      -----------------------------------------------------------      
     |                   =====================                   |     
     |                           x T B                           |     
     |                   =====================                   |     
     |                         S. Grimme                         |     
     |          Mulliken Center for Theoretical Chemistry        |     
     |                    University of Bonn                     |     
      -----------------------------------------------------------      

   * xtb version 6.2.2 (9d81278992624c895f80dd42a50cac0aa55982e2) compiled by '@Darwin' on 04/03/2020

   xtb is free software: you can redistribute it and/or modify it under
   the terms of the GNU Lesser General Public License as published by
   the Free Software Foundation, either version 3 of the License, or
   (at your option) any later version.
   
   xtb is distributed in the hope that it will be useful,
   but WITHOUT ANY WARRANTY; without even the implied warranty of
   MERCHANTABILITY or FITNESS FOR A PARTICULAR PURPOSE.  See the
   GNU Lesser General Public License for more details.
   
   Cite this work as:
   * S. Grimme, C. Bannwarth, P. Shushkov, J. Chem. Theory Comput., 2017,
     13, 1989-2009. DOI: 10.1021/acs.jctc.7b00118
   * C. Bannwarth, S. Ehlert and S. Grimme., J. Chem. Theory Comput., 2019,
     15, 1652-1671. DOI: 10.1021/acs.jctc.8b01176
   * P. Pracht, E. Caldeweyher, S. Ehlert, S. Grimme, ChemRxiv, 2019, preprint.
     DOI: 10.26434/chemrxiv.8326202.v1
   
   for DFT-D4:
   * E. Caldeweyher, C. Bannwarth and S. Grimme, J. Chem. Phys., 2017,
     147, 034112. DOI: 10.1063/1.4993215
   * E. Caldeweyher, S. Ehlert, A. Hansen, H. Neugebauer, S. Spicher,
     C. Bannwarth and S. Grimme, J. Chem. Phys., 2019, 150, 154122.
     DOI: 10.1063/1.5090222
   
   for sTDA-xTB:
   * S. Grimme and C. Bannwarth, J. Chem. Phys., 2016, 145, 054103.
     DOI: 10.1063/1.4959605
   
   in the mass-spec context:
   * V. Asgeirsson, C. Bauer and S. Grimme, Chem. Sci., 2017, 8, 4879.
     DOI: 10.1039/c7sc00601b
   
   for metadynamics refer to:
   * S. Grimme, J. Chem. Theory Comput., 2019, 155, 2847-2862
     DOI: 10.1021/acs.jctc.9b00143
   
   with help from (in alphabetical order)
   C. Bannwarth, F. Bohle, G. Brandenburg, E. Caldeweyher, M. Checinski,
   S. Dohm, S. Ehlert, S. Ehrlich, F. März, H. Neugebauer, J. Pisarek,
   P. Pracht, P. Shushkov, and S. Spicher.
   
 * started run on 2020/05/12 at 11:44:06.119     

           -------------------------------------------------
          |                Calculation Setup                |
           -------------------------------------------------

          program call               : xtb --input C4N1_19_S_1.input C4N1_19_S_1.xyz --ohess --molden --namespace C4N1_19_S_1 output.out
          calculation namespace      : C4N1_19_S_1
          coordinate file            : C4N1_19_S_1.xyz
          number of atoms            :                     5
          number of electrons        :                    21
          charge                     :                     0
          spin                       :                   0.5
          first test random number   :      0.42516108713767

   ID    Z sym.   atoms
    1    7 N      1
    2    6 C      2-5

           -------------------------------------------------
          |                 G F N 2 - x T B                 |
           -------------------------------------------------

        Reference                      10.1021/acs.jctc.8b01176
      * Hamiltonian:
        H0-scaling (s, p, d)           1.850000    2.230000    2.230000
        zeta-weighting                 0.500000
      * Dispersion:
        s8                             2.700000
        a1                             0.520000
        a2                             5.000000
        s9                             5.000000
      * Repulsion:
        kExp                           1.500000    1.000000
        rExp                           1.000000
      * Coulomb:
        alpha                          2.000000
        third order                    shell-resolved
        anisotropic                    true
        a3                             3.000000
        a5                             4.000000
        cn-shift                       1.200000
        cn-exp                         4.000000
        max-rad                        5.000000


          ...................................................
          :                      SETUP                      :
          :.................................................:
          :  # basis functions                  20          :
          :  # atomic orbitals                  20          :
          :  # shells                           10          :
          :  # electrons                        21          :
          :  max. iterations                   250          :
          :  Hamiltonian                  GFN2-xTB          :
          :  restarted?                      false          :
          :  GBSA solvation                  false          :
          :  PC potential                    false          :
          :  electronic temp.          300.0000000     K    :
          :  accuracy                    1.0000000          :
          :  -> integral cutoff          0.2500000E+02      :
          :  -> integral neglect         0.1000000E-07      :
          :  -> SCF convergence          0.1000000E-05 Eh   :
          :  -> wf. convergence          0.1000000E-03 e    :
          :  Broyden damping             0.4000000          :
          ...................................................

 iter      E             dE          RMSdq      gap      omega  full diag
   1    -10.9079975 -0.109080E+02  0.103E+01    0.84       0.0  T
   2     -9.8972273  0.101077E+01  0.114E+01    0.55       1.0  T
   3     -9.3599375  0.537290E+00  0.114E+01    0.46       1.0  T
   4    -10.7575324 -0.139759E+01  0.627E+00    0.58       1.0  T
   5    -10.9931334 -0.235601E+00  0.343E+00    0.82       1.0  T
   6    -11.0064630 -0.133296E-01  0.236E+00    0.79       1.0  T
   7    -11.0073405 -0.877513E-03  0.212E+00    0.83       1.0  T
   8    -11.0066438  0.696782E-03  0.160E+00    0.82       1.0  T
   9    -11.0090123 -0.236858E-02  0.626E-01    0.84       1.0  T
  10    -11.0115926 -0.258025E-02  0.517E-01    0.83       1.0  T
  11    -11.0115398  0.527641E-04  0.208E-01    0.84       1.0  T
  12    -11.0118205 -0.280720E-03  0.755E-02    0.83       1.0  T
  13    -11.0118496 -0.290898E-04  0.167E-02    0.83       2.7  T
  14    -11.0118512 -0.162094E-05  0.289E-03    0.83      15.5  T
  15    -11.0118512 -0.287622E-08  0.177E-03    0.83      25.2  T
  16    -11.0118513 -0.124997E-07  0.489E-04    0.83      91.4  T
  17    -11.0118513  0.669900E-10  0.295E-04    0.83     151.8  T

   *** convergence criteria satisfied after 17 iterations ***

         #    Occupation            Energy/Eh            Energy/eV
      -------------------------------------------------------------
         1        2.0000           -0.7427877             -20.2123
       ...           ...                  ...                  ...
         5        2.0000           -0.5834686             -15.8770
         6        2.0000           -0.5321255             -14.4799
         7        2.0000           -0.5189784             -14.1221
         8        2.0000           -0.4950719             -13.4716
         9        2.0000           -0.4739080             -12.8957
        10        1.9977           -0.4579130             -12.4604
        11        1.0023           -0.4463975             -12.1471 (HOMO)
        12        0.0000           -0.4158508             -11.3159 (LUMO)
        13                         -0.3702607             -10.0753
        14                         -0.3582016              -9.7472
        15                         -0.3289592              -8.9514
        16                         -0.1411565              -3.8411
       ...                                ...                  ...
        20                          0.2010849               5.4718
      -------------------------------------------------------------
                  HL-Gap            0.0305467 Eh            0.8312 eV
             Fermi-level           -0.4416397 Eh          -12.0176 eV

 SCC (total)                   0 d,  0 h,  0 min,  0.005 sec
 SCC setup                      ...        0 min,  0.000 sec (  1.730%)
 Dispersion                     ...        0 min,  0.000 sec (  0.343%)
 integral evaluation            ...        0 min,  0.001 sec ( 28.248%)
 zeroth order Hamiltonian       ...        0 min,  0.000 sec (  0.387%)
 iterations                     ...        0 min,  0.002 sec ( 41.285%)
 molecular gradient             ...        0 min,  0.001 sec ( 25.997%)
 printout                       ...        0 min,  0.000 sec (  1.807%)

         :::::::::::::::::::::::::::::::::::::::::::::::::::::
         ::                     SUMMARY                     ::
         :::::::::::::::::::::::::::::::::::::::::::::::::::::
         :: total energy             -10.940849300933 Eh    ::
         :: gradient norm              0.335589354660 Eh/a0 ::
         :: HOMO-LUMO gap              0.831217356161 eV    ::
         ::.................................................::
         :: SCC energy               -11.011851257221 Eh    ::
         :: -> isotropic ES           -0.015233986542 Eh    ::
         :: -> anisotropic ES          0.000492868867 Eh    ::
         :: -> anisotropic XC          0.013395815824 Eh    ::
         :: -> dispersion             -0.002874932872 Eh    ::
         :: repulsion energy           0.071001938383 Eh    ::
         :: add. restraining           0.000000000000 Eh    ::
         :::::::::::::::::::::::::::::::::::::::::::::::::::::

      ----------------------------------------------------------- 
     |                   =====================                   |
     |                        A N C O P T                        |
     |                   =====================                   |
     |               Approximate Normal Coordinate               |
     |                Rational Function Optimizer                |
      ----------------------------------------------------------- 

          ...................................................
          :                      SETUP                      :
          :.................................................:
          :   optimization level            normal          :
          :   max. optcycles                   200          :
          :   ANC micro-cycles                  20          :
          :   degrees of freedom                 9          :
          :.................................................:
          :   RF solver                   davidson          :
          :   write xtbopt.log                true          :
          :   linear?                        false          :
          :   energy convergence         0.5000000E-05 Eh   :
          :   grad. convergence          0.1000000E-02 Eh/α :
          :   maximium RF displ.         1.0000000          :
          :   Hlow (freq-cutoff)         0.1000000E-01      :
          :   Hmax (freq-cutoff)         5.0000000          :
          :   S6 in model hess.         20.0000000          :
          ...................................................

generating ANC from model Hessian ...
Using Lindh-Hessian (1995)
 Shifting diagonal of input Hessian by    0.0000000000000000     
 Lowest  eigenvalues of input Hessian
   -0.000000   -0.000000   -0.000000    0.000000    0.000000    0.000000
    0.010168    0.039697    0.076772    0.102079    0.690611    0.817519
    0.833136    0.977733    1.465446
 Highest eigenvalues
    0.102079    0.690611    0.817519    0.833136    0.977733    1.465446


........................................................................
.............................. CYCLE    1 ..............................
........................................................................
   1    -11.0118513 -0.110119E+02  0.867E-05    0.83       0.0  T
   2    -11.0118513  0.285020E-09  0.156E-04    0.83     285.9  T
   3    -11.0118513 -0.177748E-09  0.123E-04    0.83     362.4  T
     SCC iter.                  ...        0 min,  0.000 sec
     gradient                   ...        0 min,  0.001 sec
 * total energy  :   -10.9408493 Eh     change       -0.3562786E-09 Eh
   gradient norm :     0.3355892 Eh/α   predicted     0.0000000E+00 (-100.00%)
   displ. norm   :     0.4151419 α      lambda       -0.1269433E+00
   maximum displ.:     0.2585546 α      in ANC's #5, #6, #4, ...

........................................................................
.............................. CYCLE    2 ..............................
........................................................................
   1    -11.1606962 -0.111607E+02  0.292E+00    0.96       0.0  T
   2    -11.0265996  0.134097E+00  0.385E+00    0.87       1.0  T
   3    -11.1127505 -0.861509E-01  0.288E+00    0.89       1.0  T
   4    -11.1623957 -0.496452E-01  0.157E+00    1.01       1.0  T
   5    -11.1766920 -0.142963E-01  0.328E-01    0.94       1.0  T
   6    -11.1768490 -0.156944E-03  0.247E-01    0.94       1.0  T
   7    -11.1768326  0.163420E-04  0.198E-01    0.94       1.0  T
   8    -11.1769490 -0.116379E-03  0.509E-02    0.92       1.0  T
   9    -11.1769630 -0.140074E-04  0.871E-03    0.93       5.1  T
  10    -11.1769631 -0.101619E-06  0.229E-03    0.93      19.5  T
  11    -11.1769631 -0.264594E-08  0.864E-04    0.93      51.8  T
  12    -11.1769631 -0.186527E-08  0.214E-04    0.93     209.4  T
     SCC iter.                  ...        0 min,  0.001 sec
     gradient                   ...        0 min,  0.001 sec
 * total energy  :   -11.0457777 Eh     change       -0.1049284E+00 Eh
   gradient norm :     0.2019040 Eh/α   predicted    -0.7441051E-01 ( -29.08%)
   displ. norm   :     0.5237087 α      lambda       -0.9625706E-01
   maximum displ.:     0.3588628 α      in ANC's #5, #6, #3, ...

........................................................................
.............................. CYCLE    3 ..............................
........................................................................
   1    -11.3403720 -0.113404E+02  0.330E+00    1.47       0.0  T
   2    -11.2203928  0.119979E+00  0.390E+00    0.76       1.0  T
   3    -11.3166469 -0.962541E-01  0.264E+00    1.42       1.0  T
   4    -11.3544532 -0.378063E-01  0.130E+00    1.36       1.0  T
   5    -11.3640221 -0.956889E-02  0.379E-01    1.31       1.0  T
   6    -11.3639267  0.954542E-04  0.322E-01    1.31       1.0  T
   7    -11.3641860 -0.259298E-03  0.935E-02    1.31       1.0  T
   8    -11.3642042 -0.182028E-04  0.125E-02    1.31       3.6  T
   9    -11.3642044 -0.268428E-06  0.335E-03    1.31      13.4  T
  10    -11.3642044 -0.938190E-08  0.138E-03    1.31      32.4  T
  11    -11.3642044 -0.440478E-08  0.544E-04    1.31      82.2  T
  12    -11.3642044 -0.569329E-09  0.115E-04    1.31     387.7  T
     SCC iter.                  ...        0 min,  0.001 sec
     gradient                   ...        0 min,  0.001 sec
 * total energy  :   -11.0737218 Eh     change       -0.2794404E-01 Eh
   gradient norm :     0.3202611 Eh/α   predicted    -0.6132876E-01 ( 119.47%)
   displ. norm   :     0.4618607 α      lambda       -0.7599442E-01
   maximum displ.:     0.2790342 α      in ANC's #2, #3, #4, ...

........................................................................
.............................. CYCLE    4 ..............................
........................................................................
   1    -11.3030103 -0.113030E+02  0.185E+00    1.63       0.0  T
   2    -11.2892316  0.137788E-01  0.159E+00    1.57       1.0  T
   3    -11.2704824  0.187492E-01  0.190E+00    1.65       1.0  T
   4    -11.3018194 -0.313371E-01  0.104E+00    1.64       1.0  T
   5    -11.3073298 -0.551039E-02  0.242E-01    1.67       1.0  T
   6    -11.3074279 -0.981112E-04  0.170E-01    1.66       1.0  T
   7    -11.3074389 -0.109521E-04  0.129E-01    1.66       1.0  T
   8    -11.3074683 -0.294087E-04  0.229E-02    1.66       2.0  T
   9    -11.3074713 -0.303902E-05  0.730E-03    1.66       6.1  T
  10    -11.3074714 -0.386719E-07  0.142E-03    1.66      31.6  T
  11    -11.3074714 -0.787848E-09  0.486E-04    1.66      92.1  T
  12    -11.3074714 -0.605235E-09  0.138E-04    1.66     325.0  T
     SCC iter.                  ...        0 min,  0.001 sec
     gradient                   ...        0 min,  0.001 sec
 * total energy  :   -11.1091140 Eh     change       -0.3539224E-01 Eh
   gradient norm :     0.0797211 Eh/α   predicted    -0.4610260E-01 (  30.26%)
   displ. norm   :     0.2675239 α      lambda       -0.1032682E-01
   maximum displ.:     0.1751728 α      in ANC's #4, #1, #5, ...

........................................................................
.............................. CYCLE    5 ..............................
........................................................................
   1    -11.3020200 -0.113020E+02  0.878E-01    1.65       0.0  T
   2    -11.3009187  0.110128E-02  0.660E-01    1.70       1.0  T
   3    -11.2903260  0.105927E-01  0.103E+00    1.63       1.0  T
   4    -11.3014575 -0.111315E-01  0.321E-01    1.67       1.0  T
   5    -11.3022962 -0.838762E-03  0.551E-02    1.69       1.0  T
   6    -11.3022963 -0.292459E-07  0.446E-02    1.69       1.0  T
   7    -11.3023043 -0.799940E-05  0.186E-02    1.69       2.4  T
   8    -11.3023052 -0.936140E-06  0.814E-03    1.69       5.5  T
   9    -11.3023055 -0.351060E-06  0.298E-03    1.69      15.0  T
  10    -11.3023056 -0.192501E-07  0.298E-04    1.69     150.2  T
  11    -11.3023056 -0.861888E-11  0.109E-04    1.69     411.7  T
     SCC iter.                  ...        0 min,  0.001 sec
     gradient                   ...        0 min,  0.001 sec
 * total energy  :   -11.1150119 Eh     change       -0.5897847E-02 Eh
   gradient norm :     0.0473739 Eh/α   predicted    -0.5532948E-02 (  -6.19%)
   displ. norm   :     0.1703814 α      lambda       -0.5939569E-02
   maximum displ.:     0.1494524 α      in ANC's #5, #2, #8, ...

........................................................................
.............................. CYCLE    6 ..............................
........................................................................
   1    -11.3170289 -0.113170E+02  0.593E-01    1.83       0.0  T
   2    -11.3159306  0.109825E-02  0.483E-01    1.81       1.0  T
   3    -11.3125614  0.336929E-02  0.677E-01    1.83       1.0  T
   4    -11.3171489 -0.458753E-02  0.130E-01    1.83       1.0  T
   5    -11.3172217 -0.727996E-04  0.331E-02    1.82       1.3  T
   6    -11.3172227 -0.100468E-05  0.217E-02    1.82       2.1  T
   7    -11.3172234 -0.693809E-06  0.515E-03    1.82       8.7  T
   8    -11.3172234 -0.624951E-07  0.274E-03    1.82      16.3  T
   9    -11.3172235 -0.455922E-07  0.154E-03    1.82      29.0  T
  10    -11.3172235 -0.481299E-08  0.158E-04    1.82     282.5  T
  11    -11.3172235 -0.270699E-10  0.261E-05    1.82    1712.9  T
     SCC iter.                  ...        0 min,  0.001 sec
     gradient                   ...        0 min,  0.001 sec
 * total energy  :   -11.1184218 Eh     change       -0.3409947E-02 Eh
   gradient norm :     0.0395468 Eh/α   predicted    -0.3055997E-02 ( -10.38%)
   displ. norm   :     0.1464622 α      lambda       -0.1785237E-02
   maximum displ.:     0.1260943 α      in ANC's #1, #5, #9, ...

........................................................................
.............................. CYCLE    7 ..............................
........................................................................
   1    -11.3245640 -0.113246E+02  0.563E-01    1.91       0.0  T
   2    -11.3186067  0.595729E-02  0.800E-01    1.87       1.0  T
   3    -11.3236795 -0.507274E-02  0.477E-01    1.90       1.0  T
   4    -11.3251859 -0.150648E-02  0.145E-01    1.91       1.0  T
   5    -11.3252821 -0.961524E-04  0.335E-02    1.89       1.3  T
   6    -11.3252859 -0.377539E-05  0.224E-02    1.90       2.0  T
   7    -11.3252867 -0.877355E-06  0.132E-02    1.90       3.4  T
   8    -11.3252878 -0.110327E-05  0.259E-03    1.90      17.3  T
   9    -11.3252879 -0.208349E-07  0.130E-03    1.90      34.4  T
  10    -11.3252879 -0.603668E-08  0.193E-04    1.90     231.6  T
  11    -11.3252879 -0.594760E-10  0.962E-05    1.90     464.9  T
     SCC iter.                  ...        0 min,  0.001 sec
     gradient                   ...        0 min,  0.001 sec
 * total energy  :   -11.1194195 Eh     change       -0.9976473E-03 Eh
   gradient norm :     0.0098760 Eh/α   predicted    -0.9117648E-03 (  -8.61%)
   displ. norm   :     0.0853357 α      lambda       -0.3656900E-03
   maximum displ.:     0.0595166 α      in ANC's #1, #3, #2, ...

........................................................................
.............................. CYCLE    8 ..............................
........................................................................
   1    -11.3297624 -0.113298E+02  0.256E-01    1.91       0.0  T
   2    -11.3296768  0.856747E-04  0.176E-01    1.90       1.0  T
   3    -11.3287504  0.926416E-03  0.332E-01    1.92       1.0  T
   4    -11.3297410 -0.990621E-03  0.687E-02    1.91       1.0  T
   5    -11.3297820 -0.409844E-04  0.182E-02    1.91       2.5  T
   6    -11.3297837 -0.171636E-05  0.875E-03    1.91       5.1  T
   7    -11.3297840 -0.278434E-06  0.209E-03    1.91      21.4  T
   8    -11.3297840 -0.253579E-07  0.863E-04    1.91      51.8  T
   9    -11.3297840 -0.270723E-08  0.453E-04    1.91      98.7  T
     SCC iter.                  ...        0 min,  0.001 sec
     gradient                   ...        0 min,  0.001 sec
 * total energy  :   -11.1196207 Eh     change       -0.2012444E-03 Eh
   gradient norm :     0.0090726 Eh/α   predicted    -0.1841776E-03 (  -8.48%)
   displ. norm   :     0.0607341 α      lambda       -0.1747467E-03
   maximum displ.:     0.0507542 α      in ANC's #2, #1, #5, ...

........................................................................
.............................. CYCLE    9 ..............................
........................................................................
   1    -11.3282326 -0.113282E+02  0.222E-01    1.95       0.0  T
   2    -11.3280008  0.231824E-03  0.210E-01    1.94       1.0  T
   3    -11.3278360  0.164776E-03  0.218E-01    1.95       1.0  T
   4    -11.3282376 -0.401640E-03  0.702E-02    1.95       1.0  T
   5    -11.3282690 -0.313403E-04  0.139E-02    1.95       3.2  T
   6    -11.3282695 -0.502713E-06  0.873E-03    1.95       5.1  T
   7    -11.3282698 -0.271883E-06  0.190E-03    1.95      23.5  T
   8    -11.3282698 -0.226409E-07  0.576E-04    1.95      77.7  T
   9    -11.3282698 -0.990543E-09  0.316E-04    1.95     141.4  T
     SCC iter.                  ...        0 min,  0.001 sec
     gradient                   ...        0 min,  0.001 sec
 * total energy  :   -11.1195906 Eh     change        0.3009749E-04 Eh
   gradient norm :     0.0111487 Eh/α   predicted    -0.8769495E-04 (-391.37%)
   displ. norm   :     0.0396995 α      lambda       -0.1703718E-03
   maximum displ.:     0.0279396 α      in ANC's #2, #1, #5, ...

........................................................................
.............................. CYCLE   10 ..............................
........................................................................
   1    -11.3289639 -0.113290E+02  0.168E-01    1.93       0.0  T
   2    -11.3289606  0.326743E-05  0.947E-02    1.93       1.0  T
   3    -11.3287208  0.239799E-03  0.157E-01    1.93       1.0  T
   4    -11.3289648 -0.243982E-03  0.189E-02    1.93       2.4  T
   5    -11.3289665 -0.167290E-05  0.863E-03    1.93       5.2  T
   6    -11.3289665 -0.374056E-07  0.583E-03    1.93       7.7  T
   7    -11.3289667 -0.135558E-06  0.909E-04    1.93      49.2  T
   8    -11.3289667  0.215085E-09  0.761E-04    1.93      58.7  T
     SCC iter.                  ...        0 min,  0.001 sec
     gradient                   ...        0 min,  0.001 sec
 * total energy  :   -11.1196796 Eh     change       -0.8896318E-04 Eh
   gradient norm :     0.0021547 Eh/α   predicted    -0.8532059E-04 (  -4.09%)
   displ. norm   :     0.0105558 α      lambda       -0.9832861E-05
   maximum displ.:     0.0077895 α      in ANC's #1, #2, #3, ...

........................................................................
.............................. CYCLE   11 ..............................
........................................................................
   1    -11.3299243 -0.113299E+02  0.485E-02    1.94       0.0  T
   2    -11.3299240  0.310204E-06  0.327E-02    1.93       1.4  T
   3    -11.3299111  0.129071E-04  0.392E-02    1.94       1.1  T
   4    -11.3299184 -0.733807E-05  0.256E-02    1.93       1.7  T
   5    -11.3299248 -0.638861E-05  0.256E-03    1.93      17.4  T
   6    -11.3299248  0.942984E-08  0.168E-03    1.93      26.6  T
   7    -11.3299248 -0.118955E-07  0.319E-04    1.93     140.2  T
   8    -11.3299248 -0.120968E-09  0.187E-04    1.93     239.7  T
     SCC iter.                  ...        0 min,  0.001 sec
     gradient                   ...        0 min,  0.001 sec
 * total energy  :   -11.1196833 Eh     change       -0.3765698E-05 Eh
   gradient norm :     0.0024308 Eh/α   predicted    -0.4917418E-05 (  30.58%)
   displ. norm   :     0.0148748 α      lambda       -0.7930469E-05
   maximum displ.:     0.0136315 α      in ANC's #1, #3, #2, ...

........................................................................
.............................. CYCLE   12 ..............................
........................................................................
   1    -11.3291776 -0.113292E+02  0.605E-02    1.93       0.0  T
   2    -11.3291763  0.132936E-05  0.349E-02    1.93       1.3  T
   3    -11.3291356  0.407284E-04  0.700E-02    1.93       1.0  T
   4    -11.3291763 -0.407077E-04  0.166E-02    1.93       2.7  T
   5    -11.3291784 -0.208003E-05  0.314E-03    1.93      14.2  T
   6    -11.3291784 -0.129166E-07  0.178E-03    1.93      25.1  T
   7    -11.3291784 -0.673925E-08  0.844E-04    1.93      53.0  T
   8    -11.3291784 -0.351054E-08  0.226E-04    1.93     198.2  T
     SCC iter.                  ...        0 min,  0.001 sec
     gradient                   ...        0 min,  0.001 sec
 * total energy  :   -11.1196881 Eh     change       -0.4796595E-05 Eh
   gradient norm :     0.0012506 Eh/α   predicted    -0.3967830E-05 ( -17.28%)
   displ. norm   :     0.0049259 α      lambda       -0.2261861E-05
   maximum displ.:     0.0031990 α      in ANC's #2, #7, #6, ...

........................................................................
.............................. CYCLE   13 ..............................
........................................................................
   1    -11.3289748 -0.113290E+02  0.273E-02    1.93       0.0  T
   2    -11.3289734  0.147572E-05  0.209E-02    1.93       2.1  T
   3    -11.3289686  0.476944E-05  0.285E-02    1.93       1.6  T
   4    -11.3289743 -0.574378E-05  0.124E-02    1.93       3.6  T
   5    -11.3289755 -0.114549E-05  0.212E-03    1.93      21.1  T
   6    -11.3289755 -0.571788E-08  0.119E-03    1.93      37.6  T
   7    -11.3289755 -0.632070E-08  0.439E-04    1.93     101.8  T
   8    -11.3289755 -0.822878E-09  0.137E-04    1.93     327.3  T
     SCC iter.                  ...        0 min,  0.001 sec
     gradient                   ...        0 min,  0.001 sec
 * total energy  :   -11.1196891 Eh     change       -0.1011376E-05 Eh
   gradient norm :     0.0008981 Eh/α   predicted    -0.1129807E-05 (  11.71%)
   displ. norm   :     0.0046355 α      lambda       -0.6665686E-06
   maximum displ.:     0.0042459 α      in ANC's #1, #4, #3, ...

   *** GEOMETRY OPTIMIZATION CONVERGED AFTER 13 ITERATIONS ***

------------------------------------------------------------------------
 total energy gain   :        -0.1788398 Eh     -112.2237 kcal/mol
 total RMSD          :         0.7008041 a0        0.3708 Å
 total power (kW/mol):       -36.1187639 (step)-9567.2555 (real)
------------------------------------------------------------------------

 ANCopt (total)                0 d,  0 h,  0 min,  0.049 sec
 optimizer setup                ...        0 min,  0.000 sec (  0.118%)
 model hessian                  ...        0 min,  0.000 sec (  0.167%)
 ANC generation                 ...        0 min,  0.000 sec (  0.096%)
 coordinate transformation      ...        0 min,  0.000 sec (  0.053%)
 single point calculation       ...        0 min,  0.048 sec ( 97.682%)
 optimization log               ...        0 min,  0.000 sec (  0.621%)
 hessian update                 ...        0 min,  0.000 sec (  0.052%)
 rational function              ...        0 min,  0.000 sec (  0.520%)

================
 final structure:
================
5
 xtb: 6.2.2 (9d81278992624c895f80dd42a50cac0aa55982e2)
N        -1.40028248777102    0.35998074218024   -0.58895065388571
C        -0.27309304310204   -0.08161911733605   -0.02811606865107
C         1.01336022792861    0.04502111488636    0.24644530897832
C        -1.53240817813145   -0.79358834447531    0.04698836001043
C         2.19242248107589    0.47020560474477    0.32363305354802

 Bond Distances (Angstroems)
 ---------------------------
N1-C2=1.3342         N1-C4=1.3239         C2-N1=1.3342         C2-C3=1.3215         C2-C4=1.4486         C3-C2=1.3215         
C3-C5=1.2558         C4-N1=1.3239         C4-C2=1.4486         C5-C3=1.2558         
 C  C  Rav=1.3420 sigma=0.0800  Rmin=1.2558  Rmax=1.4486     3
 N  C  Rav=1.3290 sigma=0.0052  Rmin=1.3239  Rmax=1.3342     2

 selected bond angles (degree)
 --------------------
C4-N1-C2= 66.05                C3-C2-N1=151.41                C4-C2-N1= 56.63                C4-C2-C3=151.96                
C5-C3-C2=163.58                C2-C4-N1= 57.32                

 selected dihedral angles (degree)
 ---------------------------------
C3-C2-N1-C4=180.12            C5-C3-C2-N1=  0.64            C5-C3-C2-C4=180.86            N1-C4-C2-C3=179.88            
           -------------------------------------------------
          |                Final Singlepoint                |
           -------------------------------------------------

          ...................................................
          :                      SETUP                      :
          :.................................................:
          :  # basis functions                  20          :
          :  # atomic orbitals                  20          :
          :  # shells                           10          :
          :  # electrons                        21          :
          :  max. iterations                   250          :
          :  Hamiltonian                  GFN2-xTB          :
          :  restarted?                      false          :
          :  GBSA solvation                  false          :
          :  PC potential                    false          :
          :  electronic temp.          300.0000000     K    :
          :  accuracy                    1.0000000          :
          :  -> integral cutoff          0.2500000E+02      :
          :  -> integral neglect         0.1000000E-07      :
          :  -> SCF convergence          0.1000000E-05 Eh   :
          :  -> wf. convergence          0.1000000E-03 e    :
          :  Broyden damping             0.4000000          :
          ...................................................

 iter      E             dE          RMSdq      gap      omega  full diag
   1    -11.3289755 -0.113290E+02  0.269E-05    1.93       0.0  T
   2    -11.3289755  0.831157E-11  0.342E-05    1.93    1309.2  T
   3    -11.3289755 -0.716938E-11  0.191E-05    1.93    2341.0  T

   *** convergence criteria satisfied after 3 iterations ***

         #    Occupation            Energy/Eh            Energy/eV
      -------------------------------------------------------------
         1        2.0000           -0.7579388             -20.6246
       ...           ...                  ...                  ...
         5        2.0000           -0.5911194             -16.0852
         6        2.0000           -0.5683420             -15.4654
         7        2.0000           -0.4993158             -13.5871
         8        2.0000           -0.4866063             -13.2412
         9        2.0000           -0.4603039             -12.5255
        10        2.0000           -0.4539014             -12.3513
        11        1.0000           -0.4299542             -11.6997 (HOMO)
        12                         -0.3589210              -9.7667 (LUMO)
        13                         -0.3269488              -8.8967
        14                         -0.2516903              -6.8488
        15                         -0.1678962              -4.5687
        16                         -0.0426973              -1.1619
       ...                                ...                  ...
        20                          1.1031131              30.0172
      -------------------------------------------------------------
                  HL-Gap            0.0710332 Eh            1.9329 eV
             Fermi-level           -0.4181825 Eh          -11.3793 eV

 SCC (total)                   0 d,  0 h,  0 min,  0.003 sec
 SCC setup                      ...        0 min,  0.000 sec (  1.502%)
 Dispersion                     ...        0 min,  0.000 sec (  0.230%)
 integral evaluation            ...        0 min,  0.001 sec ( 37.559%)
 zeroth order Hamiltonian       ...        0 min,  0.000 sec (  0.469%)
 iterations                     ...        0 min,  0.000 sec ( 13.630%)
 molecular gradient             ...        0 min,  0.001 sec ( 44.409%)
 printout                       ...        0 min,  0.000 sec (  2.003%)

         :::::::::::::::::::::::::::::::::::::::::::::::::::::
         ::                     SUMMARY                     ::
         :::::::::::::::::::::::::::::::::::::::::::::::::::::
         :: total energy             -11.119689139135 Eh    ::
         :: gradient norm              0.000907241542 Eh/a0 ::
         :: HOMO-LUMO gap              1.932912666566 eV    ::
         ::.................................................::
         :: SCC energy               -11.328975493924 Eh    ::
         :: -> isotropic ES           -0.006746381345 Eh    ::
         :: -> anisotropic ES          0.002907596458 Eh    ::
         :: -> anisotropic XC          0.015620806482 Eh    ::
         :: -> dispersion             -0.002788725332 Eh    ::
         :: repulsion energy           0.209286460509 Eh    ::
         :: add. restraining           0.000000000000 Eh    ::
         :::::::::::::::::::::::::::::::::::::::::::::::::::::

           ------------------------------------------------- 
          |                Numerical Hessian                |
           ------------------------------------------------- 
step length          :   0.00500
SCC accuracy         :   0.30000
Hessian scale factor :   1.00000
frozen atoms in %    :   0.00000    0
RMS gradient         :   0.00091
estimated CPU  time      0.00 min
estimated wall time      0.00 min

writing file <hessian>.

 projected vibrational frequencies (cm-1)
eigval :       -0.00    -0.00     0.00     0.00     0.00     0.00
eigval :      155.85   176.16   428.90   491.42   737.39   856.87
eigval :     1227.08  1705.35  1841.36
           -------------------------------------------------
          |                Property Printout                |
           -------------------------------------------------

    * Orbital Energies and Occupations

         #    Occupation            Energy/Eh            Energy/eV
      -------------------------------------------------------------
         1        2.0000           -0.7579392             -20.6246
         2        2.0000           -0.6897783             -18.7698
         3        2.0000           -0.6488446             -17.6560
         4        2.0000           -0.6207586             -16.8917
         5        2.0000           -0.5911198             -16.0852
         6        2.0000           -0.5683424             -15.4654
         7        2.0000           -0.4993158             -13.5871
         8        2.0000           -0.4866062             -13.2412
         9        2.0000           -0.4603042             -12.5255
        10        2.0000           -0.4539009             -12.3513
        11        1.0000           -0.4299540             -11.6996 (HOMO)
        12                         -0.3589209              -9.7667 (LUMO)
        13                         -0.3269491              -8.8967
        14                         -0.2516899              -6.8488
        15                         -0.1678962              -4.5687
        16                         -0.0426976              -1.1619
        17                          0.0904594               2.4615
        18                          0.3007444               8.1837
        19                          0.5167064              14.0603
        20                          1.1031130              30.0172
      -------------------------------------------------------------
                  HL-Gap            0.0710331 Eh            1.9329 eV
             Fermi-level           -0.4181822 Eh          -11.3793 eV

     #   Z        covCN         q      C6AA      α(0)
     1   7 N      1.821    -0.078    23.504     7.183
     2   6 C      2.872     0.201    23.726     7.985
     3   6 C      1.962     0.019    30.575     8.930
     4   6 C      1.889    -0.046    32.369     9.189
     5   6 C      0.983    -0.096    38.965    10.485

 Mol. C6AA /au·bohr⁶  :        737.534644
 Mol. C8AA /au·bohr⁸  :      20380.602130
 Mol. α(0) /au        :         43.771897


Wiberg/Mayer (AO) data.
largest (>0.10) Wiberg bond orders for each atom
          total WBO             WBO to atom ...
     1  N   2.997        C    4 1.536    C    2 1.240    C    5 0.139
     2  C   3.765        C    3 1.469    N    1 1.240    C    4 0.902    C    5 0.153
     3  C   3.827        C    5 2.209    C    2 1.469
     4  C   2.572        N    1 1.536    C    2 0.902
     5  C   2.569        C    3 2.209    C    2 0.153    N    1 0.139

MOs/occ written to file <molden.input>


molecular dipole:
                 x           y           z       tot (Debye)
 q only:       -0.122      -0.098       0.023
   full:       -0.276      -0.098      -0.021       0.747
molecular quadrupole (traceless):
                xx          xy          yy          xz          yz          zz
 q only:       -2.289      -0.591       1.083      -0.659       0.024       1.207
  q+dip:       -3.249      -2.233       0.810      -0.369       0.607       2.440
   full:       -5.756      -3.521       1.254      -1.084       1.670       4.502

           -------------------------------------------------
          |                Geometry Summary                 |
           -------------------------------------------------

      molecular mass/u    :       62.0496468
   center of mass at/Å    :       -0.0450435       0.0115798      -0.0189448
  moments of inertia/u·Å² :        0.1163127E+02   0.1338638E+03   0.1454948E+03
rotational constants/cm⁻¹ :        0.1449338E+01   0.1259312E+00   0.1158641E+00

 * 3 selected distances

     #   Z        #   Z                                     value/Å
     1   7 N      2   6 C                                 1.3342046 (max)
     2   6 C      3   6 C                                 1.3215081
     3   6 C      5   6 C                                 1.2557578 (min)

 * 2 distinct bonds (by element types)

   Z      Z             #   av. dist./Å        max./Å        min./Å
   6 C    6 C           2     1.2886329     1.3215081     1.2557578
   6 C    7 N           1     1.3342046     1.3342046     1.3342046

           -------------------------------------------------
          |               Frequency Printout                |
           -------------------------------------------------
 projected vibrational frequencies (cm-1)
eigval :       -0.00    -0.00     0.00     0.00     0.00     0.00
eigval :      155.85   176.16   428.90   491.42   737.39   856.87
eigval :     1227.08  1705.35  1841.36
 reduced masses (amu)
   1: 12.89   2: 12.72   3: 13.13   4: 12.20   5: 12.28   6: 12.08   7: 12.35   8: 12.03
   9: 12.09  10: 12.08  11: 12.21  12: 13.00  13: 12.48  14: 12.16  15: 12.44
 IR intensities (amu)
   1:  0.06   2:  0.03   3:  0.03   4:  0.05   5:  0.07   6:  0.03   7:  0.63   8:  0.41
   9:  0.69  10:  0.42  11:  0.70  12:  0.80  13:  1.25  14:  1.81  15:  0.47
 Raman intensities (amu)
   1:  0.00   2:  0.00   3:  0.00   4:  0.00   5:  0.00   6:  0.00   7:  0.00   8:  0.00
   9:  0.00  10:  0.00  11:  0.00  12:  0.00  13:  0.00  14:  0.00  15:  0.00
Molecule has the following symmetry elements: (sigma) 
It seems to be the Cs point group
 output can be read by thermo (or use thermo option).
 writing <g98.out> molden fake output.
 recommended (thermochemical) frequency scaling factor: 1.0
           -------------------------------------------------
          |             Thermodynamic Functions             |
           -------------------------------------------------

cs  symmetry found (for desy threshold:  0.10E+00) used in thermo

          ...................................................
          :                      SETUP                      :
          :.................................................:
          :  # frequencies                           9      :
          :  # imaginary freq.                       0      :
          :  linear?                             false      :
          :  only rotor calc.                    false      :
          :  symmetry                               cs      :
          :  rotational number                       1      :
          :  scaling factor                  1.0000000      :
          :  rotor cutoff                   50.0000000 cm⁻¹ :
          :  imag. cutoff                  -20.0000000 cm⁻¹ :
          :.................................................:

    mode    ω/cm⁻¹     T·S(HO)/kcal·mol⁻¹    T·S(FR)/kcal·mol⁻¹   T·S(vib)
   ------------------------------------------------------------------------
       1    155.85    -0.00000 ( 98.95%)     0.00960 (  1.05%)     0.00010
       2    176.16    -0.00000 ( 99.36%)     0.01082 (  0.64%)     0.00007
   ------------------------------------------------------------------------

   temp. (K)  partition function   enthalpy   heat capacity  entropy
                                   cal/mol     cal/K/mol   cal/K/mol   J/K/mol
 298.15  VIB   4.38                 1208.208      8.011      6.983
         ROT  0.364E+05              888.752      2.981     23.849
         INT  0.159E+06             2096.960     10.992     30.833
         TR   0.473E+27             1481.254      4.968     38.278
         TOT                        3578.2144    15.9599    69.1110   289.1603

   temp. (K)  partition function   enthalpy   heat capacity  entropy
                                   cal/mol     cal/K/mol   cal/K/mol   J/K/mol
 120.00  VIB   1.36                  162.137      3.418      1.967
         ROT  0.928E+04              357.707      2.981     21.137
         INT  0.126E+05              519.844      6.399     23.103
         TR   0.121E+27              596.178      4.968     33.759
         TOT                        1116.0223    11.3668    56.8623   237.9117

   temp. (K)  partition function   enthalpy   heat capacity  entropy
                                   cal/mol     cal/K/mol   cal/K/mol   J/K/mol
 100.00  VIB   1.22                  100.158      2.773      1.405
         ROT  0.706E+04              298.089      2.981     20.593
         INT  0.861E+04              398.247      5.754     21.998
         TR   0.919E+26              496.815      4.968     32.853
         TOT                         895.0622    10.7219    54.8513   229.4979

   temp. (K)  partition function   enthalpy   heat capacity  entropy
                                   cal/mol     cal/K/mol   cal/K/mol   J/K/mol
  80.00  VIB   1.11                   51.644      2.064      0.867
         ROT  0.505E+04              238.471      2.981     19.928
         INT  0.562E+04              290.115      5.044     20.795
         TR   0.657E+26              397.452      4.968     31.745
         TOT                         687.5675    10.0126    52.5403   219.8284

   temp. (K)  partition function   enthalpy   heat capacity  entropy
                                   cal/mol     cal/K/mol   cal/K/mol   J/K/mol
  60.00  VIB   1.04                   18.408      1.238      0.394
         ROT  0.328E+04              178.853      2.981     19.070
         INT  0.341E+04              197.261      4.219     19.464
         TR   0.427E+26              298.089      4.968     30.317
         TOT                         495.3500     9.1867    49.7809   208.2831

   temp. (K)  partition function   enthalpy   heat capacity  entropy
                                   cal/mol     cal/K/mol   cal/K/mol   J/K/mol
  40.00  VIB   1.01                    2.538      0.373      0.080
         ROT  0.179E+04              119.236      2.981     17.862
         INT  0.180E+04              121.774      3.354     17.941
         TR   0.232E+26              198.726      4.968     28.303
         TOT                         320.4996     8.3222    46.2447   193.4880

   temp. (K)  partition function   enthalpy   heat capacity  entropy
                                   cal/mol     cal/K/mol   cal/K/mol   J/K/mol
  20.00  VIB   1.00                    0.008      0.004     -0.005
         ROT   632.                   59.618      2.981     15.796
         INT   632.                   59.625      2.985     15.790
         TR   0.822E+25               99.363      4.968     24.861
         TOT                         158.9884     7.9534    40.6515   170.0858

   temp. (K)  partition function   enthalpy   heat capacity  entropy
                                   cal/mol     cal/K/mol   cal/K/mol   J/K/mol
  10.00  VIB   1.00                    0.000      0.000     -0.018
         ROT   223.                   29.809      2.981     13.729
         INT   223.                   29.809      2.981     13.712
         TR   0.290E+25               49.681      4.968     21.419
         TOT                          79.4904     7.9490    35.1310   146.9882

       T/K    H(0)-H(T)+PV         H(T)/Eh          T*S/Eh         G(T)/Eh
   ------------------------------------------------------------------------
    298.15    0.570225E-02    0.230628E-01    0.328368E-01   -0.977409E-02
    120.00    0.177849E-02    0.191390E-01    0.108739E-01    0.826511E-02
    100.00    0.142637E-02    0.187869E-01    0.874111E-02    0.100458E-01
     80.00    0.109571E-02    0.184562E-01    0.669826E-02    0.117580E-01
     60.00    0.789390E-03    0.181499E-01    0.475985E-02    0.133900E-01
     40.00    0.510749E-03    0.178713E-01    0.294783E-02    0.149234E-01
     20.00    0.253364E-03    0.176139E-01    0.129565E-02    0.163182E-01
     10.00    0.126676E-03    0.174872E-01    0.559848E-03    0.169273E-01 (used)
   ------------------------------------------------------------------------

         :::::::::::::::::::::::::::::::::::::::::::::::::::::
         ::                  THERMODYNAMIC                  ::
         :::::::::::::::::::::::::::::::::::::::::::::::::::::
         :: total free energy         -11.102761803553 Eh   ::
         ::.................................................::
         :: total energy              -11.119689138736 Eh   ::
         :: zero point energy           0.017360507500 Eh   ::
         :: G(RRHO) w/o ZPVE           -0.000433172317 Eh   ::
         :: G(RRHO) contrib.            0.016927335183 Eh   ::
         :::::::::::::::::::::::::::::::::::::::::::::::::::::

optimized geometry written to: xtbopt.xyz


           -------------------------------------------------
          | TOTAL ENERGY              -11.119689138736 Eh   |
          | TOTAL ENTHALPY            -11.102201955220 Eh   |
          | TOTAL FREE ENERGY         -11.102761803553 Eh   |
          | GRADIENT NORM               0.000907953078 Eh/α |
          | HOMO-LUMO GAP               1.932909875931 eV   |
           -------------------------------------------------

------------------------------------------------------------------------
 * finished run on 2020/05/12 at 11:44:06.295     
------------------------------------------------------------------------
 total:
 * wall-time:     0 d,  0 h,  0 min,  0.175 sec
 *  cpu-time:     0 d,  0 h,  0 min,  0.175 sec
 * ratio c/w:     0.999 speedup
 SCF:
 * wall-time:     0 d,  0 h,  0 min,  0.005 sec
 *  cpu-time:     0 d,  0 h,  0 min,  0.005 sec
 * ratio c/w:     1.000 speedup
 ANC optimizer:
 * wall-time:     0 d,  0 h,  0 min,  0.053 sec
 *  cpu-time:     0 d,  0 h,  0 min,  0.053 sec
 * ratio c/w:     0.999 speedup
 numerical hessian:
 * wall-time:     0 d,  0 h,  0 min,  0.101 sec
 *  cpu-time:     0 d,  0 h,  0 min,  0.101 sec
 * ratio c/w:     0.999 speedup

