      -----------------------------------------------------------      
     |                   =====================                   |     
     |                           x T B                           |     
     |                   =====================                   |     
     |                         S. Grimme                         |     
     |          Mulliken Center for Theoretical Chemistry        |     
     |                    University of Bonn                     |     
      -----------------------------------------------------------      

   * xtb version 6.2.2 (9d81278992624c895f80dd42a50cac0aa55982e2) compiled by '@Darwin' on 04/03/2020

   xtb is free software: you can redistribute it and/or modify it under
   the terms of the GNU Lesser General Public License as published by
   the Free Software Foundation, either version 3 of the License, or
   (at your option) any later version.
   
   xtb is distributed in the hope that it will be useful,
   but WITHOUT ANY WARRANTY; without even the implied warranty of
   MERCHANTABILITY or FITNESS FOR A PARTICULAR PURPOSE.  See the
   GNU Lesser General Public License for more details.
   
   Cite this work as:
   * S. Grimme, C. Bannwarth, P. Shushkov, J. Chem. Theory Comput., 2017,
     13, 1989-2009. DOI: 10.1021/acs.jctc.7b00118
   * C. Bannwarth, S. Ehlert and S. Grimme., J. Chem. Theory Comput., 2019,
     15, 1652-1671. DOI: 10.1021/acs.jctc.8b01176
   * P. Pracht, E. Caldeweyher, S. Ehlert, S. Grimme, ChemRxiv, 2019, preprint.
     DOI: 10.26434/chemrxiv.8326202.v1
   
   for DFT-D4:
   * E. Caldeweyher, C. Bannwarth and S. Grimme, J. Chem. Phys., 2017,
     147, 034112. DOI: 10.1063/1.4993215
   * E. Caldeweyher, S. Ehlert, A. Hansen, H. Neugebauer, S. Spicher,
     C. Bannwarth and S. Grimme, J. Chem. Phys., 2019, 150, 154122.
     DOI: 10.1063/1.5090222
   
   for sTDA-xTB:
   * S. Grimme and C. Bannwarth, J. Chem. Phys., 2016, 145, 054103.
     DOI: 10.1063/1.4959605
   
   in the mass-spec context:
   * V. Asgeirsson, C. Bauer and S. Grimme, Chem. Sci., 2017, 8, 4879.
     DOI: 10.1039/c7sc00601b
   
   for metadynamics refer to:
   * S. Grimme, J. Chem. Theory Comput., 2019, 155, 2847-2862
     DOI: 10.1021/acs.jctc.9b00143
   
   with help from (in alphabetical order)
   C. Bannwarth, F. Bohle, G. Brandenburg, E. Caldeweyher, M. Checinski,
   S. Dohm, S. Ehlert, S. Ehrlich, F. März, H. Neugebauer, J. Pisarek,
   P. Pracht, P. Shushkov, and S. Spicher.
   
 * started run on 2020/05/12 at 11:45:06.201     

           -------------------------------------------------
          |                Calculation Setup                |
           -------------------------------------------------

          program call               : xtb --input C3N1_8_S_1.input C3N1_8_S_1.xyz --ohess --molden --namespace C3N1_8_S_1 output.out
          calculation namespace      : C3N1_8_S_1
          coordinate file            : C3N1_8_S_1.xyz
          number of atoms            :                     4
          number of electrons        :                    17
          charge                     :                     0
          spin                       :                   0.5
          first test random number   :      0.58324494492126

   ID    Z sym.   atoms
    1    6 C      1-3
    2    7 N      4

           -------------------------------------------------
          |                 G F N 2 - x T B                 |
           -------------------------------------------------

        Reference                      10.1021/acs.jctc.8b01176
      * Hamiltonian:
        H0-scaling (s, p, d)           1.850000    2.230000    2.230000
        zeta-weighting                 0.500000
      * Dispersion:
        s8                             2.700000
        a1                             0.520000
        a2                             5.000000
        s9                             5.000000
      * Repulsion:
        kExp                           1.500000    1.000000
        rExp                           1.000000
      * Coulomb:
        alpha                          2.000000
        third order                    shell-resolved
        anisotropic                    true
        a3                             3.000000
        a5                             4.000000
        cn-shift                       1.200000
        cn-exp                         4.000000
        max-rad                        5.000000


          ...................................................
          :                      SETUP                      :
          :.................................................:
          :  # basis functions                  16          :
          :  # atomic orbitals                  16          :
          :  # shells                            8          :
          :  # electrons                        17          :
          :  max. iterations                   250          :
          :  Hamiltonian                  GFN2-xTB          :
          :  restarted?                      false          :
          :  GBSA solvation                  false          :
          :  PC potential                    false          :
          :  electronic temp.          300.0000000     K    :
          :  accuracy                    1.0000000          :
          :  -> integral cutoff          0.2500000E+02      :
          :  -> integral neglect         0.1000000E-07      :
          :  -> SCF convergence          0.1000000E-05 Eh   :
          :  -> wf. convergence          0.1000000E-03 e    :
          :  Broyden damping             0.4000000          :
          ...................................................

 iter      E             dE          RMSdq      gap      omega  full diag
   1     -8.9866118 -0.898661E+01  0.108E+01    0.58       0.0  T
   2     -8.9899695 -0.335772E-02  0.717E+00    0.58       1.0  T
   3     -8.9412138  0.487558E-01  0.484E+00    0.82       1.0  T
   4     -9.0105602 -0.693464E-01  0.136E+00    0.21       1.0  T
   5     -9.0189835 -0.842336E-02  0.480E-01    0.51       1.0  T
   6     -9.0189836 -0.357755E-07  0.183E-01    0.54       1.0  T
   7     -9.0190130 -0.294797E-04  0.494E-02    0.54       1.0  T
   8     -9.0190136 -0.574450E-06  0.183E-02    0.53       2.7  T
   9     -9.0190143 -0.645655E-06  0.109E-02    0.53       4.6  T
  10     -9.0190147 -0.395384E-06  0.594E-03    0.53       8.4  T
  11     -9.0190148 -0.115814E-06  0.107E-03    0.53      46.9  T
  12     -9.0190148 -0.255546E-08  0.158E-04    0.53     315.6  T
  13     -9.0190148  0.133333E-10  0.119E-04    0.53     421.7  T

   *** convergence criteria satisfied after 13 iterations ***

         #    Occupation            Energy/Eh            Energy/eV
      -------------------------------------------------------------
         1        2.0000           -0.7698127             -20.9477
       ...           ...                  ...                  ...
         3        2.0000           -0.6170285             -16.7902
         4        2.0000           -0.5980885             -16.2748
         5        2.0000           -0.5392730             -14.6744
         6        2.0000           -0.5234680             -14.2443
         7        2.0000           -0.4904170             -13.3449
         8        2.0000           -0.4771021             -12.9826
         9        1.0000           -0.4208176             -11.4510 (HOMO)
        10        0.0000           -0.4012537             -10.9187 (LUMO)
        11                         -0.3286714              -8.9436
        12                         -0.2502027              -6.8084
        13                         -0.0495793              -1.3491
        14                         -0.0164230              -0.4469
       ...                                ...                  ...
        16                          0.1961804               5.3383
      -------------------------------------------------------------
                  HL-Gap            0.0195639 Eh            0.5324 eV
             Fermi-level           -0.4299978 Eh          -11.7008 eV

 SCC (total)                   0 d,  0 h,  0 min,  0.004 sec
 SCC setup                      ...        0 min,  0.000 sec (  2.301%)
 Dispersion                     ...        0 min,  0.000 sec (  0.401%)
 integral evaluation            ...        0 min,  0.001 sec ( 28.382%)
 zeroth order Hamiltonian       ...        0 min,  0.000 sec (  0.550%)
 iterations                     ...        0 min,  0.001 sec ( 37.866%)
 molecular gradient             ...        0 min,  0.001 sec ( 28.280%)
 printout                       ...        0 min,  0.000 sec (  1.908%)

         :::::::::::::::::::::::::::::::::::::::::::::::::::::
         ::                     SUMMARY                     ::
         :::::::::::::::::::::::::::::::::::::::::::::::::::::
         :: total energy              -8.947660468359 Eh    ::
         :: gradient norm              0.122565170112 Eh/a0 ::
         :: HOMO-LUMO gap              0.532361387535 eV    ::
         ::.................................................::
         :: SCC energy                -9.019014782128 Eh    ::
         :: -> isotropic ES           -0.015250771745 Eh    ::
         :: -> anisotropic ES          0.003846912356 Eh    ::
         :: -> anisotropic XC          0.009891436261 Eh    ::
         :: -> dispersion             -0.001753257745 Eh    ::
         :: repulsion energy           0.071354308801 Eh    ::
         :: add. restraining           0.000000000000 Eh    ::
         :::::::::::::::::::::::::::::::::::::::::::::::::::::

      ----------------------------------------------------------- 
     |                   =====================                   |
     |                        A N C O P T                        |
     |                   =====================                   |
     |               Approximate Normal Coordinate               |
     |                Rational Function Optimizer                |
      ----------------------------------------------------------- 

          ...................................................
          :                      SETUP                      :
          :.................................................:
          :   optimization level            normal          :
          :   max. optcycles                   200          :
          :   ANC micro-cycles                  20          :
          :   degrees of freedom                 6          :
          :.................................................:
          :   RF solver                   davidson          :
          :   write xtbopt.log                true          :
          :   linear?                        false          :
          :   energy convergence         0.5000000E-05 Eh   :
          :   grad. convergence          0.1000000E-02 Eh/α :
          :   maximium RF displ.         1.0000000          :
          :   Hlow (freq-cutoff)         0.1000000E-01      :
          :   Hmax (freq-cutoff)         5.0000000          :
          :   S6 in model hess.         20.0000000          :
          ...................................................

generating ANC from model Hessian ...
Using Lindh-Hessian (1995)
 Shifting diagonal of input Hessian by    0.0000000000000000     
 Lowest  eigenvalues of input Hessian
   -0.000000   -0.000000   -0.000000    0.000000    0.000000    0.000000
    0.098104    0.669475    0.759078    0.962096    1.372869    1.490223
 Highest eigenvalues
    0.098104    0.669475    0.759078    0.962096    1.372869    1.490223


........................................................................
.............................. CYCLE    1 ..............................
........................................................................
   1     -9.0190148 -0.901901E+01  0.698E-06    0.53       0.0  T
   2     -9.0190148  0.710543E-14  0.500E-06    0.53   10006.9  T
   3     -9.0190148 -0.213163E-13  0.324E-06    0.53   15431.1  T
     SCC iter.                  ...        0 min,  0.001 sec
     gradient                   ...        0 min,  0.001 sec
 * total energy  :    -8.9476605 Eh     change        0.3016254E-09 Eh
   gradient norm :     0.1225664 Eh/α   predicted     0.0000000E+00 (-100.00%)
   displ. norm   :     0.2272250 α      lambda       -0.2241456E-01
   maximum displ.:     0.1609606 α      in ANC's #2, #1, #6, ...

........................................................................
.............................. CYCLE    2 ..............................
........................................................................
   1     -9.0522312 -0.905223E+01  0.165E+00    1.20       0.0  T
   2     -9.0531912 -0.959919E-03  0.912E-01    1.54       1.0  T
   3     -9.0531213  0.699023E-04  0.717E-01    1.29       1.0  T
   4     -9.0541308 -0.100954E-02  0.277E-01    1.39       1.0  T
   5     -9.0544228 -0.292005E-03  0.519E-02    1.39       1.0  T
   6     -9.0544246 -0.181705E-05  0.630E-03    1.39       7.9  T
   7     -9.0544246  0.166819E-09  0.344E-03    1.39      14.5  T
   8     -9.0544246  0.101201E-07  0.146E-03    1.39      34.2  T
   9     -9.0544246 -0.154529E-07  0.229E-04    1.39     218.2  T
  10     -9.0544246 -0.425491E-10  0.261E-05    1.39    1919.3  T
     SCC iter.                  ...        0 min,  0.001 sec
     gradient                   ...        0 min,  0.001 sec
 * total energy  :    -8.9652772 Eh     change       -0.1761678E-01 Eh
   gradient norm :     0.0743637 Eh/α   predicted    -0.1178593E-01 ( -33.10%)
   displ. norm   :     0.2660347 α      lambda       -0.1931997E-01
   maximum displ.:     0.2546656 α      in ANC's #2, #1, #3, ...

........................................................................
.............................. CYCLE    3 ..............................
........................................................................
   1     -9.0913002 -0.909130E+01  0.246E+00    2.24       0.0  T
   2     -9.0931123 -0.181209E-02  0.141E+00    2.66       1.0  T
   3     -9.0935548 -0.442466E-03  0.105E+00    2.31       1.0  T
   4     -9.0944706 -0.915859E-03  0.475E-01    2.51       1.0  T
   5     -9.0954130 -0.942394E-03  0.174E-01    2.46       1.0  T
   6     -9.0954390 -0.260354E-04  0.572E-02    2.50       1.0  T
   7     -9.0954470 -0.795009E-05  0.132E-02    2.48       3.8  T
   8     -9.0954472 -0.245977E-06  0.141E-03    2.49      35.4  T
   9     -9.0954472 -0.686926E-09  0.729E-04    2.49      68.6  T
  10     -9.0954472 -0.499549E-09  0.208E-04    2.49     239.9  T
     SCC iter.                  ...        0 min,  0.001 sec
     gradient                   ...        0 min,  0.001 sec
 * total energy  :    -8.9738939 Eh     change       -0.8616635E-02 Eh
   gradient norm :     0.0618511 Eh/α   predicted    -0.1034367E-01 (  20.04%)
   displ. norm   :     0.0625118 α      lambda       -0.2669745E-02
   maximum displ.:     0.0463364 α      in ANC's #1, #6, #3, ...

........................................................................
.............................. CYCLE    4 ..............................
........................................................................
   1     -9.0846890 -0.908469E+01  0.389E-01    2.65       0.0  T
   2     -9.0845722  0.116766E-03  0.317E-01    2.58       1.0  T
   3     -9.0847545 -0.182265E-03  0.192E-01    2.64       1.0  T
   4     -9.0848379 -0.834457E-04  0.282E-02    2.63       1.8  T
   5     -9.0848389 -0.101297E-05  0.158E-02    2.63       3.2  T
   6     -9.0848391 -0.109398E-06  0.224E-03    2.63      22.4  T
   7     -9.0848391 -0.504500E-08  0.109E-03    2.63      46.0  T
   8     -9.0848391  0.532467E-09  0.473E-04    2.63     105.8  T
   9     -9.0848391 -0.154962E-08  0.595E-05    2.63     840.8  T
     SCC iter.                  ...        0 min,  0.001 sec
     gradient                   ...        0 min,  0.001 sec
 * total energy  :    -8.9755353 Eh     change       -0.1641407E-02 Eh
   gradient norm :     0.0221628 Eh/α   predicted    -0.1340088E-02 ( -18.36%)
   displ. norm   :     0.0503878 α      lambda       -0.9012719E-03
   maximum displ.:     0.0314966 α      in ANC's #1, #3, #6, ...

........................................................................
.............................. CYCLE    5 ..............................
........................................................................
   1     -9.0815114 -0.908151E+01  0.410E-01    2.58       0.0  T
   2     -9.0813595  0.151924E-03  0.331E-01    2.53       1.0  T
   3     -9.0814597 -0.100255E-03  0.247E-01    2.59       1.0  T
   4     -9.0816225 -0.162720E-03  0.897E-02    2.55       1.0  T
   5     -9.0816443 -0.218563E-04  0.239E-02    2.56       2.1  T
   6     -9.0816447 -0.424251E-06  0.699E-03    2.56       7.1  T
   7     -9.0816448 -0.695548E-07  0.145E-03    2.56      34.4  T
   8     -9.0816448 -0.540910E-09  0.220E-04    2.56     227.1  T
   9     -9.0816448 -0.230358E-10  0.680E-05    2.56     735.0  T
     SCC iter.                  ...        0 min,  0.001 sec
     gradient                   ...        0 min,  0.001 sec
 * total energy  :    -8.9761004 Eh     change       -0.5650785E-03 Eh
   gradient norm :     0.0068822 Eh/α   predicted    -0.4517797E-03 ( -20.05%)
   displ. norm   :     0.0253222 α      lambda       -0.1497969E-03
   maximum displ.:     0.0208395 α      in ANC's #2, #6, #3, ...

........................................................................
.............................. CYCLE    6 ..............................
........................................................................
   1     -9.0811764 -0.908118E+01  0.304E-01    2.61       0.0  T
   2     -9.0809963  0.180115E-03  0.257E-01    2.56       1.0  T
   3     -9.0810046 -0.836476E-05  0.282E-01    2.62       1.0  T
   4     -9.0812255 -0.220855E-03  0.496E-02    2.59       1.0  T
   5     -9.0812272 -0.174847E-05  0.355E-02    2.59       1.4  T
   6     -9.0812291 -0.188073E-05  0.176E-02    2.59       2.8  T
   7     -9.0812297 -0.628479E-06  0.120E-03    2.59      41.6  T
   8     -9.0812297  0.857593E-08  0.122E-03    2.59      41.0  T
   9     -9.0812297 -0.100237E-07  0.116E-04    2.59     431.9  T
  10     -9.0812297 -0.697575E-11  0.606E-05    2.59     825.4  T
     SCC iter.                  ...        0 min,  0.001 sec
     gradient                   ...        0 min,  0.001 sec
 * total energy  :    -8.9762052 Eh     change       -0.1048160E-03 Eh
   gradient norm :     0.0055263 Eh/α   predicted    -0.7494665E-04 ( -28.50%)
   displ. norm   :     0.0320740 α      lambda       -0.1224605E-03
   maximum displ.:     0.0295695 α      in ANC's #2, #6, #1, ...

........................................................................
.............................. CYCLE    7 ..............................
........................................................................
   1     -9.0805897 -0.908059E+01  0.819E-01    2.70       0.0  T
   2     -9.0768620  0.372769E-02  0.107E+00    2.50       1.0  T
   3     -9.0803452 -0.348318E-02  0.636E-01    2.70       1.0  T
   4     -9.0811822 -0.836970E-03  0.313E-01    2.64       1.0  T
   5     -9.0813850 -0.202802E-03  0.190E-01    2.65       1.0  T
   6     -9.0814504 -0.654049E-04  0.102E-01    2.67       1.0  T
   7     -9.0814645 -0.140746E-04  0.202E-02    2.66       2.5  T
   8     -9.0814652 -0.718735E-06  0.228E-03    2.66      21.9  T
   9     -9.0814652 -0.930823E-08  0.319E-04    2.66     157.0  T
  10     -9.0814652  0.234690E-09  0.258E-04    2.66     194.1  T
     SCC iter.                  ...        0 min,  0.001 sec
     gradient                   ...        0 min,  0.001 sec
 * total energy  :    -8.9763235 Eh     change       -0.1183541E-03 Eh
   gradient norm :     0.0071260 Eh/α   predicted    -0.6129344E-04 ( -48.21%)
   displ. norm   :     0.0317926 α      lambda       -0.1385747E-03
   maximum displ.:     0.0290539 α      in ANC's #2, #6, #1, ...

........................................................................
.............................. CYCLE    8 ..............................
........................................................................
   1     -9.0792644 -0.907926E+01  0.133E+00    2.79       0.0  T
   2     -9.0668367  0.124277E-01  0.197E+00    2.43       1.0  T
   3     -9.0804350 -0.135983E-01  0.729E-01    2.78       1.0  T
   4     -9.0813546 -0.919563E-03  0.546E-01    2.71       1.0  T
   5     -9.0820173 -0.662725E-03  0.235E-01    2.73       1.0  T
   6     -9.0817631  0.254224E-03  0.443E-01    2.76       1.0  T
   7     -9.0821377 -0.374569E-03  0.334E-02    2.74       1.5  T
   8     -9.0821396 -0.190758E-05  0.762E-03    2.74       6.6  T
   9     -9.0821396 -0.541954E-07  0.289E-03    2.74      17.3  T
  10     -9.0821396 -0.194382E-07  0.266E-03    2.74      18.8  T
  11     -9.0821396 -0.135890E-07  0.209E-04    2.74     239.6  T
  12     -9.0821396 -0.771241E-10  0.471E-05    2.74    1062.0  T
     SCC iter.                  ...        0 min,  0.001 sec
     gradient                   ...        0 min,  0.001 sec
 * total energy  :    -8.9764903 Eh     change       -0.1667783E-03 Eh
   gradient norm :     0.0095709 Eh/α   predicted    -0.6935621E-04 ( -58.41%)
   displ. norm   :     0.0474738 α      lambda       -0.2878128E-03
   maximum displ.:     0.0435511 α      in ANC's #2, #6, #1, ...

........................................................................
.............................. CYCLE    9 ..............................
........................................................................
   1     -9.0717829 -0.907178E+01  0.257E+00    2.90       0.0  T
   2     -9.0293695  0.424134E-01  0.365E+00    2.22       1.0  T
   3     -9.0797442 -0.503747E-01  0.917E-01    2.89       1.0  T
   4     -9.0792919  0.452227E-03  0.126E+00    2.79       1.0  T
   5     -9.0829117 -0.361979E-02  0.365E-01    2.83       1.0  T
   6     -9.0822790  0.632749E-03  0.690E-01    2.87       1.0  T
   7     -9.0831029 -0.823922E-03  0.224E-01    2.84       1.0  T
   8     -9.0832024 -0.994999E-04  0.115E-02    2.85       4.4  T
   9     -9.0832017  0.684305E-06  0.221E-02    2.85       2.3  T
  10     -9.0832026 -0.909759E-06  0.513E-03    2.85       9.8  T
  11     -9.0832027 -0.245126E-07  0.378E-03    2.85      13.2  T
  12     -9.0832027 -0.261672E-07  0.993E-04    2.85      50.4  T
  13     -9.0832027 -0.179395E-08  0.263E-04    2.85     190.0  T
     SCC iter.                  ...        0 min,  0.001 sec
     gradient                   ...        0 min,  0.001 sec
 * total energy  :    -8.9768604 Eh     change       -0.3701101E-03 Eh
   gradient norm :     0.0144332 Eh/α   predicted    -0.1442300E-03 ( -61.03%)
   displ. norm   :     0.0766083 α      lambda       -0.7216349E-03
   maximum displ.:     0.0703225 α      in ANC's #2, #6, #1, ...

........................................................................
.............................. CYCLE   10 ..............................
........................................................................
   1     -9.0671074 -0.906711E+01  0.333E+00    3.04       0.0  T
   2     -8.9842707  0.828367E-01  0.508E+00    2.27       1.0  T
   3     -9.0701846 -0.859140E-01  0.224E+00    3.04       1.0  T
   4     -9.0719602 -0.177560E-02  0.237E+00    2.94       1.0  T
   5     -9.0842313 -0.122711E-01  0.578E-01    3.01       1.0  T
   6     -9.0850075 -0.776197E-03  0.166E-01    3.02       1.0  T
   7     -9.0850505 -0.430180E-04  0.106E-01    3.02       1.0  T
   8     -9.0850332  0.173263E-04  0.138E-01    3.02       1.0  T
   9     -9.0850710 -0.377667E-04  0.911E-03    3.02       5.5  T
  10     -9.0850710 -0.749859E-07  0.647E-03    3.02       7.7  T
  11     -9.0850711 -0.358100E-07  0.537E-03    3.02       9.3  T
  12     -9.0850711 -0.547578E-07  0.982E-04    3.02      50.9  T
  13     -9.0850711 -0.183329E-08  0.984E-05    3.02     508.0  T
     SCC iter.                  ...        0 min,  0.001 sec
     gradient                   ...        0 min,  0.001 sec
 * total energy  :    -8.9777990 Eh     change       -0.9385459E-03 Eh
   gradient norm :     0.0228153 Eh/α   predicted    -0.3629355E-03 ( -61.33%)
   displ. norm   :     0.1208942 α      lambda       -0.1811151E-02
   maximum displ.:     0.1109169 α      in ANC's #2, #6, #1, ...

........................................................................
.............................. CYCLE   11 ..............................
........................................................................
   1     -9.0811237 -0.908112E+01  0.258E+00    2.89       0.0  T
   2     -8.9906115  0.905123E-01  0.536E+00    2.98       1.0  T
   3     -9.0765108 -0.858993E-01  0.222E+00    2.84       1.0  T
   4     -9.0861480 -0.963716E-02  0.130E+00    2.97       1.0  T
   5     -9.0869981 -0.850086E-03  0.874E-01    2.99       1.0  T
   6     -9.0869928  0.531249E-05  0.876E-01    2.99       1.0  T
   7     -9.0883551 -0.136234E-02  0.383E-02    3.03       1.3  T
   8     -9.0883465  0.858810E-05  0.805E-02    3.03       1.0  T
   9     -9.0883556 -0.910704E-05  0.164E-02    3.03       3.0  T
  10     -9.0883560 -0.422796E-06  0.106E-02    3.03       4.7  T
  11     -9.0883561 -0.100903E-06  0.812E-03    3.03       6.2  T
  12     -9.0883563 -0.113816E-06  0.139E-03    3.03      36.1  T
  13     -9.0883563 -0.350248E-08  0.293E-04    3.03     170.9  T
  14     -9.0883563 -0.157760E-09  0.697E-05    3.03     717.9  T
     SCC iter.                  ...        0 min,  0.001 sec
     gradient                   ...        0 min,  0.001 sec
 * total energy  :    -8.9800353 Eh     change       -0.2236346E-02 Eh
   gradient norm :     0.0336946 Eh/α   predicted    -0.9188092E-03 ( -58.91%)
   displ. norm   :     0.1656878 α      lambda       -0.3592679E-02
   maximum displ.:     0.1517020 α      in ANC's #2, #6, #1, ...

........................................................................
.............................. CYCLE   12 ..............................
........................................................................
   1     -9.0917841 -0.909178E+01  0.149E+00    2.20       0.0  T
   2     -9.0918199 -0.358150E-04  0.842E-01    2.20       1.0  T
   3     -9.0911484  0.671431E-03  0.381E-01    2.24       1.0  T
   4     -9.0918763 -0.727874E-03  0.571E-02    2.20       1.0  T
   5     -9.0918741  0.218860E-05  0.409E-02    2.21       1.2  T
   6     -9.0918784 -0.422883E-05  0.766E-03    2.21       6.5  T
   7     -9.0918784 -0.608783E-07  0.230E-03    2.21      21.8  T
   8     -9.0918784  0.100208E-07  0.176E-03    2.21      28.4  T
   9     -9.0918784 -0.165943E-07  0.665E-04    2.21      75.2  T
  10     -9.0918784 -0.109612E-08  0.547E-05    2.21     913.4  T
     SCC iter.                  ...        0 min,  0.001 sec
     gradient                   ...        0 min,  0.001 sec
 * total energy  :    -8.9828790 Eh     change       -0.2843707E-02 Eh
   gradient norm :     0.0283561 Eh/α   predicted    -0.1845655E-02 ( -35.10%)
   displ. norm   :     0.0608949 α      lambda       -0.1362102E-02
   maximum displ.:     0.0420731 α      in ANC's #3, #2, #6, ...

........................................................................
.............................. CYCLE   13 ..............................
........................................................................
   1     -9.0928757 -0.909288E+01  0.579E-01    1.92       0.0  T
   2     -9.0921210  0.754753E-03  0.593E-01    1.84       1.0  T
   3     -9.0933836 -0.126265E-02  0.236E-01    1.89       1.0  T
   4     -9.0934625 -0.789146E-04  0.338E-02    1.89       1.5  T
   5     -9.0934628 -0.252393E-06  0.191E-02    1.88       2.6  T
   6     -9.0934634 -0.627738E-06  0.323E-03    1.88      15.5  T
   7     -9.0934634 -0.855773E-08  0.106E-03    1.88      47.2  T
   8     -9.0934634  0.319438E-08  0.807E-04    1.88      62.0  T
   9     -9.0934634 -0.400437E-08  0.179E-04    1.88     278.6  T
     SCC iter.                  ...        0 min,  0.001 sec
     gradient                   ...        0 min,  0.001 sec
 * total energy  :    -8.9833383 Eh     change       -0.4592791E-03 Eh
   gradient norm :     0.0092231 Eh/α   predicted    -0.6835752E-03 (  48.84%)
   displ. norm   :     0.0410499 α      lambda       -0.2857346E-03
   maximum displ.:     0.0369379 α      in ANC's #2, #6, #1, ...

........................................................................
.............................. CYCLE   14 ..............................
........................................................................
   1     -9.0944458 -0.909445E+01  0.370E-01    2.09       0.0  T
   2     -9.0944334  0.123842E-04  0.223E-01    2.16       1.0  T
   3     -9.0943570  0.764626E-04  0.224E-01    2.11       1.0  T
   4     -9.0945501 -0.193108E-03  0.562E-02    2.12       1.0  T
   5     -9.0945559 -0.580425E-05  0.983E-03    2.13       5.1  T
   6     -9.0945560 -0.106505E-06  0.148E-03    2.13      33.8  T
   7     -9.0945560  0.110604E-08  0.906E-04    2.13      55.2  T
   8     -9.0945560 -0.504224E-09  0.755E-04    2.13      66.2  T
     SCC iter.                  ...        0 min,  0.001 sec
     gradient                   ...        0 min,  0.001 sec
 * total energy  :    -8.9834209 Eh     change       -0.8257173E-04 Eh
   gradient norm :     0.0044388 Eh/α   predicted    -0.1431071E-03 (  73.31%)
   displ. norm   :     0.0153134 α      lambda       -0.6203935E-04
   maximum displ.:     0.0119735 α      in ANC's #2, #1, #3, ...

........................................................................
.............................. CYCLE   15 ..............................
........................................................................
   1     -9.0947763 -0.909478E+01  0.140E-01    2.09       0.0  T
   2     -9.0947869 -0.106129E-04  0.800E-02    2.07       1.0  T
   3     -9.0947882 -0.129965E-05  0.415E-02    2.07       1.2  T
   4     -9.0947878  0.375480E-06  0.177E-02    2.07       2.8  T
   5     -9.0947893 -0.148662E-05  0.404E-03    2.07      12.4  T
   6     -9.0947893  0.785484E-08  0.179E-03    2.07      28.0  T
   7     -9.0947893 -0.169627E-07  0.696E-04    2.07      71.8  T
   8     -9.0947893 -0.138305E-08  0.150E-04    2.07     333.4  T
     SCC iter.                  ...        0 min,  0.001 sec
     gradient                   ...        0 min,  0.001 sec
 * total energy  :    -8.9834486 Eh     change       -0.2776444E-04 Eh
   gradient norm :     0.0009826 Eh/α   predicted    -0.3102713E-04 (  11.75%)
   displ. norm   :     0.0032249 α      lambda       -0.1672542E-05
   maximum displ.:     0.0024235 α      in ANC's #1, #3, #6, ...

........................................................................
.............................. CYCLE   16 ..............................
........................................................................
   1     -9.0947599 -0.909476E+01  0.262E-02    2.06       0.0  T
   2     -9.0947592  0.727109E-06  0.239E-02    2.06       2.1  T
   3     -9.0947606 -0.133549E-05  0.110E-02    2.06       4.6  T
   4     -9.0947607 -0.172947E-06  0.474E-03    2.06      10.6  T
   5     -9.0947608 -0.903414E-07  0.115E-03    2.06      43.4  T
   6     -9.0947608  0.479119E-10  0.551E-04    2.06      90.8  T
   7     -9.0947608 -0.174935E-08  0.170E-04    2.06     293.6  T
     SCC iter.                  ...        0 min,  0.001 sec
     gradient                   ...        0 min,  0.001 sec
 * total energy  :    -8.9834491 Eh     change       -0.4403612E-06 Eh
   gradient norm :     0.0006295 Eh/α   predicted    -0.8355529E-06 (  89.74%)
   displ. norm   :     0.0013680 α      lambda       -0.4334673E-06
   maximum displ.:     0.0009942 α      in ANC's #1, #3, #2, ...

   *** GEOMETRY OPTIMIZATION CONVERGED AFTER 16 ITERATIONS ***

------------------------------------------------------------------------
 total energy gain   :        -0.0357886 Eh      -22.4577 kcal/mol
 total RMSD          :         0.4872046 a0        0.2578 Å
 total power (kW/mol):        -5.8726873 (step)-2058.2489 (real)
------------------------------------------------------------------------

 ANCopt (total)                0 d,  0 h,  0 min,  0.046 sec
 optimizer setup                ...        0 min,  0.000 sec (  0.140%)
 model hessian                  ...        0 min,  0.000 sec (  0.168%)
 ANC generation                 ...        0 min,  0.000 sec (  0.101%)
 coordinate transformation      ...        0 min,  0.000 sec (  0.077%)
 single point calculation       ...        0 min,  0.044 sec ( 96.919%)
 optimization log               ...        0 min,  0.000 sec (  0.796%)
 hessian update                 ...        0 min,  0.000 sec (  0.070%)
 rational function              ...        0 min,  0.000 sec (  0.746%)

================
 final structure:
================
4
 xtb: 6.2.2 (9d81278992624c895f80dd42a50cac0aa55982e2)
C        -0.89962980003404    0.02256250428557   -0.15160287485068
C         0.01768073969995   -0.96511470337983    0.25340154302927
C         0.85583078779738    0.01139970970010   -0.31662107000417
N         0.02611827253671    0.93115248939416    0.21482240182558

 Bond Distances (Angstroems)
 ---------------------------
C1-C2=1.4075         C1-C3=1.7632         C1-N4=1.3479         C2-C1=1.4075         C2-C3=1.4075         C2-N4=1.8967         
C3-C1=1.7632         C3-C2=1.4075         C3-N4=1.3479         N4-C1=1.3479         N4-C2=1.8967         N4-C3=1.3479         
 C  C  Rav=1.5261 sigma=0.1677  Rmin=1.4075  Rmax=1.7632     3
 N  C  Rav=1.5308 sigma=0.2587  Rmin=1.3479  Rmax=1.8967     3

 selected bond angles (degree)
 --------------------
C3-C1-C2= 51.22                N4-C1-C2= 86.97                N4-C1-C3= 49.15                C3-C2-C1= 77.57                
N4-C2-C1= 45.21                N4-C2-C3= 45.21                C2-C3-C1= 51.22                N4-C3-C1= 49.15                
N4-C3-C2= 86.97                C2-N4-C1= 47.82                C3-N4-C1= 81.70                C3-N4-C2= 47.82                

 selected dihedral angles (degree)
 ---------------------------------
C3-C2-C1-N4=322.92            N4-C2-C1-C3= 37.08            C2-C3-C1-N4=127.25            N4-C3-C1-C2=232.75            
C1-C3-C2-N4=322.92            N4-C3-C2-C1= 37.08            C2-N4-C1-C3=321.58            C3-N4-C1-C2= 38.42            
C1-N4-C3-C2=321.58            C2-N4-C3-C1= 38.42            
           -------------------------------------------------
          |                Final Singlepoint                |
           -------------------------------------------------

          ...................................................
          :                      SETUP                      :
          :.................................................:
          :  # basis functions                  16          :
          :  # atomic orbitals                  16          :
          :  # shells                            8          :
          :  # electrons                        17          :
          :  max. iterations                   250          :
          :  Hamiltonian                  GFN2-xTB          :
          :  restarted?                      false          :
          :  GBSA solvation                  false          :
          :  PC potential                    false          :
          :  electronic temp.          300.0000000     K    :
          :  accuracy                    1.0000000          :
          :  -> integral cutoff          0.2500000E+02      :
          :  -> integral neglect         0.1000000E-07      :
          :  -> SCF convergence          0.1000000E-05 Eh   :
          :  -> wf. convergence          0.1000000E-03 e    :
          :  Broyden damping             0.4000000          :
          ...................................................

 iter      E             dE          RMSdq      gap      omega  full diag
   1     -9.0947608 -0.909476E+01  0.399E-05    2.06       0.0  T
   2     -9.0947608 -0.135003E-12  0.228E-05    2.06    2191.9  T
   3     -9.0947608  0.241585E-12  0.981E-06    2.06    5097.7  T

   *** convergence criteria satisfied after 3 iterations ***

         #    Occupation            Energy/Eh            Energy/eV
      -------------------------------------------------------------
         1        2.0000           -0.7676711             -20.8894
       ...           ...                  ...                  ...
         3        2.0000           -0.6451411             -17.5552
         4        2.0000           -0.5910441             -16.0831
         5        2.0000           -0.5541212             -15.0784
         6        2.0000           -0.5112909             -13.9129
         7        2.0000           -0.4793634             -13.0441
         8        1.9999           -0.4498091             -12.2399
         9        1.0001           -0.4325361             -11.7699 (HOMO)
        10                         -0.3567727              -9.7083 (LUMO)
        11                         -0.2941373              -8.0039
        12                         -0.2798708              -7.6157
        13                          0.0760530               2.0695
        14                          0.1301815               3.5424
       ...                                ...                  ...
        16                          0.4895591              13.3216
      -------------------------------------------------------------
                  HL-Gap            0.0757634 Eh            2.0616 eV
             Fermi-level           -0.4179135 Eh          -11.3720 eV

 SCC (total)                   0 d,  0 h,  0 min,  0.003 sec
 SCC setup                      ...        0 min,  0.000 sec (  1.873%)
 Dispersion                     ...        0 min,  0.000 sec (  0.384%)
 integral evaluation            ...        0 min,  0.001 sec ( 37.184%)
 zeroth order Hamiltonian       ...        0 min,  0.000 sec (  0.539%)
 iterations                     ...        0 min,  0.001 sec ( 20.579%)
 molecular gradient             ...        0 min,  0.001 sec ( 36.178%)
 printout                       ...        0 min,  0.000 sec (  2.943%)

         :::::::::::::::::::::::::::::::::::::::::::::::::::::
         ::                     SUMMARY                     ::
         :::::::::::::::::::::::::::::::::::::::::::::::::::::
         :: total energy              -8.983449084051 Eh    ::
         :: gradient norm              0.000630434419 Eh/a0 ::
         :: HOMO-LUMO gap              2.061628239018 eV    ::
         ::.................................................::
         :: SCC energy                -9.094760823133 Eh    ::
         :: -> isotropic ES           -0.004990666284 Eh    ::
         :: -> anisotropic ES          0.002622680843 Eh    ::
         :: -> anisotropic XC          0.009078759578 Eh    ::
         :: -> dispersion             -0.001671668079 Eh    ::
         :: repulsion energy           0.111311734069 Eh    ::
         :: add. restraining           0.000000000000 Eh    ::
         :::::::::::::::::::::::::::::::::::::::::::::::::::::

           ------------------------------------------------- 
          |                Numerical Hessian                |
           ------------------------------------------------- 
step length          :   0.00500
SCC accuracy         :   0.30000
Hessian scale factor :   1.00000
frozen atoms in %    :   0.00000    0
RMS gradient         :   0.00063
estimated CPU  time      0.00 min
estimated wall time      0.00 min

writing file <hessian>.

 projected vibrational frequencies (cm-1)
eigval :       -0.00    -0.00    -0.00    -0.00     0.00     0.00
eigval :      304.21   593.79   723.27  1003.77  1263.02  1505.87
           -------------------------------------------------
          |                Property Printout                |
           -------------------------------------------------

    * Orbital Energies and Occupations

         #    Occupation            Energy/Eh            Energy/eV
      -------------------------------------------------------------
         1        2.0000           -0.7676711             -20.8894
         2        2.0000           -0.6566031             -17.8671
         3        2.0000           -0.6451411             -17.5552
         4        2.0000           -0.5910441             -16.0831
         5        2.0000           -0.5541213             -15.0784
         6        2.0000           -0.5112908             -13.9129
         7        2.0000           -0.4793634             -13.0441
         8        1.9999           -0.4498091             -12.2399
         9        1.0001           -0.4325361             -11.7699 (HOMO)
        10                         -0.3567727              -9.7083 (LUMO)
        11                         -0.2941373              -8.0039
        12                         -0.2798709              -7.6157
        13                          0.0760530               2.0695
        14                          0.1301815               3.5424
        15                          0.1743885               4.7454
        16                          0.4895591              13.3216
Molecule has the following symmetry elements: (sigma) 
It seems to be the Cs point group
      -------------------------------------------------------------
                  HL-Gap            0.0757634 Eh            2.0616 eV
             Fermi-level           -0.4179135 Eh          -11.3720 eV

     #   Z        covCN         q      C6AA      α(0)
     1   6 C      2.768     0.049    26.887     8.492
     2   6 C      2.513    -0.028    28.829     8.772
     3   6 C      2.768     0.049    26.887     8.492
     4   7 N      2.373    -0.070    22.740     7.080

 Mol. C6AA /au·bohr⁶  :        419.958765
 Mol. C8AA /au·bohr⁸  :      11442.490694
 Mol. α(0) /au        :         32.836525


Wiberg/Mayer (AO) data.
largest (>0.10) Wiberg bond orders for each atom
          total WBO             WBO to atom ...
     1  C   2.932        N    4 1.219    C    2 1.166    C    3 0.548
     2  C   2.948        C    1 1.166    C    3 1.166    N    4 0.617
     3  C   2.932        N    4 1.219    C    2 1.166    C    1 0.548
     4  N   3.054        C    3 1.219    C    1 1.219    C    2 0.617

MOs/occ written to file <molden.input>


molecular dipole:
                 x           y           z       tot (Debye)
 q only:       -0.008      -0.069      -0.085
   full:       -0.035       0.038      -0.375       0.962
molecular quadrupole (traceless):
                xx          xy          yy          xz          yz          zz
 q only:        0.421      -0.009      -0.444      -0.038      -0.040       0.024
  q+dip:       -0.270      -0.011      -0.901       0.136      -0.078       1.170
   full:       -0.684       0.020      -1.406       0.265       0.261       2.090

           -------------------------------------------------
          |                Geometry Summary                 |
           -------------------------------------------------

      molecular mass/u    :       50.0389109
   center of mass at/Å    :        0.0010420       0.0371421       0.0085688
  moments of inertia/u·Å² :        0.2142237E+02   0.2602500E+02   0.4194398E+02
rotational constants/cm⁻¹ :        0.7869171E+00   0.6477476E+00   0.4019083E+00

 * 2 selected distances

     #   Z        #   Z                                     value/Å
     1   6 C      4   7 N                                 1.3478920 (max)
     3   6 C      4   7 N                                 1.3478873 (min)

 * 1 distinct bonds (by element types)

   Z      Z             #   av. dist./Å        max./Å        min./Å
   6 C    7 N           2     1.3478896     1.3478920     1.3478873

           -------------------------------------------------
          |               Frequency Printout                |
           -------------------------------------------------
 projected vibrational frequencies (cm-1)
eigval :       -0.00    -0.00    -0.00    -0.00     0.00     0.00
eigval :      304.21   593.79   723.27  1003.77  1263.02  1505.87
 reduced masses (amu)
   1: 13.29   2: 12.75   3: 12.27   4: 12.13   5: 12.12   6: 12.68   7: 12.37   8: 12.60
   9: 12.33  10: 12.50  11: 12.48  12: 12.60
 IR intensities (amu)
   1:  0.11   2:  0.02   3:  0.14   4:  0.04   5:  0.09   6:  0.05   7:  0.46   8:  0.38
   9:  0.10  10:  2.16  11:  1.24  12:  0.35
 Raman intensities (amu)
   1:  0.00   2:  0.00   3:  0.00   4:  0.00   5:  0.00   6:  0.00   7:  0.00   8:  0.00
   9:  0.00  10:  0.00  11:  0.00  12:  0.00
 output can be read by thermo (or use thermo option).
 writing <g98.out> molden fake output.
 recommended (thermochemical) frequency scaling factor: 1.0
           -------------------------------------------------
          |             Thermodynamic Functions             |
           -------------------------------------------------

cs  symmetry found (for desy threshold:  0.10E+00) used in thermo

          ...................................................
          :                      SETUP                      :
          :.................................................:
          :  # frequencies                           6      :
          :  # imaginary freq.                       0      :
          :  linear?                             false      :
          :  only rotor calc.                    false      :
          :  symmetry                               cs      :
          :  rotational number                       1      :
          :  scaling factor                  1.0000000      :
          :  rotor cutoff                   50.0000000 cm⁻¹ :
          :  imag. cutoff                  -20.0000000 cm⁻¹ :
          :.................................................:

    mode    ω/cm⁻¹     T·S(HO)/kcal·mol⁻¹    T·S(FR)/kcal·mol⁻¹   T·S(vib)
   ------------------------------------------------------------------------
   ------------------------------------------------------------------------

   temp. (K)  partition function   enthalpy   heat capacity  entropy
                                   cal/mol     cal/K/mol   cal/K/mol   J/K/mol
 298.15  VIB   1.44                  461.910      4.110      2.270
         ROT  0.117E+05              888.752      2.981     21.593
         INT  0.168E+05             1350.663      7.091     23.863
         TR   0.342E+27             1481.254      4.968     37.637
         TOT                        2831.9166    12.0589    61.4999   257.3154

   temp. (K)  partition function   enthalpy   heat capacity  entropy
                                   cal/mol     cal/K/mol   cal/K/mol   J/K/mol
 120.00  VIB   1.03                   25.020      0.835      0.263
         ROT  0.298E+04              357.707      2.981     18.880
         INT  0.307E+04              382.727      3.816     19.144
         TR   0.874E+26              596.178      4.968     33.118
         TOT                         978.9051     8.7844    52.2614   218.6616

   temp. (K)  partition function   enthalpy   heat capacity  entropy
                                   cal/mol     cal/K/mol   cal/K/mol   J/K/mol
 100.00  VIB   1.01                   11.463      0.526      0.141
         ROT  0.227E+04              298.089      2.981     18.337
         INT  0.230E+04              309.552      3.506     18.477
         TR   0.665E+26              496.815      4.968     32.212
         TOT                         806.3669     8.4746    50.6897   212.0858

   temp. (K)  partition function   enthalpy   heat capacity  entropy
                                   cal/mol     cal/K/mol   cal/K/mol   J/K/mol
  80.00  VIB   1.00                    3.718      0.258      0.055
         ROT  0.162E+04              238.471      2.981     17.672
         INT  0.163E+04              242.189      3.239     17.727
         TR   0.476E+26              397.452      4.968     31.104
         TOT                         639.6414     8.2074    48.8311   204.3092

   temp. (K)  partition function   enthalpy   heat capacity  entropy
                                   cal/mol     cal/K/mol   cal/K/mol   J/K/mol
  60.00  VIB   1.00                    0.592      0.072      0.011
         ROT  0.105E+04              178.853      2.981     16.814
         INT  0.106E+04              179.446      3.053     16.825
         TR   0.309E+26              298.089      4.968     29.676
         TOT                         477.5346     8.0212    46.5011   194.5606

   temp. (K)  partition function   enthalpy   heat capacity  entropy
                                   cal/mol     cal/K/mol   cal/K/mol   J/K/mol
  40.00  VIB   1.00                    0.015      0.004      0.000
         ROT   574.                  119.236      2.981     15.605
         INT   574.                  119.251      2.985     15.606
         TR   0.168E+26              198.726      4.968     27.662
         TOT                         317.9770     7.9533    43.2679   181.0329

   temp. (K)  partition function   enthalpy   heat capacity  entropy
                                   cal/mol     cal/K/mol   cal/K/mol   J/K/mol
  20.00  VIB   1.00                    0.000      0.000     -0.001
         ROT   203.                   59.618      2.981     13.539
         INT   203.                   59.618      2.981     13.538
         TR   0.595E+25               99.363      4.968     24.220
         TOT                         158.9808     7.9490    37.7587   157.9826

   temp. (K)  partition function   enthalpy   heat capacity  entropy
                                   cal/mol     cal/K/mol   cal/K/mol   J/K/mol
  10.00  VIB   1.00                    0.000      0.000     -0.001
         ROT   71.8                   29.809      2.981     11.473
         INT   71.8                   29.809      2.981     11.472
         TR   0.210E+25               49.681      4.968     20.778
         TOT                          79.4904     7.9490    32.2500   134.9340

       T/K    H(0)-H(T)+PV         H(T)/Eh          T*S/Eh         G(T)/Eh
   ------------------------------------------------------------------------
    298.15    0.451295E-02    0.168012E-01    0.292206E-01   -0.124194E-01
    120.00    0.155998E-02    0.138483E-01    0.999405E-02    0.385420E-02
    100.00    0.128503E-02    0.135733E-01    0.807792E-02    0.549538E-02
     80.00    0.101933E-02    0.133076E-01    0.622538E-02    0.708223E-02
     60.00    0.761000E-03    0.130493E-01    0.444625E-02    0.860302E-02
     40.00    0.506729E-03    0.127950E-01    0.275807E-02    0.100369E-01
     20.00    0.253352E-03    0.125416E-01    0.120345E-02    0.113382E-01
     10.00    0.126676E-03    0.124149E-01    0.513937E-03    0.119010E-01 (used)
   ------------------------------------------------------------------------

         :::::::::::::::::::::::::::::::::::::::::::::::::::::
         ::                  THERMODYNAMIC                  ::
         :::::::::::::::::::::::::::::::::::::::::::::::::::::
         :: total free energy          -8.971548071743 Eh   ::
         ::.................................................::
         :: total energy               -8.983449084036 Eh   ::
         :: zero point energy           0.012288272914 Eh   ::
         :: G(RRHO) w/o ZPVE           -0.000387260621 Eh   ::
         :: G(RRHO) contrib.            0.011901012294 Eh   ::
         :::::::::::::::::::::::::::::::::::::::::::::::::::::

optimized geometry written to: xtbopt.xyz


           -------------------------------------------------
          | TOTAL ENERGY               -8.983449084036 Eh   |
          | TOTAL ENTHALPY             -8.971034135106 Eh   |
          | TOTAL FREE ENERGY          -8.971548071743 Eh   |
          | GRADIENT NORM               0.000630690304 Eh/α |
          | HOMO-LUMO GAP               2.061627054550 eV   |
           -------------------------------------------------

------------------------------------------------------------------------
 * finished run on 2020/05/12 at 11:45:06.331     
------------------------------------------------------------------------
 total:
 * wall-time:     0 d,  0 h,  0 min,  0.129 sec
 *  cpu-time:     0 d,  0 h,  0 min,  0.129 sec
 * ratio c/w:     0.999 speedup
 SCF:
 * wall-time:     0 d,  0 h,  0 min,  0.004 sec
 *  cpu-time:     0 d,  0 h,  0 min,  0.004 sec
 * ratio c/w:     0.994 speedup
 ANC optimizer:
 * wall-time:     0 d,  0 h,  0 min,  0.049 sec
 *  cpu-time:     0 d,  0 h,  0 min,  0.049 sec
 * ratio c/w:     0.999 speedup
 numerical hessian:
 * wall-time:     0 d,  0 h,  0 min,  0.061 sec
 *  cpu-time:     0 d,  0 h,  0 min,  0.061 sec
 * ratio c/w:     0.999 speedup

