      -----------------------------------------------------------      
     |                   =====================                   |     
     |                           x T B                           |     
     |                   =====================                   |     
     |                         S. Grimme                         |     
     |          Mulliken Center for Theoretical Chemistry        |     
     |                    University of Bonn                     |     
      -----------------------------------------------------------      

   * xtb version 6.2.2 (9d81278992624c895f80dd42a50cac0aa55982e2) compiled by '@Darwin' on 04/03/2020

   xtb is free software: you can redistribute it and/or modify it under
   the terms of the GNU Lesser General Public License as published by
   the Free Software Foundation, either version 3 of the License, or
   (at your option) any later version.
   
   xtb is distributed in the hope that it will be useful,
   but WITHOUT ANY WARRANTY; without even the implied warranty of
   MERCHANTABILITY or FITNESS FOR A PARTICULAR PURPOSE.  See the
   GNU Lesser General Public License for more details.
   
   Cite this work as:
   * S. Grimme, C. Bannwarth, P. Shushkov, J. Chem. Theory Comput., 2017,
     13, 1989-2009. DOI: 10.1021/acs.jctc.7b00118
   * C. Bannwarth, S. Ehlert and S. Grimme., J. Chem. Theory Comput., 2019,
     15, 1652-1671. DOI: 10.1021/acs.jctc.8b01176
   * P. Pracht, E. Caldeweyher, S. Ehlert, S. Grimme, ChemRxiv, 2019, preprint.
     DOI: 10.26434/chemrxiv.8326202.v1
   
   for DFT-D4:
   * E. Caldeweyher, C. Bannwarth and S. Grimme, J. Chem. Phys., 2017,
     147, 034112. DOI: 10.1063/1.4993215
   * E. Caldeweyher, S. Ehlert, A. Hansen, H. Neugebauer, S. Spicher,
     C. Bannwarth and S. Grimme, J. Chem. Phys., 2019, 150, 154122.
     DOI: 10.1063/1.5090222
   
   for sTDA-xTB:
   * S. Grimme and C. Bannwarth, J. Chem. Phys., 2016, 145, 054103.
     DOI: 10.1063/1.4959605
   
   in the mass-spec context:
   * V. Asgeirsson, C. Bauer and S. Grimme, Chem. Sci., 2017, 8, 4879.
     DOI: 10.1039/c7sc00601b
   
   for metadynamics refer to:
   * S. Grimme, J. Chem. Theory Comput., 2019, 155, 2847-2862
     DOI: 10.1021/acs.jctc.9b00143
   
   with help from (in alphabetical order)
   C. Bannwarth, F. Bohle, G. Brandenburg, E. Caldeweyher, M. Checinski,
   S. Dohm, S. Ehlert, S. Ehrlich, F. März, H. Neugebauer, J. Pisarek,
   P. Pracht, P. Shushkov, and S. Spicher.
   
 * started run on 2020/05/13 at 16:25:46.528     

           -------------------------------------------------
          |                Calculation Setup                |
           -------------------------------------------------

          program call               : xtb --input N1_0_S_0.input N1_0_S_0.xyz --ohess --molden --namespace N1_0_S_0 output.out
          calculation namespace      : N1_0_S_0
          coordinate file            : N1_0_S_0.xyz
          number of atoms            :                     1
          number of electrons        :                     5
          charge                     :                     0
          spin                       :                   0.5
          first test random number   :      0.29293216437986

   ID    Z sym.   atoms
    1    7 N      1

           -------------------------------------------------
          |                 G F N 2 - x T B                 |
           -------------------------------------------------

        Reference                      10.1021/acs.jctc.8b01176
      * Hamiltonian:
        H0-scaling (s, p, d)           1.850000    2.230000    2.230000
        zeta-weighting                 0.500000
      * Dispersion:
        s8                             2.700000
        a1                             0.520000
        a2                             5.000000
        s9                             5.000000
      * Repulsion:
        kExp                           1.500000    1.000000
        rExp                           1.000000
      * Coulomb:
        alpha                          2.000000
        third order                    shell-resolved
        anisotropic                    true
        a3                             3.000000
        a5                             4.000000
        cn-shift                       1.200000
        cn-exp                         4.000000
        max-rad                        5.000000


          ...................................................
          :                      SETUP                      :
          :.................................................:
          :  # basis functions                   4          :
          :  # atomic orbitals                   4          :
          :  # shells                            2          :
          :  # electrons                         5          :
          :  max. iterations                   250          :
          :  Hamiltonian                  GFN2-xTB          :
          :  restarted?                      false          :
          :  GBSA solvation                  false          :
          :  PC potential                    false          :
          :  electronic temp.          300.0000000     K    :
          :  accuracy                    1.0000000          :
          :  -> integral cutoff          0.2500000E+02      :
          :  -> integral neglect         0.1000000E-07      :
          :  -> SCF convergence          0.1000000E-05 Eh   :
          :  -> wf. convergence          0.1000000E-03 e    :
          :  Broyden damping             0.4000000          :
          ...................................................

 iter      E             dE          RMSdq      gap      omega  full diag
   1     -2.6094525 -0.260945E+01  0.707E+00    0.00       0.0  T
   2     -2.6094525  0.000000E+00  0.566E+00    0.00       0.0  T
   3     -2.6094525  0.000000E+00  0.436E+00    0.00       0.0  T
   4     -2.6094525  0.000000E+00  0.348E+00    0.00       0.0  T
   5     -2.6094525  0.000000E+00  0.279E+00    0.00       0.0  T
   6     -2.6094525  0.000000E+00  0.223E+00    0.00       0.0  T
   7     -2.6094525  0.000000E+00  0.178E+00    0.00       0.0  T
   8     -2.6094525  0.000000E+00  0.143E+00    0.00       0.0  T
   9     -2.6094525  0.000000E+00  0.114E+00    0.00       0.0  T
  10     -2.6094525  0.000000E+00  0.913E-01    0.00       0.0  T
  11     -2.6094525  0.000000E+00  0.731E-01    0.00       0.0  T
  12     -2.6094525  0.000000E+00  0.585E-01    0.00       0.0  T
  13     -2.6094525  0.000000E+00  0.468E-01    0.00       0.0  T
  14     -2.6094525  0.000000E+00  0.374E-01    0.00       0.0  T
  15     -2.6094525  0.000000E+00  0.299E-01    0.00       0.0  T
  16     -2.6094525  0.000000E+00  0.239E-01    0.00       0.0  T
  17     -2.6094525  0.000000E+00  0.192E-01    0.00       0.0  T
  18     -2.6094525  0.000000E+00  0.153E-01    0.00       0.0  T
  19     -2.6094525  0.000000E+00  0.123E-01    0.00       0.0  T
  20     -2.6094525  0.000000E+00  0.981E-02    0.00       0.0  T
  21     -2.6094525  0.000000E+00  0.785E-02    0.00       0.0  T
  22     -2.6094525  0.000000E+00  0.628E-02    0.00       0.0  T
  23     -2.6094525  0.000000E+00  0.502E-02    0.00       0.0  T
  24     -2.6094525  0.000000E+00  0.402E-02    0.00       0.0  T
  25     -2.6094525  0.000000E+00  0.321E-02    0.00       0.0  T
  26     -2.6094525  0.000000E+00  0.257E-02    0.00       0.0  T
  27     -2.6094525  0.000000E+00  0.206E-02    0.00       0.0  T
  28     -2.6094525  0.000000E+00  0.165E-02    0.00       0.0  T
  29     -2.6094525  0.000000E+00  0.132E-02    0.00       0.0  T
  30     -2.6094525  0.000000E+00  0.105E-02    0.00       0.0  T
  31     -2.6094525  0.000000E+00  0.843E-03    0.00       0.0  T
  32     -2.6094525  0.000000E+00  0.674E-03    0.00       0.0  T
  33     -2.6094525  0.000000E+00  0.539E-03    0.00       0.0  T
  34     -2.6094525  0.000000E+00  0.431E-03    0.00       0.0  T
  35     -2.6094525  0.000000E+00  0.345E-03    0.00       0.0  T
  36     -2.6094525  0.000000E+00  0.276E-03    0.00       0.0  T
  37     -2.6094525  0.000000E+00  0.221E-03    0.00       0.0  T
  38     -2.6094525  0.000000E+00  0.177E-03    0.00       0.0  T
  39     -2.6094525  0.000000E+00  0.141E-03    0.00       0.0  T
  40     -2.6094525  0.000000E+00  0.113E-03    0.00       0.0  T
  41     -2.6094525  0.000000E+00  0.905E-04    0.00       0.0  T
  42     -2.6094525  0.000000E+00  0.724E-04    0.00       0.0  T

   *** convergence criteria satisfied after 42 iterations ***

         #    Occupation            Energy/Eh            Energy/eV
      -------------------------------------------------------------
         1        2.0000           -0.6106553             -16.6168
         2        1.0000           -0.4656897             -12.6721
         3        1.0000           -0.4656897             -12.6721 (HOMO)
         4        1.0000           -0.4656897             -12.6721 (LUMO)
      -------------------------------------------------------------
                  HL-Gap            0.0000000 Eh            0.0000 eV
             Fermi-level           -0.4656897 Eh          -12.6721 eV

 SCC (total)                   0 d,  0 h,  0 min,  0.001 sec
 SCC setup                      ...        0 min,  0.000 sec (  7.669%)
 Dispersion                     ...        0 min,  0.000 sec (  0.722%)
 integral evaluation            ...        0 min,  0.000 sec ( 10.475%)
 zeroth order Hamiltonian       ...        0 min,  0.000 sec (  0.806%)
 iterations                     ...        0 min,  0.001 sec ( 72.631%)
 molecular gradient             ...        0 min,  0.000 sec (  3.390%)
 printout                       ...        0 min,  0.000 sec (  3.168%)

         :::::::::::::::::::::::::::::::::::::::::::::::::::::
         ::                     SUMMARY                     ::
         :::::::::::::::::::::::::::::::::::::::::::::::::::::
         :: total energy              -2.609452454822 Eh    ::
         :: gradient norm              0.000000000000 Eh/a0 ::
         :: HOMO-LUMO gap              0.000000000000 eV    ::
         ::.................................................::
         :: SCC energy                -2.609452454822 Eh    ::
         :: -> isotropic ES            0.001332875000 Eh    ::
         :: -> anisotropic ES          0.000000000000 Eh    ::
         :: -> anisotropic XC          0.000000000000 Eh    ::
         :: -> dispersion              0.000000000000 Eh    ::
         :: repulsion energy           0.000000000000 Eh    ::
         :: add. restraining           0.000000000000 Eh    ::
         :::::::::::::::::::::::::::::::::::::::::::::::::::::

      ----------------------------------------------------------- 
     |                   =====================                   |
     |                        A N C O P T                        |
     |                   =====================                   |
     |               Approximate Normal Coordinate               |
     |                Rational Function Optimizer                |
      ----------------------------------------------------------- 
================
 final structure:
================
1
 xtb: 6.2.2 (9d81278992624c895f80dd42a50cac0aa55982e2)
N         0.00000000000000    0.00000000000000    0.00000000000000

 Bond Distances (Angstroems)
 ---------------------------


 selected bond angles (degree)
 --------------------


 selected dihedral angles (degree)
 ---------------------------------

           -------------------------------------------------
          |                Final Singlepoint                |
           -------------------------------------------------

          ...................................................
          :                      SETUP                      :
          :.................................................:
          :  # basis functions                   4          :
          :  # atomic orbitals                   4          :
          :  # shells                            2          :
          :  # electrons                         5          :
          :  max. iterations                   250          :
          :  Hamiltonian                  GFN2-xTB          :
          :  restarted?                      false          :
          :  GBSA solvation                  false          :
          :  PC potential                    false          :
          :  electronic temp.          300.0000000     K    :
          :  accuracy                    1.0000000          :
          :  -> integral cutoff          0.2500000E+02      :
          :  -> integral neglect         0.1000000E-07      :
          :  -> SCF convergence          0.1000000E-05 Eh   :
          :  -> wf. convergence          0.1000000E-03 e    :
          :  Broyden damping             0.4000000          :
          ...................................................

 iter      E             dE          RMSdq      gap      omega  full diag
   1     -2.6094525 -0.260945E+01  0.579E-04    0.00       0.0  T
   2     -2.6094525  0.000000E+00  0.463E-04    0.00       0.0  T
   3     -2.6094525  0.000000E+00  0.357E-04    0.00       0.0  T

   *** convergence criteria satisfied after 3 iterations ***

         #    Occupation            Energy/Eh            Energy/eV
      -------------------------------------------------------------
         1        2.0000           -0.6106543             -16.6167
         2        1.0000           -0.4656895             -12.6721
         3        1.0000           -0.4656895             -12.6721 (HOMO)
         4        1.0000           -0.4656895             -12.6721 (LUMO)
      -------------------------------------------------------------
                  HL-Gap            0.0000000 Eh            0.0000 eV
             Fermi-level           -0.4656895 Eh          -12.6721 eV

 SCC (total)                   0 d,  0 h,  0 min,  0.000 sec
 SCC setup                      ...        0 min,  0.000 sec ( 14.674%)
 Dispersion                     ...        0 min,  0.000 sec (  0.931%)
 integral evaluation            ...        0 min,  0.000 sec ( 24.338%)
 zeroth order Hamiltonian       ...        0 min,  0.000 sec (  0.859%)
 iterations                     ...        0 min,  0.000 sec ( 32.427%)
 molecular gradient             ...        0 min,  0.000 sec (  3.221%)
 printout                       ...        0 min,  0.000 sec ( 21.904%)

         :::::::::::::::::::::::::::::::::::::::::::::::::::::
         ::                     SUMMARY                     ::
         :::::::::::::::::::::::::::::::::::::::::::::::::::::
         :: total energy              -2.609452454822 Eh    ::
         :: gradient norm              0.000000000000 Eh/a0 ::
         :: HOMO-LUMO gap              0.000000000000 eV    ::
         ::.................................................::
         :: SCC energy                -2.609452454822 Eh    ::
         :: -> isotropic ES            0.001332875000 Eh    ::
         :: -> anisotropic ES          0.000000000000 Eh    ::
         :: -> anisotropic XC          0.000000000000 Eh    ::
         :: -> dispersion              0.000000000000 Eh    ::
         :: repulsion energy           0.000000000000 Eh    ::
         :: add. restraining           0.000000000000 Eh    ::
         :::::::::::::::::::::::::::::::::::::::::::::::::::::

           ------------------------------------------------- 
          |                Numerical Hessian                |
           ------------------------------------------------- 
step length          :   0.00500
SCC accuracy         :   0.30000
Hessian scale factor :   1.00000
frozen atoms in %    :   0.00000    0
RMS gradient         :   0.00000

writing file <hessian>.

 vibrational frequencies (cm-1)
eigval :        0.00     0.00     0.00
           -------------------------------------------------
          |                Property Printout                |
           -------------------------------------------------

    * Orbital Energies and Occupations

         #    Occupation            Energy/Eh            Energy/eV
      -------------------------------------------------------------
         1        2.0000           -0.6106538             -16.6167
         2        1.0000           -0.4656895             -12.6721
Molecule has the following symmetry elements: (i) (Cinf) (sigma) 
It seems to be the Kh point group
         3        1.0000           -0.4656895             -12.6721 (HOMO)
         4        1.0000           -0.4656895             -12.6721 (LUMO)
      -------------------------------------------------------------
                  HL-Gap            0.0000000 Eh            0.0000 eV
             Fermi-level           -0.4656895 Eh          -12.6721 eV

     #   Z        covCN         q      C6AA      α(0)
     1   7 N      0.000    -0.000    25.360     7.537

 Mol. C6AA /au·bohr⁶  :         25.359930
 Mol. C8AA /au·bohr⁸  :        559.460439
 Mol. α(0) /au        :          7.536598


Wiberg/Mayer (AO) data.
largest (>0.10) Wiberg bond orders for each atom
          total WBO             WBO to atom ...
     1  N   0.000    

MOs/occ written to file <molden.input>


molecular dipole:
                 x           y           z       tot (Debye)
 q only:        0.000       0.000       0.000
   full:        0.000       0.000       0.000       0.000
molecular quadrupole (traceless):
                xx          xy          yy          xz          yz          zz
 q only:        0.000       0.000       0.000       0.000       0.000       0.000
  q+dip:        0.000       0.000       0.000       0.000       0.000       0.000
   full:        0.000       0.000       0.000       0.000       0.000       0.000

           -------------------------------------------------
          |                Geometry Summary                 |
           -------------------------------------------------

      molecular mass/u    :       14.0067032
   center of mass at/Å    :        0.0000000       0.0000000       0.0000000
  moments of inertia/u·Å² :        0.0000000E+00   0.0000000E+00   0.0000000E+00
rotational constants/cm⁻¹ :             Infinity        Infinity        Infinity

           -------------------------------------------------
          |               Frequency Printout                |
           -------------------------------------------------
 vibrational frequencies (cm-1)
eigval :        0.00     0.00     0.00
 reduced masses (amu)
   1: 14.01   2: 14.01   3: 14.01
 IR intensities (amu)
   1:  0.00   2:  0.00   3:  0.00
 Raman intensities (amu)
   1:  0.00   2:  0.00   3:  0.00
 output can be read by thermo (or use thermo option).
 writing <g98.out> molden fake output.
 recommended (thermochemical) frequency scaling factor: 1.0
           -------------------------------------------------
          |             Thermodynamic Functions             |
           -------------------------------------------------

Kh  symmetry found (for desy threshold:  0.10E+00) used in thermo

          ...................................................
          :                      SETUP                      :
          :.................................................:
          :  # frequencies                           0      :
          :  # imaginary freq.                       0      :
          :  linear?                              true      :
          :  only rotor calc.                     true      :
          :  symmetry                               Kh      :
          :  rotational number                       1      :
          :  scaling factor                  1.0000000      :
          :  rotor cutoff                   50.0000000 cm⁻¹ :
          :  imag. cutoff                  -20.0000000 cm⁻¹ :
          :.................................................:

    mode    ω/cm⁻¹     T·S(HO)/kcal·mol⁻¹    T·S(FR)/kcal·mol⁻¹   T·S(vib)
   ------------------------------------------------------------------------
   ------------------------------------------------------------------------

   temp. (K)  partition function   enthalpy   heat capacity  entropy
                                   cal/mol     cal/K/mol   cal/K/mol   J/K/mol
 298.15  VIB   1.00                    0.000      0.000      0.000
         ROT   1.00                    0.000      0.000      0.000
         INT   1.00                    0.000      0.000      0.000
         TR   0.507E+26             1481.254      4.968     33.844
         TOT                        1481.2539     4.9681    33.8435   141.6012

   temp. (K)  partition function   enthalpy   heat capacity  entropy
                                   cal/mol     cal/K/mol   cal/K/mol   J/K/mol
 120.00  VIB   1.00                    0.000      0.000      0.000
         ROT   1.00                    0.000      0.000      0.000
         INT   1.00                    0.000      0.000      0.000
         TR   0.130E+26              596.178      4.968     29.324
         TOT                         596.1780     4.9681    29.3242   122.6924

   temp. (K)  partition function   enthalpy   heat capacity  entropy
                                   cal/mol     cal/K/mol   cal/K/mol   J/K/mol
 100.00  VIB   1.00                    0.000      0.000      0.000
         ROT   1.00                    0.000      0.000      0.000
         INT   1.00                    0.000      0.000      0.000
         TR   0.985E+25              496.815      4.968     28.419
         TOT                         496.8150     4.9681    28.4188   118.9044

   temp. (K)  partition function   enthalpy   heat capacity  entropy
                                   cal/mol     cal/K/mol   cal/K/mol   J/K/mol
  80.00  VIB   1.00                    0.000      0.000      0.000
         ROT   1.00                    0.000      0.000      0.000
         INT   1.00                    0.000      0.000      0.000
         TR   0.705E+25              397.452      4.968     27.311
         TOT                         397.4520     4.9681    27.3108   114.2682

   temp. (K)  partition function   enthalpy   heat capacity  entropy
                                   cal/mol     cal/K/mol   cal/K/mol   J/K/mol
  60.00  VIB   1.00                    0.000      0.000      0.000
         ROT   1.00                    0.000      0.000      0.000
         INT   1.00                    0.000      0.000      0.000
         TR   0.458E+25              298.089      4.968     25.882
         TOT                         298.0890     4.9681    25.8822   108.2911

   temp. (K)  partition function   enthalpy   heat capacity  entropy
                                   cal/mol     cal/K/mol   cal/K/mol   J/K/mol
  40.00  VIB   1.00                    0.000      0.000      0.000
         ROT   1.00                    0.000      0.000      0.000
         INT   1.00                    0.000      0.000      0.000
         TR   0.249E+25              198.726      4.968     23.869
         TOT                         198.7260     4.9681    23.8688    99.8670

   temp. (K)  partition function   enthalpy   heat capacity  entropy
                                   cal/mol     cal/K/mol   cal/K/mol   J/K/mol
  20.00  VIB   1.00                    0.000      0.000      0.000
         ROT   1.00                    0.000      0.000      0.000
         INT   1.00                    0.000      0.000      0.000
         TR   0.881E+24               99.363      4.968     20.427
         TOT                          99.3630     4.9681    20.4268    85.4657

   temp. (K)  partition function   enthalpy   heat capacity  entropy
                                   cal/mol     cal/K/mol   cal/K/mol   J/K/mol
  10.00  VIB   1.00                    0.000      0.000      0.000
         ROT   1.00                    0.000      0.000      0.000
         INT   1.00                    0.000      0.000      0.000
         TR   0.312E+24               49.681      4.968     16.985
         TOT                          49.6815     4.9681    16.9848    71.0645

       T/K    H(0)-H(T)+PV         H(T)/Eh          T*S/Eh         G(T)/Eh
   ------------------------------------------------------------------------
    298.15    0.236053E-02    0.236053E-02    0.160801E-01   -0.137196E-01
    120.00    0.950070E-03    0.950070E-03    0.560773E-02   -0.465766E-02
    100.00    0.791725E-03    0.791725E-03    0.452883E-02   -0.373710E-02
     80.00    0.633380E-03    0.633380E-03    0.348180E-02   -0.284842E-02
     60.00    0.475035E-03    0.475035E-03    0.247476E-02   -0.199972E-02
     40.00    0.316690E-03    0.316690E-03    0.152149E-02   -0.120480E-02
     20.00    0.158345E-03    0.158345E-03    0.651044E-03   -0.492699E-03
     10.00    0.791725E-04    0.791725E-04    0.270670E-03   -0.191498E-03 (used)
   ------------------------------------------------------------------------

         :::::::::::::::::::::::::::::::::::::::::::::::::::::
         ::                  THERMODYNAMIC                  ::
         :::::::::::::::::::::::::::::::::::::::::::::::::::::
         :: total free energy          -2.609643952695 Eh   ::
         ::.................................................::
         :: total energy               -2.609452454822 Eh   ::
         :: zero point energy           0.000000000000 Eh   ::
         :: G(RRHO) w/o ZPVE           -0.000191497873 Eh   ::
         :: G(RRHO) contrib.           -0.000191497873 Eh   ::
         :::::::::::::::::::::::::::::::::::::::::::::::::::::

optimized geometry written to: xtbopt.xyz


           -------------------------------------------------
          | TOTAL ENERGY               -2.609452454822 Eh   |
          | TOTAL ENTHALPY             -2.609373282312 Eh   |
          | TOTAL FREE ENERGY          -2.609643952695 Eh   |
          | GRADIENT NORM               0.000000000000 Eh/α |
          | HOMO-LUMO GAP               0.000000000000 eV   |
           -------------------------------------------------

------------------------------------------------------------------------
 * finished run on 2020/05/13 at 16:25:46.546     
------------------------------------------------------------------------
 total:
 * wall-time:     0 d,  0 h,  0 min,  0.017 sec
 *  cpu-time:     0 d,  0 h,  0 min,  0.017 sec
 * ratio c/w:     0.994 speedup
 SCF:
 * wall-time:     0 d,  0 h,  0 min,  0.001 sec
 *  cpu-time:     0 d,  0 h,  0 min,  0.001 sec
 * ratio c/w:     1.000 speedup
 ANC optimizer:
 * wall-time:     0 d,  0 h,  0 min,  0.001 sec
 *  cpu-time:     0 d,  0 h,  0 min,  0.001 sec
 * ratio c/w:     0.993 speedup
 numerical hessian:
 * wall-time:     0 d,  0 h,  0 min,  0.002 sec
 *  cpu-time:     0 d,  0 h,  0 min,  0.002 sec
 * ratio c/w:     0.999 speedup

