      -----------------------------------------------------------      
     |                   =====================                   |     
     |                           x T B                           |     
     |                   =====================                   |     
     |                         S. Grimme                         |     
     |          Mulliken Center for Theoretical Chemistry        |     
     |                    University of Bonn                     |     
      -----------------------------------------------------------      

   * xtb version 6.2.2 (9d81278992624c895f80dd42a50cac0aa55982e2) compiled by '@Darwin' on 04/03/2020

   xtb is free software: you can redistribute it and/or modify it under
   the terms of the GNU Lesser General Public License as published by
   the Free Software Foundation, either version 3 of the License, or
   (at your option) any later version.
   
   xtb is distributed in the hope that it will be useful,
   but WITHOUT ANY WARRANTY; without even the implied warranty of
   MERCHANTABILITY or FITNESS FOR A PARTICULAR PURPOSE.  See the
   GNU Lesser General Public License for more details.
   
   Cite this work as:
   * S. Grimme, C. Bannwarth, P. Shushkov, J. Chem. Theory Comput., 2017,
     13, 1989-2009. DOI: 10.1021/acs.jctc.7b00118
   * C. Bannwarth, S. Ehlert and S. Grimme., J. Chem. Theory Comput., 2019,
     15, 1652-1671. DOI: 10.1021/acs.jctc.8b01176
   * P. Pracht, E. Caldeweyher, S. Ehlert, S. Grimme, ChemRxiv, 2019, preprint.
     DOI: 10.26434/chemrxiv.8326202.v1
   
   for DFT-D4:
   * E. Caldeweyher, C. Bannwarth and S. Grimme, J. Chem. Phys., 2017,
     147, 034112. DOI: 10.1063/1.4993215
   * E. Caldeweyher, S. Ehlert, A. Hansen, H. Neugebauer, S. Spicher,
     C. Bannwarth and S. Grimme, J. Chem. Phys., 2019, 150, 154122.
     DOI: 10.1063/1.5090222
   
   for sTDA-xTB:
   * S. Grimme and C. Bannwarth, J. Chem. Phys., 2016, 145, 054103.
     DOI: 10.1063/1.4959605
   
   in the mass-spec context:
   * V. Asgeirsson, C. Bauer and S. Grimme, Chem. Sci., 2017, 8, 4879.
     DOI: 10.1039/c7sc00601b
   
   for metadynamics refer to:
   * S. Grimme, J. Chem. Theory Comput., 2019, 155, 2847-2862
     DOI: 10.1021/acs.jctc.9b00143
   
   with help from (in alphabetical order)
   C. Bannwarth, F. Bohle, G. Brandenburg, E. Caldeweyher, M. Checinski,
   S. Dohm, S. Ehlert, S. Ehrlich, F. März, H. Neugebauer, J. Pisarek,
   P. Pracht, P. Shushkov, and S. Spicher.
   
 * started run on 2020/05/12 at 11:44:09.893     

           -------------------------------------------------
          |                Calculation Setup                |
           -------------------------------------------------

          program call               : xtb --input C4N1_27_S_1.input C4N1_27_S_1.xyz --ohess --molden --namespace C4N1_27_S_1 output.out
          calculation namespace      : C4N1_27_S_1
          coordinate file            : C4N1_27_S_1.xyz
          number of atoms            :                     5
          number of electrons        :                    21
          charge                     :                     0
          spin                       :                   0.5
          first test random number   :      0.38881862732865

   ID    Z sym.   atoms
    1    6 C      1, 2, 4, 5
    2    7 N      3

           -------------------------------------------------
          |                 G F N 2 - x T B                 |
           -------------------------------------------------

        Reference                      10.1021/acs.jctc.8b01176
      * Hamiltonian:
        H0-scaling (s, p, d)           1.850000    2.230000    2.230000
        zeta-weighting                 0.500000
      * Dispersion:
        s8                             2.700000
        a1                             0.520000
        a2                             5.000000
        s9                             5.000000
      * Repulsion:
        kExp                           1.500000    1.000000
        rExp                           1.000000
      * Coulomb:
        alpha                          2.000000
        third order                    shell-resolved
        anisotropic                    true
        a3                             3.000000
        a5                             4.000000
        cn-shift                       1.200000
        cn-exp                         4.000000
        max-rad                        5.000000


          ...................................................
          :                      SETUP                      :
          :.................................................:
          :  # basis functions                  20          :
          :  # atomic orbitals                  20          :
          :  # shells                           10          :
          :  # electrons                        21          :
          :  max. iterations                   250          :
          :  Hamiltonian                  GFN2-xTB          :
          :  restarted?                      false          :
          :  GBSA solvation                  false          :
          :  PC potential                    false          :
          :  electronic temp.          300.0000000     K    :
          :  accuracy                    1.0000000          :
          :  -> integral cutoff          0.2500000E+02      :
          :  -> integral neglect         0.1000000E-07      :
          :  -> SCF convergence          0.1000000E-05 Eh   :
          :  -> wf. convergence          0.1000000E-03 e    :
          :  Broyden damping             0.4000000          :
          ...................................................

 iter      E             dE          RMSdq      gap      omega  full diag
   1    -10.8085347 -0.108085E+02  0.119E+01    0.60       0.0  T
   2     -8.6453839  0.216315E+01  0.164E+01    1.04       1.0  T
   3     -9.2285782 -0.583194E+00  0.124E+01    1.36       1.0  T
   4    -10.9745503 -0.174597E+01  0.620E+00    0.02       1.0  T
   5    -11.0100732 -0.355229E-01  0.382E+00    0.07       1.0  T
   6    -11.0166239 -0.655072E-02  0.293E+00    0.08       1.0  T
   7    -11.0180321 -0.140817E-02  0.208E+00    0.08       1.0  T
   8    -11.0209755 -0.294341E-02  0.121E+00    0.06       1.0  T
   9    -11.0205196  0.455872E-03  0.151E+00    0.04       1.0  T
  10    -11.0212670 -0.747346E-03  0.594E-01    0.04       1.0  T
  11    -11.0219324 -0.665397E-03  0.265E-01    0.05       1.0  T
  12    -11.0219701 -0.377774E-04  0.167E-01    0.07       1.0  T
  13    -11.0220783 -0.108173E-03  0.318E-02    0.06       1.4  T
  14    -11.0220805 -0.223984E-05  0.945E-03    0.06       4.7  T
  15    -11.0220806 -0.192081E-07  0.655E-03    0.06       6.8  T
  16    -11.0220806 -0.511882E-07  0.185E-03    0.06      24.2  T
  17    -11.0220806 -0.789996E-08  0.899E-04    0.06      49.7  T
  18    -11.0220806 -0.308670E-08  0.678E-05    0.06     659.6  T

   *** convergence criteria satisfied after 18 iterations ***

         #    Occupation            Energy/Eh            Energy/eV
      -------------------------------------------------------------
         1        2.0000           -0.7847338             -21.3537
       ...           ...                  ...                  ...
         5        2.0000           -0.5789835             -15.7549
         6        2.0000           -0.5565856             -15.1455
         7        2.0000           -0.5335548             -14.5188
         8        2.0000           -0.5247286             -14.2786
         9        2.0000           -0.4901993             -13.3390
        10        2.0000           -0.4627401             -12.5918
        11        0.7689           -0.4266119             -11.6087 (HOMO)
        12        0.2311           -0.4243282             -11.5466 (LUMO)
        13                         -0.4001746             -10.8893
        14                         -0.3511340              -9.5548
        15                         -0.2745520              -7.4709
        16                         -0.0394637              -1.0739
       ...                                ...                  ...
        20                          0.2218221               6.0361
      -------------------------------------------------------------
                  HL-Gap            0.0022837 Eh            0.0621 eV
             Fermi-level           -0.4350936 Eh          -11.8395 eV

 SCC (total)                   0 d,  0 h,  0 min,  0.005 sec
 SCC setup                      ...        0 min,  0.000 sec (  1.470%)
 Dispersion                     ...        0 min,  0.000 sec (  0.345%)
 integral evaluation            ...        0 min,  0.002 sec ( 33.193%)
 zeroth order Hamiltonian       ...        0 min,  0.000 sec (  0.402%)
 iterations                     ...        0 min,  0.002 sec ( 35.884%)
 molecular gradient             ...        0 min,  0.001 sec ( 26.969%)
 printout                       ...        0 min,  0.000 sec (  1.527%)

         :::::::::::::::::::::::::::::::::::::::::::::::::::::
         ::                     SUMMARY                     ::
         :::::::::::::::::::::::::::::::::::::::::::::::::::::
         :: total energy             -10.934662233789 Eh    ::
         :: gradient norm              0.172333857624 Eh/a0 ::
         :: HOMO-LUMO gap              0.062143237071 eV    ::
         ::.................................................::
         :: SCC energy               -11.022080621976 Eh    ::
         :: -> isotropic ES           -0.028627524958 Eh    ::
         :: -> anisotropic ES          0.004243642162 Eh    ::
         :: -> anisotropic XC          0.013389057420 Eh    ::
         :: -> dispersion             -0.002875869392 Eh    ::
         :: repulsion energy           0.087418300086 Eh    ::
         :: add. restraining           0.000000000000 Eh    ::
         :::::::::::::::::::::::::::::::::::::::::::::::::::::

      ----------------------------------------------------------- 
     |                   =====================                   |
     |                        A N C O P T                        |
     |                   =====================                   |
     |               Approximate Normal Coordinate               |
     |                Rational Function Optimizer                |
      ----------------------------------------------------------- 

          ...................................................
          :                      SETUP                      :
          :.................................................:
          :   optimization level            normal          :
          :   max. optcycles                   200          :
          :   ANC micro-cycles                  20          :
          :   degrees of freedom                 9          :
          :.................................................:
          :   RF solver                   davidson          :
          :   write xtbopt.log                true          :
          :   linear?                        false          :
          :   energy convergence         0.5000000E-05 Eh   :
          :   grad. convergence          0.1000000E-02 Eh/α :
          :   maximium RF displ.         1.0000000          :
          :   Hlow (freq-cutoff)         0.1000000E-01      :
          :   Hmax (freq-cutoff)         5.0000000          :
          :   S6 in model hess.         20.0000000          :
          ...................................................

generating ANC from model Hessian ...
Using Lindh-Hessian (1995)
 Shifting diagonal of input Hessian by    0.0000000000000000     
 Lowest  eigenvalues of input Hessian
   -0.000000   -0.000000   -0.000000    0.000000    0.000000    0.000000
    0.092449    0.097284    0.138932    0.585221    0.664150    0.976142
    1.020574    1.439514    1.546342
 Highest eigenvalues
    0.585221    0.664150    0.976142    1.020574    1.439514    1.546342


........................................................................
.............................. CYCLE    1 ..............................
........................................................................
   1    -11.0220806 -0.110221E+02  0.248E-05    0.06       0.0  T
   2    -11.0220806  0.633449E-10  0.957E-05    0.06     467.5  T
   3    -11.0220806 -0.125748E-10  0.895E-05    0.06     499.4  T
     SCC iter.                  ...        0 min,  0.001 sec
     gradient                   ...        0 min,  0.001 sec
 * total energy  :   -10.9346622 Eh     change       -0.1501430E-09 Eh
   gradient norm :     0.1723335 Eh/α   predicted     0.0000000E+00 (-100.00%)
   displ. norm   :     0.2641372 α      lambda       -0.3859409E-01
   maximum displ.:     0.1655445 α      in ANC's #3, #5, #6, ...

........................................................................
.............................. CYCLE    2 ..............................
........................................................................
   1    -11.0367745 -0.110368E+02  0.459E+00    0.28       0.0  T
   2    -10.5376292  0.499145E+00  0.714E+00    1.22       1.0  T
   3    -10.8995987 -0.361969E+00  0.455E+00    0.33       1.0  T
   4    -11.0695899 -0.169991E+00  0.205E+00    0.16       1.0  T
   5    -11.0718477 -0.225775E-02  0.133E+00    0.12       1.0  T
   6    -11.0750897 -0.324199E-02  0.763E-01    0.09       1.0  T
   7    -11.0751422 -0.525572E-04  0.723E-01    0.09       1.0  T
   8    -11.0758168 -0.674552E-03  0.213E-01    0.06       1.0  T
   9    -11.0758724 -0.556627E-04  0.158E-01    0.06       1.0  T
  10    -11.0759135 -0.410336E-04  0.115E-01    0.06       1.0  T
  11    -11.0759209 -0.747879E-05  0.838E-02    0.07       1.0  T
  12    -11.0759487 -0.278006E-04  0.302E-03    0.07      14.8  T
  13    -11.0759487  0.646853E-07  0.528E-03    0.07       8.5  T
  14    -11.0759488 -0.984325E-07  0.133E-03    0.07      33.7  T
  15    -11.0759488 -0.789322E-08  0.149E-04    0.07     300.6  T
  16    -11.0759488  0.909459E-10  0.186E-04    0.07     240.0  T
     SCC iter.                  ...        0 min,  0.001 sec
     gradient                   ...        0 min,  0.001 sec
 * total energy  :   -10.9706185 Eh     change       -0.3595629E-01 Eh
   gradient norm :     0.1410717 Eh/α   predicted    -0.2064338E-01 ( -42.59%)
   displ. norm   :     0.8748630 α      lambda       -0.1092700E+00
   maximum displ.:     0.6213092 α      in ANC's #3, #5, #6, ...

........................................................................
.............................. CYCLE    3 ..............................
........................................................................
   1    -11.1727164 -0.111727E+02  0.579E+00    1.01       0.0  T
   2    -11.0778472  0.948692E-01  0.461E+00    1.79       1.0  T
   3    -11.1208462 -0.429990E-01  0.413E+00    1.20       1.0  T
   4    -11.2241391 -0.103293E+00  0.163E+00    1.39       1.0  T
   5    -11.2296622 -0.552307E-02  0.506E-01    1.41       1.0  T
   6    -11.2301206 -0.458387E-03  0.315E-01    1.42       1.0  T
   7    -11.2302035 -0.828713E-04  0.887E-02    1.40       1.0  T
   8    -11.2302432 -0.397360E-04  0.132E-02    1.41       3.4  T
   9    -11.2302437 -0.510851E-06  0.474E-03    1.41       9.4  T
  10    -11.2302437 -0.493079E-07  0.171E-03    1.41      26.2  T
  11    -11.2302438 -0.114166E-07  0.882E-04    1.41      50.7  T
  12    -11.2302438 -0.346617E-08  0.176E-04    1.41     253.9  T
     SCC iter.                  ...        0 min,  0.001 sec
     gradient                   ...        0 min,  0.001 sec
 * total energy  :   -11.0168193 Eh     change       -0.4620078E-01 Eh
   gradient norm :     0.2102121 Eh/α   predicted    -0.9645176E-01 ( 108.77%)
   displ. norm   :     0.2361658 α      lambda       -0.3663384E-01
   maximum displ.:     0.1945532 α      in ANC's #1, #6, #5, ...

........................................................................
.............................. CYCLE    4 ..............................
........................................................................
   1    -11.1801154 -0.111801E+02  0.188E+00    1.40       0.0  T
   2    -11.0998771  0.802383E-01  0.321E+00    1.03       1.0  T
   3    -11.1879393 -0.880622E-01  0.113E+00    1.32       1.0  T
   4    -11.1931605 -0.522126E-02  0.469E-01    1.32       1.0  T
   5    -11.1940930 -0.932461E-03  0.147E-01    1.29       1.0  T
   6    -11.1941729 -0.799090E-04  0.629E-02    1.29       1.0  T
   7    -11.1941941 -0.211710E-04  0.142E-02    1.29       3.1  T
   8    -11.1941946 -0.531988E-06  0.531E-03    1.28       8.4  T
   9    -11.1941947 -0.805603E-07  0.726E-04    1.28      61.6  T
  10    -11.1941947 -0.238647E-08  0.410E-04    1.28     109.0  T
     SCC iter.                  ...        0 min,  0.001 sec
     gradient                   ...        0 min,  0.001 sec
 * total energy  :   -11.0379449 Eh     change       -0.2112559E-01 Eh
   gradient norm :     0.0572076 Eh/α   predicted    -0.1933853E-01 (  -8.46%)
   displ. norm   :     0.4037977 α      lambda       -0.1637629E-01
   maximum displ.:     0.3521349 α      in ANC's #1, #5, #3, ...

........................................................................
.............................. CYCLE    5 ..............................
........................................................................
   1    -11.1900754 -0.111901E+02  0.202E+00    1.77       0.0  T
   2    -11.1048567  0.852187E-01  0.345E+00    1.49       1.0  T
   3    -11.1951636 -0.903069E-01  0.104E+00    1.70       1.0  T
   4    -11.1959661 -0.802465E-03  0.684E-01    1.75       1.0  T
   5    -11.1978707 -0.190460E-02  0.875E-02    1.71       1.0  T
   6    -11.1978552  0.154180E-04  0.648E-02    1.71       1.0  T
   7    -11.1978781 -0.228673E-04  0.802E-03    1.71       5.6  T
   8    -11.1978783 -0.191981E-06  0.440E-03    1.71      10.2  T
   9    -11.1978783  0.143074E-07  0.251E-03    1.71      17.9  T
  10    -11.1978783 -0.439083E-07  0.900E-04    1.71      49.7  T
  11    -11.1978783 -0.440397E-08  0.497E-04    1.71      90.0  T
     SCC iter.                  ...        0 min,  0.001 sec
     gradient                   ...        0 min,  0.001 sec
 * total energy  :   -11.0486307 Eh     change       -0.1068584E-01 Eh
   gradient norm :     0.0621663 Eh/α   predicted    -0.9523241E-02 ( -10.88%)
   displ. norm   :     0.2954824 α      lambda       -0.7569002E-02
   maximum displ.:     0.1807522 α      in ANC's #1, #3, #5, ...

........................................................................
.............................. CYCLE    6 ..............................
........................................................................
   1    -11.1798987 -0.111799E+02  0.354E+00    1.86       0.0  T
   2    -10.9839727  0.195926E+00  0.486E+00    1.67       1.0  T
   3    -11.0749521 -0.909794E-01  0.385E+00    1.66       1.0  T
   4    -11.2005014 -0.125549E+00  0.136E+00    1.86       1.0  T
   5    -11.2040389 -0.353750E-02  0.813E-01    1.82       1.0  T
   6    -11.2029625  0.107644E-02  0.103E+00    1.81       1.0  T
   7    -11.2048479 -0.188543E-02  0.534E-01    1.83       1.0  T
   8    -11.2055320 -0.684095E-03  0.884E-02    1.85       1.0  T
   9    -11.2055450 -0.130144E-04  0.158E-02    1.85       2.8  T
  10    -11.2055451 -0.103248E-06  0.746E-03    1.85       6.0  T
  11    -11.2055452 -0.145708E-06  0.340E-03    1.85      13.1  T
  12    -11.2055452 -0.391219E-08  0.333E-03    1.85      13.4  T
  13    -11.2055453 -0.867752E-08  0.280E-03    1.85      16.0  T
  14    -11.2055453 -0.165731E-07  0.305E-04    1.85     146.7  T
  15    -11.2055453  0.198094E-09  0.418E-04    1.85     106.9  T
     SCC iter.                  ...        0 min,  0.001 sec
     gradient                   ...        0 min,  0.001 sec
 * total energy  :   -11.0557296 Eh     change       -0.7098821E-02 Eh
   gradient norm :     0.0633387 Eh/α   predicted    -0.4114926E-02 ( -42.03%)
   displ. norm   :     0.9355008 α      lambda       -0.2725569E-01
   maximum displ.:     0.5426102 α      in ANC's #1, #3, #5, ...

........................................................................
.............................. CYCLE    7 ..............................
........................................................................
   1    -11.1863233 -0.111863E+02  0.536E+00    1.72       0.0  T
   2    -11.1329936  0.533297E-01  0.379E+00    1.37       1.0  T
   3    -10.8781506  0.254843E+00  0.603E+00    2.13       1.0  T
   4    -11.1935262 -0.315376E+00  0.139E+00    1.66       1.0  T
   5    -11.1997903 -0.626413E-02  0.631E-01    1.51       1.0  T
   6    -11.1995597  0.230606E-03  0.567E-01    1.52       1.0  T
   7    -11.1999184 -0.358634E-03  0.189E-01    1.51       1.0  T
   8    -11.2000122 -0.937989E-04  0.948E-02    1.51       1.0  T
   9    -11.2000261 -0.139203E-04  0.673E-02    1.51       1.0  T
  10    -11.2000288 -0.269257E-05  0.433E-02    1.51       1.0  T
  11    -11.2000316 -0.281624E-05  0.492E-03    1.51       9.1  T
  12    -11.2000316 -0.105048E-07  0.328E-03    1.51      13.6  T
  13    -11.2000316 -0.413721E-07  0.243E-04    1.51     184.1  T
  14    -11.2000316 -0.107008E-10  0.915E-05    1.51     488.6  T
     SCC iter.                  ...        0 min,  0.001 sec
     gradient                   ...        0 min,  0.001 sec
 * total energy  :   -11.0473004 Eh     change        0.8429143E-02 Eh
   gradient norm :     0.1341204 Eh/α   predicted    -0.2555442E-01 (-403.17%)
   displ. norm   :     0.6291841 α      lambda       -0.4145041E-01
   maximum displ.:     0.4460137 α      in ANC's #1, #3, #4, ...

........................................................................
.............................. CYCLE    8 ..............................
........................................................................
   1    -11.2979218 -0.112979E+02  0.358E+00    2.06       0.0  T
   2    -11.2033965  0.945253E-01  0.464E+00    1.63       1.0  T
   3    -11.3053355 -0.101939E+00  0.222E+00    2.06       1.0  T
   4    -11.2863185  0.190170E-01  0.215E+00    1.89       1.0  T
   5    -11.2900693 -0.375081E-02  0.169E+00    1.88       1.0  T
   6    -11.3073760 -0.173067E-01  0.313E-01    2.05       1.0  T
   7    -11.3074179 -0.418866E-04  0.540E-02    2.04       1.0  T
   8    -11.3074141  0.386408E-05  0.384E-02    2.04       1.2  T
   9    -11.3074204 -0.630960E-05  0.629E-03    2.04       7.1  T
  10    -11.3074204 -0.504424E-07  0.350E-03    2.04      12.8  T
  11    -11.3074204 -0.513443E-08  0.129E-03    2.04      34.6  T
  12    -11.3074204 -0.652834E-09  0.648E-04    2.04      69.0  T
  13    -11.3074204  0.610608E-09  0.606E-04    2.04      73.8  T
     SCC iter.                  ...        0 min,  0.001 sec
     gradient                   ...        0 min,  0.001 sec
 * total energy  :   -11.0257208 Eh     change        0.2157958E-01 Eh
   gradient norm :     0.3369095 Eh/α   predicted    -0.2892976E-01 (-234.06%)
   displ. norm   :     0.6544471 α      lambda       -0.1320197E+00
   maximum displ.:     0.5414124 α      in ANC's #5, #6, #9, ...

........................................................................
.............................. CYCLE    9 ..............................
........................................................................
   1    -11.0879192 -0.110879E+02  0.616E+00    1.29       0.0  T
   2     -9.9445381  0.114338E+01  0.117E+01    1.24       1.0  T
   3    -10.8192186 -0.874681E+00  0.626E+00    1.30       1.0  T
   4    -11.1545014 -0.335283E+00  0.208E+00    1.29       1.0  T
   5    -11.1486780  0.582338E-02  0.178E+00    1.44       1.0  T
   6    -11.1475156  0.116239E-02  0.177E+00    1.43       1.0  T
   7    -11.1544002 -0.688462E-02  0.125E+00    1.44       1.0  T
   8    -11.1591121 -0.471191E-02  0.452E-01    1.41       1.0  T
   9    -11.1593899 -0.277800E-03  0.146E-01    1.39       1.0  T
  10    -11.1594179 -0.279195E-04  0.656E-02    1.38       1.0  T
  11    -11.1594208 -0.295330E-05  0.100E-01    1.39       1.0  T
  12    -11.1594321 -0.112466E-04  0.177E-02    1.38       2.5  T
  13    -11.1594328 -0.758403E-06  0.133E-02    1.38       3.4  T
  14    -11.1594337 -0.896833E-06  0.392E-03    1.38      11.4  T
  15    -11.1594337 -0.195665E-07  0.143E-03    1.38      31.2  T
  16    -11.1594337 -0.440911E-08  0.416E-04    1.38     107.4  T
  17    -11.1594337 -0.428091E-09  0.603E-05    1.38     741.9  T
     SCC iter.                  ...        0 min,  0.001 sec
     gradient                   ...        0 min,  0.001 sec
 * total energy  :   -11.0379705 Eh     change       -0.1224963E-01 Eh
   gradient norm :     0.1464459 Eh/α   predicted    -0.9428186E-01 ( 669.67%)
   displ. norm   :     0.4051397 α      lambda       -0.3114485E-01
   maximum displ.:     0.2752608 α      in ANC's #5, #3, #4, ...

........................................................................
.............................. CYCLE   10 ..............................
........................................................................
   1    -11.1729992 -0.111730E+02  0.392E+00    1.67       0.0  T
   2    -10.7994375  0.373562E+00  0.609E+00    1.53       1.0  T
   3    -11.0396577 -0.240220E+00  0.460E+00    1.68       1.0  T
   4    -11.1735867 -0.133929E+00  0.240E+00    1.60       1.0  T
   5    -11.1966642 -0.230775E-01  0.132E+00    1.58       1.0  T
   6    -11.1976335 -0.969277E-03  0.118E+00    1.59       1.0  T
   7    -11.2001619 -0.252842E-02  0.352E-01    1.62       1.0  T
   8    -11.2007993 -0.637388E-03  0.334E-01    1.59       1.0  T
   9    -11.2010789 -0.279622E-03  0.999E-02    1.60       1.0  T
  10    -11.2010913 -0.124373E-04  0.366E-02    1.60       1.2  T
  11    -11.2010932 -0.185945E-05  0.225E-02    1.60       2.0  T
  12    -11.2010944 -0.122380E-05  0.243E-03    1.60      18.4  T
  13    -11.2010944 -0.732141E-08  0.657E-04    1.60      68.1  T
  14    -11.2010944  0.421308E-08  0.152E-03    1.60      29.3  T
  15    -11.2010944 -0.675801E-08  0.153E-04    1.60     291.4  T
     SCC iter.                  ...        0 min,  0.002 sec
     gradient                   ...        0 min,  0.001 sec
 * total energy  :   -11.0632549 Eh     change       -0.2528448E-01 Eh
   gradient norm :     0.0982631 Eh/α   predicted    -0.1812847E-01 ( -28.30%)
   displ. norm   :     0.4455621 α      lambda       -0.1358170E-01
   maximum displ.:     0.3044708 α      in ANC's #5, #3, #1, ...

........................................................................
.............................. CYCLE   11 ..............................
........................................................................
   1    -11.2064082 -0.112064E+02  0.342E+00    1.92       0.0  T
   2    -11.1919428  0.144654E-01  0.233E+00    1.70       1.0  T
   3    -11.1544110  0.375318E-01  0.289E+00    2.06       1.0  T
   4    -11.2102763 -0.558652E-01  0.739E-01    1.84       1.0  T
   5    -11.2132254 -0.294911E-02  0.120E-01    1.81       1.0  T
   6    -11.2132310 -0.565084E-05  0.833E-02    1.81       1.0  T
   7    -11.2132229  0.812695E-05  0.358E-02    1.80       1.2  T
   8    -11.2132333 -0.103758E-04  0.426E-03    1.81      10.5  T
   9    -11.2132333 -0.453261E-07  0.921E-04    1.81      48.6  T
  10    -11.2132333 -0.380801E-09  0.461E-04    1.81      97.1  T
     SCC iter.                  ...        0 min,  0.001 sec
     gradient                   ...        0 min,  0.001 sec
 * total energy  :   -11.0593234 Eh     change        0.3931517E-02 Eh
   gradient norm :     0.1087627 Eh/α   predicted    -0.8139019E-02 (-307.02%)
   displ. norm   :     0.3239633 α      lambda       -0.1776275E-01
   maximum displ.:     0.2133915 α      in ANC's #3, #1, #5, ...

........................................................................
.............................. CYCLE   12 ..............................
........................................................................
   1    -11.2404961 -0.112405E+02  0.213E+00    1.69       0.0  T
   2    -11.2380140  0.248206E-02  0.144E+00    1.70       1.0  T
   3    -11.2049941  0.330200E-01  0.200E+00    1.74       1.0  T
   4    -11.2409950 -0.360009E-01  0.447E-01    1.72       1.0  T
   5    -11.2417725 -0.777572E-03  0.121E-01    1.70       1.0  T
   6    -11.2418034 -0.308548E-04  0.971E-02    1.70       1.0  T
   7    -11.2418084 -0.503250E-05  0.288E-02    1.70       1.6  T
   8    -11.2418121 -0.367436E-05  0.679E-03    1.70       6.6  T
   9    -11.2418121  0.324863E-07  0.437E-03    1.70      10.2  T
  10    -11.2418122 -0.862438E-07  0.175E-03    1.70      25.5  T
  11    -11.2418122 -0.649966E-08  0.229E-04    1.70     195.3  T
  12    -11.2418122 -0.144786E-09  0.355E-05    1.70    1260.3  T
     SCC iter.                  ...        0 min,  0.001 sec
     gradient                   ...        0 min,  0.001 sec
 * total energy  :   -11.0662369 Eh     change       -0.6913426E-02 Eh
   gradient norm :     0.1136842 Eh/α   predicted    -0.9813509E-02 (  41.95%)
   displ. norm   :     0.1580277 α      lambda       -0.8609775E-02
   maximum displ.:     0.1023881 α      in ANC's #5, #1, #6, ...

........................................................................
.............................. CYCLE   13 ..............................
........................................................................
   1    -11.1931157 -0.111931E+02  0.145E+00    1.55       0.0  T
   2    -11.1449171  0.481986E-01  0.256E+00    1.45       1.0  T
   3    -11.1979553 -0.530382E-01  0.863E-01    1.53       1.0  T
   4    -11.2009067 -0.295141E-02  0.331E-01    1.51       1.0  T
   5    -11.2013320 -0.425233E-03  0.914E-02    1.50       1.0  T
   6    -11.2013653 -0.333093E-04  0.235E-02    1.50       1.9  T
   7    -11.2013659 -0.607512E-06  0.128E-02    1.50       3.5  T
   8    -11.2013666 -0.756030E-06  0.380E-03    1.50      11.8  T
   9    -11.2013667 -0.123254E-07  0.161E-03    1.50      27.8  T
  10    -11.2013667 -0.208428E-07  0.369E-04    1.50     121.2  T
  11    -11.2013667 -0.453769E-09  0.948E-05    1.50     471.5  T
     SCC iter.                  ...        0 min,  0.001 sec
     gradient                   ...        0 min,  0.001 sec
 * total energy  :   -11.0662362 Eh     change        0.6623613E-06 Eh
   gradient norm :     0.0849653 Eh/α   predicted    -0.4412392E-02 (*******%)
   displ. norm   :     0.0855959 α      lambda       -0.4886937E-02
   maximum displ.:     0.0722614 α      in ANC's #5, #6, #9, ...

........................................................................
.............................. CYCLE   14 ..............................
........................................................................
   1    -11.2186602 -0.112187E+02  0.867E-01    1.56       0.0  T
   2    -11.2101705  0.848976E-02  0.109E+00    1.63       1.0  T
   3    -11.2188294 -0.865893E-02  0.592E-01    1.56       1.0  T
   4    -11.2205411 -0.171171E-02  0.139E-01    1.56       1.0  T
   5    -11.2206011 -0.599625E-04  0.267E-02    1.57       1.7  T
   6    -11.2206010  0.519333E-07  0.803E-03    1.57       5.6  T
   7    -11.2206012 -0.145972E-06  0.474E-03    1.57       9.4  T
   8    -11.2206013 -0.119681E-06  0.216E-03    1.57      20.7  T
   9    -11.2206013 -0.725504E-08  0.915E-04    1.57      48.9  T
  10    -11.2206013 -0.682489E-08  0.120E-04    1.57     373.1  T
     SCC iter.                  ...        0 min,  0.001 sec
     gradient                   ...        0 min,  0.001 sec
 * total energy  :   -11.0692576 Eh     change       -0.3021415E-02 Eh
   gradient norm :     0.0684500 Eh/α   predicted    -0.2461372E-02 ( -18.54%)
   displ. norm   :     0.0389596 α      lambda       -0.1193973E-02
   maximum displ.:     0.0227152 α      in ANC's #6, #1, #5, ...

........................................................................
.............................. CYCLE   15 ..............................
........................................................................
   1    -11.2278160 -0.112278E+02  0.283E-01    1.55       0.0  T
   2    -11.2269367  0.879287E-03  0.368E-01    1.57       1.0  T
   3    -11.2278891 -0.952374E-03  0.169E-01    1.55       1.0  T
   4    -11.2280103 -0.121154E-03  0.291E-02    1.55       1.5  T
   5    -11.2280130 -0.274647E-05  0.852E-03    1.55       5.2  T
   6    -11.2280130 -0.159043E-07  0.184E-03    1.55      24.2  T
   7    -11.2280130  0.261931E-08  0.115E-03    1.55      38.9  T
   8    -11.2280130 -0.699733E-08  0.564E-04    1.55      79.3  T
   9    -11.2280130  0.308805E-09  0.395E-04    1.55     113.2  T
     SCC iter.                  ...        0 min,  0.001 sec
     gradient                   ...        0 min,  0.001 sec
 * total energy  :   -11.0702434 Eh     change       -0.9858275E-03 Eh
   gradient norm :     0.0675581 Eh/α   predicted    -0.5978903E-03 ( -39.35%)
   displ. norm   :     0.1422200 α      lambda       -0.3332436E-02
   maximum displ.:     0.1101015 α      in ANC's #1, #6, #9, ...

........................................................................
.............................. CYCLE   16 ..............................
........................................................................
   1    -11.2384717 -0.112385E+02  0.741E-01    1.44       0.0  T
   2    -11.2360294  0.244226E-02  0.694E-01    1.43       1.0  T
   3    -11.2368274 -0.798040E-03  0.593E-01    1.44       1.0  T
   4    -11.2390223 -0.219490E-02  0.408E-02    1.43       1.1  T
   5    -11.2390254 -0.307454E-05  0.222E-02    1.43       2.0  T
   6    -11.2390255 -0.123903E-06  0.764E-03    1.43       5.9  T
   7    -11.2390257 -0.168222E-06  0.217E-03    1.43      20.6  T
   8    -11.2390257 -0.142524E-07  0.858E-04    1.43      52.2  T
   9    -11.2390257 -0.225644E-09  0.378E-04    1.43     118.2  T
     SCC iter.                  ...        0 min,  0.001 sec
     gradient                   ...        0 min,  0.001 sec
 * total energy  :   -11.0727109 Eh     change       -0.2467460E-02 Eh
   gradient norm :     0.0591909 Eh/α   predicted    -0.1699918E-02 ( -31.11%)
   displ. norm   :     0.1787527 α      lambda       -0.2895630E-02
   maximum displ.:     0.1465562 α      in ANC's #1, #6, #9, ...

........................................................................
.............................. CYCLE   17 ..............................
........................................................................
   1    -11.2399575 -0.112400E+02  0.845E-01    1.21       0.0  T
   2    -11.2394019  0.555571E-03  0.529E-01    1.18       1.0  T
   3    -11.2347191  0.468280E-02  0.863E-01    1.25       1.0  T
   4    -11.2400689 -0.534984E-02  0.186E-01    1.20       1.0  T
   5    -11.2402560 -0.187061E-03  0.252E-02    1.20       1.8  T
   6    -11.2402558  0.156970E-06  0.913E-03    1.20       4.9  T
   7    -11.2402560 -0.173650E-06  0.285E-03    1.20      15.7  T
   8    -11.2402560 -0.319626E-07  0.137E-03    1.20      32.6  T
   9    -11.2402560  0.371229E-08  0.113E-03    1.20      39.6  T
  10    -11.2402560 -0.966590E-08  0.171E-04    1.20     261.1  T
  11    -11.2402560 -0.931060E-10  0.170E-05    1.20    2629.8  T
     SCC iter.                  ...        0 min,  0.001 sec
     gradient                   ...        0 min,  0.001 sec
 * total energy  :   -11.0745225 Eh     change       -0.1811618E-02 Eh
   gradient norm :     0.0291762 Eh/α   predicted    -0.1494073E-02 ( -17.53%)
   displ. norm   :     0.0480323 α      lambda       -0.4979986E-03
   maximum displ.:     0.0285644 α      in ANC's #1, #9, #3, ...

........................................................................
.............................. CYCLE   18 ..............................
........................................................................
   1    -11.2404459 -0.112404E+02  0.254E-01    1.11       0.0  T
   2    -11.2404509 -0.498009E-05  0.149E-01    1.10       1.0  T
   3    -11.2402833  0.167605E-03  0.163E-01    1.11       1.0  T
   4    -11.2403517 -0.684859E-04  0.134E-01    1.10       1.0  T
   5    -11.2404803 -0.128564E-03  0.866E-03    1.10       5.2  T
   6    -11.2404805 -0.186100E-06  0.423E-03    1.11      10.6  T
   7    -11.2404805 -0.291040E-07  0.134E-03    1.11      33.3  T
   8    -11.2404805 -0.529625E-08  0.601E-04    1.11      74.4  T
   9    -11.2404805 -0.115610E-08  0.143E-04    1.11     313.3  T
     SCC iter.                  ...        0 min,  0.001 sec
     gradient                   ...        0 min,  0.001 sec
 * total energy  :   -11.0748039 Eh     change       -0.2813486E-03 Eh
   gradient norm :     0.0170724 Eh/α   predicted    -0.2495734E-03 ( -11.29%)
   displ. norm   :     0.0159816 α      lambda       -0.1221427E-03
   maximum displ.:     0.0115399 α      in ANC's #1, #4, #3, ...

........................................................................
.............................. CYCLE   19 ..............................
........................................................................
   1    -11.2386173 -0.112386E+02  0.853E-02    1.07       0.0  T
   2    -11.2386173 -0.748602E-07  0.483E-02    1.07       1.0  T
   3    -11.2385944  0.229246E-04  0.637E-02    1.08       1.0  T
   4    -11.2386116 -0.171436E-04  0.372E-02    1.07       1.2  T
   5    -11.2386214 -0.984680E-05  0.371E-03    1.07      12.1  T
   6    -11.2386214 -0.498238E-08  0.228E-03    1.07      19.6  T
   7    -11.2386214 -0.245853E-07  0.381E-04    1.07     117.3  T
   8    -11.2386214 -0.381409E-09  0.288E-04    1.07     155.4  T
     SCC iter.                  ...        0 min,  0.001 sec
     gradient                   ...        0 min,  0.001 sec
 * total energy  :   -11.0748971 Eh     change       -0.9320700E-04 Eh
   gradient norm :     0.0138760 Eh/α   predicted    -0.6108602E-04 ( -34.46%)
   displ. norm   :     0.0300420 α      lambda       -0.2435978E-03
   maximum displ.:     0.0223289 α      in ANC's #4, #6, #1, ...

........................................................................
.............................. CYCLE   20 ..............................
........................................................................
   1    -11.2369051 -0.112369E+02  0.120E-01    1.05       0.0  T
   2    -11.2369050  0.849670E-07  0.797E-02    1.05       1.0  T
   3    -11.2368465  0.585302E-04  0.914E-02    1.06       1.0  T
   4    -11.2368830 -0.365180E-04  0.635E-02    1.05       1.0  T
   5    -11.2369114 -0.284447E-04  0.606E-03    1.05       7.4  T
   6    -11.2369115 -0.717602E-07  0.530E-04    1.05      84.3  T
   7    -11.2369115  0.848210E-10  0.379E-04    1.05     118.0  T
     SCC iter.                  ...        0 min,  0.001 sec
     gradient                   ...        0 min,  0.001 sec
 * total energy  :   -11.0750727 Eh     change       -0.1756358E-03 Eh
   gradient norm :     0.0144407 Eh/α   predicted    -0.1219081E-03 ( -30.59%)
   displ. norm   :     0.0445159 α      lambda       -0.2969414E-03
   maximum displ.:     0.0240919 α      in ANC's #6, #4, #1, ...
 * RMSD in coord.:     1.0583436 α      energy gain  -0.1404105E+00 Eh

generating ANC from model Hessian ...
Using Lindh-Hessian (1995)
 Shifting diagonal of input Hessian by    0.0000000000000000     
 Lowest  eigenvalues of input Hessian
   -0.000000   -0.000000   -0.000000   -0.000000    0.000000    0.000000
    0.010581    0.083540    0.212113    0.387333    0.994278    1.002326
    1.406754    1.749967    2.098029
 Highest eigenvalues
    0.387333    0.994278    1.002326    1.406754    1.749967    2.098029


........................................................................
.............................. CYCLE   21 ..............................
........................................................................
   1    -11.2355274 -0.112355E+02  0.135E-01    1.05       0.0  T
   2    -11.2355276 -0.212528E-06  0.822E-02    1.05       1.0  T
   3    -11.2354720  0.556298E-04  0.837E-02    1.05       1.0  T
   4    -11.2355262 -0.542486E-04  0.221E-02    1.05       2.0  T
   5    -11.2355291 -0.289668E-05  0.529E-03    1.05       8.5  T
   6    -11.2355291  0.478786E-07  0.285E-03    1.05      15.7  T
   7    -11.2355291 -0.624251E-07  0.626E-04    1.05      71.4  T
   8    -11.2355291 -0.771315E-09  0.262E-04    1.05     170.8  T
     SCC iter.                  ...        0 min,  0.001 sec
     gradient                   ...        0 min,  0.001 sec
 * total energy  :   -11.0753084 Eh     change       -0.2356667E-03 Eh
   gradient norm :     0.0153604 Eh/α   predicted     0.0000000E+00 (-100.00%)
   displ. norm   :     0.4281824 α      lambda       -0.2647677E-02
   maximum displ.:     0.4275728 α      in ANC's #1, #2, #6, ...

........................................................................
.............................. CYCLE   22 ..............................
........................................................................
   1    -11.2208799 -0.112209E+02  0.143E+00    1.14       0.0  T
   2    -11.2146049  0.627493E-02  0.125E+00    1.22       1.0  T
   3    -11.2048652  0.973980E-02  0.152E+00    1.12       1.0  T
   4    -11.2217983 -0.169331E-01  0.125E-01    1.15       1.0  T
   5    -11.2218539 -0.556399E-04  0.556E-02    1.15       1.0  T
   6    -11.2218529  0.104340E-05  0.216E-02    1.15       2.1  T
   7    -11.2218557 -0.279731E-05  0.625E-03    1.15       7.2  T
   8    -11.2218557 -0.761561E-07  0.274E-03    1.15      16.3  T
   9    -11.2218558 -0.197857E-07  0.884E-04    1.15      50.6  T
  10    -11.2218558  0.578188E-09  0.766E-04    1.15      58.4  T
     SCC iter.                  ...        0 min,  0.001 sec
     gradient                   ...        0 min,  0.001 sec
 * total energy  :   -11.0739143 Eh     change        0.1394107E-02 Eh
   gradient norm :     0.0484041 Eh/α   predicted    -0.1566565E-02 (-212.37%)
   displ. norm   :     0.2326307 α      lambda       -0.5504040E-02
   maximum displ.:     0.2252191 α      in ANC's #1, #2, #4, ...

........................................................................
.............................. CYCLE   23 ..............................
........................................................................
   1    -11.2401891 -0.112402E+02  0.785E-01    1.20       0.0  T
   2    -11.2382471  0.194197E-02  0.725E-01    1.18       1.0  T
   3    -11.2374260  0.821162E-03  0.687E-01    1.23       1.0  T
   4    -11.2405058 -0.307984E-02  0.900E-02    1.19       1.0  T
   5    -11.2405340 -0.281311E-04  0.395E-02    1.20       1.1  T
   6    -11.2405383 -0.435133E-05  0.156E-02    1.19       2.9  T
   7    -11.2405392 -0.920046E-06  0.485E-03    1.19       9.2  T
   8    -11.2405393 -0.103352E-06  0.215E-03    1.19      20.8  T
   9    -11.2405393  0.212321E-08  0.136E-03    1.19      32.9  T
  10    -11.2405393 -0.135765E-07  0.325E-04    1.19     137.4  T
  11    -11.2405393 -0.341762E-09  0.305E-05    1.19    1466.4  T
     SCC iter.                  ...        0 min,  0.001 sec
     gradient                   ...        0 min,  0.001 sec
 * total energy  :   -11.0761615 Eh     change       -0.2247234E-02 Eh
   gradient norm :     0.0057022 Eh/α   predicted    -0.2900949E-02 (  29.09%)
   displ. norm   :     0.0278496 α      lambda       -0.5200251E-04
   maximum displ.:     0.0275577 α      in ANC's #1, #4, #6, ...

........................................................................
.............................. CYCLE   24 ..............................
........................................................................
   1    -11.2402339 -0.112402E+02  0.947E-02    1.20       0.0  T
   2    -11.2402003  0.336100E-04  0.880E-02    1.21       1.0  T
   3    -11.2401898  0.105025E-04  0.871E-02    1.20       1.0  T
   4    -11.2402394 -0.495328E-04  0.121E-02    1.20       3.7  T
   5    -11.2402400 -0.661348E-06  0.514E-03    1.20       8.7  T
   6    -11.2402401 -0.641375E-07  0.617E-04    1.20      72.5  T
   7    -11.2402401  0.707026E-10  0.442E-04    1.20     101.2  T
     SCC iter.                  ...        0 min,  0.001 sec
     gradient                   ...        0 min,  0.001 sec
 * total energy  :   -11.0761980 Eh     change       -0.3651156E-04 Eh
   gradient norm :     0.0018847 Eh/α   predicted    -0.2602056E-04 ( -28.73%)
   displ. norm   :     0.0309567 α      lambda       -0.1513959E-04
   maximum displ.:     0.0303513 α      in ANC's #1, #4, #6, ...

........................................................................
.............................. CYCLE   25 ..............................
........................................................................
   1    -11.2403369 -0.112403E+02  0.102E-01    1.21       0.0  T
   2    -11.2403211  0.158434E-04  0.768E-02    1.22       1.0  T
   3    -11.2402327  0.883795E-04  0.118E-01    1.21       1.0  T
   4    -11.2403399 -0.107226E-03  0.129E-02    1.21       3.5  T
   5    -11.2403406 -0.688788E-06  0.530E-03    1.21       8.4  T
   6    -11.2403407 -0.632369E-07  0.703E-04    1.21      63.6  T
   7    -11.2403407  0.576497E-09  0.614E-04    1.21      72.8  T
     SCC iter.                  ...        0 min,  0.001 sec
     gradient                   ...        0 min,  0.001 sec
 * total energy  :   -11.0762033 Eh     change       -0.5313206E-05 Eh
   gradient norm :     0.0017573 Eh/α   predicted    -0.7572395E-05 (  42.52%)
   displ. norm   :     0.0092163 α      lambda       -0.3221582E-05
   maximum displ.:     0.0090554 α      in ANC's #1, #6, #2, ...

........................................................................
.............................. CYCLE   26 ..............................
........................................................................
   1    -11.2405094 -0.112405E+02  0.302E-02    1.21       0.0  T
   2    -11.2405075  0.195159E-05  0.248E-02    1.21       1.8  T
   3    -11.2405022  0.525266E-05  0.321E-02    1.22       1.4  T
   4    -11.2405098 -0.750996E-05  0.378E-03    1.21      11.8  T
   5    -11.2405098 -0.718057E-07  0.175E-03    1.21      25.5  T
   6    -11.2405098  0.267534E-08  0.133E-03    1.21      33.8  T
   7    -11.2405098 -0.125520E-07  0.257E-04    1.21     174.0  T
   8    -11.2405098 -0.218323E-09  0.139E-04    1.21     322.7  T
     SCC iter.                  ...        0 min,  0.001 sec
     gradient                   ...        0 min,  0.001 sec
 * total energy  :   -11.0762057 Eh     change       -0.2379939E-05 Eh
   gradient norm :     0.0002263 Eh/α   predicted    -0.1612009E-05 ( -32.27%)
   displ. norm   :     0.0005781 α      lambda       -0.5003420E-07
   maximum displ.:     0.0004952 α      in ANC's #2, #6, #9, ...

   *** GEOMETRY OPTIMIZATION CONVERGED AFTER 26 ITERATIONS ***

------------------------------------------------------------------------
 total energy gain   :        -0.1415435 Eh      -88.8199 kcal/mol
 total RMSD          :         0.9850501 a0        0.5213 Å
 total power (kW/mol):       -14.2931665 (step)-3709.0639 (real)
------------------------------------------------------------------------

 ANCopt (total)                0 d,  0 h,  0 min,  0.100 sec
 optimizer setup                ...        0 min,  0.000 sec (  0.053%)
 model hessian                  ...        0 min,  0.000 sec (  0.114%)
 ANC generation                 ...        0 min,  0.000 sec (  0.083%)
 coordinate transformation      ...        0 min,  0.000 sec (  0.052%)
 single point calculation       ...        0 min,  0.098 sec ( 97.879%)
 optimization log               ...        0 min,  0.001 sec (  0.574%)
 hessian update                 ...        0 min,  0.000 sec (  0.051%)
 rational function              ...        0 min,  0.001 sec (  0.520%)

================
 final structure:
================
5
 xtb: 6.2.2 (9d81278992624c895f80dd42a50cac0aa55982e2)
C         1.95145267796641   -0.00982032480313   -0.07477635500587
C         0.66780479562353   -0.00800522650492   -0.19861249009165
N        -1.50283777497910    0.01675179659164    0.39976755356598
C        -0.55496237406309    0.81245685468026   -0.08500535090943
C        -0.56145732454775   -0.81138309996385   -0.04137435755904

 Bond Distances (Angstroems)
 ---------------------------
C1-C2=1.2896         C2-C1=1.2896         C2-C4=1.4769         C2-C5=1.4769         N3-C4=1.3291         N3-C5=1.3291         
C4-C2=1.4769         C4-N3=1.3291         C4-C5=1.6244         C5-C2=1.4769         C5-N3=1.3291         C5-C4=1.6244         
 C  C  Rav=1.4670 sigma=0.1188  Rmin=1.2896  Rmax=1.6244     4
 N  C  Rav=1.3291 sigma=0.0000  Rmin=1.3291  Rmax=1.3291     2

 selected bond angles (degree)
 --------------------
C4-C2-C1=144.84                C5-C2-C1=144.83                C5-C2-C4= 66.73                C5-N3-C4= 75.34                
N3-C4-C2=106.61                C5-C4-C2= 56.64                C5-C4-N3= 52.33                N3-C5-C2=106.61                
C4-C5-C2= 56.64                C4-C5-N3= 52.33                

 selected dihedral angles (degree)
 ---------------------------------
N3-C4-C2-C1=217.09            N3-C4-C2-C5= 16.26            C5-C4-C2-C1=200.83            C2-C4-N3-C5=342.82            
N3-C5-C2-C1=142.91            N3-C5-C2-C4=343.74            C4-C5-C2-C1=159.17            C2-C5-N3-C4= 17.18            
C2-C5-C4-N3=199.81            N3-C5-C4-C2=160.19            
           -------------------------------------------------
          |                Final Singlepoint                |
           -------------------------------------------------

          ...................................................
          :                      SETUP                      :
          :.................................................:
          :  # basis functions                  20          :
          :  # atomic orbitals                  20          :
          :  # shells                           10          :
          :  # electrons                        21          :
          :  max. iterations                   250          :
          :  Hamiltonian                  GFN2-xTB          :
          :  restarted?                      false          :
          :  GBSA solvation                  false          :
          :  PC potential                    false          :
          :  electronic temp.          300.0000000     K    :
          :  accuracy                    1.0000000          :
          :  -> integral cutoff          0.2500000E+02      :
          :  -> integral neglect         0.1000000E-07      :
          :  -> SCF convergence          0.1000000E-05 Eh   :
          :  -> wf. convergence          0.1000000E-03 e    :
          :  Broyden damping             0.4000000          :
          ...................................................

 iter      E             dE          RMSdq      gap      omega  full diag
   1    -11.2405098 -0.112405E+02  0.370E-05    1.21       0.0  T
   2    -11.2405098  0.390443E-11  0.384E-05    1.21    1165.6  T
   3    -11.2405098 -0.247979E-11  0.198E-05    1.21    2255.6  T

   *** convergence criteria satisfied after 3 iterations ***

         #    Occupation            Energy/Eh            Energy/eV
      -------------------------------------------------------------
         1        2.0000           -0.7713887             -20.9906
       ...           ...                  ...                  ...
         5        2.0000           -0.5967131             -16.2374
         6        2.0000           -0.5740977             -15.6220
         7        2.0000           -0.5023187             -13.6688
         8        2.0000           -0.4850879             -13.1999
         9        2.0000           -0.4729072             -12.8685
        10        2.0000           -0.4495964             -12.2341
        11        1.0000           -0.4203565             -11.4385 (HOMO)
        12                         -0.3757449             -10.2245 (LUMO)
        13                         -0.3432698              -9.3408
        14                         -0.2799870              -7.6188
        15                         -0.2091297              -5.6907
        16                          0.0796858               2.1684
       ...                                ...                  ...
        20                          0.7500668              20.4104
      -------------------------------------------------------------
                  HL-Gap            0.0446116 Eh            1.2139 eV
             Fermi-level           -0.4165136 Eh          -11.3339 eV

 SCC (total)                   0 d,  0 h,  0 min,  0.003 sec
 SCC setup                      ...        0 min,  0.000 sec (  1.408%)
 Dispersion                     ...        0 min,  0.000 sec (  0.515%)
 integral evaluation            ...        0 min,  0.001 sec ( 41.390%)
 zeroth order Hamiltonian       ...        0 min,  0.000 sec (  0.494%)
 iterations                     ...        0 min,  0.000 sec ( 11.689%)
 molecular gradient             ...        0 min,  0.001 sec ( 42.754%)
 printout                       ...        0 min,  0.000 sec (  1.488%)

         :::::::::::::::::::::::::::::::::::::::::::::::::::::
         ::                     SUMMARY                     ::
         :::::::::::::::::::::::::::::::::::::::::::::::::::::
         :: total energy             -11.076205704113 Eh    ::
         :: gradient norm              0.000225866261 Eh/a0 ::
         :: HOMO-LUMO gap              1.213943775139 eV    ::
         ::.................................................::
         :: SCC energy               -11.240509836429 Eh    ::
         :: -> isotropic ES           -0.007707282186 Eh    ::
         :: -> anisotropic ES          0.005193077773 Eh    ::
         :: -> anisotropic XC          0.012585571469 Eh    ::
         :: -> dispersion             -0.002847604720 Eh    ::
         :: repulsion energy           0.164304141680 Eh    ::
         :: add. restraining           0.000000000000 Eh    ::
         :::::::::::::::::::::::::::::::::::::::::::::::::::::

           ------------------------------------------------- 
          |                Numerical Hessian                |
           ------------------------------------------------- 
step length          :   0.00500
SCC accuracy         :   0.30000
Hessian scale factor :   1.00000
frozen atoms in %    :   0.00000    0
RMS gradient         :   0.00023
estimated CPU  time      0.00 min
estimated wall time      0.00 min

writing file <hessian>.

 projected vibrational frequencies (cm-1)
eigval :       -0.00    -0.00    -0.00    -0.00     0.00     0.00
eigval :      191.45   208.01   454.27   591.22   669.96   802.70
eigval :     1050.99  1539.31  1755.45
           -------------------------------------------------
          |                Property Printout                |
           -------------------------------------------------

    * Orbital Energies and Occupations

         #    Occupation            Energy/Eh            Energy/eV
      -------------------------------------------------------------
         1        2.0000           -0.7713891             -20.9906
         2        2.0000           -0.6930005             -18.8575
         3        2.0000           -0.6453773             -17.5616
         4        2.0000           -0.6429075             -17.4944
         5        2.0000           -0.5967135             -16.2374
         6        2.0000           -0.5740979             -15.6220
         7        2.0000           -0.5023188             -13.6688
         8        2.0000           -0.4850883             -13.1999
         9        2.0000           -0.4729070             -12.8685
        10        2.0000           -0.4495960             -12.2341
        11        1.0000           -0.4203564             -11.4385 (HOMO)
        12                         -0.3757449             -10.2245 (LUMO)
        13                         -0.3432697              -9.3408
        14                         -0.2799871              -7.6188
        15                         -0.2091296              -5.6907
        16                          0.0796856               2.1684
        17                          0.1326837               3.6105
        18                          0.1843157               5.0155
        19                          0.2763102               7.5188
        20                          0.7500670              20.4104
      -------------------------------------------------------------
                  HL-Gap            0.0446115 Eh            1.2139 eV
             Fermi-level           -0.4165134 Eh          -11.3339 eV

     #   Z        covCN         q      C6AA      α(0)
     1   6 C      0.981    -0.126    39.974    10.620
     2   6 C      2.981     0.087    26.061     8.374
     3   7 N      1.864    -0.097    23.895     7.246
     4   6 C      2.847     0.068    26.473     8.433
     5   6 C      2.847     0.068    26.473     8.433

 Mol. C6AA /au·bohr⁶  :        706.754247
 Mol. C8AA /au·bohr⁸  :      19502.743095
 Mol. α(0) /au        :         43.104239


Wiberg/Mayer (AO) data.
largest (>0.10) Wiberg bond orders for each atom
          total WBO             WBO to atom ...
     1  C   2.353        C    2 1.959    N    3 0.194
     2  C   3.857        C    1 1.959    C    4 0.904    C    5 0.904
     3  N   2.946        C    5 1.331    C    4 1.331    C    1 0.194
     4  C   3.041        N    3 1.331    C    2 0.904    C    5 0.706
     5  C   3.041        N    3 1.331    C    2 0.904    C    4 0.706

MOs/occ written to file <molden.input>
Molecule has the following symmetry elements: (sigma) 
It seems to be the Cs point group


molecular dipole:
                 x           y           z       tot (Debye)
 q only:       -0.222      -0.002      -0.104
   full:       -0.445      -0.004      -0.210       1.250
molecular quadrupole (traceless):
                xx          xy          yy          xz          yz          zz
 q only:       -2.340       0.025       1.443       0.374      -0.016       0.898
  q+dip:       -4.626       0.050       1.598       0.925       0.035       3.028
   full:       -7.153       0.080       2.247       1.569       0.065       4.906

           -------------------------------------------------
          |                Geometry Summary                 |
           -------------------------------------------------

      molecular mass/u    :       62.0496468
   center of mass at/Å    :       -0.0483421       0.0005391       0.0128594
  moments of inertia/u·Å² :        0.1737741E+02   0.9294064E+02   0.1072572E+03
rotational constants/cm⁻¹ :        0.9700887E+00   0.1813806E+00   0.1571702E+00

 * 3 selected distances

     #   Z        #   Z                                     value/Å
     1   6 C      2   6 C                                 1.2896087 (min)
     3   7 N      4   6 C                                 1.3291422 (max)
     3   7 N      5   6 C                                 1.3291391

 * 2 distinct bonds (by element types)

   Z      Z             #   av. dist./Å        max./Å        min./Å
   6 C    6 C           1     1.2896087     1.2896087     1.2896087
   6 C    7 N           2     1.3291407     1.3291422     1.3291391

           -------------------------------------------------
          |               Frequency Printout                |
           -------------------------------------------------
 projected vibrational frequencies (cm-1)
eigval :       -0.00    -0.00    -0.00    -0.00     0.00     0.00
eigval :      191.45   208.01   454.27   591.22   669.96   802.70
eigval :     1050.99  1539.31  1755.45
 reduced masses (amu)
   1: 12.28   2: 12.92   3: 12.64   4: 12.21   5: 12.26   6: 12.44   7: 12.11   8: 12.60
   9: 12.01  10: 12.33  11: 12.50  12: 12.81  13: 12.03  14: 12.96  15: 12.05
 IR intensities (amu)
   1:  0.11   2:  0.03   3:  0.07   4:  0.07   5:  0.10   6:  0.01   7:  0.56   8:  0.44
   9:  1.02  10:  0.35  11:  0.39  12:  1.56  13:  0.20  14:  1.15  15:  0.33
 Raman intensities (amu)
   1:  0.00   2:  0.00   3:  0.00   4:  0.00   5:  0.00   6:  0.00   7:  0.00   8:  0.00
   9:  0.00  10:  0.00  11:  0.00  12:  0.00  13:  0.00  14:  0.00  15:  0.00
 output can be read by thermo (or use thermo option).
 writing <g98.out> molden fake output.
 recommended (thermochemical) frequency scaling factor: 1.0
           -------------------------------------------------
          |             Thermodynamic Functions             |
           -------------------------------------------------

cs  symmetry found (for desy threshold:  0.10E+00) used in thermo

          ...................................................
          :                      SETUP                      :
          :.................................................:
          :  # frequencies                           9      :
          :  # imaginary freq.                       0      :
          :  linear?                             false      :
          :  only rotor calc.                    false      :
          :  symmetry                               cs      :
          :  rotational number                       1      :
          :  scaling factor                  1.0000000      :
          :  rotor cutoff                   50.0000000 cm⁻¹ :
          :  imag. cutoff                  -20.0000000 cm⁻¹ :
          :.................................................:

    mode    ω/cm⁻¹     T·S(HO)/kcal·mol⁻¹    T·S(FR)/kcal·mol⁻¹   T·S(vib)
   ------------------------------------------------------------------------
       1    191.45    -0.00000 ( 99.54%)     0.01165 (  0.46%)     0.00005
       2    208.01    -0.00000 ( 99.67%)     0.01247 (  0.33%)     0.00004
   ------------------------------------------------------------------------

   temp. (K)  partition function   enthalpy   heat capacity  entropy
                                   cal/mol     cal/K/mol   cal/K/mol   J/K/mol
 298.15  VIB   3.35                 1121.154      8.036      6.162
         ROT  0.318E+05              888.752      2.981     23.583
         INT  0.106E+06             2009.906     11.017     29.745
         TR   0.473E+27             1481.254      4.968     38.278
         TOT                        3491.1600    15.9852    68.0232   284.6089

   temp. (K)  partition function   enthalpy   heat capacity  entropy
                                   cal/mol     cal/K/mol   cal/K/mol   J/K/mol
 120.00  VIB   1.22                  122.660      2.912      1.420
         ROT  0.812E+04              357.707      2.981     20.870
         INT  0.989E+04              480.366      5.892     22.290
         TR   0.121E+27              596.178      4.968     33.759
         TOT                        1076.5444    10.8606    56.0489   234.5088

   temp. (K)  partition function   enthalpy   heat capacity  entropy
                                   cal/mol     cal/K/mol   cal/K/mol   J/K/mol
 100.00  VIB   1.13                   70.978      2.251      0.951
         ROT  0.618E+04              298.089      2.981     20.326
         INT  0.696E+04              369.067      5.232     21.278
         TR   0.919E+26              496.815      4.968     32.853
         TOT                         865.8818    10.2001    54.1310   226.4841

   temp. (K)  partition function   enthalpy   heat capacity  entropy
                                   cal/mol     cal/K/mol   cal/K/mol   J/K/mol
  80.00  VIB   1.06                   32.951      1.541      0.530
         ROT  0.442E+04              238.471      2.981     19.661
         INT  0.468E+04              271.423      4.522     20.191
         TR   0.657E+26              397.452      4.968     31.745
         TOT                         668.8746     9.4900    51.9362   217.3012

   temp. (K)  partition function   enthalpy   heat capacity  entropy
                                   cal/mol     cal/K/mol   cal/K/mol   J/K/mol
  60.00  VIB   1.02                    9.718      0.780      0.200
         ROT  0.287E+04              178.853      2.981     18.804
         INT  0.292E+04              188.572      3.761     19.003
         TR   0.427E+26              298.089      4.968     30.317
         TOT                         486.6609     8.7292    49.3202   206.3556

   temp. (K)  partition function   enthalpy   heat capacity  entropy
                                   cal/mol     cal/K/mol   cal/K/mol   J/K/mol
  40.00  VIB   1.00                    0.895      0.159      0.027
         ROT  0.156E+04              119.236      2.981     17.595
         INT  0.156E+04              120.131      3.140     17.622
         TR   0.232E+26              198.726      4.968     28.303
         TOT                         318.8566     8.1083    45.9251   192.1508

   temp. (K)  partition function   enthalpy   heat capacity  entropy
                                   cal/mol     cal/K/mol   cal/K/mol   J/K/mol
  20.00  VIB   1.00                    0.001      0.001     -0.004
         ROT   552.                   59.618      2.981     15.529
         INT   552.                   59.619      2.981     15.525
         TR   0.822E+25               99.363      4.968     24.861
         TOT                         158.9816     7.9496    40.3859   168.9747

   temp. (K)  partition function   enthalpy   heat capacity  entropy
                                   cal/mol     cal/K/mol   cal/K/mol   J/K/mol
  10.00  VIB   1.00                    0.000      0.000     -0.010
         ROT   195.                   29.809      2.981     13.463
         INT   195.                   29.809      2.981     13.453
         TR   0.290E+25               49.681      4.968     21.419
         TOT                          79.4904     7.9490    34.8721   145.9047

       T/K    H(0)-H(T)+PV         H(T)/Eh          T*S/Eh         G(T)/Eh
   ------------------------------------------------------------------------
    298.15    0.556352E-02    0.221106E-01    0.323200E-01   -0.102094E-01
    120.00    0.171558E-02    0.182627E-01    0.107184E-01    0.754434E-02
    100.00    0.137987E-02    0.179270E-01    0.862632E-02    0.930067E-02
     80.00    0.106592E-02    0.176130E-01    0.662125E-02    0.109918E-01
     60.00    0.775543E-03    0.173227E-01    0.471580E-02    0.126069E-01
     40.00    0.508130E-03    0.170552E-01    0.292745E-02    0.141278E-01
     20.00    0.253353E-03    0.168005E-01    0.128718E-02    0.155133E-01
     10.00    0.126676E-03    0.166738E-01    0.555722E-03    0.161181E-01 (used)
   ------------------------------------------------------------------------

         :::::::::::::::::::::::::::::::::::::::::::::::::::::
         ::                  THERMODYNAMIC                  ::
         :::::::::::::::::::::::::::::::::::::::::::::::::::::
         :: total free energy         -11.060087631742 Eh   ::
         ::.................................................::
         :: total energy              -11.076205704829 Eh   ::
         :: zero point energy           0.016547118717 Eh   ::
         :: G(RRHO) w/o ZPVE           -0.000429045630 Eh   ::
         :: G(RRHO) contrib.            0.016118073087 Eh   ::
         :::::::::::::::::::::::::::::::::::::::::::::::::::::

optimized geometry written to: xtbopt.xyz


           -------------------------------------------------
          | TOTAL ENERGY              -11.076205704829 Eh   |
          | TOTAL ENTHALPY            -11.059531910097 Eh   |
          | TOTAL FREE ENERGY         -11.060087631742 Eh   |
          | GRADIENT NORM               0.000225096122 Eh/α |
          | HOMO-LUMO GAP               1.213940614192 eV   |
           -------------------------------------------------

------------------------------------------------------------------------
 * finished run on 2020/05/12 at 11:44:10.121     
------------------------------------------------------------------------
 total:
 * wall-time:     0 d,  0 h,  0 min,  0.228 sec
 *  cpu-time:     0 d,  0 h,  0 min,  0.227 sec
 * ratio c/w:     0.998 speedup
 SCF:
 * wall-time:     0 d,  0 h,  0 min,  0.005 sec
 *  cpu-time:     0 d,  0 h,  0 min,  0.005 sec
 * ratio c/w:     0.998 speedup
 ANC optimizer:
 * wall-time:     0 d,  0 h,  0 min,  0.104 sec
 *  cpu-time:     0 d,  0 h,  0 min,  0.104 sec
 * ratio c/w:     0.999 speedup
 numerical hessian:
 * wall-time:     0 d,  0 h,  0 min,  0.104 sec
 *  cpu-time:     0 d,  0 h,  0 min,  0.103 sec
 * ratio c/w:     0.998 speedup

