      -----------------------------------------------------------      
     |                   =====================                   |     
     |                           x T B                           |     
     |                   =====================                   |     
     |                         S. Grimme                         |     
     |          Mulliken Center for Theoretical Chemistry        |     
     |                    University of Bonn                     |     
      -----------------------------------------------------------      

   * xtb version 6.2.2 (9d81278992624c895f80dd42a50cac0aa55982e2) compiled by '@Darwin' on 04/03/2020

   xtb is free software: you can redistribute it and/or modify it under
   the terms of the GNU Lesser General Public License as published by
   the Free Software Foundation, either version 3 of the License, or
   (at your option) any later version.
   
   xtb is distributed in the hope that it will be useful,
   but WITHOUT ANY WARRANTY; without even the implied warranty of
   MERCHANTABILITY or FITNESS FOR A PARTICULAR PURPOSE.  See the
   GNU Lesser General Public License for more details.
   
   Cite this work as:
   * S. Grimme, C. Bannwarth, P. Shushkov, J. Chem. Theory Comput., 2017,
     13, 1989-2009. DOI: 10.1021/acs.jctc.7b00118
   * C. Bannwarth, S. Ehlert and S. Grimme., J. Chem. Theory Comput., 2019,
     15, 1652-1671. DOI: 10.1021/acs.jctc.8b01176
   * P. Pracht, E. Caldeweyher, S. Ehlert, S. Grimme, ChemRxiv, 2019, preprint.
     DOI: 10.26434/chemrxiv.8326202.v1
   
   for DFT-D4:
   * E. Caldeweyher, C. Bannwarth and S. Grimme, J. Chem. Phys., 2017,
     147, 034112. DOI: 10.1063/1.4993215
   * E. Caldeweyher, S. Ehlert, A. Hansen, H. Neugebauer, S. Spicher,
     C. Bannwarth and S. Grimme, J. Chem. Phys., 2019, 150, 154122.
     DOI: 10.1063/1.5090222
   
   for sTDA-xTB:
   * S. Grimme and C. Bannwarth, J. Chem. Phys., 2016, 145, 054103.
     DOI: 10.1063/1.4959605
   
   in the mass-spec context:
   * V. Asgeirsson, C. Bauer and S. Grimme, Chem. Sci., 2017, 8, 4879.
     DOI: 10.1039/c7sc00601b
   
   for metadynamics refer to:
   * S. Grimme, J. Chem. Theory Comput., 2019, 155, 2847-2862
     DOI: 10.1021/acs.jctc.9b00143
   
   with help from (in alphabetical order)
   C. Bannwarth, F. Bohle, G. Brandenburg, E. Caldeweyher, M. Checinski,
   S. Dohm, S. Ehlert, S. Ehrlich, F. März, H. Neugebauer, J. Pisarek,
   P. Pracht, P. Shushkov, and S. Spicher.
   
 * started run on 2020/05/12 at 11:44:18.050     

           -------------------------------------------------
          |                Calculation Setup                |
           -------------------------------------------------

          program call               : xtb --input C4N1_44_S_1.input C4N1_44_S_1.xyz --ohess --molden --namespace C4N1_44_S_1 output.out
          calculation namespace      : C4N1_44_S_1
          coordinate file            : C4N1_44_S_1.xyz
          number of atoms            :                     5
          number of electrons        :                    21
          charge                     :                     0
          spin                       :                   0.5
          first test random number   :      0.38634110065947

   ID    Z sym.   atoms
    1    6 C      1-3, 5
    2    7 N      4

           -------------------------------------------------
          |                 G F N 2 - x T B                 |
           -------------------------------------------------

        Reference                      10.1021/acs.jctc.8b01176
      * Hamiltonian:
        H0-scaling (s, p, d)           1.850000    2.230000    2.230000
        zeta-weighting                 0.500000
      * Dispersion:
        s8                             2.700000
        a1                             0.520000
        a2                             5.000000
        s9                             5.000000
      * Repulsion:
        kExp                           1.500000    1.000000
        rExp                           1.000000
      * Coulomb:
        alpha                          2.000000
        third order                    shell-resolved
        anisotropic                    true
        a3                             3.000000
        a5                             4.000000
        cn-shift                       1.200000
        cn-exp                         4.000000
        max-rad                        5.000000


          ...................................................
          :                      SETUP                      :
          :.................................................:
          :  # basis functions                  20          :
          :  # atomic orbitals                  20          :
          :  # shells                           10          :
          :  # electrons                        21          :
          :  max. iterations                   250          :
          :  Hamiltonian                  GFN2-xTB          :
          :  restarted?                      false          :
          :  GBSA solvation                  false          :
          :  PC potential                    false          :
          :  electronic temp.          300.0000000     K    :
          :  accuracy                    1.0000000          :
          :  -> integral cutoff          0.2500000E+02      :
          :  -> integral neglect         0.1000000E-07      :
          :  -> SCF convergence          0.1000000E-05 Eh   :
          :  -> wf. convergence          0.1000000E-03 e    :
          :  Broyden damping             0.4000000          :
          ...................................................

 iter      E             dE          RMSdq      gap      omega  full diag
   1    -10.6713597 -0.106714E+02  0.107E+01    2.24       0.0  T
   2     -7.9775216  0.269384E+01  0.172E+01    0.14       1.0  T
   3     -9.9874111 -0.200989E+01  0.102E+01    2.45       1.0  T
   4    -11.0229977 -0.103559E+01  0.496E+00    0.77       1.0  T
   5    -11.0547156 -0.317179E-01  0.365E+00    1.00       1.0  T
   6    -11.0467688  0.794680E-02  0.321E+00    0.92       1.0  T
   7    -11.0539659 -0.719707E-02  0.228E+00    0.93       1.0  T
   8    -11.0578841 -0.391819E-02  0.182E+00    0.97       1.0  T
   9    -11.0620045 -0.412042E-02  0.252E-01    0.93       1.0  T
  10    -11.0620570 -0.525216E-04  0.249E-01    0.95       1.0  T
  11    -11.0621359 -0.788705E-04  0.715E-02    0.94       1.0  T
  12    -11.0621419 -0.600127E-05  0.257E-02    0.93       1.7  T
  13    -11.0621411  0.762950E-06  0.362E-02    0.93       1.2  T
  14    -11.0621432 -0.211598E-05  0.432E-03    0.93      10.3  T
  15    -11.0621433 -0.214398E-07  0.160E-03    0.93      28.0  T
  16    -11.0621433 -0.987221E-08  0.405E-04    0.93     110.4  T
  17    -11.0621433 -0.716836E-09  0.156E-04    0.93     285.9  T

   *** convergence criteria satisfied after 17 iterations ***

         #    Occupation            Energy/Eh            Energy/eV
      -------------------------------------------------------------
         1        2.0000           -0.7824368             -21.2912
       ...           ...                  ...                  ...
         5        2.0000           -0.5970806             -16.2474
         6        2.0000           -0.5244835             -14.2719
         7        2.0000           -0.5074293             -13.8079
         8        2.0000           -0.4893853             -13.3169
         9        2.0000           -0.4794613             -13.0468
        10        1.9999           -0.4699274             -12.7874
        11        1.0001           -0.4516290             -12.2894 (HOMO)
        12                         -0.4173977             -11.3580 (LUMO)
        13                         -0.3762079             -10.2371
        14                         -0.2175452              -5.9197
        15                         -0.1592048              -4.3322
        16                         -0.1385980              -3.7714
       ...                                ...                  ...
        20                          0.3695442              10.0558
      -------------------------------------------------------------
                  HL-Gap            0.0342313 Eh            0.9315 eV
             Fermi-level           -0.4476458 Eh          -12.1811 eV

 SCC (total)                   0 d,  0 h,  0 min,  0.005 sec
 SCC setup                      ...        0 min,  0.000 sec (  1.582%)
 Dispersion                     ...        0 min,  0.000 sec (  0.348%)
 integral evaluation            ...        0 min,  0.001 sec ( 25.645%)
 zeroth order Hamiltonian       ...        0 min,  0.000 sec (  0.412%)
 iterations                     ...        0 min,  0.002 sec ( 42.576%)
 molecular gradient             ...        0 min,  0.001 sec ( 27.683%)
 printout                       ...        0 min,  0.000 sec (  1.558%)

         :::::::::::::::::::::::::::::::::::::::::::::::::::::
         ::                     SUMMARY                     ::
         :::::::::::::::::::::::::::::::::::::::::::::::::::::
         :: total energy             -10.953907468390 Eh    ::
         :: gradient norm              0.219438061081 Eh/a0 ::
         :: HOMO-LUMO gap              0.931480152237 eV    ::
         ::.................................................::
         :: SCC energy               -11.062143275036 Eh    ::
         :: -> isotropic ES           -0.011979335319 Eh    ::
         :: -> anisotropic ES          0.003566062216 Eh    ::
         :: -> anisotropic XC          0.008739522227 Eh    ::
         :: -> dispersion             -0.002762353399 Eh    ::
         :: repulsion energy           0.108235771661 Eh    ::
         :: add. restraining           0.000000000000 Eh    ::
         :::::::::::::::::::::::::::::::::::::::::::::::::::::

      ----------------------------------------------------------- 
     |                   =====================                   |
     |                        A N C O P T                        |
     |                   =====================                   |
     |               Approximate Normal Coordinate               |
     |                Rational Function Optimizer                |
      ----------------------------------------------------------- 

          ...................................................
          :                      SETUP                      :
          :.................................................:
          :   optimization level            normal          :
          :   max. optcycles                   200          :
          :   ANC micro-cycles                  20          :
          :   degrees of freedom                 9          :
          :.................................................:
          :   RF solver                   davidson          :
          :   write xtbopt.log                true          :
          :   linear?                        false          :
          :   energy convergence         0.5000000E-05 Eh   :
          :   grad. convergence          0.1000000E-02 Eh/α :
          :   maximium RF displ.         1.0000000          :
          :   Hlow (freq-cutoff)         0.1000000E-01      :
          :   Hmax (freq-cutoff)         5.0000000          :
          :   S6 in model hess.         20.0000000          :
          ...................................................

generating ANC from model Hessian ...
Using Lindh-Hessian (1995)
 Shifting diagonal of input Hessian by    0.0000000000000000     
 Lowest  eigenvalues of input Hessian
   -0.000000   -0.000000   -0.000000    0.000000    0.000000    0.000000
    0.062071    0.172579    0.420066    0.670977    0.800590    1.090006
    1.175024    1.334666    1.903786
 Highest eigenvalues
    0.670977    0.800590    1.090006    1.175024    1.334666    1.903786


........................................................................
.............................. CYCLE    1 ..............................
........................................................................
   1    -11.0621433 -0.110621E+02  0.285E-05    0.93       0.0  T
   2    -11.0621433  0.199769E-10  0.618E-05    0.93     723.9  T
   3    -11.0621433 -0.221192E-10  0.144E-05    0.93    3098.5  T
     SCC iter.                  ...        0 min,  0.001 sec
     gradient                   ...        0 min,  0.001 sec
 * total energy  :   -10.9539075 Eh     change        0.1346475E-08 Eh
   gradient norm :     0.2194390 Eh/α   predicted     0.0000000E+00 (-100.00%)
   displ. norm   :     0.2836056 α      lambda       -0.5246859E-01
   maximum displ.:     0.2075889 α      in ANC's #3, #5, #1, ...

........................................................................
.............................. CYCLE    2 ..............................
........................................................................
   1    -11.0938949 -0.110939E+02  0.253E+00    1.25       0.0  T
   2    -10.6799752  0.413920E+00  0.593E+00    2.41       1.0  T
   3    -11.0913053 -0.411330E+00  0.212E+00    0.97       1.0  T
   4    -11.1039689 -0.126636E-01  0.158E+00    1.21       1.0  T
   5    -11.1094352 -0.546629E-02  0.145E+00    1.29       1.0  T
   6    -11.1166194 -0.718424E-02  0.836E-01    1.32       1.0  T
   7    -11.1182953 -0.167592E-02  0.633E-01    1.36       1.0  T
   8    -11.1211249 -0.282959E-02  0.165E-01    1.49       1.0  T
   9    -11.1212006 -0.757014E-04  0.114E-01    1.50       1.0  T
  10    -11.1212186 -0.179931E-04  0.788E-02    1.54       1.0  T
  11    -11.1212475 -0.288430E-04  0.602E-03    1.52       7.4  T
  12    -11.1212475 -0.944594E-08  0.364E-03    1.52      12.3  T
  13    -11.1212475 -0.208580E-10  0.218E-03    1.52      20.5  T
  14    -11.1212475 -0.213043E-07  0.383E-04    1.52     116.8  T
  15    -11.1212475 -0.442311E-09  0.172E-05    1.52    2593.4  T
     SCC iter.                  ...        0 min,  0.001 sec
     gradient                   ...        0 min,  0.001 sec
 * total energy  :   -10.9945775 Eh     change       -0.4067008E-01 Eh
   gradient norm :     0.1069621 Eh/α   predicted    -0.2834437E-01 ( -30.31%)
   displ. norm   :     0.3062556 α      lambda       -0.2450470E-01
   maximum displ.:     0.1992084 α      in ANC's #1, #3, #5, ...

........................................................................
.............................. CYCLE    3 ..............................
........................................................................
   1    -11.1471569 -0.111472E+02  0.266E+00    1.79       0.0  T
   2    -10.7270661  0.420091E+00  0.618E+00    2.23       1.0  T
   3    -11.1403258 -0.413260E+00  0.223E+00    1.49       1.0  T
   4    -11.1431667 -0.284087E-02  0.197E+00    1.74       1.0  T
   5    -11.1573736 -0.142069E-01  0.138E+00    1.79       1.0  T
   6    -11.1636183 -0.624470E-02  0.965E-01    1.84       1.0  T
   7    -11.1629712  0.647042E-03  0.105E+00    1.82       1.0  T
   8    -11.1685681 -0.559687E-02  0.419E-01    1.99       1.0  T
   9    -11.1690157 -0.447582E-03  0.327E-01    2.01       1.0  T
  10    -11.1695697 -0.553974E-03  0.105E-01    2.06       1.0  T
  11    -11.1696273 -0.576667E-04  0.218E-02    2.08       2.1  T
  12    -11.1696180  0.933990E-05  0.433E-02    2.07       1.0  T
  13    -11.1696276 -0.961364E-05  0.118E-02    2.08       3.8  T
  14    -11.1696284 -0.834710E-06  0.163E-03    2.08      27.5  T
  15    -11.1696284 -0.721954E-08  0.118E-03    2.08      38.0  T
  16    -11.1696284 -0.807506E-08  0.246E-04    2.08     181.7  T
  17    -11.1696284 -0.346226E-09  0.441E-05    2.08    1013.8  T
     SCC iter.                  ...        0 min,  0.002 sec
     gradient                   ...        0 min,  0.001 sec
 * total energy  :   -11.0027748 Eh     change       -0.8197244E-02 Eh
   gradient norm :     0.1173773 Eh/α   predicted    -0.1340153E-01 (  63.49%)
   displ. norm   :     0.3116552 α      lambda       -0.1493590E-01
   maximum displ.:     0.2954747 α      in ANC's #1, #2, #3, ...

........................................................................
.............................. CYCLE    4 ..............................
........................................................................
   1    -11.1405990 -0.111406E+02  0.140E+00    2.02       0.0  T
   2    -11.1351775  0.542149E-02  0.129E+00    1.83       1.0  T
   3    -11.1379551 -0.277763E-02  0.106E+00    2.09       1.0  T
   4    -11.1390569 -0.110174E-02  0.718E-01    2.04       1.0  T
   5    -11.1422511 -0.319419E-02  0.213E-01    1.95       1.0  T
   6    -11.1425510 -0.299894E-03  0.700E-02    2.00       1.0  T
   7    -11.1425530 -0.206516E-05  0.495E-02    2.00       1.0  T
   8    -11.1425574 -0.439961E-05  0.956E-03    2.00       4.7  T
   9    -11.1425576 -0.200345E-06  0.435E-03    2.00      10.3  T
  10    -11.1425577 -0.358472E-07  0.486E-04    2.00      92.0  T
  11    -11.1425577 -0.256142E-09  0.277E-04    2.00     161.5  T
     SCC iter.                  ...        0 min,  0.001 sec
     gradient                   ...        0 min,  0.001 sec
 * total energy  :   -11.0106174 Eh     change       -0.7842582E-02 Eh
   gradient norm :     0.0548366 Eh/α   predicted    -0.8193307E-02 (   4.47%)
   displ. norm   :     0.0932601 α      lambda       -0.3528312E-02
   maximum displ.:     0.0506005 α      in ANC's #4, #2, #5, ...

........................................................................
.............................. CYCLE    5 ..............................
........................................................................
   1    -11.1485301 -0.111485E+02  0.837E-01    1.97       0.0  T
   2    -11.1413912  0.713882E-02  0.110E+00    2.08       1.0  T
   3    -11.1481815 -0.679021E-02  0.582E-01    1.95       1.0  T
   4    -11.1497643 -0.158288E-02  0.110E-01    2.02       1.0  T
   5    -11.1497950 -0.307048E-04  0.558E-02    2.00       1.0  T
   6    -11.1497984 -0.332271E-05  0.510E-02    2.01       1.0  T
   7    -11.1498049 -0.650286E-05  0.222E-02    2.01       2.0  T
   8    -11.1498072 -0.238207E-05  0.589E-03    2.01       7.6  T
   9    -11.1498073 -0.432103E-07  0.392E-03    2.01      11.4  T
  10    -11.1498073 -0.548706E-07  0.251E-04    2.01     178.5  T
  11    -11.1498073 -0.958487E-10  0.411E-05    2.01    1088.5  T
     SCC iter.                  ...        0 min,  0.001 sec
     gradient                   ...        0 min,  0.001 sec
 * total energy  :   -11.0136485 Eh     change       -0.3031097E-02 Eh
   gradient norm :     0.0449203 Eh/α   predicted    -0.1779498E-02 ( -41.29%)
   displ. norm   :     0.2755395 α      lambda       -0.8804020E-02
   maximum displ.:     0.1628284 α      in ANC's #4, #5, #2, ...

........................................................................
.............................. CYCLE    6 ..............................
........................................................................
   1    -11.1632889 -0.111633E+02  0.229E+00    1.70       0.0  T
   2    -11.1341325  0.291564E-01  0.226E+00    2.04       1.0  T
   3    -11.1530373 -0.189048E-01  0.171E+00    1.55       1.0  T
   4    -11.1669120 -0.138747E-01  0.769E-01    1.95       1.0  T
   5    -11.1706461 -0.373406E-02  0.194E-01    1.80       1.0  T
   6    -11.1708504 -0.204341E-03  0.108E-01    1.83       1.0  T
   7    -11.1708229  0.275313E-04  0.664E-02    1.84       1.0  T
   8    -11.1708558 -0.328679E-04  0.112E-02    1.83       4.0  T
   9    -11.1708561 -0.381620E-06  0.475E-03    1.83       9.4  T
  10    -11.1708562 -0.311554E-07  0.761E-04    1.83      58.8  T
  11    -11.1708562 -0.363766E-09  0.446E-04    1.83     100.2  T
     SCC iter.                  ...        0 min,  0.001 sec
     gradient                   ...        0 min,  0.001 sec
 * total energy  :   -11.0186051 Eh     change       -0.4956651E-02 Eh
   gradient norm :     0.0593545 Eh/α   predicted    -0.4736217E-02 (  -4.45%)
   displ. norm   :     0.1072927 α      lambda       -0.2652959E-02
   maximum displ.:     0.0619011 α      in ANC's #5, #4, #2, ...

........................................................................
.............................. CYCLE    7 ..............................
........................................................................
   1    -11.1732592 -0.111733E+02  0.750E-01    1.68       0.0  T
   2    -11.1727888  0.470429E-03  0.473E-01    1.74       1.0  T
   3    -11.1689632  0.382563E-02  0.755E-01    1.59       1.0  T
   4    -11.1733450 -0.438178E-02  0.105E-01    1.73       1.0  T
   5    -11.1734178 -0.728744E-04  0.394E-02    1.71       1.1  T
   6    -11.1734236 -0.575425E-05  0.182E-02    1.71       2.5  T
   7    -11.1734235  0.115487E-06  0.761E-03    1.71       5.9  T
   8    -11.1734239 -0.366844E-06  0.201E-03    1.71      22.3  T
   9    -11.1734239  0.136933E-08  0.129E-03    1.71      34.7  T
  10    -11.1734239 -0.553333E-08  0.172E-04    1.71     260.7  T
  11    -11.1734239 -0.145235E-10  0.263E-05    1.71    1700.0  T
     SCC iter.                  ...        0 min,  0.001 sec
     gradient                   ...        0 min,  0.001 sec
 * total energy  :   -11.0209062 Eh     change       -0.2301053E-02 Eh
   gradient norm :     0.0473458 Eh/α   predicted    -0.1341750E-02 ( -41.69%)
   displ. norm   :     0.3015886 α      lambda       -0.7874203E-02
   maximum displ.:     0.1933733 α      in ANC's #5, #4, #2, ...

........................................................................
.............................. CYCLE    8 ..............................
........................................................................
   1    -11.1868487 -0.111868E+02  0.215E+00    1.24       0.0  T
   2    -11.1840677  0.278099E-02  0.132E+00    1.39       1.0  T
   3    -11.1526911  0.313766E-01  0.209E+00    1.00       1.0  T
   4    -11.1875841 -0.348930E-01  0.263E-01    1.35       1.0  T
   5    -11.1880914 -0.507253E-03  0.125E-01    1.30       1.0  T
   6    -11.1881661 -0.746834E-04  0.529E-02    1.31       1.0  T
   7    -11.1881628  0.329104E-05  0.343E-02    1.31       1.3  T
   8    -11.1881698 -0.700061E-05  0.832E-03    1.31       5.4  T
   9    -11.1881701 -0.293992E-06  0.288E-03    1.31      15.5  T
  10    -11.1881701 -0.803977E-08  0.566E-04    1.31      79.0  T
  11    -11.1881701 -0.995204E-09  0.186E-04    1.31     240.4  T
     SCC iter.                  ...        0 min,  0.001 sec
     gradient                   ...        0 min,  0.002 sec
 * total energy  :   -11.0262930 Eh     change       -0.5386848E-02 Eh
   gradient norm :     0.0434079 Eh/α   predicted    -0.4295199E-02 ( -20.27%)
   displ. norm   :     0.5408468 α      lambda       -0.9328810E-02
   maximum displ.:     0.3348979 α      in ANC's #5, #2, #4, ...

........................................................................
.............................. CYCLE    9 ..............................
........................................................................
   1    -11.1507629 -0.111508E+02  0.298E+00    0.91       0.0  T
   2    -11.1446194  0.614353E-02  0.192E+00    0.78       1.0  T
   3    -11.0850407  0.595787E-01  0.277E+00    1.11       1.0  T
   4    -11.1494209 -0.643802E-01  0.697E-01    0.84       1.0  T
   5    -11.1529669 -0.354603E-02  0.221E-01    0.90       1.0  T
   6    -11.1531739 -0.206945E-03  0.123E-01    0.89       1.0  T
   7    -11.1532231 -0.492301E-04  0.590E-02    0.88       1.0  T
   8    -11.1532363 -0.131861E-04  0.212E-02    0.88       2.1  T
   9    -11.1532390 -0.275524E-05  0.709E-03    0.88       6.3  T
  10    -11.1532391 -0.117858E-06  0.129E-03    0.88      34.6  T
  11    -11.1532391 -0.851966E-08  0.437E-04    0.88     102.4  T
  12    -11.1532391 -0.401521E-09  0.727E-05    0.88     614.7  T
     SCC iter.                  ...        0 min,  0.001 sec
     gradient                   ...        0 min,  0.001 sec
 * total energy  :   -11.0273486 Eh     change       -0.1055569E-02 Eh
   gradient norm :     0.0945683 Eh/α   predicted    -0.6028810E-02 ( 471.14%)
   displ. norm   :     0.2282247 α      lambda       -0.1373610E-01
   maximum displ.:     0.2122747 α      in ANC's #1, #3, #2, ...

........................................................................
.............................. CYCLE   10 ..............................
........................................................................
   1    -11.1840814 -0.111841E+02  0.987E-01    0.93       0.0  T
   2    -11.1791048  0.497669E-02  0.100E+00    1.05       1.0  T
   3    -11.1837401 -0.463531E-02  0.661E-01    0.90       1.0  T
   4    -11.1846964 -0.956380E-03  0.421E-01    0.99       1.0  T
   5    -11.1860937 -0.139727E-02  0.498E-02    0.96       1.0  T
   6    -11.1860962 -0.248196E-05  0.375E-02    0.96       1.2  T
   7    -11.1860998 -0.364344E-05  0.209E-02    0.96       2.1  T
   8    -11.1861018 -0.198322E-05  0.331E-03    0.96      13.5  T
   9    -11.1861018 -0.215785E-07  0.159E-03    0.96      28.1  T
  10    -11.1861019 -0.774984E-08  0.216E-04    0.96     207.4  T
  11    -11.1861019 -0.980211E-10  0.495E-05    0.96     903.1  T
     SCC iter.                  ...        0 min,  0.001 sec
     gradient                   ...        0 min,  0.001 sec
 * total energy  :   -11.0359292 Eh     change       -0.8580644E-02 Eh
   gradient norm :     0.0564894 Eh/α   predicted    -0.7225781E-02 ( -15.79%)
   displ. norm   :     0.4391755 α      lambda       -0.8948244E-02
   maximum displ.:     0.2497409 α      in ANC's #1, #5, #3, ...

........................................................................
.............................. CYCLE   11 ..............................
........................................................................
   1    -11.1834267 -0.111834E+02  0.206E+00    0.93       0.0  T
   2    -11.1795504  0.387635E-02  0.133E+00    0.80       1.0  T
   3    -11.1494015  0.301488E-01  0.200E+00    1.08       1.0  T
   4    -11.1825677 -0.331662E-01  0.514E-01    0.88       1.0  T
   5    -11.1847202 -0.215247E-02  0.139E-01    0.91       1.0  T
   6    -11.1847900 -0.698600E-04  0.712E-02    0.90       1.0  T
   7    -11.1848027 -0.126228E-04  0.381E-02    0.90       1.2  T
   8    -11.1848059 -0.323130E-05  0.138E-02    0.90       3.2  T
   9    -11.1848070 -0.115151E-05  0.342E-03    0.90      13.1  T
  10    -11.1848071 -0.142787E-07  0.385E-04    0.90     116.1  T
  11    -11.1848071 -0.665601E-10  0.130E-04    0.90     344.1  T
     SCC iter.                  ...        0 min,  0.001 sec
     gradient                   ...        0 min,  0.002 sec
 * total energy  :   -11.0396627 Eh     change       -0.3733472E-02 Eh
   gradient norm :     0.0695648 Eh/α   predicted    -0.5337067E-02 (  42.95%)
   displ. norm   :     0.1533661 α      lambda       -0.7826591E-02
   maximum displ.:     0.0803369 α      in ANC's #4, #6, #5, ...

........................................................................
.............................. CYCLE   12 ..............................
........................................................................
   1    -11.2068227 -0.112068E+02  0.102E+00    0.94       0.0  T
   2    -11.2027782  0.404444E-02  0.987E-01    1.06       1.0  T
   3    -11.2064080 -0.362980E-02  0.626E-01    0.89       1.0  T
   4    -11.2064486 -0.405932E-04  0.519E-01    1.02       1.0  T
   5    -11.2086308 -0.218218E-02  0.140E-01    0.96       1.0  T
   6    -11.2087698 -0.139026E-03  0.344E-02    0.96       1.3  T
   7    -11.2087725 -0.268013E-05  0.199E-02    0.96       2.3  T
   8    -11.2087736 -0.108198E-05  0.430E-03    0.96      10.4  T
   9    -11.2087737 -0.516471E-07  0.156E-03    0.96      28.6  T
  10    -11.2087737 -0.344687E-08  0.252E-04    0.96     177.7  T
  11    -11.2087737 -0.152008E-09  0.292E-05    0.96    1531.6  T
     SCC iter.                  ...        0 min,  0.001 sec
     gradient                   ...        0 min,  0.002 sec
 * total energy  :   -11.0442585 Eh     change       -0.4595832E-02 Eh
   gradient norm :     0.0312508 Eh/α   predicted    -0.4005339E-02 ( -12.85%)
   displ. norm   :     0.1504543 α      lambda       -0.2419434E-02
   maximum displ.:     0.0982357 α      in ANC's #1, #2, #3, ...

........................................................................
.............................. CYCLE   13 ..............................
........................................................................
   1    -11.2090200 -0.112090E+02  0.682E-01    0.96       0.0  T
   2    -11.2081925  0.827430E-03  0.481E-01    0.91       1.0  T
   3    -11.2054130  0.277954E-02  0.689E-01    1.01       1.0  T
   4    -11.2089845 -0.357156E-02  0.179E-01    0.92       1.0  T
   5    -11.2092430 -0.258444E-03  0.790E-02    0.95       1.0  T
   6    -11.2092827 -0.396991E-04  0.289E-02    0.95       1.5  T
   7    -11.2092852 -0.249236E-05  0.157E-02    0.94       2.9  T
   8    -11.2092859 -0.735473E-06  0.258E-03    0.94      17.4  T
   9    -11.2092859 -0.193263E-07  0.114E-03    0.94      39.4  T
  10    -11.2092859 -0.280729E-08  0.213E-04    0.94     209.6  T
  11    -11.2092859 -0.130136E-09  0.382E-05    0.94    1170.7  T
     SCC iter.                  ...        0 min,  0.001 sec
     gradient                   ...        0 min,  0.001 sec
 * total energy  :   -11.0460114 Eh     change       -0.1752836E-02 Eh
   gradient norm :     0.0319704 Eh/α   predicted    -0.1237099E-02 ( -29.42%)
   displ. norm   :     0.1835787 α      lambda       -0.2429426E-02
   maximum displ.:     0.1190671 α      in ANC's #1, #3, #2, ...

........................................................................
.............................. CYCLE   14 ..............................
........................................................................
   1    -11.2045135 -0.112045E+02  0.761E-01    0.98       0.0  T
   2    -11.2016021  0.291137E-02  0.701E-01    0.89       1.0  T
   3    -11.2001266  0.147551E-02  0.772E-01    1.04       1.0  T
   4    -11.2046085 -0.448183E-02  0.225E-01    0.93       1.0  T
   5    -11.2049674 -0.358906E-03  0.519E-02    0.96       1.0  T
   6    -11.2049743 -0.695808E-05  0.391E-02    0.95       1.1  T
   7    -11.2049804 -0.605984E-05  0.160E-02    0.96       2.8  T
   8    -11.2049819 -0.151606E-05  0.297E-03    0.95      15.1  T
   9    -11.2049819 -0.195381E-07  0.160E-03    0.95      27.9  T
  10    -11.2049819 -0.571588E-08  0.311E-04    0.95     144.0  T
  11    -11.2049819 -0.361942E-09  0.443E-05    0.95    1009.5  T
     SCC iter.                  ...        0 min,  0.001 sec
     gradient                   ...        0 min,  0.001 sec
 * total energy  :   -11.0476512 Eh     change       -0.1639854E-02 Eh
   gradient norm :     0.0350537 Eh/α   predicted    -0.1255650E-02 ( -23.43%)
   displ. norm   :     0.1094687 α      lambda       -0.1467963E-02
   maximum displ.:     0.0625343 α      in ANC's #5, #1, #3, ...

........................................................................
.............................. CYCLE   15 ..............................
........................................................................
   1    -11.2057149 -0.112057E+02  0.558E-01    1.01       0.0  T
   2    -11.2055517  0.163139E-03  0.346E-01    1.04       1.0  T
   3    -11.2017429  0.380877E-02  0.625E-01    0.92       1.0  T
   4    -11.2055115 -0.376851E-02  0.199E-01    1.02       1.0  T
   5    -11.2057917 -0.280221E-03  0.317E-02    1.01       1.4  T
   6    -11.2057927 -0.100774E-05  0.291E-02    1.01       1.5  T
   7    -11.2057963 -0.357243E-05  0.493E-03    1.01       9.1  T
   8    -11.2057964 -0.108233E-06  0.144E-03    1.01      31.0  T
   9    -11.2057964 -0.259920E-08  0.812E-04    1.01      55.1  T
  10    -11.2057964 -0.750525E-09  0.164E-04    1.01     272.6  T
     SCC iter.                  ...        0 min,  0.001 sec
     gradient                   ...        0 min,  0.001 sec
 * total energy  :   -11.0486546 Eh     change       -0.1003339E-02 Eh
   gradient norm :     0.0249461 Eh/α   predicted    -0.7427760E-03 ( -25.97%)
   displ. norm   :     0.0620526 α      lambda       -0.7708169E-03
   maximum displ.:     0.0345906 α      in ANC's #8, #3, #5, ...

........................................................................
.............................. CYCLE   16 ..............................
........................................................................
   1    -11.2092141 -0.112092E+02  0.382E-01    1.06       0.0  T
   2    -11.2076794  0.153466E-02  0.434E-01    1.12       1.0  T
   3    -11.2083337 -0.654246E-03  0.381E-01    1.04       1.0  T
   4    -11.2092675 -0.933808E-03  0.147E-01    1.08       1.0  T
   5    -11.2094149 -0.147413E-03  0.401E-02    1.07       1.1  T
   6    -11.2094259 -0.109854E-04  0.170E-02    1.07       2.6  T
   7    -11.2094261 -0.267926E-06  0.564E-03    1.07       7.9  T
   8    -11.2094263 -0.165573E-06  0.159E-03    1.07      28.0  T
   9    -11.2094263 -0.344038E-08  0.917E-04    1.07      48.8  T
  10    -11.2094263 -0.367697E-08  0.116E-04    1.07     386.7  T
     SCC iter.                  ...        0 min,  0.001 sec
     gradient                   ...        0 min,  0.001 sec
 * total energy  :   -11.0491130 Eh     change       -0.4583928E-03 Eh
   gradient norm :     0.0048929 Eh/α   predicted    -0.3868925E-03 ( -15.60%)
   displ. norm   :     0.0206123 α      lambda       -0.7313600E-04
   maximum displ.:     0.0125858 α      in ANC's #3, #2, #8, ...

........................................................................
.............................. CYCLE   17 ..............................
........................................................................
   1    -11.2110327 -0.112110E+02  0.119E-01    1.09       0.0  T
   2    -11.2108112  0.221547E-03  0.161E-01    1.10       1.0  T
   3    -11.2109823 -0.171128E-03  0.105E-01    1.08       1.0  T
   4    -11.2110393 -0.570527E-04  0.555E-02    1.10       1.0  T
   5    -11.2110615 -0.222160E-04  0.128E-02    1.09       3.5  T
   6    -11.2110626 -0.100813E-05  0.539E-03    1.09       8.3  T
   7    -11.2110626 -0.916537E-07  0.140E-03    1.09      31.9  T
   8    -11.2110627 -0.515511E-08  0.671E-04    1.09      66.6  T
   9    -11.2110627 -0.234571E-08  0.301E-04    1.09     148.4  T
     SCC iter.                  ...        0 min,  0.001 sec
     gradient                   ...        0 min,  0.001 sec
 * total energy  :   -11.0491600 Eh     change       -0.4707571E-04 Eh
   gradient norm :     0.0040834 Eh/α   predicted    -0.3658232E-04 ( -22.29%)
   displ. norm   :     0.0143134 α      lambda       -0.2839553E-04
   maximum displ.:     0.0093801 α      in ANC's #3, #2, #6, ...

........................................................................
.............................. CYCLE   18 ..............................
........................................................................
   1    -11.2118875 -0.112119E+02  0.768E-02    1.10       0.0  T
   2    -11.2118431  0.443737E-04  0.800E-02    1.10       1.0  T
   3    -11.2118475 -0.432633E-05  0.768E-02    1.09       1.0  T
   4    -11.2118875 -0.400682E-04  0.310E-02    1.10       1.4  T
   5    -11.2118934 -0.591575E-05  0.126E-02    1.09       3.5  T
   6    -11.2118947 -0.126952E-05  0.371E-03    1.10      12.1  T
   7    -11.2118948 -0.448428E-07  0.199E-03    1.10      22.5  T
   8    -11.2118948 -0.119584E-07  0.363E-04    1.10     123.2  T
   9    -11.2118948 -0.466004E-09  0.164E-04    1.10     273.3  T
     SCC iter.                  ...        0 min,  0.001 sec
     gradient                   ...        0 min,  0.001 sec
 * total energy  :   -11.0491820 Eh     change       -0.2193699E-04 Eh
   gradient norm :     0.0049132 Eh/α   predicted    -0.1420019E-04 ( -35.27%)
   displ. norm   :     0.0235270 α      lambda       -0.4179621E-04
   maximum displ.:     0.0152617 α      in ANC's #3, #2, #6, ...

........................................................................
.............................. CYCLE   19 ..............................
........................................................................
   1    -11.2126246 -0.112126E+02  0.117E-01    1.10       0.0  T
   2    -11.2125921  0.325526E-04  0.900E-02    1.10       1.0  T
   3    -11.2124981  0.939373E-04  0.129E-01    1.09       1.0  T
   4    -11.2126083 -0.110125E-03  0.514E-02    1.11       1.0  T
   5    -11.2126295 -0.212394E-04  0.195E-02    1.10       2.3  T
   6    -11.2126328 -0.332279E-05  0.485E-03    1.10       9.2  T
   7    -11.2126329 -0.631977E-07  0.257E-03    1.10      17.4  T
   8    -11.2126329 -0.198670E-07  0.414E-04    1.10     108.1  T
   9    -11.2126329 -0.443857E-09  0.167E-04    1.10     267.0  T
     SCC iter.                  ...        0 min,  0.001 sec
     gradient                   ...        0 min,  0.001 sec
 * total energy  :   -11.0492124 Eh     change       -0.3043142E-04 Eh
   gradient norm :     0.0050701 Eh/α   predicted    -0.2090957E-04 ( -31.29%)
   displ. norm   :     0.0285019 α      lambda       -0.4059170E-04
   maximum displ.:     0.0189457 α      in ANC's #2, #3, #1, ...

........................................................................
.............................. CYCLE   20 ..............................
........................................................................
   1    -11.2127704 -0.112128E+02  0.130E-01    1.11       0.0  T
   2    -11.2127659  0.449306E-05  0.801E-02    1.10       1.0  T
   3    -11.2126930  0.729188E-04  0.112E-01    1.10       1.0  T
   4    -11.2127469 -0.539486E-04  0.502E-02    1.11       1.0  T
   5    -11.2127701 -0.231368E-04  0.195E-02    1.10       2.3  T
   6    -11.2127740 -0.391026E-05  0.384E-03    1.10      11.6  T
   7    -11.2127740 -0.126985E-07  0.223E-03    1.10      20.0  T
   8    -11.2127740 -0.199104E-07  0.342E-04    1.10     130.9  T
   9    -11.2127740 -0.159369E-09  0.130E-04    1.10     342.9  T
     SCC iter.                  ...        0 min,  0.001 sec
     gradient                   ...        0 min,  0.001 sec
 * total energy  :   -11.0492422 Eh     change       -0.2980913E-04 Eh
   gradient norm :     0.0043626 Eh/α   predicted    -0.2031401E-04 ( -31.85%)
   displ. norm   :     0.0315461 α      lambda       -0.3667144E-04
   maximum displ.:     0.0208721 α      in ANC's #2, #1, #3, ...
 * RMSD in coord.:     0.7530681 α      energy gain  -0.9533475E-01 Eh

generating ANC from model Hessian ...
Using Lindh-Hessian (1995)
 Shifting diagonal of input Hessian by    0.0000000000000000     
 Lowest  eigenvalues of input Hessian
   -0.000000    0.000000    0.000000    0.000000    0.000000    0.000000
    0.058364    0.170296    0.270619    0.441926    0.911265    1.075139
    1.273130    1.652341    2.225149
 Highest eigenvalues
    0.441926    0.911265    1.075139    1.273130    1.652341    2.225149


........................................................................
.............................. CYCLE   21 ..............................
........................................................................
   1    -11.2121969 -0.112122E+02  0.136E-01    1.11       0.0  T
   2    -11.2121832  0.136989E-04  0.901E-02    1.10       1.0  T
   3    -11.2118938  0.289394E-03  0.169E-01    1.13       1.0  T
   4    -11.2121824 -0.288585E-03  0.474E-02    1.10       1.0  T
   5    -11.2121997 -0.172804E-04  0.528E-03    1.10       8.5  T
   6    -11.2121998 -0.803829E-07  0.291E-03    1.11      15.4  T
   7    -11.2121998 -0.138329E-07  0.119E-03    1.10      37.6  T
   8    -11.2121998 -0.589640E-08  0.341E-04    1.11     131.3  T
   9    -11.2121998 -0.598476E-09  0.122E-04    1.10     366.4  T
     SCC iter.                  ...        0 min,  0.001 sec
     gradient                   ...        0 min,  0.001 sec
 * total energy  :   -11.0492660 Eh     change       -0.2375408E-04 Eh
   gradient norm :     0.0028033 Eh/α   predicted     0.0000000E+00 (-100.00%)
   displ. norm   :     0.0045077 α      lambda       -0.9361651E-05
   maximum displ.:     0.0025592 α      in ANC's #2, #3, #4, ...

........................................................................
.............................. CYCLE   22 ..............................
........................................................................
   1    -11.2115536 -0.112116E+02  0.291E-02    1.10       0.0  T
   2    -11.2115405  0.130804E-04  0.430E-02    1.10       1.0  T
   3    -11.2115531 -0.125364E-04  0.191E-02    1.10       2.3  T
   4    -11.2115544 -0.134189E-05  0.127E-02    1.10       3.5  T
   5    -11.2115556 -0.116748E-05  0.414E-03    1.10      10.8  T
   6    -11.2115557 -0.131561E-06  0.152E-03    1.10      29.4  T
   7    -11.2115557 -0.936070E-08  0.688E-04    1.10      65.0  T
   8    -11.2115557 -0.508948E-09  0.159E-04    1.10     281.1  T
     SCC iter.                  ...        0 min,  0.001 sec
     gradient                   ...        0 min,  0.001 sec
 * total energy  :   -11.0492726 Eh     change       -0.6581030E-05 Eh
   gradient norm :     0.0012408 Eh/α   predicted    -0.4682867E-05 ( -28.84%)
   displ. norm   :     0.0060789 α      lambda       -0.3491331E-05
   maximum displ.:     0.0042902 α      in ANC's #3, #1, #2, ...

........................................................................
.............................. CYCLE   23 ..............................
........................................................................
   1    -11.2110868 -0.112111E+02  0.386E-02    1.10       0.0  T
   2    -11.2110762  0.105845E-04  0.424E-02    1.10       1.1  T
   3    -11.2110798 -0.353676E-05  0.325E-02    1.10       1.4  T
   4    -11.2110868 -0.704977E-05  0.162E-02    1.10       2.8  T
   5    -11.2110889 -0.207126E-05  0.343E-03    1.10      13.1  T
   6    -11.2110890 -0.716786E-07  0.209E-03    1.10      21.4  T
   7    -11.2110890 -0.217945E-07  0.873E-04    1.10      51.2  T
   8    -11.2110890 -0.142319E-08  0.151E-04    1.10     296.1  T
     SCC iter.                  ...        0 min,  0.001 sec
     gradient                   ...        0 min,  0.001 sec
 * total energy  :   -11.0492744 Eh     change       -0.1805117E-05 Eh
   gradient norm :     0.0007274 Eh/α   predicted    -0.1745775E-05 (  -3.29%)
   displ. norm   :     0.0015349 α      lambda       -0.5294301E-06
   maximum displ.:     0.0011436 α      in ANC's #2, #4, #8, ...

   *** GEOMETRY OPTIMIZATION CONVERGED AFTER 23 ITERATIONS ***

------------------------------------------------------------------------
 total energy gain   :        -0.0953669 Eh      -59.8436 kcal/mol
 total RMSD          :         0.7507933 a0        0.3973 Å
 total power (kW/mol):       -10.8863360 (step)-2730.1306 (real)
------------------------------------------------------------------------

 ANCopt (total)                0 d,  0 h,  0 min,  0.092 sec
 optimizer setup                ...        0 min,  0.000 sec (  0.064%)
 model hessian                  ...        0 min,  0.000 sec (  0.136%)
 ANC generation                 ...        0 min,  0.000 sec (  0.097%)
 coordinate transformation      ...        0 min,  0.000 sec (  0.056%)
 single point calculation       ...        0 min,  0.090 sec ( 97.776%)
 optimization log               ...        0 min,  0.001 sec (  0.599%)
 hessian update                 ...        0 min,  0.000 sec (  0.056%)
 rational function              ...        0 min,  0.000 sec (  0.515%)

================
 final structure:
================
5
 xtb: 6.2.2 (9d81278992624c895f80dd42a50cac0aa55982e2)
C         1.78941011445846   -0.34823768052944   -0.39472926581859
C         0.59423468469018   -0.15475879115884    0.02315926345788
C        -0.73864727684718   -0.62313588733397   -0.38865696739656
N        -0.36594784728523    0.48071338129685    0.85163355090528
C        -1.27905067501622    0.64541997772540   -0.09140658114801

 Bond Distances (Angstroems)
 ---------------------------
C1-C2=1.2808         C2-C1=1.2808         C2-C3=1.4716         C2-N4=1.4185         C3-C2=1.4716         C3-N4=1.7017         
C3-C5=1.4105         N4-C2=1.4185         N4-C3=1.7017         N4-C5=1.3230         C5-C3=1.4105         C5-N4=1.3230         
 C  C  Rav=1.3876 sigma=0.0795  Rmin=1.2808  Rmax=1.4716     3
 N  C  Rav=1.4810 sigma=0.1608  Rmin=1.3230  Rmax=1.7017     3

 selected bond angles (degree)
 --------------------
C3-C2-C1=134.89                N4-C2-C1=152.86                N4-C2-C3= 72.12                N4-C3-C2= 52.50                
C5-C3-C2= 90.10                C5-C3-N4= 49.23                C3-N4-C2= 55.39                C5-N4-C2= 96.12                
C5-N4-C3= 53.85                N4-C5-C3= 76.93                

 selected dihedral angles (degree)
 ---------------------------------
N4-C3-C2-C1=183.20            C5-C3-C2-C1=217.66            C5-C3-C2-N4= 34.45            C3-N4-C2-C1=175.02            
C5-N4-C2-C1=137.68            C5-N4-C2-C3=322.65            C2-N4-C3-C5=228.33            C5-N4-C3-C2=131.67            
N4-C5-C3-C2=323.66            C3-C5-N4-C2= 38.19            
           -------------------------------------------------
          |                Final Singlepoint                |
           -------------------------------------------------

          ...................................................
          :                      SETUP                      :
          :.................................................:
          :  # basis functions                  20          :
          :  # atomic orbitals                  20          :
          :  # shells                           10          :
          :  # electrons                        21          :
          :  max. iterations                   250          :
          :  Hamiltonian                  GFN2-xTB          :
          :  restarted?                      false          :
          :  GBSA solvation                  false          :
          :  PC potential                    false          :
          :  electronic temp.          300.0000000     K    :
          :  accuracy                    1.0000000          :
          :  -> integral cutoff          0.2500000E+02      :
          :  -> integral neglect         0.1000000E-07      :
          :  -> SCF convergence          0.1000000E-05 Eh   :
          :  -> wf. convergence          0.1000000E-03 e    :
          :  Broyden damping             0.4000000          :
          ...................................................

 iter      E             dE          RMSdq      gap      omega  full diag
   1    -11.2110890 -0.112111E+02  0.525E-05    1.10       0.0  T
   2    -11.2110890  0.938609E-10  0.112E-04    1.10     400.5  T
   3    -11.2110890 -0.102704E-09  0.345E-05    1.10    1296.1  T

   *** convergence criteria satisfied after 3 iterations ***

         #    Occupation            Energy/Eh            Energy/eV
      -------------------------------------------------------------
         1        2.0000           -0.7723663             -21.0172
       ...           ...                  ...                  ...
         5        2.0000           -0.5948153             -16.1857
         6        2.0000           -0.5644560             -15.3596
         7        2.0000           -0.5078690             -13.8198
         8        2.0000           -0.4930057             -13.4154
         9        2.0000           -0.4714310             -12.8283
        10        2.0000           -0.4556193             -12.3980
        11        1.0000           -0.4277687             -11.6402 (HOMO)
        12                         -0.3873221             -10.5396 (LUMO)
        13                         -0.3224291              -8.7737
        14                         -0.2933970              -7.9837
        15                         -0.2270143              -6.1774
        16                          0.0065946               0.1794
       ...                                ...                  ...
        20                          0.7806428              21.2424
      -------------------------------------------------------------
                  HL-Gap            0.0404466 Eh            1.1006 eV
             Fermi-level           -0.4246197 Eh          -11.5545 eV

 SCC (total)                   0 d,  0 h,  0 min,  0.003 sec
 SCC setup                      ...        0 min,  0.000 sec (  1.516%)
 Dispersion                     ...        0 min,  0.000 sec (  0.234%)
 integral evaluation            ...        0 min,  0.001 sec ( 38.808%)
 zeroth order Hamiltonian       ...        0 min,  0.000 sec (  0.595%)
 iterations                     ...        0 min,  0.001 sec ( 17.027%)
 molecular gradient             ...        0 min,  0.001 sec ( 40.091%)
 printout                       ...        0 min,  0.000 sec (  1.481%)

         :::::::::::::::::::::::::::::::::::::::::::::::::::::
         ::                     SUMMARY                     ::
         :::::::::::::::::::::::::::::::::::::::::::::::::::::
         :: total energy             -11.049274354901 Eh    ::
         :: gradient norm              0.000728107094 Eh/a0 ::
         :: HOMO-LUMO gap              1.100609016313 eV    ::
         ::.................................................::
         :: SCC energy               -11.211088998568 Eh    ::
         :: -> isotropic ES           -0.011827293316 Eh    ::
         :: -> anisotropic ES          0.004295194611 Eh    ::
         :: -> anisotropic XC          0.011510200422 Eh    ::
         :: -> dispersion             -0.002874626418 Eh    ::
         :: repulsion energy           0.161814611303 Eh    ::
         :: add. restraining           0.000000000000 Eh    ::
         :::::::::::::::::::::::::::::::::::::::::::::::::::::

           ------------------------------------------------- 
          |                Numerical Hessian                |
           ------------------------------------------------- 
step length          :   0.00500
SCC accuracy         :   0.30000
Hessian scale factor :   1.00000
frozen atoms in %    :   0.00000    0
RMS gradient         :   0.00073
estimated CPU  time      0.00 min
estimated wall time      0.00 min

writing file <hessian>.

 projected vibrational frequencies (cm-1)
eigval :       -0.00    -0.00    -0.00     0.00     0.00     0.00
eigval :      219.87   257.43   432.36   498.09   783.51   971.97
eigval :     1030.25  1424.47  1707.14
           -------------------------------------------------
          |                Property Printout                |
           -------------------------------------------------

    * Orbital Energies and Occupations

         #    Occupation            Energy/Eh            Energy/eV
      -------------------------------------------------------------
         1        2.0000           -0.7723661             -21.0172
         2        2.0000           -0.6988813             -19.0175
         3        2.0000           -0.6492140             -17.6660
         4        2.0000           -0.6448465             -17.5472
         5        2.0000           -0.5948152             -16.1857
         6        2.0000           -0.5644559             -15.3596
         7        2.0000           -0.5078688             -13.8198
         8        2.0000           -0.4930059             -13.4154
         9        2.0000           -0.4714314             -12.8283
        10        2.0000           -0.4556192             -12.3980
        11        1.0000           -0.4277687             -11.6402 (HOMO)
        12                         -0.3873223             -10.5396 (LUMO)
        13                         -0.3224290              -8.7737
        14                         -0.2933967              -7.9837
        15                         -0.2270145              -6.1774
        16                          0.0065945               0.1794
        17                          0.0798384               2.1725
        18                          0.1395249               3.7967
        19                          0.3771900              10.2639
        20                          0.7806425              21.2424
      -------------------------------------------------------------
                  HL-Gap            0.0404463 Eh            1.1006 eV
             Fermi-level           -0.4246197 Eh          -11.5545 eV

     #   Z        covCN         q      C6AA      α(0)
     1   6 C      0.983    -0.111    39.465    10.553
     2   6 C      3.275     0.164    23.247     7.766
     3   6 C      2.788    -0.019    28.460     8.739
     4   7 N      2.647    -0.067    22.552     7.053
     5   6 C      2.298     0.032    28.866     8.721

 Mol. C6AA /au·bohr⁶  :        704.180571
 Mol. C8AA /au·bohr⁸  :      19456.737448
 Mol. α(0) /au        :         42.831135


Wiberg/Mayer (AO) data.
largest (>0.10) Wiberg bond orders for each atom
          total WBO             WBO to atom ...
     1  C   2.484        C    2 1.940    C    3 0.221    N    4 0.168    C    5 0.155
     2  C   3.861        C    1 1.940    N    4 0.905    C    3 0.891    C    5 0.126
     3  C   2.911        C    5 1.170    C    2 0.891    N    4 0.629    C    1 0.221
     4  N   3.114        C    5 1.411    C    2 0.905    C    3 0.629    C    1 0.168
     5  C   2.862        N    4 1.411    C    3 1.170    C    1 0.155    C    2 0.126
Molecule has no symmetry elements
It seems to be the C1 point group

MOs/occ written to file <molden.input>


molecular dipole:
                 x           y           z       tot (Debye)
 q only:       -0.194       0.025      -0.010
   full:       -0.322       0.270       0.223       1.209
molecular quadrupole (traceless):
                xx          xy          yy          xz          yz          zz
 q only:       -0.782       0.163       0.524       0.534      -0.267       0.258
  q+dip:       -2.170       0.742       1.299       0.283      -1.116       0.871
   full:       -3.441       1.723       1.736       0.402      -1.288       1.705

           -------------------------------------------------
          |                Geometry Summary                 |
           -------------------------------------------------

      molecular mass/u    :       62.0496468
   center of mass at/Å    :       -0.0117716       0.0154635       0.0273947
  moments of inertia/u·Å² :        0.2297595E+02   0.8058688E+02   0.9505044E+02
rotational constants/cm⁻¹ :        0.7337077E+00   0.2091858E+00   0.1773546E+00

 * 3 selected distances

     #   Z        #   Z                                     value/Å
     1   6 C      2   6 C                                 1.2808236 (min)
     2   6 C      4   7 N                                 1.4185010 (max)
     4   7 N      5   6 C                                 1.3229549

 * 2 distinct bonds (by element types)

   Z      Z             #   av. dist./Å        max./Å        min./Å
   6 C    6 C           1     1.2808236     1.2808236     1.2808236
   6 C    7 N           2     1.3707279     1.4185010     1.3229549

           -------------------------------------------------
          |               Frequency Printout                |
           -------------------------------------------------
 projected vibrational frequencies (cm-1)
eigval :       -0.00    -0.00    -0.00     0.00     0.00     0.00
eigval :      219.87   257.43   432.36   498.09   783.51   971.97
eigval :     1030.25  1424.47  1707.14
 reduced masses (amu)
   1: 12.67   2: 12.41   3: 12.10   4: 12.30   5: 12.68   6: 12.51   7: 12.15   8: 12.13
   9: 12.32  10: 12.59  11: 12.71  12: 12.61  13: 12.33  14: 12.51  15: 12.13
 IR intensities (amu)
   1:  0.07   2:  0.05   3:  0.07   4:  0.03   5:  0.10   6:  0.08   7:  0.42   8:  0.19
   9:  0.69  10:  0.22  11:  0.38  12:  0.78  13:  1.08  14:  0.96  15:  0.43
 Raman intensities (amu)
   1:  0.00   2:  0.00   3:  0.00   4:  0.00   5:  0.00   6:  0.00   7:  0.00   8:  0.00
   9:  0.00  10:  0.00  11:  0.00  12:  0.00  13:  0.00  14:  0.00  15:  0.00
 output can be read by thermo (or use thermo option).
 writing <g98.out> molden fake output.
 recommended (thermochemical) frequency scaling factor: 1.0
           -------------------------------------------------
          |             Thermodynamic Functions             |
           -------------------------------------------------

c1  symmetry found (for desy threshold:  0.10E+00) used in thermo

          ...................................................
          :                      SETUP                      :
          :.................................................:
          :  # frequencies                           9      :
          :  # imaginary freq.                       0      :
          :  linear?                             false      :
          :  only rotor calc.                    false      :
          :  symmetry                               c1      :
          :  rotational number                       1      :
          :  scaling factor                  1.0000000      :
          :  rotor cutoff                   50.0000000 cm⁻¹ :
          :  imag. cutoff                  -20.0000000 cm⁻¹ :
          :.................................................:

    mode    ω/cm⁻¹     T·S(HO)/kcal·mol⁻¹    T·S(FR)/kcal·mol⁻¹   T·S(vib)
   ------------------------------------------------------------------------
       1    219.87    -0.00000 ( 99.73%)     0.01302 (  0.27%)     0.00003
       2    257.43    -0.00000 ( 99.86%)     0.01459 (  0.14%)     0.00002
   ------------------------------------------------------------------------

   temp. (K)  partition function   enthalpy   heat capacity  entropy
                                   cal/mol     cal/K/mol   cal/K/mol   J/K/mol
 298.15  VIB   2.81                 1052.339      7.781      5.584
         ROT  0.320E+05              888.752      2.981     23.599
         INT  0.901E+05             1941.091     10.762     29.182
         TR   0.473E+27             1481.254      4.968     38.278
         TOT                        3422.3451    15.7298    67.4606   282.2550

   temp. (K)  partition function   enthalpy   heat capacity  entropy
                                   cal/mol     cal/K/mol   cal/K/mol   J/K/mol
 120.00  VIB   1.14                   94.555      2.600      1.048
         ROT  0.818E+04              357.707      2.981     20.886
         INT  0.931E+04              452.262      5.580     21.933
         TR   0.121E+27              596.178      4.968     33.759
         TOT                        1048.4397    10.5486    55.6921   233.0156

   temp. (K)  partition function   enthalpy   heat capacity  entropy
                                   cal/mol     cal/K/mol   cal/K/mol   J/K/mol
 100.00  VIB   1.07                   49.933      1.859      0.643
         ROT  0.622E+04              298.089      2.981     20.342
         INT  0.668E+04              348.022      4.839     20.985
         TR   0.919E+26              496.815      4.968     32.853
         TOT                         844.8370     9.8076    53.8384   225.2600

   temp. (K)  partition function   enthalpy   heat capacity  entropy
                                   cal/mol     cal/K/mol   cal/K/mol   J/K/mol
  80.00  VIB   1.03                   20.244      1.114      0.314
         ROT  0.445E+04              238.471      2.981     19.677
         INT  0.459E+04              258.716      4.095     19.991
         TR   0.657E+26              397.452      4.968     31.745
         TOT                         656.1676     9.0635    51.7367   216.4664

   temp. (K)  partition function   enthalpy   heat capacity  entropy
                                   cal/mol     cal/K/mol   cal/K/mol   J/K/mol
  60.00  VIB   1.01                    4.828      0.453      0.096
         ROT  0.289E+04              178.853      2.981     18.820
         INT  0.291E+04              183.682      3.434     18.916
         TR   0.427E+26              298.089      4.968     30.317
         TOT                         481.7707     8.4025    49.2326   205.9894

   temp. (K)  partition function   enthalpy   heat capacity  entropy
                                   cal/mol     cal/K/mol   cal/K/mol   J/K/mol
  40.00  VIB   1.00                    0.301      0.062      0.008
         ROT  0.157E+04              119.236      2.981     17.611
         INT  0.158E+04              119.537      3.043     17.619
         TR   0.232E+26              198.726      4.968     28.303
         TOT                         318.2631     8.0111    45.9225   192.1398

   temp. (K)  partition function   enthalpy   heat capacity  entropy
                                   cal/mol     cal/K/mol   cal/K/mol   J/K/mol
  20.00  VIB   1.00                    0.000      0.000     -0.003
         ROT   557.                   59.618      2.981     15.545
         INT   557.                   59.618      2.981     15.542
         TR   0.822E+25               99.363      4.968     24.861
         TOT                         158.9809     7.9491    40.4029   169.0457

   temp. (K)  partition function   enthalpy   heat capacity  entropy
                                   cal/mol     cal/K/mol   cal/K/mol   J/K/mol
  10.00  VIB   1.00                    0.000      0.000     -0.006
         ROT   197.                   29.809      2.981     13.478
         INT   197.                   29.809      2.981     13.472
         TR   0.290E+25               49.681      4.968     21.419
         TOT                          79.4904     7.9490    34.8917   145.9868

       T/K    H(0)-H(T)+PV         H(T)/Eh          T*S/Eh         G(T)/Eh
   ------------------------------------------------------------------------
    298.15    0.545385E-02    0.221416E-01    0.320527E-01   -0.991107E-02
    120.00    0.167080E-02    0.183586E-01    0.106501E-01    0.770845E-02
    100.00    0.134633E-02    0.180341E-01    0.857970E-02    0.945440E-02
     80.00    0.104567E-02    0.177334E-01    0.659582E-02    0.111376E-01
     60.00    0.767750E-03    0.174555E-01    0.470743E-02    0.127481E-01
     40.00    0.507184E-03    0.171950E-01    0.292729E-02    0.142677E-01
     20.00    0.253352E-03    0.169411E-01    0.128772E-02    0.156534E-01
     10.00    0.126676E-03    0.168144E-01    0.556034E-03    0.162584E-01 (used)
   ------------------------------------------------------------------------

         :::::::::::::::::::::::::::::::::::::::::::::::::::::
         ::                  THERMODYNAMIC                  ::
         :::::::::::::::::::::::::::::::::::::::::::::::::::::
         :: total free energy         -11.033015942466 Eh   ::
         ::.................................................::
         :: total energy              -11.049274354306 Eh   ::
         :: zero point energy           0.016687770154 Eh   ::
         :: G(RRHO) w/o ZPVE           -0.000429358314 Eh   ::
         :: G(RRHO) contrib.            0.016258411840 Eh   ::
         :::::::::::::::::::::::::::::::::::::::::::::::::::::

optimized geometry written to: xtbopt.xyz


           -------------------------------------------------
          | TOTAL ENERGY              -11.049274354306 Eh   |
          | TOTAL ENTHALPY            -11.032459908136 Eh   |
          | TOTAL FREE ENERGY         -11.033015942466 Eh   |
          | GRADIENT NORM               0.000728327874 Eh/α |
          | HOMO-LUMO GAP               1.100600396298 eV   |
           -------------------------------------------------

------------------------------------------------------------------------
 * finished run on 2020/05/12 at 11:44:18.273     
------------------------------------------------------------------------
 total:
 * wall-time:     0 d,  0 h,  0 min,  0.222 sec
 *  cpu-time:     0 d,  0 h,  0 min,  0.222 sec
 * ratio c/w:     0.997 speedup
 SCF:
 * wall-time:     0 d,  0 h,  0 min,  0.005 sec
 *  cpu-time:     0 d,  0 h,  0 min,  0.005 sec
 * ratio c/w:     0.999 speedup
 ANC optimizer:
 * wall-time:     0 d,  0 h,  0 min,  0.096 sec
 *  cpu-time:     0 d,  0 h,  0 min,  0.096 sec
 * ratio c/w:     0.999 speedup
 numerical hessian:
 * wall-time:     0 d,  0 h,  0 min,  0.107 sec
 *  cpu-time:     0 d,  0 h,  0 min,  0.106 sec
 * ratio c/w:     0.997 speedup

