      -----------------------------------------------------------      
     |                   =====================                   |     
     |                           x T B                           |     
     |                   =====================                   |     
     |                         S. Grimme                         |     
     |          Mulliken Center for Theoretical Chemistry        |     
     |                    University of Bonn                     |     
      -----------------------------------------------------------      

   * xtb version 6.2.2 (9d81278992624c895f80dd42a50cac0aa55982e2) compiled by '@Darwin' on 04/03/2020

   xtb is free software: you can redistribute it and/or modify it under
   the terms of the GNU Lesser General Public License as published by
   the Free Software Foundation, either version 3 of the License, or
   (at your option) any later version.
   
   xtb is distributed in the hope that it will be useful,
   but WITHOUT ANY WARRANTY; without even the implied warranty of
   MERCHANTABILITY or FITNESS FOR A PARTICULAR PURPOSE.  See the
   GNU Lesser General Public License for more details.
   
   Cite this work as:
   * S. Grimme, C. Bannwarth, P. Shushkov, J. Chem. Theory Comput., 2017,
     13, 1989-2009. DOI: 10.1021/acs.jctc.7b00118
   * C. Bannwarth, S. Ehlert and S. Grimme., J. Chem. Theory Comput., 2019,
     15, 1652-1671. DOI: 10.1021/acs.jctc.8b01176
   * P. Pracht, E. Caldeweyher, S. Ehlert, S. Grimme, ChemRxiv, 2019, preprint.
     DOI: 10.26434/chemrxiv.8326202.v1
   
   for DFT-D4:
   * E. Caldeweyher, C. Bannwarth and S. Grimme, J. Chem. Phys., 2017,
     147, 034112. DOI: 10.1063/1.4993215
   * E. Caldeweyher, S. Ehlert, A. Hansen, H. Neugebauer, S. Spicher,
     C. Bannwarth and S. Grimme, J. Chem. Phys., 2019, 150, 154122.
     DOI: 10.1063/1.5090222
   
   for sTDA-xTB:
   * S. Grimme and C. Bannwarth, J. Chem. Phys., 2016, 145, 054103.
     DOI: 10.1063/1.4959605
   
   in the mass-spec context:
   * V. Asgeirsson, C. Bauer and S. Grimme, Chem. Sci., 2017, 8, 4879.
     DOI: 10.1039/c7sc00601b
   
   for metadynamics refer to:
   * S. Grimme, J. Chem. Theory Comput., 2019, 155, 2847-2862
     DOI: 10.1021/acs.jctc.9b00143
   
   with help from (in alphabetical order)
   C. Bannwarth, F. Bohle, G. Brandenburg, E. Caldeweyher, M. Checinski,
   S. Dohm, S. Ehlert, S. Ehrlich, F. März, H. Neugebauer, J. Pisarek,
   P. Pracht, P. Shushkov, and S. Spicher.
   
 * started run on 2020/05/12 at 11:44:20.745     

           -------------------------------------------------
          |                Calculation Setup                |
           -------------------------------------------------

          program call               : xtb --input C4N1_50_S_1.input C4N1_50_S_1.xyz --ohess --molden --namespace C4N1_50_S_1 output.out
          calculation namespace      : C4N1_50_S_1
          coordinate file            : C4N1_50_S_1.xyz
          number of atoms            :                     5
          number of electrons        :                    21
          charge                     :                     0
          spin                       :                   0.5
          first test random number   :      0.71883015074096

   ID    Z sym.   atoms
    1    7 N      1
    2    6 C      2-5

           -------------------------------------------------
          |                 G F N 2 - x T B                 |
           -------------------------------------------------

        Reference                      10.1021/acs.jctc.8b01176
      * Hamiltonian:
        H0-scaling (s, p, d)           1.850000    2.230000    2.230000
        zeta-weighting                 0.500000
      * Dispersion:
        s8                             2.700000
        a1                             0.520000
        a2                             5.000000
        s9                             5.000000
      * Repulsion:
        kExp                           1.500000    1.000000
        rExp                           1.000000
      * Coulomb:
        alpha                          2.000000
        third order                    shell-resolved
        anisotropic                    true
        a3                             3.000000
        a5                             4.000000
        cn-shift                       1.200000
        cn-exp                         4.000000
        max-rad                        5.000000


          ...................................................
          :                      SETUP                      :
          :.................................................:
          :  # basis functions                  20          :
          :  # atomic orbitals                  20          :
          :  # shells                           10          :
          :  # electrons                        21          :
          :  max. iterations                   250          :
          :  Hamiltonian                  GFN2-xTB          :
          :  restarted?                      false          :
          :  GBSA solvation                  false          :
          :  PC potential                    false          :
          :  electronic temp.          300.0000000     K    :
          :  accuracy                    1.0000000          :
          :  -> integral cutoff          0.2500000E+02      :
          :  -> integral neglect         0.1000000E-07      :
          :  -> SCF convergence          0.1000000E-05 Eh   :
          :  -> wf. convergence          0.1000000E-03 e    :
          :  Broyden damping             0.4000000          :
          ...................................................

 iter      E             dE          RMSdq      gap      omega  full diag
   1    -11.0405604 -0.110406E+02  0.685E+00    0.17       0.0  T
   2    -10.5996822  0.440878E+00  0.904E+00    0.42       1.0  T
   3    -10.9865612 -0.386879E+00  0.526E+00    0.00       1.0  T
   4    -10.9853914  0.116979E-02  0.488E+00    0.78       1.0  T
   5    -11.0772670 -0.918756E-01  0.223E+00    0.11       1.0  T
   6    -11.0778583 -0.591297E-03  0.186E+00    0.14       1.0  T
   7    -11.0891657 -0.113074E-01  0.949E-01    0.11       1.0  T
   8    -11.0907084 -0.154273E-02  0.644E-01    0.09       1.0  T
   9    -11.0901259  0.582501E-03  0.716E-01    0.11       1.0  T
  10    -11.0905457 -0.419834E-03  0.413E-01    0.09       1.0  T
  11    -11.0907751 -0.229379E-03  0.262E-01    0.07       1.0  T
  12    -11.0909662 -0.191112E-03  0.950E-02    0.08       1.0  T
  13    -11.0909767 -0.104399E-04  0.151E-02    0.08       3.0  T
  14    -11.0909756  0.103126E-05  0.234E-02    0.08       1.9  T
  15    -11.0909773 -0.167879E-05  0.620E-03    0.08       7.2  T
  16    -11.0909774 -0.122570E-06  0.188E-03    0.08      23.7  T
  17    -11.0909775 -0.120124E-07  0.622E-04    0.08      71.9  T
  18    -11.0909775 -0.125627E-08  0.276E-04    0.08     161.9  T

   *** convergence criteria satisfied after 18 iterations ***

         #    Occupation            Energy/Eh            Energy/eV
      -------------------------------------------------------------
         1        2.0000           -0.7923060             -21.5597
       ...           ...                  ...                  ...
         5        2.0000           -0.5679416             -15.4545
         6        2.0000           -0.5270757             -14.3425
         7        2.0000           -0.5084707             -13.8362
         8        2.0000           -0.5004451             -13.6178
         9        2.0000           -0.4989360             -13.5767
        10        1.9912           -0.4282778             -11.6540
        11        0.8380           -0.4192502             -11.4084 (HOMO)
        12        0.1707           -0.4162423             -11.3265 (LUMO)
        13                         -0.2889662              -7.8632
        14                         -0.1733799              -4.7179
        15                         -0.1533426              -4.1727
        16                         -0.0220726              -0.6006
       ...                                ...                  ...
        20                          0.3629199               9.8756
      -------------------------------------------------------------
                  HL-Gap            0.0030079 Eh            0.0818 eV
             Fermi-level           -0.4207651 Eh          -11.4496 eV

 SCC (total)                   0 d,  0 h,  0 min,  0.005 sec
 SCC setup                      ...        0 min,  0.000 sec (  1.596%)
 Dispersion                     ...        0 min,  0.000 sec (  0.376%)
 integral evaluation            ...        0 min,  0.001 sec ( 26.876%)
 zeroth order Hamiltonian       ...        0 min,  0.000 sec (  0.419%)
 iterations                     ...        0 min,  0.002 sec ( 39.799%)
 molecular gradient             ...        0 min,  0.001 sec ( 29.191%)
 printout                       ...        0 min,  0.000 sec (  1.562%)

         :::::::::::::::::::::::::::::::::::::::::::::::::::::
         ::                     SUMMARY                     ::
         :::::::::::::::::::::::::::::::::::::::::::::::::::::
         :: total energy             -10.962414332612 Eh    ::
         :: gradient norm              0.212942543827 Eh/a0 ::
         :: HOMO-LUMO gap              0.081849843619 eV    ::
         ::.................................................::
         :: SCC energy               -11.090977456073 Eh    ::
         :: -> isotropic ES           -0.002362827933 Eh    ::
         :: -> anisotropic ES          0.005380503492 Eh    ::
         :: -> anisotropic XC          0.004580245856 Eh    ::
         :: -> dispersion             -0.002623052936 Eh    ::
         :: repulsion energy           0.128563108515 Eh    ::
         :: add. restraining           0.000000000000 Eh    ::
         :::::::::::::::::::::::::::::::::::::::::::::::::::::

      ----------------------------------------------------------- 
     |                   =====================                   |
     |                        A N C O P T                        |
     |                   =====================                   |
     |               Approximate Normal Coordinate               |
     |                Rational Function Optimizer                |
      ----------------------------------------------------------- 

          ...................................................
          :                      SETUP                      :
          :.................................................:
          :   optimization level            normal          :
          :   max. optcycles                   200          :
          :   ANC micro-cycles                  20          :
          :   degrees of freedom                 9          :
          :.................................................:
          :   RF solver                   davidson          :
          :   write xtbopt.log                true          :
          :   linear?                        false          :
          :   energy convergence         0.5000000E-05 Eh   :
          :   grad. convergence          0.1000000E-02 Eh/α :
          :   maximium RF displ.         1.0000000          :
          :   Hlow (freq-cutoff)         0.1000000E-01      :
          :   Hmax (freq-cutoff)         5.0000000          :
          :   S6 in model hess.         20.0000000          :
          ...................................................

generating ANC from model Hessian ...
Using Lindh-Hessian (1995)
 Shifting diagonal of input Hessian by    0.0000000000000000     
 Lowest  eigenvalues of input Hessian
   -0.000000   -0.000000   -0.000000    0.000000    0.000000    0.000000
    0.180448    0.719843    0.762618    0.776207    0.879929    0.919941
    1.420267    1.481970    1.785121
 Highest eigenvalues
    0.776207    0.879929    0.919941    1.420267    1.481970    1.785121


........................................................................
.............................. CYCLE    1 ..............................
........................................................................
   1    -11.0909775 -0.110910E+02  0.486E-05    0.08       0.0  T
   2    -11.0909775  0.228569E-09  0.227E-04    0.08     197.2  T
   3    -11.0909775 -0.228161E-09  0.464E-05    0.08     963.7  T
     SCC iter.                  ...        0 min,  0.000 sec
     gradient                   ...        0 min,  0.001 sec
 * total energy  :   -10.9624143 Eh     change        0.2521004E-08 Eh
   gradient norm :     0.2129345 Eh/α   predicted     0.0000000E+00 (-100.00%)
   displ. norm   :     0.2981600 α      lambda       -0.4886064E-01
   maximum displ.:     0.2338656 α      in ANC's #1, #5, #9, ...

........................................................................
.............................. CYCLE    2 ..............................
........................................................................
   1    -11.0301091 -0.110301E+02  0.485E+00    1.12       0.0  T
   2    -10.4801493  0.549960E+00  0.983E+00    0.32       1.0  T
   3    -11.0978814 -0.617732E+00  0.223E+00    1.28       1.0  T
   4    -11.1150232 -0.171418E-01  0.934E-01    1.02       1.0  T
   5    -11.1123430  0.268025E-02  0.105E+00    1.14       1.0  T
   6    -11.0951947  0.171483E-01  0.211E+00    1.12       1.0  T
   7    -11.1167889 -0.215941E-01  0.114E-01    1.13       1.0  T
   8    -11.1168100 -0.211789E-04  0.524E-02    1.14       1.0  T
   9    -11.1168062  0.380037E-05  0.490E-02    1.14       1.0  T
  10    -11.1168135 -0.724599E-05  0.240E-02    1.14       1.9  T
  11    -11.1168161 -0.263907E-05  0.352E-03    1.14      12.7  T
  12    -11.1168159  0.214287E-06  0.795E-03    1.14       5.6  T
  13    -11.1168161 -0.195200E-06  0.355E-03    1.14      12.6  T
  14    -11.1168162 -0.469235E-07  0.102E-03    1.14      43.7  T
  15    -11.1168162 -0.416891E-08  0.104E-04    1.14     429.5  T
  16    -11.1168162 -0.324913E-10  0.448E-05    1.14     997.9  T
     SCC iter.                  ...        0 min,  0.002 sec
     gradient                   ...        0 min,  0.001 sec
 * total energy  :   -11.0064130 Eh     change       -0.4399872E-01 Eh
   gradient norm :     0.1508297 Eh/α   predicted    -0.2660216E-01 ( -39.54%)
   displ. norm   :     0.5292130 α      lambda       -0.7319722E-01
   maximum displ.:     0.3848178 α      in ANC's #5, #1, #4, ...

........................................................................
.............................. CYCLE    3 ..............................
........................................................................
   1    -11.0893059 -0.110893E+02  0.503E+00    2.61       0.0  T
   2    -10.8247066  0.264599E+00  0.656E+00    1.75       1.0  T
   3    -11.1128480 -0.288141E+00  0.313E+00    2.65       1.0  T
   4    -11.1561577 -0.433097E-01  0.110E+00    2.80       1.0  T
   5    -11.1584949 -0.233713E-02  0.721E-01    2.70       1.0  T
   6    -11.1593826 -0.887768E-03  0.457E-01    2.79       1.0  T
   7    -11.1600535 -0.670854E-03  0.646E-02    2.76       1.0  T
   8    -11.1600638 -0.103151E-04  0.313E-02    2.77       1.4  T
   9    -11.1600659 -0.210657E-05  0.978E-03    2.77       4.6  T
  10    -11.1600659  0.266049E-07  0.689E-03    2.77       6.5  T
  11    -11.1600660 -0.160627E-06  0.244E-03    2.77      18.4  T
  12    -11.1600661 -0.285662E-07  0.486E-04    2.77      92.1  T
  13    -11.1600661 -0.311200E-09  0.123E-04    2.77     363.6  T
     SCC iter.                  ...        0 min,  0.001 sec
     gradient                   ...        0 min,  0.001 sec
 * total energy  :   -11.0464771 Eh     change       -0.4006401E-01 Eh
   gradient norm :     0.0730650 Eh/α   predicted    -0.4684869E-01 (  16.93%)
   displ. norm   :     0.1031243 α      lambda       -0.6613342E-02
   maximum displ.:     0.0612177 α      in ANC's #3, #1, #4, ...

........................................................................
.............................. CYCLE    4 ..............................
........................................................................
   1    -11.1717658 -0.111718E+02  0.707E-01    2.50       0.0  T
   2    -11.1652850  0.648085E-02  0.993E-01    2.48       1.0  T
   3    -11.1716453 -0.636036E-02  0.510E-01    2.47       1.0  T
   4    -11.1723207 -0.675401E-03  0.275E-01    2.53       1.0  T
   5    -11.1727186 -0.397899E-03  0.124E-01    2.49       1.0  T
   6    -11.1727726 -0.539153E-04  0.758E-02    2.49       1.0  T
   7    -11.1727882 -0.156793E-04  0.293E-02    2.49       1.5  T
   8    -11.1727916 -0.331991E-05  0.404E-03    2.49      11.1  T
   9    -11.1727916 -0.139549E-07  0.999E-04    2.49      44.8  T
  10    -11.1727916  0.924400E-09  0.852E-04    2.49      52.5  T
     SCC iter.                  ...        0 min,  0.001 sec
     gradient                   ...        0 min,  0.001 sec
 * total energy  :   -11.0514597 Eh     change       -0.4982622E-02 Eh
   gradient norm :     0.0439961 Eh/α   predicted    -0.3341835E-02 ( -32.93%)
   displ. norm   :     0.1259561 α      lambda       -0.5434725E-02
   maximum displ.:     0.1136633 α      in ANC's #3, #4, #1, ...

........................................................................
.............................. CYCLE    5 ..............................
........................................................................
   1    -11.1780453 -0.111780E+02  0.841E-01    2.04       0.0  T
   2    -11.1780673 -0.220703E-04  0.492E-01    2.03       1.0  T
   3    -11.1773507  0.716682E-03  0.325E-01    2.04       1.0  T
   4    -11.1781011 -0.750407E-03  0.669E-02    2.03       1.0  T
   5    -11.1781274 -0.263415E-04  0.304E-02    2.04       1.5  T
   6    -11.1781280 -0.591171E-06  0.182E-02    2.03       2.5  T
   7    -11.1781296 -0.155295E-05  0.431E-03    2.04      10.4  T
   8    -11.1781296 -0.453461E-07  0.202E-03    2.04      22.2  T
   9    -11.1781296  0.193849E-08  0.178E-03    2.04      25.2  T
  10    -11.1781296 -0.196088E-07  0.179E-04    2.04     250.3  T
  11    -11.1781296 -0.144862E-10  0.653E-05    2.04     685.1  T
     SCC iter.                  ...        0 min,  0.001 sec
     gradient                   ...        0 min,  0.001 sec
 * total energy  :   -11.0545579 Eh     change       -0.3098205E-02 Eh
   gradient norm :     0.0245696 Eh/α   predicted    -0.2760475E-02 ( -10.90%)
   displ. norm   :     0.1004336 α      lambda       -0.1986952E-02
   maximum displ.:     0.0697106 α      in ANC's #1, #3, #4, ...

........................................................................
.............................. CYCLE    6 ..............................
........................................................................
   1    -11.1775191 -0.111775E+02  0.973E-01    2.07       0.0  T
   2    -11.1771433  0.375760E-03  0.648E-01    2.10       1.0  T
   3    -11.1769822  0.161115E-03  0.520E-01    2.08       1.0  T
   4    -11.1782516 -0.126944E-02  0.853E-02    2.07       1.0  T
   5    -11.1783017 -0.500177E-04  0.308E-02    2.09       1.5  T
   6    -11.1783039 -0.224201E-05  0.172E-02    2.09       2.6  T
   7    -11.1783041 -0.209670E-06  0.518E-03    2.09       8.6  T
   8    -11.1783043 -0.150939E-06  0.124E-03    2.09      36.1  T
   9    -11.1783043  0.183326E-08  0.581E-04    2.09      76.9  T
  10    -11.1783043 -0.237872E-08  0.158E-04    2.09     283.5  T
     SCC iter.                  ...        0 min,  0.001 sec
     gradient                   ...        0 min,  0.001 sec
 * total energy  :   -11.0565055 Eh     change       -0.1947617E-02 Eh
   gradient norm :     0.0277230 Eh/α   predicted    -0.1003498E-02 ( -48.48%)
   displ. norm   :     0.8624012 α      lambda       -0.1723608E-01
   maximum displ.:     0.6501701 α      in ANC's #1, #3, #4, ...

........................................................................
.............................. CYCLE    7 ..............................
........................................................................
   1    -11.0246070 -0.110246E+02  0.753E+00    1.71       0.0  T
   2    -10.7730210  0.251586E+00  0.851E+00    1.52       1.0  T
   3    -11.1282591 -0.355238E+00  0.338E+00    1.40       1.0  T
   4    -11.1454061 -0.171470E-01  0.876E-01    1.60       1.0  T
   5    -11.1496179 -0.421173E-02  0.318E-01    1.42       1.0  T
   6    -11.1498061 -0.188278E-03  0.161E-01    1.45       1.0  T
   7    -11.1498443 -0.381287E-04  0.406E-02    1.45       1.1  T
   8    -11.1498473 -0.307676E-05  0.162E-02    1.45       2.8  T
   9    -11.1498473  0.158899E-07  0.381E-03    1.45      11.7  T
  10    -11.1498474 -0.266501E-07  0.277E-03    1.45      16.2  T
  11    -11.1498474 -0.402990E-07  0.753E-04    1.45      59.4  T
  12    -11.1498474 -0.679979E-09  0.835E-05    1.45     535.9  T
     SCC iter.                  ...        0 min,  0.001 sec
     gradient                   ...        0 min,  0.001 sec
 * total energy  :   -11.0318482 Eh     change        0.2465734E-01 Eh
   gradient norm :     0.1692130 Eh/α   predicted    -0.1502766E-01 (-160.95%)
   displ. norm   :     0.4749896 α      lambda       -0.5937698E-01
   maximum displ.:     0.3457749 α      in ANC's #3, #1, #4, ...

........................................................................
.............................. CYCLE    8 ..............................
........................................................................
   1    -11.1433307 -0.111433E+02  0.380E+00    2.56       0.0  T
   2    -11.1125836  0.307472E-01  0.361E+00    2.94       1.0  T
   3    -11.1648696 -0.522861E-01  0.170E+00    2.75       1.0  T
   4    -11.1704809 -0.561128E-02  0.458E-01    2.78       1.0  T
   5    -11.1711123 -0.631383E-03  0.194E-01    2.83       1.0  T
   6    -11.1711490 -0.367015E-04  0.147E-01    2.79       1.0  T
   7    -11.1712411 -0.921359E-04  0.209E-02    2.81       2.1  T
   8    -11.1712411  0.197341E-07  0.858E-03    2.80       5.2  T
   9    -11.1712413 -0.126301E-06  0.173E-03    2.81      25.8  T
  10    -11.1712412  0.639853E-08  0.160E-03    2.81      27.9  T
  11    -11.1712413 -0.141327E-07  0.262E-04    2.81     170.6  T
  12    -11.1712413 -0.257351E-09  0.802E-05    2.81     557.7  T
     SCC iter.                  ...        0 min,  0.001 sec
     gradient                   ...        0 min,  0.001 sec
 * total energy  :   -11.0606617 Eh     change       -0.2881352E-01 Eh
   gradient norm :     0.0371353 Eh/α   predicted    -0.3638668E-01 (  26.28%)
   displ. norm   :     0.0671680 α      lambda       -0.1453447E-02
   maximum displ.:     0.0429167 α      in ANC's #1, #4, #3, ...

........................................................................
.............................. CYCLE    9 ..............................
........................................................................
   1    -11.1735917 -0.111736E+02  0.544E-01    2.74       0.0  T
   2    -11.1733730  0.218703E-03  0.389E-01    2.75       1.0  T
   3    -11.1734526 -0.796588E-04  0.299E-01    2.75       1.0  T
   4    -11.1738797 -0.427084E-03  0.363E-02    2.75       1.2  T
   5    -11.1738840 -0.429160E-05  0.168E-02    2.75       2.7  T
   6    -11.1738841 -0.115363E-06  0.106E-02    2.76       4.2  T
   7    -11.1738847 -0.566170E-06  0.143E-03    2.75      31.3  T
   8    -11.1738847 -0.110514E-08  0.541E-04    2.75      82.7  T
   9    -11.1738847 -0.201645E-09  0.127E-04    2.75     353.3  T
     SCC iter.                  ...        0 min,  0.001 sec
     gradient                   ...        0 min,  0.001 sec
 * total energy  :   -11.0616529 Eh     change       -0.9912252E-03 Eh
   gradient norm :     0.0227765 Eh/α   predicted    -0.7300047E-03 ( -26.35%)
   displ. norm   :     0.0363962 α      lambda       -0.7488865E-03
   maximum displ.:     0.0292808 α      in ANC's #4, #3, #9, ...

........................................................................
.............................. CYCLE   10 ..............................
........................................................................
   1    -11.1765733 -0.111766E+02  0.278E-01    2.81       0.0  T
   2    -11.1765722  0.108664E-05  0.169E-01    2.81       1.0  T
   3    -11.1764899  0.823350E-04  0.150E-01    2.82       1.0  T
   4    -11.1766122 -0.122311E-03  0.334E-02    2.81       1.3  T
   5    -11.1766179 -0.571618E-05  0.109E-02    2.81       4.1  T
   6    -11.1766181 -0.125200E-06  0.664E-03    2.82       6.7  T
   7    -11.1766182 -0.183134E-06  0.844E-04    2.81      53.0  T
   8    -11.1766182 -0.139243E-09  0.216E-04    2.81     207.2  T
     SCC iter.                  ...        0 min,  0.001 sec
     gradient                   ...        0 min,  0.001 sec
 * total energy  :   -11.0621678 Eh     change       -0.5148440E-03 Eh
   gradient norm :     0.0122611 Eh/α   predicted    -0.3749372E-03 ( -27.17%)
   displ. norm   :     0.0450188 α      lambda       -0.5001666E-03
   maximum displ.:     0.0342803 α      in ANC's #1, #4, #5, ...

........................................................................
.............................. CYCLE   11 ..............................
........................................................................
   1    -11.1777797 -0.111778E+02  0.344E-01    2.97       0.0  T
   2    -11.1777043  0.754208E-04  0.251E-01    2.98       1.0  T
   3    -11.1776698  0.345464E-04  0.188E-01    2.97       1.0  T
   4    -11.1778654 -0.195674E-03  0.178E-02    2.97       2.5  T
   5    -11.1778663 -0.911648E-06  0.774E-03    2.97       5.8  T
   6    -11.1778663  0.468190E-07  0.654E-03    2.97       6.8  T
   7    -11.1778665 -0.212339E-06  0.510E-04    2.97      87.7  T
   8    -11.1778665  0.441673E-10  0.265E-04    2.97     168.8  T
     SCC iter.                  ...        0 min,  0.001 sec
     gradient                   ...        0 min,  0.001 sec
 * total energy  :   -11.0625185 Eh     change       -0.3507161E-03 Eh
   gradient norm :     0.0070897 Eh/α   predicted    -0.2505910E-03 ( -28.55%)
   displ. norm   :     0.0517229 α      lambda       -0.2750283E-03
   maximum displ.:     0.0460557 α      in ANC's #1, #5, #3, ...

........................................................................
.............................. CYCLE   12 ..............................
........................................................................
   1    -11.1778636 -0.111779E+02  0.433E-01    3.13       0.0  T
   2    -11.1775948  0.268800E-03  0.361E-01    3.12       1.0  T
   3    -11.1779149 -0.320094E-03  0.214E-01    3.13       1.0  T
   4    -11.1780949 -0.179982E-03  0.148E-02    3.12       3.0  T
   5    -11.1780951 -0.181524E-06  0.110E-02    3.13       4.1  T
   6    -11.1780956 -0.537247E-06  0.118E-03    3.13      37.8  T
   7    -11.1780956 -0.921931E-09  0.508E-04    3.13      88.0  T
   8    -11.1780956 -0.104450E-11  0.162E-04    3.13     276.5  T
     SCC iter.                  ...        0 min,  0.001 sec
     gradient                   ...        0 min,  0.001 sec
 * total energy  :   -11.0626780 Eh     change       -0.1595097E-03 Eh
   gradient norm :     0.0030161 Eh/α   predicted    -0.1378812E-03 ( -13.56%)
   displ. norm   :     0.0124567 α      lambda       -0.2228951E-04
   maximum displ.:     0.0104828 α      in ANC's #1, #3, #4, ...

........................................................................
.............................. CYCLE   13 ..............................
........................................................................
   1    -11.1780262 -0.111780E+02  0.109E-01    3.15       0.0  T
   2    -11.1780069  0.193087E-04  0.923E-02    3.15       1.0  T
   3    -11.1780328 -0.258961E-04  0.527E-02    3.15       1.0  T
   4    -11.1780430 -0.102426E-04  0.509E-03    3.15       8.8  T
   5    -11.1780431 -0.717196E-07  0.295E-03    3.15      15.1  T
   6    -11.1780431 -0.152753E-07  0.168E-03    3.15      26.7  T
   7    -11.1780431 -0.120154E-07  0.217E-04    3.15     205.7  T
   8    -11.1780431 -0.132978E-10  0.802E-05    3.15     557.5  T
     SCC iter.                  ...        0 min,  0.001 sec
     gradient                   ...        0 min,  0.001 sec
 * total energy  :   -11.0626911 Eh     change       -0.1307522E-04 Eh
   gradient norm :     0.0014449 Eh/α   predicted    -0.1114729E-04 ( -14.74%)
   displ. norm   :     0.0034497 α      lambda       -0.2290300E-05
   maximum displ.:     0.0027135 α      in ANC's #4, #1, #3, ...

........................................................................
.............................. CYCLE   14 ..............................
........................................................................
   1    -11.1782204 -0.111782E+02  0.290E-02    3.15       0.0  T
   2    -11.1782194  0.106315E-05  0.225E-02    3.15       2.0  T
   3    -11.1782203 -0.968752E-06  0.153E-02    3.15       2.9  T
   4    -11.1782214 -0.106489E-05  0.163E-03    3.15      27.4  T
   5    -11.1782214 -0.105133E-07  0.104E-03    3.15      43.1  T
   6    -11.1782214 -0.376841E-08  0.443E-04    3.15     101.0  T
   7    -11.1782214 -0.410074E-09  0.755E-05    3.15     592.2  T
     SCC iter.                  ...        0 min,  0.001 sec
     gradient                   ...        0 min,  0.001 sec
 * total energy  :   -11.0626927 Eh     change       -0.1676614E-05 Eh
   gradient norm :     0.0007382 Eh/α   predicted    -0.1144359E-05 ( -31.75%)
   displ. norm   :     0.0012100 α      lambda       -0.4498407E-06
   maximum displ.:     0.0007518 α      in ANC's #9, #3, #1, ...

   *** GEOMETRY OPTIMIZATION CONVERGED AFTER 14 ITERATIONS ***

------------------------------------------------------------------------
 total energy gain   :        -0.1002784 Eh      -62.9256 kcal/mol
 total RMSD          :         0.5369006 a0        0.2841 Å
 total power (kW/mol):       -18.8057780 (step)-4784.6587 (real)
------------------------------------------------------------------------

 ANCopt (total)                0 d,  0 h,  0 min,  0.055 sec
 optimizer setup                ...        0 min,  0.000 sec (  0.112%)
 model hessian                  ...        0 min,  0.000 sec (  0.176%)
 ANC generation                 ...        0 min,  0.000 sec (  0.089%)
 coordinate transformation      ...        0 min,  0.000 sec (  0.054%)
 single point calculation       ...        0 min,  0.054 sec ( 97.643%)
 optimization log               ...        0 min,  0.000 sec (  0.589%)
 hessian update                 ...        0 min,  0.000 sec (  0.061%)
 rational function              ...        0 min,  0.000 sec (  0.544%)

================
 final structure:
================
5
 xtb: 6.2.2 (9d81278992624c895f80dd42a50cac0aa55982e2)
N         0.62414629874248   -0.79154907801147    0.01042156465239
C         0.03110192094048   -0.00990094919716   -1.00244294393258
C        -0.65527571707412    0.83102383856300   -0.01099175852859
C         0.68160898598368    0.52287008521623    0.51734185112739
C        -0.68158248859253   -0.55244389657059    0.48567128668140

 Bond Distances (Angstroems)
 ---------------------------
N1-C2=1.4102         N1-C4=1.4100         N1-C5=1.4100         C2-N1=1.4102         C2-C3=1.4701         C2-C4=1.7369         
C2-C5=1.7369         C3-C2=1.4701         C3-C4=1.4702         C3-C5=1.4702         C4-N1=1.4100         C4-C2=1.7369         
C4-C3=1.4702         C4-C5=1.7365         C5-N1=1.4100         C5-C2=1.7369         C5-C3=1.4702         C5-C4=1.7365         
 C  C  Rav=1.6035 sigma=0.1333  Rmin=1.4701  Rmax=1.7369     6
 N  C  Rav=1.4100 sigma=0.0001  Rmin=1.4100  Rmax=1.4102     3

 selected bond angles (degree)
 --------------------
C4-N1-C2= 76.03                C5-N1-C2= 76.03                C5-N1-C4= 76.02                C3-C2-N1= 91.66                
C4-C2-N1= 51.98                C4-C2-C3= 53.79                C5-C2-N1= 51.98                C5-C2-C3= 53.79                
C5-C2-C4= 59.99                C4-C3-C2= 72.42                C5-C3-C2= 72.42                C5-C3-C4= 72.40                
C2-C4-N1= 51.99                C3-C4-N1= 91.67                C3-C4-C2= 53.79                C5-C4-N1= 51.99                
C5-C4-C2= 60.01                C5-C4-C3= 53.80                C2-C5-N1= 51.99                C3-C5-N1= 91.67                
C3-C5-C2= 53.79                C4-C5-N1= 51.99                C4-C5-C2= 60.01                C4-C5-C3= 53.80                

 selected dihedral angles (degree)
 ---------------------------------
C3-C2-N1-C4=320.61            C3-C2-N1-C5= 39.39            C4-C2-N1-C5= 78.78            C5-C2-N1-C4=281.22            
C4-C3-C2-N1= 38.28            C4-C3-C2-C5= 76.57            C5-C3-C2-N1=321.72            C5-C3-C2-C4=283.43            
C2-C4-N1-C5=281.21            C3-C4-N1-C2= 39.39            C3-C4-N1-C5=320.60            C5-C4-N1-C2= 78.79            
N1-C4-C2-C3=128.18            N1-C4-C2-C5= 63.17            C3-C4-C2-N1=231.82            C3-C4-C2-C5=295.00            
C5-C4-C2-N1=296.83            C5-C4-C2-C3= 65.00            N1-C4-C3-C2=321.71            N1-C4-C3-C5= 38.30            
C2-C4-C3-C5= 76.59            C5-C4-C3-C2=283.41            C2-C5-N1-C4= 78.79            C3-C5-N1-C2=320.61            
C3-C5-N1-C4= 39.40            C4-C5-N1-C2=281.21            N1-C5-C2-C3=231.82            N1-C5-C2-C4=296.83            
C3-C5-C2-N1=128.18            C3-C5-C2-C4= 65.00            C4-C5-C2-N1= 63.17            C4-C5-C2-C3=295.00            
N1-C5-C3-C2= 38.29            N1-C5-C3-C4=321.70            C2-C5-C3-C4=283.41            C4-C5-C3-C2= 76.59            
N1-C5-C4-C2= 63.17            N1-C5-C4-C3=128.16            C2-C5-C4-N1=296.83            C2-C5-C4-C3= 64.99            
C3-C5-C4-N1=231.84            C3-C5-C4-C2=295.01            
           -------------------------------------------------
          |                Final Singlepoint                |
           -------------------------------------------------

          ...................................................
          :                      SETUP                      :
          :.................................................:
          :  # basis functions                  20          :
          :  # atomic orbitals                  20          :
          :  # shells                           10          :
          :  # electrons                        21          :
          :  max. iterations                   250          :
          :  Hamiltonian                  GFN2-xTB          :
          :  restarted?                      false          :
          :  GBSA solvation                  false          :
          :  PC potential                    false          :
          :  electronic temp.          300.0000000     K    :
          :  accuracy                    1.0000000          :
          :  -> integral cutoff          0.2500000E+02      :
          :  -> integral neglect         0.1000000E-07      :
          :  -> SCF convergence          0.1000000E-05 Eh   :
          :  -> wf. convergence          0.1000000E-03 e    :
          :  Broyden damping             0.4000000          :
          ...................................................

 iter      E             dE          RMSdq      gap      omega  full diag
   1    -11.1782214 -0.111782E+02  0.129E-05    3.15       0.0  T
   2    -11.1782214  0.213163E-12  0.997E-06    3.15    4483.9  T
   3    -11.1782214 -0.168754E-12  0.789E-06    3.15    5671.6  T

   *** convergence criteria satisfied after 3 iterations ***

         #    Occupation            Energy/Eh            Energy/eV
      -------------------------------------------------------------
         1        2.0000           -0.7941638             -21.6103
       ...           ...                  ...                  ...
         5        2.0000           -0.5599337             -15.2366
         6        2.0000           -0.5599103             -15.2359
         7        2.0000           -0.5314276             -14.4609
         8        2.0000           -0.4787635             -13.0278
         9        2.0000           -0.4699601             -12.7883
        10        2.0000           -0.4699431             -12.7878
        11        1.0000           -0.4286659             -11.6646 (HOMO)
        12                         -0.3128178              -8.5122 (LUMO)
        13                         -0.3127507              -8.5104
        14                         -0.2480155              -6.7488
        15                         -0.0017111              -0.0466
        16                         -0.0016977              -0.0462
       ...                                ...                  ...
        20                          0.3666511               9.9771
      -------------------------------------------------------------
                  HL-Gap            0.1158482 Eh            3.1524 eV
             Fermi-level           -0.4098667 Eh          -11.1530 eV

 SCC (total)                   0 d,  0 h,  0 min,  0.004 sec
 SCC setup                      ...        0 min,  0.000 sec (  1.465%)
 Dispersion                     ...        0 min,  0.000 sec (  0.370%)
 integral evaluation            ...        0 min,  0.001 sec ( 37.440%)
 zeroth order Hamiltonian       ...        0 min,  0.000 sec (  0.444%)
 iterations                     ...        0 min,  0.001 sec ( 15.426%)
 molecular gradient             ...        0 min,  0.001 sec ( 41.756%)
 printout                       ...        0 min,  0.000 sec (  2.823%)

         :::::::::::::::::::::::::::::::::::::::::::::::::::::
         ::                     SUMMARY                     ::
         :::::::::::::::::::::::::::::::::::::::::::::::::::::
         :: total energy             -11.062692728261 Eh    ::
         :: gradient norm              0.000740609803 Eh/a0 ::
         :: HOMO-LUMO gap              3.152388679178 eV    ::
         ::.................................................::
         :: SCC energy               -11.178221426255 Eh    ::
         :: -> isotropic ES           -0.010307137417 Eh    ::
         :: -> anisotropic ES          0.007123885349 Eh    ::
         :: -> anisotropic XC          0.001649759601 Eh    ::
         :: -> dispersion             -0.002327345911 Eh    ::
         :: repulsion energy           0.115528684093 Eh    ::
         :: add. restraining           0.000000000000 Eh    ::
         :::::::::::::::::::::::::::::::::::::::::::::::::::::

           ------------------------------------------------- 
          |                Numerical Hessian                |
           ------------------------------------------------- 
step length          :   0.00500
SCC accuracy         :   0.30000
Hessian scale factor :   1.00000
frozen atoms in %    :   0.00000    0
RMS gradient         :   0.00074
estimated CPU  time      0.00 min
estimated wall time      0.00 min

writing file <hessian>.

 projected vibrational frequencies (cm-1)
eigval :       -0.00    -0.00    -0.00     0.00     0.00     0.00
eigval :      405.48   405.63   821.47   848.63   848.82  1038.91
eigval :     1039.62  1277.58  1393.58
           -------------------------------------------------
          |                Property Printout                |
           -------------------------------------------------

    * Orbital Energies and Occupations

         #    Occupation            Energy/Eh            Energy/eV
      -------------------------------------------------------------
         1        2.0000           -0.7941638             -21.6103
         2        2.0000           -0.6760757             -18.3970
         3        2.0000           -0.6646387             -18.0857
         4        2.0000           -0.6646140             -18.0851
         5        2.0000           -0.5599337             -15.2366
         6        2.0000           -0.5599103             -15.2359
         7        2.0000           -0.5314276             -14.4609
         8        2.0000           -0.4787635             -13.0278
         9        2.0000           -0.4699601             -12.7883
        10        2.0000           -0.4699431             -12.7878
        11        1.0000           -0.4286659             -11.6646 (HOMO)
        12                         -0.3128178              -8.5122 (LUMO)
        13                         -0.3127507              -8.5104
        14                         -0.2480155              -6.7488
        15                         -0.0017111              -0.0466
        16                         -0.0016976              -0.0462
        17                          0.0667353               1.8160
        18                          0.0669379               1.8215
        19                          0.0917292               2.4961
        20                          0.3666511               9.9771
      -------------------------------------------------------------
                  HL-Gap            0.1158481 Eh            3.1524 eV
             Fermi-level           -0.4098667 Eh          -11.1530 eV

     #   Z        covCN         q      C6AA      α(0)
     1   7 N      2.961     0.014    21.006     6.807
     2   6 C      3.689    -0.022    21.159     6.583
     3   6 C      3.169     0.052    26.474     8.406
     4   6 C      3.690    -0.022    21.158     6.583
     5   6 C      3.690    -0.022    21.158     6.583

 Mol. C6AA /au·bohr⁶  :        552.646701
 Mol. C8AA /au·bohr⁸  :      15204.312854
 Mol. α(0) /au        :         34.962743


Wiberg/Mayer (AO) data.
largest (>0.10) Wiberg bond orders for each atom
          total WBO             WBO to atom ...
     1  N   3.056        C    5 0.969    C    4 0.969    C    2 0.969    C    3 0.149
     2  C   3.005        N    1 0.969    C    3 0.941    C    4 0.547    C    5 0.547
     3  C   2.973        C    2 0.941    C    5 0.941    C    4 0.941    N    1 0.149
     4  C   3.005        N    1 0.969    C    3 0.941    C    2 0.547    C    5 0.547
     5  C   3.005        N    1 0.969    C    3 0.941    C    2 0.547    C    4 0.547

MOs/occ written to file <molden.input>


molecular dipole:
                 x           y           z       tot (Debye)
 q only:       -0.050       0.063      -0.001
   full:       -0.015       0.019      -0.000       0.060
molecular quadrupole (traceless):
                xx          xy          yy          xz          yz          zz
 q only:        0.028      -0.276       0.161       0.004      -0.005      -0.189
  q+dip:        0.150      -1.464       0.853       0.019      -0.024      -1.003
   full:        0.083      -0.814       0.474       0.011      -0.014      -0.557

           -------------------------------------------------
          |                Geometry Summary                 |
           -------------------------------------------------

      molecular mass/u    :       62.0496468
   center of mass at/Å    :        0.0200768      -0.0254621       0.0003352
  moments of inertia/u·Å² :        0.3622878E+02   0.4574180E+02   0.4575108E+02
rotational constants/cm⁻¹ :        0.4653105E+00   0.3685389E+00   0.3684642E+00

 * 6 selected distances

     #   Z        #   Z                                     value/Å
     1   7 N      2   6 C                                 1.4101666
     2   6 C      3   6 C                                 1.4701171
     1   7 N      4   6 C                                 1.4099531
     3   6 C      4   6 C                                 1.4701550 (max)
     1   7 N      5   6 C                                 1.4099508 (min)
     3   6 C      5   6 C                                 1.4701528

 * 2 distinct bonds (by element types)

   Z      Z             #   av. dist./Å        max./Å        min./Å
   6 C    6 C           3     1.4701416     1.4701550     1.4701171
   6 C    7 N           3     1.4100235     1.4101666     1.4099508

           -------------------------------------------------
          |               Frequency Printout                |
           -------------------------------------------------
 projected vibrational frequencies (cm-1)
eigval :       -0.00    -0.00    -0.00     0.00     0.00     0.00
eigval :      405.48   405.63   821.47   848.63   848.82  1038.91
eigval :     1039.62  1277.58  1393.58
 reduced masses (amu)
   1: 12.17   2: 12.35   3: 12.38   4: 12.43   5: 12.45   6: 12.80   7: 12.37   8: 12.37
   9: 12.38  10: 12.48  11: 12.48  12: 12.15  13: 12.15  14: 12.65  15: 12.55
 IR intensities (amu)
   1:  0.02   2:  0.05   3:  0.03   4:  0.02   5:  0.03   6:  0.03   7:  0.87   8:  0.87
   9:  0.14  10:  0.16  11:  0.16  12:  1.04  13:  1.04  14:  0.94  15:  0.22
 Raman intensities (amu)
   1:  0.00   2:  0.00   3:  0.00   4:  0.00   5:  0.00   6:  0.00   7:  0.00   8:  0.00
   9:  0.00  10:  0.00  11:  0.00  12:  0.00  13:  0.00  14:  0.00  15:  0.00
 output can be read by thermo (or use thermo option).
 writing <g98.out> molden fake output.
 recommended (thermochemical) frequency scaling factor: 1.0
           -------------------------------------------------
          |             Thermodynamic Functions             |
           -------------------------------------------------
Refinement of some symmetry elements was terminated before convergence was reached.
Some symmetry elements may remain unidentified.
Molecule has the following symmetry elements: (C3) 3*(sigma) 
It seems to be the C3v point group

c3v symmetry found (for desy threshold:  0.10E+00) used in thermo

          ...................................................
          :                      SETUP                      :
          :.................................................:
          :  # frequencies                           9      :
          :  # imaginary freq.                       0      :
          :  linear?                             false      :
          :  only rotor calc.                    false      :
          :  symmetry                              c3v      :
          :  rotational number                       3      :
          :  scaling factor                  1.0000000      :
          :  rotor cutoff                   50.0000000 cm⁻¹ :
          :  imag. cutoff                  -20.0000000 cm⁻¹ :
          :.................................................:

    mode    ω/cm⁻¹     T·S(HO)/kcal·mol⁻¹    T·S(FR)/kcal·mol⁻¹   T·S(vib)
   ------------------------------------------------------------------------
   ------------------------------------------------------------------------

   temp. (K)  partition function   enthalpy   heat capacity  entropy
                                   cal/mol     cal/K/mol   cal/K/mol   J/K/mol
 298.15  VIB   1.45                  561.307      5.620      2.626
         ROT  0.701E+04              888.752      2.981     20.579
         INT  0.102E+05             1450.059      8.601     23.205
         TR   0.473E+27             1481.254      4.968     38.278
         TOT                        2931.3132    13.5688    61.4828   257.2440

   temp. (K)  partition function   enthalpy   heat capacity  entropy
                                   cal/mol     cal/K/mol   cal/K/mol   J/K/mol
 120.00  VIB   1.02                   18.401      0.766      0.185
         ROT  0.179E+04              357.707      2.981     17.866
         INT  0.182E+04              376.108      3.747     18.050
         TR   0.121E+27              596.178      4.968     33.759
         TOT                         972.2859     8.7153    51.8092   216.7695

   temp. (K)  partition function   enthalpy   heat capacity  entropy
                                   cal/mol     cal/K/mol   cal/K/mol   J/K/mol
 100.00  VIB   1.01                    6.843      0.403      0.080
         ROT  0.136E+04              298.089      2.981     17.322
         INT  0.137E+04              304.932      3.384     17.402
         TR   0.919E+26              496.815      4.968     32.853
         TOT                         801.7466     8.3522    50.2559   210.2706

   temp. (K)  partition function   enthalpy   heat capacity  entropy
                                   cal/mol     cal/K/mol   cal/K/mol   J/K/mol
  80.00  VIB   1.00                    1.580      0.144      0.022
         ROT   975.                  238.471      2.981     16.657
         INT   976.                  240.051      3.125     16.680
         TR   0.657E+26              397.452      4.968     31.745
         TOT                         637.5027     8.0934    48.4249   202.6098

   temp. (K)  partition function   enthalpy   heat capacity  entropy
                                   cal/mol     cal/K/mol   cal/K/mol   J/K/mol
  60.00  VIB   1.00                    0.139      0.022      0.002
         ROT   633.                  178.853      2.981     15.800
         INT   633.                  178.992      3.003     15.802
         TR   0.427E+26              298.089      4.968     30.317
         TOT                         477.0810     7.9715    46.1188   192.9609

   temp. (K)  partition function   enthalpy   heat capacity  entropy
                                   cal/mol     cal/K/mol   cal/K/mol   J/K/mol
  40.00  VIB   1.00                    0.001      0.000     -0.000
         ROT   345.                  119.236      2.981     14.591
         INT   345.                  119.237      2.981     14.591
         TR   0.232E+26              198.726      4.968     28.303
         TOT                         317.9627     7.9494    42.8940   179.4683

   temp. (K)  partition function   enthalpy   heat capacity  entropy
                                   cal/mol     cal/K/mol   cal/K/mol   J/K/mol
  20.00  VIB   1.00                    0.000      0.000     -0.001
         ROT   122.                   59.618      2.981     12.525
         INT   122.                   59.618      2.981     12.524
         TR   0.822E+25               99.363      4.968     24.861
         TOT                         158.9808     7.9490    37.3854   156.4205

   temp. (K)  partition function   enthalpy   heat capacity  entropy
                                   cal/mol     cal/K/mol   cal/K/mol   J/K/mol
  10.00  VIB   1.00                    0.000      0.000     -0.001
         ROT   43.1                   29.809      2.981     10.458
         INT   43.1                   29.809      2.981     10.457
         TR   0.290E+25               49.681      4.968     21.419
         TOT                          79.4904     7.9490    31.8769   133.3729

       T/K    H(0)-H(T)+PV         H(T)/Eh          T*S/Eh         G(T)/Eh
   ------------------------------------------------------------------------
    298.15    0.467134E-02    0.230783E-01    0.292125E-01   -0.613414E-02
    120.00    0.154944E-02    0.199564E-01    0.990758E-02    0.100488E-01
    100.00    0.127766E-02    0.196846E-01    0.800879E-02    0.116759E-01
     80.00    0.101593E-02    0.194229E-01    0.617360E-02    0.132493E-01
     60.00    0.760277E-03    0.191673E-01    0.440970E-02    0.147576E-01
     40.00    0.506706E-03    0.189137E-01    0.273424E-02    0.161794E-01
     20.00    0.253352E-03    0.186603E-01    0.119155E-02    0.174688E-01
     10.00    0.126676E-03    0.185337E-01    0.507990E-03    0.180257E-01 (used)
   ------------------------------------------------------------------------

         :::::::::::::::::::::::::::::::::::::::::::::::::::::
         ::                  THERMODYNAMIC                  ::
         :::::::::::::::::::::::::::::::::::::::::::::::::::::
         :: total free energy         -11.044667063707 Eh   ::
         ::.................................................::
         :: total energy              -11.062692728266 Eh   ::
         :: zero point energy           0.018406978984 Eh   ::
         :: G(RRHO) w/o ZPVE           -0.000381314425 Eh   ::
         :: G(RRHO) contrib.            0.018025664559 Eh   ::
         :::::::::::::::::::::::::::::::::::::::::::::::::::::

optimized geometry written to: xtbopt.xyz


           -------------------------------------------------
          | TOTAL ENERGY              -11.062692728266 Eh   |
          | TOTAL ENTHALPY            -11.044159073266 Eh   |
          | TOTAL FREE ENERGY         -11.044667063707 Eh   |
          | GRADIENT NORM               0.000740601957 Eh/α |
          | HOMO-LUMO GAP               3.152387988939 eV   |
           -------------------------------------------------

------------------------------------------------------------------------
 * finished run on 2020/05/12 at 11:44:20.935     
------------------------------------------------------------------------
 total:
 * wall-time:     0 d,  0 h,  0 min,  0.189 sec
 *  cpu-time:     0 d,  0 h,  0 min,  0.189 sec
 * ratio c/w:     0.998 speedup
 SCF:
 * wall-time:     0 d,  0 h,  0 min,  0.005 sec
 *  cpu-time:     0 d,  0 h,  0 min,  0.005 sec
 * ratio c/w:     1.000 speedup
 ANC optimizer:
 * wall-time:     0 d,  0 h,  0 min,  0.060 sec
 *  cpu-time:     0 d,  0 h,  0 min,  0.059 sec
 * ratio c/w:     0.999 speedup
 numerical hessian:
 * wall-time:     0 d,  0 h,  0 min,  0.109 sec
 *  cpu-time:     0 d,  0 h,  0 min,  0.109 sec
 * ratio c/w:     0.997 speedup

