      -----------------------------------------------------------      
     |                   =====================                   |     
     |                           x T B                           |     
     |                   =====================                   |     
     |                         S. Grimme                         |     
     |          Mulliken Center for Theoretical Chemistry        |     
     |                    University of Bonn                     |     
      -----------------------------------------------------------      

   * xtb version 6.2.2 (9d81278992624c895f80dd42a50cac0aa55982e2) compiled by '@Darwin' on 04/03/2020

   xtb is free software: you can redistribute it and/or modify it under
   the terms of the GNU Lesser General Public License as published by
   the Free Software Foundation, either version 3 of the License, or
   (at your option) any later version.
   
   xtb is distributed in the hope that it will be useful,
   but WITHOUT ANY WARRANTY; without even the implied warranty of
   MERCHANTABILITY or FITNESS FOR A PARTICULAR PURPOSE.  See the
   GNU Lesser General Public License for more details.
   
   Cite this work as:
   * S. Grimme, C. Bannwarth, P. Shushkov, J. Chem. Theory Comput., 2017,
     13, 1989-2009. DOI: 10.1021/acs.jctc.7b00118
   * C. Bannwarth, S. Ehlert and S. Grimme., J. Chem. Theory Comput., 2019,
     15, 1652-1671. DOI: 10.1021/acs.jctc.8b01176
   * P. Pracht, E. Caldeweyher, S. Ehlert, S. Grimme, ChemRxiv, 2019, preprint.
     DOI: 10.26434/chemrxiv.8326202.v1
   
   for DFT-D4:
   * E. Caldeweyher, C. Bannwarth and S. Grimme, J. Chem. Phys., 2017,
     147, 034112. DOI: 10.1063/1.4993215
   * E. Caldeweyher, S. Ehlert, A. Hansen, H. Neugebauer, S. Spicher,
     C. Bannwarth and S. Grimme, J. Chem. Phys., 2019, 150, 154122.
     DOI: 10.1063/1.5090222
   
   for sTDA-xTB:
   * S. Grimme and C. Bannwarth, J. Chem. Phys., 2016, 145, 054103.
     DOI: 10.1063/1.4959605
   
   in the mass-spec context:
   * V. Asgeirsson, C. Bauer and S. Grimme, Chem. Sci., 2017, 8, 4879.
     DOI: 10.1039/c7sc00601b
   
   for metadynamics refer to:
   * S. Grimme, J. Chem. Theory Comput., 2019, 155, 2847-2862
     DOI: 10.1021/acs.jctc.9b00143
   
   with help from (in alphabetical order)
   C. Bannwarth, F. Bohle, G. Brandenburg, E. Caldeweyher, M. Checinski,
   S. Dohm, S. Ehlert, S. Ehrlich, F. März, H. Neugebauer, J. Pisarek,
   P. Pracht, P. Shushkov, and S. Spicher.
   
 * started run on 2020/05/12 at 11:45:00.800     

           -------------------------------------------------
          |                Calculation Setup                |
           -------------------------------------------------

          program call               : xtb --input H1C3N1_27_S_0.input H1C3N1_27_S_0.xyz --ohess --molden --namespace H1C3N1_27_S_0 output.out
          calculation namespace      : H1C3N1_27_S_0
          coordinate file            : H1C3N1_27_S_0.xyz
          number of atoms            :                     5
          number of electrons        :                    18
          charge                     :                     0
          spin                       :                   0.0
          first test random number   :      0.37170376142587

   ID    Z sym.   atoms
    1    6 C      1-3
    2    7 N      4
    3    1 H      5

           -------------------------------------------------
          |                 G F N 2 - x T B                 |
           -------------------------------------------------

        Reference                      10.1021/acs.jctc.8b01176
      * Hamiltonian:
        H0-scaling (s, p, d)           1.850000    2.230000    2.230000
        zeta-weighting                 0.500000
      * Dispersion:
        s8                             2.700000
        a1                             0.520000
        a2                             5.000000
        s9                             5.000000
      * Repulsion:
        kExp                           1.500000    1.000000
        rExp                           1.000000
      * Coulomb:
        alpha                          2.000000
        third order                    shell-resolved
        anisotropic                    true
        a3                             3.000000
        a5                             4.000000
        cn-shift                       1.200000
        cn-exp                         4.000000
        max-rad                        5.000000


          ...................................................
          :                      SETUP                      :
          :.................................................:
          :  # basis functions                  17          :
          :  # atomic orbitals                  17          :
          :  # shells                            9          :
          :  # electrons                        18          :
          :  max. iterations                   250          :
          :  Hamiltonian                  GFN2-xTB          :
          :  restarted?                      false          :
          :  GBSA solvation                  false          :
          :  PC potential                    false          :
          :  electronic temp.          300.0000000     K    :
          :  accuracy                    1.0000000          :
          :  -> integral cutoff          0.2500000E+02      :
          :  -> integral neglect         0.1000000E-07      :
          :  -> SCF convergence          0.1000000E-05 Eh   :
          :  -> wf. convergence          0.1000000E-03 e    :
          :  Broyden damping             0.4000000          :
          ...................................................

 iter      E             dE          RMSdq      gap      omega  full diag
   1     -9.5891473 -0.958915E+01  0.935E+00    1.77       0.0  T
   2     -9.5964191 -0.727184E-02  0.573E+00    1.84       1.0  T
   3     -9.5836768  0.127423E-01  0.212E+00    1.05       1.0  T
   4     -9.6019249 -0.182481E-01  0.554E-01    1.45       1.0  T
   5     -9.6019751 -0.502588E-04  0.310E-01    1.41       1.0  T
   6     -9.6019137  0.614880E-04  0.158E-01    1.48       1.0  T
   7     -9.6020103 -0.966119E-04  0.525E-02    1.43       1.0  T
   8     -9.6020218 -0.115283E-04  0.115E-02    1.44       3.9  T
   9     -9.6020222 -0.441530E-06  0.504E-03    1.44       8.9  T
  10     -9.6020223 -0.993951E-07  0.322E-03    1.44      13.9  T
  11     -9.6020224 -0.583020E-07  0.437E-04    1.44     102.3  T
  12     -9.6020224 -0.513937E-09  0.165E-04    1.44     271.5  T

   *** convergence criteria satisfied after 12 iterations ***

         #    Occupation            Energy/Eh            Energy/eV
      -------------------------------------------------------------
         1        2.0000           -0.7580230             -20.6269
       ...           ...                  ...                  ...
         3        2.0000           -0.6240373             -16.9809
         4        2.0000           -0.5931263             -16.1398
         5        2.0000           -0.5275403             -14.3551
         6        2.0000           -0.5163663             -14.0510
         7        2.0000           -0.5071005             -13.7989
         8        2.0000           -0.4662378             -12.6870
         9        2.0000           -0.4466458             -12.1539 (HOMO)
        10                         -0.3937788             -10.7153 (LUMO)
        11                         -0.3378658              -9.1938
        12                         -0.2567308              -6.9860
        13                         -0.0258037              -0.7022
        14                         -0.0112036              -0.3049
       ...                                ...                  ...
        17                          0.2212734               6.0212
      -------------------------------------------------------------
                  HL-Gap            0.0528671 Eh            1.4386 eV
             Fermi-level           -0.4202123 Eh          -11.4346 eV

 SCC (total)                   0 d,  0 h,  0 min,  0.004 sec
 SCC setup                      ...        0 min,  0.000 sec (  2.321%)
 Dispersion                     ...        0 min,  0.000 sec (  0.476%)
 integral evaluation            ...        0 min,  0.001 sec ( 27.360%)
 zeroth order Hamiltonian       ...        0 min,  0.000 sec (  0.526%)
 iterations                     ...        0 min,  0.001 sec ( 38.774%)
 molecular gradient             ...        0 min,  0.001 sec ( 28.565%)
 printout                       ...        0 min,  0.000 sec (  1.731%)

         :::::::::::::::::::::::::::::::::::::::::::::::::::::
         ::                     SUMMARY                     ::
         :::::::::::::::::::::::::::::::::::::::::::::::::::::
         :: total energy              -9.515661373962 Eh    ::
         :: gradient norm              0.157748362978 Eh/a0 ::
         :: HOMO-LUMO gap              1.438586066804 eV    ::
         ::.................................................::
         :: SCC energy                -9.602022393011 Eh    ::
         :: -> isotropic ES           -0.013751142053 Eh    ::
         :: -> anisotropic ES          0.003385409987 Eh    ::
         :: -> anisotropic XC          0.014454659511 Eh    ::
         :: -> dispersion             -0.002059336664 Eh    ::
         :: repulsion energy           0.086360985408 Eh    ::
         :: add. restraining           0.000000000000 Eh    ::
         :::::::::::::::::::::::::::::::::::::::::::::::::::::

      ----------------------------------------------------------- 
     |                   =====================                   |
     |                        A N C O P T                        |
     |                   =====================                   |
     |               Approximate Normal Coordinate               |
     |                Rational Function Optimizer                |
      ----------------------------------------------------------- 

          ...................................................
          :                      SETUP                      :
          :.................................................:
          :   optimization level            normal          :
          :   max. optcycles                   200          :
          :   ANC micro-cycles                  20          :
          :   degrees of freedom                 9          :
          :.................................................:
          :   RF solver                   davidson          :
          :   write xtbopt.log                true          :
          :   linear?                        false          :
          :   energy convergence         0.5000000E-05 Eh   :
          :   grad. convergence          0.1000000E-02 Eh/α :
          :   maximium RF displ.         1.0000000          :
          :   Hlow (freq-cutoff)         0.1000000E-01      :
          :   Hmax (freq-cutoff)         5.0000000          :
          :   S6 in model hess.         20.0000000          :
          ...................................................

generating ANC from model Hessian ...
Using Lindh-Hessian (1995)
 Shifting diagonal of input Hessian by    0.0000000000000000     
 Lowest  eigenvalues of input Hessian
   -0.000000   -0.000000    0.000000    0.000000    0.000000    0.000000
    0.097881    0.127453    0.149876    0.573659    0.677013    0.977615
    1.020624    1.437817    1.555423
 Highest eigenvalues
    0.573659    0.677013    0.977615    1.020624    1.437817    1.555423


........................................................................
.............................. CYCLE    1 ..............................
........................................................................
   1     -9.6020224 -0.960202E+01  0.257E-05    1.44       0.0  T
   2     -9.6020224 -0.982325E-12  0.196E-05    1.44    2281.9  T
   3     -9.6020224 -0.147615E-11  0.642E-06    1.44    6966.6  T
     SCC iter.                  ...        0 min,  0.001 sec
     gradient                   ...        0 min,  0.001 sec
 * total energy  :    -9.5156614 Eh     change       -0.1938190E-08 Eh
   gradient norm :     0.1577470 Eh/α   predicted     0.0000000E+00 (-100.00%)
   displ. norm   :     0.4066014 α      lambda       -0.5179537E-01
   maximum displ.:     0.3504533 α      in ANC's #3, #5, #1, ...

........................................................................
.............................. CYCLE    2 ..............................
........................................................................
   1     -9.6490694 -0.964907E+01  0.214E+00    2.22       0.0  T
   2     -9.6519173 -0.284783E-02  0.114E+00    2.53       1.0  T
   3     -9.6527778 -0.860534E-03  0.708E-01    2.41       1.0  T
   4     -9.6532381 -0.460346E-03  0.959E-02    2.48       1.0  T
   5     -9.6532773 -0.391375E-04  0.382E-02    2.48       1.2  T
   6     -9.6532782 -0.880604E-06  0.805E-03    2.48       5.6  T
   7     -9.6532782 -0.745752E-07  0.340E-03    2.48      13.2  T
   8     -9.6532782  0.302799E-07  0.228E-03    2.48      19.6  T
   9     -9.6532782 -0.459398E-07  0.483E-04    2.48      92.6  T
  10     -9.6532782 -0.459314E-09  0.465E-05    2.48     961.6  T
     SCC iter.                  ...        0 min,  0.001 sec
     gradient                   ...        0 min,  0.001 sec
 * total energy  :    -9.5570022 Eh     change       -0.4134083E-01 Eh
   gradient norm :     0.1052288 Eh/α   predicted    -0.3017920E-01 ( -27.00%)
   displ. norm   :     0.4401078 α      lambda       -0.4017093E-01
   maximum displ.:     0.3259054 α      in ANC's #3, #5, #4, ...

........................................................................
.............................. CYCLE    3 ..............................
........................................................................
   1     -9.6978500 -0.969785E+01  0.269E+00    3.30       0.0  T
   2     -9.7039942 -0.614427E-02  0.140E+00    3.34       1.0  T
   3     -9.7049104 -0.916219E-03  0.784E-01    3.29       1.0  T
   4     -9.7051533 -0.242883E-03  0.652E-02    3.28       1.0  T
   5     -9.7051520  0.135135E-05  0.272E-02    3.28       1.6  T
   6     -9.7051549 -0.294985E-05  0.116E-02    3.27       3.9  T
   7     -9.7051552 -0.286946E-06  0.410E-03    3.27      10.9  T
   8     -9.7051552 -0.154148E-07  0.572E-04    3.27      78.2  T
   9     -9.7051552  0.137098E-08  0.441E-04    3.27     101.4  T
     SCC iter.                  ...        0 min,  0.001 sec
     gradient                   ...        0 min,  0.001 sec
 * total energy  :    -9.5772103 Eh     change       -0.2020814E-01 Eh
   gradient norm :     0.0365350 Eh/α   predicted    -0.2397592E-01 (  18.64%)
   displ. norm   :     0.0644596 α      lambda       -0.1671738E-02
   maximum displ.:     0.0391998 α      in ANC's #3, #1, #6, ...

........................................................................
.............................. CYCLE    4 ..............................
........................................................................
   1     -9.6995696 -0.969957E+01  0.325E-01    3.25       0.0  T
   2     -9.6996597 -0.900502E-04  0.216E-01    3.26       1.0  T
   3     -9.6997316 -0.719744E-04  0.119E-01    3.25       1.0  T
   4     -9.6997419 -0.102486E-04  0.196E-02    3.26       2.3  T
   5     -9.6997431 -0.124094E-05  0.795E-03    3.26       5.6  T
   6     -9.6997432 -0.136839E-07  0.104E-03    3.26      43.1  T
   7     -9.6997432  0.992687E-09  0.579E-04    3.26      77.2  T
   8     -9.6997432 -0.648114E-09  0.405E-04    3.26     110.3  T
     SCC iter.                  ...        0 min,  0.001 sec
     gradient                   ...        0 min,  0.001 sec
 * total energy  :    -9.5782364 Eh     change       -0.1026007E-02 Eh
   gradient norm :     0.0094921 Eh/α   predicted    -0.8393407E-03 ( -18.19%)
   displ. norm   :     0.0470902 α      lambda       -0.3277500E-03
   maximum displ.:     0.0369078 α      in ANC's #3, #4, #1, ...

........................................................................
.............................. CYCLE    5 ..............................
........................................................................
   1     -9.6991444 -0.969914E+01  0.208E-01    3.33       0.0  T
   2     -9.6991630 -0.185476E-04  0.124E-01    3.33       1.0  T
   3     -9.6991689 -0.591824E-05  0.743E-02    3.32       1.0  T
   4     -9.6991809 -0.120197E-04  0.108E-02    3.33       4.1  T
   5     -9.6991811 -0.145214E-06  0.468E-03    3.32       9.6  T
   6     -9.6991811 -0.556103E-08  0.737E-04    3.32      60.7  T
   7     -9.6991811  0.310331E-09  0.292E-04    3.32     153.4  T
     SCC iter.                  ...        0 min,  0.001 sec
     gradient                   ...        0 min,  0.001 sec
 * total energy  :    -9.5784171 Eh     change       -0.1807942E-03 Eh
   gradient norm :     0.0043107 Eh/α   predicted    -0.1642372E-03 (  -9.16%)
   displ. norm   :     0.0134904 α      lambda       -0.3119746E-04
   maximum displ.:     0.0099525 α      in ANC's #1, #4, #3, ...

........................................................................
.............................. CYCLE    6 ..............................
........................................................................
   1     -9.6996908 -0.969969E+01  0.460E-02    3.33       0.0  T
   2     -9.6996916 -0.778359E-06  0.264E-02    3.33       1.7  T
   3     -9.6996915  0.121328E-06  0.131E-02    3.33       3.4  T
   4     -9.6996919 -0.438570E-06  0.336E-03    3.33      13.3  T
   5     -9.6996919 -0.259955E-07  0.139E-03    3.33      32.3  T
   6     -9.6996919  0.105012E-07  0.125E-03    3.33      35.7  T
   7     -9.6996919 -0.127983E-07  0.159E-04    3.33     281.1  T
   8     -9.6996919 -0.203020E-10  0.318E-05    3.33    1405.2  T
     SCC iter.                  ...        0 min,  0.001 sec
     gradient                   ...        0 min,  0.001 sec
 * total energy  :    -9.5784391 Eh     change       -0.2190630E-04 Eh
   gradient norm :     0.0033593 Eh/α   predicted    -0.1560307E-04 ( -28.77%)
   displ. norm   :     0.0131406 α      lambda       -0.2784011E-04
   maximum displ.:     0.0080747 α      in ANC's #3, #4, #5, ...

........................................................................
.............................. CYCLE    7 ..............................
........................................................................
   1     -9.6999838 -0.969998E+01  0.493E-02    3.33       0.0  T
   2     -9.6999841 -0.319913E-06  0.279E-02    3.33       1.6  T
   3     -9.6999838  0.270621E-06  0.123E-02    3.33       3.6  T
   4     -9.6999842 -0.389977E-06  0.209E-03    3.33      21.4  T
   5     -9.6999842 -0.804390E-08  0.115E-03    3.33      38.8  T
   6     -9.6999842 -0.201349E-08  0.173E-04    3.33     259.0  T
   7     -9.6999842  0.121268E-09  0.130E-04    3.33     343.4  T
     SCC iter.                  ...        0 min,  0.001 sec
     gradient                   ...        0 min,  0.001 sec
 * total energy  :    -9.5784563 Eh     change       -0.1722393E-04 Eh
   gradient norm :     0.0024240 Eh/α   predicted    -0.1392401E-04 ( -19.16%)
   displ. norm   :     0.0055835 α      lambda       -0.8092460E-05
   maximum displ.:     0.0036378 α      in ANC's #5, #9, #3, ...

........................................................................
.............................. CYCLE    8 ..............................
........................................................................
   1     -9.7002038 -0.970020E+01  0.301E-02    3.34       0.0  T
   2     -9.7002038 -0.598531E-07  0.168E-02    3.34       2.7  T
   3     -9.7002037  0.111551E-06  0.597E-03    3.34       7.5  T
   4     -9.7002039 -0.147922E-06  0.105E-03    3.34      42.4  T
   5     -9.7002039 -0.168157E-09  0.140E-04    3.34     318.7  T
   6     -9.7002039  0.241229E-11  0.985E-05    3.34     454.0  T
     SCC iter.                  ...        0 min,  0.000 sec
     gradient                   ...        0 min,  0.001 sec
 * total energy  :    -9.5784613 Eh     change       -0.4974221E-05 Eh
   gradient norm :     0.0009030 Eh/α   predicted    -0.4046345E-05 ( -18.65%)
   displ. norm   :     0.0035401 α      lambda       -0.1445864E-05
   maximum displ.:     0.0025378 α      in ANC's #1, #5, #9, ...

   *** GEOMETRY OPTIMIZATION CONVERGED AFTER 8 ITERATIONS ***

------------------------------------------------------------------------
 total energy gain   :        -0.0627999 Eh      -39.4075 kcal/mol
 total RMSD          :         0.4065637 a0        0.2151 Å
 total power (kW/mol):       -20.6101324 (step)-7121.3486 (real)
------------------------------------------------------------------------

 ANCopt (total)                0 d,  0 h,  0 min,  0.023 sec
 optimizer setup                ...        0 min,  0.000 sec (  0.303%)
 model hessian                  ...        0 min,  0.000 sec (  0.423%)
 ANC generation                 ...        0 min,  0.000 sec (  0.230%)
 coordinate transformation      ...        0 min,  0.000 sec (  0.073%)
 single point calculation       ...        0 min,  0.022 sec ( 96.103%)
 optimization log               ...        0 min,  0.000 sec (  0.781%)
 hessian update                 ...        0 min,  0.000 sec (  0.081%)
 rational function              ...        0 min,  0.000 sec (  0.815%)

================
 final structure:
================
5
 xtb: 6.2.2 (9d81278992624c895f80dd42a50cac0aa55982e2)
C        -0.97986856365756   -0.52347592954565   -0.28029697059370
C        -0.00613440899358    0.51486752230590   -0.18357787932824
C         0.97687473444953   -0.51128939537341   -0.31150176247699
N         0.01441760571039   -0.96997205423262    0.52521070834371
H        -0.00529036750876    1.48987085684577    0.25016590405523

 Bond Distances (Angstroems)
 ---------------------------
C1-C2=1.4268         C1-N4=1.3553         C2-C1=1.4268         C2-C3=1.4268         C2-N4=1.6455         C2-H5=1.0671         
C3-C2=1.4268         C3-N4=1.3553         N4-C1=1.3553         N4-C2=1.6455         N4-C3=1.3553         H5-C2=1.0671         
 C  H  Rav=1.0671 sigma=0.0000  Rmin=1.0671  Rmax=1.0671     1
 C  C  Rav=1.4268 sigma=0.0000  Rmin=1.4268  Rmax=1.4268     2
 N  C  Rav=1.4520 sigma=0.1368  Rmin=1.3553  Rmax=1.6455     3

 selected bond angles (degree)
 --------------------
N4-C1-C2= 72.47                C3-C2-C1= 86.60                N4-C2-C1= 51.76                N4-C2-C3= 51.76                
H5-C2-C1=133.87                H5-C2-C3=133.87                H5-C2-N4=130.50                N4-C3-C2= 72.47                
C2-N4-C1= 55.77                C3-N4-C1= 92.44                C3-N4-C2= 55.77                

 selected dihedral angles (degree)
 ---------------------------------
C3-C2-C1-N4= 42.04            H5-C2-C1-N4=247.09            N4-C3-C2-C1=317.96            N4-C3-C2-H5=112.91            
C3-N4-C1-C2=315.22            C1-N4-C2-C3=238.33            C1-N4-C2-H5=119.16            C3-N4-C2-C1=121.67            
C3-N4-C2-H5=240.84            C1-N4-C3-C2= 44.78            
           -------------------------------------------------
          |                Final Singlepoint                |
           -------------------------------------------------

          ...................................................
          :                      SETUP                      :
          :.................................................:
          :  # basis functions                  17          :
          :  # atomic orbitals                  17          :
          :  # shells                            9          :
          :  # electrons                        18          :
          :  max. iterations                   250          :
          :  Hamiltonian                  GFN2-xTB          :
          :  restarted?                      false          :
          :  GBSA solvation                  false          :
          :  PC potential                    false          :
          :  electronic temp.          300.0000000     K    :
          :  accuracy                    1.0000000          :
          :  -> integral cutoff          0.2500000E+02      :
          :  -> integral neglect         0.1000000E-07      :
          :  -> SCF convergence          0.1000000E-05 Eh   :
          :  -> wf. convergence          0.1000000E-03 e    :
          :  Broyden damping             0.4000000          :
          ...................................................

 iter      E             dE          RMSdq      gap      omega  full diag
   1     -9.7002039 -0.970020E+01  0.665E-05    3.34       0.0  T
   2     -9.7002039  0.390532E-10  0.882E-05    3.34     507.2  T
   3     -9.7002039 -0.696261E-10  0.136E-05    3.34    3280.8  T

   *** convergence criteria satisfied after 3 iterations ***

         #    Occupation            Energy/Eh            Energy/eV
      -------------------------------------------------------------
         1        2.0000           -0.7535124             -20.5041
       ...           ...                  ...                  ...
         3        2.0000           -0.6337738             -17.2459
         4        2.0000           -0.5887476             -16.0206
         5        2.0000           -0.5466875             -14.8761
         6        2.0000           -0.5262608             -14.3203
         7        2.0000           -0.4665186             -12.6946
         8        2.0000           -0.4600157             -12.5177
         9        2.0000           -0.4292411             -11.6802 (HOMO)
        10                         -0.3066065              -8.3432 (LUMO)
        11                         -0.3062513              -8.3335
        12                         -0.2565117              -6.9800
        13                          0.0386698               1.0523
        14                          0.0465080               1.2655
       ...                                ...                  ...
        17                          0.5164139              14.0523
      -------------------------------------------------------------
                  HL-Gap            0.1226346 Eh            3.3371 eV
             Fermi-level           -0.3679238 Eh          -10.0117 eV

 SCC (total)                   0 d,  0 h,  0 min,  0.003 sec
 SCC setup                      ...        0 min,  0.000 sec (  1.690%)
 Dispersion                     ...        0 min,  0.000 sec (  0.312%)
 integral evaluation            ...        0 min,  0.001 sec ( 37.518%)
 zeroth order Hamiltonian       ...        0 min,  0.000 sec (  1.240%)
 iterations                     ...        0 min,  0.000 sec ( 17.910%)
 molecular gradient             ...        0 min,  0.001 sec ( 39.374%)
 printout                       ...        0 min,  0.000 sec (  1.699%)

         :::::::::::::::::::::::::::::::::::::::::::::::::::::
         ::                     SUMMARY                     ::
         :::::::::::::::::::::::::::::::::::::::::::::::::::::
         :: total energy              -9.578461252264 Eh    ::
         :: gradient norm              0.000909825101 Eh/a0 ::
         :: HOMO-LUMO gap              3.337056838984 eV    ::
         ::.................................................::
         :: SCC energy                -9.700203883647 Eh    ::
         :: -> isotropic ES           -0.008194698861 Eh    ::
         :: -> anisotropic ES          0.003083734001 Eh    ::
         :: -> anisotropic XC          0.010287473835 Eh    ::
         :: -> dispersion             -0.001960417959 Eh    ::
         :: repulsion energy           0.121742603304 Eh    ::
         :: add. restraining           0.000000000000 Eh    ::
         :::::::::::::::::::::::::::::::::::::::::::::::::::::

           ------------------------------------------------- 
          |                Numerical Hessian                |
           ------------------------------------------------- 
step length          :   0.00500
SCC accuracy         :   0.30000
Hessian scale factor :   1.00000
frozen atoms in %    :   0.00000    0
RMS gradient         :   0.00091
estimated CPU  time      0.00 min
estimated wall time      0.00 min

writing file <hessian>.

 projected vibrational frequencies (cm-1)
eigval :       -0.00    -0.00    -0.00     0.00     0.00     0.00
eigval :      605.71   728.18   732.40   822.58   916.36  1189.12
eigval :     1330.23  1471.21  3195.28
           -------------------------------------------------
          |                Property Printout                |
           -------------------------------------------------

    * Orbital Energies and Occupations

         #    Occupation            Energy/Eh            Energy/eV
      -------------------------------------------------------------
         1        2.0000           -0.7535124             -20.5041
         2        2.0000           -0.6490027             -17.6603
         3        2.0000           -0.6337738             -17.2459
         4        2.0000           -0.5887476             -16.0206
         5        2.0000           -0.5466876             -14.8761
         6        2.0000           -0.5262607             -14.3203
         7        2.0000           -0.4665186             -12.6946
         8        2.0000           -0.4600157             -12.5177
         9        2.0000           -0.4292411             -11.6802 (HOMO)
        10                         -0.3066065              -8.3432 (LUMO)
        11                         -0.3062512              -8.3335
        12                         -0.2565117              -6.9800
        13                          0.0386698               1.0523
        14                          0.0465081               1.2655
        15                          0.1887422               5.1359
        16                          0.2429598               6.6113
        17                          0.5164139              14.0523
      -------------------------------------------------------------
                  HL-Gap            0.1226346 Eh            3.3371 eV
             Fermi-level           -0.3679238 Eh          -10.0117 eV

     #   Z        covCN         q      C6AA      α(0)
     1   6 C      2.468    -0.069    30.011     8.943
     2   6 C      3.751     0.093    19.103     6.233
     3   6 C      2.468    -0.069    30.011     8.943
     4   7 N      2.684    -0.035    21.928     6.955
     5   1 H      0.927     0.080     1.977     2.199

 Mol. C6AA /au·bohr⁶  :        457.480682
 Mol. C8AA /au·bohr⁸  :      11919.188526
 Mol. α(0) /au        :         33.272745


Wiberg/Mayer (AO) data.
largest (>0.10) Wiberg bond orders for each atom
          total WBO             WBO to atom ...
     1  C   2.836        N    4 1.245    C    2 1.115    C    3 0.469
     2  C   3.805        C    1 1.115    C    3 1.115    H    5 0.953    N    4 0.622
     3  C   2.836        N    4 1.245    C    2 1.115    C    1 0.469
     4  N   3.138        C    3 1.245    C    1 1.245    C    2 0.622
     5  H   0.994        C    2 0.953

MOs/occ written to file <molden.input>


molecular dipole:
                 x           y           z       tot (Debye)
 q only:       -0.002       0.515       0.048
   full:        0.001       0.902       0.391       2.499
molecular quadrupole (traceless):
                xx          xy          yy          xz          yz          zz
 q only:       -0.683      -0.007       0.733       0.010       0.096      -0.050
  q+dip:       -2.868      -0.017       2.313       0.049       0.965       0.556
   full:       -3.297      -0.016       1.985       0.067       1.062       1.312

           -------------------------------------------------
          |                Geometry Summary                 |
           -------------------------------------------------

      molecular mass/u    :       51.0468517
   center of mass at/Å    :        0.0017018      -0.3590578      -0.0333848
  moments of inertia/u·Å² :        0.2482968E+02   0.2768458E+02   0.4314582E+02
rotational constants/cm⁻¹ :        0.6789307E+00   0.6089177E+00   0.3907130E+00

 * 5 selected distances

     #   Z        #   Z                                     value/Å
     1   6 C      2   6 C                                 1.4267690 (max)
     2   6 C      3   6 C                                 1.4267689
     1   6 C      4   7 N                                 1.3552883
     3   6 C      4   7 N                                 1.3552864
     2   6 C      5   1 H                                 1.0671297 (min)

 * 3 distinct bonds (by element types)

   Z      Z             #   av. dist./Å        max./Å        min./Å
   1 H    6 C           1     1.0671297     1.0671297     1.0671297
   6 C    6 C           2     1.4267690     1.4267690     1.4267689
Molecule has the following symmetry elements: (sigma) 
It seems to be the Cs point group
   6 C    7 N           2     1.3552874     1.3552883     1.3552864

           -------------------------------------------------
          |               Frequency Printout                |
           -------------------------------------------------
 projected vibrational frequencies (cm-1)
eigval :       -0.00    -0.00    -0.00     0.00     0.00     0.00
eigval :      605.71   728.18   732.40   822.58   916.36  1189.12
eigval :     1330.23  1471.21  3195.28
 reduced masses (amu)
   1: 10.73   2: 12.03   3: 12.16   4: 12.06   5: 12.59   6: 12.18   7: 12.45   8: 11.22
   9: 10.92  10:  4.93  11:  3.64  12: 11.69  13: 12.36  14: 12.25  15:  1.93
 IR intensities (amu)
   1:  0.14   2:  0.20   3:  0.17   4:  0.13   5:  0.10   6:  0.10   7:  0.18   8:  0.39
   9:  0.36  10:  0.25  11:  0.02  12:  0.91  13:  0.51  14:  0.47  15:  0.03
 Raman intensities (amu)
   1:  0.00   2:  0.00   3:  0.00   4:  0.00   5:  0.00   6:  0.00   7:  0.00   8:  0.00
   9:  0.00  10:  0.00  11:  0.00  12:  0.00  13:  0.00  14:  0.00  15:  0.00
 output can be read by thermo (or use thermo option).
 writing <g98.out> molden fake output.
 recommended (thermochemical) frequency scaling factor: 1.0
           -------------------------------------------------
          |             Thermodynamic Functions             |
           -------------------------------------------------

cs  symmetry found (for desy threshold:  0.10E+00) used in thermo

          ...................................................
          :                      SETUP                      :
          :.................................................:
          :  # frequencies                           9      :
          :  # imaginary freq.                       0      :
          :  linear?                             false      :
          :  only rotor calc.                    false      :
          :  symmetry                               cs      :
          :  rotational number                       1      :
          :  scaling factor                  1.0000000      :
          :  rotor cutoff                   50.0000000 cm⁻¹ :
          :  imag. cutoff                  -20.0000000 cm⁻¹ :
          :.................................................:

    mode    ω/cm⁻¹     T·S(HO)/kcal·mol⁻¹    T·S(FR)/kcal·mol⁻¹   T·S(vib)
   ------------------------------------------------------------------------
   ------------------------------------------------------------------------

   temp. (K)  partition function   enthalpy   heat capacity  entropy
                                   cal/mol     cal/K/mol   cal/K/mol   J/K/mol
 298.15  VIB   1.16                  323.046      4.086      1.386
         ROT  0.132E+05              888.752      2.981     21.829
         INT  0.153E+05             1211.798      7.067     23.215
         TR   0.353E+27             1481.254      4.968     37.697
         TOT                        2693.0518    12.0348    60.9113   254.8531

   temp. (K)  partition function   enthalpy   heat capacity  entropy
                                   cal/mol     cal/K/mol   cal/K/mol   J/K/mol
 120.00  VIB   1.00                    2.043      0.136      0.019
         ROT  0.336E+04              357.707      2.981     19.116
         INT  0.336E+04              359.750      3.117     19.136
         TR   0.901E+26              596.178      4.968     33.177
         TOT                         955.9281     8.0851    52.3128   218.8765

   temp. (K)  partition function   enthalpy   heat capacity  entropy
                                   cal/mol     cal/K/mol   cal/K/mol   J/K/mol
 100.00  VIB   1.00                    0.421      0.039      0.005
         ROT  0.256E+04              298.089      2.981     18.573
         INT  0.256E+04              298.510      3.020     18.578
         TR   0.685E+26              496.815      4.968     32.272
         TOT                         795.3246     7.9885    50.8494   212.7537

   temp. (K)  partition function   enthalpy   heat capacity  entropy
                                   cal/mol     cal/K/mol   cal/K/mol   J/K/mol
  80.00  VIB   1.00                    0.042      0.006      0.001
         ROT  0.183E+04              238.471      2.981     17.908
         INT  0.183E+04              238.513      2.987     17.908
         TR   0.490E+26              397.452      4.968     31.164
         TOT                         635.9647     7.9550    49.0720   205.3173

   temp. (K)  partition function   enthalpy   heat capacity  entropy
                                   cal/mol     cal/K/mol   cal/K/mol   J/K/mol
  60.00  VIB   1.00                    0.001      0.000     -0.000
         ROT  0.119E+04              178.853      2.981     17.050
         INT  0.119E+04              178.854      2.981     17.050
         TR   0.319E+26              298.089      4.968     29.735
         TOT                         476.9434     7.9493    46.7853   195.7498

   temp. (K)  partition function   enthalpy   heat capacity  entropy
                                   cal/mol     cal/K/mol   cal/K/mol   J/K/mol
  40.00  VIB   1.00                    0.000      0.000     -0.000
         ROT   646.                  119.236      2.981     15.842
         INT   646.                  119.236      2.981     15.841
         TR   0.173E+26              198.726      4.968     27.722
         TOT                         317.9616     7.9490    43.5632   182.2684

   temp. (K)  partition function   enthalpy   heat capacity  entropy
                                   cal/mol     cal/K/mol   cal/K/mol   J/K/mol
  20.00  VIB   1.00                    0.000      0.000     -0.000
         ROT   229.                   59.618      2.981     13.775
         INT   229.                   59.618      2.981     13.775
         TR   0.613E+25               99.363      4.968     24.280
         TOT                         158.9808     7.9490    38.0549   159.2218

   temp. (K)  partition function   enthalpy   heat capacity  entropy
                                   cal/mol     cal/K/mol   cal/K/mol   J/K/mol
  10.00  VIB   1.00                    0.000      0.000     -0.000
         ROT   80.8                   29.809      2.981     11.709
         INT   80.8                   29.809      2.981     11.709
         TR   0.217E+25               49.681      4.968     20.838
         TOT                          79.4904     7.9490    32.5467   136.1753

       T/K    H(0)-H(T)+PV         H(T)/Eh          T*S/Eh         G(T)/Eh
   ------------------------------------------------------------------------
    298.15    0.429165E-02    0.293311E-01    0.289409E-01    0.390205E-03
    120.00    0.152337E-02    0.265629E-01    0.100039E-01    0.165590E-01
    100.00    0.126743E-02    0.263069E-01    0.810336E-02    0.182036E-01
     80.00    0.101347E-02    0.260530E-01    0.625610E-02    0.197969E-01
     60.00    0.760058E-03    0.257996E-01    0.447343E-02    0.213261E-01
     40.00    0.506704E-03    0.255462E-01    0.277689E-02    0.227693E-01
     20.00    0.253352E-03    0.252928E-01    0.121289E-02    0.240800E-01
     10.00    0.126676E-03    0.251662E-01    0.518664E-03    0.246475E-01 (used)
   ------------------------------------------------------------------------

         :::::::::::::::::::::::::::::::::::::::::::::::::::::
         ::                  THERMODYNAMIC                  ::
         :::::::::::::::::::::::::::::::::::::::::::::::::::::
         :: total free energy          -9.553813743373 Eh   ::
         ::.................................................::
         :: total energy               -9.578461252118 Eh   ::
         :: zero point energy           0.025039497050 Eh   ::
         :: G(RRHO) w/o ZPVE           -0.000391988304 Eh   ::
         :: G(RRHO) contrib.            0.024647508745 Eh   ::
         :::::::::::::::::::::::::::::::::::::::::::::::::::::

optimized geometry written to: xtbopt.xyz


           -------------------------------------------------
          | TOTAL ENERGY               -9.578461252118 Eh   |
          | TOTAL ENTHALPY             -9.553295079053 Eh   |
          | TOTAL FREE ENERGY          -9.553813743373 Eh   |
          | GRADIENT NORM               0.000909829889 Eh/α |
          | HOMO-LUMO GAP               3.337056261937 eV   |
           -------------------------------------------------

------------------------------------------------------------------------
 * finished run on 2020/05/12 at 11:45:00.927     
------------------------------------------------------------------------
 total:
 * wall-time:     0 d,  0 h,  0 min,  0.126 sec
 *  cpu-time:     0 d,  0 h,  0 min,  0.126 sec
 * ratio c/w:     0.999 speedup
 SCF:
 * wall-time:     0 d,  0 h,  0 min,  0.004 sec
 *  cpu-time:     0 d,  0 h,  0 min,  0.004 sec
 * ratio c/w:     0.996 speedup
 ANC optimizer:
 * wall-time:     0 d,  0 h,  0 min,  0.026 sec
 *  cpu-time:     0 d,  0 h,  0 min,  0.026 sec
 * ratio c/w:     1.000 speedup
 numerical hessian:
 * wall-time:     0 d,  0 h,  0 min,  0.080 sec
 *  cpu-time:     0 d,  0 h,  0 min,  0.080 sec
 * ratio c/w:     0.999 speedup

