      -----------------------------------------------------------      
     |                   =====================                   |     
     |                           x T B                           |     
     |                   =====================                   |     
     |                         S. Grimme                         |     
     |          Mulliken Center for Theoretical Chemistry        |     
     |                    University of Bonn                     |     
      -----------------------------------------------------------      

   * xtb version 6.2.2 (9d81278992624c895f80dd42a50cac0aa55982e2) compiled by '@Darwin' on 04/03/2020

   xtb is free software: you can redistribute it and/or modify it under
   the terms of the GNU Lesser General Public License as published by
   the Free Software Foundation, either version 3 of the License, or
   (at your option) any later version.
   
   xtb is distributed in the hope that it will be useful,
   but WITHOUT ANY WARRANTY; without even the implied warranty of
   MERCHANTABILITY or FITNESS FOR A PARTICULAR PURPOSE.  See the
   GNU Lesser General Public License for more details.
   
   Cite this work as:
   * S. Grimme, C. Bannwarth, P. Shushkov, J. Chem. Theory Comput., 2017,
     13, 1989-2009. DOI: 10.1021/acs.jctc.7b00118
   * C. Bannwarth, S. Ehlert and S. Grimme., J. Chem. Theory Comput., 2019,
     15, 1652-1671. DOI: 10.1021/acs.jctc.8b01176
   * P. Pracht, E. Caldeweyher, S. Ehlert, S. Grimme, ChemRxiv, 2019, preprint.
     DOI: 10.26434/chemrxiv.8326202.v1
   
   for DFT-D4:
   * E. Caldeweyher, C. Bannwarth and S. Grimme, J. Chem. Phys., 2017,
     147, 034112. DOI: 10.1063/1.4993215
   * E. Caldeweyher, S. Ehlert, A. Hansen, H. Neugebauer, S. Spicher,
     C. Bannwarth and S. Grimme, J. Chem. Phys., 2019, 150, 154122.
     DOI: 10.1063/1.5090222
   
   for sTDA-xTB:
   * S. Grimme and C. Bannwarth, J. Chem. Phys., 2016, 145, 054103.
     DOI: 10.1063/1.4959605
   
   in the mass-spec context:
   * V. Asgeirsson, C. Bauer and S. Grimme, Chem. Sci., 2017, 8, 4879.
     DOI: 10.1039/c7sc00601b
   
   for metadynamics refer to:
   * S. Grimme, J. Chem. Theory Comput., 2019, 155, 2847-2862
     DOI: 10.1021/acs.jctc.9b00143
   
   with help from (in alphabetical order)
   C. Bannwarth, F. Bohle, G. Brandenburg, E. Caldeweyher, M. Checinski,
   S. Dohm, S. Ehlert, S. Ehrlich, F. März, H. Neugebauer, J. Pisarek,
   P. Pracht, P. Shushkov, and S. Spicher.
   
 * started run on 2020/05/12 at 11:45:12.384     

           -------------------------------------------------
          |                Calculation Setup                |
           -------------------------------------------------

          program call               : xtb --input H3C2_0_S_1.input H3C2_0_S_1.xyz --ohess --molden --namespace H3C2_0_S_1 output.out
          calculation namespace      : H3C2_0_S_1
          coordinate file            : H3C2_0_S_1.xyz
          number of atoms            :                     5
          number of electrons        :                    11
          charge                     :                     0
          spin                       :                   0.5
          first test random number   :      0.61202177512731

   ID    Z sym.   atoms
    1    6 C      1, 2
    2    1 H      3-5

           -------------------------------------------------
          |                 G F N 2 - x T B                 |
           -------------------------------------------------

        Reference                      10.1021/acs.jctc.8b01176
      * Hamiltonian:
        H0-scaling (s, p, d)           1.850000    2.230000    2.230000
        zeta-weighting                 0.500000
      * Dispersion:
        s8                             2.700000
        a1                             0.520000
        a2                             5.000000
        s9                             5.000000
      * Repulsion:
        kExp                           1.500000    1.000000
        rExp                           1.000000
      * Coulomb:
        alpha                          2.000000
        third order                    shell-resolved
        anisotropic                    true
        a3                             3.000000
        a5                             4.000000
        cn-shift                       1.200000
        cn-exp                         4.000000
        max-rad                        5.000000


          ...................................................
          :                      SETUP                      :
          :.................................................:
          :  # basis functions                  11          :
          :  # atomic orbitals                  11          :
          :  # shells                            7          :
          :  # electrons                        11          :
          :  max. iterations                   250          :
          :  Hamiltonian                  GFN2-xTB          :
          :  restarted?                      false          :
          :  GBSA solvation                  false          :
          :  PC potential                    false          :
          :  electronic temp.          300.0000000     K    :
          :  accuracy                    1.0000000          :
          :  -> integral cutoff          0.2500000E+02      :
          :  -> integral neglect         0.1000000E-07      :
          :  -> SCF convergence          0.1000000E-05 Eh   :
          :  -> wf. convergence          0.1000000E-03 e    :
          :  Broyden damping             0.4000000          :
          ...................................................

 iter      E             dE          RMSdq      gap      omega  full diag
   1     -5.6321873 -0.563219E+01  0.745E+00    0.00       0.0  T
   2     -5.6385214 -0.633405E-02  0.435E+00    0.00       1.0  T
   3     -5.6383052  0.216194E-03  0.672E-01    0.00       1.0  T
   4     -5.6356259  0.267932E-02  0.960E-01    0.00       1.0  T
   5     -5.6399695 -0.434359E-02  0.385E-01    0.00       1.0  T
   6     -5.6380410  0.192846E-02  0.602E-01    0.00       1.0  T
   7     -5.6404379 -0.239692E-02  0.708E-02    0.00       1.0  T
   8     -5.6404638 -0.258313E-04  0.169E-02    0.00       2.7  T
   9     -5.6404639 -0.160791E-06  0.994E-03    0.00       4.5  T
  10     -5.6404646 -0.683932E-06  0.172E-03    0.00      25.9  T
  11     -5.6404646 -0.191220E-07  0.549E-04    0.00      81.4  T
  12     -5.6404646 -0.217482E-08  0.138E-05    0.00    3244.8  T

   *** convergence criteria satisfied after 12 iterations ***

         #    Occupation            Energy/Eh            Energy/eV
      -------------------------------------------------------------
         1        2.0000           -0.6307968             -17.1649
         2        2.0000           -0.5648271             -15.3697
         3        2.0000           -0.5010176             -13.6334
         4        2.0000           -0.5010172             -13.6334
         5        2.0000           -0.4252055             -11.5704
         6        0.5000           -0.3274762              -8.9111 (HOMO)
         7        0.5000           -0.3274761              -8.9111 (LUMO)
         8                          0.1098237               2.9885
         9                          0.1323297               3.6009
        10                          0.1759757               4.7885
        11                          0.1759775               4.7886
      -------------------------------------------------------------
                  HL-Gap            0.0000000 Eh            0.0000 eV
             Fermi-level           -0.3519085 Eh           -9.5759 eV

 SCC (total)                   0 d,  0 h,  0 min,  0.002 sec
 SCC setup                      ...        0 min,  0.000 sec (  3.808%)
 Dispersion                     ...        0 min,  0.000 sec (  0.482%)
 integral evaluation            ...        0 min,  0.000 sec ( 21.252%)
 zeroth order Hamiltonian       ...        0 min,  0.000 sec (  0.573%)
 iterations                     ...        0 min,  0.001 sec ( 46.554%)
 molecular gradient             ...        0 min,  0.000 sec ( 23.133%)
 printout                       ...        0 min,  0.000 sec (  3.613%)

         :::::::::::::::::::::::::::::::::::::::::::::::::::::
         ::                     SUMMARY                     ::
         :::::::::::::::::::::::::::::::::::::::::::::::::::::
         :: total energy              -5.581857720589 Eh    ::
         :: gradient norm              0.049291924911 Eh/a0 ::
         :: HOMO-LUMO gap              0.000001129701 eV    ::
         ::.................................................::
         :: SCC energy                -5.640464626011 Eh    ::
         :: -> isotropic ES           -0.015234291267 Eh    ::
         :: -> anisotropic ES         -0.000211356586 Eh    ::
         :: -> anisotropic XC          0.006257233810 Eh    ::
         :: -> dispersion             -0.001027551435 Eh    ::
         :: repulsion energy           0.058606884221 Eh    ::
         :: add. restraining           0.000000000000 Eh    ::
         :::::::::::::::::::::::::::::::::::::::::::::::::::::

      ----------------------------------------------------------- 
     |                   =====================                   |
     |                        A N C O P T                        |
     |                   =====================                   |
     |               Approximate Normal Coordinate               |
     |                Rational Function Optimizer                |
      ----------------------------------------------------------- 

          ...................................................
          :                      SETUP                      :
          :.................................................:
          :   optimization level            normal          :
          :   max. optcycles                   200          :
          :   ANC micro-cycles                  20          :
          :   degrees of freedom                 9          :
          :.................................................:
          :   RF solver                   davidson          :
          :   write xtbopt.log                true          :
          :   linear?                        false          :
          :   energy convergence         0.5000000E-05 Eh   :
          :   grad. convergence          0.1000000E-02 Eh/α :
          :   maximium RF displ.         1.0000000          :
          :   Hlow (freq-cutoff)         0.1000000E-01      :
          :   Hmax (freq-cutoff)         5.0000000          :
          :   S6 in model hess.         20.0000000          :
          ...................................................

generating ANC from model Hessian ...
Using Lindh-Hessian (1995)
 Shifting diagonal of input Hessian by    0.0000000000000000     
 Lowest  eigenvalues of input Hessian
   -0.000000   -0.000000   -0.000000    0.000000    0.000000    0.000000
    0.074281    0.074282    0.099715    0.099715    0.114190    0.396904
    1.022620    1.022624    1.049827
 Highest eigenvalues
    0.099715    0.114190    0.396904    1.022620    1.022624    1.049827


........................................................................
.............................. CYCLE    1 ..............................
........................................................................
   1     -5.6404646 -0.564046E+01  0.336E-06    0.00       0.0  T
   2     -5.6404646 -0.452971E-13  0.253E-06    0.00   17670.6  T
   3     -5.6404646 -0.222045E-13  0.119E-06    0.00   37676.8  T
     SCC iter.                  ...        0 min,  0.000 sec
     gradient                   ...        0 min,  0.000 sec
 * total energy  :    -5.5818577 Eh     change       -0.3377973E-09 Eh
   gradient norm :     0.0492921 Eh/α   predicted     0.0000000E+00 (-100.00%)
   displ. norm   :     0.0951482 α      lambda       -0.4190246E-02
   maximum displ.:     0.0856239 α      in ANC's #6, #9, #5, ...

........................................................................
.............................. CYCLE    2 ..............................
........................................................................
   1     -5.6533402 -0.565334E+01  0.388E-01    0.00       0.0  T
   2     -5.6536645 -0.324312E-03  0.220E-01    0.00       1.0  T
   3     -5.6537356 -0.710903E-04  0.131E-01    0.00       1.0  T
   4     -5.6537438 -0.815223E-05  0.355E-02    0.00       1.3  T
   5     -5.6537443 -0.518881E-06  0.788E-03    0.00       5.7  T
   6     -5.6537443  0.308740E-08  0.136E-03    0.00      32.8  T
   7     -5.6537443 -0.692640E-08  0.268E-04    0.00     167.2  T
   8     -5.6537443 -0.182077E-12  0.169E-05    0.00    2643.0  T
     SCC iter.                  ...        0 min,  0.000 sec
     gradient                   ...        0 min,  0.000 sec
 * total energy  :    -5.5845844 Eh     change       -0.2726674E-02 Eh
   gradient norm :     0.0184114 Eh/α   predicted    -0.2114091E-02 ( -22.47%)
   displ. norm   :     0.0371534 α      lambda       -0.6002371E-03
   maximum displ.:     0.0274315 α      in ANC's #6, #9, #5, ...

........................................................................
.............................. CYCLE    3 ..............................
........................................................................
   1     -5.6580885 -0.565809E+01  0.175E-01    0.00       0.0  T
   2     -5.6581499 -0.613623E-04  0.939E-02    0.00       1.0  T
   3     -5.6581620 -0.121120E-04  0.600E-02    0.00       1.0  T
   4     -5.6581637 -0.175493E-05  0.120E-02    0.00       3.7  T
   5     -5.6581638 -0.671065E-07  0.428E-03    0.00      10.5  T
   6     -5.6581638 -0.441632E-09  0.357E-04    0.00     125.4  T
   7     -5.6581638 -0.319933E-09  0.108E-04    0.00     413.4  T
     SCC iter.                  ...        0 min,  0.000 sec
     gradient                   ...        0 min,  0.000 sec
 * total energy  :    -5.5848728 Eh     change       -0.2884354E-03 Eh
   gradient norm :     0.0035673 Eh/α   predicted    -0.3005314E-03 (   4.19%)
   displ. norm   :     0.0090864 α      lambda       -0.2707994E-04
   maximum displ.:     0.0063848 α      in ANC's #5, #6, #9, ...

........................................................................
.............................. CYCLE    4 ..............................
........................................................................
   1     -5.6573466 -0.565735E+01  0.225E-02    0.00       0.0  T
   2     -5.6573472 -0.602763E-06  0.121E-02    0.00       3.7  T
   3     -5.6573472 -0.200379E-07  0.554E-03    0.00       8.1  T
   4     -5.6573473 -0.409799E-07  0.181E-03    0.00      24.7  T
   5     -5.6573473 -0.161346E-08  0.199E-04    0.00     224.3  T
   6     -5.6573473 -0.118776E-10  0.169E-05    0.00    2645.8  T
     SCC iter.                  ...        0 min,  0.000 sec
     gradient                   ...        0 min,  0.000 sec
 * total energy  :    -5.5848899 Eh     change       -0.1708881E-04 Eh
   gradient norm :     0.0012292 Eh/α   predicted    -0.1354000E-04 ( -20.77%)
   displ. norm   :     0.0044528 α      lambda       -0.3350481E-05
   maximum displ.:     0.0034145 α      in ANC's #6, #9, #5, ...

........................................................................
.............................. CYCLE    5 ..............................
........................................................................
   1     -5.6569196 -0.565692E+01  0.111E-02    0.00       0.0  T
   2     -5.6569197 -0.120451E-06  0.450E-03    0.00       9.9  T
   3     -5.6569197 -0.574779E-08  0.280E-03    0.00      16.0  T
   4     -5.6569197 -0.667521E-08  0.692E-04    0.00      64.6  T
   5     -5.6569197 -0.357564E-09  0.197E-04    0.00     227.3  T
     SCC iter.                  ...        0 min,  0.000 sec
     gradient                   ...        0 min,  0.000 sec
 * total energy  :    -5.5848912 Eh     change       -0.1265737E-05 Eh
   gradient norm :     0.0006101 Eh/α   predicted    -0.1675220E-05 (  32.35%)
   displ. norm   :     0.0014809 α      lambda       -0.5501558E-06
   maximum displ.:     0.0011158 α      in ANC's #6, #9, #5, ...

   *** GEOMETRY OPTIMIZATION CONVERGED AFTER 5 ITERATIONS ***

------------------------------------------------------------------------
 total energy gain   :        -0.0030335 Eh       -1.9035 kcal/mol
 total RMSD          :         0.0538757 a0        0.0285 Å
 total power (kW/mol):        -1.5928718 (step)-1148.9628 (real)
------------------------------------------------------------------------

 ANCopt (total)                0 d,  0 h,  0 min,  0.007 sec
 optimizer setup                ...        0 min,  0.000 sec (  1.096%)
 model hessian                  ...        0 min,  0.000 sec (  1.989%)
 ANC generation                 ...        0 min,  0.000 sec (  0.852%)
 coordinate transformation      ...        0 min,  0.000 sec (  0.155%)
 single point calculation       ...        0 min,  0.006 sec ( 89.388%)
 optimization log               ...        0 min,  0.000 sec (  1.625%)
 hessian update                 ...        0 min,  0.000 sec (  0.179%)
 rational function              ...        0 min,  0.000 sec (  1.718%)

================
 final structure:
================
5
 xtb: 6.2.2 (9d81278992624c895f80dd42a50cac0aa55982e2)
C        -0.05730306376267   -0.00582819340335   -0.00087877262730
C         1.37889511289303    0.14025009819408    0.02115140359605
H        -0.35828518788478   -0.74022686805664   -0.75731983495566
H        -0.53823012021931    0.95058445833708   -0.23777272434929
H        -0.42507674102627   -0.34477849507118    0.97482092833621

 Bond Distances (Angstroems)
 ---------------------------
C1-C2=1.4438         C1-H3=1.0964         C1-H4=1.0964         C1-H5=1.0964         C2-C1=1.4438         H3-C1=1.0964         
H4-C1=1.0964         H5-C1=1.0964         
 C  H  Rav=1.0964 sigma=0.0000  Rmin=1.0964  Rmax=1.0964     3
 C  C  Rav=1.4438 sigma=0.0000  Rmin=1.4438  Rmax=1.4438     1

 selected bond angles (degree)
 --------------------
H3-C1-C2=110.57                H4-C1-C2=110.57                H4-C1-H3=108.35                H5-C1-C2=110.57                
H5-C1-H3=108.35                H5-C1-H4=108.35                

 selected dihedral angles (degree)
 ---------------------------------

           -------------------------------------------------
          |                Final Singlepoint                |
           -------------------------------------------------

          ...................................................
          :                      SETUP                      :
          :.................................................:
          :  # basis functions                  11          :
          :  # atomic orbitals                  11          :
          :  # shells                            7          :
          :  # electrons                        11          :
          :  max. iterations                   250          :
          :  Hamiltonian                  GFN2-xTB          :
          :  restarted?                      false          :
          :  GBSA solvation                  false          :
          :  PC potential                    false          :
          :  electronic temp.          300.0000000     K    :
          :  accuracy                    1.0000000          :
          :  -> integral cutoff          0.2500000E+02      :
          :  -> integral neglect         0.1000000E-07      :
          :  -> SCF convergence          0.1000000E-05 Eh   :
          :  -> wf. convergence          0.1000000E-03 e    :
          :  Broyden damping             0.4000000          :
          ...................................................

 iter      E             dE          RMSdq      gap      omega  full diag
   1     -5.6569197 -0.565692E+01  0.313E-05    0.00       0.0  T
   2     -5.6569197 -0.232703E-12  0.199E-05    0.00    2250.2  T
   3     -5.6569197  0.399680E-13  0.490E-06    0.00    9133.7  T

   *** convergence criteria satisfied after 3 iterations ***

         #    Occupation            Energy/Eh            Energy/eV
      -------------------------------------------------------------
         1        2.0000           -0.6345533             -17.2671
         2        2.0000           -0.5633500             -15.3295
         3        2.0000           -0.5038662             -13.7109
         4        2.0000           -0.5038662             -13.7109
         5        2.0000           -0.4168354             -11.3427
         6        0.5000           -0.3160839              -8.6011 (HOMO)
         7        0.5000           -0.3160839              -8.6011 (LUMO)
         8                          0.1451146               3.9488
         9                          0.1960502               5.3348
        10                          0.1960502               5.3348
        11                          0.2391767               6.5083
      -------------------------------------------------------------
                  HL-Gap            0.0000000 Eh            0.0000 eV
             Fermi-level           -0.3412718 Eh           -9.2865 eV

 SCC (total)                   0 d,  0 h,  0 min,  0.002 sec
 SCC setup                      ...        0 min,  0.000 sec (  4.034%)
 Dispersion                     ...        0 min,  0.000 sec (  0.504%)
 integral evaluation            ...        0 min,  0.000 sec ( 29.554%)
 zeroth order Hamiltonian       ...        0 min,  0.000 sec (  1.146%)
 iterations                     ...        0 min,  0.000 sec ( 31.464%)
 molecular gradient             ...        0 min,  0.000 sec ( 27.369%)
 printout                       ...        0 min,  0.000 sec (  5.272%)

         :::::::::::::::::::::::::::::::::::::::::::::::::::::
         ::                     SUMMARY                     ::
         :::::::::::::::::::::::::::::::::::::::::::::::::::::
         :: total energy              -5.584891184746 Eh    ::
         :: gradient norm              0.000609127281 Eh/a0 ::
         :: HOMO-LUMO gap              0.000000010143 eV    ::
         ::.................................................::
         :: SCC energy                -5.656919696269 Eh    ::
         :: -> isotropic ES           -0.012183840465 Eh    ::
         :: -> anisotropic ES         -0.000316776898 Eh    ::
         :: -> anisotropic XC          0.005609765946 Eh    ::
         :: -> dispersion             -0.001026469112 Eh    ::
         :: repulsion energy           0.072028493779 Eh    ::
         :: add. restraining           0.000000000000 Eh    ::
         :::::::::::::::::::::::::::::::::::::::::::::::::::::

           ------------------------------------------------- 
          |                Numerical Hessian                |
           ------------------------------------------------- 
step length          :   0.00500
SCC accuracy         :   0.30000
Hessian scale factor :   1.00000
frozen atoms in %    :   0.00000    0
RMS gradient         :   0.00061
estimated CPU  time      0.00 min
estimated wall time      0.00 min

writing file <hessian>.

 projected vibrational frequencies (cm-1)
eigval :       -0.00    -0.00    -0.00    -0.00    -0.00     0.00
eigval :      614.33   614.34  1165.07  1291.61  1355.25  1355.28
eigval :     2887.31  2887.34  2914.80
           -------------------------------------------------
          |                Property Printout                |
           -------------------------------------------------

    * Orbital Energies and Occupations

         #    Occupation            Energy/Eh            Energy/eV
      -------------------------------------------------------------
         1        2.0000           -0.6345533             -17.2671
         2        2.0000           -0.5633500             -15.3295
         3        2.0000           -0.5038662             -13.7109
         4        2.0000           -0.5038662             -13.7109
         5        2.0000           -0.4168354             -11.3427
         6        0.5000           -0.3160839              -8.6011 (HOMO)
         7        0.5000           -0.3160839              -8.6011 (LUMO)
         8                          0.1451146               3.9488
         9                          0.1960501               5.3348
        10                          0.1960502               5.3348
        11                          0.2391767               6.5083
      -------------------------------------------------------------
Molecule has the following symmetry elements: (C3) 3*(sigma) 
It seems to be the C3v point group
                  HL-Gap            0.0000000 Eh            0.0000 eV
             Fermi-level           -0.3412718 Eh           -9.2865 eV

     #   Z        covCN         q      C6AA      α(0)
     1   6 C      3.750    -0.066    21.836     6.664
     2   6 C      0.979    -0.184    42.028    10.888
     3   1 H      0.924     0.083     1.944     2.180
     4   1 H      0.924     0.083     1.944     2.180
     5   1 H      0.924     0.083     1.944     2.180

 Mol. C6AA /au·bohr⁶  :        234.447590
 Mol. C8AA /au·bohr⁸  :       5535.034059
 Mol. α(0) /au        :         24.093545


Wiberg/Mayer (AO) data.
largest (>0.10) Wiberg bond orders for each atom
          total WBO             WBO to atom ...
     1  C   3.981        C    2 1.248    H    5 0.911    H    4 0.911    H    3 0.911
     2  C   1.353        C    1 1.248
     3  H   0.950        C    1 0.911
     4  H   0.950        C    1 0.911
     5  H   0.950        C    1 0.911

MOs/occ written to file <molden.input>


molecular dipole:
                 x           y           z       tot (Debye)
 q only:       -0.680      -0.069      -0.010
   full:       -1.186      -0.121      -0.018       3.029
molecular quadrupole (traceless):
                xx          xy          yy          xz          yz          zz
 q only:       -1.534      -0.235       0.755      -0.035      -0.004       0.779
  q+dip:       -3.615      -0.554       1.780      -0.084      -0.009       1.835
   full:       -4.544      -0.697       2.238      -0.105      -0.011       2.307

           -------------------------------------------------
          |                Geometry Summary                 |
           -------------------------------------------------

      molecular mass/u    :       27.0452940
   center of mass at/Å    :        0.5376616       0.0546839       0.0082455
  moments of inertia/u·Å² :        0.3186254E+01   0.1740331E+02   0.1740331E+02
rotational constants/cm⁻¹ :        0.5290737E+01   0.9686451E+00   0.9686451E+00

 * 3 selected distances

     #   Z        #   Z                                     value/Å
     1   6 C      3   1 H                                 1.0964190
     1   6 C      4   1 H                                 1.0964191 (max)
     1   6 C      5   1 H                                 1.0964190 (min)

 * 1 distinct bonds (by element types)

   Z      Z             #   av. dist./Å        max./Å        min./Å
   1 H    6 C           3     1.0964190     1.0964191     1.0964190

           -------------------------------------------------
          |               Frequency Printout                |
           -------------------------------------------------
 projected vibrational frequencies (cm-1)
eigval :       -0.00    -0.00    -0.00    -0.00    -0.00     0.00
eigval :      614.33   614.34  1165.07  1291.61  1355.25  1355.28
eigval :     2887.31  2887.34  2914.80
 reduced masses (amu)
   1:  4.42   2:  8.35   3: 10.96   4: 11.57   5: 10.56   6:  5.80   7:  3.57   8:  3.57
   9: 10.54  10:  3.51  11:  1.55  12:  1.55  13:  1.99  14:  1.99  15:  1.20
 IR intensities (amu)
   1:  0.10   2:  0.16   3:  0.23   4:  0.22   5:  0.18   6:  0.12   7:  0.13   8:  0.13
   9:  0.57  10:  0.43  11:  0.16  12:  0.16  13:  0.11  14:  0.11  15:  0.04
 Raman intensities (amu)
   1:  0.00   2:  0.00   3:  0.00   4:  0.00   5:  0.00   6:  0.00   7:  0.00   8:  0.00
   9:  0.00  10:  0.00  11:  0.00  12:  0.00  13:  0.00  14:  0.00  15:  0.00
 output can be read by thermo (or use thermo option).
 writing <g98.out> molden fake output.
 recommended (thermochemical) frequency scaling factor: 1.0
           -------------------------------------------------
          |             Thermodynamic Functions             |
           -------------------------------------------------

c3v symmetry found (for desy threshold:  0.10E+00) used in thermo

          ...................................................
          :                      SETUP                      :
          :.................................................:
          :  # frequencies                           9      :
          :  # imaginary freq.                       0      :
          :  linear?                             false      :
          :  only rotor calc.                    false      :
          :  symmetry                              c3v      :
          :  rotational number                       3      :
          :  scaling factor                  1.0000000      :
          :  rotor cutoff                   50.0000000 cm⁻¹ :
          :  imag. cutoff                  -20.0000000 cm⁻¹ :
          :.................................................:

    mode    ω/cm⁻¹     T·S(HO)/kcal·mol⁻¹    T·S(FR)/kcal·mol⁻¹   T·S(vib)
   ------------------------------------------------------------------------
   ------------------------------------------------------------------------

   temp. (K)  partition function   enthalpy   heat capacity  entropy
                                   cal/mol     cal/K/mol   cal/K/mol   J/K/mol
 298.15  VIB   1.12                  221.651      2.631      0.971
         ROT   791.                  888.752      2.981     16.243
         INT   887.                 1110.403      5.612     17.213
         TR   0.136E+27             1481.254      4.968     35.804
         TOT                        2591.6571    10.5804    53.0173   221.8242

   temp. (K)  partition function   enthalpy   heat capacity  entropy
                                   cal/mol     cal/K/mol   cal/K/mol   J/K/mol
 120.00  VIB   1.00                    2.228      0.137      0.021
         ROT   202.                  357.707      2.981     13.530
         INT   202.                  359.935      3.118     13.551
         TR   0.347E+26              596.178      4.968     31.285
         TOT                         956.1125     8.0861    44.8353   187.5908

   temp. (K)  partition function   enthalpy   heat capacity  entropy
                                   cal/mol     cal/K/mol   cal/K/mol   J/K/mol
 100.00  VIB   1.00                    0.510      0.045      0.006
         ROT   154.                  298.089      2.981     12.986
         INT   154.                  298.599      3.026     12.992
         TR   0.264E+26              496.815      4.968     30.379
         TOT                         795.4136     7.9941    43.3710   181.4643

   temp. (K)  partition function   enthalpy   heat capacity  entropy
                                   cal/mol     cal/K/mol   cal/K/mol   J/K/mol
  80.00  VIB   1.00                    0.056      0.008      0.001
         ROT   110.                  238.471      2.981     12.321
         INT   110.                  238.527      2.989     12.322
         TR   0.189E+26              397.452      4.968     29.271
         TOT                         635.9791     7.9568    41.5928   174.0245

   temp. (K)  partition function   enthalpy   heat capacity  entropy
                                   cal/mol     cal/K/mol   cal/K/mol   J/K/mol
  60.00  VIB   1.00                    0.001      0.000     -0.000
         ROT   71.4                  178.853      2.981     11.463
         INT   71.4                  178.855      2.981     11.463
         TR   0.123E+26              298.089      4.968     27.843
         TOT                         476.9438     7.9494    39.3060   164.4562

   temp. (K)  partition function   enthalpy   heat capacity  entropy
                                   cal/mol     cal/K/mol   cal/K/mol   J/K/mol
  40.00  VIB   1.00                    0.000      0.000     -0.000
         ROT   38.9                  119.236      2.981     10.255
         INT   38.9                  119.236      2.981     10.255
         TR   0.669E+25              198.726      4.968     25.829
         TOT                         317.9616     7.9490    36.0838   150.9748

   temp. (K)  partition function   enthalpy   heat capacity  entropy
                                   cal/mol     cal/K/mol   cal/K/mol   J/K/mol
  20.00  VIB   1.00                    0.000      0.000     -0.000
         ROT   13.7                   59.618      2.981      8.189
         INT   13.7                   59.618      2.981      8.188
         TR   0.236E+25               99.363      4.968     22.387
         TOT                         158.9808     7.9490    30.5756   127.9283

   temp. (K)  partition function   enthalpy   heat capacity  entropy
                                   cal/mol     cal/K/mol   cal/K/mol   J/K/mol
  10.00  VIB   1.00                    0.000      0.000     -0.000
         ROT   4.86                   29.809      2.981      6.122
         INT   4.86                   29.809      2.981      6.122
         TR   0.836E+24               49.681      4.968     18.945
         TOT                          79.4904     7.9490    25.0674   104.8819

       T/K    H(0)-H(T)+PV         H(T)/Eh          T*S/Eh         G(T)/Eh
   ------------------------------------------------------------------------
    298.15    0.413007E-02    0.384970E-01    0.251902E-01    0.133068E-01
    120.00    0.152366E-02    0.358906E-01    0.857395E-02    0.273166E-01
    100.00    0.126757E-02    0.356345E-01    0.691161E-02    0.287229E-01
     80.00    0.101350E-02    0.353804E-01    0.530259E-02    0.300778E-01
     60.00    0.760058E-03    0.351270E-01    0.375828E-02    0.313687E-01
     40.00    0.506704E-03    0.348736E-01    0.230013E-02    0.325735E-01
     20.00    0.253352E-03    0.346203E-01    0.974507E-03    0.336458E-01
     10.00    0.126676E-03    0.344936E-01    0.399474E-03    0.340941E-01 (used)
   ------------------------------------------------------------------------

         :::::::::::::::::::::::::::::::::::::::::::::::::::::
         ::                  THERMODYNAMIC                  ::
         :::::::::::::::::::::::::::::::::::::::::::::::::::::
         :: total free energy          -5.550797072454 Eh   ::
         ::.................................................::
         :: total energy               -5.584891184894 Eh   ::
         :: zero point energy           0.034366910384 Eh   ::
         :: G(RRHO) w/o ZPVE           -0.000272797944 Eh   ::
         :: G(RRHO) contrib.            0.034094112440 Eh   ::
         :::::::::::::::::::::::::::::::::::::::::::::::::::::

optimized geometry written to: xtbopt.xyz


           -------------------------------------------------
          | TOTAL ENERGY               -5.584891184894 Eh   |
          | TOTAL ENTHALPY             -5.550397598494 Eh   |
          | TOTAL FREE ENERGY          -5.550797072454 Eh   |
          | GRADIENT NORM               0.000609145837 Eh/α |
          | HOMO-LUMO GAP               0.000000025465 eV   |
           -------------------------------------------------

------------------------------------------------------------------------
 * finished run on 2020/05/12 at 11:45:12.451     
------------------------------------------------------------------------
 total:
 * wall-time:     0 d,  0 h,  0 min,  0.066 sec
 *  cpu-time:     0 d,  0 h,  0 min,  0.064 sec
 * ratio c/w:     0.984 speedup
 SCF:
 * wall-time:     0 d,  0 h,  0 min,  0.002 sec
 *  cpu-time:     0 d,  0 h,  0 min,  0.002 sec
 * ratio c/w:     0.993 speedup
 ANC optimizer:
 * wall-time:     0 d,  0 h,  0 min,  0.010 sec
 *  cpu-time:     0 d,  0 h,  0 min,  0.009 sec
 * ratio c/w:     0.971 speedup
 numerical hessian:
 * wall-time:     0 d,  0 h,  0 min,  0.037 sec
 *  cpu-time:     0 d,  0 h,  0 min,  0.036 sec
 * ratio c/w:     0.992 speedup

