      -----------------------------------------------------------      
     |                   =====================                   |     
     |                           x T B                           |     
     |                   =====================                   |     
     |                         S. Grimme                         |     
     |          Mulliken Center for Theoretical Chemistry        |     
     |                    University of Bonn                     |     
      -----------------------------------------------------------      

   * xtb version 6.2.2 (9d81278992624c895f80dd42a50cac0aa55982e2) compiled by '@Darwin' on 04/03/2020

   xtb is free software: you can redistribute it and/or modify it under
   the terms of the GNU Lesser General Public License as published by
   the Free Software Foundation, either version 3 of the License, or
   (at your option) any later version.
   
   xtb is distributed in the hope that it will be useful,
   but WITHOUT ANY WARRANTY; without even the implied warranty of
   MERCHANTABILITY or FITNESS FOR A PARTICULAR PURPOSE.  See the
   GNU Lesser General Public License for more details.
   
   Cite this work as:
   * S. Grimme, C. Bannwarth, P. Shushkov, J. Chem. Theory Comput., 2017,
     13, 1989-2009. DOI: 10.1021/acs.jctc.7b00118
   * C. Bannwarth, S. Ehlert and S. Grimme., J. Chem. Theory Comput., 2019,
     15, 1652-1671. DOI: 10.1021/acs.jctc.8b01176
   * P. Pracht, E. Caldeweyher, S. Ehlert, S. Grimme, ChemRxiv, 2019, preprint.
     DOI: 10.26434/chemrxiv.8326202.v1
   
   for DFT-D4:
   * E. Caldeweyher, C. Bannwarth and S. Grimme, J. Chem. Phys., 2017,
     147, 034112. DOI: 10.1063/1.4993215
   * E. Caldeweyher, S. Ehlert, A. Hansen, H. Neugebauer, S. Spicher,
     C. Bannwarth and S. Grimme, J. Chem. Phys., 2019, 150, 154122.
     DOI: 10.1063/1.5090222
   
   for sTDA-xTB:
   * S. Grimme and C. Bannwarth, J. Chem. Phys., 2016, 145, 054103.
     DOI: 10.1063/1.4959605
   
   in the mass-spec context:
   * V. Asgeirsson, C. Bauer and S. Grimme, Chem. Sci., 2017, 8, 4879.
     DOI: 10.1039/c7sc00601b
   
   for metadynamics refer to:
   * S. Grimme, J. Chem. Theory Comput., 2019, 155, 2847-2862
     DOI: 10.1021/acs.jctc.9b00143
   
   with help from (in alphabetical order)
   C. Bannwarth, F. Bohle, G. Brandenburg, E. Caldeweyher, M. Checinski,
   S. Dohm, S. Ehlert, S. Ehrlich, F. März, H. Neugebauer, J. Pisarek,
   P. Pracht, P. Shushkov, and S. Spicher.
   
 * started run on 2020/05/12 at 11:44:48.403     

           -------------------------------------------------
          |                Calculation Setup                |
           -------------------------------------------------

          program call               : xtb --input H2C2N1_12_S_1.input H2C2N1_12_S_1.xyz --ohess --molden --namespace H2C2N1_12_S_1 output.out
          calculation namespace      : H2C2N1_12_S_1
          coordinate file            : H2C2N1_12_S_1.xyz
          number of atoms            :                     5
          number of electrons        :                    15
          charge                     :                     0
          spin                       :                   0.5
          first test random number   :      0.43509875756346

   ID    Z sym.   atoms
    1    6 C      1, 3
    2    7 N      2
    3    1 H      4, 5

           -------------------------------------------------
          |                 G F N 2 - x T B                 |
           -------------------------------------------------

        Reference                      10.1021/acs.jctc.8b01176
      * Hamiltonian:
        H0-scaling (s, p, d)           1.850000    2.230000    2.230000
        zeta-weighting                 0.500000
      * Dispersion:
        s8                             2.700000
        a1                             0.520000
        a2                             5.000000
        s9                             5.000000
      * Repulsion:
        kExp                           1.500000    1.000000
        rExp                           1.000000
      * Coulomb:
        alpha                          2.000000
        third order                    shell-resolved
        anisotropic                    true
        a3                             3.000000
        a5                             4.000000
        cn-shift                       1.200000
        cn-exp                         4.000000
        max-rad                        5.000000


          ...................................................
          :                      SETUP                      :
          :.................................................:
          :  # basis functions                  14          :
          :  # atomic orbitals                  14          :
          :  # shells                            8          :
          :  # electrons                        15          :
          :  max. iterations                   250          :
          :  Hamiltonian                  GFN2-xTB          :
          :  restarted?                      false          :
          :  GBSA solvation                  false          :
          :  PC potential                    false          :
          :  electronic temp.          300.0000000     K    :
          :  accuracy                    1.0000000          :
          :  -> integral cutoff          0.2500000E+02      :
          :  -> integral neglect         0.1000000E-07      :
          :  -> SCF convergence          0.1000000E-05 Eh   :
          :  -> wf. convergence          0.1000000E-03 e    :
          :  Broyden damping             0.4000000          :
          ...................................................

 iter      E             dE          RMSdq      gap      omega  full diag
   1     -7.9518261 -0.795183E+01  0.586E+00    1.00       0.0  T
   2     -7.8119467  0.139879E+00  0.746E+00    0.34       1.0  T
   3     -8.0173528 -0.205406E+00  0.260E+00    0.33       1.0  T
   4     -8.0227381 -0.538533E-02  0.478E-01    0.13       1.0  T
   5     -8.0225522  0.185843E-03  0.339E-01    0.10       1.0  T
   6     -8.0207874  0.176490E-02  0.667E-01    0.14       1.0  T
   7     -8.0227186 -0.193126E-02  0.182E-01    0.14       1.0  T
   8     -8.0228229 -0.104330E-03  0.618E-02    0.12       1.0  T
   9     -8.0228348 -0.118068E-04  0.290E-02    0.13       1.5  T
  10     -8.0228377 -0.293968E-05  0.499E-03    0.13       9.0  T
  11     -8.0228378 -0.764263E-07  0.112E-03    0.13      39.8  T
  12     -8.0228378 -0.293939E-08  0.198E-04    0.13     225.5  T
  13     -8.0228378 -0.106279E-09  0.931E-05    0.13     480.5  T

   *** convergence criteria satisfied after 13 iterations ***

         #    Occupation            Energy/Eh            Energy/eV
      -------------------------------------------------------------
         1        2.0000           -0.6859836             -18.6666
         2        2.0000           -0.5804020             -15.7935
         3        2.0000           -0.5781461             -15.7322
         4        2.0000           -0.5396972             -14.6859
         5        2.0000           -0.4740939             -12.9008
         6        2.0000           -0.4626189             -12.5885
         7        2.0000           -0.4362869             -11.8720
         8        0.9196           -0.3694132             -10.0522 (HOMO)
         9        0.0804           -0.3647837              -9.9263 (LUMO)
        10                         -0.1041877              -2.8351
        11                          0.0550497               1.4980
        12                          0.0831335               2.2622
        13                          0.1872826               5.0962
        14                          0.2366172               6.4387
      -------------------------------------------------------------
                  HL-Gap            0.0046295 Eh            0.1260 eV
             Fermi-level           -0.3853793 Eh          -10.4867 eV

 SCC (total)                   0 d,  0 h,  0 min,  0.003 sec
 SCC setup                      ...        0 min,  0.000 sec (  3.023%)
 Dispersion                     ...        0 min,  0.000 sec (  0.585%)
 integral evaluation            ...        0 min,  0.001 sec ( 25.467%)
 zeroth order Hamiltonian       ...        0 min,  0.000 sec (  0.550%)
 iterations                     ...        0 min,  0.001 sec ( 39.970%)
 molecular gradient             ...        0 min,  0.001 sec ( 27.381%)
 printout                       ...        0 min,  0.000 sec (  2.595%)

         :::::::::::::::::::::::::::::::::::::::::::::::::::::
         ::                     SUMMARY                     ::
         :::::::::::::::::::::::::::::::::::::::::::::::::::::
         :: total energy              -7.953917865838 Eh    ::
         :: gradient norm              0.183252737729 Eh/a0 ::
         :: HOMO-LUMO gap              0.125974893200 eV    ::
         ::.................................................::
         :: SCC energy                -8.022837773140 Eh    ::
         :: -> isotropic ES            0.004192160829 Eh    ::
         :: -> anisotropic ES          0.001450206972 Eh    ::
         :: -> anisotropic XC          0.013745081495 Eh    ::
         :: -> dispersion             -0.001517495247 Eh    ::
         :: repulsion energy           0.068919883103 Eh    ::
         :: add. restraining           0.000000000000 Eh    ::
         :::::::::::::::::::::::::::::::::::::::::::::::::::::

      ----------------------------------------------------------- 
     |                   =====================                   |
     |                        A N C O P T                        |
     |                   =====================                   |
     |               Approximate Normal Coordinate               |
     |                Rational Function Optimizer                |
      ----------------------------------------------------------- 

          ...................................................
          :                      SETUP                      :
          :.................................................:
          :   optimization level            normal          :
          :   max. optcycles                   200          :
          :   ANC micro-cycles                  20          :
          :   degrees of freedom                 9          :
          :.................................................:
          :   RF solver                   davidson          :
          :   write xtbopt.log                true          :
          :   linear?                        false          :
          :   energy convergence         0.5000000E-05 Eh   :
          :   grad. convergence          0.1000000E-02 Eh/α :
          :   maximium RF displ.         1.0000000          :
          :   Hlow (freq-cutoff)         0.1000000E-01      :
          :   Hmax (freq-cutoff)         5.0000000          :
          :   S6 in model hess.         20.0000000          :
          ...................................................

generating ANC from model Hessian ...
Using Lindh-Hessian (1995)
 Shifting diagonal of input Hessian by    0.0000000000000000     
 Lowest  eigenvalues of input Hessian
   -0.000000   -0.000000   -0.000000   -0.000000    0.000000    0.000000
    0.039237    0.070034    0.125980    0.174172    0.689384    0.727822
    0.893102    0.971454    1.512410
 Highest eigenvalues
    0.174172    0.689384    0.727822    0.893102    0.971454    1.512410


........................................................................
.............................. CYCLE    1 ..............................
........................................................................
   1     -8.0228378 -0.802284E+01  0.166E-05    0.13       0.0  T
   2     -8.0228378  0.734346E-11  0.429E-05    0.13    1043.7  T
   3     -8.0228378 -0.202149E-11  0.367E-05    0.13    1219.0  T
     SCC iter.                  ...        0 min,  0.000 sec
     gradient                   ...        0 min,  0.001 sec
 * total energy  :    -7.9539179 Eh     change       -0.2619238E-10 Eh
   gradient norm :     0.1832521 Eh/α   predicted     0.0000000E+00 (-100.00%)
   displ. norm   :     0.4572541 α      lambda       -0.4536030E-01
   maximum displ.:     0.3860846 α      in ANC's #1, #3, #7, ...

........................................................................
.............................. CYCLE    2 ..............................
........................................................................
   1     -8.0750463 -0.807505E+01  0.134E+00    0.37       0.0  T
   2     -8.0747556  0.290624E-03  0.912E-01    0.18       1.0  T
   3     -8.0759942 -0.123857E-02  0.602E-01    0.33       1.0  T
   4     -8.0766502 -0.655950E-03  0.367E-02    0.27       1.2  T
   5     -8.0766129  0.372079E-04  0.925E-02    0.26       1.0  T
   6     -8.0766507 -0.377993E-04  0.131E-02    0.26       3.4  T
   7     -8.0766514 -0.641941E-06  0.179E-03    0.26      25.0  T
   8     -8.0766514 -0.202641E-08  0.262E-04    0.26     170.9  T
   9     -8.0766514 -0.767031E-11  0.655E-05    0.26     682.9  T
     SCC iter.                  ...        0 min,  0.001 sec
     gradient                   ...        0 min,  0.001 sec
 * total energy  :    -7.9904143 Eh     change       -0.3649642E-01 Eh
   gradient norm :     0.1075545 Eh/α   predicted    -0.2742215E-01 ( -24.86%)
   displ. norm   :     0.4476566 α      lambda       -0.3179694E-01
   maximum displ.:     0.3601064 α      in ANC's #1, #7, #3, ...

........................................................................
.............................. CYCLE    3 ..............................
........................................................................
   1     -8.1248479 -0.812485E+01  0.153E+00    0.82       0.0  T
   2     -8.1255273 -0.679449E-03  0.867E-01    0.69       1.0  T
   3     -8.1255041  0.232030E-04  0.434E-01    0.79       1.0  T
   4     -8.1258206 -0.316468E-03  0.362E-02    0.73       1.2  T
   5     -8.1258207 -0.732044E-07  0.619E-03    0.73       7.2  T
   6     -8.1258207 -0.614384E-07  0.187E-03    0.73      23.9  T
   7     -8.1258207  0.714854E-08  0.171E-03    0.73      26.2  T
   8     -8.1258207 -0.130016E-07  0.360E-04    0.73     124.3  T
   9     -8.1258207 -0.202856E-09  0.244E-05    0.73    1832.6  T
     SCC iter.                  ...        0 min,  0.001 sec
     gradient                   ...        0 min,  0.001 sec
 * total energy  :    -8.0056455 Eh     change       -0.1523124E-01 Eh
   gradient norm :     0.0950686 Eh/α   predicted    -0.1908447E-01 (  25.30%)
   displ. norm   :     0.2338858 α      lambda       -0.8820068E-02
   maximum displ.:     0.1804271 α      in ANC's #1, #3, #5, ...

........................................................................
.............................. CYCLE    4 ..............................
........................................................................
   1     -8.1154151 -0.811542E+01  0.532E-01    0.47       0.0  T
   2     -8.1154342 -0.191013E-04  0.302E-01    0.48       1.0  T
   3     -8.1154374 -0.318837E-05  0.389E-02    0.47       1.1  T
   4     -8.1154406 -0.314967E-05  0.190E-02    0.48       2.4  T
   5     -8.1154408 -0.261603E-06  0.458E-03    0.48       9.8  T
   6     -8.1154405  0.373962E-06  0.997E-03    0.48       4.5  T
   7     -8.1154409 -0.422991E-06  0.569E-04    0.48      78.5  T
   8     -8.1154409 -0.162592E-09  0.194E-04    0.48     230.6  T
     SCC iter.                  ...        0 min,  0.001 sec
     gradient                   ...        0 min,  0.001 sec
 * total energy  :    -8.0111174 Eh     change       -0.5471841E-02 Eh
   gradient norm :     0.0390510 Eh/α   predicted    -0.4651275E-02 ( -15.00%)
   displ. norm   :     0.1597240 α      lambda       -0.3668097E-02
   maximum displ.:     0.1062822 α      in ANC's #1, #5, #3, ...

........................................................................
.............................. CYCLE    5 ..............................
........................................................................
   1     -8.1206394 -0.812064E+01  0.443E-01    0.38       0.0  T
   2     -8.1206719 -0.324993E-04  0.242E-01    0.36       1.0  T
   3     -8.1206601  0.118090E-04  0.101E-01    0.39       1.0  T
   4     -8.1206821 -0.219841E-04  0.225E-02    0.37       2.0  T
   5     -8.1206633  0.187938E-04  0.691E-02    0.37       1.0  T
   6     -8.1206827 -0.193642E-04  0.361E-03    0.37      12.4  T
   7     -8.1206827 -0.740639E-08  0.483E-04    0.37      92.7  T
   8     -8.1206827 -0.496403E-10  0.200E-04    0.37     223.7  T
     SCC iter.                  ...        0 min,  0.001 sec
     gradient                   ...        0 min,  0.001 sec
 * total energy  :    -8.0136108 Eh     change       -0.2493460E-02 Eh
   gradient norm :     0.0167626 Eh/α   predicted    -0.1880837E-02 ( -24.57%)
   displ. norm   :     0.2043659 α      lambda       -0.1669310E-02
   maximum displ.:     0.1828449 α      in ANC's #1, #5, #7, ...

........................................................................
.............................. CYCLE    6 ..............................
........................................................................
   1     -8.1236920 -0.812369E+01  0.299E-01    0.38       0.0  T
   2     -8.1236976 -0.558233E-05  0.173E-01    0.38       1.0  T
   3     -8.1236973  0.231031E-06  0.234E-02    0.38       1.9  T
   4     -8.1236940  0.338447E-05  0.364E-02    0.38       1.2  T
   5     -8.1236971 -0.318669E-05  0.225E-02    0.38       2.0  T
   6     -8.1236990 -0.185870E-05  0.165E-03    0.38      27.2  T
   7     -8.1236990 -0.765287E-09  0.135E-04    0.38     330.8  T
   8     -8.1236990 -0.104095E-11  0.647E-05    0.38     691.6  T
     SCC iter.                  ...        0 min,  0.001 sec
     gradient                   ...        0 min,  0.001 sec
 * total energy  :    -8.0145417 Eh     change       -0.9308936E-03 Eh
   gradient norm :     0.0107168 Eh/α   predicted    -0.8695177E-03 (  -6.59%)
   displ. norm   :     0.0416717 α      lambda       -0.3920931E-03
   maximum displ.:     0.0347649 α      in ANC's #5, #7, #3, ...

........................................................................
.............................. CYCLE    7 ..............................
........................................................................
   1     -8.1287653 -0.812877E+01  0.116E-01    0.36       0.0  T
   2     -8.1287683 -0.299386E-05  0.657E-02    0.36       1.0  T
   3     -8.1287670  0.131464E-05  0.292E-02    0.36       1.5  T
   4     -8.1287605  0.648545E-05  0.470E-02    0.36       1.0  T
   5     -8.1287685 -0.800243E-05  0.120E-02    0.36       3.7  T
   6     -8.1287690 -0.476285E-06  0.111E-03    0.36      40.5  T
   7     -8.1287690 -0.177952E-09  0.125E-04    0.36     356.9  T
   8     -8.1287690 -0.895284E-12  0.508E-05    0.36     879.7  T
     SCC iter.                  ...        0 min,  0.001 sec
     gradient                   ...        0 min,  0.001 sec
 * total energy  :    -8.0146669 Eh     change       -0.1251783E-03 Eh
   gradient norm :     0.0066432 Eh/α   predicted    -0.1963886E-03 (  56.89%)
   displ. norm   :     0.0216649 α      lambda       -0.6595587E-04
   maximum displ.:     0.0204421 α      in ANC's #1, #3, #5, ...

........................................................................
.............................. CYCLE    8 ..............................
........................................................................
   1     -8.1274459 -0.812745E+01  0.254E-02    0.35       0.0  T
   2     -8.1274461 -0.229266E-06  0.140E-02    0.35       3.2  T
   3     -8.1274458  0.348929E-06  0.128E-02    0.35       3.5  T
   4     -8.1274439  0.190241E-05  0.247E-02    0.35       1.8  T
   5     -8.1274462 -0.234174E-05  0.145E-03    0.35      30.8  T
   6     -8.1274462 -0.225754E-08  0.252E-04    0.35     177.7  T
   7     -8.1274462 -0.128821E-10  0.355E-05    0.35    1258.6  T
     SCC iter.                  ...        0 min,  0.001 sec
     gradient                   ...        0 min,  0.001 sec
 * total energy  :    -8.0146987 Eh     change       -0.3177902E-04 Eh
   gradient norm :     0.0003497 Eh/α   predicted    -0.3299369E-04 (   3.82%)
   displ. norm   :     0.0016149 α      lambda       -0.2461730E-06
   maximum displ.:     0.0014958 α      in ANC's #1, #5, #7, ...

........................................................................
.............................. CYCLE    9 ..............................
........................................................................
   1     -8.1275288 -0.812753E+01  0.503E-03    0.35       0.0  T
   2     -8.1275287  0.368963E-07  0.416E-03    0.35      10.8  T
   3     -8.1275284  0.353819E-06  0.103E-02    0.35       4.4  T
   4     -8.1275288 -0.394454E-06  0.261E-04    0.35     171.3  T
   5     -8.1275288 -0.224389E-10  0.119E-04    0.35     375.5  T
     SCC iter.                  ...        0 min,  0.000 sec
     gradient                   ...        0 min,  0.001 sec
 * total energy  :    -8.0146988 Eh     change       -0.1288948E-06 Eh
   gradient norm :     0.0001413 Eh/α   predicted    -0.1212832E-06 (  -5.91%)
   displ. norm   :     0.0004656 α      lambda       -0.1648915E-07
   maximum displ.:     0.0004480 α      in ANC's #1, #3, #5, ...

   *** GEOMETRY OPTIMIZATION CONVERGED AFTER 9 ITERATIONS ***

------------------------------------------------------------------------
 total energy gain   :        -0.0607809 Eh      -38.1406 kcal/mol
 total RMSD          :         0.6607253 a0        0.3496 Å
 total power (kW/mol):       -17.7311497 (step)-8179.0003 (real)
------------------------------------------------------------------------

 ANCopt (total)                0 d,  0 h,  0 min,  0.020 sec
 optimizer setup                ...        0 min,  0.000 sec (  0.359%)
 model hessian                  ...        0 min,  0.000 sec (  0.680%)
 ANC generation                 ...        0 min,  0.000 sec (  0.298%)
 coordinate transformation      ...        0 min,  0.000 sec (  0.115%)
 single point calculation       ...        0 min,  0.018 sec ( 94.390%)
 optimization log               ...        0 min,  0.000 sec (  1.131%)
 hessian update                 ...        0 min,  0.000 sec (  0.118%)
 rational function              ...        0 min,  0.000 sec (  1.272%)

================
 final structure:
================
5
 xtb: 6.2.2 (9d81278992624c895f80dd42a50cac0aa55982e2)
C         0.73750018739093    0.01471178260955    0.23983419186378
N        -0.00978480363049    1.02566695525423   -0.20644657128433
C        -0.73818653843217    0.00029691518940    0.23822091167713
H         1.58913559683779   -0.50486741243233   -0.13404330525897
H        -1.57866444216606   -0.53580824062085   -0.13756522699762

 Bond Distances (Angstroems)
 ---------------------------
C1-N2=1.3340         C1-C3=1.4758         C1-H4=1.0654         N2-C1=1.3340         N2-C3=1.3340         C3-C1=1.4758         
C3-N2=1.3340         C3-H5=1.0654         H4-C1=1.0654         H5-C3=1.0654         
 C  H  Rav=1.0654 sigma=0.0000  Rmin=1.0654  Rmax=1.0654     2
 C  C  Rav=1.4758 sigma=0.0000  Rmin=1.4758  Rmax=1.4758     1
 N  C  Rav=1.3340 sigma=0.0000  Rmin=1.3340  Rmax=1.3340     2

 selected bond angles (degree)
 --------------------
C3-C1-N2= 56.42                H4-C1-N2=134.42                H4-C1-C3=142.58                C3-N2-C1= 67.16                
N2-C3-C1= 56.42                H5-C3-C1=142.58                H5-C3-N2=134.42                

 selected dihedral angles (degree)
 ---------------------------------
C3-N2-C1-H4=133.16            N2-C3-C1-H4=239.01            H5-C3-C1-N2=120.99            H5-C3-C1-H4=  0.00            
H5-C3-N2-C1=226.84            
           -------------------------------------------------
          |                Final Singlepoint                |
           -------------------------------------------------

          ...................................................
          :                      SETUP                      :
          :.................................................:
          :  # basis functions                  14          :
          :  # atomic orbitals                  14          :
          :  # shells                            8          :
          :  # electrons                        15          :
          :  max. iterations                   250          :
          :  Hamiltonian                  GFN2-xTB          :
          :  restarted?                      false          :
          :  GBSA solvation                  false          :
          :  PC potential                    false          :
          :  electronic temp.          300.0000000     K    :
          :  accuracy                    1.0000000          :
          :  -> integral cutoff          0.2500000E+02      :
          :  -> integral neglect         0.1000000E-07      :
          :  -> SCF convergence          0.1000000E-05 Eh   :
          :  -> wf. convergence          0.1000000E-03 e    :
          :  Broyden damping             0.4000000          :
          ...................................................

 iter      E             dE          RMSdq      gap      omega  full diag
   1     -8.1275288 -0.812753E+01  0.303E-05    0.35       0.0  T
   2     -8.1275288  0.106226E-11  0.273E-05    0.35    1638.7  T
   3     -8.1275288  0.811795E-11  0.482E-05    0.35     927.0  T

   *** convergence criteria satisfied after 3 iterations ***

         #    Occupation            Energy/Eh            Energy/eV
      -------------------------------------------------------------
         1        2.0000           -0.6916387             -18.8204
         2        2.0000           -0.5873580             -15.9828
         3        2.0000           -0.5681757             -15.4608
         4        2.0000           -0.5318989             -14.4737
         5        2.0000           -0.4950575             -13.4712
         6        2.0000           -0.4902015             -13.3391
         7        2.0000           -0.4044043             -11.0044
         8        0.9988           -0.3108615              -8.4590 (HOMO)
         9        0.0012           -0.2980836              -8.1113 (LUMO)
        10                         -0.0550611              -1.4983
        11                          0.1143191               3.1108
        12                          0.1539608               4.1895
        13                          0.3943630              10.7312
        14                          0.5138015              13.9813
      -------------------------------------------------------------
                  HL-Gap            0.0127779 Eh            0.3477 eV
             Fermi-level           -0.3310527 Eh           -9.0084 eV

 SCC (total)                   0 d,  0 h,  0 min,  0.002 sec
 SCC setup                      ...        0 min,  0.000 sec (  3.729%)
 Dispersion                     ...        0 min,  0.000 sec (  0.404%)
 integral evaluation            ...        0 min,  0.001 sec ( 40.320%)
 zeroth order Hamiltonian       ...        0 min,  0.000 sec (  0.740%)
 iterations                     ...        0 min,  0.000 sec ( 13.611%)
 molecular gradient             ...        0 min,  0.001 sec ( 38.274%)
 printout                       ...        0 min,  0.000 sec (  2.437%)

         :::::::::::::::::::::::::::::::::::::::::::::::::::::
         ::                     SUMMARY                     ::
         :::::::::::::::::::::::::::::::::::::::::::::::::::::
         :: total energy              -8.014698810927 Eh    ::
         :: gradient norm              0.000142297316 Eh/a0 ::
         :: HOMO-LUMO gap              0.347704095465 eV    ::
         ::.................................................::
         :: SCC energy                -8.127528784537 Eh    ::
         :: -> isotropic ES            0.003000817017 Eh    ::
         :: -> anisotropic ES          0.000868085659 Eh    ::
         :: -> anisotropic XC          0.013974071730 Eh    ::
         :: -> dispersion             -0.001518452256 Eh    ::
         :: repulsion energy           0.112829950676 Eh    ::
         :: add. restraining           0.000000000000 Eh    ::
         :::::::::::::::::::::::::::::::::::::::::::::::::::::

           ------------------------------------------------- 
          |                Numerical Hessian                |
           ------------------------------------------------- 
step length          :   0.00500
SCC accuracy         :   0.30000
Hessian scale factor :   1.00000
frozen atoms in %    :   0.00000    0
RMS gradient         :   0.00014
estimated CPU  time      0.00 min
estimated wall time      0.00 min

writing file <hessian>.

 projected vibrational frequencies (cm-1)
eigval :       -0.00    -0.00    -0.00    -0.00     0.00     0.00
eigval :     -957.38   693.41   818.12   836.79  1025.94  1141.06
eigval :     1678.52  3160.30  3164.71
           -------------------------------------------------
          |                Property Printout                |
           -------------------------------------------------

    * Orbital Energies and Occupations

         #    Occupation            Energy/Eh            Energy/eV
      -------------------------------------------------------------
         1        2.0000           -0.6916387             -18.8204
         2        2.0000           -0.5873580             -15.9828
         3        2.0000           -0.5681757             -15.4608
         4        2.0000           -0.5318989             -14.4737
         5        2.0000           -0.4950574             -13.4712
         6        2.0000           -0.4902015             -13.3391
         7        2.0000           -0.4044043             -11.0044
         8        0.9988           -0.3108615              -8.4590 (HOMO)
         9        0.0012           -0.2980836              -8.1113 (LUMO)
        10                         -0.0550611              -1.4983
        11                          0.1143191               3.1108
        12                          0.1539608               4.1895
        13                          0.3943630              10.7312
        14                          0.5138015              13.9813
      -------------------------------------------------------------
                  HL-Gap            0.0127779 Eh            0.3477 eV
             Fermi-level           -0.3310527 Eh           -9.0084 eV

     #   Z        covCN         q      C6AA      α(0)
     1   6 C      2.815     0.013    27.708     8.625
     2   7 N      1.820    -0.140    24.812     7.381
     3   6 C      2.815     0.013    27.709     8.625
     4   1 H      0.927     0.057     2.235     2.338
     5   1 H      0.927     0.057     2.235     2.338

 Mol. C6AA /au·bohr⁶  :        341.553034
 Mol. C8AA /au·bohr⁸  :       8159.287453
 Mol. α(0) /au        :         29.305403


Wiberg/Mayer (AO) data.
largest (>0.10) Wiberg bond orders for each atom
          total WBO             WBO to atom ...
     1  C   3.400        N    2 1.465    C    3 0.968    H    4 0.950
     2  N   2.946        C    1 1.465    C    3 1.465
     3  C   3.399        N    2 1.465    C    1 0.968    H    5 0.950
     4  H   0.975        C    1 0.950
     5  H   0.975        C    3 0.950

MOs/occ written to file <molden.input>


molecular dipole:
                 x           y           z       tot (Debye)
 q only:        0.004      -0.383       0.037
   full:        0.007      -0.732      -0.069       1.868
molecular quadrupole (traceless):
                xx          xy          yy          xz          yz          zz
 q only:        1.283       0.022      -0.948      -0.000       0.202      -0.336
  q+dip:        2.974       0.049      -2.205      -0.005       0.967      -0.769
   full:        2.321       0.046      -2.539      -0.012       1.439       0.218

           -------------------------------------------------
          |                Geometry Summary                 |
           -------------------------------------------------

      molecular mass/u    :       40.0440565
   center of mass at/Å    :       -0.0033629       0.3370673       0.0643384
  moments of inertia/u·Å² :        0.1257430E+02   0.1867194E+02   0.3017570E+02
rotational constants/cm⁻¹ :        0.1340641E+01   0.9028324E+00   0.5586492E+00

 * 4 selected distances

     #   Z        #   Z                                     value/Å
     1   6 C      2   7 N                                 1.3340284
     2   7 N      3   6 C                                 1.3340472 (max)
     1   6 C      4   1 H                                 1.0653778
     3   6 C      5   1 H                                 1.0653765 (min)
Molecule has the following symmetry elements: (sigma) 
It seems to be the Cs point group

 * 2 distinct bonds (by element types)

   Z      Z             #   av. dist./Å        max./Å        min./Å
   1 H    6 C           2     1.0653771     1.0653778     1.0653765
   6 C    7 N           2     1.3340378     1.3340472     1.3340284

           -------------------------------------------------
          |               Frequency Printout                |
           -------------------------------------------------
 projected vibrational frequencies (cm-1)
eigval :       -0.00    -0.00    -0.00    -0.00     0.00     0.00
eigval :     -957.38   693.41   818.12   836.79  1025.94  1141.06
eigval :     1678.52  3160.30  3164.71
 reduced masses (amu)
   1:  9.60   2: 10.32   3: 13.01   4: 12.36   5: 10.12   6: 11.93   7:  7.98   8:  2.75
   9:  1.94  10:  3.35  11:  8.72  12: 11.91  13: 12.26  14:  1.82  15:  2.05
 IR intensities (amu)
   1:  0.49   2:  0.13   3:  0.19   4:  0.11   5:  0.38   6:  0.24   7:  2.36   8:  0.12
   9:  0.17  10:  0.04  11:  1.10  12:  0.10  13:  0.45  14:  0.07  15:  0.20
 Raman intensities (amu)
   1:  0.00   2:  0.00   3:  0.00   4:  0.00   5:  0.00   6:  0.00   7:  0.00   8:  0.00
   9:  0.00  10:  0.00  11:  0.00  12:  0.00  13:  0.00  14:  0.00  15:  0.00
 output can be read by thermo (or use thermo option).
 writing <g98.out> molden fake output.
 recommended (thermochemical) frequency scaling factor: 1.0
           -------------------------------------------------
          |             Thermodynamic Functions             |
           -------------------------------------------------

cs  symmetry found (for desy threshold:  0.10E+00) used in thermo

          ...................................................
          :                      SETUP                      :
          :.................................................:
          :  # frequencies                           8      :
          :  # imaginary freq.                       1      :
          :  linear?                             false      :
          :  only rotor calc.                    false      :
          :  symmetry                               cs      :
          :  rotational number                       1      :
          :  scaling factor                  1.0000000      :
          :  rotor cutoff                   50.0000000 cm⁻¹ :
          :  imag. cutoff                  -20.0000000 cm⁻¹ :
          :.................................................:

    mode    ω/cm⁻¹     T·S(HO)/kcal·mol⁻¹    T·S(FR)/kcal·mol⁻¹   T·S(vib)
   ------------------------------------------------------------------------
   ------------------------------------------------------------------------

   temp. (K)  partition function   enthalpy   heat capacity  entropy
                                   cal/mol     cal/K/mol   cal/K/mol   J/K/mol
 298.15  VIB   1.09                  197.007      2.691      0.829
         ROT  0.643E+04              888.752      2.981     20.407
         INT  0.700E+04             1085.760      5.672     21.236
         TR   0.245E+27             1481.254      4.968     36.973
         TOT                        2567.0136    10.6405    58.2088   243.5455

   temp. (K)  partition function   enthalpy   heat capacity  entropy
                                   cal/mol     cal/K/mol   cal/K/mol   J/K/mol
 120.00  VIB   1.00                    0.737      0.055      0.007
         ROT  0.164E+04              357.707      2.981     17.694
         INT  0.164E+04              358.444      3.036     17.701
         TR   0.626E+26              596.178      4.968     32.454
         TOT                         954.6216     8.0038    50.1544   209.8461

   temp. (K)  partition function   enthalpy   heat capacity  entropy
                                   cal/mol     cal/K/mol   cal/K/mol   J/K/mol
 100.00  VIB   1.00                    0.126      0.013      0.001
         ROT  0.125E+04              298.089      2.981     17.150
         INT  0.125E+04              298.215      2.994     17.152
         TR   0.476E+26              496.815      4.968     31.549
         TOT                         795.0297     7.9623    48.7001   203.7613

   temp. (K)  partition function   enthalpy   heat capacity  entropy
                                   cal/mol     cal/K/mol   cal/K/mol   J/K/mol
  80.00  VIB   1.00                    0.009      0.001      0.000
         ROT   894.                  238.471      2.981     16.485
         INT   894.                  238.480      2.982     16.485
         TR   0.341E+26              397.452      4.968     30.440
         TOT                         635.9325     7.9505    46.9256   196.3368

   temp. (K)  partition function   enthalpy   heat capacity  entropy
                                   cal/mol     cal/K/mol   cal/K/mol   J/K/mol
  60.00  VIB   1.00                    0.000      0.000     -0.000
         ROT   580.                  178.853      2.981     15.627
         INT   580.                  178.854      2.981     15.627
         TR   0.221E+26              298.089      4.968     29.012
         TOT                         476.9425     7.9491    44.6394   186.7712

   temp. (K)  partition function   enthalpy   heat capacity  entropy
                                   cal/mol     cal/K/mol   cal/K/mol   J/K/mol
  40.00  VIB   1.00                    0.000      0.000     -0.000
         ROT   316.                  119.236      2.981     14.419
         INT   316.                  119.236      2.981     14.419
         TR   0.120E+26              198.726      4.968     26.999
         TOT                         317.9616     7.9490    41.4173   173.2899

   temp. (K)  partition function   enthalpy   heat capacity  entropy
                                   cal/mol     cal/K/mol   cal/K/mol   J/K/mol
  20.00  VIB   1.00                    0.000      0.000     -0.000
         ROT   112.                   59.618      2.981     12.353
         INT   112.                   59.618      2.981     12.353
         TR   0.426E+25               99.363      4.968     23.557
         TOT                         158.9808     7.9490    35.9091   150.2435

   temp. (K)  partition function   enthalpy   heat capacity  entropy
                                   cal/mol     cal/K/mol   cal/K/mol   J/K/mol
  10.00  VIB   1.00                    0.000      0.000     -0.000
         ROT   39.5                   29.809      2.981     10.286
         INT   39.5                   29.809      2.981     10.286
         TR   0.151E+25               49.681      4.968     20.115
         TOT                          79.4904     7.9490    30.4008   127.1971

       T/K    H(0)-H(T)+PV         H(T)/Eh          T*S/Eh         G(T)/Eh
   ------------------------------------------------------------------------
    298.15    0.409080E-02    0.326108E-01    0.276569E-01    0.495395E-02
    120.00    0.152129E-02    0.300413E-01    0.959114E-02    0.204502E-01
    100.00    0.126696E-02    0.297870E-01    0.776086E-02    0.220261E-01
     80.00    0.101342E-02    0.295334E-01    0.598246E-02    0.235510E-01
     60.00    0.760056E-03    0.292801E-01    0.426824E-02    0.250118E-01
     40.00    0.506704E-03    0.290267E-01    0.264011E-02    0.263866E-01
     20.00    0.253352E-03    0.287734E-01    0.114449E-02    0.276289E-01
     10.00    0.126676E-03    0.286467E-01    0.484468E-03    0.281622E-01 (used)
   ------------------------------------------------------------------------

         :::::::::::::::::::::::::::::::::::::::::::::::::::::
         ::                  THERMODYNAMIC                  ::
         :::::::::::::::::::::::::::::::::::::::::::::::::::::
         :: total free energy          -7.986536578765 Eh   ::
         ::.................................................::
         :: total energy               -8.014698810896 Eh   ::
         :: zero point energy           0.028520024403 Eh   ::
         :: G(RRHO) w/o ZPVE           -0.000357792272 Eh   ::
         :: G(RRHO) contrib.            0.028162232131 Eh   ::
         :::::::::::::::::::::::::::::::::::::::::::::::::::::
imag cut-off (cm-1) :    5.00
 found            1  significant imaginary frequency
 writing imag mode distorted coords to xtbhess.xyz
 for further optimization.

optimized geometry written to: xtbopt.xyz


           -------------------------------------------------
          | TOTAL ENERGY               -8.014698810896 Eh   |
          | TOTAL ENTHALPY             -7.986052110478 Eh   |
          | TOTAL FREE ENERGY          -7.986536578765 Eh   |
          | GRADIENT NORM               0.000142100891 Eh/α |
          | HOMO-LUMO GAP               0.347703782647 eV   |
           -------------------------------------------------

------------------------------------------------------------------------
 * finished run on 2020/05/12 at 11:44:48.501     
------------------------------------------------------------------------
 total:
 * wall-time:     0 d,  0 h,  0 min,  0.097 sec
 *  cpu-time:     0 d,  0 h,  0 min,  0.097 sec
 * ratio c/w:     0.998 speedup
 SCF:
 * wall-time:     0 d,  0 h,  0 min,  0.003 sec
 *  cpu-time:     0 d,  0 h,  0 min,  0.003 sec
 * ratio c/w:     0.999 speedup
 ANC optimizer:
 * wall-time:     0 d,  0 h,  0 min,  0.022 sec
 *  cpu-time:     0 d,  0 h,  0 min,  0.022 sec
 * ratio c/w:     0.999 speedup
 numerical hessian:
 * wall-time:     0 d,  0 h,  0 min,  0.056 sec
 *  cpu-time:     0 d,  0 h,  0 min,  0.056 sec
 * ratio c/w:     0.998 speedup

