      -----------------------------------------------------------      
     |                   =====================                   |     
     |                           x T B                           |     
     |                   =====================                   |     
     |                         S. Grimme                         |     
     |          Mulliken Center for Theoretical Chemistry        |     
     |                    University of Bonn                     |     
      -----------------------------------------------------------      

   * xtb version 6.2.2 (9d81278992624c895f80dd42a50cac0aa55982e2) compiled by '@Darwin' on 04/03/2020

   xtb is free software: you can redistribute it and/or modify it under
   the terms of the GNU Lesser General Public License as published by
   the Free Software Foundation, either version 3 of the License, or
   (at your option) any later version.
   
   xtb is distributed in the hope that it will be useful,
   but WITHOUT ANY WARRANTY; without even the implied warranty of
   MERCHANTABILITY or FITNESS FOR A PARTICULAR PURPOSE.  See the
   GNU Lesser General Public License for more details.
   
   Cite this work as:
   * S. Grimme, C. Bannwarth, P. Shushkov, J. Chem. Theory Comput., 2017,
     13, 1989-2009. DOI: 10.1021/acs.jctc.7b00118
   * C. Bannwarth, S. Ehlert and S. Grimme., J. Chem. Theory Comput., 2019,
     15, 1652-1671. DOI: 10.1021/acs.jctc.8b01176
   * P. Pracht, E. Caldeweyher, S. Ehlert, S. Grimme, ChemRxiv, 2019, preprint.
     DOI: 10.26434/chemrxiv.8326202.v1
   
   for DFT-D4:
   * E. Caldeweyher, C. Bannwarth and S. Grimme, J. Chem. Phys., 2017,
     147, 034112. DOI: 10.1063/1.4993215
   * E. Caldeweyher, S. Ehlert, A. Hansen, H. Neugebauer, S. Spicher,
     C. Bannwarth and S. Grimme, J. Chem. Phys., 2019, 150, 154122.
     DOI: 10.1063/1.5090222
   
   for sTDA-xTB:
   * S. Grimme and C. Bannwarth, J. Chem. Phys., 2016, 145, 054103.
     DOI: 10.1063/1.4959605
   
   in the mass-spec context:
   * V. Asgeirsson, C. Bauer and S. Grimme, Chem. Sci., 2017, 8, 4879.
     DOI: 10.1039/c7sc00601b
   
   for metadynamics refer to:
   * S. Grimme, J. Chem. Theory Comput., 2019, 155, 2847-2862
     DOI: 10.1021/acs.jctc.9b00143
   
   with help from (in alphabetical order)
   C. Bannwarth, F. Bohle, G. Brandenburg, E. Caldeweyher, M. Checinski,
   S. Dohm, S. Ehlert, S. Ehrlich, F. März, H. Neugebauer, J. Pisarek,
   P. Pracht, P. Shushkov, and S. Spicher.
   
 * started run on 2020/05/12 at 11:45:21.754     

           -------------------------------------------------
          |                Calculation Setup                |
           -------------------------------------------------

          program call               : xtb --input H2C1N2_5_S_2.input H2C1N2_5_S_2.xyz --ohess --molden --namespace H2C1N2_5_S_2 output.out
          calculation namespace      : H2C1N2_5_S_2
          coordinate file            : H2C1N2_5_S_2.xyz
          number of atoms            :                     5
          number of electrons        :                    16
          charge                     :                     0
          spin                       :                   1.0
          first test random number   :      0.94043559170176

   ID    Z sym.   atoms
    1    7 N      1, 3
    2    6 C      2
    3    1 H      4, 5

           -------------------------------------------------
          |                 G F N 2 - x T B                 |
           -------------------------------------------------

        Reference                      10.1021/acs.jctc.8b01176
      * Hamiltonian:
        H0-scaling (s, p, d)           1.850000    2.230000    2.230000
        zeta-weighting                 0.500000
      * Dispersion:
        s8                             2.700000
        a1                             0.520000
        a2                             5.000000
        s9                             5.000000
      * Repulsion:
        kExp                           1.500000    1.000000
        rExp                           1.000000
      * Coulomb:
        alpha                          2.000000
        third order                    shell-resolved
        anisotropic                    true
        a3                             3.000000
        a5                             4.000000
        cn-shift                       1.200000
        cn-exp                         4.000000
        max-rad                        5.000000


          ...................................................
          :                      SETUP                      :
          :.................................................:
          :  # basis functions                  14          :
          :  # atomic orbitals                  14          :
          :  # shells                            8          :
          :  # electrons                        16          :
          :  max. iterations                   250          :
          :  Hamiltonian                  GFN2-xTB          :
          :  restarted?                      false          :
          :  GBSA solvation                  false          :
          :  PC potential                    false          :
          :  electronic temp.          300.0000000     K    :
          :  accuracy                    1.0000000          :
          :  -> integral cutoff          0.2500000E+02      :
          :  -> integral neglect         0.1000000E-07      :
          :  -> SCF convergence          0.1000000E-05 Eh   :
          :  -> wf. convergence          0.1000000E-03 e    :
          :  Broyden damping             0.4000000          :
          ...................................................

 iter      E             dE          RMSdq      gap      omega  full diag
   1     -8.5832790 -0.858328E+01  0.637E+00    1.13       0.0  T
   2     -8.3957044  0.187575E+00  0.798E+00    0.66       1.0  T
   3     -8.7282345 -0.332530E+00  0.371E+00    0.85       1.0  T
   4     -8.7404756 -0.122411E-01  0.180E+00    0.81       1.0  T
   5     -8.7385969  0.187870E-02  0.901E-01    0.82       1.0  T
   6     -8.7398480 -0.125111E-02  0.976E-01    0.74       1.0  T
   7     -8.7416390 -0.179097E-02  0.686E-01    0.75       1.0  T
   8     -8.7445980 -0.295900E-02  0.202E-02    0.78       2.2  T
   9     -8.7445989 -0.873842E-06  0.760E-03    0.78       5.9  T
  10     -8.7445991 -0.243027E-06  0.152E-03    0.78      29.5  T
  11     -8.7445991 -0.230135E-08  0.416E-04    0.78     107.6  T
  12     -8.7445991  0.105693E-11  0.246E-04    0.78     181.5  T

   *** convergence criteria satisfied after 12 iterations ***

         #    Occupation            Energy/Eh            Energy/eV
      -------------------------------------------------------------
         1        2.0000           -0.6870721             -18.6962
       ...           ...                  ...                  ...
         3        2.0000           -0.5962632             -16.2251
         4        2.0000           -0.5760359             -15.6747
         5        2.0000           -0.4970093             -13.5243
         6        2.0000           -0.4815984             -13.1050
         7        2.0000           -0.4303315             -11.7099
         8        1.0000           -0.3993510             -10.8669
         9        1.0000           -0.3233859              -8.7998 (HOMO)
        10        0.0000           -0.2946582              -8.0181 (LUMO)
        11                         -0.0252007              -0.6857
        12                          0.0177914               0.4841
        13                          0.1032114               2.8085
        14                          0.1107258               3.0130
      -------------------------------------------------------------
                  HL-Gap            0.0287278 Eh            0.7817 eV
             Fermi-level           -0.3619316 Eh           -9.8487 eV

 transition dipole moment (au) for excitation:           8           9
     X       Y       Z   
  -0.1135  -0.0281   0.1736  total (au/Debye):    0.209   0.532
 dE (eV)             :    2.067
 oscillator strength :  0.31359E-02

 SCC (total)                   0 d,  0 h,  0 min,  0.004 sec
 SCC setup                      ...        0 min,  0.000 sec (  2.624%)
 Dispersion                     ...        0 min,  0.000 sec (  0.452%)
 integral evaluation            ...        0 min,  0.001 sec ( 21.871%)
 zeroth order Hamiltonian       ...        0 min,  0.000 sec (  0.452%)
 iterations                     ...        0 min,  0.001 sec ( 32.434%)
 molecular gradient             ...        0 min,  0.001 sec ( 21.658%)
 printout                       ...        0 min,  0.001 sec ( 20.223%)

         :::::::::::::::::::::::::::::::::::::::::::::::::::::
         ::                     SUMMARY                     ::
         :::::::::::::::::::::::::::::::::::::::::::::::::::::
         :: total energy              -8.699508231202 Eh    ::
         :: gradient norm              0.189780760854 Eh/a0 ::
         :: HOMO-LUMO gap              0.781722227141 eV    ::
         ::.................................................::
         :: SCC energy                -8.744599118688 Eh    ::
         :: -> isotropic ES           -0.006914871317 Eh    ::
         :: -> anisotropic ES          0.001327501574 Eh    ::
         :: -> anisotropic XC          0.009020691462 Eh    ::
         :: -> dispersion             -0.001469888798 Eh    ::
         :: repulsion energy           0.045090853870 Eh    ::
         :: add. restraining           0.000000000000 Eh    ::
         :::::::::::::::::::::::::::::::::::::::::::::::::::::

      ----------------------------------------------------------- 
     |                   =====================                   |
     |                        A N C O P T                        |
     |                   =====================                   |
     |               Approximate Normal Coordinate               |
     |                Rational Function Optimizer                |
      ----------------------------------------------------------- 

          ...................................................
          :                      SETUP                      :
          :.................................................:
          :   optimization level            normal          :
          :   max. optcycles                   200          :
          :   ANC micro-cycles                  20          :
          :   degrees of freedom                 9          :
          :.................................................:
          :   RF solver                   davidson          :
          :   write xtbopt.log                true          :
          :   linear?                        false          :
          :   energy convergence         0.5000000E-05 Eh   :
          :   grad. convergence          0.1000000E-02 Eh/α :
          :   maximium RF displ.         1.0000000          :
          :   Hlow (freq-cutoff)         0.1000000E-01      :
          :   Hmax (freq-cutoff)         5.0000000          :
          :   S6 in model hess.         20.0000000          :
          ...................................................

generating ANC from model Hessian ...
Using Lindh-Hessian (1995)
 Shifting diagonal of input Hessian by    0.0000000000000000     
 Lowest  eigenvalues of input Hessian
   -0.000000   -0.000000   -0.000000    0.000000    0.000000    0.000000
    0.016754    0.048134    0.155502    0.171530    0.234205    0.708804
    0.976955    1.200295    1.402327
 Highest eigenvalues
    0.171530    0.234205    0.708804    0.976955    1.200295    1.402327


........................................................................
.............................. CYCLE    1 ..............................
........................................................................
   1     -8.7445991 -0.874460E+01  0.793E-05    0.78       0.0  T
   2     -8.7445991  0.655316E-10  0.109E-04    0.78     411.5  T
   3     -8.7445991 -0.875318E-10  0.367E-05    0.78    1218.9  T
     SCC iter.                  ...        0 min,  0.001 sec
     gradient                   ...        0 min,  0.001 sec
 * total energy  :    -8.6995082 Eh     change        0.6521006E-11 Eh
   gradient norm :     0.1897806 Eh/α   predicted     0.0000000E+00 (-100.00%)
   displ. norm   :     0.3073758 α      lambda       -0.4322004E-01
   maximum displ.:     0.2261508 α      in ANC's #2, #7, #6, ...

........................................................................
.............................. CYCLE    2 ..............................
........................................................................
   1     -8.7968221 -0.879682E+01  0.183E+00    1.21       0.0  T
   2     -8.7917578  0.506430E-02  0.145E+00    1.09       1.0  T
   3     -8.7975460 -0.578823E-02  0.101E+00    1.18       1.0  T
   4     -8.8012180 -0.367206E-02  0.182E-01    1.13       1.0  T
   5     -8.8013274 -0.109326E-03  0.853E-02    1.13       1.0  T
   6     -8.8013376 -0.102508E-04  0.101E-02    1.13       4.4  T
   7     -8.8013377 -0.826681E-07  0.628E-03    1.13       7.1  T
   8     -8.8013377 -0.296239E-07  0.407E-04    1.13     109.9  T
   9     -8.8013377 -0.198712E-09  0.279E-04    1.13     160.3  T
     SCC iter.                  ...        0 min,  0.001 sec
     gradient                   ...        0 min,  0.001 sec
 * total energy  :    -8.7337234 Eh     change       -0.3421513E-01 Eh
   gradient norm :     0.1098588 Eh/α   predicted    -0.2365174E-01 ( -30.87%)
   displ. norm   :     0.2755903 α      lambda       -0.2842256E-01
   maximum displ.:     0.1915041 α      in ANC's #7, #6, #5, ...

........................................................................
.............................. CYCLE    3 ..............................
........................................................................
   1     -8.8640506 -0.886405E+01  0.196E+00    1.97       0.0  T
   2     -8.8659248 -0.187423E-02  0.109E+00    1.87       1.0  T
   3     -8.8645514  0.137347E-02  0.931E-01    1.86       1.0  T
   4     -8.8672017 -0.265033E-02  0.344E-01    1.85       1.0  T
   5     -8.8676750 -0.473275E-03  0.756E-02    1.83       1.0  T
   6     -8.8676822 -0.724544E-05  0.158E-02    1.83       2.8  T
   7     -8.8676830 -0.759640E-06  0.477E-03    1.83       9.4  T
   8     -8.8676830 -0.970562E-08  0.860E-04    1.83      52.0  T
   9     -8.8676830 -0.150662E-08  0.245E-04    1.83     182.8  T
     SCC iter.                  ...        0 min,  0.001 sec
     gradient                   ...        0 min,  0.001 sec
 * total energy  :    -8.7279297 Eh     change        0.5793697E-02 Eh
   gradient norm :     0.2361123 Eh/α   predicted    -0.1529062E-01 (-363.92%)
   displ. norm   :     0.2086260 α      lambda       -0.3988241E-01
   maximum displ.:     0.1336248 α      in ANC's #2, #7, #6, ...

........................................................................
.............................. CYCLE    4 ..............................
........................................................................
   1     -8.8237477 -0.882375E+01  0.116E+00    1.22       0.0  T
   2     -8.8242799 -0.532237E-03  0.725E-01    1.29       1.0  T
   3     -8.8248026 -0.522741E-03  0.605E-01    1.28       1.0  T
   4     -8.8259342 -0.113159E-02  0.242E-01    1.29       1.0  T
   5     -8.8261073 -0.173064E-03  0.367E-02    1.30       1.2  T
   6     -8.8261065  0.843132E-06  0.186E-02    1.30       2.4  T
   7     -8.8261080 -0.155658E-05  0.399E-03    1.30      11.2  T
   8     -8.8261081 -0.883946E-07  0.579E-04    1.30      77.3  T
   9     -8.8261081 -0.438634E-09  0.187E-04    1.30     239.7  T
     SCC iter.                  ...        0 min,  0.001 sec
     gradient                   ...        0 min,  0.001 sec
 * total energy  :    -8.7420570 Eh     change       -0.1412736E-01 Eh
   gradient norm :     0.0379895 Eh/α   predicted    -0.2080915E-01 (  47.30%)
   displ. norm   :     0.0528034 α      lambda       -0.1100417E-02
   maximum displ.:     0.0395074 α      in ANC's #2, #6, #5, ...

........................................................................
.............................. CYCLE    5 ..............................
........................................................................
   1     -8.8322701 -0.883227E+01  0.257E-01    1.38       0.0  T
   2     -8.8323123 -0.421237E-04  0.131E-01    1.37       1.0  T
   3     -8.8323146 -0.234159E-05  0.663E-02    1.37       1.0  T
   4     -8.8323105  0.405946E-05  0.309E-02    1.37       1.4  T
   5     -8.8323176 -0.702339E-05  0.109E-02    1.37       4.1  T
   6     -8.8323179 -0.294533E-06  0.981E-04    1.37      45.6  T
   7     -8.8323179 -0.279437E-09  0.337E-04    1.37     132.6  T
     SCC iter.                  ...        0 min,  0.001 sec
     gradient                   ...        0 min,  0.001 sec
 * total energy  :    -8.7428326 Eh     change       -0.7755450E-03 Eh
   gradient norm :     0.0154889 Eh/α   predicted    -0.5517426E-03 ( -28.86%)
   displ. norm   :     0.0365360 α      lambda       -0.4053713E-03
   maximum displ.:     0.0213639 α      in ANC's #6, #2, #5, ...

........................................................................
.............................. CYCLE    6 ..............................
........................................................................
   1     -8.8373056 -0.883731E+01  0.207E-01    1.43       0.0  T
   2     -8.8373360 -0.304787E-04  0.101E-01    1.42       1.0  T
   3     -8.8373309  0.512224E-05  0.616E-02    1.42       1.0  T
   4     -8.8373242  0.675451E-05  0.539E-02    1.42       1.0  T
   5     -8.8373427 -0.185030E-04  0.648E-03    1.42       6.9  T
   6     -8.8373427 -0.394998E-07  0.993E-04    1.42      45.1  T
   7     -8.8373427 -0.276877E-09  0.259E-04    1.42     172.6  T
     SCC iter.                  ...        0 min,  0.000 sec
     gradient                   ...        0 min,  0.001 sec
 * total energy  :    -8.7430546 Eh     change       -0.2220418E-03 Eh
   gradient norm :     0.0066892 Eh/α   predicted    -0.2029579E-03 (  -8.59%)
   displ. norm   :     0.0258223 α      lambda       -0.6368179E-04
   maximum displ.:     0.0218052 α      in ANC's #2, #4, #6, ...

........................................................................
.............................. CYCLE    7 ..............................
........................................................................
   1     -8.8373166 -0.883732E+01  0.937E-02    1.42       0.0  T
   2     -8.8373160  0.555614E-06  0.524E-02    1.42       1.0  T
   3     -8.8372990  0.170400E-04  0.569E-02    1.42       1.0  T
   4     -8.8373196 -0.206761E-04  0.564E-03    1.42       7.9  T
   5     -8.8373197 -0.439800E-07  0.273E-03    1.42      16.4  T
   6     -8.8373197 -0.269040E-08  0.450E-04    1.42      99.5  T
   7     -8.8373197 -0.106981E-09  0.797E-05    1.42     561.4  T
     SCC iter.                  ...        0 min,  0.001 sec
     gradient                   ...        0 min,  0.001 sec
 * total energy  :    -8.7431028 Eh     change       -0.4818823E-04 Eh
   gradient norm :     0.0052806 Eh/α   predicted    -0.3186312E-04 ( -33.88%)
   displ. norm   :     0.0253569 α      lambda       -0.5882372E-04
   maximum displ.:     0.0157220 α      in ANC's #2, #4, #6, ...

........................................................................
.............................. CYCLE    8 ..............................
........................................................................
   1     -8.8371652 -0.883717E+01  0.114E-01    1.42       0.0  T
   2     -8.8371663 -0.108255E-05  0.611E-02    1.42       1.0  T
   3     -8.8371489  0.173711E-04  0.555E-02    1.42       1.0  T
   4     -8.8371686 -0.197220E-04  0.715E-03    1.42       6.3  T
   5     -8.8371687 -0.369664E-07  0.355E-03    1.42      12.6  T
   6     -8.8371687 -0.418004E-08  0.806E-04    1.42      55.5  T
   7     -8.8371687 -0.416929E-09  0.124E-04    1.42     361.3  T
     SCC iter.                  ...        0 min,  0.001 sec
     gradient                   ...        0 min,  0.001 sec
 * total energy  :    -8.7431352 Eh     change       -0.3236566E-04 Eh
   gradient norm :     0.0014598 Eh/α   predicted    -0.2943160E-04 (  -9.07%)
   displ. norm   :     0.0072640 α      lambda       -0.2655592E-05
   maximum displ.:     0.0049165 α      in ANC's #2, #4, #6, ...

........................................................................
.............................. CYCLE    9 ..............................
........................................................................
   1     -8.8369129 -0.883691E+01  0.298E-02    1.41       0.0  T
   2     -8.8369120  0.854417E-06  0.248E-02    1.41       1.8  T
   3     -8.8369129 -0.886978E-06  0.148E-02    1.41       3.0  T
   4     -8.8369139 -0.929112E-06  0.224E-03    1.41      20.0  T
   5     -8.8369139 -0.559097E-08  0.106E-03    1.41      42.1  T
   6     -8.8369139 -0.370770E-09  0.170E-04    1.41     263.5  T
   7     -8.8369139 -0.111999E-10  0.316E-05    1.41    1415.5  T
     SCC iter.                  ...        0 min,  0.000 sec
     gradient                   ...        0 min,  0.001 sec
 * total energy  :    -8.7431373 Eh     change       -0.2166852E-05 Eh
   gradient norm :     0.0008175 Eh/α   predicted    -0.1327411E-05 ( -38.74%)
   displ. norm   :     0.0017742 α      lambda       -0.8461158E-06
   maximum displ.:     0.0013135 α      in ANC's #6, #9, #2, ...

   *** GEOMETRY OPTIMIZATION CONVERGED AFTER 9 ITERATIONS ***

------------------------------------------------------------------------
 total energy gain   :        -0.0436291 Eh      -27.3777 kcal/mol
 total RMSD          :         0.2925696 a0        0.1548 Å
 total power (kW/mol):       -12.7275764 (step)-5341.5374 (real)
------------------------------------------------------------------------

 ANCopt (total)                0 d,  0 h,  0 min,  0.021 sec
 optimizer setup                ...        0 min,  0.000 sec (  0.413%)
 model hessian                  ...        0 min,  0.000 sec (  0.545%)
 ANC generation                 ...        0 min,  0.000 sec (  0.293%)
 coordinate transformation      ...        0 min,  0.000 sec (  0.111%)
 single point calculation       ...        0 min,  0.020 sec ( 94.534%)
 optimization log               ...        0 min,  0.000 sec (  1.036%)
 hessian update                 ...        0 min,  0.000 sec (  0.118%)
 rational function              ...        0 min,  0.000 sec (  1.259%)

================
 final structure:
================
5
 xtb: 6.2.2 (9d81278992624c895f80dd42a50cac0aa55982e2)
N         0.78009050253132   -0.14691181138638    0.51923418093737
C         1.66546839484325   -0.02385309230915   -0.35059436846622
N        -0.56781762405696   -0.00922642259286    0.20693201030174
H        -0.89195896256487    0.92574106124140   -0.02179927101864
H        -0.98578131075274   -0.74574973495301   -0.35377255175425

 Bond Distances (Angstroems)
 ---------------------------
N1-C2=1.2473         N1-N3=1.3904         C2-N1=1.2473         N3-N1=1.3904         N3-H4=1.0157         N3-H5=1.0157         
H4-N3=1.0157         H5-N3=1.0157         
 N  H  Rav=1.0157 sigma=0.0000  Rmin=1.0157  Rmax=1.0157     2
 N  C  Rav=1.2473 sigma=0.0000  Rmin=1.2473  Rmax=1.2473     1
 N  N  Rav=1.3904 sigma=0.0000  Rmin=1.3904  Rmax=1.3904     1

 selected bond angles (degree)
 --------------------
N3-N1-C2=121.45                H4-N3-N1=116.82                H5-N3-N1=116.82                H5-N3-H4=114.32                

 selected dihedral angles (degree)
 ---------------------------------
H4-N3-N1-C2=289.70            H5-N3-N1-C2= 70.30            
           -------------------------------------------------
          |                Final Singlepoint                |
           -------------------------------------------------

          ...................................................
          :                      SETUP                      :
          :.................................................:
          :  # basis functions                  14          :
          :  # atomic orbitals                  14          :
          :  # shells                            8          :
          :  # electrons                        16          :
          :  max. iterations                   250          :
          :  Hamiltonian                  GFN2-xTB          :
          :  restarted?                      false          :
          :  GBSA solvation                  false          :
          :  PC potential                    false          :
          :  electronic temp.          300.0000000     K    :
          :  accuracy                    1.0000000          :
          :  -> integral cutoff          0.2500000E+02      :
          :  -> integral neglect         0.1000000E-07      :
          :  -> SCF convergence          0.1000000E-05 Eh   :
          :  -> wf. convergence          0.1000000E-03 e    :
          :  Broyden damping             0.4000000          :
          ...................................................

 iter      E             dE          RMSdq      gap      omega  full diag
   1     -8.8369139 -0.883691E+01  0.907E-06    1.41       0.0  T
   2     -8.8369139  0.266454E-13  0.624E-06    1.41    7165.7  T
   3     -8.8369139  0.923706E-13  0.535E-06    1.41    8355.8  T

   *** convergence criteria satisfied after 3 iterations ***

         #    Occupation            Energy/Eh            Energy/eV
      -------------------------------------------------------------
         1        2.0000           -0.6821013             -18.5609
       ...           ...                  ...                  ...
         3        2.0000           -0.5897403             -16.0477
         4        2.0000           -0.5746888             -15.6381
         5        2.0000           -0.5065036             -13.7827
         6        2.0000           -0.4505808             -12.2609
         7        2.0000           -0.4442854             -12.0896
         8        1.0000           -0.3730100             -10.1501
         9        1.0000           -0.2810039              -7.6465 (HOMO)
        10                         -0.2291899              -6.2366 (LUMO)
        11                         -0.0169816              -0.4621
        12                          0.1139834               3.1016
        13                          0.1890621               5.1446
        14                          0.5459271              14.8554
      -------------------------------------------------------------
                  HL-Gap            0.0518140 Eh            1.4099 eV
             Fermi-level           -0.3318723 Eh           -9.0307 eV

 transition dipole moment (au) for excitation:           8           9
     X       Y       Z   
   0.4279   0.0255  -0.2493  total (au/Debye):    0.496   1.260
 dE (eV)             :    2.504
 oscillator strength :  0.21328E-01

 SCC (total)                   0 d,  0 h,  0 min,  0.002 sec
 SCC setup                      ...        0 min,  0.000 sec (  2.992%)
 Dispersion                     ...        0 min,  0.000 sec (  0.325%)
 integral evaluation            ...        0 min,  0.001 sec ( 31.039%)
 zeroth order Hamiltonian       ...        0 min,  0.000 sec (  0.478%)
 iterations                     ...        0 min,  0.000 sec (  9.674%)
 molecular gradient             ...        0 min,  0.001 sec ( 29.902%)
 printout                       ...        0 min,  0.001 sec ( 25.217%)

         :::::::::::::::::::::::::::::::::::::::::::::::::::::
         ::                     SUMMARY                     ::
         :::::::::::::::::::::::::::::::::::::::::::::::::::::
         :: total energy              -8.743137332047 Eh    ::
         :: gradient norm              0.000817533716 Eh/a0 ::
         :: HOMO-LUMO gap              1.409930400597 eV    ::
         ::.................................................::
         :: SCC energy                -8.836913868278 Eh    ::
         :: -> isotropic ES            0.001097808760 Eh    ::
         :: -> anisotropic ES          0.001096663135 Eh    ::
         :: -> anisotropic XC          0.010072581341 Eh    ::
         :: -> dispersion             -0.001471833435 Eh    ::
         :: repulsion energy           0.093776509377 Eh    ::
         :: add. restraining           0.000000000000 Eh    ::
         :::::::::::::::::::::::::::::::::::::::::::::::::::::

           ------------------------------------------------- 
          |                Numerical Hessian                |
           ------------------------------------------------- 
step length          :   0.00500
SCC accuracy         :   0.30000
Hessian scale factor :   1.00000
frozen atoms in %    :   0.00000    0
RMS gradient         :   0.00082
estimated CPU  time      0.00 min
estimated wall time      0.00 min

writing file <hessian>.

 projected vibrational frequencies (cm-1)
eigval :       -0.00    -0.00    -0.00     0.00     0.00     0.00
eigval :      -71.41   547.05   659.74   904.80   964.77  1409.91
eigval :     1604.31  3287.29  3353.65
           -------------------------------------------------
          |                Property Printout                |
           -------------------------------------------------

    * Orbital Energies and Occupations

         #    Occupation            Energy/Eh            Energy/eV
      -------------------------------------------------------------
         1        2.0000           -0.6821013             -18.5609
         2        2.0000           -0.6316676             -17.1886
         3        2.0000           -0.5897404             -16.0477
         4        2.0000           -0.5746888             -15.6381
         5        2.0000           -0.5065036             -13.7827
         6        2.0000           -0.4505808             -12.2609
         7        2.0000           -0.4442854             -12.0896
         8        1.0000           -0.3730100             -10.1501
         9        1.0000           -0.2810040              -7.6465 (HOMO)
        10                         -0.2291900              -6.2366 (LUMO)
        11                         -0.0169816              -0.4621
        12                          0.1139834               3.1016
        13                          0.1890621               5.1446
        14                          0.5459270              14.8554
      -------------------------------------------------------------
                  HL-Gap            0.0518140 Eh            1.4099 eV
             Fermi-level           -0.3318723 Eh           -9.0307 eV

     #   Z        covCN         q      C6AA      α(0)
     1   7 N      1.889    -0.031    22.562     7.042
     2   6 C      0.935    -0.154    40.612    10.679
     3   7 N      2.722    -0.166    24.596     7.366
     4   1 H      0.860     0.176     1.238     1.743
     5   1 H      0.860     0.176     1.238     1.743

 Mol. C6AA /au·bohr⁶  :        333.930899
 Mol. C8AA /au·bohr⁸  :       7647.636482
 Mol. α(0) /au        :         28.571858


Wiberg/Mayer (AO) data.
largest (>0.10) Wiberg bond orders for each atom
          total WBO             WBO to atom ...
     1  N   2.963        C    2 1.911    N    3 1.047
     2  C   2.057        N    1 1.911    N    3 0.111
     3  N   3.032        N    1 1.047    H    4 0.937    H    5 0.937    C    2 0.111
     4  H   0.958        N    3 0.937
     5  H   0.958        N    3 0.937

MOs/occ written to file <molden.input>


molecular dipole:
                 x           y           z       tot (Debye)
 q only:       -0.977       0.078      -0.118
   full:       -1.190       0.135      -0.343       3.166
molecular quadrupole (traceless):
                xx          xy          yy          xz          yz          zz
 q only:       -1.096      -0.038       1.245       0.866       0.237      -0.148
  q+dip:       -1.881      -0.031       2.335       1.377       0.496      -0.454
   full:       -1.859      -0.090       2.858       1.822       0.690      -0.999

           -------------------------------------------------
          |                Geometry Summary                 |
           -------------------------------------------------

      molecular mass/u    :       42.0400238
   center of mass at/Å    :        0.5015245      -0.0545232       0.1327705
  moments of inertia/u·Å² :        0.5944612E+01   0.3993307E+02   0.4294166E+02
rotational constants/cm⁻¹ :        0.2835783E+01   0.4221471E+00   0.3925705E+00

 * 3 selected distances

     #   Z        #   Z                                     value/Å
     1   7 N      2   6 C                                 1.2472526 (max)
Molecule has the following symmetry elements: (sigma) 
It seems to be the Cs point group
     3   7 N      4   1 H                                 1.0156524 (min)
     3   7 N      5   1 H                                 1.0156524

 * 2 distinct bonds (by element types)

   Z      Z             #   av. dist./Å        max./Å        min./Å
   1 H    7 N           2     1.0156524     1.0156524     1.0156524
   6 C    7 N           1     1.2472526     1.2472526     1.2472526

           -------------------------------------------------
          |               Frequency Printout                |
           -------------------------------------------------
 projected vibrational frequencies (cm-1)
eigval :       -0.00    -0.00    -0.00     0.00     0.00     0.00
eigval :      -71.41   547.05   659.74   904.80   964.77  1409.91
eigval :     1604.31  3287.29  3353.65
 reduced masses (amu)
   1: 11.42   2: 12.43   3: 12.84   4: 12.31   5: 11.86   6:  9.80   7:  4.63   8:  8.89
   9:  7.45  10: 12.99  11:  2.93  12:  2.20  13: 12.74  14:  1.39  15:  2.21
 IR intensities (amu)
   1:  0.14   2:  0.14   3:  0.14   4:  0.19   5:  0.27   6:  0.18   7:  0.04   8:  0.25
   9:  1.08  10:  1.14  11:  0.02  12:  0.18  13:  1.13  14:  0.10  15:  0.04
 Raman intensities (amu)
   1:  0.00   2:  0.00   3:  0.00   4:  0.00   5:  0.00   6:  0.00   7:  0.00   8:  0.00
   9:  0.00  10:  0.00  11:  0.00  12:  0.00  13:  0.00  14:  0.00  15:  0.00
 output can be read by thermo (or use thermo option).
 writing <g98.out> molden fake output.
 recommended (thermochemical) frequency scaling factor: 1.0
           -------------------------------------------------
          |             Thermodynamic Functions             |
           -------------------------------------------------

cs  symmetry found (for desy threshold:  0.10E+00) used in thermo

          ...................................................
          :                      SETUP                      :
          :.................................................:
          :  # frequencies                           8      :
          :  # imaginary freq.                       1      :
          :  linear?                             false      :
          :  only rotor calc.                    false      :
          :  symmetry                               cs      :
          :  rotational number                       1      :
          :  scaling factor                  1.0000000      :
          :  rotor cutoff                   50.0000000 cm⁻¹ :
          :  imag. cutoff                  -20.0000000 cm⁻¹ :
          :.................................................:

    mode    ω/cm⁻¹     T·S(HO)/kcal·mol⁻¹    T·S(FR)/kcal·mol⁻¹   T·S(vib)
   ------------------------------------------------------------------------
   ------------------------------------------------------------------------

   temp. (K)  partition function   enthalpy   heat capacity  entropy
                                   cal/mol     cal/K/mol   cal/K/mol   J/K/mol
 298.15  VIB   1.15                  267.970      3.120      1.178
         ROT  0.771E+04              888.752      2.981     20.768
         INT  0.887E+04             1156.722      6.100     21.946
         TR   0.264E+27             1481.254      4.968     37.118
         TOT                        2637.9763    11.0686    59.0638   247.1230

   temp. (K)  partition function   enthalpy   heat capacity  entropy
                                   cal/mol     cal/K/mol   cal/K/mol   J/K/mol
 120.00  VIB   1.00                    2.989      0.174      0.029
         ROT  0.197E+04              357.707      2.981     18.055
         INT  0.197E+04              360.696      3.155     18.084
         TR   0.673E+26              596.178      4.968     32.599
         TOT                         956.8740     8.1233    50.6826   212.0558

   temp. (K)  partition function   enthalpy   heat capacity  entropy
                                   cal/mol     cal/K/mol   cal/K/mol   J/K/mol
 100.00  VIB   1.00                    0.748      0.062      0.008
         ROT  0.150E+04              298.089      2.981     17.512
         INT  0.150E+04              298.837      3.043     17.520
         TR   0.512E+26              496.815      4.968     31.693
         TOT                         795.6520     8.0107    49.2136   205.9096

   temp. (K)  partition function   enthalpy   heat capacity  entropy
                                   cal/mol     cal/K/mol   cal/K/mol   J/K/mol
  80.00  VIB   1.00                    0.097      0.012      0.001
         ROT  0.107E+04              238.471      2.981     16.847
         INT  0.107E+04              238.568      2.993     16.848
         TR   0.367E+26              397.452      4.968     30.585
         TOT                         636.0202     7.9613    47.4333   198.4607

   temp. (K)  partition function   enthalpy   heat capacity  entropy
                                   cal/mol     cal/K/mol   cal/K/mol   J/K/mol
  60.00  VIB   1.00                    0.003      0.001     -0.000
         ROT   696.                  178.853      2.981     15.989
         INT   696.                  178.857      2.982     15.989
         TR   0.238E+26              298.089      4.968     29.157
         TOT                         476.9458     7.9498    45.1458   188.8902

   temp. (K)  partition function   enthalpy   heat capacity  entropy
                                   cal/mol     cal/K/mol   cal/K/mol   J/K/mol
  40.00  VIB   1.00                    0.000      0.000     -0.000
         ROT   379.                  119.236      2.981     14.780
         INT   379.                  119.236      2.981     14.780
         TR   0.130E+26              198.726      4.968     27.143
         TOT                         317.9616     7.9490    41.9237   175.4086

   temp. (K)  partition function   enthalpy   heat capacity  entropy
                                   cal/mol     cal/K/mol   cal/K/mol   J/K/mol
  20.00  VIB   1.00                    0.000      0.000     -0.000
         ROT   134.                   59.618      2.981     12.714
         INT   134.                   59.618      2.981     12.714
         TR   0.458E+25               99.363      4.968     23.701
         TOT                         158.9808     7.9490    36.4154   152.3621

   temp. (K)  partition function   enthalpy   heat capacity  entropy
                                   cal/mol     cal/K/mol   cal/K/mol   J/K/mol
  10.00  VIB   1.00                    0.000      0.000     -0.000
         ROT   47.4                   29.809      2.981     10.648
         INT   47.4                   29.809      2.981     10.648
         TR   0.162E+25               49.681      4.968     20.259
         TOT                          79.4904     7.9490    30.9071   129.3155

       T/K    H(0)-H(T)+PV         H(T)/Eh          T*S/Eh         G(T)/Eh
   ------------------------------------------------------------------------
    298.15    0.420388E-02    0.332084E-01    0.280631E-01    0.514530E-02
    120.00    0.152488E-02    0.305294E-01    0.969214E-02    0.208373E-01
    100.00    0.126795E-02    0.302725E-01    0.784268E-02    0.224298E-01
     80.00    0.101356E-02    0.300181E-01    0.604718E-02    0.239709E-01
     60.00    0.760062E-03    0.297646E-01    0.431667E-02    0.254479E-01
     40.00    0.506704E-03    0.295112E-01    0.267238E-02    0.268389E-01
     20.00    0.253352E-03    0.292579E-01    0.116063E-02    0.280973E-01
     10.00    0.126676E-03    0.291312E-01    0.492537E-03    0.286387E-01 (used)
   ------------------------------------------------------------------------

         :::::::::::::::::::::::::::::::::::::::::::::::::::::
         ::                  THERMODYNAMIC                  ::
         :::::::::::::::::::::::::::::::::::::::::::::::::::::
         :: total free energy          -8.714498649597 Eh   ::
         ::.................................................::
         :: total energy               -8.743137332009 Eh   ::
         :: zero point energy           0.029004543170 Eh   ::
         :: G(RRHO) w/o ZPVE           -0.000365860757 Eh   ::
         :: G(RRHO) contrib.            0.028638682413 Eh   ::
         :::::::::::::::::::::::::::::::::::::::::::::::::::::
imag cut-off (cm-1) :    5.00
 found            1  significant imaginary frequency
 writing imag mode distorted coords to xtbhess.xyz
 for further optimization.

optimized geometry written to: xtbopt.xyz


           -------------------------------------------------
          | TOTAL ENERGY               -8.743137332009 Eh   |
          | TOTAL ENTHALPY             -8.714006112824 Eh   |
          | TOTAL FREE ENERGY          -8.714498649597 Eh   |
          | GRADIENT NORM               0.000817575043 Eh/α |
          | HOMO-LUMO GAP               1.409930411776 eV   |
           -------------------------------------------------

------------------------------------------------------------------------
 * finished run on 2020/05/12 at 11:45:21.866     
------------------------------------------------------------------------
 total:
 * wall-time:     0 d,  0 h,  0 min,  0.110 sec
 *  cpu-time:     0 d,  0 h,  0 min,  0.109 sec
 * ratio c/w:     0.983 speedup
 SCF:
 * wall-time:     0 d,  0 h,  0 min,  0.004 sec
 *  cpu-time:     0 d,  0 h,  0 min,  0.004 sec
 * ratio c/w:     0.998 speedup
 ANC optimizer:
 * wall-time:     0 d,  0 h,  0 min,  0.025 sec
 *  cpu-time:     0 d,  0 h,  0 min,  0.025 sec
 * ratio c/w:     0.999 speedup
 numerical hessian:
 * wall-time:     0 d,  0 h,  0 min,  0.062 sec
 *  cpu-time:     0 d,  0 h,  0 min,  0.062 sec
 * ratio c/w:     0.987 speedup

