      -----------------------------------------------------------      
     |                   =====================                   |     
     |                           x T B                           |     
     |                   =====================                   |     
     |                         S. Grimme                         |     
     |          Mulliken Center for Theoretical Chemistry        |     
     |                    University of Bonn                     |     
      -----------------------------------------------------------      

   * xtb version 6.2.2 (9d81278992624c895f80dd42a50cac0aa55982e2) compiled by '@Darwin' on 04/03/2020

   xtb is free software: you can redistribute it and/or modify it under
   the terms of the GNU Lesser General Public License as published by
   the Free Software Foundation, either version 3 of the License, or
   (at your option) any later version.
   
   xtb is distributed in the hope that it will be useful,
   but WITHOUT ANY WARRANTY; without even the implied warranty of
   MERCHANTABILITY or FITNESS FOR A PARTICULAR PURPOSE.  See the
   GNU Lesser General Public License for more details.
   
   Cite this work as:
   * S. Grimme, C. Bannwarth, P. Shushkov, J. Chem. Theory Comput., 2017,
     13, 1989-2009. DOI: 10.1021/acs.jctc.7b00118
   * C. Bannwarth, S. Ehlert and S. Grimme., J. Chem. Theory Comput., 2019,
     15, 1652-1671. DOI: 10.1021/acs.jctc.8b01176
   * P. Pracht, E. Caldeweyher, S. Ehlert, S. Grimme, ChemRxiv, 2019, preprint.
     DOI: 10.26434/chemrxiv.8326202.v1
   
   for DFT-D4:
   * E. Caldeweyher, C. Bannwarth and S. Grimme, J. Chem. Phys., 2017,
     147, 034112. DOI: 10.1063/1.4993215
   * E. Caldeweyher, S. Ehlert, A. Hansen, H. Neugebauer, S. Spicher,
     C. Bannwarth and S. Grimme, J. Chem. Phys., 2019, 150, 154122.
     DOI: 10.1063/1.5090222
   
   for sTDA-xTB:
   * S. Grimme and C. Bannwarth, J. Chem. Phys., 2016, 145, 054103.
     DOI: 10.1063/1.4959605
   
   in the mass-spec context:
   * V. Asgeirsson, C. Bauer and S. Grimme, Chem. Sci., 2017, 8, 4879.
     DOI: 10.1039/c7sc00601b
   
   for metadynamics refer to:
   * S. Grimme, J. Chem. Theory Comput., 2019, 155, 2847-2862
     DOI: 10.1021/acs.jctc.9b00143
   
   with help from (in alphabetical order)
   C. Bannwarth, F. Bohle, G. Brandenburg, E. Caldeweyher, M. Checinski,
   S. Dohm, S. Ehlert, S. Ehrlich, F. März, H. Neugebauer, J. Pisarek,
   P. Pracht, P. Shushkov, and S. Spicher.
   
 * started run on 2020/05/12 at 11:44:58.540     

           -------------------------------------------------
          |                Calculation Setup                |
           -------------------------------------------------

          program call               : xtb --input H1C3N1_21_S_0.input H1C3N1_21_S_0.xyz --ohess --molden --namespace H1C3N1_21_S_0 output.out
          calculation namespace      : H1C3N1_21_S_0
          coordinate file            : H1C3N1_21_S_0.xyz
          number of atoms            :                     5
          number of electrons        :                    18
          charge                     :                     0
          spin                       :                   0.0
          first test random number   :      0.78677221810490

   ID    Z sym.   atoms
    1    7 N      1
    2    6 C      2-4
    3    1 H      5

           -------------------------------------------------
          |                 G F N 2 - x T B                 |
           -------------------------------------------------

        Reference                      10.1021/acs.jctc.8b01176
      * Hamiltonian:
        H0-scaling (s, p, d)           1.850000    2.230000    2.230000
        zeta-weighting                 0.500000
      * Dispersion:
        s8                             2.700000
        a1                             0.520000
        a2                             5.000000
        s9                             5.000000
      * Repulsion:
        kExp                           1.500000    1.000000
        rExp                           1.000000
      * Coulomb:
        alpha                          2.000000
        third order                    shell-resolved
        anisotropic                    true
        a3                             3.000000
        a5                             4.000000
        cn-shift                       1.200000
        cn-exp                         4.000000
        max-rad                        5.000000


          ...................................................
          :                      SETUP                      :
          :.................................................:
          :  # basis functions                  17          :
          :  # atomic orbitals                  17          :
          :  # shells                            9          :
          :  # electrons                        18          :
          :  max. iterations                   250          :
          :  Hamiltonian                  GFN2-xTB          :
          :  restarted?                      false          :
          :  GBSA solvation                  false          :
          :  PC potential                    false          :
          :  electronic temp.          300.0000000     K    :
          :  accuracy                    1.0000000          :
          :  -> integral cutoff          0.2500000E+02      :
          :  -> integral neglect         0.1000000E-07      :
          :  -> SCF convergence          0.1000000E-05 Eh   :
          :  -> wf. convergence          0.1000000E-03 e    :
          :  Broyden damping             0.4000000          :
          ...................................................

 iter      E             dE          RMSdq      gap      omega  full diag
   1     -8.7663190 -0.876632E+01  0.126E+01    1.48       0.0  T
   2     -7.4768653  0.128945E+01  0.179E+01    0.32       1.0  T
   3     -8.7206535 -0.124379E+01  0.105E+01    0.09       1.0  T
   4     -9.2139111 -0.493258E+00  0.714E+00    0.47       1.0  T
   5     -9.2344398 -0.205287E-01  0.713E+00    0.13       1.0  T
   6     -9.3081594 -0.737196E-01  0.638E+00    0.16       1.0  T
   7     -9.4338751 -0.125716E+00  0.340E+00    0.19       1.0  T
   8     -8.9303687  0.503506E+00  0.106E+01    0.97       1.0  T
   9     -9.2696392 -0.339270E+00  0.637E+00    0.34       1.0  T
  10     -9.2780062 -0.836696E-02  0.622E+00    0.33       1.0  T
  11     -9.3079706 -0.299644E-01  0.557E+00    0.30       1.0  T
  12     -9.4059561 -0.979855E-01  0.322E+00    0.19       1.0  T
  13     -9.4526004 -0.466443E-01  0.963E-01    0.20       1.0  T
  14     -9.3809385  0.716619E-01  0.401E+00    0.25       1.0  T
  15     -9.4581545 -0.772160E-01  0.553E-01    0.20       1.0  T
  16     -9.4556860  0.246848E-02  0.852E-01    0.19       1.0  T
  17     -9.4566938 -0.100780E-02  0.676E-01    0.19       1.0  T
  18     -9.4510613  0.563250E-02  0.125E+00    0.18       1.0  T
  19     -9.4582170 -0.715568E-02  0.111E-01    0.17       1.0  T
  20     -9.4568908  0.132620E-02  0.549E-01    0.17       1.0  T
  21     -9.4582696 -0.137878E-02  0.704E-02    0.17       1.0  T
  22     -9.4581896  0.800051E-04  0.148E-01    0.17       1.0  T
  23     -9.4582837 -0.940900E-04  0.234E-02    0.17       1.9  T
  24     -9.4582844 -0.775321E-06  0.150E-02    0.17       3.0  T
  25     -9.4582814  0.301097E-05  0.267E-02    0.17       1.7  T
  26     -9.4582846 -0.322600E-05  0.568E-03    0.17       7.9  T
  27     -9.4582848 -0.105387E-06  0.325E-03    0.17      13.8  T
  28     -9.4582848 -0.334691E-07  0.221E-03    0.17      20.2  T
  29     -9.4582848 -0.217564E-07  0.101E-03    0.17      44.3  T
  30     -9.4582848 -0.251707E-08  0.762E-04    0.17      58.7  T
  31     -9.4582848 -0.302315E-08  0.318E-05    0.17    1408.1  T

   *** convergence criteria satisfied after 31 iterations ***

         #    Occupation            Energy/Eh            Energy/eV
      -------------------------------------------------------------
         1        2.0000           -0.7274286             -19.7943
       ...           ...                  ...                  ...
         3        2.0000           -0.6117352             -16.6462
         4        2.0000           -0.6009752             -16.3534
         5        2.0000           -0.5391845             -14.6720
         6        2.0000           -0.5026641             -13.6782
         7        2.0000           -0.4949045             -13.4670
         8        1.9997           -0.4458858             -12.1332
         9        1.9279           -0.4406930             -11.9919 (HOMO)
        10        0.0724           -0.4344540             -11.8221 (LUMO)
        11                         -0.4190216             -11.4022
        12                         -0.3305027              -8.9934
        13                         -0.1270576              -3.4574
        14                         -0.0014702              -0.0400
       ...                                ...                  ...
        17                          0.1906801               5.1887
      -------------------------------------------------------------
                  HL-Gap            0.0062390 Eh            0.1698 eV
             Fermi-level           -0.4375713 Eh          -11.9069 eV

 SCC (total)                   0 d,  0 h,  0 min,  0.005 sec
 SCC setup                      ...        0 min,  0.000 sec (  1.637%)
 Dispersion                     ...        0 min,  0.000 sec (  0.328%)
 integral evaluation            ...        0 min,  0.001 sec ( 19.684%)
 zeroth order Hamiltonian       ...        0 min,  0.000 sec (  0.343%)
 iterations                     ...        0 min,  0.003 sec ( 56.074%)
 molecular gradient             ...        0 min,  0.001 sec ( 20.143%)
 printout                       ...        0 min,  0.000 sec (  1.579%)

         :::::::::::::::::::::::::::::::::::::::::::::::::::::
         ::                     SUMMARY                     ::
         :::::::::::::::::::::::::::::::::::::::::::::::::::::
         :: total energy              -9.387832353102 Eh    ::
         :: gradient norm              0.214755704874 Eh/a0 ::
         :: HOMO-LUMO gap              0.169772575048 eV    ::
         ::.................................................::
         :: SCC energy                -9.458284811238 Eh    ::
         :: -> isotropic ES           -0.008084888279 Eh    ::
         :: -> anisotropic ES          0.000383564344 Eh    ::
         :: -> anisotropic XC          0.014434015945 Eh    ::
         :: -> dispersion             -0.002049408352 Eh    ::
         :: repulsion energy           0.070452387574 Eh    ::
         :: add. restraining           0.000000000000 Eh    ::
         :::::::::::::::::::::::::::::::::::::::::::::::::::::

      ----------------------------------------------------------- 
     |                   =====================                   |
     |                        A N C O P T                        |
     |                   =====================                   |
     |               Approximate Normal Coordinate               |
     |                Rational Function Optimizer                |
      ----------------------------------------------------------- 

          ...................................................
          :                      SETUP                      :
          :.................................................:
          :   optimization level            normal          :
          :   max. optcycles                   200          :
          :   ANC micro-cycles                  20          :
          :   degrees of freedom                 9          :
          :.................................................:
          :   RF solver                   davidson          :
          :   write xtbopt.log                true          :
          :   linear?                        false          :
          :   energy convergence         0.5000000E-05 Eh   :
          :   grad. convergence          0.1000000E-02 Eh/α :
          :   maximium RF displ.         1.0000000          :
          :   Hlow (freq-cutoff)         0.1000000E-01      :
          :   Hmax (freq-cutoff)         5.0000000          :
          :   S6 in model hess.         20.0000000          :
          ...................................................

generating ANC from model Hessian ...
Using Lindh-Hessian (1995)
 Shifting diagonal of input Hessian by    0.0000000000000000     
 Lowest  eigenvalues of input Hessian
   -0.000000   -0.000000   -0.000000    0.000000    0.000000    0.000000
    0.061308    0.070164    0.119781    0.136490    0.389862    0.720920
    0.819223    1.233665    1.448444
 Highest eigenvalues
    0.136490    0.389862    0.720920    0.819223    1.233665    1.448444


........................................................................
.............................. CYCLE    1 ..............................
........................................................................
   1     -9.4582848 -0.945828E+01  0.920E-06    0.17       0.0  T
   2     -9.4582848  0.312639E-10  0.730E-05    0.17     612.7  T
   3     -9.4582848 -0.124079E-10  0.587E-05    0.17     762.0  T
     SCC iter.                  ...        0 min,  0.000 sec
     gradient                   ...        0 min,  0.001 sec
 * total energy  :    -9.3878324 Eh     change        0.1009202E-09 Eh
   gradient norm :     0.2147561 Eh/α   predicted     0.0000000E+00 (-100.00%)
   displ. norm   :     0.3885072 α      lambda       -0.6304481E-01
   maximum displ.:     0.2453878 α      in ANC's #4, #3, #7, ...

........................................................................
.............................. CYCLE    2 ..............................
........................................................................
   1     -9.5219792 -0.952198E+01  0.325E+00    0.50       0.0  T
   2     -9.0757768  0.446202E+00  0.892E+00    0.12       1.0  T
   3     -9.5427106 -0.466934E+00  0.145E+00    0.29       1.0  T
   4     -9.5138729  0.288377E-01  0.215E+00    0.53       1.0  T
   5     -9.5430142 -0.291413E-01  0.742E-01    0.31       1.0  T
   6     -9.5431438 -0.129662E-03  0.649E-01    0.31       1.0  T
   7     -9.5431396  0.421124E-05  0.499E-01    0.31       1.0  T
   8     -9.5431565 -0.168881E-04  0.390E-01    0.31       1.0  T
   9     -9.5431762 -0.196505E-04  0.313E-01    0.30       1.0  T
  10     -9.5431807 -0.450788E-05  0.275E-01    0.30       1.0  T
  11     -9.5431942 -0.134876E-04  0.106E-01    0.30       1.0  T
  12     -9.5431966 -0.241880E-05  0.189E-02    0.30       2.4  T
  13     -9.5431966 -0.539533E-07  0.134E-02    0.30       3.3  T
  14     -9.5431967 -0.260990E-07  0.587E-03    0.30       7.6  T
  15     -9.5431967 -0.596836E-08  0.181E-04    0.30     247.7  T
  16     -9.5431967 -0.402878E-11  0.142E-04    0.30     315.9  T
     SCC iter.                  ...        0 min,  0.001 sec
     gradient                   ...        0 min,  0.001 sec
 * total energy  :    -9.4456061 Eh     change       -0.5777372E-01 Eh
   gradient norm :     0.1541599 Eh/α   predicted    -0.3628031E-01 ( -37.20%)
   displ. norm   :     0.7156020 α      lambda       -0.8774509E-01
   maximum displ.:     0.4742367 α      in ANC's #3, #4, #7, ...

........................................................................
.............................. CYCLE    3 ..............................
........................................................................
   1     -9.6524610 -0.965246E+01  0.392E+00    1.75       0.0  T
   2     -9.6564534 -0.399246E-02  0.288E+00    0.85       1.0  T
   3     -9.6635947 -0.714130E-02  0.160E+00    1.43       1.0  T
   4     -9.6682707 -0.467593E-02  0.290E-01    1.20       1.0  T
   5     -9.6684838 -0.213165E-03  0.114E-01    1.16       1.0  T
   6     -9.6684915 -0.764575E-05  0.219E-02    1.17       2.0  T
   7     -9.6684916 -0.151347E-06  0.736E-03    1.17       6.1  T
   8     -9.6684916 -0.101634E-07  0.290E-03    1.17      15.4  T
   9     -9.6684917 -0.224071E-07  0.162E-03    1.17      27.6  T
  10     -9.6684917 -0.584876E-08  0.184E-04    1.17     242.6  T
  11     -9.6684917 -0.513012E-11  0.612E-05    1.17     730.5  T
     SCC iter.                  ...        0 min,  0.001 sec
     gradient                   ...        0 min,  0.001 sec
 * total energy  :    -9.4834808 Eh     change       -0.3787474E-01 Eh
   gradient norm :     0.2096461 Eh/α   predicted    -0.6633907E-01 (  75.15%)
   displ. norm   :     0.4063560 α      lambda       -0.4306685E-01
   maximum displ.:     0.3865326 α      in ANC's #3, #4, #8, ...

........................................................................
.............................. CYCLE    4 ..............................
........................................................................
   1     -9.6200754 -0.962008E+01  0.282E+00    0.23       0.0  T
   2     -9.6204904 -0.414966E-03  0.151E+00    0.34       1.0  T
   3     -9.6164967  0.399361E-02  0.112E+00    0.17       1.0  T
   4     -9.6213391 -0.484239E-02  0.192E-01    0.33       1.0  T
   5     -9.6214965 -0.157406E-03  0.812E-02    0.29       1.0  T
   6     -9.6214980 -0.151369E-05  0.503E-02    0.29       1.0  T
   7     -9.6215006 -0.255919E-05  0.104E-02    0.28       4.3  T
   8     -9.6215010 -0.360002E-06  0.566E-03    0.28       7.9  T
   9     -9.6215010 -0.773604E-07  0.653E-04    0.28      68.5  T
  10     -9.6215010 -0.257664E-09  0.200E-04    0.28     223.1  T
     SCC iter.                  ...        0 min,  0.001 sec
     gradient                   ...        0 min,  0.001 sec
 * total energy  :    -9.5003366 Eh     change       -0.1685575E-01 Eh
   gradient norm :     0.1013903 Eh/α   predicted    -0.2508915E-01 (  48.85%)
   displ. norm   :     0.1451588 α      lambda       -0.1168507E-01
   maximum displ.:     0.0963444 α      in ANC's #7, #5, #4, ...

........................................................................
.............................. CYCLE    5 ..............................
........................................................................
   1     -9.6179857 -0.961799E+01  0.941E-01    0.55       0.0  T
   2     -9.6180251 -0.393528E-04  0.546E-01    0.58       1.0  T
   3     -9.6179583  0.668149E-04  0.167E-01    0.55       1.0  T
   4     -9.6180487 -0.903881E-04  0.483E-02    0.57       1.0  T
   5     -9.6180423  0.640955E-05  0.427E-02    0.58       1.0  T
   6     -9.6180510 -0.876599E-05  0.126E-02    0.58       3.6  T
   7     -9.6180515 -0.489137E-06  0.711E-03    0.58       6.3  T
   8     -9.6180516 -0.711644E-07  0.110E-03    0.58      40.8  T
   9     -9.6180516 -0.160687E-08  0.397E-04    0.58     112.5  T
  10     -9.6180516 -0.995275E-10  0.790E-05    0.58     565.9  T
     SCC iter.                  ...        0 min,  0.001 sec
     gradient                   ...        0 min,  0.001 sec
 * total energy  :    -9.5047108 Eh     change       -0.4374253E-02 Eh
   gradient norm :     0.0367202 Eh/α   predicted    -0.5965644E-02 (  36.38%)
   displ. norm   :     0.0854364 α      lambda       -0.1608727E-02
   maximum displ.:     0.0565758 α      in ANC's #4, #3, #7, ...

........................................................................
.............................. CYCLE    6 ..............................
........................................................................
   1     -9.6242340 -0.962423E+01  0.553E-01    0.52       0.0  T
   2     -9.6243636 -0.129655E-03  0.355E-01    0.44       1.0  T
   3     -9.6244154 -0.517301E-04  0.206E-01    0.48       1.0  T
   4     -9.6244598 -0.444245E-04  0.732E-02    0.47       1.0  T
   5     -9.6244868 -0.269667E-04  0.267E-02    0.46       1.7  T
   6     -9.6244872 -0.417880E-06  0.166E-02    0.46       2.7  T
   7     -9.6244881 -0.886668E-06  0.369E-03    0.46      12.1  T
   8     -9.6244881 -0.952082E-08  0.656E-04    0.46      68.2  T
   9     -9.6244881 -0.488551E-10  0.263E-04    0.46     169.9  T
     SCC iter.                  ...        0 min,  0.001 sec
     gradient                   ...        0 min,  0.001 sec
 * total energy  :    -9.5055240 Eh     change       -0.8131836E-03 Eh
   gradient norm :     0.0165048 Eh/α   predicted    -0.8102348E-03 (  -0.36%)
   displ. norm   :     0.1360591 α      lambda       -0.1339420E-02
   maximum displ.:     0.1207241 α      in ANC's #1, #2, #4, ...

........................................................................
.............................. CYCLE    7 ..............................
........................................................................
   1     -9.6273766 -0.962738E+01  0.260E+00    0.65       0.0  T
   2     -9.6196254  0.775121E-02  0.166E+00    1.05       1.0  T
   3     -9.6263555 -0.673009E-02  0.158E+00    0.66       1.0  T
   4     -9.6347076 -0.835212E-02  0.389E-01    0.73       1.0  T
   5     -9.6354120 -0.704436E-03  0.158E-01    0.77       1.0  T
   6     -9.6354451 -0.331049E-04  0.664E-02    0.75       1.0  T
   7     -9.6354469 -0.176100E-05  0.249E-02    0.75       1.8  T
   8     -9.6354484 -0.151148E-05  0.870E-03    0.76       5.1  T
   9     -9.6354485 -0.152125E-06  0.177E-03    0.76      25.2  T
  10     -9.6354485 -0.662195E-08  0.701E-04    0.76      63.8  T
  11     -9.6354485 -0.128058E-08  0.128E-04    0.76     349.2  T
     SCC iter.                  ...        0 min,  0.001 sec
     gradient                   ...        0 min,  0.001 sec
 * total energy  :    -9.5110094 Eh     change       -0.5485395E-02 Eh
   gradient norm :     0.0845095 Eh/α   predicted    -0.6821054E-03 ( -87.57%)
   displ. norm   :     0.6555938 α      lambda       -0.4322764E-01
   maximum displ.:     0.5759571 α      in ANC's #1, #2, #3, ...

........................................................................
.............................. CYCLE    8 ..............................
........................................................................
   1     -9.6362749 -0.963627E+01  0.584E+00    2.67       0.0  T
   2     -9.6051537  0.311212E-01  0.393E+00    3.01       1.0  T
   3     -9.6551415 -0.499878E-01  0.302E+00    2.61       1.0  T
   4     -9.6823878 -0.272464E-01  0.796E-01    2.73       1.0  T
   5     -9.6862333 -0.384544E-02  0.224E-01    2.72       1.0  T
   6     -9.6863513 -0.118083E-03  0.110E-01    2.71       1.0  T
   7     -9.6863622 -0.108450E-04  0.326E-02    2.71       1.4  T
   8     -9.6863661 -0.392297E-05  0.932E-03    2.71       4.8  T
   9     -9.6863662 -0.825430E-07  0.150E-03    2.71      29.9  T
  10     -9.6863662 -0.196911E-08  0.470E-04    2.71      95.1  T
  11     -9.6863662 -0.434035E-09  0.136E-04    2.71     328.7  T
     SCC iter.                  ...        0 min,  0.001 sec
     gradient                   ...        0 min,  0.001 sec
 * total energy  :    -9.5639026 Eh     change       -0.5289317E-01 Eh
   gradient norm :     0.1088266 Eh/α   predicted    -0.3090353E-01 ( -41.57%)
   displ. norm   :     0.7329710 α      lambda       -0.4782440E-01
   maximum displ.:     0.6699557 α      in ANC's #1, #2, #6, ...

........................................................................
.............................. CYCLE    9 ..............................
........................................................................
   1     -9.6931270 -0.969313E+01  0.625E+00    2.30       0.0  T
   2     -9.6882477  0.487928E-02  0.362E+00    2.28       1.0  T
   3     -9.6392696  0.489782E-01  0.361E+00    2.16       1.0  T
   4     -9.7055429 -0.662734E-01  0.766E-01    2.19       1.0  T
   5     -9.7091902 -0.364727E-02  0.192E-01    2.22       1.0  T
   6     -9.7092558 -0.656057E-04  0.754E-02    2.22       1.0  T
   7     -9.7092611 -0.524337E-05  0.166E-02    2.22       2.7  T
   8     -9.7092615 -0.457774E-06  0.632E-03    2.22       7.1  T
   9     -9.7092615 -0.193638E-07  0.122E-03    2.22      36.8  T
  10     -9.7092615 -0.422339E-09  0.488E-04    2.22      91.6  T
  11     -9.7092615 -0.348091E-09  0.116E-04    2.22     384.9  T
     SCC iter.                  ...        0 min,  0.001 sec
     gradient                   ...        0 min,  0.001 sec
 * total energy  :    -9.5583739 Eh     change        0.5528627E-02 Eh
   gradient norm :     0.2104424 Eh/α   predicted    -0.3675896E-01 (-764.88%)
   displ. norm   :     0.3567978 α      lambda       -0.6664640E-01
   maximum displ.:     0.2413699 α      in ANC's #3, #2, #6, ...

........................................................................
.............................. CYCLE   10 ..............................
........................................................................
   1     -9.6556141 -0.965561E+01  0.350E+00    1.80       0.0  T
   2     -9.6410989  0.145152E-01  0.298E+00    1.72       1.0  T
   3     -9.6661555 -0.250565E-01  0.151E+00    1.82       1.0  T
   4     -9.6698679 -0.371248E-02  0.973E-01    1.81       1.0  T
   5     -9.6747376 -0.486968E-02  0.337E-01    1.82       1.0  T
   6     -9.6752051 -0.467500E-03  0.152E-01    1.83       1.0  T
   7     -9.6752299 -0.247700E-04  0.345E-02    1.83       1.3  T
   8     -9.6752316 -0.175704E-05  0.179E-02    1.83       2.5  T
   9     -9.6752320 -0.362025E-06  0.260E-03    1.83      17.2  T
  10     -9.6752320 -0.323708E-08  0.704E-04    1.83      63.6  T
  11     -9.6752320 -0.536863E-09  0.243E-04    1.83     183.7  T
     SCC iter.                  ...        0 min,  0.001 sec
     gradient                   ...        0 min,  0.001 sec
 * total energy  :    -9.5629612 Eh     change       -0.4587234E-02 Eh
   gradient norm :     0.1243799 Eh/α   predicted    -0.3756540E-01 ( 718.91%)
   displ. norm   :     0.4843406 α      lambda       -0.3841909E-01
   maximum displ.:     0.4431833 α      in ANC's #1, #3, #4, ...

........................................................................
.............................. CYCLE   11 ..............................
........................................................................
   1     -9.6990303 -0.969903E+01  0.271E+00    3.00       0.0  T
   2     -9.6980492  0.981043E-03  0.161E+00    2.98       1.0  T
   3     -9.6898532  0.819602E-02  0.151E+00    3.07       1.0  T
   4     -9.7014753 -0.116221E-01  0.202E-01    3.02       1.0  T
   5     -9.7016243 -0.148978E-03  0.897E-02    3.04       1.0  T
   6     -9.7016466 -0.222911E-04  0.586E-02    3.03       1.0  T
   7     -9.7016584 -0.118855E-04  0.913E-03    3.03       4.9  T
   8     -9.7016585 -0.184239E-07  0.448E-03    3.03      10.0  T
   9     -9.7016585 -0.389420E-07  0.809E-04    3.03      55.3  T
  10     -9.7016585 -0.441092E-09  0.140E-04    3.03     319.8  T
     SCC iter.                  ...        0 min,  0.001 sec
     gradient                   ...        0 min,  0.001 sec
 * total energy  :    -9.5822854 Eh     change       -0.1932428E-01 Eh
   gradient norm :     0.0432252 Eh/α   predicted    -0.2371584E-01 (  22.73%)
   displ. norm   :     0.0987219 α      lambda       -0.3518982E-02
   maximum displ.:     0.0689349 α      in ANC's #1, #5, #3, ...

........................................................................
.............................. CYCLE   12 ..............................
........................................................................
   1     -9.7110526 -0.971105E+01  0.107E+00    3.19       0.0  T
   2     -9.7108570  0.195600E-03  0.611E-01    3.13       1.0  T
   3     -9.7101362  0.720801E-03  0.548E-01    3.18       1.0  T
   4     -9.7117077 -0.157146E-02  0.471E-02    3.15       1.0  T
   5     -9.7117116 -0.387400E-05  0.341E-02    3.15       1.3  T
   6     -9.7117156 -0.405916E-05  0.131E-02    3.15       3.4  T
   7     -9.7117160 -0.347411E-06  0.296E-03    3.15      15.1  T
   8     -9.7117160 -0.796213E-08  0.123E-03    3.15      36.3  T
   9     -9.7117160 -0.106796E-08  0.206E-04    3.15     217.3  T
  10     -9.7117160 -0.418883E-10  0.333E-05    3.15    1343.8  T
     SCC iter.                  ...        0 min,  0.001 sec
     gradient                   ...        0 min,  0.001 sec
 * total energy  :    -9.5843387 Eh     change       -0.2053246E-02 Eh
   gradient norm :     0.0147355 Eh/α   predicted    -0.1776640E-02 ( -13.47%)
   displ. norm   :     0.0766250 α      lambda       -0.6709853E-03
   maximum displ.:     0.0723999 α      in ANC's #2, #1, #9, ...

........................................................................
.............................. CYCLE   13 ..............................
........................................................................
   1     -9.7124318 -0.971243E+01  0.411E-01    3.10       0.0  T
   2     -9.7123724  0.593853E-04  0.275E-01    3.10       1.0  T
   3     -9.7124021 -0.296241E-04  0.218E-01    3.09       1.0  T
   4     -9.7125869 -0.184840E-03  0.531E-02    3.10       1.0  T
   5     -9.7125948 -0.786070E-05  0.204E-02    3.10       2.2  T
   6     -9.7125947  0.765637E-07  0.123E-02    3.10       3.6  T
   7     -9.7125955 -0.845960E-06  0.172E-03    3.10      25.9  T
   8     -9.7125955 -0.151427E-08  0.469E-04    3.10      95.4  T
   9     -9.7125955 -0.147507E-09  0.151E-04    3.10     297.0  T
     SCC iter.                  ...        0 min,  0.001 sec
     gradient                   ...        0 min,  0.001 sec
 * total energy  :    -9.5846366 Eh     change       -0.2979483E-03 Eh
   gradient norm :     0.0105608 Eh/α   predicted    -0.3374611E-03 (  13.26%)
   displ. norm   :     0.0248313 α      lambda       -0.2102876E-03
   maximum displ.:     0.0129076 α      in ANC's #5, #7, #1, ...

........................................................................
.............................. CYCLE   14 ..............................
........................................................................
   1     -9.7136860 -0.971369E+01  0.153E-01    3.15       0.0  T
   2     -9.7136802  0.581235E-05  0.104E-01    3.15       1.0  T
   3     -9.7136629  0.173112E-04  0.813E-02    3.15       1.0  T
   4     -9.7136969 -0.340530E-04  0.109E-02    3.15       4.1  T
   5     -9.7136975 -0.582153E-06  0.540E-03    3.15       8.3  T
   6     -9.7136976 -0.697937E-07  0.134E-03    3.15      33.5  T
   7     -9.7136976 -0.397702E-08  0.267E-04    3.15     167.4  T
   8     -9.7136976 -0.217124E-10  0.719E-05    3.15     621.6  T
     SCC iter.                  ...        0 min,  0.001 sec
     gradient                   ...        0 min,  0.001 sec
 * total energy  :    -9.5847781 Eh     change       -0.1414883E-03 Eh
   gradient norm :     0.0060368 Eh/α   predicted    -0.1052098E-03 ( -25.64%)
   displ. norm   :     0.0201794 α      lambda       -0.9627322E-04
   maximum displ.:     0.0121794 α      in ANC's #7, #1, #6, ...

........................................................................
.............................. CYCLE   15 ..............................
........................................................................
   1     -9.7128113 -0.971281E+01  0.106E-01    3.16       0.0  T
   2     -9.7128090  0.233814E-05  0.703E-02    3.16       1.0  T
   3     -9.7128059  0.306862E-05  0.545E-02    3.16       1.0  T
   4     -9.7128195 -0.135477E-04  0.606E-03    3.16       7.4  T
   5     -9.7128195 -0.544277E-07  0.448E-03    3.16      10.0  T
   6     -9.7128196 -0.572954E-07  0.154E-03    3.16      29.1  T
   7     -9.7128196 -0.848378E-08  0.389E-04    3.16     115.0  T
   8     -9.7128196 -0.173438E-09  0.907E-05    3.16     493.0  T
     SCC iter.                  ...        0 min,  0.001 sec
     gradient                   ...        0 min,  0.001 sec
 * total energy  :    -9.5848340 Eh     change       -0.5587474E-04 Eh
   gradient norm :     0.0027666 Eh/α   predicted    -0.4815492E-04 ( -13.82%)
   displ. norm   :     0.0112311 α      lambda       -0.1885484E-04
   maximum displ.:     0.0081663 α      in ANC's #4, #5, #6, ...

........................................................................
.............................. CYCLE   16 ..............................
........................................................................
   1     -9.7128124 -0.971281E+01  0.471E-02    3.17       0.0  T
   2     -9.7128124 -0.670345E-07  0.262E-02    3.17       1.7  T
   3     -9.7128117  0.764267E-06  0.119E-02    3.17       3.8  T
   4     -9.7128125 -0.854177E-06  0.252E-03    3.17      17.7  T
   5     -9.7128125 -0.452000E-08  0.157E-03    3.17      28.5  T
   6     -9.7128125 -0.494751E-08  0.663E-04    3.17      67.5  T
   7     -9.7128125 -0.294095E-08  0.127E-04    3.17     350.8  T
     SCC iter.                  ...        0 min,  0.001 sec
     gradient                   ...        0 min,  0.001 sec
 * total energy  :    -9.5848478 Eh     change       -0.1381862E-04 Eh
   gradient norm :     0.0025223 Eh/α   predicted    -0.9429930E-05 ( -31.76%)
   displ. norm   :     0.0142615 α      lambda       -0.1644049E-04
   maximum displ.:     0.0105799 α      in ANC's #4, #1, #8, ...

........................................................................
.............................. CYCLE   17 ..............................
........................................................................
   1     -9.7128021 -0.971280E+01  0.409E-02    3.17       0.0  T
   2     -9.7128016  0.521958E-06  0.262E-02    3.17       1.7  T
   3     -9.7128007  0.906858E-06  0.240E-02    3.16       1.9  T
   4     -9.7128030 -0.233574E-05  0.360E-03    3.17      12.4  T
   5     -9.7128030 -0.447132E-07  0.160E-03    3.17      28.0  T
   6     -9.7128030  0.899206E-09  0.111E-03    3.17      40.2  T
   7     -9.7128030 -0.603225E-08  0.919E-05    3.17     486.5  T
   8     -9.7128030 -0.726530E-12  0.139E-05    3.17    3219.9  T
     SCC iter.                  ...        0 min,  0.001 sec
     gradient                   ...        0 min,  0.001 sec
 * total energy  :    -9.5848581 Eh     change       -0.1031332E-04 Eh
   gradient norm :     0.0015699 Eh/α   predicted    -0.8222315E-05 ( -20.27%)
   displ. norm   :     0.0083631 α      lambda       -0.3951176E-05
   maximum displ.:     0.0047374 α      in ANC's #4, #2, #1, ...

........................................................................
.............................. CYCLE   18 ..............................
........................................................................
   1     -9.7129934 -0.971299E+01  0.285E-02    3.17       0.0  T
   2     -9.7129930  0.396497E-06  0.203E-02    3.17       2.2  T
   3     -9.7129934 -0.355770E-06  0.151E-02    3.17       3.0  T
   4     -9.7129941 -0.736158E-06  0.331E-03    3.17      13.5  T
   5     -9.7129942 -0.465309E-07  0.132E-03    3.17      33.8  T
   6     -9.7129942 -0.448532E-08  0.821E-04    3.17      54.5  T
   7     -9.7129942 -0.171026E-08  0.117E-04    3.17     380.6  T
     SCC iter.                  ...        0 min,  0.001 sec
     gradient                   ...        0 min,  0.001 sec
 * total energy  :    -9.5848611 Eh     change       -0.2917716E-05 Eh
   gradient norm :     0.0004555 Eh/α   predicted    -0.1975612E-05 ( -32.29%)
   displ. norm   :     0.0031142 α      lambda       -0.6917599E-06
   maximum displ.:     0.0022943 α      in ANC's #4, #3, #5, ...

   *** GEOMETRY OPTIMIZATION CONVERGED AFTER 18 ITERATIONS ***

------------------------------------------------------------------------
 total energy gain   :        -0.1970287 Eh     -123.6374 kcal/mol
 total RMSD          :         0.9017890 a0        0.4772 Å
 total power (kW/mol):       -28.7388216 (step)-9708.9101 (real)
------------------------------------------------------------------------

 ANCopt (total)                0 d,  0 h,  0 min,  0.053 sec
 optimizer setup                ...        0 min,  0.000 sec (  0.152%)
 model hessian                  ...        0 min,  0.000 sec (  0.161%)
 ANC generation                 ...        0 min,  0.000 sec (  0.088%)
 coordinate transformation      ...        0 min,  0.000 sec (  0.075%)
 single point calculation       ...        0 min,  0.052 sec ( 96.881%)
 optimization log               ...        0 min,  0.000 sec (  0.775%)
 hessian update                 ...        0 min,  0.000 sec (  0.071%)
 rational function              ...        0 min,  0.000 sec (  0.796%)

================
 final structure:
================
5
 xtb: 6.2.2 (9d81278992624c895f80dd42a50cac0aa55982e2)
N         0.54967894392840   -0.85054423845559   -0.22430176754977
C         0.27802521856082    0.42773474041751    0.19246165847805
C        -0.90259503826853   -0.13629226317187    0.63604868901546
C        -0.72379778755271   -0.78445334177422   -0.64020137728089
H         0.79868866333201    1.34355410298417    0.03599279733714

 Bond Distances (Angstroems)
 ---------------------------
N1-C2=1.3717         N1-C3=1.8329         N1-C4=1.3413         C2-N1=1.3717         C2-C3=1.3816         C2-C4=1.7794         
C2-H5=1.0650         C3-N1=1.8329         C3-C2=1.3816         C3-C4=1.4425         C4-N1=1.3413         C4-C2=1.7794         
C4-C3=1.4425         H5-C2=1.0650         
 C  H  Rav=1.0650 sigma=0.0000  Rmin=1.0650  Rmax=1.0650     1
 C  C  Rav=1.5345 sigma=0.1750  Rmin=1.3816  Rmax=1.7794     3
 N  C  Rav=1.5153 sigma=0.2249  Rmin=1.3413  Rmax=1.8329     3

 selected bond angles (degree)
 --------------------
C3-N1-C2= 48.49                C4-N1-C2= 81.97                C4-N1-C3= 51.25                C3-C2-N1= 83.47                
C4-C2-N1= 48.28                C4-C2-C3= 52.48                H5-C2-N1=131.29                H5-C2-C3=144.68                
H5-C2-C4=142.40                C2-C3-N1= 48.03                C4-C3-N1= 46.48                C4-C3-C2= 78.08                
C2-C4-N1= 49.75                C3-C4-N1= 82.27                C3-C4-C2= 49.44                

 selected dihedral angles (degree)
 ---------------------------------
C3-C2-N1-C4= 44.01            C4-C2-N1-C3=315.99            H5-C2-N1-C3=186.97            H5-C2-N1-C4=230.98            
N1-C3-C2-C4= 40.83            N1-C3-C2-H5=170.93            C4-C3-C2-N1=319.17            C4-C3-C2-H5=130.10            
C2-C4-N1-C3= 41.85            C3-C4-N1-C2=318.15            N1-C4-C2-C3=240.49            N1-C4-C2-H5=106.93            
C3-C4-C2-N1=119.51            C3-C4-C2-H5=226.44            N1-C4-C3-C2= 42.09            C2-C4-C3-N1=317.91            
           -------------------------------------------------
          |                Final Singlepoint                |
           -------------------------------------------------

          ...................................................
          :                      SETUP                      :
          :.................................................:
          :  # basis functions                  17          :
          :  # atomic orbitals                  17          :
          :  # shells                            9          :
          :  # electrons                        18          :
          :  max. iterations                   250          :
          :  Hamiltonian                  GFN2-xTB          :
          :  restarted?                      false          :
          :  GBSA solvation                  false          :
          :  PC potential                    false          :
          :  electronic temp.          300.0000000     K    :
          :  accuracy                    1.0000000          :
          :  -> integral cutoff          0.2500000E+02      :
          :  -> integral neglect         0.1000000E-07      :
          :  -> SCF convergence          0.1000000E-05 Eh   :
          :  -> wf. convergence          0.1000000E-03 e    :
          :  Broyden damping             0.4000000          :
          ...................................................

 iter      E             dE          RMSdq      gap      omega  full diag
   1     -9.7129942 -0.971299E+01  0.254E-05    3.17       0.0  T
   2     -9.7129942 -0.657252E-13  0.152E-05    3.17    2934.5  T
   3     -9.7129942  0.584421E-12  0.103E-05    3.17    4360.0  T

   *** convergence criteria satisfied after 3 iterations ***

         #    Occupation            Energy/Eh            Energy/eV
      -------------------------------------------------------------
         1        2.0000           -0.7491741             -20.3861
       ...           ...                  ...                  ...
         3        2.0000           -0.6347815             -17.2733
         4        2.0000           -0.5914234             -16.0934
         5        2.0000           -0.5429641             -14.7748
         6        2.0000           -0.5242084             -14.2644
         7        2.0000           -0.4848422             -13.1932
         8        2.0000           -0.4385793             -11.9343
         9        2.0000           -0.4317314             -11.7480 (HOMO)
        10                         -0.3153472              -8.5810 (LUMO)
        11                         -0.2812520              -7.6533
        12                         -0.2770771              -7.5397
        13                          0.0579434               1.5767
        14                          0.0763713               2.0782
       ...                                ...                  ...
        17                          0.5982188              16.2784
      -------------------------------------------------------------
                  HL-Gap            0.1163842 Eh            3.1670 eV
             Fermi-level           -0.3735393 Eh          -10.1645 eV

 SCC (total)                   0 d,  0 h,  0 min,  0.003 sec
 SCC setup                      ...        0 min,  0.000 sec (  1.976%)
 Dispersion                     ...        0 min,  0.000 sec (  0.386%)
 integral evaluation            ...        0 min,  0.001 sec ( 37.854%)
 zeroth order Hamiltonian       ...        0 min,  0.000 sec (  0.471%)
 iterations                     ...        0 min,  0.000 sec ( 17.082%)
 molecular gradient             ...        0 min,  0.001 sec ( 39.482%)
 printout                       ...        0 min,  0.000 sec (  2.438%)

         :::::::::::::::::::::::::::::::::::::::::::::::::::::
         ::                     SUMMARY                     ::
         :::::::::::::::::::::::::::::::::::::::::::::::::::::
         :: total energy              -9.584861056524 Eh    ::
         :: gradient norm              0.000486916080 Eh/a0 ::
         :: HOMO-LUMO gap              3.166975894803 eV    ::
         ::.................................................::
         :: SCC energy                -9.712994165806 Eh    ::
         :: -> isotropic ES           -0.003514918069 Eh    ::
         :: -> anisotropic ES          0.001895444676 Eh    ::
         :: -> anisotropic XC          0.010906951535 Eh    ::
         :: -> dispersion             -0.001955663649 Eh    ::
         :: repulsion energy           0.128133083623 Eh    ::
         :: add. restraining           0.000000000000 Eh    ::
         :::::::::::::::::::::::::::::::::::::::::::::::::::::

           ------------------------------------------------- 
          |                Numerical Hessian                |
           ------------------------------------------------- 
step length          :   0.00500
SCC accuracy         :   0.30000
Hessian scale factor :   1.00000
frozen atoms in %    :   0.00000    0
RMS gradient         :   0.00049
estimated CPU  time      0.00 min
estimated wall time      0.00 min

writing file <hessian>.

 projected vibrational frequencies (cm-1)
eigval :       -0.00    -0.00    -0.00     0.00     0.00     0.00
eigval :      587.44   635.04   762.21   813.30   954.06  1181.75
eigval :     1335.81  1505.79  3216.02
           -------------------------------------------------
          |                Property Printout                |
           -------------------------------------------------

    * Orbital Energies and Occupations

         #    Occupation            Energy/Eh            Energy/eV
      -------------------------------------------------------------
         1        2.0000           -0.7491741             -20.3861
         2        2.0000           -0.6417211             -17.4621
         3        2.0000           -0.6347816             -17.2733
         4        2.0000           -0.5914234             -16.0934
         5        2.0000           -0.5429641             -14.7748
         6        2.0000           -0.5242085             -14.2644
         7        2.0000           -0.4848422             -13.1932
         8        2.0000           -0.4385792             -11.9343
         9        2.0000           -0.4317315             -11.7480 (HOMO)
        10                         -0.3153472              -8.5810 (LUMO)
        11                         -0.2812520              -7.6533
        12                         -0.2770771              -7.5397
        13                          0.0579434               1.5767
        14                          0.0763713               2.0782
        15                          0.1241515               3.3783
        16                          0.2679320               7.2908
        17                          0.5982187              16.2784
      -------------------------------------------------------------
                  HL-Gap            0.1163843 Eh            3.1670 eV
             Fermi-level           -0.3735394 Eh          -10.1645 eV

     #   Z        covCN         q      C6AA      α(0)
     1   7 N      2.487    -0.117    23.602     7.215
     2   6 C      3.679     0.123    18.774     6.206
     3   6 C      2.626    -0.067    29.652     8.907
     4   6 C      2.752    -0.017    28.417     8.729
     5   1 H      0.927     0.078     2.002     2.213

 Mol. C6AA /au·bohr⁶  :        456.073493
 Mol. C8AA /au·bohr⁸  :      11850.895851
 Mol. α(0) /au        :         33.269771


Wiberg/Mayer (AO) data.
largest (>0.10) Wiberg bond orders for each atom
          total WBO             WBO to atom ...
     1  N   3.069        C    4 1.321    C    2 1.131    C    3 0.614
     2  C   3.907        C    3 1.324    N    1 1.131    H    5 0.956    C    4 0.497
     3  C   3.018        C    2 1.324    C    4 1.073    N    1 0.614
     4  C   2.919        N    1 1.321    C    3 1.073    C    2 0.497
     5  H   0.994        C    2 0.956

MOs/occ written to file <molden.input>


molecular dipole:
                 x           y           z       tot (Debye)
 q only:        0.198       0.527       0.040
   full:        0.586       0.954      -0.019       2.846
molecular quadrupole (traceless):
                xx          xy          yy          xz          yz          zz
 q only:       -0.197       0.721       0.371       0.287      -0.060      -0.174
  q+dip:       -0.934       1.177       1.352       0.129      -1.101      -0.418
   full:       -1.391       0.667       1.706       0.362      -1.394      -0.315

           -------------------------------------------------
          |                Geometry Summary                 |
           -------------------------------------------------

      molecular mass/u    :       51.0468517
   center of mass at/Å    :       -0.1506607      -0.3228501      -0.0165273
  moments of inertia/u·Å² :        0.2553269E+02   0.2678876E+02   0.4384589E+02
rotational constants/cm⁻¹ :        0.6602373E+00   0.6292800E+00   0.3844746E+00

 * 4 selected distances

     #   Z        #   Z                                     value/Å
     1   7 N      2   6 C                                 1.3716722
     2   6 C      3   6 C                                 1.3815788 (max)
     1   7 N      4   6 C                                 1.3412992
     2   6 C      5   1 H                                 1.0650343 (min)

 * 3 distinct bonds (by element types)

   Z      Z             #   av. dist./Å        max./Å        min./Å
   1 H    6 C           1     1.0650343     1.0650343     1.0650343
   6 C    6 C           1     1.3815788     1.3815788     1.3815788
   6 C    7 N           2     1.3564857     1.3716722     1.3412992

           -------------------------------------------------
          |               Frequency Printout                |
           -------------------------------------------------
 projected vibrational frequencies (cm-1)
eigval :       -0.00    -0.00    -0.00     0.00     0.00     0.00
eigval :      587.44   635.04   762.21   813.30   954.06  1181.75
eigval :     1335.81  1505.79  3216.02
 reduced masses (amu)
   1: 10.35   2: 11.32   3: 12.61   4: 13.23   5: 12.39   6: 11.99   7: 11.88   8:  7.61
   9:  9.26  10: 10.48  11:  3.63  12: 12.13  13: 12.20  14: 12.10  15:  1.97
 IR intensities (amu)
   1:  0.21   2:  0.17   3:  0.11   4:  0.07   5:  0.15   6:  0.09   7:  0.27   8:  0.27
   9:  0.20  10:  0.54  11:  0.05  12:  0.76  13:  1.11  14:  0.34  15:  0.08
 Raman intensities (amu)
   1:  0.00   2:  0.00   3:  0.00   4:  0.00   5:  0.00   6:  0.00   7:  0.00   8:  0.00
   9:  0.00  10:  0.00  11:  0.00  12:  0.00  13:  0.00  14:  0.00  15:  0.00
 output can be read by thermo (or use thermo option).
 writing <g98.out> molden fake output.
 recommended (thermochemical) frequency scaling factor: 1.0
           -------------------------------------------------
          |             Thermodynamic Functions             |
           -------------------------------------------------
Molecule has no symmetry elements
It seems to be the C1 point group

c1  symmetry found (for desy threshold:  0.10E+00) used in thermo

          ...................................................
          :                      SETUP                      :
          :.................................................:
          :  # frequencies                           9      :
          :  # imaginary freq.                       0      :
          :  linear?                             false      :
          :  only rotor calc.                    false      :
          :  symmetry                               c1      :
          :  rotational number                       1      :
          :  scaling factor                  1.0000000      :
          :  rotor cutoff                   50.0000000 cm⁻¹ :
          :  imag. cutoff                  -20.0000000 cm⁻¹ :
          :.................................................:

    mode    ω/cm⁻¹     T·S(HO)/kcal·mol⁻¹    T·S(FR)/kcal·mol⁻¹   T·S(vib)
   ------------------------------------------------------------------------
   ------------------------------------------------------------------------

   temp. (K)  partition function   enthalpy   heat capacity  entropy
                                   cal/mol     cal/K/mol   cal/K/mol   J/K/mol
 298.15  VIB   1.18                  345.026      4.214      1.494
         ROT  0.132E+05              888.752      2.981     21.840
         INT  0.157E+05             1233.778      7.194     23.335
         TR   0.353E+27             1481.254      4.968     37.697
         TOT                        2715.0324    12.1626    61.0311   255.3542

   temp. (K)  partition function   enthalpy   heat capacity  entropy
                                   cal/mol     cal/K/mol   cal/K/mol   J/K/mol
 120.00  VIB   1.00                    2.766      0.175      0.026
         ROT  0.338E+04              357.707      2.981     19.127
         INT  0.338E+04              360.473      3.156     19.154
         TR   0.901E+26              596.178      4.968     33.177
         TOT                         956.6510     8.1242    52.3307   218.9518

   temp. (K)  partition function   enthalpy   heat capacity  entropy
                                   cal/mol     cal/K/mol   cal/K/mol   J/K/mol
 100.00  VIB   1.00                    0.614      0.055      0.007
         ROT  0.257E+04              298.089      2.981     18.584
         INT  0.257E+04              298.703      3.036     18.591
         TR   0.685E+26              496.815      4.968     32.272
         TOT                         795.5181     8.0040    50.8626   212.8091

   temp. (K)  partition function   enthalpy   heat capacity  entropy
                                   cal/mol     cal/K/mol   cal/K/mol   J/K/mol
  80.00  VIB   1.00                    0.067      0.009      0.001
         ROT  0.184E+04              238.471      2.981     17.919
         INT  0.184E+04              238.538      2.990     17.920
         TR   0.490E+26              397.452      4.968     31.164
         TOT                         635.9900     7.9582    49.0834   205.3650

   temp. (K)  partition function   enthalpy   heat capacity  entropy
                                   cal/mol     cal/K/mol   cal/K/mol   J/K/mol
  60.00  VIB   1.00                    0.002      0.000     -0.000
         ROT  0.119E+04              178.853      2.981     17.061
         INT  0.119E+04              178.855      2.981     17.061
         TR   0.319E+26              298.089      4.968     29.735
         TOT                         476.9442     7.9495    46.7964   195.7961

   temp. (K)  partition function   enthalpy   heat capacity  entropy
                                   cal/mol     cal/K/mol   cal/K/mol   J/K/mol
  40.00  VIB   1.00                    0.000      0.000     -0.000
         ROT   650.                  119.236      2.981     15.853
         INT   650.                  119.236      2.981     15.852
         TR   0.173E+26              198.726      4.968     27.722
         TOT                         317.9616     7.9490    43.5742   182.3146

   temp. (K)  partition function   enthalpy   heat capacity  entropy
                                   cal/mol     cal/K/mol   cal/K/mol   J/K/mol
  20.00  VIB   1.00                    0.000      0.000     -0.000
         ROT   230.                   59.618      2.981     13.786
         INT   230.                   59.618      2.981     13.786
         TR   0.613E+25               99.363      4.968     24.280
         TOT                         158.9808     7.9490    38.0660   159.2680

   temp. (K)  partition function   enthalpy   heat capacity  entropy
                                   cal/mol     cal/K/mol   cal/K/mol   J/K/mol
  10.00  VIB   1.00                    0.000      0.000     -0.000
         ROT   81.3                   29.809      2.981     11.720
         INT   81.3                   29.809      2.981     11.720
         TR   0.217E+25               49.681      4.968     20.838
         TOT                          79.4904     7.9490    32.5577   136.2214

       T/K    H(0)-H(T)+PV         H(T)/Eh          T*S/Eh         G(T)/Eh
   ------------------------------------------------------------------------
    298.15    0.432668E-02    0.293670E-01    0.289979E-01    0.369109E-03
    120.00    0.152452E-02    0.265648E-01    0.100073E-01    0.165575E-01
    100.00    0.126774E-02    0.263080E-01    0.810547E-02    0.182026E-01
     80.00    0.101351E-02    0.260538E-01    0.625755E-02    0.197963E-01
     60.00    0.760059E-03    0.258003E-01    0.447449E-02    0.213259E-01
     40.00    0.506704E-03    0.255470E-01    0.277760E-02    0.227694E-01
     20.00    0.253352E-03    0.252936E-01    0.121324E-02    0.240804E-01
     10.00    0.126676E-03    0.251670E-01    0.518840E-03    0.246481E-01 (used)
   ------------------------------------------------------------------------

         :::::::::::::::::::::::::::::::::::::::::::::::::::::
         ::                  THERMODYNAMIC                  ::
         :::::::::::::::::::::::::::::::::::::::::::::::::::::
         :: total free energy          -9.560212931629 Eh   ::
         ::.................................................::
         :: total energy               -9.584861056682 Eh   ::
         :: zero point energy           0.025040288859 Eh   ::
         :: G(RRHO) w/o ZPVE           -0.000392163806 Eh   ::
         :: G(RRHO) contrib.            0.024648125053 Eh   ::
         :::::::::::::::::::::::::::::::::::::::::::::::::::::

optimized geometry written to: xtbopt.xyz


           -------------------------------------------------
          | TOTAL ENERGY               -9.584861056682 Eh   |
          | TOTAL ENTHALPY             -9.559694091807 Eh   |
          | TOTAL FREE ENERGY          -9.560212931629 Eh   |
          | GRADIENT NORM               0.000486823858 Eh/α |
          | HOMO-LUMO GAP               3.166977216564 eV   |
           -------------------------------------------------

------------------------------------------------------------------------
 * finished run on 2020/05/12 at 11:44:58.695     
------------------------------------------------------------------------
 total:
 * wall-time:     0 d,  0 h,  0 min,  0.154 sec
 *  cpu-time:     0 d,  0 h,  0 min,  0.154 sec
 * ratio c/w:     0.999 speedup
 SCF:
 * wall-time:     0 d,  0 h,  0 min,  0.005 sec
 *  cpu-time:     0 d,  0 h,  0 min,  0.005 sec
 * ratio c/w:     1.000 speedup
 ANC optimizer:
 * wall-time:     0 d,  0 h,  0 min,  0.057 sec
 *  cpu-time:     0 d,  0 h,  0 min,  0.056 sec
 * ratio c/w:     0.999 speedup
 numerical hessian:
 * wall-time:     0 d,  0 h,  0 min,  0.078 sec
 *  cpu-time:     0 d,  0 h,  0 min,  0.078 sec
 * ratio c/w:     0.999 speedup

