      -----------------------------------------------------------      
     |                   =====================                   |     
     |                           x T B                           |     
     |                   =====================                   |     
     |                         S. Grimme                         |     
     |          Mulliken Center for Theoretical Chemistry        |     
     |                    University of Bonn                     |     
      -----------------------------------------------------------      

   * xtb version 6.2.2 (9d81278992624c895f80dd42a50cac0aa55982e2) compiled by '@Darwin' on 04/03/2020

   xtb is free software: you can redistribute it and/or modify it under
   the terms of the GNU Lesser General Public License as published by
   the Free Software Foundation, either version 3 of the License, or
   (at your option) any later version.
   
   xtb is distributed in the hope that it will be useful,
   but WITHOUT ANY WARRANTY; without even the implied warranty of
   MERCHANTABILITY or FITNESS FOR A PARTICULAR PURPOSE.  See the
   GNU Lesser General Public License for more details.
   
   Cite this work as:
   * S. Grimme, C. Bannwarth, P. Shushkov, J. Chem. Theory Comput., 2017,
     13, 1989-2009. DOI: 10.1021/acs.jctc.7b00118
   * C. Bannwarth, S. Ehlert and S. Grimme., J. Chem. Theory Comput., 2019,
     15, 1652-1671. DOI: 10.1021/acs.jctc.8b01176
   * P. Pracht, E. Caldeweyher, S. Ehlert, S. Grimme, ChemRxiv, 2019, preprint.
     DOI: 10.26434/chemrxiv.8326202.v1
   
   for DFT-D4:
   * E. Caldeweyher, C. Bannwarth and S. Grimme, J. Chem. Phys., 2017,
     147, 034112. DOI: 10.1063/1.4993215
   * E. Caldeweyher, S. Ehlert, A. Hansen, H. Neugebauer, S. Spicher,
     C. Bannwarth and S. Grimme, J. Chem. Phys., 2019, 150, 154122.
     DOI: 10.1063/1.5090222
   
   for sTDA-xTB:
   * S. Grimme and C. Bannwarth, J. Chem. Phys., 2016, 145, 054103.
     DOI: 10.1063/1.4959605
   
   in the mass-spec context:
   * V. Asgeirsson, C. Bauer and S. Grimme, Chem. Sci., 2017, 8, 4879.
     DOI: 10.1039/c7sc00601b
   
   for metadynamics refer to:
   * S. Grimme, J. Chem. Theory Comput., 2019, 155, 2847-2862
     DOI: 10.1021/acs.jctc.9b00143
   
   with help from (in alphabetical order)
   C. Bannwarth, F. Bohle, G. Brandenburg, E. Caldeweyher, M. Checinski,
   S. Dohm, S. Ehlert, S. Ehrlich, F. März, H. Neugebauer, J. Pisarek,
   P. Pracht, P. Shushkov, and S. Spicher.
   
 * started run on 2020/05/14 at 11:41:35.436     

           -------------------------------------------------
          |                Calculation Setup                |
           -------------------------------------------------

          program call               : xtb --input O2_0_S_2.input O2_0_S_2.xyz --ohess --molden --namespace O2_0_S_2 output.out
          calculation namespace      : O2_0_S_2
          coordinate file            : O2_0_S_2.xyz
          number of atoms            :                     2
          number of electrons        :                    12
          charge                     :                     0
          spin                       :                   1.0
          first test random number   :      0.47182026432175

   ID    Z sym.   atoms
    1    8 O      1, 2

           -------------------------------------------------
          |                 G F N 2 - x T B                 |
           -------------------------------------------------

        Reference                      10.1021/acs.jctc.8b01176
      * Hamiltonian:
        H0-scaling (s, p, d)           1.850000    2.230000    2.230000
        zeta-weighting                 0.500000
      * Dispersion:
        s8                             2.700000
        a1                             0.520000
        a2                             5.000000
        s9                             5.000000
      * Repulsion:
        kExp                           1.500000    1.000000
        rExp                           1.000000
      * Coulomb:
        alpha                          2.000000
        third order                    shell-resolved
        anisotropic                    true
        a3                             3.000000
        a5                             4.000000
        cn-shift                       1.200000
        cn-exp                         4.000000
        max-rad                        5.000000


          ...................................................
          :                      SETUP                      :
          :.................................................:
          :  # basis functions                   8          :
          :  # atomic orbitals                   8          :
          :  # shells                            4          :
          :  # electrons                        12          :
          :  max. iterations                   250          :
          :  Hamiltonian                  GFN2-xTB          :
          :  restarted?                      false          :
          :  GBSA solvation                  false          :
          :  PC potential                    false          :
          :  electronic temp.          300.0000000     K    :
          :  accuracy                    1.0000000          :
          :  -> integral cutoff          0.2500000E+02      :
          :  -> integral neglect         0.1000000E-07      :
          :  -> SCF convergence          0.1000000E-05 Eh   :
          :  -> wf. convergence          0.1000000E-03 e    :
          :  Broyden damping             0.4000000          :
          ...................................................

 iter      E             dE          RMSdq      gap      omega  full diag
   1     -7.8938245 -0.789382E+01  0.296E+00   10.73       0.0  T
   2     -7.8938436 -0.190097E-04  0.181E+00   10.73       1.0  T
   3     -7.8938563 -0.127249E-04  0.524E-02   10.73       1.3  T
   4     -7.8938563 -0.912881E-09  0.915E-03   10.73       7.7  T
   5     -7.8938563 -0.471170E-10  0.217E-05   10.73    3257.5  T
   6     -7.8938563 -0.355271E-14  0.195E-07   10.73  100000.0  T

   *** convergence criteria satisfied after 6 iterations ***

         #    Occupation            Energy/Eh            Energy/eV
      -------------------------------------------------------------
         1        2.0000           -0.8109458             -22.0670
         2        2.0000           -0.7342507             -19.9800
         3        2.0000           -0.6446339             -17.5414
         4        2.0000           -0.6415586             -17.4577
         5        2.0000           -0.6415586             -17.4577
         6        1.0000           -0.4741581             -12.9025
         7        1.0000           -0.4741581             -12.9025 (HOMO)
         8                         -0.0797655              -2.1705 (LUMO)
      -------------------------------------------------------------
                  HL-Gap            0.3943926 Eh           10.7320 eV
             Fermi-level           -0.4174101 Eh          -11.3583 eV

 transition dipole moment (au) for excitation:           6           7
     X       Y       Z   
  -0.0000   0.0000  -0.0000  total (au/Debye):    0.000   0.000
 dE (eV)             :    0.000
 oscillator strength :  0.23451E-46

 SCC (total)                   0 d,  0 h,  0 min,  0.001 sec
 SCC setup                      ...        0 min,  0.000 sec (  6.024%)
 Dispersion                     ...        0 min,  0.000 sec (  0.672%)
 integral evaluation            ...        0 min,  0.000 sec ( 22.359%)
 zeroth order Hamiltonian       ...        0 min,  0.000 sec (  0.788%)
 iterations                     ...        0 min,  0.000 sec ( 34.222%)
 molecular gradient             ...        0 min,  0.000 sec ( 14.875%)
 printout                       ...        0 min,  0.000 sec ( 20.389%)

         :::::::::::::::::::::::::::::::::::::::::::::::::::::
         ::                     SUMMARY                     ::
         :::::::::::::::::::::::::::::::::::::::::::::::::::::
         :: total energy              -7.891100670834 Eh    ::
         :: gradient norm              0.164442286847 Eh/a0 ::
         :: HOMO-LUMO gap             10.731969349872 eV    ::
         ::.................................................::
         :: SCC energy                -7.893856277547 Eh    ::
         :: -> isotropic ES           -0.000104962201 Eh    ::
         :: -> anisotropic ES          0.001672133899 Eh    ::
         :: -> anisotropic XC         -0.003392959581 Eh    ::
         :: -> dispersion             -0.000194507822 Eh    ::
         :: repulsion energy           0.002755606713 Eh    ::
         :: add. restraining           0.000000000000 Eh    ::
         :::::::::::::::::::::::::::::::::::::::::::::::::::::

      ----------------------------------------------------------- 
     |                   =====================                   |
     |                        A N C O P T                        |
     |                   =====================                   |
     |               Approximate Normal Coordinate               |
     |                Rational Function Optimizer                |
      ----------------------------------------------------------- 

          ...................................................
          :                      SETUP                      :
          :.................................................:
          :   optimization level            normal          :
          :   max. optcycles                   200          :
          :   ANC micro-cycles                  20          :
          :   degrees of freedom                 1          :
          :.................................................:
          :   RF solver                   davidson          :
          :   write xtbopt.log                true          :
          :   linear (good luck)              true          :
          :   energy convergence         0.5000000E-05 Eh   :
          :   grad. convergence          0.1000000E-02 Eh/α :
          :   maximium RF displ.         1.0000000          :
          :   Hlow (freq-cutoff)         0.1000000E-01      :
          :   Hmax (freq-cutoff)         5.0000000          :
          :   S6 in model hess.         20.0000000          :
          ...................................................

generating ANC from model Hessian ...
Using Lindh-Hessian (1995)
 Shifting diagonal of input Hessian by    9.9908667155489891E-003
 Lowest  eigenvalues of input Hessian
   -0.000000    0.000000    0.000000    0.010000    0.010000    1.431257
 Highest eigenvalues
   -0.000000    0.000000    0.000000    0.010000    0.010000    1.431257


........................................................................
.............................. CYCLE    1 ..............................
........................................................................
   1     -7.8938563 -0.789386E+01  0.119E-08   10.73       0.0  T
   2     -7.8938563  0.888178E-15  0.714E-09   10.73  100000.0  T
   3     -7.8938563 -0.177636E-14  0.226E-11   10.73  100000.0  T
     SCC iter.                  ...        0 min,  0.000 sec
     gradient                   ...        0 min,  0.000 sec
 * total energy  :    -7.8911007 Eh     change        0.8881784E-15 Eh
   gradient norm :     0.1644423 Eh/α   predicted     0.0000000E+00 (-100.00%)
   displ. norm   :     0.1134157 α      lambda       -0.1865034E-01
   maximum displ.:     0.1134157 α      in ANC's #1, #1, #1, ...

........................................................................
.............................. CYCLE    2 ..............................
........................................................................
   1     -7.9101029 -0.791010E+01  0.991E-01   14.30       0.0  T
   2     -7.9101048 -0.184738E-05  0.602E-01   14.30       1.0  T
   3     -7.9101059 -0.112673E-05  0.184E-02   14.30       3.9  T
   4     -7.9101059 -0.188106E-09  0.215E-03   14.30      32.8  T
   5     -7.9101059 -0.125855E-11  0.134E-07   14.30  100000.0  T
   6     -7.9101059  0.621725E-14  0.334E-08   14.30  100000.0  T
     SCC iter.                  ...        0 min,  0.000 sec
     gradient                   ...        0 min,  0.000 sec
 * total energy  :    -7.9034958 Eh     change       -0.1239513E-01 Eh
   gradient norm :     0.0427468 Eh/α   predicted    -0.9445123E-02 ( -23.80%)
   displ. norm   :     0.0397754 α      lambda       -0.1700273E-02
   maximum displ.:     0.0397754 α      in ANC's #1, #1, #1, ...

........................................................................
.............................. CYCLE    3 ..............................
........................................................................
   1     -7.9129497 -0.791295E+01  0.363E-01   15.91       0.0  T
   2     -7.9129499 -0.203823E-06  0.220E-01   15.91       1.0  T
   3     -7.9129501 -0.122681E-06  0.598E-03   15.91      11.8  T
   4     -7.9129501 -0.207043E-10  0.851E-04   15.91      83.1  T
   5     -7.9129501 -0.327738E-12  0.988E-09   15.91  100000.0  T
     SCC iter.                  ...        0 min,  0.000 sec
     gradient                   ...        0 min,  0.000 sec
 * total energy  :    -7.9040139 Eh     change       -0.5180836E-03 Eh
   gradient norm :     0.0186542 Eh/α   predicted    -0.8514814E-03 (  64.35%)
   displ. norm   :     0.0120824 α      lambda       -0.2253850E-03
   maximum displ.:     0.0120824 α      in ANC's #1, #1, #1, ...

........................................................................
.............................. CYCLE    4 ..............................
........................................................................
   1     -7.9122743 -0.791227E+01  0.111E-01   15.40       0.0  T
   2     -7.9122743 -0.206873E-07  0.672E-02   15.40       1.1  T
   3     -7.9122743 -0.123178E-07  0.189E-03   15.40      37.4  T
   4     -7.9122743 -0.192024E-11  0.244E-04   15.40     289.9  T
   5     -7.9122743 -0.346390E-13  0.563E-10   15.40  100000.0  T
     SCC iter.                  ...        0 min,  0.000 sec
     gradient                   ...        0 min,  0.000 sec
 * total energy  :    -7.9041178 Eh     change       -0.1039547E-03 Eh
   gradient norm :     0.0012542 Eh/α   predicted    -0.1127097E-03 (   8.42%)
   displ. norm   :     0.0011417 α      lambda       -0.9550635E-06
   maximum displ.:     0.0011417 α      in ANC's #1, #1, #1, ...

........................................................................
.............................. CYCLE    5 ..............................
........................................................................
   1     -7.9123455 -0.791235E+01  0.104E-02   15.44       0.0  T
   2     -7.9123455 -0.181833E-09  0.633E-03   15.44      11.2  T
   3     -7.9123455 -0.108569E-09  0.178E-04   15.44     398.1  T
   4     -7.9123455 -0.168754E-13  0.203E-07   15.44  100000.0  T
     SCC iter.                  ...        0 min,  0.000 sec
     gradient                   ...        0 min,  0.000 sec
 * total energy  :    -7.9041182 Eh     change       -0.3869052E-06 Eh
   gradient norm :     0.0005781 Eh/α   predicted    -0.4773003E-06 (  23.36%)
   displ. norm   :     0.0003602 α      lambda       -0.1365594E-06
   maximum displ.:     0.0003602 α      in ANC's #1, #1, #1, ...

   *** GEOMETRY OPTIMIZATION CONVERGED AFTER 5 ITERATIONS ***

------------------------------------------------------------------------
 total energy gain   :        -0.0130176 Eh       -8.1686 kcal/mol
 total RMSD          :         0.1005863 a0        0.0532 Å
 total power (kW/mol):        -6.8355154 (step)********** (real)
------------------------------------------------------------------------

 ANCopt (total)                0 d,  0 h,  0 min,  0.003 sec
 optimizer setup                ...        0 min,  0.000 sec (  1.776%)
 model hessian                  ...        0 min,  0.000 sec (  0.567%)
 ANC generation                 ...        0 min,  0.000 sec (  0.776%)
 coordinate transformation      ...        0 min,  0.000 sec (  0.309%)
 single point calculation       ...        0 min,  0.003 sec ( 87.642%)
 optimization log               ...        0 min,  0.000 sec (  2.318%)
 hessian update                 ...        0 min,  0.000 sec (  0.292%)
 rational function              ...        0 min,  0.000 sec (  2.101%)

================
 final structure:
================
2
 xtb: 6.2.2 (9d81278992624c895f80dd42a50cac0aa55982e2)
O         0.60477200739977    0.00000000000000    0.00000000000000
O        -0.60477200739977    0.00000000000000    0.00000000000000

 Bond Distances (Angstroems)
 ---------------------------
O1-O2=1.2095         O2-O1=1.2095         
 O  O  Rav=1.2095 sigma=0.0000  Rmin=1.2095  Rmax=1.2095     1

 selected bond angles (degree)
 --------------------


 selected dihedral angles (degree)
 ---------------------------------

           -------------------------------------------------
          |                Final Singlepoint                |
           -------------------------------------------------

          ...................................................
          :                      SETUP                      :
          :.................................................:
          :  # basis functions                   8          :
          :  # atomic orbitals                   8          :
          :  # shells                            4          :
          :  # electrons                        12          :
          :  max. iterations                   250          :
          :  Hamiltonian                  GFN2-xTB          :
          :  restarted?                      false          :
          :  GBSA solvation                  false          :
          :  PC potential                    false          :
          :  electronic temp.          300.0000000     K    :
          :  accuracy                    1.0000000          :
          :  -> integral cutoff          0.2500000E+02      :
          :  -> integral neglect         0.1000000E-07      :
          :  -> SCF convergence          0.1000000E-05 Eh   :
          :  -> wf. convergence          0.1000000E-03 e    :
          :  Broyden damping             0.4000000          :
          ...................................................

 iter      E             dE          RMSdq      gap      omega  full diag
   1     -7.9123455 -0.791235E+01  0.149E-09   15.44       0.0  T
   2     -7.9123455 -0.532907E-14  0.904E-10   15.44  100000.0  T
   3     -7.9123455  0.444089E-14  0.123E-11   15.44  100000.0  T

   *** convergence criteria satisfied after 3 iterations ***

         #    Occupation            Energy/Eh            Energy/eV
      -------------------------------------------------------------
         1        2.0000           -0.8271750             -22.5086
         2        2.0000           -0.7368837             -20.0516
         3        2.0000           -0.6615024             -18.0004
         4        2.0000           -0.6615024             -18.0004
         5        2.0000           -0.6381459             -17.3648
         6        1.0000           -0.4427919             -12.0490
         7        1.0000           -0.4427919             -12.0490 (HOMO)
         8                          0.1247245               3.3939 (LUMO)
      -------------------------------------------------------------
                  HL-Gap            0.5675165 Eh           15.4429 eV
             Fermi-level           -0.3497513 Eh           -9.5172 eV

 transition dipole moment (au) for excitation:           6           7
     X       Y       Z   
   0.0000  -0.0000  -0.0000  total (au/Debye):    0.000   0.000
 dE (eV)             :    0.000
 oscillator strength :  0.19626E-46

 SCC (total)                   0 d,  0 h,  0 min,  0.001 sec
 SCC setup                      ...        0 min,  0.000 sec (  3.468%)
 Dispersion                     ...        0 min,  0.000 sec (  0.248%)
 integral evaluation            ...        0 min,  0.000 sec ( 24.222%)
 zeroth order Hamiltonian       ...        0 min,  0.000 sec (  0.330%)
 iterations                     ...        0 min,  0.000 sec (  9.249%)
 molecular gradient             ...        0 min,  0.000 sec ( 23.534%)
 printout                       ...        0 min,  0.000 sec ( 38.205%)

         :::::::::::::::::::::::::::::::::::::::::::::::::::::
         ::                     SUMMARY                     ::
         :::::::::::::::::::::::::::::::::::::::::::::::::::::
         :: total energy              -7.904118222395 Eh    ::
         :: gradient norm              0.000578075393 Eh/a0 ::
         :: HOMO-LUMO gap             15.442909444611 eV    ::
         ::.................................................::
         :: SCC energy                -7.912345494262 Eh    ::
         :: -> isotropic ES           -0.000224919112 Eh    ::
         :: -> anisotropic ES          0.003546644196 Eh    ::
         :: -> anisotropic XC         -0.006920208588 Eh    ::
         :: -> dispersion             -0.000194536017 Eh    ::
         :: repulsion energy           0.008227271867 Eh    ::
         :: add. restraining           0.000000000000 Eh    ::
         :::::::::::::::::::::::::::::::::::::::::::::::::::::

           ------------------------------------------------- 
          |                Numerical Hessian                |
           ------------------------------------------------- 
step length          :   0.00500
SCC accuracy         :   0.30000
Hessian scale factor :   1.00000
frozen atoms in %    :   0.00000    0
RMS gradient         :   0.00058

writing file <hessian>.

 vibrational frequencies (cm-1)
eigval :        0.00     0.00     0.00     0.00     0.00  1630.31
           -------------------------------------------------
          |                Property Printout                |
           -------------------------------------------------

    * Orbital Energies and Occupations

         #    Occupation            Energy/Eh            Energy/eV
      -------------------------------------------------------------
         1        2.0000           -0.8271750             -22.5086
         2        2.0000           -0.7368837             -20.0516
         3        2.0000           -0.6615024             -18.0004
         4        2.0000           -0.6615024             -18.0004
         5        2.0000           -0.6381459             -17.3648
         6        1.0000           -0.4427919             -12.0490
         7        1.0000           -0.4427919             -12.0490 (HOMO)
         8                          0.1247245               3.3939 (LUMO)
      -------------------------------------------------------------
                  HL-Gap            0.5675165 Eh           15.4429 eV
             Fermi-level           -0.3497513 Eh           -9.5172 eV

     #   Z        covCN         q      C6AA      α(0)
     1   8 O      0.979    -0.000    15.074     5.208
     2   8 O      0.979     0.000    15.074     5.208

 Mol. C6AA /au·bohr⁶  :         60.297392
 Mol. C8AA /au·bohr⁸  :       1216.834218
 Mol. α(0) /au        :         10.415952


Wiberg/Mayer (AO) data.
largest (>0.10) Wiberg bond orders for each atom
          total WBO             WBO to atom ...
     1  O   1.500        O    2 1.500
     2  O   1.500        O    1 1.500

MOs/occ written to file <molden.input>


molecular dipole:
                 x           y           z       tot (Debye)
 q only:       -0.000       0.000       0.000
   full:       -0.000      -0.000       0.000       0.000
molecular quadrupole (traceless):
                xx          xy          yy          xz          yz          zz
 q only:        0.000      -0.000      -0.000      -0.000       0.000      -0.000
  q+dip:       -1.210       0.000       0.605       0.000      -0.000       0.605
   full:       -1.234       0.000       0.617       0.000      -0.000       0.617

           -------------------------------------------------
          |                Geometry Summary                 |
           -------------------------------------------------

      molecular mass/u    :       31.9988098
   center of mass at/Å    :        0.0000000       0.0000000       0.0000000
  moments of inertia/u·Å² :        0.2584724E-14   0.1170354E+02   0.1170354E+02
rotational constants/cm⁻¹ :        0.6522025E+16   0.1440388E+01   0.1440388E+01

           -------------------------------------------------
          |               Frequency Printout                |
Molecule has the following symmetry elements: (i) (Cinf) (C2) 2*(sigma) 
It seems to be the Dinfh point group
           -------------------------------------------------
 vibrational frequencies (cm-1)
eigval :        0.00     0.00     0.00     0.00     0.00  1630.31
 reduced masses (amu)
   1: 16.00   2: 16.00   3: 16.00   4: 16.00   5: 16.00   6: 16.00
 IR intensities (amu)
   1:  0.00   2:  0.00   3:  0.00   4:  0.00   5:  0.00   6:  0.00
 Raman intensities (amu)
   1:  0.00   2:  0.00   3:  0.00   4:  0.00   5:  0.00   6:  0.00
 output can be read by thermo (or use thermo option).
 writing <g98.out> molden fake output.
 recommended (thermochemical) frequency scaling factor: 1.0
           -------------------------------------------------
          |             Thermodynamic Functions             |
           -------------------------------------------------

din symmetry found (for desy threshold:  0.10E+00) used in thermo

          ...................................................
          :                      SETUP                      :
          :.................................................:
          :  # frequencies                           1      :
          :  # imaginary freq.                       0      :
          :  linear?                              true      :
          :  only rotor calc.                    false      :
          :  symmetry                              din      :
          :  rotational number                       2      :
          :  scaling factor                  1.0000000      :
          :  rotor cutoff                   50.0000000 cm⁻¹ :
          :  imag. cutoff                  -20.0000000 cm⁻¹ :
          :.................................................:

    mode    ω/cm⁻¹     T·S(HO)/kcal·mol⁻¹    T·S(FR)/kcal·mol⁻¹   T·S(vib)
   ------------------------------------------------------------------------
   ------------------------------------------------------------------------

   temp. (K)  partition function   enthalpy   heat capacity  entropy
                                   cal/mol     cal/K/mol   cal/K/mol   J/K/mol
 298.15  VIB   1.00                    1.786      0.047      0.007
         ROT   71.9                  592.502      1.987     10.484
         INT   72.0                  594.288      2.034     10.491
         TR   0.175E+27             1481.254      4.968     36.305
         TOT                        2075.5417     7.0026    46.7960   195.7946

   temp. (K)  partition function   enthalpy   heat capacity  entropy
                                   cal/mol     cal/K/mol   cal/K/mol   J/K/mol
 120.00  VIB   1.00                    0.000      0.000     -0.000
         ROT   29.0                  238.471      1.987      8.676
         INT   29.0                  238.471      1.987      8.676
         TR   0.447E+26              596.178      4.968     31.786
         TOT                         834.6492     6.9554    40.4613   169.2902

   temp. (K)  partition function   enthalpy   heat capacity  entropy
                                   cal/mol     cal/K/mol   cal/K/mol   J/K/mol
 100.00  VIB   1.00                    0.000      0.000     -0.000
         ROT   24.1                  198.726      1.987      8.313
         INT   24.1                  198.726      1.987      8.313
         TR   0.340E+26              496.815      4.968     30.880
         TOT                         695.5410     6.9554    39.1937   163.9862

   temp. (K)  partition function   enthalpy   heat capacity  entropy
                                   cal/mol     cal/K/mol   cal/K/mol   J/K/mol
  80.00  VIB   1.00                    0.000      0.000     -0.000
         ROT   19.3                  158.981      1.987      7.870
         INT   19.3                  158.981      1.987      7.870
         TR   0.243E+26              397.452      4.968     29.772
         TOT                         556.4328     6.9554    37.6421   157.4947

   temp. (K)  partition function   enthalpy   heat capacity  entropy
                                   cal/mol     cal/K/mol   cal/K/mol   J/K/mol
  60.00  VIB   1.00                    0.000      0.000     -0.000
         ROT   14.5                  119.236      1.987      7.298
         INT   14.5                  119.236      1.987      7.298
         TR   0.158E+26              298.089      4.968     28.344
         TOT                         417.3246     6.9554    35.6419   149.1257

   temp. (K)  partition function   enthalpy   heat capacity  entropy
                                   cal/mol     cal/K/mol   cal/K/mol   J/K/mol
  40.00  VIB   1.00                    0.000      0.000     -0.000
         ROT   9.65                   79.490      1.987      6.492
         INT   9.65                   79.490      1.987      6.492
         TR   0.861E+25              198.726      4.968     26.330
         TOT                         278.2164     6.9554    32.8227   137.3302

   temp. (K)  partition function   enthalpy   heat capacity  entropy
                                   cal/mol     cal/K/mol   cal/K/mol   J/K/mol
  20.00  VIB   1.00                    0.000      0.000     -0.000
         ROT   4.83                   39.745      1.987      5.115
         INT   4.83                   39.745      1.987      5.115
         TR   0.304E+25               99.363      4.968     22.888
         TOT                         139.1082     6.9554    28.0033   117.1656

   temp. (K)  partition function   enthalpy   heat capacity  entropy
                                   cal/mol     cal/K/mol   cal/K/mol   J/K/mol
  10.00  VIB   1.00                    0.000      0.000     -0.000
         ROT   2.41                   19.873      1.987      3.737
         INT   2.41                   19.873      1.987      3.737
         TR   0.108E+25               49.681      4.968     19.446
         TOT                          69.5541     6.9554    23.1838    97.0011

       T/K    H(0)-H(T)+PV         H(T)/Eh          T*S/Eh         G(T)/Eh
   ------------------------------------------------------------------------
    298.15    0.330759E-02    0.702169E-02    0.222343E-01   -0.152126E-01
    120.00    0.133010E-02    0.504421E-02    0.773751E-02   -0.269330E-02
    100.00    0.110842E-02    0.482252E-02    0.624591E-02   -0.142338E-02
     80.00    0.886732E-03    0.460084E-02    0.479893E-02   -0.198085E-03
     60.00    0.665049E-03    0.437916E-02    0.340794E-02    0.971219E-03
     40.00    0.443366E-03    0.415747E-02    0.209225E-02    0.206522E-02
     20.00    0.221683E-03    0.393579E-02    0.892521E-03    0.304327E-02
     10.00    0.110842E-03    0.382495E-02    0.369458E-03    0.345549E-02 (used)
   ------------------------------------------------------------------------

         :::::::::::::::::::::::::::::::::::::::::::::::::::::
         ::                  THERMODYNAMIC                  ::
         :::::::::::::::::::::::::::::::::::::::::::::::::::::
         :: total free energy          -7.900662729946 Eh   ::
         ::.................................................::
         :: total energy               -7.904118222395 Eh   ::
         :: zero point energy           0.003714108575 Eh   ::
         :: G(RRHO) w/o ZPVE           -0.000258616127 Eh   ::
         :: G(RRHO) contrib.            0.003455492448 Eh   ::
         :::::::::::::::::::::::::::::::::::::::::::::::::::::

optimized geometry written to: xtbopt.xyz


           -------------------------------------------------
          | TOTAL ENERGY               -7.904118222395 Eh   |
          | TOTAL ENTHALPY             -7.900293272306 Eh   |
          | TOTAL FREE ENERGY          -7.900662729946 Eh   |
          | GRADIENT NORM               0.000578075393 Eh/α |
          | HOMO-LUMO GAP              15.442909444389 eV   |
           -------------------------------------------------

------------------------------------------------------------------------
 * finished run on 2020/05/14 at 11:41:35.465     
------------------------------------------------------------------------
 total:
 * wall-time:     0 d,  0 h,  0 min,  0.028 sec
 *  cpu-time:     0 d,  0 h,  0 min,  0.028 sec
 * ratio c/w:     0.999 speedup
 SCF:
 * wall-time:     0 d,  0 h,  0 min,  0.001 sec
 *  cpu-time:     0 d,  0 h,  0 min,  0.001 sec
 * ratio c/w:     1.000 speedup
 ANC optimizer:
 * wall-time:     0 d,  0 h,  0 min,  0.004 sec
 *  cpu-time:     0 d,  0 h,  0 min,  0.004 sec
 * ratio c/w:     1.000 speedup
 numerical hessian:
 * wall-time:     0 d,  0 h,  0 min,  0.009 sec
 *  cpu-time:     0 d,  0 h,  0 min,  0.009 sec
 * ratio c/w:     1.000 speedup

