      -----------------------------------------------------------      
     |                   =====================                   |     
     |                           x T B                           |     
     |                   =====================                   |     
     |                         S. Grimme                         |     
     |          Mulliken Center for Theoretical Chemistry        |     
     |                    University of Bonn                     |     
      -----------------------------------------------------------      

   * xtb version 6.2.2 (9d81278992624c895f80dd42a50cac0aa55982e2) compiled by '@Darwin' on 04/03/2020

   xtb is free software: you can redistribute it and/or modify it under
   the terms of the GNU Lesser General Public License as published by
   the Free Software Foundation, either version 3 of the License, or
   (at your option) any later version.
   
   xtb is distributed in the hope that it will be useful,
   but WITHOUT ANY WARRANTY; without even the implied warranty of
   MERCHANTABILITY or FITNESS FOR A PARTICULAR PURPOSE.  See the
   GNU Lesser General Public License for more details.
   
   Cite this work as:
   * S. Grimme, C. Bannwarth, P. Shushkov, J. Chem. Theory Comput., 2017,
     13, 1989-2009. DOI: 10.1021/acs.jctc.7b00118
   * C. Bannwarth, S. Ehlert and S. Grimme., J. Chem. Theory Comput., 2019,
     15, 1652-1671. DOI: 10.1021/acs.jctc.8b01176
   * P. Pracht, E. Caldeweyher, S. Ehlert, S. Grimme, ChemRxiv, 2019, preprint.
     DOI: 10.26434/chemrxiv.8326202.v1
   
   for DFT-D4:
   * E. Caldeweyher, C. Bannwarth and S. Grimme, J. Chem. Phys., 2017,
     147, 034112. DOI: 10.1063/1.4993215
   * E. Caldeweyher, S. Ehlert, A. Hansen, H. Neugebauer, S. Spicher,
     C. Bannwarth and S. Grimme, J. Chem. Phys., 2019, 150, 154122.
     DOI: 10.1063/1.5090222
   
   for sTDA-xTB:
   * S. Grimme and C. Bannwarth, J. Chem. Phys., 2016, 145, 054103.
     DOI: 10.1063/1.4959605
   
   in the mass-spec context:
   * V. Asgeirsson, C. Bauer and S. Grimme, Chem. Sci., 2017, 8, 4879.
     DOI: 10.1039/c7sc00601b
   
   for metadynamics refer to:
   * S. Grimme, J. Chem. Theory Comput., 2019, 155, 2847-2862
     DOI: 10.1021/acs.jctc.9b00143
   
   with help from (in alphabetical order)
   C. Bannwarth, F. Bohle, G. Brandenburg, E. Caldeweyher, M. Checinski,
   S. Dohm, S. Ehlert, S. Ehrlich, F. März, H. Neugebauer, J. Pisarek,
   P. Pracht, P. Shushkov, and S. Spicher.
   
 * started run on 2020/05/12 at 11:45:23.989     

           -------------------------------------------------
          |                Calculation Setup                |
           -------------------------------------------------

          program call               : xtb --input H2C1N2_12_S_2.input H2C1N2_12_S_2.xyz --ohess --molden --namespace H2C1N2_12_S_2 output.out
          calculation namespace      : H2C1N2_12_S_2
          coordinate file            : H2C1N2_12_S_2.xyz
          number of atoms            :                     5
          number of electrons        :                    16
          charge                     :                     0
          spin                       :                   1.0
          first test random number   :      0.50316500211489

   ID    Z sym.   atoms
    1    7 N      1, 3
    2    6 C      2
    3    1 H      4, 5

           -------------------------------------------------
          |                 G F N 2 - x T B                 |
           -------------------------------------------------

        Reference                      10.1021/acs.jctc.8b01176
      * Hamiltonian:
        H0-scaling (s, p, d)           1.850000    2.230000    2.230000
        zeta-weighting                 0.500000
      * Dispersion:
        s8                             2.700000
        a1                             0.520000
        a2                             5.000000
        s9                             5.000000
      * Repulsion:
        kExp                           1.500000    1.000000
        rExp                           1.000000
      * Coulomb:
        alpha                          2.000000
        third order                    shell-resolved
        anisotropic                    true
        a3                             3.000000
        a5                             4.000000
        cn-shift                       1.200000
        cn-exp                         4.000000
        max-rad                        5.000000


          ...................................................
          :                      SETUP                      :
          :.................................................:
          :  # basis functions                  14          :
          :  # atomic orbitals                  14          :
          :  # shells                            8          :
          :  # electrons                        16          :
          :  max. iterations                   250          :
          :  Hamiltonian                  GFN2-xTB          :
          :  restarted?                      false          :
          :  GBSA solvation                  false          :
          :  PC potential                    false          :
          :  electronic temp.          300.0000000     K    :
          :  accuracy                    1.0000000          :
          :  -> integral cutoff          0.2500000E+02      :
          :  -> integral neglect         0.1000000E-07      :
          :  -> SCF convergence          0.1000000E-05 Eh   :
          :  -> wf. convergence          0.1000000E-03 e    :
          :  Broyden damping             0.4000000          :
          ...................................................

 iter      E             dE          RMSdq      gap      omega  full diag
   1     -8.6207893 -0.862079E+01  0.525E+00    5.75       0.0  T
   2     -8.6436450 -0.228557E-01  0.573E+00    3.28       1.0  T
   3     -8.7515845 -0.107939E+00  0.320E+00    4.50       1.0  T
   4     -8.7759747 -0.243902E-01  0.104E+00    5.06       1.0  T
   5     -8.7769298 -0.955141E-03  0.490E-01    5.00       1.0  T
   6     -8.7775226 -0.592753E-03  0.256E-01    4.98       1.0  T
   7     -8.7776945 -0.171937E-03  0.150E-01    4.94       1.0  T
   8     -8.7777866 -0.920328E-04  0.191E-02    4.95       2.3  T
   9     -8.7777879 -0.137969E-05  0.150E-02    4.96       3.0  T
  10     -8.7777887 -0.769012E-06  0.574E-03    4.95       7.8  T
  11     -8.7777888 -0.936950E-07  0.304E-03    4.95      14.7  T
  12     -8.7777888 -0.363517E-07  0.709E-04    4.95      63.0  T
  13     -8.7777888 -0.197050E-08  0.224E-04    4.95     199.4  T

   *** convergence criteria satisfied after 13 iterations ***

         #    Occupation            Energy/Eh            Energy/eV
      -------------------------------------------------------------
         1        2.0000           -0.7163259             -19.4922
       ...           ...                  ...                  ...
         3        2.0000           -0.5831612             -15.8686
         4        2.0000           -0.5493393             -14.9483
         5        2.0000           -0.5327843             -14.4978
         6        2.0000           -0.4524779             -12.3125
         7        2.0000           -0.4215173             -11.4701
         8        1.0000           -0.4009045             -10.9092
         9        1.0000           -0.2973807              -8.0921 (HOMO)
        10                         -0.1152947              -3.1373 (LUMO)
        11                          0.0131554               0.3580
        12                          0.0747924               2.0352
        13                          0.0871018               2.3702
        14                          0.2263091               6.1582
      -------------------------------------------------------------
                  HL-Gap            0.1820859 Eh            4.9548 eV
             Fermi-level           -0.3087743 Eh           -8.4022 eV

 transition dipole moment (au) for excitation:           8           9
     X       Y       Z   
  -0.4501  -0.0062   0.0897  total (au/Debye):    0.459   1.167
 dE (eV)             :    2.817
 oscillator strength :  0.20566E-01

 SCC (total)                   0 d,  0 h,  0 min,  0.004 sec
 SCC setup                      ...        0 min,  0.000 sec (  2.814%)
 Dispersion                     ...        0 min,  0.000 sec (  0.419%)
 integral evaluation            ...        0 min,  0.001 sec ( 21.845%)
 zeroth order Hamiltonian       ...        0 min,  0.000 sec (  0.526%)
 iterations                     ...        0 min,  0.001 sec ( 32.648%)
 molecular gradient             ...        0 min,  0.001 sec ( 22.677%)
 printout                       ...        0 min,  0.001 sec ( 18.745%)

         :::::::::::::::::::::::::::::::::::::::::::::::::::::
         ::                     SUMMARY                     ::
         :::::::::::::::::::::::::::::::::::::::::::::::::::::
         :: total energy              -8.716646259621 Eh    ::
         :: gradient norm              0.061966840463 Eh/a0 ::
         :: HOMO-LUMO gap              4.954810622836 eV    ::
         ::.................................................::
         :: SCC energy                -8.777788849881 Eh    ::
         :: -> isotropic ES            0.005815893774 Eh    ::
         :: -> anisotropic ES          0.000188417298 Eh    ::
         :: -> anisotropic XC          0.011434480979 Eh    ::
         :: -> dispersion             -0.001426165236 Eh    ::
         :: repulsion energy           0.061142575978 Eh    ::
         :: add. restraining           0.000000000000 Eh    ::
         :::::::::::::::::::::::::::::::::::::::::::::::::::::

      ----------------------------------------------------------- 
     |                   =====================                   |
     |                        A N C O P T                        |
     |                   =====================                   |
     |               Approximate Normal Coordinate               |
     |                Rational Function Optimizer                |
      ----------------------------------------------------------- 

          ...................................................
          :                      SETUP                      :
          :.................................................:
          :   optimization level            normal          :
          :   max. optcycles                   200          :
          :   ANC micro-cycles                  20          :
          :   degrees of freedom                 9          :
          :.................................................:
          :   RF solver                   davidson          :
          :   write xtbopt.log                true          :
          :   linear?                        false          :
          :   energy convergence         0.5000000E-05 Eh   :
          :   grad. convergence          0.1000000E-02 Eh/α :
          :   maximium RF displ.         1.0000000          :
          :   Hlow (freq-cutoff)         0.1000000E-01      :
          :   Hmax (freq-cutoff)         5.0000000          :
          :   S6 in model hess.         20.0000000          :
          ...................................................

generating ANC from model Hessian ...
Using Lindh-Hessian (1995)
 Shifting diagonal of input Hessian by    0.0000000000000000     
 Lowest  eigenvalues of input Hessian
   -0.000000   -0.000000   -0.000000    0.000000    0.000000    0.000000
    0.072393    0.123307    0.199276    0.203867    0.874818    0.950154
    1.059921    1.131076    1.687227
 Highest eigenvalues
    0.203867    0.874818    0.950154    1.059921    1.131076    1.687227


........................................................................
.............................. CYCLE    1 ..............................
........................................................................
   1     -8.7777889 -0.877779E+01  0.141E-05    4.95       0.0  T
   2     -8.7777889  0.380673E-11  0.280E-05    4.95    1598.2  T
   3     -8.7777889 -0.461142E-11  0.420E-06    4.95   10657.5  T
     SCC iter.                  ...        0 min,  0.000 sec
     gradient                   ...        0 min,  0.001 sec
 * total energy  :    -8.7166463 Eh     change        0.4086740E-09 Eh
   gradient norm :     0.0619676 Eh/α   predicted     0.0000000E+00 (-100.00%)
   displ. norm   :     0.1867749 α      lambda       -0.7297168E-02
   maximum displ.:     0.1333575 α      in ANC's #1, #3, #7, ...

........................................................................
.............................. CYCLE    2 ..............................
........................................................................
   1     -8.7863862 -0.878639E+01  0.724E-01    4.69       0.0  T
   2     -8.7828900  0.349623E-02  0.945E-01    4.87       1.0  T
   3     -8.7869347 -0.404469E-02  0.371E-01    4.70       1.0  T
   4     -8.7873141 -0.379430E-03  0.307E-02    4.73       1.5  T
   5     -8.7873149 -0.819784E-06  0.110E-02    4.73       4.1  T
   6     -8.7873152 -0.303727E-06  0.182E-03    4.73      24.6  T
   7     -8.7873153 -0.592890E-08  0.282E-04    4.73     158.8  T
   8     -8.7873153 -0.473452E-10  0.152E-04    4.73     294.7  T
     SCC iter.                  ...        0 min,  0.001 sec
     gradient                   ...        0 min,  0.001 sec
 * total energy  :    -8.7222720 Eh     change       -0.5625777E-02 Eh
   gradient norm :     0.0380396 Eh/α   predicted    -0.3775864E-02 ( -32.88%)
   displ. norm   :     0.2001821 α      lambda       -0.5057431E-02
   maximum displ.:     0.1498369 α      in ANC's #3, #1, #7, ...

........................................................................
.............................. CYCLE    3 ..............................
........................................................................
   1     -8.7940295 -0.879403E+01  0.868E-01    4.30       0.0  T
   2     -8.7920119  0.201759E-02  0.821E-01    4.48       1.0  T
   3     -8.7939898 -0.197787E-02  0.503E-01    4.28       1.0  T
   4     -8.7948497 -0.859908E-03  0.335E-02    4.35       1.3  T
   5     -8.7948492  0.503683E-06  0.198E-02    4.35       2.3  T
   6     -8.7948503 -0.117806E-05  0.245E-03    4.35      18.3  T
   7     -8.7948504 -0.104469E-07  0.569E-04    4.35      78.7  T
   8     -8.7948504 -0.604599E-09  0.148E-04    4.35     302.7  T
     SCC iter.                  ...        0 min,  0.001 sec
     gradient                   ...        0 min,  0.001 sec
 * total energy  :    -8.7250909 Eh     change       -0.2818862E-02 Eh
   gradient norm :     0.0098649 Eh/α   predicted    -0.2630047E-02 (  -6.70%)
   displ. norm   :     0.0276622 α      lambda       -0.1651928E-03
   maximum displ.:     0.0163773 α      in ANC's #1, #3, #7, ...

........................................................................
.............................. CYCLE    4 ..............................
........................................................................
   1     -8.7966094 -0.879661E+01  0.134E-01    4.33       0.0  T
   2     -8.7966119 -0.253951E-05  0.708E-02    4.33       1.0  T
   3     -8.7966108  0.112833E-05  0.190E-02    4.33       2.4  T
   4     -8.7966121 -0.126486E-05  0.152E-02    4.33       2.9  T
   5     -8.7966128 -0.752354E-06  0.179E-03    4.33      24.9  T
   6     -8.7966128 -0.413547E-08  0.318E-04    4.33     140.7  T
   7     -8.7966128 -0.167763E-09  0.116E-04    4.33     385.0  T
     SCC iter.                  ...        0 min,  0.000 sec
     gradient                   ...        0 min,  0.001 sec
 * total energy  :    -8.7251974 Eh     change       -0.1065095E-03 Eh
   gradient norm :     0.0048911 Eh/α   predicted    -0.8265890E-04 ( -22.39%)
   displ. norm   :     0.0198650 α      lambda       -0.5273395E-04
   maximum displ.:     0.0165442 α      in ANC's #1, #6, #7, ...

........................................................................
.............................. CYCLE    5 ..............................
........................................................................
   1     -8.7972406 -0.879724E+01  0.974E-02    4.39       0.0  T
   2     -8.7971916  0.489494E-04  0.117E-01    4.36       1.0  T
   3     -8.7972571 -0.654557E-04  0.439E-02    4.38       1.0  T
   4     -8.7972611 -0.403056E-05  0.802E-03    4.38       5.6  T
   5     -8.7972612 -0.125464E-06  0.150E-03    4.38      29.8  T
   6     -8.7972612 -0.306442E-08  0.441E-04    4.38     101.4  T
   7     -8.7972612 -0.284608E-09  0.863E-05    4.38     518.0  T
     SCC iter.                  ...        0 min,  0.001 sec
     gradient                   ...        0 min,  0.001 sec
 * total energy  :    -8.7252355 Eh     change       -0.3804611E-04 Eh
   gradient norm :     0.0036043 Eh/α   predicted    -0.2637855E-04 ( -30.67%)
   displ. norm   :     0.0200302 α      lambda       -0.3818405E-04
   maximum displ.:     0.0166090 α      in ANC's #1, #6, #3, ...

........................................................................
.............................. CYCLE    6 ..............................
........................................................................
   1     -8.7973089 -0.879731E+01  0.141E-01    4.48       0.0  T
   2     -8.7971304  0.178559E-03  0.209E-01    4.43       1.0  T
   3     -8.7973704 -0.240075E-03  0.484E-02    4.47       1.0  T
   4     -8.7973743 -0.384132E-05  0.870E-03    4.46       5.1  T
   5     -8.7973744 -0.161241E-06  0.200E-03    4.46      22.3  T
   6     -8.7973744 -0.360895E-08  0.497E-04    4.46      90.0  T
   7     -8.7973744 -0.336668E-09  0.930E-05    4.46     480.9  T
     SCC iter.                  ...        0 min,  0.001 sec
     gradient                   ...        0 min,  0.001 sec
 * total energy  :    -8.7252600 Eh     change       -0.2456057E-04 Eh
   gradient norm :     0.0022736 Eh/α   predicted    -0.1910000E-04 ( -22.23%)
   displ. norm   :     0.0068188 α      lambda       -0.1014302E-04
   maximum displ.:     0.0054571 α      in ANC's #6, #1, #7, ...

........................................................................
.............................. CYCLE    7 ..............................
........................................................................
   1     -8.7971146 -0.879711E+01  0.802E-02    4.52       0.0  T
   2     -8.7970425  0.720867E-04  0.131E-01    4.49       1.0  T
   3     -8.7971378 -0.952367E-04  0.239E-02    4.52       1.9  T
   4     -8.7971387 -0.919749E-06  0.362E-03    4.51      12.4  T
   5     -8.7971387 -0.261736E-07  0.948E-04    4.51      47.2  T
   6     -8.7971387 -0.921361E-09  0.205E-04    4.51     218.6  T
     SCC iter.                  ...        0 min,  0.000 sec
     gradient                   ...        0 min,  0.001 sec
 * total energy  :    -8.7252664 Eh     change       -0.6424318E-05 Eh
   gradient norm :     0.0010368 Eh/α   predicted    -0.5073659E-05 ( -21.02%)
   displ. norm   :     0.0043863 α      lambda       -0.2205450E-05
   maximum displ.:     0.0028672 α      in ANC's #1, #6, #7, ...

........................................................................
.............................. CYCLE    8 ..............................
........................................................................
   1     -8.7968716 -0.879687E+01  0.391E-02    4.54       0.0  T
   2     -8.7968521  0.194841E-04  0.679E-02    4.53       1.0  T
   3     -8.7968777 -0.255547E-04  0.102E-02    4.54       4.4  T
   4     -8.7968778 -0.128534E-06  0.122E-03    4.54      36.7  T
   5     -8.7968778 -0.248919E-08  0.381E-04    4.54     117.3  T
   6     -8.7968778 -0.175511E-09  0.664E-05    4.54     673.7  T
     SCC iter.                  ...        0 min,  0.000 sec
     gradient                   ...        0 min,  0.001 sec
 * total energy  :    -8.7252678 Eh     change       -0.1331997E-05 Eh
   gradient norm :     0.0003553 Eh/α   predicted    -0.1101392E-05 ( -17.31%)
   displ. norm   :     0.0015609 α      lambda       -0.2122225E-06
   maximum displ.:     0.0011394 α      in ANC's #1, #6, #7, ...

   *** GEOMETRY OPTIMIZATION CONVERGED AFTER 8 ITERATIONS ***

------------------------------------------------------------------------
 total energy gain   :        -0.0086215 Eh       -5.4101 kcal/mol
 total RMSD          :         0.1970165 a0        0.1043 Å
 total power (kW/mol):        -2.8294718 (step)-1238.1497 (real)
------------------------------------------------------------------------

 ANCopt (total)                0 d,  0 h,  0 min,  0.018 sec
 optimizer setup                ...        0 min,  0.000 sec (  0.409%)
 model hessian                  ...        0 min,  0.000 sec (  0.544%)
 ANC generation                 ...        0 min,  0.000 sec (  0.316%)
 coordinate transformation      ...        0 min,  0.000 sec (  0.109%)
 single point calculation       ...        0 min,  0.017 sec ( 94.610%)
 optimization log               ...        0 min,  0.000 sec (  1.105%)
 hessian update                 ...        0 min,  0.000 sec (  0.113%)
 rational function              ...        0 min,  0.000 sec (  1.132%)

================
 final structure:
================
5
 xtb: 6.2.2 (9d81278992624c895f80dd42a50cac0aa55982e2)
N         0.60356503330424   -0.03652819927998    0.41655564014345
C        -0.03153039013917    1.09953480932224   -0.08245733537429
N        -0.59871688587381   -0.13253165521990   -0.40387615880873
H         1.42087422537246   -0.43202853902105   -0.06051315751725
H        -1.39419198266373   -0.49844641580131    0.13029201155682

 Bond Distances (Angstroems)
 ---------------------------
N1-C2=1.3939         N1-N3=1.4587         N1-H4=1.0257         C2-N1=1.3939         C2-N3=1.3939         N3-N1=1.4587         
N3-C2=1.3939         N3-H5=1.0257         H4-N1=1.0257         H5-N3=1.0257         
 N  H  Rav=1.0257 sigma=0.0000  Rmin=1.0257  Rmax=1.0257     2
 N  C  Rav=1.3939 sigma=0.0000  Rmin=1.3939  Rmax=1.3939     2
 N  N  Rav=1.4587 sigma=0.0000  Rmin=1.4587  Rmax=1.4587     1

 selected bond angles (degree)
 --------------------
N3-N1-C2= 58.45                H4-N1-C2=120.72                H4-N1-N3=111.70                N3-C2-N1= 63.10                
C2-N3-N1= 58.45                H5-N3-N1=111.70                H5-N3-C2=120.72                

 selected dihedral angles (degree)
 ---------------------------------
N3-C2-N1-H4= 98.04            C2-N3-N1-H4=246.37            H5-N3-N1-C2=246.37            H5-N3-N1-H4=132.75            
H5-N3-C2-N1= 98.04            
           -------------------------------------------------
          |                Final Singlepoint                |
           -------------------------------------------------

          ...................................................
          :                      SETUP                      :
          :.................................................:
          :  # basis functions                  14          :
          :  # atomic orbitals                  14          :
          :  # shells                            8          :
          :  # electrons                        16          :
          :  max. iterations                   250          :
          :  Hamiltonian                  GFN2-xTB          :
          :  restarted?                      false          :
          :  GBSA solvation                  false          :
          :  PC potential                    false          :
          :  electronic temp.          300.0000000     K    :
          :  accuracy                    1.0000000          :
          :  -> integral cutoff          0.2500000E+02      :
          :  -> integral neglect         0.1000000E-07      :
          :  -> SCF convergence          0.1000000E-05 Eh   :
          :  -> wf. convergence          0.1000000E-03 e    :
          :  Broyden damping             0.4000000          :
          ...................................................

 iter      E             dE          RMSdq      gap      omega  full diag
   1     -8.7968778 -0.879688E+01  0.160E-05    4.54       0.0  T
   2     -8.7968778  0.447642E-12  0.171E-05    4.54    2617.9  T
   3     -8.7968778 -0.691003E-12  0.638E-06    4.54    7011.6  T

   *** convergence criteria satisfied after 3 iterations ***

         #    Occupation            Energy/Eh            Energy/eV
      -------------------------------------------------------------
         1        2.0000           -0.7118676             -19.3709
       ...           ...                  ...                  ...
         3        2.0000           -0.5892472             -16.0342
         4        2.0000           -0.5455966             -14.8464
         5        2.0000           -0.5318239             -14.4717
         6        2.0000           -0.4650847             -12.6556
         7        2.0000           -0.4150997             -11.2954
         8        1.0000           -0.3899858             -10.6121
         9        1.0000           -0.2861563              -7.7867 (HOMO)
        10                         -0.1193369              -3.2473 (LUMO)
        11                         -0.0024466              -0.0666
        12                          0.0834698               2.2713
        13                          0.1545077               4.2044
        14                          0.3216945               8.7538
      -------------------------------------------------------------
                  HL-Gap            0.1668195 Eh            4.5394 eV
             Fermi-level           -0.3026447 Eh           -8.2354 eV

 transition dipole moment (au) for excitation:           8           9
     X       Y       Z   
   0.4400   0.0076  -0.0670  total (au/Debye):    0.445   1.132
 dE (eV)             :    2.825
 oscillator strength :  0.19401E-01

 SCC (total)                   0 d,  0 h,  0 min,  0.003 sec
 SCC setup                      ...        0 min,  0.000 sec (  2.135%)
 Dispersion                     ...        0 min,  0.000 sec (  0.433%)
 integral evaluation            ...        0 min,  0.001 sec ( 30.086%)
 zeroth order Hamiltonian       ...        0 min,  0.000 sec (  0.480%)
 iterations                     ...        0 min,  0.000 sec ( 10.016%)
 molecular gradient             ...        0 min,  0.001 sec ( 30.330%)
 printout                       ...        0 min,  0.001 sec ( 26.192%)

         :::::::::::::::::::::::::::::::::::::::::::::::::::::
         ::                     SUMMARY                     ::
         :::::::::::::::::::::::::::::::::::::::::::::::::::::
         :: total energy              -8.725267770527 Eh    ::
         :: gradient norm              0.000355295232 Eh/a0 ::
         :: HOMO-LUMO gap              4.539388483177 eV    ::
         ::.................................................::
         :: SCC energy                -8.796877807452 Eh    ::
         :: -> isotropic ES            0.005294437470 Eh    ::
         :: -> anisotropic ES          0.000098364056 Eh    ::
         :: -> anisotropic XC          0.011124418871 Eh    ::
         :: -> dispersion             -0.001431385174 Eh    ::
         :: repulsion energy           0.071610016805 Eh    ::
         :: add. restraining           0.000000000000 Eh    ::
         :::::::::::::::::::::::::::::::::::::::::::::::::::::

           ------------------------------------------------- 
          |                Numerical Hessian                |
           ------------------------------------------------- 
step length          :   0.00500
SCC accuracy         :   0.30000
Hessian scale factor :   1.00000
frozen atoms in %    :   0.00000    0
RMS gradient         :   0.00036
estimated CPU  time      0.00 min
estimated wall time      0.00 min

writing file <hessian>.

 projected vibrational frequencies (cm-1)
eigval :       -0.00    -0.00    -0.00     0.00     0.00     0.00
eigval :      629.81   934.47   971.62  1070.78  1082.30  1132.53
eigval :     1458.74  3139.53  3144.38
           -------------------------------------------------
          |                Property Printout                |
           -------------------------------------------------

    * Orbital Energies and Occupations

         #    Occupation            Energy/Eh            Energy/eV
      -------------------------------------------------------------
         1        2.0000           -0.7118676             -19.3709
         2        2.0000           -0.6135977             -16.6968
         3        2.0000           -0.5892473             -16.0342
         4        2.0000           -0.5455966             -14.8464
         5        2.0000           -0.5318240             -14.4717
         6        2.0000           -0.4650847             -12.6556
         7        2.0000           -0.4150997             -11.2954
         8        1.0000           -0.3899858             -10.6121
         9        1.0000           -0.2861562              -7.7867 (HOMO)
        10                         -0.1193369              -3.2473 (LUMO)
        11                         -0.0024466              -0.0666
        12                          0.0834698               2.2713
        13                          0.1545077               4.2044
        14                          0.3216945               8.7538
      -------------------------------------------------------------
                  HL-Gap            0.1668193 Eh            4.5394 eV
             Fermi-level           -0.3026447 Eh           -8.2354 eV

     #   Z        covCN         q      C6AA      α(0)
     1   7 N      2.742    -0.130    23.819     7.248
     2   6 C      1.819    -0.057    32.715     9.242
     3   7 N      2.742    -0.130    23.819     7.248
     4   1 H      0.859     0.158     1.345     1.817
     5   1 H      0.859     0.158     1.345     1.817

 Mol. C6AA /au·bohr⁶  :        315.914530
 Mol. C8AA /au·bohr⁸  :       7148.427618
 Mol. α(0) /au        :         27.372846


Wiberg/Mayer (AO) data.
largest (>0.10) Wiberg bond orders for each atom
          total WBO             WBO to atom ...
     1  N   2.969        C    2 1.078    N    3 0.968    H    4 0.922
     2  C   2.188        N    3 1.078    N    1 1.078
     3  N   2.969        C    2 1.078    N    1 0.968    H    5 0.922
     4  H   0.944        N    1 0.922
     5  H   0.944        N    3 0.922

MOs/occ written to file <molden.input>


molecular dipole:
                 x           y           z       tot (Debye)
 q only:        0.010      -0.355       0.027
   full:        0.017      -0.600       0.045       1.530
molecular quadrupole (traceless):
                xx          xy          yy          xz          yz          zz
 q only:        1.982       0.039      -0.887      -0.571      -0.032      -1.095
  q+dip:        3.249      -0.043      -1.361      -2.330      -0.107      -1.889
   full:        3.442      -0.013      -1.467      -2.050      -0.097      -1.975

           -------------------------------------------------
          |                Geometry Summary                 |
           -------------------------------------------------

      molecular mass/u    :       42.0400238
   center of mass at/Å    :       -0.0067520       0.2354991      -0.0176608
  moments of inertia/u·Å² :        0.1420822E+02   0.1891611E+02   0.3052457E+02
rotational constants/cm⁻¹ :        0.1186470E+01   0.8911785E+00   0.5522643E+00

 * 2 selected distances

     #   Z        #   Z                                     value/Å
     1   7 N      4   1 H                                 1.0256751 (min)
     3   7 N      5   1 H                                 1.0256753 (max)

 * 1 distinct bonds (by element types)

   Z      Z             #   av. dist./Å        max./Å        min./Å
   1 H    7 N           2     1.0256752     1.0256753     1.0256751

           -------------------------------------------------
          |               Frequency Printout                |
           -------------------------------------------------
 projected vibrational frequencies (cm-1)
eigval :       -0.00    -0.00    -0.00     0.00     0.00     0.00
eigval :      629.81   934.47   971.62  1070.78  1082.30  1132.53
eigval :     1458.74  3139.53  3144.38
 reduced masses (amu)
   1: 11.43   2: 12.71   3: 12.36   4: 12.28   5: 12.59   6: 10.91   7: 11.02   8:  6.47
   9:  4.32  10:  3.39  11:  9.19  12:  2.87  13: 12.97  14:  1.82  15:  1.81
 IR intensities (amu)
   1:  0.35   2:  0.06   3:  0.24   4:  0.23   5:  0.13   6:  0.22   7:  1.53   8:  0.90
   9:  0.04  10:  0.12  11:  0.59  12:  0.22  13:  0.07  14:  0.15  15:  0.16
 Raman intensities (amu)
   1:  0.00   2:  0.00   3:  0.00   4:  0.00   5:  0.00   6:  0.00   7:  0.00   8:  0.00
   9:  0.00  10:  0.00  11:  0.00  12:  0.00  13:  0.00  14:  0.00  15:  0.00
Molecule has the following symmetry elements: (C2) 
It seems to be the C2 point group
 output can be read by thermo (or use thermo option).
 writing <g98.out> molden fake output.
 recommended (thermochemical) frequency scaling factor: 1.0
           -------------------------------------------------
          |             Thermodynamic Functions             |
           -------------------------------------------------

c2  symmetry found (for desy threshold:  0.10E+00) used in thermo

          ...................................................
          :                      SETUP                      :
          :.................................................:
          :  # frequencies                           9      :
          :  # imaginary freq.                       0      :
          :  linear?                             false      :
          :  only rotor calc.                    false      :
          :  symmetry                               c2      :
          :  rotational number                       2      :
          :  scaling factor                  1.0000000      :
          :  rotor cutoff                   50.0000000 cm⁻¹ :
          :  imag. cutoff                  -20.0000000 cm⁻¹ :
          :.................................................:

    mode    ω/cm⁻¹     T·S(HO)/kcal·mol⁻¹    T·S(FR)/kcal·mol⁻¹   T·S(vib)
   ------------------------------------------------------------------------
   ------------------------------------------------------------------------

   temp. (K)  partition function   enthalpy   heat capacity  entropy
                                   cal/mol     cal/K/mol   cal/K/mol   J/K/mol
 298.15  VIB   1.09                  197.810      2.775      0.834
         ROT  0.346E+04              888.752      2.981     19.175
         INT  0.377E+04             1086.563      5.756     20.008
         TR   0.264E+27             1481.254      4.968     37.118
         TOT                        2567.8166    10.7238    57.1266   239.0179

   temp. (K)  partition function   enthalpy   heat capacity  entropy
                                   cal/mol     cal/K/mol   cal/K/mol   J/K/mol
 120.00  VIB   1.00                    1.027      0.067      0.010
         ROT   883.                  357.707      2.981     16.462
         INT   884.                  358.734      3.048     16.472
         TR   0.673E+26              596.178      4.968     32.599
         TOT                         954.9116     8.0165    49.0704   205.3107

   temp. (K)  partition function   enthalpy   heat capacity  entropy
                                   cal/mol     cal/K/mol   cal/K/mol   J/K/mol
 100.00  VIB   1.00                    0.217      0.020      0.002
         ROT   672.                  298.089      2.981     15.918
         INT   672.                  298.306      3.001     15.921
         TR   0.512E+26              496.815      4.968     31.693
         TOT                         795.1207     7.9691    47.6143   199.2183

   temp. (K)  partition function   enthalpy   heat capacity  entropy
                                   cal/mol     cal/K/mol   cal/K/mol   J/K/mol
  80.00  VIB   1.00                    0.022      0.003      0.000
         ROT   481.                  238.471      2.981     15.253
         INT   481.                  238.493      2.984     15.254
         TR   0.367E+26              397.452      4.968     30.585
         TOT                         635.9451     7.9522    45.8390   191.7903

   temp. (K)  partition function   enthalpy   heat capacity  entropy
                                   cal/mol     cal/K/mol   cal/K/mol   J/K/mol
  60.00  VIB   1.00                    0.000      0.000     -0.000
         ROT   312.                  178.853      2.981     14.396
         INT   312.                  178.854      2.981     14.396
         TR   0.238E+26              298.089      4.968     29.157
         TOT                         476.9429     7.9492    43.5526   182.2239

   temp. (K)  partition function   enthalpy   heat capacity  entropy
                                   cal/mol     cal/K/mol   cal/K/mol   J/K/mol
  40.00  VIB   1.00                    0.000      0.000     -0.000
         ROT   170.                  119.236      2.981     13.187
         INT   170.                  119.236      2.981     13.187
         TR   0.130E+26              198.726      4.968     27.143
         TOT                         317.9616     7.9490    40.3305   168.7426

   temp. (K)  partition function   enthalpy   heat capacity  entropy
                                   cal/mol     cal/K/mol   cal/K/mol   J/K/mol
  20.00  VIB   1.00                    0.000      0.000     -0.000
         ROT   60.1                   59.618      2.981     11.121
         INT   60.1                   59.618      2.981     11.121
         TR   0.458E+25               99.363      4.968     23.701
         TOT                         158.9808     7.9490    34.8222   145.6962

   temp. (K)  partition function   enthalpy   heat capacity  entropy
                                   cal/mol     cal/K/mol   cal/K/mol   J/K/mol
  10.00  VIB   1.00                    0.000      0.000     -0.000
         ROT   21.3                   29.809      2.981      9.055
         INT   21.3                   29.809      2.981      9.055
         TR   0.162E+25               49.681      4.968     20.259
         TOT                          79.4904     7.9490    29.3140   122.6498

       T/K    H(0)-H(T)+PV         H(T)/Eh          T*S/Eh         G(T)/Eh
   ------------------------------------------------------------------------
    298.15    0.409208E-02    0.349935E-01    0.271427E-01    0.785078E-02
    120.00    0.152175E-02    0.324232E-01    0.938385E-02    0.230393E-01
    100.00    0.126711E-02    0.321685E-01    0.758783E-02    0.245807E-01
     80.00    0.101344E-02    0.319149E-01    0.584392E-02    0.260709E-01
     60.00    0.760057E-03    0.316615E-01    0.416433E-02    0.274971E-01
     40.00    0.506704E-03    0.314081E-01    0.257083E-02    0.288373E-01
     20.00    0.253352E-03    0.311548E-01    0.110986E-02    0.300449E-01
     10.00    0.126676E-03    0.310281E-01    0.467149E-03    0.305609E-01 (used)
   ------------------------------------------------------------------------

         :::::::::::::::::::::::::::::::::::::::::::::::::::::
         ::                  THERMODYNAMIC                  ::
         :::::::::::::::::::::::::::::::::::::::::::::::::::::
         :: total free energy          -8.694706825068 Eh   ::
         ::.................................................::
         :: total energy               -8.725267770524 Eh   ::
         :: zero point energy           0.030901417954 Eh   ::
         :: G(RRHO) w/o ZPVE           -0.000340472497 Eh   ::
         :: G(RRHO) contrib.            0.030560945457 Eh   ::
         :::::::::::::::::::::::::::::::::::::::::::::::::::::

optimized geometry written to: xtbopt.xyz


           -------------------------------------------------
          | TOTAL ENERGY               -8.725267770524 Eh   |
          | TOTAL ENTHALPY             -8.694239676555 Eh   |
          | TOTAL FREE ENERGY          -8.694706825068 Eh   |
          | GRADIENT NORM               0.000355435259 Eh/α |
          | HOMO-LUMO GAP               4.539383920444 eV   |
           -------------------------------------------------

------------------------------------------------------------------------
 * finished run on 2020/05/12 at 11:45:24.094     
------------------------------------------------------------------------
 total:
 * wall-time:     0 d,  0 h,  0 min,  0.104 sec
 *  cpu-time:     0 d,  0 h,  0 min,  0.104 sec
 * ratio c/w:     0.999 speedup
 SCF:
 * wall-time:     0 d,  0 h,  0 min,  0.004 sec
 *  cpu-time:     0 d,  0 h,  0 min,  0.004 sec
 * ratio c/w:     1.000 speedup
 ANC optimizer:
 * wall-time:     0 d,  0 h,  0 min,  0.022 sec
 *  cpu-time:     0 d,  0 h,  0 min,  0.022 sec
 * ratio c/w:     0.999 speedup
 numerical hessian:
 * wall-time:     0 d,  0 h,  0 min,  0.061 sec
 *  cpu-time:     0 d,  0 h,  0 min,  0.061 sec
 * ratio c/w:     0.999 speedup

