      -----------------------------------------------------------      
     |                   =====================                   |     
     |                           x T B                           |     
     |                   =====================                   |     
     |                         S. Grimme                         |     
     |          Mulliken Center for Theoretical Chemistry        |     
     |                    University of Bonn                     |     
      -----------------------------------------------------------      

   * xtb version 6.2.2 (9d81278992624c895f80dd42a50cac0aa55982e2) compiled by '@Darwin' on 04/03/2020

   xtb is free software: you can redistribute it and/or modify it under
   the terms of the GNU Lesser General Public License as published by
   the Free Software Foundation, either version 3 of the License, or
   (at your option) any later version.
   
   xtb is distributed in the hope that it will be useful,
   but WITHOUT ANY WARRANTY; without even the implied warranty of
   MERCHANTABILITY or FITNESS FOR A PARTICULAR PURPOSE.  See the
   GNU Lesser General Public License for more details.
   
   Cite this work as:
   * S. Grimme, C. Bannwarth, P. Shushkov, J. Chem. Theory Comput., 2017,
     13, 1989-2009. DOI: 10.1021/acs.jctc.7b00118
   * C. Bannwarth, S. Ehlert and S. Grimme., J. Chem. Theory Comput., 2019,
     15, 1652-1671. DOI: 10.1021/acs.jctc.8b01176
   * P. Pracht, E. Caldeweyher, S. Ehlert, S. Grimme, ChemRxiv, 2019, preprint.
     DOI: 10.26434/chemrxiv.8326202.v1
   
   for DFT-D4:
   * E. Caldeweyher, C. Bannwarth and S. Grimme, J. Chem. Phys., 2017,
     147, 034112. DOI: 10.1063/1.4993215
   * E. Caldeweyher, S. Ehlert, A. Hansen, H. Neugebauer, S. Spicher,
     C. Bannwarth and S. Grimme, J. Chem. Phys., 2019, 150, 154122.
     DOI: 10.1063/1.5090222
   
   for sTDA-xTB:
   * S. Grimme and C. Bannwarth, J. Chem. Phys., 2016, 145, 054103.
     DOI: 10.1063/1.4959605
   
   in the mass-spec context:
   * V. Asgeirsson, C. Bauer and S. Grimme, Chem. Sci., 2017, 8, 4879.
     DOI: 10.1039/c7sc00601b
   
   for metadynamics refer to:
   * S. Grimme, J. Chem. Theory Comput., 2019, 155, 2847-2862
     DOI: 10.1021/acs.jctc.9b00143
   
   with help from (in alphabetical order)
   C. Bannwarth, F. Bohle, G. Brandenburg, E. Caldeweyher, M. Checinski,
   S. Dohm, S. Ehlert, S. Ehrlich, F. März, H. Neugebauer, J. Pisarek,
   P. Pracht, P. Shushkov, and S. Spicher.
   
 * started run on 2020/05/12 at 11:44:35.819     

           -------------------------------------------------
          |                Calculation Setup                |
           -------------------------------------------------

          program call               : xtb --input C5_10_S_2.input C5_10_S_2.xyz --ohess --molden --namespace C5_10_S_2 output.out
          calculation namespace      : C5_10_S_2
          coordinate file            : C5_10_S_2.xyz
          number of atoms            :                     5
          number of electrons        :                    20
          charge                     :                     0
          spin                       :                   1.0
          first test random number   :      0.95815263036306

   ID    Z sym.   atoms
    1    6 C      1-5

           -------------------------------------------------
          |                 G F N 2 - x T B                 |
           -------------------------------------------------

        Reference                      10.1021/acs.jctc.8b01176
      * Hamiltonian:
        H0-scaling (s, p, d)           1.850000    2.230000    2.230000
        zeta-weighting                 0.500000
      * Dispersion:
        s8                             2.700000
        a1                             0.520000
        a2                             5.000000
        s9                             5.000000
      * Repulsion:
        kExp                           1.500000    1.000000
        rExp                           1.000000
      * Coulomb:
        alpha                          2.000000
        third order                    shell-resolved
        anisotropic                    true
        a3                             3.000000
        a5                             4.000000
        cn-shift                       1.200000
        cn-exp                         4.000000
        max-rad                        5.000000


          ...................................................
          :                      SETUP                      :
          :.................................................:
          :  # basis functions                  20          :
          :  # atomic orbitals                  20          :
          :  # shells                           10          :
          :  # electrons                        20          :
          :  max. iterations                   250          :
          :  Hamiltonian                  GFN2-xTB          :
          :  restarted?                      false          :
          :  GBSA solvation                  false          :
          :  PC potential                    false          :
          :  electronic temp.          300.0000000     K    :
          :  accuracy                    1.0000000          :
          :  -> integral cutoff          0.2500000E+02      :
          :  -> integral neglect         0.1000000E-07      :
          :  -> SCF convergence          0.1000000E-05 Eh   :
          :  -> wf. convergence          0.1000000E-03 e    :
          :  Broyden damping             0.4000000          :
          ...................................................

 iter      E             dE          RMSdq      gap      omega  full diag
   1    -10.2078590 -0.102079E+02  0.930E+00    0.07       0.0  T
   2    -10.1799321  0.279269E-01  0.589E+00    0.04       1.0  T
   3     -9.9150990  0.264833E+00  0.723E+00    0.28       1.0  T
   4    -10.1988800 -0.283781E+00  0.171E+00    0.00       1.0  T
   5    -10.2008378 -0.195778E-02  0.161E+00    0.04       1.0  T
   6    -10.2234030 -0.225652E-01  0.642E-01    0.03       1.0  T
   7    -10.2233978  0.519616E-05  0.357E-01    0.02       1.0  T
   8    -10.2233336  0.642065E-04  0.146E-01    0.02       1.0  T
   9    -10.2234805 -0.146931E-03  0.760E-02    0.02       1.0  T
  10    -10.2234816 -0.113173E-05  0.189E-02    0.02       2.4  T
  11    -10.2234838 -0.221866E-05  0.117E-02    0.02       3.8  T
  12    -10.2234839 -0.179538E-07  0.812E-03    0.02       5.5  T
  13    -10.2234839 -0.555104E-07  0.325E-03    0.02      13.8  T
  14    -10.2234839 -0.124877E-07  0.448E-04    0.02      99.8  T
  15    -10.2234839 -0.339746E-10  0.990E-05    0.02     451.7  T

   *** convergence criteria satisfied after 15 iterations ***

         #    Occupation            Energy/Eh            Energy/eV
      -------------------------------------------------------------
         1        2.0000           -0.7371430             -20.0587
       ...           ...                  ...                  ...
         5        2.0000           -0.5506217             -14.9832
         6        2.0000           -0.5386497             -14.6574
         7        2.0000           -0.4958526             -13.4928
         8        2.0000           -0.4795264             -13.0486
         9        2.0000           -0.4562103             -12.4141
        10        1.0000           -0.4158698             -11.3164
        11        0.5851           -0.3982057             -10.8357 (HOMO)
        12        0.4149           -0.3975526             -10.8180 (LUMO)
        13                         -0.3647169              -9.9245
        14                         -0.3138170              -8.5394
        15                         -0.1323575              -3.6016
        16                          0.0115322               0.3138
       ...                                ...                  ...
        20                          0.2772249               7.5437
      -------------------------------------------------------------
                  HL-Gap            0.0006530 Eh            0.0178 eV
             Fermi-level           -0.4169596 Eh          -11.3460 eV

 transition dipole moment (au) for excitation:          10          11
     X       Y       Z   
  -0.0090  -0.2525  -0.0016  total (au/Debye):    0.253   0.642
 dE (eV)             :    0.481
 oscillator strength :  0.10634E-02

 SCC (total)                   0 d,  0 h,  0 min,  0.006 sec
 SCC setup                      ...        0 min,  0.000 sec (  1.309%)
 Dispersion                     ...        0 min,  0.000 sec (  0.363%)
 integral evaluation            ...        0 min,  0.001 sec ( 23.355%)
 zeroth order Hamiltonian       ...        0 min,  0.000 sec (  0.310%)
 iterations                     ...        0 min,  0.002 sec ( 30.017%)
 molecular gradient             ...        0 min,  0.001 sec ( 25.258%)
 printout                       ...        0 min,  0.001 sec ( 19.149%)

         :::::::::::::::::::::::::::::::::::::::::::::::::::::
         ::                     SUMMARY                     ::
         :::::::::::::::::::::::::::::::::::::::::::::::::::::
         :: total energy             -10.133506936171 Eh    ::
         :: gradient norm              0.172392256236 Eh/a0 ::
         :: HOMO-LUMO gap              0.017770300310 eV    ::
         ::.................................................::
         :: SCC energy               -10.223483924431 Eh    ::
         :: -> isotropic ES           -0.016121294602 Eh    ::
         :: -> anisotropic ES          0.000414496272 Eh    ::
         :: -> anisotropic XC          0.005955040258 Eh    ::
         :: -> dispersion             -0.002978619933 Eh    ::
         :: repulsion energy           0.089976941237 Eh    ::
         :: add. restraining           0.000000000000 Eh    ::
         :::::::::::::::::::::::::::::::::::::::::::::::::::::

      ----------------------------------------------------------- 
     |                   =====================                   |
     |                        A N C O P T                        |
     |                   =====================                   |
     |               Approximate Normal Coordinate               |
     |                Rational Function Optimizer                |
      ----------------------------------------------------------- 

          ...................................................
          :                      SETUP                      :
          :.................................................:
          :   optimization level            normal          :
          :   max. optcycles                   200          :
          :   ANC micro-cycles                  20          :
          :   degrees of freedom                 9          :
          :.................................................:
          :   RF solver                   davidson          :
          :   write xtbopt.log                true          :
          :   linear?                        false          :
          :   energy convergence         0.5000000E-05 Eh   :
          :   grad. convergence          0.1000000E-02 Eh/α :
          :   maximium RF displ.         1.0000000          :
          :   Hlow (freq-cutoff)         0.1000000E-01      :
          :   Hmax (freq-cutoff)         5.0000000          :
          :   S6 in model hess.         20.0000000          :
          ...................................................

generating ANC from model Hessian ...
Using Lindh-Hessian (1995)
 Shifting diagonal of input Hessian by    0.0000000000000000     
 Lowest  eigenvalues of input Hessian
   -0.000000   -0.000000   -0.000000    0.000000    0.000000    0.000000
    0.046314    0.094124    0.244392    0.643969    0.659503    0.881283
    0.917844    0.970091    1.274515
 Highest eigenvalues
    0.643969    0.659503    0.881283    0.917844    0.970091    1.274515


........................................................................
.............................. CYCLE    1 ..............................
........................................................................
   1    -10.2234839 -0.102235E+02  0.282E-05    0.02       0.0  T
   2    -10.2234839  0.153477E-10  0.389E-05    0.02    1150.0  T
   3    -10.2234839 -0.109015E-10  0.245E-05    0.02    1827.1  T
     SCC iter.                  ...        0 min,  0.000 sec
     gradient                   ...        0 min,  0.001 sec
 * total energy  :   -10.1335069 Eh     change       -0.5694503E-09 Eh
   gradient norm :     0.1723924 Eh/α   predicted     0.0000000E+00 (-100.00%)
   displ. norm   :     0.2727798 α      lambda       -0.3947825E-01
   maximum displ.:     0.1731583 α      in ANC's #2, #5, #7, ...

........................................................................
.............................. CYCLE    2 ..............................
........................................................................
   1    -10.2902737 -0.102903E+02  0.275E+00    0.29       0.0  T
   2    -10.2857465  0.452718E-02  0.177E+00    0.29       1.0  T
   3    -10.2499123  0.358342E-01  0.254E+00    0.24       1.0  T
   4    -10.2776373 -0.277251E-01  0.112E+00    0.24       1.0  T
   5    -10.2920322 -0.143948E-01  0.105E-01    0.24       1.0  T
   6    -10.2920645 -0.323086E-04  0.510E-02    0.24       1.0  T
   7    -10.2920712 -0.670516E-05  0.720E-03    0.24       6.2  T
   8    -10.2920714 -0.218366E-06  0.204E-03    0.24      21.9  T
   9    -10.2920714 -0.375520E-08  0.165E-03    0.24      27.0  T
  10    -10.2920714 -0.198272E-07  0.201E-04    0.24     222.8  T
  11    -10.2920714  0.446398E-10  0.175E-04    0.24     255.9  T
     SCC iter.                  ...        0 min,  0.001 sec
     gradient                   ...        0 min,  0.001 sec
 * total energy  :   -10.1684347 Eh     change       -0.3492772E-01 Eh
   gradient norm :     0.1260675 Eh/α   predicted    -0.2120790E-01 ( -39.28%)
   displ. norm   :     0.5693339 α      lambda       -0.6870905E-01
   maximum displ.:     0.4821696 α      in ANC's #5, #2, #7, ...

........................................................................
.............................. CYCLE    3 ..............................
........................................................................
   1    -10.4097921 -0.104098E+02  0.443E+00    1.01       0.0  T
   2    -10.4002939  0.949822E-02  0.296E+00    0.78       1.0  T
   3    -10.3991497  0.114420E-02  0.249E+00    0.96       1.0  T
   4    -10.4035703 -0.442054E-02  0.146E+00    1.01       1.0  T
   5    -10.4230270 -0.194568E-01  0.154E-01    0.95       1.0  T
   6    -10.4230666 -0.395385E-04  0.693E-02    0.94       1.0  T
   7    -10.4230734 -0.683908E-05  0.459E-03    0.94       9.7  T
   8    -10.4230734 -0.115996E-07  0.277E-03    0.94      16.2  T
   9    -10.4230734  0.174277E-07  0.198E-03    0.94      22.6  T
  10    -10.4230734 -0.304094E-07  0.278E-04    0.94     161.0  T
  11    -10.4230734 -0.109750E-09  0.108E-04    0.94     415.5  T
     SCC iter.                  ...        0 min,  0.001 sec
     gradient                   ...        0 min,  0.001 sec
 * total energy  :   -10.1862509 Eh     change       -0.1781620E-01 Eh
   gradient norm :     0.1480638 Eh/α   predicted    -0.4549024E-01 ( 155.33%)
   displ. norm   :     0.2662385 α      lambda       -0.2657197E-01
   maximum displ.:     0.2357244 α      in ANC's #2, #7, #5, ...

........................................................................
.............................. CYCLE    4 ..............................
........................................................................
   1    -10.3637245 -0.103637E+02  0.108E+00    0.73       0.0  T
   2    -10.3621721  0.155243E-02  0.879E-01    0.75       1.0  T
   3    -10.3613671  0.804995E-03  0.808E-01    0.73       1.0  T
   4    -10.3565861  0.478099E-02  0.843E-01    0.77       1.0  T
   5    -10.3646041 -0.801807E-02  0.618E-02    0.75       1.0  T
   6    -10.3646146 -0.104395E-04  0.143E-02    0.75       3.1  T
   7    -10.3646153 -0.686485E-06  0.288E-03    0.75      15.5  T
   8    -10.3646153  0.166617E-07  0.205E-03    0.75      21.8  T
   9    -10.3646153 -0.314384E-07  0.300E-04    0.75     148.9  T
  10    -10.3646153 -0.167429E-09  0.701E-05    0.75     637.9  T
     SCC iter.                  ...        0 min,  0.001 sec
     gradient                   ...        0 min,  0.001 sec
 * total energy  :   -10.1956586 Eh     change       -0.9407752E-02 Eh
   gradient norm :     0.0363960 Eh/α   predicted    -0.1422773E-01 (  51.23%)
   displ. norm   :     0.1286410 α      lambda       -0.3030258E-02
   maximum displ.:     0.1261646 α      in ANC's #2, #7, #6, ...

........................................................................
.............................. CYCLE    5 ..............................
........................................................................
   1    -10.3737697 -0.103738E+02  0.533E-01    0.78       0.0  T
   2    -10.3693552  0.441444E-02  0.771E-01    0.75       1.0  T
   3    -10.3738090 -0.445372E-02  0.331E-01    0.78       1.0  T
   4    -10.3742497 -0.440732E-03  0.103E-01    0.77       1.0  T
   5    -10.3743174 -0.677487E-04  0.225E-02    0.77       2.0  T
   6    -10.3743181 -0.664136E-06  0.514E-03    0.77       8.7  T
   7    -10.3743181 -0.312568E-07  0.113E-03    0.77      39.4  T
   8    -10.3743181  0.631294E-08  0.959E-04    0.77      46.6  T
   9    -10.3743181 -0.759727E-08  0.114E-04    0.77     394.0  T
     SCC iter.                  ...        0 min,  0.001 sec
     gradient                   ...        0 min,  0.001 sec
 * total energy  :   -10.1971345 Eh     change       -0.1475883E-02 Eh
   gradient norm :     0.0147917 Eh/α   predicted    -0.1540202E-02 (   4.36%)
   displ. norm   :     0.0325089 α      lambda       -0.3485441E-03
   maximum displ.:     0.0300401 α      in ANC's #5, #2, #9, ...

........................................................................
.............................. CYCLE    6 ..............................
........................................................................
   1    -10.3773046 -0.103773E+02  0.267E-01    0.80       0.0  T
   2    -10.3772099  0.947549E-04  0.194E-01    0.80       1.0  T
   3    -10.3768783  0.331634E-03  0.227E-01    0.79       1.0  T
   4    -10.3770629 -0.184630E-03  0.189E-01    0.80       1.0  T
   5    -10.3773462 -0.283363E-03  0.711E-03    0.80       6.3  T
   6    -10.3773463 -0.867903E-07  0.207E-03    0.80      21.6  T
   7    -10.3773463 -0.932653E-08  0.320E-04    0.80     139.7  T
   8    -10.3773463  0.482340E-09  0.324E-04    0.80     138.0  T
     SCC iter.                  ...        0 min,  0.001 sec
     gradient                   ...        0 min,  0.001 sec
 * total energy  :   -10.1973803 Eh     change       -0.2458340E-03 Eh
   gradient norm :     0.0094669 Eh/α   predicted    -0.1744548E-03 ( -29.04%)
   displ. norm   :     0.0258694 α      lambda       -0.1735759E-03
   maximum displ.:     0.0234237 α      in ANC's #5, #9, #7, ...

........................................................................
.............................. CYCLE    7 ..............................
........................................................................
   1    -10.3776650 -0.103777E+02  0.206E-01    0.81       0.0  T
   2    -10.3776066  0.584535E-04  0.147E-01    0.81       1.0  T
   3    -10.3772101  0.396473E-03  0.217E-01    0.80       1.0  T
   4    -10.3776045 -0.394404E-03  0.108E-01    0.81       1.0  T
   5    -10.3776814 -0.768918E-04  0.583E-03    0.81       7.7  T
   6    -10.3776814 -0.692489E-07  0.168E-03    0.81      26.7  T
   7    -10.3776814  0.140380E-07  0.171E-03    0.80      26.1  T
   8    -10.3776815 -0.240640E-07  0.214E-04    0.80     208.6  T
   9    -10.3776815  0.656648E-10  0.137E-04    0.80     326.9  T
     SCC iter.                  ...        0 min,  0.001 sec
     gradient                   ...        0 min,  0.001 sec
 * total energy  :   -10.1974895 Eh     change       -0.1091181E-03 Eh
   gradient norm :     0.0051808 Eh/α   predicted    -0.8684461E-04 ( -20.41%)
   displ. norm   :     0.0123251 α      lambda       -0.4508827E-04
   maximum displ.:     0.0063571 α      in ANC's #5, #9, #7, ...

........................................................................
.............................. CYCLE    8 ..............................
........................................................................
   1    -10.3769181 -0.103769E+02  0.846E-02    0.80       0.0  T
   2    -10.3769106  0.755183E-05  0.611E-02    0.80       1.0  T
   3    -10.3768184  0.922185E-04  0.102E-01    0.79       1.0  T
   4    -10.3769164 -0.980333E-04  0.183E-02    0.80       2.4  T
   5    -10.3769193 -0.293595E-05  0.307E-03    0.80      14.6  T
   6    -10.3769193 -0.130375E-07  0.121E-03    0.80      37.1  T
   7    -10.3769194 -0.967988E-08  0.459E-04    0.80      97.4  T
   8    -10.3769194 -0.155317E-08  0.113E-04    0.80     397.5  T
     SCC iter.                  ...        0 min,  0.001 sec
     gradient                   ...        0 min,  0.001 sec
 * total energy  :   -10.1975212 Eh     change       -0.3170387E-04 Eh
   gradient norm :     0.0029835 Eh/α   predicted    -0.2254877E-04 ( -28.88%)
   displ. norm   :     0.0126279 α      lambda       -0.2466828E-04
   maximum displ.:     0.0094314 α      in ANC's #2, #7, #9, ...

........................................................................
.............................. CYCLE    9 ..............................
........................................................................
   1    -10.3761255 -0.103761E+02  0.795E-02    0.78       0.0  T
   2    -10.3761188  0.667774E-05  0.618E-02    0.78       1.0  T
   3    -10.3761088  0.994823E-05  0.571E-02    0.78       1.0  T
   4    -10.3760962  0.126036E-04  0.572E-02    0.78       1.0  T
   5    -10.3761291 -0.329215E-04  0.255E-03    0.78      17.6  T
   6    -10.3761291  0.426494E-07  0.285E-03    0.78      15.7  T
   7    -10.3761292 -0.605128E-07  0.364E-04    0.78     122.7  T
   8    -10.3761292 -0.614994E-09  0.162E-04    0.78     276.2  T
     SCC iter.                  ...        0 min,  0.001 sec
     gradient                   ...        0 min,  0.001 sec
 * total energy  :   -10.1975361 Eh     change       -0.1489937E-04 Eh
   gradient norm :     0.0013778 Eh/α   predicted    -0.1233786E-04 ( -17.19%)
   displ. norm   :     0.0095271 α      lambda       -0.4503749E-05
   maximum displ.:     0.0060750 α      in ANC's #2, #1, #6, ...

........................................................................
.............................. CYCLE   10 ..............................
........................................................................
   1    -10.3759148 -0.103759E+02  0.564E-02    0.77       0.0  T
   2    -10.3759112  0.358857E-05  0.446E-02    0.77       1.0  T
   3    -10.3759118 -0.614960E-06  0.350E-02    0.77       1.3  T
   4    -10.3759025  0.933998E-05  0.385E-02    0.77       1.2  T
   5    -10.3759174 -0.149100E-04  0.337E-03    0.77      13.3  T
   6    -10.3759175 -0.631068E-07  0.166E-03    0.77      27.0  T
   7    -10.3759175 -0.965366E-08  0.619E-04    0.77      72.3  T
   8    -10.3759175 -0.213755E-08  0.129E-04    0.77     346.3  T
     SCC iter.                  ...        0 min,  0.001 sec
     gradient                   ...        0 min,  0.001 sec
 * total energy  :   -10.1975365 Eh     change       -0.4359181E-06 Eh
   gradient norm :     0.0013367 Eh/α   predicted    -0.2253905E-05 ( 417.05%)
   displ. norm   :     0.0082548 α      lambda       -0.4079101E-05
   maximum displ.:     0.0080554 α      in ANC's #1, #5, #4, ...

........................................................................
.............................. CYCLE   11 ..............................
........................................................................
   1    -10.3760395 -0.103760E+02  0.383E-02    0.77       0.0  T
   2    -10.3760386  0.917098E-06  0.270E-02    0.77       1.7  T
   3    -10.3760330  0.557058E-05  0.306E-02    0.77       1.5  T
   4    -10.3760393 -0.630481E-05  0.856E-03    0.77       5.2  T
   5    -10.3760399 -0.533712E-06  0.292E-03    0.77      15.3  T
   6    -10.3760399 -0.730152E-07  0.105E-03    0.77      42.4  T
   7    -10.3760399 -0.180030E-08  0.642E-04    0.77      69.6  T
   8    -10.3760399 -0.231287E-08  0.307E-05    0.77    1457.1  T
     SCC iter.                  ...        0 min,  0.001 sec
     gradient                   ...        0 min,  0.001 sec
 * total energy  :   -10.1975370 Eh     change       -0.4800966E-06 Eh
   gradient norm :     0.0010982 Eh/α   predicted    -0.2041579E-05 ( 325.24%)
   displ. norm   :     0.0058224 α      lambda       -0.2500099E-05
   maximum displ.:     0.0038497 α      in ANC's #2, #1, #6, ...

........................................................................
.............................. CYCLE   12 ..............................
........................................................................
   1    -10.3762192 -0.103762E+02  0.341E-02    0.77       0.0  T
   2    -10.3762179  0.124915E-05  0.267E-02    0.77       1.7  T
   3    -10.3762181 -0.175325E-06  0.212E-02    0.78       2.1  T
   4    -10.3762149  0.319240E-05  0.227E-02    0.77       2.0  T
   5    -10.3762201 -0.520008E-05  0.197E-03    0.77      22.7  T
   6    -10.3762201 -0.213517E-07  0.962E-04    0.77      46.5  T
   7    -10.3762202 -0.308110E-08  0.368E-04    0.77     121.4  T
     SCC iter.                  ...        0 min,  0.001 sec
     gradient                   ...        0 min,  0.001 sec
 * total energy  :   -10.1975385 Eh     change       -0.1515101E-05 Eh
   gradient norm :     0.0002599 Eh/α   predicted    -0.1250286E-05 ( -17.48%)
   displ. norm   :     0.0017051 α      lambda       -0.1999156E-06
   maximum displ.:     0.0013184 α      in ANC's #2, #7, #9, ...

   *** GEOMETRY OPTIMIZATION CONVERGED AFTER 12 ITERATIONS ***

------------------------------------------------------------------------
 total energy gain   :        -0.0640316 Eh      -40.1804 kcal/mol
 total RMSD          :         0.3774833 a0        0.1998 Å
 total power (kW/mol):       -14.0095677 (step)-3662.3002 (real)
------------------------------------------------------------------------

 ANCopt (total)                0 d,  0 h,  0 min,  0.046 sec
 optimizer setup                ...        0 min,  0.000 sec (  0.135%)
 model hessian                  ...        0 min,  0.000 sec (  0.207%)
 ANC generation                 ...        0 min,  0.000 sec (  0.111%)
 coordinate transformation      ...        0 min,  0.000 sec (  0.061%)
 single point calculation       ...        0 min,  0.045 sec ( 97.376%)
 optimization log               ...        0 min,  0.000 sec (  0.744%)
 hessian update                 ...        0 min,  0.000 sec (  0.063%)
 rational function              ...        0 min,  0.000 sec (  0.562%)

================
 final structure:
================
5
 xtb: 6.2.2 (9d81278992624c895f80dd42a50cac0aa55982e2)
C        -0.96492229175212    0.74491539906154    0.08781229964153
C         0.35929065232757    0.85464882300488   -0.19986892935411
C         0.29735462830541   -0.87556775278709   -0.21129924027196
C         1.32388909081221   -0.04907547388370    0.24481520050914
C        -1.01561107969306   -0.67492199539563    0.07853966947540

 Bond Distances (Angstroems)
 ---------------------------
C1-C2=1.3595         C1-C5=1.4208         C2-C1=1.3595         C2-C3=1.7314         C2-C4=1.3946         C3-C2=1.7314         
C3-C4=1.3946         C3-C5=1.3595         C4-C2=1.3946         C4-C3=1.3946         C5-C1=1.4208         C5-C3=1.3595         
 C  C  Rav=1.4434 sigma=0.1306  Rmin=1.3595  Rmax=1.7314     6

 selected bond angles (degree)
 --------------------
C5-C1-C2= 96.55                C3-C2-C1= 83.45                C4-C2-C1=123.64                C4-C2-C3= 51.63                
C4-C3-C2= 51.63                C5-C3-C2= 83.43                C5-C3-C4=123.62                C3-C4-C2= 76.74                
C3-C5-C1= 96.57                

 selected dihedral angles (degree)
 ---------------------------------
C3-C2-C1-C5=  0.00            C4-C2-C1-C5=325.79            C4-C3-C2-C1=216.67            C5-C3-C2-C1=  0.00            
C5-C3-C2-C4=143.33            C3-C4-C2-C1= 45.45            C2-C4-C3-C5=314.56            C3-C5-C1-C2=  0.00            
C1-C5-C3-C2=  0.00            C1-C5-C3-C4= 34.22            
           -------------------------------------------------
          |                Final Singlepoint                |
           -------------------------------------------------

          ...................................................
          :                      SETUP                      :
          :.................................................:
          :  # basis functions                  20          :
          :  # atomic orbitals                  20          :
          :  # shells                           10          :
          :  # electrons                        20          :
          :  max. iterations                   250          :
          :  Hamiltonian                  GFN2-xTB          :
          :  restarted?                      false          :
          :  GBSA solvation                  false          :
          :  PC potential                    false          :
          :  electronic temp.          300.0000000     K    :
          :  accuracy                    1.0000000          :
          :  -> integral cutoff          0.2500000E+02      :
          :  -> integral neglect         0.1000000E-07      :
          :  -> SCF convergence          0.1000000E-05 Eh   :
          :  -> wf. convergence          0.1000000E-03 e    :
          :  Broyden damping             0.4000000          :
          ...................................................

 iter      E             dE          RMSdq      gap      omega  full diag
   1    -10.3762202 -0.103762E+02  0.131E-04    0.77       0.0  T
   2    -10.3762202  0.221512E-11  0.733E-05    0.77     609.9  T
   3    -10.3762202  0.178257E-10  0.760E-05    0.77     588.5  T

   *** convergence criteria satisfied after 3 iterations ***

         #    Occupation            Energy/Eh            Energy/eV
      -------------------------------------------------------------
         1        2.0000           -0.7300913             -19.8668
       ...           ...                  ...                  ...
         5        2.0000           -0.5551861             -15.1074
         6        2.0000           -0.5483416             -14.9211
         7        2.0000           -0.4894192             -13.3178
         8        2.0000           -0.4438981             -12.0791
         9        2.0000           -0.4351582             -11.8413
        10        1.0000           -0.3996847             -10.8760
        11        1.0000           -0.3956764             -10.7669 (HOMO)
        12        0.0000           -0.3672056              -9.9922 (LUMO)
        13                         -0.2821044              -7.6765
        14                         -0.2572975              -7.0014
        15                         -0.1957689              -5.3271
        16                          0.1270927               3.4584
       ...                                ...                  ...
        20                          0.5514547              15.0058
      -------------------------------------------------------------
                  HL-Gap            0.0284708 Eh            0.7747 eV
             Fermi-level           -0.3994312 Eh          -10.8691 eV

 transition dipole moment (au) for excitation:          10          11
     X       Y       Z   
  -0.0133  -0.5611  -0.0027  total (au/Debye):    0.561   1.427
 dE (eV)             :    0.109
 oscillator strength :  0.11903E-02

 SCC (total)                   0 d,  0 h,  0 min,  0.004 sec
 SCC setup                      ...        0 min,  0.000 sec (  1.178%)
 Dispersion                     ...        0 min,  0.000 sec (  0.200%)
 integral evaluation            ...        0 min,  0.001 sec ( 30.242%)
 zeroth order Hamiltonian       ...        0 min,  0.000 sec (  0.341%)
 iterations                     ...        0 min,  0.000 sec (  9.345%)
 molecular gradient             ...        0 min,  0.002 sec ( 35.506%)
 printout                       ...        0 min,  0.001 sec ( 22.966%)

         :::::::::::::::::::::::::::::::::::::::::::::::::::::
         ::                     SUMMARY                     ::
         :::::::::::::::::::::::::::::::::::::::::::::::::::::
         :: total energy             -10.197538487872 Eh    ::
         :: gradient norm              0.000260665095 Eh/a0 ::
         :: HOMO-LUMO gap              0.774729560534 eV    ::
         ::.................................................::
         :: SCC energy               -10.376220151164 Eh    ::
         :: -> isotropic ES           -0.005386528342 Eh    ::
         :: -> anisotropic ES          0.000696989311 Eh    ::
         :: -> anisotropic XC          0.008079734751 Eh    ::
         :: -> dispersion             -0.002928075145 Eh    ::
         :: repulsion energy           0.178681632179 Eh    ::
         :: add. restraining           0.000000000000 Eh    ::
         :::::::::::::::::::::::::::::::::::::::::::::::::::::

           ------------------------------------------------- 
          |                Numerical Hessian                |
           ------------------------------------------------- 
step length          :   0.00500
SCC accuracy         :   0.30000
Hessian scale factor :   1.00000
frozen atoms in %    :   0.00000    0
RMS gradient         :   0.00026
estimated CPU  time      0.00 min
estimated wall time      0.00 min

writing file <hessian>.

 projected vibrational frequencies (cm-1)
eigval :       -0.00    -0.00    -0.00    -0.00     0.00     0.00
eigval :     -377.38  -192.80   413.13   572.49   889.67  1074.48
eigval :     1257.97  1270.51  1349.37
           -------------------------------------------------
          |                Property Printout                |
           -------------------------------------------------

    * Orbital Energies and Occupations

         #    Occupation            Energy/Eh            Energy/eV
      -------------------------------------------------------------
         1        2.0000           -0.7300913             -19.8668
         2        2.0000           -0.6644373             -18.0803
         3        2.0000           -0.6370968             -17.3363
         4        2.0000           -0.5697434             -15.5035
         5        2.0000           -0.5551860             -15.1074
         6        2.0000           -0.5483416             -14.9211
         7        2.0000           -0.4894192             -13.3178
         8        2.0000           -0.4438980             -12.0791
         9        2.0000           -0.4351582             -11.8413
        10        1.0000           -0.3996846             -10.8760
        11        1.0000           -0.3956766             -10.7669 (HOMO)
        12        0.0000           -0.3672057              -9.9922 (LUMO)
        13                         -0.2821044              -7.6765
        14                         -0.2572973              -7.0014
        15                         -0.1957690              -5.3271
        16                          0.1270928               3.4584
        17                          0.2715338               7.3888
        18                          0.2787467               7.5851
        19                          0.4787398              13.0272
        20                          0.5514545              15.0058
      -------------------------------------------------------------
                  HL-Gap            0.0284709 Eh            0.7747 eV
             Fermi-level           -0.3994312 Eh          -10.8691 eV

     #   Z        covCN         q      C6AA      α(0)
     1   6 C      2.309    -0.019    30.017     8.897
     2   6 C      3.204     0.054    26.224     8.342
     3   6 C      3.203     0.054    26.229     8.343
     4   6 C      1.983    -0.070    32.962     9.272
     5   6 C      2.310    -0.019    30.009     8.896

 Mol. C6AA /au·bohr⁶  :        725.739598
 Mol. C8AA /au·bohr⁸  :      20989.650327
 Mol. α(0) /au        :         43.749539


Wiberg/Mayer (AO) data.
largest (>0.10) Wiberg bond orders for each atom
          total WBO             WBO to atom ...
     1  C   3.071        C    2 1.484    C    5 1.149    C    3 0.310    C    4 0.129
     2  C   3.455        C    1 1.484    C    4 1.280    C    3 0.380    C    5 0.310
     3  C   3.454        C    5 1.484    C    4 1.280    C    2 0.380    C    1 0.310
     4  C   2.817        C    2 1.280    C    3 1.280    C    1 0.129    C    5 0.129
Molecule has the following symmetry elements: (sigma) 
It seems to be the Cs point group
     5  C   3.072        C    3 1.484    C    1 1.149    C    2 0.310    C    4 0.129

MOs/occ written to file <molden.input>


molecular dipole:
                 x           y           z       tot (Debye)
 q only:       -0.038       0.002      -0.080
   full:        0.001       0.001      -0.261       0.664
molecular quadrupole (traceless):
                xx          xy          yy          xz          yz          zz
 q only:       -0.640       0.042       0.484      -0.144       0.007       0.155
  q+dip:       -1.035       0.075       0.944      -0.388       0.019       0.091
   full:       -2.736       0.161       1.622      -0.461       0.019       1.113

           -------------------------------------------------
          |                Geometry Summary                 |
           -------------------------------------------------

      molecular mass/u    :       60.0536795
   center of mass at/Å    :        0.0000002      -0.0000002      -0.0000002
  moments of inertia/u·Å² :        0.3202367E+02   0.4915883E+02   0.7738353E+02
rotational constants/cm⁻¹ :        0.5264116E+00   0.3429217E+00   0.2178452E+00

 * 2 selected distances

     #   Z        #   Z                                     value/Å
     1   6 C      2   6 C                                 1.3595374 (max)
     3   6 C      5   6 C                                 1.3594647 (min)

 * 1 distinct bonds (by element types)

   Z      Z             #   av. dist./Å        max./Å        min./Å
   6 C    6 C           2     1.3595010     1.3595374     1.3594647

           -------------------------------------------------
          |               Frequency Printout                |
           -------------------------------------------------
 projected vibrational frequencies (cm-1)
eigval :       -0.00    -0.00    -0.00    -0.00     0.00     0.00
eigval :     -377.38  -192.80   413.13   572.49   889.67  1074.48
eigval :     1257.97  1270.51  1349.37
 reduced masses (amu)
   1: 12.01   2: 12.01   3: 12.01   4: 12.01   5: 12.01   6: 12.01   7: 12.01   8: 12.01
   9: 12.01  10: 12.01  11: 12.01  12: 12.01  13: 12.01  14: 12.01  15: 12.01
 IR intensities (amu)
   1:  0.06   2:  0.05   3:  0.01   4:  0.04   5:  0.08   6:  0.01   7:  1.28   8:  0.94
   9:  0.21  10:  0.42  11:  0.76  12:  0.60  13:  0.92  14:  0.59  15:  1.72
 Raman intensities (amu)
   1:  0.00   2:  0.00   3:  0.00   4:  0.00   5:  0.00   6:  0.00   7:  0.00   8:  0.00
   9:  0.00  10:  0.00  11:  0.00  12:  0.00  13:  0.00  14:  0.00  15:  0.00
 output can be read by thermo (or use thermo option).
 writing <g98.out> molden fake output.
 recommended (thermochemical) frequency scaling factor: 1.0
           -------------------------------------------------
          |             Thermodynamic Functions             |
           -------------------------------------------------

cs  symmetry found (for desy threshold:  0.10E+00) used in thermo

          ...................................................
          :                      SETUP                      :
          :.................................................:
          :  # frequencies                           7      :
          :  # imaginary freq.                       2      :
          :  linear?                             false      :
          :  only rotor calc.                    false      :
          :  symmetry                               cs      :
          :  rotational number                       1      :
          :  scaling factor                  1.0000000      :
          :  rotor cutoff                   50.0000000 cm⁻¹ :
          :  imag. cutoff                  -20.0000000 cm⁻¹ :
          :.................................................:

    mode    ω/cm⁻¹     T·S(HO)/kcal·mol⁻¹    T·S(FR)/kcal·mol⁻¹   T·S(vib)
   ------------------------------------------------------------------------
   ------------------------------------------------------------------------

   temp. (K)  partition function   enthalpy   heat capacity  entropy
                                   cal/mol     cal/K/mol   cal/K/mol   J/K/mol
 298.15  VIB   1.27                  371.051      3.808      1.716
         ROT  0.267E+05              888.752      2.981     23.233
         INT  0.338E+05             1259.804      6.789     24.949
         TR   0.450E+27             1481.254      4.968     38.181
         TOT                        2741.0576    11.7571    63.1293   264.1332

   temp. (K)  partition function   enthalpy   heat capacity  entropy
                                   cal/mol     cal/K/mol   cal/K/mol   J/K/mol
 120.00  VIB   1.01                   10.180      0.454      0.101
         ROT  0.681E+04              357.707      2.981     20.520
         INT  0.686E+04              367.886      3.434     20.621
         TR   0.115E+27              596.178      4.968     33.661
         TOT                         964.0643     8.4026    54.2827   227.1186

   temp. (K)  partition function   enthalpy   heat capacity  entropy
                                   cal/mol     cal/K/mol   cal/K/mol   J/K/mol
 100.00  VIB   1.00                    3.546      0.222      0.041
         ROT  0.518E+04              298.089      2.981     19.977
         INT  0.519E+04              301.635      3.203     20.018
         TR   0.875E+26              496.815      4.968     32.756
         TOT                         798.4498     8.1708    52.7739   220.8062

   temp. (K)  partition function   enthalpy   heat capacity  entropy
                                   cal/mol     cal/K/mol   cal/K/mol   J/K/mol
  80.00  VIB   1.00                    0.757      0.072      0.011
         ROT  0.371E+04              238.471      2.981     19.312
         INT  0.371E+04              239.228      3.053     19.322
         TR   0.626E+26              397.452      4.968     31.648
         TOT                         636.6799     8.0214    50.9701   213.2591

   temp. (K)  partition function   enthalpy   heat capacity  entropy
                                   cal/mol     cal/K/mol   cal/K/mol   J/K/mol
  60.00  VIB   1.00                    0.061      0.010      0.001
         ROT  0.241E+04              178.853      2.981     18.454
         INT  0.241E+04              178.914      2.991     18.455
         TR   0.406E+26              298.089      4.968     30.219
         TOT                         477.0031     7.9592    48.6744   203.6536

   temp. (K)  partition function   enthalpy   heat capacity  entropy
                                   cal/mol     cal/K/mol   cal/K/mol   J/K/mol
  40.00  VIB   1.00                    0.000      0.000     -0.000
         ROT  0.131E+04              119.236      2.981     17.245
         INT  0.131E+04              119.236      2.981     17.245
         TR   0.221E+26              198.726      4.968     28.206
         TOT                         317.9620     7.9492    45.4511   190.1673

   temp. (K)  partition function   enthalpy   heat capacity  entropy
                                   cal/mol     cal/K/mol   cal/K/mol   J/K/mol
  20.00  VIB   1.00                    0.000      0.000     -0.000
         ROT   463.                   59.618      2.981     15.179
         INT   463.                   59.618      2.981     15.179
         TR   0.782E+25               99.363      4.968     24.764
         TOT                         158.9808     7.9490    39.9427   167.1202

   temp. (K)  partition function   enthalpy   heat capacity  entropy
                                   cal/mol     cal/K/mol   cal/K/mol   J/K/mol
  10.00  VIB   1.00                    0.000      0.000     -0.001
         ROT   164.                   29.809      2.981     13.113
         INT   164.                   29.809      2.981     13.112
         TR   0.277E+25               49.681      4.968     21.322
         TOT                          79.4904     7.9490    34.4343   144.0732

       T/K    H(0)-H(T)+PV         H(T)/Eh          T*S/Eh         G(T)/Eh
   ------------------------------------------------------------------------
    298.15    0.436815E-02    0.199226E-01    0.299948E-01   -0.100722E-01
    120.00    0.153633E-02    0.170908E-01    0.103806E-01    0.671021E-02
    100.00    0.127241E-02    0.168269E-01    0.841006E-02    0.841681E-02
     80.00    0.101461E-02    0.165691E-01    0.649809E-02    0.100710E-01
     60.00    0.760153E-03    0.163146E-01    0.465405E-02    0.116606E-01
     40.00    0.506705E-03    0.160612E-01    0.289724E-02    0.131639E-01
     20.00    0.253352E-03    0.158078E-01    0.127305E-02    0.145348E-01
     10.00    0.126676E-03    0.156811E-01    0.548746E-03    0.151324E-01 (used)
   ------------------------------------------------------------------------

         :::::::::::::::::::::::::::::::::::::::::::::::::::::
         ::                  THERMODYNAMIC                  ::
         :::::::::::::::::::::::::::::::::::::::::::::::::::::
         :: total free energy         -10.182406092225 Eh   ::
         ::.................................................::
         :: total energy              -10.197538487939 Eh   ::
         :: zero point energy           0.015554465460 Eh   ::
         :: G(RRHO) w/o ZPVE           -0.000422069747 Eh   ::
         :: G(RRHO) contrib.            0.015132395713 Eh   ::
         :::::::::::::::::::::::::::::::::::::::::::::::::::::
imag cut-off (cm-1) :    5.00
 found            2  significant imaginary frequencies
 writing imag mode distorted coords to xtbhess.xyz
 for further optimization.

optimized geometry written to: xtbopt.xyz


           -------------------------------------------------
          | TOTAL ENERGY              -10.197538487939 Eh   |
          | TOTAL ENTHALPY            -10.181857346463 Eh   |
          | TOTAL FREE ENERGY         -10.182406092225 Eh   |
          | GRADIENT NORM               0.000260583459 Eh/α |
          | HOMO-LUMO GAP               0.774732048146 eV   |
           -------------------------------------------------

------------------------------------------------------------------------
 * finished run on 2020/05/12 at 11:44:36.008     
------------------------------------------------------------------------
 total:
 * wall-time:     0 d,  0 h,  0 min,  0.188 sec
 *  cpu-time:     0 d,  0 h,  0 min,  0.188 sec
 * ratio c/w:     0.999 speedup
 SCF:
 * wall-time:     0 d,  0 h,  0 min,  0.006 sec
 *  cpu-time:     0 d,  0 h,  0 min,  0.006 sec
 * ratio c/w:     1.000 speedup
 ANC optimizer:
 * wall-time:     0 d,  0 h,  0 min,  0.051 sec
 *  cpu-time:     0 d,  0 h,  0 min,  0.051 sec
 * ratio c/w:     0.999 speedup
 numerical hessian:
 * wall-time:     0 d,  0 h,  0 min,  0.112 sec
 *  cpu-time:     0 d,  0 h,  0 min,  0.111 sec
 * ratio c/w:     0.999 speedup

