      -----------------------------------------------------------      
     |                   =====================                   |     
     |                           x T B                           |     
     |                   =====================                   |     
     |                         S. Grimme                         |     
     |          Mulliken Center for Theoretical Chemistry        |     
     |                    University of Bonn                     |     
      -----------------------------------------------------------      

   * xtb version 6.2.2 (9d81278992624c895f80dd42a50cac0aa55982e2) compiled by '@Darwin' on 04/03/2020

   xtb is free software: you can redistribute it and/or modify it under
   the terms of the GNU Lesser General Public License as published by
   the Free Software Foundation, either version 3 of the License, or
   (at your option) any later version.
   
   xtb is distributed in the hope that it will be useful,
   but WITHOUT ANY WARRANTY; without even the implied warranty of
   MERCHANTABILITY or FITNESS FOR A PARTICULAR PURPOSE.  See the
   GNU Lesser General Public License for more details.
   
   Cite this work as:
   * S. Grimme, C. Bannwarth, P. Shushkov, J. Chem. Theory Comput., 2017,
     13, 1989-2009. DOI: 10.1021/acs.jctc.7b00118
   * C. Bannwarth, S. Ehlert and S. Grimme., J. Chem. Theory Comput., 2019,
     15, 1652-1671. DOI: 10.1021/acs.jctc.8b01176
   * P. Pracht, E. Caldeweyher, S. Ehlert, S. Grimme, ChemRxiv, 2019, preprint.
     DOI: 10.26434/chemrxiv.8326202.v1
   
   for DFT-D4:
   * E. Caldeweyher, C. Bannwarth and S. Grimme, J. Chem. Phys., 2017,
     147, 034112. DOI: 10.1063/1.4993215
   * E. Caldeweyher, S. Ehlert, A. Hansen, H. Neugebauer, S. Spicher,
     C. Bannwarth and S. Grimme, J. Chem. Phys., 2019, 150, 154122.
     DOI: 10.1063/1.5090222
   
   for sTDA-xTB:
   * S. Grimme and C. Bannwarth, J. Chem. Phys., 2016, 145, 054103.
     DOI: 10.1063/1.4959605
   
   in the mass-spec context:
   * V. Asgeirsson, C. Bauer and S. Grimme, Chem. Sci., 2017, 8, 4879.
     DOI: 10.1039/c7sc00601b
   
   for metadynamics refer to:
   * S. Grimme, J. Chem. Theory Comput., 2019, 155, 2847-2862
     DOI: 10.1021/acs.jctc.9b00143
   
   with help from (in alphabetical order)
   C. Bannwarth, F. Bohle, G. Brandenburg, E. Caldeweyher, M. Checinski,
   S. Dohm, S. Ehlert, S. Ehrlich, F. März, H. Neugebauer, J. Pisarek,
   P. Pracht, P. Shushkov, and S. Spicher.
   
 * started run on 2020/05/12 at 11:44:57.051     

           -------------------------------------------------
          |                Calculation Setup                |
           -------------------------------------------------

          program call               : xtb --input H1C3N1_17_S_2.input H1C3N1_17_S_2.xyz --ohess --molden --namespace H1C3N1_17_S_2 output.out
          calculation namespace      : H1C3N1_17_S_2
          coordinate file            : H1C3N1_17_S_2.xyz
          number of atoms            :                     5
          number of electrons        :                    18
          charge                     :                     0
          spin                       :                   1.0
          first test random number   :      0.75890160995654

   ID    Z sym.   atoms
    1    6 C      1, 3, 4
    2    7 N      2
    3    1 H      5

           -------------------------------------------------
          |                 G F N 2 - x T B                 |
           -------------------------------------------------

        Reference                      10.1021/acs.jctc.8b01176
      * Hamiltonian:
        H0-scaling (s, p, d)           1.850000    2.230000    2.230000
        zeta-weighting                 0.500000
      * Dispersion:
        s8                             2.700000
        a1                             0.520000
        a2                             5.000000
        s9                             5.000000
      * Repulsion:
        kExp                           1.500000    1.000000
        rExp                           1.000000
      * Coulomb:
        alpha                          2.000000
        third order                    shell-resolved
        anisotropic                    true
        a3                             3.000000
        a5                             4.000000
        cn-shift                       1.200000
        cn-exp                         4.000000
        max-rad                        5.000000


          ...................................................
          :                      SETUP                      :
          :.................................................:
          :  # basis functions                  17          :
          :  # atomic orbitals                  17          :
          :  # shells                            9          :
          :  # electrons                        18          :
          :  max. iterations                   250          :
          :  Hamiltonian                  GFN2-xTB          :
          :  restarted?                      false          :
          :  GBSA solvation                  false          :
          :  PC potential                    false          :
          :  electronic temp.          300.0000000     K    :
          :  accuracy                    1.0000000          :
          :  -> integral cutoff          0.2500000E+02      :
          :  -> integral neglect         0.1000000E-07      :
          :  -> SCF convergence          0.1000000E-05 Eh   :
          :  -> wf. convergence          0.1000000E-03 e    :
          :  Broyden damping             0.4000000          :
          ...................................................

 iter      E             dE          RMSdq      gap      omega  full diag
   1     -9.3186026 -0.931860E+01  0.974E+00    0.49       0.0  T
   2     -8.1379043  0.118070E+01  0.124E+01    0.05       1.0  T
   3     -9.0776326 -0.939728E+00  0.796E+00    0.71       1.0  T
   4     -9.3463755 -0.268743E+00  0.445E+00    0.49       1.0  T
   5     -9.4329243 -0.865488E-01  0.327E+00    0.41       1.0  T
   6     -9.4391646 -0.624028E-02  0.279E+00    0.42       1.0  T
   7     -9.4279586  0.112060E-01  0.291E+00    0.45       1.0  T
   8     -9.4276645  0.294022E-03  0.290E+00    0.46       1.0  T
   9     -9.4468629 -0.191984E-01  0.187E+00    0.22       1.0  T
  10     -9.4457841  0.107880E-02  0.185E+00    0.22       1.0  T
  11     -9.4495291 -0.374497E-02  0.156E+00    0.24       1.0  T
  12     -9.4528073 -0.327824E-02  0.111E+00    0.26       1.0  T
  13     -9.4540685 -0.126118E-02  0.996E-01    0.27       1.0  T
  14     -9.4532959  0.772609E-03  0.110E+00    0.26       1.0  T
  15     -9.4587378 -0.544193E-02  0.999E-02    0.33       1.0  T
  16     -9.4587788 -0.409892E-04  0.578E-02    0.33       1.0  T
  17     -9.4587803 -0.153828E-05  0.161E-02    0.33       2.8  T
  18     -9.4587807 -0.340816E-06  0.671E-03    0.33       6.7  T
  19     -9.4587807  0.245958E-07  0.884E-03    0.33       5.1  T
  20     -9.4587809 -0.236685E-06  0.811E-04    0.33      55.1  T
  21     -9.4587809  0.368396E-07  0.281E-03    0.33      15.9  T
  22     -9.4587809 -0.371065E-07  0.313E-04    0.33     143.0  T

   *** convergence criteria satisfied after 22 iterations ***

         #    Occupation            Energy/Eh            Energy/eV
      -------------------------------------------------------------
         1        2.0000           -0.7280211             -19.8105
       ...           ...                  ...                  ...
         4        2.0000           -0.5819745             -15.8363
         5        2.0000           -0.5565142             -15.1435
         6        2.0000           -0.5045718             -13.7301
         7        2.0000           -0.4727530             -12.8643
         8        1.8863           -0.4268529             -11.6153
         9        1.1137           -0.4229512             -11.5091
        10        0.9983           -0.3915008             -10.6533 (HOMO)
        11        0.0017           -0.3794149             -10.3244 (LUMO)
        12                         -0.2969364              -8.0801
        13                         -0.1199896              -3.2651
        14                          0.0116996               0.3184
        15                          0.0584157               1.5896
       ...                                ...                  ...
        17                          0.2193259               5.9682
      -------------------------------------------------------------
                  HL-Gap            0.0120859 Eh            0.3289 eV
             Fermi-level           -0.4051799 Eh          -11.0255 eV

 transition dipole moment (au) for excitation:           9          10
     X       Y       Z   
  -0.3624   0.0223  -0.1155  total (au/Debye):    0.381   0.969
 dE (eV)             :    0.856
 oscillator strength :  0.43052E-02

 SCC (total)                   0 d,  0 h,  0 min,  0.005 sec
 SCC setup                      ...        0 min,  0.000 sec (  1.382%)
 Dispersion                     ...        0 min,  0.000 sec (  0.251%)
 integral evaluation            ...        0 min,  0.001 sec ( 18.855%)
 zeroth order Hamiltonian       ...        0 min,  0.000 sec (  0.298%)
 iterations                     ...        0 min,  0.002 sec ( 42.008%)
 molecular gradient             ...        0 min,  0.001 sec ( 21.404%)
 printout                       ...        0 min,  0.001 sec ( 15.431%)

         :::::::::::::::::::::::::::::::::::::::::::::::::::::
         ::                     SUMMARY                     ::
         :::::::::::::::::::::::::::::::::::::::::::::::::::::
         :: total energy              -9.391820572260 Eh    ::
         :: gradient norm              0.196356705895 Eh/a0 ::
         :: HOMO-LUMO gap              0.328873469117 eV    ::
         ::.................................................::
         :: SCC energy                -9.458780898413 Eh    ::
         :: -> isotropic ES           -0.013787785915 Eh    ::
         :: -> anisotropic ES          0.000848605892 Eh    ::
         :: -> anisotropic XC          0.007621257090 Eh    ::
         :: -> dispersion             -0.002180672662 Eh    ::
         :: repulsion energy           0.066960307580 Eh    ::
         :: add. restraining           0.000000000000 Eh    ::
         :::::::::::::::::::::::::::::::::::::::::::::::::::::

      ----------------------------------------------------------- 
     |                   =====================                   |
     |                        A N C O P T                        |
     |                   =====================                   |
     |               Approximate Normal Coordinate               |
     |                Rational Function Optimizer                |
      ----------------------------------------------------------- 

          ...................................................
          :                      SETUP                      :
          :.................................................:
          :   optimization level            normal          :
          :   max. optcycles                   200          :
          :   ANC micro-cycles                  20          :
          :   degrees of freedom                 9          :
          :.................................................:
          :   RF solver                   davidson          :
          :   write xtbopt.log                true          :
          :   linear?                        false          :
          :   energy convergence         0.5000000E-05 Eh   :
          :   grad. convergence          0.1000000E-02 Eh/α :
          :   maximium RF displ.         1.0000000          :
          :   Hlow (freq-cutoff)         0.1000000E-01      :
          :   Hmax (freq-cutoff)         5.0000000          :
          :   S6 in model hess.         20.0000000          :
          ...................................................

generating ANC from model Hessian ...
Using Lindh-Hessian (1995)
 Shifting diagonal of input Hessian by    0.0000000000000000     
 Lowest  eigenvalues of input Hessian
   -0.000000   -0.000000   -0.000000    0.000000    0.000000    0.000000
    0.016237    0.065502    0.098027    0.121038    0.789382    0.822063
    0.823944    1.094135    1.472739
 Highest eigenvalues
    0.121038    0.789382    0.822063    0.823944    1.094135    1.472739


........................................................................
.............................. CYCLE    1 ..............................
........................................................................
   1     -9.4587809 -0.945878E+01  0.130E-04    0.33       0.0  T
   2     -9.4587809  0.877467E-10  0.145E-04    0.33     308.9  T
   3     -9.4587809  0.329830E-09  0.240E-04    0.33     186.0  T
     SCC iter.                  ...        0 min,  0.001 sec
     gradient                   ...        0 min,  0.001 sec
 * total energy  :    -9.3918206 Eh     change        0.5231778E-08 Eh
   gradient norm :     0.1963579 Eh/α   predicted     0.0000000E+00 (-100.00%)
   displ. norm   :     0.3350667 α      lambda       -0.4714767E-01
   maximum displ.:     0.2629205 α      in ANC's #4, #8, #7, ...

........................................................................
.............................. CYCLE    2 ..............................
........................................................................
   1     -9.5264504 -0.952645E+01  0.292E+00    0.48       0.0  T
   2     -9.5111884  0.152620E-01  0.228E+00    0.62       1.0  T
   3     -9.4781686  0.330198E-01  0.290E+00    0.40       1.0  T
   4     -9.5289484 -0.507798E-01  0.546E-01    0.51       1.0  T
   5     -9.5304854 -0.153701E-02  0.284E-01    0.51       1.0  T
   6     -9.5307375 -0.252072E-03  0.202E-01    0.50       1.0  T
   7     -9.5306993  0.381761E-04  0.184E-01    0.51       1.0  T
   8     -9.5308358 -0.136503E-03  0.883E-03    0.49       5.1  T
   9     -9.5308359 -0.719729E-07  0.314E-03    0.49      14.2  T
  10     -9.5308359 -0.377012E-08  0.115E-03    0.49      39.0  T
  11     -9.5308359 -0.265062E-08  0.184E-04    0.49     243.2  T
  12     -9.5308359 -0.124647E-10  0.470E-05    0.49     951.2  T
     SCC iter.                  ...        0 min,  0.001 sec
     gradient                   ...        0 min,  0.001 sec
 * total energy  :    -9.4381753 Eh     change       -0.4635475E-01 Eh
   gradient norm :     0.1689891 Eh/α   predicted    -0.2622046E-01 ( -43.44%)
   displ. norm   :     0.7720472 α      lambda       -0.1115621E+00
   maximum displ.:     0.5330471 α      in ANC's #4, #8, #7, ...

........................................................................
.............................. CYCLE    3 ..............................
........................................................................
   1     -9.7242970 -0.972430E+01  0.511E+00    1.27       0.0  T
   2     -9.7259392 -0.164221E-02  0.298E+00    1.26       1.0  T
   3     -9.7228184  0.312080E-02  0.902E-01    1.23       1.0  T
   4     -9.7263127 -0.349430E-02  0.290E-01    1.25       1.0  T
   5     -9.7265888 -0.276151E-03  0.155E-01    1.24       1.0  T
   6     -9.7266272 -0.383406E-04  0.805E-02    1.24       1.0  T
   7     -9.7266524 -0.252402E-04  0.133E-02    1.24       3.4  T
   8     -9.7266525 -0.105414E-06  0.455E-03    1.24       9.8  T
   9     -9.7266526 -0.552959E-07  0.137E-03    1.24      32.7  T
  10     -9.7266526 -0.498118E-08  0.171E-04    1.24     262.2  T
  11     -9.7266526 -0.412488E-10  0.939E-05    1.24     476.5  T
     SCC iter.                  ...        0 min,  0.001 sec
     gradient                   ...        0 min,  0.001 sec
 * total energy  :    -9.4178465 Eh     change        0.2032883E-01 Eh
   gradient norm :     0.5712743 Eh/α   predicted    -0.8902971E-01 (-537.95%)
   displ. norm   :     0.3139458 α      lambda       -0.1674256E+00
   maximum displ.:     0.2226878 α      in ANC's #8, #7, #4, ...

........................................................................
.............................. CYCLE    4 ..............................
........................................................................
   1     -9.6094916 -0.960949E+01  0.215E+00    1.42       0.0  T
   2     -9.6104355 -0.943885E-03  0.134E+00    1.47       1.0  T
   3     -9.6063134  0.412207E-02  0.806E-01    1.45       1.0  T
   4     -9.6094600 -0.314661E-02  0.495E-01    1.48       1.0  T
   5     -9.6108790 -0.141902E-02  0.865E-02    1.48       1.0  T
   6     -9.6108304  0.486467E-04  0.999E-02    1.48       1.0  T
   7     -9.6108957 -0.652945E-04  0.117E-02    1.48       3.8  T
   8     -9.6108961 -0.427878E-06  0.381E-03    1.48      11.7  T
   9     -9.6108961 -0.986083E-08  0.730E-04    1.48      61.3  T
  10     -9.6108961  0.811085E-11  0.270E-04    1.48     165.4  T
     SCC iter.                  ...        0 min,  0.001 sec
     gradient                   ...        0 min,  0.001 sec
 * total energy  :    -9.4802503 Eh     change       -0.6240380E-01 Eh
   gradient norm :     0.0960410 Eh/α   predicted    -0.9196365E-01 (  47.37%)
   displ. norm   :     0.2600981 α      lambda       -0.1320206E-01
   maximum displ.:     0.1798334 α      in ANC's #1, #4, #5, ...

........................................................................
.............................. CYCLE    5 ..............................
........................................................................
   1     -9.6262292 -0.962623E+01  0.130E+00    1.96       0.0  T
   2     -9.6268489 -0.619654E-03  0.755E-01    1.90       1.0  T
   3     -9.6270523 -0.203448E-03  0.617E-01    1.90       1.0  T
   4     -9.6280834 -0.103103E-02  0.321E-01    1.91       1.0  T
   5     -9.6282359 -0.152528E-03  0.242E-01    1.90       1.0  T
   6     -9.6286816 -0.445745E-03  0.217E-02    1.90       2.1  T
   7     -9.6286818 -0.202655E-06  0.357E-03    1.90      12.5  T
   8     -9.6286818 -0.147098E-07  0.156E-03    1.90      28.6  T
   9     -9.6286818 -0.402381E-08  0.211E-04    1.90     211.5  T
  10     -9.6286818 -0.764011E-10  0.465E-05    1.90     961.7  T
     SCC iter.                  ...        0 min,  0.001 sec
     gradient                   ...        0 min,  0.001 sec
 * total energy  :    -9.4884169 Eh     change       -0.8166618E-02 Eh
   gradient norm :     0.0656534 Eh/α   predicted    -0.7047591E-02 ( -13.70%)
   displ. norm   :     0.2540955 α      lambda       -0.1131204E-01
   maximum displ.:     0.1548552 α      in ANC's #5, #3, #4, ...

........................................................................
.............................. CYCLE    6 ..............................
........................................................................
   1     -9.6453710 -0.964537E+01  0.129E+00    2.48       0.0  T
   2     -9.6451217  0.249287E-03  0.767E-01    2.44       1.0  T
   3     -9.6437668  0.135485E-02  0.746E-01    2.45       1.0  T
   4     -9.6457492 -0.198240E-02  0.294E-01    2.45       1.0  T
   5     -9.6462032 -0.453967E-03  0.148E-01    2.45       1.0  T
   6     -9.6463598 -0.156619E-03  0.289E-02    2.45       1.5  T
   7     -9.6463601 -0.234362E-06  0.418E-03    2.45      10.7  T
   8     -9.6463601 -0.329957E-08  0.172E-03    2.45      26.1  T
   9     -9.6463601 -0.347944E-08  0.455E-04    2.45      98.4  T
  10     -9.6463601 -0.822578E-10  0.486E-05    2.45     919.3  T
     SCC iter.                  ...        0 min,  0.001 sec
     gradient                   ...        0 min,  0.001 sec
 * total energy  :    -9.4966021 Eh     change       -0.8185169E-02 Eh
   gradient norm :     0.0440649 Eh/α   predicted    -0.6021199E-02 ( -26.44%)
   displ. norm   :     0.2471895 α      lambda       -0.7619417E-02
   maximum displ.:     0.1780434 α      in ANC's #5, #4, #8, ...

........................................................................
.............................. CYCLE    7 ..............................
........................................................................
   1     -9.6548420 -0.965484E+01  0.121E+00    2.70       0.0  T
   2     -9.6547955  0.464510E-04  0.685E-01    2.69       1.0  T
   3     -9.6525929  0.220262E-02  0.647E-01    2.71       1.0  T
   4     -9.6550791 -0.248622E-02  0.877E-02    2.70       1.0  T
   5     -9.6550783  0.803430E-06  0.780E-02    2.70       1.0  T
   6     -9.6551114 -0.330852E-04  0.150E-02    2.70       3.0  T
   7     -9.6551128 -0.138882E-05  0.323E-03    2.70      13.8  T
   8     -9.6551128 -0.337961E-08  0.124E-03    2.70      36.1  T
   9     -9.6551128 -0.271474E-08  0.350E-04    2.70     127.6  T
  10     -9.6551128 -0.780371E-10  0.421E-05    2.70    1062.5  T
     SCC iter.                  ...        0 min,  0.001 sec
     gradient                   ...        0 min,  0.001 sec
 * total energy  :    -9.5009685 Eh     change       -0.4366425E-02 Eh
   gradient norm :     0.0234864 Eh/α   predicted    -0.4042488E-02 (  -7.42%)
   displ. norm   :     0.3308715 α      lambda       -0.2703042E-02
   maximum displ.:     0.2996977 α      in ANC's #1, #5, #4, ...

........................................................................
.............................. CYCLE    8 ..............................
........................................................................
   1     -9.6395966 -0.963960E+01  0.103E+00    2.87       0.0  T
   2     -9.6397437 -0.147177E-03  0.635E-01    2.88       1.0  T
   3     -9.6385603  0.118348E-02  0.391E-01    2.90       1.0  T
   4     -9.6396913 -0.113100E-02  0.166E-01    2.88       1.0  T
   5     -9.6397892 -0.979089E-04  0.878E-02    2.89       1.0  T
   6     -9.6398261 -0.369029E-04  0.393E-02    2.89       1.1  T
   7     -9.6398323 -0.620561E-05  0.725E-03    2.90       6.2  T
   8     -9.6398323 -0.232153E-07  0.102E-03    2.90      43.8  T
   9     -9.6398323 -0.378174E-09  0.458E-04    2.90      97.6  T
  10     -9.6398323 -0.606821E-10  0.385E-05    2.90    1161.5  T
     SCC iter.                  ...        0 min,  0.001 sec
     gradient                   ...        0 min,  0.001 sec
 * total energy  :    -9.4987459 Eh     change        0.2222571E-02 Eh
   gradient norm :     0.0608189 Eh/α   predicted    -0.1499480E-02 (-167.47%)
   displ. norm   :     0.1821663 α      lambda       -0.7048913E-02
   maximum displ.:     0.1474103 α      in ANC's #1, #4, #2, ...

........................................................................
.............................. CYCLE    9 ..............................
........................................................................
   1     -9.6625549 -0.966255E+01  0.737E-01    2.81       0.0  T
   2     -9.6628670 -0.312131E-03  0.382E-01    2.82       1.0  T
   3     -9.6626273  0.239675E-03  0.341E-01    2.87       1.0  T
   4     -9.6627636 -0.136299E-03  0.190E-01    2.83       1.0  T
   5     -9.6629127 -0.149014E-03  0.113E-01    2.82       1.0  T
   6     -9.6630046 -0.919029E-04  0.263E-02    2.84       1.7  T
   7     -9.6630063 -0.178310E-05  0.437E-03    2.84      10.2  T
   8     -9.6630063 -0.768668E-08  0.905E-04    2.84      49.4  T
   9     -9.6630063 -0.229818E-09  0.308E-04    2.84     145.3  T
     SCC iter.                  ...        0 min,  0.001 sec
     gradient                   ...        0 min,  0.001 sec
 * total energy  :    -9.5019144 Eh     change       -0.3168445E-02 Eh
   gradient norm :     0.0116837 Eh/α   predicted    -0.3641409E-02 (  14.93%)
   displ. norm   :     0.0388833 α      lambda       -0.3122083E-03
   maximum displ.:     0.0346813 α      in ANC's #4, #1, #5, ...

........................................................................
.............................. CYCLE   10 ..............................
........................................................................
   1     -9.6602245 -0.966022E+01  0.261E-01    2.82       0.0  T
   2     -9.6602203  0.413099E-05  0.157E-01    2.85       1.0  T
   3     -9.6602784 -0.580627E-04  0.116E-01    2.82       1.0  T
   4     -9.6603238 -0.454434E-04  0.452E-02    2.84       1.0  T
   5     -9.6603202  0.359488E-05  0.439E-02    2.83       1.0  T
   6     -9.6603346 -0.143896E-04  0.358E-03    2.84      12.5  T
   7     -9.6603346 -0.697810E-08  0.565E-04    2.84      79.1  T
   8     -9.6603346 -0.117192E-09  0.288E-04    2.84     155.4  T
     SCC iter.                  ...        0 min,  0.001 sec
     gradient                   ...        0 min,  0.001 sec
 * total energy  :    -9.5020359 Eh     change       -0.1214837E-03 Eh
   gradient norm :     0.0065745 Eh/α   predicted    -0.1563411E-03 (  28.69%)
   displ. norm   :     0.0182506 α      lambda       -0.5868700E-04
   maximum displ.:     0.0149207 α      in ANC's #1, #6, #4, ...

........................................................................
.............................. CYCLE   11 ..............................
........................................................................
   1     -9.6612767 -0.966128E+01  0.634E-02    2.84       0.0  T
   2     -9.6612754  0.125068E-05  0.442E-02    2.84       1.0  T
   3     -9.6612762 -0.782598E-06  0.332E-02    2.84       1.3  T
   4     -9.6612779 -0.170071E-05  0.212E-02    2.84       2.1  T
   5     -9.6612803 -0.242108E-05  0.981E-03    2.84       4.6  T
   6     -9.6612810 -0.621874E-06  0.187E-03    2.84      23.9  T
   7     -9.6612810 -0.175887E-08  0.322E-04    2.84     138.9  T
   8     -9.6612810 -0.574776E-10  0.513E-05    2.84     871.0  T
     SCC iter.                  ...        0 min,  0.001 sec
     gradient                   ...        0 min,  0.001 sec
 * total energy  :    -9.5020771 Eh     change       -0.4126415E-04 Eh
   gradient norm :     0.0034494 Eh/α   predicted    -0.2935412E-04 ( -28.86%)
   displ. norm   :     0.0230578 α      lambda       -0.4267358E-04
   maximum displ.:     0.0149362 α      in ANC's #1, #2, #6, ...

........................................................................
.............................. CYCLE   12 ..............................
........................................................................
   1     -9.6622194 -0.966222E+01  0.740E-02    2.83       0.0  T
   2     -9.6622149  0.455135E-05  0.500E-02    2.83       1.0  T
   3     -9.6621932  0.217006E-04  0.666E-02    2.83       1.0  T
   4     -9.6622215 -0.283080E-04  0.538E-03    2.83       8.3  T
   5     -9.6622215 -0.261443E-07  0.298E-03    2.83      15.0  T
   6     -9.6622215  0.291321E-07  0.259E-03    2.83      17.3  T
   7     -9.6622215 -0.406144E-07  0.280E-04    2.83     159.7  T
   8     -9.6622215 -0.118236E-09  0.499E-05    2.83     896.9  T
     SCC iter.                  ...        0 min,  0.001 sec
     gradient                   ...        0 min,  0.001 sec
 * total energy  :    -9.5021064 Eh     change       -0.2926593E-04 Eh
   gradient norm :     0.0031374 Eh/α   predicted    -0.2134791E-04 ( -27.06%)
   displ. norm   :     0.0166531 α      lambda       -0.2532540E-04
   maximum displ.:     0.0103895 α      in ANC's #2, #6, #1, ...

........................................................................
.............................. CYCLE   13 ..............................
........................................................................
   1     -9.6624492 -0.966245E+01  0.693E-02    2.81       0.0  T
   2     -9.6624426  0.664281E-05  0.513E-02    2.82       1.0  T
   3     -9.6624319  0.106492E-04  0.576E-02    2.81       1.0  T
   4     -9.6624509 -0.190164E-04  0.108E-02    2.81       4.1  T
   5     -9.6624516 -0.692251E-06  0.345E-03    2.81      13.0  T
   6     -9.6624516 -0.116600E-07  0.431E-04    2.81     103.7  T
   7     -9.6624516 -0.332506E-09  0.207E-04    2.81     216.3  T
     SCC iter.                  ...        0 min,  0.001 sec
     gradient                   ...        0 min,  0.001 sec
 * total energy  :    -9.5021235 Eh     change       -0.1715922E-04 Eh
   gradient norm :     0.0028454 Eh/α   predicted    -0.1266539E-04 ( -26.19%)
   displ. norm   :     0.0098976 α      lambda       -0.1139555E-04
   maximum displ.:     0.0053803 α      in ANC's #2, #5, #6, ...

........................................................................
.............................. CYCLE   14 ..............................
........................................................................
   1     -9.6621704 -0.966217E+01  0.474E-02    2.80       0.0  T
   2     -9.6621670  0.336158E-05  0.374E-02    2.80       1.2  T
   3     -9.6621666  0.400877E-06  0.329E-02    2.79       1.4  T
   4     -9.6621703 -0.374219E-05  0.166E-02    2.80       2.7  T
   5     -9.6621722 -0.185128E-05  0.320E-03    2.80      14.0  T
   6     -9.6621722 -0.303855E-07  0.153E-03    2.80      29.1  T
   7     -9.6621722 -0.337537E-08  0.186E-04    2.80     240.8  T
   8     -9.6621722 -0.515392E-10  0.366E-05    2.80    1220.3  T
     SCC iter.                  ...        0 min,  0.001 sec
     gradient                   ...        0 min,  0.001 sec
 * total energy  :    -9.5021305 Eh     change       -0.6947236E-05 Eh
   gradient norm :     0.0013734 Eh/α   predicted    -0.5699399E-05 ( -17.96%)
   displ. norm   :     0.0053549 α      lambda       -0.2023638E-05
   maximum displ.:     0.0033575 α      in ANC's #1, #5, #2, ...

........................................................................
.............................. CYCLE   15 ..............................
........................................................................
   1     -9.6618000 -0.966180E+01  0.210E-02    2.79       0.0  T
   2     -9.6617999  0.190538E-06  0.147E-02    2.79       3.1  T
   3     -9.6617988  0.107987E-05  0.151E-02    2.79       3.0  T
   4     -9.6618000 -0.118234E-05  0.636E-03    2.79       7.0  T
   5     -9.6618002 -0.251426E-06  0.187E-03    2.79      23.9  T
   6     -9.6618002 -0.150143E-07  0.880E-04    2.79      50.8  T
   7     -9.6618002 -0.181416E-08  0.117E-04    2.79     383.3  T
     SCC iter.                  ...        0 min,  0.001 sec
     gradient                   ...        0 min,  0.001 sec
 * total energy  :    -9.5021316 Eh     change       -0.1137358E-05 Eh
   gradient norm :     0.0005242 Eh/α   predicted    -0.1011045E-05 ( -11.11%)
   displ. norm   :     0.0018950 α      lambda       -0.3098620E-06
   maximum displ.:     0.0009054 α      in ANC's #2, #6, #1, ...

   *** GEOMETRY OPTIMIZATION CONVERGED AFTER 15 ITERATIONS ***

------------------------------------------------------------------------
 total energy gain   :        -0.1103111 Eh      -69.2212 kcal/mol
 total RMSD          :         0.6524690 a0        0.3453 Å
 total power (kW/mol):       -19.3081097 (step)-6691.5352 (real)
------------------------------------------------------------------------

 ANCopt (total)                0 d,  0 h,  0 min,  0.043 sec
 optimizer setup                ...        0 min,  0.000 sec (  0.155%)
 model hessian                  ...        0 min,  0.000 sec (  0.200%)
 ANC generation                 ...        0 min,  0.000 sec (  0.169%)
 coordinate transformation      ...        0 min,  0.000 sec (  0.077%)
 single point calculation       ...        0 min,  0.042 sec ( 96.726%)
 optimization log               ...        0 min,  0.000 sec (  0.882%)
 hessian update                 ...        0 min,  0.000 sec (  0.078%)
 rational function              ...        0 min,  0.000 sec (  0.764%)

================
 final structure:
================
5
 xtb: 6.2.2 (9d81278992624c895f80dd42a50cac0aa55982e2)
C         1.05509955889453   -0.37516635499608   -0.02773838094641
N        -0.13507079867132   -0.12680123536387   -0.01009319397774
C        -1.32084026114134    0.75700961423071    0.05472055191055
C        -1.49664951685833   -0.53929744245781   -0.04274177905136
H         1.89746101777646    0.28425541858705    0.02585280206496

 Bond Distances (Angstroems)
 ---------------------------
C1-N2=1.2159         C1-H5=1.0711         N2-C1=1.2159         N2-C3=1.4803         N2-C4=1.4231         C3-N2=1.4803         
C3-C4=1.3118         C4-N2=1.4231         C4-C3=1.3118         H5-C1=1.0711         
 C  H  Rav=1.0711 sigma=0.0000  Rmin=1.0711  Rmax=1.0711     1
 C  C  Rav=1.3118 sigma=0.0000  Rmin=1.3118  Rmax=1.3118     1
 N  C  Rav=1.3731 sigma=0.1136  Rmin=1.2159  Rmax=1.4803     3

 selected bond angles (degree)
 --------------------
H5-C1-N2=130.04                C3-N2-C1=155.04                C4-N2-C1=151.28                C4-N2-C3= 53.68                
C4-C3-N2= 60.93                C3-C4-N2= 65.39                

 selected dihedral angles (degree)
 ---------------------------------
C3-N2-C1-H5=  0.28            C4-N2-C1-H5=180.19            C4-C3-N2-C1=179.94            C3-C4-N2-C1=180.05            
           -------------------------------------------------
          |                Final Singlepoint                |
           -------------------------------------------------

          ...................................................
          :                      SETUP                      :
          :.................................................:
          :  # basis functions                  17          :
          :  # atomic orbitals                  17          :
          :  # shells                            9          :
          :  # electrons                        18          :
          :  max. iterations                   250          :
          :  Hamiltonian                  GFN2-xTB          :
          :  restarted?                      false          :
          :  GBSA solvation                  false          :
          :  PC potential                    false          :
          :  electronic temp.          300.0000000     K    :
          :  accuracy                    1.0000000          :
          :  -> integral cutoff          0.2500000E+02      :
          :  -> integral neglect         0.1000000E-07      :
          :  -> SCF convergence          0.1000000E-05 Eh   :
          :  -> wf. convergence          0.1000000E-03 e    :
          :  Broyden damping             0.4000000          :
          ...................................................

 iter      E             dE          RMSdq      gap      omega  full diag
   1     -9.6618002 -0.966180E+01  0.219E-05    2.79       0.0  T
   2     -9.6618002 -0.124345E-13  0.134E-05    2.79    3325.4  T
   3     -9.6618002  0.710543E-12  0.106E-05    2.79    4210.7  T

   *** convergence criteria satisfied after 3 iterations ***

         #    Occupation            Energy/Eh            Energy/eV
      -------------------------------------------------------------
         1        2.0000           -0.7132666             -19.4090
       ...           ...                  ...                  ...
         4        2.0000           -0.5628335             -15.3155
         5        2.0000           -0.5600120             -15.2387
         6        2.0000           -0.5215932             -14.1933
         7        2.0000           -0.4589312             -12.4882
         8        2.0000           -0.4188850             -11.3984
         9        1.0000           -0.3847134             -10.4686
        10        1.0000           -0.3494443              -9.5089 (HOMO)
        11                         -0.2470027              -6.7213 (LUMO)
        12                         -0.2351718              -6.3994
        13                         -0.0648142              -1.7637
        14                         -0.0359000              -0.9769
        15                          0.2364552               6.4343
       ...                                ...                  ...
        17                          0.7589300              20.6515
      -------------------------------------------------------------
                  HL-Gap            0.1024416 Eh            2.7876 eV
             Fermi-level           -0.3500113 Eh           -9.5243 eV

 transition dipole moment (au) for excitation:           9          10
     X       Y       Z   
  -0.4956  -0.2294  -0.0181  total (au/Debye):    0.546   1.389
 dE (eV)             :    0.960
 oscillator strength :  0.99284E-02

 SCC (total)                   0 d,  0 h,  0 min,  0.003 sec
 SCC setup                      ...        0 min,  0.000 sec (  1.263%)
 Dispersion                     ...        0 min,  0.000 sec (  0.360%)
 integral evaluation            ...        0 min,  0.001 sec ( 30.221%)
 zeroth order Hamiltonian       ...        0 min,  0.000 sec (  0.438%)
 iterations                     ...        0 min,  0.001 sec ( 16.254%)
 molecular gradient             ...        0 min,  0.001 sec ( 28.273%)
 printout                       ...        0 min,  0.001 sec ( 22.944%)

         :::::::::::::::::::::::::::::::::::::::::::::::::::::
         ::                     SUMMARY                     ::
         :::::::::::::::::::::::::::::::::::::::::::::::::::::
         :: total energy              -9.502131630676 Eh    ::
         :: gradient norm              0.000538466202 Eh/a0 ::
         :: HOMO-LUMO gap              2.787577796669 eV    ::
         ::.................................................::
         :: SCC energy                -9.661800221577 Eh    ::
         :: -> isotropic ES           -0.006255725215 Eh    ::
         :: -> anisotropic ES          0.001425852250 Eh    ::
         :: -> anisotropic XC          0.008476624538 Eh    ::
         :: -> dispersion             -0.002163269215 Eh    ::
         :: repulsion energy           0.159668598241 Eh    ::
         :: add. restraining           0.000000000000 Eh    ::
         :::::::::::::::::::::::::::::::::::::::::::::::::::::

           ------------------------------------------------- 
          |                Numerical Hessian                |
           ------------------------------------------------- 
step length          :   0.00500
SCC accuracy         :   0.30000
Hessian scale factor :   1.00000
frozen atoms in %    :   0.00000    0
RMS gradient         :   0.00054
estimated CPU  time      0.00 min
estimated wall time      0.00 min

writing file <hessian>.

 projected vibrational frequencies (cm-1)
eigval :       -0.00    -0.00    -0.00     0.00     0.00     0.00
eigval :      349.81   373.78   568.01   589.02   866.23   900.40
eigval :     1670.11  1954.36  3093.20
           -------------------------------------------------
          |                Property Printout                |
           -------------------------------------------------

    * Orbital Energies and Occupations

         #    Occupation            Energy/Eh            Energy/eV
      -------------------------------------------------------------
         1        2.0000           -0.7132666             -19.4090
         2        2.0000           -0.6729424             -18.3117
         3        2.0000           -0.5899673             -16.0538
         4        2.0000           -0.5628335             -15.3155
         5        2.0000           -0.5600120             -15.2387
         6        2.0000           -0.5215932             -14.1933
         7        2.0000           -0.4589312             -12.4882
         8        2.0000           -0.4188850             -11.3984
         9        1.0000           -0.3847134             -10.4686
        10        1.0000           -0.3494443              -9.5089 (HOMO)
        11                         -0.2470027              -6.7213 (LUMO)
        12                         -0.2351717              -6.3993
        13                         -0.0648143              -1.7637
        14                         -0.0358999              -0.9769
        15                          0.2364552               6.4343
        16                          0.5647808              15.3685
        17                          0.7589300              20.6515
      -------------------------------------------------------------
                  HL-Gap            0.1024415 Eh            2.7876 eV
             Fermi-level           -0.3500114 Eh           -9.5243 eV

     #   Z        covCN         q      C6AA      α(0)
     1   6 C      1.839    -0.085    33.486     9.348
     2   7 N      2.724     0.108    19.387     6.539
     3   6 C      1.887    -0.069    33.010     9.279
     4   6 C      1.891    -0.044    32.291     9.178
     5   1 H      0.926     0.090     1.882     2.145

 Mol. C6AA /au·bohr⁶  :        527.576024
 Mol. C8AA /au·bohr⁸  :      13907.953977
 Mol. α(0) /au        :         36.489925


Wiberg/Mayer (AO) data.
largest (>0.10) Wiberg bond orders for each atom
          total WBO             WBO to atom ...
     1  C   3.203        N    2 1.960    H    5 0.920    C    3 0.181    C    4 0.142
     2  N   3.627        C    1 1.960    C    4 0.897    C    3 0.767
     3  C   2.765        C    4 1.816    N    2 0.767    C    1 0.181
     4  C   2.873        C    3 1.816    N    2 0.897    C    1 0.142
     5  H   0.943        C    1 0.920
Molecule has the following symmetry elements: (sigma) 
It seems to be the Cs point group

MOs/occ written to file <molden.input>


molecular dipole:
                 x           y           z       tot (Debye)
 q only:        0.422       0.028       0.003
   full:        0.803       0.125       0.011       2.066
molecular quadrupole (traceless):
                xx          xy          yy          xz          yz          zz
 q only:        0.142       0.632      -0.218       0.050      -0.021       0.077
  q+dip:       -1.169       2.152       0.780       0.166       0.034       0.388
   full:       -1.719       1.837      -0.129       0.138      -0.147       1.849

           -------------------------------------------------
          |                Geometry Summary                 |
           -------------------------------------------------

      molecular mass/u    :       51.0468517
   center of mass at/Å    :       -0.4142663      -0.0662251      -0.0059655
  moments of inertia/u·Å² :        0.1091103E+02   0.5765833E+02   0.6856934E+02
rotational constants/cm⁻¹ :        0.1545009E+01   0.2923712E+00   0.2458480E+00

 * 2 selected distances

     #   Z        #   Z                                     value/Å
     1   6 C      2   7 N                                 1.2159367 (min)
     3   6 C      4   6 C                                 1.3118002 (max)

 * 2 distinct bonds (by element types)

   Z      Z             #   av. dist./Å        max./Å        min./Å
   6 C    6 C           1     1.3118002     1.3118002     1.3118002
   6 C    7 N           1     1.2159367     1.2159367     1.2159367

           -------------------------------------------------
          |               Frequency Printout                |
           -------------------------------------------------
 projected vibrational frequencies (cm-1)
eigval :       -0.00    -0.00    -0.00     0.00     0.00     0.00
eigval :      349.81   373.78   568.01   589.02   866.23   900.40
eigval :     1670.11  1954.36  3093.20
 reduced masses (amu)
   1: 12.33   2: 11.83   3: 11.70   4: 12.24   5: 11.90   6: 10.75   7: 11.27   8: 13.38
   9: 12.40  10:  2.76  11:  5.96  12:  9.83  13: 12.02  14: 12.80  15:  1.96
 IR intensities (amu)
   1:  0.03   2:  0.11   3:  0.14   4:  0.10   5:  0.08   6:  0.06   7:  0.19   8:  0.30
   9:  0.51  10:  0.21  11:  0.37  12:  0.49  13:  0.53  14:  0.76  15:  0.05
 Raman intensities (amu)
   1:  0.00   2:  0.00   3:  0.00   4:  0.00   5:  0.00   6:  0.00   7:  0.00   8:  0.00
   9:  0.00  10:  0.00  11:  0.00  12:  0.00  13:  0.00  14:  0.00  15:  0.00
 output can be read by thermo (or use thermo option).
 writing <g98.out> molden fake output.
 recommended (thermochemical) frequency scaling factor: 1.0
           -------------------------------------------------
          |             Thermodynamic Functions             |
           -------------------------------------------------

cs  symmetry found (for desy threshold:  0.10E+00) used in thermo

          ...................................................
          :                      SETUP                      :
          :.................................................:
          :  # frequencies                           9      :
          :  # imaginary freq.                       0      :
          :  linear?                             false      :
          :  only rotor calc.                    false      :
          :  symmetry                               cs      :
          :  rotational number                       1      :
          :  scaling factor                  1.0000000      :
          :  rotor cutoff                   50.0000000 cm⁻¹ :
          :  imag. cutoff                  -20.0000000 cm⁻¹ :
          :.................................................:

    mode    ω/cm⁻¹     T·S(HO)/kcal·mol⁻¹    T·S(FR)/kcal·mol⁻¹   T·S(vib)
   ------------------------------------------------------------------------
   ------------------------------------------------------------------------

   temp. (K)  partition function   enthalpy   heat capacity  entropy
                                   cal/mol     cal/K/mol   cal/K/mol   J/K/mol
 298.15  VIB   1.72                  728.032      6.360      3.515
         ROT  0.159E+05              888.752      2.981     22.202
         INT  0.272E+05             1616.784      9.341     25.717
         TR   0.353E+27             1481.254      4.968     37.697
         TOT                        3098.0384    14.3089    63.4134   265.3216

   temp. (K)  partition function   enthalpy   heat capacity  entropy
                                   cal/mol     cal/K/mol   cal/K/mol   J/K/mol
 120.00  VIB   1.03                   30.916      1.204      0.315
         ROT  0.405E+04              357.707      2.981     19.489
         INT  0.417E+04              388.623      4.185     19.803
         TR   0.901E+26              596.178      4.968     33.177
         TOT                         984.8007     9.1529    52.9807   221.6712

   temp. (K)  partition function   enthalpy   heat capacity  entropy
                                   cal/mol     cal/K/mol   cal/K/mol   J/K/mol
 100.00  VIB   1.01                   12.348      0.670      0.147
         ROT  0.308E+04              298.089      2.981     18.945
         INT  0.312E+04              310.437      3.651     19.092
         TR   0.685E+26              496.815      4.968     32.272
         TOT                         807.2516     8.6187    51.3640   214.9068

   temp. (K)  partition function   enthalpy   heat capacity  entropy
                                   cal/mol     cal/K/mol   cal/K/mol   J/K/mol
  80.00  VIB   1.00                    3.247      0.268      0.047
         ROT  0.221E+04              238.471      2.981     18.280
         INT  0.221E+04              241.718      3.249     18.327
         TR   0.490E+26              397.452      4.968     31.164
         TOT                         639.1700     8.2170    49.4907   207.0691

   temp. (K)  partition function   enthalpy   heat capacity  entropy
                                   cal/mol     cal/K/mol   cal/K/mol   J/K/mol
  60.00  VIB   1.00                    0.368      0.053      0.007
         ROT  0.143E+04              178.853      2.981     17.422
         INT  0.143E+04              179.221      3.034     17.429
         TR   0.319E+26              298.089      4.968     29.735
         TOT                         477.3101     8.0021    47.1644   197.3359

   temp. (K)  partition function   enthalpy   heat capacity  entropy
                                   cal/mol     cal/K/mol   cal/K/mol   J/K/mol
  40.00  VIB   1.00                    0.005      0.002     -0.000
         ROT   780.                  119.236      2.981     16.214
         INT   780.                  119.241      2.982     16.213
         TR   0.173E+26              198.726      4.968     27.722
         TOT                         317.9666     7.9506    43.9353   183.8252

   temp. (K)  partition function   enthalpy   heat capacity  entropy
                                   cal/mol     cal/K/mol   cal/K/mol   J/K/mol
  20.00  VIB   1.00                    0.000      0.000     -0.001
         ROT   276.                   59.618      2.981     14.148
         INT   276.                   59.618      2.981     14.147
         TR   0.613E+25               99.363      4.968     24.280
         TOT                         158.9808     7.9490    38.4264   160.7760

   temp. (K)  partition function   enthalpy   heat capacity  entropy
                                   cal/mol     cal/K/mol   cal/K/mol   J/K/mol
  10.00  VIB   1.00                    0.000      0.000     -0.002
         ROT   97.5                   29.809      2.981     12.081
         INT   97.5                   29.809      2.981     12.080
         TR   0.217E+25               49.681      4.968     20.838
         TOT                          79.4904     7.9490    32.9176   137.7273

       T/K    H(0)-H(T)+PV         H(T)/Eh          T*S/Eh         G(T)/Eh
   ------------------------------------------------------------------------
    298.15    0.493704E-02    0.285500E-01    0.301297E-01   -0.157971E-02
    120.00    0.156938E-02    0.251824E-01    0.101316E-01    0.150508E-01
    100.00    0.128644E-02    0.248994E-01    0.818537E-02    0.167141E-01
     80.00    0.101858E-02    0.246316E-01    0.630948E-02    0.183221E-01
     60.00    0.760642E-03    0.243736E-01    0.450968E-02    0.198640E-01
     40.00    0.506712E-03    0.241197E-01    0.280061E-02    0.213191E-01
     20.00    0.253352E-03    0.238663E-01    0.122473E-02    0.226416E-01
     10.00    0.126676E-03    0.237397E-01    0.524575E-03    0.232151E-01 (used)
   ------------------------------------------------------------------------

         :::::::::::::::::::::::::::::::::::::::::::::::::::::
         ::                  THERMODYNAMIC                  ::
         :::::::::::::::::::::::::::::::::::::::::::::::::::::
         :: total free energy          -9.478916532291 Eh   ::
         ::.................................................::
         :: total energy               -9.502131630547 Eh   ::
         :: zero point energy           0.023612997689 Eh   ::
         :: G(RRHO) w/o ZPVE           -0.000397899432 Eh   ::
         :: G(RRHO) contrib.            0.023215098257 Eh   ::
         :::::::::::::::::::::::::::::::::::::::::::::::::::::

optimized geometry written to: xtbopt.xyz


           -------------------------------------------------
          | TOTAL ENERGY               -9.502131630547 Eh   |
          | TOTAL ENTHALPY             -9.478391956843 Eh   |
          | TOTAL FREE ENERGY          -9.478916532291 Eh   |
          | GRADIENT NORM               0.000538440944 Eh/α |
          | HOMO-LUMO GAP               2.787575945013 eV   |
           -------------------------------------------------

------------------------------------------------------------------------
 * finished run on 2020/05/12 at 11:44:57.194     
------------------------------------------------------------------------
 total:
 * wall-time:     0 d,  0 h,  0 min,  0.143 sec
 *  cpu-time:     0 d,  0 h,  0 min,  0.143 sec
 * ratio c/w:     0.999 speedup
 SCF:
 * wall-time:     0 d,  0 h,  0 min,  0.005 sec
 *  cpu-time:     0 d,  0 h,  0 min,  0.005 sec
 * ratio c/w:     0.996 speedup
 ANC optimizer:
 * wall-time:     0 d,  0 h,  0 min,  0.047 sec
 *  cpu-time:     0 d,  0 h,  0 min,  0.047 sec
 * ratio c/w:     0.999 speedup
 numerical hessian:
 * wall-time:     0 d,  0 h,  0 min,  0.076 sec
 *  cpu-time:     0 d,  0 h,  0 min,  0.076 sec
 * ratio c/w:     0.999 speedup

