      -----------------------------------------------------------      
     |                   =====================                   |     
     |                           x T B                           |     
     |                   =====================                   |     
     |                         S. Grimme                         |     
     |          Mulliken Center for Theoretical Chemistry        |     
     |                    University of Bonn                     |     
      -----------------------------------------------------------      

   * xtb version 6.2.2 (9d81278992624c895f80dd42a50cac0aa55982e2) compiled by '@Darwin' on 04/03/2020

   xtb is free software: you can redistribute it and/or modify it under
   the terms of the GNU Lesser General Public License as published by
   the Free Software Foundation, either version 3 of the License, or
   (at your option) any later version.
   
   xtb is distributed in the hope that it will be useful,
   but WITHOUT ANY WARRANTY; without even the implied warranty of
   MERCHANTABILITY or FITNESS FOR A PARTICULAR PURPOSE.  See the
   GNU Lesser General Public License for more details.
   
   Cite this work as:
   * S. Grimme, C. Bannwarth, P. Shushkov, J. Chem. Theory Comput., 2017,
     13, 1989-2009. DOI: 10.1021/acs.jctc.7b00118
   * C. Bannwarth, S. Ehlert and S. Grimme., J. Chem. Theory Comput., 2019,
     15, 1652-1671. DOI: 10.1021/acs.jctc.8b01176
   * P. Pracht, E. Caldeweyher, S. Ehlert, S. Grimme, ChemRxiv, 2019, preprint.
     DOI: 10.26434/chemrxiv.8326202.v1
   
   for DFT-D4:
   * E. Caldeweyher, C. Bannwarth and S. Grimme, J. Chem. Phys., 2017,
     147, 034112. DOI: 10.1063/1.4993215
   * E. Caldeweyher, S. Ehlert, A. Hansen, H. Neugebauer, S. Spicher,
     C. Bannwarth and S. Grimme, J. Chem. Phys., 2019, 150, 154122.
     DOI: 10.1063/1.5090222
   
   for sTDA-xTB:
   * S. Grimme and C. Bannwarth, J. Chem. Phys., 2016, 145, 054103.
     DOI: 10.1063/1.4959605
   
   in the mass-spec context:
   * V. Asgeirsson, C. Bauer and S. Grimme, Chem. Sci., 2017, 8, 4879.
     DOI: 10.1039/c7sc00601b
   
   for metadynamics refer to:
   * S. Grimme, J. Chem. Theory Comput., 2019, 155, 2847-2862
     DOI: 10.1021/acs.jctc.9b00143
   
   with help from (in alphabetical order)
   C. Bannwarth, F. Bohle, G. Brandenburg, E. Caldeweyher, M. Checinski,
   S. Dohm, S. Ehlert, S. Ehrlich, F. März, H. Neugebauer, J. Pisarek,
   P. Pracht, P. Shushkov, and S. Spicher.
   
 * started run on 2020/05/12 at 11:44:22.223     

           -------------------------------------------------
          |                Calculation Setup                |
           -------------------------------------------------

          program call               : xtb --input C4N1_53_S_3.input C4N1_53_S_3.xyz --ohess --molden --namespace C4N1_53_S_3 output.out
          calculation namespace      : C4N1_53_S_3
          coordinate file            : C4N1_53_S_3.xyz
          number of atoms            :                     5
          number of electrons        :                    21
          charge                     :                     0
          spin                       :                   1.5
          first test random number   :      0.94679652954466

   ID    Z sym.   atoms
    1    6 C      1, 3-5
    2    7 N      2

           -------------------------------------------------
          |                 G F N 2 - x T B                 |
           -------------------------------------------------

        Reference                      10.1021/acs.jctc.8b01176
      * Hamiltonian:
        H0-scaling (s, p, d)           1.850000    2.230000    2.230000
        zeta-weighting                 0.500000
      * Dispersion:
        s8                             2.700000
        a1                             0.520000
        a2                             5.000000
        s9                             5.000000
      * Repulsion:
        kExp                           1.500000    1.000000
        rExp                           1.000000
      * Coulomb:
        alpha                          2.000000
        third order                    shell-resolved
        anisotropic                    true
        a3                             3.000000
        a5                             4.000000
        cn-shift                       1.200000
        cn-exp                         4.000000
        max-rad                        5.000000


          ...................................................
          :                      SETUP                      :
          :.................................................:
          :  # basis functions                  20          :
          :  # atomic orbitals                  20          :
          :  # shells                           10          :
          :  # electrons                        21          :
          :  max. iterations                   250          :
          :  Hamiltonian                  GFN2-xTB          :
          :  restarted?                      false          :
          :  GBSA solvation                  false          :
          :  PC potential                    false          :
          :  electronic temp.          300.0000000     K    :
          :  accuracy                    1.0000000          :
          :  -> integral cutoff          0.2500000E+02      :
          :  -> integral neglect         0.1000000E-07      :
          :  -> SCF convergence          0.1000000E-05 Eh   :
          :  -> wf. convergence          0.1000000E-03 e    :
          :  Broyden damping             0.4000000          :
          ...................................................

 iter      E             dE          RMSdq      gap      omega  full diag
   1    -11.0080930 -0.110081E+02  0.696E+00    1.36       0.0  T
   2    -10.9513769  0.567161E-01  0.522E+00    1.58       1.0  T
   3    -10.9033140  0.480629E-01  0.438E+00    0.54       1.0  T
   4    -11.0296756 -0.126362E+00  0.185E+00    1.39       1.0  T
   5    -11.0282126  0.146301E-02  0.137E+00    1.28       1.0  T
   6    -11.0330073 -0.479476E-02  0.103E+00    1.29       1.0  T
   7    -11.0305542  0.245315E-02  0.973E-01    1.33       1.0  T
   8    -11.0355429 -0.498877E-02  0.223E-01    1.36       1.0  T
   9    -11.0355591 -0.162062E-04  0.103E-01    1.36       1.0  T
  10    -11.0355555  0.364934E-05  0.906E-02    1.36       1.0  T
  11    -11.0355731 -0.176402E-04  0.187E-02    1.36       2.4  T
  12    -11.0355730  0.107921E-06  0.694E-03    1.36       6.4  T
  13    -11.0355732 -0.129860E-06  0.110E-03    1.36      40.7  T
  14    -11.0355732  0.174857E-08  0.810E-04    1.36      55.2  T
  15    -11.0355732 -0.433208E-08  0.112E-04    1.36     399.9  T

   *** convergence criteria satisfied after 15 iterations ***

         #    Occupation            Energy/Eh            Energy/eV
      -------------------------------------------------------------
         1        2.0000           -0.7798895             -21.2219
       ...           ...                  ...                  ...
         6        2.0000           -0.5320057             -14.4766
         7        2.0000           -0.4949871             -13.4693
         8        2.0000           -0.4819245             -13.1138
         9        1.9837           -0.4558486             -12.4043
        10        1.0163           -0.4480537             -12.1922
        11        1.0000           -0.4382119             -11.9244
        12        1.0000           -0.3554556              -9.6724 (HOMO)
        13                         -0.3053627              -8.3093 (LUMO)
        14                         -0.1497872              -4.0759
        15                         -0.0786125              -2.1392
        16                         -0.0308126              -0.8385
        17                         -0.0015016              -0.0409
       ...                                ...                  ...
        20                          0.2634260               7.1682
      -------------------------------------------------------------
                  HL-Gap            0.0500929 Eh            1.3631 eV
             Fermi-level           -0.3911802 Eh          -10.6446 eV

 SCC (total)                   0 d,  0 h,  0 min,  0.005 sec
 SCC setup                      ...        0 min,  0.000 sec (  1.706%)
 Dispersion                     ...        0 min,  0.000 sec (  0.370%)
 integral evaluation            ...        0 min,  0.001 sec ( 28.101%)
 zeroth order Hamiltonian       ...        0 min,  0.000 sec (  0.414%)
 iterations                     ...        0 min,  0.002 sec ( 36.664%)
 molecular gradient             ...        0 min,  0.001 sec ( 30.704%)
 printout                       ...        0 min,  0.000 sec (  1.804%)

         :::::::::::::::::::::::::::::::::::::::::::::::::::::
         ::                     SUMMARY                     ::
         :::::::::::::::::::::::::::::::::::::::::::::::::::::
         :: total energy             -10.914597269957 Eh    ::
         :: gradient norm              0.116218700296 Eh/a0 ::
         :: HOMO-LUMO gap              1.363098202744 eV    ::
         ::.................................................::
         :: SCC energy               -11.035573160083 Eh    ::
         :: -> isotropic ES           -0.003829088838 Eh    ::
         :: -> anisotropic ES          0.002474189567 Eh    ::
         :: -> anisotropic XC          0.008077796063 Eh    ::
         :: -> dispersion             -0.002678429746 Eh    ::
         :: repulsion energy           0.120975870406 Eh    ::
         :: add. restraining           0.000000000000 Eh    ::
         :::::::::::::::::::::::::::::::::::::::::::::::::::::

      ----------------------------------------------------------- 
     |                   =====================                   |
     |                        A N C O P T                        |
     |                   =====================                   |
     |               Approximate Normal Coordinate               |
     |                Rational Function Optimizer                |
      ----------------------------------------------------------- 

          ...................................................
          :                      SETUP                      :
          :.................................................:
          :   optimization level            normal          :
          :   max. optcycles                   200          :
          :   ANC micro-cycles                  20          :
          :   degrees of freedom                 9          :
          :.................................................:
          :   RF solver                   davidson          :
          :   write xtbopt.log                true          :
          :   linear?                        false          :
          :   energy convergence         0.5000000E-05 Eh   :
          :   grad. convergence          0.1000000E-02 Eh/α :
          :   maximium RF displ.         1.0000000          :
          :   Hlow (freq-cutoff)         0.1000000E-01      :
          :   Hmax (freq-cutoff)         5.0000000          :
          :   S6 in model hess.         20.0000000          :
          ...................................................

generating ANC from model Hessian ...
Using Lindh-Hessian (1995)
 Shifting diagonal of input Hessian by    0.0000000000000000     
 Lowest  eigenvalues of input Hessian
   -0.000000   -0.000000   -0.000000    0.000000    0.000000    0.000000
    0.143894    0.530674    0.680882    0.853001    1.047735    1.123078
    1.252432    1.493555    1.888279
 Highest eigenvalues
    0.853001    1.047735    1.123078    1.252432    1.493555    1.888279


........................................................................
.............................. CYCLE    1 ..............................
........................................................................
   1    -11.0355732 -0.110356E+02  0.226E-05    1.36       0.0  T
   2    -11.0355732  0.182965E-12  0.149E-05    1.36    2994.9  T
   3    -11.0355732  0.328626E-11  0.254E-05    1.36    1758.9  T
     SCC iter.                  ...        0 min,  0.000 sec
     gradient                   ...        0 min,  0.001 sec
 * total energy  :   -10.9145973 Eh     change        0.4774829E-09 Eh
   gradient norm :     0.1162185 Eh/α   predicted     0.0000000E+00 (-100.00%)
   displ. norm   :     0.1529983 α      lambda       -0.1566886E-01
   maximum displ.:     0.1439071 α      in ANC's #2, #9, #7, ...

........................................................................
.............................. CYCLE    2 ..............................
........................................................................
   1    -11.0444432 -0.110444E+02  0.115E+00    1.10       0.0  T
   2    -11.0437618  0.681426E-03  0.709E-01    0.91       1.0  T
   3    -11.0402153  0.354642E-02  0.784E-01    1.12       1.0  T
   4    -11.0453550 -0.513964E-02  0.165E-01    1.00       1.0  T
   5    -11.0454999 -0.144950E-03  0.521E-02    1.00       1.0  T
   6    -11.0455144 -0.144562E-04  0.239E-02    1.00       1.9  T
   7    -11.0455069  0.746342E-05  0.376E-02    1.00       1.2  T
   8    -11.0455157 -0.880320E-05  0.367E-03    1.00      12.2  T
   9    -11.0455158 -0.928770E-07  0.107E-03    1.00      41.7  T
  10    -11.0455158 -0.146787E-09  0.129E-04    1.00     345.9  T
  11    -11.0455158 -0.214779E-10  0.245E-05    1.00    1822.4  T
     SCC iter.                  ...        0 min,  0.001 sec
     gradient                   ...        0 min,  0.001 sec
 * total energy  :   -10.9263016 Eh     change       -0.1170429E-01 Eh
   gradient norm :     0.0589794 Eh/α   predicted    -0.8017821E-02 ( -31.50%)
   displ. norm   :     0.1423921 α      lambda       -0.7386027E-02
   maximum displ.:     0.1295723 α      in ANC's #2, #9, #7, ...

........................................................................
.............................. CYCLE    3 ..............................
........................................................................
   1    -11.0464672 -0.110465E+02  0.107E+00    0.54       0.0  T
   2    -11.0458244  0.642804E-03  0.676E-01    0.35       1.0  T
   3    -11.0434824  0.234195E-02  0.709E-01    0.55       1.0  T
   4    -11.0474073 -0.392481E-02  0.128E-01    0.44       1.0  T
   5    -11.0474702 -0.629242E-04  0.478E-02    0.43       1.0  T
   6    -11.0474809 -0.106738E-04  0.282E-02    0.44       1.6  T
   7    -11.0474781  0.276544E-05  0.323E-02    0.44       1.4  T
   8    -11.0474839 -0.582605E-05  0.266E-03    0.44      16.8  T
   9    -11.0474839 -0.355971E-07  0.915E-04    0.44      48.9  T
  10    -11.0474839 -0.494031E-09  0.117E-04    0.44     381.6  T
     SCC iter.                  ...        0 min,  0.001 sec
     gradient                   ...        0 min,  0.001 sec
 * total energy  :   -10.9302571 Eh     change       -0.3955573E-02 Eh
   gradient norm :     0.0184602 Eh/α   predicted    -0.3767892E-02 (  -4.74%)
   displ. norm   :     0.0209717 α      lambda       -0.3396041E-03
   maximum displ.:     0.0122663 α      in ANC's #4, #8, #2, ...

........................................................................
.............................. CYCLE    4 ..............................
........................................................................
   1    -11.0448975 -0.110449E+02  0.153E-01    0.34       0.0  T
   2    -11.0448937  0.372697E-05  0.113E-01    0.34       1.0  T
   3    -11.0448994 -0.565212E-05  0.725E-02    0.34       1.0  T
   4    -11.0449047 -0.531110E-05  0.411E-02    0.33       1.1  T
   5    -11.0449208 -0.160726E-04  0.787E-03    0.34       5.7  T
   6    -11.0449210 -0.236284E-06  0.490E-03    0.34       9.1  T
   7    -11.0449210  0.397451E-07  0.508E-03    0.34       8.8  T
   8    -11.0449211 -0.137921E-06  0.309E-04    0.34     144.8  T
   9    -11.0449211 -0.161133E-10  0.113E-04    0.34     396.5  T
     SCC iter.                  ...        0 min,  0.001 sec
     gradient                   ...        0 min,  0.002 sec
 * total energy  :   -10.9304984 Eh     change       -0.2412621E-03 Eh
   gradient norm :     0.0086543 Eh/α   predicted    -0.1698774E-03 ( -29.59%)
   displ. norm   :     0.0167733 α      lambda       -0.1376785E-03
   maximum displ.:     0.0119034 α      in ANC's #4, #8, #5, ...

........................................................................
.............................. CYCLE    5 ..............................
........................................................................
   1    -11.0430486 -0.110430E+02  0.125E-01    0.27       0.0  T
   2    -11.0430466  0.201931E-05  0.998E-02    0.28       1.0  T
   3    -11.0430678 -0.211812E-04  0.526E-02    0.27       1.0  T
   4    -11.0430702 -0.238097E-05  0.126E-02    0.27       3.5  T
   5    -11.0430715 -0.137435E-05  0.620E-03    0.27       7.2  T
   6    -11.0430717 -0.208473E-06  0.250E-03    0.27      17.9  T
   7    -11.0430716  0.101221E-06  0.423E-03    0.27      10.6  T
   8    -11.0430717 -0.112617E-06  0.352E-04    0.27     127.0  T
   9    -11.0430717 -0.673701E-10  0.934E-05    0.27     478.9  T
     SCC iter.                  ...        0 min,  0.001 sec
     gradient                   ...        0 min,  0.002 sec
 * total energy  :   -10.9305782 Eh     change       -0.7978065E-04 Eh
   gradient norm :     0.0032080 Eh/α   predicted    -0.6886037E-04 ( -13.69%)
   displ. norm   :     0.0058791 α      lambda       -0.1564763E-04
   maximum displ.:     0.0042915 α      in ANC's #5, #4, #8, ...

........................................................................
.............................. CYCLE    6 ..............................
........................................................................
   1    -11.0429944 -0.110430E+02  0.498E-02    0.25       0.0  T
   2    -11.0429933  0.104122E-05  0.358E-02    0.25       1.2  T
   3    -11.0429938 -0.460978E-06  0.252E-02    0.24       1.8  T
   4    -11.0429950 -0.116978E-05  0.128E-02    0.25       3.5  T
   5    -11.0429966 -0.163458E-05  0.162E-03    0.25      27.7  T
   6    -11.0429966  0.403862E-07  0.273E-03    0.25      16.4  T
   7    -11.0429966 -0.462163E-07  0.270E-04    0.25     165.8  T
   8    -11.0429966 -0.195266E-09  0.126E-04    0.25     354.9  T
     SCC iter.                  ...        0 min,  0.001 sec
     gradient                   ...        0 min,  0.002 sec
 * total energy  :   -10.9305901 Eh     change       -0.1194478E-04 Eh
   gradient norm :     0.0024608 Eh/α   predicted    -0.7823920E-05 ( -34.50%)
   displ. norm   :     0.0083501 α      lambda       -0.1587032E-04
   maximum displ.:     0.0069539 α      in ANC's #5, #4, #2, ...

........................................................................
.............................. CYCLE    7 ..............................
........................................................................
   1    -11.0432300 -0.110432E+02  0.780E-02    0.21       0.0  T
   2    -11.0432229  0.709781E-05  0.558E-02    0.22       1.0  T
   3    -11.0432203  0.261585E-05  0.507E-02    0.21       1.0  T
   4    -11.0432318 -0.115423E-04  0.188E-02    0.22       2.4  T
   5    -11.0432350 -0.316173E-05  0.281E-03    0.22      15.9  T
   6    -11.0432349  0.536256E-07  0.365E-03    0.22      12.3  T
   7    -11.0432350 -0.674954E-07  0.139E-03    0.22      32.2  T
   8    -11.0432350 -0.783503E-08  0.222E-04    0.22     201.5  T
   9    -11.0432350 -0.839311E-10  0.979E-05    0.22     456.8  T
     SCC iter.                  ...        0 min,  0.001 sec
     gradient                   ...        0 min,  0.001 sec
 * total energy  :   -10.9306008 Eh     change       -0.1069784E-04 Eh
   gradient norm :     0.0015533 Eh/α   predicted    -0.7937209E-05 ( -25.81%)
   displ. norm   :     0.0113421 α      lambda       -0.7364568E-05
   maximum displ.:     0.0088030 α      in ANC's #5, #2, #4, ...

........................................................................
.............................. CYCLE    8 ..............................
........................................................................
   1    -11.0433883 -0.110434E+02  0.167E-01    0.16       0.0  T
   2    -11.0432464  0.141955E-03  0.162E-01    0.20       1.0  T
   3    -11.0433523 -0.105901E-03  0.128E-01    0.16       1.0  T
   4    -11.0434243 -0.720088E-04  0.328E-02    0.17       1.4  T
   5    -11.0434320 -0.772457E-05  0.960E-03    0.17       4.7  T
   6    -11.0434322 -0.221846E-06  0.638E-03    0.17       7.0  T
   7    -11.0434322  0.325779E-07  0.608E-03    0.17       7.4  T
   8    -11.0434324 -0.191294E-06  0.481E-04    0.17      93.1  T
   9    -11.0434324 -0.525754E-09  0.179E-04    0.17     249.4  T
     SCC iter.                  ...        0 min,  0.001 sec
     gradient                   ...        0 min,  0.001 sec
 * total energy  :   -10.9306129 Eh     change       -0.1206476E-04 Eh
   gradient norm :     0.0027927 Eh/α   predicted    -0.3684184E-05 ( -69.46%)
   displ. norm   :     0.0139423 α      lambda       -0.2436533E-04
   maximum displ.:     0.0094519 α      in ANC's #5, #2, #4, ...

........................................................................
.............................. CYCLE    9 ..............................
........................................................................
   1    -11.0427207 -0.110427E+02  0.511E-01    0.10       0.0  T
   2    -11.0399573  0.276339E-02  0.711E-01    0.25       1.0  T
   3    -11.0425522 -0.259495E-02  0.398E-01    0.10       1.0  T
   4    -11.0432746 -0.722417E-03  0.813E-02    0.13       1.0  T
   5    -11.0433045 -0.298809E-04  0.596E-02    0.13       1.0  T
   6    -11.0433087 -0.418798E-05  0.384E-02    0.13       1.2  T
   7    -11.0433117 -0.300296E-05  0.204E-02    0.13       2.2  T
   8    -11.0433137 -0.194531E-05  0.103E-02    0.13       4.3  T
   9    -11.0433139 -0.224917E-06  0.216E-03    0.13      20.7  T
  10    -11.0433139 -0.761733E-08  0.900E-04    0.13      49.7  T
  11    -11.0433139 -0.181528E-08  0.433E-05    0.13    1033.5  T
     SCC iter.                  ...        0 min,  0.001 sec
     gradient                   ...        0 min,  0.001 sec
 * total energy  :   -10.9306652 Eh     change       -0.5229948E-04 Eh
   gradient norm :     0.0079845 Eh/α   predicted    -0.1218446E-04 ( -76.70%)
   displ. norm   :     0.0535429 α      lambda       -0.3238659E-03
   maximum displ.:     0.0377958 α      in ANC's #5, #2, #4, ...

........................................................................
.............................. CYCLE   10 ..............................
........................................................................
   1    -10.9883827 -0.109884E+02  0.471E+00    0.15       0.0  T
   2    -10.7592989  0.229084E+00  0.636E+00    1.14       1.0  T
   3    -10.9612258 -0.201927E+00  0.385E+00    0.11       1.0  T
   4    -11.0326363 -0.714105E-01  0.231E+00    0.17       1.0  T
   5    -11.0386838 -0.604748E-02  0.155E+00    0.12       1.0  T
   6    -11.0426888 -0.400505E-02  0.810E-01    0.08       1.0  T
   7    -11.0415709  0.111790E-02  0.105E+00    0.01       1.0  T
   8    -11.0433384 -0.176741E-02  0.644E-01    0.02       1.0  T
   9    -11.0436802 -0.341884E-03  0.533E-01    0.06       1.0  T
  10    -11.0443605 -0.680258E-03  0.758E-02    0.04       1.0  T
  11    -11.0443743 -0.138152E-04  0.701E-03    0.04       6.4  T
  12    -11.0443743 -0.118305E-10  0.683E-03    0.04       6.5  T
  13    -11.0443744 -0.103887E-06  0.207E-03    0.04      21.6  T
  14    -11.0443744 -0.102883E-07  0.880E-05    0.04     508.4  T
  15    -11.0443744 -0.937206E-11  0.656E-05    0.04     681.5  T
     SCC iter.                  ...        0 min,  0.002 sec
     gradient                   ...        0 min,  0.001 sec
 * total energy  :   -10.9317752 Eh     change       -0.1109983E-02 Eh
   gradient norm :     0.0455453 Eh/α   predicted    -0.1623964E-03 ( -85.37%)
   displ. norm   :     0.3052744 α      lambda       -0.1140928E-01
   maximum displ.:     0.2181021 α      in ANC's #5, #2, #4, ...

........................................................................
.............................. CYCLE   11 ..............................
........................................................................
   1    -11.0497771 -0.110498E+02  0.398E+00    1.52       0.0  T
   2    -11.0212207  0.285564E-01  0.314E+00    0.39       1.0  T
   3    -11.0424983 -0.212775E-01  0.252E+00    1.22       1.0  T
   4    -11.0707208 -0.282226E-01  0.110E+00    0.98       1.0  T
   5    -11.0773457 -0.662486E-02  0.349E-01    0.89       1.0  T
   6    -11.0779509 -0.605182E-03  0.150E-01    0.90       1.0  T
   7    -11.0780408 -0.899740E-04  0.867E-02    0.90       1.0  T
   8    -11.0780736 -0.327941E-04  0.120E-02    0.89       3.7  T
   9    -11.0780744 -0.757947E-06  0.465E-03    0.90       9.6  T
  10    -11.0780744 -0.426710E-07  0.499E-04    0.90      89.6  T
  11    -11.0780744 -0.305088E-09  0.241E-04    0.90     185.2  T
     SCC iter.                  ...        0 min,  0.001 sec
     gradient                   ...        0 min,  0.001 sec
 * total energy  :   -10.9591818 Eh     change       -0.2740660E-01 Eh
   gradient norm :     0.1232310 Eh/α   predicted    -0.6236259E-02 ( -77.25%)
   displ. norm   :     0.4190168 α      lambda       -0.3558519E-01
   maximum displ.:     0.2829341 α      in ANC's #5, #2, #9, ...

........................................................................
.............................. CYCLE   12 ..............................
........................................................................
   1    -11.0956082 -0.110956E+02  0.249E+00    2.37       0.0  T
   2    -11.0940935  0.151473E-02  0.149E+00    2.40       1.0  T
   3    -11.0779055  0.161880E-01  0.174E+00    2.34       1.0  T
   4    -11.0973720 -0.194665E-01  0.149E-01    2.38       1.0  T
   5    -11.0974603 -0.883410E-04  0.106E-01    2.38       1.0  T
   6    -11.0974995 -0.391520E-04  0.604E-02    2.38       1.0  T
   7    -11.0974932  0.624239E-05  0.540E-02    2.38       1.0  T
   8    -11.0975115 -0.182186E-04  0.724E-03    2.38       6.2  T
   9    -11.0975115 -0.643246E-07  0.403E-03    2.38      11.1  T
  10    -11.0975115 -0.190852E-07  0.336E-04    2.38     133.1  T
  11    -11.0975115 -0.958682E-10  0.497E-05    2.38     899.6  T
     SCC iter.                  ...        0 min,  0.001 sec
     gradient                   ...        0 min,  0.001 sec
 * total energy  :   -10.9601784 Eh     change       -0.9966583E-03 Eh
   gradient norm :     0.1676327 Eh/α   predicted    -0.2091654E-01 (1998.67%)
   displ. norm   :     0.2592438 α      lambda       -0.4124142E-01
   maximum displ.:     0.1985095 α      in ANC's #4, #5, #7, ...

........................................................................
.............................. CYCLE   13 ..............................
........................................................................
   1    -11.0834277 -0.110834E+02  0.218E+00    2.15       0.0  T
   2    -11.0818881  0.153959E-02  0.161E+00    2.18       1.0  T
   3    -11.0819628 -0.747304E-04  0.103E+00    2.15       1.0  T
   4    -11.0861874 -0.422460E-02  0.448E-01    2.18       1.0  T
   5    -11.0875722 -0.138477E-02  0.108E-01    2.17       1.0  T
   6    -11.0875474  0.248373E-04  0.111E-01    2.17       1.0  T
   7    -11.0875820 -0.345734E-04  0.741E-02    2.17       1.0  T
   8    -11.0876089 -0.269173E-04  0.737E-03    2.17       6.1  T
   9    -11.0876090 -0.145222E-06  0.336E-03    2.17      13.3  T
  10    -11.0876090 -0.678664E-08  0.252E-04    2.17     177.5  T
  11    -11.0876090 -0.518270E-10  0.105E-04    2.17     425.8  T
     SCC iter.                  ...        0 min,  0.001 sec
     gradient                   ...        0 min,  0.001 sec
 * total energy  :   -10.9764352 Eh     change       -0.1625674E-01 Eh
   gradient norm :     0.0321917 Eh/α   predicted    -0.2200657E-01 (  35.37%)
   displ. norm   :     0.0803622 α      lambda       -0.2209221E-02
   maximum displ.:     0.0676172 α      in ANC's #2, #4, #8, ...

........................................................................
.............................. CYCLE   14 ..............................
........................................................................
   1    -11.0911324 -0.110911E+02  0.543E-01    2.19       0.0  T
   2    -11.0908233  0.309087E-03  0.418E-01    2.15       1.0  T
   3    -11.0910203 -0.196951E-03  0.292E-01    2.19       1.0  T
   4    -11.0913664 -0.346148E-03  0.115E-01    2.18       1.0  T
   5    -11.0914701 -0.103621E-03  0.211E-02    2.18       2.1  T
   6    -11.0914680  0.209130E-05  0.245E-02    2.18       1.8  T
   7    -11.0914709 -0.295952E-05  0.101E-02    2.18       4.4  T
   8    -11.0914714 -0.462468E-06  0.757E-04    2.18      59.1  T
   9    -11.0914714 -0.201124E-09  0.326E-04    2.18     137.2  T
     SCC iter.                  ...        0 min,  0.001 sec
     gradient                   ...        0 min,  0.001 sec
 * total energy  :   -10.9775183 Eh     change       -0.1083123E-02 Eh
   gradient norm :     0.0092465 Eh/α   predicted    -0.1111744E-02 (   2.64%)
   displ. norm   :     0.0122117 α      lambda       -0.1016804E-03
   maximum displ.:     0.0107741 α      in ANC's #5, #2, #8, ...

........................................................................
.............................. CYCLE   15 ..............................
........................................................................
   1    -11.0929583 -0.110930E+02  0.950E-02    2.20       0.0  T
   2    -11.0929583 -0.390390E-07  0.561E-02    2.20       1.0  T
   3    -11.0929443  0.140671E-04  0.455E-02    2.20       1.0  T
   4    -11.0929584 -0.141404E-04  0.808E-03    2.20       5.5  T
   5    -11.0929587 -0.238574E-06  0.580E-03    2.20       7.7  T
   6    -11.0929588 -0.134632E-06  0.156E-03    2.20      28.7  T
   7    -11.0929588 -0.738559E-08  0.787E-04    2.20      56.8  T
   8    -11.0929588 -0.347743E-08  0.238E-04    2.20     187.7  T
     SCC iter.                  ...        0 min,  0.001 sec
     gradient                   ...        0 min,  0.002 sec
 * total energy  :   -10.9775861 Eh     change       -0.6785251E-04 Eh
   gradient norm :     0.0044723 Eh/α   predicted    -0.5084621E-04 ( -25.06%)
   displ. norm   :     0.0068674 α      lambda       -0.2671241E-04
   maximum displ.:     0.0052404 α      in ANC's #5, #8, #9, ...

........................................................................
.............................. CYCLE   16 ..............................
........................................................................
   1    -11.0937511 -0.110938E+02  0.570E-02    2.21       0.0  T
   2    -11.0937502  0.936202E-06  0.393E-02    2.21       1.1  T
   3    -11.0937343  0.158979E-04  0.476E-02    2.21       1.0  T
   4    -11.0937498 -0.154977E-04  0.171E-02    2.21       2.6  T
   5    -11.0937517 -0.190929E-05  0.457E-03    2.21       9.8  T
   6    -11.0937518 -0.803776E-07  0.188E-03    2.21      23.8  T
   7    -11.0937518 -0.408002E-08  0.910E-04    2.21      49.1  T
   8    -11.0937518 -0.473062E-08  0.155E-04    2.21     287.9  T
     SCC iter.                  ...        0 min,  0.001 sec
     gradient                   ...        0 min,  0.001 sec
 * total energy  :   -10.9776021 Eh     change       -0.1598688E-04 Eh
   gradient norm :     0.0023211 Eh/α   predicted    -0.1335762E-04 ( -16.45%)
   displ. norm   :     0.0029480 α      lambda       -0.5344459E-05
   maximum displ.:     0.0017781 α      in ANC's #9, #2, #8, ...

........................................................................
.............................. CYCLE   17 ..............................
........................................................................
   1    -11.0937429 -0.110937E+02  0.213E-02    2.22       0.0  T
   2    -11.0937423  0.601965E-06  0.180E-02    2.21       2.5  T
   3    -11.0937415  0.730537E-06  0.165E-02    2.22       2.7  T
   4    -11.0937424 -0.907937E-06  0.961E-03    2.22       4.7  T
   5    -11.0937431 -0.650095E-06  0.255E-03    2.21      17.5  T
   6    -11.0937431 -0.315226E-07  0.814E-04    2.21      55.0  T
   7    -11.0937431  0.383665E-09  0.509E-04    2.21      87.9  T
     SCC iter.                  ...        0 min,  0.001 sec
     gradient                   ...        0 min,  0.001 sec
 * total energy  :   -10.9776060 Eh     change       -0.3910929E-05 Eh
   gradient norm :     0.0013692 Eh/α   predicted    -0.2672614E-05 ( -31.66%)
   displ. norm   :     0.0052051 α      lambda       -0.3589499E-05
   maximum displ.:     0.0029185 α      in ANC's #2, #1, #9, ...

........................................................................
.............................. CYCLE   18 ..............................
........................................................................
   1    -11.0934328 -0.110934E+02  0.329E-02    2.22       0.0  T
   2    -11.0934296  0.327595E-05  0.312E-02    2.22       1.4  T
   3    -11.0934302 -0.624574E-06  0.267E-02    2.22       1.7  T
   4    -11.0934328 -0.264944E-05  0.105E-02    2.22       4.2  T
   5    -11.0934336 -0.788092E-06  0.395E-03    2.22      11.3  T
   6    -11.0934337 -0.859576E-07  0.110E-03    2.22      40.6  T
   7    -11.0934337  0.235595E-08  0.693E-04    2.22      64.6  T
   8    -11.0934337 -0.325444E-08  0.131E-04    2.22     340.4  T
     SCC iter.                  ...        0 min,  0.001 sec
     gradient                   ...        0 min,  0.002 sec
 * total energy  :   -10.9776081 Eh     change       -0.2030108E-05 Eh
   gradient norm :     0.0007554 Eh/α   predicted    -0.1795736E-05 ( -11.54%)
   displ. norm   :     0.0015357 α      lambda       -0.5372427E-06
   maximum displ.:     0.0012095 α      in ANC's #1, #9, #8, ...

   *** GEOMETRY OPTIMIZATION CONVERGED AFTER 18 ITERATIONS ***

------------------------------------------------------------------------
 total energy gain   :        -0.0630108 Eh      -39.5399 kcal/mol
 total RMSD          :         0.4157885 a0        0.2200 Å
 total power (kW/mol):        -9.1908234 (step)-2297.7430 (real)
------------------------------------------------------------------------

 ANCopt (total)                0 d,  0 h,  0 min,  0.072 sec
 optimizer setup                ...        0 min,  0.000 sec (  0.086%)
 model hessian                  ...        0 min,  0.000 sec (  0.129%)
 ANC generation                 ...        0 min,  0.000 sec (  0.072%)
 coordinate transformation      ...        0 min,  0.000 sec (  0.051%)
 single point calculation       ...        0 min,  0.070 sec ( 97.759%)
 optimization log               ...        0 min,  0.000 sec (  0.588%)
 hessian update                 ...        0 min,  0.000 sec (  0.053%)
 rational function              ...        0 min,  0.000 sec (  0.516%)

================
 final structure:
================
5
 xtb: 6.2.2 (9d81278992624c895f80dd42a50cac0aa55982e2)
C         1.13122868614374   -0.01291333852448   -0.01049758531146
N         0.17507216106254    0.97791823357095   -0.04503270562152
C        -0.74209062646637   -0.00289815089141   -0.70724397067051
C        -0.73419077952888    0.06676589781441    0.71530594801010
C         0.16997955878897   -1.02887264196947    0.04746931359339

 Bond Distances (Angstroems)
 ---------------------------
C1-N2=1.3774         C1-C5=1.3998         N2-C1=1.3774         N2-C3=1.4972         N2-C4=1.4950         C3-N2=1.4972         
C3-C4=1.4243         C3-C5=1.5666         C4-N2=1.4950         C4-C3=1.4243         C4-C5=1.5697         C5-C1=1.3998         
C5-C3=1.5666         C5-C4=1.5697         
 C  C  Rav=1.4901 sigma=0.0785  Rmin=1.3998  Rmax=1.5697     4
 N  C  Rav=1.4565 sigma=0.0560  Rmin=1.3774  Rmax=1.4972     3

 selected bond angles (degree)
 --------------------
C5-C1-N2= 92.66                C3-N2-C1= 88.00                C4-N2-C1= 88.34                C4-N2-C3= 56.85                
C4-C3-N2= 61.50                C5-C3-N2= 81.91                C5-C3-C4= 63.10                C3-C4-N2= 61.65                
C5-C4-N2= 81.88                C5-C4-C3= 62.88                C3-C5-C1= 84.52                C4-C5-C1= 84.64                
C4-C5-C3= 54.02                

 selected dihedral angles (degree)
 ---------------------------------
C3-N2-C1-C5=331.36            C4-N2-C1-C5= 28.24            C4-C3-N2-C1= 89.32            C5-C3-N2-C1= 25.60            
C5-C3-N2-C4=296.28            C3-C4-N2-C1=271.31            C5-C4-N2-C1=334.80            C5-C4-N2-C3= 63.50            
N2-C4-C3-C5= 95.50            C5-C4-C3-N2=264.50            C3-C5-C1-N2= 27.38            C4-C5-C1-N2=333.10            
C1-C5-C3-N2=334.73            C1-C5-C3-C4=272.66            C4-C5-C3-N2= 62.07            C1-C5-C4-N2= 24.87            
C1-C5-C4-C3= 87.11            C3-C5-C4-N2=297.76            
           -------------------------------------------------
          |                Final Singlepoint                |
           -------------------------------------------------

          ...................................................
          :                      SETUP                      :
          :.................................................:
          :  # basis functions                  20          :
          :  # atomic orbitals                  20          :
          :  # shells                           10          :
          :  # electrons                        21          :
          :  max. iterations                   250          :
          :  Hamiltonian                  GFN2-xTB          :
          :  restarted?                      false          :
          :  GBSA solvation                  false          :
          :  PC potential                    false          :
          :  electronic temp.          300.0000000     K    :
          :  accuracy                    1.0000000          :
          :  -> integral cutoff          0.2500000E+02      :
          :  -> integral neglect         0.1000000E-07      :
          :  -> SCF convergence          0.1000000E-05 Eh   :
          :  -> wf. convergence          0.1000000E-03 e    :
          :  Broyden damping             0.4000000          :
          ...................................................

 iter      E             dE          RMSdq      gap      omega  full diag
   1    -11.0934337 -0.110934E+02  0.368E-05    2.22       0.0  T
   2    -11.0934337  0.422240E-11  0.465E-05    2.22     961.3  T
   3    -11.0934337 -0.310330E-11  0.366E-05    2.22    1223.1  T

   *** convergence criteria satisfied after 3 iterations ***

         #    Occupation            Energy/Eh            Energy/eV
      -------------------------------------------------------------
         1        2.0000           -0.7764321             -21.1278
       ...           ...                  ...                  ...
         6        2.0000           -0.5245608             -14.2740
         7        2.0000           -0.5080734             -13.8254
         8        2.0000           -0.5009296             -13.6310
         9        2.0000           -0.4721921             -12.8490
        10        1.0000           -0.4486667             -12.2088
        11        1.0000           -0.4058064             -11.0426
        12        1.0000           -0.3964372             -10.7876 (HOMO)
        13                         -0.3149754              -8.5709 (LUMO)
        14                         -0.1535851              -4.1793
        15                         -0.1339774              -3.6457
        16                         -0.0566078              -1.5404
        17                         -0.0171112              -0.4656
       ...                                ...                  ...
        20                          0.3959866              10.7753
      -------------------------------------------------------------
                  HL-Gap            0.0814619 Eh            2.2167 eV
             Fermi-level           -0.4080679 Eh          -11.1041 eV

 SCC (total)                   0 d,  0 h,  0 min,  0.003 sec
 SCC setup                      ...        0 min,  0.000 sec (  1.349%)
 Dispersion                     ...        0 min,  0.000 sec (  0.366%)
 integral evaluation            ...        0 min,  0.001 sec ( 39.798%)
 zeroth order Hamiltonian       ...        0 min,  0.000 sec (  0.481%)
 iterations                     ...        0 min,  0.000 sec ( 11.469%)
 molecular gradient             ...        0 min,  0.001 sec ( 44.829%)
 printout                       ...        0 min,  0.000 sec (  1.471%)

         :::::::::::::::::::::::::::::::::::::::::::::::::::::
         ::                     SUMMARY                     ::
         :::::::::::::::::::::::::::::::::::::::::::::::::::::
         :: total energy             -10.977608065555 Eh    ::
         :: gradient norm              0.000755244116 Eh/a0 ::
         :: HOMO-LUMO gap              2.216689842446 eV    ::
         ::.................................................::
         :: SCC energy               -11.093433711470 Eh    ::
         :: -> isotropic ES           -0.003100934473 Eh    ::
         :: -> anisotropic ES          0.002970125284 Eh    ::
         :: -> anisotropic XC          0.004719271157 Eh    ::
         :: -> dispersion             -0.002662494615 Eh    ::
         :: repulsion energy           0.115825625725 Eh    ::
         :: add. restraining           0.000000000000 Eh    ::
         :::::::::::::::::::::::::::::::::::::::::::::::::::::

           ------------------------------------------------- 
          |                Numerical Hessian                |
           ------------------------------------------------- 
step length          :   0.00500
SCC accuracy         :   0.30000
Hessian scale factor :   1.00000
frozen atoms in %    :   0.00000    0
RMS gradient         :   0.00076
estimated CPU  time      0.00 min
estimated wall time      0.00 min

writing file <hessian>.

 projected vibrational frequencies (cm-1)
eigval :       -0.00    -0.00    -0.00     0.00     0.00     0.00
eigval :     -252.68  -213.69   637.57   714.54   894.49   922.53
eigval :     1190.41  1351.69  1419.04
           -------------------------------------------------
          |                Property Printout                |
           -------------------------------------------------

    * Orbital Energies and Occupations

         #    Occupation            Energy/Eh            Energy/eV
      -------------------------------------------------------------
         1        2.0000           -0.7764321             -21.1278
         2        2.0000           -0.6768527             -18.4181
         3        2.0000           -0.6555983             -17.8397
         4        2.0000           -0.6253025             -17.0153
         5        2.0000           -0.5767655             -15.6946
         6        2.0000           -0.5245608             -14.2740
         7        2.0000           -0.5080734             -13.8254
         8        2.0000           -0.5009296             -13.6310
         9        2.0000           -0.4721921             -12.8490
        10        1.0000           -0.4486666             -12.2088
        11        1.0000           -0.4058064             -11.0426
        12        1.0000           -0.3964373             -10.7876 (HOMO)
        13                         -0.3149755              -8.5709 (LUMO)
        14                         -0.1535850              -4.1793
        15                         -0.1339774              -3.6457
        16                         -0.0566078              -1.5404
        17                         -0.0171112              -0.4656
        18                          0.1170714               3.1857
        19                          0.2673208               7.2742
        20                          0.3959865              10.7753
      -------------------------------------------------------------
                  HL-Gap            0.0814618 Eh            2.2167 eV
             Fermi-level           -0.4080679 Eh          -11.1041 eV

     #   Z        covCN         q      C6AA      α(0)
     1   6 C      2.867     0.029    27.339     8.571
     2   7 N      3.052    -0.080    22.780     7.089
     3   6 C      3.347     0.035    24.592     7.823
     4   6 C      3.338     0.033    24.818     7.885
     5   6 C      3.255    -0.018    27.335     8.456

 Mol. C6AA /au·bohr⁶  :        632.885440
 Mol. C8AA /au·bohr⁸  :      17436.977388
 Mol. α(0) /au        :         39.824215


Wiberg/Mayer (AO) data.
largest (>0.10) Wiberg bond orders for each atom
          total WBO             WBO to atom ...
     1  C   2.883        C    5 1.251    N    2 1.119    C    3 0.258    C    4 0.255
     2  N   2.905        C    1 1.119    C    4 0.829    C    3 0.824    C    5 0.133
     3  C   2.800        C    4 0.982    N    2 0.824    C    5 0.735    C    1 0.258
     4  C   2.796        C    3 0.982    N    2 0.829    C    5 0.730    C    1 0.255
     5  C   2.849        C    1 1.251    C    3 0.735    C    4 0.730    N    2 0.133
Molecule has the following symmetry elements: (sigma) 
It seems to be the Cs point group

MOs/occ written to file <molden.input>


molecular dipole:
                 x           y           z       tot (Debye)
 q only:       -0.064      -0.109       0.003
   full:        0.093      -0.029      -0.004       0.248
molecular quadrupole (traceless):
                xx          xy          yy          xz          yz          zz
 q only:        0.365      -0.067      -0.527       0.004       0.032       0.163
  q+dip:       -0.708       0.135      -0.607       0.023       0.078       1.315
   full:       -0.601      -0.005      -0.985       0.038       0.113       1.586

           -------------------------------------------------
          |                Geometry Summary                 |
           -------------------------------------------------

      molecular mass/u    :       62.0496468
   center of mass at/Å    :        0.0056316       0.0314569      -0.0014485
  moments of inertia/u·Å² :        0.3824905E+02   0.4147902E+02   0.5536407E+02
rotational constants/cm⁻¹ :        0.4407334E+00   0.4064135E+00   0.3044869E+00

 * 3 selected distances

     #   Z        #   Z                                     value/Å
     1   6 C      2   7 N                                 1.3773798 (min)
     3   6 C      4   6 C                                 1.4242766 (max)
     1   6 C      5   6 C                                 1.3998333

 * 2 distinct bonds (by element types)

   Z      Z             #   av. dist./Å        max./Å        min./Å
   6 C    6 C           2     1.4120550     1.4242766     1.3998333
   6 C    7 N           1     1.3773798     1.3773798     1.3773798

           -------------------------------------------------
          |               Frequency Printout                |
           -------------------------------------------------
 projected vibrational frequencies (cm-1)
eigval :       -0.00    -0.00    -0.00     0.00     0.00     0.00
eigval :     -252.68  -213.69   637.57   714.54   894.49   922.53
eigval :     1190.41  1351.69  1419.04
 reduced masses (amu)
   1: 12.30   2: 12.77   3: 12.58   4: 12.80   5: 12.05   6: 12.06   7: 12.34   8: 12.20
   9: 12.36  10: 12.25  11: 12.30  12: 12.99  13: 12.81  14: 12.11  15: 12.22
 IR intensities (amu)
   1:  0.02   2:  0.03   3:  0.05   4:  0.05   5:  0.01   6:  0.02   7:  0.79   8:  0.06
   9:  1.52  10:  0.18  11:  0.22  12:  0.66  13:  1.02  14:  0.66  15:  0.24
 Raman intensities (amu)
   1:  0.00   2:  0.00   3:  0.00   4:  0.00   5:  0.00   6:  0.00   7:  0.00   8:  0.00
   9:  0.00  10:  0.00  11:  0.00  12:  0.00  13:  0.00  14:  0.00  15:  0.00
 output can be read by thermo (or use thermo option).
 writing <g98.out> molden fake output.
 recommended (thermochemical) frequency scaling factor: 1.0
           -------------------------------------------------
          |             Thermodynamic Functions             |
           -------------------------------------------------

cs  symmetry found (for desy threshold:  0.10E+00) used in thermo

          ...................................................
          :                      SETUP                      :
          :.................................................:
          :  # frequencies                           7      :
          :  # imaginary freq.                       2      :
          :  linear?                             false      :
          :  only rotor calc.                    false      :
          :  symmetry                               cs      :
          :  rotational number                       1      :
          :  scaling factor                  1.0000000      :
          :  rotor cutoff                   50.0000000 cm⁻¹ :
          :  imag. cutoff                  -20.0000000 cm⁻¹ :
          :.................................................:

    mode    ω/cm⁻¹     T·S(HO)/kcal·mol⁻¹    T·S(FR)/kcal·mol⁻¹   T·S(vib)
   ------------------------------------------------------------------------
   ------------------------------------------------------------------------

   temp. (K)  partition function   enthalpy   heat capacity  entropy
                                   cal/mol     cal/K/mol   cal/K/mol   J/K/mol
 298.15  VIB   1.12                  241.864      3.168      1.031
         ROT  0.226E+05              888.752      2.981     22.908
         INT  0.253E+05             1130.617      6.148     23.939
         TR   0.473E+27             1481.254      4.968     38.278
         TOT                        2611.8708    11.1166    62.2169   260.3156

   temp. (K)  partition function   enthalpy   heat capacity  entropy
                                   cal/mol     cal/K/mol   cal/K/mol   J/K/mol
 120.00  VIB   1.00                    1.362      0.093      0.013
         ROT  0.578E+04              357.707      2.981     20.195
         INT  0.579E+04              359.069      3.073     20.208
         TR   0.121E+27              596.178      4.968     33.759
         TOT                         955.2470     8.0416    53.9667   225.7967

   temp. (K)  partition function   enthalpy   heat capacity  entropy
                                   cal/mol     cal/K/mol   cal/K/mol   J/K/mol
 100.00  VIB   1.00                    0.271      0.026      0.003
         ROT  0.440E+04              298.089      2.981     19.652
         INT  0.440E+04              298.360      3.007     19.655
         TR   0.919E+26              496.815      4.968     32.853
         TOT                         795.1745     7.9751    52.5081   219.6938

   temp. (K)  partition function   enthalpy   heat capacity  entropy
                                   cal/mol     cal/K/mol   cal/K/mol   J/K/mol
  80.00  VIB   1.00                    0.025      0.004      0.000
         ROT  0.315E+04              238.471      2.981     18.987
         INT  0.315E+04              238.496      2.985     18.987
         TR   0.657E+26              397.452      4.968     31.745
         TOT                         635.9481     7.9527    50.7322   212.2634

   temp. (K)  partition function   enthalpy   heat capacity  entropy
                                   cal/mol     cal/K/mol   cal/K/mol   J/K/mol
  60.00  VIB   1.00                    0.000      0.000     -0.000
         ROT  0.204E+04              178.853      2.981     18.129
         INT  0.204E+04              178.854      2.981     18.129
         TR   0.427E+26              298.089      4.968     30.317
         TOT                         476.9429     7.9492    48.4457   202.6969

   temp. (K)  partition function   enthalpy   heat capacity  entropy
                                   cal/mol     cal/K/mol   cal/K/mol   J/K/mol
  40.00  VIB   1.00                    0.000      0.000     -0.000
         ROT  0.111E+04              119.236      2.981     16.920
         INT  0.111E+04              119.236      2.981     16.920
         TR   0.232E+26              198.726      4.968     28.303
         TOT                         317.9616     7.9490    45.2236   189.2155

   temp. (K)  partition function   enthalpy   heat capacity  entropy
                                   cal/mol     cal/K/mol   cal/K/mol   J/K/mol
  20.00  VIB   1.00                    0.000      0.000     -0.000
         ROT   393.                   59.618      2.981     14.854
         INT   393.                   59.618      2.981     14.854
         TR   0.822E+25               99.363      4.968     24.861
         TOT                         158.9808     7.9490    39.7154   166.1691

   temp. (K)  partition function   enthalpy   heat capacity  entropy
                                   cal/mol     cal/K/mol   cal/K/mol   J/K/mol
  10.00  VIB   1.00                    0.000      0.000     -0.000
         ROT   139.                   29.809      2.981     12.788
         INT   139.                   29.809      2.981     12.788
         TR   0.290E+25               49.681      4.968     21.419
         TOT                          79.4904     7.9490    34.2071   143.1227

       T/K    H(0)-H(T)+PV         H(T)/Eh          T*S/Eh         G(T)/Eh
   ------------------------------------------------------------------------
    298.15    0.416228E-02    0.204062E-01    0.295613E-01   -0.915501E-02
    120.00    0.152228E-02    0.177662E-01    0.103202E-01    0.744608E-02
    100.00    0.126719E-02    0.175112E-01    0.836769E-02    0.914346E-02
     80.00    0.101345E-02    0.172574E-01    0.646775E-02    0.107897E-01
     60.00    0.760057E-03    0.170040E-01    0.463219E-02    0.123718E-01
     40.00    0.506704E-03    0.167507E-01    0.288274E-02    0.138679E-01
     20.00    0.253352E-03    0.164973E-01    0.126581E-02    0.152315E-01
     10.00    0.126676E-03    0.163706E-01    0.545125E-03    0.158255E-01 (used)
   ------------------------------------------------------------------------

         :::::::::::::::::::::::::::::::::::::::::::::::::::::
         ::                  THERMODYNAMIC                  ::
         :::::::::::::::::::::::::::::::::::::::::::::::::::::
         :: total free energy         -10.961782548074 Eh   ::
         ::.................................................::
         :: total energy              -10.977608065509 Eh   ::
         :: zero point energy           0.016243966805 Eh   ::
         :: G(RRHO) w/o ZPVE           -0.000418449370 Eh   ::
         :: G(RRHO) contrib.            0.015825517435 Eh   ::
         :::::::::::::::::::::::::::::::::::::::::::::::::::::
imag cut-off (cm-1) :    5.00
 found            2  significant imaginary frequencies
 writing imag mode distorted coords to xtbhess.xyz
 for further optimization.

optimized geometry written to: xtbopt.xyz


           -------------------------------------------------
          | TOTAL ENERGY              -10.977608065509 Eh   |
          | TOTAL ENTHALPY            -10.961237422688 Eh   |
          | TOTAL FREE ENERGY         -10.961782548074 Eh   |
          | GRADIENT NORM               0.000755250461 Eh/α |
          | HOMO-LUMO GAP               2.216689396180 eV   |
           -------------------------------------------------

------------------------------------------------------------------------
 * finished run on 2020/05/12 at 11:44:22.433     
------------------------------------------------------------------------
 total:
 * wall-time:     0 d,  0 h,  0 min,  0.209 sec
 *  cpu-time:     0 d,  0 h,  0 min,  0.209 sec
 * ratio c/w:     0.998 speedup
 SCF:
 * wall-time:     0 d,  0 h,  0 min,  0.005 sec
 *  cpu-time:     0 d,  0 h,  0 min,  0.005 sec
 * ratio c/w:     1.000 speedup
 ANC optimizer:
 * wall-time:     0 d,  0 h,  0 min,  0.076 sec
 *  cpu-time:     0 d,  0 h,  0 min,  0.076 sec
 * ratio c/w:     0.998 speedup
 numerical hessian:
 * wall-time:     0 d,  0 h,  0 min,  0.109 sec
 *  cpu-time:     0 d,  0 h,  0 min,  0.109 sec
 * ratio c/w:     0.997 speedup

