      -----------------------------------------------------------      
     |                   =====================                   |     
     |                           x T B                           |     
     |                   =====================                   |     
     |                         S. Grimme                         |     
     |          Mulliken Center for Theoretical Chemistry        |     
     |                    University of Bonn                     |     
      -----------------------------------------------------------      

   * xtb version 6.2.2 (9d81278992624c895f80dd42a50cac0aa55982e2) compiled by '@Darwin' on 04/03/2020

   xtb is free software: you can redistribute it and/or modify it under
   the terms of the GNU Lesser General Public License as published by
   the Free Software Foundation, either version 3 of the License, or
   (at your option) any later version.
   
   xtb is distributed in the hope that it will be useful,
   but WITHOUT ANY WARRANTY; without even the implied warranty of
   MERCHANTABILITY or FITNESS FOR A PARTICULAR PURPOSE.  See the
   GNU Lesser General Public License for more details.
   
   Cite this work as:
   * S. Grimme, C. Bannwarth, P. Shushkov, J. Chem. Theory Comput., 2017,
     13, 1989-2009. DOI: 10.1021/acs.jctc.7b00118
   * C. Bannwarth, S. Ehlert and S. Grimme., J. Chem. Theory Comput., 2019,
     15, 1652-1671. DOI: 10.1021/acs.jctc.8b01176
   * P. Pracht, E. Caldeweyher, S. Ehlert, S. Grimme, ChemRxiv, 2019, preprint.
     DOI: 10.26434/chemrxiv.8326202.v1
   
   for DFT-D4:
   * E. Caldeweyher, C. Bannwarth and S. Grimme, J. Chem. Phys., 2017,
     147, 034112. DOI: 10.1063/1.4993215
   * E. Caldeweyher, S. Ehlert, A. Hansen, H. Neugebauer, S. Spicher,
     C. Bannwarth and S. Grimme, J. Chem. Phys., 2019, 150, 154122.
     DOI: 10.1063/1.5090222
   
   for sTDA-xTB:
   * S. Grimme and C. Bannwarth, J. Chem. Phys., 2016, 145, 054103.
     DOI: 10.1063/1.4959605
   
   in the mass-spec context:
   * V. Asgeirsson, C. Bauer and S. Grimme, Chem. Sci., 2017, 8, 4879.
     DOI: 10.1039/c7sc00601b
   
   for metadynamics refer to:
   * S. Grimme, J. Chem. Theory Comput., 2019, 155, 2847-2862
     DOI: 10.1021/acs.jctc.9b00143
   
   with help from (in alphabetical order)
   C. Bannwarth, F. Bohle, G. Brandenburg, E. Caldeweyher, M. Checinski,
   S. Dohm, S. Ehlert, S. Ehrlich, F. März, H. Neugebauer, J. Pisarek,
   P. Pracht, P. Shushkov, and S. Spicher.
   
 * started run on 2020/05/12 at 11:44:50.003     

           -------------------------------------------------
          |                Calculation Setup                |
           -------------------------------------------------

          program call               : xtb --input H1C3N1_0_S_2.input H1C3N1_0_S_2.xyz --ohess --molden --namespace H1C3N1_0_S_2 output.out
          calculation namespace      : H1C3N1_0_S_2
          coordinate file            : H1C3N1_0_S_2.xyz
          number of atoms            :                     5
          number of electrons        :                    18
          charge                     :                     0
          spin                       :                   1.0
          first test random number   :      0.49947039736177

   ID    Z sym.   atoms
    1    6 C      1-3
    2    7 N      4
    3    1 H      5

           -------------------------------------------------
          |                 G F N 2 - x T B                 |
           -------------------------------------------------

        Reference                      10.1021/acs.jctc.8b01176
      * Hamiltonian:
        H0-scaling (s, p, d)           1.850000    2.230000    2.230000
        zeta-weighting                 0.500000
      * Dispersion:
        s8                             2.700000
        a1                             0.520000
        a2                             5.000000
        s9                             5.000000
      * Repulsion:
        kExp                           1.500000    1.000000
        rExp                           1.000000
      * Coulomb:
        alpha                          2.000000
        third order                    shell-resolved
        anisotropic                    true
        a3                             3.000000
        a5                             4.000000
        cn-shift                       1.200000
        cn-exp                         4.000000
        max-rad                        5.000000


          ...................................................
          :                      SETUP                      :
          :.................................................:
          :  # basis functions                  17          :
          :  # atomic orbitals                  17          :
          :  # shells                            9          :
          :  # electrons                        18          :
          :  max. iterations                   250          :
          :  Hamiltonian                  GFN2-xTB          :
          :  restarted?                      false          :
          :  GBSA solvation                  false          :
          :  PC potential                    false          :
          :  electronic temp.          300.0000000     K    :
          :  accuracy                    1.0000000          :
          :  -> integral cutoff          0.2500000E+02      :
          :  -> integral neglect         0.1000000E-07      :
          :  -> SCF convergence          0.1000000E-05 Eh   :
          :  -> wf. convergence          0.1000000E-03 e    :
          :  Broyden damping             0.4000000          :
          ...................................................

 iter      E             dE          RMSdq      gap      omega  full diag
   1     -9.1618909 -0.916189E+01  0.108E+01    0.15       0.0  T
   2     -7.7628365  0.139905E+01  0.148E+01    1.45       1.0  T
   3     -8.7367162 -0.973880E+00  0.910E+00    0.77       1.0  T
   4     -8.0068204  0.729896E+00  0.134E+01    0.45       1.0  T
   5     -9.2435794 -0.123676E+01  0.594E+00    0.33       1.0  T
   6     -9.3719725 -0.128393E+00  0.274E+00    0.08       1.0  T
   7     -9.3723069 -0.334347E-03  0.254E+00    0.13       1.0  T
   8     -9.3667430  0.556386E-02  0.167E+00    0.16       1.0  T
   9     -9.3874778 -0.207348E-01  0.634E-01    0.09       1.0  T
  10     -9.3878177 -0.339930E-03  0.518E-01    0.09       1.0  T
  11     -9.3879680 -0.150266E-03  0.346E-01    0.10       1.0  T
  12     -9.3884170 -0.449035E-03  0.137E-01    0.09       1.0  T
  13     -9.3885265 -0.109455E-03  0.698E-02    0.08       1.0  T
  14     -9.3885276 -0.111507E-05  0.387E-02    0.08       1.2  T
  15     -9.3885301 -0.256411E-05  0.166E-02    0.08       2.7  T
  16     -9.3885302 -0.839342E-08  0.644E-03    0.08       6.9  T
  17     -9.3885305 -0.307953E-06  0.120E-03    0.08      37.3  T
  18     -9.3885305  0.270926E-08  0.828E-04    0.08      54.0  T
  19     -9.3885305 -0.438710E-08  0.142E-04    0.08     315.5  T

   *** convergence criteria satisfied after 19 iterations ***

         #    Occupation            Energy/Eh            Energy/eV
      -------------------------------------------------------------
         1        2.0000           -0.6996210             -19.0377
       ...           ...                  ...                  ...
         4        2.0000           -0.5680257             -15.4568
         5        2.0000           -0.5180671             -14.0973
         6        2.0000           -0.5112704             -13.9124
         7        2.0000           -0.4959986             -13.4968
         8        2.0000           -0.4519656             -12.2986
         9        1.0000           -0.4320977             -11.7580
        10        0.8340           -0.4035110             -10.9801 (HOMO)
        11        0.1660           -0.4004443             -10.8966 (LUMO)
        12        0.0000           -0.3869836             -10.5304
        13                         -0.3339912              -9.0884
        14                          0.0490546               1.3348
        15                          0.0786454               2.1400
       ...                                ...                  ...
        17                          0.1266520               3.4464
      -------------------------------------------------------------
                  HL-Gap            0.0030667 Eh            0.0834 eV
             Fermi-level           -0.4220046 Eh          -11.4833 eV

 transition dipole moment (au) for excitation:           9          10
     X       Y       Z   
   0.1219   0.8655   0.0854  total (au/Debye):    0.878   2.232
 dE (eV)             :    0.778
 oscillator strength :  0.20788E-01

 SCC (total)                   0 d,  0 h,  0 min,  0.005 sec
 SCC setup                      ...        0 min,  0.000 sec (  2.191%)
 Dispersion                     ...        0 min,  0.000 sec (  0.389%)
 integral evaluation            ...        0 min,  0.001 sec ( 22.492%)
 zeroth order Hamiltonian       ...        0 min,  0.000 sec (  0.414%)
 iterations                     ...        0 min,  0.002 sec ( 36.472%)
 molecular gradient             ...        0 min,  0.001 sec ( 21.148%)
 printout                       ...        0 min,  0.001 sec ( 16.667%)

         :::::::::::::::::::::::::::::::::::::::::::::::::::::
         ::                     SUMMARY                     ::
         :::::::::::::::::::::::::::::::::::::::::::::::::::::
         :: total energy              -9.333939313103 Eh    ::
         :: gradient norm              0.217379235740 Eh/a0 ::
         :: HOMO-LUMO gap              0.083448570629 eV    ::
         ::.................................................::
         :: SCC energy                -9.388530465848 Eh    ::
         :: -> isotropic ES           -0.013851522472 Eh    ::
         :: -> anisotropic ES         -0.001755536504 Eh    ::
         :: -> anisotropic XC          0.013065795464 Eh    ::
         :: -> dispersion             -0.002202174821 Eh    ::
         :: repulsion energy           0.054591011657 Eh    ::
         :: add. restraining           0.000000000000 Eh    ::
         :::::::::::::::::::::::::::::::::::::::::::::::::::::

      ----------------------------------------------------------- 
     |                   =====================                   |
     |                        A N C O P T                        |
     |                   =====================                   |
     |               Approximate Normal Coordinate               |
     |                Rational Function Optimizer                |
      ----------------------------------------------------------- 

          ...................................................
          :                      SETUP                      :
          :.................................................:
          :   optimization level            normal          :
          :   max. optcycles                   200          :
          :   ANC micro-cycles                  20          :
          :   degrees of freedom                 9          :
          :.................................................:
          :   RF solver                   davidson          :
          :   write xtbopt.log                true          :
          :   linear?                        false          :
          :   energy convergence         0.5000000E-05 Eh   :
          :   grad. convergence          0.1000000E-02 Eh/α :
          :   maximium RF displ.         1.0000000          :
          :   Hlow (freq-cutoff)         0.1000000E-01      :
          :   Hmax (freq-cutoff)         5.0000000          :
          :   S6 in model hess.         20.0000000          :
          ...................................................

generating ANC from model Hessian ...
Using Lindh-Hessian (1995)
 Shifting diagonal of input Hessian by    0.0000000000000000     
 Lowest  eigenvalues of input Hessian
   -0.000000   -0.000000    0.000000    0.000000    0.000000    0.000000
    0.010428    0.027786    0.081990    0.088377    0.124055    0.559010
    0.802316    1.032404    1.129130
 Highest eigenvalues
    0.088377    0.124055    0.559010    0.802316    1.032404    1.129130


........................................................................
.............................. CYCLE    1 ..............................
........................................................................
   1     -9.3885305 -0.938853E+01  0.415E-05    0.08       0.0  T
   2     -9.3885305  0.294179E-09  0.217E-04    0.08     206.1  T
   3     -9.3885305 -0.284441E-09  0.456E-05    0.08     979.8  T
     SCC iter.                  ...        0 min,  0.001 sec
     gradient                   ...        0 min,  0.001 sec
 * total energy  :    -9.3339393 Eh     change        0.1911005E-10 Eh
   gradient norm :     0.2173786 Eh/α   predicted     0.0000000E+00 (-100.00%)
   displ. norm   :     0.3665548 α      lambda       -0.7037463E-01
   maximum displ.:     0.2827356 α      in ANC's #6, #2, #5, ...

........................................................................
.............................. CYCLE    2 ..............................
........................................................................
   1     -9.4738000 -0.947380E+01  0.217E+00    0.42       0.0  T
   2     -9.3345743  0.139226E+00  0.446E+00    0.14       1.0  T
   3     -9.4519625 -0.117388E+00  0.218E+00    0.51       1.0  T
   4     -9.4055214  0.464410E-01  0.332E+00    0.24       1.0  T
   5     -9.4808150 -0.752935E-01  0.803E-01    0.38       1.0  T
   6     -9.4843926 -0.357762E-02  0.461E-01    0.32       1.0  T
   7     -9.4843832  0.937591E-05  0.481E-01    0.32       1.0  T
   8     -9.4841531  0.230154E-03  0.230E-01    0.29       1.0  T
   9     -9.4844494 -0.296322E-03  0.456E-02    0.30       1.0  T
  10     -9.4844552 -0.581629E-05  0.151E-02    0.30       3.0  T
  11     -9.4844560 -0.829399E-06  0.955E-03    0.30       4.7  T
  12     -9.4844564 -0.382359E-06  0.104E-03    0.30      43.1  T
  13     -9.4844564 -0.299470E-08  0.459E-04    0.30      97.4  T
  14     -9.4844564 -0.681613E-09  0.639E-05    0.30     700.2  T
     SCC iter.                  ...        0 min,  0.001 sec
     gradient                   ...        0 min,  0.001 sec
 * total energy  :    -9.3893444 Eh     change       -0.5540510E-01 Eh
   gradient norm :     0.1177783 Eh/α   predicted    -0.3991516E-01 ( -27.96%)
   displ. norm   :     0.6075261 α      lambda       -0.5775831E-01
   maximum displ.:     0.4636939 α      in ANC's #4, #6, #2, ...

........................................................................
.............................. CYCLE    3 ..............................
........................................................................
   1     -9.5690037 -0.956900E+01  0.304E+00    1.34       0.0  T
   2     -9.4848989  0.841048E-01  0.387E+00    1.26       1.0  T
   3     -9.5604605 -0.755616E-01  0.214E+00    1.51       1.0  T
   4     -9.5588258  0.163474E-02  0.196E+00    1.10       1.0  T
   5     -9.5835589 -0.247331E-01  0.377E-01    1.38       1.0  T
   6     -9.5842650 -0.706040E-03  0.867E-02    1.34       1.0  T
   7     -9.5842532  0.117970E-04  0.524E-02    1.33       1.0  T
   8     -9.5842691 -0.159302E-04  0.959E-03    1.34       4.7  T
   9     -9.5842692 -0.135664E-06  0.131E-03    1.34      34.0  T
  10     -9.5842692  0.146065E-08  0.905E-04    1.34      49.4  T
  11     -9.5842692 -0.233474E-08  0.172E-04    1.34     259.4  T
     SCC iter.                  ...        0 min,  0.001 sec
     gradient                   ...        0 min,  0.001 sec
 * total energy  :    -9.4152209 Eh     change       -0.2587647E-01 Eh
   gradient norm :     0.1494592 Eh/α   predicted    -0.3953811E-01 (  52.80%)
   displ. norm   :     0.5690633 α      lambda       -0.3423401E-01
   maximum displ.:     0.4172886 α      in ANC's #2, #4, #5, ...

........................................................................
.............................. CYCLE    4 ..............................
........................................................................
   1     -9.5483999 -0.954840E+01  0.324E+00    0.67       0.0  T
   2     -9.3133174  0.235083E+00  0.604E+00    0.61       1.0  T
   3     -9.5514422 -0.238125E+00  0.178E+00    0.70       1.0  T
   4     -9.5588999 -0.745767E-02  0.975E-01    0.52       1.0  T
   5     -9.5615433 -0.264337E-02  0.535E-01    0.58       1.0  T
   6     -9.5626548 -0.111150E-02  0.305E-01    0.56       1.0  T
   7     -9.5629786 -0.323860E-03  0.882E-02    0.57       1.0  T
   8     -9.5630032 -0.245495E-04  0.214E-02    0.57       2.1  T
   9     -9.5630042 -0.999963E-06  0.497E-03    0.58       9.0  T
  10     -9.5630042 -0.114747E-07  0.233E-03    0.58      19.2  T
  11     -9.5630042 -0.188417E-07  0.512E-04    0.58      87.3  T
  12     -9.5630042 -0.685967E-09  0.201E-04    0.58     222.9  T
     SCC iter.                  ...        0 min,  0.001 sec
     gradient                   ...        0 min,  0.001 sec
 * total energy  :    -9.4351162 Eh     change       -0.1989531E-01 Eh
   gradient norm :     0.0968502 Eh/α   predicted    -0.2266002E-01 (  13.90%)
   displ. norm   :     0.6346905 α      lambda       -0.3474085E-01
   maximum displ.:     0.3853698 α      in ANC's #4, #3, #2, ...

........................................................................
.............................. CYCLE    5 ..............................
........................................................................
   1     -9.5525463 -0.955255E+01  0.616E+00    0.91       0.0  T
   2     -9.2218671  0.330679E+00  0.683E+00    0.73       1.0  T
   3     -9.1223254  0.995416E-01  0.744E+00    1.17       1.0  T
   4     -9.5919751 -0.469650E+00  0.293E+00    0.45       1.0  T
   5     -9.5978715 -0.589637E-02  0.166E+00    0.48       1.0  T
   6     -9.5968053  0.106617E-02  0.152E+00    0.48       1.0  T
   7     -9.5985538 -0.174847E-02  0.960E-01    0.50       1.0  T
   8     -9.5987043 -0.150528E-03  0.220E-01    0.48       1.0  T
   9     -9.5987402 -0.358270E-04  0.284E-01    0.48       1.0  T
  10     -9.5987483 -0.815962E-05  0.913E-02    0.47       1.0  T
  11     -9.5987571 -0.877940E-05  0.141E-02    0.47       3.2  T
  12     -9.5987575 -0.417862E-06  0.450E-03    0.46       9.9  T
  13     -9.5987576 -0.701588E-07  0.246E-03    0.46      18.1  T
  14     -9.5987576 -0.129428E-07  0.150E-03    0.46      29.8  T
  15     -9.5987576 -0.338311E-08  0.182E-04    0.46     245.1  T
  16     -9.5987576 -0.179840E-09  0.350E-05    0.46    1276.4  T
     SCC iter.                  ...        0 min,  0.001 sec
     gradient                   ...        0 min,  0.001 sec
 * total energy  :    -9.4697611 Eh     change       -0.3464490E-01 Eh
   gradient norm :     0.1700239 Eh/α   predicted    -0.2436777E-01 ( -29.66%)
   displ. norm   :     0.7898982 α      lambda       -0.4777577E-01
   maximum displ.:     0.4714151 α      in ANC's #4, #3, #2, ...

........................................................................
.............................. CYCLE    6 ..............................
........................................................................
   1     -9.4973792 -0.949738E+01  0.950E+00    0.66       0.0  T
   2     -8.7312154  0.766164E+00  0.104E+01    0.20       1.0  T
   3     -9.3881937 -0.656978E+00  0.689E+00    0.48       1.0  T
   4     -9.5913374 -0.203144E+00  0.471E+00    0.26       1.0  T
   5     -9.6498085 -0.584711E-01  0.416E+00    0.14       1.0  T
   6     -9.6656517 -0.158432E-01  0.286E+00    0.08       1.0  T
   7     -9.6655478  0.103837E-03  0.304E+00    0.09       1.0  T
   8     -9.6568902  0.865766E-02  0.327E+00    0.09       1.0  T
   9     -9.6456283  0.112619E-01  0.177E+00    0.05       1.0  T
  10     -9.6639320 -0.183037E-01  0.103E+00    0.05       1.0  T
  11     -9.6631006  0.831355E-03  0.985E-01    0.05       1.0  T
  12     -9.6706533 -0.755267E-02  0.169E-01    0.06       1.0  T
  13     -9.6706325  0.207682E-04  0.174E-01    0.06       1.0  T
  14     -9.6707358 -0.103265E-03  0.860E-02    0.06       1.0  T
  15     -9.6707772 -0.413960E-04  0.188E-02    0.06       2.4  T
  16     -9.6707759  0.127569E-05  0.224E-02    0.06       2.0  T
  17     -9.6707787 -0.277163E-05  0.211E-03    0.06      21.2  T
  18     -9.6707787  0.322478E-08  0.234E-03    0.06      19.1  T
  19     -9.6707787 -0.200702E-07  0.741E-04    0.06      60.3  T
  20     -9.6707787 -0.237446E-08  0.114E-04    0.06     390.7  T
     SCC iter.                  ...        0 min,  0.002 sec
     gradient                   ...        0 min,  0.001 sec
 * total energy  :    -9.4275863 Eh     change        0.4217480E-01 Eh
   gradient norm :     0.4365072 Eh/α   predicted    -0.3879247E-01 (-191.98%)
   displ. norm   :     0.4608586 α      lambda       -0.1705138E+00
   maximum displ.:     0.3831439 α      in ANC's #4, #6, #3, ...

........................................................................
.............................. CYCLE    7 ..............................
........................................................................
   1     -9.3160579 -0.931606E+01  0.699E+00    0.10       0.0  T
   2     -8.3056053  0.101045E+01  0.124E+01    0.90       1.0  T
   3     -9.5985446 -0.129294E+01  0.331E+00    0.85       1.0  T
   4     -9.5995797 -0.103514E-02  0.251E+00    1.00       1.0  T
   5     -9.5960659  0.351387E-02  0.127E+00    0.82       1.0  T
   6     -9.6012994 -0.523352E-02  0.451E-01    0.82       1.0  T
   7     -9.6022946 -0.995265E-03  0.142E-01    0.84       1.0  T
   8     -9.6023050 -0.103938E-04  0.841E-02    0.84       1.0  T
   9     -9.6023122 -0.715566E-05  0.132E-02    0.84       3.4  T
  10     -9.6023126 -0.456285E-06  0.493E-03    0.84       9.1  T
  11     -9.6023126 -0.345059E-08  0.983E-04    0.84      45.5  T
  12     -9.6023126 -0.104990E-08  0.546E-04    0.84      81.8  T
     SCC iter.                  ...        0 min,  0.001 sec
     gradient                   ...        0 min,  0.001 sec
 * total energy  :    -9.4866473 Eh     change       -0.5906097E-01 Eh
   gradient norm :     0.0929263 Eh/α   predicted    -0.1033646E+00 (  75.01%)
   displ. norm   :     0.2838338 α      lambda       -0.1207197E-01
   maximum displ.:     0.1776112 α      in ANC's #3, #1, #6, ...

........................................................................
.............................. CYCLE    8 ..............................
........................................................................
   1     -9.6261452 -0.962615E+01  0.106E+00    0.81       0.0  T
   2     -9.6256253  0.519864E-03  0.650E-01    0.96       1.0  T
   3     -9.6232768  0.234856E-02  0.690E-01    0.67       1.0  T
   4     -9.6267283 -0.345150E-02  0.157E-01    0.87       1.0  T
   5     -9.6268179 -0.896592E-04  0.625E-02    0.85       1.0  T
   6     -9.6268274 -0.944396E-05  0.430E-02    0.87       1.0  T
   7     -9.6268293 -0.193996E-05  0.166E-02    0.86       2.7  T
   8     -9.6268303 -0.102607E-05  0.521E-03    0.86       8.6  T
   9     -9.6268304 -0.992948E-07  0.120E-03    0.86      37.3  T
  10     -9.6268304 -0.129235E-09  0.569E-04    0.86      78.6  T
  11     -9.6268304 -0.371449E-09  0.120E-04    0.86     373.7  T
     SCC iter.                  ...        0 min,  0.001 sec
     gradient                   ...        0 min,  0.001 sec
 * total energy  :    -9.4932714 Eh     change       -0.6624146E-02 Eh
   gradient norm :     0.0990705 Eh/α   predicted    -0.6522254E-02 (  -1.54%)
   displ. norm   :     0.2410393 α      lambda       -0.1115497E-01
   maximum displ.:     0.1606815 α      in ANC's #1, #6, #2, ...

........................................................................
.............................. CYCLE    9 ..............................
........................................................................
   1     -9.6516871 -0.965169E+01  0.759E-01    0.97       0.0  T
   2     -9.6515996  0.874758E-04  0.580E-01    0.87       1.0  T
   3     -9.6519771 -0.377480E-03  0.341E-01    0.98       1.0  T
   4     -9.6522008 -0.223641E-03  0.125E-01    0.88       1.0  T
   5     -9.6523160 -0.115250E-03  0.346E-02    0.93       1.3  T
   6     -9.6523176 -0.161179E-05  0.196E-02    0.92       2.3  T
   7     -9.6523183 -0.708850E-06  0.453E-03    0.92       9.9  T
   8     -9.6523183 -0.717827E-08  0.129E-03    0.92      34.6  T
   9     -9.6523184 -0.369555E-08  0.431E-04    0.92     103.8  T
  10     -9.6523184 -0.194273E-09  0.793E-05    0.92     563.9  T
     SCC iter.                  ...        0 min,  0.001 sec
     gradient                   ...        0 min,  0.001 sec
 * total energy  :    -9.4996725 Eh     change       -0.6401122E-02 Eh
   gradient norm :     0.0746413 Eh/α   predicted    -0.5901537E-02 (  -7.80%)
   displ. norm   :     0.5652828 α      lambda       -0.1428955E-01
   maximum displ.:     0.4232075 α      in ANC's #2, #1, #6, ...

........................................................................
.............................. CYCLE   10 ..............................
........................................................................
   1     -9.6268434 -0.962684E+01  0.214E+00    1.24       0.0  T
   2     -9.5896748  0.371686E-01  0.255E+00    0.43       1.0  T
   3     -9.6390798 -0.494050E-01  0.835E-01    1.22       1.0  T
   4     -9.6386746  0.405218E-03  0.700E-01    1.11       1.0  T
   5     -9.6398666 -0.119196E-02  0.247E-01    1.19       1.0  T
   6     -9.6400326 -0.166018E-03  0.700E-02    1.18       1.0  T
   7     -9.6400462 -0.136202E-04  0.377E-02    1.17       1.2  T
   8     -9.6400451  0.114210E-05  0.354E-02    1.17       1.3  T
   9     -9.6400508 -0.575860E-05  0.548E-03    1.17       8.2  T
  10     -9.6400510 -0.165335E-06  0.869E-04    1.17      51.5  T
  11     -9.6400510 -0.110248E-08  0.655E-04    1.17      68.3  T
     SCC iter.                  ...        0 min,  0.001 sec
     gradient                   ...        0 min,  0.001 sec
 * total energy  :    -9.5050120 Eh     change       -0.5339519E-02 Eh
   gradient norm :     0.1054494 Eh/α   predicted    -0.9427848E-02 (  76.57%)
   displ. norm   :     0.4309194 α      lambda       -0.2690409E-01
   maximum displ.:     0.2227752 α      in ANC's #8, #1, #5, ...

........................................................................
.............................. CYCLE   11 ..............................
........................................................................
   1     -9.5781162 -0.957812E+01  0.415E+00    1.68       0.0  T
   2     -8.6294453  0.948671E+00  0.109E+01    0.89       1.0  T
   3     -9.6239583 -0.994513E+00  0.252E+00    1.14       1.0  T
   4     -9.6567242 -0.327658E-01  0.858E-01    1.53       1.0  T
   5     -9.6424127  0.143114E-01  0.147E+00    1.58       1.0  T
   6     -9.6570403 -0.146276E-01  0.380E-01    1.50       1.0  T
   7     -9.6569215  0.118868E-03  0.349E-01    1.49       1.0  T
   8     -9.6570689 -0.147439E-03  0.175E-01    1.49       1.0  T
   9     -9.6570080  0.608796E-04  0.899E-02    1.49       1.0  T
  10     -9.6570350 -0.269989E-04  0.726E-02    1.49       1.0  T
  11     -9.6570744 -0.394114E-04  0.455E-02    1.48       1.0  T
  12     -9.6570744  0.437881E-07  0.357E-02    1.48       1.3  T
  13     -9.6570765 -0.211383E-05  0.870E-03    1.48       5.1  T
  14     -9.6570765 -0.269509E-07  0.203E-03    1.48      22.0  T
  15     -9.6570765  0.134213E-08  0.140E-03    1.48      31.9  T
  16     -9.6570765 -0.867659E-08  0.252E-04    1.48     177.3  T
  17     -9.6570765 -0.219723E-09  0.337E-05    1.48    1328.3  T
     SCC iter.                  ...        0 min,  0.002 sec
     gradient                   ...        0 min,  0.001 sec
 * total energy  :    -9.5080046 Eh     change       -0.2992584E-02 Eh
   gradient norm :     0.1283845 Eh/α   predicted    -0.1594998E-01 ( 432.98%)
   displ. norm   :     0.2039683 α      lambda       -0.1895359E-01
   maximum displ.:     0.1442495 α      in ANC's #5, #3, #1, ...

........................................................................
.............................. CYCLE   12 ..............................
........................................................................
   1     -9.6496166 -0.964962E+01  0.127E+00    1.42       0.0  T
   2     -9.4535744  0.196042E+00  0.528E+00    2.04       1.0  T
   3     -9.6491449 -0.195570E+00  0.114E+00    1.41       1.0  T
   4     -9.6536691 -0.452421E-02  0.704E-01    1.45       1.0  T
   5     -9.6563895 -0.272037E-02  0.122E-01    1.49       1.0  T
   6     -9.6564536 -0.640904E-04  0.482E-02    1.50       1.0  T
   7     -9.6564483  0.525020E-05  0.455E-02    1.50       1.0  T
   8     -9.6564538 -0.547108E-05  0.192E-02    1.50       2.3  T
   9     -9.6564543 -0.480952E-06  0.152E-02    1.50       2.9  T
  10     -9.6564551 -0.787429E-06  0.977E-03    1.50       4.6  T
  11     -9.6564555 -0.463213E-06  0.342E-03    1.50      13.1  T
  12     -9.6564556 -0.618719E-07  0.215E-04    1.50     207.8  T
  13     -9.6564556  0.710294E-10  0.178E-04    1.50     250.7  T
     SCC iter.                  ...        0 min,  0.001 sec
     gradient                   ...        0 min,  0.001 sec
 * total energy  :    -9.5151196 Eh     change       -0.7114925E-02 Eh
   gradient norm :     0.0433878 Eh/α   predicted    -0.9871052E-02 (  38.74%)
   displ. norm   :     0.2632396 α      lambda       -0.5177555E-02
   maximum displ.:     0.2001788 α      in ANC's #1, #2, #3, ...

........................................................................
.............................. CYCLE   13 ..............................
........................................................................
   1     -9.6687017 -0.966870E+01  0.785E-01    1.37       0.0  T
   2     -9.6637901  0.491159E-02  0.948E-01    1.27       1.0  T
   3     -9.6248717  0.389185E-01  0.266E+00    1.48       1.0  T
   4     -9.6687737 -0.439021E-01  0.282E-01    1.37       1.0  T
   5     -9.6682534  0.520311E-03  0.409E-01    1.36       1.0  T
   6     -9.6680912  0.162230E-03  0.429E-01    1.35       1.0  T
   7     -9.6687433 -0.652131E-03  0.229E-01    1.37       1.0  T
   8     -9.6689184 -0.175028E-03  0.134E-01    1.37       1.0  T
   9     -9.6689781 -0.596896E-04  0.782E-02    1.38       1.0  T
  10     -9.6690060 -0.279674E-04  0.223E-02    1.38       2.0  T
  11     -9.6690084 -0.233255E-05  0.446E-03    1.38      10.0  T
  12     -9.6690085 -0.102620E-06  0.868E-05    1.38     515.1  T
  13     -9.6690085  0.331575E-10  0.950E-05    1.38     470.8  T
     SCC iter.                  ...        0 min,  0.001 sec
     gradient                   ...        0 min,  0.001 sec
 * total energy  :    -9.5168023 Eh     change       -0.1682761E-02 Eh
   gradient norm :     0.0457523 Eh/α   predicted    -0.2768171E-02 (  64.50%)
   displ. norm   :     0.1324318 α      lambda       -0.2804951E-02
   maximum displ.:     0.0741798 α      in ANC's #8, #6, #2, ...

........................................................................
.............................. CYCLE   14 ..............................
........................................................................
   1     -9.6708189 -0.967082E+01  0.503E-01    1.46       0.0  T
   2     -9.6667993  0.401958E-02  0.756E-01    1.38       1.0  T
   3     -9.6402169  0.265824E-01  0.228E+00    1.54       1.0  T
   4     -9.6691768 -0.289599E-01  0.504E-01    1.47       1.0  T
   5     -9.6708100 -0.163314E-02  0.172E-01    1.43       1.0  T
   6     -9.6707214  0.885802E-04  0.203E-01    1.43       1.0  T
   7     -9.6709339 -0.212498E-03  0.688E-02    1.43       1.0  T
   8     -9.6709567 -0.228580E-04  0.215E-02    1.44       2.1  T
   9     -9.6709580 -0.131409E-05  0.136E-02    1.44       3.3  T
  10     -9.6709590 -0.946109E-06  0.393E-03    1.44      11.4  T
  11     -9.6709591 -0.811486E-07  0.706E-04    1.44      63.3  T
  12     -9.6709591 -0.260549E-08  0.104E-04    1.44     428.8  T
     SCC iter.                  ...        0 min,  0.001 sec
     gradient                   ...        0 min,  0.001 sec
 * total energy  :    -9.5188619 Eh     change       -0.2059614E-02 Eh
   gradient norm :     0.0232752 Eh/α   predicted    -0.1427071E-02 ( -30.71%)
   displ. norm   :     0.1982933 α      lambda       -0.2479750E-02
   maximum displ.:     0.1235600 α      in ANC's #8, #6, #1, ...

........................................................................
.............................. CYCLE   15 ..............................
........................................................................
   1     -9.6701627 -0.967016E+01  0.694E-01    1.52       0.0  T
   2     -9.5288247  0.141338E+00  0.476E+00    1.82       1.0  T
   3     -9.6716230 -0.142798E+00  0.315E-01    1.55       1.0  T
   4     -9.6714887  0.134266E-03  0.214E-01    1.55       1.0  T
   5     -9.6716691 -0.180323E-03  0.769E-02    1.55       1.0  T
   6     -9.6716366  0.325058E-04  0.103E-01    1.55       1.0  T
   7     -9.6716610 -0.243949E-04  0.754E-02    1.55       1.0  T
   8     -9.6716945 -0.335794E-04  0.485E-03    1.54       9.2  T
   9     -9.6716945  0.455962E-07  0.511E-03    1.54       8.8  T
  10     -9.6716946 -0.108279E-06  0.201E-04    1.54     222.2  T
  11     -9.6716946  0.239387E-09  0.226E-04    1.54     197.5  T
     SCC iter.                  ...        0 min,  0.001 sec
     gradient                   ...        0 min,  0.001 sec
 * total energy  :    -9.5205131 Eh     change       -0.1651158E-02 Eh
   gradient norm :     0.0159578 Eh/α   predicted    -0.1288629E-02 ( -21.96%)
   displ. norm   :     0.1592991 α      lambda       -0.1077163E-02
   maximum displ.:     0.0953389 α      in ANC's #1, #8, #6, ...

........................................................................
.............................. CYCLE   16 ..............................
........................................................................
   1     -9.6691919 -0.966919E+01  0.476E-01    1.53       0.0  T
   2     -9.5708153  0.983766E-01  0.400E+00    1.73       1.0  T
   3     -9.6698048 -0.989895E-01  0.237E-01    1.56       1.0  T
   4     -9.6697086  0.961898E-04  0.186E-01    1.56       1.0  T
   5     -9.6698418 -0.133206E-03  0.233E-02    1.56       1.9  T
   6     -9.6698259  0.158903E-04  0.564E-02    1.56       1.0  T
   7     -9.6698350 -0.906977E-05  0.395E-02    1.56       1.1  T
   8     -9.6698439 -0.884969E-05  0.814E-03    1.56       5.5  T
   9     -9.6698437  0.133412E-06  0.894E-03    1.56       5.0  T
  10     -9.6698441 -0.363612E-06  0.352E-03    1.56      12.7  T
  11     -9.6698441 -0.352427E-07  0.236E-03    1.56      18.9  T
  12     -9.6698441 -0.290707E-07  0.225E-04    1.56     198.7  T
  13     -9.6698441 -0.256316E-09  0.243E-05    1.56    1844.1  T
     SCC iter.                  ...        0 min,  0.001 sec
     gradient                   ...        0 min,  0.001 sec
 * total energy  :    -9.5211814 Eh     change       -0.6683378E-03 Eh
   gradient norm :     0.0073728 Eh/α   predicted    -0.5522459E-03 ( -17.37%)
   displ. norm   :     0.1288279 α      lambda       -0.6738107E-03
   maximum displ.:     0.0850548 α      in ANC's #2, #1, #8, ...

........................................................................
.............................. CYCLE   17 ..............................
........................................................................
   1     -9.6729183 -0.967292E+01  0.719E-01    1.55       0.0  T
   2     -9.5096275  0.163291E+00  0.504E+00    1.91       1.0  T
   3     -9.6744621 -0.164835E+00  0.405E-01    1.58       1.0  T
   4     -9.6747019 -0.239830E-03  0.269E-01    1.58       1.0  T
   5     -9.6749890 -0.287080E-03  0.128E-01    1.59       1.0  T
   6     -9.6750786 -0.895926E-04  0.456E-02    1.59       1.0  T
   7     -9.6750831 -0.455415E-05  0.335E-02    1.59       1.3  T
   8     -9.6750857 -0.251596E-05  0.234E-02    1.59       1.9  T
   9     -9.6750888 -0.314429E-05  0.576E-03    1.59       7.8  T
  10     -9.6750888 -0.268319E-07  0.515E-03    1.59       8.7  T
  11     -9.6750890 -0.130014E-06  0.106E-03    1.60      42.3  T
  12     -9.6750890 -0.528876E-08  0.158E-04    1.60     283.2  T
  13     -9.6750890 -0.920313E-10  0.601E-05    1.60     744.3  T
     SCC iter.                  ...        0 min,  0.001 sec
     gradient                   ...        0 min,  0.001 sec
 * total energy  :    -9.5211933 Eh     change       -0.1184997E-04 Eh
   gradient norm :     0.0193111 Eh/α   predicted    -0.3424969E-03 (2790.28%)
   displ. norm   :     0.0483965 α      lambda       -0.5752658E-03
   maximum displ.:     0.0386695 α      in ANC's #1, #2, #5, ...

........................................................................
.............................. CYCLE   18 ..............................
........................................................................
   1     -9.6693500 -0.966935E+01  0.474E-01    1.63       0.0  T
   2     -9.6575646  0.117854E-01  0.122E+00    1.35       1.0  T
   3     -9.6705331 -0.129685E-01  0.139E-01    1.61       1.0  T
   4     -9.6703529  0.180224E-03  0.199E-01    1.60       1.0  T
   5     -9.6705414 -0.188501E-03  0.508E-02    1.61       1.0  T
   6     -9.6704323  0.109120E-03  0.146E-01    1.62       1.0  T
   7     -9.6705035 -0.711806E-04  0.911E-02    1.62       1.0  T
   8     -9.6705196 -0.161667E-04  0.734E-02    1.61       1.0  T
   9     -9.6705471 -0.275067E-04  0.169E-02    1.61       2.7  T
  10     -9.6705486 -0.145415E-05  0.292E-03    1.61      15.3  T
  11     -9.6705486 -0.414887E-07  0.461E-04    1.61      97.1  T
  12     -9.6705486 -0.549155E-09  0.298E-04    1.61     150.0  T
     SCC iter.                  ...        0 min,  0.001 sec
     gradient                   ...        0 min,  0.001 sec
 * total energy  :    -9.5214796 Eh     change       -0.2863117E-03 Eh
   gradient norm :     0.0068427 Eh/α   predicted    -0.2883054E-03 (   0.70%)
   displ. norm   :     0.0440794 α      lambda       -0.1172987E-03
   maximum displ.:     0.0288922 α      in ANC's #1, #8, #6, ...

........................................................................
.............................. CYCLE   19 ..............................
........................................................................
   1     -9.6693784 -0.966938E+01  0.613E-01    1.62       0.0  T
   2     -9.6512691  0.181093E-01  0.149E+00    1.24       1.0  T
   3     -9.6713844 -0.201153E-01  0.100E-01    1.60       1.0  T
   4     -9.6712842  0.100279E-03  0.175E-01    1.58       1.0  T
   5     -9.6714245 -0.140337E-03  0.560E-02    1.59       1.0  T
   6     -9.6711860  0.238457E-03  0.213E-01    1.60       1.0  T
   7     -9.6714231 -0.237068E-03  0.453E-02    1.59       1.0  T
   8     -9.6714335 -0.103738E-04  0.121E-02    1.59       3.7  T
   9     -9.6714340 -0.531750E-06  0.661E-03    1.59       6.8  T
  10     -9.6714342 -0.223889E-06  0.121E-03    1.59      37.0  T
  11     -9.6714342 -0.599536E-08  0.592E-04    1.59      75.5  T
  12     -9.6714342 -0.184302E-08  0.542E-05    1.59     824.5  T
     SCC iter.                  ...        0 min,  0.001 sec
     gradient                   ...        0 min,  0.001 sec
 * total energy  :    -9.5215510 Eh     change       -0.7141517E-04 Eh
   gradient norm :     0.0064657 Eh/α   predicted    -0.5876404E-04 ( -17.71%)
   displ. norm   :     0.0395796 α      lambda       -0.1322007E-03
   maximum displ.:     0.0230398 α      in ANC's #4, #6, #9, ...

........................................................................
.............................. CYCLE   20 ..............................
........................................................................
   1     -9.6701066 -0.967011E+01  0.565E-01    1.62       0.0  T
   2     -9.6515568  0.185498E-01  0.152E+00    1.28       1.0  T
   3     -9.6716431 -0.200862E-01  0.142E-01    1.60       1.0  T
   4     -9.6714834  0.159628E-03  0.230E-01    1.58       1.0  T
   5     -9.6717007 -0.217306E-03  0.116E-01    1.59       1.0  T
   6     -9.6713006  0.400156E-03  0.298E-01    1.60       1.0  T
   7     -9.6716880 -0.387427E-03  0.129E-01    1.60       1.0  T
   8     -9.6717728 -0.848001E-04  0.292E-02    1.59       1.5  T
   9     -9.6717749 -0.212697E-05  0.210E-02    1.59       2.1  T
  10     -9.6717772 -0.231031E-05  0.850E-04    1.59      52.6  T
  11     -9.6717772  0.834522E-08  0.149E-03    1.59      30.0  T
  12     -9.6717772 -0.106613E-07  0.469E-04    1.59      95.4  T
  13     -9.6717772 -0.116436E-08  0.306E-05    1.59    1462.0  T
     SCC iter.                  ...        0 min,  0.001 sec
     gradient                   ...        0 min,  0.001 sec
 * total energy  :    -9.5216513 Eh     change       -0.1002978E-03 Eh
   gradient norm :     0.0044738 Eh/α   predicted    -0.6620515E-04 ( -33.99%)
   displ. norm   :     0.0607725 α      lambda       -0.1450872E-03
   maximum displ.:     0.0322291 α      in ANC's #9, #4, #2, ...
 * RMSD in coord.:     1.3127190 α      energy gain  -0.1877120E+00 Eh

generating ANC from model Hessian ...
Using Lindh-Hessian (1995)
 Shifting diagonal of input Hessian by    9.4131835680938501E-003
 Lowest  eigenvalues of input Hessian
   -0.000000   -0.000000   -0.000000   -0.000000    0.000000    0.000000
    0.010000    0.011280    0.113530    0.292406    0.609472    1.000986
    1.262325    1.623056    2.414857
 Highest eigenvalues
    0.292406    0.609472    1.000986    1.262325    1.623056    2.414857


........................................................................
.............................. CYCLE   21 ..............................
........................................................................
   1     -9.6690711 -0.966907E+01  0.809E-01    1.62       0.0  T
   2     -9.6396950  0.293761E-01  0.191E+00    1.16       1.0  T
   3     -9.6715555 -0.318605E-01  0.315E-01    1.61       1.0  T
   4     -9.6710962  0.459284E-03  0.452E-01    1.57       1.0  T
   5     -9.6718241 -0.727924E-03  0.266E-01    1.58       1.0  T
   6     -9.6700498  0.177431E-02  0.639E-01    1.61       1.0  T
   7     -9.6720856 -0.203580E-02  0.156E-01    1.60       1.0  T
   8     -9.6722091 -0.123438E-03  0.353E-02    1.59       1.3  T
   9     -9.6722066  0.246700E-05  0.418E-02    1.59       1.1  T
  10     -9.6722158 -0.925276E-05  0.300E-03    1.59      14.9  T
  11     -9.6722159 -0.236487E-07  0.205E-03    1.59      21.9  T
  12     -9.6722159 -0.214894E-07  0.298E-04    1.59     150.2  T
  13     -9.6722159 -0.443622E-09  0.539E-05    1.59     829.5  T
     SCC iter.                  ...        0 min,  0.001 sec
     gradient                   ...        0 min,  0.001 sec
 * total energy  :    -9.5217344 Eh     change       -0.8312025E-04 Eh
   gradient norm :     0.0052058 Eh/α   predicted     0.0000000E+00 (-100.00%)
   displ. norm   :     0.2385237 α      lambda       -0.6770320E-03
   maximum displ.:     0.1957944 α      in ANC's #2, #1, #3, ...

........................................................................
.............................. CYCLE   22 ..............................
........................................................................
   1     -9.6650194 -0.966502E+01  0.702E-01    1.60       0.0  T
   2     -9.6469772  0.180421E-01  0.174E+00    1.67       1.0  T
   3     -9.6584202 -0.114429E-01  0.106E+00    1.53       1.0  T
   4     -9.6649416 -0.652140E-02  0.177E-01    1.61       1.0  T
   5     -9.6648605  0.810325E-04  0.245E-01    1.59       1.0  T
   6     -9.6646336  0.226921E-03  0.301E-01    1.59       1.0  T
   7     -9.6651419 -0.508318E-03  0.608E-02    1.60       1.0  T
   8     -9.6651619 -0.199949E-04  0.905E-03    1.60       4.9  T
   9     -9.6651623 -0.356162E-06  0.181E-03    1.60      24.8  T
  10     -9.6651623 -0.554081E-09  0.110E-03    1.60      40.5  T
  11     -9.6651623 -0.317559E-08  0.621E-04    1.60      72.0  T
  12     -9.6651623 -0.198811E-08  0.101E-04    1.60     443.7  T
     SCC iter.                  ...        0 min,  0.001 sec
     gradient                   ...        0 min,  0.001 sec
 * total energy  :    -9.5200276 Eh     change        0.1706790E-02 Eh
   gradient norm :     0.0211990 Eh/α   predicted    -0.3577732E-03 (-120.96%)
   displ. norm   :     0.1956070 α      lambda       -0.3626476E-02
   maximum displ.:     0.1690406 α      in ANC's #2, #1, #3, ...

........................................................................
.............................. CYCLE   23 ..............................
........................................................................
   1     -9.6731264 -0.967313E+01  0.575E-01    1.60       0.0  T
   2     -9.6701205  0.300592E-02  0.733E-01    1.55       1.0  T
   3     -9.6274110  0.427095E-01  0.275E+00    1.71       1.0  T
   4     -9.6729677 -0.455567E-01  0.197E-01    1.61       1.0  T
   5     -9.6730516 -0.838693E-04  0.175E-01    1.59       1.0  T
   6     -9.6729289  0.122635E-03  0.220E-01    1.59       1.0  T
   7     -9.6731744 -0.245491E-03  0.830E-02    1.60       1.0  T
   8     -9.6732051 -0.307365E-04  0.336E-02    1.60       1.3  T
   9     -9.6732059 -0.734865E-06  0.310E-02    1.60       1.4  T
  10     -9.6732107 -0.483382E-05  0.733E-03    1.60       6.1  T
  11     -9.6732110 -0.259048E-06  0.174E-03    1.60      25.7  T
  12     -9.6732110 -0.149038E-07  0.222E-04    1.60     201.1  T
  13     -9.6732110 -0.194751E-09  0.112E-04    1.60     399.1  T
     SCC iter.                  ...        0 min,  0.001 sec
     gradient                   ...        0 min,  0.001 sec
 * total energy  :    -9.5217996 Eh     change       -0.1771986E-02 Eh
   gradient norm :     0.0027820 Eh/α   predicted    -0.1882613E-02 (   6.24%)
   displ. norm   :     0.0276582 α      lambda       -0.2208611E-04
   maximum displ.:     0.0258163 α      in ANC's #1, #2, #3, ...

........................................................................
.............................. CYCLE   24 ..............................
........................................................................
   1     -9.6727896 -0.967279E+01  0.743E-02    1.61       0.0  T
   2     -9.6707567  0.203296E-02  0.567E-01    1.63       1.0  T
   3     -9.6727924 -0.203574E-02  0.525E-02    1.61       1.0  T
   4     -9.6728015 -0.910241E-05  0.130E-02    1.61       3.4  T
   5     -9.6728021 -0.609122E-06  0.582E-03    1.61       7.7  T
   6     -9.6728023 -0.169540E-06  0.163E-03    1.61      27.4  T
   7     -9.6728023 -0.698760E-08  0.541E-04    1.61      82.7  T
   8     -9.6728023 -0.870948E-09  0.249E-04    1.61     179.9  T
     SCC iter.                  ...        0 min,  0.001 sec
     gradient                   ...        0 min,  0.001 sec
 * total energy  :    -9.5218098 Eh     change       -0.1014176E-04 Eh
   gradient norm :     0.0017142 Eh/α   predicted    -0.1104975E-04 (   8.95%)
   displ. norm   :     0.0284073 α      lambda       -0.1880026E-04
   maximum displ.:     0.0168530 α      in ANC's #3, #2, #1, ...

........................................................................
.............................. CYCLE   25 ..............................
........................................................................
   1     -9.6721813 -0.967218E+01  0.120E-01    1.62       0.0  T
   2     -9.6623139  0.986741E-02  0.125E+00    1.68       1.0  T
   3     -9.6721726 -0.985870E-02  0.109E-01    1.62       1.0  T
   4     -9.6722291 -0.565544E-04  0.308E-02    1.62       1.5  T
   5     -9.6722331 -0.393891E-05  0.878E-03    1.62       5.1  T
   6     -9.6722333 -0.209378E-06  0.440E-03    1.62      10.2  T
   7     -9.6722334 -0.998692E-07  0.119E-03    1.62      37.7  T
   8     -9.6722334 -0.875962E-08  0.175E-04    1.62     255.9  T
   9     -9.6722334  0.120783E-08  0.465E-04    1.62      96.3  T
     SCC iter.                  ...        0 min,  0.001 sec
     gradient                   ...        0 min,  0.001 sec
 * total energy  :    -9.5218231 Eh     change       -0.1331307E-04 Eh
   gradient norm :     0.0018827 Eh/α   predicted    -0.9403801E-05 ( -29.36%)
   displ. norm   :     0.0210133 α      lambda       -0.1265907E-04
   maximum displ.:     0.0187999 α      in ANC's #3, #2, #7, ...

........................................................................
.............................. CYCLE   26 ..............................
........................................................................
   1     -9.6725273 -0.967253E+01  0.593E-02    1.63       0.0  T
   2     -9.6716082  0.919080E-03  0.383E-01    1.65       1.0  T
   3     -9.6725310 -0.922803E-03  0.354E-02    1.63       1.3  T
   4     -9.6725292  0.185491E-05  0.313E-02    1.63       1.4  T
   5     -9.6725313 -0.209820E-05  0.218E-02    1.63       2.1  T
   6     -9.6725333 -0.201575E-05  0.116E-02    1.63       3.9  T
   7     -9.6725337 -0.416671E-06  0.758E-03    1.63       5.9  T
   8     -9.6725340 -0.312244E-06  0.186E-03    1.63      24.1  T
   9     -9.6725340 -0.180179E-07  0.584E-04    1.63      76.6  T
  10     -9.6725340 -0.188934E-08  0.760E-05    1.63     588.3  T
     SCC iter.                  ...        0 min,  0.001 sec
     gradient                   ...        0 min,  0.001 sec
 * total energy  :    -9.5218352 Eh     change       -0.1208696E-04 Eh
   gradient norm :     0.0011199 Eh/α   predicted    -0.6331807E-05 ( -47.61%)
   displ. norm   :     0.0103319 α      lambda       -0.2398509E-05
   maximum displ.:     0.0091916 α      in ANC's #3, #2, #7, ...

........................................................................
.............................. CYCLE   27 ..............................
........................................................................
   1     -9.6725254 -0.967253E+01  0.283E-02    1.63       0.0  T
   2     -9.6725140  0.114669E-04  0.433E-02    1.63       1.0  T
   3     -9.6724419  0.720618E-04  0.117E-01    1.64       1.0  T
   4     -9.6725221 -0.802138E-04  0.275E-02    1.63       1.6  T
   5     -9.6725250 -0.289773E-05  0.125E-02    1.63       3.6  T
   6     -9.6725258 -0.812257E-06  0.417E-03    1.63      10.7  T
   7     -9.6725259 -0.927832E-07  0.106E-03    1.63      42.3  T
   8     -9.6725259 -0.508075E-08  0.459E-04    1.63      97.5  T
   9     -9.6725259 -0.120879E-08  0.390E-05    1.63    1145.3  T
     SCC iter.                  ...        0 min,  0.001 sec
     gradient                   ...        0 min,  0.001 sec
 * total energy  :    -9.5218371 Eh     change       -0.1958860E-05 Eh
   gradient norm :     0.0006297 Eh/α   predicted    -0.1197441E-05 ( -38.87%)
   displ. norm   :     0.0017653 α      lambda       -0.3869296E-06
   maximum displ.:     0.0012726 α      in ANC's #1, #7, #3, ...

   *** GEOMETRY OPTIMIZATION CONVERGED AFTER 27 ITERATIONS ***

------------------------------------------------------------------------
 total energy gain   :        -0.1878978 Eh     -117.9077 kcal/mol
 total RMSD          :         1.3080351 a0        0.6922 Å
 total power (kW/mol):       -18.2713193 (step)-5815.9490 (real)
------------------------------------------------------------------------

 ANCopt (total)                0 d,  0 h,  0 min,  0.085 sec
 optimizer setup                ...        0 min,  0.000 sec (  0.082%)
 model hessian                  ...        0 min,  0.000 sec (  0.145%)
 ANC generation                 ...        0 min,  0.000 sec (  0.133%)
 coordinate transformation      ...        0 min,  0.000 sec (  0.067%)
 single point calculation       ...        0 min,  0.082 sec ( 97.156%)
 optimization log               ...        0 min,  0.001 sec (  0.778%)
 hessian update                 ...        0 min,  0.000 sec (  0.068%)
 rational function              ...        0 min,  0.001 sec (  0.720%)

================
 final structure:
================
5
 xtb: 6.2.2 (9d81278992624c895f80dd42a50cac0aa55982e2)
C         1.09908591300922    0.24528236266605    0.09408059128428
C        -0.19278231771631    0.09603679605033    0.02043139210595
C        -1.53549909109927    0.63273867172702    0.12999687860552
N        -1.34509919895995   -0.62885652836189   -0.20371001892191
H         1.97429469476630   -0.34520130208151   -0.04079884307384

 Bond Distances (Angstroems)
 ---------------------------
C1-C2=1.3025         C1-H5=1.0644         C2-C1=1.3025         C2-C3=1.4502         C2-N4=1.3797         C3-C2=1.4502         
C3-N4=1.3188         N4-C2=1.3797         N4-C3=1.3188         H5-C1=1.0644         
 C  H  Rav=1.0644 sigma=0.0000  Rmin=1.0644  Rmax=1.0644     1
 C  C  Rav=1.3763 sigma=0.0738  Rmin=1.3025  Rmax=1.4502     2
 N  C  Rav=1.3492 sigma=0.0304  Rmin=1.3188  Rmax=1.3797     2

 selected bond angles (degree)
 --------------------
H5-C1-C2=138.14                C3-C2-C1=150.65                N4-C2-C1=153.86                N4-C2-C3= 55.49                
N4-C3-C2= 59.55                C3-N4-C2= 64.97                

 selected dihedral angles (degree)
 ---------------------------------
C3-C2-C1-H5=179.90            N4-C2-C1-H5=359.97            N4-C3-C2-C1=180.04            C3-N4-C2-C1=179.96            
           -------------------------------------------------
          |                Final Singlepoint                |
           -------------------------------------------------

          ...................................................
          :                      SETUP                      :
          :.................................................:
          :  # basis functions                  17          :
          :  # atomic orbitals                  17          :
          :  # shells                            9          :
          :  # electrons                        18          :
          :  max. iterations                   250          :
          :  Hamiltonian                  GFN2-xTB          :
          :  restarted?                      false          :
          :  GBSA solvation                  false          :
          :  PC potential                    false          :
          :  electronic temp.          300.0000000     K    :
          :  accuracy                    1.0000000          :
          :  -> integral cutoff          0.2500000E+02      :
          :  -> integral neglect         0.1000000E-07      :
          :  -> SCF convergence          0.1000000E-05 Eh   :
          :  -> wf. convergence          0.1000000E-03 e    :
          :  Broyden damping             0.4000000          :
          ...................................................

 iter      E             dE          RMSdq      gap      omega  full diag
   1     -9.6725259 -0.967253E+01  0.315E-05    1.63       0.0  T
   2     -9.6725259  0.108001E-09  0.121E-04    1.63     368.9  T
   3     -9.6725259  0.839844E-10  0.180E-04    1.63     248.0  T

   *** convergence criteria satisfied after 3 iterations ***

         #    Occupation            Energy/Eh            Energy/eV
      -------------------------------------------------------------
         1        2.0000           -0.7208013             -19.6140
       ...           ...                  ...                  ...
         4        2.0000           -0.5678051             -15.4508
         5        2.0000           -0.5527304             -15.0406
         6        2.0000           -0.5216108             -14.1938
         7        2.0000           -0.4538294             -12.3493
         8        1.7896           -0.4296752             -11.6921
         9        1.2104           -0.4271628             -11.6237
        10        1.0000           -0.3575812              -9.7303 (HOMO)
        11                         -0.2975574              -8.0970 (LUMO)
        12                         -0.2146807              -5.8418
        13                         -0.0412256              -1.1218
        14                          0.0764859               2.0813
        15                          0.2415230               6.5722
       ...                                ...                  ...
        17                          0.8195285              22.3005
      -------------------------------------------------------------
                  HL-Gap            0.0600238 Eh            1.6333 eV
             Fermi-level           -0.3779942 Eh          -10.2857 eV

 transition dipole moment (au) for excitation:           9          10
     X       Y       Z   
   0.0026   0.0192  -0.0704  total (au/Debye):    0.073   0.186
 dE (eV)             :    1.893
 oscillator strength :  0.34987E-03

 SCC (total)                   0 d,  0 h,  0 min,  0.003 sec
 SCC setup                      ...        0 min,  0.000 sec (  1.559%)
 Dispersion                     ...        0 min,  0.000 sec (  0.333%)
 integral evaluation            ...        0 min,  0.001 sec ( 29.699%)
 zeroth order Hamiltonian       ...        0 min,  0.000 sec (  0.370%)
 iterations                     ...        0 min,  0.000 sec ( 14.172%)
 molecular gradient             ...        0 min,  0.001 sec ( 30.228%)
 printout                       ...        0 min,  0.001 sec ( 23.465%)

         :::::::::::::::::::::::::::::::::::::::::::::::::::::
         ::                     SUMMARY                     ::
         :::::::::::::::::::::::::::::::::::::::::::::::::::::
         :: total energy              -9.521837119136 Eh    ::
         :: gradient norm              0.000625445796 Eh/a0 ::
         :: HOMO-LUMO gap              1.633330274918 eV    ::
         ::.................................................::
         :: SCC energy                -9.672525938727 Eh    ::
         :: -> isotropic ES           -0.000777216411 Eh    ::
         :: -> anisotropic ES          0.001480302015 Eh    ::
         :: -> anisotropic XC          0.012536041536 Eh    ::
         :: -> dispersion             -0.002104931152 Eh    ::
         :: repulsion energy           0.150688835478 Eh    ::
         :: add. restraining           0.000000000000 Eh    ::
         :::::::::::::::::::::::::::::::::::::::::::::::::::::

           ------------------------------------------------- 
          |                Numerical Hessian                |
           ------------------------------------------------- 
step length          :   0.00500
SCC accuracy         :   0.30000
Hessian scale factor :   1.00000
frozen atoms in %    :   0.00000    0
RMS gradient         :   0.00063
estimated CPU  time      0.00 min
estimated wall time      0.00 min

writing file <hessian>.

 projected vibrational frequencies (cm-1)
eigval :       -0.00    -0.00     0.00     0.00     0.00     0.00
eigval :      330.18   350.99   540.56   608.93   676.43   858.81
eigval :     1279.44  1789.87  3184.49
           -------------------------------------------------
          |                Property Printout                |
           -------------------------------------------------

    * Orbital Energies and Occupations

         #    Occupation            Energy/Eh            Energy/eV
      -------------------------------------------------------------
         1        2.0000           -0.7208013             -19.6140
         2        2.0000           -0.6543212             -17.8050
         3        2.0000           -0.5828945             -15.8614
         4        2.0000           -0.5678051             -15.4508
         5        2.0000           -0.5527304             -15.0406
         6        2.0000           -0.5216108             -14.1938
         7        2.0000           -0.4538294             -12.3493
         8        1.7895           -0.4296750             -11.6921
         9        1.2105           -0.4271629             -11.6237
        10        1.0000           -0.3575813              -9.7303 (HOMO)
        11                         -0.2975573              -8.0969 (LUMO)
        12                         -0.2146808              -5.8418
        13                         -0.0412255              -1.1218
        14                          0.0764858               2.0813
        15                          0.2415230               6.5722
        16                          0.3670592               9.9882
        17                          0.8195284              22.3005
      -------------------------------------------------------------
                  HL-Gap            0.0600240 Eh            1.6333 eV
             Fermi-level           -0.3779941 Eh          -10.2857 eV

     #   Z        covCN         q      C6AA      α(0)
     1   6 C      1.908    -0.098    33.804     9.390
     2   6 C      2.869     0.154    24.666     8.141
     3   6 C      1.890    -0.050    32.459     9.202
     4   7 N      1.820    -0.108    24.115     7.276
     5   1 H      0.927     0.101     1.772     2.082

 Mol. C6AA /au·bohr⁶  :        515.338970
 Mol. C8AA /au·bohr⁸  :      13507.365340
 Mol. α(0) /au        :         36.090222


Wiberg/Mayer (AO) data.
largest (>0.10) Wiberg bond orders for each atom
          total WBO             WBO to atom ...
     1  C   2.692        C    2 1.664    H    5 0.940
     2  C   3.683        C    1 1.664    N    4 1.069    C    3 0.944
     3  C   2.494        N    4 1.497    C    2 0.944
     4  N   2.615        C    3 1.497    C    2 1.069
     5  H   0.960        C    1 0.940

MOs/occ written to file <molden.input>


molecular dipole:
                 x           y           z       tot (Debye)
 q only:        0.538      -0.015       0.010
Molecule has the following symmetry elements: (sigma) 
It seems to be the Cs point group
   full:        0.790      -0.265      -0.051       2.121
molecular quadrupole (traceless):
                xx          xy          yy          xz          yz          zz
 q only:        0.004      -0.756      -0.133      -0.206      -0.099       0.129
  q+dip:        0.514      -1.239      -0.898      -0.330      -0.409       0.384
   full:       -1.174      -0.981      -1.461      -0.369      -1.215       2.635

           -------------------------------------------------
          |                Geometry Summary                 |
           -------------------------------------------------

      molecular mass/u    :       51.0468517
   center of mass at/Å    :       -0.4781396       0.0498195       0.0008303
  moments of inertia/u·Å² :        0.1166441E+02   0.6128170E+02   0.7294611E+02
rotational constants/cm⁻¹ :        0.1445220E+01   0.2750843E+00   0.2310971E+00

 * 1 selected distances

     #   Z        #   Z                                     value/Å
     1   6 C      2   6 C                                 1.3025444 (max)

 * 1 distinct bonds (by element types)

   Z      Z             #   av. dist./Å        max./Å        min./Å
   6 C    6 C           1     1.3025444     1.3025444     1.3025444

           -------------------------------------------------
          |               Frequency Printout                |
           -------------------------------------------------
 projected vibrational frequencies (cm-1)
eigval :       -0.00    -0.00     0.00     0.00     0.00     0.00
eigval :      330.18   350.99   540.56   608.93   676.43   858.81
eigval :     1279.44  1789.87  3184.49
 reduced masses (amu)
   1: 11.99   2: 12.03   3: 12.18   4: 12.92   5: 11.26   6: 12.18   7: 10.47   8: 10.57
   9: 12.35  10:  4.16  11:  4.38  12: 12.14  13: 12.40  14: 12.14  15:  1.98
 IR intensities (amu)
   1:  0.10   2:  0.12   3:  0.10   4:  0.06   5:  0.06   6:  0.08   7:  0.41   8:  0.34
   9:  2.35  10:  0.23  11:  0.55  12:  0.74  13:  1.97  14:  0.50  15:  0.14
 Raman intensities (amu)
   1:  0.00   2:  0.00   3:  0.00   4:  0.00   5:  0.00   6:  0.00   7:  0.00   8:  0.00
   9:  0.00  10:  0.00  11:  0.00  12:  0.00  13:  0.00  14:  0.00  15:  0.00
 output can be read by thermo (or use thermo option).
 writing <g98.out> molden fake output.
 recommended (thermochemical) frequency scaling factor: 1.0
           -------------------------------------------------
          |             Thermodynamic Functions             |
           -------------------------------------------------

cs  symmetry found (for desy threshold:  0.10E+00) used in thermo

          ...................................................
          :                      SETUP                      :
          :.................................................:
          :  # frequencies                           9      :
          :  # imaginary freq.                       0      :
          :  linear?                             false      :
          :  only rotor calc.                    false      :
          :  symmetry                               cs      :
          :  rotational number                       1      :
          :  scaling factor                  1.0000000      :
          :  rotor cutoff                   50.0000000 cm⁻¹ :
          :  imag. cutoff                  -20.0000000 cm⁻¹ :
          :.................................................:

    mode    ω/cm⁻¹     T·S(HO)/kcal·mol⁻¹    T·S(FR)/kcal·mol⁻¹   T·S(vib)
   ------------------------------------------------------------------------
   ------------------------------------------------------------------------

   temp. (K)  partition function   enthalpy   heat capacity  entropy
                                   cal/mol     cal/K/mol   cal/K/mol   J/K/mol
 298.15  VIB   1.86                  812.020      6.980      3.953
         ROT  0.174E+05              888.752      2.981     22.390
         INT  0.324E+05             1700.772      9.961     26.343
         TR   0.353E+27             1481.254      4.968     37.697
         TOT                        3182.0259    14.9295    64.0395   267.9413

   temp. (K)  partition function   enthalpy   heat capacity  entropy
                                   cal/mol     cal/K/mol   cal/K/mol   J/K/mol
 120.00  VIB   1.04                   37.731      1.403      0.388
         ROT  0.445E+04              357.707      2.981     19.677
         INT  0.462E+04              395.437      4.384     20.065
         TR   0.901E+26              596.178      4.968     33.177
         TOT                         991.6153     9.3525    53.2423   222.7658

   temp. (K)  partition function   enthalpy   heat capacity  entropy
                                   cal/mol     cal/K/mol   cal/K/mol   J/K/mol
 100.00  VIB   1.02                   15.754      0.810      0.189
         ROT  0.339E+04              298.089      2.981     19.134
         INT  0.344E+04              313.843      3.791     19.323
         TR   0.685E+26              496.815      4.968     32.272
         TOT                         810.6583     8.7595    51.5947   215.8720

   temp. (K)  partition function   enthalpy   heat capacity  entropy
                                   cal/mol     cal/K/mol   cal/K/mol   J/K/mol
  80.00  VIB   1.00                    4.453      0.347      0.065
         ROT  0.242E+04              238.471      2.981     18.468
         INT  0.244E+04              242.924      3.328     18.533
         TR   0.490E+26              397.452      4.968     31.164
         TOT                         640.3761     8.2960    49.6971   207.9325

   temp. (K)  partition function   enthalpy   heat capacity  entropy
                                   cal/mol     cal/K/mol   cal/K/mol   J/K/mol
  60.00  VIB   1.00                    0.571      0.078      0.011
         ROT  0.157E+04              178.853      2.981     17.611
         INT  0.158E+04              179.424      3.058     17.621
         TR   0.319E+26              298.089      4.968     29.735
         TOT                         477.5130     8.0266    47.3567   198.1403

   temp. (K)  partition function   enthalpy   heat capacity  entropy
                                   cal/mol     cal/K/mol   cal/K/mol   J/K/mol
  40.00  VIB   1.00                    0.010      0.003     -0.000
         ROT   857.                  119.236      2.981     16.402
         INT   857.                  119.245      2.984     16.402
         TR   0.173E+26              198.726      4.968     27.722
         TOT                         317.9715     7.9520    44.1237   184.6138

   temp. (K)  partition function   enthalpy   heat capacity  entropy
                                   cal/mol     cal/K/mol   cal/K/mol   J/K/mol
  20.00  VIB   1.00                    0.000      0.000     -0.001
         ROT   303.                   59.618      2.981     14.336
         INT   303.                   59.618      2.981     14.335
         TR   0.613E+25               99.363      4.968     24.280
         TOT                         158.9808     7.9490    38.6146   161.5633

   temp. (K)  partition function   enthalpy   heat capacity  entropy
                                   cal/mol     cal/K/mol   cal/K/mol   J/K/mol
  10.00  VIB   1.00                    0.000      0.000     -0.002
         ROT   107.                   29.809      2.981     12.270
         INT   107.                   29.809      2.981     12.268
         TR   0.217E+25               49.681      4.968     20.838
         TOT                          79.4904     7.9490    33.1056   138.5139

       T/K    H(0)-H(T)+PV         H(T)/Eh          T*S/Eh         G(T)/Eh
   ------------------------------------------------------------------------
    298.15    0.507088E-02    0.269862E-01    0.304272E-01   -0.344106E-02
    120.00    0.158024E-02    0.234955E-01    0.101816E-01    0.133139E-01
    100.00    0.129187E-02    0.232072E-01    0.822213E-02    0.149850E-01
     80.00    0.102050E-02    0.229358E-01    0.633578E-02    0.166000E-01
     60.00    0.760965E-03    0.226763E-01    0.452806E-02    0.181482E-01
     40.00    0.506720E-03    0.224220E-01    0.281263E-02    0.196094E-01
     20.00    0.253352E-03    0.221686E-01    0.123072E-02    0.209379E-01
     10.00    0.126676E-03    0.220420E-01    0.527572E-03    0.215144E-01 (used)
   ------------------------------------------------------------------------

         :::::::::::::::::::::::::::::::::::::::::::::::::::::
         ::                  THERMODYNAMIC                  ::
         :::::::::::::::::::::::::::::::::::::::::::::::::::::
         :: total free energy          -9.500322729086 Eh   ::
         ::.................................................::
         :: total energy               -9.521837119202 Eh   ::
         :: zero point energy           0.021915285751 Eh   ::
         :: G(RRHO) w/o ZPVE           -0.000400895635 Eh   ::
         :: G(RRHO) contrib.            0.021514390116 Eh   ::
         :::::::::::::::::::::::::::::::::::::::::::::::::::::

optimized geometry written to: xtbopt.xyz


           -------------------------------------------------
          | TOTAL ENERGY               -9.521837119202 Eh   |
          | TOTAL ENTHALPY             -9.499795157435 Eh   |
          | TOTAL FREE ENERGY          -9.500322729086 Eh   |
          | GRADIENT NORM               0.000627854017 Eh/α |
          | HOMO-LUMO GAP               1.633335015931 eV   |
           -------------------------------------------------

------------------------------------------------------------------------
 * finished run on 2020/05/12 at 11:44:50.198     
------------------------------------------------------------------------
 total:
 * wall-time:     0 d,  0 h,  0 min,  0.194 sec
 *  cpu-time:     0 d,  0 h,  0 min,  0.194 sec
 * ratio c/w:     0.998 speedup
 SCF:
 * wall-time:     0 d,  0 h,  0 min,  0.005 sec
 *  cpu-time:     0 d,  0 h,  0 min,  0.005 sec
 * ratio c/w:     0.995 speedup
 ANC optimizer:
 * wall-time:     0 d,  0 h,  0 min,  0.089 sec
 *  cpu-time:     0 d,  0 h,  0 min,  0.089 sec
 * ratio c/w:     0.999 speedup
 numerical hessian:
 * wall-time:     0 d,  0 h,  0 min,  0.085 sec
 *  cpu-time:     0 d,  0 h,  0 min,  0.085 sec
 * ratio c/w:     0.998 speedup

