      -----------------------------------------------------------      
     |                   =====================                   |     
     |                           x T B                           |     
     |                   =====================                   |     
     |                         S. Grimme                         |     
     |          Mulliken Center for Theoretical Chemistry        |     
     |                    University of Bonn                     |     
      -----------------------------------------------------------      

   * xtb version 6.2.2 (9d81278992624c895f80dd42a50cac0aa55982e2) compiled by '@Darwin' on 04/03/2020

   xtb is free software: you can redistribute it and/or modify it under
   the terms of the GNU Lesser General Public License as published by
   the Free Software Foundation, either version 3 of the License, or
   (at your option) any later version.
   
   xtb is distributed in the hope that it will be useful,
   but WITHOUT ANY WARRANTY; without even the implied warranty of
   MERCHANTABILITY or FITNESS FOR A PARTICULAR PURPOSE.  See the
   GNU Lesser General Public License for more details.
   
   Cite this work as:
   * S. Grimme, C. Bannwarth, P. Shushkov, J. Chem. Theory Comput., 2017,
     13, 1989-2009. DOI: 10.1021/acs.jctc.7b00118
   * C. Bannwarth, S. Ehlert and S. Grimme., J. Chem. Theory Comput., 2019,
     15, 1652-1671. DOI: 10.1021/acs.jctc.8b01176
   * P. Pracht, E. Caldeweyher, S. Ehlert, S. Grimme, ChemRxiv, 2019, preprint.
     DOI: 10.26434/chemrxiv.8326202.v1
   
   for DFT-D4:
   * E. Caldeweyher, C. Bannwarth and S. Grimme, J. Chem. Phys., 2017,
     147, 034112. DOI: 10.1063/1.4993215
   * E. Caldeweyher, S. Ehlert, A. Hansen, H. Neugebauer, S. Spicher,
     C. Bannwarth and S. Grimme, J. Chem. Phys., 2019, 150, 154122.
     DOI: 10.1063/1.5090222
   
   for sTDA-xTB:
   * S. Grimme and C. Bannwarth, J. Chem. Phys., 2016, 145, 054103.
     DOI: 10.1063/1.4959605
   
   in the mass-spec context:
   * V. Asgeirsson, C. Bauer and S. Grimme, Chem. Sci., 2017, 8, 4879.
     DOI: 10.1039/c7sc00601b
   
   for metadynamics refer to:
   * S. Grimme, J. Chem. Theory Comput., 2019, 155, 2847-2862
     DOI: 10.1021/acs.jctc.9b00143
   
   with help from (in alphabetical order)
   C. Bannwarth, F. Bohle, G. Brandenburg, E. Caldeweyher, M. Checinski,
   S. Dohm, S. Ehlert, S. Ehrlich, F. März, H. Neugebauer, J. Pisarek,
   P. Pracht, P. Shushkov, and S. Spicher.
   
 * started run on 2020/05/12 at 11:44:52.216     

           -------------------------------------------------
          |                Calculation Setup                |
           -------------------------------------------------

          program call               : xtb --input H1C3N1_5_S_2.input H1C3N1_5_S_2.xyz --ohess --molden --namespace H1C3N1_5_S_2 output.out
          calculation namespace      : H1C3N1_5_S_2
          coordinate file            : H1C3N1_5_S_2.xyz
          number of atoms            :                     5
          number of electrons        :                    18
          charge                     :                     0
          spin                       :                   1.0
          first test random number   :      0.61741285171878

   ID    Z sym.   atoms
    1    6 C      1-3
    2    7 N      4
    3    1 H      5

           -------------------------------------------------
          |                 G F N 2 - x T B                 |
           -------------------------------------------------

        Reference                      10.1021/acs.jctc.8b01176
      * Hamiltonian:
        H0-scaling (s, p, d)           1.850000    2.230000    2.230000
        zeta-weighting                 0.500000
      * Dispersion:
        s8                             2.700000
        a1                             0.520000
        a2                             5.000000
        s9                             5.000000
      * Repulsion:
        kExp                           1.500000    1.000000
        rExp                           1.000000
      * Coulomb:
        alpha                          2.000000
        third order                    shell-resolved
        anisotropic                    true
        a3                             3.000000
        a5                             4.000000
        cn-shift                       1.200000
        cn-exp                         4.000000
        max-rad                        5.000000


          ...................................................
          :                      SETUP                      :
          :.................................................:
          :  # basis functions                  17          :
          :  # atomic orbitals                  17          :
          :  # shells                            9          :
          :  # electrons                        18          :
          :  max. iterations                   250          :
          :  Hamiltonian                  GFN2-xTB          :
          :  restarted?                      false          :
          :  GBSA solvation                  false          :
          :  PC potential                    false          :
          :  electronic temp.          300.0000000     K    :
          :  accuracy                    1.0000000          :
          :  -> integral cutoff          0.2500000E+02      :
          :  -> integral neglect         0.1000000E-07      :
          :  -> SCF convergence          0.1000000E-05 Eh   :
          :  -> wf. convergence          0.1000000E-03 e    :
          :  Broyden damping             0.4000000          :
          ...................................................

 iter      E             dE          RMSdq      gap      omega  full diag
   1     -9.2551167 -0.925512E+01  0.964E+00    1.23       0.0  T
   2     -8.6291356  0.625981E+00  0.121E+01    1.94       1.0  T
   3     -9.3624472 -0.733312E+00  0.525E+00    1.41       1.0  T
   4     -8.7681465  0.594301E+00  0.851E+00    1.43       1.0  T
   5     -9.4222151 -0.654069E+00  0.197E+00    1.29       1.0  T
   6     -9.4366673 -0.144522E-01  0.118E+00    1.36       1.0  T
   7     -9.4422586 -0.559129E-02  0.852E-01    1.36       1.0  T
   8     -9.4441718 -0.191320E-02  0.541E-01    1.35       1.0  T
   9     -9.4433651  0.806783E-03  0.445E-01    1.36       1.0  T
  10     -9.4445475 -0.118242E-02  0.150E-01    1.35       1.0  T
  11     -9.4446052 -0.577721E-04  0.569E-02    1.35       1.0  T
  12     -9.4446119 -0.669398E-05  0.160E-02    1.35       2.8  T
  13     -9.4446123 -0.368567E-06  0.130E-02    1.35       3.4  T
  14     -9.4446125 -0.222258E-06  0.599E-03    1.35       7.5  T
  15     -9.4446126 -0.972870E-07  0.121E-03    1.35      36.9  T
  16     -9.4446126 -0.652564E-08  0.369E-04    1.35     121.2  T
  17     -9.4446126 -0.934417E-10  0.148E-04    1.35     301.5  T

   *** convergence criteria satisfied after 17 iterations ***

         #    Occupation            Energy/Eh            Energy/eV
      -------------------------------------------------------------
         1        2.0000           -0.6702426             -18.2382
       ...           ...                  ...                  ...
         4        2.0000           -0.5489762             -14.9384
         5        2.0000           -0.4992070             -13.5841
         6        2.0000           -0.4912166             -13.3667
         7        2.0000           -0.4856999             -13.2166
         8        1.9467           -0.4406823             -11.9916
         9        1.0533           -0.4352139             -11.8428
        10        1.0000           -0.4052330             -11.0270 (HOMO)
        11                         -0.3554910              -9.6734 (LUMO)
        12                         -0.3355546              -9.1309
        13                         -0.3140311              -8.5452
        14                          0.0617294               1.6797
        15                          0.0815221               2.2183
       ...                                ...                  ...
        17                          0.1319094               3.5894
      -------------------------------------------------------------
                  HL-Gap            0.0497420 Eh            1.3535 eV
             Fermi-level           -0.4091551 Eh          -11.1337 eV

 transition dipole moment (au) for excitation:           9          10
     X       Y       Z   
   0.7597   0.1809   0.0939  total (au/Debye):    0.787   1.999
 dE (eV)             :    0.816
 oscillator strength :  0.17488E-01

 SCC (total)                   0 d,  0 h,  0 min,  0.005 sec
 SCC setup                      ...        0 min,  0.000 sec (  1.545%)
 Dispersion                     ...        0 min,  0.000 sec (  0.356%)
 integral evaluation            ...        0 min,  0.002 sec ( 29.751%)
 zeroth order Hamiltonian       ...        0 min,  0.000 sec (  0.454%)
 iterations                     ...        0 min,  0.002 sec ( 32.032%)
 molecular gradient             ...        0 min,  0.001 sec ( 19.792%)
 printout                       ...        0 min,  0.001 sec ( 15.831%)

         :::::::::::::::::::::::::::::::::::::::::::::::::::::
         ::                     SUMMARY                     ::
         :::::::::::::::::::::::::::::::::::::::::::::::::::::
         :: total energy              -9.390343036707 Eh    ::
         :: gradient norm              0.333820371930 Eh/a0 ::
         :: HOMO-LUMO gap              1.353548314360 eV    ::
         ::.................................................::
         :: SCC energy                -9.444612635084 Eh    ::
         :: -> isotropic ES           -0.001116662173 Eh    ::
         :: -> anisotropic ES          0.000335087234 Eh    ::
         :: -> anisotropic XC          0.017728411106 Eh    ::
         :: -> dispersion             -0.002120942210 Eh    ::
         :: repulsion energy           0.054269504745 Eh    ::
         :: add. restraining           0.000000000000 Eh    ::
         :::::::::::::::::::::::::::::::::::::::::::::::::::::

      ----------------------------------------------------------- 
     |                   =====================                   |
     |                        A N C O P T                        |
     |                   =====================                   |
     |               Approximate Normal Coordinate               |
     |                Rational Function Optimizer                |
      ----------------------------------------------------------- 

          ...................................................
          :                      SETUP                      :
          :.................................................:
          :   optimization level            normal          :
          :   max. optcycles                   200          :
          :   ANC micro-cycles                  20          :
          :   degrees of freedom                 9          :
          :.................................................:
          :   RF solver                   davidson          :
          :   write xtbopt.log                true          :
          :   linear?                        false          :
          :   energy convergence         0.5000000E-05 Eh   :
          :   grad. convergence          0.1000000E-02 Eh/α :
          :   maximium RF displ.         1.0000000          :
          :   Hlow (freq-cutoff)         0.1000000E-01      :
          :   Hmax (freq-cutoff)         5.0000000          :
          :   S6 in model hess.         20.0000000          :
          ...................................................

generating ANC from model Hessian ...
Using Lindh-Hessian (1995)
 Shifting diagonal of input Hessian by    6.8430091860771057E-003
 Lowest  eigenvalues of input Hessian
   -0.000000   -0.000000   -0.000000    0.000000    0.000000    0.000000
    0.010000    0.018114    0.042436    0.103792    0.115978    0.626802
    0.792619    0.971275    1.099987
 Highest eigenvalues
    0.103792    0.115978    0.626802    0.792619    0.971275    1.099987


........................................................................
.............................. CYCLE    1 ..............................
........................................................................
   1     -9.4446126 -0.944461E+01  0.659E-05    1.35       0.0  T
   2     -9.4446126  0.521007E-09  0.277E-04    1.35     161.4  T
   3     -9.4446126 -0.526418E-09  0.494E-05    1.35     905.3  T
     SCC iter.                  ...        0 min,  0.000 sec
     gradient                   ...        0 min,  0.001 sec
 * total energy  :    -9.3903430 Eh     change       -0.5736567E-10 Eh
   gradient norm :     0.3338202 Eh/α   predicted     0.0000000E+00 (-100.00%)
   displ. norm   :     0.4002972 α      lambda       -0.1281957E+00
   maximum displ.:     0.3274898 α      in ANC's #6, #9, #7, ...

........................................................................
.............................. CYCLE    2 ..............................
........................................................................
   1     -9.6150029 -0.961500E+01  0.267E+00    1.88       0.0  T
   2     -9.6105737  0.442916E-02  0.171E+00    1.83       1.0  T
   3     -9.5740358  0.365380E-01  0.303E+00    1.85       1.0  T
   4     -9.6074123 -0.333765E-01  0.138E+00    1.88       1.0  T
   5     -9.6170586 -0.964634E-02  0.476E-01    1.83       1.0  T
   6     -9.6176647 -0.606052E-03  0.342E-01    1.83       1.0  T
   7     -9.6179429 -0.278256E-03  0.212E-01    1.83       1.0  T
   8     -9.6180598 -0.116810E-03  0.799E-02    1.83       1.0  T
   9     -9.6180636 -0.387750E-05  0.345E-02    1.83       1.3  T
  10     -9.6180688 -0.519213E-05  0.102E-02    1.83       4.4  T
  11     -9.6180691 -0.267219E-06  0.180E-03    1.83      24.9  T
  12     -9.6180691 -0.176614E-08  0.979E-04    1.83      45.7  T
  13     -9.6180691 -0.168736E-08  0.162E-04    1.83     275.3  T
     SCC iter.                  ...        0 min,  0.001 sec
     gradient                   ...        0 min,  0.001 sec
 * total energy  :    -9.4999349 Eh     change       -0.1095919E+00 Eh
   gradient norm :     0.2181112 Eh/α   predicted    -0.7436874E-01 ( -32.14%)
   displ. norm   :     0.5823425 α      lambda       -0.1144801E+00
   maximum displ.:     0.4007505 α      in ANC's #6, #9, #3, ...

........................................................................
.............................. CYCLE    3 ..............................
........................................................................
   1     -9.8149399 -0.981494E+01  0.371E+00    2.29       0.0  T
   2     -9.7762623  0.386775E-01  0.340E+00    2.27       1.0  T
   3     -9.8340607 -0.577984E-01  0.176E+00    2.27       1.0  T
   4     -9.8415988 -0.753811E-02  0.489E-01    2.27       1.0  T
   5     -9.8423095 -0.710641E-03  0.205E-01    2.26       1.0  T
   6     -9.8424226 -0.113159E-03  0.889E-02    2.26       1.0  T
   7     -9.8424442 -0.216255E-04  0.230E-02    2.26       1.9  T
   8     -9.8424437  0.549581E-06  0.180E-02    2.26       2.5  T
   9     -9.8424443 -0.600164E-06  0.117E-02    2.26       3.8  T
  10     -9.8424449 -0.600833E-06  0.781E-04    2.26      57.3  T
  11     -9.8424449 -0.340780E-09  0.379E-04    2.26     117.9  T
     SCC iter.                  ...        0 min,  0.001 sec
     gradient                   ...        0 min,  0.001 sec
 * total energy  :    -9.5090228 Eh     change       -0.9087881E-02 Eh
   gradient norm :     0.4639406 Eh/α   predicted    -0.7665146E-01 ( 743.45%)
   displ. norm   :     0.4873278 α      lambda       -0.1289095E+00
   maximum displ.:     0.3247394 α      in ANC's #2, #3, #5, ...

........................................................................
.............................. CYCLE    4 ..............................
........................................................................
   1     -9.7226977 -0.972270E+01  0.247E+00    1.59       0.0  T
   2     -9.6154639  0.107234E+00  0.394E+00    1.71       1.0  T
   3     -9.7309237 -0.115460E+00  0.136E+00    1.64       1.0  T
   4     -9.7355102 -0.458657E-02  0.872E-01    1.65       1.0  T
   5     -9.7377991 -0.228890E-02  0.374E-01    1.67       1.0  T
   6     -9.7381896 -0.390427E-03  0.242E-01    1.68       1.0  T
   7     -9.7384397 -0.250136E-03  0.896E-02    1.68       1.0  T
   8     -9.7384139  0.258311E-04  0.858E-02    1.68       1.0  T
   9     -9.7384464 -0.325861E-04  0.571E-03    1.68       7.8  T
  10     -9.7384464 -0.575633E-08  0.451E-03    1.68       9.9  T
  11     -9.7384465 -0.139954E-07  0.111E-03    1.68      40.4  T
  12     -9.7384465 -0.375765E-08  0.448E-04    1.68      99.8  T
  13     -9.7384465 -0.981366E-10  0.588E-05    1.68     760.9  T
     SCC iter.                  ...        0 min,  0.001 sec
     gradient                   ...        0 min,  0.001 sec
 * total energy  :    -9.5494274 Eh     change       -0.4040454E-01 Eh
   gradient norm :     0.1645528 Eh/α   predicted    -0.7976201E-01 (  97.41%)
   displ. norm   :     0.4536624 α      lambda       -0.2784552E-01
   maximum displ.:     0.3991266 α      in ANC's #3, #5, #1, ...

........................................................................
.............................. CYCLE    5 ..............................
........................................................................
   1     -9.7179277 -0.971793E+01  0.180E+00    1.59       0.0  T
   2     -9.7067072  0.112205E-01  0.180E+00    1.48       1.0  T
   3     -9.7173354 -0.106282E-01  0.110E+00    1.55       1.0  T
   4     -9.7187041 -0.136867E-02  0.819E-01    1.54       1.0  T
   5     -9.7224027 -0.369861E-02  0.276E-01    1.52       1.0  T
   6     -9.7226170 -0.214256E-03  0.121E-01    1.53       1.0  T
   7     -9.7225895  0.274845E-04  0.149E-01    1.53       1.0  T
   8     -9.7226724 -0.829237E-04  0.457E-02    1.53       1.0  T
   9     -9.7226812 -0.882497E-05  0.139E-02    1.53       3.2  T
  10     -9.7226818 -0.609516E-06  0.214E-03    1.53      20.9  T
  11     -9.7226818 -0.273640E-08  0.705E-04    1.53      63.5  T
  12     -9.7226818 -0.116444E-08  0.144E-04    1.53     311.2  T
     SCC iter.                  ...        0 min,  0.001 sec
     gradient                   ...        0 min,  0.001 sec
 * total energy  :    -9.5547921 Eh     change       -0.5364754E-02 Eh
   gradient norm :     0.1101088 Eh/α   predicted    -0.1678819E-01 ( 212.93%)
   displ. norm   :     0.4330383 α      lambda       -0.2061242E-01
   maximum displ.:     0.3923839 α      in ANC's #1, #6, #4, ...

........................................................................
.............................. CYCLE    6 ..............................
........................................................................
   1     -9.7525760 -0.975258E+01  0.146E+00    1.33       0.0  T
   2     -9.7515888  0.987216E-03  0.842E-01    1.33       1.0  T
   3     -9.7247900  0.267988E-01  0.193E+00    1.35       1.0  T
   4     -9.7519044 -0.271144E-01  0.465E-01    1.32       1.0  T
   5     -9.7527623 -0.857887E-03  0.242E-01    1.33       1.0  T
   6     -9.7530171 -0.254764E-03  0.138E-01    1.33       1.0  T
   7     -9.7530904 -0.732819E-04  0.696E-02    1.33       1.0  T
   8     -9.7531123 -0.219663E-04  0.127E-02    1.34       3.5  T
   9     -9.7531125 -0.109673E-06  0.654E-03    1.34       6.8  T
  10     -9.7531126 -0.189275E-06  0.173E-03    1.34      25.9  T
  11     -9.7531127 -0.100755E-07  0.458E-04    1.34      97.7  T
  12     -9.7531127 -0.665763E-09  0.123E-04    1.34     364.1  T
     SCC iter.                  ...        0 min,  0.001 sec
     gradient                   ...        0 min,  0.001 sec
 * total energy  :    -9.5662318 Eh     change       -0.1143968E-01 Eh
   gradient norm :     0.0637800 Eh/α   predicted    -0.1223885E-01 (   6.99%)
   displ. norm   :     0.4605789 α      lambda       -0.1253367E-01
   maximum displ.:     0.3548837 α      in ANC's #2, #6, #1, ...

........................................................................
.............................. CYCLE    7 ..............................
........................................................................
   1     -9.7457245 -0.974572E+01  0.167E+00    1.26       0.0  T
   2     -9.7457621 -0.376584E-04  0.951E-01    1.28       1.0  T
   3     -9.7386951  0.706702E-02  0.914E-01    1.25       1.0  T
   4     -9.7460330 -0.733784E-02  0.110E-01    1.29       1.0  T
   5     -9.7460000  0.329598E-04  0.737E-02    1.29       1.0  T
   6     -9.7460357 -0.357420E-04  0.304E-02    1.29       1.5  T
   7     -9.7460384 -0.270692E-05  0.138E-02    1.29       3.2  T
   8     -9.7460391 -0.623912E-06  0.529E-03    1.29       8.4  T
   9     -9.7460392 -0.115692E-06  0.815E-04    1.29      54.8  T
  10     -9.7460392 -0.591925E-09  0.345E-04    1.29     129.7  T
     SCC iter.                  ...        0 min,  0.001 sec
     gradient                   ...        0 min,  0.001 sec
 * total energy  :    -9.5641862 Eh     change        0.2045562E-02 Eh
   gradient norm :     0.1683000 Eh/α   predicted    -0.7596238E-02 (-471.35%)
   displ. norm   :     0.2939312 α      lambda       -0.2340773E-01
   maximum displ.:     0.2108207 α      in ANC's #2, #1, #4, ...

........................................................................
.............................. CYCLE    8 ..............................
........................................................................
   1     -9.8201448 -0.982014E+01  0.124E+00    1.45       0.0  T
   2     -9.8154727  0.467217E-02  0.112E+00    1.36       1.0  T
   3     -9.8171429 -0.167021E-02  0.870E-01    1.43       1.0  T
   4     -9.8215738 -0.443087E-02  0.305E-01    1.38       1.0  T
   5     -9.8220595 -0.485745E-03  0.564E-02    1.38       1.0  T
   6     -9.8220685 -0.897216E-05  0.252E-02    1.38       1.8  T
   7     -9.8220677  0.750025E-06  0.180E-02    1.38       2.5  T
   8     -9.8220691 -0.137032E-05  0.161E-03    1.38      27.9  T
   9     -9.8220691 -0.185660E-08  0.455E-04    1.38      98.3  T
  10     -9.8220691  0.127159E-09  0.232E-04    1.38     192.7  T
     SCC iter.                  ...        0 min,  0.001 sec
     gradient                   ...        0 min,  0.001 sec
 * total energy  :    -9.5651625 Eh     change       -0.9762240E-03 Eh
   gradient norm :     0.1150990 Eh/α   predicted    -0.1271503E-01 (1202.47%)
   displ. norm   :     0.3847179 α      lambda       -0.2402525E-01
   maximum displ.:     0.2305577 α      in ANC's #3, #1, #4, ...

........................................................................
.............................. CYCLE    9 ..............................
........................................................................
   1     -9.7703415 -0.977034E+01  0.777E-01    1.28       0.0  T
   2     -9.7692091  0.113247E-02  0.673E-01    1.28       1.0  T
   3     -9.7694831 -0.274080E-03  0.527E-01    1.27       1.0  T
   4     -9.7691201  0.363032E-03  0.510E-01    1.29       1.0  T
   5     -9.7710147 -0.189458E-02  0.837E-02    1.27       1.0  T
   6     -9.7710471 -0.324513E-04  0.455E-02    1.28       1.0  T
   7     -9.7710568 -0.964746E-05  0.101E-02    1.28       4.4  T
   8     -9.7710570 -0.265522E-06  0.280E-03    1.28      16.0  T
   9     -9.7710571 -0.168343E-07  0.882E-04    1.28      50.7  T
  10     -9.7710571 -0.318499E-08  0.249E-04    1.28     179.8  T
     SCC iter.                  ...        0 min,  0.001 sec
     gradient                   ...        0 min,  0.001 sec
 * total energy  :    -9.5721911 Eh     change       -0.7028595E-02 Eh
   gradient norm :     0.0498702 Eh/α   predicted    -0.1379060E-01 (  96.21%)
   displ. norm   :     0.1684413 α      lambda       -0.5906034E-02
   maximum displ.:     0.0844986 α      in ANC's #2, #3, #4, ...

........................................................................
.............................. CYCLE   10 ..............................
........................................................................
   1     -9.7771121 -0.977711E+01  0.610E-01    1.25       0.0  T
   2     -9.7769849  0.127186E-03  0.393E-01    1.27       1.0  T
   3     -9.7745891  0.239580E-02  0.559E-01    1.24       1.0  T
   4     -9.7770944 -0.250531E-02  0.131E-01    1.27       1.0  T
   5     -9.7771912 -0.968487E-04  0.420E-02    1.27       1.1  T
   6     -9.7771970 -0.580344E-05  0.189E-02    1.27       2.4  T
   7     -9.7771990 -0.197890E-05  0.102E-02    1.27       4.4  T
   8     -9.7771996 -0.558179E-06  0.214E-03    1.27      20.9  T
   9     -9.7771996 -0.125065E-08  0.216E-04    1.27     206.8  T
  10     -9.7771996 -0.983391E-10  0.657E-05    1.27     681.1  T
     SCC iter.                  ...        0 min,  0.001 sec
     gradient                   ...        0 min,  0.001 sec
 * total energy  :    -9.5753032 Eh     change       -0.3112139E-02 Eh
   gradient norm :     0.0373535 Eh/α   predicted    -0.3036802E-02 (  -2.42%)
   displ. norm   :     0.1992383 α      lambda       -0.1835904E-02
   maximum displ.:     0.1765950 α      in ANC's #1, #6, #4, ...

........................................................................
.............................. CYCLE   11 ..............................
........................................................................
   1     -9.7863818 -0.978638E+01  0.533E-01    1.18       0.0  T
   2     -9.7855483  0.833487E-03  0.404E-01    1.17       1.0  T
   3     -9.7838336  0.171472E-02  0.598E-01    1.19       1.0  T
   4     -9.7865079 -0.267425E-02  0.935E-02    1.17       1.0  T
   5     -9.7865473 -0.394094E-04  0.475E-02    1.17       1.0  T
   6     -9.7865592 -0.118889E-04  0.128E-02    1.17       3.5  T
   7     -9.7865597 -0.584225E-06  0.333E-03    1.17      13.4  T
   8     -9.7865598 -0.340313E-07  0.185E-03    1.17      24.2  T
   9     -9.7865598 -0.427584E-08  0.382E-04    1.17     116.9  T
  10     -9.7865598 -0.660508E-09  0.684E-05    1.17     653.4  T
     SCC iter.                  ...        0 min,  0.001 sec
     gradient                   ...        0 min,  0.001 sec
 * total energy  :    -9.5766379 Eh     change       -0.1334681E-02 Eh
   gradient norm :     0.0192373 Eh/α   predicted    -0.9543913E-03 ( -28.49%)
   displ. norm   :     0.2857571 α      lambda       -0.2210165E-02
   maximum displ.:     0.2103920 α      in ANC's #1, #6, #9, ...

........................................................................
.............................. CYCLE   12 ..............................
........................................................................
   1     -9.7859770 -0.978598E+01  0.920E-01    1.08       0.0  T
   2     -9.7859046  0.724114E-04  0.514E-01    1.07       1.0  T
   3     -9.7803877  0.551692E-02  0.811E-01    1.10       1.0  T
   4     -9.7858050 -0.541731E-02  0.191E-01    1.07       1.0  T
   5     -9.7860718 -0.266813E-03  0.658E-02    1.08       1.0  T
   6     -9.7860904 -0.185562E-04  0.158E-02    1.08       2.8  T
   7     -9.7860913 -0.965281E-06  0.767E-03    1.08       5.8  T
   8     -9.7860915 -0.109923E-06  0.185E-03    1.08      24.2  T
   9     -9.7860915 -0.210599E-08  0.436E-04    1.08     102.5  T
  10     -9.7860915 -0.368235E-09  0.135E-04    1.08     331.5  T
     SCC iter.                  ...        0 min,  0.001 sec
     gradient                   ...        0 min,  0.001 sec
 * total energy  :    -9.5779963 Eh     change       -0.1358407E-02 Eh
   gradient norm :     0.0291963 Eh/α   predicted    -0.1195322E-02 ( -12.01%)
   displ. norm   :     0.1272750 α      lambda       -0.9734893E-03
   maximum displ.:     0.0769054 α      in ANC's #1, #5, #6, ...

........................................................................
.............................. CYCLE   13 ..............................
........................................................................
   1     -9.7933509 -0.979335E+01  0.422E-01    1.08       0.0  T
   2     -9.7923206  0.103033E-02  0.418E-01    1.07       1.0  T
   3     -9.7924048 -0.841892E-04  0.389E-01    1.08       1.0  T
   4     -9.7934957 -0.109091E-02  0.791E-02    1.07       1.0  T
   5     -9.7935212 -0.255258E-04  0.334E-02    1.07       1.3  T
   6     -9.7935261 -0.485184E-05  0.139E-02    1.07       3.2  T
   7     -9.7935268 -0.698843E-06  0.537E-03    1.07       8.3  T
   8     -9.7935270 -0.204722E-06  0.135E-03    1.07      33.2  T
   9     -9.7935270 -0.154207E-08  0.187E-04    1.07     239.0  T
  10     -9.7935270 -0.937419E-10  0.563E-05    1.07     794.7  T
     SCC iter.                  ...        0 min,  0.001 sec
     gradient                   ...        0 min,  0.001 sec
 * total energy  :    -9.5784565 Eh     change       -0.4602393E-03 Eh
   gradient norm :     0.0116802 Eh/α   predicted    -0.4946293E-03 (   7.47%)
   displ. norm   :     0.1491479 α      lambda       -0.4085219E-03
   maximum displ.:     0.1321897 α      in ANC's #1, #6, #9, ...

........................................................................
.............................. CYCLE   14 ..............................
........................................................................
   1     -9.7909226 -0.979092E+01  0.408E-01    1.02       0.0  T
   2     -9.7909267 -0.417126E-05  0.221E-01    1.02       1.0  T
   3     -9.7903510  0.575717E-03  0.266E-01    1.02       1.0  T
   4     -9.7908959 -0.544869E-03  0.811E-02    1.02       1.0  T
   5     -9.7909465 -0.505818E-04  0.189E-02    1.02       2.4  T
   6     -9.7909472 -0.675123E-06  0.308E-03    1.02      14.5  T
   7     -9.7909472 -0.133528E-07  0.993E-04    1.02      45.0  T
   8     -9.7909472  0.624365E-09  0.715E-04    1.02      62.5  T
     SCC iter.                  ...        0 min,  0.001 sec
     gradient                   ...        0 min,  0.001 sec
 * total energy  :    -9.5786388 Eh     change       -0.1823253E-03 Eh
   gradient norm :     0.0076489 Eh/α   predicted    -0.2088055E-03 (  14.52%)
   displ. norm   :     0.0369961 α      lambda       -0.1226715E-03
   maximum displ.:     0.0353282 α      in ANC's #3, #5, #6, ...

........................................................................
.............................. CYCLE   15 ..............................
........................................................................
   1     -9.7952841 -0.979528E+01  0.106E-01    1.04       0.0  T
   2     -9.7952145  0.695381E-04  0.990E-02    1.03       1.0  T
   3     -9.7951985  0.160072E-04  0.116E-01    1.04       1.0  T
   4     -9.7952920 -0.934985E-04  0.251E-02    1.03       1.8  T
   5     -9.7952952 -0.323172E-05  0.499E-03    1.04       9.0  T
   6     -9.7952952  0.209563E-07  0.291E-03    1.04      15.4  T
   7     -9.7952953 -0.562658E-07  0.101E-03    1.04      44.1  T
   8     -9.7952953 -0.536334E-08  0.257E-04    1.04     173.8  T
   9     -9.7952953 -0.138105E-09  0.294E-05    1.04    1521.5  T
     SCC iter.                  ...        0 min,  0.001 sec
     gradient                   ...        0 min,  0.001 sec
 * total energy  :    -9.5786864 Eh     change       -0.4753993E-04 Eh
   gradient norm :     0.0071416 Eh/α   predicted    -0.6141872E-04 (  29.19%)
   displ. norm   :     0.0268092 α      lambda       -0.5631199E-04
   maximum displ.:     0.0197671 α      in ANC's #1, #5, #4, ...

........................................................................
.............................. CYCLE   16 ..............................
........................................................................
   1     -9.7942033 -0.979420E+01  0.787E-02    1.04       0.0  T
   2     -9.7941988  0.445342E-05  0.505E-02    1.04       1.0  T
   3     -9.7941296  0.691921E-04  0.919E-02    1.04       1.0  T
   4     -9.7942028 -0.731872E-04  0.193E-02    1.04       2.3  T
   5     -9.7942049 -0.211747E-05  0.407E-03    1.04      11.0  T
   6     -9.7942049 -0.735662E-08  0.298E-03    1.04      15.0  T
   7     -9.7942050 -0.516158E-07  0.600E-04    1.04      74.6  T
   8     -9.7942050 -0.440565E-09  0.113E-04    1.04     396.8  T
     SCC iter.                  ...        0 min,  0.001 sec
     gradient                   ...        0 min,  0.001 sec
 * total energy  :    -9.5787102 Eh     change       -0.2376698E-04 Eh
   gradient norm :     0.0049089 Eh/α   predicted    -0.2817814E-04 (  18.56%)
   displ. norm   :     0.0131445 α      lambda       -0.2301329E-04
   maximum displ.:     0.0105085 α      in ANC's #1, #2, #5, ...

........................................................................
.............................. CYCLE   17 ..............................
........................................................................
   1     -9.7943976 -0.979440E+01  0.313E-02    1.04       0.0  T
   2     -9.7943817  0.159326E-04  0.470E-02    1.04       1.0  T
   3     -9.7943982 -0.165182E-04  0.187E-02    1.04       2.4  T
   4     -9.7943998 -0.157647E-05  0.342E-03    1.04      13.1  T
   5     -9.7943998 -0.492642E-07  0.164E-03    1.04      27.2  T
   6     -9.7943998 -0.859512E-08  0.432E-04    1.04     103.5  T
   7     -9.7943998 -0.839858E-09  0.165E-04    1.04     271.6  T
     SCC iter.                  ...        0 min,  0.001 sec
     gradient                   ...        0 min,  0.001 sec
 * total energy  :    -9.5787211 Eh     change       -0.1093731E-04 Eh
   gradient norm :     0.0023693 Eh/α   predicted    -0.1150999E-04 (   5.24%)
   displ. norm   :     0.0190547 α      lambda       -0.1245911E-04
   maximum displ.:     0.0140034 α      in ANC's #1, #3, #5, ...

........................................................................
.............................. CYCLE   18 ..............................
........................................................................
   1     -9.7938685 -0.979387E+01  0.617E-02    1.04       0.0  T
   2     -9.7938686 -0.158089E-06  0.339E-02    1.04       1.3  T
   3     -9.7938582  0.104538E-04  0.374E-02    1.04       1.2  T
   4     -9.7938674 -0.918053E-05  0.143E-02    1.04       3.1  T
   5     -9.7938691 -0.176361E-05  0.292E-03    1.04      15.3  T
   6     -9.7938691  0.678761E-08  0.186E-03    1.04      24.1  T
   7     -9.7938691 -0.172273E-07  0.351E-04    1.04     127.5  T
   8     -9.7938691 -0.382482E-09  0.489E-05    1.04     914.3  T
     SCC iter.                  ...        0 min,  0.001 sec
     gradient                   ...        0 min,  0.001 sec
 * total energy  :    -9.5787268 Eh     change       -0.5686605E-05 Eh
   gradient norm :     0.0020865 Eh/α   predicted    -0.6231623E-05 (   9.58%)
   displ. norm   :     0.0084112 α      lambda       -0.5912662E-05
   maximum displ.:     0.0054791 α      in ANC's #1, #6, #3, ...

........................................................................
.............................. CYCLE   19 ..............................
........................................................................
   1     -9.7941566 -0.979416E+01  0.220E-02    1.04       0.0  T
   2     -9.7941566  0.315675E-07  0.134E-02    1.04       3.3  T
   3     -9.7941533  0.328033E-05  0.190E-02    1.05       2.4  T
   4     -9.7941566 -0.328003E-05  0.448E-03    1.04      10.0  T
   5     -9.7941567 -0.930465E-07  0.143E-03    1.04      31.2  T
   6     -9.7941567 -0.886806E-08  0.228E-04    1.04     196.3  T
   7     -9.7941567 -0.845226E-10  0.166E-04    1.04     269.2  T
     SCC iter.                  ...        0 min,  0.001 sec
     gradient                   ...        0 min,  0.001 sec
 * total energy  :    -9.5787312 Eh     change       -0.4430865E-05 Eh
   gradient norm :     0.0012746 Eh/α   predicted    -0.2957594E-05 ( -33.25%)
   displ. norm   :     0.0134524 α      lambda       -0.4950935E-05
   maximum displ.:     0.0084572 α      in ANC's #6, #1, #7, ...

........................................................................
.............................. CYCLE   20 ..............................
........................................................................
   1     -9.7940513 -0.979405E+01  0.433E-02    1.05       0.0  T
   2     -9.7940507  0.589536E-06  0.257E-02    1.05       1.7  T
   3     -9.7940334  0.172821E-04  0.465E-02    1.05       1.0  T
   4     -9.7940510 -0.175181E-04  0.953E-03    1.05       4.7  T
   5     -9.7940516 -0.621324E-06  0.224E-03    1.05      20.0  T
   6     -9.7940516 -0.289605E-08  0.141E-03    1.05      31.7  T
   7     -9.7940516 -0.106329E-07  0.270E-04    1.05     165.5  T
   8     -9.7940516 -0.918909E-10  0.544E-05    1.05     821.7  T
     SCC iter.                  ...        0 min,  0.001 sec
     gradient                   ...        0 min,  0.001 sec
 * total energy  :    -9.5787338 Eh     change       -0.2639520E-05 Eh
   gradient norm :     0.0005920 Eh/α   predicted    -0.2476646E-05 (  -6.17%)
   displ. norm   :     0.0037569 α      lambda       -0.7081866E-06
   maximum displ.:     0.0024072 α      in ANC's #3, #6, #1, ...

   *** GEOMETRY OPTIMIZATION CONVERGED AFTER 20 ITERATIONS ***

------------------------------------------------------------------------
 total energy gain   :        -0.1883908 Eh     -118.2170 kcal/mol
 total RMSD          :         1.1801516 a0        0.6245 Å
 total power (kW/mol):       -24.7310000 (step)-8864.3154 (real)
------------------------------------------------------------------------

 ANCopt (total)                0 d,  0 h,  0 min,  0.056 sec
 optimizer setup                ...        0 min,  0.000 sec (  0.114%)
 model hessian                  ...        0 min,  0.000 sec (  0.159%)
 ANC generation                 ...        0 min,  0.000 sec (  0.094%)
 coordinate transformation      ...        0 min,  0.000 sec (  0.073%)
 single point calculation       ...        0 min,  0.054 sec ( 96.940%)
 optimization log               ...        0 min,  0.000 sec (  0.852%)
 hessian update                 ...        0 min,  0.000 sec (  0.074%)
 rational function              ...        0 min,  0.000 sec (  0.716%)

================
 final structure:
================
5
 xtb: 6.2.2 (9d81278992624c895f80dd42a50cac0aa55982e2)
C        -1.37352318100492    0.26679025682705   -0.05277510940998
C        -0.09588707598299    0.31255837076993   -0.14009356503648
C         1.16116815087719   -0.08453989869897   -0.02117969253900
N         2.33665112448543   -0.00021902846668   -0.12226043480597
H        -2.02840901837472   -0.49458870043134    0.33630880179142

 Bond Distances (Angstroems)
 ---------------------------
C1-C2=1.2814         C1-H5=1.0770         C2-C1=1.2814         C2-C3=1.3236         C3-C2=1.3236         C3-N4=1.1828         
N4-C3=1.1828         H5-C1=1.0770         
 C  H  Rav=1.0770 sigma=0.0000  Rmin=1.0770  Rmax=1.0770     1
 C  C  Rav=1.3025 sigma=0.0211  Rmin=1.2814  Rmax=1.3236     2
 N  C  Rav=1.1828 sigma=0.0000  Rmin=1.1828  Rmax=1.1828     1

 selected bond angles (degree)
 --------------------
H5-C1-C2=131.00                C3-C2-C1=158.44                N4-C3-C2=156.17                

 selected dihedral angles (degree)
 ---------------------------------
C3-C2-C1-H5=  0.16            N4-C3-C2-C1=179.87            
           -------------------------------------------------
          |                Final Singlepoint                |
           -------------------------------------------------

          ...................................................
          :                      SETUP                      :
          :.................................................:
          :  # basis functions                  17          :
          :  # atomic orbitals                  17          :
          :  # shells                            9          :
          :  # electrons                        18          :
          :  max. iterations                   250          :
          :  Hamiltonian                  GFN2-xTB          :
          :  restarted?                      false          :
          :  GBSA solvation                  false          :
          :  PC potential                    false          :
          :  electronic temp.          300.0000000     K    :
          :  accuracy                    1.0000000          :
          :  -> integral cutoff          0.2500000E+02      :
          :  -> integral neglect         0.1000000E-07      :
          :  -> SCF convergence          0.1000000E-05 Eh   :
          :  -> wf. convergence          0.1000000E-03 e    :
          :  Broyden damping             0.4000000          :
          ...................................................

 iter      E             dE          RMSdq      gap      omega  full diag
   1     -9.7940516 -0.979405E+01  0.315E-05    1.05       0.0  T
   2     -9.7940516  0.163602E-11  0.155E-05    1.05    2884.3  T
   3     -9.7940516  0.983036E-11  0.406E-05    1.05    1102.3  T

   *** convergence criteria satisfied after 3 iterations ***

         #    Occupation            Energy/Eh            Energy/eV
      -------------------------------------------------------------
         1        2.0000           -0.6668153             -18.1450
       ...           ...                  ...                  ...
         4        2.0000           -0.5408808             -14.7181
         5        2.0000           -0.5181535             -14.0997
         6        2.0000           -0.5119226             -13.9301
         7        2.0000           -0.4619400             -12.5700
         8        1.9998           -0.4490724             -12.2199
         9        1.0002           -0.4327207             -11.7749
        10        1.0000           -0.3354477              -9.1280 (HOMO)
        11                         -0.2968169              -8.0768 (LUMO)
        12                         -0.1768328              -4.8119
        13                         -0.1292618              -3.5174
        14                          0.1572262               4.2783
        15                          0.2539647               6.9107
       ...                                ...                  ...
        17                          1.1529329              31.3729
      -------------------------------------------------------------
                  HL-Gap            0.0386308 Eh            1.0512 eV
             Fermi-level           -0.3785144 Eh          -10.2999 eV

 transition dipole moment (au) for excitation:           9          10
     X       Y       Z   
   1.5599  -0.1330  -0.0192  total (au/Debye):    1.566   3.980
 dE (eV)             :    2.647
 oscillator strength :  0.22483E+00

 SCC (total)                   0 d,  0 h,  0 min,  0.003 sec
 SCC setup                      ...        0 min,  0.000 sec (  1.435%)
 Dispersion                     ...        0 min,  0.000 sec (  0.235%)
 integral evaluation            ...        0 min,  0.001 sec ( 32.552%)
 zeroth order Hamiltonian       ...        0 min,  0.000 sec (  0.478%)
 iterations                     ...        0 min,  0.000 sec ( 10.510%)
 molecular gradient             ...        0 min,  0.001 sec ( 31.425%)
 printout                       ...        0 min,  0.001 sec ( 23.096%)

         :::::::::::::::::::::::::::::::::::::::::::::::::::::
         ::                     SUMMARY                     ::
         :::::::::::::::::::::::::::::::::::::::::::::::::::::
         :: total energy              -9.578733845209 Eh    ::
         :: gradient norm              0.000632775658 Eh/a0 ::
         :: HOMO-LUMO gap              1.051197997967 eV    ::
         ::.................................................::
         :: SCC energy                -9.794051594014 Eh    ::
         :: -> isotropic ES            0.005184255516 Eh    ::
         :: -> anisotropic ES          0.000761551356 Eh    ::
         :: -> anisotropic XC          0.018385210358 Eh    ::
         :: -> dispersion             -0.002010048081 Eh    ::
         :: repulsion energy           0.215318015568 Eh    ::
         :: add. restraining           0.000000000000 Eh    ::
         :::::::::::::::::::::::::::::::::::::::::::::::::::::

           ------------------------------------------------- 
          |                Numerical Hessian                |
           ------------------------------------------------- 
step length          :   0.00500
SCC accuracy         :   0.30000
Hessian scale factor :   1.00000
frozen atoms in %    :   0.00000    0
RMS gradient         :   0.00063
estimated CPU  time      0.00 min
estimated wall time      0.00 min

writing file <hessian>.

 projected vibrational frequencies (cm-1)
eigval :       -0.00    -0.00    -0.00     0.00     0.00     0.00
eigval :      193.94   206.13   403.91   530.57   767.56  1012.30
eigval :     1793.05  2076.82  3019.09
           -------------------------------------------------
          |                Property Printout                |
           -------------------------------------------------

    * Orbital Energies and Occupations

         #    Occupation            Energy/Eh            Energy/eV
      -------------------------------------------------------------
         1        2.0000           -0.6668154             -18.1450
         2        2.0000           -0.6550269             -17.8242
         3        2.0000           -0.6075979             -16.5336
         4        2.0000           -0.5408806             -14.7181
         5        2.0000           -0.5181537             -14.0997
         6        2.0000           -0.5119227             -13.9301
         7        2.0000           -0.4619401             -12.5700
         8        1.9998           -0.4490723             -12.2199
         9        1.0002           -0.4327207             -11.7749
        10        1.0000           -0.3354476              -9.1280 (HOMO)
        11                         -0.2968168              -8.0768 (LUMO)
        12                         -0.1768330              -4.8119
        13                         -0.1292619              -3.5174
        14                          0.1572263               4.2783
        15                          0.2539648               6.9107
        16                          0.7838964              21.3309
        17                          1.1529327              31.3729
      -------------------------------------------------------------
                  HL-Gap            0.0386308 Eh            1.0512 eV
             Fermi-level           -0.3785143 Eh          -10.2999 eV

     #   Z        covCN         q      C6AA      α(0)
     1   6 C      1.908    -0.057    32.645     9.227
     2   6 C      1.964     0.018    30.607     8.934
     3   6 C      1.893     0.114    28.309     8.593
     4   7 N      0.913    -0.172    24.703     7.187
     5   1 H      0.926     0.097     1.813     2.106

 Mol. C6AA /au·bohr⁶  :        522.534797
 Mol. C8AA /au·bohr⁸  :      13689.904700
 Mol. α(0) /au        :         36.047693


Wiberg/Mayer (AO) data.
largest (>0.10) Wiberg bond orders for each atom
          total WBO             WBO to atom ...
     1  C   3.153        C    2 1.982    H    5 0.911    N    4 0.235
     2  C   3.496        C    1 1.982    C    3 1.445
     3  C   3.779        N    4 2.295    C    2 1.445
     4  N   2.589        C    3 2.295    C    1 0.235
     5  H   0.935        C    1 0.911

MOs/occ written to file <molden.input>


molecular dipole:
                 x           y           z       tot (Debye)
 q only:       -0.735      -0.127       0.098
   full:       -1.035      -0.289       0.189       2.773
molecular quadrupole (traceless):
                xx          xy          yy          xz          yz          zz
 q only:       -1.813       0.570       0.943      -0.127      -0.085       0.870
  q+dip:       -1.057       1.004       0.768      -0.406      -0.365       0.289
   full:       -3.949       0.920       2.022      -0.124      -0.122       1.926

           -------------------------------------------------
          |                Geometry Summary                 |
           -------------------------------------------------

      molecular mass/u    :       51.0468517
   center of mass at/Å    :        0.5285745       0.1065939      -0.0772715
  moments of inertia/u·Å² :        0.1455907E+01   0.1059424E+03   0.1073983E+03
rotational constants/cm⁻¹ :        0.1157879E+02   0.1591207E+00   0.1569637E+00

 * 2 selected distances

     #   Z        #   Z                                     value/Å
     1   6 C      2   6 C                                 1.2814341 (max)
     3   6 C      4   7 N                                 1.1828303 (min)

 * 2 distinct bonds (by element types)

   Z      Z             #   av. dist./Å        max./Å        min./Å
   6 C    6 C           1     1.2814341     1.2814341     1.2814341
   6 C    7 N           1     1.1828303     1.1828303     1.1828303

           -------------------------------------------------
          |               Frequency Printout                |
           -------------------------------------------------
 projected vibrational frequencies (cm-1)
eigval :       -0.00    -0.00    -0.00     0.00     0.00     0.00
eigval :      193.94   206.13   403.91   530.57   767.56  1012.30
Molecule has the following symmetry elements: (sigma) 
It seems to be the Cs point group
eigval :     1793.05  2076.82  3019.09
 reduced masses (amu)
   1:  6.14   2: 12.46   3: 12.92   4: 12.36   5: 12.81   6: 10.91   7: 10.49   8: 12.42
   9: 12.20  10:  7.84  11:  3.78  12: 12.32  13: 12.08  14: 12.48  15:  1.93
 IR intensities (amu)
   1:  0.28   2:  0.07   3:  0.12   4:  0.06   5:  0.04   6:  0.12   7:  0.21   8:  0.35
   9:  0.25  10:  0.00  11:  0.30  12:  0.15  13:  0.47  14:  1.13  15:  0.01
 Raman intensities (amu)
   1:  0.00   2:  0.00   3:  0.00   4:  0.00   5:  0.00   6:  0.00   7:  0.00   8:  0.00
   9:  0.00  10:  0.00  11:  0.00  12:  0.00  13:  0.00  14:  0.00  15:  0.00
 output can be read by thermo (or use thermo option).
 writing <g98.out> molden fake output.
 recommended (thermochemical) frequency scaling factor: 1.0
           -------------------------------------------------
          |             Thermodynamic Functions             |
           -------------------------------------------------

cs  symmetry found (for desy threshold:  0.10E+00) used in thermo

          ...................................................
          :                      SETUP                      :
          :.................................................:
          :  # frequencies                           9      :
          :  # imaginary freq.                       0      :
          :  linear?                             false      :
          :  only rotor calc.                    false      :
          :  symmetry                               cs      :
          :  rotational number                       1      :
          :  scaling factor                  1.0000000      :
          :  rotor cutoff                   50.0000000 cm⁻¹ :
          :  imag. cutoff                  -20.0000000 cm⁻¹ :
          :.................................................:

    mode    ω/cm⁻¹     T·S(HO)/kcal·mol⁻¹    T·S(FR)/kcal·mol⁻¹   T·S(vib)
   ------------------------------------------------------------------------
       1    193.94    -0.00000 ( 99.56%)     0.01178 (  0.44%)     0.00005
       2    206.13    -0.00000 ( 99.66%)     0.01238 (  0.34%)     0.00004
   ------------------------------------------------------------------------

   temp. (K)  partition function   enthalpy   heat capacity  entropy
                                   cal/mol     cal/K/mol   cal/K/mol   J/K/mol
 298.15  VIB   3.41                 1101.164      7.428      6.131
         ROT  0.983E+04              888.752      2.981     21.251
         INT  0.335E+05             1989.917     10.409     27.382
         TR   0.353E+27             1481.254      4.968     37.697
         TOT                        3471.1707    15.3774    65.0782   272.2871

   temp. (K)  partition function   enthalpy   heat capacity  entropy
                                   cal/mol     cal/K/mol   cal/K/mol   J/K/mol
 120.00  VIB   1.22                  126.488      3.045      1.458
         ROT  0.251E+04              357.707      2.981     18.538
         INT  0.307E+04              484.194      6.026     19.996
         TR   0.901E+26              596.178      4.968     33.177
         TOT                        1080.3723    10.9937    53.1728   222.4752

   temp. (K)  partition function   enthalpy   heat capacity  entropy
                                   cal/mol     cal/K/mol   cal/K/mol   J/K/mol
 100.00  VIB   1.13                   72.525      2.342      0.968
         ROT  0.191E+04              298.089      2.981     17.994
         INT  0.215E+04              370.614      5.323     18.962
         TR   0.685E+26              496.815      4.968     32.272
         TOT                         867.4293    10.2907    51.2342   214.3639

   temp. (K)  partition function   enthalpy   heat capacity  entropy
                                   cal/mol     cal/K/mol   cal/K/mol   J/K/mol
  80.00  VIB   1.06                   33.233      1.578      0.533
         ROT  0.137E+04              238.471      2.981     17.329
         INT  0.145E+04              271.704      4.559     17.862
         TR   0.490E+26              397.452      4.968     31.164
         TOT                         669.1557     9.5267    49.0255   205.1228

   temp. (K)  partition function   enthalpy   heat capacity  entropy
                                   cal/mol     cal/K/mol   cal/K/mol   J/K/mol
  60.00  VIB   1.02                    9.661      0.783      0.198
         ROT   888.                  178.853      2.981     16.471
         INT   903.                  188.514      3.763     16.670
         TR   0.319E+26              298.089      4.968     29.735
         TOT                         486.6030     8.7316    46.4048   194.1576

   temp. (K)  partition function   enthalpy   heat capacity  entropy
                                   cal/mol     cal/K/mol   cal/K/mol   J/K/mol
  40.00  VIB   1.00                    0.874      0.157      0.026
         ROT   483.                  119.236      2.981     15.263
         INT   484.                  120.110      3.137     15.289
         TR   0.173E+26              198.726      4.968     27.722
         TOT                         318.8359     8.1056    43.0106   179.9561

   temp. (K)  partition function   enthalpy   heat capacity  entropy
                                   cal/mol     cal/K/mol   cal/K/mol   J/K/mol
  20.00  VIB   1.00                    0.001      0.000     -0.004
         ROT   171.                   59.618      2.981     13.197
         INT   171.                   59.618      2.981     13.192
         TR   0.613E+25               99.363      4.968     24.280
         TOT                         158.9815     7.9495    37.4720   156.7827

   temp. (K)  partition function   enthalpy   heat capacity  entropy
                                   cal/mol     cal/K/mol   cal/K/mol   J/K/mol
  10.00  VIB   1.00                    0.000      0.000     -0.010
         ROT   60.4                   29.809      2.981     11.130
         INT   60.4                   29.809      2.981     11.120
         TR   0.217E+25               49.681      4.968     20.838
         TOT                          79.4904     7.9490    31.9581   133.7128

       T/K    H(0)-H(T)+PV         H(T)/Eh          T*S/Eh         G(T)/Eh
   ------------------------------------------------------------------------
    298.15    0.553166E-02    0.283210E-01    0.309207E-01   -0.259970E-02
    120.00    0.172168E-02    0.245111E-01    0.101684E-01    0.143427E-01
    100.00    0.138234E-02    0.241717E-01    0.816469E-02    0.160070E-01
     80.00    0.106637E-02    0.238557E-01    0.625017E-02    0.176056E-01
     60.00    0.775451E-03    0.235648E-01    0.443704E-02    0.191278E-01
     40.00    0.508097E-03    0.232975E-01    0.274167E-02    0.205558E-01
     20.00    0.253353E-03    0.230427E-01    0.119431E-02    0.218484E-01
     10.00    0.126676E-03    0.229161E-01    0.509285E-03    0.224068E-01 (used)
   ------------------------------------------------------------------------

         :::::::::::::::::::::::::::::::::::::::::::::::::::::
         ::                  THERMODYNAMIC                  ::
         :::::::::::::::::::::::::::::::::::::::::::::::::::::
         :: total free energy          -9.556327073200 Eh   ::
         ::.................................................::
         :: total energy               -9.578733845188 Eh   ::
         :: zero point energy           0.022789380956 Eh   ::
         :: G(RRHO) w/o ZPVE           -0.000382608969 Eh   ::
         :: G(RRHO) contrib.            0.022406771987 Eh   ::
         :::::::::::::::::::::::::::::::::::::::::::::::::::::

optimized geometry written to: xtbopt.xyz


           -------------------------------------------------
          | TOTAL ENERGY               -9.578733845188 Eh   |
          | TOTAL ENTHALPY             -9.555817788215 Eh   |
          | TOTAL FREE ENERGY          -9.556327073200 Eh   |
          | GRADIENT NORM               0.000633178316 Eh/α |
          | HOMO-LUMO GAP               1.051197470127 eV   |
           -------------------------------------------------

------------------------------------------------------------------------
 * finished run on 2020/05/12 at 11:44:52.375     
------------------------------------------------------------------------
 total:
 * wall-time:     0 d,  0 h,  0 min,  0.159 sec
 *  cpu-time:     0 d,  0 h,  0 min,  0.159 sec
 * ratio c/w:     0.999 speedup
 SCF:
 * wall-time:     0 d,  0 h,  0 min,  0.005 sec
 *  cpu-time:     0 d,  0 h,  0 min,  0.005 sec
 * ratio c/w:     1.000 speedup
 ANC optimizer:
 * wall-time:     0 d,  0 h,  0 min,  0.059 sec
 *  cpu-time:     0 d,  0 h,  0 min,  0.059 sec
 * ratio c/w:     0.999 speedup
 numerical hessian:
 * wall-time:     0 d,  0 h,  0 min,  0.076 sec
 *  cpu-time:     0 d,  0 h,  0 min,  0.076 sec
 * ratio c/w:     0.998 speedup

