      -----------------------------------------------------------      
     |                   =====================                   |     
     |                           x T B                           |     
     |                   =====================                   |     
     |                         S. Grimme                         |     
     |          Mulliken Center for Theoretical Chemistry        |     
     |                    University of Bonn                     |     
      -----------------------------------------------------------      

   * xtb version 6.2.2 (9d81278992624c895f80dd42a50cac0aa55982e2) compiled by '@Darwin' on 04/03/2020

   xtb is free software: you can redistribute it and/or modify it under
   the terms of the GNU Lesser General Public License as published by
   the Free Software Foundation, either version 3 of the License, or
   (at your option) any later version.
   
   xtb is distributed in the hope that it will be useful,
   but WITHOUT ANY WARRANTY; without even the implied warranty of
   MERCHANTABILITY or FITNESS FOR A PARTICULAR PURPOSE.  See the
   GNU Lesser General Public License for more details.
   
   Cite this work as:
   * S. Grimme, C. Bannwarth, P. Shushkov, J. Chem. Theory Comput., 2017,
     13, 1989-2009. DOI: 10.1021/acs.jctc.7b00118
   * C. Bannwarth, S. Ehlert and S. Grimme., J. Chem. Theory Comput., 2019,
     15, 1652-1671. DOI: 10.1021/acs.jctc.8b01176
   * P. Pracht, E. Caldeweyher, S. Ehlert, S. Grimme, ChemRxiv, 2019, preprint.
     DOI: 10.26434/chemrxiv.8326202.v1
   
   for DFT-D4:
   * E. Caldeweyher, C. Bannwarth and S. Grimme, J. Chem. Phys., 2017,
     147, 034112. DOI: 10.1063/1.4993215
   * E. Caldeweyher, S. Ehlert, A. Hansen, H. Neugebauer, S. Spicher,
     C. Bannwarth and S. Grimme, J. Chem. Phys., 2019, 150, 154122.
     DOI: 10.1063/1.5090222
   
   for sTDA-xTB:
   * S. Grimme and C. Bannwarth, J. Chem. Phys., 2016, 145, 054103.
     DOI: 10.1063/1.4959605
   
   in the mass-spec context:
   * V. Asgeirsson, C. Bauer and S. Grimme, Chem. Sci., 2017, 8, 4879.
     DOI: 10.1039/c7sc00601b
   
   for metadynamics refer to:
   * S. Grimme, J. Chem. Theory Comput., 2019, 155, 2847-2862
     DOI: 10.1021/acs.jctc.9b00143
   
   with help from (in alphabetical order)
   C. Bannwarth, F. Bohle, G. Brandenburg, E. Caldeweyher, M. Checinski,
   S. Dohm, S. Ehlert, S. Ehrlich, F. März, H. Neugebauer, J. Pisarek,
   P. Pracht, P. Shushkov, and S. Spicher.
   
 * started run on 2020/05/12 at 11:44:55.214     

           -------------------------------------------------
          |                Calculation Setup                |
           -------------------------------------------------

          program call               : xtb --input H1C3N1_13_S_0.input H1C3N1_13_S_0.xyz --ohess --molden --namespace H1C3N1_13_S_0 output.out
          calculation namespace      : H1C3N1_13_S_0
          coordinate file            : H1C3N1_13_S_0.xyz
          number of atoms            :                     5
          number of electrons        :                    18
          charge                     :                     0
          spin                       :                   0.0
          first test random number   :      0.28312918949629

   ID    Z sym.   atoms
    1    6 C      1-3
    2    7 N      4
    3    1 H      5

           -------------------------------------------------
          |                 G F N 2 - x T B                 |
           -------------------------------------------------

        Reference                      10.1021/acs.jctc.8b01176
      * Hamiltonian:
        H0-scaling (s, p, d)           1.850000    2.230000    2.230000
        zeta-weighting                 0.500000
      * Dispersion:
        s8                             2.700000
        a1                             0.520000
        a2                             5.000000
        s9                             5.000000
      * Repulsion:
        kExp                           1.500000    1.000000
        rExp                           1.000000
      * Coulomb:
        alpha                          2.000000
        third order                    shell-resolved
        anisotropic                    true
        a3                             3.000000
        a5                             4.000000
        cn-shift                       1.200000
        cn-exp                         4.000000
        max-rad                        5.000000


          ...................................................
          :                      SETUP                      :
          :.................................................:
          :  # basis functions                  17          :
          :  # atomic orbitals                  17          :
          :  # shells                            9          :
          :  # electrons                        18          :
          :  max. iterations                   250          :
          :  Hamiltonian                  GFN2-xTB          :
          :  restarted?                      false          :
          :  GBSA solvation                  false          :
          :  PC potential                    false          :
          :  electronic temp.          300.0000000     K    :
          :  accuracy                    1.0000000          :
          :  -> integral cutoff          0.2500000E+02      :
          :  -> integral neglect         0.1000000E-07      :
          :  -> SCF convergence          0.1000000E-05 Eh   :
          :  -> wf. convergence          0.1000000E-03 e    :
          :  Broyden damping             0.4000000          :
          ...................................................

 iter      E             dE          RMSdq      gap      omega  full diag
   1     -9.4554543 -0.945545E+01  0.989E+00    1.25       0.0  T
   2     -8.6065785  0.848876E+00  0.104E+01    0.81       1.0  T
   3     -8.8214046 -0.214826E+00  0.974E+00    1.03       1.0  T
   4     -9.3955087 -0.574104E+00  0.617E+00    1.22       1.0  T
   5     -9.4706956 -0.751868E-01  0.407E+00    1.38       1.0  T
   6     -9.5111025 -0.404069E-01  0.292E+00    1.24       1.0  T
   7     -9.5098482  0.125429E-02  0.252E+00    1.30       1.0  T
   8     -9.5237295 -0.138813E-01  0.147E+00    1.22       1.0  T
   9     -9.5307017 -0.697213E-02  0.829E-01    1.15       1.0  T
  10     -9.5335842 -0.288254E-02  0.126E-01    1.05       1.0  T
  11     -9.5335292  0.550284E-04  0.153E-01    1.05       1.0  T
  12     -9.5336078 -0.786515E-04  0.134E-02    1.06       3.3  T
  13     -9.5336084 -0.592956E-06  0.799E-03    1.06       5.6  T
  14     -9.5336085 -0.110264E-06  0.325E-03    1.06      13.8  T
  15     -9.5336086 -0.388944E-07  0.647E-04    1.06      69.2  T
  16     -9.5336086 -0.138934E-08  0.464E-04    1.06      96.5  T

   *** convergence criteria satisfied after 16 iterations ***

         #    Occupation            Energy/Eh            Energy/eV
      -------------------------------------------------------------
         1        2.0000           -0.7157322             -19.4761
       ...           ...                  ...                  ...
         3        2.0000           -0.5886190             -16.0171
         4        2.0000           -0.5704819             -15.5236
         5        2.0000           -0.5454622             -14.8428
         6        2.0000           -0.4982171             -13.5572
         7        2.0000           -0.4714584             -12.8290
         8        2.0000           -0.4479966             -12.1906
         9        2.0000           -0.4352767             -11.8445 (HOMO)
        10                         -0.3963235             -10.7845 (LUMO)
        11                         -0.3648921              -9.9292
        12                         -0.3272715              -8.9055
        13                         -0.1152431              -3.1359
        14                          0.0443084               1.2057
       ...                                ...                  ...
        17                          0.2275566               6.1921
      -------------------------------------------------------------
                  HL-Gap            0.0389532 Eh            1.0600 eV
             Fermi-level           -0.4158001 Eh          -11.3145 eV

 SCC (total)                   0 d,  0 h,  0 min,  0.005 sec
 SCC setup                      ...        0 min,  0.000 sec (  2.549%)
 Dispersion                     ...        0 min,  0.000 sec (  0.540%)
 integral evaluation            ...        0 min,  0.002 sec ( 33.574%)
 zeroth order Hamiltonian       ...        0 min,  0.000 sec (  0.583%)
 iterations                     ...        0 min,  0.002 sec ( 38.007%)
 molecular gradient             ...        0 min,  0.001 sec ( 21.342%)
 printout                       ...        0 min,  0.000 sec (  3.156%)

         :::::::::::::::::::::::::::::::::::::::::::::::::::::
         ::                     SUMMARY                     ::
         :::::::::::::::::::::::::::::::::::::::::::::::::::::
         :: total energy              -9.463050891323 Eh    ::
         :: gradient norm              0.252001836184 Eh/a0 ::
         :: HOMO-LUMO gap              1.059969280080 eV    ::
         ::.................................................::
         :: SCC energy                -9.533608574400 Eh    ::
         :: -> isotropic ES           -0.005778728530 Eh    ::
         :: -> anisotropic ES         -0.000080482038 Eh    ::
         :: -> anisotropic XC          0.012573215705 Eh    ::
         :: -> dispersion             -0.002134798160 Eh    ::
         :: repulsion energy           0.070557651403 Eh    ::
         :: add. restraining           0.000000000000 Eh    ::
         :::::::::::::::::::::::::::::::::::::::::::::::::::::

      ----------------------------------------------------------- 
     |                   =====================                   |
     |                        A N C O P T                        |
     |                   =====================                   |
     |               Approximate Normal Coordinate               |
     |                Rational Function Optimizer                |
      ----------------------------------------------------------- 

          ...................................................
          :                      SETUP                      :
          :.................................................:
          :   optimization level            normal          :
          :   max. optcycles                   200          :
          :   ANC micro-cycles                  20          :
          :   degrees of freedom                 9          :
          :.................................................:
          :   RF solver                   davidson          :
          :   write xtbopt.log                true          :
          :   linear?                        false          :
          :   energy convergence         0.5000000E-05 Eh   :
          :   grad. convergence          0.1000000E-02 Eh/α :
          :   maximium RF displ.         1.0000000          :
          :   Hlow (freq-cutoff)         0.1000000E-01      :
          :   Hmax (freq-cutoff)         5.0000000          :
          :   S6 in model hess.         20.0000000          :
          ...................................................

generating ANC from model Hessian ...
Using Lindh-Hessian (1995)
 Shifting diagonal of input Hessian by    0.0000000000000000     
 Lowest  eigenvalues of input Hessian
   -0.000000   -0.000000   -0.000000   -0.000000    0.000000    0.000000
    0.013941    0.043636    0.084085    0.111080    0.690892    0.811760
    0.835024    0.976286    1.462993
 Highest eigenvalues
    0.111080    0.690892    0.811760    0.835024    0.976286    1.462993


........................................................................
.............................. CYCLE    1 ..............................
........................................................................
   1     -9.5336086 -0.953361E+01  0.413E-05    1.06       0.0  T
   2     -9.5336086  0.329070E-10  0.668E-05    1.06     669.4  T
   3     -9.5336086 -0.317026E-10  0.314E-05    1.06    1422.4  T
     SCC iter.                  ...        0 min,  0.001 sec
     gradient                   ...        0 min,  0.001 sec
 * total energy  :    -9.4630509 Eh     change       -0.1183771E-08 Eh
   gradient norm :     0.2520009 Eh/α   predicted     0.0000000E+00 (-100.00%)
   displ. norm   :     0.4500913 α      lambda       -0.8197661E-01
   maximum displ.:     0.2521850 α      in ANC's #3, #2, #5, ...

........................................................................
.............................. CYCLE    2 ..............................
........................................................................
   1     -9.6268633 -0.962686E+01  0.278E+00    1.59       0.0  T
   2     -9.5775539  0.493094E-01  0.296E+00    2.03       1.0  T
   3     -9.6084694 -0.309155E-01  0.233E+00    1.40       1.0  T
   4     -9.6283700 -0.199007E-01  0.118E+00    1.75       1.0  T
   5     -9.6369358 -0.856576E-02  0.211E-01    1.65       1.0  T
   6     -9.6369355  0.334415E-06  0.163E-01    1.66       1.0  T
   7     -9.6369340  0.149021E-05  0.501E-02    1.65       1.0  T
   8     -9.6369483 -0.143339E-04  0.139E-02    1.66       3.2  T
   9     -9.6369488 -0.537409E-06  0.233E-03    1.66      19.2  T
  10     -9.6369488  0.502671E-08  0.187E-03    1.66      24.0  T
  11     -9.6369489 -0.125931E-07  0.147E-04    1.66     304.7  T
  12     -9.6369489 -0.779377E-10  0.368E-05    1.66    1213.7  T
     SCC iter.                  ...        0 min,  0.001 sec
     gradient                   ...        0 min,  0.001 sec
 * total energy  :    -9.5348494 Eh     change       -0.7179849E-01 Eh
   gradient norm :     0.2044167 Eh/α   predicted    -0.4929180E-01 ( -31.35%)
   displ. norm   :     0.7233527 α      lambda       -0.1376272E+00
   maximum displ.:     0.4255134 α      in ANC's #8, #5, #6, ...

........................................................................
.............................. CYCLE    3 ..............................
........................................................................
   1     -9.8937431 -0.989374E+01  0.578E+00    2.62       0.0  T
   2     -9.8963115 -0.256846E-02  0.340E+00    2.83       1.0  T
   3     -9.8843385  0.119731E-01  0.253E+00    2.36       1.0  T
   4     -9.9039762 -0.196378E-01  0.416E-01    2.58       1.0  T
   5     -9.9045294 -0.553130E-03  0.221E-01    2.51       1.0  T
   6     -9.9046180 -0.886111E-04  0.543E-02    2.55       1.0  T
   7     -9.9046243 -0.628463E-05  0.940E-03    2.54       4.8  T
   8     -9.9046242  0.504974E-07  0.522E-03    2.54       8.6  T
   9     -9.9046243 -0.696308E-07  0.839E-04    2.54      53.3  T
  10     -9.9046243 -0.218144E-08  0.150E-04    2.54     298.2  T
     SCC iter.                  ...        0 min,  0.001 sec
     gradient                   ...        0 min,  0.001 sec
 * total energy  :    -9.5288612 Eh     change        0.5988158E-02 Eh
   gradient norm :     0.6361923 Eh/α   predicted    -0.1048195E+00 (*******%)
   displ. norm   :     0.3789548 α      lambda       -0.2048509E+00
   maximum displ.:     0.2385485 α      in ANC's #8, #3, #4, ...

........................................................................
.............................. CYCLE    4 ..............................
........................................................................
   1     -9.7616137 -0.976161E+01  0.210E+00    1.65       0.0  T
   2     -9.7608650  0.748683E-03  0.137E+00    1.72       1.0  T
   3     -9.7550001  0.586482E-02  0.141E+00    1.93       1.0  T
   4     -9.7602345 -0.523434E-02  0.723E-01    1.67       1.0  T
   5     -9.7640728 -0.383829E-02  0.865E-02    1.82       1.0  T
   6     -9.7640826 -0.980875E-05  0.531E-02    1.83       1.0  T
   7     -9.7640872 -0.463162E-05  0.825E-03    1.82       5.4  T
   8     -9.7640874 -0.185420E-06  0.394E-03    1.82      11.3  T
   9     -9.7640874 -0.187017E-07  0.309E-04    1.82     144.6  T
  10     -9.7640874 -0.557474E-10  0.890E-05    1.82     502.6  T
     SCC iter.                  ...        0 min,  0.001 sec
     gradient                   ...        0 min,  0.001 sec
 * total energy  :    -9.5951027 Eh     change       -0.6624147E-01 Eh
   gradient norm :     0.1298926 Eh/α   predicted    -0.1171344E+00 (  76.83%)
   displ. norm   :     0.6715555 α      lambda       -0.2649650E-01
   maximum displ.:     0.6546704 α      in ANC's #1, #3, #5, ...

........................................................................
.............................. CYCLE    5 ..............................
........................................................................
   1     -9.7495065 -0.974951E+01  0.137E+00    2.30       0.0  T
   2     -9.7484220  0.108449E-02  0.993E-01    2.20       1.0  T
   3     -9.7474208  0.100119E-02  0.883E-01    2.39       1.0  T
   4     -9.7499764 -0.255558E-02  0.358E-01    2.26       1.0  T
   5     -9.7506758 -0.699423E-03  0.637E-02    2.31       1.0  T
   6     -9.7506749  0.941540E-06  0.298E-02    2.30       1.5  T
   7     -9.7506775 -0.257648E-05  0.888E-03    2.31       5.0  T
   8     -9.7506775 -0.321436E-07  0.242E-03    2.31      18.5  T
   9     -9.7506775 -0.483427E-08  0.858E-04    2.31      52.1  T
  10     -9.7506775 -0.296110E-09  0.139E-04    2.31     322.2  T
     SCC iter.                  ...        0 min,  0.001 sec
     gradient                   ...        0 min,  0.001 sec
 * total energy  :    -9.5999596 Eh     change       -0.4856867E-02 Eh
   gradient norm :     0.1077880 Eh/α   predicted    -0.1922302E-01 ( 295.79%)
   displ. norm   :     0.3117895 α      lambda       -0.1847880E-01
   maximum displ.:     0.2342366 α      in ANC's #1, #2, #5, ...

........................................................................
.............................. CYCLE    6 ..............................
........................................................................
   1     -9.7895428 -0.978954E+01  0.130E+00    2.24       0.0  T
   2     -9.7890727  0.470033E-03  0.818E-01    2.33       1.0  T
   3     -9.7872130  0.185970E-02  0.881E-01    2.16       1.0  T
   4     -9.7900041 -0.279104E-02  0.255E-01    2.27       1.0  T
   5     -9.7903322 -0.328118E-03  0.724E-02    2.23       1.0  T
   6     -9.7903438 -0.116669E-04  0.284E-02    2.24       1.6  T
   7     -9.7903456 -0.176678E-05  0.505E-03    2.24       8.9  T
   8     -9.7903456 -0.121328E-07  0.156E-03    2.24      28.6  T
   9     -9.7903456 -0.151206E-08  0.593E-04    2.24      75.4  T
  10     -9.7903456 -0.530155E-09  0.844E-05    2.24     529.8  T
     SCC iter.                  ...        0 min,  0.001 sec
     gradient                   ...        0 min,  0.001 sec
 * total energy  :    -9.6102458 Eh     change       -0.1028619E-01 Eh
   gradient norm :     0.0465262 Eh/α   predicted    -0.1013759E-01 (  -1.44%)
   displ. norm   :     0.1428114 α      lambda       -0.5693213E-02
   maximum displ.:     0.0931445 α      in ANC's #5, #3, #4, ...

........................................................................
.............................. CYCLE    7 ..............................
........................................................................
   1     -9.8108370 -0.981084E+01  0.477E-01    2.32       0.0  T
   2     -9.8104836  0.353422E-03  0.356E-01    2.41       1.0  T
   3     -9.8107947 -0.311106E-03  0.301E-01    2.32       1.0  T
   4     -9.8110927 -0.298016E-03  0.389E-02    2.37       1.1  T
   5     -9.8110964 -0.364917E-05  0.186E-02    2.37       2.4  T
   6     -9.8110970 -0.573892E-06  0.932E-03    2.37       4.8  T
   7     -9.8110972 -0.245601E-06  0.138E-03    2.37      32.5  T
   8     -9.8110972 -0.743324E-09  0.342E-04    2.37     130.6  T
   9     -9.8110972 -0.299032E-10  0.115E-04    2.37     389.2  T
     SCC iter.                  ...        0 min,  0.001 sec
     gradient                   ...        0 min,  0.001 sec
 * total energy  :    -9.6131417 Eh     change       -0.2895914E-02 Eh
   gradient norm :     0.0475983 Eh/α   predicted    -0.2904663E-02 (   0.30%)
   displ. norm   :     0.3198296 α      lambda       -0.7134413E-02
   maximum displ.:     0.1886335 α      in ANC's #2, #5, #1, ...

........................................................................
.............................. CYCLE    8 ..............................
........................................................................
   1     -9.8206717 -0.982067E+01  0.101E+00    2.46       0.0  T
   2     -9.8204809  0.190852E-03  0.635E-01    2.56       1.0  T
   3     -9.8189218  0.155906E-02  0.665E-01    2.42       1.0  T
   4     -9.8209469 -0.202507E-02  0.912E-02    2.52       1.0  T
   5     -9.8209767 -0.298673E-04  0.444E-02    2.51       1.0  T
   6     -9.8209808 -0.405251E-05  0.146E-02    2.52       3.1  T
   7     -9.8209814 -0.568382E-06  0.154E-03    2.52      29.0  T
   8     -9.8209814 -0.128256E-08  0.571E-04    2.52      78.3  T
   9     -9.8209814 -0.116939E-09  0.129E-04    2.52     347.6  T
     SCC iter.                  ...        0 min,  0.001 sec
     gradient                   ...        0 min,  0.001 sec
 * total energy  :    -9.6183035 Eh     change       -0.5161864E-02 Eh
   gradient norm :     0.0343690 Eh/α   predicted    -0.3932114E-02 ( -23.82%)
   displ. norm   :     0.3612287 α      lambda       -0.4958432E-02
   maximum displ.:     0.2125439 α      in ANC's #5, #1, #2, ...

........................................................................
.............................. CYCLE    9 ..............................
........................................................................
   1     -9.8071605 -0.980716E+01  0.116E+00    2.54       0.0  T
   2     -9.8072595 -0.989978E-04  0.672E-01    2.61       1.0  T
   3     -9.8060271  0.123245E-02  0.514E-01    2.55       1.0  T
   4     -9.8073717 -0.134464E-02  0.111E-01    2.61       1.0  T
   5     -9.8074036 -0.318869E-04  0.669E-02    2.60       1.0  T
   6     -9.8074189 -0.152961E-04  0.263E-02    2.61       1.7  T
   7     -9.8074198 -0.861083E-06  0.327E-03    2.61      13.7  T
   8     -9.8074198 -0.137879E-08  0.901E-04    2.61      49.6  T
   9     -9.8074198 -0.116851E-08  0.223E-04    2.61     200.1  T
     SCC iter.                  ...        0 min,  0.001 sec
     gradient                   ...        0 min,  0.001 sec
 * total energy  :    -9.6204691 Eh     change       -0.2165611E-02 Eh
   gradient norm :     0.0275673 Eh/α   predicted    -0.2802724E-02 (  29.42%)
   displ. norm   :     0.0977866 α      lambda       -0.2097896E-02
   maximum displ.:     0.0704144 α      in ANC's #4, #3, #7, ...

........................................................................
.............................. CYCLE   10 ..............................
........................................................................
   1     -9.8191031 -0.981910E+01  0.485E-01    2.62       0.0  T
   2     -9.8183141  0.789023E-03  0.499E-01    2.75       1.0  T
   3     -9.8195721 -0.125807E-02  0.206E-01    2.67       1.0  T
   4     -9.8196591 -0.869596E-04  0.354E-02    2.69       1.3  T
   5     -9.8196642 -0.507911E-05  0.205E-02    2.69       2.2  T
   6     -9.8196653 -0.110897E-05  0.669E-03    2.69       6.7  T
   7     -9.8196653 -0.448271E-07  0.684E-04    2.69      65.4  T
   8     -9.8196653 -0.251639E-10  0.338E-04    2.69     132.5  T
     SCC iter.                  ...        0 min,  0.001 sec
     gradient                   ...        0 min,  0.001 sec
 * total energy  :    -9.6214967 Eh     change       -0.1027591E-02 Eh
   gradient norm :     0.0183950 Eh/α   predicted    -0.1058978E-02 (   3.05%)
   displ. norm   :     0.0638039 α      lambda       -0.6157806E-03
   maximum displ.:     0.0369756 α      in ANC's #3, #1, #7, ...

........................................................................
.............................. CYCLE   11 ..............................
........................................................................
   1     -9.8244541 -0.982445E+01  0.278E-01    2.71       0.0  T
   2     -9.8244588 -0.476148E-05  0.148E-01    2.74       1.0  T
   3     -9.8243374  0.121419E-03  0.176E-01    2.71       1.0  T
   4     -9.8244857 -0.148277E-03  0.246E-02    2.73       1.8  T
   5     -9.8244863 -0.639434E-06  0.137E-02    2.73       3.3  T
   6     -9.8244870 -0.607651E-06  0.707E-03    2.73       6.3  T
   7     -9.8244870 -0.731671E-07  0.685E-04    2.73      65.2  T
   8     -9.8244870 -0.844214E-10  0.125E-04    2.73     358.7  T
     SCC iter.                  ...        0 min,  0.001 sec
     gradient                   ...        0 min,  0.001 sec
 * total energy  :    -9.6217725 Eh     change       -0.2757828E-03 Eh
   gradient norm :     0.0143555 Eh/α   predicted    -0.3091428E-03 (  12.10%)
   displ. norm   :     0.1083495 α      lambda       -0.5650362E-03
   maximum displ.:     0.0601501 α      in ANC's #2, #1, #7, ...

........................................................................
.............................. CYCLE   12 ..............................
........................................................................
   1     -9.8234345 -0.982343E+01  0.359E-01    2.75       0.0  T
   2     -9.8234374 -0.287549E-05  0.203E-01    2.77       1.0  T
   3     -9.8232659  0.171447E-03  0.209E-01    2.75       1.0  T
   4     -9.8234752 -0.209281E-03  0.404E-02    2.77       1.1  T
   5     -9.8234794 -0.420734E-05  0.215E-02    2.77       2.1  T
   6     -9.8234808 -0.140869E-05  0.969E-03    2.77       4.6  T
   7     -9.8234809 -0.860172E-07  0.127E-03    2.77      35.2  T
   8     -9.8234809 -0.424716E-09  0.249E-04    2.77     179.2  T
   9     -9.8234809 -0.441851E-10  0.955E-05    2.77     468.3  T
     SCC iter.                  ...        0 min,  0.001 sec
     gradient                   ...        0 min,  0.001 sec
 * total energy  :    -9.6220482 Eh     change       -0.2756708E-03 Eh
   gradient norm :     0.0174784 Eh/α   predicted    -0.2858370E-03 (   3.69%)
   displ. norm   :     0.0434810 α      lambda       -0.3656351E-03
   maximum displ.:     0.0316436 α      in ANC's #7, #2, #1, ...

........................................................................
.............................. CYCLE   13 ..............................
........................................................................
   1     -9.8239456 -0.982395E+01  0.221E-01    2.76       0.0  T
   2     -9.8239059  0.396485E-04  0.158E-01    2.80       1.0  T
   3     -9.8239393 -0.333496E-04  0.130E-01    2.77       1.0  T
   4     -9.8239996 -0.602718E-04  0.187E-02    2.78       2.4  T
   5     -9.8239999 -0.365498E-06  0.970E-03    2.79       4.6  T
   6     -9.8240001 -0.204810E-06  0.461E-03    2.79       9.7  T
   7     -9.8240002 -0.391823E-07  0.415E-04    2.79     107.8  T
   8     -9.8240002 -0.526850E-10  0.131E-04    2.79     341.7  T
     SCC iter.                  ...        0 min,  0.001 sec
     gradient                   ...        0 min,  0.001 sec
 * total energy  :    -9.6223726 Eh     change       -0.3243801E-03 Eh
   gradient norm :     0.0107718 Eh/α   predicted    -0.1831629E-03 ( -43.53%)
   displ. norm   :     0.2184170 α      lambda       -0.1687954E-02
   maximum displ.:     0.1560189 α      in ANC's #7, #2, #5, ...

........................................................................
.............................. CYCLE   14 ..............................
........................................................................
   1     -9.8253112 -0.982531E+01  0.112E+00    2.78       0.0  T
   2     -9.8246673  0.643813E-03  0.725E-01    2.88       1.0  T
   3     -9.8243146  0.352745E-03  0.722E-01    2.81       1.0  T
   4     -9.8263682 -0.205361E-02  0.919E-02    2.83       1.0  T
   5     -9.8263775 -0.930759E-05  0.330E-02    2.84       1.4  T
   6     -9.8263752  0.228146E-05  0.264E-02    2.84       1.7  T
   7     -9.8263783 -0.307163E-05  0.236E-03    2.84      19.0  T
   8     -9.8263783 -0.589104E-09  0.816E-04    2.84      54.8  T
   9     -9.8263783 -0.414444E-09  0.237E-04    2.84     188.4  T
     SCC iter.                  ...        0 min,  0.001 sec
     gradient                   ...        0 min,  0.001 sec
 * total energy  :    -9.6235539 Eh     change       -0.1181383E-02 Eh
   gradient norm :     0.0186278 Eh/α   predicted    -0.8842393E-03 ( -25.15%)
   displ. norm   :     0.2247658 α      lambda       -0.1168442E-02
   maximum displ.:     0.1797276 α      in ANC's #7, #2, #5, ...

........................................................................
.............................. CYCLE   15 ..............................
........................................................................
   1     -9.8271774 -0.982718E+01  0.130E+00    2.79       0.0  T
   2     -9.8269679  0.209491E-03  0.774E-01    2.80       1.0  T
   3     -9.8255028  0.146508E-02  0.836E-01    2.82       1.0  T
   4     -9.8284601 -0.295729E-02  0.120E-01    2.81       1.0  T
   5     -9.8284718 -0.116881E-04  0.575E-02    2.80       1.0  T
   6     -9.8284842 -0.124005E-04  0.332E-02    2.81       1.3  T
   7     -9.8284860 -0.181247E-05  0.292E-03    2.81      15.3  T
   8     -9.8284860 -0.275916E-08  0.980E-04    2.81      45.7  T
   9     -9.8284860 -0.267178E-09  0.312E-04    2.81     143.4  T
     SCC iter.                  ...        0 min,  0.001 sec
     gradient                   ...        0 min,  0.001 sec
 * total energy  :    -9.6247513 Eh     change       -0.1197304E-02 Eh
   gradient norm :     0.0295980 Eh/α   predicted    -0.6137309E-03 ( -48.74%)
   displ. norm   :     0.2224725 α      lambda       -0.1941475E-02
   maximum displ.:     0.1984102 α      in ANC's #7, #2, #6, ...

........................................................................
.............................. CYCLE   16 ..............................
........................................................................
   1     -9.8319308 -0.983193E+01  0.139E+00    2.72       0.0  T
   2     -9.8323238 -0.393037E-03  0.793E-01    2.64       1.0  T
   3     -9.8303206  0.200319E-02  0.828E-01    2.73       1.0  T
   4     -9.8333049 -0.298434E-02  0.119E-01    2.68       1.0  T
   5     -9.8333155 -0.105181E-04  0.446E-02    2.67       1.0  T
   6     -9.8333170 -0.148307E-05  0.381E-02    2.68       1.2  T
   7     -9.8333215 -0.458667E-05  0.289E-03    2.67      15.5  T
   8     -9.8333215 -0.769286E-08  0.842E-04    2.67      53.1  T
   9     -9.8333215 -0.257820E-09  0.321E-04    2.67     139.5  T
     SCC iter.                  ...        0 min,  0.001 sec
     gradient                   ...        0 min,  0.001 sec
 * total energy  :    -9.6276653 Eh     change       -0.2914005E-02 Eh
   gradient norm :     0.0478195 Eh/α   predicted    -0.1018778E-02 ( -65.04%)
   displ. norm   :     0.3578366 α      lambda       -0.7430435E-02
   maximum displ.:     0.3254280 α      in ANC's #7, #6, #5, ...

........................................................................
.............................. CYCLE   17 ..............................
........................................................................
   1     -9.8371276 -0.983713E+01  0.195E+00    2.72       0.0  T
   2     -9.8378518 -0.724105E-03  0.111E+00    2.70       1.0  T
   3     -9.8345648  0.328693E-02  0.884E-01    2.50       1.0  T
   4     -9.8382392 -0.367435E-02  0.243E-01    2.68       1.0  T
   5     -9.8384980 -0.258886E-03  0.582E-02    2.64       1.0  T
   6     -9.8384897  0.834628E-05  0.423E-02    2.64       1.1  T
   7     -9.8384995 -0.977721E-05  0.426E-03    2.64      10.5  T
   8     -9.8384995 -0.507773E-07  0.232E-03    2.64      19.3  T
   9     -9.8384995 -0.166719E-07  0.333E-04    2.64     134.3  T
  10     -9.8384995 -0.385274E-10  0.376E-05    2.64    1190.7  T
     SCC iter.                  ...        0 min,  0.001 sec
     gradient                   ...        0 min,  0.001 sec
 * total energy  :    -9.6377746 Eh     change       -0.1010935E-01 Eh
   gradient norm :     0.0922835 Eh/α   predicted    -0.4190937E-02 ( -58.54%)
   displ. norm   :     0.3204669 α      lambda       -0.1955609E-01
   maximum displ.:     0.2049460 α      in ANC's #2, #7, #3, ...

........................................................................
.............................. CYCLE   18 ..............................
........................................................................
   1     -9.8834923 -0.988349E+01  0.162E+00    3.18       0.0  T
   2     -9.8811540  0.233832E-02  0.130E+00    3.37       1.0  T
   3     -9.8847440 -0.358993E-02  0.797E-01    3.16       1.0  T
   4     -9.8863828 -0.163883E-02  0.128E-01    3.24       1.0  T
   5     -9.8864247 -0.419330E-04  0.676E-02    3.23       1.0  T
   6     -9.8864344 -0.968604E-05  0.228E-02    3.23       2.0  T
   7     -9.8864364 -0.198242E-05  0.150E-03    3.23      29.9  T
   8     -9.8864364 -0.743352E-09  0.494E-04    3.23      90.5  T
   9     -9.8864364 -0.840179E-09  0.122E-04    3.23     367.4  T
     SCC iter.                  ...        0 min,  0.001 sec
     gradient                   ...        0 min,  0.001 sec
 * total energy  :    -9.6553421 Eh     change       -0.1756747E-01 Eh
   gradient norm :     0.0596608 Eh/α   predicted    -0.1078224E-01 ( -38.62%)
   displ. norm   :     0.8771183 α      lambda       -0.4141900E-01
   maximum displ.:     0.6940824 α      in ANC's #7, #3, #6, ...

........................................................................
.............................. CYCLE   19 ..............................
........................................................................
   1     -9.8045025 -0.980450E+01  0.331E+00    3.48       0.0  T
   2     -9.7856811  0.188214E-01  0.275E+00    3.46       1.0  T
   3     -9.7947251 -0.904399E-02  0.227E+00    3.82       1.0  T
   4     -9.8014757 -0.675059E-02  0.160E+00    3.40       1.0  T
   5     -9.8179286 -0.164529E-01  0.232E-01    3.56       1.0  T
   6     -9.8180505 -0.121930E-03  0.130E-01    3.58       1.0  T
   7     -9.8180919 -0.414100E-04  0.148E-02    3.57       3.0  T
   8     -9.8180923 -0.382926E-06  0.114E-02    3.57       3.9  T
   9     -9.8180929 -0.572982E-06  0.915E-04    3.57      48.9  T
  10     -9.8180929 -0.314415E-08  0.297E-04    3.57     150.4  T
     SCC iter.                  ...        0 min,  0.001 sec
     gradient                   ...        0 min,  0.001 sec
 * total energy  :    -9.6359584 Eh     change        0.1938367E-01 Eh
   gradient norm :     0.2484435 Eh/α   predicted    -0.3664205E-01 (-289.04%)
   displ. norm   :     0.4373565 α      lambda       -0.7008154E-01
   maximum displ.:     0.3895125 α      in ANC's #7, #1, #9, ...

........................................................................
.............................. CYCLE   20 ..............................
........................................................................
   1     -9.9018457 -0.990185E+01  0.249E+00    4.45       0.0  T
   2     -9.8957710  0.607471E-02  0.205E+00    4.48       1.0  T
   3     -9.9137407 -0.179697E-01  0.102E+00    4.42       1.0  T
   4     -9.9149542 -0.121352E-02  0.295E-01    4.43       1.0  T
   5     -9.9152681 -0.313911E-03  0.170E-01    4.42       1.0  T
   6     -9.9154000 -0.131842E-03  0.514E-02    4.42       1.0  T
   7     -9.9154031 -0.311938E-05  0.571E-03    4.42       7.8  T
   8     -9.9154032 -0.769868E-07  0.308E-03    4.42      14.5  T
   9     -9.9154032 -0.181397E-07  0.307E-04    4.42     145.6  T
  10     -9.9154032 -0.601297E-10  0.105E-04    4.42     427.2  T
     SCC iter.                  ...        0 min,  0.001 sec
     gradient                   ...        0 min,  0.001 sec
 * total energy  :    -9.6743302 Eh     change       -0.3837180E-01 Eh
   gradient norm :     0.0817252 Eh/α   predicted    -0.4174338E-01 (   8.79%)
   displ. norm   :     0.4875475 α      lambda       -0.1416202E-01
   maximum displ.:     0.2897097 α      in ANC's #2, #3, #7, ...
 * RMSD in coord.:     1.1869403 α      energy gain  -0.2112793E+00 Eh

generating ANC from model Hessian ...
Using Lindh-Hessian (1995)
 Shifting diagonal of input Hessian by    9.1311551758701086E-003
 Lowest  eigenvalues of input Hessian
   -0.000000   -0.000000   -0.000000    0.000000    0.000000    0.000000
    0.010000    0.014103    0.211019    0.293565    0.624226    1.002743
    1.095631    2.045126    2.909096
 Highest eigenvalues
    0.293565    0.624226    1.002743    1.095631    2.045126    2.909096


........................................................................
.............................. CYCLE   21 ..............................
........................................................................
   1     -9.9093455 -0.990935E+01  0.145E+00    3.79       0.0  T
   2     -9.9072597  0.208579E-02  0.106E+00    3.70       1.0  T
   3     -9.9063380  0.921733E-03  0.101E+00    3.82       1.0  T
   4     -9.9102809 -0.394299E-02  0.219E-01    3.73       1.0  T
   5     -9.9105713 -0.290308E-03  0.609E-02    3.75       1.0  T
   6     -9.9105769 -0.565835E-05  0.165E-02    3.75       2.7  T
   7     -9.9105785 -0.163020E-05  0.369E-03    3.75      12.1  T
   8     -9.9105786 -0.443061E-07  0.123E-03    3.75      36.3  T
   9     -9.9105786 -0.263128E-08  0.123E-04    3.75     363.1  T
  10     -9.9105786 -0.447997E-11  0.174E-05    3.75    2576.0  T
     SCC iter.                  ...        0 min,  0.001 sec
     gradient                   ...        0 min,  0.001 sec
 * total energy  :    -9.6765013 Eh     change       -0.2171065E-02 Eh
   gradient norm :     0.1298952 Eh/α   predicted     0.0000000E+00 (-100.00%)
   displ. norm   :     0.1838989 α      lambda       -0.9503392E-02
   maximum displ.:     0.1292433 α      in ANC's #1, #2, #3, ...

........................................................................
.............................. CYCLE   22 ..............................
........................................................................
   1     -9.9215844 -0.992158E+01  0.637E-01    4.06       0.0  T
   2     -9.9209471  0.637262E-03  0.513E-01    4.10       1.0  T
   3     -9.9216129 -0.665761E-03  0.371E-01    4.05       1.0  T
   4     -9.9220287 -0.415793E-03  0.632E-02    4.06       1.0  T
   5     -9.9220447 -0.160215E-04  0.232E-02    4.06       1.9  T
   6     -9.9220449 -0.237170E-06  0.131E-02    4.06       3.4  T
   7     -9.9220455 -0.592942E-06  0.117E-03    4.06      38.1  T
   8     -9.9220455 -0.516406E-09  0.276E-04    4.06     162.3  T
   9     -9.9220455 -0.123602E-09  0.803E-05    4.06     556.7  T
     SCC iter.                  ...        0 min,  0.001 sec
     gradient                   ...        0 min,  0.001 sec
 * total energy  :    -9.6831032 Eh     change       -0.6601921E-02 Eh
   gradient norm :     0.0483784 Eh/α   predicted    -0.4912393E-02 ( -25.59%)
   displ. norm   :     0.1545992 α      lambda       -0.5284284E-02
   maximum displ.:     0.0878150 α      in ANC's #3, #5, #4, ...

........................................................................
.............................. CYCLE   23 ..............................
........................................................................
   1     -9.9324651 -0.993247E+01  0.601E-01    4.39       0.0  T
   2     -9.9322729  0.192278E-03  0.409E-01    4.40       1.0  T
   3     -9.9320729  0.199959E-03  0.382E-01    4.39       1.0  T
   4     -9.9326499 -0.577036E-03  0.246E-02    4.39       1.8  T
   5     -9.9326496  0.303031E-06  0.844E-03    4.39       5.3  T
   6     -9.9326499 -0.249290E-06  0.491E-03    4.39       9.1  T
   7     -9.9326500 -0.113388E-06  0.725E-04    4.39      61.7  T
   8     -9.9326500 -0.786731E-10  0.231E-04    4.39     193.9  T
     SCC iter.                  ...        0 min,  0.001 sec
     gradient                   ...        0 min,  0.001 sec
 * total energy  :    -9.6866992 Eh     change       -0.3595962E-02 Eh
   gradient norm :     0.0376101 Eh/α   predicted    -0.2705292E-02 ( -24.77%)
   displ. norm   :     0.5202308 α      lambda       -0.6405334E-02
   maximum displ.:     0.3513088 α      in ANC's #1, #2, #5, ...

........................................................................
.............................. CYCLE   24 ..............................
........................................................................
   1     -9.9079363 -0.990794E+01  0.160E+00    4.37       0.0  T
   2     -9.9071547  0.781667E-03  0.104E+00    4.29       1.0  T
   3     -9.9055833  0.157139E-02  0.939E-01    4.40       1.0  T
   4     -9.9090858 -0.350252E-02  0.232E-01    4.33       1.0  T
   5     -9.9093611 -0.275317E-03  0.708E-02    4.34       1.0  T
   6     -9.9093699 -0.872289E-05  0.319E-02    4.34       1.4  T
   7     -9.9093717 -0.182692E-05  0.269E-03    4.34      16.6  T
   8     -9.9093717  0.561542E-08  0.130E-03    4.34      34.3  T
   9     -9.9093717 -0.783283E-08  0.190E-04    4.34     235.1  T
  10     -9.9093717 -0.399574E-10  0.337E-05    4.34    1328.8  T
     SCC iter.                  ...        0 min,  0.001 sec
     gradient                   ...        0 min,  0.001 sec
 * total energy  :    -9.6882086 Eh     change       -0.1509413E-02 Eh
   gradient norm :     0.0798975 Eh/α   predicted    -0.4069436E-02 ( 169.60%)
   displ. norm   :     0.2192969 α      lambda       -0.6248174E-02
   maximum displ.:     0.1949508 α      in ANC's #2, #1, #6, ...

........................................................................
.............................. CYCLE   25 ..............................
........................................................................
   1     -9.9359208 -0.993592E+01  0.883E-01    4.63       0.0  T
   2     -9.9355803  0.340446E-03  0.620E-01    4.65       1.0  T
   3     -9.9360936 -0.513301E-03  0.451E-01    4.62       1.0  T
   4     -9.9365891 -0.495493E-03  0.149E-01    4.64       1.0  T
   5     -9.9367030 -0.113897E-03  0.329E-02    4.64       1.4  T
   6     -9.9367051 -0.209421E-05  0.160E-02    4.64       2.8  T
   7     -9.9367055 -0.446907E-06  0.140E-03    4.64      31.9  T
   8     -9.9367055 -0.142838E-08  0.248E-04    4.63     180.6  T
   9     -9.9367055 -0.574136E-10  0.775E-05    4.63     577.4  T
     SCC iter.                  ...        0 min,  0.001 sec
     gradient                   ...        0 min,  0.001 sec
 * total energy  :    -9.6910626 Eh     change       -0.2853991E-02 Eh
   gradient norm :     0.0430581 Eh/α   predicted    -0.3274326E-02 (  14.73%)
   displ. norm   :     0.3366442 α      lambda       -0.3974837E-02
   maximum displ.:     0.2486809 α      in ANC's #1, #2, #6, ...

........................................................................
.............................. CYCLE   26 ..............................
........................................................................
   1     -9.9358697 -0.993587E+01  0.110E+00    4.56       0.0  T
   2     -9.9358602  0.952554E-05  0.666E-01    4.58       1.0  T
   3     -9.9347228  0.113735E-02  0.517E-01    4.51       1.0  T
   4     -9.9360605 -0.133765E-02  0.806E-02    4.57       1.0  T
   5     -9.9360828 -0.223558E-04  0.438E-02    4.56       1.0  T
   6     -9.9360897 -0.690607E-05  0.140E-02    4.56       3.2  T
   7     -9.9360900 -0.277901E-06  0.782E-04    4.56      57.2  T
   8     -9.9360900 -0.281643E-09  0.218E-04    4.56     204.9  T
     SCC iter.                  ...        0 min,  0.001 sec
     gradient                   ...        0 min,  0.001 sec
 * total energy  :    -9.6910573 Eh     change        0.5302222E-05 Eh
   gradient norm :     0.0537806 Eh/α   predicted    -0.2212657E-02 (*******%)
   displ. norm   :     0.2746508 α      lambda       -0.4172381E-02
   maximum displ.:     0.2567161 α      in ANC's #1, #5, #6, ...

........................................................................
.............................. CYCLE   27 ..............................
........................................................................
   1     -9.9416296 -0.994163E+01  0.707E-01    4.63       0.0  T
   2     -9.9416028  0.267867E-04  0.424E-01    4.61       1.0  T
   3     -9.9408604  0.742349E-03  0.410E-01    4.66       1.0  T
   4     -9.9417006 -0.840204E-03  0.690E-02    4.62       1.0  T
   5     -9.9417213 -0.206480E-04  0.272E-02    4.62       1.6  T
   6     -9.9417231 -0.178776E-05  0.113E-02    4.63       4.0  T
   7     -9.9417234 -0.289460E-06  0.800E-04    4.63      55.9  T
   8     -9.9417234  0.212582E-09  0.296E-04    4.63     151.1  T
     SCC iter.                  ...        0 min,  0.001 sec
     gradient                   ...        0 min,  0.001 sec
 * total energy  :    -9.6937054 Eh     change       -0.2648104E-02 Eh
   gradient norm :     0.0238434 Eh/α   predicted    -0.2243554E-02 ( -15.28%)
   displ. norm   :     0.1539830 α      lambda       -0.1016010E-02
   maximum displ.:     0.1450728 α      in ANC's #1, #6, #7, ...

........................................................................
.............................. CYCLE   28 ..............................
........................................................................
   1     -9.9428894 -0.994289E+01  0.353E-01    4.63       0.0  T
   2     -9.9428801  0.931187E-05  0.223E-01    4.64       1.0  T
   3     -9.9427166  0.163423E-03  0.199E-01    4.61       1.0  T
   4     -9.9429126 -0.195947E-03  0.442E-02    4.63       1.0  T
   5     -9.9429227 -0.100740E-04  0.119E-02    4.63       3.7  T
   6     -9.9429228 -0.973700E-07  0.324E-03    4.63      13.8  T
   7     -9.9429228 -0.464509E-07  0.472E-04    4.63      94.7  T
   8     -9.9429228 -0.125651E-09  0.647E-05    4.63     691.2  T
     SCC iter.                  ...        0 min,  0.001 sec
     gradient                   ...        0 min,  0.001 sec
 * total energy  :    -9.6941015 Eh     change       -0.3960982E-03 Eh
   gradient norm :     0.0263724 Eh/α   predicted    -0.5200509E-03 (  31.29%)
   displ. norm   :     0.0523692 α      lambda       -0.4240769E-03
   maximum displ.:     0.0328351 α      in ANC's #2, #6, #5, ...

........................................................................
.............................. CYCLE   29 ..............................
........................................................................
   1     -9.9435586 -0.994356E+01  0.203E-01    4.65       0.0  T
   2     -9.9435598 -0.126142E-05  0.119E-01    4.65       1.0  T
   3     -9.9435602 -0.381631E-06  0.107E-02    4.65       4.2  T
   4     -9.9435599  0.275356E-06  0.941E-03    4.65       4.8  T
   5     -9.9435603 -0.311568E-06  0.385E-03    4.65      11.6  T
   6     -9.9435603 -0.677668E-07  0.133E-03    4.65      33.6  T
   7     -9.9435603 -0.926831E-08  0.251E-04    4.65     178.1  T
   8     -9.9435603 -0.649827E-10  0.511E-05    4.65     875.9  T
     SCC iter.                  ...        0 min,  0.001 sec
     gradient                   ...        0 min,  0.001 sec
 * total energy  :    -9.6944098 Eh     change       -0.3083812E-03 Eh
   gradient norm :     0.0207564 Eh/α   predicted    -0.2126197E-03 ( -31.05%)
   displ. norm   :     0.0674837 α      lambda       -0.4586242E-03
   maximum displ.:     0.0419521 α      in ANC's #2, #6, #5, ...

........................................................................
.............................. CYCLE   30 ..............................
........................................................................
   1     -9.9479335 -0.994793E+01  0.278E-01    4.71       0.0  T
   2     -9.9479225  0.109333E-04  0.175E-01    4.73       1.0  T
   3     -9.9478186  0.103908E-03  0.169E-01    4.69       1.0  T
   4     -9.9479507 -0.132032E-03  0.344E-02    4.72       1.3  T
   5     -9.9479562 -0.558547E-05  0.929E-03    4.72       4.8  T
   6     -9.9479564 -0.106229E-06  0.446E-03    4.71      10.0  T
   7     -9.9479564 -0.495520E-07  0.392E-04    4.71     114.1  T
   8     -9.9479564 -0.113026E-09  0.782E-05    4.71     571.5  T
     SCC iter.                  ...        0 min,  0.001 sec
     gradient                   ...        0 min,  0.001 sec
 * total energy  :    -9.6946933 Eh     change       -0.2834368E-03 Eh
   gradient norm :     0.0097949 Eh/α   predicted    -0.2303573E-03 ( -18.73%)
   displ. norm   :     0.1518851 α      lambda       -0.3601108E-03
   maximum displ.:     0.0930182 α      in ANC's #2, #1, #6, ...

........................................................................
.............................. CYCLE   31 ..............................
........................................................................
   1     -9.9404778 -0.994048E+01  0.551E-01    4.64       0.0  T
   2     -9.9404530  0.247874E-04  0.333E-01    4.61       1.0  T
   3     -9.9400230  0.429995E-03  0.318E-01    4.67       1.0  T
   4     -9.9405294 -0.506418E-03  0.610E-02    4.63       1.0  T
   5     -9.9405479 -0.184588E-04  0.177E-02    4.63       2.5  T
   6     -9.9405481 -0.190584E-06  0.569E-03    4.63       7.9  T
   7     -9.9405482 -0.104073E-06  0.546E-04    4.63      81.9  T
   8     -9.9405482 -0.217510E-09  0.108E-04    4.63     414.1  T
     SCC iter.                  ...        0 min,  0.001 sec
     gradient                   ...        0 min,  0.001 sec
 * total energy  :    -9.6947091 Eh     change       -0.1582425E-04 Eh
   gradient norm :     0.0250596 Eh/α   predicted    -0.1842062E-03 (1064.08%)
   displ. norm   :     0.0452259 α      lambda       -0.3780118E-03
   maximum displ.:     0.0249770 α      in ANC's #2, #5, #6, ...

........................................................................
.............................. CYCLE   32 ..............................
........................................................................
   1     -9.9478564 -0.994786E+01  0.201E-01    4.73       0.0  T
   2     -9.9478321  0.243218E-04  0.143E-01    4.75       1.0  T
   3     -9.9478593 -0.271416E-04  0.109E-01    4.72       1.0  T
   4     -9.9478885 -0.292062E-04  0.412E-02    4.73       1.1  T
   5     -9.9478974 -0.896393E-05  0.672E-03    4.73       6.7  T
   6     -9.9478974 -0.187935E-07  0.370E-03    4.73      12.1  T
   7     -9.9478975 -0.326918E-07  0.366E-04    4.73     122.1  T
   8     -9.9478975 -0.123224E-09  0.640E-05    4.73     699.3  T
     SCC iter.                  ...        0 min,  0.001 sec
     gradient                   ...        0 min,  0.001 sec
 * total energy  :    -9.6948932 Eh     change       -0.1840697E-03 Eh
   gradient norm :     0.0042833 Eh/α   predicted    -0.1893927E-03 (   2.89%)
   displ. norm   :     0.0248185 α      lambda       -0.2610413E-04
   maximum displ.:     0.0156855 α      in ANC's #2, #1, #6, ...

........................................................................
.............................. CYCLE   33 ..............................
........................................................................
   1     -9.9480091 -0.994801E+01  0.840E-02    4.73       0.0  T
   2     -9.9480094 -0.228709E-06  0.488E-02    4.73       1.0  T
   3     -9.9480095 -0.903103E-07  0.365E-03    4.73      12.2  T
   4     -9.9480094  0.384396E-07  0.345E-03    4.73      13.0  T
   5     -9.9480095 -0.497334E-07  0.617E-04    4.73      72.4  T
   6     -9.9480095 -0.207067E-08  0.191E-04    4.73     234.6  T
     SCC iter.                  ...        0 min,  0.000 sec
     gradient                   ...        0 min,  0.001 sec
 * total energy  :    -9.6949130 Eh     change       -0.1985375E-04 Eh
   gradient norm :     0.0032662 Eh/α   predicted    -0.1306123E-04 ( -34.21%)
   displ. norm   :     0.0291924 α      lambda       -0.2670985E-04
   maximum displ.:     0.0190212 α      in ANC's #2, #6, #1, ...

........................................................................
.............................. CYCLE   34 ..............................
........................................................................
   1     -9.9478371 -0.994784E+01  0.107E-01    4.73       0.0  T
   2     -9.9478374 -0.296204E-06  0.623E-02    4.73       1.0  T
   3     -9.9478355  0.186962E-05  0.191E-02    4.74       2.3  T
   4     -9.9478376 -0.209794E-05  0.405E-03    4.73      11.0  T
   5     -9.9478376  0.971169E-08  0.338E-03    4.73      13.2  T
   6     -9.9478377 -0.449463E-07  0.319E-04    4.73     140.1  T
   7     -9.9478377 -0.477501E-09  0.645E-05    4.73     693.9  T
     SCC iter.                  ...        0 min,  0.001 sec
     gradient                   ...        0 min,  0.001 sec
 * total energy  :    -9.6949307 Eh     change       -0.1766458E-04 Eh
   gradient norm :     0.0021542 Eh/α   predicted    -0.1336523E-04 ( -24.34%)
   displ. norm   :     0.0128708 α      lambda       -0.1265871E-04
   maximum displ.:     0.0077735 α      in ANC's #3, #2, #6, ...

........................................................................
.............................. CYCLE   35 ..............................
........................................................................
   1     -9.9479739 -0.994797E+01  0.496E-02    4.74       0.0  T
   2     -9.9479739 -0.578131E-07  0.293E-02    4.74       1.5  T
   3     -9.9479738  0.812842E-07  0.478E-03    4.74       9.4  T
   4     -9.9479740 -0.113594E-06  0.147E-03    4.74      30.5  T
   5     -9.9479740 -0.713518E-09  0.223E-04    4.74     200.5  T
   6     -9.9479740 -0.230255E-09  0.943E-05    4.74     474.0  T
     SCC iter.                  ...        0 min,  0.001 sec
     gradient                   ...        0 min,  0.001 sec
 * total energy  :    -9.6949399 Eh     change       -0.9184102E-05 Eh
   gradient norm :     0.0015924 Eh/α   predicted    -0.6332171E-05 ( -31.05%)
   displ. norm   :     0.0175460 α      lambda       -0.9097776E-05
   maximum displ.:     0.0111942 α      in ANC's #1, #3, #5, ...

........................................................................
.............................. CYCLE   36 ..............................
........................................................................
   1     -9.9481937 -0.994819E+01  0.544E-02    4.74       0.0  T
   2     -9.9481937 -0.751580E-07  0.318E-02    4.74       1.4  T
   3     -9.9481930  0.768327E-06  0.123E-02    4.74       3.6  T
   4     -9.9481938 -0.864136E-06  0.228E-03    4.74      19.6  T
   5     -9.9481938  0.235776E-07  0.226E-03    4.74      19.8  T
   6     -9.9481938 -0.271562E-07  0.131E-04    4.74     341.7  T
   7     -9.9481938 -0.722267E-10  0.370E-05    4.74    1207.5  T
     SCC iter.                  ...        0 min,  0.001 sec
     gradient                   ...        0 min,  0.001 sec
 * total energy  :    -9.6949459 Eh     change       -0.6005038E-05 Eh
   gradient norm :     0.0011547 Eh/α   predicted    -0.4549521E-05 ( -24.24%)
   displ. norm   :     0.0075519 α      lambda       -0.1659332E-05
   maximum displ.:     0.0042176 α      in ANC's #2, #1, #3, ...

........................................................................
.............................. CYCLE   37 ..............................
........................................................................
   1     -9.9480750 -0.994807E+01  0.252E-02    4.74       0.0  T
   2     -9.9480750 -0.197119E-07  0.147E-02    4.74       3.0  T
   3     -9.9480749  0.761780E-07  0.396E-03    4.74      11.3  T
   4     -9.9480750 -0.891274E-07  0.910E-04    4.74      49.2  T
   5     -9.9480750  0.133949E-08  0.757E-04    4.74      59.1  T
     SCC iter.                  ...        0 min,  0.000 sec
     gradient                   ...        0 min,  0.001 sec
 * total energy  :    -9.6949478 Eh     change       -0.1923265E-05 Eh
   gradient norm :     0.0009678 Eh/α   predicted    -0.8303582E-06 ( -56.83%)
   displ. norm   :     0.0108473 α      lambda       -0.2763842E-05
   maximum displ.:     0.0054205 α      in ANC's #2, #3, #1, ...

   *** GEOMETRY OPTIMIZATION CONVERGED AFTER 37 ITERATIONS ***

------------------------------------------------------------------------
 total energy gain   :        -0.2318969 Eh     -145.5175 kcal/mol
 total RMSD          :         1.4831980 a0        0.7849 Å
 total power (kW/mol):       -16.4552769 (step)-5707.6872 (real)
------------------------------------------------------------------------

 ANCopt (total)                0 d,  0 h,  0 min,  0.107 sec
 optimizer setup                ...        0 min,  0.000 sec (  0.066%)
 model hessian                  ...        0 min,  0.000 sec (  0.118%)
 ANC generation                 ...        0 min,  0.000 sec (  0.091%)
 coordinate transformation      ...        0 min,  0.000 sec (  0.077%)
 single point calculation       ...        0 min,  0.104 sec ( 97.048%)
 optimization log               ...        0 min,  0.001 sec (  0.859%)
 hessian update                 ...        0 min,  0.000 sec (  0.069%)
 rational function              ...        0 min,  0.001 sec (  0.769%)

================
 final structure:
================
5
 xtb: 6.2.2 (9d81278992624c895f80dd42a50cac0aa55982e2)
C         1.08853486858758   -0.63890263784351    0.06925584932856
C         0.05320293867632   -0.03081470917467    0.00787253249611
C        -2.06618568203933    1.22142948959837   -0.14289171069019
N        -1.05735345104336    0.63102456665353   -0.06755782273889
H         1.98180132581881   -1.18273670923370    0.13332215160445

 Bond Distances (Angstroems)
 ---------------------------
C1-C2=1.2023         C1-H5=1.0478         C2-C1=1.2023         C2-N4=1.2950         C3-N4=1.1713         N4-C2=1.2950         
N4-C3=1.1713         H5-C1=1.0478         
 C  H  Rav=1.0478 sigma=0.0000  Rmin=1.0478  Rmax=1.0478     1
 C  C  Rav=1.2023 sigma=0.0000  Rmin=1.2023  Rmax=1.2023     1
 N  C  Rav=1.2332 sigma=0.0618  Rmin=1.1713  Rmax=1.2950     2

 selected bond angles (degree)
 --------------------
H5-C1-C2=178.93                N4-C2-C1=179.45                C3-N4-C2=179.43                

 selected dihedral angles (degree)
 ---------------------------------
N4-C2-C1-H5=195.87            C3-N4-C2-C1= 94.03            
           -------------------------------------------------
          |                Final Singlepoint                |
           -------------------------------------------------

          ...................................................
          :                      SETUP                      :
          :.................................................:
          :  # basis functions                  17          :
          :  # atomic orbitals                  17          :
          :  # shells                            9          :
          :  # electrons                        18          :
          :  max. iterations                   250          :
          :  Hamiltonian                  GFN2-xTB          :
          :  restarted?                      false          :
          :  GBSA solvation                  false          :
          :  PC potential                    false          :
          :  electronic temp.          300.0000000     K    :
          :  accuracy                    1.0000000          :
          :  -> integral cutoff          0.2500000E+02      :
          :  -> integral neglect         0.1000000E-07      :
          :  -> SCF convergence          0.1000000E-05 Eh   :
          :  -> wf. convergence          0.1000000E-03 e    :
          :  Broyden damping             0.4000000          :
          ...................................................

 iter      E             dE          RMSdq      gap      omega  full diag
   1     -9.9480750 -0.994807E+01  0.216E-04    4.74       0.0  T
   2     -9.9480750 -0.845546E-12  0.125E-04    4.74     358.8  T
   3     -9.9480750  0.263061E-10  0.744E-05    4.74     601.4  T

   *** convergence criteria satisfied after 3 iterations ***

         #    Occupation            Energy/Eh            Energy/eV
      -------------------------------------------------------------
         1        2.0000           -0.6768801             -18.4188
       ...           ...                  ...                  ...
         3        2.0000           -0.6168110             -16.7843
         4        2.0000           -0.5347185             -14.5504
         5        2.0000           -0.5347138             -14.5503
         6        2.0000           -0.5293170             -14.4034
         7        2.0000           -0.4408827             -11.9970
         8        2.0000           -0.4377181             -11.9109
         9        2.0000           -0.4376994             -11.9104 (HOMO)
        10                         -0.2636802              -7.1751 (LUMO)
        11                         -0.2636708              -7.1748
        12                         -0.1178757              -3.2076
        13                         -0.1178661              -3.2073
        14                          0.0206266               0.5613
       ...                                ...                  ...
        17                          1.5401494              41.9096
      -------------------------------------------------------------
                  HL-Gap            0.1740192 Eh            4.7353 eV
             Fermi-level           -0.3506898 Eh           -9.5428 eV

 SCC (total)                   0 d,  0 h,  0 min,  0.002 sec
 SCC setup                      ...        0 min,  0.000 sec (  2.105%)
 Dispersion                     ...        0 min,  0.000 sec (  0.455%)
 integral evaluation            ...        0 min,  0.001 sec ( 40.530%)
 zeroth order Hamiltonian       ...        0 min,  0.000 sec (  0.534%)
 iterations                     ...        0 min,  0.000 sec ( 13.428%)
 molecular gradient             ...        0 min,  0.001 sec ( 40.332%)
 printout                       ...        0 min,  0.000 sec (  2.243%)

         :::::::::::::::::::::::::::::::::::::::::::::::::::::
         ::                     SUMMARY                     ::
         :::::::::::::::::::::::::::::::::::::::::::::::::::::
         :: total energy              -9.694947797727 Eh    ::
         :: gradient norm              0.000973820873 Eh/a0 ::
         :: HOMO-LUMO gap              4.735304793693 eV    ::
         ::.................................................::
         :: SCC energy                -9.948074987011 Eh    ::
         :: -> isotropic ES           -0.009742173201 Eh    ::
         :: -> anisotropic ES         -0.000733744967 Eh    ::
         :: -> anisotropic XC          0.021918838860 Eh    ::
         :: -> dispersion             -0.002072707667 Eh    ::
         :: repulsion energy           0.253127700542 Eh    ::
         :: add. restraining           0.000000000000 Eh    ::
         :::::::::::::::::::::::::::::::::::::::::::::::::::::

           ------------------------------------------------- 
          |                Numerical Hessian                |
           ------------------------------------------------- 
step length          :   0.00500
SCC accuracy         :   0.30000
Hessian scale factor :   1.00000
frozen atoms in %    :   0.00000    0
RMS gradient         :   0.00097
estimated CPU  time      0.00 min
estimated wall time      0.00 min

writing file <hessian>.

 projected vibrational frequencies (cm-1)
eigval :       -0.00    -0.00    -0.00     0.00     0.00     0.00
eigval :      200.45   297.63   385.29   561.86   667.70   980.45
eigval :     2150.81  2277.04  3409.18
           -------------------------------------------------
          |                Property Printout                |
           -------------------------------------------------

    * Orbital Energies and Occupations

         #    Occupation            Energy/Eh            Energy/eV
      -------------------------------------------------------------
         1        2.0000           -0.6768801             -18.4188
         2        2.0000           -0.6525818             -17.7577
         3        2.0000           -0.6168108             -16.7843
         4        2.0000           -0.5347184             -14.5504
         5        2.0000           -0.5347136             -14.5503
         6        2.0000           -0.5293168             -14.4034
         7        2.0000           -0.4408833             -11.9970
         8        2.0000           -0.4377180             -11.9109
         9        2.0000           -0.4376993             -11.9104 (HOMO)
        10                         -0.2636805              -7.1751 (LUMO)
        11                         -0.2636711              -7.1749
        12                         -0.1178755              -3.2076
        13                         -0.1178659              -3.2073
        14                          0.0206268               0.5613
        15                          0.2818488               7.6695
        16                          0.9510691              25.8799
        17                          1.5401497              41.9096
      -------------------------------------------------------------
                  HL-Gap            0.1740188 Eh            4.7353 eV
             Fermi-level           -0.3506899 Eh           -9.5428 eV

     #   Z        covCN         q      C6AA      α(0)
     1   6 C      1.910    -0.088    33.528     9.351
     2   6 C      1.898     0.050    29.845     8.823
     3   6 C      0.917    -0.138    39.904    10.575
     4   7 N      1.822     0.076    20.561     6.719
     5   1 H      0.928     0.100     1.786     2.090

 Mol. C6AA /au·bohr⁶  :        548.473422
 Mol. C8AA /au·bohr⁸  :      14479.831113
Molecule has the following symmetry elements: (Cinf) (sigma) 
It seems to be the Cinfv point group
 Mol. α(0) /au        :         37.558081


Wiberg/Mayer (AO) data.
largest (>0.10) Wiberg bond orders for each atom
          total WBO             WBO to atom ...
     1  C   3.972        C    2 2.703    H    5 0.969    C    3 0.278
     2  C   3.972        C    1 2.703    N    4 1.222
     3  C   2.784        N    4 2.463    C    1 0.278
     4  N   3.718        C    3 2.463    C    2 1.222
     5  H   0.990        C    1 0.969

MOs/occ written to file <molden.input>


molecular dipole:
                 x           y           z       tot (Debye)
 q only:        0.583      -0.346       0.042
   full:        0.965      -0.575       0.069       2.861
molecular quadrupole (traceless):
                xx          xy          yy          xz          yz          zz
 q only:       -0.637       0.663       0.131      -0.083       0.048       0.507
  q+dip:        0.024      -0.069       0.019      -0.012       0.005      -0.042
   full:       -2.259       2.389       0.444      -0.293       0.171       1.816

           -------------------------------------------------
          |                Geometry Summary                 |
           -------------------------------------------------

      molecular mass/u    :       51.0468517
   center of mass at/Å    :       -0.4685054       0.2796066      -0.0313768
  moments of inertia/u·Å² :        0.1161996E-02   0.1001182E+03   0.1001186E+03
rotational constants/cm⁻¹ :        0.1450748E+05   0.1683774E+00   0.1683766E+00

 * 4 selected distances

     #   Z        #   Z                                     value/Å
     1   6 C      2   6 C                                 1.2022691
     2   6 C      4   7 N                                 1.2950121 (max)
     3   6 C      4   7 N                                 1.1713222
     1   6 C      5   1 H                                 1.0477523 (min)

 * 3 distinct bonds (by element types)

   Z      Z             #   av. dist./Å        max./Å        min./Å
   1 H    6 C           1     1.0477523     1.0477523     1.0477523
   6 C    6 C           1     1.2022691     1.2022691     1.2022691
   6 C    7 N           2     1.2331672     1.2950121     1.1713222

           -------------------------------------------------
          |               Frequency Printout                |
           -------------------------------------------------
 projected vibrational frequencies (cm-1)
eigval :       -0.00    -0.00    -0.00     0.00     0.00     0.00
eigval :      200.45   297.63   385.29   561.86   667.70   980.45
eigval :     2150.81  2277.04  3409.18
 reduced masses (amu)
   1: 11.88   2: 12.01   3: 11.98   4: 11.36   5: 11.51   6: 11.83   7: 11.84   8: 10.61
   9: 12.07  10:  6.07  11:  3.27  12: 12.00  13: 12.66  14: 11.56  15:  2.49
 IR intensities (amu)
   1:  0.22   2:  0.08   3:  0.10   4:  0.19   5:  0.05   6:  0.04   7:  0.23   8:  0.27
   9:  0.20  10:  0.04  11:  0.10  12:  0.08  13:  0.17  14:  0.04  15:  0.17
 Raman intensities (amu)
   1:  0.00   2:  0.00   3:  0.00   4:  0.00   5:  0.00   6:  0.00   7:  0.00   8:  0.00
   9:  0.00  10:  0.00  11:  0.00  12:  0.00  13:  0.00  14:  0.00  15:  0.00
 output can be read by thermo (or use thermo option).
 writing <g98.out> molden fake output.
 recommended (thermochemical) frequency scaling factor: 1.0
           -------------------------------------------------
          |             Thermodynamic Functions             |
           -------------------------------------------------

cin symmetry found (for desy threshold:  0.10E+00) used in thermo

          ...................................................
          :                      SETUP                      :
          :.................................................:
          :  # frequencies                           9      :
          :  # imaginary freq.                       0      :
          :  linear?                             false      :
          :  only rotor calc.                    false      :
          :  symmetry                              cin      :
          :  rotational number                       1      :
          :  scaling factor                  1.0000000      :
          :  rotor cutoff                   50.0000000 cm⁻¹ :
          :  imag. cutoff                  -20.0000000 cm⁻¹ :
          :.................................................:

    mode    ω/cm⁻¹     T·S(HO)/kcal·mol⁻¹    T·S(FR)/kcal·mol⁻¹   T·S(vib)
   ------------------------------------------------------------------------
       1    200.45    -0.00000 ( 99.61%)     0.01211 (  0.39%)     0.00005
       2    297.63    -0.00000 ( 99.92%)     0.01603 (  0.08%)     0.00001
   ------------------------------------------------------------------------

   temp. (K)  partition function   enthalpy   heat capacity  entropy
                                   cal/mol     cal/K/mol   cal/K/mol   J/K/mol
 298.15  VIB   2.82                 1039.086      7.435      5.547
         ROT   261.                  888.752      2.981     14.037
         INT   736.                 1927.838     10.416     19.584
         TR   0.353E+27             1481.254      4.968     37.697
         TOT                        3409.0920    15.3842    57.2808   239.6627

   temp. (K)  partition function   enthalpy   heat capacity  entropy
                                   cal/mol     cal/K/mol   cal/K/mol   J/K/mol
 120.00  VIB   1.14                   95.195      2.588      1.064
         ROT   66.6                  357.707      2.981     11.324
         INT   76.2                  452.902      5.569     12.388
         TR   0.901E+26              596.178      4.968     33.177
         TOT                        1049.0797    10.5373    45.5652   190.6449

   temp. (K)  partition function   enthalpy   heat capacity  entropy
                                   cal/mol     cal/K/mol   cal/K/mol   J/K/mol
 100.00  VIB   1.08                   50.812      1.848      0.662
         ROT   50.6                  298.089      2.981     10.780
         INT   54.6                  348.901      4.829     11.442
         TR   0.685E+26              496.815      4.968     32.272
         TOT                         845.7157     9.7969    43.7138   182.8987

   temp. (K)  partition function   enthalpy   heat capacity  entropy
                                   cal/mol     cal/K/mol   cal/K/mol   J/K/mol
  80.00  VIB   1.03                   21.221      1.118      0.334
         ROT   36.2                  238.471      2.981     10.115
         INT   37.5                  259.693      4.099     10.449
         TR   0.490E+26              397.452      4.968     31.164
         TOT                         657.1445     9.0667    41.6132   174.1097

   temp. (K)  partition function   enthalpy   heat capacity  entropy
                                   cal/mol     cal/K/mol   cal/K/mol   J/K/mol
  60.00  VIB   1.01                    5.510      0.479      0.112
         ROT   23.5                  178.853      2.981      9.258
         INT   23.8                  184.364      3.460      9.370
         TR   0.319E+26              298.089      4.968     29.735
         TOT                         482.4526     8.4282    39.1047   163.6143

   temp. (K)  partition function   enthalpy   heat capacity  entropy
                                   cal/mol     cal/K/mol   cal/K/mol   J/K/mol
  40.00  VIB   1.00                    0.444      0.082      0.013
         ROT   12.8                  119.236      2.981      8.049
         INT   12.8                  119.680      3.063      8.062
         TR   0.173E+26              198.726      4.968     27.722
         TOT                         318.4056     8.0310    35.7837   149.7189

   temp. (K)  partition function   enthalpy   heat capacity  entropy
                                   cal/mol     cal/K/mol   cal/K/mol   J/K/mol
  20.00  VIB   1.00                    0.000      0.000     -0.003
         ROT   4.53                   59.618      2.981      5.983
         INT   4.53                   59.618      2.981      5.980
         TR   0.613E+25               99.363      4.968     24.280
         TOT                         158.9811     7.9493    30.2595   126.6056

   temp. (K)  partition function   enthalpy   heat capacity  entropy
                                   cal/mol     cal/K/mol   cal/K/mol   J/K/mol
  10.00  VIB   1.00                    0.000      0.000     -0.007
         ROT   1.60                   29.809      2.981      3.917
         INT   1.60                   29.809      2.981      3.910
         TR   0.217E+25               49.681      4.968     20.838
         TOT                          79.4904     7.9490    24.7478   103.5448

       T/K    H(0)-H(T)+PV         H(T)/Eh          T*S/Eh         G(T)/Eh
   ------------------------------------------------------------------------
    298.15    0.543273E-02    0.303341E-01    0.272159E-01    0.311812E-02
    120.00    0.167181E-02    0.265731E-01    0.871353E-02    0.178596E-01
    100.00    0.134773E-02    0.262491E-01    0.696624E-02    0.192828E-01
     80.00    0.104723E-02    0.259485E-01    0.530519E-02    0.206434E-01
     60.00    0.768837E-03    0.256702E-01    0.373904E-02    0.219311E-01
     40.00    0.507412E-03    0.254087E-01    0.228100E-02    0.231277E-01
     20.00    0.253353E-03    0.251547E-01    0.964431E-03    0.241902E-01
     10.00    0.126676E-03    0.250280E-01    0.394381E-03    0.246336E-01 (used)
   ------------------------------------------------------------------------

         :::::::::::::::::::::::::::::::::::::::::::::::::::::
         ::                  THERMODYNAMIC                  ::
         :::::::::::::::::::::::::::::::::::::::::::::::::::::
         :: total free energy          -9.670314181529 Eh   ::
         ::.................................................::
         :: total energy               -9.694947797444 Eh   ::
         :: zero point energy           0.024901321386 Eh   ::
         :: G(RRHO) w/o ZPVE           -0.000267705471 Eh   ::
         :: G(RRHO) contrib.            0.024633615915 Eh   ::
         :::::::::::::::::::::::::::::::::::::::::::::::::::::

optimized geometry written to: xtbopt.xyz


           -------------------------------------------------
          | TOTAL ENERGY               -9.694947797444 Eh   |
          | TOTAL ENTHALPY             -9.669919800043 Eh   |
          | TOTAL FREE ENERGY          -9.670314181529 Eh   |
          | GRADIENT NORM               0.000973140532 Eh/α |
          | HOMO-LUMO GAP               4.735292319346 eV   |
           -------------------------------------------------

------------------------------------------------------------------------
 * finished run on 2020/05/12 at 11:44:55.422     
------------------------------------------------------------------------
 total:
 * wall-time:     0 d,  0 h,  0 min,  0.207 sec
 *  cpu-time:     0 d,  0 h,  0 min,  0.207 sec
 * ratio c/w:     0.998 speedup
 SCF:
 * wall-time:     0 d,  0 h,  0 min,  0.005 sec
 *  cpu-time:     0 d,  0 h,  0 min,  0.005 sec
 * ratio c/w:     0.999 speedup
 ANC optimizer:
 * wall-time:     0 d,  0 h,  0 min,  0.110 sec
 *  cpu-time:     0 d,  0 h,  0 min,  0.110 sec
 * ratio c/w:     0.999 speedup
 numerical hessian:
 * wall-time:     0 d,  0 h,  0 min,  0.077 sec
 *  cpu-time:     0 d,  0 h,  0 min,  0.076 sec
 * ratio c/w:     0.997 speedup

