      -----------------------------------------------------------      
     |                   =====================                   |     
     |                           x T B                           |     
     |                   =====================                   |     
     |                         S. Grimme                         |     
     |          Mulliken Center for Theoretical Chemistry        |     
     |                    University of Bonn                     |     
      -----------------------------------------------------------      

   * xtb version 6.2.2 (9d81278992624c895f80dd42a50cac0aa55982e2) compiled by '@Darwin' on 04/03/2020

   xtb is free software: you can redistribute it and/or modify it under
   the terms of the GNU Lesser General Public License as published by
   the Free Software Foundation, either version 3 of the License, or
   (at your option) any later version.
   
   xtb is distributed in the hope that it will be useful,
   but WITHOUT ANY WARRANTY; without even the implied warranty of
   MERCHANTABILITY or FITNESS FOR A PARTICULAR PURPOSE.  See the
   GNU Lesser General Public License for more details.
   
   Cite this work as:
   * S. Grimme, C. Bannwarth, P. Shushkov, J. Chem. Theory Comput., 2017,
     13, 1989-2009. DOI: 10.1021/acs.jctc.7b00118
   * C. Bannwarth, S. Ehlert and S. Grimme., J. Chem. Theory Comput., 2019,
     15, 1652-1671. DOI: 10.1021/acs.jctc.8b01176
   * P. Pracht, E. Caldeweyher, S. Ehlert, S. Grimme, ChemRxiv, 2019, preprint.
     DOI: 10.26434/chemrxiv.8326202.v1
   
   for DFT-D4:
   * E. Caldeweyher, C. Bannwarth and S. Grimme, J. Chem. Phys., 2017,
     147, 034112. DOI: 10.1063/1.4993215
   * E. Caldeweyher, S. Ehlert, A. Hansen, H. Neugebauer, S. Spicher,
     C. Bannwarth and S. Grimme, J. Chem. Phys., 2019, 150, 154122.
     DOI: 10.1063/1.5090222
   
   for sTDA-xTB:
   * S. Grimme and C. Bannwarth, J. Chem. Phys., 2016, 145, 054103.
     DOI: 10.1063/1.4959605
   
   in the mass-spec context:
   * V. Asgeirsson, C. Bauer and S. Grimme, Chem. Sci., 2017, 8, 4879.
     DOI: 10.1039/c7sc00601b
   
   for metadynamics refer to:
   * S. Grimme, J. Chem. Theory Comput., 2019, 155, 2847-2862
     DOI: 10.1021/acs.jctc.9b00143
   
   with help from (in alphabetical order)
   C. Bannwarth, F. Bohle, G. Brandenburg, E. Caldeweyher, M. Checinski,
   S. Dohm, S. Ehlert, S. Ehrlich, F. März, H. Neugebauer, J. Pisarek,
   P. Pracht, P. Shushkov, and S. Spicher.
   
 * started run on 2020/05/12 at 11:45:24.147     

           -------------------------------------------------
          |                Calculation Setup                |
           -------------------------------------------------

          program call               : xtb --input H2C1N2_13_S_0.input H2C1N2_13_S_0.xyz --ohess --molden --namespace H2C1N2_13_S_0 output.out
          calculation namespace      : H2C1N2_13_S_0
          coordinate file            : H2C1N2_13_S_0.xyz
          number of atoms            :                     5
          number of electrons        :                    16
          charge                     :                     0
          spin                       :                   0.0
          first test random number   :      0.23789160838322

   ID    Z sym.   atoms
    1    7 N      1, 3
    2    6 C      2
    3    1 H      4, 5

           -------------------------------------------------
          |                 G F N 2 - x T B                 |
           -------------------------------------------------

        Reference                      10.1021/acs.jctc.8b01176
      * Hamiltonian:
        H0-scaling (s, p, d)           1.850000    2.230000    2.230000
        zeta-weighting                 0.500000
      * Dispersion:
        s8                             2.700000
        a1                             0.520000
        a2                             5.000000
        s9                             5.000000
      * Repulsion:
        kExp                           1.500000    1.000000
        rExp                           1.000000
      * Coulomb:
        alpha                          2.000000
        third order                    shell-resolved
        anisotropic                    true
        a3                             3.000000
        a5                             4.000000
        cn-shift                       1.200000
        cn-exp                         4.000000
        max-rad                        5.000000


          ...................................................
          :                      SETUP                      :
          :.................................................:
          :  # basis functions                  14          :
          :  # atomic orbitals                  14          :
          :  # shells                            8          :
          :  # electrons                        16          :
          :  max. iterations                   250          :
          :  Hamiltonian                  GFN2-xTB          :
          :  restarted?                      false          :
          :  GBSA solvation                  false          :
          :  PC potential                    false          :
          :  electronic temp.          300.0000000     K    :
          :  accuracy                    1.0000000          :
          :  -> integral cutoff          0.2500000E+02      :
          :  -> integral neglect         0.1000000E-07      :
          :  -> SCF convergence          0.1000000E-05 Eh   :
          :  -> wf. convergence          0.1000000E-03 e    :
          :  Broyden damping             0.4000000          :
          ...................................................

 iter      E             dE          RMSdq      gap      omega  full diag
   1     -8.8908932 -0.889089E+01  0.554E+00    2.46       0.0  T
   2     -8.9023585 -0.114653E-01  0.337E+00    2.02       1.0  T
   3     -8.9027577 -0.399246E-03  0.115E+00    1.83       1.0  T
   4     -8.9037481 -0.990384E-03  0.243E-01    1.65       1.0  T
   5     -8.9037684 -0.202985E-04  0.360E-02    1.69       1.2  T
   6     -8.9037684 -0.239075E-08  0.113E-02    1.69       4.0  T
   7     -8.9037684  0.975766E-08  0.670E-03    1.69       6.7  T
   8     -8.9037686 -0.145427E-06  0.146E-03    1.69      30.6  T
   9     -8.9037686 -0.246400E-08  0.128E-04    1.69     350.3  T
  10     -8.9037686 -0.674660E-11  0.516E-05    1.69     867.0  T

   *** convergence criteria satisfied after 10 iterations ***

         #    Occupation            Energy/Eh            Energy/eV
      -------------------------------------------------------------
         1        2.0000           -0.7250310             -19.7291
         2        2.0000           -0.6113790             -16.6365
         3        2.0000           -0.5998574             -16.3230
         4        2.0000           -0.5882041             -16.0058
         5        2.0000           -0.5102426             -13.8844
         6        2.0000           -0.4805191             -13.0756
         7        2.0000           -0.4665120             -12.6944
         8        2.0000           -0.4570989             -12.4383 (HOMO)
         9                         -0.3949985             -10.7485 (LUMO)
        10                         -0.1402668              -3.8169
        11                         -0.0012880              -0.0350
        12                          0.0425420               1.1576
        13                          0.1943056               5.2873
        14                          0.2291539               6.2356
      -------------------------------------------------------------
                  HL-Gap            0.0621004 Eh            1.6898 eV
             Fermi-level           -0.4260487 Eh          -11.5934 eV

 SCC (total)                   0 d,  0 h,  0 min,  0.003 sec
 SCC setup                      ...        0 min,  0.000 sec (  3.366%)
 Dispersion                     ...        0 min,  0.000 sec (  0.545%)
 integral evaluation            ...        0 min,  0.001 sec ( 27.806%)
 zeroth order Hamiltonian       ...        0 min,  0.000 sec (  0.537%)
 iterations                     ...        0 min,  0.001 sec ( 36.702%)
 molecular gradient             ...        0 min,  0.001 sec ( 28.479%)
 printout                       ...        0 min,  0.000 sec (  2.224%)

         :::::::::::::::::::::::::::::::::::::::::::::::::::::
         ::                     SUMMARY                     ::
         :::::::::::::::::::::::::::::::::::::::::::::::::::::
         :: total energy              -8.841420650448 Eh    ::
         :: gradient norm              0.224825801946 Eh/a0 ::
         :: HOMO-LUMO gap              1.689837540391 eV    ::
         ::.................................................::
         :: SCC energy                -8.903768554323 Eh    ::
         :: -> isotropic ES            0.003712462969 Eh    ::
         :: -> anisotropic ES          0.001773024171 Eh    ::
         :: -> anisotropic XC          0.020580961023 Eh    ::
         :: -> dispersion             -0.001420755378 Eh    ::
         :: repulsion energy           0.062347877172 Eh    ::
         :: add. restraining           0.000000000000 Eh    ::
         :::::::::::::::::::::::::::::::::::::::::::::::::::::

      ----------------------------------------------------------- 
     |                   =====================                   |
     |                        A N C O P T                        |
     |                   =====================                   |
     |               Approximate Normal Coordinate               |
     |                Rational Function Optimizer                |
      ----------------------------------------------------------- 

          ...................................................
          :                      SETUP                      :
          :.................................................:
          :   optimization level            normal          :
          :   max. optcycles                   200          :
          :   ANC micro-cycles                  20          :
          :   degrees of freedom                 9          :
          :.................................................:
          :   RF solver                   davidson          :
          :   write xtbopt.log                true          :
          :   linear?                        false          :
          :   energy convergence         0.5000000E-05 Eh   :
          :   grad. convergence          0.1000000E-02 Eh/α :
          :   maximium RF displ.         1.0000000          :
          :   Hlow (freq-cutoff)         0.1000000E-01      :
          :   Hmax (freq-cutoff)         5.0000000          :
          :   S6 in model hess.         20.0000000          :
          ...................................................

generating ANC from model Hessian ...
Using Lindh-Hessian (1995)
 Shifting diagonal of input Hessian by    0.0000000000000000     
 Lowest  eigenvalues of input Hessian
   -0.000000   -0.000000   -0.000000   -0.000000    0.000000    0.000000
    0.086037    0.097773    0.158362    0.167734    0.399327    0.982438
    1.022114    1.197804    1.759335
 Highest eigenvalues
    0.167734    0.399327    0.982438    1.022114    1.197804    1.759335


........................................................................
.............................. CYCLE    1 ..............................
........................................................................
   1     -8.9037686 -0.890377E+01  0.300E-06    1.69       0.0  T
   2     -8.9037686  0.000000E+00  0.167E-06    1.69   26819.7  T
   3     -8.9037686  0.710543E-14  0.339E-07    1.69  100000.0  T
     SCC iter.                  ...        0 min,  0.001 sec
     gradient                   ...        0 min,  0.001 sec
 * total energy  :    -8.8414207 Eh     change       -0.1610751E-08 Eh
   gradient norm :     0.2248259 Eh/α   predicted     0.0000000E+00 (-100.00%)
   displ. norm   :     0.2665165 α      lambda       -0.4967583E-01
   maximum displ.:     0.1872539 α      in ANC's #7, #3, #9, ...

........................................................................
.............................. CYCLE    2 ..............................
........................................................................
   1     -8.9568367 -0.895684E+01  0.199E+00    2.65       0.0  T
   2     -8.9584024 -0.156569E-02  0.967E-01    2.49       1.0  T
   3     -8.9584941 -0.917823E-04  0.383E-01    2.53       1.0  T
   4     -8.9586092 -0.115058E-03  0.612E-02    2.49       1.0  T
   5     -8.9586097 -0.534120E-06  0.702E-03    2.49       6.4  T
   6     -8.9586097 -0.149745E-07  0.201E-03    2.49      22.2  T
   7     -8.9586097 -0.481947E-08  0.470E-04    2.49      95.1  T
   8     -8.9586097 -0.206040E-10  0.383E-05    2.49    1167.2  T
     SCC iter.                  ...        0 min,  0.001 sec
     gradient                   ...        0 min,  0.001 sec
 * total energy  :    -8.8820523 Eh     change       -0.4063161E-01 Eh
   gradient norm :     0.1278516 Eh/α   predicted    -0.2660218E-01 ( -34.53%)
   displ. norm   :     0.2752135 α      lambda       -0.3196559E-01
   maximum displ.:     0.2261808 α      in ANC's #7, #3, #9, ...

........................................................................
.............................. CYCLE    3 ..............................
........................................................................
   1     -9.0035159 -0.900352E+01  0.295E+00    3.90       0.0  T
   2     -9.0082023 -0.468638E-02  0.135E+00    3.52       1.0  T
   3     -9.0085018 -0.299514E-03  0.620E-01    3.62       1.0  T
   4     -9.0087011 -0.199289E-03  0.736E-02    3.54       1.0  T
   5     -9.0087023 -0.121011E-05  0.107E-02    3.54       4.2  T
   6     -9.0087023 -0.440019E-07  0.288E-03    3.55      15.5  T
   7     -9.0087023 -0.120990E-07  0.570E-04    3.54      78.5  T
   8     -9.0087023 -0.261782E-10  0.217E-05    3.54    2062.4  T
     SCC iter.                  ...        0 min,  0.001 sec
     gradient                   ...        0 min,  0.001 sec
 * total energy  :    -8.8759688 Eh     change        0.6083476E-02 Eh
   gradient norm :     0.2684676 Eh/α   predicted    -0.1719337E-01 (-382.62%)
   displ. norm   :     0.1570671 α      lambda       -0.4015857E-01
   maximum displ.:     0.1431468 α      in ANC's #7, #9, #5, ...

........................................................................
.............................. CYCLE    4 ..............................
........................................................................
   1     -8.9766763 -0.897668E+01  0.192E+00    2.61       0.0  T
   2     -8.9787993 -0.212297E-02  0.881E-01    2.80       1.0  T
   3     -8.9789370 -0.137703E-03  0.402E-01    2.75       1.0  T
   4     -8.9790357 -0.987204E-04  0.525E-02    2.79       1.0  T
   5     -8.9790363 -0.605855E-06  0.786E-03    2.79       5.7  T
   6     -8.9790364 -0.366947E-07  0.200E-03    2.79      22.4  T
   7     -8.9790364 -0.408767E-08  0.558E-04    2.79      80.2  T
   8     -8.9790364 -0.891465E-10  0.257E-05    2.79    1741.2  T
     SCC iter.                  ...        0 min,  0.001 sec
     gradient                   ...        0 min,  0.001 sec
 * total energy  :    -8.8901319 Eh     change       -0.1416309E-01 Eh
   gradient norm :     0.0405148 Eh/α   predicted    -0.2057464E-01 (  45.27%)
   displ. norm   :     0.0241704 α      lambda       -0.8274771E-03
   maximum displ.:     0.0193536 α      in ANC's #7, #3, #9, ...

........................................................................
.............................. CYCLE    5 ..............................
........................................................................
   1     -8.9837171 -0.898372E+01  0.242E-01    2.90       0.0  T
   2     -8.9837484 -0.313011E-04  0.112E-01    2.87       1.0  T
   3     -8.9837505 -0.205887E-05  0.512E-02    2.88       1.0  T
   4     -8.9837521 -0.162226E-05  0.658E-03    2.88       6.8  T
   5     -8.9837521 -0.849677E-08  0.871E-04    2.88      51.4  T
   6     -8.9837521 -0.211962E-09  0.164E-04    2.88     273.4  T
     SCC iter.                  ...        0 min,  0.000 sec
     gradient                   ...        0 min,  0.001 sec
 * total energy  :    -8.8906715 Eh     change       -0.5396351E-03 Eh
   gradient norm :     0.0120102 Eh/α   predicted    -0.4139792E-03 ( -23.29%)
   displ. norm   :     0.0097728 α      lambda       -0.1007341E-03
   maximum displ.:     0.0077839 α      in ANC's #7, #3, #9, ...

........................................................................
.............................. CYCLE    6 ..............................
........................................................................
   1     -8.9855870 -0.898559E+01  0.101E-01    2.92       0.0  T
   2     -8.9855926 -0.554364E-05  0.468E-02    2.91       1.0  T
   3     -8.9855929 -0.367614E-06  0.213E-02    2.91       2.1  T
   4     -8.9855932 -0.276761E-06  0.276E-03    2.91      16.2  T
   5     -8.9855932 -0.162936E-08  0.380E-04    2.91     117.6  T
   6     -8.9855932 -0.388116E-10  0.668E-05    2.91     669.6  T
     SCC iter.                  ...        0 min,  0.000 sec
     gradient                   ...        0 min,  0.001 sec
 * total energy  :    -8.8907187 Eh     change       -0.4715802E-04 Eh
   gradient norm :     0.0008405 Eh/α   predicted    -0.5037120E-04 (   6.81%)
   displ. norm   :     0.0009536 α      lambda       -0.5060825E-06
   maximum displ.:     0.0008920 α      in ANC's #7, #3, #5, ...

........................................................................
.............................. CYCLE    7 ..............................
........................................................................
   1     -8.9854087 -0.898541E+01  0.110E-02    2.91       0.0  T
   2     -8.9854088 -0.654796E-07  0.498E-03    2.91       9.0  T
   3     -8.9854088 -0.430959E-08  0.231E-03    2.91      19.4  T
   4     -8.9854088 -0.324228E-08  0.289E-04    2.91     154.9  T
   5     -8.9854088 -0.143174E-10  0.349E-05    2.91    1281.8  T
     SCC iter.                  ...        0 min,  0.000 sec
     gradient                   ...        0 min,  0.001 sec
 * total energy  :    -8.8907189 Eh     change       -0.1927400E-06 Eh
   gradient norm :     0.0004556 Eh/α   predicted    -0.2513500E-06 (  30.41%)
   displ. norm   :     0.0003516 α      lambda       -0.8550981E-07
   maximum displ.:     0.0002524 α      in ANC's #7, #3, #9, ...

   *** GEOMETRY OPTIMIZATION CONVERGED AFTER 7 ITERATIONS ***

------------------------------------------------------------------------
 total energy gain   :        -0.0492982 Eh      -30.9351 kcal/mol
 total RMSD          :         0.1949999 a0        0.1032 Å
 total power (kW/mol):       -18.4903507 (step)-8173.3046 (real)
------------------------------------------------------------------------

 ANCopt (total)                0 d,  0 h,  0 min,  0.016 sec
 optimizer setup                ...        0 min,  0.000 sec (  0.466%)
 model hessian                  ...        0 min,  0.000 sec (  1.211%)
 ANC generation                 ...        0 min,  0.000 sec (  0.453%)
 coordinate transformation      ...        0 min,  0.000 sec (  0.110%)
 single point calculation       ...        0 min,  0.015 sec ( 93.463%)
 optimization log               ...        0 min,  0.000 sec (  1.094%)
 hessian update                 ...        0 min,  0.000 sec (  0.126%)
 rational function              ...        0 min,  0.000 sec (  1.144%)

================
 final structure:
================
5
 xtb: 6.2.2 (9d81278992624c895f80dd42a50cac0aa55982e2)
N         0.98083515822805   -0.03186543195475    0.64903042304330
C        -0.29720965581405    0.00383146197912   -0.01238520141991
N         1.03191930079620    0.00591849895886   -0.56515610526842
H        -0.86845159790778   -0.91166369077618   -0.06490745235559
H        -0.84709220530242    0.93377916179295   -0.00658166399938

 Bond Distances (Angstroems)
 ---------------------------
N1-C2=1.4395         N1-N3=1.2158         C2-N1=1.4395         C2-N3=1.4395         C2-H4=1.0804         C2-H5=1.0804         
N3-N1=1.2158         N3-C2=1.4395         H4-C2=1.0804         H5-C2=1.0804         
 C  H  Rav=1.0804 sigma=0.0000  Rmin=1.0804  Rmax=1.0804     2
 N  C  Rav=1.4395 sigma=0.0000  Rmin=1.4395  Rmax=1.4395     2
 N  N  Rav=1.2158 sigma=0.0000  Rmin=1.2158  Rmax=1.2158     1

 selected bond angles (degree)
 --------------------
N3-N1-C2= 65.02                N3-C2-N1= 49.96                H4-C2-N1=118.08                H4-C2-N3=118.08                
H5-C2-N1=118.08                H5-C2-N3=118.08                H5-C2-H4=117.42                C2-N3-N1= 65.02                

 selected dihedral angles (degree)
 ---------------------------------
H4-C2-N1-N3=104.39            H5-C2-N1-N3=255.61            N1-N3-C2-H4=255.61            N1-N3-C2-H5=104.39            
           -------------------------------------------------
          |                Final Singlepoint                |
           -------------------------------------------------

          ...................................................
          :                      SETUP                      :
          :.................................................:
          :  # basis functions                  14          :
          :  # atomic orbitals                  14          :
          :  # shells                            8          :
          :  # electrons                        16          :
          :  max. iterations                   250          :
          :  Hamiltonian                  GFN2-xTB          :
          :  restarted?                      false          :
          :  GBSA solvation                  false          :
          :  PC potential                    false          :
          :  electronic temp.          300.0000000     K    :
          :  accuracy                    1.0000000          :
          :  -> integral cutoff          0.2500000E+02      :
          :  -> integral neglect         0.1000000E-07      :
          :  -> SCF convergence          0.1000000E-05 Eh   :
          :  -> wf. convergence          0.1000000E-03 e    :
          :  Broyden damping             0.4000000          :
          ...................................................

 iter      E             dE          RMSdq      gap      omega  full diag
   1     -8.9854088 -0.898541E+01  0.111E-05    2.91       0.0  T
   2     -8.9854088 -0.150990E-12  0.624E-06    2.91    7171.8  T
   3     -8.9854088 -0.639488E-13  0.286E-06    2.91   15619.5  T

   *** convergence criteria satisfied after 3 iterations ***

         #    Occupation            Energy/Eh            Energy/eV
      -------------------------------------------------------------
         1        2.0000           -0.7440369             -20.2463
         2        2.0000           -0.6292215             -17.1220
         3        2.0000           -0.5955895             -16.2068
         4        2.0000           -0.5843072             -15.8998
         5        2.0000           -0.5446627             -14.8210
         6        2.0000           -0.4764654             -12.9653
         7        2.0000           -0.4555783             -12.3969
         8        2.0000           -0.4390167             -11.9463 (HOMO)
         9                         -0.3321268              -9.0376 (LUMO)
        10                         -0.1023045              -2.7838
        11                          0.0668920               1.8202
        12                          0.1900492               5.1715
        13                          0.2479010               6.7457
        14                          0.3672056               9.9922
      -------------------------------------------------------------
                  HL-Gap            0.1068899 Eh            2.9086 eV
             Fermi-level           -0.3855718 Eh          -10.4919 eV

 SCC (total)                   0 d,  0 h,  0 min,  0.002 sec
 SCC setup                      ...        0 min,  0.000 sec (  2.538%)
 Dispersion                     ...        0 min,  0.000 sec (  0.508%)
 integral evaluation            ...        0 min,  0.001 sec ( 40.036%)
 zeroth order Hamiltonian       ...        0 min,  0.000 sec (  0.616%)
 iterations                     ...        0 min,  0.000 sec ( 13.583%)
 molecular gradient             ...        0 min,  0.001 sec ( 39.795%)
 printout                       ...        0 min,  0.000 sec (  2.429%)

         :::::::::::::::::::::::::::::::::::::::::::::::::::::
         ::                     SUMMARY                     ::
         :::::::::::::::::::::::::::::::::::::::::::::::::::::
         :: total energy              -8.890718868029 Eh    ::
         :: gradient norm              0.000455613036 Eh/a0 ::
         :: HOMO-LUMO gap              2.908621800084 eV    ::
         ::.................................................::
         :: SCC energy                -8.985408812404 Eh    ::
         :: -> isotropic ES            0.001786732982 Eh    ::
         :: -> anisotropic ES          0.003556528710 Eh    ::
         :: -> anisotropic XC          0.019610630975 Eh    ::
         :: -> dispersion             -0.001425226206 Eh    ::
         :: repulsion energy           0.094689923802 Eh    ::
         :: add. restraining           0.000000000000 Eh    ::
         :::::::::::::::::::::::::::::::::::::::::::::::::::::

           ------------------------------------------------- 
          |                Numerical Hessian                |
           ------------------------------------------------- 
step length          :   0.00500
SCC accuracy         :   0.30000
Hessian scale factor :   1.00000
frozen atoms in %    :   0.00000    0
RMS gradient         :   0.00046
estimated CPU  time      0.00 min
estimated wall time      0.00 min

writing file <hessian>.

 projected vibrational frequencies (cm-1)
eigval :       -0.00    -0.00    -0.00    -0.00     0.00     0.00
eigval :      953.86   980.96   983.61  1091.34  1195.72  1444.18
eigval :     1799.63  3091.15  3101.85
           -------------------------------------------------
          |                Property Printout                |
           -------------------------------------------------

    * Orbital Energies and Occupations

         #    Occupation            Energy/Eh            Energy/eV
      -------------------------------------------------------------
         1        2.0000           -0.7440369             -20.2463
         2        2.0000           -0.6292215             -17.1220
         3        2.0000           -0.5955895             -16.2068
         4        2.0000           -0.5843072             -15.8998
         5        2.0000           -0.5446627             -14.8210
         6        2.0000           -0.4764654             -12.9653
         7        2.0000           -0.4555783             -12.3969
         8        2.0000           -0.4390167             -11.9463 (HOMO)
         9                         -0.3321268              -9.0376 (LUMO)
        10                         -0.1023045              -2.7838
        11                          0.0668920               1.8202
        12                          0.1900492               5.1715
        13                          0.2479010               6.7457
        14                          0.3672056               9.9922
      -------------------------------------------------------------
                  HL-Gap            0.1068899 Eh            2.9086 eV
             Fermi-level           -0.3855718 Eh          -10.4919 eV

     #   Z        covCN         q      C6AA      α(0)
     1   7 N      1.889    -0.060    23.126     7.129
     2   6 C      3.667     0.045    20.059     6.422
     3   7 N      1.889    -0.060    23.126     7.129
     4   1 H      0.926     0.037     2.491     2.468
     5   1 H      0.926     0.037     2.491     2.468

 Mol. C6AA /au·bohr⁶  :        297.113726
 Mol. C8AA /au·bohr⁸  :       6427.918647
 Mol. α(0) /au        :         25.616531


Wiberg/Mayer (AO) data.
largest (>0.10) Wiberg bond orders for each atom
          total WBO             WBO to atom ...
     1  N   2.966        N    3 1.992    C    2 0.956
     2  C   3.869        H    4 0.978    H    5 0.978    N    1 0.956    N    3 0.956
     3  N   2.966        N    1 1.992    C    2 0.956
     4  H   0.999        C    2 0.978
     5  H   0.999        C    2 0.978

MOs/occ written to file <molden.input>


molecular dipole:
                 x           y           z       tot (Debye)
Molecule has the following symmetry elements: (C2) 2*(sigma) 
It seems to be the C2v point group
 q only:       -0.372       0.005      -0.015
   full:       -0.626       0.008      -0.026       1.591
molecular quadrupole (traceless):
                xx          xy          yy          xz          yz          zz
 q only:       -0.257       0.008       0.414      -0.004       0.018      -0.157
  q+dip:       -1.178       0.041       2.373       0.002       0.113      -1.195
   full:       -1.077       0.044       2.800       0.029       0.143      -1.723

           -------------------------------------------------
          |                Geometry Summary                 |
           -------------------------------------------------

      molecular mass/u    :       42.0400238
   center of mass at/Å    :        0.5445568      -0.0070228       0.0226905
  moments of inertia/u·Å² :        0.1207125E+02   0.2020278E+02   0.2883745E+02
rotational constants/cm⁻¹ :        0.1396511E+01   0.8344212E+00   0.5845744E+00

 * 3 selected distances

     #   Z        #   Z                                     value/Å
     1   7 N      3   7 N                                 1.2158479 (max)
     2   6 C      4   1 H                                 1.0803737
     2   6 C      5   1 H                                 1.0803737 (min)

 * 2 distinct bonds (by element types)

   Z      Z             #   av. dist./Å        max./Å        min./Å
   1 H    6 C           2     1.0803737     1.0803737     1.0803737
   7 N    7 N           1     1.2158479     1.2158479     1.2158479

           -------------------------------------------------
          |               Frequency Printout                |
           -------------------------------------------------
 projected vibrational frequencies (cm-1)
eigval :       -0.00    -0.00    -0.00    -0.00     0.00     0.00
eigval :      953.86   980.96   983.61  1091.34  1195.72  1444.18
eigval :     1799.63  3091.15  3101.85
 reduced masses (amu)
   1:  9.76   2: 13.94   3: 12.17   4: 11.01   5: 13.44   6: 11.41   7: 11.56   8:  2.86
   9:  5.04  10:  3.60  11: 11.96  12:  2.12  13: 13.74  14:  1.41  15:  2.12
 IR intensities (amu)
   1:  0.32   2:  0.12   3:  0.04   4:  0.18   5:  0.19   6:  0.05   7:  0.20   8:  0.00
   9:  0.09  10:  0.31  11:  0.14  12:  0.09  13:  0.94  14:  0.18  15:  0.29
 Raman intensities (amu)
   1:  0.00   2:  0.00   3:  0.00   4:  0.00   5:  0.00   6:  0.00   7:  0.00   8:  0.00
   9:  0.00  10:  0.00  11:  0.00  12:  0.00  13:  0.00  14:  0.00  15:  0.00
 output can be read by thermo (or use thermo option).
 writing <g98.out> molden fake output.
 recommended (thermochemical) frequency scaling factor: 1.0
           -------------------------------------------------
          |             Thermodynamic Functions             |
           -------------------------------------------------

c2v symmetry found (for desy threshold:  0.10E+00) used in thermo

          ...................................................
          :                      SETUP                      :
          :.................................................:
          :  # frequencies                           9      :
          :  # imaginary freq.                       0      :
          :  linear?                             false      :
          :  only rotor calc.                    false      :
          :  symmetry                              c2v      :
          :  rotational number                       2      :
          :  scaling factor                  1.0000000      :
          :  rotor cutoff                   50.0000000 cm⁻¹ :
          :  imag. cutoff                  -20.0000000 cm⁻¹ :
          :.................................................:

    mode    ω/cm⁻¹     T·S(HO)/kcal·mol⁻¹    T·S(FR)/kcal·mol⁻¹   T·S(vib)
   ------------------------------------------------------------------------
   ------------------------------------------------------------------------

   temp. (K)  partition function   enthalpy   heat capacity  entropy
                                   cal/mol     cal/K/mol   cal/K/mol   J/K/mol
 298.15  VIB   1.04                  108.769      1.836      0.438
         ROT  0.320E+04              888.752      2.981     19.022
         INT  0.332E+04              997.521      4.817     19.460
         TR   0.264E+27             1481.254      4.968     37.118
         TOT                        2478.7749     9.7854    56.5784   236.7240

   temp. (K)  partition function   enthalpy   heat capacity  entropy
                                   cal/mol     cal/K/mol   cal/K/mol   J/K/mol
 120.00  VIB   1.00                    0.081      0.008      0.001
         ROT   818.                  357.707      2.981     16.309
         INT   818.                  357.788      2.989     16.310
         TR   0.673E+26              596.178      4.968     32.599
         TOT                         953.9660     7.9570    48.9084   204.6329

   temp. (K)  partition function   enthalpy   heat capacity  entropy
                                   cal/mol     cal/K/mol   cal/K/mol   J/K/mol
 100.00  VIB   1.00                    0.008      0.001      0.000
         ROT   622.                  298.089      2.981     15.765
         INT   622.                  298.097      2.982     15.765
         TR   0.512E+26              496.815      4.968     31.693
         TOT                         794.9117     7.9501    47.4589   198.5682

   temp. (K)  partition function   enthalpy   heat capacity  entropy
                                   cal/mol     cal/K/mol   cal/K/mol   J/K/mol
  80.00  VIB   1.00                    0.000      0.000     -0.000
         ROT   445.                  238.471      2.981     15.100
         INT   445.                  238.471      2.981     15.100
         TR   0.367E+26              397.452      4.968     30.585
         TOT                         635.9234     7.9491    45.6856   191.1486

   temp. (K)  partition function   enthalpy   heat capacity  entropy
                                   cal/mol     cal/K/mol   cal/K/mol   J/K/mol
  60.00  VIB   1.00                    0.000      0.000     -0.000
         ROT   289.                  178.853      2.981     14.243
         INT   289.                  178.853      2.981     14.243
         TR   0.238E+26              298.089      4.968     29.157
         TOT                         476.9424     7.9490    43.3995   181.5836

   temp. (K)  partition function   enthalpy   heat capacity  entropy
                                   cal/mol     cal/K/mol   cal/K/mol   J/K/mol
  40.00  VIB   1.00                    0.000      0.000     -0.000
         ROT   157.                  119.236      2.981     13.034
         INT   157.                  119.236      2.981     13.034
         TR   0.130E+26              198.726      4.968     27.143
         TOT                         317.9616     7.9490    40.1774   168.1024

   temp. (K)  partition function   enthalpy   heat capacity  entropy
                                   cal/mol     cal/K/mol   cal/K/mol   J/K/mol
  20.00  VIB   1.00                    0.000      0.000     -0.000
         ROT   55.6                   59.618      2.981     10.968
         INT   55.6                   59.618      2.981     10.968
         TR   0.458E+25               99.363      4.968     23.701
         TOT                         158.9808     7.9490    34.6692   145.0561

   temp. (K)  partition function   enthalpy   heat capacity  entropy
                                   cal/mol     cal/K/mol   cal/K/mol   J/K/mol
  10.00  VIB   1.00                    0.000      0.000     -0.000
         ROT   19.7                   29.809      2.981      8.902
         INT   19.7                   29.809      2.981      8.902
         TR   0.162E+25               49.681      4.968     20.259
         TOT                          79.4904     7.9490    29.1610   122.0098

       T/K    H(0)-H(T)+PV         H(T)/Eh          T*S/Eh         G(T)/Eh
   ------------------------------------------------------------------------
    298.15    0.395018E-02    0.373078E-01    0.268822E-01    0.104256E-01
    120.00    0.152024E-02    0.348779E-01    0.935287E-02    0.255250E-01
    100.00    0.126677E-02    0.346244E-01    0.756306E-02    0.270613E-01
     80.00    0.101341E-02    0.343710E-01    0.582437E-02    0.285467E-01
     60.00    0.760056E-03    0.341177E-01    0.414969E-02    0.299680E-01
     40.00    0.506704E-03    0.338643E-01    0.256107E-02    0.313033E-01
     20.00    0.253352E-03    0.336110E-01    0.110498E-02    0.325060E-01
     10.00    0.126676E-03    0.334843E-01    0.464711E-03    0.330196E-01 (used)
   ------------------------------------------------------------------------

         :::::::::::::::::::::::::::::::::::::::::::::::::::::
         ::                  THERMODYNAMIC                  ::
         :::::::::::::::::::::::::::::::::::::::::::::::::::::
         :: total free energy          -8.857699279209 Eh   ::
         ::.................................................::
         :: total energy               -8.890718868030 Eh   ::
         :: zero point energy           0.033357623542 Eh   ::
         :: G(RRHO) w/o ZPVE           -0.000338034720 Eh   ::
         :: G(RRHO) contrib.            0.033019588822 Eh   ::
         :::::::::::::::::::::::::::::::::::::::::::::::::::::

optimized geometry written to: xtbopt.xyz


           -------------------------------------------------
          | TOTAL ENERGY               -8.890718868030 Eh   |
          | TOTAL ENTHALPY             -8.857234568473 Eh   |
          | TOTAL FREE ENERGY          -8.857699279209 Eh   |
          | GRADIENT NORM               0.000455624548 Eh/α |
          | HOMO-LUMO GAP               2.908621990989 eV   |
           -------------------------------------------------

------------------------------------------------------------------------
 * finished run on 2020/05/12 at 11:45:24.247     
------------------------------------------------------------------------
 total:
 * wall-time:     0 d,  0 h,  0 min,  0.100 sec
 *  cpu-time:     0 d,  0 h,  0 min,  0.100 sec
 * ratio c/w:     0.999 speedup
 SCF:
 * wall-time:     0 d,  0 h,  0 min,  0.003 sec
 *  cpu-time:     0 d,  0 h,  0 min,  0.003 sec
 * ratio c/w:     1.000 speedup
 ANC optimizer:
 * wall-time:     0 d,  0 h,  0 min,  0.019 sec
 *  cpu-time:     0 d,  0 h,  0 min,  0.019 sec
 * ratio c/w:     0.999 speedup
 numerical hessian:
 * wall-time:     0 d,  0 h,  0 min,  0.061 sec
 *  cpu-time:     0 d,  0 h,  0 min,  0.061 sec
 * ratio c/w:     0.999 speedup

