      -----------------------------------------------------------      
     |                   =====================                   |     
     |                           x T B                           |     
     |                   =====================                   |     
     |                         S. Grimme                         |     
     |          Mulliken Center for Theoretical Chemistry        |     
     |                    University of Bonn                     |     
      -----------------------------------------------------------      

   * xtb version 6.2.2 (9d81278992624c895f80dd42a50cac0aa55982e2) compiled by '@Darwin' on 04/03/2020

   xtb is free software: you can redistribute it and/or modify it under
   the terms of the GNU Lesser General Public License as published by
   the Free Software Foundation, either version 3 of the License, or
   (at your option) any later version.
   
   xtb is distributed in the hope that it will be useful,
   but WITHOUT ANY WARRANTY; without even the implied warranty of
   MERCHANTABILITY or FITNESS FOR A PARTICULAR PURPOSE.  See the
   GNU Lesser General Public License for more details.
   
   Cite this work as:
   * S. Grimme, C. Bannwarth, P. Shushkov, J. Chem. Theory Comput., 2017,
     13, 1989-2009. DOI: 10.1021/acs.jctc.7b00118
   * C. Bannwarth, S. Ehlert and S. Grimme., J. Chem. Theory Comput., 2019,
     15, 1652-1671. DOI: 10.1021/acs.jctc.8b01176
   * P. Pracht, E. Caldeweyher, S. Ehlert, S. Grimme, ChemRxiv, 2019, preprint.
     DOI: 10.26434/chemrxiv.8326202.v1
   
   for DFT-D4:
   * E. Caldeweyher, C. Bannwarth and S. Grimme, J. Chem. Phys., 2017,
     147, 034112. DOI: 10.1063/1.4993215
   * E. Caldeweyher, S. Ehlert, A. Hansen, H. Neugebauer, S. Spicher,
     C. Bannwarth and S. Grimme, J. Chem. Phys., 2019, 150, 154122.
     DOI: 10.1063/1.5090222
   
   for sTDA-xTB:
   * S. Grimme and C. Bannwarth, J. Chem. Phys., 2016, 145, 054103.
     DOI: 10.1063/1.4959605
   
   in the mass-spec context:
   * V. Asgeirsson, C. Bauer and S. Grimme, Chem. Sci., 2017, 8, 4879.
     DOI: 10.1039/c7sc00601b
   
   for metadynamics refer to:
   * S. Grimme, J. Chem. Theory Comput., 2019, 155, 2847-2862
     DOI: 10.1021/acs.jctc.9b00143
   
   with help from (in alphabetical order)
   C. Bannwarth, F. Bohle, G. Brandenburg, E. Caldeweyher, M. Checinski,
   S. Dohm, S. Ehlert, S. Ehrlich, F. März, H. Neugebauer, J. Pisarek,
   P. Pracht, P. Shushkov, and S. Spicher.
   
 * started run on 2020/05/12 at 11:44:34.196     

           -------------------------------------------------
          |                Calculation Setup                |
           -------------------------------------------------

          program call               : xtb --input C5_7_S_0.input C5_7_S_0.xyz --ohess --molden --namespace C5_7_S_0 output.out
          calculation namespace      : C5_7_S_0
          coordinate file            : C5_7_S_0.xyz
          number of atoms            :                     5
          number of electrons        :                    20
          charge                     :                     0
          spin                       :                   0.0
          first test random number   :      0.53129372903439

   ID    Z sym.   atoms
    1    6 C      1-5

           -------------------------------------------------
          |                 G F N 2 - x T B                 |
           -------------------------------------------------

        Reference                      10.1021/acs.jctc.8b01176
      * Hamiltonian:
        H0-scaling (s, p, d)           1.850000    2.230000    2.230000
        zeta-weighting                 0.500000
      * Dispersion:
        s8                             2.700000
        a1                             0.520000
        a2                             5.000000
        s9                             5.000000
      * Repulsion:
        kExp                           1.500000    1.000000
        rExp                           1.000000
      * Coulomb:
        alpha                          2.000000
        third order                    shell-resolved
        anisotropic                    true
        a3                             3.000000
        a5                             4.000000
        cn-shift                       1.200000
        cn-exp                         4.000000
        max-rad                        5.000000


          ...................................................
          :                      SETUP                      :
          :.................................................:
          :  # basis functions                  20          :
          :  # atomic orbitals                  20          :
          :  # shells                           10          :
          :  # electrons                        20          :
          :  max. iterations                   250          :
          :  Hamiltonian                  GFN2-xTB          :
          :  restarted?                      false          :
          :  GBSA solvation                  false          :
          :  PC potential                    false          :
          :  electronic temp.          300.0000000     K    :
          :  accuracy                    1.0000000          :
          :  -> integral cutoff          0.2500000E+02      :
          :  -> integral neglect         0.1000000E-07      :
          :  -> SCF convergence          0.1000000E-05 Eh   :
          :  -> wf. convergence          0.1000000E-03 e    :
          :  Broyden damping             0.4000000          :
          ...................................................

 iter      E             dE          RMSdq      gap      omega  full diag
   1    -10.1629165 -0.101629E+02  0.101E+01    0.03       0.0  T
   2     -9.5459262  0.616990E+00  0.101E+01    0.03       1.0  T
   3     -8.5556559  0.990270E+00  0.128E+01    0.21       1.0  T
   4     -9.7482414 -0.119259E+01  0.885E+00    0.19       1.0  T
   5    -10.0978969 -0.349655E+00  0.475E+00    0.10       1.0  T
   6    -10.1736125 -0.757157E-01  0.233E+00    0.02       1.0  T
   7    -10.1361095  0.375030E-01  0.294E+00    0.03       1.0  T
   8    -10.1798424 -0.437329E-01  0.175E+00    0.01       1.0  T
   9    -10.1827512 -0.290888E-02  0.130E+00    0.02       1.0  T
  10    -10.1785445  0.420669E-02  0.172E+00    0.03       1.0  T
  11    -10.1785791 -0.345258E-04  0.162E+00    0.03       1.0  T
  12    -10.1867800 -0.820090E-02  0.511E-01    0.01       1.0  T
  13    -10.1874622 -0.682206E-03  0.276E-01    0.01       1.0  T
  14    -10.1876974 -0.235222E-03  0.825E-02    0.01       1.0  T
  15    -10.1877184 -0.209789E-04  0.330E-02    0.01       1.4  T
  16    -10.1877201 -0.176380E-05  0.199E-02    0.01       2.2  T
  17    -10.1877209 -0.752438E-06  0.131E-02    0.01       3.4  T
  18    -10.1877213 -0.403225E-06  0.175E-03    0.01      25.5  T
  19    -10.1877213  0.135104E-07  0.262E-03    0.01      17.1  T
  20    -10.1877213 -0.174826E-07  0.110E-03    0.01      40.7  T
  21    -10.1877213 -0.260470E-08  0.532E-04    0.01      84.1  T
  22    -10.1877213 -0.731893E-09  0.786E-05    0.01     568.7  T

   *** convergence criteria satisfied after 22 iterations ***

         #    Occupation            Energy/Eh            Energy/eV
      -------------------------------------------------------------
         1        2.0000           -0.7047582             -19.1774
       ...           ...                  ...                  ...
         4        2.0000           -0.5721109             -15.5679
         5        2.0000           -0.5708768             -15.5343
         6        2.0000           -0.5196450             -14.1403
         7        2.0000           -0.4868520             -13.2479
         8        2.0000           -0.4495923             -12.2340
         9        2.0000           -0.4485774             -12.2064
        10        1.0701           -0.4147292             -11.2854 (HOMO)
        11        0.9299           -0.4144623             -11.2781 (LUMO)
        12        0.0000           -0.4034127             -10.9774
        13        0.0000           -0.4032391             -10.9727
        14                         -0.2842829              -7.7357
        15                         -0.2733412              -7.4380
       ...                                ...                  ...
        20                          0.1481193               4.0305
      -------------------------------------------------------------
                  HL-Gap            0.0002669 Eh            0.0073 eV
             Fermi-level           -0.4145958 Eh          -11.2817 eV

 SCC (total)                   0 d,  0 h,  0 min,  0.005 sec
 SCC setup                      ...        0 min,  0.000 sec (  1.597%)
 Dispersion                     ...        0 min,  0.000 sec (  0.435%)
 integral evaluation            ...        0 min,  0.001 sec ( 25.591%)
 zeroth order Hamiltonian       ...        0 min,  0.000 sec (  0.413%)
 iterations                     ...        0 min,  0.002 sec ( 44.081%)
 molecular gradient             ...        0 min,  0.001 sec ( 26.246%)
 printout                       ...        0 min,  0.000 sec (  1.489%)

         :::::::::::::::::::::::::::::::::::::::::::::::::::::
         ::                     SUMMARY                     ::
         :::::::::::::::::::::::::::::::::::::::::::::::::::::
         :: total energy             -10.112930008461 Eh    ::
         :: gradient norm              0.214232255291 Eh/a0 ::
         :: HOMO-LUMO gap              0.007261808389 eV    ::
         ::.................................................::
         :: SCC energy               -10.187721305521 Eh    ::
         :: -> isotropic ES           -0.013464569098 Eh    ::
         :: -> anisotropic ES         -0.000090869978 Eh    ::
         :: -> anisotropic XC          0.007828988507 Eh    ::
         :: -> dispersion             -0.003118307159 Eh    ::
         :: repulsion energy           0.074791221776 Eh    ::
         :: add. restraining           0.000000000000 Eh    ::
         :::::::::::::::::::::::::::::::::::::::::::::::::::::

      ----------------------------------------------------------- 
     |                   =====================                   |
     |                        A N C O P T                        |
     |                   =====================                   |
     |               Approximate Normal Coordinate               |
     |                Rational Function Optimizer                |
      ----------------------------------------------------------- 

          ...................................................
          :                      SETUP                      :
          :.................................................:
          :   optimization level            normal          :
          :   max. optcycles                   200          :
          :   ANC micro-cycles                  20          :
          :   degrees of freedom                 9          :
          :.................................................:
          :   RF solver                   davidson          :
          :   write xtbopt.log                true          :
          :   linear?                        false          :
          :   energy convergence         0.5000000E-05 Eh   :
          :   grad. convergence          0.1000000E-02 Eh/α :
          :   maximium RF displ.         1.0000000          :
          :   Hlow (freq-cutoff)         0.1000000E-01      :
          :   Hmax (freq-cutoff)         5.0000000          :
          :   S6 in model hess.         20.0000000          :
          ...................................................

generating ANC from model Hessian ...
Using Lindh-Hessian (1995)
 Shifting diagonal of input Hessian by    0.0000000000000000     
 Lowest  eigenvalues of input Hessian
   -0.000000   -0.000000   -0.000000    0.000000    0.000000    0.000000
    0.022046    0.031588    0.144654    0.148607    0.631184    0.794040
    0.796019    1.025948    1.027461
 Highest eigenvalues
    0.148607    0.631184    0.794040    0.796019    1.025948    1.027461


........................................................................
.............................. CYCLE    1 ..............................
........................................................................
   1    -10.1877213 -0.101877E+02  0.489E-05    0.01       0.0  T
   2    -10.1877213  0.256808E-09  0.207E-04    0.01     215.5  T
   3    -10.1877213 -0.231196E-09  0.863E-05    0.01     518.3  T
     SCC iter.                  ...        0 min,  0.001 sec
     gradient                   ...        0 min,  0.001 sec
 * total energy  :   -10.1129300 Eh     change        0.6297185E-11 Eh
   gradient norm :     0.2142324 Eh/α   predicted     0.0000000E+00 (-100.00%)
   displ. norm   :     0.4948759 α      lambda       -0.7923388E-01
   maximum displ.:     0.3977229 α      in ANC's #2, #5, #7, ...

........................................................................
.............................. CYCLE    2 ..............................
........................................................................
   1    -10.2820232 -0.102820E+02  0.273E+00    0.05       0.0  T
   2    -10.0293308  0.252692E+00  0.723E+00    0.40       1.0  T
   3    -10.2428082 -0.213477E+00  0.355E+00    0.12       1.0  T
   4    -10.2283882  0.144200E-01  0.319E+00    0.03       1.0  T
   5    -10.2616494 -0.332612E-01  0.306E+00    0.05       1.0  T
   6    -10.2653080 -0.365862E-02  0.286E+00    0.05       1.0  T
   7    -10.2792328 -0.139248E-01  0.220E+00    0.06       1.0  T
   8    -10.2936037 -0.143709E-01  0.915E-01    0.03       1.0  T
   9    -10.2959593 -0.235559E-02  0.412E-01    0.02       1.0  T
  10    -10.2962473 -0.288054E-03  0.295E-01    0.02       1.0  T
  11    -10.2964860 -0.238723E-03  0.133E-01    0.02       1.0  T
  12    -10.2965450 -0.590161E-04  0.384E-02    0.02       1.2  T
  13    -10.2965497 -0.461131E-05  0.144E-02    0.02       3.1  T
  14    -10.2965503 -0.626552E-06  0.626E-03    0.01       7.1  T
  15    -10.2965504 -0.139303E-06  0.108E-03    0.01      41.4  T
  16    -10.2965504 -0.972841E-09  0.944E-04    0.01      47.4  T
  17    -10.2965504 -0.314447E-08  0.659E-05    0.01     678.6  T
     SCC iter.                  ...        0 min,  0.002 sec
     gradient                   ...        0 min,  0.001 sec
 * total energy  :   -10.1743665 Eh     change       -0.6143646E-01 Eh
   gradient norm :     0.1175645 Eh/α   predicted    -0.4931921E-01 ( -19.72%)
   displ. norm   :     0.3813287 α      lambda       -0.4361403E-01
   maximum displ.:     0.3471756 α      in ANC's #5, #3, #2, ...

........................................................................
.............................. CYCLE    3 ..............................
........................................................................
   1    -10.3675419 -0.103675E+02  0.416E+00    0.54       0.0  T
   2     -9.9392007  0.428341E+00  0.984E+00    0.78       1.0  T
   3    -10.3857010 -0.446500E+00  0.317E+00    0.39       1.0  T
   4    -10.3990058 -0.133048E-01  0.172E+00    0.16       1.0  T
   5    -10.4110762 -0.120704E-01  0.103E+00    0.14       1.0  T
   6    -10.4149475 -0.387133E-02  0.211E-01    0.09       1.0  T
   7    -10.4147139  0.233667E-03  0.305E-01    0.10       1.0  T
   8    -10.4149433 -0.229473E-03  0.219E-01    0.10       1.0  T
   9    -10.4148137  0.129615E-03  0.297E-01    0.08       1.0  T
  10    -10.4150783 -0.264576E-03  0.932E-02    0.09       1.0  T
  11    -10.4151069 -0.285838E-04  0.700E-03    0.09       6.4  T
  12    -10.4151070 -0.106821E-06  0.394E-03    0.09      11.4  T
  13    -10.4151069  0.474351E-07  0.530E-03    0.09       8.4  T
  14    -10.4151070 -0.931459E-07  0.126E-04    0.09     353.8  T
  15    -10.4151070 -0.309743E-10  0.694E-05    0.09     644.0  T
     SCC iter.                  ...        0 min,  0.001 sec
     gradient                   ...        0 min,  0.001 sec
 * total energy  :   -10.1853377 Eh     change       -0.1097119E-01 Eh
   gradient norm :     0.1590958 Eh/α   predicted    -0.2497801E-01 ( 127.67%)
   displ. norm   :     0.5036325 α      lambda       -0.4437232E-01
   maximum displ.:     0.3764012 α      in ANC's #2, #3, #5, ...

........................................................................
.............................. CYCLE    4 ..............................
........................................................................
   1    -10.4140422 -0.104140E+02  0.317E+00    1.30       0.0  T
   2    -10.4085516  0.549063E-02  0.204E+00    1.30       1.0  T
   3    -10.3621079  0.464437E-01  0.264E+00    1.24       1.0  T
   4    -10.4159577 -0.538498E-01  0.256E-01    1.35       1.0  T
   5    -10.4163556 -0.397962E-03  0.992E-02    1.31       1.0  T
   6    -10.4163599 -0.430036E-05  0.467E-02    1.31       1.0  T
   7    -10.4163609 -0.927324E-06  0.103E-02    1.31       4.4  T
   8    -10.4163616 -0.760094E-06  0.443E-03    1.31      10.1  T
   9    -10.4163617 -0.619691E-07  0.336E-04    1.31     133.0  T
  10    -10.4163617 -0.105828E-09  0.216E-04    1.31     206.9  T
     SCC iter.                  ...        0 min,  0.001 sec
     gradient                   ...        0 min,  0.001 sec
 * total energy  :   -10.2284511 Eh     change       -0.4311342E-01 Eh
   gradient norm :     0.0868455 Eh/α   predicted    -0.2781359E-01 ( -35.49%)
   displ. norm   :     0.7319189 α      lambda       -0.5416243E-01
   maximum displ.:     0.7242674 α      in ANC's #3, #2, #5, ...

........................................................................
.............................. CYCLE    5 ..............................
........................................................................
   1    -10.3631294 -0.103631E+02  0.583E+00    1.59       0.0  T
   2    -10.3321655  0.309640E-01  0.391E+00    0.97       1.0  T
   3    -10.3549665 -0.228010E-01  0.350E+00    1.62       1.0  T
   4    -10.3970414 -0.420749E-01  0.439E-01    1.48       1.0  T
   5    -10.3974268 -0.385432E-03  0.297E-01    1.46       1.0  T
   6    -10.3974110  0.158373E-04  0.163E-01    1.45       1.0  T
   7    -10.3973529  0.580277E-04  0.160E-01    1.44       1.0  T
   8    -10.3976071 -0.254153E-03  0.136E-02    1.44       3.3  T
   9    -10.3976073 -0.176824E-06  0.265E-03    1.44      16.8  T
  10    -10.3976073 -0.586790E-08  0.583E-04    1.44      76.8  T
  11    -10.3976073 -0.158234E-08  0.241E-04    1.44     185.5  T
     SCC iter.                  ...        0 min,  0.001 sec
     gradient                   ...        0 min,  0.002 sec
 * total energy  :   -10.2249475 Eh     change        0.3503602E-02 Eh
   gradient norm :     0.1321546 Eh/α   predicted    -0.4158874E-01 (*******%)
   displ. norm   :     0.3972485 α      lambda       -0.4612481E-01
   maximum displ.:     0.3313184 α      in ANC's #3, #2, #5, ...

........................................................................
.............................. CYCLE    6 ..............................
........................................................................
   1    -10.3937740 -0.103938E+02  0.336E+00    1.61       0.0  T
   2    -10.3862704  0.750361E-02  0.208E+00    1.37       1.0  T
   3    -10.3816855  0.458487E-02  0.212E+00    1.60       1.0  T
   4    -10.4013147 -0.196291E-01  0.453E-01    1.50       1.0  T
   5    -10.4025337 -0.121903E-02  0.111E-01    1.50       1.0  T
   6    -10.4025308  0.289954E-05  0.687E-02    1.50       1.0  T
   7    -10.4024608  0.700098E-04  0.960E-02    1.50       1.0  T
   8    -10.4025489 -0.881117E-04  0.762E-03    1.50       5.9  T
   9    -10.4025489 -0.472152E-07  0.137E-03    1.50      32.6  T
  10    -10.4025489 -0.695097E-08  0.521E-04    1.50      85.8  T
  11    -10.4025489 -0.142493E-08  0.128E-04    1.50     349.0  T
     SCC iter.                  ...        0 min,  0.001 sec
     gradient                   ...        0 min,  0.001 sec
 * total energy  :   -10.2447890 Eh     change       -0.1984157E-01 Eh
   gradient norm :     0.0414978 Eh/α   predicted    -0.2670179E-01 (  34.57%)
   displ. norm   :     0.0713811 α      lambda       -0.2196743E-02
   maximum displ.:     0.0480855 α      in ANC's #5, #2, #3, ...

........................................................................
.............................. CYCLE    7 ..............................
........................................................................
   1    -10.4154456 -0.104154E+02  0.382E-01    1.59       0.0  T
   2    -10.4153795  0.661205E-04  0.317E-01    1.57       1.0  T
   3    -10.4157345 -0.355049E-03  0.153E-01    1.58       1.0  T
   4    -10.4157454 -0.109041E-04  0.479E-02    1.58       1.0  T
   5    -10.4157597 -0.143150E-04  0.160E-02    1.57       2.8  T
   6    -10.4157586  0.108484E-05  0.118E-02    1.57       3.8  T
   7    -10.4157599 -0.124347E-05  0.286E-03    1.57      15.6  T
   8    -10.4157599 -0.629002E-07  0.786E-04    1.57      56.9  T
   9    -10.4157599 -0.637161E-10  0.524E-04    1.57      85.3  T
     SCC iter.                  ...        0 min,  0.001 sec
     gradient                   ...        0 min,  0.001 sec
 * total energy  :   -10.2459286 Eh     change       -0.1139564E-02 Eh
   gradient norm :     0.0155091 Eh/α   predicted    -0.1103967E-02 (  -3.12%)
   displ. norm   :     0.0870868 α      lambda       -0.1019063E-02
   maximum displ.:     0.0754368 α      in ANC's #2, #7, #3, ...

........................................................................
.............................. CYCLE    8 ..............................
........................................................................
   1    -10.4209837 -0.104210E+02  0.392E-01    1.47       0.0  T
   2    -10.4209593  0.244323E-04  0.252E-01    1.48       1.0  T
   3    -10.4205789  0.380412E-03  0.234E-01    1.46       1.0  T
   4    -10.4210063 -0.427364E-03  0.329E-02    1.48       1.4  T
   5    -10.4210123 -0.603873E-05  0.146E-02    1.48       3.1  T
   6    -10.4210134 -0.111675E-05  0.843E-03    1.48       5.3  T
   7    -10.4210138 -0.363622E-06  0.796E-04    1.48      56.2  T
   8    -10.4210138 -0.159153E-08  0.398E-04    1.48     112.2  T
     SCC iter.                  ...        0 min,  0.001 sec
     gradient                   ...        0 min,  0.001 sec
 * total energy  :   -10.2464596 Eh     change       -0.5309648E-03 Eh
   gradient norm :     0.0110335 Eh/α   predicted    -0.5133947E-03 (  -3.31%)
   displ. norm   :     0.0343211 α      lambda       -0.2483453E-03
   maximum displ.:     0.0221908 α      in ANC's #1, #3, #7, ...

........................................................................
.............................. CYCLE    9 ..............................
........................................................................
   1    -10.4181107 -0.104181E+02  0.209E-01    1.48       0.0  T
   2    -10.4180627  0.480152E-04  0.156E-01    1.50       1.0  T
   3    -10.4181037 -0.410001E-04  0.119E-01    1.48       1.0  T
   4    -10.4181519 -0.482671E-04  0.396E-02    1.49       1.1  T
   5    -10.4181613 -0.940925E-05  0.163E-02    1.49       2.7  T
   6    -10.4181632 -0.183257E-05  0.617E-03    1.49       7.2  T
   7    -10.4181632 -0.392823E-07  0.712E-04    1.49      62.8  T
   8    -10.4181632 -0.117085E-08  0.322E-04    1.49     139.0  T
     SCC iter.                  ...        0 min,  0.001 sec
     gradient                   ...        0 min,  0.001 sec
 * total energy  :   -10.2465889 Eh     change       -0.1293159E-03 Eh
   gradient norm :     0.0043521 Eh/α   predicted    -0.1243197E-03 (  -3.86%)
   displ. norm   :     0.0544957 α      lambda       -0.1192870E-03
   maximum displ.:     0.0510816 α      in ANC's #1, #2, #9, ...

........................................................................
.............................. CYCLE   10 ..............................
........................................................................
   1    -10.4159517 -0.104160E+02  0.289E-01    1.51       0.0  T
   2    -10.4159227  0.290079E-04  0.191E-01    1.51       1.0  T
   3    -10.4159484 -0.256896E-04  0.159E-01    1.51       1.0  T
   4    -10.4159493 -0.924825E-06  0.952E-02    1.51       1.0  T
   5    -10.4160310 -0.816475E-04  0.270E-02    1.51       1.7  T
   6    -10.4160356 -0.461096E-05  0.119E-02    1.51       3.7  T
   7    -10.4160360 -0.409314E-06  0.175E-03    1.51      25.6  T
   8    -10.4160360 -0.938506E-08  0.848E-04    1.51      52.7  T
   9    -10.4160360 -0.349045E-08  0.343E-04    1.51     130.2  T
     SCC iter.                  ...        0 min,  0.001 sec
     gradient                   ...        0 min,  0.001 sec
 * total energy  :   -10.2465369 Eh     change        0.5198690E-04 Eh
   gradient norm :     0.0070307 Eh/α   predicted    -0.5982034E-04 (-215.07%)
   displ. norm   :     0.0368708 α      lambda       -0.1538360E-03
   maximum displ.:     0.0350517 α      in ANC's #1, #3, #7, ...

........................................................................
.............................. CYCLE   11 ..............................
........................................................................
   1    -10.4174198 -0.104174E+02  0.192E-01    1.51       0.0  T
   2    -10.4174040  0.157964E-04  0.130E-01    1.50       1.0  T
   3    -10.4174208 -0.167087E-04  0.106E-01    1.51       1.0  T
   4    -10.4174077  0.130369E-04  0.743E-02    1.50       1.0  T
   5    -10.4174580 -0.502619E-04  0.193E-02    1.50       2.3  T
   6    -10.4174604 -0.239401E-05  0.831E-03    1.50       5.4  T
   7    -10.4174606 -0.220256E-06  0.745E-04    1.50      60.1  T
   8    -10.4174606 -0.157924E-08  0.286E-04    1.50     156.5  T
     SCC iter.                  ...        0 min,  0.001 sec
     gradient                   ...        0 min,  0.001 sec
 * total energy  :   -10.2466149 Eh     change       -0.7800589E-04 Eh
   gradient norm :     0.0011017 Eh/α   predicted    -0.7702231E-04 (  -1.26%)
   displ. norm   :     0.0020984 α      lambda       -0.1431580E-05
   maximum displ.:     0.0015990 α      in ANC's #9, #7, #1, ...

........................................................................
.............................. CYCLE   12 ..............................
........................................................................
   1    -10.4174704 -0.104175E+02  0.209E-02    1.51       0.0  T
   2    -10.4174703  0.186231E-06  0.139E-02    1.51       3.2  T
   3    -10.4174694  0.839070E-06  0.130E-02    1.51       3.4  T
   4    -10.4174706 -0.119000E-05  0.177E-03    1.51      25.2  T
   5    -10.4174706 -0.129902E-07  0.822E-04    1.51      54.4  T
   6    -10.4174706  0.503377E-08  0.915E-04    1.51      48.9  T
     SCC iter.                  ...        0 min,  0.001 sec
     gradient                   ...        0 min,  0.001 sec
 * total energy  :   -10.2466161 Eh     change       -0.1208913E-05 Eh
   gradient norm :     0.0001760 Eh/α   predicted    -0.7177227E-06 ( -40.63%)
   displ. norm   :     0.0008393 α      lambda       -0.6901260E-07
   maximum displ.:     0.0006805 α      in ANC's #1, #9, #7, ...

   *** GEOMETRY OPTIMIZATION CONVERGED AFTER 12 ITERATIONS ***

------------------------------------------------------------------------
 total energy gain   :        -0.1336861 Eh      -83.8893 kcal/mol
 total RMSD          :         0.5864671 a0        0.3103 Å
 total power (kW/mol):       -29.2494034 (step)-7365.9359 (real)
------------------------------------------------------------------------

 ANCopt (total)                0 d,  0 h,  0 min,  0.048 sec
 optimizer setup                ...        0 min,  0.000 sec (  0.129%)
 model hessian                  ...        0 min,  0.000 sec (  0.202%)
 ANC generation                 ...        0 min,  0.000 sec (  0.155%)
 coordinate transformation      ...        0 min,  0.000 sec (  0.052%)
 single point calculation       ...        0 min,  0.046 sec ( 97.401%)
 optimization log               ...        0 min,  0.000 sec (  0.600%)
 hessian update                 ...        0 min,  0.000 sec (  0.059%)
 rational function              ...        0 min,  0.000 sec (  0.606%)

================
 final structure:
================
5
 xtb: 6.2.2 (9d81278992624c895f80dd42a50cac0aa55982e2)
C        -0.81415971263498    0.53347306472106   -0.34167501837851
C         0.25017982197283    1.29745304491534    0.22663722243449
C         0.80830646956789    0.06877677743261   -0.00669238917445
C        -0.70639718840751   -0.66280827795977    0.35443695674212
C         0.46207060950177   -1.23689460910924   -0.23270677162366

 Bond Distances (Angstroems)
 ---------------------------
C1-C2=1.4281         C1-C3=1.7206         C1-C4=1.3883         C2-C1=1.4281         C2-C3=1.3695         C3-C1=1.7206         
C3-C2=1.3695         C3-C4=1.7205         C3-C5=1.3696         C4-C1=1.3883         C4-C3=1.7205         C4-C5=1.4282         
C5-C3=1.3696         C5-C4=1.4282         
 C  C  Rav=1.4892 sigma=0.1480  Rmin=1.3695  Rmax=1.7206     7

 selected bond angles (degree)
 --------------------
C3-C1-C2= 50.52                C4-C1-C2=101.75                C4-C1-C3= 66.20                C3-C2-C1= 75.88                
C2-C3-C1= 53.60                C4-C3-C1= 47.59                C4-C3-C2= 89.25                C5-C3-C1= 89.25                
C5-C3-C2=141.30                C5-C3-C4= 53.61                C3-C4-C1= 66.21                C5-C4-C1=101.76                
C5-C4-C3= 50.53                C4-C5-C3= 75.86                

 selected dihedral angles (degree)
 ---------------------------------
C3-C2-C1-C4= 45.15            C2-C3-C1-C4=229.34            C4-C3-C1-C2=130.66            C5-C3-C1-C2=168.30            
C5-C3-C1-C4= 37.65            C4-C3-C2-C1=325.94            C5-C3-C2-C1=341.09            C3-C4-C1-C2=323.27            
C5-C4-C1-C2=286.52            C5-C4-C1-C3=323.26            C1-C4-C3-C2= 37.64            C1-C4-C3-C5=229.35            
C5-C4-C3-C1=130.65            C5-C4-C3-C2=168.29            C4-C5-C3-C1=325.93            C4-C5-C3-C2=341.05            
C3-C5-C4-C1= 45.17            
           -------------------------------------------------
          |                Final Singlepoint                |
           -------------------------------------------------

          ...................................................
          :                      SETUP                      :
          :.................................................:
          :  # basis functions                  20          :
          :  # atomic orbitals                  20          :
          :  # shells                           10          :
          :  # electrons                        20          :
          :  max. iterations                   250          :
          :  Hamiltonian                  GFN2-xTB          :
          :  restarted?                      false          :
          :  GBSA solvation                  false          :
          :  PC potential                    false          :
          :  electronic temp.          300.0000000     K    :
          :  accuracy                    1.0000000          :
          :  -> integral cutoff          0.2500000E+02      :
          :  -> integral neglect         0.1000000E-07      :
          :  -> SCF convergence          0.1000000E-05 Eh   :
          :  -> wf. convergence          0.1000000E-03 e    :
          :  Broyden damping             0.4000000          :
          ...................................................

 iter      E             dE          RMSdq      gap      omega  full diag
   1    -10.4174706 -0.104175E+02  0.380E-04    1.51       0.0  T
   2    -10.4174706 -0.646594E-12  0.231E-04    1.51     193.9  T
   3    -10.4174706  0.550990E-10  0.939E-05    1.51     476.4  T

   *** convergence criteria satisfied after 3 iterations ***

         #    Occupation            Energy/Eh            Energy/eV
      -------------------------------------------------------------
         1        2.0000           -0.7519881             -20.4626
       ...           ...                  ...                  ...
         4        2.0000           -0.5825439             -15.8518
         5        2.0000           -0.5621375             -15.2965
         6        2.0000           -0.5531603             -15.0523
         7        2.0000           -0.5012037             -13.6384
         8        2.0000           -0.4637019             -12.6180
         9        2.0000           -0.4517624             -12.2931
        10        2.0000           -0.4329989             -11.7825 (HOMO)
        11                         -0.3776586             -10.2766 (LUMO)
        12                         -0.3207059              -8.7269
        13                         -0.3121929              -8.4952
        14                         -0.2455733              -6.6824
        15                         -0.2228100              -6.0630
       ...                                ...                  ...
        20                          0.6097870              16.5931
      -------------------------------------------------------------
                  HL-Gap            0.0553403 Eh            1.5059 eV
             Fermi-level           -0.4053287 Eh          -11.0296 eV

 SCC (total)                   0 d,  0 h,  0 min,  0.004 sec
 SCC setup                      ...        0 min,  0.000 sec (  1.451%)
 Dispersion                     ...        0 min,  0.000 sec (  0.403%)
 integral evaluation            ...        0 min,  0.001 sec ( 36.588%)
 zeroth order Hamiltonian       ...        0 min,  0.000 sec (  0.410%)
 iterations                     ...        0 min,  0.001 sec ( 17.383%)
 molecular gradient             ...        0 min,  0.001 sec ( 39.900%)
 printout                       ...        0 min,  0.000 sec (  3.546%)

         :::::::::::::::::::::::::::::::::::::::::::::::::::::
         ::                     SUMMARY                     ::
         :::::::::::::::::::::::::::::::::::::::::::::::::::::
         :: total energy             -10.246616128473 Eh    ::
         :: gradient norm              0.000180064999 Eh/a0 ::
         :: HOMO-LUMO gap              1.505886623567 eV    ::
         ::.................................................::
         :: SCC energy               -10.417470622944 Eh    ::
         :: -> isotropic ES           -0.009605513139 Eh    ::
         :: -> anisotropic ES          0.002435003876 Eh    ::
         :: -> anisotropic XC          0.008752462696 Eh    ::
         :: -> dispersion             -0.002777112831 Eh    ::
         :: repulsion energy           0.170854468624 Eh    ::
         :: add. restraining           0.000000000000 Eh    ::
         :::::::::::::::::::::::::::::::::::::::::::::::::::::

           ------------------------------------------------- 
          |                Numerical Hessian                |
           ------------------------------------------------- 
step length          :   0.00500
SCC accuracy         :   0.30000
Hessian scale factor :   1.00000
frozen atoms in %    :   0.00000    0
RMS gradient         :   0.00018
estimated CPU  time      0.00 min
estimated wall time      0.00 min

writing file <hessian>.

 projected vibrational frequencies (cm-1)
eigval :       -0.00    -0.00    -0.00     0.00     0.00     0.00
eigval :       46.70   501.46   538.24   660.30   884.56   931.00
eigval :     1116.83  1313.17  1521.10
           -------------------------------------------------
          |                Property Printout                |
           -------------------------------------------------

    * Orbital Energies and Occupations

         #    Occupation            Energy/Eh            Energy/eV
      -------------------------------------------------------------
         1        2.0000           -0.7519882             -20.4626
         2        2.0000           -0.6842827             -18.6203
         3        2.0000           -0.6435360             -17.5115
         4        2.0000           -0.5825440             -15.8518
         5        2.0000           -0.5621375             -15.2965
         6        2.0000           -0.5531603             -15.0523
         7        2.0000           -0.5012037             -13.6384
         8        2.0000           -0.4637018             -12.6180
         9        2.0000           -0.4517625             -12.2931
        10        2.0000           -0.4329988             -11.7825 (HOMO)
        11                         -0.3776585             -10.2766 (LUMO)
        12                         -0.3207059              -8.7269
        13                         -0.3121929              -8.4952
        14                         -0.2455734              -6.6824
        15                         -0.2228101              -6.0630
        16                          0.0882188               2.4006
        17                          0.1519189               4.1339
        18                          0.3111191               8.4660
        19                          0.3183463               8.6626
        20                          0.6097869              16.5931
      -------------------------------------------------------------
                  HL-Gap            0.0553403 Eh            1.5059 eV
             Fermi-level           -0.4053287 Eh          -11.0296 eV

     #   Z        covCN         q      C6AA      α(0)
     1   6 C      3.033     0.016    27.630     8.622
     2   6 C      2.121    -0.071    32.731     9.246
     3   6 C      3.787     0.111    18.784     6.173
     4   6 C      3.033     0.016    27.629     8.622
     5   6 C      2.121    -0.071    32.733     9.246

 Mol. C6AA /au·bohr⁶  :        690.025764
 Mol. C8AA /au·bohr⁸  :      19956.744192
 Mol. α(0) /au        :         41.908118


Wiberg/Mayer (AO) data.
largest (>0.10) Wiberg bond orders for each atom
          total WBO             WBO to atom ...
     1  C   3.333        C    4 1.355    C    2 1.121    C    3 0.499    C    5 0.356
     2  C   3.078        C    3 1.383    C    1 1.121    C    4 0.356    C    5 0.218
     3  C   3.764        C    2 1.383    C    5 1.383    C    4 0.500    C    1 0.499
     4  C   3.333        C    1 1.355    C    5 1.121    C    3 0.500    C    2 0.356
     5  C   3.078        C    3 1.383    C    4 1.121    C    1 0.356    C    2 0.218

MOs/occ written to file <molden.input>


molecular dipole:
                 x           y           z       tot (Debye)
 q only:        0.028       0.002      -0.000
   full:        0.231       0.020      -0.002       0.589
molecular quadrupole (traceless):
                xx          xy          yy          xz          yz          zz
 q only:        0.645       0.130      -0.891       0.018      -0.256       0.246
  q+dip:        0.958       0.267      -2.256       0.084      -0.950       1.298
   full:        1.689       0.484      -4.100       0.129      -1.447       2.411

           -------------------------------------------------
          |                Geometry Summary                 |
           -------------------------------------------------

      molecular mass/u    :       60.0536795
   center of mass at/Å    :        0.0000000       0.0000000      -0.0000000
  moments of inertia/u·Å² :        0.2904569E+02   0.5168272E+02   0.7255673E+02
rotational constants/cm⁻¹ :        0.5803833E+00   0.3261754E+00   0.2323373E+00

 * 3 selected distances

     #   Z        #   Z                                     value/Å
     2   6 C      3   6 C                                 1.3695231 (min)
     1   6 C      4   6 C                                 1.3882628 (max)
     3   6 C      5   6 C                                 1.3695764

 * 1 distinct bonds (by element types)

   Z      Z             #   av. dist./Å        max./Å        min./Å
   6 C    6 C           3     1.3757874     1.3882628     1.3695231

           -------------------------------------------------
          |               Frequency Printout                |
           -------------------------------------------------
 projected vibrational frequencies (cm-1)
eigval :       -0.00    -0.00    -0.00     0.00     0.00     0.00
eigval :       46.70   501.46   538.24   660.30   884.56   931.00
eigval :     1116.83  1313.17  1521.10
 reduced masses (amu)
   1: 12.01   2: 12.01   3: 12.01   4: 12.01   5: 12.01   6: 12.01   7: 12.01   8: 12.01
   9: 12.01  10: 12.01  11: 12.01  12: 12.01  13: 12.01  14: 12.01  15: 12.01
 IR intensities (amu)
   1:  0.04   2:  0.03   3:  0.02   4:  0.05   5:  0.02   6:  0.04   7:  0.85   8:  0.24
   9:  0.36  10:  0.43  11:  1.68  12:  0.21  13:  1.01  14:  0.20  15:  0.84
 Raman intensities (amu)
   1:  0.00   2:  0.00   3:  0.00   4:  0.00   5:  0.00   6:  0.00   7:  0.00   8:  0.00
   9:  0.00  10:  0.00  11:  0.00  12:  0.00  13:  0.00  14:  0.00  15:  0.00
 output can be read by thermo (or use thermo option).
Molecule has the following symmetry elements: (C2) 
It seems to be the C2 point group
 writing <g98.out> molden fake output.
 recommended (thermochemical) frequency scaling factor: 1.0
           -------------------------------------------------
          |             Thermodynamic Functions             |
           -------------------------------------------------

c2  symmetry found (for desy threshold:  0.10E+00) used in thermo

          ...................................................
          :                      SETUP                      :
          :.................................................:
          :  # frequencies                           9      :
          :  # imaginary freq.                       0      :
          :  linear?                             false      :
          :  only rotor calc.                    false      :
          :  symmetry                               c2      :
          :  rotational number                       2      :
          :  scaling factor                  1.0000000      :
          :  rotor cutoff                   50.0000000 cm⁻¹ :
          :  imag. cutoff                  -20.0000000 cm⁻¹ :
          :.................................................:

    mode    ω/cm⁻¹     T·S(HO)/kcal·mol⁻¹    T·S(FR)/kcal·mol⁻¹   T·S(vib)
   ------------------------------------------------------------------------
       1     46.70    -0.00019 ( 43.21%)    -0.00231 ( 56.79%)    -0.00139
   ------------------------------------------------------------------------

   temp. (K)  partition function   enthalpy   heat capacity  entropy
                                   cal/mol     cal/K/mol   cal/K/mol   J/K/mol
 298.15  VIB   6.33                  963.564      6.756      6.134
         ROT  0.126E+05              888.752      2.981     21.744
         INT  0.798E+05             1852.317      9.737     27.879
         TR   0.450E+27             1481.254      4.968     38.181
         TOT                        3333.5705    14.7051    66.0594   276.3927

   temp. (K)  partition function   enthalpy   heat capacity  entropy
                                   cal/mol     cal/K/mol   cal/K/mol   J/K/mol
 120.00  VIB   2.34                  184.652      2.299      2.966
         ROT  0.322E+04              357.707      2.981     19.031
         INT  0.754E+04              542.359      5.280     21.998
         TR   0.115E+27              596.178      4.968     33.661
         TOT                        1138.5370    10.2478    55.6593   232.8785

   temp. (K)  partition function   enthalpy   heat capacity  entropy
                                   cal/mol     cal/K/mol   cal/K/mol   J/K/mol
 100.00  VIB   2.05                  141.264      2.057      2.668
         ROT  0.245E+04              298.089      2.981     18.488
         INT  0.501E+04              439.353      5.038     21.156
         TR   0.875E+26              496.815      4.968     32.756
         TOT                         936.1682    10.0061    53.9121   225.5682

   temp. (K)  partition function   enthalpy   heat capacity  entropy
                                   cal/mol     cal/K/mol   cal/K/mol   J/K/mol
  80.00  VIB   1.76                  101.743      1.908      2.342
         ROT  0.175E+04              238.471      2.981     17.823
         INT  0.308E+04              340.214      4.889     20.165
         TR   0.626E+26              397.452      4.968     31.648
         TOT                         737.6664     9.8568    51.8128   216.7847

   temp. (K)  partition function   enthalpy   heat capacity  entropy
                                   cal/mol     cal/K/mol   cal/K/mol   J/K/mol
  60.00  VIB   1.48                   64.697      1.795      1.948
         ROT  0.114E+04              178.853      2.981     16.965
         INT  0.169E+04              243.550      4.776     18.913
         TR   0.406E+26              298.089      4.968     30.219
         TOT                         541.6394     9.7437    49.1323   205.5695

   temp. (K)  partition function   enthalpy   heat capacity  entropy
                                   cal/mol     cal/K/mol   cal/K/mol   J/K/mol
  40.00  VIB   1.23                   30.598      1.579      1.421
         ROT   619.                  119.236      2.981     15.757
         INT   761.                  149.833      4.560     17.178
         TR   0.221E+26              198.726      4.968     28.206
         TOT                         348.5593     9.5283    45.3837   189.8856

   temp. (K)  partition function   enthalpy   heat capacity  entropy
                                   cal/mol     cal/K/mol   cal/K/mol   J/K/mol
  20.00  VIB   1.04                    4.808      0.837      0.656
         ROT   219.                   59.618      2.981     13.690
         INT   227.                   64.426      3.818     14.347
         TR   0.782E+25               99.363      4.968     24.764
         TOT                         163.7891     8.7857    39.1108   163.6397

   temp. (K)  partition function   enthalpy   heat capacity  entropy
                                   cal/mol     cal/K/mol   cal/K/mol   J/K/mol
  10.00  VIB   1.00                    0.162      0.109      0.139
         ROT   77.4                   29.809      2.981     11.624
         INT   77.5                   29.970      3.090     11.763
         TR   0.277E+25               49.681      4.968     21.322
         TOT                          79.6519     8.0577    33.0851   138.4281

       T/K    H(0)-H(T)+PV         H(T)/Eh          T*S/Eh         G(T)/Eh
   ------------------------------------------------------------------------
    298.15    0.531238E-02    0.224290E-01    0.313870E-01   -0.895793E-02
    120.00    0.181437E-02    0.189310E-01    0.106438E-01    0.828718E-02
    100.00    0.149188E-02    0.186085E-01    0.859144E-02    0.100171E-01
     80.00    0.117555E-02    0.182922E-01    0.660552E-02    0.116867E-01
     60.00    0.863157E-03    0.179798E-01    0.469784E-02    0.132820E-01
     40.00    0.555465E-03    0.176721E-01    0.289294E-02    0.147792E-01
     20.00    0.261015E-03    0.173777E-01    0.124654E-02    0.161311E-01
     10.00    0.126933E-03    0.172436E-01    0.527245E-03    0.167163E-01 (used)
   ------------------------------------------------------------------------

         :::::::::::::::::::::::::::::::::::::::::::::::::::::
         ::                  THERMODYNAMIC                  ::
         :::::::::::::::::::::::::::::::::::::::::::::::::::::
         :: total free energy         -10.229899786795 Eh   ::
         ::.................................................::
         :: total energy              -10.246616128992 Eh   ::
         :: zero point energy           0.017116653587 Eh   ::
         :: G(RRHO) w/o ZPVE           -0.000400311390 Eh   ::
         :: G(RRHO) contrib.            0.016716342197 Eh   ::
         :::::::::::::::::::::::::::::::::::::::::::::::::::::

optimized geometry written to: xtbopt.xyz


           -------------------------------------------------
          | TOTAL ENERGY              -10.246616128992 Eh   |
          | TOTAL ENTHALPY            -10.229372541978 Eh   |
          | TOTAL FREE ENERGY         -10.229899786795 Eh   |
          | GRADIENT NORM               0.000180282113 Eh/α |
          | HOMO-LUMO GAP               1.505885578695 eV   |
           -------------------------------------------------

------------------------------------------------------------------------
 * finished run on 2020/05/12 at 11:44:34.380     
------------------------------------------------------------------------
 total:
 * wall-time:     0 d,  0 h,  0 min,  0.183 sec
 *  cpu-time:     0 d,  0 h,  0 min,  0.183 sec
 * ratio c/w:     0.999 speedup
 SCF:
 * wall-time:     0 d,  0 h,  0 min,  0.005 sec
 *  cpu-time:     0 d,  0 h,  0 min,  0.005 sec
 * ratio c/w:     1.000 speedup
 ANC optimizer:
 * wall-time:     0 d,  0 h,  0 min,  0.052 sec
 *  cpu-time:     0 d,  0 h,  0 min,  0.052 sec
 * ratio c/w:     0.999 speedup
 numerical hessian:
 * wall-time:     0 d,  0 h,  0 min,  0.109 sec
 *  cpu-time:     0 d,  0 h,  0 min,  0.109 sec
 * ratio c/w:     0.999 speedup

