      -----------------------------------------------------------      
     |                   =====================                   |     
     |                           x T B                           |     
     |                   =====================                   |     
     |                         S. Grimme                         |     
     |          Mulliken Center for Theoretical Chemistry        |     
     |                    University of Bonn                     |     
      -----------------------------------------------------------      

   * xtb version 6.2.2 (9d81278992624c895f80dd42a50cac0aa55982e2) compiled by '@Darwin' on 04/03/2020

   xtb is free software: you can redistribute it and/or modify it under
   the terms of the GNU Lesser General Public License as published by
   the Free Software Foundation, either version 3 of the License, or
   (at your option) any later version.
   
   xtb is distributed in the hope that it will be useful,
   but WITHOUT ANY WARRANTY; without even the implied warranty of
   MERCHANTABILITY or FITNESS FOR A PARTICULAR PURPOSE.  See the
   GNU Lesser General Public License for more details.
   
   Cite this work as:
   * S. Grimme, C. Bannwarth, P. Shushkov, J. Chem. Theory Comput., 2017,
     13, 1989-2009. DOI: 10.1021/acs.jctc.7b00118
   * C. Bannwarth, S. Ehlert and S. Grimme., J. Chem. Theory Comput., 2019,
     15, 1652-1671. DOI: 10.1021/acs.jctc.8b01176
   * P. Pracht, E. Caldeweyher, S. Ehlert, S. Grimme, ChemRxiv, 2019, preprint.
     DOI: 10.26434/chemrxiv.8326202.v1
   
   for DFT-D4:
   * E. Caldeweyher, C. Bannwarth and S. Grimme, J. Chem. Phys., 2017,
     147, 034112. DOI: 10.1063/1.4993215
   * E. Caldeweyher, S. Ehlert, A. Hansen, H. Neugebauer, S. Spicher,
     C. Bannwarth and S. Grimme, J. Chem. Phys., 2019, 150, 154122.
     DOI: 10.1063/1.5090222
   
   for sTDA-xTB:
   * S. Grimme and C. Bannwarth, J. Chem. Phys., 2016, 145, 054103.
     DOI: 10.1063/1.4959605
   
   in the mass-spec context:
   * V. Asgeirsson, C. Bauer and S. Grimme, Chem. Sci., 2017, 8, 4879.
     DOI: 10.1039/c7sc00601b
   
   for metadynamics refer to:
   * S. Grimme, J. Chem. Theory Comput., 2019, 155, 2847-2862
     DOI: 10.1021/acs.jctc.9b00143
   
   with help from (in alphabetical order)
   C. Bannwarth, F. Bohle, G. Brandenburg, E. Caldeweyher, M. Checinski,
   S. Dohm, S. Ehlert, S. Ehrlich, F. März, H. Neugebauer, J. Pisarek,
   P. Pracht, P. Shushkov, and S. Spicher.
   
 * started run on 2020/05/12 at 11:45:03.170     

           -------------------------------------------------
          |                Calculation Setup                |
           -------------------------------------------------

          program call               : xtb --input H1C3N1_33_S_2.input H1C3N1_33_S_2.xyz --ohess --molden --namespace H1C3N1_33_S_2 output.out
          calculation namespace      : H1C3N1_33_S_2
          coordinate file            : H1C3N1_33_S_2.xyz
          number of atoms            :                     5
          number of electrons        :                    18
          charge                     :                     0
          spin                       :                   1.0
          first test random number   :      0.69534801071384

   ID    Z sym.   atoms
    1    6 C      1-3
    2    7 N      4
    3    1 H      5

           -------------------------------------------------
          |                 G F N 2 - x T B                 |
           -------------------------------------------------

        Reference                      10.1021/acs.jctc.8b01176
      * Hamiltonian:
        H0-scaling (s, p, d)           1.850000    2.230000    2.230000
        zeta-weighting                 0.500000
      * Dispersion:
        s8                             2.700000
        a1                             0.520000
        a2                             5.000000
        s9                             5.000000
      * Repulsion:
        kExp                           1.500000    1.000000
        rExp                           1.000000
      * Coulomb:
        alpha                          2.000000
        third order                    shell-resolved
        anisotropic                    true
        a3                             3.000000
        a5                             4.000000
        cn-shift                       1.200000
        cn-exp                         4.000000
        max-rad                        5.000000


          ...................................................
          :                      SETUP                      :
          :.................................................:
          :  # basis functions                  17          :
          :  # atomic orbitals                  17          :
          :  # shells                            9          :
          :  # electrons                        18          :
          :  max. iterations                   250          :
          :  Hamiltonian                  GFN2-xTB          :
          :  restarted?                      false          :
          :  GBSA solvation                  false          :
          :  PC potential                    false          :
          :  electronic temp.          300.0000000     K    :
          :  accuracy                    1.0000000          :
          :  -> integral cutoff          0.2500000E+02      :
          :  -> integral neglect         0.1000000E-07      :
          :  -> SCF convergence          0.1000000E-05 Eh   :
          :  -> wf. convergence          0.1000000E-03 e    :
          :  Broyden damping             0.4000000          :
          ...................................................

 iter      E             dE          RMSdq      gap      omega  full diag
   1     -9.4762689 -0.947627E+01  0.514E+00    6.57       0.0  T
   2     -9.4219379  0.543309E-01  0.551E+00    5.82       1.0  T
   3     -9.4605399 -0.386020E-01  0.407E+00    6.22       1.0  T
   4     -9.4810360 -0.204961E-01  0.299E+00    6.20       1.0  T
   5     -9.4880071 -0.697108E-02  0.287E+00    6.39       1.0  T
   6     -9.5126636 -0.246565E-01  0.175E+00    6.42       1.0  T
   7     -9.5119274  0.736173E-03  0.170E+00    6.42       1.0  T
   8     -9.5155607 -0.363325E-02  0.113E+00    6.42       1.0  T
   9     -9.5122304  0.333028E-02  0.117E+00    6.38       1.0  T
  10     -9.5148160 -0.258562E-02  0.899E-01    6.38       1.0  T
  11     -9.5171831 -0.236710E-02  0.401E-01    6.41       1.0  T
  12     -9.5177984 -0.615253E-03  0.983E-02    6.41       1.0  T
  13     -9.5178041 -0.568470E-05  0.580E-02    6.41       1.0  T
  14     -9.5178046 -0.579331E-06  0.337E-02    6.41       1.3  T
  15     -9.5178067 -0.209350E-05  0.203E-02    6.41       2.2  T
  16     -9.5178077 -0.955982E-06  0.587E-03    6.41       7.6  T
  17     -9.5178077 -0.469849E-07  0.398E-03    6.41      11.3  T
  18     -9.5178078 -0.606349E-07  0.538E-04    6.41      83.2  T
  19     -9.5178078 -0.681267E-09  0.372E-04    6.41     120.3  T

   *** convergence criteria satisfied after 19 iterations ***

         #    Occupation            Energy/Eh            Energy/eV
      -------------------------------------------------------------
         1        2.0000           -0.7450021             -20.2725
       ...           ...                  ...                  ...
         4        2.0000           -0.5954728             -16.2036
         5        2.0000           -0.5191166             -14.1259
         6        2.0000           -0.4587242             -12.4825
         7        2.0000           -0.4524295             -12.3112
         8        1.6389           -0.4117002             -11.2029
         9        1.2243           -0.4099793             -11.1561
        10        1.1368           -0.4094075             -11.1405 (HOMO)
        11                         -0.1737871              -4.7290 (LUMO)
        12                         -0.1263178              -3.4373
        13                         -0.0517093              -1.4071
        14                         -0.0382263              -1.0402
        15                          0.1182125               3.2167
       ...                                ...                  ...
        17                          0.3669748               9.9859
      -------------------------------------------------------------
                  HL-Gap            0.2356204 Eh            6.4116 eV
             Fermi-level           -0.3513777 Eh           -9.5615 eV

 transition dipole moment (au) for excitation:           9          10
     X       Y       Z   
   0.3253  -0.2614   0.4148  total (au/Debye):    0.588   1.496
 dE (eV)             :    0.016
 oscillator strength :  0.18665E-03

 SCC (total)                   0 d,  0 h,  0 min,  0.005 sec
 SCC setup                      ...        0 min,  0.000 sec (  1.723%)
 Dispersion                     ...        0 min,  0.000 sec (  0.342%)
 integral evaluation            ...        0 min,  0.001 sec ( 22.758%)
 zeroth order Hamiltonian       ...        0 min,  0.000 sec (  0.401%)
 iterations                     ...        0 min,  0.002 sec ( 35.605%)
 molecular gradient             ...        0 min,  0.001 sec ( 21.924%)
 printout                       ...        0 min,  0.001 sec ( 17.041%)

         :::::::::::::::::::::::::::::::::::::::::::::::::::::
         ::                     SUMMARY                     ::
         :::::::::::::::::::::::::::::::::::::::::::::::::::::
         :: total energy              -9.408651468898 Eh    ::
         :: gradient norm              0.092152346689 Eh/a0 ::
         :: HOMO-LUMO gap              6.411557252580 eV    ::
         ::.................................................::
         :: SCC energy                -9.517807793271 Eh    ::
         :: -> isotropic ES           -0.001124736577 Eh    ::
         :: -> anisotropic ES          0.004839741482 Eh    ::
         :: -> anisotropic XC          0.006011755532 Eh    ::
         :: -> dispersion             -0.002037500113 Eh    ::
         :: repulsion energy           0.109156309222 Eh    ::
         :: add. restraining           0.000000000000 Eh    ::
         :::::::::::::::::::::::::::::::::::::::::::::::::::::

      ----------------------------------------------------------- 
     |                   =====================                   |
     |                        A N C O P T                        |
     |                   =====================                   |
     |               Approximate Normal Coordinate               |
     |                Rational Function Optimizer                |
      ----------------------------------------------------------- 

          ...................................................
          :                      SETUP                      :
          :.................................................:
          :   optimization level            normal          :
          :   max. optcycles                   200          :
          :   ANC micro-cycles                  20          :
          :   degrees of freedom                 9          :
          :.................................................:
          :   RF solver                   davidson          :
          :   write xtbopt.log                true          :
          :   linear?                        false          :
          :   energy convergence         0.5000000E-05 Eh   :
          :   grad. convergence          0.1000000E-02 Eh/α :
          :   maximium RF displ.         1.0000000          :
          :   Hlow (freq-cutoff)         0.1000000E-01      :
          :   Hmax (freq-cutoff)         5.0000000          :
          :   S6 in model hess.         20.0000000          :
          ...................................................

generating ANC from model Hessian ...
Using Lindh-Hessian (1995)
 Shifting diagonal of input Hessian by    0.0000000000000000     
 Lowest  eigenvalues of input Hessian
   -0.000000   -0.000000   -0.000000    0.000000    0.000000    0.000000
    0.130979    0.245855    0.440659    0.706756    0.927204    1.136794
    1.158995    1.408019    1.921622
 Highest eigenvalues
    0.706756    0.927204    1.136794    1.158995    1.408019    1.921622


........................................................................
.............................. CYCLE    1 ..............................
........................................................................
   1     -9.5178078 -0.951781E+01  0.462E-05    6.41       0.0  T
   2     -9.5178078  0.462995E-09  0.295E-04    6.41     151.7  T
   3     -9.5178078 -0.429184E-09  0.916E-05    6.41     488.3  T
     SCC iter.                  ...        0 min,  0.001 sec
     gradient                   ...        0 min,  0.001 sec
 * total energy  :    -9.4086515 Eh     change       -0.3943352E-09 Eh
   gradient norm :     0.0921523 Eh/α   predicted     0.0000000E+00 (-100.00%)
   displ. norm   :     0.1744490 α      lambda       -0.1299176E-01
   maximum displ.:     0.1252407 α      in ANC's #3, #2, #9, ...

........................................................................
.............................. CYCLE    2 ..............................
........................................................................
   1     -9.5224191 -0.952242E+01  0.106E+00    5.99       0.0  T
   2     -9.5219650  0.454084E-03  0.695E-01    5.95       1.0  T
   3     -9.5085315  0.134335E-01  0.185E+00    5.98       1.0  T
   4     -9.5088622 -0.330702E-03  0.184E+00    5.98       1.0  T
   5     -9.5218230 -0.129608E-01  0.450E-01    5.98       1.0  T
   6     -9.5224742 -0.651204E-03  0.251E-01    5.97       1.0  T
   7     -9.5227262 -0.251990E-03  0.573E-02    5.97       1.0  T
   8     -9.5227377 -0.115153E-04  0.237E-02    5.97       1.9  T
   9     -9.5227401 -0.242552E-05  0.752E-03    5.97       6.0  T
  10     -9.5227403 -0.148314E-06  0.224E-03    5.97      20.0  T
  11     -9.5227403 -0.202106E-07  0.784E-04    5.97      57.1  T
  12     -9.5227403 -0.209074E-08  0.124E-04    5.97     361.1  T
     SCC iter.                  ...        0 min,  0.001 sec
     gradient                   ...        0 min,  0.001 sec
 * total energy  :    -9.4206311 Eh     change       -0.1197958E-01 Eh
   gradient norm :     0.0652333 Eh/α   predicted    -0.6693569E-02 ( -44.13%)
   displ. norm   :     0.6451644 α      lambda       -0.3908267E-01
   maximum displ.:     0.4728788 α      in ANC's #3, #2, #5, ...

........................................................................
.............................. CYCLE    3 ..............................
........................................................................
   1     -9.5189252 -0.951893E+01  0.326E+00    3.35       0.0  T
   2     -9.5166764  0.224882E-02  0.219E+00    3.38       1.0  T
   3     -9.5024813  0.141950E-01  0.188E+00    3.08       1.0  T
   4     -9.5217775 -0.192962E-01  0.773E-01    3.36       1.0  T
   5     -9.5200113  0.176627E-02  0.985E-01    3.29       1.0  T
   6     -9.5248726 -0.486131E-02  0.166E-01    3.28       1.0  T
   7     -9.5249191 -0.465525E-04  0.666E-02    3.27       1.0  T
   8     -9.5249352 -0.160687E-04  0.138E-02    3.27       3.2  T
   9     -9.5249354 -0.167207E-06  0.427E-03    3.27      10.5  T
  10     -9.5249354 -0.350748E-07  0.131E-03    3.27      34.2  T
  11     -9.5249354 -0.231602E-08  0.338E-04    3.27     132.2  T
  12     -9.5249354 -0.259892E-09  0.150E-04    3.27     297.2  T
     SCC iter.                  ...        0 min,  0.001 sec
     gradient                   ...        0 min,  0.001 sec
 * total energy  :    -9.4387004 Eh     change       -0.1806935E-01 Eh
   gradient norm :     0.0797929 Eh/α   predicted    -0.2767516E-01 (  53.16%)
   displ. norm   :     0.0555019 α      lambda       -0.2995794E-02
   maximum displ.:     0.0402548 α      in ANC's #3, #9, #6, ...

........................................................................
.............................. CYCLE    4 ..............................
........................................................................
   1     -9.5317795 -0.953178E+01  0.330E-01    3.42       0.0  T
   2     -9.5317413  0.382571E-04  0.233E-01    3.41       1.0  T
   3     -9.5314060  0.335282E-03  0.289E-01    3.44       1.0  T
   4     -9.5309774  0.428616E-03  0.417E-01    3.43       1.0  T
   5     -9.5318221 -0.844735E-03  0.649E-02    3.42       1.0  T
   6     -9.5318426 -0.204833E-04  0.182E-02    3.42       2.5  T
   7     -9.5318428 -0.202568E-06  0.350E-03    3.42      12.8  T
   8     -9.5318428 -0.123987E-07  0.150E-03    3.42      29.8  T
   9     -9.5318428 -0.176559E-08  0.213E-04    3.42     209.9  T
  10     -9.5318428 -0.592006E-10  0.138E-04    3.42     323.8  T
     SCC iter.                  ...        0 min,  0.001 sec
     gradient                   ...        0 min,  0.001 sec
 * total energy  :    -9.4410696 Eh     change       -0.2369183E-02 Eh
   gradient norm :     0.0539259 Eh/α   predicted    -0.1502511E-02 ( -36.58%)
   displ. norm   :     0.1032053 α      lambda       -0.4582414E-02
   maximum displ.:     0.0574750 α      in ANC's #9, #2, #6, ...

........................................................................
.............................. CYCLE    5 ..............................
........................................................................
   1     -9.5461531 -0.954615E+01  0.600E-01    3.07       0.0  T
   2     -9.5460172  0.135950E-03  0.404E-01    3.03       1.0  T
   3     -9.5453057  0.711485E-03  0.424E-01    3.10       1.0  T
   4     -9.5451723  0.133407E-03  0.468E-01    3.06       1.0  T
   5     -9.5463137 -0.114141E-02  0.462E-02    3.05       1.0  T
   6     -9.5463186 -0.494073E-05  0.168E-02    3.06       2.7  T
   7     -9.5463188 -0.190559E-06  0.371E-03    3.05      12.1  T
   8     -9.5463188 -0.558928E-08  0.176E-03    3.05      25.4  T
   9     -9.5463188 -0.364825E-08  0.388E-04    3.05     115.4  T
  10     -9.5463188 -0.180451E-09  0.120E-04    3.05     372.4  T
     SCC iter.                  ...        0 min,  0.001 sec
     gradient                   ...        0 min,  0.001 sec
 * total energy  :    -9.4436752 Eh     change       -0.2605658E-02 Eh
   gradient norm :     0.0158750 Eh/α   predicted    -0.2315611E-02 ( -11.13%)
   displ. norm   :     0.0734764 α      lambda       -0.7389407E-03
   maximum displ.:     0.0515650 α      in ANC's #3, #2, #5, ...

........................................................................
.............................. CYCLE    6 ..............................
........................................................................
   1     -9.5478565 -0.954786E+01  0.338E-01    2.66       0.0  T
   2     -9.5478426  0.138813E-04  0.198E-01    2.65       1.0  T
   3     -9.5475637  0.278891E-03  0.222E-01    2.68       1.0  T
   4     -9.5478009 -0.237145E-03  0.117E-01    2.66       1.0  T
   5     -9.5478764 -0.755384E-04  0.122E-02    2.65       3.7  T
   6     -9.5478766 -0.167945E-06  0.351E-03    2.65      12.7  T
   7     -9.5478766 -0.292356E-07  0.125E-03    2.65      35.7  T
   8     -9.5478766 -0.155450E-08  0.538E-04    2.65      83.1  T
   9     -9.5478766 -0.547551E-09  0.161E-04    2.65     278.3  T
     SCC iter.                  ...        0 min,  0.001 sec
     gradient                   ...        0 min,  0.001 sec
 * total energy  :    -9.4442195 Eh     change       -0.5442425E-03 Eh
   gradient norm :     0.0149995 Eh/α   predicted    -0.3714662E-03 ( -31.75%)
   displ. norm   :     0.0744919 α      lambda       -0.5521665E-03
   maximum displ.:     0.0526524 α      in ANC's #3, #2, #5, ...

........................................................................
.............................. CYCLE    7 ..............................
........................................................................
   1     -9.5488465 -0.954885E+01  0.454E-01    2.23       0.0  T
   2     -9.5487497  0.967706E-04  0.286E-01    2.20       1.0  T
   3     -9.5486209  0.128873E-03  0.274E-01    2.25       1.0  T
   4     -9.5488092 -0.188367E-03  0.179E-01    2.22       1.0  T
   5     -9.5489796 -0.170349E-03  0.503E-02    2.21       1.0  T
   6     -9.5489936 -0.140461E-04  0.875E-03    2.22       5.1  T
   7     -9.5489937 -0.931838E-07  0.157E-03    2.22      28.5  T
   8     -9.5489937 -0.358660E-08  0.749E-04    2.22      59.7  T
   9     -9.5489937 -0.104330E-08  0.208E-04    2.22     215.1  T
     SCC iter.                  ...        0 min,  0.001 sec
     gradient                   ...        0 min,  0.001 sec
 * total energy  :    -9.4446083 Eh     change       -0.3888346E-03 Eh
   gradient norm :     0.0118663 Eh/α   predicted    -0.2776156E-03 ( -28.60%)
   displ. norm   :     0.0766800 α      lambda       -0.4122283E-03
   maximum displ.:     0.0488973 α      in ANC's #3, #5, #6, ...

........................................................................
.............................. CYCLE    8 ..............................
........................................................................
   1     -9.5493235 -0.954932E+01  0.614E-01    1.80       0.0  T
   2     -9.5491462  0.177372E-03  0.392E-01    1.74       1.0  T
   3     -9.5491559 -0.977467E-05  0.337E-01    1.83       1.0  T
   4     -9.5495362 -0.380208E-03  0.158E-01    1.77       1.0  T
   5     -9.5496091 -0.729312E-04  0.109E-01    1.77       1.0  T
   6     -9.5496827 -0.736239E-04  0.102E-02    1.78       4.4  T
   7     -9.5496828 -0.690751E-07  0.174E-03    1.78      25.7  T
   8     -9.5496828 -0.457024E-08  0.812E-04    1.78      55.1  T
   9     -9.5496828 -0.110450E-08  0.240E-04    1.78     186.2  T
     SCC iter.                  ...        0 min,  0.001 sec
     gradient                   ...        0 min,  0.001 sec
 * total energy  :    -9.4450322 Eh     change       -0.4238589E-03 Eh
   gradient norm :     0.0164016 Eh/α   predicted    -0.2073262E-03 ( -51.09%)
   displ. norm   :     0.0938158 α      lambda       -0.6674739E-03
   maximum displ.:     0.0602482 α      in ANC's #3, #5, #6, ...

........................................................................
.............................. CYCLE    9 ..............................
........................................................................
   1     -9.5504772 -0.955048E+01  0.865E-01    1.39       0.0  T
   2     -9.5504561  0.210895E-04  0.497E-01    1.32       1.0  T
   3     -9.5500636  0.392480E-03  0.440E-01    1.42       1.0  T
   4     -9.5509074 -0.843788E-03  0.143E-01    1.33       1.0  T
   5     -9.5509357 -0.283142E-04  0.111E-01    1.35       1.0  T
   6     -9.5510164 -0.806635E-04  0.149E-02    1.35       3.0  T
   7     -9.5510166 -0.219501E-06  0.183E-03    1.35      24.5  T
   8     -9.5510166 -0.506711E-08  0.813E-04    1.35      55.0  T
   9     -9.5510166 -0.548152E-09  0.199E-04    1.35     224.6  T
     SCC iter.                  ...        0 min,  0.001 sec
     gradient                   ...        0 min,  0.001 sec
 * total energy  :    -9.4461779 Eh     change       -0.1145673E-02 Eh
   gradient norm :     0.0310865 Eh/α   predicted    -0.3366739E-03 ( -70.61%)
   displ. norm   :     0.2835874 α      lambda       -0.5030469E-02
   maximum displ.:     0.1870286 α      in ANC's #3, #5, #6, ...

........................................................................
.............................. CYCLE   10 ..............................
........................................................................
   1     -9.5592758 -0.955928E+01  0.231E+00    1.39       0.0  T
   2     -9.5587726  0.503256E-03  0.135E+00    1.37       1.0  T
   3     -9.5532744  0.549816E-02  0.152E+00    1.23       1.0  T
   4     -9.5628515 -0.957708E-02  0.394E-01    1.36       1.0  T
   5     -9.5636780 -0.826445E-03  0.619E-02    1.30       1.0  T
   6     -9.5636430  0.349274E-04  0.783E-02    1.30       1.0  T
   7     -9.5636846 -0.415497E-04  0.941E-03    1.30       4.8  T
   8     -9.5636850 -0.475509E-06  0.263E-03    1.30      17.0  T
   9     -9.5636851 -0.381609E-08  0.482E-04    1.30      92.8  T
  10     -9.5636851 -0.313737E-09  0.142E-04    1.30     314.5  T
     SCC iter.                  ...        0 min,  0.001 sec
     gradient                   ...        0 min,  0.001 sec
 * total energy  :    -9.4610032 Eh     change       -0.1482539E-01 Eh
   gradient norm :     0.0987043 Eh/α   predicted    -0.2717511E-02 ( -81.67%)
   displ. norm   :     0.6832017 α      lambda       -0.5314145E-01
   maximum displ.:     0.4507910 α      in ANC's #3, #5, #6, ...

........................................................................
.............................. CYCLE   11 ..............................
........................................................................
   1     -9.5612065 -0.956121E+01  0.242E+00    2.63       0.0  T
   2     -9.5595415  0.166492E-02  0.144E+00    2.62       1.0  T
   3     -9.5355763  0.239652E-01  0.190E+00    2.44       1.0  T
   4     -9.5624043 -0.268280E-01  0.126E-01    2.62       1.0  T
   5     -9.5624460 -0.416545E-04  0.728E-02    2.62       1.0  T
   6     -9.5624439  0.203581E-05  0.286E-02    2.62       1.6  T
   7     -9.5624418  0.214129E-05  0.298E-02    2.62       1.5  T
   8     -9.5624492 -0.735262E-05  0.405E-03    2.62      11.0  T
   9     -9.5624492 -0.707910E-08  0.499E-04    2.62      89.6  T
  10     -9.5624492 -0.156756E-09  0.138E-04    2.62     324.2  T
     SCC iter.                  ...        0 min,  0.001 sec
     gradient                   ...        0 min,  0.001 sec
 * total energy  :    -9.4785943 Eh     change       -0.1759108E-01 Eh
   gradient norm :     0.1410371 Eh/α   predicted    -0.3897297E-01 ( 121.55%)
   displ. norm   :     0.2305743 α      lambda       -0.2157582E-01
   maximum displ.:     0.1678029 α      in ANC's #3, #2, #9, ...

........................................................................
.............................. CYCLE   12 ..............................
........................................................................
   1     -9.5999550 -0.959996E+01  0.825E-01    3.00       0.0  T
   2     -9.5999736 -0.185998E-04  0.541E-01    2.97       1.0  T
   3     -9.5984872  0.148637E-02  0.459E-01    3.05       1.0  T
   4     -9.6000908 -0.160356E-02  0.989E-02    2.97       1.0  T
   5     -9.6001210 -0.301737E-04  0.472E-02    2.98       1.0  T
   6     -9.6001078  0.131741E-04  0.440E-02    2.98       1.0  T
   7     -9.6001233 -0.155382E-04  0.512E-03    2.98       8.7  T
   8     -9.6001234 -0.988754E-08  0.195E-03    2.98      23.0  T
   9     -9.6001234 -0.846716E-08  0.255E-04    2.98     175.2  T
  10     -9.6001234 -0.120437E-11  0.934E-05    2.98     479.0  T
     SCC iter.                  ...        0 min,  0.001 sec
     gradient                   ...        0 min,  0.001 sec
 * total energy  :    -9.4900705 Eh     change       -0.1147621E-01 Eh
   gradient norm :     0.0453988 Eh/α   predicted    -0.1136144E-01 (  -1.00%)
   displ. norm   :     0.0586749 α      lambda       -0.2025411E-02
   maximum displ.:     0.0364255 α      in ANC's #3, #9, #5, ...

........................................................................
.............................. CYCLE   13 ..............................
........................................................................
   1     -9.6017380 -0.960174E+01  0.334E-01    3.01       0.0  T
   2     -9.6015149  0.223088E-03  0.286E-01    3.03       1.0  T
   3     -9.6019071 -0.392215E-03  0.161E-01    3.00       1.0  T
   4     -9.6019957 -0.885519E-04  0.501E-02    3.03       1.0  T
   5     -9.6020026 -0.692723E-05  0.966E-03    3.02       4.6  T
   6     -9.6020027 -0.126595E-06  0.763E-03    3.02       5.9  T
   7     -9.6020030 -0.295237E-06  0.881E-04    3.02      50.8  T
   8     -9.6020030 -0.170605E-08  0.391E-04    3.02     114.4  T
     SCC iter.                  ...        0 min,  0.001 sec
     gradient                   ...        0 min,  0.001 sec
 * total energy  :    -9.4915842 Eh     change       -0.1513632E-02 Eh
   gradient norm :     0.0280850 Eh/α   predicted    -0.1016194E-02 ( -32.86%)
   displ. norm   :     0.0718276 α      lambda       -0.1628704E-02
   maximum displ.:     0.0477076 α      in ANC's #3, #9, #5, ...

........................................................................
.............................. CYCLE   14 ..............................
........................................................................
   1     -9.6050062 -0.960501E+01  0.430E-01    2.77       0.0  T
   2     -9.6045771  0.429161E-03  0.371E-01    2.77       1.0  T
   3     -9.6052664 -0.689321E-03  0.208E-01    2.77       1.0  T
   4     -9.6054114 -0.145051E-03  0.353E-02    2.77       1.3  T
   5     -9.6054152 -0.379984E-05  0.795E-03    2.77       5.6  T
   6     -9.6054147  0.516105E-06  0.842E-03    2.77       5.3  T
   7     -9.6054153 -0.560908E-06  0.796E-04    2.77      56.2  T
   8     -9.6054153 -0.130770E-08  0.389E-04    2.77     115.1  T
     SCC iter.                  ...        0 min,  0.001 sec
     gradient                   ...        0 min,  0.001 sec
 * total energy  :    -9.4926077 Eh     change       -0.1023538E-02 Eh
   gradient norm :     0.0223848 Eh/α   predicted    -0.8185516E-03 ( -20.03%)
   displ. norm   :     0.0414730 α      lambda       -0.5746795E-03
   maximum displ.:     0.0223623 α      in ANC's #5, #3, #6, ...

........................................................................
.............................. CYCLE   15 ..............................
........................................................................
   1     -9.6072277 -0.960723E+01  0.227E-01    2.62       0.0  T
   2     -9.6071676  0.600797E-04  0.158E-01    2.62       1.0  T
   3     -9.6071973 -0.296953E-04  0.137E-01    2.62       1.0  T
   4     -9.6072842 -0.868692E-04  0.120E-02    2.62       3.7  T
   5     -9.6072843 -0.166395E-06  0.661E-03    2.62       6.8  T
   6     -9.6072839  0.397213E-06  0.780E-03    2.62       5.7  T
   7     -9.6072844 -0.467359E-06  0.719E-04    2.62      62.2  T
   8     -9.6072844 -0.676287E-09  0.285E-04    2.62     156.7  T
     SCC iter.                  ...        0 min,  0.001 sec
     gradient                   ...        0 min,  0.001 sec
 * total energy  :    -9.4930599 Eh     change       -0.4522019E-03 Eh
   gradient norm :     0.0196145 Eh/α   predicted    -0.2878332E-03 ( -36.35%)
   displ. norm   :     0.0710675 α      lambda       -0.8489468E-03
   maximum displ.:     0.0350431 α      in ANC's #5, #8, #6, ...

........................................................................
.............................. CYCLE   16 ..............................
........................................................................
   1     -9.6086939 -0.960869E+01  0.338E-01    2.41       0.0  T
   2     -9.6086611  0.327810E-04  0.206E-01    2.41       1.0  T
   3     -9.6085756  0.855689E-04  0.206E-01    2.41       1.0  T
   4     -9.6087839 -0.208305E-03  0.374E-02    2.41       1.2  T
   5     -9.6087882 -0.436718E-05  0.119E-02    2.41       3.7  T
   6     -9.6087871  0.114226E-05  0.140E-02    2.41       3.2  T
   7     -9.6087885 -0.144468E-05  0.109E-03    2.41      41.2  T
   8     -9.6087885 -0.141402E-08  0.438E-04    2.41     102.0  T
   9     -9.6087885 -0.145864E-09  0.440E-05    2.41    1015.3  T
     SCC iter.                  ...        0 min,  0.001 sec
     gradient                   ...        0 min,  0.001 sec
 * total energy  :    -9.4936201 Eh     change       -0.5602133E-03 Eh
   gradient norm :     0.0120027 Eh/α   predicted    -0.4266177E-03 ( -23.85%)
   displ. norm   :     0.0513625 α      lambda       -0.3448550E-03
   maximum displ.:     0.0375992 α      in ANC's #2, #8, #6, ...

........................................................................
.............................. CYCLE   17 ..............................
........................................................................
   1     -9.6090556 -0.960906E+01  0.186E-01    2.34       0.0  T
   2     -9.6090665 -0.108851E-04  0.104E-01    2.34       1.0  T
   3     -9.6090429  0.235836E-04  0.853E-02    2.34       1.0  T
   4     -9.6090695 -0.265365E-04  0.331E-02    2.34       1.4  T
   5     -9.6090769 -0.746341E-05  0.629E-03    2.34       7.1  T
   6     -9.6090768  0.173966E-06  0.542E-03    2.34       8.2  T
   7     -9.6090770 -0.238272E-06  0.518E-04    2.34      86.3  T
   8     -9.6090770 -0.229322E-09  0.210E-04    2.34     213.0  T
     SCC iter.                  ...        0 min,  0.001 sec
     gradient                   ...        0 min,  0.001 sec
 * total energy  :    -9.4938740 Eh     change       -0.2539011E-03 Eh
   gradient norm :     0.0087218 Eh/α   predicted    -0.1728841E-03 ( -31.91%)
   displ. norm   :     0.0677104 α      lambda       -0.3182482E-03
   maximum displ.:     0.0581754 α      in ANC's #2, #8, #6, ...

........................................................................
.............................. CYCLE   18 ..............................
........................................................................
   1     -9.6090494 -0.960905E+01  0.213E-01    2.32       0.0  T
   2     -9.6090558 -0.637153E-05  0.121E-01    2.32       1.0  T
   3     -9.6090138  0.420250E-04  0.899E-02    2.32       1.0  T
   4     -9.6090594 -0.455775E-04  0.260E-02    2.32       1.7  T
   5     -9.6090636 -0.423581E-05  0.742E-03    2.32       6.0  T
   6     -9.6090631  0.485074E-06  0.906E-03    2.32       4.9  T
   7     -9.6090637 -0.622780E-06  0.542E-04    2.32      82.5  T
   8     -9.6090637 -0.147249E-09  0.119E-04    2.32     375.0  T
     SCC iter.                  ...        0 min,  0.001 sec
     gradient                   ...        0 min,  0.001 sec
 * total energy  :    -9.4941002 Eh     change       -0.2261827E-03 Eh
   gradient norm :     0.0085516 Eh/α   predicted    -0.1598517E-03 ( -29.33%)
   displ. norm   :     0.0639182 α      lambda       -0.2232675E-03
   maximum displ.:     0.0563963 α      in ANC's #2, #8, #9, ...

........................................................................
.............................. CYCLE   19 ..............................
........................................................................
   1     -9.6095624 -0.960956E+01  0.206E-01    2.34       0.0  T
   2     -9.6095602  0.225179E-05  0.123E-01    2.34       1.0  T
   3     -9.6094704  0.897874E-04  0.117E-01    2.34       1.0  T
   4     -9.6095724 -0.101960E-03  0.985E-03    2.34       4.5  T
   5     -9.6095717  0.693169E-06  0.102E-02    2.34       4.4  T
   6     -9.6095724 -0.720506E-06  0.288E-03    2.34      15.6  T
   7     -9.6095724 -0.453386E-07  0.681E-04    2.34      65.7  T
   8     -9.6095724 -0.359874E-09  0.134E-04    2.34     332.9  T
     SCC iter.                  ...        0 min,  0.001 sec
     gradient                   ...        0 min,  0.001 sec
 * total energy  :    -9.4942565 Eh     change       -0.1562631E-03 Eh
   gradient norm :     0.0070891 Eh/α   predicted    -0.1120914E-03 ( -28.27%)
   displ. norm   :     0.0442409 α      lambda       -0.1201833E-03
   maximum displ.:     0.0377683 α      in ANC's #2, #8, #9, ...

........................................................................
.............................. CYCLE   20 ..............................
........................................................................
   1     -9.6103474 -0.961035E+01  0.161E-01    2.37       0.0  T
   2     -9.6103398  0.754763E-05  0.111E-01    2.37       1.0  T
   3     -9.6103146  0.252815E-04  0.907E-02    2.37       1.0  T
   4     -9.6103639 -0.492877E-04  0.155E-02    2.37       2.9  T
   5     -9.6103646 -0.719457E-06  0.607E-03    2.37       7.4  T
   6     -9.6103646  0.468976E-08  0.148E-03    2.37      30.2  T
   7     -9.6103646 -0.421709E-08  0.116E-03    2.37      38.5  T
   8     -9.6103646 -0.836473E-08  0.136E-04    2.37     328.1  T
   9     -9.6103646 -0.203606E-10  0.668E-05    2.37     669.1  T
     SCC iter.                  ...        0 min,  0.001 sec
     gradient                   ...        0 min,  0.001 sec
 * total energy  :    -9.4943333 Eh     change       -0.7685982E-04 Eh
   gradient norm :     0.0033776 Eh/α   predicted    -0.6020983E-04 ( -21.66%)
   displ. norm   :     0.0126249 α      lambda       -0.2350901E-04
   maximum displ.:     0.0086172 α      in ANC's #2, #5, #3, ...
 * RMSD in coord.:     0.9381657 α      energy gain  -0.8568186E-01 Eh

generating ANC from model Hessian ...
Using Lindh-Hessian (1995)
 Shifting diagonal of input Hessian by    0.0000000000000000     
 Lowest  eigenvalues of input Hessian
   -0.000000   -0.000000   -0.000000   -0.000000    0.000000    0.000000
    0.069178    0.215322    0.251239    0.527923    0.901996    1.117322
    1.221498    1.427987    1.773757
 Highest eigenvalues
    0.527923    0.901996    1.117322    1.221498    1.427987    1.773757


........................................................................
.............................. CYCLE   21 ..............................
........................................................................
   1     -9.6109905 -0.961099E+01  0.580E-02    2.39       0.0  T
   2     -9.6109874  0.312109E-05  0.502E-02    2.38       1.0  T
   3     -9.6109945 -0.713726E-05  0.269E-02    2.38       1.7  T
   4     -9.6109962 -0.164375E-05  0.985E-03    2.38       4.5  T
   5     -9.6109965 -0.365645E-06  0.272E-03    2.38      16.5  T
   6     -9.6109964  0.750607E-07  0.346E-03    2.38      12.9  T
   7     -9.6109965 -0.886998E-07  0.304E-04    2.38     146.9  T
   8     -9.6109965 -0.795435E-10  0.627E-05    2.38     712.8  T
     SCC iter.                  ...        0 min,  0.001 sec
     gradient                   ...        0 min,  0.001 sec
 * total energy  :    -9.4943467 Eh     change       -0.1336104E-04 Eh
   gradient norm :     0.0007011 Eh/α   predicted     0.0000000E+00 (-100.00%)
   displ. norm   :     0.0018613 α      lambda       -0.7006007E-06
   maximum displ.:     0.0014887 α      in ANC's #3, #5, #4, ...

........................................................................
.............................. CYCLE   22 ..............................
........................................................................
   1     -9.6111255 -0.961113E+01  0.764E-03    2.38       0.0  T
   2     -9.6111253  0.176356E-06  0.810E-03    2.38       5.5  T
   3     -9.6111257 -0.376472E-06  0.291E-03    2.38      15.4  T
   4     -9.6111257 -0.474146E-08  0.108E-03    2.38      41.5  T
   5     -9.6111257 -0.184861E-08  0.704E-04    2.38      63.5  T
   6     -9.6111257 -0.369544E-08  0.195E-04    2.38     229.6  T
     SCC iter.                  ...        0 min,  0.001 sec
     gradient                   ...        0 min,  0.001 sec
 * total energy  :    -9.4943472 Eh     change       -0.5109766E-06 Eh
   gradient norm :     0.0001849 Eh/α   predicted    -0.3504717E-06 ( -31.41%)
   displ. norm   :     0.0005153 α      lambda       -0.3221955E-07
   maximum displ.:     0.0004101 α      in ANC's #1, #3, #9, ...

   *** GEOMETRY OPTIMIZATION CONVERGED AFTER 22 ITERATIONS ***

------------------------------------------------------------------------
 total energy gain   :        -0.0856957 Eh      -53.7749 kcal/mol
 total RMSD          :         0.9382434 a0        0.4965 Å
 total power (kW/mol):       -10.2270048 (step)-3333.0873 (real)
------------------------------------------------------------------------

 ANCopt (total)                0 d,  0 h,  0 min,  0.068 sec
 optimizer setup                ...        0 min,  0.000 sec (  0.096%)
 model hessian                  ...        0 min,  0.000 sec (  0.222%)
 ANC generation                 ...        0 min,  0.000 sec (  0.232%)
 coordinate transformation      ...        0 min,  0.000 sec (  0.073%)
 single point calculation       ...        0 min,  0.065 sec ( 96.671%)
 optimization log               ...        0 min,  0.001 sec (  0.849%)
 hessian update                 ...        0 min,  0.000 sec (  0.073%)
 rational function              ...        0 min,  0.001 sec (  0.793%)

================
 final structure:
================
5
 xtb: 6.2.2 (9d81278992624c895f80dd42a50cac0aa55982e2)
C        -0.62930475435517    0.58410442714202    0.47945607088158
C        -0.99884899810651   -0.76363552419556    0.60583629648539
C        -0.28192577583635   -0.72653444002628   -0.59983257175575
N         0.46936235295738    0.43475053783716   -0.37681754837618
H         1.44071717534065    0.47131499924266   -0.10864224723504

 Bond Distances (Angstroems)
 ---------------------------
C1-C2=1.4032         C1-C3=1.7330         C1-N4=1.4009         C2-C1=1.4032         C2-C3=1.4032         C3-C1=1.7330         
C3-C2=1.4032         C3-N4=1.4010         N4-C1=1.4009         N4-C3=1.4010         N4-H5=1.0084         H5-N4=1.0084         
 C  C  Rav=1.5131 sigma=0.1555  Rmin=1.4032  Rmax=1.7330     3
 N  H  Rav=1.0084 sigma=0.0000  Rmin=1.0084  Rmax=1.0084     1
 N  C  Rav=1.4010 sigma=0.0000  Rmin=1.4009  Rmax=1.4010     2

 selected bond angles (degree)
 --------------------
C3-C1-C2= 51.87                N4-C1-C2= 99.16                N4-C1-C3= 51.79                C3-C2-C1= 76.27                
C2-C3-C1= 51.86                N4-C3-C1= 51.79                N4-C3-C2= 99.16                C3-N4-C1= 76.41                
H5-N4-C1=126.09                H5-N4-C3=126.08                

 selected dihedral angles (degree)
 ---------------------------------
C3-C2-C1-N4=337.38            C2-C3-C1-N4=151.10            N4-C3-C1-C2=208.90            N4-C3-C2-C1= 22.62            
C3-N4-C1-C2= 22.64            H5-N4-C1-C2=257.64            H5-N4-C1-C3=234.99            C1-N4-C3-C2=337.36            
H5-N4-C3-C1=125.01            H5-N4-C3-C2=102.37            
           -------------------------------------------------
          |                Final Singlepoint                |
           -------------------------------------------------

          ...................................................
          :                      SETUP                      :
          :.................................................:
          :  # basis functions                  17          :
          :  # atomic orbitals                  17          :
          :  # shells                            9          :
          :  # electrons                        18          :
          :  max. iterations                   250          :
          :  Hamiltonian                  GFN2-xTB          :
          :  restarted?                      false          :
          :  GBSA solvation                  false          :
          :  PC potential                    false          :
          :  electronic temp.          300.0000000     K    :
          :  accuracy                    1.0000000          :
          :  -> integral cutoff          0.2500000E+02      :
          :  -> integral neglect         0.1000000E-07      :
          :  -> SCF convergence          0.1000000E-05 Eh   :
          :  -> wf. convergence          0.1000000E-03 e    :
          :  Broyden damping             0.4000000          :
          ...................................................

 iter      E             dE          RMSdq      gap      omega  full diag
   1     -9.6111257 -0.961113E+01  0.428E-05    2.38       0.0  T
   2     -9.6111257 -0.515143E-13  0.256E-05    2.38    1747.6  T
   3     -9.6111257  0.207834E-11  0.159E-05    2.38    2812.1  T

   *** convergence criteria satisfied after 3 iterations ***

         #    Occupation            Energy/Eh            Energy/eV
      -------------------------------------------------------------
         1        2.0000           -0.7230025             -19.6739
       ...           ...                  ...                  ...
         4        2.0000           -0.5908187             -16.0770
         5        2.0000           -0.5275146             -14.3544
         6        2.0000           -0.5227510             -14.2248
         7        2.0000           -0.4488105             -12.2128
         8        2.0000           -0.4269010             -11.6166
         9        1.0000           -0.3714617             -10.1080
        10        1.0000           -0.3648622              -9.9284 (HOMO)
        11                         -0.2773460              -7.5470 (LUMO)
        12                         -0.2367849              -6.4432
        13                          0.0320132               0.8711
        14                          0.0914856               2.4895
        15                          0.1704227               4.6374
       ...                                ...                  ...
        17                          0.4766183              12.9694
      -------------------------------------------------------------
                  HL-Gap            0.0875162 Eh            2.3814 eV
             Fermi-level           -0.3601427 Eh           -9.8000 eV

 transition dipole moment (au) for excitation:           9          10
     X       Y       Z   
   0.0796  -0.3002  -0.2475  total (au/Debye):    0.397   1.009
 dE (eV)             :    0.180
 oscillator strength :  0.98138E-03

 SCC (total)                   0 d,  0 h,  0 min,  0.004 sec
 SCC setup                      ...        0 min,  0.000 sec (  1.615%)
 Dispersion                     ...        0 min,  0.000 sec (  0.332%)
 integral evaluation            ...        0 min,  0.001 sec ( 29.377%)
 zeroth order Hamiltonian       ...        0 min,  0.000 sec (  0.359%)
 iterations                     ...        0 min,  0.001 sec ( 15.616%)
 molecular gradient             ...        0 min,  0.001 sec ( 30.268%)
 printout                       ...        0 min,  0.001 sec ( 22.121%)

         :::::::::::::::::::::::::::::::::::::::::::::::::::::
         ::                     SUMMARY                     ::
         :::::::::::::::::::::::::::::::::::::::::::::::::::::
         :: total energy              -9.494347197563 Eh    ::
         :: gradient norm              0.000186299793 Eh/a0 ::
         :: HOMO-LUMO gap              2.381436341734 eV    ::
         ::.................................................::
         :: SCC energy                -9.611125688965 Eh    ::
         :: -> isotropic ES           -0.004214858045 Eh    ::
         :: -> anisotropic ES          0.001364532164 Eh    ::
         :: -> anisotropic XC          0.004928567123 Eh    ::
         :: -> dispersion             -0.002080270900 Eh    ::
         :: repulsion energy           0.116778472467 Eh    ::
         :: add. restraining           0.000000000000 Eh    ::
         :::::::::::::::::::::::::::::::::::::::::::::::::::::

           ------------------------------------------------- 
          |                Numerical Hessian                |
           ------------------------------------------------- 
step length          :   0.00500
SCC accuracy         :   0.30000
Hessian scale factor :   1.00000
frozen atoms in %    :   0.00000    0
RMS gradient         :   0.00019
estimated CPU  time      0.00 min
estimated wall time      0.00 min

writing file <hessian>.

 projected vibrational frequencies (cm-1)
eigval :       -0.00    -0.00    -0.00     0.00     0.00     0.00
eigval :      470.56   618.42   801.00   814.55   914.39   987.56
eigval :     1240.65  1403.29  3414.32
           -------------------------------------------------
          |                Property Printout                |
           -------------------------------------------------

    * Orbital Energies and Occupations

         #    Occupation            Energy/Eh            Energy/eV
      -------------------------------------------------------------
         1        2.0000           -0.7230025             -19.6739
         2        2.0000           -0.6416353             -17.4598
         3        2.0000           -0.6072383             -16.5238
         4        2.0000           -0.5908187             -16.0770
         5        2.0000           -0.5275146             -14.3544
         6        2.0000           -0.5227510             -14.2248
         7        2.0000           -0.4488105             -12.2128
         8        2.0000           -0.4269011             -11.6166
         9        1.0000           -0.3714617             -10.1080
        10        1.0000           -0.3648622              -9.9284 (HOMO)
        11                         -0.2773460              -7.5470 (LUMO)
        12                         -0.2367849              -6.4432
        13                          0.0320132               0.8711
        14                          0.0914856               2.4895
        15                          0.1704227               4.6374
        16                          0.2445421               6.6543
        17                          0.4766183              12.9694
      -------------------------------------------------------------
                  HL-Gap            0.0875162 Eh            2.3814 eV
             Fermi-level           -0.3601428 Eh           -9.8000 eV

     #   Z        covCN         q      C6AA      α(0)
Molecule has the following symmetry elements: (sigma) 
It seems to be the Cs point group
     1   6 C      2.793    -0.010    28.251     8.707
     2   6 C      2.099    -0.071    32.808     9.255
     3   6 C      2.793    -0.010    28.252     8.707
     4   7 N      2.818    -0.088    22.957     7.116
     5   1 H      0.860     0.180     1.216     1.728

 Mol. C6AA /au·bohr⁶  :        494.294640
 Mol. C8AA /au·bohr⁸  :      13045.909082
 Mol. α(0) /au        :         35.512027


Wiberg/Mayer (AO) data.
largest (>0.10) Wiberg bond orders for each atom
          total WBO             WBO to atom ...
     1  C   2.887        C    2 1.263    N    4 1.048    C    3 0.572
     2  C   2.704        C    1 1.263    C    3 1.263    N    4 0.141
     3  C   2.887        C    2 1.263    N    4 1.048    C    1 0.572
     4  N   3.162        C    1 1.048    C    3 1.048    H    5 0.924    C    2 0.141
     5  H   0.967        N    4 0.924

MOs/occ written to file <molden.input>


molecular dipole:
                 x           y           z       tot (Debye)
 q only:        0.563       0.193      -0.053
   full:        0.947       0.336      -0.103       2.567
molecular quadrupole (traceless):
                xx          xy          yy          xz          yz          zz
 q only:        1.115       0.274      -0.516       0.171       0.166      -0.599
  q+dip:        2.691       0.342      -1.515       1.034      -0.248      -1.176
   full:        3.041      -0.124      -1.844       1.747      -0.133      -1.197

           -------------------------------------------------
          |                Geometry Summary                 |
           -------------------------------------------------

      molecular mass/u    :       51.0468517
   center of mass at/Å    :       -0.2921846      -0.0845881       0.0086844
  moments of inertia/u·Å² :        0.1979851E+02   0.3391357E+02   0.5018703E+02
rotational constants/cm⁻¹ :        0.8514598E+00   0.4970764E+00   0.3358962E+00

 * 3 selected distances

     #   Z        #   Z                                     value/Å
     1   6 C      4   7 N                                 1.4009213
     3   6 C      4   7 N                                 1.4009826 (max)
     4   7 N      5   1 H                                 1.0083576 (min)

 * 2 distinct bonds (by element types)

   Z      Z             #   av. dist./Å        max./Å        min./Å
   1 H    7 N           1     1.0083576     1.0083576     1.0083576
   6 C    7 N           2     1.4009520     1.4009826     1.4009213

           -------------------------------------------------
          |               Frequency Printout                |
           -------------------------------------------------
 projected vibrational frequencies (cm-1)
eigval :       -0.00    -0.00    -0.00     0.00     0.00     0.00
eigval :      470.56   618.42   801.00   814.55   914.39   987.56
eigval :     1240.65  1403.29  3414.32
 reduced masses (amu)
   1: 11.83   2: 12.08   3: 12.14   4: 12.03   5: 12.28   6: 11.99   7:  4.88   8: 10.31
   9: 11.70  10: 12.53  11: 11.73  12:  3.70  13: 11.93  14: 12.12  15:  1.88
 IR intensities (amu)
   1:  0.20   2:  0.12   3:  0.06   4:  0.19   5:  0.08   6:  0.10   7:  0.55   8:  0.89
   9:  1.68  10:  0.38  11:  0.32  12:  0.31  13:  1.32  14:  0.39  15:  0.19
 Raman intensities (amu)
   1:  0.00   2:  0.00   3:  0.00   4:  0.00   5:  0.00   6:  0.00   7:  0.00   8:  0.00
   9:  0.00  10:  0.00  11:  0.00  12:  0.00  13:  0.00  14:  0.00  15:  0.00
 output can be read by thermo (or use thermo option).
 writing <g98.out> molden fake output.
 recommended (thermochemical) frequency scaling factor: 1.0
           -------------------------------------------------
          |             Thermodynamic Functions             |
           -------------------------------------------------

cs  symmetry found (for desy threshold:  0.10E+00) used in thermo

          ...................................................
          :                      SETUP                      :
          :.................................................:
          :  # frequencies                           9      :
          :  # imaginary freq.                       0      :
          :  linear?                             false      :
          :  only rotor calc.                    false      :
          :  symmetry                               cs      :
          :  rotational number                       1      :
          :  scaling factor                  1.0000000      :
          :  rotor cutoff                   50.0000000 cm⁻¹ :
          :  imag. cutoff                  -20.0000000 cm⁻¹ :
          :.................................................:

    mode    ω/cm⁻¹     T·S(HO)/kcal·mol⁻¹    T·S(FR)/kcal·mol⁻¹   T·S(vib)
   ------------------------------------------------------------------------
   ------------------------------------------------------------------------

   temp. (K)  partition function   enthalpy   heat capacity  entropy
                                   cal/mol     cal/K/mol   cal/K/mol   J/K/mol
 298.15  VIB   1.25                  414.599      4.741      1.840
         ROT  0.140E+05              888.752      2.981     21.956
         INT  0.176E+05             1303.352      7.722     23.797
         TR   0.353E+27             1481.254      4.968     37.697
         TOT                        2784.6057    12.6899    61.4930   257.2869

   temp. (K)  partition function   enthalpy   heat capacity  entropy
                                   cal/mol     cal/K/mol   cal/K/mol   J/K/mol
 120.00  VIB   1.00                    6.209      0.321      0.060
         ROT  0.358E+04              357.707      2.981     19.243
         INT  0.360E+04              363.916      3.302     19.304
         TR   0.901E+26              596.178      4.968     33.177
         TOT                         960.0937     8.2704    52.4808   219.5795

   temp. (K)  partition function   enthalpy   heat capacity  entropy
                                   cal/mol     cal/K/mol   cal/K/mol   J/K/mol
 100.00  VIB   1.00                    1.836      0.132      0.021
         ROT  0.272E+04              298.089      2.981     18.700
         INT  0.273E+04              299.925      3.113     18.721
         TR   0.685E+26              496.815      4.968     32.272
         TOT                         796.7398     8.0811    50.9925   213.3528

   temp. (K)  partition function   enthalpy   heat capacity  entropy
                                   cal/mol     cal/K/mol   cal/K/mol   J/K/mol
  80.00  VIB   1.00                    0.313      0.034      0.004
         ROT  0.195E+04              238.471      2.981     18.035
         INT  0.195E+04              238.784      3.015     18.039
         TR   0.490E+26              397.452      4.968     31.164
         TOT                         636.2360     7.9832    49.2027   205.8640

   temp. (K)  partition function   enthalpy   heat capacity  entropy
                                   cal/mol     cal/K/mol   cal/K/mol   J/K/mol
  60.00  VIB   1.00                    0.018      0.003      0.000
         ROT  0.127E+04              178.853      2.981     17.177
         INT  0.127E+04              178.871      2.984     17.177
         TR   0.319E+26              298.089      4.968     29.735
         TOT                         476.9600     7.9524    46.9125   196.2818

   temp. (K)  partition function   enthalpy   heat capacity  entropy
                                   cal/mol     cal/K/mol   cal/K/mol   J/K/mol
  40.00  VIB   1.00                    0.000      0.000     -0.000
         ROT   689.                  119.236      2.981     15.968
         INT   689.                  119.236      2.981     15.968
         TR   0.173E+26              198.726      4.968     27.722
         TOT                         317.9617     7.9491    43.6900   182.7989

   temp. (K)  partition function   enthalpy   heat capacity  entropy
                                   cal/mol     cal/K/mol   cal/K/mol   J/K/mol
  20.00  VIB   1.00                    0.000      0.000     -0.000
         ROT   244.                   59.618      2.981     13.902
         INT   244.                   59.618      2.981     13.902
         TR   0.613E+25               99.363      4.968     24.280
         TOT                         158.9808     7.9490    38.1817   159.7521

   temp. (K)  partition function   enthalpy   heat capacity  entropy
                                   cal/mol     cal/K/mol   cal/K/mol   J/K/mol
  10.00  VIB   1.00                    0.000      0.000     -0.000
         ROT   86.1                   29.809      2.981     11.836
         INT   86.1                   29.809      2.981     11.835
         TR   0.217E+25               49.681      4.968     20.838
         TOT                          79.4904     7.9490    32.6733   136.7053

       T/K    H(0)-H(T)+PV         H(T)/Eh          T*S/Eh         G(T)/Eh
   ------------------------------------------------------------------------
    298.15    0.443755E-02    0.287336E-01    0.292173E-01   -0.483729E-03
    120.00    0.153001E-02    0.258261E-01    0.100360E-01    0.157900E-01
    100.00    0.126969E-02    0.255657E-01    0.812618E-02    0.174396E-01
     80.00    0.101391E-02    0.253100E-01    0.627276E-02    0.190372E-01
     60.00    0.760084E-03    0.250561E-01    0.448559E-02    0.205705E-01
     40.00    0.506704E-03    0.248028E-01    0.278498E-02    0.220178E-01
     20.00    0.253352E-03    0.245494E-01    0.121693E-02    0.233325E-01
     10.00    0.126676E-03    0.244227E-01    0.520683E-03    0.239020E-01 (used)
   ------------------------------------------------------------------------

         :::::::::::::::::::::::::::::::::::::::::::::::::::::
         ::                  THERMODYNAMIC                  ::
         :::::::::::::::::::::::::::::::::::::::::::::::::::::
         :: total free energy          -9.470445154931 Eh   ::
         ::.................................................::
         :: total energy               -9.494347197599 Eh   ::
         :: zero point energy           0.024296049531 Eh   ::
         :: G(RRHO) w/o ZPVE           -0.000394006864 Eh   ::
         :: G(RRHO) contrib.            0.023902042667 Eh   ::
         :::::::::::::::::::::::::::::::::::::::::::::::::::::

optimized geometry written to: xtbopt.xyz


           -------------------------------------------------
          | TOTAL ENERGY               -9.494347197599 Eh   |
          | TOTAL ENTHALPY             -9.469924472052 Eh   |
          | TOTAL FREE ENERGY          -9.470445154931 Eh   |
          | GRADIENT NORM               0.000186401830 Eh/α |
          | HOMO-LUMO GAP               2.381436329472 eV   |
           -------------------------------------------------

------------------------------------------------------------------------
 * finished run on 2020/05/12 at 11:45:03.350     
------------------------------------------------------------------------
 total:
 * wall-time:     0 d,  0 h,  0 min,  0.180 sec
 *  cpu-time:     0 d,  0 h,  0 min,  0.180 sec
 * ratio c/w:     0.998 speedup
 SCF:
 * wall-time:     0 d,  0 h,  0 min,  0.005 sec
 *  cpu-time:     0 d,  0 h,  0 min,  0.005 sec
 * ratio c/w:     0.998 speedup
 ANC optimizer:
 * wall-time:     0 d,  0 h,  0 min,  0.072 sec
 *  cpu-time:     0 d,  0 h,  0 min,  0.072 sec
 * ratio c/w:     0.998 speedup
 numerical hessian:
 * wall-time:     0 d,  0 h,  0 min,  0.083 sec
 *  cpu-time:     0 d,  0 h,  0 min,  0.083 sec
 * ratio c/w:     0.998 speedup

