      -----------------------------------------------------------      
     |                   =====================                   |     
     |                           x T B                           |     
     |                   =====================                   |     
     |                         S. Grimme                         |     
     |          Mulliken Center for Theoretical Chemistry        |     
     |                    University of Bonn                     |     
      -----------------------------------------------------------      

   * xtb version 6.2.2 (9d81278992624c895f80dd42a50cac0aa55982e2) compiled by '@Darwin' on 04/03/2020

   xtb is free software: you can redistribute it and/or modify it under
   the terms of the GNU Lesser General Public License as published by
   the Free Software Foundation, either version 3 of the License, or
   (at your option) any later version.
   
   xtb is distributed in the hope that it will be useful,
   but WITHOUT ANY WARRANTY; without even the implied warranty of
   MERCHANTABILITY or FITNESS FOR A PARTICULAR PURPOSE.  See the
   GNU Lesser General Public License for more details.
   
   Cite this work as:
   * S. Grimme, C. Bannwarth, P. Shushkov, J. Chem. Theory Comput., 2017,
     13, 1989-2009. DOI: 10.1021/acs.jctc.7b00118
   * C. Bannwarth, S. Ehlert and S. Grimme., J. Chem. Theory Comput., 2019,
     15, 1652-1671. DOI: 10.1021/acs.jctc.8b01176
   * P. Pracht, E. Caldeweyher, S. Ehlert, S. Grimme, ChemRxiv, 2019, preprint.
     DOI: 10.26434/chemrxiv.8326202.v1
   
   for DFT-D4:
   * E. Caldeweyher, C. Bannwarth and S. Grimme, J. Chem. Phys., 2017,
     147, 034112. DOI: 10.1063/1.4993215
   * E. Caldeweyher, S. Ehlert, A. Hansen, H. Neugebauer, S. Spicher,
     C. Bannwarth and S. Grimme, J. Chem. Phys., 2019, 150, 154122.
     DOI: 10.1063/1.5090222
   
   for sTDA-xTB:
   * S. Grimme and C. Bannwarth, J. Chem. Phys., 2016, 145, 054103.
     DOI: 10.1063/1.4959605
   
   in the mass-spec context:
   * V. Asgeirsson, C. Bauer and S. Grimme, Chem. Sci., 2017, 8, 4879.
     DOI: 10.1039/c7sc00601b
   
   for metadynamics refer to:
   * S. Grimme, J. Chem. Theory Comput., 2019, 155, 2847-2862
     DOI: 10.1021/acs.jctc.9b00143
   
   with help from (in alphabetical order)
   C. Bannwarth, F. Bohle, G. Brandenburg, E. Caldeweyher, M. Checinski,
   S. Dohm, S. Ehlert, S. Ehrlich, F. März, H. Neugebauer, J. Pisarek,
   P. Pracht, P. Shushkov, and S. Spicher.
   
 * started run on 2020/05/12 at 11:44:57.959     

           -------------------------------------------------
          |                Calculation Setup                |
           -------------------------------------------------

          program call               : xtb --input H1C3N1_19_S_2.input H1C3N1_19_S_2.xyz --ohess --molden --namespace H1C3N1_19_S_2 output.out
          calculation namespace      : H1C3N1_19_S_2
          coordinate file            : H1C3N1_19_S_2.xyz
          number of atoms            :                     5
          number of electrons        :                    18
          charge                     :                     0
          spin                       :                   1.0
          first test random number   :      0.20188146777688

   ID    Z sym.   atoms
    1    6 C      1, 3, 4
    2    7 N      2
    3    1 H      5

           -------------------------------------------------
          |                 G F N 2 - x T B                 |
           -------------------------------------------------

        Reference                      10.1021/acs.jctc.8b01176
      * Hamiltonian:
        H0-scaling (s, p, d)           1.850000    2.230000    2.230000
        zeta-weighting                 0.500000
      * Dispersion:
        s8                             2.700000
        a1                             0.520000
        a2                             5.000000
        s9                             5.000000
      * Repulsion:
        kExp                           1.500000    1.000000
        rExp                           1.000000
      * Coulomb:
        alpha                          2.000000
        third order                    shell-resolved
        anisotropic                    true
        a3                             3.000000
        a5                             4.000000
        cn-shift                       1.200000
        cn-exp                         4.000000
        max-rad                        5.000000


          ...................................................
          :                      SETUP                      :
          :.................................................:
          :  # basis functions                  17          :
          :  # atomic orbitals                  17          :
          :  # shells                            9          :
          :  # electrons                        18          :
          :  max. iterations                   250          :
          :  Hamiltonian                  GFN2-xTB          :
          :  restarted?                      false          :
          :  GBSA solvation                  false          :
          :  PC potential                    false          :
          :  electronic temp.          300.0000000     K    :
          :  accuracy                    1.0000000          :
          :  -> integral cutoff          0.2500000E+02      :
          :  -> integral neglect         0.1000000E-07      :
          :  -> SCF convergence          0.1000000E-05 Eh   :
          :  -> wf. convergence          0.1000000E-03 e    :
          :  Broyden damping             0.4000000          :
          ...................................................

 iter      E             dE          RMSdq      gap      omega  full diag
   1     -9.3867530 -0.938675E+01  0.848E+00    0.37       0.0  T
   2     -8.4503090  0.936444E+00  0.102E+01    0.25       1.0  T
   3     -8.3463033  0.104006E+00  0.106E+01    2.05       1.0  T
   4     -9.4431092 -0.109681E+01  0.412E+00    0.26       1.0  T
   5     -9.4633955 -0.202863E-01  0.233E+00    0.18       1.0  T
   6     -9.4657088 -0.231333E-02  0.176E+00    0.16       1.0  T
   7     -9.4655689  0.139909E-03  0.952E-01    0.13       1.0  T
   8     -9.4672267 -0.165777E-02  0.573E-01    0.12       1.0  T
   9     -9.4687175 -0.149082E-02  0.336E-01    0.12       1.0  T
  10     -9.4688026 -0.850550E-04  0.221E-01    0.11       1.0  T
  11     -9.4688206 -0.180697E-04  0.108E-01    0.11       1.0  T
  12     -9.4688332 -0.125363E-04  0.349E-02    0.11       1.3  T
  13     -9.4688328  0.374875E-06  0.189E-02    0.11       2.4  T
  14     -9.4688339 -0.107329E-05  0.613E-03    0.11       7.3  T
  15     -9.4688339 -0.302020E-07  0.288E-03    0.11      15.5  T
  16     -9.4688339 -0.351598E-08  0.842E-04    0.11      53.1  T
  17     -9.4688339 -0.808081E-09  0.243E-04    0.11     183.8  T

   *** convergence criteria satisfied after 17 iterations ***

         #    Occupation            Energy/Eh            Energy/eV
      -------------------------------------------------------------
         1        2.0000           -0.7345100             -19.9870
       ...           ...                  ...                  ...
         4        2.0000           -0.5848959             -15.9158
         5        2.0000           -0.5568961             -15.1539
         6        2.0000           -0.5035301             -13.7018
         7        2.0000           -0.4963435             -13.5062
         8        2.0000           -0.4524663             -12.3122
         9        1.0000           -0.4124456             -11.2232
        10        0.8984           -0.3725261             -10.1370 (HOMO)
        11        0.1016           -0.3683843             -10.0242 (LUMO)
        12                         -0.3351661              -9.1203
        13                         -0.1256700              -3.4197
        14                          0.0118302               0.3219
        15                          0.0546149               1.4861
       ...                                ...                  ...
        17                          0.2126869               5.7875
      -------------------------------------------------------------
                  HL-Gap            0.0041418 Eh            0.1127 eV
             Fermi-level           -0.4014556 Eh          -10.9242 eV

 transition dipole moment (au) for excitation:           9          10
     X       Y       Z   
  -0.3152  -0.2617  -0.1417  total (au/Debye):    0.433   1.102
 dE (eV)             :    1.086
 oscillator strength :  0.70713E-02

 SCC (total)                   0 d,  0 h,  0 min,  0.005 sec
 SCC setup                      ...        0 min,  0.000 sec (  1.597%)
 Dispersion                     ...        0 min,  0.000 sec (  0.391%)
 integral evaluation            ...        0 min,  0.001 sec ( 18.931%)
 zeroth order Hamiltonian       ...        0 min,  0.000 sec (  0.339%)
 iterations                     ...        0 min,  0.002 sec ( 42.169%)
 molecular gradient             ...        0 min,  0.001 sec ( 20.208%)
 printout                       ...        0 min,  0.001 sec ( 16.104%)

         :::::::::::::::::::::::::::::::::::::::::::::::::::::
         ::                     SUMMARY                     ::
         :::::::::::::::::::::::::::::::::::::::::::::::::::::
         :: total energy              -9.401889672548 Eh    ::
         :: gradient norm              0.166592867059 Eh/a0 ::
         :: HOMO-LUMO gap              0.112704028446 eV    ::
         ::.................................................::
         :: SCC energy                -9.468833912534 Eh    ::
         :: -> isotropic ES           -0.022805651888 Eh    ::
         :: -> anisotropic ES          0.000768330937 Eh    ::
         :: -> anisotropic XC          0.007064813001 Eh    ::
         :: -> dispersion             -0.002217808648 Eh    ::
         :: repulsion energy           0.066944206365 Eh    ::
         :: add. restraining           0.000000000000 Eh    ::
         :::::::::::::::::::::::::::::::::::::::::::::::::::::

      ----------------------------------------------------------- 
     |                   =====================                   |
     |                        A N C O P T                        |
     |                   =====================                   |
     |               Approximate Normal Coordinate               |
     |                Rational Function Optimizer                |
      ----------------------------------------------------------- 

          ...................................................
          :                      SETUP                      :
          :.................................................:
          :   optimization level            normal          :
          :   max. optcycles                   200          :
          :   ANC micro-cycles                  20          :
          :   degrees of freedom                 9          :
          :.................................................:
          :   RF solver                   davidson          :
          :   write xtbopt.log                true          :
          :   linear?                        false          :
          :   energy convergence         0.5000000E-05 Eh   :
          :   grad. convergence          0.1000000E-02 Eh/α :
          :   maximium RF displ.         1.0000000          :
          :   Hlow (freq-cutoff)         0.1000000E-01      :
          :   Hmax (freq-cutoff)         5.0000000          :
          :   S6 in model hess.         20.0000000          :
          ...................................................

generating ANC from model Hessian ...
Using Lindh-Hessian (1995)
 Shifting diagonal of input Hessian by    0.0000000000000000     
 Lowest  eigenvalues of input Hessian
   -0.000000   -0.000000    0.000000    0.000000    0.000000    0.000000
    0.044543    0.078885    0.141793    0.148794    0.724315    0.820176
    0.911814    1.061520    1.510680
 Highest eigenvalues
    0.148794    0.724315    0.820176    0.911814    1.061520    1.510680


........................................................................
.............................. CYCLE    1 ..............................
........................................................................
   1     -9.4688339 -0.946883E+01  0.548E-05    0.11       0.0  T
   2     -9.4688339  0.146905E-10  0.666E-05    0.11     671.4  T
   3     -9.4688339 -0.847855E-11  0.444E-05    0.11    1006.2  T
     SCC iter.                  ...        0 min,  0.000 sec
     gradient                   ...        0 min,  0.001 sec
 * total energy  :    -9.4018897 Eh     change       -0.6025882E-09 Eh
   gradient norm :     0.1665936 Eh/α   predicted     0.0000000E+00 (-100.00%)
   displ. norm   :     0.2692165 α      lambda       -0.3323421E-01
   maximum displ.:     0.1803729 α      in ANC's #3, #8, #7, ...

........................................................................
.............................. CYCLE    2 ..............................
........................................................................
   1     -9.5080184 -0.950802E+01  0.171E+00    0.23       0.0  T
   2     -9.3948288  0.113190E+00  0.388E+00    0.38       1.0  T
   3     -9.5078856 -0.113057E+00  0.139E+00    0.17       1.0  T
   4     -9.5150453 -0.715979E-02  0.710E-01    0.21       1.0  T
   5     -9.5158256 -0.780238E-03  0.423E-01    0.22       1.0  T
   6     -9.5157885  0.370432E-04  0.319E-01    0.20       1.0  T
   7     -9.5163052 -0.516655E-03  0.123E-01    0.20       1.0  T
   8     -9.5163449 -0.397364E-04  0.668E-02    0.20       1.0  T
   9     -9.5163658 -0.209067E-04  0.224E-02    0.20       2.0  T
  10     -9.5163683 -0.243926E-05  0.859E-03    0.20       5.2  T
  11     -9.5163686 -0.301660E-06  0.758E-04    0.20      59.0  T
  12     -9.5163686  0.199973E-09  0.556E-04    0.20      80.4  T
     SCC iter.                  ...        0 min,  0.001 sec
     gradient                   ...        0 min,  0.001 sec
 * total energy  :    -9.4302690 Eh     change       -0.2837933E-01 Eh
   gradient norm :     0.1166762 Eh/α   predicted    -0.1782148E-01 ( -37.20%)
   displ. norm   :     0.5307259 α      lambda       -0.4975314E-01
   maximum displ.:     0.2860200 α      in ANC's #4, #8, #3, ...

........................................................................
.............................. CYCLE    3 ..............................
........................................................................
   1     -9.5645644 -0.956456E+01  0.324E+00    0.65       0.0  T
   2     -8.9700237  0.594541E+00  0.870E+00    0.98       1.0  T
   3     -9.5844666 -0.614443E+00  0.192E+00    0.55       1.0  T
   4     -9.5910545 -0.658786E-02  0.140E+00    0.33       1.0  T
   5     -9.5964694 -0.541491E-02  0.785E-01    0.44       1.0  T
   6     -9.5973792 -0.909789E-03  0.600E-01    0.44       1.0  T
   7     -9.5990694 -0.169029E-02  0.335E-01    0.40       1.0  T
   8     -9.5995660 -0.496509E-03  0.153E-01    0.37       1.0  T
   9     -9.5996363 -0.703105E-04  0.735E-02    0.36       1.0  T
  10     -9.5996542 -0.179770E-04  0.493E-03    0.35       9.1  T
  11     -9.5996543 -0.623811E-07  0.220E-03    0.35      20.4  T
  12     -9.5996543 -0.571430E-08  0.170E-03    0.35      26.4  T
  13     -9.5996543 -0.129467E-07  0.284E-04    0.35     157.2  T
  14     -9.5996543 -0.210520E-09  0.952E-05    0.35     469.6  T
     SCC iter.                  ...        0 min,  0.001 sec
     gradient                   ...        0 min,  0.001 sec
 * total energy  :    -9.4578844 Eh     change       -0.2761535E-01 Eh
   gradient norm :     0.1226726 Eh/α   predicted    -0.3188355E-01 (  15.46%)
   displ. norm   :     0.4643203 α      lambda       -0.2540417E-01
   maximum displ.:     0.3455313 α      in ANC's #4, #1, #3, ...

........................................................................
.............................. CYCLE    4 ..............................
........................................................................
   1     -9.5808677 -0.958087E+01  0.205E+00    0.77       0.0  T
   2     -9.3700473  0.210820E+00  0.509E+00    0.03       1.0  T
   3     -9.5734409 -0.203394E+00  0.155E+00    0.85       1.0  T
   4     -9.5868835 -0.134426E-01  0.111E+00    0.59       1.0  T
   5     -9.5868578  0.256876E-04  0.774E-01    0.66       1.0  T
   6     -9.5871904 -0.332560E-03  0.714E-01    0.65       1.0  T
   7     -9.5887404 -0.155005E-02  0.491E-01    0.59       1.0  T
   8     -9.5891625 -0.422120E-03  0.376E-01    0.57       1.0  T
   9     -9.5894507 -0.288216E-03  0.286E-01    0.55       1.0  T
  10     -9.5897115 -0.260812E-03  0.140E-01    0.52       1.0  T
  11     -9.5897741 -0.625364E-04  0.751E-02    0.50       1.0  T
  12     -9.5897995 -0.254208E-04  0.277E-03    0.49      16.1  T
  13     -9.5897994  0.150816E-06  0.643E-03    0.49       7.0  T
  14     -9.5897995 -0.169948E-06  0.102E-03    0.49      43.7  T
  15     -9.5897995 -0.413334E-08  0.111E-04    0.49     402.3  T
  16     -9.5897995 -0.368647E-10  0.127E-05    0.49    3524.5  T
     SCC iter.                  ...        0 min,  0.001 sec
     gradient                   ...        0 min,  0.001 sec
 * total energy  :    -9.4726906 Eh     change       -0.1480620E-01 Eh
   gradient norm :     0.0641538 Eh/α   predicted    -0.1544056E-01 (   4.28%)
   displ. norm   :     0.2224911 α      lambda       -0.9495012E-02
   maximum displ.:     0.1199243 α      in ANC's #4, #2, #6, ...

........................................................................
.............................. CYCLE    5 ..............................
........................................................................
   1     -9.6021815 -0.960218E+01  0.860E-01    0.76       0.0  T
   2     -9.6018598  0.321729E-03  0.601E-01    0.70       1.0  T
   3     -9.6018664 -0.663583E-05  0.478E-01    0.77       1.0  T
   4     -9.6026828 -0.816357E-03  0.724E-02    0.71       1.0  T
   5     -9.6026695  0.132456E-04  0.757E-02    0.74       1.0  T
   6     -9.6027089 -0.393658E-04  0.236E-02    0.72       1.9  T
   7     -9.6027105 -0.158167E-05  0.415E-03    0.72      10.8  T
   8     -9.6027105 -0.172787E-07  0.138E-03    0.72      32.3  T
   9     -9.6027105 -0.207486E-08  0.426E-04    0.72     105.1  T
  10     -9.6027105 -0.416142E-09  0.523E-05    0.72     854.5  T
     SCC iter.                  ...        0 min,  0.001 sec
     gradient                   ...        0 min,  0.001 sec
 * total energy  :    -9.4786897 Eh     change       -0.5999101E-02 Eh
   gradient norm :     0.0504395 Eh/α   predicted    -0.4982523E-02 ( -16.95%)
   displ. norm   :     0.2296403 α      lambda       -0.7122314E-02
   maximum displ.:     0.1375203 α      in ANC's #1, #6, #2, ...

........................................................................
.............................. CYCLE    6 ..............................
........................................................................
   1     -9.6084041 -0.960840E+01  0.122E+00    0.83       0.0  T
   2     -9.6084391 -0.350194E-04  0.733E-01    0.64       1.0  T
   3     -9.6077108  0.728244E-03  0.602E-01    0.92       1.0  T
   4     -9.6093346 -0.162381E-02  0.180E-01    0.69       1.0  T
   5     -9.6095269 -0.192299E-03  0.620E-02    0.77       1.0  T
   6     -9.6095474 -0.204536E-04  0.252E-02    0.75       1.8  T
   7     -9.6095475 -0.145068E-06  0.324E-03    0.75      13.8  T
   8     -9.6095476 -0.156591E-07  0.149E-03    0.75      30.0  T
   9     -9.6095476 -0.583974E-09  0.240E-04    0.75     186.1  T
  10     -9.6095476 -0.342197E-10  0.526E-05    0.75     850.0  T
     SCC iter.                  ...        0 min,  0.001 sec
     gradient                   ...        0 min,  0.001 sec
 * total energy  :    -9.4839653 Eh     change       -0.5275633E-02 Eh
   gradient norm :     0.0305097 Eh/α   predicted    -0.3748953E-02 ( -28.94%)
   displ. norm   :     0.2266377 α      lambda       -0.4913758E-02
   maximum displ.:     0.1725182 α      in ANC's #6, #1, #5, ...

........................................................................
.............................. CYCLE    7 ..............................
........................................................................
   1     -9.6110913 -0.961109E+01  0.118E+00    0.76       0.0  T
   2     -9.6110850  0.627077E-05  0.698E-01    0.43       1.0  T
   3     -9.6103687  0.716319E-03  0.566E-01    0.84       1.0  T
   4     -9.6120458 -0.167703E-02  0.622E-02    0.59       1.0  T
   5     -9.6120546 -0.888921E-05  0.389E-02    0.61       1.1  T
   6     -9.6120550 -0.357570E-06  0.244E-02    0.60       1.8  T
   7     -9.6120574 -0.235948E-05  0.340E-03    0.61      13.2  T
   8     -9.6120574 -0.822406E-08  0.164E-03    0.61      27.2  T
   9     -9.6120574 -0.115248E-08  0.215E-04    0.61     208.0  T
  10     -9.6120574 -0.403944E-10  0.457E-05    0.61     977.6  T
     SCC iter.                  ...        0 min,  0.001 sec
     gradient                   ...        0 min,  0.001 sec
 * total energy  :    -9.4866336 Eh     change       -0.2668351E-02 Eh
   gradient norm :     0.0193756 Eh/α   predicted    -0.2583080E-02 (  -3.20%)
   displ. norm   :     0.0990577 α      lambda       -0.1055730E-02
   maximum displ.:     0.0475276 α      in ANC's #2, #6, #4, ...

........................................................................
.............................. CYCLE    8 ..............................
........................................................................
   1     -9.6119223 -0.961192E+01  0.500E-01    0.63       0.0  T
   2     -9.6119729 -0.505928E-04  0.279E-01    0.60       1.0  T
   3     -9.6119233  0.496174E-04  0.131E-01    0.66       1.0  T
   4     -9.6119799 -0.566162E-04  0.431E-02    0.60       1.0  T
   5     -9.6119918 -0.119453E-04  0.142E-02    0.62       3.2  T
   6     -9.6119919 -0.709963E-07  0.399E-03    0.62      11.2  T
   7     -9.6119920 -0.101267E-06  0.911E-04    0.62      49.1  T
   8     -9.6119920 -0.563851E-10  0.288E-04    0.62     155.2  T
     SCC iter.                  ...        0 min,  0.001 sec
     gradient                   ...        0 min,  0.001 sec
 * total energy  :    -9.4872519 Eh     change       -0.6182990E-03 Eh
   gradient norm :     0.0105241 Eh/α   predicted    -0.5330456E-03 ( -13.79%)
   displ. norm   :     0.0529876 α      lambda       -0.3076391E-03
   maximum displ.:     0.0301945 α      in ANC's #2, #6, #5, ...

........................................................................
.............................. CYCLE    9 ..............................
........................................................................
   1     -9.6167313 -0.961673E+01  0.258E-01    0.65       0.0  T
   2     -9.6167323 -0.102229E-05  0.164E-01    0.61       1.0  T
   3     -9.6167217  0.106343E-04  0.125E-01    0.64       1.0  T
   4     -9.6167721 -0.504505E-04  0.160E-02    0.63       2.8  T
   5     -9.6167733 -0.115923E-05  0.792E-03    0.63       5.6  T
   6     -9.6167734 -0.139694E-06  0.349E-03    0.63      12.8  T
   7     -9.6167734 -0.393325E-07  0.579E-04    0.63      77.2  T
   8     -9.6167734 -0.103070E-09  0.120E-04    0.63     374.0  T
     SCC iter.                  ...        0 min,  0.001 sec
     gradient                   ...        0 min,  0.001 sec
 * total energy  :    -9.4873587 Eh     change       -0.1067416E-03 Eh
   gradient norm :     0.0060855 Eh/α   predicted    -0.1542503E-03 (  44.51%)
   displ. norm   :     0.0422764 α      lambda       -0.1332787E-03
   maximum displ.:     0.0187674 α      in ANC's #1, #6, #4, ...

........................................................................
.............................. CYCLE   10 ..............................
........................................................................
   1     -9.6143663 -0.961437E+01  0.185E-01    0.65       0.0  T
   2     -9.6143754 -0.905887E-05  0.104E-01    0.64       1.0  T
   3     -9.6143726  0.278045E-05  0.411E-02    0.66       1.1  T
   4     -9.6143751 -0.252180E-05  0.188E-02    0.64       2.4  T
   5     -9.6143774 -0.225914E-05  0.545E-03    0.65       8.2  T
   6     -9.6143774  0.251535E-07  0.268E-03    0.65      16.7  T
   7     -9.6143774 -0.450168E-07  0.575E-04    0.65      77.8  T
   8     -9.6143774 -0.313738E-09  0.105E-04    0.65     425.6  T
     SCC iter.                  ...        0 min,  0.001 sec
     gradient                   ...        0 min,  0.001 sec
 * total energy  :    -9.4873753 Eh     change       -0.1666979E-04 Eh
   gradient norm :     0.0055041 Eh/α   predicted    -0.6675804E-04 ( 300.47%)
   displ. norm   :     0.0233502 α      lambda       -0.5825073E-04
   maximum displ.:     0.0169290 α      in ANC's #1, #6, #5, ...

........................................................................
.............................. CYCLE   11 ..............................
........................................................................
   1     -9.6148862 -0.961489E+01  0.965E-02    0.63       0.0  T
   2     -9.6148892 -0.302005E-05  0.525E-02    0.63       1.0  T
   3     -9.6148878  0.141758E-05  0.281E-02    0.62       1.6  T
   4     -9.6148897 -0.187919E-05  0.101E-02    0.63       4.4  T
   5     -9.6148903 -0.599630E-06  0.274E-03    0.63      16.3  T
   6     -9.6148903  0.398045E-08  0.972E-04    0.63      46.0  T
   7     -9.6148903 -0.565395E-08  0.310E-04    0.63     144.1  T
     SCC iter.                  ...        0 min,  0.001 sec
     gradient                   ...        0 min,  0.001 sec
 * total energy  :    -9.4874044 Eh     change       -0.2903669E-04 Eh
   gradient norm :     0.0014561 Eh/α   predicted    -0.2914177E-04 (   0.36%)
   displ. norm   :     0.0048344 α      lambda       -0.1992410E-05
   maximum displ.:     0.0042785 α      in ANC's #1, #9, #2, ...

........................................................................
.............................. CYCLE   12 ..............................
........................................................................
   1     -9.6150446 -0.961504E+01  0.155E-02    0.63       0.0  T
   2     -9.6150445  0.836929E-07  0.111E-02    0.64       4.0  T
   3     -9.6150448 -0.279832E-06  0.733E-03    0.63       6.1  T
   4     -9.6150449 -0.133526E-06  0.781E-04    0.64      57.2  T
   5     -9.6150449 -0.547363E-09  0.455E-04    0.64      98.2  T
     SCC iter.                  ...        0 min,  0.000 sec
     gradient                   ...        0 min,  0.001 sec
 * total energy  :    -9.4874063 Eh     change       -0.1874319E-05 Eh
   gradient norm :     0.0005089 Eh/α   predicted    -0.9956381E-06 ( -46.88%)
   displ. norm   :     0.0061065 α      lambda       -0.9179610E-06
   maximum displ.:     0.0051088 α      in ANC's #1, #2, #3, ...

   *** GEOMETRY OPTIMIZATION CONVERGED AFTER 12 ITERATIONS ***

------------------------------------------------------------------------
 total energy gain   :        -0.0855166 Eh      -53.6625 kcal/mol
 total RMSD          :         0.7452378 a0        0.3944 Å
 total power (kW/mol):       -18.7103139 (step)-6395.0843 (real)
------------------------------------------------------------------------

 ANCopt (total)                0 d,  0 h,  0 min,  0.035 sec
 optimizer setup                ...        0 min,  0.000 sec (  0.182%)
 model hessian                  ...        0 min,  0.000 sec (  0.259%)
 ANC generation                 ...        0 min,  0.000 sec (  0.139%)
 coordinate transformation      ...        0 min,  0.000 sec (  0.068%)
 single point calculation       ...        0 min,  0.034 sec ( 96.765%)
 optimization log               ...        0 min,  0.000 sec (  0.824%)
 hessian update                 ...        0 min,  0.000 sec (  0.072%)
 rational function              ...        0 min,  0.000 sec (  0.732%)

================
 final structure:
================
5
 xtb: 6.2.2 (9d81278992624c895f80dd42a50cac0aa55982e2)
C         1.72660143894865   -0.64118120207211   -0.05579360088633
N         0.62746847612820    0.01638917789154    0.01907530841802
C        -0.73036670742878    0.03739438234145    0.01164494599457
C        -0.11126614288559    1.27164802519744    0.03400821541603
H        -1.51243806476248   -0.68425038335833   -0.00893486894229

 Bond Distances (Angstroems)
 ---------------------------
C1-N2=1.2830         N2-C1=1.2830         N2-C3=1.3580         N2-C4=1.4566         C3-N2=1.3580         C3-C4=1.3810         
C3-H5=1.0643         C4-N2=1.4566         C4-C3=1.3810         H5-C3=1.0643         
 C  H  Rav=1.0643 sigma=0.0000  Rmin=1.0643  Rmax=1.0643     1
 C  C  Rav=1.3810 sigma=0.0000  Rmin=1.3810  Rmax=1.3810     1
 N  C  Rav=1.3659 sigma=0.0711  Rmin=1.2830  Rmax=1.4566     3

 selected bond angles (degree)
 --------------------
C3-N2-C1=149.79                C4-N2-C1=151.26                C4-N2-C3= 58.64                C4-C3-N2= 64.25                
H5-C3-N2=136.41                H5-C3-C4=159.34                C3-C4-N2= 57.11                

 selected dihedral angles (degree)
 ---------------------------------
C4-C3-N2-C1=186.32            H5-C3-N2-C1=  5.92            H5-C3-N2-C4=179.60            C3-C4-N2-C1=173.38            
N2-C4-C3-H5=180.78            
           -------------------------------------------------
          |                Final Singlepoint                |
           -------------------------------------------------

          ...................................................
          :                      SETUP                      :
          :.................................................:
          :  # basis functions                  17          :
          :  # atomic orbitals                  17          :
          :  # shells                            9          :
          :  # electrons                        18          :
          :  max. iterations                   250          :
          :  Hamiltonian                  GFN2-xTB          :
          :  restarted?                      false          :
          :  GBSA solvation                  false          :
          :  PC potential                    false          :
          :  electronic temp.          300.0000000     K    :
          :  accuracy                    1.0000000          :
          :  -> integral cutoff          0.2500000E+02      :
          :  -> integral neglect         0.1000000E-07      :
          :  -> SCF convergence          0.1000000E-05 Eh   :
          :  -> wf. convergence          0.1000000E-03 e    :
          :  Broyden damping             0.4000000          :
          ...................................................

 iter      E             dE          RMSdq      gap      omega  full diag
   1     -9.6150449 -0.961504E+01  0.247E-04    0.64       0.0  T
   2     -9.6150449 -0.300666E-10  0.168E-04    0.64     266.5  T
   3     -9.6150449 -0.273703E-09  0.686E-05    0.64     651.6  T

   *** convergence criteria satisfied after 3 iterations ***

         #    Occupation            Energy/Eh            Energy/eV
      -------------------------------------------------------------
         1        2.0000           -0.7430541             -20.2195
       ...           ...                  ...                  ...
         4        2.0000           -0.5851228             -15.9220
         5        2.0000           -0.5818650             -15.8334
         6        2.0000           -0.5298131             -14.4169
         7        2.0000           -0.4550702             -12.3831
         8        2.0000           -0.4495154             -12.2319
         9        1.0000           -0.4202441             -11.4354
        10        1.0000           -0.3202132              -8.7134 (HOMO)
        11        0.0000           -0.2968670              -8.0782 (LUMO)
        12                         -0.2476398              -6.7386
        13                         -0.0852995              -2.3211
        14                          0.0165036               0.4491
        15                          0.0733213               1.9952
       ...                                ...                  ...
        17                          0.6407621              17.4360
      -------------------------------------------------------------
                  HL-Gap            0.0233462 Eh            0.6353 eV
             Fermi-level           -0.3717092 Eh          -10.1147 eV

 transition dipole moment (au) for excitation:           9          10
     X       Y       Z   
  -0.0195  -0.0236   0.0243  total (au/Debye):    0.039   0.099
 dE (eV)             :    2.722
 oscillator strength :  0.14445E-03

 SCC (total)                   0 d,  0 h,  0 min,  0.003 sec
 SCC setup                      ...        0 min,  0.000 sec (  1.340%)
 Dispersion                     ...        0 min,  0.000 sec (  0.263%)
 integral evaluation            ...        0 min,  0.001 sec ( 30.991%)
 zeroth order Hamiltonian       ...        0 min,  0.000 sec (  0.387%)
 iterations                     ...        0 min,  0.000 sec (  8.575%)
 molecular gradient             ...        0 min,  0.001 sec ( 32.912%)
 printout                       ...        0 min,  0.001 sec ( 25.244%)

         :::::::::::::::::::::::::::::::::::::::::::::::::::::
         ::                     SUMMARY                     ::
         :::::::::::::::::::::::::::::::::::::::::::::::::::::
         :: total energy              -9.487406262311 Eh    ::
         :: gradient norm              0.000523803561 Eh/a0 ::
         :: HOMO-LUMO gap              0.635283763931 eV    ::
         ::.................................................::
         :: SCC energy                -9.615044898600 Eh    ::
         :: -> isotropic ES           -0.015680320708 Eh    ::
         :: -> anisotropic ES          0.000271251625 Eh    ::
         :: -> anisotropic XC          0.010597244205 Eh    ::
         :: -> dispersion             -0.002216405401 Eh    ::
         :: repulsion energy           0.127638560849 Eh    ::
         :: add. restraining           0.000000000000 Eh    ::
         :::::::::::::::::::::::::::::::::::::::::::::::::::::

           ------------------------------------------------- 
          |                Numerical Hessian                |
           ------------------------------------------------- 
step length          :   0.00500
SCC accuracy         :   0.30000
Hessian scale factor :   1.00000
frozen atoms in %    :   0.00000    0
RMS gradient         :   0.00052
estimated CPU  time      0.00 min
estimated wall time      0.00 min

writing file <hessian>.

 projected vibrational frequencies (cm-1)
eigval :       -0.00    -0.00    -0.00    -0.00     0.00     0.00
eigval :       19.05   375.08   573.71   672.78   837.36  1011.08
eigval :     1426.19  1572.03  3209.20
           -------------------------------------------------
          |                Property Printout                |
           -------------------------------------------------

    * Orbital Energies and Occupations

         #    Occupation            Energy/Eh            Energy/eV
      -------------------------------------------------------------
         1        2.0000           -0.7430538             -20.2195
         2        2.0000           -0.6807572             -18.5243
         3        2.0000           -0.6316137             -17.1871
         4        2.0000           -0.5851227             -15.9220
         5        2.0000           -0.5818649             -15.8334
         6        2.0000           -0.5298130             -14.4169
         7        2.0000           -0.4550698             -12.3831
         8        2.0000           -0.4495158             -12.2319
         9        1.0000           -0.4202441             -11.4354
        10        1.0000           -0.3202136              -8.7135 (HOMO)
        11        0.0000           -0.2968665              -8.0781 (LUMO)
        12                         -0.2476402              -6.7386
        13                         -0.0852993              -2.3211
        14                          0.0165037               0.4491
        15                          0.0733215               1.9952
        16                          0.4879323              13.2773
        17                          0.6407621              17.4360
      -------------------------------------------------------------
                  HL-Gap            0.0233471 Eh            0.6353 eV
             Fermi-level           -0.3717093 Eh          -10.1147 eV

     #   Z        covCN         q      C6AA      α(0)
     1   6 C      0.912    -0.206    42.300    10.885
     2   7 N      2.727     0.157    18.597     6.405
     3   6 C      2.819     0.080    26.199     8.387
     4   6 C      1.888    -0.119    34.452     9.480
Molecule has the following symmetry elements: (sigma) 
It seems to be the Cs point group
     5   1 H      0.927     0.087     1.903     2.157

 Mol. C6AA /au·bohr⁶  :        536.396432
 Mol. C8AA /au·bohr⁸  :      14162.915812
 Mol. α(0) /au        :         37.314067


Wiberg/Mayer (AO) data.
largest (>0.10) Wiberg bond orders for each atom
          total WBO             WBO to atom ...
     1  C   1.583        N    2 1.501
     2  N   3.560        C    1 1.501    C    3 1.146    C    4 0.908
     3  C   3.490        C    4 1.361    N    2 1.146    H    5 0.954
     4  C   2.348        C    3 1.361    N    2 0.908
     5  H   0.989        C    3 0.954

MOs/occ written to file <molden.input>


molecular dipole:
                 x           y           z       tot (Debye)
 q only:       -0.820      -0.140       0.020
   full:       -1.300      -0.529       0.037       3.569
molecular quadrupole (traceless):
                xx          xy          yy          xz          yz          zz
 q only:       -0.683       1.792      -0.290       0.121      -0.064       0.972
  q+dip:       -1.193       4.486      -1.423       0.353      -0.204       2.616
   full:       -2.405       4.253      -2.708       0.405      -0.311       5.113

           -------------------------------------------------
          |                Geometry Summary                 |
           -------------------------------------------------

      molecular mass/u    :       51.0468517
   center of mass at/Å    :        0.3505305       0.1481244       0.0026702
  moments of inertia/u·Å² :        0.1425196E+02   0.5346021E+02   0.6768775E+02
rotational constants/cm⁻¹ :        0.1182829E+01   0.3153304E+00   0.2490500E+00

 * 3 selected distances

     #   Z        #   Z                                     value/Å
     1   6 C      2   7 N                                 1.2830033
     2   7 N      3   6 C                                 1.3580180 (max)
     3   6 C      5   1 H                                 1.0643450 (min)

 * 2 distinct bonds (by element types)

   Z      Z             #   av. dist./Å        max./Å        min./Å
   1 H    6 C           1     1.0643450     1.0643450     1.0643450
   6 C    7 N           2     1.3205106     1.3580180     1.2830033

           -------------------------------------------------
          |               Frequency Printout                |
           -------------------------------------------------
 projected vibrational frequencies (cm-1)
eigval :       -0.00    -0.00    -0.00    -0.00     0.00     0.00
eigval :       19.05   375.08   573.71   672.78   837.36  1011.08
eigval :     1426.19  1572.03  3209.20
 reduced masses (amu)
   1:  9.44   2: 12.29   3: 12.05   4: 12.57   5: 11.97   6: 11.73   7: 13.07   8: 11.97
   9:  3.98  10: 12.09  11:  3.50  12: 11.76  13: 12.04  14: 12.68  15:  2.00
 IR intensities (amu)
   1:  0.37   2:  0.15   3:  0.22   4:  0.17   5:  0.07   6:  0.11   7:  0.63   8:  0.48
   9:  0.07  10:  0.15  11:  0.11  12:  0.08  13:  0.10  14:  0.16  15:  0.03
 Raman intensities (amu)
   1:  0.00   2:  0.00   3:  0.00   4:  0.00   5:  0.00   6:  0.00   7:  0.00   8:  0.00
   9:  0.00  10:  0.00  11:  0.00  12:  0.00  13:  0.00  14:  0.00  15:  0.00
 output can be read by thermo (or use thermo option).
 writing <g98.out> molden fake output.
 recommended (thermochemical) frequency scaling factor: 1.0
           -------------------------------------------------
          |             Thermodynamic Functions             |
           -------------------------------------------------

cs  symmetry found (for desy threshold:  0.10E+00) used in thermo

          ...................................................
          :                      SETUP                      :
          :.................................................:
          :  # frequencies                           9      :
          :  # imaginary freq.                       0      :
          :  linear?                             false      :
          :  only rotor calc.                    false      :
          :  symmetry                               cs      :
          :  rotational number                       1      :
          :  scaling factor                  1.0000000      :
          :  rotor cutoff                   50.0000000 cm⁻¹ :
          :  imag. cutoff                  -20.0000000 cm⁻¹ :
          :.................................................:

    mode    ω/cm⁻¹     T·S(HO)/kcal·mol⁻¹    T·S(FR)/kcal·mol⁻¹   T·S(vib)
   ------------------------------------------------------------------------
       1     19.05    -0.00508 (  2.06%)    -0.01110 ( 97.94%)    -0.01098
   ------------------------------------------------------------------------

   temp. (K)  partition function   enthalpy   heat capacity  entropy
                                   cal/mol     cal/K/mol   cal/K/mol   J/K/mol
 298.15  VIB   15.5                 1034.704      6.591      6.719
         ROT  0.173E+05              888.752      2.981     22.379
         INT  0.269E+06             1923.456      9.572     29.098
         TR   0.353E+27             1481.254      4.968     37.697
         TOT                        3404.7098    14.5398    66.7950   279.4702

   temp. (K)  partition function   enthalpy   heat capacity  entropy
                                   cal/mol     cal/K/mol   cal/K/mol   J/K/mol
 120.00  VIB   4.96                  226.776      2.585      3.753
         ROT  0.443E+04              357.707      2.981     19.666
         INT  0.220E+05              584.483      5.565     23.419
         TR   0.901E+26              596.178      4.968     33.177
         TOT                        1180.6609    10.5335    56.5963   236.7990

   temp. (K)  partition function   enthalpy   heat capacity  entropy
                                   cal/mol     cal/K/mol   cal/K/mol   J/K/mol
 100.00  VIB   4.19                  178.186      2.288      3.486
         ROT  0.337E+04              298.089      2.981     19.123
         INT  0.141E+05              476.275      5.269     22.609
         TR   0.685E+26              496.815      4.968     32.272
         TOT                         973.0896    10.2374    54.8809   229.6215

   temp. (K)  partition function   enthalpy   heat capacity  entropy
                                   cal/mol     cal/K/mol   cal/K/mol   J/K/mol
  80.00  VIB   3.45                  134.633      2.083      3.215
         ROT  0.241E+04              238.471      2.981     18.457
         INT  0.832E+04              373.104      5.064     21.672
         TR   0.490E+26              397.452      4.968     31.164
         TOT                         770.5564    10.0323    52.8362   221.0667

   temp. (K)  partition function   enthalpy   heat capacity  entropy
                                   cal/mol     cal/K/mol   cal/K/mol   J/K/mol
  60.00  VIB   2.73                   94.209      1.973      2.907
         ROT  0.157E+04              178.853      2.981     17.600
         INT  0.427E+04              273.062      4.954     20.507
         TR   0.319E+26              298.089      4.968     29.735
         TOT                         571.1513     9.9225    50.2419   210.2120

   temp. (K)  partition function   enthalpy   heat capacity  entropy
                                   cal/mol     cal/K/mol   cal/K/mol   J/K/mol
  40.00  VIB   2.02                   55.349      1.912      2.493
         ROT   852.                  119.236      2.981     16.391
         INT  0.172E+04              174.585      4.893     18.885
         TR   0.173E+26              198.726      4.968     27.722
         TOT                         373.3110     9.8609    46.6064   195.0013

   temp. (K)  partition function   enthalpy   heat capacity  entropy
                                   cal/mol     cal/K/mol   cal/K/mol   J/K/mol
  20.00  VIB   1.34                   18.549      1.704      1.792
         ROT   301.                   59.618      2.981     14.325
         INT   404.                   78.167      4.684     16.117
         TR   0.613E+25               99.363      4.968     24.280
         TOT                         177.5300     9.6526    40.3973   169.0221

   temp. (K)  partition function   enthalpy   heat capacity  entropy
                                   cal/mol     cal/K/mol   cal/K/mol   J/K/mol
  10.00  VIB   1.07                    3.758      1.101      1.097
         ROT   107.                   29.809      2.981     12.259
         INT   114.                   33.567      4.082     13.356
         TR   0.217E+25               49.681      4.968     20.838
         TOT                          83.2486     9.0499    34.1936   143.0661

       T/K    H(0)-H(T)+PV         H(T)/Eh          T*S/Eh         G(T)/Eh
   ------------------------------------------------------------------------
    298.15    0.542575E-02    0.275160E-01    0.317364E-01   -0.422046E-02
    120.00    0.188150E-02    0.239717E-01    0.108230E-01    0.131487E-01
    100.00    0.155072E-02    0.236410E-01    0.874582E-02    0.148951E-01
     80.00    0.122796E-02    0.233182E-01    0.673599E-02    0.165822E-01
     60.00    0.910187E-03    0.230004E-01    0.480393E-02    0.181965E-01
     40.00    0.594909E-03    0.226851E-01    0.297088E-02    0.197143E-01
     20.00    0.282912E-03    0.223731E-01    0.128754E-02    0.210856E-01
     10.00    0.132665E-03    0.222229E-01    0.544910E-03    0.216780E-01 (used)
   ------------------------------------------------------------------------

         :::::::::::::::::::::::::::::::::::::::::::::::::::::
         ::                  THERMODYNAMIC                  ::
         :::::::::::::::::::::::::::::::::::::::::::::::::::::
         :: total free energy          -9.465728270453 Eh   ::
         ::.................................................::
         :: total energy               -9.487406262025 Eh   ::
         :: zero point energy           0.022090236448 Eh   ::
         :: G(RRHO) w/o ZPVE           -0.000412244875 Eh   ::
         :: G(RRHO) contrib.            0.021677991572 Eh   ::
         :::::::::::::::::::::::::::::::::::::::::::::::::::::

optimized geometry written to: xtbopt.xyz


           -------------------------------------------------
          | TOTAL ENERGY               -9.487406262025 Eh   |
          | TOTAL ENTHALPY             -9.465183360487 Eh   |
          | TOTAL FREE ENERGY          -9.465728270453 Eh   |
          | GRADIENT NORM               0.000523953149 Eh/α |
          | HOMO-LUMO GAP               0.635306103694 eV   |
           -------------------------------------------------

------------------------------------------------------------------------
 * finished run on 2020/05/12 at 11:44:58.095     
------------------------------------------------------------------------
 total:
 * wall-time:     0 d,  0 h,  0 min,  0.135 sec
 *  cpu-time:     0 d,  0 h,  0 min,  0.135 sec
 * ratio c/w:     0.999 speedup
 SCF:
 * wall-time:     0 d,  0 h,  0 min,  0.005 sec
 *  cpu-time:     0 d,  0 h,  0 min,  0.005 sec
 * ratio c/w:     1.000 speedup
 ANC optimizer:
 * wall-time:     0 d,  0 h,  0 min,  0.039 sec
 *  cpu-time:     0 d,  0 h,  0 min,  0.039 sec
 * ratio c/w:     0.998 speedup
 numerical hessian:
 * wall-time:     0 d,  0 h,  0 min,  0.076 sec
 *  cpu-time:     0 d,  0 h,  0 min,  0.076 sec
 * ratio c/w:     0.999 speedup

