      -----------------------------------------------------------      
     |                   =====================                   |     
     |                           x T B                           |     
     |                   =====================                   |     
     |                         S. Grimme                         |     
     |          Mulliken Center for Theoretical Chemistry        |     
     |                    University of Bonn                     |     
      -----------------------------------------------------------      

   * xtb version 6.2.2 (9d81278992624c895f80dd42a50cac0aa55982e2) compiled by '@Darwin' on 04/03/2020

   xtb is free software: you can redistribute it and/or modify it under
   the terms of the GNU Lesser General Public License as published by
   the Free Software Foundation, either version 3 of the License, or
   (at your option) any later version.
   
   xtb is distributed in the hope that it will be useful,
   but WITHOUT ANY WARRANTY; without even the implied warranty of
   MERCHANTABILITY or FITNESS FOR A PARTICULAR PURPOSE.  See the
   GNU Lesser General Public License for more details.
   
   Cite this work as:
   * S. Grimme, C. Bannwarth, P. Shushkov, J. Chem. Theory Comput., 2017,
     13, 1989-2009. DOI: 10.1021/acs.jctc.7b00118
   * C. Bannwarth, S. Ehlert and S. Grimme., J. Chem. Theory Comput., 2019,
     15, 1652-1671. DOI: 10.1021/acs.jctc.8b01176
   * P. Pracht, E. Caldeweyher, S. Ehlert, S. Grimme, ChemRxiv, 2019, preprint.
     DOI: 10.26434/chemrxiv.8326202.v1
   
   for DFT-D4:
   * E. Caldeweyher, C. Bannwarth and S. Grimme, J. Chem. Phys., 2017,
     147, 034112. DOI: 10.1063/1.4993215
   * E. Caldeweyher, S. Ehlert, A. Hansen, H. Neugebauer, S. Spicher,
     C. Bannwarth and S. Grimme, J. Chem. Phys., 2019, 150, 154122.
     DOI: 10.1063/1.5090222
   
   for sTDA-xTB:
   * S. Grimme and C. Bannwarth, J. Chem. Phys., 2016, 145, 054103.
     DOI: 10.1063/1.4959605
   
   in the mass-spec context:
   * V. Asgeirsson, C. Bauer and S. Grimme, Chem. Sci., 2017, 8, 4879.
     DOI: 10.1039/c7sc00601b
   
   for metadynamics refer to:
   * S. Grimme, J. Chem. Theory Comput., 2019, 155, 2847-2862
     DOI: 10.1021/acs.jctc.9b00143
   
   with help from (in alphabetical order)
   C. Bannwarth, F. Bohle, G. Brandenburg, E. Caldeweyher, M. Checinski,
   S. Dohm, S. Ehlert, S. Ehrlich, F. März, H. Neugebauer, J. Pisarek,
   P. Pracht, P. Shushkov, and S. Spicher.
   
 * started run on 2020/05/12 at 11:44:46.420     

           -------------------------------------------------
          |                Calculation Setup                |
           -------------------------------------------------

          program call               : xtb --input H2C2N1_5_S_1.input H2C2N1_5_S_1.xyz --ohess --molden --namespace H2C2N1_5_S_1 output.out
          calculation namespace      : H2C2N1_5_S_1
          coordinate file            : H2C2N1_5_S_1.xyz
          number of atoms            :                     5
          number of electrons        :                    15
          charge                     :                     0
          spin                       :                   0.5
          first test random number   :      0.80653607507218

   ID    Z sym.   atoms
    1    6 C      1, 3
    2    7 N      2
    3    1 H      4, 5

           -------------------------------------------------
          |                 G F N 2 - x T B                 |
           -------------------------------------------------

        Reference                      10.1021/acs.jctc.8b01176
      * Hamiltonian:
        H0-scaling (s, p, d)           1.850000    2.230000    2.230000
        zeta-weighting                 0.500000
      * Dispersion:
        s8                             2.700000
        a1                             0.520000
        a2                             5.000000
        s9                             5.000000
      * Repulsion:
        kExp                           1.500000    1.000000
        rExp                           1.000000
      * Coulomb:
        alpha                          2.000000
        third order                    shell-resolved
        anisotropic                    true
        a3                             3.000000
        a5                             4.000000
        cn-shift                       1.200000
        cn-exp                         4.000000
        max-rad                        5.000000


          ...................................................
          :                      SETUP                      :
          :.................................................:
          :  # basis functions                  14          :
          :  # atomic orbitals                  14          :
          :  # shells                            8          :
          :  # electrons                        15          :
          :  max. iterations                   250          :
          :  Hamiltonian                  GFN2-xTB          :
          :  restarted?                      false          :
          :  GBSA solvation                  false          :
          :  PC potential                    false          :
          :  electronic temp.          300.0000000     K    :
          :  accuracy                    1.0000000          :
          :  -> integral cutoff          0.2500000E+02      :
          :  -> integral neglect         0.1000000E-07      :
          :  -> SCF convergence          0.1000000E-05 Eh   :
          :  -> wf. convergence          0.1000000E-03 e    :
          :  Broyden damping             0.4000000          :
          ...................................................

 iter      E             dE          RMSdq      gap      omega  full diag
   1     -7.7947055 -0.779471E+01  0.785E+00    1.01       0.0  T
   2     -7.1670876  0.627618E+00  0.122E+01    0.81       1.0  T
   3     -7.9477108 -0.780623E+00  0.418E+00    0.45       1.0  T
   4     -7.7356412  0.212070E+00  0.660E+00    0.44       1.0  T
   5     -7.8825386 -0.146897E+00  0.391E+00    0.48       1.0  T
   6     -7.9597506 -0.772119E-01  0.204E+00    0.27       1.0  T
   7     -7.9636292 -0.387863E-02  0.180E+00    0.27       1.0  T
   8     -7.9779814 -0.143522E-01  0.419E-01    0.23       1.0  T
   9     -7.9782908 -0.309347E-03  0.295E-01    0.22       1.0  T
  10     -7.9785950 -0.304222E-03  0.145E-01    0.21       1.0  T
  11     -7.9786780 -0.830149E-04  0.400E-02    0.20       1.1  T
  12     -7.9786787 -0.626711E-06  0.402E-02    0.21       1.1  T
  13     -7.9786823 -0.363528E-05  0.272E-02    0.20       1.6  T
  14     -7.9786855 -0.319328E-05  0.962E-03    0.20       4.7  T
  15     -7.9786859 -0.380757E-06  0.154E-03    0.20      28.9  T
  16     -7.9786859 -0.108375E-07  0.593E-04    0.20      75.4  T
  17     -7.9786859 -0.123876E-08  0.335E-04    0.20     133.3  T

   *** convergence criteria satisfied after 17 iterations ***

         #    Occupation            Energy/Eh            Energy/eV
      -------------------------------------------------------------
         1        2.0000           -0.6420769             -17.4718
         2        2.0000           -0.5991055             -16.3025
         3        2.0000           -0.5448844             -14.8271
         4        2.0000           -0.5201371             -14.1536
         5        2.0000           -0.4780676             -13.0089
         6        2.0000           -0.4549456             -12.3797
         7        2.0000           -0.4391924             -11.9510
         8        0.9814           -0.3707808             -10.0895 (HOMO)
         9        0.0186           -0.3632480              -9.8845 (LUMO)
        10                         -0.3123075              -8.4983
        11                          0.0690684               1.8794
        12                          0.1011103               2.7514
        13                          0.1349652               3.6726
        14                          0.1607945               4.3754
      -------------------------------------------------------------
                  HL-Gap            0.0075327 Eh            0.2050 eV
             Fermi-level           -0.3860005 Eh          -10.5036 eV

 SCC (total)                   0 d,  0 h,  0 min,  0.003 sec
 SCC setup                      ...        0 min,  0.000 sec (  2.753%)
 Dispersion                     ...        0 min,  0.000 sec (  0.514%)
 integral evaluation            ...        0 min,  0.001 sec ( 23.868%)
 zeroth order Hamiltonian       ...        0 min,  0.000 sec (  0.522%)
 iterations                     ...        0 min,  0.001 sec ( 45.223%)
 molecular gradient             ...        0 min,  0.001 sec ( 23.959%)
 printout                       ...        0 min,  0.000 sec (  2.778%)

         :::::::::::::::::::::::::::::::::::::::::::::::::::::
         ::                     SUMMARY                     ::
         :::::::::::::::::::::::::::::::::::::::::::::::::::::
         :: total energy              -7.924304182016 Eh    ::
         :: gradient norm              0.338572681220 Eh/a0 ::
         :: HOMO-LUMO gap              0.204976217432 eV    ::
         ::.................................................::
         :: SCC energy                -7.978685877314 Eh    ::
         :: -> isotropic ES            0.006504376758 Eh    ::
         :: -> anisotropic ES          0.001556175741 Eh    ::
         :: -> anisotropic XC          0.014375726912 Eh    ::
         :: -> dispersion             -0.001490572190 Eh    ::
         :: repulsion energy           0.054381649926 Eh    ::
         :: add. restraining           0.000000000000 Eh    ::
         :::::::::::::::::::::::::::::::::::::::::::::::::::::

      ----------------------------------------------------------- 
     |                   =====================                   |
     |                        A N C O P T                        |
     |                   =====================                   |
     |               Approximate Normal Coordinate               |
     |                Rational Function Optimizer                |
      ----------------------------------------------------------- 

          ...................................................
          :                      SETUP                      :
          :.................................................:
          :   optimization level            normal          :
          :   max. optcycles                   200          :
          :   ANC micro-cycles                  20          :
          :   degrees of freedom                 9          :
          :.................................................:
          :   RF solver                   davidson          :
          :   write xtbopt.log                true          :
          :   linear?                        false          :
          :   energy convergence         0.5000000E-05 Eh   :
          :   grad. convergence          0.1000000E-02 Eh/α :
          :   maximium RF displ.         1.0000000          :
          :   Hlow (freq-cutoff)         0.1000000E-01      :
          :   Hmax (freq-cutoff)         5.0000000          :
          :   S6 in model hess.         20.0000000          :
          ...................................................

generating ANC from model Hessian ...
Using Lindh-Hessian (1995)
 Shifting diagonal of input Hessian by    0.0000000000000000     
 Lowest  eigenvalues of input Hessian
    0.000000    0.000000    0.000000    0.000000    0.000000    0.000000
    0.010211    0.029681    0.081120    0.098047    0.134223    0.526605
    0.900561    0.975971    1.122976
 Highest eigenvalues
    0.098047    0.134223    0.526605    0.900561    0.975971    1.122976


........................................................................
.............................. CYCLE    1 ..............................
........................................................................
   1     -7.9786859 -0.797869E+01  0.286E-05    0.20       0.0  T
   2     -7.9786859  0.131877E-09  0.157E-04    0.20     285.3  T
   3     -7.9786859 -0.132598E-09  0.244E-05    0.20    1834.3  T
     SCC iter.                  ...        0 min,  0.000 sec
     gradient                   ...        0 min,  0.001 sec
 * total energy  :    -7.9243042 Eh     change       -0.9449614E-09 Eh
   gradient norm :     0.3385696 Eh/α   predicted     0.0000000E+00 (-100.00%)
   displ. norm   :     0.4509841 α      lambda       -0.1298952E+00
   maximum displ.:     0.2473899 α      in ANC's #7, #2, #6, ...

........................................................................
.............................. CYCLE    2 ..............................
........................................................................
   1     -8.1377536 -0.813775E+01  0.213E+00    1.84       0.0  T
   2     -8.1378557 -0.102093E-03  0.133E+00    1.63       1.0  T
   3     -8.1337694  0.408625E-02  0.996E-01    1.95       1.0  T
   4     -8.1385537 -0.478423E-02  0.357E-01    1.75       1.0  T
   5     -8.1392658 -0.712184E-03  0.713E-02    1.74       1.0  T
   6     -8.1392719 -0.606902E-05  0.129E-02    1.75       3.5  T
   7     -8.1392720 -0.529813E-07  0.493E-03    1.75       9.1  T
   8     -8.1392720 -0.120727E-07  0.565E-04    1.75      79.2  T
   9     -8.1392720 -0.232248E-09  0.646E-05    1.75     691.9  T
     SCC iter.                  ...        0 min,  0.001 sec
     gradient                   ...        0 min,  0.001 sec
 * total energy  :    -8.0340231 Eh     change       -0.1097189E+00 Eh
   gradient norm :     0.2136787 Eh/α   predicted    -0.7815705E-01 ( -28.77%)
   displ. norm   :     0.4717217 α      lambda       -0.9767826E-01
   maximum displ.:     0.3225605 α      in ANC's #7, #6, #9, ...

........................................................................
.............................. CYCLE    3 ..............................
........................................................................
   1     -8.3287558 -0.832876E+01  0.253E+00    5.41       0.0  T
   2     -8.3304815 -0.172565E-02  0.153E+00    4.99       1.0  T
   3     -8.3291166  0.136486E-02  0.708E-01    5.26       1.0  T
   4     -8.3312172 -0.210054E-02  0.120E-01    5.08       1.0  T
   5     -8.3312569 -0.396990E-04  0.356E-02    5.07       1.3  T
   6     -8.3312573 -0.463550E-06  0.771E-03    5.08       5.8  T
   7     -8.3312575 -0.186817E-06  0.243E-03    5.08      18.4  T
   8     -8.3312575 -0.625135E-08  0.307E-04    5.08     145.9  T
   9     -8.3312575 -0.628475E-11  0.591E-05    5.08     757.2  T
     SCC iter.                  ...        0 min,  0.001 sec
     gradient                   ...        0 min,  0.001 sec
 * total energy  :    -7.9985802 Eh     change        0.3544295E-01 Eh
   gradient norm :     0.8175916 Eh/α   predicted    -0.5970688E-01 (-268.46%)
   displ. norm   :     0.3894247 α      lambda       -0.2168442E+00
   maximum displ.:     0.2768490 α      in ANC's #2, #5, #9, ...

........................................................................
.............................. CYCLE    4 ..............................
........................................................................
   1     -8.2259025 -0.822590E+01  0.219E+00    3.75       0.0  T
   2     -8.2256198  0.282785E-03  0.167E+00    4.37       1.0  T
   3     -8.2299779 -0.435819E-02  0.977E-01    4.05       1.0  T
   4     -8.2321140 -0.213601E-02  0.561E-01    4.12       1.0  T
   5     -8.2332346 -0.112062E-02  0.939E-02    4.19       1.0  T
   6     -8.2332430 -0.844919E-05  0.152E-02    4.19       2.9  T
   7     -8.2332432 -0.213683E-06  0.453E-03    4.19       9.9  T
   8     -8.2332433 -0.148092E-07  0.134E-03    4.19      33.4  T
   9     -8.2332433 -0.132202E-08  0.274E-04    4.19     163.2  T
  10     -8.2332433 -0.587796E-11  0.105E-04    4.19     424.8  T
     SCC iter.                  ...        0 min,  0.001 sec
     gradient                   ...        0 min,  0.001 sec
 * total energy  :    -8.0789171 Eh     change       -0.8033695E-01 Eh
   gradient norm :     0.1125266 Eh/α   predicted    -0.1248645E+00 (  55.43%)
   displ. norm   :     0.5930888 α      lambda       -0.2104815E-01
   maximum displ.:     0.5713231 α      in ANC's #2, #9, #7, ...

........................................................................
.............................. CYCLE    5 ..............................
........................................................................
   1     -8.2088612 -0.820886E+01  0.132E+00    3.83       0.0  T
   2     -8.2091636 -0.302386E-03  0.711E-01    3.97       1.0  T
   3     -8.2084070  0.756526E-03  0.480E-01    3.79       1.0  T
   4     -8.2093424 -0.935340E-03  0.167E-01    3.89       1.0  T
   5     -8.2094721 -0.129678E-03  0.420E-02    3.90       1.1  T
   6     -8.2094745 -0.239173E-05  0.802E-03    3.90       5.6  T
   7     -8.2094745 -0.120036E-07  0.200E-03    3.90      22.4  T
   8     -8.2094745 -0.433746E-08  0.627E-04    3.90      71.3  T
   9     -8.2094745 -0.338217E-09  0.138E-04    3.90     324.9  T
     SCC iter.                  ...        0 min,  0.001 sec
     gradient                   ...        0 min,  0.001 sec
 * total energy  :    -8.0857596 Eh     change       -0.6842468E-02 Eh
   gradient norm :     0.1477954 Eh/α   predicted    -0.1422597E-01 ( 107.91%)
   displ. norm   :     0.1433601 α      lambda       -0.1109183E-01
   maximum displ.:     0.1171030 α      in ANC's #2, #5, #7, ...

........................................................................
.............................. CYCLE    6 ..............................
........................................................................
   1     -8.2421218 -0.824212E+01  0.530E-01    4.33       0.0  T
   2     -8.2422087 -0.869883E-04  0.304E-01    4.23       1.0  T
   3     -8.2421398  0.689759E-04  0.183E-01    4.30       1.0  T
   4     -8.2422511 -0.111315E-03  0.741E-02    4.25       1.0  T
   5     -8.2422759 -0.248476E-04  0.105E-02    4.25       4.3  T
   6     -8.2422759 -0.475805E-08  0.142E-03    4.25      31.4  T
   7     -8.2422759 -0.130816E-08  0.518E-04    4.25      86.4  T
   8     -8.2422759 -0.199989E-09  0.937E-05    4.25     477.1  T
     SCC iter.                  ...        0 min,  0.001 sec
     gradient                   ...        0 min,  0.001 sec
 * total energy  :    -8.0926032 Eh     change       -0.6843636E-02 Eh
   gradient norm :     0.0560374 Eh/α   predicted    -0.5659895E-02 ( -17.30%)
   displ. norm   :     0.1874513 α      lambda       -0.8168960E-02
   maximum displ.:     0.1349385 α      in ANC's #6, #5, #9, ...

........................................................................
.............................. CYCLE    7 ..............................
........................................................................
   1     -8.2670982 -0.826710E+01  0.595E-01    4.52       0.0  T
   2     -8.2671404 -0.421904E-04  0.331E-01    4.53       1.0  T
   3     -8.2671233  0.171190E-04  0.920E-02    4.53       1.0  T
   4     -8.2671534 -0.301400E-04  0.271E-02    4.53       1.6  T
   5     -8.2671543 -0.842125E-06  0.107E-02    4.53       4.2  T
   6     -8.2671547 -0.381742E-06  0.362E-03    4.53      12.3  T
   7     -8.2671547 -0.233405E-08  0.390E-04    4.53     114.5  T
   8     -8.2671547 -0.159815E-09  0.193E-04    4.53     231.6  T
     SCC iter.                  ...        0 min,  0.001 sec
     gradient                   ...        0 min,  0.001 sec
 * total energy  :    -8.0970114 Eh     change       -0.4408141E-02 Eh
   gradient norm :     0.0322574 Eh/α   predicted    -0.4227998E-02 (  -4.09%)
   displ. norm   :     0.2932770 α      lambda       -0.6567745E-02
   maximum displ.:     0.1928597 α      in ANC's #2, #6, #4, ...

........................................................................
.............................. CYCLE    8 ..............................
........................................................................
   1     -8.2695932 -0.826959E+01  0.843E-01    4.49       0.0  T
   2     -8.2696468 -0.535993E-04  0.488E-01    4.55       1.0  T
   3     -8.2691698  0.477006E-03  0.375E-01    4.49       1.0  T
   4     -8.2698000 -0.630242E-03  0.484E-02    4.52       1.0  T
   5     -8.2698046 -0.462590E-05  0.214E-02    4.53       2.1  T
   6     -8.2698050 -0.324839E-06  0.383E-03    4.53      11.7  T
   7     -8.2698050 -0.220937E-08  0.755E-04    4.53      59.2  T
   8     -8.2698050 -0.655577E-09  0.114E-04    4.53     391.4  T
     SCC iter.                  ...        0 min,  0.001 sec
     gradient                   ...        0 min,  0.001 sec
 * total energy  :    -8.1011140 Eh     change       -0.4102681E-02 Eh
   gradient norm :     0.0262197 Eh/α   predicted    -0.3566321E-02 ( -13.07%)
   displ. norm   :     0.1900296 α      lambda       -0.2009686E-02
   maximum displ.:     0.1353577 α      in ANC's #2, #6, #9, ...

........................................................................
.............................. CYCLE    9 ..............................
........................................................................
   1     -8.2609754 -0.826098E+01  0.580E-01    4.40       0.0  T
   2     -8.2610137 -0.383358E-04  0.316E-01    4.42       1.0  T
   3     -8.2609976  0.161257E-04  0.890E-02    4.40       1.0  T
   4     -8.2610254 -0.277640E-04  0.293E-02    4.41       1.5  T
   5     -8.2610269 -0.156745E-05  0.150E-02    4.42       3.0  T
   6     -8.2610277 -0.798862E-06  0.274E-03    4.41      16.3  T
   7     -8.2610277 -0.367760E-08  0.361E-04    4.41     123.9  T
   8     -8.2610277 -0.425741E-09  0.100E-04    4.41     447.4  T
     SCC iter.                  ...        0 min,  0.000 sec
     gradient                   ...        0 min,  0.001 sec
 * total energy  :    -8.1019604 Eh     change       -0.8463956E-03 Eh
   gradient norm :     0.0383502 Eh/α   predicted    -0.1041130E-02 (  23.01%)
   displ. norm   :     0.0310721 α      lambda       -0.9673823E-03
   maximum displ.:     0.0189171 α      in ANC's #9, #2, #6, ...

........................................................................
.............................. CYCLE   10 ..............................
........................................................................
   1     -8.2708369 -0.827084E+01  0.126E-01    4.58       0.0  T
   2     -8.2708438 -0.689738E-05  0.740E-02    4.55       1.0  T
   3     -8.2708415  0.233487E-05  0.478E-02    4.57       1.0  T
   4     -8.2708481 -0.661265E-05  0.173E-02    4.56       2.6  T
   5     -8.2708492 -0.112791E-05  0.252E-03    4.56      17.8  T
   6     -8.2708492 -0.657227E-09  0.354E-04    4.56     126.4  T
   7     -8.2708492 -0.150635E-10  0.918E-05    4.56     487.0  T
     SCC iter.                  ...        0 min,  0.000 sec
     gradient                   ...        0 min,  0.001 sec
 * total energy  :    -8.1024454 Eh     change       -0.4850012E-03 Eh
   gradient norm :     0.0071861 Eh/α   predicted    -0.4841571E-03 (  -0.17%)
   displ. norm   :     0.0485774 α      lambda       -0.2187816E-03
   maximum displ.:     0.0323699 α      in ANC's #6, #4, #9, ...

........................................................................
.............................. CYCLE   11 ..............................
........................................................................
   1     -8.2722543 -0.827225E+01  0.145E-01    4.56       0.0  T
   2     -8.2722566 -0.227980E-05  0.809E-02    4.57       1.0  T
   3     -8.2722517  0.484912E-05  0.338E-02    4.56       1.3  T
   4     -8.2722578 -0.600849E-05  0.795E-03    4.57       5.6  T
   5     -8.2722579 -0.968638E-07  0.315E-03    4.57      14.2  T
   6     -8.2722579 -0.213194E-07  0.639E-04    4.57      70.0  T
   7     -8.2722579 -0.665157E-10  0.749E-05    4.57     597.0  T
     SCC iter.                  ...        0 min,  0.000 sec
     gradient                   ...        0 min,  0.001 sec
 * total energy  :    -8.1025795 Eh     change       -0.1340738E-03 Eh
   gradient norm :     0.0039303 Eh/α   predicted    -0.1096477E-03 ( -18.22%)
   displ. norm   :     0.0322192 α      lambda       -0.4034428E-04
   maximum displ.:     0.0170442 α      in ANC's #6, #9, #1, ...

........................................................................
.............................. CYCLE   12 ..............................
........................................................................
   1     -8.2722684 -0.827227E+01  0.102E-01    4.57       0.0  T
   2     -8.2722694 -0.965635E-06  0.560E-02    4.57       1.0  T
   3     -8.2722693  0.112945E-06  0.105E-02    4.57       4.3  T
   4     -8.2722697 -0.427627E-06  0.432E-03    4.57      10.4  T
   5     -8.2722697 -0.304189E-07  0.120E-03    4.57      37.2  T
   6     -8.2722697 -0.418973E-08  0.436E-04    4.57     102.6  T
   7     -8.2722697 -0.388667E-10  0.255E-05    4.57    1751.4  T
     SCC iter.                  ...        0 min,  0.000 sec
     gradient                   ...        0 min,  0.001 sec
 * total energy  :    -8.1025938 Eh     change       -0.1428911E-04 Eh
   gradient norm :     0.0044665 Eh/α   predicted    -0.2019265E-04 (  41.31%)
   displ. norm   :     0.0756944 α      lambda       -0.8015013E-04
   maximum displ.:     0.0555932 α      in ANC's #1, #6, #9, ...

........................................................................
.............................. CYCLE   13 ..............................
........................................................................
   1     -8.2717638 -0.827176E+01  0.238E-01    4.56       0.0  T
   2     -8.2717684 -0.455184E-05  0.131E-01    4.57       1.0  T
   3     -8.2717699 -0.151613E-05  0.112E-02    4.56       4.0  T
   4     -8.2717697  0.160386E-06  0.808E-03    4.57       5.5  T
   5     -8.2717700 -0.276351E-06  0.193E-03    4.57      23.1  T
   6     -8.2717700 -0.630276E-08  0.948E-04    4.56      47.2  T
   7     -8.2717700 -0.643055E-09  0.707E-05    4.56     632.9  T
     SCC iter.                  ...        0 min,  0.000 sec
     gradient                   ...        0 min,  0.001 sec
 * total energy  :    -8.1024734 Eh     change        0.1204107E-03 Eh
   gradient norm :     0.0112558 Eh/α   predicted    -0.4030440E-04 (-133.47%)
   displ. norm   :     0.0634140 α      lambda       -0.2711544E-03
   maximum displ.:     0.0418344 α      in ANC's #1, #6, #9, ...

........................................................................
.............................. CYCLE   14 ..............................
........................................................................
   1     -8.2727175 -0.827272E+01  0.197E-01    4.58       0.0  T
   2     -8.2727207 -0.327222E-05  0.108E-01    4.57       1.0  T
   3     -8.2727206  0.113243E-06  0.181E-02    4.58       2.5  T
   4     -8.2727218 -0.120857E-05  0.818E-03    4.58       5.5  T
   5     -8.2727219 -0.113095E-06  0.257E-03    4.58      17.4  T
   6     -8.2727220 -0.177706E-07  0.902E-04    4.58      49.6  T
   7     -8.2727220 -0.189816E-09  0.667E-05    4.58     670.1  T
     SCC iter.                  ...        0 min,  0.000 sec
     gradient                   ...        0 min,  0.001 sec
 * total energy  :    -8.1026102 Eh     change       -0.1368525E-03 Eh
   gradient norm :     0.0022318 Eh/α   predicted    -0.1361212E-03 (  -0.53%)
   displ. norm   :     0.0033888 α      lambda       -0.5238843E-05
   maximum displ.:     0.0019412 α      in ANC's #7, #6, #1, ...

........................................................................
.............................. CYCLE   15 ..............................
........................................................................
   1     -8.2725905 -0.827259E+01  0.862E-03    4.57       0.0  T
   2     -8.2725905 -0.390915E-08  0.509E-03    4.57       8.8  T
   3     -8.2725904  0.411226E-07  0.322E-03    4.57      13.9  T
   4     -8.2725905 -0.472449E-07  0.396E-04    4.57     113.1  T
   5     -8.2725905 -0.415881E-10  0.169E-04    4.57     264.4  T
     SCC iter.                  ...        0 min,  0.001 sec
     gradient                   ...        0 min,  0.001 sec
 * total energy  :    -8.1026147 Eh     change       -0.4497917E-05 Eh
   gradient norm :     0.0017372 Eh/α   predicted    -0.2620628E-05 ( -41.74%)
   displ. norm   :     0.0179639 α      lambda       -0.1523160E-04
   maximum displ.:     0.0130721 α      in ANC's #7, #6, #4, ...

........................................................................
.............................. CYCLE   16 ..............................
........................................................................
   1     -8.2724792 -0.827248E+01  0.509E-02    4.58       0.0  T
   2     -8.2724793 -0.794022E-07  0.304E-02    4.58       1.5  T
   3     -8.2724791  0.175108E-06  0.703E-03    4.57       6.4  T
   4     -8.2724793 -0.220103E-06  0.170E-03    4.58      26.3  T
   5     -8.2724793 -0.114886E-08  0.276E-04    4.58     161.9  T
   6     -8.2724793 -0.410498E-10  0.731E-05    4.58     611.6  T
     SCC iter.                  ...        0 min,  0.000 sec
     gradient                   ...        0 min,  0.001 sec
 * total energy  :    -8.1026214 Eh     change       -0.6681298E-05 Eh
   gradient norm :     0.0007633 Eh/α   predicted    -0.7617302E-05 (  14.01%)
   displ. norm   :     0.0061502 α      lambda       -0.2152639E-05
   maximum displ.:     0.0033287 α      in ANC's #7, #6, #4, ...

........................................................................
.............................. CYCLE   17 ..............................
........................................................................
   1     -8.2727004 -0.827270E+01  0.166E-02    4.58       0.0  T
   2     -8.2727004 -0.104328E-07  0.982E-03    4.58       4.6  T
   3     -8.2727004  0.361600E-08  0.142E-03    4.58      31.5  T
   4     -8.2727004 -0.634690E-08  0.685E-04    4.58      65.3  T
   5     -8.2727004 -0.887047E-09  0.333E-04    4.58     134.4  T
     SCC iter.                  ...        0 min,  0.000 sec
     gradient                   ...        0 min,  0.001 sec
 * total energy  :    -8.1026229 Eh     change       -0.1518490E-05 Eh
   gradient norm :     0.0002581 Eh/α   predicted    -0.1077661E-05 ( -29.03%)
   displ. norm   :     0.0006934 α      lambda       -0.6568165E-07
   maximum displ.:     0.0004275 α      in ANC's #1, #4, #2, ...

   *** GEOMETRY OPTIMIZATION CONVERGED AFTER 17 ITERATIONS ***

------------------------------------------------------------------------
 total energy gain   :        -0.1783188 Eh     -111.8967 kcal/mol
 total RMSD          :         0.9162789 a0        0.4849 Å
 total power (kW/mol):       -27.5397544 (step)********** (real)
------------------------------------------------------------------------

 ANCopt (total)                0 d,  0 h,  0 min,  0.034 sec
 optimizer setup                ...        0 min,  0.000 sec (  0.202%)
 model hessian                  ...        0 min,  0.000 sec (  0.346%)
 ANC generation                 ...        0 min,  0.000 sec (  0.160%)
 coordinate transformation      ...        0 min,  0.000 sec (  0.108%)
 single point calculation       ...        0 min,  0.032 sec ( 95.310%)
 optimization log               ...        0 min,  0.000 sec (  1.203%)
 hessian update                 ...        0 min,  0.000 sec (  0.106%)
 rational function              ...        0 min,  0.000 sec (  1.076%)

================
 final structure:
================
5
 xtb: 6.2.2 (9d81278992624c895f80dd42a50cac0aa55982e2)
C         0.78221979771097   -0.15304542058841    0.02694944416918
N         1.92240994262520   -0.37651524312284    0.06627555197552
C        -0.54613877584476    0.10698314034991   -0.01872300660639
H        -1.24087308297777   -0.51761063041857    0.51300770978160
H        -0.91761888151364    0.94018915377990   -0.58750969931991

 Bond Distances (Angstroems)
 ---------------------------
C1-N2=1.1625         C1-C3=1.3543         N2-C1=1.1625         C3-C1=1.3543         C3-H4=1.0749         C3-H5=1.0751         
H4-C3=1.0749         H5-C3=1.0751         
 C  H  Rav=1.0750 sigma=0.0001  Rmin=1.0749  Rmax=1.0751     2
 C  C  Rav=1.3543 sigma=0.0000  Rmin=1.3543  Rmax=1.3543     1
 N  C  Rav=1.1625 sigma=0.0000  Rmin=1.1625  Rmax=1.1625     1

 selected bond angles (degree)
 --------------------
C3-C1-N2=179.99                H4-C3-C1=120.38                H5-C3-C1=120.37                H5-C3-H4=119.26                

 selected dihedral angles (degree)
 ---------------------------------
H4-C3-C1-N2= 12.21            H5-C3-C1-N2=192.23            
           -------------------------------------------------
          |                Final Singlepoint                |
           -------------------------------------------------

          ...................................................
          :                      SETUP                      :
          :.................................................:
          :  # basis functions                  14          :
          :  # atomic orbitals                  14          :
          :  # shells                            8          :
          :  # electrons                        15          :
          :  max. iterations                   250          :
          :  Hamiltonian                  GFN2-xTB          :
          :  restarted?                      false          :
          :  GBSA solvation                  false          :
          :  PC potential                    false          :
          :  electronic temp.          300.0000000     K    :
          :  accuracy                    1.0000000          :
          :  -> integral cutoff          0.2500000E+02      :
          :  -> integral neglect         0.1000000E-07      :
          :  -> SCF convergence          0.1000000E-05 Eh   :
          :  -> wf. convergence          0.1000000E-03 e    :
          :  Broyden damping             0.4000000          :
          ...................................................

 iter      E             dE          RMSdq      gap      omega  full diag
   1     -8.2727004 -0.827270E+01  0.895E-05    4.58       0.0  T
   2     -8.2727004 -0.123102E-11  0.436E-05    4.58    1024.6  T
   3     -8.2727004  0.136957E-11  0.427E-05    4.58    1046.9  T

   *** convergence criteria satisfied after 3 iterations ***

         #    Occupation            Energy/Eh            Energy/eV
      -------------------------------------------------------------
         1        2.0000           -0.6550335             -17.8244
         2        2.0000           -0.6333483             -17.2343
         3        2.0000           -0.5481720             -14.9165
         4        2.0000           -0.5358354             -14.5808
         5        2.0000           -0.5035904             -13.7034
         6        2.0000           -0.4668743             -12.7043
         7        2.0000           -0.4334183             -11.7939
         8        1.0000           -0.3846180             -10.4660 (HOMO)
         9                         -0.2163877              -5.8882 (LUMO)
        10                         -0.1640090              -4.4629
        11                          0.0997885               2.7154
        12                          0.2904119               7.9025
        13                          0.2913042               7.9268
        14                          1.1460710              31.1862
      -------------------------------------------------------------
                  HL-Gap            0.1682303 Eh            4.5778 eV
             Fermi-level           -0.3547605 Eh           -9.6535 eV

 SCC (total)                   0 d,  0 h,  0 min,  0.002 sec
 SCC setup                      ...        0 min,  0.000 sec (  2.819%)
 Dispersion                     ...        0 min,  0.000 sec (  0.472%)
 integral evaluation            ...        0 min,  0.001 sec ( 40.269%)
 zeroth order Hamiltonian       ...        0 min,  0.000 sec (  0.601%)
 iterations                     ...        0 min,  0.000 sec ( 12.536%)
 molecular gradient             ...        0 min,  0.001 sec ( 40.083%)
 printout                       ...        0 min,  0.000 sec (  2.590%)

         :::::::::::::::::::::::::::::::::::::::::::::::::::::
         ::                     SUMMARY                     ::
         :::::::::::::::::::::::::::::::::::::::::::::::::::::
         :: total energy              -8.102622936039 Eh    ::
         :: gradient norm              0.000273029509 Eh/a0 ::
         :: HOMO-LUMO gap              4.577779643607 eV    ::
         ::.................................................::
         :: SCC energy                -8.272700392261 Eh    ::
         :: -> isotropic ES            0.008271979472 Eh    ::
         :: -> anisotropic ES          0.000763147746 Eh    ::
         :: -> anisotropic XC          0.020107899873 Eh    ::
         :: -> dispersion             -0.001475634421 Eh    ::
         :: repulsion energy           0.170077437997 Eh    ::
         :: add. restraining           0.000000000000 Eh    ::
         :::::::::::::::::::::::::::::::::::::::::::::::::::::

           ------------------------------------------------- 
          |                Numerical Hessian                |
           ------------------------------------------------- 
step length          :   0.00500
SCC accuracy         :   0.30000
Hessian scale factor :   1.00000
frozen atoms in %    :   0.00000    0
RMS gradient         :   0.00027
estimated CPU  time      0.00 min
estimated wall time      0.00 min

writing file <hessian>.

 projected vibrational frequencies (cm-1)
eigval :       -0.00    -0.00    -0.00    -0.00     0.00     0.00
eigval :      371.78   383.03   681.51   924.76  1136.33  1352.21
eigval :     2198.85  3110.80  3147.48
           -------------------------------------------------
          |                Property Printout                |
           -------------------------------------------------

    * Orbital Energies and Occupations

         #    Occupation            Energy/Eh            Energy/eV
      -------------------------------------------------------------
         1        2.0000           -0.6550335             -17.8244
         2        2.0000           -0.6333484             -17.2343
         3        2.0000           -0.5481721             -14.9165
         4        2.0000           -0.5358356             -14.5808
         5        2.0000           -0.5035904             -13.7034
         6        2.0000           -0.4668742             -12.7043
         7        2.0000           -0.4334182             -11.7939
         8        1.0000           -0.3846181             -10.4660 (HOMO)
         9                         -0.2163876              -5.8882 (LUMO)
        10                         -0.1640090              -4.4629
        11                          0.0997884               2.7154
        12                          0.2904117               7.9025
        13                          0.2913041               7.9268
        14                          1.1460710              31.1862
      -------------------------------------------------------------
                  HL-Gap            0.1682304 Eh            4.5778 eV
             Fermi-level           -0.3547605 Eh           -9.6535 eV

     #   Z        covCN         q      C6AA      α(0)
     1   6 C      1.891     0.121    28.131     8.566
     2   7 N      0.911    -0.220    25.811     7.348
     3   6 C      2.834    -0.072    29.792     8.944
     4   1 H      0.926     0.086     1.921     2.167
     5   1 H      0.926     0.086     1.921     2.168

 Mol. C6AA /au·bohr⁶  :        345.625706
 Mol. C8AA /au·bohr⁸  :       8329.795827
 Mol. α(0) /au        :         29.193141


Wiberg/Mayer (AO) data.
largest (>0.10) Wiberg bond orders for each atom
          total WBO             WBO to atom ...
     1  C   3.955        N    2 2.561    C    3 1.380
     2  N   2.666        C    1 2.561
     3  C   3.327        C    1 1.380    H    5 0.953    H    4 0.953
     4  H   0.993        C    3 0.953
     5  H   0.993        C    3 0.953

MOs/occ written to file <molden.input>


molecular dipole:
                 x           y           z       tot (Debye)
 q only:       -0.897       0.176      -0.031
   full:       -1.390       0.272      -0.048       3.603
molecular quadrupole (traceless):
                xx          xy          yy          xz          yz          zz
 q only:       -2.208       0.699       1.153      -0.186      -0.348       1.055
  q+dip:       -3.105       1.037       1.788      -0.364      -1.043       1.317
   full:       -4.945       1.543       2.518      -0.376      -0.567       2.427

           -------------------------------------------------
          |                Geometry Summary                 |
           -------------------------------------------------

      molecular mass/u    :       40.0440565
Molecule has the following symmetry elements: (C2) 2*(sigma) 
It seems to be the C2v point group
   center of mass at/Å    :        0.6889031      -0.1348811       0.0237720
  moments of inertia/u·Å² :        0.1734068E+01   0.4785958E+02   0.4959365E+02
rotational constants/cm⁻¹ :        0.9721439E+01   0.3522311E+00   0.3399152E+00

 * 4 selected distances

     #   Z        #   Z                                     value/Å
     1   6 C      2   7 N                                 1.1625484
     1   6 C      3   6 C                                 1.3543402 (max)
     3   6 C      4   1 H                                 1.0749468 (min)
     3   6 C      5   1 H                                 1.0750572

 * 3 distinct bonds (by element types)

   Z      Z             #   av. dist./Å        max./Å        min./Å
   1 H    6 C           2     1.0750020     1.0750572     1.0749468
   6 C    6 C           1     1.3543402     1.3543402     1.3543402
   6 C    7 N           1     1.1625484     1.1625484     1.1625484

           -------------------------------------------------
          |               Frequency Printout                |
           -------------------------------------------------
 projected vibrational frequencies (cm-1)
eigval :       -0.00    -0.00    -0.00    -0.00     0.00     0.00
eigval :      371.78   383.03   681.51   924.76  1136.33  1352.21
eigval :     2198.85  3110.80  3147.48
 reduced masses (amu)
   1:  6.27   2: 11.34   3:  9.63   4: 13.47   5: 13.36   6:  5.89   7:  9.49   8: 11.07
   9:  4.38  10:  5.20  11:  9.17  12:  4.53  13: 12.73  14:  1.45  15:  2.13
 IR intensities (amu)
   1:  0.07   2:  0.08   3:  0.24   4:  0.23   5:  0.22   6:  0.09   7:  0.28   8:  0.42
   9:  0.34  10:  0.14  11:  0.01  12:  0.14  13:  0.82  14:  0.05  15:  0.05
 Raman intensities (amu)
   1:  0.00   2:  0.00   3:  0.00   4:  0.00   5:  0.00   6:  0.00   7:  0.00   8:  0.00
   9:  0.00  10:  0.00  11:  0.00  12:  0.00  13:  0.00  14:  0.00  15:  0.00
 output can be read by thermo (or use thermo option).
 writing <g98.out> molden fake output.
 recommended (thermochemical) frequency scaling factor: 1.0
           -------------------------------------------------
          |             Thermodynamic Functions             |
           -------------------------------------------------

c2v symmetry found (for desy threshold:  0.10E+00) used in thermo

          ...................................................
          :                      SETUP                      :
          :.................................................:
          :  # frequencies                           9      :
          :  # imaginary freq.                       0      :
          :  linear?                             false      :
          :  only rotor calc.                    false      :
          :  symmetry                              c2v      :
          :  rotational number                       2      :
          :  scaling factor                  1.0000000      :
          :  rotor cutoff                   50.0000000 cm⁻¹ :
          :  imag. cutoff                  -20.0000000 cm⁻¹ :
          :.................................................:

    mode    ω/cm⁻¹     T·S(HO)/kcal·mol⁻¹    T·S(FR)/kcal·mol⁻¹   T·S(vib)
   ------------------------------------------------------------------------
   ------------------------------------------------------------------------

   temp. (K)  partition function   enthalpy   heat capacity  entropy
                                   cal/mol     cal/K/mol   cal/K/mol   J/K/mol
 298.15  VIB   1.50                  542.467      4.749      2.632
         ROT  0.245E+04              888.752      2.981     18.489
         INT  0.369E+04             1431.219      7.730     21.121
         TR   0.245E+27             1481.254      4.968     36.973
         TOT                        2912.4733    12.6983    58.0943   243.0665

   temp. (K)  partition function   enthalpy   heat capacity  entropy
                                   cal/mol     cal/K/mol   cal/K/mol   J/K/mol
 120.00  VIB   1.02                   24.266      0.943      0.247
         ROT   626.                  357.707      2.981     15.777
         INT   640.                  381.973      3.924     16.023
         TR   0.626E+26              596.178      4.968     32.454
         TOT                         978.1511     8.8925    48.4770   202.8278

   temp. (K)  partition function   enthalpy   heat capacity  entropy
                                   cal/mol     cal/K/mol   cal/K/mol   J/K/mol
 100.00  VIB   1.01                    9.633      0.530      0.114
         ROT   476.                  298.089      2.981     15.233
         INT   480.                  307.722      3.511     15.347
         TR   0.476E+26              496.815      4.968     31.549
         TOT                         804.5372     8.4790    46.8958   196.2122

   temp. (K)  partition function   enthalpy   heat capacity  entropy
                                   cal/mol     cal/K/mol   cal/K/mol   J/K/mol
  80.00  VIB   1.00                    2.455      0.209      0.035
         ROT   341.                  238.471      2.981     14.568
         INT   341.                  240.926      3.190     14.603
         TR   0.341E+26              397.452      4.968     30.440
         TOT                         638.3781     8.1579    45.0437   188.4629

   temp. (K)  partition function   enthalpy   heat capacity  entropy
                                   cal/mol     cal/K/mol   cal/K/mol   J/K/mol
  60.00  VIB   1.00                    0.255      0.038      0.005
         ROT   221.                  178.853      2.981     13.710
         INT   221.                  179.109      3.019     13.715
         TR   0.221E+26              298.089      4.968     29.012
         TOT                         477.1977     7.9875    42.7270   178.7696

   temp. (K)  partition function   enthalpy   heat capacity  entropy
                                   cal/mol     cal/K/mol   cal/K/mol   J/K/mol
  40.00  VIB   1.00                    0.003      0.001     -0.000
         ROT   120.                  119.236      2.981     12.502
         INT   120.                  119.238      2.982     12.501
         TR   0.120E+26              198.726      4.968     26.999
         TOT                         317.9644     7.9500    39.5000   165.2679

   temp. (K)  partition function   enthalpy   heat capacity  entropy
                                   cal/mol     cal/K/mol   cal/K/mol   J/K/mol
  20.00  VIB   1.00                    0.000      0.000     -0.001
         ROT   42.6                   59.618      2.981     10.436
         INT   42.6                   59.618      2.981     10.435
         TR   0.426E+25               99.363      4.968     23.557
         TOT                         158.9808     7.9490    33.9913   142.2195

   temp. (K)  partition function   enthalpy   heat capacity  entropy
                                   cal/mol     cal/K/mol   cal/K/mol   J/K/mol
  10.00  VIB   1.00                    0.000      0.000     -0.001
         ROT   15.1                   29.809      2.981      8.369
         INT   15.1                   29.809      2.981      8.368
         TR   0.151E+25               49.681      4.968     20.115
         TOT                          79.4904     7.9490    28.4826   119.1714

       T/K    H(0)-H(T)+PV         H(T)/Eh          T*S/Eh         G(T)/Eh
   ------------------------------------------------------------------------
    298.15    0.464132E-02    0.349563E-01    0.276025E-01    0.735383E-02
    120.00    0.155878E-02    0.318738E-01    0.927036E-02    0.226034E-01
    100.00    0.128211E-02    0.315971E-01    0.747333E-02    0.241238E-01
     80.00    0.101732E-02    0.313323E-01    0.574254E-02    0.255898E-01
     60.00    0.760463E-03    0.310754E-01    0.408539E-02    0.269901E-01
     40.00    0.506709E-03    0.308217E-01    0.251789E-02    0.283038E-01
     20.00    0.253352E-03    0.305683E-01    0.108337E-02    0.294850E-01
     10.00    0.126676E-03    0.304417E-01    0.453900E-03    0.299878E-01 (used)
   ------------------------------------------------------------------------

         :::::::::::::::::::::::::::::::::::::::::::::::::::::
         ::                  THERMODYNAMIC                  ::
         :::::::::::::::::::::::::::::::::::::::::::::::::::::
         :: total free energy          -8.072635174679 Eh   ::
         ::.................................................::
         :: total energy               -8.102622936346 Eh   ::
         :: zero point energy           0.030314985550 Eh   ::
         :: G(RRHO) w/o ZPVE           -0.000327223882 Eh   ::
         :: G(RRHO) contrib.            0.029987761667 Eh   ::
         :::::::::::::::::::::::::::::::::::::::::::::::::::::

optimized geometry written to: xtbopt.xyz


           -------------------------------------------------
          | TOTAL ENERGY               -8.102622936346 Eh   |
          | TOTAL ENTHALPY             -8.072181274781 Eh   |
          | TOTAL FREE ENERGY          -8.072635174679 Eh   |
          | GRADIENT NORM               0.000272722571 Eh/α |
          | HOMO-LUMO GAP               4.577782483969 eV   |
           -------------------------------------------------

------------------------------------------------------------------------
 * finished run on 2020/05/12 at 11:44:46.529     
------------------------------------------------------------------------
 total:
 * wall-time:     0 d,  0 h,  0 min,  0.108 sec
 *  cpu-time:     0 d,  0 h,  0 min,  0.108 sec
 * ratio c/w:     0.998 speedup
 SCF:
 * wall-time:     0 d,  0 h,  0 min,  0.003 sec
 *  cpu-time:     0 d,  0 h,  0 min,  0.003 sec
 * ratio c/w:     1.000 speedup
 ANC optimizer:
 * wall-time:     0 d,  0 h,  0 min,  0.036 sec
 *  cpu-time:     0 d,  0 h,  0 min,  0.036 sec
 * ratio c/w:     0.998 speedup
 numerical hessian:
 * wall-time:     0 d,  0 h,  0 min,  0.053 sec
 *  cpu-time:     0 d,  0 h,  0 min,  0.053 sec
 * ratio c/w:     0.999 speedup

