      -----------------------------------------------------------      
     |                   =====================                   |     
     |                           x T B                           |     
     |                   =====================                   |     
     |                         S. Grimme                         |     
     |          Mulliken Center for Theoretical Chemistry        |     
     |                    University of Bonn                     |     
      -----------------------------------------------------------      

   * xtb version 6.2.2 (9d81278992624c895f80dd42a50cac0aa55982e2) compiled by '@Darwin' on 04/03/2020

   xtb is free software: you can redistribute it and/or modify it under
   the terms of the GNU Lesser General Public License as published by
   the Free Software Foundation, either version 3 of the License, or
   (at your option) any later version.
   
   xtb is distributed in the hope that it will be useful,
   but WITHOUT ANY WARRANTY; without even the implied warranty of
   MERCHANTABILITY or FITNESS FOR A PARTICULAR PURPOSE.  See the
   GNU Lesser General Public License for more details.
   
   Cite this work as:
   * S. Grimme, C. Bannwarth, P. Shushkov, J. Chem. Theory Comput., 2017,
     13, 1989-2009. DOI: 10.1021/acs.jctc.7b00118
   * C. Bannwarth, S. Ehlert and S. Grimme., J. Chem. Theory Comput., 2019,
     15, 1652-1671. DOI: 10.1021/acs.jctc.8b01176
   * P. Pracht, E. Caldeweyher, S. Ehlert, S. Grimme, ChemRxiv, 2019, preprint.
     DOI: 10.26434/chemrxiv.8326202.v1
   
   for DFT-D4:
   * E. Caldeweyher, C. Bannwarth and S. Grimme, J. Chem. Phys., 2017,
     147, 034112. DOI: 10.1063/1.4993215
   * E. Caldeweyher, S. Ehlert, A. Hansen, H. Neugebauer, S. Spicher,
     C. Bannwarth and S. Grimme, J. Chem. Phys., 2019, 150, 154122.
     DOI: 10.1063/1.5090222
   
   for sTDA-xTB:
   * S. Grimme and C. Bannwarth, J. Chem. Phys., 2016, 145, 054103.
     DOI: 10.1063/1.4959605
   
   in the mass-spec context:
   * V. Asgeirsson, C. Bauer and S. Grimme, Chem. Sci., 2017, 8, 4879.
     DOI: 10.1039/c7sc00601b
   
   for metadynamics refer to:
   * S. Grimme, J. Chem. Theory Comput., 2019, 155, 2847-2862
     DOI: 10.1021/acs.jctc.9b00143
   
   with help from (in alphabetical order)
   C. Bannwarth, F. Bohle, G. Brandenburg, E. Caldeweyher, M. Checinski,
   S. Dohm, S. Ehlert, S. Ehrlich, F. März, H. Neugebauer, J. Pisarek,
   P. Pracht, P. Shushkov, and S. Spicher.
   
 * started run on 2020/05/12 at 11:45:02.987     

           -------------------------------------------------
          |                Calculation Setup                |
           -------------------------------------------------

          program call               : xtb --input H1C3N1_33_S_0.input H1C3N1_33_S_0.xyz --ohess --molden --namespace H1C3N1_33_S_0 output.out
          calculation namespace      : H1C3N1_33_S_0
          coordinate file            : H1C3N1_33_S_0.xyz
          number of atoms            :                     5
          number of electrons        :                    18
          charge                     :                     0
          spin                       :                   0.0
          first test random number   :      0.92755362451909

   ID    Z sym.   atoms
    1    6 C      1-3
    2    7 N      4
    3    1 H      5

           -------------------------------------------------
          |                 G F N 2 - x T B                 |
           -------------------------------------------------

        Reference                      10.1021/acs.jctc.8b01176
      * Hamiltonian:
        H0-scaling (s, p, d)           1.850000    2.230000    2.230000
        zeta-weighting                 0.500000
      * Dispersion:
        s8                             2.700000
        a1                             0.520000
        a2                             5.000000
        s9                             5.000000
      * Repulsion:
        kExp                           1.500000    1.000000
        rExp                           1.000000
      * Coulomb:
        alpha                          2.000000
        third order                    shell-resolved
        anisotropic                    true
        a3                             3.000000
        a5                             4.000000
        cn-shift                       1.200000
        cn-exp                         4.000000
        max-rad                        5.000000


          ...................................................
          :                      SETUP                      :
          :.................................................:
          :  # basis functions                  17          :
          :  # atomic orbitals                  17          :
          :  # shells                            9          :
          :  # electrons                        18          :
          :  max. iterations                   250          :
          :  Hamiltonian                  GFN2-xTB          :
          :  restarted?                      false          :
          :  GBSA solvation                  false          :
          :  PC potential                    false          :
          :  electronic temp.          300.0000000     K    :
          :  accuracy                    1.0000000          :
          :  -> integral cutoff          0.2500000E+02      :
          :  -> integral neglect         0.1000000E-07      :
          :  -> SCF convergence          0.1000000E-05 Eh   :
          :  -> wf. convergence          0.1000000E-03 e    :
          :  Broyden damping             0.4000000          :
          ...................................................

 iter      E             dE          RMSdq      gap      omega  full diag
   1     -9.3528271 -0.935283E+01  0.734E+00    0.22       0.0  T
   2     -9.0132757  0.339551E+00  0.102E+01    0.66       1.0  T
   3     -9.4067201 -0.393444E+00  0.607E+00    0.16       1.0  T
   4     -9.3728443  0.338758E-01  0.588E+00    0.20       1.0  T
   5     -9.4447868 -0.719426E-01  0.411E+00    0.09       1.0  T
   6     -9.3383001  0.106487E+00  0.693E+00    0.17       1.0  T
   7     -9.4965794 -0.158279E+00  0.233E+00    0.01       1.0  T
   8     -9.5034254 -0.684605E-02  0.210E+00    0.05       1.0  T
   9     -9.5091362 -0.571079E-02  0.172E+00    0.04       1.0  T
  10     -9.4915747  0.175616E-01  0.262E+00    0.05       1.0  T
  11     -9.4942820 -0.270734E-02  0.243E+00    0.05       1.0  T
  12     -9.5196932 -0.254112E-01  0.259E-01    0.01       1.0  T
  13     -9.5187755  0.917706E-03  0.500E-01    0.01       1.0  T
  14     -9.5184000  0.375451E-03  0.578E-01    0.01       1.0  T
  15     -9.5190572 -0.657140E-03  0.434E-01    0.01       1.0  T
  16     -9.5198418 -0.784659E-03  0.108E-01    0.01       1.0  T
  17     -9.5197968  0.450135E-04  0.140E-01    0.01       1.0  T
  18     -9.5197893  0.751552E-05  0.132E-01    0.01       1.0  T
  19     -9.5198425 -0.531802E-04  0.599E-02    0.01       1.0  T
  20     -9.5198531 -0.105868E-04  0.279E-02    0.01       1.6  T
  21     -9.5198551 -0.201151E-05  0.147E-02    0.01       3.0  T
  22     -9.5198558 -0.770978E-06  0.553E-03    0.01       8.1  T
  23     -9.5198560 -0.125760E-06  0.812E-04    0.01      55.1  T
  24     -9.5198560 -0.213596E-08  0.346E-04    0.01     129.1  T

   *** convergence criteria satisfied after 24 iterations ***

         #    Occupation            Energy/Eh            Energy/eV
      -------------------------------------------------------------
         1        2.0000           -0.7455679             -20.2879
       ...           ...                  ...                  ...
         3        2.0000           -0.6016675             -16.3722
         4        2.0000           -0.5954457             -16.2029
         5        2.0000           -0.5196422             -14.1402
         6        2.0000           -0.4591611             -12.4944
         7        2.0000           -0.4527591             -12.3202
         8        1.7958           -0.4120098             -11.2114
         9        1.2185           -0.4103663             -11.1666 (HOMO)
        10        0.9857           -0.4099171             -11.1544 (LUMO)
        11                         -0.1744922              -4.7482
        12                         -0.1263423              -3.4379
        13                         -0.0520611              -1.4167
        14                         -0.0388163              -1.0562
       ...                                ...                  ...
        17                          0.3660872               9.9617
      -------------------------------------------------------------
                  HL-Gap            0.0004491 Eh            0.0122 eV
             Fermi-level           -0.4099443 Eh          -11.1552 eV

 SCC (total)                   0 d,  0 h,  0 min,  0.005 sec
 SCC setup                      ...        0 min,  0.000 sec (  1.805%)
 Dispersion                     ...        0 min,  0.000 sec (  0.342%)
 integral evaluation            ...        0 min,  0.001 sec ( 21.499%)
 zeroth order Hamiltonian       ...        0 min,  0.000 sec (  0.385%)
 iterations                     ...        0 min,  0.003 sec ( 50.929%)
 molecular gradient             ...        0 min,  0.001 sec ( 22.827%)
 printout                       ...        0 min,  0.000 sec (  2.017%)

         :::::::::::::::::::::::::::::::::::::::::::::::::::::
         ::                     SUMMARY                     ::
         :::::::::::::::::::::::::::::::::::::::::::::::::::::
         :: total energy              -9.410699652279 Eh    ::
         :: gradient norm              0.096221532033 Eh/a0 ::
         :: HOMO-LUMO gap              0.012221620528 eV    ::
         ::.................................................::
         :: SCC energy                -9.519855976799 Eh    ::
         :: -> isotropic ES           -0.001353163444 Eh    ::
         :: -> anisotropic ES          0.005114004974 Eh    ::
         :: -> anisotropic XC          0.006175456433 Eh    ::
         :: -> dispersion             -0.002037690503 Eh    ::
         :: repulsion energy           0.109156309222 Eh    ::
         :: add. restraining           0.000000000000 Eh    ::
         :::::::::::::::::::::::::::::::::::::::::::::::::::::

      ----------------------------------------------------------- 
     |                   =====================                   |
     |                        A N C O P T                        |
     |                   =====================                   |
     |               Approximate Normal Coordinate               |
     |                Rational Function Optimizer                |
      ----------------------------------------------------------- 

          ...................................................
          :                      SETUP                      :
          :.................................................:
          :   optimization level            normal          :
          :   max. optcycles                   200          :
          :   ANC micro-cycles                  20          :
          :   degrees of freedom                 9          :
          :.................................................:
          :   RF solver                   davidson          :
          :   write xtbopt.log                true          :
          :   linear?                        false          :
          :   energy convergence         0.5000000E-05 Eh   :
          :   grad. convergence          0.1000000E-02 Eh/α :
          :   maximium RF displ.         1.0000000          :
          :   Hlow (freq-cutoff)         0.1000000E-01      :
          :   Hmax (freq-cutoff)         5.0000000          :
          :   S6 in model hess.         20.0000000          :
          ...................................................

generating ANC from model Hessian ...
Using Lindh-Hessian (1995)
 Shifting diagonal of input Hessian by    0.0000000000000000     
 Lowest  eigenvalues of input Hessian
   -0.000000   -0.000000   -0.000000    0.000000    0.000000    0.000000
    0.130979    0.245855    0.440659    0.706756    0.927204    1.136794
    1.158995    1.408019    1.921622
 Highest eigenvalues
    0.706756    0.927204    1.136794    1.158995    1.408019    1.921622


........................................................................
.............................. CYCLE    1 ..............................
........................................................................
   1     -9.5198560 -0.951986E+01  0.134E-04    0.01       0.0  T
   2     -9.5198560  0.239736E-07  0.223E-03    0.01      20.0  T
   3     -9.5198560 -0.237605E-07  0.244E-04    0.01     183.3  T
   4     -9.5198560 -0.141458E-09  0.174E-04    0.01     257.2  T
     SCC iter.                  ...        0 min,  0.001 sec
     gradient                   ...        0 min,  0.001 sec
 * total energy  :    -9.4106997 Eh     change       -0.3768843E-09 Eh
   gradient norm :     0.0962200 Eh/α   predicted     0.0000000E+00 (-100.00%)
   displ. norm   :     0.1864079 α      lambda       -0.1478538E-01
   maximum displ.:     0.1356065 α      in ANC's #3, #2, #9, ...

........................................................................
.............................. CYCLE    2 ..............................
........................................................................
   1     -9.4994000 -0.949940E+01  0.411E+00    0.29       0.0  T
   2     -9.2208135  0.278587E+00  0.750E+00    0.45       1.0  T
   3     -9.4687380 -0.247925E+00  0.360E+00    0.35       1.0  T
   4     -9.5232020 -0.544640E-01  0.290E+00    0.19       1.0  T
   5     -9.5250464 -0.184438E-02  0.235E+00    0.19       1.0  T
   6     -9.5308067 -0.576028E-02  0.134E+00    0.20       1.0  T
   7     -9.5307595  0.471798E-04  0.139E+00    0.20       1.0  T
   8     -9.5305987  0.160758E-03  0.627E-01    0.19       1.0  T
   9     -9.5308521 -0.253421E-03  0.468E-01    0.19       1.0  T
  10     -9.5312737 -0.421556E-03  0.253E-01    0.20       1.0  T
  11     -9.5313682 -0.944661E-04  0.593E-02    0.20       1.0  T
  12     -9.5313690 -0.853840E-06  0.224E-02    0.20       2.0  T
  13     -9.5313705 -0.150272E-05  0.763E-03    0.20       5.9  T
  14     -9.5313707 -0.207450E-06  0.220E-03    0.20      20.4  T
  15     -9.5313707  0.378050E-08  0.141E-03    0.20      31.6  T
  16     -9.5313707 -0.484635E-08  0.102E-04    0.20     440.1  T
  17     -9.5313707  0.618705E-11  0.120E-04    0.20     372.1  T
     SCC iter.                  ...        0 min,  0.001 sec
     gradient                   ...        0 min,  0.001 sec
 * total energy  :    -9.4290753 Eh     change       -0.1837562E-01 Eh
   gradient norm :     0.1592817 Eh/α   predicted    -0.7649576E-02 ( -58.37%)
   displ. norm   :     0.2718487 α      lambda       -0.3899083E-01
   maximum displ.:     0.1983856 α      in ANC's #3, #2, #5, ...

........................................................................
.............................. CYCLE    3 ..............................
........................................................................
   1     -9.5662448 -0.956624E+01  0.183E+00    0.91       0.0  T
   2     -9.5666050 -0.360201E-03  0.108E+00    0.88       1.0  T
   3     -9.5601542  0.645082E-02  0.124E+00    0.97       1.0  T
   4     -9.5664131 -0.625891E-02  0.552E-01    0.89       1.0  T
   5     -9.5677926 -0.137945E-02  0.583E-02    0.91       1.0  T
   6     -9.5677939 -0.128224E-05  0.273E-02    0.91       1.6  T
   7     -9.5677938  0.865260E-07  0.172E-02    0.91       2.6  T
   8     -9.5677953 -0.154167E-05  0.439E-03    0.91      10.2  T
   9     -9.5677953 -0.212522E-07  0.117E-03    0.91      38.3  T
  10     -9.5677953 -0.341637E-08  0.136E-04    0.91     329.4  T
  11     -9.5677953 -0.643965E-10  0.475E-05    0.91     940.9  T
     SCC iter.                  ...        0 min,  0.001 sec
     gradient                   ...        0 min,  0.001 sec
 * total energy  :    -9.4673446 Eh     change       -0.3826935E-01 Eh
   gradient norm :     0.1420466 Eh/α   predicted    -0.2093616E-01 ( -45.29%)
   displ. norm   :     0.8007636 α      lambda       -0.1059236E+00
   maximum displ.:     0.5967721 α      in ANC's #3, #5, #2, ...

........................................................................
.............................. CYCLE    4 ..............................
........................................................................
   1     -9.6096341 -0.960963E+01  0.380E+00    2.72       0.0  T
   2     -9.6017634  0.787071E-02  0.252E+00    2.79       1.0  T
   3     -9.5979433  0.382008E-02  0.222E+00    2.67       1.0  T
   4     -9.6200512 -0.221079E-01  0.299E-01    2.75       1.0  T
   5     -9.6202723 -0.221093E-03  0.112E-01    2.74       1.0  T
   6     -9.6202702  0.213603E-05  0.337E-02    2.74       1.3  T
   7     -9.6202709 -0.732711E-06  0.244E-02    2.74       1.8  T
   8     -9.6202749 -0.395674E-05  0.903E-03    2.74       5.0  T
   9     -9.6202750 -0.192699E-06  0.175E-03    2.74      25.5  T
  10     -9.6202750 -0.193157E-08  0.223E-04    2.74     200.5  T
  11     -9.6202750 -0.242402E-10  0.931E-05    2.74     480.5  T
     SCC iter.                  ...        0 min,  0.001 sec
     gradient                   ...        0 min,  0.001 sec
 * total energy  :    -9.5272248 Eh     change       -0.5988020E-01 Eh
   gradient norm :     0.0865614 Eh/α   predicted    -0.8692203E-01 (  45.16%)
   displ. norm   :     0.1265545 α      lambda       -0.5808741E-02
   maximum displ.:     0.0804127 α      in ANC's #3, #5, #2, ...

........................................................................
.............................. CYCLE    5 ..............................
........................................................................
   1     -9.6299045 -0.962990E+01  0.498E-01    2.99       0.0  T
   2     -9.6299077 -0.326715E-05  0.296E-01    2.99       1.0  T
   3     -9.6297629  0.144880E-03  0.149E-01    2.99       1.0  T
   4     -9.6299185 -0.155619E-03  0.201E-02    2.99       2.2  T
   5     -9.6299177  0.831423E-06  0.139E-02    2.99       3.2  T
   6     -9.6299183 -0.625567E-06  0.925E-03    2.99       4.8  T
   7     -9.6299189 -0.615635E-06  0.148E-03    2.99      30.3  T
   8     -9.6299189 -0.959227E-09  0.348E-04    2.99     128.5  T
   9     -9.6299189 -0.251230E-10  0.133E-04    2.99     336.0  T
     SCC iter.                  ...        0 min,  0.001 sec
     gradient                   ...        0 min,  0.001 sec
 * total energy  :    -9.5318329 Eh     change       -0.4608117E-02 Eh
   gradient norm :     0.0693086 Eh/α   predicted    -0.2950884E-02 ( -35.96%)
   displ. norm   :     0.1648443 α      lambda       -0.8040605E-02
   maximum displ.:     0.0901402 α      in ANC's #8, #5, #9, ...

........................................................................
.............................. CYCLE    6 ..............................
........................................................................
   1     -9.6513135 -0.965131E+01  0.792E-01    3.09       0.0  T
   2     -9.6511679  0.145587E-03  0.561E-01    3.10       1.0  T
   3     -9.6510691  0.987585E-04  0.406E-01    3.07       1.0  T
   4     -9.6517251 -0.655960E-03  0.463E-02    3.08       1.0  T
   5     -9.6517296 -0.447971E-05  0.225E-02    3.08       2.0  T
   6     -9.6517296 -0.328540E-07  0.510E-03    3.08       8.8  T
   7     -9.6517297 -0.642708E-07  0.375E-03    3.08      11.9  T
   8     -9.6517297 -0.758521E-07  0.771E-04    3.08      58.0  T
   9     -9.6517297 -0.576970E-09  0.142E-04    3.08     315.2  T
     SCC iter.                  ...        0 min,  0.001 sec
     gradient                   ...        0 min,  0.001 sec
 * total energy  :    -9.5365963 Eh     change       -0.4763379E-02 Eh
   gradient norm :     0.0162474 Eh/α   predicted    -0.4129550E-02 ( -13.31%)
   displ. norm   :     0.0593898 α      lambda       -0.6787487E-03
   maximum displ.:     0.0462346 α      in ANC's #2, #8, #9, ...

........................................................................
.............................. CYCLE    7 ..............................
........................................................................
   1     -9.6550203 -0.965502E+01  0.238E-01    3.03       0.0  T
   2     -9.6550081  0.122278E-04  0.158E-01    3.04       1.0  T
   3     -9.6550046  0.354045E-05  0.121E-01    3.03       1.0  T
   4     -9.6550609 -0.563168E-04  0.118E-02    3.03       3.8  T
   5     -9.6550609 -0.683467E-07  0.810E-03    3.03       5.5  T
   6     -9.6550609  0.643597E-07  0.716E-03    3.03       6.2  T
   7     -9.6550612 -0.322523E-06  0.608E-04    3.03      73.5  T
   8     -9.6550612 -0.200238E-09  0.160E-04    3.03     279.4  T
     SCC iter.                  ...        0 min,  0.001 sec
     gradient                   ...        0 min,  0.001 sec
 * total energy  :    -9.5370629 Eh     change       -0.4665746E-03 Eh
   gradient norm :     0.0111960 Eh/α   predicted    -0.3405697E-03 ( -27.01%)
   displ. norm   :     0.0620867 α      lambda       -0.4359150E-03
   maximum displ.:     0.0543599 α      in ANC's #2, #8, #3, ...

........................................................................
.............................. CYCLE    8 ..............................
........................................................................
   1     -9.6559195 -0.965592E+01  0.231E-01    3.04       0.0  T
   2     -9.6559180  0.150444E-05  0.133E-01    3.04       1.0  T
   3     -9.6558606  0.574070E-04  0.119E-01    3.03       1.0  T
   4     -9.6559347 -0.740723E-04  0.904E-03    3.04       4.9  T
   5     -9.6559344  0.314257E-06  0.654E-03    3.04       6.8  T
   6     -9.6559347 -0.332435E-06  0.114E-03    3.04      39.4  T
   7     -9.6559347 -0.370357E-08  0.393E-04    3.04     113.9  T
   8     -9.6559347 -0.763745E-10  0.136E-04    3.04     327.7  T
     SCC iter.                  ...        0 min,  0.001 sec
     gradient                   ...        0 min,  0.001 sec
 * total energy  :    -9.5373910 Eh     change       -0.3280989E-03 Eh
   gradient norm :     0.0108943 Eh/α   predicted    -0.2188003E-03 ( -33.31%)
   displ. norm   :     0.0781491 α      lambda       -0.4692515E-03
   maximum displ.:     0.0664103 α      in ANC's #2, #5, #8, ...

........................................................................
.............................. CYCLE    9 ..............................
........................................................................
   1     -9.6559543 -0.965595E+01  0.312E-01    3.11       0.0  T
   2     -9.6559628 -0.852946E-05  0.173E-01    3.11       1.0  T
   3     -9.6559212  0.416270E-04  0.941E-02    3.11       1.0  T
   4     -9.6559698 -0.485380E-04  0.165E-02    3.11       2.7  T
   5     -9.6559700 -0.262375E-06  0.101E-02    3.11       4.4  T
   6     -9.6559695  0.516761E-06  0.921E-03    3.11       4.9  T
   7     -9.6559702 -0.656701E-06  0.109E-03    3.11      41.1  T
   8     -9.6559702 -0.111243E-08  0.233E-04    3.11     192.2  T
   9     -9.6559702 -0.215650E-11  0.102E-04    3.11     438.3  T
     SCC iter.                  ...        0 min,  0.001 sec
     gradient                   ...        0 min,  0.001 sec
 * total energy  :    -9.5377123 Eh     change       -0.3212988E-03 Eh
   gradient norm :     0.0082341 Eh/α   predicted    -0.2360578E-03 ( -26.53%)
   displ. norm   :     0.0471373 α      lambda       -0.2147943E-03
   maximum displ.:     0.0334081 α      in ANC's #2, #5, #8, ...

........................................................................
.............................. CYCLE   10 ..............................
........................................................................
   1     -9.6557837 -0.965578E+01  0.217E-01    3.20       0.0  T
   2     -9.6557938 -0.101217E-04  0.128E-01    3.20       1.0  T
   3     -9.6557742  0.195930E-04  0.677E-02    3.20       1.0  T
   4     -9.6557959 -0.217117E-04  0.280E-02    3.20       1.6  T
   5     -9.6557996 -0.361254E-05  0.797E-03    3.20       5.6  T
   6     -9.6557989  0.616870E-06  0.941E-03    3.20       4.8  T
   7     -9.6557996 -0.684278E-06  0.866E-04    3.20      51.7  T
   8     -9.6557996 -0.675488E-09  0.185E-04    3.20     241.2  T
     SCC iter.                  ...        0 min,  0.001 sec
     gradient                   ...        0 min,  0.001 sec
 * total energy  :    -9.5378521 Eh     change       -0.1398329E-03 Eh
   gradient norm :     0.0051034 Eh/α   predicted    -0.1076357E-03 ( -23.03%)
   displ. norm   :     0.0176255 α      lambda       -0.5827462E-04
   maximum displ.:     0.0155303 α      in ANC's #5, #2, #6, ...

........................................................................
.............................. CYCLE   11 ..............................
........................................................................
   1     -9.6557949 -0.965579E+01  0.107E-01    3.24       0.0  T
   2     -9.6557970 -0.210378E-05  0.743E-02    3.24       1.0  T
   3     -9.6558040 -0.697275E-05  0.445E-02    3.24       1.0  T
   4     -9.6558091 -0.515811E-05  0.169E-02    3.24       2.7  T
   5     -9.6558101 -0.100258E-05  0.441E-03    3.24      10.1  T
   6     -9.6558101  0.385990E-08  0.391E-03    3.24      11.4  T
   7     -9.6558102 -0.827945E-07  0.347E-04    3.24     128.9  T
   8     -9.6558102 -0.852296E-10  0.100E-04    3.24     445.3  T
     SCC iter.                  ...        0 min,  0.001 sec
     gradient                   ...        0 min,  0.001 sec
 * total energy  :    -9.5378892 Eh     change       -0.3703787E-04 Eh
   gradient norm :     0.0031295 Eh/α   predicted    -0.2914725E-04 ( -21.30%)
   displ. norm   :     0.0064770 α      lambda       -0.1531080E-04
   maximum displ.:     0.0044759 α      in ANC's #5, #6, #2, ...

........................................................................
.............................. CYCLE   12 ..............................
........................................................................
   1     -9.6559079 -0.965591E+01  0.523E-02    3.25       0.0  T
   2     -9.6559072  0.701517E-06  0.392E-02    3.25       1.1  T
   3     -9.6559134 -0.614406E-05  0.200E-02    3.25       2.2  T
   4     -9.6559142 -0.867407E-06  0.633E-03    3.25       7.1  T
   5     -9.6559143 -0.604328E-07  0.249E-03    3.25      18.0  T
   6     -9.6559143 -0.441811E-07  0.785E-04    3.25      57.0  T
   7     -9.6559143 -0.115603E-08  0.594E-05    3.25     753.1  T
     SCC iter.                  ...        0 min,  0.001 sec
     gradient                   ...        0 min,  0.001 sec
 * total energy  :    -9.5378994 Eh     change       -0.1023411E-04 Eh
   gradient norm :     0.0017512 Eh/α   predicted    -0.7653966E-05 ( -25.21%)
   displ. norm   :     0.0069154 α      lambda       -0.6255601E-05
   maximum displ.:     0.0050517 α      in ANC's #6, #2, #8, ...

........................................................................
.............................. CYCLE   13 ..............................
........................................................................
   1     -9.6560721 -0.965607E+01  0.486E-02    3.25       0.0  T
   2     -9.6560708  0.129986E-05  0.331E-02    3.25       1.3  T
   3     -9.6560751 -0.431397E-05  0.219E-02    3.25       2.0  T
   4     -9.6560764 -0.124222E-05  0.387E-03    3.25      11.5  T
   5     -9.6560764  0.178744E-08  0.312E-03    3.25      14.3  T
   6     -9.6560764 -0.721451E-07  0.916E-04    3.25      48.8  T
   7     -9.6560764 -0.108018E-08  0.117E-04    3.25     381.6  T
     SCC iter.                  ...        0 min,  0.001 sec
     gradient                   ...        0 min,  0.001 sec
 * total energy  :    -9.5379039 Eh     change       -0.4468239E-05 Eh
   gradient norm :     0.0012983 Eh/α   predicted    -0.3128401E-05 ( -29.99%)
   displ. norm   :     0.0025269 α      lambda       -0.1500929E-05
   maximum displ.:     0.0015745 α      in ANC's #5, #8, #1, ...

........................................................................
.............................. CYCLE   14 ..............................
........................................................................
   1     -9.6560331 -0.965603E+01  0.158E-02    3.24       0.0  T
   2     -9.6560333 -0.197451E-06  0.103E-02    3.24       4.4  T
   3     -9.6560334 -0.808012E-07  0.616E-03    3.24       7.3  T
   4     -9.6560334  0.650486E-08  0.534E-03    3.24       8.4  T
   5     -9.6560335 -0.118273E-06  0.230E-03    3.24      19.4  T
   6     -9.6560335 -0.358715E-07  0.406E-04    3.24     110.1  T
   7     -9.6560335 -0.203386E-09  0.606E-05    3.24     738.2  T
     SCC iter.                  ...        0 min,  0.001 sec
     gradient                   ...        0 min,  0.001 sec
 * total energy  :    -9.5379053 Eh     change       -0.1441798E-05 Eh
   gradient norm :     0.0007218 Eh/α   predicted    -0.7483185E-06 ( -48.10%)
   displ. norm   :     0.0026911 α      lambda       -0.7260157E-06
   maximum displ.:     0.0015116 α      in ANC's #2, #8, #1, ...

   *** GEOMETRY OPTIMIZATION CONVERGED AFTER 14 ITERATIONS ***

------------------------------------------------------------------------
 total energy gain   :        -0.1272057 Eh      -79.8228 kcal/mol
 total RMSD          :         0.7175625 a0        0.3797 Å
 total power (kW/mol):       -23.8556002 (step)-7562.2008 (real)
------------------------------------------------------------------------

 ANCopt (total)                0 d,  0 h,  0 min,  0.044 sec
 optimizer setup                ...        0 min,  0.000 sec (  0.152%)
 model hessian                  ...        0 min,  0.000 sec (  0.233%)
 ANC generation                 ...        0 min,  0.000 sec (  0.170%)
 coordinate transformation      ...        0 min,  0.000 sec (  0.069%)
 single point calculation       ...        0 min,  0.043 sec ( 96.648%)
 optimization log               ...        0 min,  0.000 sec (  0.848%)
 hessian update                 ...        0 min,  0.000 sec (  0.073%)
 rational function              ...        0 min,  0.000 sec (  0.837%)

================
 final structure:
================
5
 xtb: 6.2.2 (9d81278992624c895f80dd42a50cac0aa55982e2)
C        -0.73474225332070    0.71555904637819    0.46608560414303
C        -0.71440438704384   -0.67821521654109    0.59385562783410
C        -0.34199683660245   -0.76492647425311   -0.75297028349836
N         0.40154322130391    0.29416452001200   -0.22776687134216
H         1.38960025566308    0.43341812440401   -0.07920407713660

 Bond Distances (Angstroems)
 ---------------------------
C1-C2=1.3998         C1-N4=1.3965         C2-C1=1.3998         C2-C3=1.4001         C2-N4=1.6929         C3-C2=1.4001         
C3-N4=1.3966         N4-C1=1.3965         N4-C2=1.6929         N4-C3=1.3966         N4-H5=1.0088         H5-N4=1.0088         
 C  C  Rav=1.3999 sigma=0.0001  Rmin=1.3998  Rmax=1.4001     2
 N  H  Rav=1.0088 sigma=0.0000  Rmin=1.0088  Rmax=1.0088     1
 N  C  Rav=1.4953 sigma=0.1397  Rmin=1.3965  Rmax=1.6929     3

 selected bond angles (degree)
 --------------------
N4-C1-C2= 74.52                C3-C2-C1= 88.72                N4-C2-C1= 52.65                N4-C2-C3= 52.65                
N4-C3-C2= 74.51                C2-N4-C1= 52.83                C3-N4-C1= 89.00                C3-N4-C2= 52.84                
H5-N4-C1=133.01                H5-N4-C2=130.80                H5-N4-C3=132.96                

 selected dihedral angles (degree)
 ---------------------------------
C3-C2-C1-N4=318.27            N4-C3-C2-C1= 41.73            C3-N4-C1-C2= 41.85            H5-N4-C1-C2=245.53            
C1-N4-C2-C3=123.17            C3-N4-C2-C1=236.83            H5-N4-C2-C1=118.45            H5-N4-C2-C3=241.61            
C1-N4-C3-C2=318.16            H5-N4-C3-C2=114.49            
           -------------------------------------------------
          |                Final Singlepoint                |
           -------------------------------------------------

          ...................................................
          :                      SETUP                      :
          :.................................................:
          :  # basis functions                  17          :
          :  # atomic orbitals                  17          :
          :  # shells                            9          :
          :  # electrons                        18          :
          :  max. iterations                   250          :
          :  Hamiltonian                  GFN2-xTB          :
          :  restarted?                      false          :
          :  GBSA solvation                  false          :
          :  PC potential                    false          :
          :  electronic temp.          300.0000000     K    :
          :  accuracy                    1.0000000          :
          :  -> integral cutoff          0.2500000E+02      :
          :  -> integral neglect         0.1000000E-07      :
          :  -> SCF convergence          0.1000000E-05 Eh   :
          :  -> wf. convergence          0.1000000E-03 e    :
          :  Broyden damping             0.4000000          :
          ...................................................

 iter      E             dE          RMSdq      gap      omega  full diag
   1     -9.6560335 -0.965603E+01  0.108E-05    3.24       0.0  T
   2     -9.6560335  0.301981E-13  0.728E-06    3.24    6142.5  T
   3     -9.6560335  0.490274E-12  0.824E-06    3.24    5429.2  T

   *** convergence criteria satisfied after 3 iterations ***

         #    Occupation            Energy/Eh            Energy/eV
      -------------------------------------------------------------
         1        2.0000           -0.7418087             -20.1856
       ...           ...                  ...                  ...
         3        2.0000           -0.6431266             -17.5004
         4        2.0000           -0.5944573             -16.1760
         5        2.0000           -0.5308167             -14.4443
         6        2.0000           -0.5197422             -14.1429
         7        2.0000           -0.4600331             -12.5181
         8        2.0000           -0.4276353             -11.6365
         9        2.0000           -0.4114966             -11.1974 (HOMO)
        10                         -0.2922988              -7.9539 (LUMO)
        11                         -0.2865841              -7.7984
        12                         -0.2535421              -6.8992
        13                         -0.0486725              -1.3244
        14                          0.0451933               1.2298
       ...                                ...                  ...
        17                          0.5084318              13.8351
      -------------------------------------------------------------
                  HL-Gap            0.1191977 Eh            3.2435 eV
             Fermi-level           -0.3518977 Eh           -9.5756 eV

 SCC (total)                   0 d,  0 h,  0 min,  0.003 sec
 SCC setup                      ...        0 min,  0.000 sec (  2.615%)
 Dispersion                     ...        0 min,  0.000 sec (  0.511%)
 integral evaluation            ...        0 min,  0.001 sec ( 36.572%)
 zeroth order Hamiltonian       ...        0 min,  0.000 sec (  0.468%)
 iterations                     ...        0 min,  0.001 sec ( 18.672%)
 molecular gradient             ...        0 min,  0.001 sec ( 39.084%)
 printout                       ...        0 min,  0.000 sec (  1.715%)

         :::::::::::::::::::::::::::::::::::::::::::::::::::::
         ::                     SUMMARY                     ::
         :::::::::::::::::::::::::::::::::::::::::::::::::::::
         :: total energy              -9.537905307937 Eh    ::
         :: gradient norm              0.000725512050 Eh/a0 ::
         :: HOMO-LUMO gap              3.243535606083 eV    ::
         ::.................................................::
         :: SCC energy                -9.656033547301 Eh    ::
         :: -> isotropic ES           -0.011596781734 Eh    ::
         :: -> anisotropic ES          0.004509891883 Eh    ::
         :: -> anisotropic XC          0.006919347554 Eh    ::
         :: -> dispersion             -0.002054514001 Eh    ::
         :: repulsion energy           0.118128213910 Eh    ::
         :: add. restraining           0.000000000000 Eh    ::
         :::::::::::::::::::::::::::::::::::::::::::::::::::::

           ------------------------------------------------- 
          |                Numerical Hessian                |
           ------------------------------------------------- 
step length          :   0.00500
SCC accuracy         :   0.30000
Hessian scale factor :   1.00000
frozen atoms in %    :   0.00000    0
RMS gradient         :   0.00073
estimated CPU  time      0.00 min
estimated wall time      0.00 min

writing file <hessian>.

 projected vibrational frequencies (cm-1)
eigval :       -0.00    -0.00    -0.00     0.00     0.00     0.00
eigval :      536.99   582.10   731.09   852.59   984.90  1082.79
eigval :     1319.06  1432.75  3405.38
           -------------------------------------------------
          |                Property Printout                |
           -------------------------------------------------

    * Orbital Energies and Occupations

         #    Occupation            Energy/Eh            Energy/eV
      -------------------------------------------------------------
         1        2.0000           -0.7418087             -20.1856
         2        2.0000           -0.6528770             -17.7657
         3        2.0000           -0.6431266             -17.5004
         4        2.0000           -0.5944573             -16.1760
         5        2.0000           -0.5308167             -14.4443
         6        2.0000           -0.5197422             -14.1429
         7        2.0000           -0.4600331             -12.5181
         8        2.0000           -0.4276353             -11.6365
         9        2.0000           -0.4114966             -11.1974 (HOMO)
        10                         -0.2922988              -7.9539 (LUMO)
        11                         -0.2865841              -7.7984
        12                         -0.2535421              -6.8992
        13                         -0.0486725              -1.3244
        14                          0.0451933               1.2298
        15                          0.1992478               5.4218
        16                          0.2389447               6.5020
        17                          0.5084318              13.8351
      -------------------------------------------------------------
                  HL-Gap            0.1191977 Eh            3.2435 eV
             Fermi-level           -0.3518977 Eh           -9.5756 eV

     #   Z        covCN         q      C6AA      α(0)
     1   6 C      2.467    -0.089    30.542     9.021
     2   6 C      2.795    -0.020    28.483     8.743
     3   6 C      2.467    -0.089    30.543     9.022
     4   7 N      3.513     0.029    20.725     6.762
     5   1 H      0.860     0.168     1.282     1.774

 Mol. C6AA /au·bohr⁶  :        486.513535
 Mol. C8AA /au·bohr⁸  :      12855.061897
 Mol. α(0) /au        :         35.320727


Wiberg/Mayer (AO) data.
largest (>0.10) Wiberg bond orders for each atom
          total WBO             WBO to atom ...
     1  C   2.890        C    2 1.278    N    4 1.053    C    3 0.551
     2  C   3.167        C    1 1.278    C    3 1.277    N    4 0.588
     3  C   2.889        C    2 1.277    N    4 1.053    C    1 0.551
     4  N   3.628        C    3 1.053    C    1 1.053    H    5 0.933    C    2 0.588
     5  H   0.972        N    4 0.933

MOs/occ written to file <molden.input>


molecular dipole:
                 x           y           z       tot (Debye)
 q only:        0.673       0.188      -0.012
   full:        1.310       0.283       0.078       3.411
molecular quadrupole (traceless):
                xx          xy          yy          xz          yz          zz
 q only:        1.196       0.637      -0.594      -0.029      -0.434      -0.602
  q+dip:        2.521       0.957      -1.559       0.663      -1.628      -0.962
   full:        3.178       0.997      -1.965       1.000      -1.775      -1.213

           -------------------------------------------------
          |                Geometry Summary                 |
           -------------------------------------------------

      molecular mass/u    :       51.0468517
   center of mass at/Å    :       -0.2838185      -0.0819167       0.0081672
  moments of inertia/u·Å² :        0.2524283E+02   0.2732266E+02   0.4394752E+02
rotational constants/cm⁻¹ :        0.6678186E+00   0.6169836E+00   0.3835855E+00
Molecule has the following symmetry elements: (sigma) 
It seems to be the Cs point group

 * 5 selected distances

     #   Z        #   Z                                     value/Å
     1   6 C      2   6 C                                 1.3997662
     2   6 C      3   6 C                                 1.4000522 (max)
     1   6 C      4   7 N                                 1.3964775
     3   6 C      4   7 N                                 1.3965544
     4   7 N      5   1 H                                 1.0088207 (min)

 * 3 distinct bonds (by element types)

   Z      Z             #   av. dist./Å        max./Å        min./Å
   6 C    6 C           2     1.3999092     1.4000522     1.3997662
   1 H    7 N           1     1.0088207     1.0088207     1.0088207
   6 C    7 N           2     1.3965159     1.3965544     1.3964775

           -------------------------------------------------
          |               Frequency Printout                |
           -------------------------------------------------
 projected vibrational frequencies (cm-1)
eigval :       -0.00    -0.00    -0.00     0.00     0.00     0.00
eigval :      536.99   582.10   731.09   852.59   984.90  1082.79
eigval :     1319.06  1432.75  3405.38
 reduced masses (amu)
   1: 11.57   2: 12.15   3: 12.18   4: 11.84   5: 11.98   6: 12.27   7: 10.73   8:  8.24
   9:  9.66  10: 12.44  11:  2.62  12: 11.34  13: 12.09  14: 12.16  15:  1.88
 IR intensities (amu)
   1:  0.11   2:  0.19   3:  0.17   4:  0.17   5:  0.08   6:  0.12   7:  0.71   8:  0.22
   9:  0.62  10:  0.14  11:  0.20  12:  1.21  13:  0.55  14:  0.15  15:  0.29
 Raman intensities (amu)
   1:  0.00   2:  0.00   3:  0.00   4:  0.00   5:  0.00   6:  0.00   7:  0.00   8:  0.00
   9:  0.00  10:  0.00  11:  0.00  12:  0.00  13:  0.00  14:  0.00  15:  0.00
 output can be read by thermo (or use thermo option).
 writing <g98.out> molden fake output.
 recommended (thermochemical) frequency scaling factor: 1.0
           -------------------------------------------------
          |             Thermodynamic Functions             |
           -------------------------------------------------

cs  symmetry found (for desy threshold:  0.10E+00) used in thermo

          ...................................................
          :                      SETUP                      :
          :.................................................:
          :  # frequencies                           9      :
          :  # imaginary freq.                       0      :
          :  linear?                             false      :
          :  only rotor calc.                    false      :
          :  symmetry                               cs      :
          :  rotational number                       1      :
          :  scaling factor                  1.0000000      :
          :  rotor cutoff                   50.0000000 cm⁻¹ :
          :  imag. cutoff                  -20.0000000 cm⁻¹ :
          :.................................................:

    mode    ω/cm⁻¹     T·S(HO)/kcal·mol⁻¹    T·S(FR)/kcal·mol⁻¹   T·S(vib)
   ------------------------------------------------------------------------
   ------------------------------------------------------------------------

   temp. (K)  partition function   enthalpy   heat capacity  entropy
                                   cal/mol     cal/K/mol   cal/K/mol   J/K/mol
 298.15  VIB   1.23                  386.625      4.500      1.700
         ROT  0.133E+05              888.752      2.981     21.851
         INT  0.163E+05             1275.377      7.481     23.551
         TR   0.353E+27             1481.254      4.968     37.697
         TOT                        2756.6313    12.4490    61.2479   256.2610

   temp. (K)  partition function   enthalpy   heat capacity  entropy
                                   cal/mol     cal/K/mol   cal/K/mol   J/K/mol
 120.00  VIB   1.00                    4.453      0.257      0.043
         ROT  0.340E+04              357.707      2.981     19.138
         INT  0.341E+04              362.160      3.238     19.181
         TR   0.901E+26              596.178      4.968     33.177
         TOT                         958.3381     8.2058    52.3577   219.0648

   temp. (K)  partition function   enthalpy   heat capacity  entropy
                                   cal/mol     cal/K/mol   cal/K/mol   J/K/mol
 100.00  VIB   1.00                    1.132      0.092      0.013
         ROT  0.258E+04              298.089      2.981     18.594
         INT  0.259E+04              299.221      3.073     18.607
         TR   0.685E+26              496.815      4.968     32.272
         TOT                         796.0359     8.0413    50.8791   212.8779

   temp. (K)  partition function   enthalpy   heat capacity  entropy
                                   cal/mol     cal/K/mol   cal/K/mol   J/K/mol
  80.00  VIB   1.00                    0.150      0.019      0.002
         ROT  0.185E+04              238.471      2.981     17.929
         INT  0.185E+04              238.621      3.000     17.931
         TR   0.490E+26              397.452      4.968     31.164
         TOT                         636.0733     7.9679    49.0951   205.4140

   temp. (K)  partition function   enthalpy   heat capacity  entropy
                                   cal/mol     cal/K/mol   cal/K/mol   J/K/mol
  60.00  VIB   1.00                    0.005      0.001     -0.000
         ROT  0.120E+04              178.853      2.981     17.072
         INT  0.120E+04              178.859      2.982     17.072
         TR   0.319E+26              298.089      4.968     29.735
         TOT                         476.9478     7.9502    46.8070   195.8405

   temp. (K)  partition function   enthalpy   heat capacity  entropy
                                   cal/mol     cal/K/mol   cal/K/mol   J/K/mol
  40.00  VIB   1.00                    0.000      0.000     -0.000
         ROT   654.                  119.236      2.981     15.863
         INT   654.                  119.236      2.981     15.863
         TR   0.173E+26              198.726      4.968     27.722
         TOT                         317.9616     7.9490    43.5848   182.3586

   temp. (K)  partition function   enthalpy   heat capacity  entropy
                                   cal/mol     cal/K/mol   cal/K/mol   J/K/mol
  20.00  VIB   1.00                    0.000      0.000     -0.000
         ROT   231.                   59.618      2.981     13.797
         INT   231.                   59.618      2.981     13.797
         TR   0.613E+25               99.363      4.968     24.280
         TOT                         158.9808     7.9490    38.0765   159.3119

   temp. (K)  partition function   enthalpy   heat capacity  entropy
                                   cal/mol     cal/K/mol   cal/K/mol   J/K/mol
  10.00  VIB   1.00                    0.000      0.000     -0.000
         ROT   81.7                   29.809      2.981     11.731
         INT   81.7                   29.809      2.981     11.730
         TR   0.217E+25               49.681      4.968     20.838
         TOT                          79.4904     7.9490    32.5682   136.2652

       T/K    H(0)-H(T)+PV         H(T)/Eh          T*S/Eh         G(T)/Eh
   ------------------------------------------------------------------------
    298.15    0.439297E-02    0.292880E-01    0.291008E-01    0.187138E-03
    120.00    0.152721E-02    0.264222E-01    0.100125E-01    0.164097E-01
    100.00    0.126856E-02    0.261636E-01    0.810809E-02    0.180555E-01
     80.00    0.101365E-02    0.259086E-01    0.625904E-02    0.196496E-01
     60.00    0.760065E-03    0.256551E-01    0.447550E-02    0.211796E-01
     40.00    0.506704E-03    0.254017E-01    0.277827E-02    0.226234E-01
     20.00    0.253352E-03    0.251484E-01    0.121357E-02    0.239348E-01
     10.00    0.126676E-03    0.250217E-01    0.519007E-03    0.245027E-01 (used)
   ------------------------------------------------------------------------

         :::::::::::::::::::::::::::::::::::::::::::::::::::::
         ::                  THERMODYNAMIC                  ::
         :::::::::::::::::::::::::::::::::::::::::::::::::::::
         :: total free energy          -9.513402638571 Eh   ::
         ::.................................................::
         :: total energy               -9.537905307937 Eh   ::
         :: zero point energy           0.024895000214 Eh   ::
         :: G(RRHO) w/o ZPVE           -0.000392330848 Eh   ::
         :: G(RRHO) contrib.            0.024502669366 Eh   ::
         :::::::::::::::::::::::::::::::::::::::::::::::::::::

optimized geometry written to: xtbopt.xyz


           -------------------------------------------------
          | TOTAL ENERGY               -9.537905307937 Eh   |
          | TOTAL ENTHALPY             -9.512883631708 Eh   |
          | TOTAL FREE ENERGY          -9.513402638571 Eh   |
          | GRADIENT NORM               0.000725541776 Eh/α |
          | HOMO-LUMO GAP               3.243535622986 eV   |
           -------------------------------------------------

------------------------------------------------------------------------
 * finished run on 2020/05/12 at 11:45:03.142     
------------------------------------------------------------------------
 total:
 * wall-time:     0 d,  0 h,  0 min,  0.154 sec
 *  cpu-time:     0 d,  0 h,  0 min,  0.154 sec
 * ratio c/w:     0.997 speedup
 SCF:
 * wall-time:     0 d,  0 h,  0 min,  0.005 sec
 *  cpu-time:     0 d,  0 h,  0 min,  0.005 sec
 * ratio c/w:     0.998 speedup
 ANC optimizer:
 * wall-time:     0 d,  0 h,  0 min,  0.048 sec
 *  cpu-time:     0 d,  0 h,  0 min,  0.048 sec
 * ratio c/w:     0.998 speedup
 numerical hessian:
 * wall-time:     0 d,  0 h,  0 min,  0.085 sec
 *  cpu-time:     0 d,  0 h,  0 min,  0.084 sec
 * ratio c/w:     0.998 speedup

