      -----------------------------------------------------------      
     |                   =====================                   |     
     |                           x T B                           |     
     |                   =====================                   |     
     |                         S. Grimme                         |     
     |          Mulliken Center for Theoretical Chemistry        |     
     |                    University of Bonn                     |     
      -----------------------------------------------------------      

   * xtb version 6.2.2 (9d81278992624c895f80dd42a50cac0aa55982e2) compiled by '@Darwin' on 04/03/2020

   xtb is free software: you can redistribute it and/or modify it under
   the terms of the GNU Lesser General Public License as published by
   the Free Software Foundation, either version 3 of the License, or
   (at your option) any later version.
   
   xtb is distributed in the hope that it will be useful,
   but WITHOUT ANY WARRANTY; without even the implied warranty of
   MERCHANTABILITY or FITNESS FOR A PARTICULAR PURPOSE.  See the
   GNU Lesser General Public License for more details.
   
   Cite this work as:
   * S. Grimme, C. Bannwarth, P. Shushkov, J. Chem. Theory Comput., 2017,
     13, 1989-2009. DOI: 10.1021/acs.jctc.7b00118
   * C. Bannwarth, S. Ehlert and S. Grimme., J. Chem. Theory Comput., 2019,
     15, 1652-1671. DOI: 10.1021/acs.jctc.8b01176
   * P. Pracht, E. Caldeweyher, S. Ehlert, S. Grimme, ChemRxiv, 2019, preprint.
     DOI: 10.26434/chemrxiv.8326202.v1
   
   for DFT-D4:
   * E. Caldeweyher, C. Bannwarth and S. Grimme, J. Chem. Phys., 2017,
     147, 034112. DOI: 10.1063/1.4993215
   * E. Caldeweyher, S. Ehlert, A. Hansen, H. Neugebauer, S. Spicher,
     C. Bannwarth and S. Grimme, J. Chem. Phys., 2019, 150, 154122.
     DOI: 10.1063/1.5090222
   
   for sTDA-xTB:
   * S. Grimme and C. Bannwarth, J. Chem. Phys., 2016, 145, 054103.
     DOI: 10.1063/1.4959605
   
   in the mass-spec context:
   * V. Asgeirsson, C. Bauer and S. Grimme, Chem. Sci., 2017, 8, 4879.
     DOI: 10.1039/c7sc00601b
   
   for metadynamics refer to:
   * S. Grimme, J. Chem. Theory Comput., 2019, 155, 2847-2862
     DOI: 10.1021/acs.jctc.9b00143
   
   with help from (in alphabetical order)
   C. Bannwarth, F. Bohle, G. Brandenburg, E. Caldeweyher, M. Checinski,
   S. Dohm, S. Ehlert, S. Ehrlich, F. März, H. Neugebauer, J. Pisarek,
   P. Pracht, P. Shushkov, and S. Spicher.
   
 * started run on 2020/05/12 at 11:43:50.606     

           -------------------------------------------------
          |                Calculation Setup                |
           -------------------------------------------------

          program call               : xtb --input C2O1_0_S_2.input C2O1_0_S_2.xyz --ohess --molden --namespace C2O1_0_S_2 output.out
          calculation namespace      : C2O1_0_S_2
          coordinate file            : C2O1_0_S_2.xyz
          number of atoms            :                     3
          number of electrons        :                    14
          charge                     :                     0
          spin                       :                   1.0
          first test random number   :      0.05090456470111

   ID    Z sym.   atoms
    1    6 C      1, 2
    2    8 O      3

           -------------------------------------------------
          |                 G F N 2 - x T B                 |
           -------------------------------------------------

        Reference                      10.1021/acs.jctc.8b01176
      * Hamiltonian:
        H0-scaling (s, p, d)           1.850000    2.230000    2.230000
        zeta-weighting                 0.500000
      * Dispersion:
        s8                             2.700000
        a1                             0.520000
        a2                             5.000000
        s9                             5.000000
      * Repulsion:
        kExp                           1.500000    1.000000
        rExp                           1.000000
      * Coulomb:
        alpha                          2.000000
        third order                    shell-resolved
        anisotropic                    true
        a3                             3.000000
        a5                             4.000000
        cn-shift                       1.200000
        cn-exp                         4.000000
        max-rad                        5.000000


          ...................................................
          :                      SETUP                      :
          :.................................................:
          :  # basis functions                  12          :
          :  # atomic orbitals                  12          :
          :  # shells                            6          :
          :  # electrons                        14          :
          :  max. iterations                   250          :
          :  Hamiltonian                  GFN2-xTB          :
          :  restarted?                      false          :
          :  GBSA solvation                  false          :
          :  PC potential                    false          :
          :  electronic temp.          300.0000000     K    :
          :  accuracy                    1.0000000          :
          :  -> integral cutoff          0.2500000E+02      :
          :  -> integral neglect         0.1000000E-07      :
          :  -> SCF convergence          0.1000000E-05 Eh   :
          :  -> wf. convergence          0.1000000E-03 e    :
          :  Broyden damping             0.4000000          :
          ...................................................

 iter      E             dE          RMSdq      gap      omega  full diag
   1     -7.9775095 -0.797751E+01  0.114E+01    1.23       0.0  T
   2     -7.7786751  0.198834E+00  0.773E+00    1.18       1.0  T
   3     -7.3309122  0.447763E+00  0.119E+01    2.09       1.0  T
   4     -7.9555150 -0.624603E+00  0.492E+00    1.26       1.0  T
   5     -8.0105424 -0.550274E-01  0.209E+00    1.12       1.0  T
   6     -8.0162825 -0.574010E-02  0.118E+00    1.09       1.0  T
   7     -8.0150622  0.122031E-02  0.739E-01    1.07       1.0  T
   8     -8.0178451 -0.278284E-02  0.187E-01    1.06       1.0  T
   9     -8.0178715 -0.264628E-04  0.121E-01    1.05       1.0  T
  10     -8.0179290 -0.574499E-04  0.955E-03    1.06       6.0  T
  11     -8.0179293 -0.336926E-06  0.561E-03    1.06      10.3  T
  12     -8.0179294 -0.574172E-07  0.111E-03    1.06      52.1  T
  13     -8.0179294 -0.238678E-08  0.300E-04    1.06     192.5  T
  14     -8.0179294 -0.417565E-09  0.742E-05    1.06     778.0  T

   *** convergence criteria satisfied after 14 iterations ***

         #    Occupation            Energy/Eh            Energy/eV
      -------------------------------------------------------------
         1        2.0000           -0.7563206             -20.5805
         2        2.0000           -0.6958017             -18.9337
         3        2.0000           -0.6262791             -17.0419
         4        2.0000           -0.5749094             -15.6441
         5        2.0000           -0.5618393             -15.2884
         6        2.0000           -0.5383924             -14.6504
         7        1.0000           -0.4619842             -12.5712
         8        1.0000           -0.4432591             -12.0617 (HOMO)
         9                         -0.4044263             -11.0050 (LUMO)
        10                         -0.3383631              -9.2073
        11                          0.0475130               1.2929
        12                          0.0584487               1.5905
      -------------------------------------------------------------
                  HL-Gap            0.0388328 Eh            1.0567 eV
             Fermi-level           -0.4620155 Eh          -12.5721 eV

 transition dipole moment (au) for excitation:           7           8
     X       Y       Z   
  -0.0000  -0.0000  -0.0536  total (au/Debye):    0.054   0.136
 dE (eV)             :    0.510
 oscillator strength :  0.50740E-04

 SCC (total)                   0 d,  0 h,  0 min,  0.002 sec
 SCC setup                      ...        0 min,  0.000 sec (  2.731%)
 Dispersion                     ...        0 min,  0.000 sec (  1.108%)
 integral evaluation            ...        0 min,  0.001 sec ( 22.944%)
 zeroth order Hamiltonian       ...        0 min,  0.000 sec (  0.373%)
 iterations                     ...        0 min,  0.001 sec ( 36.054%)
 molecular gradient             ...        0 min,  0.000 sec ( 18.984%)
 printout                       ...        0 min,  0.000 sec ( 17.372%)

         :::::::::::::::::::::::::::::::::::::::::::::::::::::
         ::                     SUMMARY                     ::
         :::::::::::::::::::::::::::::::::::::::::::::::::::::
         :: total energy              -7.994746871067 Eh    ::
         :: gradient norm              0.313707733883 Eh/a0 ::
         :: HOMO-LUMO gap              1.056694030740 eV    ::
         ::.................................................::
         :: SCC energy                -8.017929379609 Eh    ::
         :: -> isotropic ES           -0.000115832436 Eh    ::
         :: -> anisotropic ES         -0.000710642653 Eh    ::
         :: -> anisotropic XC          0.003575075741 Eh    ::
         :: -> dispersion             -0.000839422437 Eh    ::
         :: repulsion energy           0.023182507780 Eh    ::
         :: add. restraining           0.000000000000 Eh    ::
         :::::::::::::::::::::::::::::::::::::::::::::::::::::

      ----------------------------------------------------------- 
     |                   =====================                   |
     |                        A N C O P T                        |
     |                   =====================                   |
     |               Approximate Normal Coordinate               |
     |                Rational Function Optimizer                |
      ----------------------------------------------------------- 

          ...................................................
          :                      SETUP                      :
          :.................................................:
          :   optimization level            normal          :
          :   max. optcycles                   200          :
          :   ANC micro-cycles                  20          :
          :   degrees of freedom                 3          :
          :.................................................:
          :   RF solver                   davidson          :
          :   write xtbopt.log                true          :
          :   linear?                        false          :
          :   energy convergence         0.5000000E-05 Eh   :
          :   grad. convergence          0.1000000E-02 Eh/α :
          :   maximium RF displ.         1.0000000          :
          :   Hlow (freq-cutoff)         0.1000000E-01      :
          :   Hmax (freq-cutoff)         5.0000000          :
          :   S6 in model hess.         20.0000000          :
          ...................................................

generating ANC from model Hessian ...
Using Lindh-Hessian (1995)
 Shifting diagonal of input Hessian by    0.0000000000000000     
 Lowest  eigenvalues of input Hessian
   -0.000000   -0.000000   -0.000000    0.000000    0.000000    0.000000
    0.108407    0.783031    1.221677
 Highest eigenvalues
    0.000000    0.000000    0.000000    0.108407    0.783031    1.221677


........................................................................
.............................. CYCLE    1 ..............................
........................................................................
   1     -8.0179294 -0.801793E+01  0.177E-05    1.06       0.0  T
   2     -8.0179294  0.227374E-12  0.997E-06    1.06    5790.0  T
   3     -8.0179294  0.407319E-11  0.315E-05    1.06    1832.6  T
     SCC iter.                  ...        0 min,  0.000 sec
     gradient                   ...        0 min,  0.000 sec
 * total energy  :    -7.9947469 Eh     change        0.2793943E-09 Eh
   gradient norm :     0.3137091 Eh/α   predicted     0.0000000E+00 (-100.00%)
   displ. norm   :     0.3753034 α      lambda       -0.1052873E+00
   maximum displ.:     0.2839387 α      in ANC's #2, #1, #3, ...

........................................................................
.............................. CYCLE    2 ..............................
........................................................................
   1     -8.1005180 -0.810052E+01  0.370E+00    2.73       0.0  T
   2     -7.9850627  0.115455E+00  0.580E+00    2.62       1.0  T
   3     -8.1387111 -0.153648E+00  0.132E+00    2.61       1.0  T
   4     -8.1378383  0.872787E-03  0.916E-01    2.54       1.0  T
   5     -8.1398817 -0.204339E-02  0.132E-01    2.59       1.0  T
   6     -8.1398807  0.946089E-06  0.863E-02    2.60       1.0  T
   7     -8.1398940 -0.132829E-04  0.487E-03    2.60      11.9  T
   8     -8.1398941 -0.389193E-07  0.158E-03    2.60      36.5  T
   9     -8.1398941 -0.296666E-08  0.218E-04    2.60     265.0  T
  10     -8.1398941 -0.626503E-10  0.997E-05    2.60     579.4  T
     SCC iter.                  ...        0 min,  0.001 sec
     gradient                   ...        0 min,  0.000 sec
 * total energy  :    -8.0800933 Eh     change       -0.8534639E-01 Eh
   gradient norm :     0.1846016 Eh/α   predicted    -0.6005866E-01 ( -29.63%)
   displ. norm   :     0.3939578 α      lambda       -0.6993762E-01
   maximum displ.:     0.3216882 α      in ANC's #2, #3, #1, ...

........................................................................
.............................. CYCLE    3 ..............................
........................................................................
   1     -8.2235054 -0.822351E+01  0.343E+00    5.37       0.0  T
   2     -8.2194176  0.408782E-02  0.311E+00    4.80       1.0  T
   3     -8.2526095 -0.331919E-01  0.115E+00    5.08       1.0  T
   4     -8.2530424 -0.432917E-03  0.318E-01    5.03       1.0  T
   5     -8.2532361 -0.193694E-03  0.751E-02    5.06       1.0  T
   6     -8.2532340  0.208237E-05  0.527E-02    5.06       1.1  T
   7     -8.2532369 -0.284839E-05  0.304E-03    5.06      19.0  T
   8     -8.2532369  0.255251E-08  0.143E-03    5.06      40.5  T
   9     -8.2532369 -0.432598E-08  0.161E-04    5.06     359.1  T
  10     -8.2532369 -0.738254E-11  0.228E-05    5.06    2532.1  T
     SCC iter.                  ...        0 min,  0.000 sec
     gradient                   ...        0 min,  0.000 sec
 * total energy  :    -8.1017062 Eh     change       -0.2161293E-01 Eh
   gradient norm :     0.1900485 Eh/α   predicted    -0.4039607E-01 (  86.91%)
   displ. norm   :     0.4888422 α      lambda       -0.5166917E-01
   maximum displ.:     0.4858404 α      in ANC's #1, #2, #3, ...

........................................................................
.............................. CYCLE    4 ..............................
........................................................................
   1     -8.1808747 -0.818087E+01  0.317E+00    5.01       0.0  T
   2     -8.1763924  0.448228E-02  0.242E+00    5.27       1.0  T
   3     -8.1891458 -0.127533E-01  0.156E+00    5.05       1.0  T
   4     -8.1922299 -0.308412E-02  0.153E-01    5.10       1.0  T
   5     -8.1922619 -0.320103E-04  0.744E-02    5.11       1.0  T
   6     -8.1922629 -0.971204E-06  0.240E-02    5.11       2.4  T
   7     -8.1922630 -0.174061E-06  0.230E-03    5.11      25.1  T
   8     -8.1922630 -0.417558E-09  0.780E-04    5.11      74.0  T
   9     -8.1922630 -0.111161E-08  0.221E-04    5.11     261.3  T
     SCC iter.                  ...        0 min,  0.000 sec
     gradient                   ...        0 min,  0.000 sec
 * total energy  :    -8.1134706 Eh     change       -0.1176437E-01 Eh
   gradient norm :     0.1204325 Eh/α   predicted    -0.3200819E-01 ( 172.08%)
   displ. norm   :     0.1458430 α      lambda       -0.1026116E-01
   maximum displ.:     0.1441423 α      in ANC's #1, #3, #2, ...

........................................................................
.............................. CYCLE    5 ..............................
........................................................................
   1     -8.2176640 -0.821766E+01  0.113E+00    5.35       0.0  T
   2     -8.2171416  0.522449E-03  0.932E-01    5.23       1.0  T
   3     -8.2196145 -0.247288E-02  0.465E-01    5.30       1.0  T
   4     -8.2197761 -0.161594E-03  0.398E-02    5.28       1.5  T
   5     -8.2197793 -0.321213E-05  0.235E-02    5.28       2.5  T
   6     -8.2197795 -0.224642E-06  0.708E-03    5.28       8.2  T
   7     -8.2197795 -0.403210E-07  0.748E-04    5.28      77.2  T
   8     -8.2197795 -0.141986E-09  0.116E-04    5.28     498.7  T
     SCC iter.                  ...        0 min,  0.000 sec
     gradient                   ...        0 min,  0.000 sec
 * total energy  :    -8.1191289 Eh     change       -0.5658314E-02 Eh
   gradient norm :     0.0297910 Eh/α   predicted    -0.5239711E-02 (  -7.40%)
   displ. norm   :     0.0634958 α      lambda       -0.1249871E-02
   maximum displ.:     0.0396876 α      in ANC's #1, #2, #3, ...

........................................................................
.............................. CYCLE    6 ..............................
........................................................................
   1     -8.2238943 -0.822389E+01  0.431E-01    5.45       0.0  T
   2     -8.2238737  0.205648E-04  0.363E-01    5.41       1.0  T
   3     -8.2241868 -0.313081E-03  0.180E-01    5.44       1.0  T
   4     -8.2241990 -0.122262E-04  0.348E-02    5.43       1.7  T
   5     -8.2242020 -0.296464E-05  0.655E-03    5.43       8.8  T
   6     -8.2242020 -0.136654E-07  0.169E-03    5.43      34.3  T
   7     -8.2242020 -0.130807E-08  0.307E-04    5.43     188.1  T
   8     -8.2242020 -0.485461E-10  0.187E-05    5.43    3081.0  T
     SCC iter.                  ...        0 min,  0.000 sec
     gradient                   ...        0 min,  0.000 sec
 * total energy  :    -8.1200467 Eh     change       -0.9177936E-03 Eh
   gradient norm :     0.0117383 Eh/α   predicted    -0.6274551E-03 ( -31.63%)
   displ. norm   :     0.1240961 α      lambda       -0.1239029E-02
   maximum displ.:     0.0886444 α      in ANC's #1, #2, #3, ...

........................................................................
.............................. CYCLE    7 ..............................
........................................................................
   1     -8.2250006 -0.822500E+01  0.755E-01    5.64       0.0  T
   2     -8.2250145 -0.139273E-04  0.488E-01    5.63       1.0  T
   3     -8.2247226  0.291922E-03  0.328E-01    5.66       1.0  T
   4     -8.2250756 -0.352951E-03  0.248E-02    5.64       2.3  T
   5     -8.2250762 -0.605468E-06  0.144E-02    5.64       4.0  T
   6     -8.2250763 -0.924582E-07  0.132E-03    5.64      43.7  T
   7     -8.2250763 -0.622313E-09  0.587E-04    5.64      98.4  T
   8     -8.2250763 -0.447002E-10  0.605E-05    5.64     954.4  T
     SCC iter.                  ...        0 min,  0.000 sec
     gradient                   ...        0 min,  0.000 sec
 * total energy  :    -8.1208750 Eh     change       -0.8283400E-03 Eh
   gradient norm :     0.0066496 Eh/α   predicted    -0.6290532E-03 ( -24.06%)
   displ. norm   :     0.0764267 α      lambda       -0.3092177E-03
   maximum displ.:     0.0520099 α      in ANC's #1, #2, #3, ...

........................................................................
.............................. CYCLE    8 ..............................
........................................................................
   1     -8.2244617 -0.822446E+01  0.472E-01    5.67       0.0  T
   2     -8.2244663 -0.458160E-05  0.299E-01    5.67       1.0  T
   3     -8.2244178  0.485263E-04  0.121E-01    5.68       1.0  T
   4     -8.2244730 -0.552523E-04  0.131E-02    5.67       4.4  T
   5     -8.2244731 -0.105761E-06  0.791E-03    5.67       7.3  T
   6     -8.2244731 -0.335720E-07  0.698E-04    5.67      82.8  T
   7     -8.2244731 -0.689582E-10  0.362E-04    5.67     159.4  T
     SCC iter.                  ...        0 min,  0.001 sec
     gradient                   ...        0 min,  0.000 sec
 * total energy  :    -8.1210681 Eh     change       -0.1930781E-03 Eh
   gradient norm :     0.0066718 Eh/α   predicted    -0.1555114E-03 ( -19.46%)
   displ. norm   :     0.0327870 α      lambda       -0.8994353E-04
   maximum displ.:     0.0267347 α      in ANC's #2, #1, #3, ...

........................................................................
.............................. CYCLE    9 ..............................
........................................................................
   1     -8.2264495 -0.822645E+01  0.208E-01    5.73       0.0  T
   2     -8.2264511 -0.159390E-05  0.136E-01    5.72       1.0  T
   3     -8.2264374  0.137357E-04  0.995E-02    5.73       1.0  T
   4     -8.2264606 -0.232073E-04  0.542E-03    5.72      10.7  T
   5     -8.2264606 -0.100490E-07  0.351E-03    5.72      16.5  T
   6     -8.2264606 -0.930941E-08  0.320E-04    5.72     180.6  T
   7     -8.2264606 -0.246096E-10  0.170E-04    5.72     340.0  T
     SCC iter.                  ...        0 min,  0.001 sec
     gradient                   ...        0 min,  0.000 sec
 * total energy  :    -8.1211177 Eh     change       -0.4961528E-04 Eh
   gradient norm :     0.0018835 Eh/α   predicted    -0.4502086E-04 (  -9.26%)
   displ. norm   :     0.0209153 α      lambda       -0.7912318E-05
   maximum displ.:     0.0134475 α      in ANC's #1, #2, #3, ...

........................................................................
.............................. CYCLE   10 ..............................
........................................................................
   1     -8.2261315 -0.822613E+01  0.132E-01    5.71       0.0  T
   2     -8.2261319 -0.356999E-06  0.826E-02    5.71       1.0  T
   3     -8.2261301  0.176452E-05  0.237E-02    5.71       2.4  T
   4     -8.2261322 -0.212192E-05  0.397E-03    5.71      14.5  T
   5     -8.2261323 -0.139486E-07  0.224E-03    5.71      25.7  T
   6     -8.2261323 -0.235834E-08  0.195E-04    5.71     295.7  T
   7     -8.2261323 -0.347633E-11  0.991E-05    5.71     582.3  T
     SCC iter.                  ...        0 min,  0.000 sec
     gradient                   ...        0 min,  0.000 sec
 * total energy  :    -8.1211194 Eh     change       -0.1651957E-05 Eh
   gradient norm :     0.0014805 Eh/α   predicted    -0.3957579E-05 ( 139.57%)
   displ. norm   :     0.0078119 α      lambda       -0.2817470E-05
   maximum displ.:     0.0057495 α      in ANC's #1, #2, #3, ...

........................................................................
.............................. CYCLE   11 ..............................
........................................................................
   1     -8.2265484 -0.822655E+01  0.489E-02    5.72       0.0  T
   2     -8.2265484 -0.524015E-07  0.309E-02    5.72       1.9  T
   3     -8.2265476  0.787342E-06  0.164E-02    5.72       3.5  T
   4     -8.2265485 -0.898746E-06  0.142E-03    5.72      40.6  T
   5     -8.2265485 -0.516707E-10  0.875E-04    5.72      66.0  T
   6     -8.2265485 -0.838853E-09  0.750E-05    5.72     769.9  T
     SCC iter.                  ...        0 min,  0.000 sec
     gradient                   ...        0 min,  0.001 sec
 * total energy  :    -8.1211213 Eh     change       -0.1905475E-05 Eh
   gradient norm :     0.0003685 Eh/α   predicted    -0.1407664E-05 ( -26.13%)
   displ. norm   :     0.0005693 α      lambda       -0.1201071E-06
   maximum displ.:     0.0004155 α      in ANC's #2, #3, #1, ...

   *** GEOMETRY OPTIMIZATION CONVERGED AFTER 11 ITERATIONS ***

------------------------------------------------------------------------
 total energy gain   :        -0.1263744 Eh      -79.3011 kcal/mol
 total RMSD          :         0.7502059 a0        0.3970 Å
 total power (kW/mol):       -30.1632652 (step)********** (real)
------------------------------------------------------------------------

 ANCopt (total)                0 d,  0 h,  0 min,  0.016 sec
 optimizer setup                ...        0 min,  0.000 sec (  0.585%)
 model hessian                  ...        0 min,  0.000 sec (  0.335%)
 ANC generation                 ...        0 min,  0.000 sec (  0.194%)
 coordinate transformation      ...        0 min,  0.000 sec (  0.123%)
 single point calculation       ...        0 min,  0.016 sec ( 94.535%)
 optimization log               ...        0 min,  0.000 sec (  1.059%)
 hessian update                 ...        0 min,  0.000 sec (  0.116%)
 rational function              ...        0 min,  0.000 sec (  1.015%)

================
 final structure:
================
3
 xtb: 6.2.2 (9d81278992624c895f80dd42a50cac0aa55982e2)
C        -0.05157336396721   -0.00016928438599    0.00000000000000
C         1.26687260853871    0.00338934275730    0.00000000000000
O        -1.21529924457149   -0.00322005837131    0.00000000000000

 Bond Distances (Angstroems)
 ---------------------------
C1-C2=1.3185         C1-O3=1.1637         C2-C1=1.3185         O3-C1=1.1637         
 C  C  Rav=1.3185 sigma=0.0000  Rmin=1.3185  Rmax=1.3185     1
 O  C  Rav=1.1637 sigma=0.0000  Rmin=1.1637  Rmax=1.1637     1

 selected bond angles (degree)
 --------------------
O3-C1-C2=180.00                

 selected dihedral angles (degree)
 ---------------------------------

           -------------------------------------------------
          |                Final Singlepoint                |
           -------------------------------------------------

          ...................................................
          :                      SETUP                      :
          :.................................................:
          :  # basis functions                  12          :
          :  # atomic orbitals                  12          :
          :  # shells                            6          :
          :  # electrons                        14          :
          :  max. iterations                   250          :
          :  Hamiltonian                  GFN2-xTB          :
          :  restarted?                      false          :
          :  GBSA solvation                  false          :
          :  PC potential                    false          :
          :  electronic temp.          300.0000000     K    :
          :  accuracy                    1.0000000          :
          :  -> integral cutoff          0.2500000E+02      :
          :  -> integral neglect         0.1000000E-07      :
          :  -> SCF convergence          0.1000000E-05 Eh   :
          :  -> wf. convergence          0.1000000E-03 e    :
          :  Broyden damping             0.4000000          :
          ...................................................

 iter      E             dE          RMSdq      gap      omega  full diag
   1     -8.2265485 -0.822655E+01  0.147E-05    5.72       0.0  T
   2     -8.2265485 -0.213163E-13  0.101E-05    5.72    5728.1  T
   3     -8.2265485  0.888178E-13  0.652E-06    5.72    8853.9  T

   *** convergence criteria satisfied after 3 iterations ***

         #    Occupation            Energy/Eh            Energy/eV
      -------------------------------------------------------------
         1        2.0000           -0.8000993             -21.7718
         2        2.0000           -0.7011950             -19.0805
         3        2.0000           -0.6300317             -17.1440
         4        2.0000           -0.6250478             -17.0084
         5        2.0000           -0.6250478             -17.0084
         6        2.0000           -0.4719330             -12.8419
         7        1.0000           -0.4326193             -11.7722
         8        1.0000           -0.4326193             -11.7722 (HOMO)
         9                         -0.2224078              -6.0520 (LUMO)
        10                         -0.2224078              -6.0520
        11                          0.2166806               5.8962
        12                          1.0459710              28.4623
      -------------------------------------------------------------
                  HL-Gap            0.2102116 Eh            5.7201 eV
             Fermi-level           -0.3900595 Eh          -10.6141 eV

 transition dipole moment (au) for excitation:           7           8
     X       Y       Z   
  -0.0000   0.0000  -0.0000  total (au/Debye):    0.000   0.000
 dE (eV)             :    0.000
 oscillator strength :  0.21833E-19

 SCC (total)                   0 d,  0 h,  0 min,  0.001 sec
 SCC setup                      ...        0 min,  0.000 sec (  2.900%)
 Dispersion                     ...        0 min,  0.000 sec (  0.278%)
 integral evaluation            ...        0 min,  0.000 sec ( 32.210%)
 zeroth order Hamiltonian       ...        0 min,  0.000 sec (  0.295%)
 iterations                     ...        0 min,  0.000 sec (  9.776%)
 molecular gradient             ...        0 min,  0.000 sec ( 26.810%)
 printout                       ...        0 min,  0.000 sec ( 27.244%)

         :::::::::::::::::::::::::::::::::::::::::::::::::::::
         ::                     SUMMARY                     ::
         :::::::::::::::::::::::::::::::::::::::::::::::::::::
         :: total energy              -8.121121261851 Eh    ::
         :: gradient norm              0.000374786518 Eh/a0 ::
         :: HOMO-LUMO gap              5.720147928449 eV    ::
         ::.................................................::
         :: SCC energy                -8.226548516909 Eh    ::
         :: -> isotropic ES            0.000681706583 Eh    ::
         :: -> anisotropic ES          0.000856170996 Eh    ::
         :: -> anisotropic XC          0.004659956941 Eh    ::
         :: -> dispersion             -0.000841081665 Eh    ::
         :: repulsion energy           0.105427258188 Eh    ::
         :: add. restraining           0.000000000000 Eh    ::
         :::::::::::::::::::::::::::::::::::::::::::::::::::::

           ------------------------------------------------- 
          |                Numerical Hessian                |
           ------------------------------------------------- 
step length          :   0.00500
SCC accuracy         :   0.30000
Hessian scale factor :   1.00000
frozen atoms in %    :   0.00000    0
RMS gradient         :   0.00037
estimated CPU  time      0.00 min
estimated wall time      0.00 min

writing file <hessian>.

 vibrational frequencies (cm-1)
eigval :        0.00     0.00     0.00     0.00     0.00   252.81
eigval :      253.04  1241.46  2104.81
           -------------------------------------------------
          |                Property Printout                |
           -------------------------------------------------

    * Orbital Energies and Occupations

         #    Occupation            Energy/Eh            Energy/eV
      -------------------------------------------------------------
         1        2.0000           -0.8000992             -21.7718
         2        2.0000           -0.7011950             -19.0805
         3        2.0000           -0.6300317             -17.1440
         4        2.0000           -0.6250478             -17.0084
         5        2.0000           -0.6250477             -17.0084
         6        2.0000           -0.4719330             -12.8420
         7        1.0000           -0.4326193             -11.7722
         8        1.0000           -0.4326193             -11.7722 (HOMO)
         9                         -0.2224078              -6.0520 (LUMO)
        10                         -0.2224077              -6.0520
        11                          0.2166806               5.8962
        12                          1.0459710              28.4623
      -------------------------------------------------------------
                  HL-Gap            0.2102116 Eh            5.7201 eV
             Fermi-level           -0.3900595 Eh          -10.6141 eV

     #   Z        covCN         q      C6AA      α(0)
     1   6 C      1.836     0.292    24.537     8.002
     2   6 C      0.981    -0.156    41.018    10.757
     3   8 O      0.856    -0.136    17.062     5.538

 Mol. C6AA /au·bohr⁶  :        238.052828
 Mol. C8AA /au·bohr⁸  :       6297.551037
 Mol. α(0) /au        :         24.297517


Wiberg/Mayer (AO) data.
largest (>0.10) Wiberg bond orders for each atom
          total WBO             WBO to atom ...
     1  C   3.546        O    3 2.018    C    2 1.528
Molecule has the following symmetry elements: (Cinf) (sigma) 
It seems to be the Cinfv point group
     2  C   1.577        C    1 1.528
     3  O   2.066        C    1 2.018

MOs/occ written to file <molden.input>


molecular dipole:
                 x           y           z       tot (Debye)
 q only:       -0.088      -0.000       0.000
   full:       -0.490      -0.001       0.000       1.245
molecular quadrupole (traceless):
                xx          xy          yy          xz          yz          zz
 q only:       -1.608      -0.006       0.804       0.000       0.000       0.804
  q+dip:       -3.138      -0.013       1.569       0.000       0.000       1.569
   full:       -5.357      -0.022       2.678       0.000       0.000       2.679

           -------------------------------------------------
          |                Geometry Summary                 |
           -------------------------------------------------

      molecular mass/u    :       40.0208767
   center of mass at/Å    :       -0.1211224      -0.0003203       0.0000004
  moments of inertia/u·Å² :        0.1927836E-07   0.4235230E+02   0.4235230E+02
rotational constants/cm⁻¹ :        0.8744327E+09   0.3980335E+00   0.3980335E+00

 * 1 selected distances

     #   Z        #   Z                                     value/Å
     1   6 C      3   8 O                                 1.1637299 (max)

 * 1 distinct bonds (by element types)

   Z      Z             #   av. dist./Å        max./Å        min./Å
   6 C    8 O           1     1.1637299     1.1637299     1.1637299

           -------------------------------------------------
          |               Frequency Printout                |
           -------------------------------------------------
 vibrational frequencies (cm-1)
eigval :        0.00     0.00     0.00     0.00     0.00   252.81
eigval :      253.04  1241.46  2104.81
 reduced masses (amu)
   1: 12.88   2: 13.16   3: 13.61   4: 14.26   5: 14.55   6: 12.60   7: 12.60   8: 13.42
   9: 13.00
 IR intensities (amu)
   1:  0.11   2:  0.12   3:  0.10   4:  0.01   5:  0.01   6:  0.86   7:  0.86   8:  0.41
   9:  1.71
 Raman intensities (amu)
   1:  0.00   2:  0.00   3:  0.00   4:  0.00   5:  0.00   6:  0.00   7:  0.00   8:  0.00
   9:  0.00
 output can be read by thermo (or use thermo option).
 writing <g98.out> molden fake output.
 recommended (thermochemical) frequency scaling factor: 1.0
           -------------------------------------------------
          |             Thermodynamic Functions             |
           -------------------------------------------------

cin symmetry found (for desy threshold:  0.10E+00) used in thermo

          ...................................................
          :                      SETUP                      :
          :.................................................:
          :  # frequencies                           4      :
          :  # imaginary freq.                       0      :
          :  linear?                              true      :
          :  only rotor calc.                    false      :
          :  symmetry                              cin      :
          :  rotational number                       1      :
          :  scaling factor                  1.0000000      :
          :  rotor cutoff                   50.0000000 cm⁻¹ :
          :  imag. cutoff                  -20.0000000 cm⁻¹ :
          :.................................................:

    mode    ω/cm⁻¹     T·S(HO)/kcal·mol⁻¹    T·S(FR)/kcal·mol⁻¹   T·S(vib)
   ------------------------------------------------------------------------
       1    252.81    -0.00000 ( 99.85%)     0.01442 (  0.15%)     0.00002
       2    253.04    -0.00000 ( 99.85%)     0.01443 (  0.15%)     0.00002
   ------------------------------------------------------------------------

   temp. (K)  partition function   enthalpy   heat capacity  entropy
                                   cal/mol     cal/K/mol   cal/K/mol   J/K/mol
 298.15  VIB   2.02                  614.543      3.703      3.457
         ROT   521.                  592.502      1.987     14.418
         INT  0.105E+04             1207.045      5.690     17.874
         TR   0.245E+27             1481.254      4.968     36.972
         TOT                        2688.2988    10.6585    54.8457   229.4746

   temp. (K)  partition function   enthalpy   heat capacity  entropy
                                   cal/mol     cal/K/mol   cal/K/mol   J/K/mol
 120.00  VIB   1.10                   73.233      1.945      0.808
         ROT   210.                  238.471      1.987     12.609
         INT   231.                  311.704      3.932     13.417
         TR   0.625E+26              596.178      4.968     32.452
         TOT                         907.8822     8.8999    45.8697   191.9187

   temp. (K)  partition function   enthalpy   heat capacity  entropy
                                   cal/mol     cal/K/mol   cal/K/mol   J/K/mol
 100.00  VIB   1.05                   39.031      1.459      0.498
         ROT   175.                  198.726      1.987     12.247
         INT   184.                  237.757      3.446     12.745
         TR   0.476E+26              496.815      4.968     31.547
         TOT                         734.5719     8.4141    44.2915   185.3155

   temp. (K)  partition function   enthalpy   heat capacity  entropy
                                   cal/mol     cal/K/mol   cal/K/mol   J/K/mol
  80.00  VIB   1.02                   15.465      0.889      0.237
         ROT   140.                  158.981      1.987     11.803
         INT   143.                  174.446      2.876     12.040
         TR   0.340E+26              397.452      4.968     30.439
         TOT                         571.8980     7.8442    42.4791   177.7326

   temp. (K)  partition function   enthalpy   heat capacity  entropy
                                   cal/mol     cal/K/mol   cal/K/mol   J/K/mol
  60.00  VIB   1.00                    3.367      0.341      0.066
         ROT   105.                  119.236      1.987     11.232
         INT   105.                  122.603      2.328     11.298
         TR   0.221E+26              298.089      4.968     29.010
         TOT                         420.6915     7.2965    40.3080   168.6488

   temp. (K)  partition function   enthalpy   heat capacity  entropy
                                   cal/mol     cal/K/mol   cal/K/mol   J/K/mol
  40.00  VIB   1.00                    0.162      0.037      0.004
         ROT   69.8                   79.490      1.987     10.426
         INT   69.9                   79.652      2.024     10.430
         TR   0.120E+26              198.726      4.968     26.997
         TOT                         278.3783     6.9922    37.4268   156.5939

   temp. (K)  partition function   enthalpy   heat capacity  entropy
                                   cal/mol     cal/K/mol   cal/K/mol   J/K/mol
  20.00  VIB   1.00                    0.000      0.000     -0.002
         ROT   34.9                   39.745      1.987      9.048
         INT   34.9                   39.745      1.987      9.046
         TR   0.426E+25               99.363      4.968     23.555
         TOT                         139.1082     6.9554    32.6008   136.4018

   temp. (K)  partition function   enthalpy   heat capacity  entropy
                                   cal/mol     cal/K/mol   cal/K/mol   J/K/mol
  10.00  VIB   1.00                    0.000      0.000     -0.004
         ROT   17.5                   19.873      1.987      7.671
         INT   17.5                   19.873      1.987      7.666
         TR   0.150E+25               49.681      4.968     20.113
         TOT                          69.5541     6.9554    27.7793   116.2284

       T/K    H(0)-H(T)+PV         H(T)/Eh          T*S/Eh         G(T)/Eh
   ------------------------------------------------------------------------
    298.15    0.428408E-02    0.130599E-01    0.260590E-01   -0.129991E-01
    120.00    0.144680E-02    0.102226E-01    0.877176E-02    0.145085E-02
    100.00    0.117061E-02    0.994642E-02    0.705829E-02    0.288812E-02
     80.00    0.911377E-03    0.968718E-02    0.541558E-02    0.427160E-02
     60.00    0.670415E-03    0.944622E-02    0.385410E-02    0.559212E-02
     40.00    0.443624E-03    0.921942E-02    0.238574E-02    0.683369E-02
     20.00    0.221683E-03    0.899748E-02    0.103905E-02    0.795843E-02
     10.00    0.110842E-03    0.888664E-02    0.442691E-03    0.844395E-02 (used)
   ------------------------------------------------------------------------

         :::::::::::::::::::::::::::::::::::::::::::::::::::::
         ::                  THERMODYNAMIC                  ::
         :::::::::::::::::::::::::::::::::::::::::::::::::::::
         :: total free energy          -8.112677310521 Eh   ::
         ::.................................................::
         :: total energy               -8.121121261827 Eh   ::
         :: zero point energy           0.008775800465 Eh   ::
         :: G(RRHO) w/o ZPVE           -0.000331849159 Eh   ::
         :: G(RRHO) contrib.            0.008443951307 Eh   ::
         :::::::::::::::::::::::::::::::::::::::::::::::::::::

optimized geometry written to: xtbopt.xyz


           -------------------------------------------------
          | TOTAL ENERGY               -8.121121261827 Eh   |
          | TOTAL ENTHALPY             -8.112234619849 Eh   |
          | TOTAL FREE ENERGY          -8.112677310521 Eh   |
          | GRADIENT NORM               0.000374672258 Eh/α |
          | HOMO-LUMO GAP               5.720148300309 eV   |
           -------------------------------------------------

------------------------------------------------------------------------
 * finished run on 2020/05/12 at 11:43:50.664     
------------------------------------------------------------------------
 total:
 * wall-time:     0 d,  0 h,  0 min,  0.057 sec
 *  cpu-time:     0 d,  0 h,  0 min,  0.057 sec
 * ratio c/w:     0.999 speedup
 SCF:
 * wall-time:     0 d,  0 h,  0 min,  0.002 sec
 *  cpu-time:     0 d,  0 h,  0 min,  0.002 sec
 * ratio c/w:     1.000 speedup
 ANC optimizer:
 * wall-time:     0 d,  0 h,  0 min,  0.019 sec
 *  cpu-time:     0 d,  0 h,  0 min,  0.019 sec
 * ratio c/w:     0.998 speedup
 numerical hessian:
 * wall-time:     0 d,  0 h,  0 min,  0.022 sec
 *  cpu-time:     0 d,  0 h,  0 min,  0.022 sec
 * ratio c/w:     1.000 speedup

