      -----------------------------------------------------------      
     |                   =====================                   |     
     |                           x T B                           |     
     |                   =====================                   |     
     |                         S. Grimme                         |     
     |          Mulliken Center for Theoretical Chemistry        |     
     |                    University of Bonn                     |     
      -----------------------------------------------------------      

   * xtb version 6.2.2 (9d81278992624c895f80dd42a50cac0aa55982e2) compiled by '@Darwin' on 04/03/2020

   xtb is free software: you can redistribute it and/or modify it under
   the terms of the GNU Lesser General Public License as published by
   the Free Software Foundation, either version 3 of the License, or
   (at your option) any later version.
   
   xtb is distributed in the hope that it will be useful,
   but WITHOUT ANY WARRANTY; without even the implied warranty of
   MERCHANTABILITY or FITNESS FOR A PARTICULAR PURPOSE.  See the
   GNU Lesser General Public License for more details.
   
   Cite this work as:
   * S. Grimme, C. Bannwarth, P. Shushkov, J. Chem. Theory Comput., 2017,
     13, 1989-2009. DOI: 10.1021/acs.jctc.7b00118
   * C. Bannwarth, S. Ehlert and S. Grimme., J. Chem. Theory Comput., 2019,
     15, 1652-1671. DOI: 10.1021/acs.jctc.8b01176
   * P. Pracht, E. Caldeweyher, S. Ehlert, S. Grimme, ChemRxiv, 2019, preprint.
     DOI: 10.26434/chemrxiv.8326202.v1
   
   for DFT-D4:
   * E. Caldeweyher, C. Bannwarth and S. Grimme, J. Chem. Phys., 2017,
     147, 034112. DOI: 10.1063/1.4993215
   * E. Caldeweyher, S. Ehlert, A. Hansen, H. Neugebauer, S. Spicher,
     C. Bannwarth and S. Grimme, J. Chem. Phys., 2019, 150, 154122.
     DOI: 10.1063/1.5090222
   
   for sTDA-xTB:
   * S. Grimme and C. Bannwarth, J. Chem. Phys., 2016, 145, 054103.
     DOI: 10.1063/1.4959605
   
   in the mass-spec context:
   * V. Asgeirsson, C. Bauer and S. Grimme, Chem. Sci., 2017, 8, 4879.
     DOI: 10.1039/c7sc00601b
   
   for metadynamics refer to:
   * S. Grimme, J. Chem. Theory Comput., 2019, 155, 2847-2862
     DOI: 10.1021/acs.jctc.9b00143
   
   with help from (in alphabetical order)
   C. Bannwarth, F. Bohle, G. Brandenburg, E. Caldeweyher, M. Checinski,
   S. Dohm, S. Ehlert, S. Ehrlich, F. März, H. Neugebauer, J. Pisarek,
   P. Pracht, P. Shushkov, and S. Spicher.
   
 * started run on 2020/05/12 at 11:45:20.062     

           -------------------------------------------------
          |                Calculation Setup                |
           -------------------------------------------------

          program call               : xtb --input H2C1N2_0_S_2.input H2C1N2_0_S_2.xyz --ohess --molden --namespace H2C1N2_0_S_2 output.out
          calculation namespace      : H2C1N2_0_S_2
          coordinate file            : H2C1N2_0_S_2.xyz
          number of atoms            :                     5
          number of electrons        :                    16
          charge                     :                     0
          spin                       :                   1.0
          first test random number   :      0.72531538404763

   ID    Z sym.   atoms
    1    7 N      1, 3
    2    6 C      2
    3    1 H      4, 5

           -------------------------------------------------
          |                 G F N 2 - x T B                 |
           -------------------------------------------------

        Reference                      10.1021/acs.jctc.8b01176
      * Hamiltonian:
        H0-scaling (s, p, d)           1.850000    2.230000    2.230000
        zeta-weighting                 0.500000
      * Dispersion:
        s8                             2.700000
        a1                             0.520000
        a2                             5.000000
        s9                             5.000000
      * Repulsion:
        kExp                           1.500000    1.000000
        rExp                           1.000000
      * Coulomb:
        alpha                          2.000000
        third order                    shell-resolved
        anisotropic                    true
        a3                             3.000000
        a5                             4.000000
        cn-shift                       1.200000
        cn-exp                         4.000000
        max-rad                        5.000000


          ...................................................
          :                      SETUP                      :
          :.................................................:
          :  # basis functions                  14          :
          :  # atomic orbitals                  14          :
          :  # shells                            8          :
          :  # electrons                        16          :
          :  max. iterations                   250          :
          :  Hamiltonian                  GFN2-xTB          :
          :  restarted?                      false          :
          :  GBSA solvation                  false          :
          :  PC potential                    false          :
          :  electronic temp.          300.0000000     K    :
          :  accuracy                    1.0000000          :
          :  -> integral cutoff          0.2500000E+02      :
          :  -> integral neglect         0.1000000E-07      :
          :  -> SCF convergence          0.1000000E-05 Eh   :
          :  -> wf. convergence          0.1000000E-03 e    :
          :  Broyden damping             0.4000000          :
          ...................................................

 iter      E             dE          RMSdq      gap      omega  full diag
   1     -8.5031289 -0.850313E+01  0.600E+00    0.16       0.0  T
   2     -7.8934447  0.609684E+00  0.957E+00    0.04       1.0  T
   3     -8.6408737 -0.747429E+00  0.395E+00    0.25       1.0  T
   4     -8.6309301  0.994359E-02  0.260E+00    0.28       1.0  T
   5     -8.6192471  0.116830E-01  0.289E+00    0.14       1.0  T
   6     -8.6344019 -0.151548E-01  0.198E+00    0.14       1.0  T
   7     -8.6428162 -0.841427E-02  0.604E-01    0.17       1.0  T
   8     -8.6397647  0.305150E-02  0.123E+00    0.16       1.0  T
   9     -8.6423838 -0.261911E-02  0.432E-01    0.17       1.0  T
  10     -8.6431369 -0.753039E-03  0.104E-01    0.16       1.0  T
  11     -8.6431457 -0.880734E-05  0.263E-02    0.16       1.7  T
  12     -8.6431436  0.210429E-05  0.348E-02    0.16       1.3  T
  13     -8.6431438 -0.223645E-06  0.346E-02    0.16       1.3  T
  14     -8.6431459 -0.208846E-05  0.178E-02    0.16       2.5  T
  15     -8.6431467 -0.838939E-06  0.283E-03    0.16      15.8  T
  16     -8.6431467 -0.747398E-08  0.799E-04    0.16      56.0  T
  17     -8.6431467 -0.179936E-08  0.403E-05    0.16    1110.8  T

   *** convergence criteria satisfied after 17 iterations ***

         #    Occupation            Energy/Eh            Energy/eV
      -------------------------------------------------------------
         1        2.0000           -0.7179038             -19.5352
       ...           ...                  ...                  ...
         3        2.0000           -0.6476708             -17.6240
         4        2.0000           -0.6269997             -17.0615
         5        2.0000           -0.4886533             -13.2969
         6        2.0000           -0.4578550             -12.4589
         7        1.6644           -0.3724297             -10.1343
         8        1.3356           -0.3711322             -10.0990
         9        0.9599           -0.3396027              -9.2411 (HOMO)
        10        0.0401           -0.3335686              -9.0769 (LUMO)
        11                         -0.0688433              -1.8733
        12                          0.0347118               0.9446
        13                          0.0735180               2.0005
        14                          0.0905614               2.4643
      -------------------------------------------------------------
                  HL-Gap            0.0060341 Eh            0.1642 eV
             Fermi-level           -0.3541833 Eh           -9.6378 eV

 transition dipole moment (au) for excitation:           8           9
     X       Y       Z   
   0.9690   0.0906   0.0038  total (au/Debye):    0.973   2.474
 dE (eV)             :    0.858
 oscillator strength :  0.28156E-01

 SCC (total)                   0 d,  0 h,  0 min,  0.004 sec
 SCC setup                      ...        0 min,  0.000 sec (  2.380%)
 Dispersion                     ...        0 min,  0.000 sec (  0.388%)
 integral evaluation            ...        0 min,  0.001 sec ( 20.038%)
 zeroth order Hamiltonian       ...        0 min,  0.000 sec (  0.486%)
 iterations                     ...        0 min,  0.001 sec ( 36.128%)
 molecular gradient             ...        0 min,  0.001 sec ( 19.355%)
 printout                       ...        0 min,  0.001 sec ( 20.912%)

         :::::::::::::::::::::::::::::::::::::::::::::::::::::
         ::                     SUMMARY                     ::
         :::::::::::::::::::::::::::::::::::::::::::::::::::::
         :: total energy              -8.596333677816 Eh    ::
         :: gradient norm              0.048961004993 Eh/a0 ::
         :: HOMO-LUMO gap              0.164195487067 eV    ::
         ::.................................................::
         :: SCC energy                -8.643146715546 Eh    ::
         :: -> isotropic ES            0.010243365084 Eh    ::
         :: -> anisotropic ES          0.003247743037 Eh    ::
         :: -> anisotropic XC          0.006845336256 Eh    ::
         :: -> dispersion             -0.001457061158 Eh    ::
         :: repulsion energy           0.046813002106 Eh    ::
         :: add. restraining           0.000000000000 Eh    ::
         :::::::::::::::::::::::::::::::::::::::::::::::::::::

      ----------------------------------------------------------- 
     |                   =====================                   |
     |                        A N C O P T                        |
     |                   =====================                   |
     |               Approximate Normal Coordinate               |
     |                Rational Function Optimizer                |
      ----------------------------------------------------------- 

          ...................................................
          :                      SETUP                      :
          :.................................................:
          :   optimization level            normal          :
          :   max. optcycles                   200          :
          :   ANC micro-cycles                  20          :
          :   degrees of freedom                 9          :
          :.................................................:
          :   RF solver                   davidson          :
          :   write xtbopt.log                true          :
          :   linear?                        false          :
          :   energy convergence         0.5000000E-05 Eh   :
          :   grad. convergence          0.1000000E-02 Eh/α :
          :   maximium RF displ.         1.0000000          :
          :   Hlow (freq-cutoff)         0.1000000E-01      :
          :   Hmax (freq-cutoff)         5.0000000          :
          :   S6 in model hess.         20.0000000          :
          ...................................................

generating ANC from model Hessian ...
Using Lindh-Hessian (1995)
 Shifting diagonal of input Hessian by    0.0000000000000000     
 Lowest  eigenvalues of input Hessian
   -0.000000   -0.000000   -0.000000   -0.000000    0.000000    0.000000
    0.121335    0.128468    0.158773    0.187500    0.195201    0.541230
    1.289236    1.303349    1.427594
 Highest eigenvalues
    0.187500    0.195201    0.541230    1.289236    1.303349    1.427594


........................................................................
.............................. CYCLE    1 ..............................
........................................................................
   1     -8.6431467 -0.864315E+01  0.244E-05    0.16       0.0  T
   2     -8.6431467  0.762750E-10  0.113E-04    0.16     397.1  T
   3     -8.6431467 -0.757971E-10  0.331E-05    0.16    1350.5  T
     SCC iter.                  ...        0 min,  0.001 sec
     gradient                   ...        0 min,  0.001 sec
 * total energy  :    -8.5963337 Eh     change        0.9398349E-10 Eh
   gradient norm :     0.0489615 Eh/α   predicted     0.0000000E+00 (-100.00%)
   displ. norm   :     0.3094106 α      lambda       -0.1391639E-01
   maximum displ.:     0.3001051 α      in ANC's #1, #4, #6, ...

........................................................................
.............................. CYCLE    2 ..............................
........................................................................
   1     -8.6396480 -0.863965E+01  0.305E+00    0.84       0.0  T
   2     -8.5363551  0.103293E+00  0.564E+00    0.44       1.0  T
   3     -8.6564505 -0.120095E+00  0.188E+00    0.72       1.0  T
   4     -8.6462059  0.102446E-01  0.192E+00    0.79       1.0  T
   5     -8.6532556 -0.704969E-02  0.166E+00    0.67       1.0  T
   6     -8.6582772 -0.502159E-02  0.865E-01    0.68       1.0  T
   7     -8.6594601 -0.118288E-02  0.660E-01    0.69       1.0  T
   8     -8.6604449 -0.984847E-03  0.554E-02    0.71       1.0  T
   9     -8.6604349  0.100238E-04  0.829E-02    0.70       1.0  T
  10     -8.6604472 -0.123613E-04  0.581E-02    0.70       1.0  T
  11     -8.6604542 -0.698090E-05  0.276E-03    0.70      16.2  T
  12     -8.6604542  0.445483E-08  0.347E-03    0.70      12.9  T
  13     -8.6604542 -0.225061E-07  0.230E-03    0.70      19.4  T
  14     -8.6604543 -0.169121E-07  0.136E-04    0.70     328.7  T
  15     -8.6604543  0.490097E-11  0.152E-04    0.70     294.5  T
     SCC iter.                  ...        0 min,  0.001 sec
     gradient                   ...        0 min,  0.001 sec
 * total energy  :    -8.6120761 Eh     change       -0.1574240E-01 Eh
   gradient norm :     0.0602028 Eh/α   predicted    -0.7624343E-02 ( -51.57%)
   displ. norm   :     0.3613231 α      lambda       -0.2008323E-01
   maximum displ.:     0.3461227 α      in ANC's #1, #4, #6, ...

........................................................................
.............................. CYCLE    3 ..............................
........................................................................
   1     -8.6680225 -0.866802E+01  0.303E+00    1.85       0.0  T
   2     -8.5988643  0.691581E-01  0.525E+00    1.43       1.0  T
   3     -8.6790711 -0.802068E-01  0.183E+00    1.70       1.0  T
   4     -8.6753480  0.372317E-02  0.160E+00    1.75       1.0  T
   5     -8.6808186 -0.547065E-02  0.105E+00    1.65       1.0  T
   6     -8.6814682 -0.649559E-03  0.656E-01    1.65       1.0  T
   7     -8.6816497 -0.181464E-03  0.386E-01    1.65       1.0  T
   8     -8.6819120 -0.262395E-03  0.113E-01    1.65       1.0  T
   9     -8.6818570  0.550827E-04  0.215E-01    1.65       1.0  T
  10     -8.6819397 -0.826894E-04  0.338E-02    1.65       1.3  T
  11     -8.6819418 -0.213996E-05  0.491E-03    1.65       9.1  T
  12     -8.6819418 -0.154077E-07  0.483E-03    1.65       9.3  T
  13     -8.6819418 -0.375791E-07  0.168E-03    1.65      26.6  T
  14     -8.6819419 -0.371741E-08  0.783E-04    1.65      57.1  T
  15     -8.6819419 -0.960625E-09  0.629E-05    1.65     711.0  T
     SCC iter.                  ...        0 min,  0.001 sec
     gradient                   ...        0 min,  0.001 sec
 * total energy  :    -8.6337425 Eh     change       -0.2166642E-01 Eh
   gradient norm :     0.0738307 Eh/α   predicted    -0.1135259E-01 ( -47.60%)
   displ. norm   :     0.3891625 α      lambda       -0.2545119E-01
   maximum displ.:     0.3653216 α      in ANC's #1, #4, #6, ...

........................................................................
.............................. CYCLE    4 ..............................
........................................................................
   1     -8.6972623 -0.869726E+01  0.314E+00    3.37       0.0  T
   2     -8.6533451  0.439172E-01  0.441E+00    3.08       1.0  T
   3     -8.7027985 -0.494535E-01  0.168E+00    3.31       1.0  T
   4     -8.7050309 -0.223239E-02  0.113E+00    3.24       1.0  T
   5     -8.7052323 -0.201412E-03  0.911E-01    3.24       1.0  T
   6     -8.7066421 -0.140972E-02  0.310E-01    3.20       1.0  T
   7     -8.7067675 -0.125415E-03  0.155E-01    3.20       1.0  T
   8     -8.7067245  0.429520E-04  0.225E-01    3.20       1.0  T
   9     -8.7068048 -0.802658E-04  0.263E-02    3.20       1.7  T
  10     -8.7068052 -0.394821E-06  0.216E-02    3.20       2.1  T
  11     -8.7068060 -0.794251E-06  0.178E-03    3.20      25.1  T
  12     -8.7068060 -0.492446E-08  0.239E-04    3.20     186.7  T
  13     -8.7068060 -0.380425E-10  0.141E-04    3.20     317.3  T
     SCC iter.                  ...        0 min,  0.001 sec
     gradient                   ...        0 min,  0.001 sec
 * total energy  :    -8.6584115 Eh     change       -0.2466905E-01 Eh
   gradient norm :     0.0688795 Eh/α   predicted    -0.1465285E-01 ( -40.60%)
   displ. norm   :     0.7830513 α      lambda       -0.4656596E-01
   maximum displ.:     0.7040445 α      in ANC's #1, #4, #6, ...

........................................................................
.............................. CYCLE    5 ..............................
........................................................................
   1     -8.7429870 -0.874299E+01  0.768E+00    0.79       0.0  T
   2     -8.7683007 -0.253137E-01  0.377E+00    1.78       1.0  T
   3     -8.7672215  0.107923E-02  0.150E+00    1.79       1.0  T
   4     -8.7697868 -0.256529E-02  0.703E-01    1.89       1.0  T
   5     -8.7713797 -0.159295E-02  0.259E-01    1.84       1.0  T
   6     -8.7713979 -0.181813E-04  0.310E-02    1.84       1.4  T
   7     -8.7713986 -0.633076E-06  0.895E-03    1.84       5.0  T
   8     -8.7713986 -0.714249E-08  0.280E-03    1.84      16.0  T
   9     -8.7713986 -0.375938E-08  0.429E-04    1.84     104.2  T
  10     -8.7713986  0.307898E-09  0.348E-04    1.84     128.5  T
     SCC iter.                  ...        0 min,  0.001 sec
     gradient                   ...        0 min,  0.001 sec
 * total energy  :    -8.6440255 Eh     change        0.1438604E-01 Eh
   gradient norm :     0.4148031 Eh/α   predicted    -0.3755944E-01 (-361.08%)
   displ. norm   :     0.4773198 α      lambda       -0.1849133E+00
   maximum displ.:     0.3842864 α      in ANC's #1, #4, #6, ...

........................................................................
.............................. CYCLE    6 ..............................
........................................................................
   1     -8.6904458 -0.869045E+01  0.560E+00    3.90       0.0  T
   2     -8.6050431  0.854026E-01  0.457E+00    3.37       1.0  T
   3     -8.6788472 -0.738040E-01  0.400E+00    3.76       1.0  T
   4     -8.7113030 -0.324559E-01  0.166E+00    3.75       1.0  T
   5     -8.7169058 -0.560274E-02  0.176E+00    3.69       1.0  T
   6     -8.7141278  0.277796E-02  0.214E+00    3.69       1.0  T
   7     -8.7068385  0.728930E-02  0.292E+00    3.68       1.0  T
   8     -8.7098153 -0.297676E-02  0.250E+00    3.69       1.0  T
   9     -8.7173990 -0.758370E-02  0.162E+00    3.68       1.0  T
  10     -8.7221287 -0.472977E-02  0.128E-01    3.67       1.0  T
  11     -8.7221487 -0.200186E-04  0.103E-01    3.67       1.0  T
  12     -8.7221562 -0.742050E-05  0.101E-01    3.67       1.0  T
  13     -8.7221749 -0.187463E-04  0.287E-02    3.67       1.6  T
  14     -8.7221761 -0.122034E-05  0.923E-03    3.67       4.8  T
  15     -8.7221762 -0.115078E-06  0.647E-03    3.67       6.9  T
  16     -8.7221763 -0.834010E-07  0.233E-03    3.67      19.2  T
  17     -8.7221763 -0.103502E-07  0.856E-04    3.67      52.2  T
  18     -8.7221763 -0.145531E-08  0.111E-04    3.67     403.9  T
     SCC iter.                  ...        0 min,  0.002 sec
     gradient                   ...        0 min,  0.001 sec
 * total energy  :    -8.6714416 Eh     change       -0.2741605E-01 Eh
   gradient norm :     0.0680389 Eh/α   predicted    -0.1135214E+00 ( 314.07%)
   displ. norm   :     0.0651794 α      lambda       -0.3972166E-02
   maximum displ.:     0.0506281 α      in ANC's #6, #4, #5, ...

........................................................................
.............................. CYCLE    7 ..............................
........................................................................
   1     -8.7259219 -0.872592E+01  0.196E+00    3.90       0.0  T
   2     -8.6935915  0.323304E-01  0.359E+00    3.98       1.0  T
   3     -8.7289196 -0.353281E-01  0.129E+00    3.88       1.0  T
   4     -8.7316397 -0.272005E-02  0.422E-01    3.90       1.0  T
   5     -8.7307232  0.916493E-03  0.760E-01    3.89       1.0  T
   6     -8.7321340 -0.141084E-02  0.195E-01    3.90       1.0  T
   7     -8.7322106 -0.766209E-04  0.294E-02    3.90       1.5  T
   8     -8.7322122 -0.151185E-05  0.219E-02    3.90       2.0  T
   9     -8.7322130 -0.815729E-06  0.595E-03    3.90       7.5  T
  10     -8.7322131 -0.100772E-06  0.152E-03    3.90      29.4  T
  11     -8.7322131 -0.485570E-08  0.695E-05    3.90     643.9  T
  12     -8.7322131 -0.337685E-11  0.650E-05    3.90     688.3  T
     SCC iter.                  ...        0 min,  0.001 sec
     gradient                   ...        0 min,  0.001 sec
 * total energy  :    -8.6752210 Eh     change       -0.3779400E-02 Eh
   gradient norm :     0.0649610 Eh/α   predicted    -0.1994521E-02 ( -47.23%)
   displ. norm   :     0.7529652 α      lambda       -0.4567657E-01
   maximum displ.:     0.5014473 α      in ANC's #6, #4, #1, ...

........................................................................
.............................. CYCLE    8 ..............................
........................................................................
   1     -8.6676902 -0.866769E+01  0.826E+00    0.34       0.0  T
   2     -8.7148019 -0.471117E-01  0.430E+00    1.42       1.0  T
   3     -8.7473365 -0.325346E-01  0.243E+00    0.35       1.0  T
   4     -8.7490307 -0.169421E-02  0.122E+00    0.16       1.0  T
   5     -8.7465622  0.246852E-02  0.107E+00    0.06       1.0  T
   6     -8.7488517 -0.228950E-02  0.539E-01    0.22       1.0  T
   7     -8.7492511 -0.399398E-03  0.348E-02    0.14       1.3  T
   8     -8.7492531 -0.198781E-05  0.155E-02    0.14       2.9  T
   9     -8.7492532 -0.106182E-06  0.124E-02    0.14       3.6  T
  10     -8.7492534 -0.204915E-06  0.195E-03    0.14      23.0  T
  11     -8.7492534 -0.912408E-10  0.206E-03    0.14      21.7  T
  12     -8.7492534 -0.577933E-08  0.528E-04    0.14      84.7  T
  13     -8.7492534 -0.372935E-09  0.195E-04    0.14     229.6  T
     SCC iter.                  ...        0 min,  0.001 sec
     gradient                   ...        0 min,  0.001 sec
 * total energy  :    -8.3231004 Eh     change        0.3521205E+00 Eh
   gradient norm :     2.0292786 Eh/α   predicted    -0.3578658E-01 (-110.16%)
   displ. norm   :     0.4882857 α      lambda       -0.9801735E+00
   maximum displ.:     0.3261024 α      in ANC's #6, #1, #4, ...

........................................................................
.............................. CYCLE    9 ..............................
........................................................................
   1     -8.7649464 -0.876495E+01  0.372E+00    3.21       0.0  T
   2     -8.7673540 -0.240752E-02  0.215E+00    3.18       1.0  T
   3     -8.7620601  0.529389E-02  0.155E+00    2.79       1.0  T
   4     -8.7725362 -0.104761E-01  0.349E-01    3.03       1.0  T
   5     -8.7726505 -0.114254E-03  0.136E-01    2.99       1.0  T
   6     -8.7726516 -0.113320E-05  0.219E-02    2.99       2.0  T
   7     -8.7726519 -0.314669E-06  0.747E-03    2.99       6.0  T
   8     -8.7726522 -0.282909E-06  0.937E-04    2.99      47.7  T
   9     -8.7726522  0.717771E-09  0.571E-04    2.99      78.3  T
     SCC iter.                  ...        0 min,  0.001 sec
     gradient                   ...        0 min,  0.001 sec
 * total energy  :    -8.6789093 Eh     change       -0.3558089E+00 Eh
   gradient norm :     0.0710976 Eh/α   predicted    -0.6069348E+00 (  70.58%)
   displ. norm   :     0.1735689 α      lambda       -0.8125537E-02
   maximum displ.:     0.1371411 α      in ANC's #5, #6, #1, ...

........................................................................
.............................. CYCLE   10 ..............................
........................................................................
   1     -8.7635515 -0.876355E+01  0.603E-01    3.49       0.0  T
   2     -8.7637170 -0.165464E-03  0.311E-01    3.52       1.0  T
   3     -8.7637330 -0.159409E-04  0.877E-02    3.52       1.0  T
   4     -8.7637315  0.145350E-05  0.294E-02    3.52       1.5  T
   5     -8.7637318 -0.301082E-06  0.305E-02    3.51       1.5  T
   6     -8.7637348 -0.295082E-05  0.283E-03    3.52      15.8  T
   7     -8.7637348 -0.123830E-08  0.694E-04    3.52      64.4  T
   8     -8.7637348 -0.920922E-09  0.219E-04    3.52     203.9  T
     SCC iter.                  ...        0 min,  0.001 sec
     gradient                   ...        0 min,  0.001 sec
 * total energy  :    -8.6839840 Eh     change       -0.5074699E-02 Eh
   gradient norm :     0.0277723 Eh/α   predicted    -0.4185159E-02 ( -17.53%)
   displ. norm   :     0.0687260 α      lambda       -0.1102049E-02
   maximum displ.:     0.0366382 α      in ANC's #5, #4, #1, ...

........................................................................
.............................. CYCLE   11 ..............................
........................................................................
   1     -8.7590077 -0.875901E+01  0.225E-01    3.57       0.0  T
   2     -8.7590351 -0.274221E-04  0.119E-01    3.59       1.0  T
   3     -8.7590110  0.241272E-04  0.853E-02    3.58       1.0  T
   4     -8.7590411 -0.300830E-04  0.283E-02    3.59       1.6  T
   5     -8.7590434 -0.229188E-05  0.104E-02    3.58       4.3  T
   6     -8.7590435 -0.130236E-06  0.148E-03    3.58      30.2  T
   7     -8.7590435 -0.858876E-09  0.266E-04    3.58     168.3  T
   8     -8.7590435 -0.641620E-11  0.107E-04    3.58     416.9  T
     SCC iter.                  ...        0 min,  0.001 sec
     gradient                   ...        0 min,  0.001 sec
 * total energy  :    -8.6846610 Eh     change       -0.6769768E-03 Eh
   gradient norm :     0.0138917 Eh/α   predicted    -0.5536262E-03 ( -18.22%)
   displ. norm   :     0.0241285 α      lambda       -0.1972175E-03
   maximum displ.:     0.0153754 α      in ANC's #1, #4, #6, ...

........................................................................
.............................. CYCLE   12 ..............................
........................................................................
   1     -8.7575337 -0.875753E+01  0.833E-02    3.49       0.0  T
   2     -8.7575367 -0.298328E-05  0.509E-02    3.50       1.0  T
   3     -8.7575353  0.141122E-05  0.415E-02    3.49       1.1  T
   4     -8.7575431 -0.782002E-05  0.103E-02    3.50       4.4  T
   5     -8.7575431 -0.339956E-07  0.304E-03    3.50      14.7  T
   6     -8.7575431 -0.502765E-08  0.559E-04    3.50      80.0  T
   7     -8.7575431 -0.198625E-09  0.774E-05    3.50     577.9  T
     SCC iter.                  ...        0 min,  0.000 sec
     gradient                   ...        0 min,  0.001 sec
 * total energy  :    -8.6848015 Eh     change       -0.1405431E-03 Eh
   gradient norm :     0.0092966 Eh/α   predicted    -0.9866474E-04 ( -29.80%)
   displ. norm   :     0.0208192 α      lambda       -0.1416047E-03
   maximum displ.:     0.0114682 α      in ANC's #5, #9, #1, ...

........................................................................
.............................. CYCLE   13 ..............................
........................................................................
   1     -8.7567488 -0.875675E+01  0.953E-02    3.32       0.0  T
   2     -8.7567471  0.162468E-05  0.653E-02    3.34       1.0  T
   3     -8.7567511 -0.395535E-05  0.456E-02    3.32       1.0  T
   4     -8.7567598 -0.867554E-05  0.620E-03    3.33       7.2  T
   5     -8.7567598 -0.113593E-08  0.235E-03    3.33      19.0  T
   6     -8.7567598 -0.251666E-08  0.345E-04    3.33     129.6  T
   7     -8.7567598 -0.405187E-10  0.792E-05    3.33     565.0  T
     SCC iter.                  ...        0 min,  0.001 sec
     gradient                   ...        0 min,  0.001 sec
 * total energy  :    -8.6848979 Eh     change       -0.9641205E-04 Eh
   gradient norm :     0.0058119 Eh/α   predicted    -0.7083442E-04 ( -26.53%)
   displ. norm   :     0.0152071 α      lambda       -0.6846385E-04
   maximum displ.:     0.0100477 α      in ANC's #9, #5, #8, ...

........................................................................
.............................. CYCLE   14 ..............................
........................................................................
   1     -8.7567761 -0.875678E+01  0.822E-02    3.18       0.0  T
   2     -8.7567733  0.272778E-05  0.582E-02    3.19       1.0  T
   3     -8.7567784 -0.502692E-05  0.377E-02    3.18       1.2  T
   4     -8.7567837 -0.529649E-05  0.398E-03    3.19      11.2  T
   5     -8.7567837 -0.149075E-07  0.640E-04    3.19      69.9  T
   6     -8.7567837 -0.100189E-08  0.206E-04    3.19     216.7  T
     SCC iter.                  ...        0 min,  0.000 sec
     gradient                   ...        0 min,  0.001 sec
 * total energy  :    -8.6849440 Eh     change       -0.4607768E-04 Eh
   gradient norm :     0.0037797 Eh/α   predicted    -0.3423911E-04 ( -25.69%)
   displ. norm   :     0.0099132 α      lambda       -0.2976641E-04
   maximum displ.:     0.0074897 α      in ANC's #9, #4, #8, ...

........................................................................
.............................. CYCLE   15 ..............................
........................................................................
   1     -8.7570903 -0.875709E+01  0.550E-02    3.12       0.0  T
   2     -8.7570886  0.173539E-05  0.419E-02    3.13       1.1  T
   3     -8.7570937 -0.515033E-05  0.228E-02    3.12       2.0  T
   4     -8.7570951 -0.142814E-05  0.393E-03    3.12      11.4  T
   5     -8.7570952 -0.397319E-07  0.144E-03    3.12      31.0  T
   6     -8.7570952 -0.166852E-08  0.162E-04    3.12     275.5  T
   7     -8.7570952 -0.381206E-11  0.236E-05    3.12    1897.6  T
     SCC iter.                  ...        0 min,  0.000 sec
     gradient                   ...        0 min,  0.001 sec
 * total energy  :    -8.6849644 Eh     change       -0.2044427E-04 Eh
   gradient norm :     0.0024305 Eh/α   predicted    -0.1488466E-04 ( -27.19%)
   displ. norm   :     0.0087099 α      lambda       -0.1635860E-04
   maximum displ.:     0.0052945 α      in ANC's #9, #5, #1, ...

........................................................................
.............................. CYCLE   16 ..............................
........................................................................
   1     -8.7573878 -0.875739E+01  0.410E-02    3.11       0.0  T
   2     -8.7573866  0.124649E-05  0.326E-02    3.11       1.4  T
   3     -8.7573906 -0.406233E-05  0.162E-02    3.11       2.8  T
   4     -8.7573912 -0.594435E-06  0.283E-03    3.11      15.8  T
   5     -8.7573913 -0.212510E-07  0.866E-04    3.11      51.6  T
   6     -8.7573913 -0.297595E-09  0.140E-04    3.11     319.5  T
     SCC iter.                  ...        0 min,  0.000 sec
     gradient                   ...        0 min,  0.001 sec
 * total energy  :    -8.6849756 Eh     change       -0.1112961E-04 Eh
   gradient norm :     0.0014431 Eh/α   predicted    -0.8181802E-05 ( -26.49%)
   displ. norm   :     0.0111676 α      lambda       -0.7153356E-05
   maximum displ.:     0.0096863 α      in ANC's #5, #9, #6, ...

........................................................................
.............................. CYCLE   17 ..............................
........................................................................
   1     -8.7576026 -0.875760E+01  0.426E-02    3.14       0.0  T
   2     -8.7576017  0.979245E-06  0.306E-02    3.14       1.5  T
   3     -8.7576043 -0.258888E-05  0.192E-02    3.14       2.3  T
   4     -8.7576053 -0.106951E-05  0.178E-03    3.14      25.2  T
   5     -8.7576053 -0.449330E-08  0.795E-04    3.14      56.2  T
   6     -8.7576053 -0.347141E-09  0.121E-04    3.14     371.0  T
     SCC iter.                  ...        0 min,  0.000 sec
     gradient                   ...        0 min,  0.001 sec
 * total energy  :    -8.6849801 Eh     change       -0.4569693E-05 Eh
   gradient norm :     0.0006406 Eh/α   predicted    -0.3577837E-05 ( -21.71%)
   displ. norm   :     0.0026553 α      lambda       -0.7433251E-06
   maximum displ.:     0.0015447 α      in ANC's #9, #1, #4, ...

   *** GEOMETRY OPTIMIZATION CONVERGED AFTER 17 ITERATIONS ***

------------------------------------------------------------------------
 total energy gain   :        -0.0886465 Eh      -55.6265 kcal/mol
 total RMSD          :         0.7045967 a0        0.3729 Å
 total power (kW/mol):       -13.6906626 (step)-5412.9799 (real)
------------------------------------------------------------------------

 ANCopt (total)                0 d,  0 h,  0 min,  0.043 sec
 optimizer setup                ...        0 min,  0.000 sec (  0.251%)
 model hessian                  ...        0 min,  0.000 sec (  0.355%)
 ANC generation                 ...        0 min,  0.000 sec (  0.223%)
 coordinate transformation      ...        0 min,  0.000 sec (  0.100%)
 single point calculation       ...        0 min,  0.041 sec ( 95.520%)
 optimization log               ...        0 min,  0.000 sec (  1.053%)
 hessian update                 ...        0 min,  0.000 sec (  0.100%)
 rational function              ...        0 min,  0.000 sec (  0.993%)

================
 final structure:
================
5
 xtb: 6.2.2 (9d81278992624c895f80dd42a50cac0aa55982e2)
N         0.02498701054506   -0.30068939213755    0.01801053713977
C         0.74248358215126    0.96562274047135   -0.05009183584141
N        -0.60355189283641    1.03257799075647   -0.06672223800749
H        -0.09000445430368   -0.79824139662006    0.90392884505046
H        -0.07391424555622   -0.89927094247022   -0.80512430834133

 Bond Distances (Angstroems)
 ---------------------------
N1-C2=1.4570         N1-N3=1.4764         N1-H4=1.0226         N1-H5=1.0226         C2-N1=1.4570         C2-N3=1.3478         
N3-N1=1.4764         N3-C2=1.3478         H4-N1=1.0226         H5-N1=1.0226         
 N  H  Rav=1.0226 sigma=0.0000  Rmin=1.0226  Rmax=1.0226     2
 N  C  Rav=1.4024 sigma=0.0546  Rmin=1.3478  Rmax=1.4570     2
 N  N  Rav=1.4764 sigma=0.0000  Rmin=1.4764  Rmax=1.4764     1

 selected bond angles (degree)
 --------------------
N3-N1-C2= 54.70                H4-N1-C2=121.25                H4-N1-N3=116.18                H5-N1-C2=121.25                
H5-N1-N3=116.18                H5-N1-H4=113.68                N3-C2-N1= 63.38                C2-N3-N1= 61.92                

 selected dihedral angles (degree)
 ---------------------------------
N3-C2-N1-H4=258.30            N3-C2-N1-H5=101.70            C2-N3-N1-H4=111.11            C2-N3-N1-H5=248.89            
           -------------------------------------------------
          |                Final Singlepoint                |
           -------------------------------------------------

          ...................................................
          :                      SETUP                      :
          :.................................................:
          :  # basis functions                  14          :
          :  # atomic orbitals                  14          :
          :  # shells                            8          :
          :  # electrons                        16          :
          :  max. iterations                   250          :
          :  Hamiltonian                  GFN2-xTB          :
          :  restarted?                      false          :
          :  GBSA solvation                  false          :
          :  PC potential                    false          :
          :  electronic temp.          300.0000000     K    :
          :  accuracy                    1.0000000          :
          :  -> integral cutoff          0.2500000E+02      :
          :  -> integral neglect         0.1000000E-07      :
          :  -> SCF convergence          0.1000000E-05 Eh   :
          :  -> wf. convergence          0.1000000E-03 e    :
          :  Broyden damping             0.4000000          :
          ...................................................

 iter      E             dE          RMSdq      gap      omega  full diag
   1     -8.7576053 -0.875761E+01  0.246E-05    3.14       0.0  T
   2     -8.7576053 -0.532907E-13  0.146E-05    3.14    3069.9  T
   3     -8.7576053  0.261124E-12  0.122E-05    3.14    3670.7  T

   *** convergence criteria satisfied after 3 iterations ***

         #    Occupation            Energy/Eh            Energy/eV
      -------------------------------------------------------------
         1        2.0000           -0.7025272             -19.1167
       ...           ...                  ...                  ...
         3        2.0000           -0.6015564             -16.3692
         4        2.0000           -0.5700435             -15.5117
         5        2.0000           -0.5005729             -13.6213
         6        2.0000           -0.4265326             -11.6065
         7        2.0000           -0.3992111             -10.8631
         8        1.0000           -0.3745442             -10.1919
         9        1.0000           -0.2368712              -6.4456 (HOMO)
        10                         -0.1215794              -3.3083 (LUMO)
        11                         -0.0748855              -2.0377
        12                          0.1022774               2.7831
        13                          0.1516957               4.1279
        14                          0.3383177               9.2061
      -------------------------------------------------------------
                  HL-Gap            0.1152918 Eh            3.1372 eV
             Fermi-level           -0.2830515 Eh           -7.7022 eV

 transition dipole moment (au) for excitation:           8           9
     X       Y       Z   
   0.0023  -0.0144  -0.2438  total (au/Debye):    0.244   0.621
 dE (eV)             :    3.746
 oscillator strength :  0.77443E-02

 SCC (total)                   0 d,  0 h,  0 min,  0.003 sec
 SCC setup                      ...        0 min,  0.000 sec (  3.069%)
 Dispersion                     ...        0 min,  0.000 sec (  0.462%)
 integral evaluation            ...        0 min,  0.001 sec ( 29.472%)
 zeroth order Hamiltonian       ...        0 min,  0.000 sec (  0.471%)
 iterations                     ...        0 min,  0.000 sec (  9.457%)
 molecular gradient             ...        0 min,  0.001 sec ( 29.907%)
 printout                       ...        0 min,  0.001 sec ( 26.837%)

         :::::::::::::::::::::::::::::::::::::::::::::::::::::
         ::                     SUMMARY                     ::
         :::::::::::::::::::::::::::::::::::::::::::::::::::::
         :: total energy              -8.684980143308 Eh    ::
         :: gradient norm              0.000645273763 Eh/a0 ::
         :: HOMO-LUMO gap              3.137249609831 eV    ::
         ::.................................................::
         :: SCC energy                -8.757605331321 Eh    ::
         :: -> isotropic ES            0.016575798490 Eh    ::
         :: -> anisotropic ES          0.004816312177 Eh    ::
         :: -> anisotropic XC          0.009969619867 Eh    ::
         :: -> dispersion             -0.001442278375 Eh    ::
         :: repulsion energy           0.072625168321 Eh    ::
         :: add. restraining           0.000000000000 Eh    ::
         :::::::::::::::::::::::::::::::::::::::::::::::::::::

           ------------------------------------------------- 
          |                Numerical Hessian                |
           ------------------------------------------------- 
step length          :   0.00500
SCC accuracy         :   0.30000
Hessian scale factor :   1.00000
frozen atoms in %    :   0.00000    0
RMS gradient         :   0.00065
estimated CPU  time      0.00 min
estimated wall time      0.00 min

writing file <hessian>.

 projected vibrational frequencies (cm-1)
eigval :       -0.00    -0.00    -0.00    -0.00    -0.00     0.00
eigval :      681.13   865.89   873.63   974.14  1023.18  1474.57
eigval :     1548.14  3190.38  3208.54
           -------------------------------------------------
          |                Property Printout                |
           -------------------------------------------------

    * Orbital Energies and Occupations

         #    Occupation            Energy/Eh            Energy/eV
      -------------------------------------------------------------
         1        2.0000           -0.7025272             -19.1167
         2        2.0000           -0.6451376             -17.5551
         3        2.0000           -0.6015564             -16.3692
         4        2.0000           -0.5700435             -15.5117
         5        2.0000           -0.5005729             -13.6213
         6        2.0000           -0.4265326             -11.6065
         7        2.0000           -0.3992111             -10.8631
         8        1.0000           -0.3745441             -10.1919
         9        1.0000           -0.2368712              -6.4456 (HOMO)
        10                         -0.1215794              -3.3083 (LUMO)
        11                         -0.0748855              -2.0377
        12                          0.1022774               2.7831
        13                          0.1516957               4.1279
        14                          0.3383177               9.2061
      -------------------------------------------------------------
                  HL-Gap            0.1152918 Eh            3.1372 eV
             Fermi-level           -0.2830515 Eh           -7.7022 eV

     #   Z        covCN         q      C6AA      α(0)
     1   7 N      3.597     0.007    21.132     6.828
     2   6 C      1.817    -0.083    33.446     9.344
     3   7 N      1.881    -0.264    27.708     7.803
     4   1 H      0.859     0.170     1.275     1.769
     5   1 H      0.859     0.170     1.275     1.769

 Mol. C6AA /au·bohr⁶  :        319.601795
 Mol. C8AA /au·bohr⁸  :       7250.990707
 Mol. α(0) /au        :         27.512400


Wiberg/Mayer (AO) data.
largest (>0.10) Wiberg bond orders for each atom
          total WBO             WBO to atom ...
     1  N   3.624        H    5 0.942    H    4 0.942    N    3 0.892    C    2 0.848
     2  C   2.082        N    3 1.206    N    1 0.848
     3  N   2.125        C    2 1.206    N    1 0.892
     4  H   0.969        N    1 0.942
     5  H   0.969        N    1 0.942

MOs/occ written to file <molden.input>


molecular dipole:
                 x           y           z       tot (Debye)
 q only:        0.133      -1.214       0.073
   full:        0.218      -1.775       0.107       4.554
molecular quadrupole (traceless):
                xx          xy          yy          xz          yz          zz
 q only:       -0.739       0.689      -0.594      -0.060       0.121       1.332
  q+dip:       -0.504       1.321      -2.400      -0.110       0.327       2.904
   full:       -0.652       1.287      -1.708      -0.105       0.253       2.359

           -------------------------------------------------
          |                Geometry Summary                 |
           -------------------------------------------------

      molecular mass/u    :       42.0400238
   center of mass at/Å    :        0.0154345       0.4790242      -0.0281726
  moments of inertia/u·Å² :        0.1319293E+02   0.2077139E+02   0.3100972E+02
rotational constants/cm⁻¹ :        0.1277778E+01   0.8115792E+00   0.5436242E+00

 * 2 selected distances

     #   Z        #   Z                                     value/Å
     1   7 N      4   1 H                                 1.0225616 (min)
     1   7 N      5   1 H                                 1.0225616 (max)

 * 1 distinct bonds (by element types)

   Z      Z             #   av. dist./Å        max./Å        min./Å
   1 H    7 N           2     1.0225616     1.0225616     1.0225616
Molecule has the following symmetry elements: (sigma) 
It seems to be the Cs point group

           -------------------------------------------------
          |               Frequency Printout                |
           -------------------------------------------------
 projected vibrational frequencies (cm-1)
eigval :       -0.00    -0.00    -0.00    -0.00    -0.00     0.00
eigval :      681.13   865.89   873.63   974.14  1023.18  1474.57
eigval :     1548.14  3190.38  3208.54
 reduced masses (amu)
   1: 10.29   2: 13.04   3: 11.66   4: 12.14   5: 12.81   6: 12.52   7: 13.33   8:  2.42
   9:  4.65  10: 11.61  11:  3.53  12:  2.44  13: 12.15  14:  2.18  15:  1.35
 IR intensities (amu)
   1:  0.46   2:  0.28   3:  0.18   4:  0.12   5:  0.26   6:  0.26   7:  0.41   8:  0.04
   9:  0.61  10:  0.57  11:  0.09  12:  0.25  13:  0.34  14:  0.08  15:  0.04
 Raman intensities (amu)
   1:  0.00   2:  0.00   3:  0.00   4:  0.00   5:  0.00   6:  0.00   7:  0.00   8:  0.00
   9:  0.00  10:  0.00  11:  0.00  12:  0.00  13:  0.00  14:  0.00  15:  0.00
 output can be read by thermo (or use thermo option).
 writing <g98.out> molden fake output.
 recommended (thermochemical) frequency scaling factor: 1.0
           -------------------------------------------------
          |             Thermodynamic Functions             |
           -------------------------------------------------

cs  symmetry found (for desy threshold:  0.10E+00) used in thermo

          ...................................................
          :                      SETUP                      :
          :.................................................:
          :  # frequencies                           9      :
          :  # imaginary freq.                       0      :
          :  linear?                             false      :
          :  only rotor calc.                    false      :
          :  symmetry                               cs      :
          :  rotational number                       1      :
          :  scaling factor                  1.0000000      :
          :  rotor cutoff                   50.0000000 cm⁻¹ :
          :  imag. cutoff                  -20.0000000 cm⁻¹ :
          :.................................................:

    mode    ω/cm⁻¹     T·S(HO)/kcal·mol⁻¹    T·S(FR)/kcal·mol⁻¹   T·S(vib)
   ------------------------------------------------------------------------
   ------------------------------------------------------------------------

   temp. (K)  partition function   enthalpy   heat capacity  entropy
                                   cal/mol     cal/K/mol   cal/K/mol   J/K/mol
 298.15  VIB   1.09                  204.174      2.855      0.856
         ROT  0.704E+04              888.752      2.981     20.587
         INT  0.768E+04             1092.926      5.836     21.443
         TR   0.264E+27             1481.254      4.968     37.118
         TOT                        2574.1801    10.8044    58.5614   245.0210

   temp. (K)  partition function   enthalpy   heat capacity  entropy
                                   cal/mol     cal/K/mol   cal/K/mol   J/K/mol
 120.00  VIB   1.00                    0.738      0.054      0.007
         ROT  0.180E+04              357.707      2.981     17.874
         INT  0.180E+04              358.445      3.035     17.881
         TR   0.673E+26              596.178      4.968     32.599
         TOT                         954.6227     8.0032    50.4801   211.2086

   temp. (K)  partition function   enthalpy   heat capacity  entropy
                                   cal/mol     cal/K/mol   cal/K/mol   J/K/mol
 100.00  VIB   1.00                    0.130      0.013      0.001
         ROT  0.137E+04              298.089      2.981     17.331
         INT  0.137E+04              298.219      2.994     17.332
         TR   0.512E+26              496.815      4.968     31.693
         TOT                         795.0338     7.9624    49.0258   205.1239

   temp. (K)  partition function   enthalpy   heat capacity  entropy
                                   cal/mol     cal/K/mol   cal/K/mol   J/K/mol
  80.00  VIB   1.00                    0.010      0.002      0.000
         ROT   979.                  238.471      2.981     16.666
         INT   979.                  238.481      2.982     16.666
         TR   0.367E+26              397.452      4.968     30.585
         TOT                         635.9334     7.9506    47.2512   197.6992

   temp. (K)  partition function   enthalpy   heat capacity  entropy
                                   cal/mol     cal/K/mol   cal/K/mol   J/K/mol
  60.00  VIB   1.00                    0.000      0.000     -0.000
         ROT   636.                  178.853      2.981     15.808
         INT   636.                  178.854      2.981     15.808
         TR   0.238E+26              298.089      4.968     29.157
         TOT                         476.9426     7.9491    44.9650   188.1335

   temp. (K)  partition function   enthalpy   heat capacity  entropy
                                   cal/mol     cal/K/mol   cal/K/mol   J/K/mol
  40.00  VIB   1.00                    0.000      0.000     -0.000
         ROT   346.                  119.236      2.981     14.600
         INT   346.                  119.236      2.981     14.599
         TR   0.130E+26              198.726      4.968     27.143
         TOT                         317.9616     7.9490    41.7429   174.6522

   temp. (K)  partition function   enthalpy   heat capacity  entropy
                                   cal/mol     cal/K/mol   cal/K/mol   J/K/mol
  20.00  VIB   1.00                    0.000      0.000     -0.000
         ROT   122.                   59.618      2.981     12.533
         INT   122.                   59.618      2.981     12.533
         TR   0.458E+25               99.363      4.968     23.701
         TOT                         158.9808     7.9490    36.2347   151.6058

   temp. (K)  partition function   enthalpy   heat capacity  entropy
                                   cal/mol     cal/K/mol   cal/K/mol   J/K/mol
  10.00  VIB   1.00                    0.000      0.000     -0.000
         ROT   43.3                   29.809      2.981     10.467
         INT   43.3                   29.809      2.981     10.467
         TR   0.162E+25               49.681      4.968     20.259
         TOT                          79.4904     7.9490    30.7264   128.5595

       T/K    H(0)-H(T)+PV         H(T)/Eh          T*S/Eh         G(T)/Eh
   ------------------------------------------------------------------------
    298.15    0.410222E-02    0.356311E-01    0.278244E-01    0.780670E-02
    120.00    0.152129E-02    0.330502E-01    0.965341E-02    0.233968E-01
    100.00    0.126697E-02    0.327959E-01    0.781275E-02    0.249831E-01
     80.00    0.101342E-02    0.325423E-01    0.602397E-02    0.265184E-01
     60.00    0.760056E-03    0.322890E-01    0.429938E-02    0.279896E-01
     40.00    0.506704E-03    0.320356E-01    0.266086E-02    0.293747E-01
     20.00    0.253352E-03    0.317823E-01    0.115487E-02    0.306274E-01
     10.00    0.126676E-03    0.316556E-01    0.489657E-03    0.311659E-01 (used)
   ------------------------------------------------------------------------

         :::::::::::::::::::::::::::::::::::::::::::::::::::::
         ::                  THERMODYNAMIC                  ::
         :::::::::::::::::::::::::::::::::::::::::::::::::::::
         :: total free energy          -8.653814220641 Eh   ::
         ::.................................................::
         :: total energy               -8.684980143315 Eh   ::
         :: zero point energy           0.031528903781 Eh   ::
         :: G(RRHO) w/o ZPVE           -0.000362981107 Eh   ::
         :: G(RRHO) contrib.            0.031165922674 Eh   ::
         :::::::::::::::::::::::::::::::::::::::::::::::::::::

optimized geometry written to: xtbopt.xyz


           -------------------------------------------------
          | TOTAL ENERGY               -8.684980143315 Eh   |
          | TOTAL ENTHALPY             -8.653324563518 Eh   |
          | TOTAL FREE ENERGY          -8.653814220641 Eh   |
          | GRADIENT NORM               0.000645312330 Eh/α |
          | HOMO-LUMO GAP               3.137249967072 eV   |
           -------------------------------------------------

------------------------------------------------------------------------
 * finished run on 2020/05/12 at 11:45:20.194     
------------------------------------------------------------------------
 total:
 * wall-time:     0 d,  0 h,  0 min,  0.131 sec
 *  cpu-time:     0 d,  0 h,  0 min,  0.130 sec
 * ratio c/w:     0.998 speedup
 SCF:
 * wall-time:     0 d,  0 h,  0 min,  0.004 sec
 *  cpu-time:     0 d,  0 h,  0 min,  0.004 sec
 * ratio c/w:     0.998 speedup
 ANC optimizer:
 * wall-time:     0 d,  0 h,  0 min,  0.046 sec
 *  cpu-time:     0 d,  0 h,  0 min,  0.046 sec
 * ratio c/w:     0.998 speedup
 numerical hessian:
 * wall-time:     0 d,  0 h,  0 min,  0.062 sec
 *  cpu-time:     0 d,  0 h,  0 min,  0.062 sec
 * ratio c/w:     0.998 speedup

