      -----------------------------------------------------------      
     |                   =====================                   |     
     |                           x T B                           |     
     |                   =====================                   |     
     |                         S. Grimme                         |     
     |          Mulliken Center for Theoretical Chemistry        |     
     |                    University of Bonn                     |     
      -----------------------------------------------------------      

   * xtb version 6.2.2 (9d81278992624c895f80dd42a50cac0aa55982e2) compiled by '@Darwin' on 04/03/2020

   xtb is free software: you can redistribute it and/or modify it under
   the terms of the GNU Lesser General Public License as published by
   the Free Software Foundation, either version 3 of the License, or
   (at your option) any later version.
   
   xtb is distributed in the hope that it will be useful,
   but WITHOUT ANY WARRANTY; without even the implied warranty of
   MERCHANTABILITY or FITNESS FOR A PARTICULAR PURPOSE.  See the
   GNU Lesser General Public License for more details.
   
   Cite this work as:
   * S. Grimme, C. Bannwarth, P. Shushkov, J. Chem. Theory Comput., 2017,
     13, 1989-2009. DOI: 10.1021/acs.jctc.7b00118
   * C. Bannwarth, S. Ehlert and S. Grimme., J. Chem. Theory Comput., 2019,
     15, 1652-1671. DOI: 10.1021/acs.jctc.8b01176
   * P. Pracht, E. Caldeweyher, S. Ehlert, S. Grimme, ChemRxiv, 2019, preprint.
     DOI: 10.26434/chemrxiv.8326202.v1
   
   for DFT-D4:
   * E. Caldeweyher, C. Bannwarth and S. Grimme, J. Chem. Phys., 2017,
     147, 034112. DOI: 10.1063/1.4993215
   * E. Caldeweyher, S. Ehlert, A. Hansen, H. Neugebauer, S. Spicher,
     C. Bannwarth and S. Grimme, J. Chem. Phys., 2019, 150, 154122.
     DOI: 10.1063/1.5090222
   
   for sTDA-xTB:
   * S. Grimme and C. Bannwarth, J. Chem. Phys., 2016, 145, 054103.
     DOI: 10.1063/1.4959605
   
   in the mass-spec context:
   * V. Asgeirsson, C. Bauer and S. Grimme, Chem. Sci., 2017, 8, 4879.
     DOI: 10.1039/c7sc00601b
   
   for metadynamics refer to:
   * S. Grimme, J. Chem. Theory Comput., 2019, 155, 2847-2862
     DOI: 10.1021/acs.jctc.9b00143
   
   with help from (in alphabetical order)
   C. Bannwarth, F. Bohle, G. Brandenburg, E. Caldeweyher, M. Checinski,
   S. Dohm, S. Ehlert, S. Ehrlich, F. März, H. Neugebauer, J. Pisarek,
   P. Pracht, P. Shushkov, and S. Spicher.
   
 * started run on 2020/05/12 at 11:45:20.933     

           -------------------------------------------------
          |                Calculation Setup                |
           -------------------------------------------------

          program call               : xtb --input H2C1N2_3_S_0.input H2C1N2_3_S_0.xyz --ohess --molden --namespace H2C1N2_3_S_0 output.out
          calculation namespace      : H2C1N2_3_S_0
          coordinate file            : H2C1N2_3_S_0.xyz
          number of atoms            :                     5
          number of electrons        :                    16
          charge                     :                     0
          spin                       :                   0.0
          first test random number   :      0.18451989684569

   ID    Z sym.   atoms
    1    7 N      1, 3
    2    6 C      2
    3    1 H      4, 5

           -------------------------------------------------
          |                 G F N 2 - x T B                 |
           -------------------------------------------------

        Reference                      10.1021/acs.jctc.8b01176
      * Hamiltonian:
        H0-scaling (s, p, d)           1.850000    2.230000    2.230000
        zeta-weighting                 0.500000
      * Dispersion:
        s8                             2.700000
        a1                             0.520000
        a2                             5.000000
        s9                             5.000000
      * Repulsion:
        kExp                           1.500000    1.000000
        rExp                           1.000000
      * Coulomb:
        alpha                          2.000000
        third order                    shell-resolved
        anisotropic                    true
        a3                             3.000000
        a5                             4.000000
        cn-shift                       1.200000
        cn-exp                         4.000000
        max-rad                        5.000000


          ...................................................
          :                      SETUP                      :
          :.................................................:
          :  # basis functions                  14          :
          :  # atomic orbitals                  14          :
          :  # shells                            8          :
          :  # electrons                        16          :
          :  max. iterations                   250          :
          :  Hamiltonian                  GFN2-xTB          :
          :  restarted?                      false          :
          :  GBSA solvation                  false          :
          :  PC potential                    false          :
          :  electronic temp.          300.0000000     K    :
          :  accuracy                    1.0000000          :
          :  -> integral cutoff          0.2500000E+02      :
          :  -> integral neglect         0.1000000E-07      :
          :  -> SCF convergence          0.1000000E-05 Eh   :
          :  -> wf. convergence          0.1000000E-03 e    :
          :  Broyden damping             0.4000000          :
          ...................................................

 iter      E             dE          RMSdq      gap      omega  full diag
   1     -8.4976297 -0.849763E+01  0.845E+00    1.05       0.0  T
   2     -7.7524553  0.745174E+00  0.132E+01    1.41       1.0  T
   3     -8.6258594 -0.873404E+00  0.675E+00    0.80       1.0  T
   4     -8.7266842 -0.100825E+00  0.465E+00    0.46       1.0  T
   5     -8.5808993  0.145785E+00  0.648E+00    0.44       1.0  T
   6     -8.7775707 -0.196671E+00  0.139E+00    0.34       1.0  T
   7     -8.7470680  0.305027E-01  0.277E+00    0.34       1.0  T
   8     -8.7849134 -0.378454E-01  0.497E-01    0.27       1.0  T
   9     -8.7816321  0.328133E-02  0.968E-01    0.25       1.0  T
  10     -8.7715193  0.101128E-01  0.170E+00    0.27       1.0  T
  11     -8.7844614 -0.129422E-01  0.505E-01    0.24       1.0  T
  12     -8.7856973 -0.123588E-02  0.118E-01    0.23       1.0  T
  13     -8.7856740  0.233015E-04  0.117E-01    0.23       1.0  T
  14     -8.7857020 -0.280210E-04  0.828E-02    0.22       1.0  T
  15     -8.7857339 -0.319159E-04  0.216E-02    0.22       2.1  T
  16     -8.7857356 -0.170769E-05  0.104E-02    0.22       4.3  T
  17     -8.7857360 -0.320662E-06  0.617E-03    0.22       7.3  T
  18     -8.7857361 -0.186555E-06  0.180E-04    0.22     248.3  T
  19     -8.7857361 -0.119721E-09  0.619E-05    0.22     722.0  T

   *** convergence criteria satisfied after 19 iterations ***

         #    Occupation            Energy/Eh            Energy/eV
      -------------------------------------------------------------
         1        2.0000           -0.6740716             -18.3424
         2        2.0000           -0.6212482             -16.9050
         3        2.0000           -0.5741700             -15.6240
         4        2.0000           -0.5518963             -15.0179
         5        2.0000           -0.5039777             -13.7139
         6        2.0000           -0.4851405             -13.2013
         7        2.0000           -0.4739276             -12.8962
         8        1.9713           -0.3917508             -10.6601 (HOMO)
         9        0.0287           -0.3837134             -10.4414 (LUMO)
        10                         -0.3625587              -9.8657
        11                          0.0006590               0.0179
        12                          0.0587824               1.5996
        13                          0.1090125               2.9664
        14                          0.1490176               4.0550
      -------------------------------------------------------------
                  HL-Gap            0.0080375 Eh            0.2187 eV
             Fermi-level           -0.3877321 Eh          -10.5507 eV

 SCC (total)                   0 d,  0 h,  0 min,  0.004 sec
 SCC setup                      ...        0 min,  0.000 sec (  2.592%)
 Dispersion                     ...        0 min,  0.000 sec (  0.419%)
 integral evaluation            ...        0 min,  0.001 sec ( 21.775%)
 zeroth order Hamiltonian       ...        0 min,  0.000 sec (  0.452%)
 iterations                     ...        0 min,  0.002 sec ( 49.066%)
 molecular gradient             ...        0 min,  0.001 sec ( 22.340%)
 printout                       ...        0 min,  0.000 sec (  3.011%)

         :::::::::::::::::::::::::::::::::::::::::::::::::::::
         ::                     SUMMARY                     ::
         :::::::::::::::::::::::::::::::::::::::::::::::::::::
         :: total energy              -8.739100941118 Eh    ::
         :: gradient norm              0.254016559801 Eh/a0 ::
         :: HOMO-LUMO gap              0.218710805704 eV    ::
         ::.................................................::
         :: SCC energy                -8.785736144388 Eh    ::
         :: -> isotropic ES            0.004864004370 Eh    ::
         :: -> anisotropic ES          0.000200878138 Eh    ::
         :: -> anisotropic XC          0.020631119764 Eh    ::
         :: -> dispersion             -0.001434225055 Eh    ::
         :: repulsion energy           0.046635165056 Eh    ::
         :: add. restraining           0.000000000000 Eh    ::
         :::::::::::::::::::::::::::::::::::::::::::::::::::::

      ----------------------------------------------------------- 
     |                   =====================                   |
     |                        A N C O P T                        |
     |                   =====================                   |
     |               Approximate Normal Coordinate               |
     |                Rational Function Optimizer                |
      ----------------------------------------------------------- 

          ...................................................
          :                      SETUP                      :
          :.................................................:
          :   optimization level            normal          :
          :   max. optcycles                   200          :
          :   ANC micro-cycles                  20          :
          :   degrees of freedom                 9          :
          :.................................................:
          :   RF solver                   davidson          :
          :   write xtbopt.log                true          :
          :   linear?                        false          :
          :   energy convergence         0.5000000E-05 Eh   :
          :   grad. convergence          0.1000000E-02 Eh/α :
          :   maximium RF displ.         1.0000000          :
          :   Hlow (freq-cutoff)         0.1000000E-01      :
          :   Hmax (freq-cutoff)         5.0000000          :
          :   S6 in model hess.         20.0000000          :
          ...................................................

generating ANC from model Hessian ...
Using Lindh-Hessian (1995)
 Shifting diagonal of input Hessian by    0.0000000000000000     
 Lowest  eigenvalues of input Hessian
   -0.000000   -0.000000   -0.000000    0.000000    0.000000    0.000000
    0.014174    0.039134    0.101337    0.103068    0.188027    0.558606
    0.989872    1.042594    1.285848
 Highest eigenvalues
    0.103068    0.188027    0.558606    0.989872    1.042594    1.285848


........................................................................
.............................. CYCLE    1 ..............................
........................................................................
   1     -8.7857361 -0.878574E+01  0.653E-05    0.22       0.0  T
   2     -8.7857361  0.487806E-08  0.975E-04    0.22      45.9  T
   3     -8.7857361 -0.489737E-08  0.190E-05    0.22    2355.7  T
     SCC iter.                  ...        0 min,  0.001 sec
     gradient                   ...        0 min,  0.001 sec
 * total energy  :    -8.7391009 Eh     change        0.1814264E-09 Eh
   gradient norm :     0.2540159 Eh/α   predicted     0.0000000E+00 (-100.00%)
   displ. norm   :     0.4338854 α      lambda       -0.8501414E-01
   maximum displ.:     0.3516817 α      in ANC's #5, #8, #6, ...

........................................................................
.............................. CYCLE    2 ..............................
........................................................................
   1     -8.8723565 -0.887236E+01  0.248E+00    1.66       0.0  T
   2     -8.8521746  0.201819E-01  0.265E+00    1.46       1.0  T
   3     -8.8707093 -0.185347E-01  0.156E+00    1.68       1.0  T
   4     -8.8790018 -0.829247E-02  0.394E-01    1.54       1.0  T
   5     -8.8793349 -0.333137E-03  0.106E-01    1.53       1.0  T
   6     -8.8793330  0.191453E-05  0.327E-02    1.52       1.4  T
   7     -8.8793360 -0.295589E-05  0.586E-03    1.52       7.6  T
   8     -8.8793360 -0.535047E-08  0.784E-04    1.52      57.0  T
   9     -8.8793360 -0.965416E-09  0.241E-04    1.52     185.3  T
     SCC iter.                  ...        0 min,  0.001 sec
     gradient                   ...        0 min,  0.001 sec
 * total energy  :    -8.8133013 Eh     change       -0.7420035E-01 Eh
   gradient norm :     0.1610757 Eh/α   predicted    -0.5050931E-01 ( -31.93%)
   displ. norm   :     0.6976470 α      lambda       -0.9069596E-01
   maximum displ.:     0.5256068 α      in ANC's #5, #2, #6, ...

........................................................................
.............................. CYCLE    3 ..............................
........................................................................
   1     -8.9735681 -0.897357E+01  0.441E+00    3.60       0.0  T
   2     -8.9811238 -0.755568E-02  0.234E+00    3.23       1.0  T
   3     -8.9818621 -0.738270E-03  0.897E-01    3.38       1.0  T
   4     -8.9833843 -0.152230E-02  0.182E-01    3.24       1.0  T
   5     -8.9833859 -0.154269E-05  0.202E-02    3.23       2.2  T
   6     -8.9833861 -0.202198E-06  0.855E-03    3.23       5.2  T
   7     -8.9833861  0.202790E-08  0.184E-03    3.23      24.4  T
   8     -8.9833861 -0.984560E-08  0.424E-04    3.23     105.6  T
   9     -8.9833861 -0.356160E-10  0.707E-05    3.23     632.8  T
     SCC iter.                  ...        0 min,  0.001 sec
     gradient                   ...        0 min,  0.001 sec
 * total energy  :    -8.8722325 Eh     change       -0.5893119E-01 Eh
   gradient norm :     0.1777107 Eh/α   predicted    -0.6741936E-01 (  14.40%)
   displ. norm   :     0.5837330 α      lambda       -0.4977509E-01
   maximum displ.:     0.4444887 α      in ANC's #5, #2, #3, ...

........................................................................
.............................. CYCLE    4 ..............................
........................................................................
   1     -8.8543092 -0.885431E+01  0.689E+00    1.97       0.0  T
   2     -8.8642658 -0.995662E-02  0.507E+00    2.56       1.0  T
   3     -8.9366822 -0.724164E-01  0.204E+00    2.07       1.0  T
   4     -8.9425359 -0.585368E-02  0.361E-01    2.11       1.0  T
   5     -8.9426065 -0.705912E-04  0.148E-01    2.11       1.0  T
   6     -8.9426246 -0.181618E-04  0.355E-02    2.09       1.3  T
   7     -8.9426249 -0.251863E-06  0.572E-03    2.09       7.8  T
   8     -8.9426249 -0.303926E-07  0.161E-03    2.09      27.8  T
   9     -8.9426249 -0.144695E-08  0.354E-04    2.09     126.2  T
  10     -8.9426249 -0.856986E-10  0.494E-05    2.09     904.5  T
     SCC iter.                  ...        0 min,  0.001 sec
     gradient                   ...        0 min,  0.001 sec
 * total energy  :    -8.8189771 Eh     change        0.5325536E-01 Eh
   gradient norm :     0.3825650 Eh/α   predicted    -0.3336785E-01 (-162.66%)
   displ. norm   :     0.4155823 α      lambda       -0.1547846E+00
   maximum displ.:     0.3073679 α      in ANC's #5, #2, #8, ...

........................................................................
.............................. CYCLE    5 ..............................
........................................................................
   1     -8.9293407 -0.892934E+01  0.386E+00    2.81       0.0  T
   2     -8.9403356 -0.109949E-01  0.233E+00    2.38       1.0  T
   3     -8.9490653 -0.872972E-02  0.110E+00    2.56       1.0  T
   4     -8.9502334 -0.116801E-02  0.254E-01    2.56       1.0  T
   5     -8.9503573 -0.123954E-03  0.978E-02    2.54       1.0  T
   6     -8.9503618 -0.449501E-05  0.107E-02    2.54       4.2  T
   7     -8.9503619 -0.491354E-07  0.536E-03    2.54       8.3  T
   8     -8.9503619 -0.202580E-07  0.916E-04    2.54      48.8  T
   9     -8.9503619 -0.240673E-09  0.732E-05    2.54     611.2  T
     SCC iter.                  ...        0 min,  0.001 sec
     gradient                   ...        0 min,  0.001 sec
 * total energy  :    -8.8769246 Eh     change       -0.5794753E-01 Eh
   gradient norm :     0.1353582 Eh/α   predicted    -0.9075862E-01 (  56.62%)
   displ. norm   :     0.3895308 α      lambda       -0.3138243E-01
   maximum displ.:     0.3338428 α      in ANC's #2, #3, #6, ...

........................................................................
.............................. CYCLE    6 ..............................
........................................................................
   1     -8.9759794 -0.897598E+01  0.165E+00    3.43       0.0  T
   2     -8.9772922 -0.131279E-02  0.877E-01    3.22       1.0  T
   3     -8.9773810 -0.888080E-04  0.401E-01    3.26       1.0  T
   4     -8.9775129 -0.131945E-03  0.718E-02    3.20       1.0  T
   5     -8.9775147 -0.176750E-05  0.144E-02    3.20       3.1  T
   6     -8.9775149 -0.193546E-06  0.636E-03    3.21       7.0  T
   7     -8.9775149 -0.144095E-07  0.111E-03    3.21      40.2  T
   8     -8.9775149 -0.663263E-09  0.376E-04    3.21     118.9  T
   9     -8.9775149 -0.173390E-10  0.280E-05    3.21    1596.3  T
     SCC iter.                  ...        0 min,  0.001 sec
     gradient                   ...        0 min,  0.001 sec
 * total energy  :    -8.8810031 Eh     change       -0.4078470E-02 Eh
   gradient norm :     0.1415617 Eh/α   predicted    -0.1807211E-01 ( 343.11%)
   displ. norm   :     0.2025047 α      lambda       -0.1571422E-01
   maximum displ.:     0.1755225 α      in ANC's #2, #3, #5, ...

........................................................................
.............................. CYCLE    7 ..............................
........................................................................
   1     -8.9826699 -0.898267E+01  0.730E-01    2.86       0.0  T
   2     -8.9830949 -0.424946E-03  0.390E-01    2.95       1.0  T
   3     -8.9831442 -0.493483E-04  0.204E-01    2.93       1.0  T
   4     -8.9831678 -0.236388E-04  0.446E-02    2.95       1.0  T
   5     -8.9831701 -0.222528E-05  0.204E-02    2.96       2.2  T
   6     -8.9831704 -0.319215E-06  0.272E-03    2.96      16.4  T
   7     -8.9831704 -0.158925E-08  0.386E-04    2.96     116.0  T
   8     -8.9831704 -0.414779E-11  0.168E-04    2.96     266.2  T
     SCC iter.                  ...        0 min,  0.001 sec
     gradient                   ...        0 min,  0.001 sec
 * total energy  :    -8.8889563 Eh     change       -0.7953193E-02 Eh
   gradient norm :     0.0292232 Eh/α   predicted    -0.8179312E-02 (   2.84%)
   displ. norm   :     0.0923435 α      lambda       -0.1815313E-02
   maximum displ.:     0.0627087 α      in ANC's #2, #5, #6, ...

........................................................................
.............................. CYCLE    8 ..............................
........................................................................
   1     -8.9758852 -0.897589E+01  0.467E-01    2.82       0.0  T
   2     -8.9760124 -0.127263E-03  0.245E-01    2.85       1.0  T
   3     -8.9760474 -0.349377E-04  0.144E-01    2.84       1.0  T
   4     -8.9760633 -0.159256E-04  0.226E-02    2.84       2.0  T
   5     -8.9760638 -0.537345E-06  0.104E-02    2.84       4.3  T
   6     -8.9760639 -0.322519E-07  0.665E-04    2.84      67.3  T
   7     -8.9760639 -0.962483E-10  0.234E-04    2.84     191.3  T
     SCC iter.                  ...        0 min,  0.001 sec
     gradient                   ...        0 min,  0.001 sec
 * total energy  :    -8.8897021 Eh     change       -0.7457765E-03 Eh
   gradient norm :     0.0310887 Eh/α   predicted    -0.9153963E-03 (  22.74%)
   displ. norm   :     0.0748027 α      lambda       -0.1666344E-02
   maximum displ.:     0.0719296 α      in ANC's #6, #9, #5, ...

........................................................................
.............................. CYCLE    9 ..............................
........................................................................
   1     -8.9842715 -0.898427E+01  0.205E-01    2.89       0.0  T
   2     -8.9842788 -0.735427E-05  0.117E-01    2.89       1.0  T
   3     -8.9842773  0.156989E-05  0.490E-02    2.89       1.0  T
   4     -8.9842809 -0.364363E-05  0.890E-03    2.89       5.0  T
   5     -8.9842810 -0.582875E-07  0.443E-03    2.89      10.1  T
   6     -8.9842810 -0.132719E-07  0.668E-04    2.89      67.0  T
   7     -8.9842810 -0.116026E-09  0.985E-05    2.89     453.8  T
     SCC iter.                  ...        0 min,  0.000 sec
     gradient                   ...        0 min,  0.001 sec
 * total energy  :    -8.8906632 Eh     change       -0.9610921E-03 Eh
   gradient norm :     0.0076524 Eh/α   predicted    -0.8378351E-03 ( -12.82%)
   displ. norm   :     0.0243579 α      lambda       -0.1005064E-03
   maximum displ.:     0.0161150 α      in ANC's #6, #3, #2, ...

........................................................................
.............................. CYCLE   10 ..............................
........................................................................
   1     -8.9853414 -0.898534E+01  0.736E-02    2.91       0.0  T
   2     -8.9853424 -0.986427E-06  0.422E-02    2.91       1.1  T
   3     -8.9853422  0.233629E-06  0.230E-02    2.91       1.9  T
   4     -8.9853428 -0.674351E-06  0.246E-03    2.91      18.2  T
   5     -8.9853429 -0.135411E-08  0.988E-04    2.91      45.3  T
   6     -8.9853429 -0.792541E-09  0.173E-04    2.91     258.6  T
     SCC iter.                  ...        0 min,  0.001 sec
     gradient                   ...        0 min,  0.001 sec
 * total energy  :    -8.8907164 Eh     change       -0.5325726E-04 Eh
   gradient norm :     0.0017051 Eh/α   predicted    -0.5028259E-04 (  -5.59%)
   displ. norm   :     0.0107153 α      lambda       -0.3807961E-05
   maximum displ.:     0.0096493 α      in ANC's #1, #2, #6, ...

........................................................................
.............................. CYCLE   11 ..............................
........................................................................
   1     -8.9855534 -0.898555E+01  0.439E-02    2.91       0.0  T
   2     -8.9855539 -0.444394E-06  0.225E-02    2.91       2.0  T
   3     -8.9855539 -0.202195E-07  0.705E-03    2.91       6.3  T
   4     -8.9855540 -0.873422E-07  0.164E-03    2.91      27.2  T
   5     -8.9855540 -0.152746E-08  0.883E-04    2.91      50.6  T
   6     -8.9855540 -0.343531E-09  0.433E-05    2.91    1032.4  T
     SCC iter.                  ...        0 min,  0.000 sec
     gradient                   ...        0 min,  0.001 sec
 * total energy  :    -8.8907136 Eh     change        0.2848335E-05 Eh
   gradient norm :     0.0017686 Eh/α   predicted    -0.1905051E-05 (-166.88%)
   displ. norm   :     0.0206305 α      lambda       -0.1384210E-04
   maximum displ.:     0.0181018 α      in ANC's #1, #2, #6, ...

........................................................................
.............................. CYCLE   12 ..............................
........................................................................
   1     -8.9859613 -0.898596E+01  0.798E-02    2.92       0.0  T
   2     -8.9859633 -0.195841E-05  0.409E-02    2.92       1.1  T
   3     -8.9859634 -0.102988E-06  0.146E-02    2.92       3.1  T
   4     -8.9859637 -0.334716E-06  0.311E-03    2.92      14.4  T
   5     -8.9859637 -0.781609E-08  0.169E-03    2.92      26.4  T
   6     -8.9859637 -0.103742E-08  0.979E-05    2.92     456.9  T
   7     -8.9859637 -0.229861E-11  0.220E-05    2.92    2031.3  T
     SCC iter.                  ...        0 min,  0.001 sec
     gradient                   ...        0 min,  0.001 sec
 * total energy  :    -8.8907008 Eh     change        0.1277618E-04 Eh
   gradient norm :     0.0042207 Eh/α   predicted    -0.6923284E-05 (-154.19%)
   displ. norm   :     0.0094792 α      lambda       -0.2538395E-04
   maximum displ.:     0.0054793 α      in ANC's #2, #1, #6, ...

........................................................................
.............................. CYCLE   13 ..............................
........................................................................
   1     -8.9855539 -0.898555E+01  0.388E-02    2.91       0.0  T
   2     -8.9855547 -0.793875E-06  0.192E-02    2.91       2.3  T
   3     -8.9855547 -0.513629E-07  0.971E-03    2.91       4.6  T
   4     -8.9855548 -0.804027E-07  0.193E-03    2.91      23.1  T
   5     -8.9855548 -0.514022E-08  0.932E-04    2.91      48.0  T
   6     -8.9855548 -0.291928E-09  0.629E-05    2.91     711.3  T
     SCC iter.                  ...        0 min,  0.000 sec
     gradient                   ...        0 min,  0.001 sec
 * total energy  :    -8.8907171 Eh     change       -0.1632757E-04 Eh
   gradient norm :     0.0011898 Eh/α   predicted    -0.1269320E-04 ( -22.26%)
   displ. norm   :     0.0069096 α      lambda       -0.3551596E-05
   maximum displ.:     0.0057629 α      in ANC's #1, #2, #6, ...

........................................................................
.............................. CYCLE   14 ..............................
........................................................................
   1     -8.9854396 -0.898544E+01  0.270E-02    2.91       0.0  T
   2     -8.9854398 -0.252805E-06  0.138E-02    2.91       3.2  T
   3     -8.9854398 -0.103321E-07  0.558E-03    2.91       8.0  T
   4     -8.9854399 -0.446991E-07  0.114E-03    2.91      39.1  T
   5     -8.9854399 -0.126382E-08  0.609E-04    2.91      73.5  T
   6     -8.9854399 -0.114833E-09  0.360E-05    2.91    1242.0  T
     SCC iter.                  ...        0 min,  0.001 sec
     gradient                   ...        0 min,  0.001 sec
 * total energy  :    -8.8907185 Eh     change       -0.1369142E-05 Eh
   gradient norm :     0.0005904 Eh/α   predicted    -0.1776533E-05 (  29.76%)
   displ. norm   :     0.0022476 α      lambda       -0.5723394E-06
   maximum displ.:     0.0017114 α      in ANC's #1, #2, #6, ...

   *** GEOMETRY OPTIMIZATION CONVERGED AFTER 14 ITERATIONS ***

------------------------------------------------------------------------
 total energy gain   :        -0.1516176 Eh      -95.1415 kcal/mol
 total RMSD          :         0.5862082 a0        0.3102 Å
 total power (kW/mol):       -28.4337048 (step)********** (real)
------------------------------------------------------------------------

 ANCopt (total)                0 d,  0 h,  0 min,  0.034 sec
 optimizer setup                ...        0 min,  0.000 sec (  0.317%)
 model hessian                  ...        0 min,  0.000 sec (  0.417%)
 ANC generation                 ...        0 min,  0.000 sec (  0.196%)
 coordinate transformation      ...        0 min,  0.000 sec (  0.107%)
 single point calculation       ...        0 min,  0.032 sec ( 95.162%)
 optimization log               ...        0 min,  0.000 sec (  1.199%)
 hessian update                 ...        0 min,  0.000 sec (  0.106%)
 rational function              ...        0 min,  0.000 sec (  1.182%)

================
 final structure:
================
5
 xtb: 6.2.2 (9d81278992624c895f80dd42a50cac0aa55982e2)
N         0.75142306285693   -0.60867040784792    0.67025839614431
C        -0.27713534623413    0.09606653970119   -0.04849335472302
N         1.12547416025609   -0.04352081901353   -0.33913887496182
H        -0.97819380845166   -0.48322120478726   -0.63238509504218
H        -0.62156706842723    1.03934589194752    0.34975892858272

 Bond Distances (Angstroems)
 ---------------------------
N1-C2=1.4392         N1-N3=1.2158         C2-N1=1.4392         C2-N3=1.4392         C2-H4=1.0807         C2-H5=1.0803         
N3-N1=1.2158         N3-C2=1.4392         H4-C2=1.0807         H5-C2=1.0803         
 C  H  Rav=1.0805 sigma=0.0002  Rmin=1.0803  Rmax=1.0807     2
 N  C  Rav=1.4392 sigma=0.0000  Rmin=1.4392  Rmax=1.4392     2
 N  N  Rav=1.2158 sigma=0.0000  Rmin=1.2158  Rmax=1.2158     1

 selected bond angles (degree)
 --------------------
N3-N1-C2= 65.02                N3-C2-N1= 49.97                H4-C2-N1=118.10                H4-C2-N3=118.11                
H5-C2-N1=118.12                H5-C2-N3=118.03                H5-C2-H4=117.41                C2-N3-N1= 65.01                

 selected dihedral angles (degree)
 ---------------------------------
H4-C2-N1-N3=104.42            H5-C2-N1-N3=255.71            N1-N3-C2-H4=255.60            N1-N3-C2-H5=104.49            
           -------------------------------------------------
          |                Final Singlepoint                |
           -------------------------------------------------

          ...................................................
          :                      SETUP                      :
          :.................................................:
          :  # basis functions                  14          :
          :  # atomic orbitals                  14          :
          :  # shells                            8          :
          :  # electrons                        16          :
          :  max. iterations                   250          :
          :  Hamiltonian                  GFN2-xTB          :
          :  restarted?                      false          :
          :  GBSA solvation                  false          :
          :  PC potential                    false          :
          :  electronic temp.          300.0000000     K    :
          :  accuracy                    1.0000000          :
          :  -> integral cutoff          0.2500000E+02      :
          :  -> integral neglect         0.1000000E-07      :
          :  -> SCF convergence          0.1000000E-05 Eh   :
          :  -> wf. convergence          0.1000000E-03 e    :
          :  Broyden damping             0.4000000          :
          ...................................................

 iter      E             dE          RMSdq      gap      omega  full diag
   1     -8.9854399 -0.898544E+01  0.650E-06    2.91       0.0  T
   2     -8.9854399 -0.177636E-13  0.335E-06    2.91   13366.7  T
   3     -8.9854399 -0.355271E-14  0.763E-07    2.91   58642.9  T

   *** convergence criteria satisfied after 3 iterations ***

         #    Occupation            Energy/Eh            Energy/eV
      -------------------------------------------------------------
         1        2.0000           -0.7441010             -20.2480
         2        2.0000           -0.6292386             -17.1225
         3        2.0000           -0.5956403             -16.2082
         4        2.0000           -0.5843588             -15.9012
         5        2.0000           -0.5446547             -14.8208
         6        2.0000           -0.4764321             -12.9644
         7        2.0000           -0.4555856             -12.3971
         8        2.0000           -0.4390352             -11.9468 (HOMO)
         9                         -0.3321262              -9.0376 (LUMO)
        10                         -0.1021071              -2.7785
        11                          0.0670747               1.8252
        12                          0.1902312               5.1765
        13                          0.2476565               6.7391
        14                          0.3673312               9.9956
      -------------------------------------------------------------
                  HL-Gap            0.1069090 Eh            2.9091 eV
             Fermi-level           -0.3855807 Eh          -10.4922 eV

 SCC (total)                   0 d,  0 h,  0 min,  0.002 sec
 SCC setup                      ...        0 min,  0.000 sec (  2.801%)
 Dispersion                     ...        0 min,  0.000 sec (  0.553%)
 integral evaluation            ...        0 min,  0.001 sec ( 39.111%)
 zeroth order Hamiltonian       ...        0 min,  0.000 sec (  0.565%)
 iterations                     ...        0 min,  0.000 sec ( 12.566%)
 molecular gradient             ...        0 min,  0.001 sec ( 39.971%)
 printout                       ...        0 min,  0.000 sec (  3.968%)

         :::::::::::::::::::::::::::::::::::::::::::::::::::::
         ::                     SUMMARY                     ::
         :::::::::::::::::::::::::::::::::::::::::::::::::::::
         :: total energy              -8.890718507329 Eh    ::
         :: gradient norm              0.000606470704 Eh/a0 ::
         :: HOMO-LUMO gap              2.909143120012 eV    ::
         ::.................................................::
         :: SCC energy                -8.985439865316 Eh    ::
         :: -> isotropic ES            0.001786423835 Eh    ::
         :: -> anisotropic ES          0.003559423461 Eh    ::
         :: -> anisotropic XC          0.019615665588 Eh    ::
         :: -> dispersion             -0.001425320492 Eh    ::
         :: repulsion energy           0.094721337432 Eh    ::
         :: add. restraining           0.000000000000 Eh    ::
         :::::::::::::::::::::::::::::::::::::::::::::::::::::

           ------------------------------------------------- 
          |                Numerical Hessian                |
           ------------------------------------------------- 
step length          :   0.00500
SCC accuracy         :   0.30000
Hessian scale factor :   1.00000
frozen atoms in %    :   0.00000    0
RMS gradient         :   0.00061
estimated CPU  time      0.00 min
estimated wall time      0.00 min

writing file <hessian>.

 projected vibrational frequencies (cm-1)
eigval :       -0.00    -0.00    -0.00    -0.00     0.00     0.00
eigval :      954.88   979.94   983.65  1091.60  1196.32  1444.63
eigval :     1800.03  3089.84  3101.14
           -------------------------------------------------
          |                Property Printout                |
           -------------------------------------------------

    * Orbital Energies and Occupations

         #    Occupation            Energy/Eh            Energy/eV
      -------------------------------------------------------------
         1        2.0000           -0.7441010             -20.2480
         2        2.0000           -0.6292386             -17.1225
         3        2.0000           -0.5956403             -16.2082
         4        2.0000           -0.5843588             -15.9012
         5        2.0000           -0.5446547             -14.8208
         6        2.0000           -0.4764321             -12.9644
         7        2.0000           -0.4555856             -12.3971
         8        2.0000           -0.4390352             -11.9468 (HOMO)
         9                         -0.3321262              -9.0376 (LUMO)
        10                         -0.1021071              -2.7785
        11                          0.0670747               1.8252
        12                          0.1902312               5.1765
        13                          0.2476565               6.7391
        14                          0.3673312               9.9956
      -------------------------------------------------------------
                  HL-Gap            0.1069090 Eh            2.9091 eV
             Fermi-level           -0.3855807 Eh          -10.4922 eV

     #   Z        covCN         q      C6AA      α(0)
     1   7 N      1.889    -0.060    23.125     7.129
     2   6 C      3.667     0.046    20.057     6.422
     3   7 N      1.889    -0.060    23.127     7.129
     4   1 H      0.926     0.037     2.492     2.469
     5   1 H      0.926     0.037     2.491     2.468

 Mol. C6AA /au·bohr⁶  :        297.124658
 Mol. C8AA /au·bohr⁸  :       6428.022184
Molecule has the following symmetry elements: (C2) 2*(sigma) 
It seems to be the C2v point group
 Mol. α(0) /au        :         25.617063


Wiberg/Mayer (AO) data.
largest (>0.10) Wiberg bond orders for each atom
          total WBO             WBO to atom ...
     1  N   2.966        N    3 1.991    C    2 0.956
     2  C   3.869        H    5 0.978    H    4 0.978    N    3 0.956    N    1 0.956
     3  N   2.966        N    1 1.991    C    2 0.956
     4  H   0.999        C    2 0.978
     5  H   0.999        C    2 0.978

MOs/occ written to file <molden.input>


molecular dipole:
                 x           y           z       tot (Debye)
 q only:       -0.347       0.120      -0.061
   full:       -0.583       0.203      -0.103       1.591
molecular quadrupole (traceless):
                xx          xy          yy          xz          yz          zz
 q only:       -0.223       0.121       0.221       0.044       0.256       0.002
  q+dip:       -1.050       0.562       1.234       0.371       1.567      -0.185
   full:       -0.995       0.523       1.420       0.565       1.954      -0.425

           -------------------------------------------------
          |                Geometry Summary                 |
           -------------------------------------------------

      molecular mass/u    :       42.0400238
   center of mass at/Å    :        0.5078031      -0.1765171       0.0896888
  moments of inertia/u·Å² :        0.1207083E+02   0.2019508E+02   0.2882884E+02
rotational constants/cm⁻¹ :        0.1396559E+01   0.8347396E+00   0.5847489E+00

 * 3 selected distances

     #   Z        #   Z                                     value/Å
     1   7 N      3   7 N                                 1.2158088 (max)
     2   6 C      4   1 H                                 1.0807344
     2   6 C      5   1 H                                 1.0802842 (min)

 * 2 distinct bonds (by element types)

   Z      Z             #   av. dist./Å        max./Å        min./Å
   1 H    6 C           2     1.0805093     1.0807344     1.0802842
   7 N    7 N           1     1.2158088     1.2158088     1.2158088

           -------------------------------------------------
          |               Frequency Printout                |
           -------------------------------------------------
 projected vibrational frequencies (cm-1)
eigval :       -0.00    -0.00    -0.00    -0.00     0.00     0.00
eigval :      954.88   979.94   983.65  1091.60  1196.32  1444.63
eigval :     1800.03  3089.84  3101.14
 reduced masses (amu)
   1:  9.76   2: 10.67   3: 13.21   4: 12.88   5: 11.85   6: 13.35   7: 11.51   8:  2.86
   9:  5.09  10:  3.60  11: 11.95  12:  2.13  13: 13.74  14:  1.44  15:  2.10
 IR intensities (amu)
   1:  0.31   2:  0.11   3:  0.08   4:  0.06   5:  0.25   6:  0.08   7:  0.20   8:  0.00
   9:  0.09  10:  0.31  11:  0.14  12:  0.09  13:  0.94  14:  0.18  15:  0.29
 Raman intensities (amu)
   1:  0.00   2:  0.00   3:  0.00   4:  0.00   5:  0.00   6:  0.00   7:  0.00   8:  0.00
   9:  0.00  10:  0.00  11:  0.00  12:  0.00  13:  0.00  14:  0.00  15:  0.00
 output can be read by thermo (or use thermo option).
 writing <g98.out> molden fake output.
 recommended (thermochemical) frequency scaling factor: 1.0
           -------------------------------------------------
          |             Thermodynamic Functions             |
           -------------------------------------------------

c2v symmetry found (for desy threshold:  0.10E+00) used in thermo

          ...................................................
          :                      SETUP                      :
          :.................................................:
          :  # frequencies                           9      :
          :  # imaginary freq.                       0      :
          :  linear?                             false      :
          :  only rotor calc.                    false      :
          :  symmetry                              c2v      :
          :  rotational number                       2      :
          :  scaling factor                  1.0000000      :
          :  rotor cutoff                   50.0000000 cm⁻¹ :
          :  imag. cutoff                  -20.0000000 cm⁻¹ :
          :.................................................:

    mode    ω/cm⁻¹     T·S(HO)/kcal·mol⁻¹    T·S(FR)/kcal·mol⁻¹   T·S(vib)
   ------------------------------------------------------------------------
   ------------------------------------------------------------------------

   temp. (K)  partition function   enthalpy   heat capacity  entropy
                                   cal/mol     cal/K/mol   cal/K/mol   J/K/mol
 298.15  VIB   1.04                  108.705      1.835      0.438
         ROT  0.320E+04              888.752      2.981     19.021
         INT  0.332E+04              997.458      4.816     19.459
         TR   0.264E+27             1481.254      4.968     37.118
         TOT                        2478.7116     9.7845    56.5774   236.7199

   temp. (K)  partition function   enthalpy   heat capacity  entropy
                                   cal/mol     cal/K/mol   cal/K/mol   J/K/mol
 120.00  VIB   1.00                    0.081      0.008      0.001
         ROT   818.                  357.707      2.981     16.308
         INT   818.                  357.788      2.989     16.309
         TR   0.673E+26              596.178      4.968     32.599
         TOT                         953.9659     7.9570    48.9077   204.6299

   temp. (K)  partition function   enthalpy   heat capacity  entropy
                                   cal/mol     cal/K/mol   cal/K/mol   J/K/mol
 100.00  VIB   1.00                    0.008      0.001      0.000
         ROT   622.                  298.089      2.981     15.765
         INT   622.                  298.097      2.982     15.765
         TR   0.512E+26              496.815      4.968     31.693
         TOT                         794.9117     7.9501    47.4582   198.5652

   temp. (K)  partition function   enthalpy   heat capacity  entropy
                                   cal/mol     cal/K/mol   cal/K/mol   J/K/mol
  80.00  VIB   1.00                    0.000      0.000     -0.000
         ROT   445.                  238.471      2.981     15.100
         INT   445.                  238.471      2.981     15.100
         TR   0.367E+26              397.452      4.968     30.585
         TOT                         635.9234     7.9491    45.6849   191.1457

   temp. (K)  partition function   enthalpy   heat capacity  entropy
                                   cal/mol     cal/K/mol   cal/K/mol   J/K/mol
  60.00  VIB   1.00                    0.000      0.000     -0.000
         ROT   289.                  178.853      2.981     14.242
         INT   289.                  178.853      2.981     14.242
         TR   0.238E+26              298.089      4.968     29.157
         TOT                         476.9424     7.9490    43.3988   181.5806

   temp. (K)  partition function   enthalpy   heat capacity  entropy
                                   cal/mol     cal/K/mol   cal/K/mol   J/K/mol
  40.00  VIB   1.00                    0.000      0.000     -0.000
         ROT   157.                  119.236      2.981     13.033
         INT   157.                  119.236      2.981     13.033
         TR   0.130E+26              198.726      4.968     27.143
         TOT                         317.9616     7.9490    40.1767   168.0994

   temp. (K)  partition function   enthalpy   heat capacity  entropy
                                   cal/mol     cal/K/mol   cal/K/mol   J/K/mol
  20.00  VIB   1.00                    0.000      0.000     -0.000
         ROT   55.6                   59.618      2.981     10.967
         INT   55.6                   59.618      2.981     10.967
         TR   0.458E+25               99.363      4.968     23.701
         TOT                         158.9808     7.9490    34.6685   145.0531

   temp. (K)  partition function   enthalpy   heat capacity  entropy
                                   cal/mol     cal/K/mol   cal/K/mol   J/K/mol
  10.00  VIB   1.00                    0.000      0.000     -0.000
         ROT   19.7                   29.809      2.981      8.901
         INT   19.7                   29.809      2.981      8.901
         TR   0.162E+25               49.681      4.968     20.259
         TOT                          79.4904     7.9490    29.1603   122.0068

       T/K    H(0)-H(T)+PV         H(T)/Eh          T*S/Eh         G(T)/Eh
   ------------------------------------------------------------------------
    298.15    0.395008E-02    0.373071E-01    0.268818E-01    0.104253E-01
    120.00    0.152024E-02    0.348772E-01    0.935273E-02    0.255245E-01
    100.00    0.126677E-02    0.346238E-01    0.756295E-02    0.270608E-01
     80.00    0.101341E-02    0.343704E-01    0.582428E-02    0.285461E-01
     60.00    0.760056E-03    0.341171E-01    0.414962E-02    0.299674E-01
     40.00    0.506704E-03    0.338637E-01    0.256103E-02    0.313027E-01
     20.00    0.253352E-03    0.336104E-01    0.110496E-02    0.325054E-01
     10.00    0.126676E-03    0.334837E-01    0.464699E-03    0.330190E-01 (used)
   ------------------------------------------------------------------------

         :::::::::::::::::::::::::::::::::::::::::::::::::::::
         ::                  THERMODYNAMIC                  ::
         :::::::::::::::::::::::::::::::::::::::::::::::::::::
         :: total free energy          -8.857699532001 Eh   ::
         ::.................................................::
         :: total energy               -8.890718507317 Eh   ::
         :: zero point energy           0.033356998714 Eh   ::
         :: G(RRHO) w/o ZPVE           -0.000338023398 Eh   ::
         :: G(RRHO) contrib.            0.033018975316 Eh   ::
         :::::::::::::::::::::::::::::::::::::::::::::::::::::

optimized geometry written to: xtbopt.xyz


           -------------------------------------------------
          | TOTAL ENERGY               -8.890718507317 Eh   |
          | TOTAL ENTHALPY             -8.857234832587 Eh   |
          | TOTAL FREE ENERGY          -8.857699532001 Eh   |
          | GRADIENT NORM               0.000606467787 Eh/α |
          | HOMO-LUMO GAP               2.909143099631 eV   |
           -------------------------------------------------

------------------------------------------------------------------------
 * finished run on 2020/05/12 at 11:45:21.053     
------------------------------------------------------------------------
 total:
 * wall-time:     0 d,  0 h,  0 min,  0.120 sec
 *  cpu-time:     0 d,  0 h,  0 min,  0.119 sec
 * ratio c/w:     0.992 speedup
 SCF:
 * wall-time:     0 d,  0 h,  0 min,  0.004 sec
 *  cpu-time:     0 d,  0 h,  0 min,  0.004 sec
 * ratio c/w:     0.996 speedup
 ANC optimizer:
 * wall-time:     0 d,  0 h,  0 min,  0.037 sec
 *  cpu-time:     0 d,  0 h,  0 min,  0.037 sec
 * ratio c/w:     0.990 speedup
 numerical hessian:
 * wall-time:     0 d,  0 h,  0 min,  0.061 sec
 *  cpu-time:     0 d,  0 h,  0 min,  0.060 sec
 * ratio c/w:     0.999 speedup

