      -----------------------------------------------------------      
     |                   =====================                   |     
     |                           x T B                           |     
     |                   =====================                   |     
     |                         S. Grimme                         |     
     |          Mulliken Center for Theoretical Chemistry        |     
     |                    University of Bonn                     |     
      -----------------------------------------------------------      

   * xtb version 6.2.2 (9d81278992624c895f80dd42a50cac0aa55982e2) compiled by '@Darwin' on 04/03/2020

   xtb is free software: you can redistribute it and/or modify it under
   the terms of the GNU Lesser General Public License as published by
   the Free Software Foundation, either version 3 of the License, or
   (at your option) any later version.
   
   xtb is distributed in the hope that it will be useful,
   but WITHOUT ANY WARRANTY; without even the implied warranty of
   MERCHANTABILITY or FITNESS FOR A PARTICULAR PURPOSE.  See the
   GNU Lesser General Public License for more details.
   
   Cite this work as:
   * S. Grimme, C. Bannwarth, P. Shushkov, J. Chem. Theory Comput., 2017,
     13, 1989-2009. DOI: 10.1021/acs.jctc.7b00118
   * C. Bannwarth, S. Ehlert and S. Grimme., J. Chem. Theory Comput., 2019,
     15, 1652-1671. DOI: 10.1021/acs.jctc.8b01176
   * P. Pracht, E. Caldeweyher, S. Ehlert, S. Grimme, ChemRxiv, 2019, preprint.
     DOI: 10.26434/chemrxiv.8326202.v1
   
   for DFT-D4:
   * E. Caldeweyher, C. Bannwarth and S. Grimme, J. Chem. Phys., 2017,
     147, 034112. DOI: 10.1063/1.4993215
   * E. Caldeweyher, S. Ehlert, A. Hansen, H. Neugebauer, S. Spicher,
     C. Bannwarth and S. Grimme, J. Chem. Phys., 2019, 150, 154122.
     DOI: 10.1063/1.5090222
   
   for sTDA-xTB:
   * S. Grimme and C. Bannwarth, J. Chem. Phys., 2016, 145, 054103.
     DOI: 10.1063/1.4959605
   
   in the mass-spec context:
   * V. Asgeirsson, C. Bauer and S. Grimme, Chem. Sci., 2017, 8, 4879.
     DOI: 10.1039/c7sc00601b
   
   for metadynamics refer to:
   * S. Grimme, J. Chem. Theory Comput., 2019, 155, 2847-2862
     DOI: 10.1021/acs.jctc.9b00143
   
   with help from (in alphabetical order)
   C. Bannwarth, F. Bohle, G. Brandenburg, E. Caldeweyher, M. Checinski,
   S. Dohm, S. Ehlert, S. Ehrlich, F. März, H. Neugebauer, J. Pisarek,
   P. Pracht, P. Shushkov, and S. Spicher.
   
 * started run on 2020/05/12 at 11:44:48.948     

           -------------------------------------------------
          |                Calculation Setup                |
           -------------------------------------------------

          program call               : xtb --input C1O2_0_S_0.input C1O2_0_S_0.xyz --ohess --molden --namespace C1O2_0_S_0 output.out
          calculation namespace      : C1O2_0_S_0
          coordinate file            : C1O2_0_S_0.xyz
          number of atoms            :                     3
          number of electrons        :                    16
          charge                     :                     0
          spin                       :                   0.0
          first test random number   :      0.80455260598694

   ID    Z sym.   atoms
    1    6 C      1
    2    8 O      2, 3

           -------------------------------------------------
          |                 G F N 2 - x T B                 |
           -------------------------------------------------

        Reference                      10.1021/acs.jctc.8b01176
      * Hamiltonian:
        H0-scaling (s, p, d)           1.850000    2.230000    2.230000
        zeta-weighting                 0.500000
      * Dispersion:
        s8                             2.700000
        a1                             0.520000
        a2                             5.000000
        s9                             5.000000
      * Repulsion:
        kExp                           1.500000    1.000000
        rExp                           1.000000
      * Coulomb:
        alpha                          2.000000
        third order                    shell-resolved
        anisotropic                    true
        a3                             3.000000
        a5                             4.000000
        cn-shift                       1.200000
        cn-exp                         4.000000
        max-rad                        5.000000


          ...................................................
          :                      SETUP                      :
          :.................................................:
          :  # basis functions                  12          :
          :  # atomic orbitals                  12          :
          :  # shells                            6          :
          :  # electrons                        16          :
          :  max. iterations                   250          :
          :  Hamiltonian                  GFN2-xTB          :
          :  restarted?                      false          :
          :  GBSA solvation                  false          :
          :  PC potential                    false          :
          :  electronic temp.          300.0000000     K    :
          :  accuracy                    1.0000000          :
          :  -> integral cutoff          0.2500000E+02      :
          :  -> integral neglect         0.1000000E-07      :
          :  -> SCF convergence          0.1000000E-05 Eh   :
          :  -> wf. convergence          0.1000000E-03 e    :
          :  Broyden damping             0.4000000          :
          ...................................................

 iter      E             dE          RMSdq      gap      omega  full diag
   1    -10.0265739 -0.100266E+02  0.838E+00    1.94       0.0  T
   2     -9.9685689  0.580050E-01  0.564E+00    0.83       1.0  T
   3    -10.0409882 -0.724193E-01  0.524E+00    1.94       1.0  T
   4    -10.0942139 -0.532257E-01  0.278E-01    1.46       1.0  T
   5    -10.0943996 -0.185748E-03  0.122E-01    1.50       1.0  T
   6    -10.0944315 -0.319120E-04  0.232E-02    1.49       2.5  T
   7    -10.0944328 -0.130302E-05  0.459E-03    1.49      12.6  T
   8    -10.0944328  0.240772E-07  0.438E-03    1.49      13.2  T
   9    -10.0944329 -0.454273E-07  0.167E-03    1.49      34.6  T
  10    -10.0944329 -0.964890E-08  0.537E-04    1.49     107.5  T
  11    -10.0944329 -0.105048E-08  0.113E-05    1.49    5106.0  T

   *** convergence criteria satisfied after 11 iterations ***

         #    Occupation            Energy/Eh            Energy/eV
      -------------------------------------------------------------
         1        2.0000           -0.7795017             -21.2113
         2        2.0000           -0.7559941             -20.5716
         3        2.0000           -0.6631244             -18.0445
         4        2.0000           -0.6145454             -16.7226
         5        2.0000           -0.6143736             -16.7180
         6        2.0000           -0.6002975             -16.3349
         7        2.0000           -0.5263520             -14.3228
         8        2.0000           -0.5063111             -13.7774 (HOMO)
         9                         -0.4514662             -12.2850 (LUMO)
        10                         -0.3744333             -10.1888
        11                          0.0314594               0.8561
        12                          0.0435245               1.1844
      -------------------------------------------------------------
                  HL-Gap            0.0548450 Eh            1.4924 eV
             Fermi-level           -0.4788886 Eh          -13.0312 eV

 SCC (total)                   0 d,  0 h,  0 min,  0.002 sec
 SCC setup                      ...        0 min,  0.000 sec (  4.089%)
 Dispersion                     ...        0 min,  0.000 sec (  0.510%)
 integral evaluation            ...        0 min,  0.001 sec ( 28.949%)
 zeroth order Hamiltonian       ...        0 min,  0.000 sec (  0.558%)
 iterations                     ...        0 min,  0.001 sec ( 38.219%)
 molecular gradient             ...        0 min,  0.000 sec ( 24.678%)
 printout                       ...        0 min,  0.000 sec (  2.427%)

         :::::::::::::::::::::::::::::::::::::::::::::::::::::
         ::                     SUMMARY                     ::
         :::::::::::::::::::::::::::::::::::::::::::::::::::::
         :: total energy             -10.077937692861 Eh    ::
         :: gradient norm              0.436918356484 Eh/a0 ::
         :: HOMO-LUMO gap              1.492407518075 eV    ::
         ::.................................................::
         :: SCC energy               -10.094432875119 Eh    ::
         :: -> isotropic ES            0.030461485035 Eh    ::
         :: -> anisotropic ES          0.000778060088 Eh    ::
         :: -> anisotropic XC         -0.001379030729 Eh    ::
         :: -> dispersion             -0.000684721934 Eh    ::
         :: repulsion energy           0.016495181598 Eh    ::
         :: add. restraining           0.000000000000 Eh    ::
         :::::::::::::::::::::::::::::::::::::::::::::::::::::

      ----------------------------------------------------------- 
     |                   =====================                   |
     |                        A N C O P T                        |
     |                   =====================                   |
     |               Approximate Normal Coordinate               |
     |                Rational Function Optimizer                |
      ----------------------------------------------------------- 

          ...................................................
          :                      SETUP                      :
          :.................................................:
          :   optimization level            normal          :
          :   max. optcycles                   200          :
          :   ANC micro-cycles                  20          :
          :   degrees of freedom                 3          :
          :.................................................:
          :   RF solver                   davidson          :
          :   write xtbopt.log                true          :
          :   linear?                        false          :
          :   energy convergence         0.5000000E-05 Eh   :
          :   grad. convergence          0.1000000E-02 Eh/α :
          :   maximium RF displ.         1.0000000          :
          :   Hlow (freq-cutoff)         0.1000000E-01      :
          :   Hmax (freq-cutoff)         5.0000000          :
          :   S6 in model hess.         20.0000000          :
          ...................................................

generating ANC from model Hessian ...
Using Lindh-Hessian (1995)
 Shifting diagonal of input Hessian by    0.0000000000000000     
 Lowest  eigenvalues of input Hessian
   -0.000000   -0.000000   -0.000000    0.000000    0.000000    0.000000
    0.166748    1.023476    1.344680
 Highest eigenvalues
    0.000000    0.000000    0.000000    0.166748    1.023476    1.344680


........................................................................
.............................. CYCLE    1 ..............................
........................................................................
   1    -10.0944329 -0.100944E+02  0.749E-06    1.49       0.0  T
   2    -10.0944329  0.152767E-12  0.907E-06    1.49    6366.3  T
   3    -10.0944329 -0.257572E-12  0.302E-06    1.49   19146.1  T
     SCC iter.                  ...        0 min,  0.000 sec
     gradient                   ...        0 min,  0.000 sec
 * total energy  :   -10.0779377 Eh     change       -0.1909406E-10 Eh
   gradient norm :     0.4369183 Eh/α   predicted     0.0000000E+00 (-100.00%)
   displ. norm   :     0.4562776 α      lambda       -0.1792026E+00
   maximum displ.:     0.3536993 α      in ANC's #2, #1, #3, ...

........................................................................
.............................. CYCLE    2 ..............................
........................................................................
   1    -10.2730333 -0.102730E+02  0.300E+00    4.17       0.0  T
   2    -10.2740644 -0.103112E-02  0.193E+00    3.94       1.0  T
   3    -10.2730064  0.105805E-02  0.120E+00    4.21       1.0  T
   4    -10.2754044 -0.239809E-02  0.104E-01    4.08       1.0  T
   5    -10.2754050 -0.573901E-06  0.223E-02    4.08       2.6  T
   6    -10.2754065 -0.146152E-05  0.145E-03    4.08      39.7  T
   7    -10.2754065 -0.121563E-09  0.184E-04    4.08     313.8  T
   8    -10.2754065 -0.717826E-11  0.685E-05    4.08     843.3  T
     SCC iter.                  ...        0 min,  0.000 sec
     gradient                   ...        0 min,  0.000 sec
 * total energy  :   -10.2251541 Eh     change       -0.1472164E+00 Eh
   gradient norm :     0.2939018 Eh/α   predicted    -0.1082553E+00 ( -26.47%)
   displ. norm   :     0.5683014 α      lambda       -0.1667616E+00
   maximum displ.:     0.5682827 α      in ANC's #2, #1, #3, ...

........................................................................
.............................. CYCLE    3 ..............................
........................................................................
   1    -10.4912903 -0.104913E+02  0.306E+00   10.29       0.0  T
   2    -10.4946897 -0.339945E-02  0.174E+00    9.97       1.0  T
   3    -10.4947850 -0.952792E-04  0.703E-01   10.06       1.0  T
   4    -10.4948397 -0.547224E-04  0.810E-02   10.04       1.0  T
   5    -10.4948393  0.457150E-06  0.181E-02   10.05       3.2  T
   6    -10.4948401 -0.783299E-06  0.326E-03   10.04      17.7  T
   7    -10.4948401 -0.489683E-08  0.332E-04   10.04     173.7  T
   8    -10.4948401  0.103277E-10  0.158E-04   10.04     366.2  T
     SCC iter.                  ...        0 min,  0.000 sec
     gradient                   ...        0 min,  0.001 sec
 * total energy  :   -10.2407186 Eh     change       -0.1556450E-01 Eh
   gradient norm :     0.4766559 Eh/α   predicted    -0.1103100E+00 ( 608.73%)
   displ. norm   :     0.4445995 α      lambda       -0.1710292E+00
   maximum displ.:     0.4418470 α      in ANC's #1, #2, #3, ...

........................................................................
.............................. CYCLE    4 ..............................
........................................................................
   1    -10.3962574 -0.103963E+02  0.226E+00    7.38       0.0  T
   2    -10.3997599 -0.350256E-02  0.123E+00    7.79       1.0  T
   3    -10.4004472 -0.687313E-03  0.761E-01    7.63       1.0  T
   4    -10.4005962 -0.148994E-03  0.788E-02    7.69       1.0  T
   5    -10.4005974 -0.118638E-05  0.167E-02    7.70       3.5  T
   6    -10.4005981 -0.667538E-06  0.277E-03    7.70      20.8  T
   7    -10.4005981 -0.745352E-09  0.333E-04    7.70     173.4  T
   8    -10.4005981 -0.129587E-09  0.105E-04    7.70     550.3  T
     SCC iter.                  ...        0 min,  0.001 sec
     gradient                   ...        0 min,  0.000 sec
 * total energy  :   -10.3039006 Eh     change       -0.6318194E-01 Eh
   gradient norm :     0.0907645 Eh/α   predicted    -0.1024182E+00 (  62.10%)
   displ. norm   :     0.0514373 α      lambda       -0.4649635E-02
   maximum displ.:     0.0429530 α      in ANC's #2, #1, #3, ...

........................................................................
.............................. CYCLE    5 ..............................
........................................................................
   1    -10.4189095 -0.104189E+02  0.260E-01    8.16       0.0  T
   2    -10.4189584 -0.489723E-04  0.140E-01    8.12       1.0  T
   3    -10.4189651 -0.665571E-05  0.838E-02    8.13       1.0  T
   4    -10.4189666 -0.153692E-05  0.963E-03    8.13       6.0  T
   5    -10.4189666 -0.731035E-08  0.573E-04    8.13     100.7  T
   6    -10.4189666 -0.296144E-09  0.245E-04    8.13     235.3  T
     SCC iter.                  ...        0 min,  0.000 sec
     gradient                   ...        0 min,  0.000 sec
 * total energy  :   -10.3072571 Eh     change       -0.3356559E-02 Eh
   gradient norm :     0.0392800 Eh/α   predicted    -0.2330968E-02 ( -30.55%)
   displ. norm   :     0.0787672 α      lambda       -0.2277504E-02
   maximum displ.:     0.0762090 α      in ANC's #2, #1, #3, ...

........................................................................
.............................. CYCLE    6 ..............................
........................................................................
   1    -10.4308372 -0.104308E+02  0.359E-01    8.48       0.0  T
   2    -10.4308607 -0.234930E-04  0.219E-01    8.45       1.0  T
   3    -10.4308610 -0.292397E-06  0.872E-02    8.46       1.0  T
   4    -10.4308662 -0.518969E-05  0.104E-02    8.45       5.5  T
   5    -10.4308662 -0.867847E-08  0.642E-04    8.45      89.9  T
   6    -10.4308662 -0.301448E-11  0.382E-04    8.45     151.1  T
     SCC iter.                  ...        0 min,  0.000 sec
     gradient                   ...        0 min,  0.000 sec
 * total energy  :   -10.3084379 Eh     change       -0.1180795E-02 Eh
   gradient norm :     0.0024347 Eh/α   predicted    -0.1145816E-02 (  -2.96%)
   displ. norm   :     0.0126969 α      lambda       -0.2959395E-04
   maximum displ.:     0.0093389 α      in ANC's #2, #1, #3, ...

........................................................................
.............................. CYCLE    7 ..............................
........................................................................
   1    -10.4303540 -0.104304E+02  0.561E-02    8.44       0.0  T
   2    -10.4303541 -0.165158E-06  0.353E-02    8.44       1.6  T
   3    -10.4303542 -0.560050E-07  0.482E-03    8.44      12.0  T
   4    -10.4303542 -0.368057E-07  0.148E-03    8.44      38.9  T
   5    -10.4303542 -0.156172E-09  0.427E-05    8.44    1353.2  T
   6    -10.4303542 -0.143885E-12  0.235E-05    8.44    2455.3  T
     SCC iter.                  ...        0 min,  0.000 sec
     gradient                   ...        0 min,  0.001 sec
 * total energy  :   -10.3084520 Eh     change       -0.1406455E-04 Eh
   gradient norm :     0.0008728 Eh/α   predicted    -0.1479881E-04 (   5.22%)
   displ. norm   :     0.0010999 α      lambda       -0.6343982E-06
   maximum displ.:     0.0009753 α      in ANC's #1, #2, #3, ...

........................................................................
.............................. CYCLE    8 ..............................
........................................................................
   1    -10.4307387 -0.104307E+02  0.571E-03    8.45       0.0  T
   2    -10.4307388 -0.251519E-07  0.297E-03    8.45      19.4  T
   3    -10.4307388 -0.290748E-08  0.177E-03    8.45      32.5  T
   4    -10.4307388 -0.569951E-09  0.196E-04    8.45     294.2  T
   5    -10.4307388 -0.314238E-11  0.610E-06    8.45    9461.4  T
     SCC iter.                  ...        0 min,  0.000 sec
     gradient                   ...        0 min,  0.001 sec
 * total energy  :   -10.3084522 Eh     change       -0.2226716E-06 Eh
   gradient norm :     0.0004654 Eh/α   predicted    -0.3176591E-06 (  42.66%)
   displ. norm   :     0.0003839 α      lambda       -0.1199417E-06
   maximum displ.:     0.0003448 α      in ANC's #1, #2, #3, ...

   *** GEOMETRY OPTIMIZATION CONVERGED AFTER 8 ITERATIONS ***

------------------------------------------------------------------------
 total energy gain   :        -0.2305145 Eh     -144.6500 kcal/mol
 total RMSD          :         0.7169051 a0        0.3794 Å
 total power (kW/mol):       -75.6519700 (step)********** (real)
------------------------------------------------------------------------

 ANCopt (total)                0 d,  0 h,  0 min,  0.013 sec
 optimizer setup                ...        0 min,  0.000 sec (  0.475%)
 model hessian                  ...        0 min,  0.000 sec (  0.319%)
 ANC generation                 ...        0 min,  0.000 sec (  0.258%)
 coordinate transformation      ...        0 min,  0.000 sec (  0.137%)
 single point calculation       ...        0 min,  0.012 sec ( 94.242%)
 optimization log               ...        0 min,  0.000 sec (  1.185%)
 hessian update                 ...        0 min,  0.000 sec (  0.146%)
 rational function              ...        0 min,  0.000 sec (  1.368%)

================
 final structure:
================
3
 xtb: 6.2.2 (9d81278992624c895f80dd42a50cac0aa55982e2)
C        -0.00000010421960    0.00002600049431    0.00000000000000
O         1.14350956411796    0.00086565666765    0.00000000000000
O        -1.14350945989836   -0.00089165716196    0.00000000000000

 Bond Distances (Angstroems)
 ---------------------------
C1-O2=1.1435         C1-O3=1.1435         O2-C1=1.1435         O3-C1=1.1435         
 O  C  Rav=1.1435 sigma=0.0000  Rmin=1.1435  Rmax=1.1435     2

 selected bond angles (degree)
 --------------------
O3-C1-O2=180.00                

 selected dihedral angles (degree)
 ---------------------------------

           -------------------------------------------------
          |                Final Singlepoint                |
           -------------------------------------------------

          ...................................................
          :                      SETUP                      :
          :.................................................:
          :  # basis functions                  12          :
          :  # atomic orbitals                  12          :
          :  # shells                            6          :
          :  # electrons                        16          :
          :  max. iterations                   250          :
          :  Hamiltonian                  GFN2-xTB          :
          :  restarted?                      false          :
          :  GBSA solvation                  false          :
          :  PC potential                    false          :
          :  electronic temp.          300.0000000     K    :
          :  accuracy                    1.0000000          :
          :  -> integral cutoff          0.2500000E+02      :
          :  -> integral neglect         0.1000000E-07      :
          :  -> SCF convergence          0.1000000E-05 Eh   :
          :  -> wf. convergence          0.1000000E-03 e    :
          :  Broyden damping             0.4000000          :
          ...................................................

 iter      E             dE          RMSdq      gap      omega  full diag
   1    -10.4307388 -0.104307E+02  0.749E-07    8.45       0.0  T
   2    -10.4307388  0.355271E-14  0.389E-07    8.45  100000.0  T
   3    -10.4307388  0.000000E+00  0.233E-07    8.45  100000.0  T

   *** convergence criteria satisfied after 3 iterations ***

         #    Occupation            Energy/Eh            Energy/eV
      -------------------------------------------------------------
         1        2.0000           -0.8108425             -22.0641
         2        2.0000           -0.7967023             -21.6794
         3        2.0000           -0.6648102             -18.0904
         4        2.0000           -0.6635058             -18.0549
         5        2.0000           -0.6635058             -18.0549
         6        2.0000           -0.5998191             -16.3219
         7        2.0000           -0.5344428             -14.5429
         8        2.0000           -0.5344428             -14.5429 (HOMO)
         9                         -0.2238363              -6.0909 (LUMO)
        10                         -0.2238363              -6.0909
        11                          0.3103756               8.4457
        12                          1.3653051              37.1518
      -------------------------------------------------------------
                  HL-Gap            0.3106066 Eh            8.4520 eV
             Fermi-level           -0.3791395 Eh          -10.3169 eV

 SCC (total)                   0 d,  0 h,  0 min,  0.001 sec
 SCC setup                      ...        0 min,  0.000 sec (  4.129%)
 Dispersion                     ...        0 min,  0.000 sec (  0.518%)
 integral evaluation            ...        0 min,  0.001 sec ( 41.769%)
 zeroth order Hamiltonian       ...        0 min,  0.000 sec (  0.447%)
 iterations                     ...        0 min,  0.000 sec ( 14.245%)
 molecular gradient             ...        0 min,  0.000 sec ( 35.317%)
 printout                       ...        0 min,  0.000 sec (  3.003%)

         :::::::::::::::::::::::::::::::::::::::::::::::::::::
         ::                     SUMMARY                     ::
         :::::::::::::::::::::::::::::::::::::::::::::::::::::
         :: total energy             -10.308452201566 Eh    ::
         :: gradient norm              0.000465383723 Eh/a0 ::
         :: HOMO-LUMO gap              8.452034681028 eV    ::
         ::.................................................::
         :: SCC energy               -10.430738761562 Eh    ::
         :: -> isotropic ES            0.032325411198 Eh    ::
         :: -> anisotropic ES          0.003406038045 Eh    ::
         :: -> anisotropic XC          0.000429537618 Eh    ::
         :: -> dispersion             -0.000687158926 Eh    ::
         :: repulsion energy           0.122286561608 Eh    ::
         :: add. restraining           0.000000000000 Eh    ::
         :::::::::::::::::::::::::::::::::::::::::::::::::::::

           ------------------------------------------------- 
          |                Numerical Hessian                |
           ------------------------------------------------- 
step length          :   0.00500
SCC accuracy         :   0.30000
Hessian scale factor :   1.00000
frozen atoms in %    :   0.00000    0
RMS gradient         :   0.00047
estimated CPU  time      0.00 min
estimated wall time      0.00 min

writing file <hessian>.

 vibrational frequencies (cm-1)
eigval :        0.00     0.00     0.00     0.00     0.00   599.58
eigval :      599.77  1425.51  2594.42
           -------------------------------------------------
          |                Property Printout                |
           -------------------------------------------------

    * Orbital Energies and Occupations

         #    Occupation            Energy/Eh            Energy/eV
      -------------------------------------------------------------
         1        2.0000           -0.8108425             -22.0641
         2        2.0000           -0.7967023             -21.6794
         3        2.0000           -0.6648102             -18.0904
         4        2.0000           -0.6635058             -18.0549
         5        2.0000           -0.6635058             -18.0549
         6        2.0000           -0.5998191             -16.3219
         7        2.0000           -0.5344428             -14.5429
         8        2.0000           -0.5344428             -14.5429 (HOMO)
         9                         -0.2238363              -6.0909 (LUMO)
        10                         -0.2238363              -6.0909
        11                          0.3103756               8.4457
        12                          1.3653051              37.1518
      -------------------------------------------------------------
                  HL-Gap            0.3106066 Eh            8.4520 eV
             Fermi-level           -0.3791395 Eh          -10.3169 eV

     #   Z        covCN         q      C6AA      α(0)
     1   6 C      1.711     0.464    21.599     7.524
     2   8 O      0.856    -0.232    18.600     5.782
     3   8 O      0.856    -0.232    18.600     5.782

 Mol. C6AA /au·bohr⁶  :        174.800388
 Mol. C8AA /au·bohr⁸  :       4029.880406
 Mol. α(0) /au        :         19.088384


Wiberg/Mayer (AO) data.
largest (>0.10) Wiberg bond orders for each atom
          total WBO             WBO to atom ...
     1  C   3.936        O    3 1.968    O    2 1.968
     2  O   2.370        C    1 1.968    O    3 0.402
     3  O   2.370        C    1 1.968    O    2 0.402

MOs/occ written to file <molden.input>


molecular dipole:
                 x           y           z       tot (Debye)
 q only:       -0.000       0.000      -0.000
   full:       -0.000       0.000      -0.000       0.000
molecular quadrupole (traceless):
                xx          xy          yy          xz          yz          zz
 q only:       -2.168      -0.002       1.084       0.000       0.000       1.084
  q+dip:       -3.107      -0.004       1.554       0.000       0.000       1.554
   full:       -4.360      -0.005       2.180       0.000       0.000       2.180
Molecule has the following symmetry elements: (i) (Cinf) (C2) 2*(sigma) 
It seems to be the Dinfh point group

           -------------------------------------------------
          |                Geometry Summary                 |
           -------------------------------------------------

      molecular mass/u    :       44.0095457
   center of mass at/Å    :        0.0000000      -0.0000024       0.0000000
  moments of inertia/u·Å² :        0.1328326E-07   0.4184212E+02   0.4184212E+02
rotational constants/cm⁻¹ :        0.1269088E+10   0.4028867E+00   0.4028867E+00

 * 2 selected distances

     #   Z        #   Z                                     value/Å
     1   6 C      2   8 O                                 1.1435100 (max)
     1   6 C      3   8 O                                 1.1435097 (min)

 * 1 distinct bonds (by element types)

   Z      Z             #   av. dist./Å        max./Å        min./Å
   6 C    8 O           2     1.1435099     1.1435100     1.1435097

           -------------------------------------------------
          |               Frequency Printout                |
           -------------------------------------------------
 vibrational frequencies (cm-1)
eigval :        0.00     0.00     0.00     0.00     0.00   599.58
eigval :      599.77  1425.51  2594.42
 reduced masses (amu)
   1: 16.00   2: 16.00   3: 14.91   4: 14.91   5: 14.91   6: 13.10   7: 13.10   8: 16.00
   9: 13.10
 IR intensities (amu)
   1:  0.00   2:  0.00   3:  0.24   4:  0.06   5:  0.08   6:  0.96   7:  0.96   8:  0.00
   9:  3.74
 Raman intensities (amu)
   1:  0.00   2:  0.00   3:  0.00   4:  0.00   5:  0.00   6:  0.00   7:  0.00   8:  0.00
   9:  0.00
 output can be read by thermo (or use thermo option).
 writing <g98.out> molden fake output.
 recommended (thermochemical) frequency scaling factor: 1.0
           -------------------------------------------------
          |             Thermodynamic Functions             |
           -------------------------------------------------

din symmetry found (for desy threshold:  0.10E+00) used in thermo

          ...................................................
          :                      SETUP                      :
          :.................................................:
          :  # frequencies                           4      :
          :  # imaginary freq.                       0      :
          :  linear?                              true      :
          :  only rotor calc.                    false      :
          :  symmetry                              din      :
          :  rotational number                       2      :
          :  scaling factor                  1.0000000      :
          :  rotor cutoff                   50.0000000 cm⁻¹ :
          :  imag. cutoff                  -20.0000000 cm⁻¹ :
          :.................................................:

    mode    ω/cm⁻¹     T·S(HO)/kcal·mol⁻¹    T·S(FR)/kcal·mol⁻¹   T·S(vib)
   ------------------------------------------------------------------------
   ------------------------------------------------------------------------

   temp. (K)  partition function   enthalpy   heat capacity  entropy
                                   cal/mol     cal/K/mol   cal/K/mol   J/K/mol
 298.15  VIB   1.12                  205.205      2.163      0.917
         ROT   257.                  592.502      1.987     13.016
         INT   289.                  797.706      4.150     13.933
         TR   0.282E+27             1481.254      4.968     37.255
         TOT                        2278.9604     9.1185    51.1874   214.1680

   temp. (K)  partition function   enthalpy   heat capacity  entropy
                                   cal/mol     cal/K/mol   cal/K/mol   J/K/mol
 120.00  VIB   1.00                    2.588      0.155      0.025
         ROT   104.                  238.471      1.987     11.207
         INT   104.                  241.059      2.142     11.232
         TR   0.721E+26              596.178      4.968     32.735
         TOT                         837.2373     7.1106    43.9673   183.9591

   temp. (K)  partition function   enthalpy   heat capacity  entropy
                                   cal/mol     cal/K/mol   cal/K/mol   J/K/mol
 100.00  VIB   1.00                    0.614      0.053      0.007
         ROT   86.3                  198.726      1.987     10.845
         INT   86.3                  199.340      2.040     10.852
         TR   0.549E+26              496.815      4.968     31.830
         TOT                         696.1550     7.0084    42.6819   178.5809

   temp. (K)  partition function   enthalpy   heat capacity  entropy
                                   cal/mol     cal/K/mol   cal/K/mol   J/K/mol
  80.00  VIB   1.00                    0.071      0.010      0.001
         ROT   69.0                  158.981      1.987     10.402
         INT   69.0                  159.052      1.997     10.403
         TR   0.393E+26              397.452      4.968     30.722
         TOT                         556.5038     6.9650    41.1244   172.0647

   temp. (K)  partition function   enthalpy   heat capacity  entropy
                                   cal/mol     cal/K/mol   cal/K/mol   J/K/mol
  60.00  VIB   1.00                    0.002      0.000     -0.000
         ROT   51.8                  119.236      1.987      9.830
         INT   51.8                  119.238      1.988      9.830
         TR   0.255E+26              298.089      4.968     29.293
         TOT                         417.3266     6.9559    39.1232   163.6916

   temp. (K)  partition function   enthalpy   heat capacity  entropy
                                   cal/mol     cal/K/mol   cal/K/mol   J/K/mol
  40.00  VIB   1.00                    0.000      0.000     -0.000
         ROT   34.5                   79.490      1.987      9.024
         INT   34.5                   79.490      1.987      9.024
         TR   0.139E+26              198.726      4.968     27.280
         TOT                         278.2164     6.9554    36.3040   151.8958

   temp. (K)  partition function   enthalpy   heat capacity  entropy
                                   cal/mol     cal/K/mol   cal/K/mol   J/K/mol
  20.00  VIB   1.00                    0.000      0.000     -0.000
         ROT   17.3                   39.745      1.987      7.647
         INT   17.3                   39.745      1.987      7.647
         TR   0.491E+25               99.363      4.968     23.838
         TOT                         139.1082     6.9554    31.4845   131.7310

   temp. (K)  partition function   enthalpy   heat capacity  entropy
                                   cal/mol     cal/K/mol   cal/K/mol   J/K/mol
  10.00  VIB   1.00                    0.000      0.000     -0.000
         ROT   8.63                   19.873      1.987      6.269
         INT   8.63                   19.873      1.987      6.269
         TR   0.174E+25               49.681      4.968     20.396
         TOT                          69.5541     6.9554    26.6650   111.5662

       T/K    H(0)-H(T)+PV         H(T)/Eh          T*S/Eh         G(T)/Eh
   ------------------------------------------------------------------------
    298.15    0.363175E-02    0.155222E-01    0.243208E-01   -0.879861E-02
    120.00    0.133422E-02    0.132246E-01    0.840796E-02    0.481668E-02
    100.00    0.110939E-02    0.129998E-01    0.680179E-02    0.619802E-02
     80.00    0.886845E-03    0.127773E-01    0.524288E-02    0.753438E-02
     60.00    0.665052E-03    0.125555E-01    0.374081E-02    0.881465E-02
     40.00    0.443366E-03    0.123338E-01    0.231416E-02    0.100196E-01
     20.00    0.221683E-03    0.121121E-01    0.100347E-02    0.111086E-01
     10.00    0.110842E-03    0.120013E-01    0.424933E-03    0.115763E-01 (used)
   ------------------------------------------------------------------------

         :::::::::::::::::::::::::::::::::::::::::::::::::::::
         ::                  THERMODYNAMIC                  ::
         :::::::::::::::::::::::::::::::::::::::::::::::::::::
         :: total free energy         -10.296875881247 Eh   ::
         ::.................................................::
         :: total energy              -10.308452201565 Eh   ::
         :: zero point energy           0.011890411907 Eh   ::
         :: G(RRHO) w/o ZPVE           -0.000314091588 Eh   ::
         :: G(RRHO) contrib.            0.011576320319 Eh   ::
         :::::::::::::::::::::::::::::::::::::::::::::::::::::

optimized geometry written to: xtbopt.xyz


           -------------------------------------------------
          | TOTAL ENERGY              -10.308452201565 Eh   |
          | TOTAL ENTHALPY            -10.296450948145 Eh   |
          | TOTAL FREE ENERGY         -10.296875881247 Eh   |
          | GRADIENT NORM               0.000465383824 Eh/α |
          | HOMO-LUMO GAP               8.452034630217 eV   |
           -------------------------------------------------

------------------------------------------------------------------------
 * finished run on 2020/05/12 at 11:44:49.006     
------------------------------------------------------------------------
 total:
 * wall-time:     0 d,  0 h,  0 min,  0.057 sec
 *  cpu-time:     0 d,  0 h,  0 min,  0.057 sec
 * ratio c/w:     0.998 speedup
 SCF:
 * wall-time:     0 d,  0 h,  0 min,  0.002 sec
 *  cpu-time:     0 d,  0 h,  0 min,  0.002 sec
 * ratio c/w:     1.000 speedup
 ANC optimizer:
 * wall-time:     0 d,  0 h,  0 min,  0.015 sec
 *  cpu-time:     0 d,  0 h,  0 min,  0.015 sec
 * ratio c/w:     0.999 speedup
 numerical hessian:
 * wall-time:     0 d,  0 h,  0 min,  0.025 sec
 *  cpu-time:     0 d,  0 h,  0 min,  0.025 sec
 * ratio c/w:     0.998 speedup

