      -----------------------------------------------------------      
     |                   =====================                   |     
     |                           x T B                           |     
     |                   =====================                   |     
     |                         S. Grimme                         |     
     |          Mulliken Center for Theoretical Chemistry        |     
     |                    University of Bonn                     |     
      -----------------------------------------------------------      

   * xtb version 6.2.2 (9d81278992624c895f80dd42a50cac0aa55982e2) compiled by '@Darwin' on 04/03/2020

   xtb is free software: you can redistribute it and/or modify it under
   the terms of the GNU Lesser General Public License as published by
   the Free Software Foundation, either version 3 of the License, or
   (at your option) any later version.
   
   xtb is distributed in the hope that it will be useful,
   but WITHOUT ANY WARRANTY; without even the implied warranty of
   MERCHANTABILITY or FITNESS FOR A PARTICULAR PURPOSE.  See the
   GNU Lesser General Public License for more details.
   
   Cite this work as:
   * S. Grimme, C. Bannwarth, P. Shushkov, J. Chem. Theory Comput., 2017,
     13, 1989-2009. DOI: 10.1021/acs.jctc.7b00118
   * C. Bannwarth, S. Ehlert and S. Grimme., J. Chem. Theory Comput., 2019,
     15, 1652-1671. DOI: 10.1021/acs.jctc.8b01176
   * P. Pracht, E. Caldeweyher, S. Ehlert, S. Grimme, ChemRxiv, 2019, preprint.
     DOI: 10.26434/chemrxiv.8326202.v1
   
   for DFT-D4:
   * E. Caldeweyher, C. Bannwarth and S. Grimme, J. Chem. Phys., 2017,
     147, 034112. DOI: 10.1063/1.4993215
   * E. Caldeweyher, S. Ehlert, A. Hansen, H. Neugebauer, S. Spicher,
     C. Bannwarth and S. Grimme, J. Chem. Phys., 2019, 150, 154122.
     DOI: 10.1063/1.5090222
   
   for sTDA-xTB:
   * S. Grimme and C. Bannwarth, J. Chem. Phys., 2016, 145, 054103.
     DOI: 10.1063/1.4959605
   
   in the mass-spec context:
   * V. Asgeirsson, C. Bauer and S. Grimme, Chem. Sci., 2017, 8, 4879.
     DOI: 10.1039/c7sc00601b
   
   for metadynamics refer to:
   * S. Grimme, J. Chem. Theory Comput., 2019, 155, 2847-2862
     DOI: 10.1021/acs.jctc.9b00143
   
   with help from (in alphabetical order)
   C. Bannwarth, F. Bohle, G. Brandenburg, E. Caldeweyher, M. Checinski,
   S. Dohm, S. Ehlert, S. Ehrlich, F. März, H. Neugebauer, J. Pisarek,
   P. Pracht, P. Shushkov, and S. Spicher.
   
 * started run on 2020/05/12 at 11:45:23.549     

           -------------------------------------------------
          |                Calculation Setup                |
           -------------------------------------------------

          program call               : xtb --input H2C1N2_11_S_0.input H2C1N2_11_S_0.xyz --ohess --molden --namespace H2C1N2_11_S_0 output.out
          calculation namespace      : H2C1N2_11_S_0
          coordinate file            : H2C1N2_11_S_0.xyz
          number of atoms            :                     5
          number of electrons        :                    16
          charge                     :                     0
          spin                       :                   0.0
          first test random number   :      0.16785524417412

   ID    Z sym.   atoms
    1    7 N      1, 3
    2    6 C      2
    3    1 H      4, 5

           -------------------------------------------------
          |                 G F N 2 - x T B                 |
           -------------------------------------------------

        Reference                      10.1021/acs.jctc.8b01176
      * Hamiltonian:
        H0-scaling (s, p, d)           1.850000    2.230000    2.230000
        zeta-weighting                 0.500000
      * Dispersion:
        s8                             2.700000
        a1                             0.520000
        a2                             5.000000
        s9                             5.000000
      * Repulsion:
        kExp                           1.500000    1.000000
        rExp                           1.000000
      * Coulomb:
        alpha                          2.000000
        third order                    shell-resolved
        anisotropic                    true
        a3                             3.000000
        a5                             4.000000
        cn-shift                       1.200000
        cn-exp                         4.000000
        max-rad                        5.000000


          ...................................................
          :                      SETUP                      :
          :.................................................:
          :  # basis functions                  14          :
          :  # atomic orbitals                  14          :
          :  # shells                            8          :
          :  # electrons                        16          :
          :  max. iterations                   250          :
          :  Hamiltonian                  GFN2-xTB          :
          :  restarted?                      false          :
          :  GBSA solvation                  false          :
          :  PC potential                    false          :
          :  electronic temp.          300.0000000     K    :
          :  accuracy                    1.0000000          :
          :  -> integral cutoff          0.2500000E+02      :
          :  -> integral neglect         0.1000000E-07      :
          :  -> SCF convergence          0.1000000E-05 Eh   :
          :  -> wf. convergence          0.1000000E-03 e    :
          :  Broyden damping             0.4000000          :
          ...................................................

 iter      E             dE          RMSdq      gap      omega  full diag
   1     -8.7699401 -0.876994E+01  0.611E+00    1.36       0.0  T
   2     -8.5282770  0.241663E+00  0.871E+00    1.92       1.0  T
   3     -8.8589699 -0.330693E+00  0.250E+00    0.92       1.0  T
   4     -8.8344476  0.245223E-01  0.237E+00    0.47       1.0  T
   5     -8.8558353 -0.213877E-01  0.108E+00    0.68       1.0  T
   6     -8.8590224 -0.318701E-02  0.453E-01    0.62       1.0  T
   7     -8.8596949 -0.672582E-03  0.672E-02    0.57       1.0  T
   8     -8.8596974 -0.250354E-05  0.503E-02    0.57       1.0  T
   9     -8.8597051 -0.763237E-05  0.204E-02    0.57       2.2  T
  10     -8.8597065 -0.142354E-05  0.258E-03    0.56      17.3  T
  11     -8.8597065 -0.123606E-07  0.886E-04    0.56      50.5  T
  12     -8.8597065 -0.160438E-08  0.441E-04    0.56     101.4  T

   *** convergence criteria satisfied after 12 iterations ***

         #    Occupation            Energy/Eh            Energy/eV
      -------------------------------------------------------------
         1        2.0000           -0.7263311             -19.7645
         2        2.0000           -0.6081771             -16.5493
         3        2.0000           -0.6038376             -16.4313
         4        2.0000           -0.5728295             -15.5875
         5        2.0000           -0.5014350             -13.6447
         6        2.0000           -0.4871440             -13.2559
         7        2.0000           -0.4604978             -12.5308
         8        2.0000           -0.3987434             -10.8504 (HOMO)
         9        0.0000           -0.3780145             -10.2863 (LUMO)
        10                         -0.1307642              -3.5583
        11                         -0.0004777              -0.0130
        12                          0.0471213               1.2822
        13                          0.1467920               3.9944
        14                          0.1987818               5.4091
      -------------------------------------------------------------
                  HL-Gap            0.0207288 Eh            0.5641 eV
             Fermi-level           -0.3883789 Eh          -10.5683 eV

 SCC (total)                   0 d,  0 h,  0 min,  0.003 sec
 SCC setup                      ...        0 min,  0.000 sec (  2.749%)
 Dispersion                     ...        0 min,  0.000 sec (  0.444%)
 integral evaluation            ...        0 min,  0.001 sec ( 25.650%)
 zeroth order Hamiltonian       ...        0 min,  0.000 sec (  1.205%)
 iterations                     ...        0 min,  0.001 sec ( 41.125%)
 molecular gradient             ...        0 min,  0.001 sec ( 26.124%)
 printout                       ...        0 min,  0.000 sec (  2.335%)

         :::::::::::::::::::::::::::::::::::::::::::::::::::::
         ::                     SUMMARY                     ::
         :::::::::::::::::::::::::::::::::::::::::::::::::::::
         :: total energy              -8.799281054458 Eh    ::
         :: gradient norm              0.180929820297 Eh/a0 ::
         :: HOMO-LUMO gap              0.564060540521 eV    ::
         ::.................................................::
         :: SCC energy                -8.859706515634 Eh    ::
         :: -> isotropic ES            0.008168109261 Eh    ::
         :: -> anisotropic ES          0.002412478380 Eh    ::
         :: -> anisotropic XC          0.019524511186 Eh    ::
         :: -> dispersion             -0.001450439788 Eh    ::
         :: repulsion energy           0.060425441413 Eh    ::
         :: add. restraining           0.000000000000 Eh    ::
         :::::::::::::::::::::::::::::::::::::::::::::::::::::

      ----------------------------------------------------------- 
     |                   =====================                   |
     |                        A N C O P T                        |
     |                   =====================                   |
     |               Approximate Normal Coordinate               |
     |                Rational Function Optimizer                |
      ----------------------------------------------------------- 

          ...................................................
          :                      SETUP                      :
          :.................................................:
          :   optimization level            normal          :
          :   max. optcycles                   200          :
          :   ANC micro-cycles                  20          :
          :   degrees of freedom                 9          :
          :.................................................:
          :   RF solver                   davidson          :
          :   write xtbopt.log                true          :
          :   linear?                        false          :
          :   energy convergence         0.5000000E-05 Eh   :
          :   grad. convergence          0.1000000E-02 Eh/α :
          :   maximium RF displ.         1.0000000          :
          :   Hlow (freq-cutoff)         0.1000000E-01      :
          :   Hmax (freq-cutoff)         5.0000000          :
          :   S6 in model hess.         20.0000000          :
          ...................................................

generating ANC from model Hessian ...
Using Lindh-Hessian (1995)
 Shifting diagonal of input Hessian by    0.0000000000000000     
 Lowest  eigenvalues of input Hessian
   -0.000000   -0.000000    0.000000    0.000000    0.000000    0.000000
    0.050463    0.093339    0.168639    0.229985    0.739854    0.888921
    1.004658    1.111484    1.684464
 Highest eigenvalues
    0.229985    0.739854    0.888921    1.004658    1.111484    1.684464


........................................................................
.............................. CYCLE    1 ..............................
........................................................................
   1     -8.8597065 -0.885971E+01  0.399E-05    0.56       0.0  T
   2     -8.8597065  0.712639E-10  0.131E-04    0.56     340.1  T
   3     -8.8597065 -0.748805E-10  0.184E-05    0.56    2435.1  T
     SCC iter.                  ...        0 min,  0.001 sec
     gradient                   ...        0 min,  0.001 sec
 * total energy  :    -8.7992811 Eh     change       -0.3991563E-09 Eh
   gradient norm :     0.1809318 Eh/α   predicted     0.0000000E+00 (-100.00%)
   displ. norm   :     0.3786880 α      lambda       -0.4072247E-01
   maximum displ.:     0.3186916 α      in ANC's #1, #3, #6, ...

........................................................................
.............................. CYCLE    2 ..............................
........................................................................
   1     -8.9061234 -0.890612E+01  0.150E+00    1.47       0.0  T
   2     -8.9025490  0.357444E-02  0.130E+00    1.25       1.0  T
   3     -8.9056129 -0.306394E-02  0.101E+00    1.32       1.0  T
   4     -8.9085224 -0.290945E-02  0.164E-01    1.29       1.0  T
   5     -8.9085622 -0.398592E-04  0.475E-02    1.27       1.0  T
   6     -8.9085623 -0.770115E-07  0.136E-02    1.27       3.3  T
   7     -8.9085627 -0.422780E-06  0.185E-03    1.27      24.2  T
   8     -8.9085627 -0.666472E-08  0.592E-04    1.27      75.5  T
   9     -8.9085627 -0.195081E-09  0.894E-05    1.27     500.5  T
     SCC iter.                  ...        0 min,  0.001 sec
     gradient                   ...        0 min,  0.001 sec
 * total energy  :    -8.8319260 Eh     change       -0.3264496E-01 Eh
   gradient norm :     0.1104843 Eh/α   predicted    -0.2328112E-01 ( -28.68%)
   displ. norm   :     0.4398132 α      lambda       -0.3772905E-01
   maximum displ.:     0.2067218 α      in ANC's #1, #3, #2, ...

........................................................................
.............................. CYCLE    3 ..............................
........................................................................
   1     -8.9664256 -0.896643E+01  0.210E+00    3.11       0.0  T
   2     -8.9691427 -0.271711E-02  0.108E+00    2.65       1.0  T
   3     -8.9687612  0.381564E-03  0.772E-01    2.77       1.0  T
   4     -8.9700404 -0.127927E-02  0.166E-01    2.71       1.0  T
   5     -8.9700604 -0.199435E-04  0.549E-02    2.70       1.0  T
   6     -8.9700611 -0.725657E-06  0.561E-03    2.70       8.0  T
   7     -8.9700611 -0.213755E-07  0.112E-03    2.70      39.9  T
   8     -8.9700611 -0.174591E-08  0.236E-04    2.70     189.4  T
   9     -8.9700611 -0.751044E-11  0.340E-05    2.70    1316.5  T
     SCC iter.                  ...        0 min,  0.001 sec
     gradient                   ...        0 min,  0.001 sec
 * total energy  :    -8.8493587 Eh     change       -0.1743265E-01 Eh
   gradient norm :     0.1538714 Eh/α   predicted    -0.2251360E-01 (  29.15%)
   displ. norm   :     0.2679216 α      lambda       -0.1812345E-01
   maximum displ.:     0.1846465 α      in ANC's #3, #2, #5, ...

........................................................................
.............................. CYCLE    4 ..............................
........................................................................
   1     -8.9548255 -0.895483E+01  0.108E+00    2.48       0.0  T
   2     -8.9551065 -0.281052E-03  0.571E-01    2.58       1.0  T
   3     -8.9549084  0.198099E-03  0.353E-01    2.61       1.0  T
   4     -8.9552092 -0.300815E-03  0.876E-02    2.58       1.0  T
   5     -8.9552357 -0.265047E-04  0.224E-02    2.60       2.0  T
   6     -8.9552358 -0.920318E-07  0.443E-03    2.60      10.1  T
   7     -8.9552359 -0.159608E-07  0.103E-03    2.60      43.5  T
   8     -8.9552359 -0.949452E-09  0.211E-04    2.60     212.5  T
   9     -8.9552359 -0.200409E-10  0.495E-05    2.60     902.6  T
     SCC iter.                  ...        0 min,  0.001 sec
     gradient                   ...        0 min,  0.001 sec
 * total energy  :    -8.8600745 Eh     change       -0.1071580E-01 Eh
   gradient norm :     0.0564384 Eh/α   predicted    -0.9712195E-02 (  -9.37%)
   displ. norm   :     0.1758289 α      lambda       -0.7732446E-02
   maximum displ.:     0.1512993 α      in ANC's #5, #1, #3, ...

........................................................................
.............................. CYCLE    5 ..............................
........................................................................
   1     -8.9611803 -0.896118E+01  0.937E-01    2.76       0.0  T
   2     -8.9613182 -0.137896E-03  0.562E-01    2.79       1.0  T
   3     -8.9617564 -0.438163E-03  0.367E-01    2.83       1.0  T
   4     -8.9619861 -0.229694E-03  0.441E-02    2.81       1.0  T
   5     -8.9619905 -0.439838E-05  0.164E-02    2.82       2.7  T
   6     -8.9619905 -0.376925E-07  0.314E-03    2.82      14.2  T
   7     -8.9619905 -0.703012E-08  0.736E-04    2.82      60.8  T
   8     -8.9619905 -0.215081E-09  0.176E-04    2.82     254.3  T
     SCC iter.                  ...        0 min,  0.001 sec
     gradient                   ...        0 min,  0.001 sec
 * total energy  :    -8.8658906 Eh     change       -0.5816111E-02 Eh
   gradient norm :     0.0466892 Eh/α   predicted    -0.3985748E-02 ( -31.47%)
   displ. norm   :     0.2331183 α      lambda       -0.6792188E-02
   maximum displ.:     0.1893704 α      in ANC's #5, #1, #2, ...

........................................................................
.............................. CYCLE    6 ..............................
........................................................................
   1     -8.9703056 -0.897031E+01  0.123E+00    3.09       0.0  T
   2     -8.9708189 -0.513341E-03  0.736E-01    3.15       1.0  T
   3     -8.9719755 -0.115657E-02  0.429E-01    3.18       1.0  T
   4     -8.9722203 -0.244794E-03  0.579E-02    3.16       1.0  T
   5     -8.9722290 -0.871327E-05  0.193E-02    3.17       2.3  T
   6     -8.9722291 -0.606173E-07  0.226E-03    3.17      19.8  T
   7     -8.9722291 -0.356218E-08  0.841E-04    3.17      53.2  T
   8     -8.9722291 -0.180828E-09  0.658E-05    3.17     679.2  T
     SCC iter.                  ...        0 min,  0.001 sec
     gradient                   ...        0 min,  0.001 sec
 * total energy  :    -8.8700712 Eh     change       -0.4180610E-02 Eh
   gradient norm :     0.0257541 Eh/α   predicted    -0.3580653E-02 ( -14.35%)
   displ. norm   :     0.0690672 α      lambda       -0.1018969E-02
   maximum displ.:     0.0632905 α      in ANC's #5, #8, #3, ...

........................................................................
.............................. CYCLE    7 ..............................
........................................................................
   1     -8.9793271 -0.897933E+01  0.434E-01    3.28       0.0  T
   2     -8.9794005 -0.733731E-04  0.267E-01    3.29       1.0  T
   3     -8.9795713 -0.170762E-03  0.141E-01    3.30       1.0  T
   4     -8.9795941 -0.228085E-04  0.196E-02    3.30       2.3  T
   5     -8.9795949 -0.841161E-06  0.845E-03    3.30       5.3  T
   6     -8.9795949 -0.249714E-07  0.115E-03    3.30      39.0  T
   7     -8.9795949 -0.441597E-09  0.273E-04    3.30     163.9  T
   8     -8.9795949 -0.348219E-10  0.897E-05    3.30     498.7  T
     SCC iter.                  ...        0 min,  0.001 sec
     gradient                   ...        0 min,  0.001 sec
 * total energy  :    -8.8705896 Eh     change       -0.5184499E-03 Eh
   gradient norm :     0.0095641 Eh/α   predicted    -0.5119137E-03 (  -1.26%)
   displ. norm   :     0.0578545 α      lambda       -0.2481405E-03
   maximum displ.:     0.0375402 α      in ANC's #1, #2, #5, ...

........................................................................
.............................. CYCLE    8 ..............................
........................................................................
   1     -8.9789637 -0.897896E+01  0.157E-01    3.36       0.0  T
   2     -8.9789684 -0.465939E-05  0.868E-02    3.34       1.0  T
   3     -8.9789674  0.956766E-06  0.303E-02    3.35       1.5  T
   4     -8.9789691 -0.172893E-05  0.920E-03    3.35       4.9  T
   5     -8.9789694 -0.244252E-06  0.486E-03    3.35       9.2  T
   6     -8.9789694 -0.220309E-07  0.581E-04    3.35      76.9  T
   7     -8.9789694 -0.150825E-09  0.104E-04    3.35     428.8  T
     SCC iter.                  ...        0 min,  0.001 sec
     gradient                   ...        0 min,  0.001 sec
 * total energy  :    -8.8706305 Eh     change       -0.4088522E-04 Eh
   gradient norm :     0.0113674 Eh/α   predicted    -0.1244860E-03 ( 204.48%)
   displ. norm   :     0.0250920 α      lambda       -0.1434718E-03
   maximum displ.:     0.0168820 α      in ANC's #1, #5, #3, ...

........................................................................
.............................. CYCLE    9 ..............................
........................................................................
   1     -8.9806293 -0.898063E+01  0.964E-02    3.33       0.0  T
   2     -8.9806330 -0.372729E-05  0.490E-02    3.32       1.0  T
   3     -8.9806337 -0.719942E-06  0.372E-02    3.32       1.2  T
   4     -8.9806357 -0.199407E-05  0.641E-03    3.32       7.0  T
   5     -8.9806358 -0.114836E-06  0.218E-03    3.32      20.5  T
   6     -8.9806358 -0.161825E-08  0.388E-04    3.32     115.3  T
   7     -8.9806358 -0.955769E-10  0.446E-05    3.32    1002.7  T
     SCC iter.                  ...        0 min,  0.000 sec
     gradient                   ...        0 min,  0.001 sec
 * total energy  :    -8.8707050 Eh     change       -0.7443972E-04 Eh
   gradient norm :     0.0046894 Eh/α   predicted    -0.7178160E-04 (  -3.57%)
   displ. norm   :     0.0098263 α      lambda       -0.3124435E-04
   maximum displ.:     0.0079364 α      in ANC's #3, #2, #6, ...

........................................................................
.............................. CYCLE   10 ..............................
........................................................................
   1     -8.9803483 -0.898035E+01  0.521E-02    3.30       0.0  T
   2     -8.9803489 -0.529345E-06  0.273E-02    3.30       1.6  T
   3     -8.9803490 -0.109237E-06  0.439E-03    3.30      10.2  T
   4     -8.9803490 -0.306000E-07  0.302E-03    3.30      14.8  T
   5     -8.9803490 -0.151529E-07  0.640E-04    3.30      69.9  T
   6     -8.9803490 -0.358614E-09  0.246E-04    3.30     181.7  T
     SCC iter.                  ...        0 min,  0.000 sec
     gradient                   ...        0 min,  0.001 sec
 * total energy  :    -8.8707200 Eh     change       -0.1501928E-04 Eh
   gradient norm :     0.0013329 Eh/α   predicted    -0.1562508E-04 (   4.03%)
   displ. norm   :     0.0158348 α      lambda       -0.1036503E-04
   maximum displ.:     0.0116049 α      in ANC's #1, #4, #2, ...

........................................................................
.............................. CYCLE   11 ..............................
........................................................................
   1     -8.9803569 -0.898036E+01  0.428E-02    3.29       0.0  T
   2     -8.9803572 -0.297729E-06  0.233E-02    3.29       1.9  T
   3     -8.9803568  0.438311E-06  0.164E-02    3.29       2.7  T
   4     -8.9803575 -0.751204E-06  0.178E-03    3.29      25.1  T
   5     -8.9803575 -0.143135E-08  0.913E-04    3.29      49.0  T
   6     -8.9803575 -0.196287E-09  0.145E-04    3.29     308.7  T
     SCC iter.                  ...        0 min,  0.000 sec
     gradient                   ...        0 min,  0.001 sec
 * total energy  :    -8.8707269 Eh     change       -0.6863956E-05 Eh
   gradient norm :     0.0005627 Eh/α   predicted    -0.5184478E-05 ( -24.47%)
   displ. norm   :     0.0019023 α      lambda       -0.5853139E-06
   maximum displ.:     0.0014772 α      in ANC's #4, #5, #7, ...

........................................................................
.............................. CYCLE   12 ..............................
........................................................................
   1     -8.9803695 -0.898037E+01  0.844E-03    3.29       0.0  T
   2     -8.9803695 -0.173116E-07  0.491E-03    3.29       9.1  T
   3     -8.9803695 -0.178540E-07  0.317E-03    3.29      14.1  T
   4     -8.9803695 -0.178940E-07  0.333E-04    3.29     134.2  T
   5     -8.9803695 -0.136390E-09  0.142E-04    3.29     315.7  T
     SCC iter.                  ...        0 min,  0.000 sec
     gradient                   ...        0 min,  0.001 sec
 * total energy  :    -8.8707274 Eh     change       -0.5287916E-06 Eh
   gradient norm :     0.0003683 Eh/α   predicted    -0.2936736E-06 ( -44.46%)
   displ. norm   :     0.0013229 α      lambda       -0.2091136E-06
   maximum displ.:     0.0006413 α      in ANC's #1, #4, #7, ...

   *** GEOMETRY OPTIMIZATION CONVERGED AFTER 12 ITERATIONS ***

------------------------------------------------------------------------
 total energy gain   :        -0.0714463 Eh      -44.8332 kcal/mol
 total RMSD          :         0.6131156 a0        0.3244 Å
 total power (kW/mol):       -15.6318585 (step)-6856.6254 (real)
------------------------------------------------------------------------

 ANCopt (total)                0 d,  0 h,  0 min,  0.027 sec
 optimizer setup                ...        0 min,  0.000 sec (  0.281%)
 model hessian                  ...        0 min,  0.000 sec (  0.516%)
 ANC generation                 ...        0 min,  0.000 sec (  0.230%)
 coordinate transformation      ...        0 min,  0.000 sec (  0.138%)
 single point calculation       ...        0 min,  0.026 sec ( 94.696%)
 optimization log               ...        0 min,  0.000 sec (  1.262%)
 hessian update                 ...        0 min,  0.000 sec (  0.112%)
 rational function              ...        0 min,  0.000 sec (  1.182%)

================
 final structure:
================
5
 xtb: 6.2.2 (9d81278992624c895f80dd42a50cac0aa55982e2)
N        -0.72966612052516   -0.09606840706541    0.44268427820547
C         0.57937945467189    0.04503473835501    0.01599568983294
N         0.00058602701191    1.12073878255573   -0.19562808214671
H        -1.33844486250452   -0.56053191061862   -0.23728889534580
H         1.48814550134588   -0.50917320322671   -0.02576199054591

 Bond Distances (Angstroems)
 ---------------------------
N1-C2=1.3840         N1-N3=1.5561         N1-H4=1.0241         C2-N1=1.3840         C2-N3=1.2397         C2-H5=1.0652         
N3-N1=1.5561         N3-C2=1.2397         H4-N1=1.0241         H5-C2=1.0652         
 C  H  Rav=1.0652 sigma=0.0000  Rmin=1.0652  Rmax=1.0652     1
 N  H  Rav=1.0241 sigma=0.0000  Rmin=1.0241  Rmax=1.0241     1
 N  C  Rav=1.3119 sigma=0.0722  Rmin=1.2397  Rmax=1.3840     2
 N  N  Rav=1.5561 sigma=0.0000  Rmin=1.5561  Rmax=1.5561     1

 selected bond angles (degree)
 --------------------
N3-N1-C2= 49.45                H4-N1-C2=113.82                H4-N1-N3=111.18                N3-C2-N1= 72.51                
H5-C2-N1=139.99                H5-C2-N3=147.46                C2-N3-N1= 58.03                

 selected dihedral angles (degree)
 ---------------------------------
N3-C2-N1-H4= 98.17            H5-C2-N1-N3=178.09            H5-C2-N1-H4=276.26            C2-N3-N1-H4=256.21            
N1-N3-C2-H5=182.28            
           -------------------------------------------------
          |                Final Singlepoint                |
           -------------------------------------------------

          ...................................................
          :                      SETUP                      :
          :.................................................:
          :  # basis functions                  14          :
          :  # atomic orbitals                  14          :
          :  # shells                            8          :
          :  # electrons                        16          :
          :  max. iterations                   250          :
          :  Hamiltonian                  GFN2-xTB          :
          :  restarted?                      false          :
          :  GBSA solvation                  false          :
          :  PC potential                    false          :
          :  electronic temp.          300.0000000     K    :
          :  accuracy                    1.0000000          :
          :  -> integral cutoff          0.2500000E+02      :
          :  -> integral neglect         0.1000000E-07      :
          :  -> SCF convergence          0.1000000E-05 Eh   :
          :  -> wf. convergence          0.1000000E-03 e    :
          :  Broyden damping             0.4000000          :
          ...................................................

 iter      E             dE          RMSdq      gap      omega  full diag
   1     -8.9803695 -0.898037E+01  0.387E-05    3.29       0.0  T
   2     -8.9803695 -0.285993E-12  0.171E-05    3.29    2612.2  T
   3     -8.9803695  0.131450E-12  0.103E-05    3.29    4338.0  T

   *** convergence criteria satisfied after 3 iterations ***

         #    Occupation            Energy/Eh            Energy/eV
      -------------------------------------------------------------
         1        2.0000           -0.7279246             -19.8078
         2        2.0000           -0.6184710             -16.8295
         3        2.0000           -0.6060521             -16.4915
         4        2.0000           -0.5692081             -15.4889
         5        2.0000           -0.5152856             -14.0216
         6        2.0000           -0.4922821             -13.3957
         7        2.0000           -0.4498534             -12.2411
         8        2.0000           -0.4002244             -10.8907 (HOMO)
         9                         -0.2792470              -7.5987 (LUMO)
        10                         -0.1780956              -4.8462
        11                          0.0215258               0.5857
        12                          0.1236355               3.3643
        13                          0.1440252               3.9191
        14                          0.7257135              19.7477
      -------------------------------------------------------------
                  HL-Gap            0.1209774 Eh            3.2920 eV
             Fermi-level           -0.3397357 Eh           -9.2447 eV

 SCC (total)                   0 d,  0 h,  0 min,  0.002 sec
 SCC setup                      ...        0 min,  0.000 sec (  2.499%)
 Dispersion                     ...        0 min,  0.000 sec (  0.408%)
 integral evaluation            ...        0 min,  0.001 sec ( 39.446%)
 zeroth order Hamiltonian       ...        0 min,  0.000 sec (  0.569%)
 iterations                     ...        0 min,  0.000 sec ( 14.378%)
 molecular gradient             ...        0 min,  0.001 sec ( 39.767%)
 printout                       ...        0 min,  0.000 sec (  2.549%)

         :::::::::::::::::::::::::::::::::::::::::::::::::::::
         ::                     SUMMARY                     ::
         :::::::::::::::::::::::::::::::::::::::::::::::::::::
         :: total energy              -8.870727379633 Eh    ::
         :: gradient norm              0.000382905046 Eh/a0 ::
         :: HOMO-LUMO gap              3.291963789857 eV    ::
         ::.................................................::
         :: SCC energy                -8.980369514263 Eh    ::
         :: -> isotropic ES            0.012855977851 Eh    ::
         :: -> anisotropic ES          0.000808892781 Eh    ::
         :: -> anisotropic XC          0.019388023672 Eh    ::
         :: -> dispersion             -0.001449092385 Eh    ::
         :: repulsion energy           0.109642108528 Eh    ::
         :: add. restraining           0.000000000000 Eh    ::
         :::::::::::::::::::::::::::::::::::::::::::::::::::::

           ------------------------------------------------- 
          |                Numerical Hessian                |
           ------------------------------------------------- 
step length          :   0.00500
SCC accuracy         :   0.30000
Hessian scale factor :   1.00000
frozen atoms in %    :   0.00000    0
RMS gradient         :   0.00038
estimated CPU  time      0.00 min
estimated wall time      0.00 min

writing file <hessian>.

 projected vibrational frequencies (cm-1)
eigval :       -0.00    -0.00    -0.00    -0.00     0.00     0.00
eigval :      695.73   783.30   932.09  1038.10  1166.55  1256.81
eigval :     1819.10  3206.24  3224.27
           -------------------------------------------------
          |                Property Printout                |
           -------------------------------------------------

    * Orbital Energies and Occupations

         #    Occupation            Energy/Eh            Energy/eV
      -------------------------------------------------------------
         1        2.0000           -0.7279245             -19.8078
         2        2.0000           -0.6184709             -16.8295
         3        2.0000           -0.6060521             -16.4915
         4        2.0000           -0.5692081             -15.4889
         5        2.0000           -0.5152855             -14.0216
         6        2.0000           -0.4922821             -13.3957
         7        2.0000           -0.4498534             -12.2411
         8        2.0000           -0.4002244             -10.8907 (HOMO)
         9                         -0.2792469              -7.5987 (LUMO)
        10                         -0.1780956              -4.8462
        11                          0.0215258               0.5857
        12                          0.1236355               3.3643
        13                          0.1440252               3.9191
        14                          0.7257136              19.7477
      -------------------------------------------------------------
                  HL-Gap            0.1209775 Eh            3.2920 eV
             Fermi-level           -0.3397357 Eh           -9.2447 eV

     #   Z        covCN         q      C6AA      α(0)
     1   7 N      2.721    -0.217    25.727     7.533
     2   6 C      2.747     0.177    24.183     8.052
     3   7 N      1.862    -0.170    25.489     7.483
     4   1 H      0.859     0.148     1.415     1.863
     5   1 H      0.927     0.062     2.176     2.307

 Mol. C6AA /au·bohr⁶  :        312.608063
 Mol. C8AA /au·bohr⁸  :       6913.494304
 Mol. α(0) /au        :         27.238809


Wiberg/Mayer (AO) data.
largest (>0.10) Wiberg bond orders for each atom
          total WBO             WBO to atom ...
     1  N   2.953        C    2 1.047    H    4 0.948    N    3 0.940
     2  C   3.925        N    3 1.924    N    1 1.047    H    5 0.954
     3  N   2.916        C    2 1.924    N    1 0.940
     4  H   0.978        N    1 0.948
     5  H   0.996        C    2 0.954

MOs/occ written to file <molden.input>


molecular dipole:
                 x           y           z       tot (Debye)
 q only:        0.293      -0.522      -0.183
   full:        0.504      -0.951      -0.444       2.960
molecular quadrupole (traceless):
                xx          xy          yy          xz          yz          zz
 q only:        1.582       0.286      -1.092       0.623       0.360      -0.490
  q+dip:        2.982      -0.423      -2.024       1.867       1.191      -0.958
   full:        2.719       0.337      -2.305       1.914       1.302      -0.413

           -------------------------------------------------
          |                Geometry Summary                 |
           -------------------------------------------------

      molecular mass/u    :       42.0400238
   center of mass at/Å    :       -0.0737930       0.3286149       0.0805758
  moments of inertia/u·Å² :        0.1299851E+02   0.1991632E+02   0.3138821E+02
rotational constants/cm⁻¹ :        0.1296890E+01   0.8464231E+00   0.5370689E+00

 * 4 selected distances

     #   Z        #   Z                                     value/Å
     1   7 N      2   6 C                                 1.3840425 (max)
     2   6 C      3   7 N                                 1.2397281
     1   7 N      4   1 H                                 1.0240612 (min)
     2   6 C      5   1 H                                 1.0652445

 * 3 distinct bonds (by element types)

   Z      Z             #   av. dist./Å        max./Å        min./Å
   1 H    6 C           1     1.0652445     1.0652445     1.0652445
   1 H    7 N           1     1.0240612     1.0240612     1.0240612
   6 C    7 N           2     1.3118853     1.3840425     1.2397281

           -------------------------------------------------
          |               Frequency Printout                |
           -------------------------------------------------
 projected vibrational frequencies (cm-1)
eigval :       -0.00    -0.00    -0.00    -0.00     0.00     0.00
eigval :      695.73   783.30   932.09  1038.10  1166.55  1256.81
eigval :     1819.10  3206.24  3224.27
 reduced masses (amu)
   1: 11.83   2: 13.72   3: 11.44   4: 13.28   5: 12.69   6:  8.79   7: 11.58   8:  4.39
   9:  2.83  10:  3.62  11:  8.49  12:  7.19  13: 12.31  14:  2.11  15:  1.84
 IR intensities (amu)
Molecule has no symmetry elements
It seems to be the C1 point group
   1:  0.20   2:  0.31   3:  0.15   4:  0.19   5:  0.13   6:  0.34   7:  0.71   8:  0.22
   9:  0.08  10:  0.30  11:  0.99  12:  0.63  13:  0.71  14:  0.21  15:  0.10
 Raman intensities (amu)
   1:  0.00   2:  0.00   3:  0.00   4:  0.00   5:  0.00   6:  0.00   7:  0.00   8:  0.00
   9:  0.00  10:  0.00  11:  0.00  12:  0.00  13:  0.00  14:  0.00  15:  0.00
 output can be read by thermo (or use thermo option).
 writing <g98.out> molden fake output.
 recommended (thermochemical) frequency scaling factor: 1.0
           -------------------------------------------------
          |             Thermodynamic Functions             |
           -------------------------------------------------

c1  symmetry found (for desy threshold:  0.10E+00) used in thermo

          ...................................................
          :                      SETUP                      :
          :.................................................:
          :  # frequencies                           9      :
          :  # imaginary freq.                       0      :
          :  linear?                             false      :
          :  only rotor calc.                    false      :
          :  symmetry                               c1      :
          :  rotational number                       1      :
          :  scaling factor                  1.0000000      :
          :  rotor cutoff                   50.0000000 cm⁻¹ :
          :  imag. cutoff                  -20.0000000 cm⁻¹ :
          :.................................................:

    mode    ω/cm⁻¹     T·S(HO)/kcal·mol⁻¹    T·S(FR)/kcal·mol⁻¹   T·S(vib)
   ------------------------------------------------------------------------
   ------------------------------------------------------------------------

   temp. (K)  partition function   enthalpy   heat capacity  entropy
                                   cal/mol     cal/K/mol   cal/K/mol   J/K/mol
 298.15  VIB   1.09                  195.223      2.733      0.819
         ROT  0.689E+04              888.752      2.981     20.543
         INT  0.748E+04             1083.976      5.714     21.362
         TR   0.264E+27             1481.254      4.968     37.118
         TOT                        2565.2297    10.6823    58.4798   244.6794

   temp. (K)  partition function   enthalpy   heat capacity  entropy
                                   cal/mol     cal/K/mol   cal/K/mol   J/K/mol
 120.00  VIB   1.00                    0.714      0.053      0.007
         ROT  0.176E+04              357.707      2.981     17.830
         INT  0.176E+04              358.421      3.034     17.837
         TR   0.673E+26              596.178      4.968     32.599
         TOT                         954.5988     8.0018    50.4354   211.0216

   temp. (K)  partition function   enthalpy   heat capacity  entropy
                                   cal/mol     cal/K/mol   cal/K/mol   J/K/mol
 100.00  VIB   1.00                    0.123      0.013      0.001
         ROT  0.134E+04              298.089      2.981     17.286
         INT  0.134E+04              298.212      2.994     17.288
         TR   0.512E+26              496.815      4.968     31.693
         TOT                         795.0272     7.9619    48.9812   204.9375

   temp. (K)  partition function   enthalpy   heat capacity  entropy
                                   cal/mol     cal/K/mol   cal/K/mol   J/K/mol
  80.00  VIB   1.00                    0.009      0.001      0.000
         ROT   957.                  238.471      2.981     16.621
         INT   957.                  238.480      2.982     16.621
         TR   0.367E+26              397.452      4.968     30.585
         TOT                         635.9324     7.9505    47.2068   197.5131

   temp. (K)  partition function   enthalpy   heat capacity  entropy
                                   cal/mol     cal/K/mol   cal/K/mol   J/K/mol
  60.00  VIB   1.00                    0.000      0.000     -0.000
         ROT   622.                  178.853      2.981     15.764
         INT   622.                  178.854      2.981     15.764
         TR   0.238E+26              298.089      4.968     29.157
         TOT                         476.9425     7.9491    44.9205   187.9475

   temp. (K)  partition function   enthalpy   heat capacity  entropy
                                   cal/mol     cal/K/mol   cal/K/mol   J/K/mol
  40.00  VIB   1.00                    0.000      0.000     -0.000
         ROT   338.                  119.236      2.981     14.555
         INT   338.                  119.236      2.981     14.555
         TR   0.130E+26              198.726      4.968     27.143
         TOT                         317.9616     7.9490    41.6984   174.4662

   temp. (K)  partition function   enthalpy   heat capacity  entropy
                                   cal/mol     cal/K/mol   cal/K/mol   J/K/mol
  20.00  VIB   1.00                    0.000      0.000     -0.000
         ROT   120.                   59.618      2.981     12.489
         INT   120.                   59.618      2.981     12.489
         TR   0.458E+25               99.363      4.968     23.701
         TOT                         158.9808     7.9490    36.1902   151.4198

   temp. (K)  partition function   enthalpy   heat capacity  entropy
                                   cal/mol     cal/K/mol   cal/K/mol   J/K/mol
  10.00  VIB   1.00                    0.000      0.000     -0.000
         ROT   42.3                   29.809      2.981     10.423
         INT   42.3                   29.809      2.981     10.423
         TR   0.162E+25               49.681      4.968     20.259
         TOT                          79.4904     7.9490    30.6820   128.3734

       T/K    H(0)-H(T)+PV         H(T)/Eh          T*S/Eh         G(T)/Eh
   ------------------------------------------------------------------------
    298.15    0.408795E-02    0.362607E-01    0.277856E-01    0.847504E-02
    120.00    0.152125E-02    0.336940E-01    0.964486E-02    0.240491E-01
    100.00    0.126696E-02    0.334397E-01    0.780566E-02    0.256340E-01
     80.00    0.101342E-02    0.331861E-01    0.601830E-02    0.271678E-01
     60.00    0.760056E-03    0.329328E-01    0.429512E-02    0.286376E-01
     40.00    0.506704E-03    0.326794E-01    0.265803E-02    0.300214E-01
     20.00    0.253352E-03    0.324261E-01    0.115346E-02    0.312726E-01
     10.00    0.126676E-03    0.322994E-01    0.488949E-03    0.318104E-01 (used)
   ------------------------------------------------------------------------

         :::::::::::::::::::::::::::::::::::::::::::::::::::::
         ::                  THERMODYNAMIC                  ::
         :::::::::::::::::::::::::::::::::::::::::::::::::::::
         :: total free energy          -8.838916936087 Eh   ::
         ::.................................................::
         :: total energy               -8.870727379509 Eh   ::
         :: zero point energy           0.032172716012 Eh   ::
         :: G(RRHO) w/o ZPVE           -0.000362272590 Eh   ::
         :: G(RRHO) contrib.            0.031810443422 Eh   ::
         :::::::::::::::::::::::::::::::::::::::::::::::::::::

optimized geometry written to: xtbopt.xyz


           -------------------------------------------------
          | TOTAL ENERGY               -8.870727379509 Eh   |
          | TOTAL ENTHALPY             -8.838427987481 Eh   |
          | TOTAL FREE ENERGY          -8.838916936087 Eh   |
          | GRADIENT NORM               0.000382884066 Eh/α |
          | HOMO-LUMO GAP               3.291964205115 eV   |
           -------------------------------------------------

------------------------------------------------------------------------
 * finished run on 2020/05/12 at 11:45:23.663     
------------------------------------------------------------------------
 total:
 * wall-time:     0 d,  0 h,  0 min,  0.113 sec
 *  cpu-time:     0 d,  0 h,  0 min,  0.113 sec
 * ratio c/w:     0.998 speedup
 SCF:
 * wall-time:     0 d,  0 h,  0 min,  0.003 sec
 *  cpu-time:     0 d,  0 h,  0 min,  0.003 sec
 * ratio c/w:     0.995 speedup
 ANC optimizer:
 * wall-time:     0 d,  0 h,  0 min,  0.030 sec
 *  cpu-time:     0 d,  0 h,  0 min,  0.030 sec
 * ratio c/w:     0.999 speedup
 numerical hessian:
 * wall-time:     0 d,  0 h,  0 min,  0.062 sec
 *  cpu-time:     0 d,  0 h,  0 min,  0.062 sec
 * ratio c/w:     0.999 speedup

