      -----------------------------------------------------------      
     |                   =====================                   |     
     |                           x T B                           |     
     |                   =====================                   |     
     |                         S. Grimme                         |     
     |          Mulliken Center for Theoretical Chemistry        |     
     |                    University of Bonn                     |     
      -----------------------------------------------------------      

   * xtb version 6.2.2 (9d81278992624c895f80dd42a50cac0aa55982e2) compiled by '@Darwin' on 04/03/2020

   xtb is free software: you can redistribute it and/or modify it under
   the terms of the GNU Lesser General Public License as published by
   the Free Software Foundation, either version 3 of the License, or
   (at your option) any later version.
   
   xtb is distributed in the hope that it will be useful,
   but WITHOUT ANY WARRANTY; without even the implied warranty of
   MERCHANTABILITY or FITNESS FOR A PARTICULAR PURPOSE.  See the
   GNU Lesser General Public License for more details.
   
   Cite this work as:
   * S. Grimme, C. Bannwarth, P. Shushkov, J. Chem. Theory Comput., 2017,
     13, 1989-2009. DOI: 10.1021/acs.jctc.7b00118
   * C. Bannwarth, S. Ehlert and S. Grimme., J. Chem. Theory Comput., 2019,
     15, 1652-1671. DOI: 10.1021/acs.jctc.8b01176
   * P. Pracht, E. Caldeweyher, S. Ehlert, S. Grimme, ChemRxiv, 2019, preprint.
     DOI: 10.26434/chemrxiv.8326202.v1
   
   for DFT-D4:
   * E. Caldeweyher, C. Bannwarth and S. Grimme, J. Chem. Phys., 2017,
     147, 034112. DOI: 10.1063/1.4993215
   * E. Caldeweyher, S. Ehlert, A. Hansen, H. Neugebauer, S. Spicher,
     C. Bannwarth and S. Grimme, J. Chem. Phys., 2019, 150, 154122.
     DOI: 10.1063/1.5090222
   
   for sTDA-xTB:
   * S. Grimme and C. Bannwarth, J. Chem. Phys., 2016, 145, 054103.
     DOI: 10.1063/1.4959605
   
   in the mass-spec context:
   * V. Asgeirsson, C. Bauer and S. Grimme, Chem. Sci., 2017, 8, 4879.
     DOI: 10.1039/c7sc00601b
   
   for metadynamics refer to:
   * S. Grimme, J. Chem. Theory Comput., 2019, 155, 2847-2862
     DOI: 10.1021/acs.jctc.9b00143
   
   with help from (in alphabetical order)
   C. Bannwarth, F. Bohle, G. Brandenburg, E. Caldeweyher, M. Checinski,
   S. Dohm, S. Ehlert, S. Ehrlich, F. März, H. Neugebauer, J. Pisarek,
   P. Pracht, P. Shushkov, and S. Spicher.
   
 * started run on 2020/05/12 at 11:43:59.903     

           -------------------------------------------------
          |                Calculation Setup                |
           -------------------------------------------------

          program call               : xtb --input C4N1_6_S_3.input C4N1_6_S_3.xyz --ohess --molden --namespace C4N1_6_S_3 output.out
          calculation namespace      : C4N1_6_S_3
          coordinate file            : C4N1_6_S_3.xyz
          number of atoms            :                     5
          number of electrons        :                    21
          charge                     :                     0
          spin                       :                   1.5
          first test random number   :      0.80837355283735

   ID    Z sym.   atoms
    1    7 N      1
    2    6 C      2-5

           -------------------------------------------------
          |                 G F N 2 - x T B                 |
           -------------------------------------------------

        Reference                      10.1021/acs.jctc.8b01176
      * Hamiltonian:
        H0-scaling (s, p, d)           1.850000    2.230000    2.230000
        zeta-weighting                 0.500000
      * Dispersion:
        s8                             2.700000
        a1                             0.520000
        a2                             5.000000
        s9                             5.000000
      * Repulsion:
        kExp                           1.500000    1.000000
        rExp                           1.000000
      * Coulomb:
        alpha                          2.000000
        third order                    shell-resolved
        anisotropic                    true
        a3                             3.000000
        a5                             4.000000
        cn-shift                       1.200000
        cn-exp                         4.000000
        max-rad                        5.000000


          ...................................................
          :                      SETUP                      :
          :.................................................:
          :  # basis functions                  20          :
          :  # atomic orbitals                  20          :
          :  # shells                           10          :
          :  # electrons                        21          :
          :  max. iterations                   250          :
          :  Hamiltonian                  GFN2-xTB          :
          :  restarted?                      false          :
          :  GBSA solvation                  false          :
          :  PC potential                    false          :
          :  electronic temp.          300.0000000     K    :
          :  accuracy                    1.0000000          :
          :  -> integral cutoff          0.2500000E+02      :
          :  -> integral neglect         0.1000000E-07      :
          :  -> SCF convergence          0.1000000E-05 Eh   :
          :  -> wf. convergence          0.1000000E-03 e    :
          :  Broyden damping             0.4000000          :
          ...................................................

 iter      E             dE          RMSdq      gap      omega  full diag
   1    -10.7948652 -0.107949E+02  0.109E+01    0.37       0.0  T
   2    -10.2500015  0.544864E+00  0.102E+01    0.22       1.0  T
   3     -9.8128158  0.437186E+00  0.108E+01    0.86       1.0  T
   4    -10.5200561 -0.707240E+00  0.728E+00    0.18       1.0  T
   5    -10.1164798  0.403576E+00  0.828E+00    0.42       1.0  T
   6    -10.8963797 -0.779900E+00  0.196E+00    0.06       1.0  T
   7    -10.8830857  0.132940E-01  0.237E+00    0.16       1.0  T
   8    -10.8987348 -0.156491E-01  0.180E+00    0.13       1.0  T
   9    -10.9043537 -0.561888E-02  0.940E-01    0.06       1.0  T
  10    -10.9020403  0.231333E-02  0.195E+00    0.03       1.0  T
  11    -10.9011253  0.915001E-03  0.212E+00    0.03       1.0  T
  12    -10.9045405 -0.341517E-02  0.866E-01    0.06       1.0  T
  13    -10.9051587 -0.618160E-03  0.213E-01    0.07       1.0  T
  14    -10.9052788 -0.120133E-03  0.300E-01    0.08       1.0  T
  15    -10.9054487 -0.169925E-03  0.147E-01    0.08       1.0  T
  16    -10.9054840 -0.352349E-04  0.335E-02    0.07       1.3  T
  17    -10.9054841 -0.152261E-06  0.350E-02    0.07       1.3  T
  18    -10.9054855 -0.133198E-05  0.148E-02    0.07       3.0  T
  19    -10.9054857 -0.222760E-06  0.361E-03    0.07      12.4  T
  20    -10.9054857 -0.132430E-07  0.615E-04    0.07      72.7  T
  21    -10.9054857 -0.580112E-09  0.224E-04    0.07     200.1  T

   *** convergence criteria satisfied after 21 iterations ***

         #    Occupation            Energy/Eh            Energy/eV
      -------------------------------------------------------------
         1        2.0000           -0.7060621             -19.2129
       ...           ...                  ...                  ...
         6        2.0000           -0.5425086             -14.7624
         7        2.0000           -0.5188594             -14.1189
         8        2.0000           -0.5134119             -13.9706
         9        1.9625           -0.4729276             -12.8690
        10        1.0375           -0.4667626             -12.7013
        11        1.0000           -0.4299848             -11.7005
        12        0.8022           -0.3917723             -10.6607 (HOMO)
        13        0.1978           -0.3891118             -10.5883 (LUMO)
        14                         -0.3694291             -10.0527
        15                         -0.3344243              -9.1001
        16                         -0.3155058              -8.5853
        17                          0.0049310               0.1342
       ...                                ...                  ...
        20                          0.0962352               2.6187
      -------------------------------------------------------------
                  HL-Gap            0.0026605 Eh            0.0724 eV
             Fermi-level           -0.4301436 Eh          -11.7048 eV

 SCC (total)                   0 d,  0 h,  0 min,  0.005 sec
 SCC setup                      ...        0 min,  0.000 sec (  2.512%)
 Dispersion                     ...        0 min,  0.000 sec (  0.317%)
 integral evaluation            ...        0 min,  0.001 sec ( 25.666%)
 zeroth order Hamiltonian       ...        0 min,  0.000 sec (  0.389%)
 iterations                     ...        0 min,  0.002 sec ( 43.086%)
 molecular gradient             ...        0 min,  0.001 sec ( 26.526%)
 printout                       ...        0 min,  0.000 sec (  1.330%)

         :::::::::::::::::::::::::::::::::::::::::::::::::::::
         ::                     SUMMARY                     ::
         :::::::::::::::::::::::::::::::::::::::::::::::::::::
         :: total energy             -10.853896110981 Eh    ::
         :: gradient norm              0.339046862239 Eh/a0 ::
         :: HOMO-LUMO gap              0.072396299803 eV    ::
         ::.................................................::
         :: SCC energy               -10.905485693839 Eh    ::
         :: -> isotropic ES           -0.029773189863 Eh    ::
         :: -> anisotropic ES         -0.000644579009 Eh    ::
         :: -> anisotropic XC          0.011711696863 Eh    ::
         :: -> dispersion             -0.002855510983 Eh    ::
         :: repulsion energy           0.051589682690 Eh    ::
         :: add. restraining           0.000000000000 Eh    ::
         :::::::::::::::::::::::::::::::::::::::::::::::::::::

      ----------------------------------------------------------- 
     |                   =====================                   |
     |                        A N C O P T                        |
     |                   =====================                   |
     |               Approximate Normal Coordinate               |
     |                Rational Function Optimizer                |
      ----------------------------------------------------------- 

          ...................................................
          :                      SETUP                      :
          :.................................................:
          :   optimization level            normal          :
          :   max. optcycles                   200          :
          :   ANC micro-cycles                  20          :
          :   degrees of freedom                 9          :
          :.................................................:
          :   RF solver                   davidson          :
          :   write xtbopt.log                true          :
          :   linear?                        false          :
          :   energy convergence         0.5000000E-05 Eh   :
          :   grad. convergence          0.1000000E-02 Eh/α :
          :   maximium RF displ.         1.0000000          :
          :   Hlow (freq-cutoff)         0.1000000E-01      :
          :   Hmax (freq-cutoff)         5.0000000          :
          :   S6 in model hess.         20.0000000          :
          ...................................................

generating ANC from model Hessian ...
Using Lindh-Hessian (1995)
 Shifting diagonal of input Hessian by    5.3139788804040886E-003
 Lowest  eigenvalues of input Hessian
   -0.000000   -0.000000   -0.000000   -0.000000    0.000000    0.000000
    0.010000    0.012662    0.054471    0.072453    0.123541    0.689422
    0.888680    0.980168    1.172643
 Highest eigenvalues
    0.072453    0.123541    0.689422    0.888680    0.980168    1.172643


........................................................................
.............................. CYCLE    1 ..............................
........................................................................
   1    -10.9054857 -0.109055E+02  0.151E-04    0.07       0.0  T
   2    -10.9054857  0.157804E-09  0.154E-04    0.07     291.2  T
   3    -10.9054857  0.214031E-09  0.281E-04    0.07     159.0  T
     SCC iter.                  ...        0 min,  0.001 sec
     gradient                   ...        0 min,  0.002 sec
 * total energy  :   -10.8538961 Eh     change        0.2238664E-08 Eh
   gradient norm :     0.3390470 Eh/α   predicted     0.0000000E+00 (-100.00%)
   displ. norm   :     0.3927746 α      lambda       -0.1291105E+00
   maximum displ.:     0.3260984 α      in ANC's #6, #8, #7, ...

........................................................................
.............................. CYCLE    2 ..............................
........................................................................
   1    -11.0606335 -0.110606E+02  0.274E+00    0.79       0.0  T
   2    -10.9214643  0.139169E+00  0.480E+00    0.45       1.0  T
   3    -11.0667170 -0.145253E+00  0.196E+00    0.72       1.0  T
   4    -11.0117428  0.549742E-01  0.304E+00    0.54       1.0  T
   5    -11.0688284 -0.570856E-01  0.145E+00    0.77       1.0  T
   6    -11.0812636 -0.124351E-01  0.670E-01    0.66       1.0  T
   7    -11.0836058 -0.234226E-02  0.330E-01    0.71       1.0  T
   8    -11.0844117 -0.805907E-03  0.209E-01    0.69       1.0  T
   9    -11.0844904 -0.786278E-04  0.157E-01    0.69       1.0  T
  10    -11.0845470 -0.566464E-04  0.110E-01    0.69       1.0  T
  11    -11.0846427 -0.956860E-04  0.145E-02    0.70       3.1  T
  12    -11.0846425  0.201266E-06  0.119E-02    0.70       3.8  T
  13    -11.0846434 -0.862753E-06  0.250E-03    0.70      17.9  T
  14    -11.0846434 -0.110398E-07  0.308E-04    0.70     145.0  T
  15    -11.0846434 -0.186262E-09  0.857E-05    0.70     521.9  T
     SCC iter.                  ...        0 min,  0.002 sec
     gradient                   ...        0 min,  0.001 sec
 * total energy  :   -10.9688723 Eh     change       -0.1149762E+00 Eh
   gradient norm :     0.2529950 Eh/α   predicted    -0.7451432E-01 ( -35.19%)
   displ. norm   :     0.6845403 α      lambda       -0.1675711E+00
   maximum displ.:     0.5319446 α      in ANC's #6, #8, #4, ...

........................................................................
.............................. CYCLE    3 ..............................
........................................................................
   1    -11.3668665 -0.113669E+02  0.473E+00    3.25       0.0  T
   2    -10.9591029  0.407764E+00  0.656E+00    3.48       1.0  T
   3    -11.3038246 -0.344722E+00  0.359E+00    2.75       1.0  T
   4    -11.3691975 -0.653729E-01  0.222E+00    3.10       1.0  T
   5    -11.3861498 -0.169522E-01  0.138E+00    3.21       1.0  T
   6    -11.3881166 -0.196682E-02  0.118E+00    3.20       1.0  T
   7    -11.3911903 -0.307369E-02  0.809E-01    3.24       1.0  T
   8    -11.3953305 -0.414018E-02  0.274E-01    3.29       1.0  T
   9    -11.3950580  0.272465E-03  0.334E-01    3.29       1.0  T
  10    -11.3949893  0.686813E-04  0.336E-01    3.29       1.0  T
  11    -11.3957781 -0.788756E-03  0.137E-02    3.32       3.3  T
  12    -11.3957795 -0.141517E-05  0.485E-03    3.32       9.2  T
  13    -11.3957796 -0.616657E-07  0.138E-03    3.32      32.4  T
  14    -11.3957796  0.358781E-08  0.103E-03    3.32      43.3  T
  15    -11.3957796 -0.571212E-08  0.250E-04    3.32     179.2  T
  16    -11.3957796 -0.372816E-09  0.269E-05    3.32    1663.4  T
     SCC iter.                  ...        0 min,  0.002 sec
     gradient                   ...        0 min,  0.002 sec
 * total energy  :   -10.9992000 Eh     change       -0.3032775E-01 Eh
   gradient norm :     0.5326845 Eh/α   predicted    -0.1230471E+00 ( 305.72%)
   displ. norm   :     0.4335685 α      lambda       -0.1614045E+00
   maximum displ.:     0.3299660 α      in ANC's #4, #7, #3, ...

........................................................................
.............................. CYCLE    4 ..............................
........................................................................
   1    -11.2484685 -0.112485E+02  0.246E+00    2.66       0.0  T
   2    -10.9118726  0.336596E+00  0.560E+00    2.50       1.0  T
   3    -11.2659606 -0.354088E+00  0.157E+00    2.73       1.0  T
   4    -11.2807828 -0.148222E-01  0.810E-01    2.77       1.0  T
   5    -11.2784648  0.231797E-02  0.675E-01    2.72       1.0  T
   6    -11.2816053 -0.314049E-02  0.466E-01    2.76       1.0  T
   7    -11.2830847 -0.147940E-02  0.154E-01    2.77       1.0  T
   8    -11.2831254 -0.407030E-04  0.106E-01    2.76       1.0  T
   9    -11.2830584  0.670019E-04  0.125E-01    2.76       1.0  T
  10    -11.2831528 -0.943566E-04  0.376E-02    2.76       1.2  T
  11    -11.2831562 -0.345921E-05  0.228E-02    2.76       2.0  T
  12    -11.2831585 -0.228935E-05  0.123E-03    2.76      36.4  T
  13    -11.2831585 -0.653041E-08  0.803E-04    2.76      55.7  T
  14    -11.2831585 -0.214708E-09  0.760E-04    2.76      58.9  T
     SCC iter.                  ...        0 min,  0.001 sec
     gradient                   ...        0 min,  0.002 sec
 * total energy  :   -11.0577536 Eh     change       -0.5855360E-01 Eh
   gradient norm :     0.1188717 Eh/α   predicted    -0.9587280E-01 (  63.74%)
   displ. norm   :     0.6707407 α      lambda       -0.3219628E-01
   maximum displ.:     0.5553482 α      in ANC's #2, #4, #6, ...

........................................................................
.............................. CYCLE    5 ..............................
........................................................................
   1    -11.2641182 -0.112641E+02  0.249E+00    2.63       0.0  T
   2    -11.2490810  0.150372E-01  0.189E+00    2.53       1.0  T
   3    -11.0722874  0.176794E+00  0.389E+00    2.87       1.0  T
   4    -11.2074056 -0.135118E+00  0.223E+00    2.52       1.0  T
   5    -11.2674122 -0.600066E-01  0.605E-01    2.58       1.0  T
   6    -11.2683468 -0.934583E-03  0.362E-01    2.60       1.0  T
   7    -11.2681684  0.178417E-03  0.348E-01    2.60       1.0  T
   8    -11.2685040 -0.335588E-03  0.274E-01    2.60       1.0  T
   9    -11.2690067 -0.502748E-03  0.976E-02    2.62       1.0  T
  10    -11.2690644 -0.577241E-04  0.424E-02    2.62       1.1  T
  11    -11.2690734 -0.899457E-05  0.339E-03    2.62      13.2  T
  12    -11.2690735 -0.557827E-07  0.154E-03    2.62      29.0  T
  13    -11.2690735 -0.335454E-08  0.897E-04    2.62      49.8  T
  14    -11.2690735 -0.614744E-08  0.566E-05    2.62     790.1  T
     SCC iter.                  ...        0 min,  0.002 sec
     gradient                   ...        0 min,  0.001 sec
 * total energy  :   -11.0694809 Eh     change       -0.1172730E-01 Eh
   gradient norm :     0.1451137 Eh/α   predicted    -0.2334059E-01 (  99.03%)
   displ. norm   :     0.3908315 α      lambda       -0.2229484E-01
   maximum displ.:     0.3127631 α      in ANC's #1, #3, #6, ...

........................................................................
.............................. CYCLE    6 ..............................
........................................................................
   1    -11.3127446 -0.113127E+02  0.167E+00    3.38       0.0  T
   2    -11.3131422 -0.397561E-03  0.998E-01    3.35       1.0  T
   3    -11.3037244  0.941777E-02  0.110E+00    3.25       1.0  T
   4    -11.2227129  0.810115E-01  0.262E+00    3.40       1.0  T
   5    -11.3122299 -0.895170E-01  0.454E-01    3.34       1.0  T
   6    -11.3143341 -0.210421E-02  0.109E-01    3.32       1.0  T
   7    -11.3142959  0.382373E-04  0.100E-01    3.32       1.0  T
   8    -11.3142870  0.889527E-05  0.925E-02    3.32       1.0  T
   9    -11.3143711 -0.840488E-04  0.360E-02    3.32       1.2  T
  10    -11.3143777 -0.666967E-05  0.245E-02    3.32       1.8  T
  11    -11.3143824 -0.463922E-05  0.946E-03    3.32       4.7  T
  12    -11.3143831 -0.769730E-06  0.198E-03    3.32      22.5  T
  13    -11.3143832 -0.332952E-07  0.138E-04    3.32     324.3  T
  14    -11.3143832 -0.753886E-11  0.700E-05    3.32     638.9  T
     SCC iter.                  ...        0 min,  0.001 sec
     gradient                   ...        0 min,  0.001 sec
 * total energy  :   -11.0792977 Eh     change       -0.9816740E-02 Eh
   gradient norm :     0.1109783 Eh/α   predicted    -0.1285018E-01 (  30.90%)
   displ. norm   :     0.4733845 α      lambda       -0.2608178E-01
   maximum displ.:     0.3862178 α      in ANC's #2, #6, #3, ...

........................................................................
.............................. CYCLE    7 ..............................
........................................................................
   1    -11.3726697 -0.113727E+02  0.186E+00    3.46       0.0  T
   2    -11.1993925  0.173277E+00  0.397E+00    3.67       1.0  T
   3    -11.3744062 -0.175014E+00  0.110E+00    3.54       1.0  T
   4    -11.3691418  0.526442E-02  0.125E+00    3.48       1.0  T
   5    -11.3796854 -0.105436E-01  0.243E-01    3.52       1.0  T
   6    -11.3794515  0.233896E-03  0.224E-01    3.53       1.0  T
   7    -11.3797391 -0.287617E-03  0.135E-01    3.53       1.0  T
   8    -11.3798465 -0.107421E-03  0.758E-02    3.54       1.0  T
   9    -11.3798632 -0.166938E-04  0.587E-02    3.54       1.0  T
  10    -11.3798945 -0.312521E-04  0.903E-03    3.54       5.0  T
  11    -11.3798950 -0.581558E-06  0.464E-03    3.54       9.6  T
  12    -11.3798952 -0.158347E-06  0.946E-04    3.54      47.3  T
  13    -11.3798952 -0.615142E-08  0.302E-04    3.54     148.0  T
     SCC iter.                  ...        0 min,  0.002 sec
     gradient                   ...        0 min,  0.001 sec
 * total energy  :   -11.0614488 Eh     change        0.1784890E-01 Eh
   gradient norm :     0.2998612 Eh/α   predicted    -0.1596325E-01 (-189.44%)
   displ. norm   :     0.3255909 α      lambda       -0.5410003E-01
   maximum displ.:     0.2851795 α      in ANC's #2, #1, #5, ...

........................................................................
.............................. CYCLE    8 ..............................
........................................................................
   1    -11.3416222 -0.113416E+02  0.125E+00    3.37       0.0  T
   2    -11.3251795  0.164427E-01  0.143E+00    3.26       1.0  T
   3    -11.3216144  0.356510E-02  0.130E+00    3.36       1.0  T
   4    -11.3395235 -0.179091E-01  0.646E-01    3.31       1.0  T
   5    -11.3428866 -0.336310E-02  0.275E-01    3.30       1.0  T
   6    -11.3434226 -0.536046E-03  0.134E-01    3.31       1.0  T
   7    -11.3434875 -0.648143E-04  0.713E-02    3.31       1.0  T
   8    -11.3435375 -0.500993E-04  0.126E-02    3.32       3.5  T
   9    -11.3435377 -0.127134E-06  0.974E-03    3.32       4.6  T
  10    -11.3435385 -0.828309E-06  0.315E-03    3.32      14.2  T
  11    -11.3435386 -0.533044E-07  0.138E-03    3.32      32.5  T
  12    -11.3435386 -0.167495E-07  0.186E-04    3.32     240.1  T
  13    -11.3435386 -0.275334E-09  0.572E-05    3.32     782.3  T
     SCC iter.                  ...        0 min,  0.001 sec
     gradient                   ...        0 min,  0.001 sec
 * total energy  :   -11.0844293 Eh     change       -0.2298054E-01 Eh
   gradient norm :     0.0778198 Eh/α   predicted    -0.2991759E-01 (  30.19%)
   displ. norm   :     0.3726668 α      lambda       -0.1083383E-01
   maximum displ.:     0.2247285 α      in ANC's #3, #1, #2, ...

........................................................................
.............................. CYCLE    9 ..............................
........................................................................
   1    -11.3450472 -0.113450E+02  0.159E+00    3.78       0.0  T
   2    -11.3382808  0.676639E-02  0.122E+00    3.57       1.0  T
   3    -11.2118741  0.126407E+00  0.328E+00    3.83       1.0  T
   4    -11.3287833 -0.116909E+00  0.130E+00    3.70       1.0  T
   5    -11.3468651 -0.180817E-01  0.274E-01    3.66       1.0  T
   6    -11.3466584  0.206640E-03  0.245E-01    3.65       1.0  T
   7    -11.3465605  0.979115E-04  0.242E-01    3.66       1.0  T
   8    -11.3469326 -0.372091E-03  0.141E-01    3.66       1.0  T
   9    -11.3470314 -0.987869E-04  0.936E-02    3.66       1.0  T
  10    -11.3470986 -0.672556E-04  0.326E-02    3.67       1.4  T
  11    -11.3471072 -0.852097E-05  0.328E-03    3.67      13.6  T
  12    -11.3471072 -0.878695E-07  0.111E-03    3.67      40.2  T
  13    -11.3471073 -0.109687E-07  0.111E-04    3.67     402.3  T
  14    -11.3471073 -0.100504E-09  0.763E-06    3.67    5864.2  T
     SCC iter.                  ...        0 min,  0.002 sec
     gradient                   ...        0 min,  0.001 sec
 * total energy  :   -11.0827233 Eh     change        0.1706014E-02 Eh
   gradient norm :     0.1197049 Eh/α   predicted    -0.6169210E-02 (-461.62%)
   displ. norm   :     0.2599868 α      lambda       -0.1004307E-01
   maximum displ.:     0.1799346 α      in ANC's #1, #3, #6, ...

........................................................................
.............................. CYCLE   10 ..............................
........................................................................
   1    -11.3489180 -0.113489E+02  0.103E+00    3.39       0.0  T
   2    -11.3446000  0.431798E-02  0.817E-01    3.49       1.0  T
   3    -11.3232036  0.213964E-01  0.142E+00    3.32       1.0  T
   4    -11.3481541 -0.249505E-01  0.408E-01    3.39       1.0  T
   5    -11.3486768 -0.522745E-03  0.270E-01    3.43       1.0  T
   6    -11.3493760 -0.699189E-03  0.109E-01    3.43       1.0  T
   7    -11.3494107 -0.346768E-04  0.596E-02    3.44       1.0  T
   8    -11.3494387 -0.280108E-04  0.146E-02    3.44       3.1  T
   9    -11.3494402 -0.149297E-05  0.100E-02    3.44       4.5  T
  10    -11.3494409 -0.649345E-06  0.786E-04    3.44      56.9  T
  11    -11.3494409 -0.183660E-08  0.594E-04    3.44      75.3  T
     SCC iter.                  ...        0 min,  0.001 sec
     gradient                   ...        0 min,  0.001 sec
 * total energy  :   -11.0888352 Eh     change       -0.6111886E-02 Eh
   gradient norm :     0.0543959 Eh/α   predicted    -0.5360953E-02 ( -12.29%)
   displ. norm   :     0.1236475 α      lambda       -0.3633370E-02
   maximum displ.:     0.0694447 α      in ANC's #5, #6, #4, ...

........................................................................
.............................. CYCLE   11 ..............................
........................................................................
   1    -11.3478138 -0.113478E+02  0.675E-01    3.35       0.0  T
   2    -11.3401930  0.762077E-02  0.870E-01    3.43       1.0  T
   3    -11.3424531 -0.226013E-02  0.720E-01    3.36       1.0  T
   4    -11.3473183 -0.486516E-02  0.415E-01    3.36       1.0  T
   5    -11.3487242 -0.140591E-02  0.958E-02    3.38       1.0  T
   6    -11.3487693 -0.451025E-04  0.515E-02    3.38       1.0  T
   7    -11.3487710 -0.174799E-05  0.379E-02    3.38       1.2  T
   8    -11.3487716 -0.524167E-06  0.422E-03    3.38      10.6  T
   9    -11.3487716 -0.549751E-07  0.936E-04    3.38      47.8  T
  10    -11.3487716 -0.956087E-08  0.333E-04    3.38     134.3  T
     SCC iter.                  ...        0 min,  0.001 sec
     gradient                   ...        0 min,  0.001 sec
 * total energy  :   -11.0888647 Eh     change       -0.2956786E-04 Eh
   gradient norm :     0.0686238 Eh/α   predicted    -0.1844458E-02 (6138.05%)
   displ. norm   :     0.2091511 α      lambda       -0.4065247E-02
   maximum displ.:     0.1740666 α      in ANC's #1, #5, #2, ...

........................................................................
.............................. CYCLE   12 ..............................
........................................................................
   1    -11.3501675 -0.113502E+02  0.762E-01    3.33       0.0  T
   2    -11.3500455  0.122006E-03  0.458E-01    3.31       1.0  T
   3    -11.3477084  0.233709E-02  0.548E-01    3.37       1.0  T
   4    -11.3467752  0.933251E-03  0.490E-01    3.30       1.0  T
   5    -11.3503652 -0.359002E-02  0.100E-01    3.32       1.0  T
   6    -11.3504354 -0.701818E-04  0.221E-02    3.32       2.0  T
   7    -11.3504363 -0.866690E-06  0.149E-02    3.33       3.0  T
   8    -11.3504361  0.166909E-06  0.536E-03    3.33       8.3  T
   9    -11.3504364 -0.259211E-06  0.172E-03    3.33      26.0  T
  10    -11.3504364 -0.141552E-07  0.113E-04    3.33     394.8  T
  11    -11.3504364 -0.355129E-10  0.648E-05    3.33     690.1  T
     SCC iter.                  ...        0 min,  0.001 sec
     gradient                   ...        0 min,  0.001 sec
 * total energy  :   -11.0911019 Eh     change       -0.2237134E-02 Eh
   gradient norm :     0.0414274 Eh/α   predicted    -0.2121542E-02 (  -5.17%)
   displ. norm   :     0.2374486 α      lambda       -0.3093594E-02
   maximum displ.:     0.1661527 α      in ANC's #4, #2, #9, ...

........................................................................
.............................. CYCLE   13 ..............................
........................................................................
   1    -11.3820334 -0.113820E+02  0.101E+00    3.62       0.0  T
   2    -11.3813728  0.660515E-03  0.655E-01    3.58       1.0  T
   3    -11.3320913  0.492816E-01  0.194E+00    3.64       1.0  T
   4    -11.3789999 -0.469087E-01  0.565E-01    3.53       1.0  T
   5    -11.3823951 -0.339520E-02  0.128E-01    3.59       1.0  T
   6    -11.3824456 -0.504983E-04  0.799E-02    3.57       1.0  T
   7    -11.3824503 -0.463528E-05  0.707E-02    3.57       1.0  T
   8    -11.3824953 -0.450001E-04  0.178E-02    3.58       2.5  T
   9    -11.3824963 -0.104522E-05  0.123E-02    3.58       3.6  T
  10    -11.3824976 -0.126246E-05  0.231E-03    3.58      19.4  T
  11    -11.3824976 -0.198179E-07  0.138E-03    3.58      32.5  T
  12    -11.3824976 -0.139313E-07  0.430E-05    3.58    1039.3  T
  13    -11.3824976 -0.914824E-12  0.109E-05    3.58    4094.2  T
     SCC iter.                  ...        0 min,  0.001 sec
     gradient                   ...        0 min,  0.002 sec
 * total energy  :   -11.0906263 Eh     change        0.4755534E-03 Eh
   gradient norm :     0.0718147 Eh/α   predicted    -0.1634009E-02 (-443.60%)
   displ. norm   :     0.1839186 α      lambda       -0.4165766E-02
   maximum displ.:     0.1317455 α      in ANC's #1, #3, #6, ...

........................................................................
.............................. CYCLE   14 ..............................
........................................................................
   1    -11.3594612 -0.113595E+02  0.574E-01    3.44       0.0  T
   2    -11.3588332  0.627949E-03  0.417E-01    3.46       1.0  T
   3    -11.3532356  0.559760E-02  0.706E-01    3.42       1.0  T
   4    -11.3587235 -0.548787E-02  0.296E-01    3.48       1.0  T
   5    -11.3593756 -0.652078E-03  0.148E-01    3.44       1.0  T
   6    -11.3596463 -0.270717E-03  0.363E-02    3.45       1.2  T
   7    -11.3596500 -0.367421E-05  0.176E-02    3.46       2.5  T
   8    -11.3596506 -0.589290E-06  0.264E-03    3.46      16.9  T
   9    -11.3596505  0.478633E-08  0.239E-03    3.46      18.7  T
  10    -11.3596506 -0.282055E-07  0.193E-04    3.46     231.4  T
  11    -11.3596506 -0.136732E-09  0.907E-05    3.46     493.1  T
     SCC iter.                  ...        0 min,  0.001 sec
     gradient                   ...        0 min,  0.001 sec
 * total energy  :   -11.0932400 Eh     change       -0.2613643E-02 Eh
   gradient norm :     0.0313406 Eh/α   predicted    -0.2153342E-02 ( -17.61%)
   displ. norm   :     0.2393464 α      lambda       -0.2441257E-02
   maximum displ.:     0.2126477 α      in ANC's #1, #4, #9, ...

........................................................................
.............................. CYCLE   15 ..............................
........................................................................
   1    -11.3534755 -0.113535E+02  0.889E-01    3.27       0.0  T
   2    -11.3484822  0.499330E-02  0.800E-01    3.35       1.0  T
   3    -11.3371343  0.113478E-01  0.116E+00    3.25       1.0  T
   4    -11.3528510 -0.157167E-01  0.337E-01    3.28       1.0  T
   5    -11.3536281 -0.777096E-03  0.186E-01    3.31       1.0  T
   6    -11.3539102 -0.282065E-03  0.902E-02    3.31       1.0  T
   7    -11.3539223 -0.120465E-04  0.490E-02    3.31       1.0  T
   8    -11.3539264 -0.411653E-05  0.160E-02    3.31       2.8  T
   9    -11.3539292 -0.280324E-05  0.886E-03    3.31       5.0  T
  10    -11.3539296 -0.436774E-06  0.454E-04    3.31      98.6  T
  11    -11.3539296 -0.114088E-08  0.311E-04    3.31     143.7  T
     SCC iter.                  ...        0 min,  0.001 sec
     gradient                   ...        0 min,  0.001 sec
 * total energy  :   -11.0938701 Eh     change       -0.6301146E-03 Eh
   gradient norm :     0.0443409 Eh/α   predicted    -0.1290551E-02 ( 104.81%)
   displ. norm   :     0.1242415 α      lambda       -0.1522546E-02
   maximum displ.:     0.1041264 α      in ANC's #2, #4, #6, ...

........................................................................
.............................. CYCLE   16 ..............................
........................................................................
   1    -11.3546882 -0.113547E+02  0.469E-01    3.40       0.0  T
   2    -11.3543018  0.386410E-03  0.323E-01    3.36       1.0  T
   3    -11.3369475  0.173543E-01  0.110E+00    3.43       1.0  T
   4    -11.3546933 -0.177458E-01  0.950E-02    3.38       1.0  T
   5    -11.3547296 -0.363535E-04  0.653E-02    3.37       1.0  T
   6    -11.3547564 -0.267608E-04  0.286E-02    3.37       1.6  T
   7    -11.3547580 -0.161408E-05  0.229E-02    3.38       2.0  T
   8    -11.3547634 -0.537404E-05  0.501E-03    3.38       8.9  T
   9    -11.3547634 -0.435875E-07  0.352E-03    3.38      12.7  T
  10    -11.3547635 -0.104507E-06  0.803E-04    3.38      55.7  T
  11    -11.3547635 -0.266387E-08  0.468E-04    3.38      95.5  T
     SCC iter.                  ...        0 min,  0.001 sec
     gradient                   ...        0 min,  0.001 sec
 * total energy  :   -11.0947948 Eh     change       -0.9247499E-03 Eh
   gradient norm :     0.0219412 Eh/α   predicted    -0.7730257E-03 ( -16.41%)
   displ. norm   :     0.0986291 α      lambda       -0.8190570E-03
   maximum displ.:     0.0812066 α      in ANC's #4, #2, #9, ...

........................................................................
.............................. CYCLE   17 ..............................
........................................................................
   1    -11.3649816 -0.113650E+02  0.369E-01    3.48       0.0  T
   2    -11.3648089  0.172675E-03  0.253E-01    3.49       1.0  T
   3    -11.3625240  0.228494E-02  0.439E-01    3.45       1.0  T
   4    -11.3642361 -0.171215E-02  0.250E-01    3.48       1.0  T
   5    -11.3650346 -0.798518E-03  0.310E-02    3.48       1.4  T
   6    -11.3650411 -0.641009E-05  0.124E-02    3.48       3.6  T
   7    -11.3650415 -0.464891E-06  0.636E-03    3.48       7.0  T
   8    -11.3650415 -0.547711E-08  0.895E-04    3.48      49.9  T
   9    -11.3650415  0.125672E-08  0.769E-04    3.48      58.1  T
     SCC iter.                  ...        0 min,  0.001 sec
     gradient                   ...        0 min,  0.001 sec
 * total energy  :   -11.0951391 Eh     change       -0.3442476E-03 Eh
   gradient norm :     0.0166070 Eh/α   predicted    -0.4135110E-03 (  20.12%)
   displ. norm   :     0.2738730 α      lambda       -0.1025968E-02
   maximum displ.:     0.1622025 α      in ANC's #1, #2, #4, ...

........................................................................
.............................. CYCLE   18 ..............................
........................................................................
   1    -11.3567481 -0.113567E+02  0.874E-01    3.37       0.0  T
   2    -11.3567192  0.288606E-04  0.507E-01    3.38       1.0  T
   3    -11.3446905  0.120287E-01  0.904E-01    3.41       1.0  T
   4    -11.3566947 -0.120042E-01  0.997E-02    3.37       1.0  T
   5    -11.3567924 -0.977116E-04  0.400E-02    3.38       1.1  T
   6    -11.3568019 -0.942924E-05  0.220E-02    3.38       2.0  T
   7    -11.3568035 -0.164736E-05  0.129E-02    3.38       3.5  T
   8    -11.3568038 -0.316573E-06  0.769E-03    3.38       5.8  T
   9    -11.3568045 -0.692442E-06  0.270E-03    3.38      16.6  T
  10    -11.3568046 -0.514135E-07  0.494E-04    3.38      90.5  T
  11    -11.3568046 -0.890568E-09  0.304E-04    3.38     147.1  T
     SCC iter.                  ...        0 min,  0.001 sec
     gradient                   ...        0 min,  0.001 sec
 * total energy  :   -11.0955677 Eh     change       -0.4286634E-03 Eh
   gradient norm :     0.0194519 Eh/α   predicted    -0.5514608E-03 (  28.65%)
   displ. norm   :     0.0529604 α      lambda       -0.3666491E-03
   maximum displ.:     0.0367061 α      in ANC's #2, #3, #1, ...

........................................................................
.............................. CYCLE   19 ..............................
........................................................................
   1    -11.3660955 -0.113661E+02  0.155E-01    3.42       0.0  T
   2    -11.3660612  0.343118E-04  0.118E-01    3.43       1.0  T
   3    -11.3660156  0.455531E-04  0.109E-01    3.42       1.0  T
   4    -11.3656037  0.411875E-03  0.188E-01    3.43       1.0  T
   5    -11.3661244 -0.520698E-03  0.159E-02    3.42       2.8  T
   6    -11.3661260 -0.152599E-05  0.440E-03    3.42      10.2  T
   7    -11.3661261 -0.158644E-06  0.188E-03    3.42      23.8  T
   8    -11.3661261 -0.652284E-08  0.357E-04    3.42     125.2  T
   9    -11.3661261 -0.748379E-10  0.207E-04    3.42     215.6  T
     SCC iter.                  ...        0 min,  0.001 sec
     gradient                   ...        0 min,  0.001 sec
 * total energy  :   -11.0957350 Eh     change       -0.1673031E-03 Eh
   gradient norm :     0.0113190 Eh/α   predicted    -0.1838388E-03 (   9.88%)
   displ. norm   :     0.0642102 α      lambda       -0.1773277E-03
   maximum displ.:     0.0447024 α      in ANC's #1, #4, #6, ...

........................................................................
.............................. CYCLE   20 ..............................
........................................................................
   1    -11.3662382 -0.113662E+02  0.210E-01    3.43       0.0  T
   2    -11.3661885  0.497199E-04  0.137E-01    3.43       1.0  T
   3    -11.3642765  0.191193E-02  0.367E-01    3.41       1.0  T
   4    -11.3662347 -0.195817E-02  0.343E-02    3.43       1.3  T
   5    -11.3662449 -0.102022E-04  0.139E-02    3.43       3.2  T
   6    -11.3662463 -0.137516E-05  0.632E-03    3.43       7.1  T
   7    -11.3662463  0.134096E-07  0.362E-03    3.43      12.4  T
   8    -11.3662463 -0.524756E-07  0.710E-04    3.43      63.0  T
   9    -11.3662463  0.136433E-09  0.445E-04    3.43     100.4  T
     SCC iter.                  ...        0 min,  0.001 sec
     gradient                   ...        0 min,  0.001 sec
 * total energy  :   -11.0958554 Eh     change       -0.1203795E-03 Eh
   gradient norm :     0.0082902 Eh/α   predicted    -0.8903099E-04 ( -26.04%)
   displ. norm   :     0.1104474 α      lambda       -0.1661096E-03
   maximum displ.:     0.0762286 α      in ANC's #1, #4, #6, ...
 * RMSD in coord.:     1.2057659 α      energy gain  -0.2419593E+00 Eh

generating ANC from model Hessian ...
Using Lindh-Hessian (1995)
 Shifting diagonal of input Hessian by    8.3524621973710099E-003
 Lowest  eigenvalues of input Hessian
   -0.000000   -0.000000   -0.000000   -0.000000    0.000000    0.000000
    0.010000    0.012745    0.224804    0.333521    0.643688    1.021376
    1.240104    2.295062    3.052057
 Highest eigenvalues
    0.333521    0.643688    1.021376    1.240104    2.295062    3.052057


........................................................................
.............................. CYCLE   21 ..............................
........................................................................
   1    -11.3653900 -0.113654E+02  0.355E-01    3.43       0.0  T
   2    -11.3653943 -0.425420E-05  0.205E-01    3.42       1.0  T
   3    -11.3653060  0.883352E-04  0.875E-02    3.43       1.0  T
   4    -11.3653577 -0.517700E-04  0.530E-02    3.42       1.0  T
   5    -11.3653979 -0.401527E-04  0.107E-02    3.43       4.2  T
   6    -11.3653979  0.249345E-07  0.612E-03    3.43       7.3  T
   7    -11.3653982 -0.392754E-06  0.919E-04    3.43      48.6  T
   8    -11.3653983 -0.410550E-08  0.252E-04    3.43     177.8  T
     SCC iter.                  ...        0 min,  0.001 sec
     gradient                   ...        0 min,  0.001 sec
 * total energy  :   -11.0959666 Eh     change       -0.1111872E-03 Eh
   gradient norm :     0.0082511 Eh/α   predicted     0.0000000E+00 (-100.00%)
   displ. norm   :     0.0599262 α      lambda       -0.8885776E-04
   maximum displ.:     0.0515535 α      in ANC's #1, #2, #4, ...

........................................................................
.............................. CYCLE   22 ..............................
........................................................................
   1    -11.3671179 -0.113671E+02  0.208E-01    3.45       0.0  T
   2    -11.3671155  0.240351E-05  0.123E-01    3.44       1.0  T
   3    -11.3666449  0.470639E-03  0.189E-01    3.45       1.0  T
   4    -11.3669977 -0.352789E-03  0.991E-02    3.44       1.0  T
   5    -11.3671210 -0.123307E-03  0.214E-02    3.45       2.1  T
   6    -11.3671260 -0.496575E-05  0.654E-03    3.44       6.8  T
   7    -11.3671262 -0.257808E-06  0.235E-03    3.44      19.1  T
   8    -11.3671263 -0.351067E-07  0.299E-04    3.44     149.4  T
   9    -11.3671263 -0.963940E-10  0.191E-04    3.44     233.6  T
     SCC iter.                  ...        0 min,  0.001 sec
     gradient                   ...        0 min,  0.002 sec
 * total energy  :   -11.0959999 Eh     change       -0.3325599E-04 Eh
   gradient norm :     0.0026906 Eh/α   predicted    -0.4458883E-04 (  34.08%)
   displ. norm   :     0.0289396 α      lambda       -0.2815813E-04
   maximum displ.:     0.0277562 α      in ANC's #2, #1, #3, ...

........................................................................
.............................. CYCLE   23 ..............................
........................................................................
   1    -11.3681184 -0.113681E+02  0.112E-01    3.46       0.0  T
   2    -11.3681181  0.292647E-06  0.653E-02    3.46       1.0  T
   3    -11.3679904  0.127707E-03  0.958E-02    3.46       1.0  T
   4    -11.3680995 -0.109115E-03  0.403E-02    3.46       1.1  T
   5    -11.3681191 -0.196370E-04  0.106E-02    3.46       4.2  T
   6    -11.3681202 -0.107503E-05  0.318E-03    3.46      14.1  T
   7    -11.3681202 -0.465568E-07  0.100E-03    3.46      44.6  T
   8    -11.3681202 -0.102160E-07  0.177E-04    3.46     253.3  T
   9    -11.3681202  0.126477E-11  0.135E-04    3.46     331.3  T
     SCC iter.                  ...        0 min,  0.001 sec
     gradient                   ...        0 min,  0.001 sec
 * total energy  :   -11.0960030 Eh     change       -0.3099052E-05 Eh
   gradient norm :     0.0029829 Eh/α   predicted    -0.1409182E-04 ( 354.71%)
   displ. norm   :     0.0309185 α      lambda       -0.2539255E-04
   maximum displ.:     0.0265018 α      in ANC's #1, #2, #3, ...

........................................................................
.............................. CYCLE   24 ..............................
........................................................................
   1    -11.3681201 -0.113681E+02  0.104E-01    3.46       0.0  T
   2    -11.3681202 -0.793326E-07  0.632E-02    3.46       1.0  T
   3    -11.3681164  0.379666E-05  0.196E-02    3.46       2.3  T
   4    -11.3681178 -0.142462E-05  0.138E-02    3.46       3.3  T
   5    -11.3681200 -0.215414E-05  0.555E-03    3.46       8.1  T
   6    -11.3681203 -0.304369E-06  0.246E-03    3.46      18.2  T
   7    -11.3681203 -0.619135E-07  0.379E-04    3.46     117.8  T
   8    -11.3681203 -0.700664E-09  0.570E-05    3.46     784.4  T
     SCC iter.                  ...        0 min,  0.001 sec
     gradient                   ...        0 min,  0.001 sec
 * total energy  :   -11.0960108 Eh     change       -0.7852174E-05 Eh
   gradient norm :     0.0023701 Eh/α   predicted    -0.1270972E-04 (  61.86%)
   displ. norm   :     0.0202477 α      lambda       -0.1326896E-04
   maximum displ.:     0.0198066 α      in ANC's #1, #2, #4, ...

........................................................................
.............................. CYCLE   25 ..............................
........................................................................
   1    -11.3673158 -0.113673E+02  0.686E-02    3.45       0.0  T
   2    -11.3673157  0.409998E-07  0.407E-02    3.45       1.1  T
   3    -11.3672878  0.279688E-04  0.485E-02    3.45       1.0  T
   4    -11.3672979 -0.101587E-04  0.369E-02    3.45       1.2  T
   5    -11.3673154 -0.175193E-04  0.962E-03    3.45       4.6  T
   6    -11.3673166 -0.118869E-05  0.191E-03    3.45      23.4  T
   7    -11.3673166 -0.515936E-08  0.866E-04    3.45      51.7  T
   8    -11.3673166 -0.612236E-08  0.122E-04    3.45     365.2  T
     SCC iter.                  ...        0 min,  0.001 sec
     gradient                   ...        0 min,  0.002 sec
 * total energy  :   -11.0960184 Eh     change       -0.7578563E-05 Eh
   gradient norm :     0.0012749 Eh/α   predicted    -0.6635087E-05 ( -12.45%)
   displ. norm   :     0.0143715 α      lambda       -0.5837048E-05
   maximum displ.:     0.0119693 α      in ANC's #1, #3, #5, ...

........................................................................
.............................. CYCLE   26 ..............................
........................................................................
   1    -11.3673370 -0.113673E+02  0.478E-02    3.45       0.0  T
   2    -11.3673371 -0.154168E-07  0.281E-02    3.45       1.6  T
   3    -11.3673302  0.686579E-05  0.218E-02    3.45       2.0  T
   4    -11.3673370 -0.684508E-05  0.360E-03    3.45      12.4  T
   5    -11.3673371 -0.880957E-07  0.193E-03    3.45      23.1  T
   6    -11.3673371 -0.705976E-08  0.107E-03    3.45      41.6  T
   7    -11.3673371 -0.126050E-07  0.157E-04    3.45     285.5  T
   8    -11.3673371 -0.215499E-09  0.442E-05    3.45    1012.8  T
     SCC iter.                  ...        0 min,  0.001 sec
     gradient                   ...        0 min,  0.001 sec
 * total energy  :   -11.0960249 Eh     change       -0.6493089E-05 Eh
   gradient norm :     0.0009750 Eh/α   predicted    -0.2919212E-05 ( -55.04%)
   displ. norm   :     0.0161632 α      lambda       -0.6890028E-05
   maximum displ.:     0.0103400 α      in ANC's #3, #5, #2, ...

........................................................................
.............................. CYCLE   27 ..............................
........................................................................
   1    -11.3675056 -0.113675E+02  0.579E-02    3.45       0.0  T
   2    -11.3675056 -0.555524E-07  0.333E-02    3.45       1.3  T
   3    -11.3674989  0.669172E-05  0.220E-02    3.45       2.0  T
   4    -11.3675051 -0.621484E-05  0.695E-03    3.45       6.4  T
   5    -11.3675057 -0.589789E-06  0.181E-03    3.45      24.8  T
   6    -11.3675057 -0.505669E-08  0.749E-04    3.45      59.7  T
   7    -11.3675057 -0.503641E-08  0.589E-05    3.45     759.3  T
     SCC iter.                  ...        0 min,  0.001 sec
     gradient                   ...        0 min,  0.001 sec
 * total energy  :   -11.0960300 Eh     change       -0.5138857E-05 Eh
   gradient norm :     0.0005477 Eh/α   predicted    -0.3444823E-05 ( -32.97%)
   displ. norm   :     0.0014710 α      lambda       -0.3579598E-06
   maximum displ.:     0.0008702 α      in ANC's #6, #2, #1, ...

........................................................................
.............................. CYCLE   28 ..............................
........................................................................
   1    -11.3675745 -0.113676E+02  0.576E-03    3.45       0.0  T
   2    -11.3675745  0.122156E-07  0.375E-03    3.45      11.9  T
   3    -11.3675742  0.271079E-06  0.516E-03    3.45       8.7  T
   4    -11.3675740  0.150668E-06  0.549E-03    3.45       8.1  T
   5    -11.3675745 -0.443797E-06  0.642E-04    3.45      69.6  T
   6    -11.3675745 -0.336290E-08  0.174E-04    3.45     257.0  T
     SCC iter.                  ...        0 min,  0.001 sec
     gradient                   ...        0 min,  0.001 sec
 * total energy  :   -11.0960305 Eh     change       -0.4847762E-06 Eh
   gradient norm :     0.0004937 Eh/α   predicted    -0.1792486E-06 ( -63.02%)
   displ. norm   :     0.0105952 α      lambda       -0.2711791E-05
   maximum displ.:     0.0079082 α      in ANC's #6, #3, #2, ...

   *** GEOMETRY OPTIMIZATION CONVERGED AFTER 28 ITERATIONS ***

------------------------------------------------------------------------
 total energy gain   :        -0.2421344 Eh     -151.9416 kcal/mol
 total RMSD          :         1.2248701 a0        0.6482 Å
 total power (kW/mol):       -22.7044209 (step)-5955.9357 (real)
------------------------------------------------------------------------

 ANCopt (total)                0 d,  0 h,  0 min,  0.107 sec
 optimizer setup                ...        0 min,  0.000 sec (  0.050%)
 model hessian                  ...        0 min,  0.000 sec (  0.083%)
 ANC generation                 ...        0 min,  0.000 sec (  0.071%)
 coordinate transformation      ...        0 min,  0.000 sec (  0.050%)
 single point calculation       ...        0 min,  0.104 sec ( 97.648%)
 optimization log               ...        0 min,  0.001 sec (  0.699%)
 hessian update                 ...        0 min,  0.000 sec (  0.064%)
 rational function              ...        0 min,  0.001 sec (  0.627%)

================
 final structure:
================
5
 xtb: 6.2.2 (9d81278992624c895f80dd42a50cac0aa55982e2)
N         1.23510530414375    0.27281504562505   -0.11329591167065
C         0.03026835781194   -0.01373776638737   -0.02546075604421
C        -1.22872989643339   -0.26684444236224    0.12921403203775
C         2.39823550597275    0.53914021278760   -0.22577700940971
C        -2.43488027149504   -0.53137204966304    0.23531964508684

 Bond Distances (Angstroems)
 ---------------------------
N1-C2=1.2416         N1-C4=1.1985         C2-N1=1.2416         C2-C3=1.2935         C3-C2=1.2935         C3-C5=1.2394         
C4-N1=1.1985         C5-C3=1.2394         
 C  C  Rav=1.2664 sigma=0.0271  Rmin=1.2394  Rmax=1.2935     2
 N  C  Rav=1.2200 sigma=0.0215  Rmin=1.1985  Rmax=1.2416     2

 selected bond angles (degree)
 --------------------
C4-N1-C2=178.59                C3-C2-N1=176.55                C5-C3-C2=177.80                

 selected dihedral angles (degree)
 ---------------------------------
C3-C2-N1-C4=195.52            C5-C3-C2-N1=171.51            
           -------------------------------------------------
          |                Final Singlepoint                |
           -------------------------------------------------

          ...................................................
          :                      SETUP                      :
          :.................................................:
          :  # basis functions                  20          :
          :  # atomic orbitals                  20          :
          :  # shells                           10          :
          :  # electrons                        21          :
          :  max. iterations                   250          :
          :  Hamiltonian                  GFN2-xTB          :
          :  restarted?                      false          :
          :  GBSA solvation                  false          :
          :  PC potential                    false          :
          :  electronic temp.          300.0000000     K    :
          :  accuracy                    1.0000000          :
          :  -> integral cutoff          0.2500000E+02      :
          :  -> integral neglect         0.1000000E-07      :
          :  -> SCF convergence          0.1000000E-05 Eh   :
          :  -> wf. convergence          0.1000000E-03 e    :
          :  Broyden damping             0.4000000          :
          ...................................................

 iter      E             dE          RMSdq      gap      omega  full diag
   1    -11.3675745 -0.113676E+02  0.695E-05    3.45       0.0  T
   2    -11.3675745  0.505622E-10  0.641E-05    3.45     697.9  T
   3    -11.3675745  0.124368E-09  0.120E-04    3.45     372.8  T

   *** convergence criteria satisfied after 3 iterations ***

         #    Occupation            Energy/Eh            Energy/eV
      -------------------------------------------------------------
         1        2.0000           -0.6972724             -18.9737
       ...           ...                  ...                  ...
         6        2.0000           -0.5576953             -15.1757
         7        2.0000           -0.4808670             -13.0851
         8        2.0000           -0.4808326             -13.0841
         9        2.0000           -0.4566309             -12.4256
        10        1.0000           -0.4325665             -11.7707
        11        1.0000           -0.3676946             -10.0055
        12        1.0000           -0.3675823             -10.0024 (HOMO)
        13                         -0.2407564              -6.5513 (LUMO)
        14                         -0.2406453              -6.5483
        15                         -0.1094116              -2.9772
        16                         -0.1090170              -2.9665
        17                          0.0585093               1.5921
       ...                                ...                  ...
        20                          1.4334377              39.0058
      -------------------------------------------------------------
                  HL-Gap            0.1268259 Eh            3.4511 eV
             Fermi-level           -0.3743840 Eh          -10.1875 eV

 SCC (total)                   0 d,  0 h,  0 min,  0.003 sec
 SCC setup                      ...        0 min,  0.000 sec (  1.364%)
 Dispersion                     ...        0 min,  0.000 sec (  0.219%)
 integral evaluation            ...        0 min,  0.001 sec ( 34.544%)
 zeroth order Hamiltonian       ...        0 min,  0.000 sec (  0.394%)
 iterations                     ...        0 min,  0.000 sec ( 11.622%)
 molecular gradient             ...        0 min,  0.002 sec ( 50.150%)
 printout                       ...        0 min,  0.000 sec (  1.430%)

         :::::::::::::::::::::::::::::::::::::::::::::::::::::
         ::                     SUMMARY                     ::
         :::::::::::::::::::::::::::::::::::::::::::::::::::::
         :: total energy             -11.096030513631 Eh    ::
         :: gradient norm              0.000511456793 Eh/a0 ::
         :: HOMO-LUMO gap              3.451109530792 eV    ::
         ::.................................................::
         :: SCC energy               -11.367574483135 Eh    ::
         :: -> isotropic ES           -0.009813103365 Eh    ::
         :: -> anisotropic ES         -0.000241653094 Eh    ::
         :: -> anisotropic XC          0.019186643595 Eh    ::
         :: -> dispersion             -0.002675551747 Eh    ::
         :: repulsion energy           0.271545085400 Eh    ::
         :: add. restraining           0.000000000000 Eh    ::
         :::::::::::::::::::::::::::::::::::::::::::::::::::::

           ------------------------------------------------- 
          |                Numerical Hessian                |
           ------------------------------------------------- 
step length          :   0.00500
SCC accuracy         :   0.30000
Hessian scale factor :   1.00000
frozen atoms in %    :   0.00000    0
RMS gradient         :   0.00051
estimated CPU  time      0.00 min
estimated wall time      0.00 min

writing file <hessian>.

 projected vibrational frequencies (cm-1)
eigval :       -0.00    -0.00    -0.00    -0.00     0.00     0.00
eigval :       78.43   202.97   213.94   355.64   355.84   830.31
eigval :     1647.99  1888.68  1994.30
           -------------------------------------------------
          |                Property Printout                |
           -------------------------------------------------

    * Orbital Energies and Occupations

         #    Occupation            Energy/Eh            Energy/eV
      -------------------------------------------------------------
         1        2.0000           -0.6972724             -18.9737
         2        2.0000           -0.6704170             -18.2430
         3        2.0000           -0.6525186             -17.7559
         4        2.0000           -0.6042308             -16.4420
         5        2.0000           -0.5577077             -15.1760
         6        2.0000           -0.5576953             -15.1757
         7        2.0000           -0.4808670             -13.0851
         8        2.0000           -0.4808326             -13.0841
         9        2.0000           -0.4566308             -12.4256
        10        1.0000           -0.4325664             -11.7707
        11        1.0000           -0.3676946             -10.0055
        12        1.0000           -0.3675823             -10.0024 (HOMO)
        13                         -0.2407564              -6.5513 (LUMO)
        14                         -0.2406452              -6.5483
        15                         -0.1094116              -2.9772
        16                         -0.1090170              -2.9665
        17                          0.0585093               1.5921
        18                          0.4883428              13.2885
        19                          0.9904603              26.9518
        20                          1.4334377              39.0058
      -------------------------------------------------------------
                  HL-Gap            0.1268259 Eh            3.4511 eV
             Fermi-level           -0.3743840 Eh          -10.1875 eV

     #   Z        covCN         q      C6AA      α(0)
     1   7 N      1.822     0.098    20.175     6.655
     2   6 C      1.903     0.056    29.690     8.800
     3   6 C      1.962     0.021    30.529     8.923
     4   6 C      0.920    -0.134    39.807    10.564
     5   6 C      0.983    -0.041    37.194    10.245

 Mol. C6AA /au·bohr⁶  :        775.616779
 Mol. C8AA /au·bohr⁸  :      21529.055155
 Mol. α(0) /au        :         45.186780


Wiberg/Mayer (AO) data.
largest (>0.10) Wiberg bond orders for each atom
          total WBO             WBO to atom ...
     1  N   3.701        C    4 2.070    C    2 1.544
     2  C   3.193        C    3 1.582    N    1 1.544
     3  C   3.906        C    5 2.214    C    2 1.582
     4  C   2.283        N    1 2.070
     5  C   2.359        C    3 2.214

MOs/occ written to file <molden.input>


molecular dipole:
                 x           y           z       tot (Debye)
 q only:       -0.234      -0.057       0.020
   full:       -0.642      -0.148       0.060       1.681
molecular quadrupole (traceless):
                xx          xy          yy          xz          yz          zz
 q only:       -2.890      -1.000       1.353       0.424       0.095       1.537
  q+dip:       -1.733      -0.680       0.787       0.187       0.051       0.946
   full:       -5.401      -1.935       2.508       0.726       0.170       2.893

           -------------------------------------------------
          |                Geometry Summary                 |
           -------------------------------------------------

      molecular mass/u    :       62.0496468
   center of mass at/Å    :        0.0397298       0.0087757      -0.0036446
  moments of inertia/u·Å² :        0.1499538E-01   0.1901292E+03   0.1901428E+03
rotational constants/cm⁻¹ :        0.1124189E+04   0.8866410E-01   0.8865777E-01

 * 4 selected distances

     #   Z        #   Z                                     value/Å
     1   7 N      2   6 C                                 1.2415553
     2   6 C      3   6 C                                 1.2934697 (max)
     1   7 N      4   6 C                                 1.1985212 (min)
     3   6 C      5   6 C                                 1.2393676

 * 2 distinct bonds (by element types)

   Z      Z             #   av. dist./Å        max./Å        min./Å
   6 C    6 C           2     1.2664186     1.2934697     1.2393676
   6 C    7 N           2     1.2200382     1.2415553     1.1985212

           -------------------------------------------------
          |               Frequency Printout                |
           -------------------------------------------------
Molecule has the following symmetry elements: (Cinf) (sigma) 
It seems to be the Cinfv point group
 projected vibrational frequencies (cm-1)
eigval :       -0.00    -0.00    -0.00    -0.00     0.00     0.00
eigval :       78.43   202.97   213.94   355.64   355.84   830.31
eigval :     1647.99  1888.68  1994.30
 reduced masses (amu)
   1: 12.12   2: 12.41   3: 12.44   4: 12.18   5: 12.41   6: 12.35   7: 12.01   8: 12.40
   9: 12.46  10: 12.90  11: 12.88  12: 12.38  13: 12.10  14: 12.68  15: 12.43
 IR intensities (amu)
   1:  0.09   2:  0.04   3:  0.10   4:  0.07   5:  0.07   6:  0.09   7:  0.15   8:  0.26
   9:  0.23  10:  0.07  11:  0.07  12:  0.10  13:  1.38  14:  1.31  15:  0.36
 Raman intensities (amu)
   1:  0.00   2:  0.00   3:  0.00   4:  0.00   5:  0.00   6:  0.00   7:  0.00   8:  0.00
   9:  0.00  10:  0.00  11:  0.00  12:  0.00  13:  0.00  14:  0.00  15:  0.00
 output can be read by thermo (or use thermo option).
 writing <g98.out> molden fake output.
 recommended (thermochemical) frequency scaling factor: 1.0
           -------------------------------------------------
          |             Thermodynamic Functions             |
           -------------------------------------------------

cin symmetry found (for desy threshold:  0.10E+00) used in thermo

          ...................................................
          :                      SETUP                      :
          :.................................................:
          :  # frequencies                           9      :
          :  # imaginary freq.                       0      :
          :  linear?                             false      :
          :  only rotor calc.                    false      :
          :  symmetry                              cin      :
          :  rotational number                       1      :
          :  scaling factor                  1.0000000      :
          :  rotor cutoff                   50.0000000 cm⁻¹ :
          :  imag. cutoff                  -20.0000000 cm⁻¹ :
          :.................................................:

    mode    ω/cm⁻¹     T·S(HO)/kcal·mol⁻¹    T·S(FR)/kcal·mol⁻¹   T·S(vib)
   ------------------------------------------------------------------------
       1     78.43    -0.00000 ( 85.82%)     0.00279 ( 14.18%)     0.00039
       2    202.97    -0.00000 ( 99.63%)     0.01222 (  0.37%)     0.00004
       3    213.94    -0.00000 ( 99.70%)     0.01275 (  0.30%)     0.00004
   ------------------------------------------------------------------------

   temp. (K)  partition function   enthalpy   heat capacity  entropy
                                   cal/mol     cal/K/mol   cal/K/mol   J/K/mol
 298.15  VIB   12.0                 1666.898      9.423     10.404
         ROT  0.178E+04              888.752      2.981     17.853
         INT  0.213E+05             2555.650     12.404     28.256
         TR   0.473E+27             1481.254      4.968     38.278
         TOT                        4036.9040    17.3719    66.5343   278.3797

   temp. (K)  partition function   enthalpy   heat capacity  entropy
                                   cal/mol     cal/K/mol   cal/K/mol   J/K/mol
 120.00  VIB   2.00                  279.537      5.322      3.717
         ROT   454.                  357.707      2.981     15.140
         INT   910.                  637.243      8.303     18.857
         TR   0.121E+27              596.178      4.968     33.759
         TOT                        1233.4213    13.2711    52.6155   220.1434

   temp. (K)  partition function   enthalpy   heat capacity  entropy
                                   cal/mol     cal/K/mol   cal/K/mol   J/K/mol
 100.00  VIB   1.66                  182.122      4.395      2.853
         ROT   345.                  298.089      2.981     14.596
         INT   573.                  480.211      7.376     17.449
         TR   0.919E+26              496.815      4.968     32.853
         TOT                         977.0262    12.3445    50.3026   210.4662

   temp. (K)  partition function   enthalpy   heat capacity  entropy
                                   cal/mol     cal/K/mol   cal/K/mol   J/K/mol
  80.00  VIB   1.39                  104.588      3.340      2.016
         ROT   247.                  238.471      2.981     13.931
         INT   344.                  343.060      6.321     15.947
         TR   0.657E+26              397.452      4.968     31.745
         TOT                         740.5117    11.2895    47.6920   199.5435

   temp. (K)  partition function   enthalpy   heat capacity  entropy
                                   cal/mol     cal/K/mol   cal/K/mol   J/K/mol
  60.00  VIB   1.20                   48.889      2.230      1.245
         ROT   161.                  178.853      2.981     13.074
         INT   192.                  227.742      5.211     14.319
         TR   0.427E+26              298.089      4.968     30.317
         TOT                         525.8311    10.1793    44.6359   186.7566

   temp. (K)  partition function   enthalpy   heat capacity  entropy
                                   cal/mol     cal/K/mol   cal/K/mol   J/K/mol
  40.00  VIB   1.06                   14.874      1.192      0.585
         ROT   87.4                  119.236      2.981     11.865
         INT   93.0                  134.110      4.173     12.450
         TR   0.232E+26              198.726      4.968     28.303
         TOT                         332.8359     9.1408    40.7531   170.5110

   temp. (K)  partition function   enthalpy   heat capacity  entropy
                                   cal/mol     cal/K/mol   cal/K/mol   J/K/mol
  20.00  VIB   1.00                    0.798      0.226      0.094
         ROT   30.9                   59.618      2.981      9.799
         INT   31.0                   60.416      3.207      9.893
         TR   0.822E+25               99.363      4.968     24.861
         TOT                         159.7791     8.1752    34.7541   145.4110

   temp. (K)  partition function   enthalpy   heat capacity  entropy
                                   cal/mol     cal/K/mol   cal/K/mol   J/K/mol
  10.00  VIB   1.00                    0.003      0.003     -0.049
         ROT   10.9                   29.809      2.981      7.733
         INT   10.9                   29.812      2.984      7.684
         TR   0.290E+25               49.681      4.968     21.419
         TOT                          79.4932     7.9522    29.1031   121.7672

       T/K    H(0)-H(T)+PV         H(T)/Eh          T*S/Eh         G(T)/Eh
   ------------------------------------------------------------------------
    298.15    0.643322E-02    0.236746E-01    0.316126E-01   -0.793800E-02
    120.00    0.196558E-02    0.192070E-01    0.100618E-01    0.914519E-02
    100.00    0.155699E-02    0.187984E-01    0.801624E-02    0.107821E-01
     80.00    0.118008E-02    0.184215E-01    0.608017E-02    0.123413E-01
     60.00    0.837965E-03    0.180794E-01    0.426791E-02    0.138115E-01
     40.00    0.530408E-03    0.177718E-01    0.259777E-02    0.151740E-01
     20.00    0.254624E-03    0.174960E-01    0.110768E-02    0.163883E-01
     10.00    0.126681E-03    0.173681E-01    0.463787E-03    0.169043E-01 (used)
   ------------------------------------------------------------------------

         :::::::::::::::::::::::::::::::::::::::::::::::::::::
         ::                  THERMODYNAMIC                  ::
         :::::::::::::::::::::::::::::::::::::::::::::::::::::
         :: total free energy         -11.079126224404 Eh   ::
         ::.................................................::
         :: total energy              -11.096030513607 Eh   ::
         :: zero point energy           0.017241395390 Eh   ::
         :: G(RRHO) w/o ZPVE           -0.000337106187 Eh   ::
         :: G(RRHO) contrib.            0.016904289203 Eh   ::
         :::::::::::::::::::::::::::::::::::::::::::::::::::::

optimized geometry written to: xtbopt.xyz


           -------------------------------------------------
          | TOTAL ENERGY              -11.096030513607 Eh   |
          | TOTAL ENTHALPY            -11.078662437709 Eh   |
          | TOTAL FREE ENERGY         -11.079126224404 Eh   |
          | GRADIENT NORM               0.000511444240 Eh/α |
          | HOMO-LUMO GAP               3.451109325137 eV   |
           -------------------------------------------------

------------------------------------------------------------------------
 * finished run on 2020/05/12 at 11:44:00.130     
------------------------------------------------------------------------
 total:
 * wall-time:     0 d,  0 h,  0 min,  0.226 sec
 *  cpu-time:     0 d,  0 h,  0 min,  0.225 sec
 * ratio c/w:     0.997 speedup
 SCF:
 * wall-time:     0 d,  0 h,  0 min,  0.005 sec
 *  cpu-time:     0 d,  0 h,  0 min,  0.005 sec
 * ratio c/w:     1.000 speedup
 ANC optimizer:
 * wall-time:     0 d,  0 h,  0 min,  0.111 sec
 *  cpu-time:     0 d,  0 h,  0 min,  0.110 sec
 * ratio c/w:     0.997 speedup
 numerical hessian:
 * wall-time:     0 d,  0 h,  0 min,  0.096 sec
 *  cpu-time:     0 d,  0 h,  0 min,  0.095 sec
 * ratio c/w:     0.997 speedup

