      -----------------------------------------------------------      
     |                   =====================                   |     
     |                           x T B                           |     
     |                   =====================                   |     
     |                         S. Grimme                         |     
     |          Mulliken Center for Theoretical Chemistry        |     
     |                    University of Bonn                     |     
      -----------------------------------------------------------      

   * xtb version 6.2.2 (9d81278992624c895f80dd42a50cac0aa55982e2) compiled by '@Darwin' on 04/03/2020

   xtb is free software: you can redistribute it and/or modify it under
   the terms of the GNU Lesser General Public License as published by
   the Free Software Foundation, either version 3 of the License, or
   (at your option) any later version.
   
   xtb is distributed in the hope that it will be useful,
   but WITHOUT ANY WARRANTY; without even the implied warranty of
   MERCHANTABILITY or FITNESS FOR A PARTICULAR PURPOSE.  See the
   GNU Lesser General Public License for more details.
   
   Cite this work as:
   * S. Grimme, C. Bannwarth, P. Shushkov, J. Chem. Theory Comput., 2017,
     13, 1989-2009. DOI: 10.1021/acs.jctc.7b00118
   * C. Bannwarth, S. Ehlert and S. Grimme., J. Chem. Theory Comput., 2019,
     15, 1652-1671. DOI: 10.1021/acs.jctc.8b01176
   * P. Pracht, E. Caldeweyher, S. Ehlert, S. Grimme, ChemRxiv, 2019, preprint.
     DOI: 10.26434/chemrxiv.8326202.v1
   
   for DFT-D4:
   * E. Caldeweyher, C. Bannwarth and S. Grimme, J. Chem. Phys., 2017,
     147, 034112. DOI: 10.1063/1.4993215
   * E. Caldeweyher, S. Ehlert, A. Hansen, H. Neugebauer, S. Spicher,
     C. Bannwarth and S. Grimme, J. Chem. Phys., 2019, 150, 154122.
     DOI: 10.1063/1.5090222
   
   for sTDA-xTB:
   * S. Grimme and C. Bannwarth, J. Chem. Phys., 2016, 145, 054103.
     DOI: 10.1063/1.4959605
   
   in the mass-spec context:
   * V. Asgeirsson, C. Bauer and S. Grimme, Chem. Sci., 2017, 8, 4879.
     DOI: 10.1039/c7sc00601b
   
   for metadynamics refer to:
   * S. Grimme, J. Chem. Theory Comput., 2019, 155, 2847-2862
     DOI: 10.1021/acs.jctc.9b00143
   
   with help from (in alphabetical order)
   C. Bannwarth, F. Bohle, G. Brandenburg, E. Caldeweyher, M. Checinski,
   S. Dohm, S. Ehlert, S. Ehrlich, F. März, H. Neugebauer, J. Pisarek,
   P. Pracht, P. Shushkov, and S. Spicher.
   
 * started run on 2020/05/12 at 11:44:46.558     

           -------------------------------------------------
          |                Calculation Setup                |
           -------------------------------------------------

          program call               : xtb --input H2C2N1_5_S_3.input H2C2N1_5_S_3.xyz --ohess --molden --namespace H2C2N1_5_S_3 output.out
          calculation namespace      : H2C2N1_5_S_3
          coordinate file            : H2C2N1_5_S_3.xyz
          number of atoms            :                     5
          number of electrons        :                    15
          charge                     :                     0
          spin                       :                   1.5
          first test random number   :      0.44782723550956

   ID    Z sym.   atoms
    1    6 C      1, 3
    2    7 N      2
    3    1 H      4, 5

           -------------------------------------------------
          |                 G F N 2 - x T B                 |
           -------------------------------------------------

        Reference                      10.1021/acs.jctc.8b01176
      * Hamiltonian:
        H0-scaling (s, p, d)           1.850000    2.230000    2.230000
        zeta-weighting                 0.500000
      * Dispersion:
        s8                             2.700000
        a1                             0.520000
        a2                             5.000000
        s9                             5.000000
      * Repulsion:
        kExp                           1.500000    1.000000
        rExp                           1.000000
      * Coulomb:
        alpha                          2.000000
        third order                    shell-resolved
        anisotropic                    true
        a3                             3.000000
        a5                             4.000000
        cn-shift                       1.200000
        cn-exp                         4.000000
        max-rad                        5.000000


          ...................................................
          :                      SETUP                      :
          :.................................................:
          :  # basis functions                  14          :
          :  # atomic orbitals                  14          :
          :  # shells                            8          :
          :  # electrons                        15          :
          :  max. iterations                   250          :
          :  Hamiltonian                  GFN2-xTB          :
          :  restarted?                      false          :
          :  GBSA solvation                  false          :
          :  PC potential                    false          :
          :  electronic temp.          300.0000000     K    :
          :  accuracy                    1.0000000          :
          :  -> integral cutoff          0.2500000E+02      :
          :  -> integral neglect         0.1000000E-07      :
          :  -> SCF convergence          0.1000000E-05 Eh   :
          :  -> wf. convergence          0.1000000E-03 e    :
          :  Broyden damping             0.4000000          :
          ...................................................

 iter      E             dE          RMSdq      gap      omega  full diag
   1     -7.7920307 -0.779203E+01  0.735E+00    1.18       0.0  T
   2     -7.6447424  0.147288E+00  0.686E+00    0.74       1.0  T
   3     -7.8612852 -0.216543E+00  0.389E+00    1.10       1.0  T
   4     -7.8803951 -0.191098E-01  0.357E+00    1.14       1.0  T
   5     -7.8852906 -0.489551E-02  0.264E+00    1.16       1.0  T
   6     -7.8913182 -0.602761E-02  0.763E-01    1.14       1.0  T
   7     -7.8920991 -0.780875E-03  0.777E-01    1.21       1.0  T
   8     -7.8924224 -0.323323E-03  0.484E-01    1.19       1.0  T
   9     -7.8925925 -0.170092E-03  0.153E-01    1.18       1.0  T
  10     -7.8926149 -0.223968E-04  0.343E-02    1.18       1.3  T
  11     -7.8926169 -0.199280E-05  0.353E-03    1.18      12.7  T
  12     -7.8926169 -0.239405E-08  0.271E-03    1.18      16.5  T
  13     -7.8926169 -0.418831E-08  0.150E-03    1.18      29.8  T
  14     -7.8926169 -0.199077E-08  0.952E-04    1.18      47.0  T
  15     -7.8926169 -0.740084E-09  0.269E-04    1.18     166.2  T

   *** convergence criteria satisfied after 15 iterations ***

         #    Occupation            Energy/Eh            Energy/eV
      -------------------------------------------------------------
         1        2.0000           -0.6484416             -17.6450
       ...           ...                  ...                  ...
         3        2.0000           -0.5474522             -14.8969
         4        2.0000           -0.5207755             -14.1710
         5        2.0000           -0.4792752             -13.0417
         6        1.7516           -0.4585027             -12.4765
         7        1.2484           -0.4563986             -12.4192
         8        1.0000           -0.3686612             -10.0318
         9        1.0000           -0.3620396              -9.8516 (HOMO)
        10                         -0.3184930              -8.6666 (LUMO)
        11                          0.0656915               1.7876
        12                          0.1028928               2.7999
        13                          0.1364734               3.7136
        14                          0.1631802               4.4404
      -------------------------------------------------------------
                  HL-Gap            0.0435466 Eh            1.1850 eV
             Fermi-level           -0.3988583 Eh          -10.8535 eV

 SCC (total)                   0 d,  0 h,  0 min,  0.003 sec
 SCC setup                      ...        0 min,  0.000 sec (  2.994%)
 Dispersion                     ...        0 min,  0.000 sec (  0.469%)
 integral evaluation            ...        0 min,  0.001 sec ( 24.797%)
 zeroth order Hamiltonian       ...        0 min,  0.000 sec (  0.546%)
 iterations                     ...        0 min,  0.001 sec ( 42.788%)
 molecular gradient             ...        0 min,  0.001 sec ( 26.111%)
 printout                       ...        0 min,  0.000 sec (  1.894%)

         :::::::::::::::::::::::::::::::::::::::::::::::::::::
         ::                     SUMMARY                     ::
         :::::::::::::::::::::::::::::::::::::::::::::::::::::
         :: total energy              -7.838235189757 Eh    ::
         :: gradient norm              0.179462015028 Eh/a0 ::
         :: HOMO-LUMO gap              1.184962172515 eV    ::
         ::.................................................::
         :: SCC energy                -7.892616883618 Eh    ::
         :: -> isotropic ES            0.003235719874 Eh    ::
         :: -> anisotropic ES          0.000231435930 Eh    ::
         :: -> anisotropic XC          0.014261933709 Eh    ::
         :: -> dispersion             -0.001480857077 Eh    ::
         :: repulsion energy           0.054381649926 Eh    ::
         :: add. restraining           0.000000000000 Eh    ::
         :::::::::::::::::::::::::::::::::::::::::::::::::::::

      ----------------------------------------------------------- 
     |                   =====================                   |
     |                        A N C O P T                        |
     |                   =====================                   |
     |               Approximate Normal Coordinate               |
     |                Rational Function Optimizer                |
      ----------------------------------------------------------- 

          ...................................................
          :                      SETUP                      :
          :.................................................:
          :   optimization level            normal          :
          :   max. optcycles                   200          :
          :   ANC micro-cycles                  20          :
          :   degrees of freedom                 9          :
          :.................................................:
          :   RF solver                   davidson          :
          :   write xtbopt.log                true          :
          :   linear?                        false          :
          :   energy convergence         0.5000000E-05 Eh   :
          :   grad. convergence          0.1000000E-02 Eh/α :
          :   maximium RF displ.         1.0000000          :
          :   Hlow (freq-cutoff)         0.1000000E-01      :
          :   Hmax (freq-cutoff)         5.0000000          :
          :   S6 in model hess.         20.0000000          :
          ...................................................

generating ANC from model Hessian ...
Using Lindh-Hessian (1995)
 Shifting diagonal of input Hessian by    0.0000000000000000     
 Lowest  eigenvalues of input Hessian
   -0.000000   -0.000000   -0.000000    0.000000    0.000000    0.000000
    0.010211    0.029681    0.081120    0.098047    0.134223    0.526605
    0.900561    0.975971    1.122976
 Highest eigenvalues
    0.098047    0.134223    0.526605    0.900561    0.975971    1.122976


........................................................................
.............................. CYCLE    1 ..............................
........................................................................
   1     -7.8926169 -0.789262E+01  0.116E-04    1.18       0.0  T
   2     -7.8926169  0.640652E-10  0.193E-04    1.18     231.3  T
   3     -7.8926169 -0.738201E-10  0.489E-05    1.18     914.3  T
     SCC iter.                  ...        0 min,  0.000 sec
     gradient                   ...        0 min,  0.001 sec
 * total energy  :    -7.8382352 Eh     change        0.1386252E-08 Eh
   gradient norm :     0.1794633 Eh/α   predicted     0.0000000E+00 (-100.00%)
   displ. norm   :     0.2671877 α      lambda       -0.3997552E-01
   maximum displ.:     0.1534505 α      in ANC's #6, #7, #2, ...

........................................................................
.............................. CYCLE    2 ..............................
........................................................................
   1     -7.9456455 -0.794565E+01  0.258E+00    1.20       0.0  T
   2     -7.9459762 -0.330672E-03  0.202E+00    1.28       1.0  T
   3     -7.9498988 -0.392261E-02  0.584E-01    1.21       1.0  T
   4     -7.9496241  0.274763E-03  0.529E-01    1.19       1.0  T
   5     -7.9499129 -0.288876E-03  0.949E-02    1.19       1.0  T
   6     -7.9499116  0.136548E-05  0.123E-01    1.19       1.0  T
   7     -7.9499271 -0.155717E-04  0.202E-02    1.19       2.2  T
   8     -7.9499290 -0.182556E-05  0.115E-02    1.19       3.9  T
   9     -7.9499284  0.526420E-06  0.272E-02    1.19       1.6  T
  10     -7.9499292 -0.719654E-06  0.497E-03    1.19       9.0  T
  11     -7.9499292 -0.232813E-07  0.101E-03    1.19      44.2  T
  12     -7.9499292 -0.954150E-09  0.136E-04    1.19     329.2  T
  13     -7.9499292  0.437145E-09  0.693E-04    1.19      64.6  T
     SCC iter.                  ...        0 min,  0.001 sec
     gradient                   ...        0 min,  0.001 sec
 * total energy  :    -7.8685623 Eh     change       -0.3032712E-01 Eh
   gradient norm :     0.0980241 Eh/α   predicted    -0.2141467E-01 ( -29.39%)
   displ. norm   :     0.2502440 α      lambda       -0.2129865E-01
   maximum displ.:     0.1355178 α      in ANC's #7, #9, #6, ...

........................................................................
.............................. CYCLE    3 ..............................
........................................................................
   1     -8.0028186 -0.800282E+01  0.259E+00    1.55       0.0  T
   2     -8.0025269  0.291756E-03  0.160E+00    1.60       1.0  T
   3     -7.9966318  0.589504E-02  0.138E+00    1.61       1.0  T
   4     -8.0046332 -0.800135E-02  0.115E+00    1.64       1.0  T
   5     -8.0056176 -0.984475E-03  0.723E-01    1.64       1.0  T
   6     -8.0061813 -0.563605E-03  0.222E-01    1.63       1.0  T
   7     -8.0062192 -0.379815E-04  0.152E-01    1.63       1.0  T
   8     -8.0062337 -0.144661E-04  0.746E-02    1.62       1.0  T
   9     -8.0062379 -0.424634E-05  0.399E-02    1.62       1.1  T
  10     -8.0062392 -0.124275E-05  0.159E-02    1.62       2.8  T
  11     -8.0062393 -0.151398E-06  0.999E-03    1.62       4.5  T
  12     -8.0062394 -0.903475E-07  0.301E-03    1.62      14.8  T
  13     -8.0062394 -0.869815E-08  0.488E-04    1.62      91.6  T
  14     -8.0062394 -0.236588E-09  0.483E-05    1.62     925.1  T
     SCC iter.                  ...        0 min,  0.001 sec
     gradient                   ...        0 min,  0.001 sec
 * total energy  :    -7.8711716 Eh     change       -0.2609337E-02 Eh
   gradient norm :     0.1307440 Eh/α   predicted    -0.1131621E-01 ( 333.68%)
   displ. norm   :     0.2178018 α      lambda       -0.1607217E-01
   maximum displ.:     0.1865633 α      in ANC's #2, #7, #6, ...

........................................................................
.............................. CYCLE    4 ..............................
........................................................................
   1     -7.9720764 -0.797208E+01  0.214E+00    1.28       0.0  T
   2     -7.9727313 -0.654893E-03  0.155E+00    1.23       1.0  T
   3     -7.9757460 -0.301472E-02  0.523E-01    1.25       1.0  T
   4     -7.9760407 -0.294714E-03  0.268E-01    1.25       1.0  T
   5     -7.9758423  0.198368E-03  0.640E-01    1.27       1.0  T
   6     -7.9762407 -0.398331E-03  0.622E-02    1.26       1.0  T
   7     -7.9762092  0.314804E-04  0.182E-01    1.26       1.0  T
   8     -7.9762458 -0.365994E-04  0.114E-02    1.26       3.9  T
   9     -7.9762459 -0.104517E-06  0.326E-03    1.26      13.7  T
  10     -7.9762459 -0.344981E-07  0.126E-03    1.26      35.4  T
  11     -7.9762459  0.700137E-09  0.209E-03    1.26      21.4  T
  12     -7.9762459 -0.479687E-09  0.187E-03    1.26      23.9  T
  13     -7.9762459 -0.359951E-08  0.187E-04    1.26     238.7  T
  14     -7.9762459 -0.380087E-10  0.918E-06    1.26    4869.5  T
     SCC iter.                  ...        0 min,  0.001 sec
     gradient                   ...        0 min,  0.001 sec
 * total energy  :    -7.8774129 Eh     change       -0.6241242E-02 Eh
   gradient norm :     0.0430705 Eh/α   predicted    -0.8417291E-02 (  34.87%)
   displ. norm   :     0.0563965 α      lambda       -0.1789724E-02
   maximum displ.:     0.0354753 α      in ANC's #9, #4, #5, ...

........................................................................
.............................. CYCLE    5 ..............................
........................................................................
   1     -7.9833777 -0.798338E+01  0.101E+00    1.38       0.0  T
   2     -7.9837377 -0.360072E-03  0.273E-01    1.40       1.0  T
   3     -7.9836293  0.108431E-03  0.329E-01    1.40       1.0  T
   4     -7.9840948 -0.465533E-03  0.810E-02    1.40       1.0  T
   5     -7.9840956 -0.755288E-06  0.433E-02    1.40       1.0  T
   6     -7.9840982 -0.256393E-05  0.733E-03    1.40       6.1  T
   7     -7.9840982  0.554035E-08  0.885E-03    1.40       5.1  T
   8     -7.9840982 -0.674174E-07  0.639E-04    1.40      70.0  T
   9     -7.9840982  0.462590E-08  0.237E-03    1.40      18.9  T
  10     -7.9840982 -0.470276E-08  0.313E-04    1.40     142.7  T
     SCC iter.                  ...        0 min,  0.001 sec
     gradient                   ...        0 min,  0.001 sec
 * total energy  :    -7.8789768 Eh     change       -0.1563905E-02 Eh
   gradient norm :     0.0303211 Eh/α   predicted    -0.8977080E-03 ( -42.60%)
   displ. norm   :     0.2898198 α      lambda       -0.5340368E-02
   maximum displ.:     0.1579067 α      in ANC's #4, #2, #9, ...

........................................................................
.............................. CYCLE    6 ..............................
........................................................................
   1     -8.0040799 -0.800408E+01  0.103E+00    1.84       0.0  T
   2     -8.0040425  0.374381E-04  0.645E-01    1.84       1.0  T
   3     -8.0025053  0.153713E-02  0.548E-01    1.84       1.0  T
   4     -8.0042470 -0.174169E-02  0.362E-02    1.85       1.2  T
   5     -8.0042492 -0.216248E-05  0.169E-02    1.85       2.7  T
   6     -8.0042493 -0.658675E-07  0.361E-03    1.85      12.4  T
   7     -8.0042493 -0.378886E-08  0.638E-04    1.85      70.1  T
   8     -8.0042493 -0.841514E-10  0.197E-04    1.85     227.1  T
     SCC iter.                  ...        0 min,  0.001 sec
     gradient                   ...        0 min,  0.001 sec
 * total energy  :    -7.8797230 Eh     change       -0.7461974E-03 Eh
   gradient norm :     0.0820577 Eh/α   predicted    -0.2894465E-02 ( 287.90%)
   displ. norm   :     0.1156612 α      lambda       -0.3948676E-02
   maximum displ.:     0.0685163 α      in ANC's #2, #4, #9, ...

........................................................................
.............................. CYCLE    7 ..............................
........................................................................
   1     -7.9946626 -0.799466E+01  0.441E-01    1.63       0.0  T
   2     -7.9946560  0.656340E-05  0.260E-01    1.64       1.0  T
   3     -7.9943636  0.292439E-03  0.242E-01    1.65       1.0  T
   4     -7.9947000 -0.336358E-03  0.301E-02    1.65       1.5  T
   5     -7.9947009 -0.923213E-06  0.727E-03    1.65       6.2  T
   6     -7.9947009 -0.315630E-07  0.213E-03    1.65      21.0  T
   7     -7.9947009 -0.359625E-08  0.696E-04    1.65      64.3  T
   8     -7.9947009 -0.469496E-09  0.243E-04    1.65     183.9  T
     SCC iter.                  ...        0 min,  0.001 sec
     gradient                   ...        0 min,  0.001 sec
 * total energy  :    -7.8813413 Eh     change       -0.1618363E-02 Eh
   gradient norm :     0.0058082 Eh/α   predicted    -0.2000750E-02 (  23.63%)
   displ. norm   :     0.1050424 α      lambda       -0.4408284E-03
   maximum displ.:     0.0736874 α      in ANC's #2, #1, #4, ...

........................................................................
.............................. CYCLE    8 ..............................
........................................................................
   1     -7.9918679 -0.799187E+01  0.341E-01    1.64       0.0  T
   2     -7.9918799 -0.120607E-04  0.185E-01    1.63       1.0  T
   3     -7.9918773  0.267707E-05  0.545E-02    1.64       1.0  T
   4     -7.9918703  0.701025E-05  0.450E-02    1.63       1.0  T
   5     -7.9918821 -0.118892E-04  0.854E-03    1.63       5.2  T
   6     -7.9918822 -0.584573E-07  0.196E-03    1.63      22.8  T
   7     -7.9918822 -0.914182E-09  0.891E-04    1.63      50.2  T
   8     -7.9918822 -0.791836E-09  0.911E-05    1.63     491.1  T
     SCC iter.                  ...        0 min,  0.000 sec
     gradient                   ...        0 min,  0.001 sec
 * total energy  :    -7.8816925 Eh     change       -0.3511653E-03 Eh
   gradient norm :     0.0118515 Eh/α   predicted    -0.2228469E-03 ( -36.54%)
   displ. norm   :     0.7381012 α      lambda       -0.2602050E-02
   maximum displ.:     0.5742537 α      in ANC's #1, #2, #4, ...

........................................................................
.............................. CYCLE    9 ..............................
........................................................................
   1     -7.9458318 -0.794583E+01  0.239E+00    1.78       0.0  T
   2     -7.9447792  0.105256E-02  0.157E+00    1.84       1.0  T
   3     -7.9352823  0.949696E-02  0.150E+00    1.82       1.0  T
   4     -7.9479257 -0.126434E-01  0.280E-01    1.82       1.0  T
   5     -7.9483592 -0.433511E-03  0.836E-02    1.85       1.0  T
   6     -7.9483654 -0.621749E-05  0.246E-02    1.85       1.8  T
   7     -7.9483656 -0.234237E-06  0.665E-03    1.85       6.7  T
   8     -7.9483657 -0.587203E-07  0.160E-03    1.85      27.9  T
   9     -7.9483657 -0.365663E-09  0.234E-04    1.85     191.5  T
  10     -7.9483657 -0.345759E-10  0.109E-04    1.85     408.8  T
     SCC iter.                  ...        0 min,  0.001 sec
     gradient                   ...        0 min,  0.001 sec
 * total energy  :    -7.8743658 Eh     change        0.7326685E-02 Eh
   gradient norm :     0.1287490 Eh/α   predicted    -0.2009786E-02 (-127.43%)
   displ. norm   :     0.4386595 α      lambda       -0.2195719E-01
   maximum displ.:     0.3405708 α      in ANC's #1, #2, #4, ...

........................................................................
.............................. CYCLE   10 ..............................
........................................................................
   1     -7.9860745 -0.798607E+01  0.154E+00    1.70       0.0  T
   2     -7.9857234  0.351076E-03  0.101E+00    1.65       1.0  T
   3     -7.9829768  0.274659E-02  0.928E-01    1.65       1.0  T
   4     -7.9871312 -0.415443E-02  0.130E-01    1.65       1.0  T
   5     -7.9871976 -0.663689E-04  0.393E-02    1.64       1.1  T
   6     -7.9871982 -0.595789E-06  0.223E-02    1.64       2.0  T
   7     -7.9871984 -0.234341E-06  0.267E-03    1.64      16.7  T
   8     -7.9871984 -0.831740E-08  0.706E-04    1.64      63.4  T
   9     -7.9871984 -0.423768E-09  0.146E-04    1.64     307.0  T
     SCC iter.                  ...        0 min,  0.001 sec
     gradient                   ...        0 min,  0.001 sec
 * total energy  :    -7.8835541 Eh     change       -0.9188254E-02 Eh
   gradient norm :     0.0345782 Eh/α   predicted    -0.1309112E-01 (  42.48%)
   displ. norm   :     0.1125111 α      lambda       -0.2407718E-02
   maximum displ.:     0.0787491 α      in ANC's #1, #3, #2, ...

........................................................................
.............................. CYCLE   11 ..............................
........................................................................
   1     -7.9870333 -0.798703E+01  0.593E-01    1.69       0.0  T
   2     -7.9870703 -0.369725E-04  0.332E-01    1.70       1.0  T
   3     -7.9867345  0.335843E-03  0.298E-01    1.70       1.0  T
   4     -7.9871934 -0.458905E-03  0.885E-02    1.70       1.0  T
   5     -7.9872109 -0.175108E-04  0.234E-02    1.70       1.9  T
   6     -7.9872128 -0.191906E-05  0.762E-03    1.70       5.9  T
   7     -7.9872128 -0.248688E-07  0.119E-03    1.70      37.6  T
   8     -7.9872128 -0.463869E-09  0.212E-04    1.70     210.6  T
   9     -7.9872128 -0.763123E-11  0.753E-05    1.70     594.1  T
     SCC iter.                  ...        0 min,  0.001 sec
     gradient                   ...        0 min,  0.001 sec
 * total energy  :    -7.8861337 Eh     change       -0.2579568E-02 Eh
   gradient norm :     0.0390478 Eh/α   predicted    -0.1219099E-02 ( -52.74%)
   displ. norm   :     0.1719313 α      lambda       -0.3578755E-02
   maximum displ.:     0.1503128 α      in ANC's #1, #3, #7, ...

........................................................................
.............................. CYCLE   12 ..............................
........................................................................
   1     -7.9843085 -0.798431E+01  0.887E-01    1.74       0.0  T
   2     -7.9842737  0.347507E-04  0.535E-01    1.76       1.0  T
   3     -7.9833010  0.972700E-03  0.500E-01    1.75       1.0  T
   4     -7.9847030 -0.140199E-02  0.116E-01    1.75       1.0  T
   5     -7.9847379 -0.349029E-04  0.436E-02    1.76       1.0  T
   6     -7.9847454 -0.750911E-05  0.128E-02    1.76       3.5  T
   7     -7.9847455 -0.865856E-07  0.122E-03    1.76      36.8  T
   8     -7.9847455 -0.699214E-09  0.500E-04    1.76      89.4  T
   9     -7.9847455 -0.223634E-09  0.930E-05    1.76     480.7  T
     SCC iter.                  ...        0 min,  0.001 sec
     gradient                   ...        0 min,  0.001 sec
 * total energy  :    -7.8900182 Eh     change       -0.3884571E-02 Eh
   gradient norm :     0.0554589 Eh/α   predicted    -0.1842269E-02 ( -52.57%)
   displ. norm   :     0.1671030 α      lambda       -0.4702704E-02
   maximum displ.:     0.1401742 α      in ANC's #1, #3, #7, ...

........................................................................
.............................. CYCLE   13 ..............................
........................................................................
   1     -7.9831536 -0.798315E+01  0.857E-01    1.87       0.0  T
   2     -7.9829084  0.245243E-03  0.555E-01    1.86       1.0  T
   3     -7.9820682  0.840223E-03  0.520E-01    1.88       1.0  T
   4     -7.9835934 -0.152518E-02  0.102E-01    1.87       1.0  T
   5     -7.9836128 -0.194684E-04  0.492E-02    1.87       1.0  T
   6     -7.9836244 -0.115755E-04  0.111E-02    1.87       4.0  T
   7     -7.9836245 -0.556054E-07  0.115E-03    1.87      38.7  T
   8     -7.9836245  0.438289E-10  0.571E-04    1.87      78.3  T
   9     -7.9836245 -0.494937E-09  0.997E-05    1.87     448.5  T
     SCC iter.                  ...        0 min,  0.001 sec
     gradient                   ...        0 min,  0.001 sec
 * total energy  :    -7.8946691 Eh     change       -0.4650908E-02 Eh
   gradient norm :     0.0679606 Eh/α   predicted    -0.2417008E-02 ( -48.03%)
   displ. norm   :     0.8396100 α      lambda       -0.2940318E-01
   maximum displ.:     0.6240927 α      in ANC's #1, #3, #7, ...

........................................................................
.............................. CYCLE   14 ..............................
........................................................................
   1     -7.9551900 -0.795519E+01  0.306E+00    2.97       0.0  T
   2     -7.9478059  0.738414E-02  0.225E+00    2.76       1.0  T
   3     -7.9379641  0.984183E-02  0.198E+00    3.11       1.0  T
   4     -7.9597061 -0.217421E-01  0.458E-01    2.86       1.0  T
   5     -7.9607663 -0.106016E-02  0.144E-01    2.90       1.0  T
   6     -7.9607819 -0.155978E-04  0.578E-02    2.91       1.0  T
   7     -7.9607956 -0.137417E-04  0.110E-02    2.90       4.1  T
   8     -7.9607957 -0.739686E-07  0.335E-03    2.90      13.4  T
   9     -7.9607957 -0.417671E-08  0.911E-04    2.90      49.1  T
  10     -7.9607957 -0.213887E-08  0.224E-04    2.90     199.8  T
     SCC iter.                  ...        0 min,  0.001 sec
     gradient                   ...        0 min,  0.001 sec
 * total energy  :    -7.8857082 Eh     change        0.8960938E-02 Eh
   gradient norm :     0.1618430 Eh/α   predicted    -0.2506540E-01 (-379.72%)
   displ. norm   :     0.4075607 α      lambda       -0.4120323E-01
   maximum displ.:     0.2978599 α      in ANC's #1, #7, #3, ...

........................................................................
.............................. CYCLE   15 ..............................
........................................................................
   1     -8.0014821 -0.800148E+01  0.164E+00    2.52       0.0  T
   2     -8.0009970  0.485144E-03  0.102E+00    2.55       1.0  T
   3     -7.9959945  0.500244E-02  0.101E+00    2.46       1.0  T
   4     -8.0021917 -0.619720E-02  0.186E-01    2.53       1.0  T
   5     -8.0023515 -0.159796E-03  0.644E-02    2.52       1.0  T
   6     -8.0023593 -0.778435E-05  0.145E-02    2.52       3.1  T
   7     -8.0023599 -0.616064E-06  0.597E-03    2.52       7.5  T
   8     -8.0023600 -0.338070E-07  0.119E-03    2.52      37.5  T
   9     -8.0023600 -0.258908E-08  0.247E-04    2.52     180.7  T
  10     -8.0023600 -0.223679E-10  0.567E-05    2.52     788.1  T
     SCC iter.                  ...        0 min,  0.001 sec
     gradient                   ...        0 min,  0.001 sec
 * total energy  :    -7.9091636 Eh     change       -0.2345542E-01 Eh
   gradient norm :     0.0705536 Eh/α   predicted    -0.2402367E-01 (   2.42%)
   displ. norm   :     0.1819290 α      lambda       -0.5847298E-02
   maximum displ.:     0.1145176 α      in ANC's #3, #2, #1, ...

........................................................................
.............................. CYCLE   16 ..............................
........................................................................
   1     -8.0135253 -0.801353E+01  0.486E-01    2.49       0.0  T
   2     -8.0134628  0.625259E-04  0.311E-01    2.51       1.0  T
   3     -8.0131703  0.292442E-03  0.295E-01    2.48       1.0  T
   4     -8.0136695 -0.499240E-03  0.535E-02    2.50       1.0  T
   5     -8.0136699 -0.326132E-06  0.349E-02    2.50       1.3  T
   6     -8.0136750 -0.508782E-05  0.486E-03    2.50       9.2  T
   7     -8.0136750 -0.297662E-07  0.144E-03    2.50      31.0  T
   8     -8.0136750 -0.398773E-09  0.535E-04    2.50      83.6  T
   9     -8.0136750 -0.122117E-09  0.952E-05    2.50     469.7  T
     SCC iter.                  ...        0 min,  0.001 sec
     gradient                   ...        0 min,  0.001 sec
 * total energy  :    -7.9132552 Eh     change       -0.4091624E-02 Eh
   gradient norm :     0.0475811 Eh/α   predicted    -0.3020418E-02 ( -26.18%)
   displ. norm   :     0.2662314 α      lambda       -0.8229060E-02
   maximum displ.:     0.2024312 α      in ANC's #6, #9, #8, ...

........................................................................
.............................. CYCLE   17 ..............................
........................................................................
   1     -8.0371781 -0.803718E+01  0.786E-01    2.79       0.0  T
   2     -8.0373059 -0.127769E-03  0.417E-01    2.79       1.0  T
   3     -8.0372208  0.850698E-04  0.173E-01    2.79       1.0  T
   4     -8.0373382 -0.117396E-03  0.762E-02    2.78       1.0  T
   5     -8.0373391 -0.882149E-06  0.536E-02    2.79       1.0  T
   6     -8.0373566 -0.175037E-04  0.620E-03    2.78       7.2  T
   7     -8.0373567 -0.255303E-07  0.164E-03    2.78      27.3  T
   8     -8.0373567 -0.308367E-09  0.373E-04    2.78     119.8  T
   9     -8.0373567 -0.527756E-10  0.112E-04    2.78     400.1  T
     SCC iter.                  ...        0 min,  0.001 sec
     gradient                   ...        0 min,  0.001 sec
 * total energy  :    -7.9180212 Eh     change       -0.4765974E-02 Eh
   gradient norm :     0.0255011 Eh/α   predicted    -0.4406167E-02 (  -7.55%)
   displ. norm   :     0.3766519 α      lambda       -0.5857850E-02
   maximum displ.:     0.2129303 α      in ANC's #1, #2, #6, ...

........................................................................
.............................. CYCLE   18 ..............................
........................................................................
   1     -8.0222853 -0.802229E+01  0.110E+00    2.90       0.0  T
   2     -8.0223418 -0.564158E-04  0.625E-01    2.88       1.0  T
   3     -8.0202480  0.209375E-02  0.588E-01    2.96       1.0  T
   4     -8.0226387 -0.239073E-02  0.102E-01    2.91       1.0  T
   5     -8.0226588 -0.200928E-04  0.503E-02    2.91       1.0  T
   6     -8.0226680 -0.915833E-05  0.637E-03    2.91       7.0  T
   7     -8.0226680 -0.384100E-07  0.259E-03    2.91      17.3  T
   8     -8.0226680 -0.105569E-07  0.360E-04    2.91     124.1  T
   9     -8.0226680 -0.112914E-09  0.120E-04    2.91     374.0  T
     SCC iter.                  ...        0 min,  0.001 sec
     gradient                   ...        0 min,  0.001 sec
 * total energy  :    -7.9184683 Eh     change       -0.4470456E-03 Eh
   gradient norm :     0.0602557 Eh/α   predicted    -0.3344445E-02 ( 648.12%)
   displ. norm   :     0.1596767 α      lambda       -0.4582600E-02
   maximum displ.:     0.1141633 α      in ANC's #2, #6, #1, ...

........................................................................
.............................. CYCLE   19 ..............................
........................................................................
   1     -8.0346660 -0.803467E+01  0.444E-01    2.88       0.0  T
   2     -8.0346310  0.350383E-04  0.266E-01    2.89       1.0  T
   3     -8.0343070  0.323997E-03  0.274E-01    2.85       1.0  T
   4     -8.0347558 -0.448840E-03  0.361E-02    2.88       1.2  T
   5     -8.0347564 -0.617129E-06  0.207E-02    2.88       2.2  T
   6     -8.0347580 -0.156502E-05  0.243E-03    2.88      18.4  T
   7     -8.0347580 -0.487997E-09  0.937E-04    2.88      47.7  T
   8     -8.0347580 -0.199383E-08  0.224E-04    2.88     199.7  T
     SCC iter.                  ...        0 min,  0.000 sec
     gradient                   ...        0 min,  0.001 sec
 * total energy  :    -7.9206816 Eh     change       -0.2213345E-02 Eh
   gradient norm :     0.0250009 Eh/α   predicted    -0.2349720E-02 (   6.16%)
   displ. norm   :     0.0543525 α      lambda       -0.6855401E-03
   maximum displ.:     0.0339645 α      in ANC's #1, #9, #5, ...

........................................................................
.............................. CYCLE   20 ..............................
........................................................................
   1     -8.0358601 -0.803586E+01  0.196E-01    2.91       0.0  T
   2     -8.0358654 -0.531591E-05  0.105E-01    2.91       1.0  T
   3     -8.0358546  0.107867E-04  0.480E-02    2.91       1.0  T
   4     -8.0358671 -0.124685E-04  0.125E-02    2.91       3.6  T
   5     -8.0358674 -0.249114E-06  0.758E-03    2.91       5.9  T
   6     -8.0358676 -0.274486E-06  0.195E-03    2.91      23.0  T
   7     -8.0358676 -0.604057E-08  0.380E-04    2.91     117.7  T
   8     -8.0358676 -0.149429E-09  0.715E-05    2.91     625.9  T
     SCC iter.                  ...        0 min,  0.000 sec
     gradient                   ...        0 min,  0.001 sec
 * total energy  :    -7.9212042 Eh     change       -0.5225543E-03 Eh
   gradient norm :     0.0148262 Eh/α   predicted    -0.3437824E-03 ( -34.21%)
   displ. norm   :     0.1297599 α      lambda       -0.9711268E-03
   maximum displ.:     0.0928178 α      in ANC's #1, #9, #7, ...
 * RMSD in coord.:     0.9751120 α      energy gain  -0.8296897E-01 Eh

generating ANC from model Hessian ...
Using Lindh-Hessian (1995)
 Shifting diagonal of input Hessian by    0.0000000000000000     
 Lowest  eigenvalues of input Hessian
   -0.000000   -0.000000   -0.000000    0.000000    0.000000    0.000000
    0.027571    0.062537    0.080600    0.161684    0.259293    0.507324
    1.215853    1.436881    1.851893
 Highest eigenvalues
    0.161684    0.259293    0.507324    1.215853    1.436881    1.851893


........................................................................
.............................. CYCLE   21 ..............................
........................................................................
   1     -8.0343825 -0.803438E+01  0.424E-01    2.94       0.0  T
   2     -8.0344137 -0.312402E-04  0.228E-01    2.94       1.0  T
   3     -8.0344072  0.654960E-05  0.636E-02    2.94       1.0  T
   4     -8.0344195 -0.123435E-04  0.319E-02    2.94       1.4  T
   5     -8.0344206 -0.108470E-05  0.205E-02    2.94       2.2  T
   6     -8.0344233 -0.272054E-05  0.253E-03    2.94      17.7  T
   7     -8.0344233 -0.144097E-08  0.621E-04    2.94      72.1  T
   8     -8.0344233 -0.160261E-09  0.127E-04    2.94     353.4  T
     SCC iter.                  ...        0 min,  0.001 sec
     gradient                   ...        0 min,  0.001 sec
 * total energy  :    -7.9217481 Eh     change       -0.5439497E-03 Eh
   gradient norm :     0.0109292 Eh/α   predicted     0.0000000E+00 (-100.00%)
   displ. norm   :     0.0843389 α      lambda       -0.5139508E-03
   maximum displ.:     0.0752164 α      in ANC's #2, #1, #3, ...

........................................................................
.............................. CYCLE   22 ..............................
........................................................................
   1     -8.0343892 -0.803439E+01  0.247E-01    2.94       0.0  T
   2     -8.0343907 -0.151286E-05  0.148E-01    2.94       1.0  T
   3     -8.0343880  0.270836E-05  0.250E-02    2.94       1.8  T
   4     -8.0343913 -0.329090E-05  0.868E-03    2.94       5.2  T
   5     -8.0343913 -0.280242E-07  0.695E-03    2.94       6.4  T
   6     -8.0343915 -0.231385E-06  0.101E-03    2.94      44.3  T
   7     -8.0343915 -0.420199E-09  0.177E-04    2.94     252.6  T
   8     -8.0343915 -0.108589E-10  0.552E-05    2.94     809.7  T
     SCC iter.                  ...        0 min,  0.001 sec
     gradient                   ...        0 min,  0.001 sec
 * total energy  :    -7.9219139 Eh     change       -0.1657964E-03 Eh
   gradient norm :     0.0049392 Eh/α   predicted    -0.2588043E-03 (  56.10%)
   displ. norm   :     0.0370436 α      lambda       -0.1180063E-03
   maximum displ.:     0.0272272 α      in ANC's #1, #2, #3, ...

........................................................................
.............................. CYCLE   23 ..............................
........................................................................
   1     -8.0352022 -0.803520E+01  0.972E-02    2.94       0.0  T
   2     -8.0352029 -0.635552E-06  0.568E-02    2.94       1.0  T
   3     -8.0352016  0.123873E-05  0.178E-02    2.94       2.5  T
   4     -8.0352030 -0.135943E-05  0.677E-03    2.94       6.6  T
   5     -8.0352030 -0.222278E-07  0.491E-03    2.94       9.1  T
   6     -8.0352031 -0.147949E-06  0.548E-04    2.94      81.6  T
   7     -8.0352031 -0.320757E-10  0.108E-04    2.94     415.2  T
     SCC iter.                  ...        0 min,  0.000 sec
     gradient                   ...        0 min,  0.001 sec
 * total energy  :    -7.9219836 Eh     change       -0.6965173E-04 Eh
   gradient norm :     0.0019585 Eh/α   predicted    -0.5908541E-04 ( -15.17%)
   displ. norm   :     0.0298897 α      lambda       -0.2559337E-04
   maximum displ.:     0.0244708 α      in ANC's #3, #2, #4, ...

........................................................................
.............................. CYCLE   24 ..............................
........................................................................
   1     -8.0353822 -0.803538E+01  0.929E-02    2.93       0.0  T
   2     -8.0353829 -0.640542E-06  0.528E-02    2.93       1.0  T
   3     -8.0353819  0.981874E-06  0.162E-02    2.93       2.8  T
   4     -8.0353831 -0.122269E-05  0.456E-03    2.93       9.8  T
   5     -8.0353831  0.245200E-07  0.392E-03    2.93      11.4  T
   6     -8.0353832 -0.979774E-07  0.478E-04    2.93      93.6  T
   7     -8.0353832 -0.287184E-10  0.820E-05    2.93     545.1  T
     SCC iter.                  ...        0 min,  0.000 sec
     gradient                   ...        0 min,  0.001 sec
 * total energy  :    -7.9220038 Eh     change       -0.2023836E-04 Eh
   gradient norm :     0.0012982 Eh/α   predicted    -0.1280365E-04 ( -36.74%)
   displ. norm   :     0.0154608 α      lambda       -0.6506568E-05
   maximum displ.:     0.0134452 α      in ANC's #3, #2, #4, ...

........................................................................
.............................. CYCLE   25 ..............................
........................................................................
   1     -8.0352534 -0.803525E+01  0.437E-02    2.92       0.0  T
   2     -8.0352535 -0.145134E-06  0.249E-02    2.92       1.8  T
   3     -8.0352535  0.260066E-07  0.404E-03    2.92      11.1  T
   4     -8.0352535 -0.344555E-07  0.285E-03    2.92      15.7  T
   5     -8.0352535 -0.292098E-07  0.136E-03    2.92      32.9  T
   6     -8.0352535 -0.100391E-07  0.294E-04    2.92     152.0  T
   7     -8.0352535 -0.637854E-10  0.524E-05    2.92     853.4  T
     SCC iter.                  ...        0 min,  0.000 sec
     gradient                   ...        0 min,  0.001 sec
 * total energy  :    -7.9220081 Eh     change       -0.4347750E-05 Eh
   gradient norm :     0.0003355 Eh/α   predicted    -0.3254741E-05 ( -25.14%)
   displ. norm   :     0.0049008 α      lambda       -0.5586198E-06
   maximum displ.:     0.0045815 α      in ANC's #1, #5, #2, ...

   *** GEOMETRY OPTIMIZATION CONVERGED AFTER 25 ITERATIONS ***

------------------------------------------------------------------------
 total energy gain   :        -0.0837730 Eh      -52.5683 kcal/mol
 total RMSD          :         0.9754456 a0        0.5162 Å
 total power (kW/mol):        -8.7978340 (step)-4144.6846 (real)
------------------------------------------------------------------------

 ANCopt (total)                0 d,  0 h,  0 min,  0.053 sec
 optimizer setup                ...        0 min,  0.000 sec (  0.124%)
 model hessian                  ...        0 min,  0.000 sec (  0.254%)
 ANC generation                 ...        0 min,  0.000 sec (  0.221%)
 coordinate transformation      ...        0 min,  0.000 sec (  0.102%)
 single point calculation       ...        0 min,  0.051 sec ( 95.634%)
 optimization log               ...        0 min,  0.001 sec (  1.179%)
 hessian update                 ...        0 min,  0.000 sec (  0.096%)
 rational function              ...        0 min,  0.001 sec (  1.048%)

================
 final structure:
================
5
 xtb: 6.2.2 (9d81278992624c895f80dd42a50cac0aa55982e2)
C         0.72377166953380   -0.60840217154925    0.11552288714854
N         1.78520665366344    0.05041149518433   -0.13004119880755
C        -0.48955251287833    0.03499725773296    0.02300590826022
H        -1.37103503034324   -0.55339220988049    0.23487536111966
H        -0.64839177997566    1.07638662851244   -0.24336295772087

 Bond Distances (Angstroems)
 ---------------------------
C1-N2=1.2732         C1-C3=1.3765         N2-C1=1.2732         C3-C1=1.3765         C3-H4=1.0808         C3-H5=1.0866         
H4-C3=1.0808         H5-C3=1.0866         
 C  H  Rav=1.0837 sigma=0.0029  Rmin=1.0808  Rmax=1.0866     2
 C  C  Rav=1.3765 sigma=0.0000  Rmin=1.3765  Rmax=1.3765     1
 N  C  Rav=1.2732 sigma=0.0000  Rmin=1.2732  Rmax=1.2732     1

 selected bond angles (degree)
 --------------------
C3-C1-N2=118.69                H4-C3-C1=116.83                H5-C3-C1=126.39                H5-C3-H4=116.78                

 selected dihedral angles (degree)
 ---------------------------------
H4-C3-C1-N2=179.82            H5-C3-C1-N2=359.90            
           -------------------------------------------------
          |                Final Singlepoint                |
           -------------------------------------------------

          ...................................................
          :                      SETUP                      :
          :.................................................:
          :  # basis functions                  14          :
          :  # atomic orbitals                  14          :
          :  # shells                            8          :
          :  # electrons                        15          :
          :  max. iterations                   250          :
          :  Hamiltonian                  GFN2-xTB          :
          :  restarted?                      false          :
          :  GBSA solvation                  false          :
          :  PC potential                    false          :
          :  electronic temp.          300.0000000     K    :
          :  accuracy                    1.0000000          :
          :  -> integral cutoff          0.2500000E+02      :
          :  -> integral neglect         0.1000000E-07      :
          :  -> SCF convergence          0.1000000E-05 Eh   :
          :  -> wf. convergence          0.1000000E-03 e    :
          :  Broyden damping             0.4000000          :
          ...................................................

 iter      E             dE          RMSdq      gap      omega  full diag
   1     -8.0352535 -0.803525E+01  0.109E-05    2.92       0.0  T
   2     -8.0352535 -0.390799E-13  0.514E-06    2.92    8707.9  T
   3     -8.0352535  0.373035E-13  0.300E-06    2.92   14897.6  T

   *** convergence criteria satisfied after 3 iterations ***

         #    Occupation            Energy/Eh            Energy/eV
      -------------------------------------------------------------
         1        2.0000           -0.6539841             -17.7958
       ...           ...                  ...                  ...
         3        2.0000           -0.5463610             -14.8672
         4        2.0000           -0.5227731             -14.2254
         5        2.0000           -0.4859580             -13.2236
         6        2.0000           -0.4677780             -12.7289
         7        1.0000           -0.4277951             -11.6409
         8        1.0000           -0.3814832             -10.3807
         9        1.0000           -0.3059096              -8.3242 (HOMO)
        10                         -0.1985249              -5.4021 (LUMO)
        11                          0.1205558               3.2805
        12                          0.2084632               5.6726
        13                          0.4064127              11.0591
        14                          0.5136865              13.9781
      -------------------------------------------------------------
                  HL-Gap            0.1073847 Eh            2.9221 eV
             Fermi-level           -0.3500019 Eh           -9.5240 eV

 SCC (total)                   0 d,  0 h,  0 min,  0.002 sec
 SCC setup                      ...        0 min,  0.000 sec (  3.684%)
 Dispersion                     ...        0 min,  0.000 sec (  0.417%)
 integral evaluation            ...        0 min,  0.001 sec ( 38.755%)
 zeroth order Hamiltonian       ...        0 min,  0.000 sec (  0.584%)
 iterations                     ...        0 min,  0.000 sec ( 13.178%)
 molecular gradient             ...        0 min,  0.001 sec ( 38.824%)
 printout                       ...        0 min,  0.000 sec (  4.031%)

         :::::::::::::::::::::::::::::::::::::::::::::::::::::
         ::                     SUMMARY                     ::
         :::::::::::::::::::::::::::::::::::::::::::::::::::::
         :: total energy              -7.922008140481 Eh    ::
         :: gradient norm              0.000335489920 Eh/a0 ::
         :: HOMO-LUMO gap              2.922086594241 eV    ::
         ::.................................................::
         :: SCC energy                -8.035253546440 Eh    ::
         :: -> isotropic ES            0.005532144093 Eh    ::
         :: -> anisotropic ES         -0.000101459163 Eh    ::
         :: -> anisotropic XC          0.011091271933 Eh    ::
         :: -> dispersion             -0.001480383264 Eh    ::
         :: repulsion energy           0.113245390835 Eh    ::
         :: add. restraining           0.000000000000 Eh    ::
         :::::::::::::::::::::::::::::::::::::::::::::::::::::

           ------------------------------------------------- 
          |                Numerical Hessian                |
           ------------------------------------------------- 
step length          :   0.00500
SCC accuracy         :   0.30000
Hessian scale factor :   1.00000
frozen atoms in %    :   0.00000    0
RMS gradient         :   0.00034
estimated CPU  time      0.00 min
estimated wall time      0.00 min

writing file <hessian>.

 projected vibrational frequencies (cm-1)
eigval :       -0.00    -0.00     0.00     0.00     0.00     0.00
eigval :      419.51   574.20   737.78   844.01  1211.86  1277.72
eigval :     1529.51  2937.08  3041.87
           -------------------------------------------------
          |                Property Printout                |
           -------------------------------------------------

    * Orbital Energies and Occupations

         #    Occupation            Energy/Eh            Energy/eV
      -------------------------------------------------------------
         1        2.0000           -0.6539842             -17.7958
         2        2.0000           -0.6156309             -16.7522
         3        2.0000           -0.5463611             -14.8672
         4        2.0000           -0.5227731             -14.2254
         5        2.0000           -0.4859580             -13.2236
         6        2.0000           -0.4677779             -12.7289
         7        1.0000           -0.4277950             -11.6409
         8        1.0000           -0.3814833             -10.3807
         9        1.0000           -0.3059096              -8.3242 (HOMO)
        10                         -0.1985249              -5.4021 (LUMO)
        11                          0.1205556               3.2805
        12                          0.2084631               5.6726
        13                          0.4064126              11.0590
        14                          0.5136865              13.9781
      -------------------------------------------------------------
                  HL-Gap            0.1073846 Eh            2.9221 eV
             Fermi-level           -0.3500019 Eh           -9.5240 eV

     #   Z        covCN         q      C6AA      α(0)
     1   6 C      1.891     0.019    30.625     8.938
     2   7 N      0.942    -0.166    24.430     7.132
     3   6 C      2.862    -0.052    29.281     8.870
     4   1 H      0.926     0.110     1.693     2.035
     5   1 H      0.925     0.089     1.893     2.152

 Mol. C6AA /au·bohr⁶  :        343.772134
 Mol. C8AA /au·bohr⁸  :       8330.872974
 Mol. α(0) /au        :         29.125539


Wiberg/Mayer (AO) data.
largest (>0.10) Wiberg bond orders for each atom
          total WBO             WBO to atom ...
     1  C   3.060        N    2 1.663    C    3 1.383
     2  N   1.745        C    1 1.663
     3  C   3.250        C    1 1.383    H    5 0.918    H    4 0.895
     4  H   0.923        C    3 0.895
     5  H   0.931        C    3 0.918

MOs/occ written to file <molden.input>


molecular dipole:
                 x           y           z       tot (Debye)
 q only:       -0.881       0.023       0.051
   full:       -1.106       0.057       0.057       2.819
molecular quadrupole (traceless):
                xx          xy          yy          xz          yz          zz
 q only:       -1.298      -0.003       1.008       0.103      -0.203       0.289
  q+dip:       -0.891      -0.142       1.338       0.061      -0.497      -0.447
   full:       -1.585      -0.265       0.895       0.221      -0.033       0.691

           -------------------------------------------------
          |                Geometry Summary                 |
           -------------------------------------------------

      molecular mass/u    :       40.0440565
   center of mass at/Å    :        0.6438536      -0.1411921      -0.0041517
  moments of inertia/u·Å² :        0.5534472E+01   0.3968535E+02   0.4521980E+02
rotational constants/cm⁻¹ :        0.3045933E+01   0.4247823E+00   0.3727932E+00

 * 3 selected distances

     #   Z        #   Z                                     value/Å
Molecule has the following symmetry elements: (sigma) 
It seems to be the Cs point group
     1   6 C      3   6 C                                 1.3764730 (max)
     3   6 C      4   1 H                                 1.0807878 (min)
     3   6 C      5   1 H                                 1.0865883

 * 2 distinct bonds (by element types)

   Z      Z             #   av. dist./Å        max./Å        min./Å
   1 H    6 C           2     1.0836880     1.0865883     1.0807878
   6 C    6 C           1     1.3764730     1.3764730     1.3764730

           -------------------------------------------------
          |               Frequency Printout                |
           -------------------------------------------------
 projected vibrational frequencies (cm-1)
eigval :       -0.00    -0.00     0.00     0.00     0.00     0.00
eigval :      419.51   574.20   737.78   844.01  1211.86  1277.72
eigval :     1529.51  2937.08  3041.87
 reduced masses (amu)
   1: 10.40   2: 12.29   3: 10.89   4: 12.28   5: 11.24   6: 10.43   7:  9.46   8:  3.43
   9:  4.39  10:  5.60  11:  8.74  12:  4.89  13: 12.59  14:  1.67  15:  1.83
 IR intensities (amu)
   1:  0.13   2:  0.12   3:  0.14   4:  0.14   5:  0.08   6:  0.16   7:  0.06   8:  0.06
   9:  0.30  10:  0.03  11:  0.31  12:  0.42  13:  0.66  14:  0.09  15:  0.16
 Raman intensities (amu)
   1:  0.00   2:  0.00   3:  0.00   4:  0.00   5:  0.00   6:  0.00   7:  0.00   8:  0.00
   9:  0.00  10:  0.00  11:  0.00  12:  0.00  13:  0.00  14:  0.00  15:  0.00
 output can be read by thermo (or use thermo option).
 writing <g98.out> molden fake output.
 recommended (thermochemical) frequency scaling factor: 1.0
           -------------------------------------------------
          |             Thermodynamic Functions             |
           -------------------------------------------------

cs  symmetry found (for desy threshold:  0.10E+00) used in thermo

          ...................................................
          :                      SETUP                      :
          :.................................................:
          :  # frequencies                           9      :
          :  # imaginary freq.                       0      :
          :  linear?                             false      :
          :  only rotor calc.                    false      :
          :  symmetry                               cs      :
          :  rotational number                       1      :
          :  scaling factor                  1.0000000      :
          :  rotor cutoff                   50.0000000 cm⁻¹ :
          :  imag. cutoff                  -20.0000000 cm⁻¹ :
          :.................................................:

    mode    ω/cm⁻¹     T·S(HO)/kcal·mol⁻¹    T·S(FR)/kcal·mol⁻¹   T·S(vib)
   ------------------------------------------------------------------------
   ------------------------------------------------------------------------

   temp. (K)  partition function   enthalpy   heat capacity  entropy
                                   cal/mol     cal/K/mol   cal/K/mol   J/K/mol
 298.15  VIB   1.29                  416.153      4.279      1.909
         ROT  0.761E+04              888.752      2.981     20.742
         INT  0.985E+04             1304.905      7.260     22.651
         TR   0.245E+27             1481.254      4.968     36.973
         TOT                        2786.1589    12.2282    59.6240   249.4669

   temp. (K)  partition function   enthalpy   heat capacity  entropy
                                   cal/mol     cal/K/mol   cal/K/mol   J/K/mol
 120.00  VIB   1.01                    9.982      0.461      0.099
         ROT  0.194E+04              357.707      2.981     18.029
         INT  0.196E+04              367.689      3.442     18.128
         TR   0.626E+26              596.178      4.968     32.454
         TOT                         963.8667     8.4097    50.5820   211.6350

   temp. (K)  partition function   enthalpy   heat capacity  entropy
                                   cal/mol     cal/K/mol   cal/K/mol   J/K/mol
 100.00  VIB   1.00                    3.365      0.216      0.039
         ROT  0.148E+04              298.089      2.981     17.486
         INT  0.148E+04              301.454      3.197     17.525
         TR   0.476E+26              496.815      4.968     31.549
         TOT                         798.2685     8.1652    49.0734   205.3233

   temp. (K)  partition function   enthalpy   heat capacity  entropy
                                   cal/mol     cal/K/mol   cal/K/mol   J/K/mol
  80.00  VIB   1.00                    0.693      0.068      0.010
         ROT  0.106E+04              238.471      2.981     16.821
         INT  0.106E+04              239.164      3.048     16.830
         TR   0.341E+26              397.452      4.968     30.440
         TOT                         636.6160     8.0166    47.2709   197.7816

   temp. (K)  partition function   enthalpy   heat capacity  entropy
                                   cal/mol     cal/K/mol   cal/K/mol   J/K/mol
  60.00  VIB   1.00                    0.053      0.009      0.001
         ROT   687.                  178.853      2.981     15.963
         INT   687.                  178.906      2.990     15.964
         TR   0.221E+26              298.089      4.968     29.012
         TOT                         476.9955     7.9581    44.9760   188.1794

   temp. (K)  partition function   enthalpy   heat capacity  entropy
                                   cal/mol     cal/K/mol   cal/K/mol   J/K/mol
  40.00  VIB   1.00                    0.000      0.000     -0.000
         ROT   374.                  119.236      2.981     14.754
         INT   374.                  119.236      2.981     14.754
         TR   0.120E+26              198.726      4.968     26.999
         TOT                         317.9619     7.9492    41.7528   174.6937

   temp. (K)  partition function   enthalpy   heat capacity  entropy
                                   cal/mol     cal/K/mol   cal/K/mol   J/K/mol
  20.00  VIB   1.00                    0.000      0.000     -0.000
         ROT   132.                   59.618      2.981     12.688
         INT   132.                   59.618      2.981     12.688
         TR   0.426E+25               99.363      4.968     23.557
         TOT                         158.9808     7.9490    36.2444   151.6466

   temp. (K)  partition function   enthalpy   heat capacity  entropy
                                   cal/mol     cal/K/mol   cal/K/mol   J/K/mol
  10.00  VIB   1.00                    0.000      0.000     -0.001
         ROT   46.8                   29.809      2.981     10.622
         INT   46.8                   29.809      2.981     10.621
         TR   0.151E+25               49.681      4.968     20.115
         TOT                          79.4904     7.9490    30.7360   128.5995

       T/K    H(0)-H(T)+PV         H(T)/Eh          T*S/Eh         G(T)/Eh
   ------------------------------------------------------------------------
    298.15    0.444003E-02    0.330846E-01    0.283293E-01    0.475534E-02
    120.00    0.153602E-02    0.301806E-01    0.967290E-02    0.205077E-01
    100.00    0.127212E-02    0.299167E-01    0.782035E-02    0.220964E-01
     80.00    0.101451E-02    0.296591E-01    0.602648E-02    0.236326E-01
     60.00    0.760141E-03    0.294047E-01    0.430042E-02    0.251043E-01
     40.00    0.506705E-03    0.291513E-01    0.266149E-02    0.264898E-01
     20.00    0.253352E-03    0.288980E-01    0.115518E-02    0.277428E-01
     10.00    0.126676E-03    0.287713E-01    0.489810E-03    0.282815E-01 (used)
   ------------------------------------------------------------------------

         :::::::::::::::::::::::::::::::::::::::::::::::::::::
         ::                  THERMODYNAMIC                  ::
         :::::::::::::::::::::::::::::::::::::::::::::::::::::
         :: total free energy          -7.893726667465 Eh   ::
         ::.................................................::
         :: total energy               -7.922008140501 Eh   ::
         :: zero point energy           0.028644606827 Eh   ::
         :: G(RRHO) w/o ZPVE           -0.000363133792 Eh   ::
         :: G(RRHO) contrib.            0.028281473036 Eh   ::
         :::::::::::::::::::::::::::::::::::::::::::::::::::::

optimized geometry written to: xtbopt.xyz


           -------------------------------------------------
          | TOTAL ENERGY               -7.922008140501 Eh   |
          | TOTAL ENTHALPY             -7.893236857658 Eh   |
          | TOTAL FREE ENERGY          -7.893726667465 Eh   |
          | GRADIENT NORM               0.000335396846 Eh/α |
          | HOMO-LUMO GAP               2.922084969201 eV   |
           -------------------------------------------------

------------------------------------------------------------------------
 * finished run on 2020/05/12 at 11:44:46.685     
------------------------------------------------------------------------
 total:
 * wall-time:     0 d,  0 h,  0 min,  0.127 sec
 *  cpu-time:     0 d,  0 h,  0 min,  0.127 sec
 * ratio c/w:     0.998 speedup
 SCF:
 * wall-time:     0 d,  0 h,  0 min,  0.003 sec
 *  cpu-time:     0 d,  0 h,  0 min,  0.003 sec
 * ratio c/w:     1.000 speedup
 ANC optimizer:
 * wall-time:     0 d,  0 h,  0 min,  0.055 sec
 *  cpu-time:     0 d,  0 h,  0 min,  0.055 sec
 * ratio c/w:     0.999 speedup
 numerical hessian:
 * wall-time:     0 d,  0 h,  0 min,  0.053 sec
 *  cpu-time:     0 d,  0 h,  0 min,  0.053 sec
 * ratio c/w:     0.998 speedup

