      -----------------------------------------------------------      
     |                   =====================                   |     
     |                           x T B                           |     
     |                   =====================                   |     
     |                         S. Grimme                         |     
     |          Mulliken Center for Theoretical Chemistry        |     
     |                    University of Bonn                     |     
      -----------------------------------------------------------      

   * xtb version 6.2.2 (9d81278992624c895f80dd42a50cac0aa55982e2) compiled by '@Darwin' on 04/03/2020

   xtb is free software: you can redistribute it and/or modify it under
   the terms of the GNU Lesser General Public License as published by
   the Free Software Foundation, either version 3 of the License, or
   (at your option) any later version.
   
   xtb is distributed in the hope that it will be useful,
   but WITHOUT ANY WARRANTY; without even the implied warranty of
   MERCHANTABILITY or FITNESS FOR A PARTICULAR PURPOSE.  See the
   GNU Lesser General Public License for more details.
   
   Cite this work as:
   * S. Grimme, C. Bannwarth, P. Shushkov, J. Chem. Theory Comput., 2017,
     13, 1989-2009. DOI: 10.1021/acs.jctc.7b00118
   * C. Bannwarth, S. Ehlert and S. Grimme., J. Chem. Theory Comput., 2019,
     15, 1652-1671. DOI: 10.1021/acs.jctc.8b01176
   * P. Pracht, E. Caldeweyher, S. Ehlert, S. Grimme, ChemRxiv, 2019, preprint.
     DOI: 10.26434/chemrxiv.8326202.v1
   
   for DFT-D4:
   * E. Caldeweyher, C. Bannwarth and S. Grimme, J. Chem. Phys., 2017,
     147, 034112. DOI: 10.1063/1.4993215
   * E. Caldeweyher, S. Ehlert, A. Hansen, H. Neugebauer, S. Spicher,
     C. Bannwarth and S. Grimme, J. Chem. Phys., 2019, 150, 154122.
     DOI: 10.1063/1.5090222
   
   for sTDA-xTB:
   * S. Grimme and C. Bannwarth, J. Chem. Phys., 2016, 145, 054103.
     DOI: 10.1063/1.4959605
   
   in the mass-spec context:
   * V. Asgeirsson, C. Bauer and S. Grimme, Chem. Sci., 2017, 8, 4879.
     DOI: 10.1039/c7sc00601b
   
   for metadynamics refer to:
   * S. Grimme, J. Chem. Theory Comput., 2019, 155, 2847-2862
     DOI: 10.1021/acs.jctc.9b00143
   
   with help from (in alphabetical order)
   C. Bannwarth, F. Bohle, G. Brandenburg, E. Caldeweyher, M. Checinski,
   S. Dohm, S. Ehlert, S. Ehrlich, F. März, H. Neugebauer, J. Pisarek,
   P. Pracht, P. Shushkov, and S. Spicher.
   
 * started run on 2020/05/12 at 11:43:53.096     

           -------------------------------------------------
          |                Calculation Setup                |
           -------------------------------------------------

          program call               : xtb --input H2C1O2_4_S_2.input H2C1O2_4_S_2.xyz --ohess --molden --namespace H2C1O2_4_S_2 output.out
          calculation namespace      : H2C1O2_4_S_2
          coordinate file            : H2C1O2_4_S_2.xyz
          number of atoms            :                     5
          number of electrons        :                    18
          charge                     :                     0
          spin                       :                   1.0
          first test random number   :      0.42681192812122

   ID    Z sym.   atoms
    1    8 O      1, 3
    2    6 C      2
    3    1 H      4, 5

           -------------------------------------------------
          |                 G F N 2 - x T B                 |
           -------------------------------------------------

        Reference                      10.1021/acs.jctc.8b01176
      * Hamiltonian:
        H0-scaling (s, p, d)           1.850000    2.230000    2.230000
        zeta-weighting                 0.500000
      * Dispersion:
        s8                             2.700000
        a1                             0.520000
        a2                             5.000000
        s9                             5.000000
      * Repulsion:
        kExp                           1.500000    1.000000
        rExp                           1.000000
      * Coulomb:
        alpha                          2.000000
        third order                    shell-resolved
        anisotropic                    true
        a3                             3.000000
        a5                             4.000000
        cn-shift                       1.200000
        cn-exp                         4.000000
        max-rad                        5.000000


          ...................................................
          :                      SETUP                      :
          :.................................................:
          :  # basis functions                  14          :
          :  # atomic orbitals                  14          :
          :  # shells                            8          :
          :  # electrons                        18          :
          :  max. iterations                   250          :
          :  Hamiltonian                  GFN2-xTB          :
          :  restarted?                      false          :
          :  GBSA solvation                  false          :
          :  PC potential                    false          :
          :  electronic temp.          300.0000000     K    :
          :  accuracy                    1.0000000          :
          :  -> integral cutoff          0.2500000E+02      :
          :  -> integral neglect         0.1000000E-07      :
          :  -> SCF convergence          0.1000000E-05 Eh   :
          :  -> wf. convergence          0.1000000E-03 e    :
          :  Broyden damping             0.4000000          :
          ...................................................

 iter      E             dE          RMSdq      gap      omega  full diag
   1    -11.0196451 -0.110196E+02  0.492E+00    7.69       0.0  T
   2    -11.0239484 -0.430335E-02  0.331E+00    7.11       1.0  T
   3    -11.0230777  0.870740E-03  0.640E-01    7.41       1.0  T
   4    -11.0248632 -0.178552E-02  0.188E-01    7.12       1.0  T
   5    -11.0248787 -0.154271E-04  0.565E-02    7.10       1.0  T
   6    -11.0248809 -0.224491E-05  0.259E-02    7.13       1.7  T
   7    -11.0248826 -0.166813E-05  0.578E-03    7.12       7.7  T
   8    -11.0248826 -0.383556E-07  0.128E-03    7.12      35.0  T
   9    -11.0248826 -0.386904E-08  0.566E-04    7.12      79.0  T
  10    -11.0248826 -0.445675E-09  0.256E-04    7.12     174.8  T

   *** convergence criteria satisfied after 10 iterations ***

         #    Occupation            Energy/Eh            Energy/eV
      -------------------------------------------------------------
         1        2.0000           -0.7646913             -20.8083
       ...           ...                  ...                  ...
         4        2.0000           -0.6404771             -17.4283
         5        2.0000           -0.6051904             -16.4681
         6        2.0000           -0.5354284             -14.5697
         7        2.0000           -0.4991970             -13.5838
         8        2.0000           -0.4608414             -12.5401
         9        1.0000           -0.3913832             -10.6501
        10        1.0000           -0.3099733              -8.4348 (HOMO)
        11                         -0.0484177              -1.3175 (LUMO)
        12                          0.0764671               2.0808
        13                          0.1089949               2.9659
        14                          0.1572551               4.2791
      -------------------------------------------------------------
                  HL-Gap            0.2615556 Eh            7.1173 eV
             Fermi-level           -0.3026539 Eh           -8.2356 eV

 transition dipole moment (au) for excitation:           9          10
     X       Y       Z   
   0.0814  -0.2075  -0.1321  total (au/Debye):    0.259   0.659
 dE (eV)             :    2.215
 oscillator strength :  0.51536E-02

 SCC (total)                   0 d,  0 h,  0 min,  0.003 sec
 SCC setup                      ...        0 min,  0.000 sec (  4.934%)
 Dispersion                     ...        0 min,  0.000 sec (  1.285%)
 integral evaluation            ...        0 min,  0.001 sec ( 21.486%)
 zeroth order Hamiltonian       ...        0 min,  0.000 sec (  0.494%)
 iterations                     ...        0 min,  0.001 sec ( 29.772%)
 molecular gradient             ...        0 min,  0.001 sec ( 20.714%)
 printout                       ...        0 min,  0.001 sec ( 21.028%)

         :::::::::::::::::::::::::::::::::::::::::::::::::::::
         ::                     SUMMARY                     ::
         :::::::::::::::::::::::::::::::::::::::::::::::::::::
         :: total energy             -10.987285387297 Eh    ::
         :: gradient norm              0.137224385108 Eh/a0 ::
         :: HOMO-LUMO gap              7.117290373352 eV    ::
         ::.................................................::
         :: SCC energy               -11.024882606144 Eh    ::
         :: -> isotropic ES            0.017813440362 Eh    ::
         :: -> anisotropic ES          0.000419532108 Eh    ::
         :: -> anisotropic XC         -0.009447299776 Eh    ::
         :: -> dispersion             -0.001166608446 Eh    ::
         :: repulsion energy           0.037597243599 Eh    ::
         :: add. restraining           0.000000000000 Eh    ::
         :::::::::::::::::::::::::::::::::::::::::::::::::::::

      ----------------------------------------------------------- 
     |                   =====================                   |
     |                        A N C O P T                        |
     |                   =====================                   |
     |               Approximate Normal Coordinate               |
     |                Rational Function Optimizer                |
      ----------------------------------------------------------- 

          ...................................................
          :                      SETUP                      :
          :.................................................:
          :   optimization level            normal          :
          :   max. optcycles                   200          :
          :   ANC micro-cycles                  20          :
          :   degrees of freedom                 9          :
          :.................................................:
          :   RF solver                   davidson          :
          :   write xtbopt.log                true          :
          :   linear?                        false          :
          :   energy convergence         0.5000000E-05 Eh   :
          :   grad. convergence          0.1000000E-02 Eh/α :
          :   maximium RF displ.         1.0000000          :
          :   Hlow (freq-cutoff)         0.1000000E-01      :
          :   Hmax (freq-cutoff)         5.0000000          :
          :   S6 in model hess.         20.0000000          :
          ...................................................

generating ANC from model Hessian ...
Using Lindh-Hessian (1995)
 Shifting diagonal of input Hessian by    0.0000000000000000     
 Lowest  eigenvalues of input Hessian
   -0.000000   -0.000000   -0.000000   -0.000000    0.000000    0.000000
    0.013170    0.031723    0.098534    0.168818    0.288594    0.845443
    1.168837    1.244896    1.601323
 Highest eigenvalues
    0.168818    0.288594    0.845443    1.168837    1.244896    1.601323


........................................................................
.............................. CYCLE    1 ..............................
........................................................................
   1    -11.0248826 -0.110249E+02  0.672E-05    7.12       0.0  T
   2    -11.0248826 -0.213340E-11  0.453E-05    7.12     986.6  T
   3    -11.0248826 -0.198774E-11  0.111E-05    7.12    4039.3  T
     SCC iter.                  ...        0 min,  0.000 sec
     gradient                   ...        0 min,  0.001 sec
 * total energy  :   -10.9872854 Eh     change        0.2012461E-08 Eh
   gradient norm :     0.1372243 Eh/α   predicted     0.0000000E+00 (-100.00%)
   displ. norm   :     0.2311363 α      lambda       -0.1997195E-01
   maximum displ.:     0.1494667 α      in ANC's #4, #3, #6, ...

........................................................................
.............................. CYCLE    2 ..............................
........................................................................
   1    -11.0441663 -0.110442E+02  0.603E-01    4.90       0.0  T
   2    -11.0442520 -0.857405E-04  0.366E-01    4.89       1.0  T
   3    -11.0442637 -0.116442E-04  0.867E-02    4.93       1.0  T
   4    -11.0442678 -0.408845E-05  0.226E-02    4.91       2.0  T
   5    -11.0442684 -0.651281E-06  0.592E-03    4.91       7.5  T
   6    -11.0442684 -0.116053E-07  0.219E-03    4.91      20.4  T
   7    -11.0442684 -0.243154E-08  0.466E-04    4.91      96.0  T
   8    -11.0442684 -0.273111E-09  0.243E-04    4.91     183.9  T
     SCC iter.                  ...        0 min,  0.000 sec
     gradient                   ...        0 min,  0.001 sec
 * total energy  :   -11.0009659 Eh     change       -0.1368056E-01 Eh
   gradient norm :     0.0588081 Eh/α   predicted    -0.1051947E-01 ( -23.11%)
   displ. norm   :     0.1362840 α      lambda       -0.5719304E-02
   maximum displ.:     0.0857169 α      in ANC's #4, #6, #9, ...

........................................................................
.............................. CYCLE    3 ..............................
........................................................................
   1    -11.0544280 -0.110544E+02  0.461E-01    3.65       0.0  T
   2    -11.0544788 -0.507666E-04  0.279E-01    3.63       1.0  T
   3    -11.0544857 -0.691891E-05  0.675E-02    3.66       1.0  T
   4    -11.0544880 -0.224323E-05  0.173E-02    3.64       2.6  T
   5    -11.0544883 -0.322958E-06  0.458E-03    3.64       9.8  T
   6    -11.0544883 -0.737985E-08  0.172E-03    3.64      26.0  T
   7    -11.0544883 -0.112465E-08  0.311E-04    3.64     143.7  T
   8    -11.0544883 -0.111513E-09  0.155E-04    3.64     289.4  T
     SCC iter.                  ...        0 min,  0.001 sec
     gradient                   ...        0 min,  0.001 sec
 * total energy  :   -11.0043647 Eh     change       -0.3398728E-02 Eh
   gradient norm :     0.0153127 Eh/α   predicted    -0.2912767E-02 ( -14.30%)
   displ. norm   :     0.1418283 α      lambda       -0.6856234E-03
   maximum displ.:     0.1323619 α      in ANC's #1, #3, #4, ...

........................................................................
.............................. CYCLE    4 ..............................
........................................................................
   1    -11.0554919 -0.110555E+02  0.385E-01    3.25       0.0  T
   2    -11.0554986 -0.667129E-05  0.237E-01    3.27       1.0  T
   3    -11.0555008 -0.224899E-05  0.157E-02    3.27       2.8  T
   4    -11.0555010 -0.163887E-06  0.726E-03    3.27       6.2  T
   5    -11.0555010 -0.169475E-07  0.282E-03    3.27      15.8  T
   6    -11.0555010 -0.591959E-08  0.101E-03    3.27      44.3  T
   7    -11.0555010 -0.115463E-08  0.342E-04    3.27     131.0  T
   8    -11.0555010 -0.198831E-09  0.113E-04    3.27     394.4  T
     SCC iter.                  ...        0 min,  0.001 sec
     gradient                   ...        0 min,  0.001 sec
 * total energy  :   -11.0051042 Eh     change       -0.7394847E-03 Eh
   gradient norm :     0.0112864 Eh/α   predicted    -0.3497072E-03 ( -52.71%)
   displ. norm   :     0.3379817 α      lambda       -0.1884275E-02
   maximum displ.:     0.3339728 α      in ANC's #1, #2, #6, ...

........................................................................
.............................. CYCLE    5 ..............................
........................................................................
   1    -11.0532985 -0.110533E+02  0.935E-01    3.19       0.0  T
   2    -11.0534976 -0.199098E-03  0.555E-01    3.32       1.0  T
   3    -11.0534845  0.130308E-04  0.158E-01    3.27       1.0  T
   4    -11.0535265 -0.419919E-04  0.247E-02    3.31       1.8  T
   5    -11.0535268 -0.324375E-06  0.131E-02    3.31       3.4  T
   6    -11.0535270 -0.126152E-06  0.327E-03    3.31      13.7  T
   7    -11.0535270 -0.176917E-07  0.137E-03    3.31      32.7  T
   8    -11.0535270 -0.288612E-08  0.415E-04    3.31     107.9  T
   9    -11.0535270 -0.539849E-09  0.117E-04    3.31     381.0  T
     SCC iter.                  ...        0 min,  0.001 sec
     gradient                   ...        0 min,  0.001 sec
 * total energy  :   -11.0077093 Eh     change       -0.2605129E-02 Eh
   gradient norm :     0.0388399 Eh/α   predicted    -0.1049762E-02 ( -59.70%)
   displ. norm   :     0.3349997 α      lambda       -0.4319540E-02
   maximum displ.:     0.3259285 α      in ANC's #1, #6, #5, ...

........................................................................
.............................. CYCLE    6 ..............................
........................................................................
   1    -11.0545860 -0.110546E+02  0.103E+00    3.14       0.0  T
   2    -11.0554741 -0.888064E-03  0.574E-01    3.39       1.0  T
   3    -11.0555929 -0.118836E-03  0.348E-01    3.27       1.0  T
   4    -11.0557320 -0.139081E-03  0.323E-02    3.33       1.4  T
   5    -11.0557324 -0.431943E-06  0.162E-02    3.33       2.8  T
   6    -11.0557325 -0.113762E-06  0.329E-03    3.33      13.6  T
   7    -11.0557326 -0.143828E-07  0.131E-03    3.33      34.0  T
   8    -11.0557326 -0.243896E-08  0.592E-04    3.33      75.6  T
   9    -11.0557326 -0.752610E-09  0.160E-04    3.33     280.0  T
     SCC iter.                  ...        0 min,  0.001 sec
     gradient                   ...        0 min,  0.001 sec
 * total energy  :   -11.0119864 Eh     change       -0.4277144E-02 Eh
   gradient norm :     0.0595258 Eh/α   predicted    -0.2402149E-02 ( -43.84%)
   displ. norm   :     0.8381330 α      lambda       -0.1619490E-01
   maximum displ.:     0.7762327 α      in ANC's #1, #6, #5, ...

........................................................................
.............................. CYCLE    7 ..............................
........................................................................
   1    -11.0376592 -0.110377E+02  0.314E+00    3.25       0.0  T
   2    -11.0431300 -0.547082E-02  0.210E+00    3.70       1.0  T
   3    -11.0586328 -0.155028E-01  0.125E+00    3.41       1.0  T
   4    -11.0609654 -0.233264E-02  0.117E-01    3.50       1.0  T
   5    -11.0609938 -0.283301E-04  0.494E-02    3.49       1.0  T
   6    -11.0609940 -0.224463E-06  0.138E-02    3.49       3.2  T
   7    -11.0609947 -0.686959E-06  0.496E-03    3.49       9.0  T
   8    -11.0609947 -0.575954E-07  0.219E-03    3.49      20.5  T
   9    -11.0609948 -0.920771E-08  0.608E-04    3.49      73.6  T
  10    -11.0609948 -0.755080E-09  0.116E-04    3.49     386.6  T
     SCC iter.                  ...        0 min,  0.001 sec
     gradient                   ...        0 min,  0.001 sec
 * total energy  :   -11.0153367 Eh     change       -0.3350311E-02 Eh
   gradient norm :     0.0843157 Eh/α   predicted    -0.1378563E-01 ( 311.47%)
   displ. norm   :     0.4084013 α      lambda       -0.2240153E-01
   maximum displ.:     0.3326877 α      in ANC's #1, #6, #2, ...

........................................................................
.............................. CYCLE    8 ..............................
........................................................................
   1    -11.0942633 -0.110943E+02  0.888E-01    3.07       0.0  T
   2    -11.0945227 -0.259354E-03  0.566E-01    3.10       1.0  T
   3    -11.0944937  0.289871E-04  0.176E-01    3.08       1.0  T
   4    -11.0945837 -0.900435E-04  0.102E-01    3.11       1.0  T
   5    -11.0946111 -0.273412E-04  0.257E-02    3.09       1.7  T
   6    -11.0946120 -0.925184E-06  0.993E-03    3.09       4.5  T
   7    -11.0946122 -0.188724E-06  0.374E-03    3.09      12.0  T
   8    -11.0946122 -0.143214E-07  0.813E-04    3.09      55.0  T
   9    -11.0946122 -0.173954E-08  0.259E-04    3.09     172.7  T
     SCC iter.                  ...        0 min,  0.001 sec
     gradient                   ...        0 min,  0.001 sec
 * total energy  :   -11.0279673 Eh     change       -0.1263059E-01 Eh
   gradient norm :     0.0348395 Eh/α   predicted    -0.1306896E-01 (   3.47%)
   displ. norm   :     0.3736119 α      lambda       -0.6633933E-02
   maximum displ.:     0.3426770 α      in ANC's #2, #1, #3, ...

........................................................................
.............................. CYCLE    9 ..............................
........................................................................
   1    -11.0895471 -0.110895E+02  0.116E+00    2.72       0.0  T
   2    -11.0896992 -0.152060E-03  0.712E-01    2.71       1.0  T
   3    -11.0897225 -0.233828E-04  0.903E-02    2.71       1.0  T
   4    -11.0897244 -0.181595E-05  0.316E-02    2.71       1.4  T
   5    -11.0897252 -0.799561E-06  0.209E-02    2.71       2.1  T
   6    -11.0897264 -0.123141E-05  0.752E-03    2.71       5.9  T
   7    -11.0897265 -0.715835E-07  0.196E-03    2.71      22.8  T
   8    -11.0897265 -0.594942E-08  0.451E-04    2.71      99.2  T
   9    -11.0897265 -0.441354E-09  0.137E-04    2.71     325.5  T
     SCC iter.                  ...        0 min,  0.001 sec
     gradient                   ...        0 min,  0.001 sec
 * total energy  :   -11.0304015 Eh     change       -0.2434162E-02 Eh
   gradient norm :     0.0554483 Eh/α   predicted    -0.3779966E-02 (  55.29%)
   displ. norm   :     0.1904113 α      lambda       -0.3975193E-02
   maximum displ.:     0.1674253 α      in ANC's #1, #6, #9, ...

........................................................................
.............................. CYCLE   10 ..............................
........................................................................
   1    -11.0917504 -0.110918E+02  0.781E-01    2.50       0.0  T
   2    -11.0921946 -0.444160E-03  0.480E-01    2.60       1.0  T
   3    -11.0930140 -0.819432E-03  0.296E-01    2.53       1.0  T
   4    -11.0931297 -0.115732E-03  0.281E-02    2.54       1.6  T
   5    -11.0931299 -0.179677E-06  0.118E-02    2.54       3.8  T
   6    -11.0931300 -0.466967E-07  0.253E-03    2.54      17.7  T
   7    -11.0931300 -0.561960E-08  0.669E-04    2.54      66.8  T
   8    -11.0931300 -0.720764E-09  0.328E-04    2.54     136.3  T
     SCC iter.                  ...        0 min,  0.000 sec
     gradient                   ...        0 min,  0.001 sec
 * total energy  :   -11.0321431 Eh     change       -0.1741621E-02 Eh
   gradient norm :     0.0326327 Eh/α   predicted    -0.2059658E-02 (  18.26%)
   displ. norm   :     0.0604489 α      lambda       -0.1568970E-02
   maximum displ.:     0.0380083 α      in ANC's #3, #9, #6, ...

........................................................................
.............................. CYCLE   11 ..............................
........................................................................
   1    -11.1017714 -0.111018E+02  0.210E-01    2.46       0.0  T
   2    -11.1018302 -0.588151E-04  0.152E-01    2.49       1.0  T
   3    -11.1019114 -0.812584E-04  0.672E-02    2.47       1.0  T
   4    -11.1019147 -0.323025E-05  0.220E-02    2.48       2.0  T
   5    -11.1019149 -0.198589E-06  0.578E-03    2.48       7.7  T
   6    -11.1019149 -0.195355E-07  0.168E-03    2.47      26.6  T
   7    -11.1019149 -0.106744E-08  0.194E-04    2.47     230.6  T
   8    -11.1019149 -0.167795E-10  0.131E-04    2.47     341.4  T
     SCC iter.                  ...        0 min,  0.001 sec
     gradient                   ...        0 min,  0.001 sec
 * total energy  :   -11.0330828 Eh     change       -0.9397145E-03 Eh
   gradient norm :     0.0181007 Eh/α   predicted    -0.7873533E-03 ( -16.21%)
   displ. norm   :     0.1875315 α      lambda       -0.1361553E-02
   maximum displ.:     0.1579629 α      in ANC's #2, #1, #3, ...

........................................................................
.............................. CYCLE   12 ..............................
........................................................................
   1    -11.1022970 -0.111023E+02  0.540E-01    2.30       0.0  T
   2    -11.1023681 -0.711013E-04  0.362E-01    2.33       1.0  T
   3    -11.1023942 -0.260339E-04  0.232E-01    2.30       1.0  T
   4    -11.1025137 -0.119566E-03  0.198E-02    2.31       2.3  T
   5    -11.1025141 -0.346291E-06  0.896E-03    2.31       5.0  T
   6    -11.1025142 -0.750446E-07  0.417E-03    2.31      10.7  T
   7    -11.1025142 -0.270978E-07  0.109E-03    2.31      40.9  T
   8    -11.1025142 -0.149644E-08  0.172E-04    2.31     259.4  T
   9    -11.1025142 -0.214708E-10  0.727E-05    2.31     614.7  T
     SCC iter.                  ...        0 min,  0.000 sec
     gradient                   ...        0 min,  0.001 sec
 * total energy  :   -11.0339397 Eh     change       -0.8568381E-03 Eh
   gradient norm :     0.0167930 Eh/α   predicted    -0.7047164E-03 ( -17.75%)
   displ. norm   :     0.1262181 α      lambda       -0.6700077E-03
   maximum displ.:     0.0871732 α      in ANC's #2, #1, #9, ...

........................................................................
.............................. CYCLE   13 ..............................
........................................................................
   1    -11.1026228 -0.111026E+02  0.383E-01    2.22       0.0  T
   2    -11.1026912 -0.684096E-04  0.254E-01    2.25       1.0  T
   3    -11.1028160 -0.124840E-03  0.160E-01    2.23       1.0  T
   4    -11.1028494 -0.333984E-04  0.134E-02    2.24       3.3  T
   5    -11.1028496 -0.119277E-06  0.870E-03    2.24       5.1  T
   6    -11.1028497 -0.100656E-06  0.206E-03    2.24      21.7  T
   7    -11.1028497 -0.617717E-08  0.654E-04    2.24      68.3  T
   8    -11.1028497 -0.463789E-09  0.860E-05    2.24     520.3  T
     SCC iter.                  ...        0 min,  0.000 sec
     gradient                   ...        0 min,  0.001 sec
 * total energy  :   -11.0343837 Eh     change       -0.4440010E-03 Eh
   gradient norm :     0.0108576 Eh/α   predicted    -0.3403416E-03 ( -23.35%)
   displ. norm   :     0.0617960 α      lambda       -0.2210830E-03
   maximum displ.:     0.0384139 α      in ANC's #2, #1, #9, ...

........................................................................
.............................. CYCLE   14 ..............................
........................................................................
   1    -11.1046737 -0.111047E+02  0.225E-01    2.19       0.0  T
   2    -11.1047052 -0.314751E-04  0.149E-01    2.20       1.0  T
   3    -11.1047558 -0.505524E-04  0.903E-02    2.19       1.0  T
   4    -11.1047651 -0.935208E-05  0.861E-03    2.20       5.2  T
   5    -11.1047651 -0.341622E-07  0.479E-03    2.20       9.3  T
   6    -11.1047652 -0.243796E-07  0.101E-03    2.20      44.2  T
   7    -11.1047652 -0.151511E-08  0.339E-04    2.20     131.8  T
   8    -11.1047652 -0.154275E-09  0.680E-05    2.20     657.4  T
     SCC iter.                  ...        0 min,  0.000 sec
     gradient                   ...        0 min,  0.001 sec
 * total energy  :   -11.0345183 Eh     change       -0.1346717E-03 Eh
   gradient norm :     0.0032667 Eh/α   predicted    -0.1109621E-03 ( -17.61%)
   displ. norm   :     0.0523436 α      lambda       -0.5875211E-04
   maximum displ.:     0.0409609 α      in ANC's #2, #1, #9, ...

........................................................................
.............................. CYCLE   15 ..............................
........................................................................
   1    -11.1046888 -0.111047E+02  0.168E-01    2.14       0.0  T
   2    -11.1046977 -0.893761E-05  0.113E-01    2.15       1.0  T
   3    -11.1047072 -0.947062E-05  0.724E-02    2.14       1.0  T
   4    -11.1047161 -0.887519E-05  0.537E-03    2.14       8.3  T
   5    -11.1047161 -0.197279E-07  0.166E-03    2.14      26.9  T
   6    -11.1047161 -0.316626E-08  0.785E-04    2.14      56.9  T
   7    -11.1047161 -0.925054E-09  0.269E-04    2.14     166.5  T
     SCC iter.                  ...        0 min,  0.000 sec
     gradient                   ...        0 min,  0.001 sec
 * total energy  :   -11.0345485 Eh     change       -0.3019526E-04 Eh
   gradient norm :     0.0028520 Eh/α   predicted    -0.2945735E-04 (  -2.44%)
   displ. norm   :     0.0127232 α      lambda       -0.2742933E-04
   maximum displ.:     0.0071125 α      in ANC's #9, #1, #5, ...

........................................................................
.............................. CYCLE   16 ..............................
........................................................................
   1    -11.1055195 -0.111055E+02  0.410E-02    2.12       0.0  T
   2    -11.1055208 -0.127696E-05  0.287E-02    2.13       1.6  T
   3    -11.1055224 -0.159558E-05  0.165E-02    2.12       2.7  T
   4    -11.1055226 -0.265989E-06  0.307E-03    2.12      14.6  T
   5    -11.1055226 -0.385551E-08  0.101E-03    2.12      44.1  T
   6    -11.1055226 -0.448132E-09  0.321E-04    2.12     139.5  T
   7    -11.1055226 -0.301306E-10  0.289E-05    2.12    1546.7  T
     SCC iter.                  ...        0 min,  0.000 sec
     gradient                   ...        0 min,  0.001 sec
 * total energy  :   -11.0345621 Eh     change       -0.1355190E-04 Eh
   gradient norm :     0.0024450 Eh/α   predicted    -0.1371737E-04 (   1.22%)
   displ. norm   :     0.0049219 α      lambda       -0.6190128E-05
   maximum displ.:     0.0030422 α      in ANC's #5, #1, #7, ...

........................................................................
.............................. CYCLE   17 ..............................
........................................................................
   1    -11.1054990 -0.111055E+02  0.798E-03    2.12       0.0  T
   2    -11.1054990 -0.977607E-08  0.491E-03    2.12       9.1  T
   3    -11.1054990  0.946985E-09  0.133E-03    2.12      33.6  T
   4    -11.1054990 -0.581721E-08  0.599E-04    2.12      74.7  T
   5    -11.1054990 -0.703634E-09  0.342E-04    2.12     130.9  T
     SCC iter.                  ...        0 min,  0.000 sec
     gradient                   ...        0 min,  0.001 sec
 * total energy  :   -11.0345673 Eh     change       -0.5200118E-05 Eh
   gradient norm :     0.0017400 Eh/α   predicted    -0.3095785E-05 ( -40.47%)
   displ. norm   :     0.0270403 α      lambda       -0.1476391E-04
   maximum displ.:     0.0152866 α      in ANC's #1, #5, #7, ...

........................................................................
.............................. CYCLE   18 ..............................
........................................................................
   1    -11.1051405 -0.111051E+02  0.440E-02    2.12       0.0  T
   2    -11.1051408 -0.298353E-06  0.266E-02    2.12       1.7  T
   3    -11.1051407  0.707353E-07  0.776E-03    2.12       5.8  T
   4    -11.1051409 -0.171778E-06  0.358E-03    2.12      12.5  T
   5    -11.1051409 -0.361532E-07  0.176E-03    2.12      25.5  T
   6    -11.1051410 -0.367984E-08  0.391E-04    2.12     114.5  T
   7    -11.1051410 -0.206105E-09  0.100E-04    2.12     446.1  T
     SCC iter.                  ...        0 min,  0.000 sec
     gradient                   ...        0 min,  0.001 sec
 * total energy  :   -11.0345763 Eh     change       -0.8966647E-05 Eh
   gradient norm :     0.0012528 Eh/α   predicted    -0.7383791E-05 ( -17.65%)
   displ. norm   :     0.0064564 α      lambda       -0.3495733E-05
   maximum displ.:     0.0050328 α      in ANC's #3, #4, #1, ...

........................................................................
.............................. CYCLE   19 ..............................
........................................................................
   1    -11.1052861 -0.111053E+02  0.176E-02    2.12       0.0  T
   2    -11.1052863 -0.160648E-06  0.107E-02    2.12       4.2  T
   3    -11.1052865 -0.260229E-06  0.708E-03    2.12       6.3  T
   4    -11.1052866 -0.672781E-07  0.598E-04    2.12      74.7  T
   5    -11.1052866 -0.113648E-09  0.164E-04    2.12     271.9  T
     SCC iter.                  ...        0 min,  0.000 sec
     gradient                   ...        0 min,  0.001 sec
 * total energy  :   -11.0345804 Eh     change       -0.4139389E-05 Eh
   gradient norm :     0.0006127 Eh/α   predicted    -0.1748822E-05 ( -57.75%)
   displ. norm   :     0.0166180 α      lambda       -0.5439324E-05
   maximum displ.:     0.0115067 α      in ANC's #4, #3, #2, ...

   *** GEOMETRY OPTIMIZATION CONVERGED AFTER 19 ITERATIONS ***

------------------------------------------------------------------------
 total energy gain   :        -0.0472950 Eh      -29.6781 kcal/mol
 total RMSD          :         0.9399593 a0        0.4974 Å
 total power (kW/mol):        -6.5354218 (step)-3436.5267 (real)
------------------------------------------------------------------------

 ANCopt (total)                0 d,  0 h,  0 min,  0.036 sec
 optimizer setup                ...        0 min,  0.000 sec (  0.156%)
 model hessian                  ...        0 min,  0.000 sec (  0.196%)
 ANC generation                 ...        0 min,  0.000 sec (  0.119%)
 coordinate transformation      ...        0 min,  0.000 sec (  0.094%)
 single point calculation       ...        0 min,  0.034 sec ( 95.214%)
 optimization log               ...        0 min,  0.001 sec (  1.457%)
 hessian update                 ...        0 min,  0.000 sec (  0.103%)
 rational function              ...        0 min,  0.000 sec (  1.145%)

================
 final structure:
================
5
 xtb: 6.2.2 (9d81278992624c895f80dd42a50cac0aa55982e2)
O         0.03008043785160   -0.13930363858882   -0.54693523395467
C        -1.12617541770420   -0.40177101497172   -0.33036294154800
O         1.11068301209431    0.21027261064295    0.83068885229778
H        -1.96566105726968    0.29719854367464   -0.35239123619688
H         1.95107302502798    0.03360249924295    0.39900055940177

 Bond Distances (Angstroems)
 ---------------------------
O1-C2=1.2053         C2-O1=1.2053         C2-H4=1.0926         O3-H5=0.9612         H4-C2=1.0926         H5-O3=0.9612         
 C  H  Rav=1.0926 sigma=0.0000  Rmin=1.0926  Rmax=1.0926     1
 O  H  Rav=0.9612 sigma=0.0000  Rmin=0.9612  Rmax=0.9612     1
 O  C  Rav=1.2053 sigma=0.0000  Rmin=1.2053  Rmax=1.2053     1

 selected bond angles (degree)
 --------------------
H4-C2-O1=126.45                

 selected dihedral angles (degree)
 ---------------------------------

           -------------------------------------------------
          |                Final Singlepoint                |
           -------------------------------------------------

          ...................................................
          :                      SETUP                      :
          :.................................................:
          :  # basis functions                  14          :
          :  # atomic orbitals                  14          :
          :  # shells                            8          :
          :  # electrons                        18          :
          :  max. iterations                   250          :
          :  Hamiltonian                  GFN2-xTB          :
          :  restarted?                      false          :
          :  GBSA solvation                  false          :
          :  PC potential                    false          :
          :  electronic temp.          300.0000000     K    :
          :  accuracy                    1.0000000          :
          :  -> integral cutoff          0.2500000E+02      :
          :  -> integral neglect         0.1000000E-07      :
          :  -> SCF convergence          0.1000000E-05 Eh   :
          :  -> wf. convergence          0.1000000E-03 e    :
          :  Broyden damping             0.4000000          :
          ...................................................

 iter      E             dE          RMSdq      gap      omega  full diag
   1    -11.1052866 -0.111053E+02  0.436E-05    2.12       0.0  T
   2    -11.1052866 -0.195755E-11  0.282E-05    2.12    1585.1  T
   3    -11.1052866 -0.451195E-12  0.174E-05    2.12    2575.9  T

   *** convergence criteria satisfied after 3 iterations ***

         #    Occupation            Energy/Eh            Energy/eV
      -------------------------------------------------------------
         1        2.0000           -0.7589153             -20.6511
       ...           ...                  ...                  ...
         4        2.0000           -0.5986232             -16.2894
         5        2.0000           -0.5905127             -16.0687
         6        2.0000           -0.5489844             -14.9386
         7        2.0000           -0.5292155             -14.4007
         8        2.0000           -0.4647623             -12.6468
         9        1.0000           -0.4156305             -11.3099
        10        1.0000           -0.3453539              -9.3976 (HOMO)
        11                         -0.2675890              -7.2815 (LUMO)
        12                          0.1530905               4.1658
        13                          0.1573353               4.2813
        14                          0.5440481              14.8043
      -------------------------------------------------------------
                  HL-Gap            0.0777649 Eh            2.1161 eV
             Fermi-level           -0.3733339 Eh          -10.1589 eV

 transition dipole moment (au) for excitation:           9          10
     X       Y       Z   
  -0.0253  -0.0251  -0.1076  total (au/Debye):    0.113   0.288
 dE (eV)             :    1.912
 oscillator strength :  0.85080E-03

 SCC (total)                   0 d,  0 h,  0 min,  0.003 sec
 SCC setup                      ...        0 min,  0.000 sec (  1.407%)
 Dispersion                     ...        0 min,  0.000 sec (  0.238%)
 integral evaluation            ...        0 min,  0.001 sec ( 20.698%)
 zeroth order Hamiltonian       ...        0 min,  0.000 sec (  0.338%)
 iterations                     ...        0 min,  0.000 sec (  6.781%)
 molecular gradient             ...        0 min,  0.001 sec ( 31.929%)
 printout                       ...        0 min,  0.001 sec ( 38.372%)

         :::::::::::::::::::::::::::::::::::::::::::::::::::::
         ::                     SUMMARY                     ::
         :::::::::::::::::::::::::::::::::::::::::::::::::::::
         :: total energy             -11.034580388736 Eh    ::
         :: gradient norm              0.000833854697 Eh/a0 ::
         :: HOMO-LUMO gap              2.116090111269 eV    ::
         ::.................................................::
         :: SCC energy               -11.105286610512 Eh    ::
         :: -> isotropic ES            0.026419769939 Eh    ::
         :: -> anisotropic ES         -0.004435052365 Eh    ::
         :: -> anisotropic XC          0.000993337733 Eh    ::
         :: -> dispersion             -0.001155496261 Eh    ::
         :: repulsion energy           0.070706268924 Eh    ::
         :: add. restraining           0.000000000000 Eh    ::
         :::::::::::::::::::::::::::::::::::::::::::::::::::::

           ------------------------------------------------- 
          |                Numerical Hessian                |
           ------------------------------------------------- 
step length          :   0.00500
SCC accuracy         :   0.30000
Hessian scale factor :   1.00000
frozen atoms in %    :   0.00000    0
RMS gradient         :   0.00083
estimated CPU  time      0.00 min
estimated wall time      0.00 min

writing file <hessian>.

 projected vibrational frequencies (cm-1)
eigval :       -0.00    -0.00    -0.00     0.00     0.00     0.00
eigval :      186.00   244.14   330.73   614.74   783.32  1012.92
eigval :     1706.84  2822.22  3611.97
           -------------------------------------------------
          |                Property Printout                |
           -------------------------------------------------

    * Orbital Energies and Occupations

         #    Occupation            Energy/Eh            Energy/eV
      -------------------------------------------------------------
         1        2.0000           -0.7589153             -20.6511
         2        2.0000           -0.6839518             -18.6113
         3        2.0000           -0.6424563             -17.4821
         4        2.0000           -0.5986231             -16.2894
         5        2.0000           -0.5905127             -16.0687
         6        2.0000           -0.5489843             -14.9386
         7        2.0000           -0.5292155             -14.4007
         8        2.0000           -0.4647621             -12.6468
         9        1.0000           -0.4156305             -11.3099
        10        1.0000           -0.3453540              -9.3976 (HOMO)
        11                         -0.2675891              -7.2815 (LUMO)
        12                          0.1530906               4.1658
        13                          0.1573352               4.2813
        14                          0.5440480              14.8043
      -------------------------------------------------------------
                  HL-Gap            0.0777650 Eh            2.1161 eV
             Fermi-level           -0.3733339 Eh          -10.1589 eV

     #   Z        covCN         q      C6AA      α(0)
     1   8 O      1.104    -0.102    16.452     5.444
     2   6 C      1.780     0.091    28.951     8.698
     3   8 O      1.053    -0.403    21.635     6.241
     4   1 H      0.924     0.099     1.791     2.093
     5   1 H      0.805     0.314     0.679     1.294

 Mol. C6AA /au·bohr⁶  :        261.716648
 Mol. C8AA /au·bohr⁸  :       5660.311958
 Mol. α(0) /au        :         23.769136


Wiberg/Mayer (AO) data.
largest (>0.10) Wiberg bond orders for each atom
          total WBO             WBO to atom ...
     1  O   2.168        C    2 1.818    O    3 0.341
     2  C   2.733        O    1 1.818    H    4 0.887
     3  O   1.272        H    5 0.899    O    1 0.341
     4  H   0.900        C    2 0.887
     5  H   0.901        O    3 0.899

MOs/occ written to file <molden.input>


molecular dipole:
                 x           y           z       tot (Debye)
 q only:       -0.254      -0.126      -0.412
   full:       -0.130       0.038      -0.506       1.332
molecular quadrupole (traceless):
                xx          xy          yy          xz          yz          zz
 q only:        4.698      -0.482      -1.706      -0.120      -0.387      -2.992
  q+dip:        6.000      -1.938      -1.911      -0.377      -0.833      -4.090
   full:        5.452      -1.737      -2.396       0.062      -0.471      -3.055

           -------------------------------------------------
          |                Geometry Summary                 |
           -------------------------------------------------

      molecular mass/u    :       46.0254272
   center of mass at/Å    :        0.1023482      -0.0729314       0.0134481
  moments of inertia/u·Å² :        0.6676410E+01   0.5645150E+02   0.6177262E+02
rotational constants/cm⁻¹ :        0.2524955E+01   0.2986215E+00   0.2728981E+00

 * 1 selected distances

     #   Z        #   Z                                     value/Å
     1   8 O      2   6 C                                 1.2052885 (max)

 * 1 distinct bonds (by element types)

   Z      Z             #   av. dist./Å        max./Å        min./Å
   6 C    8 O           1     1.2052885     1.2052885     1.2052885

           -------------------------------------------------
          |               Frequency Printout                |
           -------------------------------------------------
 projected vibrational frequencies (cm-1)
eigval :       -0.00    -0.00    -0.00     0.00     0.00     0.00
eigval :      186.00   244.14   330.73   614.74   783.32  1012.92
eigval :     1706.84  2822.22  3611.97
 reduced masses (amu)
   1: 13.60   2: 10.95   3: 14.39   4: 13.22   5: 15.24   6: 13.02   7:  2.73   8: 13.10
   9: 14.14  10:  4.86  11:  2.19  12:  3.54  13: 13.45  14:  1.76  15:  1.89
 IR intensities (amu)
   1:  0.17   2:  0.17   3:  0.04   4:  0.17   5:  0.40   6:  0.21   7:  0.54   8:  0.50
   9:  0.48  10:  0.20  11:  0.45  12:  0.24  13:  0.57  14:  0.20  15:  0.32
 Raman intensities (amu)
   1:  0.00   2:  0.00   3:  0.00   4:  0.00   5:  0.00   6:  0.00   7:  0.00   8:  0.00
   9:  0.00  10:  0.00  11:  0.00  12:  0.00  13:  0.00  14:  0.00  15:  0.00
 output can be read by thermo (or use thermo option).
 writing <g98.out> molden fake output.
Molecule has no symmetry elements
It seems to be the C1 point group
 recommended (thermochemical) frequency scaling factor: 1.0
           -------------------------------------------------
          |             Thermodynamic Functions             |
           -------------------------------------------------

c1  symmetry found (for desy threshold:  0.10E+00) used in thermo

          ...................................................
          :                      SETUP                      :
          :.................................................:
          :  # frequencies                           9      :
          :  # imaginary freq.                       0      :
          :  linear?                             false      :
          :  only rotor calc.                    false      :
          :  symmetry                               c1      :
          :  rotational number                       1      :
          :  scaling factor                  1.0000000      :
          :  rotor cutoff                   50.0000000 cm⁻¹ :
          :  imag. cutoff                  -20.0000000 cm⁻¹ :
          :.................................................:

    mode    ω/cm⁻¹     T·S(HO)/kcal·mol⁻¹    T·S(FR)/kcal·mol⁻¹   T·S(vib)
   ------------------------------------------------------------------------
       1    186.00    -0.00000 ( 99.48%)     0.01137 (  0.52%)     0.00006
       2    244.14    -0.00000 ( 99.82%)     0.01407 (  0.18%)     0.00002
   ------------------------------------------------------------------------

   temp. (K)  partition function   enthalpy   heat capacity  entropy
                                   cal/mol     cal/K/mol   cal/K/mol   J/K/mol
 298.15  VIB   3.33                 1087.745      7.325      6.037
         ROT  0.117E+05              888.752      2.981     21.589
         INT  0.388E+05             1976.498     10.305     27.626
         TR   0.302E+27             1481.254      4.968     37.388
         TOT                        3457.7516    15.2736    65.0137   272.0174

   temp. (K)  partition function   enthalpy   heat capacity  entropy
                                   cal/mol     cal/K/mol   cal/K/mol   J/K/mol
 120.00  VIB   1.21                  123.147      3.052      1.405
         ROT  0.298E+04              357.707      2.981     18.876
         INT  0.359E+04              480.854      6.033     20.281
         TR   0.771E+26              596.178      4.968     32.869
         TOT                        1077.0322    11.0009    53.1500   222.3796

   temp. (K)  partition function   enthalpy   heat capacity  entropy
                                   cal/mol     cal/K/mol   cal/K/mol   J/K/mol
 100.00  VIB   1.12                   69.231      2.325      0.916
         ROT  0.226E+04              298.089      2.981     18.332
         INT  0.253E+04              367.320      5.306     19.248
         TR   0.587E+26              496.815      4.968     31.963
         TOT                         864.1349    10.2741    51.2118   214.2702

   temp. (K)  partition function   enthalpy   heat capacity  entropy
                                   cal/mol     cal/K/mol   cal/K/mol   J/K/mol
  80.00  VIB   1.05                   30.697      1.518      0.489
         ROT  0.162E+04              238.471      2.981     17.667
         INT  0.170E+04              269.168      4.499     18.156
         TR   0.420E+26              397.452      4.968     30.855
         TOT                         666.6204     9.4668    49.0117   205.0651

   temp. (K)  partition function   enthalpy   heat capacity  entropy
                                   cal/mol     cal/K/mol   cal/K/mol   J/K/mol
  60.00  VIB   1.01                    8.568      0.709      0.176
         ROT  0.105E+04              178.853      2.981     16.810
         INT  0.107E+04              187.421      3.690     16.985
         TR   0.273E+26              298.089      4.968     29.427
         TOT                         485.5102     8.6584    46.4119   194.1875

   temp. (K)  partition function   enthalpy   heat capacity  entropy
                                   cal/mol     cal/K/mol   cal/K/mol   J/K/mol
  40.00  VIB   1.00                    0.775      0.136      0.023
         ROT   573.                  119.236      2.981     15.601
         INT   574.                  120.011      3.117     15.624
         TR   0.148E+26              198.726      4.968     27.413
         TOT                         318.7371     8.0853    43.0373   180.0680

   temp. (K)  partition function   enthalpy   heat capacity  entropy
                                   cal/mol     cal/K/mol   cal/K/mol   J/K/mol
  20.00  VIB   1.00                    0.001      0.001     -0.004
         ROT   203.                   59.618      2.981     13.535
         INT   203.                   59.619      2.981     13.531
         TR   0.525E+25               99.363      4.968     23.971
         TOT                         158.9816     7.9496    37.5019   156.9079

   temp. (K)  partition function   enthalpy   heat capacity  entropy
                                   cal/mol     cal/K/mol   cal/K/mol   J/K/mol
  10.00  VIB   1.00                    0.000      0.000     -0.009
         ROT   71.6                   29.809      2.981     11.469
         INT   71.6                   29.809      2.981     11.459
         TR   0.186E+25               49.681      4.968     20.529
         TOT                          79.4904     7.9490    31.9885   133.8398

       T/K    H(0)-H(T)+PV         H(T)/Eh          T*S/Eh         G(T)/Eh
   ------------------------------------------------------------------------
    298.15    0.551028E-02    0.312829E-01    0.308901E-01    0.392771E-03
    120.00    0.171636E-02    0.274890E-01    0.101640E-01    0.173250E-01
    100.00    0.137709E-02    0.271497E-01    0.816112E-02    0.189886E-01
     80.00    0.106233E-02    0.268349E-01    0.624841E-02    0.205865E-01
     60.00    0.773710E-03    0.265463E-01    0.443773E-02    0.221086E-01
     40.00    0.507940E-03    0.262805E-01    0.274337E-02    0.235372E-01
     20.00    0.253353E-03    0.260260E-01    0.119526E-02    0.248307E-01
     10.00    0.126676E-03    0.258993E-01    0.509769E-03    0.253895E-01 (used)
   ------------------------------------------------------------------------

         :::::::::::::::::::::::::::::::::::::::::::::::::::::
         ::                  THERMODYNAMIC                  ::
         :::::::::::::::::::::::::::::::::::::::::::::::::::::
         :: total free energy         -11.009190873633 Eh   ::
         ::.................................................::
         :: total energy              -11.034580388972 Eh   ::
         :: zero point energy           0.025772608268 Eh   ::
         :: G(RRHO) w/o ZPVE           -0.000383092929 Eh   ::
         :: G(RRHO) contrib.            0.025389515339 Eh   ::
         :::::::::::::::::::::::::::::::::::::::::::::::::::::

optimized geometry written to: xtbopt.xyz


           -------------------------------------------------
          | TOTAL ENERGY              -11.034580388972 Eh   |
          | TOTAL ENTHALPY            -11.008681104688 Eh   |
          | TOTAL FREE ENERGY         -11.009190873633 Eh   |
          | GRADIENT NORM               0.000833768015 Eh/α |
          | HOMO-LUMO GAP               2.116092091244 eV   |
           -------------------------------------------------

------------------------------------------------------------------------
 * finished run on 2020/05/12 at 11:43:53.199     
------------------------------------------------------------------------
 total:
 * wall-time:     0 d,  0 h,  0 min,  0.102 sec
 *  cpu-time:     0 d,  0 h,  0 min,  0.102 sec
 * ratio c/w:     0.999 speedup
 SCF:
 * wall-time:     0 d,  0 h,  0 min,  0.003 sec
 *  cpu-time:     0 d,  0 h,  0 min,  0.003 sec
 * ratio c/w:     0.999 speedup
 ANC optimizer:
 * wall-time:     0 d,  0 h,  0 min,  0.039 sec
 *  cpu-time:     0 d,  0 h,  0 min,  0.039 sec
 * ratio c/w:     0.998 speedup
 numerical hessian:
 * wall-time:     0 d,  0 h,  0 min,  0.046 sec
 *  cpu-time:     0 d,  0 h,  0 min,  0.046 sec
 * ratio c/w:     0.999 speedup

