      -----------------------------------------------------------      
     |                   =====================                   |     
     |                           x T B                           |     
     |                   =====================                   |     
     |                         S. Grimme                         |     
     |          Mulliken Center for Theoretical Chemistry        |     
     |                    University of Bonn                     |     
      -----------------------------------------------------------      

   * xtb version 6.2.2 (9d81278992624c895f80dd42a50cac0aa55982e2) compiled by '@Darwin' on 04/03/2020

   xtb is free software: you can redistribute it and/or modify it under
   the terms of the GNU Lesser General Public License as published by
   the Free Software Foundation, either version 3 of the License, or
   (at your option) any later version.
   
   xtb is distributed in the hope that it will be useful,
   but WITHOUT ANY WARRANTY; without even the implied warranty of
   MERCHANTABILITY or FITNESS FOR A PARTICULAR PURPOSE.  See the
   GNU Lesser General Public License for more details.
   
   Cite this work as:
   * S. Grimme, C. Bannwarth, P. Shushkov, J. Chem. Theory Comput., 2017,
     13, 1989-2009. DOI: 10.1021/acs.jctc.7b00118
   * C. Bannwarth, S. Ehlert and S. Grimme., J. Chem. Theory Comput., 2019,
     15, 1652-1671. DOI: 10.1021/acs.jctc.8b01176
   * P. Pracht, E. Caldeweyher, S. Ehlert, S. Grimme, ChemRxiv, 2019, preprint.
     DOI: 10.26434/chemrxiv.8326202.v1
   
   for DFT-D4:
   * E. Caldeweyher, C. Bannwarth and S. Grimme, J. Chem. Phys., 2017,
     147, 034112. DOI: 10.1063/1.4993215
   * E. Caldeweyher, S. Ehlert, A. Hansen, H. Neugebauer, S. Spicher,
     C. Bannwarth and S. Grimme, J. Chem. Phys., 2019, 150, 154122.
     DOI: 10.1063/1.5090222
   
   for sTDA-xTB:
   * S. Grimme and C. Bannwarth, J. Chem. Phys., 2016, 145, 054103.
     DOI: 10.1063/1.4959605
   
   in the mass-spec context:
   * V. Asgeirsson, C. Bauer and S. Grimme, Chem. Sci., 2017, 8, 4879.
     DOI: 10.1039/c7sc00601b
   
   for metadynamics refer to:
   * S. Grimme, J. Chem. Theory Comput., 2019, 155, 2847-2862
     DOI: 10.1021/acs.jctc.9b00143
   
   with help from (in alphabetical order)
   C. Bannwarth, F. Bohle, G. Brandenburg, E. Caldeweyher, M. Checinski,
   S. Dohm, S. Ehlert, S. Ehrlich, F. März, H. Neugebauer, J. Pisarek,
   P. Pracht, P. Shushkov, and S. Spicher.
   
 * started run on 2020/05/12 at 11:44:01.756     

           -------------------------------------------------
          |                Calculation Setup                |
           -------------------------------------------------

          program call               : xtb --input C4N1_10_S_1.input C4N1_10_S_1.xyz --ohess --molden --namespace C4N1_10_S_1 output.out
          calculation namespace      : C4N1_10_S_1
          coordinate file            : C4N1_10_S_1.xyz
          number of atoms            :                     5
          number of electrons        :                    21
          charge                     :                     0
          spin                       :                   0.5
          first test random number   :      0.37849517255982

   ID    Z sym.   atoms
    1    6 C      1, 3-5
    2    7 N      2

           -------------------------------------------------
          |                 G F N 2 - x T B                 |
           -------------------------------------------------

        Reference                      10.1021/acs.jctc.8b01176
      * Hamiltonian:
        H0-scaling (s, p, d)           1.850000    2.230000    2.230000
        zeta-weighting                 0.500000
      * Dispersion:
        s8                             2.700000
        a1                             0.520000
        a2                             5.000000
        s9                             5.000000
      * Repulsion:
        kExp                           1.500000    1.000000
        rExp                           1.000000
      * Coulomb:
        alpha                          2.000000
        third order                    shell-resolved
        anisotropic                    true
        a3                             3.000000
        a5                             4.000000
        cn-shift                       1.200000
        cn-exp                         4.000000
        max-rad                        5.000000


          ...................................................
          :                      SETUP                      :
          :.................................................:
          :  # basis functions                  20          :
          :  # atomic orbitals                  20          :
          :  # shells                           10          :
          :  # electrons                        21          :
          :  max. iterations                   250          :
          :  Hamiltonian                  GFN2-xTB          :
          :  restarted?                      false          :
          :  GBSA solvation                  false          :
          :  PC potential                    false          :
          :  electronic temp.          300.0000000     K    :
          :  accuracy                    1.0000000          :
          :  -> integral cutoff          0.2500000E+02      :
          :  -> integral neglect         0.1000000E-07      :
          :  -> SCF convergence          0.1000000E-05 Eh   :
          :  -> wf. convergence          0.1000000E-03 e    :
          :  Broyden damping             0.4000000          :
          ...................................................

 iter      E             dE          RMSdq      gap      omega  full diag
   1    -10.5440021 -0.105440E+02  0.136E+01    0.16       0.0  T
   2     -4.7392494  0.580475E+01  0.225E+01    1.67       1.0  T
   3     -9.1175845 -0.437834E+01  0.150E+01    1.61       1.0  T
   4     -9.7750683 -0.657484E+00  0.111E+01    0.51       1.0  T
   5    -10.7207747 -0.945706E+00  0.519E+00    0.17       1.0  T
   6    -10.7161994  0.457526E-02  0.460E+00    0.15       1.0  T
   7    -10.0191789  0.697021E+00  0.968E+00    0.31       1.0  T
   8    -10.4908421 -0.471663E+00  0.660E+00    0.25       1.0  T
   9     -9.6706014  0.820241E+00  0.115E+01    0.40       1.0  T
  10     -9.7860739 -0.115472E+00  0.108E+01    0.33       1.0  T
  11    -10.7978301 -0.101176E+01  0.286E+00    0.23       1.0  T
  12    -10.8301892 -0.323591E-01  0.208E+00    0.23       1.0  T
  13    -10.8470454 -0.168562E-01  0.169E+00    0.22       1.0  T
  14    -10.8718256 -0.247803E-01  0.766E-01    0.21       1.0  T
  15    -10.8723884 -0.562793E-03  0.740E-01    0.21       1.0  T
  16    -10.8745112 -0.212279E-02  0.547E-01    0.20       1.0  T
  17    -10.8755093 -0.998032E-03  0.390E-01    0.21       1.0  T
  18    -10.8759031 -0.393805E-03  0.286E-01    0.21       1.0  T
  19    -10.8759501 -0.470246E-04  0.232E-01    0.21       1.0  T
  20    -10.8751484  0.801677E-03  0.311E-01    0.22       1.0  T
  21    -10.8752222 -0.738380E-04  0.283E-01    0.22       1.0  T
  22    -10.8759591 -0.736869E-03  0.705E-02    0.21       1.0  T
  23    -10.8759568  0.230790E-05  0.624E-02    0.21       1.0  T
  24    -10.8759759 -0.190724E-04  0.218E-02    0.21       2.1  T
  25    -10.8759762 -0.314040E-06  0.152E-02    0.21       2.9  T
  26    -10.8759770 -0.849156E-06  0.101E-02    0.21       4.4  T
  27    -10.8759778 -0.723512E-06  0.451E-03    0.21       9.9  T
  28    -10.8759779 -0.101647E-06  0.159E-03    0.21      28.1  T
  29    -10.8759779 -0.203741E-07  0.392E-04    0.21     114.2  T
  30    -10.8759779 -0.103358E-08  0.796E-05    0.21     562.2  T

   *** convergence criteria satisfied after 30 iterations ***

         #    Occupation            Energy/Eh            Energy/eV
      -------------------------------------------------------------
         1        2.0000           -0.7782560             -21.1774
       ...           ...                  ...                  ...
         5        2.0000           -0.5885200             -16.0144
         6        2.0000           -0.5568114             -15.1516
         7        2.0000           -0.5499631             -14.9653
         8        2.0000           -0.5129988             -13.9594
         9        1.9964           -0.4513586             -12.2821
        10        1.9268           -0.4484295             -12.2024
        11        1.0610           -0.4436515             -12.0724 (HOMO)
        12        0.0157           -0.4357828             -11.8583 (LUMO)
        13                         -0.4193595             -11.4114
        14                         -0.4017871             -10.9332
        15                         -0.3210207              -8.7354
        16                         -0.1453506              -3.9552
       ...                                ...                  ...
        20                          0.1709292               4.6512
      -------------------------------------------------------------
                  HL-Gap            0.0078687 Eh            0.2141 eV
             Fermi-level           -0.4428649 Eh          -12.0510 eV

 SCC (total)                   0 d,  0 h,  0 min,  0.006 sec
 SCC setup                      ...        0 min,  0.000 sec (  1.364%)
 Dispersion                     ...        0 min,  0.000 sec (  0.252%)
 integral evaluation            ...        0 min,  0.001 sec ( 18.564%)
 zeroth order Hamiltonian       ...        0 min,  0.000 sec (  0.288%)
 iterations                     ...        0 min,  0.003 sec ( 55.483%)
 molecular gradient             ...        0 min,  0.001 sec ( 22.643%)
 printout                       ...        0 min,  0.000 sec (  1.308%)

         :::::::::::::::::::::::::::::::::::::::::::::::::::::
         ::                     SUMMARY                     ::
         :::::::::::::::::::::::::::::::::::::::::::::::::::::
         :: total energy             -10.813652718822 Eh    ::
         :: gradient norm              0.216510862739 Eh/a0 ::
         :: HOMO-LUMO gap              0.214117716591 eV    ::
         ::.................................................::
         :: SCC energy               -10.875977884630 Eh    ::
         :: -> isotropic ES           -0.043230471757 Eh    ::
         :: -> anisotropic ES          0.004619326687 Eh    ::
         :: -> anisotropic XC          0.006261509934 Eh    ::
         :: -> dispersion             -0.003186195687 Eh    ::
         :: repulsion energy           0.062325013121 Eh    ::
         :: add. restraining           0.000000000000 Eh    ::
         :::::::::::::::::::::::::::::::::::::::::::::::::::::

      ----------------------------------------------------------- 
     |                   =====================                   |
     |                        A N C O P T                        |
     |                   =====================                   |
     |               Approximate Normal Coordinate               |
     |                Rational Function Optimizer                |
      ----------------------------------------------------------- 

          ...................................................
          :                      SETUP                      :
          :.................................................:
          :   optimization level            normal          :
          :   max. optcycles                   200          :
          :   ANC micro-cycles                  20          :
          :   degrees of freedom                 9          :
          :.................................................:
          :   RF solver                   davidson          :
          :   write xtbopt.log                true          :
          :   linear?                        false          :
          :   energy convergence         0.5000000E-05 Eh   :
          :   grad. convergence          0.1000000E-02 Eh/α :
          :   maximium RF displ.         1.0000000          :
          :   Hlow (freq-cutoff)         0.1000000E-01      :
          :   Hmax (freq-cutoff)         5.0000000          :
          :   S6 in model hess.         20.0000000          :
          ...................................................

generating ANC from model Hessian ...
Using Lindh-Hessian (1995)
 Shifting diagonal of input Hessian by    0.0000000000000000     
 Lowest  eigenvalues of input Hessian
   -0.000000   -0.000000   -0.000000    0.000000    0.000000    0.000000
    0.078373    0.081319    0.130178    0.165567    0.469208    0.847987
    0.951796    1.371632    1.622064
 Highest eigenvalues
    0.165567    0.469208    0.847987    0.951796    1.371632    1.622064


........................................................................
.............................. CYCLE    1 ..............................
........................................................................
   1    -10.8759779 -0.108760E+02  0.459E-05    0.21       0.0  T
   2    -10.8759779  0.479974E-08  0.680E-04    0.21      65.8  T
   3    -10.8759779 -0.480479E-08  0.417E-05    0.21    1071.8  T
     SCC iter.                  ...        0 min,  0.000 sec
     gradient                   ...        0 min,  0.001 sec
 * total energy  :   -10.8136527 Eh     change       -0.1995755E-09 Eh
   gradient norm :     0.2165108 Eh/α   predicted     0.0000000E+00 (-100.00%)
   displ. norm   :     0.2615830 α      lambda       -0.4839952E-01
   maximum displ.:     0.1855198 α      in ANC's #7, #3, #5, ...

........................................................................
.............................. CYCLE    2 ..............................
........................................................................
   1    -10.7465126 -0.107465E+02  0.528E+00    0.38       0.0  T
   2     -9.4482527  0.129826E+01  0.126E+01    1.37       1.0  T
   3    -10.8242473 -0.137599E+01  0.384E+00    0.39       1.0  T
   4    -10.9439752 -0.119728E+00  0.122E+00    0.46       1.0  T
   5    -10.8855355  0.584397E-01  0.269E+00    0.43       1.0  T
   6    -10.7302024  0.155333E+00  0.533E+00    0.34       1.0  T
   7    -10.9025040 -0.172302E+00  0.251E+00    0.46       1.0  T
   8    -10.9458616 -0.433576E-01  0.662E-02    0.46       1.0  T
   9    -10.9457195  0.142047E-03  0.147E-01    0.46       1.0  T
  10    -10.9453398  0.379719E-03  0.271E-01    0.47       1.0  T
  11    -10.9438307  0.150909E-02  0.530E-01    0.47       1.0  T
  12    -10.9458245 -0.199372E-02  0.842E-02    0.46       1.0  T
  13    -10.9457376  0.868182E-04  0.138E-01    0.46       1.0  T
  14    -10.9458027 -0.650801E-04  0.982E-02    0.46       1.0  T
  15    -10.9458658 -0.630648E-04  0.177E-02    0.46       2.5  T
  16    -10.9458676 -0.186571E-05  0.536E-03    0.46       8.4  T
  17    -10.9458676  0.922887E-07  0.597E-03    0.46       7.5  T
  18    -10.9458678 -0.213575E-06  0.129E-03    0.46      34.7  T
  19    -10.9458678 -0.692125E-08  0.323E-04    0.46     138.4  T
  20    -10.9458678 -0.769438E-09  0.113E-04    0.46     397.1  T
     SCC iter.                  ...        0 min,  0.003 sec
     gradient                   ...        0 min,  0.002 sec
 * total energy  :   -10.8563646 Eh     change       -0.4271189E-01 Eh
   gradient norm :     0.1637954 Eh/α   predicted    -0.2585564E-01 ( -39.47%)
   displ. norm   :     0.5382991 α      lambda       -0.7609213E-01
   maximum displ.:     0.3583372 α      in ANC's #7, #3, #5, ...

........................................................................
.............................. CYCLE    3 ..............................
........................................................................
   1    -10.8624552 -0.108625E+02  0.532E+00    0.65       0.0  T
   2    -10.1252083  0.737247E+00  0.106E+01    1.07       1.0  T
   3    -10.9820397 -0.856831E+00  0.394E+00    0.99       1.0  T
   4    -11.0113366 -0.292969E-01  0.343E+00    1.02       1.0  T
   5    -11.0410824 -0.297458E-01  0.237E+00    1.08       1.0  T
   6    -10.8920246  0.149058E+00  0.546E+00    0.69       1.0  T
   7    -10.9802050 -0.881805E-01  0.393E+00    0.98       1.0  T
   8    -10.9826550 -0.244998E-02  0.387E+00    0.99       1.0  T
   9    -11.0034475 -0.207924E-01  0.360E+00    0.99       1.0  T
  10    -11.0323859 -0.289385E-01  0.263E+00    1.05       1.0  T
  11    -11.0632811 -0.308952E-01  0.126E+00    1.09       1.0  T
  12    -11.0688275 -0.554643E-02  0.819E-01    1.10       1.0  T
  13    -11.0572098  0.116177E-01  0.162E+00    1.08       1.0  T
  14    -11.0104114  0.467984E-01  0.323E+00    1.03       1.0  T
  15    -11.0285024 -0.180910E-01  0.276E+00    1.05       1.0  T
  16    -11.0613780 -0.328756E-01  0.138E+00    1.09       1.0  T
  17    -11.0595888  0.178922E-02  0.149E+00    1.08       1.0  T
  18    -11.0469826  0.126062E-01  0.208E+00    1.07       1.0  T
  19    -11.0505953 -0.361273E-02  0.193E+00    1.07       1.0  T
  20    -11.0574051 -0.680973E-02  0.161E+00    1.08       1.0  T
  21    -11.0602108 -0.280570E-02  0.145E+00    1.08       1.0  T
  22    -11.0612050 -0.994228E-03  0.140E+00    1.09       1.0  T
  23    -11.0638977 -0.269274E-02  0.122E+00    1.08       1.0  T
  24    -11.0652327 -0.133499E-02  0.113E+00    1.09       1.0  T
  25    -11.0674343 -0.220162E-02  0.955E-01    1.09       1.0  T
  26    -11.0689064 -0.147204E-02  0.819E-01    1.10       1.0  T
  27    -11.0708279 -0.192151E-02  0.591E-01    1.09       1.0  T
  28    -11.0719522 -0.112433E-02  0.406E-01    1.10       1.0  T
  29    -11.0727704 -0.818188E-03  0.167E-01    1.09       1.0  T
  30    -11.0729217 -0.151277E-03  0.564E-02    1.10       1.0  T
  31    -11.0729341 -0.124548E-04  0.329E-02    1.10       1.4  T
  32    -11.0729387 -0.460271E-05  0.168E-02    1.09       2.7  T
  33    -11.0729395 -0.815302E-06  0.128E-02    1.09       3.5  T
  34    -11.0729402 -0.686999E-06  0.642E-03    1.09       7.0  T
  35    -11.0729405 -0.258160E-06  0.426E-04    1.09     105.0  T
  36    -11.0729404  0.483622E-07  0.286E-03    1.09      15.6  T
  37    -11.0729405 -0.462629E-07  0.694E-04    1.09      64.4  T
     SCC iter.                  ...        0 min,  0.004 sec
     gradient                   ...        0 min,  0.002 sec
 * total energy  :   -10.8913119 Eh     change       -0.3494725E-01 Eh
   gradient norm :     0.1697562 Eh/α   predicted    -0.4907050E-01 (  40.41%)
   displ. norm   :     0.3933335 α      lambda       -0.3284994E-01
   maximum displ.:     0.3820513 α      in ANC's #3, #9, #5, ...

........................................................................
.............................. CYCLE    4 ..............................
........................................................................
   1    -11.0379080 -0.110379E+02  0.272E+00    1.76       0.0  T
   2    -10.7962306  0.241677E+00  0.568E+00    1.22       1.0  T
   3    -11.0006550 -0.204424E+00  0.269E+00    1.71       1.0  T
   4    -11.0395202 -0.388651E-01  0.131E+00    1.80       1.0  T
   5    -11.0481865 -0.866629E-02  0.437E-01    1.80       1.0  T
   6    -11.0456188  0.256767E-02  0.824E-01    1.78       1.0  T
   7    -11.0462721 -0.653366E-03  0.771E-01    1.80       1.0  T
   8    -11.0488275 -0.255532E-02  0.328E-01    1.80       1.0  T
   9    -11.0492722 -0.444736E-03  0.165E-01    1.80       1.0  T
  10    -11.0494192 -0.147032E-03  0.281E-02    1.80       1.6  T
  11    -11.0494232 -0.401363E-05  0.101E-02    1.80       4.4  T
  12    -11.0494238 -0.546561E-06  0.847E-04    1.80      52.8  T
  13    -11.0494238 -0.352859E-08  0.280E-04    1.80     159.5  T
     SCC iter.                  ...        0 min,  0.001 sec
     gradient                   ...        0 min,  0.001 sec
 * total energy  :   -10.9164012 Eh     change       -0.2508939E-01 Eh
   gradient norm :     0.1075179 Eh/α   predicted    -0.1896609E-01 ( -24.41%)
   displ. norm   :     0.5722734 α      lambda       -0.3752920E-01
   maximum displ.:     0.4757347 α      in ANC's #3, #5, #9, ...

........................................................................
.............................. CYCLE    5 ..............................
........................................................................
   1    -11.0068343 -0.110068E+02  0.387E+00    3.03       0.0  T
   2    -10.8603404  0.146494E+00  0.481E+00    3.32       1.0  T
   3    -10.9327010 -0.723606E-01  0.410E+00    2.79       1.0  T
   4    -10.9961448 -0.634438E-01  0.294E+00    3.15       1.0  T
   5    -11.0001101 -0.396531E-02  0.265E+00    3.15       1.0  T
   6    -10.8611897  0.138920E+00  0.624E+00    2.42       1.0  T
   7    -10.9777679 -0.116578E+00  0.354E+00    3.03       1.0  T
   8    -11.0267759 -0.490080E-01  0.103E+00    3.16       1.0  T
   9    -11.0296002 -0.282430E-02  0.716E-01    3.15       1.0  T
  10    -11.0287627  0.837512E-03  0.837E-01    3.15       1.0  T
  11    -11.0307980 -0.203525E-02  0.467E-01    3.16       1.0  T
  12    -11.0310655 -0.267489E-03  0.383E-01    3.16       1.0  T
  13    -11.0316568 -0.591365E-03  0.104E-01    3.16       1.0  T
  14    -11.0316906 -0.337868E-04  0.565E-02    3.16       1.0  T
  15    -11.0317028 -0.122215E-04  0.211E-02    3.16       2.1  T
  16    -11.0317043 -0.141925E-05  0.122E-02    3.16       3.7  T
  17    -11.0317046 -0.354135E-06  0.782E-03    3.16       5.7  T
  18    -11.0317048 -0.222909E-06  0.283E-03    3.16      15.8  T
  19    -11.0317049 -0.259141E-07  0.150E-03    3.16      29.9  T
  20    -11.0317049 -0.907137E-08  0.353E-04    3.16     126.8  T
  21    -11.0317049 -0.525182E-09  0.688E-05    3.16     649.6  T
     SCC iter.                  ...        0 min,  0.003 sec
     gradient                   ...        0 min,  0.001 sec
 * total energy  :   -10.9420157 Eh     change       -0.2561443E-01 Eh
   gradient norm :     0.1127251 Eh/α   predicted    -0.2490993E-01 (  -2.75%)
   displ. norm   :     0.4107952 α      lambda       -0.2324810E-01
   maximum displ.:     0.2925499 α      in ANC's #5, #3, #9, ...

........................................................................
.............................. CYCLE    6 ..............................
........................................................................
   1    -11.0121027 -0.110121E+02  0.422E+00    3.46       0.0  T
   2    -10.8464198  0.165683E+00  0.530E+00    4.30       1.0  T
   3    -10.9999985 -0.153579E+00  0.318E+00    3.36       1.0  T
   4    -11.0407864 -0.407878E-01  0.100E+00    3.88       1.0  T
   5    -11.0439957 -0.320937E-02  0.450E-01    3.87       1.0  T
   6    -11.0443779 -0.382184E-03  0.271E-01    3.86       1.0  T
   7    -11.0434846  0.893288E-03  0.541E-01    3.88       1.0  T
   8    -11.0444698 -0.985180E-03  0.926E-02    3.86       1.0  T
   9    -11.0444910 -0.212303E-04  0.377E-02    3.86       1.2  T
  10    -11.0444801  0.109189E-04  0.704E-02    3.85       1.0  T
  11    -11.0444924 -0.123151E-04  0.363E-02    3.86       1.2  T
  12    -11.0444963 -0.383654E-05  0.103E-02    3.86       4.3  T
  13    -11.0444966 -0.324670E-06  0.140E-03    3.86      32.0  T
  14    -11.0444965  0.607775E-07  0.456E-03    3.86       9.8  T
  15    -11.0444966 -0.640390E-07  0.677E-04    3.86      66.1  T
  16    -11.0444966 -0.141592E-08  0.110E-04    3.86     405.2  T
     SCC iter.                  ...        0 min,  0.001 sec
     gradient                   ...        0 min,  0.001 sec
 * total energy  :   -10.9634869 Eh     change       -0.2147125E-01 Eh
   gradient norm :     0.1339201 Eh/α   predicted    -0.1358563E-01 ( -36.73%)
   displ. norm   :     0.8585330 α      lambda       -0.5909117E-01
   maximum displ.:     0.6792592 α      in ANC's #5, #3, #9, ...

........................................................................
.............................. CYCLE    7 ..............................
........................................................................
   1    -11.1047542 -0.111048E+02  0.577E+00    3.44       0.0  T
   2    -10.9912230  0.113531E+00  0.562E+00    3.12       1.0  T
   3    -11.0408696 -0.496466E-01  0.421E+00    3.30       1.0  T
   4    -11.1153303 -0.744606E-01  0.176E+00    3.42       1.0  T
   5    -11.1134269  0.190339E-02  0.152E+00    3.45       1.0  T
   6    -11.1093241  0.410274E-02  0.181E+00    3.43       1.0  T
   7    -11.0972206  0.121036E-01  0.236E+00    3.46       1.0  T
   8    -11.1151405 -0.179199E-01  0.130E+00    3.49       1.0  T
   9    -11.1220833 -0.694283E-02  0.429E-01    3.48       1.0  T
  10    -11.1185740  0.350928E-02  0.971E-01    3.48       1.0  T
  11    -11.1229451 -0.437103E-02  0.279E-02    3.47       1.6  T
  12    -11.1229455 -0.465768E-06  0.235E-02    3.47       1.9  T
  13    -11.1229435  0.198653E-05  0.313E-02    3.47       1.4  T
  14    -11.1229476 -0.410655E-05  0.103E-02    3.47       4.3  T
  15    -11.1229480 -0.355704E-06  0.516E-03    3.47       8.7  T
  16    -11.1229481 -0.121296E-06  0.392E-05    3.47    1140.6  T
  17    -11.1229481  0.279492E-10  0.827E-05    3.47     540.9  T
     SCC iter.                  ...        0 min,  0.002 sec
     gradient                   ...        0 min,  0.001 sec
 * total energy  :   -11.0274172 Eh     change       -0.6393024E-01 Eh
   gradient norm :     0.1078209 Eh/α   predicted    -0.5132299E-01 ( -19.72%)
   displ. norm   :     0.8974035 α      lambda       -0.6690244E-01
   maximum displ.:     0.6701859 α      in ANC's #5, #3, #9, ...

........................................................................
.............................. CYCLE    8 ..............................
........................................................................
   1    -11.1573528 -0.111574E+02  0.604E+00    2.86       0.0  T
   2    -11.1795283 -0.221755E-01  0.446E+00    2.75       1.0  T
   3    -11.1998693 -0.203410E-01  0.228E+00    2.89       1.0  T
   4    -11.2030838 -0.321457E-02  0.306E-01    2.79       1.0  T
   5    -11.2034108 -0.326979E-03  0.121E-01    2.83       1.0  T
   6    -11.2034163 -0.549363E-05  0.301E-02    2.82       1.5  T
   7    -11.2034175 -0.123214E-05  0.147E-02    2.82       3.0  T
   8    -11.2034183 -0.752608E-06  0.103E-02    2.82       4.3  T
   9    -11.2034190 -0.672882E-06  0.248E-03    2.82      18.0  T
  10    -11.2034190 -0.415560E-07  0.497E-04    2.82      90.0  T
  11    -11.2034190 -0.501776E-09  0.229E-04    2.82     195.7  T
     SCC iter.                  ...        0 min,  0.001 sec
     gradient                   ...        0 min,  0.001 sec
 * total energy  :   -11.0409022 Eh     change       -0.1348500E-01 Eh
   gradient norm :     0.2123330 Eh/α   predicted    -0.6039057E-01 ( 347.84%)
   displ. norm   :     0.5445102 α      lambda       -0.7461386E-01
   maximum displ.:     0.5243512 α      in ANC's #2, #3, #9, ...

........................................................................
.............................. CYCLE    9 ..............................
........................................................................
   1    -11.2313991 -0.112314E+02  0.443E+00    3.25       0.0  T
   2    -11.2325882 -0.118912E-02  0.251E+00    3.22       1.0  T
   3    -11.2311474  0.144085E-02  0.715E-01    3.19       1.0  T
   4    -11.2332007 -0.205330E-02  0.135E-01    3.21       1.0  T
   5    -11.2332037 -0.306012E-05  0.457E-02    3.20       1.0  T
   6    -11.2332001  0.359864E-05  0.294E-02    3.20       1.5  T
   7    -11.2332078 -0.763099E-05  0.541E-03    3.20       8.3  T
   8    -11.2332078 -0.422044E-07  0.180E-03    3.20      24.8  T
   9    -11.2332078  0.239808E-08  0.119E-03    3.20      37.7  T
  10    -11.2332078 -0.849402E-08  0.223E-04    3.20     200.2  T
  11    -11.2332078 -0.996359E-11  0.201E-05    3.20    2226.8  T
     SCC iter.                  ...        0 min,  0.001 sec
     gradient                   ...        0 min,  0.001 sec
 * total energy  :   -11.0165450 Eh     change        0.2435719E-01 Eh
   gradient norm :     0.3659190 Eh/α   predicted    -0.4836814E-01 (-298.58%)
   displ. norm   :     0.4740440 α      lambda       -0.1469615E+00
   maximum displ.:     0.3293627 α      in ANC's #5, #7, #2, ...

........................................................................
.............................. CYCLE   10 ..............................
........................................................................
   1    -11.1367444 -0.111367E+02  0.336E+00    3.56       0.0  T
   2    -11.1382949 -0.155055E-02  0.215E+00    3.75       1.0  T
   3    -11.1439609 -0.566599E-02  0.141E+00    3.61       1.0  T
   4    -11.1493173 -0.535636E-02  0.179E-01    3.69       1.0  T
   5    -11.1492751  0.421657E-04  0.103E-01    3.69       1.0  T
   6    -11.1490120  0.263095E-03  0.171E-01    3.69       1.0  T
   7    -11.1493226 -0.310527E-03  0.139E-02    3.69       3.2  T
   8    -11.1493228 -0.234115E-06  0.787E-03    3.69       5.7  T
   9    -11.1493229 -0.934575E-07  0.138E-03    3.69      32.5  T
  10    -11.1493229 -0.116010E-07  0.487E-04    3.69      91.9  T
  11    -11.1493229 -0.657181E-09  0.157E-04    3.69     284.9  T
     SCC iter.                  ...        0 min,  0.001 sec
     gradient                   ...        0 min,  0.001 sec
 * total energy  :   -11.0539844 Eh     change       -0.3743939E-01 Eh
   gradient norm :     0.1178596 Eh/α   predicted    -0.8999314E-01 ( 140.37%)
   displ. norm   :     0.3503259 α      lambda       -0.3626439E-01
   maximum displ.:     0.2748918 α      in ANC's #5, #2, #3, ...

........................................................................
.............................. CYCLE   11 ..............................
........................................................................
   1    -11.2076668 -0.112077E+02  0.244E+00    3.20       0.0  T
   2    -11.2104513 -0.278444E-02  0.139E+00    2.93       1.0  T
   3    -11.2099774  0.473858E-03  0.715E-01    3.09       1.0  T
   4    -11.2111858 -0.120834E-02  0.154E-01    2.98       1.0  T
   5    -11.2112567 -0.709112E-04  0.535E-02    2.99       1.0  T
   6    -11.2112558  0.895348E-06  0.155E-02    2.99       2.9  T
   7    -11.2112577 -0.196132E-05  0.525E-03    2.99       8.5  T
   8    -11.2112578 -0.764672E-07  0.234E-03    2.99      19.1  T
   9    -11.2112578 -0.395813E-09  0.152E-03    2.99      29.4  T
  10    -11.2112578 -0.159879E-07  0.164E-04    2.99     273.5  T
  11    -11.2112578 -0.540545E-11  0.319E-05    2.99    1403.0  T
     SCC iter.                  ...        0 min,  0.001 sec
     gradient                   ...        0 min,  0.001 sec
 * total energy  :   -11.0641841 Eh     change       -0.1019969E-01 Eh
   gradient norm :     0.0932705 Eh/α   predicted    -0.2035752E-01 (  99.59%)
   displ. norm   :     0.3428023 α      lambda       -0.1854894E-01
   maximum displ.:     0.3134250 α      in ANC's #3, #9, #5, ...

........................................................................
.............................. CYCLE   12 ..............................
........................................................................
   1    -11.1808069 -0.111808E+02  0.249E+00    2.54       0.0  T
   2    -11.1863929 -0.558594E-02  0.171E+00    2.40       1.0  T
   3    -11.1890237 -0.263082E-02  0.893E-01    2.52       1.0  T
   4    -11.1892961 -0.272444E-03  0.182E-01    2.46       1.0  T
   5    -11.1894248 -0.128645E-03  0.602E-02    2.49       1.0  T
   6    -11.1893973  0.274411E-04  0.560E-02    2.49       1.0  T
   7    -11.1894271 -0.297796E-04  0.822E-03    2.49       5.4  T
   8    -11.1894272 -0.579613E-07  0.432E-03    2.49      10.4  T
   9    -11.1894273 -0.741471E-07  0.234E-03    2.49      19.1  T
  10    -11.1894273 -0.271054E-07  0.285E-04    2.49     157.0  T
  11    -11.1894273 -0.210854E-10  0.443E-05    2.49    1010.2  T
     SCC iter.                  ...        0 min,  0.001 sec
     gradient                   ...        0 min,  0.001 sec
 * total energy  :   -11.0665890 Eh     change       -0.2404931E-02 Eh
   gradient norm :     0.0664434 Eh/α   predicted    -0.1036434E-01 ( 330.96%)
   displ. norm   :     0.1854177 α      lambda       -0.7770577E-02
   maximum displ.:     0.1153905 α      in ANC's #3, #5, #2, ...

........................................................................
.............................. CYCLE   13 ..............................
........................................................................
   1    -11.1881750 -0.111882E+02  0.140E+00    2.85       0.0  T
   2    -11.1893504 -0.117542E-02  0.896E-01    2.97       1.0  T
   3    -11.1899928 -0.642410E-03  0.486E-01    2.88       1.0  T
   4    -11.1902799 -0.287052E-03  0.621E-02    2.92       1.0  T
   5    -11.1902901 -0.101816E-04  0.299E-02    2.91       1.5  T
   6    -11.1902803  0.977048E-05  0.327E-02    2.91       1.4  T
   7    -11.1902908 -0.105403E-04  0.239E-03    2.91      18.7  T
   8    -11.1902908  0.139638E-07  0.192E-03    2.91      23.3  T
   9    -11.1902908 -0.165050E-07  0.817E-04    2.91      54.7  T
  10    -11.1902908 -0.325219E-08  0.696E-05    2.91     642.5  T
     SCC iter.                  ...        0 min,  0.001 sec
     gradient                   ...        0 min,  0.001 sec
 * total energy  :   -11.0699163 Eh     change       -0.3327262E-02 Eh
   gradient norm :     0.0291456 Eh/α   predicted    -0.4018867E-02 (  20.79%)
   displ. norm   :     0.0613452 α      lambda       -0.1630595E-02
   maximum displ.:     0.0521578 α      in ANC's #5, #2, #3, ...

........................................................................
.............................. CYCLE   14 ..............................
........................................................................
   1    -11.1992399 -0.111992E+02  0.439E-01    2.73       0.0  T
   2    -11.1993369 -0.969499E-04  0.246E-01    2.68       1.0  T
   3    -11.1993293  0.761514E-05  0.123E-01    2.71       1.0  T
   4    -11.1993587 -0.294060E-04  0.275E-02    2.69       1.6  T
   5    -11.1993613 -0.264406E-05  0.946E-03    2.70       4.7  T
   6    -11.1993613 -0.367937E-08  0.239E-03    2.70      18.7  T
   7    -11.1993614 -0.339235E-07  0.891E-04    2.70      50.2  T
   8    -11.1993614 -0.146954E-08  0.217E-04    2.70     206.1  T
     SCC iter.                  ...        0 min,  0.001 sec
     gradient                   ...        0 min,  0.001 sec
 * total energy  :   -11.0707230 Eh     change       -0.8067616E-03 Eh
   gradient norm :     0.0071346 Eh/α   predicted    -0.8183651E-03 (   1.44%)
   displ. norm   :     0.0309810 α      lambda       -0.1354095E-03
   maximum displ.:     0.0241029 α      in ANC's #3, #5, #9, ...

........................................................................
.............................. CYCLE   15 ..............................
........................................................................
   1    -11.1988443 -0.111988E+02  0.219E-01    2.61       0.0  T
   2    -11.1988660 -0.216983E-04  0.142E-01    2.59       1.0  T
   3    -11.1988723 -0.630945E-05  0.768E-02    2.61       1.0  T
   4    -11.1988815 -0.911580E-05  0.572E-03    2.60       7.8  T
   5    -11.1988815 -0.804174E-07  0.292E-03    2.60      15.3  T
   6    -11.1988814  0.119591E-06  0.401E-03    2.60      11.2  T
   7    -11.1988816 -0.142008E-06  0.229E-04    2.60     195.3  T
   8    -11.1988816  0.186816E-09  0.214E-04    2.60     209.0  T
     SCC iter.                  ...        0 min,  0.001 sec
     gradient                   ...        0 min,  0.001 sec
 * total energy  :   -11.0708192 Eh     change       -0.9620243E-04 Eh
   gradient norm :     0.0046063 Eh/α   predicted    -0.6776929E-04 ( -29.56%)
   displ. norm   :     0.0325056 α      lambda       -0.9034091E-04
   maximum displ.:     0.0227559 α      in ANC's #3, #5, #7, ...

........................................................................
.............................. CYCLE   16 ..............................
........................................................................
   1    -11.1983972 -0.111984E+02  0.230E-01    2.51       0.0  T
   2    -11.1984082 -0.109983E-04  0.141E-01    2.49       1.0  T
   3    -11.1983995  0.866554E-05  0.716E-02    2.51       1.0  T
   4    -11.1984164 -0.168303E-04  0.437E-03    2.50      10.2  T
   5    -11.1984161  0.222037E-06  0.519E-03    2.50       8.6  T
   6    -11.1984164 -0.227510E-06  0.132E-03    2.50      33.8  T
   7    -11.1984164 -0.133722E-07  0.220E-04    2.50     203.2  T
   8    -11.1984164 -0.177636E-11  0.603E-05    2.50     742.1  T
     SCC iter.                  ...        0 min,  0.001 sec
     gradient                   ...        0 min,  0.002 sec
 * total energy  :   -11.0708711 Eh     change       -0.5192422E-04 Eh
   gradient norm :     0.0020677 Eh/α   predicted    -0.4521907E-04 ( -12.91%)
   displ. norm   :     0.0061413 α      lambda       -0.6090888E-05
   maximum displ.:     0.0037176 α      in ANC's #3, #5, #7, ...

........................................................................
.............................. CYCLE   17 ..............................
........................................................................
   1    -11.1983720 -0.111984E+02  0.460E-02    2.49       0.0  T
   2    -11.1983722 -0.156141E-06  0.259E-02    2.48       1.7  T
   3    -11.1983719  0.255581E-06  0.781E-03    2.49       5.7  T
   4    -11.1983722 -0.250078E-06  0.302E-03    2.48      14.8  T
   5    -11.1983722 -0.494243E-07  0.176E-03    2.48      25.4  T
   6    -11.1983722 -0.220200E-07  0.623E-04    2.48      71.8  T
   7    -11.1983722  0.494987E-09  0.488E-04    2.48      91.6  T
     SCC iter.                  ...        0 min,  0.001 sec
     gradient                   ...        0 min,  0.001 sec
 * total energy  :   -11.0708750 Eh     change       -0.3825786E-05 Eh
   gradient norm :     0.0014238 Eh/α   predicted    -0.3043635E-05 ( -20.44%)
   displ. norm   :     0.0035557 α      lambda       -0.1657202E-05
   maximum displ.:     0.0023681 α      in ANC's #3, #9, #5, ...

........................................................................
.............................. CYCLE   18 ..............................
........................................................................
   1    -11.1984111 -0.111984E+02  0.276E-02    2.48       0.0  T
   2    -11.1984111 -0.186634E-07  0.154E-02    2.48       2.9  T
   3    -11.1984107  0.353439E-06  0.654E-03    2.48       6.8  T
   4    -11.1984111 -0.343130E-06  0.210E-03    2.48      21.3  T
   5    -11.1984111 -0.287634E-07  0.884E-04    2.48      50.6  T
   6    -11.1984111  0.319327E-09  0.728E-04    2.48      61.4  T
     SCC iter.                  ...        0 min,  0.001 sec
     gradient                   ...        0 min,  0.001 sec
 * total energy  :   -11.0708765 Eh     change       -0.1521682E-05 Eh
   gradient norm :     0.0011246 Eh/α   predicted    -0.8284563E-06 ( -45.56%)
   displ. norm   :     0.0027104 α      lambda       -0.1189744E-05
   maximum displ.:     0.0020984 α      in ANC's #3, #9, #4, ...

........................................................................
.............................. CYCLE   19 ..............................
........................................................................
   1    -11.1985404 -0.111985E+02  0.196E-02    2.48       0.0  T
   2    -11.1985404  0.100329E-07  0.121E-02    2.49       3.7  T
   3    -11.1985390  0.146830E-05  0.128E-02    2.49       3.5  T
   4    -11.1985404 -0.145567E-05  0.334E-03    2.48      13.4  T
   5    -11.1985405 -0.918715E-07  0.645E-04    2.48      69.4  T
   6    -11.1985405  0.120167E-08  0.545E-04    2.49      82.0  T
     SCC iter.                  ...        0 min,  0.001 sec
     gradient                   ...        0 min,  0.001 sec
 * total energy  :   -11.0708777 Eh     change       -0.1248979E-05 Eh
   gradient norm :     0.0007164 Eh/α   predicted    -0.5958624E-06 ( -52.29%)
   displ. norm   :     0.0047368 α      lambda       -0.1373121E-05
   maximum displ.:     0.0034166 α      in ANC's #3, #4, #9, ...

   *** GEOMETRY OPTIMIZATION CONVERGED AFTER 19 ITERATIONS ***

------------------------------------------------------------------------
 total energy gain   :        -0.2572250 Eh     -161.4111 kcal/mol
 total RMSD          :         1.5994648 a0        0.8464 Å
 total power (kW/mol):       -35.5444313 (step)-8565.6969 (real)
------------------------------------------------------------------------

 ANCopt (total)                0 d,  0 h,  0 min,  0.079 sec
 optimizer setup                ...        0 min,  0.000 sec (  0.097%)
 model hessian                  ...        0 min,  0.000 sec (  0.109%)
 ANC generation                 ...        0 min,  0.000 sec (  0.066%)
 coordinate transformation      ...        0 min,  0.000 sec (  0.048%)
 single point calculation       ...        0 min,  0.077 sec ( 97.972%)
 optimization log               ...        0 min,  0.000 sec (  0.586%)
 hessian update                 ...        0 min,  0.000 sec (  0.042%)
 rational function              ...        0 min,  0.000 sec (  0.502%)

================
 final structure:
================
5
 xtb: 6.2.2 (9d81278992624c895f80dd42a50cac0aa55982e2)
C         0.16671744009830    1.07566249190902    0.02689156033035
N        -0.91712084879801    0.06586985867790   -0.00763900810176
C         0.37857140065253   -0.00540649322742   -0.89677937965337
C         0.01122505051153   -1.08858376947618   -0.02538742701162
C         0.36060595753565   -0.04754208788332    0.90291425443639

 Bond Distances (Angstroems)
 ---------------------------
C1-N2=1.4817         C1-C3=1.4376         C1-C5=1.4376         N2-C1=1.4817         N2-C3=1.5730         N2-C4=1.4815         
N2-C5=1.5731         C3-C1=1.4376         C3-N2=1.5730         C3-C4=1.4379         C3-C5=1.8003         C4-N2=1.4815         
C4-C3=1.4379         C4-C5=1.4379         C5-C1=1.4376         C5-N2=1.5731         C5-C3=1.8003         C5-C4=1.4379         
 C  C  Rav=1.5103 sigma=0.1450  Rmin=1.4376  Rmax=1.8003     5
 N  C  Rav=1.5273 sigma=0.0457  Rmin=1.4815  Rmax=1.5731     4

 selected bond angles (degree)
 --------------------
C3-C1-N2= 65.19                C5-C1-N2= 65.19                C5-C1-C3= 77.53                C3-N2-C1= 56.05                
C4-N2-C1= 94.18                C4-N2-C3= 56.07                C5-N2-C1= 56.05                C5-N2-C3= 69.81                
C5-N2-C4= 56.07                N2-C3-C1= 58.76                C4-C3-C1= 98.02                C4-C3-N2= 58.75                
C5-C3-C1= 51.23                C5-C3-N2= 55.10                C5-C3-C4= 51.24                C3-C4-N2= 65.19                
C5-C4-N2= 65.19                C5-C4-C3= 77.51                N2-C5-C1= 58.76                C3-C5-C1= 51.24                
C3-C5-N2= 55.09                C4-C5-C1= 98.02                C4-C5-N2= 58.74                C4-C5-C3= 51.24                

 selected dihedral angles (degree)
 ---------------------------------
C3-N2-C1-C5=272.77            C4-N2-C1-C3= 43.62            C4-N2-C1-C5=316.39            C5-N2-C1-C3= 87.23            
N2-C3-C1-C5= 68.21            C4-C3-C1-N2=314.29            C4-C3-C1-C5= 22.50            C5-C3-C1-N2=291.79            
C1-C3-N2-C4=236.02            C1-C3-N2-C5=298.02            C4-C3-N2-C1=123.98            C4-C3-N2-C5= 62.00            
C5-C3-N2-C1= 61.98            C5-C3-N2-C4=298.00            C3-C4-N2-C1=316.39            C3-C4-N2-C5=272.79            
C5-C4-N2-C1= 43.60            C5-C4-N2-C3= 87.21            N2-C4-C3-C1= 45.72            N2-C4-C3-C5= 68.21            
C5-C4-C3-C1=337.51            C5-C4-C3-N2=291.79            N2-C5-C1-C3=291.79            C3-C5-C1-N2= 68.21            
C4-C5-C1-N2= 45.71            C4-C5-C1-C3=337.50            C1-C5-N2-C3= 61.98            C1-C5-N2-C4=123.99            
C3-C5-N2-C1=298.02            C3-C5-N2-C4= 62.00            C4-C5-N2-C1=236.01            C4-C5-N2-C3=298.00            
C1-C5-C3-N2=284.52            C1-C5-C3-C4=209.07            N2-C5-C3-C1= 75.48            N2-C5-C3-C4=284.55            
C4-C5-C3-C1=150.93            C4-C5-C3-N2= 75.45            C1-C5-C4-N2=314.28            C1-C5-C4-C3= 22.49            
N2-C5-C4-C3= 68.21            C3-C5-C4-N2=291.79            
           -------------------------------------------------
          |                Final Singlepoint                |
           -------------------------------------------------

          ...................................................
          :                      SETUP                      :
          :.................................................:
          :  # basis functions                  20          :
          :  # atomic orbitals                  20          :
          :  # shells                           10          :
          :  # electrons                        21          :
          :  max. iterations                   250          :
          :  Hamiltonian                  GFN2-xTB          :
          :  restarted?                      false          :
          :  GBSA solvation                  false          :
          :  PC potential                    false          :
          :  electronic temp.          300.0000000     K    :
          :  accuracy                    1.0000000          :
          :  -> integral cutoff          0.2500000E+02      :
          :  -> integral neglect         0.1000000E-07      :
          :  -> SCF convergence          0.1000000E-05 Eh   :
          :  -> wf. convergence          0.1000000E-03 e    :
          :  Broyden damping             0.4000000          :
          ...................................................

 iter      E             dE          RMSdq      gap      omega  full diag
   1    -11.1985405 -0.111985E+02  0.291E-04    2.49       0.0  T
   2    -11.1985405  0.249768E-09  0.235E-04    2.48     190.5  T
   3    -11.1985405 -0.354783E-09  0.181E-04    2.48     246.4  T

   *** convergence criteria satisfied after 3 iterations ***

         #    Occupation            Energy/Eh            Energy/eV
      -------------------------------------------------------------
         1        2.0000           -0.7941046             -21.6087
       ...           ...                  ...                  ...
         5        2.0000           -0.5505755             -14.9819
         6        2.0000           -0.5400965             -14.6968
         7        2.0000           -0.5041743             -13.7193
         8        2.0000           -0.5015234             -13.6471
         9        2.0000           -0.4972900             -13.5320
        10        2.0000           -0.4770727             -12.9818
        11        1.0000           -0.4216399             -11.4734 (HOMO)
        12                         -0.3303182              -8.9884 (LUMO)
        13                         -0.2459148              -6.6917
        14                         -0.2382805              -6.4839
        15                         -0.0958108              -2.6071
        16                         -0.0616236              -1.6769
       ...                                ...                  ...
        20                          0.4124943              11.2245
      -------------------------------------------------------------
                  HL-Gap            0.0913217 Eh            2.4850 eV
             Fermi-level           -0.4126677 Eh          -11.2293 eV

 SCC (total)                   0 d,  0 h,  0 min,  0.004 sec
 SCC setup                      ...        0 min,  0.000 sec (  1.708%)
 Dispersion                     ...        0 min,  0.000 sec (  0.277%)
 integral evaluation            ...        0 min,  0.001 sec ( 35.213%)
 zeroth order Hamiltonian       ...        0 min,  0.000 sec (  0.383%)
 iterations                     ...        0 min,  0.000 sec ( 13.230%)
 molecular gradient             ...        0 min,  0.002 sec ( 46.636%)
 printout                       ...        0 min,  0.000 sec (  2.434%)

         :::::::::::::::::::::::::::::::::::::::::::::::::::::
         ::                     SUMMARY                     ::
         :::::::::::::::::::::::::::::::::::::::::::::::::::::
         :: total energy             -11.070877740899 Eh    ::
         :: gradient norm              0.000728596309 Eh/a0 ::
         :: HOMO-LUMO gap              2.484988696537 eV    ::
         ::.................................................::
         :: SCC energy               -11.198540513121 Eh    ::
         :: -> isotropic ES           -0.004851884447 Eh    ::
         :: -> anisotropic ES          0.005329759413 Eh    ::
         :: -> anisotropic XC          0.006957835072 Eh    ::
         :: -> dispersion             -0.002479607707 Eh    ::
         :: repulsion energy           0.127662758204 Eh    ::
         :: add. restraining           0.000000000000 Eh    ::
         :::::::::::::::::::::::::::::::::::::::::::::::::::::

           ------------------------------------------------- 
          |                Numerical Hessian                |
           ------------------------------------------------- 
step length          :   0.00500
SCC accuracy         :   0.30000
Hessian scale factor :   1.00000
frozen atoms in %    :   0.00000    0
RMS gradient         :   0.00073
estimated CPU  time      0.00 min
estimated wall time      0.00 min

writing file <hessian>.

 projected vibrational frequencies (cm-1)
eigval :       -0.00    -0.00    -0.00     0.00     0.00     0.00
eigval :      300.50   430.82   701.03   773.81  1040.74  1047.70
eigval :     1079.40  1322.58  1421.15
           -------------------------------------------------
          |                Property Printout                |
           -------------------------------------------------

    * Orbital Energies and Occupations

         #    Occupation            Energy/Eh            Energy/eV
      -------------------------------------------------------------
         1        2.0000           -0.7941045             -21.6087
         2        2.0000           -0.6840114             -18.6129
         3        2.0000           -0.6661404             -18.1266
         4        2.0000           -0.6416986             -17.4615
         5        2.0000           -0.5505755             -14.9819
         6        2.0000           -0.5400964             -14.6968
         7        2.0000           -0.5041742             -13.7193
         8        2.0000           -0.5015234             -13.6471
         9        2.0000           -0.4972900             -13.5319
        10        2.0000           -0.4770726             -12.9818
        11        1.0000           -0.4216398             -11.4734 (HOMO)
        12                         -0.3303182              -8.9884 (LUMO)
        13                         -0.2459148              -6.6917
        14                         -0.2382805              -6.4839
        15                         -0.0958108              -2.6071
        16                         -0.0616235              -1.6769
        17                          0.0802151               2.1828
        18                          0.0923509               2.5130
        19                          0.2313273               6.2947
        20                          0.4124944              11.2245
      -------------------------------------------------------------
                  HL-Gap            0.0913217 Eh            2.4850 eV
             Fermi-level           -0.4126676 Eh          -11.2293 eV

     #   Z        covCN         q      C6AA      α(0)
     1   6 C      3.044     0.027    27.370     8.581
     2   7 N      3.594    -0.083    22.850     7.100
     3   6 C      3.689     0.015    20.508     6.481
     4   6 C      3.044     0.026    27.372     8.581
     5   6 C      3.689     0.015    20.508     6.481

 Mol. C6AA /au·bohr⁶  :        589.090223
 Mol. C8AA /au·bohr⁸  :      16199.032393
 Mol. α(0) /au        :         37.223593


Wiberg/Mayer (AO) data.
largest (>0.10) Wiberg bond orders for each atom
          total WBO             WBO to atom ...
     1  C   2.945        C    5 0.964    C    3 0.964    N    2 0.793    C    4 0.224
     2  N   2.979        C    4 0.794    C    1 0.793    C    3 0.696    C    5 0.696
     3  C   3.214        C    1 0.964    C    4 0.964    N    2 0.696    C    5 0.591
     4  C   2.945        C    3 0.964    C    5 0.964    N    2 0.794    C    1 0.224
     5  C   3.215        C    1 0.964    C    4 0.964    N    2 0.696    C    3 0.591

MOs/occ written to file <molden.input>


molecular dipole:
                 x           y           z       tot (Debye)
 q only:        0.174      -0.012       0.001
   full:       -0.032       0.003      -0.000       0.081
molecular quadrupole (traceless):
                xx          xy          yy          xz          yz          zz
 q only:       -0.386       0.049       0.293      -0.004       0.005       0.093
  q+dip:       -0.605       0.081       0.507      -0.005       0.010       0.099
   full:        0.263      -0.056      -0.521      -0.001      -0.019       0.258

           -------------------------------------------------
          |                Geometry Summary                 |
           -------------------------------------------------

      molecular mass/u    :       62.0496468
   center of mass at/Å    :       -0.0295015       0.0021190      -0.0002456
Molecule has the following symmetry elements: (C2) 2*(sigma) 
It seems to be the C2v point group
  moments of inertia/u·Å² :        0.3474132E+02   0.4356848E+02   0.4775390E+02
rotational constants/cm⁻¹ :        0.4852329E+00   0.3869227E+00   0.3530106E+00

 * 6 selected distances

     #   Z        #   Z                                     value/Å
     1   6 C      2   7 N                                 1.4817486 (max)
     1   6 C      3   6 C                                 1.4376231
     2   7 N      4   6 C                                 1.4815209
     3   6 C      4   6 C                                 1.4378944
     1   6 C      5   6 C                                 1.4375664 (min)
     4   6 C      5   6 C                                 1.4379078

 * 2 distinct bonds (by element types)

   Z      Z             #   av. dist./Å        max./Å        min./Å
   6 C    6 C           4     1.4377479     1.4379078     1.4375664
   6 C    7 N           2     1.4816348     1.4817486     1.4815209

           -------------------------------------------------
          |               Frequency Printout                |
           -------------------------------------------------
 projected vibrational frequencies (cm-1)
eigval :       -0.00    -0.00    -0.00     0.00     0.00     0.00
eigval :      300.50   430.82   701.03   773.81  1040.74  1047.70
eigval :     1079.40  1322.58  1421.15
 reduced masses (amu)
   1: 12.22   2: 12.70   3: 12.61   4: 12.46   5: 12.46   6: 12.11   7: 12.01   8: 12.75
   9: 12.97  10: 12.02  11: 13.38  12: 12.01  13: 12.18  14: 12.09  15: 12.18
 IR intensities (amu)
   1:  0.04   2:  0.05   3:  0.06   4:  0.02   5:  0.04   6:  0.02   7:  0.29   8:  1.06
   9:  0.13  10:  0.18  11:  1.04  12:  0.02  13:  1.19  14:  1.15  15:  0.15
 Raman intensities (amu)
   1:  0.00   2:  0.00   3:  0.00   4:  0.00   5:  0.00   6:  0.00   7:  0.00   8:  0.00
   9:  0.00  10:  0.00  11:  0.00  12:  0.00  13:  0.00  14:  0.00  15:  0.00
 output can be read by thermo (or use thermo option).
 writing <g98.out> molden fake output.
 recommended (thermochemical) frequency scaling factor: 1.0
           -------------------------------------------------
          |             Thermodynamic Functions             |
           -------------------------------------------------

c2v symmetry found (for desy threshold:  0.10E+00) used in thermo

          ...................................................
          :                      SETUP                      :
          :.................................................:
          :  # frequencies                           9      :
          :  # imaginary freq.                       0      :
          :  linear?                             false      :
          :  only rotor calc.                    false      :
          :  symmetry                              c2v      :
          :  rotational number                       2      :
          :  scaling factor                  1.0000000      :
          :  rotor cutoff                   50.0000000 cm⁻¹ :
          :  imag. cutoff                  -20.0000000 cm⁻¹ :
          :.................................................:

    mode    ω/cm⁻¹     T·S(HO)/kcal·mol⁻¹    T·S(FR)/kcal·mol⁻¹   T·S(vib)
   ------------------------------------------------------------------------
   ------------------------------------------------------------------------

   temp. (K)  partition function   enthalpy   heat capacity  entropy
                                   cal/mol     cal/K/mol   cal/K/mol   J/K/mol
 298.15  VIB   1.62                  630.513      5.795      3.071
         ROT  0.103E+05              888.752      2.981     21.337
         INT  0.166E+05             1519.266      8.775     24.408
         TR   0.473E+27             1481.254      4.968     38.278
         TOT                        3000.5196    13.7435    62.6857   262.2771

   temp. (K)  partition function   enthalpy   heat capacity  entropy
                                   cal/mol     cal/K/mol   cal/K/mol   J/K/mol
 120.00  VIB   1.03                   31.822      1.100      0.333
         ROT  0.262E+04              357.707      2.981     18.624
         INT  0.271E+04              389.529      4.080     18.957
         TR   0.121E+27              596.178      4.968     33.759
         TOT                         985.7070     9.0486    52.7154   220.5614

   temp. (K)  partition function   enthalpy   heat capacity  entropy
                                   cal/mol     cal/K/mol   cal/K/mol   J/K/mol
 100.00  VIB   1.02                   14.166      0.674      0.173
         ROT  0.199E+04              298.089      2.981     18.081
         INT  0.203E+04              312.255      3.655     18.253
         TR   0.919E+26              496.815      4.968     32.853
         TOT                         809.0703     8.6229    51.1067   213.8306

   temp. (K)  partition function   enthalpy   heat capacity  entropy
                                   cal/mol     cal/K/mol   cal/K/mol   J/K/mol
  80.00  VIB   1.00                    4.421      0.316      0.065
         ROT  0.143E+04              238.471      2.981     17.415
         INT  0.143E+04              242.893      3.297     17.481
         TR   0.657E+26              397.452      4.968     31.745
         TOT                         640.3446     8.2653    49.2261   205.9620

   temp. (K)  partition function   enthalpy   heat capacity  entropy
                                   cal/mol     cal/K/mol   cal/K/mol   J/K/mol
  60.00  VIB   1.00                    0.678      0.084      0.013
         ROT   927.                  178.853      2.981     16.558
         INT   928.                  179.532      3.065     16.571
         TR   0.427E+26              298.089      4.968     30.317
         TOT                         477.6208     8.0327    46.8875   196.1774

   temp. (K)  partition function   enthalpy   heat capacity  entropy
                                   cal/mol     cal/K/mol   cal/K/mol   J/K/mol
  40.00  VIB   1.00                    0.018      0.005      0.000
         ROT   505.                  119.236      2.981     15.349
         INT   505.                  119.253      2.986     15.349
         TR   0.232E+26              198.726      4.968     28.303
         TOT                         317.9792     7.9538    43.6527   182.6428

   temp. (K)  partition function   enthalpy   heat capacity  entropy
                                   cal/mol     cal/K/mol   cal/K/mol   J/K/mol
  20.00  VIB   1.00                    0.000      0.000     -0.001
         ROT   178.                   59.618      2.981     13.283
         INT   178.                   59.618      2.981     13.282
         TR   0.822E+25               99.363      4.968     24.861
         TOT                         158.9808     7.9490    38.1433   159.5917

   temp. (K)  partition function   enthalpy   heat capacity  entropy
                                   cal/mol     cal/K/mol   cal/K/mol   J/K/mol
  10.00  VIB   1.00                    0.000      0.000     -0.002
         ROT   63.1                   29.809      2.981     11.217
         INT   63.1                   29.809      2.981     11.215
         TR   0.290E+25               49.681      4.968     21.419
         TOT                          79.4904     7.9490    32.6345   136.5426

       T/K    H(0)-H(T)+PV         H(T)/Eh          T*S/Eh         G(T)/Eh
   ------------------------------------------------------------------------
    298.15    0.478163E-02    0.232752E-01    0.297840E-01   -0.650882E-02
    120.00    0.157082E-02    0.200644E-01    0.100809E-01    0.998350E-02
    100.00    0.128934E-02    0.197829E-01    0.814438E-02    0.116385E-01
     80.00    0.102045E-02    0.195140E-01    0.627574E-02    0.132383E-01
     60.00    0.761137E-03    0.192547E-01    0.448320E-02    0.147715E-01
     40.00    0.506732E-03    0.190003E-01    0.278260E-02    0.162177E-01
     20.00    0.253352E-03    0.187469E-01    0.121571E-02    0.175312E-01
     10.00    0.126676E-03    0.186202E-01    0.520063E-03    0.181002E-01 (used)
   ------------------------------------------------------------------------

         :::::::::::::::::::::::::::::::::::::::::::::::::::::
         ::                  THERMODYNAMIC                  ::
         :::::::::::::::::::::::::::::::::::::::::::::::::::::
         :: total free energy         -11.052777563769 Eh   ::
         ::.................................................::
         :: total energy              -11.070877741080 Eh   ::
         :: zero point energy           0.018493564562 Eh   ::
         :: G(RRHO) w/o ZPVE           -0.000393387251 Eh   ::
         :: G(RRHO) contrib.            0.018100177311 Eh   ::
         :::::::::::::::::::::::::::::::::::::::::::::::::::::

optimized geometry written to: xtbopt.xyz


           -------------------------------------------------
          | TOTAL ENERGY              -11.070877741080 Eh   |
          | TOTAL ENTHALPY            -11.052257500502 Eh   |
          | TOTAL FREE ENERGY         -11.052777563769 Eh   |
          | GRADIENT NORM               0.000728902445 Eh/α |
          | HOMO-LUMO GAP               2.484989025755 eV   |
           -------------------------------------------------

------------------------------------------------------------------------
 * finished run on 2020/05/12 at 11:44:01.963     
------------------------------------------------------------------------
 total:
 * wall-time:     0 d,  0 h,  0 min,  0.206 sec
 *  cpu-time:     0 d,  0 h,  0 min,  0.206 sec
 * ratio c/w:     0.999 speedup
 SCF:
 * wall-time:     0 d,  0 h,  0 min,  0.006 sec
 *  cpu-time:     0 d,  0 h,  0 min,  0.006 sec
 * ratio c/w:     1.000 speedup
 ANC optimizer:
 * wall-time:     0 d,  0 h,  0 min,  0.084 sec
 *  cpu-time:     0 d,  0 h,  0 min,  0.084 sec
 * ratio c/w:     1.000 speedup
 numerical hessian:
 * wall-time:     0 d,  0 h,  0 min,  0.100 sec
 *  cpu-time:     0 d,  0 h,  0 min,  0.100 sec
 * ratio c/w:     0.999 speedup

