      -----------------------------------------------------------      
     |                   =====================                   |     
     |                           x T B                           |     
     |                   =====================                   |     
     |                         S. Grimme                         |     
     |          Mulliken Center for Theoretical Chemistry        |     
     |                    University of Bonn                     |     
      -----------------------------------------------------------      

   * xtb version 6.2.2 (9d81278992624c895f80dd42a50cac0aa55982e2) compiled by '@Darwin' on 04/03/2020

   xtb is free software: you can redistribute it and/or modify it under
   the terms of the GNU Lesser General Public License as published by
   the Free Software Foundation, either version 3 of the License, or
   (at your option) any later version.
   
   xtb is distributed in the hope that it will be useful,
   but WITHOUT ANY WARRANTY; without even the implied warranty of
   MERCHANTABILITY or FITNESS FOR A PARTICULAR PURPOSE.  See the
   GNU Lesser General Public License for more details.
   
   Cite this work as:
   * S. Grimme, C. Bannwarth, P. Shushkov, J. Chem. Theory Comput., 2017,
     13, 1989-2009. DOI: 10.1021/acs.jctc.7b00118
   * C. Bannwarth, S. Ehlert and S. Grimme., J. Chem. Theory Comput., 2019,
     15, 1652-1671. DOI: 10.1021/acs.jctc.8b01176
   * P. Pracht, E. Caldeweyher, S. Ehlert, S. Grimme, ChemRxiv, 2019, preprint.
     DOI: 10.26434/chemrxiv.8326202.v1
   
   for DFT-D4:
   * E. Caldeweyher, C. Bannwarth and S. Grimme, J. Chem. Phys., 2017,
     147, 034112. DOI: 10.1063/1.4993215
   * E. Caldeweyher, S. Ehlert, A. Hansen, H. Neugebauer, S. Spicher,
     C. Bannwarth and S. Grimme, J. Chem. Phys., 2019, 150, 154122.
     DOI: 10.1063/1.5090222
   
   for sTDA-xTB:
   * S. Grimme and C. Bannwarth, J. Chem. Phys., 2016, 145, 054103.
     DOI: 10.1063/1.4959605
   
   in the mass-spec context:
   * V. Asgeirsson, C. Bauer and S. Grimme, Chem. Sci., 2017, 8, 4879.
     DOI: 10.1039/c7sc00601b
   
   for metadynamics refer to:
   * S. Grimme, J. Chem. Theory Comput., 2019, 155, 2847-2862
     DOI: 10.1021/acs.jctc.9b00143
   
   with help from (in alphabetical order)
   C. Bannwarth, F. Bohle, G. Brandenburg, E. Caldeweyher, M. Checinski,
   S. Dohm, S. Ehlert, S. Ehrlich, F. März, H. Neugebauer, J. Pisarek,
   P. Pracht, P. Shushkov, and S. Spicher.
   
 * started run on 2020/05/12 at 11:44:32.119     

           -------------------------------------------------
          |                Calculation Setup                |
           -------------------------------------------------

          program call               : xtb --input C5_3_S_0.input C5_3_S_0.xyz --ohess --molden --namespace C5_3_S_0 output.out
          calculation namespace      : C5_3_S_0
          coordinate file            : C5_3_S_0.xyz
          number of atoms            :                     5
          number of electrons        :                    20
          charge                     :                     0
          spin                       :                   0.0
          first test random number   :      0.72797883611729

   ID    Z sym.   atoms
    1    6 C      1-5

           -------------------------------------------------
          |                 G F N 2 - x T B                 |
           -------------------------------------------------

        Reference                      10.1021/acs.jctc.8b01176
      * Hamiltonian:
        H0-scaling (s, p, d)           1.850000    2.230000    2.230000
        zeta-weighting                 0.500000
      * Dispersion:
        s8                             2.700000
        a1                             0.520000
        a2                             5.000000
        s9                             5.000000
      * Repulsion:
        kExp                           1.500000    1.000000
        rExp                           1.000000
      * Coulomb:
        alpha                          2.000000
        third order                    shell-resolved
        anisotropic                    true
        a3                             3.000000
        a5                             4.000000
        cn-shift                       1.200000
        cn-exp                         4.000000
        max-rad                        5.000000


          ...................................................
          :                      SETUP                      :
          :.................................................:
          :  # basis functions                  20          :
          :  # atomic orbitals                  20          :
          :  # shells                           10          :
          :  # electrons                        20          :
          :  max. iterations                   250          :
          :  Hamiltonian                  GFN2-xTB          :
          :  restarted?                      false          :
          :  GBSA solvation                  false          :
          :  PC potential                    false          :
          :  electronic temp.          300.0000000     K    :
          :  accuracy                    1.0000000          :
          :  -> integral cutoff          0.2500000E+02      :
          :  -> integral neglect         0.1000000E-07      :
          :  -> SCF convergence          0.1000000E-05 Eh   :
          :  -> wf. convergence          0.1000000E-03 e    :
          :  Broyden damping             0.4000000          :
          ...................................................

 iter      E             dE          RMSdq      gap      omega  full diag
   1     -9.4744725 -0.947447E+01  0.159E+01    0.96       0.0  T
   2     -1.8426626  0.763181E+01  0.262E+01    1.53       1.0  T
   3     -6.2003283 -0.435767E+01  0.188E+01    0.35       1.0  T
   4     -9.4776702 -0.327734E+01  0.111E+01    0.92       1.0  T
   5    -10.0132353 -0.535565E+00  0.729E+00    0.06       1.0  T
   6    -10.0125128  0.722476E-03  0.730E+00    0.06       1.0  T
   7     -9.9521719  0.603409E-01  0.826E+00    0.09       1.0  T
   8     -9.9508453  0.132659E-02  0.829E+00    0.09       1.0  T
   9     -9.9100230  0.408223E-01  0.691E+00    0.22       1.0  T
  10     -9.9147746 -0.475156E-02  0.686E+00    0.21       1.0  T
  11     -9.9225841 -0.780956E-02  0.645E+00    0.20       1.0  T
  12     -9.9798603 -0.572762E-01  0.439E+00    0.12       1.0  T
  13    -10.0224465 -0.425862E-01  0.641E+00    0.06       1.0  T
  14    -10.0123229  0.101235E-01  0.370E+00    0.09       1.0  T
  15    -10.0527016 -0.403787E-01  0.212E+00    0.05       1.0  T
  16    -10.0555540 -0.285240E-02  0.196E+00    0.05       1.0  T
  17    -10.0591161 -0.356207E-02  0.171E+00    0.05       1.0  T
  18    -10.0669914 -0.787529E-02  0.139E+00    0.00       1.0  T
  19    -10.0699654 -0.297397E-02  0.468E-01    0.02       1.0  T
  20    -10.0697946  0.170778E-03  0.446E-01    0.01       1.0  T
  21    -10.0699663 -0.171718E-03  0.177E-01    0.01       1.0  T
  22    -10.0699640  0.235301E-05  0.105E-01    0.01       1.0  T
  23    -10.0699761 -0.121750E-04  0.384E-02    0.02       1.2  T
  24    -10.0699801 -0.398928E-05  0.905E-03    0.02       4.9  T
  25    -10.0699807 -0.583940E-06  0.287E-03    0.02      15.6  T
  26    -10.0699807 -0.825044E-08  0.119E-03    0.02      37.6  T
  27    -10.0699807 -0.163544E-08  0.478E-04    0.02      93.6  T
  28    -10.0699807  0.138277E-08  0.761E-04    0.02      58.7  T

   *** convergence criteria satisfied after 28 iterations ***

         #    Occupation            Energy/Eh            Energy/eV
      -------------------------------------------------------------
         1        2.0000           -0.7510558             -20.4373
       ...           ...                  ...                  ...
         4        2.0000           -0.6176839             -16.8080
         5        2.0000           -0.5738568             -15.6154
         6        2.0000           -0.5383632             -14.6496
         7        2.0000           -0.5265735             -14.3288
         8        2.0000           -0.5044827             -13.7277
         9        1.9995           -0.4541917             -12.3592
        10        1.1554           -0.4466334             -12.1535 (HOMO)
        11        0.8445           -0.4460378             -12.1373 (LUMO)
        12        0.0006           -0.4385832             -11.9345
        13                         -0.4281686             -11.6511
        14                         -0.3978175             -10.8252
        15                         -0.3370401              -9.1713
       ...                                ...                  ...
        20                          0.1499923               4.0815
      -------------------------------------------------------------
                  HL-Gap            0.0005956 Eh            0.0162 eV
             Fermi-level           -0.4463356 Eh          -12.1454 eV

 SCC (total)                   0 d,  0 h,  0 min,  0.006 sec
 SCC setup                      ...        0 min,  0.000 sec (  1.253%)
 Dispersion                     ...        0 min,  0.000 sec (  0.364%)
 integral evaluation            ...        0 min,  0.001 sec ( 22.758%)
 zeroth order Hamiltonian       ...        0 min,  0.000 sec (  0.310%)
 iterations                     ...        0 min,  0.003 sec ( 50.318%)
 molecular gradient             ...        0 min,  0.001 sec ( 23.400%)
 printout                       ...        0 min,  0.000 sec (  1.427%)

         :::::::::::::::::::::::::::::::::::::::::::::::::::::
         ::                     SUMMARY                     ::
         :::::::::::::::::::::::::::::::::::::::::::::::::::::
         :: total energy              -9.995221927202 Eh    ::
         :: gradient norm              0.187904146722 Eh/a0 ::
         :: HOMO-LUMO gap              0.016206436909 eV    ::
         ::.................................................::
         :: SCC energy               -10.069980709752 Eh    ::
         :: -> isotropic ES           -0.042925957495 Eh    ::
         :: -> anisotropic ES          0.001031978271 Eh    ::
         :: -> anisotropic XC          0.009728084045 Eh    ::
         :: -> dispersion             -0.003059016359 Eh    ::
         :: repulsion energy           0.074758580827 Eh    ::
         :: add. restraining           0.000000000000 Eh    ::
         :::::::::::::::::::::::::::::::::::::::::::::::::::::

      ----------------------------------------------------------- 
     |                   =====================                   |
     |                        A N C O P T                        |
     |                   =====================                   |
     |               Approximate Normal Coordinate               |
     |                Rational Function Optimizer                |
      ----------------------------------------------------------- 

          ...................................................
          :                      SETUP                      :
          :.................................................:
          :   optimization level            normal          :
          :   max. optcycles                   200          :
          :   ANC micro-cycles                  20          :
          :   degrees of freedom                 9          :
          :.................................................:
          :   RF solver                   davidson          :
          :   write xtbopt.log                true          :
          :   linear?                        false          :
          :   energy convergence         0.5000000E-05 Eh   :
          :   grad. convergence          0.1000000E-02 Eh/α :
          :   maximium RF displ.         1.0000000          :
          :   Hlow (freq-cutoff)         0.1000000E-01      :
          :   Hmax (freq-cutoff)         5.0000000          :
          :   S6 in model hess.         20.0000000          :
          ...................................................

generating ANC from model Hessian ...
Using Lindh-Hessian (1995)
 Shifting diagonal of input Hessian by    0.0000000000000000     
 Lowest  eigenvalues of input Hessian
   -0.000000   -0.000000    0.000000    0.000000    0.000000    0.000000
    0.050703    0.052042    0.081208    0.108462    0.378120    0.716628
    0.797771    1.106262    1.390321
 Highest eigenvalues
    0.108462    0.378120    0.716628    0.797771    1.106262    1.390321


........................................................................
.............................. CYCLE    1 ..............................
........................................................................
   1    -10.0699807 -0.100700E+02  0.300E-04    0.02       0.0  T
   2    -10.0699806  0.147467E-06  0.569E-03    0.02       7.9  T
   3    -10.0699807 -0.145011E-06  0.795E-04    0.02      56.3  T
   4    -10.0699807 -0.236303E-08  0.302E-04    0.02     148.3  T
     SCC iter.                  ...        0 min,  0.000 sec
     gradient                   ...        0 min,  0.001 sec
 * total energy  :    -9.9952219 Eh     change       -0.2255470E-08 Eh
   gradient norm :     0.1879068 Eh/α   predicted     0.0000000E+00 (-100.00%)
   displ. norm   :     0.2634237 α      lambda       -0.4544103E-01
   maximum displ.:     0.1868682 α      in ANC's #7, #5, #3, ...

........................................................................
.............................. CYCLE    2 ..............................
........................................................................
   1    -10.1063821 -0.101064E+02  0.370E+00    0.02       0.0  T
   2     -9.6206862  0.485696E+00  0.759E+00    1.19       1.0  T
   3    -10.0706896 -0.450003E+00  0.406E+00    0.21       1.0  T
   4     -9.8756527  0.195037E+00  0.577E+00    0.04       1.0  T
   5    -10.1447027 -0.269050E+00  0.376E-01    0.05       1.0  T
   6    -10.0848992  0.598034E-01  0.285E+00    0.16       1.0  T
   7    -10.1108465 -0.259472E-01  0.217E+00    0.12       1.0  T
   8    -10.1430661 -0.322197E-01  0.602E-01    0.07       1.0  T
   9    -10.1392340  0.383217E-02  0.977E-01    0.04       1.0  T
  10    -10.1300303  0.920368E-02  0.148E+00    0.03       1.0  T
  11    -10.1353787 -0.534845E-02  0.120E+00    0.04       1.0  T
  12    -10.1437163 -0.833755E-02  0.533E-01    0.05       1.0  T
  13    -10.1458515 -0.213521E-02  0.521E-02    0.06       1.0  T
  14    -10.1458615 -0.100097E-04  0.544E-02    0.06       1.0  T
  15    -10.1458756 -0.140762E-04  0.170E-02    0.06       2.6  T
  16    -10.1458773 -0.169642E-05  0.605E-03    0.06       7.4  T
  17    -10.1458774 -0.177298E-06  0.315E-03    0.06      14.2  T
  18    -10.1458775 -0.679547E-07  0.282E-04    0.06     158.8  T
  19    -10.1458775 -0.106416E-09  0.257E-04    0.06     174.2  T
     SCC iter.                  ...        0 min,  0.002 sec
     gradient                   ...        0 min,  0.001 sec
 * total energy  :   -10.0366236 Eh     change       -0.4140169E-01 Eh
   gradient norm :     0.1830789 Eh/α   predicted    -0.2429713E-01 ( -41.31%)
   displ. norm   :     0.8004907 α      lambda       -0.1350328E+00
   maximum displ.:     0.7050550 α      in ANC's #7, #5, #3, ...

........................................................................
.............................. CYCLE    3 ..............................
........................................................................
   1     -9.7632570 -0.976326E+01  0.102E+01    0.91       0.0  T
   2     -6.2693426  0.349391E+01  0.210E+01    1.17       1.0  T
   3    -10.2307293 -0.396139E+01  0.767E+00    0.65       1.0  T
   4    -10.3434825 -0.112753E+00  0.391E+00    0.02       1.0  T
   5    -10.2455168  0.979657E-01  0.633E+00    0.57       1.0  T
   6    -10.2633010 -0.177842E-01  0.573E+00    0.44       1.0  T
   7    -10.2853116 -0.220106E-01  0.493E+00    0.30       1.0  T
   8    -10.2172411  0.680705E-01  0.656E+00    0.73       1.0  T
   9    -10.2650525 -0.478114E-01  0.516E+00    0.42       1.0  T
  10    -10.2805769 -0.155244E-01  0.482E+00    0.32       1.0  T
  11    -10.3082819 -0.277049E-01  0.422E+00    0.21       1.0  T
  12    -10.2708512  0.374307E-01  0.507E+00    0.38       1.0  T
  13    -10.0263918  0.244459E+00  0.889E+00    0.35       1.0  T
  14    -10.1173966 -0.910047E-01  0.734E+00    0.14       1.0  T
  15    -10.2371296 -0.119733E+00  0.592E+00    0.61       1.0  T
  16    -10.3809092 -0.143780E+00  0.223E+00    0.09       1.0  T
  17    -10.1075215  0.273388E+00  0.761E+00    0.15       1.0  T
  18    -10.2698074 -0.162286E+00  0.517E+00    0.40       1.0  T
  19    -10.3281910 -0.583836E-01  0.378E+00    0.03       1.0  T
  20    -10.3051919  0.229991E-01  0.437E+00    0.22       1.0  T
  21    -10.2382656  0.669262E-01  0.562E+00    0.07       1.0  T
  22    -10.3006804 -0.624148E-01  0.448E+00    0.24       1.0  T
  23    -10.3571540 -0.564736E-01  0.299E+00    0.02       1.0  T
  24    -10.3376538  0.195002E-01  0.359E+00    0.15       1.0  T
  25    -10.3349123  0.274151E-02  0.364E+00    0.03       1.0  T
  26    -10.3504691 -0.155568E-01  0.324E+00    0.13       1.0  T
  27    -10.3612623 -0.107932E-01  0.288E+00    0.02       1.0  T
  28    -10.3730433 -0.117811E-01  0.250E+00    0.10       1.0  T
  29    -10.3809268 -0.788350E-02  0.216E+00    0.00       1.0  T
  30    -10.3934765 -0.125497E-01  0.156E+00    0.07       1.0  T
  31    -10.3979253 -0.444878E-02  0.124E+00    0.01       1.0  T
  32    -10.4052763 -0.735108E-02  0.444E-01    0.04       1.0  T
  33    -10.4059130 -0.636695E-03  0.260E-01    0.03       1.0  T
  34    -10.4056826  0.230408E-03  0.332E-01    0.03       1.0  T
  35    -10.4062674 -0.584811E-03  0.636E-02    0.03       1.0  T
  36    -10.4061039  0.163519E-03  0.184E-01    0.03       1.0  T
  37    -10.4062644 -0.160472E-03  0.693E-02    0.03       1.0  T
  38    -10.4062413  0.231108E-04  0.954E-02    0.03       1.0  T
  39    -10.4062794 -0.381081E-04  0.468E-02    0.03       1.0  T
  40    -10.4062801 -0.685667E-06  0.457E-02    0.03       1.0  T
  41    -10.4062862 -0.617662E-05  0.316E-02    0.04       1.4  T
  42    -10.4062884 -0.210555E-05  0.247E-02    0.04       1.8  T
  43    -10.4062901 -0.172259E-05  0.171E-02    0.04       2.6  T
  44    -10.4062912 -0.109247E-05  0.954E-03    0.04       4.7  T
  45    -10.4062916 -0.422797E-06  0.361E-03    0.04      12.4  T
  46    -10.4062917 -0.704313E-07  0.241E-04    0.04     185.5  T
  47    -10.4062917 -0.222609E-09  0.131E-04    0.04     341.9  T
     SCC iter.                  ...        0 min,  0.006 sec
     gradient                   ...        0 min,  0.001 sec
 * total energy  :    -9.9694229 Eh     change        0.6720069E-01 Eh
   gradient norm :     0.6321252 Eh/α   predicted    -0.1107799E+00 (-264.85%)
   displ. norm   :     0.4255569 α      lambda       -0.2547021E+00
   maximum displ.:     0.3574504 α      in ANC's #7, #3, #5, ...

........................................................................
.............................. CYCLE    4 ..............................
........................................................................
   1    -10.0679969 -0.100680E+02  0.577E+00    0.71       0.0  T
   2     -6.8208803  0.324712E+01  0.194E+01    1.43       1.0  T
   3    -10.1307772 -0.330990E+01  0.504E+00    0.03       1.0  T
   4    -10.1803388 -0.495616E-01  0.372E+00    0.19       1.0  T
   5     -9.9026315  0.277707E+00  0.713E+00    0.10       1.0  T
   6    -10.1712530 -0.268621E+00  0.381E+00    0.25       1.0  T
   7    -10.1973882 -0.261353E-01  0.315E+00    0.17       1.0  T
   8    -10.2176739 -0.202857E-01  0.258E+00    0.13       1.0  T
   9    -10.2602284 -0.425545E-01  0.410E-02    0.05       1.1  T
  10    -10.2579129  0.231555E-02  0.607E-01    0.04       1.0  T
  11    -10.2585961 -0.683254E-03  0.510E-01    0.04       1.0  T
  12    -10.2601988 -0.160262E-02  0.731E-02    0.05       1.0  T
  13    -10.2595976  0.601188E-03  0.314E-01    0.06       1.0  T
  14    -10.2602010 -0.603405E-03  0.739E-02    0.05       1.0  T
  15    -10.2602360 -0.350255E-04  0.214E-03    0.05      20.9  T
  16    -10.2602356  0.388338E-06  0.794E-03    0.05       5.6  T
  17    -10.2602360 -0.384395E-06  0.213E-03    0.05      21.0  T
  18    -10.2602360 -0.259836E-07  0.621E-04    0.05      72.1  T
  19    -10.2602360 -0.255019E-08  0.658E-05    0.05     679.8  T
     SCC iter.                  ...        0 min,  0.002 sec
     gradient                   ...        0 min,  0.001 sec
 * total energy  :   -10.0843898 Eh     change       -0.1149669E+00 Eh
   gradient norm :     0.0586099 Eh/α   predicted    -0.1504141E+00 (  30.83%)
   displ. norm   :     0.4703505 α      lambda       -0.2074650E-01
   maximum displ.:     0.4604327 α      in ANC's #3, #7, #9, ...

........................................................................
.............................. CYCLE    5 ..............................
........................................................................
   1    -10.0042189 -0.100042E+02  0.621E+00    0.07       0.0  T
   2     -8.8182471  0.118597E+01  0.122E+01    0.05       1.0  T
   3    -10.0614385 -0.124319E+01  0.561E+00    0.86       1.0  T
   4    -10.1274112 -0.659727E-01  0.449E+00    0.46       1.0  T
   5    -10.1592651 -0.318539E-01  0.386E+00    0.25       1.0  T
   6     -9.9368752  0.222390E+00  0.727E+00    0.10       1.0  T
   7     -9.9696083 -0.327331E-01  0.677E+00    0.08       1.0  T
   8    -10.1974638 -0.227855E+00  0.291E+00    0.14       1.0  T
   9    -10.1941478  0.331605E-02  0.299E+00    0.15       1.0  T
  10    -10.2310652 -0.369174E-01  0.172E+00    0.09       1.0  T
  11    -10.2426238 -0.115587E-01  0.104E+00    0.03       1.0  T
  12    -10.2486008 -0.597692E-02  0.335E-01    0.04       1.0  T
  13    -10.2492614 -0.660604E-03  0.709E-02    0.05       1.0  T
  14    -10.2491360  0.125411E-03  0.160E-01    0.04       1.0  T
  15    -10.2492923 -0.156330E-03  0.174E-03    0.05      25.7  T
  16    -10.2492753  0.169937E-04  0.525E-02    0.05       1.0  T
  17    -10.2492913 -0.159696E-04  0.129E-02    0.05       3.5  T
  18    -10.2492921 -0.856139E-06  0.534E-03    0.05       8.4  T
  19    -10.2492923 -0.143336E-06  0.234E-03    0.05      19.1  T
  20    -10.2492923 -0.317012E-07  0.549E-04    0.05      81.4  T
  21    -10.2492923 -0.535236E-09  0.466E-04    0.05      96.1  T
     SCC iter.                  ...        0 min,  0.002 sec
     gradient                   ...        0 min,  0.001 sec
 * total energy  :   -10.0983283 Eh     change       -0.1393851E-01 Eh
   gradient norm :     0.0820992 Eh/α   predicted    -0.1266812E-01 (  -9.11%)
   displ. norm   :     0.2897386 α      lambda       -0.8905489E-02
   maximum displ.:     0.2578843 α      in ANC's #3, #5, #9, ...

........................................................................
.............................. CYCLE    6 ..............................
........................................................................
   1    -10.2002755 -0.102003E+02  0.257E+00    0.00       0.0  T
   2     -9.8887939  0.311482E+00  0.642E+00    1.21       1.0  T
   3    -10.1662256 -0.277432E+00  0.366E+00    0.21       1.0  T
   4    -10.2001828 -0.339571E-01  0.269E+00    0.13       1.0  T
   5     -9.7876517  0.412531E+00  0.893E+00    0.21       1.0  T
   6     -9.9840840 -0.196432E+00  0.665E+00    0.08       1.0  T
   7    -10.2216005 -0.237516E+00  0.165E+00    0.09       1.0  T
   8    -10.2370510 -0.154505E-01  0.136E-01    0.05       1.0  T
   9    -10.2288970  0.815403E-02  0.120E+00    0.02       1.0  T
  10    -10.2337905 -0.489346E-02  0.762E-01    0.03       1.0  T
  11    -10.2369603 -0.316979E-02  0.178E-01    0.04       1.0  T
  12    -10.2371044 -0.144101E-03  0.807E-02    0.05       1.0  T
  13    -10.2370993  0.508444E-05  0.858E-02    0.05       1.0  T
  14    -10.2371101 -0.108043E-04  0.747E-02    0.05       1.0  T
  15    -10.2371274 -0.173730E-04  0.504E-02    0.05       1.0  T
  16    -10.2371415 -0.140003E-04  0.103E-02    0.05       4.3  T
  17    -10.2371420 -0.586370E-06  0.212E-03    0.05      21.1  T
  18    -10.2371421 -0.259810E-07  0.144E-04    0.05     310.6  T
  19    -10.2371421  0.979732E-10  0.191E-04    0.05     234.3  T
     SCC iter.                  ...        0 min,  0.002 sec
     gradient                   ...        0 min,  0.001 sec
 * total energy  :   -10.1043670 Eh     change       -0.6038640E-02 Eh
   gradient norm :     0.0928572 Eh/α   predicted    -0.4826549E-02 ( -20.07%)
   displ. norm   :     0.2289815 α      lambda       -0.1248220E-01
   maximum displ.:     0.1508791 α      in ANC's #5, #3, #9, ...

........................................................................
.............................. CYCLE    7 ..............................
........................................................................
   1    -10.2034592 -0.102035E+02  0.252E+00    0.01       0.0  T
   2     -9.9574659  0.245993E+00  0.589E+00    0.97       1.0  T
   3    -10.1876232 -0.230157E+00  0.336E+00    0.22       1.0  T
   4    -10.2001771 -0.125538E-01  0.294E+00    0.17       1.0  T
   5     -9.8052094  0.394968E+00  0.915E+00    0.20       1.0  T
   6    -10.1792870 -0.374078E+00  0.341E+00    0.01       1.0  T
   7    -10.2336554 -0.543684E-01  0.104E+00    0.08       1.0  T
   8    -10.2348029 -0.114755E-02  0.918E-01    0.04       1.0  T
   9    -10.2391517 -0.434884E-02  0.570E-02    0.06       1.0  T
  10    -10.2391652 -0.134122E-04  0.262E-02    0.06       1.7  T
  11    -10.2387029  0.462269E-03  0.299E-01    0.05       1.0  T
  12    -10.2390731 -0.370213E-03  0.136E-01    0.06       1.0  T
  13    -10.2391683 -0.952047E-04  0.952E-03    0.06       4.7  T
  14    -10.2391571  0.112060E-04  0.475E-02    0.06       1.0  T
  15    -10.2391672 -0.100674E-04  0.178E-02    0.06       2.5  T
  16    -10.2391688 -0.164701E-05  0.125E-03    0.06      35.8  T
  17    -10.2391688 -0.304324E-08  0.954E-04    0.06      46.9  T
  18    -10.2391688  0.173426E-09  0.967E-04    0.06      46.3  T
     SCC iter.                  ...        0 min,  0.002 sec
     gradient                   ...        0 min,  0.001 sec
 * total energy  :   -10.1143142 Eh     change       -0.9947230E-02 Eh
   gradient norm :     0.0778085 Eh/α   predicted    -0.6568330E-02 ( -33.97%)
   displ. norm   :     0.4523326 α      lambda       -0.2036351E-01
   maximum displ.:     0.2887303 α      in ANC's #5, #2, #9, ...

........................................................................
.............................. CYCLE    8 ..............................
........................................................................
   1    -10.1870556 -0.101871E+02  0.517E+00    0.70       0.0  T
   2     -9.4686045  0.718451E+00  0.961E+00    0.04       1.0  T
   3    -10.2683065 -0.799702E+00  0.205E+00    0.72       1.0  T
   4    -10.2494728  0.188338E-01  0.210E+00    0.69       1.0  T
   5    -10.2715143 -0.220415E-01  0.125E+00    0.73       1.0  T
   6    -10.2731896 -0.167529E-02  0.124E+00    0.77       1.0  T
   7    -10.2735660 -0.376390E-03  0.105E+00    0.77       1.0  T
   8    -10.2735206  0.453843E-04  0.109E+00    0.77       1.0  T
   9    -10.2743158 -0.795176E-03  0.473E-01    0.76       1.0  T
  10    -10.2744561 -0.140362E-03  0.127E-01    0.75       1.0  T
  11    -10.2744655 -0.941728E-05  0.363E-02    0.75       1.2  T
  12    -10.2744666 -0.106488E-05  0.162E-02    0.75       2.8  T
  13    -10.2744668 -0.205930E-06  0.904E-04    0.75      49.5  T
  14    -10.2744668 -0.820689E-09  0.801E-04    0.75      55.8  T
     SCC iter.                  ...        0 min,  0.002 sec
     gradient                   ...        0 min,  0.001 sec
 * total energy  :   -10.1458983 Eh     change       -0.3158406E-01 Eh
   gradient norm :     0.1333124 Eh/α   predicted    -0.1226499E-01 ( -61.17%)
   displ. norm   :     0.7660881 α      lambda       -0.7142901E-01
   maximum displ.:     0.6938590 α      in ANC's #2, #3, #5, ...

........................................................................
.............................. CYCLE    9 ..............................
........................................................................
   1    -10.3021985 -0.103022E+02  0.461E+00    1.42       0.0  T
   2    -10.2727737  0.294248E-01  0.321E+00    0.86       1.0  T
   3    -10.2045317  0.682419E-01  0.396E+00    1.84       1.0  T
   4    -10.3122489 -0.107717E+00  0.286E-01    1.24       1.0  T
   5    -10.3124618 -0.212918E-03  0.171E-01    1.22       1.0  T
   6    -10.3124807 -0.188655E-04  0.138E-01    1.22       1.0  T
   7    -10.3125080 -0.273255E-04  0.384E-02    1.21       1.2  T
   8    -10.3125207 -0.126980E-04  0.131E-02    1.21       3.4  T
   9    -10.3125209 -0.191479E-06  0.181E-03    1.21      24.8  T
  10    -10.3125209 -0.126297E-08  0.572E-04    1.21      78.2  T
  11    -10.3125209  0.651893E-09  0.314E-04    1.21     142.5  T
     SCC iter.                  ...        0 min,  0.001 sec
     gradient                   ...        0 min,  0.001 sec
 * total energy  :   -10.2057510 Eh     change       -0.5985277E-01 Eh
   gradient norm :     0.1719980 Eh/α   predicted    -0.5667501E-01 (  -5.31%)
   displ. norm   :     0.5240059 α      lambda       -0.4151275E-01
   maximum displ.:     0.4647051 α      in ANC's #2, #5, #3, ...

........................................................................
.............................. CYCLE   10 ..............................
........................................................................
   1    -10.3848985 -0.103849E+02  0.401E+00    1.19       0.0  T
   2    -10.3850886 -0.190127E-03  0.241E+00    1.24       1.0  T
   3    -10.3781949  0.689375E-02  0.102E+00    1.08       1.0  T
   4    -10.3849698 -0.677491E-02  0.298E-01    1.22       1.0  T
   5    -10.3850411 -0.712633E-04  0.280E-01    1.22       1.0  T
   6    -10.3851789 -0.137801E-03  0.233E-01    1.21       1.0  T
   7    -10.3856262 -0.447308E-03  0.207E-02    1.21       2.2  T
   8    -10.3856276 -0.143226E-05  0.523E-03    1.21       8.6  T
   9    -10.3856276  0.157444E-07  0.434E-03    1.21      10.3  T
  10    -10.3856277 -0.929421E-07  0.436E-04    1.21     102.6  T
  11    -10.3856277 -0.644720E-09  0.154E-04    1.21     290.7  T
     SCC iter.                  ...        0 min,  0.001 sec
     gradient                   ...        0 min,  0.001 sec
 * total energy  :   -10.2174271 Eh     change       -0.1167606E-01 Eh
   gradient norm :     0.1089861 Eh/α   predicted    -0.2645570E-01 ( 126.58%)
   displ. norm   :     0.4251230 α      lambda       -0.3789218E-01
   maximum displ.:     0.3042834 α      in ANC's #3, #5, #9, ...

........................................................................
.............................. CYCLE   11 ..............................
........................................................................
   1    -10.3823744 -0.103824E+02  0.257E+00    1.41       0.0  T
   2    -10.3826525 -0.278178E-03  0.181E+00    1.39       1.0  T
   3    -10.3792290  0.342353E-02  0.103E+00    1.41       1.0  T
   4    -10.3841512 -0.492220E-02  0.256E-01    1.44       1.0  T
   5    -10.3846389 -0.487685E-03  0.115E-01    1.41       1.0  T
   6    -10.3845403  0.986537E-04  0.140E-01    1.41       1.0  T
   7    -10.3847148 -0.174585E-03  0.729E-03    1.41       6.1  T
   8    -10.3847149 -0.791527E-07  0.353E-03    1.41      12.7  T
   9    -10.3847149 -0.221134E-07  0.242E-03    1.41      18.5  T
  10    -10.3847150 -0.184380E-07  0.191E-04    1.41     234.7  T
  11    -10.3847150 -0.401190E-10  0.634E-05    1.41     705.7  T
     SCC iter.                  ...        0 min,  0.001 sec
     gradient                   ...        0 min,  0.001 sec
 * total energy  :   -10.2297050 Eh     change       -0.1227789E-01 Eh
   gradient norm :     0.0979076 Eh/α   predicted    -0.2237020E-01 (  82.20%)
   displ. norm   :     0.2717090 α      lambda       -0.1627572E-01
   maximum displ.:     0.2166302 α      in ANC's #2, #3, #9, ...

........................................................................
.............................. CYCLE   12 ..............................
........................................................................
   1    -10.3795142 -0.103795E+02  0.166E+00    1.75       0.0  T
   2    -10.3795068  0.745908E-05  0.101E+00    1.80       1.0  T
   3    -10.3791106  0.396183E-03  0.878E-01    1.76       1.0  T
   4    -10.3811966 -0.208607E-02  0.106E-01    1.80       1.0  T
   5    -10.3812042 -0.754980E-05  0.111E-01    1.79       1.0  T
   6    -10.3812379 -0.337110E-04  0.459E-02    1.80       1.0  T
   7    -10.3812569 -0.189847E-04  0.114E-02    1.80       3.9  T
   8    -10.3812578 -0.888967E-06  0.267E-03    1.80      16.8  T
   9    -10.3812578  0.261076E-08  0.761E-04    1.80      58.7  T
  10    -10.3812578 -0.392758E-08  0.188E-04    1.80     237.7  T
     SCC iter.                  ...        0 min,  0.001 sec
     gradient                   ...        0 min,  0.001 sec
 * total energy  :   -10.2395295 Eh     change       -0.9824557E-02 Eh
   gradient norm :     0.0734415 Eh/α   predicted    -0.8738645E-02 ( -11.05%)
   displ. norm   :     0.0994592 α      lambda       -0.6725230E-02
   maximum displ.:     0.0760393 α      in ANC's #7, #9, #2, ...

........................................................................
.............................. CYCLE   13 ..............................
........................................................................
   1    -10.4038475 -0.104038E+02  0.593E-01    1.76       0.0  T
   2    -10.4037767  0.708566E-04  0.403E-01    1.74       1.0  T
   3    -10.4028594  0.917236E-03  0.373E-01    1.78       1.0  T
   4    -10.4039344 -0.107492E-02  0.497E-02    1.75       1.0  T
   5    -10.4039419 -0.757590E-05  0.293E-02    1.75       1.5  T
   6    -10.4039332  0.876668E-05  0.374E-02    1.75       1.2  T
   7    -10.4039458 -0.125963E-04  0.146E-03    1.75      30.7  T
   8    -10.4039458 -0.107464E-08  0.625E-04    1.75      71.6  T
   9    -10.4039458 -0.125480E-09  0.997E-05    1.75     448.7  T
     SCC iter.                  ...        0 min,  0.001 sec
     gradient                   ...        0 min,  0.001 sec
 * total energy  :   -10.2439615 Eh     change       -0.4431953E-02 Eh
   gradient norm :     0.0335128 Eh/α   predicted    -0.3395875E-02 ( -23.38%)
   displ. norm   :     0.1061727 α      lambda       -0.2939180E-02
   maximum displ.:     0.0798432 α      in ANC's #2, #7, #5, ...

........................................................................
.............................. CYCLE   14 ..............................
........................................................................
   1    -10.4181515 -0.104182E+02  0.771E-01    1.60       0.0  T
   2    -10.4179835  0.167999E-03  0.453E-01    1.56       1.0  T
   3    -10.4170739  0.909603E-03  0.509E-01    1.61       1.0  T
   4    -10.4183598 -0.128586E-02  0.732E-02    1.57       1.0  T
   5    -10.4183797 -0.198959E-04  0.339E-02    1.57       1.3  T
   6    -10.4183597  0.199766E-04  0.472E-02    1.57       1.0  T
   7    -10.4183815 -0.217703E-04  0.278E-03    1.57      16.1  T
   8    -10.4183815 -0.361066E-07  0.848E-04    1.57      52.7  T
   9    -10.4183815 -0.249345E-09  0.927E-05    1.57     482.5  T
     SCC iter.                  ...        0 min,  0.001 sec
     gradient                   ...        0 min,  0.001 sec
 * total energy  :   -10.2454668 Eh     change       -0.1505288E-02 Eh
   gradient norm :     0.0273319 Eh/α   predicted    -0.1486158E-02 (  -1.27%)
   displ. norm   :     0.0553446 α      lambda       -0.1287336E-02
   maximum displ.:     0.0455283 α      in ANC's #7, #3, #2, ...

........................................................................
.............................. CYCLE   15 ..............................
........................................................................
   1    -10.4221727 -0.104222E+02  0.556E-01    1.59       0.0  T
   2    -10.4219338  0.238880E-03  0.391E-01    1.56       1.0  T
   3    -10.4218118  0.122075E-03  0.326E-01    1.60       1.0  T
   4    -10.4223795 -0.567767E-03  0.465E-02    1.58       1.0  T
   5    -10.4223968 -0.172350E-04  0.189E-02    1.58       2.4  T
   6    -10.4223986 -0.187742E-05  0.110E-02    1.58       4.1  T
   7    -10.4223990 -0.361520E-06  0.127E-03    1.58      35.3  T
   8    -10.4223990 -0.698060E-08  0.320E-04    1.58     139.7  T
   9    -10.4223990  0.392824E-10  0.107E-04    1.58     417.4  T
     SCC iter.                  ...        0 min,  0.001 sec
     gradient                   ...        0 min,  0.001 sec
 * total energy  :   -10.2462469 Eh     change       -0.7800918E-03 Eh
   gradient norm :     0.0181993 Eh/α   predicted    -0.6456387E-03 ( -17.24%)
   displ. norm   :     0.0520942 α      lambda       -0.6508370E-03
   maximum displ.:     0.0279341 α      in ANC's #2, #5, #3, ...

........................................................................
.............................. CYCLE   16 ..............................
........................................................................
   1    -10.4184521 -0.104185E+02  0.329E-01    1.52       0.0  T
   2    -10.4184170  0.350516E-04  0.194E-01    1.50       1.0  T
   3    -10.4180490  0.368040E-03  0.243E-01    1.53       1.0  T
   4    -10.4183697 -0.320696E-03  0.107E-01    1.51       1.0  T
   5    -10.4184793 -0.109651E-03  0.107E-02    1.51       4.2  T
   6    -10.4184797 -0.356132E-06  0.607E-03    1.51       7.4  T
   7    -10.4184797 -0.692122E-07  0.811E-04    1.51      55.1  T
   8    -10.4184797 -0.961784E-09  0.439E-04    1.51     101.8  T
     SCC iter.                  ...        0 min,  0.001 sec
     gradient                   ...        0 min,  0.001 sec
 * total energy  :   -10.2466033 Eh     change       -0.3564438E-03 Eh
   gradient norm :     0.0034213 Eh/α   predicted    -0.3263007E-03 (  -8.46%)
   displ. norm   :     0.0129306 α      lambda       -0.2939366E-04
   maximum displ.:     0.0075539 α      in ANC's #1, #9, #4, ...

........................................................................
.............................. CYCLE   17 ..............................
........................................................................
   1    -10.4175240 -0.104175E+02  0.105E-01    1.51       0.0  T
   2    -10.4174167  0.107296E-03  0.129E-01    1.50       1.0  T
   3    -10.4175179 -0.101229E-03  0.694E-02    1.51       1.0  T
   4    -10.4175270 -0.907212E-05  0.474E-02    1.51       1.0  T
   5    -10.4175448 -0.178901E-04  0.606E-03    1.50       7.4  T
   6    -10.4175450 -0.203161E-06  0.261E-03    1.51      17.1  T
   7    -10.4175451 -0.154002E-07  0.418E-04    1.51     106.9  T
   8    -10.4175451 -0.301391E-09  0.158E-04    1.51     282.6  T
     SCC iter.                  ...        0 min,  0.001 sec
     gradient                   ...        0 min,  0.001 sec
 * total energy  :   -10.2466078 Eh     change       -0.4473384E-05 Eh
   gradient norm :     0.0024027 Eh/α   predicted    -0.1469736E-04 ( 228.55%)
   displ. norm   :     0.0123868 α      lambda       -0.2573966E-04
   maximum displ.:     0.0086977 α      in ANC's #1, #4, #9, ...

........................................................................
.............................. CYCLE   18 ..............................
........................................................................
   1    -10.4170227 -0.104170E+02  0.106E-01    1.50       0.0  T
   2    -10.4168835  0.139123E-03  0.144E-01    1.50       1.0  T
   3    -10.4170290 -0.145424E-03  0.641E-02    1.50       1.0  T
   4    -10.4170349 -0.594067E-05  0.408E-02    1.50       1.1  T
   5    -10.4170473 -0.124013E-04  0.542E-03    1.50       8.2  T
   6    -10.4170475 -0.150084E-06  0.274E-03    1.50      16.3  T
   7    -10.4170475 -0.229153E-07  0.489E-04    1.50      91.4  T
   8    -10.4170475 -0.563842E-09  0.129E-04    1.50     346.5  T
     SCC iter.                  ...        0 min,  0.001 sec
     gradient                   ...        0 min,  0.001 sec
 * total energy  :   -10.2466112 Eh     change       -0.3445700E-05 Eh
   gradient norm :     0.0019721 Eh/α   predicted    -0.1287119E-04 ( 273.54%)
   displ. norm   :     0.0090622 α      lambda       -0.1026043E-04
   maximum displ.:     0.0053031 α      in ANC's #9, #7, #1, ...

........................................................................
.............................. CYCLE   19 ..............................
........................................................................
   1    -10.4177459 -0.104177E+02  0.716E-02    1.51       0.0  T
   2    -10.4177113  0.346035E-04  0.783E-02    1.51       1.0  T
   3    -10.4177374 -0.261582E-04  0.509E-02    1.51       1.0  T
   4    -10.4177421 -0.470544E-05  0.375E-02    1.51       1.2  T
   5    -10.4177540 -0.119126E-04  0.415E-03    1.51      10.8  T
   6    -10.4177541 -0.934323E-07  0.174E-03    1.51      25.8  T
   7    -10.4177541 -0.562582E-08  0.256E-04    1.51     174.7  T
   8    -10.4177541 -0.686722E-10  0.139E-04    1.51     322.0  T
     SCC iter.                  ...        0 min,  0.001 sec
     gradient                   ...        0 min,  0.001 sec
 * total energy  :   -10.2466146 Eh     change       -0.3317083E-05 Eh
   gradient norm :     0.0011462 Eh/α   predicted    -0.5130036E-05 (  54.66%)
   displ. norm   :     0.0033920 α      lambda       -0.2189135E-05
   maximum displ.:     0.0022563 α      in ANC's #9, #7, #1, ...

........................................................................
.............................. CYCLE   20 ..............................
........................................................................
   1    -10.4174598 -0.104175E+02  0.257E-02    1.51       0.0  T
   2    -10.4174573  0.252236E-05  0.238E-02    1.51       1.9  T
   3    -10.4174580 -0.671983E-06  0.196E-02    1.51       2.3  T
   4    -10.4174585 -0.548947E-06  0.155E-02    1.51       2.9  T
   5    -10.4174607 -0.215470E-05  0.136E-03    1.51      32.9  T
   6    -10.4174607 -0.952868E-08  0.598E-04    1.51      74.7  T
   7    -10.4174607 -0.593582E-09  0.517E-05    1.51     865.3  T
     SCC iter.                  ...        0 min,  0.001 sec
     gradient                   ...        0 min,  0.001 sec
 * total energy  :   -10.2466162 Eh     change       -0.1602482E-05 Eh
   gradient norm :     0.0001091 Eh/α   predicted    -0.1093737E-05 ( -31.75%)
   displ. norm   :     0.0005528 α      lambda       -0.3216552E-07
   maximum displ.:     0.0003633 α      in ANC's #1, #4, #7, ...

   *** GEOMETRY OPTIMIZATION CONVERGED AFTER 20 ITERATIONS ***

------------------------------------------------------------------------
 total energy gain   :        -0.2513942 Eh     -157.7523 kcal/mol
 total RMSD          :         1.1675644 a0        0.6178 Å
 total power (kW/mol):       -33.0017725 (step)-7601.4139 (real)
------------------------------------------------------------------------

 ANCopt (total)                0 d,  0 h,  0 min,  0.087 sec
 optimizer setup                ...        0 min,  0.000 sec (  0.070%)
 model hessian                  ...        0 min,  0.000 sec (  0.086%)
 ANC generation                 ...        0 min,  0.000 sec (  0.077%)
 coordinate transformation      ...        0 min,  0.000 sec (  0.047%)
 single point calculation       ...        0 min,  0.085 sec ( 97.995%)
 optimization log               ...        0 min,  0.000 sec (  0.559%)
 hessian update                 ...        0 min,  0.000 sec (  0.052%)
 rational function              ...        0 min,  0.000 sec (  0.471%)

================
 final structure:
================
5
 xtb: 6.2.2 (9d81278992624c895f80dd42a50cac0aa55982e2)
C        -0.43028285391384   -1.25504677914093    0.19284264556507
C        -0.81002212111658    0.04565832772576   -0.00648731759790
C         0.73215059555928   -0.49692722446640    0.53006504822515
C        -0.28354847203952    1.29526630057815   -0.19828076034499
C         0.79170385151066    0.41105037530341   -0.51813961584734

 Bond Distances (Angstroems)
 ---------------------------
C1-C2=1.3696         C1-C3=1.4282         C2-C1=1.3696         C2-C3=1.7206         C2-C4=1.3695         C2-C5=1.7207         
C3-C1=1.4282         C3-C2=1.7206         C3-C5=1.3881         C4-C2=1.3695         C4-C5=1.4284         C5-C2=1.7207         
C5-C3=1.3881         C5-C4=1.4284         
 C  C  Rav=1.4893 sigma=0.1481  Rmin=1.3695  Rmax=1.7207     7

 selected bond angles (degree)
 --------------------
C3-C1-C2= 75.87                C3-C2-C1= 53.60                C4-C2-C1=141.29                C4-C2-C3= 89.25                
C5-C2-C1= 89.25                C5-C2-C3= 47.58                C5-C2-C4= 53.61                C2-C3-C1= 50.52                
C5-C3-C1=101.76                C5-C3-C2= 66.22                C5-C4-C2= 75.87                C3-C5-C2= 66.21                
C4-C5-C2= 50.52                C4-C5-C3=101.74                

 selected dihedral angles (degree)
 ---------------------------------
C4-C2-C1-C3= 18.90            C5-C2-C1-C3= 34.06            C5-C3-C1-C2=314.84            C1-C3-C2-C4=191.69            
C1-C3-C2-C5=229.34            C5-C3-C2-C1=130.66            C5-C3-C2-C4=322.35            C5-C4-C2-C1= 18.95            
C5-C4-C2-C3= 34.06            C3-C5-C2-C1=322.36            C3-C5-C2-C4=130.65            C4-C5-C2-C1=191.72            
C4-C5-C2-C3=229.35            C2-C5-C3-C1= 36.73            C4-C5-C3-C1= 73.47            C4-C5-C3-C2= 36.74            
C3-C5-C4-C2=314.84            
           -------------------------------------------------
          |                Final Singlepoint                |
           -------------------------------------------------

          ...................................................
          :                      SETUP                      :
          :.................................................:
          :  # basis functions                  20          :
          :  # atomic orbitals                  20          :
          :  # shells                           10          :
          :  # electrons                        20          :
          :  max. iterations                   250          :
          :  Hamiltonian                  GFN2-xTB          :
          :  restarted?                      false          :
          :  GBSA solvation                  false          :
          :  PC potential                    false          :
          :  electronic temp.          300.0000000     K    :
          :  accuracy                    1.0000000          :
          :  -> integral cutoff          0.2500000E+02      :
          :  -> integral neglect         0.1000000E-07      :
          :  -> SCF convergence          0.1000000E-05 Eh   :
          :  -> wf. convergence          0.1000000E-03 e    :
          :  Broyden damping             0.4000000          :
          ...................................................

 iter      E             dE          RMSdq      gap      omega  full diag
   1    -10.4174607 -0.104175E+02  0.350E-05    1.51       0.0  T
   2    -10.4174607  0.265743E-11  0.333E-05    1.51    1343.9  T
   3    -10.4174607 -0.782130E-11  0.116E-05    1.51    3861.7  T

   *** convergence criteria satisfied after 3 iterations ***

         #    Occupation            Energy/Eh            Energy/eV
      -------------------------------------------------------------
         1        2.0000           -0.7519894             -20.4627
       ...           ...                  ...                  ...
         4        2.0000           -0.5825420             -15.8518
         5        2.0000           -0.5621322             -15.2964
         6        2.0000           -0.5531638             -15.0524
         7        2.0000           -0.5012251             -13.6390
         8        2.0000           -0.4636899             -12.6176
         9        2.0000           -0.4517864             -12.2937
        10        2.0000           -0.4330005             -11.7825 (HOMO)
        11                         -0.3776512             -10.2764 (LUMO)
        12                         -0.3207217              -8.7273
        13                         -0.3122310              -8.4962
        14                         -0.2455583              -6.6820
        15                         -0.2228794              -6.0649
       ...                                ...                  ...
        20                          0.6097479              16.5921
      -------------------------------------------------------------
                  HL-Gap            0.0553493 Eh            1.5061 eV
             Fermi-level           -0.4053259 Eh          -11.0295 eV

 SCC (total)                   0 d,  0 h,  0 min,  0.003 sec
 SCC setup                      ...        0 min,  0.000 sec (  1.365%)
 Dispersion                     ...        0 min,  0.000 sec (  0.282%)
 integral evaluation            ...        0 min,  0.001 sec ( 40.074%)
 zeroth order Hamiltonian       ...        0 min,  0.000 sec (  0.467%)
 iterations                     ...        0 min,  0.000 sec ( 11.291%)
 molecular gradient             ...        0 min,  0.001 sec ( 44.926%)
 printout                       ...        0 min,  0.000 sec (  1.306%)

         :::::::::::::::::::::::::::::::::::::::::::::::::::::
         ::                     SUMMARY                     ::
         :::::::::::::::::::::::::::::::::::::::::::::::::::::
         :: total energy             -10.246616153791 Eh    ::
         :: gradient norm              0.000109583604 Eh/a0 ::
         :: HOMO-LUMO gap              1.506130029912 eV    ::
         ::.................................................::
         :: SCC energy               -10.417460705929 Eh    ::
         :: -> isotropic ES           -0.009608549610 Eh    ::
         :: -> anisotropic ES          0.002434951981 Eh    ::
         :: -> anisotropic XC          0.008754136968 Eh    ::
         :: -> dispersion             -0.002777121753 Eh    ::
         :: repulsion energy           0.170844526837 Eh    ::
         :: add. restraining           0.000000000000 Eh    ::
         :::::::::::::::::::::::::::::::::::::::::::::::::::::

           ------------------------------------------------- 
          |                Numerical Hessian                |
           ------------------------------------------------- 
step length          :   0.00500
SCC accuracy         :   0.30000
Hessian scale factor :   1.00000
frozen atoms in %    :   0.00000    0
RMS gradient         :   0.00011
estimated CPU  time      0.00 min
estimated wall time      0.00 min

writing file <hessian>.

 projected vibrational frequencies (cm-1)
eigval :       -0.00    -0.00    -0.00    -0.00    -0.00    -0.00
eigval :       49.09   501.37   538.38   660.12   883.63   930.68
eigval :     1117.24  1313.01  1520.95
           -------------------------------------------------
          |                Property Printout                |
           -------------------------------------------------

    * Orbital Energies and Occupations

         #    Occupation            Energy/Eh            Energy/eV
      -------------------------------------------------------------
         1        2.0000           -0.7519894             -20.4627
         2        2.0000           -0.6842736             -18.6200
         3        2.0000           -0.6435643             -17.5123
         4        2.0000           -0.5825420             -15.8518
         5        2.0000           -0.5621322             -15.2964
         6        2.0000           -0.5531638             -15.0524
         7        2.0000           -0.5012250             -13.6390
         8        2.0000           -0.4636899             -12.6176
         9        2.0000           -0.4517864             -12.2937
        10        2.0000           -0.4330004             -11.7825 (HOMO)
        11                         -0.3776512             -10.2764 (LUMO)
        12                         -0.3207217              -8.7273
        13                         -0.3122311              -8.4962
        14                         -0.2455582              -6.6820
        15                         -0.2228794              -6.0649
        16                          0.0881015               2.3974
        17                          0.1517544               4.1294
        18                          0.3109687               8.4619
        19                          0.3187125               8.6726
        20                          0.6097480              16.5921
      -------------------------------------------------------------
                  HL-Gap            0.0553492 Eh            1.5061 eV
             Fermi-level           -0.4053258 Eh          -11.0295 eV

     #   Z        covCN         q      C6AA      α(0)
     1   6 C      2.121    -0.071    32.733     9.246
     2   6 C      3.787     0.111    18.784     6.173
     3   6 C      3.033     0.016    27.628     8.621
     4   6 C      2.121    -0.071    32.733     9.246
     5   6 C      3.033     0.016    27.630     8.622
Molecule has the following symmetry elements: (C2) 
It seems to be the C2 point group

 Mol. C6AA /au·bohr⁶  :        690.028008
 Mol. C8AA /au·bohr⁸  :      19956.809113
 Mol. α(0) /au        :         41.908223


Wiberg/Mayer (AO) data.
largest (>0.10) Wiberg bond orders for each atom
          total WBO             WBO to atom ...
     1  C   3.078        C    2 1.382    C    3 1.121    C    5 0.356    C    4 0.218
     2  C   3.764        C    4 1.383    C    1 1.382    C    3 0.499    C    5 0.499
     3  C   3.333        C    5 1.356    C    1 1.121    C    2 0.499    C    4 0.356
     4  C   3.078        C    2 1.383    C    5 1.121    C    3 0.356    C    1 0.218
     5  C   3.332        C    3 1.356    C    4 1.121    C    2 0.499    C    1 0.356

MOs/occ written to file <molden.input>


molecular dipole:
                 x           y           z       tot (Debye)
 q only:       -0.028       0.002      -0.000
   full:       -0.231       0.013      -0.002       0.588
molecular quadrupole (traceless):
                xx          xy          yy          xz          yz          zz
 q only:        0.651      -0.091      -0.934       0.012       0.149       0.283
  q+dip:        0.970      -0.198      -2.477       0.016       0.345       1.507
   full:        1.711      -0.349      -4.324       0.043       0.864       2.613

           -------------------------------------------------
          |                Geometry Summary                 |
           -------------------------------------------------

      molecular mass/u    :       60.0536795
   center of mass at/Å    :        0.0000002       0.0000002      -0.0000000
  moments of inertia/u·Å² :        0.2905176E+02   0.5167804E+02   0.7255944E+02
rotational constants/cm⁻¹ :        0.5802620E+00   0.3262049E+00   0.2323286E+00

 * 3 selected distances

     #   Z        #   Z                                     value/Å
     1   6 C      2   6 C                                 1.3695868
     2   6 C      4   6 C                                 1.3694814 (min)
     3   6 C      5   6 C                                 1.3880573 (max)

 * 1 distinct bonds (by element types)

   Z      Z             #   av. dist./Å        max./Å        min./Å
   6 C    6 C           3     1.3757085     1.3880573     1.3694814

           -------------------------------------------------
          |               Frequency Printout                |
           -------------------------------------------------
 projected vibrational frequencies (cm-1)
eigval :       -0.00    -0.00    -0.00    -0.00    -0.00    -0.00
eigval :       49.09   501.37   538.38   660.12   883.63   930.68
eigval :     1117.24  1313.01  1520.95
 reduced masses (amu)
   1: 12.01   2: 12.01   3: 12.01   4: 12.01   5: 12.01   6: 12.01   7: 12.01   8: 12.01
   9: 12.01  10: 12.01  11: 12.01  12: 12.01  13: 12.01  14: 12.01  15: 12.01
 IR intensities (amu)
   1:  0.05   2:  0.05   3:  0.04   4:  0.03   5:  0.03   6:  0.04   7:  0.83   8:  0.23
   9:  0.37  10:  0.43  11:  1.69  12:  0.22  13:  1.01  14:  0.20  15:  0.85
 Raman intensities (amu)
   1:  0.00   2:  0.00   3:  0.00   4:  0.00   5:  0.00   6:  0.00   7:  0.00   8:  0.00
   9:  0.00  10:  0.00  11:  0.00  12:  0.00  13:  0.00  14:  0.00  15:  0.00
 output can be read by thermo (or use thermo option).
 writing <g98.out> molden fake output.
 recommended (thermochemical) frequency scaling factor: 1.0
           -------------------------------------------------
          |             Thermodynamic Functions             |
           -------------------------------------------------

c2  symmetry found (for desy threshold:  0.10E+00) used in thermo

          ...................................................
          :                      SETUP                      :
          :.................................................:
          :  # frequencies                           9      :
          :  # imaginary freq.                       0      :
          :  linear?                             false      :
          :  only rotor calc.                    false      :
          :  symmetry                               c2      :
          :  rotational number                       2      :
          :  scaling factor                  1.0000000      :
          :  rotor cutoff                   50.0000000 cm⁻¹ :
          :  imag. cutoff                  -20.0000000 cm⁻¹ :
          :.................................................:

    mode    ω/cm⁻¹     T·S(HO)/kcal·mol⁻¹    T·S(FR)/kcal·mol⁻¹   T·S(vib)
   ------------------------------------------------------------------------
       1     49.09    -0.00014 ( 48.17%)    -0.00182 ( 51.83%)    -0.00101
   ------------------------------------------------------------------------

   temp. (K)  partition function   enthalpy   heat capacity  entropy
                                   cal/mol     cal/K/mol   cal/K/mol   J/K/mol
 298.15  VIB   6.06                  960.581      6.757      6.129
         ROT  0.126E+05              888.752      2.981     21.745
         INT  0.764E+05             1849.334      9.738     27.873
         TR   0.450E+27             1481.254      4.968     38.181
         TOT                        3330.5876    14.7060    66.0540   276.3700

   temp. (K)  partition function   enthalpy   heat capacity  entropy
                                   cal/mol     cal/K/mol   cal/K/mol   J/K/mol
 120.00  VIB   2.26                  181.875      2.294      2.917
         ROT  0.322E+04              357.707      2.981     19.032
         INT  0.727E+04              539.582      5.274     21.949
         TR   0.115E+27              596.178      4.968     33.661
         TOT                        1135.7596    10.2426    55.6103   232.6736

   temp. (K)  partition function   enthalpy   heat capacity  entropy
                                   cal/mol     cal/K/mol   cal/K/mol   J/K/mol
 100.00  VIB   1.98                  138.611      2.050      2.611
         ROT  0.245E+04              298.089      2.981     18.488
         INT  0.484E+04              436.700      5.030     21.099
         TR   0.875E+26              496.815      4.968     32.756
         TOT                         933.5155     9.9986    53.8552   225.3302

   temp. (K)  partition function   enthalpy   heat capacity  entropy
                                   cal/mol     cal/K/mol   cal/K/mol   J/K/mol
  80.00  VIB   1.71                   99.275      1.896      2.276
         ROT  0.175E+04              238.471      2.981     17.823
         INT  0.299E+04              337.747      4.877     20.099
         TR   0.626E+26              397.452      4.968     31.648
         TOT                         735.1987     9.8454    51.7469   216.5091

   temp. (K)  partition function   enthalpy   heat capacity  entropy
                                   cal/mol     cal/K/mol   cal/K/mol   J/K/mol
  60.00  VIB   1.45                   62.526      1.775      1.872
         ROT  0.114E+04              178.853      2.981     16.965
         INT  0.164E+04              241.379      4.756     18.837
         TR   0.406E+26              298.089      4.968     30.219
         TOT                         539.4683     9.7245    49.0564   205.2521

   temp. (K)  partition function   enthalpy   heat capacity  entropy
                                   cal/mol     cal/K/mol   cal/K/mol   J/K/mol
  40.00  VIB   1.21                   28.962      1.542      1.336
         ROT   619.                  119.236      2.981     15.757
         INT   747.                  148.198      4.523     17.093
         TR   0.221E+26              198.726      4.968     28.206
         TOT                         346.9235     9.4914    45.2991   189.5313

   temp. (K)  partition function   enthalpy   heat capacity  entropy
                                   cal/mol     cal/K/mol   cal/K/mol   J/K/mol
  20.00  VIB   1.03                    4.230      0.769      0.581
         ROT   219.                   59.618      2.981     13.691
         INT   226.                   63.848      3.750     14.272
         TR   0.782E+25               99.363      4.968     24.764
         TOT                         163.2108     8.7185    39.0357   163.3255

   temp. (K)  partition function   enthalpy   heat capacity  entropy
                                   cal/mol     cal/K/mol   cal/K/mol   J/K/mol
  10.00  VIB   1.00                    0.120      0.085      0.100
         ROT   77.4                   29.809      2.981     11.624
         INT   77.5                   29.929      3.066     11.725
         TR   0.277E+25               49.681      4.968     21.322
         TOT                          79.6106     8.0340    33.0468   138.2676

       T/K    H(0)-H(T)+PV         H(T)/Eh          T*S/Eh         G(T)/Eh
   ------------------------------------------------------------------------
    298.15    0.530763E-02    0.224268E-01    0.313844E-01   -0.895755E-02
    120.00    0.180995E-02    0.189292E-01    0.106345E-01    0.829468E-02
    100.00    0.148765E-02    0.186069E-01    0.858237E-02    0.100245E-01
     80.00    0.117161E-02    0.182908E-01    0.659712E-02    0.116937E-01
     60.00    0.859697E-03    0.179789E-01    0.469058E-02    0.132883E-01
     40.00    0.552858E-03    0.176721E-01    0.288755E-02    0.147845E-01
     20.00    0.260093E-03    0.173793E-01    0.124415E-02    0.161352E-01
     10.00    0.126868E-03    0.172461E-01    0.526634E-03    0.167194E-01 (used)
   ------------------------------------------------------------------------

         :::::::::::::::::::::::::::::::::::::::::::::::::::::
         ::                  THERMODYNAMIC                  ::
         :::::::::::::::::::::::::::::::::::::::::::::::::::::
         :: total free energy         -10.229896706106 Eh   ::
         ::.................................................::
         :: total energy              -10.246616153755 Eh   ::
         :: zero point energy           0.017119213606 Eh   ::
         :: G(RRHO) w/o ZPVE           -0.000399765957 Eh   ::
         :: G(RRHO) contrib.            0.016719447648 Eh   ::
         :::::::::::::::::::::::::::::::::::::::::::::::::::::

optimized geometry written to: xtbopt.xyz


           -------------------------------------------------
          | TOTAL ENERGY              -10.246616153755 Eh   |
          | TOTAL ENTHALPY            -10.229370072544 Eh   |
          | TOTAL FREE ENERGY         -10.229896706106 Eh   |
          | GRADIENT NORM               0.000108864063 Eh/α |
          | HOMO-LUMO GAP               1.506129023827 eV   |
           -------------------------------------------------

------------------------------------------------------------------------
 * finished run on 2020/05/12 at 11:44:32.340     
------------------------------------------------------------------------
 total:
 * wall-time:     0 d,  0 h,  0 min,  0.220 sec
 *  cpu-time:     0 d,  0 h,  0 min,  0.220 sec
 * ratio c/w:     1.000 speedup
 SCF:
 * wall-time:     0 d,  0 h,  0 min,  0.006 sec
 *  cpu-time:     0 d,  0 h,  0 min,  0.006 sec
 * ratio c/w:     1.000 speedup
 ANC optimizer:
 * wall-time:     0 d,  0 h,  0 min,  0.091 sec
 *  cpu-time:     0 d,  0 h,  0 min,  0.091 sec
 * ratio c/w:     1.002 speedup
 numerical hessian:
 * wall-time:     0 d,  0 h,  0 min,  0.107 sec
 *  cpu-time:     0 d,  0 h,  0 min,  0.107 sec
 * ratio c/w:     0.997 speedup

