      -----------------------------------------------------------      
     |                   =====================                   |     
     |                           x T B                           |     
     |                   =====================                   |     
     |                         S. Grimme                         |     
     |          Mulliken Center for Theoretical Chemistry        |     
     |                    University of Bonn                     |     
      -----------------------------------------------------------      

   * xtb version 6.2.2 (9d81278992624c895f80dd42a50cac0aa55982e2) compiled by '@Darwin' on 04/03/2020

   xtb is free software: you can redistribute it and/or modify it under
   the terms of the GNU Lesser General Public License as published by
   the Free Software Foundation, either version 3 of the License, or
   (at your option) any later version.
   
   xtb is distributed in the hope that it will be useful,
   but WITHOUT ANY WARRANTY; without even the implied warranty of
   MERCHANTABILITY or FITNESS FOR A PARTICULAR PURPOSE.  See the
   GNU Lesser General Public License for more details.
   
   Cite this work as:
   * S. Grimme, C. Bannwarth, P. Shushkov, J. Chem. Theory Comput., 2017,
     13, 1989-2009. DOI: 10.1021/acs.jctc.7b00118
   * C. Bannwarth, S. Ehlert and S. Grimme., J. Chem. Theory Comput., 2019,
     15, 1652-1671. DOI: 10.1021/acs.jctc.8b01176
   * P. Pracht, E. Caldeweyher, S. Ehlert, S. Grimme, ChemRxiv, 2019, preprint.
     DOI: 10.26434/chemrxiv.8326202.v1
   
   for DFT-D4:
   * E. Caldeweyher, C. Bannwarth and S. Grimme, J. Chem. Phys., 2017,
     147, 034112. DOI: 10.1063/1.4993215
   * E. Caldeweyher, S. Ehlert, A. Hansen, H. Neugebauer, S. Spicher,
     C. Bannwarth and S. Grimme, J. Chem. Phys., 2019, 150, 154122.
     DOI: 10.1063/1.5090222
   
   for sTDA-xTB:
   * S. Grimme and C. Bannwarth, J. Chem. Phys., 2016, 145, 054103.
     DOI: 10.1063/1.4959605
   
   in the mass-spec context:
   * V. Asgeirsson, C. Bauer and S. Grimme, Chem. Sci., 2017, 8, 4879.
     DOI: 10.1039/c7sc00601b
   
   for metadynamics refer to:
   * S. Grimme, J. Chem. Theory Comput., 2019, 155, 2847-2862
     DOI: 10.1021/acs.jctc.9b00143
   
   with help from (in alphabetical order)
   C. Bannwarth, F. Bohle, G. Brandenburg, E. Caldeweyher, M. Checinski,
   S. Dohm, S. Ehlert, S. Ehrlich, F. März, H. Neugebauer, J. Pisarek,
   P. Pracht, P. Shushkov, and S. Spicher.
   
 * started run on 2020/05/12 at 11:44:55.649     

           -------------------------------------------------
          |                Calculation Setup                |
           -------------------------------------------------

          program call               : xtb --input H1C3N1_14_S_0.input H1C3N1_14_S_0.xyz --ohess --molden --namespace H1C3N1_14_S_0 output.out
          calculation namespace      : H1C3N1_14_S_0
          coordinate file            : H1C3N1_14_S_0.xyz
          number of atoms            :                     5
          number of electrons        :                    18
          charge                     :                     0
          spin                       :                   0.0
          first test random number   :      0.26792661308297

   ID    Z sym.   atoms
    1    6 C      1-3
    2    7 N      4
    3    1 H      5

           -------------------------------------------------
          |                 G F N 2 - x T B                 |
           -------------------------------------------------

        Reference                      10.1021/acs.jctc.8b01176
      * Hamiltonian:
        H0-scaling (s, p, d)           1.850000    2.230000    2.230000
        zeta-weighting                 0.500000
      * Dispersion:
        s8                             2.700000
        a1                             0.520000
        a2                             5.000000
        s9                             5.000000
      * Repulsion:
        kExp                           1.500000    1.000000
        rExp                           1.000000
      * Coulomb:
        alpha                          2.000000
        third order                    shell-resolved
        anisotropic                    true
        a3                             3.000000
        a5                             4.000000
        cn-shift                       1.200000
        cn-exp                         4.000000
        max-rad                        5.000000


          ...................................................
          :                      SETUP                      :
          :.................................................:
          :  # basis functions                  17          :
          :  # atomic orbitals                  17          :
          :  # shells                            9          :
          :  # electrons                        18          :
          :  max. iterations                   250          :
          :  Hamiltonian                  GFN2-xTB          :
          :  restarted?                      false          :
          :  GBSA solvation                  false          :
          :  PC potential                    false          :
          :  electronic temp.          300.0000000     K    :
          :  accuracy                    1.0000000          :
          :  -> integral cutoff          0.2500000E+02      :
          :  -> integral neglect         0.1000000E-07      :
          :  -> SCF convergence          0.1000000E-05 Eh   :
          :  -> wf. convergence          0.1000000E-03 e    :
          :  Broyden damping             0.4000000          :
          ...................................................

 iter      E             dE          RMSdq      gap      omega  full diag
   1     -9.2643054 -0.926431E+01  0.113E+01    1.55       0.0  T
   2     -6.3154185  0.294889E+01  0.173E+01    0.33       1.0  T
   3     -8.8026572 -0.248724E+01  0.101E+01    0.15       1.0  T
   4     -9.1362695 -0.333612E+00  0.722E+00    1.45       1.0  T
   5     -9.2797419 -0.143472E+00  0.531E+00    1.48       1.0  T
   6     -9.4086885 -0.128947E+00  0.374E+00    1.25       1.0  T
   7     -9.3972434  0.114451E-01  0.393E+00    1.31       1.0  T
   8     -9.4377415 -0.404981E-01  0.304E+00    1.09       1.0  T
   9     -9.4948125 -0.570711E-01  0.140E+00    0.45       1.0  T
  10     -9.4619898  0.328227E-01  0.255E+00    0.38       1.0  T
  11     -9.4561032  0.588659E-02  0.271E+00    0.37       1.0  T
  12     -9.4439066  0.121966E-01  0.292E+00    0.34       1.0  T
  13     -9.4874460 -0.435394E-01  0.154E+00    0.40       1.0  T
  14     -9.5007477 -0.133017E-01  0.722E-01    0.46       1.0  T
  15     -9.5017759 -0.102828E-02  0.629E-01    0.47       1.0  T
  16     -9.5045853 -0.280936E-02  0.732E-02    0.53       1.0  T
  17     -9.5045513  0.340280E-04  0.951E-02    0.53       1.0  T
  18     -9.5045725 -0.212042E-04  0.566E-02    0.53       1.0  T
  19     -9.5045894 -0.168933E-04  0.645E-03    0.54       6.9  T
  20     -9.5045891  0.302284E-06  0.702E-03    0.54       6.4  T
  21     -9.5045893 -0.219646E-06  0.420E-03    0.54      10.6  T
  22     -9.5045894 -0.912760E-07  0.199E-03    0.54      22.4  T
  23     -9.5045894 -0.227588E-07  0.529E-04    0.54      84.5  T
  24     -9.5045894 -0.151401E-08  0.310E-04    0.54     144.3  T

   *** convergence criteria satisfied after 24 iterations ***

         #    Occupation            Energy/Eh            Energy/eV
      -------------------------------------------------------------
         1        2.0000           -0.7340051             -19.9733
       ...           ...                  ...                  ...
         3        2.0000           -0.6154456             -16.7471
         4        2.0000           -0.6022279             -16.3875
         5        2.0000           -0.5497599             -14.9597
         6        2.0000           -0.5131786             -13.9643
         7        2.0000           -0.4834439             -13.1552
         8        2.0000           -0.4573225             -12.4444
         9        1.9999           -0.4474884             -12.1768 (HOMO)
        10        0.0001           -0.4277714             -11.6403 (LUMO)
        11                         -0.4124609             -11.2236
        12                         -0.3430016              -9.3335
        13                         -0.1240573              -3.3758
        14                          0.0093395               0.2541
       ...                                ...                  ...
        17                          0.2353184               6.4033
      -------------------------------------------------------------
                  HL-Gap            0.0197171 Eh            0.5365 eV
             Fermi-level           -0.4376299 Eh          -11.9085 eV

 SCC (total)                   0 d,  0 h,  0 min,  0.005 sec
 SCC setup                      ...        0 min,  0.000 sec (  1.805%)
 Dispersion                     ...        0 min,  0.000 sec (  0.367%)
 integral evaluation            ...        0 min,  0.001 sec ( 21.686%)
 zeroth order Hamiltonian       ...        0 min,  0.000 sec (  0.367%)
 iterations                     ...        0 min,  0.002 sec ( 50.471%)
 molecular gradient             ...        0 min,  0.001 sec ( 22.973%)
 printout                       ...        0 min,  0.000 sec (  2.104%)

         :::::::::::::::::::::::::::::::::::::::::::::::::::::
         ::                     SUMMARY                     ::
         :::::::::::::::::::::::::::::::::::::::::::::::::::::
         :: total energy              -9.433746400196 Eh    ::
         :: gradient norm              0.239864978742 Eh/a0 ::
         :: HOMO-LUMO gap              0.536528363177 eV    ::
         ::.................................................::
         :: SCC energy                -9.504589414796 Eh    ::
         :: -> isotropic ES           -0.015330944342 Eh    ::
         :: -> anisotropic ES          0.001157806766 Eh    ::
         :: -> anisotropic XC          0.013067315233 Eh    ::
         :: -> dispersion             -0.002127755021 Eh    ::
         :: repulsion energy           0.070842943102 Eh    ::
         :: add. restraining           0.000000000000 Eh    ::
         :::::::::::::::::::::::::::::::::::::::::::::::::::::

      ----------------------------------------------------------- 
     |                   =====================                   |
     |                        A N C O P T                        |
     |                   =====================                   |
     |               Approximate Normal Coordinate               |
     |                Rational Function Optimizer                |
      ----------------------------------------------------------- 

          ...................................................
          :                      SETUP                      :
          :.................................................:
          :   optimization level            normal          :
          :   max. optcycles                   200          :
          :   ANC micro-cycles                  20          :
          :   degrees of freedom                 9          :
          :.................................................:
          :   RF solver                   davidson          :
          :   write xtbopt.log                true          :
          :   linear?                        false          :
          :   energy convergence         0.5000000E-05 Eh   :
          :   grad. convergence          0.1000000E-02 Eh/α :
          :   maximium RF displ.         1.0000000          :
          :   Hlow (freq-cutoff)         0.1000000E-01      :
          :   Hmax (freq-cutoff)         5.0000000          :
          :   S6 in model hess.         20.0000000          :
          ...................................................

generating ANC from model Hessian ...
Using Lindh-Hessian (1995)
 Shifting diagonal of input Hessian by    0.0000000000000000     
 Lowest  eigenvalues of input Hessian
   -0.000000   -0.000000    0.000000    0.000000    0.000000    0.000000
    0.063522    0.079976    0.106839    0.149138    0.394283    0.843912
    0.926766    1.149440    1.580402
 Highest eigenvalues
    0.149138    0.394283    0.843912    0.926766    1.149440    1.580402


........................................................................
.............................. CYCLE    1 ..............................
........................................................................
   1     -9.5045894 -0.950459E+01  0.172E-04    0.54       0.0  T
   2     -9.5045894  0.465026E-08  0.740E-04    0.54      60.5  T
   3     -9.5045894 -0.480737E-08  0.555E-05    0.54     805.2  T
     SCC iter.                  ...        0 min,  0.001 sec
     gradient                   ...        0 min,  0.001 sec
 * total energy  :    -9.4337464 Eh     change        0.1113715E-08 Eh
   gradient norm :     0.2398648 Eh/α   predicted     0.0000000E+00 (-100.00%)
   displ. norm   :     0.3349041 α      lambda       -0.6640967E-01
   maximum displ.:     0.2206898 α      in ANC's #7, #4, #2, ...

........................................................................
.............................. CYCLE    2 ..............................
........................................................................
   1     -9.5675317 -0.956753E+01  0.284E+00    0.70       0.0  T
   2     -9.4982371  0.692946E-01  0.351E+00    1.97       1.0  T
   3     -9.5723064 -0.740693E-01  0.178E+00    0.66       1.0  T
   4     -9.5811453 -0.883889E-02  0.117E+00    1.07       1.0  T
   5     -9.5878308 -0.668556E-02  0.309E-01    0.83       1.0  T
   6     -9.5884265 -0.595694E-03  0.854E-02    0.91       1.0  T
   7     -9.5884312 -0.472986E-05  0.210E-02    0.90       2.1  T
   8     -9.5884317 -0.454143E-06  0.107E-02    0.90       4.2  T
   9     -9.5884320 -0.279175E-06  0.394E-03    0.90      11.3  T
  10     -9.5884321 -0.102015E-06  0.169E-03    0.90      26.5  T
  11     -9.5884321 -0.168450E-07  0.183E-04    0.90     244.7  T
  12     -9.5884321 -0.520171E-10  0.600E-05    0.90     745.6  T
     SCC iter.                  ...        0 min,  0.001 sec
     gradient                   ...        0 min,  0.001 sec
 * total energy  :    -9.4896634 Eh     change       -0.5591704E-01 Eh
   gradient norm :     0.1564936 Eh/α   predicted    -0.3692910E-01 ( -33.96%)
   displ. norm   :     0.4285664 α      lambda       -0.6199079E-01
   maximum displ.:     0.3477895 α      in ANC's #7, #4, #8, ...

........................................................................
.............................. CYCLE    3 ..............................
........................................................................
   1     -9.6461908 -0.964619E+01  0.452E+00    0.59       0.0  T
   2     -9.5842178  0.619730E-01  0.450E+00    2.46       1.0  T
   3     -9.7087649 -0.124547E+00  0.171E+00    1.06       1.0  T
   4     -9.7084443  0.320582E-03  0.979E-01    0.87       1.0  T
   5     -9.7090677 -0.623357E-03  0.398E-01    0.86       1.0  T
   6     -9.7100469 -0.979289E-03  0.172E-01    1.02       1.0  T
   7     -9.7101456 -0.986374E-04  0.991E-02    1.00       1.0  T
   8     -9.7101987 -0.530743E-04  0.985E-03    0.97       4.5  T
   9     -9.7101987 -0.268881E-07  0.638E-03    0.97       7.0  T
  10     -9.7101988 -0.152580E-06  0.583E-04    0.97      76.7  T
  11     -9.7101988 -0.310187E-09  0.798E-05    0.97     560.2  T
     SCC iter.                  ...        0 min,  0.001 sec
     gradient                   ...        0 min,  0.001 sec
 * total energy  :    -9.4882814 Eh     change        0.1381988E-02 Eh
   gradient norm :     0.3270559 Eh/α   predicted    -0.3668829E-01 (*******%)
   displ. norm   :     0.2136454 α      lambda       -0.6207886E-01
   maximum displ.:     0.1759796 α      in ANC's #7, #3, #8, ...

........................................................................
.............................. CYCLE    4 ..............................
........................................................................
   1     -9.6329267 -0.963293E+01  0.239E+00    1.51       0.0  T
   2     -9.6150674  0.178593E-01  0.222E+00    0.80       1.0  T
   3     -9.6300333 -0.149659E-01  0.149E+00    1.68       1.0  T
   4     -9.6383896 -0.835623E-02  0.719E-01    1.23       1.0  T
   5     -9.6409195 -0.252995E-02  0.114E-01    1.36       1.0  T
   6     -9.6409380 -0.184556E-04  0.659E-02    1.33       1.0  T
   7     -9.6409491 -0.110835E-04  0.200E-02    1.34       2.2  T
   8     -9.6409515 -0.244024E-05  0.740E-03    1.35       6.0  T
   9     -9.6409516 -0.809300E-07  0.152E-03    1.34      29.4  T
  10     -9.6409516 -0.357552E-08  0.341E-04    1.34     131.3  T
  11     -9.6409516 -0.335451E-09  0.701E-05    1.34     637.8  T
     SCC iter.                  ...        0 min,  0.001 sec
     gradient                   ...        0 min,  0.001 sec
 * total energy  :    -9.5127201 Eh     change       -0.2443867E-01 Eh
   gradient norm :     0.0453661 Eh/α   predicted    -0.3245620E-01 (  32.81%)
   displ. norm   :     0.2146139 α      lambda       -0.6144906E-02
   maximum displ.:     0.1883538 α      in ANC's #3, #4, #1, ...

........................................................................
.............................. CYCLE    5 ..............................
........................................................................
   1     -9.6431945 -0.964319E+01  0.131E+00    1.76       0.0  T
   2     -9.6416651  0.152939E-02  0.910E-01    2.06       1.0  T
   3     -9.6370570  0.460810E-02  0.105E+00    1.61       1.0  T
   4     -9.6440492 -0.699218E-02  0.117E-01    1.88       1.0  T
   5     -9.6440892 -0.400279E-04  0.317E-02    1.88       1.4  T
   6     -9.6440893 -0.812322E-07  0.190E-02    1.88       2.4  T
   7     -9.6440901 -0.867338E-06  0.653E-03    1.88       6.8  T
   8     -9.6440904 -0.245395E-06  0.161E-03    1.88      27.7  T
   9     -9.6440904 -0.380018E-08  0.220E-04    1.88     203.6  T
  10     -9.6440904 -0.388365E-10  0.383E-05    1.88    1166.5  T
     SCC iter.                  ...        0 min,  0.001 sec
     gradient                   ...        0 min,  0.001 sec
 * total energy  :    -9.5188133 Eh     change       -0.6093170E-02 Eh
   gradient norm :     0.0405784 Eh/α   predicted    -0.3213972E-02 ( -47.25%)
   displ. norm   :     0.9538386 α      lambda       -0.2768210E-01
   maximum displ.:     0.8105023 α      in ANC's #3, #4, #1, ...

........................................................................
.............................. CYCLE    6 ..............................
........................................................................
   1     -9.6078259 -0.960783E+01  0.608E+00    2.03       0.0  T
   2     -9.6125713 -0.474542E-02  0.301E+00    2.35       1.0  T
   3     -9.5957189  0.168524E-01  0.289E+00    2.23       1.0  T
   4     -9.6210765 -0.253575E-01  0.790E-01    2.15       1.0  T
   5     -9.6239148 -0.283829E-02  0.367E-01    2.29       1.0  T
   6     -9.6247684 -0.853594E-03  0.121E-01    2.27       1.0  T
   7     -9.6247832 -0.148365E-04  0.228E-02    2.27       2.0  T
   8     -9.6247852 -0.201059E-05  0.977E-03    2.26       4.6  T
   9     -9.6247854 -0.171470E-06  0.113E-03    2.26      39.4  T
  10     -9.6247854 -0.153407E-08  0.274E-04    2.26     163.3  T
  11     -9.6247854 -0.203020E-10  0.121E-04    2.26     370.8  T
     SCC iter.                  ...        0 min,  0.001 sec
     gradient                   ...        0 min,  0.001 sec
 * total energy  :    -9.5254366 Eh     change       -0.6623354E-02 Eh
   gradient norm :     0.1579728 Eh/α   predicted    -0.2643370E-01 ( 299.10%)
   displ. norm   :     0.3115431 α      lambda       -0.2438293E-01
   maximum displ.:     0.2400573 α      in ANC's #3, #1, #2, ...

........................................................................
.............................. CYCLE    7 ..............................
........................................................................
   1     -9.6462649 -0.964626E+01  0.147E+00    2.88       0.0  T
   2     -9.6455974  0.667526E-03  0.915E-01    2.89       1.0  T
   3     -9.6426705  0.292687E-02  0.957E-01    2.82       1.0  T
   4     -9.6470656 -0.439514E-02  0.188E-01    2.90       1.0  T
   5     -9.6473136 -0.248001E-03  0.724E-02    2.89       1.0  T
   6     -9.6473319 -0.182404E-04  0.349E-02    2.88       1.3  T
   7     -9.6473331 -0.124868E-05  0.549E-03    2.89       8.1  T
   8     -9.6473332 -0.378799E-07  0.310E-03    2.89      14.4  T
   9     -9.6473332 -0.177167E-07  0.343E-04    2.89     130.5  T
  10     -9.6473332 -0.124611E-09  0.491E-05    2.89     911.7  T
     SCC iter.                  ...        0 min,  0.001 sec
     gradient                   ...        0 min,  0.001 sec
 * total energy  :    -9.5417464 Eh     change       -0.1630971E-01 Eh
   gradient norm :     0.1029942 Eh/α   predicted    -0.1337476E-01 ( -18.00%)
   displ. norm   :     0.5287956 α      lambda       -0.2035773E-01
   maximum displ.:     0.4854686 α      in ANC's #1, #2, #7, ...

........................................................................
.............................. CYCLE    8 ..............................
........................................................................
   1     -9.6378821 -0.963788E+01  0.366E+00    2.37       0.0  T
   2     -9.6369982  0.883908E-03  0.209E+00    2.59       1.0  T
   3     -9.6121156  0.248826E-01  0.210E+00    2.20       1.0  T
   4     -9.6349061 -0.227906E-01  0.106E+00    2.66       1.0  T
   5     -9.6431147 -0.820857E-02  0.271E-01    2.52       1.0  T
   6     -9.6433207 -0.205981E-03  0.159E-01    2.51       1.0  T
   7     -9.6434004 -0.796849E-04  0.331E-02    2.49       1.3  T
   8     -9.6434017 -0.137649E-05  0.108E-02    2.49       4.1  T
   9     -9.6434020 -0.269824E-06  0.147E-03    2.49      30.4  T
  10     -9.6434020 -0.252117E-08  0.575E-04    2.49      77.8  T
  11     -9.6434020 -0.460323E-09  0.915E-05    2.49     488.9  T
     SCC iter.                  ...        0 min,  0.001 sec
     gradient                   ...        0 min,  0.001 sec
 * total energy  :    -9.5421521 Eh     change       -0.4057938E-03 Eh
   gradient norm :     0.1367179 Eh/α   predicted    -0.1302510E-01 (3109.78%)
   displ. norm   :     0.2973967 α      lambda       -0.2874680E-01
   maximum displ.:     0.2204755 α      in ANC's #1, #3, #9, ...

........................................................................
.............................. CYCLE    9 ..............................
........................................................................
   1     -9.6834543 -0.968345E+01  0.249E+00    3.22       0.0  T
   2     -9.6834562 -0.191258E-05  0.143E+00    3.16       1.0  T
   3     -9.6792531  0.420312E-02  0.121E+00    3.19       1.0  T
   4     -9.6852233 -0.597020E-02  0.490E-01    3.09       1.0  T
   5     -9.6868202 -0.159693E-02  0.111E-01    3.15       1.0  T
   6     -9.6868348 -0.145702E-04  0.621E-02    3.15       1.0  T
   7     -9.6868429 -0.811283E-05  0.116E-02    3.15       3.8  T
   8     -9.6868432 -0.334269E-06  0.479E-03    3.15       9.3  T
   9     -9.6868433 -0.978447E-08  0.575E-04    3.15      77.8  T
  10     -9.6868433 -0.606075E-10  0.961E-05    3.15     465.1  T
     SCC iter.                  ...        0 min,  0.001 sec
     gradient                   ...        0 min,  0.001 sec
 * total energy  :    -9.5552609 Eh     change       -0.1310880E-01 Eh
   gradient norm :     0.0846404 Eh/α   predicted    -0.1564465E-01 (  19.34%)
   displ. norm   :     0.1887295 α      lambda       -0.1273505E-01
   maximum displ.:     0.0990134 α      in ANC's #3, #2, #6, ...

........................................................................
.............................. CYCLE   10 ..............................
........................................................................
   1     -9.6768337 -0.967683E+01  0.147E+00    3.20       0.0  T
   2     -9.6759742  0.859482E-03  0.828E-01    3.14       1.0  T
   3     -9.6711946  0.477962E-02  0.104E+00    3.21       1.0  T
   4     -9.6776306 -0.643600E-02  0.127E-01    3.19       1.0  T
   5     -9.6776683 -0.377208E-04  0.820E-02    3.19       1.0  T
   6     -9.6776858 -0.175239E-04  0.142E-02    3.18       3.1  T
   7     -9.6776860 -0.201313E-06  0.683E-03    3.18       6.5  T
   8     -9.6776861 -0.386854E-07  0.245E-03    3.18      18.3  T
   9     -9.6776861 -0.931797E-08  0.301E-04    3.18     148.4  T
  10     -9.6776861 -0.135110E-10  0.300E-05    3.18    1492.9  T
     SCC iter.                  ...        0 min,  0.001 sec
     gradient                   ...        0 min,  0.001 sec
 * total energy  :    -9.5629116 Eh     change       -0.7650651E-02 Eh
   gradient norm :     0.0733665 Eh/α   predicted    -0.6594325E-02 ( -13.81%)
   displ. norm   :     0.2284794 α      lambda       -0.1185364E-01
   maximum displ.:     0.1184870 α      in ANC's #6, #1, #9, ...

........................................................................
.............................. CYCLE   11 ..............................
........................................................................
   1     -9.6929971 -0.969300E+01  0.216E+00    3.05       0.0  T
   2     -9.6937899 -0.792787E-03  0.114E+00    3.04       1.0  T
   3     -9.6925232  0.126678E-02  0.570E-01    3.06       1.0  T
   4     -9.6933826 -0.859417E-03  0.300E-01    3.00       1.0  T
   5     -9.6941154 -0.732819E-03  0.676E-02    3.03       1.0  T
   6     -9.6941189 -0.346506E-05  0.360E-02    3.03       1.2  T
   7     -9.6941232 -0.431645E-05  0.594E-03    3.03       7.5  T
   8     -9.6941232 -0.106301E-07  0.258E-03    3.03      17.4  T
   9     -9.6941232 -0.234075E-08  0.351E-04    3.03     127.5  T
  10     -9.6941232 -0.774421E-10  0.681E-05    3.03     656.6  T
     SCC iter.                  ...        0 min,  0.001 sec
     gradient                   ...        0 min,  0.001 sec
 * total energy  :    -9.5704939 Eh     change       -0.7582298E-02 Eh
   gradient norm :     0.0739493 Eh/α   predicted    -0.6236219E-02 ( -17.75%)
   displ. norm   :     0.1093135 α      lambda       -0.3586212E-02
   maximum displ.:     0.0715021 α      in ANC's #4, #1, #5, ...

........................................................................
.............................. CYCLE   12 ..............................
........................................................................
   1     -9.6980790 -0.969808E+01  0.117E+00    3.06       0.0  T
   2     -9.6982179 -0.138931E-03  0.630E-01    3.05       1.0  T
   3     -9.6969987  0.121923E-02  0.462E-01    3.06       1.0  T
   4     -9.6982560 -0.125727E-02  0.170E-01    3.04       1.0  T
   5     -9.6984525 -0.196519E-03  0.352E-02    3.05       1.3  T
   6     -9.6984527 -0.211281E-06  0.227E-02    3.05       2.0  T
   7     -9.6984543 -0.154523E-05  0.350E-03    3.05      12.8  T
   8     -9.6984543 -0.508228E-08  0.169E-03    3.05      26.4  T
   9     -9.6984543 -0.426601E-08  0.193E-04    3.05     232.2  T
  10     -9.6984543 -0.200870E-10  0.369E-05    3.05    1211.1  T
     SCC iter.                  ...        0 min,  0.001 sec
     gradient                   ...        0 min,  0.001 sec
 * total energy  :    -9.5724507 Eh     change       -0.1956813E-02 Eh
   gradient norm :     0.0590392 Eh/α   predicted    -0.1814534E-02 (  -7.27%)
   displ. norm   :     0.0717824 α      lambda       -0.2724107E-02
   maximum displ.:     0.0464522 α      in ANC's #7, #3, #4, ...

........................................................................
.............................. CYCLE   13 ..............................
........................................................................
   1     -9.6965974 -0.969660E+01  0.539E-01    3.01       0.0  T
   2     -9.6966741 -0.766698E-04  0.311E-01    3.01       1.0  T
   3     -9.6966510  0.231053E-04  0.189E-01    3.01       1.0  T
   4     -9.6967513 -0.100325E-03  0.299E-02    3.01       1.5  T
   5     -9.6967533 -0.202291E-05  0.159E-02    3.01       2.8  T
   6     -9.6967523  0.105008E-05  0.154E-02    3.01       2.9  T
   7     -9.6967540 -0.166283E-05  0.158E-03    3.01      28.2  T
   8     -9.6967540 -0.588196E-09  0.319E-04    3.01     140.2  T
   9     -9.6967540 -0.971685E-10  0.846E-05    3.01     528.9  T
     SCC iter.                  ...        0 min,  0.001 sec
     gradient                   ...        0 min,  0.001 sec
 * total energy  :    -9.5745288 Eh     change       -0.2078070E-02 Eh
   gradient norm :     0.0397060 Eh/α   predicted    -0.1369070E-02 ( -34.12%)
   displ. norm   :     0.2510767 α      lambda       -0.6296796E-02
   maximum displ.:     0.1635839 α      in ANC's #2, #7, #4, ...

........................................................................
.............................. CYCLE   14 ..............................
........................................................................
   1     -9.6958420 -0.969584E+01  0.119E+00    3.29       0.0  T
   2     -9.6960038 -0.161780E-03  0.661E-01    3.28       1.0  T
   3     -9.6959127  0.910565E-04  0.214E-01    3.27       1.0  T
   4     -9.6960189 -0.106219E-03  0.780E-02    3.29       1.0  T
   5     -9.6960464 -0.274675E-04  0.492E-02    3.28       1.0  T
   6     -9.6960530 -0.660968E-05  0.201E-02    3.28       2.2  T
   7     -9.6960552 -0.218448E-05  0.309E-03    3.28      14.5  T
   8     -9.6960552 -0.727683E-08  0.642E-04    3.28      69.7  T
   9     -9.6960552 -0.528217E-10  0.195E-04    3.28     229.1  T
     SCC iter.                  ...        0 min,  0.001 sec
     gradient                   ...        0 min,  0.001 sec
 * total energy  :    -9.5780520 Eh     change       -0.3523246E-02 Eh
   gradient norm :     0.0184804 Eh/α   predicted    -0.3346870E-02 (  -5.01%)
   displ. norm   :     0.0538604 α      lambda       -0.6152386E-03
   maximum displ.:     0.0317184 α      in ANC's #2, #5, #7, ...

........................................................................
.............................. CYCLE   15 ..............................
........................................................................
   1     -9.6999732 -0.969997E+01  0.362E-01    3.33       0.0  T
   2     -9.6999858 -0.125431E-04  0.194E-01    3.33       1.0  T
   3     -9.6999027  0.830122E-04  0.136E-01    3.33       1.0  T
   4     -9.6999911 -0.883512E-04  0.458E-02    3.32       1.0  T
   5     -9.7000075 -0.164361E-04  0.120E-02    3.33       3.7  T
   6     -9.7000077 -0.207214E-06  0.512E-03    3.33       8.7  T
   7     -9.7000078 -0.375755E-07  0.920E-04    3.33      48.6  T
   8     -9.7000078 -0.204354E-09  0.254E-04    3.33     176.4  T
     SCC iter.                  ...        0 min,  0.001 sec
     gradient                   ...        0 min,  0.001 sec
 * total energy  :    -9.5783605 Eh     change       -0.3085053E-03 Eh
   gradient norm :     0.0079659 Eh/α   predicted    -0.3085126E-03 (   0.00%)
   displ. norm   :     0.0315329 α      lambda       -0.1806554E-03
   maximum displ.:     0.0236365 α      in ANC's #4, #6, #1, ...

........................................................................
.............................. CYCLE   16 ..............................
........................................................................
   1     -9.7005931 -0.970059E+01  0.187E-01    3.33       0.0  T
   2     -9.7006002 -0.708771E-05  0.102E-01    3.33       1.0  T
   3     -9.7005940  0.619473E-05  0.482E-02    3.33       1.0  T
   4     -9.7005994 -0.543485E-05  0.236E-02    3.33       1.9  T
   5     -9.7006030 -0.361051E-05  0.592E-03    3.33       7.6  T
   6     -9.7006030  0.138417E-07  0.490E-03    3.34       9.1  T
   7     -9.7006031 -0.784769E-07  0.816E-04    3.34      54.8  T
   8     -9.7006031 -0.696398E-09  0.907E-05    3.34     493.3  T
     SCC iter.                  ...        0 min,  0.001 sec
     gradient                   ...        0 min,  0.001 sec
 * total energy  :    -9.5784415 Eh     change       -0.8093111E-04 Eh
   gradient norm :     0.0028833 Eh/α   predicted    -0.9041830E-04 (  11.72%)
   displ. norm   :     0.0104987 α      lambda       -0.2132349E-04
   maximum displ.:     0.0056144 α      in ANC's #4, #3, #1, ...

........................................................................
.............................. CYCLE   17 ..............................
........................................................................
   1     -9.7004554 -0.970046E+01  0.352E-02    3.35       0.0  T
   2     -9.7004554  0.209447E-07  0.225E-02    3.34       2.0  T
   3     -9.7004541  0.133164E-05  0.190E-02    3.34       2.4  T
   4     -9.7004557 -0.160849E-05  0.715E-03    3.34       6.3  T
   5     -9.7004561 -0.399003E-06  0.157E-03    3.34      28.4  T
   6     -9.7004561 -0.422935E-08  0.608E-04    3.34      73.6  T
   7     -9.7004561 -0.500259E-09  0.155E-04    3.34     289.2  T
     SCC iter.                  ...        0 min,  0.001 sec
     gradient                   ...        0 min,  0.001 sec
 * total energy  :    -9.5784546 Eh     change       -0.1315326E-04 Eh
   gradient norm :     0.0018236 Eh/α   predicted    -0.1066472E-04 ( -18.92%)
   displ. norm   :     0.0094372 α      lambda       -0.5578527E-05
   maximum displ.:     0.0058684 α      in ANC's #3, #4, #8, ...

........................................................................
.............................. CYCLE   18 ..............................
........................................................................
   1     -9.7002537 -0.970025E+01  0.273E-02    3.34       0.0  T
   2     -9.7002536  0.997610E-07  0.163E-02    3.34       2.7  T
   3     -9.7002516  0.199995E-05  0.172E-02    3.34       2.6  T
   4     -9.7002538 -0.223165E-05  0.173E-03    3.34      25.9  T
   5     -9.7002538 -0.804790E-08  0.917E-04    3.34      48.8  T
   6     -9.7002538 -0.103584E-08  0.132E-04    3.34     337.6  T
     SCC iter.                  ...        0 min,  0.001 sec
     gradient                   ...        0 min,  0.001 sec
 * total energy  :    -9.5784591 Eh     change       -0.4456182E-05 Eh
   gradient norm :     0.0014240 Eh/α   predicted    -0.2788478E-05 ( -37.42%)
   displ. norm   :     0.0042104 α      lambda       -0.2239839E-05
   maximum displ.:     0.0034071 α      in ANC's #2, #9, #6, ...

........................................................................
.............................. CYCLE   19 ..............................
........................................................................
   1     -9.7001328 -0.970013E+01  0.160E-02    3.34       0.0  T
   2     -9.7001328 -0.669623E-07  0.905E-03    3.34       4.9  T
   3     -9.7001328  0.491674E-07  0.451E-03    3.34       9.9  T
   4     -9.7001328 -0.177826E-07  0.277E-03    3.34      16.2  T
   5     -9.7001328 -0.561045E-07  0.548E-04    3.34      81.6  T
   6     -9.7001328  0.296000E-09  0.366E-04    3.34     122.2  T
     SCC iter.                  ...        0 min,  0.001 sec
     gradient                   ...        0 min,  0.001 sec
 * total energy  :    -9.5784613 Eh     change       -0.2259480E-05 Eh
   gradient norm :     0.0006581 Eh/α   predicted    -0.1120767E-05 ( -50.40%)
   displ. norm   :     0.0028850 α      lambda       -0.1145954E-05
   maximum displ.:     0.0018618 α      in ANC's #6, #5, #9, ...

   *** GEOMETRY OPTIMIZATION CONVERGED AFTER 19 ITERATIONS ***

------------------------------------------------------------------------
 total energy gain   :        -0.1447149 Eh      -90.8100 kcal/mol
 total RMSD          :         0.8154112 a0        0.4315 Å
 total power (kW/mol):       -19.9973150 (step)-6721.7875 (real)
------------------------------------------------------------------------

 ANCopt (total)                0 d,  0 h,  0 min,  0.057 sec
 optimizer setup                ...        0 min,  0.000 sec (  0.119%)
 model hessian                  ...        0 min,  0.000 sec (  0.159%)
 ANC generation                 ...        0 min,  0.000 sec (  0.129%)
 coordinate transformation      ...        0 min,  0.000 sec (  0.067%)
 single point calculation       ...        0 min,  0.055 sec ( 97.041%)
 optimization log               ...        0 min,  0.000 sec (  0.810%)
 hessian update                 ...        0 min,  0.000 sec (  0.073%)
 rational function              ...        0 min,  0.000 sec (  0.698%)

================
 final structure:
================
5
 xtb: 6.2.2 (9d81278992624c895f80dd42a50cac0aa55982e2)
C         0.70493790694208   -0.89375252374059   -0.13643966585837
C         0.27738229285767    0.42618639832807    0.19759940961157
C        -0.94742326233585   -0.16879950414001    0.62234770193281
N        -0.58252760737123   -0.76472955357078   -0.53912055056062
H         0.54763066990733    1.40109418312331   -0.14438689512539

 Bond Distances (Angstroems)
 ---------------------------
C1-C2=1.4271         C1-N4=1.3551         C2-C1=1.4271         C2-C3=1.4264         C2-N4=1.6433         C2-H5=1.0679         
C3-C2=1.4264         C3-N4=1.3555         N4-C1=1.3551         N4-C2=1.6433         N4-C3=1.3555         H5-C2=1.0679         
 C  H  Rav=1.0679 sigma=0.0000  Rmin=1.0679  Rmax=1.0679     1
 C  C  Rav=1.4267 sigma=0.0004  Rmin=1.4264  Rmax=1.4271     2
 N  C  Rav=1.4513 sigma=0.1358  Rmin=1.3551  Rmax=1.6433     3

 selected bond angles (degree)
 --------------------
N4-C1-C2= 72.35                C3-C2-C1= 86.63                N4-C2-C1= 51.80                N4-C2-C3= 51.82                
H5-C2-C1=133.91                H5-C2-C3=133.90                H5-C2-N4=130.58                N4-C3-C2= 72.37                
C2-N4-C1= 55.85                C3-N4-C1= 92.46                C3-N4-C2= 55.81                

 selected dihedral angles (degree)
 ---------------------------------
C3-C2-C1-N4= 42.14            H5-C2-C1-N4=246.97            N4-C3-C2-C1=317.88            N4-C3-C2-H5=113.06            
C3-N4-C1-C2=315.14            C1-N4-C2-C3=238.43            C1-N4-C2-H5=119.21            C3-N4-C2-C1=121.57            
C3-N4-C2-H5=240.79            C1-N4-C3-C2= 44.89            
           -------------------------------------------------
          |                Final Singlepoint                |
           -------------------------------------------------

          ...................................................
          :                      SETUP                      :
          :.................................................:
          :  # basis functions                  17          :
          :  # atomic orbitals                  17          :
          :  # shells                            9          :
          :  # electrons                        18          :
          :  max. iterations                   250          :
          :  Hamiltonian                  GFN2-xTB          :
          :  restarted?                      false          :
          :  GBSA solvation                  false          :
          :  PC potential                    false          :
          :  electronic temp.          300.0000000     K    :
          :  accuracy                    1.0000000          :
          :  -> integral cutoff          0.2500000E+02      :
          :  -> integral neglect         0.1000000E-07      :
          :  -> SCF convergence          0.1000000E-05 Eh   :
          :  -> wf. convergence          0.1000000E-03 e    :
          :  Broyden damping             0.4000000          :
          ...................................................

 iter      E             dE          RMSdq      gap      omega  full diag
   1     -9.7001328 -0.970013E+01  0.101E-04    3.34       0.0  T
   2     -9.7001328  0.461853E-11  0.616E-05    3.34     725.9  T
   3     -9.7001328  0.227800E-10  0.706E-05    3.34     633.7  T

   *** convergence criteria satisfied after 3 iterations ***

         #    Occupation            Energy/Eh            Energy/eV
      -------------------------------------------------------------
         1        2.0000           -0.7536414             -20.5076
       ...           ...                  ...                  ...
         3        2.0000           -0.6336989             -17.2438
         4        2.0000           -0.5888172             -16.0225
         5        2.0000           -0.5466745             -14.8758
         6        2.0000           -0.5261107             -14.3162
         7        2.0000           -0.4666177             -12.6973
         8        2.0000           -0.4598624             -12.5135
         9        2.0000           -0.4294639             -11.6863 (HOMO)
        10                         -0.3068485              -8.3498 (LUMO)
        11                         -0.3063101              -8.3351
        12                         -0.2555216              -6.9531
        13                          0.0382527               1.0409
        14                          0.0460916               1.2542
       ...                                ...                  ...
        17                          0.5157327              14.0338
      -------------------------------------------------------------
                  HL-Gap            0.1226154 Eh            3.3365 eV
             Fermi-level           -0.3681562 Eh          -10.0180 eV

 SCC (total)                   0 d,  0 h,  0 min,  0.003 sec
 SCC setup                      ...        0 min,  0.000 sec (  1.941%)
 Dispersion                     ...        0 min,  0.000 sec (  0.460%)
 integral evaluation            ...        0 min,  0.001 sec ( 37.706%)
 zeroth order Hamiltonian       ...        0 min,  0.000 sec (  0.506%)
 iterations                     ...        0 min,  0.000 sec ( 17.128%)
 molecular gradient             ...        0 min,  0.001 sec ( 39.472%)
 printout                       ...        0 min,  0.000 sec (  2.539%)

         :::::::::::::::::::::::::::::::::::::::::::::::::::::
         ::                     SUMMARY                     ::
         :::::::::::::::::::::::::::::::::::::::::::::::::::::
         :: total energy              -9.578461330829 Eh    ::
         :: gradient norm              0.000706360539 Eh/a0 ::
         :: HOMO-LUMO gap              3.336535043320 eV    ::
         ::.................................................::
         :: SCC energy                -9.700132844566 Eh    ::
         :: -> isotropic ES           -0.008218938053 Eh    ::
         :: -> anisotropic ES          0.003097025334 Eh    ::
         :: -> anisotropic XC          0.010295563496 Eh    ::
         :: -> dispersion             -0.001960609526 Eh    ::
         :: repulsion energy           0.121671485642 Eh    ::
         :: add. restraining           0.000000000000 Eh    ::
         :::::::::::::::::::::::::::::::::::::::::::::::::::::

           ------------------------------------------------- 
          |                Numerical Hessian                |
           ------------------------------------------------- 
step length          :   0.00500
SCC accuracy         :   0.30000
Hessian scale factor :   1.00000
frozen atoms in %    :   0.00000    0
RMS gradient         :   0.00071
estimated CPU  time      0.00 min
estimated wall time      0.00 min

writing file <hessian>.

 projected vibrational frequencies (cm-1)
eigval :       -0.00    -0.00    -0.00     0.00     0.00     0.00
eigval :      606.02   728.68   733.17   823.78   917.61  1188.75
eigval :     1331.06  1471.81  3187.06
           -------------------------------------------------
          |                Property Printout                |
           -------------------------------------------------

    * Orbital Energies and Occupations

         #    Occupation            Energy/Eh            Energy/eV
      -------------------------------------------------------------
         1        2.0000           -0.7536415             -20.5076
         2        2.0000           -0.6491579             -17.6645
         3        2.0000           -0.6336990             -17.2438
         4        2.0000           -0.5888173             -16.0225
         5        2.0000           -0.5466746             -14.8758
         6        2.0000           -0.5261108             -14.3162
         7        2.0000           -0.4666178             -12.6973
         8        2.0000           -0.4598625             -12.5135
         9        2.0000           -0.4294640             -11.6863 (HOMO)
        10                         -0.3068486              -8.3498 (LUMO)
        11                         -0.3063101              -8.3351
        12                         -0.2555217              -6.9531
        13                          0.0382526               1.0409
        14                          0.0460915               1.2542
        15                          0.1880991               5.1184
        16                          0.2434163               6.6237
        17                          0.5157326              14.0338
      -------------------------------------------------------------
                  HL-Gap            0.1226154 Eh            3.3365 eV
             Fermi-level           -0.3681563 Eh          -10.0180 eV

     #   Z        covCN         q      C6AA      α(0)
     1   6 C      2.468    -0.069    30.014     8.943
     2   6 C      3.752     0.093    19.100     6.232
     3   6 C      2.468    -0.069    30.014     8.943
     4   7 N      2.686    -0.035    21.928     6.955
     5   1 H      0.927     0.080     1.979     2.200

 Mol. C6AA /au·bohr⁶  :        457.514921
 Mol. C8AA /au·bohr⁸  :      11919.835155
 Mol. α(0) /au        :         33.273512


Wiberg/Mayer (AO) data.
largest (>0.10) Wiberg bond orders for each atom
          total WBO             WBO to atom ...
     1  C   2.836        N    4 1.245    C    2 1.114    C    3 0.469
     2  C   3.806        C    3 1.116    C    1 1.114    H    5 0.953    N    4 0.623
     3  C   2.836        N    4 1.244    C    2 1.116    C    1 0.469
     4  N   3.138        C    1 1.245    C    3 1.244    C    2 0.623
     5  H   0.994        C    2 0.953

MOs/occ written to file <molden.input>


molecular dipole:
                 x           y           z       tot (Debye)
 q only:        0.202       0.476      -0.014
   full:        0.253       0.898      -0.308       2.497
molecular quadrupole (traceless):
                xx          xy          yy          xz          yz          zz
 q only:       -0.387       0.477       0.540       0.187      -0.129      -0.152
  q+dip:       -1.840       1.539       1.894       0.768      -1.194      -0.054
   full:       -2.150       1.473       1.638       1.090      -1.499       0.512

           -------------------------------------------------
          |                Geometry Summary                 |
           -------------------------------------------------

      molecular mass/u    :       51.0468517
   center of mass at/Å    :       -0.1408169      -0.3318971       0.0100427
  moments of inertia/u·Å² :        0.2480262E+02   0.2771041E+02   0.4311276E+02
rotational constants/cm⁻¹ :        0.6796715E+00   0.6083501E+00   0.3910126E+00

 * 5 selected distances

     #   Z        #   Z                                     value/Å
     1   6 C      2   6 C                                 1.4271036 (max)
     2   6 C      3   6 C                                 1.4263828
     1   6 C      4   7 N                                 1.3551259
     3   6 C      4   7 N                                 1.3554667
     2   6 C      5   1 H                                 1.0679110 (min)

 * 3 distinct bonds (by element types)

   Z      Z             #   av. dist./Å        max./Å        min./Å
   1 H    6 C           1     1.0679110     1.0679110     1.0679110
   6 C    6 C           2     1.4267432     1.4271036     1.4263828
   6 C    7 N           2     1.3552963     1.3554667     1.3551259

           -------------------------------------------------
          |               Frequency Printout                |
           -------------------------------------------------
 projected vibrational frequencies (cm-1)
eigval :       -0.00    -0.00    -0.00     0.00     0.00     0.00
eigval :      606.02   728.68   733.17   823.78   917.61  1188.75
eigval :     1331.06  1471.81  3187.06
 reduced masses (amu)
   1: 10.65   2: 12.37   3: 12.78   4: 11.61   5: 11.94   6: 12.39   7: 12.45   8: 11.24
   9: 10.89  10:  4.96  11:  3.62  12: 11.69  13: 12.36  14: 12.25  15:  1.93
 IR intensities (amu)
   1:  0.17   2:  0.07   3:  0.13   4:  0.02   5:  0.17   6:  0.17   7:  0.17   8:  0.40
   9:  0.36  10:  0.26  11:  0.01  12:  0.92  13:  0.51  14:  0.46  15:  0.03
 Raman intensities (amu)
   1:  0.00   2:  0.00   3:  0.00   4:  0.00   5:  0.00   6:  0.00   7:  0.00   8:  0.00
   9:  0.00  10:  0.00  11:  0.00  12:  0.00  13:  0.00  14:  0.00  15:  0.00
 output can be read by thermo (or use thermo option).
 writing <g98.out> molden fake output.
 recommended (thermochemical) frequency scaling factor: 1.0
Molecule has the following symmetry elements: (sigma) 
It seems to be the Cs point group
           -------------------------------------------------
          |             Thermodynamic Functions             |
           -------------------------------------------------

cs  symmetry found (for desy threshold:  0.10E+00) used in thermo

          ...................................................
          :                      SETUP                      :
          :.................................................:
          :  # frequencies                           9      :
          :  # imaginary freq.                       0      :
          :  linear?                             false      :
          :  only rotor calc.                    false      :
          :  symmetry                               cs      :
          :  rotational number                       1      :
          :  scaling factor                  1.0000000      :
          :  rotor cutoff                   50.0000000 cm⁻¹ :
          :  imag. cutoff                  -20.0000000 cm⁻¹ :
          :.................................................:

    mode    ω/cm⁻¹     T·S(HO)/kcal·mol⁻¹    T·S(FR)/kcal·mol⁻¹   T·S(vib)
   ------------------------------------------------------------------------
   ------------------------------------------------------------------------

   temp. (K)  partition function   enthalpy   heat capacity  entropy
                                   cal/mol     cal/K/mol   cal/K/mol   J/K/mol
 298.15  VIB   1.16                  322.285      4.079      1.382
         ROT  0.131E+05              888.752      2.981     21.828
         INT  0.153E+05             1211.037      7.060     23.210
         TR   0.353E+27             1481.254      4.968     37.697
         TOT                        2692.2909    12.0280    60.9070   254.8347

   temp. (K)  partition function   enthalpy   heat capacity  entropy
                                   cal/mol     cal/K/mol   cal/K/mol   J/K/mol
 120.00  VIB   1.00                    2.033      0.135      0.019
         ROT  0.336E+04              357.707      2.981     19.115
         INT  0.336E+04              359.740      3.116     19.135
         TR   0.901E+26              596.178      4.968     33.177
         TOT                         955.9176     8.0845    52.3117   218.8723

   temp. (K)  partition function   enthalpy   heat capacity  entropy
                                   cal/mol     cal/K/mol   cal/K/mol   J/K/mol
 100.00  VIB   1.00                    0.418      0.039      0.005
         ROT  0.255E+04              298.089      2.981     18.572
         INT  0.255E+04              298.507      3.020     18.577
         TR   0.685E+26              496.815      4.968     32.272
         TOT                         795.3222     7.9883    50.8484   212.7498

   temp. (K)  partition function   enthalpy   heat capacity  entropy
                                   cal/mol     cal/K/mol   cal/K/mol   J/K/mol
  80.00  VIB   1.00                    0.041      0.006      0.001
         ROT  0.183E+04              238.471      2.981     17.907
         INT  0.183E+04              238.512      2.987     17.907
         TR   0.490E+26              397.452      4.968     31.164
         TOT                         635.9644     7.9549    49.0711   205.3134

   temp. (K)  partition function   enthalpy   heat capacity  entropy
                                   cal/mol     cal/K/mol   cal/K/mol   J/K/mol
  60.00  VIB   1.00                    0.001      0.000     -0.000
         ROT  0.119E+04              178.853      2.981     17.049
         INT  0.119E+04              178.854      2.981     17.049
         TR   0.319E+26              298.089      4.968     29.735
         TOT                         476.9434     7.9493    46.7844   195.7460

   temp. (K)  partition function   enthalpy   heat capacity  entropy
                                   cal/mol     cal/K/mol   cal/K/mol   J/K/mol
  40.00  VIB   1.00                    0.000      0.000     -0.000
         ROT   646.                  119.236      2.981     15.841
         INT   646.                  119.236      2.981     15.840
         TR   0.173E+26              198.726      4.968     27.722
         TOT                         317.9616     7.9490    43.5623   182.2645

   temp. (K)  partition function   enthalpy   heat capacity  entropy
                                   cal/mol     cal/K/mol   cal/K/mol   J/K/mol
  20.00  VIB   1.00                    0.000      0.000     -0.000
         ROT   228.                   59.618      2.981     13.774
         INT   228.                   59.618      2.981     13.774
         TR   0.613E+25               99.363      4.968     24.280
         TOT                         158.9808     7.9490    38.0540   159.2180

   temp. (K)  partition function   enthalpy   heat capacity  entropy
                                   cal/mol     cal/K/mol   cal/K/mol   J/K/mol
  10.00  VIB   1.00                    0.000      0.000     -0.000
         ROT   80.8                   29.809      2.981     11.708
         INT   80.8                   29.809      2.981     11.708
         TR   0.217E+25               49.681      4.968     20.838
         TOT                          79.4904     7.9490    32.5458   136.1715

       T/K    H(0)-H(T)+PV         H(T)/Eh          T*S/Eh         G(T)/Eh
   ------------------------------------------------------------------------
    298.15    0.429044E-02    0.293228E-01    0.289389E-01    0.383981E-03
    120.00    0.152335E-02    0.265558E-01    0.100037E-01    0.165521E-01
    100.00    0.126743E-02    0.262998E-01    0.810321E-02    0.181966E-01
     80.00    0.101347E-02    0.260459E-01    0.625598E-02    0.197899E-01
     60.00    0.760058E-03    0.257925E-01    0.447334E-02    0.213191E-01
     40.00    0.506704E-03    0.255391E-01    0.277684E-02    0.227623E-01
     20.00    0.253352E-03    0.252858E-01    0.121286E-02    0.240729E-01
     10.00    0.126676E-03    0.251591E-01    0.518650E-03    0.246404E-01 (used)
   ------------------------------------------------------------------------

         :::::::::::::::::::::::::::::::::::::::::::::::::::::
         ::                  THERMODYNAMIC                  ::
         :::::::::::::::::::::::::::::::::::::::::::::::::::::
         :: total free energy          -9.553820901465 Eh   ::
         ::.................................................::
         :: total energy               -9.578461330951 Eh   ::
         :: zero point energy           0.025032403166 Eh   ::
         :: G(RRHO) w/o ZPVE           -0.000391973680 Eh   ::
         :: G(RRHO) contrib.            0.024640429486 Eh   ::
         :::::::::::::::::::::::::::::::::::::::::::::::::::::

optimized geometry written to: xtbopt.xyz


           -------------------------------------------------
          | TOTAL ENERGY               -9.578461330951 Eh   |
          | TOTAL ENTHALPY             -9.553302251770 Eh   |
          | TOTAL FREE ENERGY          -9.553820901465 Eh   |
          | GRADIENT NORM               0.000706315002 Eh/α |
          | HOMO-LUMO GAP               3.336535956342 eV   |
           -------------------------------------------------

------------------------------------------------------------------------
 * finished run on 2020/05/12 at 11:44:55.809     
------------------------------------------------------------------------
 total:
 * wall-time:     0 d,  0 h,  0 min,  0.160 sec
 *  cpu-time:     0 d,  0 h,  0 min,  0.160 sec
 * ratio c/w:     0.999 speedup
 SCF:
 * wall-time:     0 d,  0 h,  0 min,  0.005 sec
 *  cpu-time:     0 d,  0 h,  0 min,  0.005 sec
 * ratio c/w:     0.999 speedup
 ANC optimizer:
 * wall-time:     0 d,  0 h,  0 min,  0.060 sec
 *  cpu-time:     0 d,  0 h,  0 min,  0.060 sec
 * ratio c/w:     1.000 speedup
 numerical hessian:
 * wall-time:     0 d,  0 h,  0 min,  0.080 sec
 *  cpu-time:     0 d,  0 h,  0 min,  0.079 sec
 * ratio c/w:     0.999 speedup

