      -----------------------------------------------------------      
     |                   =====================                   |     
     |                           x T B                           |     
     |                   =====================                   |     
     |                         S. Grimme                         |     
     |          Mulliken Center for Theoretical Chemistry        |     
     |                    University of Bonn                     |     
      -----------------------------------------------------------      

   * xtb version 6.2.2 (9d81278992624c895f80dd42a50cac0aa55982e2) compiled by '@Darwin' on 04/03/2020

   xtb is free software: you can redistribute it and/or modify it under
   the terms of the GNU Lesser General Public License as published by
   the Free Software Foundation, either version 3 of the License, or
   (at your option) any later version.
   
   xtb is distributed in the hope that it will be useful,
   but WITHOUT ANY WARRANTY; without even the implied warranty of
   MERCHANTABILITY or FITNESS FOR A PARTICULAR PURPOSE.  See the
   GNU Lesser General Public License for more details.
   
   Cite this work as:
   * S. Grimme, C. Bannwarth, P. Shushkov, J. Chem. Theory Comput., 2017,
     13, 1989-2009. DOI: 10.1021/acs.jctc.7b00118
   * C. Bannwarth, S. Ehlert and S. Grimme., J. Chem. Theory Comput., 2019,
     15, 1652-1671. DOI: 10.1021/acs.jctc.8b01176
   * P. Pracht, E. Caldeweyher, S. Ehlert, S. Grimme, ChemRxiv, 2019, preprint.
     DOI: 10.26434/chemrxiv.8326202.v1
   
   for DFT-D4:
   * E. Caldeweyher, C. Bannwarth and S. Grimme, J. Chem. Phys., 2017,
     147, 034112. DOI: 10.1063/1.4993215
   * E. Caldeweyher, S. Ehlert, A. Hansen, H. Neugebauer, S. Spicher,
     C. Bannwarth and S. Grimme, J. Chem. Phys., 2019, 150, 154122.
     DOI: 10.1063/1.5090222
   
   for sTDA-xTB:
   * S. Grimme and C. Bannwarth, J. Chem. Phys., 2016, 145, 054103.
     DOI: 10.1063/1.4959605
   
   in the mass-spec context:
   * V. Asgeirsson, C. Bauer and S. Grimme, Chem. Sci., 2017, 8, 4879.
     DOI: 10.1039/c7sc00601b
   
   for metadynamics refer to:
   * S. Grimme, J. Chem. Theory Comput., 2019, 155, 2847-2862
     DOI: 10.1021/acs.jctc.9b00143
   
   with help from (in alphabetical order)
   C. Bannwarth, F. Bohle, G. Brandenburg, E. Caldeweyher, M. Checinski,
   S. Dohm, S. Ehlert, S. Ehrlich, F. März, H. Neugebauer, J. Pisarek,
   P. Pracht, P. Shushkov, and S. Spicher.
   
 * started run on 2020/05/12 at 11:45:15.435     

           -------------------------------------------------
          |                Calculation Setup                |
           -------------------------------------------------

          program call               : xtb --input H2C2O1_7_S_2.input H2C2O1_7_S_2.xyz --ohess --molden --namespace H2C2O1_7_S_2 output.out
          calculation namespace      : H2C2O1_7_S_2
          coordinate file            : H2C2O1_7_S_2.xyz
          number of atoms            :                     5
          number of electrons        :                    16
          charge                     :                     0
          spin                       :                   1.0
          first test random number   :      0.13386737629380

   ID    Z sym.   atoms
    1    6 C      1, 2
    2    8 O      3
    3    1 H      4, 5

           -------------------------------------------------
          |                 G F N 2 - x T B                 |
           -------------------------------------------------

        Reference                      10.1021/acs.jctc.8b01176
      * Hamiltonian:
        H0-scaling (s, p, d)           1.850000    2.230000    2.230000
        zeta-weighting                 0.500000
      * Dispersion:
        s8                             2.700000
        a1                             0.520000
        a2                             5.000000
        s9                             5.000000
      * Repulsion:
        kExp                           1.500000    1.000000
        rExp                           1.000000
      * Coulomb:
        alpha                          2.000000
        third order                    shell-resolved
        anisotropic                    true
        a3                             3.000000
        a5                             4.000000
        cn-shift                       1.200000
        cn-exp                         4.000000
        max-rad                        5.000000


          ...................................................
          :                      SETUP                      :
          :.................................................:
          :  # basis functions                  14          :
          :  # atomic orbitals                  14          :
          :  # shells                            8          :
          :  # electrons                        16          :
          :  max. iterations                   250          :
          :  Hamiltonian                  GFN2-xTB          :
          :  restarted?                      false          :
          :  GBSA solvation                  false          :
          :  PC potential                    false          :
          :  electronic temp.          300.0000000     K    :
          :  accuracy                    1.0000000          :
          :  -> integral cutoff          0.2500000E+02      :
          :  -> integral neglect         0.1000000E-07      :
          :  -> SCF convergence          0.1000000E-05 Eh   :
          :  -> wf. convergence          0.1000000E-03 e    :
          :  Broyden damping             0.4000000          :
          ...................................................

 iter      E             dE          RMSdq      gap      omega  full diag
   1     -9.1513382 -0.915134E+01  0.544E+00    5.87       0.0  T
   2     -9.1630743 -0.117361E-01  0.275E+00    5.71       1.0  T
   3     -9.1623572  0.717090E-03  0.132E+00    5.93       1.0  T
   4     -9.1640554 -0.169815E-02  0.354E-01    5.73       1.0  T
   5     -9.1643942 -0.338782E-03  0.151E-01    5.80       1.0  T
   6     -9.1644061 -0.119061E-04  0.561E-02    5.78       1.0  T
   7     -9.1644086 -0.256880E-05  0.253E-02    5.79       1.8  T
   8     -9.1644118 -0.318691E-05  0.359E-03    5.79      12.5  T
   9     -9.1644119 -0.516397E-07  0.925E-04    5.79      48.3  T
  10     -9.1644119 -0.193160E-08  0.107E-04    5.79     417.1  T

   *** convergence criteria satisfied after 10 iterations ***

         #    Occupation            Energy/Eh            Energy/eV
      -------------------------------------------------------------
         1        2.0000           -0.7410618             -20.1653
       ...           ...                  ...                  ...
         3        2.0000           -0.6152433             -16.7416
         4        2.0000           -0.5826141             -15.8537
         5        2.0000           -0.5481129             -14.9149
         6        2.0000           -0.4848399             -13.1932
         7        2.0000           -0.4652894             -12.6612
         8        1.0000           -0.4309646             -11.7271
         9        1.0000           -0.3215373              -8.7495 (HOMO)
        10                         -0.1088980              -2.9633 (LUMO)
        11                          0.0468245               1.2742
        12                          0.0735184               2.0005
        13                          0.2193767               5.9695
        14                          0.2331039               6.3431
      -------------------------------------------------------------
                  HL-Gap            0.2126393 Eh            5.7862 eV
             Fermi-level           -0.3316723 Eh           -9.0253 eV

 transition dipole moment (au) for excitation:           8           9
     X       Y       Z   
  -0.0017   0.3522  -0.0221  total (au/Debye):    0.353   0.897
 dE (eV)             :    2.978
 oscillator strength :  0.12844E-01

 SCC (total)                   0 d,  0 h,  0 min,  0.003 sec
 SCC setup                      ...        0 min,  0.000 sec (  2.547%)
 Dispersion                     ...        0 min,  0.000 sec (  0.360%)
 integral evaluation            ...        0 min,  0.001 sec ( 23.143%)
 zeroth order Hamiltonian       ...        0 min,  0.000 sec (  0.797%)
 iterations                     ...        0 min,  0.001 sec ( 29.718%)
 molecular gradient             ...        0 min,  0.001 sec ( 23.792%)
 printout                       ...        0 min,  0.001 sec ( 19.234%)

         :::::::::::::::::::::::::::::::::::::::::::::::::::::
         ::                     SUMMARY                     ::
         :::::::::::::::::::::::::::::::::::::::::::::::::::::
         :: total energy              -9.101548078646 Eh    ::
         :: gradient norm              0.071790659564 Eh/a0 ::
         :: HOMO-LUMO gap              5.786209250743 eV    ::
         ::.................................................::
         :: SCC energy                -9.164411888726 Eh    ::
         :: -> isotropic ES            0.014451288582 Eh    ::
         :: -> anisotropic ES         -0.001082645512 Eh    ::
         :: -> anisotropic XC          0.000141747516 Eh    ::
         :: -> dispersion             -0.001319765215 Eh    ::
         :: repulsion energy           0.062863787634 Eh    ::
         :: add. restraining           0.000000000000 Eh    ::
         :::::::::::::::::::::::::::::::::::::::::::::::::::::

      ----------------------------------------------------------- 
     |                   =====================                   |
     |                        A N C O P T                        |
     |                   =====================                   |
     |               Approximate Normal Coordinate               |
     |                Rational Function Optimizer                |
      ----------------------------------------------------------- 

          ...................................................
          :                      SETUP                      :
          :.................................................:
          :   optimization level            normal          :
          :   max. optcycles                   200          :
          :   ANC micro-cycles                  20          :
          :   degrees of freedom                 9          :
          :.................................................:
          :   RF solver                   davidson          :
          :   write xtbopt.log                true          :
          :   linear?                        false          :
          :   energy convergence         0.5000000E-05 Eh   :
          :   grad. convergence          0.1000000E-02 Eh/α :
          :   maximium RF displ.         1.0000000          :
          :   Hlow (freq-cutoff)         0.1000000E-01      :
          :   Hmax (freq-cutoff)         5.0000000          :
          :   S6 in model hess.         20.0000000          :
          ...................................................

generating ANC from model Hessian ...
Using Lindh-Hessian (1995)
 Shifting diagonal of input Hessian by    0.0000000000000000     
 Lowest  eigenvalues of input Hessian
   -0.000000   -0.000000   -0.000000    0.000000    0.000000    0.000000
    0.079044    0.094605    0.152890    0.159593    0.392283    0.930563
    1.086576    1.176081    1.735479
 Highest eigenvalues
    0.159593    0.392283    0.930563    1.086576    1.176081    1.735479


........................................................................
.............................. CYCLE    1 ..............................
........................................................................
   1     -9.1644119 -0.916441E+01  0.308E-05    5.79       0.0  T
   2     -9.1644119 -0.346922E-11  0.106E-05    5.79    4212.8  T
   3     -9.1644119 -0.367706E-12  0.376E-06    5.79   11879.1  T
     SCC iter.                  ...        0 min,  0.000 sec
     gradient                   ...        0 min,  0.001 sec
 * total energy  :    -9.1015481 Eh     change       -0.2606146E-09 Eh
   gradient norm :     0.0717914 Eh/α   predicted     0.0000000E+00 (-100.00%)
   displ. norm   :     0.1776335 α      lambda       -0.8426132E-02
   maximum displ.:     0.1381178 α      in ANC's #3, #2, #7, ...

........................................................................
.............................. CYCLE    2 ..............................
........................................................................
   1     -9.1779030 -0.917790E+01  0.519E-01    5.69       0.0  T
   2     -9.1780463 -0.143342E-03  0.268E-01    5.70       1.0  T
   3     -9.1780500 -0.365194E-05  0.129E-01    5.69       1.0  T
   4     -9.1780560 -0.604397E-05  0.186E-02    5.70       2.4  T
   5     -9.1780575 -0.151158E-05  0.508E-03    5.70       8.8  T
   6     -9.1780575 -0.727229E-08  0.146E-03    5.70      30.6  T
   7     -9.1780575 -0.429225E-09  0.228E-04    5.70     196.5  T
   8     -9.1780575 -0.145615E-09  0.476E-05    5.70     940.0  T
     SCC iter.                  ...        0 min,  0.001 sec
     gradient                   ...        0 min,  0.001 sec
 * total energy  :    -9.1071576 Eh     change       -0.5609487E-02 Eh
   gradient norm :     0.0350797 Eh/α   predicted    -0.4346003E-02 ( -22.52%)
   displ. norm   :     0.1376024 α      lambda       -0.3273012E-02
   maximum displ.:     0.1014418 α      in ANC's #3, #2, #7, ...

........................................................................
.............................. CYCLE    3 ..............................
........................................................................
   1     -9.1870042 -0.918700E+01  0.481E-01    5.39       0.0  T
   2     -9.1871247 -0.120457E-03  0.262E-01    5.45       1.0  T
   3     -9.1871312 -0.651512E-05  0.160E-01    5.41       1.0  T
   4     -9.1871663 -0.351391E-04  0.274E-02    5.44       1.6  T
   5     -9.1871680 -0.170404E-05  0.134E-02    5.44       3.3  T
   6     -9.1871681 -0.480725E-07  0.295E-03    5.44      15.1  T
   7     -9.1871681 -0.396075E-08  0.303E-04    5.44     147.8  T
   8     -9.1871681 -0.158202E-10  0.172E-04    5.44     259.7  T
     SCC iter.                  ...        0 min,  0.001 sec
     gradient                   ...        0 min,  0.001 sec
 * total energy  :    -9.1086549 Eh     change       -0.1497342E-02 Eh
   gradient norm :     0.0125571 Eh/α   predicted    -0.1667493E-02 (  11.36%)
   displ. norm   :     0.0206153 α      lambda       -0.1851548E-03
   maximum displ.:     0.0112007 α      in ANC's #2, #5, #3, ...

........................................................................
.............................. CYCLE    4 ..............................
........................................................................
   1     -9.1858210 -0.918582E+01  0.670E-02    5.37       0.0  T
   2     -9.1858227 -0.173676E-05  0.367E-02    5.37       1.2  T
   3     -9.1858227 -0.307202E-07  0.146E-02    5.37       3.1  T
   4     -9.1858228 -0.108404E-06  0.191E-03    5.37      23.4  T
   5     -9.1858228 -0.508565E-08  0.120E-03    5.37      37.4  T
   6     -9.1858228 -0.186023E-08  0.396E-04    5.37     113.0  T
   7     -9.1858228 -0.440377E-10  0.412E-05    5.37    1085.9  T
     SCC iter.                  ...        0 min,  0.000 sec
     gradient                   ...        0 min,  0.001 sec
 * total energy  :    -9.1087826 Eh     change       -0.1276647E-03 Eh
   gradient norm :     0.0062617 Eh/α   predicted    -0.9261497E-04 ( -27.45%)
   displ. norm   :     0.0141944 α      lambda       -0.7447242E-04
   maximum displ.:     0.0099187 α      in ANC's #6, #5, #3, ...

........................................................................
.............................. CYCLE    5 ..............................
........................................................................
   1     -9.1851994 -0.918520E+01  0.619E-02    5.26       0.0  T
   2     -9.1852009 -0.150619E-05  0.352E-02    5.27       1.3  T
   3     -9.1852007  0.205500E-06  0.174E-02    5.26       2.6  T
   4     -9.1852013 -0.595991E-06  0.331E-03    5.27      13.5  T
   5     -9.1852014 -0.289951E-07  0.150E-03    5.27      29.8  T
   6     -9.1852014 -0.952372E-09  0.539E-04    5.27      83.0  T
   7     -9.1852014 -0.987654E-10  0.424E-05    5.27    1055.2  T
     SCC iter.                  ...        0 min,  0.000 sec
     gradient                   ...        0 min,  0.001 sec
 * total energy  :    -9.1088261 Eh     change       -0.4357369E-04 Eh
   gradient norm :     0.0022325 Eh/α   predicted    -0.3724415E-04 ( -14.53%)
   displ. norm   :     0.0045181 α      lambda       -0.7156175E-05
   maximum displ.:     0.0024662 α      in ANC's #6, #2, #9, ...

........................................................................
.............................. CYCLE    6 ..............................
........................................................................
   1     -9.1852399 -0.918524E+01  0.187E-02    5.23       0.0  T
   2     -9.1852401 -0.148897E-06  0.107E-02    5.23       4.2  T
   3     -9.1852401  0.815082E-08  0.656E-03    5.23       6.8  T
   4     -9.1852402 -0.845330E-07  0.982E-04    5.23      45.5  T
   5     -9.1852402 -0.586759E-09  0.467E-04    5.23      95.7  T
     SCC iter.                  ...        0 min,  0.001 sec
     gradient                   ...        0 min,  0.001 sec
 * total energy  :    -9.1088306 Eh     change       -0.4489909E-05 Eh
   gradient norm :     0.0009321 Eh/α   predicted    -0.3579454E-05 ( -20.28%)
   displ. norm   :     0.0023664 α      lambda       -0.1138095E-05
   maximum displ.:     0.0014743 α      in ANC's #7, #2, #9, ...

   *** GEOMETRY OPTIMIZATION CONVERGED AFTER 6 ITERATIONS ***

------------------------------------------------------------------------
 total energy gain   :        -0.0072826 Eh       -4.5699 kcal/mol
 total RMSD          :         0.1185960 a0        0.0628 Å
 total power (kW/mol):        -3.1867256 (step)-1441.1921 (real)
------------------------------------------------------------------------

 ANCopt (total)                0 d,  0 h,  0 min,  0.013 sec
 optimizer setup                ...        0 min,  0.000 sec (  0.542%)
 model hessian                  ...        0 min,  0.000 sec (  0.763%)
 ANC generation                 ...        0 min,  0.000 sec (  0.444%)
 coordinate transformation      ...        0 min,  0.000 sec (  0.102%)
 single point calculation       ...        0 min,  0.012 sec ( 93.966%)
 optimization log               ...        0 min,  0.000 sec (  1.072%)
 hessian update                 ...        0 min,  0.000 sec (  0.115%)
 rational function              ...        0 min,  0.000 sec (  1.133%)

================
 final structure:
================
5
 xtb: 6.2.2 (9d81278992624c895f80dd42a50cac0aa55982e2)
C        -0.27702761845039   -0.00656715830038   -0.08375248565700
C         1.06997831963296   -0.03048325421364   -0.56941802572271
O         0.91192701077407    0.05250429396273    0.76948343319267
H        -0.85684874018732    0.91156816837833   -0.11565654097701
H        -0.84802897176933   -0.92702104982703   -0.00065638083594

 Bond Distances (Angstroems)
 ---------------------------
C1-C2=1.4321         C1-O3=1.4646         C1-H4=1.0864         C1-H5=1.0864         C2-C1=1.4321         C2-O3=1.3507         
O3-C1=1.4646         O3-C2=1.3507         H4-C1=1.0864         H5-C1=1.0864         
 C  H  Rav=1.0864 sigma=0.0000  Rmin=1.0864  Rmax=1.0864     2
 C  C  Rav=1.4321 sigma=0.0000  Rmin=1.4321  Rmax=1.4321     1
 O  C  Rav=1.4077 sigma=0.0569  Rmin=1.3507  Rmax=1.4646     2

 selected bond angles (degree)
 --------------------
O3-C1-C2= 55.58                H4-C1-C2=120.41                H4-C1-O3=114.60                H5-C1-C2=120.41                
H5-C1-O3=114.60                H5-C1-H4=115.96                O3-C2-C1= 63.43                C2-O3-C1= 60.99                

 selected dihedral angles (degree)
 ---------------------------------
O3-C2-C1-H4=100.54            O3-C2-C1-H5=259.46            C2-O3-C1-H4=248.83            C2-O3-C1-H5=111.17            
           -------------------------------------------------
          |                Final Singlepoint                |
           -------------------------------------------------

          ...................................................
          :                      SETUP                      :
          :.................................................:
          :  # basis functions                  14          :
          :  # atomic orbitals                  14          :
          :  # shells                            8          :
          :  # electrons                        16          :
          :  max. iterations                   250          :
          :  Hamiltonian                  GFN2-xTB          :
          :  restarted?                      false          :
          :  GBSA solvation                  false          :
          :  PC potential                    false          :
          :  electronic temp.          300.0000000     K    :
          :  accuracy                    1.0000000          :
          :  -> integral cutoff          0.2500000E+02      :
          :  -> integral neglect         0.1000000E-07      :
          :  -> SCF convergence          0.1000000E-05 Eh   :
          :  -> wf. convergence          0.1000000E-03 e    :
          :  Broyden damping             0.4000000          :
          ...................................................

 iter      E             dE          RMSdq      gap      omega  full diag
   1     -9.1852402 -0.918524E+01  0.125E-04    5.23       0.0  T
   2     -9.1852402 -0.134026E-10  0.687E-05    5.23     650.5  T
   3     -9.1852402 -0.160760E-11  0.354E-05    5.23    1262.3  T

   *** convergence criteria satisfied after 3 iterations ***

         #    Occupation            Energy/Eh            Energy/eV
      -------------------------------------------------------------
         1        2.0000           -0.7419316             -20.1890
       ...           ...                  ...                  ...
         3        2.0000           -0.6136680             -16.6988
         4        2.0000           -0.5797930             -15.7770
         5        2.0000           -0.5551404             -15.1061
         6        2.0000           -0.4926629             -13.4060
         7        2.0000           -0.4734366             -12.8829
         8        1.0000           -0.4185234             -11.3886
         9        1.0000           -0.3064365              -8.3386 (HOMO)
        10                         -0.1142243              -3.1082 (LUMO)
        11                          0.0553356               1.5058
        12                          0.1280705               3.4850
        13                          0.2259618               6.1487
        14                          0.3391546               9.2289
      -------------------------------------------------------------
                  HL-Gap            0.1922123 Eh            5.2304 eV
             Fermi-level           -0.3281552 Eh           -8.9296 eV

 transition dipole moment (au) for excitation:           8           9
     X       Y       Z   
   0.0016  -0.3357   0.0210  total (au/Debye):    0.336   0.855
 dE (eV)             :    3.050
 oscillator strength :  0.11953E-01

 SCC (total)                   0 d,  0 h,  0 min,  0.002 sec
 SCC setup                      ...        0 min,  0.000 sec (  3.614%)
 Dispersion                     ...        0 min,  0.000 sec (  0.554%)
 integral evaluation            ...        0 min,  0.001 sec ( 30.717%)
 zeroth order Hamiltonian       ...        0 min,  0.000 sec (  0.526%)
 iterations                     ...        0 min,  0.000 sec (  9.895%)
 molecular gradient             ...        0 min,  0.001 sec ( 29.560%)
 printout                       ...        0 min,  0.001 sec ( 24.751%)

         :::::::::::::::::::::::::::::::::::::::::::::::::::::
         ::                     SUMMARY                     ::
         :::::::::::::::::::::::::::::::::::::::::::::::::::::
         :: total energy              -9.108830632661 Eh    ::
         :: gradient norm              0.000933670324 Eh/a0 ::
         :: HOMO-LUMO gap              5.230362259119 eV    ::
         ::.................................................::
         :: SCC energy                -9.185240167825 Eh    ::
         :: -> isotropic ES            0.013213953241 Eh    ::
         :: -> anisotropic ES         -0.000426015402 Eh    ::
         :: -> anisotropic XC          0.000271604154 Eh    ::
         :: -> dispersion             -0.001322007534 Eh    ::
         :: repulsion energy           0.076409514556 Eh    ::
         :: add. restraining           0.000000000000 Eh    ::
         :::::::::::::::::::::::::::::::::::::::::::::::::::::

           ------------------------------------------------- 
          |                Numerical Hessian                |
           ------------------------------------------------- 
step length          :   0.00500
SCC accuracy         :   0.30000
Hessian scale factor :   1.00000
frozen atoms in %    :   0.00000    0
RMS gradient         :   0.00093
estimated CPU  time      0.00 min
estimated wall time      0.00 min

writing file <hessian>.

 projected vibrational frequencies (cm-1)
eigval :       -0.00     0.00     0.00     0.00     0.00     0.00
eigval :      811.73   866.07  1025.65  1045.39  1136.35  1398.50
eigval :     1498.78  2989.75  2994.34
           -------------------------------------------------
          |                Property Printout                |
           -------------------------------------------------

    * Orbital Energies and Occupations

         #    Occupation            Energy/Eh            Energy/eV
      -------------------------------------------------------------
         1        2.0000           -0.7419315             -20.1890
         2        2.0000           -0.6507629             -17.7082
         3        2.0000           -0.6136680             -16.6988
         4        2.0000           -0.5797930             -15.7770
         5        2.0000           -0.5551404             -15.1061
         6        2.0000           -0.4926628             -13.4060
         7        2.0000           -0.4734365             -12.8829
         8        1.0000           -0.4185232             -11.3886
         9        1.0000           -0.3064363              -8.3386 (HOMO)
        10                         -0.1142242              -3.1082 (LUMO)
        11                          0.0553357               1.5058
        12                          0.1280705               3.4850
        13                          0.2259616               6.1487
        14                          0.3391547               9.2289
      -------------------------------------------------------------
                  HL-Gap            0.1922121 Eh            5.2304 eV
             Fermi-level           -0.3281550 Eh           -8.9296 eV

     #   Z        covCN         q      C6AA      α(0)
     1   6 C      3.672     0.082    19.450     6.321
     2   6 C      1.833     0.025    30.518     8.925
     3   8 O      1.696    -0.244    18.038     5.734
     4   1 H      0.925     0.068     2.102     2.267
     5   1 H      0.925     0.068     2.102     2.267

 Mol. C6AA /au·bohr⁶  :        290.015187
 Mol. C8AA /au·bohr⁸  :       6781.727980
 Mol. α(0) /au        :         25.514592


Wiberg/Mayer (AO) data.
largest (>0.10) Wiberg bond orders for each atom
          total WBO             WBO to atom ...
     1  C   3.752        C    2 0.980    H    5 0.962    H    4 0.962    O    3 0.848
     2  C   2.076        O    3 1.091    C    1 0.980
     3  O   1.969        C    2 1.091    C    1 0.848
     4  H   0.981        C    1 0.962
     5  H   0.981        C    1 0.962

MOs/occ written to file <molden.input>


molecular dipole:
                 x           y           z       tot (Debye)
 q only:       -0.633      -0.029      -0.409
   full:       -0.625      -0.022      -0.301       1.765
molecular quadrupole (traceless):
                xx          xy          yy          xz          yz          zz
 q only:       -0.208      -0.064       0.773      -0.950      -0.089      -0.565
  q+dip:        0.140      -0.120       1.917      -1.776      -0.258      -2.057
   full:        0.354      -0.096       1.361      -1.450      -0.200      -1.716

           -------------------------------------------------
Molecule has the following symmetry elements: (sigma) 
It seems to be the Cs point group
          |                Geometry Summary                 |
           -------------------------------------------------

      molecular mass/u    :       42.0367582
   center of mass at/Å    :        0.5327674       0.0090242       0.1034548
  moments of inertia/u·Å² :        0.1401779E+02   0.1997480E+02   0.3057194E+02
rotational constants/cm⁻¹ :        0.1202588E+01   0.8439448E+00   0.5514087E+00

 * 2 selected distances

     #   Z        #   Z                                     value/Å
     1   6 C      4   1 H                                 1.0863622 (max)
     1   6 C      5   1 H                                 1.0863622 (min)

 * 1 distinct bonds (by element types)

   Z      Z             #   av. dist./Å        max./Å        min./Å
   1 H    6 C           2     1.0863622     1.0863622     1.0863622

           -------------------------------------------------
          |               Frequency Printout                |
           -------------------------------------------------
 projected vibrational frequencies (cm-1)
eigval :       -0.00     0.00     0.00     0.00     0.00     0.00
eigval :      811.73   866.07  1025.65  1045.39  1136.35  1398.50
eigval :     1498.78  2989.75  2994.34
 reduced masses (amu)
   1: 13.82   2: 11.02   3: 11.83   4: 13.94   5:  9.99   6: 11.97   7: 13.36   8:  2.62
   9:  4.06  10:  3.58  11: 11.81  12:  3.19  13: 11.43  14:  1.40  15:  2.12
 IR intensities (amu)
   1:  0.16   2:  0.11   3:  0.12   4:  0.17   5:  0.32   6:  0.19   7:  0.58   8:  0.06
   9:  0.39  10:  0.22  11:  0.66  12:  0.28  13:  0.70  14:  0.16  15:  0.22
 Raman intensities (amu)
   1:  0.00   2:  0.00   3:  0.00   4:  0.00   5:  0.00   6:  0.00   7:  0.00   8:  0.00
   9:  0.00  10:  0.00  11:  0.00  12:  0.00  13:  0.00  14:  0.00  15:  0.00
 output can be read by thermo (or use thermo option).
 writing <g98.out> molden fake output.
 recommended (thermochemical) frequency scaling factor: 1.0
           -------------------------------------------------
          |             Thermodynamic Functions             |
           -------------------------------------------------

cs  symmetry found (for desy threshold:  0.10E+00) used in thermo

          ...................................................
          :                      SETUP                      :
          :.................................................:
          :  # frequencies                           9      :
          :  # imaginary freq.                       0      :
          :  linear?                             false      :
          :  only rotor calc.                    false      :
          :  symmetry                               cs      :
          :  rotational number                       1      :
          :  scaling factor                  1.0000000      :
          :  rotor cutoff                   50.0000000 cm⁻¹ :
          :  imag. cutoff                  -20.0000000 cm⁻¹ :
          :.................................................:

    mode    ω/cm⁻¹     T·S(HO)/kcal·mol⁻¹    T·S(FR)/kcal·mol⁻¹   T·S(vib)
   ------------------------------------------------------------------------
   ------------------------------------------------------------------------

   temp. (K)  partition function   enthalpy   heat capacity  entropy
                                   cal/mol     cal/K/mol   cal/K/mol   J/K/mol
 298.15  VIB   1.06                  147.286      2.292      0.604
         ROT  0.707E+04              888.752      2.981     20.595
         INT  0.747E+04             1036.038      5.273     21.198
         TR   0.264E+27             1481.254      4.968     37.118
         TOT                        2517.2924    10.2411    58.3162   243.9948

   temp. (K)  partition function   enthalpy   heat capacity  entropy
                                   cal/mol     cal/K/mol   cal/K/mol   J/K/mol
 120.00  VIB   1.00                    0.243      0.021      0.002
         ROT  0.180E+04              357.707      2.981     17.882
         INT  0.180E+04              357.949      3.002     17.884
         TR   0.673E+26              596.178      4.968     32.599
         TOT                         954.1274     7.9698    50.4825   211.2186

   temp. (K)  partition function   enthalpy   heat capacity  entropy
                                   cal/mol     cal/K/mol   cal/K/mol   J/K/mol
 100.00  VIB   1.00                    0.032      0.004      0.000
         ROT  0.137E+04              298.089      2.981     17.338
         INT  0.137E+04              298.121      2.985     17.338
         TR   0.512E+26              496.815      4.968     31.693
         TOT                         794.9355     7.9529    49.0317   205.1488

   temp. (K)  partition function   enthalpy   heat capacity  entropy
                                   cal/mol     cal/K/mol   cal/K/mol   J/K/mol
  80.00  VIB   1.00                    0.002      0.000     -0.000
         ROT   982.                  238.471      2.981     16.673
         INT   982.                  238.473      2.981     16.673
         TR   0.367E+26              397.452      4.968     30.585
         TOT                         635.9247     7.9493    47.2582   197.7282

   temp. (K)  partition function   enthalpy   heat capacity  entropy
                                   cal/mol     cal/K/mol   cal/K/mol   J/K/mol
  60.00  VIB   1.00                    0.000      0.000     -0.000
         ROT   638.                  178.853      2.981     15.815
         INT   638.                  178.853      2.981     15.815
         TR   0.238E+26              298.089      4.968     29.157
         TOT                         476.9424     7.9490    44.9720   188.1630

   temp. (K)  partition function   enthalpy   heat capacity  entropy
                                   cal/mol     cal/K/mol   cal/K/mol   J/K/mol
  40.00  VIB   1.00                    0.000      0.000     -0.000
         ROT   347.                  119.236      2.981     14.607
         INT   347.                  119.236      2.981     14.607
         TR   0.130E+26              198.726      4.968     27.143
         TOT                         317.9616     7.9490    41.7500   174.6818

   temp. (K)  partition function   enthalpy   heat capacity  entropy
                                   cal/mol     cal/K/mol   cal/K/mol   J/K/mol
  20.00  VIB   1.00                    0.000      0.000     -0.000
         ROT   123.                   59.618      2.981     12.541
         INT   123.                   59.618      2.981     12.541
         TR   0.458E+25               99.363      4.968     23.701
         TOT                         158.9808     7.9490    36.2417   151.6355

   temp. (K)  partition function   enthalpy   heat capacity  entropy
                                   cal/mol     cal/K/mol   cal/K/mol   J/K/mol
  10.00  VIB   1.00                    0.000      0.000     -0.000
         ROT   43.4                   29.809      2.981     10.474
         INT   43.4                   29.809      2.981     10.474
         TR   0.162E+25               49.681      4.968     20.259
         TOT                          79.4904     7.9490    30.7335   128.5892

       T/K    H(0)-H(T)+PV         H(T)/Eh          T*S/Eh         G(T)/Eh
   ------------------------------------------------------------------------
    298.15    0.401156E-02    0.353741E-01    0.277079E-01    0.766619E-02
    120.00    0.152050E-02    0.328830E-01    0.965387E-02    0.232291E-01
    100.00    0.126681E-02    0.326293E-01    0.781371E-02    0.248156E-01
     80.00    0.101341E-02    0.323759E-01    0.602486E-02    0.263511E-01
     60.00    0.760056E-03    0.321226E-01    0.430005E-02    0.278225E-01
     40.00    0.506704E-03    0.318692E-01    0.266131E-02    0.292079E-01
     20.00    0.253352E-03    0.316159E-01    0.115510E-02    0.304608E-01
     10.00    0.126676E-03    0.314892E-01    0.489770E-03    0.309994E-01 (used)
   ------------------------------------------------------------------------

         :::::::::::::::::::::::::::::::::::::::::::::::::::::
         ::                  THERMODYNAMIC                  ::
         :::::::::::::::::::::::::::::::::::::::::::::::::::::
         :: total free energy          -9.077831212715 Eh   ::
         ::.................................................::
         :: total energy               -9.108830633198 Eh   ::
         :: zero point energy           0.031362514720 Eh   ::
         :: G(RRHO) w/o ZPVE           -0.000363094236 Eh   ::
         :: G(RRHO) contrib.            0.030999420484 Eh   ::
         :::::::::::::::::::::::::::::::::::::::::::::::::::::

optimized geometry written to: xtbopt.xyz


           -------------------------------------------------
          | TOTAL ENERGY               -9.108830633198 Eh   |
          | TOTAL ENTHALPY             -9.077341442463 Eh   |
          | TOTAL FREE ENERGY          -9.077831212715 Eh   |
          | GRADIENT NORM               0.000933786866 Eh/α |
          | HOMO-LUMO GAP               5.230356481865 eV   |
           -------------------------------------------------

------------------------------------------------------------------------
 * finished run on 2020/05/12 at 11:45:15.531     
------------------------------------------------------------------------
 total:
 * wall-time:     0 d,  0 h,  0 min,  0.096 sec
 *  cpu-time:     0 d,  0 h,  0 min,  0.096 sec
 * ratio c/w:     0.999 speedup
 SCF:
 * wall-time:     0 d,  0 h,  0 min,  0.004 sec
 *  cpu-time:     0 d,  0 h,  0 min,  0.004 sec
 * ratio c/w:     0.999 speedup
 ANC optimizer:
 * wall-time:     0 d,  0 h,  0 min,  0.017 sec
 *  cpu-time:     0 d,  0 h,  0 min,  0.017 sec
 * ratio c/w:     0.999 speedup
 numerical hessian:
 * wall-time:     0 d,  0 h,  0 min,  0.059 sec
 *  cpu-time:     0 d,  0 h,  0 min,  0.059 sec
 * ratio c/w:     0.999 speedup

