      -----------------------------------------------------------      
     |                   =====================                   |     
     |                           x T B                           |     
     |                   =====================                   |     
     |                         S. Grimme                         |     
     |          Mulliken Center for Theoretical Chemistry        |     
     |                    University of Bonn                     |     
      -----------------------------------------------------------      

   * xtb version 6.2.2 (9d81278992624c895f80dd42a50cac0aa55982e2) compiled by '@Darwin' on 04/03/2020

   xtb is free software: you can redistribute it and/or modify it under
   the terms of the GNU Lesser General Public License as published by
   the Free Software Foundation, either version 3 of the License, or
   (at your option) any later version.
   
   xtb is distributed in the hope that it will be useful,
   but WITHOUT ANY WARRANTY; without even the implied warranty of
   MERCHANTABILITY or FITNESS FOR A PARTICULAR PURPOSE.  See the
   GNU Lesser General Public License for more details.
   
   Cite this work as:
   * S. Grimme, C. Bannwarth, P. Shushkov, J. Chem. Theory Comput., 2017,
     13, 1989-2009. DOI: 10.1021/acs.jctc.7b00118
   * C. Bannwarth, S. Ehlert and S. Grimme., J. Chem. Theory Comput., 2019,
     15, 1652-1671. DOI: 10.1021/acs.jctc.8b01176
   * P. Pracht, E. Caldeweyher, S. Ehlert, S. Grimme, ChemRxiv, 2019, preprint.
     DOI: 10.26434/chemrxiv.8326202.v1
   
   for DFT-D4:
   * E. Caldeweyher, C. Bannwarth and S. Grimme, J. Chem. Phys., 2017,
     147, 034112. DOI: 10.1063/1.4993215
   * E. Caldeweyher, S. Ehlert, A. Hansen, H. Neugebauer, S. Spicher,
     C. Bannwarth and S. Grimme, J. Chem. Phys., 2019, 150, 154122.
     DOI: 10.1063/1.5090222
   
   for sTDA-xTB:
   * S. Grimme and C. Bannwarth, J. Chem. Phys., 2016, 145, 054103.
     DOI: 10.1063/1.4959605
   
   in the mass-spec context:
   * V. Asgeirsson, C. Bauer and S. Grimme, Chem. Sci., 2017, 8, 4879.
     DOI: 10.1039/c7sc00601b
   
   for metadynamics refer to:
   * S. Grimme, J. Chem. Theory Comput., 2019, 155, 2847-2862
     DOI: 10.1021/acs.jctc.9b00143
   
   with help from (in alphabetical order)
   C. Bannwarth, F. Bohle, G. Brandenburg, E. Caldeweyher, M. Checinski,
   S. Dohm, S. Ehlert, S. Ehrlich, F. März, H. Neugebauer, J. Pisarek,
   P. Pracht, P. Shushkov, and S. Spicher.
   
 * started run on 2020/05/12 at 11:45:24.278     

           -------------------------------------------------
          |                Calculation Setup                |
           -------------------------------------------------

          program call               : xtb --input H2C1N2_13_S_2.input H2C1N2_13_S_2.xyz --ohess --molden --namespace H2C1N2_13_S_2 output.out
          calculation namespace      : H2C1N2_13_S_2
          coordinate file            : H2C1N2_13_S_2.xyz
          number of atoms            :                     5
          number of electrons        :                    16
          charge                     :                     0
          spin                       :                   1.0
          first test random number   :      0.30614833479291

   ID    Z sym.   atoms
    1    7 N      1, 3
    2    6 C      2
    3    1 H      4, 5

           -------------------------------------------------
          |                 G F N 2 - x T B                 |
           -------------------------------------------------

        Reference                      10.1021/acs.jctc.8b01176
      * Hamiltonian:
        H0-scaling (s, p, d)           1.850000    2.230000    2.230000
        zeta-weighting                 0.500000
      * Dispersion:
        s8                             2.700000
        a1                             0.520000
        a2                             5.000000
        s9                             5.000000
      * Repulsion:
        kExp                           1.500000    1.000000
        rExp                           1.000000
      * Coulomb:
        alpha                          2.000000
        third order                    shell-resolved
        anisotropic                    true
        a3                             3.000000
        a5                             4.000000
        cn-shift                       1.200000
        cn-exp                         4.000000
        max-rad                        5.000000


          ...................................................
          :                      SETUP                      :
          :.................................................:
          :  # basis functions                  14          :
          :  # atomic orbitals                  14          :
          :  # shells                            8          :
          :  # electrons                        16          :
          :  max. iterations                   250          :
          :  Hamiltonian                  GFN2-xTB          :
          :  restarted?                      false          :
          :  GBSA solvation                  false          :
          :  PC potential                    false          :
          :  electronic temp.          300.0000000     K    :
          :  accuracy                    1.0000000          :
          :  -> integral cutoff          0.2500000E+02      :
          :  -> integral neglect         0.1000000E-07      :
          :  -> SCF convergence          0.1000000E-05 Eh   :
          :  -> wf. convergence          0.1000000E-03 e    :
          :  Broyden damping             0.4000000          :
          ...................................................

 iter      E             dE          RMSdq      gap      omega  full diag
   1     -8.8179807 -0.881798E+01  0.441E+00    5.80       0.0  T
   2     -8.8241752 -0.619446E-02  0.242E+00    6.25       1.0  T
   3     -8.8247368 -0.561633E-03  0.920E-01    6.22       1.0  T
   4     -8.8260250 -0.128821E-02  0.803E-01    6.33       1.0  T
   5     -8.8205207  0.550430E-02  0.244E+00    6.36       1.0  T
   6     -8.8264630 -0.594230E-02  0.261E-01    6.32       1.0  T
   7     -8.8265205 -0.574583E-04  0.120E-01    6.33       1.0  T
   8     -8.8265301 -0.964416E-05  0.669E-02    6.33       1.0  T
   9     -8.8265333 -0.317683E-05  0.305E-02    6.33       1.5  T
  10     -8.8265338 -0.538510E-06  0.188E-02    6.33       2.4  T
  11     -8.8265341 -0.265840E-06  0.868E-03    6.33       5.2  T
  12     -8.8265342 -0.496384E-07  0.482E-03    6.33       9.3  T
  13     -8.8265342 -0.199197E-07  0.147E-03    6.33      30.5  T
  14     -8.8265342 -0.202099E-08  0.149E-04    6.33     300.4  T
  15     -8.8265342 -0.185967E-10  0.512E-05    6.33     872.8  T

   *** convergence criteria satisfied after 15 iterations ***

         #    Occupation            Energy/Eh            Energy/eV
      -------------------------------------------------------------
         1        2.0000           -0.7202073             -19.5978
       ...           ...                  ...                  ...
         3        2.0000           -0.5831077             -15.8672
         4        2.0000           -0.5819102             -15.8346
         5        2.0000           -0.5038784             -13.7112
         6        1.9998           -0.4539978             -12.3539
         7        1.8454           -0.4473381             -12.1727
         8        1.1548           -0.4441113             -12.0849
         9        1.0000           -0.3548000              -9.6546 (HOMO)
        10                         -0.1222545              -3.3267 (LUMO)
        11                          0.0224962               0.6122
        12                          0.0327355               0.8908
        13                          0.1988543               5.4111
        14                          0.2184067               5.9431
      -------------------------------------------------------------
                  HL-Gap            0.2325455 Eh            6.3279 eV
             Fermi-level           -0.3421257 Eh           -9.3097 eV

 transition dipole moment (au) for excitation:           8           9
     X       Y       Z   
   0.0470   0.0348  -1.1169  total (au/Debye):    1.118   2.843
 dE (eV)             :    2.430
 oscillator strength :  0.10533E+00

 SCC (total)                   0 d,  0 h,  0 min,  0.004 sec
 SCC setup                      ...        0 min,  0.000 sec (  2.702%)
 Dispersion                     ...        0 min,  0.000 sec (  0.403%)
 integral evaluation            ...        0 min,  0.001 sec ( 19.739%)
 zeroth order Hamiltonian       ...        0 min,  0.000 sec (  0.433%)
 iterations                     ...        0 min,  0.001 sec ( 35.837%)
 molecular gradient             ...        0 min,  0.001 sec ( 21.406%)
 printout                       ...        0 min,  0.001 sec ( 19.173%)

         :::::::::::::::::::::::::::::::::::::::::::::::::::::
         ::                     SUMMARY                     ::
         :::::::::::::::::::::::::::::::::::::::::::::::::::::
         :: total energy              -8.764186277454 Eh    ::
         :: gradient norm              0.061376589962 Eh/a0 ::
         :: HOMO-LUMO gap              6.327885350666 eV    ::
         ::.................................................::
         :: SCC energy                -8.826534178751 Eh    ::
         :: -> isotropic ES            0.013894315720 Eh    ::
         :: -> anisotropic ES          0.000728684213 Eh    ::
         :: -> anisotropic XC          0.013467019589 Eh    ::
         :: -> dispersion             -0.001344655994 Eh    ::
         :: repulsion energy           0.062347877172 Eh    ::
         :: add. restraining           0.000000000000 Eh    ::
         :::::::::::::::::::::::::::::::::::::::::::::::::::::

      ----------------------------------------------------------- 
     |                   =====================                   |
     |                        A N C O P T                        |
     |                   =====================                   |
     |               Approximate Normal Coordinate               |
     |                Rational Function Optimizer                |
      ----------------------------------------------------------- 

          ...................................................
          :                      SETUP                      :
          :.................................................:
          :   optimization level            normal          :
          :   max. optcycles                   200          :
          :   ANC micro-cycles                  20          :
          :   degrees of freedom                 9          :
          :.................................................:
          :   RF solver                   davidson          :
          :   write xtbopt.log                true          :
          :   linear?                        false          :
          :   energy convergence         0.5000000E-05 Eh   :
          :   grad. convergence          0.1000000E-02 Eh/α :
          :   maximium RF displ.         1.0000000          :
          :   Hlow (freq-cutoff)         0.1000000E-01      :
          :   Hmax (freq-cutoff)         5.0000000          :
          :   S6 in model hess.         20.0000000          :
          ...................................................

generating ANC from model Hessian ...
Using Lindh-Hessian (1995)
 Shifting diagonal of input Hessian by    0.0000000000000000     
 Lowest  eigenvalues of input Hessian
   -0.000000   -0.000000   -0.000000   -0.000000   -0.000000    0.000000
    0.086037    0.097773    0.158362    0.167734    0.399327    0.982438
    1.022114    1.197804    1.759335
 Highest eigenvalues
    0.167734    0.399327    0.982438    1.022114    1.197804    1.759335


........................................................................
.............................. CYCLE    1 ..............................
........................................................................
   1     -8.8265342 -0.882653E+01  0.763E-06    6.33       0.0  T
   2     -8.8265342 -0.159872E-13  0.533E-06    6.33    8395.6  T
   3     -8.8265342 -0.390799E-13  0.639E-07    6.33   69998.5  T
     SCC iter.                  ...        0 min,  0.001 sec
     gradient                   ...        0 min,  0.001 sec
 * total energy  :    -8.7641863 Eh     change        0.9754260E-09 Eh
   gradient norm :     0.0613766 Eh/α   predicted     0.0000000E+00 (-100.00%)
   displ. norm   :     0.1417607 α      lambda       -0.5324570E-02
   maximum displ.:     0.1308513 α      in ANC's #3, #5, #9, ...

........................................................................
.............................. CYCLE    2 ..............................
........................................................................
   1     -8.8377632 -0.883776E+01  0.457E-01    6.54       0.0  T
   2     -8.8377824 -0.191388E-04  0.355E-01    6.52       1.0  T
   3     -8.8379191 -0.136786E-03  0.106E-01    6.53       1.0  T
   4     -8.8379182  0.917414E-06  0.367E-02    6.53       1.2  T
   5     -8.8379197 -0.143282E-05  0.115E-02    6.53       3.9  T
   6     -8.8379197 -0.156086E-08  0.113E-02    6.53       4.0  T
   7     -8.8379198 -0.134710E-06  0.895E-04    6.53      50.0  T
   8     -8.8379198 -0.423547E-09  0.468E-04    6.53      95.6  T
     SCC iter.                  ...        0 min,  0.001 sec
     gradient                   ...        0 min,  0.001 sec
 * total energy  :    -8.7683016 Eh     change       -0.4115353E-02 Eh
   gradient norm :     0.0348183 Eh/α   predicted    -0.2715786E-02 ( -34.01%)
   displ. norm   :     0.1825842 α      lambda       -0.3722079E-02
   maximum displ.:     0.1756501 α      in ANC's #3, #9, #5, ...

........................................................................
.............................. CYCLE    3 ..............................
........................................................................
   1     -8.8451200 -0.884512E+01  0.547E-01    6.79       0.0  T
   2     -8.8450884  0.315936E-04  0.483E-01    6.76       1.0  T
   3     -8.8453505 -0.262060E-03  0.138E-01    6.77       1.0  T
   4     -8.8453464  0.404682E-05  0.644E-02    6.77       1.0  T
   5     -8.8453508 -0.443090E-05  0.177E-02    6.77       2.5  T
   6     -8.8453512 -0.353030E-06  0.123E-03    6.77      36.4  T
   7     -8.8453512  0.342029E-08  0.253E-03    6.77      17.7  T
   8     -8.8453512 -0.557074E-08  0.915E-04    6.77      48.9  T
   9     -8.8453512 -0.836923E-09  0.993E-05    6.77     450.3  T
     SCC iter.                  ...        0 min,  0.001 sec
     gradient                   ...        0 min,  0.001 sec
 * total energy  :    -8.7701875 Eh     change       -0.1885857E-02 Eh
   gradient norm :     0.0041954 Eh/α   predicted    -0.1923078E-02 (   1.97%)
   displ. norm   :     0.0063805 α      lambda       -0.2035283E-04
   maximum displ.:     0.0043977 α      in ANC's #3, #7, #5, ...

........................................................................
.............................. CYCLE    4 ..............................
........................................................................
   1     -8.8446569 -0.884466E+01  0.108E-01    6.76       0.0  T
   2     -8.8446534  0.348207E-05  0.102E-01    6.76       1.0  T
   3     -8.8446669 -0.135328E-04  0.207E-02    6.76       2.2  T
   4     -8.8446672 -0.241743E-06  0.349E-03    6.76      12.8  T
   5     -8.8446672 -0.119478E-07  0.144E-03    6.76      31.1  T
   6     -8.8446672 -0.134766E-08  0.520E-04    6.76      86.0  T
   7     -8.8446672 -0.127457E-09  0.238E-04    6.76     187.6  T
     SCC iter.                  ...        0 min,  0.000 sec
     gradient                   ...        0 min,  0.001 sec
 * total energy  :    -8.7702016 Eh     change       -0.1415046E-04 Eh
   gradient norm :     0.0022699 Eh/α   predicted    -0.1017643E-04 ( -28.08%)
   displ. norm   :     0.0053619 α      lambda       -0.1047755E-04
   maximum displ.:     0.0044841 α      in ANC's #7, #3, #1, ...

........................................................................
.............................. CYCLE    5 ..............................
........................................................................
   1     -8.8442695 -0.884427E+01  0.202E-01    6.75       0.0  T
   2     -8.8442626  0.693324E-05  0.189E-01    6.75       1.0  T
   3     -8.8443083 -0.456856E-04  0.321E-02    6.75       1.4  T
   4     -8.8443089 -0.694582E-06  0.582E-03    6.75       7.7  T
   5     -8.8443090 -0.385604E-07  0.386E-03    6.75      11.6  T
   6     -8.8443090 -0.112527E-07  0.133E-03    6.75      33.7  T
   7     -8.8443090 -0.165427E-08  0.486E-04    6.75      92.1  T
   8     -8.8443090 -0.398266E-09  0.171E-04    6.75     262.3  T
     SCC iter.                  ...        0 min,  0.001 sec
     gradient                   ...        0 min,  0.001 sec
 * total energy  :    -8.7702090 Eh     change       -0.7383574E-05 Eh
   gradient norm :     0.0015681 Eh/α   predicted    -0.5239463E-05 ( -29.04%)
   displ. norm   :     0.0090441 α      lambda       -0.7882965E-05
   maximum displ.:     0.0078568 α      in ANC's #7, #5, #3, ...

........................................................................
.............................. CYCLE    6 ..............................
........................................................................
   1     -8.8441022 -0.884410E+01  0.363E-01    6.75       0.0  T
   2     -8.8441279 -0.257260E-04  0.274E-01    6.76       1.0  T
   3     -8.8442244 -0.964569E-04  0.652E-02    6.75       1.0  T
   4     -8.8442276 -0.321216E-05  0.107E-02    6.76       4.2  T
   5     -8.8442276 -0.446910E-07  0.101E-02    6.76       4.4  T
   6     -8.8442277 -0.769822E-07  0.415E-03    6.76      10.8  T
   7     -8.8442277 -0.191284E-07  0.102E-03    6.76      43.9  T
   8     -8.8442277 -0.931495E-09  0.169E-04    6.76     264.5  T
   9     -8.8442277 -0.454747E-10  0.752E-05    6.76     594.4  T
     SCC iter.                  ...        0 min,  0.001 sec
     gradient                   ...        0 min,  0.001 sec
 * total energy  :    -8.7702156 Eh     change       -0.6590883E-05 Eh
   gradient norm :     0.0013331 Eh/α   predicted    -0.3940151E-05 ( -40.22%)
   displ. norm   :     0.0068261 α      lambda       -0.3266543E-05
   maximum displ.:     0.0053370 α      in ANC's #1, #5, #7, ...

........................................................................
.............................. CYCLE    7 ..............................
........................................................................
   1     -8.8445467 -0.884455E+01  0.166E-01    6.76       0.0  T
   2     -8.8445602 -0.135658E-04  0.106E-01    6.77       1.0  T
   3     -8.8445739 -0.136231E-04  0.243E-02    6.76       1.8  T
   4     -8.8445744 -0.510823E-06  0.763E-03    6.76       5.9  T
   5     -8.8445744 -0.123057E-07  0.308E-03    6.76      14.5  T
   6     -8.8445744 -0.654852E-08  0.107E-03    6.76      42.0  T
   7     -8.8445744 -0.127235E-08  0.278E-04    6.76     160.6  T
   8     -8.8445744 -0.671783E-10  0.570E-05    6.76     785.0  T
     SCC iter.                  ...        0 min,  0.001 sec
     gradient                   ...        0 min,  0.001 sec
 * total energy  :    -8.7702201 Eh     change       -0.4516544E-05 Eh
   gradient norm :     0.0008353 Eh/α   predicted    -0.1632397E-05 ( -63.86%)
   displ. norm   :     0.3903250 α      lambda       -0.1667045E-03
   maximum displ.:     0.3290268 α      in ANC's #1, #5, #7, ...

   *** GEOMETRY OPTIMIZATION CONVERGED AFTER 7 ITERATIONS ***

------------------------------------------------------------------------
 total energy gain   :        -0.0060338 Eh       -3.7863 kcal/mol
 total RMSD          :         0.1481809 a0        0.0784 Å
 total power (kW/mol):        -2.2631243 (step) -964.4336 (real)
------------------------------------------------------------------------

 ANCopt (total)                0 d,  0 h,  0 min,  0.016 sec
 optimizer setup                ...        0 min,  0.000 sec (  0.487%)
 model hessian                  ...        0 min,  0.000 sec (  0.627%)
 ANC generation                 ...        0 min,  0.000 sec (  0.396%)
 coordinate transformation      ...        0 min,  0.000 sec (  0.109%)
 single point calculation       ...        0 min,  0.016 sec ( 94.428%)
 optimization log               ...        0 min,  0.000 sec (  1.021%)
 hessian update                 ...        0 min,  0.000 sec (  0.100%)
 rational function              ...        0 min,  0.000 sec (  1.095%)

================
 final structure:
================
5
 xtb: 6.2.2 (9d81278992624c895f80dd42a50cac0aa55982e2)
N         0.93689419764030   -0.03203492093925    0.74718922008434
C        -0.22354815207014    0.00288082461023   -0.00931612666724
N         0.99631557089166    0.00711477503127   -0.66662979692877
H        -0.86515981185597   -0.88774116226282   -0.06579099275893
H        -0.84450080460585    0.90978048356056   -0.00545230372940

 Bond Distances (Angstroems)
 ---------------------------
N1-C2=1.3857         N1-N3=1.4156         C2-N1=1.3857         C2-N3=1.3857         C2-H4=1.0991         C2-H5=1.0991         
N3-N1=1.4156         N3-C2=1.3857         H4-C2=1.0991         H5-C2=1.0991         
 C  H  Rav=1.0991 sigma=0.0000  Rmin=1.0991  Rmax=1.0991     2
 N  C  Rav=1.3857 sigma=0.0000  Rmin=1.3857  Rmax=1.3857     2
 N  N  Rav=1.4156 sigma=0.0000  Rmin=1.4156  Rmax=1.4156     1

 selected bond angles (degree)
 --------------------
N3-N1-C2= 59.28                N3-C2-N1= 61.43                H4-C2-N1=119.77                H4-C2-N3=119.47                
H5-C2-N1=119.47                H5-C2-N3=119.77                H5-C2-H4=109.81                C2-N3-N1= 59.28                

 selected dihedral angles (degree)
 ---------------------------------
H4-C2-N1-N3=109.51            H5-C2-N1-N3=250.02            N1-N3-C2-H4=250.02            N1-N3-C2-H5=109.51            
           -------------------------------------------------
          |                Final Singlepoint                |
           -------------------------------------------------

          ...................................................
          :                      SETUP                      :
          :.................................................:
          :  # basis functions                  14          :
          :  # atomic orbitals                  14          :
          :  # shells                            8          :
          :  # electrons                        16          :
          :  max. iterations                   250          :
          :  Hamiltonian                  GFN2-xTB          :
          :  restarted?                      false          :
          :  GBSA solvation                  false          :
          :  PC potential                    false          :
          :  electronic temp.          300.0000000     K    :
          :  accuracy                    1.0000000          :
          :  -> integral cutoff          0.2500000E+02      :
          :  -> integral neglect         0.1000000E-07      :
          :  -> SCF convergence          0.1000000E-05 Eh   :
          :  -> wf. convergence          0.1000000E-03 e    :
          :  Broyden damping             0.4000000          :
          ...................................................

 iter      E             dE          RMSdq      gap      omega  full diag
   1     -8.8445744 -0.884457E+01  0.792E-05    6.76       0.0  T
   2     -8.8445744 -0.161293E-11  0.434E-05    6.76    1030.7  T
   3     -8.8445744 -0.725286E-11  0.204E-05    6.76    2189.8  T

   *** convergence criteria satisfied after 3 iterations ***

         #    Occupation            Energy/Eh            Energy/eV
      -------------------------------------------------------------
         1        2.0000           -0.7274953             -19.7962
       ...           ...                  ...                  ...
         3        2.0000           -0.5863686             -15.9559
         4        2.0000           -0.5821154             -15.8402
         5        2.0000           -0.5116096             -13.9216
         6        1.9997           -0.4510000             -12.2723
         7        1.8348           -0.4447605             -12.1026
         8        1.1655           -0.4416840             -12.0188
         9        1.0000           -0.3475888              -9.4584 (HOMO)
        10                         -0.0990134              -2.6943 (LUMO)
        11                          0.0636853               1.7330
        12                          0.0806681               2.1951
        13                          0.1774769               4.8294
        14                          0.3004276               8.1751
      -------------------------------------------------------------
                  HL-Gap            0.2485754 Eh            6.7641 eV
             Fermi-level           -0.3332612 Eh           -9.0685 eV

 transition dipole moment (au) for excitation:           8           9
     X       Y       Z   
  -0.0444  -0.0370   1.0552  total (au/Debye):    1.057   2.686
 dE (eV)             :    2.560
 oscillator strength :  0.99068E-01

 SCC (total)                   0 d,  0 h,  0 min,  0.003 sec
 SCC setup                      ...        0 min,  0.000 sec (  2.117%)
 Dispersion                     ...        0 min,  0.000 sec (  0.393%)
 integral evaluation            ...        0 min,  0.001 sec ( 27.247%)
 zeroth order Hamiltonian       ...        0 min,  0.000 sec (  0.393%)
 iterations                     ...        0 min,  0.001 sec ( 18.404%)
 molecular gradient             ...        0 min,  0.001 sec ( 27.315%)
 printout                       ...        0 min,  0.001 sec ( 23.696%)

         :::::::::::::::::::::::::::::::::::::::::::::::::::::
         ::                     SUMMARY                     ::
         :::::::::::::::::::::::::::::::::::::::::::::::::::::
         :: total energy              -8.770220128543 Eh    ::
         :: gradient norm              0.000836103151 Eh/a0 ::
         :: HOMO-LUMO gap              6.764082122077 eV    ::
         ::.................................................::
         :: SCC energy                -8.844574395432 Eh    ::
         :: -> isotropic ES            0.014088971503 Eh    ::
         :: -> anisotropic ES          0.002287947165 Eh    ::
         :: -> anisotropic XC          0.012816983144 Eh    ::
         :: -> dispersion             -0.001352250255 Eh    ::
         :: repulsion energy           0.074354244314 Eh    ::
         :: add. restraining           0.000000000000 Eh    ::
         :::::::::::::::::::::::::::::::::::::::::::::::::::::

           ------------------------------------------------- 
          |                Numerical Hessian                |
           ------------------------------------------------- 
step length          :   0.00500
SCC accuracy         :   0.30000
Hessian scale factor :   1.00000
frozen atoms in %    :   0.00000    0
RMS gradient         :   0.00084
estimated CPU  time      0.00 min
estimated wall time      0.00 min

writing file <hessian>.

 projected vibrational frequencies (cm-1)
eigval :       -0.00    -0.00    -0.00    -0.00     0.00     0.00
eigval :    -1027.78   548.94   794.74   948.10   981.79  1272.56
eigval :     1474.34  2786.63  2852.71
           -------------------------------------------------
          |                Property Printout                |
           -------------------------------------------------

    * Orbital Energies and Occupations

         #    Occupation            Energy/Eh            Energy/eV
      -------------------------------------------------------------
         1        2.0000           -0.7274954             -19.7962
         2        2.0000           -0.6263400             -17.0436
         3        2.0000           -0.5863686             -15.9559
         4        2.0000           -0.5821154             -15.8402
         5        2.0000           -0.5116096             -13.9216
         6        1.9997           -0.4510001             -12.2723
         7        1.8348           -0.4447606             -12.1026
         8        1.1655           -0.4416841             -12.0188
         9        1.0000           -0.3475888              -9.4584 (HOMO)
        10                         -0.0990134              -2.6943 (LUMO)
        11                          0.0636853               1.7330
        12                          0.0806681               2.1951
        13                          0.1774769               4.8294
        14                          0.3004276               8.1751
      -------------------------------------------------------------
                  HL-Gap            0.2485755 Eh            6.7641 eV
             Fermi-level           -0.3332612 Eh           -9.0685 eV

     #   Z        covCN         q      C6AA      α(0)
     1   7 N      1.887    -0.166    25.389     7.470
     2   6 C      3.666     0.109    19.039     6.258
     3   7 N      1.887    -0.166    25.389     7.470
     4   1 H      0.923     0.111     1.684     2.030
     5   1 H      0.923     0.111     1.684     2.030

 Mol. C6AA /au·bohr⁶  :        289.762681
 Mol. C8AA /au·bohr⁸  :       6363.324249
 Mol. α(0) /au        :         25.255933


Wiberg/Mayer (AO) data.
largest (>0.10) Wiberg bond orders for each atom
          total WBO             WBO to atom ...
     1  N   2.080        C    2 1.057    N    3 1.012
     2  C   3.790        N    1 1.057    N    3 1.057    H    4 0.838    H    5 0.838
     3  N   2.080        C    2 1.057    N    1 1.012
     4  H   0.856        C    2 0.838
     5  H   0.856        C    2 0.838

MOs/occ written to file <molden.input>


molecular dipole:
                 x           y           z       tot (Debye)
 q only:       -1.012       0.013      -0.042
   full:       -1.413       0.018      -0.059       3.595
molecular quadrupole (traceless):
                xx          xy          yy          xz          yz          zz
 q only:       -0.532       0.020       1.192       0.006       0.057      -0.660
  q+dip:       -0.923       0.047       3.179       0.057       0.145      -2.256
   full:       -1.137       0.052       3.348       0.047       0.142      -2.212

           -------------------------------------------------
          |                Geometry Summary                 |
           -------------------------------------------------

      molecular mass/u    :       42.0400238
   center of mass at/Å    :        0.5392405      -0.0069541       0.0224688
  moments of inertia/u·Å² :        0.1566477E+02   0.1768337E+02   0.3008740E+02
rotational constants/cm⁻¹ :        0.1076149E+01   0.9533045E+00   0.5602887E+00

 * 4 selected distances

     #   Z        #   Z                                     value/Å
     1   7 N      2   6 C                                 1.3856933
     2   6 C      3   7 N                                 1.3856936 (max)
     2   6 C      4   1 H                                 1.0991189 (min)
     2   6 C      5   1 H                                 1.0991197

 * 2 distinct bonds (by element types)

   Z      Z             #   av. dist./Å        max./Å        min./Å
   1 H    6 C           2     1.0991193     1.0991197     1.0991189
   6 C    7 N           2     1.3856934     1.3856936     1.3856933

           -------------------------------------------------
          |               Frequency Printout                |
           -------------------------------------------------
 projected vibrational frequencies (cm-1)
eigval :       -0.00    -0.00    -0.00    -0.00     0.00     0.00
eigval :    -1027.78   548.94   794.74   948.10   981.79  1272.56
eigval :     1474.34  2786.63  2852.71
 reduced masses (amu)
   1: 10.11   2: 12.07   3: 12.82   4: 12.44   5: 13.12   6: 11.52   7:  2.36   8: 13.40
   9:  4.14  10:  5.62  11: 10.75  12:  1.45  13: 12.95  14:  1.95  15:  1.43
 IR intensities (amu)
   1:  0.31   2:  0.13   3:  0.21   4:  0.09   5:  0.20   6:  0.19   7:  0.02   8:  2.14
   9:  0.02  10:  0.72  11:  0.98  12:  0.24  13:  0.08  14:  0.06  15:  0.14
 Raman intensities (amu)
   1:  0.00   2:  0.00   3:  0.00   4:  0.00   5:  0.00   6:  0.00   7:  0.00   8:  0.00
   9:  0.00  10:  0.00  11:  0.00  12:  0.00  13:  0.00  14:  0.00  15:  0.00
 output can be read by thermo (or use thermo option).
 writing <g98.out> molden fake output.
 recommended (thermochemical) frequency scaling factor: 1.0
           -------------------------------------------------
          |             Thermodynamic Functions             |
Molecule has the following symmetry elements: (C2) 2*(sigma) 
It seems to be the C2v point group
           -------------------------------------------------

c2v symmetry found (for desy threshold:  0.10E+00) used in thermo

          ...................................................
          :                      SETUP                      :
          :.................................................:
          :  # frequencies                           8      :
          :  # imaginary freq.                       1      :
          :  linear?                             false      :
          :  only rotor calc.                    false      :
          :  symmetry                              c2v      :
          :  rotational number                       2      :
          :  scaling factor                  1.0000000      :
          :  rotor cutoff                   50.0000000 cm⁻¹ :
          :  imag. cutoff                  -20.0000000 cm⁻¹ :
          :.................................................:

    mode    ω/cm⁻¹     T·S(HO)/kcal·mol⁻¹    T·S(FR)/kcal·mol⁻¹   T·S(vib)
   ------------------------------------------------------------------------
   ------------------------------------------------------------------------

   temp. (K)  partition function   enthalpy   heat capacity  entropy
                                   cal/mol     cal/K/mol   cal/K/mol   J/K/mol
 298.15  VIB   1.12                  233.935      2.882      1.018
         ROT  0.349E+04              888.752      2.981     19.191
         INT  0.392E+04             1122.688      5.862     20.208
         TR   0.264E+27             1481.254      4.968     37.118
         TOT                        2603.9416    10.8306    57.3265   239.8541

   temp. (K)  partition function   enthalpy   heat capacity  entropy
                                   cal/mol     cal/K/mol   cal/K/mol   J/K/mol
 120.00  VIB   1.00                    2.397      0.138      0.023
         ROT   890.                  357.707      2.981     16.478
         INT   892.                  360.104      3.119     16.501
         TR   0.673E+26              596.178      4.968     32.599
         TOT                         956.2818     8.0870    49.0994   205.4318

   temp. (K)  partition function   enthalpy   heat capacity  entropy
                                   cal/mol     cal/K/mol   cal/K/mol   J/K/mol
 100.00  VIB   1.00                    0.613      0.050      0.007
         ROT   677.                  298.089      2.981     15.934
         INT   678.                  298.702      3.031     15.941
         TR   0.512E+26              496.815      4.968     31.693
         TOT                         795.5172     7.9987    47.6345   199.3028

   temp. (K)  partition function   enthalpy   heat capacity  entropy
                                   cal/mol     cal/K/mol   cal/K/mol   J/K/mol
  80.00  VIB   1.00                    0.083      0.010      0.001
         ROT   485.                  238.471      2.981     15.269
         INT   485.                  238.554      2.991     15.270
         TR   0.367E+26              397.452      4.968     30.585
         TOT                         636.0057     7.9593    45.8555   191.8594

   temp. (K)  partition function   enthalpy   heat capacity  entropy
                                   cal/mol     cal/K/mol   cal/K/mol   J/K/mol
  60.00  VIB   1.00                    0.003      0.001     -0.000
         ROT   315.                  178.853      2.981     14.411
         INT   315.                  178.856      2.982     14.411
         TR   0.238E+26              298.089      4.968     29.157
         TOT                         476.9454     7.9497    43.5683   182.2897

   temp. (K)  partition function   enthalpy   heat capacity  entropy
                                   cal/mol     cal/K/mol   cal/K/mol   J/K/mol
  40.00  VIB   1.00                    0.000      0.000     -0.000
         ROT   171.                  119.236      2.981     13.203
         INT   171.                  119.236      2.981     13.203
         TR   0.130E+26              198.726      4.968     27.143
         TOT                         317.9616     7.9490    40.3461   168.8081

   temp. (K)  partition function   enthalpy   heat capacity  entropy
                                   cal/mol     cal/K/mol   cal/K/mol   J/K/mol
  20.00  VIB   1.00                    0.000      0.000     -0.000
         ROT   60.6                   59.618      2.981     11.137
         INT   60.6                   59.618      2.981     11.136
         TR   0.458E+25               99.363      4.968     23.701
         TOT                         158.9808     7.9490    34.8379   145.7616

   temp. (K)  partition function   enthalpy   heat capacity  entropy
                                   cal/mol     cal/K/mol   cal/K/mol   J/K/mol
  10.00  VIB   1.00                    0.000      0.000     -0.000
         ROT   21.4                   29.809      2.981      9.070
         INT   21.4                   29.809      2.981      9.070
         TR   0.162E+25               49.681      4.968     20.259
         TOT                          79.4904     7.9490    29.3296   122.7151

       T/K    H(0)-H(T)+PV         H(T)/Eh          T*S/Eh         G(T)/Eh
   ------------------------------------------------------------------------
    298.15    0.414965E-02    0.307126E-01    0.272377E-01    0.347495E-02
    120.00    0.152393E-02    0.280869E-01    0.938938E-02    0.186975E-01
    100.00    0.126774E-02    0.278307E-01    0.759104E-02    0.202397E-01
     80.00    0.101354E-02    0.275765E-01    0.584603E-02    0.217305E-01
     60.00    0.760061E-03    0.273230E-01    0.416583E-02    0.231572E-01
     40.00    0.506704E-03    0.270697E-01    0.257182E-02    0.244979E-01
     20.00    0.253352E-03    0.268163E-01    0.111035E-02    0.257060E-01
     10.00    0.126676E-03    0.266897E-01    0.467397E-03    0.262223E-01 (used)
   ------------------------------------------------------------------------

         :::::::::::::::::::::::::::::::::::::::::::::::::::::
         ::                  THERMODYNAMIC                  ::
         :::::::::::::::::::::::::::::::::::::::::::::::::::::
         :: total free energy          -8.743997872232 Eh   ::
         ::.................................................::
         :: total energy               -8.770220128590 Eh   ::
         :: zero point energy           0.026562977633 Eh   ::
         :: G(RRHO) w/o ZPVE           -0.000340721275 Eh   ::
         :: G(RRHO) contrib.            0.026222256358 Eh   ::
         :::::::::::::::::::::::::::::::::::::::::::::::::::::
imag cut-off (cm-1) :    5.00
 found            1  significant imaginary frequency
 writing imag mode distorted coords to xtbhess.xyz
 for further optimization.

optimized geometry written to: xtbopt.xyz


           -------------------------------------------------
          | TOTAL ENERGY               -8.770220128590 Eh   |
          | TOTAL ENTHALPY             -8.743530474941 Eh   |
          | TOTAL FREE ENERGY          -8.743997872232 Eh   |
          | GRADIENT NORM               0.000836189015 Eh/α |
          | HOMO-LUMO GAP               6.764082309565 eV   |
           -------------------------------------------------

------------------------------------------------------------------------
 * finished run on 2020/05/12 at 11:45:24.386     
------------------------------------------------------------------------
 total:
 * wall-time:     0 d,  0 h,  0 min,  0.106 sec
 *  cpu-time:     0 d,  0 h,  0 min,  0.106 sec
 * ratio c/w:     0.999 speedup
 SCF:
 * wall-time:     0 d,  0 h,  0 min,  0.004 sec
 *  cpu-time:     0 d,  0 h,  0 min,  0.004 sec
 * ratio c/w:     0.999 speedup
 ANC optimizer:
 * wall-time:     0 d,  0 h,  0 min,  0.020 sec
 *  cpu-time:     0 d,  0 h,  0 min,  0.020 sec
 * ratio c/w:     0.999 speedup
 numerical hessian:
 * wall-time:     0 d,  0 h,  0 min,  0.062 sec
 *  cpu-time:     0 d,  0 h,  0 min,  0.062 sec
 * ratio c/w:     0.999 speedup

