      -----------------------------------------------------------      
     |                   =====================                   |     
     |                           x T B                           |     
     |                   =====================                   |     
     |                         S. Grimme                         |     
     |          Mulliken Center for Theoretical Chemistry        |     
     |                    University of Bonn                     |     
      -----------------------------------------------------------      

   * xtb version 6.2.2 (9d81278992624c895f80dd42a50cac0aa55982e2) compiled by '@Darwin' on 04/03/2020

   xtb is free software: you can redistribute it and/or modify it under
   the terms of the GNU Lesser General Public License as published by
   the Free Software Foundation, either version 3 of the License, or
   (at your option) any later version.
   
   xtb is distributed in the hope that it will be useful,
   but WITHOUT ANY WARRANTY; without even the implied warranty of
   MERCHANTABILITY or FITNESS FOR A PARTICULAR PURPOSE.  See the
   GNU Lesser General Public License for more details.
   
   Cite this work as:
   * S. Grimme, C. Bannwarth, P. Shushkov, J. Chem. Theory Comput., 2017,
     13, 1989-2009. DOI: 10.1021/acs.jctc.7b00118
   * C. Bannwarth, S. Ehlert and S. Grimme., J. Chem. Theory Comput., 2019,
     15, 1652-1671. DOI: 10.1021/acs.jctc.8b01176
   * P. Pracht, E. Caldeweyher, S. Ehlert, S. Grimme, ChemRxiv, 2019, preprint.
     DOI: 10.26434/chemrxiv.8326202.v1
   
   for DFT-D4:
   * E. Caldeweyher, C. Bannwarth and S. Grimme, J. Chem. Phys., 2017,
     147, 034112. DOI: 10.1063/1.4993215
   * E. Caldeweyher, S. Ehlert, A. Hansen, H. Neugebauer, S. Spicher,
     C. Bannwarth and S. Grimme, J. Chem. Phys., 2019, 150, 154122.
     DOI: 10.1063/1.5090222
   
   for sTDA-xTB:
   * S. Grimme and C. Bannwarth, J. Chem. Phys., 2016, 145, 054103.
     DOI: 10.1063/1.4959605
   
   in the mass-spec context:
   * V. Asgeirsson, C. Bauer and S. Grimme, Chem. Sci., 2017, 8, 4879.
     DOI: 10.1039/c7sc00601b
   
   for metadynamics refer to:
   * S. Grimme, J. Chem. Theory Comput., 2019, 155, 2847-2862
     DOI: 10.1021/acs.jctc.9b00143
   
   with help from (in alphabetical order)
   C. Bannwarth, F. Bohle, G. Brandenburg, E. Caldeweyher, M. Checinski,
   S. Dohm, S. Ehlert, S. Ehrlich, F. März, H. Neugebauer, J. Pisarek,
   P. Pracht, P. Shushkov, and S. Spicher.
   
 * started run on 2020/05/12 at 11:44:00.410     

           -------------------------------------------------
          |                Calculation Setup                |
           -------------------------------------------------

          program call               : xtb --input C4N1_7_S_3.input C4N1_7_S_3.xyz --ohess --molden --namespace C4N1_7_S_3 output.out
          calculation namespace      : C4N1_7_S_3
          coordinate file            : C4N1_7_S_3.xyz
          number of atoms            :                     5
          number of electrons        :                    21
          charge                     :                     0
          spin                       :                   1.5
          first test random number   :      0.23951016091125

   ID    Z sym.   atoms
    1    6 C      1, 3-5
    2    7 N      2

           -------------------------------------------------
          |                 G F N 2 - x T B                 |
           -------------------------------------------------

        Reference                      10.1021/acs.jctc.8b01176
      * Hamiltonian:
        H0-scaling (s, p, d)           1.850000    2.230000    2.230000
        zeta-weighting                 0.500000
      * Dispersion:
        s8                             2.700000
        a1                             0.520000
        a2                             5.000000
        s9                             5.000000
      * Repulsion:
        kExp                           1.500000    1.000000
        rExp                           1.000000
      * Coulomb:
        alpha                          2.000000
        third order                    shell-resolved
        anisotropic                    true
        a3                             3.000000
        a5                             4.000000
        cn-shift                       1.200000
        cn-exp                         4.000000
        max-rad                        5.000000


          ...................................................
          :                      SETUP                      :
          :.................................................:
          :  # basis functions                  20          :
          :  # atomic orbitals                  20          :
          :  # shells                           10          :
          :  # electrons                        21          :
          :  max. iterations                   250          :
          :  Hamiltonian                  GFN2-xTB          :
          :  restarted?                      false          :
          :  GBSA solvation                  false          :
          :  PC potential                    false          :
          :  electronic temp.          300.0000000     K    :
          :  accuracy                    1.0000000          :
          :  -> integral cutoff          0.2500000E+02      :
          :  -> integral neglect         0.1000000E-07      :
          :  -> SCF convergence          0.1000000E-05 Eh   :
          :  -> wf. convergence          0.1000000E-03 e    :
          :  Broyden damping             0.4000000          :
          ...................................................

 iter      E             dE          RMSdq      gap      omega  full diag
   1    -10.8072939 -0.108073E+02  0.102E+01    0.10       0.0  T
   2    -10.7678217  0.394722E-01  0.837E+00    0.78       1.0  T
   3    -10.8617419 -0.939202E-01  0.464E+00    0.21       1.0  T
   4    -10.8321881  0.295538E-01  0.300E+00    0.46       1.0  T
   5    -10.8837028 -0.515147E-01  0.116E+00    0.35       1.0  T
   6    -10.8836499  0.528965E-04  0.116E+00    0.38       1.0  T
   7    -10.8677185  0.159313E-01  0.162E+00    0.38       1.0  T
   8    -10.8890190 -0.213005E-01  0.611E-01    0.35       1.0  T
   9    -10.8914989 -0.247996E-02  0.236E-01    0.37       1.0  T
  10    -10.8916672 -0.168251E-03  0.180E-01    0.37       1.0  T
  11    -10.8917621 -0.949579E-04  0.143E-01    0.37       1.0  T
  12    -10.8919119 -0.149702E-03  0.205E-02    0.38       2.2  T
  13    -10.8919142 -0.236710E-05  0.123E-02    0.38       3.6  T
  14    -10.8919148 -0.575763E-06  0.380E-03    0.38      11.8  T
  15    -10.8919149 -0.823974E-07  0.150E-03    0.38      29.8  T
  16    -10.8919149 -0.141970E-07  0.575E-04    0.38      77.8  T
  17    -10.8919149 -0.181130E-08  0.135E-04    0.38     331.5  T

   *** convergence criteria satisfied after 17 iterations ***

         #    Occupation            Energy/Eh            Energy/eV
      -------------------------------------------------------------
         1        2.0000           -0.7084466             -19.2778
       ...           ...                  ...                  ...
         6        2.0000           -0.5364079             -14.5964
         7        2.0000           -0.5205619             -14.1652
         8        2.0000           -0.5138196             -13.9817
         9        1.6006           -0.4582004             -12.4683
        10        1.3980           -0.4574197             -12.4470
        11        1.0013           -0.4515204             -12.2865
        12        0.9994           -0.3980270             -10.8309 (HOMO)
        13        0.0006           -0.3840071             -10.4494 (LUMO)
        14                         -0.3753464             -10.2137
        15                         -0.3329237              -9.0593
        16                         -0.3183699              -8.6633
        17                          0.0156650               0.4263
       ...                                ...                  ...
        20                          0.0727665               1.9801
      -------------------------------------------------------------
                  HL-Gap            0.0140199 Eh            0.3815 eV
             Fermi-level           -0.4244149 Eh          -11.5489 eV

 SCC (total)                   0 d,  0 h,  0 min,  0.005 sec
 SCC setup                      ...        0 min,  0.000 sec (  2.579%)
 Dispersion                     ...        0 min,  0.000 sec (  0.551%)
 integral evaluation            ...        0 min,  0.002 sec ( 32.114%)
 zeroth order Hamiltonian       ...        0 min,  0.000 sec (  0.478%)
 iterations                     ...        0 min,  0.002 sec ( 38.612%)
 molecular gradient             ...        0 min,  0.001 sec ( 23.747%)
 printout                       ...        0 min,  0.000 sec (  1.704%)

         :::::::::::::::::::::::::::::::::::::::::::::::::::::
         ::                     SUMMARY                     ::
         :::::::::::::::::::::::::::::::::::::::::::::::::::::
         :: total energy             -10.840468100722 Eh    ::
         :: gradient norm              0.356146677134 Eh/a0 ::
         :: HOMO-LUMO gap              0.381501555272 eV    ::
         ::.................................................::
         :: SCC energy               -10.891914892648 Eh    ::
         :: -> isotropic ES           -0.027200360764 Eh    ::
         :: -> anisotropic ES         -0.000350820122 Eh    ::
         :: -> anisotropic XC          0.010378320626 Eh    ::
         :: -> dispersion             -0.002879717441 Eh    ::
         :: repulsion energy           0.051447049648 Eh    ::
         :: add. restraining           0.000000000000 Eh    ::
         :::::::::::::::::::::::::::::::::::::::::::::::::::::

      ----------------------------------------------------------- 
     |                   =====================                   |
     |                        A N C O P T                        |
     |                   =====================                   |
     |               Approximate Normal Coordinate               |
     |                Rational Function Optimizer                |
      ----------------------------------------------------------- 

          ...................................................
          :                      SETUP                      :
          :.................................................:
          :   optimization level            normal          :
          :   max. optcycles                   200          :
          :   ANC micro-cycles                  20          :
          :   degrees of freedom                 9          :
          :.................................................:
          :   RF solver                   davidson          :
          :   write xtbopt.log                true          :
          :   linear?                        false          :
          :   energy convergence         0.5000000E-05 Eh   :
          :   grad. convergence          0.1000000E-02 Eh/α :
          :   maximium RF displ.         1.0000000          :
          :   Hlow (freq-cutoff)         0.1000000E-01      :
          :   Hmax (freq-cutoff)         5.0000000          :
          :   S6 in model hess.         20.0000000          :
          ...................................................

generating ANC from model Hessian ...
Using Lindh-Hessian (1995)
 Shifting diagonal of input Hessian by    5.8768146579416952E-003
 Lowest  eigenvalues of input Hessian
   -0.000000   -0.000000   -0.000000   -0.000000    0.000000    0.000000
    0.010000    0.013646    0.057184    0.123100    0.128297    0.732344
    0.779772    0.996357    1.188744
 Highest eigenvalues
    0.123100    0.128297    0.732344    0.779772    0.996357    1.188744


........................................................................
.............................. CYCLE    1 ..............................
........................................................................
   1    -10.8919149 -0.108919E+02  0.468E-05    0.38       0.0  T
   2    -10.8919149  0.366107E-09  0.209E-04    0.38     214.1  T
   3    -10.8919149 -0.171875E-09  0.141E-04    0.38     317.0  T
     SCC iter.                  ...        0 min,  0.001 sec
     gradient                   ...        0 min,  0.002 sec
 * total energy  :   -10.8404681 Eh     change       -0.1954348E-10 Eh
   gradient norm :     0.3561469 Eh/α   predicted     0.0000000E+00 (-100.00%)
   displ. norm   :     0.4492601 α      lambda       -0.1502257E+00
   maximum displ.:     0.3999403 α      in ANC's #6, #3, #4, ...

........................................................................
.............................. CYCLE    2 ..............................
........................................................................
   1    -11.0683222 -0.110683E+02  0.291E+00    1.30       0.0  T
   2    -10.9419105  0.126412E+00  0.445E+00    1.48       1.0  T
   3    -11.0874046 -0.145494E+00  0.154E+00    1.38       1.0  T
   4    -11.0910602 -0.365561E-02  0.756E-01    1.29       1.0  T
   5    -11.0932441 -0.218382E-02  0.234E-01    1.36       1.0  T
   6    -11.0934124 -0.168292E-03  0.589E-02    1.36       1.0  T
   7    -11.0932558  0.156527E-03  0.116E-01    1.36       1.0  T
   8    -11.0934251 -0.169266E-03  0.152E-02    1.36       2.9  T
   9    -11.0934260 -0.915248E-06  0.243E-03    1.36      18.4  T
  10    -11.0934260 -0.116060E-07  0.175E-03    1.36      25.5  T
  11    -11.0934260 -0.184869E-07  0.602E-04    1.36      74.3  T
  12    -11.0934260 -0.122744E-08  0.297E-05    1.36    1505.2  T
     SCC iter.                  ...        0 min,  0.001 sec
     gradient                   ...        0 min,  0.001 sec
 * total energy  :   -10.9739457 Eh     change       -0.1334776E+00 Eh
   gradient norm :     0.2537505 Eh/α   predicted    -0.9027317E-01 ( -32.37%)
   displ. norm   :     0.6375216 α      lambda       -0.1601016E+00
   maximum displ.:     0.6174374 α      in ANC's #6, #3, #1, ...

........................................................................
.............................. CYCLE    3 ..............................
........................................................................
   1    -11.3889877 -0.113890E+02  0.350E+00    3.58       0.0  T
   2    -11.3811905  0.779712E-02  0.264E+00    3.57       1.0  T
   3    -11.3849323 -0.374173E-02  0.195E+00    3.59       1.0  T
   4    -11.3992005 -0.142683E-01  0.352E-01    3.57       1.0  T
   5    -11.3855209  0.136796E-01  0.134E+00    3.57       1.0  T
   6    -11.3994989 -0.139780E-01  0.794E-02    3.58       1.0  T
   7    -11.3995188 -0.199288E-04  0.298E-02    3.57       1.5  T
   8    -11.3995209 -0.208329E-05  0.160E-02    3.57       2.8  T
   9    -11.3995216 -0.659542E-06  0.279E-03    3.57      16.0  T
  10    -11.3995216 -0.249313E-07  0.100E-03    3.57      44.7  T
  11    -11.3995216 -0.584702E-08  0.289E-04    3.57     154.7  T
  12    -11.3995216 -0.940830E-10  0.531E-05    3.57     842.6  T
     SCC iter.                  ...        0 min,  0.001 sec
     gradient                   ...        0 min,  0.002 sec
 * total energy  :   -10.9903820 Eh     change       -0.1643635E-01 Eh
   gradient norm :     0.5184253 Eh/α   predicted    -0.1125861E+00 ( 584.98%)
   displ. norm   :     0.4339589 α      lambda       -0.1584342E+00
   maximum displ.:     0.3717816 α      in ANC's #3, #8, #6, ...

........................................................................
.............................. CYCLE    4 ..............................
........................................................................
   1    -11.2792443 -0.112792E+02  0.143E+00    2.82       0.0  T
   2    -11.2804456 -0.120131E-02  0.954E-01    2.91       1.0  T
   3    -11.2799013  0.544320E-03  0.633E-01    2.90       1.0  T
   4    -11.2784952  0.140611E-02  0.678E-01    2.88       1.0  T
   5    -11.2730039  0.549131E-02  0.915E-01    2.91       1.0  T
   6    -11.2812125 -0.820859E-02  0.120E-01    2.91       1.0  T
   7    -11.2812780 -0.655097E-04  0.301E-02    2.91       1.5  T
   8    -11.2812841 -0.617967E-05  0.705E-03    2.91       6.3  T
   9    -11.2812842 -0.198844E-07  0.350E-03    2.91      12.8  T
  10    -11.2812843 -0.919690E-07  0.156E-03    2.91      28.7  T
  11    -11.2812843 -0.138079E-07  0.880E-04    2.91      50.8  T
  12    -11.2812843 -0.409853E-08  0.463E-04    2.91      96.5  T
     SCC iter.                  ...        0 min,  0.001 sec
     gradient                   ...        0 min,  0.001 sec
 * total energy  :   -11.0542099 Eh     change       -0.6382788E-01 Eh
   gradient norm :     0.0845662 Eh/α   predicted    -0.9413525E-01 (  47.48%)
   displ. norm   :     0.5989671 α      lambda       -0.2167052E-01
   maximum displ.:     0.4340109 α      in ANC's #1, #3, #6, ...

........................................................................
.............................. CYCLE    5 ..............................
........................................................................
   1    -11.2738199 -0.112738E+02  0.296E+00    3.64       0.0  T
   2    -11.2712751  0.254477E-02  0.178E+00    3.68       1.0  T
   3    -11.2419370  0.293381E-01  0.227E+00    3.63       1.0  T
   4    -11.1889869  0.529501E-01  0.269E+00    3.65       1.0  T
   5    -11.2748518 -0.858650E-01  0.244E-01    3.67       1.0  T
   6    -11.2751283 -0.276437E-03  0.151E-01    3.67       1.0  T
   7    -11.2749861  0.142151E-03  0.201E-01    3.67       1.0  T
   8    -11.2750485 -0.623922E-04  0.185E-01    3.67       1.0  T
   9    -11.2749452  0.103283E-03  0.223E-01    3.67       1.0  T
  10    -11.2753510 -0.405796E-03  0.313E-02    3.67       1.4  T
  11    -11.2753370  0.140390E-04  0.494E-02    3.67       1.0  T
  12    -11.2753541 -0.171025E-04  0.895E-03    3.67       5.0  T
  13    -11.2753546 -0.534971E-06  0.704E-04    3.67      63.6  T
  14    -11.2753546 -0.331038E-08  0.434E-05    3.67    1031.4  T
     SCC iter.                  ...        0 min,  0.002 sec
     gradient                   ...        0 min,  0.001 sec
 * total energy  :   -11.0666934 Eh     change       -0.1248354E-01 Eh
   gradient norm :     0.0942375 Eh/α   predicted    -0.1472253E-01 (  17.94%)
   displ. norm   :     0.4610638 α      lambda       -0.2031031E-01
   maximum displ.:     0.2509167 α      in ANC's #1, #3, #6, ...

........................................................................
.............................. CYCLE    6 ..............................
........................................................................
   1    -11.2821100 -0.112821E+02  0.144E+00    4.14       0.0  T
   2    -11.2821473 -0.373328E-04  0.867E-01    4.17       1.0  T
   3    -11.2784937  0.365359E-02  0.719E-01    4.17       1.0  T
   4    -11.2803962 -0.190244E-02  0.401E-01    4.15       1.0  T
   5    -11.2654297  0.149665E-01  0.110E+00    4.16       1.0  T
   6    -11.2824214 -0.169917E-01  0.361E-02    4.17       1.2  T
   7    -11.2824239 -0.250794E-05  0.132E-02    4.17       3.4  T
   8    -11.2824255 -0.157953E-05  0.238E-03    4.17      18.8  T
   9    -11.2824255  0.161175E-08  0.140E-03    4.17      32.1  T
  10    -11.2824255 -0.168486E-07  0.367E-04    4.17     121.8  T
  11    -11.2824255  0.348168E-09  0.300E-04    4.17     148.9  T
     SCC iter.                  ...        0 min,  0.001 sec
     gradient                   ...        0 min,  0.001 sec
 * total energy  :   -11.0774990 Eh     change       -0.1080558E-01 Eh
   gradient norm :     0.0998145 Eh/α   predicted    -0.1231393E-01 (  13.96%)
   displ. norm   :     0.2712707 α      lambda       -0.1925759E-01
   maximum displ.:     0.1757655 α      in ANC's #6, #1, #3, ...

........................................................................
.............................. CYCLE    7 ..............................
........................................................................
   1    -11.3583212 -0.113583E+02  0.892E-01    4.66       0.0  T
   2    -11.3565714  0.174981E-02  0.882E-01    4.67       1.0  T
   3    -11.3603464 -0.377504E-02  0.414E-01    4.69       1.0  T
   4    -11.3570055  0.334094E-02  0.521E-01    4.67       1.0  T
   5    -11.3456607  0.113448E-01  0.105E+00    4.67       1.0  T
   6    -11.3605347 -0.148740E-01  0.427E-02    4.68       1.0  T
   7    -11.3605384 -0.372242E-05  0.195E-02    4.68       2.3  T
   8    -11.3605405 -0.211158E-05  0.196E-03    4.68      22.9  T
   9    -11.3605405 -0.923310E-08  0.866E-04    4.68      51.6  T
  10    -11.3605405 -0.980681E-08  0.163E-04    4.68     274.6  T
     SCC iter.                  ...        0 min,  0.001 sec
     gradient                   ...        0 min,  0.002 sec
 * total energy  :   -11.0865256 Eh     change       -0.9026581E-02 Eh
   gradient norm :     0.0200809 Eh/α   predicted    -0.1033736E-01 (  14.52%)
   displ. norm   :     0.2070836 α      lambda       -0.2130996E-02
   maximum displ.:     0.1997616 α      in ANC's #1, #6, #3, ...

........................................................................
.............................. CYCLE    8 ..............................
........................................................................
   1    -11.3528287 -0.113528E+02  0.608E-01    4.71       0.0  T
   2    -11.3527790  0.497061E-04  0.379E-01    4.70       1.0  T
   3    -11.3392869  0.134921E-01  0.102E+00    4.70       1.0  T
   4    -11.3334981  0.578879E-02  0.120E+00    4.70       1.0  T
   5    -11.3528914 -0.193933E-01  0.323E-02    4.70       1.4  T
   6    -11.3528934 -0.198813E-05  0.187E-02    4.70       2.4  T
   7    -11.3528940 -0.649875E-06  0.667E-03    4.70       6.7  T
   8    -11.3528942 -0.128993E-06  0.503E-03    4.70       8.9  T
   9    -11.3528944 -0.284415E-06  0.177E-03    4.70      25.3  T
  10    -11.3528945 -0.272301E-07  0.257E-04    4.70     174.1  T
  11    -11.3528945  0.131272E-08  0.388E-04    4.70     115.2  T
     SCC iter.                  ...        0 min,  0.001 sec
     gradient                   ...        0 min,  0.001 sec
 * total energy  :   -11.0879389 Eh     change       -0.1413277E-02 Eh
   gradient norm :     0.0064957 Eh/α   predicted    -0.1111189E-02 ( -21.37%)
   displ. norm   :     0.1913641 α      lambda       -0.6517842E-03
   maximum displ.:     0.1770367 α      in ANC's #1, #2, #6, ...

........................................................................
.............................. CYCLE    9 ..............................
........................................................................
   1    -11.3482340 -0.113482E+02  0.621E-01    4.61       0.0  T
   2    -11.3359281  0.123060E-01  0.106E+00    4.60       1.0  T
   3    -11.3318378  0.409023E-02  0.113E+00    4.61       1.0  T
   4    -11.3480240 -0.161862E-01  0.228E-01    4.61       1.0  T
   5    -11.3471522  0.871839E-03  0.323E-01    4.60       1.0  T
   6    -11.3474797 -0.327532E-03  0.270E-01    4.61       1.0  T
   7    -11.3483045 -0.824761E-03  0.707E-02    4.61       1.0  T
   8    -11.3483662 -0.617537E-04  0.167E-02    4.61       2.7  T
   9    -11.3483691 -0.285207E-05  0.601E-03    4.61       7.4  T
  10    -11.3483694 -0.353410E-06  0.600E-04    4.61      74.5  T
  11    -11.3483694 -0.449547E-08  0.118E-04    4.61     377.4  T
     SCC iter.                  ...        0 min,  0.001 sec
     gradient                   ...        0 min,  0.001 sec
 * total energy  :   -11.0877502 Eh     change        0.1886831E-03 Eh
   gradient norm :     0.0344441 Eh/α   predicted    -0.3378277E-03 (-279.05%)
   displ. norm   :     0.4161605 α      lambda       -0.2589277E-02
   maximum displ.:     0.3727548 α      in ANC's #1, #2, #6, ...

........................................................................
.............................. CYCLE   10 ..............................
........................................................................
   1    -11.3228438 -0.113228E+02  0.141E+00    4.19       0.0  T
   2    -11.3028233  0.200205E-01  0.158E+00    4.18       1.0  T
   3    -11.1451002  0.157723E+00  0.351E+00    4.16       1.0  T
   4    -11.3134061 -0.168306E+00  0.104E+00    4.18       1.0  T
   5    -11.3137184 -0.312382E-03  0.884E-01    4.18       1.0  T
   6    -11.3198106 -0.609212E-02  0.548E-01    4.17       1.0  T
   7    -11.3222366 -0.242607E-02  0.320E-01    4.18       1.0  T
   8    -11.3234228 -0.118619E-02  0.291E-02    4.18       1.5  T
   9    -11.3234259 -0.304902E-05  0.188E-02    4.18       2.4  T
  10    -11.3234284 -0.248843E-05  0.453E-03    4.18       9.9  T
  11    -11.3234283  0.868511E-07  0.589E-03    4.18       7.6  T
  12    -11.3234285 -0.213336E-06  0.108E-03    4.18      41.5  T
  13    -11.3234285 -0.721201E-08  0.124E-04    4.18     360.5  T
  14    -11.3234285 -0.213465E-10  0.533E-05    4.18     839.2  T
     SCC iter.                  ...        0 min,  0.001 sec
     gradient                   ...        0 min,  0.001 sec
 * total energy  :   -11.0841503 Eh     change        0.3599852E-02 Eh
   gradient norm :     0.0756892 Eh/α   predicted    -0.1518853E-02 (-142.19%)
   displ. norm   :     0.3506019 α      lambda       -0.9368575E-02
   maximum displ.:     0.3357677 α      in ANC's #1, #4, #2, ...

........................................................................
.............................. CYCLE   11 ..............................
........................................................................
   1    -11.3630166 -0.113630E+02  0.121E+00    4.78       0.0  T
   2    -11.3482915  0.147251E-01  0.135E+00    4.77       1.0  T
   3    -11.2426580  0.105633E+00  0.290E+00    4.75       1.0  T
   4    -11.3514187 -0.108761E+00  0.101E+00    4.79       1.0  T
   5    -11.3608306 -0.941194E-02  0.416E-01    4.78       1.0  T
   6    -11.3631143 -0.228369E-02  0.149E-01    4.78       1.0  T
   7    -11.3627576  0.356664E-03  0.218E-01    4.78       1.0  T
   8    -11.3632804 -0.522722E-03  0.300E-02    4.78       1.5  T
   9    -11.3632457  0.346758E-04  0.660E-02    4.78       1.0  T
  10    -11.3632620 -0.163499E-04  0.500E-02    4.78       1.0  T
  11    -11.3632838 -0.217241E-04  0.761E-03    4.78       5.9  T
  12    -11.3632842 -0.478483E-06  0.353E-04    4.78     126.9  T
  13    -11.3632842 -0.865619E-10  0.957E-05    4.78     467.5  T
     SCC iter.                  ...        0 min,  0.001 sec
     gradient                   ...        0 min,  0.002 sec
 * total energy  :   -11.0879172 Eh     change       -0.3766826E-02 Eh
   gradient norm :     0.0417632 Eh/α   predicted    -0.5260087E-02 (  39.64%)
   displ. norm   :     0.1677960 α      lambda       -0.3033541E-02
   maximum displ.:     0.1174847 α      in ANC's #2, #6, #1, ...

........................................................................
.............................. CYCLE   12 ..............................
........................................................................
   1    -11.3484890 -0.113485E+02  0.781E-01    4.50       0.0  T
   2    -11.3471567  0.133224E-02  0.563E-01    4.50       1.0  T
   3    -11.2208818  0.126275E+00  0.297E+00    4.47       1.0  T
   4    -11.3484480 -0.127566E+00  0.236E-01    4.50       1.0  T
   5    -11.3453554  0.309262E-02  0.556E-01    4.50       1.0  T
   6    -11.3454190 -0.636496E-04  0.556E-01    4.50       1.0  T
   7    -11.3468342 -0.141517E-02  0.406E-01    4.50       1.0  T
   8    -11.3482598 -0.142558E-02  0.217E-01    4.50       1.0  T
   9    -11.3484452 -0.185451E-03  0.145E-01    4.50       1.0  T
  10    -11.3486254 -0.180188E-03  0.165E-02    4.50       2.7  T
  11    -11.3486274 -0.193669E-05  0.849E-03    4.50       5.3  T
  12    -11.3486279 -0.559800E-06  0.126E-03    4.50      35.5  T
  13    -11.3486279 -0.783513E-08  0.787E-04    4.50      56.8  T
  14    -11.3486279 -0.510897E-08  0.159E-04    4.50     281.1  T
     SCC iter.                  ...        0 min,  0.001 sec
     gradient                   ...        0 min,  0.002 sec
 * total energy  :   -11.0868887 Eh     change        0.1028450E-02 Eh
   gradient norm :     0.0539614 Eh/α   predicted    -0.1559477E-02 (-251.63%)
   displ. norm   :     0.0936583 α      lambda       -0.3081932E-02
   maximum displ.:     0.0626314 α      in ANC's #2, #6, #5, ...

........................................................................
.............................. CYCLE   13 ..............................
........................................................................
   1    -11.3542678 -0.113543E+02  0.493E-01    4.63       0.0  T
   2    -11.3217649  0.325029E-01  0.151E+00    4.63       1.0  T
   3    -11.3338412 -0.120763E-01  0.134E+00    4.63       1.0  T
   4    -11.3455402 -0.116990E-01  0.842E-01    4.63       1.0  T
   5    -11.3521757 -0.663551E-02  0.440E-01    4.63       1.0  T
   6    -11.3539410 -0.176527E-02  0.229E-01    4.63       1.0  T
   7    -11.3543638 -0.422869E-03  0.132E-01    4.63       1.0  T
   8    -11.3545750 -0.211147E-03  0.574E-03    4.63       7.8  T
   9    -11.3545750 -0.592328E-07  0.406E-03    4.63      11.0  T
  10    -11.3545751 -0.831060E-07  0.800E-04    4.63      55.9  T
  11    -11.3545751 -0.385050E-09  0.441E-04    4.63     101.4  T
     SCC iter.                  ...        0 min,  0.001 sec
     gradient                   ...        0 min,  0.001 sec
 * total energy  :   -11.0884261 Eh     change       -0.1537357E-02 Eh
   gradient norm :     0.0172285 Eh/α   predicted    -0.1554484E-02 (   1.11%)
   displ. norm   :     0.1075528 α      lambda       -0.1013934E-02
   maximum displ.:     0.0752908 α      in ANC's #2, #5, #6, ...

........................................................................
.............................. CYCLE   14 ..............................
........................................................................
   1    -11.3567865 -0.113568E+02  0.689E-01    4.74       0.0  T
   2    -11.1565280  0.200258E+00  0.365E+00    4.72       1.0  T
   3    -11.3603839 -0.203856E+00  0.329E-01    4.74       1.0  T
   4    -11.3601065  0.277422E-03  0.306E-01    4.74       1.0  T
   5    -11.3578906  0.221590E-02  0.460E-01    4.74       1.0  T
   6    -11.3605545 -0.266397E-02  0.712E-02    4.74       1.0  T
   7    -11.3603406  0.213906E-03  0.163E-01    4.74       1.0  T
   8    -11.3604885 -0.147832E-03  0.996E-02    4.74       1.0  T
   9    -11.3604371  0.513693E-04  0.130E-01    4.74       1.0  T
  10    -11.3605460 -0.108937E-03  0.666E-02    4.74       1.0  T
  11    -11.3605844 -0.384168E-04  0.725E-03    4.74       6.2  T
  12    -11.3605849 -0.417199E-06  0.104E-03    4.74      43.0  T
  13    -11.3605849 -0.599199E-08  0.230E-04    4.74     194.5  T
  14    -11.3605849 -0.560549E-09  0.192E-05    4.74    2330.6  T
     SCC iter.                  ...        0 min,  0.001 sec
     gradient                   ...        0 min,  0.001 sec
 * total energy  :   -11.0873105 Eh     change        0.1115516E-02 Eh
   gradient norm :     0.0583499 Eh/α   predicted    -0.5128329E-03 (-145.97%)
   displ. norm   :     0.0864230 α      lambda       -0.2510379E-02
   maximum displ.:     0.0592279 α      in ANC's #2, #5, #1, ...

........................................................................
.............................. CYCLE   15 ..............................
........................................................................
   1    -11.3537302 -0.113537E+02  0.519E-01    4.66       0.0  T
   2    -11.2035778  0.150152E+00  0.324E+00    4.62       1.0  T
   3    -11.3555301 -0.151952E+00  0.287E-01    4.66       1.0  T
   4    -11.3553903  0.139851E-03  0.263E-01    4.66       1.0  T
   5    -11.3542893  0.110097E-02  0.341E-01    4.66       1.0  T
   6    -11.3558162 -0.152686E-02  0.307E-02    4.66       1.5  T
   7    -11.3557893  0.268779E-04  0.566E-02    4.66       1.0  T
   8    -11.3558032 -0.138672E-04  0.395E-02    4.66       1.1  T
   9    -11.3558091 -0.593640E-05  0.354E-02    4.66       1.3  T
  10    -11.3558153 -0.622211E-05  0.232E-02    4.66       1.9  T
  11    -11.3558197 -0.433069E-05  0.531E-03    4.66       8.4  T
  12    -11.3558199 -0.246016E-06  0.510E-04    4.66      87.6  T
  13    -11.3558199 -0.228333E-08  0.226E-04    4.66     197.6  T
     SCC iter.                  ...        0 min,  0.001 sec
     gradient                   ...        0 min,  0.001 sec
 * total energy  :   -11.0885821 Eh     change       -0.1271541E-02 Eh
   gradient norm :     0.0046904 Eh/α   predicted    -0.1264563E-02 (  -0.55%)
   displ. norm   :     0.0251672 α      lambda       -0.3548884E-04
   maximum displ.:     0.0218611 α      in ANC's #1, #3, #4, ...

........................................................................
.............................. CYCLE   16 ..............................
........................................................................
   1    -11.3559284 -0.113559E+02  0.799E-02    4.64       0.0  T
   2    -11.3558628  0.655771E-04  0.858E-02    4.64       1.0  T
   3    -11.3544136  0.144920E-02  0.340E-01    4.64       1.0  T
   4    -11.3559178 -0.150421E-02  0.412E-02    4.64       1.1  T
   5    -11.3559297 -0.119432E-04  0.415E-03    4.64      10.8  T
   6    -11.3559298 -0.104522E-07  0.284E-03    4.64      15.7  T
   7    -11.3559298 -0.177663E-07  0.169E-03    4.64      26.5  T
   8    -11.3559298 -0.306012E-07  0.208E-04    4.64     214.6  T
   9    -11.3559298 -0.119666E-09  0.152E-04    4.64     293.6  T
     SCC iter.                  ...        0 min,  0.001 sec
     gradient                   ...        0 min,  0.001 sec
 * total energy  :   -11.0886135 Eh     change       -0.3138540E-04 Eh
   gradient norm :     0.0028352 Eh/α   predicted    -0.1775481E-04 ( -43.43%)
   displ. norm   :     0.1386676 α      lambda       -0.1556721E-03
   maximum displ.:     0.1214577 α      in ANC's #1, #4, #3, ...

........................................................................
.............................. CYCLE   17 ..............................
........................................................................
   1    -11.3555349 -0.113555E+02  0.430E-01    4.59       0.0  T
   2    -11.3554382  0.967525E-04  0.267E-01    4.59       1.0  T
   3    -11.3081389  0.472993E-01  0.187E+00    4.59       1.0  T
   4    -11.3554309 -0.472920E-01  0.111E-01    4.59       1.0  T
   5    -11.3555415 -0.110667E-03  0.211E-02    4.59       2.1  T
   6    -11.3555438 -0.223121E-05  0.109E-02    4.59       4.1  T
   7    -11.3555403  0.346351E-05  0.172E-02    4.59       2.6  T
   8    -11.3555441 -0.375956E-05  0.295E-03    4.59      15.2  T
   9    -11.3555442 -0.110260E-06  0.488E-04    4.59      91.7  T
  10    -11.3555442  0.272383E-08  0.596E-04    4.59      75.0  T
     SCC iter.                  ...        0 min,  0.001 sec
     gradient                   ...        0 min,  0.001 sec
 * total energy  :   -11.0886979 Eh     change       -0.8440610E-04 Eh
   gradient norm :     0.0049018 Eh/α   predicted    -0.7933354E-04 (  -6.01%)
   displ. norm   :     0.0183964 α      lambda       -0.2729432E-04
   maximum displ.:     0.0121641 α      in ANC's #4, #1, #6, ...

........................................................................
.............................. CYCLE   18 ..............................
........................................................................
   1    -11.3573443 -0.113573E+02  0.711E-02    4.61       0.0  T
   2    -11.3571843  0.159955E-03  0.118E-01    4.61       1.0  T
   3    -11.3568343  0.350014E-03  0.200E-01    4.61       1.0  T
   4    -11.3573411 -0.506825E-03  0.284E-02    4.61       1.6  T
   5    -11.3573459 -0.471670E-05  0.571E-03    4.61       7.8  T
   6    -11.3573453  0.543738E-06  0.844E-03    4.61       5.3  T
   7    -11.3573460 -0.690425E-06  0.317E-03    4.61      14.1  T
   8    -11.3573461 -0.777903E-07  0.161E-03    4.61      27.7  T
   9    -11.3573461 -0.218889E-07  0.853E-04    4.61      52.4  T
  10    -11.3573461 -0.837690E-08  0.109E-04    4.61     411.7  T
     SCC iter.                  ...        0 min,  0.001 sec
     gradient                   ...        0 min,  0.001 sec
 * total energy  :   -11.0887162 Eh     change       -0.1834704E-04 Eh
   gradient norm :     0.0010554 Eh/α   predicted    -0.1365136E-04 ( -25.59%)
   displ. norm   :     0.0344396 α      lambda       -0.7602493E-05
   maximum displ.:     0.0245988 α      in ANC's #1, #4, #8, ...

........................................................................
.............................. CYCLE   19 ..............................
........................................................................
   1    -11.3582873 -0.113583E+02  0.118E-01    4.62       0.0  T
   2    -11.3581776  0.109698E-03  0.113E-01    4.62       1.0  T
   3    -11.3537799  0.439771E-02  0.589E-01    4.62       1.0  T
   4    -11.3582861 -0.450622E-02  0.194E-02    4.62       2.3  T
   5    -11.3582888 -0.273022E-05  0.425E-03    4.62      10.5  T
   6    -11.3582889 -0.908670E-07  0.313E-03    4.62      14.3  T
   7    -11.3582888  0.844249E-07  0.325E-03    4.62      13.8  T
   8    -11.3582890 -0.118735E-06  0.716E-04    4.62      62.5  T
   9    -11.3582890 -0.383979E-08  0.421E-04    4.62     106.2  T
     SCC iter.                  ...        0 min,  0.001 sec
     gradient                   ...        0 min,  0.001 sec
 * total energy  :   -11.0887200 Eh     change       -0.3775767E-05 Eh
   gradient norm :     0.0012348 Eh/α   predicted    -0.3803214E-05 (   0.73%)
   displ. norm   :     0.0104218 α      lambda       -0.9498406E-06
   maximum displ.:     0.0086331 α      in ANC's #1, #4, #3, ...

........................................................................
.............................. CYCLE   20 ..............................
........................................................................
   1    -11.3582012 -0.113582E+02  0.326E-02    4.62       0.0  T
   2    -11.3581787  0.224583E-04  0.454E-02    4.62       1.0  T
   3    -11.3580370  0.141655E-03  0.113E-01    4.62       1.0  T
   4    -11.3582008 -0.163749E-03  0.738E-03    4.62       6.1  T
   5    -11.3582014 -0.569936E-06  0.192E-03    4.62      23.3  T
   6    -11.3582014 -0.165015E-07  0.922E-04    4.62      48.5  T
   7    -11.3582014 -0.332637E-08  0.557E-04    4.62      80.3  T
     SCC iter.                  ...        0 min,  0.001 sec
     gradient                   ...        0 min,  0.001 sec
 * total energy  :   -11.0887209 Eh     change       -0.8562716E-06 Eh
   gradient norm :     0.0004688 Eh/α   predicted    -0.4769263E-06 ( -44.30%)
   displ. norm   :     0.0037995 α      lambda       -0.2287128E-06
   maximum displ.:     0.0031558 α      in ANC's #1, #3, #4, ...

   *** GEOMETRY OPTIMIZATION CONVERGED AFTER 20 ITERATIONS ***

------------------------------------------------------------------------
 total energy gain   :        -0.2482528 Eh     -155.7810 kcal/mol
 total RMSD          :         1.0315239 a0        0.5459 Å
 total power (kW/mol):       -32.5893763 (step)-8194.3379 (real)
------------------------------------------------------------------------

 ANCopt (total)                0 d,  0 h,  0 min,  0.080 sec
 optimizer setup                ...        0 min,  0.000 sec (  0.079%)
 model hessian                  ...        0 min,  0.000 sec (  0.145%)
 ANC generation                 ...        0 min,  0.000 sec (  0.060%)
 coordinate transformation      ...        0 min,  0.000 sec (  0.052%)
 single point calculation       ...        0 min,  0.078 sec ( 97.653%)
 optimization log               ...        0 min,  0.000 sec (  0.551%)
 hessian update                 ...        0 min,  0.000 sec (  0.070%)
 rational function              ...        0 min,  0.000 sec (  0.579%)

================
 final structure:
================
5
 xtb: 6.2.2 (9d81278992624c895f80dd42a50cac0aa55982e2)
C         1.21370079341535    0.08249479777503   -0.11347138307079
N        -0.00133205779546    0.17527299070689    0.14516277982613
C        -1.21363707317130   -0.10616423048686    0.09233748041203
C         2.44825291497449    0.11468925295251   -0.26907040861580
C        -2.44698457742306   -0.26629281094759    0.14504253144844

 Bond Distances (Angstroems)
 ---------------------------
C1-N2=1.2457         C1-C4=1.2447         N2-C1=1.2457         N2-C3=1.2457         C3-N2=1.2457         C3-C5=1.2448         
C4-C1=1.2447         C5-C3=1.2448         
 C  C  Rav=1.2448 sigma=0.0000  Rmin=1.2447  Rmax=1.2448     2
 N  C  Rav=1.2457 sigma=0.0000  Rmin=1.2457  Rmax=1.2457     2

 selected bond angles (degree)
 --------------------
C4-C1-N2=172.49                C3-N2-C1=157.46                C5-C3-N2=172.53                

 selected dihedral angles (degree)
 ---------------------------------
C3-N2-C1-C4=180.56            C5-C3-N2-C1=179.58            
           -------------------------------------------------
          |                Final Singlepoint                |
           -------------------------------------------------

          ...................................................
          :                      SETUP                      :
          :.................................................:
          :  # basis functions                  20          :
          :  # atomic orbitals                  20          :
          :  # shells                           10          :
          :  # electrons                        21          :
          :  max. iterations                   250          :
          :  Hamiltonian                  GFN2-xTB          :
          :  restarted?                      false          :
          :  GBSA solvation                  false          :
          :  PC potential                    false          :
          :  electronic temp.          300.0000000     K    :
          :  accuracy                    1.0000000          :
          :  -> integral cutoff          0.2500000E+02      :
          :  -> integral neglect         0.1000000E-07      :
          :  -> SCF convergence          0.1000000E-05 Eh   :
          :  -> wf. convergence          0.1000000E-03 e    :
          :  Broyden damping             0.4000000          :
          ...................................................

 iter      E             dE          RMSdq      gap      omega  full diag
   1    -11.3582014 -0.113582E+02  0.287E-04    4.62       0.0  T
   2    -11.3582014  0.136689E-07  0.964E-04    4.62      46.4  T
   3    -11.3582014  0.148725E-07  0.155E-03    4.62      28.9  T
   4    -11.3582014 -0.276517E-07  0.283E-04    4.62     158.1  T

   *** convergence criteria satisfied after 4 iterations ***

         #    Occupation            Energy/Eh            Energy/eV
      -------------------------------------------------------------
         1        2.0000           -0.7019713             -19.1016
       ...           ...                  ...                  ...
         6        2.0000           -0.5657861             -15.3958
         7        2.0000           -0.4688001             -12.7567
         8        2.0000           -0.4683092             -12.7433
         9        1.9998           -0.4446973             -12.1008
        10        1.0002           -0.4287828             -11.6678
        11        1.0000           -0.3980832             -10.8324
        12        1.0000           -0.3942906             -10.7292 (HOMO)
        13                         -0.2245989              -6.1116 (LUMO)
        14                         -0.2225193              -6.0551
        15                         -0.1347545              -3.6669
        16                         -0.1223225              -3.3286
        17                          0.0662581               1.8030
       ...                                ...                  ...
        20                          1.3319817              36.2451
      -------------------------------------------------------------
                  HL-Gap            0.1696917 Eh            4.6175 eV
             Fermi-level           -0.3730924 Eh          -10.1524 eV

 SCC (total)                   0 d,  0 h,  0 min,  0.003 sec
 SCC setup                      ...        0 min,  0.000 sec (  1.309%)
 Dispersion                     ...        0 min,  0.000 sec (  0.239%)
 integral evaluation            ...        0 min,  0.001 sec ( 45.121%)
 zeroth order Hamiltonian       ...        0 min,  0.000 sec (  0.486%)
 iterations                     ...        0 min,  0.000 sec ( 13.366%)
 molecular gradient             ...        0 min,  0.001 sec ( 37.956%)
 printout                       ...        0 min,  0.000 sec (  1.309%)

         :::::::::::::::::::::::::::::::::::::::::::::::::::::
         ::                     SUMMARY                     ::
         :::::::::::::::::::::::::::::::::::::::::::::::::::::
         :: total energy             -11.088720863790 Eh    ::
         :: gradient norm              0.000485653833 Eh/a0 ::
         :: HOMO-LUMO gap              4.617545525503 eV    ::
         ::.................................................::
         :: SCC energy               -11.358201381872 Eh    ::
         :: -> isotropic ES           -0.005383859408 Eh    ::
         :: -> anisotropic ES          0.000122866060 Eh    ::
         :: -> anisotropic XC          0.016448656356 Eh    ::
         :: -> dispersion             -0.002705530493 Eh    ::
         :: repulsion energy           0.269481570083 Eh    ::
         :: add. restraining           0.000000000000 Eh    ::
         :::::::::::::::::::::::::::::::::::::::::::::::::::::

           ------------------------------------------------- 
          |                Numerical Hessian                |
           ------------------------------------------------- 
step length          :   0.00500
SCC accuracy         :   0.30000
Hessian scale factor :   1.00000
frozen atoms in %    :   0.00000    0
RMS gradient         :   0.00049
estimated CPU  time      0.00 min
estimated wall time      0.00 min

writing file <hessian>.

 projected vibrational frequencies (cm-1)
eigval :       -0.00    -0.00    -0.00     0.00     0.00     0.00
eigval :      104.38   195.08   288.96   386.22   402.04   880.00
eigval :     1485.77  1750.13  2053.10
           -------------------------------------------------
          |                Property Printout                |
           -------------------------------------------------

    * Orbital Energies and Occupations

         #    Occupation            Energy/Eh            Energy/eV
      -------------------------------------------------------------
         1        2.0000           -0.7019712             -19.1016
         2        2.0000           -0.6763164             -18.4035
         3        2.0000           -0.6501482             -17.6914
         4        2.0000           -0.6183667             -16.8266
         5        2.0000           -0.5665420             -15.4164
         6        2.0000           -0.5657860             -15.3958
         7        2.0000           -0.4688001             -12.7567
         8        2.0000           -0.4683092             -12.7433
         9        1.9998           -0.4446973             -12.1008
        10        1.0002           -0.4287828             -11.6678
        11        1.0000           -0.3980832             -10.8324
        12        1.0000           -0.3942906             -10.7292 (HOMO)
        13                         -0.2245989              -6.1116 (LUMO)
        14                         -0.2225193              -6.0551
        15                         -0.1347544              -3.6669
        16                         -0.1223225              -3.3286
        17                          0.0662582               1.8030
        18                          0.4655421              12.6680
        19                          1.0477810              28.5116
        20                          1.3319817              36.2451
      -------------------------------------------------------------
                  HL-Gap            0.1696917 Eh            4.6175 eV
             Fermi-level           -0.3730924 Eh          -10.1524 eV

     #   Z        covCN         q      C6AA      α(0)
     1   6 C      1.900     0.090    28.862     8.676
     2   7 N      1.824     0.031    21.382     6.852
     3   6 C      1.900     0.090    28.861     8.676
     4   6 C      0.982    -0.105    39.284    10.528
     5   6 C      0.982    -0.105    39.286    10.528

 Mol. C6AA /au·bohr⁶  :        777.260428
 Mol. C8AA /au·bohr⁸  :      21549.265452
 Mol. α(0) /au        :         45.260995


Wiberg/Mayer (AO) data.
largest (>0.10) Wiberg bond orders for each atom
          total WBO             WBO to atom ...
     1  C   3.820        C    4 2.110    N    2 1.539    C    5 0.132
     2  N   3.126        C    3 1.539    C    1 1.539
     3  C   3.820        C    5 2.109    N    2 1.539    C    4 0.132
     4  C   2.434        C    1 2.110    C    5 0.169    C    3 0.132
     5  C   2.434        C    3 2.109    C    4 0.169    C    1 0.132

MOs/occ written to file <molden.input>


molecular dipole:
                 x           y           z       tot (Debye)
Molecule has the following symmetry elements: (C2) 2*(sigma) 
It seems to be the C2v point group
 q only:       -0.000       0.036       0.029
   full:        0.000       0.018       0.013       0.057
molecular quadrupole (traceless):
                xx          xy          yy          xz          yz          zz
 q only:       -3.537      -0.416       1.771       0.452       0.034       1.766
  q+dip:       -3.268      -0.383       1.641       0.416       0.054       1.627
   full:       -7.169      -0.842       3.592       0.914       0.083       3.577

           -------------------------------------------------
          |                Geometry Summary                 |
           -------------------------------------------------

      molecular mass/u    :       62.0496468
   center of mass at/Å    :       -0.0000428       0.0056381       0.0046697
  moments of inertia/u·Å² :        0.9586094E+00   0.1816618E+03   0.1826204E+03
rotational constants/cm⁻¹ :        0.1758551E+02   0.9279678E-01   0.9230969E-01

 * 4 selected distances

     #   Z        #   Z                                     value/Å
     1   6 C      2   7 N                                 1.2457144 (max)
     2   7 N      3   6 C                                 1.2456648
     1   6 C      4   6 C                                 1.2447355 (min)
     3   6 C      5   6 C                                 1.2448153

 * 2 distinct bonds (by element types)

   Z      Z             #   av. dist./Å        max./Å        min./Å
   6 C    6 C           2     1.2447754     1.2448153     1.2447355
   6 C    7 N           2     1.2456896     1.2457144     1.2456648

           -------------------------------------------------
          |               Frequency Printout                |
           -------------------------------------------------
 projected vibrational frequencies (cm-1)
eigval :       -0.00    -0.00    -0.00     0.00     0.00     0.00
eigval :      104.38   195.08   288.96   386.22   402.04   880.00
eigval :     1485.77  1750.13  2053.10
 reduced masses (amu)
   1: 12.39   2: 12.41   3: 12.06   4: 13.52   5: 12.22   6: 12.24   7: 12.79   8: 12.14
   9: 12.63  10: 12.02  11: 12.01  12: 12.15  13: 12.60  14: 12.95  15: 12.02
 IR intensities (amu)
   1:  0.06   2:  0.10   3:  0.10   4:  0.13   5:  0.09   6:  0.05   7:  0.28   8:  0.56
   9:  0.46  10:  0.71  11:  0.02  12:  0.17  13:  3.36  14:  2.65  15:  0.02
 Raman intensities (amu)
   1:  0.00   2:  0.00   3:  0.00   4:  0.00   5:  0.00   6:  0.00   7:  0.00   8:  0.00
   9:  0.00  10:  0.00  11:  0.00  12:  0.00  13:  0.00  14:  0.00  15:  0.00
 output can be read by thermo (or use thermo option).
 writing <g98.out> molden fake output.
 recommended (thermochemical) frequency scaling factor: 1.0
           -------------------------------------------------
          |             Thermodynamic Functions             |
           -------------------------------------------------

c2v symmetry found (for desy threshold:  0.10E+00) used in thermo

          ...................................................
          :                      SETUP                      :
          :.................................................:
          :  # frequencies                           9      :
          :  # imaginary freq.                       0      :
          :  linear?                             false      :
          :  only rotor calc.                    false      :
          :  symmetry                              c2v      :
          :  rotational number                       2      :
          :  scaling factor                  1.0000000      :
          :  rotor cutoff                   50.0000000 cm⁻¹ :
          :  imag. cutoff                  -20.0000000 cm⁻¹ :
          :.................................................:

    mode    ω/cm⁻¹     T·S(HO)/kcal·mol⁻¹    T·S(FR)/kcal·mol⁻¹   T·S(vib)
   ------------------------------------------------------------------------
       1    104.38    -0.00000 ( 95.00%)     0.00562 (  5.00%)     0.00028
       2    195.08    -0.00000 ( 99.57%)     0.01183 (  0.43%)     0.00005
       3    288.96    -0.00000 ( 99.91%)     0.01573 (  0.09%)     0.00001
   ------------------------------------------------------------------------

   temp. (K)  partition function   enthalpy   heat capacity  entropy
                                   cal/mol     cal/K/mol   cal/K/mol   J/K/mol
 298.15  VIB   7.73                 1521.678      9.099      9.141
         ROT  0.681E+04              888.752      2.981     20.521
         INT  0.527E+05             2410.431     12.080     29.663
         TR   0.473E+27             1481.254      4.968     38.278
         TOT                        3891.6845    17.0481    67.9407   284.2639

   temp. (K)  partition function   enthalpy   heat capacity  entropy
                                   cal/mol     cal/K/mol   cal/K/mol   J/K/mol
 120.00  VIB   1.63                  226.080      4.634      2.869
         ROT  0.174E+04              357.707      2.981     17.808
         INT  0.283E+04              583.787      7.615     20.678
         TR   0.121E+27              596.178      4.968     33.759
         TOT                        1179.9647    12.5832    54.4363   227.7616

   temp. (K)  partition function   enthalpy   heat capacity  entropy
                                   cal/mol     cal/K/mol   cal/K/mol   J/K/mol
 100.00  VIB   1.40                  142.344      3.724      2.115
         ROT  0.132E+04              298.089      2.981     17.265
         INT  0.185E+04              440.433      6.704     19.380
         TR   0.919E+26              496.815      4.968     32.853
         TOT                         937.2479    11.6726    52.2332   218.5435

   temp. (K)  partition function   enthalpy   heat capacity  entropy
                                   cal/mol     cal/K/mol   cal/K/mol   J/K/mol
  80.00  VIB   1.23                   77.628      2.740      1.403
         ROT   947.                  238.471      2.981     16.600
         INT  0.116E+04              316.100      5.721     18.003
         TR   0.657E+26              397.452      4.968     31.745
         TOT                         713.5515    10.6893    49.7482   208.1465

   temp. (K)  partition function   enthalpy   heat capacity  entropy
                                   cal/mol     cal/K/mol   cal/K/mol   J/K/mol
  60.00  VIB   1.10                   32.827      1.742      0.770
         ROT   615.                  178.853      2.981     15.742
         INT   677.                  211.681      4.723     16.512
         TR   0.427E+26              298.089      4.968     30.317
         TOT                         509.7698     9.6915    46.8290   195.9324

   temp. (K)  partition function   enthalpy   heat capacity  entropy
                                   cal/mol     cal/K/mol   cal/K/mol   J/K/mol
  40.00  VIB   1.02                    7.683      0.783      0.271
         ROT   335.                  119.236      2.981     14.533
         INT   343.                  126.919      3.764     14.804
         TR   0.232E+26              198.726      4.968     28.303
         TOT                         325.6447     8.7318    43.1076   180.3620

   temp. (K)  partition function   enthalpy   heat capacity  entropy
                                   cal/mol     cal/K/mol   cal/K/mol   J/K/mol
  20.00  VIB   1.00                    0.164      0.062      0.012
         ROT   118.                   59.618      2.981     12.467
         INT   118.                   59.782      3.043     12.479
         TR   0.822E+25               99.363      4.968     24.861
         TOT                         159.1450     8.0109    37.3402   156.2313

   temp. (K)  partition function   enthalpy   heat capacity  entropy
                                   cal/mol     cal/K/mol   cal/K/mol   J/K/mol
  10.00  VIB   1.00                    0.000      0.000     -0.036
         ROT   41.8                   29.809      2.981     10.401
         INT   41.8                   29.809      2.981     10.365
         TR   0.290E+25               49.681      4.968     21.419
         TOT                          79.4905     7.9492    31.7848   132.9876

       T/K    H(0)-H(T)+PV         H(T)/Eh          T*S/Eh         G(T)/Eh
   ------------------------------------------------------------------------
    298.15    0.620179E-02    0.233921E-01    0.322808E-01   -0.888870E-02
    120.00    0.188039E-02    0.190707E-01    0.104100E-01    0.866074E-02
    100.00    0.149360E-02    0.186839E-01    0.832388E-02    0.103600E-01
     80.00    0.113712E-02    0.183274E-01    0.634230E-02    0.119851E-01
     60.00    0.812370E-03    0.180027E-01    0.447760E-02    0.135251E-01
     40.00    0.518948E-03    0.177093E-01    0.274785E-02    0.149614E-01
     20.00    0.253614E-03    0.174439E-01    0.119011E-02    0.162538E-01
     10.00    0.126676E-03    0.173170E-01    0.506523E-03    0.168105E-01 (used)
   ------------------------------------------------------------------------

         :::::::::::::::::::::::::::::::::::::::::::::::::::::
         ::                  THERMODYNAMIC                  ::
         :::::::::::::::::::::::::::::::::::::::::::::::::::::
         :: total free energy         -11.071910388455 Eh   ::
         ::.................................................::
         :: total energy              -11.088720864837 Eh   ::
         :: zero point energy           0.017190323065 Eh   ::
         :: G(RRHO) w/o ZPVE           -0.000379846684 Eh   ::
         :: G(RRHO) contrib.            0.016810476381 Eh   ::
         :::::::::::::::::::::::::::::::::::::::::::::::::::::

optimized geometry written to: xtbopt.xyz


           -------------------------------------------------
          | TOTAL ENERGY              -11.088720864837 Eh   |
          | TOTAL ENTHALPY            -11.071403865613 Eh   |
          | TOTAL FREE ENERGY         -11.071910388455 Eh   |
          | GRADIENT NORM               0.000485646245 Eh/α |
          | HOMO-LUMO GAP               4.617545781113 eV   |
           -------------------------------------------------

------------------------------------------------------------------------
 * finished run on 2020/05/12 at 11:44:00.616     
------------------------------------------------------------------------
 total:
 * wall-time:     0 d,  0 h,  0 min,  0.205 sec
 *  cpu-time:     0 d,  0 h,  0 min,  0.205 sec
 * ratio c/w:     0.998 speedup
 SCF:
 * wall-time:     0 d,  0 h,  0 min,  0.005 sec
 *  cpu-time:     0 d,  0 h,  0 min,  0.005 sec
 * ratio c/w:     1.000 speedup
 ANC optimizer:
 * wall-time:     0 d,  0 h,  0 min,  0.083 sec
 *  cpu-time:     0 d,  0 h,  0 min,  0.083 sec
 * ratio c/w:     0.998 speedup
 numerical hessian:
 * wall-time:     0 d,  0 h,  0 min,  0.101 sec
 *  cpu-time:     0 d,  0 h,  0 min,  0.101 sec
 * ratio c/w:     0.999 speedup

