      -----------------------------------------------------------      
     |                   =====================                   |     
     |                           x T B                           |     
     |                   =====================                   |     
     |                         S. Grimme                         |     
     |          Mulliken Center for Theoretical Chemistry        |     
     |                    University of Bonn                     |     
      -----------------------------------------------------------      

   * xtb version 6.2.2 (9d81278992624c895f80dd42a50cac0aa55982e2) compiled by '@Darwin' on 04/03/2020

   xtb is free software: you can redistribute it and/or modify it under
   the terms of the GNU Lesser General Public License as published by
   the Free Software Foundation, either version 3 of the License, or
   (at your option) any later version.
   
   xtb is distributed in the hope that it will be useful,
   but WITHOUT ANY WARRANTY; without even the implied warranty of
   MERCHANTABILITY or FITNESS FOR A PARTICULAR PURPOSE.  See the
   GNU Lesser General Public License for more details.
   
   Cite this work as:
   * S. Grimme, C. Bannwarth, P. Shushkov, J. Chem. Theory Comput., 2017,
     13, 1989-2009. DOI: 10.1021/acs.jctc.7b00118
   * C. Bannwarth, S. Ehlert and S. Grimme., J. Chem. Theory Comput., 2019,
     15, 1652-1671. DOI: 10.1021/acs.jctc.8b01176
   * P. Pracht, E. Caldeweyher, S. Ehlert, S. Grimme, ChemRxiv, 2019, preprint.
     DOI: 10.26434/chemrxiv.8326202.v1
   
   for DFT-D4:
   * E. Caldeweyher, C. Bannwarth and S. Grimme, J. Chem. Phys., 2017,
     147, 034112. DOI: 10.1063/1.4993215
   * E. Caldeweyher, S. Ehlert, A. Hansen, H. Neugebauer, S. Spicher,
     C. Bannwarth and S. Grimme, J. Chem. Phys., 2019, 150, 154122.
     DOI: 10.1063/1.5090222
   
   for sTDA-xTB:
   * S. Grimme and C. Bannwarth, J. Chem. Phys., 2016, 145, 054103.
     DOI: 10.1063/1.4959605
   
   in the mass-spec context:
   * V. Asgeirsson, C. Bauer and S. Grimme, Chem. Sci., 2017, 8, 4879.
     DOI: 10.1039/c7sc00601b
   
   for metadynamics refer to:
   * S. Grimme, J. Chem. Theory Comput., 2019, 155, 2847-2862
     DOI: 10.1021/acs.jctc.9b00143
   
   with help from (in alphabetical order)
   C. Bannwarth, F. Bohle, G. Brandenburg, E. Caldeweyher, M. Checinski,
   S. Dohm, S. Ehlert, S. Ehrlich, F. März, H. Neugebauer, J. Pisarek,
   P. Pracht, P. Shushkov, and S. Spicher.
   
 * started run on 2020/05/12 at 11:44:41.338     

           -------------------------------------------------
          |                Calculation Setup                |
           -------------------------------------------------

          program call               : xtb --input C1N1O1_2_S_3.input C1N1O1_2_S_3.xyz --ohess --molden --namespace C1N1O1_2_S_3 output.out
          calculation namespace      : C1N1O1_2_S_3
          coordinate file            : C1N1O1_2_S_3.xyz
          number of atoms            :                     3
          number of electrons        :                    15
          charge                     :                     0
          spin                       :                   1.5
          first test random number   :      0.32361025525029

   ID    Z sym.   atoms
    1    8 O      1
    2    7 N      2
    3    6 C      3

           -------------------------------------------------
          |                 G F N 2 - x T B                 |
           -------------------------------------------------

        Reference                      10.1021/acs.jctc.8b01176
      * Hamiltonian:
        H0-scaling (s, p, d)           1.850000    2.230000    2.230000
        zeta-weighting                 0.500000
      * Dispersion:
        s8                             2.700000
        a1                             0.520000
        a2                             5.000000
        s9                             5.000000
      * Repulsion:
        kExp                           1.500000    1.000000
        rExp                           1.000000
      * Coulomb:
        alpha                          2.000000
        third order                    shell-resolved
        anisotropic                    true
        a3                             3.000000
        a5                             4.000000
        cn-shift                       1.200000
        cn-exp                         4.000000
        max-rad                        5.000000


          ...................................................
          :                      SETUP                      :
          :.................................................:
          :  # basis functions                  12          :
          :  # atomic orbitals                  12          :
          :  # shells                            6          :
          :  # electrons                        15          :
          :  max. iterations                   250          :
          :  Hamiltonian                  GFN2-xTB          :
          :  restarted?                      false          :
          :  GBSA solvation                  false          :
          :  PC potential                    false          :
          :  electronic temp.          300.0000000     K    :
          :  accuracy                    1.0000000          :
          :  -> integral cutoff          0.2500000E+02      :
          :  -> integral neglect         0.1000000E-07      :
          :  -> SCF convergence          0.1000000E-05 Eh   :
          :  -> wf. convergence          0.1000000E-03 e    :
          :  Broyden damping             0.4000000          :
          ...................................................

 iter      E             dE          RMSdq      gap      omega  full diag
   1     -8.6049237 -0.860492E+01  0.897E+00    0.78       0.0  T
   2     -8.3095385  0.295385E+00  0.101E+01    0.61       1.0  T
   3     -8.7177071 -0.408169E+00  0.491E+00    0.73       1.0  T
   4     -8.7260649 -0.835781E-02  0.158E+00    0.68       1.0  T
   5     -8.7311607 -0.509573E-02  0.742E-01    0.62       1.0  T
   6     -8.7312206 -0.599304E-04  0.538E-01    0.62       1.0  T
   7     -8.7311744  0.461917E-04  0.208E-01    0.61       1.0  T
   8     -8.7312614 -0.870146E-04  0.607E-02    0.62       1.0  T
   9     -8.7312623 -0.898648E-06  0.389E-02    0.62       1.5  T
  10     -8.7312680 -0.571665E-05  0.436E-03    0.62      13.2  T
  11     -8.7312681 -0.177103E-07  0.813E-04    0.62      71.0  T
  12     -8.7312681  0.195337E-08  0.717E-04    0.62      80.5  T

   *** convergence criteria satisfied after 12 iterations ***

         #    Occupation            Energy/Eh            Energy/eV
      -------------------------------------------------------------
         1        2.0000           -0.8202170             -22.3192
       ...           ...                  ...                  ...
         3        2.0000           -0.6817423             -18.5512
         4        2.0000           -0.6420702             -17.4716
         5        2.0000           -0.5474030             -14.8956
         6        2.0000           -0.5355554             -14.5732
         7        1.0000           -0.4491311             -12.2215
         8        1.0000           -0.4479540             -12.1894
         9        1.0000           -0.3864089             -10.5147 (HOMO)
        10        0.0000           -0.3637068              -9.8970 (LUMO)
        11                         -0.0475525              -1.2940
        12                          0.0462939               1.2597
      -------------------------------------------------------------
                  HL-Gap            0.0227021 Eh            0.6178 eV
             Fermi-level           -0.4337005 Eh          -11.8016 eV

 SCC (total)                   0 d,  0 h,  0 min,  0.002 sec
 SCC setup                      ...        0 min,  0.000 sec (  3.983%)
 Dispersion                     ...        0 min,  0.000 sec (  0.486%)
 integral evaluation            ...        0 min,  0.001 sec ( 27.443%)
 zeroth order Hamiltonian       ...        0 min,  0.000 sec (  0.591%)
 iterations                     ...        0 min,  0.001 sec ( 40.459%)
 molecular gradient             ...        0 min,  0.000 sec ( 24.189%)
 printout                       ...        0 min,  0.000 sec (  2.432%)

         :::::::::::::::::::::::::::::::::::::::::::::::::::::
         ::                     SUMMARY                     ::
         :::::::::::::::::::::::::::::::::::::::::::::::::::::
         :: total energy              -8.718163139042 Eh    ::
         :: gradient norm              0.149663478345 Eh/a0 ::
         :: HOMO-LUMO gap              0.617754535136 eV    ::
         ::.................................................::
         :: SCC energy                -8.731268053309 Eh    ::
         :: -> isotropic ES           -0.012474777713 Eh    ::
         :: -> anisotropic ES          0.003732156440 Eh    ::
         :: -> anisotropic XC          0.005092624836 Eh    ::
         :: -> dispersion             -0.000771985842 Eh    ::
         :: repulsion energy           0.013104911986 Eh    ::
         :: add. restraining           0.000000000000 Eh    ::
         :::::::::::::::::::::::::::::::::::::::::::::::::::::

      ----------------------------------------------------------- 
     |                   =====================                   |
     |                        A N C O P T                        |
     |                   =====================                   |
     |               Approximate Normal Coordinate               |
     |                Rational Function Optimizer                |
      ----------------------------------------------------------- 

          ...................................................
          :                      SETUP                      :
          :.................................................:
          :   optimization level            normal          :
          :   max. optcycles                   200          :
          :   ANC micro-cycles                  20          :
          :   degrees of freedom                 3          :
          :.................................................:
          :   RF solver                   davidson          :
          :   write xtbopt.log                true          :
          :   linear?                        false          :
          :   energy convergence         0.5000000E-05 Eh   :
          :   grad. convergence          0.1000000E-02 Eh/α :
          :   maximium RF displ.         1.0000000          :
          :   Hlow (freq-cutoff)         0.1000000E-01      :
          :   Hmax (freq-cutoff)         5.0000000          :
          :   S6 in model hess.         20.0000000          :
          ...................................................

generating ANC from model Hessian ...
Using Lindh-Hessian (1995)
 Shifting diagonal of input Hessian by    0.0000000000000000     
 Lowest  eigenvalues of input Hessian
   -0.000000   -0.000000   -0.000000    0.000000    0.000000    0.000000
    0.202621    1.127315    1.392869
 Highest eigenvalues
    0.000000    0.000000    0.000000    0.202621    1.127315    1.392869


........................................................................
.............................. CYCLE    1 ..............................
........................................................................
   1     -8.7312681 -0.873127E+01  0.496E-05    0.62       0.0  T
   2     -8.7312681  0.550671E-13  0.371E-05    0.62    1558.2  T
   3     -8.7312681  0.115286E-11  0.224E-05    0.62    2580.0  T
     SCC iter.                  ...        0 min,  0.000 sec
     gradient                   ...        0 min,  0.000 sec
 * total energy  :    -8.7181631 Eh     change       -0.3489136E-08 Eh
   gradient norm :     0.1496559 Eh/α   predicted     0.0000000E+00 (-100.00%)
   displ. norm   :     0.2602608 α      lambda       -0.2911465E-01
   maximum displ.:     0.2309676 α      in ANC's #1, #2, #3, ...

........................................................................
.............................. CYCLE    2 ..............................
........................................................................
   1     -8.7565601 -0.875656E+01  0.192E+00    1.15       0.0  T
   2     -8.7561002  0.459884E-03  0.128E+00    1.03       1.0  T
   3     -8.7551486  0.951616E-03  0.105E+00    1.14       1.0  T
   4     -8.7581742 -0.302561E-02  0.117E-01    1.07       1.0  T
   5     -8.7581913 -0.171304E-04  0.492E-02    1.07       1.2  T
   6     -8.7581916 -0.326416E-06  0.820E-03    1.07       7.0  T
   7     -8.7581916  0.653322E-08  0.558E-03    1.07      10.4  T
   8     -8.7581917 -0.386842E-07  0.588E-04    1.07      98.2  T
   9     -8.7581917 -0.828404E-10  0.127E-04    1.07     453.4  T
     SCC iter.                  ...        0 min,  0.000 sec
     gradient                   ...        0 min,  0.000 sec
 * total energy  :    -8.7387497 Eh     change       -0.2058657E-01 Eh
   gradient norm :     0.0879484 Eh/α   predicted    -0.1554336E-01 ( -24.50%)
   displ. norm   :     0.1715928 α      lambda       -0.1384334E-01
   maximum displ.:     0.1488182 α      in ANC's #2, #1, #3, ...

........................................................................
.............................. CYCLE    3 ..............................
........................................................................
   1     -8.7753060 -0.877531E+01  0.161E+00    1.34       0.0  T
   2     -8.7756234 -0.317376E-03  0.111E+00    1.22       1.0  T
   3     -8.7770281 -0.140471E-02  0.721E-01    1.28       1.0  T
   4     -8.7779405 -0.912440E-03  0.192E-01    1.25       1.0  T
   5     -8.7779618 -0.213119E-04  0.422E-02    1.25       1.4  T
   6     -8.7779624 -0.552401E-06  0.116E-02    1.25       5.0  T
   7     -8.7779625 -0.108954E-06  0.483E-03    1.25      11.9  T
   8     -8.7779625 -0.161373E-07  0.455E-04    1.25     127.0  T
   9     -8.7779625  0.543654E-10  0.185E-04    1.25     312.1  T
     SCC iter.                  ...        0 min,  0.000 sec
     gradient                   ...        0 min,  0.000 sec
 * total energy  :    -8.7452900 Eh     change       -0.6540301E-02 Eh
   gradient norm :     0.0138705 Eh/α   predicted    -0.7125472E-02 (   8.95%)
   displ. norm   :     0.0196574 α      lambda       -0.2454697E-03
   maximum displ.:     0.0137946 α      in ANC's #2, #1, #3, ...

........................................................................
.............................. CYCLE    4 ..............................
........................................................................
   1     -8.7759548 -0.877595E+01  0.163E-01    1.21       0.0  T
   2     -8.7759727 -0.178741E-04  0.898E-02    1.22       1.0  T
   3     -8.7759799 -0.725176E-05  0.702E-02    1.21       1.0  T
   4     -8.7759900 -0.101070E-04  0.283E-02    1.21       2.0  T
   5     -8.7759903 -0.237762E-06  0.529E-03    1.21      10.9  T
   6     -8.7759903 -0.255921E-07  0.830E-04    1.21      69.6  T
   7     -8.7759903 -0.420455E-09  0.340E-04    1.21     169.8  T
     SCC iter.                  ...        0 min,  0.000 sec
     gradient                   ...        0 min,  0.000 sec
 * total energy  :    -8.7454152 Eh     change       -0.1251978E-03 Eh
   gradient norm :     0.0040617 Eh/α   predicted    -0.1227835E-03 (  -1.93%)
   displ. norm   :     0.0058419 α      lambda       -0.1703322E-04
   maximum displ.:     0.0045421 α      in ANC's #1, #3, #2, ...

........................................................................
.............................. CYCLE    5 ..............................
........................................................................
   1     -8.7759905 -0.877599E+01  0.485E-02    1.21       0.0  T
   2     -8.7759902  0.252439E-06  0.343E-02    1.21       1.7  T
   3     -8.7759901  0.147543E-06  0.229E-02    1.21       2.5  T
   4     -8.7759915 -0.139287E-05  0.232E-03    1.21      24.9  T
   5     -8.7759915 -0.403618E-08  0.456E-04    1.21     126.6  T
   6     -8.7759915 -0.152232E-09  0.120E-04    1.21     480.9  T
     SCC iter.                  ...        0 min,  0.000 sec
     gradient                   ...        0 min,  0.000 sec
 * total energy  :    -8.7454275 Eh     change       -0.1223578E-04 Eh
   gradient norm :     0.0020855 Eh/α   predicted    -0.8515620E-05 ( -30.40%)
   displ. norm   :     0.0037789 α      lambda       -0.6811272E-05
   maximum displ.:     0.0032287 α      in ANC's #3, #1, #2, ...

........................................................................
.............................. CYCLE    6 ..............................
........................................................................
   1     -8.7760108 -0.877601E+01  0.391E-02    1.21       0.0  T
   2     -8.7760106  0.188237E-06  0.287E-02    1.20       2.0  T
   3     -8.7760111 -0.439999E-06  0.174E-02    1.21       3.3  T
   4     -8.7760117 -0.665131E-06  0.250E-03    1.20      23.1  T
   5     -8.7760117 -0.632400E-08  0.109E-03    1.21      53.0  T
   6     -8.7760117 -0.941846E-09  0.114E-04    1.21     507.9  T
   7     -8.7760117 -0.200018E-11  0.209E-05    1.21    2760.4  T
     SCC iter.                  ...        0 min,  0.000 sec
     gradient                   ...        0 min,  0.000 sec
 * total energy  :    -8.7454310 Eh     change       -0.3530382E-05 Eh
   gradient norm :     0.0002085 Eh/α   predicted    -0.3407197E-05 (  -3.49%)
   displ. norm   :     0.0007738 α      lambda       -0.9218937E-07
   maximum displ.:     0.0006922 α      in ANC's #1, #3, #2, ...

   *** GEOMETRY OPTIMIZATION CONVERGED AFTER 6 ITERATIONS ***

------------------------------------------------------------------------
 total energy gain   :        -0.0272678 Eh      -17.1108 kcal/mol
 total RMSD          :         0.2438870 a0        0.1291 Å
 total power (kW/mol):       -11.9319515 (step)-7941.3253 (real)
------------------------------------------------------------------------

 ANCopt (total)                0 d,  0 h,  0 min,  0.009 sec
 optimizer setup                ...        0 min,  0.000 sec (  0.708%)
 model hessian                  ...        0 min,  0.000 sec (  0.431%)
 ANC generation                 ...        0 min,  0.000 sec (  0.402%)
 coordinate transformation      ...        0 min,  0.000 sec (  0.137%)
 single point calculation       ...        0 min,  0.008 sec ( 93.298%)
 optimization log               ...        0 min,  0.000 sec (  1.200%)
 hessian update                 ...        0 min,  0.000 sec (  0.159%)
 rational function              ...        0 min,  0.000 sec (  1.147%)

================
 final structure:
================
3
 xtb: 6.2.2 (9d81278992624c895f80dd42a50cac0aa55982e2)
O        -0.01582788081053    0.38700038946208    0.00000000000000
N        -1.12772122296864   -0.20774102352517   -0.00000000000000
C         1.14354810377917   -0.17925836593691    0.00000000000000

 Bond Distances (Angstroems)
 ---------------------------
O1-N2=1.2610         O1-C3=1.2903         N2-O1=1.2610         C3-O1=1.2903         
 O  C  Rav=1.2903 sigma=0.0000  Rmin=1.2903  Rmax=1.2903     1
 O  N  Rav=1.2610 sigma=0.0000  Rmin=1.2610  Rmax=1.2610     1

 selected bond angles (degree)
 --------------------
C3-O1-N2=125.83                

 selected dihedral angles (degree)
 ---------------------------------

           -------------------------------------------------
          |                Final Singlepoint                |
           -------------------------------------------------

          ...................................................
          :                      SETUP                      :
          :.................................................:
          :  # basis functions                  12          :
          :  # atomic orbitals                  12          :
          :  # shells                            6          :
          :  # electrons                        15          :
          :  max. iterations                   250          :
          :  Hamiltonian                  GFN2-xTB          :
          :  restarted?                      false          :
          :  GBSA solvation                  false          :
          :  PC potential                    false          :
          :  electronic temp.          300.0000000     K    :
          :  accuracy                    1.0000000          :
          :  -> integral cutoff          0.2500000E+02      :
          :  -> integral neglect         0.1000000E-07      :
          :  -> SCF convergence          0.1000000E-05 Eh   :
          :  -> wf. convergence          0.1000000E-03 e    :
          :  Broyden damping             0.4000000          :
          ...................................................

 iter      E             dE          RMSdq      gap      omega  full diag
   1     -8.7760117 -0.877601E+01  0.565E-06    1.21       0.0  T
   2     -8.7760117 -0.710543E-14  0.329E-06    1.21   17557.5  T
   3     -8.7760117  0.195399E-13  0.278E-06    1.21   20762.6  T

   *** convergence criteria satisfied after 3 iterations ***

         #    Occupation            Energy/Eh            Energy/eV
      -------------------------------------------------------------
         1        2.0000           -0.8314398             -22.6246
       ...           ...                  ...                  ...
         3        2.0000           -0.6832098             -18.5911
         4        2.0000           -0.6638962             -18.0655
         5        2.0000           -0.5436161             -14.7925
         6        2.0000           -0.5125071             -13.9460
         7        1.0000           -0.4432639             -12.0618
         8        1.0000           -0.4240413             -11.5388
         9        1.0000           -0.3585491              -9.7566 (HOMO)
        10                         -0.3142647              -8.5516 (LUMO)
        11                          0.0644367               1.7534
        12                          0.3405928               9.2680
      -------------------------------------------------------------
                  HL-Gap            0.0442843 Eh            1.2050 eV
             Fermi-level           -0.4071462 Eh          -11.0790 eV

 SCC (total)                   0 d,  0 h,  0 min,  0.001 sec
 SCC setup                      ...        0 min,  0.000 sec (  4.548%)
 Dispersion                     ...        0 min,  0.000 sec (  0.458%)
 integral evaluation            ...        0 min,  0.001 sec ( 42.454%)
 zeroth order Hamiltonian       ...        0 min,  0.000 sec (  0.458%)
 iterations                     ...        0 min,  0.000 sec ( 12.984%)
 molecular gradient             ...        0 min,  0.000 sec ( 35.503%)
 printout                       ...        0 min,  0.000 sec (  2.934%)

         :::::::::::::::::::::::::::::::::::::::::::::::::::::
         ::                     SUMMARY                     ::
         :::::::::::::::::::::::::::::::::::::::::::::::::::::
         :: total energy              -8.745430981011 Eh    ::
         :: gradient norm              0.000209763475 Eh/a0 ::
         :: HOMO-LUMO gap              1.205038475802 eV    ::
         ::.................................................::
         :: SCC energy                -8.776011734571 Eh    ::
         :: -> isotropic ES           -0.010232393469 Eh    ::
         :: -> anisotropic ES          0.005609106633 Eh    ::
         :: -> anisotropic XC          0.005004638607 Eh    ::
         :: -> dispersion             -0.000773120998 Eh    ::
         :: repulsion energy           0.030580754160 Eh    ::
         :: add. restraining           0.000000000000 Eh    ::
         :::::::::::::::::::::::::::::::::::::::::::::::::::::

           ------------------------------------------------- 
          |                Numerical Hessian                |
           ------------------------------------------------- 
step length          :   0.00500
SCC accuracy         :   0.30000
Hessian scale factor :   1.00000
frozen atoms in %    :   0.00000    0
RMS gradient         :   0.00021
estimated CPU  time      0.00 min
estimated wall time      0.00 min

writing file <hessian>.

 projected vibrational frequencies (cm-1)
eigval :       -0.00    -0.00    -0.00     0.00     0.00     0.00
eigval :      555.87  1063.61  1244.60
           -------------------------------------------------
          |                Property Printout                |
           -------------------------------------------------

    * Orbital Energies and Occupations

         #    Occupation            Energy/Eh            Energy/eV
      -------------------------------------------------------------
         1        2.0000           -0.8314398             -22.6246
         2        2.0000           -0.7693621             -20.9354
         3        2.0000           -0.6832098             -18.5911
         4        2.0000           -0.6638962             -18.0655
         5        2.0000           -0.5436161             -14.7925
         6        2.0000           -0.5125072             -13.9460
         7        1.0000           -0.4432638             -12.0618
         8        1.0000           -0.4240413             -11.5388
         9        1.0000           -0.3585492              -9.7566 (HOMO)
        10                         -0.3142648              -8.5516 (LUMO)
        11                          0.0644367               1.7534
        12                          0.3405928               9.2680
      -------------------------------------------------------------
                  HL-Gap            0.0442844 Eh            1.2050 eV
             Fermi-level           -0.4071463 Eh          -11.0790 eV

     #   Z        covCN         q      C6AA      α(0)
     1   8 O      1.777     0.138    12.816     4.834
     2   7 N      0.957    -0.053    22.038     6.766
     3   6 C      0.890    -0.085    37.931    10.296

 Mol. C6AA /au·bohr⁶  :        206.859352
 Mol. C8AA /au·bohr⁸  :       5041.425862
 Mol. α(0) /au        :         21.895351


Wiberg/Mayer (AO) data.
largest (>0.10) Wiberg bond orders for each atom
          total WBO             WBO to atom ...
     1  O   2.645        N    2 1.335    C    3 1.310
     2  N   1.455        O    1 1.335    C    3 0.121
     3  C   1.431        O    1 1.310    N    2 0.121

MOs/occ written to file <molden.input>


molecular dipole:
                 x           y           z       tot (Debye)
 q only:       -0.075       0.150      -0.000
   full:       -0.225       0.368      -0.000       1.097
molecular quadrupole (traceless):
                xx          xy          yy          xz          yz          zz
 q only:       -0.664       0.022       0.374       0.000      -0.000       0.290
  q+dip:       -3.596       0.116       1.524       0.000       0.000       2.072
   full:       -4.122       0.211       1.145       0.000       0.000       2.978

           -------------------------------------------------
          |                Geometry Summary                 |
           -------------------------------------------------

      molecular mass/u    :       42.0168440
   center of mass at/Å    :       -0.0550739       0.0268701       0.0000001
  moments of inertia/u·Å² :        0.3335889E+01   0.3341655E+02   0.3675244E+02
rotational constants/cm⁻¹ :        0.5053416E+01   0.5044696E+00   0.4586807E+00

 * 2 selected distances

     #   Z        #   Z                                     value/Å
     1   8 O      2   7 N                                 1.2609616 (min)
     1   8 O      3   6 C                                 1.2902719 (max)

 * 2 distinct bonds (by element types)

   Z      Z             #   av. dist./Å        max./Å        min./Å
   6 C    8 O           1     1.2902719     1.2902719     1.2902719
   7 N    8 O           1     1.2609616     1.2609616     1.2609616

           -------------------------------------------------
          |               Frequency Printout                |
           -------------------------------------------------
 projected vibrational frequencies (cm-1)
eigval :       -0.00    -0.00    -0.00     0.00     0.00     0.00
eigval :      555.87  1063.61  1244.60
 reduced masses (amu)
   1: 14.24   2: 14.12   3: 12.37   4: 15.64   5: 14.03   6: 13.16   7: 14.01   8: 14.86
   9: 13.62
 IR intensities (amu)
   1:  0.06   2:  0.11   3:  0.11   4:  0.39   5:  0.13   6:  0.06   7:  0.40   8:  0.55
   9:  0.37
 Raman intensities (amu)
   1:  0.00   2:  0.00   3:  0.00   4:  0.00   5:  0.00   6:  0.00   7:  0.00   8:  0.00
Molecule has the following symmetry elements: (sigma) 
It seems to be the Cs point group
   9:  0.00
 output can be read by thermo (or use thermo option).
 writing <g98.out> molden fake output.
 recommended (thermochemical) frequency scaling factor: 1.0
           -------------------------------------------------
          |             Thermodynamic Functions             |
           -------------------------------------------------

cs  symmetry found (for desy threshold:  0.10E+00) used in thermo

          ...................................................
          :                      SETUP                      :
          :.................................................:
          :  # frequencies                           3      :
          :  # imaginary freq.                       0      :
          :  linear?                             false      :
          :  only rotor calc.                    false      :
          :  symmetry                               cs      :
          :  rotational number                       1      :
          :  scaling factor                  1.0000000      :
          :  rotor cutoff                   50.0000000 cm⁻¹ :
          :  imag. cutoff                  -20.0000000 cm⁻¹ :
          :.................................................:

    mode    ω/cm⁻¹     T·S(HO)/kcal·mol⁻¹    T·S(FR)/kcal·mol⁻¹   T·S(vib)
   ------------------------------------------------------------------------
   ------------------------------------------------------------------------

   temp. (K)  partition function   enthalpy   heat capacity  entropy
                                   cal/mol     cal/K/mol   cal/K/mol   J/K/mol
 298.15  VIB   1.08                  143.525      1.617      0.639
         ROT  0.489E+04              888.752      2.981     19.862
         INT  0.529E+04             1032.278      4.598     20.501
         TR   0.264E+27             1481.254      4.968     37.117
         TOT                        2513.5317     9.5660    57.6178   241.0728

   temp. (K)  partition function   enthalpy   heat capacity  entropy
                                   cal/mol     cal/K/mol   cal/K/mol   J/K/mol
 120.00  VIB   1.00                    2.039      0.114      0.020
         ROT  0.125E+04              357.707      2.981     17.149
         INT  0.125E+04              359.746      3.095     17.169
         TR   0.673E+26              596.178      4.968     32.597
         TOT                         955.9238     8.0630    49.7662   208.2218

   temp. (K)  partition function   enthalpy   heat capacity  entropy
                                   cal/mol     cal/K/mol   cal/K/mol   J/K/mol
 100.00  VIB   1.00                    0.535      0.043      0.006
         ROT   950.                  298.089      2.981     16.606
         INT   950.                  298.624      3.024     16.612
         TR   0.512E+26              496.815      4.968     31.692
         TOT                         795.4393     7.9919    48.3038   202.1032

   temp. (K)  partition function   enthalpy   heat capacity  entropy
                                   cal/mol     cal/K/mol   cal/K/mol   J/K/mol
  80.00  VIB   1.00                    0.072      0.009      0.001
         ROT   680.                  238.471      2.981     15.941
         INT   680.                  238.544      2.990     15.942
         TR   0.366E+26              397.452      4.968     30.584
         TOT                         635.9956     7.9581    46.5256   194.6629

   temp. (K)  partition function   enthalpy   heat capacity  entropy
                                   cal/mol     cal/K/mol   cal/K/mol   J/K/mol
  60.00  VIB   1.00                    0.003      0.001      0.000
         ROT   441.                  178.853      2.981     15.083
         INT   441.                  178.856      2.981     15.083
         TR   0.238E+26              298.089      4.968     29.155
         TOT                         476.9450     7.9496    44.2385   185.0938

   temp. (K)  partition function   enthalpy   heat capacity  entropy
                                   cal/mol     cal/K/mol   cal/K/mol   J/K/mol
  40.00  VIB   1.00                    0.000      0.000     -0.000
         ROT   240.                  119.236      2.981     13.875
         INT   240.                  119.236      2.981     13.875
         TR   0.129E+26              198.726      4.968     27.142
         TOT                         317.9616     7.9490    41.0163   171.6124

   temp. (K)  partition function   enthalpy   heat capacity  entropy
                                   cal/mol     cal/K/mol   cal/K/mol   J/K/mol
  20.00  VIB   1.00                    0.000      0.000     -0.000
         ROT   84.9                   59.618      2.981     11.808
         INT   84.9                   59.618      2.981     11.808
         TR   0.458E+25               99.363      4.968     23.700
         TOT                         158.9808     7.9490    35.5081   148.5660

   temp. (K)  partition function   enthalpy   heat capacity  entropy
                                   cal/mol     cal/K/mol   cal/K/mol   J/K/mol
  10.00  VIB   1.00                    0.000      0.000     -0.000
         ROT   30.0                   29.809      2.981      9.742
         INT   30.0                   29.809      2.981      9.742
         TR   0.162E+25               49.681      4.968     20.258
         TOT                          79.4904     7.9490    29.9999   125.5196

       T/K    H(0)-H(T)+PV         H(T)/Eh          T*S/Eh         G(T)/Eh
   ------------------------------------------------------------------------
    298.15    0.400557E-02    0.105304E-01    0.273761E-01   -0.168456E-01
    120.00    0.152336E-02    0.804823E-02    0.951690E-02   -0.146867E-02
    100.00    0.126761E-02    0.779248E-02    0.769771E-02    0.947719E-04
     80.00    0.101352E-02    0.753839E-02    0.593146E-02    0.160693E-02
     60.00    0.760060E-03    0.728493E-02    0.422991E-02    0.305501E-02
     40.00    0.506704E-03    0.703157E-02    0.261455E-02    0.441702E-02
     20.00    0.253352E-03    0.677822E-02    0.113172E-02    0.564650E-02
     10.00    0.126676E-03    0.665154E-02    0.478079E-03    0.617346E-02 (used)
   ------------------------------------------------------------------------

         :::::::::::::::::::::::::::::::::::::::::::::::::::::
         ::                  THERMODYNAMIC                  ::
         :::::::::::::::::::::::::::::::::::::::::::::::::::::
         :: total free energy          -8.739257518890 Eh   ::
         ::.................................................::
         :: total energy               -8.745430980994 Eh   ::
         :: zero point energy           0.006524864829 Eh   ::
         :: G(RRHO) w/o ZPVE           -0.000351402725 Eh   ::
         :: G(RRHO) contrib.            0.006173462104 Eh   ::
         :::::::::::::::::::::::::::::::::::::::::::::::::::::

optimized geometry written to: xtbopt.xyz


           -------------------------------------------------
          | TOTAL ENERGY               -8.745430980994 Eh   |
          | TOTAL ENTHALPY             -8.738779440149 Eh   |
          | TOTAL FREE ENERGY          -8.739257518890 Eh   |
          | GRADIENT NORM               0.000209815454 Eh/α |
          | HOMO-LUMO GAP               1.205039113189 eV   |
           -------------------------------------------------

------------------------------------------------------------------------
 * finished run on 2020/05/12 at 11:44:41.391     
------------------------------------------------------------------------
 total:
 * wall-time:     0 d,  0 h,  0 min,  0.053 sec
 *  cpu-time:     0 d,  0 h,  0 min,  0.053 sec
 * ratio c/w:     0.999 speedup
 SCF:
 * wall-time:     0 d,  0 h,  0 min,  0.002 sec
 *  cpu-time:     0 d,  0 h,  0 min,  0.002 sec
 * ratio c/w:     1.000 speedup
 ANC optimizer:
 * wall-time:     0 d,  0 h,  0 min,  0.011 sec
 *  cpu-time:     0 d,  0 h,  0 min,  0.011 sec
 * ratio c/w:     1.000 speedup
 numerical hessian:
 * wall-time:     0 d,  0 h,  0 min,  0.025 sec
 *  cpu-time:     0 d,  0 h,  0 min,  0.025 sec
 * ratio c/w:     1.000 speedup

