      -----------------------------------------------------------      
     |                   =====================                   |     
     |                           x T B                           |     
     |                   =====================                   |     
     |                         S. Grimme                         |     
     |          Mulliken Center for Theoretical Chemistry        |     
     |                    University of Bonn                     |     
      -----------------------------------------------------------      

   * xtb version 6.2.2 (9d81278992624c895f80dd42a50cac0aa55982e2) compiled by '@Darwin' on 04/03/2020

   xtb is free software: you can redistribute it and/or modify it under
   the terms of the GNU Lesser General Public License as published by
   the Free Software Foundation, either version 3 of the License, or
   (at your option) any later version.
   
   xtb is distributed in the hope that it will be useful,
   but WITHOUT ANY WARRANTY; without even the implied warranty of
   MERCHANTABILITY or FITNESS FOR A PARTICULAR PURPOSE.  See the
   GNU Lesser General Public License for more details.
   
   Cite this work as:
   * S. Grimme, C. Bannwarth, P. Shushkov, J. Chem. Theory Comput., 2017,
     13, 1989-2009. DOI: 10.1021/acs.jctc.7b00118
   * C. Bannwarth, S. Ehlert and S. Grimme., J. Chem. Theory Comput., 2019,
     15, 1652-1671. DOI: 10.1021/acs.jctc.8b01176
   * P. Pracht, E. Caldeweyher, S. Ehlert, S. Grimme, ChemRxiv, 2019, preprint.
     DOI: 10.26434/chemrxiv.8326202.v1
   
   for DFT-D4:
   * E. Caldeweyher, C. Bannwarth and S. Grimme, J. Chem. Phys., 2017,
     147, 034112. DOI: 10.1063/1.4993215
   * E. Caldeweyher, S. Ehlert, A. Hansen, H. Neugebauer, S. Spicher,
     C. Bannwarth and S. Grimme, J. Chem. Phys., 2019, 150, 154122.
     DOI: 10.1063/1.5090222
   
   for sTDA-xTB:
   * S. Grimme and C. Bannwarth, J. Chem. Phys., 2016, 145, 054103.
     DOI: 10.1063/1.4959605
   
   in the mass-spec context:
   * V. Asgeirsson, C. Bauer and S. Grimme, Chem. Sci., 2017, 8, 4879.
     DOI: 10.1039/c7sc00601b
   
   for metadynamics refer to:
   * S. Grimme, J. Chem. Theory Comput., 2019, 155, 2847-2862
     DOI: 10.1021/acs.jctc.9b00143
   
   with help from (in alphabetical order)
   C. Bannwarth, F. Bohle, G. Brandenburg, E. Caldeweyher, M. Checinski,
   S. Dohm, S. Ehlert, S. Ehrlich, F. März, H. Neugebauer, J. Pisarek,
   P. Pracht, P. Shushkov, and S. Spicher.
   
 * started run on 2020/05/12 at 11:44:03.852     

           -------------------------------------------------
          |                Calculation Setup                |
           -------------------------------------------------

          program call               : xtb --input C4N1_14_S_1.input C4N1_14_S_1.xyz --ohess --molden --namespace C4N1_14_S_1 output.out
          calculation namespace      : C4N1_14_S_1
          coordinate file            : C4N1_14_S_1.xyz
          number of atoms            :                     5
          number of electrons        :                    21
          charge                     :                     0
          spin                       :                   0.5
          first test random number   :      0.22670291465646

   ID    Z sym.   atoms
    1    6 C      1-3, 5
    2    7 N      4

           -------------------------------------------------
          |                 G F N 2 - x T B                 |
           -------------------------------------------------

        Reference                      10.1021/acs.jctc.8b01176
      * Hamiltonian:
        H0-scaling (s, p, d)           1.850000    2.230000    2.230000
        zeta-weighting                 0.500000
      * Dispersion:
        s8                             2.700000
        a1                             0.520000
        a2                             5.000000
        s9                             5.000000
      * Repulsion:
        kExp                           1.500000    1.000000
        rExp                           1.000000
      * Coulomb:
        alpha                          2.000000
        third order                    shell-resolved
        anisotropic                    true
        a3                             3.000000
        a5                             4.000000
        cn-shift                       1.200000
        cn-exp                         4.000000
        max-rad                        5.000000


          ...................................................
          :                      SETUP                      :
          :.................................................:
          :  # basis functions                  20          :
          :  # atomic orbitals                  20          :
          :  # shells                           10          :
          :  # electrons                        21          :
          :  max. iterations                   250          :
          :  Hamiltonian                  GFN2-xTB          :
          :  restarted?                      false          :
          :  GBSA solvation                  false          :
          :  PC potential                    false          :
          :  electronic temp.          300.0000000     K    :
          :  accuracy                    1.0000000          :
          :  -> integral cutoff          0.2500000E+02      :
          :  -> integral neglect         0.1000000E-07      :
          :  -> SCF convergence          0.1000000E-05 Eh   :
          :  -> wf. convergence          0.1000000E-03 e    :
          :  Broyden damping             0.4000000          :
          ...................................................

 iter      E             dE          RMSdq      gap      omega  full diag
   1    -10.7659070 -0.107659E+02  0.119E+01    0.19       0.0  T
   2     -9.7435088  0.102240E+01  0.115E+01    0.14       1.0  T
   3     -9.5802554  0.163253E+00  0.132E+01    1.45       1.0  T
   4    -10.7291121 -0.114886E+01  0.680E+00    0.39       1.0  T
   5    -10.9535060 -0.224394E+00  0.184E+00    0.25       1.0  T
   6    -10.9535359 -0.298711E-04  0.183E+00    0.25       1.0  T
   7    -10.8911676  0.623683E-01  0.282E+00    0.26       1.0  T
   8    -10.9538195 -0.626520E-01  0.565E-01    0.29       1.0  T
   9    -10.9553125 -0.149300E-02  0.140E-01    0.25       1.0  T
  10    -10.9553111  0.143727E-05  0.968E-02    0.25       1.0  T
  11    -10.9553558 -0.446848E-04  0.519E-02    0.25       1.0  T
  12    -10.9553635 -0.767948E-05  0.310E-02    0.24       1.4  T
  13    -10.9553695 -0.604165E-05  0.148E-02    0.24       3.0  T
  14    -10.9553710 -0.145001E-05  0.323E-03    0.24      13.9  T
  15    -10.9553710 -0.501368E-07  0.730E-04    0.24      61.3  T
  16    -10.9553710 -0.318796E-08  0.247E-04    0.24     181.2  T

   *** convergence criteria satisfied after 16 iterations ***

         #    Occupation            Energy/Eh            Energy/eV
      -------------------------------------------------------------
         1        2.0000           -0.7432546             -20.2250
       ...           ...                  ...                  ...
         5        2.0000           -0.5788424             -15.7511
         6        2.0000           -0.5443430             -14.8123
         7        2.0000           -0.5135872             -13.9754
         8        2.0000           -0.5119545             -13.9310
         9        2.0000           -0.5016919             -13.6517
        10        1.9967           -0.4386050             -11.9350
        11        0.9945           -0.4277459             -11.6396 (HOMO)
        12        0.0087           -0.4187566             -11.3949 (LUMO)
        13                         -0.4067989             -11.0696
        14                         -0.3702529             -10.0751
        15                         -0.3678238             -10.0090
        16                         -0.1343946              -3.6571
       ...                                ...                  ...
        20                          0.1917901               5.2189
      -------------------------------------------------------------
                  HL-Gap            0.0089893 Eh            0.2446 eV
             Fermi-level           -0.4282134 Eh          -11.6523 eV

 SCC (total)                   0 d,  0 h,  0 min,  0.006 sec
 SCC setup                      ...        0 min,  0.000 sec (  1.664%)
 Dispersion                     ...        0 min,  0.000 sec (  0.272%)
 integral evaluation            ...        0 min,  0.001 sec ( 26.275%)
 zeroth order Hamiltonian       ...        0 min,  0.000 sec (  0.324%)
 iterations                     ...        0 min,  0.002 sec ( 39.188%)
 molecular gradient             ...        0 min,  0.002 sec ( 30.793%)
 printout                       ...        0 min,  0.000 sec (  1.340%)

         :::::::::::::::::::::::::::::::::::::::::::::::::::::
         ::                     SUMMARY                     ::
         :::::::::::::::::::::::::::::::::::::::::::::::::::::
         :: total energy             -10.889217753682 Eh    ::
         :: gradient norm              0.285103581950 Eh/a0 ::
         :: HOMO-LUMO gap              0.244612038277 eV    ::
         ::.................................................::
         :: SCC energy               -10.955371007098 Eh    ::
         :: -> isotropic ES           -0.027465483781 Eh    ::
         :: -> anisotropic ES         -0.000216067246 Eh    ::
         :: -> anisotropic XC          0.012564198689 Eh    ::
         :: -> dispersion             -0.003058243366 Eh    ::
         :: repulsion energy           0.066153091582 Eh    ::
         :: add. restraining           0.000000000000 Eh    ::
         :::::::::::::::::::::::::::::::::::::::::::::::::::::

      ----------------------------------------------------------- 
     |                   =====================                   |
     |                        A N C O P T                        |
     |                   =====================                   |
     |               Approximate Normal Coordinate               |
     |                Rational Function Optimizer                |
      ----------------------------------------------------------- 

          ...................................................
          :                      SETUP                      :
          :.................................................:
          :   optimization level            normal          :
          :   max. optcycles                   200          :
          :   ANC micro-cycles                  20          :
          :   degrees of freedom                 9          :
          :.................................................:
          :   RF solver                   davidson          :
          :   write xtbopt.log                true          :
          :   linear?                        false          :
          :   energy convergence         0.5000000E-05 Eh   :
          :   grad. convergence          0.1000000E-02 Eh/α :
          :   maximium RF displ.         1.0000000          :
          :   Hlow (freq-cutoff)         0.1000000E-01      :
          :   Hmax (freq-cutoff)         5.0000000          :
          :   S6 in model hess.         20.0000000          :
          ...................................................

generating ANC from model Hessian ...
Using Lindh-Hessian (1995)
 Shifting diagonal of input Hessian by    0.0000000000000000     
 Lowest  eigenvalues of input Hessian
   -0.000000   -0.000000   -0.000000   -0.000000   -0.000000    0.000000
    0.019390    0.053601    0.103571    0.139478    0.614084    0.697818
    0.902300    0.958548    1.490429
 Highest eigenvalues
    0.139478    0.614084    0.697818    0.902300    0.958548    1.490429


........................................................................
.............................. CYCLE    1 ..............................
........................................................................
   1    -10.9553710 -0.109554E+02  0.634E-05    0.24       0.0  T
   2    -10.9553710  0.417407E-09  0.219E-04    0.24     204.2  T
   3    -10.9553710 -0.189976E-09  0.168E-04    0.24     265.8  T
     SCC iter.                  ...        0 min,  0.000 sec
     gradient                   ...        0 min,  0.001 sec
 * total energy  :   -10.8892178 Eh     change       -0.3435865E-08 Eh
   gradient norm :     0.2851015 Eh/α   predicted     0.0000000E+00 (-100.00%)
   displ. norm   :     0.3975968 α      lambda       -0.9944744E-01
   maximum displ.:     0.2326936 α      in ANC's #7, #5, #3, ...

........................................................................
.............................. CYCLE    2 ..............................
........................................................................
   1    -11.0304600 -0.110305E+02  0.352E+00    0.03       0.0  T
   2    -10.6720514  0.358409E+00  0.712E+00    1.09       1.0  T
   3    -11.0909090 -0.418858E+00  0.151E+00    0.26       1.0  T
   4    -11.0915275 -0.618446E-03  0.833E-01    0.16       1.0  T
   5    -11.0906546  0.872894E-03  0.544E-01    0.20       1.0  T
   6    -11.0913775 -0.722932E-03  0.279E-01    0.18       1.0  T
   7    -11.0917473 -0.369818E-03  0.191E-01    0.18       1.0  T
   8    -11.0920157 -0.268421E-03  0.481E-02    0.18       1.0  T
   9    -11.0920241 -0.835318E-05  0.944E-03    0.18       4.7  T
  10    -11.0920243 -0.185789E-06  0.556E-03    0.18       8.0  T
  11    -11.0920243 -0.513494E-07  0.727E-04    0.18      61.5  T
  12    -11.0920243 -0.501187E-09  0.438E-04    0.18     102.1  T
     SCC iter.                  ...        0 min,  0.001 sec
     gradient                   ...        0 min,  0.001 sec
 * total energy  :   -10.9770396 Eh     change       -0.8782187E-01 Eh
   gradient norm :     0.2007067 Eh/α   predicted    -0.5758422E-01 ( -34.43%)
   displ. norm   :     0.6227181 α      lambda       -0.1125400E+00
   maximum displ.:     0.4113843 α      in ANC's #7, #3, #5, ...

........................................................................
.............................. CYCLE    3 ..............................
........................................................................
   1    -11.2008031 -0.112008E+02  0.518E+00    0.09       0.0  T
   2    -10.9648657  0.235937E+00  0.692E+00    0.67       1.0  T
   3    -11.2808361 -0.315970E+00  0.200E+00    0.13       1.0  T
   4    -11.2818822 -0.104613E-02  0.126E+00    0.13       1.0  T
   5    -11.2817345  0.147749E-03  0.573E-01    0.10       1.0  T
   6    -11.2826677 -0.933184E-03  0.317E-01    0.08       1.0  T
   7    -11.2821450  0.522672E-03  0.309E-01    0.10       1.0  T
   8    -11.2828928 -0.747779E-03  0.227E-01    0.12       1.0  T
   9    -11.2829654 -0.725985E-04  0.903E-02    0.11       1.0  T
  10    -11.2829800 -0.146366E-04  0.948E-03    0.10       4.7  T
  11    -11.2829801 -0.124893E-06  0.556E-03    0.10       8.0  T
  12    -11.2829802 -0.817965E-07  0.163E-03    0.10      27.4  T
  13    -11.2829802 -0.734349E-08  0.361E-04    0.10     123.9  T
  14    -11.2829802 -0.250093E-09  0.172E-04    0.10     259.7  T
     SCC iter.                  ...        0 min,  0.001 sec
     gradient                   ...        0 min,  0.002 sec
 * total energy  :   -11.0202786 Eh     change       -0.4323896E-01 Eh
   gradient norm :     0.2506460 Eh/α   predicted    -0.7809026E-01 (  80.60%)
   displ. norm   :     0.5681135 α      lambda       -0.6756877E-01
   maximum displ.:     0.4295184 α      in ANC's #1, #3, #9, ...

........................................................................
.............................. CYCLE    4 ..............................
........................................................................
   1    -11.2010643 -0.112011E+02  0.219E+00    0.24       0.0  T
   2    -11.1849686  0.160957E-01  0.178E+00    0.08       1.0  T
   3    -11.1917666 -0.679807E-02  0.176E+00    0.38       1.0  T
   4    -11.2061459 -0.143793E-01  0.532E-01    0.23       1.0  T
   5    -11.2067252 -0.579278E-03  0.274E-01    0.24       1.0  T
   6    -11.2067773 -0.521303E-04  0.207E-01    0.23       1.0  T
   7    -11.2066296  0.147727E-03  0.152E-01    0.21       1.0  T
   8    -11.2068776 -0.248051E-03  0.251E-02    0.21       1.8  T
   9    -11.2068794 -0.177327E-05  0.288E-03    0.21      15.5  T
  10    -11.2068794 -0.472649E-08  0.599E-04    0.21      74.7  T
  11    -11.2068794 -0.780986E-09  0.363E-04    0.21     123.3  T
     SCC iter.                  ...        0 min,  0.001 sec
     gradient                   ...        0 min,  0.001 sec
 * total energy  :   -11.0503371 Eh     change       -0.3005853E-01 Eh
   gradient norm :     0.0914241 Eh/α   predicted    -0.4468840E-01 (  48.67%)
   displ. norm   :     0.3827037 α      lambda       -0.1399193E-01
   maximum displ.:     0.3517018 α      in ANC's #1, #7, #5, ...

........................................................................
.............................. CYCLE    5 ..............................
........................................................................
   1    -11.2260121 -0.112260E+02  0.217E+00    0.06       0.0  T
   2    -11.2106823  0.153298E-01  0.203E+00    0.34       1.0  T
   3    -11.2260182 -0.153360E-01  0.121E+00    0.08       1.0  T
   4    -11.2313775 -0.535929E-02  0.529E-01    0.17       1.0  T
   5    -11.2322597 -0.882239E-03  0.270E-01    0.16       1.0  T
   6    -11.2322878 -0.280942E-04  0.128E-01    0.13       1.0  T
   7    -11.2323873 -0.994304E-04  0.661E-02    0.14       1.0  T
   8    -11.2324019 -0.146348E-04  0.759E-03    0.14       5.9  T
   9    -11.2324019 -0.193352E-07  0.181E-03    0.14      24.6  T
  10    -11.2324019 -0.204661E-08  0.123E-03    0.14      36.3  T
  11    -11.2324019 -0.284804E-08  0.428E-04    0.14     104.5  T
  12    -11.2324019 -0.660403E-09  0.772E-05    0.14     579.5  T
     SCC iter.                  ...        0 min,  0.001 sec
     gradient                   ...        0 min,  0.001 sec
 * total energy  :   -11.0589817 Eh     change       -0.8644607E-02 Eh
   gradient norm :     0.0823941 Eh/α   predicted    -0.8020606E-02 (  -7.22%)
   displ. norm   :     0.2529862 α      lambda       -0.1079953E-01
   maximum displ.:     0.1740981 α      in ANC's #7, #3, #5, ...

........................................................................
.............................. CYCLE    6 ..............................
........................................................................
   1    -11.2567211 -0.112567E+02  0.122E+00    0.13       0.0  T
   2    -11.2555001  0.122098E-02  0.841E-01    0.20       1.0  T
   3    -11.2508000  0.470013E-02  0.115E+00    0.07       1.0  T
   4    -11.2573128 -0.651286E-02  0.221E-01    0.16       1.0  T
   5    -11.2574060 -0.931783E-04  0.134E-01    0.16       1.0  T
   6    -11.2574012  0.478312E-05  0.108E-01    0.16       1.0  T
   7    -11.2572355  0.165705E-03  0.133E-01    0.16       1.0  T
   8    -11.2574145 -0.179012E-03  0.638E-03    0.15       7.0  T
   9    -11.2574145 -0.742757E-08  0.146E-03    0.15      30.5  T
  10    -11.2574145 -0.119566E-08  0.228E-04    0.15     195.9  T
  11    -11.2574145 -0.633769E-10  0.136E-04    0.15     329.6  T
     SCC iter.                  ...        0 min,  0.001 sec
     gradient                   ...        0 min,  0.001 sec
 * total energy  :   -11.0661315 Eh     change       -0.7149799E-02 Eh
   gradient norm :     0.0212027 Eh/α   predicted    -0.5745358E-02 ( -19.64%)
   displ. norm   :     0.3536036 α      lambda       -0.4334724E-02
   maximum displ.:     0.2711569 α      in ANC's #1, #7, #3, ...

........................................................................
.............................. CYCLE    7 ..............................
........................................................................
   1    -11.2452197 -0.112452E+02  0.127E+00    0.20       0.0  T
   2    -11.2446862  0.533491E-03  0.803E-01    0.16       1.0  T
   3    -11.2394137  0.527248E-02  0.951E-01    0.27       1.0  T
   4    -11.2455685 -0.615475E-02  0.818E-02    0.19       1.0  T
   5    -11.2455718 -0.328770E-05  0.494E-02    0.19       1.0  T
   6    -11.2455474  0.243281E-04  0.479E-02    0.18       1.0  T
   7    -11.2455730 -0.256016E-04  0.336E-03    0.18      13.3  T
   8    -11.2455731 -0.490806E-07  0.207E-03    0.18      21.6  T
   9    -11.2455731 -0.340861E-08  0.167E-04    0.18     268.4  T
  10    -11.2455731 -0.185292E-10  0.914E-05    0.18     489.5  T
     SCC iter.                  ...        0 min,  0.001 sec
     gradient                   ...        0 min,  0.001 sec
 * total energy  :   -11.0681004 Eh     change       -0.1968870E-02 Eh
   gradient norm :     0.0448564 Eh/α   predicted    -0.2438354E-02 (  23.85%)
   displ. norm   :     0.1368907 α      lambda       -0.3846381E-02
   maximum displ.:     0.1085451 α      in ANC's #7, #5, #1, ...

........................................................................
.............................. CYCLE    8 ..............................
........................................................................
   1    -11.2718197 -0.112718E+02  0.922E-01    0.15       0.0  T
   2    -11.2702354  0.158430E-02  0.726E-01    0.24       1.0  T
   3    -11.2714494 -0.121399E-02  0.568E-01    0.14       1.0  T
   4    -11.2728276 -0.137820E-02  0.720E-02    0.18       1.0  T
   5    -11.2728296 -0.202669E-05  0.541E-02    0.18       1.0  T
   6    -11.2727929  0.367261E-04  0.605E-02    0.18       1.0  T
   7    -11.2728178 -0.248855E-04  0.344E-02    0.18       1.3  T
   8    -11.2728301 -0.123711E-04  0.465E-03    0.18       9.6  T
   9    -11.2728302 -0.449948E-07  0.378E-04    0.18     118.4  T
  10    -11.2728302 -0.180792E-09  0.165E-04    0.18     270.6  T
     SCC iter.                  ...        0 min,  0.001 sec
     gradient                   ...        0 min,  0.002 sec
 * total energy  :   -11.0700436 Eh     change       -0.1943203E-02 Eh
   gradient norm :     0.0131937 Eh/α   predicted    -0.1959230E-02 (   0.82%)
   displ. norm   :     0.1343173 α      lambda       -0.6565144E-03
   maximum displ.:     0.0936161 α      in ANC's #1, #7, #5, ...

........................................................................
.............................. CYCLE    9 ..............................
........................................................................
   1    -11.2685098 -0.112685E+02  0.504E-01    0.22       0.0  T
   2    -11.2683740  0.135782E-03  0.346E-01    0.19       1.0  T
   3    -11.2678492  0.524812E-03  0.348E-01    0.24       1.0  T
   4    -11.2686075 -0.758342E-03  0.253E-02    0.21       1.8  T
   5    -11.2686074  0.161896E-06  0.154E-02    0.21       2.9  T
   6    -11.2685958  0.115785E-04  0.333E-02    0.21       1.3  T
   7    -11.2686079 -0.121232E-04  0.391E-03    0.21      11.4  T
   8    -11.2686080 -0.152209E-06  0.562E-04    0.21      79.5  T
   9    -11.2686080 -0.129839E-09  0.213E-05    0.21    2099.4  T
     SCC iter.                  ...        0 min,  0.001 sec
     gradient                   ...        0 min,  0.001 sec
 * total energy  :   -11.0704414 Eh     change       -0.3977855E-03 Eh
   gradient norm :     0.0125677 Eh/α   predicted    -0.3341791E-03 ( -15.99%)
   displ. norm   :     0.0501320 α      lambda       -0.2532510E-03
   maximum displ.:     0.0364727 α      in ANC's #5, #1, #7, ...

........................................................................
.............................. CYCLE   10 ..............................
........................................................................
   1    -11.2706388 -0.112706E+02  0.176E-01    0.24       0.0  T
   2    -11.2706354  0.343339E-05  0.115E-01    0.23       1.0  T
   3    -11.2705500  0.853857E-04  0.112E-01    0.25       1.0  T
   4    -11.2706428 -0.927508E-04  0.121E-02    0.24       3.7  T
   5    -11.2706415  0.129103E-05  0.142E-02    0.24       3.1  T
   6    -11.2706430 -0.148423E-05  0.784E-03    0.24       5.7  T
   7    -11.2706435 -0.504885E-06  0.712E-04    0.24      62.8  T
   8    -11.2706435 -0.900203E-09  0.258E-04    0.24     173.2  T
     SCC iter.                  ...        0 min,  0.001 sec
     gradient                   ...        0 min,  0.001 sec
 * total energy  :   -11.0706364 Eh     change       -0.1950469E-03 Eh
   gradient norm :     0.0075056 Eh/α   predicted    -0.1269429E-03 ( -34.92%)
   displ. norm   :     0.0771197 α      lambda       -0.3509561E-03
   maximum displ.:     0.0516327 α      in ANC's #5, #1, #3, ...

........................................................................
.............................. CYCLE   11 ..............................
........................................................................
   1    -11.2742001 -0.112742E+02  0.251E-01    0.29       0.0  T
   2    -11.2742019 -0.171713E-05  0.151E-01    0.29       1.0  T
   3    -11.2741872  0.146414E-04  0.408E-02    0.29       1.1  T
   4    -11.2741783  0.888839E-05  0.482E-02    0.29       1.0  T
   5    -11.2742023 -0.240240E-04  0.104E-02    0.29       4.3  T
   6    -11.2742024 -0.505325E-07  0.759E-03    0.29       5.9  T
   7    -11.2742028 -0.385248E-06  0.822E-04    0.29      54.4  T
   8    -11.2742028 -0.141739E-09  0.352E-04    0.29     127.2  T
     SCC iter.                  ...        0 min,  0.001 sec
     gradient                   ...        0 min,  0.001 sec
 * total energy  :   -11.0708575 Eh     change       -0.2210945E-03 Eh
   gradient norm :     0.0060958 Eh/α   predicted    -0.1765228E-03 ( -20.16%)
   displ. norm   :     0.0366440 α      lambda       -0.1162607E-03
   maximum displ.:     0.0220335 α      in ANC's #7, #3, #5, ...

........................................................................
.............................. CYCLE   12 ..............................
........................................................................
   1    -11.2749918 -0.112750E+02  0.179E-01    0.32       0.0  T
   2    -11.2749879  0.393033E-05  0.104E-01    0.31       1.0  T
   3    -11.2747254  0.262435E-03  0.164E-01    0.32       1.0  T
   4    -11.2749310 -0.205618E-03  0.792E-02    0.32       1.0  T
   5    -11.2749971 -0.660873E-04  0.844E-03    0.32       5.3  T
   6    -11.2749972 -0.787853E-07  0.337E-03    0.32      13.3  T
   7    -11.2749972 -0.325747E-07  0.531E-04    0.32      84.3  T
   8    -11.2749972 -0.975360E-09  0.236E-04    0.32     189.3  T
     SCC iter.                  ...        0 min,  0.001 sec
     gradient                   ...        0 min,  0.002 sec
 * total energy  :   -11.0709351 Eh     change       -0.7755958E-04 Eh
   gradient norm :     0.0035852 Eh/α   predicted    -0.5820870E-04 ( -24.95%)
   displ. norm   :     0.0479212 α      lambda       -0.8497210E-04
   maximum displ.:     0.0284793 α      in ANC's #1, #3, #7, ...

........................................................................
.............................. CYCLE   13 ..............................
........................................................................
   1    -11.2734125 -0.112734E+02  0.216E-01    0.34       0.0  T
   2    -11.2732956  0.116941E-03  0.163E-01    0.33       1.0  T
   3    -11.2722715  0.102403E-02  0.334E-01    0.34       1.0  T
   4    -11.2733394 -0.106786E-02  0.103E-01    0.34       1.0  T
   5    -11.2734305 -0.911277E-04  0.101E-02    0.33       4.4  T
   6    -11.2734305  0.602249E-07  0.682E-03    0.33       6.6  T
   7    -11.2734306 -0.179924E-06  0.969E-04    0.33      46.1  T
   8    -11.2734306 -0.803720E-09  0.448E-04    0.33      99.8  T
     SCC iter.                  ...        0 min,  0.001 sec
     gradient                   ...        0 min,  0.001 sec
 * total energy  :   -11.0709724 Eh     change       -0.3727324E-04 Eh
   gradient norm :     0.0057605 Eh/α   predicted    -0.4258403E-04 (  14.25%)
   displ. norm   :     0.0386802 α      lambda       -0.7699970E-04
   maximum displ.:     0.0227686 α      in ANC's #7, #3, #4, ...

........................................................................
.............................. CYCLE   14 ..............................
........................................................................
   1    -11.2721792 -0.112722E+02  0.202E-01    0.34       0.0  T
   2    -11.2713661  0.813076E-03  0.296E-01    0.33       1.0  T
   3    -11.2718774 -0.511320E-03  0.205E-01    0.34       1.0  T
   4    -11.2722142 -0.336820E-03  0.611E-02    0.34       1.0  T
   5    -11.2722393 -0.251190E-04  0.159E-02    0.33       2.8  T
   6    -11.2722402 -0.842093E-06  0.898E-03    0.34       5.0  T
   7    -11.2722405 -0.309453E-06  0.150E-03    0.34      29.8  T
   8    -11.2722405 -0.714857E-08  0.740E-04    0.34      60.4  T
   9    -11.2722405 -0.270474E-08  0.197E-04    0.34     227.3  T
     SCC iter.                  ...        0 min,  0.001 sec
     gradient                   ...        0 min,  0.002 sec
 * total energy  :   -11.0709566 Eh     change        0.1578124E-04 Eh
   gradient norm :     0.0092715 Eh/α   predicted    -0.3855718E-04 (-344.32%)
   displ. norm   :     0.0268046 α      lambda       -0.9409289E-04
   maximum displ.:     0.0189562 α      in ANC's #1, #5, #4, ...

........................................................................
.............................. CYCLE   15 ..............................
........................................................................
   1    -11.2736376 -0.112736E+02  0.113E-01    0.32       0.0  T
   2    -11.2732463  0.391309E-03  0.201E-01    0.32       1.0  T
   3    -11.2735826 -0.336290E-03  0.103E-01    0.32       1.0  T
   4    -11.2736486 -0.660263E-04  0.544E-02    0.32       1.0  T
   5    -11.2736684 -0.198349E-04  0.894E-03    0.32       5.0  T
   6    -11.2736686 -0.159885E-06  0.525E-03    0.32       8.5  T
   7    -11.2736687 -0.968058E-07  0.848E-04    0.32      52.8  T
   8    -11.2736687 -0.170846E-08  0.509E-04    0.32      87.8  T
     SCC iter.                  ...        0 min,  0.001 sec
     gradient                   ...        0 min,  0.001 sec
 * total energy  :   -11.0710044 Eh     change       -0.4786112E-04 Eh
   gradient norm :     0.0014514 Eh/α   predicted    -0.4707966E-04 (  -1.63%)
   displ. norm   :     0.0242100 α      lambda       -0.1164567E-04
   maximum displ.:     0.0195124 α      in ANC's #1, #7, #5, ...

........................................................................
.............................. CYCLE   16 ..............................
........................................................................
   1    -11.2733212 -0.112733E+02  0.106E-01    0.32       0.0  T
   2    -11.2733196  0.160997E-05  0.618E-02    0.32       1.0  T
   3    -11.2731523  0.167305E-03  0.125E-01    0.32       1.0  T
   4    -11.2733209 -0.168571E-03  0.109E-02    0.32       4.1  T
   5    -11.2733218 -0.873193E-06  0.453E-03    0.32       9.9  T
   6    -11.2733218 -0.257162E-07  0.300E-03    0.32      14.9  T
   7    -11.2733218 -0.473173E-07  0.228E-04    0.32     196.1  T
   8    -11.2733218 -0.359002E-10  0.138E-04    0.32     323.6  T
     SCC iter.                  ...        0 min,  0.001 sec
     gradient                   ...        0 min,  0.001 sec
 * total energy  :   -11.0710127 Eh     change       -0.8259690E-05 Eh
   gradient norm :     0.0033378 Eh/α   predicted    -0.5826015E-05 ( -29.46%)
   displ. norm   :     0.0107095 α      lambda       -0.8529592E-05
   maximum displ.:     0.0081136 α      in ANC's #1, #3, #9, ...

........................................................................
.............................. CYCLE   17 ..............................
........................................................................
   1    -11.2735400 -0.112735E+02  0.549E-02    0.32       0.0  T
   2    -11.2735396  0.464685E-06  0.316E-02    0.32       1.4  T
   3    -11.2734894  0.501796E-04  0.679E-02    0.32       1.0  T
   4    -11.2735402 -0.508333E-04  0.289E-03    0.32      15.5  T
   5    -11.2735402  0.308514E-08  0.293E-03    0.32      15.3  T
   6    -11.2735402 -0.318747E-07  0.889E-04    0.32      50.3  T
   7    -11.2735402 -0.550875E-08  0.166E-04    0.32     269.2  T
     SCC iter.                  ...        0 min,  0.001 sec
     gradient                   ...        0 min,  0.002 sec
 * total energy  :   -11.0710192 Eh     change       -0.6535135E-05 Eh
   gradient norm :     0.0018971 Eh/α   predicted    -0.4266872E-05 ( -34.71%)
   displ. norm   :     0.0206933 α      lambda       -0.5934465E-05
   maximum displ.:     0.0165903 α      in ANC's #1, #3, #9, ...

........................................................................
.............................. CYCLE   18 ..............................
........................................................................
   1    -11.2742600 -0.112743E+02  0.104E-01    0.31       0.0  T
   2    -11.2742589  0.109969E-05  0.593E-02    0.32       1.0  T
   3    -11.2741269  0.131921E-03  0.111E-01    0.31       1.0  T
   4    -11.2742597 -0.132798E-03  0.118E-02    0.31       3.8  T
   5    -11.2742606 -0.895685E-06  0.392E-03    0.32      11.4  T
   6    -11.2742606  0.301172E-07  0.342E-03    0.32      13.1  T
   7    -11.2742607 -0.542418E-07  0.306E-04    0.32     146.4  T
   8    -11.2742607 -0.957101E-10  0.157E-04    0.32     284.5  T
     SCC iter.                  ...        0 min,  0.001 sec
     gradient                   ...        0 min,  0.001 sec
 * total energy  :   -11.0710218 Eh     change       -0.2548723E-05 Eh
   gradient norm :     0.0008504 Eh/α   predicted    -0.2966118E-05 (  16.38%)
   displ. norm   :     0.0052715 α      lambda       -0.7773393E-06
   maximum displ.:     0.0039937 α      in ANC's #1, #3, #9, ...

   *** GEOMETRY OPTIMIZATION CONVERGED AFTER 18 ITERATIONS ***

------------------------------------------------------------------------
 total energy gain   :        -0.1818040 Eh     -114.0837 kcal/mol
 total RMSD          :         1.1332649 a0        0.5997 Å
 total power (kW/mol):       -26.5181333 (step)-6951.4247 (real)
------------------------------------------------------------------------

 ANCopt (total)                0 d,  0 h,  0 min,  0.069 sec
 optimizer setup                ...        0 min,  0.000 sec (  0.194%)
 model hessian                  ...        0 min,  0.000 sec (  0.128%)
 ANC generation                 ...        0 min,  0.000 sec (  0.060%)
 coordinate transformation      ...        0 min,  0.000 sec (  0.073%)
 single point calculation       ...        0 min,  0.067 sec ( 97.534%)
 optimization log               ...        0 min,  0.000 sec (  0.618%)
 hessian update                 ...        0 min,  0.000 sec (  0.047%)
 rational function              ...        0 min,  0.000 sec (  0.685%)

================
 final structure:
================
5
 xtb: 6.2.2 (9d81278992624c895f80dd42a50cac0aa55982e2)
C        -1.95502335981401   -0.51218764415623   -0.07974033709805
C        -0.79187307444277    0.00231548203904   -0.00975222191448
C         0.79176015988161   -0.01054209910324    0.01017366243465
N         0.00708399687994    1.06444870478140    0.10931681634254
C         1.94805227749523   -0.54403444356099   -0.02999791976466

 Bond Distances (Angstroems)
 ---------------------------
C1-C2=1.2738         C2-C1=1.2738         C2-C3=1.5838         C2-N4=1.3344         C3-C2=1.5838         C3-N4=1.3346         
C3-C5=1.2741         N4-C2=1.3344         N4-C3=1.3346         C5-C3=1.2741         
 C  C  Rav=1.3772 sigma=0.1461  Rmin=1.2738  Rmax=1.5838     3
 N  C  Rav=1.3345 sigma=0.0001  Rmin=1.3344  Rmax=1.3346     2

 selected bond angles (degree)
 --------------------
C3-C2-C1=155.57                N4-C2-C1=150.83                N4-C2-C3= 53.61                N4-C3-C2= 53.60                
C5-C3-C2=155.57                C5-C3-N4=150.84                C3-N4-C2= 72.80                

 selected dihedral angles (degree)
 ---------------------------------
N4-C3-C2-C1=179.79            C5-C3-C2-C1=359.93            C5-C3-C2-N4=180.14            C3-N4-C2-C1=180.17            
C2-N4-C3-C5=179.88            
           -------------------------------------------------
          |                Final Singlepoint                |
           -------------------------------------------------

          ...................................................
          :                      SETUP                      :
          :.................................................:
          :  # basis functions                  20          :
          :  # atomic orbitals                  20          :
          :  # shells                           10          :
          :  # electrons                        21          :
          :  max. iterations                   250          :
          :  Hamiltonian                  GFN2-xTB          :
          :  restarted?                      false          :
          :  GBSA solvation                  false          :
          :  PC potential                    false          :
          :  electronic temp.          300.0000000     K    :
          :  accuracy                    1.0000000          :
          :  -> integral cutoff          0.2500000E+02      :
          :  -> integral neglect         0.1000000E-07      :
          :  -> SCF convergence          0.1000000E-05 Eh   :
          :  -> wf. convergence          0.1000000E-03 e    :
          :  Broyden damping             0.4000000          :
          ...................................................

 iter      E             dE          RMSdq      gap      omega  full diag
   1    -11.2742607 -0.112743E+02  0.458E-05    0.32       0.0  T
   2    -11.2742607  0.347811E-11  0.382E-05    0.32    1172.1  T
   3    -11.2742607  0.102336E-10  0.421E-05    0.32    1063.4  T

   *** convergence criteria satisfied after 3 iterations ***

         #    Occupation            Energy/Eh            Energy/eV
      -------------------------------------------------------------
         1        2.0000           -0.7550651             -20.5464
       ...           ...                  ...                  ...
         5        2.0000           -0.5961970             -16.2233
         6        2.0000           -0.5922056             -16.1147
         7        2.0000           -0.4879605             -13.2781
         8        2.0000           -0.4792265             -13.0404
         9        2.0000           -0.4770605             -12.9815
        10        2.0000           -0.4689879             -12.7618
        11        0.9978           -0.4272374             -11.6257 (HOMO)
        12        0.0022           -0.4156518             -11.3105 (LUMO)
        13                         -0.3204747              -8.7206
        14                         -0.2419743              -6.5845
        15                         -0.2221091              -6.0439
        16                         -0.0853891              -2.3236
       ...                                ...                  ...
        20                          0.8539888              23.2382
      -------------------------------------------------------------
                  HL-Gap            0.0115856 Eh            0.3153 eV
             Fermi-level           -0.4347785 Eh          -11.8309 eV

 SCC (total)                   0 d,  0 h,  0 min,  0.003 sec
 SCC setup                      ...        0 min,  0.000 sec (  2.010%)
 Dispersion                     ...        0 min,  0.000 sec (  0.400%)
 integral evaluation            ...        0 min,  0.001 sec ( 40.971%)
 zeroth order Hamiltonian       ...        0 min,  0.000 sec (  0.472%)
 iterations                     ...        0 min,  0.000 sec ( 11.892%)
 molecular gradient             ...        0 min,  0.001 sec ( 42.420%)
 printout                       ...        0 min,  0.000 sec (  1.546%)

         :::::::::::::::::::::::::::::::::::::::::::::::::::::
         ::                     SUMMARY                     ::
         :::::::::::::::::::::::::::::::::::::::::::::::::::::
         :: total energy             -11.071021778131 Eh    ::
         :: gradient norm              0.000880451626 Eh/a0 ::
         :: HOMO-LUMO gap              0.315258944214 eV    ::
         ::.................................................::
         :: SCC energy               -11.274260654549 Eh    ::
         :: -> isotropic ES           -0.012504563071 Eh    ::
         :: -> anisotropic ES          0.003490730138 Eh    ::
         :: -> anisotropic XC          0.013196092448 Eh    ::
         :: -> dispersion             -0.002908776547 Eh    ::
         :: repulsion energy           0.203238848102 Eh    ::
         :: add. restraining           0.000000000000 Eh    ::
         :::::::::::::::::::::::::::::::::::::::::::::::::::::

           ------------------------------------------------- 
          |                Numerical Hessian                |
           ------------------------------------------------- 
step length          :   0.00500
SCC accuracy         :   0.30000
Hessian scale factor :   1.00000
frozen atoms in %    :   0.00000    0
RMS gradient         :   0.00088
estimated CPU  time      0.00 min
estimated wall time      0.00 min

writing file <hessian>.

 projected vibrational frequencies (cm-1)
eigval :       -0.00    -0.00    -0.00     0.00     0.00     0.00
eigval :      175.09   268.35   298.21   330.52   543.52   906.00
eigval :     1187.47  1588.62  1863.02
           -------------------------------------------------
          |                Property Printout                |
           -------------------------------------------------

    * Orbital Energies and Occupations

         #    Occupation            Energy/Eh            Energy/eV
      -------------------------------------------------------------
         1        2.0000           -0.7550652             -20.5464
         2        2.0000           -0.7009071             -19.0727
         3        2.0000           -0.6836128             -18.6021
         4        2.0000           -0.6034217             -16.4199
         5        2.0000           -0.5961971             -16.2233
         6        2.0000           -0.5922057             -16.1147
         7        2.0000           -0.4879605             -13.2781
         8        2.0000           -0.4792264             -13.0404
         9        2.0000           -0.4770605             -12.9815
        10        2.0000           -0.4689878             -12.7618
        11        0.9978           -0.4272373             -11.6257 (HOMO)
        12        0.0022           -0.4156518             -11.3105 (LUMO)
        13                         -0.3204746              -8.7206
        14                         -0.2419743              -6.5845
        15                         -0.2221091              -6.0439
        16                         -0.0853892              -2.3236
        17                          0.1072635               2.9188
        18                          0.1907662               5.1910
        19                          0.7778129              21.1654
        20                          0.8539888              23.2382
      -------------------------------------------------------------
                  HL-Gap            0.0115856 Eh            0.3153 eV
             Fermi-level           -0.4347785 Eh          -11.8309 eV

     #   Z        covCN         q      C6AA      α(0)
     1   6 C      0.982    -0.118    39.692    10.582
     2   6 C      2.858     0.158    24.578     8.126
     3   6 C      2.858     0.158    24.579     8.126
     4   7 N      1.822    -0.081    23.559     7.192
     5   6 C      0.982    -0.118    39.692    10.582

 Mol. C6AA /au·bohr⁶  :        747.687970
 Mol. C8AA /au·bohr⁸  :      20666.888874
 Mol. α(0) /au        :         44.608262


Wiberg/Mayer (AO) data.
largest (>0.10) Wiberg bond orders for each atom
          total WBO             WBO to atom ...
     1  C   2.513        C    2 1.969    C    5 0.237    N    4 0.159    C    3 0.149
     2  C   3.870        C    1 1.969    N    4 1.199    C    3 0.553    C    5 0.149
     3  C   3.870        C    5 1.969    N    4 1.199    C    2 0.553    C    1 0.149
     4  N   2.716        C    2 1.199    C    3 1.199    C    1 0.159    C    5 0.159
     5  C   2.513        C    3 1.969    C    1 0.237    N    4 0.159    C    2 0.149

MOs/occ written to file <molden.input>


molecular dipole:
                 x           y           z       tot (Debye)
 q only:        0.000       0.069       0.008
   full:        0.000       0.039       0.006       0.099
molecular quadrupole (traceless):
                xx          xy          yy          xz          yz          zz
 q only:       -2.204       0.025       0.685      -0.048      -0.087       1.519
  q+dip:       -5.618       0.065       1.968      -0.120      -0.174       3.650
   full:       -8.120       0.094       2.980      -0.171      -0.225       5.140

           -------------------------------------------------
          |                Geometry Summary                 |
           -------------------------------------------------
Molecule has the following symmetry elements: (C2) 2*(sigma) 
It seems to be the C2v point group

      molecular mass/u    :       62.0496468
   center of mass at/Å    :        0.0002281       0.0342404       0.0035164
  moments of inertia/u·Å² :        0.2273751E+02   0.1065709E+03   0.1293084E+03
rotational constants/cm⁻¹ :        0.7414017E+00   0.1581823E+00   0.1303676E+00

 * 4 selected distances

     #   Z        #   Z                                     value/Å
     1   6 C      2   6 C                                 1.2737858 (min)
     2   6 C      4   7 N                                 1.3344050
     3   6 C      4   7 N                                 1.3345978 (max)
     3   6 C      5   6 C                                 1.2740641

 * 2 distinct bonds (by element types)

   Z      Z             #   av. dist./Å        max./Å        min./Å
   6 C    6 C           2     1.2739250     1.2740641     1.2737858
   6 C    7 N           2     1.3345014     1.3345978     1.3344050

           -------------------------------------------------
          |               Frequency Printout                |
           -------------------------------------------------
 projected vibrational frequencies (cm-1)
eigval :       -0.00    -0.00    -0.00     0.00     0.00     0.00
eigval :      175.09   268.35   298.21   330.52   543.52   906.00
eigval :     1187.47  1588.62  1863.02
 reduced masses (amu)
   1: 12.65   2: 12.61   3: 12.23   4: 12.02   5: 12.07   6: 13.38   7: 12.29   8: 12.24
   9: 12.27  10: 12.01  11: 12.09  12: 13.06  13: 12.98  14: 12.01  15: 12.24
 IR intensities (amu)
   1:  0.02   2:  0.06   3:  0.01   4:  0.01   5:  0.01   6:  0.01   7:  0.44   8:  0.74
   9:  0.06  10:  0.02  11:  0.00  12:  0.77  13:  0.02  14:  0.58  15:  0.86
 Raman intensities (amu)
   1:  0.00   2:  0.00   3:  0.00   4:  0.00   5:  0.00   6:  0.00   7:  0.00   8:  0.00
   9:  0.00  10:  0.00  11:  0.00  12:  0.00  13:  0.00  14:  0.00  15:  0.00
 output can be read by thermo (or use thermo option).
 writing <g98.out> molden fake output.
 recommended (thermochemical) frequency scaling factor: 1.0
           -------------------------------------------------
          |             Thermodynamic Functions             |
           -------------------------------------------------

c2v symmetry found (for desy threshold:  0.10E+00) used in thermo

          ...................................................
          :                      SETUP                      :
          :.................................................:
          :  # frequencies                           9      :
          :  # imaginary freq.                       0      :
          :  linear?                             false      :
          :  only rotor calc.                    false      :
          :  symmetry                              c2v      :
          :  rotational number                       2      :
          :  scaling factor                  1.0000000      :
          :  rotor cutoff                   50.0000000 cm⁻¹ :
          :  imag. cutoff                  -20.0000000 cm⁻¹ :
          :.................................................:

    mode    ω/cm⁻¹     T·S(HO)/kcal·mol⁻¹    T·S(FR)/kcal·mol⁻¹   T·S(vib)
   ------------------------------------------------------------------------
       1    175.09    -0.00000 ( 99.34%)     0.01076 (  0.66%)     0.00007
       2    268.35    -0.00000 ( 99.88%)     0.01500 (  0.12%)     0.00002
       3    298.21    -0.00000 ( 99.92%)     0.01605 (  0.08%)     0.00001
   ------------------------------------------------------------------------

   temp. (K)  partition function   enthalpy   heat capacity  entropy
                                   cal/mol     cal/K/mol   cal/K/mol   J/K/mol
 298.15  VIB   4.35                 1340.721      8.830      7.420
         ROT  0.214E+05              888.752      2.981     22.794
         INT  0.931E+05             2229.473     11.811     30.214
         TR   0.473E+27             1481.254      4.968     38.278
         TOT                        3710.7271    16.7790    68.4925   286.5727

   temp. (K)  partition function   enthalpy   heat capacity  entropy
                                   cal/mol     cal/K/mol   cal/K/mol   J/K/mol
 120.00  VIB   1.25                  147.159      3.787      1.670
         ROT  0.546E+04              357.707      2.981     20.081
         INT  0.681E+04              504.866      6.768     21.751
         TR   0.121E+27              596.178      4.968     33.759
         TOT                        1101.0436    11.7365    55.5103   232.2549

   temp. (K)  partition function   enthalpy   heat capacity  entropy
                                   cal/mol     cal/K/mol   cal/K/mol   J/K/mol
 100.00  VIB   1.14                   81.014      2.810      1.070
         ROT  0.415E+04              298.089      2.981     19.538
         INT  0.472E+04              379.103      5.791     20.608
         TR   0.919E+26              496.815      4.968     32.853
         TOT                         875.9177    10.7590    53.4613   223.6823

   temp. (K)  partition function   enthalpy   heat capacity  entropy
                                   cal/mol     cal/K/mol   cal/K/mol   J/K/mol
  80.00  VIB   1.06                   35.224      1.766      0.563
         ROT  0.297E+04              238.471      2.981     18.873
         INT  0.315E+04              273.695      4.747     19.436
         TR   0.657E+26              397.452      4.968     31.745
         TOT                         671.1474     9.7151    51.1813   214.1427

   temp. (K)  partition function   enthalpy   heat capacity  entropy
                                   cal/mol     cal/K/mol   cal/K/mol   J/K/mol
  60.00  VIB   1.02                    9.879      0.800      0.204
         ROT  0.193E+04              178.853      2.981     18.015
         INT  0.196E+04              188.733      3.781     18.219
         TR   0.427E+26              298.089      4.968     30.317
         TOT                         486.8217     8.7494    48.5362   203.0756

   temp. (K)  partition function   enthalpy   heat capacity  entropy
                                   cal/mol     cal/K/mol   cal/K/mol   J/K/mol
  40.00  VIB   1.00                    0.997      0.164      0.030
         ROT  0.105E+04              119.236      2.981     16.807
         INT  0.105E+04              120.233      3.145     16.837
         TR   0.232E+26              198.726      4.968     28.303
         TOT                         318.9591     8.1135    45.1399   188.8655

   temp. (K)  partition function   enthalpy   heat capacity  entropy
                                   cal/mol     cal/K/mol   cal/K/mol   J/K/mol
  20.00  VIB   1.00                    0.002      0.001     -0.005
         ROT   371.                   59.618      2.981     14.740
         INT   371.                   59.619      2.982     14.736
         TR   0.822E+25               99.363      4.968     24.861
         TOT                         158.9825     7.9501    39.5969   165.6735

   temp. (K)  partition function   enthalpy   heat capacity  entropy
                                   cal/mol     cal/K/mol   cal/K/mol   J/K/mol
  10.00  VIB   1.00                    0.000      0.000     -0.011
         ROT   131.                   29.809      2.981     12.674
         INT   131.                   29.809      2.981     12.663
         TR   0.290E+25               49.681      4.968     21.419
         TOT                          79.4904     7.9490    34.0823   142.6004

       T/K    H(0)-H(T)+PV         H(T)/Eh          T*S/Eh         G(T)/Eh
   ------------------------------------------------------------------------
    298.15    0.591342E-02    0.222269E-01    0.325430E-01   -0.103161E-01
    120.00    0.175462E-02    0.180681E-01    0.106153E-01    0.745277E-02
    100.00    0.139586E-02    0.177094E-01    0.851961E-02    0.918975E-02
     80.00    0.106954E-02    0.173830E-01    0.652501E-02    0.108580E-01
     60.00    0.775800E-03    0.170893E-01    0.464084E-02    0.124484E-01
     40.00    0.508294E-03    0.168218E-01    0.287740E-02    0.139444E-01
     20.00    0.253355E-03    0.165668E-01    0.126203E-02    0.153048E-01
     10.00    0.126676E-03    0.164402E-01    0.543136E-03    0.158970E-01 (used)
   ------------------------------------------------------------------------

         :::::::::::::::::::::::::::::::::::::::::::::::::::::
         ::                  THERMODYNAMIC                  ::
         :::::::::::::::::::::::::::::::::::::::::::::::::::::
         :: total free energy         -11.055124743144 Eh   ::
         ::.................................................::
         :: total energy              -11.071021777938 Eh   ::
         :: zero point energy           0.016313494907 Eh   ::
         :: G(RRHO) w/o ZPVE           -0.000416460114 Eh   ::
         :: G(RRHO) contrib.            0.015897034794 Eh   ::
         :::::::::::::::::::::::::::::::::::::::::::::::::::::

optimized geometry written to: xtbopt.xyz


           -------------------------------------------------
          | TOTAL ENERGY              -11.071021777938 Eh   |
          | TOTAL ENTHALPY            -11.054581607014 Eh   |
          | TOTAL FREE ENERGY         -11.055124743144 Eh   |
          | GRADIENT NORM               0.000881317158 Eh/α |
          | HOMO-LUMO GAP               0.315259720104 eV   |
           -------------------------------------------------

------------------------------------------------------------------------
 * finished run on 2020/05/12 at 11:44:04.044     
------------------------------------------------------------------------
 total:
 * wall-time:     0 d,  0 h,  0 min,  0.191 sec
 *  cpu-time:     0 d,  0 h,  0 min,  0.191 sec
 * ratio c/w:     0.998 speedup
 SCF:
 * wall-time:     0 d,  0 h,  0 min,  0.006 sec
 *  cpu-time:     0 d,  0 h,  0 min,  0.006 sec
 * ratio c/w:     0.998 speedup
 ANC optimizer:
 * wall-time:     0 d,  0 h,  0 min,  0.072 sec
 *  cpu-time:     0 d,  0 h,  0 min,  0.072 sec
 * ratio c/w:     0.998 speedup
 numerical hessian:
 * wall-time:     0 d,  0 h,  0 min,  0.099 sec
 *  cpu-time:     0 d,  0 h,  0 min,  0.099 sec
 * ratio c/w:     0.998 speedup

