      -----------------------------------------------------------      
     |                   =====================                   |     
     |                           x T B                           |     
     |                   =====================                   |     
     |                         S. Grimme                         |     
     |          Mulliken Center for Theoretical Chemistry        |     
     |                    University of Bonn                     |     
      -----------------------------------------------------------      

   * xtb version 6.2.2 (9d81278992624c895f80dd42a50cac0aa55982e2) compiled by '@Darwin' on 04/03/2020

   xtb is free software: you can redistribute it and/or modify it under
   the terms of the GNU Lesser General Public License as published by
   the Free Software Foundation, either version 3 of the License, or
   (at your option) any later version.
   
   xtb is distributed in the hope that it will be useful,
   but WITHOUT ANY WARRANTY; without even the implied warranty of
   MERCHANTABILITY or FITNESS FOR A PARTICULAR PURPOSE.  See the
   GNU Lesser General Public License for more details.
   
   Cite this work as:
   * S. Grimme, C. Bannwarth, P. Shushkov, J. Chem. Theory Comput., 2017,
     13, 1989-2009. DOI: 10.1021/acs.jctc.7b00118
   * C. Bannwarth, S. Ehlert and S. Grimme., J. Chem. Theory Comput., 2019,
     15, 1652-1671. DOI: 10.1021/acs.jctc.8b01176
   * P. Pracht, E. Caldeweyher, S. Ehlert, S. Grimme, ChemRxiv, 2019, preprint.
     DOI: 10.26434/chemrxiv.8326202.v1
   
   for DFT-D4:
   * E. Caldeweyher, C. Bannwarth and S. Grimme, J. Chem. Phys., 2017,
     147, 034112. DOI: 10.1063/1.4993215
   * E. Caldeweyher, S. Ehlert, A. Hansen, H. Neugebauer, S. Spicher,
     C. Bannwarth and S. Grimme, J. Chem. Phys., 2019, 150, 154122.
     DOI: 10.1063/1.5090222
   
   for sTDA-xTB:
   * S. Grimme and C. Bannwarth, J. Chem. Phys., 2016, 145, 054103.
     DOI: 10.1063/1.4959605
   
   in the mass-spec context:
   * V. Asgeirsson, C. Bauer and S. Grimme, Chem. Sci., 2017, 8, 4879.
     DOI: 10.1039/c7sc00601b
   
   for metadynamics refer to:
   * S. Grimme, J. Chem. Theory Comput., 2019, 155, 2847-2862
     DOI: 10.1021/acs.jctc.9b00143
   
   with help from (in alphabetical order)
   C. Bannwarth, F. Bohle, G. Brandenburg, E. Caldeweyher, M. Checinski,
   S. Dohm, S. Ehlert, S. Ehrlich, F. März, H. Neugebauer, J. Pisarek,
   P. Pracht, P. Shushkov, and S. Spicher.
   
 * started run on 2020/05/12 at 11:45:11.756     

           -------------------------------------------------
          |                Calculation Setup                |
           -------------------------------------------------

          program call               : xtb --input H1C4_9_S_3.input H1C4_9_S_3.xyz --ohess --molden --namespace H1C4_9_S_3 output.out
          calculation namespace      : H1C4_9_S_3
          coordinate file            : H1C4_9_S_3.xyz
          number of atoms            :                     5
          number of electrons        :                    17
          charge                     :                     0
          spin                       :                   1.5
          first test random number   :      0.31847060777655

   ID    Z sym.   atoms
    1    6 C      1-4
    2    1 H      5

           -------------------------------------------------
          |                 G F N 2 - x T B                 |
           -------------------------------------------------

        Reference                      10.1021/acs.jctc.8b01176
      * Hamiltonian:
        H0-scaling (s, p, d)           1.850000    2.230000    2.230000
        zeta-weighting                 0.500000
      * Dispersion:
        s8                             2.700000
        a1                             0.520000
        a2                             5.000000
        s9                             5.000000
      * Repulsion:
        kExp                           1.500000    1.000000
        rExp                           1.000000
      * Coulomb:
        alpha                          2.000000
        third order                    shell-resolved
        anisotropic                    true
        a3                             3.000000
        a5                             4.000000
        cn-shift                       1.200000
        cn-exp                         4.000000
        max-rad                        5.000000


          ...................................................
          :                      SETUP                      :
          :.................................................:
          :  # basis functions                  17          :
          :  # atomic orbitals                  17          :
          :  # shells                            9          :
          :  # electrons                        17          :
          :  max. iterations                   250          :
          :  Hamiltonian                  GFN2-xTB          :
          :  restarted?                      false          :
          :  GBSA solvation                  false          :
          :  PC potential                    false          :
          :  electronic temp.          300.0000000     K    :
          :  accuracy                    1.0000000          :
          :  -> integral cutoff          0.2500000E+02      :
          :  -> integral neglect         0.1000000E-07      :
          :  -> SCF convergence          0.1000000E-05 Eh   :
          :  -> wf. convergence          0.1000000E-03 e    :
          :  Broyden damping             0.4000000          :
          ...................................................

 iter      E             dE          RMSdq      gap      omega  full diag
   1     -8.6597553 -0.865976E+01  0.699E+00    1.70       0.0  T
   2     -8.6601964 -0.441061E-03  0.422E+00    1.69       1.0  T
   3     -8.6564605  0.373584E-02  0.939E-01    1.76       1.0  T
   4     -8.6615082 -0.504769E-02  0.375E-01    1.71       1.0  T
   5     -8.6608926  0.615596E-03  0.363E-01    1.66       1.0  T
   6     -8.6609500 -0.573407E-04  0.286E-01    1.72       1.0  T
   7     -8.6612929 -0.342950E-03  0.184E-01    1.71       1.0  T
   8     -8.6616215 -0.328612E-03  0.615E-02    1.70       1.0  T
   9     -8.6616422 -0.206359E-04  0.183E-02    1.70       2.4  T
  10     -8.6616440 -0.186558E-05  0.487E-03    1.70       9.2  T
  11     -8.6616442 -0.128953E-06  0.279E-04    1.69     160.2  T
  12     -8.6616442 -0.108617E-09  0.153E-04    1.69     291.8  T

   *** convergence criteria satisfied after 12 iterations ***

         #    Occupation            Energy/Eh            Energy/eV
      -------------------------------------------------------------
         1        2.0000           -0.7129960             -19.4016
       ...           ...                  ...                  ...
         4        2.0000           -0.5528690             -15.0443
         5        2.0000           -0.4867413             -13.2449
         6        2.0000           -0.4807577             -13.0821
         7        2.0000           -0.4624316             -12.5834
         8        1.0000           -0.4309940             -11.7279
         9        1.0000           -0.4023166             -10.9476
        10        1.0000           -0.3613364              -9.8325 (HOMO)
        11                         -0.2990594              -8.1378 (LUMO)
        12                         -0.2295858              -6.2473
        13                          0.0056394               0.1535
        14                          0.0864934               2.3536
        15                          0.1558216               4.2401
       ...                                ...                  ...
        17                          0.1966361               5.3507
      -------------------------------------------------------------
                  HL-Gap            0.0622771 Eh            1.6946 eV
             Fermi-level           -0.3884554 Eh          -10.5704 eV

 SCC (total)                   0 d,  0 h,  0 min,  0.004 sec
 SCC setup                      ...        0 min,  0.000 sec (  2.538%)
 Dispersion                     ...        0 min,  0.000 sec (  0.446%)
 integral evaluation            ...        0 min,  0.001 sec ( 28.617%)
 zeroth order Hamiltonian       ...        0 min,  0.000 sec (  0.509%)
 iterations                     ...        0 min,  0.001 sec ( 36.093%)
 molecular gradient             ...        0 min,  0.001 sec ( 30.075%)
 printout                       ...        0 min,  0.000 sec (  1.476%)

         :::::::::::::::::::::::::::::::::::::::::::::::::::::
         ::                     SUMMARY                     ::
         :::::::::::::::::::::::::::::::::::::::::::::::::::::
         :: total energy              -8.572580716252 Eh    ::
         :: gradient norm              0.159975105058 Eh/a0 ::
         :: HOMO-LUMO gap              1.694645944974 eV    ::
         ::.................................................::
         :: SCC energy                -8.661644154932 Eh    ::
         :: -> isotropic ES           -0.009404693055 Eh    ::
         :: -> anisotropic ES          0.001383467953 Eh    ::
         :: -> anisotropic XC          0.005069994068 Eh    ::
         :: -> dispersion             -0.002082920932 Eh    ::
         :: repulsion energy           0.089063404222 Eh    ::
         :: add. restraining           0.000000000000 Eh    ::
         :::::::::::::::::::::::::::::::::::::::::::::::::::::

      ----------------------------------------------------------- 
     |                   =====================                   |
     |                        A N C O P T                        |
     |                   =====================                   |
     |               Approximate Normal Coordinate               |
     |                Rational Function Optimizer                |
      ----------------------------------------------------------- 

          ...................................................
          :                      SETUP                      :
          :.................................................:
          :   optimization level            normal          :
          :   max. optcycles                   200          :
          :   ANC micro-cycles                  20          :
          :   degrees of freedom                 9          :
          :.................................................:
          :   RF solver                   davidson          :
          :   write xtbopt.log                true          :
          :   linear?                        false          :
          :   energy convergence         0.5000000E-05 Eh   :
          :   grad. convergence          0.1000000E-02 Eh/α :
          :   maximium RF displ.         1.0000000          :
          :   Hlow (freq-cutoff)         0.1000000E-01      :
          :   Hmax (freq-cutoff)         5.0000000          :
          :   S6 in model hess.         20.0000000          :
          ...................................................

generating ANC from model Hessian ...
Using Lindh-Hessian (1995)
 Shifting diagonal of input Hessian by    0.0000000000000000     
 Lowest  eigenvalues of input Hessian
   -0.000000    0.000000    0.000000    0.000000    0.000000    0.000000
    0.072551    0.100018    0.124955    0.490856    0.572762    0.870322
    0.896774    1.224340    1.374061
 Highest eigenvalues
    0.490856    0.572762    0.870322    0.896774    1.224340    1.374061


........................................................................
.............................. CYCLE    1 ..............................
........................................................................
   1     -8.6616442 -0.866164E+01  0.389E-05    1.69       0.0  T
   2     -8.6616442  0.948575E-12  0.435E-05    1.69    1028.8  T
   3     -8.6616442 -0.968114E-11  0.140E-05    1.69    3203.4  T
     SCC iter.                  ...        0 min,  0.000 sec
     gradient                   ...        0 min,  0.001 sec
 * total energy  :    -8.5725807 Eh     change        0.1683752E-08 Eh
   gradient norm :     0.1599765 Eh/α   predicted     0.0000000E+00 (-100.00%)
   displ. norm   :     0.4879591 α      lambda       -0.6043417E-01
   maximum displ.:     0.3369794 α      in ANC's #1, #3, #5, ...

........................................................................
.............................. CYCLE    2 ..............................
........................................................................
   1     -8.7173293 -0.871733E+01  0.231E+00    2.76       0.0  T
   2     -8.7172988  0.304874E-04  0.150E+00    2.57       1.0  T
   3     -8.7158312  0.146761E-02  0.113E+00    2.74       1.0  T
   4     -8.7203927 -0.456151E-02  0.383E-01    2.69       1.0  T
   5     -8.7213248 -0.932101E-03  0.433E-02    2.67       1.0  T
   6     -8.7213255 -0.629143E-06  0.101E-02    2.67       4.4  T
   7     -8.7213229  0.251843E-05  0.160E-02    2.67       2.8  T
   8     -8.7213257 -0.274816E-05  0.327E-03    2.67      13.7  T
   9     -8.7213257 -0.434384E-07  0.628E-04    2.67      71.2  T
  10     -8.7213257 -0.265370E-09  0.383E-05    2.67    1169.1  T
     SCC iter.                  ...        0 min,  0.001 sec
     gradient                   ...        0 min,  0.001 sec
 * total energy  :    -8.6160871 Eh     change       -0.4350637E-01 Eh
   gradient norm :     0.0990941 Eh/α   predicted    -0.3741192E-01 ( -14.01%)
   displ. norm   :     0.4312593 α      lambda       -0.3610368E-01
   maximum displ.:     0.3107365 α      in ANC's #3, #5, #7, ...

........................................................................
.............................. CYCLE    3 ..............................
........................................................................
   1     -8.7720988 -0.877210E+01  0.210E+00    2.36       0.0  T
   2     -8.7734113 -0.131247E-02  0.143E+00    1.88       1.0  T
   3     -8.7776938 -0.428256E-02  0.957E-01    2.11       1.0  T
   4     -8.7795332 -0.183935E-02  0.492E-01    2.15       1.0  T
   5     -8.7806515 -0.111826E-02  0.576E-02    2.09       1.0  T
   6     -8.7806530 -0.150202E-05  0.151E-02    2.08       3.0  T
   7     -8.7806503  0.268354E-05  0.178E-02    2.09       2.5  T
   8     -8.7806530 -0.269642E-05  0.609E-03    2.09       7.3  T
   9     -8.7806532 -0.244034E-06  0.471E-04    2.09      94.9  T
  10     -8.7806532 -0.126521E-09  0.647E-05    2.09     691.3  T
     SCC iter.                  ...        0 min,  0.001 sec
     gradient                   ...        0 min,  0.001 sec
 * total energy  :    -8.6284943 Eh     change       -0.1240724E-01 Eh
   gradient norm :     0.0732861 Eh/α   predicted    -0.2140920E-01 (  72.55%)
   displ. norm   :     0.2479187 α      lambda       -0.1288074E-01
   maximum displ.:     0.2436404 α      in ANC's #1, #5, #3, ...

........................................................................
.............................. CYCLE    4 ..............................
........................................................................
   1     -8.7625128 -0.876251E+01  0.102E+00    1.77       0.0  T
   2     -8.7625110  0.179017E-05  0.645E-01    1.88       1.0  T
   3     -8.7611441  0.136690E-02  0.545E-01    1.76       1.0  T
   4     -8.7627799 -0.163579E-02  0.159E-01    1.81       1.0  T
   5     -8.7629135 -0.133561E-03  0.237E-02    1.83       1.9  T
   6     -8.7629135 -0.577141E-07  0.281E-03    1.83      15.9  T
   7     -8.7629135  0.241638E-07  0.215E-03    1.83      20.8  T
   8     -8.7629135  0.105571E-07  0.224E-03    1.83      20.0  T
   9     -8.7629135 -0.465557E-07  0.263E-04    1.83     170.1  T
  10     -8.7629135 -0.249365E-10  0.167E-05    1.83    2676.0  T
     SCC iter.                  ...        0 min,  0.001 sec
     gradient                   ...        0 min,  0.001 sec
 * total energy  :    -8.6345602 Eh     change       -0.6065904E-02 Eh
   gradient norm :     0.0204224 Eh/α   predicted    -0.6836213E-02 (  12.70%)
   displ. norm   :     0.0571265 α      lambda       -0.6799927E-03
   maximum displ.:     0.0483752 α      in ANC's #3, #7, #1, ...

........................................................................
.............................. CYCLE    5 ..............................
........................................................................
   1     -8.7654068 -0.876541E+01  0.231E-01    1.75       0.0  T
   2     -8.7653501  0.567118E-04  0.175E-01    1.71       1.0  T
   3     -8.7654301 -0.799820E-04  0.125E-01    1.74       1.0  T
   4     -8.7654816 -0.515226E-04  0.322E-02    1.74       1.4  T
   5     -8.7654865 -0.490215E-05  0.343E-03    1.73      13.0  T
   6     -8.7654865  0.159339E-07  0.174E-03    1.73      25.7  T
   7     -8.7654865  0.871856E-08  0.183E-03    1.73      24.4  T
   8     -8.7654865 -0.298131E-07  0.254E-04    1.73     175.7  T
   9     -8.7654865 -0.822400E-10  0.455E-05    1.73     982.8  T
     SCC iter.                  ...        0 min,  0.001 sec
     gradient                   ...        0 min,  0.001 sec
 * total energy  :    -8.6350563 Eh     change       -0.4960915E-03 Eh
   gradient norm :     0.0122296 Eh/α   predicted    -0.3411069E-03 ( -31.24%)
   displ. norm   :     0.0551089 α      lambda       -0.4049528E-03
   maximum displ.:     0.0417535 α      in ANC's #3, #7, #1, ...

........................................................................
.............................. CYCLE    6 ..............................
........................................................................
   1     -8.7678419 -0.876784E+01  0.224E-01    1.70       0.0  T
   2     -8.7677994  0.424654E-04  0.155E-01    1.68       1.0  T
   3     -8.7678050 -0.559253E-05  0.137E-01    1.69       1.0  T
   4     -8.7678849 -0.798969E-04  0.139E-02    1.69       3.2  T
   5     -8.7678858 -0.935349E-06  0.304E-03    1.69      14.7  T
   6     -8.7678858 -0.299507E-08  0.968E-04    1.69      46.2  T
   7     -8.7678858  0.219997E-07  0.159E-03    1.69      28.2  T
   8     -8.7678858 -0.245597E-07  0.219E-04    1.69     204.5  T
     SCC iter.                  ...        0 min,  0.001 sec
     gradient                   ...        0 min,  0.001 sec
 * total energy  :    -8.6353079 Eh     change       -0.2515859E-03 Eh
   gradient norm :     0.0067560 Eh/α   predicted    -0.2030909E-03 ( -19.28%)
   displ. norm   :     0.0239912 α      lambda       -0.1059622E-03
   maximum displ.:     0.0141978 α      in ANC's #3, #7, #5, ...

........................................................................
.............................. CYCLE    7 ..............................
........................................................................
   1     -8.7685916 -0.876859E+01  0.972E-02    1.71       0.0  T
   2     -8.7685916 -0.284731E-07  0.556E-02    1.72       1.0  T
   3     -8.7685812  0.104061E-04  0.460E-02    1.71       1.0  T
   4     -8.7685924 -0.112470E-04  0.918E-03    1.71       4.9  T
   5     -8.7685930 -0.545533E-06  0.149E-03    1.71      30.0  T
   6     -8.7685930  0.154792E-07  0.131E-03    1.71      34.2  T
   7     -8.7685930 -0.159164E-07  0.381E-04    1.71     117.4  T
   8     -8.7685930 -0.739346E-09  0.543E-05    1.71     823.5  T
     SCC iter.                  ...        0 min,  0.001 sec
     gradient                   ...        0 min,  0.001 sec
 * total energy  :    -8.6353846 Eh     change       -0.7666403E-04 Eh
   gradient norm :     0.0044643 Eh/α   predicted    -0.5301147E-04 ( -30.85%)
   displ. norm   :     0.0185442 α      lambda       -0.6574379E-04
   maximum displ.:     0.0132981 α      in ANC's #5, #7, #9, ...

........................................................................
.............................. CYCLE    8 ..............................
........................................................................
   1     -8.7690680 -0.876907E+01  0.867E-02    1.77       0.0  T
   2     -8.7690674  0.575038E-06  0.562E-02    1.78       1.0  T
   3     -8.7690592  0.818363E-05  0.474E-02    1.77       1.0  T
   4     -8.7690711 -0.119174E-04  0.132E-02    1.77       3.4  T
   5     -8.7690720 -0.875055E-06  0.162E-03    1.77      27.7  T
   6     -8.7690720  0.381837E-07  0.197E-03    1.77      22.6  T
   7     -8.7690720 -0.399275E-07  0.224E-04    1.77     199.4  T
   8     -8.7690720 -0.190703E-09  0.660E-05    1.77     677.6  T
     SCC iter.                  ...        0 min,  0.001 sec
     gradient                   ...        0 min,  0.001 sec
 * total energy  :    -8.6354230 Eh     change       -0.3838879E-04 Eh
   gradient norm :     0.0015628 Eh/α   predicted    -0.3288420E-04 ( -14.34%)
   displ. norm   :     0.0070243 α      lambda       -0.6047523E-05
   maximum displ.:     0.0054131 α      in ANC's #5, #4, #1, ...

........................................................................
.............................. CYCLE    9 ..............................
........................................................................
   1     -8.7690441 -0.876904E+01  0.408E-02    1.79       0.0  T
   2     -8.7690418  0.228134E-05  0.342E-02    1.79       1.3  T
   3     -8.7690453 -0.356304E-05  0.205E-02    1.79       2.2  T
   4     -8.7690465 -0.115872E-05  0.263E-03    1.79      17.0  T
   5     -8.7690465 -0.320111E-07  0.706E-04    1.79      63.3  T
   6     -8.7690465  0.166162E-07  0.131E-03    1.79      34.2  T
   7     -8.7690465 -0.173650E-07  0.569E-05    1.79     785.8  T
     SCC iter.                  ...        0 min,  0.001 sec
     gradient                   ...        0 min,  0.001 sec
 * total energy  :    -8.6354270 Eh     change       -0.4054564E-05 Eh
   gradient norm :     0.0006437 Eh/α   predicted    -0.3022709E-05 ( -25.45%)
   displ. norm   :     0.0020585 α      lambda       -0.7567152E-06
   maximum displ.:     0.0011185 α      in ANC's #5, #7, #4, ...

   *** GEOMETRY OPTIMIZATION CONVERGED AFTER 9 ITERATIONS ***

------------------------------------------------------------------------
 total energy gain   :        -0.0628463 Eh      -39.4366 kcal/mol
 total RMSD          :         0.4771591 a0        0.2525 Å
 total power (kW/mol):       -18.3336591 (step)-5768.5203 (real)
------------------------------------------------------------------------

 ANCopt (total)                0 d,  0 h,  0 min,  0.029 sec
 optimizer setup                ...        0 min,  0.000 sec (  0.241%)
 model hessian                  ...        0 min,  0.000 sec (  0.455%)
 ANC generation                 ...        0 min,  0.000 sec (  0.199%)
 coordinate transformation      ...        0 min,  0.000 sec (  0.069%)
 single point calculation       ...        0 min,  0.028 sec ( 96.238%)
 optimization log               ...        0 min,  0.000 sec (  0.741%)
 hessian update                 ...        0 min,  0.000 sec (  0.076%)
 rational function              ...        0 min,  0.000 sec (  0.865%)

================
 final structure:
================
5
 xtb: 6.2.2 (9d81278992624c895f80dd42a50cac0aa55982e2)
C         1.13141034361617   -0.43507549754320   -0.11825044885425
C        -0.32676777126428   -0.36224403082841   -0.21265290976455
C        -0.54190282008133    1.08266931938889   -0.13239790737818
C         0.74635405350396    0.82577579440400    0.31353434852338
H        -1.00909280577452   -1.11112558542126    0.14976791747361

 Bond Distances (Angstroems)
 ---------------------------
C1-C2=1.4630         C1-C4=1.3872         C2-C1=1.4630         C2-C3=1.4630         C2-C4=1.6852         C2-H5=1.0760         
C3-C2=1.4630         C3-C4=1.3872         C4-C1=1.3872         C4-C2=1.6852         C4-C3=1.3872         H5-C2=1.0760         
 C  H  Rav=1.0760 sigma=0.0000  Rmin=1.0760  Rmax=1.0760     1
 C  C  Rav=1.4772 sigma=0.1094  Rmin=1.3872  Rmax=1.6852     5

 selected bond angles (degree)
 --------------------
C4-C1-C2= 72.43                C3-C2-C1=101.08                C4-C2-C1= 51.70                C4-C2-C3= 51.70                
H5-C2-C1=125.15                H5-C2-C3=125.14                H5-C2-C4=142.12                C4-C3-C2= 72.43                
C2-C4-C1= 55.86                C3-C4-C1=109.03                C3-C4-C2= 55.86                

 selected dihedral angles (degree)
 ---------------------------------
C3-C2-C1-C4= 16.40            H5-C2-C1-C4=227.62            C4-C3-C2-C1=343.60            C4-C3-C2-H5=132.38            
C3-C4-C1-C2=341.99            C1-C4-C2-C3=200.68            C1-C4-C2-H5=100.34            C3-C4-C2-C1=159.32            
C3-C4-C2-H5=259.66            C1-C4-C3-C2= 18.01            
           -------------------------------------------------
          |                Final Singlepoint                |
           -------------------------------------------------

          ...................................................
          :                      SETUP                      :
          :.................................................:
          :  # basis functions                  17          :
          :  # atomic orbitals                  17          :
          :  # shells                            9          :
          :  # electrons                        17          :
          :  max. iterations                   250          :
          :  Hamiltonian                  GFN2-xTB          :
          :  restarted?                      false          :
          :  GBSA solvation                  false          :
          :  PC potential                    false          :
          :  electronic temp.          300.0000000     K    :
          :  accuracy                    1.0000000          :
          :  -> integral cutoff          0.2500000E+02      :
          :  -> integral neglect         0.1000000E-07      :
          :  -> SCF convergence          0.1000000E-05 Eh   :
          :  -> wf. convergence          0.1000000E-03 e    :
          :  Broyden damping             0.4000000          :
          ...................................................

 iter      E             dE          RMSdq      gap      omega  full diag
   1     -8.7690465 -0.876905E+01  0.186E-05    1.79       0.0  T
   2     -8.7690465  0.817124E-12  0.180E-05    1.79    2487.1  T
   3     -8.7690465 -0.153122E-11  0.889E-06    1.79    5030.7  T

   *** convergence criteria satisfied after 3 iterations ***

         #    Occupation            Energy/Eh            Energy/eV
      -------------------------------------------------------------
         1        2.0000           -0.7112056             -19.3529
       ...           ...                  ...                  ...
         4        2.0000           -0.5400175             -14.6946
         5        2.0000           -0.5075646             -13.8115
         6        2.0000           -0.5040636             -13.7163
         7        2.0000           -0.4547491             -12.3744
         8        1.0000           -0.3887913             -10.5796
         9        1.0000           -0.3869620             -10.5298
        10        1.0000           -0.3434290              -9.3452 (HOMO)
        11                         -0.2775566              -7.5527 (LUMO)
        12                         -0.2087117              -5.6793
        13                          0.0484763               1.3191
        14                          0.1173428               3.1931
        15                          0.2447223               6.6592
       ...                                ...                  ...
        17                          0.4433548              12.0643
      -------------------------------------------------------------
                  HL-Gap            0.0658724 Eh            1.7925 eV
             Fermi-level           -0.3661315 Eh           -9.9629 eV

 SCC (total)                   0 d,  0 h,  0 min,  0.003 sec
 SCC setup                      ...        0 min,  0.000 sec (  1.935%)
 Dispersion                     ...        0 min,  0.000 sec (  0.427%)
 integral evaluation            ...        0 min,  0.001 sec ( 37.589%)
 zeroth order Hamiltonian       ...        0 min,  0.000 sec (  0.444%)
 iterations                     ...        0 min,  0.001 sec ( 17.953%)
 molecular gradient             ...        0 min,  0.001 sec ( 39.566%)
 printout                       ...        0 min,  0.000 sec (  1.734%)

         :::::::::::::::::::::::::::::::::::::::::::::::::::::
         ::                     SUMMARY                     ::
         :::::::::::::::::::::::::::::::::::::::::::::::::::::
         :: total energy              -8.635427013015 Eh    ::
         :: gradient norm              0.000657458007 Eh/a0 ::
         :: HOMO-LUMO gap              1.792478589497 eV    ::
         ::.................................................::
         :: SCC energy                -8.769046529037 Eh    ::
         :: -> isotropic ES           -0.004292176540 Eh    ::
         :: -> anisotropic ES          0.001056264348 Eh    ::
         :: -> anisotropic XC          0.005348223552 Eh    ::
         :: -> dispersion             -0.002082826501 Eh    ::
         :: repulsion energy           0.133619482625 Eh    ::
         :: add. restraining           0.000000000000 Eh    ::
         :::::::::::::::::::::::::::::::::::::::::::::::::::::

           ------------------------------------------------- 
          |                Numerical Hessian                |
           ------------------------------------------------- 
step length          :   0.00500
SCC accuracy         :   0.30000
Hessian scale factor :   1.00000
frozen atoms in %    :   0.00000    0
RMS gradient         :   0.00066
estimated CPU  time      0.00 min
estimated wall time      0.00 min

writing file <hessian>.

 projected vibrational frequencies (cm-1)
eigval :       -0.00    -0.00    -0.00     0.00     0.00     0.00
eigval :      506.96   636.08   803.81   859.47   935.81   954.49
eigval :     1290.42  1393.47  3070.77
           -------------------------------------------------
          |                Property Printout                |
           -------------------------------------------------

    * Orbital Energies and Occupations

         #    Occupation            Energy/Eh            Energy/eV
      -------------------------------------------------------------
         1        2.0000           -0.7112056             -19.3529
         2        2.0000           -0.6237740             -16.9738
         3        2.0000           -0.6113327             -16.6352
         4        2.0000           -0.5400175             -14.6946
         5        2.0000           -0.5075646             -13.8115
         6        2.0000           -0.5040636             -13.7163
         7        2.0000           -0.4547491             -12.3744
         8        1.0000           -0.3887913             -10.5796
         9        1.0000           -0.3869620             -10.5298
        10        1.0000           -0.3434290              -9.3452 (HOMO)
        11                         -0.2775566              -7.5527 (LUMO)
        12                         -0.2087117              -5.6793
        13                          0.0484763               1.3191
        14                          0.1173428               3.1931
        15                          0.2447223               6.6592
        16                          0.3490404               9.4979
        17                          0.4433549              12.0643
      -------------------------------------------------------------
                  HL-Gap            0.0658724 Eh            1.7925 eV
             Fermi-level           -0.3661315 Eh           -9.9629 eV

     #   Z        covCN         q      C6AA      α(0)
     1   6 C      2.042    -0.109    34.006     9.419
     2   6 C      3.818     0.072    19.373     6.264
     3   6 C      2.042    -0.109    34.006     9.419
     4   6 C      2.895     0.059    26.686     8.470
     5   1 H      0.926     0.088     1.899     2.155

 Mol. C6AA /au·bohr⁶  :        510.145722
 Mol. C8AA /au·bohr⁸  :      14125.305149
 Mol. α(0) /au        :         35.726245


Wiberg/Mayer (AO) data.
largest (>0.10) Wiberg bond orders for each atom
          total WBO             WBO to atom ...
     1  C   2.458        C    4 1.256    C    2 1.023    C    3 0.176
     2  C   3.470        C    3 1.023    C    1 1.023    H    5 0.925    C    4 0.498
     3  C   2.458        C    4 1.256    C    2 1.023    C    1 0.176
     4  C   3.042        C    1 1.256    C    3 1.256    C    2 0.498
     5  H   0.960        C    2 0.925

MOs/occ written to file <molden.input>


molecular dipole:
                 x           y           z       tot (Debye)
 q only:       -0.251      -0.276       0.082
   full:       -0.401      -0.440       0.188       1.586
molecular quadrupole (traceless):
Molecule has the following symmetry elements: (sigma) 
It seems to be the Cs point group
                xx          xy          yy          xz          yz          zz
 q only:       -0.180       1.397       0.095       0.065       0.086       0.085
  q+dip:       -0.483       2.735       0.049      -0.182      -0.169       0.434
   full:       -1.209       3.312      -0.568      -0.342      -0.321       1.777

           -------------------------------------------------
          |                Geometry Summary                 |
           -------------------------------------------------

      molecular mass/u    :       49.0508844
   center of mass at/Å    :        0.2263550       0.2492397      -0.0335960
  moments of inertia/u·Å² :        0.2112360E+02   0.3162408E+02   0.5079902E+02
rotational constants/cm⁻¹ :        0.7980474E+00   0.5330631E+00   0.3318495E+00

 * 1 selected distances

     #   Z        #   Z                                     value/Å
     2   6 C      5   1 H                                 1.0759832 (max)

 * 1 distinct bonds (by element types)

   Z      Z             #   av. dist./Å        max./Å        min./Å
   1 H    6 C           1     1.0759832     1.0759832     1.0759832

           -------------------------------------------------
          |               Frequency Printout                |
           -------------------------------------------------
 projected vibrational frequencies (cm-1)
eigval :       -0.00    -0.00    -0.00     0.00     0.00     0.00
eigval :      506.96   636.08   803.81   859.47   935.81   954.49
eigval :     1290.42  1393.47  3070.77
 reduced masses (amu)
   1: 12.00   2: 11.56   3: 11.97   4: 10.08   5: 11.50   6: 11.69   7: 11.98   8:  8.40
   9:  7.17  10: 10.56  11: 11.02  12:  3.70  13: 11.79  14: 11.86  15:  1.86
 IR intensities (amu)
   1:  0.10   2:  0.06   3:  0.04   4:  0.06   5:  0.05   6:  0.06   7:  0.34   8:  0.33
   9:  0.24  10:  0.32  11:  0.51  12:  0.49  13:  1.36  14:  0.28  15:  0.02
 Raman intensities (amu)
   1:  0.00   2:  0.00   3:  0.00   4:  0.00   5:  0.00   6:  0.00   7:  0.00   8:  0.00
   9:  0.00  10:  0.00  11:  0.00  12:  0.00  13:  0.00  14:  0.00  15:  0.00
 output can be read by thermo (or use thermo option).
 writing <g98.out> molden fake output.
 recommended (thermochemical) frequency scaling factor: 1.0
           -------------------------------------------------
          |             Thermodynamic Functions             |
           -------------------------------------------------

cs  symmetry found (for desy threshold:  0.10E+00) used in thermo

          ...................................................
          :                      SETUP                      :
          :.................................................:
          :  # frequencies                           9      :
          :  # imaginary freq.                       0      :
          :  linear?                             false      :
          :  only rotor calc.                    false      :
          :  symmetry                               cs      :
          :  rotational number                       1      :
          :  scaling factor                  1.0000000      :
          :  rotor cutoff                   50.0000000 cm⁻¹ :
          :  imag. cutoff                  -20.0000000 cm⁻¹ :
          :.................................................:

    mode    ω/cm⁻¹     T·S(HO)/kcal·mol⁻¹    T·S(FR)/kcal·mol⁻¹   T·S(vib)
   ------------------------------------------------------------------------
   ------------------------------------------------------------------------

   temp. (K)  partition function   enthalpy   heat capacity  entropy
                                   cal/mol     cal/K/mol   cal/K/mol   J/K/mol
 298.15  VIB   1.22                  383.204      4.537      1.681
         ROT  0.141E+05              888.752      2.981     21.963
         INT  0.172E+05             1271.956      7.518     23.644
         TR   0.332E+27             1481.254      4.968     37.578
         TOT                        2753.2098    12.4861    61.2220   256.1528

   temp. (K)  partition function   enthalpy   heat capacity  entropy
                                   cal/mol     cal/K/mol   cal/K/mol   J/K/mol
 120.00  VIB   1.00                    4.515      0.251      0.043
         ROT  0.359E+04              357.707      2.981     19.250
         INT  0.360E+04              362.222      3.232     19.294
         TR   0.849E+26              596.178      4.968     33.058
         TOT                         958.3997     8.1999    52.3520   219.0407

   temp. (K)  partition function   enthalpy   heat capacity  entropy
                                   cal/mol     cal/K/mol   cal/K/mol   J/K/mol
 100.00  VIB   1.00                    1.218      0.094      0.014
         ROT  0.273E+04              298.089      2.981     18.707
         INT  0.274E+04              299.307      3.075     18.720
         TR   0.646E+26              496.815      4.968     32.153
         TOT                         796.1217     8.0434    50.8735   212.8546

   temp. (K)  partition function   enthalpy   heat capacity  entropy
                                   cal/mol     cal/K/mol   cal/K/mol   J/K/mol
  80.00  VIB   1.00                    0.181      0.021      0.002
         ROT  0.196E+04              238.471      2.981     18.042
         INT  0.196E+04              238.652      3.002     18.044
         TR   0.462E+26              397.452      4.968     31.045
         TOT                         636.1038     7.9703    49.0889   205.3881

   temp. (K)  partition function   enthalpy   heat capacity  entropy
                                   cal/mol     cal/K/mol   cal/K/mol   J/K/mol
  60.00  VIB   1.00                    0.008      0.002      0.000
         ROT  0.127E+04              178.853      2.981     17.184
         INT  0.127E+04              178.861      2.983     17.184
         TR   0.300E+26              298.089      4.968     29.616
         TOT                         476.9505     7.9507    46.8004   195.8130

   temp. (K)  partition function   enthalpy   heat capacity  entropy
                                   cal/mol     cal/K/mol   cal/K/mol   J/K/mol
  40.00  VIB   1.00                    0.000      0.000     -0.000
         ROT   692.                  119.236      2.981     15.975
         INT   692.                  119.236      2.981     15.975
         TR   0.163E+26              198.726      4.968     27.603
         TOT                         317.9616     7.9490    43.5781   182.3309

   temp. (K)  partition function   enthalpy   heat capacity  entropy
                                   cal/mol     cal/K/mol   cal/K/mol   J/K/mol
  20.00  VIB   1.00                    0.000      0.000     -0.000
         ROT   244.                   59.618      2.981     13.909
         INT   244.                   59.618      2.981     13.909
         TR   0.577E+25               99.363      4.968     24.161
         TOT                         158.9808     7.9490    38.0698   159.2842

   temp. (K)  partition function   enthalpy   heat capacity  entropy
                                   cal/mol     cal/K/mol   cal/K/mol   J/K/mol
  10.00  VIB   1.00                    0.000      0.000     -0.000
         ROT   86.4                   29.809      2.981     11.843
         INT   86.4                   29.809      2.981     11.843
         TR   0.204E+25               49.681      4.968     20.719
         TOT                          79.4904     7.9490    32.5615   136.2375

       T/K    H(0)-H(T)+PV         H(T)/Eh          T*S/Eh         G(T)/Eh
   ------------------------------------------------------------------------
    298.15    0.438752E-02    0.281973E-01    0.290885E-01   -0.891231E-03
    120.00    0.152731E-02    0.253371E-01    0.100114E-01    0.153257E-01
    100.00    0.126870E-02    0.250785E-01    0.810721E-02    0.169713E-01
     80.00    0.101370E-02    0.248235E-01    0.625826E-02    0.185652E-01
     60.00    0.760069E-03    0.245699E-01    0.447487E-02    0.200950E-01
     40.00    0.506704E-03    0.243165E-01    0.277785E-02    0.215387E-01
     20.00    0.253352E-03    0.240631E-01    0.121336E-02    0.228498E-01
     10.00    0.126676E-03    0.239365E-01    0.518901E-03    0.234176E-01 (used)
   ------------------------------------------------------------------------

         :::::::::::::::::::::::::::::::::::::::::::::::::::::
         ::                  THERMODYNAMIC                  ::
         :::::::::::::::::::::::::::::::::::::::::::::::::::::
         :: total free energy          -8.612009443153 Eh   ::
         ::.................................................::
         :: total energy               -8.635427013057 Eh   ::
         :: zero point energy           0.023809795203 Eh   ::
         :: G(RRHO) w/o ZPVE           -0.000392225298 Eh   ::
         :: G(RRHO) contrib.            0.023417569904 Eh   ::
         :::::::::::::::::::::::::::::::::::::::::::::::::::::

optimized geometry written to: xtbopt.xyz


           -------------------------------------------------
          | TOTAL ENERGY               -8.635427013057 Eh   |
          | TOTAL ENTHALPY             -8.611490541839 Eh   |
          | TOTAL FREE ENERGY          -8.612009443153 Eh   |
          | GRADIENT NORM               0.000657448394 Eh/α |
          | HOMO-LUMO GAP               1.792479190497 eV   |
           -------------------------------------------------

------------------------------------------------------------------------
 * finished run on 2020/05/12 at 11:45:11.898     
------------------------------------------------------------------------
 total:
 * wall-time:     0 d,  0 h,  0 min,  0.141 sec
 *  cpu-time:     0 d,  0 h,  0 min,  0.141 sec
 * ratio c/w:     0.996 speedup
 SCF:
 * wall-time:     0 d,  0 h,  0 min,  0.004 sec
 *  cpu-time:     0 d,  0 h,  0 min,  0.004 sec
 * ratio c/w:     1.000 speedup
 ANC optimizer:
 * wall-time:     0 d,  0 h,  0 min,  0.032 sec
 *  cpu-time:     0 d,  0 h,  0 min,  0.032 sec
 * ratio c/w:     1.000 speedup
 numerical hessian:
 * wall-time:     0 d,  0 h,  0 min,  0.088 sec
 *  cpu-time:     0 d,  0 h,  0 min,  0.088 sec
 * ratio c/w:     0.999 speedup

