      -----------------------------------------------------------      
     |                   =====================                   |     
     |                           x T B                           |     
     |                   =====================                   |     
     |                         S. Grimme                         |     
     |          Mulliken Center for Theoretical Chemistry        |     
     |                    University of Bonn                     |     
      -----------------------------------------------------------      

   * xtb version 6.2.2 (9d81278992624c895f80dd42a50cac0aa55982e2) compiled by '@Darwin' on 04/03/2020

   xtb is free software: you can redistribute it and/or modify it under
   the terms of the GNU Lesser General Public License as published by
   the Free Software Foundation, either version 3 of the License, or
   (at your option) any later version.
   
   xtb is distributed in the hope that it will be useful,
   but WITHOUT ANY WARRANTY; without even the implied warranty of
   MERCHANTABILITY or FITNESS FOR A PARTICULAR PURPOSE.  See the
   GNU Lesser General Public License for more details.
   
   Cite this work as:
   * S. Grimme, C. Bannwarth, P. Shushkov, J. Chem. Theory Comput., 2017,
     13, 1989-2009. DOI: 10.1021/acs.jctc.7b00118
   * C. Bannwarth, S. Ehlert and S. Grimme., J. Chem. Theory Comput., 2019,
     15, 1652-1671. DOI: 10.1021/acs.jctc.8b01176
   * P. Pracht, E. Caldeweyher, S. Ehlert, S. Grimme, ChemRxiv, 2019, preprint.
     DOI: 10.26434/chemrxiv.8326202.v1
   
   for DFT-D4:
   * E. Caldeweyher, C. Bannwarth and S. Grimme, J. Chem. Phys., 2017,
     147, 034112. DOI: 10.1063/1.4993215
   * E. Caldeweyher, S. Ehlert, A. Hansen, H. Neugebauer, S. Spicher,
     C. Bannwarth and S. Grimme, J. Chem. Phys., 2019, 150, 154122.
     DOI: 10.1063/1.5090222
   
   for sTDA-xTB:
   * S. Grimme and C. Bannwarth, J. Chem. Phys., 2016, 145, 054103.
     DOI: 10.1063/1.4959605
   
   in the mass-spec context:
   * V. Asgeirsson, C. Bauer and S. Grimme, Chem. Sci., 2017, 8, 4879.
     DOI: 10.1039/c7sc00601b
   
   for metadynamics refer to:
   * S. Grimme, J. Chem. Theory Comput., 2019, 155, 2847-2862
     DOI: 10.1021/acs.jctc.9b00143
   
   with help from (in alphabetical order)
   C. Bannwarth, F. Bohle, G. Brandenburg, E. Caldeweyher, M. Checinski,
   S. Dohm, S. Ehlert, S. Ehrlich, F. März, H. Neugebauer, J. Pisarek,
   P. Pracht, P. Shushkov, and S. Spicher.
   
 * started run on 2020/05/12 at 11:43:53.244     

           -------------------------------------------------
          |                Calculation Setup                |
           -------------------------------------------------

          program call               : xtb --input H2C1O2_5_S_0.input H2C1O2_5_S_0.xyz --ohess --molden --namespace H2C1O2_5_S_0 output.out
          calculation namespace      : H2C1O2_5_S_0
          coordinate file            : H2C1O2_5_S_0.xyz
          number of atoms            :                     5
          number of electrons        :                    18
          charge                     :                     0
          spin                       :                   0.0
          first test random number   :      0.11784592664797

   ID    Z sym.   atoms
    1    6 C      1
    2    8 O      2, 3
    3    1 H      4, 5

           -------------------------------------------------
          |                 G F N 2 - x T B                 |
           -------------------------------------------------

        Reference                      10.1021/acs.jctc.8b01176
      * Hamiltonian:
        H0-scaling (s, p, d)           1.850000    2.230000    2.230000
        zeta-weighting                 0.500000
      * Dispersion:
        s8                             2.700000
        a1                             0.520000
        a2                             5.000000
        s9                             5.000000
      * Repulsion:
        kExp                           1.500000    1.000000
        rExp                           1.000000
      * Coulomb:
        alpha                          2.000000
        third order                    shell-resolved
        anisotropic                    true
        a3                             3.000000
        a5                             4.000000
        cn-shift                       1.200000
        cn-exp                         4.000000
        max-rad                        5.000000


          ...................................................
          :                      SETUP                      :
          :.................................................:
          :  # basis functions                  14          :
          :  # atomic orbitals                  14          :
          :  # shells                            8          :
          :  # electrons                        18          :
          :  max. iterations                   250          :
          :  Hamiltonian                  GFN2-xTB          :
          :  restarted?                      false          :
          :  GBSA solvation                  false          :
          :  PC potential                    false          :
          :  electronic temp.          300.0000000     K    :
          :  accuracy                    1.0000000          :
          :  -> integral cutoff          0.2500000E+02      :
          :  -> integral neglect         0.1000000E-07      :
          :  -> SCF convergence          0.1000000E-05 Eh   :
          :  -> wf. convergence          0.1000000E-03 e    :
          :  Broyden damping             0.4000000          :
          ...................................................

 iter      E             dE          RMSdq      gap      omega  full diag
   1    -11.2085160 -0.112085E+02  0.693E+00    7.88       0.0  T
   2    -11.2217164 -0.132004E-01  0.383E+00    7.50       1.0  T
   3    -11.2217441 -0.276494E-04  0.121E+00    7.72       1.0  T
   4    -11.2224251 -0.680961E-03  0.171E-01    7.65       1.0  T
   5    -11.2224231  0.194376E-05  0.580E-02    7.66       1.0  T
   6    -11.2224288 -0.567744E-05  0.223E-02    7.65       2.0  T
   7    -11.2224306 -0.185546E-05  0.182E-03    7.65      24.5  T
   8    -11.2224306  0.147907E-08  0.101E-03    7.65      44.2  T
   9    -11.2224306 -0.320830E-08  0.475E-05    7.65     940.9  T
  10    -11.2224306 -0.151701E-11  0.201E-06    7.65   22200.5  T

   *** convergence criteria satisfied after 10 iterations ***

         #    Occupation            Energy/Eh            Energy/eV
      -------------------------------------------------------------
         1        2.0000           -0.7985294             -21.7291
       ...           ...                  ...                  ...
         3        2.0000           -0.6872949             -18.7022
         4        2.0000           -0.6450245             -17.5520
         5        2.0000           -0.6117558             -16.6467
         6        2.0000           -0.5792263             -15.7616
         7        2.0000           -0.5620390             -15.2939
         8        2.0000           -0.4994247             -13.5900
         9        2.0000           -0.4483931             -12.2014 (HOMO)
        10                         -0.1671319              -4.5479 (LUMO)
        11                         -0.0428664              -1.1665
        12                          0.0195385               0.5317
        13                          0.1978679               5.3843
        14                          0.2093870               5.6977
      -------------------------------------------------------------
                  HL-Gap            0.2812611 Eh            7.6535 eV
             Fermi-level           -0.3077625 Eh           -8.3746 eV

 SCC (total)                   0 d,  0 h,  0 min,  0.002 sec
 SCC setup                      ...        0 min,  0.000 sec (  3.150%)
 Dispersion                     ...        0 min,  0.000 sec (  0.416%)
 integral evaluation            ...        0 min,  0.001 sec ( 25.377%)
 zeroth order Hamiltonian       ...        0 min,  0.000 sec (  0.547%)
 iterations                     ...        0 min,  0.001 sec ( 40.516%)
 molecular gradient             ...        0 min,  0.001 sec ( 27.182%)
 printout                       ...        0 min,  0.000 sec (  2.428%)

         :::::::::::::::::::::::::::::::::::::::::::::::::::::
         ::                     SUMMARY                     ::
         :::::::::::::::::::::::::::::::::::::::::::::::::::::
         :: total energy             -11.172212369854 Eh    ::
         :: gradient norm              0.073540294230 Eh/a0 ::
         :: HOMO-LUMO gap              7.653504948316 eV    ::
         ::.................................................::
         :: SCC energy               -11.222430641043 Eh    ::
         :: -> isotropic ES            0.022425136936 Eh    ::
         :: -> anisotropic ES         -0.000754214344 Eh    ::
         :: -> anisotropic XC         -0.011730924661 Eh    ::
         :: -> dispersion             -0.001154028141 Eh    ::
         :: repulsion energy           0.050218253622 Eh    ::
         :: add. restraining           0.000000000000 Eh    ::
         :::::::::::::::::::::::::::::::::::::::::::::::::::::

      ----------------------------------------------------------- 
     |                   =====================                   |
     |                        A N C O P T                        |
     |                   =====================                   |
     |               Approximate Normal Coordinate               |
     |                Rational Function Optimizer                |
      ----------------------------------------------------------- 

          ...................................................
          :                      SETUP                      :
          :.................................................:
          :   optimization level            normal          :
          :   max. optcycles                   200          :
          :   ANC micro-cycles                  20          :
          :   degrees of freedom                 9          :
          :.................................................:
          :   RF solver                   davidson          :
          :   write xtbopt.log                true          :
          :   linear?                        false          :
          :   energy convergence         0.5000000E-05 Eh   :
          :   grad. convergence          0.1000000E-02 Eh/α :
          :   maximium RF displ.         1.0000000          :
          :   Hlow (freq-cutoff)         0.1000000E-01      :
          :   Hmax (freq-cutoff)         5.0000000          :
          :   S6 in model hess.         20.0000000          :
          ...................................................

generating ANC from model Hessian ...
Using Lindh-Hessian (1995)
 Shifting diagonal of input Hessian by    0.0000000000000000     
 Lowest  eigenvalues of input Hessian
   -0.000000   -0.000000   -0.000000   -0.000000    0.000000    0.000000
    0.107987    0.115711    0.173398    0.196694    0.415469    1.170163
    1.238044    1.315028    2.039622
 Highest eigenvalues
    0.196694    0.415469    1.170163    1.238044    1.315028    2.039622


........................................................................
.............................. CYCLE    1 ..............................
........................................................................
   1    -11.2224306 -0.112224E+02  0.115E-06    7.65       0.0  T
   2    -11.2224306  0.000000E+00  0.354E-07    7.65  100000.0  T
   3    -11.2224306  0.000000E+00  0.199E-07    7.65  100000.0  T
     SCC iter.                  ...        0 min,  0.000 sec
     gradient                   ...        0 min,  0.001 sec
 * total energy  :   -11.1722124 Eh     change       -0.6112444E-10 Eh
   gradient norm :     0.0735403 Eh/α   predicted     0.0000000E+00 (-100.00%)
   displ. norm   :     0.1260747 α      lambda       -0.6536756E-02
   maximum displ.:     0.0993320 α      in ANC's #3, #5, #8, ...

........................................................................
.............................. CYCLE    2 ..............................
........................................................................
   1    -11.2314329 -0.112314E+02  0.357E-01    7.37       0.0  T
   2    -11.2314602 -0.273441E-04  0.206E-01    7.35       1.0  T
   3    -11.2314599  0.269794E-06  0.533E-02    7.36       1.0  T
   4    -11.2314621 -0.221010E-05  0.514E-03    7.36       8.7  T
   5    -11.2314621 -0.611367E-08  0.141E-03    7.36      31.7  T
   6    -11.2314621 -0.321855E-09  0.175E-04    7.36     255.5  T
   7    -11.2314621 -0.707168E-11  0.739E-05    7.36     605.0  T
     SCC iter.                  ...        0 min,  0.000 sec
     gradient                   ...        0 min,  0.001 sec
 * total energy  :   -11.1767469 Eh     change       -0.4534516E-02 Eh
   gradient norm :     0.0304343 Eh/α   predicted    -0.3320330E-02 ( -26.78%)
   displ. norm   :     0.0940378 α      lambda       -0.1947616E-02
   maximum displ.:     0.0813593 α      in ANC's #3, #8, #5, ...

........................................................................
.............................. CYCLE    3 ..............................
........................................................................
   1    -11.2344393 -0.112344E+02  0.257E-01    7.08       0.0  T
   2    -11.2344525 -0.131572E-04  0.147E-01    7.08       1.0  T
   3    -11.2344528 -0.284545E-06  0.358E-02    7.08       1.2  T
   4    -11.2344536 -0.822105E-06  0.505E-03    7.08       8.9  T
   5    -11.2344536 -0.209079E-07  0.135E-03    7.08      33.0  T
   6    -11.2344536 -0.204331E-09  0.115E-04    7.08     389.5  T
   7    -11.2344536 -0.172129E-11  0.557E-05    7.08     803.2  T
     SCC iter.                  ...        0 min,  0.000 sec
     gradient                   ...        0 min,  0.001 sec
 * total energy  :   -11.1778375 Eh     change       -0.1090645E-02 Eh
   gradient norm :     0.0084100 Eh/α   predicted    -0.9824170E-03 (  -9.92%)
   displ. norm   :     0.0143554 α      lambda       -0.7251889E-04
   maximum displ.:     0.0117077 α      in ANC's #3, #8, #9, ...

........................................................................
.............................. CYCLE    4 ..............................
........................................................................
   1    -11.2343295 -0.112343E+02  0.477E-02    7.05       0.0  T
   2    -11.2343303 -0.798744E-06  0.263E-02    7.05       1.7  T
   3    -11.2343303 -0.564623E-07  0.901E-03    7.05       5.0  T
   4    -11.2343304 -0.260081E-07  0.170E-03    7.05      26.3  T
   5    -11.2343304 -0.289511E-08  0.253E-04    7.05     176.7  T
   6    -11.2343304 -0.142286E-10  0.225E-05    7.05    1990.1  T
     SCC iter.                  ...        0 min,  0.001 sec
     gradient                   ...        0 min,  0.001 sec
 * total energy  :   -11.1778802 Eh     change       -0.4264033E-04 Eh
   gradient norm :     0.0030588 Eh/α   predicted    -0.3626535E-04 ( -14.95%)
   displ. norm   :     0.0023545 α      lambda       -0.6533785E-05
   maximum displ.:     0.0018847 α      in ANC's #9, #8, #5, ...

........................................................................
.............................. CYCLE    5 ..............................
........................................................................
   1    -11.2342969 -0.112343E+02  0.114E-02    7.05       0.0  T
   2    -11.2342969 -0.630182E-07  0.622E-03    7.05       7.2  T
   3    -11.2342969 -0.586796E-08  0.254E-03    7.05      17.6  T
   4    -11.2342969 -0.146871E-08  0.510E-04    7.05      87.7  T
   5    -11.2342969 -0.300048E-09  0.907E-05    7.05     493.0  T
     SCC iter.                  ...        0 min,  0.000 sec
     gradient                   ...        0 min,  0.001 sec
 * total energy  :   -11.1778841 Eh     change       -0.3887151E-05 Eh
   gradient norm :     0.0008660 Eh/α   predicted    -0.3268731E-05 ( -15.91%)
   displ. norm   :     0.0013486 α      lambda       -0.6025538E-06
   maximum displ.:     0.0009232 α      in ANC's #3, #9, #8, ...

   *** GEOMETRY OPTIMIZATION CONVERGED AFTER 5 ITERATIONS ***

------------------------------------------------------------------------
 total energy gain   :        -0.0056717 Eh       -3.5590 kcal/mol
 total RMSD          :         0.1035864 a0        0.0548 Å
 total power (kW/mol):        -2.9782035 (step)-1622.7774 (real)
------------------------------------------------------------------------

 ANCopt (total)                0 d,  0 h,  0 min,  0.009 sec
 optimizer setup                ...        0 min,  0.000 sec (  0.623%)
 model hessian                  ...        0 min,  0.000 sec (  0.870%)
 ANC generation                 ...        0 min,  0.000 sec (  0.480%)
 coordinate transformation      ...        0 min,  0.000 sec (  0.114%)
 single point calculation       ...        0 min,  0.009 sec ( 93.568%)
 optimization log               ...        0 min,  0.000 sec (  1.124%)
 hessian update                 ...        0 min,  0.000 sec (  0.119%)
 rational function              ...        0 min,  0.000 sec (  1.122%)

================
 final structure:
================
5
 xtb: 6.2.2 (9d81278992624c895f80dd42a50cac0aa55982e2)
C        -0.23462840187251    0.00663524790244   -0.00504237188795
O         0.94677479073554    0.03586767570795   -0.67905371158805
O         0.91322512786665   -0.08846278240203    0.71900634086084
H        -0.83691829533839   -0.89655652941016   -0.09981184957517
H        -0.78845322139130    0.94251738820180    0.06490159219033

 Bond Distances (Angstroems)
 ---------------------------
C1-O2=1.3605         C1-O3=1.3605         C1-H4=1.0897         C1-H5=1.0897         O2-C1=1.3605         O2-O3=1.4040         
O3-C1=1.3605         O3-O2=1.4040         H4-C1=1.0897         H5-C1=1.0897         
 C  H  Rav=1.0897 sigma=0.0000  Rmin=1.0897  Rmax=1.0897     2
 O  C  Rav=1.3605 sigma=0.0000  Rmin=1.3605  Rmax=1.3605     2
 O  O  Rav=1.4040 sigma=0.0000  Rmin=1.4040  Rmax=1.4040     1

 selected bond angles (degree)
 --------------------
O3-C1-O2= 62.13                H4-C1-O2=117.04                H4-C1-O3=117.04                H5-C1-O2=117.04                
H5-C1-O3=117.04                H5-C1-H4=115.88                O3-O2-C1= 58.94                O2-O3-C1= 58.94                

 selected dihedral angles (degree)
 ---------------------------------
O3-O2-C1-H4=252.09            O3-O2-C1-H5=107.91            O2-O3-C1-H4=107.91            O2-O3-C1-H5=252.09            
           -------------------------------------------------
          |                Final Singlepoint                |
           -------------------------------------------------

          ...................................................
          :                      SETUP                      :
          :.................................................:
          :  # basis functions                  14          :
          :  # atomic orbitals                  14          :
          :  # shells                            8          :
          :  # electrons                        18          :
          :  max. iterations                   250          :
          :  Hamiltonian                  GFN2-xTB          :
          :  restarted?                      false          :
          :  GBSA solvation                  false          :
          :  PC potential                    false          :
          :  electronic temp.          300.0000000     K    :
          :  accuracy                    1.0000000          :
          :  -> integral cutoff          0.2500000E+02      :
          :  -> integral neglect         0.1000000E-07      :
          :  -> SCF convergence          0.1000000E-05 Eh   :
          :  -> wf. convergence          0.1000000E-03 e    :
          :  Broyden damping             0.4000000          :
          ...................................................

 iter      E             dE          RMSdq      gap      omega  full diag
   1    -11.2342969 -0.112343E+02  0.154E-05    7.05       0.0  T
   2    -11.2342969 -0.870415E-13  0.105E-05    7.05    4244.1  T
   3    -11.2342969 -0.319744E-13  0.262E-06    7.05   17075.6  T

   *** convergence criteria satisfied after 3 iterations ***

         #    Occupation            Energy/Eh            Energy/eV
      -------------------------------------------------------------
         1        2.0000           -0.7981494             -21.7188
       ...           ...                  ...                  ...
         3        2.0000           -0.6863495             -18.6765
         4        2.0000           -0.6434167             -17.5083
         5        2.0000           -0.6157708             -16.7560
         6        2.0000           -0.5823187             -15.8457
         7        2.0000           -0.5730046             -15.5922
         8        2.0000           -0.4934162             -13.4265
         9        2.0000           -0.4631675             -12.6034 (HOMO)
        10                         -0.2039498              -5.5498 (LUMO)
        11                         -0.0660428              -1.7971
        12                          0.0706374               1.9221
        13                          0.2031327               5.5275
        14                          0.2540459               6.9129
      -------------------------------------------------------------
                  HL-Gap            0.2592178 Eh            7.0537 eV
             Fermi-level           -0.3335587 Eh           -9.0766 eV

 SCC (total)                   0 d,  0 h,  0 min,  0.002 sec
 SCC setup                      ...        0 min,  0.000 sec (  1.641%)
 Dispersion                     ...        0 min,  0.000 sec (  0.216%)
 integral evaluation            ...        0 min,  0.001 sec ( 34.909%)
 zeroth order Hamiltonian       ...        0 min,  0.000 sec (  0.367%)
 iterations                     ...        0 min,  0.000 sec ( 15.652%)
 molecular gradient             ...        0 min,  0.001 sec ( 42.951%)
 printout                       ...        0 min,  0.000 sec (  3.228%)

         :::::::::::::::::::::::::::::::::::::::::::::::::::::
         ::                     SUMMARY                     ::
         :::::::::::::::::::::::::::::::::::::::::::::::::::::
         :: total energy             -11.177884057426 Eh    ::
         :: gradient norm              0.000867072443 Eh/a0 ::
         :: HOMO-LUMO gap              7.053674297210 eV    ::
         ::.................................................::
         :: SCC energy               -11.234296927702 Eh    ::
         :: -> isotropic ES            0.021461965926 Eh    ::
         :: -> anisotropic ES          0.000020241892 Eh    ::
         :: -> anisotropic XC         -0.010129150925 Eh    ::
         :: -> dispersion             -0.001165999305 Eh    ::
         :: repulsion energy           0.056412853393 Eh    ::
         :: add. restraining           0.000000000000 Eh    ::
         :::::::::::::::::::::::::::::::::::::::::::::::::::::

           ------------------------------------------------- 
          |                Numerical Hessian                |
           ------------------------------------------------- 
step length          :   0.00500
SCC accuracy         :   0.30000
Hessian scale factor :   1.00000
frozen atoms in %    :   0.00000    0
RMS gradient         :   0.00087
estimated CPU  time      0.00 min
estimated wall time      0.00 min

writing file <hessian>.

 projected vibrational frequencies (cm-1)
eigval :       -0.00    -0.00     0.00     0.00     0.00     0.00
eigval :     1022.51  1029.66  1034.68  1132.80  1137.50  1372.42
eigval :     1481.72  3005.71  3010.30
           -------------------------------------------------
          |                Property Printout                |
           -------------------------------------------------

    * Orbital Energies and Occupations

         #    Occupation            Energy/Eh            Energy/eV
      -------------------------------------------------------------
         1        2.0000           -0.7981495             -21.7188
         2        2.0000           -0.7265276             -19.7698
         3        2.0000           -0.6863496             -18.6765
         4        2.0000           -0.6434167             -17.5083
         5        2.0000           -0.6157708             -16.7560
         6        2.0000           -0.5823187             -15.8457
         7        2.0000           -0.5730046             -15.5922
         8        2.0000           -0.4934162             -13.4265
         9        2.0000           -0.4631676             -12.6034 (HOMO)
        10                         -0.2039498              -5.5498 (LUMO)
        11                         -0.0660429              -1.7971
        12                          0.0706374               1.9221
        13                          0.2031327               5.5275
        14                          0.2540458               6.9129
      -------------------------------------------------------------
                  HL-Gap            0.2592178 Eh            7.0537 eV
             Fermi-level           -0.3335587 Eh           -9.0766 eV

     #   Z        covCN         q      C6AA      α(0)
     1   6 C      3.555     0.218    17.979     6.190
     2   8 O      1.794    -0.176    16.940     5.558
     3   8 O      1.794    -0.176    16.941     5.558
     4   1 H      0.925     0.067     2.123     2.279
     5   1 H      0.925     0.067     2.123     2.279

 Mol. C6AA /au·bohr⁶  :        235.468474
 Mol. C8AA /au·bohr⁸  :       4865.450316
 Mol. α(0) /au        :         21.863678


Wiberg/Mayer (AO) data.
largest (>0.10) Wiberg bond orders for each atom
          total WBO             WBO to atom ...
     1  C   3.881        O    2 0.977    O    3 0.977    H    5 0.964    H    4 0.964
     2  O   1.930        C    1 0.977    O    3 0.924
     3  O   1.930        C    1 0.977    O    2 0.924
     4  H   0.996        C    1 0.964
     5  H   0.996        C    1 0.964

MOs/occ written to file <molden.input>


molecular dipole:
                 x           y           z       tot (Debye)
 q only:       -0.919       0.026      -0.020
   full:       -1.101       0.031      -0.024       2.801
molecular quadrupole (traceless):
                xx          xy          yy          xz          yz          zz
 q only:       -0.622       0.045       1.067       0.000       0.137      -0.445
  q+dip:       -1.254       0.115       3.166       0.027       0.458      -1.912
   full:       -1.100       0.081       1.959       0.002       0.255      -0.859

           -------------------------------------------------
          |                Geometry Summary                 |
           -------------------------------------------------

      molecular mass/u    :       46.0254272
   center of mass at/Å    :        0.5497516      -0.0155480       0.0118061
  moments of inertia/u·Å² :        0.1748804E+02   0.1749750E+02   0.3154678E+02
rotational constants/cm⁻¹ :        0.9639521E+00   0.9634307E+00   0.5343693E+00

 * 5 selected distances

     #   Z        #   Z                                     value/Å
     1   6 C      2   8 O                                 1.3604629
     1   6 C      3   8 O                                 1.3604624
     2   8 O      3   8 O                                 1.4039785 (max)
     1   6 C      4   1 H                                 1.0897200
     1   6 C      5   1 H                                 1.0897199 (min)

 * 3 distinct bonds (by element types)

   Z      Z             #   av. dist./Å        max./Å        min./Å
   1 H    6 C           2     1.0897200     1.0897200     1.0897199
   6 C    8 O           2     1.3604626     1.3604629     1.3604624
   8 O    8 O           1     1.4039785     1.4039785     1.4039785

           -------------------------------------------------
          |               Frequency Printout                |
           -------------------------------------------------
 projected vibrational frequencies (cm-1)
eigval :       -0.00    -0.00     0.00     0.00     0.00     0.00
eigval :     1022.51  1029.66  1034.68  1132.80  1137.50  1372.42
eigval :     1481.72  3005.71  3010.30
 reduced masses (amu)
   1: 12.81   2: 12.61   3: 13.08   4: 14.57   5: 11.84   6: 15.43   7:  2.48   8: 14.39
   9: 14.94  10:  4.01  11:  3.04  12:  9.72  13:  5.64  14:  1.42  15:  2.09
 IR intensities (amu)
Molecule has the following symmetry elements: (C2) 2*(sigma) 
It seems to be the C2v point group
   1:  0.18   2:  0.49   3:  0.21   4:  0.06   5:  0.27   6:  0.26   7:  0.00   8:  0.74
   9:  0.17  10:  0.41  11:  0.07  12:  0.77  13:  0.58  14:  0.25  15:  0.30
 Raman intensities (amu)
   1:  0.00   2:  0.00   3:  0.00   4:  0.00   5:  0.00   6:  0.00   7:  0.00   8:  0.00
   9:  0.00  10:  0.00  11:  0.00  12:  0.00  13:  0.00  14:  0.00  15:  0.00
 output can be read by thermo (or use thermo option).
 writing <g98.out> molden fake output.
 recommended (thermochemical) frequency scaling factor: 1.0
           -------------------------------------------------
          |             Thermodynamic Functions             |
           -------------------------------------------------

c2v symmetry found (for desy threshold:  0.10E+00) used in thermo

          ...................................................
          :                      SETUP                      :
          :.................................................:
          :  # frequencies                           9      :
          :  # imaginary freq.                       0      :
          :  linear?                             false      :
          :  only rotor calc.                    false      :
          :  symmetry                              c2v      :
          :  rotational number                       2      :
          :  scaling factor                  1.0000000      :
          :  rotor cutoff                   50.0000000 cm⁻¹ :
          :  imag. cutoff                  -20.0000000 cm⁻¹ :
          :.................................................:

    mode    ω/cm⁻¹     T·S(HO)/kcal·mol⁻¹    T·S(FR)/kcal·mol⁻¹   T·S(vib)
   ------------------------------------------------------------------------
   ------------------------------------------------------------------------

   temp. (K)  partition function   enthalpy   heat capacity  entropy
                                   cal/mol     cal/K/mol   cal/K/mol   J/K/mol
 298.15  VIB   1.03                   97.803      1.739      0.391
         ROT  0.375E+04              888.752      2.981     19.337
         INT  0.387E+04              986.556      4.720     19.727
         TR   0.302E+27             1481.254      4.968     37.388
         TOT                        2467.8095     9.6878    57.1152   238.9699

   temp. (K)  partition function   enthalpy   heat capacity  entropy
                                   cal/mol     cal/K/mol   cal/K/mol   J/K/mol
 120.00  VIB   1.00                    0.047      0.005      0.000
         ROT   958.                  357.707      2.981     16.624
         INT   958.                  357.754      2.986     16.624
         TR   0.771E+26              596.178      4.968     32.869
         TOT                         953.9319     7.9540    49.4927   207.0774

   temp. (K)  partition function   enthalpy   heat capacity  entropy
                                   cal/mol     cal/K/mol   cal/K/mol   J/K/mol
 100.00  VIB   1.00                    0.004      0.001      0.000
         ROT   729.                  298.089      2.981     16.080
         INT   729.                  298.093      2.981     16.080
         TR   0.587E+26              496.815      4.968     31.963
         TOT                         794.9078     7.9496    48.0435   201.0139

   temp. (K)  partition function   enthalpy   heat capacity  entropy
                                   cal/mol     cal/K/mol   cal/K/mol   J/K/mol
  80.00  VIB   1.00                    0.000      0.000     -0.000
         ROT   522.                  238.471      2.981     15.415
         INT   522.                  238.471      2.981     15.415
         TR   0.420E+26              397.452      4.968     30.855
         TOT                         635.9233     7.9491    46.2702   193.5944

   temp. (K)  partition function   enthalpy   heat capacity  entropy
                                   cal/mol     cal/K/mol   cal/K/mol   J/K/mol
  60.00  VIB   1.00                    0.000      0.000     -0.000
         ROT   339.                  178.853      2.981     14.557
         INT   339.                  178.853      2.981     14.557
         TR   0.273E+26              298.089      4.968     29.427
         TOT                         476.9424     7.9490    43.9841   184.0294

   temp. (K)  partition function   enthalpy   heat capacity  entropy
                                   cal/mol     cal/K/mol   cal/K/mol   J/K/mol
  40.00  VIB   1.00                    0.000      0.000     -0.000
         ROT   184.                  119.236      2.981     13.349
         INT   184.                  119.236      2.981     13.349
         TR   0.148E+26              198.726      4.968     27.413
         TOT                         317.9616     7.9490    40.7620   170.5482

   temp. (K)  partition function   enthalpy   heat capacity  entropy
                                   cal/mol     cal/K/mol   cal/K/mol   J/K/mol
  20.00  VIB   1.00                    0.000      0.000     -0.000
         ROT   65.2                   59.618      2.981     11.283
         INT   65.2                   59.618      2.981     11.282
         TR   0.525E+25               99.363      4.968     23.971
         TOT                         158.9808     7.9490    35.2538   147.5019

   temp. (K)  partition function   enthalpy   heat capacity  entropy
                                   cal/mol     cal/K/mol   cal/K/mol   J/K/mol
  10.00  VIB   1.00                    0.000      0.000     -0.000
         ROT   23.1                   29.809      2.981      9.216
         INT   23.1                   29.809      2.981      9.216
         TR   0.186E+25               49.681      4.968     20.529
         TOT                          79.4904     7.9490    29.7456   124.4556

       T/K    H(0)-H(T)+PV         H(T)/Eh          T*S/Eh         G(T)/Eh
   ------------------------------------------------------------------------
    298.15    0.393270E-02    0.363449E-01    0.271373E-01    0.920763E-02
    120.00    0.152019E-02    0.339324E-01    0.946459E-02    0.244678E-01
    100.00    0.126677E-02    0.336789E-01    0.765621E-02    0.260227E-01
     80.00    0.101341E-02    0.334256E-01    0.589890E-02    0.275267E-01
     60.00    0.760056E-03    0.331722E-01    0.420559E-02    0.289667E-01
     40.00    0.506704E-03    0.329189E-01    0.259833E-02    0.303206E-01
     20.00    0.253352E-03    0.326655E-01    0.112361E-02    0.315419E-01
     10.00    0.126676E-03    0.325389E-01    0.474026E-03    0.320648E-01 (used)
   ------------------------------------------------------------------------

         :::::::::::::::::::::::::::::::::::::::::::::::::::::
         ::                  THERMODYNAMIC                  ::
         :::::::::::::::::::::::::::::::::::::::::::::::::::::
         :: total free energy         -11.145819226823 Eh   ::
         ::.................................................::
         :: total energy              -11.177884057573 Eh   ::
         :: zero point energy           0.032412181151 Eh   ::
         :: G(RRHO) w/o ZPVE           -0.000347350401 Eh   ::
         :: G(RRHO) contrib.            0.032064830750 Eh   ::
         :::::::::::::::::::::::::::::::::::::::::::::::::::::

optimized geometry written to: xtbopt.xyz


           -------------------------------------------------
          | TOTAL ENERGY              -11.177884057573 Eh   |
          | TOTAL ENTHALPY            -11.145345200406 Eh   |
          | TOTAL FREE ENERGY         -11.145819226823 Eh   |
          | GRADIENT NORM               0.000867073824 Eh/α |
          | HOMO-LUMO GAP               7.053674243948 eV   |
           -------------------------------------------------

------------------------------------------------------------------------
 * finished run on 2020/05/12 at 11:43:53.321     
------------------------------------------------------------------------
 total:
 * wall-time:     0 d,  0 h,  0 min,  0.076 sec
 *  cpu-time:     0 d,  0 h,  0 min,  0.076 sec
 * ratio c/w:     0.999 speedup
 SCF:
 * wall-time:     0 d,  0 h,  0 min,  0.002 sec
 *  cpu-time:     0 d,  0 h,  0 min,  0.002 sec
 * ratio c/w:     0.999 speedup
 ANC optimizer:
 * wall-time:     0 d,  0 h,  0 min,  0.012 sec
 *  cpu-time:     0 d,  0 h,  0 min,  0.012 sec
 * ratio c/w:     1.000 speedup
 numerical hessian:
 * wall-time:     0 d,  0 h,  0 min,  0.047 sec
 *  cpu-time:     0 d,  0 h,  0 min,  0.047 sec
 * ratio c/w:     1.000 speedup

