      -----------------------------------------------------------      
     |                   =====================                   |     
     |                           x T B                           |     
     |                   =====================                   |     
     |                         S. Grimme                         |     
     |          Mulliken Center for Theoretical Chemistry        |     
     |                    University of Bonn                     |     
      -----------------------------------------------------------      

   * xtb version 6.2.2 (9d81278992624c895f80dd42a50cac0aa55982e2) compiled by '@Darwin' on 04/03/2020

   xtb is free software: you can redistribute it and/or modify it under
   the terms of the GNU Lesser General Public License as published by
   the Free Software Foundation, either version 3 of the License, or
   (at your option) any later version.
   
   xtb is distributed in the hope that it will be useful,
   but WITHOUT ANY WARRANTY; without even the implied warranty of
   MERCHANTABILITY or FITNESS FOR A PARTICULAR PURPOSE.  See the
   GNU Lesser General Public License for more details.
   
   Cite this work as:
   * S. Grimme, C. Bannwarth, P. Shushkov, J. Chem. Theory Comput., 2017,
     13, 1989-2009. DOI: 10.1021/acs.jctc.7b00118
   * C. Bannwarth, S. Ehlert and S. Grimme., J. Chem. Theory Comput., 2019,
     15, 1652-1671. DOI: 10.1021/acs.jctc.8b01176
   * P. Pracht, E. Caldeweyher, S. Ehlert, S. Grimme, ChemRxiv, 2019, preprint.
     DOI: 10.26434/chemrxiv.8326202.v1
   
   for DFT-D4:
   * E. Caldeweyher, C. Bannwarth and S. Grimme, J. Chem. Phys., 2017,
     147, 034112. DOI: 10.1063/1.4993215
   * E. Caldeweyher, S. Ehlert, A. Hansen, H. Neugebauer, S. Spicher,
     C. Bannwarth and S. Grimme, J. Chem. Phys., 2019, 150, 154122.
     DOI: 10.1063/1.5090222
   
   for sTDA-xTB:
   * S. Grimme and C. Bannwarth, J. Chem. Phys., 2016, 145, 054103.
     DOI: 10.1063/1.4959605
   
   in the mass-spec context:
   * V. Asgeirsson, C. Bauer and S. Grimme, Chem. Sci., 2017, 8, 4879.
     DOI: 10.1039/c7sc00601b
   
   for metadynamics refer to:
   * S. Grimme, J. Chem. Theory Comput., 2019, 155, 2847-2862
     DOI: 10.1021/acs.jctc.9b00143
   
   with help from (in alphabetical order)
   C. Bannwarth, F. Bohle, G. Brandenburg, E. Caldeweyher, M. Checinski,
   S. Dohm, S. Ehlert, S. Ehrlich, F. März, H. Neugebauer, J. Pisarek,
   P. Pracht, P. Shushkov, and S. Spicher.
   
 * started run on 2020/05/12 at 11:43:56.379     

           -------------------------------------------------
          |                Calculation Setup                |
           -------------------------------------------------

          program call               : xtb --input C4N1_0_S_3.input C4N1_0_S_3.xyz --ohess --molden --namespace C4N1_0_S_3 output.out
          calculation namespace      : C4N1_0_S_3
          coordinate file            : C4N1_0_S_3.xyz
          number of atoms            :                     5
          number of electrons        :                    21
          charge                     :                     0
          spin                       :                   1.5
          first test random number   :      0.94826953827614

   ID    Z sym.   atoms
    1    7 N      1
    2    6 C      2-5

           -------------------------------------------------
          |                 G F N 2 - x T B                 |
           -------------------------------------------------

        Reference                      10.1021/acs.jctc.8b01176
      * Hamiltonian:
        H0-scaling (s, p, d)           1.850000    2.230000    2.230000
        zeta-weighting                 0.500000
      * Dispersion:
        s8                             2.700000
        a1                             0.520000
        a2                             5.000000
        s9                             5.000000
      * Repulsion:
        kExp                           1.500000    1.000000
        rExp                           1.000000
      * Coulomb:
        alpha                          2.000000
        third order                    shell-resolved
        anisotropic                    true
        a3                             3.000000
        a5                             4.000000
        cn-shift                       1.200000
        cn-exp                         4.000000
        max-rad                        5.000000


          ...................................................
          :                      SETUP                      :
          :.................................................:
          :  # basis functions                  20          :
          :  # atomic orbitals                  20          :
          :  # shells                           10          :
          :  # electrons                        21          :
          :  max. iterations                   250          :
          :  Hamiltonian                  GFN2-xTB          :
          :  restarted?                      false          :
          :  GBSA solvation                  false          :
          :  PC potential                    false          :
          :  electronic temp.          300.0000000     K    :
          :  accuracy                    1.0000000          :
          :  -> integral cutoff          0.2500000E+02      :
          :  -> integral neglect         0.1000000E-07      :
          :  -> SCF convergence          0.1000000E-05 Eh   :
          :  -> wf. convergence          0.1000000E-03 e    :
          :  Broyden damping             0.4000000          :
          ...................................................

 iter      E             dE          RMSdq      gap      omega  full diag
   1    -10.5444903 -0.105445E+02  0.112E+01    0.00       0.0  T
   2     -9.7152559  0.829234E+00  0.137E+01    0.00       1.0  T
   3    -10.7318889 -0.101663E+01  0.541E+00    0.00       1.0  T
   4    -10.7465777 -0.146887E-01  0.172E+00    0.01       1.0  T
   5    -10.7299272  0.166504E-01  0.172E+00    0.00       1.0  T
   6    -10.7169148  0.130125E-01  0.227E+00    0.06       1.0  T
   7    -10.7103459  0.656890E-02  0.235E+00    0.06       1.0  T
   8    -10.7450904 -0.347445E-01  0.864E-01    0.01       1.0  T
   9    -10.7309132  0.141772E-01  0.147E+00    0.02       1.0  T
  10    -10.7365399 -0.562673E-02  0.160E+00    0.00       1.0  T
  11    -10.7423065 -0.576655E-02  0.124E+00    0.00       1.0  T
  12    -10.7512895 -0.898297E-02  0.755E-02    0.00       1.0  T
  13    -10.7512507  0.387344E-04  0.963E-02    0.00       1.0  T
  14    -10.7512761 -0.253258E-04  0.727E-02    0.00       1.0  T
  15    -10.7513108 -0.347833E-04  0.239E-02    0.00       1.9  T
  16    -10.7513146 -0.377411E-05  0.756E-03    0.00       5.9  T
  17    -10.7513149 -0.290190E-06  0.222E-03    0.00      20.1  T
  18    -10.7513149  0.590510E-08  0.228E-03    0.00      19.7  T
  19    -10.7513149 -0.198653E-07  0.691E-04    0.00      64.7  T
  20    -10.7513149 -0.150413E-08  0.237E-04    0.00     188.3  T

   *** convergence criteria satisfied after 20 iterations ***

         #    Occupation            Energy/Eh            Energy/eV
      -------------------------------------------------------------
         1        2.0000           -0.7550469             -20.5459
       ...           ...                  ...                  ...
         6        2.0000           -0.5445003             -14.8166
         7        2.0000           -0.5445001             -14.8166
         8        2.0000           -0.5314821             -14.4624
         9        1.5000           -0.4730318             -12.8719
        10        1.5000           -0.4730318             -12.8718
        11        0.7087           -0.4343073             -11.8181
        12        0.6456           -0.4340323             -11.8106 (HOMO)
        13        0.6456           -0.4340323             -11.8106 (LUMO)
        14        0.0000           -0.4230664             -11.5122
        15        0.0000           -0.4230663             -11.5122
        16        0.0000           -0.4182574             -11.3814
        17                          0.0199258               0.5422
       ...                                ...                  ...
        20                          0.0669750               1.8225
      -------------------------------------------------------------
                  HL-Gap            0.0000000 Eh            0.0000 eV
             Fermi-level           -0.4532471 Eh          -12.3335 eV

 SCC (total)                   0 d,  0 h,  0 min,  0.005 sec
 SCC setup                      ...        0 min,  0.000 sec (  1.466%)
 Dispersion                     ...        0 min,  0.000 sec (  0.339%)
 integral evaluation            ...        0 min,  0.001 sec ( 28.001%)
 zeroth order Hamiltonian       ...        0 min,  0.000 sec (  0.379%)
 iterations                     ...        0 min,  0.002 sec ( 40.364%)
 molecular gradient             ...        0 min,  0.001 sec ( 27.915%)
 printout                       ...        0 min,  0.000 sec (  1.360%)

         :::::::::::::::::::::::::::::::::::::::::::::::::::::
         ::                     SUMMARY                     ::
         :::::::::::::::::::::::::::::::::::::::::::::::::::::
         :: total energy             -10.695229346499 Eh    ::
         :: gradient norm              0.127667419535 Eh/a0 ::
         :: HOMO-LUMO gap              0.000000721456 eV    ::
         ::.................................................::
         :: SCC energy               -10.751314919202 Eh    ::
         :: -> isotropic ES           -0.036421398205 Eh    ::
         :: -> anisotropic ES          0.000218799014 Eh    ::
         :: -> anisotropic XC          0.007198552533 Eh    ::
         :: -> dispersion             -0.003041769149 Eh    ::
         :: repulsion energy           0.056085328381 Eh    ::
         :: add. restraining           0.000000000000 Eh    ::
         :::::::::::::::::::::::::::::::::::::::::::::::::::::

      ----------------------------------------------------------- 
     |                   =====================                   |
     |                        A N C O P T                        |
     |                   =====================                   |
     |               Approximate Normal Coordinate               |
     |                Rational Function Optimizer                |
      ----------------------------------------------------------- 

          ...................................................
          :                      SETUP                      :
          :.................................................:
          :   optimization level            normal          :
          :   max. optcycles                   200          :
          :   ANC micro-cycles                  20          :
          :   degrees of freedom                 9          :
          :.................................................:
          :   RF solver                   davidson          :
          :   write xtbopt.log                true          :
          :   linear?                        false          :
          :   energy convergence         0.5000000E-05 Eh   :
          :   grad. convergence          0.1000000E-02 Eh/α :
          :   maximium RF displ.         1.0000000          :
          :   Hlow (freq-cutoff)         0.1000000E-01      :
          :   Hmax (freq-cutoff)         5.0000000          :
          :   S6 in model hess.         20.0000000          :
          ...................................................

generating ANC from model Hessian ...
Using Lindh-Hessian (1995)
 Shifting diagonal of input Hessian by    0.0000000000000000     
 Lowest  eigenvalues of input Hessian
   -0.000000   -0.000000   -0.000000   -0.000000    0.000000    0.000000
    0.064926    0.064926    0.091417    0.097160    0.097161    0.465641
    1.016444    1.016446    1.163668
 Highest eigenvalues
    0.097160    0.097161    0.465641    1.016444    1.016446    1.163668


........................................................................
.............................. CYCLE    1 ..............................
........................................................................
   1    -10.7513149 -0.107513E+02  0.835E-05    0.00       0.0  T
   2    -10.7513149  0.112779E-08  0.369E-04    0.00     121.3  T
   3    -10.7513149  0.451095E-09  0.394E-04    0.00     113.5  T
     SCC iter.                  ...        0 min,  0.000 sec
     gradient                   ...        0 min,  0.001 sec
 * total energy  :   -10.6952293 Eh     change       -0.3578116E-10 Eh
   gradient norm :     0.1276664 Eh/α   predicted     0.0000000E+00 (-100.00%)
   displ. norm   :     0.3657673 α      lambda       -0.3751348E-01
   maximum displ.:     0.2877327 α      in ANC's #3, #6, #9, ...

........................................................................
.............................. CYCLE    2 ..............................
........................................................................
   1    -10.8029900 -0.108030E+02  0.175E+00    0.00       0.0  T
   2    -10.6987654  0.104225E+00  0.383E+00    0.00       1.0  T
   3    -10.8082029 -0.109438E+00  0.110E+00    0.00       1.0  T
   4    -10.8119465 -0.374356E-02  0.378E-01    0.01       1.0  T
   5    -10.7716714  0.402751E-01  0.198E+00    0.05       1.0  T
   6    -10.8123471 -0.406757E-01  0.222E-01    0.01       1.0  T
   7    -10.8122629  0.841316E-04  0.233E-01    0.00       1.0  T
   8    -10.8128078 -0.544874E-03  0.562E-02    0.00       1.0  T
   9    -10.8128235 -0.156976E-04  0.119E-02    0.00       3.8  T
  10    -10.8128240 -0.506161E-06  0.443E-03    0.00      10.1  T
  11    -10.8128240  0.184505E-07  0.275E-03    0.00      16.3  T
  12    -10.8128240 -0.470457E-07  0.650E-04    0.00      68.8  T
  13    -10.8128240 -0.226807E-08  0.148E-04    0.00     302.4  T
     SCC iter.                  ...        0 min,  0.002 sec
     gradient                   ...        0 min,  0.001 sec
 * total energy  :   -10.7307515 Eh     change       -0.3552214E-01 Eh
   gradient norm :     0.1098385 Eh/α   predicted    -0.2126613E-01 ( -40.13%)
   displ. norm   :     0.9183562 α      lambda       -0.8346977E-01
   maximum displ.:     0.7781299 α      in ANC's #3, #6, #9, ...

........................................................................
.............................. CYCLE    3 ..............................
........................................................................
   1    -10.9214544 -0.109215E+02  0.397E+00    0.00       0.0  T
   2    -10.7178064  0.203648E+00  0.570E+00    0.00       1.0  T
   3    -10.9485958 -0.230789E+00  0.210E+00    0.00       1.0  T
   4    -10.9542555 -0.565970E-02  0.636E-01    0.01       1.0  T
   5    -10.9327697  0.214859E-01  0.187E+00    0.06       1.0  T
   6    -10.9574802 -0.247106E-01  0.127E-01    0.00       1.0  T
   7    -10.9569699  0.510357E-03  0.291E-01    0.01       1.0  T
   8    -10.9574737 -0.503799E-03  0.110E-01    0.00       1.0  T
   9    -10.9575436 -0.699780E-04  0.285E-02    0.00       1.6  T
  10    -10.9575470 -0.341299E-05  0.142E-02    0.00       3.2  T
  11    -10.9575482 -0.116181E-05  0.621E-03    0.00       7.2  T
  12    -10.9575484 -0.233467E-06  0.114E-03    0.00      39.3  T
  13    -10.9575484 -0.549543E-08  0.388E-04    0.00     115.4  T
  14    -10.9575484 -0.711221E-09  0.162E-04    0.00     275.4  T
     SCC iter.                  ...        0 min,  0.001 sec
     gradient                   ...        0 min,  0.001 sec
 * total energy  :   -10.8112398 Eh     change       -0.8048835E-01 Eh
   gradient norm :     0.1295865 Eh/α   predicted    -0.7693315E-01 (  -4.42%)
   displ. norm   :     0.9922947 α      lambda       -0.9027206E-01
   maximum displ.:     0.8585675 α      in ANC's #3, #6, #9, ...

........................................................................
.............................. CYCLE    4 ..............................
........................................................................
   1    -11.1901360 -0.111901E+02  0.583E+00    0.00       0.0  T
   2    -11.1967447 -0.660876E-02  0.375E+00    0.00       1.0  T
   3    -11.1595143  0.372305E-01  0.277E+00    0.07       1.0  T
   4    -11.0087205  0.150794E+00  0.541E+00    0.47       1.0  T
   5    -11.1827355 -0.174015E+00  0.170E+00    0.05       1.0  T
   6    -11.1386472  0.440883E-01  0.322E+00    0.12       1.0  T
   7    -11.1984518 -0.598045E-01  0.566E-01    0.01       1.0  T
   8    -11.1989359 -0.484144E-03  0.189E-01    0.00       1.0  T
   9    -11.1989068  0.290655E-04  0.170E-01    0.00       1.0  T
  10    -11.1990468 -0.139946E-03  0.524E-02    0.00       1.0  T
  11    -11.1990582 -0.114028E-04  0.177E-02    0.00       2.5  T
  12    -11.1990472  0.109506E-04  0.448E-02    0.00       1.0  T
  13    -11.1990544 -0.714172E-05  0.275E-02    0.00       1.6  T
  14    -11.1990569 -0.257183E-05  0.173E-02    0.00       2.6  T
  15    -11.1990586 -0.170626E-05  0.261E-03    0.00      17.2  T
  16    -11.1990587 -0.461094E-08  0.237E-03    0.00      18.9  T
  17    -11.1990587 -0.242115E-07  0.114E-03    0.00      39.2  T
  18    -11.1990587 -0.685757E-08  0.331E-04    0.00     135.1  T
  19    -11.1990587 -0.599155E-09  0.401E-05    0.00    1115.8  T
     SCC iter.                  ...        0 min,  0.002 sec
     gradient                   ...        0 min,  0.001 sec
 * total energy  :   -10.8494782 Eh     change       -0.3823842E-01 Eh
   gradient norm :     0.8850167 Eh/α   predicted    -0.8957891E-01 ( 134.26%)
   displ. norm   :     0.2940508 α      lambda       -0.1542787E+00
   maximum displ.:     0.2686044 α      in ANC's #6, #9, #3, ...

........................................................................
.............................. CYCLE    5 ..............................
........................................................................
   1    -11.0835688 -0.110836E+02  0.206E+00    0.00       0.0  T
   2    -11.0854652 -0.189645E-02  0.124E+00    0.00       1.0  T
   3    -11.0767873  0.867798E-02  0.129E+00    0.03       1.0  T
   4    -10.9953099  0.814774E-01  0.369E+00    0.16       1.0  T
   5    -11.0664830 -0.711731E-01  0.164E+00    0.04       1.0  T
   6    -11.0501770  0.163060E-01  0.220E+00    0.06       1.0  T
   7    -11.0858112 -0.356342E-01  0.186E-01    0.00       1.0  T
   8    -11.0857624  0.488098E-04  0.151E-01    0.00       1.0  T
   9    -11.0858936 -0.131146E-03  0.514E-02    0.00       1.0  T
  10    -11.0859000 -0.645940E-05  0.338E-02    0.00       1.3  T
  11    -11.0858948  0.528471E-05  0.398E-02    0.00       1.1  T
  12    -11.0859052 -0.104109E-04  0.292E-03    0.00      15.3  T
  13    -11.0859050  0.142576E-06  0.519E-03    0.00       8.6  T
  14    -11.0859052 -0.168812E-06  0.140E-03    0.00      32.0  T
  15    -11.0859052 -0.716093E-08  0.877E-04    0.00      51.0  T
  16    -11.0859052 -0.321910E-08  0.450E-04    0.00      99.4  T
     SCC iter.                  ...        0 min,  0.002 sec
     gradient                   ...        0 min,  0.002 sec
 * total energy  :   -10.9179684 Eh     change       -0.6849017E-01 Eh
   gradient norm :     0.2300947 Eh/α   predicted    -0.8380925E-01 (  22.37%)
   displ. norm   :     0.4177128 α      lambda       -0.6258514E-01
   maximum displ.:     0.3877622 α      in ANC's #3, #6, #9, ...

........................................................................
.............................. CYCLE    6 ..............................
........................................................................
   1    -11.1284327 -0.111284E+02  0.249E+00    0.01       0.0  T
   2    -11.1198299  0.860279E-02  0.198E+00    0.04       1.0  T
   3    -10.9897345  0.130095E+00  0.473E+00    0.29       1.0  T
   4    -11.1292304 -0.139496E+00  0.852E-01    0.02       1.0  T
   5    -11.1270310  0.219942E-02  0.861E-01    0.02       1.0  T
   6    -11.1278514 -0.820380E-03  0.627E-01    0.02       1.0  T
   7    -11.1278460  0.536387E-05  0.661E-01    0.02       1.0  T
   8    -11.1297716 -0.192565E-02  0.199E-01    0.00       1.0  T
   9    -11.1297606  0.110438E-04  0.165E-01    0.01       1.0  T
  10    -11.1298370 -0.763810E-04  0.341E-02    0.00       1.3  T
  11    -11.1298383 -0.133636E-05  0.257E-02    0.00       1.7  T
  12    -11.1298417 -0.338522E-05  0.421E-03    0.00      10.6  T
  13    -11.1298418 -0.652289E-07  0.153E-03    0.00      29.2  T
  14    -11.1298418  0.461018E-08  0.157E-03    0.00      28.5  T
  15    -11.1298418 -0.787019E-08  0.715E-04    0.00      62.5  T
  16    -11.1298418 -0.196800E-08  0.477E-05    0.00     937.5  T
     SCC iter.                  ...        0 min,  0.002 sec
     gradient                   ...        0 min,  0.002 sec
 * total energy  :   -10.9453717 Eh     change       -0.2740327E-01 Eh
   gradient norm :     0.0894948 Eh/α   predicted    -0.3675265E-01 (  34.12%)
   displ. norm   :     0.1109318 α      lambda       -0.8892653E-02
   maximum displ.:     0.0869110 α      in ANC's #6, #3, #9, ...

........................................................................
.............................. CYCLE    7 ..............................
........................................................................
   1    -11.1010454 -0.111010E+02  0.123E+00    0.04       0.0  T
   2    -10.9854990  0.115546E+00  0.457E+00    0.20       1.0  T
   3    -11.0896743 -0.104175E+00  0.165E+00    0.05       1.0  T
   4    -11.0832196  0.645466E-02  0.195E+00    0.06       1.0  T
   5    -11.0871648 -0.394514E-02  0.164E+00    0.04       1.0  T
   6    -11.1029043 -0.157396E-01  0.571E-01    0.01       1.0  T
   7    -11.1044040 -0.149967E-02  0.212E-01    0.00       1.0  T
   8    -11.1043886  0.153711E-04  0.159E-01    0.00       1.0  T
   9    -11.1044183 -0.297129E-04  0.114E-01    0.00       1.0  T
  10    -11.1044105  0.782487E-05  0.997E-02    0.00       1.0  T
  11    -11.1044273 -0.168099E-04  0.599E-02    0.00       1.0  T
  12    -11.1044301 -0.275964E-05  0.375E-02    0.00       1.2  T
  13    -11.1044309 -0.874457E-06  0.211E-02    0.01       2.1  T
  14    -11.1044312 -0.284900E-06  0.406E-03    0.01      11.0  T
  15    -11.1044312  0.539010E-08  0.222E-03    0.01      20.1  T
  16    -11.1044312 -0.114822E-07  0.195E-03    0.01      23.0  T
  17    -11.1044312 -0.866542E-08  0.857E-04    0.01      52.2  T
  18    -11.1044312 -0.177127E-08  0.308E-04    0.01     145.1  T
     SCC iter.                  ...        0 min,  0.001 sec
     gradient                   ...        0 min,  0.001 sec
 * total energy  :   -10.9481819 Eh     change       -0.2810179E-02 Eh
   gradient norm :     0.0456439 Eh/α   predicted    -0.4501045E-02 (  60.17%)
   displ. norm   :     0.1258420 α      lambda       -0.2117225E-02
   maximum displ.:     0.1165758 α      in ANC's #2, #4, #9, ...

........................................................................
.............................. CYCLE    8 ..............................
........................................................................
   1    -11.0812192 -0.110812E+02  0.337E+00    0.40       0.0  T
   2    -10.6961831  0.385036E+00  0.699E+00    0.49       1.0  T
   3    -11.0544632 -0.358280E+00  0.311E+00    0.36       1.0  T
   4    -11.0377177  0.167455E-01  0.356E+00    0.41       1.0  T
   5    -11.1079349 -0.702172E-01  0.149E+00    0.22       1.0  T
   6    -11.1083648 -0.429936E-03  0.132E+00    0.21       1.0  T
   7    -11.1101723 -0.180747E-02  0.871E-01    0.15       1.0  T
   8    -11.1108022 -0.629919E-03  0.594E-01    0.14       1.0  T
   9    -11.1109992 -0.197016E-03  0.402E-01    0.13       1.0  T
  10    -11.1111065 -0.107285E-03  0.108E-01    0.12       1.0  T
  11    -11.1111548 -0.482669E-04  0.663E-02    0.12       1.0  T
  12    -11.1111574 -0.258138E-05  0.274E-02    0.12       1.6  T
  13    -11.1111591 -0.170897E-05  0.121E-02    0.12       3.7  T
  14    -11.1111589  0.184064E-06  0.108E-02    0.12       4.1  T
  15    -11.1111592 -0.266106E-06  0.231E-03    0.12      19.4  T
  16    -11.1111592  0.219908E-08  0.158E-03    0.12      28.3  T
  17    -11.1111592 -0.342705E-08  0.363E-04    0.12     123.2  T
  18    -11.1111592 -0.304595E-09  0.943E-05    0.12     474.5  T
     SCC iter.                  ...        0 min,  0.002 sec
     gradient                   ...        0 min,  0.001 sec
 * total energy  :   -10.9536974 Eh     change       -0.5515569E-02 Eh
   gradient norm :     0.0567407 Eh/α   predicted    -0.1075375E-02 ( -80.50%)
   displ. norm   :     0.5573984 α      lambda       -0.2979093E-01
   maximum displ.:     0.5330160 α      in ANC's #2, #4, #5, ...

........................................................................
.............................. CYCLE    9 ..............................
........................................................................
   1    -11.1366090 -0.111366E+02  0.424E+00    1.80       0.0  T
   2    -11.0247171  0.111892E+00  0.454E+00    1.59       1.0  T
   3    -11.0943090 -0.695919E-01  0.306E+00    1.89       1.0  T
   4    -11.1434889 -0.491799E-01  0.116E+00    1.80       1.0  T
   5    -11.1453821 -0.189312E-02  0.942E-01    1.78       1.0  T
   6    -11.1459988 -0.616742E-03  0.850E-01    1.79       1.0  T
   7    -11.1469774 -0.978589E-03  0.630E-01    1.77       1.0  T
   8    -11.1480181 -0.104072E-02  0.317E-01    1.74       1.0  T
   9    -11.1482959 -0.277750E-03  0.118E-01    1.73       1.0  T
  10    -11.1483153 -0.194135E-04  0.597E-02    1.71       1.0  T
  11    -11.1483244 -0.910078E-05  0.454E-02    1.71       1.0  T
  12    -11.1483320 -0.761000E-05  0.497E-03    1.72       9.0  T
  13    -11.1483320 -0.541146E-07  0.258E-03    1.72      17.3  T
  14    -11.1483321 -0.247785E-07  0.472E-04    1.72      94.7  T
  15    -11.1483321 -0.645477E-09  0.181E-04    1.72     247.2  T
     SCC iter.                  ...        0 min,  0.002 sec
     gradient                   ...        0 min,  0.001 sec
 * total energy  :   -10.9657669 Eh     change       -0.1206949E-01 Eh
   gradient norm :     0.1172924 Eh/α   predicted    -0.1952339E-01 (  61.76%)
   displ. norm   :     0.3973667 α      lambda       -0.2256822E-01
   maximum displ.:     0.2538662 α      in ANC's #1, #2, #4, ...

........................................................................
.............................. CYCLE   10 ..............................
........................................................................
   1    -11.0841613 -0.110842E+02  0.372E+00    2.06       0.0  T
   2    -10.7815114  0.302650E+00  0.623E+00    2.05       1.0  T
   3    -11.1232736 -0.341762E+00  0.192E+00    2.17       1.0  T
   4    -10.8827365  0.240537E+00  0.513E+00    1.92       1.0  T
   5    -11.1293851 -0.246649E+00  0.106E+00    2.20       1.0  T
   6    -11.1332635 -0.387838E-02  0.678E-01    2.20       1.0  T
   7    -11.1343514 -0.108792E-02  0.535E-01    2.20       1.0  T
   8    -11.1346306 -0.279196E-03  0.480E-01    2.20       1.0  T
   9    -11.1348723 -0.241645E-03  0.437E-01    2.20       1.0  T
  10    -11.1355062 -0.633935E-03  0.299E-01    2.19       1.0  T
  11    -11.1353293  0.176876E-03  0.352E-01    2.20       1.0  T
  12    -11.1359317 -0.602356E-03  0.149E-01    2.19       1.0  T
  13    -11.1359881 -0.564403E-04  0.114E-01    2.19       1.0  T
  14    -11.1360333 -0.451249E-04  0.721E-02    2.18       1.0  T
  15    -11.1360614 -0.281273E-04  0.266E-02    2.18       1.7  T
  16    -11.1360649 -0.351529E-05  0.112E-02    2.18       4.0  T
  17    -11.1360656 -0.680968E-06  0.383E-03    2.18      11.7  T
  18    -11.1360657 -0.846868E-07  0.130E-03    2.18      34.3  T
  19    -11.1360657 -0.845215E-08  0.577E-04    2.18      77.5  T
  20    -11.1360657 -0.203052E-08  0.508E-05    2.18     880.5  T
     SCC iter.                  ...        0 min,  0.002 sec
     gradient                   ...        0 min,  0.001 sec
 * total energy  :   -10.9797608 Eh     change       -0.1399385E-01 Eh
   gradient norm :     0.0869851 Eh/α   predicted    -0.1306588E-01 (  -6.63%)
   displ. norm   :     0.6266545 α      lambda       -0.2448013E-01
   maximum displ.:     0.4449718 α      in ANC's #2, #4, #1, ...

........................................................................
.............................. CYCLE   11 ..............................
........................................................................
   1    -11.1236121 -0.111236E+02  0.305E+00    1.95       0.0  T
   2    -11.0476215  0.759906E-01  0.347E+00    2.10       1.0  T
   3    -11.0822708 -0.346493E-01  0.269E+00    1.99       1.0  T
   4    -11.1180540 -0.357832E-01  0.131E+00    1.87       1.0  T
   5    -11.1324613 -0.144073E-01  0.353E-01    2.04       1.0  T
   6    -11.1325940 -0.132722E-03  0.298E-01    2.04       1.0  T
   7    -11.1326205 -0.264807E-04  0.180E-01    2.01       1.0  T
   8    -11.1327364 -0.115940E-03  0.320E-02    2.03       1.4  T
   9    -11.1327366 -0.236082E-06  0.197E-02    2.03       2.3  T
  10    -11.1327369 -0.286029E-06  0.625E-03    2.03       7.2  T
  11    -11.1327371 -0.182780E-06  0.294E-03    2.03      15.2  T
  12    -11.1327371 -0.140864E-07  0.842E-04    2.03      53.1  T
  13    -11.1327371 -0.245120E-08  0.127E-04    2.03     351.6  T
     SCC iter.                  ...        0 min,  0.001 sec
     gradient                   ...        0 min,  0.001 sec
 * total energy  :   -10.9930787 Eh     change       -0.1331796E-01 Eh
   gradient norm :     0.1207651 Eh/α   predicted    -0.1704666E-01 (  28.00%)
   displ. norm   :     0.2235062 α      lambda       -0.1492807E-01
   maximum displ.:     0.1556810 α      in ANC's #1, #3, #7, ...

........................................................................
.............................. CYCLE   12 ..............................
........................................................................
   1    -11.1638103 -0.111638E+02  0.169E+00    2.18       0.0  T
   2    -11.1502532  0.135571E-01  0.168E+00    2.27       1.0  T
   3    -11.1568537 -0.660045E-02  0.125E+00    2.21       1.0  T
   4    -11.1654211 -0.856744E-02  0.514E-01    2.15       1.0  T
   5    -11.1669728 -0.155171E-02  0.103E-01    2.19       1.0  T
   6    -11.1669780 -0.520861E-05  0.852E-02    2.21       1.0  T
   7    -11.1670017 -0.236675E-04  0.342E-02    2.20       1.3  T
   8    -11.1670047 -0.303761E-05  0.582E-03    2.20       7.7  T
   9    -11.1670047  0.968081E-09  0.193E-03    2.20      23.2  T
  10    -11.1670048 -0.115039E-07  0.104E-03    2.20      43.0  T
  11    -11.1670048 -0.278633E-08  0.235E-04    2.20     190.1  T
  12    -11.1670048 -0.115680E-09  0.700E-05    2.20     639.1  T
     SCC iter.                  ...        0 min,  0.001 sec
     gradient                   ...        0 min,  0.001 sec
 * total energy  :   -11.0024500 Eh     change       -0.9371301E-02 Eh
   gradient norm :     0.0880217 Eh/α   predicted    -0.7836893E-02 ( -16.37%)
   displ. norm   :     0.3430509 α      lambda       -0.2072291E-01
   maximum displ.:     0.2071197 α      in ANC's #3, #7, #4, ...

........................................................................
.............................. CYCLE   13 ..............................
........................................................................
   1    -11.1824249 -0.111824E+02  0.206E+00    2.03       0.0  T
   2    -11.1823375  0.874051E-04  0.136E+00    1.81       1.0  T
   3    -11.1833380 -0.100053E-02  0.103E+00    1.98       1.0  T
   4    -11.1800245  0.331355E-02  0.908E-01    1.98       1.0  T
   5    -11.1868272 -0.680271E-02  0.100E-01    1.93       1.0  T
   6    -11.1868357 -0.853832E-05  0.577E-02    1.92       1.0  T
   7    -11.1868220  0.136877E-04  0.488E-02    1.94       1.0  T
   8    -11.1868399 -0.178724E-04  0.179E-02    1.93       2.5  T
   9    -11.1868418 -0.192298E-05  0.641E-03    1.93       7.0  T
  10    -11.1868419 -0.888388E-07  0.123E-03    1.93      36.5  T
  11    -11.1868419 -0.100843E-08  0.336E-04    1.93     133.1  T
  12    -11.1868419 -0.165729E-09  0.111E-04    1.93     404.4  T
     SCC iter.                  ...        0 min,  0.001 sec
     gradient                   ...        0 min,  0.001 sec
 * total energy  :   -11.0152588 Eh     change       -0.1280875E-01 Eh
   gradient norm :     0.0514489 Eh/α   predicted    -0.1158085E-01 (  -9.59%)
   displ. norm   :     0.4166608 α      lambda       -0.1388597E-01
   maximum displ.:     0.3371260 α      in ANC's #2, #7, #3, ...

........................................................................
.............................. CYCLE   14 ..............................
........................................................................
   1    -11.1768863 -0.111769E+02  0.175E+00    1.75       0.0  T
   2    -11.1643496  0.125367E-01  0.175E+00    1.75       1.0  T
   3    -11.1733567 -0.900715E-02  0.121E+00    1.69       1.0  T
   4    -11.1705565  0.280021E-02  0.111E+00    1.76       1.0  T
   5    -11.1805431 -0.998659E-02  0.202E-01    1.75       1.0  T
   6    -11.1808716 -0.328428E-03  0.697E-02    1.71       1.0  T
   7    -11.1808744 -0.283047E-05  0.408E-02    1.71       1.1  T
   8    -11.1808771 -0.274360E-05  0.108E-02    1.71       4.1  T
   9    -11.1808777 -0.539444E-06  0.399E-03    1.71      11.2  T
  10    -11.1808777 -0.265159E-07  0.865E-04    1.71      51.7  T
  11    -11.1808777 -0.441847E-09  0.333E-04    1.71     134.4  T
     SCC iter.                  ...        0 min,  0.001 sec
     gradient                   ...        0 min,  0.001 sec
 * total energy  :   -11.0194057 Eh     change       -0.4146871E-02 Eh
   gradient norm :     0.0704640 Eh/α   predicted    -0.8148348E-02 (  96.49%)
   displ. norm   :     0.1644363 α      lambda       -0.5909623E-02
   maximum displ.:     0.0885245 α      in ANC's #2, #4, #3, ...

........................................................................
.............................. CYCLE   15 ..............................
........................................................................
   1    -11.2020219 -0.112020E+02  0.716E-01    1.91       0.0  T
   2    -11.1999459  0.207600E-02  0.697E-01    1.90       1.0  T
   3    -11.2005314 -0.585445E-03  0.593E-01    1.91       1.0  T
   4    -11.2018567 -0.132529E-02  0.312E-01    1.92       1.0  T
   5    -11.2024772 -0.620508E-03  0.105E-01    1.90       1.0  T
   6    -11.2025596 -0.824302E-04  0.412E-02    1.92       1.1  T
   7    -11.2025611 -0.149058E-05  0.181E-02    1.91       2.5  T
   8    -11.2025629 -0.176900E-05  0.580E-03    1.91       7.7  T
   9    -11.2025629 -0.648248E-07  0.211E-03    1.91      21.2  T
  10    -11.2025629 -0.302537E-08  0.409E-04    1.91     109.2  T
  11    -11.2025629 -0.159229E-09  0.871E-05    1.91     513.3  T
     SCC iter.                  ...        0 min,  0.001 sec
     gradient                   ...        0 min,  0.001 sec
 * total energy  :   -11.0230759 Eh     change       -0.3670197E-02 Eh
   gradient norm :     0.0447660 Eh/α   predicted    -0.3034708E-02 ( -17.31%)
   displ. norm   :     0.1136339 α      lambda       -0.2502117E-02
   maximum displ.:     0.0744793 α      in ANC's #5, #3, #6, ...

........................................................................
.............................. CYCLE   16 ..............................
........................................................................
   1    -11.2046214 -0.112046E+02  0.569E-01    1.89       0.0  T
   2    -11.2008243  0.379705E-02  0.783E-01    1.91       1.0  T
   3    -11.2046811 -0.385674E-02  0.377E-01    1.90       1.0  T
   4    -11.2051994 -0.518275E-03  0.111E-01    1.89       1.0  T
   5    -11.2052466 -0.472090E-04  0.542E-02    1.91       1.0  T
   6    -11.2052456  0.962418E-06  0.389E-02    1.90       1.1  T
   7    -11.2052532 -0.760791E-05  0.154E-02    1.91       2.9  T
   8    -11.2052548 -0.162122E-05  0.487E-03    1.91       9.2  T
   9    -11.2052549 -0.817867E-07  0.113E-03    1.91      39.5  T
  10    -11.2052549 -0.723253E-09  0.436E-04    1.91     102.6  T
  11    -11.2052549 -0.973355E-10  0.126E-04    1.91     355.3  T
     SCC iter.                  ...        0 min,  0.001 sec
     gradient                   ...        0 min,  0.001 sec
 * total energy  :   -11.0244650 Eh     change       -0.1389146E-02 Eh
   gradient norm :     0.0250908 Eh/α   predicted    -0.1267213E-02 (  -8.78%)
   displ. norm   :     0.0894984 α      lambda       -0.1246146E-02
   maximum displ.:     0.0598438 α      in ANC's #5, #4, #2, ...

........................................................................
.............................. CYCLE   17 ..............................
........................................................................
   1    -11.2052336 -0.112052E+02  0.551E-01    1.99       0.0  T
   2    -11.2009669  0.426671E-02  0.813E-01    2.01       1.0  T
   3    -11.2054028 -0.443591E-02  0.348E-01    2.00       1.0  T
   4    -11.2057858 -0.382967E-03  0.115E-01    1.99       1.0  T
   5    -11.2058255 -0.396734E-04  0.707E-02    2.00       1.0  T
   6    -11.2058438 -0.183343E-04  0.415E-02    2.00       1.1  T
   7    -11.2058523 -0.851186E-05  0.980E-03    2.00       4.6  T
   8    -11.2058525 -0.151521E-06  0.499E-03    2.00       9.0  T
   9    -11.2058526 -0.119936E-06  0.106E-03    2.00      42.0  T
  10    -11.2058526 -0.418240E-09  0.517E-04    2.00      86.4  T
  11    -11.2058526 -0.464954E-09  0.105E-04    2.00     426.5  T
     SCC iter.                  ...        0 min,  0.001 sec
     gradient                   ...        0 min,  0.002 sec
 * total energy  :   -11.0251455 Eh     change       -0.6804922E-03 Eh
   gradient norm :     0.0116616 Eh/α   predicted    -0.6280625E-03 (  -7.70%)
   displ. norm   :     0.0625580 α      lambda       -0.4689358E-03
   maximum displ.:     0.0315872 α      in ANC's #2, #4, #5, ...

........................................................................
.............................. CYCLE   18 ..............................
........................................................................
   1    -11.2011374 -0.112011E+02  0.261E-01    1.89       0.0  T
   2    -11.2011322  0.526090E-05  0.161E-01    1.87       1.0  T
   3    -11.2010428  0.893677E-04  0.153E-01    1.88       1.0  T
   4    -11.2010624 -0.196570E-04  0.124E-01    1.89       1.0  T
   5    -11.2011740 -0.111523E-03  0.350E-02    1.88       1.3  T
   6    -11.2011829 -0.894889E-05  0.121E-02    1.88       3.7  T
   7    -11.2011835 -0.596920E-06  0.437E-03    1.88      10.2  T
   8    -11.2011836 -0.986239E-07  0.163E-03    1.88      27.5  T
   9    -11.2011836 -0.225461E-08  0.423E-04    1.88     105.6  T
  10    -11.2011836 -0.164141E-09  0.198E-04    1.88     225.6  T
     SCC iter.                  ...        0 min,  0.001 sec
     gradient                   ...        0 min,  0.001 sec
 * total energy  :   -11.0254198 Eh     change       -0.2742617E-03 Eh
   gradient norm :     0.0124473 Eh/α   predicted    -0.2353848E-03 ( -14.18%)
   displ. norm   :     0.0334830 α      lambda       -0.2322082E-03
   maximum displ.:     0.0174815 α      in ANC's #4, #2, #3, ...

........................................................................
.............................. CYCLE   19 ..............................
........................................................................
   1    -11.2002905 -0.112003E+02  0.147E-01    1.85       0.0  T
   2    -11.2001389  0.151533E-03  0.162E-01    1.84       1.0  T
   3    -11.2002175 -0.785371E-04  0.129E-01    1.84       1.0  T
   4    -11.2003069 -0.894095E-04  0.456E-02    1.84       1.0  T
   5    -11.2003166 -0.967662E-05  0.179E-02    1.84       2.5  T
   6    -11.2003179 -0.132702E-05  0.107E-02    1.84       4.2  T
   7    -11.2003182 -0.322207E-06  0.432E-03    1.84      10.4  T
   8    -11.2003183 -0.594330E-07  0.188E-03    1.84      23.8  T
   9    -11.2003183 -0.182756E-07  0.322E-04    1.84     139.0  T
  10    -11.2003183 -0.107660E-09  0.122E-04    1.84     365.8  T
     SCC iter.                  ...        0 min,  0.001 sec
     gradient                   ...        0 min,  0.001 sec
 * total energy  :   -11.0256091 Eh     change       -0.1893040E-03 Eh
   gradient norm :     0.0131252 Eh/α   predicted    -0.1162354E-03 ( -38.60%)
   displ. norm   :     0.0720018 α      lambda       -0.4437949E-03
   maximum displ.:     0.0402920 α      in ANC's #7, #4, #2, ...

........................................................................
.............................. CYCLE   20 ..............................
........................................................................
   1    -11.2000733 -0.112001E+02  0.309E-01    1.80       0.0  T
   2    -11.1997916  0.281707E-03  0.257E-01    1.79       1.0  T
   3    -11.1993307  0.460952E-03  0.337E-01    1.79       1.0  T
   4    -11.2000778 -0.747075E-03  0.835E-02    1.80       1.0  T
   5    -11.2001253 -0.475392E-04  0.304E-02    1.80       1.5  T
   6    -11.2001279 -0.255370E-05  0.194E-02    1.79       2.3  T
   7    -11.2001288 -0.913174E-06  0.831E-03    1.79       5.4  T
   8    -11.2001290 -0.190944E-06  0.349E-03    1.79      12.8  T
   9    -11.2001290 -0.668754E-07  0.920E-04    1.79      48.6  T
  10    -11.2001290 -0.161261E-08  0.296E-04    1.79     151.1  T
     SCC iter.                  ...        0 min,  0.001 sec
     gradient                   ...        0 min,  0.001 sec
 * total energy  :   -11.0258849 Eh     change       -0.2758187E-03 Eh
   gradient norm :     0.0148977 Eh/α   predicted    -0.2230472E-03 ( -19.13%)
   displ. norm   :     0.0316785 α      lambda       -0.1449237E-03
   maximum displ.:     0.0154586 α      in ANC's #2, #7, #4, ...
 * RMSD in coord.:     1.4963063 α      energy gain  -0.3306555E+00 Eh

generating ANC from model Hessian ...
Using Lindh-Hessian (1995)
 Shifting diagonal of input Hessian by    0.0000000000000000     
 Lowest  eigenvalues of input Hessian
   -0.000000   -0.000000   -0.000000    0.000000    0.000000    0.000000
    0.066567    0.179042    0.270938    0.355566    0.790621    1.043058
    1.301363    1.437908    2.346186
 Highest eigenvalues
    0.355566    0.790621    1.043058    1.301363    1.437908    2.346186


........................................................................
.............................. CYCLE   21 ..............................
........................................................................
   1    -11.2022203 -0.112022E+02  0.146E-01    1.79       0.0  T
   2    -11.2022151  0.516478E-05  0.897E-02    1.78       1.0  T
   3    -11.2021231  0.920336E-04  0.111E-01    1.78       1.0  T
   4    -11.2022221 -0.990753E-04  0.259E-02    1.78       1.7  T
   5    -11.2022237 -0.152206E-05  0.217E-02    1.78       2.1  T
   6    -11.2022269 -0.326303E-05  0.558E-03    1.78       8.0  T
   7    -11.2022269  0.218276E-07  0.308E-03    1.78      14.5  T
   8    -11.2022270 -0.376644E-07  0.141E-03    1.78      31.7  T
   9    -11.2022270 -0.617625E-08  0.269E-04    1.78     166.5  T
  10    -11.2022270 -0.482796E-10  0.943E-05    1.78     474.4  T
     SCC iter.                  ...        0 min,  0.001 sec
     gradient                   ...        0 min,  0.001 sec
 * total energy  :   -11.0259929 Eh     change       -0.1080411E-03 Eh
   gradient norm :     0.0101716 Eh/α   predicted     0.0000000E+00 (-100.00%)
   displ. norm   :     0.0191933 α      lambda       -0.1000109E-03
   maximum displ.:     0.0148007 α      in ANC's #1, #4, #2, ...

........................................................................
.............................. CYCLE   22 ..............................
........................................................................
   1    -11.2048810 -0.112049E+02  0.840E-02    1.78       0.0  T
   2    -11.2048688  0.121938E-04  0.672E-02    1.78       1.0  T
   3    -11.2048509  0.179134E-04  0.714E-02    1.78       1.0  T
   4    -11.2048689 -0.180029E-04  0.461E-02    1.78       1.0  T
   5    -11.2048868 -0.178367E-04  0.124E-02    1.78       3.6  T
   6    -11.2048877 -0.886405E-06  0.231E-03    1.78      19.4  T
   7    -11.2048877  0.511786E-10  0.831E-04    1.78      53.8  T
   8    -11.2048877 -0.215860E-08  0.461E-04    1.78      97.0  T
     SCC iter.                  ...        0 min,  0.001 sec
     gradient                   ...        0 min,  0.001 sec
 * total energy  :   -11.0260559 Eh     change       -0.6302232E-04 Eh
   gradient norm :     0.0024574 Eh/α   predicted    -0.5002343E-04 ( -20.63%)
   displ. norm   :     0.0181185 α      lambda       -0.2541982E-04
   maximum displ.:     0.0153014 α      in ANC's #1, #2, #4, ...

........................................................................
.............................. CYCLE   23 ..............................
........................................................................
   1    -11.2055985 -0.112056E+02  0.760E-02    1.77       0.0  T
   2    -11.2055869  0.116333E-04  0.598E-02    1.77       1.0  T
   3    -11.2055621  0.248024E-04  0.748E-02    1.77       1.0  T
   4    -11.2055905 -0.284600E-04  0.371E-02    1.77       1.2  T
   5    -11.2056022 -0.116323E-04  0.698E-03    1.77       6.4  T
   6    -11.2056024 -0.251449E-06  0.238E-03    1.77      18.8  T
   7    -11.2056024  0.535971E-08  0.144E-03    1.77      31.2  T
   8    -11.2056024 -0.975816E-08  0.530E-04    1.77      84.4  T
   9    -11.2056024 -0.973579E-09  0.135E-04    1.77     330.5  T
     SCC iter.                  ...        0 min,  0.001 sec
     gradient                   ...        0 min,  0.001 sec
 * total energy  :   -11.0260740 Eh     change       -0.1806351E-04 Eh
   gradient norm :     0.0016384 Eh/α   predicted    -0.1271491E-04 ( -29.61%)
   displ. norm   :     0.0274108 α      lambda       -0.1458364E-04
   maximum displ.:     0.0218980 α      in ANC's #1, #2, #3, ...

........................................................................
.............................. CYCLE   24 ..............................
........................................................................
   1    -11.2054934 -0.112055E+02  0.112E-01    1.75       0.0  T
   2    -11.2054663  0.270727E-04  0.881E-02    1.74       1.0  T
   3    -11.2054054  0.609504E-04  0.115E-01    1.74       1.0  T
   4    -11.2054827 -0.773167E-04  0.478E-02    1.75       1.0  T
   5    -11.2055004 -0.176990E-04  0.109E-02    1.75       4.1  T
   6    -11.2055011 -0.716867E-06  0.386E-03    1.74      11.6  T
   7    -11.2055011  0.353227E-08  0.202E-03    1.74      22.2  T
   8    -11.2055011 -0.186817E-07  0.882E-04    1.74      50.7  T
   9    -11.2055011 -0.281223E-08  0.225E-04    1.74     199.1  T
     SCC iter.                  ...        0 min,  0.001 sec
     gradient                   ...        0 min,  0.001 sec
 * total energy  :   -11.0260825 Eh     change       -0.8523955E-05 Eh
   gradient norm :     0.0007506 Eh/α   predicted    -0.7295716E-05 ( -14.41%)
   displ. norm   :     0.0059630 α      lambda       -0.1168981E-05
   maximum displ.:     0.0050597 α      in ANC's #1, #2, #4, ...

........................................................................
.............................. CYCLE   25 ..............................
........................................................................
   1    -11.2052776 -0.112053E+02  0.252E-02    1.75       0.0  T
   2    -11.2052766  0.927413E-06  0.185E-02    1.75       2.4  T
   3    -11.2052733  0.333675E-05  0.249E-02    1.75       1.8  T
   4    -11.2052766 -0.326128E-05  0.125E-02    1.75       3.6  T
   5    -11.2052779 -0.134185E-05  0.166E-03    1.75      27.0  T
   6    -11.2052779 -0.120684E-07  0.618E-04    1.75      72.4  T
   7    -11.2052779  0.421153E-09  0.330E-04    1.75     135.7  T
     SCC iter.                  ...        0 min,  0.001 sec
     gradient                   ...        0 min,  0.002 sec
 * total energy  :   -11.0260835 Eh     change       -0.9765458E-06 Eh
   gradient norm :     0.0003572 Eh/α   predicted    -0.5845599E-06 ( -40.14%)
   displ. norm   :     0.0010874 α      lambda       -0.1606784E-06
   maximum displ.:     0.0007120 α      in ANC's #1, #6, #2, ...

   *** GEOMETRY OPTIMIZATION CONVERGED AFTER 25 ITERATIONS ***

------------------------------------------------------------------------
 total energy gain   :        -0.3308542 Eh     -207.6141 kcal/mol
 total RMSD          :         1.5123090 a0        0.8003 Å
 total power (kW/mol):       -34.7462987 (step)-8585.7071 (real)
------------------------------------------------------------------------

 ANCopt (total)                0 d,  0 h,  0 min,  0.101 sec
 optimizer setup                ...        0 min,  0.000 sec (  0.118%)
 model hessian                  ...        0 min,  0.000 sec (  0.148%)
 ANC generation                 ...        0 min,  0.000 sec (  0.074%)
 coordinate transformation      ...        0 min,  0.000 sec (  0.044%)
 single point calculation       ...        0 min,  0.099 sec ( 97.857%)
 optimization log               ...        0 min,  0.001 sec (  0.571%)
 hessian update                 ...        0 min,  0.000 sec (  0.049%)
 rational function              ...        0 min,  0.000 sec (  0.480%)

================
 final structure:
================
5
 xtb: 6.2.2 (9d81278992624c895f80dd42a50cac0aa55982e2)
N        -0.65550906641073   -0.08134165307658   -1.72029070570137
C        -0.15753042935755   -0.01298780424533   -0.62720595393859
C         0.50387182851202   -0.85010611598213    0.40972864829532
C         0.21555373130200   -0.00748281102509    1.45694654561244
C         0.09361293595425    0.95191838432913    0.48082146573220

 Bond Distances (Angstroems)
 ---------------------------
N1-C2=1.2031         C2-N1=1.2031         C2-C3=1.4878         C2-C5=1.4906         C3-C2=1.4878         C3-C4=1.3747         
C3-C5=1.8495         C4-C3=1.3747         C4-C5=1.3741         C5-C2=1.4906         C5-C3=1.8495         C5-C4=1.3741         
 C  C  Rav=1.5153 sigma=0.1748  Rmin=1.3741  Rmax=1.8495     5
 N  C  Rav=1.2031 sigma=0.0000  Rmin=1.2031  Rmax=1.2031     1

 selected bond angles (degree)
 --------------------
C3-C2-N1=141.75                C5-C2-N1=141.43                C5-C2-C3= 76.78                C4-C3-C2= 95.33                
C5-C3-C2= 51.68                C5-C3-C4= 47.70                C5-C4-C3= 84.57                C3-C5-C2= 51.54                
C4-C5-C2= 95.22                C4-C5-C3= 47.73                

 selected dihedral angles (degree)
 ---------------------------------
C4-C3-C2-N1=203.06            C4-C3-C2-C5= 20.74            C5-C3-C2-N1=182.32            C5-C4-C3-C2=337.94            
C3-C5-C2-N1=177.70            C4-C5-C2-N1=156.95            C4-C5-C2-C3=339.26            C2-C5-C3-C4=208.47            
C4-C5-C3-C2=151.53            C2-C5-C4-C3= 22.01            
           -------------------------------------------------
          |                Final Singlepoint                |
           -------------------------------------------------

          ...................................................
          :                      SETUP                      :
          :.................................................:
          :  # basis functions                  20          :
          :  # atomic orbitals                  20          :
          :  # shells                           10          :
          :  # electrons                        21          :
          :  max. iterations                   250          :
          :  Hamiltonian                  GFN2-xTB          :
          :  restarted?                      false          :
          :  GBSA solvation                  false          :
          :  PC potential                    false          :
          :  electronic temp.          300.0000000     K    :
          :  accuracy                    1.0000000          :
          :  -> integral cutoff          0.2500000E+02      :
          :  -> integral neglect         0.1000000E-07      :
          :  -> SCF convergence          0.1000000E-05 Eh   :
          :  -> wf. convergence          0.1000000E-03 e    :
          :  Broyden damping             0.4000000          :
          ...................................................

 iter      E             dE          RMSdq      gap      omega  full diag
   1    -11.2052779 -0.112053E+02  0.989E-05    1.75       0.0  T
   2    -11.2052779  0.179364E-09  0.178E-04    1.75     251.0  T
   3    -11.2052779 -0.205347E-09  0.482E-05    1.75     928.5  T

   *** convergence criteria satisfied after 3 iterations ***

         #    Occupation            Energy/Eh            Energy/eV
      -------------------------------------------------------------
         1        2.0000           -0.7381987             -20.0874
       ...           ...                  ...                  ...
         6        2.0000           -0.5668811             -15.4256
         7        2.0000           -0.5040518             -13.7159
         8        2.0000           -0.4915087             -13.3746
         9        2.0000           -0.4683610             -12.7448
        10        1.0000           -0.4484688             -12.2035
        11        1.0000           -0.4259537             -11.5908
        12        1.0000           -0.3835239             -10.4362 (HOMO)
        13                         -0.3193275              -8.6893 (LUMO)
        14                         -0.3111183              -8.4660
        15                         -0.1992792              -5.4227
        16                          0.0696323               1.8948
        17                          0.1002245               2.7272
       ...                                ...                  ...
        20                          0.8220866              22.3701
      -------------------------------------------------------------
                  HL-Gap            0.0641963 Eh            1.7469 eV
             Fermi-level           -0.4049203 Eh          -11.0184 eV

 SCC (total)                   0 d,  0 h,  0 min,  0.004 sec
 SCC setup                      ...        0 min,  0.000 sec (  1.047%)
 Dispersion                     ...        0 min,  0.000 sec (  0.329%)
 integral evaluation            ...        0 min,  0.001 sec ( 33.099%)
 zeroth order Hamiltonian       ...        0 min,  0.000 sec (  0.362%)
 iterations                     ...        0 min,  0.001 sec ( 14.936%)
 molecular gradient             ...        0 min,  0.002 sec ( 48.101%)
 printout                       ...        0 min,  0.000 sec (  1.902%)

         :::::::::::::::::::::::::::::::::::::::::::::::::::::
         ::                     SUMMARY                     ::
         :::::::::::::::::::::::::::::::::::::::::::::::::::::
         :: total energy             -11.026083504126 Eh    ::
         :: gradient norm              0.000357547912 Eh/a0 ::
         :: HOMO-LUMO gap              1.746870576835 eV    ::
         ::.................................................::
         :: SCC energy               -11.205277926994 Eh    ::
         :: -> isotropic ES            0.001132624496 Eh    ::
         :: -> anisotropic ES          0.001196271931 Eh    ::
         :: -> anisotropic XC          0.012382089007 Eh    ::
         :: -> dispersion             -0.002755669092 Eh    ::
         :: repulsion energy           0.179194399507 Eh    ::
         :: add. restraining           0.000000000000 Eh    ::
         :::::::::::::::::::::::::::::::::::::::::::::::::::::

           ------------------------------------------------- 
          |                Numerical Hessian                |
           ------------------------------------------------- 
step length          :   0.00500
SCC accuracy         :   0.30000
Hessian scale factor :   1.00000
frozen atoms in %    :   0.00000    0
RMS gradient         :   0.00036
estimated CPU  time      0.00 min
estimated wall time      0.00 min

writing file <hessian>.

 projected vibrational frequencies (cm-1)
eigval :       -0.00    -0.00    -0.00     0.00     0.00     0.00
eigval :      245.28   369.97   500.44   513.18   627.85   836.23
eigval :      957.13  1470.61  1854.95
           -------------------------------------------------
          |                Property Printout                |
           -------------------------------------------------

    * Orbital Energies and Occupations

         #    Occupation            Energy/Eh            Energy/eV
      -------------------------------------------------------------
         1        2.0000           -0.7381987             -20.0874
         2        2.0000           -0.7003109             -19.0564
         3        2.0000           -0.6304721             -17.1560
         4        2.0000           -0.6203134             -16.8796
         5        2.0000           -0.5674200             -15.4403
         6        2.0000           -0.5668812             -15.4256
         7        2.0000           -0.5040519             -13.7160
         8        2.0000           -0.4915088             -13.3746
         9        2.0000           -0.4683611             -12.7448
        10        1.0000           -0.4484689             -12.2035
        11        1.0000           -0.4259537             -11.5908
        12        1.0000           -0.3835239             -10.4362 (HOMO)
        13                         -0.3193276              -8.6893 (LUMO)
        14                         -0.3111184              -8.4660
        15                         -0.1992793              -5.4227
        16                          0.0696321               1.8948
        17                          0.1002244               2.7272
        18                          0.1995342               5.4296
        19                          0.4236041              11.5269
        20                          0.8220864              22.3701
      -------------------------------------------------------------
                  HL-Gap            0.0641963 Eh            1.7469 eV
             Fermi-level           -0.4049204 Eh          -11.0184 eV

     #   Z        covCN         q      C6AA      α(0)
     1   7 N      0.912    -0.153    24.304     7.130
     2   6 C      3.127     0.198    23.625     7.958
     3   6 C      2.731    -0.044    29.071     8.827
     4   6 C      2.223     0.043    29.232     8.754
     5   6 C      2.731    -0.045    29.080     8.829

 Mol. C6AA /au·bohr⁶  :        673.922653
 Mol. C8AA /au·bohr⁸  :      18568.109410
 Mol. α(0) /au        :         41.497834


Wiberg/Mayer (AO) data.
largest (>0.10) Wiberg bond orders for each atom
          total WBO             WBO to atom ...
     1  N   2.334        C    2 2.090    C    4 0.175
     2  C   3.857        N    1 2.090    C    3 0.853    C    5 0.847
     3  C   2.776        C    4 1.340    C    2 0.853    C    5 0.550
     4  C   2.926        C    5 1.344    C    3 1.340    N    1 0.175
     5  C   2.774        C    4 1.344    C    2 0.847    C    3 0.550

MOs/occ written to file <molden.input>


molecular dipole:
                 x           y           z       tot (Debye)
 q only:        0.098       0.009       0.306
   full:        0.174       0.019       0.463       1.258
molecular quadrupole (traceless):
                xx          xy          yy          xz          yz          zz
 q only:        0.415       0.038       0.400      -0.805      -0.135      -0.815
  q+dip:        1.133       0.334      -0.010      -1.426      -0.288      -1.123
   full:        2.432       0.652       0.102      -2.153      -0.387      -2.534

           -------------------------------------------------
          |                Geometry Summary                 |
           -------------------------------------------------

      molecular mass/u    :       62.0496468
   center of mass at/Å    :       -0.0210863      -0.0026165      -0.0553370
  moments of inertia/u·Å² :        0.2198982E+02   0.8539225E+02   0.1044871E+03
rotational constants/cm⁻¹ :        0.7666107E+00   0.1974141E+00   0.1613369E+00

 * 3 selected distances

     #   Z        #   Z                                     value/Å
     1   7 N      2   6 C                                 1.2031165 (min)
     3   6 C      4   6 C                                 1.3747024 (max)
     4   6 C      5   6 C                                 1.3740962

 * 2 distinct bonds (by element types)

   Z      Z             #   av. dist./Å        max./Å        min./Å
   6 C    6 C           2     1.3743993     1.3747024     1.3740962
   6 C    7 N           1     1.2031165     1.2031165     1.2031165

           -------------------------------------------------
          |               Frequency Printout                |
           -------------------------------------------------
 projected vibrational frequencies (cm-1)
eigval :       -0.00    -0.00    -0.00     0.00     0.00     0.00
eigval :      245.28   369.97   500.44   513.18   627.85   836.23
eigval :      957.13  1470.61  1854.95
 reduced masses (amu)
   1: 12.22   2: 13.09   3: 12.71   4: 12.48   5: 12.54   6: 12.29   7: 12.40   8: 12.67
   9: 12.03  10: 12.14  11: 12.36  12: 12.02  13: 12.36  14: 12.05  15: 12.80
 IR intensities (amu)
   1:  0.06   2:  0.07   3:  0.08   4:  0.06   5:  0.07   6:  0.04   7:  0.30   8:  0.15
   9:  0.67  10:  0.25  11:  0.08  12:  2.63  13:  0.10  14:  0.29  15:  0.72
 Raman intensities (amu)
   1:  0.00   2:  0.00   3:  0.00   4:  0.00   5:  0.00   6:  0.00   7:  0.00   8:  0.00
Molecule has the following symmetry elements: (sigma) 
It seems to be the Cs point group
   9:  0.00  10:  0.00  11:  0.00  12:  0.00  13:  0.00  14:  0.00  15:  0.00
 output can be read by thermo (or use thermo option).
 writing <g98.out> molden fake output.
 recommended (thermochemical) frequency scaling factor: 1.0
           -------------------------------------------------
          |             Thermodynamic Functions             |
           -------------------------------------------------

cs  symmetry found (for desy threshold:  0.10E+00) used in thermo

          ...................................................
          :                      SETUP                      :
          :.................................................:
          :  # frequencies                           9      :
          :  # imaginary freq.                       0      :
          :  linear?                             false      :
          :  only rotor calc.                    false      :
          :  symmetry                               cs      :
          :  rotational number                       1      :
          :  scaling factor                  1.0000000      :
          :  rotor cutoff                   50.0000000 cm⁻¹ :
          :  imag. cutoff                  -20.0000000 cm⁻¹ :
          :.................................................:

    mode    ω/cm⁻¹     T·S(HO)/kcal·mol⁻¹    T·S(FR)/kcal·mol⁻¹   T·S(vib)
   ------------------------------------------------------------------------
       1    245.28    -0.00000 ( 99.83%)     0.01411 (  0.17%)     0.00002
   ------------------------------------------------------------------------

   temp. (K)  partition function   enthalpy   heat capacity  entropy
                                   cal/mol     cal/K/mol   cal/K/mol   J/K/mol
 298.15  VIB   2.25                  963.336      7.871      4.839
         ROT  0.338E+05              888.752      2.981     23.707
         INT  0.760E+05             1852.088     10.852     28.546
         TR   0.473E+27             1481.254      4.968     38.278
         TOT                        3333.3423    15.8200    66.8237   279.5902

   temp. (K)  partition function   enthalpy   heat capacity  entropy
                                   cal/mol     cal/K/mol   cal/K/mol   J/K/mol
 120.00  VIB   1.07                   59.573      1.897      0.640
         ROT  0.864E+04              357.707      2.981     20.994
         INT  0.928E+04              417.280      4.878     21.633
         TR   0.121E+27              596.178      4.968     33.759
         TOT                        1013.4580     9.8464    55.3921   231.7606

   temp. (K)  partition function   enthalpy   heat capacity  entropy
                                   cal/mol     cal/K/mol   cal/K/mol   J/K/mol
 100.00  VIB   1.04                   28.592      1.214      0.359
         ROT  0.657E+04              298.089      2.981     20.450
         INT  0.681E+04              326.681      4.195     20.809
         TR   0.919E+26              496.815      4.968     32.853
         TOT                         823.4959     9.1628    53.6626   224.5244

   temp. (K)  partition function   enthalpy   heat capacity  entropy
                                   cal/mol     cal/K/mol   cal/K/mol   J/K/mol
  80.00  VIB   1.01                   10.328      0.635      0.157
         ROT  0.470E+04              238.471      2.981     19.785
         INT  0.477E+04              248.799      3.615     19.942
         TR   0.657E+26              397.452      4.968     31.745
         TOT                         646.2509     8.5836    51.6878   216.2616

   temp. (K)  partition function   enthalpy   heat capacity  entropy
                                   cal/mol     cal/K/mol   cal/K/mol   J/K/mol
  60.00  VIB   1.00                    2.127      0.218      0.042
         ROT  0.305E+04              178.853      2.981     18.928
         INT  0.306E+04              180.980      3.199     18.969
         TR   0.427E+26              298.089      4.968     30.317
         TOT                         479.0690     8.1671    49.2861   206.2129

   temp. (K)  partition function   enthalpy   heat capacity  entropy
                                   cal/mol     cal/K/mol   cal/K/mol   J/K/mol
  40.00  VIB   1.00                    0.105      0.023      0.003
         ROT  0.166E+04              119.236      2.981     17.719
         INT  0.166E+04              119.341      3.004     17.721
         TR   0.232E+26              198.726      4.968     28.303
         TOT                         318.0668     7.9724    46.0247   192.5675

   temp. (K)  partition function   enthalpy   heat capacity  entropy
                                   cal/mol     cal/K/mol   cal/K/mol   J/K/mol
  20.00  VIB   1.00                    0.000      0.000     -0.002
         ROT   588.                   59.618      2.981     15.653
         INT   588.                   59.618      2.981     15.651
         TR   0.822E+25               99.363      4.968     24.861
         TOT                         158.9808     7.9491    40.5121   169.5025

   temp. (K)  partition function   enthalpy   heat capacity  entropy
                                   cal/mol     cal/K/mol   cal/K/mol   J/K/mol
  10.00  VIB   1.00                    0.000      0.000     -0.004
         ROT   208.                   29.809      2.981     13.586
         INT   208.                   29.809      2.981     13.583
         TR   0.290E+25               49.681      4.968     21.419
         TOT                          79.4904     7.9490    35.0023   146.4496

       T/K    H(0)-H(T)+PV         H(T)/Eh          T*S/Eh         G(T)/Eh
   ------------------------------------------------------------------------
    298.15    0.531202E-02    0.221149E-01    0.317501E-01   -0.963514E-02
    120.00    0.161505E-02    0.184180E-01    0.105928E-01    0.782522E-02
    100.00    0.131232E-02    0.181152E-01    0.855168E-02    0.956357E-02
     80.00    0.102987E-02    0.178328E-01    0.658957E-02    0.112432E-01
     60.00    0.763445E-03    0.175664E-01    0.471254E-02    0.128538E-01
     40.00    0.506872E-03    0.173098E-01    0.293380E-02    0.143760E-01
     20.00    0.253352E-03    0.170563E-01    0.129120E-02    0.157651E-01
     10.00    0.126676E-03    0.169296E-01    0.557797E-03    0.163718E-01 (used)
   ------------------------------------------------------------------------

         :::::::::::::::::::::::::::::::::::::::::::::::::::::
         ::                  THERMODYNAMIC                  ::
         :::::::::::::::::::::::::::::::::::::::::::::::::::::
         :: total free energy         -11.009711699499 Eh   ::
         ::.................................................::
         :: total energy              -11.026083504072 Eh   ::
         :: zero point energy           0.016802925677 Eh   ::
         :: G(RRHO) w/o ZPVE           -0.000431121104 Eh   ::
         :: G(RRHO) contrib.            0.016371804573 Eh   ::
         :::::::::::::::::::::::::::::::::::::::::::::::::::::

optimized geometry written to: xtbopt.xyz


           -------------------------------------------------
          | TOTAL ENERGY              -11.026083504072 Eh   |
          | TOTAL ENTHALPY            -11.009153902380 Eh   |
          | TOTAL FREE ENERGY         -11.009711699499 Eh   |
          | GRADIENT NORM               0.000357608354 Eh/α |
          | HOMO-LUMO GAP               1.746871298951 eV   |
           -------------------------------------------------

------------------------------------------------------------------------
 * finished run on 2020/05/12 at 11:43:56.609     
------------------------------------------------------------------------
 total:
 * wall-time:     0 d,  0 h,  0 min,  0.228 sec
 *  cpu-time:     0 d,  0 h,  0 min,  0.228 sec
 * ratio c/w:     0.998 speedup
 SCF:
 * wall-time:     0 d,  0 h,  0 min,  0.005 sec
 *  cpu-time:     0 d,  0 h,  0 min,  0.005 sec
 * ratio c/w:     1.000 speedup
 ANC optimizer:
 * wall-time:     0 d,  0 h,  0 min,  0.105 sec
 *  cpu-time:     0 d,  0 h,  0 min,  0.105 sec
 * ratio c/w:     0.999 speedup
 numerical hessian:
 * wall-time:     0 d,  0 h,  0 min,  0.102 sec
 *  cpu-time:     0 d,  0 h,  0 min,  0.102 sec
 * ratio c/w:     0.998 speedup

