      -----------------------------------------------------------      
     |                   =====================                   |     
     |                           x T B                           |     
     |                   =====================                   |     
     |                         S. Grimme                         |     
     |          Mulliken Center for Theoretical Chemistry        |     
     |                    University of Bonn                     |     
      -----------------------------------------------------------      

   * xtb version 6.2.2 (9d81278992624c895f80dd42a50cac0aa55982e2) compiled by '@Darwin' on 04/03/2020

   xtb is free software: you can redistribute it and/or modify it under
   the terms of the GNU Lesser General Public License as published by
   the Free Software Foundation, either version 3 of the License, or
   (at your option) any later version.
   
   xtb is distributed in the hope that it will be useful,
   but WITHOUT ANY WARRANTY; without even the implied warranty of
   MERCHANTABILITY or FITNESS FOR A PARTICULAR PURPOSE.  See the
   GNU Lesser General Public License for more details.
   
   Cite this work as:
   * S. Grimme, C. Bannwarth, P. Shushkov, J. Chem. Theory Comput., 2017,
     13, 1989-2009. DOI: 10.1021/acs.jctc.7b00118
   * C. Bannwarth, S. Ehlert and S. Grimme., J. Chem. Theory Comput., 2019,
     15, 1652-1671. DOI: 10.1021/acs.jctc.8b01176
   * P. Pracht, E. Caldeweyher, S. Ehlert, S. Grimme, ChemRxiv, 2019, preprint.
     DOI: 10.26434/chemrxiv.8326202.v1
   
   for DFT-D4:
   * E. Caldeweyher, C. Bannwarth and S. Grimme, J. Chem. Phys., 2017,
     147, 034112. DOI: 10.1063/1.4993215
   * E. Caldeweyher, S. Ehlert, A. Hansen, H. Neugebauer, S. Spicher,
     C. Bannwarth and S. Grimme, J. Chem. Phys., 2019, 150, 154122.
     DOI: 10.1063/1.5090222
   
   for sTDA-xTB:
   * S. Grimme and C. Bannwarth, J. Chem. Phys., 2016, 145, 054103.
     DOI: 10.1063/1.4959605
   
   in the mass-spec context:
   * V. Asgeirsson, C. Bauer and S. Grimme, Chem. Sci., 2017, 8, 4879.
     DOI: 10.1039/c7sc00601b
   
   for metadynamics refer to:
   * S. Grimme, J. Chem. Theory Comput., 2019, 155, 2847-2862
     DOI: 10.1021/acs.jctc.9b00143
   
   with help from (in alphabetical order)
   C. Bannwarth, F. Bohle, G. Brandenburg, E. Caldeweyher, M. Checinski,
   S. Dohm, S. Ehlert, S. Ehrlich, F. März, H. Neugebauer, J. Pisarek,
   P. Pracht, P. Shushkov, and S. Spicher.
   
 * started run on 2020/05/12 at 11:45:19.470     

           -------------------------------------------------
          |                Calculation Setup                |
           -------------------------------------------------

          program call               : xtb --input C3O1_6_S_0.input C3O1_6_S_0.xyz --ohess --molden --namespace C3O1_6_S_0 output.out
          calculation namespace      : C3O1_6_S_0
          coordinate file            : C3O1_6_S_0.xyz
          number of atoms            :                     4
          number of electrons        :                    18
          charge                     :                     0
          spin                       :                   0.0
          first test random number   :      0.22569904907111

   ID    Z sym.   atoms
    1    8 O      1
    2    6 C      2-4

           -------------------------------------------------
          |                 G F N 2 - x T B                 |
           -------------------------------------------------

        Reference                      10.1021/acs.jctc.8b01176
      * Hamiltonian:
        H0-scaling (s, p, d)           1.850000    2.230000    2.230000
        zeta-weighting                 0.500000
      * Dispersion:
        s8                             2.700000
        a1                             0.520000
        a2                             5.000000
        s9                             5.000000
      * Repulsion:
        kExp                           1.500000    1.000000
        rExp                           1.000000
      * Coulomb:
        alpha                          2.000000
        third order                    shell-resolved
        anisotropic                    true
        a3                             3.000000
        a5                             4.000000
        cn-shift                       1.200000
        cn-exp                         4.000000
        max-rad                        5.000000


          ...................................................
          :                      SETUP                      :
          :.................................................:
          :  # basis functions                  16          :
          :  # atomic orbitals                  16          :
          :  # shells                            8          :
          :  # electrons                        18          :
          :  max. iterations                   250          :
          :  Hamiltonian                  GFN2-xTB          :
          :  restarted?                      false          :
          :  GBSA solvation                  false          :
          :  PC potential                    false          :
          :  electronic temp.          300.0000000     K    :
          :  accuracy                    1.0000000          :
          :  -> integral cutoff          0.2500000E+02      :
          :  -> integral neglect         0.1000000E-07      :
          :  -> SCF convergence          0.1000000E-05 Eh   :
          :  -> wf. convergence          0.1000000E-03 e    :
          :  Broyden damping             0.4000000          :
          ...................................................

 iter      E             dE          RMSdq      gap      omega  full diag
   1    -10.1578479 -0.101578E+02  0.904E+00    1.02       0.0  T
   2    -10.1287493  0.290987E-01  0.696E+00    0.30       1.0  T
   3    -10.0154962  0.113253E+00  0.546E+00    1.24       1.0  T
   4    -10.1773068 -0.161811E+00  0.112E+00    0.73       1.0  T
   5    -10.1803563 -0.304948E-02  0.349E-01    0.79       1.0  T
   6    -10.1804913 -0.134987E-03  0.703E-02    0.81       1.0  T
   7    -10.1804878  0.344602E-05  0.626E-02    0.81       1.0  T
   8    -10.1804992 -0.113323E-04  0.357E-02    0.81       1.4  T
   9    -10.1805013 -0.216499E-05  0.143E-02    0.81       3.5  T
  10    -10.1805024 -0.111584E-05  0.300E-03    0.81      16.7  T
  11    -10.1805025 -0.349364E-07  0.652E-04    0.81      76.7  T
  12    -10.1805025 -0.392445E-09  0.131E-04    0.81     382.9  T

   *** convergence criteria satisfied after 12 iterations ***

         #    Occupation            Energy/Eh            Energy/eV
      -------------------------------------------------------------
         1        2.0000           -0.8036713             -21.8690
       ...           ...                  ...                  ...
         3        2.0000           -0.6619838             -18.0135
         4        2.0000           -0.6398367             -17.4108
         5        2.0000           -0.6071381             -16.5211
         6        2.0000           -0.5663719             -15.4118
         7        2.0000           -0.5045232             -13.7288
         8        2.0000           -0.4769685             -12.9790
         9        2.0000           -0.4457527             -12.1295 (HOMO)
        10        0.0000           -0.4158477             -11.3158 (LUMO)
        11                         -0.3378168              -9.1925
        12                         -0.2762231              -7.5164
        13                         -0.0255345              -0.6948
        14                          0.0200844               0.5465
       ...                                ...                  ...
        16                          0.1831112               4.9827
      -------------------------------------------------------------
                  HL-Gap            0.0299050 Eh            0.8138 eV
             Fermi-level           -0.4308002 Eh          -11.7227 eV

 SCC (total)                   0 d,  0 h,  0 min,  0.004 sec
 SCC setup                      ...        0 min,  0.000 sec (  2.250%)
 Dispersion                     ...        0 min,  0.000 sec (  0.326%)
 integral evaluation            ...        0 min,  0.001 sec ( 29.091%)
 zeroth order Hamiltonian       ...        0 min,  0.000 sec (  0.454%)
 iterations                     ...        0 min,  0.001 sec ( 35.956%)
 molecular gradient             ...        0 min,  0.001 sec ( 29.845%)
 printout                       ...        0 min,  0.000 sec (  1.713%)

         :::::::::::::::::::::::::::::::::::::::::::::::::::::
         ::                     SUMMARY                     ::
         :::::::::::::::::::::::::::::::::::::::::::::::::::::
         :: total energy             -10.116451666156 Eh    ::
         :: gradient norm              0.134499963440 Eh/a0 ::
         :: HOMO-LUMO gap              0.813757719919 eV    ::
         ::.................................................::
         :: SCC energy               -10.180502479421 Eh    ::
         :: -> isotropic ES            0.002937055579 Eh    ::
         :: -> anisotropic ES          0.002947823415 Eh    ::
         :: -> anisotropic XC         -0.000304627834 Eh    ::
         :: -> dispersion             -0.001574819686 Eh    ::
         :: repulsion energy           0.064050808450 Eh    ::
         :: add. restraining           0.000000000000 Eh    ::
         :::::::::::::::::::::::::::::::::::::::::::::::::::::

      ----------------------------------------------------------- 
     |                   =====================                   |
     |                        A N C O P T                        |
     |                   =====================                   |
     |               Approximate Normal Coordinate               |
     |                Rational Function Optimizer                |
      ----------------------------------------------------------- 

          ...................................................
          :                      SETUP                      :
          :.................................................:
          :   optimization level            normal          :
          :   max. optcycles                   200          :
          :   ANC micro-cycles                  20          :
          :   degrees of freedom                 6          :
          :.................................................:
          :   RF solver                   davidson          :
          :   write xtbopt.log                true          :
          :   linear?                        false          :
          :   energy convergence         0.5000000E-05 Eh   :
          :   grad. convergence          0.1000000E-02 Eh/α :
          :   maximium RF displ.         1.0000000          :
          :   Hlow (freq-cutoff)         0.1000000E-01      :
          :   Hmax (freq-cutoff)         5.0000000          :
          :   S6 in model hess.         20.0000000          :
          ...................................................

generating ANC from model Hessian ...
Using Lindh-Hessian (1995)
 Shifting diagonal of input Hessian by    0.0000000000000000     
 Lowest  eigenvalues of input Hessian
   -0.000000   -0.000000   -0.000000    0.000000    0.000000    0.000000
    0.093414    0.664074    0.705818    1.077491    1.337759    1.614582
 Highest eigenvalues
    0.093414    0.664074    0.705818    1.077491    1.337759    1.614582


........................................................................
.............................. CYCLE    1 ..............................
........................................................................
   1    -10.1805025 -0.101805E+02  0.744E-05    0.81       0.0  T
   2    -10.1805025  0.407496E-10  0.994E-05    0.81     502.8  T
   3    -10.1805025 -0.562856E-10  0.338E-05    0.81    1480.9  T
     SCC iter.                  ...        0 min,  0.000 sec
     gradient                   ...        0 min,  0.001 sec
 * total energy  :   -10.1164517 Eh     change       -0.5759073E-09 Eh
   gradient norm :     0.1344991 Eh/α   predicted     0.0000000E+00 (-100.00%)
   displ. norm   :     0.5030347 α      lambda       -0.4681227E-01
   maximum displ.:     0.4876687 α      in ANC's #1, #2, #5, ...

........................................................................
.............................. CYCLE    2 ..............................
........................................................................
   1    -10.2105595 -0.102106E+02  0.271E+00    2.08       0.0  T
   2    -10.2026905  0.786899E-02  0.214E+00    1.70       1.0  T
   3    -10.2109533 -0.826285E-02  0.157E+00    2.10       1.0  T
   4    -10.2169499 -0.599659E-02  0.925E-02    1.98       1.0  T
   5    -10.2169500 -0.949595E-07  0.515E-02    1.98       1.0  T
   6    -10.2169509 -0.856773E-06  0.107E-02    1.99       4.7  T
   7    -10.2169513 -0.423375E-06  0.337E-03    1.98      14.8  T
   8    -10.2169512  0.495047E-07  0.383E-03    1.98      13.1  T
   9    -10.2169513 -0.687968E-07  0.282E-04    1.98     177.5  T
  10    -10.2169513 -0.187086E-10  0.874E-05    1.98     572.3  T
     SCC iter.                  ...        0 min,  0.001 sec
     gradient                   ...        0 min,  0.001 sec
 * total energy  :   -10.1459304 Eh     change       -0.2947869E-01 Eh
   gradient norm :     0.1051571 Eh/α   predicted    -0.2932891E-01 (  -0.51%)
   displ. norm   :     0.2342373 α      lambda       -0.1971677E-01
   maximum displ.:     0.1753689 α      in ANC's #2, #1, #5, ...

........................................................................
.............................. CYCLE    3 ..............................
........................................................................
   1    -10.2490603 -0.102491E+02  0.177E+00    2.39       0.0  T
   2    -10.2475442  0.151606E-02  0.143E+00    1.69       1.0  T
   3    -10.2551312 -0.758698E-02  0.696E-01    2.13       1.0  T
   4    -10.2555475 -0.416342E-03  0.117E-01    2.06       1.0  T
   5    -10.2555695 -0.219463E-04  0.474E-02    2.04       1.1  T
   6    -10.2555713 -0.180440E-05  0.516E-03    2.03       9.7  T
   7    -10.2555714 -0.123909E-06  0.192E-03    2.04      26.0  T
   8    -10.2555714 -0.346275E-08  0.323E-04    2.04     154.8  T
   9    -10.2555714 -0.353712E-09  0.175E-04    2.04     286.0  T
     SCC iter.                  ...        0 min,  0.001 sec
     gradient                   ...        0 min,  0.001 sec
 * total energy  :   -10.1572070 Eh     change       -0.1127662E-01 Eh
   gradient norm :     0.0264663 Eh/α   predicted    -0.1039928E-01 (  -7.78%)
   displ. norm   :     0.0724141 α      lambda       -0.1062063E-02
   maximum displ.:     0.0622575 α      in ANC's #1, #2, #6, ...

........................................................................
.............................. CYCLE    4 ..............................
........................................................................
   1    -10.2571364 -0.102571E+02  0.366E-01    2.10       0.0  T
   2    -10.2571247  0.116482E-04  0.242E-01    2.03       1.0  T
   3    -10.2571221  0.267452E-05  0.186E-01    2.11       1.0  T
   4    -10.2572047 -0.826873E-04  0.105E-02    2.07       4.8  T
   5    -10.2572048 -0.236868E-07  0.549E-03    2.07       9.1  T
   6    -10.2572048  0.111641E-08  0.938E-04    2.07      53.3  T
   7    -10.2572048 -0.444168E-08  0.258E-04    2.07     193.8  T
     SCC iter.                  ...        0 min,  0.001 sec
     gradient                   ...        0 min,  0.001 sec
 * total energy  :   -10.1579354 Eh     change       -0.7283728E-03 Eh
   gradient norm :     0.0165526 Eh/α   predicted    -0.5338157E-03 ( -26.71%)
   displ. norm   :     0.0378116 α      lambda       -0.3771916E-03
   maximum displ.:     0.0286667 α      in ANC's #1, #6, #2, ...

........................................................................
.............................. CYCLE    5 ..............................
........................................................................
   1    -10.2574822 -0.102575E+02  0.213E-01    2.09       0.0  T
   2    -10.2574816  0.684171E-06  0.152E-01    2.05       1.0  T
   3    -10.2575075 -0.259446E-04  0.978E-02    2.09       1.0  T
   4    -10.2575235 -0.159869E-04  0.153E-02    2.07       3.3  T
   5    -10.2575240 -0.496595E-06  0.475E-03    2.08      10.5  T
   6    -10.2575239  0.662841E-07  0.381E-03    2.08      13.1  T
   7    -10.2575240 -0.777401E-07  0.347E-04    2.08     144.2  T
   8    -10.2575240 -0.839044E-10  0.147E-04    2.08     340.6  T
     SCC iter.                  ...        0 min,  0.001 sec
     gradient                   ...        0 min,  0.001 sec
 * total energy  :   -10.1581421 Eh     change       -0.2067950E-03 Eh
   gradient norm :     0.0028073 Eh/α   predicted    -0.1888660E-03 (  -8.67%)
   displ. norm   :     0.0032067 α      lambda       -0.8332187E-05
   maximum displ.:     0.0026270 α      in ANC's #6, #2, #1, ...

........................................................................
.............................. CYCLE    6 ..............................
........................................................................
   1    -10.2575344 -0.102575E+02  0.270E-02    2.09       0.0  T
   2    -10.2575348 -0.430511E-06  0.147E-02    2.09       3.4  T
   3    -10.2575348  0.184112E-07  0.726E-03    2.09       6.9  T
   4    -10.2575348  0.406343E-07  0.383E-03    2.09      13.0  T
   5    -10.2575348 -0.766479E-07  0.942E-04    2.09      53.1  T
   6    -10.2575348 -0.248605E-09  0.364E-04    2.09     137.4  T
     SCC iter.                  ...        0 min,  0.000 sec
     gradient                   ...        0 min,  0.001 sec
 * total energy  :   -10.1581470 Eh     change       -0.4812346E-05 Eh
   gradient norm :     0.0007156 Eh/α   predicted    -0.4166302E-05 ( -13.42%)
   displ. norm   :     0.0015569 α      lambda       -0.6701113E-06
   maximum displ.:     0.0013487 α      in ANC's #2, #6, #5, ...

   *** GEOMETRY OPTIMIZATION CONVERGED AFTER 6 ITERATIONS ***

------------------------------------------------------------------------
 total energy gain   :        -0.0416953 Eh      -26.1642 kcal/mol
 total RMSD          :         0.3964833 a0        0.2098 Å
 total power (kW/mol):       -18.2451629 (step)-5926.3337 (real)
------------------------------------------------------------------------

 ANCopt (total)                0 d,  0 h,  0 min,  0.018 sec
 optimizer setup                ...        0 min,  0.000 sec (  0.390%)
 model hessian                  ...        0 min,  0.000 sec (  0.445%)
 ANC generation                 ...        0 min,  0.000 sec (  0.271%)
 coordinate transformation      ...        0 min,  0.000 sec (  0.083%)
 single point calculation       ...        0 min,  0.018 sec ( 95.774%)
 optimization log               ...        0 min,  0.000 sec (  0.775%)
 hessian update                 ...        0 min,  0.000 sec (  0.092%)
 rational function              ...        0 min,  0.000 sec (  0.962%)

================
 final structure:
================
4
 xtb: 6.2.2 (9d81278992624c895f80dd42a50cac0aa55982e2)
O        -1.16086420324315   -0.03009529885414    0.00100788471904
C        -0.02733452637920    0.74605527715724   -0.00000688900677
C         1.17683464969793    0.03051398626467   -0.00120106087066
C         0.01136407992442   -0.74647396456777    0.00020006515839

 Bond Distances (Angstroems)
 ---------------------------
O1-C2=1.3738         O1-C4=1.3738         C2-O1=1.3738         C2-C3=1.4007         C2-C4=1.4930         C3-C2=1.4007         
C3-C4=1.4007         C4-O1=1.3738         C4-C2=1.4930         C4-C3=1.4007         
 C  C  Rav=1.4315 sigma=0.0435  Rmin=1.4007  Rmax=1.4930     3
 O  C  Rav=1.3738 sigma=0.0000  Rmin=1.3738  Rmax=1.3738     2

 selected bond angles (degree)
 --------------------
C4-O1-C2= 65.83                C3-C2-O1=114.88                C4-C2-O1= 57.09                C4-C2-C3= 57.80                
C4-C3-C2= 64.41                C2-C4-O1= 57.08                C3-C4-O1=114.88                C3-C4-C2= 57.79                

 selected dihedral angles (degree)
 ---------------------------------
C3-C2-O1-C4=  0.00            C4-C3-C2-O1=  0.00            C3-C4-O1-C2=  0.00            O1-C4-C2-C3=180.02            
C3-C4-C2-O1=179.98            O1-C4-C3-C2=  0.00            
           -------------------------------------------------
          |                Final Singlepoint                |
           -------------------------------------------------

          ...................................................
          :                      SETUP                      :
          :.................................................:
          :  # basis functions                  16          :
          :  # atomic orbitals                  16          :
          :  # shells                            8          :
          :  # electrons                        18          :
          :  max. iterations                   250          :
          :  Hamiltonian                  GFN2-xTB          :
          :  restarted?                      false          :
          :  GBSA solvation                  false          :
          :  PC potential                    false          :
          :  electronic temp.          300.0000000     K    :
          :  accuracy                    1.0000000          :
          :  -> integral cutoff          0.2500000E+02      :
          :  -> integral neglect         0.1000000E-07      :
          :  -> SCF convergence          0.1000000E-05 Eh   :
          :  -> wf. convergence          0.1000000E-03 e    :
          :  Broyden damping             0.4000000          :
          ...................................................

 iter      E             dE          RMSdq      gap      omega  full diag
   1    -10.2575348 -0.102575E+02  0.159E-04    2.09       0.0  T
   2    -10.2575348 -0.188294E-12  0.889E-05    2.09     562.4  T
   3    -10.2575348  0.127258E-10  0.569E-05    2.09     878.7  T

   *** convergence criteria satisfied after 3 iterations ***

         #    Occupation            Energy/Eh            Energy/eV
      -------------------------------------------------------------
         1        2.0000           -0.8130898             -22.1253
       ...           ...                  ...                  ...
         3        2.0000           -0.6739397             -18.3388
         4        2.0000           -0.6334548             -17.2372
         5        2.0000           -0.6254063             -17.0182
         6        2.0000           -0.5811364             -15.8135
         7        2.0000           -0.4855524             -13.2126
         8        2.0000           -0.4648693             -12.6497
         9        2.0000           -0.4482287             -12.1969 (HOMO)
        10                         -0.3714987             -10.1090 (LUMO)
        11                         -0.3316820              -9.0255
        12                         -0.2602651              -7.0822
        13                          0.0732457               1.9931
        14                          0.1100388               2.9943
       ...                                ...                  ...
        16                          0.3772107              10.2644
      -------------------------------------------------------------
                  HL-Gap            0.0767300 Eh            2.0879 eV
             Fermi-level           -0.4098637 Eh          -11.1530 eV

 SCC (total)                   0 d,  0 h,  0 min,  0.003 sec
 SCC setup                      ...        0 min,  0.000 sec (  1.968%)
 Dispersion                     ...        0 min,  0.000 sec (  0.359%)
 integral evaluation            ...        0 min,  0.001 sec ( 38.151%)
 zeroth order Hamiltonian       ...        0 min,  0.000 sec (  0.471%)
 iterations                     ...        0 min,  0.000 sec ( 17.809%)
 molecular gradient             ...        0 min,  0.001 sec ( 38.733%)
 printout                       ...        0 min,  0.000 sec (  2.191%)

         :::::::::::::::::::::::::::::::::::::::::::::::::::::
         ::                     SUMMARY                     ::
         :::::::::::::::::::::::::::::::::::::::::::::::::::::
         :: total energy             -10.158146959731 Eh    ::
         :: gradient norm              0.000715294779 Eh/a0 ::
         :: HOMO-LUMO gap              2.087930098981 eV    ::
         ::.................................................::
         :: SCC energy               -10.257534828692 Eh    ::
         :: -> isotropic ES            0.008442920068 Eh    ::
         :: -> anisotropic ES          0.004712142416 Eh    ::
         :: -> anisotropic XC         -0.000486164764 Eh    ::
         :: -> dispersion             -0.001577937488 Eh    ::
         :: repulsion energy           0.099387866485 Eh    ::
         :: add. restraining           0.000000000000 Eh    ::
         :::::::::::::::::::::::::::::::::::::::::::::::::::::

           ------------------------------------------------- 
          |                Numerical Hessian                |
           ------------------------------------------------- 
step length          :   0.00500
SCC accuracy         :   0.30000
Hessian scale factor :   1.00000
frozen atoms in %    :   0.00000    0
RMS gradient         :   0.00072
estimated CPU  time      0.00 min
estimated wall time      0.00 min

writing file <hessian>.

 projected vibrational frequencies (cm-1)
eigval :       -0.00    -0.00    -0.00    -0.00     0.00     0.00
eigval :     -399.03   395.07   470.25   934.27  1366.05  1513.17
           -------------------------------------------------
          |                Property Printout                |
           -------------------------------------------------

    * Orbital Energies and Occupations

         #    Occupation            Energy/Eh            Energy/eV
      -------------------------------------------------------------
         1        2.0000           -0.8130899             -22.1253
         2        2.0000           -0.7282934             -19.8179
         3        2.0000           -0.6739398             -18.3388
         4        2.0000           -0.6334550             -17.2372
         5        2.0000           -0.6254064             -17.0182
         6        2.0000           -0.5811364             -15.8135
         7        2.0000           -0.4855525             -13.2126
         8        2.0000           -0.4648692             -12.6497
         9        2.0000           -0.4482285             -12.1969 (HOMO)
        10                         -0.3714988             -10.1090 (LUMO)
        11                         -0.3316820              -9.0255
        12                         -0.2602649              -7.0822
        13                          0.0732456               1.9931
        14                          0.1100388               2.9943
        15                          0.1991640               5.4195
        16                          0.3772108              10.2644
      -------------------------------------------------------------
                  HL-Gap            0.0767297 Eh            2.0879 eV
             Fermi-level           -0.4098637 Eh          -11.1530 eV

     #   Z        covCN         q      C6AA      α(0)
     1   8 O      1.707    -0.180    17.023     5.571
     2   6 C      2.810     0.159    24.562     8.120
     3   6 C      1.962    -0.137    34.928     9.544
     4   6 C      2.810     0.159    24.562     8.120

 Mol. C6AA /au·bohr⁶  :        395.949206
 Mol. C8AA /au·bohr⁸  :      10690.200806
 Mol. α(0) /au        :         31.354085


Wiberg/Mayer (AO) data.
largest (>0.10) Wiberg bond orders for each atom
          total WBO             WBO to atom ...
     1  O   2.243        C    2 0.976    C    4 0.976    C    3 0.290
     2  C   3.348        C    3 1.258    C    4 1.114    O    1 0.976
     3  C   2.806        C    2 1.258    C    4 1.258    O    1 0.290
     4  C   3.348        C    3 1.258    C    2 1.114    O    1 0.976

MOs/occ written to file <molden.input>


molecular dipole:
                 x           y           z       tot (Debye)
 q only:        0.086       0.002       0.000
   full:       -0.613      -0.016       0.001       1.559
molecular quadrupole (traceless):
                xx          xy          yy          xz          yz          zz
 q only:       -1.858      -0.085       1.401       0.002      -0.000       0.457
  q+dip:       -3.683      -0.132       1.389       0.005       0.000       2.294
   full:       -4.924      -0.159       1.211       0.008       0.001       3.713
Molecule has the following symmetry elements: (C2) 2*(sigma) 
It seems to be the C2v point group

           -------------------------------------------------
          |                Geometry Summary                 |
           -------------------------------------------------

      molecular mass/u    :       52.0316126
   center of mass at/Å    :       -0.0889902      -0.0023066       0.0000776
  moments of inertia/u·Å² :        0.1338681E+02   0.3780995E+02   0.5119676E+02
rotational constants/cm⁻¹ :        0.1259271E+01   0.4458518E+00   0.3292715E+00

 * 2 selected distances

     #   Z        #   Z                                     value/Å
     1   8 O      2   6 C                                 1.3737905 (min)
     1   8 O      4   6 C                                 1.3737970 (max)

 * 1 distinct bonds (by element types)

   Z      Z             #   av. dist./Å        max./Å        min./Å
   6 C    8 O           2     1.3737937     1.3737970     1.3737905

           -------------------------------------------------
          |               Frequency Printout                |
           -------------------------------------------------
 projected vibrational frequencies (cm-1)
eigval :       -0.00    -0.00    -0.00    -0.00     0.00     0.00
eigval :     -399.03   395.07   470.25   934.27  1366.05  1513.17
 reduced masses (amu)
   1: 12.35   2: 12.20   3: 14.52   4: 13.37   5: 13.43   6: 13.25   7: 13.10   8: 12.25
   9: 12.83  10: 13.49  11: 13.29  12: 12.02
 IR intensities (amu)
   1:  0.02   2:  0.13   3:  0.23   4:  0.13   5:  0.07   6:  0.08   7:  1.01   8:  1.45
   9:  0.75  10:  0.64  11:  1.17  12:  0.47
 Raman intensities (amu)
   1:  0.00   2:  0.00   3:  0.00   4:  0.00   5:  0.00   6:  0.00   7:  0.00   8:  0.00
   9:  0.00  10:  0.00  11:  0.00  12:  0.00
 output can be read by thermo (or use thermo option).
 writing <g98.out> molden fake output.
 recommended (thermochemical) frequency scaling factor: 1.0
           -------------------------------------------------
          |             Thermodynamic Functions             |
           -------------------------------------------------

c2v symmetry found (for desy threshold:  0.10E+00) used in thermo

          ...................................................
          :                      SETUP                      :
          :.................................................:
          :  # frequencies                           5      :
          :  # imaginary freq.                       1      :
          :  linear?                             false      :
          :  only rotor calc.                    false      :
          :  symmetry                              c2v      :
          :  rotational number                       2      :
          :  scaling factor                  1.0000000      :
          :  rotor cutoff                   50.0000000 cm⁻¹ :
          :  imag. cutoff                  -20.0000000 cm⁻¹ :
          :.................................................:

    mode    ω/cm⁻¹     T·S(HO)/kcal·mol⁻¹    T·S(FR)/kcal·mol⁻¹   T·S(vib)
   ------------------------------------------------------------------------
   ------------------------------------------------------------------------

   temp. (K)  partition function   enthalpy   heat capacity  entropy
                                   cal/mol     cal/K/mol   cal/K/mol   J/K/mol
 298.15  VIB   1.33                  390.229      3.442      1.872
         ROT  0.615E+04              888.752      2.981     20.318
         INT  0.816E+04             1278.981      6.423     22.189
         TR   0.363E+27             1481.254      4.968     37.753
         TOT                        2760.2354    11.3910    59.9429   250.8009

   temp. (K)  partition function   enthalpy   heat capacity  entropy
                                   cal/mol     cal/K/mol   cal/K/mol   J/K/mol
 120.00  VIB   1.01                   14.830      0.628      0.148
         ROT  0.157E+04              357.707      2.981     17.605
         INT  0.159E+04              372.536      3.609     17.753
         TR   0.927E+26              596.178      4.968     33.234
         TOT                         968.7144     8.5768    50.9873   213.3307

   temp. (K)  partition function   enthalpy   heat capacity  entropy
                                   cal/mol     cal/K/mol   cal/K/mol   J/K/mol
 100.00  VIB   1.00                    5.408      0.325      0.063
         ROT  0.119E+04              298.089      2.981     17.061
         INT  0.120E+04              303.497      3.306     17.125
         TR   0.705E+26              496.815      4.968     32.329
         TOT                         800.3122     8.2744    49.4533   206.9127

   temp. (K)  partition function   enthalpy   heat capacity  entropy
                                   cal/mol     cal/K/mol   cal/K/mol   J/K/mol
  80.00  VIB   1.00                    1.214      0.113      0.017
         ROT   855.                  238.471      2.981     16.396
         INT   855.                  239.685      3.094     16.413
         TR   0.505E+26              397.452      4.968     31.221
         TOT                         637.1368     8.0617    47.6341   199.3011

   temp. (K)  partition function   enthalpy   heat capacity  entropy
                                   cal/mol     cal/K/mol   cal/K/mol   J/K/mol
  60.00  VIB   1.00                    0.104      0.017      0.002
         ROT   555.                  178.853      2.981     15.539
         INT   555.                  178.957      2.998     15.540
         TR   0.328E+26              298.089      4.968     29.792
         TOT                         477.0462     7.9660    45.3326   189.6715

   temp. (K)  partition function   enthalpy   heat capacity  entropy
                                   cal/mol     cal/K/mol   cal/K/mol   J/K/mol
  40.00  VIB   1.00                    0.001      0.000     -0.000
         ROT   302.                  119.236      2.981     14.330
         INT   302.                  119.236      2.981     14.330
         TR   0.178E+26              198.726      4.968     27.779
         TOT                         317.9624     7.9493    42.1085   176.1818

   temp. (K)  partition function   enthalpy   heat capacity  entropy
                                   cal/mol     cal/K/mol   cal/K/mol   J/K/mol
  20.00  VIB   1.00                    0.000      0.000     -0.001
         ROT   107.                   59.618      2.981     12.264
         INT   107.                   59.618      2.981     12.263
         TR   0.631E+25               99.363      4.968     24.337
         TOT                         158.9808     7.9490    36.6000   153.1343

   temp. (K)  partition function   enthalpy   heat capacity  entropy
                                   cal/mol     cal/K/mol   cal/K/mol   J/K/mol
  10.00  VIB   1.00                    0.000      0.000     -0.001
         ROT   37.8                   29.809      2.981     10.198
         INT   37.8                   29.809      2.981     10.197
         TR   0.223E+25               49.681      4.968     20.895
         TOT                          79.4904     7.9490    31.0915   130.0870

       T/K    H(0)-H(T)+PV         H(T)/Eh          T*S/Eh         G(T)/Eh
   ------------------------------------------------------------------------
    298.15    0.439872E-02    0.150578E-01    0.284808E-01   -0.134230E-01
    120.00    0.154374E-02    0.122029E-01    0.975041E-02    0.245246E-02
    100.00    0.127538E-02    0.119345E-01    0.788089E-02    0.405361E-02
     80.00    0.101534E-02    0.116745E-01    0.607278E-02    0.560168E-02
     60.00    0.760222E-03    0.114193E-01    0.433452E-02    0.708481E-02
     40.00    0.506705E-03    0.111658E-01    0.268416E-02    0.848166E-02
     20.00    0.253352E-03    0.109125E-01    0.116652E-02    0.974595E-02
     10.00    0.126676E-03    0.107858E-01    0.495475E-03    0.102903E-01 (used)
   ------------------------------------------------------------------------

         :::::::::::::::::::::::::::::::::::::::::::::::::::::
         ::                  THERMODYNAMIC                  ::
         :::::::::::::::::::::::::::::::::::::::::::::::::::::
         :: total free energy         -10.147856642885 Eh   ::
         ::.................................................::
         :: total energy              -10.158146959937 Eh   ::
         :: zero point energy           0.010659116257 Eh   ::
         :: G(RRHO) w/o ZPVE           -0.000368799205 Eh   ::
         :: G(RRHO) contrib.            0.010290317052 Eh   ::
         :::::::::::::::::::::::::::::::::::::::::::::::::::::
imag cut-off (cm-1) :    5.00
 found            1  significant imaginary frequency
 writing imag mode distorted coords to xtbhess.xyz
 for further optimization.

optimized geometry written to: xtbopt.xyz


           -------------------------------------------------
          | TOTAL ENERGY              -10.158146959937 Eh   |
          | TOTAL ENTHALPY            -10.147361167665 Eh   |
          | TOTAL FREE ENERGY         -10.147856642885 Eh   |
          | GRADIENT NORM               0.000715428099 Eh/α |
          | HOMO-LUMO GAP               2.087921811023 eV   |
           -------------------------------------------------

------------------------------------------------------------------------
 * finished run on 2020/05/12 at 11:45:19.584     
------------------------------------------------------------------------
 total:
 * wall-time:     0 d,  0 h,  0 min,  0.113 sec
 *  cpu-time:     0 d,  0 h,  0 min,  0.113 sec
 * ratio c/w:     0.998 speedup
 SCF:
 * wall-time:     0 d,  0 h,  0 min,  0.004 sec
 *  cpu-time:     0 d,  0 h,  0 min,  0.004 sec
 * ratio c/w:     1.000 speedup
 ANC optimizer:
 * wall-time:     0 d,  0 h,  0 min,  0.022 sec
 *  cpu-time:     0 d,  0 h,  0 min,  0.022 sec
 * ratio c/w:     0.998 speedup
 numerical hessian:
 * wall-time:     0 d,  0 h,  0 min,  0.067 sec
 *  cpu-time:     0 d,  0 h,  0 min,  0.067 sec
 * ratio c/w:     0.999 speedup

