      -----------------------------------------------------------      
     |                   =====================                   |     
     |                           x T B                           |     
     |                   =====================                   |     
     |                         S. Grimme                         |     
     |          Mulliken Center for Theoretical Chemistry        |     
     |                    University of Bonn                     |     
      -----------------------------------------------------------      

   * xtb version 6.2.2 (9d81278992624c895f80dd42a50cac0aa55982e2) compiled by '@Darwin' on 04/03/2020

   xtb is free software: you can redistribute it and/or modify it under
   the terms of the GNU Lesser General Public License as published by
   the Free Software Foundation, either version 3 of the License, or
   (at your option) any later version.
   
   xtb is distributed in the hope that it will be useful,
   but WITHOUT ANY WARRANTY; without even the implied warranty of
   MERCHANTABILITY or FITNESS FOR A PARTICULAR PURPOSE.  See the
   GNU Lesser General Public License for more details.
   
   Cite this work as:
   * S. Grimme, C. Bannwarth, P. Shushkov, J. Chem. Theory Comput., 2017,
     13, 1989-2009. DOI: 10.1021/acs.jctc.7b00118
   * C. Bannwarth, S. Ehlert and S. Grimme., J. Chem. Theory Comput., 2019,
     15, 1652-1671. DOI: 10.1021/acs.jctc.8b01176
   * P. Pracht, E. Caldeweyher, S. Ehlert, S. Grimme, ChemRxiv, 2019, preprint.
     DOI: 10.26434/chemrxiv.8326202.v1
   
   for DFT-D4:
   * E. Caldeweyher, C. Bannwarth and S. Grimme, J. Chem. Phys., 2017,
     147, 034112. DOI: 10.1063/1.4993215
   * E. Caldeweyher, S. Ehlert, A. Hansen, H. Neugebauer, S. Spicher,
     C. Bannwarth and S. Grimme, J. Chem. Phys., 2019, 150, 154122.
     DOI: 10.1063/1.5090222
   
   for sTDA-xTB:
   * S. Grimme and C. Bannwarth, J. Chem. Phys., 2016, 145, 054103.
     DOI: 10.1063/1.4959605
   
   in the mass-spec context:
   * V. Asgeirsson, C. Bauer and S. Grimme, Chem. Sci., 2017, 8, 4879.
     DOI: 10.1039/c7sc00601b
   
   for metadynamics refer to:
   * S. Grimme, J. Chem. Theory Comput., 2019, 155, 2847-2862
     DOI: 10.1021/acs.jctc.9b00143
   
   with help from (in alphabetical order)
   C. Bannwarth, F. Bohle, G. Brandenburg, E. Caldeweyher, M. Checinski,
   S. Dohm, S. Ehlert, S. Ehrlich, F. März, H. Neugebauer, J. Pisarek,
   P. Pracht, P. Shushkov, and S. Spicher.
   
 * started run on 2020/05/12 at 11:44:07.071     

           -------------------------------------------------
          |                Calculation Setup                |
           -------------------------------------------------

          program call               : xtb --input C4N1_21_S_1.input C4N1_21_S_1.xyz --ohess --molden --namespace C4N1_21_S_1 output.out
          calculation namespace      : C4N1_21_S_1
          coordinate file            : C4N1_21_S_1.xyz
          number of atoms            :                     5
          number of electrons        :                    21
          charge                     :                     0
          spin                       :                   0.5
          first test random number   :      0.06218295491143

   ID    Z sym.   atoms
    1    6 C      1, 2, 4, 5
    2    7 N      3

           -------------------------------------------------
          |                 G F N 2 - x T B                 |
           -------------------------------------------------

        Reference                      10.1021/acs.jctc.8b01176
      * Hamiltonian:
        H0-scaling (s, p, d)           1.850000    2.230000    2.230000
        zeta-weighting                 0.500000
      * Dispersion:
        s8                             2.700000
        a1                             0.520000
        a2                             5.000000
        s9                             5.000000
      * Repulsion:
        kExp                           1.500000    1.000000
        rExp                           1.000000
      * Coulomb:
        alpha                          2.000000
        third order                    shell-resolved
        anisotropic                    true
        a3                             3.000000
        a5                             4.000000
        cn-shift                       1.200000
        cn-exp                         4.000000
        max-rad                        5.000000


          ...................................................
          :                      SETUP                      :
          :.................................................:
          :  # basis functions                  20          :
          :  # atomic orbitals                  20          :
          :  # shells                           10          :
          :  # electrons                        21          :
          :  max. iterations                   250          :
          :  Hamiltonian                  GFN2-xTB          :
          :  restarted?                      false          :
          :  GBSA solvation                  false          :
          :  PC potential                    false          :
          :  electronic temp.          300.0000000     K    :
          :  accuracy                    1.0000000          :
          :  -> integral cutoff          0.2500000E+02      :
          :  -> integral neglect         0.1000000E-07      :
          :  -> SCF convergence          0.1000000E-05 Eh   :
          :  -> wf. convergence          0.1000000E-03 e    :
          :  Broyden damping             0.4000000          :
          ...................................................

 iter      E             dE          RMSdq      gap      omega  full diag
   1    -10.8042896 -0.108043E+02  0.117E+01    1.15       0.0  T
   2     -6.5390279  0.426526E+01  0.185E+01    1.16       1.0  T
   3     -8.4230601 -0.188403E+01  0.131E+01    0.57       1.0  T
   4    -10.7681573 -0.234510E+01  0.796E+00    1.29       1.0  T
   5    -10.8808393 -0.112682E+00  0.585E+00    1.13       1.0  T
   6    -10.8785208  0.231849E-02  0.458E+00    1.24       1.0  T
   7    -10.9338819 -0.553611E-01  0.348E+00    1.21       1.0  T
   8    -10.9843415 -0.504596E-01  0.310E+00    1.07       1.0  T
   9    -10.9837052  0.636354E-03  0.263E+00    1.14       1.0  T
  10    -10.9820394  0.166581E-02  0.337E+00    1.09       1.0  T
  11    -10.9843342 -0.229489E-02  0.339E+00    1.12       1.0  T
  12    -10.9725981  0.117362E-01  0.178E+00    1.16       1.0  T
  13    -10.9803282 -0.773014E-02  0.151E+00    1.13       1.0  T
  14    -10.9896960 -0.936783E-02  0.169E+00    1.03       1.0  T
  15    -10.9958174 -0.612139E-02  0.325E-01    0.97       1.0  T
  16    -10.9958807 -0.632447E-04  0.154E-01    0.98       1.0  T
  17    -10.9959512 -0.705647E-04  0.426E-02    0.98       1.0  T
  18    -10.9959557 -0.443804E-05  0.188E-02    0.98       2.4  T
  19    -10.9959560 -0.332388E-06  0.136E-02    0.98       3.3  T
  20    -10.9959570 -0.959552E-06  0.487E-03    0.98       9.2  T
  21    -10.9959569  0.330095E-07  0.411E-03    0.98      10.9  T
  22    -10.9959570 -0.625687E-07  0.942E-04    0.98      47.5  T
  23    -10.9959570 -0.179184E-08  0.714E-04    0.98      62.7  T

   *** convergence criteria satisfied after 23 iterations ***

         #    Occupation            Energy/Eh            Energy/eV
      -------------------------------------------------------------
         1        2.0000           -0.7279223             -19.8078
       ...           ...                  ...                  ...
         5        2.0000           -0.5791394             -15.7592
         6        2.0000           -0.5395040             -14.6807
         7        2.0000           -0.5233712             -14.2417
         8        2.0000           -0.5212138             -14.1829
         9        2.0000           -0.4590975             -12.4927
        10        1.6900           -0.4441475             -12.0859
        11        1.3100           -0.4426268             -12.0445 (HOMO)
        12                         -0.4066748             -11.0662 (LUMO)
        13                         -0.3826688             -10.4129
        14                         -0.3653447              -9.9415
        15                         -0.3241760              -8.8213
        16                         -0.1264981              -3.4422
       ...                                ...                  ...
        20                          0.1289060               3.5077
      -------------------------------------------------------------
                  HL-Gap            0.0359520 Eh            0.9783 eV
             Fermi-level           -0.4339753 Eh          -11.8091 eV

 SCC (total)                   0 d,  0 h,  0 min,  0.005 sec
 SCC setup                      ...        0 min,  0.000 sec (  1.521%)
 Dispersion                     ...        0 min,  0.000 sec (  0.332%)
 integral evaluation            ...        0 min,  0.001 sec ( 23.758%)
 zeroth order Hamiltonian       ...        0 min,  0.000 sec (  0.389%)
 iterations                     ...        0 min,  0.002 sec ( 45.959%)
 molecular gradient             ...        0 min,  0.001 sec ( 26.424%)
 printout                       ...        0 min,  0.000 sec (  1.428%)

         :::::::::::::::::::::::::::::::::::::::::::::::::::::
         ::                     SUMMARY                     ::
         :::::::::::::::::::::::::::::::::::::::::::::::::::::
         :: total energy             -10.928766331709 Eh    ::
         :: gradient norm              0.352879455912 Eh/a0 ::
         :: HOMO-LUMO gap              0.978303569540 eV    ::
         ::.................................................::
         :: SCC energy               -10.995956991563 Eh    ::
         :: -> isotropic ES           -0.022588204925 Eh    ::
         :: -> anisotropic ES         -0.000058561285 Eh    ::
         :: -> anisotropic XC          0.009342819126 Eh    ::
         :: -> dispersion             -0.002871802113 Eh    ::
         :: repulsion energy           0.067190652140 Eh    ::
         :: add. restraining           0.000000000000 Eh    ::
         :::::::::::::::::::::::::::::::::::::::::::::::::::::

      ----------------------------------------------------------- 
     |                   =====================                   |
     |                        A N C O P T                        |
     |                   =====================                   |
     |               Approximate Normal Coordinate               |
     |                Rational Function Optimizer                |
      ----------------------------------------------------------- 

          ...................................................
          :                      SETUP                      :
          :.................................................:
          :   optimization level            normal          :
          :   max. optcycles                   200          :
          :   ANC micro-cycles                  20          :
          :   degrees of freedom                 9          :
          :.................................................:
          :   RF solver                   davidson          :
          :   write xtbopt.log                true          :
          :   linear?                        false          :
          :   energy convergence         0.5000000E-05 Eh   :
          :   grad. convergence          0.1000000E-02 Eh/α :
          :   maximium RF displ.         1.0000000          :
          :   Hlow (freq-cutoff)         0.1000000E-01      :
          :   Hmax (freq-cutoff)         5.0000000          :
          :   S6 in model hess.         20.0000000          :
          ...................................................

generating ANC from model Hessian ...
Using Lindh-Hessian (1995)
 Shifting diagonal of input Hessian by    0.0000000000000000     
 Lowest  eigenvalues of input Hessian
   -0.000000   -0.000000   -0.000000    0.000000    0.000000    0.000000
    0.012789    0.065828    0.071438    0.106947    0.684055    0.696166
    0.925626    1.084277    1.336616
 Highest eigenvalues
    0.106947    0.684055    0.696166    0.925626    1.084277    1.336616


........................................................................
.............................. CYCLE    1 ..............................
........................................................................
   1    -10.9959570 -0.109960E+02  0.251E-04    0.98       0.0  T
   2    -10.9959570  0.112819E-07  0.145E-03    0.98      30.7  T
   3    -10.9959570 -0.111293E-07  0.291E-04    0.98     153.6  T
   4    -10.9959570 -0.116659E-09  0.241E-04    0.98     185.9  T
     SCC iter.                  ...        0 min,  0.001 sec
     gradient                   ...        0 min,  0.001 sec
 * total energy  :   -10.9287663 Eh     change        0.7818830E-09 Eh
   gradient norm :     0.3528797 Eh/α   predicted     0.0000000E+00 (-100.00%)
   displ. norm   :     0.4080975 α      lambda       -0.1241947E+00
   maximum displ.:     0.2925735 α      in ANC's #7, #4, #3, ...

........................................................................
.............................. CYCLE    2 ..............................
........................................................................
   1    -11.1372228 -0.111372E+02  0.293E+00    1.23       0.0  T
   2    -11.0916224  0.456005E-01  0.345E+00    1.72       1.0  T
   3    -11.1390792 -0.474568E-01  0.205E+00    0.95       1.0  T
   4    -11.1405166 -0.143736E-02  0.146E+00    1.39       1.0  T
   5    -11.1524612 -0.119446E-01  0.602E-01    1.33       1.0  T
   6    -11.1523303  0.130909E-03  0.587E-01    1.27       1.0  T
   7    -11.1526240 -0.293697E-03  0.303E-01    1.32       1.0  T
   8    -11.1529384 -0.314401E-03  0.120E-01    1.33       1.0  T
   9    -11.1529987 -0.602796E-04  0.542E-02    1.33       1.0  T
  10    -11.1530060 -0.728475E-05  0.151E-02    1.32       3.0  T
  11    -11.1530060 -0.602419E-07  0.210E-03    1.32      21.3  T
  12    -11.1530060 -0.101846E-07  0.105E-03    1.32      42.6  T
  13    -11.1530060 -0.212757E-08  0.120E-04    1.32     372.5  T
  14    -11.1530060 -0.351896E-10  0.224E-05    1.32    1998.6  T
     SCC iter.                  ...        0 min,  0.001 sec
     gradient                   ...        0 min,  0.001 sec
 * total energy  :   -11.0329432 Eh     change       -0.1041768E+00 Eh
   gradient norm :     0.2261416 Eh/α   predicted    -0.7243927E-01 ( -30.47%)
   displ. norm   :     0.5477497 α      lambda       -0.1166930E+00
   maximum displ.:     0.4492479 α      in ANC's #7, #4, #5, ...

........................................................................
.............................. CYCLE    3 ..............................
........................................................................
   1    -11.3453322 -0.113453E+02  0.388E+00    1.84       0.0  T
   2    -11.3493427 -0.401051E-02  0.274E+00    2.27       1.0  T
   3    -11.3634430 -0.141003E-01  0.165E+00    1.81       1.0  T
   4    -11.3570623  0.638066E-02  0.140E+00    2.20       1.0  T
   5    -11.3670268 -0.996444E-02  0.241E-01    2.00       1.0  T
   6    -11.3664905  0.536295E-03  0.412E-01    1.99       1.0  T
   7    -11.3670752 -0.584680E-03  0.157E-01    1.99       1.0  T
   8    -11.3671103 -0.351299E-04  0.245E-02    2.00       1.8  T
   9    -11.3671107 -0.430136E-06  0.997E-03    2.00       4.5  T
  10    -11.3671108 -0.562528E-07  0.134E-03    2.00      33.4  T
  11    -11.3671108 -0.686834E-08  0.491E-04    2.00      91.0  T
  12    -11.3671108 -0.316165E-09  0.120E-04    2.00     372.0  T
     SCC iter.                  ...        0 min,  0.001 sec
     gradient                   ...        0 min,  0.001 sec
 * total energy  :   -11.0622835 Eh     change       -0.2934038E-01 Eh
   gradient norm :     0.4770416 Eh/α   predicted    -0.7585219E-01 ( 158.52%)
   displ. norm   :     0.3891330 α      lambda       -0.1048440E+00
   maximum displ.:     0.2970828 α      in ANC's #4, #3, #8, ...

........................................................................
.............................. CYCLE    4 ..............................
........................................................................
   1    -11.2966064 -0.112966E+02  0.239E+00    1.96       0.0  T
   2    -11.2807447  0.158617E-01  0.224E+00    1.46       1.0  T
   3    -11.3030438 -0.222991E-01  0.145E+00    2.06       1.0  T
   4    -11.3078659 -0.482216E-02  0.812E-01    1.74       1.0  T
   5    -11.3103083 -0.244241E-02  0.299E-01    1.82       1.0  T
   6    -11.3096212  0.687141E-03  0.521E-01    1.82       1.0  T
   7    -11.3105074 -0.886236E-03  0.221E-01    1.83       1.0  T
   8    -11.3106248 -0.117379E-03  0.202E-02    1.86       2.2  T
   9    -11.3106258 -0.100522E-05  0.846E-03    1.86       5.3  T
  10    -11.3106260 -0.194632E-06  0.152E-03    1.86      29.4  T
  11    -11.3106260 -0.503861E-08  0.495E-04    1.86      90.3  T
  12    -11.3106260 -0.514246E-09  0.756E-05    1.86     591.5  T
     SCC iter.                  ...        0 min,  0.001 sec
     gradient                   ...        0 min,  0.001 sec
 * total energy  :   -11.1063374 Eh     change       -0.4405384E-01 Eh
   gradient norm :     0.1267483 Eh/α   predicted    -0.6035997E-01 (  37.01%)
   displ. norm   :     0.2355054 α      lambda       -0.1687123E-01
   maximum displ.:     0.1520649 α      in ANC's #3, #4, #5, ...

........................................................................
.............................. CYCLE    5 ..............................
........................................................................
   1    -11.2980506 -0.112981E+02  0.862E-01    1.98       0.0  T
   2    -11.2971469  0.903726E-03  0.687E-01    2.06       1.0  T
   3    -11.2960357  0.111118E-02  0.779E-01    1.85       1.0  T
   4    -11.2984055 -0.236985E-02  0.172E-01    2.01       1.0  T
   5    -11.2976529  0.752691E-03  0.471E-01    1.99       1.0  T
   6    -11.2984665 -0.813693E-03  0.160E-01    1.99       1.0  T
   7    -11.2984985 -0.319158E-04  0.121E-01    1.98       1.0  T
   8    -11.2985443 -0.458568E-04  0.316E-02    2.00       1.4  T
   9    -11.2985454 -0.110536E-05  0.155E-02    2.00       2.9  T
  10    -11.2985458 -0.392106E-06  0.324E-03    2.00      13.8  T
  11    -11.2985458 -0.221278E-07  0.897E-04    2.00      49.8  T
  12    -11.2985458 -0.164629E-08  0.484E-05    2.00     923.1  T
     SCC iter.                  ...        0 min,  0.001 sec
     gradient                   ...        0 min,  0.001 sec
 * total energy  :   -11.1142360 Eh     change       -0.7898585E-02 Eh
   gradient norm :     0.0605633 Eh/α   predicted    -0.8903476E-02 (  12.72%)
   displ. norm   :     0.1711018 α      lambda       -0.7253640E-02
   maximum displ.:     0.1157576 α      in ANC's #7, #5, #3, ...

........................................................................
.............................. CYCLE    6 ..............................
........................................................................
   1    -11.3157774 -0.113158E+02  0.716E-01    2.17       0.0  T
   2    -11.3144839  0.129352E-02  0.697E-01    2.06       1.0  T
   3    -11.3146617 -0.177848E-03  0.663E-01    2.22       1.0  T
   4    -11.3140950  0.566769E-03  0.706E-01    2.12       1.0  T
   5    -11.3155863 -0.149138E-02  0.369E-01    2.12       1.0  T
   6    -11.3161627 -0.576345E-03  0.686E-02    2.15       1.0  T
   7    -11.3161548  0.793408E-05  0.750E-02    2.14       1.0  T
   8    -11.3161670 -0.122479E-04  0.489E-03    2.15       9.1  T
   9    -11.3161671 -0.699272E-07  0.483E-03    2.15       9.3  T
  10    -11.3161671 -0.601333E-07  0.364E-04    2.15     122.9  T
  11    -11.3161671 -0.177355E-09  0.200E-04    2.15     223.5  T
     SCC iter.                  ...        0 min,  0.001 sec
     gradient                   ...        0 min,  0.001 sec
 * total energy  :   -11.1191020 Eh     change       -0.4866021E-02 Eh
   gradient norm :     0.0352772 Eh/α   predicted    -0.3732999E-02 ( -23.28%)
   displ. norm   :     0.0915631 α      lambda       -0.1962279E-02
   maximum displ.:     0.0739006 α      in ANC's #7, #5, #8, ...

........................................................................
.............................. CYCLE    7 ..............................
........................................................................
   1    -11.3294263 -0.113294E+02  0.347E-01    2.22       0.0  T
   2    -11.3292276  0.198735E-03  0.334E-01    2.22       1.0  T
   3    -11.3284414  0.786237E-03  0.566E-01    2.23       1.0  T
   4    -11.3292597 -0.818369E-03  0.291E-01    2.22       1.0  T
   5    -11.3294589 -0.199143E-03  0.159E-01    2.20       1.0  T
   6    -11.3295766 -0.117757E-03  0.225E-02    2.22       2.0  T
   7    -11.3295771 -0.470799E-06  0.156E-02    2.22       2.9  T
   8    -11.3295779 -0.827691E-06  0.366E-03    2.22      12.2  T
   9    -11.3295779 -0.235301E-07  0.236E-03    2.22      19.0  T
  10    -11.3295780 -0.156403E-07  0.543E-04    2.22      82.4  T
  11    -11.3295780 -0.719263E-09  0.249E-04    2.22     179.9  T
     SCC iter.                  ...        0 min,  0.001 sec
     gradient                   ...        0 min,  0.001 sec
 * total energy  :   -11.1202345 Eh     change       -0.1132490E-02 Eh
   gradient norm :     0.0086475 Eh/α   predicted    -0.9893640E-03 ( -12.64%)
   displ. norm   :     0.0449927 α      lambda       -0.1807940E-03
   maximum displ.:     0.0289201 α      in ANC's #7, #4, #3, ...

........................................................................
.............................. CYCLE    8 ..............................
........................................................................
   1    -11.3291383 -0.113291E+02  0.207E-01    2.22       0.0  T
   2    -11.3281274  0.101094E-02  0.509E-01    2.26       1.0  T
   3    -11.3287559 -0.628510E-03  0.361E-01    2.23       1.0  T
   4    -11.3290949 -0.339016E-03  0.166E-01    2.21       1.0  T
   5    -11.3291615 -0.665942E-04  0.867E-02    2.24       1.0  T
   6    -11.3291818 -0.203568E-04  0.518E-02    2.23       1.0  T
   7    -11.3291860 -0.412018E-05  0.363E-02    2.23       1.2  T
   8    -11.3291898 -0.382495E-05  0.927E-03    2.23       4.8  T
   9    -11.3291900 -0.188160E-06  0.497E-03    2.23       9.0  T
  10    -11.3291901 -0.767539E-07  0.198E-04    2.23     225.5  T
  11    -11.3291901 -0.113809E-09  0.172E-05    2.23    2598.4  T
     SCC iter.                  ...        0 min,  0.002 sec
     gradient                   ...        0 min,  0.001 sec
 * total energy  :   -11.1202824 Eh     change       -0.4789098E-04 Eh
   gradient norm :     0.0101304 Eh/α   predicted    -0.9058090E-04 (  89.14%)
   displ. norm   :     0.0193157 α      lambda       -0.1214187E-03
   maximum displ.:     0.0152747 α      in ANC's #4, #7, #3, ...

........................................................................
.............................. CYCLE    9 ..............................
........................................................................
   1    -11.3317588 -0.113318E+02  0.231E-01    2.23       0.0  T
   2    -11.3285249  0.323389E-02  0.888E-01    2.21       1.0  T
   3    -11.3313597 -0.283478E-02  0.394E-01    2.22       1.0  T
   4    -11.3316159 -0.256140E-03  0.289E-01    2.23       1.0  T
   5    -11.3317554 -0.139488E-03  0.190E-01    2.22       1.0  T
   6    -11.3318555 -0.100161E-03  0.756E-02    2.22       1.0  T
   7    -11.3318683 -0.128201E-04  0.406E-02    2.22       1.1  T
   8    -11.3318736 -0.525366E-05  0.186E-03    2.23      24.0  T
   9    -11.3318736 -0.617959E-08  0.112E-03    2.23      39.8  T
  10    -11.3318736 -0.362616E-08  0.274E-05    2.23    1633.0  T
  11    -11.3318736 -0.683897E-12  0.103E-05    2.23    4333.9  T
     SCC iter.                  ...        0 min,  0.001 sec
     gradient                   ...        0 min,  0.001 sec
 * total energy  :   -11.1203565 Eh     change       -0.7414654E-04 Eh
   gradient norm :     0.0063635 Eh/α   predicted    -0.6073083E-04 ( -18.09%)
   displ. norm   :     0.0299699 α      lambda       -0.9657170E-04
   maximum displ.:     0.0203289 α      in ANC's #3, #2, #6, ...

........................................................................
.............................. CYCLE   10 ..............................
........................................................................
   1    -11.3316517 -0.113317E+02  0.760E-01    2.21       0.0  T
   2    -11.3024600  0.291917E-01  0.256E+00    2.14       1.0  T
   3    -11.3288463 -0.263863E-01  0.108E+00    2.17       1.0  T
   4    -11.3312235 -0.237719E-02  0.697E-01    2.23       1.0  T
   5    -11.3326882 -0.146469E-02  0.220E-01    2.20       1.0  T
   6    -11.3326836  0.456183E-05  0.212E-01    2.20       1.0  T
   7    -11.3326916 -0.792273E-05  0.199E-01    2.20       1.0  T
   8    -11.3327874 -0.958067E-04  0.304E-02    2.21       1.5  T
   9    -11.3327884 -0.998347E-06  0.169E-02    2.21       2.6  T
  10    -11.3327889 -0.579257E-06  0.601E-03    2.21       7.4  T
  11    -11.3327890 -0.323529E-07  0.271E-03    2.21      16.5  T
  12    -11.3327890 -0.122148E-07  0.337E-04    2.21     132.5  T
  13    -11.3327890 -0.193820E-09  0.866E-05    2.21     516.3  T
     SCC iter.                  ...        0 min,  0.001 sec
     gradient                   ...        0 min,  0.001 sec
 * total energy  :   -11.1204800 Eh     change       -0.1234505E-03 Eh
   gradient norm :     0.0132201 Eh/α   predicted    -0.4833003E-04 ( -60.85%)
   displ. norm   :     0.0479769 α      lambda       -0.3171456E-03
   maximum displ.:     0.0282990 α      in ANC's #2, #3, #6, ...

........................................................................
.............................. CYCLE   11 ..............................
........................................................................
   1    -11.3317976 -0.113318E+02  0.125E+00    2.17       0.0  T
   2    -11.2781405  0.536571E-01  0.332E+00    2.04       1.0  T
   3    -11.3273991 -0.492587E-01  0.139E+00    2.11       1.0  T
   4    -11.3331836 -0.578445E-02  0.780E-01    2.18       1.0  T
   5    -11.3340344 -0.850836E-03  0.505E-01    2.15       1.0  T
   6    -11.3340573 -0.228361E-04  0.500E-01    2.15       1.0  T
   7    -11.3343929 -0.335658E-03  0.291E-01    2.15       1.0  T
   8    -11.3345419 -0.149010E-03  0.140E-01    2.16       1.0  T
   9    -11.3345687 -0.267162E-04  0.698E-02    2.17       1.0  T
  10    -11.3345767 -0.800387E-05  0.146E-02    2.17       3.1  T
  11    -11.3345770 -0.362441E-06  0.388E-03    2.17      11.5  T
  12    -11.3345770 -0.244222E-07  0.843E-04    2.17      53.0  T
  13    -11.3345770 -0.103103E-08  0.129E-04    2.17     346.7  T
     SCC iter.                  ...        0 min,  0.002 sec
     gradient                   ...        0 min,  0.001 sec
 * total energy  :   -11.1209812 Eh     change       -0.5012780E-03 Eh
   gradient norm :     0.0286017 Eh/α   predicted    -0.1589362E-03 ( -68.29%)
   displ. norm   :     0.0903868 α      lambda       -0.1398073E-02
   maximum displ.:     0.0559949 α      in ANC's #2, #6, #1, ...

........................................................................
.............................. CYCLE   12 ..............................
........................................................................
   1    -11.3375262 -0.113375E+02  0.110E+00    2.05       0.0  T
   2    -11.3310496  0.647668E-02  0.107E+00    1.92       1.0  T
   3    -11.3349124 -0.386289E-02  0.101E+00    2.06       1.0  T
   4    -11.3385826 -0.367013E-02  0.299E-01    2.01       1.0  T
   5    -11.3387348 -0.152236E-03  0.170E-01    2.02       1.0  T
   6    -11.3387392 -0.441371E-05  0.162E-01    2.02       1.0  T
   7    -11.3387558 -0.166029E-04  0.607E-02    2.02       1.0  T
   8    -11.3387690 -0.132150E-04  0.882E-03    2.01       5.1  T
   9    -11.3387692 -0.127357E-06  0.190E-03    2.01      23.6  T
  10    -11.3387692 -0.370559E-08  0.196E-04    2.01     227.8  T
  11    -11.3387692  0.749516E-10  0.273E-04    2.01     164.0  T
     SCC iter.                  ...        0 min,  0.001 sec
     gradient                   ...        0 min,  0.001 sec
 * total energy  :   -11.1223927 Eh     change       -0.1411450E-02 Eh
   gradient norm :     0.0290257 Eh/α   predicted    -0.7047471E-03 ( -50.07%)
   displ. norm   :     0.2645049 α      lambda       -0.5812257E-02
   maximum displ.:     0.2242645 α      in ANC's #6, #2, #3, ...

........................................................................
.............................. CYCLE   13 ..............................
........................................................................
   1    -11.3436751 -0.113437E+02  0.191E+00    1.32       0.0  T
   2    -11.3388169  0.485813E-02  0.134E+00    0.94       1.0  T
   3    -11.3437533 -0.493636E-02  0.115E+00    1.28       1.0  T
   4    -11.3480538 -0.430044E-02  0.376E-01    1.23       1.0  T
   5    -11.3489482 -0.894455E-03  0.984E-02    1.17       1.0  T
   6    -11.3489654 -0.172026E-04  0.659E-02    1.17       1.0  T
   7    -11.3489750 -0.960519E-05  0.196E-02    1.17       2.3  T
   8    -11.3489770 -0.201489E-05  0.375E-03    1.17      11.9  T
   9    -11.3489770  0.412016E-08  0.110E-03    1.17      40.6  T
  10    -11.3489770 -0.582693E-08  0.182E-04    1.17     245.9  T
  11    -11.3489770 -0.214868E-10  0.261E-05    1.17    1715.3  T
     SCC iter.                  ...        0 min,  0.001 sec
     gradient                   ...        0 min,  0.001 sec
 * total energy  :   -11.1149587 Eh     change        0.7433996E-02 Eh
   gradient norm :     0.1110413 Eh/α   predicted    -0.3109453E-02 (-141.83%)
   displ. norm   :     0.1993044 α      lambda       -0.1700035E-01
   maximum displ.:     0.1433292 α      in ANC's #6, #2, #3, ...

........................................................................
.............................. CYCLE   14 ..............................
........................................................................
   1    -11.3337736 -0.113338E+02  0.132E+00    1.61       0.0  T
   2    -11.3303229  0.345075E-02  0.104E+00    1.79       1.0  T
   3    -11.3354688 -0.514593E-02  0.717E-01    1.67       1.0  T
   4    -11.3366261 -0.115732E-02  0.304E-01    1.64       1.0  T
   5    -11.3372107 -0.584579E-03  0.653E-02    1.71       1.0  T
   6    -11.3372180 -0.732825E-05  0.414E-02    1.70       1.1  T
   7    -11.3372239 -0.584535E-05  0.692E-03    1.70       6.5  T
   8    -11.3372240 -0.114935E-06  0.311E-03    1.70      14.4  T
   9    -11.3372240 -0.215820E-08  0.867E-04    1.70      51.6  T
  10    -11.3372240 -0.387138E-08  0.132E-04    1.70     339.1  T
     SCC iter.                  ...        0 min,  0.001 sec
     gradient                   ...        0 min,  0.001 sec
 * total energy  :   -11.1235765 Eh     change       -0.8617827E-02 Eh
   gradient norm :     0.0105918 Eh/α   predicted    -0.8837822E-02 (   2.55%)
   displ. norm   :     0.0949732 α      lambda       -0.4371918E-03
   maximum displ.:     0.0831966 α      in ANC's #1, #2, #3, ...

........................................................................
.............................. CYCLE   15 ..............................
........................................................................
   1    -11.3367344 -0.113367E+02  0.406E-01    1.80       0.0  T
   2    -11.3366924  0.420048E-04  0.256E-01    1.83       1.0  T
   3    -11.3363831  0.309282E-03  0.256E-01    1.79       1.0  T
   4    -11.3367865 -0.403401E-03  0.444E-02    1.81       1.0  T
   5    -11.3367962 -0.973461E-05  0.183E-02    1.82       2.4  T
   6    -11.3367970 -0.775485E-06  0.932E-03    1.81       4.8  T
   7    -11.3367970  0.993145E-09  0.621E-03    1.82       7.2  T
   8    -11.3367972 -0.221906E-06  0.838E-04    1.81      53.4  T
   9    -11.3367972 -0.759302E-09  0.126E-04    1.81     356.0  T
     SCC iter.                  ...        0 min,  0.001 sec
     gradient                   ...        0 min,  0.001 sec
 * total energy  :   -11.1237716 Eh     change       -0.1950576E-03 Eh
   gradient norm :     0.0044687 Eh/α   predicted    -0.2205680E-03 (  13.08%)
   displ. norm   :     0.0458520 α      lambda       -0.8426115E-04
   maximum displ.:     0.0415883 α      in ANC's #1, #2, #6, ...

........................................................................
.............................. CYCLE   16 ..............................
........................................................................
   1    -11.3354129 -0.113354E+02  0.159E-01    1.79       0.0  T
   2    -11.3354109  0.198570E-05  0.981E-02    1.78       1.0  T
   3    -11.3353647  0.462344E-04  0.939E-02    1.80       1.0  T
   4    -11.3354172 -0.525155E-04  0.147E-02    1.78       3.0  T
   5    -11.3354181 -0.932383E-06  0.647E-03    1.78       6.9  T
   6    -11.3354181  0.760219E-07  0.482E-03    1.78       9.3  T
   7    -11.3354182 -0.152547E-06  0.479E-04    1.78      93.4  T
   8    -11.3354182 -0.144221E-09  0.260E-04    1.78     172.3  T
     SCC iter.                  ...        0 min,  0.001 sec
     gradient                   ...        0 min,  0.001 sec
 * total energy  :   -11.1238191 Eh     change       -0.4749803E-04 Eh
   gradient norm :     0.0027525 Eh/α   predicted    -0.4222069E-04 ( -11.11%)
   displ. norm   :     0.0076849 α      lambda       -0.9470704E-05
   maximum displ.:     0.0059091 α      in ANC's #2, #6, #8, ...

........................................................................
.............................. CYCLE   17 ..............................
........................................................................
   1    -11.3356162 -0.113356E+02  0.367E-02    1.78       0.0  T
   2    -11.3356151  0.110206E-05  0.261E-02    1.78       1.7  T
   3    -11.3356149  0.184337E-06  0.237E-02    1.77       1.9  T
   4    -11.3356171 -0.217209E-05  0.705E-03    1.78       6.3  T
   5    -11.3356174 -0.253307E-06  0.249E-03    1.78      18.0  T
   6    -11.3356174 -0.241490E-07  0.134E-03    1.78      33.4  T
   7    -11.3356174  0.117354E-08  0.960E-04    1.78      46.6  T
   8    -11.3356174 -0.571626E-08  0.118E-04    1.78     380.0  T
     SCC iter.                  ...        0 min,  0.001 sec
     gradient                   ...        0 min,  0.001 sec
 * total energy  :   -11.1238223 Eh     change       -0.3171582E-05 Eh
   gradient norm :     0.0010117 Eh/α   predicted    -0.4735034E-05 (  49.30%)
   displ. norm   :     0.0071897 α      lambda       -0.2149089E-05
   maximum displ.:     0.0052267 α      in ANC's #3, #1, #7, ...

........................................................................
.............................. CYCLE   18 ..............................
........................................................................
   1    -11.3353068 -0.113353E+02  0.272E-02    1.78       0.0  T
   2    -11.3353061  0.701465E-06  0.197E-02    1.78       2.3  T
   3    -11.3353060  0.114433E-06  0.178E-02    1.78       2.5  T
   4    -11.3353073 -0.126141E-05  0.482E-03    1.78       9.3  T
   5    -11.3353074 -0.127852E-06  0.129E-03    1.78      34.6  T
   6    -11.3353074 -0.509031E-08  0.656E-04    1.78      68.2  T
   7    -11.3353074 -0.134794E-09  0.337E-04    1.78     132.8  T
     SCC iter.                  ...        0 min,  0.001 sec
     gradient                   ...        0 min,  0.001 sec
 * total energy  :   -11.1238236 Eh     change       -0.1310755E-05 Eh
   gradient norm :     0.0014077 Eh/α   predicted    -0.1075875E-05 ( -17.92%)
   displ. norm   :     0.0026789 α      lambda       -0.7721641E-06
   maximum displ.:     0.0019084 α      in ANC's #3, #8, #2, ...

........................................................................
.............................. CYCLE   19 ..............................
........................................................................
   1    -11.3354632 -0.113355E+02  0.103E-02    1.78       0.0  T
   2    -11.3354632  0.517110E-07  0.681E-03    1.78       6.6  T
   3    -11.3354631  0.108177E-06  0.685E-03    1.78       6.5  T
   4    -11.3354633 -0.191681E-06  0.200E-03    1.78      22.3  T
   5    -11.3354633 -0.241798E-07  0.386E-04    1.78     116.0  T
   6    -11.3354633 -0.683542E-10  0.280E-04    1.78     159.9  T
     SCC iter.                  ...        0 min,  0.001 sec
     gradient                   ...        0 min,  0.001 sec
 * total energy  :   -11.1238245 Eh     change       -0.9363690E-06 Eh
   gradient norm :     0.0007629 Eh/α   predicted    -0.3851401E-06 ( -58.87%)
   displ. norm   :     0.0092973 α      lambda       -0.1471523E-05
   maximum displ.:     0.0080072 α      in ANC's #3, #8, #7, ...

   *** GEOMETRY OPTIMIZATION CONVERGED AFTER 19 ITERATIONS ***

------------------------------------------------------------------------
 total energy gain   :        -0.1950582 Eh     -122.4008 kcal/mol
 total RMSD          :         0.6666050 a0        0.3528 Å
 total power (kW/mol):       -26.9539550 (step)-7142.1256 (real)
------------------------------------------------------------------------

 ANCopt (total)                0 d,  0 h,  0 min,  0.072 sec
 optimizer setup                ...        0 min,  0.000 sec (  0.075%)
 model hessian                  ...        0 min,  0.000 sec (  0.099%)
 ANC generation                 ...        0 min,  0.000 sec (  0.083%)
 coordinate transformation      ...        0 min,  0.000 sec (  0.049%)
 single point calculation       ...        0 min,  0.070 sec ( 97.770%)
 optimization log               ...        0 min,  0.000 sec (  0.638%)
 hessian update                 ...        0 min,  0.000 sec (  0.054%)
 rational function              ...        0 min,  0.000 sec (  0.523%)

================
 final structure:
================
5
 xtb: 6.2.2 (9d81278992624c895f80dd42a50cac0aa55982e2)
C        -1.44267098589220    0.80570091477124   -0.06352812604625
C        -0.26376661204598   -0.04672720478177   -0.37256173803237
N         1.01443763878093   -0.08226525035049   -0.57214398497982
C        -1.48804063892581   -0.58101188208769   -0.26042824128098
C         2.18003959808306   -0.09569557755129   -0.74454490966058

 Bond Distances (Angstroems)
 ---------------------------
C1-C2=1.4873         C1-C4=1.4014         C2-C1=1.4873         C2-N3=1.2942         C2-C4=1.3405         N3-C2=1.2942         
N3-C5=1.1784         C4-C1=1.4014         C4-C2=1.3405         C5-N3=1.1784         
 C  C  Rav=1.4097 sigma=0.0602  Rmin=1.3405  Rmax=1.4873     3
 N  C  Rav=1.2363 sigma=0.0579  Rmin=1.1784  Rmax=1.2942     2

 selected bond angles (degree)
 --------------------
C4-C1-C2= 55.20                N3-C2-C1=146.17                C4-C2-C1= 59.14                C4-C2-N3=154.69                
C5-N3-C2=178.97                C2-C4-C1= 65.66                

 selected dihedral angles (degree)
 ---------------------------------
N3-C2-C1-C4=180.37            C5-N3-C2-C1= 18.04            C5-N3-C2-C4=198.78            C1-C4-C2-N3=179.52            
           -------------------------------------------------
          |                Final Singlepoint                |
           -------------------------------------------------

          ...................................................
          :                      SETUP                      :
          :.................................................:
          :  # basis functions                  20          :
          :  # atomic orbitals                  20          :
          :  # shells                           10          :
          :  # electrons                        21          :
          :  max. iterations                   250          :
          :  Hamiltonian                  GFN2-xTB          :
          :  restarted?                      false          :
          :  GBSA solvation                  false          :
          :  PC potential                    false          :
          :  electronic temp.          300.0000000     K    :
          :  accuracy                    1.0000000          :
          :  -> integral cutoff          0.2500000E+02      :
          :  -> integral neglect         0.1000000E-07      :
          :  -> SCF convergence          0.1000000E-05 Eh   :
          :  -> wf. convergence          0.1000000E-03 e    :
          :  Broyden damping             0.4000000          :
          ...................................................

 iter      E             dE          RMSdq      gap      omega  full diag
   1    -11.3354633 -0.113355E+02  0.142E-04    1.78       0.0  T
   2    -11.3354633  0.105947E-09  0.177E-04    1.78     252.8  T
   3    -11.3354633 -0.219325E-09  0.353E-05    1.78    1266.5  T

   *** convergence criteria satisfied after 3 iterations ***

         #    Occupation            Energy/Eh            Energy/eV
      -------------------------------------------------------------
         1        2.0000           -0.7286554             -19.8277
       ...           ...                  ...                  ...
         5        2.0000           -0.5855222             -15.9329
         6        2.0000           -0.5451188             -14.8334
         7        2.0000           -0.5273065             -14.3487
         8        2.0000           -0.5046118             -13.7312
         9        2.0000           -0.4773339             -12.9889
        10        2.0000           -0.4318355             -11.7508
        11        1.0000           -0.4085737             -11.1179 (HOMO)
        12                         -0.3432155              -9.3394 (LUMO)
        13                         -0.2878629              -7.8331
        14                         -0.2725649              -7.4169
        15                         -0.1989963              -5.4150
        16                         -0.0330317              -0.8988
       ...                                ...                  ...
        20                          1.0703437              29.1255
      -------------------------------------------------------------
                  HL-Gap            0.0653582 Eh            1.7785 eV
             Fermi-level           -0.3980496 Eh          -10.8315 eV

 SCC (total)                   0 d,  0 h,  0 min,  0.003 sec
 SCC setup                      ...        0 min,  0.000 sec (  1.226%)
 Dispersion                     ...        0 min,  0.000 sec (  0.228%)
 integral evaluation            ...        0 min,  0.001 sec ( 38.571%)
 zeroth order Hamiltonian       ...        0 min,  0.000 sec (  0.456%)
 iterations                     ...        0 min,  0.000 sec (  8.937%)
 molecular gradient             ...        0 min,  0.001 sec ( 48.208%)
 printout                       ...        0 min,  0.000 sec (  2.075%)

         :::::::::::::::::::::::::::::::::::::::::::::::::::::
         ::                     SUMMARY                     ::
         :::::::::::::::::::::::::::::::::::::::::::::::::::::
         :: total energy             -11.123824498673 Eh    ::
         :: gradient norm              0.000768333043 Eh/a0 ::
         :: HOMO-LUMO gap              1.778486778064 eV    ::
         ::.................................................::
         :: SCC energy               -11.335463293147 Eh    ::
         :: -> isotropic ES           -0.015416142615 Eh    ::
         :: -> anisotropic ES          0.000608264190 Eh    ::
         :: -> anisotropic XC          0.016903384472 Eh    ::
         :: -> dispersion             -0.002807184348 Eh    ::
         :: repulsion energy           0.211638867527 Eh    ::
         :: add. restraining           0.000000000000 Eh    ::
         :::::::::::::::::::::::::::::::::::::::::::::::::::::

           ------------------------------------------------- 
          |                Numerical Hessian                |
           ------------------------------------------------- 
step length          :   0.00500
SCC accuracy         :   0.30000
Hessian scale factor :   1.00000
frozen atoms in %    :   0.00000    0
RMS gradient         :   0.00077
estimated CPU  time      0.00 min
estimated wall time      0.00 min

writing file <hessian>.

 projected vibrational frequencies (cm-1)
eigval :       -0.00    -0.00    -0.00    -0.00     0.00     0.00
eigval :      187.95   193.28   444.24   488.39   731.00  1010.24
eigval :     1231.04  1812.91  2097.81
           -------------------------------------------------
          |                Property Printout                |
           -------------------------------------------------

    * Orbital Energies and Occupations

         #    Occupation            Energy/Eh            Energy/eV
      -------------------------------------------------------------
         1        2.0000           -0.7286553             -19.8277
         2        2.0000           -0.7180523             -19.5392
         3        2.0000           -0.6770382             -18.4231
         4        2.0000           -0.6067496             -16.5105
         5        2.0000           -0.5855220             -15.9329
         6        2.0000           -0.5451188             -14.8334
         7        2.0000           -0.5273066             -14.3487
         8        2.0000           -0.5046118             -13.7312
         9        2.0000           -0.4773335             -12.9889
        10        2.0000           -0.4318357             -11.7508
        11        1.0000           -0.4085739             -11.1179 (HOMO)
        12                         -0.3432154              -9.3394 (LUMO)
        13                         -0.2878633              -7.8332
        14                         -0.2725646              -7.4169
        15                         -0.1989961              -5.4150
        16                         -0.0330318              -0.8988
        17                          0.0369185               1.0046
        18                          0.3000719               8.1654
        19                          0.5631175              15.3232
        20                          1.0703440              29.1255
      -------------------------------------------------------------
                  HL-Gap            0.0653585 Eh            1.7785 eV
             Fermi-level           -0.3980497 Eh          -10.8315 eV

     #   Z        covCN         q      C6AA      α(0)
     1   6 C      1.958    -0.114    34.250     9.451
     2   6 C      2.875     0.163    24.474     8.110
     3   7 N      1.821     0.060    20.843     6.765
     4   6 C      1.961    -0.017    31.516     9.066
     5   6 C      0.916    -0.093    38.384    10.372

 Mol. C6AA /au·bohr⁶  :        737.303680
 Mol. C8AA /au·bohr⁸  :      20428.882673
 Mol. α(0) /au        :         43.762901


Wiberg/Mayer (AO) data.
largest (>0.10) Wiberg bond orders for each atom
          total WBO             WBO to atom ...
     1  C   2.533        C    4 1.319    C    2 1.054    C    5 0.130
     2  C   3.835        C    4 1.467    N    3 1.258    C    1 1.054
     3  N   3.710        C    5 2.374    C    2 1.258
     4  C   2.951        C    2 1.467    C    1 1.319    C    5 0.118
     5  C   2.677        N    3 2.374    C    1 0.130    C    4 0.118

MOs/occ written to file <molden.input>


molecular dipole:
                 x           y           z       tot (Debye)
 q only:        0.010      -0.162      -0.028
   full:        0.018      -0.449      -0.074       1.157
molecular quadrupole (traceless):
                xx          xy          yy          xz          yz          zz
 q only:       -2.131       0.721       0.880       0.614       0.013       1.251
  q+dip:       -5.001       2.738       2.009       1.616      -0.076       2.992
   full:       -7.521       2.705       1.826       2.431      -0.523       5.695

           -------------------------------------------------
          |                Geometry Summary                 |
           -------------------------------------------------

      molecular mass/u    :       62.0496468
   center of mass at/Å    :        0.0326301      -0.0026469      -0.4080939
  moments of inertia/u·Å² :        0.1184745E+02   0.1275329E+03   0.1393795E+03
rotational constants/cm⁻¹ :        0.1422892E+01   0.1321826E+00   0.1209477E+00

 * 3 selected distances

     #   Z        #   Z                                     value/Å
     2   6 C      3   7 N                                 1.2941801
     2   6 C      4   6 C                                 1.3404779 (max)
     3   7 N      5   6 C                                 1.1783592 (min)

 * 2 distinct bonds (by element types)

   Z      Z             #   av. dist./Å        max./Å        min./Å
   6 C    6 C           1     1.3404779     1.3404779     1.3404779
   6 C    7 N           2     1.2362696     1.2941801     1.1783592

           -------------------------------------------------
          |               Frequency Printout                |
           -------------------------------------------------
 projected vibrational frequencies (cm-1)
eigval :       -0.00    -0.00    -0.00    -0.00     0.00     0.00
eigval :      187.95   193.28   444.24   488.39   731.00  1010.24
Molecule has the following symmetry elements: (sigma) 
It seems to be the Cs point group
eigval :     1231.04  1812.91  2097.81
 reduced masses (amu)
   1: 12.36   2: 12.33   3: 12.38   4: 12.12   5: 12.43   6: 12.22   7: 12.72   8: 12.40
   9: 12.98  10: 12.63  11: 12.30  12: 12.13  13: 12.05  14: 12.01  15: 13.09
 IR intensities (amu)
   1:  0.09   2:  0.10   3:  0.06   4:  0.14   5:  0.13   6:  0.08   7:  0.37   8:  0.36
   9:  0.18  10:  0.40  11:  0.14  12:  0.21  13:  0.32  14:  0.32  15:  0.28
 Raman intensities (amu)
   1:  0.00   2:  0.00   3:  0.00   4:  0.00   5:  0.00   6:  0.00   7:  0.00   8:  0.00
   9:  0.00  10:  0.00  11:  0.00  12:  0.00  13:  0.00  14:  0.00  15:  0.00
 output can be read by thermo (or use thermo option).
 writing <g98.out> molden fake output.
 recommended (thermochemical) frequency scaling factor: 1.0
           -------------------------------------------------
          |             Thermodynamic Functions             |
           -------------------------------------------------

cs  symmetry found (for desy threshold:  0.10E+00) used in thermo

          ...................................................
          :                      SETUP                      :
          :.................................................:
          :  # frequencies                           9      :
          :  # imaginary freq.                       0      :
          :  linear?                             false      :
          :  only rotor calc.                    false      :
          :  symmetry                               cs      :
          :  rotational number                       1      :
          :  scaling factor                  1.0000000      :
          :  rotor cutoff                   50.0000000 cm⁻¹ :
          :  imag. cutoff                  -20.0000000 cm⁻¹ :
          :.................................................:

    mode    ω/cm⁻¹     T·S(HO)/kcal·mol⁻¹    T·S(FR)/kcal·mol⁻¹   T·S(vib)
   ------------------------------------------------------------------------
       1    187.95    -0.00000 ( 99.50%)     0.01146 (  0.50%)     0.00006
       2    193.28    -0.00000 ( 99.55%)     0.01174 (  0.45%)     0.00005
   ------------------------------------------------------------------------

   temp. (K)  partition function   enthalpy   heat capacity  entropy
                                   cal/mol     cal/K/mol   cal/K/mol   J/K/mol
 298.15  VIB   3.60                 1132.992      7.710      6.347
         ROT  0.351E+05              888.752      2.981     23.777
         INT  0.126E+06             2021.745     10.691     30.124
         TR   0.473E+27             1481.254      4.968     38.278
         TOT                        3502.9986    15.6592    68.4021   286.1945

   temp. (K)  partition function   enthalpy   heat capacity  entropy
                                   cal/mol     cal/K/mol   cal/K/mol   J/K/mol
 120.00  VIB   1.25                  134.031      3.116      1.565
         ROT  0.895E+04              357.707      2.981     21.064
         INT  0.112E+05              491.737      6.097     22.629
         TR   0.121E+27              596.178      4.968     33.759
         TOT                        1087.9155    11.0650    56.3877   235.9261

   temp. (K)  partition function   enthalpy   heat capacity  entropy
                                   cal/mol     cal/K/mol   cal/K/mol   J/K/mol
 100.00  VIB   1.15                   78.494      2.430      1.061
         ROT  0.681E+04              298.089      2.981     20.521
         INT  0.780E+04              376.583      5.411     21.581
         TR   0.919E+26              496.815      4.968     32.853
         TOT                         873.3983    10.3787    54.4348   227.7552

   temp. (K)  partition function   enthalpy   heat capacity  entropy
                                   cal/mol     cal/K/mol   cal/K/mol   J/K/mol
  80.00  VIB   1.07                   37.224      1.686      0.603
         ROT  0.487E+04              238.471      2.981     19.855
         INT  0.521E+04              275.695      4.667     20.459
         TR   0.657E+26              397.452      4.968     31.745
         TOT                         673.1474     9.6354    52.2041   218.4218

   temp. (K)  partition function   enthalpy   heat capacity  entropy
                                   cal/mol     cal/K/mol   cal/K/mol   J/K/mol
  60.00  VIB   1.02                   11.454      0.886      0.237
         ROT  0.316E+04              178.853      2.981     18.998
         INT  0.323E+04              190.307      3.866     19.235
         TR   0.427E+26              298.089      4.968     30.317
         TOT                         488.3964     8.8345    49.5517   207.3244

   temp. (K)  partition function   enthalpy   heat capacity  entropy
                                   cal/mol     cal/K/mol   cal/K/mol   J/K/mol
  40.00  VIB   1.00                    1.153      0.198      0.035
         ROT  0.172E+04              119.236      2.981     17.789
         INT  0.173E+04              120.388      3.179     17.824
         TR   0.232E+26              198.726      4.968     28.303
         TOT                         319.1144     8.1467    46.1273   192.9966

   temp. (K)  partition function   enthalpy   heat capacity  entropy
                                   cal/mol     cal/K/mol   cal/K/mol   J/K/mol
  20.00  VIB   1.00                    0.001      0.001     -0.005
         ROT   609.                   59.618      2.981     15.723
         INT   609.                   59.619      2.982     15.718
         TR   0.822E+25               99.363      4.968     24.861
         TOT                         158.9820     7.9499    40.5796   169.7850

   temp. (K)  partition function   enthalpy   heat capacity  entropy
                                   cal/mol     cal/K/mol   cal/K/mol   J/K/mol
  10.00  VIB   1.00                    0.000      0.000     -0.012
         ROT   215.                   29.809      2.981     13.657
         INT   215.                   29.809      2.981     13.645
         TR   0.290E+25               49.681      4.968     21.419
         TOT                          79.4904     7.9490    35.0647   146.7105

       T/K    H(0)-H(T)+PV         H(T)/Eh          T*S/Eh         G(T)/Eh
   ------------------------------------------------------------------------
    298.15    0.558238E-02    0.242562E-01    0.325001E-01   -0.824384E-02
    120.00    0.173370E-02    0.204075E-01    0.107831E-01    0.962440E-02
    100.00    0.139185E-02    0.200657E-01    0.867474E-02    0.113909E-01
     80.00    0.107273E-02    0.197466E-01    0.665540E-02    0.130912E-01
     60.00    0.778309E-03    0.194521E-01    0.473794E-02    0.147142E-01
     40.00    0.508541E-03    0.191824E-01    0.294034E-02    0.162420E-01
     20.00    0.253354E-03    0.189272E-01    0.129335E-02    0.176338E-01
     10.00    0.126676E-03    0.188005E-01    0.558791E-03    0.182417E-01 (used)
   ------------------------------------------------------------------------

         :::::::::::::::::::::::::::::::::::::::::::::::::::::
         ::                  THERMODYNAMIC                  ::
         :::::::::::::::::::::::::::::::::::::::::::::::::::::
         :: total free energy         -11.105582777735 Eh   ::
         ::.................................................::
         :: total energy              -11.123824498425 Eh   ::
         :: zero point energy           0.018673835462 Eh   ::
         :: G(RRHO) w/o ZPVE           -0.000432114772 Eh   ::
         :: G(RRHO) contrib.            0.018241720690 Eh   ::
         :::::::::::::::::::::::::::::::::::::::::::::::::::::

optimized geometry written to: xtbopt.xyz


           -------------------------------------------------
          | TOTAL ENERGY              -11.123824498425 Eh   |
          | TOTAL ENTHALPY            -11.105023986948 Eh   |
          | TOTAL FREE ENERGY         -11.105582777735 Eh   |
          | GRADIENT NORM               0.000767871627 Eh/α |
          | HOMO-LUMO GAP               1.778494621893 eV   |
           -------------------------------------------------

------------------------------------------------------------------------
 * finished run on 2020/05/12 at 11:44:07.269     
------------------------------------------------------------------------
 total:
 * wall-time:     0 d,  0 h,  0 min,  0.197 sec
 *  cpu-time:     0 d,  0 h,  0 min,  0.196 sec
 * ratio c/w:     0.998 speedup
 SCF:
 * wall-time:     0 d,  0 h,  0 min,  0.005 sec
 *  cpu-time:     0 d,  0 h,  0 min,  0.005 sec
 * ratio c/w:     1.000 speedup
 ANC optimizer:
 * wall-time:     0 d,  0 h,  0 min,  0.075 sec
 *  cpu-time:     0 d,  0 h,  0 min,  0.075 sec
 * ratio c/w:     0.999 speedup
 numerical hessian:
 * wall-time:     0 d,  0 h,  0 min,  0.099 sec
 *  cpu-time:     0 d,  0 h,  0 min,  0.099 sec
 * ratio c/w:     0.997 speedup

