      -----------------------------------------------------------      
     |                   =====================                   |     
     |                           x T B                           |     
     |                   =====================                   |     
     |                         S. Grimme                         |     
     |          Mulliken Center for Theoretical Chemistry        |     
     |                    University of Bonn                     |     
      -----------------------------------------------------------      

   * xtb version 6.2.2 (9d81278992624c895f80dd42a50cac0aa55982e2) compiled by '@Darwin' on 04/03/2020

   xtb is free software: you can redistribute it and/or modify it under
   the terms of the GNU Lesser General Public License as published by
   the Free Software Foundation, either version 3 of the License, or
   (at your option) any later version.
   
   xtb is distributed in the hope that it will be useful,
   but WITHOUT ANY WARRANTY; without even the implied warranty of
   MERCHANTABILITY or FITNESS FOR A PARTICULAR PURPOSE.  See the
   GNU Lesser General Public License for more details.
   
   Cite this work as:
   * S. Grimme, C. Bannwarth, P. Shushkov, J. Chem. Theory Comput., 2017,
     13, 1989-2009. DOI: 10.1021/acs.jctc.7b00118
   * C. Bannwarth, S. Ehlert and S. Grimme., J. Chem. Theory Comput., 2019,
     15, 1652-1671. DOI: 10.1021/acs.jctc.8b01176
   * P. Pracht, E. Caldeweyher, S. Ehlert, S. Grimme, ChemRxiv, 2019, preprint.
     DOI: 10.26434/chemrxiv.8326202.v1
   
   for DFT-D4:
   * E. Caldeweyher, C. Bannwarth and S. Grimme, J. Chem. Phys., 2017,
     147, 034112. DOI: 10.1063/1.4993215
   * E. Caldeweyher, S. Ehlert, A. Hansen, H. Neugebauer, S. Spicher,
     C. Bannwarth and S. Grimme, J. Chem. Phys., 2019, 150, 154122.
     DOI: 10.1063/1.5090222
   
   for sTDA-xTB:
   * S. Grimme and C. Bannwarth, J. Chem. Phys., 2016, 145, 054103.
     DOI: 10.1063/1.4959605
   
   in the mass-spec context:
   * V. Asgeirsson, C. Bauer and S. Grimme, Chem. Sci., 2017, 8, 4879.
     DOI: 10.1039/c7sc00601b
   
   for metadynamics refer to:
   * S. Grimme, J. Chem. Theory Comput., 2019, 155, 2847-2862
     DOI: 10.1021/acs.jctc.9b00143
   
   with help from (in alphabetical order)
   C. Bannwarth, F. Bohle, G. Brandenburg, E. Caldeweyher, M. Checinski,
   S. Dohm, S. Ehlert, S. Ehrlich, F. März, H. Neugebauer, J. Pisarek,
   P. Pracht, P. Shushkov, and S. Spicher.
   
 * started run on 2020/05/14 at 11:33:58.154     

           -------------------------------------------------
          |                Calculation Setup                |
           -------------------------------------------------

          program call               : xtb --input O1_0_S_1.input O1_0_S_1.xyz --ohess --molden --namespace O1_0_S_1 output.out
          calculation namespace      : O1_0_S_1
          coordinate file            : O1_0_S_1.xyz
          number of atoms            :                     1
          number of electrons        :                     6
          charge                     :                     0
          spin                       :                   0.5
          first test random number   :      0.30184406978561

   ID    Z sym.   atoms
    1    8 O      1

           -------------------------------------------------
          |                 G F N 2 - x T B                 |
           -------------------------------------------------

        Reference                      10.1021/acs.jctc.8b01176
      * Hamiltonian:
        H0-scaling (s, p, d)           1.850000    2.230000    2.230000
        zeta-weighting                 0.500000
      * Dispersion:
        s8                             2.700000
        a1                             0.520000
        a2                             5.000000
        s9                             5.000000
      * Repulsion:
        kExp                           1.500000    1.000000
        rExp                           1.000000
      * Coulomb:
        alpha                          2.000000
        third order                    shell-resolved
        anisotropic                    true
        a3                             3.000000
        a5                             4.000000
        cn-shift                       1.200000
        cn-exp                         4.000000
        max-rad                        5.000000


          ...................................................
          :                      SETUP                      :
          :.................................................:
          :  # basis functions                   4          :
          :  # atomic orbitals                   4          :
          :  # shells                            2          :
          :  # electrons                         6          :
          :  max. iterations                   250          :
          :  Hamiltonian                  GFN2-xTB          :
          :  restarted?                      false          :
          :  GBSA solvation                  false          :
          :  PC potential                    false          :
          :  electronic temp.          300.0000000     K    :
          :  accuracy                    1.0000000          :
          :  -> integral cutoff          0.2500000E+02      :
          :  -> integral neglect         0.1000000E-07      :
          :  -> SCF convergence          0.1000000E-05 Eh   :
          :  -> wf. convergence          0.1000000E-03 e    :
          :  Broyden damping             0.4000000          :
          ...................................................

 iter      E             dE          RMSdq      gap      omega  full diag
   1     -3.7694211 -0.376942E+01  0.142E-13    0.00       0.0  T
   2     -3.7694211  0.000000E+00  0.114E-13    0.00       0.0  T
   3     -3.7694211  0.000000E+00  0.878E-14    0.00       0.0  T

   *** convergence criteria satisfied after 3 iterations ***

         #    Occupation            Energy/Eh            Energy/eV
      -------------------------------------------------------------
         1        2.0000           -0.7434383             -20.2300
         2        1.3333           -0.5697291             -15.5031
         3        1.3333           -0.5697291             -15.5031 (HOMO)
         4        1.3333           -0.5697291             -15.5031 (LUMO)
      -------------------------------------------------------------
                  HL-Gap            0.0000000 Eh            0.0000 eV
             Fermi-level           -0.5690705 Eh          -15.4852 eV

 SCC (total)                   0 d,  0 h,  0 min,  0.007 sec
 SCC setup                      ...        0 min,  0.000 sec (  1.400%)
 Dispersion                     ...        0 min,  0.000 sec (  0.093%)
 integral evaluation            ...        0 min,  0.000 sec (  6.916%)
 zeroth order Hamiltonian       ...        0 min,  0.000 sec (  0.136%)
 iterations                     ...        0 min,  0.005 sec ( 79.910%)
 molecular gradient             ...        0 min,  0.000 sec (  0.467%)
 printout                       ...        0 min,  0.001 sec ( 10.862%)

         :::::::::::::::::::::::::::::::::::::::::::::::::::::
         ::                     SUMMARY                     ::
         :::::::::::::::::::::::::::::::::::::::::::::::::::::
         :: total energy              -3.769421097344 Eh    ::
         :: gradient norm              0.000000000000 Eh/a0 ::
         :: HOMO-LUMO gap              0.000000000000 eV    ::
         ::.................................................::
         :: SCC energy                -3.769421097344 Eh    ::
         :: -> isotropic ES            0.000000000000 Eh    ::
         :: -> anisotropic ES          0.000000000000 Eh    ::
         :: -> anisotropic XC         -0.000000000000 Eh    ::
         :: -> dispersion              0.000000000000 Eh    ::
         :: repulsion energy           0.000000000000 Eh    ::
         :: add. restraining           0.000000000000 Eh    ::
         :::::::::::::::::::::::::::::::::::::::::::::::::::::

      ----------------------------------------------------------- 
     |                   =====================                   |
     |                        A N C O P T                        |
     |                   =====================                   |
     |               Approximate Normal Coordinate               |
     |                Rational Function Optimizer                |
      ----------------------------------------------------------- 
================
 final structure:
================
1
 xtb: 6.2.2 (9d81278992624c895f80dd42a50cac0aa55982e2)
O         0.00000000000000    0.00000000000000    0.00000000000000

 Bond Distances (Angstroems)
 ---------------------------


 selected bond angles (degree)
 --------------------


 selected dihedral angles (degree)
 ---------------------------------

           -------------------------------------------------
          |                Final Singlepoint                |
           -------------------------------------------------

          ...................................................
          :                      SETUP                      :
          :.................................................:
          :  # basis functions                   4          :
          :  # atomic orbitals                   4          :
          :  # shells                            2          :
          :  # electrons                         6          :
          :  max. iterations                   250          :
          :  Hamiltonian                  GFN2-xTB          :
          :  restarted?                      false          :
          :  GBSA solvation                  false          :
          :  PC potential                    false          :
          :  electronic temp.          300.0000000     K    :
          :  accuracy                    1.0000000          :
          :  -> integral cutoff          0.2500000E+02      :
          :  -> integral neglect         0.1000000E-07      :
          :  -> SCF convergence          0.1000000E-05 Eh   :
          :  -> wf. convergence          0.1000000E-03 e    :
          :  Broyden damping             0.4000000          :
          ...................................................

 iter      E             dE          RMSdq      gap      omega  full diag
   1     -3.7694211 -0.376942E+01  0.701E-14    0.00       0.0  T
   2     -3.7694211  0.000000E+00  0.561E-14    0.00       0.0  T
   3     -3.7694211  0.000000E+00  0.432E-14    0.00       0.0  T

   *** convergence criteria satisfied after 3 iterations ***

         #    Occupation            Energy/Eh            Energy/eV
      -------------------------------------------------------------
         1        2.0000           -0.7434383             -20.2300
         2        1.3333           -0.5697291             -15.5031
         3        1.3333           -0.5697291             -15.5031 (HOMO)
         4        1.3333           -0.5697291             -15.5031 (LUMO)
      -------------------------------------------------------------
                  HL-Gap            0.0000000 Eh            0.0000 eV
             Fermi-level           -0.5690705 Eh          -15.4852 eV

 SCC (total)                   0 d,  0 h,  0 min,  0.000 sec
 SCC setup                      ...        0 min,  0.000 sec ( 13.998%)
 Dispersion                     ...        0 min,  0.000 sec (  1.208%)
 integral evaluation            ...        0 min,  0.000 sec ( 34.642%)
 zeroth order Hamiltonian       ...        0 min,  0.000 sec (  1.309%)
 iterations                     ...        0 min,  0.000 sec ( 32.830%)
 molecular gradient             ...        0 min,  0.000 sec (  4.230%)
 printout                       ...        0 min,  0.000 sec (  8.459%)

         :::::::::::::::::::::::::::::::::::::::::::::::::::::
         ::                     SUMMARY                     ::
         :::::::::::::::::::::::::::::::::::::::::::::::::::::
         :: total energy              -3.769421097344 Eh    ::
         :: gradient norm              0.000000000000 Eh/a0 ::
         :: HOMO-LUMO gap              0.000000000000 eV    ::
Molecule has the following symmetry elements: (i) (Cinf) (sigma) 
It seems to be the Kh point group
         ::.................................................::
         :: SCC energy                -3.769421097344 Eh    ::
         :: -> isotropic ES            0.000000000000 Eh    ::
         :: -> anisotropic ES          0.000000000000 Eh    ::
         :: -> anisotropic XC         -0.000000000000 Eh    ::
         :: -> dispersion              0.000000000000 Eh    ::
         :: repulsion energy           0.000000000000 Eh    ::
         :: add. restraining           0.000000000000 Eh    ::
         :::::::::::::::::::::::::::::::::::::::::::::::::::::

           ------------------------------------------------- 
          |                Numerical Hessian                |
           ------------------------------------------------- 
step length          :   0.00500
SCC accuracy         :   0.30000
Hessian scale factor :   1.00000
frozen atoms in %    :   0.00000    0
RMS gradient         :   0.00000

writing file <hessian>.

 vibrational frequencies (cm-1)
eigval :        0.00     0.00     0.00
           -------------------------------------------------
          |                Property Printout                |
           -------------------------------------------------

    * Orbital Energies and Occupations

         #    Occupation            Energy/Eh            Energy/eV
      -------------------------------------------------------------
         1        2.0000           -0.7434383             -20.2300
         2        1.3333           -0.5697291             -15.5031
         3        1.3333           -0.5697291             -15.5031 (HOMO)
         4        1.3333           -0.5697291             -15.5031 (LUMO)
      -------------------------------------------------------------
                  HL-Gap            0.0000000 Eh            0.0000 eV
             Fermi-level           -0.5690705 Eh          -15.4852 eV

     #   Z        covCN         q      C6AA      α(0)
     1   8 O      0.000     0.000    15.568     5.197

 Mol. C6AA /au·bohr⁶  :         15.568032
 Mol. C8AA /au·bohr⁸  :        314.171359
 Mol. α(0) /au        :          5.196904


Wiberg/Mayer (AO) data.
largest (>0.10) Wiberg bond orders for each atom
          total WBO             WBO to atom ...
     1  O   0.000    

MOs/occ written to file <molden.input>


molecular dipole:
                 x           y           z       tot (Debye)
 q only:        0.000       0.000       0.000
   full:        0.000       0.000       0.000       0.000
molecular quadrupole (traceless):
                xx          xy          yy          xz          yz          zz
 q only:        0.000       0.000       0.000       0.000       0.000       0.000
  q+dip:        0.000       0.000       0.000       0.000       0.000       0.000
   full:       -0.000       0.000       0.000       0.000       0.000       0.000

           -------------------------------------------------
          |                Geometry Summary                 |
           -------------------------------------------------

      molecular mass/u    :       15.9994049
   center of mass at/Å    :        0.0000000       0.0000000       0.0000000
  moments of inertia/u·Å² :        0.0000000E+00   0.0000000E+00   0.0000000E+00
rotational constants/cm⁻¹ :             Infinity        Infinity        Infinity

           -------------------------------------------------
          |               Frequency Printout                |
           -------------------------------------------------
 vibrational frequencies (cm-1)
eigval :        0.00     0.00     0.00
 reduced masses (amu)
   1: 16.00   2: 16.00   3: 16.00
 IR intensities (amu)
   1:  0.00   2:  0.00   3:  0.00
 Raman intensities (amu)
   1:  0.00   2:  0.00   3:  0.00
 output can be read by thermo (or use thermo option).
 writing <g98.out> molden fake output.
 recommended (thermochemical) frequency scaling factor: 1.0
           -------------------------------------------------
          |             Thermodynamic Functions             |
           -------------------------------------------------

Kh  symmetry found (for desy threshold:  0.10E+00) used in thermo

          ...................................................
          :                      SETUP                      :
          :.................................................:
          :  # frequencies                           0      :
          :  # imaginary freq.                       0      :
          :  linear?                              true      :
          :  only rotor calc.                     true      :
          :  symmetry                               Kh      :
          :  rotational number                       1      :
          :  scaling factor                  1.0000000      :
          :  rotor cutoff                   50.0000000 cm⁻¹ :
          :  imag. cutoff                  -20.0000000 cm⁻¹ :
          :.................................................:

    mode    ω/cm⁻¹     T·S(HO)/kcal·mol⁻¹    T·S(FR)/kcal·mol⁻¹   T·S(vib)
   ------------------------------------------------------------------------
   ------------------------------------------------------------------------

   temp. (K)  partition function   enthalpy   heat capacity  entropy
                                   cal/mol     cal/K/mol   cal/K/mol   J/K/mol
 298.15  VIB   1.00                    0.000      0.000      0.000
         ROT   1.00                    0.000      0.000      0.000
         INT   1.00                    0.000      0.000      0.000
         TR   0.619E+26             1481.254      4.968     34.240
         TOT                        1481.2539     4.9681    34.2398   143.2594

   temp. (K)  partition function   enthalpy   heat capacity  entropy
                                   cal/mol     cal/K/mol   cal/K/mol   J/K/mol
 120.00  VIB   1.00                    0.000      0.000      0.000
         ROT   1.00                    0.000      0.000      0.000
         INT   1.00                    0.000      0.000      0.000
         TR   0.158E+26              596.178      4.968     29.720
         TOT                         596.1780     4.9681    29.7205   124.3505

   temp. (K)  partition function   enthalpy   heat capacity  entropy
                                   cal/mol     cal/K/mol   cal/K/mol   J/K/mol
 100.00  VIB   1.00                    0.000      0.000      0.000
         ROT   1.00                    0.000      0.000      0.000
         INT   1.00                    0.000      0.000      0.000
         TR   0.120E+26              496.815      4.968     28.815
         TOT                         496.8150     4.9681    28.8151   120.5625

   temp. (K)  partition function   enthalpy   heat capacity  entropy
                                   cal/mol     cal/K/mol   cal/K/mol   J/K/mol
  80.00  VIB   1.00                    0.000      0.000      0.000
         ROT   1.00                    0.000      0.000      0.000
         INT   1.00                    0.000      0.000      0.000
         TR   0.861E+25              397.452      4.968     27.707
         TOT                         397.4520     4.9681    27.7071   115.9264

   temp. (K)  partition function   enthalpy   heat capacity  entropy
                                   cal/mol     cal/K/mol   cal/K/mol   J/K/mol
  60.00  VIB   1.00                    0.000      0.000      0.000
         ROT   1.00                    0.000      0.000      0.000
         INT   1.00                    0.000      0.000      0.000
         TR   0.559E+25              298.089      4.968     26.279
         TOT                         298.0890     4.9681    26.2785   109.9493

   temp. (K)  partition function   enthalpy   heat capacity  entropy
                                   cal/mol     cal/K/mol   cal/K/mol   J/K/mol
  40.00  VIB   1.00                    0.000      0.000      0.000
         ROT   1.00                    0.000      0.000      0.000
         INT   1.00                    0.000      0.000      0.000
         TR   0.304E+25              198.726      4.968     24.265
         TOT                         198.7260     4.9681    24.2651   101.5251

   temp. (K)  partition function   enthalpy   heat capacity  entropy
                                   cal/mol     cal/K/mol   cal/K/mol   J/K/mol
  20.00  VIB   1.00                    0.000      0.000      0.000
         ROT   1.00                    0.000      0.000      0.000
         INT   1.00                    0.000      0.000      0.000
         TR   0.108E+25               99.363      4.968     20.823
         TOT                          99.3630     4.9681    20.8231    87.1239

   temp. (K)  partition function   enthalpy   heat capacity  entropy
                                   cal/mol     cal/K/mol   cal/K/mol   J/K/mol
  10.00  VIB   1.00                    0.000      0.000      0.000
         ROT   1.00                    0.000      0.000      0.000
         INT   1.00                    0.000      0.000      0.000
         TR   0.380E+24               49.681      4.968     17.381
         TOT                          49.6815     4.9681    17.3811    72.7227

       T/K    H(0)-H(T)+PV         H(T)/Eh          T*S/Eh         G(T)/Eh
   ------------------------------------------------------------------------
    298.15    0.236053E-02    0.236053E-02    0.162684E-01   -0.139079E-01
    120.00    0.950070E-03    0.950070E-03    0.568351E-02   -0.473344E-02
    100.00    0.791725E-03    0.791725E-03    0.459198E-02   -0.380026E-02
     80.00    0.633380E-03    0.633380E-03    0.353232E-02   -0.289894E-02
     60.00    0.475035E-03    0.475035E-03    0.251265E-02   -0.203761E-02
     40.00    0.316690E-03    0.316690E-03    0.154676E-02   -0.123007E-02
     20.00    0.158345E-03    0.158345E-03    0.663675E-03   -0.505330E-03
     10.00    0.791725E-04    0.791725E-04    0.276986E-03   -0.197813E-03 (used)
   ------------------------------------------------------------------------

         :::::::::::::::::::::::::::::::::::::::::::::::::::::
         ::                  THERMODYNAMIC                  ::
         :::::::::::::::::::::::::::::::::::::::::::::::::::::
         :: total free energy          -3.769618910834 Eh   ::
         ::.................................................::
         :: total energy               -3.769421097344 Eh   ::
         :: zero point energy           0.000000000000 Eh   ::
         :: G(RRHO) w/o ZPVE           -0.000197813490 Eh   ::
         :: G(RRHO) contrib.           -0.000197813490 Eh   ::
         :::::::::::::::::::::::::::::::::::::::::::::::::::::

optimized geometry written to: xtbopt.xyz


           -------------------------------------------------
          | TOTAL ENERGY               -3.769421097344 Eh   |
          | TOTAL ENTHALPY             -3.769341924834 Eh   |
          | TOTAL FREE ENERGY          -3.769618910834 Eh   |
          | GRADIENT NORM               0.000000000000 Eh/α |
          | HOMO-LUMO GAP               0.000000000000 eV   |
           -------------------------------------------------

------------------------------------------------------------------------
 * finished run on 2020/05/14 at 11:33:58.193     
------------------------------------------------------------------------
 total:
 * wall-time:     0 d,  0 h,  0 min,  0.039 sec
 *  cpu-time:     0 d,  0 h,  0 min,  0.021 sec
 * ratio c/w:     0.549 speedup
 SCF:
 * wall-time:     0 d,  0 h,  0 min,  0.007 sec
 *  cpu-time:     0 d,  0 h,  0 min,  0.002 sec
 * ratio c/w:     0.232 speedup
 ANC optimizer:
 * wall-time:     0 d,  0 h,  0 min,  0.002 sec
 *  cpu-time:     0 d,  0 h,  0 min,  0.001 sec
 * ratio c/w:     0.550 speedup
 numerical hessian:
 * wall-time:     0 d,  0 h,  0 min,  0.004 sec
 *  cpu-time:     0 d,  0 h,  0 min,  0.002 sec
 * ratio c/w:     0.654 speedup

