      -----------------------------------------------------------      
     |                   =====================                   |     
     |                           x T B                           |     
     |                   =====================                   |     
     |                         S. Grimme                         |     
     |          Mulliken Center for Theoretical Chemistry        |     
     |                    University of Bonn                     |     
      -----------------------------------------------------------      

   * xtb version 6.2.2 (9d81278992624c895f80dd42a50cac0aa55982e2) compiled by '@Darwin' on 04/03/2020

   xtb is free software: you can redistribute it and/or modify it under
   the terms of the GNU Lesser General Public License as published by
   the Free Software Foundation, either version 3 of the License, or
   (at your option) any later version.
   
   xtb is distributed in the hope that it will be useful,
   but WITHOUT ANY WARRANTY; without even the implied warranty of
   MERCHANTABILITY or FITNESS FOR A PARTICULAR PURPOSE.  See the
   GNU Lesser General Public License for more details.
   
   Cite this work as:
   * S. Grimme, C. Bannwarth, P. Shushkov, J. Chem. Theory Comput., 2017,
     13, 1989-2009. DOI: 10.1021/acs.jctc.7b00118
   * C. Bannwarth, S. Ehlert and S. Grimme., J. Chem. Theory Comput., 2019,
     15, 1652-1671. DOI: 10.1021/acs.jctc.8b01176
   * P. Pracht, E. Caldeweyher, S. Ehlert, S. Grimme, ChemRxiv, 2019, preprint.
     DOI: 10.26434/chemrxiv.8326202.v1
   
   for DFT-D4:
   * E. Caldeweyher, C. Bannwarth and S. Grimme, J. Chem. Phys., 2017,
     147, 034112. DOI: 10.1063/1.4993215
   * E. Caldeweyher, S. Ehlert, A. Hansen, H. Neugebauer, S. Spicher,
     C. Bannwarth and S. Grimme, J. Chem. Phys., 2019, 150, 154122.
     DOI: 10.1063/1.5090222
   
   for sTDA-xTB:
   * S. Grimme and C. Bannwarth, J. Chem. Phys., 2016, 145, 054103.
     DOI: 10.1063/1.4959605
   
   in the mass-spec context:
   * V. Asgeirsson, C. Bauer and S. Grimme, Chem. Sci., 2017, 8, 4879.
     DOI: 10.1039/c7sc00601b
   
   for metadynamics refer to:
   * S. Grimme, J. Chem. Theory Comput., 2019, 155, 2847-2862
     DOI: 10.1021/acs.jctc.9b00143
   
   with help from (in alphabetical order)
   C. Bannwarth, F. Bohle, G. Brandenburg, E. Caldeweyher, M. Checinski,
   S. Dohm, S. Ehlert, S. Ehrlich, F. März, H. Neugebauer, J. Pisarek,
   P. Pracht, P. Shushkov, and S. Spicher.
   
 * started run on 2020/05/12 at 11:44:15.113     

           -------------------------------------------------
          |                Calculation Setup                |
           -------------------------------------------------

          program call               : xtb --input C4N1_38_S_1.input C4N1_38_S_1.xyz --ohess --molden --namespace C4N1_38_S_1 output.out
          calculation namespace      : C4N1_38_S_1
          coordinate file            : C4N1_38_S_1.xyz
          number of atoms            :                     5
          number of electrons        :                    21
          charge                     :                     0
          spin                       :                   0.5
          first test random number   :      0.35226859378488

   ID    Z sym.   atoms
    1    6 C      1, 3-5
    2    7 N      2

           -------------------------------------------------
          |                 G F N 2 - x T B                 |
           -------------------------------------------------

        Reference                      10.1021/acs.jctc.8b01176
      * Hamiltonian:
        H0-scaling (s, p, d)           1.850000    2.230000    2.230000
        zeta-weighting                 0.500000
      * Dispersion:
        s8                             2.700000
        a1                             0.520000
        a2                             5.000000
        s9                             5.000000
      * Repulsion:
        kExp                           1.500000    1.000000
        rExp                           1.000000
      * Coulomb:
        alpha                          2.000000
        third order                    shell-resolved
        anisotropic                    true
        a3                             3.000000
        a5                             4.000000
        cn-shift                       1.200000
        cn-exp                         4.000000
        max-rad                        5.000000


          ...................................................
          :                      SETUP                      :
          :.................................................:
          :  # basis functions                  20          :
          :  # atomic orbitals                  20          :
          :  # shells                           10          :
          :  # electrons                        21          :
          :  max. iterations                   250          :
          :  Hamiltonian                  GFN2-xTB          :
          :  restarted?                      false          :
          :  GBSA solvation                  false          :
          :  PC potential                    false          :
          :  electronic temp.          300.0000000     K    :
          :  accuracy                    1.0000000          :
          :  -> integral cutoff          0.2500000E+02      :
          :  -> integral neglect         0.1000000E-07      :
          :  -> SCF convergence          0.1000000E-05 Eh   :
          :  -> wf. convergence          0.1000000E-03 e    :
          :  Broyden damping             0.4000000          :
          ...................................................

 iter      E             dE          RMSdq      gap      omega  full diag
   1    -11.0741786 -0.110742E+02  0.842E+00    1.10       0.0  T
   2    -11.0883342 -0.141556E-01  0.555E+00    0.76       1.0  T
   3    -11.0657023  0.226320E-01  0.342E+00    1.34       1.0  T
   4    -11.1073508 -0.416485E-01  0.999E-01    0.73       1.0  T
   5    -11.1120052 -0.465441E-02  0.386E-01    0.94       1.0  T
   6    -11.1120163 -0.110546E-04  0.167E-01    1.03       1.0  T
   7    -11.1121191 -0.102844E-03  0.241E-02    0.99       1.9  T
   8    -11.1121191 -0.512387E-07  0.148E-02    0.99       3.0  T
   9    -11.1121196 -0.475792E-06  0.978E-03    0.99       4.6  T
  10    -11.1121199 -0.283998E-06  0.108E-03    0.99      41.6  T
  11    -11.1121199 -0.746173E-09  0.632E-04    0.99      70.8  T
  12    -11.1121199 -0.143572E-08  0.133E-04    0.99     335.4  T

   *** convergence criteria satisfied after 12 iterations ***

         #    Occupation            Energy/Eh            Energy/eV
      -------------------------------------------------------------
         1        2.0000           -0.7942203             -21.6118
       ...           ...                  ...                  ...
         5        2.0000           -0.5603582             -15.2481
         6        2.0000           -0.5603581             -15.2481
         7        2.0000           -0.5267358             -14.3332
         8        2.0000           -0.5085542             -13.8385
         9        2.0000           -0.4927001             -13.4071
        10        2.0000           -0.4927001             -13.4071
        11        1.0000           -0.3996740             -10.8757 (HOMO)
        12                         -0.3633058              -9.8861 (LUMO)
        13                         -0.3633055              -9.8860
        14                         -0.3263026              -8.8791
        15                         -0.0653651              -1.7787
        16                         -0.0653647              -1.7787
       ...                                ...                  ...
        20                          0.3099184               8.4333
      -------------------------------------------------------------
                  HL-Gap            0.0363683 Eh            0.9896 eV
             Fermi-level           -0.4140031 Eh          -11.2656 eV

 SCC (total)                   0 d,  0 h,  0 min,  0.005 sec
 SCC setup                      ...        0 min,  0.000 sec (  1.853%)
 Dispersion                     ...        0 min,  0.000 sec (  0.402%)
 integral evaluation            ...        0 min,  0.001 sec ( 27.884%)
 zeroth order Hamiltonian       ...        0 min,  0.000 sec (  0.575%)
 iterations                     ...        0 min,  0.002 sec ( 36.185%)
 molecular gradient             ...        0 min,  0.001 sec ( 31.665%)
 printout                       ...        0 min,  0.000 sec (  1.201%)

         :::::::::::::::::::::::::::::::::::::::::::::::::::::
         ::                     SUMMARY                     ::
         :::::::::::::::::::::::::::::::::::::::::::::::::::::
         :: total energy             -11.030145247593 Eh    ::
         :: gradient norm              0.134894646944 Eh/a0 ::
         :: HOMO-LUMO gap              0.989630904001 eV    ::
         ::.................................................::
         :: SCC energy               -11.112119908165 Eh    ::
         :: -> isotropic ES           -0.019805567226 Eh    ::
         :: -> anisotropic ES          0.006239724762 Eh    ::
         :: -> anisotropic XC          0.005483400214 Eh    ::
         :: -> dispersion             -0.002681844195 Eh    ::
         :: repulsion energy           0.081974634121 Eh    ::
         :: add. restraining           0.000000000000 Eh    ::
         :::::::::::::::::::::::::::::::::::::::::::::::::::::

      ----------------------------------------------------------- 
     |                   =====================                   |
     |                        A N C O P T                        |
     |                   =====================                   |
     |               Approximate Normal Coordinate               |
     |                Rational Function Optimizer                |
      ----------------------------------------------------------- 

          ...................................................
          :                      SETUP                      :
          :.................................................:
          :   optimization level            normal          :
          :   max. optcycles                   200          :
          :   ANC micro-cycles                  20          :
          :   degrees of freedom                 9          :
          :.................................................:
          :   RF solver                   davidson          :
          :   write xtbopt.log                true          :
          :   linear?                        false          :
          :   energy convergence         0.5000000E-05 Eh   :
          :   grad. convergence          0.1000000E-02 Eh/α :
          :   maximium RF displ.         1.0000000          :
          :   Hlow (freq-cutoff)         0.1000000E-01      :
          :   Hmax (freq-cutoff)         5.0000000          :
          :   S6 in model hess.         20.0000000          :
          ...................................................

generating ANC from model Hessian ...
Using Lindh-Hessian (1995)
 Shifting diagonal of input Hessian by    0.0000000000000000     
 Lowest  eigenvalues of input Hessian
   -0.000000   -0.000000   -0.000000   -0.000000    0.000000    0.000000
    0.203680    0.203681    0.484005    0.806586    0.806586    1.072579
    1.072579    1.089027    1.340223
 Highest eigenvalues
    0.806586    0.806586    1.072579    1.072579    1.089027    1.340223


........................................................................
.............................. CYCLE    1 ..............................
........................................................................
   1    -11.1121199 -0.111121E+02  0.200E-05    0.99       0.0  T
   2    -11.1121199  0.585132E-11  0.310E-05    0.99    1443.3  T
   3    -11.1121199 -0.807709E-11  0.628E-06    0.99    7116.8  T
     SCC iter.                  ...        0 min,  0.001 sec
     gradient                   ...        0 min,  0.002 sec
 * total energy  :   -11.0301452 Eh     change        0.7057821E-10 Eh
   gradient norm :     0.1348938 Eh/α   predicted     0.0000000E+00 (-100.00%)
   displ. norm   :     0.2376244 α      lambda       -0.3079869E-01
   maximum displ.:     0.2332052 α      in ANC's #3, #9, #8, ...

........................................................................
.............................. CYCLE    2 ..............................
........................................................................
   1    -11.1436525 -0.111437E+02  0.142E+00    1.99       0.0  T
   2    -11.1442915 -0.638994E-03  0.900E-01    2.30       1.0  T
   3    -11.1452049 -0.913385E-03  0.655E-01    2.06       1.0  T
   4    -11.1466636 -0.145866E-02  0.176E-01    2.15       1.0  T
   5    -11.1467576 -0.939688E-04  0.476E-02    2.15       1.0  T
   6    -11.1467585 -0.916633E-06  0.585E-03    2.15       7.6  T
   7    -11.1467585 -0.352933E-07  0.307E-03    2.15      14.6  T
   8    -11.1467585 -0.659033E-08  0.680E-04    2.15      65.8  T
   9    -11.1467585 -0.358495E-08  0.135E-04    2.15     330.4  T
     SCC iter.                  ...        0 min,  0.001 sec
     gradient                   ...        0 min,  0.001 sec
 * total energy  :   -11.0536834 Eh     change       -0.2353816E-01 Eh
   gradient norm :     0.0792360 Eh/α   predicted    -0.1626888E-01 ( -30.88%)
   displ. norm   :     0.2441853 α      lambda       -0.1774107E-01
   maximum displ.:     0.2299729 α      in ANC's #3, #9, #8, ...

........................................................................
.............................. CYCLE    3 ..............................
........................................................................
   1    -11.1739741 -0.111740E+02  0.154E+00    3.08       0.0  T
   2    -11.1747649 -0.790745E-03  0.944E-01    3.34       1.0  T
   3    -11.1749461 -0.181203E-03  0.743E-01    3.11       1.0  T
   4    -11.1769882 -0.204212E-02  0.240E-01    3.22       1.0  T
   5    -11.1772129 -0.224720E-03  0.546E-02    3.21       1.0  T
   6    -11.1772142 -0.128675E-05  0.774E-03    3.21       5.8  T
   7    -11.1772143 -0.159400E-06  0.331E-03    3.21      13.5  T
   8    -11.1772143 -0.273711E-08  0.357E-04    3.21     125.4  T
   9    -11.1772143 -0.518467E-09  0.207E-04    3.21     216.2  T
     SCC iter.                  ...        0 min,  0.001 sec
     gradient                   ...        0 min,  0.001 sec
 * total energy  :   -11.0626271 Eh     change       -0.8943722E-02 Eh
   gradient norm :     0.0091827 Eh/α   predicted    -0.9399452E-02 (   5.10%)
   displ. norm   :     0.0134805 α      lambda       -0.9913440E-04
   maximum displ.:     0.0125219 α      in ANC's #3, #8, #9, ...

........................................................................
.............................. CYCLE    4 ..............................
........................................................................
   1    -11.1777118 -0.111777E+02  0.875E-02    3.17       0.0  T
   2    -11.1777067  0.511755E-05  0.660E-02    3.15       1.0  T
   3    -11.1777224 -0.156625E-04  0.376E-02    3.17       1.2  T
   4    -11.1777272 -0.483128E-05  0.532E-03    3.16       8.4  T
   5    -11.1777273 -0.371733E-07  0.239E-03    3.16      18.7  T
   6    -11.1777273 -0.191050E-08  0.301E-04    3.16     148.5  T
   7    -11.1777273  0.245155E-10  0.172E-04    3.16     259.5  T
     SCC iter.                  ...        0 min,  0.001 sec
     gradient                   ...        0 min,  0.001 sec
 * total energy  :   -11.0626878 Eh     change       -0.6067349E-04 Eh
   gradient norm :     0.0030796 Eh/α   predicted    -0.4957507E-04 ( -18.29%)
   displ. norm   :     0.0036609 α      lambda       -0.1099475E-04
   maximum displ.:     0.0030360 α      in ANC's #9, #3, #8, ...

........................................................................
.............................. CYCLE    5 ..............................
........................................................................
   1    -11.1784097 -0.111784E+02  0.224E-02    3.16       0.0  T
   2    -11.1784093  0.375386E-06  0.199E-02    3.16       2.2  T
   3    -11.1784110 -0.166216E-05  0.904E-03    3.16       4.9  T
   4    -11.1784111 -0.937662E-07  0.222E-03    3.16      20.2  T
   5    -11.1784111 -0.214507E-07  0.866E-04    3.16      51.6  T
   6    -11.1784111  0.596227E-09  0.430E-04    3.16     104.0  T
     SCC iter.                  ...        0 min,  0.001 sec
     gradient                   ...        0 min,  0.001 sec
 * total energy  :   -11.0626932 Eh     change       -0.5380214E-05 Eh
   gradient norm :     0.0000795 Eh/α   predicted    -0.5496373E-05 (   2.16%)
   displ. norm   :     0.0001530 α      lambda       -0.8882576E-08
   maximum displ.:     0.0001282 α      in ANC's #9, #3, #8, ...

........................................................................
.............................. CYCLE    6 ..............................
........................................................................
   1    -11.1783803 -0.111784E+02  0.906E-04    3.16       0.0  T
   2    -11.1783803 -0.610413E-09  0.662E-04    3.16      67.6  T
   3    -11.1783803 -0.292884E-09  0.387E-04    3.16     115.5  T
     SCC iter.                  ...        0 min,  0.000 sec
     gradient                   ...        0 min,  0.002 sec
 * total energy  :   -11.0626932 Eh     change       -0.3847164E-08 Eh
   gradient norm :     0.0000400 Eh/α   predicted    -0.3784612E-08 (  -1.63%)
   displ. norm   :     0.0000549 α      lambda       -0.3276315E-08
   maximum displ.:     0.0000437 α      in ANC's #9, #3, #8, ...

   *** GEOMETRY OPTIMIZATION CONVERGED AFTER 6 ITERATIONS ***

------------------------------------------------------------------------
 total energy gain   :        -0.0325479 Eh      -20.4241 kcal/mol
 total RMSD          :         0.2093527 a0        0.1108 Å
 total power (kW/mol):       -14.2424359 (step)-3885.6772 (real)
------------------------------------------------------------------------

 ANCopt (total)                0 d,  0 h,  0 min,  0.022 sec
 optimizer setup                ...        0 min,  0.000 sec (  0.346%)
 model hessian                  ...        0 min,  0.000 sec (  0.468%)
 ANC generation                 ...        0 min,  0.000 sec (  0.241%)
 coordinate transformation      ...        0 min,  0.000 sec (  0.056%)
 single point calculation       ...        0 min,  0.021 sec ( 96.488%)
 optimization log               ...        0 min,  0.000 sec (  0.530%)
 hessian update                 ...        0 min,  0.000 sec (  0.053%)
 rational function              ...        0 min,  0.000 sec (  0.730%)

================
 final structure:
================
5
 xtb: 6.2.2 (9d81278992624c895f80dd42a50cac0aa55982e2)
C         0.85425056618549   -0.15335192036682   -0.50174629441587
N         0.33169472225695   -0.62166419265622    0.72087560644588
C        -0.78174518271481   -0.61095233042676   -0.14360183460312
C        -0.05586523177191    0.73311013675542    0.68149868716344
C        -0.34833387395572    0.65285730669439   -0.75702616459032

 Bond Distances (Angstroems)
 ---------------------------
C1-N2=1.4097         C1-C3=1.7361         C1-C4=1.7361         C1-C5=1.4702         N2-C1=1.4097         N2-C3=1.4097         
N2-C4=1.4097         C3-C1=1.7361         C3-N2=1.4097         C3-C4=1.7361         C3-C5=1.4702         C4-C1=1.7361         
C4-N2=1.4097         C4-C3=1.7361         C4-C5=1.4701         C5-C1=1.4702         C5-C3=1.4702         C5-C4=1.4701         
 C  C  Rav=1.6031 sigma=0.1330  Rmin=1.4701  Rmax=1.7361     6
 N  C  Rav=1.4097 sigma=0.0000  Rmin=1.4097  Rmax=1.4097     3

 selected bond angles (degree)
 --------------------
C3-C1-N2= 51.99                C4-C1-N2= 51.99                C4-C1-C3= 60.00                C5-C1-N2= 91.69                
C5-C1-C3= 53.81                C5-C1-C4= 53.81                C3-N2-C1= 76.02                C4-N2-C1= 76.02                
C4-N2-C3= 76.02                N2-C3-C1= 51.99                C4-C3-C1= 60.00                C4-C3-N2= 51.99                
C5-C3-C1= 53.81                C5-C3-N2= 91.69                C5-C3-C4= 53.81                N2-C4-C1= 51.99                
C3-C4-C1= 60.00                C3-C4-N2= 51.99                C5-C4-C1= 53.81                C5-C4-N2= 91.69                
C5-C4-C3= 53.81                C3-C5-C1= 72.38                C4-C5-C1= 72.38                C4-C5-C3= 72.38                

 selected dihedral angles (degree)
 ---------------------------------
C3-N2-C1-C4= 78.78            C3-N2-C1-C5= 39.39            C4-N2-C1-C3=281.22            C4-N2-C1-C5=320.61            
N2-C3-C1-C4=296.82            N2-C3-C1-C5=231.81            C4-C3-C1-N2= 63.18            C4-C3-C1-C5=294.99            
C5-C3-C1-N2=128.19            C5-C3-C1-C4= 65.01            C1-C3-N2-C4= 78.78            C4-C3-N2-C1=281.22            
C5-C3-N2-C1=320.61            C5-C3-N2-C4= 39.39            N2-C4-C1-C3= 63.18            N2-C4-C1-C5=128.19            
C3-C4-C1-N2=296.82            C3-C4-C1-C5= 65.01            C5-C4-C1-N2=231.81            C5-C4-C1-C3=294.99            
C1-C4-N2-C3=281.22            C3-C4-N2-C1= 78.78            C5-C4-N2-C1= 39.39            C5-C4-N2-C3=320.61            
C1-C4-C3-N2= 63.18            C1-C4-C3-C5=294.99            N2-C4-C3-C1=296.82            N2-C4-C3-C5=231.81            
C5-C4-C3-C1= 65.01            C5-C4-C3-N2=128.19            C3-C5-C1-N2=321.72            C3-C5-C1-C4=283.44            
C4-C5-C1-N2= 38.28            C4-C5-C1-C3= 76.56            C1-C5-C3-N2= 38.28            C1-C5-C3-C4= 76.56            
C4-C5-C3-C1=283.44            C4-C5-C3-N2=321.72            C1-C5-C4-N2=321.72            C1-C5-C4-C3=283.44            
C3-C5-C4-C1= 76.56            C3-C5-C4-N2= 38.28            
           -------------------------------------------------
          |                Final Singlepoint                |
           -------------------------------------------------

          ...................................................
          :                      SETUP                      :
          :.................................................:
          :  # basis functions                  20          :
          :  # atomic orbitals                  20          :
          :  # shells                           10          :
          :  # electrons                        21          :
          :  max. iterations                   250          :
          :  Hamiltonian                  GFN2-xTB          :
          :  restarted?                      false          :
          :  GBSA solvation                  false          :
          :  PC potential                    false          :
          :  electronic temp.          300.0000000     K    :
          :  accuracy                    1.0000000          :
          :  -> integral cutoff          0.2500000E+02      :
          :  -> integral neglect         0.1000000E-07      :
          :  -> SCF convergence          0.1000000E-05 Eh   :
          :  -> wf. convergence          0.1000000E-03 e    :
          :  Broyden damping             0.4000000          :
          ...................................................

 iter      E             dE          RMSdq      gap      omega  full diag
   1    -11.1783803 -0.111784E+02  0.283E-04    3.16       0.0  T
   2    -11.1783803  0.320497E-09  0.293E-04    3.16     152.7  T
   3    -11.1783803 -0.725008E-09  0.866E-05    3.16     516.2  T

   *** convergence criteria satisfied after 3 iterations ***

         #    Occupation            Energy/Eh            Energy/eV
      -------------------------------------------------------------
         1        2.0000           -0.7941787             -21.6107
       ...           ...                  ...                  ...
         5        2.0000           -0.5598943             -15.2355
         6        2.0000           -0.5598913             -15.2354
         7        2.0000           -0.5314228             -14.4608
         8        2.0000           -0.4786742             -13.0254
         9        2.0000           -0.4698757             -12.7860
        10        2.0000           -0.4698756             -12.7860
        11        1.0000           -0.4286939             -11.6654 (HOMO)
        12                         -0.3126329              -8.5072 (LUMO)
        13                         -0.3126271              -8.5070
        14                         -0.2477378              -6.7413
        15                         -0.0015144              -0.0412
        16                         -0.0015044              -0.0409
       ...                                ...                  ...
        20                          0.3666657               9.9775
      -------------------------------------------------------------
                  HL-Gap            0.1160610 Eh            3.1582 eV
             Fermi-level           -0.4098157 Eh          -11.1517 eV

 SCC (total)                   0 d,  0 h,  0 min,  0.003 sec
 SCC setup                      ...        0 min,  0.000 sec (  1.187%)
 Dispersion                     ...        0 min,  0.000 sec (  0.314%)
 integral evaluation            ...        0 min,  0.001 sec ( 38.359%)
 zeroth order Hamiltonian       ...        0 min,  0.000 sec (  0.478%)
 iterations                     ...        0 min,  0.000 sec ( 14.682%)
 molecular gradient             ...        0 min,  0.001 sec ( 42.674%)
 printout                       ...        0 min,  0.000 sec (  2.097%)

         :::::::::::::::::::::::::::::::::::::::::::::::::::::
         ::                     SUMMARY                     ::
         :::::::::::::::::::::::::::::::::::::::::::::::::::::
         :: total energy             -11.062693191968 Eh    ::
         :: gradient norm              0.000041904735 Eh/a0 ::
         :: HOMO-LUMO gap              3.158180680907 eV    ::
         ::.................................................::
         :: SCC energy               -11.178380267919 Eh    ::
         :: -> isotropic ES           -0.010283697780 Eh    ::
         :: -> anisotropic ES          0.007129939471 Eh    ::
         :: -> anisotropic XC          0.001642988250 Eh    ::
         :: -> dispersion             -0.002327198166 Eh    ::
         :: repulsion energy           0.115687062087 Eh    ::
         :: add. restraining           0.000000000000 Eh    ::
         :::::::::::::::::::::::::::::::::::::::::::::::::::::

           ------------------------------------------------- 
          |                Numerical Hessian                |
           ------------------------------------------------- 
step length          :   0.00500
SCC accuracy         :   0.30000
Hessian scale factor :   1.00000
frozen atoms in %    :   0.00000    0
RMS gradient         :   0.00004
estimated CPU  time      0.00 min
estimated wall time      0.00 min

writing file <hessian>.

 projected vibrational frequencies (cm-1)
eigval :       -0.00    -0.00     0.00     0.00     0.00     0.00
eigval :      404.64   405.07   822.01   849.50   849.59  1039.66
eigval :     1039.83  1278.35  1394.16
           -------------------------------------------------
          |                Property Printout                |
           -------------------------------------------------

    * Orbital Energies and Occupations

         #    Occupation            Energy/Eh            Energy/eV
      -------------------------------------------------------------
         1        2.0000           -0.7941790             -21.6107
         2        2.0000           -0.6761136             -18.3980
         3        2.0000           -0.6646184             -18.0852
         4        2.0000           -0.6646172             -18.0852
         5        2.0000           -0.5598943             -15.2355
         6        2.0000           -0.5598916             -15.2354
         7        2.0000           -0.5314230             -14.4608
         8        2.0000           -0.4786745             -13.0254
         9        2.0000           -0.4698760             -12.7860
        10        2.0000           -0.4698758             -12.7860
        11        1.0000           -0.4286941             -11.6654 (HOMO)
        12                         -0.3126331              -8.5072 (LUMO)
        13                         -0.3126272              -8.5070
        14                         -0.2477379              -6.7413
        15                         -0.0015148              -0.0412
        16                         -0.0015044              -0.0409
        17                          0.0672708               1.8305
        18                          0.0672710               1.8305
        19                          0.0923603               2.5133
        20                          0.3666654               9.9775
      -------------------------------------------------------------
                  HL-Gap            0.1160610 Eh            3.1582 eV
             Fermi-level           -0.4098159 Eh          -11.1517 eV

     #   Z        covCN         q      C6AA      α(0)
     1   6 C      3.690    -0.022    21.155     6.582
     2   7 N      2.960     0.014    21.005     6.807
     3   6 C      3.690    -0.022    21.155     6.582
     4   6 C      3.690    -0.022    21.155     6.582
     5   6 C      3.169     0.052    26.478     8.407

 Mol. C6AA /au·bohr⁶  :        552.611589
 Mol. C8AA /au·bohr⁸  :      15203.335640
 Mol. α(0) /au        :         34.960490


Wiberg/Mayer (AO) data.
largest (>0.10) Wiberg bond orders for each atom
          total WBO             WBO to atom ...
     1  C   3.005        N    2 0.969    C    5 0.941    C    3 0.547    C    4 0.547
     2  N   3.056        C    4 0.969    C    3 0.969    C    1 0.969    C    5 0.149
     3  C   3.005        N    2 0.969    C    5 0.941    C    1 0.547    C    4 0.547
     4  C   3.005        N    2 0.969    C    5 0.941    C    1 0.547    C    3 0.547
     5  C   2.973        C    4 0.941    C    3 0.941    C    1 0.941    N    2 0.149

MOs/occ written to file <molden.input>


molecular dipole:
                 x           y           z       tot (Debye)
 q only:       -0.026       0.049      -0.057
   full:       -0.008       0.014      -0.017       0.059
molecular quadrupole (traceless):
                xx          xy          yy          xz          yz          zz
 q only:       -0.128      -0.115       0.027       0.133      -0.250       0.101
  q+dip:       -0.678      -0.612       0.142       0.709      -1.329       0.537
   full:       -0.377      -0.340       0.079       0.394      -0.739       0.298

           -------------------------------------------------
          |                Geometry Summary                 |
           -------------------------------------------------

      molecular mass/u    :       62.0496468
   center of mass at/Å    :        0.0106699      -0.0199974       0.0231886
  moments of inertia/u·Å² :        0.3620251E+02   0.4573877E+02   0.4573915E+02
rotational constants/cm⁻¹ :        0.4656481E+00   0.3685633E+00   0.3685602E+00

 * 6 selected distances

     #   Z        #   Z                                     value/Å
     1   6 C      2   7 N                                 1.4096756
     2   7 N      3   6 C                                 1.4096753
     2   7 N      4   6 C                                 1.4096690 (min)
     1   6 C      5   6 C                                 1.4701532 (max)
     3   6 C      5   6 C                                 1.4701529
     4   6 C      5   6 C                                 1.4701470

 * 2 distinct bonds (by element types)

   Z      Z             #   av. dist./Å        max./Å        min./Å
   6 C    6 C           3     1.4701510     1.4701532     1.4701470
   6 C    7 N           3     1.4096733     1.4096756     1.4096690

           -------------------------------------------------
          |               Frequency Printout                |
           -------------------------------------------------
 projected vibrational frequencies (cm-1)
eigval :       -0.00    -0.00     0.00     0.00     0.00     0.00
eigval :      404.64   405.07   822.01   849.50   849.59  1039.66
eigval :     1039.83  1278.35  1394.16
 reduced masses (amu)
   1: 12.27   2: 12.77   3: 12.67   4: 12.03   5: 12.53   6: 12.31   7: 12.37   8: 12.37
   9: 12.38  10: 12.47  11: 12.47  12: 12.16  13: 12.15  14: 12.65  15: 12.55
 IR intensities (amu)
   1:  0.03   2:  0.03   3:  0.02   4:  0.01   5:  0.03   6:  0.04   7:  0.87   8:  0.87
   9:  0.11  10:  0.16  11:  0.16  12:  1.04  13:  1.04  14:  0.94  15:  0.24
 Raman intensities (amu)
   1:  0.00   2:  0.00   3:  0.00   4:  0.00   5:  0.00   6:  0.00   7:  0.00   8:  0.00
Refinement of some symmetry elements was terminated before convergence was reached.
Some symmetry elements may remain unidentified.
Molecule has the following symmetry elements: (C3) 3*(sigma) 
It seems to be the C3v point group
   9:  0.00  10:  0.00  11:  0.00  12:  0.00  13:  0.00  14:  0.00  15:  0.00
 output can be read by thermo (or use thermo option).
 writing <g98.out> molden fake output.
 recommended (thermochemical) frequency scaling factor: 1.0
           -------------------------------------------------
          |             Thermodynamic Functions             |
           -------------------------------------------------

c3v symmetry found (for desy threshold:  0.10E+00) used in thermo

          ...................................................
          :                      SETUP                      :
          :.................................................:
          :  # frequencies                           9      :
          :  # imaginary freq.                       0      :
          :  linear?                             false      :
          :  only rotor calc.                    false      :
          :  symmetry                              c3v      :
          :  rotational number                       3      :
          :  scaling factor                  1.0000000      :
          :  rotor cutoff                   50.0000000 cm⁻¹ :
          :  imag. cutoff                  -20.0000000 cm⁻¹ :
          :.................................................:

    mode    ω/cm⁻¹     T·S(HO)/kcal·mol⁻¹    T·S(FR)/kcal·mol⁻¹   T·S(vib)
   ------------------------------------------------------------------------
   ------------------------------------------------------------------------

   temp. (K)  partition function   enthalpy   heat capacity  entropy
                                   cal/mol     cal/K/mol   cal/K/mol   J/K/mol
 298.15  VIB   1.45                  561.699      5.618      2.629
         ROT  0.701E+04              888.752      2.981     20.578
         INT  0.102E+05             1450.452      8.599     23.207
         TR   0.473E+27             1481.254      4.968     38.278
         TOT                        2931.7057    13.5670    61.4848   257.2525

   temp. (K)  partition function   enthalpy   heat capacity  entropy
                                   cal/mol     cal/K/mol   cal/K/mol   J/K/mol
 120.00  VIB   1.02                   18.521      0.770      0.186
         ROT  0.179E+04              357.707      2.981     17.865
         INT  0.182E+04              376.227      3.751     18.051
         TR   0.121E+27              596.178      4.968     33.759
         TOT                         972.4053     8.7188    51.8094   216.7704

   temp. (K)  partition function   enthalpy   heat capacity  entropy
                                   cal/mol     cal/K/mol   cal/K/mol   J/K/mol
 100.00  VIB   1.01                    6.899      0.406      0.081
         ROT  0.136E+04              298.089      2.981     17.321
         INT  0.137E+04              304.988      3.387     17.402
         TR   0.919E+26              496.815      4.968     32.853
         TOT                         801.8033     8.3548    50.2555   210.2691

   temp. (K)  partition function   enthalpy   heat capacity  entropy
                                   cal/mol     cal/K/mol   cal/K/mol   J/K/mol
  80.00  VIB   1.00                    1.597      0.146      0.023
         ROT   974.                  238.471      2.981     16.656
         INT   975.                  240.068      3.127     16.679
         TR   0.657E+26              397.452      4.968     31.745
         TOT                         637.5199     8.0947    48.4241   202.6065

   temp. (K)  partition function   enthalpy   heat capacity  entropy
                                   cal/mol     cal/K/mol   cal/K/mol   J/K/mol
  60.00  VIB   1.00                    0.141      0.023      0.002
         ROT   633.                  178.853      2.981     15.798
         INT   633.                  178.994      3.004     15.801
         TR   0.427E+26              298.089      4.968     30.317
         TOT                         477.0831     7.9718    46.1178   192.9567

   temp. (K)  partition function   enthalpy   heat capacity  entropy
                                   cal/mol     cal/K/mol   cal/K/mol   J/K/mol
  40.00  VIB   1.00                    0.001      0.000     -0.000
         ROT   344.                  119.236      2.981     14.590
         INT   344.                  119.237      2.981     14.590
         TR   0.232E+26              198.726      4.968     28.303
         TOT                         317.9627     7.9494    42.8929   179.4640

   temp. (K)  partition function   enthalpy   heat capacity  entropy
                                   cal/mol     cal/K/mol   cal/K/mol   J/K/mol
  20.00  VIB   1.00                    0.000      0.000     -0.001
         ROT   122.                   59.618      2.981     12.524
         INT   122.                   59.618      2.981     12.523
         TR   0.822E+25               99.363      4.968     24.861
         TOT                         158.9808     7.9490    37.3844   156.4162

   temp. (K)  partition function   enthalpy   heat capacity  entropy
                                   cal/mol     cal/K/mol   cal/K/mol   J/K/mol
  10.00  VIB   1.00                    0.000      0.000     -0.001
         ROT   43.0                   29.809      2.981     10.457
         INT   43.0                   29.809      2.981     10.456
         TR   0.290E+25               49.681      4.968     21.419
         TOT                          79.4904     7.9490    31.8758   133.3685

       T/K    H(0)-H(T)+PV         H(T)/Eh          T*S/Eh         G(T)/Eh
   ------------------------------------------------------------------------
    298.15    0.467197E-02    0.230860E-01    0.292134E-01   -0.612747E-02
    120.00    0.154963E-02    0.199636E-01    0.990762E-02    0.100560E-01
    100.00    0.127775E-02    0.196917E-01    0.800873E-02    0.116830E-01
     80.00    0.101595E-02    0.194299E-01    0.617350E-02    0.132564E-01
     60.00    0.760280E-03    0.191743E-01    0.440960E-02    0.147647E-01
     40.00    0.506706E-03    0.189207E-01    0.273417E-02    0.161865E-01
     20.00    0.253352E-03    0.186673E-01    0.119152E-02    0.174758E-01
     10.00    0.126676E-03    0.185407E-01    0.507974E-03    0.180327E-01 (used)
   ------------------------------------------------------------------------

         :::::::::::::::::::::::::::::::::::::::::::::::::::::
         ::                  THERMODYNAMIC                  ::
         :::::::::::::::::::::::::::::::::::::::::::::::::::::
         :: total free energy         -11.044660504276 Eh   ::
         ::.................................................::
         :: total energy              -11.062693191953 Eh   ::
         :: zero point energy           0.018413985362 Eh   ::
         :: G(RRHO) w/o ZPVE           -0.000381297684 Eh   ::
         :: G(RRHO) contrib.            0.018032687678 Eh   ::
         :::::::::::::::::::::::::::::::::::::::::::::::::::::

optimized geometry written to: xtbopt.xyz


           -------------------------------------------------
          | TOTAL ENERGY              -11.062693191953 Eh   |
          | TOTAL ENTHALPY            -11.044152530576 Eh   |
          | TOTAL FREE ENERGY         -11.044660504276 Eh   |
          | GRADIENT NORM               0.000041510785 Eh/α |
          | HOMO-LUMO GAP               3.158179582291 eV   |
           -------------------------------------------------

------------------------------------------------------------------------
 * finished run on 2020/05/12 at 11:44:15.268     
------------------------------------------------------------------------
 total:
 * wall-time:     0 d,  0 h,  0 min,  0.154 sec
 *  cpu-time:     0 d,  0 h,  0 min,  0.153 sec
 * ratio c/w:     0.999 speedup
 SCF:
 * wall-time:     0 d,  0 h,  0 min,  0.005 sec
 *  cpu-time:     0 d,  0 h,  0 min,  0.005 sec
 * ratio c/w:     1.000 speedup
 ANC optimizer:
 * wall-time:     0 d,  0 h,  0 min,  0.026 sec
 *  cpu-time:     0 d,  0 h,  0 min,  0.026 sec
 * ratio c/w:     1.000 speedup
 numerical hessian:
 * wall-time:     0 d,  0 h,  0 min,  0.107 sec
 *  cpu-time:     0 d,  0 h,  0 min,  0.107 sec
 * ratio c/w:     0.999 speedup

