      -----------------------------------------------------------      
     |                   =====================                   |     
     |                           x T B                           |     
     |                   =====================                   |     
     |                         S. Grimme                         |     
     |          Mulliken Center for Theoretical Chemistry        |     
     |                    University of Bonn                     |     
      -----------------------------------------------------------      

   * xtb version 6.2.2 (9d81278992624c895f80dd42a50cac0aa55982e2) compiled by '@Darwin' on 04/03/2020

   xtb is free software: you can redistribute it and/or modify it under
   the terms of the GNU Lesser General Public License as published by
   the Free Software Foundation, either version 3 of the License, or
   (at your option) any later version.
   
   xtb is distributed in the hope that it will be useful,
   but WITHOUT ANY WARRANTY; without even the implied warranty of
   MERCHANTABILITY or FITNESS FOR A PARTICULAR PURPOSE.  See the
   GNU Lesser General Public License for more details.
   
   Cite this work as:
   * S. Grimme, C. Bannwarth, P. Shushkov, J. Chem. Theory Comput., 2017,
     13, 1989-2009. DOI: 10.1021/acs.jctc.7b00118
   * C. Bannwarth, S. Ehlert and S. Grimme., J. Chem. Theory Comput., 2019,
     15, 1652-1671. DOI: 10.1021/acs.jctc.8b01176
   * P. Pracht, E. Caldeweyher, S. Ehlert, S. Grimme, ChemRxiv, 2019, preprint.
     DOI: 10.26434/chemrxiv.8326202.v1
   
   for DFT-D4:
   * E. Caldeweyher, C. Bannwarth and S. Grimme, J. Chem. Phys., 2017,
     147, 034112. DOI: 10.1063/1.4993215
   * E. Caldeweyher, S. Ehlert, A. Hansen, H. Neugebauer, S. Spicher,
     C. Bannwarth and S. Grimme, J. Chem. Phys., 2019, 150, 154122.
     DOI: 10.1063/1.5090222
   
   for sTDA-xTB:
   * S. Grimme and C. Bannwarth, J. Chem. Phys., 2016, 145, 054103.
     DOI: 10.1063/1.4959605
   
   in the mass-spec context:
   * V. Asgeirsson, C. Bauer and S. Grimme, Chem. Sci., 2017, 8, 4879.
     DOI: 10.1039/c7sc00601b
   
   for metadynamics refer to:
   * S. Grimme, J. Chem. Theory Comput., 2019, 155, 2847-2862
     DOI: 10.1021/acs.jctc.9b00143
   
   with help from (in alphabetical order)
   C. Bannwarth, F. Bohle, G. Brandenburg, E. Caldeweyher, M. Checinski,
   S. Dohm, S. Ehlert, S. Ehrlich, F. März, H. Neugebauer, J. Pisarek,
   P. Pracht, P. Shushkov, and S. Spicher.
   
 * started run on 2020/05/12 at 11:45:01.480     

           -------------------------------------------------
          |                Calculation Setup                |
           -------------------------------------------------

          program call               : xtb --input H1C3N1_29_S_0.input H1C3N1_29_S_0.xyz --ohess --molden --namespace H1C3N1_29_S_0 output.out
          calculation namespace      : H1C3N1_29_S_0
          coordinate file            : H1C3N1_29_S_0.xyz
          number of atoms            :                     5
          number of electrons        :                    18
          charge                     :                     0
          spin                       :                   0.0
          first test random number   :      0.64745537692677

   ID    Z sym.   atoms
    1    7 N      1
    2    6 C      2-4
    3    1 H      5

           -------------------------------------------------
          |                 G F N 2 - x T B                 |
           -------------------------------------------------

        Reference                      10.1021/acs.jctc.8b01176
      * Hamiltonian:
        H0-scaling (s, p, d)           1.850000    2.230000    2.230000
        zeta-weighting                 0.500000
      * Dispersion:
        s8                             2.700000
        a1                             0.520000
        a2                             5.000000
        s9                             5.000000
      * Repulsion:
        kExp                           1.500000    1.000000
        rExp                           1.000000
      * Coulomb:
        alpha                          2.000000
        third order                    shell-resolved
        anisotropic                    true
        a3                             3.000000
        a5                             4.000000
        cn-shift                       1.200000
        cn-exp                         4.000000
        max-rad                        5.000000


          ...................................................
          :                      SETUP                      :
          :.................................................:
          :  # basis functions                  17          :
          :  # atomic orbitals                  17          :
          :  # shells                            9          :
          :  # electrons                        18          :
          :  max. iterations                   250          :
          :  Hamiltonian                  GFN2-xTB          :
          :  restarted?                      false          :
          :  GBSA solvation                  false          :
          :  PC potential                    false          :
          :  electronic temp.          300.0000000     K    :
          :  accuracy                    1.0000000          :
          :  -> integral cutoff          0.2500000E+02      :
          :  -> integral neglect         0.1000000E-07      :
          :  -> SCF convergence          0.1000000E-05 Eh   :
          :  -> wf. convergence          0.1000000E-03 e    :
          :  Broyden damping             0.4000000          :
          ...................................................

 iter      E             dE          RMSdq      gap      omega  full diag
   1     -9.5457044 -0.954570E+01  0.760E+00    0.96       0.0  T
   2     -9.5554121 -0.970777E-02  0.499E+00    1.08       1.0  T
   3     -9.4731987  0.822134E-01  0.364E+00    1.32       1.0  T
   4     -9.5427716 -0.695728E-01  0.216E+00    0.84       1.0  T
   5     -9.5685827 -0.258111E-01  0.304E-01    1.09       1.0  T
   6     -9.5686999 -0.117206E-03  0.154E-01    1.10       1.0  T
   7     -9.5687102 -0.103747E-04  0.432E-02    1.11       1.0  T
   8     -9.5687084  0.186942E-05  0.413E-02    1.11       1.1  T
   9     -9.5687169 -0.853153E-05  0.131E-02    1.11       3.4  T
  10     -9.5687181 -0.119440E-05  0.326E-03    1.11      13.7  T
  11     -9.5687182 -0.663214E-07  0.704E-04    1.11      63.6  T
  12     -9.5687182 -0.262739E-08  0.852E-05    1.11     525.1  T

   *** convergence criteria satisfied after 12 iterations ***

         #    Occupation            Energy/Eh            Energy/eV
      -------------------------------------------------------------
         1        2.0000           -0.7365920             -20.0437
       ...           ...                  ...                  ...
         3        2.0000           -0.6032912             -16.4164
         4        2.0000           -0.5921887             -16.1143
         5        2.0000           -0.5153736             -14.0240
         6        2.0000           -0.5144459             -13.9988
         7        2.0000           -0.4890161             -13.3068
         8        2.0000           -0.4357833             -11.8583
         9        2.0000           -0.4169139             -11.3448 (HOMO)
        10                         -0.3762342             -10.2379 (LUMO)
        11                         -0.3299157              -8.9775
        12                         -0.2313020              -6.2940
        13                         -0.0116243              -0.3163
        14                          0.0149247               0.4061
       ...                                ...                  ...
        17                          0.2278273               6.1995
      -------------------------------------------------------------
                  HL-Gap            0.0406797 Eh            1.1069 eV
             Fermi-level           -0.3965740 Eh          -10.7913 eV

 SCC (total)                   0 d,  0 h,  0 min,  0.004 sec
 SCC setup                      ...        0 min,  0.000 sec (  2.085%)
 Dispersion                     ...        0 min,  0.000 sec (  0.430%)
 integral evaluation            ...        0 min,  0.001 sec ( 27.926%)
 zeroth order Hamiltonian       ...        0 min,  0.000 sec (  0.538%)
 iterations                     ...        0 min,  0.001 sec ( 36.051%)
 molecular gradient             ...        0 min,  0.001 sec ( 30.367%)
 printout                       ...        0 min,  0.000 sec (  2.320%)

         :::::::::::::::::::::::::::::::::::::::::::::::::::::
         ::                     SUMMARY                     ::
         :::::::::::::::::::::::::::::::::::::::::::::::::::::
         :: total energy              -9.484314979041 Eh    ::
         :: gradient norm              0.129463986713 Eh/a0 ::
         :: HOMO-LUMO gap              1.106949745715 eV    ::
         ::.................................................::
         :: SCC energy                -9.568718169490 Eh    ::
         :: -> isotropic ES           -0.007183469521 Eh    ::
         :: -> anisotropic ES          0.002948619835 Eh    ::
         :: -> anisotropic XC          0.008650249421 Eh    ::
         :: -> dispersion             -0.002087276036 Eh    ::
         :: repulsion energy           0.084403167559 Eh    ::
         :: add. restraining           0.000000000000 Eh    ::
         :::::::::::::::::::::::::::::::::::::::::::::::::::::

      ----------------------------------------------------------- 
     |                   =====================                   |
     |                        A N C O P T                        |
     |                   =====================                   |
     |               Approximate Normal Coordinate               |
     |                Rational Function Optimizer                |
      ----------------------------------------------------------- 

          ...................................................
          :                      SETUP                      :
          :.................................................:
          :   optimization level            normal          :
          :   max. optcycles                   200          :
          :   ANC micro-cycles                  20          :
          :   degrees of freedom                 9          :
          :.................................................:
          :   RF solver                   davidson          :
          :   write xtbopt.log                true          :
          :   linear?                        false          :
          :   energy convergence         0.5000000E-05 Eh   :
          :   grad. convergence          0.1000000E-02 Eh/α :
          :   maximium RF displ.         1.0000000          :
          :   Hlow (freq-cutoff)         0.1000000E-01      :
          :   Hmax (freq-cutoff)         5.0000000          :
          :   S6 in model hess.         20.0000000          :
          ...................................................

generating ANC from model Hessian ...
Using Lindh-Hessian (1995)
 Shifting diagonal of input Hessian by    0.0000000000000000     
 Lowest  eigenvalues of input Hessian
   -0.000000   -0.000000   -0.000000    0.000000    0.000000    0.000000
    0.046414    0.106280    0.198135    0.644250    0.659549    0.941060
    0.993536    1.321854    1.516616
 Highest eigenvalues
    0.644250    0.659549    0.941060    0.993536    1.321854    1.516616


........................................................................
.............................. CYCLE    1 ..............................
........................................................................
   1     -9.5687182 -0.956872E+01  0.197E-05    1.11       0.0  T
   2     -9.5687182 -0.657252E-12  0.985E-06    1.11    4541.6  T
   3     -9.5687182  0.101252E-12  0.846E-06    1.11    5285.9  T
     SCC iter.                  ...        0 min,  0.001 sec
     gradient                   ...        0 min,  0.001 sec
 * total energy  :    -9.4843150 Eh     change        0.4369873E-09 Eh
   gradient norm :     0.1294630 Eh/α   predicted     0.0000000E+00 (-100.00%)
   displ. norm   :     0.5620558 α      lambda       -0.4721429E-01
   maximum displ.:     0.5144899 α      in ANC's #1, #3, #4, ...

........................................................................
.............................. CYCLE    2 ..............................
........................................................................
   1     -9.5989767 -0.959898E+01  0.244E+00    2.01       0.0  T
   2     -9.5883088  0.106679E-01  0.196E+00    1.69       1.0  T
   3     -9.6014897 -0.131810E-01  0.134E+00    2.06       1.0  T
   4     -9.6074595 -0.596974E-02  0.974E-02    1.93       1.0  T
   5     -9.6074726 -0.131146E-04  0.592E-02    1.95       1.0  T
   6     -9.6074735 -0.895686E-06  0.116E-02    1.95       3.9  T
   7     -9.6074740 -0.553548E-06  0.420E-03    1.95      10.6  T
   8     -9.6074740  0.412305E-07  0.423E-03    1.95      10.6  T
   9     -9.6074741 -0.964859E-07  0.720E-04    1.95      62.1  T
  10     -9.6074741 -0.681860E-09  0.116E-04    1.95     386.7  T
     SCC iter.                  ...        0 min,  0.001 sec
     gradient                   ...        0 min,  0.001 sec
 * total energy  :    -9.5164690 Eh     change       -0.3215399E-01 Eh
   gradient norm :     0.1087539 Eh/α   predicted    -0.3106479E-01 (  -3.39%)
   displ. norm   :     0.3269633 α      lambda       -0.2767290E-01
   maximum displ.:     0.2356347 α      in ANC's #4, #1, #8, ...

........................................................................
.............................. CYCLE    3 ..............................
........................................................................
   1     -9.6422062 -0.964221E+01  0.200E+00    2.28       0.0  T
   2     -9.6395955  0.261066E-02  0.151E+00    1.54       1.0  T
   3     -9.6515390 -0.119435E-01  0.783E-01    2.03       1.0  T
   4     -9.6524697 -0.930705E-03  0.115E-01    1.95       1.0  T
   5     -9.6524941 -0.244212E-04  0.547E-02    1.93       1.0  T
   6     -9.6524959 -0.177561E-05  0.923E-03    1.92       4.8  T
   7     -9.6524960 -0.961980E-07  0.801E-03    1.92       5.6  T
   8     -9.6524963 -0.343928E-06  0.331E-03    1.92      13.5  T
   9     -9.6524964 -0.287933E-07  0.285E-04    1.92     157.2  T
  10     -9.6524964 -0.903810E-11  0.998E-05    1.92     447.9  T
     SCC iter.                  ...        0 min,  0.001 sec
     gradient                   ...        0 min,  0.001 sec
 * total energy  :    -9.5333146 Eh     change       -0.1684559E-01 Eh
   gradient norm :     0.0272111 Eh/α   predicted    -0.1531564E-01 (  -9.08%)
   displ. norm   :     0.3147881 α      lambda       -0.6669337E-02
   maximum displ.:     0.2977137 α      in ANC's #1, #4, #8, ...

........................................................................
.............................. CYCLE    4 ..............................
........................................................................
   1     -9.6502933 -0.965029E+01  0.967E-01    2.09       0.0  T
   2     -9.6503166 -0.232517E-04  0.567E-01    2.09       1.0  T
   3     -9.6501045  0.212102E-03  0.202E-01    2.16       1.0  T
   4     -9.6503386 -0.234085E-03  0.337E-02    2.11       1.3  T
   5     -9.6503402 -0.160607E-05  0.183E-02    2.12       2.4  T
   6     -9.6503403 -0.132322E-06  0.153E-03    2.12      29.2  T
   7     -9.6503403  0.643438E-08  0.123E-03    2.12      36.4  T
   8     -9.6503403 -0.605826E-08  0.647E-04    2.12      69.1  T
   9     -9.6503403 -0.222613E-08  0.668E-05    2.12     669.9  T
     SCC iter.                  ...        0 min,  0.001 sec
     gradient                   ...        0 min,  0.001 sec
 * total energy  :    -9.5373634 Eh     change       -0.4048793E-02 Eh
   gradient norm :     0.0397686 Eh/α   predicted    -0.3665103E-02 (  -9.48%)
   displ. norm   :     0.1350392 α      lambda       -0.2376463E-02
   maximum displ.:     0.1030193 α      in ANC's #1, #4, #8, ...

........................................................................
.............................. CYCLE    5 ..............................
........................................................................
   1     -9.6588722 -0.965887E+01  0.458E-01    2.13       0.0  T
   2     -9.6588751 -0.295197E-05  0.284E-01    2.03       1.0  T
   3     -9.6588230  0.521468E-04  0.237E-01    2.12       1.0  T
   4     -9.6590212 -0.198236E-03  0.281E-02    2.07       1.6  T
   5     -9.6590215 -0.333124E-06  0.155E-02    2.07       2.9  T
   6     -9.6590218 -0.233977E-06  0.211E-03    2.07      21.2  T
   7     -9.6590218  0.581113E-08  0.128E-03    2.07      34.9  T
   8     -9.6590218 -0.827852E-08  0.581E-04    2.07      77.0  T
   9     -9.6590218 -0.143859E-08  0.171E-04    2.07     261.8  T
     SCC iter.                  ...        0 min,  0.001 sec
     gradient                   ...        0 min,  0.001 sec
 * total energy  :    -9.5389937 Eh     change       -0.1630310E-02 Eh
   gradient norm :     0.0216919 Eh/α   predicted    -0.1209899E-02 ( -25.79%)
   displ. norm   :     0.0961858 α      lambda       -0.9958480E-03
   maximum displ.:     0.0742501 α      in ANC's #1, #7, #8, ...

........................................................................
.............................. CYCLE    6 ..............................
........................................................................
   1     -9.6632535 -0.966325E+01  0.318E-01    2.10       0.0  T
   2     -9.6632683 -0.148232E-04  0.179E-01    2.09       1.0  T
   3     -9.6632697 -0.144372E-05  0.351E-02    2.10       1.3  T
   4     -9.6632704 -0.612870E-06  0.147E-02    2.09       3.0  T
   5     -9.6632707 -0.366709E-06  0.112E-02    2.10       4.0  T
   6     -9.6632711 -0.380589E-06  0.152E-03    2.09      29.5  T
   7     -9.6632711  0.859305E-08  0.124E-03    2.09      36.2  T
   8     -9.6632711 -0.103562E-07  0.202E-04    2.09     221.3  T
   9     -9.6632711 -0.426734E-10  0.754E-05    2.09     592.8  T
     SCC iter.                  ...        0 min,  0.001 sec
     gradient                   ...        0 min,  0.001 sec
 * total energy  :    -9.5396055 Eh     change       -0.6118080E-03 Eh
   gradient norm :     0.0063137 Eh/α   predicted    -0.5025292E-03 ( -17.86%)
   displ. norm   :     0.0389236 α      lambda       -0.1365615E-03
   maximum displ.:     0.0265095 α      in ANC's #1, #3, #7, ...

........................................................................
.............................. CYCLE    7 ..............................
........................................................................
   1     -9.6641936 -0.966419E+01  0.132E-01    2.11       0.0  T
   2     -9.6641959 -0.224115E-05  0.744E-02    2.09       1.0  T
   3     -9.6641840  0.118273E-04  0.531E-02    2.11       1.0  T
   4     -9.6641986 -0.145204E-04  0.778E-03    2.10       5.7  T
   5     -9.6641986 -0.724696E-07  0.385E-03    2.10      11.6  T
   6     -9.6641986 -0.642016E-08  0.567E-04    2.10      78.8  T
   7     -9.6641986  0.289332E-08  0.731E-04    2.10      61.1  T
     SCC iter.                  ...        0 min,  0.001 sec
     gradient                   ...        0 min,  0.001 sec
 * total energy  :    -9.5396887 Eh     change       -0.8326336E-04 Eh
   gradient norm :     0.0034862 Eh/α   predicted    -0.6838559E-04 ( -17.87%)
   displ. norm   :     0.0091873 α      lambda       -0.2112464E-04
   maximum displ.:     0.0060440 α      in ANC's #7, #3, #4, ...

........................................................................
.............................. CYCLE    8 ..............................
........................................................................
   1     -9.6643939 -0.966439E+01  0.511E-02    2.10       0.0  T
   2     -9.6643939 -0.655282E-07  0.305E-02    2.09       1.5  T
   3     -9.6643930  0.914789E-06  0.249E-02    2.10       1.8  T
   4     -9.6643956 -0.258833E-05  0.285E-03    2.09      15.7  T
   5     -9.6643956 -0.127368E-08  0.155E-03    2.09      28.8  T
   6     -9.6643956  0.146223E-07  0.184E-03    2.09      24.3  T
   7     -9.6643956 -0.208721E-07  0.145E-04    2.09     308.2  T
   8     -9.6643956 -0.149569E-10  0.184E-05    2.09    2434.0  T
     SCC iter.                  ...        0 min,  0.001 sec
     gradient                   ...        0 min,  0.001 sec
 * total energy  :    -9.5397019 Eh     change       -0.1319068E-04 Eh
   gradient norm :     0.0017701 Eh/α   predicted    -0.1056434E-04 ( -19.91%)
   displ. norm   :     0.0054833 α      lambda       -0.4482119E-05
   maximum displ.:     0.0038661 α      in ANC's #3, #8, #7, ...

........................................................................
.............................. CYCLE    9 ..............................
........................................................................
   1     -9.6639251 -0.966393E+01  0.343E-02    2.08       0.0  T
   2     -9.6639249  0.189263E-06  0.214E-02    2.08       2.1  T
   3     -9.6639251 -0.167126E-06  0.169E-02    2.08       2.6  T
   4     -9.6639260 -0.978722E-06  0.137E-03    2.08      32.6  T
   5     -9.6639260  0.137748E-08  0.847E-04    2.08      52.8  T
   6     -9.6639260  0.346521E-08  0.930E-04    2.08      48.1  T
     SCC iter.                  ...        0 min,  0.001 sec
     gradient                   ...        0 min,  0.001 sec
 * total energy  :    -9.5397041 Eh     change       -0.2222810E-05 Eh
   gradient norm :     0.0006921 Eh/α   predicted    -0.2241105E-05 (   0.82%)
   displ. norm   :     0.0047727 α      lambda       -0.8787576E-06
   maximum displ.:     0.0040860 α      in ANC's #1, #3, #7, ...

   *** GEOMETRY OPTIMIZATION CONVERGED AFTER 9 ITERATIONS ***

------------------------------------------------------------------------
 total energy gain   :        -0.0553892 Eh      -34.7572 kcal/mol
 total RMSD          :         0.6094255 a0        0.3225 Å
 total power (kW/mol):       -16.1582488 (step)-5571.2162 (real)
------------------------------------------------------------------------

 ANCopt (total)                0 d,  0 h,  0 min,  0.026 sec
 optimizer setup                ...        0 min,  0.000 sec (  0.314%)
 model hessian                  ...        0 min,  0.000 sec (  0.383%)
 ANC generation                 ...        0 min,  0.000 sec (  0.211%)
 coordinate transformation      ...        0 min,  0.000 sec (  0.069%)
 single point calculation       ...        0 min,  0.025 sec ( 96.216%)
 optimization log               ...        0 min,  0.000 sec (  0.764%)
 hessian update                 ...        0 min,  0.000 sec (  0.077%)
 rational function              ...        0 min,  0.000 sec (  0.783%)

================
 final structure:
================
5
 xtb: 6.2.2 (9d81278992624c895f80dd42a50cac0aa55982e2)
N        -0.79255085081851    0.23970539095601    0.19994023733126
C         0.38449495413244   -0.41674381046295    0.63253737828227
C         1.55335228893954   -0.04735780912511   -0.04781385267292
C         0.37753570358839    0.53730696400077   -0.53888836971467
H        -1.52283209584186   -0.31291073536872   -0.24577439322594

 Bond Distances (Angstroems)
 ---------------------------
N1-C2=1.4155         N1-C4=1.4155         N1-H5=1.0185         C2-N1=1.4155         C2-C3=1.4020         C2-C4=1.5108         
C3-C2=1.4020         C3-C4=1.4020         C4-N1=1.4155         C4-C2=1.5108         C4-C3=1.4020         H5-N1=1.0185         
 C  C  Rav=1.4382 sigma=0.0513  Rmin=1.4020  Rmax=1.5108     3
 N  H  Rav=1.0185 sigma=0.0000  Rmin=1.0185  Rmax=1.0185     1
 N  C  Rav=1.4155 sigma=0.0000  Rmin=1.4155  Rmax=1.4155     2

 selected bond angles (degree)
 --------------------
C4-N1-C2= 64.51                H5-N1-C2=118.58                H5-N1-C4=118.58                C3-C2-N1=115.01                
C4-C2-N1= 57.75                C4-C2-C3= 57.40                C4-C3-C2= 65.21                C2-C4-N1= 57.75                
C3-C4-N1=115.01                C3-C4-C2= 57.40                

 selected dihedral angles (degree)
 ---------------------------------
C3-C2-N1-C4=  4.09            C3-C2-N1-H5=114.19            C4-C2-N1-H5=110.11            C4-C3-C2-N1=355.90            
C2-C4-N1-H5=249.89            C3-C4-N1-C2=355.91            C3-C4-N1-H5=245.81            N1-C4-C2-C3=184.40            
C3-C4-C2-N1=175.60            N1-C4-C3-C2=  4.10            
           -------------------------------------------------
          |                Final Singlepoint                |
           -------------------------------------------------

          ...................................................
          :                      SETUP                      :
          :.................................................:
          :  # basis functions                  17          :
          :  # atomic orbitals                  17          :
          :  # shells                            9          :
          :  # electrons                        18          :
          :  max. iterations                   250          :
          :  Hamiltonian                  GFN2-xTB          :
          :  restarted?                      false          :
          :  GBSA solvation                  false          :
          :  PC potential                    false          :
          :  electronic temp.          300.0000000     K    :
          :  accuracy                    1.0000000          :
          :  -> integral cutoff          0.2500000E+02      :
          :  -> integral neglect         0.1000000E-07      :
          :  -> SCF convergence          0.1000000E-05 Eh   :
          :  -> wf. convergence          0.1000000E-03 e    :
          :  Broyden damping             0.4000000          :
          ...................................................

 iter      E             dE          RMSdq      gap      omega  full diag
   1     -9.6639260 -0.966393E+01  0.370E-04    2.08       0.0  T
   2     -9.6639260 -0.208900E-11  0.199E-04    2.08     224.9  T
   3     -9.6639260  0.119767E-09  0.150E-04    2.08     297.7  T

   *** convergence criteria satisfied after 3 iterations ***

         #    Occupation            Energy/Eh            Energy/eV
      -------------------------------------------------------------
         1        2.0000           -0.7398310             -20.1318
       ...           ...                  ...                  ...
         3        2.0000           -0.6043014             -16.4439
         4        2.0000           -0.5982368             -16.2789
         5        2.0000           -0.5427882             -14.7700
         6        2.0000           -0.5298767             -14.4187
         7        2.0000           -0.4456589             -12.1270
         8        2.0000           -0.4270834             -11.6215
         9        2.0000           -0.4085342             -11.1168 (HOMO)
        10                         -0.3320704              -9.0361 (LUMO)
        11                         -0.2831299              -7.7044
        12                         -0.2338925              -6.3645
        13                          0.0235547               0.6410
        14                          0.1249278               3.3995
       ...                                ...                  ...
        17                          0.4112655              11.1911
      -------------------------------------------------------------
                  HL-Gap            0.0764638 Eh            2.0807 eV
             Fermi-level           -0.3703023 Eh          -10.0764 eV

 SCC (total)                   0 d,  0 h,  0 min,  0.002 sec
 SCC setup                      ...        0 min,  0.000 sec (  1.874%)
 Dispersion                     ...        0 min,  0.000 sec (  0.315%)
 integral evaluation            ...        0 min,  0.001 sec ( 39.331%)
 zeroth order Hamiltonian       ...        0 min,  0.000 sec (  0.564%)
 iterations                     ...        0 min,  0.000 sec ( 14.551%)
 molecular gradient             ...        0 min,  0.001 sec ( 41.310%)
 printout                       ...        0 min,  0.000 sec (  1.807%)

         :::::::::::::::::::::::::::::::::::::::::::::::::::::
         ::                     SUMMARY                     ::
         :::::::::::::::::::::::::::::::::::::::::::::::::::::
         :: total energy              -9.539704150093 Eh    ::
         :: gradient norm              0.000703576415 Eh/a0 ::
         :: HOMO-LUMO gap              2.080684829311 eV    ::
         ::.................................................::
         :: SCC energy                -9.663926037182 Eh    ::
         :: -> isotropic ES           -0.001212609587 Eh    ::
         :: -> anisotropic ES          0.003922827329 Eh    ::
         :: -> anisotropic XC          0.006867122919 Eh    ::
         :: -> dispersion             -0.002082358238 Eh    ::
         :: repulsion energy           0.124221885036 Eh    ::
         :: add. restraining           0.000000000000 Eh    ::
         :::::::::::::::::::::::::::::::::::::::::::::::::::::

           ------------------------------------------------- 
          |                Numerical Hessian                |
           ------------------------------------------------- 
step length          :   0.00500
SCC accuracy         :   0.30000
Hessian scale factor :   1.00000
frozen atoms in %    :   0.00000    0
RMS gradient         :   0.00070
estimated CPU  time      0.00 min
estimated wall time      0.00 min

writing file <hessian>.

 projected vibrational frequencies (cm-1)
eigval :       -0.00    -0.00    -0.00    -0.00     0.00     0.00
eigval :      368.01   439.94   555.65   893.62   961.30  1064.08
eigval :     1355.62  1504.89  3293.97
           -------------------------------------------------
          |                Property Printout                |
           -------------------------------------------------

    * Orbital Energies and Occupations

         #    Occupation            Energy/Eh            Energy/eV
      -------------------------------------------------------------
         1        2.0000           -0.7398310             -20.1318
         2        2.0000           -0.6613037             -17.9950
         3        2.0000           -0.6043014             -16.4439
         4        2.0000           -0.5982368             -16.2789
         5        2.0000           -0.5427883             -14.7700
         6        2.0000           -0.5298767             -14.4187
         7        2.0000           -0.4456589             -12.1270
         8        2.0000           -0.4270835             -11.6215
         9        2.0000           -0.4085342             -11.1168 (HOMO)
        10                         -0.3320705              -9.0361 (LUMO)
        11                         -0.2831300              -7.7044
        12                         -0.2338925              -6.3645
        13                          0.0235547               0.6410
        14                          0.1249278               3.3995
        15                          0.2080416               5.6611
        16                          0.2183996               5.9430
        17                          0.4112655              11.1911
      -------------------------------------------------------------
                  HL-Gap            0.0764638 Eh            2.0807 eV
             Fermi-level           -0.3703024 Eh          -10.0764 eV

     #   Z        covCN         q      C6AA      α(0)
     1   7 N      2.686    -0.156    24.368     7.331
     2   6 C      2.865     0.070    26.422     8.426
     3   6 C      1.969    -0.153    35.398     9.608
     4   6 C      2.865     0.070    26.423     8.426
     5   1 H      0.860     0.168     1.287     1.777

 Mol. C6AA /au·bohr⁶  :        496.434282
 Mol. C8AA /au·bohr⁸  :      13068.686720
 Mol. α(0) /au        :         35.568476


Wiberg/Mayer (AO) data.
largest (>0.10) Wiberg bond orders for each atom
          total WBO             WBO to atom ...
     1  N   3.182        C    2 0.998    C    4 0.998    H    5 0.928    C    3 0.258
     2  C   3.382        C    3 1.265    C    4 1.118    N    1 0.998
     3  C   2.829        C    4 1.265    C    2 1.265    N    1 0.258
     4  C   3.382        C    3 1.265    C    2 1.118    N    1 0.998
     5  H   0.972        N    1 0.928

MOs/occ written to file <molden.input>


molecular dipole:
                 x           y           z       tot (Debye)
 q only:       -0.596      -0.140      -0.110
   full:       -1.312      -0.311      -0.245       3.482
molecular quadrupole (traceless):
Molecule has the following symmetry elements: (sigma) 
It seems to be the Cs point group
                xx          xy          yy          xz          yz          zz
 q only:       -0.367       0.662       0.150       0.544      -0.181       0.217
  q+dip:       -2.035       1.764       1.146       1.452       0.570       0.889
   full:       -3.417       2.081       2.001       1.717       1.355       1.416

           -------------------------------------------------
          |                Geometry Summary                 |
           -------------------------------------------------

      molecular mass/u    :       51.0468517
   center of mass at/Å    :        0.2972472       0.0768169       0.0607918
  moments of inertia/u·Å² :        0.1431375E+02   0.4032207E+02   0.5342282E+02
rotational constants/cm⁻¹ :        0.1177723E+01   0.4180745E+00   0.3155512E+00

 * 3 selected distances

     #   Z        #   Z                                     value/Å
     1   7 N      2   6 C                                 1.4154514
     1   7 N      4   6 C                                 1.4154635 (max)
     1   7 N      5   1 H                                 1.0185071 (min)

 * 2 distinct bonds (by element types)

   Z      Z             #   av. dist./Å        max./Å        min./Å
   1 H    7 N           1     1.0185071     1.0185071     1.0185071
   6 C    7 N           2     1.4154575     1.4154635     1.4154514

           -------------------------------------------------
          |               Frequency Printout                |
           -------------------------------------------------
 projected vibrational frequencies (cm-1)
eigval :       -0.00    -0.00    -0.00    -0.00     0.00     0.00
eigval :      368.01   439.94   555.65   893.62   961.30  1064.08
eigval :     1355.62  1504.89  3293.97
 reduced masses (amu)
   1: 11.65   2: 12.41   3: 11.95   4: 12.06   5: 12.13   6: 12.37   7: 12.26   8: 10.75
   9: 12.05  10: 11.33  11:  5.15  12:  2.77  13: 12.45  14: 11.98  15:  1.84
 IR intensities (amu)
   1:  0.15   2:  0.05   3:  0.19   4:  0.19   5:  0.19   6:  0.16   7:  1.39   8:  0.51
   9:  0.61  10:  0.72  11:  0.37  12:  0.05  13:  0.87  14:  0.49  15:  0.08
 Raman intensities (amu)
   1:  0.00   2:  0.00   3:  0.00   4:  0.00   5:  0.00   6:  0.00   7:  0.00   8:  0.00
   9:  0.00  10:  0.00  11:  0.00  12:  0.00  13:  0.00  14:  0.00  15:  0.00
 output can be read by thermo (or use thermo option).
 writing <g98.out> molden fake output.
 recommended (thermochemical) frequency scaling factor: 1.0
           -------------------------------------------------
          |             Thermodynamic Functions             |
           -------------------------------------------------

cs  symmetry found (for desy threshold:  0.10E+00) used in thermo

          ...................................................
          :                      SETUP                      :
          :.................................................:
          :  # frequencies                           9      :
          :  # imaginary freq.                       0      :
          :  linear?                             false      :
          :  only rotor calc.                    false      :
          :  symmetry                               cs      :
          :  rotational number                       1      :
          :  scaling factor                  1.0000000      :
          :  rotor cutoff                   50.0000000 cm⁻¹ :
          :  imag. cutoff                  -20.0000000 cm⁻¹ :
          :.................................................:

    mode    ω/cm⁻¹     T·S(HO)/kcal·mol⁻¹    T·S(FR)/kcal·mol⁻¹   T·S(vib)
   ------------------------------------------------------------------------
   ------------------------------------------------------------------------

   temp. (K)  partition function   enthalpy   heat capacity  entropy
                                   cal/mol     cal/K/mol   cal/K/mol   J/K/mol
 298.15  VIB   1.51                  590.441      5.488      2.806
         ROT  0.134E+05              888.752      2.981     21.868
         INT  0.203E+05             1479.194      8.469     24.674
         TR   0.353E+27             1481.254      4.968     37.697
         TOT                        2960.4475    13.4368    62.3701   260.9566

   temp. (K)  partition function   enthalpy   heat capacity  entropy
                                   cal/mol     cal/K/mol   cal/K/mol   J/K/mol
 120.00  VIB   1.02                   21.515      0.888      0.217
         ROT  0.343E+04              357.707      2.981     19.155
         INT  0.349E+04              379.222      3.869     19.372
         TR   0.901E+26              596.178      4.968     33.177
         TOT                         975.3999     8.8375    52.5488   219.8641

   temp. (K)  partition function   enthalpy   heat capacity  entropy
                                   cal/mol     cal/K/mol   cal/K/mol   J/K/mol
 100.00  VIB   1.01                    8.098      0.469      0.095
         ROT  0.261E+04              298.089      2.981     18.611
         INT  0.262E+04              306.187      3.450     18.707
         TR   0.685E+26              496.815      4.968     32.272
         TOT                         803.0022     8.4180    50.9787   213.2949

   temp. (K)  partition function   enthalpy   heat capacity  entropy
                                   cal/mol     cal/K/mol   cal/K/mol   J/K/mol
  80.00  VIB   1.00                    1.941      0.171      0.028
         ROT  0.186E+04              238.471      2.981     17.946
         INT  0.187E+04              240.412      3.152     17.974
         TR   0.490E+26              397.452      4.968     31.164
         TOT                         637.8640     8.1203    49.1379   205.5930

   temp. (K)  partition function   enthalpy   heat capacity  entropy
                                   cal/mol     cal/K/mol   cal/K/mol   J/K/mol
  60.00  VIB   1.00                    0.190      0.029      0.003
         ROT  0.121E+04              178.853      2.981     17.089
         INT  0.121E+04              179.044      3.010     17.092
         TR   0.319E+26              298.089      4.968     29.735
         TOT                         477.1327     7.9782    46.8274   195.9259

   temp. (K)  partition function   enthalpy   heat capacity  entropy
                                   cal/mol     cal/K/mol   cal/K/mol   J/K/mol
  40.00  VIB   1.00                    0.002      0.001     -0.000
         ROT   659.                  119.236      2.981     15.880
         INT   659.                  119.238      2.982     15.880
         TR   0.173E+26              198.726      4.968     27.722
         TOT                         317.9636     7.9497    43.6016   182.4293

   temp. (K)  partition function   enthalpy   heat capacity  entropy
                                   cal/mol     cal/K/mol   cal/K/mol   J/K/mol
  20.00  VIB   1.00                    0.000      0.000     -0.001
         ROT   233.                   59.618      2.981     13.814
         INT   233.                   59.618      2.981     13.813
         TR   0.613E+25               99.363      4.968     24.280
         TOT                         158.9808     7.9490    38.0930   159.3811

   temp. (K)  partition function   enthalpy   heat capacity  entropy
                                   cal/mol     cal/K/mol   cal/K/mol   J/K/mol
  10.00  VIB   1.00                    0.000      0.000     -0.001
         ROT   82.4                   29.809      2.981     11.748
         INT   82.4                   29.809      2.981     11.747
         TR   0.217E+25               49.681      4.968     20.838
         TOT                          79.4904     7.9490    32.5844   136.3332

       T/K    H(0)-H(T)+PV         H(T)/Eh          T*S/Eh         G(T)/Eh
   ------------------------------------------------------------------------
    298.15    0.471777E-02    0.284952E-01    0.296341E-01   -0.113886E-02
    120.00    0.155440E-02    0.253318E-01    0.100490E-01    0.152828E-01
    100.00    0.127967E-02    0.250571E-01    0.812398E-02    0.169331E-01
     80.00    0.101650E-02    0.247939E-01    0.626450E-02    0.185294E-01
     60.00    0.760359E-03    0.245378E-01    0.447745E-02    0.200603E-01
     40.00    0.506707E-03    0.242841E-01    0.277935E-02    0.215048E-01
     20.00    0.253352E-03    0.240308E-01    0.121410E-02    0.228167E-01
     10.00    0.126676E-03    0.239041E-01    0.519266E-03    0.233848E-01 (used)
   ------------------------------------------------------------------------

         :::::::::::::::::::::::::::::::::::::::::::::::::::::
         ::                  THERMODYNAMIC                  ::
         :::::::::::::::::::::::::::::::::::::::::::::::::::::
         :: total free energy          -9.516319313374 Eh   ::
         ::.................................................::
         :: total energy               -9.539704150387 Eh   ::
         :: zero point energy           0.023777426735 Eh   ::
         :: G(RRHO) w/o ZPVE           -0.000392589722 Eh   ::
         :: G(RRHO) contrib.            0.023384837013 Eh   ::
         :::::::::::::::::::::::::::::::::::::::::::::::::::::

optimized geometry written to: xtbopt.xyz


           -------------------------------------------------
          | TOTAL ENERGY               -9.539704150387 Eh   |
          | TOTAL ENTHALPY             -9.515800047636 Eh   |
          | TOTAL FREE ENERGY          -9.516319313374 Eh   |
          | GRADIENT NORM               0.000703540859 Eh/α |
          | HOMO-LUMO GAP               2.080684728862 eV   |
           -------------------------------------------------

------------------------------------------------------------------------
 * finished run on 2020/05/12 at 11:45:01.610     
------------------------------------------------------------------------
 total:
 * wall-time:     0 d,  0 h,  0 min,  0.129 sec
 *  cpu-time:     0 d,  0 h,  0 min,  0.129 sec
 * ratio c/w:     0.999 speedup
 SCF:
 * wall-time:     0 d,  0 h,  0 min,  0.004 sec
 *  cpu-time:     0 d,  0 h,  0 min,  0.004 sec
 * ratio c/w:     0.996 speedup
 ANC optimizer:
 * wall-time:     0 d,  0 h,  0 min,  0.029 sec
 *  cpu-time:     0 d,  0 h,  0 min,  0.029 sec
 * ratio c/w:     0.999 speedup
 numerical hessian:
 * wall-time:     0 d,  0 h,  0 min,  0.078 sec
 *  cpu-time:     0 d,  0 h,  0 min,  0.078 sec
 * ratio c/w:     1.000 speedup

