      -----------------------------------------------------------      
     |                   =====================                   |     
     |                           x T B                           |     
     |                   =====================                   |     
     |                         S. Grimme                         |     
     |          Mulliken Center for Theoretical Chemistry        |     
     |                    University of Bonn                     |     
      -----------------------------------------------------------      

   * xtb version 6.2.2 (9d81278992624c895f80dd42a50cac0aa55982e2) compiled by '@Darwin' on 04/03/2020

   xtb is free software: you can redistribute it and/or modify it under
   the terms of the GNU Lesser General Public License as published by
   the Free Software Foundation, either version 3 of the License, or
   (at your option) any later version.
   
   xtb is distributed in the hope that it will be useful,
   but WITHOUT ANY WARRANTY; without even the implied warranty of
   MERCHANTABILITY or FITNESS FOR A PARTICULAR PURPOSE.  See the
   GNU Lesser General Public License for more details.
   
   Cite this work as:
   * S. Grimme, C. Bannwarth, P. Shushkov, J. Chem. Theory Comput., 2017,
     13, 1989-2009. DOI: 10.1021/acs.jctc.7b00118
   * C. Bannwarth, S. Ehlert and S. Grimme., J. Chem. Theory Comput., 2019,
     15, 1652-1671. DOI: 10.1021/acs.jctc.8b01176
   * P. Pracht, E. Caldeweyher, S. Ehlert, S. Grimme, ChemRxiv, 2019, preprint.
     DOI: 10.26434/chemrxiv.8326202.v1
   
   for DFT-D4:
   * E. Caldeweyher, C. Bannwarth and S. Grimme, J. Chem. Phys., 2017,
     147, 034112. DOI: 10.1063/1.4993215
   * E. Caldeweyher, S. Ehlert, A. Hansen, H. Neugebauer, S. Spicher,
     C. Bannwarth and S. Grimme, J. Chem. Phys., 2019, 150, 154122.
     DOI: 10.1063/1.5090222
   
   for sTDA-xTB:
   * S. Grimme and C. Bannwarth, J. Chem. Phys., 2016, 145, 054103.
     DOI: 10.1063/1.4959605
   
   in the mass-spec context:
   * V. Asgeirsson, C. Bauer and S. Grimme, Chem. Sci., 2017, 8, 4879.
     DOI: 10.1039/c7sc00601b
   
   for metadynamics refer to:
   * S. Grimme, J. Chem. Theory Comput., 2019, 155, 2847-2862
     DOI: 10.1021/acs.jctc.9b00143
   
   with help from (in alphabetical order)
   C. Bannwarth, F. Bohle, G. Brandenburg, E. Caldeweyher, M. Checinski,
   S. Dohm, S. Ehlert, S. Ehrlich, F. März, H. Neugebauer, J. Pisarek,
   P. Pracht, P. Shushkov, and S. Spicher.
   
 * started run on 2020/05/12 at 11:44:38.368     

           -------------------------------------------------
          |                Calculation Setup                |
           -------------------------------------------------

          program call               : xtb --input C5_16_S_0.input C5_16_S_0.xyz --ohess --molden --namespace C5_16_S_0 output.out
          calculation namespace      : C5_16_S_0
          coordinate file            : C5_16_S_0.xyz
          number of atoms            :                     5
          number of electrons        :                    20
          charge                     :                     0
          spin                       :                   0.0
          first test random number   :      0.99048150030345

   ID    Z sym.   atoms
    1    6 C      1-5

           -------------------------------------------------
          |                 G F N 2 - x T B                 |
           -------------------------------------------------

        Reference                      10.1021/acs.jctc.8b01176
      * Hamiltonian:
        H0-scaling (s, p, d)           1.850000    2.230000    2.230000
        zeta-weighting                 0.500000
      * Dispersion:
        s8                             2.700000
        a1                             0.520000
        a2                             5.000000
        s9                             5.000000
      * Repulsion:
        kExp                           1.500000    1.000000
        rExp                           1.000000
      * Coulomb:
        alpha                          2.000000
        third order                    shell-resolved
        anisotropic                    true
        a3                             3.000000
        a5                             4.000000
        cn-shift                       1.200000
        cn-exp                         4.000000
        max-rad                        5.000000


          ...................................................
          :                      SETUP                      :
          :.................................................:
          :  # basis functions                  20          :
          :  # atomic orbitals                  20          :
          :  # shells                           10          :
          :  # electrons                        20          :
          :  max. iterations                   250          :
          :  Hamiltonian                  GFN2-xTB          :
          :  restarted?                      false          :
          :  GBSA solvation                  false          :
          :  PC potential                    false          :
          :  electronic temp.          300.0000000     K    :
          :  accuracy                    1.0000000          :
          :  -> integral cutoff          0.2500000E+02      :
          :  -> integral neglect         0.1000000E-07      :
          :  -> SCF convergence          0.1000000E-05 Eh   :
          :  -> wf. convergence          0.1000000E-03 e    :
          :  Broyden damping             0.4000000          :
          ...................................................

 iter      E             dE          RMSdq      gap      omega  full diag
   1    -10.1080603 -0.101081E+02  0.986E+00    1.01       0.0  T
   2     -8.8663456  0.124171E+01  0.127E+01    0.34       1.0  T
   3     -9.6498425 -0.783497E+00  0.907E+00    1.90       1.0  T
   4    -10.2676692 -0.617827E+00  0.397E+00    0.43       1.0  T
   5    -10.2750176 -0.734833E-02  0.286E+00    0.51       1.0  T
   6    -10.2747477  0.269889E-03  0.253E+00    0.51       1.0  T
   7    -10.2764903 -0.174264E-02  0.152E+00    0.47       1.0  T
   8    -10.2767660 -0.275669E-03  0.492E-01    0.45       1.0  T
   9    -10.2767425  0.234821E-04  0.284E-01    0.45       1.0  T
  10    -10.2767940 -0.514729E-04  0.197E-01    0.45       1.0  T
  11    -10.2768026 -0.865414E-05  0.671E-02    0.45       1.0  T
  12    -10.2768041 -0.145385E-05  0.110E-02    0.45       4.1  T
  13    -10.2768041 -0.547292E-07  0.139E-03    0.45      32.1  T
  14    -10.2768041 -0.335755E-08  0.105E-03    0.45      42.6  T
  15    -10.2768041 -0.859368E-09  0.356E-04    0.45     125.5  T
  16    -10.2768041 -0.169056E-09  0.108E-04    0.45     412.3  T

   *** convergence criteria satisfied after 16 iterations ***

         #    Occupation            Energy/Eh            Energy/eV
      -------------------------------------------------------------
         1        2.0000           -0.7576234             -20.6160
       ...           ...                  ...                  ...
         4        2.0000           -0.6052204             -16.4689
         5        2.0000           -0.5538272             -15.0704
         6        2.0000           -0.5281445             -14.3715
         7        2.0000           -0.4876069             -13.2685
         8        2.0000           -0.4822089             -13.1216
         9        2.0000           -0.4618957             -12.5688
        10        1.9997           -0.4318593             -11.7515 (HOMO)
        11        0.0003           -0.4153460             -11.3021 (LUMO)
        12                         -0.3950162             -10.7489
        13                         -0.3472257              -9.4485
        14                         -0.1292244              -3.5164
        15                         -0.0947792              -2.5791
       ...                                ...                  ...
        20                          0.2792286               7.5982
      -------------------------------------------------------------
                  HL-Gap            0.0165134 Eh            0.4494 eV
             Fermi-level           -0.4236027 Eh          -11.5268 eV

 SCC (total)                   0 d,  0 h,  0 min,  0.005 sec
 SCC setup                      ...        0 min,  0.000 sec (  1.834%)
 Dispersion                     ...        0 min,  0.000 sec (  0.383%)
 integral evaluation            ...        0 min,  0.001 sec ( 27.957%)
 zeroth order Hamiltonian       ...        0 min,  0.000 sec (  0.427%)
 iterations                     ...        0 min,  0.002 sec ( 37.448%)
 molecular gradient             ...        0 min,  0.001 sec ( 29.927%)
 printout                       ...        0 min,  0.000 sec (  1.795%)

         :::::::::::::::::::::::::::::::::::::::::::::::::::::
         ::                     SUMMARY                     ::
         :::::::::::::::::::::::::::::::::::::::::::::::::::::
         :: total energy             -10.168588702453 Eh    ::
         :: gradient norm              0.230650892387 Eh/a0 ::
         :: HOMO-LUMO gap              0.449351772304 eV    ::
         ::.................................................::
         :: SCC energy               -10.276804149523 Eh    ::
         :: -> isotropic ES           -0.012879951902 Eh    ::
         :: -> anisotropic ES          0.001168635463 Eh    ::
         :: -> anisotropic XC          0.001964915883 Eh    ::
         :: -> dispersion             -0.002724176321 Eh    ::
         :: repulsion energy           0.108215422333 Eh    ::
         :: add. restraining           0.000000000000 Eh    ::
         :::::::::::::::::::::::::::::::::::::::::::::::::::::

      ----------------------------------------------------------- 
     |                   =====================                   |
     |                        A N C O P T                        |
     |                   =====================                   |
     |               Approximate Normal Coordinate               |
     |                Rational Function Optimizer                |
      ----------------------------------------------------------- 

          ...................................................
          :                      SETUP                      :
          :.................................................:
          :   optimization level            normal          :
          :   max. optcycles                   200          :
          :   ANC micro-cycles                  20          :
          :   degrees of freedom                 9          :
          :.................................................:
          :   RF solver                   davidson          :
          :   write xtbopt.log                true          :
          :   linear?                        false          :
          :   energy convergence         0.5000000E-05 Eh   :
          :   grad. convergence          0.1000000E-02 Eh/α :
          :   maximium RF displ.         1.0000000          :
          :   Hlow (freq-cutoff)         0.1000000E-01      :
          :   Hmax (freq-cutoff)         5.0000000          :
          :   S6 in model hess.         20.0000000          :
          ...................................................

generating ANC from model Hessian ...
Using Lindh-Hessian (1995)
 Shifting diagonal of input Hessian by    0.0000000000000000     
 Lowest  eigenvalues of input Hessian
   -0.000000   -0.000000   -0.000000    0.000000    0.000000    0.000000
    0.089748    0.270372    0.661268    0.764389    0.778573    0.816388
    0.923188    1.065169    1.534037
 Highest eigenvalues
    0.764389    0.778573    0.816388    0.923188    1.065169    1.534037


........................................................................
.............................. CYCLE    1 ..............................
........................................................................
   1    -10.2768041 -0.102768E+02  0.245E-05    0.45       0.0  T
   2    -10.2768041  0.894396E-11  0.405E-05    0.45    1103.0  T
   3    -10.2768041 -0.972378E-11  0.160E-05    0.45    2796.2  T
     SCC iter.                  ...        0 min,  0.001 sec
     gradient                   ...        0 min,  0.001 sec
 * total energy  :   -10.1685887 Eh     change       -0.1248832E-09 Eh
   gradient norm :     0.2306509 Eh/α   predicted     0.0000000E+00 (-100.00%)
   displ. norm   :     0.2946710 α      lambda       -0.6169013E-01
   maximum displ.:     0.1918584 α      in ANC's #7, #2, #5, ...

........................................................................
.............................. CYCLE    2 ..............................
........................................................................
   1    -10.3416255 -0.103416E+02  0.219E+00    1.43       0.0  T
   2    -10.3421393 -0.513769E-03  0.128E+00    1.27       1.0  T
   3    -10.3412902  0.849086E-03  0.517E-01    1.47       1.0  T
   4    -10.3419218 -0.631585E-03  0.232E-01    1.39       1.0  T
   5    -10.3423245 -0.402703E-03  0.133E-01    1.35       1.0  T
   6    -10.3424162 -0.917414E-04  0.765E-03    1.36       5.8  T
   7    -10.3424162  0.581680E-07  0.583E-03    1.36       7.7  T
   8    -10.3424163 -0.134943E-06  0.421E-04    1.36     106.2  T
   9    -10.3424163  0.446736E-09  0.448E-04    1.36      99.8  T
     SCC iter.                  ...        0 min,  0.001 sec
     gradient                   ...        0 min,  0.002 sec
 * total energy  :   -10.2163608 Eh     change       -0.4777206E-01 Eh
   gradient norm :     0.1214595 Eh/α   predicted    -0.3352337E-01 ( -29.83%)
   displ. norm   :     0.3102895 α      lambda       -0.3474581E-01
   maximum displ.:     0.1920680 α      in ANC's #2, #7, #5, ...

........................................................................
.............................. CYCLE    3 ..............................
........................................................................
   1    -10.3976317 -0.103976E+02  0.233E+00    1.82       0.0  T
   2    -10.3979217 -0.290033E-03  0.135E+00    1.72       1.0  T
   3    -10.3949190  0.300272E-02  0.723E-01    1.78       1.0  T
   4    -10.3971502 -0.223116E-02  0.344E-01    1.85       1.0  T
   5    -10.3981103 -0.960107E-03  0.889E-02    1.77       1.0  T
   6    -10.3981377 -0.274320E-04  0.747E-03    1.78       6.0  T
   7    -10.3981377  0.300754E-07  0.495E-03    1.78       9.0  T
   8    -10.3981377  0.105974E-07  0.464E-03    1.78       9.6  T
   9    -10.3981378 -0.116863E-06  0.699E-04    1.78      64.0  T
  10    -10.3981378 -0.327718E-08  0.149E-04    1.78     300.4  T
     SCC iter.                  ...        0 min,  0.001 sec
     gradient                   ...        0 min,  0.001 sec
 * total energy  :   -10.2337876 Eh     change       -0.1742684E-01 Eh
   gradient norm :     0.0755350 Eh/α   predicted    -0.1904556E-01 (   9.29%)
   displ. norm   :     0.0965733 α      lambda       -0.5851219E-02
   maximum displ.:     0.0775241 α      in ANC's #5, #2, #7, ...

........................................................................
.............................. CYCLE    4 ..............................
........................................................................
   1    -10.3916047 -0.103916E+02  0.883E-01    1.83       0.0  T
   2    -10.3875009  0.410382E-02  0.102E+00    1.98       1.0  T
   3    -10.3923560 -0.485513E-02  0.440E-01    1.86       1.0  T
   4    -10.3927879 -0.431928E-03  0.229E-02    1.89       2.0  T
   5    -10.3927879 -0.327561E-07  0.114E-02    1.89       3.9  T
   6    -10.3927880 -0.861733E-07  0.278E-03    1.89      16.1  T
   7    -10.3927880  0.651763E-07  0.376E-03    1.89      11.9  T
   8    -10.3927881 -0.104228E-06  0.586E-04    1.89      76.3  T
   9    -10.3927881 -0.227125E-09  0.255E-04    1.89     175.2  T
     SCC iter.                  ...        0 min,  0.001 sec
     gradient                   ...        0 min,  0.001 sec
 * total energy  :   -10.2387939 Eh     change       -0.5006280E-02 Eh
   gradient norm :     0.0502129 Eh/α   predicted    -0.2952895E-02 ( -41.02%)
   displ. norm   :     0.3180594 α      lambda       -0.1344741E-01
   maximum displ.:     0.2887637 α      in ANC's #5, #2, #9, ...

........................................................................
.............................. CYCLE    5 ..............................
........................................................................
   1    -10.3793915 -0.103794E+02  0.254E+00    2.31       0.0  T
   2    -10.3574607  0.219308E-01  0.259E+00    2.39       1.0  T
   3    -10.3826499 -0.251892E-01  0.130E+00    2.42       1.0  T
   4    -10.3877171 -0.506717E-02  0.170E-01    2.46       1.0  T
   5    -10.3878305 -0.113434E-03  0.531E-02    2.49       1.0  T
   6    -10.3878311 -0.546564E-06  0.873E-03    2.50       5.1  T
   7    -10.3878313 -0.201476E-06  0.459E-03    2.50       9.8  T
   8    -10.3878313 -0.534565E-07  0.338E-03    2.50      13.2  T
   9    -10.3878313 -0.190250E-07  0.187E-03    2.50      24.0  T
  10    -10.3878314 -0.268034E-07  0.202E-04    2.50     221.8  T
  11    -10.3878314 -0.579448E-10  0.370E-05    2.50    1207.8  T
     SCC iter.                  ...        0 min,  0.001 sec
     gradient                   ...        0 min,  0.002 sec
 * total energy  :   -10.2469358 Eh     change       -0.8141926E-02 Eh
   gradient norm :     0.0167998 Eh/α   predicted    -0.7403886E-02 (  -9.06%)
   displ. norm   :     0.0879042 α      lambda       -0.1003818E-02
   maximum displ.:     0.0862096 α      in ANC's #5, #2, #9, ...

........................................................................
.............................. CYCLE    6 ..............................
........................................................................
   1    -10.3883995 -0.103884E+02  0.649E-01    2.67       0.0  T
   2    -10.3874091  0.990420E-03  0.612E-01    2.71       1.0  T
   3    -10.3883812 -0.972167E-03  0.355E-01    2.72       1.0  T
   4    -10.3888580 -0.476773E-03  0.964E-02    2.70       1.0  T
   5    -10.3889063 -0.483043E-04  0.116E-02    2.72       3.8  T
   6    -10.3889064 -0.529977E-07  0.205E-03    2.72      21.8  T
   7    -10.3889064 -0.612871E-08  0.915E-04    2.72      48.9  T
   8    -10.3889064 -0.318507E-08  0.585E-04    2.72      76.5  T
     SCC iter.                  ...        0 min,  0.001 sec
     gradient                   ...        0 min,  0.001 sec
 * total energy  :   -10.2474603 Eh     change       -0.5245091E-03 Eh
   gradient norm :     0.0087282 Eh/α   predicted    -0.5057871E-03 (  -3.57%)
   displ. norm   :     0.0098947 α      lambda       -0.7170554E-04
   maximum displ.:     0.0070136 α      in ANC's #2, #7, #9, ...

........................................................................
.............................. CYCLE    7 ..............................
........................................................................
   1    -10.3910790 -0.103911E+02  0.684E-02    2.76       0.0  T
   2    -10.3910757  0.332415E-05  0.499E-02    2.76       1.0  T
   3    -10.3910642  0.114615E-04  0.500E-02    2.76       1.0  T
   4    -10.3910809 -0.166293E-04  0.913E-03    2.76       4.9  T
   5    -10.3910813 -0.456115E-06  0.147E-03    2.76      30.4  T
   6    -10.3910813  0.288380E-07  0.209E-03    2.76      21.4  T
   7    -10.3910813 -0.308257E-07  0.885E-05    2.76     505.4  T
   8    -10.3910813 -0.850697E-11  0.523E-05    2.76     854.6  T
     SCC iter.                  ...        0 min,  0.001 sec
     gradient                   ...        0 min,  0.001 sec
 * total energy  :   -10.2475067 Eh     change       -0.4641998E-04 Eh
   gradient norm :     0.0025445 Eh/α   predicted    -0.3585650E-04 ( -22.76%)
   displ. norm   :     0.0042931 α      lambda       -0.9036625E-05
   maximum displ.:     0.0029259 α      in ANC's #2, #7, #9, ...

........................................................................
.............................. CYCLE    8 ..............................
........................................................................
   1    -10.3919703 -0.103920E+02  0.292E-02    2.78       0.0  T
   2    -10.3919689  0.137635E-05  0.250E-02    2.78       1.8  T
   3    -10.3919691 -0.204816E-06  0.179E-02    2.78       2.5  T
   4    -10.3919708 -0.176087E-05  0.290E-03    2.78      15.4  T
   5    -10.3919709 -0.398479E-07  0.747E-04    2.78      59.9  T
   6    -10.3919709  0.131538E-08  0.515E-04    2.78      86.8  T
     SCC iter.                  ...        0 min,  0.001 sec
     gradient                   ...        0 min,  0.001 sec
 * total energy  :   -10.2475113 Eh     change       -0.4519500E-05 Eh
   gradient norm :     0.0002522 Eh/α   predicted    -0.4516903E-05 (  -0.06%)
   displ. norm   :     0.0003447 α      lambda       -0.4828195E-07
   maximum displ.:     0.0002479 α      in ANC's #9, #2, #7, ...

   *** GEOMETRY OPTIMIZATION CONVERGED AFTER 8 ITERATIONS ***

------------------------------------------------------------------------
 total energy gain   :        -0.0789226 Eh      -49.5247 kcal/mol
 total RMSD          :         0.4350053 a0        0.2302 Å
 total power (kW/mol):       -25.9013929 (step)-6496.8755 (real)
------------------------------------------------------------------------

 ANCopt (total)                0 d,  0 h,  0 min,  0.032 sec
 optimizer setup                ...        0 min,  0.000 sec (  0.200%)
 model hessian                  ...        0 min,  0.000 sec (  0.310%)
 ANC generation                 ...        0 min,  0.000 sec (  0.156%)
 coordinate transformation      ...        0 min,  0.000 sec (  0.056%)
 single point calculation       ...        0 min,  0.031 sec ( 97.260%)
 optimization log               ...        0 min,  0.000 sec (  0.556%)
 hessian update                 ...        0 min,  0.000 sec (  0.049%)
 rational function              ...        0 min,  0.000 sec (  0.574%)

================
 final structure:
================
5
 xtb: 6.2.2 (9d81278992624c895f80dd42a50cac0aa55982e2)
C        -0.04769690039327   -0.94184340228990    0.00347091295041
C        -0.51964202306125    0.02979865051309    0.96473108188796
C         0.04746498673648    0.94185565347665   -0.00345526304887
C        -0.57457622350095    0.02559592493300   -0.93318083004035
C         1.09444916021898   -0.05540682663283   -0.03156490174917

 Bond Distances (Angstroems)
 ---------------------------
C1-C2=1.4460         C1-C3=1.8861         C1-C4=1.4460         C1-C5=1.4462         C2-C1=1.4460         C2-C3=1.4460         
C2-C4=1.8987         C2-C5=1.8987         C3-C1=1.8861         C3-C2=1.4460         C3-C4=1.4460         C3-C5=1.4462         
C4-C1=1.4460         C4-C2=1.8987         C4-C3=1.4460         C4-C5=1.8987         C5-C1=1.4462         C5-C2=1.8987         
C5-C3=1.4462         C5-C4=1.8987         
 C  C  Rav=1.6259 sigma=0.2202  Rmin=1.4460  Rmax=1.8987    10

 selected bond angles (degree)
 --------------------
C3-C1-C2= 49.29                C4-C1-C2= 82.07                C4-C1-C3= 49.29                C5-C1-C2= 82.07                
C5-C1-C3= 49.30                C5-C1-C4= 82.07                C3-C2-C1= 81.41                C4-C2-C1= 48.96                
C4-C2-C3= 48.96                C5-C2-C1= 48.97                C5-C2-C3= 48.97                C5-C2-C4= 60.00                
C2-C3-C1= 49.29                C4-C3-C1= 49.29                C4-C3-C2= 82.07                C5-C3-C1= 49.30                
C5-C3-C2= 82.07                C5-C3-C4= 82.07                C2-C4-C1= 48.96                C3-C4-C1= 81.41                
C3-C4-C2= 48.96                C5-C4-C1= 48.97                C5-C4-C2= 60.00                C5-C4-C3= 48.97                
C2-C5-C1= 48.96                C3-C5-C1= 81.40                C3-C5-C2= 48.96                C4-C5-C1= 48.96                
C4-C5-C2= 60.00                C4-C5-C3= 48.96                

 selected dihedral angles (degree)
 ---------------------------------
C3-C2-C1-C4=318.49            C3-C2-C1-C5= 41.53            C4-C2-C1-C3= 41.51            C4-C2-C1-C5= 83.03            
C5-C2-C1-C3=318.47            C5-C2-C1-C4=276.97            C1-C3-C2-C4=318.49            C1-C3-C2-C5= 41.53            
C4-C3-C2-C1= 41.51            C4-C3-C2-C5= 83.03            C5-C3-C2-C1=318.47            C5-C3-C2-C4=276.97            
C2-C4-C1-C3=318.49            C2-C4-C1-C5=276.97            C3-C4-C1-C2= 41.51            C3-C4-C1-C5=318.47            
C5-C4-C1-C2= 83.03            C5-C4-C1-C3= 41.53            C1-C4-C3-C2=318.49            C1-C4-C3-C5= 41.53            
C2-C4-C3-C1= 41.51            C2-C4-C3-C5= 83.03            C5-C4-C3-C1=318.47            C5-C4-C3-C2=276.97            
C2-C5-C1-C3= 41.52            C2-C5-C1-C4= 83.04            C3-C5-C1-C2=318.48            C3-C5-C1-C4= 41.52            
C4-C5-C1-C2=276.96            C4-C5-C1-C3=318.48            C1-C5-C3-C2= 41.52            C1-C5-C3-C4=318.48            
C2-C5-C3-C1=318.48            C2-C5-C3-C4=276.96            C4-C5-C3-C1= 41.52            C4-C5-C3-C2= 83.04            
           -------------------------------------------------
          |                Final Singlepoint                |
           -------------------------------------------------

          ...................................................
          :                      SETUP                      :
          :.................................................:
          :  # basis functions                  20          :
          :  # atomic orbitals                  20          :
          :  # shells                           10          :
          :  # electrons                        20          :
          :  max. iterations                   250          :
          :  Hamiltonian                  GFN2-xTB          :
          :  restarted?                      false          :
          :  GBSA solvation                  false          :
          :  PC potential                    false          :
          :  electronic temp.          300.0000000     K    :
          :  accuracy                    1.0000000          :
          :  -> integral cutoff          0.2500000E+02      :
          :  -> integral neglect         0.1000000E-07      :
          :  -> SCF convergence          0.1000000E-05 Eh   :
          :  -> wf. convergence          0.1000000E-03 e    :
          :  Broyden damping             0.4000000          :
          ...................................................

 iter      E             dE          RMSdq      gap      omega  full diag
   1    -10.3919709 -0.103920E+02  0.245E-04    2.78       0.0  T
   2    -10.3919709  0.236433E-11  0.158E-04    2.78     283.4  T
   3    -10.3919709  0.163149E-09  0.147E-04    2.78     305.2  T

   *** convergence criteria satisfied after 3 iterations ***

         #    Occupation            Energy/Eh            Energy/eV
      -------------------------------------------------------------
         1        2.0000           -0.7769226             -21.1411
       ...           ...                  ...                  ...
         4        2.0000           -0.6480046             -17.6331
         5        2.0000           -0.5376599             -14.6305
         6        2.0000           -0.5376188             -14.6294
         7        2.0000           -0.4991317             -13.5821
         8        2.0000           -0.4781458             -13.0110
         9        2.0000           -0.4751074             -12.9283
        10        2.0000           -0.4750787             -12.9275 (HOMO)
        11                         -0.3729527             -10.1486 (LUMO)
        12                         -0.3267240              -8.8906
        13                         -0.3266638              -8.8890
        14                         -0.2969365              -8.0801
        15                          0.0152515               0.4150
       ...                                ...                  ...
        20                          0.5510603              14.9951
      -------------------------------------------------------------
                  HL-Gap            0.1021260 Eh            2.7790 eV
             Fermi-level           -0.4240157 Eh          -11.5381 eV

 SCC (total)                   0 d,  0 h,  0 min,  0.003 sec
 SCC setup                      ...        0 min,  0.000 sec (  1.579%)
 Dispersion                     ...        0 min,  0.000 sec (  0.252%)
 integral evaluation            ...        0 min,  0.001 sec ( 41.089%)
 zeroth order Hamiltonian       ...        0 min,  0.000 sec (  0.548%)
 iterations                     ...        0 min,  0.000 sec (  9.618%)
 molecular gradient             ...        0 min,  0.001 sec ( 45.205%)
 printout                       ...        0 min,  0.000 sec (  1.449%)

         :::::::::::::::::::::::::::::::::::::::::::::::::::::
         ::                     SUMMARY                     ::
         :::::::::::::::::::::::::::::::::::::::::::::::::::::
         :: total energy             -10.247511260595 Eh    ::
         :: gradient norm              0.000251940499 Eh/a0 ::
         :: HOMO-LUMO gap              2.778990161452 eV    ::
         ::.................................................::
         :: SCC energy               -10.391970882488 Eh    ::
         :: -> isotropic ES           -0.014916580519 Eh    ::
         :: -> anisotropic ES          0.002535957962 Eh    ::
         :: -> anisotropic XC          0.004147959439 Eh    ::
         :: -> dispersion             -0.002394707285 Eh    ::
         :: repulsion energy           0.144459604580 Eh    ::
         :: add. restraining           0.000000000000 Eh    ::
         :::::::::::::::::::::::::::::::::::::::::::::::::::::

           ------------------------------------------------- 
          |                Numerical Hessian                |
           ------------------------------------------------- 
step length          :   0.00500
SCC accuracy         :   0.30000
Hessian scale factor :   1.00000
frozen atoms in %    :   0.00000    0
RMS gradient         :   0.00025
estimated CPU  time      0.00 min
estimated wall time      0.00 min

writing file <hessian>.

 projected vibrational frequencies (cm-1)
eigval :       -0.00    -0.00    -0.00    -0.00     0.00     0.00
eigval :      465.46   465.77   664.01   882.78   883.40  1124.82
eigval :     1136.85  1137.33  1398.82
           -------------------------------------------------
          |                Property Printout                |
           -------------------------------------------------

    * Orbital Energies and Occupations

         #    Occupation            Energy/Eh            Energy/eV
      -------------------------------------------------------------
         1        2.0000           -0.7769226             -21.1411
         2        2.0000           -0.6564098             -17.8618
         3        2.0000           -0.6564051             -17.8617
         4        2.0000           -0.6480046             -17.6331
         5        2.0000           -0.5376602             -14.6305
         6        2.0000           -0.5376185             -14.6293
         7        2.0000           -0.4991317             -13.5821
         8        2.0000           -0.4781458             -13.0110
         9        2.0000           -0.4751074             -12.9283
        10        2.0000           -0.4750787             -12.9276 (HOMO)
        11                         -0.3729526             -10.1486 (LUMO)
        12                         -0.3267240              -8.8906
        13                         -0.3266638              -8.8890
        14                         -0.2969365              -8.0801
        15                          0.0152517               0.4150
        16                          0.0155002               0.4218
        17                          0.1092923               2.9740
        18                          0.1094720               2.9789
        19                          0.1406920               3.8284
        20                          0.5510603              14.9951
      -------------------------------------------------------------
                  HL-Gap            0.1021261 Eh            2.7790 eV
             Fermi-level           -0.4240157 Eh          -11.5381 eV

     #   Z        covCN         q      C6AA      α(0)
     1   6 C      3.651     0.080    19.541     6.349
     2   6 C      3.340    -0.054    26.644     8.162
     3   6 C      3.651     0.080    19.541     6.349
     4   6 C      3.340    -0.054    26.644     8.162
     5   6 C      3.340    -0.054    26.647     8.163

 Mol. C6AA /au·bohr⁶  :        591.137483
 Mol. C8AA /au·bohr⁸  :      17096.723267
 Mol. α(0) /au        :         37.185770
Molecule has the following symmetry elements: (C3) 3*(C2) (S3) 4*(sigma) 
It seems to be the D3h point group


Wiberg/Mayer (AO) data.
largest (>0.10) Wiberg bond orders for each atom
          total WBO             WBO to atom ...
     1  C   3.575        C    2 0.980    C    4 0.980    C    5 0.980    C    3 0.634
     2  C   3.065        C    1 0.980    C    3 0.980    C    4 0.552    C    5 0.552
     3  C   3.575        C    2 0.980    C    4 0.980    C    5 0.980    C    1 0.634
     4  C   3.065        C    3 0.980    C    1 0.980    C    2 0.552    C    5 0.552
     5  C   3.065        C    1 0.980    C    3 0.980    C    2 0.552    C    4 0.552

MOs/occ written to file <molden.input>


molecular dipole:
                 x           y           z       tot (Debye)
 q only:       -0.000       0.000       0.000
   full:       -0.000       0.000       0.000       0.001
molecular quadrupole (traceless):
                xx          xy          yy          xz          yz          zz
 q only:       -0.425       0.065       0.853      -0.000      -0.005      -0.428
  q+dip:       -1.229       0.187       2.467      -0.001      -0.014      -1.237
   full:       -1.015       0.155       2.036      -0.001      -0.011      -1.021

           -------------------------------------------------
          |                Geometry Summary                 |
           -------------------------------------------------

      molecular mass/u    :       60.0536795
   center of mass at/Å    :       -0.0000002       0.0000000       0.0000002
  moments of inertia/u·Å² :        0.4301358E+02   0.4301395E+02   0.4330022E+02
rotational constants/cm⁻¹ :        0.3919142E+00   0.3919109E+00   0.3893198E+00

 * 6 selected distances

     #   Z        #   Z                                     value/Å
     1   6 C      2   6 C                                 1.4459743 (min)
     2   6 C      3   6 C                                 1.4459748
     1   6 C      4   6 C                                 1.4459797
     3   6 C      4   6 C                                 1.4459795
     1   6 C      5   6 C                                 1.4462002
     3   6 C      5   6 C                                 1.4462014 (max)

 * 1 distinct bonds (by element types)

   Z      Z             #   av. dist./Å        max./Å        min./Å
   6 C    6 C           6     1.4460516     1.4462014     1.4459743

           -------------------------------------------------
          |               Frequency Printout                |
           -------------------------------------------------
 projected vibrational frequencies (cm-1)
eigval :       -0.00    -0.00    -0.00    -0.00     0.00     0.00
eigval :      465.46   465.77   664.01   882.78   883.40  1124.82
eigval :     1136.85  1137.33  1398.82
 reduced masses (amu)
   1: 12.01   2: 12.01   3: 12.01   4: 12.01   5: 12.01   6: 12.01   7: 12.01   8: 12.01
   9: 12.01  10: 12.01  11: 12.01  12: 12.01  13: 12.01  14: 12.01  15: 12.01
 IR intensities (amu)
   1:  0.02   2:  0.07   3:  0.03   4:  0.09   5:  0.04   6:  0.05   7:  0.52   8:  0.51
   9:  0.00  10:  0.03  11:  0.03  12:  1.56  13:  0.97  14:  0.96  15:  0.00
 Raman intensities (amu)
   1:  0.00   2:  0.00   3:  0.00   4:  0.00   5:  0.00   6:  0.00   7:  0.00   8:  0.00
   9:  0.00  10:  0.00  11:  0.00  12:  0.00  13:  0.00  14:  0.00  15:  0.00
 output can be read by thermo (or use thermo option).
 writing <g98.out> molden fake output.
 recommended (thermochemical) frequency scaling factor: 1.0
           -------------------------------------------------
          |             Thermodynamic Functions             |
           -------------------------------------------------

d3h symmetry found (for desy threshold:  0.10E+00) used in thermo

          ...................................................
          :                      SETUP                      :
          :.................................................:
          :  # frequencies                           9      :
          :  # imaginary freq.                       0      :
          :  linear?                             false      :
          :  only rotor calc.                    false      :
          :  symmetry                              d3h      :
          :  rotational number                       6      :
          :  scaling factor                  1.0000000      :
          :  rotor cutoff                   50.0000000 cm⁻¹ :
          :  imag. cutoff                  -20.0000000 cm⁻¹ :
          :.................................................:

    mode    ω/cm⁻¹     T·S(HO)/kcal·mol⁻¹    T·S(FR)/kcal·mol⁻¹   T·S(vib)
   ------------------------------------------------------------------------
   ------------------------------------------------------------------------

   temp. (K)  partition function   enthalpy   heat capacity  entropy
                                   cal/mol     cal/K/mol   cal/K/mol   J/K/mol
 298.15  VIB   1.36                  513.232      5.465      2.332
         ROT  0.360E+04              888.752      2.981     19.256
         INT  0.490E+04             1401.984      8.446     21.588
         TR   0.450E+27             1481.254      4.968     38.181
         TOT                        2883.2382    13.4138    59.7687   250.0722

   temp. (K)  partition function   enthalpy   heat capacity  entropy
                                   cal/mol     cal/K/mol   cal/K/mol   J/K/mol
 120.00  VIB   1.01                   10.858      0.526      0.106
         ROT   920.                  357.707      2.981     16.543
         INT   927.                  368.565      3.507     16.649
         TR   0.115E+27              596.178      4.968     33.661
         TOT                         964.7432     8.4753    50.3107   210.5002

   temp. (K)  partition function   enthalpy   heat capacity  entropy
                                   cal/mol     cal/K/mol   cal/K/mol   J/K/mol
 100.00  VIB   1.00                    3.435      0.235      0.039
         ROT   700.                  298.089      2.981     16.000
         INT   702.                  301.524      3.216     16.039
         TR   0.875E+26              496.815      4.968     32.756
         TOT                         798.3391     8.1843    48.7950   204.1582

   temp. (K)  partition function   enthalpy   heat capacity  entropy
                                   cal/mol     cal/K/mol   cal/K/mol   J/K/mol
  80.00  VIB   1.00                    0.628      0.066      0.009
         ROT   501.                  238.471      2.981     15.334
         INT   501.                  239.099      3.047     15.343
         TR   0.626E+26              397.452      4.968     31.648
         TOT                         636.5509     8.0154    46.9911   196.6106

   temp. (K)  partition function   enthalpy   heat capacity  entropy
                                   cal/mol     cal/K/mol   cal/K/mol   J/K/mol
  60.00  VIB   1.00                    0.038      0.007      0.001
         ROT   325.                  178.853      2.981     14.477
         INT   325.                  178.891      2.988     14.477
         TR   0.406E+26              298.089      4.968     30.219
         TOT                         476.9803     7.9561    44.6968   187.0113

   temp. (K)  partition function   enthalpy   heat capacity  entropy
                                   cal/mol     cal/K/mol   cal/K/mol   J/K/mol
  40.00  VIB   1.00                    0.000      0.000     -0.000
         ROT   177.                  119.236      2.981     13.268
         INT   177.                  119.236      2.981     13.268
         TR   0.221E+26              198.726      4.968     28.206
         TOT                         317.9617     7.9491    41.4739   173.5267

   temp. (K)  partition function   enthalpy   heat capacity  entropy
                                   cal/mol     cal/K/mol   cal/K/mol   J/K/mol
  20.00  VIB   1.00                    0.000      0.000     -0.000
         ROT   62.6                   59.618      2.981     11.202
         INT   62.6                   59.618      2.981     11.202
         TR   0.782E+25               99.363      4.968     24.764
         TOT                         158.9808     7.9490    35.9655   150.4796

   temp. (K)  partition function   enthalpy   heat capacity  entropy
                                   cal/mol     cal/K/mol   cal/K/mol   J/K/mol
  10.00  VIB   1.00                    0.000      0.000     -0.001
         ROT   22.1                   29.809      2.981      9.136
         INT   22.1                   29.809      2.981      9.135
         TR   0.277E+25               49.681      4.968     21.322
         TOT                          79.4904     7.9490    30.4571   127.4324

       T/K    H(0)-H(T)+PV         H(T)/Eh          T*S/Eh         G(T)/Eh
   ------------------------------------------------------------------------
    298.15    0.459473E-02    0.231828E-01    0.283980E-01   -0.521520E-02
    120.00    0.153742E-02    0.201255E-01    0.962103E-02    0.105045E-01
    100.00    0.127223E-02    0.198603E-01    0.777598E-02    0.120844E-01
     80.00    0.101441E-02    0.196025E-01    0.599080E-02    0.136117E-01
     60.00    0.760117E-03    0.193482E-01    0.427373E-02    0.150745E-01
     40.00    0.506704E-03    0.190948E-01    0.264371E-02    0.164511E-01
     20.00    0.253352E-03    0.188414E-01    0.114629E-02    0.176952E-01
     10.00    0.126676E-03    0.187148E-01    0.485364E-03    0.182294E-01 (used)
   ------------------------------------------------------------------------

         :::::::::::::::::::::::::::::::::::::::::::::::::::::
         ::                  THERMODYNAMIC                  ::
         :::::::::::::::::::::::::::::::::::::::::::::::::::::
         :: total free energy         -10.229281851384 Eh   ::
         ::.................................................::
         :: total energy              -10.247511260730 Eh   ::
         :: zero point energy           0.018588097748 Eh   ::
         :: G(RRHO) w/o ZPVE           -0.000358688403 Eh   ::
         :: G(RRHO) contrib.            0.018229409345 Eh   ::
         :::::::::::::::::::::::::::::::::::::::::::::::::::::

optimized geometry written to: xtbopt.xyz


           -------------------------------------------------
          | TOTAL ENERGY              -10.247511260730 Eh   |
          | TOTAL ENTHALPY            -10.228796486966 Eh   |
          | TOTAL FREE ENERGY         -10.229281851384 Eh   |
          | GRADIENT NORM               0.000252430354 Eh/α |
          | HOMO-LUMO GAP               2.778992434442 eV   |
           -------------------------------------------------

------------------------------------------------------------------------
 * finished run on 2020/05/12 at 11:44:38.535     
------------------------------------------------------------------------
 total:
 * wall-time:     0 d,  0 h,  0 min,  0.166 sec
 *  cpu-time:     0 d,  0 h,  0 min,  0.166 sec
 * ratio c/w:     0.999 speedup
 SCF:
 * wall-time:     0 d,  0 h,  0 min,  0.005 sec
 *  cpu-time:     0 d,  0 h,  0 min,  0.005 sec
 * ratio c/w:     1.000 speedup
 ANC optimizer:
 * wall-time:     0 d,  0 h,  0 min,  0.036 sec
 *  cpu-time:     0 d,  0 h,  0 min,  0.036 sec
 * ratio c/w:     0.998 speedup
 numerical hessian:
 * wall-time:     0 d,  0 h,  0 min,  0.106 sec
 *  cpu-time:     0 d,  0 h,  0 min,  0.106 sec
 * ratio c/w:     0.999 speedup

