      -----------------------------------------------------------      
     |                   =====================                   |     
     |                           x T B                           |     
     |                   =====================                   |     
     |                         S. Grimme                         |     
     |          Mulliken Center for Theoretical Chemistry        |     
     |                    University of Bonn                     |     
      -----------------------------------------------------------      

   * xtb version 6.2.2 (9d81278992624c895f80dd42a50cac0aa55982e2) compiled by '@Darwin' on 04/03/2020

   xtb is free software: you can redistribute it and/or modify it under
   the terms of the GNU Lesser General Public License as published by
   the Free Software Foundation, either version 3 of the License, or
   (at your option) any later version.
   
   xtb is distributed in the hope that it will be useful,
   but WITHOUT ANY WARRANTY; without even the implied warranty of
   MERCHANTABILITY or FITNESS FOR A PARTICULAR PURPOSE.  See the
   GNU Lesser General Public License for more details.
   
   Cite this work as:
   * S. Grimme, C. Bannwarth, P. Shushkov, J. Chem. Theory Comput., 2017,
     13, 1989-2009. DOI: 10.1021/acs.jctc.7b00118
   * C. Bannwarth, S. Ehlert and S. Grimme., J. Chem. Theory Comput., 2019,
     15, 1652-1671. DOI: 10.1021/acs.jctc.8b01176
   * P. Pracht, E. Caldeweyher, S. Ehlert, S. Grimme, ChemRxiv, 2019, preprint.
     DOI: 10.26434/chemrxiv.8326202.v1
   
   for DFT-D4:
   * E. Caldeweyher, C. Bannwarth and S. Grimme, J. Chem. Phys., 2017,
     147, 034112. DOI: 10.1063/1.4993215
   * E. Caldeweyher, S. Ehlert, A. Hansen, H. Neugebauer, S. Spicher,
     C. Bannwarth and S. Grimme, J. Chem. Phys., 2019, 150, 154122.
     DOI: 10.1063/1.5090222
   
   for sTDA-xTB:
   * S. Grimme and C. Bannwarth, J. Chem. Phys., 2016, 145, 054103.
     DOI: 10.1063/1.4959605
   
   in the mass-spec context:
   * V. Asgeirsson, C. Bauer and S. Grimme, Chem. Sci., 2017, 8, 4879.
     DOI: 10.1039/c7sc00601b
   
   for metadynamics refer to:
   * S. Grimme, J. Chem. Theory Comput., 2019, 155, 2847-2862
     DOI: 10.1021/acs.jctc.9b00143
   
   with help from (in alphabetical order)
   C. Bannwarth, F. Bohle, G. Brandenburg, E. Caldeweyher, M. Checinski,
   S. Dohm, S. Ehlert, S. Ehrlich, F. März, H. Neugebauer, J. Pisarek,
   P. Pracht, P. Shushkov, and S. Spicher.
   
 * started run on 2020/05/12 at 11:44:47.312     

           -------------------------------------------------
          |                Calculation Setup                |
           -------------------------------------------------

          program call               : xtb --input H2C2N1_8_S_1.input H2C2N1_8_S_1.xyz --ohess --molden --namespace H2C2N1_8_S_1 output.out
          calculation namespace      : H2C2N1_8_S_1
          coordinate file            : H2C2N1_8_S_1.xyz
          number of atoms            :                     5
          number of electrons        :                    15
          charge                     :                     0
          spin                       :                   0.5
          first test random number   :      0.35536670876506

   ID    Z sym.   atoms
    1    7 N      1
    2    6 C      2, 3
    3    1 H      4, 5

           -------------------------------------------------
          |                 G F N 2 - x T B                 |
           -------------------------------------------------

        Reference                      10.1021/acs.jctc.8b01176
      * Hamiltonian:
        H0-scaling (s, p, d)           1.850000    2.230000    2.230000
        zeta-weighting                 0.500000
      * Dispersion:
        s8                             2.700000
        a1                             0.520000
        a2                             5.000000
        s9                             5.000000
      * Repulsion:
        kExp                           1.500000    1.000000
        rExp                           1.000000
      * Coulomb:
        alpha                          2.000000
        third order                    shell-resolved
        anisotropic                    true
        a3                             3.000000
        a5                             4.000000
        cn-shift                       1.200000
        cn-exp                         4.000000
        max-rad                        5.000000


          ...................................................
          :                      SETUP                      :
          :.................................................:
          :  # basis functions                  14          :
          :  # atomic orbitals                  14          :
          :  # shells                            8          :
          :  # electrons                        15          :
          :  max. iterations                   250          :
          :  Hamiltonian                  GFN2-xTB          :
          :  restarted?                      false          :
          :  GBSA solvation                  false          :
          :  PC potential                    false          :
          :  electronic temp.          300.0000000     K    :
          :  accuracy                    1.0000000          :
          :  -> integral cutoff          0.2500000E+02      :
          :  -> integral neglect         0.1000000E-07      :
          :  -> SCF convergence          0.1000000E-05 Eh   :
          :  -> wf. convergence          0.1000000E-03 e    :
          :  Broyden damping             0.4000000          :
          ...................................................

 iter      E             dE          RMSdq      gap      omega  full diag
   1     -7.9620071 -0.796201E+01  0.768E+00    1.02       0.0  T
   2     -7.9685492 -0.654215E-02  0.535E+00    0.27       1.0  T
   3     -7.9656678  0.288137E-02  0.311E+00    0.73       1.0  T
   4     -7.9803613 -0.146934E-01  0.145E+00    0.55       1.0  T
   5     -7.9767782  0.358302E-02  0.157E+00    0.28       1.0  T
   6     -7.9915876 -0.148093E-01  0.492E-01    0.45       1.0  T
   7     -7.9923011 -0.713515E-03  0.266E-01    0.44       1.0  T
   8     -7.9926573 -0.356191E-03  0.316E-02    0.42       1.4  T
   9     -7.9926499  0.736451E-05  0.377E-02    0.42       1.2  T
  10     -7.9926579 -0.794766E-05  0.576E-03    0.42       7.8  T
  11     -7.9926579 -0.629087E-07  0.330E-03    0.42      13.5  T
  12     -7.9926580 -0.361510E-07  0.775E-04    0.42      57.7  T
  13     -7.9926580 -0.786975E-09  0.549E-04    0.42      81.5  T

   *** convergence criteria satisfied after 13 iterations ***

         #    Occupation            Energy/Eh            Energy/eV
      -------------------------------------------------------------
         1        2.0000           -0.6695623             -18.2197
         2        2.0000           -0.6283633             -17.0986
         3        2.0000           -0.5640332             -15.3481
         4        2.0000           -0.5278106             -14.3625
         5        2.0000           -0.5151483             -14.0179
         6        2.0000           -0.4827448             -13.1362
         7        2.0000           -0.4433151             -12.0632
         8        0.9997           -0.3750121             -10.2046 (HOMO)
         9        0.0003           -0.3596043              -9.7853 (LUMO)
        10                         -0.3187849              -8.6746
        11                          0.0342008               0.9307
        12                          0.0810386               2.2052
        13                          0.1185209               3.2251
        14                          0.1621187               4.4115
      -------------------------------------------------------------
                  HL-Gap            0.0154078 Eh            0.4193 eV
             Fermi-level           -0.3882359 Eh          -10.5644 eV

 SCC (total)                   0 d,  0 h,  0 min,  0.003 sec
 SCC setup                      ...        0 min,  0.000 sec (  3.220%)
 Dispersion                     ...        0 min,  0.000 sec (  0.484%)
 integral evaluation            ...        0 min,  0.001 sec ( 24.706%)
 zeroth order Hamiltonian       ...        0 min,  0.000 sec (  0.767%)
 iterations                     ...        0 min,  0.001 sec ( 43.523%)
 molecular gradient             ...        0 min,  0.001 sec ( 24.940%)
 printout                       ...        0 min,  0.000 sec (  1.993%)

         :::::::::::::::::::::::::::::::::::::::::::::::::::::
         ::                     SUMMARY                     ::
         :::::::::::::::::::::::::::::::::::::::::::::::::::::
         :: total energy              -7.941677404684 Eh    ::
         :: gradient norm              0.281873579508 Eh/a0 ::
         :: HOMO-LUMO gap              0.419268684319 eV    ::
         ::.................................................::
         :: SCC energy                -7.992657969306 Eh    ::
         :: -> isotropic ES           -0.016078955551 Eh    ::
         :: -> anisotropic ES          0.001138530570 Eh    ::
         :: -> anisotropic XC          0.011315092925 Eh    ::
         :: -> dispersion             -0.001572061338 Eh    ::
         :: repulsion energy           0.050980546127 Eh    ::
         :: add. restraining           0.000000000000 Eh    ::
         :::::::::::::::::::::::::::::::::::::::::::::::::::::

      ----------------------------------------------------------- 
     |                   =====================                   |
     |                        A N C O P T                        |
     |                   =====================                   |
     |               Approximate Normal Coordinate               |
     |                Rational Function Optimizer                |
      ----------------------------------------------------------- 

          ...................................................
          :                      SETUP                      :
          :.................................................:
          :   optimization level            normal          :
          :   max. optcycles                   200          :
          :   ANC micro-cycles                  20          :
          :   degrees of freedom                 9          :
          :.................................................:
          :   RF solver                   davidson          :
          :   write xtbopt.log                true          :
          :   linear?                        false          :
          :   energy convergence         0.5000000E-05 Eh   :
          :   grad. convergence          0.1000000E-02 Eh/α :
          :   maximium RF displ.         1.0000000          :
          :   Hlow (freq-cutoff)         0.1000000E-01      :
          :   Hmax (freq-cutoff)         5.0000000          :
          :   S6 in model hess.         20.0000000          :
          ...................................................

generating ANC from model Hessian ...
Using Lindh-Hessian (1995)
 Shifting diagonal of input Hessian by    0.0000000000000000     
 Lowest  eigenvalues of input Hessian
   -0.000000   -0.000000   -0.000000    0.000000    0.000000    0.000000
    0.012996    0.053863    0.092126    0.095806    0.131148    0.607654
    0.951975    1.001747    1.208096
 Highest eigenvalues
    0.095806    0.131148    0.607654    0.951975    1.001747    1.208096


........................................................................
.............................. CYCLE    1 ..............................
........................................................................
   1     -7.9926580 -0.799266E+01  0.101E-04    0.42       0.0  T
   2     -7.9926580  0.571366E-09  0.278E-04    0.42     160.9  T
   3     -7.9926580 -0.584000E-09  0.692E-05    0.42     646.5  T
     SCC iter.                  ...        0 min,  0.000 sec
     gradient                   ...        0 min,  0.001 sec
 * total energy  :    -7.9416774 Eh     change        0.1682485E-09 Eh
   gradient norm :     0.2818767 Eh/α   predicted     0.0000000E+00 (-100.00%)
   displ. norm   :     0.3682007 α      lambda       -0.8927877E-01
   maximum displ.:     0.1968208 α      in ANC's #7, #3, #6, ...

........................................................................
.............................. CYCLE    2 ..............................
........................................................................
   1     -8.0754466 -0.807545E+01  0.293E+00    1.37       0.0  T
   2     -8.0084646  0.669820E-01  0.396E+00    2.12       1.0  T
   3     -8.1007537 -0.922891E-01  0.123E+00    1.37       1.0  T
   4     -8.1002060  0.547719E-03  0.599E-01    1.57       1.0  T
   5     -8.1014605 -0.125451E-02  0.192E-01    1.42       1.0  T
   6     -8.1016320 -0.171486E-03  0.494E-02    1.44       1.0  T
   7     -8.1016363 -0.435148E-05  0.788E-03    1.44       5.7  T
   8     -8.1016364 -0.255729E-07  0.419E-03    1.44      10.7  T
   9     -8.1016364 -0.520615E-07  0.458E-04    1.44      97.6  T
  10     -8.1016364 -0.242313E-09  0.740E-05    1.44     604.6  T
     SCC iter.                  ...        0 min,  0.001 sec
     gradient                   ...        0 min,  0.001 sec
 * total energy  :    -8.0157840 Eh     change       -0.7410658E-01 Eh
   gradient norm :     0.1771356 Eh/α   predicted    -0.5069122E-01 ( -31.60%)
   displ. norm   :     0.5699488 α      lambda       -0.8608302E-01
   maximum displ.:     0.2999669 α      in ANC's #7, #1, #6, ...

........................................................................
.............................. CYCLE    3 ..............................
........................................................................
   1     -8.2278697 -0.822787E+01  0.345E+00    4.20       0.0  T
   2     -8.2278609  0.879714E-05  0.256E+00    4.56       1.0  T
   3     -8.2433806 -0.155197E-01  0.140E+00    3.98       1.0  T
   4     -8.2466067 -0.322611E-02  0.476E-01    4.29       1.0  T
   5     -8.2473218 -0.715071E-03  0.102E-01    4.17       1.0  T
   6     -8.2473295 -0.769974E-05  0.245E-02    4.17       1.8  T
   7     -8.2473316 -0.215462E-05  0.452E-03    4.17       9.9  T
   8     -8.2473316  0.188638E-07  0.253E-03    4.17      17.7  T
   9     -8.2473316 -0.279172E-07  0.187E-04    4.17     238.8  T
  10     -8.2473316 -0.703562E-10  0.297E-05    4.17    1506.9  T
     SCC iter.                  ...        0 min,  0.001 sec
     gradient                   ...        0 min,  0.001 sec
 * total energy  :    -8.0361725 Eh     change       -0.2038854E-01 Eh
   gradient norm :     0.3366493 Eh/α   predicted    -0.5702317E-01 ( 179.68%)
   displ. norm   :     0.5508231 α      lambda       -0.8381722E-01
   maximum displ.:     0.3785243 α      in ANC's #2, #5, #1, ...

........................................................................
.............................. CYCLE    4 ..............................
........................................................................
   1     -8.1574603 -0.815746E+01  0.279E+00    2.65       0.0  T
   2     -8.1524882  0.497207E-02  0.203E+00    2.74       1.0  T
   3     -8.1588330 -0.634480E-02  0.158E+00    3.02       1.0  T
   4     -8.1686978 -0.986482E-02  0.579E-01    2.74       1.0  T
   5     -8.1698000 -0.110216E-02  0.113E-01    2.86       1.0  T
   6     -8.1698059 -0.593535E-05  0.475E-02    2.85       1.0  T
   7     -8.1698137 -0.781208E-05  0.113E-02    2.85       3.9  T
   8     -8.1698141 -0.412889E-06  0.228E-03    2.85      19.6  T
   9     -8.1698141 -0.147334E-08  0.757E-04    2.85      59.1  T
  10     -8.1698141 -0.261267E-08  0.651E-05    2.85     686.8  T
     SCC iter.                  ...        0 min,  0.001 sec
     gradient                   ...        0 min,  0.001 sec
 * total energy  :    -8.0539628 Eh     change       -0.1779024E-01 Eh
   gradient norm :     0.1602733 Eh/α   predicted    -0.5462393E-01 ( 207.04%)
   displ. norm   :     0.2927069 α      lambda       -0.2234068E-01
   maximum displ.:     0.1851443 α      in ANC's #5, #3, #1, ...

........................................................................
.............................. CYCLE    5 ..............................
........................................................................
   1     -8.1931429 -0.819314E+01  0.137E+00    3.26       0.0  T
   2     -8.1929439  0.198976E-03  0.875E-01    3.26       1.0  T
   3     -8.1922048  0.739082E-03  0.740E-01    3.11       1.0  T
   4     -8.1942987 -0.209389E-02  0.208E-01    3.25       1.0  T
   5     -8.1945412 -0.242545E-03  0.421E-02    3.19       1.1  T
   6     -8.1945433 -0.202539E-05  0.102E-02    3.19       4.4  T
   7     -8.1945434 -0.156591E-06  0.224E-03    3.19      20.0  T
   8     -8.1945434 -0.196526E-08  0.815E-04    3.19      54.8  T
   9     -8.1945434 -0.931719E-09  0.625E-05    3.19     715.9  T
     SCC iter.                  ...        0 min,  0.001 sec
     gradient                   ...        0 min,  0.001 sec
 * total energy  :    -8.0650328 Eh     change       -0.1106999E-01 Eh
   gradient norm :     0.0511432 Eh/α   predicted    -0.1212738E-01 (   9.55%)
   displ. norm   :     0.2209269 α      lambda       -0.4663448E-02
   maximum displ.:     0.1835388 α      in ANC's #1, #7, #6, ...

........................................................................
.............................. CYCLE    6 ..............................
........................................................................
   1     -8.2107132 -0.821071E+01  0.700E-01    3.48       0.0  T
   2     -8.2105322  0.181020E-03  0.497E-01    3.53       1.0  T
   3     -8.2107426 -0.210402E-03  0.348E-01    3.43       1.0  T
   4     -8.2111560 -0.413451E-03  0.788E-02    3.50       1.0  T
   5     -8.2111858 -0.298037E-04  0.191E-02    3.48       2.3  T
   6     -8.2111859 -0.688500E-07  0.209E-03    3.48      21.4  T
   7     -8.2111859 -0.297023E-08  0.739E-04    3.48      60.5  T
   8     -8.2111859 -0.491017E-09  0.278E-04    3.48     160.6  T
     SCC iter.                  ...        0 min,  0.001 sec
     gradient                   ...        0 min,  0.001 sec
 * total energy  :    -8.0678575 Eh     change       -0.2824703E-02 Eh
   gradient norm :     0.0235684 Eh/α   predicted    -0.2445532E-02 ( -13.42%)
   displ. norm   :     0.2784599 α      lambda       -0.4610938E-02
   maximum displ.:     0.1952488 α      in ANC's #2, #6, #7, ...

........................................................................
.............................. CYCLE    7 ..............................
........................................................................
   1     -8.2181264 -0.821813E+01  0.102E+00    3.57       0.0  T
   2     -8.2181615 -0.351586E-04  0.590E-01    3.55       1.0  T
   3     -8.2172450  0.916558E-03  0.426E-01    3.64       1.0  T
   4     -8.2182661 -0.102113E-02  0.537E-02    3.56       1.0  T
   5     -8.2182715 -0.543746E-05  0.272E-02    3.57       1.6  T
   6     -8.2182725 -0.935386E-06  0.381E-03    3.57      11.7  T
   7     -8.2182725 -0.939802E-08  0.555E-04    3.57      80.5  T
   8     -8.2182725 -0.139226E-08  0.139E-04    3.57     322.4  T
     SCC iter.                  ...        0 min,  0.000 sec
     gradient                   ...        0 min,  0.001 sec
 * total energy  :    -8.0692057 Eh     change       -0.1348241E-02 Eh
   gradient norm :     0.0333974 Eh/α   predicted    -0.2484238E-02 (  84.26%)
   displ. norm   :     0.1610390 α      lambda       -0.1994179E-02
   maximum displ.:     0.1375487 α      in ANC's #1, #3, #5, ...

........................................................................
.............................. CYCLE    8 ..............................
........................................................................
   1     -8.2115165 -0.821152E+01  0.443E-01    3.56       0.0  T
   2     -8.2115297 -0.132382E-04  0.254E-01    3.58       1.0  T
   3     -8.2114968  0.329580E-04  0.810E-02    3.55       1.0  T
   4     -8.2115348 -0.380109E-04  0.262E-02    3.57       1.7  T
   5     -8.2115366 -0.184332E-05  0.110E-02    3.57       4.1  T
   6     -8.2115367 -0.284291E-07  0.157E-03    3.57      28.5  T
   7     -8.2115367 -0.116046E-08  0.295E-04    3.57     151.8  T
   8     -8.2115367 -0.101759E-09  0.133E-04    3.57     337.5  T
     SCC iter.                  ...        0 min,  0.000 sec
     gradient                   ...        0 min,  0.001 sec
 * total energy  :    -8.0699175 Eh     change       -0.7118351E-03 Eh
   gradient norm :     0.0188587 Eh/α   predicted    -0.1022949E-02 (  43.71%)
   displ. norm   :     0.0740334 α      lambda       -0.7431143E-03
   maximum displ.:     0.0408677 α      in ANC's #2, #1, #4, ...

........................................................................
.............................. CYCLE    9 ..............................
........................................................................
   1     -8.2230125 -0.822301E+01  0.320E-01    3.69       0.0  T
   2     -8.2229180  0.944896E-04  0.279E-01    3.73       1.0  T
   3     -8.2232659 -0.347899E-03  0.114E-01    3.68       1.0  T
   4     -8.2232847 -0.188015E-04  0.426E-02    3.70       1.1  T
   5     -8.2232900 -0.529943E-05  0.732E-03    3.69       6.1  T
   6     -8.2232900 -0.308331E-07  0.946E-04    3.69      47.3  T
   7     -8.2232900  0.176836E-09  0.583E-04    3.69      76.8  T
     SCC iter.                  ...        0 min,  0.000 sec
     gradient                   ...        0 min,  0.001 sec
 * total energy  :    -8.0699734 Eh     change       -0.5589104E-04 Eh
   gradient norm :     0.0136537 Eh/α   predicted    -0.3735949E-03 ( 568.43%)
   displ. norm   :     0.0575246 α      lambda       -0.3982898E-03
   maximum displ.:     0.0448345 α      in ANC's #2, #1, #7, ...

........................................................................
.............................. CYCLE   10 ..............................
........................................................................
   1     -8.2186151 -0.821862E+01  0.209E-01    3.63       0.0  T
   2     -8.2185901  0.250144E-04  0.157E-01    3.61       1.0  T
   3     -8.2186500 -0.599075E-04  0.980E-02    3.64       1.0  T
   4     -8.2186746 -0.246140E-04  0.208E-02    3.62       2.1  T
   5     -8.2186765 -0.189192E-05  0.563E-03    3.63       7.9  T
   6     -8.2186765 -0.109523E-07  0.606E-04    3.63      73.8  T
   7     -8.2186765 -0.352342E-09  0.258E-04    3.63     173.6  T
     SCC iter.                  ...        0 min,  0.000 sec
     gradient                   ...        0 min,  0.001 sec
 * total energy  :    -8.0701835 Eh     change       -0.2100584E-03 Eh
   gradient norm :     0.0041931 Eh/α   predicted    -0.1998027E-03 (  -4.88%)
   displ. norm   :     0.0148543 α      lambda       -0.2145748E-04
   maximum displ.:     0.0078979 α      in ANC's #7, #1, #2, ...

........................................................................
.............................. CYCLE   11 ..............................
........................................................................
   1     -8.2187010 -0.821870E+01  0.546E-02    3.64       0.0  T
   2     -8.2187011 -0.123812E-06  0.313E-02    3.64       1.4  T
   3     -8.2187006  0.553991E-06  0.101E-02    3.64       4.4  T
   4     -8.2187012 -0.646599E-06  0.234E-03    3.64      19.1  T
   5     -8.2187012 -0.252421E-08  0.722E-04    3.64      61.9  T
   6     -8.2187012 -0.893650E-09  0.523E-05    3.64     854.7  T
     SCC iter.                  ...        0 min,  0.000 sec
     gradient                   ...        0 min,  0.001 sec
 * total energy  :    -8.0701985 Eh     change       -0.1500746E-04 Eh
   gradient norm :     0.0022433 Eh/α   predicted    -0.1073002E-04 ( -28.50%)
   displ. norm   :     0.0216746 α      lambda       -0.1686418E-04
   maximum displ.:     0.0114495 α      in ANC's #2, #1, #7, ...

........................................................................
.............................. CYCLE   12 ..............................
........................................................................
   1     -8.2189388 -0.821894E+01  0.690E-02    3.64       0.0  T
   2     -8.2189387  0.770942E-07  0.407E-02    3.64       1.1  T
   3     -8.2189328  0.596995E-05  0.342E-02    3.63       1.3  T
   4     -8.2189396 -0.684162E-05  0.294E-03    3.64      15.2  T
   5     -8.2189396 -0.602582E-08  0.142E-03    3.64      31.5  T
   6     -8.2189396 -0.185397E-08  0.534E-05    3.64     837.2  T
   7     -8.2189396 -0.139799E-11  0.190E-05    3.64    2349.0  T
     SCC iter.                  ...        0 min,  0.000 sec
     gradient                   ...        0 min,  0.001 sec
 * total energy  :    -8.0702077 Eh     change       -0.9221350E-05 Eh
   gradient norm :     0.0018925 Eh/α   predicted    -0.8437394E-05 (  -8.50%)
   displ. norm   :     0.0078562 α      lambda       -0.5279498E-05
   maximum displ.:     0.0043109 α      in ANC's #2, #6, #3, ...

........................................................................
.............................. CYCLE   13 ..............................
........................................................................
   1     -8.2195156 -0.821952E+01  0.298E-02    3.66       0.0  T
   2     -8.2195157 -0.125487E-06  0.177E-02    3.66       2.5  T
   3     -8.2195152  0.509471E-06  0.142E-02    3.65       3.1  T
   4     -8.2195160 -0.733820E-06  0.377E-03    3.66      11.9  T
   5     -8.2195160 -0.842436E-07  0.837E-04    3.65      53.4  T
   6     -8.2195160 -0.757971E-09  0.145E-04    3.66     308.8  T
     SCC iter.                  ...        0 min,  0.000 sec
     gradient                   ...        0 min,  0.001 sec
 * total energy  :    -8.0702105 Eh     change       -0.2829651E-05 Eh
   gradient norm :     0.0021233 Eh/α   predicted    -0.2639723E-05 (  -6.71%)
   displ. norm   :     0.0037291 α      lambda       -0.2717122E-05
   maximum displ.:     0.0019931 α      in ANC's #4, #2, #6, ...

........................................................................
.............................. CYCLE   14 ..............................
........................................................................
   1     -8.2193127 -0.821931E+01  0.127E-02    3.65       0.0  T
   2     -8.2193127 -0.168414E-07  0.753E-03    3.65       5.9  T
   3     -8.2193125  0.120353E-06  0.586E-03    3.65       7.6  T
   4     -8.2193127 -0.144976E-06  0.136E-03    3.65      33.0  T
   5     -8.2193127 -0.113194E-07  0.322E-04    3.65     138.9  T
   6     -8.2193127 -0.990461E-10  0.490E-05    3.65     912.8  T
     SCC iter.                  ...        0 min,  0.000 sec
     gradient                   ...        0 min,  0.001 sec
 * total energy  :    -8.0702125 Eh     change       -0.1955115E-05 Eh
   gradient norm :     0.0008789 Eh/α   predicted    -0.1358497E-05 ( -30.52%)
   displ. norm   :     0.0055289 α      lambda       -0.1183928E-05
   maximum displ.:     0.0033109 α      in ANC's #6, #1, #2, ...

   *** GEOMETRY OPTIMIZATION CONVERGED AFTER 14 ITERATIONS ***

------------------------------------------------------------------------
 total energy gain   :        -0.1285351 Eh      -80.6570 kcal/mol
 total RMSD          :         0.7092327 a0        0.3753 Å
 total power (kW/mol):       -24.1049169 (step)********** (real)
------------------------------------------------------------------------

 ANCopt (total)                0 d,  0 h,  0 min,  0.028 sec
 optimizer setup                ...        0 min,  0.000 sec (  0.242%)
 model hessian                  ...        0 min,  0.000 sec (  0.355%)
 ANC generation                 ...        0 min,  0.000 sec (  0.189%)
 coordinate transformation      ...        0 min,  0.000 sec (  0.105%)
 single point calculation       ...        0 min,  0.027 sec ( 95.035%)
 optimization log               ...        0 min,  0.000 sec (  1.293%)
 hessian update                 ...        0 min,  0.000 sec (  0.111%)
 rational function              ...        0 min,  0.000 sec (  1.165%)

================
 final structure:
================
5
 xtb: 6.2.2 (9d81278992624c895f80dd42a50cac0aa55982e2)
N         0.75340583290973   -0.01622002347844    0.02045660583818
C        -0.54322543933795    0.01287094221636   -0.01353670938275
C         1.93789554780948   -0.04462846164908    0.05292331423097
H        -1.10090697846547   -0.87277372824037    0.23498329948635
H        -1.04716996291579    0.92075227115153   -0.29482651017276

 Bond Distances (Angstroems)
 ---------------------------
N1-C2=1.2974         N1-C3=1.1853         C2-N1=1.2974         C2-H4=1.0757         C2-H5=1.0758         C3-N1=1.1853         
H4-C2=1.0757         H5-C2=1.0758         
 C  H  Rav=1.0757 sigma=0.0000  Rmin=1.0757  Rmax=1.0758     2
 N  C  Rav=1.2413 sigma=0.0561  Rmin=1.1853  Rmax=1.2974     2

 selected bond angles (degree)
 --------------------
C3-N1-C2=179.89                H4-C2-N1=119.58                H5-C2-N1=119.60                H5-C2-H4=120.82                

 selected dihedral angles (degree)
 ---------------------------------
H4-C2-N1-C3=338.69            H5-C2-N1-C3=159.01            
           -------------------------------------------------
          |                Final Singlepoint                |
           -------------------------------------------------

          ...................................................
          :                      SETUP                      :
          :.................................................:
          :  # basis functions                  14          :
          :  # atomic orbitals                  14          :
          :  # shells                            8          :
          :  # electrons                        15          :
          :  max. iterations                   250          :
          :  Hamiltonian                  GFN2-xTB          :
          :  restarted?                      false          :
          :  GBSA solvation                  false          :
          :  PC potential                    false          :
          :  electronic temp.          300.0000000     K    :
          :  accuracy                    1.0000000          :
          :  -> integral cutoff          0.2500000E+02      :
          :  -> integral neglect         0.1000000E-07      :
          :  -> SCF convergence          0.1000000E-05 Eh   :
          :  -> wf. convergence          0.1000000E-03 e    :
          :  Broyden damping             0.4000000          :
          ...................................................

 iter      E             dE          RMSdq      gap      omega  full diag
   1     -8.2193127 -0.821931E+01  0.842E-06    3.65       0.0  T
   2     -8.2193127 -0.177636E-14  0.555E-06    3.65    8052.2  T
   3     -8.2193127  0.959233E-13  0.518E-06    3.65    8637.4  T

   *** convergence criteria satisfied after 3 iterations ***

         #    Occupation            Energy/Eh            Energy/eV
      -------------------------------------------------------------
         1        2.0000           -0.6750555             -18.3692
         2        2.0000           -0.6420379             -17.4707
         3        2.0000           -0.5606681             -15.2566
         4        2.0000           -0.5513758             -15.0037
         5        2.0000           -0.5258410             -14.3089
         6        2.0000           -0.4591117             -12.4931
         7        2.0000           -0.4316823             -11.7467
         8        1.0000           -0.3576834              -9.7331 (HOMO)
         9                         -0.2235489              -6.0831 (LUMO)
        10                         -0.1828601              -4.9759
        11                          0.0889958               2.4217
        12                          0.2324032               6.3240
        13                          0.2973919               8.0924
        14                          1.0013261              27.2475
      -------------------------------------------------------------
                  HL-Gap            0.1341345 Eh            3.6500 eV
             Fermi-level           -0.3426495 Eh           -9.3240 eV

 SCC (total)                   0 d,  0 h,  0 min,  0.002 sec
 SCC setup                      ...        0 min,  0.000 sec (  2.764%)
 Dispersion                     ...        0 min,  0.000 sec (  0.558%)
 integral evaluation            ...        0 min,  0.001 sec ( 40.126%)
 zeroth order Hamiltonian       ...        0 min,  0.000 sec (  0.601%)
 iterations                     ...        0 min,  0.000 sec ( 12.974%)
 molecular gradient             ...        0 min,  0.001 sec ( 39.940%)
 printout                       ...        0 min,  0.000 sec (  2.578%)

         :::::::::::::::::::::::::::::::::::::::::::::::::::::
         ::                     SUMMARY                     ::
         :::::::::::::::::::::::::::::::::::::::::::::::::::::
         :: total energy              -8.070212495187 Eh    ::
         :: gradient norm              0.000902281878 Eh/a0 ::
         :: HOMO-LUMO gap              3.649984600765 eV    ::
         ::.................................................::
         :: SCC energy                -8.219312704987 Eh    ::
         :: -> isotropic ES           -0.009090603419 Eh    ::
         :: -> anisotropic ES         -0.001126207298 Eh    ::
         :: -> anisotropic XC          0.015835428803 Eh    ::
         :: -> dispersion             -0.001567911418 Eh    ::
         :: repulsion energy           0.149100191533 Eh    ::
         :: add. restraining           0.000000000000 Eh    ::
         :::::::::::::::::::::::::::::::::::::::::::::::::::::

           ------------------------------------------------- 
          |                Numerical Hessian                |
           ------------------------------------------------- 
step length          :   0.00500
SCC accuracy         :   0.30000
Hessian scale factor :   1.00000
frozen atoms in %    :   0.00000    0
RMS gradient         :   0.00090
estimated CPU  time      0.00 min
estimated wall time      0.00 min

writing file <hessian>.

 projected vibrational frequencies (cm-1)
eigval :       -0.00    -0.00     0.00     0.00     0.00     0.00
eigval :      310.39   324.07   635.69  1025.35  1211.31  1376.19
eigval :     2041.82  3097.31  3129.12
           -------------------------------------------------
          |                Property Printout                |
           -------------------------------------------------

    * Orbital Energies and Occupations

         #    Occupation            Energy/Eh            Energy/eV
      -------------------------------------------------------------
         1        2.0000           -0.6750554             -18.3692
         2        2.0000           -0.6420379             -17.4707
         3        2.0000           -0.5606681             -15.2566
         4        2.0000           -0.5513758             -15.0037
         5        2.0000           -0.5258410             -14.3089
         6        2.0000           -0.4591117             -12.4931
         7        2.0000           -0.4316823             -11.7467
         8        1.0000           -0.3576834              -9.7331 (HOMO)
         9                         -0.2235490              -6.0831 (LUMO)
        10                         -0.1828601              -4.9759
        11                          0.0889959               2.4217
        12                          0.2324032               6.3240
        13                          0.2973919               8.0924
        14                          1.0013261              27.2475
      -------------------------------------------------------------
                  HL-Gap            0.1341344 Eh            3.6500 eV
             Fermi-level           -0.3426495 Eh           -9.3240 eV

     #   Z        covCN         q      C6AA      α(0)
     1   7 N      1.821     0.052    20.999     6.790
     2   6 C      2.768    -0.031    28.761     8.783
     3   6 C      0.916    -0.157    40.559    10.661
     4   1 H      0.926     0.068     2.105     2.269
     5   1 H      0.926     0.068     2.105     2.269

 Mol. C6AA /au·bohr⁶  :        368.380355
 Mol. C8AA /au·bohr⁸  :       8948.643994
 Mol. α(0) /au        :         30.771172


Wiberg/Mayer (AO) data.
largest (>0.10) Wiberg bond orders for each atom
          total WBO             WBO to atom ...
     1  N   3.694        C    3 2.305    C    2 1.387
     2  C   3.351        N    1 1.387    H    5 0.956    H    4 0.956
     3  C   2.435        N    1 2.305
     4  H   0.995        C    2 0.956
     5  H   0.995        C    2 0.956

Molecule has the following symmetry elements: (C2) 2*(sigma) 
It seems to be the C2v point group
MOs/occ written to file <molden.input>


molecular dipole:
                 x           y           z       tot (Debye)
 q only:       -0.745       0.017      -0.021
   full:       -1.237       0.028      -0.034       3.145
molecular quadrupole (traceless):
                xx          xy          yy          xz          yz          zz
 q only:       -1.680       0.069       1.109      -0.065      -0.172       0.572
  q+dip:       -3.572       0.160       2.689      -0.130      -0.582       0.882
   full:       -5.176       0.201       3.103      -0.201      -0.328       2.074

           -------------------------------------------------
          |                Geometry Summary                 |
           -------------------------------------------------

      molecular mass/u    :       40.0440565
   center of mass at/Å    :        0.6277738      -0.0139944       0.0174604
  moments of inertia/u·Å² :        0.1764079E+01   0.4319865E+02   0.4496271E+02
rotational constants/cm⁻¹ :        0.9556051E+01   0.3902352E+00   0.3749247E+00

 * 4 selected distances

     #   Z        #   Z                                     value/Å
     1   7 N      2   6 C                                 1.2974030 (max)
     1   7 N      3   6 C                                 1.1852751
     2   6 C      4   1 H                                 1.0757032 (min)
     2   6 C      5   1 H                                 1.0757939

 * 2 distinct bonds (by element types)

   Z      Z             #   av. dist./Å        max./Å        min./Å
   1 H    6 C           2     1.0757486     1.0757939     1.0757032
   6 C    7 N           2     1.2413390     1.2974030     1.1852751

           -------------------------------------------------
          |               Frequency Printout                |
           -------------------------------------------------
 projected vibrational frequencies (cm-1)
eigval :       -0.00    -0.00     0.00     0.00     0.00     0.00
eigval :      310.39   324.07   635.69  1025.35  1211.31  1376.19
eigval :     2041.82  3097.31  3129.12
 reduced masses (amu)
   1: 12.06   2: 10.83   3: 12.11   4: 10.90   5:  9.80   6:  2.45   7: 11.33   8: 12.52
   9:  3.83  10:  4.24  11:  8.68  12:  4.71  13: 13.11  14:  1.39  15:  2.15
 IR intensities (amu)
   1:  0.07   2:  0.10   3:  0.18   4:  0.10   5:  0.34   6:  0.06   7:  0.06   8:  0.23
   9:  0.25  10:  0.20  11:  0.12  12:  0.14  13:  0.40  14:  0.01  15:  0.17
 Raman intensities (amu)
   1:  0.00   2:  0.00   3:  0.00   4:  0.00   5:  0.00   6:  0.00   7:  0.00   8:  0.00
   9:  0.00  10:  0.00  11:  0.00  12:  0.00  13:  0.00  14:  0.00  15:  0.00
 output can be read by thermo (or use thermo option).
 writing <g98.out> molden fake output.
 recommended (thermochemical) frequency scaling factor: 1.0
           -------------------------------------------------
          |             Thermodynamic Functions             |
           -------------------------------------------------

c2v symmetry found (for desy threshold:  0.10E+00) used in thermo

          ...................................................
          :                      SETUP                      :
          :.................................................:
          :  # frequencies                           9      :
          :  # imaginary freq.                       0      :
          :  linear?                             false      :
          :  only rotor calc.                    false      :
          :  symmetry                              c2v      :
          :  rotational number                       2      :
          :  scaling factor                  1.0000000      :
          :  rotor cutoff                   50.0000000 cm⁻¹ :
          :  imag. cutoff                  -20.0000000 cm⁻¹ :
          :.................................................:

    mode    ω/cm⁻¹     T·S(HO)/kcal·mol⁻¹    T·S(FR)/kcal·mol⁻¹   T·S(vib)
   ------------------------------------------------------------------------
   ------------------------------------------------------------------------

   temp. (K)  partition function   enthalpy   heat capacity  entropy
                                   cal/mol     cal/K/mol   cal/K/mol   J/K/mol
 298.15  VIB   1.73                  626.072      4.911      3.187
         ROT  0.224E+04              888.752      2.981     18.307
         INT  0.386E+04             1514.824      7.892     21.495
         TR   0.245E+27             1481.254      4.968     36.973
         TOT                        2996.0784    12.8605    58.4679   244.6299

   temp. (K)  partition function   enthalpy   heat capacity  entropy
                                   cal/mol     cal/K/mol   cal/K/mol   J/K/mol
 120.00  VIB   1.05                   42.339      1.400      0.444
         ROT   571.                  357.707      2.981     15.594
         INT   598.                  400.046      4.381     16.039
         TR   0.626E+26              596.178      4.968     32.454
         TOT                         996.2242     9.3489    48.4928   202.8937

   temp. (K)  partition function   enthalpy   heat capacity  entropy
                                   cal/mol     cal/K/mol   cal/K/mol   J/K/mol
 100.00  VIB   1.02                   19.346      0.900      0.236
         ROT   434.                  298.089      2.981     15.051
         INT   444.                  317.435      3.881     15.287
         TR   0.476E+26              496.815      4.968     31.549
         TOT                         814.2503     8.8489    46.8356   195.9602

   temp. (K)  partition function   enthalpy   heat capacity  entropy
                                   cal/mol     cal/K/mol   cal/K/mol   J/K/mol
  80.00  VIB   1.01                    6.107      0.438      0.090
         ROT   311.                  238.471      2.981     14.386
         INT   313.                  244.579      3.418     14.476
         TR   0.341E+26              397.452      4.968     30.440
         TOT                         642.0307     8.3865    44.9164   187.9302

   temp. (K)  partition function   enthalpy   heat capacity  entropy
                                   cal/mol     cal/K/mol   cal/K/mol   J/K/mol
  60.00  VIB   1.00                    0.911      0.115      0.017
         ROT   202.                  178.853      2.981     13.528
         INT   202.                  179.765      3.096     13.546
         TR   0.221E+26              298.089      4.968     29.012
         TOT                         477.8536     8.0643    42.5574   178.0603

   temp. (K)  partition function   enthalpy   heat capacity  entropy
                                   cal/mol     cal/K/mol   cal/K/mol   J/K/mol
  40.00  VIB   1.00                    0.021      0.006      0.000
         ROT   110.                  119.236      2.981     12.320
         INT   110.                  119.256      2.987     12.320
         TR   0.120E+26              198.726      4.968     26.999
         TOT                         317.9822     7.9549    39.3182   164.5075

   temp. (K)  partition function   enthalpy   heat capacity  entropy
                                   cal/mol     cal/K/mol   cal/K/mol   J/K/mol
  20.00  VIB   1.00                    0.000      0.000     -0.001
         ROT   38.8                   59.618      2.981     10.253
         INT   38.8                   59.618      2.981     10.252
         TR   0.426E+25               99.363      4.968     23.557
         TOT                         158.9808     7.9490    33.8086   141.4552

   temp. (K)  partition function   enthalpy   heat capacity  entropy
                                   cal/mol     cal/K/mol   cal/K/mol   J/K/mol
  10.00  VIB   1.00                    0.000      0.000     -0.002
         ROT   13.7                   29.809      2.981      8.187
         INT   13.7                   29.809      2.981      8.185
         TR   0.151E+25               49.681      4.968     20.115
         TOT                          79.4904     7.9490    28.2995   118.4053

       T/K    H(0)-H(T)+PV         H(T)/Eh          T*S/Eh         G(T)/Eh
   ------------------------------------------------------------------------
    298.15    0.477455E-02    0.347353E-01    0.277800E-01    0.695532E-02
    120.00    0.158758E-02    0.315484E-01    0.927338E-02    0.222750E-01
    100.00    0.129759E-02    0.312584E-01    0.746373E-02    0.237946E-01
     80.00    0.102314E-02    0.309839E-01    0.572631E-02    0.252576E-01
     60.00    0.761508E-03    0.307223E-01    0.406918E-02    0.266531E-01
     40.00    0.506737E-03    0.304675E-01    0.250630E-02    0.279612E-01
     20.00    0.253352E-03    0.302141E-01    0.107755E-02    0.291366E-01
     10.00    0.126676E-03    0.300875E-01    0.450982E-03    0.296365E-01 (used)
   ------------------------------------------------------------------------

         :::::::::::::::::::::::::::::::::::::::::::::::::::::
         ::                  THERMODYNAMIC                  ::
         :::::::::::::::::::::::::::::::::::::::::::::::::::::
         :: total free energy          -8.040576025711 Eh   ::
         ::.................................................::
         :: total energy               -8.070212495143 Eh   ::
         :: zero point energy           0.029960775378 Eh   ::
         :: G(RRHO) w/o ZPVE           -0.000324305945 Eh   ::
         :: G(RRHO) contrib.            0.029636469432 Eh   ::
         :::::::::::::::::::::::::::::::::::::::::::::::::::::

optimized geometry written to: xtbopt.xyz


           -------------------------------------------------
          | TOTAL ENERGY               -8.070212495143 Eh   |
          | TOTAL ENTHALPY             -8.040125043750 Eh   |
          | TOTAL FREE ENERGY          -8.040576025711 Eh   |
          | GRADIENT NORM               0.000902297791 Eh/α |
          | HOMO-LUMO GAP               3.649984085281 eV   |
           -------------------------------------------------

------------------------------------------------------------------------
 * finished run on 2020/05/12 at 11:44:47.416     
------------------------------------------------------------------------
 total:
 * wall-time:     0 d,  0 h,  0 min,  0.103 sec
 *  cpu-time:     0 d,  0 h,  0 min,  0.103 sec
 * ratio c/w:     0.998 speedup
 SCF:
 * wall-time:     0 d,  0 h,  0 min,  0.003 sec
 *  cpu-time:     0 d,  0 h,  0 min,  0.003 sec
 * ratio c/w:     1.000 speedup
 ANC optimizer:
 * wall-time:     0 d,  0 h,  0 min,  0.031 sec
 *  cpu-time:     0 d,  0 h,  0 min,  0.031 sec
 * ratio c/w:     0.999 speedup
 numerical hessian:
 * wall-time:     0 d,  0 h,  0 min,  0.054 sec
 *  cpu-time:     0 d,  0 h,  0 min,  0.054 sec
 * ratio c/w:     0.998 speedup

