      -----------------------------------------------------------      
     |                   =====================                   |     
     |                           x T B                           |     
     |                   =====================                   |     
     |                         S. Grimme                         |     
     |          Mulliken Center for Theoretical Chemistry        |     
     |                    University of Bonn                     |     
      -----------------------------------------------------------      

   * xtb version 6.2.2 (9d81278992624c895f80dd42a50cac0aa55982e2) compiled by '@Darwin' on 04/03/2020

   xtb is free software: you can redistribute it and/or modify it under
   the terms of the GNU Lesser General Public License as published by
   the Free Software Foundation, either version 3 of the License, or
   (at your option) any later version.
   
   xtb is distributed in the hope that it will be useful,
   but WITHOUT ANY WARRANTY; without even the implied warranty of
   MERCHANTABILITY or FITNESS FOR A PARTICULAR PURPOSE.  See the
   GNU Lesser General Public License for more details.
   
   Cite this work as:
   * S. Grimme, C. Bannwarth, P. Shushkov, J. Chem. Theory Comput., 2017,
     13, 1989-2009. DOI: 10.1021/acs.jctc.7b00118
   * C. Bannwarth, S. Ehlert and S. Grimme., J. Chem. Theory Comput., 2019,
     15, 1652-1671. DOI: 10.1021/acs.jctc.8b01176
   * P. Pracht, E. Caldeweyher, S. Ehlert, S. Grimme, ChemRxiv, 2019, preprint.
     DOI: 10.26434/chemrxiv.8326202.v1
   
   for DFT-D4:
   * E. Caldeweyher, C. Bannwarth and S. Grimme, J. Chem. Phys., 2017,
     147, 034112. DOI: 10.1063/1.4993215
   * E. Caldeweyher, S. Ehlert, A. Hansen, H. Neugebauer, S. Spicher,
     C. Bannwarth and S. Grimme, J. Chem. Phys., 2019, 150, 154122.
     DOI: 10.1063/1.5090222
   
   for sTDA-xTB:
   * S. Grimme and C. Bannwarth, J. Chem. Phys., 2016, 145, 054103.
     DOI: 10.1063/1.4959605
   
   in the mass-spec context:
   * V. Asgeirsson, C. Bauer and S. Grimme, Chem. Sci., 2017, 8, 4879.
     DOI: 10.1039/c7sc00601b
   
   for metadynamics refer to:
   * S. Grimme, J. Chem. Theory Comput., 2019, 155, 2847-2862
     DOI: 10.1021/acs.jctc.9b00143
   
   with help from (in alphabetical order)
   C. Bannwarth, F. Bohle, G. Brandenburg, E. Caldeweyher, M. Checinski,
   S. Dohm, S. Ehlert, S. Ehrlich, F. März, H. Neugebauer, J. Pisarek,
   P. Pracht, P. Shushkov, and S. Spicher.
   
 * started run on 2020/05/12 at 11:45:13.412     

           -------------------------------------------------
          |                Calculation Setup                |
           -------------------------------------------------

          program call               : xtb --input H2C2O1_1_S_2.input H2C2O1_1_S_2.xyz --ohess --molden --namespace H2C2O1_1_S_2 output.out
          calculation namespace      : H2C2O1_1_S_2
          coordinate file            : H2C2O1_1_S_2.xyz
          number of atoms            :                     5
          number of electrons        :                    16
          charge                     :                     0
          spin                       :                   1.0
          first test random number   :      0.93383541520438

   ID    Z sym.   atoms
    1    6 C      1, 2
    2    8 O      3
    3    1 H      4, 5

           -------------------------------------------------
          |                 G F N 2 - x T B                 |
           -------------------------------------------------

        Reference                      10.1021/acs.jctc.8b01176
      * Hamiltonian:
        H0-scaling (s, p, d)           1.850000    2.230000    2.230000
        zeta-weighting                 0.500000
      * Dispersion:
        s8                             2.700000
        a1                             0.520000
        a2                             5.000000
        s9                             5.000000
      * Repulsion:
        kExp                           1.500000    1.000000
        rExp                           1.000000
      * Coulomb:
        alpha                          2.000000
        third order                    shell-resolved
        anisotropic                    true
        a3                             3.000000
        a5                             4.000000
        cn-shift                       1.200000
        cn-exp                         4.000000
        max-rad                        5.000000


          ...................................................
          :                      SETUP                      :
          :.................................................:
          :  # basis functions                  14          :
          :  # atomic orbitals                  14          :
          :  # shells                            8          :
          :  # electrons                        16          :
          :  max. iterations                   250          :
          :  Hamiltonian                  GFN2-xTB          :
          :  restarted?                      false          :
          :  GBSA solvation                  false          :
          :  PC potential                    false          :
          :  electronic temp.          300.0000000     K    :
          :  accuracy                    1.0000000          :
          :  -> integral cutoff          0.2500000E+02      :
          :  -> integral neglect         0.1000000E-07      :
          :  -> SCF convergence          0.1000000E-05 Eh   :
          :  -> wf. convergence          0.1000000E-03 e    :
          :  Broyden damping             0.4000000          :
          ...................................................

 iter      E             dE          RMSdq      gap      omega  full diag
   1     -9.0800983 -0.908010E+01  0.679E+00    0.65       0.0  T
   2     -9.0515112  0.285871E-01  0.407E+00    0.52       1.0  T
   3     -9.0050027  0.465086E-01  0.546E+00    0.31       1.0  T
   4     -9.0818769 -0.768742E-01  0.338E+00    0.96       1.0  T
   5     -9.1198166 -0.379398E-01  0.597E-01    0.47       1.0  T
   6     -9.1195101  0.306468E-03  0.572E-01    0.52       1.0  T
   7     -9.1200086 -0.498437E-03  0.151E-01    0.46       1.0  T
   8     -9.1200658 -0.571727E-04  0.415E-02    0.46       1.1  T
   9     -9.1200699 -0.411863E-05  0.235E-02    0.46       1.9  T
  10     -9.1200714 -0.156059E-05  0.967E-03    0.46       4.6  T
  11     -9.1200718 -0.337609E-06  0.375E-03    0.46      11.9  T
  12     -9.1200718 -0.808985E-07  0.104E-03    0.46      42.9  T
  13     -9.1200719 -0.271060E-08  0.720E-04    0.46      62.1  T
  14     -9.1200719 -0.307640E-08  0.834E-05    0.46     536.5  T

   *** convergence criteria satisfied after 14 iterations ***

         #    Occupation            Energy/Eh            Energy/eV
      -------------------------------------------------------------
         1        2.0000           -0.7068391             -19.2341
       ...           ...                  ...                  ...
         3        2.0000           -0.5949607             -16.1897
         4        2.0000           -0.5592095             -15.2169
         5        2.0000           -0.5327876             -14.4979
         6        2.0000           -0.5107162             -13.8973
         7        2.0000           -0.4495682             -12.2334
         8        1.0000           -0.4047062             -11.0126
         9        0.9999           -0.3675085             -10.0004 (HOMO)
        10        0.0001           -0.3504925              -9.5374 (LUMO)
        11                          0.0870688               2.3693
        12                          0.0941777               2.5627
        13                          0.1143453               3.1115
        14                          0.1562027               4.2505
      -------------------------------------------------------------
                  HL-Gap            0.0170160 Eh            0.4630 eV
             Fermi-level           -0.3930689 Eh          -10.6959 eV

 transition dipole moment (au) for excitation:           8           9
     X       Y       Z   
   0.2216   0.0599   0.0096  total (au/Debye):    0.230   0.584
 dE (eV)             :    1.012
 oscillator strength :  0.18512E-02

 SCC (total)                   0 d,  0 h,  0 min,  0.004 sec
 SCC setup                      ...        0 min,  0.000 sec (  2.760%)
 Dispersion                     ...        0 min,  0.000 sec (  0.392%)
 integral evaluation            ...        0 min,  0.001 sec ( 21.588%)
 zeroth order Hamiltonian       ...        0 min,  0.000 sec (  0.525%)
 iterations                     ...        0 min,  0.001 sec ( 35.009%)
 molecular gradient             ...        0 min,  0.001 sec ( 21.289%)
 printout                       ...        0 min,  0.001 sec ( 18.083%)

         :::::::::::::::::::::::::::::::::::::::::::::::::::::
         ::                     SUMMARY                     ::
         :::::::::::::::::::::::::::::::::::::::::::::::::::::
         :: total energy              -9.068618740752 Eh    ::
         :: gradient norm              0.218423828766 Eh/a0 ::
         :: HOMO-LUMO gap              0.463028068658 eV    ::
         ::.................................................::
         :: SCC energy                -9.120071855500 Eh    ::
         :: -> isotropic ES            0.022579089873 Eh    ::
         :: -> anisotropic ES         -0.000377986514 Eh    ::
         :: -> anisotropic XC          0.005609876734 Eh    ::
         :: -> dispersion             -0.001366104935 Eh    ::
         :: repulsion energy           0.051453071402 Eh    ::
         :: add. restraining           0.000000000000 Eh    ::
         :::::::::::::::::::::::::::::::::::::::::::::::::::::

      ----------------------------------------------------------- 
     |                   =====================                   |
     |                        A N C O P T                        |
     |                   =====================                   |
     |               Approximate Normal Coordinate               |
     |                Rational Function Optimizer                |
      ----------------------------------------------------------- 

          ...................................................
          :                      SETUP                      :
          :.................................................:
          :   optimization level            normal          :
          :   max. optcycles                   200          :
          :   ANC micro-cycles                  20          :
          :   degrees of freedom                 9          :
          :.................................................:
          :   RF solver                   davidson          :
          :   write xtbopt.log                true          :
          :   linear?                        false          :
          :   energy convergence         0.5000000E-05 Eh   :
          :   grad. convergence          0.1000000E-02 Eh/α :
          :   maximium RF displ.         1.0000000          :
          :   Hlow (freq-cutoff)         0.1000000E-01      :
          :   Hmax (freq-cutoff)         5.0000000          :
          :   S6 in model hess.         20.0000000          :
          ...................................................

generating ANC from model Hessian ...
Using Lindh-Hessian (1995)
 Shifting diagonal of input Hessian by    0.0000000000000000     
 Lowest  eigenvalues of input Hessian
   -0.000000   -0.000000   -0.000000   -0.000000    0.000000    0.000000
    0.012355    0.032453    0.094645    0.126544    0.141999    0.571877
    0.812120    1.045529    1.298712
 Highest eigenvalues
    0.126544    0.141999    0.571877    0.812120    1.045529    1.298712


........................................................................
.............................. CYCLE    1 ..............................
........................................................................
   1     -9.1200719 -0.912007E+01  0.396E-06    0.46       0.0  T
   2     -9.1200719  0.177636E-13  0.302E-06    0.46   14785.2  T
   3     -9.1200719  0.550671E-13  0.364E-06    0.46   12298.0  T
     SCC iter.                  ...        0 min,  0.001 sec
     gradient                   ...        0 min,  0.001 sec
 * total energy  :    -9.0686187 Eh     change        0.2951772E-10 Eh
   gradient norm :     0.2184252 Eh/α   predicted     0.0000000E+00 (-100.00%)
   displ. norm   :     0.4742194 α      lambda       -0.6668961E-01
   maximum displ.:     0.2672284 α      in ANC's #2, #1, #6, ...

........................................................................
.............................. CYCLE    2 ..............................
........................................................................
   1     -9.1844861 -0.918449E+01  0.152E+00    1.90       0.0  T
   2     -9.1725698  0.119163E-01  0.188E+00    1.21       1.0  T
   3     -9.1919178 -0.193480E-01  0.645E-01    1.65       1.0  T
   4     -9.1920691 -0.151307E-03  0.114E-01    1.64       1.0  T
   5     -9.1920798 -0.106356E-04  0.547E-02    1.62       1.0  T
   6     -9.1920890 -0.924272E-05  0.332E-02    1.63       1.3  T
   7     -9.1920907 -0.166751E-05  0.104E-02    1.63       4.3  T
   8     -9.1920907 -0.624148E-07  0.140E-03    1.63      31.9  T
   9     -9.1920907 -0.181010E-08  0.284E-04    1.63     157.3  T
  10     -9.1920907 -0.839524E-10  0.140E-04    1.63     319.8  T
     SCC iter.                  ...        0 min,  0.001 sec
     gradient                   ...        0 min,  0.001 sec
 * total energy  :    -9.1213727 Eh     change       -0.5275397E-01 Eh
   gradient norm :     0.1263019 Eh/α   predicted    -0.4084353E-01 ( -22.58%)
   displ. norm   :     0.4181880 α      lambda       -0.4361147E-01
   maximum displ.:     0.2789087 α      in ANC's #6, #2, #9, ...

........................................................................
.............................. CYCLE    3 ..............................
........................................................................
   1     -9.2460662 -0.924607E+01  0.173E+00    3.45       0.0  T
   2     -9.2448938  0.117239E-02  0.165E+00    2.53       1.0  T
   3     -9.2574178 -0.125240E-01  0.562E-01    3.01       1.0  T
   4     -9.2573982  0.196242E-04  0.145E-01    3.04       1.0  T
   5     -9.2574538 -0.556009E-04  0.573E-02    3.00       1.0  T
   6     -9.2574618 -0.803905E-05  0.182E-02    3.01       2.5  T
   7     -9.2574620 -0.160394E-06  0.121E-02    3.01       3.7  T
   8     -9.2574621 -0.151538E-06  0.884E-04    3.01      50.6  T
   9     -9.2574621 -0.571823E-09  0.291E-04    3.01     153.9  T
     SCC iter.                  ...        0 min,  0.001 sec
     gradient                   ...        0 min,  0.001 sec
 * total energy  :    -9.1334134 Eh     change       -0.1204072E-01 Eh
   gradient norm :     0.1654044 Eh/α   predicted    -0.2561915E-01 ( 112.77%)
   displ. norm   :     0.3955622 α      lambda       -0.2803415E-01
   maximum displ.:     0.3514261 α      in ANC's #2, #4, #5, ...

........................................................................
.............................. CYCLE    4 ..............................
........................................................................
   1     -9.2161148 -0.921611E+01  0.160E+00    2.41       0.0  T
   2     -9.1955851  0.205298E-01  0.230E+00    3.17       1.0  T
   3     -9.2238960 -0.283109E-01  0.687E-01    2.68       1.0  T
   4     -9.2248554 -0.959418E-03  0.287E-01    2.70       1.0  T
   5     -9.2250041 -0.148634E-03  0.667E-02    2.75       1.0  T
   6     -9.2250124 -0.838734E-05  0.215E-02    2.74       2.1  T
   7     -9.2250126 -0.142685E-06  0.500E-03    2.74       9.0  T
   8     -9.2250126 -0.229096E-07  0.142E-03    2.74      31.4  T
   9     -9.2250126 -0.443324E-08  0.503E-04    2.74      89.0  T
  10     -9.2250126 -0.205501E-09  0.207E-04    2.74     216.0  T
     SCC iter.                  ...        0 min,  0.001 sec
     gradient                   ...        0 min,  0.001 sec
 * total energy  :    -9.1416856 Eh     change       -0.8272142E-02 Eh
   gradient norm :     0.0724789 Eh/α   predicted    -0.1621031E-01 (  95.96%)
   displ. norm   :     0.1704952 α      lambda       -0.7751978E-02
   maximum displ.:     0.0903001 α      in ANC's #3, #2, #5, ...

........................................................................
.............................. CYCLE    5 ..............................
........................................................................
   1     -9.2389020 -0.923890E+01  0.480E-01    2.90       0.0  T
   2     -9.2388902  0.117847E-04  0.305E-01    2.85       1.0  T
   3     -9.2384697  0.420476E-03  0.321E-01    2.95       1.0  T
   4     -9.2389587 -0.488920E-03  0.448E-02    2.89       1.0  T
   5     -9.2389640 -0.531891E-05  0.193E-02    2.88       2.3  T
   6     -9.2389646 -0.607385E-06  0.775E-03    2.89       5.8  T
   7     -9.2389646 -0.468432E-07  0.139E-03    2.89      32.1  T
   8     -9.2389646 -0.243071E-08  0.582E-04    2.89      76.9  T
   9     -9.2389646 -0.100478E-08  0.830E-05    2.89     538.6  T
     SCC iter.                  ...        0 min,  0.001 sec
     gradient                   ...        0 min,  0.001 sec
 * total energy  :    -9.1463265 Eh     change       -0.4640965E-02 Eh
   gradient norm :     0.0341876 Eh/α   predicted    -0.3988657E-02 ( -14.06%)
   displ. norm   :     0.2107646 α      lambda       -0.4161604E-02
   maximum displ.:     0.1337825 α      in ANC's #1, #2, #6, ...

........................................................................
.............................. CYCLE    6 ..............................
........................................................................
   1     -9.2469195 -0.924692E+01  0.434E-01    3.29       0.0  T
   2     -9.2468162  0.103306E-03  0.282E-01    3.36       1.0  T
   3     -9.2467309  0.853108E-04  0.292E-01    3.27       1.0  T
   4     -9.2470176 -0.286742E-03  0.264E-02    3.32       1.7  T
   5     -9.2470189 -0.130373E-05  0.131E-02    3.32       3.4  T
   6     -9.2470193 -0.334398E-06  0.395E-03    3.33      11.3  T
   7     -9.2470193  0.741482E-09  0.170E-03    3.32      26.3  T
   8     -9.2470193 -0.855687E-08  0.338E-04    3.33     132.4  T
   9     -9.2470193 -0.297462E-09  0.274E-05    3.33    1631.6  T
     SCC iter.                  ...        0 min,  0.001 sec
     gradient                   ...        0 min,  0.001 sec
 * total energy  :    -9.1492763 Eh     change       -0.2949780E-02 Eh
   gradient norm :     0.0408029 Eh/α   predicted    -0.2173233E-02 ( -26.33%)
   displ. norm   :     0.2508173 α      lambda       -0.6223986E-02
   maximum displ.:     0.1720672 α      in ANC's #6, #8, #7, ...

........................................................................
.............................. CYCLE    7 ..............................
........................................................................
   1     -9.2643524 -0.926435E+01  0.704E-01    3.67       0.0  T
   2     -9.2638273  0.525110E-03  0.538E-01    3.85       1.0  T
   3     -9.2645465 -0.719151E-03  0.400E-01    3.70       1.0  T
   4     -9.2649221 -0.375687E-03  0.398E-02    3.76       1.1  T
   5     -9.2649243 -0.217580E-05  0.197E-02    3.76       2.3  T
   6     -9.2649247 -0.361163E-06  0.721E-03    3.76       6.2  T
   7     -9.2649247  0.722862E-08  0.261E-03    3.76      17.1  T
   8     -9.2649247 -0.180753E-07  0.699E-04    3.76      64.0  T
   9     -9.2649247 -0.761483E-09  0.122E-04    3.76     366.8  T
     SCC iter.                  ...        0 min,  0.001 sec
     gradient                   ...        0 min,  0.001 sec
 * total energy  :    -9.1518583 Eh     change       -0.2581949E-02 Eh
   gradient norm :     0.0386142 Eh/α   predicted    -0.3307766E-02 (  28.11%)
   displ. norm   :     0.5508871 α      lambda       -0.7567735E-02
   maximum displ.:     0.4631425 α      in ANC's #1, #2, #6, ...

........................................................................
.............................. CYCLE    8 ..............................
........................................................................
   1     -9.2419999 -0.924200E+01  0.150E+00    4.16       0.0  T
   2     -9.2409203  0.107958E-02  0.895E-01    4.47       1.0  T
   3     -9.2415900 -0.669703E-03  0.924E-01    4.18       1.0  T
   4     -9.2441243 -0.253429E-02  0.193E-01    4.28       1.0  T
   5     -9.2442195 -0.952563E-04  0.602E-02    4.32       1.0  T
   6     -9.2442247 -0.516685E-05  0.219E-02    4.32       2.0  T
   7     -9.2442251 -0.429221E-06  0.109E-02    4.32       4.1  T
   8     -9.2442255 -0.374421E-06  0.164E-03    4.32      27.3  T
   9     -9.2442255 -0.868208E-08  0.505E-04    4.32      88.6  T
  10     -9.2442255 -0.595884E-09  0.465E-05    4.32     960.9  T
     SCC iter.                  ...        0 min,  0.001 sec
     gradient                   ...        0 min,  0.001 sec
 * total energy  :    -9.1532334 Eh     change       -0.1375148E-02 Eh
   gradient norm :     0.0571521 Eh/α   predicted    -0.4932180E-02 ( 258.67%)
   displ. norm   :     0.1970430 α      lambda       -0.4997504E-02
   maximum displ.:     0.1211017 α      in ANC's #1, #2, #6, ...

........................................................................
.............................. CYCLE    9 ..............................
........................................................................
   1     -9.2532541 -0.925325E+01  0.549E-01    4.10       0.0  T
   2     -9.2531967  0.574575E-04  0.284E-01    4.01       1.0  T
   3     -9.2529747  0.221942E-03  0.382E-01    4.12       1.0  T
   4     -9.2534574 -0.482661E-03  0.445E-02    4.06       1.0  T
   5     -9.2534592 -0.177349E-05  0.185E-02    4.06       2.4  T
   6     -9.2534599 -0.750861E-06  0.670E-03    4.06       6.7  T
   7     -9.2534599  0.158271E-07  0.300E-03    4.06      14.9  T
   8     -9.2534599 -0.332891E-07  0.364E-04    4.06     122.8  T
   9     -9.2534599 -0.212946E-09  0.496E-05    4.06     901.0  T
     SCC iter.                  ...        0 min,  0.001 sec
     gradient                   ...        0 min,  0.001 sec
 * total energy  :    -9.1556232 Eh     change       -0.2389732E-02 Eh
   gradient norm :     0.0144515 Eh/α   predicted    -0.2595765E-02 (   8.62%)
   displ. norm   :     0.1893790 α      lambda       -0.1189136E-02
   maximum displ.:     0.1653347 α      in ANC's #1, #2, #8, ...

........................................................................
.............................. CYCLE   10 ..............................
........................................................................
   1     -9.2515878 -0.925159E+01  0.481E-01    4.06       0.0  T
   2     -9.2516077 -0.198851E-04  0.281E-01    4.11       1.0  T
   3     -9.2514146  0.193095E-03  0.232E-01    4.04       1.0  T
   4     -9.2516376 -0.222941E-03  0.522E-02    4.08       1.0  T
   5     -9.2516504 -0.128614E-04  0.124E-02    4.08       3.6  T
   6     -9.2516505 -0.101155E-06  0.431E-03    4.08      10.4  T
   7     -9.2516506 -0.304149E-07  0.999E-04    4.08      44.8  T
   8     -9.2516506 -0.848766E-09  0.411E-04    4.08     108.9  T
     SCC iter.                  ...        0 min,  0.001 sec
     gradient                   ...        0 min,  0.001 sec
 * total energy  :    -9.1566088 Eh     change       -0.9856940E-03 Eh
   gradient norm :     0.0106435 Eh/α   predicted    -0.6158933E-03 ( -37.52%)
   displ. norm   :     0.3786690 α      lambda       -0.1977451E-02
   maximum displ.:     0.3141777 α      in ANC's #1, #6, #8, ...

........................................................................
.............................. CYCLE   11 ..............................
........................................................................
   1     -9.2472230 -0.924722E+01  0.876E-01    4.04       0.0  T
   2     -9.2472733 -0.502405E-04  0.523E-01    4.09       1.0  T
   3     -9.2468418  0.431501E-03  0.304E-01    4.00       1.0  T
   4     -9.2472930 -0.451264E-03  0.847E-02    4.06       1.0  T
   5     -9.2473313 -0.382782E-04  0.213E-02    4.06       2.1  T
   6     -9.2473315 -0.240223E-06  0.661E-03    4.06       6.8  T
   7     -9.2473316 -0.714057E-07  0.163E-03    4.06      27.4  T
   8     -9.2473316 -0.142972E-08  0.485E-04    4.06      92.2  T
   9     -9.2473316 -0.220520E-09  0.129E-04    4.06     345.6  T
     SCC iter.                  ...        0 min,  0.001 sec
     gradient                   ...        0 min,  0.001 sec
 * total energy  :    -9.1571502 Eh     change       -0.5413528E-03 Eh
   gradient norm :     0.0263013 Eh/α   predicted    -0.1130501E-02 ( 108.83%)
   displ. norm   :     0.1275811 α      lambda       -0.1425466E-02
   maximum displ.:     0.1210538 α      in ANC's #1, #3, #8, ...

........................................................................
.............................. CYCLE   12 ..............................
........................................................................
   1     -9.2561602 -0.925616E+01  0.338E-01    4.18       0.0  T
   2     -9.2561728 -0.126269E-04  0.209E-01    4.18       1.0  T
   3     -9.2561634  0.938228E-05  0.653E-02    4.19       1.0  T
   4     -9.2561759 -0.124876E-04  0.256E-02    4.19       1.7  T
   5     -9.2561780 -0.208306E-05  0.148E-02    4.18       3.0  T
   6     -9.2561787 -0.719524E-06  0.360E-03    4.18      12.4  T
   7     -9.2561787 -0.109533E-07  0.474E-04    4.18      94.4  T
   8     -9.2561787 -0.171912E-09  0.176E-04    4.18     254.0  T
     SCC iter.                  ...        0 min,  0.001 sec
     gradient                   ...        0 min,  0.001 sec
 * total energy  :    -9.1577024 Eh     change       -0.5521855E-03 Eh
   gradient norm :     0.0069557 Eh/α   predicted    -0.7243348E-03 (  31.18%)
   displ. norm   :     0.0561884 α      lambda       -0.1520368E-03
   maximum displ.:     0.0425110 α      in ANC's #1, #6, #8, ...

........................................................................
.............................. CYCLE   13 ..............................
........................................................................
   1     -9.2552758 -0.925528E+01  0.146E-01    4.16       0.0  T
   2     -9.2552710  0.483254E-05  0.101E-01    4.15       1.0  T
   3     -9.2552489  0.220882E-04  0.845E-02    4.17       1.0  T
   4     -9.2552842 -0.352915E-04  0.614E-03    4.15       7.3  T
   5     -9.2552843 -0.508128E-07  0.279E-03    4.16      16.0  T
   6     -9.2552843 -0.101625E-07  0.840E-04    4.16      53.2  T
   7     -9.2552843 -0.670440E-09  0.196E-04    4.16     228.7  T
     SCC iter.                  ...        0 min,  0.000 sec
     gradient                   ...        0 min,  0.001 sec
 * total energy  :    -9.1578124 Eh     change       -0.1100028E-03 Eh
   gradient norm :     0.0049866 Eh/α   predicted    -0.7625749E-04 ( -30.68%)
   displ. norm   :     0.0507411 α      lambda       -0.7497480E-04
   maximum displ.:     0.0328972 α      in ANC's #1, #6, #8, ...

........................................................................
.............................. CYCLE   14 ..............................
........................................................................
   1     -9.2549973 -0.925500E+01  0.127E-01    4.15       0.0  T
   2     -9.2549884  0.888609E-05  0.952E-02    4.13       1.0  T
   3     -9.2549944 -0.591876E-05  0.687E-02    4.15       1.0  T
   4     -9.2550103 -0.159795E-04  0.432E-03    4.14      10.3  T
   5     -9.2550104 -0.118995E-07  0.180E-03    4.14      24.9  T
   6     -9.2550104 -0.581795E-08  0.609E-04    4.14      73.4  T
   7     -9.2550104 -0.321872E-09  0.170E-04    4.14     262.8  T
     SCC iter.                  ...        0 min,  0.000 sec
     gradient                   ...        0 min,  0.001 sec
 * total energy  :    -9.1578506 Eh     change       -0.3820042E-04 Eh
   gradient norm :     0.0020615 Eh/α   predicted    -0.3758389E-04 (  -1.61%)
   displ. norm   :     0.0080329 α      lambda       -0.7821425E-05
   maximum displ.:     0.0061280 α      in ANC's #1, #3, #5, ...

........................................................................
.............................. CYCLE   15 ..............................
........................................................................
   1     -9.2553379 -0.925534E+01  0.177E-02    4.14       0.0  T
   2     -9.2553378  0.133556E-06  0.115E-02    4.14       3.9  T
   3     -9.2553378 -0.237747E-07  0.107E-02    4.14       4.2  T
   4     -9.2553382 -0.390316E-06  0.161E-03    4.14      27.8  T
   5     -9.2553382 -0.723347E-08  0.550E-04    4.14      81.4  T
   6     -9.2553382 -0.135765E-09  0.179E-04    4.14     249.9  T
     SCC iter.                  ...        0 min,  0.000 sec
     gradient                   ...        0 min,  0.001 sec
 * total energy  :    -9.1578559 Eh     change       -0.5308000E-05 Eh
   gradient norm :     0.0013091 Eh/α   predicted    -0.3911429E-05 ( -26.31%)
   displ. norm   :     0.0141351 α      lambda       -0.5125080E-05
   maximum displ.:     0.0079626 α      in ANC's #1, #2, #7, ...

........................................................................
.............................. CYCLE   16 ..............................
........................................................................
   1     -9.2556551 -0.925566E+01  0.338E-02    4.15       0.0  T
   2     -9.2556552 -0.112082E-06  0.201E-02    4.15       2.2  T
   3     -9.2556542  0.102890E-05  0.152E-02    4.15       2.9  T
   4     -9.2556554 -0.115405E-05  0.371E-03    4.15      12.1  T
   5     -9.2556554 -0.498156E-07  0.124E-03    4.15      36.0  T
   6     -9.2556554 -0.869314E-09  0.311E-04    4.15     143.7  T
   7     -9.2556554 -0.379909E-10  0.566E-05    4.15     790.0  T
     SCC iter.                  ...        0 min,  0.000 sec
     gradient                   ...        0 min,  0.001 sec
 * total energy  :    -9.1578591 Eh     change       -0.3249840E-05 Eh
   gradient norm :     0.0016240 Eh/α   predicted    -0.2563739E-05 ( -21.11%)
   displ. norm   :     0.0065185 α      lambda       -0.2646953E-05
   maximum displ.:     0.0040395 α      in ANC's #7, #3, #5, ...

........................................................................
.............................. CYCLE   17 ..............................
........................................................................
   1     -9.2555765 -0.925558E+01  0.176E-02    4.15       0.0  T
   2     -9.2555764  0.664436E-07  0.112E-02    4.15       4.0  T
   3     -9.2555761  0.305462E-06  0.106E-02    4.14       4.2  T
   4     -9.2555766 -0.508021E-06  0.108E-03    4.15      41.4  T
   5     -9.2555766 -0.278024E-08  0.426E-04    4.15     105.1  T
   6     -9.2555766 -0.140819E-09  0.961E-05    4.15     465.4  T
     SCC iter.                  ...        0 min,  0.000 sec
     gradient                   ...        0 min,  0.001 sec
 * total energy  :    -9.1578611 Eh     change       -0.1915857E-05 Eh
   gradient norm :     0.0008872 Eh/α   predicted    -0.1323490E-05 ( -30.92%)
   displ. norm   :     0.0028597 α      lambda       -0.1163378E-05
   maximum displ.:     0.0015861 α      in ANC's #1, #3, #7, ...

   *** GEOMETRY OPTIMIZATION CONVERGED AFTER 17 ITERATIONS ***

------------------------------------------------------------------------
 total energy gain   :        -0.0892423 Eh      -56.0004 kcal/mol
 total RMSD          :         0.8876273 a0        0.4697 Å
 total power (kW/mol):       -13.7826869 (step)-5844.2015 (real)
------------------------------------------------------------------------

 ANCopt (total)                0 d,  0 h,  0 min,  0.040 sec
 optimizer setup                ...        0 min,  0.000 sec (  0.177%)
 model hessian                  ...        0 min,  0.000 sec (  0.247%)
 ANC generation                 ...        0 min,  0.000 sec (  0.137%)
 coordinate transformation      ...        0 min,  0.000 sec (  0.108%)
 single point calculation       ...        0 min,  0.038 sec ( 95.463%)
 optimization log               ...        0 min,  0.000 sec (  1.203%)
 hessian update                 ...        0 min,  0.000 sec (  0.100%)
 rational function              ...        0 min,  0.000 sec (  1.247%)

================
 final structure:
================
5
 xtb: 6.2.2 (9d81278992624c895f80dd42a50cac0aa55982e2)
C        -0.46360261198260    0.19016938738041    0.06563780637467
C         0.93011229280457    0.22576269583974    0.01851152352538
O        -0.99789814707417   -0.89269473098386   -0.18089806334537
H        -1.03169015833700    1.09100129675882    0.31251377531623
H         1.56307962458920   -0.61423864899511   -0.21576404187092

 Bond Distances (Angstroems)
 ---------------------------
C1-C2=1.3950         C1-O3=1.2324         C1-H4=1.0932         C2-C1=1.3950         C2-H5=1.0776         O3-C1=1.2324         
H4-C1=1.0932         H5-C2=1.0776         
 C  H  Rav=1.0854 sigma=0.0078  Rmin=1.0776  Rmax=1.0932     2
 C  C  Rav=1.3950 sigma=0.0000  Rmin=1.3950  Rmax=1.3950     1
 O  C  Rav=1.2324 sigma=0.0000  Rmin=1.2324  Rmax=1.2324     1

 selected bond angles (degree)
 --------------------
O3-C1-C2=116.67                H4-C1-C2=120.38                H4-C1-O3=122.95                H5-C2-C1=125.05                

 selected dihedral angles (degree)
 ---------------------------------
H5-C2-C1-O3=  0.06            H5-C2-C1-H4=180.00            
           -------------------------------------------------
          |                Final Singlepoint                |
           -------------------------------------------------

          ...................................................
          :                      SETUP                      :
          :.................................................:
          :  # basis functions                  14          :
          :  # atomic orbitals                  14          :
          :  # shells                            8          :
          :  # electrons                        16          :
          :  max. iterations                   250          :
          :  Hamiltonian                  GFN2-xTB          :
          :  restarted?                      false          :
          :  GBSA solvation                  false          :
          :  PC potential                    false          :
          :  electronic temp.          300.0000000     K    :
          :  accuracy                    1.0000000          :
          :  -> integral cutoff          0.2500000E+02      :
          :  -> integral neglect         0.1000000E-07      :
          :  -> SCF convergence          0.1000000E-05 Eh   :
          :  -> wf. convergence          0.1000000E-03 e    :
          :  Broyden damping             0.4000000          :
          ...................................................

 iter      E             dE          RMSdq      gap      omega  full diag
   1     -9.2555766 -0.925558E+01  0.137E-05    4.15       0.0  T
   2     -9.2555766 -0.426326E-13  0.823E-06    4.15    5431.3  T
   3     -9.2555766  0.207834E-12  0.674E-06    4.15    6632.8  T

   *** convergence criteria satisfied after 3 iterations ***

         #    Occupation            Energy/Eh            Energy/eV
      -------------------------------------------------------------
         1        2.0000           -0.7346472             -19.9908
       ...           ...                  ...                  ...
         3        2.0000           -0.6101547             -16.6032
         4        2.0000           -0.5569315             -15.1549
         5        2.0000           -0.5562672             -15.1368
         6        2.0000           -0.5408451             -14.7171
         7        2.0000           -0.4418135             -12.0224
         8        1.0000           -0.4090343             -11.1304
         9        1.0000           -0.3905030             -10.6261 (HOMO)
        10                         -0.2381416              -6.4802 (LUMO)
        11                          0.0823408               2.2406
        12                          0.2177268               5.9246
        13                          0.3741160              10.1802
        14                          0.5033144              13.6959
      -------------------------------------------------------------
                  HL-Gap            0.1523614 Eh            4.1460 eV
             Fermi-level           -0.3698731 Eh          -10.0648 eV

 transition dipole moment (au) for excitation:           8           9
     X       Y       Z   
  -0.0044   0.0216  -0.0892  total (au/Debye):    0.092   0.234
 dE (eV)             :    0.504
 oscillator strength :  0.14762E-03

 SCC (total)                   0 d,  0 h,  0 min,  0.002 sec
 SCC setup                      ...        0 min,  0.000 sec (  2.149%)
 Dispersion                     ...        0 min,  0.000 sec (  0.454%)
 integral evaluation            ...        0 min,  0.001 sec ( 30.812%)
 zeroth order Hamiltonian       ...        0 min,  0.000 sec (  0.463%)
 iterations                     ...        0 min,  0.000 sec ( 10.018%)
 molecular gradient             ...        0 min,  0.001 sec ( 30.270%)
 printout                       ...        0 min,  0.001 sec ( 25.518%)

         :::::::::::::::::::::::::::::::::::::::::::::::::::::
         ::                     SUMMARY                     ::
         :::::::::::::::::::::::::::::::::::::::::::::::::::::
         :: total energy              -9.157861059472 Eh    ::
         :: gradient norm              0.000903783937 Eh/a0 ::
         :: HOMO-LUMO gap              4.145964568459 eV    ::
         ::.................................................::
         :: SCC energy                -9.255576632879 Eh    ::
         :: -> isotropic ES            0.017295002553 Eh    ::
         :: -> anisotropic ES         -0.001091023866 Eh    ::
         :: -> anisotropic XC          0.004432441027 Eh    ::
         :: -> dispersion             -0.001409841708 Eh    ::
         :: repulsion energy           0.097715542638 Eh    ::
         :: add. restraining           0.000000000000 Eh    ::
         :::::::::::::::::::::::::::::::::::::::::::::::::::::

           ------------------------------------------------- 
          |                Numerical Hessian                |
           ------------------------------------------------- 
step length          :   0.00500
SCC accuracy         :   0.30000
Hessian scale factor :   1.00000
frozen atoms in %    :   0.00000    0
RMS gradient         :   0.00090
estimated CPU  time      0.00 min
estimated wall time      0.00 min

writing file <hessian>.

 projected vibrational frequencies (cm-1)
eigval :       -0.00    -0.00    -0.00     0.00     0.00     0.00
eigval :      430.64   536.67   874.39   882.69  1229.76  1322.38
eigval :     1515.92  2918.16  3075.51
           -------------------------------------------------
          |                Property Printout                |
           -------------------------------------------------

    * Orbital Energies and Occupations

         #    Occupation            Energy/Eh            Energy/eV
      -------------------------------------------------------------
         1        2.0000           -0.7346473             -19.9908
         2        2.0000           -0.6596233             -17.9493
         3        2.0000           -0.6101547             -16.6032
         4        2.0000           -0.5569315             -15.1549
         5        2.0000           -0.5562672             -15.1368
         6        2.0000           -0.5408451             -14.7171
         7        2.0000           -0.4418135             -12.0224
         8        1.0000           -0.4090342             -11.1304
         9        1.0000           -0.3905029             -10.6261 (HOMO)
        10                         -0.2381416              -6.4802 (LUMO)
        11                          0.0823408               2.2406
        12                          0.2177268               5.9246
        13                          0.3741160              10.1802
        14                          0.5033144              13.6959
      -------------------------------------------------------------
                  HL-Gap            0.1523614 Eh            4.1460 eV
             Fermi-level           -0.3698731 Eh          -10.0648 eV

     #   Z        covCN         q      C6AA      α(0)
     1   6 C      2.760     0.210    23.541     7.945
     2   6 C      1.915    -0.082    33.345     9.326
     3   8 O      0.865    -0.294    19.671     5.947
     4   1 H      0.924     0.053     2.285     2.364
     5   1 H      0.926     0.113     1.673     2.023

 Mol. C6AA /au·bohr⁶  :        317.181861
 Mol. C8AA /au·bohr⁸  :       7493.502990
 Mol. α(0) /au        :         27.604752


Molecule has the following symmetry elements: (sigma) 
It seems to be the Cs point group
Wiberg/Mayer (AO) data.
largest (>0.10) Wiberg bond orders for each atom
          total WBO             WBO to atom ...
     1  C   3.828        O    3 1.630    C    2 1.256    H    4 0.937
     2  C   2.306        C    1 1.256    H    5 0.941    O    3 0.102
     3  O   1.772        C    1 1.630    C    2 0.102
     4  H   0.997        C    1 0.937
     5  H   0.966        C    2 0.941

MOs/occ written to file <molden.input>


molecular dipole:
                 x           y           z       tot (Debye)
 q only:        0.456       0.515       0.109
   full:        0.442       0.484       0.102       1.686
molecular quadrupole (traceless):
                xx          xy          yy          xz          yz          zz
 q only:        0.268      -2.493      -0.475      -0.621      -0.066       0.207
  q+dip:        0.663      -4.510      -0.553      -1.153       0.091      -0.110
   full:       -0.118      -4.020      -1.025      -0.944      -0.388       1.142

           -------------------------------------------------
          |                Geometry Summary                 |
           -------------------------------------------------

      molecular mass/u    :       42.0367582
   center of mass at/Å    :       -0.2337739      -0.2094913      -0.0424866
  moments of inertia/u·Å² :        0.8037949E+01   0.3628504E+02   0.4432299E+02
rotational constants/cm⁻¹ :        0.2097255E+01   0.4645890E+00   0.3803361E+00

 * 2 selected distances

     #   Z        #   Z                                     value/Å
     1   6 C      3   8 O                                 1.2324148 (max)
     1   6 C      4   1 H                                 1.0932380 (min)

 * 2 distinct bonds (by element types)

   Z      Z             #   av. dist./Å        max./Å        min./Å
   1 H    6 C           1     1.0932380     1.0932380     1.0932380
   6 C    8 O           1     1.2324148     1.2324148     1.2324148

           -------------------------------------------------
          |               Frequency Printout                |
           -------------------------------------------------
 projected vibrational frequencies (cm-1)
eigval :       -0.00    -0.00    -0.00     0.00     0.00     0.00
eigval :      430.64   536.67   874.39   882.69  1229.76  1322.38
eigval :     1515.92  2918.16  3075.51
 reduced masses (amu)
   1:  8.76   2: 12.94   3: 11.76   4: 11.74   5: 12.41   6: 13.79   7:  8.66   8:  3.04
   9:  5.70  10:  6.50  11:  7.98  12:  5.63  13: 13.60  14:  1.76  15:  1.87
 IR intensities (amu)
   1:  0.15   2:  0.27   3:  0.20   4:  0.17   5:  0.28   6:  0.19   7:  0.69   8:  0.33
   9:  0.16  10:  0.24  11:  0.58  12:  0.57  13:  1.31  14:  0.39  15:  0.09
 Raman intensities (amu)
   1:  0.00   2:  0.00   3:  0.00   4:  0.00   5:  0.00   6:  0.00   7:  0.00   8:  0.00
   9:  0.00  10:  0.00  11:  0.00  12:  0.00  13:  0.00  14:  0.00  15:  0.00
 output can be read by thermo (or use thermo option).
 writing <g98.out> molden fake output.
 recommended (thermochemical) frequency scaling factor: 1.0
           -------------------------------------------------
          |             Thermodynamic Functions             |
           -------------------------------------------------

cs  symmetry found (for desy threshold:  0.10E+00) used in thermo

          ...................................................
          :                      SETUP                      :
          :.................................................:
          :  # frequencies                           9      :
          :  # imaginary freq.                       0      :
          :  linear?                             false      :
          :  only rotor calc.                    false      :
          :  symmetry                               cs      :
          :  rotational number                       1      :
          :  scaling factor                  1.0000000      :
          :  rotor cutoff                   50.0000000 cm⁻¹ :
          :  imag. cutoff                  -20.0000000 cm⁻¹ :
          :.................................................:

    mode    ω/cm⁻¹     T·S(HO)/kcal·mol⁻¹    T·S(FR)/kcal·mol⁻¹   T·S(vib)
   ------------------------------------------------------------------------
   ------------------------------------------------------------------------

   temp. (K)  partition function   enthalpy   heat capacity  entropy
                                   cal/mol     cal/K/mol   cal/K/mol   J/K/mol
 298.15  VIB   1.28                  392.756      4.028      1.806
         ROT  0.869E+04              888.752      2.981     21.004
         INT  0.111E+05             1281.509      7.008     22.810
         TR   0.264E+27             1481.254      4.968     37.118
         TOT                        2762.7626    11.9766    59.9280   250.7386

   temp. (K)  partition function   enthalpy   heat capacity  entropy
                                   cal/mol     cal/K/mol   cal/K/mol   J/K/mol
 120.00  VIB   1.01                    9.690      0.451      0.096
         ROT  0.222E+04              357.707      2.981     18.291
         INT  0.223E+04              367.396      3.432     18.387
         TR   0.673E+26              596.178      4.968     32.599
         TOT                         963.5743     8.4002    50.9854   213.3228

   temp. (K)  partition function   enthalpy   heat capacity  entropy
                                   cal/mol     cal/K/mol   cal/K/mol   J/K/mol
 100.00  VIB   1.00                    3.211      0.211      0.037
         ROT  0.169E+04              298.089      2.981     17.748
         INT  0.169E+04              301.300      3.192     17.785
         TR   0.512E+26              496.815      4.968     31.693
         TOT                         798.1148     8.1598    49.4781   207.0164

   temp. (K)  partition function   enthalpy   heat capacity  entropy
                                   cal/mol     cal/K/mol   cal/K/mol   J/K/mol
  80.00  VIB   1.00                    0.633      0.064      0.009
         ROT  0.121E+04              238.471      2.981     17.083
         INT  0.121E+04              239.104      3.045     17.091
         TR   0.367E+26              397.452      4.968     30.585
         TOT                         636.5558     8.0127    47.6766   199.4791

   temp. (K)  partition function   enthalpy   heat capacity  entropy
                                   cal/mol     cal/K/mol   cal/K/mol   J/K/mol
  60.00  VIB   1.00                    0.044      0.008      0.001
         ROT   784.                  178.853      2.981     16.225
         INT   784.                  178.898      2.989     16.226
         TR   0.238E+26              298.089      4.968     29.157
         TOT                         476.9867     7.9568    45.3824   189.8799

   temp. (K)  partition function   enthalpy   heat capacity  entropy
                                   cal/mol     cal/K/mol   cal/K/mol   J/K/mol
  40.00  VIB   1.00                    0.000      0.000     -0.000
         ROT   427.                  119.236      2.981     15.016
         INT   427.                  119.236      2.981     15.016
         TR   0.130E+26              198.726      4.968     27.143
         TOT                         317.9618     7.9491    42.1594   176.3949

   temp. (K)  partition function   enthalpy   heat capacity  entropy
                                   cal/mol     cal/K/mol   cal/K/mol   J/K/mol
  20.00  VIB   1.00                    0.000      0.000     -0.000
         ROT   151.                   59.618      2.981     12.950
         INT   151.                   59.618      2.981     12.950
         TR   0.458E+25               99.363      4.968     23.701
         TOT                         158.9808     7.9490    36.6510   153.3478

   temp. (K)  partition function   enthalpy   heat capacity  entropy
                                   cal/mol     cal/K/mol   cal/K/mol   J/K/mol
  10.00  VIB   1.00                    0.000      0.000     -0.001
         ROT   53.4                   29.809      2.981     10.884
         INT   53.4                   29.809      2.981     10.883
         TR   0.162E+25               49.681      4.968     20.259
         TOT                          79.4904     7.9490    31.1426   130.3008

       T/K    H(0)-H(T)+PV         H(T)/Eh          T*S/Eh         G(T)/Eh
   ------------------------------------------------------------------------
    298.15    0.440274E-02    0.335317E-01    0.284737E-01    0.505801E-02
    120.00    0.153555E-02    0.306645E-01    0.975004E-02    0.209145E-01
    100.00    0.127188E-02    0.304008E-01    0.788484E-02    0.225160E-01
     80.00    0.101442E-02    0.301434E-01    0.607821E-02    0.240652E-01
     60.00    0.760127E-03    0.298891E-01    0.433929E-02    0.255498E-01
     40.00    0.506704E-03    0.296357E-01    0.268741E-02    0.269483E-01
     20.00    0.253352E-03    0.293823E-01    0.116814E-02    0.282142E-01
     10.00    0.126676E-03    0.292556E-01    0.496290E-03    0.287594E-01 (used)
   ------------------------------------------------------------------------

         :::::::::::::::::::::::::::::::::::::::::::::::::::::
         ::                  THERMODYNAMIC                  ::
         :::::::::::::::::::::::::::::::::::::::::::::::::::::
         :: total free energy          -9.129101701478 Eh   ::
         ::.................................................::
         :: total energy               -9.157861059443 Eh   ::
         :: zero point energy           0.029128971563 Eh   ::
         :: G(RRHO) w/o ZPVE           -0.000369613598 Eh   ::
         :: G(RRHO) contrib.            0.028759357965 Eh   ::
         :::::::::::::::::::::::::::::::::::::::::::::::::::::

optimized geometry written to: xtbopt.xyz


           -------------------------------------------------
          | TOTAL ENERGY               -9.157861059443 Eh   |
          | TOTAL ENTHALPY             -9.128605411864 Eh   |
          | TOTAL FREE ENERGY          -9.129101701478 Eh   |
          | GRADIENT NORM               0.000903891222 Eh/α |
          | HOMO-LUMO GAP               4.145963702765 eV   |
           -------------------------------------------------

------------------------------------------------------------------------
 * finished run on 2020/05/12 at 11:45:13.538     
------------------------------------------------------------------------
 total:
 * wall-time:     0 d,  0 h,  0 min,  0.125 sec
 *  cpu-time:     0 d,  0 h,  0 min,  0.125 sec
 * ratio c/w:     0.997 speedup
 SCF:
 * wall-time:     0 d,  0 h,  0 min,  0.004 sec
 *  cpu-time:     0 d,  0 h,  0 min,  0.004 sec
 * ratio c/w:     1.000 speedup
 ANC optimizer:
 * wall-time:     0 d,  0 h,  0 min,  0.043 sec
 *  cpu-time:     0 d,  0 h,  0 min,  0.043 sec
 * ratio c/w:     0.997 speedup
 numerical hessian:
 * wall-time:     0 d,  0 h,  0 min,  0.060 sec
 *  cpu-time:     0 d,  0 h,  0 min,  0.060 sec
 * ratio c/w:     0.998 speedup

