      -----------------------------------------------------------      
     |                   =====================                   |     
     |                           x T B                           |     
     |                   =====================                   |     
     |                         S. Grimme                         |     
     |          Mulliken Center for Theoretical Chemistry        |     
     |                    University of Bonn                     |     
      -----------------------------------------------------------      

   * xtb version 6.2.2 (9d81278992624c895f80dd42a50cac0aa55982e2) compiled by '@Darwin' on 04/03/2020

   xtb is free software: you can redistribute it and/or modify it under
   the terms of the GNU Lesser General Public License as published by
   the Free Software Foundation, either version 3 of the License, or
   (at your option) any later version.
   
   xtb is distributed in the hope that it will be useful,
   but WITHOUT ANY WARRANTY; without even the implied warranty of
   MERCHANTABILITY or FITNESS FOR A PARTICULAR PURPOSE.  See the
   GNU Lesser General Public License for more details.
   
   Cite this work as:
   * S. Grimme, C. Bannwarth, P. Shushkov, J. Chem. Theory Comput., 2017,
     13, 1989-2009. DOI: 10.1021/acs.jctc.7b00118
   * C. Bannwarth, S. Ehlert and S. Grimme., J. Chem. Theory Comput., 2019,
     15, 1652-1671. DOI: 10.1021/acs.jctc.8b01176
   * P. Pracht, E. Caldeweyher, S. Ehlert, S. Grimme, ChemRxiv, 2019, preprint.
     DOI: 10.26434/chemrxiv.8326202.v1
   
   for DFT-D4:
   * E. Caldeweyher, C. Bannwarth and S. Grimme, J. Chem. Phys., 2017,
     147, 034112. DOI: 10.1063/1.4993215
   * E. Caldeweyher, S. Ehlert, A. Hansen, H. Neugebauer, S. Spicher,
     C. Bannwarth and S. Grimme, J. Chem. Phys., 2019, 150, 154122.
     DOI: 10.1063/1.5090222
   
   for sTDA-xTB:
   * S. Grimme and C. Bannwarth, J. Chem. Phys., 2016, 145, 054103.
     DOI: 10.1063/1.4959605
   
   in the mass-spec context:
   * V. Asgeirsson, C. Bauer and S. Grimme, Chem. Sci., 2017, 8, 4879.
     DOI: 10.1039/c7sc00601b
   
   for metadynamics refer to:
   * S. Grimme, J. Chem. Theory Comput., 2019, 155, 2847-2862
     DOI: 10.1021/acs.jctc.9b00143
   
   with help from (in alphabetical order)
   C. Bannwarth, F. Bohle, G. Brandenburg, E. Caldeweyher, M. Checinski,
   S. Dohm, S. Ehlert, S. Ehrlich, F. März, H. Neugebauer, J. Pisarek,
   P. Pracht, P. Shushkov, and S. Spicher.
   
 * started run on 2020/05/12 at 11:45:08.266     

           -------------------------------------------------
          |                Calculation Setup                |
           -------------------------------------------------

          program call               : xtb --input H1C4_1_S_3.input H1C4_1_S_3.xyz --ohess --molden --namespace H1C4_1_S_3 output.out
          calculation namespace      : H1C4_1_S_3
          coordinate file            : H1C4_1_S_3.xyz
          number of atoms            :                     5
          number of electrons        :                    17
          charge                     :                     0
          spin                       :                   1.5
          first test random number   :      0.67740448429367

   ID    Z sym.   atoms
    1    6 C      1-4
    2    1 H      5

           -------------------------------------------------
          |                 G F N 2 - x T B                 |
           -------------------------------------------------

        Reference                      10.1021/acs.jctc.8b01176
      * Hamiltonian:
        H0-scaling (s, p, d)           1.850000    2.230000    2.230000
        zeta-weighting                 0.500000
      * Dispersion:
        s8                             2.700000
        a1                             0.520000
        a2                             5.000000
        s9                             5.000000
      * Repulsion:
        kExp                           1.500000    1.000000
        rExp                           1.000000
      * Coulomb:
        alpha                          2.000000
        third order                    shell-resolved
        anisotropic                    true
        a3                             3.000000
        a5                             4.000000
        cn-shift                       1.200000
        cn-exp                         4.000000
        max-rad                        5.000000


          ...................................................
          :                      SETUP                      :
          :.................................................:
          :  # basis functions                  17          :
          :  # atomic orbitals                  17          :
          :  # shells                            9          :
          :  # electrons                        17          :
          :  max. iterations                   250          :
          :  Hamiltonian                  GFN2-xTB          :
          :  restarted?                      false          :
          :  GBSA solvation                  false          :
          :  PC potential                    false          :
          :  electronic temp.          300.0000000     K    :
          :  accuracy                    1.0000000          :
          :  -> integral cutoff          0.2500000E+02      :
          :  -> integral neglect         0.1000000E-07      :
          :  -> SCF convergence          0.1000000E-05 Eh   :
          :  -> wf. convergence          0.1000000E-03 e    :
          :  Broyden damping             0.4000000          :
          ...................................................

 iter      E             dE          RMSdq      gap      omega  full diag
   1     -8.4617899 -0.846179E+01  0.107E+01    0.25       0.0  T
   2     -8.4845948 -0.228049E-01  0.617E+00    0.13       1.0  T
   3     -8.4861467 -0.155191E-02  0.136E+00    0.09       1.0  T
   4     -8.4875790 -0.143230E-02  0.577E-01    0.06       1.0  T
   5     -8.4612713  0.263077E-01  0.189E+00    0.14       1.0  T
   6     -8.4760561 -0.147848E-01  0.135E+00    0.16       1.0  T
   7     -8.4874448 -0.113887E-01  0.504E-01    0.13       1.0  T
   8     -8.4865978  0.846917E-03  0.580E-01    0.13       1.0  T
   9     -8.4867694 -0.171571E-03  0.555E-01    0.13       1.0  T
  10     -8.4883864 -0.161699E-02  0.723E-02    0.10       1.0  T
  11     -8.4883722  0.142297E-04  0.758E-02    0.10       1.0  T
  12     -8.4883803 -0.812861E-05  0.450E-02    0.10       1.0  T
  13     -8.4883811 -0.798649E-06  0.445E-02    0.10       1.0  T
  14     -8.4883914 -0.103196E-04  0.119E-02    0.10       3.8  T
  15     -8.4883920 -0.590188E-06  0.306E-03    0.10      14.6  T
  16     -8.4883920 -0.416701E-07  0.994E-04    0.10      45.0  T
  17     -8.4883920 -0.227718E-08  0.663E-04    0.10      67.5  T

   *** convergence criteria satisfied after 17 iterations ***

         #    Occupation            Energy/Eh            Energy/eV
      -------------------------------------------------------------
         1        2.0000           -0.7169537             -19.5093
       ...           ...                  ...                  ...
         4        2.0000           -0.5967982             -16.2397
         5        2.0000           -0.5248123             -14.2809
         6        2.0000           -0.4968819             -13.5208
         7        2.0000           -0.4968815             -13.5208
         8        1.0000           -0.4165673             -11.3354
         9        1.0000           -0.4165670             -11.3354
        10        0.8096           -0.3881476             -10.5620 (HOMO)
        11        0.0950           -0.3846311             -10.4663 (LUMO)
        12        0.0950           -0.3846306             -10.4663
        13        0.0004           -0.3794327             -10.3249
        14                          0.0594548               1.6178
        15                          0.0873374               2.3766
       ...                                ...                  ...
        17                          0.1290616               3.5119
      -------------------------------------------------------------
                  HL-Gap            0.0035164 Eh            0.0957 eV
             Fermi-level           -0.4217485 Eh          -11.4764 eV

 SCC (total)                   0 d,  0 h,  0 min,  0.005 sec
 SCC setup                      ...        0 min,  0.000 sec (  2.457%)
 Dispersion                     ...        0 min,  0.000 sec (  0.552%)
 integral evaluation            ...        0 min,  0.002 sec ( 32.513%)
 zeroth order Hamiltonian       ...        0 min,  0.000 sec (  0.486%)
 iterations                     ...        0 min,  0.002 sec ( 37.372%)
 molecular gradient             ...        0 min,  0.001 sec ( 23.592%)
 printout                       ...        0 min,  0.000 sec (  2.693%)

         :::::::::::::::::::::::::::::::::::::::::::::::::::::
         ::                     SUMMARY                     ::
         :::::::::::::::::::::::::::::::::::::::::::::::::::::
         :: total energy              -8.429173254038 Eh    ::
         :: gradient norm              0.089975193885 Eh/a0 ::
         :: HOMO-LUMO gap              0.095687243668 eV    ::
         ::.................................................::
         :: SCC energy                -8.488392048156 Eh    ::
         :: -> isotropic ES           -0.046687260830 Eh    ::
         :: -> anisotropic ES         -0.001186432565 Eh    ::
         :: -> anisotropic XC          0.006360892802 Eh    ::
         :: -> dispersion             -0.002323211750 Eh    ::
         :: repulsion energy           0.059218660068 Eh    ::
         :: add. restraining           0.000000000000 Eh    ::
         :::::::::::::::::::::::::::::::::::::::::::::::::::::

      ----------------------------------------------------------- 
     |                   =====================                   |
     |                        A N C O P T                        |
     |                   =====================                   |
     |               Approximate Normal Coordinate               |
     |                Rational Function Optimizer                |
      ----------------------------------------------------------- 

          ...................................................
          :                      SETUP                      :
          :.................................................:
          :   optimization level            normal          :
          :   max. optcycles                   200          :
          :   ANC micro-cycles                  20          :
          :   degrees of freedom                 9          :
          :.................................................:
          :   RF solver                   davidson          :
          :   write xtbopt.log                true          :
          :   linear?                        false          :
          :   energy convergence         0.5000000E-05 Eh   :
          :   grad. convergence          0.1000000E-02 Eh/α :
          :   maximium RF displ.         1.0000000          :
          :   Hlow (freq-cutoff)         0.1000000E-01      :
          :   Hmax (freq-cutoff)         5.0000000          :
          :   S6 in model hess.         20.0000000          :
          ...................................................

generating ANC from model Hessian ...
Using Lindh-Hessian (1995)
 Shifting diagonal of input Hessian by    0.0000000000000000     
 Lowest  eigenvalues of input Hessian
   -0.000000   -0.000000   -0.000000    0.000000    0.000000    0.000000
    0.063364    0.063364    0.075763    0.098772    0.098772    0.428085
    0.998408    1.023008    1.023010
 Highest eigenvalues
    0.098772    0.098772    0.428085    0.998408    1.023008    1.023010


........................................................................
.............................. CYCLE    1 ..............................
........................................................................
   1     -8.4883921 -0.848839E+01  0.112E-04    0.10       0.0  T
   2     -8.4883920  0.151285E-07  0.142E-03    0.10      31.4  T
   3     -8.4883921 -0.151353E-07  0.100E-04    0.10     445.3  T
   4     -8.4883921 -0.559943E-10  0.464E-05    0.10     963.8  T
     SCC iter.                  ...        0 min,  0.001 sec
     gradient                   ...        0 min,  0.001 sec
 * total energy  :    -8.4291733 Eh     change       -0.5021297E-08 Eh
   gradient norm :     0.0899748 Eh/α   predicted     0.0000000E+00 (-100.00%)
   displ. norm   :     0.4600367 α      lambda       -0.3227312E-01
   maximum displ.:     0.4310229 α      in ANC's #3, #6, #7, ...

........................................................................
.............................. CYCLE    2 ..............................
........................................................................
   1     -8.5354950 -0.853550E+01  0.164E+00    1.11       0.0  T
   2     -8.5357550 -0.260002E-03  0.101E+00    1.13       1.0  T
   3     -8.5354649  0.290167E-03  0.275E-01    1.12       1.0  T
   4     -8.5358391 -0.374206E-03  0.175E-02    1.13       2.6  T
   5     -8.5358354  0.368437E-05  0.205E-02    1.13       2.2  T
   6     -8.5358387 -0.328542E-05  0.757E-03    1.13       5.9  T
   7     -8.5358391 -0.465573E-06  0.106E-03    1.13      42.3  T
   8     -8.5358391 -0.433680E-09  0.238E-04    1.13     187.9  T
   9     -8.5358391  0.173239E-08  0.433E-04    1.13     103.3  T
     SCC iter.                  ...        0 min,  0.001 sec
     gradient                   ...        0 min,  0.001 sec
 * total energy  :    -8.4625015 Eh     change       -0.3332819E-01 Eh
   gradient norm :     0.0751543 Eh/α   predicted    -0.1955160E-01 ( -41.34%)
   displ. norm   :     0.9223500 α      lambda       -0.6061358E-01
   maximum displ.:     0.8601778 α      in ANC's #3, #6, #7, ...

........................................................................
.............................. CYCLE    3 ..............................
........................................................................
   1     -8.5963556 -0.859636E+01  0.387E+00    3.75       0.0  T
   2     -8.5965098 -0.154170E-03  0.230E+00    3.75       1.0  T
   3     -8.5965682 -0.583727E-04  0.109E-01    3.76       1.0  T
   4     -8.5965731 -0.495386E-05  0.727E-02    3.75       1.0  T
   5     -8.5965854 -0.122631E-04  0.254E-02    3.75       1.8  T
   6     -8.5965856 -0.219002E-06  0.730E-03    3.75       6.1  T
   7     -8.5965854  0.170755E-06  0.590E-03    3.75       7.6  T
   8     -8.5965857 -0.276258E-06  0.168E-03    3.75      26.6  T
   9     -8.5965857 -0.563657E-08  0.627E-05    3.75     713.7  T
  10     -8.5965857 -0.211564E-11  0.208E-05    3.75    2146.6  T
     SCC iter.                  ...        0 min,  0.001 sec
     gradient                   ...        0 min,  0.001 sec
 * total energy  :    -8.5139028 Eh     change       -0.5140130E-01 Eh
   gradient norm :     0.0665049 Eh/α   predicted    -0.5608970E-01 (   9.12%)
   displ. norm   :     0.8774077 α      lambda       -0.5159916E-01
   maximum displ.:     0.7774118 α      in ANC's #3, #6, #7, ...

........................................................................
.............................. CYCLE    4 ..............................
........................................................................
   1     -8.6606959 -0.866070E+01  0.607E+00    8.27       0.0  T
   2     -8.5808315  0.798644E-01  0.606E+00    7.94       1.0  T
   3     -8.6543539 -0.735224E-01  0.381E+00    8.23       1.0  T
   4     -8.6839290 -0.295751E-01  0.872E-01    8.16       1.0  T
   5     -8.6836972  0.231838E-03  0.644E-01    8.17       1.0  T
   6     -8.6836040  0.931799E-04  0.362E-01    8.16       1.0  T
   7     -8.6832832  0.320785E-03  0.396E-01    8.16       1.0  T
   8     -8.6838430 -0.559795E-03  0.221E-01    8.16       1.0  T
   9     -8.6838353  0.774513E-05  0.189E-01    8.16       1.0  T
  10     -8.6839388 -0.103479E-03  0.470E-02    8.16       1.0  T
  11     -8.6839405 -0.176484E-05  0.295E-02    8.17       1.5  T
  12     -8.6839421 -0.158514E-05  0.778E-03    8.16       5.7  T
  13     -8.6839422 -0.123250E-06  0.112E-03    8.16      39.9  T
  14     -8.6839422 -0.119645E-08  0.367E-04    8.16     121.8  T
  15     -8.6839422 -0.290985E-09  0.119E-04    8.16     377.1  T
     SCC iter.                  ...        0 min,  0.002 sec
     gradient                   ...        0 min,  0.001 sec
 * total energy  :    -8.5737975 Eh     change       -0.5989470E-01 Eh
   gradient norm :     0.0424141 Eh/α   predicted    -0.4566123E-01 ( -23.76%)
   displ. norm   :     0.1049330 α      lambda       -0.2333843E-02
   maximum displ.:     0.0908517 α      in ANC's #3, #6, #7, ...

........................................................................
.............................. CYCLE    5 ..............................
........................................................................
   1     -8.6764743 -0.867647E+01  0.996E-01    7.55       0.0  T
   2     -8.6726971  0.377725E-02  0.124E+00    7.61       1.0  T
   3     -8.6782627 -0.556567E-02  0.410E-01    7.57       1.0  T
   4     -8.6783862 -0.123413E-03  0.334E-02    7.57       1.3  T
   5     -8.6782787  0.107487E-03  0.128E-01    7.57       1.0  T
   6     -8.6783886 -0.109970E-03  0.166E-02    7.57       2.7  T
   7     -8.6783819  0.674714E-05  0.334E-02    7.57       1.3  T
   8     -8.6783891 -0.724059E-05  0.576E-03    7.58       7.8  T
   9     -8.6783892 -0.902005E-07  0.978E-04    7.57      45.7  T
  10     -8.6783892 -0.146654E-08  0.353E-04    7.57     126.7  T
     SCC iter.                  ...        0 min,  0.001 sec
     gradient                   ...        0 min,  0.001 sec
 * total energy  :    -8.5734051 Eh     change        0.3923219E-03 Eh
   gradient norm :     0.0293606 Eh/α   predicted    -0.1179769E-02 (-400.71%)
   displ. norm   :     0.1143450 α      lambda       -0.2966562E-02
   maximum displ.:     0.1047115 α      in ANC's #3, #6, #7, ...

........................................................................
.............................. CYCLE    6 ..............................
........................................................................
   1     -8.6847506 -0.868475E+01  0.867E-01    8.34       0.0  T
   2     -8.6751372  0.961338E-02  0.181E+00    8.28       1.0  T
   3     -8.6862328 -0.110956E-01  0.337E-01    8.32       1.0  T
   4     -8.6862004  0.324104E-04  0.130E-01    8.32       1.0  T
   5     -8.6859618  0.238566E-03  0.212E-01    8.32       1.0  T
   6     -8.6862372 -0.275404E-03  0.490E-02    8.32       1.0  T
   7     -8.6862110  0.262831E-04  0.710E-02    8.32       1.0  T
   8     -8.6862428 -0.318633E-04  0.758E-03    8.32       5.9  T
   9     -8.6862429 -0.752019E-07  0.456E-03    8.32       9.8  T
  10     -8.6862430 -0.461710E-07  0.506E-04    8.32      88.4  T
  11     -8.6862430 -0.422100E-09  0.188E-04    8.32     238.0  T
     SCC iter.                  ...        0 min,  0.001 sec
     gradient                   ...        0 min,  0.001 sec
 * total energy  :    -8.5741168 Eh     change       -0.7117160E-03 Eh
   gradient norm :     0.0311577 Eh/α   predicted    -0.1502674E-02 ( 111.13%)
   displ. norm   :     0.0429275 α      lambda       -0.1280882E-02
   maximum displ.:     0.0312682 α      in ANC's #7, #6, #3, ...

........................................................................
.............................. CYCLE    7 ..............................
........................................................................
   1     -8.6778531 -0.867785E+01  0.234E-01    8.03       0.0  T
   2     -8.6778031  0.499761E-04  0.199E-01    8.02       1.0  T
   3     -8.6777214  0.817009E-04  0.218E-01    8.03       1.0  T
   4     -8.6778596 -0.138203E-03  0.445E-02    8.03       1.0  T
   5     -8.6778597 -0.150100E-06  0.434E-02    8.03       1.0  T
   6     -8.6778699 -0.101946E-04  0.632E-03    8.03       7.1  T
   7     -8.6778701 -0.122326E-06  0.171E-03    8.03      26.1  T
   8     -8.6778699  0.153724E-06  0.512E-03    8.03       8.7  T
   9     -8.6778701 -0.164894E-06  0.825E-04    8.03      54.2  T
  10     -8.6778701 -0.182461E-08  0.808E-05    8.03     553.8  T
     SCC iter.                  ...        0 min,  0.001 sec
     gradient                   ...        0 min,  0.001 sec
 * total energy  :    -8.5744061 Eh     change       -0.2892755E-03 Eh
   gradient norm :     0.0173443 Eh/α   predicted    -0.6416203E-03 ( 121.80%)
   displ. norm   :     0.0408009 α      lambda       -0.4503075E-03
   maximum displ.:     0.0340931 α      in ANC's #3, #6, #7, ...

........................................................................
.............................. CYCLE    8 ..............................
........................................................................
   1     -8.6835974 -0.868360E+01  0.225E-01    8.04       0.0  T
   2     -8.6830266  0.570738E-03  0.452E-01    8.05       1.0  T
   3     -8.6837260 -0.699370E-03  0.989E-02    8.05       1.0  T
   4     -8.6837276 -0.157709E-05  0.184E-02    8.04       2.4  T
   5     -8.6837167  0.108890E-04  0.440E-02    8.04       1.0  T
   6     -8.6837289 -0.122150E-04  0.711E-03    8.04       6.3  T
   7     -8.6837287  0.250343E-06  0.706E-03    8.04       6.3  T
   8     -8.6837290 -0.319285E-06  0.916E-04    8.04      48.8  T
   9     -8.6837290 -0.327593E-08  0.381E-04    8.04     117.3  T
     SCC iter.                  ...        0 min,  0.001 sec
     gradient                   ...        0 min,  0.001 sec
 * total energy  :    -8.5745559 Eh     change       -0.1498061E-03 Eh
   gradient norm :     0.0045945 Eh/α   predicted    -0.2255274E-03 (  50.55%)
   displ. norm   :     0.0183349 α      lambda       -0.8191685E-04
   maximum displ.:     0.0160604 α      in ANC's #3, #6, #7, ...

........................................................................
.............................. CYCLE    9 ..............................
........................................................................
   1     -8.6823894 -0.868239E+01  0.706E-02    8.08       0.0  T
   2     -8.6823095  0.799064E-04  0.169E-01    8.08       1.0  T
   3     -8.6824030 -0.934553E-04  0.401E-02    8.08       1.1  T
   4     -8.6824014  0.159497E-05  0.232E-02    8.08       1.9  T
   5     -8.6824048 -0.336477E-05  0.530E-03    8.08       8.4  T
   6     -8.6824049 -0.122973E-06  0.223E-03    8.08      20.0  T
   7     -8.6824048  0.906171E-07  0.397E-03    8.08      11.3  T
   8     -8.6824049 -0.100116E-06  0.500E-04    8.08      89.4  T
   9     -8.6824049 -0.676975E-09  0.771E-05    8.08     580.3  T
     SCC iter.                  ...        0 min,  0.001 sec
     gradient                   ...        0 min,  0.001 sec
 * total energy  :    -8.5745891 Eh     change       -0.3320974E-04 Eh
   gradient norm :     0.0018946 Eh/α   predicted    -0.4097251E-04 (  23.37%)
   displ. norm   :     0.0038736 α      lambda       -0.4171496E-05
   maximum displ.:     0.0030837 α      in ANC's #7, #3, #6, ...

........................................................................
.............................. CYCLE   10 ..............................
........................................................................
   1     -8.6824511 -0.868245E+01  0.117E-02    8.07       0.0  T
   2     -8.6824509  0.230661E-06  0.930E-03    8.07       4.8  T
   3     -8.6824507  0.198967E-06  0.131E-02    8.07       3.4  T
   4     -8.6824495  0.121905E-05  0.161E-02    8.07       2.8  T
   5     -8.6824512 -0.170553E-05  0.133E-03    8.07      33.7  T
   6     -8.6824512 -0.363524E-08  0.643E-04    8.07      69.5  T
   7     -8.6824512  0.368359E-08  0.930E-04    8.07      48.1  T
     SCC iter.                  ...        0 min,  0.001 sec
     gradient                   ...        0 min,  0.001 sec
 * total energy  :    -8.5745903 Eh     change       -0.1174085E-05 Eh
   gradient norm :     0.0013173 Eh/α   predicted    -0.2085787E-05 (  77.65%)
   displ. norm   :     0.0012829 α      lambda       -0.1055052E-05
   maximum displ.:     0.0012168 α      in ANC's #7, #6, #3, ...

........................................................................
.............................. CYCLE   11 ..............................
........................................................................
   1     -8.6824729 -0.868247E+01  0.892E-03    8.07       0.0  T
   2     -8.6824709  0.190582E-05  0.198E-02    8.07       2.3  T
   3     -8.6824720 -0.107678E-05  0.126E-02    8.07       3.6  T
   4     -8.6824727 -0.722150E-06  0.766E-03    8.07       5.8  T
   5     -8.6824730 -0.252169E-06  0.537E-04    8.07      83.3  T
   6     -8.6824730  0.159719E-07  0.169E-03    8.07      26.5  T
   7     -8.6824730 -0.154042E-07  0.548E-04    8.07      81.5  T
     SCC iter.                  ...        0 min,  0.001 sec
     gradient                   ...        0 min,  0.001 sec
 * total energy  :    -8.5745911 Eh     change       -0.7723342E-06 Eh
   gradient norm :     0.0001443 Eh/α   predicted    -0.5286504E-06 ( -31.55%)
   displ. norm   :     0.0006641 α      lambda       -0.3995982E-07
   maximum displ.:     0.0004214 α      in ANC's #3, #4, #2, ...

   *** GEOMETRY OPTIMIZATION CONVERGED AFTER 11 ITERATIONS ***

------------------------------------------------------------------------
 total energy gain   :        -0.1454178 Eh      -91.2511 kcal/mol
 total RMSD          :         1.0024421 a0        0.5305 Å
 total power (kW/mol):       -34.7085871 (step)********** (real)
------------------------------------------------------------------------

 ANCopt (total)                0 d,  0 h,  0 min,  0.036 sec
 optimizer setup                ...        0 min,  0.000 sec (  0.210%)
 model hessian                  ...        0 min,  0.000 sec (  0.314%)
 ANC generation                 ...        0 min,  0.000 sec (  0.168%)
 coordinate transformation      ...        0 min,  0.000 sec (  0.069%)
 single point calculation       ...        0 min,  0.035 sec ( 96.766%)
 optimization log               ...        0 min,  0.000 sec (  0.805%)
 hessian update                 ...        0 min,  0.000 sec (  0.065%)
 rational function              ...        0 min,  0.000 sec (  0.701%)

================
 final structure:
================
5
 xtb: 6.2.2 (9d81278992624c895f80dd42a50cac0aa55982e2)
C        -0.48108517417691    0.79140879621842   -0.64565265133412
C         0.02486248130966   -0.01598954365966    0.50865436988981
C         0.85654579671125    0.02547755155672   -0.73524581695109
C        -0.47684732320892   -0.75166703638772   -0.69465106221117
H         0.07652421936492   -0.04923076772777    1.56689516060657

 Bond Distances (Angstroems)
 ---------------------------
C1-C2=1.4968         C1-C3=1.5440         C1-C4=1.5439         C2-C1=1.4968         C2-C3=1.4969         C2-C4=1.4970         
C2-H5=1.0600         C3-C1=1.5440         C3-C2=1.4969         C3-C4=1.5439         C4-C1=1.5439         C4-C2=1.4970         
C4-C3=1.5439         H5-C2=1.0600         
 C  H  Rav=1.0600 sigma=0.0000  Rmin=1.0600  Rmax=1.0600     1
 C  C  Rav=1.5204 sigma=0.0235  Rmin=1.4968  Rmax=1.5440     6

 selected bond angles (degree)
 --------------------
C3-C1-C2= 58.96                C4-C1-C2= 58.96                C4-C1-C3= 60.00                C3-C2-C1= 62.10                
C4-C2-C1= 62.09                C4-C2-C3= 62.09                H5-C2-C1=143.45                H5-C2-C3=143.45                
H5-C2-C4=143.46                C2-C3-C1= 58.95                C4-C3-C1= 60.00                C4-C3-C2= 58.96                
C2-C4-C1= 58.95                C3-C4-C1= 60.01                C3-C4-C2= 58.96                

 selected dihedral angles (degree)
 ---------------------------------
C3-C2-C1-C4= 71.40            C4-C2-C1-C3=288.60            H5-C2-C1-C3=144.30            H5-C2-C1-C4=215.70            
C2-C3-C1-C4=290.33            C4-C3-C1-C2= 69.67            C1-C3-C2-C4= 71.40            C1-C3-C2-H5=215.70            
C4-C3-C2-C1=288.60            C4-C3-C2-H5=144.30            C2-C4-C1-C3= 69.66            C3-C4-C1-C2=290.34            
C1-C4-C2-C3=288.58            C1-C4-C2-H5=144.29            C3-C4-C2-C1= 71.42            C3-C4-C2-H5=215.70            
C1-C4-C3-C2= 69.65            C2-C4-C3-C1=290.35            
           -------------------------------------------------
          |                Final Singlepoint                |
           -------------------------------------------------

          ...................................................
          :                      SETUP                      :
          :.................................................:
          :  # basis functions                  17          :
          :  # atomic orbitals                  17          :
          :  # shells                            9          :
          :  # electrons                        17          :
          :  max. iterations                   250          :
          :  Hamiltonian                  GFN2-xTB          :
          :  restarted?                      false          :
          :  GBSA solvation                  false          :
          :  PC potential                    false          :
          :  electronic temp.          300.0000000     K    :
          :  accuracy                    1.0000000          :
          :  -> integral cutoff          0.2500000E+02      :
          :  -> integral neglect         0.1000000E-07      :
          :  -> SCF convergence          0.1000000E-05 Eh   :
          :  -> wf. convergence          0.1000000E-03 e    :
          :  Broyden damping             0.4000000          :
          ...................................................

 iter      E             dE          RMSdq      gap      omega  full diag
   1     -8.6824730 -0.868247E+01  0.215E-04    8.07       0.0  T
   2     -8.6824730  0.183621E-07  0.180E-03    8.07      24.9  T
   3     -8.6824730 -0.132285E-07  0.103E-03    8.07      43.4  T
   4     -8.6824730 -0.462219E-08  0.434E-04    8.07     102.9  T
   5     -8.6824730 -0.943645E-09  0.871E-05    8.07     513.5  T

   *** convergence criteria satisfied after 5 iterations ***

         #    Occupation            Energy/Eh            Energy/eV
      -------------------------------------------------------------
         1        2.0000           -0.7277712             -19.8037
       ...           ...                  ...                  ...
         4        2.0000           -0.5898933             -16.0518
         5        2.0000           -0.5191956             -14.1280
         6        1.9802           -0.4332756             -11.7900
         7        1.9800           -0.4332663             -11.7898
         8        1.0385           -0.4265097             -11.6059
         9        1.0006           -0.4225751             -11.4989
        10        1.0006           -0.4225210             -11.4974 (HOMO)
        11                         -0.1258118              -3.4235 (LUMO)
        12                         -0.1099787              -2.9927
        13                         -0.1099445              -2.9917
        14                          0.0302911               0.8243
        15                          0.1515875               4.1249
       ...                                ...                  ...
        17                          0.4394697              11.9586
      -------------------------------------------------------------
                  HL-Gap            0.2967092 Eh            8.0739 eV
             Fermi-level           -0.3518667 Eh           -9.5748 eV

 SCC (total)                   0 d,  0 h,  0 min,  0.003 sec
 SCC setup                      ...        0 min,  0.000 sec (  2.624%)
 Dispersion                     ...        0 min,  0.000 sec (  0.484%)
 integral evaluation            ...        0 min,  0.001 sec ( 36.829%)
 zeroth order Hamiltonian       ...        0 min,  0.000 sec (  0.451%)
 iterations                     ...        0 min,  0.001 sec ( 18.086%)
 molecular gradient             ...        0 min,  0.001 sec ( 39.444%)
 printout                       ...        0 min,  0.000 sec (  1.746%)

         :::::::::::::::::::::::::::::::::::::::::::::::::::::
         ::                     SUMMARY                     ::
         :::::::::::::::::::::::::::::::::::::::::::::::::::::
         :: total energy              -8.574591085600 Eh    ::
         :: gradient norm              0.000145574062 Eh/a0 ::
         :: HOMO-LUMO gap              8.073868577447 eV    ::
         ::.................................................::
         :: SCC energy                -8.682472997743 Eh    ::
         :: -> isotropic ES           -0.008443211479 Eh    ::
         :: -> anisotropic ES          0.000584262536 Eh    ::
         :: -> anisotropic XC          0.001887654791 Eh    ::
         :: -> dispersion             -0.002003192669 Eh    ::
         :: repulsion energy           0.107881883371 Eh    ::
         :: add. restraining           0.000000000000 Eh    ::
         :::::::::::::::::::::::::::::::::::::::::::::::::::::

           ------------------------------------------------- 
          |                Numerical Hessian                |
           ------------------------------------------------- 
step length          :   0.00500
SCC accuracy         :   0.30000
Hessian scale factor :   1.00000
frozen atoms in %    :   0.00000    0
RMS gradient         :   0.00015
estimated CPU  time      0.00 min
estimated wall time      0.00 min

writing file <hessian>.

 projected vibrational frequencies (cm-1)
eigval :       -0.00    -0.00     0.00     0.00     0.00     0.00
eigval :     -984.44  -979.54   482.10   482.44   772.50   772.53
eigval :      949.88  1433.15  3272.12
           -------------------------------------------------
          |                Property Printout                |
           -------------------------------------------------

    * Orbital Energies and Occupations

         #    Occupation            Energy/Eh            Energy/eV
      -------------------------------------------------------------
         1        2.0000           -0.7277711             -19.8037
         2        2.0000           -0.6112027             -16.6317
         3        2.0000           -0.5899037             -16.0521
         4        2.0000           -0.5898933             -16.0518
         5        2.0000           -0.5191956             -14.1280
         6        1.9802           -0.4332756             -11.7900
         7        1.9800           -0.4332662             -11.7898
         8        1.0385           -0.4265097             -11.6059
         9        1.0006           -0.4225751             -11.4989
        10        1.0006           -0.4225209             -11.4974 (HOMO)
        11                         -0.1258117              -3.4235 (LUMO)
        12                         -0.1099787              -2.9927
        13                         -0.1099444              -2.9917
        14                          0.0302911               0.8243
        15                          0.1515875               4.1249
        16                          0.1516798               4.1274
        17                          0.4394697              11.9586
      -------------------------------------------------------------
                  HL-Gap            0.2967092 Eh            8.0739 eV
             Fermi-level           -0.3518666 Eh           -9.5748 eV

     #   Z        covCN         q      C6AA      α(0)
     1   6 C      2.924    -0.039    28.978     8.828
     2   6 C      3.859     0.060    19.543     6.287
     3   6 C      2.924    -0.039    28.981     8.828
     4   6 C      2.924    -0.039    28.981     8.828
     5   1 H      0.927     0.059     2.214     2.327

 Mol. C6AA /au·bohr⁶  :        485.656756
 Mol. C8AA /au·bohr⁸  :      13384.431912
 Mol. α(0) /au        :         35.098210


Wiberg/Mayer (AO) data.
largest (>0.10) Wiberg bond orders for each atom
          total WBO             WBO to atom ...
     1  C   2.303        C    2 0.897    C    4 0.699    C    3 0.699
     2  C   3.660        H    5 0.971    C    1 0.897    C    3 0.896    C    4 0.896
     3  C   2.302        C    2 0.896    C    4 0.699    C    1 0.699
     4  C   2.302        C    2 0.896    C    1 0.699    C    3 0.699
     5  H   0.997        C    2 0.971

MOs/occ written to file <molden.input>


molecular dipole:
                 x           y           z       tot (Debye)
 q only:        0.019      -0.012       0.386
   full:        0.056      -0.035       1.160       2.953
molecular quadrupole (traceless):
                xx          xy          yy          xz          yz          zz
Refinement of some symmetry elements was terminated before convergence was reached.
Some symmetry elements may remain unidentified.
Molecule has the following symmetry elements: (C3) 3*(sigma) 
It seems to be the C3v point group
 q only:       -0.266      -0.002      -0.267       0.039      -0.026       0.534
  q+dip:       -0.451      -0.003      -0.451       0.067      -0.046       0.902
   full:       -0.107      -0.001      -0.106       0.017      -0.013       0.213

           -------------------------------------------------
          |                Geometry Summary                 |
           -------------------------------------------------

      molecular mass/u    :       49.0508844
   center of mass at/Å    :       -0.0171666       0.0110424      -0.3514763
  moments of inertia/u·Å² :        0.2862949E+02   0.3113937E+02   0.3114269E+02
rotational constants/cm⁻¹ :        0.5888206E+00   0.5413608E+00   0.5413030E+00

 * 1 selected distances

     #   Z        #   Z                                     value/Å
     2   6 C      5   1 H                                 1.0600224 (max)

 * 1 distinct bonds (by element types)

   Z      Z             #   av. dist./Å        max./Å        min./Å
   1 H    6 C           1     1.0600224     1.0600224     1.0600224

           -------------------------------------------------
          |               Frequency Printout                |
           -------------------------------------------------
 projected vibrational frequencies (cm-1)
eigval :       -0.00    -0.00     0.00     0.00     0.00     0.00
eigval :     -984.44  -979.54   482.10   482.44   772.50   772.53
eigval :      949.88  1433.15  3272.12
 reduced masses (amu)
   1: 11.62   2: 10.86   3: 11.65   4: 11.19   5: 11.94   6: 11.50   7: 12.00   8: 12.00
   9: 11.95  10: 11.94  11:  2.62  12:  2.62  13: 11.72  14: 11.58  15:  1.96
 IR intensities (amu)
   1:  0.19   2:  0.09   3:  0.19   4:  0.08   5:  0.04   6:  0.08   7:  6.48   8:  6.45
   9:  1.64  10:  1.64  11:  0.16  12:  0.14  13:  0.43  14:  0.13  15:  0.00
 Raman intensities (amu)
   1:  0.00   2:  0.00   3:  0.00   4:  0.00   5:  0.00   6:  0.00   7:  0.00   8:  0.00
   9:  0.00  10:  0.00  11:  0.00  12:  0.00  13:  0.00  14:  0.00  15:  0.00
 output can be read by thermo (or use thermo option).
 writing <g98.out> molden fake output.
 recommended (thermochemical) frequency scaling factor: 1.0
           -------------------------------------------------
          |             Thermodynamic Functions             |
           -------------------------------------------------

c3v symmetry found (for desy threshold:  0.10E+00) used in thermo

          ...................................................
          :                      SETUP                      :
          :.................................................:
          :  # frequencies                           7      :
          :  # imaginary freq.                       2      :
          :  linear?                             false      :
          :  only rotor calc.                    false      :
          :  symmetry                              c3v      :
          :  rotational number                       3      :
          :  scaling factor                  1.0000000      :
          :  rotor cutoff                   50.0000000 cm⁻¹ :
          :  imag. cutoff                  -20.0000000 cm⁻¹ :
          :.................................................:

    mode    ω/cm⁻¹     T·S(HO)/kcal·mol⁻¹    T·S(FR)/kcal·mol⁻¹   T·S(vib)
   ------------------------------------------------------------------------
   ------------------------------------------------------------------------

   temp. (K)  partition function   enthalpy   heat capacity  entropy
                                   cal/mol     cal/K/mol   cal/K/mol   J/K/mol
 298.15  VIB   1.30                  439.072      4.503      2.000
         ROT  0.424E+04              888.752      2.981     19.580
         INT  0.553E+04             1327.825      7.484     21.580
         TR   0.332E+27             1481.254      4.968     37.578
         TOT                        2809.0787    12.4521    59.1581   247.5174

   temp. (K)  partition function   enthalpy   heat capacity  entropy
                                   cal/mol     cal/K/mol   cal/K/mol   J/K/mol
 120.00  VIB   1.01                    8.975      0.447      0.088
         ROT  0.108E+04              357.707      2.981     16.868
         INT  0.109E+04              366.682      3.428     16.955
         TR   0.849E+26              596.178      4.968     33.058
         TOT                         962.8597     8.3964    50.0134   209.2562

   temp. (K)  partition function   enthalpy   heat capacity  entropy
                                   cal/mol     cal/K/mol   cal/K/mol   J/K/mol
 100.00  VIB   1.00                    2.745      0.194      0.031
         ROT   824.                  298.089      2.981     16.324
         INT   826.                  300.834      3.175     16.355
         TR   0.646E+26              496.815      4.968     32.153
         TOT                         797.6491     8.1427    48.5085   202.9594

   temp. (K)  partition function   enthalpy   heat capacity  entropy
                                   cal/mol     cal/K/mol   cal/K/mol   J/K/mol
  80.00  VIB   1.00                    0.476      0.052      0.007
         ROT   590.                  238.471      2.981     15.659
         INT   590.                  238.947      3.033     15.665
         TR   0.462E+26              397.452      4.968     31.045
         TOT                         636.3992     8.0009    46.7104   195.4365

   temp. (K)  partition function   enthalpy   heat capacity  entropy
                                   cal/mol     cal/K/mol   cal/K/mol   J/K/mol
  60.00  VIB   1.00                    0.026      0.005      0.000
         ROT   383.                  178.853      2.981     14.801
         INT   383.                  178.880      2.986     14.802
         TR   0.300E+26              298.089      4.968     29.616
         TOT                         476.9686     7.9541    44.4181   185.8454

   temp. (K)  partition function   enthalpy   heat capacity  entropy
                                   cal/mol     cal/K/mol   cal/K/mol   J/K/mol
  40.00  VIB   1.00                    0.000      0.000     -0.000
         ROT   208.                  119.236      2.981     13.593
         INT   208.                  119.236      2.981     13.592
         TR   0.163E+26              198.726      4.968     27.603
         TOT                         317.9617     7.9491    41.1954   172.3618

   temp. (K)  partition function   enthalpy   heat capacity  entropy
                                   cal/mol     cal/K/mol   cal/K/mol   J/K/mol
  20.00  VIB   1.00                    0.000      0.000     -0.000
         ROT   73.7                   59.618      2.981     11.527
         INT   73.7                   59.618      2.981     11.526
         TR   0.577E+25               99.363      4.968     24.161
         TOT                         158.9808     7.9490    35.6871   149.3148

   temp. (K)  partition function   enthalpy   heat capacity  entropy
                                   cal/mol     cal/K/mol   cal/K/mol   J/K/mol
  10.00  VIB   1.00                    0.000      0.000     -0.001
         ROT   26.1                   29.809      2.981      9.460
         INT   26.1                   29.809      2.981      9.460
         TR   0.204E+25               49.681      4.968     20.719
         TOT                          79.4904     7.9490    30.1787   126.2678

       T/K    H(0)-H(T)+PV         H(T)/Eh          T*S/Eh         G(T)/Eh
   ------------------------------------------------------------------------
    298.15    0.447655E-02    0.230772E-01    0.281079E-01   -0.503076E-02
    120.00    0.153441E-02    0.201350E-01    0.956418E-02    0.105708E-01
    100.00    0.127113E-02    0.198717E-01    0.773032E-02    0.121414E-01
     80.00    0.101417E-02    0.196148E-01    0.595503E-02    0.136597E-01
     60.00    0.760098E-03    0.193607E-01    0.424709E-02    0.151136E-01
     40.00    0.506704E-03    0.191073E-01    0.262596E-02    0.164813E-01
     20.00    0.253352E-03    0.188540E-01    0.113742E-02    0.177165E-01
     10.00    0.126676E-03    0.187273E-01    0.480929E-03    0.182463E-01 (used)
   ------------------------------------------------------------------------

         :::::::::::::::::::::::::::::::::::::::::::::::::::::
         ::                  THERMODYNAMIC                  ::
         :::::::::::::::::::::::::::::::::::::::::::::::::::::
         :: total free energy          -8.556344738285 Eh   ::
         ::.................................................::
         :: total energy               -8.574591085393 Eh   ::
         :: zero point energy           0.018600599632 Eh   ::
         :: G(RRHO) w/o ZPVE           -0.000354252524 Eh   ::
         :: G(RRHO) contrib.            0.018246347108 Eh   ::
         :::::::::::::::::::::::::::::::::::::::::::::::::::::
imag cut-off (cm-1) :    5.00
 found            2  significant imaginary frequencies
 writing imag mode distorted coords to xtbhess.xyz
 for further optimization.

optimized geometry written to: xtbopt.xyz


           -------------------------------------------------
          | TOTAL ENERGY               -8.574591085393 Eh   |
          | TOTAL ENTHALPY             -8.555863809745 Eh   |
          | TOTAL FREE ENERGY          -8.556344738285 Eh   |
          | GRADIENT NORM               0.000146160178 Eh/α |
          | HOMO-LUMO GAP               8.073867851768 eV   |
           -------------------------------------------------

------------------------------------------------------------------------
 * finished run on 2020/05/12 at 11:45:08.426     
------------------------------------------------------------------------
 total:
 * wall-time:     0 d,  0 h,  0 min,  0.160 sec
 *  cpu-time:     0 d,  0 h,  0 min,  0.160 sec
 * ratio c/w:     0.998 speedup
 SCF:
 * wall-time:     0 d,  0 h,  0 min,  0.005 sec
 *  cpu-time:     0 d,  0 h,  0 min,  0.005 sec
 * ratio c/w:     0.998 speedup
 ANC optimizer:
 * wall-time:     0 d,  0 h,  0 min,  0.039 sec
 *  cpu-time:     0 d,  0 h,  0 min,  0.039 sec
 * ratio c/w:     0.999 speedup
 numerical hessian:
 * wall-time:     0 d,  0 h,  0 min,  0.096 sec
 *  cpu-time:     0 d,  0 h,  0 min,  0.096 sec
 * ratio c/w:     0.997 speedup

