      -----------------------------------------------------------      
     |                   =====================                   |     
     |                           x T B                           |     
     |                   =====================                   |     
     |                         S. Grimme                         |     
     |          Mulliken Center for Theoretical Chemistry        |     
     |                    University of Bonn                     |     
      -----------------------------------------------------------      

   * xtb version 6.2.2 (9d81278992624c895f80dd42a50cac0aa55982e2) compiled by '@Darwin' on 04/03/2020

   xtb is free software: you can redistribute it and/or modify it under
   the terms of the GNU Lesser General Public License as published by
   the Free Software Foundation, either version 3 of the License, or
   (at your option) any later version.
   
   xtb is distributed in the hope that it will be useful,
   but WITHOUT ANY WARRANTY; without even the implied warranty of
   MERCHANTABILITY or FITNESS FOR A PARTICULAR PURPOSE.  See the
   GNU Lesser General Public License for more details.
   
   Cite this work as:
   * S. Grimme, C. Bannwarth, P. Shushkov, J. Chem. Theory Comput., 2017,
     13, 1989-2009. DOI: 10.1021/acs.jctc.7b00118
   * C. Bannwarth, S. Ehlert and S. Grimme., J. Chem. Theory Comput., 2019,
     15, 1652-1671. DOI: 10.1021/acs.jctc.8b01176
   * P. Pracht, E. Caldeweyher, S. Ehlert, S. Grimme, ChemRxiv, 2019, preprint.
     DOI: 10.26434/chemrxiv.8326202.v1
   
   for DFT-D4:
   * E. Caldeweyher, C. Bannwarth and S. Grimme, J. Chem. Phys., 2017,
     147, 034112. DOI: 10.1063/1.4993215
   * E. Caldeweyher, S. Ehlert, A. Hansen, H. Neugebauer, S. Spicher,
     C. Bannwarth and S. Grimme, J. Chem. Phys., 2019, 150, 154122.
     DOI: 10.1063/1.5090222
   
   for sTDA-xTB:
   * S. Grimme and C. Bannwarth, J. Chem. Phys., 2016, 145, 054103.
     DOI: 10.1063/1.4959605
   
   in the mass-spec context:
   * V. Asgeirsson, C. Bauer and S. Grimme, Chem. Sci., 2017, 8, 4879.
     DOI: 10.1039/c7sc00601b
   
   for metadynamics refer to:
   * S. Grimme, J. Chem. Theory Comput., 2019, 155, 2847-2862
     DOI: 10.1021/acs.jctc.9b00143
   
   with help from (in alphabetical order)
   C. Bannwarth, F. Bohle, G. Brandenburg, E. Caldeweyher, M. Checinski,
   S. Dohm, S. Ehlert, S. Ehrlich, F. März, H. Neugebauer, J. Pisarek,
   P. Pracht, P. Shushkov, and S. Spicher.
   
 * started run on 2020/05/12 at 11:44:02.525     

           -------------------------------------------------
          |                Calculation Setup                |
           -------------------------------------------------

          program call               : xtb --input C4N1_11_S_3.input C4N1_11_S_3.xyz --ohess --molden --namespace C4N1_11_S_3 output.out
          calculation namespace      : C4N1_11_S_3
          coordinate file            : C4N1_11_S_3.xyz
          number of atoms            :                     5
          number of electrons        :                    21
          charge                     :                     0
          spin                       :                   1.5
          first test random number   :      0.30559144688902

   ID    Z sym.   atoms
    1    6 C      1, 2, 4, 5
    2    7 N      3

           -------------------------------------------------
          |                 G F N 2 - x T B                 |
           -------------------------------------------------

        Reference                      10.1021/acs.jctc.8b01176
      * Hamiltonian:
        H0-scaling (s, p, d)           1.850000    2.230000    2.230000
        zeta-weighting                 0.500000
      * Dispersion:
        s8                             2.700000
        a1                             0.520000
        a2                             5.000000
        s9                             5.000000
      * Repulsion:
        kExp                           1.500000    1.000000
        rExp                           1.000000
      * Coulomb:
        alpha                          2.000000
        third order                    shell-resolved
        anisotropic                    true
        a3                             3.000000
        a5                             4.000000
        cn-shift                       1.200000
        cn-exp                         4.000000
        max-rad                        5.000000


          ...................................................
          :                      SETUP                      :
          :.................................................:
          :  # basis functions                  20          :
          :  # atomic orbitals                  20          :
          :  # shells                           10          :
          :  # electrons                        21          :
          :  max. iterations                   250          :
          :  Hamiltonian                  GFN2-xTB          :
          :  restarted?                      false          :
          :  GBSA solvation                  false          :
          :  PC potential                    false          :
          :  electronic temp.          300.0000000     K    :
          :  accuracy                    1.0000000          :
          :  -> integral cutoff          0.2500000E+02      :
          :  -> integral neglect         0.1000000E-07      :
          :  -> SCF convergence          0.1000000E-05 Eh   :
          :  -> wf. convergence          0.1000000E-03 e    :
          :  Broyden damping             0.4000000          :
          ...................................................

 iter      E             dE          RMSdq      gap      omega  full diag
   1    -10.7887839 -0.107888E+02  0.111E+01    0.38       0.0  T
   2    -10.2085989  0.580185E+00  0.101E+01    0.31       1.0  T
   3    -10.0736156  0.134983E+00  0.107E+01    0.34       1.0  T
   4    -10.7044227 -0.630807E+00  0.656E+00    0.27       1.0  T
   5    -10.8670971 -0.162674E+00  0.302E+00    0.37       1.0  T
   6    -10.8932878 -0.261907E-01  0.240E+00    0.32       1.0  T
   7    -10.7852076  0.108080E+00  0.401E+00    0.41       1.0  T
   8    -10.8926172 -0.107410E+00  0.165E+00    0.31       1.0  T
   9    -10.8991525 -0.653530E-02  0.563E-01    0.32       1.0  T
  10    -10.8987479  0.404590E-03  0.387E-01    0.32       1.0  T
  11    -10.8996198 -0.871858E-03  0.113E-01    0.32       1.0  T
  12    -10.8995805  0.392977E-04  0.134E-01    0.33       1.0  T
  13    -10.8997177 -0.137217E-03  0.260E-02    0.33       1.7  T
  14    -10.8997203 -0.260629E-05  0.130E-02    0.33       3.4  T
  15    -10.8997193  0.977758E-06  0.153E-02    0.33       2.9  T
  16    -10.8997208 -0.144850E-05  0.102E-03    0.33      43.9  T
  17    -10.8997208 -0.458694E-08  0.541E-04    0.33      82.6  T
  18    -10.8997208 -0.189686E-08  0.155E-04    0.33     289.1  T

   *** convergence criteria satisfied after 18 iterations ***

         #    Occupation            Energy/Eh            Energy/eV
      -------------------------------------------------------------
         1        2.0000           -0.7648135             -20.8116
       ...           ...                  ...                  ...
         6        2.0000           -0.5532939             -15.0559
         7        2.0000           -0.5345257             -14.5452
         8        2.0000           -0.5142257             -13.9928
         9        1.9999           -0.4897114             -13.3257
        10        1.0001           -0.4710513             -12.8180
        11        0.9999           -0.4361995             -11.8696
        12        0.9982           -0.4329045             -11.7799 (HOMO)
        13        0.0018           -0.4208905             -11.4530 (LUMO)
        14                         -0.4068030             -11.0697
        15                         -0.3752586             -10.2113
        16                         -0.1425281              -3.8784
        17                         -0.0102842              -0.2798
       ...                                ...                  ...
        20                          0.2142742               5.8307
      -------------------------------------------------------------
                  HL-Gap            0.0120141 Eh            0.3269 eV
             Fermi-level           -0.4536321 Eh          -12.3440 eV

 SCC (total)                   0 d,  0 h,  0 min,  0.005 sec
 SCC setup                      ...        0 min,  0.000 sec (  2.198%)
 Dispersion                     ...        0 min,  0.000 sec (  0.318%)
 integral evaluation            ...        0 min,  0.002 sec ( 31.379%)
 zeroth order Hamiltonian       ...        0 min,  0.000 sec (  0.706%)
 iterations                     ...        0 min,  0.002 sec ( 40.735%)
 molecular gradient             ...        0 min,  0.001 sec ( 23.178%)
 printout                       ...        0 min,  0.000 sec (  1.314%)

         :::::::::::::::::::::::::::::::::::::::::::::::::::::
         ::                     SUMMARY                     ::
         :::::::::::::::::::::::::::::::::::::::::::::::::::::
         :: total energy             -10.828101378623 Eh    ::
         :: gradient norm              0.196243834663 Eh/a0 ::
         :: HOMO-LUMO gap              0.326919563987 eV    ::
         ::.................................................::
         :: SCC energy               -10.899720758339 Eh    ::
         :: -> isotropic ES           -0.030842746228 Eh    ::
         :: -> anisotropic ES          0.001750209926 Eh    ::
         :: -> anisotropic XC          0.011114984422 Eh    ::
         :: -> dispersion             -0.002965668338 Eh    ::
         :: repulsion energy           0.071619191200 Eh    ::
         :: add. restraining           0.000000000000 Eh    ::
         :::::::::::::::::::::::::::::::::::::::::::::::::::::

      ----------------------------------------------------------- 
     |                   =====================                   |
     |                        A N C O P T                        |
     |                   =====================                   |
     |               Approximate Normal Coordinate               |
     |                Rational Function Optimizer                |
      ----------------------------------------------------------- 

          ...................................................
          :                      SETUP                      :
          :.................................................:
          :   optimization level            normal          :
          :   max. optcycles                   200          :
          :   ANC micro-cycles                  20          :
          :   degrees of freedom                 9          :
          :.................................................:
          :   RF solver                   davidson          :
          :   write xtbopt.log                true          :
          :   linear?                        false          :
          :   energy convergence         0.5000000E-05 Eh   :
          :   grad. convergence          0.1000000E-02 Eh/α :
          :   maximium RF displ.         1.0000000          :
          :   Hlow (freq-cutoff)         0.1000000E-01      :
          :   Hmax (freq-cutoff)         5.0000000          :
          :   S6 in model hess.         20.0000000          :
          ...................................................

generating ANC from model Hessian ...
Using Lindh-Hessian (1995)
 Shifting diagonal of input Hessian by    0.0000000000000000     
 Lowest  eigenvalues of input Hessian
   -0.000000   -0.000000    0.000000    0.000000    0.000000    0.000000
    0.062775    0.065777    0.087791    0.132645    0.405943    0.844079
    0.922753    1.129717    1.570958
 Highest eigenvalues
    0.132645    0.405943    0.844079    0.922753    1.129717    1.570958


........................................................................
.............................. CYCLE    1 ..............................
........................................................................
   1    -10.8997208 -0.108997E+02  0.546E-05    0.33       0.0  T
   2    -10.8997208  0.137146E-08  0.382E-04    0.33     117.0  T
   3    -10.8997208 -0.117092E-08  0.154E-04    0.33     289.7  T
     SCC iter.                  ...        0 min,  0.000 sec
     gradient                   ...        0 min,  0.002 sec
 * total energy  :   -10.8281014 Eh     change       -0.9463861E-09 Eh
   gradient norm :     0.1962431 Eh/α   predicted     0.0000000E+00 (-100.00%)
   displ. norm   :     0.3254466 α      lambda       -0.4861653E-01
   maximum displ.:     0.2152597 α      in ANC's #3, #7, #1, ...

........................................................................
.............................. CYCLE    2 ..............................
........................................................................
   1    -10.9633138 -0.109633E+02  0.243E+00    0.63       0.0  T
   2    -10.9540281  0.928563E-02  0.163E+00    0.65       1.0  T
   3    -10.8445290  0.109499E+00  0.395E+00    0.61       1.0  T
   4    -10.9672899 -0.122761E+00  0.998E-01    0.63       1.0  T
   5    -10.9691998 -0.190993E-02  0.425E-01    0.62       1.0  T
   6    -10.9689406  0.259168E-03  0.387E-01    0.62       1.0  T
   7    -10.9684110  0.529661E-03  0.400E-01    0.62       1.0  T
   8    -10.9690889 -0.677947E-03  0.302E-01    0.62       1.0  T
   9    -10.9692877 -0.198770E-03  0.234E-01    0.62       1.0  T
  10    -10.9693518 -0.641646E-04  0.192E-01    0.62       1.0  T
  11    -10.9694424 -0.905259E-04  0.120E-01    0.62       1.0  T
  12    -10.9694975 -0.551301E-04  0.283E-02    0.62       1.6  T
  13    -10.9695008 -0.327081E-05  0.242E-03    0.62      18.5  T
  14    -10.9695008 -0.190333E-07  0.865E-04    0.62      51.7  T
  15    -10.9695008 -0.206968E-08  0.259E-04    0.62     172.4  T
     SCC iter.                  ...        0 min,  0.001 sec
     gradient                   ...        0 min,  0.001 sec
 * total energy  :   -10.8702639 Eh     change       -0.4216250E-01 Eh
   gradient norm :     0.1394941 Eh/α   predicted    -0.2688290E-01 ( -36.24%)
   displ. norm   :     0.5490372 α      lambda       -0.6382266E-01
   maximum displ.:     0.3830502 α      in ANC's #3, #7, #5, ...

........................................................................
.............................. CYCLE    3 ..............................
........................................................................
   1    -10.9592579 -0.109593E+02  0.636E+00    1.23       0.0  T
   2    -10.2097724  0.749485E+00  0.995E+00    0.70       1.0  T
   3    -10.9850155 -0.775243E+00  0.426E+00    1.23       1.0  T
   4    -11.0313258 -0.463103E-01  0.360E+00    1.21       1.0  T
   5    -11.0870018 -0.556760E-01  0.235E+00    1.23       1.0  T
   6    -11.0279960  0.590058E-01  0.292E+00    1.22       1.0  T
   7    -11.0744606 -0.464646E-01  0.249E+00    1.22       1.0  T
   8    -11.0778052 -0.334456E-02  0.220E+00    1.22       1.0  T
   9    -11.0889219 -0.111167E-01  0.157E+00    1.21       1.0  T
  10    -11.1026121 -0.136902E-01  0.753E-01    1.21       1.0  T
  11    -11.1041331 -0.152095E-02  0.603E-01    1.21       1.0  T
  12    -11.1015853  0.254782E-02  0.719E-01    1.21       1.0  T
  13    -11.1058440 -0.425871E-02  0.146E-01    1.21       1.0  T
  14    -11.1058130  0.309793E-04  0.164E-01    1.21       1.0  T
  15    -11.1060390 -0.225981E-03  0.902E-03    1.21       5.0  T
  16    -11.1060353  0.367835E-05  0.221E-02    1.21       2.0  T
  17    -11.1060392 -0.392418E-05  0.374E-03    1.21      12.0  T
  18    -11.1060393 -0.916210E-07  0.132E-03    1.21      34.0  T
  19    -11.1060393 -0.130982E-07  0.230E-04    1.21     194.6  T
  20    -11.1060393 -0.367956E-09  0.620E-05    1.21     721.7  T
     SCC iter.                  ...        0 min,  0.002 sec
     gradient                   ...        0 min,  0.002 sec
 * total energy  :   -10.8855939 Eh     change       -0.1533001E-01 Eh
   gradient norm :     0.2406068 Eh/α   predicted    -0.4153074E-01 ( 170.91%)
   displ. norm   :     0.2187759 α      lambda       -0.4364549E-01
   maximum displ.:     0.1668651 α      in ANC's #7, #1, #3, ...

........................................................................
.............................. CYCLE    4 ..............................
........................................................................
   1    -11.0026720 -0.110027E+02  0.242E+00    0.78       0.0  T
   2    -10.7985619  0.204110E+00  0.499E+00    1.24       1.0  T
   3    -11.0256179 -0.227056E+00  0.134E+00    0.97       1.0  T
   4    -11.0267944 -0.117647E-02  0.110E+00    1.05       1.0  T
   5    -11.0249955  0.179892E-02  0.110E+00    0.97       1.0  T
   6    -11.0316140 -0.661853E-02  0.655E-01    1.01       1.0  T
   7    -11.0350309 -0.341693E-02  0.122E-01    1.05       1.0  T
   8    -11.0348360  0.194974E-03  0.176E-01    1.05       1.0  T
   9    -11.0350470 -0.211078E-03  0.103E-01    1.05       1.0  T
  10    -11.0351333 -0.863159E-04  0.127E-02    1.04       3.5  T
  11    -11.0351337 -0.319711E-06  0.100E-02    1.04       4.5  T
  12    -11.0351344 -0.717367E-06  0.289E-03    1.04      15.5  T
  13    -11.0351344 -0.519573E-07  0.702E-04    1.04      63.7  T
  14    -11.0351344  0.275877E-07  0.202E-03    1.04      22.1  T
  15    -11.0351344 -0.304220E-07  0.236E-04    1.04     189.9  T
     SCC iter.                  ...        0 min,  0.001 sec
     gradient                   ...        0 min,  0.001 sec
 * total energy  :   -10.9005411 Eh     change       -0.1494718E-01 Eh
   gradient norm :     0.0520089 Eh/α   predicted    -0.2286724E-01 (  52.99%)
   displ. norm   :     0.2004105 α      lambda       -0.5021569E-02
   maximum displ.:     0.1887654 α      in ANC's #3, #7, #1, ...

........................................................................
.............................. CYCLE    5 ..............................
........................................................................
   1    -10.9682891 -0.109683E+02  0.331E+00    0.99       0.0  T
   2    -10.1130493  0.855240E+00  0.102E+01    0.57       1.0  T
   3    -10.9994654 -0.886416E+00  0.234E+00    0.56       1.0  T
   4    -11.0344894 -0.350239E-01  0.142E+00    0.85       1.0  T
   5    -11.0068599  0.276295E-01  0.207E+00    0.96       1.0  T
   6    -11.0342496 -0.273897E-01  0.132E+00    0.84       1.0  T
   7    -11.0368072 -0.255760E-02  0.117E+00    0.85       1.0  T
   8    -11.0420815 -0.527431E-02  0.721E-01    0.87       1.0  T
   9    -11.0427842 -0.702759E-03  0.639E-01    0.88       1.0  T
  10    -11.0450201 -0.223585E-02  0.119E-01    0.89       1.0  T
  11    -11.0448633  0.156796E-03  0.128E-01    0.90       1.0  T
  12    -11.0449866 -0.123309E-03  0.104E-01    0.89       1.0  T
  13    -11.0450070 -0.204251E-04  0.433E-02    0.89       1.0  T
  14    -11.0450248 -0.178447E-04  0.163E-02    0.89       2.8  T
  15    -11.0450251 -0.236004E-06  0.484E-03    0.89       9.2  T
  16    -11.0450253 -0.218305E-06  0.134E-03    0.89      33.4  T
  17    -11.0450253 -0.876815E-08  0.161E-04    0.89     277.2  T
  18    -11.0450253 -0.178858E-09  0.463E-05    0.89     966.6  T
     SCC iter.                  ...        0 min,  0.002 sec
     gradient                   ...        0 min,  0.001 sec
 * total energy  :   -10.9040900 Eh     change       -0.3548909E-02 Eh
   gradient norm :     0.0245126 Eh/α   predicted    -0.2611628E-02 ( -26.41%)
   displ. norm   :     0.1946425 α      lambda       -0.2621381E-02
   maximum displ.:     0.1697388 α      in ANC's #3, #1, #7, ...

........................................................................
.............................. CYCLE    6 ..............................
........................................................................
   1    -11.0363290 -0.110363E+02  0.191E+00    0.79       0.0  T
   2    -10.8357704  0.200559E+00  0.458E+00    0.03       1.0  T
   3    -11.0473644 -0.211594E+00  0.145E+00    0.69       1.0  T
   4    -11.0389864  0.837802E-02  0.147E+00    0.78       1.0  T
   5    -11.0461557 -0.716927E-02  0.138E+00    0.67       1.0  T
   6    -11.0482866 -0.213097E-02  0.128E+00    0.68       1.0  T
   7    -11.0521691 -0.388243E-02  0.987E-01    0.70       1.0  T
   8    -11.0558999 -0.373087E-02  0.602E-01    0.72       1.0  T
   9    -11.0573420 -0.144210E-02  0.391E-01    0.72       1.0  T
  10    -11.0574535 -0.111451E-03  0.341E-01    0.75       1.0  T
  11    -11.0580211 -0.567639E-03  0.215E-01    0.73       1.0  T
  12    -11.0583016 -0.280487E-03  0.672E-02    0.74       1.0  T
  13    -11.0583380 -0.363917E-04  0.432E-03    0.74      10.4  T
  14    -11.0583379  0.136521E-06  0.396E-03    0.74      11.3  T
  15    -11.0583372  0.711966E-06  0.108E-02    0.74       4.1  T
  16    -11.0583379 -0.727502E-06  0.414E-03    0.74      10.8  T
  17    -11.0583380 -0.129396E-06  0.150E-05    0.74    2980.6  T
  18    -11.0583380  0.106208E-09  0.117E-04    0.74     383.3  T
     SCC iter.                  ...        0 min,  0.002 sec
     gradient                   ...        0 min,  0.001 sec
 * total energy  :   -10.9054648 Eh     change       -0.1374768E-02 Eh
   gradient norm :     0.0200441 Eh/α   predicted    -0.1360349E-02 (  -1.05%)
   displ. norm   :     0.1025101 α      lambda       -0.6736520E-03
   maximum displ.:     0.0960537 α      in ANC's #3, #6, #1, ...

........................................................................
.............................. CYCLE    7 ..............................
........................................................................
   1    -11.0550283 -0.110550E+02  0.433E-01    0.59       0.0  T
   2    -11.0530191  0.200925E-02  0.516E-01    0.57       1.0  T
   3    -10.9984214  0.545977E-01  0.257E+00    0.66       1.0  T
   4    -11.0550417 -0.566203E-01  0.562E-02    0.59       1.0  T
   5    -11.0549375  0.104200E-03  0.128E-01    0.59       1.0  T
   6    -11.0548644  0.731025E-04  0.154E-01    0.58       1.0  T
   7    -11.0550461 -0.181750E-03  0.365E-02    0.59       1.2  T
   8    -11.0550462 -0.582602E-07  0.342E-02    0.59       1.3  T
   9    -11.0550493 -0.312965E-05  0.268E-02    0.59       1.7  T
  10    -11.0550517 -0.243450E-05  0.194E-02    0.59       2.3  T
  11    -11.0550544 -0.265196E-05  0.358E-03    0.59      12.5  T
  12    -11.0550545 -0.861155E-07  0.107E-03    0.59      41.8  T
  13    -11.0550545 -0.807615E-08  0.268E-04    0.59     166.7  T
  14    -11.0550545 -0.540981E-09  0.573E-06    0.59    7799.2  T
     SCC iter.                  ...        0 min,  0.001 sec
     gradient                   ...        0 min,  0.001 sec
 * total energy  :   -10.9060609 Eh     change       -0.5961054E-03 Eh
   gradient norm :     0.0173153 Eh/α   predicted    -0.3403653E-03 ( -42.90%)
   displ. norm   :     0.6155597 α      lambda       -0.3756517E-02
   maximum displ.:     0.5598504 α      in ANC's #3, #6, #1, ...

........................................................................
.............................. CYCLE    8 ..............................
........................................................................
   1    -10.9577286 -0.109577E+02  0.632E+00    0.64       0.0  T
   2     -9.6850719  0.127266E+01  0.105E+01    1.35       1.0  T
   3    -10.8816933 -0.119662E+01  0.488E+00    0.98       1.0  T
   4    -10.9659931 -0.842999E-01  0.270E+00    0.46       1.0  T
   5    -11.0426946 -0.767014E-01  0.261E+00    0.20       1.0  T
   6    -11.0489948 -0.630025E-02  0.233E+00    0.21       1.0  T
   7    -10.9672711  0.817238E-01  0.349E+00    0.10       1.0  T
   8    -10.9723339 -0.506283E-02  0.328E+00    0.11       1.0  T
   9    -10.9803665 -0.803259E-02  0.314E+00    0.12       1.0  T
  10    -10.9950602 -0.146937E-01  0.284E+00    0.13       1.0  T
  11    -11.0179831 -0.229228E-01  0.223E+00    0.14       1.0  T
  12    -11.0232467 -0.526365E-02  0.208E+00    0.15       1.0  T
  13    -11.0568182 -0.335715E-01  0.148E-01    0.18       1.0  T
  14    -11.0554304  0.138777E-02  0.466E-01    0.17       1.0  T
  15    -11.0568371 -0.140670E-02  0.109E-01    0.18       1.0  T
  16    -11.0569264 -0.892980E-04  0.150E-02    0.18       3.0  T
  17    -11.0569142  0.121969E-04  0.445E-02    0.18       1.0  T
  18    -11.0569263 -0.121150E-04  0.134E-02    0.18       3.3  T
  19    -11.0569279 -0.157902E-05  0.216E-03    0.18      20.7  T
  20    -11.0569279 -0.116423E-08  0.116E-03    0.18      38.5  T
  21    -11.0569279  0.106647E-07  0.131E-03    0.18      34.1  T
  22    -11.0569279 -0.782907E-08  0.730E-04    0.18      61.2  T
  23    -11.0569279 -0.379819E-08  0.746E-05    0.18     599.6  T
     SCC iter.                  ...        0 min,  0.002 sec
     gradient                   ...        0 min,  0.001 sec
 * total energy  :   -10.9291759 Eh     change       -0.2311508E-01 Eh
   gradient norm :     0.1610713 Eh/α   predicted    -0.2589944E-02 ( -88.80%)
   displ. norm   :     0.8899497 α      lambda       -0.1078960E+00
   maximum displ.:     0.8511425 α      in ANC's #3, #6, #5, ...

........................................................................
.............................. CYCLE    9 ..............................
........................................................................
   1    -11.1605525 -0.111606E+02  0.619E+00    1.94       0.0  T
   2    -11.1508918  0.966073E-02  0.421E+00    2.20       1.0  T
   3    -10.9642946  0.186597E+00  0.528E+00    1.46       1.0  T
   4    -11.1674668 -0.203172E+00  0.727E-01    2.08       1.0  T
   5    -11.1706561 -0.318931E-02  0.281E-01    2.05       1.0  T
   6    -11.1708326 -0.176498E-03  0.160E-01    2.05       1.0  T
   7    -11.1708637 -0.311062E-04  0.511E-02    2.03       1.0  T
   8    -11.1708724 -0.869873E-05  0.990E-03    2.04       4.5  T
   9    -11.1708725 -0.105472E-06  0.242E-03    2.04      18.5  T
  10    -11.1708726 -0.209430E-07  0.699E-04    2.04      63.9  T
  11    -11.1708725  0.100698E-08  0.515E-04    2.04      86.8  T
     SCC iter.                  ...        0 min,  0.001 sec
     gradient                   ...        0 min,  0.001 sec
 * total energy  :   -10.9674303 Eh     change       -0.3825438E-01 Eh
   gradient norm :     0.2775034 Eh/α   predicted    -0.9667532E-01 ( 152.72%)
   displ. norm   :     0.4502260 α      lambda       -0.1053133E+00
   maximum displ.:     0.4315085 α      in ANC's #3, #5, #6, ...

........................................................................
.............................. CYCLE   10 ..............................
........................................................................
   1    -11.0981387 -0.110981E+02  0.326E+00    1.47       0.0  T
   2    -10.8772780  0.220861E+00  0.425E+00    1.02       1.0  T
   3    -11.0021610 -0.124883E+00  0.358E+00    1.47       1.0  T
   4    -11.0692733 -0.671123E-01  0.217E+00    1.62       1.0  T
   5    -11.0795429 -0.102696E-01  0.157E+00    1.66       1.0  T
   6    -11.0878558 -0.831292E-02  0.131E+00    1.69       1.0  T
   7    -11.0891561 -0.130025E-02  0.124E+00    1.68       1.0  T
   8    -11.0973749 -0.821882E-02  0.732E-01    1.55       1.0  T
   9    -11.0992144 -0.183947E-02  0.541E-01    1.48       1.0  T
  10    -11.1015614 -0.234701E-02  0.734E-02    1.33       1.0  T
  11    -11.1015950 -0.336030E-04  0.412E-02    1.32       1.1  T
  12    -11.1015900  0.498142E-05  0.493E-02    1.32       1.0  T
  13    -11.1016028 -0.128614E-04  0.201E-02    1.32       2.2  T
  14    -11.1016053 -0.246993E-05  0.857E-03    1.31       5.2  T
  15    -11.1016059 -0.620697E-06  0.235E-03    1.31      19.0  T
  16    -11.1016060 -0.225211E-07  0.133E-03    1.31      33.5  T
  17    -11.1016060 -0.140822E-07  0.257E-04    1.31     174.0  T
  18    -11.1016060 -0.396541E-09  0.137E-04    1.31     326.5  T
     SCC iter.                  ...        0 min,  0.002 sec
     gradient                   ...        0 min,  0.001 sec
 * total energy  :   -10.9798265 Eh     change       -0.1239620E-01 Eh
   gradient norm :     0.1523235 Eh/α   predicted    -0.6333034E-01 ( 410.89%)
   displ. norm   :     0.3115623 α      lambda       -0.2350563E-01
   maximum displ.:     0.2179314 α      in ANC's #5, #1, #7, ...

........................................................................
.............................. CYCLE   11 ..............................
........................................................................
   1    -11.1372298 -0.111372E+02  0.131E+00    2.18       0.0  T
   2    -11.1374543 -0.224428E-03  0.749E-01    2.23       1.0  T
   3    -11.1363094  0.114488E-02  0.537E-01    2.15       1.0  T
   4    -11.1377664 -0.145699E-02  0.134E-01    2.21       1.0  T
   5    -11.1378379 -0.714976E-04  0.609E-02    2.20       1.0  T
   6    -11.1378390 -0.116678E-05  0.207E-02    2.20       2.2  T
   7    -11.1378422 -0.312154E-05  0.504E-03    2.20       8.9  T
   8    -11.1378422 -0.221902E-07  0.193E-03    2.20      23.1  T
   9    -11.1378422 -0.397516E-08  0.500E-04    2.20      89.4  T
  10    -11.1378422 -0.933014E-09  0.326E-04    2.20     137.1  T
     SCC iter.                  ...        0 min,  0.001 sec
     gradient                   ...        0 min,  0.001 sec
 * total energy  :   -10.9978539 Eh     change       -0.1802743E-01 Eh
   gradient norm :     0.0774530 Eh/α   predicted    -0.1289368E-01 ( -28.48%)
   displ. norm   :     0.2350417 α      lambda       -0.1155584E-01
   maximum displ.:     0.1637417 α      in ANC's #5, #6, #7, ...

........................................................................
.............................. CYCLE   12 ..............................
........................................................................
   1    -11.1706417 -0.111706E+02  0.127E+00    2.43       0.0  T
   2    -11.1708945 -0.252791E-03  0.724E-01    2.43       1.0  T
   3    -11.1704852  0.409285E-03  0.366E-01    2.48       1.0  T
   4    -11.1710295 -0.544311E-03  0.116E-01    2.41       1.0  T
   5    -11.1710770 -0.475153E-04  0.480E-02    2.44       1.0  T
   6    -11.1710770  0.873993E-07  0.191E-02    2.44       2.3  T
   7    -11.1710791 -0.212303E-05  0.532E-03    2.44       8.4  T
   8    -11.1710791 -0.904504E-08  0.151E-03    2.44      29.6  T
   9    -11.1710791 -0.335544E-08  0.369E-04    2.44     121.3  T
  10    -11.1710791  0.477234E-09  0.296E-04    2.44     151.3  T
     SCC iter.                  ...        0 min,  0.001 sec
     gradient                   ...        0 min,  0.001 sec
 * total energy  :   -11.0010997 Eh     change       -0.3245756E-02 Eh
   gradient norm :     0.0623948 Eh/α   predicted    -0.6097117E-02 (  87.85%)
   displ. norm   :     0.0805923 α      lambda       -0.3124492E-02
   maximum displ.:     0.0588988 α      in ANC's #5, #1, #7, ...

........................................................................
.............................. CYCLE   13 ..............................
........................................................................
   1    -11.1613592 -0.111614E+02  0.451E-01    2.56       0.0  T
   2    -11.1613814 -0.222049E-04  0.261E-01    2.58       1.0  T
   3    -11.1612546  0.126833E-03  0.187E-01    2.54       1.0  T
   4    -11.1614388 -0.184183E-03  0.349E-02    2.57       1.3  T
   5    -11.1614432 -0.444675E-05  0.152E-02    2.57       2.9  T
   6    -11.1614433 -0.107552E-06  0.659E-03    2.57       6.8  T
   7    -11.1614436 -0.238409E-06  0.134E-03    2.57      33.3  T
   8    -11.1614436  0.668248E-10  0.596E-04    2.57      75.1  T
   9    -11.1614436  0.107203E-08  0.596E-04    2.57      75.1  T
     SCC iter.                  ...        0 min,  0.001 sec
     gradient                   ...        0 min,  0.001 sec
 * total energy  :   -11.0026560 Eh     change       -0.1556308E-02 Eh
   gradient norm :     0.0144041 Eh/α   predicted    -0.1572392E-02 (   1.03%)
   displ. norm   :     0.0494204 α      lambda       -0.4638824E-03
   maximum displ.:     0.0392085 α      in ANC's #1, #6, #7, ...

........................................................................
.............................. CYCLE   14 ..............................
........................................................................
   1    -11.1623533 -0.111624E+02  0.219E-01    2.64       0.0  T
   2    -11.1623577 -0.441187E-05  0.135E-01    2.64       1.0  T
   3    -11.1623369  0.208359E-04  0.948E-02    2.65       1.0  T
   4    -11.1623694 -0.325326E-04  0.228E-02    2.64       2.0  T
   5    -11.1623713 -0.190791E-05  0.972E-03    2.64       4.6  T
   6    -11.1623714 -0.554201E-07  0.202E-03    2.64      22.2  T
   7    -11.1623714 -0.185791E-07  0.108E-03    2.64      41.2  T
   8    -11.1623714  0.351858E-08  0.890E-04    2.64      50.2  T
   9    -11.1623714 -0.569120E-08  0.187E-04    2.64     238.8  T
     SCC iter.                  ...        0 min,  0.001 sec
     gradient                   ...        0 min,  0.002 sec
 * total energy  :   -11.0030410 Eh     change       -0.3850166E-03 Eh
   gradient norm :     0.0094536 Eh/α   predicted    -0.2325089E-03 ( -39.61%)
   displ. norm   :     0.1081929 α      lambda       -0.7887997E-03
   maximum displ.:     0.0741170 α      in ANC's #6, #1, #7, ...

........................................................................
.............................. CYCLE   15 ..............................
........................................................................
   1    -11.1630941 -0.111631E+02  0.626E-01    2.74       0.0  T
   2    -11.1630774  0.167009E-04  0.426E-01    2.75       1.0  T
   3    -11.1631825 -0.105086E-03  0.282E-01    2.77       1.0  T
   4    -11.1633961 -0.213602E-03  0.716E-02    2.73       1.0  T
   5    -11.1634189 -0.228301E-04  0.276E-02    2.75       1.6  T
   6    -11.1634190 -0.671085E-07  0.166E-02    2.75       2.7  T
   7    -11.1634203 -0.133653E-05  0.281E-03    2.75      15.9  T
   8    -11.1634203 -0.235553E-08  0.855E-04    2.75      52.3  T
   9    -11.1634203  0.118515E-09  0.277E-04    2.75     161.5  T
     SCC iter.                  ...        0 min,  0.001 sec
     gradient                   ...        0 min,  0.001 sec
 * total energy  :   -11.0034570 Eh     change       -0.4160302E-03 Eh
   gradient norm :     0.0079333 Eh/α   predicted    -0.3990147E-03 (  -4.09%)
   displ. norm   :     0.0130056 α      lambda       -0.4523774E-04
   maximum displ.:     0.0109441 α      in ANC's #6, #7, #1, ...

........................................................................
.............................. CYCLE   16 ..............................
........................................................................
   1    -11.1628479 -0.111628E+02  0.109E-01    2.74       0.0  T
   2    -11.1628429  0.505347E-05  0.898E-02    2.74       1.0  T
   3    -11.1628643 -0.214537E-04  0.442E-02    2.75       1.0  T
   4    -11.1628663 -0.198461E-05  0.125E-02    2.74       3.6  T
   5    -11.1628673 -0.105375E-05  0.423E-03    2.74      10.6  T
   6    -11.1628674 -0.142242E-07  0.232E-03    2.74      19.2  T
   7    -11.1628674 -0.913501E-08  0.135E-03    2.74      33.2  T
   8    -11.1628674 -0.135168E-07  0.303E-04    2.74     147.4  T
   9    -11.1628674 -0.111140E-09  0.949E-05    2.74     471.3  T
     SCC iter.                  ...        0 min,  0.001 sec
     gradient                   ...        0 min,  0.001 sec
 * total energy  :   -11.0034903 Eh     change       -0.3323863E-04 Eh
   gradient norm :     0.0038158 Eh/α   predicted    -0.2262342E-04 ( -31.94%)
   displ. norm   :     0.0128084 α      lambda       -0.2242431E-04
   maximum displ.:     0.0108338 α      in ANC's #6, #7, #1, ...

........................................................................
.............................. CYCLE   17 ..............................
........................................................................
   1    -11.1621409 -0.111621E+02  0.117E-01    2.73       0.0  T
   2    -11.1621345  0.634531E-05  0.941E-02    2.73       1.0  T
   3    -11.1621566 -0.220218E-04  0.494E-02    2.74       1.0  T
   4    -11.1621598 -0.324290E-05  0.133E-02    2.73       3.4  T
   5    -11.1621610 -0.123913E-05  0.442E-03    2.73      10.1  T
   6    -11.1621611 -0.225419E-07  0.222E-03    2.73      20.1  T
   7    -11.1621611 -0.157715E-07  0.373E-04    2.73     120.0  T
   8    -11.1621611 -0.415490E-11  0.162E-04    2.73     275.9  T
     SCC iter.                  ...        0 min,  0.001 sec
     gradient                   ...        0 min,  0.001 sec
 * total energy  :   -11.0035023 Eh     change       -0.1206287E-04 Eh
   gradient norm :     0.0005386 Eh/α   predicted    -0.1121339E-04 (  -7.04%)
   displ. norm   :     0.0041604 α      lambda       -0.1200116E-05
   maximum displ.:     0.0027332 α      in ANC's #3, #6, #5, ...

........................................................................
.............................. CYCLE   18 ..............................
........................................................................
   1    -11.1620021 -0.111620E+02  0.223E-02    2.74       0.0  T
   2    -11.1620021  0.419169E-07  0.154E-02    2.74       2.9  T
   3    -11.1620022 -0.121169E-06  0.105E-02    2.74       4.3  T
   4    -11.1620025 -0.322265E-06  0.282E-03    2.74      15.9  T
   5    -11.1620025 -0.391413E-07  0.893E-04    2.74      50.1  T
   6    -11.1620025  0.161782E-08  0.829E-04    2.74      53.9  T
     SCC iter.                  ...        0 min,  0.001 sec
     gradient                   ...        0 min,  0.001 sec
 * total energy  :   -11.0035024 Eh     change       -0.3397800E-07 Eh
   gradient norm :     0.0005477 Eh/α   predicted    -0.6001687E-06 (1666.35%)
   displ. norm   :     0.0030543 α      lambda       -0.7283463E-06
   maximum displ.:     0.0019464 α      in ANC's #1, #3, #5, ...

   *** GEOMETRY OPTIMIZATION CONVERGED AFTER 18 ITERATIONS ***

------------------------------------------------------------------------
 total energy gain   :        -0.1754010 Eh     -110.0658 kcal/mol
 total RMSD          :         0.9742835 a0        0.5156 Å
 total power (kW/mol):       -25.5841813 (step)-6443.8399 (real)
------------------------------------------------------------------------

 ANCopt (total)                0 d,  0 h,  0 min,  0.071 sec
 optimizer setup                ...        0 min,  0.000 sec (  0.073%)
 model hessian                  ...        0 min,  0.000 sec (  0.095%)
 ANC generation                 ...        0 min,  0.000 sec (  0.057%)
 coordinate transformation      ...        0 min,  0.000 sec (  0.049%)
 single point calculation       ...        0 min,  0.070 sec ( 97.941%)
 optimization log               ...        0 min,  0.000 sec (  0.544%)
 hessian update                 ...        0 min,  0.000 sec (  0.049%)
 rational function              ...        0 min,  0.000 sec (  0.522%)

================
 final structure:
================
5
 xtb: 6.2.2 (9d81278992624c895f80dd42a50cac0aa55982e2)
C        -1.32552105222256   -0.63459070760990   -0.00510828433750
C         0.01643403909109   -0.00039028961479    0.01744537866845
N         1.24563308976133   -0.02623266054851    0.64072158630101
C        -1.30114351584601    0.68319752601972    0.00145336910210
C         1.36459743921615   -0.02198486824653   -0.65451104973406

 Bond Distances (Angstroems)
 ---------------------------
C1-C2=1.4844         C1-C4=1.3180         C2-C1=1.4844         C2-N3=1.3784         C2-C4=1.4844         C2-C5=1.5065         
N3-C2=1.3784         N3-C5=1.3007         C4-C1=1.3180         C4-C2=1.4844         C5-C2=1.5065         C5-N3=1.3007         
 C  C  Rav=1.4484 sigma=0.0758  Rmin=1.3180  Rmax=1.5065     4
 N  C  Rav=1.3396 sigma=0.0389  Rmin=1.3007  Rmax=1.3784     2

 selected bond angles (degree)
 --------------------
C4-C1-C2= 63.64                N3-C2-C1=143.61                C4-C2-C1= 52.71                C4-C2-N3=143.61                
C5-C2-C1=142.76                C5-C2-N3= 53.37                C5-C2-C4=142.76                C5-N3-C2= 68.36                
C2-C4-C1= 63.64                N3-C5-C2= 58.27                

 selected dihedral angles (degree)
 ---------------------------------
N3-C2-C1-C4=132.24            C5-C2-C1-C4=229.32            C5-N3-C2-C1=131.56            C5-N3-C2-C4=228.44            
C1-C4-C2-N3=227.76            C1-C4-C2-C5=130.68            N3-C5-C2-C1=227.19            N3-C5-C2-C4=132.81            
           -------------------------------------------------
          |                Final Singlepoint                |
           -------------------------------------------------

          ...................................................
          :                      SETUP                      :
          :.................................................:
          :  # basis functions                  20          :
          :  # atomic orbitals                  20          :
          :  # shells                           10          :
          :  # electrons                        21          :
          :  max. iterations                   250          :
          :  Hamiltonian                  GFN2-xTB          :
          :  restarted?                      false          :
          :  GBSA solvation                  false          :
          :  PC potential                    false          :
          :  electronic temp.          300.0000000     K    :
          :  accuracy                    1.0000000          :
          :  -> integral cutoff          0.2500000E+02      :
          :  -> integral neglect         0.1000000E-07      :
          :  -> SCF convergence          0.1000000E-05 Eh   :
          :  -> wf. convergence          0.1000000E-03 e    :
          :  Broyden damping             0.4000000          :
          ...................................................

 iter      E             dE          RMSdq      gap      omega  full diag
   1    -11.1620025 -0.111620E+02  0.401E-04    2.74       0.0  T
   2    -11.1620025  0.118044E-08  0.495E-04    2.74      90.4  T
   3    -11.1620025 -0.199060E-08  0.174E-04    2.74     257.7  T

   *** convergence criteria satisfied after 3 iterations ***

         #    Occupation            Energy/Eh            Energy/eV
      -------------------------------------------------------------
         1        2.0000           -0.7483164             -20.3627
       ...           ...                  ...                  ...
         6        2.0000           -0.5402312             -14.7004
         7        2.0000           -0.5272628             -14.3476
         8        2.0000           -0.5162859             -14.0489
         9        1.9998           -0.4470804             -12.1657
        10        1.0002           -0.4305810             -11.7167
        11        1.0000           -0.4133848             -11.2488
        12        1.0000           -0.4093914             -11.1401 (HOMO)
        13                         -0.3087804              -8.4023 (LUMO)
        14                         -0.2880904              -7.8393
        15                         -0.0812947              -2.2121
        16                         -0.0640884              -1.7439
        17                         -0.0186790              -0.5083
       ...                                ...                  ...
        20                          0.4965075              13.5107
      -------------------------------------------------------------
                  HL-Gap            0.1006110 Eh            2.7378 eV
             Fermi-level           -0.3989583 Eh          -10.8562 eV

 SCC (total)                   0 d,  0 h,  0 min,  0.003 sec
 SCC setup                      ...        0 min,  0.000 sec (  1.902%)
 Dispersion                     ...        0 min,  0.000 sec (  0.463%)
 integral evaluation            ...        0 min,  0.001 sec ( 41.618%)
 zeroth order Hamiltonian       ...        0 min,  0.000 sec (  0.497%)
 iterations                     ...        0 min,  0.000 sec ( 10.133%)
 molecular gradient             ...        0 min,  0.001 sec ( 43.873%)
 printout                       ...        0 min,  0.000 sec (  1.338%)

         :::::::::::::::::::::::::::::::::::::::::::::::::::::
         ::                     SUMMARY                     ::
         :::::::::::::::::::::::::::::::::::::::::::::::::::::
         :: total energy             -11.003502385842 Eh    ::
         :: gradient norm              0.000548380922 Eh/a0 ::
         :: HOMO-LUMO gap              2.737764303845 eV    ::
         ::.................................................::
         :: SCC energy               -11.162002545740 Eh    ::
         :: -> isotropic ES           -0.003230064782 Eh    ::
         :: -> anisotropic ES          0.001955961684 Eh    ::
         :: -> anisotropic XC          0.007095644916 Eh    ::
         :: -> dispersion             -0.002760769571 Eh    ::
         :: repulsion energy           0.158500104361 Eh    ::
         :: add. restraining           0.000000000000 Eh    ::
         :::::::::::::::::::::::::::::::::::::::::::::::::::::

           ------------------------------------------------- 
          |                Numerical Hessian                |
           ------------------------------------------------- 
step length          :   0.00500
SCC accuracy         :   0.30000
Hessian scale factor :   1.00000
frozen atoms in %    :   0.00000    0
RMS gradient         :   0.00055
estimated CPU  time      0.00 min
estimated wall time      0.00 min

writing file <hessian>.

 projected vibrational frequencies (cm-1)
eigval :       -0.00    -0.00     0.00     0.00     0.00     0.00
eigval :      281.65   324.08   366.12   369.85   736.99   743.02
eigval :     1368.14  1618.43  1764.56
           -------------------------------------------------
          |                Property Printout                |
           -------------------------------------------------

    * Orbital Energies and Occupations

         #    Occupation            Energy/Eh            Energy/eV
      -------------------------------------------------------------
         1        2.0000           -0.7483163             -20.3627
         2        2.0000           -0.7270232             -19.7833
         3        2.0000           -0.6150244             -16.7357
         4        2.0000           -0.6047097             -16.4550
         5        2.0000           -0.5996551             -16.3174
         6        2.0000           -0.5402311             -14.7004
         7        2.0000           -0.5272628             -14.3476
         8        2.0000           -0.5162857             -14.0488
         9        1.9998           -0.4470806             -12.1657
        10        1.0002           -0.4305806             -11.7167
        11        1.0000           -0.4133848             -11.2488
        12        1.0000           -0.4093912             -11.1401 (HOMO)
        13                         -0.3087807              -8.4024 (LUMO)
        14                         -0.2880900              -7.8393
        15                         -0.0812949              -2.2121
        16                         -0.0640881              -1.7439
        17                         -0.0186789              -0.5083
        18                          0.3437620               9.3542
        19                          0.3864266              10.5152
        20                          0.4965079              13.5107
      -------------------------------------------------------------
                  HL-Gap            0.1006104 Eh            2.7377 eV
             Fermi-level           -0.3989583 Eh          -10.8562 eV

     #   Z        covCN         q      C6AA      α(0)
     1   6 C      1.959    -0.019    31.572     9.074
     2   6 C      3.842     0.208    17.310     5.919
     3   7 N      1.820    -0.108    24.130     7.278
     4   6 C      1.959    -0.019    31.572     9.074
     5   6 C      1.887    -0.062    32.802     9.250

 Mol. C6AA /au·bohr⁶  :        676.343257
 Mol. C8AA /au·bohr⁸  :      18638.239363
 Mol. α(0) /au        :         40.595192


Wiberg/Mayer (AO) data.
largest (>0.10) Wiberg bond orders for each atom
          total WBO             WBO to atom ...
     1  C   2.677        C    4 1.732    C    2 0.863
     2  C   3.472        N    3 1.018    C    4 0.863    C    1 0.863    C    5 0.728
     3  N   2.796        C    5 1.675    C    2 1.018
     4  C   2.677        C    1 1.732    C    2 0.863
     5  C   2.463        N    3 1.675    C    2 0.728

MOs/occ written to file <molden.input>


molecular dipole:
                 x           y           z       tot (Debye)
 q only:       -0.316       0.006      -0.048
   full:       -0.331       0.005       0.139       0.913
molecular quadrupole (traceless):
                xx          xy          yy          xz          yz          zz
 q only:       -1.088       0.034       0.690      -0.167       0.005       0.398
  q+dip:       -2.765       0.101       2.831       0.582       0.004      -0.066
   full:       -3.056       0.109       2.998       0.642       0.003       0.057
Molecule has the following symmetry elements: (sigma) 
It seems to be the Cs point group

           -------------------------------------------------
          |                Geometry Summary                 |
           -------------------------------------------------

      molecular mass/u    :       62.0496468
   center of mass at/Å    :        0.0400687      -0.0008442       0.0206103
  moments of inertia/u·Å² :        0.2130263E+02   0.9589992E+02   0.9633746E+02
rotational constants/cm⁻¹ :        0.7913404E+00   0.1757836E+00   0.1749852E+00

 * 3 selected distances

     #   Z        #   Z                                     value/Å
     2   6 C      3   7 N                                 1.3784308 (max)
     1   6 C      4   6 C                                 1.3180300
     3   7 N      5   6 C                                 1.3006914 (min)

 * 2 distinct bonds (by element types)

   Z      Z             #   av. dist./Å        max./Å        min./Å
   6 C    6 C           1     1.3180300     1.3180300     1.3180300
   6 C    7 N           2     1.3395611     1.3784308     1.3006914

           -------------------------------------------------
          |               Frequency Printout                |
           -------------------------------------------------
 projected vibrational frequencies (cm-1)
eigval :       -0.00    -0.00     0.00     0.00     0.00     0.00
eigval :      281.65   324.08   366.12   369.85   736.99   743.02
eigval :     1368.14  1618.43  1764.56
 reduced masses (amu)
   1: 12.53   2: 12.32   3: 12.84   4: 12.54   5: 12.43   6: 12.21   7: 12.15   8: 12.05
   9: 12.59  10: 12.57  11: 12.75  12: 12.01  13: 12.40  14: 12.49  15: 12.27
 IR intensities (amu)
   1:  0.04   2:  0.07   3:  0.03   4:  0.02   5:  0.09   6:  0.04   7:  1.17   8:  0.21
   9:  0.19  10:  0.50  11:  0.19  12:  0.15  13:  0.56  14:  0.45  15:  0.99
 Raman intensities (amu)
   1:  0.00   2:  0.00   3:  0.00   4:  0.00   5:  0.00   6:  0.00   7:  0.00   8:  0.00
   9:  0.00  10:  0.00  11:  0.00  12:  0.00  13:  0.00  14:  0.00  15:  0.00
 output can be read by thermo (or use thermo option).
 writing <g98.out> molden fake output.
 recommended (thermochemical) frequency scaling factor: 1.0
           -------------------------------------------------
          |             Thermodynamic Functions             |
           -------------------------------------------------

cs  symmetry found (for desy threshold:  0.10E+00) used in thermo

          ...................................................
          :                      SETUP                      :
          :.................................................:
          :  # frequencies                           9      :
          :  # imaginary freq.                       0      :
          :  linear?                             false      :
          :  only rotor calc.                    false      :
          :  symmetry                               cs      :
          :  rotational number                       1      :
          :  scaling factor                  1.0000000      :
          :  rotor cutoff                   50.0000000 cm⁻¹ :
          :  imag. cutoff                  -20.0000000 cm⁻¹ :
          :.................................................:

    mode    ω/cm⁻¹     T·S(HO)/kcal·mol⁻¹    T·S(FR)/kcal·mol⁻¹   T·S(vib)
   ------------------------------------------------------------------------
       1    281.65    -0.00000 ( 99.90%)     0.01548 (  0.10%)     0.00002
   ------------------------------------------------------------------------

   temp. (K)  partition function   enthalpy   heat capacity  entropy
                                   cal/mol     cal/K/mol   cal/K/mol   J/K/mol
 298.15  VIB   2.62                 1083.379      8.116      5.546
         ROT  0.339E+05              888.752      2.981     23.710
         INT  0.887E+05             1972.131     11.097     29.256
         TR   0.473E+27             1481.254      4.968     38.278
         TOT                        3453.3850    16.0655    67.5339   282.5618

   temp. (K)  partition function   enthalpy   heat capacity  entropy
                                   cal/mol     cal/K/mol   cal/K/mol   J/K/mol
 120.00  VIB   1.08                   74.337      2.478      0.780
         ROT  0.865E+04              357.707      2.981     20.997
         INT  0.938E+04              432.043      5.458     21.777
         TR   0.121E+27              596.178      4.968     33.759
         TOT                        1028.2213    10.4266    55.5357   232.3613

   temp. (K)  partition function   enthalpy   heat capacity  entropy
                                   cal/mol     cal/K/mol   cal/K/mol   J/K/mol
 100.00  VIB   1.04                   33.794      1.579      0.413
         ROT  0.658E+04              298.089      2.981     20.453
         INT  0.683E+04              331.883      4.560     20.866
         TR   0.919E+26              496.815      4.968     32.853
         TOT                         828.6976     9.5278    53.7196   224.7626

   temp. (K)  partition function   enthalpy   heat capacity  entropy
                                   cal/mol     cal/K/mol   cal/K/mol   J/K/mol
  80.00  VIB   1.01                   10.672      0.760      0.158
         ROT  0.471E+04              238.471      2.981     19.788
         INT  0.477E+04              249.144      3.741     19.946
         TR   0.657E+26              397.452      4.968     31.745
         TOT                         646.5955     8.7092    51.6914   216.2769

   temp. (K)  partition function   enthalpy   heat capacity  entropy
                                   cal/mol     cal/K/mol   cal/K/mol   J/K/mol
  60.00  VIB   1.00                    1.641      0.202      0.031
         ROT  0.306E+04              178.853      2.981     18.931
         INT  0.307E+04              180.495      3.183     18.962
         TR   0.427E+26              298.089      4.968     30.317
         TOT                         478.5836     8.1513    49.2787   206.1820

   temp. (K)  partition function   enthalpy   heat capacity  entropy
                                   cal/mol     cal/K/mol   cal/K/mol   J/K/mol
  40.00  VIB   1.00                    0.044      0.012      0.001
         ROT  0.167E+04              119.236      2.981     17.722
         INT  0.167E+04              119.279      2.993     17.722
         TR   0.232E+26              198.726      4.968     28.303
         TOT                         318.0055     7.9607    46.0258   192.5720

   temp. (K)  partition function   enthalpy   heat capacity  entropy
                                   cal/mol     cal/K/mol   cal/K/mol   J/K/mol
  20.00  VIB   1.00                    0.000      0.000     -0.002
         ROT   589.                   59.618      2.981     15.656
         INT   589.                   59.618      2.981     15.653
         TR   0.822E+25               99.363      4.968     24.861
         TOT                         158.9808     7.9490    40.5149   169.5142

   temp. (K)  partition function   enthalpy   heat capacity  entropy
                                   cal/mol     cal/K/mol   cal/K/mol   J/K/mol
  10.00  VIB   1.00                    0.000      0.000     -0.004
         ROT   208.                   29.809      2.981     13.590
         INT   208.                   29.809      2.981     13.586
         TR   0.290E+25               49.681      4.968     21.419
         TOT                          79.4904     7.9490    35.0051   146.4614

       T/K    H(0)-H(T)+PV         H(T)/Eh          T*S/Eh         G(T)/Eh
   ------------------------------------------------------------------------
    298.15    0.550332E-02    0.227555E-01    0.320875E-01   -0.933201E-02
    120.00    0.163857E-02    0.188908E-01    0.106202E-01    0.827056E-02
    100.00    0.132061E-02    0.185728E-01    0.856076E-02    0.100121E-01
     80.00    0.103042E-02    0.182826E-01    0.659004E-02    0.116926E-01
     60.00    0.762671E-03    0.180149E-01    0.471184E-02    0.133030E-01
     40.00    0.506774E-03    0.177590E-01    0.293387E-02    0.148251E-01
     20.00    0.253352E-03    0.175055E-01    0.129129E-02    0.162143E-01
     10.00    0.126676E-03    0.173789E-01    0.557842E-03    0.168210E-01 (used)
   ------------------------------------------------------------------------

         :::::::::::::::::::::::::::::::::::::::::::::::::::::
         ::                  THERMODYNAMIC                  ::
         :::::::::::::::::::::::::::::::::::::::::::::::::::::
         :: total free energy         -10.986681356591 Eh   ::
         ::.................................................::
         :: total energy              -11.003502385817 Eh   ::
         :: zero point energy           0.017252195412 Eh   ::
         :: G(RRHO) w/o ZPVE           -0.000431166186 Eh   ::
         :: G(RRHO) contrib.            0.016821029226 Eh   ::
         :::::::::::::::::::::::::::::::::::::::::::::::::::::

optimized geometry written to: xtbopt.xyz


           -------------------------------------------------
          | TOTAL ENERGY              -11.003502385817 Eh   |
          | TOTAL ENTHALPY            -10.986123514389 Eh   |
          | TOTAL FREE ENERGY         -10.986681356591 Eh   |
          | GRADIENT NORM               0.000548252451 Eh/α |
          | HOMO-LUMO GAP               2.737748775766 eV   |
           -------------------------------------------------

------------------------------------------------------------------------
 * finished run on 2020/05/12 at 11:44:02.725     
------------------------------------------------------------------------
 total:
 * wall-time:     0 d,  0 h,  0 min,  0.199 sec
 *  cpu-time:     0 d,  0 h,  0 min,  0.199 sec
 * ratio c/w:     0.999 speedup
 SCF:
 * wall-time:     0 d,  0 h,  0 min,  0.005 sec
 *  cpu-time:     0 d,  0 h,  0 min,  0.005 sec
 * ratio c/w:     1.000 speedup
 ANC optimizer:
 * wall-time:     0 d,  0 h,  0 min,  0.075 sec
 *  cpu-time:     0 d,  0 h,  0 min,  0.075 sec
 * ratio c/w:     1.000 speedup
 numerical hessian:
 * wall-time:     0 d,  0 h,  0 min,  0.101 sec
 *  cpu-time:     0 d,  0 h,  0 min,  0.101 sec
 * ratio c/w:     0.998 speedup

