      -----------------------------------------------------------      
     |                   =====================                   |     
     |                           x T B                           |     
     |                   =====================                   |     
     |                         S. Grimme                         |     
     |          Mulliken Center for Theoretical Chemistry        |     
     |                    University of Bonn                     |     
      -----------------------------------------------------------      

   * xtb version 6.2.2 (9d81278992624c895f80dd42a50cac0aa55982e2) compiled by '@Darwin' on 04/03/2020

   xtb is free software: you can redistribute it and/or modify it under
   the terms of the GNU Lesser General Public License as published by
   the Free Software Foundation, either version 3 of the License, or
   (at your option) any later version.
   
   xtb is distributed in the hope that it will be useful,
   but WITHOUT ANY WARRANTY; without even the implied warranty of
   MERCHANTABILITY or FITNESS FOR A PARTICULAR PURPOSE.  See the
   GNU Lesser General Public License for more details.
   
   Cite this work as:
   * S. Grimme, C. Bannwarth, P. Shushkov, J. Chem. Theory Comput., 2017,
     13, 1989-2009. DOI: 10.1021/acs.jctc.7b00118
   * C. Bannwarth, S. Ehlert and S. Grimme., J. Chem. Theory Comput., 2019,
     15, 1652-1671. DOI: 10.1021/acs.jctc.8b01176
   * P. Pracht, E. Caldeweyher, S. Ehlert, S. Grimme, ChemRxiv, 2019, preprint.
     DOI: 10.26434/chemrxiv.8326202.v1
   
   for DFT-D4:
   * E. Caldeweyher, C. Bannwarth and S. Grimme, J. Chem. Phys., 2017,
     147, 034112. DOI: 10.1063/1.4993215
   * E. Caldeweyher, S. Ehlert, A. Hansen, H. Neugebauer, S. Spicher,
     C. Bannwarth and S. Grimme, J. Chem. Phys., 2019, 150, 154122.
     DOI: 10.1063/1.5090222
   
   for sTDA-xTB:
   * S. Grimme and C. Bannwarth, J. Chem. Phys., 2016, 145, 054103.
     DOI: 10.1063/1.4959605
   
   in the mass-spec context:
   * V. Asgeirsson, C. Bauer and S. Grimme, Chem. Sci., 2017, 8, 4879.
     DOI: 10.1039/c7sc00601b
   
   for metadynamics refer to:
   * S. Grimme, J. Chem. Theory Comput., 2019, 155, 2847-2862
     DOI: 10.1021/acs.jctc.9b00143
   
   with help from (in alphabetical order)
   C. Bannwarth, F. Bohle, G. Brandenburg, E. Caldeweyher, M. Checinski,
   S. Dohm, S. Ehlert, S. Ehrlich, F. März, H. Neugebauer, J. Pisarek,
   P. Pracht, P. Shushkov, and S. Spicher.
   
 * started run on 2020/05/12 at 11:44:25.902     

           -------------------------------------------------
          |                Calculation Setup                |
           -------------------------------------------------

          program call               : xtb --input H2C3_1_S_0.input H2C3_1_S_0.xyz --ohess --molden --namespace H2C3_1_S_0 output.out
          calculation namespace      : H2C3_1_S_0
          coordinate file            : H2C3_1_S_0.xyz
          number of atoms            :                     5
          number of electrons        :                    14
          charge                     :                     0
          spin                       :                   0.0
          first test random number   :      0.17829035962128

   ID    Z sym.   atoms
    1    6 C      1-3
    2    1 H      4, 5

           -------------------------------------------------
          |                 G F N 2 - x T B                 |
           -------------------------------------------------

        Reference                      10.1021/acs.jctc.8b01176
      * Hamiltonian:
        H0-scaling (s, p, d)           1.850000    2.230000    2.230000
        zeta-weighting                 0.500000
      * Dispersion:
        s8                             2.700000
        a1                             0.520000
        a2                             5.000000
        s9                             5.000000
      * Repulsion:
        kExp                           1.500000    1.000000
        rExp                           1.000000
      * Coulomb:
        alpha                          2.000000
        third order                    shell-resolved
        anisotropic                    true
        a3                             3.000000
        a5                             4.000000
        cn-shift                       1.200000
        cn-exp                         4.000000
        max-rad                        5.000000


          ...................................................
          :                      SETUP                      :
          :.................................................:
          :  # basis functions                  14          :
          :  # atomic orbitals                  14          :
          :  # shells                            8          :
          :  # electrons                        14          :
          :  max. iterations                   250          :
          :  Hamiltonian                  GFN2-xTB          :
          :  restarted?                      false          :
          :  GBSA solvation                  false          :
          :  PC potential                    false          :
          :  electronic temp.          300.0000000     K    :
          :  accuracy                    1.0000000          :
          :  -> integral cutoff          0.2500000E+02      :
          :  -> integral neglect         0.1000000E-07      :
          :  -> SCF convergence          0.1000000E-05 Eh   :
          :  -> wf. convergence          0.1000000E-03 e    :
          :  Broyden damping             0.4000000          :
          ...................................................

 iter      E             dE          RMSdq      gap      omega  full diag
   1     -6.9740027 -0.697400E+01  0.112E+01    0.86       0.0  T
   2     -4.9155815  0.205842E+01  0.163E+01    1.14       1.0  T
   3     -5.7910674 -0.875486E+00  0.124E+01    0.74       1.0  T
   4     -6.9482398 -0.115717E+01  0.758E+00    0.85       1.0  T
   5     -7.0896974 -0.141458E+00  0.401E+00    0.58       1.0  T
   6     -7.0939018 -0.420447E-02  0.371E+00    0.59       1.0  T
   7     -7.0948662 -0.964324E-03  0.386E+00    0.59       1.0  T
   8     -7.1112426 -0.163765E-01  0.155E+00    0.48       1.0  T
   9     -7.1136480 -0.240541E-02  0.101E+00    0.44       1.0  T
  10     -7.1145161 -0.868065E-03  0.927E-02    0.40       1.0  T
  11     -7.1145149  0.121543E-05  0.118E-01    0.38       1.0  T
  12     -7.1145269 -0.120471E-04  0.307E-02    0.39       1.5  T
  13     -7.1145328 -0.583177E-05  0.831E-03    0.39       5.4  T
  14     -7.1145328 -0.251014E-07  0.314E-03    0.39      14.2  T
  15     -7.1145327  0.513591E-07  0.432E-03    0.39      10.4  T
  16     -7.1145328 -0.625010E-07  0.105E-03    0.39      42.6  T
  17     -7.1145328 -0.273797E-09  0.653E-04    0.39      68.5  T
  18     -7.1145328 -0.753230E-09  0.137E-04    0.39     327.0  T

   *** convergence criteria satisfied after 18 iterations ***

         #    Occupation            Energy/Eh            Energy/eV
      -------------------------------------------------------------
         1        2.0000           -0.6595515             -17.9473
         2        2.0000           -0.6165977             -16.7785
         3        2.0000           -0.5590409             -15.2123
         4        2.0000           -0.5130837             -13.9617
         5        2.0000           -0.4716966             -12.8355
         6        2.0000           -0.4487775             -12.2119
         7        1.9989           -0.3904432             -10.6245 (HOMO)
         8        0.0011           -0.3760966             -10.2341 (LUMO)
         9                         -0.3665587              -9.9746
        10                         -0.2910350              -7.9195
        11                          0.0805752               2.1926
        12                          0.1154771               3.1423
       ...                                ...                  ...
        14                          0.1803427               4.9074
      -------------------------------------------------------------
                  HL-Gap            0.0143466 Eh            0.3904 eV
             Fermi-level           -0.3832700 Eh          -10.4293 eV

 SCC (total)                   0 d,  0 h,  0 min,  0.003 sec
 SCC setup                      ...        0 min,  0.000 sec (  2.837%)
 Dispersion                     ...        0 min,  0.000 sec (  0.445%)
 integral evaluation            ...        0 min,  0.001 sec ( 23.314%)
 zeroth order Hamiltonian       ...        0 min,  0.000 sec (  0.511%)
 iterations                     ...        0 min,  0.001 sec ( 46.932%)
 molecular gradient             ...        0 min,  0.001 sec ( 22.934%)
 printout                       ...        0 min,  0.000 sec (  2.622%)

         :::::::::::::::::::::::::::::::::::::::::::::::::::::
         ::                     SUMMARY                     ::
         :::::::::::::::::::::::::::::::::::::::::::::::::::::
         :: total energy              -7.056078726392 Eh    ::
         :: gradient norm              0.193570598855 Eh/a0 ::
         :: HOMO-LUMO gap              0.390390940951 eV    ::
         ::.................................................::
         :: SCC energy                -7.114532791668 Eh    ::
         :: -> isotropic ES           -0.021849909837 Eh    ::
         :: -> anisotropic ES         -0.000604721913 Eh    ::
         :: -> anisotropic XC          0.014112817966 Eh    ::
         :: -> dispersion             -0.001625839587 Eh    ::
         :: repulsion energy           0.058454038997 Eh    ::
         :: add. restraining           0.000000000000 Eh    ::
         :::::::::::::::::::::::::::::::::::::::::::::::::::::

      ----------------------------------------------------------- 
     |                   =====================                   |
     |                        A N C O P T                        |
     |                   =====================                   |
     |               Approximate Normal Coordinate               |
     |                Rational Function Optimizer                |
      ----------------------------------------------------------- 

          ...................................................
          :                      SETUP                      :
          :.................................................:
          :   optimization level            normal          :
          :   max. optcycles                   200          :
          :   ANC micro-cycles                  20          :
          :   degrees of freedom                 9          :
          :.................................................:
          :   RF solver                   davidson          :
          :   write xtbopt.log                true          :
          :   linear?                        false          :
          :   energy convergence         0.5000000E-05 Eh   :
          :   grad. convergence          0.1000000E-02 Eh/α :
          :   maximium RF displ.         1.0000000          :
          :   Hlow (freq-cutoff)         0.1000000E-01      :
          :   Hmax (freq-cutoff)         5.0000000          :
          :   S6 in model hess.         20.0000000          :
          ...................................................

generating ANC from model Hessian ...
Using Lindh-Hessian (1995)
 Shifting diagonal of input Hessian by    0.0000000000000000     
 Lowest  eigenvalues of input Hessian
   -0.000000   -0.000000   -0.000000   -0.000000    0.000000    0.000000
    0.011088    0.040188    0.061878    0.072442    0.113890    0.562984
    0.795208    0.982831    1.044824
 Highest eigenvalues
    0.072442    0.113890    0.562984    0.795208    0.982831    1.044824


........................................................................
.............................. CYCLE    1 ..............................
........................................................................
   1     -7.1145328 -0.711453E+01  0.244E-05    0.39       0.0  T
   2     -7.1145328  0.179137E-10  0.510E-05    0.39     876.1  T
   3     -7.1145328 -0.627853E-11  0.469E-05    0.39     954.5  T
     SCC iter.                  ...        0 min,  0.000 sec
     gradient                   ...        0 min,  0.001 sec
 * total energy  :    -7.0560787 Eh     change       -0.5504042E-10 Eh
   gradient norm :     0.1935711 Eh/α   predicted     0.0000000E+00 (-100.00%)
   displ. norm   :     0.4541265 α      lambda       -0.6412385E-01
   maximum displ.:     0.2563031 α      in ANC's #4, #6, #3, ...

........................................................................
.............................. CYCLE    2 ..............................
........................................................................
   1     -7.1672640 -0.716726E+01  0.248E+00    0.65       0.0  T
   2     -6.9937074  0.173557E+00  0.528E+00    1.02       1.0  T
   3     -7.1659811 -0.172274E+00  0.217E+00    0.81       1.0  T
   4     -7.1818961 -0.159151E-01  0.871E-01    0.70       1.0  T
   5     -7.1772336  0.466253E-02  0.958E-01    0.66       1.0  T
   6     -7.1834786 -0.624506E-02  0.326E-01    0.70       1.0  T
   7     -7.1840571 -0.578438E-03  0.928E-02    0.71       1.0  T
   8     -7.1840990 -0.418934E-04  0.359E-02    0.71       1.2  T
   9     -7.1841033 -0.436173E-05  0.970E-03    0.71       4.6  T
  10     -7.1841039 -0.537516E-06  0.698E-04    0.71      64.1  T
  11     -7.1841039 -0.584624E-09  0.216E-04    0.71     207.0  T
     SCC iter.                  ...        0 min,  0.001 sec
     gradient                   ...        0 min,  0.001 sec
 * total energy  :    -7.1033922 Eh     change       -0.4731345E-01 Eh
   gradient norm :     0.1077613 Eh/α   predicted    -0.3867408E-01 ( -18.26%)
   displ. norm   :     0.4016129 α      lambda       -0.3835065E-01
   maximum displ.:     0.3057410 α      in ANC's #6, #1, #8, ...

........................................................................
.............................. CYCLE    3 ..............................
........................................................................
   1     -7.2478992 -0.724790E+01  0.286E+00    0.74       0.0  T
   2     -7.1620615  0.858377E-01  0.403E+00    0.91       1.0  T
   3     -7.2642056 -0.102144E+00  0.130E+00    0.77       1.0  T
   4     -7.2648186 -0.612961E-03  0.735E-01    0.77       1.0  T
   5     -7.2665138 -0.169517E-02  0.264E-01    0.75       1.0  T
   6     -7.2669285 -0.414716E-03  0.911E-02    0.76       1.0  T
   7     -7.2669545 -0.259963E-04  0.200E-02    0.75       2.2  T
   8     -7.2669541  0.417660E-06  0.967E-03    0.75       4.6  T
   9     -7.2669545 -0.417891E-06  0.367E-03    0.75      12.2  T
  10     -7.2669546 -0.862882E-07  0.160E-04    0.75     279.1  T
  11     -7.2669546 -0.217781E-11  0.518E-05    0.75     863.2  T
     SCC iter.                  ...        0 min,  0.001 sec
     gradient                   ...        0 min,  0.001 sec
 * total energy  :    -7.1080545 Eh     change       -0.4662352E-02 Eh
   gradient norm :     0.1941653 Eh/α   predicted    -0.2226818E-01 ( 377.62%)
   displ. norm   :     0.3732184 α      lambda       -0.3759156E-01
   maximum displ.:     0.2608068 α      in ANC's #2, #3, #4, ...

........................................................................
.............................. CYCLE    4 ..............................
........................................................................
   1     -7.2272791 -0.722728E+01  0.176E+00    0.76       0.0  T
   2     -7.1808644  0.464147E-01  0.266E+00    0.67       1.0  T
   3     -7.2150818 -0.342174E-01  0.155E+00    0.82       1.0  T
   4     -7.2287446 -0.136628E-01  0.431E-01    0.75       1.0  T
   5     -7.2290715 -0.326959E-03  0.292E-01    0.76       1.0  T
   6     -7.2291546 -0.830520E-04  0.261E-01    0.76       1.0  T
   7     -7.2295228 -0.368226E-03  0.323E-02    0.75       1.4  T
   8     -7.2295292 -0.641817E-05  0.361E-03    0.75      12.4  T
   9     -7.2295293 -0.148762E-07  0.188E-03    0.75      23.8  T
  10     -7.2295293 -0.155936E-07  0.364E-04    0.75     122.9  T
  11     -7.2295293 -0.345613E-09  0.108E-04    0.75     412.7  T
     SCC iter.                  ...        0 min,  0.001 sec
     gradient                   ...        0 min,  0.001 sec
 * total energy  :    -7.1239011 Eh     change       -0.1584656E-01 Eh
   gradient norm :     0.0364383 Eh/α   predicted    -0.2141387E-01 (  35.13%)
   displ. norm   :     0.1362158 α      lambda       -0.2761293E-02
   maximum displ.:     0.0712970 α      in ANC's #1, #5, #6, ...

........................................................................
.............................. CYCLE    5 ..............................
........................................................................
   1     -7.2420546 -0.724205E+01  0.581E-01    0.70       0.0  T
   2     -7.2360306  0.602393E-02  0.907E-01    0.76       1.0  T
   3     -7.2397677 -0.373706E-02  0.618E-01    0.68       1.0  T
   4     -7.2424335 -0.266578E-02  0.200E-01    0.71       1.0  T
   5     -7.2425946 -0.161137E-03  0.786E-02    0.71       1.0  T
   6     -7.2426314 -0.368439E-04  0.217E-02    0.70       2.1  T
   7     -7.2426334 -0.200026E-05  0.868E-03    0.70       5.2  T
   8     -7.2426338 -0.399731E-06  0.104E-03    0.70      42.9  T
   9     -7.2426338 -0.450629E-08  0.622E-05    0.70     718.4  T
  10     -7.2426338 -0.987210E-11  0.296E-05    0.70    1509.8  T
     SCC iter.                  ...        0 min,  0.001 sec
     gradient                   ...        0 min,  0.001 sec
 * total energy  :    -7.1258869 Eh     change       -0.1985844E-02 Eh
   gradient norm :     0.0222528 Eh/α   predicted    -0.1406265E-02 ( -29.19%)
   displ. norm   :     0.3700708 α      lambda       -0.4621659E-02
   maximum displ.:     0.1901907 α      in ANC's #5, #3, #1, ...

........................................................................
.............................. CYCLE    6 ..............................
........................................................................
   1     -7.2529492 -0.725295E+01  0.235E+00    0.79       0.0  T
   2     -7.2494053  0.354393E-02  0.143E+00    0.85       1.0  T
   3     -7.1351051  0.114300E+00  0.376E+00    0.61       1.0  T
   4     -7.2520648 -0.116960E+00  0.499E-01    0.81       1.0  T
   5     -7.2538086 -0.174389E-02  0.153E-01    0.79       1.0  T
   6     -7.2538438 -0.351095E-04  0.114E-01    0.78       1.0  T
   7     -7.2539020 -0.582407E-04  0.149E-02    0.78       3.0  T
   8     -7.2539029 -0.908246E-06  0.669E-03    0.78       6.7  T
   9     -7.2539031 -0.216847E-06  0.106E-03    0.78      42.2  T
  10     -7.2539031 -0.709992E-08  0.265E-04    0.78     168.5  T
  11     -7.2539031 -0.247908E-09  0.318E-05    0.78    1405.2  T
     SCC iter.                  ...        0 min,  0.001 sec
     gradient                   ...        0 min,  0.001 sec
 * total energy  :    -7.1289250 Eh     change       -0.3038053E-02 Eh
   gradient norm :     0.0246265 Eh/α   predicted    -0.2627302E-02 ( -13.52%)
   displ. norm   :     0.5981137 α      lambda       -0.6231746E-02
   maximum displ.:     0.3643052 α      in ANC's #3, #5, #6, ...

........................................................................
.............................. CYCLE    7 ..............................
........................................................................
   1     -7.2510079 -0.725101E+01  0.279E+00    0.83       0.0  T
   2     -7.2142202  0.367877E-01  0.263E+00    1.27       1.0  T
   3     -7.2408932 -0.266730E-01  0.199E+00    0.75       1.0  T
   4     -7.2621399 -0.212467E-01  0.668E-01    0.96       1.0  T
   5     -7.2641104 -0.197045E-02  0.147E-01    0.92       1.0  T
   6     -7.2641731 -0.627587E-04  0.737E-02    0.91       1.0  T
   7     -7.2641802 -0.707155E-05  0.201E-02    0.90       2.2  T
   8     -7.2641814 -0.118636E-05  0.346E-03    0.90      12.9  T
   9     -7.2641814 -0.335407E-07  0.162E-03    0.90      27.6  T
  10     -7.2641814 -0.487345E-08  0.250E-04    0.90     179.2  T
  11     -7.2641814 -0.406644E-10  0.363E-05    0.90    1230.9  T
     SCC iter.                  ...        0 min,  0.001 sec
     gradient                   ...        0 min,  0.001 sec
 * total energy  :    -7.1386507 Eh     change       -0.9725724E-02 Eh
   gradient norm :     0.0555438 Eh/α   predicted    -0.4230558E-02 ( -56.50%)
   displ. norm   :     0.7267855 α      lambda       -0.2236219E-01
   maximum displ.:     0.4872645 α      in ANC's #5, #3, #2, ...

........................................................................
.............................. CYCLE    8 ..............................
........................................................................
   1     -7.2956379 -0.729564E+01  0.398E+00    1.04       0.0  T
   2     -7.2300836  0.655544E-01  0.408E+00    1.34       1.0  T
   3     -7.3164302 -0.863466E-01  0.209E+00    1.13       1.0  T
   4     -7.3251323 -0.870210E-02  0.104E+00    1.13       1.0  T
   5     -7.3295224 -0.439013E-02  0.177E-01    1.14       1.0  T
   6     -7.3295659 -0.434979E-04  0.665E-02    1.15       1.0  T
   7     -7.3295658  0.179126E-06  0.174E-02    1.14       2.6  T
   8     -7.3295667 -0.924909E-06  0.482E-03    1.14       9.3  T
   9     -7.3295667 -0.171466E-07  0.173E-03    1.14      25.8  T
  10     -7.3295667 -0.235461E-08  0.196E-04    1.14     228.5  T
  11     -7.3295667 -0.118171E-09  0.708E-05    1.14     631.5  T
     SCC iter.                  ...        0 min,  0.001 sec
     gradient                   ...        0 min,  0.001 sec
 * total energy  :    -7.1497239 Eh     change       -0.1107318E-01 Eh
   gradient norm :     0.1809509 Eh/α   predicted    -0.1708711E-01 (  54.31%)
   displ. norm   :     0.4578201 α      lambda       -0.5519459E-01
   maximum displ.:     0.2729656 α      in ANC's #1, #2, #3, ...

........................................................................
.............................. CYCLE    9 ..............................
........................................................................
   1     -7.3617531 -0.736175E+01  0.141E+00    1.30       0.0  T
   2     -7.3618008 -0.477470E-04  0.808E-01    1.27       1.0  T
   3     -7.3572212  0.457958E-02  0.869E-01    1.30       1.0  T
   4     -7.3622816 -0.506034E-02  0.113E-01    1.27       1.0  T
   5     -7.3623071 -0.255820E-04  0.522E-02    1.28       1.0  T
   6     -7.3623178 -0.106487E-04  0.136E-02    1.28       3.3  T
   7     -7.3623178 -0.382968E-08  0.452E-03    1.28       9.9  T
   8     -7.3623178 -0.269870E-07  0.916E-04    1.28      48.8  T
   9     -7.3623178 -0.265958E-09  0.154E-04    1.28     290.5  T
     SCC iter.                  ...        0 min,  0.001 sec
     gradient                   ...        0 min,  0.001 sec
 * total energy  :    -7.1672666 Eh     change       -0.1754272E-01 Eh
   gradient norm :     0.1072345 Eh/α   predicted    -0.3338167E-01 (  90.29%)
   displ. norm   :     0.5777172 α      lambda       -0.3664883E-01
   maximum displ.:     0.3502514 α      in ANC's #3, #2, #1, ...

........................................................................
.............................. CYCLE   10 ..............................
........................................................................
   1     -7.3282470 -0.732825E+01  0.165E+00    1.25       0.0  T
   2     -7.3265521  0.169491E-02  0.125E+00    1.24       1.0  T
   3     -7.3187861  0.776592E-02  0.122E+00    1.20       1.0  T
   4     -7.3286722 -0.988604E-02  0.322E-01    1.23       1.0  T
   5     -7.3294113 -0.739165E-03  0.841E-02    1.22       1.0  T
   6     -7.3294306 -0.192173E-04  0.196E-02    1.22       2.3  T
   7     -7.3294307 -0.127210E-06  0.673E-03    1.22       6.6  T
   8     -7.3294307 -0.507559E-07  0.147E-03    1.22      30.5  T
   9     -7.3294307 -0.764489E-09  0.270E-04    1.22     165.8  T
  10     -7.3294307 -0.276845E-11  0.916E-05    1.22     488.2  T
     SCC iter.                  ...        0 min,  0.001 sec
     gradient                   ...        0 min,  0.001 sec
 * total energy  :    -7.1878136 Eh     change       -0.2054699E-01 Eh
   gradient norm :     0.1149983 Eh/α   predicted    -0.2444032E-01 (  18.95%)
   displ. norm   :     0.6727480 α      lambda       -0.3642758E-01
   maximum displ.:     0.4179297 α      in ANC's #1, #5, #2, ...

........................................................................
.............................. CYCLE   11 ..............................
........................................................................
   1     -7.3698894 -0.736989E+01  0.246E+00    1.22       0.0  T
   2     -7.3676492  0.224021E-02  0.170E+00    1.19       1.0  T
   3     -7.3440788  0.235704E-01  0.190E+00    1.16       1.0  T
   4     -7.3711945 -0.271157E-01  0.151E-01    1.16       1.0  T
   5     -7.3712538 -0.593228E-04  0.867E-02    1.15       1.0  T
   6     -7.3712741 -0.202581E-04  0.275E-02    1.15       1.6  T
   7     -7.3712745 -0.409345E-06  0.746E-03    1.15       6.0  T
   8     -7.3712745 -0.330953E-07  0.138E-03    1.15      32.3  T
   9     -7.3712745 -0.224706E-08  0.297E-04    1.15     150.5  T
  10     -7.3712745 -0.814699E-10  0.103E-04    1.15     432.6  T
     SCC iter.                  ...        0 min,  0.001 sec
     gradient                   ...        0 min,  0.001 sec
 * total energy  :    -7.2035160 Eh     change       -0.1570242E-01 Eh
   gradient norm :     0.1139759 Eh/α   predicted    -0.2645718E-01 (  68.49%)
   displ. norm   :     0.3871263 α      lambda       -0.1862752E-01
   maximum displ.:     0.3091413 α      in ANC's #1, #4, #3, ...

........................................................................
.............................. CYCLE   12 ..............................
........................................................................
   1     -7.3944685 -0.739447E+01  0.139E+00    0.83       0.0  T
   2     -7.3945464 -0.779054E-04  0.884E-01    0.83       1.0  T
   3     -7.3897483  0.479810E-02  0.868E-01    0.80       1.0  T
   4     -7.3947034 -0.495509E-02  0.250E-01    0.80       1.0  T
   5     -7.3950094 -0.306054E-03  0.730E-02    0.80       1.0  T
   6     -7.3950202 -0.108382E-04  0.240E-02    0.80       1.9  T
   7     -7.3950204 -0.151471E-06  0.581E-03    0.80       7.7  T
   8     -7.3950205 -0.707565E-07  0.143E-03    0.80      31.3  T
   9     -7.3950205 -0.248201E-08  0.126E-04    0.80     354.2  T
  10     -7.3950205  0.185718E-11  0.627E-05    0.80     713.3  T
     SCC iter.                  ...        0 min,  0.001 sec
     gradient                   ...        0 min,  0.001 sec
 * total energy  :    -7.2124603 Eh     change       -0.8944267E-02 Eh
   gradient norm :     0.0696273 Eh/α   predicted    -0.1070959E-01 (  19.74%)
   displ. norm   :     0.5488676 α      lambda       -0.1623811E-01
   maximum displ.:     0.5010691 α      in ANC's #2, #3, #5, ...

........................................................................
.............................. CYCLE   13 ..............................
........................................................................
   1     -7.3836368 -0.738364E+01  0.210E+00    0.53       0.0  T
   2     -7.3812991  0.233774E-02  0.148E+00    0.53       1.0  T
   3     -7.3595102  0.217889E-01  0.180E+00    0.51       1.0  T
   4     -7.3844479 -0.249378E-01  0.182E-01    0.51       1.0  T
   5     -7.3845703 -0.122384E-03  0.721E-02    0.51       1.0  T
   6     -7.3845765 -0.624264E-05  0.382E-02    0.51       1.2  T
   7     -7.3845811 -0.458966E-05  0.686E-03    0.51       6.5  T
   8     -7.3845811 -0.182217E-07  0.136E-03    0.51      32.9  T
   9     -7.3845812 -0.361301E-08  0.324E-04    0.51     137.9  T
  10     -7.3845812 -0.102879E-09  0.119E-04    0.51     377.1  T
     SCC iter.                  ...        0 min,  0.001 sec
     gradient                   ...        0 min,  0.001 sec
 * total energy  :    -7.2053044 Eh     change        0.7155936E-02 Eh
   gradient norm :     0.1643930 Eh/α   predicted    -0.1056498E-01 (-247.64%)
   displ. norm   :     0.2401940 α      lambda       -0.2357096E-01
   maximum displ.:     0.2347835 α      in ANC's #2, #1, #4, ...

........................................................................
.............................. CYCLE   14 ..............................
........................................................................
   1     -7.3878284 -0.738783E+01  0.122E+00    0.56       0.0  T
   2     -7.3868029  0.102543E-02  0.903E-01    0.56       1.0  T
   3     -7.3805329  0.627002E-02  0.986E-01    0.56       1.0  T
   4     -7.3881687 -0.763583E-02  0.107E-01    0.56       1.0  T
   5     -7.3882231 -0.543941E-04  0.397E-02    0.56       1.1  T
   6     -7.3882268 -0.363703E-05  0.117E-02    0.56       3.8  T
   7     -7.3882269 -0.122861E-06  0.330E-03    0.56      13.5  T
   8     -7.3882269 -0.761726E-09  0.722E-04    0.56      62.0  T
   9     -7.3882269 -0.106082E-08  0.109E-04    0.56     409.5  T
     SCC iter.                  ...        0 min,  0.001 sec
     gradient                   ...        0 min,  0.001 sec
 * total energy  :    -7.2173344 Eh     change       -0.1203009E-01 Eh
   gradient norm :     0.0281209 Eh/α   predicted    -0.1246542E-01 (   3.62%)
   displ. norm   :     0.1154591 α      lambda       -0.2131027E-02
   maximum displ.:     0.1024979 α      in ANC's #4, #6, #5, ...

........................................................................
.............................. CYCLE   15 ..............................
........................................................................
   1     -7.4002914 -0.740029E+01  0.642E-01    0.51       0.0  T
   2     -7.4000935  0.197929E-03  0.368E-01    0.50       1.0  T
   3     -7.3983102  0.178325E-02  0.540E-01    0.50       1.0  T
   4     -7.4003800 -0.206974E-02  0.447E-02    0.50       1.0  T
   5     -7.4003827 -0.274063E-05  0.252E-02    0.50       1.8  T
   6     -7.4003836 -0.845171E-06  0.442E-03    0.50      10.1  T
   7     -7.4003836 -0.307995E-07  0.184E-03    0.50      24.3  T
   8     -7.4003836 -0.441889E-08  0.331E-04    0.50     135.2  T
   9     -7.4003836 -0.995959E-10  0.299E-05    0.50    1495.6  T
     SCC iter.                  ...        0 min,  0.001 sec
     gradient                   ...        0 min,  0.001 sec
 * total energy  :    -7.2183288 Eh     change       -0.9943838E-03 Eh
   gradient norm :     0.0235087 Eh/α   predicted    -0.1079720E-02 (   8.58%)
   displ. norm   :     0.1100289 α      lambda       -0.1202879E-02
   maximum displ.:     0.0601038 α      in ANC's #4, #5, #1, ...

........................................................................
.............................. CYCLE   16 ..............................
........................................................................
   1     -7.4028802 -0.740288E+01  0.534E-01    0.45       0.0  T
   2     -7.4028863 -0.617478E-05  0.269E-01    0.45       1.0  T
   3     -7.4028604  0.259640E-04  0.710E-02    0.45       1.0  T
   4     -7.4028839 -0.235558E-04  0.374E-02    0.45       1.2  T
   5     -7.4028888 -0.485423E-05  0.126E-02    0.45       3.5  T
   6     -7.4028895 -0.718127E-06  0.192E-03    0.45      23.4  T
   7     -7.4028895 -0.216720E-08  0.668E-04    0.45      67.0  T
   8     -7.4028895 -0.427889E-10  0.124E-04    0.45     362.0  T
     SCC iter.                  ...        0 min,  0.001 sec
     gradient                   ...        0 min,  0.001 sec
 * total energy  :    -7.2192620 Eh     change       -0.9331909E-03 Eh
   gradient norm :     0.0176757 Eh/α   predicted    -0.6087206E-03 ( -34.77%)
   displ. norm   :     0.2751856 α      lambda       -0.2111355E-02
   maximum displ.:     0.1572434 α      in ANC's #4, #2, #6, ...

........................................................................
.............................. CYCLE   17 ..............................
........................................................................
   1     -7.3955072 -0.739551E+01  0.179E+00    0.38       0.0  T
   2     -7.3954804  0.268292E-04  0.847E-01    0.38       1.0  T
   3     -7.3923726  0.310783E-02  0.645E-01    0.36       1.0  T
   4     -7.3956573 -0.328477E-02  0.118E-01    0.37       1.0  T
   5     -7.3956728 -0.154957E-04  0.542E-02    0.37       1.0  T
   6     -7.3956835 -0.107188E-04  0.516E-03    0.37       8.7  T
   7     -7.3956835 -0.255794E-08  0.217E-03    0.37      20.6  T
   8     -7.3956836 -0.314196E-08  0.164E-04    0.37     273.4  T
   9     -7.3956836 -0.335865E-10  0.480E-05    0.37     931.8  T
     SCC iter.                  ...        0 min,  0.001 sec
     gradient                   ...        0 min,  0.001 sec
 * total energy  :    -7.2206614 Eh     change       -0.1399370E-02 Eh
   gradient norm :     0.0234522 Eh/α   predicted    -0.1135627E-02 ( -18.85%)
   displ. norm   :     0.2015095 α      lambda       -0.1381690E-02
   maximum displ.:     0.1156359 α      in ANC's #4, #2, #6, ...

........................................................................
.............................. CYCLE   18 ..............................
........................................................................
   1     -7.3880759 -0.738808E+01  0.176E+00    0.41       0.0  T
   2     -7.3879450  0.130858E-03  0.830E-01    0.41       1.0  T
   3     -7.3828329  0.511208E-02  0.818E-01    0.40       1.0  T
   4     -7.3882490 -0.541606E-02  0.116E-01    0.41       1.0  T
   5     -7.3882728 -0.238390E-04  0.669E-02    0.41       1.0  T
   6     -7.3882813 -0.851198E-05  0.371E-03    0.41      12.1  T
   7     -7.3882813  0.521541E-08  0.237E-03    0.41      18.9  T
   8     -7.3882813 -0.666833E-08  0.140E-04    0.41     320.0  T
   9     -7.3882813 -0.285638E-10  0.484E-05    0.41     923.1  T
     SCC iter.                  ...        0 min,  0.001 sec
     gradient                   ...        0 min,  0.001 sec
 * total energy  :    -7.2214099 Eh     change       -0.7484858E-03 Eh
   gradient norm :     0.0339758 Eh/α   predicted    -0.7188940E-03 (  -3.95%)
   displ. norm   :     0.0804527 α      lambda       -0.1358121E-02
   maximum displ.:     0.0485805 α      in ANC's #1, #3, #8, ...

........................................................................
.............................. CYCLE   19 ..............................
........................................................................
   1     -7.3946613 -0.739466E+01  0.222E-01    0.45       0.0  T
   2     -7.3946534  0.795176E-05  0.138E-01    0.46       1.0  T
   3     -7.3944050  0.248399E-03  0.185E-01    0.46       1.0  T
   4     -7.3946677 -0.262742E-03  0.151E-02    0.46       3.0  T
   5     -7.3946681 -0.416054E-06  0.760E-03    0.46       5.9  T
   6     -7.3946684 -0.234901E-06  0.192E-03    0.46      23.2  T
   7     -7.3946684 -0.166245E-08  0.384E-04    0.46     116.4  T
   8     -7.3946684 -0.799538E-10  0.109E-04    0.46     408.6  T
     SCC iter.                  ...        0 min,  0.000 sec
     gradient                   ...        0 min,  0.001 sec
 * total energy  :    -7.2222824 Eh     change       -0.8724978E-03 Eh
   gradient norm :     0.0123554 Eh/α   predicted    -0.6834557E-03 ( -21.67%)
   displ. norm   :     0.0575447 α      lambda       -0.3787400E-03
   maximum displ.:     0.0327819 α      in ANC's #8, #4, #5, ...

........................................................................
.............................. CYCLE   20 ..............................
........................................................................
   1     -7.3964877 -0.739649E+01  0.299E-01    0.48       0.0  T
   2     -7.3964764  0.112916E-04  0.156E-01    0.48       1.0  T
   3     -7.3961908  0.285676E-03  0.198E-01    0.48       1.0  T
   4     -7.3964946 -0.303851E-03  0.176E-02    0.48       2.5  T
   5     -7.3964943  0.310655E-06  0.959E-03    0.48       4.7  T
   6     -7.3964947 -0.418700E-06  0.826E-04    0.48      54.1  T
   7     -7.3964947 -0.316462E-09  0.410E-04    0.48     109.1  T
     SCC iter.                  ...        0 min,  0.000 sec
     gradient                   ...        0 min,  0.001 sec
 * total energy  :    -7.2224799 Eh     change       -0.1975460E-03 Eh
   gradient norm :     0.0059359 Eh/α   predicted    -0.1899975E-03 (  -3.82%)
   displ. norm   :     0.0487909 α      lambda       -0.1684781E-03
   maximum displ.:     0.0366403 α      in ANC's #2, #4, #5, ...
 * RMSD in coord.:     1.5583668 α      energy gain  -0.1664012E+00 Eh

generating ANC from model Hessian ...
Using Lindh-Hessian (1995)
 Shifting diagonal of input Hessian by    9.3873397441985758E-003
 Lowest  eigenvalues of input Hessian
   -0.000000   -0.000000   -0.000000    0.000000    0.000000    0.000000
    0.010000    0.011593    0.079649    0.235016    0.284877    0.830912
    1.024613    1.315278    2.410959
 Highest eigenvalues
    0.235016    0.284877    0.830912    1.024613    1.315278    2.410959


........................................................................
.............................. CYCLE   21 ..............................
........................................................................
   1     -7.3983320 -0.739833E+01  0.149E-01    0.47       0.0  T
   2     -7.3983305  0.146463E-05  0.828E-02    0.47       1.0  T
   3     -7.3982772  0.532626E-04  0.865E-02    0.47       1.0  T
   4     -7.3983325 -0.552858E-04  0.164E-02    0.47       2.7  T
   5     -7.3983336 -0.104310E-05  0.722E-03    0.47       6.2  T
   6     -7.3983337 -0.107231E-06  0.560E-04    0.47      79.8  T
   7     -7.3983337 -0.944542E-10  0.233E-04    0.47     191.8  T
     SCC iter.                  ...        0 min,  0.001 sec
     gradient                   ...        0 min,  0.001 sec
 * total energy  :    -7.2225764 Eh     change       -0.9645233E-04 Eh
   gradient norm :     0.0096314 Eh/α   predicted     0.0000000E+00 (-100.00%)
   displ. norm   :     0.1408983 α      lambda       -0.3295674E-03
   maximum displ.:     0.1177785 α      in ANC's #2, #1, #3, ...

........................................................................
.............................. CYCLE   22 ..............................
........................................................................
   1     -7.3965398 -0.739654E+01  0.102E+00    0.47       0.0  T
   2     -7.3965662 -0.263617E-04  0.499E-01    0.47       1.0  T
   3     -7.3965416  0.246312E-04  0.809E-02    0.47       1.0  T
   4     -7.3965525 -0.108886E-04  0.644E-02    0.47       1.0  T
   5     -7.3965733 -0.208044E-04  0.197E-02    0.47       2.3  T
   6     -7.3965749 -0.164985E-05  0.192E-03    0.47      23.3  T
   7     -7.3965749 -0.408741E-08  0.790E-04    0.47      56.6  T
   8     -7.3965749 -0.472280E-10  0.329E-05    0.47    1358.3  T
     SCC iter.                  ...        0 min,  0.000 sec
     gradient                   ...        0 min,  0.001 sec
 * total energy  :    -7.2226474 Eh     change       -0.7107456E-04 Eh
   gradient norm :     0.0065464 Eh/α   predicted    -0.1680558E-03 ( 136.45%)
   displ. norm   :     0.0713743 α      lambda       -0.1840433E-03
   maximum displ.:     0.0519102 α      in ANC's #1, #2, #3, ...

........................................................................
.............................. CYCLE   23 ..............................
........................................................................
   1     -7.3993059 -0.739931E+01  0.528E-01    0.46       0.0  T
   2     -7.3993137 -0.779809E-05  0.251E-01    0.46       1.0  T
   3     -7.3993038  0.994109E-05  0.507E-02    0.45       1.0  T
   4     -7.3993117 -0.791202E-05  0.328E-02    0.45       1.4  T
   5     -7.3993146 -0.288409E-05  0.190E-02    0.45       2.4  T
   6     -7.3993166 -0.204195E-05  0.968E-04    0.45      46.2  T
   7     -7.3993166 -0.682387E-09  0.452E-04    0.45      98.9  T
   8     -7.3993166 -0.272040E-10  0.568E-05    0.45     787.2  T
     SCC iter.                  ...        0 min,  0.000 sec
     gradient                   ...        0 min,  0.001 sec
 * total energy  :    -7.2227324 Eh     change       -0.8497286E-04 Eh
   gradient norm :     0.0024134 Eh/α   predicted    -0.9248943E-04 (   8.85%)
   displ. norm   :     0.1220572 α      lambda       -0.1778219E-03
   maximum displ.:     0.1048695 α      in ANC's #2, #1, #3, ...

........................................................................
.............................. CYCLE   24 ..............................
........................................................................
   1     -7.4001995 -0.740020E+01  0.587E-01    0.44       0.0  T
   2     -7.4002020 -0.243021E-05  0.290E-01    0.44       1.0  T
   3     -7.4000416  0.160312E-03  0.151E-01    0.43       1.0  T
   4     -7.4002074 -0.165772E-03  0.400E-02    0.43       1.1  T
   5     -7.4002103 -0.292542E-05  0.168E-02    0.43       2.7  T
   6     -7.4002117 -0.131197E-05  0.157E-03    0.43      28.4  T
   7     -7.4002117 -0.412721E-09  0.730E-04    0.43      61.2  T
   8     -7.4002117 -0.996074E-10  0.491E-05    0.43     911.1  T
     SCC iter.                  ...        0 min,  0.001 sec
     gradient                   ...        0 min,  0.001 sec
 * total energy  :    -7.2224314 Eh     change        0.3010490E-03 Eh
   gradient norm :     0.0072270 Eh/α   predicted    -0.9023752E-04 (-129.97%)
   displ. norm   :     0.0993318 α      lambda       -0.6517314E-03
   maximum displ.:     0.0895170 α      in ANC's #2, #1, #4, ...

........................................................................
.............................. CYCLE   25 ..............................
........................................................................
   1     -7.3999918 -0.739999E+01  0.475E-01    0.44       0.0  T
   2     -7.3999950 -0.324338E-05  0.237E-01    0.44       1.0  T
   3     -7.3999387  0.563095E-04  0.913E-02    0.44       1.0  T
   4     -7.3999968 -0.580764E-04  0.291E-02    0.44       1.5  T
   5     -7.3999986 -0.182015E-05  0.718E-03    0.44       6.2  T
   6     -7.3999989 -0.262355E-06  0.124E-03    0.44      36.1  T
   7     -7.3999989 -0.662383E-09  0.543E-04    0.44      82.4  T
   8     -7.3999989 -0.625722E-11  0.198E-05    0.44    2256.8  T
     SCC iter.                  ...        0 min,  0.000 sec
     gradient                   ...        0 min,  0.001 sec
 * total energy  :    -7.2227721 Eh     change       -0.3407768E-03 Eh
   gradient norm :     0.0011738 Eh/α   predicted    -0.3290794E-03 (  -3.43%)
   displ. norm   :     0.0226441 α      lambda       -0.1183841E-04
   maximum displ.:     0.0190008 α      in ANC's #3, #2, #4, ...

........................................................................
.............................. CYCLE   26 ..............................
........................................................................
   1     -7.3997331 -0.739973E+01  0.779E-02    0.43       0.0  T
   2     -7.3997326  0.490755E-06  0.433E-02    0.43       1.0  T
   3     -7.3997165  0.160793E-04  0.459E-02    0.43       1.0  T
   4     -7.3997333 -0.167863E-04  0.733E-03    0.43       6.1  T
   5     -7.3997334 -0.113511E-06  0.314E-03    0.43      14.2  T
   6     -7.3997335 -0.375537E-07  0.316E-04    0.43     141.5  T
   7     -7.3997335 -0.135261E-10  0.127E-04    0.43     353.0  T
     SCC iter.                  ...        0 min,  0.000 sec
     gradient                   ...        0 min,  0.001 sec
 * total energy  :    -7.2227833 Eh     change       -0.1120946E-04 Eh
   gradient norm :     0.0008556 Eh/α   predicted    -0.5922749E-05 ( -47.16%)
   displ. norm   :     0.0145549 α      lambda       -0.3978301E-05
   maximum displ.:     0.0134447 α      in ANC's #3, #1, #5, ...

........................................................................
.............................. CYCLE   27 ..............................
........................................................................
   1     -7.4000696 -0.740007E+01  0.399E-02    0.43       0.0  T
   2     -7.4000690  0.613382E-06  0.271E-02    0.43       1.7  T
   3     -7.4000614  0.765099E-05  0.334E-02    0.43       1.3  T
   4     -7.4000698 -0.844416E-05  0.526E-03    0.43       8.5  T
   5     -7.4000700 -0.145152E-06  0.117E-03    0.43      38.2  T
   6     -7.4000700 -0.707576E-09  0.286E-04    0.43     156.5  T
   7     -7.4000700 -0.183018E-10  0.501E-05    0.43     892.5  T
     SCC iter.                  ...        0 min,  0.000 sec
     gradient                   ...        0 min,  0.001 sec
 * total energy  :    -7.2227862 Eh     change       -0.2834911E-05 Eh
   gradient norm :     0.0005873 Eh/α   predicted    -0.1988988E-05 ( -29.84%)
   displ. norm   :     0.0027424 α      lambda       -0.7153327E-06
   maximum displ.:     0.0019388 α      in ANC's #4, #2, #5, ...

   *** GEOMETRY OPTIMIZATION CONVERGED AFTER 27 ITERATIONS ***

------------------------------------------------------------------------
 total energy gain   :        -0.1667075 Eh     -104.6105 kcal/mol
 total RMSD          :         1.5986632 a0        0.8460 Å
 total power (kW/mol):       -16.2107545 (step)-7579.6817 (real)
------------------------------------------------------------------------

 ANCopt (total)                0 d,  0 h,  0 min,  0.058 sec
 optimizer setup                ...        0 min,  0.000 sec (  0.109%)
 model hessian                  ...        0 min,  0.000 sec (  0.210%)
 ANC generation                 ...        0 min,  0.000 sec (  0.208%)
 coordinate transformation      ...        0 min,  0.000 sec (  0.104%)
 single point calculation       ...        0 min,  0.055 sec ( 95.634%)
 optimization log               ...        0 min,  0.001 sec (  1.190%)
 hessian update                 ...        0 min,  0.000 sec (  0.099%)
 rational function              ...        0 min,  0.001 sec (  1.035%)

================
 final structure:
================
5
 xtb: 6.2.2 (9d81278992624c895f80dd42a50cac0aa55982e2)
C        -0.00984227165771    0.01044191108222   -0.00236912141568
C         1.12262479177683   -0.55027028042890    0.04067604018685
C        -1.30160160142744    0.03284035700963    0.07136816693058
H        -1.96961635807410    0.85996975599230   -0.04944633010723
H         2.15843643938242   -0.35298074365525   -0.06022975559453

 Bond Distances (Angstroems)
 ---------------------------
C1-C2=1.2644         C1-C3=1.2941         C2-C1=1.2644         C2-H5=1.0593         C3-C1=1.2941         C3-H4=1.0700         
H4-C3=1.0700         H5-C2=1.0593         
 C  H  Rav=1.0646 sigma=0.0054  Rmin=1.0593  Rmax=1.0700     2
 C  C  Rav=1.2792 sigma=0.0148  Rmin=1.2644  Rmax=1.2941     2

 selected bond angles (degree)
 --------------------
C3-C1-C2=154.13                H5-C2-C1=142.18                H4-C3-C1=129.06                

 selected dihedral angles (degree)
 ---------------------------------
H5-C2-C1-C3=180.09            H4-C3-C1-C2=179.77            
           -------------------------------------------------
          |                Final Singlepoint                |
           -------------------------------------------------

          ...................................................
          :                      SETUP                      :
          :.................................................:
          :  # basis functions                  14          :
          :  # atomic orbitals                  14          :
          :  # shells                            8          :
          :  # electrons                        14          :
          :  max. iterations                   250          :
          :  Hamiltonian                  GFN2-xTB          :
          :  restarted?                      false          :
          :  GBSA solvation                  false          :
          :  PC potential                    false          :
          :  electronic temp.          300.0000000     K    :
          :  accuracy                    1.0000000          :
          :  -> integral cutoff          0.2500000E+02      :
          :  -> integral neglect         0.1000000E-07      :
          :  -> SCF convergence          0.1000000E-05 Eh   :
          :  -> wf. convergence          0.1000000E-03 e    :
          :  Broyden damping             0.4000000          :
          ...................................................

 iter      E             dE          RMSdq      gap      omega  full diag
   1     -7.4000700 -0.740007E+01  0.124E-05    0.43       0.0  T
   2     -7.4000700  0.112710E-11  0.173E-05    0.43    2588.4  T
   3     -7.4000700 -0.158096E-11  0.584E-06    0.43    7657.9  T

   *** convergence criteria satisfied after 3 iterations ***

         #    Occupation            Energy/Eh            Energy/eV
      -------------------------------------------------------------
         1        2.0000           -0.6319020             -17.1949
         2        2.0000           -0.5971573             -16.2495
         3        2.0000           -0.5283056             -14.3759
         4        2.0000           -0.4818811             -13.1127
         5        2.0000           -0.4612983             -12.5526
         6        2.0000           -0.4601992             -12.5227
         7        1.9995           -0.3550174              -9.6605 (HOMO)
         8        0.0005           -0.3393181              -9.2333 (LUMO)
         9                         -0.1819691              -4.9516
        10                         -0.1299511              -3.5362
        11                          0.1261666               3.4332
        12                          0.2416884               6.5767
       ...                                ...                  ...
        14                          1.0811809              29.4204
      -------------------------------------------------------------
                  HL-Gap            0.0156993 Eh            0.4272 eV
             Fermi-level           -0.3471678 Eh           -9.4469 eV

 SCC (total)                   0 d,  0 h,  0 min,  0.002 sec
 SCC setup                      ...        0 min,  0.000 sec (  2.819%)
 Dispersion                     ...        0 min,  0.000 sec (  0.575%)
 integral evaluation            ...        0 min,  0.001 sec ( 39.293%)
 zeroth order Hamiltonian       ...        0 min,  0.000 sec (  0.547%)
 iterations                     ...        0 min,  0.000 sec ( 13.715%)
 molecular gradient             ...        0 min,  0.001 sec ( 38.690%)
 printout                       ...        0 min,  0.000 sec (  3.884%)

         :::::::::::::::::::::::::::::::::::::::::::::::::::::
         ::                     SUMMARY                     ::
         :::::::::::::::::::::::::::::::::::::::::::::::::::::
         :: total energy              -7.222786185475 Eh    ::
         :: gradient norm              0.000587500785 Eh/a0 ::
         :: HOMO-LUMO gap              0.427199837007 eV    ::
         ::.................................................::
         :: SCC energy                -7.400069959597 Eh    ::
         :: -> isotropic ES           -0.000680671768 Eh    ::
         :: -> anisotropic ES         -0.000874869591 Eh    ::
         :: -> anisotropic XC          0.015691023360 Eh    ::
         :: -> dispersion             -0.001568910988 Eh    ::
         :: repulsion energy           0.177283927544 Eh    ::
         :: add. restraining           0.000000000000 Eh    ::
         :::::::::::::::::::::::::::::::::::::::::::::::::::::

           ------------------------------------------------- 
          |                Numerical Hessian                |
           ------------------------------------------------- 
step length          :   0.00500
SCC accuracy         :   0.30000
Hessian scale factor :   1.00000
frozen atoms in %    :   0.00000    0
RMS gradient         :   0.00059
estimated CPU  time      0.00 min
estimated wall time      0.00 min

writing file <hessian>.

 projected vibrational frequencies (cm-1)
eigval :       -0.00    -0.00    -0.00    -0.00     0.00     0.00
eigval :      138.15   330.56   468.01   739.27   811.61  1325.66
eigval :     1822.48  3156.05  3273.78
           -------------------------------------------------
          |                Property Printout                |
           -------------------------------------------------

    * Orbital Energies and Occupations

         #    Occupation            Energy/Eh            Energy/eV
      -------------------------------------------------------------
         1        2.0000           -0.6319021             -17.1949
         2        2.0000           -0.5971574             -16.2495
         3        2.0000           -0.5283056             -14.3759
         4        2.0000           -0.4818812             -13.1127
         5        2.0000           -0.4612984             -12.5526
         6        2.0000           -0.4601992             -12.5227
         7        1.9995           -0.3550175              -9.6605 (HOMO)
         8        0.0005           -0.3393182              -9.2333 (LUMO)
         9                         -0.1819691              -4.9516
        10                         -0.1299512              -3.5362
        11                          0.1261666               3.4332
        12                          0.2416884               6.5767
Molecule has the following symmetry elements: (sigma) 
It seems to be the Cs point group
        13                          0.5819892              15.8367
        14                          1.0811809              29.4204
      -------------------------------------------------------------
                  HL-Gap            0.0156993 Eh            0.4272 eV
             Fermi-level           -0.3471678 Eh           -9.4469 eV

     #   Z        covCN         q      C6AA      α(0)
     1   6 C      1.962     0.016    30.663     8.942
     2   6 C      1.912    -0.077    33.193     9.305
     3   6 C      1.912    -0.093    33.663     9.370
     4   1 H      0.927     0.074     2.042     2.235
     5   1 H      0.927     0.080     1.982     2.201

 Mol. C6AA /au·bohr⁶  :        397.452766
 Mol. C8AA /au·bohr⁸  :      10368.192591
 Mol. α(0) /au        :         32.053279


Wiberg/Mayer (AO) data.
largest (>0.10) Wiberg bond orders for each atom
          total WBO             WBO to atom ...
     1  C   3.950        C    2 2.084    C    3 1.842
     2  C   3.542        C    1 2.084    H    5 0.962    C    3 0.470
     3  C   3.281        C    1 1.842    H    4 0.952    C    2 0.470
     4  H   0.995        C    3 0.952
     5  H   0.994        C    2 0.962

MOs/occ written to file <molden.input>


molecular dipole:
                 x           y           z       tot (Debye)
 q only:        0.116       0.141      -0.034
   full:        0.308       0.594      -0.135       1.734
molecular quadrupole (traceless):
                xx          xy          yy          xz          yz          zz
 q only:        1.370      -0.722      -0.574       0.011       0.000      -0.796
  q+dip:        4.436      -2.482      -1.792       0.061      -0.018      -2.644
   full:        1.981      -1.854      -1.942       0.249       0.507      -0.039

           -------------------------------------------------
          |                Geometry Summary                 |
           -------------------------------------------------

      molecular mass/u    :       38.0480892
   center of mass at/Å    :       -0.0546036      -0.1466111       0.0317164
  moments of inertia/u·Å² :        0.1075099E+01   0.4665704E+02   0.4773212E+02
rotational constants/cm⁻¹ :        0.1568008E+02   0.3613095E+00   0.3531717E+00

 * 2 selected distances

     #   Z        #   Z                                     value/Å
     1   6 C      2   6 C                                 1.2644100 (min)
     1   6 C      3   6 C                                 1.2940560 (max)

 * 1 distinct bonds (by element types)

   Z      Z             #   av. dist./Å        max./Å        min./Å
   6 C    6 C           2     1.2792330     1.2940560     1.2644100

           -------------------------------------------------
          |               Frequency Printout                |
           -------------------------------------------------
 projected vibrational frequencies (cm-1)
eigval :       -0.00    -0.00    -0.00    -0.00     0.00     0.00
eigval :      138.15   330.56   468.01   739.27   811.61  1325.66
eigval :     1822.48  3156.05  3273.78
 reduced masses (amu)
   1: 10.72   2: 10.83   3: 10.34   4:  9.76   5: 11.14   6:  9.05   7:  4.50   8:  5.58
   9:  9.00  10:  3.61  11:  3.25  12: 11.30  13: 10.99  14:  1.99  15:  2.08
 IR intensities (amu)
   1:  0.14   2:  0.38   3:  0.34   4:  0.31   5:  0.22   6:  0.44   7:  0.79   8:  0.02
   9:  0.18  10:  0.42  11:  0.03  12:  0.22  13:  0.40  14:  0.12  15:  0.06
 Raman intensities (amu)
   1:  0.00   2:  0.00   3:  0.00   4:  0.00   5:  0.00   6:  0.00   7:  0.00   8:  0.00
   9:  0.00  10:  0.00  11:  0.00  12:  0.00  13:  0.00  14:  0.00  15:  0.00
 output can be read by thermo (or use thermo option).
 writing <g98.out> molden fake output.
 recommended (thermochemical) frequency scaling factor: 1.0
           -------------------------------------------------
          |             Thermodynamic Functions             |
           -------------------------------------------------

cs  symmetry found (for desy threshold:  0.10E+00) used in thermo

          ...................................................
          :                      SETUP                      :
          :.................................................:
          :  # frequencies                           9      :
          :  # imaginary freq.                       0      :
          :  linear?                             false      :
          :  only rotor calc.                    false      :
          :  symmetry                               cs      :
          :  rotational number                       1      :
          :  scaling factor                  1.0000000      :
          :  rotor cutoff                   50.0000000 cm⁻¹ :
          :  imag. cutoff                  -20.0000000 cm⁻¹ :
          :.................................................:

    mode    ω/cm⁻¹     T·S(HO)/kcal·mol⁻¹    T·S(FR)/kcal·mol⁻¹   T·S(vib)
   ------------------------------------------------------------------------
       1    138.15    -0.00000 ( 98.31%)     0.00843 (  1.69%)     0.00014
   ------------------------------------------------------------------------

   temp. (K)  partition function   enthalpy   heat capacity  entropy
                                   cal/mol     cal/K/mol   cal/K/mol   J/K/mol
 298.15  VIB   3.03                  929.152      6.398      5.314
         ROT  0.374E+04              888.752      2.981     19.329
         INT  0.113E+05             1817.904      9.379     24.642
         TR   0.227E+27             1481.254      4.968     36.821
         TOT                        3299.1578    14.3471    61.4631   257.1618

   temp. (K)  partition function   enthalpy   heat capacity  entropy
                                   cal/mol     cal/K/mol   cal/K/mol   J/K/mol
 120.00  VIB   1.26                  116.804      2.469      1.448
         ROT   954.                  357.707      2.981     16.616
         INT  0.121E+04              474.510      5.450     18.063
         TR   0.580E+26              596.178      4.968     32.302
         TOT                        1070.6884    10.4181    50.3648   210.7264

   temp. (K)  partition function   enthalpy   heat capacity  entropy
                                   cal/mol     cal/K/mol   cal/K/mol   J/K/mol
 100.00  VIB   1.17                   72.576      1.953      1.047
         ROT   726.                  298.089      2.981     16.072
         INT   850.                  370.665      4.934     17.120
         TR   0.441E+26              496.815      4.968     31.396
         TOT                         867.4798     9.9020    48.5158   202.9900

   temp. (K)  partition function   enthalpy   heat capacity  entropy
                                   cal/mol     cal/K/mol   cal/K/mol   J/K/mol
  80.00  VIB   1.09                   38.703      1.434      0.673
         ROT   520.                  238.471      2.981     15.407
         INT   568.                  277.174      4.415     16.080
         TR   0.316E+26              397.452      4.968     30.288
         TOT                         674.6262     9.3829    46.3679   194.0034

   temp. (K)  partition function   enthalpy   heat capacity  entropy
                                   cal/mol     cal/K/mol   cal/K/mol   J/K/mol
  60.00  VIB   1.04                   15.286      0.904      0.340
         ROT   337.                  178.853      2.981     14.550
         INT   350.                  194.140      3.885     14.889
         TR   0.205E+26              298.089      4.968     28.860
         TOT                         492.2286     8.8528    43.7487   183.0445

   temp. (K)  partition function   enthalpy   heat capacity  entropy
                                   cal/mol     cal/K/mol   cal/K/mol   J/K/mol
  40.00  VIB   1.01                    2.770      0.348      0.090
         ROT   184.                  119.236      2.981     13.341
         INT   185.                  122.006      3.329     13.431
         TR   0.112E+26              198.726      4.968     26.846
         TOT                         320.7320     8.2968    40.2775   168.5210

   temp. (K)  partition function   enthalpy   heat capacity  entropy
                                   cal/mol     cal/K/mol   cal/K/mol   J/K/mol
  20.00  VIB   1.00                    0.019      0.009     -0.002
         ROT   64.9                   59.618      2.981     11.275
         INT   64.9                   59.637      2.990     11.272
         TR   0.395E+25               99.363      4.968     23.404
         TOT                         158.9999     7.9585    34.6765   145.0866

   temp. (K)  partition function   enthalpy   heat capacity  entropy
                                   cal/mol     cal/K/mol   cal/K/mol   J/K/mol
  10.00  VIB   1.00                    0.000      0.000     -0.015
         ROT   23.0                   29.809      2.981      9.208
         INT   23.0                   29.809      2.981      9.193
         TR   0.139E+25               49.681      4.968     19.962
         TOT                          79.4904     7.9490    29.1552   121.9855

       T/K    H(0)-H(T)+PV         H(T)/Eh          T*S/Eh         G(T)/Eh
   ------------------------------------------------------------------------
    298.15    0.525754E-02    0.327450E-01    0.292031E-01    0.354184E-02
    120.00    0.170625E-02    0.291937E-01    0.963137E-02    0.195623E-01
    100.00    0.138242E-02    0.288698E-01    0.773148E-02    0.211383E-01
     80.00    0.107509E-02    0.285625E-01    0.591136E-02    0.226511E-01
     60.00    0.784416E-03    0.282718E-01    0.418308E-02    0.240887E-01
     40.00    0.511119E-03    0.279985E-01    0.256745E-02    0.254311E-01
     20.00    0.253382E-03    0.277408E-01    0.110521E-02    0.266356E-01
     10.00    0.126676E-03    0.276141E-01    0.464618E-03    0.271495E-01 (used)
   ------------------------------------------------------------------------

         :::::::::::::::::::::::::::::::::::::::::::::::::::::
         ::                  THERMODYNAMIC                  ::
         :::::::::::::::::::::::::::::::::::::::::::::::::::::
         :: total free energy          -7.195636716494 Eh   ::
         ::.................................................::
         :: total energy               -7.222786185520 Eh   ::
         :: zero point energy           0.027487411124 Eh   ::
         :: G(RRHO) w/o ZPVE           -0.000337942097 Eh   ::
         :: G(RRHO) contrib.            0.027149469026 Eh   ::
         :::::::::::::::::::::::::::::::::::::::::::::::::::::

optimized geometry written to: xtbopt.xyz


           -------------------------------------------------
          | TOTAL ENERGY               -7.222786185520 Eh   |
          | TOTAL ENTHALPY             -7.195172098380 Eh   |
          | TOTAL FREE ENERGY          -7.195636716494 Eh   |
          | GRADIENT NORM               0.000587456467 Eh/α |
          | HOMO-LUMO GAP               0.427199814852 eV   |
           -------------------------------------------------

------------------------------------------------------------------------
 * finished run on 2020/05/12 at 11:44:26.036     
------------------------------------------------------------------------
 total:
 * wall-time:     0 d,  0 h,  0 min,  0.133 sec
 *  cpu-time:     0 d,  0 h,  0 min,  0.133 sec
 * ratio c/w:     0.999 speedup
 SCF:
 * wall-time:     0 d,  0 h,  0 min,  0.003 sec
 *  cpu-time:     0 d,  0 h,  0 min,  0.003 sec
 * ratio c/w:     1.000 speedup
 ANC optimizer:
 * wall-time:     0 d,  0 h,  0 min,  0.060 sec
 *  cpu-time:     0 d,  0 h,  0 min,  0.060 sec
 * ratio c/w:     0.999 speedup
 numerical hessian:
 * wall-time:     0 d,  0 h,  0 min,  0.055 sec
 *  cpu-time:     0 d,  0 h,  0 min,  0.055 sec
 * ratio c/w:     0.999 speedup

