      -----------------------------------------------------------      
     |                   =====================                   |     
     |                           x T B                           |     
     |                   =====================                   |     
     |                         S. Grimme                         |     
     |          Mulliken Center for Theoretical Chemistry        |     
     |                    University of Bonn                     |     
      -----------------------------------------------------------      

   * xtb version 6.2.2 (9d81278992624c895f80dd42a50cac0aa55982e2) compiled by '@Darwin' on 04/03/2020

   xtb is free software: you can redistribute it and/or modify it under
   the terms of the GNU Lesser General Public License as published by
   the Free Software Foundation, either version 3 of the License, or
   (at your option) any later version.
   
   xtb is distributed in the hope that it will be useful,
   but WITHOUT ANY WARRANTY; without even the implied warranty of
   MERCHANTABILITY or FITNESS FOR A PARTICULAR PURPOSE.  See the
   GNU Lesser General Public License for more details.
   
   Cite this work as:
   * S. Grimme, C. Bannwarth, P. Shushkov, J. Chem. Theory Comput., 2017,
     13, 1989-2009. DOI: 10.1021/acs.jctc.7b00118
   * C. Bannwarth, S. Ehlert and S. Grimme., J. Chem. Theory Comput., 2019,
     15, 1652-1671. DOI: 10.1021/acs.jctc.8b01176
   * P. Pracht, E. Caldeweyher, S. Ehlert, S. Grimme, ChemRxiv, 2019, preprint.
     DOI: 10.26434/chemrxiv.8326202.v1
   
   for DFT-D4:
   * E. Caldeweyher, C. Bannwarth and S. Grimme, J. Chem. Phys., 2017,
     147, 034112. DOI: 10.1063/1.4993215
   * E. Caldeweyher, S. Ehlert, A. Hansen, H. Neugebauer, S. Spicher,
     C. Bannwarth and S. Grimme, J. Chem. Phys., 2019, 150, 154122.
     DOI: 10.1063/1.5090222
   
   for sTDA-xTB:
   * S. Grimme and C. Bannwarth, J. Chem. Phys., 2016, 145, 054103.
     DOI: 10.1063/1.4959605
   
   in the mass-spec context:
   * V. Asgeirsson, C. Bauer and S. Grimme, Chem. Sci., 2017, 8, 4879.
     DOI: 10.1039/c7sc00601b
   
   for metadynamics refer to:
   * S. Grimme, J. Chem. Theory Comput., 2019, 155, 2847-2862
     DOI: 10.1021/acs.jctc.9b00143
   
   with help from (in alphabetical order)
   C. Bannwarth, F. Bohle, G. Brandenburg, E. Caldeweyher, M. Checinski,
   S. Dohm, S. Ehlert, S. Ehrlich, F. März, H. Neugebauer, J. Pisarek,
   P. Pracht, P. Shushkov, and S. Spicher.
   
 * started run on 2020/05/12 at 11:45:00.598     

           -------------------------------------------------
          |                Calculation Setup                |
           -------------------------------------------------

          program call               : xtb --input H1C3N1_26_S_2.input H1C3N1_26_S_2.xyz --ohess --molden --namespace H1C3N1_26_S_2 output.out
          calculation namespace      : H1C3N1_26_S_2
          coordinate file            : H1C3N1_26_S_2.xyz
          number of atoms            :                     5
          number of electrons        :                    18
          charge                     :                     0
          spin                       :                   1.0
          first test random number   :      0.08624255942355

   ID    Z sym.   atoms
    1    6 C      1-3
    2    7 N      4
    3    1 H      5

           -------------------------------------------------
          |                 G F N 2 - x T B                 |
           -------------------------------------------------

        Reference                      10.1021/acs.jctc.8b01176
      * Hamiltonian:
        H0-scaling (s, p, d)           1.850000    2.230000    2.230000
        zeta-weighting                 0.500000
      * Dispersion:
        s8                             2.700000
        a1                             0.520000
        a2                             5.000000
        s9                             5.000000
      * Repulsion:
        kExp                           1.500000    1.000000
        rExp                           1.000000
      * Coulomb:
        alpha                          2.000000
        third order                    shell-resolved
        anisotropic                    true
        a3                             3.000000
        a5                             4.000000
        cn-shift                       1.200000
        cn-exp                         4.000000
        max-rad                        5.000000


          ...................................................
          :                      SETUP                      :
          :.................................................:
          :  # basis functions                  17          :
          :  # atomic orbitals                  17          :
          :  # shells                            9          :
          :  # electrons                        18          :
          :  max. iterations                   250          :
          :  Hamiltonian                  GFN2-xTB          :
          :  restarted?                      false          :
          :  GBSA solvation                  false          :
          :  PC potential                    false          :
          :  electronic temp.          300.0000000     K    :
          :  accuracy                    1.0000000          :
          :  -> integral cutoff          0.2500000E+02      :
          :  -> integral neglect         0.1000000E-07      :
          :  -> SCF convergence          0.1000000E-05 Eh   :
          :  -> wf. convergence          0.1000000E-03 e    :
          :  Broyden damping             0.4000000          :
          ...................................................

 iter      E             dE          RMSdq      gap      omega  full diag
   1     -9.5326966 -0.953270E+01  0.705E+00    1.75       0.0  T
   2     -9.5389784 -0.628185E-02  0.500E+00    1.74       1.0  T
   3     -9.5202327  0.187457E-01  0.328E+00    1.89       1.0  T
   4     -9.5001543  0.200784E-01  0.269E+00    1.51       1.0  T
   5     -9.5572594 -0.571051E-01  0.657E-01    1.76       1.0  T
   6     -9.5596474 -0.238805E-02  0.280E-01    1.70       1.0  T
   7     -9.5594191  0.228293E-03  0.206E-01    1.73       1.0  T
   8     -9.5597166 -0.297456E-03  0.462E-02    1.71       1.0  T
   9     -9.5597215 -0.487164E-05  0.160E-02    1.71       2.8  T
  10     -9.5597227 -0.119898E-05  0.880E-03    1.71       5.1  T
  11     -9.5597232 -0.595316E-06  0.900E-04    1.71      49.7  T
  12     -9.5597232 -0.207058E-08  0.491E-04    1.71      91.1  T

   *** convergence criteria satisfied after 12 iterations ***

         #    Occupation            Energy/Eh            Energy/eV
      -------------------------------------------------------------
         1        2.0000           -0.7420762             -20.1929
       ...           ...                  ...                  ...
         4        2.0000           -0.5922411             -16.1157
         5        2.0000           -0.5213704             -14.1872
         6        2.0000           -0.5121372             -13.9360
         7        2.0000           -0.4793106             -13.0427
         8        2.0000           -0.4701962             -12.7947
         9        1.0000           -0.4014888             -10.9251
        10        1.0000           -0.3899113             -10.6100 (HOMO)
        11                         -0.3271726              -8.9028 (LUMO)
        12                         -0.2321430              -6.3169
        13                         -0.0214848              -0.5846
        14                          0.0034860               0.0949
        15                          0.1201067               3.2683
       ...                                ...                  ...
        17                          0.2337630               6.3610
      -------------------------------------------------------------
                  HL-Gap            0.0627388 Eh            1.7072 eV
             Fermi-level           -0.3971922 Eh          -10.8082 eV

 transition dipole moment (au) for excitation:           9          10
     X       Y       Z   
   0.7162  -0.0788   0.0660  total (au/Debye):    0.724   1.839
 dE (eV)             :    0.315
 oscillator strength :  0.57146E-02

 SCC (total)                   0 d,  0 h,  0 min,  0.004 sec
 SCC setup                      ...        0 min,  0.000 sec (  1.974%)
 Dispersion                     ...        0 min,  0.000 sec (  0.377%)
 integral evaluation            ...        0 min,  0.001 sec ( 23.370%)
 zeroth order Hamiltonian       ...        0 min,  0.000 sec (  0.438%)
 iterations                     ...        0 min,  0.001 sec ( 28.909%)
 molecular gradient             ...        0 min,  0.001 sec ( 24.956%)
 printout                       ...        0 min,  0.001 sec ( 19.772%)

         :::::::::::::::::::::::::::::::::::::::::::::::::::::
         ::                     SUMMARY                     ::
         :::::::::::::::::::::::::::::::::::::::::::::::::::::
         :: total energy              -9.474604308362 Eh    ::
         :: gradient norm              0.117230273813 Eh/a0 ::
         :: HOMO-LUMO gap              1.707208631425 eV    ::
         ::.................................................::
         :: SCC energy                -9.559723248161 Eh    ::
         :: -> isotropic ES           -0.007048184430 Eh    ::
         :: -> anisotropic ES          0.001820472299 Eh    ::
         :: -> anisotropic XC          0.009489946957 Eh    ::
         :: -> dispersion             -0.002120622830 Eh    ::
         :: repulsion energy           0.085118912006 Eh    ::
         :: add. restraining           0.000000000000 Eh    ::
         :::::::::::::::::::::::::::::::::::::::::::::::::::::

      ----------------------------------------------------------- 
     |                   =====================                   |
     |                        A N C O P T                        |
     |                   =====================                   |
     |               Approximate Normal Coordinate               |
     |                Rational Function Optimizer                |
      ----------------------------------------------------------- 

          ...................................................
          :                      SETUP                      :
          :.................................................:
          :   optimization level            normal          :
          :   max. optcycles                   200          :
          :   ANC micro-cycles                  20          :
          :   degrees of freedom                 9          :
          :.................................................:
          :   RF solver                   davidson          :
          :   write xtbopt.log                true          :
          :   linear?                        false          :
          :   energy convergence         0.5000000E-05 Eh   :
          :   grad. convergence          0.1000000E-02 Eh/α :
          :   maximium RF displ.         1.0000000          :
          :   Hlow (freq-cutoff)         0.1000000E-01      :
          :   Hmax (freq-cutoff)         5.0000000          :
          :   S6 in model hess.         20.0000000          :
          ...................................................

generating ANC from model Hessian ...
Using Lindh-Hessian (1995)
 Shifting diagonal of input Hessian by    0.0000000000000000     
 Lowest  eigenvalues of input Hessian
   -0.000000   -0.000000   -0.000000   -0.000000    0.000000    0.000000
    0.048873    0.084228    0.168090    0.642187    0.759083    0.841646
    0.982359    1.418087    1.507339
 Highest eigenvalues
    0.642187    0.759083    0.841646    0.982359    1.418087    1.507339


........................................................................
.............................. CYCLE    1 ..............................
........................................................................
   1     -9.5597232 -0.955972E+01  0.645E-05    1.71       0.0  T
   2     -9.5597232  0.809486E-10  0.117E-04    1.71     383.8  T
   3     -9.5597232 -0.109269E-09  0.248E-05    1.71    1801.9  T
     SCC iter.                  ...        0 min,  0.001 sec
     gradient                   ...        0 min,  0.001 sec
 * total energy  :    -9.4746043 Eh     change       -0.3731886E-08 Eh
   gradient norm :     0.1172325 Eh/α   predicted     0.0000000E+00 (-100.00%)
   displ. norm   :     0.3004019 α      lambda       -0.2230940E-01
   maximum displ.:     0.2538336 α      in ANC's #1, #4, #8, ...

........................................................................
.............................. CYCLE    2 ..............................
........................................................................
   1     -9.5913073 -0.959131E+01  0.143E+00    2.17       0.0  T
   2     -9.5880835  0.322375E-02  0.102E+00    2.28       1.0  T
   3     -9.5854725  0.261106E-02  0.111E+00    2.06       1.0  T
   4     -9.5930018 -0.752933E-02  0.183E-01    2.20       1.0  T
   5     -9.5931156 -0.113804E-03  0.568E-02    2.18       1.0  T
   6     -9.5931143  0.124000E-05  0.322E-02    2.17       1.4  T
   7     -9.5931193 -0.491312E-05  0.101E-02    2.18       4.4  T
   8     -9.5931196 -0.305758E-06  0.549E-03    2.18       8.1  T
   9     -9.5931197 -0.105732E-06  0.322E-04    2.18     138.7  T
  10     -9.5931197 -0.308038E-10  0.597E-05    2.18     748.7  T
     SCC iter.                  ...        0 min,  0.001 sec
     gradient                   ...        0 min,  0.001 sec
 * total energy  :    -9.4922128 Eh     change       -0.1760848E-01 Eh
   gradient norm :     0.0707708 Eh/α   predicted    -0.1216131E-01 ( -30.93%)
   displ. norm   :     0.3198153 α      lambda       -0.1872016E-01
   maximum displ.:     0.2386279 α      in ANC's #4, #1, #8, ...

........................................................................
.............................. CYCLE    3 ..............................
........................................................................
   1     -9.6246661 -0.962467E+01  0.190E+00    2.51       0.0  T
   2     -9.6219215  0.274454E-02  0.125E+00    2.50       1.0  T
   3     -9.6194104  0.251115E-02  0.126E+00    2.34       1.0  T
   4     -9.6280056 -0.859518E-02  0.251E-01    2.48       1.0  T
   5     -9.6281979 -0.192353E-03  0.735E-02    2.44       1.0  T
   6     -9.6282021 -0.421231E-05  0.498E-02    2.44       1.0  T
   7     -9.6282109 -0.878933E-05  0.694E-03    2.44       6.4  T
   8     -9.6282109  0.360223E-07  0.537E-03    2.44       8.3  T
   9     -9.6282110 -0.841950E-07  0.421E-04    2.44     106.3  T
  10     -9.6282110 -0.153598E-09  0.870E-05    2.44     513.8  T
     SCC iter.                  ...        0 min,  0.001 sec
     gradient                   ...        0 min,  0.001 sec
 * total energy  :    -9.5032266 Eh     change       -0.1101379E-01 Eh
   gradient norm :     0.0451709 Eh/α   predicted    -0.1031745E-01 (  -6.32%)
   displ. norm   :     0.3785791 α      lambda       -0.7720230E-02
   maximum displ.:     0.3553451 α      in ANC's #1, #4, #3, ...

........................................................................
.............................. CYCLE    4 ..............................
........................................................................
   1     -9.6185815 -0.961858E+01  0.155E+00    2.18       0.0  T
   2     -9.6141892  0.439225E-02  0.120E+00    2.23       1.0  T
   3     -9.6166019 -0.241266E-02  0.986E-01    2.19       1.0  T
   4     -9.6210404 -0.443848E-02  0.227E-01    2.18       1.0  T
   5     -9.6213211 -0.280720E-03  0.796E-02    2.20       1.0  T
   6     -9.6213291 -0.798800E-05  0.420E-02    2.20       1.1  T
   7     -9.6213297 -0.687491E-06  0.565E-03    2.20       7.9  T
   8     -9.6213298 -0.895087E-07  0.251E-03    2.20      17.8  T
   9     -9.6213298 -0.651184E-08  0.221E-04    2.20     202.7  T
  10     -9.6213298 -0.494857E-10  0.463E-05    2.20     966.2  T
     SCC iter.                  ...        0 min,  0.001 sec
     gradient                   ...        0 min,  0.001 sec
 * total energy  :    -9.5073479 Eh     change       -0.4121299E-02 Eh
   gradient norm :     0.0369110 Eh/α   predicted    -0.4413356E-02 (   7.09%)
   displ. norm   :     0.1035479 α      lambda       -0.2285710E-02
   maximum displ.:     0.0792069 α      in ANC's #4, #1, #6, ...

........................................................................
.............................. CYCLE    5 ..............................
........................................................................
   1     -9.6271118 -0.962711E+01  0.514E-01    1.98       0.0  T
   2     -9.6269230  0.188844E-03  0.368E-01    1.94       1.0  T
   3     -9.6269427 -0.196959E-04  0.303E-01    1.94       1.0  T
   4     -9.6273629 -0.420177E-03  0.858E-02    1.95       1.0  T
   5     -9.6273907 -0.278595E-04  0.408E-02    1.94       1.1  T
   6     -9.6273991 -0.836058E-05  0.135E-02    1.94       3.3  T
   7     -9.6273992 -0.137257E-06  0.222E-03    1.94      20.1  T
   8     -9.6273992 -0.565680E-08  0.107E-03    1.94      41.9  T
   9     -9.6273992 -0.318693E-08  0.131E-04    1.94     341.2  T
  10     -9.6273992 -0.752998E-11  0.239E-05    1.94    1871.2  T
     SCC iter.                  ...        0 min,  0.001 sec
     gradient                   ...        0 min,  0.001 sec
 * total energy  :    -9.5089913 Eh     change       -0.1643401E-02 Eh
   gradient norm :     0.0192189 Eh/α   predicted    -0.1155108E-02 ( -29.71%)
   displ. norm   :     0.1627206 α      lambda       -0.1576740E-02
   maximum displ.:     0.1126202 α      in ANC's #1, #4, #6, ...

........................................................................
.............................. CYCLE    6 ..............................
........................................................................
   1     -9.6280868 -0.962809E+01  0.576E-01    1.73       0.0  T
   2     -9.6276658  0.420997E-03  0.444E-01    1.70       1.0  T
   3     -9.6279964 -0.330607E-03  0.339E-01    1.70       1.0  T
   4     -9.6284587 -0.462334E-03  0.725E-02    1.71       1.0  T
   5     -9.6284733 -0.146138E-04  0.419E-02    1.71       1.1  T
   6     -9.6284816 -0.832576E-05  0.165E-02    1.70       2.7  T
   7     -9.6284820 -0.365178E-06  0.207E-03    1.70      21.6  T
   8     -9.6284820 -0.361639E-08  0.102E-03    1.70      44.0  T
   9     -9.6284820 -0.273510E-08  0.139E-04    1.70     320.8  T
  10     -9.6284820 -0.116298E-10  0.268E-05    1.70    1669.3  T
     SCC iter.                  ...        0 min,  0.001 sec
     gradient                   ...        0 min,  0.001 sec
 * total energy  :    -9.5100721 Eh     change       -0.1080775E-02 Eh
   gradient norm :     0.0172190 Eh/α   predicted    -0.8092440E-03 ( -25.12%)
   displ. norm   :     0.1343279 α      lambda       -0.9724156E-03
   maximum displ.:     0.0900164 α      in ANC's #1, #6, #4, ...

........................................................................
.............................. CYCLE    7 ..............................
........................................................................
   1     -9.6292179 -0.962922E+01  0.420E-01    1.66       0.0  T
   2     -9.6289443  0.273540E-03  0.345E-01    1.66       1.0  T
   3     -9.6292552 -0.310878E-03  0.235E-01    1.66       1.0  T
   4     -9.6294353 -0.180093E-03  0.513E-02    1.66       1.0  T
   5     -9.6294468 -0.115280E-04  0.226E-02    1.66       2.0  T
   6     -9.6294483 -0.150338E-05  0.955E-03    1.65       4.7  T
   7     -9.6294485 -0.214881E-06  0.222E-03    1.66      20.2  T
   8     -9.6294485 -0.701269E-08  0.553E-04    1.66      80.9  T
   9     -9.6294485 -0.743235E-09  0.135E-04    1.66     331.4  T
     SCC iter.                  ...        0 min,  0.001 sec
     gradient                   ...        0 min,  0.001 sec
 * total energy  :    -9.5108185 Eh     change       -0.7464272E-03 Eh
   gradient norm :     0.0171214 Eh/α   predicted    -0.4949811E-03 ( -33.69%)
   displ. norm   :     0.2227551 α      lambda       -0.1197924E-02
   maximum displ.:     0.1570070 α      in ANC's #1, #6, #4, ...

........................................................................
.............................. CYCLE    8 ..............................
........................................................................
   1     -9.6275467 -0.962755E+01  0.698E-01    1.68       0.0  T
   2     -9.6268790  0.667741E-03  0.550E-01    1.68       1.0  T
   3     -9.6277182 -0.839252E-03  0.385E-01    1.68       1.0  T
   4     -9.6281741 -0.455868E-03  0.831E-02    1.68       1.0  T
   5     -9.6282102 -0.361289E-04  0.276E-02    1.68       1.6  T
   6     -9.6282109 -0.737243E-06  0.420E-03    1.68      10.7  T
   7     -9.6282110 -0.536489E-08  0.214E-03    1.68      20.9  T
   8     -9.6282110 -0.552000E-08  0.618E-04    1.68      72.3  T
   9     -9.6282110 -0.498810E-09  0.191E-04    1.68     233.7  T
     SCC iter.                  ...        0 min,  0.001 sec
     gradient                   ...        0 min,  0.001 sec
 * total energy  :    -9.5116348 Eh     change       -0.8163301E-03 Eh
   gradient norm :     0.0184261 Eh/α   predicted    -0.6286841E-03 ( -22.99%)
   displ. norm   :     0.1972414 α      lambda       -0.1470672E-02
   maximum displ.:     0.1467296 α      in ANC's #6, #1, #4, ...

........................................................................
.............................. CYCLE    9 ..............................
........................................................................
   1     -9.6323149 -0.963231E+01  0.756E-01    1.97       0.0  T
   2     -9.6322096  0.105281E-03  0.479E-01    1.98       1.0  T
   3     -9.6315478  0.661823E-03  0.440E-01    1.97       1.0  T
   4     -9.6325328 -0.985020E-03  0.598E-02    1.98       1.0  T
   5     -9.6325466 -0.137583E-04  0.300E-02    1.98       1.5  T
   6     -9.6325489 -0.233930E-05  0.462E-03    1.98       9.7  T
   7     -9.6325489 -0.170564E-07  0.239E-03    1.98      18.7  T
   8     -9.6325489 -0.604274E-08  0.688E-04    1.98      65.0  T
   9     -9.6325489 -0.417348E-09  0.221E-04    1.98     202.8  T
     SCC iter.                  ...        0 min,  0.001 sec
     gradient                   ...        0 min,  0.001 sec
 * total energy  :    -9.5125629 Eh     change       -0.9280506E-03 Eh
   gradient norm :     0.0127921 Eh/α   predicted    -0.7639467E-03 ( -17.68%)
   displ. norm   :     0.1813411 α      lambda       -0.6277886E-03
   maximum displ.:     0.1160553 α      in ANC's #6, #1, #4, ...

........................................................................
.............................. CYCLE   10 ..............................
........................................................................
   1     -9.6304459 -0.963045E+01  0.593E-01    2.12       0.0  T
   2     -9.6303891  0.567537E-04  0.355E-01    2.13       1.0  T
   3     -9.6298738  0.515283E-03  0.365E-01    2.14       1.0  T
   4     -9.6305647 -0.690878E-03  0.446E-02    2.13       1.0  T
   5     -9.6305708 -0.608932E-05  0.228E-02    2.14       2.0  T
   6     -9.6305720 -0.116401E-05  0.138E-02    2.13       3.2  T
   7     -9.6305724 -0.454967E-06  0.185E-03    2.13      24.2  T
   8     -9.6305724 -0.575165E-08  0.642E-04    2.13      69.7  T
   9     -9.6305724 -0.358366E-09  0.103E-04    2.13     432.4  T
     SCC iter.                  ...        0 min,  0.001 sec
     gradient                   ...        0 min,  0.001 sec
 * total energy  :    -9.5128675 Eh     change       -0.3046401E-03 Eh
   gradient norm :     0.0188795 Eh/α   predicted    -0.3242164E-03 (   6.43%)
   displ. norm   :     0.0968340 α      lambda       -0.9833712E-03
   maximum displ.:     0.0771448 α      in ANC's #6, #4, #5, ...

........................................................................
.............................. CYCLE   11 ..............................
........................................................................
   1     -9.6368603 -0.963686E+01  0.358E-01    2.28       0.0  T
   2     -9.6368527  0.759238E-05  0.223E-01    2.27       1.0  T
   3     -9.6366913  0.161463E-03  0.190E-01    2.29       1.0  T
   4     -9.6368912 -0.199901E-03  0.235E-02    2.28       1.9  T
   5     -9.6368932 -0.201640E-05  0.135E-02    2.28       3.3  T
   6     -9.6368937 -0.532730E-06  0.136E-03    2.28      33.0  T
   7     -9.6368937 -0.240770E-08  0.733E-04    2.28      61.0  T
   8     -9.6368937 -0.290237E-09  0.207E-04    2.28     215.9  T
     SCC iter.                  ...        0 min,  0.001 sec
     gradient                   ...        0 min,  0.001 sec
 * total energy  :    -9.5133322 Eh     change       -0.4647370E-03 Eh
   gradient norm :     0.0128795 Eh/α   predicted    -0.4962949E-03 (   6.79%)
   displ. norm   :     0.0972188 α      lambda       -0.3382467E-03
   maximum displ.:     0.0634554 α      in ANC's #6, #4, #1, ...

........................................................................
.............................. CYCLE   12 ..............................
........................................................................
   1     -9.6340928 -0.963409E+01  0.323E-01    2.36       0.0  T
   2     -9.6340853  0.758602E-05  0.205E-01    2.37       1.0  T
   3     -9.6338661  0.219177E-03  0.187E-01    2.36       1.0  T
   4     -9.6341126 -0.246529E-03  0.151E-02    2.37       3.0  T
   5     -9.6341125  0.129771E-06  0.942E-03    2.37       4.7  T
   6     -9.6341128 -0.332601E-06  0.316E-03    2.37      14.1  T
   7     -9.6341129 -0.440194E-07  0.108E-03    2.37      41.4  T
   8     -9.6341129 -0.162897E-08  0.216E-04    2.37     207.1  T
   9     -9.6341129 -0.192948E-10  0.975E-05    2.37     458.5  T
     SCC iter.                  ...        0 min,  0.001 sec
     gradient                   ...        0 min,  0.001 sec
 * total energy  :    -9.5135022 Eh     change       -0.1699629E-03 Eh
   gradient norm :     0.0108736 Eh/α   predicted    -0.1707210E-03 (   0.45%)
   displ. norm   :     0.0443842 α      lambda       -0.2178958E-03
   maximum displ.:     0.0319459 α      in ANC's #2, #6, #3, ...

........................................................................
.............................. CYCLE   13 ..............................
........................................................................
   1     -9.6342047 -0.963420E+01  0.198E-01    2.25       0.0  T
   2     -9.6342089 -0.416316E-05  0.113E-01    2.23       1.0  T
   3     -9.6341765  0.323497E-04  0.798E-02    2.25       1.0  T
   4     -9.6342121 -0.355196E-04  0.204E-02    2.24       2.2  T
   5     -9.6342138 -0.171581E-05  0.711E-03    2.24       6.3  T
   6     -9.6342138  0.197248E-07  0.556E-03    2.24       8.0  T
   7     -9.6342139 -0.137630E-06  0.755E-04    2.24      59.2  T
   8     -9.6342139 -0.843029E-09  0.129E-04    2.24     346.6  T
     SCC iter.                  ...        0 min,  0.001 sec
     gradient                   ...        0 min,  0.001 sec
 * total energy  :    -9.5136195 Eh     change       -0.1172905E-03 Eh
   gradient norm :     0.0039760 Eh/α   predicted    -0.1091611E-03 (  -6.93%)
   displ. norm   :     0.0224273 α      lambda       -0.4069658E-04
   maximum displ.:     0.0134239 α      in ANC's #4, #1, #6, ...

........................................................................
.............................. CYCLE   14 ..............................
........................................................................
   1     -9.6337086 -0.963371E+01  0.868E-02    2.22       0.0  T
   2     -9.6337067  0.190480E-05  0.585E-02    2.22       1.0  T
   3     -9.6337088 -0.206169E-05  0.440E-02    2.22       1.0  T
   4     -9.6337150 -0.620807E-05  0.122E-02    2.22       3.7  T
   5     -9.6337157 -0.724010E-06  0.525E-03    2.22       8.5  T
   6     -9.6337158 -0.100746E-06  0.260E-03    2.22      17.2  T
   7     -9.6337158 -0.123307E-07  0.299E-04    2.22     149.4  T
   8     -9.6337158 -0.108292E-09  0.878E-05    2.22     509.5  T
     SCC iter.                  ...        0 min,  0.001 sec
     gradient                   ...        0 min,  0.001 sec
 * total energy  :    -9.5136430 Eh     change       -0.2351967E-04 Eh
   gradient norm :     0.0034107 Eh/α   predicted    -0.2035761E-04 ( -13.44%)
   displ. norm   :     0.0068888 α      lambda       -0.1129890E-04
   maximum displ.:     0.0031886 α      in ANC's #7, #4, #2, ...

........................................................................
.............................. CYCLE   15 ..............................
........................................................................
   1     -9.6339711 -0.963397E+01  0.318E-02    2.22       0.0  T
   2     -9.6339708  0.312366E-06  0.237E-02    2.22       1.9  T
   3     -9.6339716 -0.845281E-06  0.144E-02    2.23       3.1  T
   4     -9.6339722 -0.558862E-06  0.274E-03    2.22      16.3  T
   5     -9.6339722 -0.260460E-07  0.184E-03    2.22      24.3  T
   6     -9.6339722 -0.128711E-07  0.707E-04    2.22      63.3  T
   7     -9.6339722 -0.710406E-09  0.115E-04    2.22     389.4  T
     SCC iter.                  ...        0 min,  0.001 sec
     gradient                   ...        0 min,  0.001 sec
 * total energy  :    -9.5136514 Eh     change       -0.8354878E-05 Eh
   gradient norm :     0.0021948 Eh/α   predicted    -0.5649577E-05 ( -32.38%)
   displ. norm   :     0.0093547 α      lambda       -0.9918032E-05
   maximum displ.:     0.0057791 α      in ANC's #2, #1, #8, ...

........................................................................
.............................. CYCLE   16 ..............................
........................................................................
   1     -9.6343635 -0.963436E+01  0.353E-02    2.24       0.0  T
   2     -9.6343634  0.625420E-07  0.231E-02    2.24       1.9  T
   3     -9.6343623  0.115237E-05  0.184E-02    2.24       2.4  T
   4     -9.6343639 -0.161770E-05  0.389E-03    2.24      11.5  T
   5     -9.6343640 -0.669841E-07  0.191E-03    2.24      23.4  T
   6     -9.6343640 -0.957296E-08  0.942E-04    2.24      47.5  T
   7     -9.6343640 -0.239081E-08  0.162E-04    2.24     275.6  T
     SCC iter.                  ...        0 min,  0.001 sec
     gradient                   ...        0 min,  0.001 sec
 * total energy  :    -9.5136573 Eh     change       -0.5905071E-05 Eh
   gradient norm :     0.0008939 Eh/α   predicted    -0.4959096E-05 ( -16.02%)
   displ. norm   :     0.0040181 α      lambda       -0.1318472E-05
   maximum displ.:     0.0020823 α      in ANC's #2, #1, #8, ...

........................................................................
.............................. CYCLE   17 ..............................
........................................................................
   1     -9.6345064 -0.963451E+01  0.182E-02    2.24       0.0  T
   2     -9.6345064  0.298645E-08  0.116E-02    2.24       3.9  T
   3     -9.6345060  0.447686E-06  0.920E-03    2.24       4.9  T
   4     -9.6345065 -0.505523E-06  0.171E-03    2.24      26.1  T
   5     -9.6345065 -0.132730E-07  0.749E-04    2.24      59.7  T
   6     -9.6345065 -0.240606E-09  0.443E-04    2.24     100.9  T
     SCC iter.                  ...        0 min,  0.000 sec
     gradient                   ...        0 min,  0.001 sec
 * total energy  :    -9.5136582 Eh     change       -0.9347825E-06 Eh
   gradient norm :     0.0003313 Eh/α   predicted    -0.6601800E-06 ( -29.38%)
   displ. norm   :     0.0013821 α      lambda       -0.1815970E-06
   maximum displ.:     0.0011549 α      in ANC's #2, #7, #3, ...

   *** GEOMETRY OPTIMIZATION CONVERGED AFTER 17 ITERATIONS ***

------------------------------------------------------------------------
 total energy gain   :        -0.0390539 Eh      -24.5067 kcal/mol
 total RMSD          :         0.8596482 a0        0.4549 Å
 total power (kW/mol):        -6.0315294 (step)-2047.6171 (real)
------------------------------------------------------------------------

 ANCopt (total)                0 d,  0 h,  0 min,  0.050 sec
 optimizer setup                ...        0 min,  0.000 sec (  0.178%)
 model hessian                  ...        0 min,  0.000 sec (  0.246%)
 ANC generation                 ...        0 min,  0.000 sec (  0.112%)
 coordinate transformation      ...        0 min,  0.000 sec (  0.078%)
 single point calculation       ...        0 min,  0.048 sec ( 96.723%)
 optimization log               ...        0 min,  0.000 sec (  0.806%)
 hessian update                 ...        0 min,  0.000 sec (  0.072%)
 rational function              ...        0 min,  0.000 sec (  0.735%)

================
 final structure:
================
5
 xtb: 6.2.2 (9d81278992624c895f80dd42a50cac0aa55982e2)
C         0.66165676390954    0.02725652621639    0.11687866052763
C        -0.44994976075761    0.85375303163494   -0.11011124441124
C        -1.54012453351473   -0.03613936992995    0.10174913249460
N        -0.38993698317297   -0.77698864377312   -0.18087030377952
H         1.71835451353577   -0.06788154414826    0.07235475516853

 Bond Distances (Angstroems)
 ---------------------------
C1-C2=1.4037         C1-N4=1.3570         C1-H5=1.0619         C2-C1=1.4037         C2-C3=1.4231         C2-N4=1.6334         
C3-C2=1.4231         C3-N4=1.3970         N4-C1=1.3570         N4-C2=1.6334         N4-C3=1.3970         H5-C1=1.0619         
 C  H  Rav=1.0619 sigma=0.0000  Rmin=1.0619  Rmax=1.0619     1
 C  C  Rav=1.4134 sigma=0.0097  Rmin=1.4037  Rmax=1.4231     2
 N  C  Rav=1.4624 sigma=0.1220  Rmin=1.3570  Rmax=1.6334     3

 selected bond angles (degree)
 --------------------
N4-C1-C2= 72.53                H5-C1-C2=146.51                H5-C1-N4=135.14                C3-C2-C1=102.38                
N4-C2-C1= 52.41                N4-C2-C3= 53.86                N4-C3-C2= 70.78                C2-N4-C1= 55.06                
C3-N4-C1=106.22                C3-N4-C2= 55.36                

 selected dihedral angles (degree)
 ---------------------------------
C3-C2-C1-N4= 21.44            C3-C2-C1-H5=172.03            N4-C2-C1-H5=150.59            N4-C3-C2-C1=338.99            
C2-N4-C1-H5=202.59            C3-N4-C1-C2=337.75            C3-N4-C1-H5=180.33            C1-N4-C2-C3=206.23            
C3-N4-C2-C1=153.77            C1-N4-C3-C2= 22.17            
           -------------------------------------------------
          |                Final Singlepoint                |
           -------------------------------------------------

          ...................................................
          :                      SETUP                      :
          :.................................................:
          :  # basis functions                  17          :
          :  # atomic orbitals                  17          :
          :  # shells                            9          :
          :  # electrons                        18          :
          :  max. iterations                   250          :
          :  Hamiltonian                  GFN2-xTB          :
          :  restarted?                      false          :
          :  GBSA solvation                  false          :
          :  PC potential                    false          :
          :  electronic temp.          300.0000000     K    :
          :  accuracy                    1.0000000          :
          :  -> integral cutoff          0.2500000E+02      :
          :  -> integral neglect         0.1000000E-07      :
          :  -> SCF convergence          0.1000000E-05 Eh   :
          :  -> wf. convergence          0.1000000E-03 e    :
          :  Broyden damping             0.4000000          :
          ...................................................

 iter      E             dE          RMSdq      gap      omega  full diag
   1     -9.6345065 -0.963451E+01  0.152E-04    2.24       0.0  T
   2     -9.6345065  0.482103E-11  0.834E-05    2.24     536.3  T
   3     -9.6345065  0.359890E-10  0.997E-05    2.24     448.7  T

   *** convergence criteria satisfied after 3 iterations ***

         #    Occupation            Energy/Eh            Energy/eV
      -------------------------------------------------------------
         1        2.0000           -0.7390099             -20.1095
       ...           ...                  ...                  ...
         4        2.0000           -0.5695431             -15.4981
         5        2.0000           -0.5605370             -15.2530
         6        2.0000           -0.5290036             -14.3949
         7        2.0000           -0.4797014             -13.0533
         8        2.0000           -0.4221794             -11.4881
         9        1.0000           -0.3925193             -10.6810
        10        1.0000           -0.3633783              -9.8880 (HOMO)
        11                         -0.2809750              -7.6457 (LUMO)
        12                         -0.2216250              -6.0307
        13                          0.0243006               0.6613
        14                          0.0836153               2.2753
        15                          0.1238910               3.3712
       ...                                ...                  ...
        17                          0.5623065              15.3011
      -------------------------------------------------------------
                  HL-Gap            0.0824033 Eh            2.2423 eV
             Fermi-level           -0.3647630 Eh           -9.9257 eV

 transition dipole moment (au) for excitation:           9          10
     X       Y       Z   
   0.4316  -0.2434   0.1452  total (au/Debye):    0.516   1.312
 dE (eV)             :    0.793
 oscillator strength :  0.73237E-02

 SCC (total)                   0 d,  0 h,  0 min,  0.003 sec
 SCC setup                      ...        0 min,  0.000 sec (  1.518%)
 Dispersion                     ...        0 min,  0.000 sec (  0.298%)
 integral evaluation            ...        0 min,  0.001 sec ( 30.161%)
 zeroth order Hamiltonian       ...        0 min,  0.000 sec (  0.363%)
 iterations                     ...        0 min,  0.000 sec ( 13.562%)
 molecular gradient             ...        0 min,  0.001 sec ( 31.360%)
 printout                       ...        0 min,  0.001 sec ( 22.425%)

         :::::::::::::::::::::::::::::::::::::::::::::::::::::
         ::                     SUMMARY                     ::
         :::::::::::::::::::::::::::::::::::::::::::::::::::::
         :: total energy              -9.513658204816 Eh    ::
         :: gradient norm              0.000350592666 Eh/a0 ::
         :: HOMO-LUMO gap              2.242307476035 eV    ::
         ::.................................................::
         :: SCC energy                -9.634506500243 Eh    ::
         :: -> isotropic ES           -0.004435625483 Eh    ::
         :: -> anisotropic ES          0.001202004571 Eh    ::
         :: -> anisotropic XC          0.008238482143 Eh    ::
         :: -> dispersion             -0.002109818167 Eh    ::
         :: repulsion energy           0.120848295752 Eh    ::
         :: add. restraining           0.000000000000 Eh    ::
         :::::::::::::::::::::::::::::::::::::::::::::::::::::

           ------------------------------------------------- 
          |                Numerical Hessian                |
           ------------------------------------------------- 
step length          :   0.00500
SCC accuracy         :   0.30000
Hessian scale factor :   1.00000
frozen atoms in %    :   0.00000    0
RMS gradient         :   0.00035
estimated CPU  time      0.00 min
estimated wall time      0.00 min

writing file <hessian>.

 projected vibrational frequencies (cm-1)
eigval :       -0.00    -0.00    -0.00     0.00     0.00     0.00
eigval :      385.46   449.10   692.71   802.15   942.72  1123.72
eigval :     1275.79  1425.85  3232.89
           -------------------------------------------------
          |                Property Printout                |
           -------------------------------------------------

    * Orbital Energies and Occupations

         #    Occupation            Energy/Eh            Energy/eV
      -------------------------------------------------------------
         1        2.0000           -0.7390098             -20.1095
         2        2.0000           -0.6509207             -17.7125
         3        2.0000           -0.6108273             -16.6215
         4        2.0000           -0.5695432             -15.4981
         5        2.0000           -0.5605371             -15.2530
         6        2.0000           -0.5290035             -14.3949
         7        2.0000           -0.4797014             -13.0533
         8        2.0000           -0.4221787             -11.4881
         9        1.0000           -0.3925194             -10.6810
        10        1.0000           -0.3633780              -9.8880 (HOMO)
        11                         -0.2809750              -7.6457 (LUMO)
        12                         -0.2216249              -6.0307
        13                          0.0243009               0.6613
        14                          0.0836149               2.2753
        15                          0.1238911               3.3712
        16                          0.3056445               8.3170
        17                          0.5623062              15.3011
      -------------------------------------------------------------
                  HL-Gap            0.0824030 Eh            2.2423 eV
             Fermi-level           -0.3647628 Eh           -9.9257 eV

     #   Z        covCN         q      C6AA      α(0)
     1   6 C      2.956     0.054    26.791     8.490
     2   6 C      2.830     0.017    27.611     8.611
     3   6 C      2.027    -0.105    33.903     9.404
     4   7 N      2.690    -0.048    22.168     6.993
     5   1 H      0.927     0.081     1.965     2.192

 Mol. C6AA /au·bohr⁶  :        499.235795
 Mol. C8AA /au·bohr⁸  :      13065.237457
 Mol. α(0) /au        :         35.689290


Wiberg/Mayer (AO) data.
largest (>0.10) Wiberg bond orders for each atom
          total WBO             WBO to atom ...
     1  C   3.409        N    4 1.188    C    2 1.152    H    5 0.960    C    3 0.109
     2  C   2.910        C    1 1.152    C    3 1.122    N    4 0.630
     3  C   2.324        C    2 1.122    N    4 1.079    C    1 0.109
     4  N   2.902        C    1 1.188    C    3 1.079    C    2 0.630
     5  H   0.984        C    1 0.960

MOs/occ written to file <molden.input>


molecular dipole:
                 x           y           z       tot (Debye)
 q only:        0.657       0.098       0.016
   full:        1.332       0.006      -0.113       3.399
molecular quadrupole (traceless):
                xx          xy          yy          xz          yz          zz
 q only:        0.071      -0.190      -0.074       0.151      -0.044       0.004
  q+dip:       -0.770      -0.179      -0.362       0.675      -0.259       1.132
   full:       -2.315      -0.153      -0.169       0.827      -0.202       2.484

           -------------------------------------------------
          |                Geometry Summary                 |
           -------------------------------------------------

      molecular mass/u    :       51.0468517
   center of mass at/Å    :       -0.3856264      -0.0157474      -0.0226661
  moments of inertia/u·Å² :        0.1809501E+02   0.3452585E+02   0.5096395E+02
rotational constants/cm⁻¹ :        0.9316177E+00   0.4882612E+00   0.3307756E+00

 * 3 selected distances

     #   Z        #   Z                                     value/Å
     1   6 C      2   6 C                                 1.4036702 (max)
     1   6 C      4   7 N                                 1.3569503
     1   6 C      5   1 H                                 1.0619057 (min)

 * 3 distinct bonds (by element types)

   Z      Z             #   av. dist./Å        max./Å        min./Å
   1 H    6 C           1     1.0619057     1.0619057     1.0619057
   6 C    6 C           1     1.4036702     1.4036702     1.4036702
   6 C    7 N           1     1.3569503     1.3569503     1.3569503

           -------------------------------------------------
          |               Frequency Printout                |
           -------------------------------------------------
 projected vibrational frequencies (cm-1)
eigval :       -0.00    -0.00    -0.00     0.00     0.00     0.00
eigval :      385.46   449.10   692.71   802.15   942.72  1123.72
eigval :     1275.79  1425.85  3232.89
 reduced masses (amu)
   1: 10.50   2: 12.54   3: 12.68   4: 12.31   5: 12.49   6: 11.40   7: 11.61   8:  3.65
   9: 10.92  10: 11.04  11:  5.54  12: 12.35  13: 12.20  14: 11.92  15:  1.98
 IR intensities (amu)
   1:  0.23   2:  0.10   3:  0.16   4:  0.08   5:  0.18   6:  0.18   7:  0.52   8:  0.14
   9:  0.88  10:  0.82  11:  0.61  12:  0.37  13:  0.55  14:  0.30  15:  0.10
Molecule has no symmetry elements
It seems to be the C1 point group
 Raman intensities (amu)
   1:  0.00   2:  0.00   3:  0.00   4:  0.00   5:  0.00   6:  0.00   7:  0.00   8:  0.00
   9:  0.00  10:  0.00  11:  0.00  12:  0.00  13:  0.00  14:  0.00  15:  0.00
 output can be read by thermo (or use thermo option).
 writing <g98.out> molden fake output.
 recommended (thermochemical) frequency scaling factor: 1.0
           -------------------------------------------------
          |             Thermodynamic Functions             |
           -------------------------------------------------

c1  symmetry found (for desy threshold:  0.10E+00) used in thermo

          ...................................................
          :                      SETUP                      :
          :.................................................:
          :  # frequencies                           9      :
          :  # imaginary freq.                       0      :
          :  linear?                             false      :
          :  only rotor calc.                    false      :
          :  symmetry                               c1      :
          :  rotational number                       1      :
          :  scaling factor                  1.0000000      :
          :  rotor cutoff                   50.0000000 cm⁻¹ :
          :  imag. cutoff                  -20.0000000 cm⁻¹ :
          :.................................................:

    mode    ω/cm⁻¹     T·S(HO)/kcal·mol⁻¹    T·S(FR)/kcal·mol⁻¹   T·S(vib)
   ------------------------------------------------------------------------
   ------------------------------------------------------------------------

   temp. (K)  partition function   enthalpy   heat capacity  entropy
                                   cal/mol     cal/K/mol   cal/K/mol   J/K/mol
 298.15  VIB   1.44                  545.576      5.317      2.558
         ROT  0.136E+05              888.752      2.981     21.900
         INT  0.197E+05             1434.328      8.297     24.457
         TR   0.353E+27             1481.254      4.968     37.697
         TOT                        2915.5821    13.2656    62.1539   260.0518

   temp. (K)  partition function   enthalpy   heat capacity  entropy
                                   cal/mol     cal/K/mol   cal/K/mol   J/K/mol
 120.00  VIB   1.01                   17.547      0.743      0.176
         ROT  0.348E+04              357.707      2.981     19.187
         INT  0.353E+04              375.254      3.723     19.363
         TR   0.901E+26              596.178      4.968     33.177
         TOT                         971.4321     8.6915    52.5399   219.8271

   temp. (K)  partition function   enthalpy   heat capacity  entropy
                                   cal/mol     cal/K/mol   cal/K/mol   J/K/mol
 100.00  VIB   1.01                    6.447      0.383      0.076
         ROT  0.265E+04              298.089      2.981     18.643
         INT  0.266E+04              304.536      3.364     18.719
         TR   0.685E+26              496.815      4.968     32.272
         TOT                         801.3514     8.3319    50.9908   213.3456

   temp. (K)  partition function   enthalpy   heat capacity  entropy
                                   cal/mol     cal/K/mol   cal/K/mol   J/K/mol
  80.00  VIB   1.00                    1.484      0.135      0.021
         ROT  0.189E+04              238.471      2.981     17.978
         INT  0.190E+04              239.956      3.116     17.999
         TR   0.490E+26              397.452      4.968     31.164
         TOT                         637.4076     8.0841    49.1632   205.6986

   temp. (K)  partition function   enthalpy   heat capacity  entropy
                                   cal/mol     cal/K/mol   cal/K/mol   J/K/mol
  60.00  VIB   1.00                    0.134      0.021      0.002
         ROT  0.123E+04              178.853      2.981     17.121
         INT  0.123E+04              178.987      3.002     17.123
         TR   0.319E+26              298.089      4.968     29.735
         TOT                         477.0762     7.9704    46.8583   196.0550

   temp. (K)  partition function   enthalpy   heat capacity  entropy
                                   cal/mol     cal/K/mol   cal/K/mol   J/K/mol
  40.00  VIB   1.00                    0.001      0.000     -0.000
         ROT   670.                  119.236      2.981     15.912
         INT   670.                  119.237      2.981     15.912
         TR   0.173E+26              198.726      4.968     27.722
         TOT                         317.9628     7.9495    43.6336   182.5628

   temp. (K)  partition function   enthalpy   heat capacity  entropy
                                   cal/mol     cal/K/mol   cal/K/mol   J/K/mol
  20.00  VIB   1.00                    0.000      0.000     -0.001
         ROT   237.                   59.618      2.981     13.846
         INT   237.                   59.618      2.981     13.845
         TR   0.613E+25               99.363      4.968     24.280
         TOT                         158.9808     7.9490    38.1250   159.5150

   temp. (K)  partition function   enthalpy   heat capacity  entropy
                                   cal/mol     cal/K/mol   cal/K/mol   J/K/mol
  10.00  VIB   1.00                    0.000      0.000     -0.001
         ROT   83.7                   29.809      2.981     11.780
         INT   83.7                   29.809      2.981     11.779
         TR   0.217E+25               49.681      4.968     20.838
         TOT                          79.4904     7.9490    32.6165   136.4674

       T/K    H(0)-H(T)+PV         H(T)/Eh          T*S/Eh         G(T)/Eh
   ------------------------------------------------------------------------
    298.15    0.464628E-02    0.281806E-01    0.295313E-01   -0.135067E-02
    120.00    0.154808E-02    0.250824E-01    0.100473E-01    0.150351E-01
    100.00    0.127703E-02    0.248114E-01    0.812591E-02    0.166855E-01
     80.00    0.101577E-02    0.245501E-01    0.626772E-02    0.182824E-01
     60.00    0.760269E-03    0.242946E-01    0.448040E-02    0.198142E-01
     40.00    0.506706E-03    0.240411E-01    0.278138E-02    0.212597E-01
     20.00    0.253352E-03    0.237877E-01    0.121512E-02    0.225726E-01
     10.00    0.126676E-03    0.236610E-01    0.519777E-03    0.231413E-01 (used)
   ------------------------------------------------------------------------

         :::::::::::::::::::::::::::::::::::::::::::::::::::::
         ::                  THERMODYNAMIC                  ::
         :::::::::::::::::::::::::::::::::::::::::::::::::::::
         :: total free energy          -9.490516948273 Eh   ::
         ::.................................................::
         :: total energy               -9.513658205822 Eh   ::
         :: zero point energy           0.023534358511 Eh   ::
         :: G(RRHO) w/o ZPVE           -0.000393100963 Eh   ::
         :: G(RRHO) contrib.            0.023141257549 Eh   ::
         :::::::::::::::::::::::::::::::::::::::::::::::::::::

optimized geometry written to: xtbopt.xyz


           -------------------------------------------------
          | TOTAL ENERGY               -9.513658205822 Eh   |
          | TOTAL ENTHALPY             -9.489997171295 Eh   |
          | TOTAL FREE ENERGY          -9.490516948273 Eh   |
          | GRADIENT NORM               0.000350384245 Eh/α |
          | HOMO-LUMO GAP               2.242300573916 eV   |
           -------------------------------------------------

------------------------------------------------------------------------
 * finished run on 2020/05/12 at 11:45:00.755     
------------------------------------------------------------------------
 total:
 * wall-time:     0 d,  0 h,  0 min,  0.156 sec
 *  cpu-time:     0 d,  0 h,  0 min,  0.155 sec
 * ratio c/w:     0.994 speedup
 SCF:
 * wall-time:     0 d,  0 h,  0 min,  0.004 sec
 *  cpu-time:     0 d,  0 h,  0 min,  0.004 sec
 * ratio c/w:     0.998 speedup
 ANC optimizer:
 * wall-time:     0 d,  0 h,  0 min,  0.054 sec
 *  cpu-time:     0 d,  0 h,  0 min,  0.054 sec
 * ratio c/w:     0.999 speedup
 numerical hessian:
 * wall-time:     0 d,  0 h,  0 min,  0.081 sec
 *  cpu-time:     0 d,  0 h,  0 min,  0.080 sec
 * ratio c/w:     0.998 speedup

