      -----------------------------------------------------------      
     |                   =====================                   |     
     |                           x T B                           |     
     |                   =====================                   |     
     |                         S. Grimme                         |     
     |          Mulliken Center for Theoretical Chemistry        |     
     |                    University of Bonn                     |     
      -----------------------------------------------------------      

   * xtb version 6.2.2 (9d81278992624c895f80dd42a50cac0aa55982e2) compiled by '@Darwin' on 04/03/2020

   xtb is free software: you can redistribute it and/or modify it under
   the terms of the GNU Lesser General Public License as published by
   the Free Software Foundation, either version 3 of the License, or
   (at your option) any later version.
   
   xtb is distributed in the hope that it will be useful,
   but WITHOUT ANY WARRANTY; without even the implied warranty of
   MERCHANTABILITY or FITNESS FOR A PARTICULAR PURPOSE.  See the
   GNU Lesser General Public License for more details.
   
   Cite this work as:
   * S. Grimme, C. Bannwarth, P. Shushkov, J. Chem. Theory Comput., 2017,
     13, 1989-2009. DOI: 10.1021/acs.jctc.7b00118
   * C. Bannwarth, S. Ehlert and S. Grimme., J. Chem. Theory Comput., 2019,
     15, 1652-1671. DOI: 10.1021/acs.jctc.8b01176
   * P. Pracht, E. Caldeweyher, S. Ehlert, S. Grimme, ChemRxiv, 2019, preprint.
     DOI: 10.26434/chemrxiv.8326202.v1
   
   for DFT-D4:
   * E. Caldeweyher, C. Bannwarth and S. Grimme, J. Chem. Phys., 2017,
     147, 034112. DOI: 10.1063/1.4993215
   * E. Caldeweyher, S. Ehlert, A. Hansen, H. Neugebauer, S. Spicher,
     C. Bannwarth and S. Grimme, J. Chem. Phys., 2019, 150, 154122.
     DOI: 10.1063/1.5090222
   
   for sTDA-xTB:
   * S. Grimme and C. Bannwarth, J. Chem. Phys., 2016, 145, 054103.
     DOI: 10.1063/1.4959605
   
   in the mass-spec context:
   * V. Asgeirsson, C. Bauer and S. Grimme, Chem. Sci., 2017, 8, 4879.
     DOI: 10.1039/c7sc00601b
   
   for metadynamics refer to:
   * S. Grimme, J. Chem. Theory Comput., 2019, 155, 2847-2862
     DOI: 10.1021/acs.jctc.9b00143
   
   with help from (in alphabetical order)
   C. Bannwarth, F. Bohle, G. Brandenburg, E. Caldeweyher, M. Checinski,
   S. Dohm, S. Ehlert, S. Ehrlich, F. März, H. Neugebauer, J. Pisarek,
   P. Pracht, P. Shushkov, and S. Spicher.
   
 * started run on 2020/05/12 at 11:44:34.834     

           -------------------------------------------------
          |                Calculation Setup                |
           -------------------------------------------------

          program call               : xtb --input C5_8_S_2.input C5_8_S_2.xyz --ohess --molden --namespace C5_8_S_2 output.out
          calculation namespace      : C5_8_S_2
          coordinate file            : C5_8_S_2.xyz
          number of atoms            :                     5
          number of electrons        :                    20
          charge                     :                     0
          spin                       :                   1.0
          first test random number   :      0.16158105185257

   ID    Z sym.   atoms
    1    6 C      1-5

           -------------------------------------------------
          |                 G F N 2 - x T B                 |
           -------------------------------------------------

        Reference                      10.1021/acs.jctc.8b01176
      * Hamiltonian:
        H0-scaling (s, p, d)           1.850000    2.230000    2.230000
        zeta-weighting                 0.500000
      * Dispersion:
        s8                             2.700000
        a1                             0.520000
        a2                             5.000000
        s9                             5.000000
      * Repulsion:
        kExp                           1.500000    1.000000
        rExp                           1.000000
      * Coulomb:
        alpha                          2.000000
        third order                    shell-resolved
        anisotropic                    true
        a3                             3.000000
        a5                             4.000000
        cn-shift                       1.200000
        cn-exp                         4.000000
        max-rad                        5.000000


          ...................................................
          :                      SETUP                      :
          :.................................................:
          :  # basis functions                  20          :
          :  # atomic orbitals                  20          :
          :  # shells                           10          :
          :  # electrons                        20          :
          :  max. iterations                   250          :
          :  Hamiltonian                  GFN2-xTB          :
          :  restarted?                      false          :
          :  GBSA solvation                  false          :
          :  PC potential                    false          :
          :  electronic temp.          300.0000000     K    :
          :  accuracy                    1.0000000          :
          :  -> integral cutoff          0.2500000E+02      :
          :  -> integral neglect         0.1000000E-07      :
          :  -> SCF convergence          0.1000000E-05 Eh   :
          :  -> wf. convergence          0.1000000E-03 e    :
          :  Broyden damping             0.4000000          :
          ...................................................

 iter      E             dE          RMSdq      gap      omega  full diag
   1     -9.8660634 -0.986606E+01  0.120E+01    0.68       0.0  T
   2     -7.6094462  0.225662E+01  0.174E+01    0.02       1.0  T
   3     -9.2074613 -0.159802E+01  0.102E+01    1.49       1.0  T
   4    -10.0017325 -0.794271E+00  0.524E+00    0.47       1.0  T
   5    -10.1670652 -0.165333E+00  0.308E+00    0.24       1.0  T
   6    -10.1671091 -0.438981E-04  0.241E+00    0.31       1.0  T
   7    -10.1691958 -0.208676E-02  0.173E+00    0.27       1.0  T
   8    -10.1679825  0.121337E-02  0.729E-01    0.22       1.0  T
   9    -10.1697792 -0.179672E-02  0.485E-01    0.22       1.0  T
  10    -10.1708388 -0.105966E-02  0.237E-01    0.24       1.0  T
  11    -10.1709746 -0.135785E-03  0.185E-01    0.24       1.0  T
  12    -10.1711162 -0.141547E-03  0.903E-02    0.23       1.0  T
  13    -10.1711691 -0.529470E-04  0.111E-02    0.23       4.0  T
  14    -10.1711690  0.680631E-07  0.104E-02    0.23       4.3  T
  15    -10.1711695 -0.417327E-06  0.132E-03    0.23      33.9  T
  16    -10.1711695 -0.378937E-08  0.442E-04    0.23     101.2  T
  17    -10.1711695 -0.478854E-09  0.268E-04    0.23     166.8  T

   *** convergence criteria satisfied after 17 iterations ***

         #    Occupation            Energy/Eh            Energy/eV
      -------------------------------------------------------------
         1        2.0000           -0.7575234             -20.6133
       ...           ...                  ...                  ...
         5        2.0000           -0.5519518             -15.0194
         6        2.0000           -0.5329495             -14.5023
         7        2.0000           -0.5183164             -14.1041
         8        2.0000           -0.5052907             -13.7497
         9        2.0000           -0.4739135             -12.8958
        10        1.0000           -0.4373280             -11.9003
        11        0.9886           -0.4155897             -11.3088 (HOMO)
        12        0.0114           -0.4071071             -11.0779 (LUMO)
        13                         -0.3908928             -10.6367
        14                         -0.3250148              -8.8441
        15                         -0.2673385              -7.2747
        16                         -0.0190061              -0.5172
       ...                                ...                  ...
        20                          0.1731272               4.7110
      -------------------------------------------------------------
                  HL-Gap            0.0084826 Eh            0.2308 eV
             Fermi-level           -0.4334846 Eh          -11.7957 eV

 transition dipole moment (au) for excitation:          10          11
     X       Y       Z   
  -0.0253  -0.2164   0.0039  total (au/Debye):    0.218   0.554
 dE (eV)             :    0.592
 oscillator strength :  0.97340E-03

 SCC (total)                   0 d,  0 h,  0 min,  0.006 sec
 SCC setup                      ...        0 min,  0.000 sec (  1.469%)
 Dispersion                     ...        0 min,  0.000 sec (  0.335%)
 integral evaluation            ...        0 min,  0.001 sec ( 22.853%)
 zeroth order Hamiltonian       ...        0 min,  0.000 sec (  0.369%)
 iterations                     ...        0 min,  0.002 sec ( 32.167%)
 molecular gradient             ...        0 min,  0.002 sec ( 24.048%)
 printout                       ...        0 min,  0.001 sec ( 18.627%)

         :::::::::::::::::::::::::::::::::::::::::::::::::::::
         ::                     SUMMARY                     ::
         :::::::::::::::::::::::::::::::::::::::::::::::::::::
         :: total energy             -10.081510194869 Eh    ::
         :: gradient norm              0.178774525113 Eh/a0 ::
         :: HOMO-LUMO gap              0.230823199275 eV    ::
         ::.................................................::
         :: SCC energy               -10.171169471224 Eh    ::
         :: -> isotropic ES           -0.030969709359 Eh    ::
         :: -> anisotropic ES          0.001293796221 Eh    ::
         :: -> anisotropic XC          0.008047060762 Eh    ::
         :: -> dispersion             -0.002926997265 Eh    ::
         :: repulsion energy           0.089659178763 Eh    ::
         :: add. restraining           0.000000000000 Eh    ::
         :::::::::::::::::::::::::::::::::::::::::::::::::::::

      ----------------------------------------------------------- 
     |                   =====================                   |
     |                        A N C O P T                        |
     |                   =====================                   |
     |               Approximate Normal Coordinate               |
     |                Rational Function Optimizer                |
      ----------------------------------------------------------- 

          ...................................................
          :                      SETUP                      :
          :.................................................:
          :   optimization level            normal          :
          :   max. optcycles                   200          :
          :   ANC micro-cycles                  20          :
          :   degrees of freedom                 9          :
          :.................................................:
          :   RF solver                   davidson          :
          :   write xtbopt.log                true          :
          :   linear?                        false          :
          :   energy convergence         0.5000000E-05 Eh   :
          :   grad. convergence          0.1000000E-02 Eh/α :
          :   maximium RF displ.         1.0000000          :
          :   Hlow (freq-cutoff)         0.1000000E-01      :
          :   Hmax (freq-cutoff)         5.0000000          :
          :   S6 in model hess.         20.0000000          :
          ...................................................

generating ANC from model Hessian ...
Using Lindh-Hessian (1995)
 Shifting diagonal of input Hessian by    0.0000000000000000     
 Lowest  eigenvalues of input Hessian
   -0.000000   -0.000000   -0.000000    0.000000    0.000000    0.000000
    0.071386    0.076781    0.111625    0.500214    0.559613    0.868720
    0.895119    1.227396    1.365718
 Highest eigenvalues
    0.500214    0.559613    0.868720    0.895119    1.227396    1.365718


........................................................................
.............................. CYCLE    1 ..............................
........................................................................
   1    -10.1711695 -0.101712E+02  0.235E-05    0.23       0.0  T
   2    -10.1711695  0.117405E-09  0.113E-04    0.23     396.3  T
   3    -10.1711695 -0.112454E-09  0.288E-05    0.23    1553.7  T
     SCC iter.                  ...        0 min,  0.001 sec
     gradient                   ...        0 min,  0.001 sec
 * total energy  :   -10.0815102 Eh     change        0.1582638E-08 Eh
   gradient norm :     0.1787752 Eh/α   predicted     0.0000000E+00 (-100.00%)
   displ. norm   :     0.2866842 α      lambda       -0.4320854E-01
   maximum displ.:     0.1591137 α      in ANC's #1, #5, #7, ...

........................................................................
.............................. CYCLE    2 ..............................
........................................................................
   1    -10.2232645 -0.102233E+02  0.238E+00    0.33       0.0  T
   2    -10.0683981  0.154866E+00  0.412E+00    0.28       1.0  T
   3    -10.1244209 -0.560229E-01  0.358E+00    0.13       1.0  T
   4    -10.2275990 -0.103178E+00  0.152E+00    0.35       1.0  T
   5    -10.2361488 -0.854984E-02  0.401E-01    0.23       1.0  T
   6    -10.2360848  0.639505E-04  0.397E-01    0.23       1.0  T
   7    -10.2361045 -0.196450E-04  0.403E-01    0.23       1.0  T
   8    -10.2368853 -0.780833E-03  0.976E-02    0.24       1.0  T
   9    -10.2369020 -0.166677E-04  0.703E-02    0.24       1.0  T
  10    -10.2369138 -0.117972E-04  0.381E-02    0.24       1.2  T
  11    -10.2369192 -0.541219E-05  0.212E-03    0.23      21.0  T
  12    -10.2369192  0.202241E-07  0.273E-03    0.23      16.4  T
  13    -10.2369192 -0.375457E-07  0.292E-04    0.23     153.1  T
  14    -10.2369192 -0.388768E-09  0.463E-05    0.23     965.1  T
     SCC iter.                  ...        0 min,  0.001 sec
     gradient                   ...        0 min,  0.001 sec
 * total energy  :   -10.1168355 Eh     change       -0.3532535E-01 Eh
   gradient norm :     0.1148420 Eh/α   predicted    -0.2337987E-01 ( -33.82%)
   displ. norm   :     0.4283003 α      lambda       -0.4174833E-01
   maximum displ.:     0.2724401 α      in ANC's #7, #3, #1, ...

........................................................................
.............................. CYCLE    3 ..............................
........................................................................
   1    -10.3037661 -0.103038E+02  0.509E+00    0.31       0.0  T
   2     -9.9105782  0.393188E+00  0.623E+00    1.17       1.0  T
   3     -9.8782354  0.323429E-01  0.709E+00    0.55       1.0  T
   4    -10.3138480 -0.435613E+00  0.229E+00    0.40       1.0  T
   5    -10.3265471 -0.126992E-01  0.214E+00    0.36       1.0  T
   6    -10.3223954  0.415173E-02  0.146E+00    0.40       1.0  T
   7    -10.3304599 -0.806448E-02  0.996E-01    0.38       1.0  T
   8    -10.3332835 -0.282361E-02  0.454E-01    0.36       1.0  T
   9    -10.3339125 -0.629016E-03  0.245E-01    0.35       1.0  T
  10    -10.3339268 -0.143305E-04  0.993E-02    0.35       1.0  T
  11    -10.3339311 -0.428090E-05  0.720E-02    0.35       1.0  T
  12    -10.3339373 -0.620830E-05  0.207E-02    0.35       2.2  T
  13    -10.3339374 -0.103328E-06  0.191E-02    0.35       2.3  T
  14    -10.3339391 -0.164467E-05  0.150E-03    0.35      29.8  T
  15    -10.3339390  0.344103E-07  0.267E-03    0.35      16.7  T
  16    -10.3339391 -0.359522E-07  0.765E-04    0.35      58.4  T
  17    -10.3339391 -0.361130E-08  0.169E-04    0.35     264.1  T
     SCC iter.                  ...        0 min,  0.002 sec
     gradient                   ...        0 min,  0.002 sec
 * total energy  :   -10.1351157 Eh     change       -0.1828019E-01 Eh
   gradient norm :     0.0960350 Eh/α   predicted    -0.2470335E-01 (  35.14%)
   displ. norm   :     0.4924857 α      lambda       -0.2459326E-01
   maximum displ.:     0.3912460 α      in ANC's #1, #3, #4, ...

........................................................................
.............................. CYCLE    4 ..............................
........................................................................
   1    -10.3201726 -0.103202E+02  0.348E+00    0.39       0.0  T
   2    -10.0784424  0.241730E+00  0.498E+00    1.27       1.0  T
   3     -9.9463090  0.132133E+00  0.689E+00    0.34       1.0  T
   4    -10.3228195 -0.376511E+00  0.242E+00    0.44       1.0  T
   5    -10.3273045 -0.448499E-02  0.162E+00    0.55       1.0  T
   6    -10.3281137 -0.809197E-03  0.154E+00    0.58       1.0  T
   7    -10.3285427 -0.429045E-03  0.141E+00    0.59       1.0  T
   8    -10.3292613 -0.718574E-03  0.113E+00    0.63       1.0  T
   9    -10.3298801 -0.618803E-03  0.424E-01    0.69       1.0  T
  10    -10.3298832 -0.306184E-05  0.483E-01    0.67       1.0  T
  11    -10.3298866 -0.337601E-05  0.445E-01    0.67       1.0  T
  12    -10.3299031 -0.165671E-04  0.251E-01    0.68       1.0  T
  13    -10.3298983  0.486066E-05  0.123E-01    0.68       1.0  T
  14    -10.3299099 -0.116573E-04  0.610E-02    0.67       1.0  T
  15    -10.3299115 -0.160061E-05  0.284E-02    0.67       1.6  T
  16    -10.3299116 -0.105433E-06  0.146E-02    0.67       3.1  T
  17    -10.3299119 -0.259700E-06  0.556E-04    0.67      80.5  T
  18    -10.3299119  0.967049E-11  0.432E-04    0.67     103.5  T
     SCC iter.                  ...        0 min,  0.002 sec
     gradient                   ...        0 min,  0.001 sec
 * total energy  :   -10.1565663 Eh     change       -0.2145056E-01 Eh
   gradient norm :     0.0754581 Eh/α   predicted    -0.1527909E-01 ( -28.77%)
   displ. norm   :     0.7439932 α      lambda       -0.3204180E-01
   maximum displ.:     0.5579785 α      in ANC's #3, #1, #7, ...

........................................................................
.............................. CYCLE    5 ..............................
........................................................................
   1    -10.2987202 -0.102987E+02  0.315E+00    0.63       0.0  T
   2    -10.2607486  0.379716E-01  0.289E+00    0.16       1.0  T
   3    -10.2405930  0.201556E-01  0.291E+00    0.64       1.0  T
   4    -10.2768248 -0.362318E-01  0.186E+00    0.36       1.0  T
   5    -10.3061874 -0.293627E-01  0.268E-01    0.49       1.0  T
   6    -10.3061953 -0.789160E-05  0.222E-01    0.50       1.0  T
   7    -10.3062453 -0.499735E-04  0.922E-02    0.49       1.0  T
   8    -10.3062645 -0.192459E-04  0.989E-03    0.49       4.5  T
   9    -10.3062636  0.965362E-06  0.123E-02    0.49       3.6  T
  10    -10.3062646 -0.103969E-05  0.598E-03    0.49       7.5  T
  11    -10.3062648 -0.150767E-06  0.455E-04    0.49      98.3  T
  12    -10.3062648 -0.188205E-10  0.352E-04    0.49     126.9  T
     SCC iter.                  ...        0 min,  0.001 sec
     gradient                   ...        0 min,  0.001 sec
 * total energy  :   -10.1624920 Eh     change       -0.5925701E-02 Eh
   gradient norm :     0.1251044 Eh/α   predicted    -0.2488886E-01 ( 320.02%)
   displ. norm   :     0.2506396 α      lambda       -0.1557095E-01
   maximum displ.:     0.1873650 α      in ANC's #3, #1, #5, ...

........................................................................
.............................. CYCLE    6 ..............................
........................................................................
   1    -10.3550765 -0.103551E+02  0.132E+00    0.52       0.0  T
   2    -10.3424444  0.126321E-01  0.151E+00    0.94       1.0  T
   3    -10.3549561 -0.125116E-01  0.804E-01    0.51       1.0  T
   4    -10.3576008 -0.264477E-02  0.224E-01    0.64       1.0  T
   5    -10.3579597 -0.358904E-03  0.429E-02    0.63       1.0  T
   6    -10.3579600 -0.241799E-06  0.271E-02    0.62       1.7  T
   7    -10.3579607 -0.734924E-06  0.571E-03    0.63       7.8  T
   8    -10.3579607  0.622580E-07  0.451E-03    0.63       9.9  T
   9    -10.3579608 -0.167973E-06  0.194E-03    0.63      23.0  T
  10    -10.3579608 -0.166948E-07  0.245E-04    0.63     182.8  T
  11    -10.3579608 -0.264416E-09  0.514E-05    0.63     870.7  T
     SCC iter.                  ...        0 min,  0.001 sec
     gradient                   ...        0 min,  0.001 sec
 * total energy  :   -10.1705591 Eh     change       -0.8067080E-02 Eh
   gradient norm :     0.0476439 Eh/α   predicted    -0.8274559E-02 (   2.57%)
   displ. norm   :     0.2240021 α      lambda       -0.7576713E-02
   maximum displ.:     0.1601584 α      in ANC's #1, #3, #7, ...

........................................................................
.............................. CYCLE    7 ..............................
........................................................................
   1    -10.3655644 -0.103656E+02  0.108E+00    0.80       0.0  T
   2    -10.3644302  0.113419E-02  0.909E-01    0.92       1.0  T
   3    -10.3674536 -0.302343E-02  0.484E-01    0.83       1.0  T
   4    -10.3674781 -0.245030E-04  0.215E-01    0.81       1.0  T
   5    -10.3678142 -0.336120E-03  0.443E-02    0.85       1.0  T
   6    -10.3678165 -0.228442E-05  0.390E-02    0.84       1.1  T
   7    -10.3678229 -0.639338E-05  0.336E-03    0.85      13.3  T
   8    -10.3678229 -0.217680E-07  0.215E-03    0.85      20.8  T
   9    -10.3678229 -0.916622E-08  0.181E-03    0.84      24.7  T
  10    -10.3678230 -0.250203E-07  0.741E-05    0.85     603.9  T
  11    -10.3678230 -0.112319E-10  0.320E-05    0.85    1396.5  T
     SCC iter.                  ...        0 min,  0.001 sec
     gradient                   ...        0 min,  0.001 sec
 * total energy  :   -10.1680215 Eh     change        0.2537584E-02 Eh
   gradient norm :     0.1225702 Eh/α   predicted    -0.3978446E-02 (-256.78%)
   displ. norm   :     0.1345148 α      lambda       -0.1054859E-01
   maximum displ.:     0.1104567 α      in ANC's #3, #1, #9, ...

........................................................................
.............................. CYCLE    8 ..............................
........................................................................
   1    -10.3648101 -0.103648E+02  0.682E-01    0.74       0.0  T
   2    -10.3644452  0.364951E-03  0.554E-01    0.66       1.0  T
   3    -10.3655890 -0.114382E-02  0.318E-01    0.73       1.0  T
   4    -10.3655753  0.137185E-04  0.133E-01    0.68       1.0  T
   5    -10.3657398 -0.164468E-03  0.288E-02    0.71       1.6  T
   6    -10.3657411 -0.131833E-05  0.146E-02    0.71       3.1  T
   7    -10.3657421 -0.104440E-05  0.205E-03    0.71      21.8  T
   8    -10.3657421  0.472173E-08  0.149E-03    0.71      30.1  T
   9    -10.3657421 -0.103065E-07  0.103E-03    0.71      43.3  T
  10    -10.3657421 -0.713644E-08  0.496E-05    0.71     901.3  T
  11    -10.3657421 -0.674660E-11  0.942E-06    0.71    4748.9  T
     SCC iter.                  ...        0 min,  0.001 sec
     gradient                   ...        0 min,  0.001 sec
 * total energy  :   -10.1738121 Eh     change       -0.5790634E-02 Eh
   gradient norm :     0.0325859 Eh/α   predicted    -0.5369728E-02 (  -7.27%)
   displ. norm   :     0.0720289 α      lambda       -0.1693228E-02
   maximum displ.:     0.0424248 α      in ANC's #3, #7, #9, ...

........................................................................
.............................. CYCLE    9 ..............................
........................................................................
   1    -10.3697752 -0.103698E+02  0.310E-01    0.70       0.0  T
   2    -10.3697527  0.224993E-04  0.201E-01    0.70       1.0  T
   3    -10.3694258  0.326891E-03  0.214E-01    0.67       1.0  T
   4    -10.3696972 -0.271353E-03  0.114E-01    0.72       1.0  T
   5    -10.3697996 -0.102408E-03  0.808E-03    0.70       5.5  T
   6    -10.3697998 -0.198486E-06  0.464E-03    0.70       9.6  T
   7    -10.3697998 -0.242501E-07  0.966E-04    0.70      46.3  T
   8    -10.3697998  0.388818E-08  0.944E-04    0.70      47.4  T
     SCC iter.                  ...        0 min,  0.001 sec
     gradient                   ...        0 min,  0.001 sec
 * total energy  :   -10.1752402 Eh     change       -0.1428108E-02 Eh
   gradient norm :     0.0228982 Eh/α   predicted    -0.8510076E-03 ( -40.41%)
   displ. norm   :     0.2081762 α      lambda       -0.3913797E-02
   maximum displ.:     0.1207614 α      in ANC's #7, #9, #1, ...

........................................................................
.............................. CYCLE   10 ..............................
........................................................................
   1    -10.3720110 -0.103720E+02  0.867E-01    0.68       0.0  T
   2    -10.3720131 -0.210291E-05  0.511E-01    0.65       1.0  T
   3    -10.3713652  0.647978E-03  0.292E-01    0.75       1.0  T
   4    -10.3719501 -0.584942E-03  0.105E-01    0.66       1.0  T
   5    -10.3720343 -0.841796E-04  0.257E-02    0.68       1.7  T
   6    -10.3720382 -0.389389E-05  0.128E-02    0.67       3.5  T
   7    -10.3720378  0.344527E-06  0.843E-03    0.67       5.3  T
   8    -10.3720385 -0.679069E-06  0.222E-03    0.67      20.2  T
   9    -10.3720386 -0.362243E-07  0.749E-04    0.67      59.7  T
  10    -10.3720386 -0.133583E-08  0.413E-05    0.67    1082.7  T
     SCC iter.                  ...        0 min,  0.001 sec
     gradient                   ...        0 min,  0.001 sec
 * total energy  :   -10.1775926 Eh     change       -0.2352336E-02 Eh
   gradient norm :     0.0247968 Eh/α   predicted    -0.2041705E-02 ( -13.21%)
   displ. norm   :     0.0735951 α      lambda       -0.8563063E-03
   maximum displ.:     0.0520255 α      in ANC's #7, #9, #5, ...

........................................................................
.............................. CYCLE   11 ..............................
........................................................................
   1    -10.3776051 -0.103776E+02  0.318E-01    0.68       0.0  T
   2    -10.3773987  0.206369E-03  0.259E-01    0.74       1.0  T
   3    -10.3772871  0.111593E-03  0.246E-01    0.65       1.0  T
   4    -10.3775917 -0.304560E-03  0.103E-01    0.71       1.0  T
   5    -10.3776784 -0.866839E-04  0.577E-03    0.70       7.8  T
   6    -10.3776784 -0.562116E-07  0.332E-03    0.69      13.5  T
   7    -10.3776782  0.260310E-06  0.531E-03    0.69       8.4  T
   8    -10.3776785 -0.279207E-06  0.895E-04    0.69      50.0  T
   9    -10.3776785 -0.610292E-08  0.155E-04    0.69     288.8  T
     SCC iter.                  ...        0 min,  0.001 sec
     gradient                   ...        0 min,  0.001 sec
 * total energy  :   -10.1781865 Eh     change       -0.5939161E-03 Eh
   gradient norm :     0.0156587 Eh/α   predicted    -0.4304718E-03 ( -27.52%)
   displ. norm   :     0.0607011 α      lambda       -0.4029833E-03
   maximum displ.:     0.0434080 α      in ANC's #7, #5, #1, ...

........................................................................
.............................. CYCLE   12 ..............................
........................................................................
   1    -10.3785205 -0.103785E+02  0.269E-01    0.69       0.0  T
   2    -10.3784747  0.458379E-04  0.181E-01    0.74       1.0  T
   3    -10.3782750  0.199709E-03  0.210E-01    0.66       1.0  T
   4    -10.3784852 -0.210195E-03  0.928E-02    0.72       1.0  T
   5    -10.3785543 -0.690890E-04  0.621E-03    0.71       7.2  T
   6    -10.3785544 -0.179458E-06  0.306E-03    0.71      14.6  T
   7    -10.3785544  0.483683E-07  0.238E-03    0.71      18.8  T
   8    -10.3785544 -0.431424E-07  0.118E-03    0.71      38.0  T
   9    -10.3785544 -0.122252E-07  0.219E-04    0.71     203.7  T
  10    -10.3785544 -0.957030E-10  0.127E-05    0.71    3526.6  T
     SCC iter.                  ...        0 min,  0.001 sec
     gradient                   ...        0 min,  0.002 sec
 * total energy  :   -10.1784378 Eh     change       -0.2513619E-03 Eh
   gradient norm :     0.0063925 Eh/α   predicted    -0.2022335E-03 ( -19.54%)
   displ. norm   :     0.0277872 α      lambda       -0.1204788E-03
   maximum displ.:     0.0228726 α      in ANC's #5, #7, #1, ...

........................................................................
.............................. CYCLE   13 ..............................
........................................................................
   1    -10.3798738 -0.103799E+02  0.155E-01    0.70       0.0  T
   2    -10.3798195  0.542647E-04  0.128E-01    0.75       1.0  T
   3    -10.3798159  0.361577E-05  0.114E-01    0.70       1.0  T
   4    -10.3798879 -0.720216E-04  0.393E-02    0.72       1.1  T
   5    -10.3798959 -0.800429E-05  0.584E-03    0.72       7.7  T
   6    -10.3798962 -0.246075E-06  0.215E-03    0.72      20.8  T
   7    -10.3798962 -0.525193E-08  0.485E-04    0.72      92.3  T
   8    -10.3798962  0.403508E-08  0.753E-04    0.72      59.4  T
     SCC iter.                  ...        0 min,  0.001 sec
     gradient                   ...        0 min,  0.001 sec
 * total energy  :   -10.1785223 Eh     change       -0.8443256E-04 Eh
   gradient norm :     0.0054678 Eh/α   predicted    -0.6028587E-04 ( -28.60%)
   displ. norm   :     0.0249900 α      lambda       -0.8025782E-04
   maximum displ.:     0.0218329 α      in ANC's #5, #1, #3, ...

........................................................................
.............................. CYCLE   14 ..............................
........................................................................
   1    -10.3787756 -0.103788E+02  0.127E-01    0.71       0.0  T
   2    -10.3787703  0.530114E-05  0.854E-02    0.73       1.0  T
   3    -10.3787185  0.518514E-04  0.950E-02    0.70       1.0  T
   4    -10.3787755 -0.570188E-04  0.373E-02    0.72       1.2  T
   5    -10.3787836 -0.814460E-05  0.539E-03    0.72       8.3  T
   6    -10.3787838 -0.165427E-06  0.278E-03    0.72      16.1  T
   7    -10.3787837  0.736945E-07  0.311E-03    0.72      14.4  T
   8    -10.3787838 -0.100815E-06  0.203E-04    0.72     220.8  T
   9    -10.3787838 -0.127619E-09  0.972E-05    0.72     460.1  T
     SCC iter.                  ...        0 min,  0.001 sec
     gradient                   ...        0 min,  0.001 sec
 * total energy  :   -10.1785702 Eh     change       -0.4796827E-04 Eh
   gradient norm :     0.0022304 Eh/α   predicted    -0.4015518E-04 ( -16.29%)
   displ. norm   :     0.0156266 α      lambda       -0.1752248E-04
   maximum displ.:     0.0102114 α      in ANC's #1, #7, #9, ...

........................................................................
.............................. CYCLE   15 ..............................
........................................................................
   1    -10.3786793 -0.103787E+02  0.711E-02    0.72       0.0  T
   2    -10.3786777  0.161961E-05  0.461E-02    0.73       1.0  T
   3    -10.3786511  0.266187E-04  0.604E-02    0.71       1.0  T
   4    -10.3786798 -0.287545E-04  0.109E-02    0.72       4.1  T
   5    -10.3786804 -0.610729E-06  0.182E-03    0.72      24.6  T
   6    -10.3786805 -0.117231E-07  0.114E-03    0.72      39.2  T
   7    -10.3786804  0.267050E-07  0.179E-03    0.72      24.9  T
   8    -10.3786805 -0.325680E-07  0.613E-05    0.72     729.3  T
   9    -10.3786805 -0.645706E-11  0.313E-05    0.72    1428.5  T
     SCC iter.                  ...        0 min,  0.001 sec
     gradient                   ...        0 min,  0.001 sec
 * total energy  :   -10.1785805 Eh     change       -0.1021577E-04 Eh
   gradient norm :     0.0015820 Eh/α   predicted    -0.8764160E-05 ( -14.21%)
   displ. norm   :     0.0063388 α      lambda       -0.2648218E-05
   maximum displ.:     0.0053593 α      in ANC's #7, #9, #1, ...

........................................................................
.............................. CYCLE   16 ..............................
........................................................................
   1    -10.3779041 -0.103779E+02  0.283E-02    0.72       0.0  T
   2    -10.3779021  0.205749E-05  0.236E-02    0.71       1.9  T
   3    -10.3779022 -0.161389E-06  0.213E-02    0.72       2.1  T
   4    -10.3779047 -0.245062E-05  0.394E-03    0.72      11.3  T
   5    -10.3779048 -0.107307E-06  0.818E-04    0.72      54.7  T
   6    -10.3779048 -0.183622E-09  0.555E-04    0.72      80.6  T
     SCC iter.                  ...        0 min,  0.001 sec
     gradient                   ...        0 min,  0.002 sec
 * total energy  :   -10.1785817 Eh     change       -0.1270628E-05 Eh
   gradient norm :     0.0006195 Eh/α   predicted    -0.1325062E-05 (   4.28%)
   displ. norm   :     0.0018244 α      lambda       -0.5103605E-06
   maximum displ.:     0.0010239 α      in ANC's #7, #3, #9, ...

   *** GEOMETRY OPTIMIZATION CONVERGED AFTER 16 ITERATIONS ***

------------------------------------------------------------------------
 total energy gain   :        -0.0970715 Eh      -60.9133 kcal/mol
 total RMSD          :         0.8579262 a0        0.4540 Å
 total power (kW/mol):       -15.9288308 (step)-3809.0556 (real)
------------------------------------------------------------------------

 ANCopt (total)                0 d,  0 h,  0 min,  0.067 sec
 optimizer setup                ...        0 min,  0.000 sec (  0.095%)
 model hessian                  ...        0 min,  0.000 sec (  0.144%)
 ANC generation                 ...        0 min,  0.000 sec (  0.081%)
 coordinate transformation      ...        0 min,  0.000 sec (  0.055%)
 single point calculation       ...        0 min,  0.065 sec ( 97.611%)
 optimization log               ...        0 min,  0.000 sec (  0.583%)
 hessian update                 ...        0 min,  0.000 sec (  0.055%)
 rational function              ...        0 min,  0.000 sec (  0.576%)

================
 final structure:
================
5
 xtb: 6.2.2 (9d81278992624c895f80dd42a50cac0aa55982e2)
C         1.77617946550614   -0.20982115708317   -0.11154346535894
C         0.52399726362520   -0.06189030711108   -0.03252057861607
C        -1.20519721534166    0.14239465809599    0.07712120659072
C        -0.41411306079441    1.20459798230991    0.01304925192782
C        -0.68086645299528   -1.07528117621165    0.05389258545648

 Bond Distances (Angstroems)
 ---------------------------
C1-C2=1.2634         C2-C1=1.2634         C2-C3=1.7447         C2-C4=1.5767         C2-C5=1.5767         C3-C2=1.7447         
C3-C4=1.3260         C3-C5=1.3260         C4-C2=1.5767         C4-C3=1.3260         C5-C2=1.5767         C5-C3=1.3260         
 C  C  Rav=1.4689 sigma=0.1744  Rmin=1.2634  Rmax=1.7447     6

 selected bond angles (degree)
 --------------------
C3-C2-C1=179.98                C4-C2-C1=133.28                C4-C2-C3= 46.72                C5-C2-C1=133.28                
C5-C2-C3= 46.72                C5-C2-C4= 93.44                C4-C3-C2= 59.96                C5-C3-C2= 59.96                
C5-C3-C4=119.93                C3-C4-C2= 73.32                C3-C5-C2= 73.32                

 selected dihedral angles (degree)
 ---------------------------------
C4-C3-C2-C1= 91.05            C4-C3-C2-C5=180.19            C5-C3-C2-C1=270.85            C5-C3-C2-C4=179.81            
C3-C4-C2-C1=180.02            C3-C4-C2-C5=  0.14            C2-C4-C3-C5=359.81            C3-C5-C2-C1=179.98            
C3-C5-C2-C4=359.86            C2-C5-C3-C4=  0.19            
           -------------------------------------------------
          |                Final Singlepoint                |
           -------------------------------------------------

          ...................................................
          :                      SETUP                      :
          :.................................................:
          :  # basis functions                  20          :
          :  # atomic orbitals                  20          :
          :  # shells                           10          :
          :  # electrons                        20          :
          :  max. iterations                   250          :
          :  Hamiltonian                  GFN2-xTB          :
          :  restarted?                      false          :
          :  GBSA solvation                  false          :
          :  PC potential                    false          :
          :  electronic temp.          300.0000000     K    :
          :  accuracy                    1.0000000          :
          :  -> integral cutoff          0.2500000E+02      :
          :  -> integral neglect         0.1000000E-07      :
          :  -> SCF convergence          0.1000000E-05 Eh   :
          :  -> wf. convergence          0.1000000E-03 e    :
          :  Broyden damping             0.4000000          :
          ...................................................

 iter      E             dE          RMSdq      gap      omega  full diag
   1    -10.3779048 -0.103779E+02  0.415E-04    0.72       0.0  T
   2    -10.3779048  0.146814E-07  0.123E-03    0.72      36.3  T
   3    -10.3779048 -0.162358E-07  0.998E-05    0.72     448.1  T
   4    -10.3779048  0.139224E-09  0.129E-04    0.72     347.5  T

   *** convergence criteria satisfied after 4 iterations ***

         #    Occupation            Energy/Eh            Energy/eV
      -------------------------------------------------------------
         1        2.0000           -0.7368430             -20.0505
       ...           ...                  ...                  ...
         5        2.0000           -0.5559355             -15.1278
         6        2.0000           -0.5470869             -14.8870
         7        2.0000           -0.4916033             -13.3772
         8        2.0000           -0.4642633             -12.6332
         9        2.0000           -0.4599322             -12.5154
        10        1.0000           -0.4266883             -11.6108
        11        1.0000           -0.3893975             -10.5960 (HOMO)
        12        0.0000           -0.3630058              -9.8779 (LUMO)
        13                         -0.3233316              -8.7983
        14                         -0.2633695              -7.1666
        15                         -0.1897936              -5.1645
        16                         -0.0445061              -1.2111
       ...                                ...                  ...
        20                          0.7445041              20.2590
      -------------------------------------------------------------
                  HL-Gap            0.0263917 Eh            0.7182 eV
             Fermi-level           -0.4097535 Eh          -11.1500 eV

 transition dipole moment (au) for excitation:          10          11
     X       Y       Z   
  -0.0218  -0.0024  -0.2766  total (au/Debye):    0.277   0.705
 dE (eV)             :    1.015
 oscillator strength :  0.27073E-02

 SCC (total)                   0 d,  0 h,  0 min,  0.005 sec
 SCC setup                      ...        0 min,  0.000 sec (  1.462%)
 Dispersion                     ...        0 min,  0.000 sec (  0.222%)
 integral evaluation            ...        0 min,  0.001 sec ( 29.914%)
 zeroth order Hamiltonian       ...        0 min,  0.000 sec (  0.359%)
 iterations                     ...        0 min,  0.001 sec ( 12.951%)
 molecular gradient             ...        0 min,  0.001 sec ( 30.928%)
 printout                       ...        0 min,  0.001 sec ( 23.964%)

         :::::::::::::::::::::::::::::::::::::::::::::::::::::
         ::                     SUMMARY                     ::
         :::::::::::::::::::::::::::::::::::::::::::::::::::::
         :: total energy             -10.178581734258 Eh    ::
         :: gradient norm              0.000620550842 Eh/a0 ::
         :: HOMO-LUMO gap              0.718155847740 eV    ::
         ::.................................................::
         :: SCC energy               -10.377904779364 Eh    ::
         :: -> isotropic ES           -0.012710959020 Eh    ::
         :: -> anisotropic ES         -0.000236567905 Eh    ::
         :: -> anisotropic XC          0.007926022750 Eh    ::
         :: -> dispersion             -0.002897640180 Eh    ::
         :: repulsion energy           0.199322966126 Eh    ::
         :: add. restraining           0.000000000000 Eh    ::
         :::::::::::::::::::::::::::::::::::::::::::::::::::::

           ------------------------------------------------- 
          |                Numerical Hessian                |
           ------------------------------------------------- 
step length          :   0.00500
SCC accuracy         :   0.30000
Hessian scale factor :   1.00000
frozen atoms in %    :   0.00000    0
RMS gradient         :   0.00062
estimated CPU  time      0.00 min
estimated wall time      0.00 min

writing file <hessian>.

 projected vibrational frequencies (cm-1)
eigval :       -0.00    -0.00    -0.00     0.00     0.00     0.00
eigval :      247.24   328.73   376.35   388.38   452.18   685.42
eigval :     1418.93  1419.43  1782.53
           -------------------------------------------------
          |                Property Printout                |
           -------------------------------------------------

    * Orbital Energies and Occupations

         #    Occupation            Energy/Eh            Energy/eV
      -------------------------------------------------------------
         1        2.0000           -0.7368426             -20.0505
         2        2.0000           -0.6841708             -18.6172
         3        2.0000           -0.6580418             -17.9062
         4        2.0000           -0.5840720             -15.8934
         5        2.0000           -0.5559351             -15.1278
         6        2.0000           -0.5470868             -14.8870
         7        2.0000           -0.4916030             -13.3772
         8        2.0000           -0.4642641             -12.6333
         9        2.0000           -0.4599325             -12.5154
        10        1.0000           -0.4266881             -11.6108
        11        1.0000           -0.3893971             -10.5960 (HOMO)
        12        0.0000           -0.3630064              -9.8779 (LUMO)
        13                         -0.3233311              -8.7983
        14                         -0.2633697              -7.1667
        15                         -0.1897935              -5.1645
        16                         -0.0445059              -1.2111
        17                          0.0178378               0.4854
        18                          0.4587119              12.4822
        19                          0.5226784              14.2228
        20                          0.7445035              20.2590
      -------------------------------------------------------------
                  HL-Gap            0.0263906 Eh            0.7181 eV
             Fermi-level           -0.4097536 Eh          -11.1500 eV

     #   Z        covCN         q      C6AA      α(0)
     1   6 C      0.982    -0.114    39.567    10.566
     2   6 C      3.813     0.138    18.350     6.097
     3   6 C      2.856     0.106    25.661     8.303
     4   6 C      2.007    -0.065    32.784     9.247
     5   6 C      2.007    -0.065    32.784     9.247

 Mol. C6AA /au·bohr⁶  :        732.521560
 Mol. C8AA /au·bohr⁸  :      21185.796461
 Mol. α(0) /au        :         43.459535


Wiberg/Mayer (AO) data.
largest (>0.10) Wiberg bond orders for each atom
          total WBO             WBO to atom ...
     1  C   2.626        C    2 2.165    C    3 0.238    C    5 0.112    C    4 0.112
     2  C   3.845        C    1 2.165    C    4 0.669    C    5 0.669    C    3 0.342
     3  C   3.684        C    4 1.552    C    5 1.552    C    2 0.342    C    1 0.238
     4  C   2.538        C    3 1.552    C    2 0.669    C    5 0.206    C    1 0.112
     5  C   2.538        C    3 1.552    C    2 0.669    C    4 0.206    C    1 0.112

MOs/occ written to file <molden.input>


molecular dipole:
                 x           y           z       tot (Debye)
 q only:       -0.352       0.042       0.023
   full:       -0.864       0.102       0.055       2.217
molecular quadrupole (traceless):
                xx          xy          yy          xz          yz          zz
 q only:       -0.439       0.025      -0.237       0.070       0.008       0.675
  q+dip:       -1.187       0.119      -0.208       0.163       0.009       1.395
   full:       -2.274       0.223      -0.439       0.318       0.019       2.712

           -------------------------------------------------
          |                Geometry Summary                 |
           -------------------------------------------------

      molecular mass/u    :       60.0536795
   center of mass at/Å    :       -0.0000000      -0.0000000      -0.0000002
  moments of inertia/u·Å² :        0.3165239E+02   0.6701460E+02   0.9866689E+02
rotational constants/cm⁻¹ :        0.5325865E+00   0.2515517E+00   0.1708540E+00
Molecule has the following symmetry elements: (C2) 2*(sigma) 
It seems to be the C2v point group

 * 3 selected distances

     #   Z        #   Z                                     value/Å
     1   6 C      2   6 C                                 1.2633639 (min)
     3   6 C      4   6 C                                 1.3259696
     3   6 C      5   6 C                                 1.3259701 (max)

 * 1 distinct bonds (by element types)

   Z      Z             #   av. dist./Å        max./Å        min./Å
   6 C    6 C           3     1.3051012     1.3259701     1.2633639

           -------------------------------------------------
          |               Frequency Printout                |
           -------------------------------------------------
 projected vibrational frequencies (cm-1)
eigval :       -0.00    -0.00    -0.00     0.00     0.00     0.00
eigval :      247.24   328.73   376.35   388.38   452.18   685.42
eigval :     1418.93  1419.43  1782.53
 reduced masses (amu)
   1: 12.01   2: 12.01   3: 12.01   4: 12.01   5: 12.01   6: 12.01   7: 12.01   8: 12.01
   9: 12.01  10: 12.01  11: 12.01  12: 12.01  13: 12.01  14: 12.01  15: 12.01
 IR intensities (amu)
   1:  0.02   2:  0.17   3:  0.11   4:  0.16   5:  0.02   6:  0.05   7:  0.38   8:  0.05
   9:  0.41  10:  0.24  11:  0.05  12:  0.30  13:  1.53  14:  0.61  15:  0.30
 Raman intensities (amu)
   1:  0.00   2:  0.00   3:  0.00   4:  0.00   5:  0.00   6:  0.00   7:  0.00   8:  0.00
   9:  0.00  10:  0.00  11:  0.00  12:  0.00  13:  0.00  14:  0.00  15:  0.00
 output can be read by thermo (or use thermo option).
 writing <g98.out> molden fake output.
 recommended (thermochemical) frequency scaling factor: 1.0
           -------------------------------------------------
          |             Thermodynamic Functions             |
           -------------------------------------------------

c2v symmetry found (for desy threshold:  0.10E+00) used in thermo

          ...................................................
          :                      SETUP                      :
          :.................................................:
          :  # frequencies                           9      :
          :  # imaginary freq.                       0      :
          :  linear?                             false      :
          :  only rotor calc.                    false      :
          :  symmetry                              c2v      :
          :  rotational number                       2      :
          :  scaling factor                  1.0000000      :
          :  rotor cutoff                   50.0000000 cm⁻¹ :
          :  imag. cutoff                  -20.0000000 cm⁻¹ :
          :.................................................:

    mode    ω/cm⁻¹     T·S(HO)/kcal·mol⁻¹    T·S(FR)/kcal·mol⁻¹   T·S(vib)
   ------------------------------------------------------------------------
       1    247.24    -0.00000 ( 99.83%)     0.01419 (  0.17%)     0.00002
   ------------------------------------------------------------------------

   temp. (K)  partition function   enthalpy   heat capacity  entropy
                                   cal/mol     cal/K/mol   cal/K/mol   J/K/mol
 298.15  VIB   2.99                 1208.355      8.840      6.227
         ROT  0.175E+05              888.752      2.981     22.393
         INT  0.522E+05             2097.108     11.821     28.621
         TR   0.450E+27             1481.254      4.968     38.181
         TOT                        3578.3615    16.7889    66.8015   279.4973

   temp. (K)  partition function   enthalpy   heat capacity  entropy
                                   cal/mol     cal/K/mol   cal/K/mol   J/K/mol
 120.00  VIB   1.10                   85.928      2.793      0.912
         ROT  0.446E+04              357.707      2.981     19.680
         INT  0.492E+04              443.635      5.774     20.593
         TR   0.115E+27              596.178      4.968     33.661
         TOT                        1039.8128    10.7421    54.2540   226.9988

   temp. (K)  partition function   enthalpy   heat capacity  entropy
                                   cal/mol     cal/K/mol   cal/K/mol   J/K/mol
 100.00  VIB   1.05                   40.143      1.791      0.497
         ROT  0.339E+04              298.089      2.981     19.137
         INT  0.356E+04              338.232      4.772     19.634
         TR   0.875E+26              496.815      4.968     32.756
         TOT                         835.0471     9.7402    52.3904   219.2014

   temp. (K)  partition function   enthalpy   heat capacity  entropy
                                   cal/mol     cal/K/mol   cal/K/mol   J/K/mol
  80.00  VIB   1.02                   13.589      0.895      0.205
         ROT  0.243E+04              238.471      2.981     18.472
         INT  0.247E+04              252.060      3.876     18.676
         TR   0.626E+26              397.452      4.968     31.648
         TOT                         649.5125     8.8443    50.3242   210.5566

   temp. (K)  partition function   enthalpy   heat capacity  entropy
                                   cal/mol     cal/K/mol   cal/K/mol   J/K/mol
  60.00  VIB   1.00                    2.497      0.273      0.049
         ROT  0.158E+04              178.853      2.981     17.614
         INT  0.158E+04              181.350      3.254     17.663
         TR   0.406E+26              298.089      4.968     30.219
         TOT                         479.4390     8.2222    47.8822   200.3391

   temp. (K)  partition function   enthalpy   heat capacity  entropy
                                   cal/mol     cal/K/mol   cal/K/mol   J/K/mol
  40.00  VIB   1.00                    0.106      0.024      0.002
         ROT   859.                  119.236      2.981     16.406
         INT   859.                  119.342      3.005     16.408
         TR   0.221E+26              198.726      4.968     28.206
         TOT                         318.0681     7.9735    44.6138   186.6642

   temp. (K)  partition function   enthalpy   heat capacity  entropy
                                   cal/mol     cal/K/mol   cal/K/mol   J/K/mol
  20.00  VIB   1.00                    0.000      0.000     -0.003
         ROT   304.                   59.618      2.981     14.339
         INT   304.                   59.618      2.981     14.337
         TR   0.782E+25               99.363      4.968     24.764
         TOT                         158.9808     7.9491    39.1007   163.5971

   temp. (K)  partition function   enthalpy   heat capacity  entropy
                                   cal/mol     cal/K/mol   cal/K/mol   J/K/mol
  10.00  VIB   1.00                    0.000      0.000     -0.005
         ROT   107.                   29.809      2.981     12.273
         INT   107.                   29.809      2.981     12.268
         TR   0.277E+25               49.681      4.968     21.322
         TOT                          79.4904     7.9490    33.5904   140.5424

       T/K    H(0)-H(T)+PV         H(T)/Eh          T*S/Eh         G(T)/Eh
   ------------------------------------------------------------------------
    298.15    0.570248E-02    0.218756E-01    0.317395E-01   -0.986390E-02
    120.00    0.165705E-02    0.178302E-01    0.103751E-01    0.745508E-02
    100.00    0.133073E-02    0.175039E-01    0.834894E-02    0.915494E-02
     80.00    0.103506E-02    0.172082E-01    0.641574E-02    0.107925E-01
     60.00    0.764035E-03    0.169372E-01    0.457831E-02    0.123589E-01
     40.00    0.506874E-03    0.166800E-01    0.284387E-02    0.138362E-01
     20.00    0.253352E-03    0.164265E-01    0.124622E-02    0.151803E-01
     10.00    0.126676E-03    0.162998E-01    0.535298E-03    0.157645E-01 (used)
   ------------------------------------------------------------------------

         :::::::::::::::::::::::::::::::::::::::::::::::::::::
         ::                  THERMODYNAMIC                  ::
         :::::::::::::::::::::::::::::::::::::::::::::::::::::
         :: total free energy         -10.162817203794 Eh   ::
         ::.................................................::
         :: total energy              -10.178581732692 Eh   ::
         :: zero point energy           0.016173150502 Eh   ::
         :: G(RRHO) w/o ZPVE           -0.000408621604 Eh   ::
         :: G(RRHO) contrib.            0.015764528898 Eh   ::
         :::::::::::::::::::::::::::::::::::::::::::::::::::::

optimized geometry written to: xtbopt.xyz


           -------------------------------------------------
          | TOTAL ENERGY              -10.178581732692 Eh   |
          | TOTAL ENTHALPY            -10.162281906175 Eh   |
          | TOTAL FREE ENERGY         -10.162817203794 Eh   |
          | GRADIENT NORM               0.000621364555 Eh/α |
          | HOMO-LUMO GAP               0.718126094593 eV   |
           -------------------------------------------------

------------------------------------------------------------------------
 * finished run on 2020/05/12 at 11:44:35.040     
------------------------------------------------------------------------
 total:
 * wall-time:     0 d,  0 h,  0 min,  0.205 sec
 *  cpu-time:     0 d,  0 h,  0 min,  0.205 sec
 * ratio c/w:     0.998 speedup
 SCF:
 * wall-time:     0 d,  0 h,  0 min,  0.006 sec
 *  cpu-time:     0 d,  0 h,  0 min,  0.006 sec
 * ratio c/w:     0.999 speedup
 ANC optimizer:
 * wall-time:     0 d,  0 h,  0 min,  0.072 sec
 *  cpu-time:     0 d,  0 h,  0 min,  0.072 sec
 * ratio c/w:     0.998 speedup
 numerical hessian:
 * wall-time:     0 d,  0 h,  0 min,  0.110 sec
 *  cpu-time:     0 d,  0 h,  0 min,  0.110 sec
 * ratio c/w:     0.998 speedup

