      -----------------------------------------------------------      
     |                   =====================                   |     
     |                           x T B                           |     
     |                   =====================                   |     
     |                         S. Grimme                         |     
     |          Mulliken Center for Theoretical Chemistry        |     
     |                    University of Bonn                     |     
      -----------------------------------------------------------      

   * xtb version 6.2.2 (9d81278992624c895f80dd42a50cac0aa55982e2) compiled by '@Darwin' on 04/03/2020

   xtb is free software: you can redistribute it and/or modify it under
   the terms of the GNU Lesser General Public License as published by
   the Free Software Foundation, either version 3 of the License, or
   (at your option) any later version.
   
   xtb is distributed in the hope that it will be useful,
   but WITHOUT ANY WARRANTY; without even the implied warranty of
   MERCHANTABILITY or FITNESS FOR A PARTICULAR PURPOSE.  See the
   GNU Lesser General Public License for more details.
   
   Cite this work as:
   * S. Grimme, C. Bannwarth, P. Shushkov, J. Chem. Theory Comput., 2017,
     13, 1989-2009. DOI: 10.1021/acs.jctc.7b00118
   * C. Bannwarth, S. Ehlert and S. Grimme., J. Chem. Theory Comput., 2019,
     15, 1652-1671. DOI: 10.1021/acs.jctc.8b01176
   * P. Pracht, E. Caldeweyher, S. Ehlert, S. Grimme, ChemRxiv, 2019, preprint.
     DOI: 10.26434/chemrxiv.8326202.v1
   
   for DFT-D4:
   * E. Caldeweyher, C. Bannwarth and S. Grimme, J. Chem. Phys., 2017,
     147, 034112. DOI: 10.1063/1.4993215
   * E. Caldeweyher, S. Ehlert, A. Hansen, H. Neugebauer, S. Spicher,
     C. Bannwarth and S. Grimme, J. Chem. Phys., 2019, 150, 154122.
     DOI: 10.1063/1.5090222
   
   for sTDA-xTB:
   * S. Grimme and C. Bannwarth, J. Chem. Phys., 2016, 145, 054103.
     DOI: 10.1063/1.4959605
   
   in the mass-spec context:
   * V. Asgeirsson, C. Bauer and S. Grimme, Chem. Sci., 2017, 8, 4879.
     DOI: 10.1039/c7sc00601b
   
   for metadynamics refer to:
   * S. Grimme, J. Chem. Theory Comput., 2019, 155, 2847-2862
     DOI: 10.1021/acs.jctc.9b00143
   
   with help from (in alphabetical order)
   C. Bannwarth, F. Bohle, G. Brandenburg, E. Caldeweyher, M. Checinski,
   S. Dohm, S. Ehlert, S. Ehrlich, F. März, H. Neugebauer, J. Pisarek,
   P. Pracht, P. Shushkov, and S. Spicher.
   
 * started run on 2020/05/12 at 11:44:05.894     

           -------------------------------------------------
          |                Calculation Setup                |
           -------------------------------------------------

          program call               : xtb --input C4N1_18_S_3.input C4N1_18_S_3.xyz --ohess --molden --namespace C4N1_18_S_3 output.out
          calculation namespace      : C4N1_18_S_3
          coordinate file            : C4N1_18_S_3.xyz
          number of atoms            :                     5
          number of electrons        :                    21
          charge                     :                     0
          spin                       :                   1.5
          first test random number   :      0.64179295308952

   ID    Z sym.   atoms
    1    6 C      1-4
    2    7 N      5

           -------------------------------------------------
          |                 G F N 2 - x T B                 |
           -------------------------------------------------

        Reference                      10.1021/acs.jctc.8b01176
      * Hamiltonian:
        H0-scaling (s, p, d)           1.850000    2.230000    2.230000
        zeta-weighting                 0.500000
      * Dispersion:
        s8                             2.700000
        a1                             0.520000
        a2                             5.000000
        s9                             5.000000
      * Repulsion:
        kExp                           1.500000    1.000000
        rExp                           1.000000
      * Coulomb:
        alpha                          2.000000
        third order                    shell-resolved
        anisotropic                    true
        a3                             3.000000
        a5                             4.000000
        cn-shift                       1.200000
        cn-exp                         4.000000
        max-rad                        5.000000


          ...................................................
          :                      SETUP                      :
          :.................................................:
          :  # basis functions                  20          :
          :  # atomic orbitals                  20          :
          :  # shells                           10          :
          :  # electrons                        21          :
          :  max. iterations                   250          :
          :  Hamiltonian                  GFN2-xTB          :
          :  restarted?                      false          :
          :  GBSA solvation                  false          :
          :  PC potential                    false          :
          :  electronic temp.          300.0000000     K    :
          :  accuracy                    1.0000000          :
          :  -> integral cutoff          0.2500000E+02      :
          :  -> integral neglect         0.1000000E-07      :
          :  -> SCF convergence          0.1000000E-05 Eh   :
          :  -> wf. convergence          0.1000000E-03 e    :
          :  Broyden damping             0.4000000          :
          ...................................................

 iter      E             dE          RMSdq      gap      omega  full diag
   1    -10.7714801 -0.107715E+02  0.102E+01    1.14       0.0  T
   2     -8.5644425  0.220704E+01  0.160E+01    0.71       1.0  T
   3     -9.8809702 -0.131653E+01  0.102E+01    2.51       1.0  T
   4    -10.9150032 -0.103403E+01  0.574E+00    0.89       1.0  T
   5    -10.9498887 -0.348855E-01  0.351E+00    0.71       1.0  T
   6    -10.9461344  0.375422E-02  0.299E+00    0.75       1.0  T
   7    -10.9744500 -0.283156E-01  0.173E+00    0.64       1.0  T
   8    -10.9824032 -0.795320E-02  0.103E+00    0.57       1.0  T
   9    -10.9836098 -0.120654E-02  0.687E-01    0.54       1.0  T
  10    -10.9843412 -0.731441E-03  0.224E-01    0.52       1.0  T
  11    -10.9843802 -0.390315E-04  0.231E-01    0.53       1.0  T
  12    -10.9844487 -0.684216E-04  0.119E-01    0.52       1.0  T
  13    -10.9844909 -0.422460E-04  0.650E-02    0.53       1.0  T
  14    -10.9845036 -0.126538E-04  0.119E-02    0.53       3.8  T
  15    -10.9845040 -0.479057E-06  0.145E-02    0.53       3.1  T
  16    -10.9845047 -0.606372E-06  0.265E-03    0.53      16.9  T
  17    -10.9845047 -0.103428E-07  0.125E-03    0.53      35.8  T
  18    -10.9845047 -0.516829E-08  0.581E-04    0.53      76.9  T
  19    -10.9845047 -0.506827E-09  0.678E-05    0.53     659.4  T

   *** convergence criteria satisfied after 19 iterations ***

         #    Occupation            Energy/Eh            Energy/eV
      -------------------------------------------------------------
         1        2.0000           -0.7400650             -20.1382
       ...           ...                  ...                  ...
         6        2.0000           -0.5550268             -15.1030
         7        2.0000           -0.5288680             -14.3912
         8        2.0000           -0.4927407             -13.4082
         9        1.6528           -0.4688373             -12.7577
        10        1.3472           -0.4676376             -12.7251
        11        1.0000           -0.4330297             -11.7833
        12        1.0000           -0.3986287             -10.8472 (HOMO)
        13        0.0000           -0.3791725             -10.3178 (LUMO)
        14                         -0.3725362             -10.1372
        15                         -0.3034439              -8.2571
        16                         -0.0352925              -0.9604
        17                         -0.0202315              -0.5505
       ...                                ...                  ...
        20                          0.2420346               6.5861
      -------------------------------------------------------------
                  HL-Gap            0.0194562 Eh            0.5294 eV
             Fermi-level           -0.4285692 Eh          -11.6620 eV

 SCC (total)                   0 d,  0 h,  0 min,  0.005 sec
 SCC setup                      ...        0 min,  0.000 sec (  1.556%)
 Dispersion                     ...        0 min,  0.000 sec (  0.697%)
 integral evaluation            ...        0 min,  0.001 sec ( 26.864%)
 zeroth order Hamiltonian       ...        0 min,  0.000 sec (  0.458%)
 iterations                     ...        0 min,  0.002 sec ( 40.783%)
 molecular gradient             ...        0 min,  0.001 sec ( 27.717%)
 printout                       ...        0 min,  0.000 sec (  1.722%)

         :::::::::::::::::::::::::::::::::::::::::::::::::::::
         ::                     SUMMARY                     ::
         :::::::::::::::::::::::::::::::::::::::::::::::::::::
         :: total energy             -10.916724231919 Eh    ::
         :: gradient norm              0.215812535350 Eh/a0 ::
         :: HOMO-LUMO gap              0.529429537638 eV    ::
         ::.................................................::
         :: SCC energy               -10.984504671072 Eh    ::
         :: -> isotropic ES           -0.018303351707 Eh    ::
         :: -> anisotropic ES          0.000637211239 Eh    ::
         :: -> anisotropic XC          0.008079541126 Eh    ::
         :: -> dispersion             -0.002954418046 Eh    ::
         :: repulsion energy           0.067780368599 Eh    ::
         :: add. restraining           0.000000000000 Eh    ::
         :::::::::::::::::::::::::::::::::::::::::::::::::::::

      ----------------------------------------------------------- 
     |                   =====================                   |
     |                        A N C O P T                        |
     |                   =====================                   |
     |               Approximate Normal Coordinate               |
     |                Rational Function Optimizer                |
      ----------------------------------------------------------- 

          ...................................................
          :                      SETUP                      :
          :.................................................:
          :   optimization level            normal          :
          :   max. optcycles                   200          :
          :   ANC micro-cycles                  20          :
          :   degrees of freedom                 9          :
          :.................................................:
          :   RF solver                   davidson          :
          :   write xtbopt.log                true          :
          :   linear?                        false          :
          :   energy convergence         0.5000000E-05 Eh   :
          :   grad. convergence          0.1000000E-02 Eh/α :
          :   maximium RF displ.         1.0000000          :
          :   Hlow (freq-cutoff)         0.1000000E-01      :
          :   Hmax (freq-cutoff)         5.0000000          :
          :   S6 in model hess.         20.0000000          :
          ...................................................

generating ANC from model Hessian ...
Using Lindh-Hessian (1995)
 Shifting diagonal of input Hessian by    0.0000000000000000     
 Lowest  eigenvalues of input Hessian
   -0.000000   -0.000000   -0.000000    0.000000    0.000000    0.000000
    0.022286    0.063222    0.092112    0.276121    0.718835    0.858396
    1.011803    1.067897    1.105890
 Highest eigenvalues
    0.276121    0.718835    0.858396    1.011803    1.067897    1.105890


........................................................................
.............................. CYCLE    1 ..............................
........................................................................
   1    -10.9845047 -0.109845E+02  0.800E-05    0.53       0.0  T
   2    -10.9845047  0.327775E-09  0.256E-04    0.53     175.0  T
   3    -10.9845047 -0.213003E-09  0.128E-04    0.53     349.0  T
     SCC iter.                  ...        0 min,  0.000 sec
     gradient                   ...        0 min,  0.001 sec
 * total energy  :   -10.9167242 Eh     change        0.6627445E-09 Eh
   gradient norm :     0.2158135 Eh/α   predicted     0.0000000E+00 (-100.00%)
   displ. norm   :     0.3646255 α      lambda       -0.5609091E-01
   maximum displ.:     0.2594230 α      in ANC's #1, #5, #9, ...

........................................................................
.............................. CYCLE    2 ..............................
........................................................................
   1    -11.0579241 -0.110579E+02  0.233E+00    1.11       0.0  T
   2    -10.8476447  0.210279E+00  0.447E+00    1.72       1.0  T
   3    -11.0538563 -0.206212E+00  0.166E+00    1.09       1.0  T
   4    -11.0714924 -0.176361E-01  0.413E-01    1.19       1.0  T
   5    -11.0721489 -0.656467E-03  0.215E-01    1.18       1.0  T
   6    -11.0721466  0.226526E-05  0.142E-01    1.18       1.0  T
   7    -11.0722584 -0.111787E-03  0.462E-02    1.19       1.0  T
   8    -11.0722650 -0.660780E-05  0.291E-02    1.19       1.5  T
   9    -11.0722707 -0.570925E-05  0.397E-03    1.19      11.3  T
  10    -11.0722707 -0.433016E-07  0.849E-04    1.19      52.7  T
  11    -11.0722707  0.285915E-08  0.751E-04    1.19      59.5  T
     SCC iter.                  ...        0 min,  0.001 sec
     gradient                   ...        0 min,  0.001 sec
 * total energy  :   -10.9666640 Eh     change       -0.4993982E-01 Eh
   gradient norm :     0.1626227 Eh/α   predicted    -0.3177413E-01 ( -36.38%)
   displ. norm   :     0.5534688 α      lambda       -0.8682185E-01
   maximum displ.:     0.4148138 α      in ANC's #5, #9, #8, ...

........................................................................
.............................. CYCLE    3 ..............................
........................................................................
   1    -11.2621280 -0.112621E+02  0.384E+00    1.96       0.0  T
   2    -11.2001005  0.620275E-01  0.346E+00    2.50       1.0  T
   3    -11.2486906 -0.485901E-01  0.260E+00    1.80       1.0  T
   4    -11.2850416 -0.363510E-01  0.436E-01    2.08       1.0  T
   5    -11.2856039 -0.562278E-03  0.171E-01    2.02       1.0  T
   6    -11.2856852 -0.813613E-04  0.359E-02    2.03       1.2  T
   7    -11.2856871 -0.186270E-05  0.138E-02    2.03       3.2  T
   8    -11.2856881 -0.100559E-05  0.845E-03    2.03       5.3  T
   9    -11.2856884 -0.351737E-06  0.478E-03    2.03       9.4  T
  10    -11.2856886 -0.156372E-06  0.120E-03    2.03      37.4  T
  11    -11.2856886 -0.294359E-08  0.206E-04    2.03     216.8  T
  12    -11.2856886 -0.254392E-10  0.701E-05    2.03     638.3  T
     SCC iter.                  ...        0 min,  0.001 sec
     gradient                   ...        0 min,  0.002 sec
 * total energy  :   -10.9039819 Eh     change        0.6268210E-01 Eh
   gradient norm :     0.6804195 Eh/α   predicted    -0.5670889E-01 (-190.47%)
   displ. norm   :     0.3687553 α      lambda       -0.2385339E+00
   maximum displ.:     0.2635886 α      in ANC's #5, #9, #3, ...

........................................................................
.............................. CYCLE    4 ..............................
........................................................................
   1    -11.1409312 -0.111409E+02  0.224E+00    1.21       0.0  T
   2    -11.0279640  0.112967E+00  0.353E+00    0.90       1.0  T
   3    -11.1217584 -0.937944E-01  0.198E+00    1.32       1.0  T
   4    -11.1506438 -0.288853E-01  0.374E-01    1.10       1.0  T
   5    -11.1513315 -0.687763E-03  0.215E-01    1.16       1.0  T
   6    -11.1514351 -0.103606E-03  0.119E-01    1.16       1.0  T
   7    -11.1515161 -0.809687E-04  0.341E-02    1.15       1.3  T
   8    -11.1515177 -0.160294E-05  0.282E-02    1.15       1.6  T
   9    -11.1515137  0.405052E-05  0.295E-02    1.15       1.5  T
  10    -11.1515200 -0.633717E-05  0.229E-03    1.15      19.6  T
  11    -11.1515200 -0.343784E-07  0.959E-04    1.15      46.6  T
  12    -11.1515200 -0.173544E-08  0.485E-05    1.15     921.4  T
     SCC iter.                  ...        0 min,  0.001 sec
     gradient                   ...        0 min,  0.001 sec
 * total energy  :   -10.9908481 Eh     change       -0.8686619E-01 Eh
   gradient norm :     0.0809759 Eh/α   predicted    -0.1354850E+00 (  55.97%)
   displ. norm   :     0.5774060 α      lambda       -0.1987711E-01
   maximum displ.:     0.5332412 α      in ANC's #1, #3, #9, ...

........................................................................
.............................. CYCLE    5 ..............................
........................................................................
   1    -11.1355942 -0.111356E+02  0.221E+00    1.00       0.0  T
   2    -11.1343894  0.120477E-02  0.129E+00    0.99       1.0  T
   3    -11.0641849  0.702045E-01  0.249E+00    1.21       1.0  T
   4    -11.1348125 -0.706277E-01  0.379E-01    0.95       1.0  T
   5    -11.1362344 -0.142189E-02  0.994E-02    1.01       1.0  T
   6    -11.1362278  0.662938E-05  0.627E-02    1.01       1.0  T
   7    -11.1362526 -0.248335E-04  0.202E-02    1.01       2.2  T
   8    -11.1362545 -0.187477E-05  0.580E-03    1.01       7.7  T
   9    -11.1362539  0.617685E-06  0.951E-03    1.01       4.7  T
  10    -11.1362546 -0.723739E-06  0.433E-04    1.01     103.2  T
  11    -11.1362546 -0.175930E-10  0.255E-04    1.01     175.4  T
     SCC iter.                  ...        0 min,  0.001 sec
     gradient                   ...        0 min,  0.001 sec
 * total energy  :   -10.9987524 Eh     change       -0.7904243E-02 Eh
   gradient norm :     0.0852198 Eh/α   predicted    -0.1325205E-01 (  67.66%)
   displ. norm   :     0.2467509 α      lambda       -0.1074980E-01
   maximum displ.:     0.2257087 α      in ANC's #3, #5, #1, ...

........................................................................
.............................. CYCLE    6 ..............................
........................................................................
   1    -11.1532148 -0.111532E+02  0.137E+00    1.20       0.0  T
   2    -11.1359851  0.172297E-01  0.157E+00    1.30       1.0  T
   3    -11.1410033 -0.501821E-02  0.128E+00    1.02       1.0  T
   4    -11.1540680 -0.130647E-01  0.600E-01    1.25       1.0  T
   5    -11.1562572 -0.218920E-02  0.742E-02    1.20       1.0  T
   6    -11.1562930 -0.357880E-04  0.277E-02    1.18       1.6  T
   7    -11.1562915  0.143875E-05  0.138E-02    1.18       3.2  T
   8    -11.1562929 -0.140465E-05  0.501E-03    1.18       8.9  T
   9    -11.1562931 -0.144525E-06  0.259E-03    1.18      17.3  T
  10    -11.1562931 -0.394768E-07  0.640E-04    1.18      69.8  T
  11    -11.1562931 -0.118897E-08  0.787E-05    1.18     568.1  T
     SCC iter.                  ...        0 min,  0.001 sec
     gradient                   ...        0 min,  0.001 sec
 * total energy  :   -11.0036086 Eh     change       -0.4856221E-02 Eh
   gradient norm :     0.0735491 Eh/α   predicted    -0.5702158E-02 (  17.42%)
   displ. norm   :     0.0959015 α      lambda       -0.3726479E-02
   maximum displ.:     0.0750651 α      in ANC's #1, #4, #3, ...

........................................................................
.............................. CYCLE    7 ..............................
........................................................................
   1    -11.1721632 -0.111722E+02  0.451E-01    1.31       0.0  T
   2    -11.1718720  0.291193E-03  0.292E-01    1.33       1.0  T
   3    -11.1677226  0.414935E-02  0.675E-01    1.25       1.0  T
   4    -11.1721546 -0.443200E-02  0.110E-01    1.31       1.0  T
   5    -11.1722240 -0.694316E-04  0.327E-02    1.30       1.4  T
   6    -11.1722289 -0.490403E-05  0.521E-03    1.31       8.6  T
   7    -11.1722288  0.104777E-06  0.442E-03    1.31      10.1  T
   8    -11.1722289 -0.334410E-07  0.395E-03    1.31      11.3  T
   9    -11.1722290 -0.113723E-06  0.116E-03    1.31      38.4  T
  10    -11.1722290 -0.304802E-08  0.945E-05    1.31     473.3  T
  11    -11.1722290 -0.370992E-10  0.974E-06    1.31    4589.6  T
     SCC iter.                  ...        0 min,  0.001 sec
     gradient                   ...        0 min,  0.001 sec
 * total energy  :   -11.0060239 Eh     change       -0.2415254E-02 Eh
   gradient norm :     0.0316602 Eh/α   predicted    -0.1880377E-02 ( -22.15%)
   displ. norm   :     0.1668315 α      lambda       -0.3218148E-02
   maximum displ.:     0.0963506 α      in ANC's #3, #5, #1, ...

........................................................................
.............................. CYCLE    8 ..............................
........................................................................
   1    -11.1763842 -0.111764E+02  0.552E-01    1.29       0.0  T
   2    -11.1763014  0.827873E-04  0.338E-01    1.30       1.0  T
   3    -11.1706880  0.561337E-02  0.715E-01    1.22       1.0  T
   4    -11.1763940 -0.570597E-02  0.483E-02    1.28       1.0  T
   5    -11.1764071 -0.131522E-04  0.208E-02    1.29       2.2  T
   6    -11.1764074 -0.223746E-06  0.905E-03    1.29       4.9  T
   7    -11.1764076 -0.282277E-06  0.276E-03    1.29      16.2  T
   8    -11.1764076  0.304860E-07  0.320E-03    1.29      14.0  T
   9    -11.1764077 -0.714522E-07  0.121E-03    1.29      37.0  T
  10    -11.1764077 -0.846370E-08  0.154E-04    1.29     290.5  T
  11    -11.1764077 -0.831051E-10  0.123E-05    1.29    3626.6  T
     SCC iter.                  ...        0 min,  0.001 sec
     gradient                   ...        0 min,  0.001 sec
 * total energy  :   -11.0082472 Eh     change       -0.2223390E-02 Eh
   gradient norm :     0.0190067 Eh/α   predicted    -0.1653858E-02 ( -25.62%)
   displ. norm   :     0.1800528 α      lambda       -0.1798208E-02
   maximum displ.:     0.1075881 α      in ANC's #1, #5, #3, ...

........................................................................
.............................. CYCLE    9 ..............................
........................................................................
   1    -11.1722760 -0.111723E+02  0.558E-01    1.26       0.0  T
   2    -11.1722799 -0.385512E-05  0.334E-01    1.27       1.0  T
   3    -11.1716725  0.607360E-03  0.241E-01    1.24       1.0  T
   4    -11.1720800 -0.407506E-03  0.145E-01    1.28       1.0  T
   5    -11.1722956 -0.215525E-03  0.174E-02    1.26       2.6  T
   6    -11.1722952  0.366342E-06  0.780E-03    1.26       5.7  T
   7    -11.1722958 -0.568876E-06  0.131E-03    1.26      34.1  T
   8    -11.1722958  0.642711E-08  0.120E-03    1.26      37.2  T
   9    -11.1722958 -0.445539E-08  0.875E-04    1.26      51.1  T
  10    -11.1722958 -0.532439E-08  0.862E-05    1.26     518.9  T
     SCC iter.                  ...        0 min,  0.001 sec
     gradient                   ...        0 min,  0.001 sec
 * total energy  :   -11.0093446 Eh     change       -0.1097346E-02 Eh
   gradient norm :     0.0218591 Eh/α   predicted    -0.9282533E-03 ( -15.41%)
   displ. norm   :     0.0825263 α      lambda       -0.9442866E-03
   maximum displ.:     0.0665751 α      in ANC's #5, #4, #1, ...

........................................................................
.............................. CYCLE   10 ..............................
........................................................................
   1    -11.1782317 -0.111782E+02  0.253E-01    1.28       0.0  T
   2    -11.1781560  0.756768E-04  0.182E-01    1.29       1.0  T
   3    -11.1770507  0.110533E-02  0.339E-01    1.25       1.0  T
   4    -11.1781689 -0.111815E-02  0.877E-02    1.29       1.0  T
   5    -11.1782496 -0.807904E-04  0.834E-03    1.28       5.4  T
   6    -11.1782496  0.483072E-07  0.602E-03    1.28       7.4  T
   7    -11.1782498 -0.161325E-06  0.105E-03    1.28      42.5  T
   8    -11.1782498  0.712405E-08  0.134E-03    1.28      33.4  T
   9    -11.1782498 -0.134818E-07  0.290E-04    1.28     154.1  T
  10    -11.1782498 -0.184876E-09  0.431E-05    1.28    1038.2  T
     SCC iter.                  ...        0 min,  0.001 sec
     gradient                   ...        0 min,  0.001 sec
 * total energy  :   -11.0099891 Eh     change       -0.6445453E-03 Eh
   gradient norm :     0.0095518 Eh/α   predicted    -0.4753599E-03 ( -26.25%)
   displ. norm   :     0.0524002 α      lambda       -0.2737850E-03
   maximum displ.:     0.0396919 α      in ANC's #5, #1, #4, ...

........................................................................
.............................. CYCLE   11 ..............................
........................................................................
   1    -11.1810426 -0.111810E+02  0.182E-01    1.30       0.0  T
   2    -11.1810397  0.287546E-05  0.114E-01    1.29       1.0  T
   3    -11.1807314  0.308303E-03  0.170E-01    1.31       1.0  T
   4    -11.1809836 -0.252160E-03  0.867E-02    1.29       1.0  T
   5    -11.1810538 -0.702181E-04  0.941E-03    1.29       4.8  T
   6    -11.1810541 -0.281788E-06  0.504E-03    1.29       8.9  T
   7    -11.1810542 -0.796917E-07  0.737E-04    1.29      60.6  T
   8    -11.1810541  0.415953E-08  0.960E-04    1.29      46.6  T
     SCC iter.                  ...        0 min,  0.001 sec
     gradient                   ...        0 min,  0.001 sec
 * total energy  :   -11.0101417 Eh     change       -0.1525201E-03 Eh
   gradient norm :     0.0031742 Eh/α   predicted    -0.1372675E-03 ( -10.00%)
   displ. norm   :     0.0105245 α      lambda       -0.1246244E-04
   maximum displ.:     0.0070531 α      in ANC's #5, #1, #4, ...

........................................................................
.............................. CYCLE   12 ..............................
........................................................................
   1    -11.1818367 -0.111818E+02  0.367E-02    1.30       0.0  T
   2    -11.1818172  0.194707E-04  0.492E-02    1.30       1.0  T
   3    -11.1818332 -0.159790E-04  0.271E-02    1.29       1.6  T
   4    -11.1818383 -0.509983E-05  0.738E-03    1.30       6.1  T
   5    -11.1818386 -0.327107E-06  0.148E-03    1.30      30.2  T
   6    -11.1818386  0.385618E-07  0.236E-03    1.30      18.9  T
   7    -11.1818386 -0.383838E-07  0.808E-04    1.30      55.4  T
   8    -11.1818386 -0.558522E-08  0.820E-05    1.30     545.2  T
     SCC iter.                  ...        0 min,  0.001 sec
     gradient                   ...        0 min,  0.001 sec
 * total energy  :   -11.0101493 Eh     change       -0.7659177E-05 Eh
   gradient norm :     0.0014786 Eh/α   predicted    -0.6232705E-05 ( -18.62%)
   displ. norm   :     0.0126699 α      lambda       -0.5215597E-05
   maximum displ.:     0.0103251 α      in ANC's #1, #5, #4, ...

........................................................................
.............................. CYCLE   13 ..............................
........................................................................
   1    -11.1821094 -0.111821E+02  0.528E-02    1.30       0.0  T
   2    -11.1821096 -0.198467E-06  0.296E-02    1.30       1.5  T
   3    -11.1821093  0.306757E-06  0.617E-03    1.30       7.2  T
   4    -11.1821092  0.738567E-07  0.686E-03    1.30       6.5  T
   5    -11.1821097 -0.462320E-06  0.144E-03    1.30      31.1  T
   6    -11.1821096  0.592586E-07  0.267E-03    1.30      16.7  T
   7    -11.1821097 -0.631467E-07  0.138E-04    1.30     324.6  T
   8    -11.1821097 -0.515303E-10  0.692E-05    1.30     646.6  T
     SCC iter.                  ...        0 min,  0.001 sec
     gradient                   ...        0 min,  0.002 sec
 * total energy  :   -11.0101550 Eh     change       -0.5656197E-05 Eh
   gradient norm :     0.0012970 Eh/α   predicted    -0.2608216E-05 ( -53.89%)
   displ. norm   :     0.0149680 α      lambda       -0.6812583E-05
   maximum displ.:     0.0114296 α      in ANC's #1, #3, #9, ...

........................................................................
.............................. CYCLE   14 ..............................
........................................................................
   1    -11.1823152 -0.111823E+02  0.711E-02    1.30       0.0  T
   2    -11.1823150  0.181248E-06  0.405E-02    1.30       1.1  T
   3    -11.1822735  0.415150E-04  0.607E-02    1.29       1.0  T
   4    -11.1823157 -0.422178E-04  0.494E-03    1.30       9.1  T
   5    -11.1823158 -0.829179E-07  0.241E-03    1.30      18.6  T
   6    -11.1823158  0.149254E-07  0.164E-03    1.30      27.2  T
   7    -11.1823158 -0.782111E-08  0.134E-03    1.30      33.3  T
   8    -11.1823158 -0.146956E-07  0.147E-04    1.30     304.8  T
   9    -11.1823158 -0.680522E-10  0.570E-05    1.30     784.8  T
     SCC iter.                  ...        0 min,  0.001 sec
     gradient                   ...        0 min,  0.001 sec
 * total energy  :   -11.0101607 Eh     change       -0.5729657E-05 Eh
   gradient norm :     0.0008497 Eh/α   predicted    -0.3407041E-05 ( -40.54%)
   displ. norm   :     0.0061180 α      lambda       -0.1206395E-05
   maximum displ.:     0.0057153 α      in ANC's #1, #9, #5, ...

........................................................................
.............................. CYCLE   15 ..............................
........................................................................
   1    -11.1817216 -0.111817E+02  0.277E-02    1.29       0.0  T
   2    -11.1817205  0.111639E-05  0.187E-02    1.29       2.4  T
   3    -11.1817031  0.173743E-04  0.415E-02    1.30       1.1  T
   4    -11.1817217 -0.185961E-04  0.350E-03    1.29      12.8  T
   5    -11.1817218 -0.103151E-06  0.996E-04    1.29      44.9  T
   6    -11.1817218  0.615829E-08  0.101E-03    1.29      44.1  T
   7    -11.1817218 -0.238854E-08  0.833E-04    1.29      53.7  T
     SCC iter.                  ...        0 min,  0.001 sec
     gradient                   ...        0 min,  0.001 sec
 * total energy  :   -11.0101608 Eh     change       -0.5577074E-07 Eh
   gradient norm :     0.0008211 Eh/α   predicted    -0.6027781E-06 ( 980.81%)
   displ. norm   :     0.0039506 α      lambda       -0.7655973E-06
   maximum displ.:     0.0029225 α      in ANC's #1, #3, #5, ...

   *** GEOMETRY OPTIMIZATION CONVERGED AFTER 15 ITERATIONS ***

------------------------------------------------------------------------
 total energy gain   :        -0.0934365 Eh      -58.6323 kcal/mol
 total RMSD          :         0.6961745 a0        0.3684 Å
 total power (kW/mol):       -16.3545045 (step)-4386.3858 (real)
------------------------------------------------------------------------

 ANCopt (total)                0 d,  0 h,  0 min,  0.056 sec
 optimizer setup                ...        0 min,  0.000 sec (  0.095%)
 model hessian                  ...        0 min,  0.000 sec (  0.239%)
 ANC generation                 ...        0 min,  0.000 sec (  0.078%)
 coordinate transformation      ...        0 min,  0.000 sec (  0.054%)
 single point calculation       ...        0 min,  0.055 sec ( 97.676%)
 optimization log               ...        0 min,  0.000 sec (  0.606%)
 hessian update                 ...        0 min,  0.000 sec (  0.053%)
 rational function              ...        0 min,  0.000 sec (  0.541%)

================
 final structure:
================
5
 xtb: 6.2.2 (9d81278992624c895f80dd42a50cac0aa55982e2)
C        -0.50054024262723    0.94630409973875   -0.00375803455104
C         0.65484477765252   -0.03165850547832    0.03226429620316
C        -0.58708139214519   -0.89364034201886   -0.05279379504145
C         1.90935109229753   -0.09244048959794    0.09887239868358
N        -1.47657523517763    0.07143523735638   -0.07458586529425

 Bond Distances (Angstroems)
 ---------------------------
C1-C2=1.5141         C1-C3=1.8426         C1-N5=1.3127         C2-C1=1.5141         C2-C3=1.5141         C2-C4=1.2577         
C3-C1=1.8426         C3-C2=1.5141         C3-N5=1.3126         C4-C2=1.2577         N5-C1=1.3127         N5-C3=1.3126         
 C  C  Rav=1.5322 sigma=0.2076  Rmin=1.2577  Rmax=1.8426     4
 N  C  Rav=1.3127 sigma=0.0000  Rmin=1.3126  Rmax=1.3127     2

 selected bond angles (degree)
 --------------------
C3-C1-C2= 52.52                N5-C1-C2= 97.94                N5-C1-C3= 45.42                C3-C2-C1= 74.96                
C4-C2-C1=142.52                C4-C2-C3=142.52                C2-C3-C1= 52.52                N5-C3-C1= 45.42                
N5-C3-C2= 97.94                C3-N5-C1= 89.16                

 selected dihedral angles (degree)
 ---------------------------------
C3-C2-C1-N5=  0.04            C4-C2-C1-C3=180.24            C4-C2-C1-N5=180.28            C2-C3-C1-N5=180.05            
N5-C3-C1-C2=179.95            C1-C3-C2-C4=179.76            N5-C3-C2-C1=359.96            N5-C3-C2-C4=179.72            
C3-N5-C1-C2=359.96            C1-N5-C3-C2=  0.04            
           -------------------------------------------------
          |                Final Singlepoint                |
           -------------------------------------------------

          ...................................................
          :                      SETUP                      :
          :.................................................:
          :  # basis functions                  20          :
          :  # atomic orbitals                  20          :
          :  # shells                           10          :
          :  # electrons                        21          :
          :  max. iterations                   250          :
          :  Hamiltonian                  GFN2-xTB          :
          :  restarted?                      false          :
          :  GBSA solvation                  false          :
          :  PC potential                    false          :
          :  electronic temp.          300.0000000     K    :
          :  accuracy                    1.0000000          :
          :  -> integral cutoff          0.2500000E+02      :
          :  -> integral neglect         0.1000000E-07      :
          :  -> SCF convergence          0.1000000E-05 Eh   :
          :  -> wf. convergence          0.1000000E-03 e    :
          :  Broyden damping             0.4000000          :
          ...................................................

 iter      E             dE          RMSdq      gap      omega  full diag
   1    -11.1817218 -0.111817E+02  0.364E-04    1.29       0.0  T
   2    -11.1817218  0.317915E-10  0.194E-04    1.29     230.7  T
   3    -11.1817218  0.132229E-08  0.421E-04    1.29     106.3  T

   *** convergence criteria satisfied after 3 iterations ***

         #    Occupation            Energy/Eh            Energy/eV
      -------------------------------------------------------------
         1        2.0000           -0.7435937             -20.2342
       ...           ...                  ...                  ...
         6        2.0000           -0.5640885             -15.3496
         7        2.0000           -0.4922414             -13.3946
         8        2.0000           -0.4836926             -13.1619
         9        2.0000           -0.4698605             -12.7856
        10        1.0000           -0.4364912             -11.8775
        11        1.0000           -0.4142869             -11.2733
        12        1.0000           -0.3679844             -10.0134 (HOMO)
        13                         -0.3204500              -8.7199 (LUMO)
        14                         -0.3184646              -8.6659
        15                         -0.1772902              -4.8243
        16                          0.0502665               1.3678
        17                          0.0781425               2.1264
       ...                                ...                  ...
        20                          0.8585321              23.3618
      -------------------------------------------------------------
                  HL-Gap            0.0475344 Eh            1.2935 eV
             Fermi-level           -0.3987242 Eh          -10.8498 eV

 SCC (total)                   0 d,  0 h,  0 min,  0.003 sec
 SCC setup                      ...        0 min,  0.000 sec (  1.300%)
 Dispersion                     ...        0 min,  0.000 sec (  0.468%)
 integral evaluation            ...        0 min,  0.001 sec ( 40.676%)
 zeroth order Hamiltonian       ...        0 min,  0.000 sec (  0.500%)
 iterations                     ...        0 min,  0.000 sec ( 11.243%)
 molecular gradient             ...        0 min,  0.001 sec ( 44.061%)
 printout                       ...        0 min,  0.000 sec (  1.499%)

         :::::::::::::::::::::::::::::::::::::::::::::::::::::
         ::                     SUMMARY                     ::
         :::::::::::::::::::::::::::::::::::::::::::::::::::::
         :: total energy             -11.010160762959 Eh    ::
         :: gradient norm              0.000831342958 Eh/a0 ::
         :: HOMO-LUMO gap              1.293475535247 eV    ::
         ::.................................................::
         :: SCC energy               -11.181721808042 Eh    ::
         :: -> isotropic ES           -0.007581274249 Eh    ::
         :: -> anisotropic ES          0.002217212672 Eh    ::
         :: -> anisotropic XC          0.006229719069 Eh    ::
         :: -> dispersion             -0.002856587430 Eh    ::
         :: repulsion energy           0.171561034203 Eh    ::
         :: add. restraining           0.000000000000 Eh    ::
         :::::::::::::::::::::::::::::::::::::::::::::::::::::

           ------------------------------------------------- 
          |                Numerical Hessian                |
           ------------------------------------------------- 
step length          :   0.00500
SCC accuracy         :   0.30000
Hessian scale factor :   1.00000
frozen atoms in %    :   0.00000    0
RMS gradient         :   0.00083
estimated CPU  time      0.00 min
estimated wall time      0.00 min

writing file <hessian>.

 projected vibrational frequencies (cm-1)
eigval :       -0.00    -0.00    -0.00     0.00     0.00     0.00
eigval :      221.79   284.06   305.39   359.17   623.05   899.76
eigval :      950.49  1495.73  1809.69
           -------------------------------------------------
          |                Property Printout                |
           -------------------------------------------------

    * Orbital Energies and Occupations

         #    Occupation            Energy/Eh            Energy/eV
      -------------------------------------------------------------
         1        2.0000           -0.7435930             -20.2342
         2        2.0000           -0.6853478             -18.6493
         3        2.0000           -0.6351605             -17.2836
         4        2.0000           -0.6218181             -16.9205
         5        2.0000           -0.5721054             -15.5678
         6        2.0000           -0.5640880             -15.3496
         7        2.0000           -0.4922418             -13.3946
         8        2.0000           -0.4836931             -13.1620
         9        2.0000           -0.4698597             -12.7855
        10        1.0000           -0.4364918             -11.8775
        11        1.0000           -0.4142876             -11.2733
        12        1.0000           -0.3679835             -10.0133 (HOMO)
        13                         -0.3204501              -8.7199 (LUMO)
        14                         -0.3184649              -8.6659
        15                         -0.1772901              -4.8243
        16                          0.0502670               1.3678
        17                          0.0781431               2.1264
        18                          0.2494825               6.7888
        19                          0.3486952               9.4885
        20                          0.8585318              23.3618
      -------------------------------------------------------------
                  HL-Gap            0.0475334 Eh            1.2934 eV
             Fermi-level           -0.3987240 Eh          -10.8498 eV

     #   Z        covCN         q      C6AA      α(0)
     1   6 C      2.669    -0.009    28.215     8.692
     2   6 C      3.070     0.101    25.690     8.311
     3   6 C      2.669    -0.009    28.215     8.692
     4   6 C      0.982    -0.059    37.748    10.320
     5   7 N      1.957    -0.025    22.418     7.021

 Mol. C6AA /au·bohr⁶  :        704.905937
Molecule has the following symmetry elements: (C2) 2*(sigma) 
It seems to be the C2v point group
 Mol. C8AA /au·bohr⁸  :      19479.591751
 Mol. α(0) /au        :         43.034997


Wiberg/Mayer (AO) data.
largest (>0.10) Wiberg bond orders for each atom
          total WBO             WBO to atom ...
     1  C   2.684        N    5 1.389    C    2 0.806    C    3 0.425
     2  C   3.778        C    4 2.129    C    1 0.806    C    3 0.806
     3  C   2.684        N    5 1.389    C    2 0.806    C    1 0.425
     4  C   2.485        C    2 2.129    N    5 0.227
     5  N   3.041        C    3 1.389    C    1 1.389    C    4 0.227

MOs/occ written to file <molden.input>


molecular dipole:
                 x           y           z       tot (Debye)
 q only:        0.000      -0.000      -0.000
   full:       -0.043       0.002      -0.003       0.110
molecular quadrupole (traceless):
                xx          xy          yy          xz          yz          zz
 q only:       -0.795       0.056       0.358      -0.064       0.001       0.437
  q+dip:       -0.241      -0.029      -0.885      -0.070      -0.050       1.127
   full:       -2.338       0.106      -0.232      -0.254      -0.063       2.570

           -------------------------------------------------
          |                Geometry Summary                 |
           -------------------------------------------------

      molecular mass/u    :       62.0496468
   center of mass at/Å    :       -0.0474976       0.0022981      -0.0023993
  moments of inertia/u·Å² :        0.2039002E+02   0.8686857E+02   0.1072585E+03
rotational constants/cm⁻¹ :        0.8267592E+00   0.1940590E+00   0.1571683E+00

 * 3 selected distances

     #   Z        #   Z                                     value/Å
     2   6 C      4   6 C                                 1.2577429 (min)
     1   6 C      5   7 N                                 1.3126524 (max)
     3   6 C      5   7 N                                 1.3126481

 * 2 distinct bonds (by element types)

   Z      Z             #   av. dist./Å        max./Å        min./Å
   6 C    6 C           1     1.2577429     1.2577429     1.2577429
   6 C    7 N           2     1.3126503     1.3126524     1.3126481

           -------------------------------------------------
          |               Frequency Printout                |
           -------------------------------------------------
 projected vibrational frequencies (cm-1)
eigval :       -0.00    -0.00    -0.00     0.00     0.00     0.00
eigval :      221.79   284.06   305.39   359.17   623.05   899.76
eigval :      950.49  1495.73  1809.69
 reduced masses (amu)
   1: 12.04   2: 12.02   3: 12.16   4: 12.47   5: 12.86   6: 13.06   7: 12.85   8: 12.09
   9: 12.05  10: 12.11  11: 12.57  12: 12.05  13: 12.85  14: 12.92  15: 12.05
 IR intensities (amu)
   1:  0.01   2:  0.04   3:  0.03   4:  0.04   5:  0.06   6:  0.04   7:  0.07   8:  0.56
   9:  0.21  10:  0.31  11:  0.50  12:  0.61  13:  1.66  14:  0.99  15:  1.12
 Raman intensities (amu)
   1:  0.00   2:  0.00   3:  0.00   4:  0.00   5:  0.00   6:  0.00   7:  0.00   8:  0.00
   9:  0.00  10:  0.00  11:  0.00  12:  0.00  13:  0.00  14:  0.00  15:  0.00
 output can be read by thermo (or use thermo option).
 writing <g98.out> molden fake output.
 recommended (thermochemical) frequency scaling factor: 1.0
           -------------------------------------------------
          |             Thermodynamic Functions             |
           -------------------------------------------------

c2v symmetry found (for desy threshold:  0.10E+00) used in thermo

          ...................................................
          :                      SETUP                      :
          :.................................................:
          :  # frequencies                           9      :
          :  # imaginary freq.                       0      :
          :  linear?                             false      :
          :  only rotor calc.                    false      :
          :  symmetry                              c2v      :
          :  rotational number                       2      :
          :  scaling factor                  1.0000000      :
          :  rotor cutoff                   50.0000000 cm⁻¹ :
          :  imag. cutoff                  -20.0000000 cm⁻¹ :
          :.................................................:

    mode    ω/cm⁻¹     T·S(HO)/kcal·mol⁻¹    T·S(FR)/kcal·mol⁻¹   T·S(vib)
   ------------------------------------------------------------------------
       1    221.79    -0.00000 ( 99.74%)     0.01311 (  0.26%)     0.00003
       2    284.06    -0.00000 ( 99.90%)     0.01556 (  0.10%)     0.00001
   ------------------------------------------------------------------------

   temp. (K)  partition function   enthalpy   heat capacity  entropy
                                   cal/mol     cal/K/mol   cal/K/mol   J/K/mol
 298.15  VIB   3.46                 1245.760      8.750      6.648
         ROT  0.166E+05              888.752      2.981     22.297
         INT  0.577E+05             2134.513     11.731     28.945
         TR   0.473E+27             1481.254      4.968     38.278
         TOT                        3615.7667    16.6991    67.2236   281.2635

   temp. (K)  partition function   enthalpy   heat capacity  entropy
                                   cal/mol     cal/K/mol   cal/K/mol   J/K/mol
 120.00  VIB   1.16                  113.766      3.258      1.242
         ROT  0.425E+04              357.707      2.981     19.584
         INT  0.492E+04              471.472      6.239     20.826
         TR   0.121E+27              596.178      4.968     33.759
         TOT                        1067.6503    11.2073    54.5850   228.3838

   temp. (K)  partition function   enthalpy   heat capacity  entropy
                                   cal/mol     cal/K/mol   cal/K/mol   J/K/mol
 100.00  VIB   1.08                   58.112      2.295      0.737
         ROT  0.323E+04              298.089      2.981     19.041
         INT  0.349E+04              356.201      5.276     19.778
         TR   0.919E+26              496.815      4.968     32.853
         TOT                         853.0161    10.2441    52.6314   220.2097

   temp. (K)  partition function   enthalpy   heat capacity  entropy
                                   cal/mol     cal/K/mol   cal/K/mol   J/K/mol
  80.00  VIB   1.03                   22.151      1.308      0.340
         ROT  0.231E+04              238.471      2.981     18.376
         INT  0.239E+04              260.622      4.289     18.715
         TR   0.657E+26              397.452      4.968     31.745
         TOT                         658.0740     9.2569    50.4606   211.1271

   temp. (K)  partition function   enthalpy   heat capacity  entropy
                                   cal/mol     cal/K/mol   cal/K/mol   J/K/mol
  60.00  VIB   1.01                    4.782      0.477      0.095
         ROT  0.150E+04              178.853      2.981     17.518
         INT  0.151E+04              183.635      3.458     17.613
         TR   0.427E+26              298.089      4.968     30.317
         TOT                         481.7244     8.4263    47.9295   200.5369

   temp. (K)  partition function   enthalpy   heat capacity  entropy
                                   cal/mol     cal/K/mol   cal/K/mol   J/K/mol
  40.00  VIB   1.00                    0.265      0.056      0.007
         ROT   818.                  119.236      2.981     16.309
         INT   818.                  119.500      3.037     16.316
         TR   0.232E+26              198.726      4.968     28.303
         TOT                         318.2262     8.0049    44.6198   186.6891

   temp. (K)  partition function   enthalpy   heat capacity  entropy
                                   cal/mol     cal/K/mol   cal/K/mol   J/K/mol
  20.00  VIB   1.00                    0.000      0.000     -0.004
         ROT   289.                   59.618      2.981     14.243
         INT   289.                   59.618      2.981     14.240
         TR   0.822E+25               99.363      4.968     24.861
         TOT                         158.9809     7.9491    39.1010   163.5984

   temp. (K)  partition function   enthalpy   heat capacity  entropy
                                   cal/mol     cal/K/mol   cal/K/mol   J/K/mol
  10.00  VIB   1.00                    0.000      0.000     -0.007
         ROT   102.                   29.809      2.981     12.177
         INT   102.                   29.809      2.981     12.170
         TR   0.290E+25               49.681      4.968     21.419
         TOT                          79.4904     7.9490    33.5896   140.5387

       T/K    H(0)-H(T)+PV         H(T)/Eh          T*S/Eh         G(T)/Eh
   ------------------------------------------------------------------------
    298.15    0.576209E-02    0.215934E-01    0.319401E-01   -0.103467E-01
    120.00    0.170141E-02    0.175327E-01    0.104384E-01    0.709426E-02
    100.00    0.135937E-02    0.171906E-01    0.838735E-02    0.880329E-02
     80.00    0.104871E-02    0.168800E-01    0.643313E-02    0.104468E-01
     60.00    0.767677E-03    0.165989E-01    0.458283E-02    0.120161E-01
     40.00    0.507126E-03    0.163384E-01    0.284424E-02    0.134941E-01
     20.00    0.253352E-03    0.160846E-01    0.124623E-02    0.148384E-01
     10.00    0.126676E-03    0.159579E-01    0.535284E-03    0.154227E-01 (used)
   ------------------------------------------------------------------------

         :::::::::::::::::::::::::::::::::::::::::::::::::::::
         ::                  THERMODYNAMIC                  ::
         :::::::::::::::::::::::::::::::::::::::::::::::::::::
         :: total free energy         -10.994738101905 Eh   ::
         ::.................................................::
         :: total energy              -11.010160762231 Eh   ::
         :: zero point energy           0.015831268027 Eh   ::
         :: G(RRHO) w/o ZPVE           -0.000408607701 Eh   ::
         :: G(RRHO) contrib.            0.015422660326 Eh   ::
         :::::::::::::::::::::::::::::::::::::::::::::::::::::

optimized geometry written to: xtbopt.xyz


           -------------------------------------------------
          | TOTAL ENERGY              -11.010160762231 Eh   |
          | TOTAL ENTHALPY            -10.994202818188 Eh   |
          | TOTAL FREE ENERGY         -10.994738101905 Eh   |
          | GRADIENT NORM               0.000832228251 Eh/α |
          | HOMO-LUMO GAP               1.293449825239 eV   |
           -------------------------------------------------

------------------------------------------------------------------------
 * finished run on 2020/05/12 at 11:44:06.077     
------------------------------------------------------------------------
 total:
 * wall-time:     0 d,  0 h,  0 min,  0.182 sec
 *  cpu-time:     0 d,  0 h,  0 min,  0.182 sec
 * ratio c/w:     0.999 speedup
 SCF:
 * wall-time:     0 d,  0 h,  0 min,  0.005 sec
 *  cpu-time:     0 d,  0 h,  0 min,  0.005 sec
 * ratio c/w:     0.999 speedup
 ANC optimizer:
 * wall-time:     0 d,  0 h,  0 min,  0.060 sec
 *  cpu-time:     0 d,  0 h,  0 min,  0.059 sec
 * ratio c/w:     0.999 speedup
 numerical hessian:
 * wall-time:     0 d,  0 h,  0 min,  0.102 sec
 *  cpu-time:     0 d,  0 h,  0 min,  0.102 sec
 * ratio c/w:     0.999 speedup

