      -----------------------------------------------------------      
     |                   =====================                   |     
     |                           x T B                           |     
     |                   =====================                   |     
     |                         S. Grimme                         |     
     |          Mulliken Center for Theoretical Chemistry        |     
     |                    University of Bonn                     |     
      -----------------------------------------------------------      

   * xtb version 6.2.2 (9d81278992624c895f80dd42a50cac0aa55982e2) compiled by '@Darwin' on 04/03/2020

   xtb is free software: you can redistribute it and/or modify it under
   the terms of the GNU Lesser General Public License as published by
   the Free Software Foundation, either version 3 of the License, or
   (at your option) any later version.
   
   xtb is distributed in the hope that it will be useful,
   but WITHOUT ANY WARRANTY; without even the implied warranty of
   MERCHANTABILITY or FITNESS FOR A PARTICULAR PURPOSE.  See the
   GNU Lesser General Public License for more details.
   
   Cite this work as:
   * S. Grimme, C. Bannwarth, P. Shushkov, J. Chem. Theory Comput., 2017,
     13, 1989-2009. DOI: 10.1021/acs.jctc.7b00118
   * C. Bannwarth, S. Ehlert and S. Grimme., J. Chem. Theory Comput., 2019,
     15, 1652-1671. DOI: 10.1021/acs.jctc.8b01176
   * P. Pracht, E. Caldeweyher, S. Ehlert, S. Grimme, ChemRxiv, 2019, preprint.
     DOI: 10.26434/chemrxiv.8326202.v1
   
   for DFT-D4:
   * E. Caldeweyher, C. Bannwarth and S. Grimme, J. Chem. Phys., 2017,
     147, 034112. DOI: 10.1063/1.4993215
   * E. Caldeweyher, S. Ehlert, A. Hansen, H. Neugebauer, S. Spicher,
     C. Bannwarth and S. Grimme, J. Chem. Phys., 2019, 150, 154122.
     DOI: 10.1063/1.5090222
   
   for sTDA-xTB:
   * S. Grimme and C. Bannwarth, J. Chem. Phys., 2016, 145, 054103.
     DOI: 10.1063/1.4959605
   
   in the mass-spec context:
   * V. Asgeirsson, C. Bauer and S. Grimme, Chem. Sci., 2017, 8, 4879.
     DOI: 10.1039/c7sc00601b
   
   for metadynamics refer to:
   * S. Grimme, J. Chem. Theory Comput., 2019, 155, 2847-2862
     DOI: 10.1021/acs.jctc.9b00143
   
   with help from (in alphabetical order)
   C. Bannwarth, F. Bohle, G. Brandenburg, E. Caldeweyher, M. Checinski,
   S. Dohm, S. Ehlert, S. Ehrlich, F. März, H. Neugebauer, J. Pisarek,
   P. Pracht, P. Shushkov, and S. Spicher.
   
 * started run on 2020/05/12 at 11:45:10.746     

           -------------------------------------------------
          |                Calculation Setup                |
           -------------------------------------------------

          program call               : xtb --input H1C4_7_S_1.input H1C4_7_S_1.xyz --ohess --molden --namespace H1C4_7_S_1 output.out
          calculation namespace      : H1C4_7_S_1
          coordinate file            : H1C4_7_S_1.xyz
          number of atoms            :                     5
          number of electrons        :                    17
          charge                     :                     0
          spin                       :                   0.5
          first test random number   :      0.72034955707664

   ID    Z sym.   atoms
    1    6 C      1-4
    2    1 H      5

           -------------------------------------------------
          |                 G F N 2 - x T B                 |
           -------------------------------------------------

        Reference                      10.1021/acs.jctc.8b01176
      * Hamiltonian:
        H0-scaling (s, p, d)           1.850000    2.230000    2.230000
        zeta-weighting                 0.500000
      * Dispersion:
        s8                             2.700000
        a1                             0.520000
        a2                             5.000000
        s9                             5.000000
      * Repulsion:
        kExp                           1.500000    1.000000
        rExp                           1.000000
      * Coulomb:
        alpha                          2.000000
        third order                    shell-resolved
        anisotropic                    true
        a3                             3.000000
        a5                             4.000000
        cn-shift                       1.200000
        cn-exp                         4.000000
        max-rad                        5.000000


          ...................................................
          :                      SETUP                      :
          :.................................................:
          :  # basis functions                  17          :
          :  # atomic orbitals                  17          :
          :  # shells                            9          :
          :  # electrons                        17          :
          :  max. iterations                   250          :
          :  Hamiltonian                  GFN2-xTB          :
          :  restarted?                      false          :
          :  GBSA solvation                  false          :
          :  PC potential                    false          :
          :  electronic temp.          300.0000000     K    :
          :  accuracy                    1.0000000          :
          :  -> integral cutoff          0.2500000E+02      :
          :  -> integral neglect         0.1000000E-07      :
          :  -> SCF convergence          0.1000000E-05 Eh   :
          :  -> wf. convergence          0.1000000E-03 e    :
          :  Broyden damping             0.4000000          :
          ...................................................

 iter      E             dE          RMSdq      gap      omega  full diag
   1     -8.5978562 -0.859786E+01  0.951E+00    0.09       0.0  T
   2     -7.5558246  0.104203E+01  0.139E+01    0.46       1.0  T
   3     -8.4467622 -0.890938E+00  0.773E+00    0.47       1.0  T
   4     -8.6577544 -0.210992E+00  0.426E+00    0.09       1.0  T
   5     -8.6924237 -0.346693E-01  0.299E+00    0.10       1.0  T
   6     -8.6932521 -0.828408E-03  0.289E+00    0.08       1.0  T
   7     -8.6951286 -0.187656E-02  0.190E+00    0.08       1.0  T
   8     -8.6968319 -0.170328E-02  0.129E+00    0.07       1.0  T
   9     -8.6968773 -0.454212E-04  0.655E-01    0.08       1.0  T
  10     -8.6972265 -0.349161E-03  0.288E-01    0.08       1.0  T
  11     -8.6971996  0.268987E-04  0.295E-01    0.08       1.0  T
  12     -8.6973783 -0.178693E-03  0.256E-01    0.08       1.0  T
  13     -8.6975485 -0.170223E-03  0.531E-02    0.08       1.0  T
  14     -8.6975515 -0.300746E-05  0.160E-02    0.08       2.8  T
  15     -8.6975515  0.228229E-07  0.151E-02    0.08       3.0  T
  16     -8.6975516 -0.579991E-07  0.195E-03    0.08      22.9  T
  17     -8.6975516 -0.757541E-08  0.776E-04    0.08      57.7  T
  18     -8.6975516 -0.689333E-10  0.234E-04    0.08     191.2  T

   *** convergence criteria satisfied after 18 iterations ***

         #    Occupation            Energy/Eh            Energy/eV
      -------------------------------------------------------------
         1        2.0000           -0.7022394             -19.1089
       ...           ...                  ...                  ...
         3        2.0000           -0.6129505             -16.6792
         4        2.0000           -0.5432239             -14.7819
         5        2.0000           -0.5215047             -14.1909
         6        2.0000           -0.4961051             -13.4997
         7        2.0000           -0.4714091             -12.8277
         8        2.0000           -0.4120514             -11.2125
         9        0.8271           -0.3816001             -10.3839 (HOMO)
        10        0.1535           -0.3784908             -10.2993 (LUMO)
        11        0.0193           -0.3763830             -10.2419
        12                         -0.2554298              -6.9506
        13                          0.0090579               0.2465
        14                          0.0120372               0.3275
       ...                                ...                  ...
        17                          0.2900073               7.8915
      -------------------------------------------------------------
                  HL-Gap            0.0031093 Eh            0.0846 eV
             Fermi-level           -0.3884790 Eh          -10.5711 eV

 SCC (total)                   0 d,  0 h,  0 min,  0.004 sec
 SCC setup                      ...        0 min,  0.000 sec (  2.143%)
 Dispersion                     ...        0 min,  0.000 sec (  0.473%)
 integral evaluation            ...        0 min,  0.001 sec ( 24.282%)
 zeroth order Hamiltonian       ...        0 min,  0.000 sec (  0.430%)
 iterations                     ...        0 min,  0.002 sec ( 42.297%)
 molecular gradient             ...        0 min,  0.001 sec ( 26.849%)
 printout                       ...        0 min,  0.000 sec (  3.292%)

         :::::::::::::::::::::::::::::::::::::::::::::::::::::
         ::                     SUMMARY                     ::
         :::::::::::::::::::::::::::::::::::::::::::::::::::::
         :: total energy              -8.623485946914 Eh    ::
         :: gradient norm              0.200110289387 Eh/a0 ::
         :: HOMO-LUMO gap              0.084607322728 eV    ::
         ::.................................................::
         :: SCC energy                -8.697551566385 Eh    ::
         :: -> isotropic ES           -0.013033321749 Eh    ::
         :: -> anisotropic ES         -0.000234720592 Eh    ::
         :: -> anisotropic XC          0.006570776602 Eh    ::
         :: -> dispersion             -0.002253004339 Eh    ::
         :: repulsion energy           0.074065584643 Eh    ::
         :: add. restraining           0.000000000000 Eh    ::
         :::::::::::::::::::::::::::::::::::::::::::::::::::::

      ----------------------------------------------------------- 
     |                   =====================                   |
     |                        A N C O P T                        |
     |                   =====================                   |
     |               Approximate Normal Coordinate               |
     |                Rational Function Optimizer                |
      ----------------------------------------------------------- 

          ...................................................
          :                      SETUP                      :
          :.................................................:
          :   optimization level            normal          :
          :   max. optcycles                   200          :
          :   ANC micro-cycles                  20          :
          :   degrees of freedom                 9          :
          :.................................................:
          :   RF solver                   davidson          :
          :   write xtbopt.log                true          :
          :   linear?                        false          :
          :   energy convergence         0.5000000E-05 Eh   :
          :   grad. convergence          0.1000000E-02 Eh/α :
          :   maximium RF displ.         1.0000000          :
          :   Hlow (freq-cutoff)         0.1000000E-01      :
          :   Hmax (freq-cutoff)         5.0000000          :
          :   S6 in model hess.         20.0000000          :
          ...................................................

generating ANC from model Hessian ...
Using Lindh-Hessian (1995)
 Shifting diagonal of input Hessian by    0.0000000000000000     
 Lowest  eigenvalues of input Hessian
   -0.000000   -0.000000   -0.000000    0.000000    0.000000    0.000000
    0.018256    0.080006    0.091188    0.222136    0.682586    0.824985
    0.890647    0.905508    1.051679
 Highest eigenvalues
    0.222136    0.682586    0.824985    0.890647    0.905508    1.051679


........................................................................
.............................. CYCLE    1 ..............................
........................................................................
   1     -8.6975516 -0.869755E+01  0.900E-05    0.08       0.0  T
   2     -8.6975516  0.713563E-11  0.417E-05    0.08    1072.6  T
   3     -8.6975516  0.781295E-10  0.125E-04    0.08     359.2  T
     SCC iter.                  ...        0 min,  0.001 sec
     gradient                   ...        0 min,  0.001 sec
 * total energy  :    -8.6234859 Eh     change        0.3507541E-09 Eh
   gradient norm :     0.2001114 Eh/α   predicted     0.0000000E+00 (-100.00%)
   displ. norm   :     0.6792507 α      lambda       -0.9157410E-01
   maximum displ.:     0.5331343 α      in ANC's #1, #3, #7, ...

........................................................................
.............................. CYCLE    2 ..............................
........................................................................
   1     -8.7706974 -0.877070E+01  0.257E+00    1.72       0.0  T
   2     -8.7695585  0.113889E-02  0.159E+00    1.63       1.0  T
   3     -8.7436491  0.259094E-01  0.199E+00    1.77       1.0  T
   4     -8.7705293 -0.268802E-01  0.367E-01    1.76       1.0  T
   5     -8.7713903 -0.861002E-03  0.762E-02    1.69       1.0  T
   6     -8.7713962 -0.585080E-05  0.310E-02    1.70       1.4  T
   7     -8.7713984 -0.224122E-05  0.663E-03    1.70       6.7  T
   8     -8.7713984  0.161835E-07  0.219E-03    1.70      20.4  T
   9     -8.7713984 -0.215908E-07  0.147E-03    1.70      30.3  T
  10     -8.7713984 -0.114169E-07  0.134E-04    1.70     333.2  T
  11     -8.7713984 -0.439151E-10  0.622E-05    1.70     719.3  T
     SCC iter.                  ...        0 min,  0.001 sec
     gradient                   ...        0 min,  0.001 sec
 * total energy  :    -8.6855846 Eh     change       -0.6209863E-01 Eh
   gradient norm :     0.1653720 Eh/α   predicted    -0.6691235E-01 (   7.75%)
   displ. norm   :     0.5578659 α      lambda       -0.7535965E-01
   maximum displ.:     0.3367129 α      in ANC's #7, #3, #5, ...

........................................................................
.............................. CYCLE    3 ..............................
........................................................................
   1     -8.8911994 -0.889120E+01  0.227E+00    2.47       0.0  T
   2     -8.8910325  0.166969E-03  0.144E+00    2.41       1.0  T
   3     -8.8804330  0.105995E-01  0.136E+00    2.45       1.0  T
   4     -8.8918393 -0.114063E-01  0.138E-01    2.44       1.0  T
   5     -8.8918645 -0.252074E-04  0.749E-02    2.41       1.0  T
   6     -8.8918695 -0.497462E-05  0.188E-02    2.42       2.4  T
   7     -8.8918697 -0.234757E-06  0.695E-03    2.42       6.4  T
   8     -8.8918698 -0.128612E-06  0.177E-03    2.42      25.3  T
   9     -8.8918698  0.127911E-07  0.175E-03    2.42      25.6  T
  10     -8.8918698 -0.207751E-07  0.856E-05    2.42     522.3  T
  11     -8.8918698 -0.275868E-11  0.374E-05    2.42    1195.9  T
     SCC iter.                  ...        0 min,  0.001 sec
     gradient                   ...        0 min,  0.001 sec
 * total energy  :    -8.6963510 Eh     change       -0.1076642E-01 Eh
   gradient norm :     0.2108350 Eh/α   predicted    -0.4940632E-01 ( 358.89%)
   displ. norm   :     0.2966760 α      lambda       -0.4573177E-01
   maximum displ.:     0.2458284 α      in ANC's #1, #7, #4, ...

........................................................................
.............................. CYCLE    4 ..............................
........................................................................
   1     -8.8473182 -0.884732E+01  0.145E+00    2.43       0.0  T
   2     -8.8448451  0.247318E-02  0.124E+00    2.36       1.0  T
   3     -8.8471401 -0.229508E-02  0.768E-01    2.37       1.0  T
   4     -8.8490384 -0.189829E-02  0.201E-01    2.43       1.0  T
   5     -8.8492292 -0.190806E-03  0.510E-02    2.39       1.0  T
   6     -8.8492273  0.193680E-05  0.204E-02    2.39       2.2  T
   7     -8.8492301 -0.277044E-05  0.319E-03    2.39      14.0  T
   8     -8.8492301  0.515957E-09  0.155E-03    2.39      28.9  T
   9     -8.8492301 -0.577685E-09  0.135E-03    2.39      33.1  T
  10     -8.8492301 -0.114972E-07  0.881E-05    2.39     507.7  T
  11     -8.8492301 -0.158273E-11  0.284E-05    2.39    1575.0  T
     SCC iter.                  ...        0 min,  0.001 sec
     gradient                   ...        0 min,  0.001 sec
 * total energy  :    -8.7152048 Eh     change       -0.1885378E-01 Eh
   gradient norm :     0.0299676 Eh/α   predicted    -0.2487845E-01 (  31.95%)
   displ. norm   :     0.0570347 α      lambda       -0.1138425E-02
   maximum displ.:     0.0348297 α      in ANC's #3, #1, #5, ...

........................................................................
.............................. CYCLE    5 ..............................
........................................................................
   1     -8.8556918 -0.885569E+01  0.201E-01    2.44       0.0  T
   2     -8.8556856  0.620307E-05  0.130E-01    2.42       1.0  T
   3     -8.8556518  0.338078E-04  0.120E-01    2.43       1.0  T
   4     -8.8557059 -0.540446E-04  0.384E-02    2.43       1.2  T
   5     -8.8557147 -0.885091E-05  0.679E-03    2.42       6.6  T
   6     -8.8557148 -0.333095E-07  0.104E-03    2.42      42.8  T
   7     -8.8557148 -0.185906E-08  0.402E-04    2.42     111.4  T
   8     -8.8557148 -0.317593E-09  0.106E-04    2.42     423.5  T
     SCC iter.                  ...        0 min,  0.001 sec
     gradient                   ...        0 min,  0.001 sec
 * total energy  :    -8.7159745 Eh     change       -0.7697144E-03 Eh
   gradient norm :     0.0095304 Eh/α   predicted    -0.5710648E-03 ( -25.81%)
   displ. norm   :     0.0705293 α      lambda       -0.4511189E-03
   maximum displ.:     0.0484100 α      in ANC's #3, #1, #5, ...

........................................................................
.............................. CYCLE    6 ..............................
........................................................................
   1     -8.8578262 -0.885783E+01  0.189E-01    2.42       0.0  T
   2     -8.8578322 -0.597587E-05  0.111E-01    2.39       1.0  T
   3     -8.8578265  0.571876E-05  0.605E-02    2.42       1.0  T
   4     -8.8578357 -0.924535E-05  0.582E-03    2.40       7.7  T
   5     -8.8578353  0.354016E-06  0.791E-03    2.40       5.7  T
   6     -8.8578357 -0.389891E-06  0.215E-03    2.40      20.8  T
   7     -8.8578358 -0.201648E-07  0.937E-04    2.40      47.7  T
   8     -8.8578358 -0.339641E-08  0.147E-04    2.40     304.2  T
     SCC iter.                  ...        0 min,  0.001 sec
     gradient                   ...        0 min,  0.001 sec
 * total energy  :    -8.7162623 Eh     change       -0.2878023E-03 Eh
   gradient norm :     0.0111584 Eh/α   predicted    -0.2266803E-03 ( -21.24%)
   displ. norm   :     0.0424028 α      lambda       -0.2516751E-03
   maximum displ.:     0.0329209 α      in ANC's #5, #1, #3, ...

........................................................................
.............................. CYCLE    7 ..............................
........................................................................
   1     -8.8605697 -0.886057E+01  0.153E-01    2.38       0.0  T
   2     -8.8605741 -0.435697E-05  0.104E-01    2.36       1.0  T
   3     -8.8605669  0.710459E-05  0.720E-02    2.37       1.0  T
   4     -8.8605767 -0.975419E-05  0.392E-02    2.37       1.1  T
   5     -8.8605861 -0.944192E-05  0.490E-03    2.37       9.1  T
   6     -8.8605862 -0.132054E-07  0.147E-03    2.37      30.3  T
   7     -8.8605862 -0.245650E-08  0.335E-04    2.37     133.7  T
   8     -8.8605862  0.991987E-09  0.423E-04    2.37     105.7  T
     SCC iter.                  ...        0 min,  0.001 sec
     gradient                   ...        0 min,  0.001 sec
 * total energy  :    -8.7164089 Eh     change       -0.1465722E-03 Eh
   gradient norm :     0.0101930 Eh/α   predicted    -0.1260629E-03 ( -13.99%)
   displ. norm   :     0.0548433 α      lambda       -0.1657816E-03
   maximum displ.:     0.0378248 α      in ANC's #1, #3, #5, ...

........................................................................
.............................. CYCLE    8 ..............................
........................................................................
   1     -8.8580501 -0.885805E+01  0.132E-01    2.30       0.0  T
   2     -8.8580490  0.113451E-05  0.802E-02    2.28       1.0  T
   3     -8.8580162  0.327978E-04  0.808E-02    2.30       1.0  T
   4     -8.8580535 -0.373489E-04  0.155E-02    2.29       2.9  T
   5     -8.8580546 -0.101831E-05  0.354E-03    2.29      12.6  T
   6     -8.8580546  0.951226E-08  0.119E-03    2.29      37.5  T
   7     -8.8580546 -0.869872E-08  0.566E-04    2.29      79.0  T
   8     -8.8580546 -0.207236E-08  0.779E-05    2.29     574.2  T
     SCC iter.                  ...        0 min,  0.001 sec
     gradient                   ...        0 min,  0.001 sec
 * total energy  :    -8.7164847 Eh     change       -0.7586122E-04 Eh
   gradient norm :     0.0034578 Eh/α   predicted    -0.8313980E-04 (   9.59%)
   displ. norm   :     0.0120577 α      lambda       -0.2288527E-04
   maximum displ.:     0.0096237 α      in ANC's #3, #1, #4, ...

........................................................................
.............................. CYCLE    9 ..............................
........................................................................
   1     -8.8582024 -0.885820E+01  0.249E-02    2.29       0.0  T
   2     -8.8582024  0.757392E-07  0.170E-02    2.29       2.6  T
   3     -8.8582007  0.162547E-05  0.156E-02    2.29       2.9  T
   4     -8.8582025 -0.179014E-05  0.104E-03    2.29      43.0  T
   5     -8.8582025 -0.104390E-08  0.546E-04    2.29      81.9  T
   6     -8.8582025  0.122130E-09  0.392E-04    2.29     114.1  T
     SCC iter.                  ...        0 min,  0.001 sec
     gradient                   ...        0 min,  0.001 sec
 * total energy  :    -8.7164960 Eh     change       -0.1126634E-04 Eh
   gradient norm :     0.0005684 Eh/α   predicted    -0.1144353E-04 (   1.57%)
   displ. norm   :     0.0017457 α      lambda       -0.4541830E-06
   maximum displ.:     0.0013699 α      in ANC's #5, #1, #7, ...

........................................................................
.............................. CYCLE   10 ..............................
........................................................................
   1     -8.8579628 -0.885796E+01  0.569E-03    2.29       0.0  T
   2     -8.8579628  0.529078E-08  0.364E-03    2.29      12.3  T
   3     -8.8579628  0.741484E-07  0.380E-03    2.29      11.8  T
   4     -8.8579629 -0.872542E-07  0.489E-04    2.29      91.5  T
   5     -8.8579629 -0.100407E-09  0.390E-04    2.29     114.6  T
     SCC iter.                  ...        0 min,  0.000 sec
     gradient                   ...        0 min,  0.001 sec
 * total energy  :    -8.7164963 Eh     change       -0.2598098E-06 Eh
   gradient norm :     0.0001392 Eh/α   predicted    -0.2257778E-06 ( -13.10%)
   displ. norm   :     0.0003685 α      lambda       -0.2681165E-07
   maximum displ.:     0.0002853 α      in ANC's #5, #1, #9, ...

   *** GEOMETRY OPTIMIZATION CONVERGED AFTER 10 ITERATIONS ***

------------------------------------------------------------------------
 total energy gain   :        -0.0930103 Eh      -58.3648 kcal/mol
 total RMSD          :         0.4639712 a0        0.2455 Å
 total power (kW/mol):       -24.4198529 (step)-7425.9780 (real)
------------------------------------------------------------------------

 ANCopt (total)                0 d,  0 h,  0 min,  0.033 sec
 optimizer setup                ...        0 min,  0.000 sec (  0.228%)
 model hessian                  ...        0 min,  0.000 sec (  0.398%)
 ANC generation                 ...        0 min,  0.000 sec (  0.194%)
 coordinate transformation      ...        0 min,  0.000 sec (  0.087%)
 single point calculation       ...        0 min,  0.032 sec ( 96.270%)
 optimization log               ...        0 min,  0.000 sec (  0.908%)
 hessian update                 ...        0 min,  0.000 sec (  0.076%)
 rational function              ...        0 min,  0.000 sec (  0.778%)

================
 final structure:
================
5
 xtb: 6.2.2 (9d81278992624c895f80dd42a50cac0aa55982e2)
C         0.59102207536114   -0.00823022323454   -0.13554799691002
C        -0.47623117776237   -0.90626206383716   -0.28409707752522
C        -1.25536296404992    0.01669695924881    0.45316461683254
C        -0.44878551322500    0.92279104669010   -0.27546225869519
H         1.58935657967614   -0.02499671886721    0.24194271629789

 Bond Distances (Angstroems)
 ---------------------------
C1-C2=1.4027         C1-C3=1.9381         C1-C4=1.4027         C1-H5=1.0675         C2-C1=1.4027         C2-C3=1.4151         
C2-C4=1.8293         C3-C1=1.9381         C3-C2=1.4151         C3-C4=1.4151         C4-C1=1.4027         C4-C2=1.8293         
C4-C3=1.4151         H5-C1=1.0675         
 C  H  Rav=1.0675 sigma=0.0000  Rmin=1.0675  Rmax=1.0675     1
 C  C  Rav=1.5672 sigma=0.2261  Rmin=1.4027  Rmax=1.9381     6

 selected bond angles (degree)
 --------------------
C3-C1-C2= 46.81                C4-C1-C2= 81.39                C4-C1-C3= 46.81                H5-C1-C2=137.65                
H5-C1-C3=141.61                H5-C1-C4=137.65                C3-C2-C1= 86.91                C4-C2-C1= 49.30                
C4-C2-C3= 49.73                C2-C3-C1= 46.28                C4-C3-C1= 46.28                C4-C3-C2= 80.53                
C2-C4-C1= 49.30                C3-C4-C1= 86.91                C3-C4-C2= 49.73                

 selected dihedral angles (degree)
 ---------------------------------
C3-C2-C1-C4=323.84            C3-C2-C1-H5=124.47            C4-C2-C1-C3= 36.16            C4-C2-C1-H5=160.62            
C1-C3-C2-C4=324.11            C4-C3-C2-C1= 35.89            C2-C4-C1-C3=323.84            C2-C4-C1-H5=199.38            
C3-C4-C1-C2= 36.16            C3-C4-C1-H5=235.53            C1-C4-C2-C3=129.45            C3-C4-C2-C1=230.55            
C1-C4-C3-C2=324.11            C2-C4-C3-C1= 35.89            
           -------------------------------------------------
          |                Final Singlepoint                |
           -------------------------------------------------

          ...................................................
          :                      SETUP                      :
          :.................................................:
          :  # basis functions                  17          :
          :  # atomic orbitals                  17          :
          :  # shells                            9          :
          :  # electrons                        17          :
          :  max. iterations                   250          :
          :  Hamiltonian                  GFN2-xTB          :
          :  restarted?                      false          :
          :  GBSA solvation                  false          :
          :  PC potential                    false          :
          :  electronic temp.          300.0000000     K    :
          :  accuracy                    1.0000000          :
          :  -> integral cutoff          0.2500000E+02      :
          :  -> integral neglect         0.1000000E-07      :
          :  -> SCF convergence          0.1000000E-05 Eh   :
          :  -> wf. convergence          0.1000000E-03 e    :
          :  Broyden damping             0.4000000          :
          ...................................................

 iter      E             dE          RMSdq      gap      omega  full diag
   1     -8.8579629 -0.885796E+01  0.287E-04    2.29       0.0  T
   2     -8.8579629  0.134320E-08  0.427E-04    2.29     104.7  T
   3     -8.8579629 -0.157563E-08  0.165E-04    2.29     271.1  T

   *** convergence criteria satisfied after 3 iterations ***

         #    Occupation            Energy/Eh            Energy/eV
      -------------------------------------------------------------
         1        2.0000           -0.7180830             -19.5400
       ...           ...                  ...                  ...
         3        2.0000           -0.6034960             -16.4220
         4        2.0000           -0.5628402             -15.3157
         5        2.0000           -0.5099610             -13.8767
         6        2.0000           -0.5073316             -13.8052
         7        2.0000           -0.4462600             -12.1434
         8        2.0000           -0.4204194             -11.4402
         9        1.0000           -0.3905462             -10.6273 (HOMO)
        10                         -0.3065106              -8.3406 (LUMO)
        11                         -0.2688125              -7.3148
        12                         -0.2459368              -6.6923
        13                          0.1029742               2.8021
        14                          0.1186964               3.2299
       ...                                ...                  ...
        17                          0.6430863              17.4993
      -------------------------------------------------------------
                  HL-Gap            0.0840356 Eh            2.2867 eV
             Fermi-level           -0.3770056 Eh          -10.2588 eV

 SCC (total)                   0 d,  0 h,  0 min,  0.003 sec
 SCC setup                      ...        0 min,  0.000 sec (  1.711%)
 Dispersion                     ...        0 min,  0.000 sec (  0.488%)
 integral evaluation            ...        0 min,  0.001 sec ( 37.864%)
 zeroth order Hamiltonian       ...        0 min,  0.000 sec (  0.488%)
 iterations                     ...        0 min,  0.001 sec ( 17.444%)
 molecular gradient             ...        0 min,  0.001 sec ( 39.038%)
 printout                       ...        0 min,  0.000 sec (  2.629%)

         :::::::::::::::::::::::::::::::::::::::::::::::::::::
         ::                     SUMMARY                     ::
         :::::::::::::::::::::::::::::::::::::::::::::::::::::
         :: total energy              -8.716496247813 Eh    ::
         :: gradient norm              0.000139349783 Eh/a0 ::
         :: HOMO-LUMO gap              2.286726027689 eV    ::
         ::.................................................::
         :: SCC energy                -8.857962855559 Eh    ::
         :: -> isotropic ES           -0.008347737178 Eh    ::
         :: -> anisotropic ES         -0.000023067464 Eh    ::
         :: -> anisotropic XC          0.007109489618 Eh    ::
         :: -> dispersion             -0.002017042276 Eh    ::
         :: repulsion energy           0.141466584747 Eh    ::
         :: add. restraining           0.000000000000 Eh    ::
         :::::::::::::::::::::::::::::::::::::::::::::::::::::

           ------------------------------------------------- 
          |                Numerical Hessian                |
           ------------------------------------------------- 
step length          :   0.00500
SCC accuracy         :   0.30000
Hessian scale factor :   1.00000
frozen atoms in %    :   0.00000    0
RMS gradient         :   0.00014
estimated CPU  time      0.00 min
estimated wall time      0.00 min

writing file <hessian>.

 projected vibrational frequencies (cm-1)
eigval :       -0.00    -0.00     0.00     0.00     0.00     0.00
eigval :      522.82   625.55   744.53   750.06   914.66  1055.57
eigval :     1273.41  1462.47  3184.31
           -------------------------------------------------
          |                Property Printout                |
           -------------------------------------------------

    * Orbital Energies and Occupations

         #    Occupation            Energy/Eh            Energy/eV
      -------------------------------------------------------------
         1        2.0000           -0.7180829             -19.5400
         2        2.0000           -0.6232557             -16.9596
         3        2.0000           -0.6034959             -16.4220
         4        2.0000           -0.5628403             -15.3157
         5        2.0000           -0.5099609             -13.8767
         6        2.0000           -0.5073314             -13.8052
         7        2.0000           -0.4462599             -12.1434
         8        2.0000           -0.4204193             -11.4402
         9        1.0000           -0.3905461             -10.6273 (HOMO)
        10                         -0.3065103              -8.3406 (LUMO)
        11                         -0.2688124              -7.3148
        12                         -0.2459366              -6.6923
        13                          0.1029741               2.8021
        14                          0.1186966               3.2299
        15                          0.1798750               4.8946
        16                          0.2700522               7.3485
        17                          0.6430864              17.4993
      -------------------------------------------------------------
                  HL-Gap            0.0840358 Eh            2.2867 eV
             Fermi-level           -0.3770055 Eh          -10.2588 eV

     #   Z        covCN         q      C6AA      α(0)
     1   6 C      3.504     0.060    21.060     6.802
     2   6 C      2.762    -0.039    28.950     8.811
     3   6 C      2.576    -0.061    29.549     8.887
     4   6 C      2.762    -0.039    28.950     8.811
     5   1 H      0.927     0.079     1.990     2.206

 Mol. C6AA /au·bohr⁶  :        492.150102
 Mol. C8AA /au·bohr⁸  :      13601.957108
 Mol. α(0) /au        :         35.517306


Wiberg/Mayer (AO) data.
largest (>0.10) Wiberg bond orders for each atom
          total WBO             WBO to atom ...
     1  C   3.857        C    2 1.205    C    4 1.205    H    5 0.955    C    3 0.492
     2  C   2.950        C    1 1.205    C    3 1.182    C    4 0.558
     3  C   2.886        C    2 1.182    C    4 1.182    C    1 0.492
     4  C   2.950        C    1 1.205    C    3 1.182    C    2 0.558
     5  H   0.994        C    1 0.955

MOs/occ written to file <molden.input>


molecular dipole:
                 x           y           z       tot (Debye)
 q only:        0.518      -0.008       0.009
   full:        0.957      -0.014      -0.110       2.448
molecular quadrupole (traceless):
                xx          xy          yy          xz          yz          zz
 q only:        0.523      -0.015      -0.402       0.269      -0.005      -0.121
  q+dip:        1.341      -0.051      -1.522       1.756      -0.034       0.181
   full:        0.712      -0.051      -1.953       2.321      -0.050       1.241

           -------------------------------------------------
          |                Geometry Summary                 |
           -------------------------------------------------

      molecular mass/u    :       49.0508844
   center of mass at/Å    :       -0.3565152       0.0056086      -0.0542699
  moments of inertia/u·Å² :        0.2328957E+02   0.2906064E+02   0.4596215E+02
rotational constants/cm⁻¹ :        0.7238274E+00   0.5800848E+00   0.3667721E+00

 * 3 selected distances

     #   Z        #   Z                                     value/Å
     1   6 C      2   6 C                                 1.4026965
     1   6 C      4   6 C                                 1.4027033 (max)
     1   6 C      5   1 H                                 1.0674512 (min)

 * 2 distinct bonds (by element types)

   Z      Z             #   av. dist./Å        max./Å        min./Å
   1 H    6 C           1     1.0674512     1.0674512     1.0674512
   6 C    6 C           2     1.4026999     1.4027033     1.4026965

           -------------------------------------------------
          |               Frequency Printout                |
           -------------------------------------------------
 projected vibrational frequencies (cm-1)
eigval :       -0.00    -0.00     0.00     0.00     0.00     0.00
eigval :      522.82   625.55   744.53   750.06   914.66  1055.57
eigval :     1273.41  1462.47  3184.31
 reduced masses (amu)
   1: 12.00   2: 12.00   3: 11.69   4: 11.15   5: 11.65   6: 10.34   7:  9.96   8:  9.76
   9: 11.78  10:  7.20  11:  3.77  12: 10.78  13: 11.50  14: 11.62  15:  1.96
 IR intensities (amu)
   1:  0.13   2:  0.10   3:  0.08   4:  0.08   5:  0.03   6:  0.19   7:  0.07   8:  0.38
   9:  0.76  10:  0.24  11:  0.62  12:  1.61  13:  0.77  14:  0.21  15:  0.08
 Raman intensities (amu)
   1:  0.00   2:  0.00   3:  0.00   4:  0.00   5:  0.00   6:  0.00   7:  0.00   8:  0.00
   9:  0.00  10:  0.00  11:  0.00  12:  0.00  13:  0.00  14:  0.00  15:  0.00
Molecule has the following symmetry elements: (sigma) 
It seems to be the Cs point group
 output can be read by thermo (or use thermo option).
 writing <g98.out> molden fake output.
 recommended (thermochemical) frequency scaling factor: 1.0
           -------------------------------------------------
          |             Thermodynamic Functions             |
           -------------------------------------------------

cs  symmetry found (for desy threshold:  0.10E+00) used in thermo

          ...................................................
          :                      SETUP                      :
          :.................................................:
          :  # frequencies                           9      :
          :  # imaginary freq.                       0      :
          :  linear?                             false      :
          :  only rotor calc.                    false      :
          :  symmetry                               cs      :
          :  rotational number                       1      :
          :  scaling factor                  1.0000000      :
          :  rotor cutoff                   50.0000000 cm⁻¹ :
          :  imag. cutoff                  -20.0000000 cm⁻¹ :
          :.................................................:

    mode    ω/cm⁻¹     T·S(HO)/kcal·mol⁻¹    T·S(FR)/kcal·mol⁻¹   T·S(vib)
   ------------------------------------------------------------------------
   ------------------------------------------------------------------------

   temp. (K)  partition function   enthalpy   heat capacity  entropy
                                   cal/mol     cal/K/mol   cal/K/mol   J/K/mol
 298.15  VIB   1.23                  403.663      4.708      1.772
         ROT  0.135E+05              888.752      2.981     21.877
         INT  0.166E+05             1292.415      7.689     23.648
         TR   0.332E+27             1481.254      4.968     37.578
         TOT                        2773.6694    12.6573    61.2260   256.1694

   temp. (K)  partition function   enthalpy   heat capacity  entropy
                                   cal/mol     cal/K/mol   cal/K/mol   J/K/mol
 120.00  VIB   1.00                    4.433      0.257      0.042
         ROT  0.344E+04              357.707      2.981     19.164
         INT  0.345E+04              362.139      3.238     19.206
         TR   0.849E+26              596.178      4.968     33.058
         TOT                         958.3175     8.2057    52.2645   218.6747

   temp. (K)  partition function   enthalpy   heat capacity  entropy
                                   cal/mol     cal/K/mol   cal/K/mol   J/K/mol
 100.00  VIB   1.00                    1.127      0.091      0.013
         ROT  0.262E+04              298.089      2.981     18.620
         INT  0.262E+04              299.216      3.072     18.633
         TR   0.646E+26              496.815      4.968     32.153
         TOT                         796.0311     8.0404    50.7860   212.4885

   temp. (K)  partition function   enthalpy   heat capacity  entropy
                                   cal/mol     cal/K/mol   cal/K/mol   J/K/mol
  80.00  VIB   1.00                    0.153      0.019      0.002
         ROT  0.187E+04              238.471      2.981     17.955
         INT  0.187E+04              238.624      3.000     17.957
         TR   0.462E+26              397.452      4.968     31.045
         TOT                         636.0762     7.9679    49.0021   205.0249

   temp. (K)  partition function   enthalpy   heat capacity  entropy
                                   cal/mol     cal/K/mol   cal/K/mol   J/K/mol
  60.00  VIB   1.00                    0.006      0.001      0.000
         ROT  0.122E+04              178.853      2.981     17.098
         INT  0.122E+04              178.859      2.982     17.098
         TR   0.300E+26              298.089      4.968     29.616
         TOT                         476.9484     7.9503    46.7140   195.4512

   temp. (K)  partition function   enthalpy   heat capacity  entropy
                                   cal/mol     cal/K/mol   cal/K/mol   J/K/mol
  40.00  VIB   1.00                    0.000      0.000     -0.000
         ROT   662.                  119.236      2.981     15.889
         INT   662.                  119.236      2.981     15.889
         TR   0.163E+26              198.726      4.968     27.603
         TOT                         317.9616     7.9490    43.4917   181.9693

   temp. (K)  partition function   enthalpy   heat capacity  entropy
                                   cal/mol     cal/K/mol   cal/K/mol   J/K/mol
  20.00  VIB   1.00                    0.000      0.000     -0.000
         ROT   234.                   59.618      2.981     13.823
         INT   234.                   59.618      2.981     13.822
         TR   0.577E+25               99.363      4.968     24.161
         TOT                         158.9808     7.9490    37.9834   158.9226

   temp. (K)  partition function   enthalpy   heat capacity  entropy
                                   cal/mol     cal/K/mol   cal/K/mol   J/K/mol
  10.00  VIB   1.00                    0.000      0.000     -0.000
         ROT   82.8                   29.809      2.981     11.757
         INT   82.8                   29.809      2.981     11.756
         TR   0.204E+25               49.681      4.968     20.719
         TOT                          79.4904     7.9490    32.4751   135.8759

       T/K    H(0)-H(T)+PV         H(T)/Eh          T*S/Eh         G(T)/Eh
   ------------------------------------------------------------------------
    298.15    0.442012E-02    0.284169E-01    0.290904E-01   -0.673498E-03
    120.00    0.152718E-02    0.255240E-01    0.999466E-02    0.155293E-01
    100.00    0.126856E-02    0.252654E-01    0.809326E-02    0.171721E-01
     80.00    0.101365E-02    0.250105E-01    0.624719E-02    0.187633E-01
     60.00    0.760066E-03    0.247569E-01    0.446661E-02    0.202903E-01
     40.00    0.506704E-03    0.245035E-01    0.277234E-02    0.217312E-01
     20.00    0.253352E-03    0.242502E-01    0.121061E-02    0.230396E-01
     10.00    0.126676E-03    0.241235E-01    0.517524E-03    0.236060E-01 (used)
   ------------------------------------------------------------------------

         :::::::::::::::::::::::::::::::::::::::::::::::::::::
         ::                  THERMODYNAMIC                  ::
         :::::::::::::::::::::::::::::::::::::::::::::::::::::
         :: total free energy          -8.692890284332 Eh   ::
         ::.................................................::
         :: total energy               -8.716496246707 Eh   ::
         :: zero point energy           0.023996810230 Eh   ::
         :: G(RRHO) w/o ZPVE           -0.000390847855 Eh   ::
         :: G(RRHO) contrib.            0.023605962375 Eh   ::
         :::::::::::::::::::::::::::::::::::::::::::::::::::::

optimized geometry written to: xtbopt.xyz


           -------------------------------------------------
          | TOTAL ENERGY               -8.716496246707 Eh   |
          | TOTAL ENTHALPY             -8.692372760462 Eh   |
          | TOTAL FREE ENERGY          -8.692890284332 Eh   |
          | GRADIENT NORM               0.000139146704 Eh/α |
          | HOMO-LUMO GAP               2.286729961983 eV   |
           -------------------------------------------------

------------------------------------------------------------------------
 * finished run on 2020/05/12 at 11:45:10.893     
------------------------------------------------------------------------
 total:
 * wall-time:     0 d,  0 h,  0 min,  0.146 sec
 *  cpu-time:     0 d,  0 h,  0 min,  0.146 sec
 * ratio c/w:     0.999 speedup
 SCF:
 * wall-time:     0 d,  0 h,  0 min,  0.005 sec
 *  cpu-time:     0 d,  0 h,  0 min,  0.005 sec
 * ratio c/w:     0.997 speedup
 ANC optimizer:
 * wall-time:     0 d,  0 h,  0 min,  0.037 sec
 *  cpu-time:     0 d,  0 h,  0 min,  0.036 sec
 * ratio c/w:     0.999 speedup
 numerical hessian:
 * wall-time:     0 d,  0 h,  0 min,  0.087 sec
 *  cpu-time:     0 d,  0 h,  0 min,  0.087 sec
 * ratio c/w:     0.999 speedup

