      -----------------------------------------------------------      
     |                   =====================                   |     
     |                           x T B                           |     
     |                   =====================                   |     
     |                         S. Grimme                         |     
     |          Mulliken Center for Theoretical Chemistry        |     
     |                    University of Bonn                     |     
      -----------------------------------------------------------      

   * xtb version 6.2.2 (9d81278992624c895f80dd42a50cac0aa55982e2) compiled by '@Darwin' on 04/03/2020

   xtb is free software: you can redistribute it and/or modify it under
   the terms of the GNU Lesser General Public License as published by
   the Free Software Foundation, either version 3 of the License, or
   (at your option) any later version.
   
   xtb is distributed in the hope that it will be useful,
   but WITHOUT ANY WARRANTY; without even the implied warranty of
   MERCHANTABILITY or FITNESS FOR A PARTICULAR PURPOSE.  See the
   GNU Lesser General Public License for more details.
   
   Cite this work as:
   * S. Grimme, C. Bannwarth, P. Shushkov, J. Chem. Theory Comput., 2017,
     13, 1989-2009. DOI: 10.1021/acs.jctc.7b00118
   * C. Bannwarth, S. Ehlert and S. Grimme., J. Chem. Theory Comput., 2019,
     15, 1652-1671. DOI: 10.1021/acs.jctc.8b01176
   * P. Pracht, E. Caldeweyher, S. Ehlert, S. Grimme, ChemRxiv, 2019, preprint.
     DOI: 10.26434/chemrxiv.8326202.v1
   
   for DFT-D4:
   * E. Caldeweyher, C. Bannwarth and S. Grimme, J. Chem. Phys., 2017,
     147, 034112. DOI: 10.1063/1.4993215
   * E. Caldeweyher, S. Ehlert, A. Hansen, H. Neugebauer, S. Spicher,
     C. Bannwarth and S. Grimme, J. Chem. Phys., 2019, 150, 154122.
     DOI: 10.1063/1.5090222
   
   for sTDA-xTB:
   * S. Grimme and C. Bannwarth, J. Chem. Phys., 2016, 145, 054103.
     DOI: 10.1063/1.4959605
   
   in the mass-spec context:
   * V. Asgeirsson, C. Bauer and S. Grimme, Chem. Sci., 2017, 8, 4879.
     DOI: 10.1039/c7sc00601b
   
   for metadynamics refer to:
   * S. Grimme, J. Chem. Theory Comput., 2019, 155, 2847-2862
     DOI: 10.1021/acs.jctc.9b00143
   
   with help from (in alphabetical order)
   C. Bannwarth, F. Bohle, G. Brandenburg, E. Caldeweyher, M. Checinski,
   S. Dohm, S. Ehlert, S. Ehrlich, F. März, H. Neugebauer, J. Pisarek,
   P. Pracht, P. Shushkov, and S. Spicher.
   
 * started run on 2020/05/12 at 11:44:25.643     

           -------------------------------------------------
          |                Calculation Setup                |
           -------------------------------------------------

          program call               : xtb --input H2C3_0_S_0.input H2C3_0_S_0.xyz --ohess --molden --namespace H2C3_0_S_0 output.out
          calculation namespace      : H2C3_0_S_0
          coordinate file            : H2C3_0_S_0.xyz
          number of atoms            :                     5
          number of electrons        :                    14
          charge                     :                     0
          spin                       :                   0.0
          first test random number   :      0.29502138137530

   ID    Z sym.   atoms
    1    6 C      1-3
    2    1 H      4, 5

           -------------------------------------------------
          |                 G F N 2 - x T B                 |
           -------------------------------------------------

        Reference                      10.1021/acs.jctc.8b01176
      * Hamiltonian:
        H0-scaling (s, p, d)           1.850000    2.230000    2.230000
        zeta-weighting                 0.500000
      * Dispersion:
        s8                             2.700000
        a1                             0.520000
        a2                             5.000000
        s9                             5.000000
      * Repulsion:
        kExp                           1.500000    1.000000
        rExp                           1.000000
      * Coulomb:
        alpha                          2.000000
        third order                    shell-resolved
        anisotropic                    true
        a3                             3.000000
        a5                             4.000000
        cn-shift                       1.200000
        cn-exp                         4.000000
        max-rad                        5.000000


          ...................................................
          :                      SETUP                      :
          :.................................................:
          :  # basis functions                  14          :
          :  # atomic orbitals                  14          :
          :  # shells                            8          :
          :  # electrons                        14          :
          :  max. iterations                   250          :
          :  Hamiltonian                  GFN2-xTB          :
          :  restarted?                      false          :
          :  GBSA solvation                  false          :
          :  PC potential                    false          :
          :  electronic temp.          300.0000000     K    :
          :  accuracy                    1.0000000          :
          :  -> integral cutoff          0.2500000E+02      :
          :  -> integral neglect         0.1000000E-07      :
          :  -> SCF convergence          0.1000000E-05 Eh   :
          :  -> wf. convergence          0.1000000E-03 e    :
          :  Broyden damping             0.4000000          :
          ...................................................

 iter      E             dE          RMSdq      gap      omega  full diag
   1     -7.0532732 -0.705327E+01  0.112E+01    0.12       0.0  T
   2     -7.0670542 -0.137810E-01  0.522E+00    0.01       1.0  T
   3     -7.0678356 -0.781393E-03  0.328E+00    0.03       1.0  T
   4     -7.0673270  0.508523E-03  0.213E+00    0.02       1.0  T
   5     -7.0672074  0.119618E-03  0.107E+00    0.02       1.0  T
   6     -7.0350760  0.321315E-01  0.226E+00    0.03       1.0  T
   7     -7.0690086 -0.339326E-01  0.135E+00    0.03       1.0  T
   8     -7.0699184 -0.909815E-03  0.226E-01    0.01       1.0  T
   9     -7.0699277 -0.924786E-05  0.121E-01    0.01       1.0  T
  10     -7.0699331 -0.546875E-05  0.720E-02    0.01       1.0  T
  11     -7.0699349 -0.178901E-05  0.210E-02    0.01       2.1  T
  12     -7.0699350 -0.954898E-07  0.100E-02    0.01       4.5  T
  13     -7.0699351 -0.595522E-07  0.103E-03    0.01      43.6  T
  14     -7.0699351 -0.228063E-08  0.186E-04    0.01     240.9  T
  15     -7.0699351 -0.107647E-10  0.262E-05    0.01    1708.4  T

   *** convergence criteria satisfied after 15 iterations ***

         #    Occupation            Energy/Eh            Energy/eV
      -------------------------------------------------------------
         1        2.0000           -0.6723579             -18.2958
         2        2.0000           -0.6216635             -16.9163
         3        2.0000           -0.5783030             -15.7364
         4        2.0000           -0.5385982             -14.6560
         5        2.0000           -0.4732776             -12.8785
         6        2.0000           -0.4479641             -12.1897
         7        1.1202           -0.3654656              -9.9448 (HOMO)
         8        0.8798           -0.3650068              -9.9323 (LUMO)
         9                         -0.3479404              -9.4679
        10                         -0.3404534              -9.2642
        11                          0.0895748               2.4375
        12                          0.1096168               2.9828
       ...                                ...                  ...
        14                          0.1610218               4.3816
      -------------------------------------------------------------
                  HL-Gap            0.0004589 Eh            0.0125 eV
             Fermi-level           -0.3652362 Eh           -9.9386 eV

 SCC (total)                   0 d,  0 h,  0 min,  0.003 sec
 SCC setup                      ...        0 min,  0.000 sec (  3.583%)
 Dispersion                     ...        0 min,  0.000 sec (  0.500%)
 integral evaluation            ...        0 min,  0.001 sec ( 24.935%)
 zeroth order Hamiltonian       ...        0 min,  0.000 sec (  0.543%)
 iterations                     ...        0 min,  0.001 sec ( 43.204%)
 molecular gradient             ...        0 min,  0.001 sec ( 25.185%)
 printout                       ...        0 min,  0.000 sec (  1.766%)

         :::::::::::::::::::::::::::::::::::::::::::::::::::::
         ::                     SUMMARY                     ::
         :::::::::::::::::::::::::::::::::::::::::::::::::::::
         :: total energy              -7.011118525839 Eh    ::
         :: gradient norm              0.074952861615 Eh/a0 ::
         :: HOMO-LUMO gap              0.012486088147 eV    ::
         ::.................................................::
         :: SCC energy                -7.069935066305 Eh    ::
         :: -> isotropic ES           -0.031238531772 Eh    ::
         :: -> anisotropic ES         -0.001511267179 Eh    ::
         :: -> anisotropic XC          0.007464794496 Eh    ::
         :: -> dispersion             -0.001561894478 Eh    ::
         :: repulsion energy           0.058816484276 Eh    ::
         :: add. restraining           0.000000000000 Eh    ::
         :::::::::::::::::::::::::::::::::::::::::::::::::::::

      ----------------------------------------------------------- 
     |                   =====================                   |
     |                        A N C O P T                        |
     |                   =====================                   |
     |               Approximate Normal Coordinate               |
     |                Rational Function Optimizer                |
      ----------------------------------------------------------- 

          ...................................................
          :                      SETUP                      :
          :.................................................:
          :   optimization level            normal          :
          :   max. optcycles                   200          :
          :   ANC micro-cycles                  20          :
          :   degrees of freedom                 9          :
          :.................................................:
          :   RF solver                   davidson          :
          :   write xtbopt.log                true          :
          :   linear?                        false          :
          :   energy convergence         0.5000000E-05 Eh   :
          :   grad. convergence          0.1000000E-02 Eh/α :
          :   maximium RF displ.         1.0000000          :
          :   Hlow (freq-cutoff)         0.1000000E-01      :
          :   Hmax (freq-cutoff)         5.0000000          :
          :   S6 in model hess.         20.0000000          :
          ...................................................

generating ANC from model Hessian ...
Using Lindh-Hessian (1995)
 Shifting diagonal of input Hessian by    0.0000000000000000     
 Lowest  eigenvalues of input Hessian
   -0.000000   -0.000000   -0.000000    0.000000    0.000000    0.000000
    0.064255    0.072760    0.081950    0.103926    0.108130    0.412356
    1.004706    1.024922    1.039179
 Highest eigenvalues
    0.103926    0.108130    0.412356    1.004706    1.024922    1.039179


........................................................................
.............................. CYCLE    1 ..............................
........................................................................
   1     -7.0699351 -0.706994E+01  0.906E-06    0.01       0.0  T
   2     -7.0699351  0.407763E-11  0.226E-05    0.01    1980.5  T
   3     -7.0699351  0.294653E-10  0.602E-05    0.01     742.9  T
     SCC iter.                  ...        0 min,  0.000 sec
     gradient                   ...        0 min,  0.001 sec
 * total energy  :    -7.0111185 Eh     change        0.1265459E-09 Eh
   gradient norm :     0.0749526 Eh/α   predicted     0.0000000E+00 (-100.00%)
   displ. norm   :     0.3161085 α      lambda       -0.1617984E-01
   maximum displ.:     0.2601293 α      in ANC's #1, #6, #4, ...

........................................................................
.............................. CYCLE    2 ..............................
........................................................................
   1     -7.1036962 -0.710370E+01  0.557E+00    0.40       0.0  T
   2     -7.1037746 -0.783704E-04  0.331E+00    0.32       1.0  T
   3     -7.1037970 -0.224566E-04  0.238E-01    0.20       1.0  T
   4     -7.1038491 -0.521028E-04  0.574E-02    0.21       1.0  T
   5     -7.1038489  0.268941E-06  0.470E-02    0.21       1.0  T
   6     -7.1038352  0.136186E-04  0.436E-02    0.21       1.0  T
   7     -7.1038493 -0.140919E-04  0.593E-03    0.21       7.5  T
   8     -7.1038494 -0.407100E-07  0.234E-03    0.21      19.1  T
   9     -7.1038494 -0.227931E-09  0.483E-04    0.21      92.6  T
  10     -7.1038494 -0.352056E-10  0.164E-05    0.21    2724.3  T
     SCC iter.                  ...        0 min,  0.001 sec
     gradient                   ...        0 min,  0.001 sec
 * total energy  :    -7.0307298 Eh     change       -0.1961129E-01 Eh
   gradient norm :     0.0764344 Eh/α   predicted    -0.8898300E-02 ( -54.63%)
   displ. norm   :     0.6105700 α      lambda       -0.4313077E-01
   maximum displ.:     0.5871752 α      in ANC's #1, #4, #6, ...

........................................................................
.............................. CYCLE    3 ..............................
........................................................................
   1     -7.1473115 -0.714731E+01  0.328E+00    0.88       0.0  T
   2     -7.1476723 -0.360780E-03  0.185E+00    0.87       1.0  T
   3     -7.1471249  0.547393E-03  0.435E-01    0.83       1.0  T
   4     -7.1478235 -0.698657E-03  0.386E-02    0.85       1.2  T
   5     -7.1478244 -0.860633E-06  0.122E-02    0.85       3.7  T
   6     -7.1478245 -0.721916E-07  0.283E-03    0.85      15.8  T
   7     -7.1478245 -0.883752E-08  0.114E-03    0.85      39.2  T
   8     -7.1478245  0.992334E-08  0.134E-03    0.85      33.4  T
   9     -7.1478245 -0.111566E-07  0.259E-05    0.85    1724.4  T
  10     -7.1478245 -0.686562E-12  0.119E-05    0.85    3764.0  T
     SCC iter.                  ...        0 min,  0.001 sec
     gradient                   ...        0 min,  0.001 sec
 * total energy  :    -7.0765692 Eh     change       -0.4583937E-01 Eh
   gradient norm :     0.0982440 Eh/α   predicted    -0.2960486E-01 ( -35.42%)
   displ. norm   :     0.5780418 α      lambda       -0.4576281E-01
   maximum displ.:     0.5320916 α      in ANC's #1, #4, #6, ...

........................................................................
.............................. CYCLE    4 ..............................
........................................................................
   1     -7.1788873 -0.717889E+01  0.414E+00    0.29       0.0  T
   2     -7.1800219 -0.113454E-02  0.224E+00    0.33       1.0  T
   3     -7.1748446  0.517731E-02  0.141E+00    0.21       1.0  T
   4     -7.1820137 -0.716910E-02  0.103E-01    0.26       1.0  T
   5     -7.1820136  0.739829E-07  0.746E-02    0.26       1.0  T
   6     -7.1820176 -0.403120E-05  0.176E-02    0.26       2.5  T
   7     -7.1820177 -0.793937E-07  0.393E-03    0.26      11.4  T
   8     -7.1820177 -0.740147E-08  0.395E-04    0.26     113.1  T
   9     -7.1820177 -0.716192E-09  0.415E-05    0.26    1077.2  T
     SCC iter.                  ...        0 min,  0.001 sec
     gradient                   ...        0 min,  0.001 sec
 * total energy  :    -7.1026063 Eh     change       -0.2603711E-01 Eh
   gradient norm :     0.0583207 Eh/α   predicted    -0.3052682E-01 (  17.24%)
   displ. norm   :     0.1687187 α      lambda       -0.7718028E-02
   maximum displ.:     0.1290506 α      in ANC's #1, #4, #6, ...

........................................................................
.............................. CYCLE    5 ..............................
........................................................................
   1     -7.1962042 -0.719620E+01  0.120E+00    0.61       0.0  T
   2     -7.1974285 -0.122432E-02  0.621E-01    0.53       1.0  T
   3     -7.1979577 -0.529244E-03  0.417E-01    0.57       1.0  T
   4     -7.1981724 -0.214647E-03  0.242E-02    0.56       1.8  T
   5     -7.1981729 -0.495658E-06  0.112E-02    0.56       4.0  T
   6     -7.1981729 -0.312813E-07  0.287E-03    0.56      15.6  T
   7     -7.1981729 -0.232388E-07  0.575E-04    0.56      77.8  T
   8     -7.1981729 -0.102401E-09  0.235E-05    0.56    1904.2  T
     SCC iter.                  ...        0 min,  0.000 sec
     gradient                   ...        0 min,  0.001 sec
 * total energy  :    -7.1054752 Eh     change       -0.2868883E-02 Eh
   gradient norm :     0.0149946 Eh/α   predicted    -0.3968863E-02 (  38.34%)
   displ. norm   :     0.0697238 α      lambda       -0.9455226E-03
   maximum displ.:     0.0687163 α      in ANC's #1, #4, #8, ...

........................................................................
.............................. CYCLE    6 ..............................
........................................................................
   1     -7.1980878 -0.719809E+01  0.435E-01    0.42       0.0  T
   2     -7.1981220 -0.341689E-04  0.232E-01    0.43       1.0  T
   3     -7.1980928  0.292090E-04  0.141E-01    0.41       1.0  T
   4     -7.1981467 -0.538601E-04  0.797E-03    0.42       5.6  T
   5     -7.1981467 -0.320135E-07  0.260E-03    0.42      17.2  T
   6     -7.1981467 -0.419293E-08  0.445E-04    0.42     100.4  T
   7     -7.1981467 -0.154246E-09  0.195E-04    0.42     229.1  T
     SCC iter.                  ...        0 min,  0.000 sec
     gradient                   ...        0 min,  0.001 sec
 * total energy  :    -7.1059196 Eh     change       -0.4444578E-03 Eh
   gradient norm :     0.0062936 Eh/α   predicted    -0.4750613E-03 (   6.89%)
   displ. norm   :     0.0268134 α      lambda       -0.1326252E-03
   maximum displ.:     0.0208121 α      in ANC's #4, #6, #1, ...

........................................................................
.............................. CYCLE    7 ..............................
........................................................................
   1     -7.1954322 -0.719543E+01  0.108E-01    0.44       0.0  T
   2     -7.1954350 -0.277167E-05  0.672E-02    0.45       1.0  T
   3     -7.1954324  0.263918E-05  0.345E-02    0.45       1.3  T
   4     -7.1954366 -0.420262E-05  0.563E-03    0.45       7.9  T
   5     -7.1954366 -0.141646E-07  0.225E-03    0.45      19.9  T
   6     -7.1954366 -0.212163E-08  0.124E-04    0.45     359.5  T
   7     -7.1954366 -0.321876E-11  0.630E-05    0.45     709.3  T
     SCC iter.                  ...        0 min,  0.000 sec
     gradient                   ...        0 min,  0.001 sec
 * total energy  :    -7.1059629 Eh     change       -0.4325697E-04 Eh
   gradient norm :     0.0052581 Eh/α   predicted    -0.6636074E-04 (  53.41%)
   displ. norm   :     0.0069668 α      lambda       -0.3010089E-04
   maximum displ.:     0.0043161 α      in ANC's #6, #8, #4, ...

........................................................................
.............................. CYCLE    8 ..............................
........................................................................
   1     -7.1964582 -0.719646E+01  0.396E-02    0.45       0.0  T
   2     -7.1964610 -0.278143E-05  0.249E-02    0.44       1.8  T
   3     -7.1964629 -0.184602E-05  0.133E-02    0.45       3.4  T
   4     -7.1964630 -0.945404E-07  0.285E-03    0.44      15.7  T
   5     -7.1964630 -0.408871E-08  0.899E-04    0.44      49.7  T
   6     -7.1964630 -0.933458E-10  0.525E-05    0.44     852.4  T
     SCC iter.                  ...        0 min,  0.000 sec
     gradient                   ...        0 min,  0.001 sec
 * total energy  :    -7.1059791 Eh     change       -0.1623399E-04 Eh
   gradient norm :     0.0004380 Eh/α   predicted    -0.1505202E-04 (  -7.28%)
   displ. norm   :     0.0028526 α      lambda       -0.4284717E-06
   maximum displ.:     0.0020257 α      in ANC's #4, #1, #8, ...

........................................................................
.............................. CYCLE    9 ..............................
........................................................................
   1     -7.1965195 -0.719652E+01  0.673E-03    0.44       0.0  T
   2     -7.1965195 -0.279161E-07  0.453E-03    0.44       9.9  T
   3     -7.1965195 -0.857282E-08  0.249E-03    0.44      18.0  T
   4     -7.1965195 -0.100350E-07  0.388E-04    0.44     115.2  T
   5     -7.1965195 -0.697691E-10  0.183E-04    0.44     244.2  T
     SCC iter.                  ...        0 min,  0.000 sec
     gradient                   ...        0 min,  0.001 sec
 * total energy  :    -7.1059793 Eh     change       -0.1724268E-06 Eh
   gradient norm :     0.0002205 Eh/α   predicted    -0.2141493E-06 (  24.20%)
   displ. norm   :     0.0008417 α      lambda       -0.6177567E-07
   maximum displ.:     0.0005649 α      in ANC's #4, #1, #8, ...

   *** GEOMETRY OPTIMIZATION CONVERGED AFTER 9 ITERATIONS ***

------------------------------------------------------------------------
 total energy gain   :        -0.0948608 Eh      -59.5260 kcal/mol
 total RMSD          :         0.6392254 a0        0.3383 Å
 total power (kW/mol):       -27.6729921 (step)********** (real)
------------------------------------------------------------------------

 ANCopt (total)                0 d,  0 h,  0 min,  0.018 sec
 optimizer setup                ...        0 min,  0.000 sec (  0.366%)
 model hessian                  ...        0 min,  0.000 sec (  0.537%)
 ANC generation                 ...        0 min,  0.000 sec (  0.295%)
 coordinate transformation      ...        0 min,  0.000 sec (  0.107%)
 single point calculation       ...        0 min,  0.017 sec ( 94.603%)
 optimization log               ...        0 min,  0.000 sec (  1.038%)
 hessian update                 ...        0 min,  0.000 sec (  0.102%)
 rational function              ...        0 min,  0.000 sec (  1.251%)

================
 final structure:
================
5
 xtb: 6.2.2 (9d81278992624c895f80dd42a50cac0aa55982e2)
C        -0.00410733605835   -0.23685784110318    0.01405453230805
C         0.79314813972869    0.97542618660505   -0.06586869383502
C        -0.75883505439626    1.00319052787207   -0.05154004279724
H        -0.00604894442368   -0.81877997418571    0.93232116654589
H        -0.02415580485040   -0.92297989918823   -0.82896696222169

 Bond Distances (Angstroems)
 ---------------------------
C1-C2=1.4531         C1-C3=1.4531         C1-H4=1.0871         C1-H5=1.0871         C2-C1=1.4531         C2-C3=1.5523         
C3-C1=1.4531         C3-C2=1.5523         H4-C1=1.0871         H5-C1=1.0871         
 C  H  Rav=1.0871 sigma=0.0000  Rmin=1.0871  Rmax=1.0871     2
 C  C  Rav=1.4862 sigma=0.0467  Rmin=1.4531  Rmax=1.5523     3

 selected bond angles (degree)
 --------------------
C3-C1-C2= 64.57                H4-C1-C2=119.60                H4-C1-C3=119.60                H5-C1-C2=119.60                
H5-C1-C3=119.60                H5-C1-H4=108.49                C3-C2-C1= 57.72                C2-C3-C1= 57.72                

 selected dihedral angles (degree)
 ---------------------------------
C3-C2-C1-H4=248.96            C3-C2-C1-H5=111.04            C2-C3-C1-H4=111.04            C2-C3-C1-H5=248.96            
           -------------------------------------------------
          |                Final Singlepoint                |
           -------------------------------------------------

          ...................................................
          :                      SETUP                      :
          :.................................................:
          :  # basis functions                  14          :
          :  # atomic orbitals                  14          :
          :  # shells                            8          :
          :  # electrons                        14          :
          :  max. iterations                   250          :
          :  Hamiltonian                  GFN2-xTB          :
          :  restarted?                      false          :
          :  GBSA solvation                  false          :
          :  PC potential                    false          :
          :  electronic temp.          300.0000000     K    :
          :  accuracy                    1.0000000          :
          :  -> integral cutoff          0.2500000E+02      :
          :  -> integral neglect         0.1000000E-07      :
          :  -> SCF convergence          0.1000000E-05 Eh   :
          :  -> wf. convergence          0.1000000E-03 e    :
          :  Broyden damping             0.4000000          :
          ...................................................

 iter      E             dE          RMSdq      gap      omega  full diag
   1     -7.1965195 -0.719652E+01  0.304E-05    0.44       0.0  T
   2     -7.1965195 -0.255795E-12  0.202E-05    0.44    2208.5  T
   3     -7.1965195  0.247802E-12  0.845E-06    0.44    5292.1  T

   *** convergence criteria satisfied after 3 iterations ***

         #    Occupation            Energy/Eh            Energy/eV
      -------------------------------------------------------------
         1        2.0000           -0.6813025             -18.5392
         2        2.0000           -0.5950444             -16.1920
         3        2.0000           -0.5534258             -15.0595
         4        2.0000           -0.5375605             -14.6278
         5        2.0000           -0.4547947             -12.3756
         6        2.0000           -0.4062764             -11.0553
         7        1.9996           -0.3953829             -10.7589 (HOMO)
         8        0.0004           -0.3791111             -10.3161 (LUMO)
         9                         -0.2862832              -7.7902
        10                         -0.0693588              -1.8873
        11                          0.1240692               3.3761
        12                          0.1647669               4.4835
       ...                                ...                  ...
        14                          0.3280101               8.9256
      -------------------------------------------------------------
                  HL-Gap            0.0162718 Eh            0.4428 eV
             Fermi-level           -0.3872470 Eh          -10.5375 eV

 SCC (total)                   0 d,  0 h,  0 min,  0.002 sec
 SCC setup                      ...        0 min,  0.000 sec (  4.272%)
 Dispersion                     ...        0 min,  0.000 sec (  0.475%)
 integral evaluation            ...        0 min,  0.001 sec ( 39.229%)
 zeroth order Hamiltonian       ...        0 min,  0.000 sec (  0.531%)
 iterations                     ...        0 min,  0.000 sec ( 12.774%)
 molecular gradient             ...        0 min,  0.001 sec ( 39.760%)
 printout                       ...        0 min,  0.000 sec (  2.527%)

         :::::::::::::::::::::::::::::::::::::::::::::::::::::
         ::                     SUMMARY                     ::
         :::::::::::::::::::::::::::::::::::::::::::::::::::::
         :: total energy              -7.105979298781 Eh    ::
         :: gradient norm              0.000219209618 Eh/a0 ::
         :: HOMO-LUMO gap              0.442777530885 eV    ::
         ::.................................................::
         :: SCC energy                -7.196519528602 Eh    ::
         :: -> isotropic ES           -0.014641844241 Eh    ::
         :: -> anisotropic ES          0.000473798783 Eh    ::
         :: -> anisotropic XC          0.011012132329 Eh    ::
         :: -> dispersion             -0.001453122004 Eh    ::
         :: repulsion energy           0.090540204065 Eh    ::
         :: add. restraining           0.000000000000 Eh    ::
         :::::::::::::::::::::::::::::::::::::::::::::::::::::

           ------------------------------------------------- 
          |                Numerical Hessian                |
           ------------------------------------------------- 
step length          :   0.00500
SCC accuracy         :   0.30000
Hessian scale factor :   1.00000
frozen atoms in %    :   0.00000    0
RMS gradient         :   0.00022
estimated CPU  time      0.00 min
estimated wall time      0.00 min

writing file <hessian>.

 projected vibrational frequencies (cm-1)
eigval :       -0.00    -0.00    -0.00     0.00     0.00     0.00
eigval :    -1058.71  -272.90   864.34   907.79  1063.03  1123.60
eigval :     1368.14  2958.52  2983.86
           -------------------------------------------------
          |                Property Printout                |
           -------------------------------------------------

    * Orbital Energies and Occupations

         #    Occupation            Energy/Eh            Energy/eV
      -------------------------------------------------------------
         1        2.0000           -0.6813026             -18.5392
         2        2.0000           -0.5950444             -16.1920
         3        2.0000           -0.5534258             -15.0595
         4        2.0000           -0.5375606             -14.6278
         5        2.0000           -0.4547947             -12.3756
         6        2.0000           -0.4062764             -11.0553
         7        1.9996           -0.3953829             -10.7589 (HOMO)
         8        0.0004           -0.3791111             -10.3161 (LUMO)
         9                         -0.2862831              -7.7902
        10                         -0.0693588              -1.8874
        11                          0.1240691               3.3761
        12                          0.1647669               4.4835
        13                          0.2096051               5.7036
        14                          0.3280100               8.9256
      -------------------------------------------------------------
                  HL-Gap            0.0162718 Eh            0.4428 eV
             Fermi-level           -0.3872470 Eh          -10.5375 eV

     #   Z        covCN         q      C6AA      α(0)
     1   6 C      3.808    -0.020    20.924     6.512
     2   6 C      1.951    -0.121    34.458     9.480
     3   6 C      1.951    -0.121    34.458     9.480
     4   1 H      0.925     0.131     1.527     1.933
     5   1 H      0.925     0.131     1.527     1.933

 Mol. C6AA /au·bohr⁶  :        352.106956
 Mol. C8AA /au·bohr⁸  :       9257.988140
 Mol. α(0) /au        :         29.336227


Wiberg/Mayer (AO) data.
largest (>0.10) Wiberg bond orders for each atom
          total WBO             WBO to atom ...
     1  C   3.950        C    2 1.145    C    3 1.145    H    5 0.831    H    4 0.831
     2  C   2.262        C    1 1.145    C    3 0.988
     3  C   2.262        C    1 1.145    C    2 0.988
     4  H   0.983        C    1 0.831
     5  H   0.983        C    1 0.831

MOs/occ written to file <molden.input>


molecular dipole:
                 x           y           z       tot (Debye)
 q only:       -0.015      -0.875       0.052
   full:       -0.026      -1.528       0.091       3.890
molecular quadrupole (traceless):
                xx          xy          yy          xz          yz          zz
 q only:       -0.814       0.011      -0.240       0.019       0.077       1.054
  q+dip:       -2.818       0.043      -0.548       0.061       0.232       3.366
   full:       -3.803       0.039      -1.848       0.095       0.445       5.651

           -------------------------------------------------
          |                Geometry Summary                 |
           -------------------------------------------------

      molecular mass/u    :       38.0480892
   center of mass at/Å    :        0.0087375       0.5036839      -0.0298890
  moments of inertia/u·Å² :        0.1603972E+02   0.1769098E+02   0.3059266E+02
rotational constants/cm⁻¹ :        0.1050993E+01   0.9528940E+00   0.5510351E+00

 * 2 selected distances

     #   Z        #   Z                                     value/Å
     1   6 C      4   1 H                                 1.0871296 (max)
     1   6 C      5   1 H                                 1.0871296 (min)

 * 1 distinct bonds (by element types)

   Z      Z             #   av. dist./Å        max./Å        min./Å
Molecule has the following symmetry elements: (C2) 2*(sigma) 
It seems to be the C2v point group
   1 H    6 C           2     1.0871296     1.0871296     1.0871296

           -------------------------------------------------
          |               Frequency Printout                |
           -------------------------------------------------
 projected vibrational frequencies (cm-1)
eigval :       -0.00    -0.00    -0.00     0.00     0.00     0.00
eigval :    -1058.71  -272.90   864.34   907.79  1063.03  1123.60
eigval :     1368.14  2958.52  2983.86
 reduced masses (amu)
   1:  8.29   2: 11.02   3: 11.20   4: 10.91   5: 11.24   6: 11.85   7:  2.08   8:  3.93
   9:  3.05  10: 11.72  11: 11.92  12:  1.60  13: 11.74  14:  2.02  15:  1.56
 IR intensities (amu)
   1:  0.13   2:  0.09   3:  0.12   4:  0.19   5:  0.23   6:  0.29   7:  0.00   8:  0.26
   9:  0.19  10:  0.39  11:  0.04  12:  0.44  13:  0.78  14:  0.19  15:  0.25
 Raman intensities (amu)
   1:  0.00   2:  0.00   3:  0.00   4:  0.00   5:  0.00   6:  0.00   7:  0.00   8:  0.00
   9:  0.00  10:  0.00  11:  0.00  12:  0.00  13:  0.00  14:  0.00  15:  0.00
 output can be read by thermo (or use thermo option).
 writing <g98.out> molden fake output.
 recommended (thermochemical) frequency scaling factor: 1.0
           -------------------------------------------------
          |             Thermodynamic Functions             |
           -------------------------------------------------

c2v symmetry found (for desy threshold:  0.10E+00) used in thermo

          ...................................................
          :                      SETUP                      :
          :.................................................:
          :  # frequencies                           7      :
          :  # imaginary freq.                       2      :
          :  linear?                             false      :
          :  only rotor calc.                    false      :
          :  symmetry                              c2v      :
          :  rotational number                       2      :
          :  scaling factor                  1.0000000      :
          :  rotor cutoff                   50.0000000 cm⁻¹ :
          :  imag. cutoff                  -20.0000000 cm⁻¹ :
          :.................................................:

    mode    ω/cm⁻¹     T·S(HO)/kcal·mol⁻¹    T·S(FR)/kcal·mol⁻¹   T·S(vib)
   ------------------------------------------------------------------------
   ------------------------------------------------------------------------

   temp. (K)  partition function   enthalpy   heat capacity  entropy
                                   cal/mol     cal/K/mol   cal/K/mol   J/K/mol
 298.15  VIB   1.04                  109.321      1.732      0.446
         ROT  0.356E+04              888.752      2.981     19.231
         INT  0.370E+04              998.074      4.713     19.677
         TR   0.227E+27             1481.254      4.968     36.821
         TOT                        2479.3276     9.6810    56.4978   236.3870

   temp. (K)  partition function   enthalpy   heat capacity  entropy
                                   cal/mol     cal/K/mol   cal/K/mol   J/K/mol
 120.00  VIB   1.00                    0.140      0.013      0.001
         ROT   909.                  357.707      2.981     16.518
         INT   909.                  357.847      2.994     16.519
         TR   0.580E+26              596.178      4.968     32.302
         TOT                         954.0252     7.9617    48.8209   204.2668

   temp. (K)  partition function   enthalpy   heat capacity  entropy
                                   cal/mol     cal/K/mol   cal/K/mol   J/K/mol
 100.00  VIB   1.00                    0.016      0.002      0.000
         ROT   691.                  298.089      2.981     15.975
         INT   691.                  298.105      2.983     15.975
         TR   0.441E+26              496.815      4.968     31.396
         TOT                         794.9203     7.9511    47.3710   198.2003

   temp. (K)  partition function   enthalpy   heat capacity  entropy
                                   cal/mol     cal/K/mol   cal/K/mol   J/K/mol
  80.00  VIB   1.00                    0.001      0.000     -0.000
         ROT   495.                  238.471      2.981     15.309
         INT   495.                  238.472      2.981     15.309
         TR   0.316E+26              397.452      4.968     30.288
         TOT                         635.9239     7.9492    45.5976   190.7803

   temp. (K)  partition function   enthalpy   heat capacity  entropy
                                   cal/mol     cal/K/mol   cal/K/mol   J/K/mol
  60.00  VIB   1.00                    0.000      0.000     -0.000
         ROT   321.                  178.853      2.981     14.452
         INT   321.                  178.853      2.981     14.452
         TR   0.205E+26              298.089      4.968     28.860
         TOT                         476.9424     7.9490    43.3115   181.2152

   temp. (K)  partition function   enthalpy   heat capacity  entropy
                                   cal/mol     cal/K/mol   cal/K/mol   J/K/mol
  40.00  VIB   1.00                    0.000      0.000     -0.000
         ROT   175.                  119.236      2.981     13.243
         INT   175.                  119.236      2.981     13.243
         TR   0.112E+26              198.726      4.968     26.846
         TOT                         317.9616     7.9490    40.0894   167.7340

   temp. (K)  partition function   enthalpy   heat capacity  entropy
                                   cal/mol     cal/K/mol   cal/K/mol   J/K/mol
  20.00  VIB   1.00                    0.000      0.000     -0.000
         ROT   61.8                   59.618      2.981     11.177
         INT   61.8                   59.618      2.981     11.177
         TR   0.395E+25               99.363      4.968     23.404
         TOT                         158.9808     7.9490    34.5812   144.6877

   temp. (K)  partition function   enthalpy   heat capacity  entropy
                                   cal/mol     cal/K/mol   cal/K/mol   J/K/mol
  10.00  VIB   1.00                    0.000      0.000     -0.000
         ROT   21.9                   29.809      2.981      9.111
         INT   21.9                   29.809      2.981      9.111
         TR   0.139E+25               49.681      4.968     19.962
         TOT                          79.4904     7.9490    29.0730   121.6414

       T/K    H(0)-H(T)+PV         H(T)/Eh          T*S/Eh         G(T)/Eh
   ------------------------------------------------------------------------
    298.15    0.395106E-02    0.296244E-01    0.268440E-01    0.278043E-02
    120.00    0.152034E-02    0.271937E-01    0.933614E-02    0.178575E-01
    100.00    0.126679E-02    0.269401E-01    0.754905E-02    0.193911E-01
     80.00    0.101341E-02    0.266867E-01    0.581315E-02    0.208736E-01
     60.00    0.760056E-03    0.264334E-01    0.414127E-02    0.222921E-01
     40.00    0.506704E-03    0.261800E-01    0.255546E-02    0.236246E-01
     20.00    0.253352E-03    0.259267E-01    0.110217E-02    0.248245E-01
     10.00    0.126676E-03    0.258000E-01    0.463308E-03    0.253367E-01 (used)
   ------------------------------------------------------------------------

         :::::::::::::::::::::::::::::::::::::::::::::::::::::
         ::                  THERMODYNAMIC                  ::
         :::::::::::::::::::::::::::::::::::::::::::::::::::::
         :: total free energy          -7.080642609122 Eh   ::
         ::.................................................::
         :: total energy               -7.105979298926 Eh   ::
         :: zero point energy           0.025673321507 Eh   ::
         :: G(RRHO) w/o ZPVE           -0.000336631704 Eh   ::
         :: G(RRHO) contrib.            0.025336689804 Eh   ::
         :::::::::::::::::::::::::::::::::::::::::::::::::::::
imag cut-off (cm-1) :    5.00
 found            2  significant imaginary frequencies
 writing imag mode distorted coords to xtbhess.xyz
 for further optimization.

optimized geometry written to: xtbopt.xyz


           -------------------------------------------------
          | TOTAL ENERGY               -7.105979298926 Eh   |
          | TOTAL ENTHALPY             -7.080179301403 Eh   |
          | TOTAL FREE ENERGY          -7.080642609122 Eh   |
          | GRADIENT NORM               0.000219294934 Eh/α |
          | HOMO-LUMO GAP               0.442777093040 eV   |
           -------------------------------------------------

------------------------------------------------------------------------
 * finished run on 2020/05/12 at 11:44:25.737     
------------------------------------------------------------------------
 total:
 * wall-time:     0 d,  0 h,  0 min,  0.093 sec
 *  cpu-time:     0 d,  0 h,  0 min,  0.093 sec
 * ratio c/w:     0.999 speedup
 SCF:
 * wall-time:     0 d,  0 h,  0 min,  0.003 sec
 *  cpu-time:     0 d,  0 h,  0 min,  0.003 sec
 * ratio c/w:     1.000 speedup
 ANC optimizer:
 * wall-time:     0 d,  0 h,  0 min,  0.020 sec
 *  cpu-time:     0 d,  0 h,  0 min,  0.020 sec
 * ratio c/w:     1.000 speedup
 numerical hessian:
 * wall-time:     0 d,  0 h,  0 min,  0.054 sec
 *  cpu-time:     0 d,  0 h,  0 min,  0.054 sec
 * ratio c/w:     0.998 speedup

