      -----------------------------------------------------------      
     |                   =====================                   |     
     |                           x T B                           |     
     |                   =====================                   |     
     |                         S. Grimme                         |     
     |          Mulliken Center for Theoretical Chemistry        |     
     |                    University of Bonn                     |     
      -----------------------------------------------------------      

   * xtb version 6.2.2 (9d81278992624c895f80dd42a50cac0aa55982e2) compiled by '@Darwin' on 04/03/2020

   xtb is free software: you can redistribute it and/or modify it under
   the terms of the GNU Lesser General Public License as published by
   the Free Software Foundation, either version 3 of the License, or
   (at your option) any later version.
   
   xtb is distributed in the hope that it will be useful,
   but WITHOUT ANY WARRANTY; without even the implied warranty of
   MERCHANTABILITY or FITNESS FOR A PARTICULAR PURPOSE.  See the
   GNU Lesser General Public License for more details.
   
   Cite this work as:
   * S. Grimme, C. Bannwarth, P. Shushkov, J. Chem. Theory Comput., 2017,
     13, 1989-2009. DOI: 10.1021/acs.jctc.7b00118
   * C. Bannwarth, S. Ehlert and S. Grimme., J. Chem. Theory Comput., 2019,
     15, 1652-1671. DOI: 10.1021/acs.jctc.8b01176
   * P. Pracht, E. Caldeweyher, S. Ehlert, S. Grimme, ChemRxiv, 2019, preprint.
     DOI: 10.26434/chemrxiv.8326202.v1
   
   for DFT-D4:
   * E. Caldeweyher, C. Bannwarth and S. Grimme, J. Chem. Phys., 2017,
     147, 034112. DOI: 10.1063/1.4993215
   * E. Caldeweyher, S. Ehlert, A. Hansen, H. Neugebauer, S. Spicher,
     C. Bannwarth and S. Grimme, J. Chem. Phys., 2019, 150, 154122.
     DOI: 10.1063/1.5090222
   
   for sTDA-xTB:
   * S. Grimme and C. Bannwarth, J. Chem. Phys., 2016, 145, 054103.
     DOI: 10.1063/1.4959605
   
   in the mass-spec context:
   * V. Asgeirsson, C. Bauer and S. Grimme, Chem. Sci., 2017, 8, 4879.
     DOI: 10.1039/c7sc00601b
   
   for metadynamics refer to:
   * S. Grimme, J. Chem. Theory Comput., 2019, 155, 2847-2862
     DOI: 10.1021/acs.jctc.9b00143
   
   with help from (in alphabetical order)
   C. Bannwarth, F. Bohle, G. Brandenburg, E. Caldeweyher, M. Checinski,
   S. Dohm, S. Ehlert, S. Ehrlich, F. März, H. Neugebauer, J. Pisarek,
   P. Pracht, P. Shushkov, and S. Spicher.
   
 * started run on 2020/05/12 at 11:44:25.003     

           -------------------------------------------------
          |                Calculation Setup                |
           -------------------------------------------------

          program call               : xtb --input H1C1N1_1_S_0.input H1C1N1_1_S_0.xyz --ohess --molden --namespace H1C1N1_1_S_0 output.out
          calculation namespace      : H1C1N1_1_S_0
          coordinate file            : H1C1N1_1_S_0.xyz
          number of atoms            :                     3
          number of electrons        :                    10
          charge                     :                     0
          spin                       :                   0.0
          first test random number   :      0.00497079299358

   ID    Z sym.   atoms
    1    6 C      1
    2    7 N      2
    3    1 H      3

           -------------------------------------------------
          |                 G F N 2 - x T B                 |
           -------------------------------------------------

        Reference                      10.1021/acs.jctc.8b01176
      * Hamiltonian:
        H0-scaling (s, p, d)           1.850000    2.230000    2.230000
        zeta-weighting                 0.500000
      * Dispersion:
        s8                             2.700000
        a1                             0.520000
        a2                             5.000000
        s9                             5.000000
      * Repulsion:
        kExp                           1.500000    1.000000
        rExp                           1.000000
      * Coulomb:
        alpha                          2.000000
        third order                    shell-resolved
        anisotropic                    true
        a3                             3.000000
        a5                             4.000000
        cn-shift                       1.200000
        cn-exp                         4.000000
        max-rad                        5.000000


          ...................................................
          :                      SETUP                      :
          :.................................................:
          :  # basis functions                   9          :
          :  # atomic orbitals                   9          :
          :  # shells                            5          :
          :  # electrons                        10          :
          :  max. iterations                   250          :
          :  Hamiltonian                  GFN2-xTB          :
          :  restarted?                      false          :
          :  GBSA solvation                  false          :
          :  PC potential                    false          :
          :  electronic temp.          300.0000000     K    :
          :  accuracy                    1.0000000          :
          :  -> integral cutoff          0.2500000E+02      :
          :  -> integral neglect         0.1000000E-07      :
          :  -> SCF convergence          0.1000000E-05 Eh   :
          :  -> wf. convergence          0.1000000E-03 e    :
          :  Broyden damping             0.4000000          :
          ...................................................

 iter      E             dE          RMSdq      gap      omega  full diag
   1     -5.3618898 -0.536189E+01  0.105E+01    2.48       0.0  T
   2     -5.2474828  0.114407E+00  0.942E+00    2.80       1.0  T
   3     -5.2512167 -0.373392E-02  0.672E+00    2.27       1.0  T
   4     -5.3799221 -0.128705E+00  0.216E+00    2.64       1.0  T
   5     -5.3924124 -0.124903E-01  0.676E-01    2.55       1.0  T
   6     -5.3902430  0.216943E-02  0.798E-01    2.61       1.0  T
   7     -5.3927636 -0.252061E-02  0.133E-01    2.56       1.0  T
   8     -5.3928226 -0.589488E-04  0.444E-02    2.55       1.3  T
   9     -5.3928309 -0.830446E-05  0.199E-03    2.55      29.0  T
  10     -5.3928308  0.392144E-07  0.331E-03    2.55      17.5  T
  11     -5.3928309 -0.367834E-07  0.149E-03    2.55      38.8  T
  12     -5.3928309 -0.886012E-08  0.450E-05    2.55    1282.6  T
  13     -5.3928309  0.113687E-12  0.298E-05    2.55    1935.8  T

   *** convergence criteria satisfied after 13 iterations ***

         #    Occupation            Energy/Eh            Energy/eV
      -------------------------------------------------------------
         1        2.0000           -0.6608677             -17.9831
         2        2.0000           -0.5882624             -16.0074
         3        2.0000           -0.5153539             -14.0235
         4        2.0000           -0.4774957             -12.9933
         5        2.0000           -0.4578298             -12.4582 (HOMO)
         6                         -0.3640523              -9.9064 (LUMO)
         7                         -0.3368629              -9.1665
         8                          0.0277900               0.7562
         9                          0.0895244               2.4361
      -------------------------------------------------------------
                  HL-Gap            0.0937775 Eh            2.5518 eV
             Fermi-level           -0.4109410 Eh          -11.1823 eV

 SCC (total)                   0 d,  0 h,  0 min,  0.001 sec
 SCC setup                      ...        0 min,  0.000 sec (  5.327%)
 Dispersion                     ...        0 min,  0.000 sec (  0.560%)
 integral evaluation            ...        0 min,  0.000 sec ( 22.430%)
 zeroth order Hamiltonian       ...        0 min,  0.000 sec (  0.628%)
 iterations                     ...        0 min,  0.001 sec ( 47.964%)
 molecular gradient             ...        0 min,  0.000 sec ( 18.935%)
 printout                       ...        0 min,  0.000 sec (  3.342%)

         :::::::::::::::::::::::::::::::::::::::::::::::::::::
         ::                     SUMMARY                     ::
         :::::::::::::::::::::::::::::::::::::::::::::::::::::
         :: total energy              -5.367670148620 Eh    ::
         :: gradient norm              0.303281178931 Eh/a0 ::
         :: HOMO-LUMO gap              2.551816275401 eV    ::
         ::.................................................::
         :: SCC energy                -5.392830879767 Eh    ::
         :: -> isotropic ES           -0.013504549404 Eh    ::
         :: -> anisotropic ES          0.001389538908 Eh    ::
         :: -> anisotropic XC          0.011069984362 Eh    ::
         :: -> dispersion             -0.000494928671 Eh    ::
         :: repulsion energy           0.025160730861 Eh    ::
         :: add. restraining           0.000000000000 Eh    ::
         :::::::::::::::::::::::::::::::::::::::::::::::::::::

      ----------------------------------------------------------- 
     |                   =====================                   |
     |                        A N C O P T                        |
     |                   =====================                   |
     |               Approximate Normal Coordinate               |
     |                Rational Function Optimizer                |
      ----------------------------------------------------------- 

          ...................................................
          :                      SETUP                      :
          :.................................................:
          :   optimization level            normal          :
          :   max. optcycles                   200          :
          :   ANC micro-cycles                  20          :
          :   degrees of freedom                 3          :
          :.................................................:
          :   RF solver                   davidson          :
          :   write xtbopt.log                true          :
          :   linear?                        false          :
          :   energy convergence         0.5000000E-05 Eh   :
          :   grad. convergence          0.1000000E-02 Eh/α :
          :   maximium RF displ.         1.0000000          :
          :   Hlow (freq-cutoff)         0.1000000E-01      :
          :   Hmax (freq-cutoff)         5.0000000          :
          :   S6 in model hess.         20.0000000          :
          ...................................................

generating ANC from model Hessian ...
Using Lindh-Hessian (1995)
 Shifting diagonal of input Hessian by    0.0000000000000000     
 Lowest  eigenvalues of input Hessian
   -0.000000   -0.000000   -0.000000    0.000000    0.000000    0.000000
    0.139130    0.890608    1.121768
 Highest eigenvalues
    0.000000    0.000000    0.000000    0.139130    0.890608    1.121768


........................................................................
.............................. CYCLE    1 ..............................
........................................................................
   1     -5.3928309 -0.539283E+01  0.111E-05    2.55       0.0  T
   2     -5.3928309  0.310063E-11  0.294E-05    2.55    1961.2  T
   3     -5.3928309 -0.353673E-11  0.205E-06    2.55   28216.3  T
     SCC iter.                  ...        0 min,  0.000 sec
     gradient                   ...        0 min,  0.000 sec
 * total energy  :    -5.3676701 Eh     change        0.2724665E-10 Eh
   gradient norm :     0.3032809 Eh/α   predicted     0.0000000E+00 (-100.00%)
   displ. norm   :     0.2855395 α      lambda       -0.8603928E-01
   maximum displ.:     0.2293714 α      in ANC's #2, #3, #1, ...

........................................................................
.............................. CYCLE    2 ..............................
........................................................................
   1     -5.4816029 -0.548160E+01  0.325E+00    3.53       0.0  T
   2     -5.4615175  0.200854E-01  0.390E+00    3.68       1.0  T
   3     -5.5039354 -0.424179E-01  0.116E+00    3.54       1.0  T
   4     -5.5030364  0.898977E-03  0.613E-01    3.44       1.0  T
   5     -5.5040737 -0.103729E-02  0.825E-02    3.46       1.0  T
   6     -5.5040744 -0.672710E-06  0.179E-02    3.46       3.2  T
   7     -5.5040744 -0.365948E-07  0.360E-03    3.45      16.0  T
   8     -5.5040744  0.917082E-08  0.227E-03    3.45      25.5  T
   9     -5.5040745 -0.124916E-07  0.226E-04    3.45     255.7  T
  10     -5.5040745 -0.131673E-09  0.331E-05    3.45    1742.7  T
     SCC iter.                  ...        0 min,  0.000 sec
     gradient                   ...        0 min,  0.000 sec
 * total energy  :    -5.4371789 Eh     change       -0.6950871E-01 Eh
   gradient norm :     0.1409658 Eh/α   predicted    -0.4652714E-01 ( -33.06%)
   displ. norm   :     0.3723425 α      lambda       -0.4460337E-01
   maximum displ.:     0.2497895 α      in ANC's #1, #2, #3, ...

........................................................................
.............................. CYCLE    3 ..............................
........................................................................
   1     -5.5987941 -0.559879E+01  0.333E+00    5.15       0.0  T
   2     -5.6035376 -0.474349E-02  0.224E+00    4.96       1.0  T
   3     -5.6102796 -0.674201E-02  0.117E+00    5.00       1.0  T
   4     -5.6105848 -0.305148E-03  0.153E-01    4.93       1.0  T
   5     -5.6106006 -0.158198E-04  0.591E-02    4.92       1.0  T
   6     -5.6106084 -0.787580E-05  0.169E-02    4.92       3.4  T
   7     -5.6106089 -0.420429E-06  0.240E-03    4.92      24.1  T
   8     -5.6106089 -0.763663E-08  0.526E-04    4.92     109.8  T
   9     -5.6106089 -0.100284E-09  0.240E-05    4.92    2402.4  T
     SCC iter.                  ...        0 min,  0.000 sec
     gradient                   ...        0 min,  0.000 sec
 * total energy  :    -5.4366726 Eh     change        0.5062555E-03 Eh
   gradient norm :     0.3861964 Eh/α   predicted    -0.2539355E-01 (*******%)
   displ. norm   :     0.2197056 α      lambda       -0.5531061E-01
   maximum displ.:     0.1959704 α      in ANC's #1, #3, #2, ...

........................................................................
.............................. CYCLE    4 ..............................
........................................................................
   1     -5.5525909 -0.555259E+01  0.209E+00    4.60       0.0  T
   2     -5.5505983  0.199262E-02  0.182E+00    4.71       1.0  T
   3     -5.5595605 -0.896222E-02  0.717E-01    4.67       1.0  T
   4     -5.5599575 -0.396992E-03  0.752E-02    4.72       1.0  T
   5     -5.5599528  0.465444E-05  0.632E-02    4.72       1.0  T
   6     -5.5599615 -0.864800E-05  0.466E-03    4.72      12.4  T
   7     -5.5599615 -0.387512E-08  0.745E-04    4.72      77.5  T
   8     -5.5599615 -0.335278E-10  0.308E-04    4.72     187.6  T
     SCC iter.                  ...        0 min,  0.000 sec
     gradient                   ...        0 min,  0.000 sec
 * total energy  :    -5.4626339 Eh     change       -0.2596134E-01 Eh
   gradient norm :     0.0536445 Eh/α   predicted    -0.2899024E-01 (  11.67%)
   displ. norm   :     0.1633971 α      lambda       -0.5471879E-02
   maximum displ.:     0.1351641 α      in ANC's #1, #2, #3, ...

........................................................................
.............................. CYCLE    5 ..............................
........................................................................
   1     -5.5639992 -0.556400E+01  0.809E-01    5.11       0.0  T
   2     -5.5640013 -0.214608E-05  0.461E-01    5.12       1.0  T
   3     -5.5636899  0.311401E-03  0.390E-01    5.11       1.0  T
   4     -5.5640707 -0.380820E-03  0.353E-02    5.12       1.6  T
   5     -5.5640709 -0.190556E-06  0.193E-03    5.12      29.9  T
   6     -5.5640709 -0.314812E-08  0.118E-03    5.12      49.0  T
   7     -5.5640709 -0.124324E-08  0.147E-04    5.12     392.2  T
   8     -5.5640709 -0.332356E-11  0.346E-05    5.12    1668.5  T
     SCC iter.                  ...        0 min,  0.000 sec
     gradient                   ...        0 min,  0.000 sec
 * total energy  :    -5.4668068 Eh     change       -0.4172871E-02 Eh
   gradient norm :     0.0489312 Eh/α   predicted    -0.2808984E-02 ( -32.68%)
   displ. norm   :     0.1855459 α      lambda       -0.6455844E-02
   maximum displ.:     0.1548350 α      in ANC's #2, #1, #3, ...

........................................................................
.............................. CYCLE    6 ..............................
........................................................................
   1     -5.5763938 -0.557639E+01  0.908E-01    5.51       0.0  T
   2     -5.5764191 -0.252649E-04  0.503E-01    5.52       1.0  T
   3     -5.5762351  0.183955E-03  0.289E-01    5.51       1.0  T
   4     -5.5764507 -0.215543E-03  0.411E-02    5.52       1.4  T
   5     -5.5764508 -0.655453E-07  0.646E-03    5.52       8.9  T
   6     -5.5764508 -0.275666E-07  0.170E-03    5.52      34.0  T
   7     -5.5764508 -0.226670E-08  0.219E-04    5.52     263.3  T
   8     -5.5764508 -0.354916E-11  0.160E-05    5.52    3609.1  T
     SCC iter.                  ...        0 min,  0.000 sec
     gradient                   ...        0 min,  0.000 sec
 * total energy  :    -5.4706109 Eh     change       -0.3804112E-02 Eh
   gradient norm :     0.0444022 Eh/α   predicted    -0.3339048E-02 ( -12.23%)
   displ. norm   :     0.1492693 α      lambda       -0.2049990E-02
   maximum displ.:     0.1139179 α      in ANC's #1, #2, #3, ...

........................................................................
.............................. CYCLE    7 ..............................
........................................................................
   1     -5.5757476 -0.557575E+01  0.700E-01    5.70       0.0  T
   2     -5.5757643 -0.167255E-04  0.388E-01    5.70       1.0  T
   3     -5.5757303  0.340802E-04  0.127E-01    5.70       1.0  T
   4     -5.5757748 -0.445192E-04  0.255E-02    5.70       2.3  T
   5     -5.5757748 -0.609619E-07  0.260E-03    5.70      22.2  T
   6     -5.5757748 -0.404500E-08  0.736E-04    5.70      78.4  T
   7     -5.5757748 -0.373404E-09  0.100E-04    5.70     575.9  T
     SCC iter.                  ...        0 min,  0.000 sec
     gradient                   ...        0 min,  0.000 sec
 * total energy  :    -5.4716089 Eh     change       -0.9979467E-03 Eh
   gradient norm :     0.0308659 Eh/α   predicted    -0.1047834E-02 (   5.00%)
   displ. norm   :     0.0432706 α      lambda       -0.9753961E-03
   maximum displ.:     0.0414275 α      in ANC's #2, #1, #3, ...

........................................................................
.............................. CYCLE    8 ..............................
........................................................................
   1     -5.5858689 -0.558587E+01  0.257E-01    5.82       0.0  T
   2     -5.5858515  0.173715E-04  0.233E-01    5.80       1.0  T
   3     -5.5859662 -0.114713E-03  0.920E-02    5.81       1.0  T
   4     -5.5859684 -0.219791E-05  0.114E-02    5.80       5.0  T
   5     -5.5859685 -0.486881E-07  0.173E-03    5.80      33.5  T
   6     -5.5859685 -0.493797E-09  0.473E-04    5.80     121.9  T
   7     -5.5859685 -0.110077E-09  0.802E-05    5.80     720.2  T
     SCC iter.                  ...        0 min,  0.000 sec
     gradient                   ...        0 min,  0.000 sec
 * total energy  :    -5.4721214 Eh     change       -0.5125257E-03 Eh
   gradient norm :     0.0039599 Eh/α   predicted    -0.4886109E-03 (  -4.67%)
   displ. norm   :     0.0284226 α      lambda       -0.5837807E-04
   maximum displ.:     0.0233163 α      in ANC's #2, #1, #3, ...

........................................................................
.............................. CYCLE    9 ..............................
........................................................................
   1     -5.5857106 -0.558571E+01  0.137E-01    5.80       0.0  T
   2     -5.5857112 -0.555868E-06  0.762E-02    5.80       1.0  T
   3     -5.5857075  0.366499E-05  0.395E-02    5.80       1.5  T
   4     -5.5857119 -0.434902E-05  0.437E-03    5.80      13.2  T
   5     -5.5857119 -0.259336E-09  0.229E-04    5.80     252.6  T
   6     -5.5857119 -0.196918E-10  0.101E-04    5.80     571.4  T
     SCC iter.                  ...        0 min,  0.000 sec
     gradient                   ...        0 min,  0.000 sec
 * total energy  :    -5.4721572 Eh     change       -0.3584411E-04 Eh
   gradient norm :     0.0014934 Eh/α   predicted    -0.2921302E-04 ( -18.50%)
   displ. norm   :     0.0121443 α      lambda       -0.5170175E-05
   maximum displ.:     0.0107021 α      in ANC's #2, #1, #3, ...

........................................................................
.............................. CYCLE   10 ..............................
........................................................................
   1     -5.5857848 -0.558578E+01  0.574E-02    5.80       0.0  T
   2     -5.5857849 -0.991916E-07  0.318E-02    5.80       1.8  T
   3     -5.5857841  0.798577E-06  0.188E-02    5.80       3.1  T
   4     -5.5857850 -0.949224E-06  0.191E-03    5.80      30.2  T
   5     -5.5857850 -0.778710E-10  0.225E-04    5.80     256.5  T
   6     -5.5857850 -0.360139E-10  0.422E-05    5.80    1369.5  T
     SCC iter.                  ...        0 min,  0.000 sec
     gradient                   ...        0 min,  0.000 sec
 * total energy  :    -5.4721593 Eh     change       -0.2089672E-05 Eh
   gradient norm :     0.0006909 Eh/α   predicted    -0.2584936E-05 (  23.70%)
   displ. norm   :     0.0038426 α      lambda       -0.7318483E-06
   maximum displ.:     0.0033633 α      in ANC's #2, #1, #3, ...

   *** GEOMETRY OPTIMIZATION CONVERGED AFTER 10 ITERATIONS ***

------------------------------------------------------------------------
 total energy gain   :        -0.1044892 Eh      -65.5680 kcal/mol
 total RMSD          :         0.6649695 a0        0.3519 Å
 total power (kW/mol):       -27.4336314 (step)********** (real)
------------------------------------------------------------------------

 ANCopt (total)                0 d,  0 h,  0 min,  0.009 sec
 optimizer setup                ...        0 min,  0.000 sec (  0.665%)
 model hessian                  ...        0 min,  0.000 sec (  0.453%)
 ANC generation                 ...        0 min,  0.000 sec (  0.368%)
 coordinate transformation      ...        0 min,  0.000 sec (  0.199%)
 single point calculation       ...        0 min,  0.009 sec ( 91.433%)
 optimization log               ...        0 min,  0.000 sec (  1.984%)
 hessian update                 ...        0 min,  0.000 sec (  0.214%)
 rational function              ...        0 min,  0.000 sec (  1.750%)

================
 final structure:
================
3
 xtb: 6.2.2 (9d81278992624c895f80dd42a50cac0aa55982e2)
C         1.10263563285041    0.06800110016322    0.00000000000000
N        -0.05360296321351   -0.00489614260350   -0.00000000000000
H        -1.04903266963690   -0.06310495755972    0.00000000000000

 Bond Distances (Angstroems)
 ---------------------------
C1-N2=1.1585         N2-C1=1.1585         N2-H3=0.9971         H3-N2=0.9971         
 N  H  Rav=0.9971 sigma=0.0000  Rmin=0.9971  Rmax=0.9971     1
 N  C  Rav=1.1585 sigma=0.0000  Rmin=1.1585  Rmax=1.1585     1

 selected bond angles (degree)
 --------------------
H3-N2-C1=179.74                

 selected dihedral angles (degree)
 ---------------------------------

           -------------------------------------------------
          |                Final Singlepoint                |
           -------------------------------------------------

          ...................................................
          :                      SETUP                      :
          :.................................................:
          :  # basis functions                   9          :
          :  # atomic orbitals                   9          :
          :  # shells                            5          :
          :  # electrons                        10          :
          :  max. iterations                   250          :
          :  Hamiltonian                  GFN2-xTB          :
          :  restarted?                      false          :
          :  GBSA solvation                  false          :
          :  PC potential                    false          :
          :  electronic temp.          300.0000000     K    :
          :  accuracy                    1.0000000          :
          :  -> integral cutoff          0.2500000E+02      :
          :  -> integral neglect         0.1000000E-07      :
          :  -> SCF convergence          0.1000000E-05 Eh   :
          :  -> wf. convergence          0.1000000E-03 e    :
          :  Broyden damping             0.4000000          :
          ...................................................

 iter      E             dE          RMSdq      gap      omega  full diag
   1     -5.5857850 -0.558579E+01  0.851E-06    5.80       0.0  T
   2     -5.5857850 -0.888178E-15  0.595E-06    5.80    9700.3  T
   3     -5.5857850 -0.364153E-13  0.362E-06    5.80   15932.3  T

   *** convergence criteria satisfied after 3 iterations ***

         #    Occupation            Energy/Eh            Energy/eV
      -------------------------------------------------------------
         1        2.0000           -0.6643865             -18.0789
         2        2.0000           -0.5886591             -16.0182
         3        2.0000           -0.4999998             -13.6057
         4        2.0000           -0.4999995             -13.6057
         5        2.0000           -0.4364507             -11.8764 (HOMO)
         6                         -0.2233667              -6.0781 (LUMO)
         7                         -0.2233649              -6.0781
         8                          0.0533927               1.4529
         9                          1.0151465              27.6235
      -------------------------------------------------------------
                  HL-Gap            0.2130840 Eh            5.7983 eV
             Fermi-level           -0.3299087 Eh           -8.9773 eV

 SCC (total)                   0 d,  0 h,  0 min,  0.001 sec
 SCC setup                      ...        0 min,  0.000 sec (  7.842%)
 Dispersion                     ...        0 min,  0.000 sec (  0.465%)
 integral evaluation            ...        0 min,  0.000 sec ( 37.496%)
 zeroth order Hamiltonian       ...        0 min,  0.000 sec (  0.639%)
 iterations                     ...        0 min,  0.000 sec ( 18.153%)
 molecular gradient             ...        0 min,  0.000 sec ( 30.003%)
 printout                       ...        0 min,  0.000 sec (  4.240%)

         :::::::::::::::::::::::::::::::::::::::::::::::::::::
         ::                     SUMMARY                     ::
         :::::::::::::::::::::::::::::::::::::::::::::::::::::
         :: total energy              -5.472159332140 Eh    ::
         :: gradient norm              0.000749643680 Eh/a0 ::
         :: HOMO-LUMO gap              5.798310572448 eV    ::
         ::.................................................::
         :: SCC energy                -5.585785018637 Eh    ::
         :: -> isotropic ES           -0.006410174390 Eh    ::
         :: -> anisotropic ES         -0.002846778897 Eh    ::
         :: -> anisotropic XC          0.017781749413 Eh    ::
         :: -> dispersion             -0.000501733419 Eh    ::
         :: repulsion energy           0.113625687365 Eh    ::
         :: add. restraining           0.000000000000 Eh    ::
         :::::::::::::::::::::::::::::::::::::::::::::::::::::

           ------------------------------------------------- 
          |                Numerical Hessian                |
           ------------------------------------------------- 
step length          :   0.00500
SCC accuracy         :   0.30000
Hessian scale factor :   1.00000
frozen atoms in %    :   0.00000    0
RMS gradient         :   0.00075
estimated CPU  time      0.00 min
estimated wall time      0.00 min

writing file <hessian>.

 vibrational frequencies (cm-1)
eigval :        0.00     0.00     0.00     0.00     0.00   590.97
eigval :      591.07  2179.86  3549.64
           -------------------------------------------------
          |                Property Printout                |
           -------------------------------------------------

    * Orbital Energies and Occupations

         #    Occupation            Energy/Eh            Energy/eV
      -------------------------------------------------------------
         1        2.0000           -0.6643865             -18.0789
         2        2.0000           -0.5886591             -16.0182
         3        2.0000           -0.4999998             -13.6057
         4        2.0000           -0.4999995             -13.6057
         5        2.0000           -0.4364507             -11.8764 (HOMO)
         6                         -0.2233667              -6.0781 (LUMO)
         7                         -0.2233649              -6.0781
         8                          0.0533927               1.4529
         9                          1.0151465              27.6235
      -------------------------------------------------------------
                  HL-Gap            0.2130840 Eh            5.7983 eV
             Fermi-level           -0.3299087 Eh           -8.9773 eV

     #   Z        covCN         q      C6AA      α(0)
     1   6 C      0.910    -0.105    38.743    10.417
     2   7 N      1.771    -0.078    23.463     7.173
     3   1 H      0.861     0.183     1.199     1.715

 Mol. C6AA /au·bohr⁶  :        147.449492
 Mol. C8AA /au·bohr⁸  :       3592.042395
 Mol. α(0) /au        :         19.304393


Wiberg/Mayer (AO) data.
largest (>0.10) Wiberg bond orders for each atom
          total WBO             WBO to atom ...
     1  C   2.779        N    2 2.726
     2  N   3.641        C    1 2.726    H    3 0.914
     3  H   0.967        N    2 0.914

MOs/occ written to file <molden.input>


molecular dipole:
                 x           y           z       tot (Debye)
 q only:       -0.573      -0.035       0.000
   full:       -1.067      -0.064       0.000       2.718
molecular quadrupole (traceless):
                xx          xy          yy          xz          yz          zz
 q only:        0.261       0.023      -0.130      -0.000      -0.000      -0.131
  q+dip:        0.521       0.047      -0.259      -0.000      -0.000      -0.262
   full:       -1.207      -0.114       0.600       0.000       0.000       0.607

           -------------------------------------------------
          |                Geometry Summary                 |
           -------------------------------------------------

      molecular mass/u    :       27.0253799
   center of mass at/Å    :        0.4231321       0.0253280      -0.0000015
  moments of inertia/u·Å² :        0.1584960E-04   0.1095606E+02   0.1095608E+02
rotational constants/cm⁻¹ :        0.1063600E+07   0.1538658E+01   0.1538656E+01

 * 2 selected distances

     #   Z        #   Z                                     value/Å
     1   6 C      2   7 N                                 1.1585343 (max)
     2   7 N      3   1 H                                 0.9971302 (min)

 * 2 distinct bonds (by element types)

   Z      Z             #   av. dist./Å        max./Å        min./Å
   1 H    7 N           1     0.9971302     0.9971302     0.9971302
   6 C    7 N           1     1.1585343     1.1585343     1.1585343

           -------------------------------------------------
          |               Frequency Printout                |
           -------------------------------------------------
 vibrational frequencies (cm-1)
eigval :        0.00     0.00     0.00     0.00     0.00   590.97
eigval :      591.07  2179.86  3549.64
 reduced masses (amu)
   1: 10.33   2: 10.33   3: 12.63   4: 12.65   5: 12.65   6:  4.04   7:  4.05   8: 12.16
   9:  2.23
 IR intensities (amu)
   1:  0.13   2:  0.14   3:  0.01   4:  0.21   5:  0.22   6:  0.42   7:  0.42   8:  0.16
   9:  0.05
 Raman intensities (amu)
   1:  0.00   2:  0.00   3:  0.00   4:  0.00   5:  0.00   6:  0.00   7:  0.00   8:  0.00
   9:  0.00
 output can be read by thermo (or use thermo option).
 writing <g98.out> molden fake output.
 recommended (thermochemical) frequency scaling factor: 1.0
           -------------------------------------------------
Molecule has the following symmetry elements: (Cinf) (sigma) 
It seems to be the Cinfv point group
          |             Thermodynamic Functions             |
           -------------------------------------------------

cin symmetry found (for desy threshold:  0.10E+00) used in thermo

          ...................................................
          :                      SETUP                      :
          :.................................................:
          :  # frequencies                           4      :
          :  # imaginary freq.                       0      :
          :  linear?                              true      :
          :  only rotor calc.                    false      :
          :  symmetry                              cin      :
          :  rotational number                       1      :
          :  scaling factor                  1.0000000      :
          :  rotor cutoff                   50.0000000 cm⁻¹ :
          :  imag. cutoff                  -20.0000000 cm⁻¹ :
          :.................................................:

    mode    ω/cm⁻¹     T·S(HO)/kcal·mol⁻¹    T·S(FR)/kcal·mol⁻¹   T·S(vib)
   ------------------------------------------------------------------------
   ------------------------------------------------------------------------

   temp. (K)  partition function   enthalpy   heat capacity  entropy
                                   cal/mol     cal/K/mol   cal/K/mol   J/K/mol
 298.15  VIB   1.13                  207.213      2.108      0.931
         ROT   135.                  592.502      1.987     11.731
         INT   152.                  799.714      4.095     12.662
         TR   0.136E+27             1481.254      4.968     35.802
         TOT                        2280.9684     9.0633    48.4637   202.7722

   temp. (K)  partition function   enthalpy   heat capacity  entropy
                                   cal/mol     cal/K/mol   cal/K/mol   J/K/mol
 120.00  VIB   1.00                    2.830      0.167      0.027
         ROT   54.2                  238.471      1.987      9.922
         INT   54.3                  241.301      2.154      9.949
         TR   0.347E+26              596.178      4.968     31.282
         TOT                         837.4789     7.1226    41.2313   172.5117

   temp. (K)  partition function   enthalpy   heat capacity  entropy
                                   cal/mol     cal/K/mol   cal/K/mol   J/K/mol
 100.00  VIB   1.00                    0.685      0.058      0.008
         ROT   45.2                  198.726      1.987      9.560
         INT   45.2                  199.411      2.046      9.567
         TR   0.264E+26              496.815      4.968     30.377
         TOT                         696.2264     7.0137    39.9443   167.1271

   temp. (K)  partition function   enthalpy   heat capacity  entropy
                                   cal/mol     cal/K/mol   cal/K/mol   J/K/mol
  80.00  VIB   1.00                    0.082      0.011      0.001
         ROT   36.1                  158.981      1.987      9.116
         INT   36.1                  159.063      1.998      9.117
         TR   0.189E+26              397.452      4.968     29.269
         TOT                         556.5146     6.9663    38.3863   160.6081

   temp. (K)  partition function   enthalpy   heat capacity  entropy
                                   cal/mol     cal/K/mol   cal/K/mol   J/K/mol
  60.00  VIB   1.00                    0.002      0.001     -0.000
         ROT   27.1                  119.236      1.987      8.545
         INT   27.1                  119.238      1.988      8.544
         TR   0.123E+26              298.089      4.968     27.840
         TOT                         417.3270     6.9560    36.3849   152.2344

   temp. (K)  partition function   enthalpy   heat capacity  entropy
                                   cal/mol     cal/K/mol   cal/K/mol   J/K/mol
  40.00  VIB   1.00                    0.000      0.000     -0.000
         ROT   18.1                   79.490      1.987      7.739
         INT   18.1                   79.490      1.987      7.739
         TR   0.668E+25              198.726      4.968     25.827
         TOT                         278.2164     6.9554    33.5656   140.4386

   temp. (K)  partition function   enthalpy   heat capacity  entropy
                                   cal/mol     cal/K/mol   cal/K/mol   J/K/mol
  20.00  VIB   1.00                    0.000      0.000     -0.000
         ROT   9.03                   39.745      1.987      6.361
         INT   9.03                   39.745      1.987      6.361
         TR   0.236E+25               99.363      4.968     22.385
         TOT                         139.1082     6.9554    28.7461   120.2737

   temp. (K)  partition function   enthalpy   heat capacity  entropy
                                   cal/mol     cal/K/mol   cal/K/mol   J/K/mol
  10.00  VIB   1.00                    0.000      0.000     -0.000
         ROT   4.52                   19.873      1.987      4.984
         INT   4.52                   19.873      1.987      4.984
         TR   0.835E+24               49.681      4.968     18.943
         TOT                          69.5541     6.9554    23.9266   100.1089

       T/K    H(0)-H(T)+PV         H(T)/Eh          T*S/Eh         G(T)/Eh
   ------------------------------------------------------------------------
    298.15    0.363495E-02    0.193806E-01    0.230267E-01   -0.364608E-02
    120.00    0.133461E-02    0.170803E-01    0.788475E-02    0.919551E-02
    100.00    0.110951E-02    0.168552E-01    0.636553E-02    0.104896E-01
     80.00    0.886862E-03    0.166325E-01    0.489379E-02    0.117387E-01
     60.00    0.665053E-03    0.164107E-01    0.347898E-02    0.129317E-01
     40.00    0.443366E-03    0.161890E-01    0.213961E-02    0.140494E-01
     20.00    0.221683E-03    0.159673E-01    0.916197E-03    0.150511E-01
     10.00    0.110842E-03    0.158565E-01    0.381295E-03    0.154752E-01 (used)
   ------------------------------------------------------------------------

         :::::::::::::::::::::::::::::::::::::::::::::::::::::
         ::                  THERMODYNAMIC                  ::
         :::::::::::::::::::::::::::::::::::::::::::::::::::::
         :: total free energy          -5.456684137885 Eh   ::
         ::.................................................::
         :: total energy               -5.472159332141 Eh   ::
         :: zero point energy           0.015745647420 Eh   ::
         :: G(RRHO) w/o ZPVE           -0.000270453164 Eh   ::
         :: G(RRHO) contrib.            0.015475194256 Eh   ::
         :::::::::::::::::::::::::::::::::::::::::::::::::::::

optimized geometry written to: xtbopt.xyz


           -------------------------------------------------
          | TOTAL ENERGY               -5.472159332141 Eh   |
          | TOTAL ENTHALPY             -5.456302843208 Eh   |
          | TOTAL FREE ENERGY          -5.456684137885 Eh   |
          | GRADIENT NORM               0.000749592069 Eh/α |
          | HOMO-LUMO GAP               5.798310552681 eV   |
           -------------------------------------------------

------------------------------------------------------------------------
 * finished run on 2020/05/12 at 11:44:25.045     
------------------------------------------------------------------------
 total:
 * wall-time:     0 d,  0 h,  0 min,  0.041 sec
 *  cpu-time:     0 d,  0 h,  0 min,  0.041 sec
 * ratio c/w:     0.998 speedup
 SCF:
 * wall-time:     0 d,  0 h,  0 min,  0.002 sec
 *  cpu-time:     0 d,  0 h,  0 min,  0.002 sec
 * ratio c/w:     0.999 speedup
 ANC optimizer:
 * wall-time:     0 d,  0 h,  0 min,  0.011 sec
 *  cpu-time:     0 d,  0 h,  0 min,  0.011 sec
 * ratio c/w:     0.998 speedup
 numerical hessian:
 * wall-time:     0 d,  0 h,  0 min,  0.014 sec
 *  cpu-time:     0 d,  0 h,  0 min,  0.014 sec
 * ratio c/w:     0.999 speedup

