      -----------------------------------------------------------      
     |                   =====================                   |     
     |                           x T B                           |     
     |                   =====================                   |     
     |                         S. Grimme                         |     
     |          Mulliken Center for Theoretical Chemistry        |     
     |                    University of Bonn                     |     
      -----------------------------------------------------------      

   * xtb version 6.2.2 (9d81278992624c895f80dd42a50cac0aa55982e2) compiled by '@Darwin' on 04/03/2020

   xtb is free software: you can redistribute it and/or modify it under
   the terms of the GNU Lesser General Public License as published by
   the Free Software Foundation, either version 3 of the License, or
   (at your option) any later version.
   
   xtb is distributed in the hope that it will be useful,
   but WITHOUT ANY WARRANTY; without even the implied warranty of
   MERCHANTABILITY or FITNESS FOR A PARTICULAR PURPOSE.  See the
   GNU Lesser General Public License for more details.
   
   Cite this work as:
   * S. Grimme, C. Bannwarth, P. Shushkov, J. Chem. Theory Comput., 2017,
     13, 1989-2009. DOI: 10.1021/acs.jctc.7b00118
   * C. Bannwarth, S. Ehlert and S. Grimme., J. Chem. Theory Comput., 2019,
     15, 1652-1671. DOI: 10.1021/acs.jctc.8b01176
   * P. Pracht, E. Caldeweyher, S. Ehlert, S. Grimme, ChemRxiv, 2019, preprint.
     DOI: 10.26434/chemrxiv.8326202.v1
   
   for DFT-D4:
   * E. Caldeweyher, C. Bannwarth and S. Grimme, J. Chem. Phys., 2017,
     147, 034112. DOI: 10.1063/1.4993215
   * E. Caldeweyher, S. Ehlert, A. Hansen, H. Neugebauer, S. Spicher,
     C. Bannwarth and S. Grimme, J. Chem. Phys., 2019, 150, 154122.
     DOI: 10.1063/1.5090222
   
   for sTDA-xTB:
   * S. Grimme and C. Bannwarth, J. Chem. Phys., 2016, 145, 054103.
     DOI: 10.1063/1.4959605
   
   in the mass-spec context:
   * V. Asgeirsson, C. Bauer and S. Grimme, Chem. Sci., 2017, 8, 4879.
     DOI: 10.1039/c7sc00601b
   
   for metadynamics refer to:
   * S. Grimme, J. Chem. Theory Comput., 2019, 155, 2847-2862
     DOI: 10.1021/acs.jctc.9b00143
   
   with help from (in alphabetical order)
   C. Bannwarth, F. Bohle, G. Brandenburg, E. Caldeweyher, M. Checinski,
   S. Dohm, S. Ehlert, S. Ehrlich, F. März, H. Neugebauer, J. Pisarek,
   P. Pracht, P. Shushkov, and S. Spicher.
   
 * started run on 2020/05/12 at 11:45:21.274     

           -------------------------------------------------
          |                Calculation Setup                |
           -------------------------------------------------

          program call               : xtb --input H2C1N2_4_S_0.input H2C1N2_4_S_0.xyz --ohess --molden --namespace H2C1N2_4_S_0 output.out
          calculation namespace      : H2C1N2_4_S_0
          coordinate file            : H2C1N2_4_S_0.xyz
          number of atoms            :                     5
          number of electrons        :                    16
          charge                     :                     0
          spin                       :                   0.0
          first test random number   :      0.78963711714696

   ID    Z sym.   atoms
    1    7 N      1, 3
    2    6 C      2
    3    1 H      4, 5

           -------------------------------------------------
          |                 G F N 2 - x T B                 |
           -------------------------------------------------

        Reference                      10.1021/acs.jctc.8b01176
      * Hamiltonian:
        H0-scaling (s, p, d)           1.850000    2.230000    2.230000
        zeta-weighting                 0.500000
      * Dispersion:
        s8                             2.700000
        a1                             0.520000
        a2                             5.000000
        s9                             5.000000
      * Repulsion:
        kExp                           1.500000    1.000000
        rExp                           1.000000
      * Coulomb:
        alpha                          2.000000
        third order                    shell-resolved
        anisotropic                    true
        a3                             3.000000
        a5                             4.000000
        cn-shift                       1.200000
        cn-exp                         4.000000
        max-rad                        5.000000


          ...................................................
          :                      SETUP                      :
          :.................................................:
          :  # basis functions                  14          :
          :  # atomic orbitals                  14          :
          :  # shells                            8          :
          :  # electrons                        16          :
          :  max. iterations                   250          :
          :  Hamiltonian                  GFN2-xTB          :
          :  restarted?                      false          :
          :  GBSA solvation                  false          :
          :  PC potential                    false          :
          :  electronic temp.          300.0000000     K    :
          :  accuracy                    1.0000000          :
          :  -> integral cutoff          0.2500000E+02      :
          :  -> integral neglect         0.1000000E-07      :
          :  -> SCF convergence          0.1000000E-05 Eh   :
          :  -> wf. convergence          0.1000000E-03 e    :
          :  Broyden damping             0.4000000          :
          ...................................................

 iter      E             dE          RMSdq      gap      omega  full diag
   1     -8.7331216 -0.873312E+01  0.688E+00    1.11       0.0  T
   2     -8.3547345  0.378387E+00  0.853E+00    1.56       1.0  T
   3     -8.7267079 -0.371973E+00  0.454E+00    0.83       1.0  T
   4     -8.7849018 -0.581939E-01  0.278E+00    1.14       1.0  T
   5     -8.8030531 -0.181513E-01  0.855E-01    0.98       1.0  T
   6     -8.8019282  0.112482E-02  0.587E-01    0.90       1.0  T
   7     -8.8036000 -0.167179E-02  0.327E-01    0.98       1.0  T
   8     -8.8037833 -0.183255E-03  0.143E-01    0.97       1.0  T
   9     -8.8038071 -0.238004E-04  0.253E-02    0.96       1.8  T
  10     -8.8038069  0.180424E-06  0.916E-03    0.96       4.9  T
  11     -8.8038071 -0.227531E-06  0.419E-03    0.96      10.7  T
  12     -8.8038073 -0.109043E-06  0.105E-03    0.96      42.6  T
  13     -8.8038073 -0.693370E-08  0.792E-05    0.96     564.3  T
  14     -8.8038073 -0.274394E-10  0.295E-05    0.96    1514.3  T

   *** convergence criteria satisfied after 14 iterations ***

         #    Occupation            Energy/Eh            Energy/eV
      -------------------------------------------------------------
         1        2.0000           -0.6670094             -18.1502
         2        2.0000           -0.6252378             -17.0136
         3        2.0000           -0.5656446             -15.3920
         4        2.0000           -0.5325931             -14.4926
         5        2.0000           -0.5239961             -14.2587
         6        2.0000           -0.4959669             -13.4959
         7        2.0000           -0.4216719             -11.4743
         8        2.0000           -0.4023992             -10.9498 (HOMO)
         9                         -0.3671756              -9.9914 (LUMO)
        10                         -0.3358731              -9.1396
        11                          0.0115419               0.3141
        12                          0.0628828               1.7111
        13                          0.0968646               2.6358
        14                          0.1350568               3.6751
      -------------------------------------------------------------
                  HL-Gap            0.0352236 Eh            0.9585 eV
             Fermi-level           -0.3847874 Eh          -10.4706 eV

 SCC (total)                   0 d,  0 h,  0 min,  0.003 sec
 SCC setup                      ...        0 min,  0.000 sec (  2.718%)
 Dispersion                     ...        0 min,  0.000 sec (  0.385%)
 integral evaluation            ...        0 min,  0.001 sec ( 24.606%)
 zeroth order Hamiltonian       ...        0 min,  0.000 sec (  0.476%)
 iterations                     ...        0 min,  0.001 sec ( 43.956%)
 molecular gradient             ...        0 min,  0.001 sec ( 25.270%)
 printout                       ...        0 min,  0.000 sec (  2.250%)

         :::::::::::::::::::::::::::::::::::::::::::::::::::::
         ::                     SUMMARY                     ::
         :::::::::::::::::::::::::::::::::::::::::::::::::::::
         :: total energy              -8.757164587438 Eh    ::
         :: gradient norm              0.245766003449 Eh/a0 ::
         :: HOMO-LUMO gap              0.958482319420 eV    ::
         ::.................................................::
         :: SCC energy                -8.803807260099 Eh    ::
         :: -> isotropic ES            0.002266812893 Eh    ::
         :: -> anisotropic ES         -0.001958635263 Eh    ::
         :: -> anisotropic XC          0.019214142098 Eh    ::
         :: -> dispersion             -0.001430330156 Eh    ::
         :: repulsion energy           0.046642680963 Eh    ::
         :: add. restraining           0.000000000000 Eh    ::
         :::::::::::::::::::::::::::::::::::::::::::::::::::::

      ----------------------------------------------------------- 
     |                   =====================                   |
     |                        A N C O P T                        |
     |                   =====================                   |
     |               Approximate Normal Coordinate               |
     |                Rational Function Optimizer                |
      ----------------------------------------------------------- 

          ...................................................
          :                      SETUP                      :
          :.................................................:
          :   optimization level            normal          :
          :   max. optcycles                   200          :
          :   ANC micro-cycles                  20          :
          :   degrees of freedom                 9          :
          :.................................................:
          :   RF solver                   davidson          :
          :   write xtbopt.log                true          :
          :   linear?                        false          :
          :   energy convergence         0.5000000E-05 Eh   :
          :   grad. convergence          0.1000000E-02 Eh/α :
          :   maximium RF displ.         1.0000000          :
          :   Hlow (freq-cutoff)         0.1000000E-01      :
          :   Hmax (freq-cutoff)         5.0000000          :
          :   S6 in model hess.         20.0000000          :
          ...................................................

generating ANC from model Hessian ...
Using Lindh-Hessian (1995)
 Shifting diagonal of input Hessian by    0.0000000000000000     
 Lowest  eigenvalues of input Hessian
   -0.000000    0.000000    0.000000    0.000000    0.000000    0.000000
    0.011851    0.014755    0.076666    0.113591    0.170755    0.752274
    0.983509    1.065386    1.305104
 Highest eigenvalues
    0.113591    0.170755    0.752274    0.983509    1.065386    1.305104


........................................................................
.............................. CYCLE    1 ..............................
........................................................................
   1     -8.8038073 -0.880381E+01  0.259E-06    0.96       0.0  T
   2     -8.8038073  0.479616E-13  0.299E-06    0.96   14947.1  T
   3     -8.8038073 -0.124345E-13  0.270E-06    0.96   16587.8  T
     SCC iter.                  ...        0 min,  0.001 sec
     gradient                   ...        0 min,  0.001 sec
 * total energy  :    -8.7571646 Eh     change       -0.2239986E-11 Eh
   gradient norm :     0.2457662 Eh/α   predicted     0.0000000E+00 (-100.00%)
   displ. norm   :     0.3755335 α      lambda       -0.6698898E-01
   maximum displ.:     0.1995851 α      in ANC's #1, #4, #8, ...

........................................................................
.............................. CYCLE    2 ..............................
........................................................................
   1     -8.8530756 -0.885308E+01  0.353E+00    1.72       0.0  T
   2     -8.6489185  0.204157E+00  0.606E+00    2.01       1.0  T
   3     -8.8860587 -0.237140E+00  0.126E+00    1.70       1.0  T
   4     -8.8872017 -0.114305E-02  0.912E-01    1.82       1.0  T
   5     -8.8900858 -0.288405E-02  0.189E-01    1.75       1.0  T
   6     -8.8901086 -0.227933E-04  0.502E-02    1.75       1.0  T
   7     -8.8901091 -0.480438E-06  0.849E-03    1.75       5.3  T
   8     -8.8901091 -0.312595E-07  0.659E-03    1.75       6.8  T
   9     -8.8901093 -0.224254E-06  0.986E-04    1.75      45.4  T
  10     -8.8901093 -0.421263E-09  0.356E-04    1.75     125.5  T
     SCC iter.                  ...        0 min,  0.001 sec
     gradient                   ...        0 min,  0.001 sec
 * total energy  :    -8.8177778 Eh     change       -0.6061318E-01 Eh
   gradient norm :     0.1925426 Eh/α   predicted    -0.3821807E-01 ( -36.95%)
   displ. norm   :     0.6827234 α      lambda       -0.1187288E+00
   maximum displ.:     0.3892008 α      in ANC's #8, #6, #7, ...

........................................................................
.............................. CYCLE    3 ..............................
........................................................................
   1     -9.0488457 -0.904885E+01  0.495E+00    4.36       0.0  T
   2     -9.0633450 -0.144992E-01  0.268E+00    3.86       1.0  T
   3     -9.0538059  0.953912E-02  0.207E+00    3.87       1.0  T
   4     -9.0683665 -0.145607E-01  0.105E+00    3.91       1.0  T
   5     -9.0718108 -0.344423E-02  0.119E-01    3.88       1.0  T
   6     -9.0718141 -0.332488E-05  0.451E-02    3.87       1.0  T
   7     -9.0718189 -0.481467E-05  0.780E-03    3.87       5.7  T
   8     -9.0718190 -0.848620E-07  0.235E-03    3.87      19.0  T
   9     -9.0718190 -0.138315E-07  0.102E-03    3.87      44.0  T
  10     -9.0718190 -0.412430E-08  0.112E-04    3.87     400.3  T
  11     -9.0718190  0.358469E-11  0.491E-05    3.87     911.0  T
     SCC iter.                  ...        0 min,  0.001 sec
     gradient                   ...        0 min,  0.001 sec
 * total energy  :    -8.8564315 Eh     change       -0.3865372E-01 Eh
   gradient norm :     0.3334391 Eh/α   predicted    -0.8703476E-01 ( 125.17%)
   displ. norm   :     0.5432776 α      lambda       -0.9551212E-01
   maximum displ.:     0.3882606 α      in ANC's #3, #4, #2, ...

........................................................................
.............................. CYCLE    4 ..............................
........................................................................
   1     -8.9677134 -0.896771E+01  0.301E+00    2.88       0.0  T
   2     -8.9407199  0.269935E-01  0.296E+00    3.05       1.0  T
   3     -8.9735387 -0.328187E-01  0.174E+00    3.14       1.0  T
   4     -8.9881055 -0.145668E-01  0.634E-01    3.02       1.0  T
   5     -8.9885492 -0.443710E-03  0.979E-02    3.02       1.0  T
   6     -8.9885424  0.676441E-05  0.738E-02    3.03       1.0  T
   7     -8.9885614 -0.189294E-04  0.147E-02    3.03       3.0  T
   8     -8.9885621 -0.737973E-06  0.617E-03    3.03       7.2  T
   9     -8.9885624 -0.237366E-06  0.104E-03    3.03      43.2  T
  10     -8.9885624 -0.609647E-08  0.117E-04    3.03     382.1  T
  11     -8.9885624 -0.450431E-10  0.331E-05    3.03    1349.3  T
     SCC iter.                  ...        0 min,  0.001 sec
     gradient                   ...        0 min,  0.001 sec
 * total energy  :    -8.8751822 Eh     change       -0.1875071E-01 Eh
   gradient norm :     0.1753512 Eh/α   predicted    -0.6185131E-01 ( 229.86%)
   displ. norm   :     0.6630274 α      lambda       -0.4048682E-01
   maximum displ.:     0.5052547 α      in ANC's #2, #1, #3, ...

........................................................................
.............................. CYCLE    5 ..............................
........................................................................
   1     -8.9036636 -0.890366E+01  0.448E+00    3.41       0.0  T
   2     -8.6726971  0.230966E+00  0.719E+00    3.04       1.0  T
   3     -8.9761951 -0.303498E+00  0.158E+00    3.19       1.0  T
   4     -8.9814482 -0.525308E-02  0.542E-01    2.98       1.0  T
   5     -8.9817819 -0.333745E-03  0.234E-01    3.01       1.0  T
   6     -8.9819181 -0.136182E-03  0.420E-02    3.03       1.1  T
   7     -8.9819207 -0.256308E-05  0.974E-03    3.02       4.6  T
   8     -8.9819209 -0.194192E-06  0.307E-03    3.02      14.6  T
   9     -8.9819209 -0.124027E-07  0.512E-04    3.02      87.4  T
  10     -8.9819209  0.215380E-09  0.261E-04    3.02     171.1  T
     SCC iter.                  ...        0 min,  0.001 sec
     gradient                   ...        0 min,  0.001 sec
 * total energy  :    -8.8780093 Eh     change       -0.2827059E-02 Eh
   gradient norm :     0.1474239 Eh/α   predicted    -0.2914251E-01 ( 930.84%)
   displ. norm   :     0.4205410 α      lambda       -0.3979039E-01
   maximum displ.:     0.3347670 α      in ANC's #2, #5, #3, ...

........................................................................
.............................. CYCLE    6 ..............................
........................................................................
   1     -9.0452891 -0.904529E+01  0.266E+00    4.51       0.0  T
   2     -9.0271275  0.181616E-01  0.263E+00    4.32       1.0  T
   3     -9.0611565 -0.340290E-01  0.100E+00    4.32       1.0  T
   4     -9.0635966 -0.244008E-02  0.277E-01    4.31       1.0  T
   5     -9.0636837 -0.871004E-04  0.547E-02    4.30       1.0  T
   6     -9.0636839 -0.206029E-06  0.138E-02    4.30       3.2  T
   7     -9.0636844 -0.510345E-06  0.298E-03    4.30      15.0  T
   8     -9.0636844 -0.917862E-08  0.644E-04    4.30      69.5  T
   9     -9.0636844 -0.689976E-09  0.221E-04    4.30     202.6  T
     SCC iter.                  ...        0 min,  0.001 sec
     gradient                   ...        0 min,  0.001 sec
 * total energy  :    -8.8905527 Eh     change       -0.1254342E-01 Eh
   gradient norm :     0.1278426 Eh/α   predicted    -0.2341376E-01 (  86.66%)
   displ. norm   :     0.2736524 α      lambda       -0.1799459E-01
   maximum displ.:     0.1754102 α      in ANC's #3, #4, #5, ...

........................................................................
.............................. CYCLE    7 ..............................
........................................................................
   1     -9.0356300 -0.903563E+01  0.142E+00    3.89       0.0  T
   2     -9.0330413  0.258868E-02  0.115E+00    3.95       1.0  T
   3     -9.0351966 -0.215524E-02  0.855E-01    3.98       1.0  T
   4     -9.0382065 -0.300997E-02  0.197E-01    3.94       1.0  T
   5     -9.0382447 -0.381302E-04  0.361E-02    3.95       1.2  T
   6     -9.0382450 -0.297312E-06  0.133E-02    3.95       3.4  T
   7     -9.0382456 -0.660609E-06  0.212E-03    3.95      21.1  T
   8     -9.0382456 -0.366291E-08  0.529E-04    3.95      84.5  T
   9     -9.0382456 -0.838121E-10  0.155E-04    3.95     288.1  T
     SCC iter.                  ...        0 min,  0.001 sec
     gradient                   ...        0 min,  0.001 sec
 * total energy  :    -8.8969854 Eh     change       -0.6432682E-02 Eh
   gradient norm :     0.0807990 Eh/α   predicted    -0.9671062E-02 (  50.34%)
   displ. norm   :     0.1740761 α      lambda       -0.4868026E-02
   maximum displ.:     0.1411170 α      in ANC's #1, #2, #6, ...

........................................................................
.............................. CYCLE    8 ..............................
........................................................................
   1     -9.0365366 -0.903654E+01  0.105E+00    4.05       0.0  T
   2     -9.0267762  0.976043E-02  0.157E+00    4.03       1.0  T
   3     -9.0413131 -0.145369E-01  0.259E-01    4.01       1.0  T
   4     -9.0414133 -0.100264E-03  0.530E-02    4.01       1.0  T
   5     -9.0414163 -0.294633E-05  0.169E-02    4.01       2.6  T
   6     -9.0414165 -0.264248E-06  0.287E-03    4.01      15.6  T
   7     -9.0414166 -0.249755E-07  0.799E-04    4.01      56.0  T
   8     -9.0414166 -0.395371E-09  0.203E-04    4.01     219.8  T
     SCC iter.                  ...        0 min,  0.001 sec
     gradient                   ...        0 min,  0.001 sec
 * total energy  :    -8.8994808 Eh     change       -0.2495424E-02 Eh
   gradient norm :     0.0343097 Eh/α   predicted    -0.2507767E-02 (   0.49%)
   displ. norm   :     0.3244943 α      lambda       -0.4435839E-02
   maximum displ.:     0.2150687 α      in ANC's #2, #1, #5, ...

........................................................................
.............................. CYCLE    9 ..............................
........................................................................
   1     -9.0546868 -0.905469E+01  0.114E+00    4.24       0.0  T
   2     -9.0541309  0.555936E-03  0.843E-01    4.18       1.0  T
   3     -9.0534705  0.660376E-03  0.659E-01    4.22       1.0  T
   4     -9.0555870 -0.211653E-02  0.755E-02    4.20       1.0  T
   5     -9.0555935 -0.645671E-05  0.376E-02    4.20       1.2  T
   6     -9.0555950 -0.153104E-05  0.574E-03    4.20       7.8  T
   7     -9.0555950 -0.192164E-08  0.203E-03    4.20      22.0  T
   8     -9.0555950 -0.762582E-08  0.532E-04    4.20      84.1  T
   9     -9.0555950 -0.599574E-09  0.959E-05    4.20     466.2  T
     SCC iter.                  ...        0 min,  0.001 sec
     gradient                   ...        0 min,  0.001 sec
 * total energy  :    -8.8975940 Eh     change        0.1886819E-02 Eh
   gradient norm :     0.0778797 Eh/α   predicted    -0.2451458E-02 (-229.93%)
   displ. norm   :     0.2339429 α      lambda       -0.7830832E-02
   maximum displ.:     0.1928891 α      in ANC's #1, #2, #3, ...

........................................................................
.............................. CYCLE   10 ..............................
........................................................................
   1     -9.0557516 -0.905575E+01  0.782E-01    4.33       0.0  T
   2     -9.0545593  0.119227E-02  0.754E-01    4.31       1.0  T
   3     -9.0563590 -0.179969E-02  0.348E-01    4.31       1.0  T
   4     -9.0566465 -0.287543E-03  0.654E-02    4.31       1.0  T
   5     -9.0566548 -0.830183E-05  0.238E-02    4.31       1.9  T
   6     -9.0566554 -0.532361E-06  0.349E-03    4.31      12.8  T
   7     -9.0566554 -0.881718E-08  0.742E-04    4.31      60.3  T
   8     -9.0566554 -0.500734E-09  0.301E-04    4.31     148.5  T
     SCC iter.                  ...        0 min,  0.001 sec
     gradient                   ...        0 min,  0.001 sec
 * total energy  :    -8.9013629 Eh     change       -0.3768983E-02 Eh
   gradient norm :     0.0256782 Eh/α   predicted    -0.4129700E-02 (   9.57%)
   displ. norm   :     0.0600573 α      lambda       -0.1002822E-02
   maximum displ.:     0.0365576 α      in ANC's #5, #6, #7, ...

........................................................................
.............................. CYCLE   11 ..............................
........................................................................
   1     -9.0551923 -0.905519E+01  0.359E-01    4.21       0.0  T
   2     -9.0545657  0.626622E-03  0.436E-01    4.21       1.0  T
   3     -9.0555286 -0.962902E-03  0.136E-01    4.21       1.0  T
   4     -9.0555575 -0.289129E-04  0.219E-02    4.21       2.0  T
   5     -9.0555583 -0.765263E-06  0.820E-03    4.21       5.5  T
   6     -9.0555583 -0.240492E-07  0.192E-03    4.21      23.3  T
   7     -9.0555583 -0.205799E-08  0.337E-04    4.21     132.8  T
   8     -9.0555583 -0.502585E-10  0.123E-04    4.21     363.9  T
     SCC iter.                  ...        0 min,  0.001 sec
     gradient                   ...        0 min,  0.001 sec
 * total energy  :    -8.9015322 Eh     change       -0.1692162E-03 Eh
   gradient norm :     0.0196544 Eh/α   predicted    -0.5032198E-03 ( 197.38%)
   displ. norm   :     0.0702584 α      lambda       -0.6091599E-03
   maximum displ.:     0.0489622 α      in ANC's #2, #5, #6, ...

........................................................................
.............................. CYCLE   12 ..............................
........................................................................
   1     -9.0547485 -0.905475E+01  0.231E-01    4.28       0.0  T
   2     -9.0547570 -0.844630E-05  0.126E-01    4.27       1.0  T
   3     -9.0547135  0.435040E-04  0.963E-02    4.27       1.0  T
   4     -9.0547616 -0.480842E-04  0.196E-02    4.27       2.3  T
   5     -9.0547631 -0.154987E-05  0.618E-03    4.27       7.2  T
   6     -9.0547631 -0.495568E-08  0.120E-03    4.27      37.1  T
   7     -9.0547631 -0.146806E-08  0.341E-04    4.27     131.3  T
   8     -9.0547631 -0.253474E-09  0.815E-05    4.27     548.4  T
     SCC iter.                  ...        0 min,  0.001 sec
     gradient                   ...        0 min,  0.001 sec
 * total energy  :    -8.9018777 Eh     change       -0.3455320E-03 Eh
   gradient norm :     0.0080388 Eh/α   predicted    -0.3060834E-03 ( -11.42%)
   displ. norm   :     0.0360849 α      lambda       -0.2323203E-03
   maximum displ.:     0.0174233 α      in ANC's #5, #4, #6, ...

........................................................................
.............................. CYCLE   13 ..............................
........................................................................
   1     -9.0605171 -0.906052E+01  0.181E-01    4.39       0.0  T
   2     -9.0605351 -0.180335E-04  0.884E-02    4.37       1.0  T
   3     -9.0605182  0.169123E-04  0.802E-02    4.38       1.0  T
   4     -9.0605355 -0.172831E-04  0.339E-02    4.38       1.3  T
   5     -9.0605409 -0.539384E-05  0.487E-03    4.38       9.2  T
   6     -9.0605409 -0.356398E-07  0.721E-04    4.38      62.0  T
   7     -9.0605409 -0.597973E-09  0.165E-04    4.38     270.8  T
     SCC iter.                  ...        0 min,  0.000 sec
     gradient                   ...        0 min,  0.001 sec
 * total energy  :    -8.9019738 Eh     change       -0.9610228E-04 Eh
   gradient norm :     0.0097185 Eh/α   predicted    -0.1163107E-03 (  21.03%)
   displ. norm   :     0.0376625 α      lambda       -0.1166422E-03
   maximum displ.:     0.0257346 α      in ANC's #2, #6, #3, ...

........................................................................
.............................. CYCLE   14 ..............................
........................................................................
   1     -9.0592068 -0.905921E+01  0.159E-01    4.38       0.0  T
   2     -9.0591815  0.252993E-04  0.128E-01    4.37       1.0  T
   3     -9.0591970 -0.155286E-04  0.878E-02    4.38       1.0  T
   4     -9.0592272 -0.301503E-04  0.795E-03    4.38       5.6  T
   5     -9.0592272 -0.704427E-07  0.145E-03    4.38      30.8  T
   6     -9.0592272 -0.155801E-08  0.706E-04    4.38      63.4  T
   7     -9.0592272 -0.719890E-09  0.151E-04    4.38     295.8  T
     SCC iter.                  ...        0 min,  0.000 sec
     gradient                   ...        0 min,  0.001 sec
 * total energy  :    -8.9020521 Eh     change       -0.7826292E-04 Eh
   gradient norm :     0.0036646 Eh/α   predicted    -0.5840592E-04 ( -25.37%)
   displ. norm   :     0.0271371 α      lambda       -0.4822229E-04
   maximum displ.:     0.0160670 α      in ANC's #4, #2, #6, ...

........................................................................
.............................. CYCLE   15 ..............................
........................................................................
   1     -9.0591946 -0.905919E+01  0.120E-01    4.38       0.0  T
   2     -9.0591616  0.329930E-04  0.119E-01    4.37       1.0  T
   3     -9.0592119 -0.502299E-04  0.533E-02    4.38       1.0  T
   4     -9.0592181 -0.620343E-05  0.868E-03    4.38       5.2  T
   5     -9.0592182 -0.886033E-07  0.365E-03    4.38      12.2  T
   6     -9.0592182 -0.236325E-07  0.543E-04    4.38      82.4  T
   7     -9.0592182 -0.160572E-09  0.113E-04    4.38     395.3  T
     SCC iter.                  ...        0 min,  0.001 sec
     gradient                   ...        0 min,  0.001 sec
 * total energy  :    -8.9020809 Eh     change       -0.2882442E-04 Eh
   gradient norm :     0.0015801 Eh/α   predicted    -0.2412966E-04 ( -16.29%)
   displ. norm   :     0.0161792 α      lambda       -0.9057075E-05
   maximum displ.:     0.0140658 α      in ANC's #4, #8, #7, ...

........................................................................
.............................. CYCLE   16 ..............................
........................................................................
   1     -9.0596636 -0.905966E+01  0.663E-02    4.38       0.0  T
   2     -9.0596640 -0.417360E-06  0.361E-02    4.38       1.2  T
   3     -9.0596595  0.442752E-05  0.320E-02    4.38       1.4  T
   4     -9.0596644 -0.483361E-05  0.444E-03    4.38      10.1  T
   5     -9.0596644 -0.690258E-07  0.201E-03    4.38      22.3  T
   6     -9.0596645 -0.893907E-08  0.227E-04    4.38     197.1  T
   7     -9.0596645 -0.164313E-10  0.346E-05    4.38    1293.4  T
     SCC iter.                  ...        0 min,  0.000 sec
     gradient                   ...        0 min,  0.001 sec
 * total energy  :    -8.9020868 Eh     change       -0.5892881E-05 Eh
   gradient norm :     0.0012791 Eh/α   predicted    -0.4528757E-05 ( -23.15%)
   displ. norm   :     0.0094311 α      lambda       -0.2981893E-05
   maximum displ.:     0.0085833 α      in ANC's #1, #2, #7, ...

........................................................................
.............................. CYCLE   17 ..............................
........................................................................
   1     -9.0597354 -0.905974E+01  0.339E-02    4.38       0.0  T
   2     -9.0597342  0.117071E-05  0.247E-02    4.38       1.8  T
   3     -9.0597346 -0.441408E-06  0.213E-02    4.38       2.1  T
   4     -9.0597364 -0.172622E-05  0.172E-03    4.38      25.9  T
   5     -9.0597364 -0.123518E-08  0.530E-04    4.38      84.3  T
   6     -9.0597364 -0.288352E-09  0.740E-05    4.38     604.5  T
     SCC iter.                  ...        0 min,  0.001 sec
     gradient                   ...        0 min,  0.001 sec
 * total energy  :    -8.9020890 Eh     change       -0.2210104E-05 Eh
   gradient norm :     0.0016527 Eh/α   predicted    -0.1491318E-05 ( -32.52%)
   displ. norm   :     0.0083453 α      lambda       -0.1846729E-05
   maximum displ.:     0.0047162 α      in ANC's #2, #1, #4, ...

........................................................................
.............................. CYCLE   18 ..............................
........................................................................
   1     -9.0595972 -0.905960E+01  0.360E-02    4.38       0.0  T
   2     -9.0595958  0.135472E-05  0.285E-02    4.38       1.6  T
   3     -9.0595966 -0.816283E-06  0.206E-02    4.38       2.2  T
   4     -9.0595983 -0.163851E-05  0.137E-03    4.38      32.7  T
   5     -9.0595983 -0.157445E-08  0.602E-04    4.38      74.2  T
   6     -9.0595983 -0.268207E-09  0.124E-04    4.38     361.7  T
     SCC iter.                  ...        0 min,  0.000 sec
     gradient                   ...        0 min,  0.001 sec
 * total energy  :    -8.9020908 Eh     change       -0.1829958E-05 Eh
   gradient norm :     0.0007835 Eh/α   predicted    -0.9223986E-06 ( -49.59%)
   displ. norm   :     0.0080646 α      lambda       -0.1037392E-05
   maximum displ.:     0.0065054 α      in ANC's #1, #2, #7, ...

   *** GEOMETRY OPTIMIZATION CONVERGED AFTER 18 ITERATIONS ***

------------------------------------------------------------------------
 total energy gain   :        -0.1449262 Eh      -90.9426 kcal/mol
 total RMSD          :         0.9073984 a0        0.4802 Å
 total power (kW/mol):       -21.1390980 (step)-9049.9434 (real)
------------------------------------------------------------------------

 ANCopt (total)                0 d,  0 h,  0 min,  0.042 sec
 optimizer setup                ...        0 min,  0.000 sec (  0.179%)
 model hessian                  ...        0 min,  0.000 sec (  0.249%)
 ANC generation                 ...        0 min,  0.000 sec (  0.278%)
 coordinate transformation      ...        0 min,  0.000 sec (  0.095%)
 single point calculation       ...        0 min,  0.040 sec ( 95.307%)
 optimization log               ...        0 min,  0.000 sec (  1.179%)
 hessian update                 ...        0 min,  0.000 sec (  0.121%)
 rational function              ...        0 min,  0.000 sec (  1.138%)

================
 final structure:
================
5
 xtb: 6.2.2 (9d81278992624c895f80dd42a50cac0aa55982e2)
N         0.06729356563614   -0.02550555415466    0.12088239685466
C        -1.03757811600704   -0.42663904892809    0.08452886301539
N         1.27799671864754    0.04443445990962    0.14633321482562
H        -1.98673150310600   -0.21507201374253   -0.32016135707286
H         1.67901933482935    0.62278215691565    0.87362488237720

 Bond Distances (Angstroems)
 ---------------------------
N1-C2=1.1760         N1-N3=1.2130         C2-N1=1.1760         C2-H4=1.0533         N3-N1=1.2130         N3-H5=1.0121         
H4-C2=1.0533         H5-N3=1.0121         
 C  H  Rav=1.0533 sigma=0.0000  Rmin=1.0533  Rmax=1.0533     1
 N  H  Rav=1.0121 sigma=0.0000  Rmin=1.0121  Rmax=1.0121     1
 N  C  Rav=1.1760 sigma=0.0000  Rmin=1.1760  Rmax=1.1760     1
 N  N  Rav=1.2130 sigma=0.0000  Rmin=1.2130  Rmax=1.2130     1

 selected bond angles (degree)
 --------------------
N3-N1-C2=163.35                H4-C2-N1=142.18                H5-N3-N1=116.33                

 selected dihedral angles (degree)
 ---------------------------------
H4-C2-N1-N3=217.68            H5-N3-N1-C2=230.17            
           -------------------------------------------------
          |                Final Singlepoint                |
           -------------------------------------------------

          ...................................................
          :                      SETUP                      :
          :.................................................:
          :  # basis functions                  14          :
          :  # atomic orbitals                  14          :
          :  # shells                            8          :
          :  # electrons                        16          :
          :  max. iterations                   250          :
          :  Hamiltonian                  GFN2-xTB          :
          :  restarted?                      false          :
          :  GBSA solvation                  false          :
          :  PC potential                    false          :
          :  electronic temp.          300.0000000     K    :
          :  accuracy                    1.0000000          :
          :  -> integral cutoff          0.2500000E+02      :
          :  -> integral neglect         0.1000000E-07      :
          :  -> SCF convergence          0.1000000E-05 Eh   :
          :  -> wf. convergence          0.1000000E-03 e    :
          :  Broyden damping             0.4000000          :
          ...................................................

 iter      E             dE          RMSdq      gap      omega  full diag
   1     -9.0595983 -0.905960E+01  0.352E-05    4.38       0.0  T
   2     -9.0595983  0.321521E-12  0.155E-05    4.38    2887.4  T
   3     -9.0595983  0.246381E-11  0.288E-05    4.38    1554.7  T

   *** convergence criteria satisfied after 3 iterations ***

         #    Occupation            Energy/Eh            Energy/eV
      -------------------------------------------------------------
         1        2.0000           -0.6843975             -18.6234
         2        2.0000           -0.6361409             -17.3103
         3        2.0000           -0.5614843             -15.2788
         4        2.0000           -0.5479741             -14.9111
         5        2.0000           -0.5339238             -14.5288
         6        2.0000           -0.5019518             -13.6588
         7        2.0000           -0.3877178             -10.5503
         8        2.0000           -0.3702308             -10.0745 (HOMO)
         9                         -0.2092855              -5.6949 (LUMO)
        10                         -0.2071123              -5.6358
        11                          0.0772083               2.1009
        12                          0.1951714               5.3109
        13                          0.3974477              10.8151
        14                          1.1078486              30.1461
      -------------------------------------------------------------
                  HL-Gap            0.1609453 Eh            4.3795 eV
             Fermi-level           -0.2897581 Eh           -7.8847 eV

 SCC (total)                   0 d,  0 h,  0 min,  0.002 sec
 SCC setup                      ...        0 min,  0.000 sec (  2.804%)
 Dispersion                     ...        0 min,  0.000 sec (  0.457%)
 integral evaluation            ...        0 min,  0.001 sec ( 39.543%)
 zeroth order Hamiltonian       ...        0 min,  0.000 sec (  0.618%)
 iterations                     ...        0 min,  0.000 sec ( 12.884%)
 molecular gradient             ...        0 min,  0.001 sec ( 39.222%)
 printout                       ...        0 min,  0.000 sec (  4.040%)

         :::::::::::::::::::::::::::::::::::::::::::::::::::::
         ::                     SUMMARY                     ::
         :::::::::::::::::::::::::::::::::::::::::::::::::::::
         :: total energy              -8.902090818436 Eh    ::
         :: gradient norm              0.000836452855 Eh/a0 ::
         :: HOMO-LUMO gap              4.379545504846 eV    ::
         ::.................................................::
         :: SCC energy                -9.059598254585 Eh    ::
         :: -> isotropic ES            0.007504311711 Eh    ::
         :: -> anisotropic ES          0.003208156236 Eh    ::
         :: -> anisotropic XC          0.017393845994 Eh    ::
         :: -> dispersion             -0.001430116359 Eh    ::
         :: repulsion energy           0.157507518160 Eh    ::
         :: add. restraining           0.000000000000 Eh    ::
         :::::::::::::::::::::::::::::::::::::::::::::::::::::

           ------------------------------------------------- 
          |                Numerical Hessian                |
           ------------------------------------------------- 
step length          :   0.00500
SCC accuracy         :   0.30000
Hessian scale factor :   1.00000
frozen atoms in %    :   0.00000    0
RMS gradient         :   0.00084
estimated CPU  time      0.00 min
estimated wall time      0.00 min

writing file <hessian>.

 projected vibrational frequencies (cm-1)
eigval :       -0.00    -0.00    -0.00    -0.00     0.00     0.00
eigval :      410.51   473.19   600.14   670.06  1131.72  1373.80
eigval :     2344.17  3324.05  3363.04
           -------------------------------------------------
          |                Property Printout                |
           -------------------------------------------------

    * Orbital Energies and Occupations

         #    Occupation            Energy/Eh            Energy/eV
      -------------------------------------------------------------
         1        2.0000           -0.6843975             -18.6234
         2        2.0000           -0.6361409             -17.3103
         3        2.0000           -0.5614842             -15.2788
         4        2.0000           -0.5479741             -14.9111
         5        2.0000           -0.5339239             -14.5288
         6        2.0000           -0.5019518             -13.6588
         7        2.0000           -0.3877177             -10.5503
         8        2.0000           -0.3702308             -10.0745 (HOMO)
         9                         -0.2092855              -5.6949 (LUMO)
        10                         -0.2071124              -5.6358
        11                          0.0772083               2.1009
        12                          0.1951715               5.3109
        13                          0.3974477              10.8151
        14                          1.1078485              30.1461
      -------------------------------------------------------------
Molecule has no symmetry elements
It seems to be the C1 point group
                  HL-Gap            0.1609453 Eh            4.3795 eV
             Fermi-level           -0.2897582 Eh           -7.8847 eV

     #   Z        covCN         q      C6AA      α(0)
     1   7 N      1.891     0.163    19.105     6.480
     2   6 C      1.849    -0.119    34.464     9.483
     3   7 N      1.851    -0.284    28.213     7.872
     4   1 H      0.928     0.090     1.881     2.145
     5   1 H      0.860     0.150     1.403     1.855

 Mol. C6AA /au·bohr⁶  :        327.090465
 Mol. C8AA /au·bohr⁸  :       7366.356642
 Mol. α(0) /au        :         27.835397


Wiberg/Mayer (AO) data.
largest (>0.10) Wiberg bond orders for each atom
          total WBO             WBO to atom ...
     1  N   3.758        C    2 2.218    N    3 1.529
     2  C   3.833        N    1 2.218    H    4 0.949    N    3 0.607
     3  N   3.086        N    1 1.529    H    5 0.916    C    2 0.607
     4  H   0.992        C    2 0.949
     5  H   0.978        N    3 0.916

MOs/occ written to file <molden.input>


molecular dipole:
                 x           y           z       tot (Debye)
 q only:       -0.294       0.204       0.133
   full:       -0.499       0.457       0.250       1.834
molecular quadrupole (traceless):
                xx          xy          yy          xz          yz          zz
 q only:        0.379       0.675      -0.401       1.261       0.480       0.021
  q+dip:        1.220       1.318      -1.092       3.170       1.019      -0.128
   full:        0.193       1.043      -0.624       2.881       1.100       0.431

           -------------------------------------------------
          |                Geometry Summary                 |
           -------------------------------------------------

      molecular mass/u    :       42.0400238
   center of mass at/Å    :        0.1444063      -0.1058085       0.1264488
  moments of inertia/u·Å² :        0.1116734E+01   0.4404903E+02   0.4442342E+02
rotational constants/cm⁻¹ :        0.1509547E+02   0.3827016E+00   0.3794763E+00

 * 2 selected distances

     #   Z        #   Z                                     value/Å
     1   7 N      2   6 C                                 1.1759979 (min)
     1   7 N      3   7 N                                 1.2129887 (max)

 * 2 distinct bonds (by element types)

   Z      Z             #   av. dist./Å        max./Å        min./Å
   6 C    7 N           1     1.1759979     1.1759979     1.1759979
   7 N    7 N           1     1.2129887     1.2129887     1.2129887

           -------------------------------------------------
          |               Frequency Printout                |
           -------------------------------------------------
 projected vibrational frequencies (cm-1)
eigval :       -0.00    -0.00    -0.00    -0.00     0.00     0.00
eigval :      410.51   473.19   600.14   670.06  1131.72  1373.80
eigval :     2344.17  3324.05  3363.04
 reduced masses (amu)
   1: 12.51   2: 12.89   3: 11.09   4: 10.55   5: 11.24   6:  7.00   7: 10.80   8: 12.28
   9:  2.43  10:  2.32  11:  3.48  12: 12.56  13: 12.83  14:  2.30  15:  1.84
 IR intensities (amu)
   1:  0.17   2:  0.31   3:  0.09   4:  0.18   5:  0.09   6:  0.48   7:  0.17   8:  0.44
   9:  0.57  10:  0.24  11:  0.73  12:  1.04  13:  2.70  14:  0.43  15:  0.05
 Raman intensities (amu)
   1:  0.00   2:  0.00   3:  0.00   4:  0.00   5:  0.00   6:  0.00   7:  0.00   8:  0.00
   9:  0.00  10:  0.00  11:  0.00  12:  0.00  13:  0.00  14:  0.00  15:  0.00
 output can be read by thermo (or use thermo option).
 writing <g98.out> molden fake output.
 recommended (thermochemical) frequency scaling factor: 1.0
           -------------------------------------------------
          |             Thermodynamic Functions             |
           -------------------------------------------------

c1  symmetry found (for desy threshold:  0.10E+00) used in thermo

          ...................................................
          :                      SETUP                      :
          :.................................................:
          :  # frequencies                           9      :
          :  # imaginary freq.                       0      :
          :  linear?                             false      :
          :  only rotor calc.                    false      :
          :  symmetry                               c1      :
          :  rotational number                       1      :
          :  scaling factor                  1.0000000      :
          :  rotor cutoff                   50.0000000 cm⁻¹ :
          :  imag. cutoff                  -20.0000000 cm⁻¹ :
          :.................................................:

    mode    ω/cm⁻¹     T·S(HO)/kcal·mol⁻¹    T·S(FR)/kcal·mol⁻¹   T·S(vib)
   ------------------------------------------------------------------------
   ------------------------------------------------------------------------

   temp. (K)  partition function   enthalpy   heat capacity  entropy
                                   cal/mol     cal/K/mol   cal/K/mol   J/K/mol
 298.15  VIB   1.43                  539.394      5.049      2.522
         ROT  0.357E+04              888.752      2.981     19.238
         INT  0.511E+04             1428.146      8.030     21.760
         TR   0.264E+27             1481.254      4.968     37.118
         TOT                        2909.4003    12.9980    58.8780   246.3454

   temp. (K)  partition function   enthalpy   heat capacity  entropy
                                   cal/mol     cal/K/mol   cal/K/mol   J/K/mol
 120.00  VIB   1.01                   15.192      0.697      0.150
         ROT   912.                  357.707      2.981     16.525
         INT   923.                  372.899      3.677     16.675
         TR   0.673E+26              596.178      4.968     32.599
         TOT                         969.0767     8.6456    49.2740   206.1626

   temp. (K)  partition function   enthalpy   heat capacity  entropy
                                   cal/mol     cal/K/mol   cal/K/mol   J/K/mol
 100.00  VIB   1.00                    5.130      0.330      0.059
         ROT   694.                  298.089      2.981     15.981
         INT   696.                  303.219      3.311     16.041
         TR   0.512E+26              496.815      4.968     31.693
         TOT                         800.0343     8.2792    47.7344   199.7209

   temp. (K)  partition function   enthalpy   heat capacity  entropy
                                   cal/mol     cal/K/mol   cal/K/mol   J/K/mol
  80.00  VIB   1.00                    1.049      0.103      0.015
         ROT   496.                  238.471      2.981     15.316
         INT   497.                  239.520      3.084     15.331
         TR   0.367E+26              397.452      4.968     30.585
         TOT                         636.9725     8.0519    45.9165   192.1147

   temp. (K)  partition function   enthalpy   heat capacity  entropy
                                   cal/mol     cal/K/mol   cal/K/mol   J/K/mol
  60.00  VIB   1.00                    0.079      0.014      0.001
         ROT   322.                  178.853      2.981     14.459
         INT   322.                  178.933      2.994     14.460
         TR   0.238E+26              298.089      4.968     29.157
         TOT                         477.0218     7.9626    43.6169   182.4933

   temp. (K)  partition function   enthalpy   heat capacity  entropy
                                   cal/mol     cal/K/mol   cal/K/mol   J/K/mol
  40.00  VIB   1.00                    0.001      0.000     -0.000
         ROT   175.                  119.236      2.981     13.250
         INT   175.                  119.236      2.981     13.250
         TR   0.130E+26              198.726      4.968     27.143
         TOT                         317.9621     7.9492    40.3933   169.0054

   temp. (K)  partition function   enthalpy   heat capacity  entropy
                                   cal/mol     cal/K/mol   cal/K/mol   J/K/mol
  20.00  VIB   1.00                    0.000      0.000     -0.001
         ROT   62.0                   59.618      2.981     11.184
         INT   62.0                   59.618      2.981     11.183
         TR   0.458E+25               99.363      4.968     23.701
         TOT                         158.9808     7.9490    34.8848   145.9579

   temp. (K)  partition function   enthalpy   heat capacity  entropy
                                   cal/mol     cal/K/mol   cal/K/mol   J/K/mol
  10.00  VIB   1.00                    0.000      0.000     -0.001
         ROT   21.9                   29.809      2.981      9.118
         INT   21.9                   29.809      2.981      9.117
         TR   0.162E+25               49.681      4.968     20.259
         TOT                          79.4904     7.9490    29.3763   122.9105

       T/K    H(0)-H(T)+PV         H(T)/Eh          T*S/Eh         G(T)/Eh
   ------------------------------------------------------------------------
    298.15    0.463642E-02    0.358261E-01    0.279748E-01    0.785126E-02
    120.00    0.154432E-02    0.327340E-01    0.942278E-02    0.233112E-01
    100.00    0.127494E-02    0.324646E-01    0.760697E-02    0.248576E-01
     80.00    0.101508E-02    0.322047E-01    0.585381E-02    0.263509E-01
     60.00    0.760183E-03    0.319498E-01    0.417048E-02    0.277794E-01
     40.00    0.506705E-03    0.316964E-01    0.257483E-02    0.291215E-01
     20.00    0.253352E-03    0.314430E-01    0.111185E-02    0.303312E-01
     10.00    0.126676E-03    0.313163E-01    0.468141E-03    0.308482E-01 (used)
   ------------------------------------------------------------------------

         :::::::::::::::::::::::::::::::::::::::::::::::::::::
         ::                  THERMODYNAMIC                  ::
         :::::::::::::::::::::::::::::::::::::::::::::::::::::
         :: total free energy          -8.871242622347 Eh   ::
         ::.................................................::
         :: total energy               -8.902090818429 Eh   ::
         :: zero point energy           0.031189661338 Eh   ::
         :: G(RRHO) w/o ZPVE           -0.000341465256 Eh   ::
         :: G(RRHO) contrib.            0.030848196082 Eh   ::
         :::::::::::::::::::::::::::::::::::::::::::::::::::::

optimized geometry written to: xtbopt.xyz


           -------------------------------------------------
          | TOTAL ENERGY               -8.902090818429 Eh   |
          | TOTAL ENTHALPY             -8.870774481075 Eh   |
          | TOTAL FREE ENERGY          -8.871242622347 Eh   |
          | GRADIENT NORM               0.000836688913 Eh/α |
          | HOMO-LUMO GAP               4.379544272641 eV   |
           -------------------------------------------------

------------------------------------------------------------------------
 * finished run on 2020/05/12 at 11:45:21.402     
------------------------------------------------------------------------
 total:
 * wall-time:     0 d,  0 h,  0 min,  0.128 sec
 *  cpu-time:     0 d,  0 h,  0 min,  0.128 sec
 * ratio c/w:     0.999 speedup
 SCF:
 * wall-time:     0 d,  0 h,  0 min,  0.003 sec
 *  cpu-time:     0 d,  0 h,  0 min,  0.003 sec
 * ratio c/w:     0.999 speedup
 ANC optimizer:
 * wall-time:     0 d,  0 h,  0 min,  0.045 sec
 *  cpu-time:     0 d,  0 h,  0 min,  0.045 sec
 * ratio c/w:     0.998 speedup
 numerical hessian:
 * wall-time:     0 d,  0 h,  0 min,  0.061 sec
 *  cpu-time:     0 d,  0 h,  0 min,  0.061 sec
 * ratio c/w:     0.999 speedup

