      -----------------------------------------------------------      
     |                   =====================                   |     
     |                           x T B                           |     
     |                   =====================                   |     
     |                         S. Grimme                         |     
     |          Mulliken Center for Theoretical Chemistry        |     
     |                    University of Bonn                     |     
      -----------------------------------------------------------      

   * xtb version 6.2.2 (9d81278992624c895f80dd42a50cac0aa55982e2) compiled by '@Darwin' on 04/03/2020

   xtb is free software: you can redistribute it and/or modify it under
   the terms of the GNU Lesser General Public License as published by
   the Free Software Foundation, either version 3 of the License, or
   (at your option) any later version.
   
   xtb is distributed in the hope that it will be useful,
   but WITHOUT ANY WARRANTY; without even the implied warranty of
   MERCHANTABILITY or FITNESS FOR A PARTICULAR PURPOSE.  See the
   GNU Lesser General Public License for more details.
   
   Cite this work as:
   * S. Grimme, C. Bannwarth, P. Shushkov, J. Chem. Theory Comput., 2017,
     13, 1989-2009. DOI: 10.1021/acs.jctc.7b00118
   * C. Bannwarth, S. Ehlert and S. Grimme., J. Chem. Theory Comput., 2019,
     15, 1652-1671. DOI: 10.1021/acs.jctc.8b01176
   * P. Pracht, E. Caldeweyher, S. Ehlert, S. Grimme, ChemRxiv, 2019, preprint.
     DOI: 10.26434/chemrxiv.8326202.v1
   
   for DFT-D4:
   * E. Caldeweyher, C. Bannwarth and S. Grimme, J. Chem. Phys., 2017,
     147, 034112. DOI: 10.1063/1.4993215
   * E. Caldeweyher, S. Ehlert, A. Hansen, H. Neugebauer, S. Spicher,
     C. Bannwarth and S. Grimme, J. Chem. Phys., 2019, 150, 154122.
     DOI: 10.1063/1.5090222
   
   for sTDA-xTB:
   * S. Grimme and C. Bannwarth, J. Chem. Phys., 2016, 145, 054103.
     DOI: 10.1063/1.4959605
   
   in the mass-spec context:
   * V. Asgeirsson, C. Bauer and S. Grimme, Chem. Sci., 2017, 8, 4879.
     DOI: 10.1039/c7sc00601b
   
   for metadynamics refer to:
   * S. Grimme, J. Chem. Theory Comput., 2019, 155, 2847-2862
     DOI: 10.1021/acs.jctc.9b00143
   
   with help from (in alphabetical order)
   C. Bannwarth, F. Bohle, G. Brandenburg, E. Caldeweyher, M. Checinski,
   S. Dohm, S. Ehlert, S. Ehrlich, F. März, H. Neugebauer, J. Pisarek,
   P. Pracht, P. Shushkov, and S. Spicher.
   
 * started run on 2020/05/12 at 11:45:14.646     

           -------------------------------------------------
          |                Calculation Setup                |
           -------------------------------------------------

          program call               : xtb --input H2C2O1_5_S_0.input H2C2O1_5_S_0.xyz --ohess --molden --namespace H2C2O1_5_S_0 output.out
          calculation namespace      : H2C2O1_5_S_0
          coordinate file            : H2C2O1_5_S_0.xyz
          number of atoms            :                     5
          number of electrons        :                    16
          charge                     :                     0
          spin                       :                   0.0
          first test random number   :      0.06869934785600

   ID    Z sym.   atoms
    1    8 O      1
    2    6 C      2, 3
    3    1 H      4, 5

           -------------------------------------------------
          |                 G F N 2 - x T B                 |
           -------------------------------------------------

        Reference                      10.1021/acs.jctc.8b01176
      * Hamiltonian:
        H0-scaling (s, p, d)           1.850000    2.230000    2.230000
        zeta-weighting                 0.500000
      * Dispersion:
        s8                             2.700000
        a1                             0.520000
        a2                             5.000000
        s9                             5.000000
      * Repulsion:
        kExp                           1.500000    1.000000
        rExp                           1.000000
      * Coulomb:
        alpha                          2.000000
        third order                    shell-resolved
        anisotropic                    true
        a3                             3.000000
        a5                             4.000000
        cn-shift                       1.200000
        cn-exp                         4.000000
        max-rad                        5.000000


          ...................................................
          :                      SETUP                      :
          :.................................................:
          :  # basis functions                  14          :
          :  # atomic orbitals                  14          :
          :  # shells                            8          :
          :  # electrons                        16          :
          :  max. iterations                   250          :
          :  Hamiltonian                  GFN2-xTB          :
          :  restarted?                      false          :
          :  GBSA solvation                  false          :
          :  PC potential                    false          :
          :  electronic temp.          300.0000000     K    :
          :  accuracy                    1.0000000          :
          :  -> integral cutoff          0.2500000E+02      :
          :  -> integral neglect         0.1000000E-07      :
          :  -> SCF convergence          0.1000000E-05 Eh   :
          :  -> wf. convergence          0.1000000E-03 e    :
          :  Broyden damping             0.4000000          :
          ...................................................

 iter      E             dE          RMSdq      gap      omega  full diag
   1     -8.9221043 -0.892210E+01  0.981E+00    1.29       0.0  T
   2     -7.5594639  0.136264E+01  0.141E+01    1.34       1.0  T
   3     -8.7349421 -0.117548E+01  0.883E+00    2.30       1.0  T
   4     -9.0676649 -0.332723E+00  0.315E+00    0.86       1.0  T
   5     -9.0931076 -0.254427E-01  0.365E+00    0.72       1.0  T
   6     -9.0442026  0.489050E-01  0.500E+00    0.75       1.0  T
   7     -8.9282138  0.115989E+00  0.709E+00    0.84       1.0  T
   8     -9.0435826 -0.115369E+00  0.480E+00    0.75       1.0  T
   9     -9.1284122 -0.848296E-01  0.132E+00    0.79       1.0  T
  10     -9.1247262  0.368598E-02  0.156E+00    0.80       1.0  T
  11     -9.1264990 -0.177274E-02  0.135E+00    0.79       1.0  T
  12     -9.1356157 -0.911669E-02  0.314E-01    0.76       1.0  T
  13     -9.1361382 -0.522535E-03  0.570E-02    0.76       1.0  T
  14     -9.1361442 -0.602612E-05  0.484E-02    0.75       1.0  T
  15     -9.1361561 -0.118492E-04  0.362E-03    0.75      12.4  T
  16     -9.1361561  0.753257E-08  0.445E-03    0.75      10.0  T
  17     -9.1361561 -0.209471E-07  0.373E-03    0.75      12.0  T
  18     -9.1361562 -0.697647E-07  0.101E-03    0.75      44.4  T
  19     -9.1361562 -0.434664E-08  0.223E-04    0.75     200.1  T
  20     -9.1361562 -0.262212E-09  0.150E-05    0.75    2977.7  T

   *** convergence criteria satisfied after 20 iterations ***

         #    Occupation            Energy/Eh            Energy/eV
      -------------------------------------------------------------
         1        2.0000           -0.7591200             -20.6567
         2        2.0000           -0.6806940             -18.5226
         3        2.0000           -0.6303036             -17.1514
         4        2.0000           -0.5862018             -15.9514
         5        2.0000           -0.5602899             -15.2463
         6        2.0000           -0.5042543             -13.7215
         7        2.0000           -0.4769878             -12.9795
         8        2.0000           -0.3812410             -10.3741 (HOMO)
         9        0.0000           -0.3534987              -9.6192 (LUMO)
        10                         -0.3454851              -9.4011
        11                          0.0451487               1.2286
        12                          0.1013923               2.7590
        13                          0.1296439               3.5278
        14                          0.1596027               4.3430
      -------------------------------------------------------------
                  HL-Gap            0.0277423 Eh            0.7549 eV
             Fermi-level           -0.3673700 Eh           -9.9966 eV

 SCC (total)                   0 d,  0 h,  0 min,  0.003 sec
 SCC setup                      ...        0 min,  0.000 sec (  2.767%)
 Dispersion                     ...        0 min,  0.000 sec (  0.481%)
 integral evaluation            ...        0 min,  0.001 sec ( 22.497%)
 zeroth order Hamiltonian       ...        0 min,  0.000 sec (  0.502%)
 iterations                     ...        0 min,  0.002 sec ( 47.965%)
 molecular gradient             ...        0 min,  0.001 sec ( 22.815%)
 printout                       ...        0 min,  0.000 sec (  2.675%)

         :::::::::::::::::::::::::::::::::::::::::::::::::::::
         ::                     SUMMARY                     ::
         :::::::::::::::::::::::::::::::::::::::::::::::::::::
         :: total energy              -9.090874798126 Eh    ::
         :: gradient norm              0.156590366396 Eh/a0 ::
         :: HOMO-LUMO gap              0.754905878560 eV    ::
         ::.................................................::
         :: SCC energy                -9.136156159355 Eh    ::
         :: -> isotropic ES           -0.009671568895 Eh    ::
         :: -> anisotropic ES          0.001484316328 Eh    ::
         :: -> anisotropic XC          0.002248974852 Eh    ::
         :: -> dispersion             -0.001447832167 Eh    ::
         :: repulsion energy           0.045281333041 Eh    ::
         :: add. restraining           0.000000000000 Eh    ::
         :::::::::::::::::::::::::::::::::::::::::::::::::::::

      ----------------------------------------------------------- 
     |                   =====================                   |
     |                        A N C O P T                        |
     |                   =====================                   |
     |               Approximate Normal Coordinate               |
     |                Rational Function Optimizer                |
      ----------------------------------------------------------- 

          ...................................................
          :                      SETUP                      :
          :.................................................:
          :   optimization level            normal          :
          :   max. optcycles                   200          :
          :   ANC micro-cycles                  20          :
          :   degrees of freedom                 9          :
          :.................................................:
          :   RF solver                   davidson          :
          :   write xtbopt.log                true          :
          :   linear?                        false          :
          :   energy convergence         0.5000000E-05 Eh   :
          :   grad. convergence          0.1000000E-02 Eh/α :
          :   maximium RF displ.         1.0000000          :
          :   Hlow (freq-cutoff)         0.1000000E-01      :
          :   Hmax (freq-cutoff)         5.0000000          :
          :   S6 in model hess.         20.0000000          :
          ...................................................

generating ANC from model Hessian ...
Using Lindh-Hessian (1995)
 Shifting diagonal of input Hessian by    0.0000000000000000     
 Lowest  eigenvalues of input Hessian
   -0.000000   -0.000000    0.000000    0.000000    0.000000    0.000000
    0.019381    0.069388    0.117989    0.122505    0.159839    0.663178
    0.994183    1.152605    1.378135
 Highest eigenvalues
    0.122505    0.159839    0.663178    0.994183    1.152605    1.378135


........................................................................
.............................. CYCLE    1 ..............................
........................................................................
   1     -9.1361562 -0.913616E+01  0.741E-06    0.75       0.0  T
   2     -9.1361562  0.250466E-10  0.633E-05    0.75     706.8  T
   3     -9.1361562 -0.253255E-10  0.258E-06    0.75   17327.5  T
     SCC iter.                  ...        0 min,  0.000 sec
     gradient                   ...        0 min,  0.001 sec
 * total energy  :    -9.0908748 Eh     change       -0.1093063E-09 Eh
   gradient norm :     0.1565904 Eh/α   predicted     0.0000000E+00 (-100.00%)
   displ. norm   :     0.5644420 α      lambda       -0.6178308E-01
   maximum displ.:     0.4596083 α      in ANC's #2, #5, #8, ...

........................................................................
.............................. CYCLE    2 ..............................
........................................................................
   1     -9.1977697 -0.919777E+01  0.226E+00    1.86       0.0  T
   2     -9.1771187  0.206510E-01  0.208E+00    2.31       1.0  T
   3     -9.1836235 -0.650478E-02  0.208E+00    1.73       1.0  T
   4     -9.2023586 -0.187351E-01  0.871E-02    1.95       1.0  T
   5     -9.2023564  0.222973E-05  0.611E-02    1.94       1.0  T
   6     -9.2023605 -0.417115E-05  0.238E-02    1.95       1.9  T
   7     -9.2023630 -0.251496E-05  0.505E-03    1.95       8.9  T
   8     -9.2023630  0.280607E-07  0.332E-03    1.95      13.5  T
   9     -9.2023631 -0.468256E-07  0.726E-04    1.95      61.6  T
  10     -9.2023631 -0.168899E-08  0.914E-05    1.95     489.2  T
     SCC iter.                  ...        0 min,  0.001 sec
     gradient                   ...        0 min,  0.001 sec
 * total energy  :    -9.1509766 Eh     change       -0.6010184E-01 Eh
   gradient norm :     0.1536417 Eh/α   predicted    -0.4073344E-01 ( -32.23%)
   displ. norm   :     0.9169567 α      lambda       -0.1122336E+00
   maximum displ.:     0.6593381 α      in ANC's #5, #2, #8, ...

........................................................................
.............................. CYCLE    3 ..............................
........................................................................
   1     -9.2964023 -0.929640E+01  0.441E+00    3.15       0.0  T
   2     -9.3027798 -0.637753E-02  0.229E+00    3.34       1.0  T
   3     -9.3026341  0.145770E-03  0.103E+00    3.16       1.0  T
   4     -9.3033526 -0.718573E-03  0.182E-01    3.19       1.0  T
   5     -9.3034775 -0.124900E-03  0.798E-02    3.18       1.0  T
   6     -9.3034815 -0.392250E-05  0.157E-02    3.17       2.8  T
   7     -9.3034818 -0.301689E-06  0.394E-03    3.17      11.3  T
   8     -9.3034818 -0.505889E-07  0.986E-04    3.17      45.3  T
   9     -9.3034818 -0.374552E-09  0.152E-04    3.17     294.0  T
     SCC iter.                  ...        0 min,  0.001 sec
     gradient                   ...        0 min,  0.001 sec
 * total energy  :    -9.2235135 Eh     change       -0.7253687E-01 Eh
   gradient norm :     0.0655463 Eh/α   predicted    -0.1033004E+00 (  42.41%)
   displ. norm   :     0.2214997 α      lambda       -0.1137079E-01
   maximum displ.:     0.1492792 α      in ANC's #5, #2, #8, ...

........................................................................
.............................. CYCLE    4 ..............................
........................................................................
   1     -9.3123811 -0.931238E+01  0.208E+00    3.89       0.0  T
   2     -9.3160547 -0.367355E-02  0.907E-01    3.71       1.0  T
   3     -9.3162053 -0.150642E-03  0.493E-01    3.73       1.0  T
   4     -9.3162394 -0.341200E-04  0.584E-02    3.72       1.0  T
   5     -9.3162441 -0.462597E-05  0.309E-02    3.72       1.4  T
   6     -9.3162455 -0.144119E-05  0.872E-03    3.72       5.1  T
   7     -9.3162455 -0.955670E-08  0.258E-03    3.72      17.3  T
   8     -9.3162455 -0.176644E-07  0.458E-04    3.72      97.5  T
   9     -9.3162455 -0.218847E-10  0.333E-05    3.72    1343.3  T
     SCC iter.                  ...        0 min,  0.001 sec
     gradient                   ...        0 min,  0.001 sec
 * total energy  :    -9.2225379 Eh     change        0.9756275E-03 Eh
   gradient norm :     0.0865949 Eh/α   predicted    -0.5964339E-02 (-711.33%)
   displ. norm   :     0.1688171 α      lambda       -0.1031478E-01
   maximum displ.:     0.1581552 α      in ANC's #2, #8, #9, ...

........................................................................
.............................. CYCLE    5 ..............................
........................................................................
   1     -9.3032005 -0.930320E+01  0.121E+00    3.26       0.0  T
   2     -9.3044594 -0.125890E-02  0.537E-01    3.35       1.0  T
   3     -9.3045222 -0.627522E-04  0.302E-01    3.34       1.0  T
   4     -9.3045382 -0.159814E-04  0.609E-02    3.35       1.0  T
   5     -9.3045507 -0.125533E-04  0.251E-02    3.36       1.8  T
   6     -9.3045511 -0.393454E-06  0.742E-03    3.35       6.0  T
   7     -9.3045512 -0.231996E-07  0.102E-03    3.35      44.0  T
   8     -9.3045512 -0.376921E-08  0.342E-04    3.35     130.6  T
   9     -9.3045512 -0.390159E-10  0.321E-05    3.35    1393.2  T
     SCC iter.                  ...        0 min,  0.001 sec
     gradient                   ...        0 min,  0.001 sec
 * total energy  :    -9.2266359 Eh     change       -0.4098016E-02 Eh
   gradient norm :     0.0292029 Eh/α   predicted    -0.5304367E-02 (  29.44%)
   displ. norm   :     0.0916482 α      lambda       -0.1897349E-02
   maximum displ.:     0.0728168 α      in ANC's #5, #8, #9, ...

........................................................................
.............................. CYCLE    6 ..............................
........................................................................
   1     -9.3150558 -0.931506E+01  0.470E-01    3.36       0.0  T
   2     -9.3151245 -0.687160E-04  0.263E-01    3.37       1.0  T
   3     -9.3151165  0.803616E-05  0.118E-01    3.35       1.0  T
   4     -9.3151362 -0.197798E-04  0.226E-02    3.35       2.0  T
   5     -9.3151374 -0.115977E-05  0.113E-02    3.35       4.0  T
   6     -9.3151375 -0.822337E-07  0.264E-03    3.35      16.9  T
   7     -9.3151375 -0.270230E-08  0.306E-04    3.35     146.2  T
   8     -9.3151375 -0.108431E-09  0.148E-04    3.35     302.5  T
     SCC iter.                  ...        0 min,  0.001 sec
     gradient                   ...        0 min,  0.001 sec
 * total energy  :    -9.2265963 Eh     change        0.3961836E-04 Eh
   gradient norm :     0.0324098 Eh/α   predicted    -0.9566432E-03 (*******%)
   displ. norm   :     0.0525150 α      lambda       -0.1425252E-02
   maximum displ.:     0.0442749 α      in ANC's #5, #2, #3, ...

........................................................................
.............................. CYCLE    7 ..............................
........................................................................
   1     -9.3112379 -0.931124E+01  0.353E-01    3.40       0.0  T
   2     -9.3113138 -0.759247E-04  0.171E-01    3.38       1.0  T
   3     -9.3113169 -0.308308E-05  0.894E-02    3.39       1.0  T
   4     -9.3113190 -0.209841E-05  0.122E-02    3.39       3.7  T
   5     -9.3113194 -0.428288E-06  0.654E-03    3.39       6.8  T
   6     -9.3113195 -0.520308E-07  0.147E-03    3.39      30.3  T
   7     -9.3113195 -0.765839E-09  0.164E-04    3.39     272.5  T
   8     -9.3113195 -0.141256E-10  0.795E-05    3.39     562.7  T
     SCC iter.                  ...        0 min,  0.001 sec
     gradient                   ...        0 min,  0.001 sec
 * total energy  :    -9.2273182 Eh     change       -0.7219163E-03 Eh
   gradient norm :     0.0068998 Eh/α   predicted    -0.7145916E-03 (  -1.01%)
   displ. norm   :     0.0134616 α      lambda       -0.6693210E-04
   maximum displ.:     0.0093622 α      in ANC's #2, #3, #9, ...

........................................................................
.............................. CYCLE    8 ..............................
........................................................................
   1     -9.3114081 -0.931141E+01  0.484E-02    3.39       0.0  T
   2     -9.3114090 -0.916719E-06  0.265E-02    3.39       1.7  T
   3     -9.3114090  0.493165E-07  0.145E-02    3.39       3.1  T
   4     -9.3114092 -0.244354E-06  0.269E-03    3.39      16.6  T
   5     -9.3114092 -0.208954E-07  0.111E-03    3.39      40.3  T
   6     -9.3114092 -0.587756E-09  0.165E-04    3.39     271.8  T
   7     -9.3114092 -0.173035E-10  0.361E-05    3.39    1239.4  T
     SCC iter.                  ...        0 min,  0.001 sec
     gradient                   ...        0 min,  0.001 sec
 * total energy  :    -9.2273699 Eh     change       -0.5170171E-04 Eh
   gradient norm :     0.0039442 Eh/α   predicted    -0.3347218E-04 ( -35.26%)
   displ. norm   :     0.0174971 α      lambda       -0.5022126E-04
   maximum displ.:     0.0106771 α      in ANC's #2, #3, #9, ...

........................................................................
.............................. CYCLE    9 ..............................
........................................................................
   1     -9.3116840 -0.931168E+01  0.537E-02    3.39       0.0  T
   2     -9.3116845 -0.491619E-06  0.320E-02    3.39       1.4  T
   3     -9.3116842  0.274337E-06  0.138E-02    3.39       3.2  T
   4     -9.3116847 -0.447795E-06  0.236E-03    3.39      19.0  T
   5     -9.3116847 -0.580856E-08  0.139E-03    3.39      32.2  T
   6     -9.3116847 -0.148147E-08  0.406E-04    3.39     110.3  T
   7     -9.3116847 -0.539710E-10  0.428E-05    3.39    1044.8  T
     SCC iter.                  ...        0 min,  0.001 sec
     gradient                   ...        0 min,  0.001 sec
 * total energy  :    -9.2273948 Eh     change       -0.2490240E-04 Eh
   gradient norm :     0.0003762 Eh/α   predicted    -0.2511701E-04 (   0.86%)
   displ. norm   :     0.0174977 α      lambda       -0.2908241E-05
   maximum displ.:     0.0172746 α      in ANC's #1, #2, #9, ...

........................................................................
.............................. CYCLE   10 ..............................
........................................................................
   1     -9.3116852 -0.931169E+01  0.616E-02    3.39       0.0  T
   2     -9.3116854 -0.171740E-06  0.384E-02    3.39       1.2  T
   3     -9.3116854 -0.488911E-07  0.470E-03    3.39       9.5  T
   4     -9.3116855 -0.645661E-07  0.226E-03    3.39      19.8  T
   5     -9.3116855 -0.255455E-08  0.660E-04    3.39      67.8  T
   6     -9.3116855 -0.265739E-09  0.251E-04    3.39     178.4  T
     SCC iter.                  ...        0 min,  0.001 sec
     gradient                   ...        0 min,  0.001 sec
 * total energy  :    -9.2273865 Eh     change        0.8261429E-05 Eh
   gradient norm :     0.0014795 Eh/α   predicted    -0.1453422E-05 (-117.59%)
   displ. norm   :     0.0146240 α      lambda       -0.1165156E-04
   maximum displ.:     0.0145584 α      in ANC's #1, #2, #3, ...

........................................................................
.............................. CYCLE   11 ..............................
........................................................................
   1     -9.3116898 -0.931169E+01  0.516E-02    3.39       0.0  T
   2     -9.3116899 -0.109556E-06  0.322E-02    3.39       1.4  T
   3     -9.3116900 -0.732198E-07  0.263E-03    3.39      17.0  T
   4     -9.3116900  0.193655E-09  0.142E-03    3.39      31.4  T
   5     -9.3116900 -0.422966E-08  0.373E-04    3.39     119.9  T
   6     -9.3116900 -0.484270E-10  0.107E-04    3.39     416.7  T
     SCC iter.                  ...        0 min,  0.001 sec
     gradient                   ...        0 min,  0.001 sec
 * total energy  :    -9.2273952 Eh     change       -0.8655078E-05 Eh
   gradient norm :     0.0001472 Eh/α   predicted    -0.5825187E-05 ( -32.70%)
   displ. norm   :     0.0013664 α      lambda       -0.9042341E-07
   maximum displ.:     0.0010785 α      in ANC's #2, #3, #5, ...

........................................................................
.............................. CYCLE   12 ..............................
........................................................................
   1     -9.3117145 -0.931171E+01  0.298E-03    3.39       0.0  T
   2     -9.3117145 -0.386898E-08  0.165E-03    3.39      27.1  T
   3     -9.3117145  0.255138E-09  0.989E-04    3.39      45.2  T
   4     -9.3117145 -0.169875E-08  0.131E-04    3.39     342.5  T
     SCC iter.                  ...        0 min,  0.000 sec
     gradient                   ...        0 min,  0.001 sec
 * total energy  :    -9.2273952 Eh     change       -0.9427955E-08 Eh
   gradient norm :     0.0001360 Eh/α   predicted    -0.4362282E-07 ( 362.70%)
   displ. norm   :     0.0006585 α      lambda       -0.3834241E-07
   maximum displ.:     0.0005370 α      in ANC's #2, #3, #5, ...

   *** GEOMETRY OPTIMIZATION CONVERGED AFTER 12 ITERATIONS ***

------------------------------------------------------------------------
 total energy gain   :        -0.1365204 Eh      -85.6678 kcal/mol
 total RMSD          :         0.6519222 a0        0.3450 Å
 total power (kW/mol):       -29.8695211 (step)********** (real)
------------------------------------------------------------------------

 ANCopt (total)                0 d,  0 h,  0 min,  0.027 sec
 optimizer setup                ...        0 min,  0.000 sec (  0.264%)
 model hessian                  ...        0 min,  0.000 sec (  0.388%)
 ANC generation                 ...        0 min,  0.000 sec (  0.224%)
 coordinate transformation      ...        0 min,  0.000 sec (  0.121%)
 single point calculation       ...        0 min,  0.026 sec ( 95.159%)
 optimization log               ...        0 min,  0.000 sec (  1.228%)
 hessian update                 ...        0 min,  0.000 sec (  0.128%)
 rational function              ...        0 min,  0.000 sec (  1.099%)

================
 final structure:
================
5
 xtb: 6.2.2 (9d81278992624c895f80dd42a50cac0aa55982e2)
O         0.79661122329016   -0.51067050276129    0.64871209520308
C        -0.28052777858649    0.08997769786101   -0.07977745460014
C         1.15534161309073    0.07936300763130   -0.41585376762883
H        -0.95235519827020   -0.61291934059568   -0.55015240612132
H        -0.71906985952421    0.95424813786466    0.39707153314722

 Bond Distances (Angstroems)
 ---------------------------
O1-C2=1.4324         O1-C3=1.2689         C2-O1=1.4324         C2-C3=1.4747         C2-H4=1.0801         C2-H5=1.0801         
C3-O1=1.2689         C3-C2=1.4747         H4-C2=1.0801         H5-C2=1.0801         
 C  H  Rav=1.0801 sigma=0.0000  Rmin=1.0801  Rmax=1.0801     2
 C  C  Rav=1.4747 sigma=0.0000  Rmin=1.4747  Rmax=1.4747     1
 O  C  Rav=1.3506 sigma=0.0817  Rmin=1.2689  Rmax=1.4324     2

 selected bond angles (degree)
 --------------------
C3-O1-C2= 65.85                C3-C2-O1= 51.73                H4-C2-O1=114.60                H4-C2-C3=120.11                
H5-C2-O1=114.60                H5-C2-C3=120.11                H5-C2-H4=117.41                C2-C3-O1= 62.41                

 selected dihedral angles (degree)
 ---------------------------------
H4-C2-O1-C3=109.97            H5-C2-O1-C3=250.03            O1-C3-C2-H4=261.05            O1-C3-C2-H5= 98.95            
           -------------------------------------------------
          |                Final Singlepoint                |
           -------------------------------------------------

          ...................................................
          :                      SETUP                      :
          :.................................................:
          :  # basis functions                  14          :
          :  # atomic orbitals                  14          :
          :  # shells                            8          :
          :  # electrons                        16          :
          :  max. iterations                   250          :
          :  Hamiltonian                  GFN2-xTB          :
          :  restarted?                      false          :
          :  GBSA solvation                  false          :
          :  PC potential                    false          :
          :  electronic temp.          300.0000000     K    :
          :  accuracy                    1.0000000          :
          :  -> integral cutoff          0.2500000E+02      :
          :  -> integral neglect         0.1000000E-07      :
          :  -> SCF convergence          0.1000000E-05 Eh   :
          :  -> wf. convergence          0.1000000E-03 e    :
          :  Broyden damping             0.4000000          :
          ...................................................

 iter      E             dE          RMSdq      gap      omega  full diag
   1     -9.3117145 -0.931171E+01  0.351E-05    3.39       0.0  T
   2     -9.3117145 -0.376588E-12  0.196E-05    3.39    2284.0  T
   3     -9.3117145 -0.817124E-13  0.559E-06    3.39    7999.4  T

   *** convergence criteria satisfied after 3 iterations ***

         #    Occupation            Energy/Eh            Energy/eV
      -------------------------------------------------------------
         1        2.0000           -0.7746948             -21.0805
         2        2.0000           -0.6634443             -18.0532
         3        2.0000           -0.6454159             -17.5627
         4        2.0000           -0.6022368             -16.3877
         5        2.0000           -0.5649730             -15.3737
         6        2.0000           -0.4881399             -13.2830
         7        2.0000           -0.4850362             -13.1985
         8        2.0000           -0.4312933             -11.7361 (HOMO)
         9                         -0.3067118              -8.3461 (LUMO)
        10                         -0.1010861              -2.7507
        11                          0.0630796               1.7165
        12                          0.1662598               4.5242
        13                          0.2463047               6.7023
        14                          0.3944314              10.7330
      -------------------------------------------------------------
                  HL-Gap            0.1245815 Eh            3.3900 eV
             Fermi-level           -0.3690025 Eh          -10.0411 eV

 SCC (total)                   0 d,  0 h,  0 min,  0.002 sec
 SCC setup                      ...        0 min,  0.000 sec (  4.052%)
 Dispersion                     ...        0 min,  0.000 sec (  0.584%)
 integral evaluation            ...        0 min,  0.001 sec ( 39.101%)
 zeroth order Hamiltonian       ...        0 min,  0.000 sec (  0.597%)
 iterations                     ...        0 min,  0.000 sec ( 12.081%)
 molecular gradient             ...        0 min,  0.001 sec ( 40.447%)
 printout                       ...        0 min,  0.000 sec (  2.718%)

         :::::::::::::::::::::::::::::::::::::::::::::::::::::
         ::                     SUMMARY                     ::
         :::::::::::::::::::::::::::::::::::::::::::::::::::::
         :: total energy              -9.227395191837 Eh    ::
         :: gradient norm              0.000135629440 Eh/a0 ::
         :: HOMO-LUMO gap              3.390034487692 eV    ::
         ::.................................................::
         :: SCC energy                -9.311714465169 Eh    ::
         :: -> isotropic ES            0.000529636590 Eh    ::
         :: -> anisotropic ES          0.000964947791 Eh    ::
         :: -> anisotropic XC          0.002541141125 Eh    ::
         :: -> dispersion             -0.001342960104 Eh    ::
         :: repulsion energy           0.084319254206 Eh    ::
         :: add. restraining           0.000000000000 Eh    ::
         :::::::::::::::::::::::::::::::::::::::::::::::::::::

           ------------------------------------------------- 
          |                Numerical Hessian                |
           ------------------------------------------------- 
step length          :   0.00500
SCC accuracy         :   0.30000
Hessian scale factor :   1.00000
frozen atoms in %    :   0.00000    0
RMS gradient         :   0.00014
estimated CPU  time      0.00 min
estimated wall time      0.00 min

writing file <hessian>.

 projected vibrational frequencies (cm-1)
eigval :       -0.00    -0.00    -0.00     0.00     0.00     0.00
eigval :      882.84   943.11   967.86  1096.61  1120.50  1401.43
eigval :     1570.44  3083.19  3102.38
           -------------------------------------------------
          |                Property Printout                |
           -------------------------------------------------

    * Orbital Energies and Occupations

         #    Occupation            Energy/Eh            Energy/eV
      -------------------------------------------------------------
         1        2.0000           -0.7746949             -21.0805
         2        2.0000           -0.6634443             -18.0532
         3        2.0000           -0.6454160             -17.5627
         4        2.0000           -0.6022368             -16.3877
         5        2.0000           -0.5649730             -15.3737
         6        2.0000           -0.4881399             -13.2830
         7        2.0000           -0.4850362             -13.1985
         8        2.0000           -0.4312933             -11.7361 (HOMO)
         9                         -0.3067118              -8.3461 (LUMO)
        10                         -0.1010862              -2.7507
        11                          0.0630796               1.7165
        12                          0.1662597               4.5242
        13                          0.2463047               6.7023
        14                          0.3944314              10.7330
      -------------------------------------------------------------
                  HL-Gap            0.1245815 Eh            3.3900 eV
             Fermi-level           -0.3690026 Eh          -10.0411 eV

     #   Z        covCN         q      C6AA      α(0)
     1   8 O      1.703    -0.133    16.307     5.452
     2   6 C      3.677     0.054    19.880     6.388
     3   6 C      1.833    -0.021    31.726     9.100
     4   1 H      0.926     0.050     2.324     2.384
     5   1 H      0.926     0.050     2.324     2.384

 Mol. C6AA /au·bohr⁶  :        293.350834
 Mol. C8AA /au·bohr⁸  :       6852.042768
 Mol. α(0) /au        :         25.707641


Wiberg/Mayer (AO) data.
largest (>0.10) Wiberg bond orders for each atom
          total WBO             WBO to atom ...
     1  O   2.469        C    3 1.553    C    2 0.880
     2  C   3.815        C    3 0.985    H    5 0.975    H    4 0.975    O    1 0.880
     3  C   2.546        O    1 1.553    C    2 0.985
     4  H   0.998        C    2 0.975
     5  H   0.998        C    2 0.975

MOs/occ written to file <molden.input>


molecular dipole:
                 x           y           z       tot (Debye)
 q only:       -0.431       0.166      -0.168
   full:       -0.785      -0.025       0.235       2.085
molecular quadrupole (traceless):
                xx          xy          yy          xz          yz          zz
 q only:       -0.121       0.244       0.237      -0.243       0.427      -0.116
  q+dip:       -1.326       0.114       1.683       0.820       1.766      -0.357
   full:       -1.602      -0.079       2.045       1.330       2.047      -0.444

           -------------------------------------------------
          |                Geometry Summary                 |
           -------------------------------------------------

      molecular mass/u    :       42.0367582
   center of mass at/Å    :        0.5130688      -0.1377981       0.1016194
  moments of inertia/u·Å² :        0.1278961E+02   0.2018766E+02   0.2954254E+02
rotational constants/cm⁻¹ :        0.1318072E+01   0.8350465E+00   0.5706223E+00

 * 4 selected distances

     #   Z        #   Z                                     value/Å
     1   8 O      2   6 C                                 1.4323769 (max)
     1   8 O      3   6 C                                 1.2689080
     2   6 C      4   1 H                                 1.0801245
     2   6 C      5   1 H                                 1.0801238 (min)

 * 2 distinct bonds (by element types)

   Z      Z             #   av. dist./Å        max./Å        min./Å
   1 H    6 C           2     1.0801242     1.0801245     1.0801238
   6 C    8 O           2     1.3506425     1.4323769     1.2689080

           -------------------------------------------------
Molecule has the following symmetry elements: (sigma) 
It seems to be the Cs point group
          |               Frequency Printout                |
           -------------------------------------------------
 projected vibrational frequencies (cm-1)
eigval :       -0.00    -0.00    -0.00     0.00     0.00     0.00
eigval :      882.84   943.11   967.86  1096.61  1120.50  1401.43
eigval :     1570.44  3083.19  3102.38
 reduced masses (amu)
   1: 11.29   2: 13.14   3: 13.66   4: 13.58   5:  9.70   6: 10.94   7:  3.06   8: 13.26
   9:  5.40  10:  3.23  11: 10.28  12:  2.51  13: 12.54  14:  1.41  15:  2.12
 IR intensities (amu)
   1:  0.07   2:  0.15   3:  0.12   4:  0.21   5:  0.39   6:  0.09   7:  0.17   8:  0.55
   9:  0.58  10:  0.22  11:  0.48  12:  0.34  13:  1.07  14:  0.12  15:  0.24
 Raman intensities (amu)
   1:  0.00   2:  0.00   3:  0.00   4:  0.00   5:  0.00   6:  0.00   7:  0.00   8:  0.00
   9:  0.00  10:  0.00  11:  0.00  12:  0.00  13:  0.00  14:  0.00  15:  0.00
 output can be read by thermo (or use thermo option).
 writing <g98.out> molden fake output.
 recommended (thermochemical) frequency scaling factor: 1.0
           -------------------------------------------------
          |             Thermodynamic Functions             |
           -------------------------------------------------

cs  symmetry found (for desy threshold:  0.10E+00) used in thermo

          ...................................................
          :                      SETUP                      :
          :.................................................:
          :  # frequencies                           9      :
          :  # imaginary freq.                       0      :
          :  linear?                             false      :
          :  only rotor calc.                    false      :
          :  symmetry                               cs      :
          :  rotational number                       1      :
          :  scaling factor                  1.0000000      :
          :  rotor cutoff                   50.0000000 cm⁻¹ :
          :  imag. cutoff                  -20.0000000 cm⁻¹ :
          :.................................................:

    mode    ω/cm⁻¹     T·S(HO)/kcal·mol⁻¹    T·S(FR)/kcal·mol⁻¹   T·S(vib)
   ------------------------------------------------------------------------
   ------------------------------------------------------------------------

   temp. (K)  partition function   enthalpy   heat capacity  entropy
                                   cal/mol     cal/K/mol   cal/K/mol   J/K/mol
 298.15  VIB   1.05                  128.309      2.091      0.521
         ROT  0.667E+04              888.752      2.981     20.480
         INT  0.698E+04             1017.061      5.072     21.001
         TR   0.264E+27             1481.254      4.968     37.118
         TOT                        2498.3149    10.0403    58.1186   243.1681

   temp. (K)  partition function   enthalpy   heat capacity  entropy
                                   cal/mol     cal/K/mol   cal/K/mol   J/K/mol
 120.00  VIB   1.00                    0.133      0.012      0.001
         ROT  0.170E+04              357.707      2.981     17.767
         INT  0.170E+04              357.840      2.993     17.768
         TR   0.673E+26              596.178      4.968     32.599
         TOT                         954.0180     7.9615    50.3668   210.7349

   temp. (K)  partition function   enthalpy   heat capacity  entropy
                                   cal/mol     cal/K/mol   cal/K/mol   J/K/mol
 100.00  VIB   1.00                    0.014      0.002      0.000
         ROT  0.130E+04              298.089      2.981     17.224
         INT  0.130E+04              298.103      2.983     17.224
         TR   0.512E+26              496.815      4.968     31.693
         TOT                         794.9184     7.9510    48.9169   204.6685

   temp. (K)  partition function   enthalpy   heat capacity  entropy
                                   cal/mol     cal/K/mol   cal/K/mol   J/K/mol
  80.00  VIB   1.00                    0.001      0.000     -0.000
         ROT   927.                  238.471      2.981     16.558
         INT   927.                  238.472      2.981     16.558
         TR   0.367E+26              397.452      4.968     30.585
         TOT                         635.9237     7.9491    47.1436   197.2486

   temp. (K)  partition function   enthalpy   heat capacity  entropy
                                   cal/mol     cal/K/mol   cal/K/mol   J/K/mol
  60.00  VIB   1.00                    0.000      0.000     -0.000
         ROT   602.                  178.853      2.981     15.701
         INT   602.                  178.853      2.981     15.701
         TR   0.238E+26              298.089      4.968     29.157
         TOT                         476.9424     7.9490    44.8574   187.6835

   temp. (K)  partition function   enthalpy   heat capacity  entropy
                                   cal/mol     cal/K/mol   cal/K/mol   J/K/mol
  40.00  VIB   1.00                    0.000      0.000     -0.000
         ROT   328.                  119.236      2.981     14.492
         INT   328.                  119.236      2.981     14.492
         TR   0.130E+26              198.726      4.968     27.143
         TOT                         317.9616     7.9490    41.6353   174.2023

   temp. (K)  partition function   enthalpy   heat capacity  entropy
                                   cal/mol     cal/K/mol   cal/K/mol   J/K/mol
  20.00  VIB   1.00                    0.000      0.000     -0.000
         ROT   116.                   59.618      2.981     12.426
         INT   116.                   59.618      2.981     12.426
         TR   0.458E+25               99.363      4.968     23.701
         TOT                         158.9808     7.9490    36.1272   151.1560

   temp. (K)  partition function   enthalpy   heat capacity  entropy
                                   cal/mol     cal/K/mol   cal/K/mol   J/K/mol
  10.00  VIB   1.00                    0.000      0.000     -0.000
         ROT   41.0                   29.809      2.981     10.360
         INT   41.0                   29.809      2.981     10.360
         TR   0.162E+25               49.681      4.968     20.259
         TOT                          79.4904     7.9490    30.6190   128.1097

       T/K    H(0)-H(T)+PV         H(T)/Eh          T*S/Eh         G(T)/Eh
   ------------------------------------------------------------------------
    298.15    0.398132E-02    0.362592E-01    0.276140E-01    0.864519E-02
    120.00    0.152032E-02    0.337982E-01    0.963176E-02    0.241665E-01
    100.00    0.126678E-02    0.335447E-01    0.779541E-02    0.257493E-01
     80.00    0.101341E-02    0.332913E-01    0.601024E-02    0.272811E-01
     60.00    0.760056E-03    0.330379E-01    0.428909E-02    0.287489E-01
     40.00    0.506704E-03    0.327846E-01    0.265401E-02    0.301306E-01
     20.00    0.253352E-03    0.325312E-01    0.115145E-02    0.313798E-01
     10.00    0.126676E-03    0.324046E-01    0.487944E-03    0.319166E-01 (used)
   ------------------------------------------------------------------------

         :::::::::::::::::::::::::::::::::::::::::::::::::::::
         ::                  THERMODYNAMIC                  ::
         :::::::::::::::::::::::::::::::::::::::::::::::::::::
         :: total free energy          -9.195478569952 Eh   ::
         ::.................................................::
         :: total energy               -9.227395192017 Eh   ::
         :: zero point energy           0.032277890117 Eh   ::
         :: G(RRHO) w/o ZPVE           -0.000361268052 Eh   ::
         :: G(RRHO) contrib.            0.031916622064 Eh   ::
         :::::::::::::::::::::::::::::::::::::::::::::::::::::

optimized geometry written to: xtbopt.xyz


           -------------------------------------------------
          | TOTAL ENERGY               -9.227395192017 Eh   |
          | TOTAL ENTHALPY             -9.194990625884 Eh   |
          | TOTAL FREE ENERGY          -9.195478569952 Eh   |
          | GRADIENT NORM               0.000135592485 Eh/α |
          | HOMO-LUMO GAP               3.390035017429 eV   |
           -------------------------------------------------

------------------------------------------------------------------------
 * finished run on 2020/05/12 at 11:45:14.757     
------------------------------------------------------------------------
 total:
 * wall-time:     0 d,  0 h,  0 min,  0.110 sec
 *  cpu-time:     0 d,  0 h,  0 min,  0.110 sec
 * ratio c/w:     0.999 speedup
 SCF:
 * wall-time:     0 d,  0 h,  0 min,  0.003 sec
 *  cpu-time:     0 d,  0 h,  0 min,  0.003 sec
 * ratio c/w:     1.000 speedup
 ANC optimizer:
 * wall-time:     0 d,  0 h,  0 min,  0.029 sec
 *  cpu-time:     0 d,  0 h,  0 min,  0.029 sec
 * ratio c/w:     0.999 speedup
 numerical hessian:
 * wall-time:     0 d,  0 h,  0 min,  0.060 sec
 *  cpu-time:     0 d,  0 h,  0 min,  0.060 sec
 * ratio c/w:     0.998 speedup

