      -----------------------------------------------------------      
     |                   =====================                   |     
     |                           x T B                           |     
     |                   =====================                   |     
     |                         S. Grimme                         |     
     |          Mulliken Center for Theoretical Chemistry        |     
     |                    University of Bonn                     |     
      -----------------------------------------------------------      

   * xtb version 6.2.2 (9d81278992624c895f80dd42a50cac0aa55982e2) compiled by '@Darwin' on 04/03/2020

   xtb is free software: you can redistribute it and/or modify it under
   the terms of the GNU Lesser General Public License as published by
   the Free Software Foundation, either version 3 of the License, or
   (at your option) any later version.
   
   xtb is distributed in the hope that it will be useful,
   but WITHOUT ANY WARRANTY; without even the implied warranty of
   MERCHANTABILITY or FITNESS FOR A PARTICULAR PURPOSE.  See the
   GNU Lesser General Public License for more details.
   
   Cite this work as:
   * S. Grimme, C. Bannwarth, P. Shushkov, J. Chem. Theory Comput., 2017,
     13, 1989-2009. DOI: 10.1021/acs.jctc.7b00118
   * C. Bannwarth, S. Ehlert and S. Grimme., J. Chem. Theory Comput., 2019,
     15, 1652-1671. DOI: 10.1021/acs.jctc.8b01176
   * P. Pracht, E. Caldeweyher, S. Ehlert, S. Grimme, ChemRxiv, 2019, preprint.
     DOI: 10.26434/chemrxiv.8326202.v1
   
   for DFT-D4:
   * E. Caldeweyher, C. Bannwarth and S. Grimme, J. Chem. Phys., 2017,
     147, 034112. DOI: 10.1063/1.4993215
   * E. Caldeweyher, S. Ehlert, A. Hansen, H. Neugebauer, S. Spicher,
     C. Bannwarth and S. Grimme, J. Chem. Phys., 2019, 150, 154122.
     DOI: 10.1063/1.5090222
   
   for sTDA-xTB:
   * S. Grimme and C. Bannwarth, J. Chem. Phys., 2016, 145, 054103.
     DOI: 10.1063/1.4959605
   
   in the mass-spec context:
   * V. Asgeirsson, C. Bauer and S. Grimme, Chem. Sci., 2017, 8, 4879.
     DOI: 10.1039/c7sc00601b
   
   for metadynamics refer to:
   * S. Grimme, J. Chem. Theory Comput., 2019, 155, 2847-2862
     DOI: 10.1021/acs.jctc.9b00143
   
   with help from (in alphabetical order)
   C. Bannwarth, F. Bohle, G. Brandenburg, E. Caldeweyher, M. Checinski,
   S. Dohm, S. Ehlert, S. Ehrlich, F. März, H. Neugebauer, J. Pisarek,
   P. Pracht, P. Shushkov, and S. Spicher.
   
 * started run on 2020/05/12 at 11:45:07.598     

           -------------------------------------------------
          |                Calculation Setup                |
           -------------------------------------------------

          program call               : xtb --input H1C4_0_S_1.input H1C4_0_S_1.xyz --ohess --molden --namespace H1C4_0_S_1 output.out
          calculation namespace      : H1C4_0_S_1
          coordinate file            : H1C4_0_S_1.xyz
          number of atoms            :                     5
          number of electrons        :                    17
          charge                     :                     0
          spin                       :                   0.5
          first test random number   :      0.43128143833198

   ID    Z sym.   atoms
    1    6 C      1-4
    2    1 H      5

           -------------------------------------------------
          |                 G F N 2 - x T B                 |
           -------------------------------------------------

        Reference                      10.1021/acs.jctc.8b01176
      * Hamiltonian:
        H0-scaling (s, p, d)           1.850000    2.230000    2.230000
        zeta-weighting                 0.500000
      * Dispersion:
        s8                             2.700000
        a1                             0.520000
        a2                             5.000000
        s9                             5.000000
      * Repulsion:
        kExp                           1.500000    1.000000
        rExp                           1.000000
      * Coulomb:
        alpha                          2.000000
        third order                    shell-resolved
        anisotropic                    true
        a3                             3.000000
        a5                             4.000000
        cn-shift                       1.200000
        cn-exp                         4.000000
        max-rad                        5.000000


          ...................................................
          :                      SETUP                      :
          :.................................................:
          :  # basis functions                  17          :
          :  # atomic orbitals                  17          :
          :  # shells                            9          :
          :  # electrons                        17          :
          :  max. iterations                   250          :
          :  Hamiltonian                  GFN2-xTB          :
          :  restarted?                      false          :
          :  GBSA solvation                  false          :
          :  PC potential                    false          :
          :  electronic temp.          300.0000000     K    :
          :  accuracy                    1.0000000          :
          :  -> integral cutoff          0.2500000E+02      :
          :  -> integral neglect         0.1000000E-07      :
          :  -> SCF convergence          0.1000000E-05 Eh   :
          :  -> wf. convergence          0.1000000E-03 e    :
          :  Broyden damping             0.4000000          :
          ...................................................

 iter      E             dE          RMSdq      gap      omega  full diag
   1     -8.3941616 -0.839416E+01  0.125E+01    0.51       0.0  T
   2     -6.2556820  0.213848E+01  0.157E+01    0.22       1.0  T
   3     -7.0601427 -0.804461E+00  0.135E+01    1.23       1.0  T
   4     -8.3154465 -0.125530E+01  0.731E+00    0.30       1.0  T
   5     -7.3200446  0.995402E+00  0.125E+01    0.90       1.0  T
   6     -8.5293926 -0.120935E+01  0.418E+00    0.26       1.0  T
   7     -8.5358194 -0.642681E-02  0.394E+00    0.23       1.0  T
   8     -8.5642739 -0.284546E-01  0.278E+00    0.16       1.0  T
   9     -8.5707389 -0.646491E-02  0.129E+00    0.06       1.0  T
  10     -8.5702159  0.522918E-03  0.123E+00    0.07       1.0  T
  11     -8.5712623 -0.104638E-02  0.531E-01    0.06       1.0  T
  12     -8.5718099 -0.547617E-03  0.353E-01    0.07       1.0  T
  13     -8.5722777 -0.467734E-03  0.138E-01    0.08       1.0  T
  14     -8.5722927 -0.150415E-04  0.121E-01    0.08       1.0  T
  15     -8.5722954 -0.272306E-05  0.966E-02    0.08       1.0  T
  16     -8.5722950  0.452005E-06  0.284E-02    0.08       1.6  T
  17     -8.5722977 -0.272438E-05  0.108E-02    0.08       4.1  T
  18     -8.5722980 -0.300629E-06  0.552E-03    0.08       8.1  T
  19     -8.5722981 -0.109728E-06  0.148E-03    0.08      30.2  T
  20     -8.5722981 -0.921138E-08  0.849E-04    0.08      52.7  T
  21     -8.5722981 -0.265764E-08  0.240E-04    0.08     186.0  T

   *** convergence criteria satisfied after 21 iterations ***

         #    Occupation            Energy/Eh            Energy/eV
      -------------------------------------------------------------
         1        2.0000           -0.6986370             -19.0109
       ...           ...                  ...                  ...
         3        2.0000           -0.6389891             -17.3878
         4        2.0000           -0.5513821             -15.0039
         5        2.0000           -0.5206568             -14.1678
         6        2.0000           -0.4956639             -13.4877
         7        2.0000           -0.4895367             -13.3210
         8        1.9997           -0.4266892             -11.6108
         9        0.8276           -0.4115172             -11.1980 (HOMO)
        10        0.1727           -0.4085406             -11.1170 (LUMO)
        11                         -0.3843007             -10.4574
        12                         -0.3727293             -10.1425
        13                         -0.3032871              -8.2529
        14                          0.0585242               1.5925
       ...                                ...                  ...
        17                          0.1476988               4.0191
      -------------------------------------------------------------
                  HL-Gap            0.0029766 Eh            0.0810 eV
             Fermi-level           -0.4145762 Eh          -11.2812 eV

 SCC (total)                   0 d,  0 h,  0 min,  0.005 sec
 SCC setup                      ...        0 min,  0.000 sec (  1.943%)
 Dispersion                     ...        0 min,  0.000 sec (  0.422%)
 integral evaluation            ...        0 min,  0.001 sec ( 23.197%)
 zeroth order Hamiltonian       ...        0 min,  0.000 sec (  0.411%)
 iterations                     ...        0 min,  0.002 sec ( 47.841%)
 molecular gradient             ...        0 min,  0.001 sec ( 23.681%)
 printout                       ...        0 min,  0.000 sec (  2.271%)

         :::::::::::::::::::::::::::::::::::::::::::::::::::::
         ::                     SUMMARY                     ::
         :::::::::::::::::::::::::::::::::::::::::::::::::::::
         :: total energy              -8.513575742167 Eh    ::
         :: gradient norm              0.187684866813 Eh/a0 ::
         :: HOMO-LUMO gap              0.080997148284 eV    ::
         ::.................................................::
         :: SCC energy                -8.572298127094 Eh    ::
         :: -> isotropic ES           -0.036488691043 Eh    ::
         :: -> anisotropic ES         -0.001475824631 Eh    ::
         :: -> anisotropic XC          0.012206863082 Eh    ::
         :: -> dispersion             -0.002374492921 Eh    ::
         :: repulsion energy           0.058722233192 Eh    ::
         :: add. restraining           0.000000000000 Eh    ::
         :::::::::::::::::::::::::::::::::::::::::::::::::::::

      ----------------------------------------------------------- 
     |                   =====================                   |
     |                        A N C O P T                        |
     |                   =====================                   |
     |               Approximate Normal Coordinate               |
     |                Rational Function Optimizer                |
      ----------------------------------------------------------- 

          ...................................................
          :                      SETUP                      :
          :.................................................:
          :   optimization level            normal          :
          :   max. optcycles                   200          :
          :   ANC micro-cycles                  20          :
          :   degrees of freedom                 9          :
          :.................................................:
          :   RF solver                   davidson          :
          :   write xtbopt.log                true          :
          :   linear?                        false          :
          :   energy convergence         0.5000000E-05 Eh   :
          :   grad. convergence          0.1000000E-02 Eh/α :
          :   maximium RF displ.         1.0000000          :
          :   Hlow (freq-cutoff)         0.1000000E-01      :
          :   Hmax (freq-cutoff)         5.0000000          :
          :   S6 in model hess.         20.0000000          :
          ...................................................

generating ANC from model Hessian ...
Using Lindh-Hessian (1995)
 Shifting diagonal of input Hessian by    0.0000000000000000     
 Lowest  eigenvalues of input Hessian
   -0.000000   -0.000000   -0.000000    0.000000    0.000000    0.000000
    0.010663    0.038709    0.058407    0.066415    0.098242    0.569240
    0.790728    0.983678    1.033672
 Highest eigenvalues
    0.066415    0.098242    0.569240    0.790728    0.983678    1.033672


........................................................................
.............................. CYCLE    1 ..............................
........................................................................
   1     -8.5722981 -0.857230E+01  0.495E-05    0.08       0.0  T
   2     -8.5722981  0.119387E-08  0.362E-04    0.08     123.5  T
   3     -8.5722981 -0.120315E-08  0.288E-05    0.08    1553.2  T
     SCC iter.                  ...        0 min,  0.001 sec
     gradient                   ...        0 min,  0.001 sec
 * total energy  :    -8.5135757 Eh     change        0.4163034E-09 Eh
   gradient norm :     0.1876852 Eh/α   predicted     0.0000000E+00 (-100.00%)
   displ. norm   :     0.3473421 α      lambda       -0.5764643E-01
   maximum displ.:     0.2824483 α      in ANC's #6, #2, #4, ...

........................................................................
.............................. CYCLE    2 ..............................
........................................................................
   1     -8.6421880 -0.864219E+01  0.249E+00    0.08       0.0  T
   2     -8.4253705  0.216818E+00  0.509E+00    0.77       1.0  T
   3     -8.6107092 -0.185339E+00  0.258E+00    0.13       1.0  T
   4     -8.4017460  0.208963E+00  0.569E+00    0.13       1.0  T
   5     -8.6450490 -0.243303E+00  0.148E+00    0.26       1.0  T
   6     -8.6556645 -0.106155E-01  0.832E-01    0.19       1.0  T
   7     -8.6559531 -0.288651E-03  0.671E-01    0.16       1.0  T
   8     -8.6580279 -0.207480E-02  0.386E-01    0.15       1.0  T
   9     -8.6587086 -0.680690E-03  0.149E-01    0.13       1.0  T
  10     -8.6587064  0.226285E-05  0.150E-01    0.13       1.0  T
  11     -8.6588131 -0.106751E-03  0.180E-02    0.12       2.5  T
  12     -8.6588143 -0.115216E-05  0.100E-02    0.12       4.5  T
  13     -8.6588147 -0.405265E-06  0.440E-03    0.12      10.2  T
  14     -8.6588148 -0.103898E-06  0.111E-03    0.12      40.3  T
  15     -8.6588148 -0.554383E-08  0.422E-04    0.12     105.9  T
  16     -8.6588148 -0.502988E-09  0.152E-04    0.12     294.3  T
     SCC iter.                  ...        0 min,  0.001 sec
     gradient                   ...        0 min,  0.001 sec
 * total energy  :    -8.5584842 Eh     change       -0.4490844E-01 Eh
   gradient norm :     0.0938402 Eh/α   predicted    -0.3230064E-01 ( -28.07%)
   displ. norm   :     0.6481112 α      lambda       -0.4683934E-01
   maximum displ.:     0.3649541 α      in ANC's #4, #6, #3, ...

........................................................................
.............................. CYCLE    3 ..............................
........................................................................
   1     -8.6611101 -0.866111E+01  0.473E+00    0.40       0.0  T
   2     -7.6315978  0.102951E+01  0.109E+01    1.04       1.0  T
   3     -8.7356842 -0.110409E+01  0.242E+00    0.53       1.0  T
   4     -8.7035962  0.320881E-01  0.257E+00    0.15       1.0  T
   5     -8.7005960  0.300014E-02  0.235E+00    0.72       1.0  T
   6     -8.7471638 -0.465678E-01  0.819E-01    0.52       1.0  T
   7     -8.7477954 -0.631671E-03  0.459E-01    0.52       1.0  T
   8     -8.7481376 -0.342175E-03  0.713E-02    0.50       1.0  T
   9     -8.7481414 -0.379390E-05  0.407E-02    0.50       1.1  T
  10     -8.7481451 -0.366519E-05  0.184E-02    0.50       2.4  T
  11     -8.7481459 -0.828309E-06  0.459E-03    0.50       9.7  T
  12     -8.7481459 -0.204892E-07  0.255E-03    0.50      17.5  T
  13     -8.7481459 -0.115057E-07  0.151E-03    0.50      29.7  T
  14     -8.7481459 -0.683691E-08  0.165E-04    0.50     270.5  T
  15     -8.7481459  0.914646E-11  0.108E-04    0.50     415.2  T
     SCC iter.                  ...        0 min,  0.001 sec
     gradient                   ...        0 min,  0.001 sec
 * total energy  :    -8.5928071 Eh     change       -0.3432296E-01 Eh
   gradient norm :     0.1335626 Eh/α   predicted    -0.3325706E-01 (  -3.11%)
   displ. norm   :     0.6441338 α      lambda       -0.3698033E-01
   maximum displ.:     0.3465128 α      in ANC's #3, #4, #2, ...

........................................................................
.............................. CYCLE    4 ..............................
........................................................................
   1     -8.7462649 -0.874626E+01  0.257E+00    0.74       0.0  T
   2     -8.6630550  0.832099E-01  0.376E+00    1.50       1.0  T
   3     -8.7477268 -0.846719E-01  0.166E+00    0.91       1.0  T
   4     -8.7045489  0.431779E-01  0.265E+00    0.70       1.0  T
   5     -8.7588891 -0.543402E-01  0.255E-01    0.96       1.0  T
   6     -8.7591457 -0.256563E-03  0.896E-02    0.93       1.0  T
   7     -8.7591407  0.495046E-05  0.509E-02    0.93       1.0  T
   8     -8.7591531 -0.124079E-04  0.186E-02    0.93       2.4  T
   9     -8.7591546 -0.152594E-05  0.471E-03    0.93       9.5  T
  10     -8.7591547 -0.695324E-07  0.146E-03    0.93      30.6  T
  11     -8.7591547 -0.173257E-08  0.229E-04    0.93     195.0  T
  12     -8.7591547 -0.111461E-09  0.108E-04    0.93     412.8  T
     SCC iter.                  ...        0 min,  0.001 sec
     gradient                   ...        0 min,  0.001 sec
 * total energy  :    -8.6190373 Eh     change       -0.2623020E-01 Eh
   gradient norm :     0.1301002 Eh/α   predicted    -0.2616193E-01 (  -0.26%)
   displ. norm   :     0.5363233 α      lambda       -0.4230578E-01
   maximum displ.:     0.3347899 α      in ANC's #4, #8, #6, ...

........................................................................
.............................. CYCLE    5 ..............................
........................................................................
   1     -8.7822417 -0.878224E+01  0.304E+00    1.24       0.0  T
   2     -8.7322373  0.500045E-01  0.300E+00    1.30       1.0  T
   3     -8.7577485 -0.255112E-01  0.254E+00    1.40       1.0  T
   4     -8.7919749 -0.342264E-01  0.318E-01    1.20       1.0  T
   5     -8.7923180 -0.343063E-03  0.165E-01    1.24       1.0  T
   6     -8.7923712 -0.531907E-04  0.114E-01    1.22       1.0  T
   7     -8.7923420  0.292037E-04  0.963E-02    1.24       1.0  T
   8     -8.7923828 -0.408686E-04  0.136E-02    1.22       3.3  T
   9     -8.7923832 -0.375546E-06  0.162E-03    1.22      27.6  T
  10     -8.7923832 -0.345958E-08  0.997E-04    1.22      44.9  T
  11     -8.7923832 -0.266908E-08  0.853E-05    1.22     524.4  T
     SCC iter.                  ...        0 min,  0.001 sec
     gradient                   ...        0 min,  0.001 sec
 * total energy  :    -8.6559711 Eh     change       -0.3693378E-01 Eh
   gradient norm :     0.1000305 Eh/α   predicted    -0.2723738E-01 ( -26.25%)
   displ. norm   :     0.8268213 α      lambda       -0.6548205E-01
   maximum displ.:     0.4873617 α      in ANC's #4, #8, #6, ...

........................................................................
.............................. CYCLE    6 ..............................
........................................................................
   1     -8.8113912 -0.881139E+01  0.496E+00    1.49       0.0  T
   2     -8.7911164  0.202747E-01  0.357E+00    0.74       1.0  T
   3     -8.8011684 -0.100520E-01  0.287E+00    1.38       1.0  T
   4     -8.8337896 -0.326212E-01  0.425E-01    1.22       1.0  T
   5     -8.8344876 -0.697938E-03  0.168E-01    1.12       1.0  T
   6     -8.8345590 -0.714560E-04  0.119E-01    1.11       1.0  T
   7     -8.8345938 -0.348032E-04  0.455E-02    1.12       1.0  T
   8     -8.8345983 -0.442673E-05  0.104E-02    1.11       4.3  T
   9     -8.8345984 -0.990770E-07  0.306E-03    1.11      14.6  T
  10     -8.8345984 -0.111809E-07  0.104E-03    1.11      42.9  T
  11     -8.8345984 -0.238257E-08  0.120E-04    1.11     371.8  T
  12     -8.8345984 -0.777334E-11  0.178E-05    1.11    2505.9  T
     SCC iter.                  ...        0 min,  0.001 sec
     gradient                   ...        0 min,  0.001 sec
 * total energy  :    -8.7047257 Eh     change       -0.4875460E-01 Eh
   gradient norm :     0.0603482 Eh/α   predicted    -0.5512386E-01 (  13.06%)
   displ. norm   :     0.7401955 α      lambda       -0.3109217E-01
   maximum displ.:     0.3423325 α      in ANC's #3, #4, #2, ...

........................................................................
.............................. CYCLE    7 ..............................
........................................................................
   1     -8.8727011 -0.887270E+01  0.581E+00    2.77       0.0  T
   2     -8.8290721  0.436289E-01  0.469E+00    3.02       1.0  T
   3     -8.8623997 -0.333276E-01  0.352E+00    2.81       1.0  T
   4     -8.8985367 -0.361370E-01  0.164E+00    2.73       1.0  T
   5     -8.9103575 -0.118208E-01  0.723E-01    2.72       1.0  T
   6     -8.9106321 -0.274628E-03  0.617E-01    2.72       1.0  T
   7     -8.9109389 -0.306821E-03  0.389E-01    2.72       1.0  T
   8     -8.9111760 -0.237094E-03  0.249E-02    2.72       1.8  T
   9     -8.9111762 -0.183024E-06  0.139E-02    2.72       3.2  T
  10     -8.9111766 -0.380114E-06  0.307E-03    2.72      14.5  T
  11     -8.9111766 -0.452982E-08  0.143E-03    2.72      31.3  T
  12     -8.9111766 -0.108415E-08  0.209E-04    2.72     214.3  T
  13     -8.9111766 -0.253984E-10  0.344E-05    2.72    1299.3  T
     SCC iter.                  ...        0 min,  0.001 sec
     gradient                   ...        0 min,  0.001 sec
 * total energy  :    -8.6127998 Eh     change        0.9192593E-01 Eh
   gradient norm :     0.7463634 Eh/α   predicted    -0.2406362E-01 (-126.18%)
   displ. norm   :     0.4195941 α      lambda       -0.2822544E+00
   maximum displ.:     0.2163072 α      in ANC's #2, #3, #5, ...

........................................................................
.............................. CYCLE    8 ..............................
........................................................................
   1     -8.8374867 -0.883749E+01  0.398E+00    1.30       0.0  T
   2     -8.8122771  0.252096E-01  0.299E+00    0.77       1.0  T
   3     -8.8236801 -0.114030E-01  0.266E+00    1.26       1.0  T
   4     -8.8416589 -0.179788E-01  0.139E+00    1.17       1.0  T
   5     -8.8518036 -0.101447E-01  0.296E-01    1.01       1.0  T
   6     -8.8518703 -0.666912E-04  0.211E-01    1.00       1.0  T
   7     -8.8519233 -0.530654E-04  0.183E-02    0.98       2.4  T
   8     -8.8519246 -0.121209E-05  0.888E-03    0.98       5.0  T
   9     -8.8519247 -0.192207E-06  0.221E-03    0.98      20.2  T
  10     -8.8519247 -0.158286E-08  0.932E-04    0.98      48.0  T
  11     -8.8519247 -0.713625E-09  0.286E-04    0.98     156.5  T
     SCC iter.                  ...        0 min,  0.001 sec
     gradient                   ...        0 min,  0.001 sec
 * total energy  :    -8.7106556 Eh     change       -0.9785578E-01 Eh
   gradient norm :     0.0561535 Eh/α   predicted    -0.1659740E+00 (  69.61%)
   displ. norm   :     0.4119609 α      lambda       -0.1318661E-01
   maximum displ.:     0.2980797 α      in ANC's #4, #5, #2, ...

........................................................................
.............................. CYCLE    9 ..............................
........................................................................
   1     -8.8557536 -0.885575E+01  0.315E+00    1.83       0.0  T
   2     -8.8351759  0.205776E-01  0.296E+00    2.44       1.0  T
   3     -8.8686505 -0.334746E-01  0.149E+00    1.96       1.0  T
   4     -8.8710718 -0.242131E-02  0.651E-01    1.99       1.0  T
   5     -8.8730487 -0.197682E-02  0.112E-01    2.03       1.0  T
   6     -8.8730343  0.143853E-04  0.624E-02    2.04       1.0  T
   7     -8.8730516 -0.172795E-04  0.271E-02    2.03       1.6  T
   8     -8.8730547 -0.310950E-05  0.377E-03    2.03      11.9  T
   9     -8.8730547 -0.140732E-07  0.964E-04    2.03      46.4  T
  10     -8.8730547 -0.133108E-08  0.260E-04    2.03     171.7  T
     SCC iter.                  ...        0 min,  0.001 sec
     gradient                   ...        0 min,  0.001 sec
 * total energy  :    -8.7054692 Eh     change        0.5186396E-02 Eh
   gradient norm :     0.1338529 Eh/α   predicted    -0.7712263E-02 (-248.70%)
   displ. norm   :     0.2827927 α      lambda       -0.2227017E-01
   maximum displ.:     0.2126204 α      in ANC's #4, #3, #2, ...

........................................................................
.............................. CYCLE   10 ..............................
........................................................................
   1     -8.8308676 -0.883087E+01  0.199E+00    1.67       0.0  T
   2     -8.8133279  0.175397E-01  0.232E+00    1.63       1.0  T
   3     -8.8388662 -0.255383E-01  0.956E-01    1.65       1.0  T
   4     -8.8393781 -0.511935E-03  0.186E-01    1.61       1.0  T
   5     -8.8394941 -0.115952E-03  0.779E-02    1.64       1.0  T
   6     -8.8394973 -0.321922E-05  0.197E-02    1.63       2.3  T
   7     -8.8394970  0.302498E-06  0.134E-02    1.63       3.3  T
   8     -8.8394981 -0.109648E-05  0.323E-03    1.63      13.9  T
   9     -8.8394981 -0.116334E-07  0.807E-04    1.63      55.4  T
  10     -8.8394981 -0.592834E-09  0.925E-05    1.63     483.3  T
     SCC iter.                  ...        0 min,  0.001 sec
     gradient                   ...        0 min,  0.001 sec
 * total energy  :    -8.7116735 Eh     change       -0.6204287E-02 Eh
   gradient norm :     0.0400661 Eh/α   predicted    -0.1202557E-01 (  93.83%)
   displ. norm   :     0.4181176 α      lambda       -0.1005466E-01
   maximum displ.:     0.2857556 α      in ANC's #1, #5, #3, ...

........................................................................
.............................. CYCLE   11 ..............................
........................................................................
   1     -8.8598745 -0.885987E+01  0.195E+00    0.93       0.0  T
   2     -8.8429382  0.169363E-01  0.221E+00    0.50       1.0  T
   3     -8.8633615 -0.204233E-01  0.117E+00    0.78       1.0  T
   4     -8.8646187 -0.125720E-02  0.639E-01    0.79       1.0  T
   5     -8.8670818 -0.246310E-02  0.182E-01    0.69       1.0  T
   6     -8.8671533 -0.715180E-04  0.125E-01    0.69       1.0  T
   7     -8.8671881 -0.348411E-04  0.182E-02    0.68       2.5  T
   8     -8.8671887 -0.551038E-06  0.356E-03    0.68      12.6  T
   9     -8.8671887  0.706487E-08  0.254E-03    0.68      17.6  T
  10     -8.8671887 -0.159011E-07  0.230E-04    0.68     194.8  T
  11     -8.8671887 -0.383888E-10  0.893E-05    0.68     500.9  T
     SCC iter.                  ...        0 min,  0.001 sec
     gradient                   ...        0 min,  0.001 sec
 * total energy  :    -8.7057940 Eh     change        0.5879474E-02 Eh
   gradient norm :     0.0699753 Eh/α   predicted    -0.5906218E-02 (-200.45%)
   displ. norm   :     0.2678984 α      lambda       -0.1496918E-01
   maximum displ.:     0.1830378 α      in ANC's #1, #5, #3, ...

........................................................................
.............................. CYCLE   12 ..............................
........................................................................
   1     -8.8523136 -0.885231E+01  0.147E+00    1.31       0.0  T
   2     -8.8502904  0.202323E-02  0.106E+00    1.60       1.0  T
   3     -8.8546847 -0.439429E-02  0.703E-01    1.39       1.0  T
   4     -8.8547788 -0.941030E-04  0.478E-01    1.36       1.0  T
   5     -8.8562013 -0.142250E-02  0.280E-02    1.42       1.6  T
   6     -8.8562013  0.232650E-07  0.104E-02    1.42       4.3  T
   7     -8.8562014 -0.129614E-06  0.207E-03    1.42      21.6  T
   8     -8.8562014  0.997638E-09  0.130E-03    1.42      34.5  T
   9     -8.8562014 -0.841940E-08  0.153E-04    1.42     291.4  T
  10     -8.8562014 -0.212097E-10  0.746E-05    1.42     599.3  T
     SCC iter.                  ...        0 min,  0.001 sec
     gradient                   ...        0 min,  0.001 sec
 * total energy  :    -8.7138945 Eh     change       -0.8100502E-02 Eh
   gradient norm :     0.0120399 Eh/α   predicted    -0.8021759E-02 (  -0.97%)
   displ. norm   :     0.1327231 α      lambda       -0.6016361E-03
   maximum displ.:     0.1201418 α      in ANC's #1, #2, #4, ...

........................................................................
.............................. CYCLE   13 ..............................
........................................................................
   1     -8.8598344 -0.885983E+01  0.425E-01    1.57       0.0  T
   2     -8.8598264  0.806949E-05  0.259E-01    1.62       1.0  T
   3     -8.8597564  0.699087E-04  0.225E-01    1.56       1.0  T
   4     -8.8598963 -0.139853E-03  0.357E-02    1.59       1.3  T
   5     -8.8599027 -0.640425E-05  0.161E-02    1.59       2.8  T
   6     -8.8599030 -0.273240E-06  0.526E-03    1.59       8.5  T
   7     -8.8599032 -0.173872E-06  0.118E-03    1.59      37.9  T
   8     -8.8599032 -0.488512E-08  0.462E-04    1.59      96.8  T
   9     -8.8599032 -0.195385E-09  0.971E-05    1.59     460.8  T
     SCC iter.                  ...        0 min,  0.001 sec
     gradient                   ...        0 min,  0.001 sec
 * total energy  :    -8.7139034 Eh     change       -0.8915353E-05 Eh
   gradient norm :     0.0134007 Eh/α   predicted    -0.3061154E-03 (3333.58%)
   displ. norm   :     0.0782857 α      lambda       -0.4338961E-03
   maximum displ.:     0.0645424 α      in ANC's #1, #2, #5, ...

........................................................................
.............................. CYCLE   14 ..............................
........................................................................
   1     -8.8595342 -0.885953E+01  0.210E-01    1.56       0.0  T
   2     -8.8594676  0.665865E-04  0.168E-01    1.57       1.0  T
   3     -8.8594889 -0.212770E-04  0.139E-01    1.56       1.0  T
   4     -8.8595678 -0.789136E-04  0.165E-02    1.57       2.7  T
   5     -8.8595693 -0.147329E-05  0.537E-03    1.57       8.3  T
   6     -8.8595693 -0.279805E-07  0.111E-03    1.57      40.5  T
   7     -8.8595693 -0.310095E-09  0.395E-04    1.57     113.3  T
   8     -8.8595693  0.101450E-09  0.250E-04    1.57     178.6  T
     SCC iter.                  ...        0 min,  0.001 sec
     gradient                   ...        0 min,  0.001 sec
 * total energy  :    -8.7141527 Eh     change       -0.2492864E-03 Eh
   gradient norm :     0.0075848 Eh/α   predicted    -0.2182772E-03 ( -12.44%)
   displ. norm   :     0.0222527 α      lambda       -0.7823203E-04
   maximum displ.:     0.0182279 α      in ANC's #1, #7, #4, ...

........................................................................
.............................. CYCLE   15 ..............................
........................................................................
   1     -8.8600615 -0.886006E+01  0.702E-02    1.56       0.0  T
   2     -8.8600506  0.108619E-04  0.652E-02    1.57       1.0  T
   3     -8.8600651 -0.144650E-04  0.376E-02    1.56       1.2  T
   4     -8.8600667 -0.164947E-05  0.218E-02    1.56       2.1  T
   5     -8.8600690 -0.230715E-05  0.191E-03    1.57      23.4  T
   6     -8.8600690 -0.734673E-09  0.508E-04    1.57      88.1  T
   7     -8.8600690 -0.589591E-10  0.348E-04    1.57     128.7  T
     SCC iter.                  ...        0 min,  0.001 sec
     gradient                   ...        0 min,  0.001 sec
 * total energy  :    -8.7142100 Eh     change       -0.5727769E-04 Eh
   gradient norm :     0.0050926 Eh/α   predicted    -0.3913719E-04 ( -31.67%)
   displ. norm   :     0.0386697 α      lambda       -0.1276908E-03
   maximum displ.:     0.0225706 α      in ANC's #7, #6, #2, ...

........................................................................
.............................. CYCLE   16 ..............................
........................................................................
   1     -8.8611763 -0.886118E+01  0.123E-01    1.56       0.0  T
   2     -8.8611718  0.445173E-05  0.802E-02    1.57       1.0  T
   3     -8.8611532  0.186442E-04  0.767E-02    1.56       1.0  T
   4     -8.8611777 -0.245457E-04  0.261E-02    1.56       1.7  T
   5     -8.8611819 -0.417162E-05  0.347E-03    1.56      12.9  T
   6     -8.8611819 -0.840593E-08  0.410E-04    1.56     109.0  T
   7     -8.8611819 -0.329912E-09  0.319E-04    1.56     140.3  T
     SCC iter.                  ...        0 min,  0.001 sec
     gradient                   ...        0 min,  0.001 sec
 * total energy  :    -8.7142931 Eh     change       -0.8317083E-04 Eh
   gradient norm :     0.0049747 Eh/α   predicted    -0.6394212E-04 ( -23.12%)
   displ. norm   :     0.0306678 α      lambda       -0.6597629E-04
   maximum displ.:     0.0183058 α      in ANC's #4, #7, #5, ...

........................................................................
.............................. CYCLE   17 ..............................
........................................................................
   1     -8.8617115 -0.886171E+01  0.136E-01    1.58       0.0  T
   2     -8.8616918  0.196540E-04  0.113E-01    1.61       1.0  T
   3     -8.8617229 -0.310690E-04  0.673E-02    1.59       1.0  T
   4     -8.8617227  0.184441E-06  0.508E-02    1.59       1.0  T
   5     -8.8617367 -0.140315E-04  0.438E-03    1.60      10.2  T
   6     -8.8617367 -0.400937E-08  0.657E-04    1.60      68.1  T
   7     -8.8617367  0.259005E-09  0.420E-04    1.60     106.5  T
     SCC iter.                  ...        0 min,  0.001 sec
     gradient                   ...        0 min,  0.001 sec
 * total energy  :    -8.7143340 Eh     change       -0.4090348E-04 Eh
   gradient norm :     0.0040860 Eh/α   predicted    -0.3302144E-04 ( -19.27%)
   displ. norm   :     0.0164058 α      lambda       -0.2483914E-04
   maximum displ.:     0.0096053 α      in ANC's #1, #7, #2, ...

........................................................................
.............................. CYCLE   18 ..............................
........................................................................
   1     -8.8613722 -0.886137E+01  0.459E-02    1.59       0.0  T
   2     -8.8613716  0.606787E-06  0.332E-02    1.59       1.3  T
   3     -8.8613665  0.508485E-05  0.309E-02    1.59       1.4  T
   4     -8.8613726 -0.601600E-05  0.729E-03    1.59       6.1  T
   5     -8.8613728 -0.286407E-06  0.173E-03    1.59      25.9  T
   6     -8.8613728 -0.292464E-08  0.110E-04    1.59     405.5  T
   7     -8.8613728 -0.100258E-10  0.680E-05    1.59     657.7  T
     SCC iter.                  ...        0 min,  0.001 sec
     gradient                   ...        0 min,  0.001 sec
 * total energy  :    -8.7143514 Eh     change       -0.1739272E-04 Eh
   gradient norm :     0.0027929 Eh/α   predicted    -0.1242385E-04 ( -28.57%)
   displ. norm   :     0.0129868 α      lambda       -0.1664315E-04
   maximum displ.:     0.0060862 α      in ANC's #2, #6, #7, ...

........................................................................
.............................. CYCLE   19 ..............................
........................................................................
   1     -8.8608000 -0.886080E+01  0.545E-02    1.59       0.0  T
   2     -8.8607966  0.338336E-05  0.463E-02    1.59       1.0  T
   3     -8.8607977 -0.109791E-05  0.325E-02    1.59       1.4  T
   4     -8.8608017 -0.400131E-05  0.837E-03    1.59       5.3  T
   5     -8.8608022 -0.464106E-06  0.174E-03    1.59      25.8  T
   6     -8.8608022 -0.726205E-09  0.139E-04    1.59     322.1  T
   7     -8.8608022 -0.323119E-11  0.802E-05    1.59     557.9  T
     SCC iter.                  ...        0 min,  0.001 sec
     gradient                   ...        0 min,  0.001 sec
 * total energy  :    -8.7143626 Eh     change       -0.1113673E-04 Eh
   gradient norm :     0.0008901 Eh/α   predicted    -0.8323433E-05 ( -25.26%)
   displ. norm   :     0.0177333 α      lambda       -0.7992832E-05
   maximum displ.:     0.0105832 α      in ANC's #2, #6, #3, ...

........................................................................
.............................. CYCLE   20 ..............................
........................................................................
   1     -8.8602296 -0.886023E+01  0.770E-02    1.58       0.0  T
   2     -8.8602269  0.272580E-05  0.537E-02    1.58       1.0  T
   3     -8.8602139  0.130249E-04  0.554E-02    1.58       1.0  T
   4     -8.8602310 -0.171315E-04  0.928E-03    1.58       4.8  T
   5     -8.8602314 -0.439275E-06  0.245E-03    1.58      18.2  T
   6     -8.8602314 -0.275706E-08  0.137E-04    1.58     325.9  T
   7     -8.8602314 -0.290967E-11  0.824E-05    1.58     542.6  T
     SCC iter.                  ...        0 min,  0.001 sec
     gradient                   ...        0 min,  0.001 sec
 * total energy  :    -8.7143698 Eh     change       -0.7252424E-05 Eh
   gradient norm :     0.0017367 Eh/α   predicted    -0.3998125E-05 ( -44.87%)
   displ. norm   :     0.0172835 α      lambda       -0.5468750E-05
   maximum displ.:     0.0088201 α      in ANC's #2, #1, #3, ...
 * RMSD in coord.:     1.2181690 α      energy gain  -0.2007941E+00 Eh

generating ANC from model Hessian ...
Using Lindh-Hessian (1995)
 Shifting diagonal of input Hessian by    0.0000000000000000     
 Lowest  eigenvalues of input Hessian
   -0.000000   -0.000000    0.000000    0.000000    0.000000    0.000000
    0.038597    0.085822    0.213923    0.342017    0.784265    0.918206
    1.232378    1.494566    1.945705
 Highest eigenvalues
    0.342017    0.784265    0.918206    1.232378    1.494566    1.945705


........................................................................
.............................. CYCLE   21 ..............................
........................................................................
   1     -8.8601930 -0.886019E+01  0.680E-02    1.58       0.0  T
   2     -8.8601930 -0.433561E-08  0.416E-02    1.58       1.1  T
   3     -8.8601903  0.272121E-05  0.244E-02    1.58       1.8  T
   4     -8.8601933 -0.298144E-05  0.256E-03    1.58      17.5  T
   5     -8.8601932  0.492782E-07  0.289E-03    1.58      15.5  T
   6     -8.8601933 -0.553082E-07  0.864E-05    1.58     517.7  T
   7     -8.8601933 -0.466649E-11  0.543E-05    1.58     823.4  T
     SCC iter.                  ...        0 min,  0.001 sec
     gradient                   ...        0 min,  0.001 sec
 * total energy  :    -8.7143766 Eh     change       -0.6805285E-05 Eh
   gradient norm :     0.0020905 Eh/α   predicted     0.0000000E+00 (-100.00%)
   displ. norm   :     0.0115852 α      lambda       -0.8790487E-05
   maximum displ.:     0.0110519 α      in ANC's #1, #2, #4, ...

........................................................................
.............................. CYCLE   22 ..............................
........................................................................
   1     -8.8605966 -0.886060E+01  0.487E-02    1.59       0.0  T
   2     -8.8605966  0.288697E-07  0.302E-02    1.59       1.5  T
   3     -8.8605945  0.210173E-05  0.221E-02    1.59       2.0  T
   4     -8.8605968 -0.226034E-05  0.322E-03    1.59      13.9  T
   5     -8.8605968 -0.577252E-07  0.126E-03    1.59      35.6  T
   6     -8.8605968 -0.244361E-08  0.850E-05    1.59     526.4  T
   7     -8.8605968 -0.207123E-11  0.488E-05    1.59     917.2  T
     SCC iter.                  ...        0 min,  0.001 sec
     gradient                   ...        0 min,  0.001 sec
 * total energy  :    -8.7143834 Eh     change       -0.6722776E-05 Eh
   gradient norm :     0.0009281 Eh/α   predicted    -0.4396803E-05 ( -34.60%)
   displ. norm   :     0.0303794 α      lambda       -0.7830599E-05
   maximum displ.:     0.0301955 α      in ANC's #1, #7, #2, ...

........................................................................
.............................. CYCLE   23 ..............................
........................................................................
   1     -8.8609912 -0.886099E+01  0.118E-01    1.60       0.0  T
   2     -8.8609905  0.665397E-06  0.744E-02    1.60       1.0  T
   3     -8.8609657  0.248777E-04  0.666E-02    1.60       1.0  T
   4     -8.8609916 -0.259259E-04  0.106E-02    1.60       4.2  T
   5     -8.8609922 -0.640355E-06  0.267E-03    1.60      16.7  T
   6     -8.8609922 -0.341363E-08  0.178E-04    1.60     250.7  T
   7     -8.8609922 -0.220926E-10  0.769E-05    1.60     581.2  T
     SCC iter.                  ...        0 min,  0.001 sec
     gradient                   ...        0 min,  0.001 sec
 * total energy  :    -8.7143879 Eh     change       -0.4575699E-05 Eh
   gradient norm :     0.0012029 Eh/α   predicted    -0.3916433E-05 ( -14.41%)
   displ. norm   :     0.0025855 α      lambda       -0.1118993E-05
   maximum displ.:     0.0019395 α      in ANC's #2, #1, #5, ...

........................................................................
.............................. CYCLE   24 ..............................
........................................................................
   1     -8.8607616 -0.886076E+01  0.136E-02    1.60       0.0  T
   2     -8.8607615  0.490638E-07  0.911E-03    1.59       4.9  T
   3     -8.8607616 -0.102114E-06  0.696E-03    1.60       6.4  T
   4     -8.8607617 -0.689003E-07  0.253E-03    1.59      17.7  T
   5     -8.8607617 -0.425920E-07  0.366E-04    1.59     122.3  T
   6     -8.8607617 -0.335305E-10  0.414E-05    1.59    1079.6  T
     SCC iter.                  ...        0 min,  0.001 sec
     gradient                   ...        0 min,  0.001 sec
 * total energy  :    -8.7143890 Eh     change       -0.1031457E-05 Eh
   gradient norm :     0.0003559 Eh/α   predicted    -0.5609619E-06 ( -45.61%)
   displ. norm   :     0.0016446 α      lambda       -0.1712223E-06
   maximum displ.:     0.0014255 α      in ANC's #1, #5, #6, ...

   *** GEOMETRY OPTIMIZATION CONVERGED AFTER 24 ITERATIONS ***

------------------------------------------------------------------------
 total energy gain   :        -0.2008132 Eh     -126.0122 kcal/mol
 total RMSD          :         1.2155061 a0        0.6432 Å
 total power (kW/mol):       -21.9681268 (step)-6963.7609 (real)
------------------------------------------------------------------------

 ANCopt (total)                0 d,  0 h,  0 min,  0.076 sec
 optimizer setup                ...        0 min,  0.000 sec (  0.091%)
 model hessian                  ...        0 min,  0.000 sec (  0.187%)
 ANC generation                 ...        0 min,  0.000 sec (  0.132%)
 coordinate transformation      ...        0 min,  0.000 sec (  0.077%)
 single point calculation       ...        0 min,  0.073 sec ( 96.857%)
 optimization log               ...        0 min,  0.001 sec (  0.816%)
 hessian update                 ...        0 min,  0.000 sec (  0.071%)
 rational function              ...        0 min,  0.001 sec (  0.739%)

================
 final structure:
================
5
 xtb: 6.2.2 (9d81278992624c895f80dd42a50cac0aa55982e2)
C         0.70871552187372    0.04948871866151   -0.01435398560870
C        -0.45561944171458   -0.73239934742730    0.30357787262260
C        -0.38995289317013    0.77028569409240   -0.32792479278706
C        -1.63369178380941   -0.10720081994900    0.02983371979826
H         1.77054859682040    0.01982575462238    0.00886718597489

 Bond Distances (Angstroems)
 ---------------------------
C1-C2=1.4381         C1-C3=1.3509         C1-H5=1.0625         C2-C1=1.4381         C2-C3=1.6313         C2-C4=1.3615         
C3-C1=1.3509         C3-C2=1.6313         C3-C4=1.5636         C4-C2=1.3615         C4-C3=1.5636         H5-C1=1.0625         
 C  H  Rav=1.0625 sigma=0.0000  Rmin=1.0625  Rmax=1.0625     1
 C  C  Rav=1.4691 sigma=0.1111  Rmin=1.3509  Rmax=1.6313     5

 selected bond angles (degree)
 --------------------
C3-C1-C2= 71.52                H5-C1-C2=142.10                H5-C1-C3=146.38                C3-C2-C1= 51.76                
C4-C2-C1=113.98                C4-C2-C3= 62.23                C2-C3-C1= 56.73                C4-C3-C1=107.12                
C4-C3-C2= 50.39                C3-C4-C2= 67.38                

 selected dihedral angles (degree)
 ---------------------------------
C3-C2-C1-H5=179.94            C4-C2-C1-C3=  0.00            C4-C2-C1-H5=179.93            C2-C3-C1-H5=180.07            
C4-C3-C1-C2=  0.00            C4-C3-C1-H5=180.08            C1-C3-C2-C4=179.98            C4-C3-C2-C1=180.02            
C3-C4-C2-C1=  0.00            C2-C4-C3-C1=  0.00            
           -------------------------------------------------
          |                Final Singlepoint                |
           -------------------------------------------------

          ...................................................
          :                      SETUP                      :
          :.................................................:
          :  # basis functions                  17          :
          :  # atomic orbitals                  17          :
          :  # shells                            9          :
          :  # electrons                        17          :
          :  max. iterations                   250          :
          :  Hamiltonian                  GFN2-xTB          :
          :  restarted?                      false          :
          :  GBSA solvation                  false          :
          :  PC potential                    false          :
          :  electronic temp.          300.0000000     K    :
          :  accuracy                    1.0000000          :
          :  -> integral cutoff          0.2500000E+02      :
          :  -> integral neglect         0.1000000E-07      :
          :  -> SCF convergence          0.1000000E-05 Eh   :
          :  -> wf. convergence          0.1000000E-03 e    :
          :  Broyden damping             0.4000000          :
          ...................................................

 iter      E             dE          RMSdq      gap      omega  full diag
   1     -8.8607617 -0.886076E+01  0.243E-05    1.59       0.0  T
   2     -8.8607617  0.627054E-12  0.194E-05    1.59    2306.6  T
   3     -8.8607617 -0.306954E-11  0.831E-06    1.59    5380.5  T

   *** convergence criteria satisfied after 3 iterations ***

         #    Occupation            Energy/Eh            Energy/eV
      -------------------------------------------------------------
         1        2.0000           -0.7148058             -19.4509
       ...           ...                  ...                  ...
         3        2.0000           -0.5873079             -15.9815
         4        2.0000           -0.5591996             -15.2166
         5        2.0000           -0.5278892             -14.3646
         6        2.0000           -0.5062354             -13.7754
         7        2.0000           -0.4386374             -11.9359
         8        2.0000           -0.4088212             -11.1246
         9        1.0000           -0.3768076             -10.2535 (HOMO)
        10                         -0.3181954              -8.6585 (LUMO)
        11                         -0.2660292              -7.2390
        12                         -0.1954294              -5.3179
        13                          0.0180791               0.4920
        14                          0.0791633               2.1541
       ...                                ...                  ...
        17                          0.6145754              16.7234
      -------------------------------------------------------------
                  HL-Gap            0.0586123 Eh            1.5949 eV
             Fermi-level           -0.3701580 Eh          -10.0725 eV

 SCC (total)                   0 d,  0 h,  0 min,  0.003 sec
 SCC setup                      ...        0 min,  0.000 sec (  2.894%)
 Dispersion                     ...        0 min,  0.000 sec (  0.499%)
 integral evaluation            ...        0 min,  0.001 sec ( 40.492%)
 zeroth order Hamiltonian       ...        0 min,  0.000 sec (  0.608%)
 iterations                     ...        0 min,  0.000 sec ( 11.994%)
 molecular gradient             ...        0 min,  0.001 sec ( 41.245%)
 printout                       ...        0 min,  0.000 sec (  1.905%)

         :::::::::::::::::::::::::::::::::::::::::::::::::::::
         ::                     SUMMARY                     ::
         :::::::::::::::::::::::::::::::::::::::::::::::::::::
         :: total energy              -8.714388964757 Eh    ::
         :: gradient norm              0.000355913992 Eh/a0 ::
         :: HOMO-LUMO gap              1.594920511552 eV    ::
         ::.................................................::
         :: SCC energy                -8.860761717538 Eh    ::
         :: -> isotropic ES           -0.007699789277 Eh    ::
         :: -> anisotropic ES         -0.000261354829 Eh    ::
         :: -> anisotropic XC          0.008088218961 Eh    ::
         :: -> dispersion             -0.002149583428 Eh    ::
         :: repulsion energy           0.146372763760 Eh    ::
         :: add. restraining           0.000000000000 Eh    ::
         :::::::::::::::::::::::::::::::::::::::::::::::::::::

           ------------------------------------------------- 
          |                Numerical Hessian                |
           ------------------------------------------------- 
step length          :   0.00500
SCC accuracy         :   0.30000
Hessian scale factor :   1.00000
frozen atoms in %    :   0.00000    0
RMS gradient         :   0.00036
estimated CPU  time      0.00 min
estimated wall time      0.00 min

writing file <hessian>.

 projected vibrational frequencies (cm-1)
eigval :       -0.00    -0.00    -0.00     0.00     0.00     0.00
eigval :      222.03   396.78   585.65   680.41   920.12  1032.83
eigval :     1437.92  1509.51  3236.65
           -------------------------------------------------
          |                Property Printout                |
           -------------------------------------------------

    * Orbital Energies and Occupations

         #    Occupation            Energy/Eh            Energy/eV
      -------------------------------------------------------------
         1        2.0000           -0.7148058             -19.4509
         2        2.0000           -0.6372415             -17.3402
         3        2.0000           -0.5873079             -15.9815
         4        2.0000           -0.5591995             -15.2166
         5        2.0000           -0.5278892             -14.3646
         6        2.0000           -0.5062354             -13.7754
         7        2.0000           -0.4386374             -11.9359
         8        2.0000           -0.4088212             -11.1246
         9        1.0000           -0.3768076             -10.2535 (HOMO)
        10                         -0.3181955              -8.6585 (LUMO)
        11                         -0.2660292              -7.2390
        12                         -0.1954294              -5.3179
        13                          0.0180790               0.4920
        14                          0.0791634               2.1541
        15                          0.1800505               4.8994
        16                          0.4265209              11.6062
        17                          0.6145754              16.7234
      -------------------------------------------------------------
                  HL-Gap            0.0586121 Eh            1.5949 eV
             Fermi-level           -0.3701580 Eh          -10.0725 eV

     #   Z        covCN         q      C6AA      α(0)
     1   6 C      2.919     0.036    27.189     8.551
     2   6 C      2.916     0.023    27.483     8.597
     3   6 C      2.907    -0.011    28.296     8.722
     4   6 C      1.983    -0.131    34.721     9.516
     5   1 H      0.927     0.082     1.955     2.186

 Mol. C6AA /au·bohr⁶  :        531.969014
 Mol. C8AA /au·bohr⁸  :      14733.825779
 Mol. α(0) /au        :         37.571765


Wiberg/Mayer (AO) data.
largest (>0.10) Wiberg bond orders for each atom
          total WBO             WBO to atom ...
     1  C   3.642        C    3 1.542    C    2 1.062    H    5 0.964
     2  C   3.345        C    4 1.455    C    1 1.062    C    3 0.825
     3  C   3.177        C    1 1.542    C    2 0.825    C    4 0.804
     4  C   2.352        C    2 1.455    C    3 0.804
     5  H   0.993        C    1 0.964

MOs/occ written to file <molden.input>


molecular dipole:
                 x           y           z       tot (Debye)
 q only:        0.716      -0.016       0.013
   full:        1.465      -0.115       0.062       3.740
molecular quadrupole (traceless):
                xx          xy          yy          xz          yz          zz
 q only:       -0.258      -0.040       0.139       0.014      -0.010       0.119
  q+dip:       -0.666      -0.587      -0.195       0.233       0.532       0.861
   full:       -3.016      -0.009       0.079      -0.055       1.461       2.937

           -------------------------------------------------
          |                Geometry Summary                 |
Molecule has the following symmetry elements: (sigma) 
It seems to be the Cs point group
           -------------------------------------------------

      molecular mass/u    :       49.0508844
   center of mass at/Å    :       -0.3971587      -0.0044451      -0.0019876
  moments of inertia/u·Å² :        0.1574250E+02   0.3823616E+02   0.5397866E+02
rotational constants/cm⁻¹ :        0.1070836E+01   0.4408820E+00   0.3123018E+00

 * 3 selected distances

     #   Z        #   Z                                     value/Å
     1   6 C      3   6 C                                 1.3509061
     2   6 C      4   6 C                                 1.3614931 (max)
     1   6 C      5   1 H                                 1.0625011 (min)

 * 2 distinct bonds (by element types)

   Z      Z             #   av. dist./Å        max./Å        min./Å
   1 H    6 C           1     1.0625011     1.0625011     1.0625011
   6 C    6 C           2     1.3561996     1.3614931     1.3509061

           -------------------------------------------------
          |               Frequency Printout                |
           -------------------------------------------------
 projected vibrational frequencies (cm-1)
eigval :       -0.00    -0.00    -0.00     0.00     0.00     0.00
eigval :      222.03   396.78   585.65   680.41   920.12  1032.83
eigval :     1437.92  1509.51  3236.65
 reduced masses (amu)
   1: 11.44   2: 11.24   3: 11.99   4: 11.80   5: 11.47   6: 11.08   7:  9.43   8: 11.42
   9:  5.21  10: 11.84  11:  2.84  12: 11.91  13: 12.00  14: 11.47  15:  2.02
 IR intensities (amu)
   1:  0.17   2:  0.21   3:  0.15   4:  0.07   5:  0.16   6:  0.28   7:  0.45   8:  1.27
   9:  0.27  10:  0.14  11:  0.22  12:  0.38  13:  0.42  14:  0.22  15:  0.00
 Raman intensities (amu)
   1:  0.00   2:  0.00   3:  0.00   4:  0.00   5:  0.00   6:  0.00   7:  0.00   8:  0.00
   9:  0.00  10:  0.00  11:  0.00  12:  0.00  13:  0.00  14:  0.00  15:  0.00
 output can be read by thermo (or use thermo option).
 writing <g98.out> molden fake output.
 recommended (thermochemical) frequency scaling factor: 1.0
           -------------------------------------------------
          |             Thermodynamic Functions             |
           -------------------------------------------------

cs  symmetry found (for desy threshold:  0.10E+00) used in thermo

          ...................................................
          :                      SETUP                      :
          :.................................................:
          :  # frequencies                           9      :
          :  # imaginary freq.                       0      :
          :  linear?                             false      :
          :  only rotor calc.                    false      :
          :  symmetry                               cs      :
          :  rotational number                       1      :
          :  scaling factor                  1.0000000      :
          :  rotor cutoff                   50.0000000 cm⁻¹ :
          :  imag. cutoff                  -20.0000000 cm⁻¹ :
          :.................................................:

    mode    ω/cm⁻¹     T·S(HO)/kcal·mol⁻¹    T·S(FR)/kcal·mol⁻¹   T·S(vib)
   ------------------------------------------------------------------------
       1    222.03    -0.00000 ( 99.74%)     0.01313 (  0.26%)     0.00003
   ------------------------------------------------------------------------

   temp. (K)  partition function   enthalpy   heat capacity  entropy
                                   cal/mol     cal/K/mol   cal/K/mol   J/K/mol
 298.15  VIB   2.01                  766.759      6.196      3.960
         ROT  0.138E+05              888.752      2.981     21.920
         INT  0.277E+05             1655.511      9.176     25.880
         TR   0.332E+27             1481.254      4.968     37.578
         TOT                        3136.7651    14.1446    63.4578   265.5076

   temp. (K)  partition function   enthalpy   heat capacity  entropy
                                   cal/mol     cal/K/mol   cal/K/mol   J/K/mol
 120.00  VIB   1.09                   59.574      1.660      0.661
         ROT  0.352E+04              357.707      2.981     19.207
         INT  0.382E+04              417.281      4.641     19.868
         TR   0.849E+26              596.178      4.968     33.058
         TOT                        1013.4588     9.6088    52.9269   221.4460

   temp. (K)  partition function   enthalpy   heat capacity  entropy
                                   cal/mol     cal/K/mol   cal/K/mol   J/K/mol
 100.00  VIB   1.05                   31.389      1.162      0.406
         ROT  0.267E+04              298.089      2.981     18.664
         INT  0.280E+04              329.478      4.143     19.069
         TR   0.646E+26              496.815      4.968     32.153
         TOT                         826.2928     9.1114    51.2224   214.3146

   temp. (K)  partition function   enthalpy   heat capacity  entropy
                                   cal/mol     cal/K/mol   cal/K/mol   J/K/mol
  80.00  VIB   1.02                   12.886      0.695      0.201
         ROT  0.191E+04              238.471      2.981     17.998
         INT  0.195E+04              251.357      3.675     18.200
         TR   0.462E+26              397.452      4.968     31.045
         TOT                         648.8087     8.6436    49.2445   206.0389

   temp. (K)  partition function   enthalpy   heat capacity  entropy
                                   cal/mol     cal/K/mol   cal/K/mol   J/K/mol
  60.00  VIB   1.00                    3.194      0.291      0.064
         ROT  0.124E+04              178.853      2.981     17.141
         INT  0.125E+04              182.047      3.272     17.205
         TR   0.300E+26              298.089      4.968     29.616
         TOT                         480.1359     8.2398    46.8212   195.9001

   temp. (K)  partition function   enthalpy   heat capacity  entropy
                                   cal/mol     cal/K/mol   cal/K/mol   J/K/mol
  40.00  VIB   1.00                    0.217      0.043      0.006
         ROT   677.                  119.236      2.981     15.932
         INT   677.                  119.452      3.024     15.938
         TR   0.163E+26              198.726      4.968     27.603
         TOT                         318.1783     7.9924    43.5411   182.1762

   temp. (K)  partition function   enthalpy   heat capacity  entropy
                                   cal/mol     cal/K/mol   cal/K/mol   J/K/mol
  20.00  VIB   1.00                    0.000      0.000     -0.002
         ROT   239.                   59.618      2.981     13.866
         INT   239.                   59.618      2.981     13.864
         TR   0.577E+25               99.363      4.968     24.161
         TOT                         158.9809     7.9491    38.0249   159.0961

   temp. (K)  partition function   enthalpy   heat capacity  entropy
                                   cal/mol     cal/K/mol   cal/K/mol   J/K/mol
  10.00  VIB   1.00                    0.000      0.000     -0.004
         ROT   84.6                   29.809      2.981     11.800
         INT   84.6                   29.809      2.981     11.796
         TR   0.204E+25               49.681      4.968     20.719
         TOT                          79.4904     7.9490    32.5147   136.0415

       T/K    H(0)-H(T)+PV         H(T)/Eh          T*S/Eh         G(T)/Eh
   ------------------------------------------------------------------------
    298.15    0.499875E-02    0.278303E-01    0.301509E-01   -0.232054E-02
    120.00    0.161505E-02    0.244466E-01    0.101213E-01    0.143253E-01
    100.00    0.131678E-02    0.241484E-01    0.816281E-02    0.159855E-01
     80.00    0.103394E-02    0.238655E-01    0.627809E-02    0.175874E-01
     60.00    0.765145E-03    0.235967E-01    0.447686E-02    0.191199E-01
     40.00    0.507049E-03    0.233386E-01    0.277549E-02    0.205631E-01
     20.00    0.253352E-03    0.230849E-01    0.121193E-02    0.218730E-01
     10.00    0.126676E-03    0.229582E-01    0.518155E-03    0.224401E-01 (used)
   ------------------------------------------------------------------------

         :::::::::::::::::::::::::::::::::::::::::::::::::::::
         ::                  THERMODYNAMIC                  ::
         :::::::::::::::::::::::::::::::::::::::::::::::::::::
         :: total free energy          -8.691948869569 Eh   ::
         ::.................................................::
         :: total energy               -8.714388964621 Eh   ::
         :: zero point energy           0.022831573855 Eh   ::
         :: G(RRHO) w/o ZPVE           -0.000391478802 Eh   ::
         :: G(RRHO) contrib.            0.022440095053 Eh   ::
         :::::::::::::::::::::::::::::::::::::::::::::::::::::

optimized geometry written to: xtbopt.xyz


           -------------------------------------------------
          | TOTAL ENERGY               -8.714388964621 Eh   |
          | TOTAL ENTHALPY             -8.691430714751 Eh   |
          | TOTAL FREE ENERGY          -8.691948869569 Eh   |
          | GRADIENT NORM               0.000355725291 Eh/α |
          | HOMO-LUMO GAP               1.594917366091 eV   |
           -------------------------------------------------

------------------------------------------------------------------------
 * finished run on 2020/05/12 at 11:45:07.784     
------------------------------------------------------------------------
 total:
 * wall-time:     0 d,  0 h,  0 min,  0.185 sec
 *  cpu-time:     0 d,  0 h,  0 min,  0.185 sec
 * ratio c/w:     0.997 speedup
 SCF:
 * wall-time:     0 d,  0 h,  0 min,  0.005 sec
 *  cpu-time:     0 d,  0 h,  0 min,  0.005 sec
 * ratio c/w:     0.994 speedup
 ANC optimizer:
 * wall-time:     0 d,  0 h,  0 min,  0.079 sec
 *  cpu-time:     0 d,  0 h,  0 min,  0.079 sec
 * ratio c/w:     0.998 speedup
 numerical hessian:
 * wall-time:     0 d,  0 h,  0 min,  0.084 sec
 *  cpu-time:     0 d,  0 h,  0 min,  0.084 sec
 * ratio c/w:     0.997 speedup

