      -----------------------------------------------------------      
     |                   =====================                   |     
     |                           x T B                           |     
     |                   =====================                   |     
     |                         S. Grimme                         |     
     |          Mulliken Center for Theoretical Chemistry        |     
     |                    University of Bonn                     |     
      -----------------------------------------------------------      

   * xtb version 6.2.2 (9d81278992624c895f80dd42a50cac0aa55982e2) compiled by '@Darwin' on 04/03/2020

   xtb is free software: you can redistribute it and/or modify it under
   the terms of the GNU Lesser General Public License as published by
   the Free Software Foundation, either version 3 of the License, or
   (at your option) any later version.
   
   xtb is distributed in the hope that it will be useful,
   but WITHOUT ANY WARRANTY; without even the implied warranty of
   MERCHANTABILITY or FITNESS FOR A PARTICULAR PURPOSE.  See the
   GNU Lesser General Public License for more details.
   
   Cite this work as:
   * S. Grimme, C. Bannwarth, P. Shushkov, J. Chem. Theory Comput., 2017,
     13, 1989-2009. DOI: 10.1021/acs.jctc.7b00118
   * C. Bannwarth, S. Ehlert and S. Grimme., J. Chem. Theory Comput., 2019,
     15, 1652-1671. DOI: 10.1021/acs.jctc.8b01176
   * P. Pracht, E. Caldeweyher, S. Ehlert, S. Grimme, ChemRxiv, 2019, preprint.
     DOI: 10.26434/chemrxiv.8326202.v1
   
   for DFT-D4:
   * E. Caldeweyher, C. Bannwarth and S. Grimme, J. Chem. Phys., 2017,
     147, 034112. DOI: 10.1063/1.4993215
   * E. Caldeweyher, S. Ehlert, A. Hansen, H. Neugebauer, S. Spicher,
     C. Bannwarth and S. Grimme, J. Chem. Phys., 2019, 150, 154122.
     DOI: 10.1063/1.5090222
   
   for sTDA-xTB:
   * S. Grimme and C. Bannwarth, J. Chem. Phys., 2016, 145, 054103.
     DOI: 10.1063/1.4959605
   
   in the mass-spec context:
   * V. Asgeirsson, C. Bauer and S. Grimme, Chem. Sci., 2017, 8, 4879.
     DOI: 10.1039/c7sc00601b
   
   for metadynamics refer to:
   * S. Grimme, J. Chem. Theory Comput., 2019, 155, 2847-2862
     DOI: 10.1021/acs.jctc.9b00143
   
   with help from (in alphabetical order)
   C. Bannwarth, F. Bohle, G. Brandenburg, E. Caldeweyher, M. Checinski,
   S. Dohm, S. Ehlert, S. Ehrlich, F. März, H. Neugebauer, J. Pisarek,
   P. Pracht, P. Shushkov, and S. Spicher.
   
 * started run on 2020/05/12 at 11:45:14.471     

           -------------------------------------------------
          |                Calculation Setup                |
           -------------------------------------------------

          program call               : xtb --input H2C2O1_4_S_2.input H2C2O1_4_S_2.xyz --ohess --molden --namespace H2C2O1_4_S_2 output.out
          calculation namespace      : H2C2O1_4_S_2
          coordinate file            : H2C2O1_4_S_2.xyz
          number of atoms            :                     5
          number of electrons        :                    16
          charge                     :                     0
          spin                       :                   1.0
          first test random number   :      0.85602128155746

   ID    Z sym.   atoms
    1    6 C      1, 2
    2    8 O      3
    3    1 H      4, 5

           -------------------------------------------------
          |                 G F N 2 - x T B                 |
           -------------------------------------------------

        Reference                      10.1021/acs.jctc.8b01176
      * Hamiltonian:
        H0-scaling (s, p, d)           1.850000    2.230000    2.230000
        zeta-weighting                 0.500000
      * Dispersion:
        s8                             2.700000
        a1                             0.520000
        a2                             5.000000
        s9                             5.000000
      * Repulsion:
        kExp                           1.500000    1.000000
        rExp                           1.000000
      * Coulomb:
        alpha                          2.000000
        third order                    shell-resolved
        anisotropic                    true
        a3                             3.000000
        a5                             4.000000
        cn-shift                       1.200000
        cn-exp                         4.000000
        max-rad                        5.000000


          ...................................................
          :                      SETUP                      :
          :.................................................:
          :  # basis functions                  14          :
          :  # atomic orbitals                  14          :
          :  # shells                            8          :
          :  # electrons                        16          :
          :  max. iterations                   250          :
          :  Hamiltonian                  GFN2-xTB          :
          :  restarted?                      false          :
          :  GBSA solvation                  false          :
          :  PC potential                    false          :
          :  electronic temp.          300.0000000     K    :
          :  accuracy                    1.0000000          :
          :  -> integral cutoff          0.2500000E+02      :
          :  -> integral neglect         0.1000000E-07      :
          :  -> SCF convergence          0.1000000E-05 Eh   :
          :  -> wf. convergence          0.1000000E-03 e    :
          :  Broyden damping             0.4000000          :
          ...................................................

 iter      E             dE          RMSdq      gap      omega  full diag
   1     -9.0867322 -0.908673E+01  0.609E+00    1.79       0.0  T
   2     -8.9418987  0.144833E+00  0.650E+00    1.29       1.0  T
   3     -9.0764591 -0.134560E+00  0.379E+00    1.82       1.0  T
   4     -9.1224678 -0.460087E-01  0.796E-01    1.56       1.0  T
   5     -9.1230056 -0.537770E-03  0.600E-01    1.57       1.0  T
   6     -9.1233205 -0.314966E-03  0.127E-01    1.58       1.0  T
   7     -9.1233320 -0.114459E-04  0.545E-02    1.58       1.0  T
   8     -9.1233331 -0.110433E-05  0.103E-02    1.58       4.4  T
   9     -9.1233330  0.538080E-07  0.616E-03    1.58       7.3  T
  10     -9.1233331 -0.744471E-07  0.101E-03    1.58      44.2  T
  11     -9.1233331 -0.142929E-08  0.270E-04    1.58     165.7  T
  12     -9.1233331 -0.215346E-09  0.115E-04    1.58     388.7  T

   *** convergence criteria satisfied after 12 iterations ***

         #    Occupation            Energy/Eh            Energy/eV
      -------------------------------------------------------------
         1        2.0000           -0.7290356             -19.8381
       ...           ...                  ...                  ...
         3        2.0000           -0.5806729             -15.8009
         4        2.0000           -0.5721192             -15.5682
         5        2.0000           -0.5317007             -14.4683
         6        2.0000           -0.4971241             -13.5274
         7        2.0000           -0.4107881             -11.1781
         8        1.0000           -0.3799236             -10.3382
         9        1.0000           -0.3346421              -9.1061 (HOMO)
        10                         -0.2764633              -7.5229 (LUMO)
        11                          0.0486037               1.3226
        12                          0.1237234               3.3667
        13                          0.1494506               4.0668
        14                          0.1741987               4.7402
      -------------------------------------------------------------
                  HL-Gap            0.0581789 Eh            1.5831 eV
             Fermi-level           -0.3504543 Eh           -9.5363 eV

 transition dipole moment (au) for excitation:           8           9
     X       Y       Z   
  -0.7469   0.4346  -0.5713  total (au/Debye):    1.036   2.633
 dE (eV)             :    1.232
 oscillator strength :  0.45815E-01

 SCC (total)                   0 d,  0 h,  0 min,  0.003 sec
 SCC setup                      ...        0 min,  0.000 sec (  2.770%)
 Dispersion                     ...        0 min,  0.000 sec (  0.442%)
 integral evaluation            ...        0 min,  0.001 sec ( 22.384%)
 zeroth order Hamiltonian       ...        0 min,  0.000 sec (  0.498%)
 iterations                     ...        0 min,  0.001 sec ( 32.882%)
 molecular gradient             ...        0 min,  0.001 sec ( 22.202%)
 printout                       ...        0 min,  0.001 sec ( 18.506%)

         :::::::::::::::::::::::::::::::::::::::::::::::::::::
         ::                     SUMMARY                     ::
         :::::::::::::::::::::::::::::::::::::::::::::::::::::
         :: total energy              -9.073476344847 Eh    ::
         :: gradient norm              0.154894371412 Eh/a0 ::
         :: HOMO-LUMO gap              1.583127622955 eV    ::
         ::.................................................::
         :: SCC energy                -9.123333122346 Eh    ::
         :: -> isotropic ES            0.011818070093 Eh    ::
         :: -> anisotropic ES          0.000861090837 Eh    ::
         :: -> anisotropic XC          0.003953065414 Eh    ::
         :: -> dispersion             -0.001353013642 Eh    ::
         :: repulsion energy           0.049856782175 Eh    ::
         :: add. restraining           0.000000000000 Eh    ::
         :::::::::::::::::::::::::::::::::::::::::::::::::::::

      ----------------------------------------------------------- 
     |                   =====================                   |
     |                        A N C O P T                        |
     |                   =====================                   |
     |               Approximate Normal Coordinate               |
     |                Rational Function Optimizer                |
      ----------------------------------------------------------- 

          ...................................................
          :                      SETUP                      :
          :.................................................:
          :   optimization level            normal          :
          :   max. optcycles                   200          :
          :   ANC micro-cycles                  20          :
          :   degrees of freedom                 9          :
          :.................................................:
          :   RF solver                   davidson          :
          :   write xtbopt.log                true          :
          :   linear?                        false          :
          :   energy convergence         0.5000000E-05 Eh   :
          :   grad. convergence          0.1000000E-02 Eh/α :
          :   maximium RF displ.         1.0000000          :
          :   Hlow (freq-cutoff)         0.1000000E-01      :
          :   Hmax (freq-cutoff)         5.0000000          :
          :   S6 in model hess.         20.0000000          :
          ...................................................

generating ANC from model Hessian ...
Using Lindh-Hessian (1995)
 Shifting diagonal of input Hessian by    0.0000000000000000     
 Lowest  eigenvalues of input Hessian
   -0.000000   -0.000000    0.000000    0.000000    0.000000    0.000000
    0.011425    0.012642    0.056200    0.108754    0.181796    0.710919
    0.955030    1.129788    1.334816
 Highest eigenvalues
    0.108754    0.181796    0.710919    0.955030    1.129788    1.334816


........................................................................
.............................. CYCLE    1 ..............................
........................................................................
   1     -9.1233331 -0.912333E+01  0.242E-05    1.58       0.0  T
   2     -9.1233331 -0.632383E-12  0.146E-05    1.58    3063.6  T
   3     -9.1233331  0.151701E-11  0.184E-05    1.58    2429.0  T
     SCC iter.                  ...        0 min,  0.001 sec
     gradient                   ...        0 min,  0.001 sec
 * total energy  :    -9.0734763 Eh     change        0.2971614E-09 Eh
   gradient norm :     0.1548942 Eh/α   predicted     0.0000000E+00 (-100.00%)
   displ. norm   :     0.3624146 α      lambda       -0.3452390E-01
   maximum displ.:     0.2257204 α      in ANC's #1, #3, #6, ...

........................................................................
.............................. CYCLE    2 ..............................
........................................................................
   1     -9.1669178 -0.916692E+01  0.156E+00    2.67       0.0  T
   2     -9.1669976 -0.798114E-04  0.961E-01    2.68       1.0  T
   3     -9.1664419  0.555721E-03  0.346E-01    2.69       1.0  T
   4     -9.1670239 -0.582041E-03  0.123E-01    2.68       1.0  T
   5     -9.1670597 -0.357725E-04  0.388E-02    2.68       1.2  T
   6     -9.1670604 -0.706939E-06  0.870E-03    2.68       5.1  T
   7     -9.1670604 -0.458494E-07  0.146E-03    2.68      30.7  T
   8     -9.1670604 -0.110327E-08  0.107E-03    2.68      41.8  T
   9     -9.1670604 -0.312146E-08  0.188E-04    2.68     237.8  T
  10     -9.1670604 -0.920277E-10  0.560E-05    2.68     798.9  T
     SCC iter.                  ...        0 min,  0.001 sec
     gradient                   ...        0 min,  0.001 sec
 * total energy  :    -9.0993980 Eh     change       -0.2592165E-01 Eh
   gradient norm :     0.1142952 Eh/α   predicted    -0.1952922E-01 ( -24.66%)
   displ. norm   :     0.5871519 α      lambda       -0.5878105E-01
   maximum displ.:     0.3936228 α      in ANC's #6, #7, #1, ...

........................................................................
.............................. CYCLE    3 ..............................
........................................................................
   1     -9.2866096 -0.928661E+01  0.236E+00    3.92       0.0  T
   2     -9.2871155 -0.505931E-03  0.151E+00    3.87       1.0  T
   3     -9.2869280  0.187568E-03  0.288E-01    3.83       1.0  T
   4     -9.2872264 -0.298392E-03  0.582E-02    3.83       1.0  T
   5     -9.2872298 -0.345174E-05  0.363E-02    3.83       1.2  T
   6     -9.2872304 -0.539835E-06  0.524E-03    3.83       8.5  T
   7     -9.2872304 -0.153595E-07  0.159E-03    3.83      28.1  T
   8     -9.2872304 -0.450938E-08  0.736E-04    3.83      60.8  T
   9     -9.2872304 -0.328367E-09  0.113E-04    3.83     394.5  T
     SCC iter.                  ...        0 min,  0.001 sec
     gradient                   ...        0 min,  0.001 sec
 * total energy  :    -9.0250076 Eh     change        0.7439044E-01 Eh
   gradient norm :     0.6967357 Eh/α   predicted    -0.3952283E-01 (-153.13%)
   displ. norm   :     0.3614285 α      lambda       -0.2361896E+00
   maximum displ.:     0.2277771 α      in ANC's #6, #7, #3, ...

........................................................................
.............................. CYCLE    4 ..............................
........................................................................
   1     -9.2098479 -0.920985E+01  0.120E+00    2.72       0.0  T
   2     -9.2108967 -0.104879E-02  0.777E-01    2.77       1.0  T
   3     -9.2109180 -0.213373E-04  0.312E-01    2.78       1.0  T
   4     -9.2109082  0.981268E-05  0.893E-02    2.79       1.0  T
   5     -9.2109399 -0.316997E-04  0.281E-02    2.79       1.6  T
   6     -9.2109401 -0.182808E-06  0.718E-03    2.79       6.2  T
   7     -9.2109401 -0.413814E-07  0.263E-03    2.79      17.0  T
   8     -9.2109402 -0.216978E-07  0.396E-04    2.79     112.8  T
   9     -9.2109402 -0.930545E-10  0.916E-05    2.79     488.2  T
     SCC iter.                  ...        0 min,  0.001 sec
     gradient                   ...        0 min,  0.001 sec
 * total energy  :    -9.1123774 Eh     change       -0.8736985E-01 Eh
   gradient norm :     0.0520711 Eh/α   predicted    -0.1335216E+00 (  52.82%)
   displ. norm   :     0.2679995 α      lambda       -0.7004465E-02
   maximum displ.:     0.2030038 α      in ANC's #3, #1, #2, ...

........................................................................
.............................. CYCLE    5 ..............................
........................................................................
   1     -9.2089652 -0.920897E+01  0.980E-01    3.14       0.0  T
   2     -9.2090132 -0.479875E-04  0.599E-01    3.13       1.0  T
   3     -9.2082085  0.804741E-03  0.467E-01    3.14       1.0  T
   4     -9.2091353 -0.926882E-03  0.446E-02    3.14       1.0  T
   5     -9.2091414 -0.603561E-05  0.161E-02    3.14       2.8  T
   6     -9.2091414 -0.382123E-07  0.191E-03    3.14      23.5  T
   7     -9.2091414 -0.374590E-08  0.671E-04    3.14      66.7  T
   8     -9.2091414 -0.339631E-09  0.216E-04    3.14     206.8  T
     SCC iter.                  ...        0 min,  0.001 sec
     gradient                   ...        0 min,  0.001 sec
 * total energy  :    -9.1165502 Eh     change       -0.4172777E-02 Eh
   gradient norm :     0.0393839 Eh/α   predicted    -0.3753779E-02 ( -10.04%)
   displ. norm   :     0.1091080 α      lambda       -0.1445661E-02
   maximum displ.:     0.0666666 α      in ANC's #2, #3, #6, ...

........................................................................
.............................. CYCLE    6 ..............................
........................................................................
   1     -9.2129229 -0.921292E+01  0.407E-01    3.17       0.0  T
   2     -9.2129270 -0.412551E-05  0.250E-01    3.17       1.0  T
   3     -9.2128556  0.714057E-04  0.125E-01    3.17       1.0  T
   4     -9.2129341 -0.785137E-04  0.131E-02    3.16       3.4  T
   5     -9.2129344 -0.268018E-06  0.689E-03    3.16       6.5  T
   6     -9.2129344 -0.909047E-08  0.941E-04    3.16      47.5  T
   7     -9.2129344 -0.610328E-09  0.266E-04    3.16     168.3  T
     SCC iter.                  ...        0 min,  0.000 sec
     gradient                   ...        0 min,  0.001 sec
 * total energy  :    -9.1176140 Eh     change       -0.1063783E-02 Eh
   gradient norm :     0.0279683 Eh/α   predicted    -0.7314373E-03 ( -31.24%)
   displ. norm   :     0.1655013 α      lambda       -0.2139899E-02
   maximum displ.:     0.1115935 α      in ANC's #2, #6, #5, ...

........................................................................
.............................. CYCLE    7 ..............................
........................................................................
   1     -9.2256721 -0.922567E+01  0.587E-01    3.39       0.0  T
   2     -9.2258411 -0.169040E-03  0.351E-01    3.37       1.0  T
   3     -9.2258462 -0.506276E-05  0.149E-01    3.38       1.0  T
   4     -9.2258492 -0.305141E-05  0.470E-02    3.38       1.0  T
   5     -9.2258593 -0.100515E-04  0.163E-02    3.38       2.7  T
   6     -9.2258596 -0.359488E-06  0.414E-03    3.38      10.8  T
   7     -9.2258597 -0.827032E-08  0.622E-04    3.38      71.9  T
   8     -9.2258597 -0.561270E-09  0.325E-04    3.38     137.8  T
     SCC iter.                  ...        0 min,  0.001 sec
     gradient                   ...        0 min,  0.001 sec
 * total energy  :    -9.1172002 Eh     change        0.4137731E-03 Eh
   gradient norm :     0.0420365 Eh/α   predicted    -0.1099257E-02 (-365.67%)
   displ. norm   :     0.2049380 α      lambda       -0.2719905E-02
   maximum displ.:     0.2016451 α      in ANC's #2, #5, #1, ...

........................................................................
.............................. CYCLE    8 ..............................
........................................................................
   1     -9.2234074 -0.922341E+01  0.686E-01    3.20       0.0  T
   2     -9.2236508 -0.243428E-03  0.413E-01    3.21       1.0  T
   3     -9.2236427  0.810733E-05  0.187E-01    3.20       1.0  T
   4     -9.2236514 -0.865051E-05  0.856E-02    3.20       1.0  T
   5     -9.2236870 -0.356686E-04  0.190E-02    3.20       2.4  T
   6     -9.2236872 -0.207089E-06  0.410E-03    3.20      10.9  T
   7     -9.2236872 -0.866780E-08  0.106E-03    3.20      42.2  T
   8     -9.2236872 -0.157580E-08  0.428E-04    3.20     104.5  T
   9     -9.2236872 -0.165873E-09  0.832E-05    3.20     537.6  T
     SCC iter.                  ...        0 min,  0.001 sec
     gradient                   ...        0 min,  0.001 sec
 * total energy  :    -9.1184301 Eh     change       -0.1229956E-02 Eh
   gradient norm :     0.0164930 Eh/α   predicted    -0.1417072E-02 (  15.21%)
   displ. norm   :     0.0489155 α      lambda       -0.2731497E-03
   maximum displ.:     0.0456001 α      in ANC's #2, #6, #1, ...

........................................................................
.............................. CYCLE    9 ..............................
........................................................................
   1     -9.2221032 -0.922210E+01  0.162E-01    3.23       0.0  T
   2     -9.2221101 -0.687760E-05  0.981E-02    3.23       1.0  T
   3     -9.2221089  0.114956E-05  0.355E-02    3.24       1.3  T
   4     -9.2221106 -0.161097E-05  0.169E-02    3.24       2.7  T
   5     -9.2221119 -0.130785E-05  0.528E-03    3.24       8.5  T
   6     -9.2221119 -0.236248E-07  0.106E-03    3.24      42.1  T
   7     -9.2221119 -0.544462E-09  0.224E-04    3.24     199.9  T
   8     -9.2221119 -0.333547E-10  0.690E-05    3.24     647.9  T
     SCC iter.                  ...        0 min,  0.001 sec
     gradient                   ...        0 min,  0.001 sec
 * total energy  :    -9.1185341 Eh     change       -0.1039787E-03 Eh
   gradient norm :     0.0036721 Eh/α   predicted    -0.1369013E-03 (  31.66%)
   displ. norm   :     0.0292281 α      lambda       -0.5395201E-04
   maximum displ.:     0.0255848 α      in ANC's #2, #5, #3, ...

........................................................................
.............................. CYCLE   10 ..............................
........................................................................
   1     -9.2223394 -0.922234E+01  0.925E-02    3.22       0.0  T
   2     -9.2223402 -0.831314E-06  0.568E-02    3.22       1.0  T
   3     -9.2223396  0.572050E-06  0.150E-02    3.22       3.0  T
   4     -9.2223404 -0.737391E-06  0.592E-03    3.22       7.6  T
   5     -9.2223405 -0.139894E-06  0.220E-03    3.22      20.3  T
   6     -9.2223405 -0.172402E-08  0.301E-04    3.22     148.5  T
   7     -9.2223405 -0.415579E-10  0.920E-05    3.22     486.4  T
     SCC iter.                  ...        0 min,  0.000 sec
     gradient                   ...        0 min,  0.001 sec
 * total energy  :    -9.1185775 Eh     change       -0.4338968E-04 Eh
   gradient norm :     0.0045073 Eh/α   predicted    -0.2699805E-04 ( -37.78%)
   displ. norm   :     0.0660712 α      lambda       -0.9567168E-04
   maximum displ.:     0.0547545 α      in ANC's #2, #1, #5, ...

........................................................................
.............................. CYCLE   11 ..............................
........................................................................
   1     -9.2228813 -0.922288E+01  0.191E-01    3.19       0.0  T
   2     -9.2228832 -0.182960E-05  0.118E-01    3.19       1.0  T
   3     -9.2228697  0.134628E-04  0.565E-02    3.19       1.0  T
   4     -9.2228853 -0.155375E-04  0.813E-03    3.19       5.5  T
   5     -9.2228853 -0.499633E-07  0.453E-03    3.19       9.9  T
   6     -9.2228853 -0.683578E-08  0.481E-04    3.19      93.0  T
   7     -9.2228853 -0.350191E-10  0.114E-04    3.19     391.1  T
     SCC iter.                  ...        0 min,  0.001 sec
     gradient                   ...        0 min,  0.001 sec
 * total energy  :    -9.1186381 Eh     change       -0.6056406E-04 Eh
   gradient norm :     0.0057407 Eh/α   predicted    -0.4804340E-04 ( -20.67%)
   displ. norm   :     0.0348551 α      lambda       -0.4426143E-04
   maximum displ.:     0.0276788 α      in ANC's #2, #1, #8, ...

........................................................................
.............................. CYCLE   12 ..............................
........................................................................
   1     -9.2231686 -0.922317E+01  0.994E-02    3.19       0.0  T
   2     -9.2231690 -0.449031E-06  0.609E-02    3.18       1.0  T
   3     -9.2231628  0.617326E-05  0.394E-02    3.19       1.1  T
   4     -9.2231701 -0.723076E-05  0.423E-03    3.18      10.6  T
   5     -9.2231701 -0.485845E-08  0.229E-03    3.18      19.6  T
   6     -9.2231701 -0.179127E-08  0.273E-04    3.18     163.6  T
   7     -9.2231701 -0.189626E-10  0.555E-05    3.18     806.4  T
     SCC iter.                  ...        0 min,  0.001 sec
     gradient                   ...        0 min,  0.001 sec
 * total energy  :    -9.1186724 Eh     change       -0.3429191E-04 Eh
   gradient norm :     0.0038466 Eh/α   predicted    -0.2215701E-04 ( -35.39%)
   displ. norm   :     0.0634472 α      lambda       -0.5754404E-04
   maximum displ.:     0.0425134 α      in ANC's #2, #1, #3, ...

........................................................................
.............................. CYCLE   13 ..............................
........................................................................
   1     -9.2229841 -0.922298E+01  0.166E-01    3.19       0.0  T
   2     -9.2229858 -0.169296E-05  0.100E-01    3.18       1.0  T
   3     -9.2229720  0.137930E-04  0.585E-02    3.19       1.0  T
   4     -9.2229881 -0.160124E-04  0.769E-03    3.18       5.8  T
   5     -9.2229881 -0.605638E-07  0.435E-03    3.18      10.3  T
   6     -9.2229881 -0.698065E-08  0.470E-04    3.18      95.2  T
   7     -9.2229881 -0.474678E-10  0.100E-04    3.18     445.5  T
     SCC iter.                  ...        0 min,  0.001 sec
     gradient                   ...        0 min,  0.001 sec
 * total energy  :    -9.1187094 Eh     change       -0.3700816E-04 Eh
   gradient norm :     0.0023677 Eh/α   predicted    -0.2888814E-04 ( -21.94%)
   displ. norm   :     0.0257772 α      lambda       -0.2000549E-04
   maximum displ.:     0.0180936 α      in ANC's #2, #1, #8, ...

........................................................................
.............................. CYCLE   14 ..............................
........................................................................
   1     -9.2234162 -0.922342E+01  0.785E-02    3.18       0.0  T
   2     -9.2234173 -0.110585E-05  0.475E-02    3.18       1.0  T
   3     -9.2234147  0.260656E-05  0.288E-02    3.18       1.6  T
   4     -9.2234179 -0.316989E-05  0.607E-03    3.18       7.4  T
   5     -9.2234180 -0.118200E-06  0.233E-03    3.18      19.2  T
   6     -9.2234180 -0.238979E-08  0.314E-04    3.18     142.5  T
   7     -9.2234180 -0.515019E-10  0.709E-05    3.18     630.9  T
     SCC iter.                  ...        0 min,  0.000 sec
     gradient                   ...        0 min,  0.001 sec
 * total energy  :    -9.1187205 Eh     change       -0.1108667E-04 Eh
   gradient norm :     0.0015089 Eh/α   predicted    -0.1000736E-04 (  -9.74%)
   displ. norm   :     0.0483896 α      lambda       -0.8634108E-05
   maximum displ.:     0.0366929 α      in ANC's #2, #1, #4, ...

........................................................................
.............................. CYCLE   15 ..............................
........................................................................
   1     -9.2227664 -0.922277E+01  0.138E-01    3.17       0.0  T
   2     -9.2227671 -0.681253E-06  0.845E-02    3.17       1.0  T
   3     -9.2227675 -0.387263E-06  0.748E-03    3.16       6.0  T
   4     -9.2227674  0.271233E-07  0.534E-03    3.16       8.4  T
   5     -9.2227675 -0.940250E-07  0.990E-04    3.16      45.2  T
   6     -9.2227675 -0.125110E-08  0.360E-04    3.16     124.3  T
     SCC iter.                  ...        0 min,  0.000 sec
     gradient                   ...        0 min,  0.001 sec
 * total energy  :    -9.1187203 Eh     change        0.1654924E-06 Eh
   gradient norm :     0.0023349 Eh/α   predicted    -0.4322719E-05 (*******%)
   displ. norm   :     0.0152363 α      lambda       -0.7306915E-05
   maximum displ.:     0.0121052 α      in ANC's #2, #1, #4, ...

........................................................................
.............................. CYCLE   16 ..............................
........................................................................
   1     -9.2231624 -0.922316E+01  0.433E-02    3.17       0.0  T
   2     -9.2231625 -0.800959E-07  0.265E-02    3.17       1.7  T
   3     -9.2231616  0.890416E-06  0.144E-02    3.17       3.1  T
   4     -9.2231626 -0.102786E-05  0.185E-03    3.17      24.2  T
   5     -9.2231626 -0.883604E-09  0.408E-04    3.17     109.7  T
   6     -9.2231626 -0.989466E-10  0.168E-04    3.17     266.0  T
     SCC iter.                  ...        0 min,  0.000 sec
     gradient                   ...        0 min,  0.001 sec
 * total energy  :    -9.1187248 Eh     change       -0.4526051E-05 Eh
   gradient norm :     0.0006307 Eh/α   predicted    -0.3653779E-05 ( -19.27%)
   displ. norm   :     0.0091272 α      lambda       -0.8867064E-06
   maximum displ.:     0.0065336 α      in ANC's #1, #2, #4, ...

   *** GEOMETRY OPTIMIZATION CONVERGED AFTER 16 ITERATIONS ***

------------------------------------------------------------------------
 total energy gain   :        -0.0452485 Eh      -28.3939 kcal/mol
 total RMSD          :         0.4942625 a0        0.2616 Å
 total power (kW/mol):        -7.4249924 (step)-3289.3862 (real)
------------------------------------------------------------------------

 ANCopt (total)                0 d,  0 h,  0 min,  0.036 sec
 optimizer setup                ...        0 min,  0.000 sec (  0.194%)
 model hessian                  ...        0 min,  0.000 sec (  0.249%)
 ANC generation                 ...        0 min,  0.000 sec (  0.158%)
 coordinate transformation      ...        0 min,  0.000 sec (  0.111%)
 single point calculation       ...        0 min,  0.034 sec ( 95.290%)
 optimization log               ...        0 min,  0.000 sec (  1.300%)
 hessian update                 ...        0 min,  0.000 sec (  0.112%)
 rational function              ...        0 min,  0.000 sec (  1.084%)

================
 final structure:
================
5
 xtb: 6.2.2 (9d81278992624c895f80dd42a50cac0aa55982e2)
C        -0.05401496585361   -0.47324980764205   -0.46393186518482
C         1.06623448679337   -0.61085123785646    0.17960934493894
O        -1.11574015312393    0.27691531998811   -0.07972075280406
H         1.41212855362941   -0.15234685342844    1.10006956976914
H        -1.30860792144525    0.95953257893884   -0.73602629671920

 Bond Distances (Angstroems)
 ---------------------------
C1-C2=1.2992         C1-O3=1.3556         C2-C1=1.2992         C2-H4=1.0849         O3-C1=1.3556         O3-H5=0.9664         
H4-C2=1.0849         H5-O3=0.9664         
 C  H  Rav=1.0849 sigma=0.0000  Rmin=1.0849  Rmax=1.0849     1
 C  C  Rav=1.2992 sigma=0.0000  Rmin=1.2992  Rmax=1.2992     1
 O  H  Rav=0.9664 sigma=0.0000  Rmin=0.9664  Rmax=0.9664     1
 O  C  Rav=1.3556 sigma=0.0000  Rmin=1.3556  Rmax=1.3556     1

 selected bond angles (degree)
 --------------------
O3-C1-C2=126.41                H4-C2-C1=130.57                H5-O3-C1=110.78                

 selected dihedral angles (degree)
 ---------------------------------
H4-C2-C1-O3=357.21            H5-O3-C1-C2=119.69            
           -------------------------------------------------
          |                Final Singlepoint                |
           -------------------------------------------------

          ...................................................
          :                      SETUP                      :
          :.................................................:
          :  # basis functions                  14          :
          :  # atomic orbitals                  14          :
          :  # shells                            8          :
          :  # electrons                        16          :
          :  max. iterations                   250          :
          :  Hamiltonian                  GFN2-xTB          :
          :  restarted?                      false          :
          :  GBSA solvation                  false          :
          :  PC potential                    false          :
          :  electronic temp.          300.0000000     K    :
          :  accuracy                    1.0000000          :
          :  -> integral cutoff          0.2500000E+02      :
          :  -> integral neglect         0.1000000E-07      :
          :  -> SCF convergence          0.1000000E-05 Eh   :
          :  -> wf. convergence          0.1000000E-03 e    :
          :  Broyden damping             0.4000000          :
          ...................................................

 iter      E             dE          RMSdq      gap      omega  full diag
   1     -9.2231626 -0.922316E+01  0.306E-05    3.17       0.0  T
   2     -9.2231626 -0.218492E-12  0.162E-05    3.17    2764.8  T
   3     -9.2231626  0.342837E-12  0.160E-05    3.17    2790.8  T

   *** convergence criteria satisfied after 3 iterations ***

         #    Occupation            Energy/Eh            Energy/eV
      -------------------------------------------------------------
         1        2.0000           -0.7236250             -19.6908
       ...           ...                  ...                  ...
         3        2.0000           -0.5925454             -16.1240
         4        2.0000           -0.5661735             -15.4064
         5        2.0000           -0.5216030             -14.1935
         6        2.0000           -0.5047457             -13.7348
         7        2.0000           -0.4052503             -11.0274
         8        1.0000           -0.3699794             -10.0677
         9        1.0000           -0.3090162              -8.4088 (HOMO)
        10                         -0.1926266              -5.2416 (LUMO)
        11                          0.0866687               2.3584
        12                          0.1876897               5.1073
        13                          0.2642789               7.1914
        14                          0.6835033              18.5991
      -------------------------------------------------------------
                  HL-Gap            0.1163896 Eh            3.1671 eV
             Fermi-level           -0.3192181 Eh           -8.6864 eV

 transition dipole moment (au) for excitation:           8           9
     X       Y       Z   
   1.0398  -0.2324   0.4349  total (au/Debye):    1.151   2.925
 dE (eV)             :    1.659
 oscillator strength :  0.76121E-01

 SCC (total)                   0 d,  0 h,  0 min,  0.002 sec
 SCC setup                      ...        0 min,  0.000 sec (  3.325%)
 Dispersion                     ...        0 min,  0.000 sec (  0.288%)
 integral evaluation            ...        0 min,  0.001 sec ( 30.551%)
 zeroth order Hamiltonian       ...        0 min,  0.000 sec (  0.457%)
 iterations                     ...        0 min,  0.000 sec ( 10.114%)
 molecular gradient             ...        0 min,  0.001 sec ( 30.045%)
 printout                       ...        0 min,  0.001 sec ( 24.854%)

         :::::::::::::::::::::::::::::::::::::::::::::::::::::
         ::                     SUMMARY                     ::
         :::::::::::::::::::::::::::::::::::::::::::::::::::::
         :: total energy              -9.118724827192 Eh    ::
         :: gradient norm              0.000631472160 Eh/a0 ::
         :: HOMO-LUMO gap              3.167122409716 eV    ::
         ::.................................................::
         :: SCC energy                -9.223162647603 Eh    ::
         :: -> isotropic ES            0.015438589366 Eh    ::
         :: -> anisotropic ES          0.001604737075 Eh    ::
         :: -> anisotropic XC          0.003156473916 Eh    ::
         :: -> dispersion             -0.001362488542 Eh    ::
         :: repulsion energy           0.104437815658 Eh    ::
         :: add. restraining           0.000000000000 Eh    ::
         :::::::::::::::::::::::::::::::::::::::::::::::::::::

           ------------------------------------------------- 
          |                Numerical Hessian                |
           ------------------------------------------------- 
step length          :   0.00500
SCC accuracy         :   0.30000
Hessian scale factor :   1.00000
frozen atoms in %    :   0.00000    0
RMS gradient         :   0.00063
estimated CPU  time      0.00 min
estimated wall time      0.00 min

writing file <hessian>.

 projected vibrational frequencies (cm-1)
eigval :       -0.00    -0.00    -0.00    -0.00     0.00     0.00
eigval :      275.34   453.58   592.15   897.20  1068.37  1112.26
eigval :     1711.81  2908.01  3466.14
           -------------------------------------------------
          |                Property Printout                |
           -------------------------------------------------

    * Orbital Energies and Occupations

         #    Occupation            Energy/Eh            Energy/eV
      -------------------------------------------------------------
         1        2.0000           -0.7236250             -19.6908
         2        2.0000           -0.6423902             -17.4803
         3        2.0000           -0.5925454             -16.1240
         4        2.0000           -0.5661735             -15.4064
         5        2.0000           -0.5216030             -14.1935
         6        2.0000           -0.5047458             -13.7348
         7        2.0000           -0.4052503             -11.0274
         8        1.0000           -0.3699795             -10.0677
         9        1.0000           -0.3090162              -8.4088 (HOMO)
        10                         -0.1926266              -5.2416 (LUMO)
        11                          0.0866687               2.3584
        12                          0.1876897               5.1073
        13                          0.2642789               7.1914
        14                          0.6835033              18.5991
      -------------------------------------------------------------
                  HL-Gap            0.1163896 Eh            3.1671 eV
             Fermi-level           -0.3192181 Eh           -8.6864 eV

     #   Z        covCN         q      C6AA      α(0)
     1   6 C      1.834     0.048    29.927     8.838
     2   6 C      1.907    -0.105    34.018     9.419
     3   8 O      1.659    -0.328    19.509     5.963
     4   1 H      0.925     0.069     2.099     2.266
     5   1 H      0.805     0.316     0.674     1.290

 Mol. C6AA /au·bohr⁶  :        321.642672
 Mol. C8AA /au·bohr⁸  :       7791.024864
 Mol. α(0) /au        :         27.775607


Wiberg/Mayer (AO) data.
largest (>0.10) Wiberg bond orders for each atom
          total WBO             WBO to atom ...
     1  C   3.043        C    2 1.944    O    3 1.095
     2  C   2.936        C    1 1.944    H    4 0.902
     3  O   2.032        C    1 1.095    H    5 0.870
     4  H   0.906        C    2 0.902
     5  H   0.897        O    3 0.870

MOs/occ written to file <molden.input>


molecular dipole:
                 x           y           z       tot (Debye)
 q only:       -0.123       0.460      -0.325
   full:       -0.212       0.725      -0.243       2.016
molecular quadrupole (traceless):
                xx          xy          yy          xz          yz          zz
 q only:       -0.352      -1.289       0.122       1.946      -1.100       0.231
  q+dip:       -0.385      -1.193      -0.471       4.016      -1.699       0.857
   full:       -0.825      -1.283       0.199       3.317      -1.824       0.626

           -------------------------------------------------
          |                Geometry Summary                 |
           -------------------------------------------------

      molecular mass/u    :       42.0367582
   center of mass at/Å    :       -0.1329644      -0.1849989      -0.1028490
  moments of inertia/u·Å² :        0.5063798E+01   0.4441591E+02   0.4833277E+02
rotational constants/cm⁻¹ :        0.3329049E+01   0.3795404E+00   0.3487827E+00

 * 2 selected distances

     #   Z        #   Z                                     value/Å
     1   6 C      2   6 C                                 1.2992453 (max)
     3   8 O      5   1 H                                 0.9663857 (min)

 * 2 distinct bonds (by element types)

   Z      Z             #   av. dist./Å        max./Å        min./Å
   6 C    6 C           1     1.2992453     1.2992453     1.2992453
   1 H    8 O           1     0.9663857     0.9663857     0.9663857
Molecule has no symmetry elements
It seems to be the C1 point group

           -------------------------------------------------
          |               Frequency Printout                |
           -------------------------------------------------
 projected vibrational frequencies (cm-1)
eigval :       -0.00    -0.00    -0.00    -0.00     0.00     0.00
eigval :      275.34   453.58   592.15   897.20  1068.37  1112.26
eigval :     1711.81  2908.01  3466.14
 reduced masses (amu)
   1:  9.35   2: 12.20   3: 10.92   4: 13.02   5: 13.17   6: 13.02   7:  2.76   8: 10.80
   9:  4.79  10:  4.12  11:  2.78  12: 13.72  13: 11.77  14:  1.83  15:  1.87
 IR intensities (amu)
   1:  0.27   2:  0.16   3:  0.13   4:  0.13   5:  0.21   6:  0.18   7:  0.48   8:  0.26
   9:  0.39  10:  0.08  11:  0.55  12:  1.53  13:  0.84  14:  0.16  15:  0.24
 Raman intensities (amu)
   1:  0.00   2:  0.00   3:  0.00   4:  0.00   5:  0.00   6:  0.00   7:  0.00   8:  0.00
   9:  0.00  10:  0.00  11:  0.00  12:  0.00  13:  0.00  14:  0.00  15:  0.00
 output can be read by thermo (or use thermo option).
 writing <g98.out> molden fake output.
 recommended (thermochemical) frequency scaling factor: 1.0
           -------------------------------------------------
          |             Thermodynamic Functions             |
           -------------------------------------------------

c1  symmetry found (for desy threshold:  0.10E+00) used in thermo

          ...................................................
          :                      SETUP                      :
          :.................................................:
          :  # frequencies                           9      :
          :  # imaginary freq.                       0      :
          :  linear?                             false      :
          :  only rotor calc.                    false      :
          :  symmetry                               c1      :
          :  rotational number                       1      :
          :  scaling factor                  1.0000000      :
          :  rotor cutoff                   50.0000000 cm⁻¹ :
          :  imag. cutoff                  -20.0000000 cm⁻¹ :
          :.................................................:

    mode    ω/cm⁻¹     T·S(HO)/kcal·mol⁻¹    T·S(FR)/kcal·mol⁻¹   T·S(vib)
   ------------------------------------------------------------------------
       1    275.34    -0.00000 ( 99.89%)     0.01527 (  0.11%)     0.00002
   ------------------------------------------------------------------------

   temp. (K)  partition function   enthalpy   heat capacity  entropy
                                   cal/mol     cal/K/mol   cal/K/mol   J/K/mol
 298.15  VIB   1.66                  618.492      5.238      3.088
         ROT  0.796E+04              888.752      2.981     20.832
         INT  0.133E+05             1507.244      8.219     23.920
         TR   0.264E+27             1481.254      4.968     37.118
         TOT                        2988.4979    13.1867    61.0375   255.3807

   temp. (K)  partition function   enthalpy   heat capacity  entropy
                                   cal/mol     cal/K/mol   cal/K/mol   J/K/mol
 120.00  VIB   1.04                   37.236      1.207      0.396
         ROT  0.203E+04              357.707      2.981     18.119
         INT  0.212E+04              394.943      4.188     18.515
         TR   0.673E+26              596.178      4.968     32.599
         TOT                         991.1207     9.1559    51.1136   213.8595

   temp. (K)  partition function   enthalpy   heat capacity  entropy
                                   cal/mol     cal/K/mol   cal/K/mol   J/K/mol
 100.00  VIB   1.02                   17.522      0.771      0.217
         ROT  0.155E+04              298.089      2.981     17.576
         INT  0.158E+04              315.611      3.752     17.793
         TR   0.512E+26              496.815      4.968     31.693
         TOT                         812.4264     8.7200    49.4862   207.0503

   temp. (K)  partition function   enthalpy   heat capacity  entropy
                                   cal/mol     cal/K/mol   cal/K/mol   J/K/mol
  80.00  VIB   1.01                    6.017      0.393      0.090
         ROT  0.111E+04              238.471      2.981     16.910
         INT  0.112E+04              244.488      3.374     17.001
         TR   0.367E+26              397.452      4.968     30.585
         TOT                         641.9405     8.3418    47.5860   199.0999

   temp. (K)  partition function   enthalpy   heat capacity  entropy
                                   cal/mol     cal/K/mol   cal/K/mol   J/K/mol
  60.00  VIB   1.00                    1.095      0.123      0.021
         ROT   719.                  178.853      2.981     16.053
         INT   720.                  179.949      3.103     16.074
         TR   0.238E+26              298.089      4.968     29.157
         TOT                         478.0376     8.0716    45.2307   189.2451

   temp. (K)  partition function   enthalpy   heat capacity  entropy
                                   cal/mol     cal/K/mol   cal/K/mol   J/K/mol
  40.00  VIB   1.00                    0.039      0.010      0.001
         ROT   391.                  119.236      2.981     14.844
         INT   391.                  119.275      2.991     14.845
         TR   0.130E+26              198.726      4.968     27.143
         TOT                         318.0011     7.9588    41.9882   175.6786

   temp. (K)  partition function   enthalpy   heat capacity  entropy
                                   cal/mol     cal/K/mol   cal/K/mol   J/K/mol
  20.00  VIB   1.00                    0.000      0.000     -0.001
         ROT   138.                   59.618      2.981     12.778
         INT   138.                   59.618      2.981     12.777
         TR   0.458E+25               99.363      4.968     23.701
         TOT                         158.9808     7.9490    36.4780   152.6241

   temp. (K)  partition function   enthalpy   heat capacity  entropy
                                   cal/mol     cal/K/mol   cal/K/mol   J/K/mol
  10.00  VIB   1.00                    0.000      0.000     -0.002
         ROT   48.9                   29.809      2.981     10.712
         INT   48.9                   29.809      2.981     10.710
         TR   0.162E+25               49.681      4.968     20.259
         TOT                          79.4904     7.9490    30.9690   129.5741

       T/K    H(0)-H(T)+PV         H(T)/Eh          T*S/Eh         G(T)/Eh
   ------------------------------------------------------------------------
    298.15    0.476247E-02    0.332051E-01    0.290009E-01    0.420422E-02
    120.00    0.157945E-02    0.300221E-01    0.977457E-02    0.202475E-01
    100.00    0.129468E-02    0.297373E-01    0.788613E-02    0.218512E-01
     80.00    0.102300E-02    0.294656E-01    0.606665E-02    0.233990E-01
     60.00    0.761801E-03    0.292044E-01    0.432478E-02    0.248796E-01
     40.00    0.506767E-03    0.289494E-01    0.267650E-02    0.262729E-01
     20.00    0.253352E-03    0.286960E-01    0.116263E-02    0.275333E-01
     10.00    0.126676E-03    0.285693E-01    0.493522E-03    0.280758E-01 (used)
   ------------------------------------------------------------------------

         :::::::::::::::::::::::::::::::::::::::::::::::::::::
         ::                  THERMODYNAMIC                  ::
         :::::::::::::::::::::::::::::::::::::::::::::::::::::
         :: total free energy          -9.090649068511 Eh   ::
         ::.................................................::
         :: total energy               -9.118724827064 Eh   ::
         :: zero point energy           0.028442604312 Eh   ::
         :: G(RRHO) w/o ZPVE           -0.000366845759 Eh   ::
         :: G(RRHO) contrib.            0.028075758553 Eh   ::
         :::::::::::::::::::::::::::::::::::::::::::::::::::::

optimized geometry written to: xtbopt.xyz


           -------------------------------------------------
          | TOTAL ENERGY               -9.118724827064 Eh   |
          | TOTAL ENTHALPY             -9.090155546736 Eh   |
          | TOTAL FREE ENERGY          -9.090649068511 Eh   |
          | GRADIENT NORM               0.000631487290 Eh/α |
          | HOMO-LUMO GAP               3.167122563809 eV   |
           -------------------------------------------------

------------------------------------------------------------------------
 * finished run on 2020/05/12 at 11:45:14.594     
------------------------------------------------------------------------
 total:
 * wall-time:     0 d,  0 h,  0 min,  0.122 sec
 *  cpu-time:     0 d,  0 h,  0 min,  0.122 sec
 * ratio c/w:     0.995 speedup
 SCF:
 * wall-time:     0 d,  0 h,  0 min,  0.004 sec
 *  cpu-time:     0 d,  0 h,  0 min,  0.004 sec
 * ratio c/w:     1.000 speedup
 ANC optimizer:
 * wall-time:     0 d,  0 h,  0 min,  0.039 sec
 *  cpu-time:     0 d,  0 h,  0 min,  0.039 sec
 * ratio c/w:     0.999 speedup
 numerical hessian:
 * wall-time:     0 d,  0 h,  0 min,  0.059 sec
 *  cpu-time:     0 d,  0 h,  0 min,  0.059 sec
 * ratio c/w:     0.999 speedup

