      -----------------------------------------------------------      
     |                   =====================                   |     
     |                           x T B                           |     
     |                   =====================                   |     
     |                         S. Grimme                         |     
     |          Mulliken Center for Theoretical Chemistry        |     
     |                    University of Bonn                     |     
      -----------------------------------------------------------      

   * xtb version 6.2.2 (9d81278992624c895f80dd42a50cac0aa55982e2) compiled by '@Darwin' on 04/03/2020

   xtb is free software: you can redistribute it and/or modify it under
   the terms of the GNU Lesser General Public License as published by
   the Free Software Foundation, either version 3 of the License, or
   (at your option) any later version.
   
   xtb is distributed in the hope that it will be useful,
   but WITHOUT ANY WARRANTY; without even the implied warranty of
   MERCHANTABILITY or FITNESS FOR A PARTICULAR PURPOSE.  See the
   GNU Lesser General Public License for more details.
   
   Cite this work as:
   * S. Grimme, C. Bannwarth, P. Shushkov, J. Chem. Theory Comput., 2017,
     13, 1989-2009. DOI: 10.1021/acs.jctc.7b00118
   * C. Bannwarth, S. Ehlert and S. Grimme., J. Chem. Theory Comput., 2019,
     15, 1652-1671. DOI: 10.1021/acs.jctc.8b01176
   * P. Pracht, E. Caldeweyher, S. Ehlert, S. Grimme, ChemRxiv, 2019, preprint.
     DOI: 10.26434/chemrxiv.8326202.v1
   
   for DFT-D4:
   * E. Caldeweyher, C. Bannwarth and S. Grimme, J. Chem. Phys., 2017,
     147, 034112. DOI: 10.1063/1.4993215
   * E. Caldeweyher, S. Ehlert, A. Hansen, H. Neugebauer, S. Spicher,
     C. Bannwarth and S. Grimme, J. Chem. Phys., 2019, 150, 154122.
     DOI: 10.1063/1.5090222
   
   for sTDA-xTB:
   * S. Grimme and C. Bannwarth, J. Chem. Phys., 2016, 145, 054103.
     DOI: 10.1063/1.4959605
   
   in the mass-spec context:
   * V. Asgeirsson, C. Bauer and S. Grimme, Chem. Sci., 2017, 8, 4879.
     DOI: 10.1039/c7sc00601b
   
   for metadynamics refer to:
   * S. Grimme, J. Chem. Theory Comput., 2019, 155, 2847-2862
     DOI: 10.1021/acs.jctc.9b00143
   
   with help from (in alphabetical order)
   C. Bannwarth, F. Bohle, G. Brandenburg, E. Caldeweyher, M. Checinski,
   S. Dohm, S. Ehlert, S. Ehrlich, F. März, H. Neugebauer, J. Pisarek,
   P. Pracht, P. Shushkov, and S. Spicher.
   
 * started run on 2020/05/12 at 11:43:52.182     

           -------------------------------------------------
          |                Calculation Setup                |
           -------------------------------------------------

          program call               : xtb --input H2C1O2_1_S_0.input H2C1O2_1_S_0.xyz --ohess --molden --namespace H2C1O2_1_S_0 output.out
          calculation namespace      : H2C1O2_1_S_0
          coordinate file            : H2C1O2_1_S_0.xyz
          number of atoms            :                     5
          number of electrons        :                    18
          charge                     :                     0
          spin                       :                   0.0
          first test random number   :      0.86011769317536

   ID    Z sym.   atoms
    1    6 C      1
    2    8 O      2, 3
    3    1 H      4, 5

           -------------------------------------------------
          |                 G F N 2 - x T B                 |
           -------------------------------------------------

        Reference                      10.1021/acs.jctc.8b01176
      * Hamiltonian:
        H0-scaling (s, p, d)           1.850000    2.230000    2.230000
        zeta-weighting                 0.500000
      * Dispersion:
        s8                             2.700000
        a1                             0.520000
        a2                             5.000000
        s9                             5.000000
      * Repulsion:
        kExp                           1.500000    1.000000
        rExp                           1.000000
      * Coulomb:
        alpha                          2.000000
        third order                    shell-resolved
        anisotropic                    true
        a3                             3.000000
        a5                             4.000000
        cn-shift                       1.200000
        cn-exp                         4.000000
        max-rad                        5.000000


          ...................................................
          :                      SETUP                      :
          :.................................................:
          :  # basis functions                  14          :
          :  # atomic orbitals                  14          :
          :  # shells                            8          :
          :  # electrons                        18          :
          :  max. iterations                   250          :
          :  Hamiltonian                  GFN2-xTB          :
          :  restarted?                      false          :
          :  GBSA solvation                  false          :
          :  PC potential                    false          :
          :  electronic temp.          300.0000000     K    :
          :  accuracy                    1.0000000          :
          :  -> integral cutoff          0.2500000E+02      :
          :  -> integral neglect         0.1000000E-07      :
          :  -> SCF convergence          0.1000000E-05 Eh   :
          :  -> wf. convergence          0.1000000E-03 e    :
          :  Broyden damping             0.4000000          :
          ...................................................

 iter      E             dE          RMSdq      gap      omega  full diag
   1    -11.1526050 -0.111526E+02  0.654E+00    3.27       0.0  T
   2    -11.1531964 -0.591413E-03  0.448E+00    1.66       1.0  T
   3    -11.2117610 -0.585646E-01  0.292E+00    2.73       1.0  T
   4    -11.2266081 -0.148471E-01  0.378E-01    2.29       1.0  T
   5    -11.2270789 -0.470779E-03  0.153E-01    2.39       1.0  T
   6    -11.2271348 -0.558487E-04  0.629E-02    2.37       1.0  T
   7    -11.2271470 -0.122345E-04  0.114E-02    2.36       3.9  T
   8    -11.2271474 -0.459838E-06  0.266E-03    2.36      16.8  T
   9    -11.2271475 -0.288013E-08  0.149E-03    2.36      30.1  T
  10    -11.2271475 -0.710711E-08  0.820E-04    2.36      54.5  T
  11    -11.2271475 -0.263819E-08  0.726E-05    2.36     616.2  T

   *** convergence criteria satisfied after 11 iterations ***

         #    Occupation            Energy/Eh            Energy/eV
      -------------------------------------------------------------
         1        2.0000           -0.7513616             -20.4456
       ...           ...                  ...                  ...
         3        2.0000           -0.6477137             -17.6252
         4        2.0000           -0.6137649             -16.7014
         5        2.0000           -0.5890588             -16.0291
         6        2.0000           -0.5625589             -15.3080
         7        2.0000           -0.4909435             -13.3593
         8        2.0000           -0.4836704             -13.1613
         9        2.0000           -0.4396242             -11.9628 (HOMO)
        10                         -0.3527897              -9.5999 (LUMO)
        11                          0.0221101               0.6016
        12                          0.0872132               2.3732
        13                          0.1105395               3.0079
        14                          0.1320103               3.5922
      -------------------------------------------------------------
                  HL-Gap            0.0868345 Eh            2.3629 eV
             Fermi-level           -0.3962069 Eh          -10.7813 eV

 SCC (total)                   0 d,  0 h,  0 min,  0.002 sec
 SCC setup                      ...        0 min,  0.000 sec (  3.207%)
 Dispersion                     ...        0 min,  0.000 sec (  0.518%)
 integral evaluation            ...        0 min,  0.001 sec ( 26.238%)
 zeroth order Hamiltonian       ...        0 min,  0.000 sec (  0.563%)
 iterations                     ...        0 min,  0.001 sec ( 41.202%)
 molecular gradient             ...        0 min,  0.001 sec ( 25.923%)
 printout                       ...        0 min,  0.000 sec (  1.935%)

         :::::::::::::::::::::::::::::::::::::::::::::::::::::
         ::                     SUMMARY                     ::
         :::::::::::::::::::::::::::::::::::::::::::::::::::::
         :: total energy             -11.183874789085 Eh    ::
         :: gradient norm              0.262023696978 Eh/a0 ::
         :: HOMO-LUMO gap              2.362888023175 eV    ::
         ::.................................................::
         :: SCC energy               -11.227147460380 Eh    ::
         :: -> isotropic ES            0.045620923932 Eh    ::
         :: -> anisotropic ES          0.002560676108 Eh    ::
         :: -> anisotropic XC          0.000285674998 Eh    ::
         :: -> dispersion             -0.001158577558 Eh    ::
         :: repulsion energy           0.043272645525 Eh    ::
         :: add. restraining           0.000000000000 Eh    ::
         :::::::::::::::::::::::::::::::::::::::::::::::::::::

      ----------------------------------------------------------- 
     |                   =====================                   |
     |                        A N C O P T                        |
     |                   =====================                   |
     |               Approximate Normal Coordinate               |
     |                Rational Function Optimizer                |
      ----------------------------------------------------------- 

          ...................................................
          :                      SETUP                      :
          :.................................................:
          :   optimization level            normal          :
          :   max. optcycles                   200          :
          :   ANC micro-cycles                  20          :
          :   degrees of freedom                 9          :
          :.................................................:
          :   RF solver                   davidson          :
          :   write xtbopt.log                true          :
          :   linear?                        false          :
          :   energy convergence         0.5000000E-05 Eh   :
          :   grad. convergence          0.1000000E-02 Eh/α :
          :   maximium RF displ.         1.0000000          :
          :   Hlow (freq-cutoff)         0.1000000E-01      :
          :   Hmax (freq-cutoff)         5.0000000          :
          :   S6 in model hess.         20.0000000          :
          ...................................................

generating ANC from model Hessian ...
Using Lindh-Hessian (1995)
 Shifting diagonal of input Hessian by    0.0000000000000000     
 Lowest  eigenvalues of input Hessian
   -0.000000   -0.000000   -0.000000   -0.000000    0.000000    0.000000
    0.030544    0.100120    0.118762    0.136316    0.212089    0.727795
    1.165092    1.241245    1.455811
 Highest eigenvalues
    0.136316    0.212089    0.727795    1.165092    1.241245    1.455811


........................................................................
.............................. CYCLE    1 ..............................
........................................................................
   1    -11.2271475 -0.112271E+02  0.483E-05    2.36       0.0  T
   2    -11.2271475  0.359002E-11  0.521E-05    2.36     857.9  T
   3    -11.2271475 -0.132037E-10  0.110E-05    2.36    4063.6  T
     SCC iter.                  ...        0 min,  0.000 sec
     gradient                   ...        0 min,  0.001 sec
 * total energy  :   -11.1838748 Eh     change       -0.7055512E-09 Eh
   gradient norm :     0.2620237 Eh/α   predicted     0.0000000E+00 (-100.00%)
   displ. norm   :     0.4184587 α      lambda       -0.7918035E-01
   maximum displ.:     0.2741765 α      in ANC's #3, #2, #6, ...

........................................................................
.............................. CYCLE    2 ..............................
........................................................................
   1    -11.3008232 -0.113008E+02  0.149E+00    3.79       0.0  T
   2    -11.3018612 -0.103794E-02  0.897E-01    3.62       1.0  T
   3    -11.3016852  0.175946E-03  0.567E-01    3.78       1.0  T
   4    -11.3022865 -0.601250E-03  0.932E-02    3.69       1.0  T
   5    -11.3022889 -0.245213E-05  0.325E-02    3.69       1.4  T
   6    -11.3022895 -0.558699E-06  0.985E-03    3.69       4.5  T
   7    -11.3022895 -0.394055E-07  0.136E-03    3.69      33.0  T
   8    -11.3022895 -0.209255E-08  0.581E-04    3.69      77.0  T
   9    -11.3022895 -0.315183E-09  0.101E-04    3.69     442.4  T
     SCC iter.                  ...        0 min,  0.001 sec
     gradient                   ...        0 min,  0.001 sec
 * total energy  :   -11.2441147 Eh     change       -0.6023988E-01 Eh
   gradient norm :     0.1649905 Eh/α   predicted    -0.4652275E-01 ( -22.77%)
   displ. norm   :     0.4116901 α      lambda       -0.5855245E-01
   maximum displ.:     0.2362440 α      in ANC's #6, #8, #1, ...

........................................................................
.............................. CYCLE    3 ..............................
........................................................................
   1    -11.3780500 -0.113781E+02  0.183E+00    6.13       0.0  T
   2    -11.3823820 -0.433198E-02  0.952E-01    5.88       1.0  T
   3    -11.3825674 -0.185426E-03  0.467E-01    5.85       1.0  T
   4    -11.3825890 -0.215678E-04  0.989E-02    5.82       1.0  T
   5    -11.3826012 -0.122466E-04  0.295E-02    5.83       1.5  T
   6    -11.3826018 -0.526424E-06  0.872E-03    5.83       5.1  T
   7    -11.3826018 -0.785529E-08  0.244E-03    5.83      18.3  T
   8    -11.3826018 -0.141408E-07  0.361E-04    5.83     123.9  T
   9    -11.3826018 -0.858051E-10  0.773E-05    5.83     578.4  T
     SCC iter.                  ...        0 min,  0.000 sec
     gradient                   ...        0 min,  0.001 sec
 * total energy  :   -11.2399652 Eh     change        0.4149442E-02 Eh
   gradient norm :     0.3843128 Eh/α   predicted    -0.3423821E-01 (-925.13%)
   displ. norm   :     0.2294695 α      lambda       -0.7105286E-01
   maximum displ.:     0.1230707 α      in ANC's #2, #8, #9, ...

........................................................................
.............................. CYCLE    4 ..............................
........................................................................
   1    -11.3357845 -0.113358E+02  0.114E+00    4.52       0.0  T
   2    -11.3389585 -0.317398E-02  0.539E-01    4.58       1.0  T
   3    -11.3389882 -0.297267E-04  0.319E-01    4.59       1.0  T
   4    -11.3389912 -0.294136E-05  0.433E-02    4.61       1.0  T
   5    -11.3389950 -0.378680E-05  0.249E-02    4.60       1.8  T
   6    -11.3389959 -0.926632E-06  0.745E-03    4.60       6.0  T
   7    -11.3389959 -0.195657E-07  0.587E-04    4.60      76.2  T
   8    -11.3389959 -0.400002E-09  0.305E-04    4.60     146.8  T
     SCC iter.                  ...        0 min,  0.000 sec
     gradient                   ...        0 min,  0.001 sec
 * total energy  :   -11.2650747 Eh     change       -0.2510949E-01 Eh
   gradient norm :     0.0497389 Eh/α   predicted    -0.3739711E-01 (  48.94%)
   displ. norm   :     0.1741444 α      lambda       -0.3286355E-02
   maximum displ.:     0.1657254 α      in ANC's #1, #6, #3, ...

........................................................................
.............................. CYCLE    5 ..............................
........................................................................
   1    -11.3458930 -0.113459E+02  0.481E-01    4.81       0.0  T
   2    -11.3459333 -0.402455E-04  0.295E-01    4.79       1.0  T
   3    -11.3459345 -0.119323E-05  0.715E-02    4.80       1.0  T
   4    -11.3459420 -0.753559E-05  0.174E-02    4.79       2.6  T
   5    -11.3459425 -0.469084E-06  0.748E-03    4.79       6.0  T
   6    -11.3459425 -0.276548E-07  0.238E-03    4.79      18.8  T
   7    -11.3459425 -0.195643E-08  0.228E-04    4.79     196.0  T
   8    -11.3459425 -0.196767E-10  0.755E-05    4.79     592.4  T
     SCC iter.                  ...        0 min,  0.001 sec
     gradient                   ...        0 min,  0.001 sec
 * total energy  :   -11.2673343 Eh     change       -0.2259578E-02 Eh
   gradient norm :     0.0366286 Eh/α   predicted    -0.1693008E-02 ( -25.07%)
   displ. norm   :     0.1225834 α      lambda       -0.3444292E-02
   maximum displ.:     0.0774300 α      in ANC's #6, #7, #1, ...

........................................................................
.............................. CYCLE    6 ..............................
........................................................................
   1    -11.3633944 -0.113634E+02  0.354E-01    5.09       0.0  T
   2    -11.3634654 -0.709690E-04  0.211E-01    5.05       1.0  T
   3    -11.3634708 -0.535593E-05  0.104E-01    5.07       1.0  T
   4    -11.3634794 -0.865025E-05  0.172E-02    5.06       2.6  T
   5    -11.3634796 -0.160312E-06  0.650E-03    5.06       6.9  T
   6    -11.3634796 -0.122210E-07  0.225E-03    5.06      19.9  T
   7    -11.3634796 -0.251846E-08  0.331E-04    5.06     135.1  T
   8    -11.3634796 -0.511431E-10  0.710E-05    5.06     629.8  T
     SCC iter.                  ...        0 min,  0.001 sec
     gradient                   ...        0 min,  0.001 sec
 * total energy  :   -11.2684073 Eh     change       -0.1072980E-02 Eh
   gradient norm :     0.0358630 Eh/α   predicted    -0.1748025E-02 (  62.91%)
   displ. norm   :     0.1793683 α      lambda       -0.2223654E-02
   maximum displ.:     0.1656514 α      in ANC's #1, #3, #7, ...

........................................................................
.............................. CYCLE    7 ..............................
........................................................................
   1    -11.3576422 -0.113576E+02  0.581E-01    5.08       0.0  T
   2    -11.3576984 -0.561492E-04  0.357E-01    5.10       1.0  T
   3    -11.3577026 -0.419131E-05  0.802E-02    5.07       1.0  T
   4    -11.3577136 -0.110132E-04  0.233E-02    5.09       1.9  T
   5    -11.3577141 -0.543792E-06  0.828E-03    5.09       5.4  T
   6    -11.3577141 -0.187455E-07  0.304E-03    5.09      14.7  T
   7    -11.3577141 -0.357195E-08  0.383E-04    5.09     116.8  T
   8    -11.3577141 -0.806448E-10  0.788E-05    5.09     567.9  T
     SCC iter.                  ...        0 min,  0.001 sec
     gradient                   ...        0 min,  0.001 sec
 * total energy  :   -11.2693353 Eh     change       -0.9280180E-03 Eh
   gradient norm :     0.0444764 Eh/α   predicted    -0.1147597E-02 (  23.66%)
   displ. norm   :     0.0447870 α      lambda       -0.1160181E-02
   maximum displ.:     0.0280745 α      in ANC's #2, #1, #7, ...

........................................................................
.............................. CYCLE    8 ..............................
........................................................................
   1    -11.3561060 -0.113561E+02  0.101E-01    4.97       0.0  T
   2    -11.3561194 -0.134286E-04  0.613E-02    4.97       1.0  T
   3    -11.3561211 -0.165976E-05  0.290E-02    4.97       1.5  T
   4    -11.3561213 -0.210132E-06  0.873E-03    4.97       5.1  T
   5    -11.3561213 -0.347937E-07  0.284E-03    4.97      15.7  T
   6    -11.3561214 -0.116177E-07  0.148E-03    4.97      30.3  T
   7    -11.3561214 -0.729244E-09  0.200E-04    4.97     223.6  T
   8    -11.3561214 -0.207088E-10  0.375E-05    4.97    1193.9  T
     SCC iter.                  ...        0 min,  0.001 sec
     gradient                   ...        0 min,  0.001 sec
 * total energy  :   -11.2701142 Eh     change       -0.7789531E-03 Eh
   gradient norm :     0.0190674 Eh/α   predicted    -0.5812554E-03 ( -25.38%)
   displ. norm   :     0.0964759 α      lambda       -0.9774191E-03
   maximum displ.:     0.0569486 α      in ANC's #1, #7, #2, ...

........................................................................
.............................. CYCLE    9 ..............................
........................................................................
   1    -11.3561697 -0.113562E+02  0.326E-01    4.95       0.0  T
   2    -11.3561927 -0.229987E-04  0.203E-01    4.94       1.0  T
   3    -11.3561955 -0.273302E-05  0.388E-02    4.95       1.2  T
   4    -11.3561964 -0.894321E-06  0.106E-02    4.94       4.2  T
   5    -11.3561966 -0.195558E-06  0.473E-03    4.95       9.5  T
   6    -11.3561966 -0.999959E-08  0.148E-03    4.95      30.2  T
   7    -11.3561966 -0.661423E-09  0.161E-04    4.95     278.4  T
   8    -11.3561966 -0.115676E-10  0.574E-05    4.95     779.4  T
     SCC iter.                  ...        0 min,  0.000 sec
     gradient                   ...        0 min,  0.001 sec
 * total energy  :   -11.2708455 Eh     change       -0.7312368E-03 Eh
   gradient norm :     0.0133423 Eh/α   predicted    -0.4932590E-03 ( -32.54%)
   displ. norm   :     0.1484729 α      lambda       -0.8723648E-03
   maximum displ.:     0.0956415 α      in ANC's #1, #7, #4, ...

........................................................................
.............................. CYCLE   10 ..............................
........................................................................
   1    -11.3563539 -0.113564E+02  0.492E-01    4.97       0.0  T
   2    -11.3563737 -0.197484E-04  0.308E-01    4.96       1.0  T
   3    -11.3563798 -0.612375E-05  0.275E-02    4.97       1.6  T
   4    -11.3563810 -0.121307E-05  0.107E-02    4.96       4.2  T
   5    -11.3563812 -0.119393E-06  0.589E-03    4.97       7.6  T
   6    -11.3563812 -0.728291E-08  0.382E-04    4.97     117.0  T
   7    -11.3563812 -0.479581E-10  0.711E-05    4.97     629.1  T
     SCC iter.                  ...        0 min,  0.000 sec
     gradient                   ...        0 min,  0.001 sec
 * total energy  :   -11.2714297 Eh     change       -0.5842287E-03 Eh
   gradient norm :     0.0140018 Eh/α   predicted    -0.4457972E-03 ( -23.69%)
   displ. norm   :     0.0852204 α      lambda       -0.4451913E-03
   maximum displ.:     0.0570233 α      in ANC's #7, #4, #2, ...

........................................................................
.............................. CYCLE   11 ..............................
........................................................................
   1    -11.3592281 -0.113592E+02  0.280E-01    5.03       0.0  T
   2    -11.3592362 -0.806273E-05  0.173E-01    5.02       1.0  T
   3    -11.3592373 -0.113170E-05  0.295E-02    5.03       1.5  T
   4    -11.3592393 -0.203583E-05  0.831E-03    5.02       5.4  T
   5    -11.3592394 -0.395560E-07  0.408E-03    5.02      11.0  T
   6    -11.3592394 -0.319690E-08  0.584E-04    5.02      76.6  T
   7    -11.3592394 -0.214285E-09  0.142E-04    5.02     314.5  T
     SCC iter.                  ...        0 min,  0.000 sec
     gradient                   ...        0 min,  0.001 sec
 * total energy  :   -11.2716572 Eh     change       -0.2274476E-03 Eh
   gradient norm :     0.0048664 Eh/α   predicted    -0.2242105E-03 (  -1.42%)
   displ. norm   :     0.0878440 α      lambda       -0.1621447E-03
   maximum displ.:     0.0513884 α      in ANC's #1, #2, #7, ...

........................................................................
.............................. CYCLE   12 ..............................
........................................................................
   1    -11.3580425 -0.113580E+02  0.282E-01    5.02       0.0  T
   2    -11.3580494 -0.692395E-05  0.176E-01    5.02       1.0  T
   3    -11.3580520 -0.256453E-05  0.154E-02    5.02       2.9  T
   4    -11.3580521 -0.140245E-06  0.658E-03    5.02       6.8  T
   5    -11.3580521 -0.255816E-07  0.343E-03    5.02      13.0  T
   6    -11.3580521 -0.811957E-08  0.904E-04    5.02      49.5  T
   7    -11.3580521 -0.498192E-09  0.140E-04    5.02     318.7  T
     SCC iter.                  ...        0 min,  0.001 sec
     gradient                   ...        0 min,  0.001 sec
 * total energy  :   -11.2716574 Eh     change       -0.2208268E-06 Eh
   gradient norm :     0.0075822 Eh/α   predicted    -0.8169836E-04 (*******%)
   displ. norm   :     0.0441251 α      lambda       -0.1118886E-03
   maximum displ.:     0.0300299 α      in ANC's #1, #7, #2, ...

........................................................................
.............................. CYCLE   13 ..............................
........................................................................
   1    -11.3591591 -0.113592E+02  0.144E-01    5.02       0.0  T
   2    -11.3591616 -0.246997E-05  0.893E-02    5.02       1.0  T
   3    -11.3591624 -0.772922E-06  0.103E-02    5.02       4.4  T
   4    -11.3591624 -0.540055E-07  0.428E-03    5.02      10.4  T
   5    -11.3591624 -0.140589E-07  0.207E-03    5.02      21.6  T
   6    -11.3591624 -0.243285E-08  0.601E-04    5.02      74.4  T
   7    -11.3591624 -0.185802E-09  0.107E-04    5.02     418.8  T
     SCC iter.                  ...        0 min,  0.000 sec
     gradient                   ...        0 min,  0.001 sec
 * total energy  :   -11.2717059 Eh     change       -0.4852543E-04 Eh
   gradient norm :     0.0009422 Eh/α   predicted    -0.5605440E-04 (  15.52%)
   displ. norm   :     0.0100951 α      lambda       -0.2374439E-05
   maximum displ.:     0.0054434 α      in ANC's #7, #4, #1, ...

........................................................................
.............................. CYCLE   14 ..............................
........................................................................
   1    -11.3589833 -0.113590E+02  0.328E-02    5.02       0.0  T
   2    -11.3589834 -0.118126E-06  0.204E-02    5.02       2.2  T
   3    -11.3589834 -0.147614E-07  0.337E-03    5.02      13.3  T
   4    -11.3589835 -0.254701E-07  0.900E-04    5.02      49.7  T
   5    -11.3589835 -0.821624E-09  0.401E-04    5.02     111.6  T
     SCC iter.                  ...        0 min,  0.000 sec
     gradient                   ...        0 min,  0.001 sec
 * total energy  :   -11.2717071 Eh     change       -0.1172708E-05 Eh
   gradient norm :     0.0004542 Eh/α   predicted    -0.1188257E-05 (   1.33%)
   displ. norm   :     0.0016887 α      lambda       -0.3988283E-06
   maximum displ.:     0.0010862 α      in ANC's #3, #2, #4, ...

   *** GEOMETRY OPTIMIZATION CONVERGED AFTER 14 ITERATIONS ***

------------------------------------------------------------------------
 total energy gain   :        -0.0878323 Eh      -55.1156 kcal/mol
 total RMSD          :         0.5321221 a0        0.2816 Å
 total power (kW/mol):       -16.4716886 (step)-8621.5907 (real)
------------------------------------------------------------------------

 ANCopt (total)                0 d,  0 h,  0 min,  0.027 sec
 optimizer setup                ...        0 min,  0.000 sec (  0.510%)
 model hessian                  ...        0 min,  0.000 sec (  0.287%)
 ANC generation                 ...        0 min,  0.000 sec (  0.160%)
 coordinate transformation      ...        0 min,  0.000 sec (  0.100%)
 single point calculation       ...        0 min,  0.025 sec ( 95.247%)
 optimization log               ...        0 min,  0.000 sec (  1.231%)
 hessian update                 ...        0 min,  0.000 sec (  0.095%)
 rational function              ...        0 min,  0.000 sec (  0.919%)

================
 final structure:
================
5
 xtb: 6.2.2 (9d81278992624c895f80dd42a50cac0aa55982e2)
C        -0.42501838918039    0.07674668367457    0.01641474637196
O         0.86413564202903    0.35865335207775    0.21403456016504
O        -1.30889858596877    0.80638531046557    0.32387127429594
H        -0.59705750272625   -0.90940472597318   -0.46641969007306
H         1.46683983584637   -0.33238062024471   -0.08790089075988

 Bond Distances (Angstroems)
 ---------------------------
C1-O2=1.3343         C1-O3=1.1867         C1-H4=1.1114         O2-C1=1.3343         O2-H5=0.9654         O3-C1=1.1867         
H4-C1=1.1114         H5-O2=0.9654         
 C  H  Rav=1.1114 sigma=0.0000  Rmin=1.1114  Rmax=1.1114     1
 O  H  Rav=0.9654 sigma=0.0000  Rmin=0.9654  Rmax=0.9654     1
 O  C  Rav=1.2605 sigma=0.0738  Rmin=1.1867  Rmax=1.3343     2

 selected bond angles (degree)
 --------------------
O3-C1-O2=123.46                H4-C1-O2=113.66                H4-C1-O3=122.88                H5-O2-C1=113.93                

 selected dihedral angles (degree)
 ---------------------------------
H5-O2-C1-O3=179.97            H5-O2-C1-H4=359.90            
           -------------------------------------------------
          |                Final Singlepoint                |
           -------------------------------------------------

          ...................................................
          :                      SETUP                      :
          :.................................................:
          :  # basis functions                  14          :
          :  # atomic orbitals                  14          :
          :  # shells                            8          :
          :  # electrons                        18          :
          :  max. iterations                   250          :
          :  Hamiltonian                  GFN2-xTB          :
          :  restarted?                      false          :
          :  GBSA solvation                  false          :
          :  PC potential                    false          :
          :  electronic temp.          300.0000000     K    :
          :  accuracy                    1.0000000          :
          :  -> integral cutoff          0.2500000E+02      :
          :  -> integral neglect         0.1000000E-07      :
          :  -> SCF convergence          0.1000000E-05 Eh   :
          :  -> wf. convergence          0.1000000E-03 e    :
          :  Broyden damping             0.4000000          :
          ...................................................

 iter      E             dE          RMSdq      gap      omega  full diag
   1    -11.3589835 -0.113590E+02  0.589E-05    5.02       0.0  T
   2    -11.3589835 -0.214051E-11  0.298E-05    5.02    1498.9  T
   3    -11.3589835 -0.367706E-12  0.100E-05    5.02    4456.7  T

   *** convergence criteria satisfied after 3 iterations ***

         #    Occupation            Energy/Eh            Energy/eV
      -------------------------------------------------------------
         1        2.0000           -0.7628053             -20.7570
       ...           ...                  ...                  ...
         3        2.0000           -0.6642501             -18.0752
         4        2.0000           -0.6388550             -17.3841
         5        2.0000           -0.5944361             -16.1754
         6        2.0000           -0.5703618             -15.5203
         7        2.0000           -0.5293903             -14.4054
         8        2.0000           -0.4956410             -13.4871
         9        2.0000           -0.4389204             -11.9436 (HOMO)
        10                         -0.2542901              -6.9196 (LUMO)
        11                          0.0439365               1.1956
        12                          0.1013243               2.7572
        13                          0.2950455               8.0286
        14                          0.6376768              17.3521
      -------------------------------------------------------------
                  HL-Gap            0.1846304 Eh            5.0240 eV
             Fermi-level           -0.3466053 Eh           -9.4316 eV

 SCC (total)                   0 d,  0 h,  0 min,  0.002 sec
 SCC setup                      ...        0 min,  0.000 sec (  1.934%)
 Dispersion                     ...        0 min,  0.000 sec (  0.357%)
 integral evaluation            ...        0 min,  0.001 sec ( 27.809%)
 zeroth order Hamiltonian       ...        0 min,  0.000 sec (  1.343%)
 iterations                     ...        0 min,  0.000 sec ( 15.402%)
 molecular gradient             ...        0 min,  0.001 sec ( 47.573%)
 printout                       ...        0 min,  0.000 sec (  4.436%)

         :::::::::::::::::::::::::::::::::::::::::::::::::::::
         ::                     SUMMARY                     ::
         :::::::::::::::::::::::::::::::::::::::::::::::::::::
         :: total energy             -11.271707076318 Eh    ::
         :: gradient norm              0.000459459731 Eh/a0 ::
         :: HOMO-LUMO gap              5.024047828434 eV    ::
         ::.................................................::
         :: SCC energy               -11.358983452023 Eh    ::
         :: -> isotropic ES            0.041636951038 Eh    ::
         :: -> anisotropic ES          0.003823223406 Eh    ::
         :: -> anisotropic XC         -0.001582277199 Eh    ::
         :: -> dispersion             -0.001222070332 Eh    ::
         :: repulsion energy           0.087276362654 Eh    ::
         :: add. restraining           0.000000000000 Eh    ::
         :::::::::::::::::::::::::::::::::::::::::::::::::::::

           ------------------------------------------------- 
          |                Numerical Hessian                |
           ------------------------------------------------- 
step length          :   0.00500
SCC accuracy         :   0.30000
Hessian scale factor :   1.00000
frozen atoms in %    :   0.00000    0
RMS gradient         :   0.00046
estimated CPU  time      0.00 min
estimated wall time      0.00 min

writing file <hessian>.

 projected vibrational frequencies (cm-1)
eigval :       -0.00    -0.00     0.00     0.00     0.00     0.00
eigval :      488.00   609.92   951.20  1107.30  1184.52  1408.94
eigval :     1827.31  2729.19  3506.81
           -------------------------------------------------
          |                Property Printout                |
           -------------------------------------------------

    * Orbital Energies and Occupations

         #    Occupation            Energy/Eh            Energy/eV
      -------------------------------------------------------------
         1        2.0000           -0.7628053             -20.7570
         2        2.0000           -0.7380973             -20.0846
         3        2.0000           -0.6642501             -18.0752
         4        2.0000           -0.6388550             -17.3841
         5        2.0000           -0.5944360             -16.1754
         6        2.0000           -0.5703618             -15.5203
         7        2.0000           -0.5293903             -14.4054
         8        2.0000           -0.4956410             -13.4871
         9        2.0000           -0.4389204             -11.9436 (HOMO)
        10                         -0.2542900              -6.9196 (LUMO)
        11                          0.0439366               1.1956
        12                          0.1013243               2.7572
        13                          0.2950456               8.0286
        14                          0.6376769              17.3521
      -------------------------------------------------------------
                  HL-Gap            0.1846304 Eh            5.0240 eV
             Fermi-level           -0.3466052 Eh           -9.4316 eV

     #   Z        covCN         q      C6AA      α(0)
     1   6 C      2.631     0.344    21.162     7.525
     2   8 O      1.659    -0.348    19.863     6.016
     3   8 O      0.856    -0.325    20.230     6.030
     4   1 H      0.921     0.001     3.045     2.729
     5   1 H      0.805     0.327     0.644     1.261

 Mol. C6AA /au·bohr⁶  :        257.204342
 Mol. C8AA /au·bohr⁸  :       5406.978052
 Mol. α(0) /au        :         23.561265


Wiberg/Mayer (AO) data.
largest (>0.10) Wiberg bond orders for each atom
          total WBO             WBO to atom ...
     1  C   3.923        O    3 1.854    O    2 1.148    H    4 0.920
     2  O   2.230        C    1 1.148    H    5 0.876    O    3 0.184
     3  O   2.111        C    1 1.854    O    2 0.184
     4  H   1.000        C    1 0.920
     5  H   0.893        O    2 0.876

MOs/occ written to file <molden.input>


molecular dipole:
                 x           y           z       tot (Debye)
 q only:        0.865      -0.887      -0.384
   full:        1.058      -1.237      -0.542       4.360
molecular quadrupole (traceless):
                xx          xy          yy          xz          yz          zz
 q only:        0.296       0.345      -0.603       0.155      -0.542       0.306
Molecule has the following symmetry elements: (sigma) 
It seems to be the Cs point group
  q+dip:       -0.743       0.513      -0.115       0.159      -0.570       0.858
   full:       -0.735       0.525      -0.512       0.134      -1.062       1.247

           -------------------------------------------------
          |                Geometry Summary                 |
           -------------------------------------------------

      molecular mass/u    :       46.0254272
   center of mass at/Å    :       -0.2464705       0.3978266       0.1791317
  moments of inertia/u·Å² :        0.5602290E+01   0.4301487E+02   0.4861715E+02
rotational constants/cm⁻¹ :        0.3009061E+01   0.3919025E+00   0.3467425E+00

 * 3 selected distances

     #   Z        #   Z                                     value/Å
     1   6 C      2   8 O                                 1.3343324 (max)
     1   6 C      3   8 O                                 1.1866534
     2   8 O      5   1 H                                 0.9653731 (min)

 * 2 distinct bonds (by element types)

   Z      Z             #   av. dist./Å        max./Å        min./Å
   1 H    8 O           1     0.9653731     0.9653731     0.9653731
   6 C    8 O           2     1.2604929     1.3343324     1.1866534

           -------------------------------------------------
          |               Frequency Printout                |
           -------------------------------------------------
 projected vibrational frequencies (cm-1)
eigval :       -0.00    -0.00     0.00     0.00     0.00     0.00
eigval :      488.00   609.92   951.20  1107.30  1184.52  1408.94
eigval :     1827.31  2729.19  3506.81
 reduced masses (amu)
   1: 12.27   2: 14.22   3: 13.14   4: 13.20   5: 12.88   6: 14.25   7:  2.59   8: 13.50
   9:  6.11  10:  7.46  11:  9.32  12:  2.17  13: 13.41  14:  1.67  15:  1.87
 IR intensities (amu)
   1:  0.37   2:  0.24   3:  0.45   4:  0.10   5:  0.48   6:  0.25   7:  0.32   8:  0.58
   9:  0.49  10:  0.98  11:  2.03  12:  0.33  13:  2.49  14:  0.62  15:  0.31
 Raman intensities (amu)
   1:  0.00   2:  0.00   3:  0.00   4:  0.00   5:  0.00   6:  0.00   7:  0.00   8:  0.00
   9:  0.00  10:  0.00  11:  0.00  12:  0.00  13:  0.00  14:  0.00  15:  0.00
 output can be read by thermo (or use thermo option).
 writing <g98.out> molden fake output.
 recommended (thermochemical) frequency scaling factor: 1.0
           -------------------------------------------------
          |             Thermodynamic Functions             |
           -------------------------------------------------

cs  symmetry found (for desy threshold:  0.10E+00) used in thermo

          ...................................................
          :                      SETUP                      :
          :.................................................:
          :  # frequencies                           9      :
          :  # imaginary freq.                       0      :
          :  linear?                             false      :
          :  only rotor calc.                    false      :
          :  symmetry                               cs      :
          :  rotational number                       1      :
          :  scaling factor                  1.0000000      :
          :  rotor cutoff                   50.0000000 cm⁻¹ :
          :  imag. cutoff                  -20.0000000 cm⁻¹ :
          :.................................................:

    mode    ω/cm⁻¹     T·S(HO)/kcal·mol⁻¹    T·S(FR)/kcal·mol⁻¹   T·S(vib)
   ------------------------------------------------------------------------
   ------------------------------------------------------------------------

   temp. (K)  partition function   enthalpy   heat capacity  entropy
                                   cal/mol     cal/K/mol   cal/K/mol   J/K/mol
 298.15  VIB   1.19                  302.863      3.337      1.360
         ROT  0.827E+04              888.752      2.981     20.906
         INT  0.983E+04             1191.615      6.317     22.267
         TR   0.302E+27             1481.254      4.968     37.388
         TOT                        2672.8690    11.2855    59.6549   249.5961

   temp. (K)  partition function   enthalpy   heat capacity  entropy
                                   cal/mol     cal/K/mol   cal/K/mol   J/K/mol
 120.00  VIB   1.00                    5.228      0.272      0.051
         ROT  0.211E+04              357.707      2.981     18.193
         INT  0.212E+04              362.934      3.252     18.244
         TR   0.771E+26              596.178      4.968     32.869
         TOT                         959.1124     8.2206    51.1128   213.8561

   temp. (K)  partition function   enthalpy   heat capacity  entropy
                                   cal/mol     cal/K/mol   cal/K/mol   J/K/mol
 100.00  VIB   1.00                    1.520      0.112      0.017
         ROT  0.161E+04              298.089      2.981     17.650
         INT  0.161E+04              299.609      3.093     17.667
         TR   0.587E+26              496.815      4.968     31.963
         TOT                         796.4237     8.0608    49.6306   207.6545

   temp. (K)  partition function   enthalpy   heat capacity  entropy
                                   cal/mol     cal/K/mol   cal/K/mol   J/K/mol
  80.00  VIB   1.00                    0.245      0.028      0.003
         ROT  0.115E+04              238.471      2.981     16.985
         INT  0.115E+04              238.717      3.009     16.988
         TR   0.420E+26              397.452      4.968     30.855
         TOT                         636.1687     7.9768    47.8435   200.1771

   temp. (K)  partition function   enthalpy   heat capacity  entropy
                                   cal/mol     cal/K/mol   cal/K/mol   J/K/mol
  60.00  VIB   1.00                    0.012      0.002      0.000
         ROT   746.                  178.853      2.981     16.127
         INT   746.                  178.866      2.983     16.127
         TR   0.273E+26              298.089      4.968     29.427
         TOT                         476.9547     7.9515    45.5541   190.5985

   temp. (K)  partition function   enthalpy   heat capacity  entropy
                                   cal/mol     cal/K/mol   cal/K/mol   J/K/mol
  40.00  VIB   1.00                    0.000      0.000     -0.000
         ROT   406.                  119.236      2.981     14.919
         INT   406.                  119.236      2.981     14.918
         TR   0.148E+26              198.726      4.968     27.413
         TOT                         317.9616     7.9491    42.3318   177.1161

   temp. (K)  partition function   enthalpy   heat capacity  entropy
                                   cal/mol     cal/K/mol   cal/K/mol   J/K/mol
  20.00  VIB   1.00                    0.000      0.000     -0.000
         ROT   144.                   59.618      2.981     12.852
         INT   144.                   59.618      2.981     12.852
         TR   0.525E+25               99.363      4.968     23.971
         TOT                         158.9808     7.9490    36.8235   154.0694

   temp. (K)  partition function   enthalpy   heat capacity  entropy
                                   cal/mol     cal/K/mol   cal/K/mol   J/K/mol
  10.00  VIB   1.00                    0.000      0.000     -0.000
         ROT   50.8                   29.809      2.981     10.786
         INT   50.8                   29.809      2.981     10.786
         TR   0.186E+25               49.681      4.968     20.529
         TOT                          79.4904     7.9490    31.3152   131.0227

       T/K    H(0)-H(T)+PV         H(T)/Eh          T*S/Eh         G(T)/Eh
   ------------------------------------------------------------------------
    298.15    0.425949E-02    0.357282E-01    0.283440E-01    0.738428E-02
    120.00    0.152844E-02    0.329972E-01    0.977442E-02    0.232228E-01
    100.00    0.126918E-02    0.327379E-01    0.790914E-02    0.248288E-01
     80.00    0.101380E-02    0.324826E-01    0.609947E-02    0.263831E-01
     60.00    0.760076E-03    0.322288E-01    0.435571E-02    0.278731E-01
     40.00    0.506704E-03    0.319755E-01    0.269840E-02    0.292771E-01
     20.00    0.253352E-03    0.317221E-01    0.117364E-02    0.305485E-01
     10.00    0.126676E-03    0.315954E-01    0.499039E-03    0.310964E-01 (used)
   ------------------------------------------------------------------------

         :::::::::::::::::::::::::::::::::::::::::::::::::::::
         ::                  THERMODYNAMIC                  ::
         :::::::::::::::::::::::::::::::::::::::::::::::::::::
         :: total free energy         -11.240610682860 Eh   ::
         ::.................................................::
         :: total energy              -11.271707076094 Eh   ::
         :: zero point energy           0.031468756405 Eh   ::
         :: G(RRHO) w/o ZPVE           -0.000372363172 Eh   ::
         :: G(RRHO) contrib.            0.031096393234 Eh   ::
         :::::::::::::::::::::::::::::::::::::::::::::::::::::

optimized geometry written to: xtbopt.xyz


           -------------------------------------------------
          | TOTAL ENERGY              -11.271707076094 Eh   |
          | TOTAL ENTHALPY            -11.240111643673 Eh   |
          | TOTAL FREE ENERGY         -11.240610682860 Eh   |
          | GRADIENT NORM               0.000459485375 Eh/α |
          | HOMO-LUMO GAP               5.024048738676 eV   |
           -------------------------------------------------

------------------------------------------------------------------------
 * finished run on 2020/05/12 at 11:43:52.276     
------------------------------------------------------------------------
 total:
 * wall-time:     0 d,  0 h,  0 min,  0.094 sec
 *  cpu-time:     0 d,  0 h,  0 min,  0.094 sec
 * ratio c/w:     0.998 speedup
 SCF:
 * wall-time:     0 d,  0 h,  0 min,  0.002 sec
 *  cpu-time:     0 d,  0 h,  0 min,  0.002 sec
 * ratio c/w:     1.000 speedup
 ANC optimizer:
 * wall-time:     0 d,  0 h,  0 min,  0.029 sec
 *  cpu-time:     0 d,  0 h,  0 min,  0.029 sec
 * ratio c/w:     0.999 speedup
 numerical hessian:
 * wall-time:     0 d,  0 h,  0 min,  0.047 sec
 *  cpu-time:     0 d,  0 h,  0 min,  0.047 sec
 * ratio c/w:     0.998 speedup

