      -----------------------------------------------------------      
     |                   =====================                   |     
     |                           x T B                           |     
     |                   =====================                   |     
     |                         S. Grimme                         |     
     |          Mulliken Center for Theoretical Chemistry        |     
     |                    University of Bonn                     |     
      -----------------------------------------------------------      

   * xtb version 6.2.2 (9d81278992624c895f80dd42a50cac0aa55982e2) compiled by '@Darwin' on 04/03/2020

   xtb is free software: you can redistribute it and/or modify it under
   the terms of the GNU Lesser General Public License as published by
   the Free Software Foundation, either version 3 of the License, or
   (at your option) any later version.
   
   xtb is distributed in the hope that it will be useful,
   but WITHOUT ANY WARRANTY; without even the implied warranty of
   MERCHANTABILITY or FITNESS FOR A PARTICULAR PURPOSE.  See the
   GNU Lesser General Public License for more details.
   
   Cite this work as:
   * S. Grimme, C. Bannwarth, P. Shushkov, J. Chem. Theory Comput., 2017,
     13, 1989-2009. DOI: 10.1021/acs.jctc.7b00118
   * C. Bannwarth, S. Ehlert and S. Grimme., J. Chem. Theory Comput., 2019,
     15, 1652-1671. DOI: 10.1021/acs.jctc.8b01176
   * P. Pracht, E. Caldeweyher, S. Ehlert, S. Grimme, ChemRxiv, 2019, preprint.
     DOI: 10.26434/chemrxiv.8326202.v1
   
   for DFT-D4:
   * E. Caldeweyher, C. Bannwarth and S. Grimme, J. Chem. Phys., 2017,
     147, 034112. DOI: 10.1063/1.4993215
   * E. Caldeweyher, S. Ehlert, A. Hansen, H. Neugebauer, S. Spicher,
     C. Bannwarth and S. Grimme, J. Chem. Phys., 2019, 150, 154122.
     DOI: 10.1063/1.5090222
   
   for sTDA-xTB:
   * S. Grimme and C. Bannwarth, J. Chem. Phys., 2016, 145, 054103.
     DOI: 10.1063/1.4959605
   
   in the mass-spec context:
   * V. Asgeirsson, C. Bauer and S. Grimme, Chem. Sci., 2017, 8, 4879.
     DOI: 10.1039/c7sc00601b
   
   for metadynamics refer to:
   * S. Grimme, J. Chem. Theory Comput., 2019, 155, 2847-2862
     DOI: 10.1021/acs.jctc.9b00143
   
   with help from (in alphabetical order)
   C. Bannwarth, F. Bohle, G. Brandenburg, E. Caldeweyher, M. Checinski,
   S. Dohm, S. Ehlert, S. Ehrlich, F. März, H. Neugebauer, J. Pisarek,
   P. Pracht, P. Shushkov, and S. Spicher.
   
 * started run on 2020/05/12 at 11:44:28.484     

           -------------------------------------------------
          |                Calculation Setup                |
           -------------------------------------------------

          program call               : xtb --input H3C1N1_2_S_2.input H3C1N1_2_S_2.xyz --ohess --molden --namespace H3C1N1_2_S_2 output.out
          calculation namespace      : H3C1N1_2_S_2
          coordinate file            : H3C1N1_2_S_2.xyz
          number of atoms            :                     5
          number of electrons        :                    12
          charge                     :                     0
          spin                       :                   1.0
          first test random number   :      0.28883870275664

   ID    Z sym.   atoms
    1    6 C      1
    2    7 N      2
    3    1 H      3-5

           -------------------------------------------------
          |                 G F N 2 - x T B                 |
           -------------------------------------------------

        Reference                      10.1021/acs.jctc.8b01176
      * Hamiltonian:
        H0-scaling (s, p, d)           1.850000    2.230000    2.230000
        zeta-weighting                 0.500000
      * Dispersion:
        s8                             2.700000
        a1                             0.520000
        a2                             5.000000
        s9                             5.000000
      * Repulsion:
        kExp                           1.500000    1.000000
        rExp                           1.000000
      * Coulomb:
        alpha                          2.000000
        third order                    shell-resolved
        anisotropic                    true
        a3                             3.000000
        a5                             4.000000
        cn-shift                       1.200000
        cn-exp                         4.000000
        max-rad                        5.000000


          ...................................................
          :                      SETUP                      :
          :.................................................:
          :  # basis functions                  11          :
          :  # atomic orbitals                  11          :
          :  # shells                            7          :
          :  # electrons                        12          :
          :  max. iterations                   250          :
          :  Hamiltonian                  GFN2-xTB          :
          :  restarted?                      false          :
          :  GBSA solvation                  false          :
          :  PC potential                    false          :
          :  electronic temp.          300.0000000     K    :
          :  accuracy                    1.0000000          :
          :  -> integral cutoff          0.2500000E+02      :
          :  -> integral neglect         0.1000000E-07      :
          :  -> SCF convergence          0.1000000E-05 Eh   :
          :  -> wf. convergence          0.1000000E-03 e    :
          :  Broyden damping             0.4000000          :
          ...................................................

 iter      E             dE          RMSdq      gap      omega  full diag
   1     -6.3607022 -0.636070E+01  0.431E+00    9.61       0.0  T
   2     -6.3971128 -0.364106E-01  0.333E+00    7.80       1.0  T
   3     -6.4203027 -0.231898E-01  0.176E+00    8.63       1.0  T
   4     -6.4186190  0.168367E-02  0.793E-01    9.07       1.0  T
   5     -6.4217026 -0.308362E-02  0.263E-01    8.70       1.0  T
   6     -6.4219132 -0.210585E-03  0.598E-02    8.76       1.0  T
   7     -6.4219133 -0.111248E-06  0.133E-02    8.76       3.4  T
   8     -6.4219134 -0.815807E-07  0.485E-03    8.76       9.2  T
   9     -6.4219135 -0.878532E-07  0.160E-03    8.76      28.0  T
  10     -6.4219135 -0.112806E-07  0.260E-04    8.76     171.7  T
  11     -6.4219135 -0.246501E-09  0.450E-05    8.76     993.4  T

   *** convergence criteria satisfied after 11 iterations ***

         #    Occupation            Energy/Eh            Energy/eV
      -------------------------------------------------------------
         1        2.0000           -0.6216809             -16.9168
         2        2.0000           -0.5564269             -15.1411
         3        2.0000           -0.5285334             -14.3821
         4        2.0000           -0.4998330             -13.6011
         5        2.0000           -0.4173906             -11.3578
         6        1.0000           -0.3432706              -9.3409
         7        1.0000           -0.2997767              -8.1573 (HOMO)
         8                          0.0222337               0.6050 (LUMO)
         9                          0.1191231               3.2415
        10                          0.1435213               3.9054
        11                          0.1885784               5.1315
      -------------------------------------------------------------
                  HL-Gap            0.3220104 Eh            8.7624 eV
             Fermi-level           -0.2595510 Eh           -7.0627 eV

 transition dipole moment (au) for excitation:           6           7
     X       Y       Z   
   0.0175   0.1891   0.0566  total (au/Debye):    0.198   0.504
 dE (eV)             :    1.184
 oscillator strength :  0.16107E-02

 SCC (total)                   0 d,  0 h,  0 min,  0.002 sec
 SCC setup                      ...        0 min,  0.000 sec (  3.985%)
 Dispersion                     ...        0 min,  0.000 sec (  0.599%)
 integral evaluation            ...        0 min,  0.000 sec ( 19.815%)
 zeroth order Hamiltonian       ...        0 min,  0.000 sec (  0.686%)
 iterations                     ...        0 min,  0.001 sec ( 37.224%)
 molecular gradient             ...        0 min,  0.000 sec ( 20.414%)
 printout                       ...        0 min,  0.000 sec ( 16.897%)

         :::::::::::::::::::::::::::::::::::::::::::::::::::::
         ::                     SUMMARY                     ::
         :::::::::::::::::::::::::::::::::::::::::::::::::::::
         :: total energy              -6.368782899413 Eh    ::
         :: gradient norm              0.088113205101 Eh/a0 ::
         :: HOMO-LUMO gap              8.762350251096 eV    ::
         ::.................................................::
         :: SCC energy                -6.421913500264 Eh    ::
         :: -> isotropic ES            0.007620996517 Eh    ::
         :: -> anisotropic ES          0.004227663579 Eh    ::
         :: -> anisotropic XC          0.005585825347 Eh    ::
         :: -> dispersion             -0.001003037151 Eh    ::
         :: repulsion energy           0.053130586764 Eh    ::
         :: add. restraining           0.000000000000 Eh    ::
         :::::::::::::::::::::::::::::::::::::::::::::::::::::

      ----------------------------------------------------------- 
     |                   =====================                   |
     |                        A N C O P T                        |
     |                   =====================                   |
     |               Approximate Normal Coordinate               |
     |                Rational Function Optimizer                |
      ----------------------------------------------------------- 

          ...................................................
          :                      SETUP                      :
          :.................................................:
          :   optimization level            normal          :
          :   max. optcycles                   200          :
          :   ANC micro-cycles                  20          :
          :   degrees of freedom                 9          :
          :.................................................:
          :   RF solver                   davidson          :
          :   write xtbopt.log                true          :
          :   linear?                        false          :
          :   energy convergence         0.5000000E-05 Eh   :
          :   grad. convergence          0.1000000E-02 Eh/α :
          :   maximium RF displ.         1.0000000          :
          :   Hlow (freq-cutoff)         0.1000000E-01      :
          :   Hmax (freq-cutoff)         5.0000000          :
          :   S6 in model hess.         20.0000000          :
          ...................................................

generating ANC from model Hessian ...
Using Lindh-Hessian (1995)
 Shifting diagonal of input Hessian by    0.0000000000000000     
 Lowest  eigenvalues of input Hessian
   -0.000000   -0.000000   -0.000000    0.000000    0.000000    0.000000
    0.016563    0.045777    0.132345    0.168071    0.199428    0.664883
    0.863055    1.174721    1.257264
 Highest eigenvalues
    0.168071    0.199428    0.664883    0.863055    1.174721    1.257264


........................................................................
.............................. CYCLE    1 ..............................
........................................................................
   1     -6.4219135 -0.642191E+01  0.112E-05    8.76       0.0  T
   2     -6.4219135 -0.232703E-12  0.871E-06    8.76    5134.2  T
   3     -6.4219135 -0.196287E-12  0.400E-06    8.76   11184.4  T
     SCC iter.                  ...        0 min,  0.000 sec
     gradient                   ...        0 min,  0.000 sec
 * total energy  :    -6.3687829 Eh     change        0.2846194E-09 Eh
   gradient norm :     0.0881127 Eh/α   predicted     0.0000000E+00 (-100.00%)
   displ. norm   :     0.3414519 α      lambda       -0.1641987E-01
   maximum displ.:     0.3172888 α      in ANC's #2, #6, #5, ...

........................................................................
.............................. CYCLE    2 ..............................
........................................................................
   1     -6.4435829 -0.644358E+01  0.818E-01    9.17       0.0  T
   2     -6.4437984 -0.215482E-03  0.472E-01    9.03       1.0  T
   3     -6.4437728  0.256504E-04  0.235E-01    9.14       1.0  T
   4     -6.4438765 -0.103699E-03  0.326E-02    9.09       1.4  T
   5     -6.4438768 -0.363149E-06  0.580E-03    9.09       7.7  T
   6     -6.4438769 -0.235068E-07  0.121E-03    9.09      36.9  T
   7     -6.4438769 -0.144702E-08  0.443E-04    9.09     100.9  T
   8     -6.4438769 -0.171492E-09  0.740E-05    9.09     604.7  T
     SCC iter.                  ...        0 min,  0.000 sec
     gradient                   ...        0 min,  0.000 sec
 * total energy  :    -6.3811336 Eh     change       -0.1235066E-01 Eh
   gradient norm :     0.0538911 Eh/α   predicted    -0.9167123E-02 ( -25.78%)
   displ. norm   :     0.2844515 α      lambda       -0.1034858E-01
   maximum displ.:     0.2268587 α      in ANC's #2, #6, #4, ...

........................................................................
.............................. CYCLE    3 ..............................
........................................................................
   1     -6.4622636 -0.646226E+01  0.910E-01    8.93       0.0  T
   2     -6.4627027 -0.439144E-03  0.496E-01    8.76       1.0  T
   3     -6.4627316 -0.288968E-04  0.236E-01    8.87       1.0  T
   4     -6.4627815 -0.498896E-04  0.318E-02    8.84       1.4  T
   5     -6.4627817 -0.217042E-06  0.656E-03    8.84       6.8  T
   6     -6.4627817 -0.172877E-07  0.153E-03    8.84      29.2  T
   7     -6.4627817 -0.681726E-08  0.550E-04    8.84      81.3  T
   8     -6.4627817 -0.466422E-09  0.642E-05    8.84     697.1  T
     SCC iter.                  ...        0 min,  0.000 sec
     gradient                   ...        0 min,  0.000 sec
 * total energy  :    -6.3865685 Eh     change       -0.5434989E-02 Eh
   gradient norm :     0.0298005 Eh/α   predicted    -0.5592959E-02 (   2.91%)
   displ. norm   :     0.1095420 α      lambda       -0.1185694E-02
   maximum displ.:     0.1007077 α      in ANC's #2, #5, #9, ...

........................................................................
.............................. CYCLE    4 ..............................
........................................................................
   1     -6.4611242 -0.646112E+01  0.296E-01    8.58       0.0  T
   2     -6.4611486 -0.243704E-04  0.164E-01    8.62       1.0  T
   3     -6.4611488 -0.194399E-06  0.522E-02    8.59       1.0  T
   4     -6.4611537 -0.494070E-05  0.795E-03    8.61       5.6  T
   5     -6.4611537 -0.127773E-07  0.187E-03    8.61      24.0  T
   6     -6.4611537 -0.107272E-08  0.191E-04    8.61     234.1  T
   7     -6.4611537 -0.415668E-12  0.931E-05    8.61     480.5  T
     SCC iter.                  ...        0 min,  0.000 sec
     gradient                   ...        0 min,  0.000 sec
 * total energy  :    -6.3873064 Eh     change       -0.7378804E-03 Eh
   gradient norm :     0.0188094 Eh/α   predicted    -0.5999615E-03 ( -18.69%)
   displ. norm   :     0.0542903 α      lambda       -0.6404424E-03
   maximum displ.:     0.0309037 α      in ANC's #6, #2, #9, ...

........................................................................
.............................. CYCLE    5 ..............................
........................................................................
   1     -6.4647060 -0.646471E+01  0.242E-01    8.74       0.0  T
   2     -6.4647244 -0.183561E-04  0.128E-01    8.75       1.0  T
   3     -6.4647255 -0.108203E-05  0.366E-02    8.74       1.2  T
   4     -6.4647271 -0.158470E-05  0.981E-03    8.75       4.6  T
   5     -6.4647272 -0.119330E-06  0.263E-03    8.75      17.0  T
   6     -6.4647272 -0.507665E-09  0.202E-04    8.75     220.9  T
   7     -6.4647272 -0.116005E-10  0.746E-05    8.75     599.3  T
     SCC iter.                  ...        0 min,  0.000 sec
     gradient                   ...        0 min,  0.000 sec
 * total energy  :    -6.3877198 Eh     change       -0.4133832E-03 Eh
   gradient norm :     0.0087008 Eh/α   predicted    -0.3211670E-03 ( -22.31%)
   displ. norm   :     0.0671824 α      lambda       -0.2916906E-03
   maximum displ.:     0.0485375 α      in ANC's #2, #4, #6, ...

........................................................................
.............................. CYCLE    6 ..............................
........................................................................
   1     -6.4658798 -0.646588E+01  0.258E-01    8.69       0.0  T
   2     -6.4658869 -0.709123E-05  0.143E-01    8.68       1.0  T
   3     -6.4658890 -0.213361E-05  0.119E-02    8.68       3.8  T
   4     -6.4658891 -0.689712E-07  0.384E-03    8.68      11.6  T
   5     -6.4658891 -0.128379E-07  0.196E-03    8.69      22.8  T
   6     -6.4658891 -0.169203E-08  0.273E-04    8.68     163.8  T
   7     -6.4658891 -0.214229E-10  0.633E-05    8.68     706.9  T
     SCC iter.                  ...        0 min,  0.000 sec
     gradient                   ...        0 min,  0.000 sec
 * total energy  :    -6.3879160 Eh     change       -0.1961473E-03 Eh
   gradient norm :     0.0051616 Eh/α   predicted    -0.1465052E-03 ( -25.31%)
   displ. norm   :     0.0475537 α      lambda       -0.1484996E-03
   maximum displ.:     0.0328000 α      in ANC's #4, #6, #7, ...

........................................................................
.............................. CYCLE    7 ..............................
........................................................................
   1     -6.4667472 -0.646675E+01  0.239E-01    8.60       0.0  T
   2     -6.4667529 -0.571308E-05  0.132E-01    8.60       1.0  T
   3     -6.4667547 -0.184980E-05  0.101E-02    8.60       4.4  T
   4     -6.4667548 -0.450007E-07  0.313E-03    8.60      14.3  T
   5     -6.4667548 -0.118414E-08  0.106E-03    8.60      42.2  T
   6     -6.4667548 -0.173411E-08  0.259E-04    8.60     172.4  T
   7     -6.4667548 -0.168132E-10  0.619E-05    8.60     722.0  T
     SCC iter.                  ...        0 min,  0.000 sec
     gradient                   ...        0 min,  0.000 sec
 * total energy  :    -6.3880221 Eh     change       -0.1061816E-03 Eh
   gradient norm :     0.0043801 Eh/α   predicted    -0.7441965E-04 ( -29.91%)
   displ. norm   :     0.0471506 α      lambda       -0.9311861E-04
   maximum displ.:     0.0279797 α      in ANC's #4, #7, #5, ...

........................................................................
.............................. CYCLE    8 ..............................
........................................................................
   1     -6.4668102 -0.646681E+01  0.253E-01    8.50       0.0  T
   2     -6.4668158 -0.554633E-05  0.140E-01    8.50       1.0  T
   3     -6.4668177 -0.198905E-05  0.109E-02    8.50       4.1  T
   4     -6.4668179 -0.112922E-06  0.586E-03    8.50       7.6  T
   5     -6.4668179 -0.182907E-07  0.122E-03    8.50      36.5  T
   6     -6.4668179 -0.810562E-09  0.291E-04    8.50     153.5  T
   7     -6.4668179 -0.230020E-10  0.682E-05    8.50     656.0  T
     SCC iter.                  ...        0 min,  0.000 sec
     gradient                   ...        0 min,  0.000 sec
 * total energy  :    -6.3880893 Eh     change       -0.6719798E-04 Eh
   gradient norm :     0.0024648 Eh/α   predicted    -0.4666345E-04 ( -30.56%)
   displ. norm   :     0.0496227 α      lambda       -0.5663282E-04
   maximum displ.:     0.0258086 α      in ANC's #5, #7, #4, ...

........................................................................
.............................. CYCLE    9 ..............................
........................................................................
   1     -6.4668637 -0.646686E+01  0.273E-01    8.42       0.0  T
   2     -6.4668698 -0.610145E-05  0.151E-01    8.42       1.0  T
   3     -6.4668719 -0.211917E-05  0.122E-02    8.41       3.7  T
   4     -6.4668722 -0.267166E-06  0.610E-03    8.42       7.3  T
   5     -6.4668722 -0.112956E-07  0.899E-04    8.42      49.7  T
   6     -6.4668722 -0.395825E-09  0.251E-04    8.42     178.5  T
     SCC iter.                  ...        0 min,  0.000 sec
     gradient                   ...        0 min,  0.000 sec
 * total energy  :    -6.3881320 Eh     change       -0.4267858E-04 Eh
   gradient norm :     0.0013485 Eh/α   predicted    -0.2838636E-04 ( -33.49%)
   displ. norm   :     0.1359624 α      lambda       -0.6002593E-04
   maximum displ.:     0.0641902 α      in ANC's #5, #7, #4, ...

........................................................................
.............................. CYCLE   10 ..............................
........................................................................
   1     -6.4656146 -0.646561E+01  0.726E-01    8.18       0.0  T
   2     -6.4656541 -0.395652E-04  0.401E-01    8.18       1.0  T
   3     -6.4656696 -0.154273E-04  0.226E-02    8.17       2.0  T
   4     -6.4656705 -0.933451E-06  0.119E-02    8.18       3.7  T
   5     -6.4656705 -0.343677E-07  0.178E-03    8.18      25.1  T
   6     -6.4656705 -0.149221E-08  0.527E-04    8.18      84.8  T
   7     -6.4656705 -0.534204E-10  0.173E-04    8.18     259.0  T
     SCC iter.                  ...        0 min,  0.001 sec
     gradient                   ...        0 min,  0.000 sec
 * total energy  :    -6.3882593 Eh     change       -0.1273153E-03 Eh
   gradient norm :     0.0063541 Eh/α   predicted    -0.3025879E-04 ( -76.23%)
   displ. norm   :     0.1794836 α      lambda       -0.3047694E-03
   maximum displ.:     0.0837466 α      in ANC's #4, #7, #5, ...

........................................................................
.............................. CYCLE   11 ..............................
........................................................................
   1     -6.4613298 -0.646133E+01  0.963E-01    7.87       0.0  T
   2     -6.4614037 -0.739577E-04  0.531E-01    7.87       1.0  T
   3     -6.4614315 -0.277893E-04  0.211E-02    7.86       2.1  T
   4     -6.4614319 -0.319703E-06  0.962E-03    7.86       4.6  T
   5     -6.4614318  0.813614E-08  0.369E-03    7.86      12.1  T
   6     -6.4614319 -0.234852E-07  0.380E-04    7.86     117.7  T
   7     -6.4614319 -0.676170E-11  0.228E-04    7.86     195.9  T
     SCC iter.                  ...        0 min,  0.000 sec
     gradient                   ...        0 min,  0.000 sec
 * total energy  :    -6.3886481 Eh     change       -0.3887424E-03 Eh
   gradient norm :     0.0188116 Eh/α   predicted    -0.1572947E-03 ( -59.54%)
   displ. norm   :     0.9842088 α      lambda       -0.1747978E-02
   maximum displ.:     0.4596196 α      in ANC's #4, #7, #6, ...

........................................................................
.............................. CYCLE   12 ..............................
........................................................................
   1     -6.3414818 -0.634148E+01  0.497E+00    4.06       0.0  T
   2     -6.3479657 -0.648392E-02  0.249E+00    4.18       1.0  T
   3     -6.3478029  0.162858E-03  0.852E-01    4.40       1.0  T
   4     -6.3485922 -0.789366E-03  0.222E-01    4.14       1.0  T
   5     -6.3487662 -0.173961E-03  0.915E-02    4.21       1.0  T
   6     -6.3487677 -0.153729E-05  0.874E-03    4.20       5.1  T
   7     -6.3487678 -0.366548E-07  0.329E-03    4.20      13.6  T
   8     -6.3487678 -0.445449E-08  0.902E-04    4.20      49.6  T
   9     -6.3487678  0.105580E-09  0.350E-04    4.20     127.8  T
     SCC iter.                  ...        0 min,  0.001 sec
     gradient                   ...        0 min,  0.000 sec
 * total energy  :    -6.3214246 Eh     change        0.6722345E-01 Eh
   gradient norm :     0.1985271 Eh/α   predicted    -0.1720616E-02 (-102.56%)
   displ. norm   :     0.5911863 α      lambda       -0.1047115E+00
   maximum displ.:     0.2996789 α      in ANC's #7, #4, #5, ...

........................................................................
.............................. CYCLE   13 ..............................
........................................................................
   1     -6.4368702 -0.643687E+01  0.316E+00    6.85       0.0  T
   2     -6.4390926 -0.222237E-02  0.174E+00    6.76       1.0  T
   3     -6.4393304 -0.237771E-03  0.343E-01    6.65       1.0  T
   4     -6.4393738 -0.434015E-04  0.112E-01    6.75       1.0  T
   5     -6.4393889 -0.150851E-04  0.484E-02    6.74       1.0  T
   6     -6.4393891 -0.201109E-06  0.981E-03    6.74       4.6  T
   7     -6.4393893 -0.261762E-06  0.429E-03    6.74      10.4  T
   8     -6.4393894 -0.568040E-07  0.480E-04    6.74      93.1  T
   9     -6.4393894 -0.289273E-09  0.444E-05    6.74    1008.1  T
     SCC iter.                  ...        0 min,  0.000 sec
     gradient                   ...        0 min,  0.000 sec
 * total energy  :    -6.3840373 Eh     change       -0.6261268E-01 Eh
   gradient norm :     0.0716320 Eh/α   predicted    -0.7065413E-01 (  12.84%)
   displ. norm   :     0.2749246 α      lambda       -0.1002956E-01
   maximum displ.:     0.2273795 α      in ANC's #2, #6, #5, ...

........................................................................
.............................. CYCLE   14 ..............................
........................................................................
   1     -6.4558750 -0.645588E+01  0.101E+00    7.91       0.0  T
   2     -6.4563883 -0.513276E-03  0.486E-01    7.97       1.0  T
   3     -6.4564182 -0.298937E-04  0.227E-01    7.85       1.0  T
   4     -6.4564758 -0.576694E-04  0.522E-02    7.90       1.0  T
   5     -6.4564783 -0.249142E-05  0.152E-02    7.90       3.0  T
   6     -6.4564784 -0.363924E-07  0.204E-03    7.91      21.9  T
   7     -6.4564784 -0.467598E-08  0.897E-04    7.91      49.8  T
   8     -6.4564784 -0.123435E-08  0.123E-04    7.91     362.6  T
     SCC iter.                  ...        0 min,  0.000 sec
     gradient                   ...        0 min,  0.000 sec
 * total energy  :    -6.3886618 Eh     change       -0.4624525E-02 Eh
   gradient norm :     0.0363918 Eh/α   predicted    -0.5393810E-02 (  16.63%)
   displ. norm   :     0.0753134 α      lambda       -0.1489307E-02
   maximum displ.:     0.0463639 α      in ANC's #2, #4, #5, ...

........................................................................
.............................. CYCLE   15 ..............................
........................................................................
   1     -6.4600643 -0.646006E+01  0.302E-01    7.96       0.0  T
   2     -6.4600803 -0.159597E-04  0.173E-01    7.93       1.0  T
   3     -6.4600779  0.233844E-05  0.516E-02    7.96       1.0  T
   4     -6.4600844 -0.643882E-05  0.971E-03    7.95       4.6  T
   5     -6.4600844 -0.676351E-08  0.542E-04    7.95      82.4  T
   6     -6.4600844 -0.112849E-09  0.246E-04    7.95     181.9  T
     SCC iter.                  ...        0 min,  0.001 sec
     gradient                   ...        0 min,  0.000 sec
 * total energy  :    -6.3895910 Eh     change       -0.9291901E-03 Eh
   gradient norm :     0.0204654 Eh/α   predicted    -0.7488777E-03 ( -19.41%)
   displ. norm   :     0.0254992 α      lambda       -0.2758076E-03
   maximum displ.:     0.0150551 α      in ANC's #5, #4, #7, ...

........................................................................
.............................. CYCLE   16 ..............................
........................................................................
   1     -6.4627981 -0.646280E+01  0.137E-01    8.05       0.0  T
   2     -6.4628013 -0.315196E-05  0.780E-02    8.04       1.0  T
   3     -6.4628010  0.220860E-06  0.193E-02    8.05       2.3  T
   4     -6.4628019 -0.900862E-06  0.485E-03    8.04       9.2  T
   5     -6.4628019 -0.697666E-08  0.188E-03    8.05      23.8  T
   6     -6.4628019 -0.408750E-09  0.106E-04    8.05     421.5  T
   7     -6.4628019 -0.450839E-11  0.464E-05    8.05     962.9  T
     SCC iter.                  ...        0 min,  0.000 sec
     gradient                   ...        0 min,  0.000 sec
 * total energy  :    -6.3897813 Eh     change       -0.1902312E-03 Eh
   gradient norm :     0.0153817 Eh/α   predicted    -0.1379953E-03 ( -27.46%)
   displ. norm   :     0.0306774 α      lambda       -0.2045953E-03
   maximum displ.:     0.0245078 α      in ANC's #1, #5, #6, ...

........................................................................
.............................. CYCLE   17 ..............................
........................................................................
   1     -6.4649817 -0.646498E+01  0.880E-02    8.16       0.0  T
   2     -6.4649834 -0.171137E-05  0.508E-02    8.15       1.0  T
   3     -6.4649834 -0.793362E-08  0.118E-02    8.16       3.8  T
   4     -6.4649837 -0.251936E-06  0.360E-03    8.15      12.4  T
   5     -6.4649837 -0.918508E-08  0.120E-03    8.15      37.2  T
   6     -6.4649837 -0.167045E-09  0.144E-04    8.15     309.5  T
   7     -6.4649837 -0.685407E-11  0.292E-05    8.15    1534.1  T
     SCC iter.                  ...        0 min,  0.000 sec
     gradient                   ...        0 min,  0.000 sec
 * total energy  :    -6.3899094 Eh     change       -0.1281451E-03 Eh
   gradient norm :     0.0124081 Eh/α   predicted    -0.1023938E-03 ( -20.10%)
   displ. norm   :     0.0977063 α      lambda       -0.5863985E-03
   maximum displ.:     0.0797457 α      in ANC's #1, #6, #5, ...

........................................................................
.............................. CYCLE   18 ..............................
........................................................................
   1     -6.4700746 -0.647007E+01  0.257E-01    8.44       0.0  T
   2     -6.4700860 -0.114676E-04  0.150E-01    8.42       1.0  T
   3     -6.4700862 -0.129704E-06  0.320E-02    8.42       1.4  T
   4     -6.4700880 -0.179497E-05  0.881E-03    8.41       5.1  T
   5     -6.4700880 -0.564972E-07  0.284E-03    8.42      15.8  T
   6     -6.4700880 -0.119645E-08  0.405E-04    8.42     110.3  T
   7     -6.4700880 -0.553184E-10  0.904E-05    8.42     494.5  T
     SCC iter.                  ...        0 min,  0.000 sec
     gradient                   ...        0 min,  0.000 sec
 * total energy  :    -6.3898688 Eh     change        0.4057280E-04 Eh
   gradient norm :     0.0203500 Eh/α   predicted    -0.2959970E-03 (-829.55%)
   displ. norm   :     0.0615344 α      lambda       -0.6656400E-03
   maximum displ.:     0.0520075 α      in ANC's #1, #4, #5, ...

........................................................................
.............................. CYCLE   19 ..............................
........................................................................
   1     -6.4678301 -0.646783E+01  0.229E-01    8.37       0.0  T
   2     -6.4678352 -0.509726E-05  0.129E-01    8.37       1.0  T
   3     -6.4678364 -0.118464E-05  0.124E-02    8.37       3.6  T
   4     -6.4678365 -0.110227E-06  0.561E-03    8.37       8.0  T
   5     -6.4678365 -0.267848E-07  0.231E-03    8.37      19.3  T
   6     -6.4678365 -0.112691E-08  0.223E-04    8.37     200.9  T
   7     -6.4678365 -0.135847E-10  0.641E-05    8.37     697.6  T
     SCC iter.                  ...        0 min,  0.000 sec
     gradient                   ...        0 min,  0.000 sec
 * total energy  :    -6.3903247 Eh     change       -0.4558482E-03 Eh
   gradient norm :     0.0083867 Eh/α   predicted    -0.3340806E-03 ( -26.71%)
   displ. norm   :     0.0788579 α      lambda       -0.4862338E-03
   maximum displ.:     0.0414898 α      in ANC's #6, #7, #4, ...

........................................................................
.............................. CYCLE   20 ..............................
........................................................................
   1     -6.4655322 -0.646553E+01  0.375E-01    8.35       0.0  T
   2     -6.4655480 -0.157818E-04  0.206E-01    8.35       1.0  T
   3     -6.4655511 -0.310181E-05  0.256E-02    8.35       1.7  T
   4     -6.4655524 -0.133838E-05  0.986E-03    8.34       4.5  T
   5     -6.4655525 -0.587651E-07  0.370E-03    8.34      12.1  T
   6     -6.4655525 -0.153228E-08  0.294E-04    8.34     152.0  T
   7     -6.4655525 -0.330544E-10  0.105E-04    8.34     427.4  T
     SCC iter.                  ...        0 min,  0.000 sec
     gradient                   ...        0 min,  0.000 sec
 * total energy  :    -6.3906689 Eh     change       -0.3442055E-03 Eh
   gradient norm :     0.0096050 Eh/α   predicted    -0.2446298E-03 ( -28.93%)
   displ. norm   :     0.0809172 α      lambda       -0.3296702E-03
   maximum displ.:     0.0524338 α      in ANC's #6, #7, #9, ...
 * RMSD in coord.:     0.6601272 α      energy gain  -0.2188598E-01 Eh

generating ANC from model Hessian ...
Using Lindh-Hessian (1995)
 Shifting diagonal of input Hessian by    0.0000000000000000     
 Lowest  eigenvalues of input Hessian
   -0.000000   -0.000000   -0.000000   -0.000000    0.000000    0.000000
    0.032019    0.088193    0.150938    0.207632    0.244127    0.693149
    0.937343    1.340788    1.668198
 Highest eigenvalues
    0.207632    0.244127    0.693149    0.937343    1.340788    1.668198


........................................................................
.............................. CYCLE   21 ..............................
........................................................................
   1     -6.4641952 -0.646420E+01  0.368E-01    8.46       0.0  T
   2     -6.4642116 -0.163942E-04  0.201E-01    8.44       1.0  T
   3     -6.4642141 -0.252003E-05  0.312E-02    8.45       1.4  T
   4     -6.4642163 -0.213168E-05  0.985E-03    8.44       4.5  T
   5     -6.4642163 -0.418008E-07  0.350E-03    8.44      12.8  T
   6     -6.4642163 -0.171051E-08  0.307E-04    8.44     145.6  T
   7     -6.4642163 -0.365485E-10  0.110E-04    8.44     405.1  T
     SCC iter.                  ...        0 min,  0.001 sec
     gradient                   ...        0 min,  0.000 sec
 * total energy  :    -6.3908479 Eh     change       -0.1790364E-03 Eh
   gradient norm :     0.0103616 Eh/α   predicted     0.0000000E+00 (-100.00%)
   displ. norm   :     0.0224639 α      lambda       -0.1517027E-03
   maximum displ.:     0.0116453 α      in ANC's #3, #1, #2, ...

........................................................................
.............................. CYCLE   22 ..............................
........................................................................
   1     -6.4660062 -0.646601E+01  0.477E-02    8.64       0.0  T
   2     -6.4660067 -0.437679E-06  0.274E-02    8.63       1.6  T
   3     -6.4660067 -0.513464E-07  0.490E-03    8.63       9.1  T
   4     -6.4660068 -0.608825E-07  0.176E-03    8.63      25.4  T
   5     -6.4660068 -0.104394E-08  0.521E-04    8.63      85.8  T
   6     -6.4660068 -0.516298E-10  0.696E-05    8.63     642.8  T
     SCC iter.                  ...        0 min,  0.000 sec
     gradient                   ...        0 min,  0.000 sec
 * total energy  :    -6.3909406 Eh     change       -0.9272178E-04 Eh
   gradient norm :     0.0029197 Eh/α   predicted    -0.7588928E-04 ( -18.15%)
   displ. norm   :     0.0068936 α      lambda       -0.1141376E-04
   maximum displ.:     0.0047597 α      in ANC's #1, #2, #6, ...

........................................................................
.............................. CYCLE   23 ..............................
........................................................................
   1     -6.4664223 -0.646642E+01  0.155E-02    8.68       0.0  T
   2     -6.4664223 -0.560292E-07  0.870E-03    8.68       5.1  T
   3     -6.4664224 -0.613832E-08  0.191E-03    8.67      23.4  T
   4     -6.4664224 -0.330850E-08  0.634E-04    8.68      70.5  T
   5     -6.4664224 -0.502562E-09  0.177E-04    8.68     252.4  T
     SCC iter.                  ...        0 min,  0.001 sec
     gradient                   ...        0 min,  0.000 sec
 * total energy  :    -6.3909466 Eh     change       -0.5934105E-05 Eh
   gradient norm :     0.0004866 Eh/α   predicted    -0.5708093E-05 (  -3.81%)
   displ. norm   :     0.0019918 α      lambda       -0.3471094E-06
   maximum displ.:     0.0013998 α      in ANC's #1, #5, #4, ...

........................................................................
.............................. CYCLE   24 ..............................
........................................................................
   1     -6.4664082 -0.646641E+01  0.642E-03    8.67       0.0  T
   2     -6.4664082 -0.678786E-08  0.372E-03    8.67      12.0  T
   3     -6.4664082 -0.187399E-09  0.681E-04    8.67      65.7  T
   4     -6.4664082 -0.814882E-09  0.224E-04    8.67     199.7  T
     SCC iter.                  ...        0 min,  0.000 sec
     gradient                   ...        0 min,  0.001 sec
 * total energy  :    -6.3909469 Eh     change       -0.3149978E-06 Eh
   gradient norm :     0.0001399 Eh/α   predicted    -0.1742622E-06 ( -44.68%)
   displ. norm   :     0.0010747 α      lambda       -0.6849613E-07
   maximum displ.:     0.0007073 α      in ANC's #5, #1, #4, ...

   *** GEOMETRY OPTIMIZATION CONVERGED AFTER 24 ITERATIONS ***

------------------------------------------------------------------------
 total energy gain   :        -0.0221640 Eh      -13.9081 kcal/mol
 total RMSD          :         0.6627129 a0        0.3507 Å
 total power (kW/mol):        -2.4246475 (step)-1770.2485 (real)
------------------------------------------------------------------------

 ANCopt (total)                0 d,  0 h,  0 min,  0.033 sec
 optimizer setup                ...        0 min,  0.000 sec (  0.207%)
 model hessian                  ...        0 min,  0.000 sec (  0.434%)
 ANC generation                 ...        0 min,  0.000 sec (  0.310%)
 coordinate transformation      ...        0 min,  0.000 sec (  0.165%)
 single point calculation       ...        0 min,  0.030 sec ( 92.697%)
 optimization log               ...        0 min,  0.001 sec (  1.877%)
 hessian update                 ...        0 min,  0.000 sec (  0.196%)
 rational function              ...        0 min,  0.001 sec (  1.752%)

================
 final structure:
================
5
 xtb: 6.2.2 (9d81278992624c895f80dd42a50cac0aa55982e2)
C         0.80242514723490   -0.17149433247038    0.32542207120283
N        -0.45764673513321    0.08234339381898   -0.13286938461638
H         1.66765855803360   -0.06407148570699   -0.30336072751162
H        -0.93227361783265    0.87442429920990    0.29468013648107
H        -1.08016335230264   -0.72120187485151   -0.18387209555590

 Bond Distances (Angstroems)
 ---------------------------
C1-N2=1.3646         C1-H3=1.0750         N2-C1=1.3646         N2-H4=1.0176         N2-H5=1.0177         H3-C1=1.0750         
H4-N2=1.0176         H5-N2=1.0177         
 C  H  Rav=1.0750 sigma=0.0000  Rmin=1.0750  Rmax=1.0750     1
 N  H  Rav=1.0177 sigma=0.0001  Rmin=1.0176  Rmax=1.0177     2
 N  C  Rav=1.3646 sigma=0.0000  Rmin=1.3646  Rmax=1.3646     1

 selected bond angles (degree)
 --------------------
H3-C1-N2=121.88                H4-N2-C1=115.75                H5-N2-C1=115.77                H5-N2-H4=110.51                

 selected dihedral angles (degree)
 ---------------------------------
H4-N2-C1-H3=245.76            H5-N2-C1-H3=114.10            
           -------------------------------------------------
          |                Final Singlepoint                |
           -------------------------------------------------

          ...................................................
          :                      SETUP                      :
          :.................................................:
          :  # basis functions                  11          :
          :  # atomic orbitals                  11          :
          :  # shells                            7          :
          :  # electrons                        12          :
          :  max. iterations                   250          :
          :  Hamiltonian                  GFN2-xTB          :
          :  restarted?                      false          :
          :  GBSA solvation                  false          :
          :  PC potential                    false          :
          :  electronic temp.          300.0000000     K    :
          :  accuracy                    1.0000000          :
          :  -> integral cutoff          0.2500000E+02      :
          :  -> integral neglect         0.1000000E-07      :
          :  -> SCF convergence          0.1000000E-05 Eh   :
          :  -> wf. convergence          0.1000000E-03 e    :
          :  Broyden damping             0.4000000          :
          ...................................................

 iter      E             dE          RMSdq      gap      omega  full diag
   1     -6.4664082 -0.646641E+01  0.361E-05    8.67       0.0  T
   2     -6.4664082 -0.540012E-12  0.211E-05    8.67    2116.5  T
   3     -6.4664082 -0.568434E-13  0.446E-06    8.67   10037.6  T

   *** convergence criteria satisfied after 3 iterations ***

         #    Occupation            Energy/Eh            Energy/eV
      -------------------------------------------------------------
         1        2.0000           -0.6213758             -16.9085
         2        2.0000           -0.5623293             -15.3018
         3        2.0000           -0.5337683             -14.5246
         4        2.0000           -0.4749992             -12.9254
         5        2.0000           -0.4457531             -12.1296
         6        1.0000           -0.2880868              -7.8392
         7        1.0000           -0.2805079              -7.6330 (HOMO)
         8                          0.0382507               1.0409 (LUMO)
         9                          0.2092914               5.6951
        10                          0.2390605               6.5052
        11                          0.3307415               8.9999
      -------------------------------------------------------------
                  HL-Gap            0.3187586 Eh            8.6739 eV
             Fermi-level           -0.2440243 Eh           -6.6402 eV

 transition dipole moment (au) for excitation:           6           7
     X       Y       Z   
  -0.0215  -0.2148  -0.0645  total (au/Debye):    0.225   0.573
 dE (eV)             :    0.206
 oscillator strength :  0.36281E-03

 SCC (total)                   0 d,  0 h,  0 min,  0.001 sec
 SCC setup                      ...        0 min,  0.000 sec (  5.066%)
 Dispersion                     ...        0 min,  0.000 sec (  0.421%)
 integral evaluation            ...        0 min,  0.000 sec ( 27.970%)
 zeroth order Hamiltonian       ...        0 min,  0.000 sec (  0.534%)
 iterations                     ...        0 min,  0.000 sec ( 14.179%)
 molecular gradient             ...        0 min,  0.000 sec ( 27.177%)
 printout                       ...        0 min,  0.000 sec ( 24.037%)

         :::::::::::::::::::::::::::::::::::::::::::::::::::::
         ::                     SUMMARY                     ::
         :::::::::::::::::::::::::::::::::::::::::::::::::::::
         :: total energy              -6.390946889898 Eh    ::
         :: gradient norm              0.000140398737 Eh/a0 ::
         :: HOMO-LUMO gap              8.673862628994 eV    ::
         ::.................................................::
         :: SCC energy                -6.466408224588 Eh    ::
         :: -> isotropic ES            0.008695407190 Eh    ::
         :: -> anisotropic ES          0.001980824859 Eh    ::
         :: -> anisotropic XC          0.005061044416 Eh    ::
         :: -> dispersion             -0.000998002889 Eh    ::
         :: repulsion energy           0.075461324763 Eh    ::
         :: add. restraining           0.000000000000 Eh    ::
         :::::::::::::::::::::::::::::::::::::::::::::::::::::

           ------------------------------------------------- 
          |                Numerical Hessian                |
           ------------------------------------------------- 
step length          :   0.00500
SCC accuracy         :   0.30000
Hessian scale factor :   1.00000
frozen atoms in %    :   0.00000    0
RMS gradient         :   0.00014
estimated CPU  time      0.00 min
estimated wall time      0.00 min

writing file <hessian>.

 projected vibrational frequencies (cm-1)
eigval :       -0.00    -0.00    -0.00    -0.00     0.00     0.00
eigval :      410.89   678.69   979.82  1029.39  1331.31  1483.96
eigval :     3026.21  3268.90  3281.21
           -------------------------------------------------
          |                Property Printout                |
           -------------------------------------------------

    * Orbital Energies and Occupations

         #    Occupation            Energy/Eh            Energy/eV
      -------------------------------------------------------------
         1        2.0000           -0.6213759             -16.9085
         2        2.0000           -0.5623293             -15.3018
         3        2.0000           -0.5337683             -14.5246
         4        2.0000           -0.4749993             -12.9254
         5        2.0000           -0.4457531             -12.1296
         6        1.0000           -0.2880868              -7.8392
         7        1.0000           -0.2805079              -7.6330 (HOMO)
         8                          0.0382507               1.0409 (LUMO)
         9                          0.2092914               5.6951
        10                          0.2390605               6.5052
        11                          0.3307415               8.9999
      -------------------------------------------------------------
                  HL-Gap            0.3187586 Eh            8.6739 eV
             Fermi-level           -0.2440243 Eh           -6.6402 eV

     #   Z        covCN         q      C6AA      α(0)
     1   6 C      1.836    -0.149    35.402     9.612
     2   7 N      2.629    -0.216    25.728     7.533
     3   1 H      0.926     0.041     2.435     2.440
     4   1 H      0.860     0.162     1.320     1.800
     5   1 H      0.860     0.162     1.321     1.800

 Mol. C6AA /au·bohr⁶  :        220.807805
 Mol. C8AA /au·bohr⁸  :       4780.569034
 Mol. α(0) /au        :         23.185646


Wiberg/Mayer (AO) data.
largest (>0.10) Wiberg bond orders for each atom
          total WBO             WBO to atom ...
     1  C   2.154        N    2 1.224    H    3 0.925
     2  N   3.091        C    1 1.224    H    4 0.931    H    5 0.931
     3  H   0.937        C    1 0.925
     4  H   0.938        N    2 0.931
     5  H   0.938        N    2 0.931

MOs/occ written to file <molden.input>


molecular dipole:
                 x           y           z       tot (Debye)
 q only:       -0.527       0.057      -0.027
   full:       -0.722       0.086      -0.065       1.856
molecular quadrupole (traceless):
                xx          xy          yy          xz          yz          zz
 q only:        0.714       0.098       0.176      -0.457       0.401      -0.890
  q+dip:        1.475       0.446       0.177      -1.806       0.801      -1.652
   full:        1.224       0.446       0.491      -1.623       0.906      -1.715

           -------------------------------------------------
          |                Geometry Summary                 |
           -------------------------------------------------

      molecular mass/u    :       29.0412614
   center of mass at/Å    :        0.0991720      -0.0281175       0.0638198
  moments of inertia/u·Å² :        0.2265199E+01   0.1716678E+02   0.1772071E+02
rotational constants/cm⁻¹ :        0.7442010E+01   0.9819913E+00   0.9512957E+00

 * 3 selected distances

     #   Z        #   Z                                     value/Å
     1   6 C      2   7 N                                 1.3646413 (max)
     2   7 N      4   1 H                                 1.0175763 (min)
     2   7 N      5   1 H                                 1.0177491

 * 2 distinct bonds (by element types)

   Z      Z             #   av. dist./Å        max./Å        min./Å
   1 H    7 N           2     1.0176627     1.0177491     1.0175763
   6 C    7 N           1     1.3646413     1.3646413     1.3646413

           -------------------------------------------------
          |               Frequency Printout                |
           -------------------------------------------------
 projected vibrational frequencies (cm-1)
eigval :       -0.00    -0.00    -0.00    -0.00     0.00     0.00
eigval :      410.89   678.69   979.82  1029.39  1331.31  1483.96
eigval :     3026.21  3268.90  3281.21
 reduced masses (amu)
   1:  4.54   2:  9.64   3: 10.86   4: 10.39   5:  9.93   6: 10.49   7:  1.89   8:  3.38
Molecule has the following symmetry elements: (sigma) 
It seems to be the Cs point group
   9:  3.37  10:  3.18  11: 11.90  12:  2.19  13:  1.83  14:  2.12  15:  1.43
 IR intensities (amu)
   1:  0.13   2:  0.20   3:  0.16   4:  0.30   5:  0.17   6:  0.13   7:  0.23   8:  0.70
   9:  0.22  10:  0.05  11:  0.60  12:  0.28  13:  0.30  14:  0.01  15:  0.04
 Raman intensities (amu)
   1:  0.00   2:  0.00   3:  0.00   4:  0.00   5:  0.00   6:  0.00   7:  0.00   8:  0.00
   9:  0.00  10:  0.00  11:  0.00  12:  0.00  13:  0.00  14:  0.00  15:  0.00
 output can be read by thermo (or use thermo option).
 writing <g98.out> molden fake output.
 recommended (thermochemical) frequency scaling factor: 1.0
           -------------------------------------------------
          |             Thermodynamic Functions             |
           -------------------------------------------------

cs  symmetry found (for desy threshold:  0.10E+00) used in thermo

          ...................................................
          :                      SETUP                      :
          :.................................................:
          :  # frequencies                           9      :
          :  # imaginary freq.                       0      :
          :  linear?                             false      :
          :  only rotor calc.                    false      :
          :  symmetry                               cs      :
          :  rotational number                       1      :
          :  scaling factor                  1.0000000      :
          :  rotor cutoff                   50.0000000 cm⁻¹ :
          :  imag. cutoff                  -20.0000000 cm⁻¹ :
          :.................................................:

    mode    ω/cm⁻¹     T·S(HO)/kcal·mol⁻¹    T·S(FR)/kcal·mol⁻¹   T·S(vib)
   ------------------------------------------------------------------------
   ------------------------------------------------------------------------

   temp. (K)  partition function   enthalpy   heat capacity  entropy
                                   cal/mol     cal/K/mol   cal/K/mol   J/K/mol
 298.15  VIB   1.23                  318.938      3.276      1.477
         ROT  0.201E+04              888.752      2.981     18.091
         INT  0.246E+04             1207.690      6.257     19.568
         TR   0.151E+27             1481.254      4.968     36.016
         TOT                        2688.9441    11.2252    55.5843   232.5647

   temp. (K)  partition function   enthalpy   heat capacity  entropy
                                   cal/mol     cal/K/mol   cal/K/mol   J/K/mol
 120.00  VIB   1.01                    9.185      0.397      0.092
         ROT   512.                  357.707      2.981     15.378
         INT   516.                  366.892      3.378     15.470
         TR   0.387E+26              596.178      4.968     31.497
         TOT                         963.0701     8.3460    46.9666   196.5084

   temp. (K)  partition function   enthalpy   heat capacity  entropy
                                   cal/mol     cal/K/mol   cal/K/mol   J/K/mol
 100.00  VIB   1.00                    3.304      0.200      0.039
         ROT   390.                  298.089      2.981     14.835
         INT   391.                  301.393      3.181     14.873
         TR   0.294E+26              496.815      4.968     30.591
         TOT                         798.2081     8.1494    45.4647   190.2243

   temp. (K)  partition function   enthalpy   heat capacity  entropy
                                   cal/mol     cal/K/mol   cal/K/mol   J/K/mol
  80.00  VIB   1.00                    0.736      0.069      0.010
         ROT   279.                  238.471      2.981     14.170
         INT   279.                  239.207      3.049     14.180
         TR   0.210E+26              397.452      4.968     29.483
         TOT                         636.6590     8.0176    43.6633   182.6872

   temp. (K)  partition function   enthalpy   heat capacity  entropy
                                   cal/mol     cal/K/mol   cal/K/mol   J/K/mol
  60.00  VIB   1.00                    0.062      0.010      0.001
         ROT   181.                  178.853      2.981     13.312
         INT   181.                  178.915      2.991     13.313
         TR   0.137E+26              298.089      4.968     28.055
         TOT                         477.0044     7.9592    41.3678   173.0830

   temp. (K)  partition function   enthalpy   heat capacity  entropy
                                   cal/mol     cal/K/mol   cal/K/mol   J/K/mol
  40.00  VIB   1.00                    0.000      0.000     -0.000
         ROT   98.5                  119.236      2.981     12.103
         INT   98.5                  119.236      2.981     12.103
         TR   0.744E+25              198.726      4.968     26.041
         TOT                         317.9620     7.9492    38.1445   159.5966

   temp. (K)  partition function   enthalpy   heat capacity  entropy
                                   cal/mol     cal/K/mol   cal/K/mol   J/K/mol
  20.00  VIB   1.00                    0.000      0.000     -0.000
         ROT   34.8                   59.618      2.981     10.037
         INT   34.8                   59.618      2.981     10.037
         TR   0.263E+25               99.363      4.968     22.599
         TOT                         158.9808     7.9490    32.6361   136.5496

   temp. (K)  partition function   enthalpy   heat capacity  entropy
                                   cal/mol     cal/K/mol   cal/K/mol   J/K/mol
  10.00  VIB   1.00                    0.000      0.000     -0.001
         ROT   12.3                   29.809      2.981      7.971
         INT   12.3                   29.809      2.981      7.970
         TR   0.930E+24               49.681      4.968     19.157
         TOT                          79.4904     7.9490    27.1278   113.5027

       T/K    H(0)-H(T)+PV         H(T)/Eh          T*S/Eh         G(T)/Eh
   ------------------------------------------------------------------------
    298.15    0.428511E-02    0.395748E-01    0.264099E-01    0.131649E-01
    120.00    0.153475E-02    0.368244E-01    0.898153E-02    0.278429E-01
    100.00    0.127203E-02    0.365617E-01    0.724526E-02    0.293164E-01
     80.00    0.101458E-02    0.363043E-01    0.556655E-02    0.307377E-01
     60.00    0.760155E-03    0.360498E-01    0.395543E-02    0.320944E-01
     40.00    0.506705E-03    0.357964E-01    0.243149E-02    0.333649E-01
     20.00    0.253352E-03    0.355430E-01    0.104018E-02    0.345028E-01
     10.00    0.126676E-03    0.354164E-01    0.432309E-03    0.349840E-01 (used)
   ------------------------------------------------------------------------

         :::::::::::::::::::::::::::::::::::::::::::::::::::::
         ::                  THERMODYNAMIC                  ::
         :::::::::::::::::::::::::::::::::::::::::::::::::::::
         :: total free energy          -6.355962845823 Eh   ::
         ::.................................................::
         :: total energy               -6.390946889968 Eh   ::
         :: zero point energy           0.035289677019 Eh   ::
         :: G(RRHO) w/o ZPVE           -0.000305632874 Eh   ::
         :: G(RRHO) contrib.            0.034984044145 Eh   ::
         :::::::::::::::::::::::::::::::::::::::::::::::::::::

optimized geometry written to: xtbopt.xyz


           -------------------------------------------------
          | TOTAL ENERGY               -6.390946889968 Eh   |
          | TOTAL ENTHALPY             -6.355530536933 Eh   |
          | TOTAL FREE ENERGY          -6.355962845823 Eh   |
          | GRADIENT NORM               0.000140404034 Eh/α |
          | HOMO-LUMO GAP               8.673861764487 eV   |
           -------------------------------------------------

------------------------------------------------------------------------
 * finished run on 2020/05/12 at 11:44:28.572     
------------------------------------------------------------------------
 total:
 * wall-time:     0 d,  0 h,  0 min,  0.087 sec
 *  cpu-time:     0 d,  0 h,  0 min,  0.087 sec
 * ratio c/w:     0.998 speedup
 SCF:
 * wall-time:     0 d,  0 h,  0 min,  0.002 sec
 *  cpu-time:     0 d,  0 h,  0 min,  0.002 sec
 * ratio c/w:     1.000 speedup
 ANC optimizer:
 * wall-time:     0 d,  0 h,  0 min,  0.035 sec
 *  cpu-time:     0 d,  0 h,  0 min,  0.035 sec
 * ratio c/w:     0.999 speedup
 numerical hessian:
 * wall-time:     0 d,  0 h,  0 min,  0.033 sec
 *  cpu-time:     0 d,  0 h,  0 min,  0.033 sec
 * ratio c/w:     0.998 speedup

