      -----------------------------------------------------------      
     |                   =====================                   |     
     |                           x T B                           |     
     |                   =====================                   |     
     |                         S. Grimme                         |     
     |          Mulliken Center for Theoretical Chemistry        |     
     |                    University of Bonn                     |     
      -----------------------------------------------------------      

   * xtb version 6.2.2 (9d81278992624c895f80dd42a50cac0aa55982e2) compiled by '@Darwin' on 04/03/2020

   xtb is free software: you can redistribute it and/or modify it under
   the terms of the GNU Lesser General Public License as published by
   the Free Software Foundation, either version 3 of the License, or
   (at your option) any later version.
   
   xtb is distributed in the hope that it will be useful,
   but WITHOUT ANY WARRANTY; without even the implied warranty of
   MERCHANTABILITY or FITNESS FOR A PARTICULAR PURPOSE.  See the
   GNU Lesser General Public License for more details.
   
   Cite this work as:
   * S. Grimme, C. Bannwarth, P. Shushkov, J. Chem. Theory Comput., 2017,
     13, 1989-2009. DOI: 10.1021/acs.jctc.7b00118
   * C. Bannwarth, S. Ehlert and S. Grimme., J. Chem. Theory Comput., 2019,
     15, 1652-1671. DOI: 10.1021/acs.jctc.8b01176
   * P. Pracht, E. Caldeweyher, S. Ehlert, S. Grimme, ChemRxiv, 2019, preprint.
     DOI: 10.26434/chemrxiv.8326202.v1
   
   for DFT-D4:
   * E. Caldeweyher, C. Bannwarth and S. Grimme, J. Chem. Phys., 2017,
     147, 034112. DOI: 10.1063/1.4993215
   * E. Caldeweyher, S. Ehlert, A. Hansen, H. Neugebauer, S. Spicher,
     C. Bannwarth and S. Grimme, J. Chem. Phys., 2019, 150, 154122.
     DOI: 10.1063/1.5090222
   
   for sTDA-xTB:
   * S. Grimme and C. Bannwarth, J. Chem. Phys., 2016, 145, 054103.
     DOI: 10.1063/1.4959605
   
   in the mass-spec context:
   * V. Asgeirsson, C. Bauer and S. Grimme, Chem. Sci., 2017, 8, 4879.
     DOI: 10.1039/c7sc00601b
   
   for metadynamics refer to:
   * S. Grimme, J. Chem. Theory Comput., 2019, 155, 2847-2862
     DOI: 10.1021/acs.jctc.9b00143
   
   with help from (in alphabetical order)
   C. Bannwarth, F. Bohle, G. Brandenburg, E. Caldeweyher, M. Checinski,
   S. Dohm, S. Ehlert, S. Ehrlich, F. März, H. Neugebauer, J. Pisarek,
   P. Pracht, P. Shushkov, and S. Spicher.
   
 * started run on 2020/05/12 at 11:44:22.953     

           -------------------------------------------------
          |                Calculation Setup                |
           -------------------------------------------------

          program call               : xtb --input C4N1_55_S_1.input C4N1_55_S_1.xyz --ohess --molden --namespace C4N1_55_S_1 output.out
          calculation namespace      : C4N1_55_S_1
          coordinate file            : C4N1_55_S_1.xyz
          number of atoms            :                     5
          number of electrons        :                    21
          charge                     :                     0
          spin                       :                   0.5
          first test random number   :      0.31093000190760

   ID    Z sym.   atoms
    1    7 N      1
    2    6 C      2-5

           -------------------------------------------------
          |                 G F N 2 - x T B                 |
           -------------------------------------------------

        Reference                      10.1021/acs.jctc.8b01176
      * Hamiltonian:
        H0-scaling (s, p, d)           1.850000    2.230000    2.230000
        zeta-weighting                 0.500000
      * Dispersion:
        s8                             2.700000
        a1                             0.520000
        a2                             5.000000
        s9                             5.000000
      * Repulsion:
        kExp                           1.500000    1.000000
        rExp                           1.000000
      * Coulomb:
        alpha                          2.000000
        third order                    shell-resolved
        anisotropic                    true
        a3                             3.000000
        a5                             4.000000
        cn-shift                       1.200000
        cn-exp                         4.000000
        max-rad                        5.000000


          ...................................................
          :                      SETUP                      :
          :.................................................:
          :  # basis functions                  20          :
          :  # atomic orbitals                  20          :
          :  # shells                           10          :
          :  # electrons                        21          :
          :  max. iterations                   250          :
          :  Hamiltonian                  GFN2-xTB          :
          :  restarted?                      false          :
          :  GBSA solvation                  false          :
          :  PC potential                    false          :
          :  electronic temp.          300.0000000     K    :
          :  accuracy                    1.0000000          :
          :  -> integral cutoff          0.2500000E+02      :
          :  -> integral neglect         0.1000000E-07      :
          :  -> SCF convergence          0.1000000E-05 Eh   :
          :  -> wf. convergence          0.1000000E-03 e    :
          :  Broyden damping             0.4000000          :
          ...................................................

 iter      E             dE          RMSdq      gap      omega  full diag
   1    -11.0189111 -0.110189E+02  0.808E+00    3.89       0.0  T
   2    -11.0781278 -0.592168E-01  0.513E+00    2.78       1.0  T
   3    -11.1099035 -0.317756E-01  0.310E+00    3.45       1.0  T
   4    -11.0676157  0.422877E-01  0.242E+00    3.20       1.0  T
   5    -11.1165810 -0.489653E-01  0.491E-01    3.43       1.0  T
   6    -11.1077611  0.881998E-02  0.134E+00    3.40       1.0  T
   7    -11.1166334 -0.887234E-02  0.354E-01    3.41       1.0  T
   8    -11.1169498 -0.316432E-03  0.241E-01    3.40       1.0  T
   9    -11.1171560 -0.206152E-03  0.140E-01    3.40       1.0  T
  10    -11.1172445 -0.885053E-04  0.296E-02    3.40       1.5  T
  11    -11.1172468 -0.225736E-05  0.767E-03    3.40       5.8  T
  12    -11.1172468 -0.454556E-07  0.181E-03    3.41      24.7  T
  13    -11.1172468 -0.196557E-07  0.439E-04    3.41     101.8  T
  14    -11.1172468 -0.151992E-09  0.116E-04    3.41     387.1  T

   *** convergence criteria satisfied after 14 iterations ***

         #    Occupation            Energy/Eh            Energy/eV
      -------------------------------------------------------------
         1        2.0000           -0.7827372             -21.2994
       ...           ...                  ...                  ...
         5        2.0000           -0.5409074             -14.7188
         6        2.0000           -0.5409061             -14.7188
         7        2.0000           -0.5408034             -14.7160
         8        2.0000           -0.4685481             -12.7498
         9        1.9669           -0.4508169             -12.2674
        10        1.9669           -0.4508157             -12.2673
        11        1.0662           -0.4450946             -12.1116 (HOMO)
        12                         -0.3199478              -8.7062 (LUMO)
        13                         -0.3199463              -8.7062
        14                         -0.1070846              -2.9139
        15                         -0.0348433              -0.9481
        16                         -0.0262328              -0.7138
       ...                                ...                  ...
        20                          0.2471572               6.7255
      -------------------------------------------------------------
                  HL-Gap            0.1251468 Eh            3.4054 eV
             Fermi-level           -0.4150654 Eh          -11.2945 eV

 SCC (total)                   0 d,  0 h,  0 min,  0.005 sec
 SCC setup                      ...        0 min,  0.000 sec (  2.435%)
 Dispersion                     ...        0 min,  0.000 sec (  0.365%)
 integral evaluation            ...        0 min,  0.001 sec ( 27.673%)
 zeroth order Hamiltonian       ...        0 min,  0.000 sec (  0.429%)
 iterations                     ...        0 min,  0.002 sec ( 36.010%)
 molecular gradient             ...        0 min,  0.002 sec ( 31.618%)
 printout                       ...        0 min,  0.000 sec (  1.271%)

         :::::::::::::::::::::::::::::::::::::::::::::::::::::
         ::                     SUMMARY                     ::
         :::::::::::::::::::::::::::::::::::::::::::::::::::::
         :: total energy             -10.984180897474 Eh    ::
         :: gradient norm              0.235917864316 Eh/a0 ::
         :: HOMO-LUMO gap              3.405417071392 eV    ::
         ::.................................................::
         :: SCC energy               -11.117246818757 Eh    ::
         :: -> isotropic ES           -0.004710490145 Eh    ::
         :: -> anisotropic ES          0.006462527669 Eh    ::
         :: -> anisotropic XC          0.001692290915 Eh    ::
         :: -> dispersion             -0.002323512420 Eh    ::
         :: repulsion energy           0.133065912868 Eh    ::
         :: add. restraining           0.000000000000 Eh    ::
         :::::::::::::::::::::::::::::::::::::::::::::::::::::

      ----------------------------------------------------------- 
     |                   =====================                   |
     |                        A N C O P T                        |
     |                   =====================                   |
     |               Approximate Normal Coordinate               |
     |                Rational Function Optimizer                |
      ----------------------------------------------------------- 

          ...................................................
          :                      SETUP                      :
          :.................................................:
          :   optimization level            normal          :
          :   max. optcycles                   200          :
          :   ANC micro-cycles                  20          :
          :   degrees of freedom                 9          :
          :.................................................:
          :   RF solver                   davidson          :
          :   write xtbopt.log                true          :
          :   linear?                        false          :
          :   energy convergence         0.5000000E-05 Eh   :
          :   grad. convergence          0.1000000E-02 Eh/α :
          :   maximium RF displ.         1.0000000          :
          :   Hlow (freq-cutoff)         0.1000000E-01      :
          :   Hmax (freq-cutoff)         5.0000000          :
          :   S6 in model hess.         20.0000000          :
          ...................................................

generating ANC from model Hessian ...
Using Lindh-Hessian (1995)
 Shifting diagonal of input Hessian by    0.0000000000000000     
 Lowest  eigenvalues of input Hessian
   -0.000000   -0.000000    0.000000    0.000000    0.000000    0.000000
    0.435485    0.435496    0.873661    1.003658    1.003670    1.203525
    1.203543    1.583051    1.959375
 Highest eigenvalues
    1.003658    1.003670    1.203525    1.203543    1.583051    1.959375


........................................................................
.............................. CYCLE    1 ..............................
........................................................................
   1    -11.1172468 -0.111172E+02  0.613E-05    3.41       0.0  T
   2    -11.1172468  0.575350E-09  0.330E-04    3.41     135.5  T
   3    -11.1172468 -0.573069E-09  0.572E-05    3.41     782.4  T
     SCC iter.                  ...        0 min,  0.001 sec
     gradient                   ...        0 min,  0.002 sec
 * total energy  :   -10.9841809 Eh     change        0.7226042E-09 Eh
   gradient norm :     0.2359178 Eh/α   predicted     0.0000000E+00 (-100.00%)
   displ. norm   :     0.2043148 α      lambda       -0.4562328E-01
   maximum displ.:     0.1844154 α      in ANC's #3, #9, #8, ...

........................................................................
.............................. CYCLE    2 ..............................
........................................................................
   1    -11.1423676 -0.111424E+02  0.202E+00    3.84       0.0  T
   2    -11.1425417 -0.174171E-03  0.118E+00    3.81       1.0  T
   3    -11.1393465  0.319521E-02  0.622E-01    3.79       1.0  T
   4    -11.1416860 -0.233945E-02  0.441E-01    3.81       1.0  T
   5    -11.1426442 -0.958233E-03  0.131E-01    3.80       1.0  T
   6    -11.1423994  0.244850E-03  0.226E-01    3.79       1.0  T
   7    -11.1427016 -0.302220E-03  0.130E-02    3.79       3.5  T
   8    -11.1427014  0.159422E-06  0.890E-03    3.79       5.0  T
   9    -11.1427015 -0.604085E-07  0.797E-03    3.79       5.6  T
  10    -11.1427018 -0.317583E-06  0.547E-04    3.79      81.8  T
  11    -11.1427018 -0.996829E-09  0.228E-04    3.79     196.0  T
     SCC iter.                  ...        0 min,  0.001 sec
     gradient                   ...        0 min,  0.002 sec
 * total energy  :   -11.0215240 Eh     change       -0.3734310E-01 Eh
   gradient norm :     0.1502032 Eh/α   predicted    -0.2376391E-01 ( -36.36%)
   displ. norm   :     0.3819997 α      lambda       -0.5539129E-01
   maximum displ.:     0.3616126 α      in ANC's #3, #9, #8, ...

........................................................................
.............................. CYCLE    3 ..............................
........................................................................
   1    -11.1864996 -0.111865E+02  0.335E+00    3.71       0.0  T
   2    -11.1873087 -0.809090E-03  0.199E+00    3.78       1.0  T
   3    -11.1824279  0.488084E-02  0.898E-01    3.61       1.0  T
   4    -11.1871152 -0.468736E-02  0.353E-01    3.79       1.0  T
   5    -11.1880056 -0.890364E-03  0.130E-01    3.74       1.0  T
   6    -11.1880189 -0.133154E-04  0.414E-02    3.75       1.1  T
   7    -11.1880263 -0.744055E-05  0.717E-03    3.75       6.2  T
   8    -11.1880263 -0.631355E-09  0.140E-03    3.75      32.0  T
   9    -11.1880264 -0.105606E-07  0.637E-04    3.75      70.2  T
  10    -11.1880264 -0.232588E-08  0.155E-04    3.75     288.0  T
     SCC iter.                  ...        0 min,  0.001 sec
     gradient                   ...        0 min,  0.001 sec
 * total energy  :   -11.0574738 Eh     change       -0.3594979E-01 Eh
   gradient norm :     0.0704070 Eh/α   predicted    -0.3173710E-01 ( -11.72%)
   displ. norm   :     0.1411426 α      lambda       -0.7179856E-02
   maximum displ.:     0.1253559 α      in ANC's #3, #9, #8, ...

........................................................................
.............................. CYCLE    4 ..............................
........................................................................
   1    -11.1894518 -0.111895E+02  0.100E+00    3.33       0.0  T
   2    -11.1895161 -0.642839E-04  0.574E-01    3.23       1.0  T
   3    -11.1884805  0.103555E-02  0.509E-01    3.36       1.0  T
   4    -11.1899526 -0.147205E-02  0.838E-02    3.28       1.0  T
   5    -11.1899781 -0.255169E-04  0.281E-02    3.28       1.6  T
   6    -11.1899783 -0.152320E-06  0.405E-03    3.28      11.0  T
   7    -11.1899783 -0.346562E-07  0.140E-03    3.28      32.0  T
   8    -11.1899783  0.120425E-09  0.652E-04    3.28      68.6  T
   9    -11.1899783 -0.305583E-08  0.963E-05    3.28     464.4  T
     SCC iter.                  ...        0 min,  0.001 sec
     gradient                   ...        0 min,  0.001 sec
 * total energy  :   -11.0613894 Eh     change       -0.3915580E-02 Eh
   gradient norm :     0.0501363 Eh/α   predicted    -0.3661444E-02 (  -6.49%)
   displ. norm   :     0.0365878 α      lambda       -0.1751764E-02
   maximum displ.:     0.0329802 α      in ANC's #9, #8, #3, ...

........................................................................
.............................. CYCLE    5 ..............................
........................................................................
   1    -11.1824595 -0.111825E+02  0.229E-01    3.19       0.0  T
   2    -11.1824889 -0.293276E-04  0.173E-01    3.20       1.0  T
   3    -11.1825247 -0.358623E-04  0.990E-02    3.18       1.0  T
   4    -11.1825335 -0.874976E-05  0.553E-02    3.21       1.0  T
   5    -11.1825502 -0.166907E-04  0.102E-02    3.20       4.4  T
   6    -11.1825502 -0.312557E-07  0.124E-03    3.20      36.0  T
   7    -11.1825502 -0.571161E-09  0.592E-04    3.20      75.5  T
   8    -11.1825502 -0.923738E-09  0.351E-04    3.20     127.5  T
     SCC iter.                  ...        0 min,  0.001 sec
     gradient                   ...        0 min,  0.001 sec
 * total energy  :   -11.0625435 Eh     change       -0.1154125E-02 Eh
   gradient norm :     0.0165900 Eh/α   predicted    -0.8770554E-03 ( -24.01%)
   displ. norm   :     0.0174363 α      lambda       -0.2814156E-03
   maximum displ.:     0.0156212 α      in ANC's #9, #8, #3, ...

........................................................................
.............................. CYCLE    6 ..............................
........................................................................
   1    -11.1786830 -0.111787E+02  0.108E-01    3.16       0.0  T
   2    -11.1786887 -0.568529E-05  0.826E-02    3.17       1.0  T
   3    -11.1786982 -0.944198E-05  0.469E-02    3.16       1.0  T
   4    -11.1787002 -0.205294E-05  0.253E-02    3.17       1.8  T
   5    -11.1787037 -0.348053E-05  0.502E-03    3.16       8.9  T
   6    -11.1787037 -0.805454E-08  0.532E-04    3.16      84.0  T
   7    -11.1787037  0.306883E-10  0.290E-04    3.16     154.2  T
     SCC iter.                  ...        0 min,  0.001 sec
     gradient                   ...        0 min,  0.001 sec
 * total energy  :   -11.0626925 Eh     change       -0.1490029E-03 Eh
   gradient norm :     0.0010899 Eh/α   predicted    -0.1407493E-03 (  -5.54%)
   displ. norm   :     0.0019786 α      lambda       -0.1337098E-05
   maximum displ.:     0.0018802 α      in ANC's #9, #8, #3, ...

........................................................................
.............................. CYCLE    7 ..............................
........................................................................
   1    -11.1782715 -0.111783E+02  0.123E-02    3.16       0.0  T
   2    -11.1782717 -0.117054E-06  0.847E-03    3.16       5.3  T
   3    -11.1782717 -0.102824E-07  0.499E-03    3.16       9.0  T
   4    -11.1782717 -0.564380E-08  0.318E-03    3.16      14.1  T
   5    -11.1782717 -0.643686E-07  0.532E-04    3.16      84.1  T
   6    -11.1782717  0.169372E-08  0.517E-04    3.16      86.5  T
     SCC iter.                  ...        0 min,  0.001 sec
     gradient                   ...        0 min,  0.001 sec
 * total energy  :   -11.0626930 Eh     change       -0.5507365E-06 Eh
   gradient norm :     0.0004988 Eh/α   predicted    -0.6697613E-06 (  21.61%)
   displ. norm   :     0.0006181 α      lambda       -0.1931242E-06
   maximum displ.:     0.0005546 α      in ANC's #9, #8, #3, ...

   *** GEOMETRY OPTIMIZATION CONVERGED AFTER 7 ITERATIONS ***

------------------------------------------------------------------------
 total energy gain   :        -0.0785121 Eh      -49.2671 kcal/mol
 total RMSD          :         0.3272935 a0        0.1732 Å
 total power (kW/mol):       -29.4476593 (step)-7638.5045 (real)
------------------------------------------------------------------------

 ANCopt (total)                0 d,  0 h,  0 min,  0.027 sec
 optimizer setup                ...        0 min,  0.000 sec (  0.244%)
 model hessian                  ...        0 min,  0.000 sec (  0.344%)
 ANC generation                 ...        0 min,  0.000 sec (  0.200%)
 coordinate transformation      ...        0 min,  0.000 sec (  0.056%)
 single point calculation       ...        0 min,  0.026 sec ( 96.886%)
 optimization log               ...        0 min,  0.000 sec (  0.571%)
 hessian update                 ...        0 min,  0.000 sec (  0.072%)
 rational function              ...        0 min,  0.000 sec (  0.632%)

================
 final structure:
================
5
 xtb: 6.2.2 (9d81278992624c895f80dd42a50cac0aa55982e2)
N         0.26573002699172   -0.97227414297518    0.02279479639229
C        -0.68715295269495   -0.22152564898566   -0.69572283122102
C        -0.27901502873167    1.02085717357076   -0.02391703179050
C        -0.23515780103805   -0.05888235490620    0.97289073204968
C         0.93559675547294    0.23182497329629   -0.27604466543045

 Bond Distances (Angstroems)
 ---------------------------
N1-C2=1.4099         N1-C4=1.4099         N1-C5=1.4099         C2-N1=1.4099         C2-C3=1.4702         C2-C4=1.7364         
C2-C5=1.7364         C3-C2=1.4702         C3-C4=1.4702         C3-C5=1.4702         C4-N1=1.4099         C4-C2=1.7364         
C4-C3=1.4702         C4-C5=1.7364         C5-N1=1.4099         C5-C2=1.7364         C5-C3=1.4702         C5-C4=1.7364         
 C  C  Rav=1.6033 sigma=0.1331  Rmin=1.4702  Rmax=1.7364     6
 N  C  Rav=1.4099 sigma=0.0000  Rmin=1.4099  Rmax=1.4099     3

 selected bond angles (degree)
 --------------------
C4-N1-C2= 76.02                C5-N1-C2= 76.02                C5-N1-C4= 76.02                C3-C2-N1= 91.69                
C4-C2-N1= 51.99                C4-C2-C3= 53.80                C5-C2-N1= 51.99                C5-C2-C3= 53.81                
C5-C2-C4= 60.00                C4-C3-C2= 72.39                C5-C3-C2= 72.39                C5-C3-C4= 72.39                
C2-C4-N1= 51.99                C3-C4-N1= 91.69                C3-C4-C2= 53.81                C5-C4-N1= 51.99                
C5-C4-C2= 60.00                C5-C4-C3= 53.81                C2-C5-N1= 51.99                C3-C5-N1= 91.69                
C3-C5-C2= 53.81                C4-C5-N1= 51.99                C4-C5-C2= 60.00                C4-C5-C3= 53.80                

 selected dihedral angles (degree)
 ---------------------------------
C3-C2-N1-C4= 39.39            C3-C2-N1-C5=320.61            C4-C2-N1-C5=281.22            C5-C2-N1-C4= 78.78            
C4-C3-C2-N1=321.72            C4-C3-C2-C5=283.43            C5-C3-C2-N1= 38.29            C5-C3-C2-C4= 76.57            
C2-C4-N1-C5= 78.78            C3-C4-N1-C2=320.61            C3-C4-N1-C5= 39.39            C5-C4-N1-C2=281.22            
N1-C4-C2-C3=231.81            N1-C4-C2-C5=296.82            C3-C4-C2-N1=128.19            C3-C4-C2-C5= 65.01            
C5-C4-C2-N1= 63.18            C5-C4-C2-C3=294.99            N1-C4-C3-C2= 38.28            N1-C4-C3-C5=321.72            
C2-C4-C3-C5=283.43            C5-C4-C3-C2= 76.57            C2-C5-N1-C4=281.22            C3-C5-N1-C2= 39.39            
C3-C5-N1-C4=320.61            C4-C5-N1-C2= 78.78            N1-C5-C2-C3=128.19            N1-C5-C2-C4= 63.18            
C3-C5-C2-N1=231.81            C3-C5-C2-C4=294.99            C4-C5-C2-N1=296.82            C4-C5-C2-C3= 65.01            
N1-C5-C3-C2=321.71            N1-C5-C3-C4= 38.28            C2-C5-C3-C4= 76.57            C4-C5-C3-C2=283.43            
N1-C5-C4-C2=296.82            N1-C5-C4-C3=231.81            C2-C5-C4-N1= 63.18            C2-C5-C4-C3=294.99            
C3-C5-C4-N1=128.19            C3-C5-C4-C2= 65.01            
           -------------------------------------------------
          |                Final Singlepoint                |
           -------------------------------------------------

          ...................................................
          :                      SETUP                      :
          :.................................................:
          :  # basis functions                  20          :
          :  # atomic orbitals                  20          :
          :  # shells                           10          :
          :  # electrons                        21          :
          :  max. iterations                   250          :
          :  Hamiltonian                  GFN2-xTB          :
          :  restarted?                      false          :
          :  GBSA solvation                  false          :
          :  PC potential                    false          :
          :  electronic temp.          300.0000000     K    :
          :  accuracy                    1.0000000          :
          :  -> integral cutoff          0.2500000E+02      :
          :  -> integral neglect         0.1000000E-07      :
          :  -> SCF convergence          0.1000000E-05 Eh   :
          :  -> wf. convergence          0.1000000E-03 e    :
          :  Broyden damping             0.4000000          :
          ...................................................

 iter      E             dE          RMSdq      gap      omega  full diag
   1    -11.1782717 -0.111783E+02  0.163E-04    3.16       0.0  T
   2    -11.1782717 -0.515143E-13  0.107E-04    3.16     417.6  T
   3    -11.1782717  0.477804E-10  0.772E-05    3.16     579.4  T

   *** convergence criteria satisfied after 3 iterations ***

         #    Occupation            Energy/Eh            Energy/eV
      -------------------------------------------------------------
         1        2.0000           -0.7941541             -21.6100
       ...           ...                  ...                  ...
         5        2.0000           -0.5599062             -15.2358
         6        2.0000           -0.5599031             -15.2357
         7        2.0000           -0.5314346             -14.4611
         8        2.0000           -0.4787064             -13.0263
         9        2.0000           -0.4699043             -12.7867
        10        2.0000           -0.4699036             -12.7867
        11        1.0000           -0.4287126             -11.6659 (HOMO)
        12                         -0.3127040              -8.5091 (LUMO)
        13                         -0.3126968              -8.5089
        14                         -0.2478420              -6.7441
        15                         -0.0016448              -0.0448
        16                         -0.0016301              -0.0444
       ...                                ...                  ...
        20                          0.3664676               9.9721
      -------------------------------------------------------------
                  HL-Gap            0.1160085 Eh            3.1568 eV
             Fermi-level           -0.4098499 Eh          -11.1526 eV

 SCC (total)                   0 d,  0 h,  0 min,  0.003 sec
 SCC setup                      ...        0 min,  0.000 sec (  2.115%)
 Dispersion                     ...        0 min,  0.000 sec (  0.248%)
 integral evaluation            ...        0 min,  0.001 sec ( 40.013%)
 zeroth order Hamiltonian       ...        0 min,  0.000 sec (  0.476%)
 iterations                     ...        0 min,  0.000 sec ( 10.903%)
 molecular gradient             ...        0 min,  0.001 sec ( 44.570%)
 printout                       ...        0 min,  0.000 sec (  1.427%)

         :::::::::::::::::::::::::::::::::::::::::::::::::::::
         ::                     SUMMARY                     ::
         :::::::::::::::::::::::::::::::::::::::::::::::::::::
         :: total energy             -11.062693046704 Eh    ::
         :: gradient norm              0.000497291055 Eh/a0 ::
         :: HOMO-LUMO gap              3.156753131124 eV    ::
         ::.................................................::
         :: SCC energy               -11.178271735640 Eh    ::
         :: -> isotropic ES           -0.010292555493 Eh    ::
         :: -> anisotropic ES          0.007124135058 Eh    ::
         :: -> anisotropic XC          0.001643399794 Eh    ::
         :: -> dispersion             -0.002327279812 Eh    ::
         :: repulsion energy           0.115578675053 Eh    ::
         :: add. restraining           0.000000000000 Eh    ::
         :::::::::::::::::::::::::::::::::::::::::::::::::::::

           ------------------------------------------------- 
          |                Numerical Hessian                |
           ------------------------------------------------- 
step length          :   0.00500
SCC accuracy         :   0.30000
Hessian scale factor :   1.00000
frozen atoms in %    :   0.00000    0
RMS gradient         :   0.00050
estimated CPU  time      0.00 min
estimated wall time      0.00 min

writing file <hessian>.

 projected vibrational frequencies (cm-1)
eigval :       -0.00    -0.00    -0.00    -0.00     0.00     0.00
eigval :      404.94   405.56   821.76   848.91   848.96  1039.13
eigval :     1039.82  1277.86  1393.76
           -------------------------------------------------
          |                Property Printout                |
           -------------------------------------------------

    * Orbital Energies and Occupations

         #    Occupation            Energy/Eh            Energy/eV
      -------------------------------------------------------------
         1        2.0000           -0.7941541             -21.6100
         2        2.0000           -0.6760990             -18.3976
         3        2.0000           -0.6646001             -18.0847
         4        2.0000           -0.6645989             -18.0847
         5        2.0000           -0.5599065             -15.2358
         6        2.0000           -0.5599030             -15.2357
         7        2.0000           -0.5314346             -14.4611
         8        2.0000           -0.4787064             -13.0263
         9        2.0000           -0.4699042             -12.7867
        10        2.0000           -0.4699037             -12.7867
        11        1.0000           -0.4287128             -11.6659 (HOMO)
        12                         -0.3127039              -8.5091 (LUMO)
        13                         -0.3126970              -8.5089
        14                         -0.2478420              -6.7441
        15                         -0.0016446              -0.0448
        16                         -0.0016305              -0.0444
        17                          0.0669890               1.8229
        18                          0.0669905               1.8229
        19                          0.0920236               2.5041
        20                          0.3664675               9.9721
      -------------------------------------------------------------
                  HL-Gap            0.1160089 Eh            3.1568 eV
             Fermi-level           -0.4098500 Eh          -11.1526 eV

     #   Z        covCN         q      C6AA      α(0)
     1   7 N      2.960     0.014    21.006     6.807
     2   6 C      3.690    -0.022    21.156     6.583
     3   6 C      3.169     0.052    26.477     8.407
     4   6 C      3.690    -0.022    21.156     6.583
     5   6 C      3.690    -0.022    21.156     6.583

 Mol. C6AA /au·bohr⁶  :        552.631555
 Mol. C8AA /au·bohr⁸  :      15203.884728
 Mol. α(0) /au        :         34.961758


Wiberg/Mayer (AO) data.
largest (>0.10) Wiberg bond orders for each atom
          total WBO             WBO to atom ...
     1  N   3.056        C    4 0.969    C    2 0.969    C    5 0.969    C    3 0.149
     2  C   3.005        N    1 0.969    C    3 0.941    C    5 0.547    C    4 0.547
     3  C   2.973        C    4 0.941    C    2 0.941    C    5 0.941    N    1 0.149
     4  C   3.005        N    1 0.969    C    3 0.941    C    5 0.547    C    2 0.547
     5  C   3.005        N    1 0.969    C    3 0.941    C    2 0.547    C    4 0.547

MOs/occ written to file <molden.input>


molecular dipole:
                 x           y           z       tot (Debye)
 q only:       -0.021       0.077      -0.002
   full:       -0.006       0.023      -0.001       0.060
molecular quadrupole (traceless):
                xx          xy          yy          xz          yz          zz
 q only:       -0.150      -0.144       0.338       0.003      -0.012      -0.189
  q+dip:       -0.795      -0.766       1.798       0.018      -0.066      -1.003
   full:       -0.442      -0.426       1.000       0.010      -0.037      -0.558

           -------------------------------------------------
          |                Geometry Summary                 |
           -------------------------------------------------

      molecular mass/u    :       62.0496468
Refinement of some symmetry elements was terminated before convergence was reached.
Some symmetry elements may remain unidentified.
Molecule has the following symmetry elements: (C3) 3*(sigma) 
It seems to be the C3v point group
   center of mass at/Å    :        0.0085478      -0.0312754       0.0007335
  moments of inertia/u·Å² :        0.3621242E+02   0.4574690E+02   0.4574728E+02
rotational constants/cm⁻¹ :        0.4655207E+00   0.3684978E+00   0.3684947E+00

 * 6 selected distances

     #   Z        #   Z                                     value/Å
     1   7 N      2   6 C                                 1.4099209
     2   6 C      3   6 C                                 1.4701750
     1   7 N      4   6 C                                 1.4099133 (min)
     3   6 C      4   6 C                                 1.4701655
     1   7 N      5   6 C                                 1.4099224
     3   6 C      5   6 C                                 1.4701775 (max)

 * 2 distinct bonds (by element types)

   Z      Z             #   av. dist./Å        max./Å        min./Å
   6 C    6 C           3     1.4701727     1.4701775     1.4701655
   6 C    7 N           3     1.4099188     1.4099224     1.4099133

           -------------------------------------------------
          |               Frequency Printout                |
           -------------------------------------------------
 projected vibrational frequencies (cm-1)
eigval :       -0.00    -0.00    -0.00    -0.00     0.00     0.00
eigval :      404.94   405.56   821.76   848.91   848.96  1039.13
eigval :     1039.82  1277.86  1393.76
 reduced masses (amu)
   1: 12.20   2: 12.12   3: 12.60   4: 12.45   5: 12.52   6: 12.69   7: 12.37   8: 12.37
   9: 12.38  10: 12.47  11: 12.47  12: 12.15  13: 12.15  14: 12.65  15: 12.55
 IR intensities (amu)
   1:  0.03   2:  0.04   3:  0.03   4:  0.05   5:  0.03   6:  0.03   7:  0.87   8:  0.87
   9:  0.13  10:  0.16  11:  0.16  12:  1.04  13:  1.04  14:  0.94  15:  0.23
 Raman intensities (amu)
   1:  0.00   2:  0.00   3:  0.00   4:  0.00   5:  0.00   6:  0.00   7:  0.00   8:  0.00
   9:  0.00  10:  0.00  11:  0.00  12:  0.00  13:  0.00  14:  0.00  15:  0.00
 output can be read by thermo (or use thermo option).
 writing <g98.out> molden fake output.
 recommended (thermochemical) frequency scaling factor: 1.0
           -------------------------------------------------
          |             Thermodynamic Functions             |
           -------------------------------------------------

c3v symmetry found (for desy threshold:  0.10E+00) used in thermo

          ...................................................
          :                      SETUP                      :
          :.................................................:
          :  # frequencies                           9      :
          :  # imaginary freq.                       0      :
          :  linear?                             false      :
          :  only rotor calc.                    false      :
          :  symmetry                              c3v      :
          :  rotational number                       3      :
          :  scaling factor                  1.0000000      :
          :  rotor cutoff                   50.0000000 cm⁻¹ :
          :  imag. cutoff                  -20.0000000 cm⁻¹ :
          :.................................................:

    mode    ω/cm⁻¹     T·S(HO)/kcal·mol⁻¹    T·S(FR)/kcal·mol⁻¹   T·S(vib)
   ------------------------------------------------------------------------
   ------------------------------------------------------------------------

   temp. (K)  partition function   enthalpy   heat capacity  entropy
                                   cal/mol     cal/K/mol   cal/K/mol   J/K/mol
 298.15  VIB   1.45                  561.516      5.619      2.628
         ROT  0.701E+04              888.752      2.981     20.578
         INT  0.102E+05             1450.268      8.600     23.206
         TR   0.473E+27             1481.254      4.968     38.278
         TOT                        2931.5219    13.5684    61.4839   257.2486

   temp. (K)  partition function   enthalpy   heat capacity  entropy
                                   cal/mol     cal/K/mol   cal/K/mol   J/K/mol
 120.00  VIB   1.02                   18.453      0.768      0.185
         ROT  0.179E+04              357.707      2.981     17.865
         INT  0.182E+04              376.160      3.749     18.051
         TR   0.121E+27              596.178      4.968     33.759
         TOT                         972.3381     8.7168    51.8093   216.7701

   temp. (K)  partition function   enthalpy   heat capacity  entropy
                                   cal/mol     cal/K/mol   cal/K/mol   J/K/mol
 100.00  VIB   1.01                    6.867      0.404      0.081
         ROT  0.136E+04              298.089      2.981     17.322
         INT  0.137E+04              304.956      3.385     17.402
         TR   0.919E+26              496.815      4.968     32.853
         TOT                         801.7713     8.3534    50.2558   210.2701

   temp. (K)  partition function   enthalpy   heat capacity  entropy
                                   cal/mol     cal/K/mol   cal/K/mol   J/K/mol
  80.00  VIB   1.00                    1.587      0.145      0.023
         ROT   974.                  238.471      2.981     16.657
         INT   976.                  240.058      3.126     16.679
         TR   0.657E+26              397.452      4.968     31.745
         TOT                         637.5102     8.0939    48.4246   202.6085

   temp. (K)  partition function   enthalpy   heat capacity  entropy
                                   cal/mol     cal/K/mol   cal/K/mol   J/K/mol
  60.00  VIB   1.00                    0.140      0.023      0.002
         ROT   633.                  178.853      2.981     15.799
         INT   633.                  178.993      3.003     15.802
         TR   0.427E+26              298.089      4.968     30.317
         TOT                         477.0819     7.9716    46.1184   192.9592

   temp. (K)  partition function   enthalpy   heat capacity  entropy
                                   cal/mol     cal/K/mol   cal/K/mol   J/K/mol
  40.00  VIB   1.00                    0.001      0.000     -0.000
         ROT   344.                  119.236      2.981     14.590
         INT   344.                  119.237      2.981     14.590
         TR   0.232E+26              198.726      4.968     28.303
         TOT                         317.9627     7.9494    42.8935   179.4666

   temp. (K)  partition function   enthalpy   heat capacity  entropy
                                   cal/mol     cal/K/mol   cal/K/mol   J/K/mol
  20.00  VIB   1.00                    0.000      0.000     -0.001
         ROT   122.                   59.618      2.981     12.524
         INT   122.                   59.618      2.981     12.524
         TR   0.822E+25               99.363      4.968     24.861
         TOT                         158.9808     7.9490    37.3850   156.4188

   temp. (K)  partition function   enthalpy   heat capacity  entropy
                                   cal/mol     cal/K/mol   cal/K/mol   J/K/mol
  10.00  VIB   1.00                    0.000      0.000     -0.001
         ROT   43.1                   29.809      2.981     10.458
         INT   43.1                   29.809      2.981     10.457
         TR   0.290E+25               49.681      4.968     21.419
         TOT                          79.4904     7.9490    31.8765   133.3711

       T/K    H(0)-H(T)+PV         H(T)/Eh          T*S/Eh         G(T)/Eh
   ------------------------------------------------------------------------
    298.15    0.467168E-02    0.230809E-01    0.292130E-01   -0.613207E-02
    120.00    0.154952E-02    0.199588E-01    0.990760E-02    0.100511E-01
    100.00    0.127770E-02    0.196869E-01    0.800877E-02    0.116782E-01
     80.00    0.101594E-02    0.194252E-01    0.617356E-02    0.132516E-01
     60.00    0.760278E-03    0.191695E-01    0.440966E-02    0.147599E-01
     40.00    0.506706E-03    0.189159E-01    0.273421E-02    0.161817E-01
     20.00    0.253352E-03    0.186626E-01    0.119154E-02    0.174710E-01
     10.00    0.126676E-03    0.185359E-01    0.507984E-03    0.180279E-01 (used)
   ------------------------------------------------------------------------

         :::::::::::::::::::::::::::::::::::::::::::::::::::::
         ::                  THERMODYNAMIC                  ::
         :::::::::::::::::::::::::::::::::::::::::::::::::::::
         :: total free energy         -11.044665123493 Eh   ::
         ::.................................................::
         :: total energy              -11.062693046737 Eh   ::
         :: zero point energy           0.018409230935 Eh   ::
         :: G(RRHO) w/o ZPVE           -0.000381307692 Eh   ::
         :: G(RRHO) contrib.            0.018027923243 Eh   ::
         :::::::::::::::::::::::::::::::::::::::::::::::::::::

optimized geometry written to: xtbopt.xyz


           -------------------------------------------------
          | TOTAL ENERGY              -11.062693046737 Eh   |
          | TOTAL ENTHALPY            -11.044157139786 Eh   |
          | TOTAL FREE ENERGY         -11.044665123493 Eh   |
          | GRADIENT NORM               0.000497622071 Eh/α |
          | HOMO-LUMO GAP               3.156761506170 eV   |
           -------------------------------------------------

------------------------------------------------------------------------
 * finished run on 2020/05/12 at 11:44:23.111     
------------------------------------------------------------------------
 total:
 * wall-time:     0 d,  0 h,  0 min,  0.157 sec
 *  cpu-time:     0 d,  0 h,  0 min,  0.157 sec
 * ratio c/w:     1.000 speedup
 SCF:
 * wall-time:     0 d,  0 h,  0 min,  0.005 sec
 *  cpu-time:     0 d,  0 h,  0 min,  0.005 sec
 * ratio c/w:     0.998 speedup
 ANC optimizer:
 * wall-time:     0 d,  0 h,  0 min,  0.031 sec
 *  cpu-time:     0 d,  0 h,  0 min,  0.031 sec
 * ratio c/w:     1.000 speedup
 numerical hessian:
 * wall-time:     0 d,  0 h,  0 min,  0.106 sec
 *  cpu-time:     0 d,  0 h,  0 min,  0.106 sec
 * ratio c/w:     1.000 speedup

