      -----------------------------------------------------------      
     |                   =====================                   |     
     |                           x T B                           |     
     |                   =====================                   |     
     |                         S. Grimme                         |     
     |          Mulliken Center for Theoretical Chemistry        |     
     |                    University of Bonn                     |     
      -----------------------------------------------------------      

   * xtb version 6.2.2 (9d81278992624c895f80dd42a50cac0aa55982e2) compiled by '@Darwin' on 04/03/2020

   xtb is free software: you can redistribute it and/or modify it under
   the terms of the GNU Lesser General Public License as published by
   the Free Software Foundation, either version 3 of the License, or
   (at your option) any later version.
   
   xtb is distributed in the hope that it will be useful,
   but WITHOUT ANY WARRANTY; without even the implied warranty of
   MERCHANTABILITY or FITNESS FOR A PARTICULAR PURPOSE.  See the
   GNU Lesser General Public License for more details.
   
   Cite this work as:
   * S. Grimme, C. Bannwarth, P. Shushkov, J. Chem. Theory Comput., 2017,
     13, 1989-2009. DOI: 10.1021/acs.jctc.7b00118
   * C. Bannwarth, S. Ehlert and S. Grimme., J. Chem. Theory Comput., 2019,
     15, 1652-1671. DOI: 10.1021/acs.jctc.8b01176
   * P. Pracht, E. Caldeweyher, S. Ehlert, S. Grimme, ChemRxiv, 2019, preprint.
     DOI: 10.26434/chemrxiv.8326202.v1
   
   for DFT-D4:
   * E. Caldeweyher, C. Bannwarth and S. Grimme, J. Chem. Phys., 2017,
     147, 034112. DOI: 10.1063/1.4993215
   * E. Caldeweyher, S. Ehlert, A. Hansen, H. Neugebauer, S. Spicher,
     C. Bannwarth and S. Grimme, J. Chem. Phys., 2019, 150, 154122.
     DOI: 10.1063/1.5090222
   
   for sTDA-xTB:
   * S. Grimme and C. Bannwarth, J. Chem. Phys., 2016, 145, 054103.
     DOI: 10.1063/1.4959605
   
   in the mass-spec context:
   * V. Asgeirsson, C. Bauer and S. Grimme, Chem. Sci., 2017, 8, 4879.
     DOI: 10.1039/c7sc00601b
   
   for metadynamics refer to:
   * S. Grimme, J. Chem. Theory Comput., 2019, 155, 2847-2862
     DOI: 10.1021/acs.jctc.9b00143
   
   with help from (in alphabetical order)
   C. Bannwarth, F. Bohle, G. Brandenburg, E. Caldeweyher, M. Checinski,
   S. Dohm, S. Ehlert, S. Ehrlich, F. März, H. Neugebauer, J. Pisarek,
   P. Pracht, P. Shushkov, and S. Spicher.
   
 * started run on 2020/05/12 at 11:44:27.175     

           -------------------------------------------------
          |                Calculation Setup                |
           -------------------------------------------------

          program call               : xtb --input H2C3_5_S_0.input H2C3_5_S_0.xyz --ohess --molden --namespace H2C3_5_S_0 output.out
          calculation namespace      : H2C3_5_S_0
          coordinate file            : H2C3_5_S_0.xyz
          number of atoms            :                     5
          number of electrons        :                    14
          charge                     :                     0
          spin                       :                   0.0
          first test random number   :      0.26792115526059

   ID    Z sym.   atoms
    1    6 C      1-3
    2    1 H      4, 5

           -------------------------------------------------
          |                 G F N 2 - x T B                 |
           -------------------------------------------------

        Reference                      10.1021/acs.jctc.8b01176
      * Hamiltonian:
        H0-scaling (s, p, d)           1.850000    2.230000    2.230000
        zeta-weighting                 0.500000
      * Dispersion:
        s8                             2.700000
        a1                             0.520000
        a2                             5.000000
        s9                             5.000000
      * Repulsion:
        kExp                           1.500000    1.000000
        rExp                           1.000000
      * Coulomb:
        alpha                          2.000000
        third order                    shell-resolved
        anisotropic                    true
        a3                             3.000000
        a5                             4.000000
        cn-shift                       1.200000
        cn-exp                         4.000000
        max-rad                        5.000000


          ...................................................
          :                      SETUP                      :
          :.................................................:
          :  # basis functions                  14          :
          :  # atomic orbitals                  14          :
          :  # shells                            8          :
          :  # electrons                        14          :
          :  max. iterations                   250          :
          :  Hamiltonian                  GFN2-xTB          :
          :  restarted?                      false          :
          :  GBSA solvation                  false          :
          :  PC potential                    false          :
          :  electronic temp.          300.0000000     K    :
          :  accuracy                    1.0000000          :
          :  -> integral cutoff          0.2500000E+02      :
          :  -> integral neglect         0.1000000E-07      :
          :  -> SCF convergence          0.1000000E-05 Eh   :
          :  -> wf. convergence          0.1000000E-03 e    :
          :  Broyden damping             0.4000000          :
          ...................................................

 iter      E             dE          RMSdq      gap      omega  full diag
   1     -7.1839487 -0.718395E+01  0.745E+00    0.96       0.0  T
   2     -7.1760551  0.789354E-02  0.506E+00    0.39       1.0  T
   3     -7.0235444  0.152511E+00  0.498E+00    1.68       1.0  T
   4     -7.1926547 -0.169110E+00  0.521E-01    0.97       1.0  T
   5     -7.1932764 -0.621732E-03  0.260E-01    1.03       1.0  T
   6     -7.1933080 -0.315530E-04  0.101E-01    1.03       1.0  T
   7     -7.1933354 -0.274013E-04  0.148E-02    1.05       3.0  T
   8     -7.1933355 -0.116107E-06  0.143E-02    1.05       3.1  T
   9     -7.1933359 -0.359952E-06  0.106E-02    1.05       4.2  T
  10     -7.1933364 -0.516653E-06  0.822E-04    1.05      54.4  T
  11     -7.1933364 -0.328639E-08  0.345E-04    1.05     129.8  T

   *** convergence criteria satisfied after 11 iterations ***

         #    Occupation            Energy/Eh            Energy/eV
      -------------------------------------------------------------
         1        2.0000           -0.6682972             -18.1853
         2        2.0000           -0.5663277             -15.4106
         3        2.0000           -0.5633877             -15.3306
         4        2.0000           -0.5145048             -14.0004
         5        2.0000           -0.4409616             -11.9992
         6        2.0000           -0.4309036             -11.7255
         7        2.0000           -0.3997365             -10.8774 (HOMO)
         8                         -0.3612572              -9.8303 (LUMO)
         9                         -0.3002721              -8.1708
        10                         -0.0838934              -2.2829
        11                          0.0921280               2.5069
        12                          0.1561166               4.2481
       ...                                ...                  ...
        14                          0.1944662               5.2917
      -------------------------------------------------------------
                  HL-Gap            0.0384793 Eh            1.0471 eV
             Fermi-level           -0.3804969 Eh          -10.3538 eV

 SCC (total)                   0 d,  0 h,  0 min,  0.003 sec
 SCC setup                      ...        0 min,  0.000 sec (  3.305%)
 Dispersion                     ...        0 min,  0.000 sec (  0.546%)
 integral evaluation            ...        0 min,  0.001 sec ( 27.260%)
 zeroth order Hamiltonian       ...        0 min,  0.000 sec (  0.556%)
 iterations                     ...        0 min,  0.001 sec ( 37.947%)
 molecular gradient             ...        0 min,  0.001 sec ( 28.089%)
 printout                       ...        0 min,  0.000 sec (  1.930%)

         :::::::::::::::::::::::::::::::::::::::::::::::::::::
         ::                     SUMMARY                     ::
         :::::::::::::::::::::::::::::::::::::::::::::::::::::
         :: total energy              -7.120548505306 Eh    ::
         :: gradient norm              0.199959136704 Eh/a0 ::
         :: HOMO-LUMO gap              1.047073989836 eV    ::
         ::.................................................::
         :: SCC energy                -7.193336389157 Eh    ::
         :: -> isotropic ES           -0.007997279597 Eh    ::
         :: -> anisotropic ES          0.000559875541 Eh    ::
         :: -> anisotropic XC          0.008889186920 Eh    ::
         :: -> dispersion             -0.001575174848 Eh    ::
         :: repulsion energy           0.072787859979 Eh    ::
         :: add. restraining           0.000000000000 Eh    ::
         :::::::::::::::::::::::::::::::::::::::::::::::::::::

      ----------------------------------------------------------- 
     |                   =====================                   |
     |                        A N C O P T                        |
     |                   =====================                   |
     |               Approximate Normal Coordinate               |
     |                Rational Function Optimizer                |
      ----------------------------------------------------------- 

          ...................................................
          :                      SETUP                      :
          :.................................................:
          :   optimization level            normal          :
          :   max. optcycles                   200          :
          :   ANC micro-cycles                  20          :
          :   degrees of freedom                 9          :
          :.................................................:
          :   RF solver                   davidson          :
          :   write xtbopt.log                true          :
          :   linear?                        false          :
          :   energy convergence         0.5000000E-05 Eh   :
          :   grad. convergence          0.1000000E-02 Eh/α :
          :   maximium RF displ.         1.0000000          :
          :   Hlow (freq-cutoff)         0.1000000E-01      :
          :   Hmax (freq-cutoff)         5.0000000          :
          :   S6 in model hess.         20.0000000          :
          ...................................................

generating ANC from model Hessian ...
Using Lindh-Hessian (1995)
 Shifting diagonal of input Hessian by    0.0000000000000000     
 Lowest  eigenvalues of input Hessian
   -0.000000   -0.000000   -0.000000   -0.000000    0.000000    0.000000
    0.032234    0.057218    0.106813    0.141909    0.635227    0.645874
    0.794104    0.918007    1.327576
 Highest eigenvalues
    0.141909    0.635227    0.645874    0.794104    0.918007    1.327576


........................................................................
.............................. CYCLE    1 ..............................
........................................................................
   1     -7.1933364 -0.719334E+01  0.152E-05    1.05       0.0  T
   2     -7.1933364 -0.381917E-13  0.988E-06    1.05    4526.5  T
   3     -7.1933364  0.399680E-13  0.399E-06    1.05   11207.5  T
     SCC iter.                  ...        0 min,  0.000 sec
     gradient                   ...        0 min,  0.001 sec
 * total energy  :    -7.1205485 Eh     change        0.2448013E-08 Eh
   gradient norm :     0.1999566 Eh/α   predicted     0.0000000E+00 (-100.00%)
   displ. norm   :     0.4790175 α      lambda       -0.6627139E-01
   maximum displ.:     0.4115815 α      in ANC's #3, #1, #5, ...

........................................................................
.............................. CYCLE    2 ..............................
........................................................................
   1     -7.2706200 -0.727062E+01  0.144E+00    1.86       0.0  T
   2     -7.2705748  0.451843E-04  0.886E-01    1.80       1.0  T
   3     -7.2679201  0.265476E-02  0.668E-01    1.99       1.0  T
   4     -7.2707937 -0.287360E-02  0.532E-02    1.85       1.0  T
   5     -7.2707931  0.538408E-06  0.198E-02    1.86       2.3  T
   6     -7.2707942 -0.102011E-05  0.317E-03    1.85      14.1  T
   7     -7.2707942 -0.448834E-08  0.155E-03    1.85      28.8  T
   8     -7.2707942 -0.830039E-09  0.570E-04    1.85      78.4  T
   9     -7.2707942 -0.164070E-08  0.120E-04    1.85     372.4  T
     SCC iter.                  ...        0 min,  0.001 sec
     gradient                   ...        0 min,  0.001 sec
 * total energy  :    -7.1757291 Eh     change       -0.5518057E-01 Eh
   gradient norm :     0.1372350 Eh/α   predicted    -0.4073895E-01 ( -26.17%)
   displ. norm   :     0.5697125 α      lambda       -0.6081447E-01
   maximum displ.:     0.4036126 α      in ANC's #3, #1, #5, ...

........................................................................
.............................. CYCLE    3 ..............................
........................................................................
   1     -7.3527159 -0.735272E+01  0.152E+00    3.24       0.0  T
   2     -7.3527958 -0.799089E-04  0.938E-01    3.09       1.0  T
   3     -7.3509462  0.184960E-02  0.671E-01    3.35       1.0  T
   4     -7.3532678 -0.232153E-02  0.621E-02    3.18       1.0  T
   5     -7.3532683 -0.589122E-06  0.244E-02    3.18       1.8  T
   6     -7.3532689 -0.566236E-06  0.374E-03    3.17      12.0  T
   7     -7.3532689 -0.291172E-07  0.145E-03    3.18      30.9  T
   8     -7.3532689 -0.233366E-08  0.130E-04    3.18     344.7  T
   9     -7.3532689 -0.376108E-10  0.564E-05    3.17     793.3  T
     SCC iter.                  ...        0 min,  0.001 sec
     gradient                   ...        0 min,  0.001 sec
 * total energy  :    -7.2138521 Eh     change       -0.3812304E-01 Eh
   gradient norm :     0.1205899 Eh/α   predicted    -0.4027658E-01 (   5.65%)
   displ. norm   :     0.4248801 α      lambda       -0.2480976E-01
   maximum displ.:     0.3080716 α      in ANC's #3, #1, #7, ...

........................................................................
.............................. CYCLE    4 ..............................
........................................................................
   1     -7.3517828 -0.735178E+01  0.734E-01    3.39       0.0  T
   2     -7.3517908 -0.794881E-05  0.455E-01    3.44       1.0  T
   3     -7.3515098  0.280993E-03  0.229E-01    3.36       1.0  T
   4     -7.3518223 -0.312509E-03  0.199E-02    3.43       2.2  T
   5     -7.3518223 -0.164504E-07  0.224E-03    3.43      19.9  T
   6     -7.3518223 -0.258249E-08  0.722E-04    3.43      61.9  T
   7     -7.3518223 -0.605080E-09  0.296E-04    3.43     150.9  T
     SCC iter.                  ...        0 min,  0.001 sec
     gradient                   ...        0 min,  0.001 sec
 * total energy  :    -7.2304924 Eh     change       -0.1664024E-01 Eh
   gradient norm :     0.0708287 Eh/α   predicted    -0.1464425E-01 ( -11.99%)
   displ. norm   :     0.3095096 α      lambda       -0.1674081E-01
   maximum displ.:     0.2651603 α      in ANC's #7, #3, #5, ...

........................................................................
.............................. CYCLE    5 ..............................
........................................................................
   1     -7.3742770 -0.737428E+01  0.649E-01    3.56       0.0  T
   2     -7.3743154 -0.383927E-04  0.417E-01    3.51       1.0  T
   3     -7.3740674  0.248031E-03  0.221E-01    3.60       1.0  T
   4     -7.3743517 -0.284278E-03  0.273E-02    3.53       1.6  T
   5     -7.3743525 -0.871654E-06  0.938E-03    3.54       4.8  T
   6     -7.3743526 -0.308205E-07  0.733E-04    3.54      61.0  T
   7     -7.3743526 -0.104936E-09  0.447E-04    3.54     100.2  T
     SCC iter.                  ...        0 min,  0.001 sec
     gradient                   ...        0 min,  0.001 sec
 * total energy  :    -7.2406728 Eh     change       -0.1018049E-01 Eh
   gradient norm :     0.0239780 Eh/α   predicted    -0.9172258E-02 (  -9.90%)
   displ. norm   :     0.3507059 α      lambda       -0.5552527E-02
   maximum displ.:     0.2923275 α      in ANC's #1, #7, #5, ...

........................................................................
.............................. CYCLE    6 ..............................
........................................................................
   1     -7.3785640 -0.737856E+01  0.689E-01    3.59       0.0  T
   2     -7.3789462 -0.382186E-03  0.425E-01    3.30       1.0  T
   3     -7.3796244 -0.678201E-03  0.255E-01    3.46       1.0  T
   4     -7.3796940 -0.695635E-04  0.194E-02    3.42       2.3  T
   5     -7.3796943 -0.344076E-06  0.607E-03    3.42       7.4  T
   6     -7.3796944 -0.525158E-07  0.141E-03    3.42      31.7  T
   7     -7.3796944 -0.223171E-08  0.412E-04    3.42     108.6  T
   8     -7.3796944 -0.887388E-10  0.266E-05    3.42    1681.7  T
     SCC iter.                  ...        0 min,  0.000 sec
     gradient                   ...        0 min,  0.001 sec
 * total energy  :    -7.2420316 Eh     change       -0.1358801E-02 Eh
   gradient norm :     0.0478470 Eh/α   predicted    -0.3117721E-02 ( 129.45%)
   displ. norm   :     0.1099331 α      lambda       -0.2415899E-02
   maximum displ.:     0.1066361 α      in ANC's #1, #5, #9, ...

........................................................................
.............................. CYCLE    7 ..............................
........................................................................
   1     -7.3820664 -0.738207E+01  0.317E-01    3.48       0.0  T
   2     -7.3821180 -0.515962E-04  0.183E-01    3.59       1.0  T
   3     -7.3822116 -0.935578E-04  0.136E-01    3.52       1.0  T
   4     -7.3822421 -0.305217E-04  0.105E-02    3.55       4.3  T
   5     -7.3822422 -0.697543E-07  0.452E-03    3.55       9.9  T
   6     -7.3822422 -0.143914E-07  0.812E-04    3.55      55.1  T
   7     -7.3822422 -0.494272E-09  0.162E-04    3.55     275.5  T
     SCC iter.                  ...        0 min,  0.000 sec
     gradient                   ...        0 min,  0.001 sec
 * total energy  :    -7.2432412 Eh     change       -0.1209600E-02 Eh
   gradient norm :     0.0062409 Eh/α   predicted    -0.1222547E-02 (   1.07%)
   displ. norm   :     0.0364235 α      lambda       -0.1512035E-03
   maximum displ.:     0.0263873 α      in ANC's #1, #3, #5, ...

........................................................................
.............................. CYCLE    8 ..............................
........................................................................
   1     -7.3845582 -0.738456E+01  0.977E-02    3.53       0.0  T
   2     -7.3845644 -0.626470E-05  0.666E-02    3.49       1.0  T
   3     -7.3845766 -0.121963E-04  0.387E-02    3.51       1.2  T
   4     -7.3845782 -0.160975E-05  0.422E-03    3.50      10.6  T
   5     -7.3845783 -0.134594E-07  0.144E-03    3.50      31.1  T
   6     -7.3845783 -0.745473E-09  0.306E-04    3.50     145.9  T
   7     -7.3845783 -0.106835E-09  0.816E-05    3.50     548.4  T
     SCC iter.                  ...        0 min,  0.000 sec
     gradient                   ...        0 min,  0.001 sec
 * total energy  :    -7.2433225 Eh     change       -0.8124240E-04 Eh
   gradient norm :     0.0070418 Eh/α   predicted    -0.7570351E-04 (  -6.82%)
   displ. norm   :     0.0510576 α      lambda       -0.1436871E-03
   maximum displ.:     0.0441489 α      in ANC's #1, #5, #7, ...

........................................................................
.............................. CYCLE    9 ..............................
........................................................................
   1     -7.3836714 -0.738367E+01  0.916E-02    3.54       0.0  T
   2     -7.3836730 -0.159229E-05  0.568E-02    3.52       1.0  T
   3     -7.3836723  0.686635E-06  0.385E-02    3.54       1.2  T
   4     -7.3836768 -0.444540E-05  0.198E-03    3.53      22.6  T
   5     -7.3836768 -0.274837E-08  0.759E-04    3.53      58.9  T
   6     -7.3836768 -0.302689E-09  0.140E-04    3.53     320.3  T
     SCC iter.                  ...        0 min,  0.000 sec
     gradient                   ...        0 min,  0.001 sec
 * total energy  :    -7.2434006 Eh     change       -0.7813619E-04 Eh
   gradient norm :     0.0023647 Eh/α   predicted    -0.7203192E-04 (  -7.81%)
   displ. norm   :     0.0140381 α      lambda       -0.2005484E-04
   maximum displ.:     0.0095975 α      in ANC's #7, #3, #1, ...

........................................................................
.............................. CYCLE   10 ..............................
........................................................................
   1     -7.3834218 -0.738342E+01  0.353E-02    3.54       0.0  T
   2     -7.3834218 -0.217891E-07  0.218E-02    3.54       2.1  T
   3     -7.3834217  0.388877E-07  0.342E-03    3.54      13.1  T
   4     -7.3834218 -0.557127E-07  0.112E-03    3.54      39.8  T
   5     -7.3834218 -0.162972E-09  0.175E-04    3.54     255.4  T
   6     -7.3834218 -0.242437E-10  0.422E-05    3.54    1061.0  T
     SCC iter.                  ...        0 min,  0.000 sec
     gradient                   ...        0 min,  0.001 sec
 * total energy  :    -7.2434133 Eh     change       -0.1269763E-04 Eh
   gradient norm :     0.0006265 Eh/α   predicted    -0.1002898E-04 ( -21.02%)
   displ. norm   :     0.0077013 α      lambda       -0.2147226E-05
   maximum displ.:     0.0065273 α      in ANC's #7, #3, #9, ...

........................................................................
.............................. CYCLE   11 ..............................
........................................................................
   1     -7.3832655 -0.738327E+01  0.190E-02    3.54       0.0  T
   2     -7.3832655 -0.330180E-07  0.118E-02    3.55       3.8  T
   3     -7.3832653  0.180714E-06  0.795E-03    3.54       5.6  T
   4     -7.3832656 -0.253859E-06  0.624E-04    3.55      71.7  T
   5     -7.3832656 -0.522613E-10  0.726E-05    3.55     616.3  T
     SCC iter.                  ...        0 min,  0.000 sec
     gradient                   ...        0 min,  0.001 sec
 * total energy  :    -7.2434141 Eh     change       -0.7881230E-06 Eh
   gradient norm :     0.0003271 Eh/α   predicted    -0.1073664E-05 (  36.23%)
   displ. norm   :     0.0026096 α      lambda       -0.3724962E-06
   maximum displ.:     0.0021678 α      in ANC's #7, #3, #9, ...

   *** GEOMETRY OPTIMIZATION CONVERGED AFTER 11 ITERATIONS ***

------------------------------------------------------------------------
 total energy gain   :        -0.1228656 Eh      -77.0993 kcal/mol
 total RMSD          :         0.8575908 a0        0.4538 Å
 total power (kW/mol):       -29.3257824 (step)********** (real)
------------------------------------------------------------------------

 ANCopt (total)                0 d,  0 h,  0 min,  0.023 sec
 optimizer setup                ...        0 min,  0.000 sec (  0.289%)
 model hessian                  ...        0 min,  0.000 sec (  0.423%)
 ANC generation                 ...        0 min,  0.000 sec (  0.235%)
 coordinate transformation      ...        0 min,  0.000 sec (  0.108%)
 single point calculation       ...        0 min,  0.021 sec ( 95.013%)
 optimization log               ...        0 min,  0.000 sec (  1.216%)
 hessian update                 ...        0 min,  0.000 sec (  0.108%)
 rational function              ...        0 min,  0.000 sec (  1.049%)

================
 final structure:
================
5
 xtb: 6.2.2 (9d81278992624c895f80dd42a50cac0aa55982e2)
C        -0.67110336272253   -0.01804465704551   -0.01593550389234
C         0.67123937973017   -0.00690585522645    0.01872290471888
C        -0.00860958709527    1.24264326077151   -0.06585935739118
H        -1.54721401304017   -0.62172146580671   -0.00851983568961
H         1.55568758312780   -0.59597228269284    0.07159079225425

 Bond Distances (Angstroems)
 ---------------------------
C1-C2=1.3428         C1-C3=1.4250         C1-H4=1.0640         C2-C1=1.3428         C2-C3=1.4250         C2-H5=1.0640         
C3-C1=1.4250         C3-C2=1.4250         H4-C1=1.0640         H5-C2=1.0640         
 C  H  Rav=1.0640 sigma=0.0000  Rmin=1.0640  Rmax=1.0640     2
 C  C  Rav=1.3976 sigma=0.0387  Rmin=1.3428  Rmax=1.4250     3

 selected bond angles (degree)
 --------------------
C3-C1-C2= 61.89                H4-C1-C2=145.86                H4-C1-C3=152.25                C3-C2-C1= 61.89                
H5-C2-C1=145.86                H5-C2-C3=152.25                C2-C3-C1= 56.22                

 selected dihedral angles (degree)
 ---------------------------------
C3-C2-C1-H4=179.83            H5-C2-C1-C3=180.17            H5-C2-C1-H4=  0.00            C2-C3-C1-H4=180.21            
C1-C3-C2-H5=179.79            
           -------------------------------------------------
          |                Final Singlepoint                |
           -------------------------------------------------

          ...................................................
          :                      SETUP                      :
          :.................................................:
          :  # basis functions                  14          :
          :  # atomic orbitals                  14          :
          :  # shells                            8          :
          :  # electrons                        14          :
          :  max. iterations                   250          :
          :  Hamiltonian                  GFN2-xTB          :
          :  restarted?                      false          :
          :  GBSA solvation                  false          :
          :  PC potential                    false          :
          :  electronic temp.          300.0000000     K    :
          :  accuracy                    1.0000000          :
          :  -> integral cutoff          0.2500000E+02      :
          :  -> integral neglect         0.1000000E-07      :
          :  -> SCF convergence          0.1000000E-05 Eh   :
          :  -> wf. convergence          0.1000000E-03 e    :
          :  Broyden damping             0.4000000          :
          ...................................................

 iter      E             dE          RMSdq      gap      omega  full diag
   1     -7.3832656 -0.738327E+01  0.217E-05    3.55       0.0  T
   2     -7.3832656 -0.169642E-12  0.147E-05    3.55    3045.2  T
   3     -7.3832656 -0.371259E-12  0.102E-05    3.55    4392.7  T

   *** convergence criteria satisfied after 3 iterations ***

         #    Occupation            Energy/Eh            Energy/eV
      -------------------------------------------------------------
         1        2.0000           -0.6751468             -18.3717
         2        2.0000           -0.5768030             -15.6956
         3        2.0000           -0.5690623             -15.4850
         4        2.0000           -0.4959846             -13.4964
         5        2.0000           -0.4875916             -13.2680
         6        2.0000           -0.4388594             -11.9420
         7        2.0000           -0.3856757             -10.4948 (HOMO)
         8                         -0.2553771              -6.9492 (LUMO)
         9                         -0.2508468              -6.8259
        10                         -0.0115463              -0.3142
        11                          0.0987045               2.6859
        12                          0.1307955               3.5591
       ...                                ...                  ...
        14                          0.7348311              19.9958
      -------------------------------------------------------------
                  HL-Gap            0.1302987 Eh            3.5456 eV
             Fermi-level           -0.3205264 Eh           -8.7220 eV

 SCC (total)                   0 d,  0 h,  0 min,  0.002 sec
 SCC setup                      ...        0 min,  0.000 sec (  3.076%)
 Dispersion                     ...        0 min,  0.000 sec (  0.765%)
 integral evaluation            ...        0 min,  0.001 sec ( 38.761%)
 zeroth order Hamiltonian       ...        0 min,  0.000 sec (  0.529%)
 iterations                     ...        0 min,  0.000 sec ( 14.085%)
 molecular gradient             ...        0 min,  0.001 sec ( 39.805%)
 printout                       ...        0 min,  0.000 sec (  2.450%)

         :::::::::::::::::::::::::::::::::::::::::::::::::::::
         ::                     SUMMARY                     ::
         :::::::::::::::::::::::::::::::::::::::::::::::::::::
         :: total energy              -7.243414113939 Eh    ::
         :: gradient norm              0.000347349951 Eh/a0 ::
         :: HOMO-LUMO gap              3.545606771411 eV    ::
         ::.................................................::
         :: SCC energy                -7.383265569780 Eh    ::
         :: -> isotropic ES           -0.004576981091 Eh    ::
         :: -> anisotropic ES         -0.001257982718 Eh    ::
         :: -> anisotropic XC          0.010298325006 Eh    ::
         :: -> dispersion             -0.001592463662 Eh    ::
         :: repulsion energy           0.139851418905 Eh    ::
         :: add. restraining           0.000000000000 Eh    ::
         :::::::::::::::::::::::::::::::::::::::::::::::::::::

           ------------------------------------------------- 
          |                Numerical Hessian                |
           ------------------------------------------------- 
step length          :   0.00500
SCC accuracy         :   0.30000
Hessian scale factor :   1.00000
frozen atoms in %    :   0.00000    0
RMS gradient         :   0.00035
estimated CPU  time      0.00 min
estimated wall time      0.00 min

writing file <hessian>.

 projected vibrational frequencies (cm-1)
eigval :       -0.00    -0.00    -0.00    -0.00     0.00     0.00
eigval :      781.20   822.56   859.95   883.34  1066.54  1265.49
eigval :     1693.98  3208.77  3228.92
           -------------------------------------------------
          |                Property Printout                |
           -------------------------------------------------

    * Orbital Energies and Occupations

         #    Occupation            Energy/Eh            Energy/eV
      -------------------------------------------------------------
         1        2.0000           -0.6751468             -18.3717
         2        2.0000           -0.5768030             -15.6956
         3        2.0000           -0.5690623             -15.4850
         4        2.0000           -0.4959846             -13.4964
         5        2.0000           -0.4875916             -13.2680
         6        2.0000           -0.4388594             -11.9420
         7        2.0000           -0.3856758             -10.4948 (HOMO)
         8                         -0.2553771              -6.9492 (LUMO)
         9                         -0.2508468              -6.8259
        10                         -0.0115463              -0.3142
        11                          0.0987045               2.6859
        12                          0.1307955               3.5591
        13                          0.4638461              12.6219
        14                          0.7348311              19.9958
      -------------------------------------------------------------
                  HL-Gap            0.1302987 Eh            3.5456 eV
             Fermi-level           -0.3205264 Eh           -8.7220 eV

     #   Z        covCN         q      C6AA      α(0)
     1   6 C      2.887     0.028    27.366     8.577
     2   6 C      2.887     0.028    27.366     8.577
     3   6 C      1.959    -0.169    35.922     9.679
     4   1 H      0.927     0.056     2.243     2.342
     5   1 H      0.927     0.056     2.243     2.342

 Mol. C6AA /au·bohr⁶  :        378.233556
 Mol. C8AA /au·bohr⁸  :       9781.257455
 Mol. α(0) /au        :         31.516098


Wiberg/Mayer (AO) data.
largest (>0.10) Wiberg bond orders for each atom
          total WBO             WBO to atom ...
     1  C   3.871        C    2 1.611    C    3 1.287    H    4 0.963
Molecule has the following symmetry elements: (C2) 2*(sigma) 
It seems to be the C2v point group
     2  C   3.871        C    1 1.611    C    3 1.287    H    5 0.963
     3  C   2.620        C    2 1.287    C    1 1.287
     4  H   0.997        C    1 0.963
     5  H   0.997        C    2 0.963

MOs/occ written to file <molden.input>


molecular dipole:
                 x           y           z       tot (Debye)
 q only:        0.004      -0.528       0.028
   full:        0.009      -1.255       0.066       3.195
molecular quadrupole (traceless):
                xx          xy          yy          xz          yz          zz
 q only:        1.451       0.021      -1.313       0.041       0.063      -0.138
  q+dip:        4.254       0.061      -3.627       0.125       0.162      -0.627
   full:        2.924       0.055      -4.791       0.024       0.356       1.867

           -------------------------------------------------
          |                Geometry Summary                 |
           -------------------------------------------------

      molecular mass/u    :       38.0480892
   center of mass at/Å    :       -0.0024486       0.3521339      -0.0182399
  moments of inertia/u·Å² :        0.1462183E+02   0.1568474E+02   0.3030655E+02
rotational constants/cm⁻¹ :        0.1152909E+01   0.1074780E+01   0.5562372E+00

 * 3 selected distances

     #   Z        #   Z                                     value/Å
     1   6 C      2   6 C                                 1.3428363 (max)
     1   6 C      4   1 H                                 1.0639786
     2   6 C      5   1 H                                 1.0639750 (min)

 * 2 distinct bonds (by element types)

   Z      Z             #   av. dist./Å        max./Å        min./Å
   1 H    6 C           2     1.0639768     1.0639786     1.0639750
   6 C    6 C           1     1.3428363     1.3428363     1.3428363

           -------------------------------------------------
          |               Frequency Printout                |
           -------------------------------------------------
 projected vibrational frequencies (cm-1)
eigval :       -0.00    -0.00    -0.00    -0.00     0.00     0.00
eigval :      781.20   822.56   859.95   883.34  1066.54  1265.49
eigval :     1693.98  3208.77  3228.92
 reduced masses (amu)
   1: 10.06   2: 11.06   3: 10.83   4:  9.49   5: 10.74   6: 10.89   7:  3.00   8:  4.41
   9:  4.03  10:  1.41  11: 11.16  12: 11.99  13: 10.97  14:  1.85  15:  2.25
 IR intensities (amu)
   1:  0.05   2:  0.03   3:  0.38   4:  0.16   5:  0.28   6:  0.10   7:  0.02   8:  0.00
   9:  0.01  10:  0.07  11:  0.30  12:  0.33  13:  0.14  14:  0.17  15:  0.13
 Raman intensities (amu)
   1:  0.00   2:  0.00   3:  0.00   4:  0.00   5:  0.00   6:  0.00   7:  0.00   8:  0.00
   9:  0.00  10:  0.00  11:  0.00  12:  0.00  13:  0.00  14:  0.00  15:  0.00
 output can be read by thermo (or use thermo option).
 writing <g98.out> molden fake output.
 recommended (thermochemical) frequency scaling factor: 1.0
           -------------------------------------------------
          |             Thermodynamic Functions             |
           -------------------------------------------------

c2v symmetry found (for desy threshold:  0.10E+00) used in thermo

          ...................................................
          :                      SETUP                      :
          :.................................................:
          :  # frequencies                           9      :
          :  # imaginary freq.                       0      :
          :  linear?                             false      :
          :  only rotor calc.                    false      :
          :  symmetry                              c2v      :
          :  rotational number                       2      :
          :  scaling factor                  1.0000000      :
          :  rotor cutoff                   50.0000000 cm⁻¹ :
          :  imag. cutoff                  -20.0000000 cm⁻¹ :
          :.................................................:

    mode    ω/cm⁻¹     T·S(HO)/kcal·mol⁻¹    T·S(FR)/kcal·mol⁻¹   T·S(vib)
   ------------------------------------------------------------------------
   ------------------------------------------------------------------------

   temp. (K)  partition function   enthalpy   heat capacity  entropy
                                   cal/mol     cal/K/mol   cal/K/mol   J/K/mol
 298.15  VIB   1.08                  200.744      2.890      0.834
         ROT  0.318E+04              888.752      2.981     19.010
         INT  0.345E+04             1089.496      5.871     19.844
         TR   0.227E+27             1481.254      4.968     36.821
         TOT                        2570.7500    10.8391    56.6650   237.0862

   temp. (K)  partition function   enthalpy   heat capacity  entropy
                                   cal/mol     cal/K/mol   cal/K/mol   J/K/mol
 120.00  VIB   1.00                    0.468      0.039      0.004
         ROT   813.                  357.707      2.981     16.297
         INT   813.                  358.175      3.020     16.301
         TR   0.580E+26              596.178      4.968     32.302
         TOT                         954.3532     7.9877    48.6031   203.3552

   temp. (K)  partition function   enthalpy   heat capacity  entropy
                                   cal/mol     cal/K/mol   cal/K/mol   J/K/mol
 100.00  VIB   1.00                    0.065      0.008      0.001
         ROT   619.                  298.089      2.981     15.754
         INT   619.                  298.154      2.989     15.754
         TR   0.441E+26              496.815      4.968     31.396
         TOT                         794.9691     7.9567    47.1506   197.2782

   temp. (K)  partition function   enthalpy   heat capacity  entropy
                                   cal/mol     cal/K/mol   cal/K/mol   J/K/mol
  80.00  VIB   1.00                    0.003      0.001      0.000
         ROT   443.                  238.471      2.981     15.089
         INT   443.                  238.475      2.982     15.089
         TR   0.316E+26              397.452      4.968     30.288
         TOT                         635.9267     7.9497    45.3767   189.8562

   temp. (K)  partition function   enthalpy   heat capacity  entropy
                                   cal/mol     cal/K/mol   cal/K/mol   J/K/mol
  60.00  VIB   1.00                    0.000      0.000     -0.000
         ROT   287.                  178.853      2.981     14.231
         INT   287.                  178.853      2.981     14.231
         TR   0.205E+26              298.089      4.968     28.860
         TOT                         476.9424     7.9490    43.0906   180.2909

   temp. (K)  partition function   enthalpy   heat capacity  entropy
                                   cal/mol     cal/K/mol   cal/K/mol   J/K/mol
  40.00  VIB   1.00                    0.000      0.000     -0.000
         ROT   156.                  119.236      2.981     13.022
         INT   156.                  119.236      2.981     13.022
         TR   0.112E+26              198.726      4.968     26.846
         TOT                         317.9616     7.9490    39.8685   166.8096

   temp. (K)  partition function   enthalpy   heat capacity  entropy
                                   cal/mol     cal/K/mol   cal/K/mol   J/K/mol
  20.00  VIB   1.00                    0.000      0.000     -0.000
         ROT   55.3                   59.618      2.981     10.956
         INT   55.3                   59.618      2.981     10.956
         TR   0.395E+25               99.363      4.968     23.404
         TOT                         158.9808     7.9490    34.3602   143.7632

   temp. (K)  partition function   enthalpy   heat capacity  entropy
                                   cal/mol     cal/K/mol   cal/K/mol   J/K/mol
  10.00  VIB   1.00                    0.000      0.000     -0.000
         ROT   19.6                   29.809      2.981      8.890
         INT   19.6                   29.809      2.981      8.890
         TR   0.139E+25               49.681      4.968     19.962
         TOT                          79.4904     7.9490    28.8520   120.7169

       T/K    H(0)-H(T)+PV         H(T)/Eh          T*S/Eh         G(T)/Eh
   ------------------------------------------------------------------------
    298.15    0.409675E-02    0.355599E-01    0.269234E-01    0.863658E-02
    120.00    0.152086E-02    0.329840E-01    0.929447E-02    0.236896E-01
    100.00    0.126686E-02    0.327300E-01    0.751393E-02    0.252161E-01
     80.00    0.101341E-02    0.324766E-01    0.578499E-02    0.266916E-01
     60.00    0.760056E-03    0.322232E-01    0.412015E-02    0.281031E-01
     40.00    0.506704E-03    0.319699E-01    0.254138E-02    0.294285E-01
     20.00    0.253352E-03    0.317165E-01    0.109513E-02    0.306214E-01
     10.00    0.126676E-03    0.315899E-01    0.459786E-03    0.311301E-01 (used)
   ------------------------------------------------------------------------

         :::::::::::::::::::::::::::::::::::::::::::::::::::::
         ::                  THERMODYNAMIC                  ::
         :::::::::::::::::::::::::::::::::::::::::::::::::::::
         :: total free energy          -7.212284045539 Eh   ::
         ::.................................................::
         :: total energy               -7.243414113960 Eh   ::
         :: zero point energy           0.031463178672 Eh   ::
         :: G(RRHO) w/o ZPVE           -0.000333110251 Eh   ::
         :: G(RRHO) contrib.            0.031130068421 Eh   ::
         :::::::::::::::::::::::::::::::::::::::::::::::::::::

optimized geometry written to: xtbopt.xyz


           -------------------------------------------------
          | TOTAL ENERGY               -7.243414113960 Eh   |
          | TOTAL ENTHALPY             -7.211824259272 Eh   |
          | TOTAL FREE ENERGY          -7.212284045539 Eh   |
          | GRADIENT NORM               0.000347270135 Eh/α |
          | HOMO-LUMO GAP               3.545607426667 eV   |
           -------------------------------------------------

------------------------------------------------------------------------
 * finished run on 2020/05/12 at 11:44:27.276     
------------------------------------------------------------------------
 total:
 * wall-time:     0 d,  0 h,  0 min,  0.100 sec
 *  cpu-time:     0 d,  0 h,  0 min,  0.100 sec
 * ratio c/w:     0.998 speedup
 SCF:
 * wall-time:     0 d,  0 h,  0 min,  0.003 sec
 *  cpu-time:     0 d,  0 h,  0 min,  0.003 sec
 * ratio c/w:     1.000 speedup
 ANC optimizer:
 * wall-time:     0 d,  0 h,  0 min,  0.025 sec
 *  cpu-time:     0 d,  0 h,  0 min,  0.025 sec
 * ratio c/w:     0.998 speedup
 numerical hessian:
 * wall-time:     0 d,  0 h,  0 min,  0.055 sec
 *  cpu-time:     0 d,  0 h,  0 min,  0.055 sec
 * ratio c/w:     0.998 speedup

