      -----------------------------------------------------------      
     |                   =====================                   |     
     |                           x T B                           |     
     |                   =====================                   |     
     |                         S. Grimme                         |     
     |          Mulliken Center for Theoretical Chemistry        |     
     |                    University of Bonn                     |     
      -----------------------------------------------------------      

   * xtb version 6.2.2 (9d81278992624c895f80dd42a50cac0aa55982e2) compiled by '@Darwin' on 04/03/2020

   xtb is free software: you can redistribute it and/or modify it under
   the terms of the GNU Lesser General Public License as published by
   the Free Software Foundation, either version 3 of the License, or
   (at your option) any later version.
   
   xtb is distributed in the hope that it will be useful,
   but WITHOUT ANY WARRANTY; without even the implied warranty of
   MERCHANTABILITY or FITNESS FOR A PARTICULAR PURPOSE.  See the
   GNU Lesser General Public License for more details.
   
   Cite this work as:
   * S. Grimme, C. Bannwarth, P. Shushkov, J. Chem. Theory Comput., 2017,
     13, 1989-2009. DOI: 10.1021/acs.jctc.7b00118
   * C. Bannwarth, S. Ehlert and S. Grimme., J. Chem. Theory Comput., 2019,
     15, 1652-1671. DOI: 10.1021/acs.jctc.8b01176
   * P. Pracht, E. Caldeweyher, S. Ehlert, S. Grimme, ChemRxiv, 2019, preprint.
     DOI: 10.26434/chemrxiv.8326202.v1
   
   for DFT-D4:
   * E. Caldeweyher, C. Bannwarth and S. Grimme, J. Chem. Phys., 2017,
     147, 034112. DOI: 10.1063/1.4993215
   * E. Caldeweyher, S. Ehlert, A. Hansen, H. Neugebauer, S. Spicher,
     C. Bannwarth and S. Grimme, J. Chem. Phys., 2019, 150, 154122.
     DOI: 10.1063/1.5090222
   
   for sTDA-xTB:
   * S. Grimme and C. Bannwarth, J. Chem. Phys., 2016, 145, 054103.
     DOI: 10.1063/1.4959605
   
   in the mass-spec context:
   * V. Asgeirsson, C. Bauer and S. Grimme, Chem. Sci., 2017, 8, 4879.
     DOI: 10.1039/c7sc00601b
   
   for metadynamics refer to:
   * S. Grimme, J. Chem. Theory Comput., 2019, 155, 2847-2862
     DOI: 10.1021/acs.jctc.9b00143
   
   with help from (in alphabetical order)
   C. Bannwarth, F. Bohle, G. Brandenburg, E. Caldeweyher, M. Checinski,
   S. Dohm, S. Ehlert, S. Ehrlich, F. März, H. Neugebauer, J. Pisarek,
   P. Pracht, P. Shushkov, and S. Spicher.
   
 * started run on 2020/05/12 at 11:44:32.663     

           -------------------------------------------------
          |                Calculation Setup                |
           -------------------------------------------------

          program call               : xtb --input C5_4_S_0.input C5_4_S_0.xyz --ohess --molden --namespace C5_4_S_0 output.out
          calculation namespace      : C5_4_S_0
          coordinate file            : C5_4_S_0.xyz
          number of atoms            :                     5
          number of electrons        :                    20
          charge                     :                     0
          spin                       :                   0.0
          first test random number   :      0.18411374473764

   ID    Z sym.   atoms
    1    6 C      1-5

           -------------------------------------------------
          |                 G F N 2 - x T B                 |
           -------------------------------------------------

        Reference                      10.1021/acs.jctc.8b01176
      * Hamiltonian:
        H0-scaling (s, p, d)           1.850000    2.230000    2.230000
        zeta-weighting                 0.500000
      * Dispersion:
        s8                             2.700000
        a1                             0.520000
        a2                             5.000000
        s9                             5.000000
      * Repulsion:
        kExp                           1.500000    1.000000
        rExp                           1.000000
      * Coulomb:
        alpha                          2.000000
        third order                    shell-resolved
        anisotropic                    true
        a3                             3.000000
        a5                             4.000000
        cn-shift                       1.200000
        cn-exp                         4.000000
        max-rad                        5.000000


          ...................................................
          :                      SETUP                      :
          :.................................................:
          :  # basis functions                  20          :
          :  # atomic orbitals                  20          :
          :  # shells                           10          :
          :  # electrons                        20          :
          :  max. iterations                   250          :
          :  Hamiltonian                  GFN2-xTB          :
          :  restarted?                      false          :
          :  GBSA solvation                  false          :
          :  PC potential                    false          :
          :  electronic temp.          300.0000000     K    :
          :  accuracy                    1.0000000          :
          :  -> integral cutoff          0.2500000E+02      :
          :  -> integral neglect         0.1000000E-07      :
          :  -> SCF convergence          0.1000000E-05 Eh   :
          :  -> wf. convergence          0.1000000E-03 e    :
          :  Broyden damping             0.4000000          :
          ...................................................

 iter      E             dE          RMSdq      gap      omega  full diag
   1     -9.9228619 -0.992286E+01  0.135E+01    1.13       0.0  T
   2     -7.1783078  0.274455E+01  0.169E+01    0.83       1.0  T
   3     -7.4725565 -0.294249E+00  0.164E+01    0.20       1.0  T
   4     -9.7281242 -0.225557E+01  0.984E+00    1.41       1.0  T
   5    -10.0924778 -0.364354E+00  0.408E+00    0.78       1.0  T
   6    -10.1364761 -0.439983E-01  0.269E+00    0.77       1.0  T
   7    -10.1367696 -0.293512E-03  0.265E+00    0.77       1.0  T
   8    -10.1441498 -0.738018E-02  0.775E-01    0.69       1.0  T
   9    -10.1470193 -0.286953E-02  0.475E-01    0.69       1.0  T
  10    -10.1473089 -0.289550E-03  0.344E-01    0.69       1.0  T
  11    -10.1476683 -0.359440E-03  0.467E-02    0.67       1.0  T
  12    -10.1476706 -0.225508E-05  0.303E-02    0.67       1.5  T
  13    -10.1476712 -0.623436E-06  0.612E-03    0.67       7.3  T
  14    -10.1476714 -0.235915E-06  0.261E-03    0.67      17.1  T
  15    -10.1476715 -0.149012E-07  0.616E-04    0.67      72.7  T
  16    -10.1476715 -0.250863E-08  0.212E-04    0.67     210.7  T

   *** convergence criteria satisfied after 16 iterations ***

         #    Occupation            Energy/Eh            Energy/eV
      -------------------------------------------------------------
         1        2.0000           -0.7322065             -19.9244
       ...           ...                  ...                  ...
         4        2.0000           -0.5927740             -16.1302
         5        2.0000           -0.5636844             -15.3386
         6        2.0000           -0.5228884             -14.2285
         7        2.0000           -0.5091520             -13.8547
         8        2.0000           -0.4976700             -13.5423
         9        2.0000           -0.4801379             -13.0652
        10        2.0000           -0.4368699             -11.8878 (HOMO)
        11        0.0000           -0.4121395             -11.2149 (LUMO)
        12                         -0.4022952             -10.9470
        13                         -0.3936047             -10.7105
        14                         -0.3627213              -9.8701
        15                         -0.3499928              -9.5238
       ...                                ...                  ...
        20                          0.1314619               3.5773
      -------------------------------------------------------------
                  HL-Gap            0.0247304 Eh            0.6729 eV
             Fermi-level           -0.4245047 Eh          -11.5514 eV

 SCC (total)                   0 d,  0 h,  0 min,  0.005 sec
 SCC setup                      ...        0 min,  0.000 sec (  1.555%)
 Dispersion                     ...        0 min,  0.000 sec (  0.523%)
 integral evaluation            ...        0 min,  0.001 sec ( 27.896%)
 zeroth order Hamiltonian       ...        0 min,  0.000 sec (  0.500%)
 iterations                     ...        0 min,  0.002 sec ( 39.468%)
 molecular gradient             ...        0 min,  0.001 sec ( 27.855%)
 printout                       ...        0 min,  0.000 sec (  1.939%)

         :::::::::::::::::::::::::::::::::::::::::::::::::::::
         ::                     SUMMARY                     ::
         :::::::::::::::::::::::::::::::::::::::::::::::::::::
         :: total energy             -10.076836193950 Eh    ::
         :: gradient norm              0.304976859820 Eh/a0 ::
         :: HOMO-LUMO gap              0.672948304656 eV    ::
         ::.................................................::
         :: SCC energy               -10.147671455596 Eh    ::
         :: -> isotropic ES           -0.039052673104 Eh    ::
         :: -> anisotropic ES         -0.000846586363 Eh    ::
         :: -> anisotropic XC          0.011826888232 Eh    ::
         :: -> dispersion             -0.003159554711 Eh    ::
         :: repulsion energy           0.070835095072 Eh    ::
         :: add. restraining           0.000000000000 Eh    ::
         :::::::::::::::::::::::::::::::::::::::::::::::::::::

      ----------------------------------------------------------- 
     |                   =====================                   |
     |                        A N C O P T                        |
     |                   =====================                   |
     |               Approximate Normal Coordinate               |
     |                Rational Function Optimizer                |
      ----------------------------------------------------------- 

          ...................................................
          :                      SETUP                      :
          :.................................................:
          :   optimization level            normal          :
          :   max. optcycles                   200          :
          :   ANC micro-cycles                  20          :
          :   degrees of freedom                 9          :
          :.................................................:
          :   RF solver                   davidson          :
          :   write xtbopt.log                true          :
          :   linear?                        false          :
          :   energy convergence         0.5000000E-05 Eh   :
          :   grad. convergence          0.1000000E-02 Eh/α :
          :   maximium RF displ.         1.0000000          :
          :   Hlow (freq-cutoff)         0.1000000E-01      :
          :   Hmax (freq-cutoff)         5.0000000          :
          :   S6 in model hess.         20.0000000          :
          ...................................................

generating ANC from model Hessian ...
Using Lindh-Hessian (1995)
 Shifting diagonal of input Hessian by    0.0000000000000000     
 Lowest  eigenvalues of input Hessian
   -0.000000   -0.000000   -0.000000    0.000000    0.000000    0.000000
    0.015772    0.043702    0.087833    0.113144    0.561254    0.625335
    0.807834    0.905019    1.314296
 Highest eigenvalues
    0.113144    0.561254    0.625335    0.807834    0.905019    1.314296


........................................................................
.............................. CYCLE    1 ..............................
........................................................................
   1    -10.1476715 -0.101477E+02  0.647E-05    0.67       0.0  T
   2    -10.1476715  0.115305E-09  0.116E-04    0.67     386.8  T
   3    -10.1476715 -0.685461E-10  0.857E-05    0.67     521.6  T
     SCC iter.                  ...        0 min,  0.001 sec
     gradient                   ...        0 min,  0.001 sec
 * total energy  :   -10.0768362 Eh     change       -0.1237566E-08 Eh
   gradient norm :     0.3049769 Eh/α   predicted     0.0000000E+00 (-100.00%)
   displ. norm   :     0.3992101 α      lambda       -0.1120010E+00
   maximum displ.:     0.2862729 α      in ANC's #7, #5, #3, ...

........................................................................
.............................. CYCLE    2 ..............................
........................................................................
   1    -10.2682553 -0.102683E+02  0.274E+00    0.86       0.0  T
   2    -10.0796632  0.188592E+00  0.500E+00    1.00       1.0  T
   3    -10.2991207 -0.219457E+00  0.126E+00    0.95       1.0  T
   4    -10.2927025  0.641816E-02  0.116E+00    0.85       1.0  T
   5    -10.3013049 -0.860238E-02  0.358E-01    0.91       1.0  T
   6    -10.3022850 -0.980065E-03  0.769E-02    0.91       1.0  T
   7    -10.3022864 -0.140178E-05  0.247E-02    0.91       1.8  T
   8    -10.3022835  0.285186E-05  0.298E-02    0.91       1.5  T
   9    -10.3022916 -0.809481E-05  0.349E-03    0.91      12.8  T
  10    -10.3022916 -0.122710E-07  0.363E-04    0.91     123.1  T
  11    -10.3022916 -0.433195E-09  0.173E-04    0.91     258.3  T
     SCC iter.                  ...        0 min,  0.001 sec
     gradient                   ...        0 min,  0.001 sec
 * total energy  :   -10.1695232 Eh     change       -0.9268702E-01 Eh
   gradient norm :     0.1772080 Eh/α   predicted    -0.6492520E-01 ( -29.95%)
   displ. norm   :     0.5393714 α      lambda       -0.7916941E-01
   maximum displ.:     0.3415138 α      in ANC's #7, #1, #5, ...

........................................................................
.............................. CYCLE    3 ..............................
........................................................................
   1    -10.4487699 -0.104488E+02  0.321E+00    1.25       0.0  T
   2    -10.3681793  0.805907E-01  0.356E+00    1.12       1.0  T
   3    -10.4452688 -0.770895E-01  0.217E+00    1.32       1.0  T
   4    -10.4664183 -0.211496E-01  0.979E-01    1.15       1.0  T
   5    -10.4710525 -0.463419E-02  0.222E-01    1.21       1.0  T
   6    -10.4712396 -0.187043E-03  0.930E-02    1.21       1.0  T
   7    -10.4712631 -0.235077E-04  0.731E-03    1.21       6.1  T
   8    -10.4712623  0.757438E-06  0.930E-03    1.21       4.8  T
   9    -10.4712631 -0.802652E-06  0.140E-03    1.21      32.0  T
  10    -10.4712631 -0.113532E-07  0.525E-04    1.21      85.1  T
  11    -10.4712631 -0.673943E-09  0.851E-05    1.21     525.7  T
     SCC iter.                  ...        0 min,  0.001 sec
     gradient                   ...        0 min,  0.001 sec
 * total energy  :   -10.1986589 Eh     change       -0.2913573E-01 Eh
   gradient norm :     0.1920209 Eh/α   predicted    -0.5110075E-01 (  75.39%)
   displ. norm   :     0.6733954 α      lambda       -0.5687105E-01
   maximum displ.:     0.6152126 α      in ANC's #1, #3, #9, ...

........................................................................
.............................. CYCLE    4 ..............................
........................................................................
   1    -10.3870424 -0.103870E+02  0.225E+00    1.35       0.0  T
   2    -10.3392988  0.477436E-01  0.241E+00    1.33       1.0  T
   3    -10.3732351 -0.339363E-01  0.194E+00    1.34       1.0  T
   4    -10.3944746 -0.212395E-01  0.742E-01    1.42       1.0  T
   5    -10.3969627 -0.248805E-02  0.137E-01    1.37       1.0  T
   6    -10.3970078 -0.450861E-04  0.100E-01    1.37       1.0  T
   7    -10.3969871  0.206079E-04  0.728E-02    1.37       1.0  T
   8    -10.3970420 -0.548155E-04  0.479E-03    1.37       9.3  T
   9    -10.3970420 -0.157162E-07  0.180E-03    1.37      24.8  T
  10    -10.3970420 -0.251465E-08  0.250E-04    1.37     178.6  T
  11    -10.3970420 -0.175117E-09  0.137E-04    1.37     326.4  T
     SCC iter.                  ...        0 min,  0.001 sec
     gradient                   ...        0 min,  0.001 sec
 * total energy  :   -10.2236516 Eh     change       -0.2499268E-01 Eh
   gradient norm :     0.0961026 Eh/α   predicted    -0.4132991E-01 (  65.37%)
   displ. norm   :     0.2959647 α      lambda       -0.9978926E-02
   maximum displ.:     0.2558873 α      in ANC's #1, #7, #5, ...

........................................................................
.............................. CYCLE    5 ..............................
........................................................................
   1    -10.4184386 -0.104184E+02  0.102E+00    1.54       0.0  T
   2    -10.4178487  0.589878E-03  0.683E-01    1.55       1.0  T
   3    -10.4088606  0.898815E-02  0.103E+00    1.52       1.0  T
   4    -10.4184722 -0.961162E-02  0.143E-01    1.54       1.0  T
   5    -10.4186242 -0.151955E-03  0.277E-02    1.55       1.6  T
   6    -10.4186205  0.365420E-05  0.211E-02    1.55       2.1  T
   7    -10.4186114  0.915448E-05  0.355E-02    1.55       1.3  T
   8    -10.4186243 -0.129640E-04  0.168E-03    1.55      26.6  T
   9    -10.4186243 -0.126372E-07  0.227E-04    1.55     197.0  T
  10    -10.4186243 -0.117545E-09  0.650E-05    1.55     688.5  T
     SCC iter.                  ...        0 min,  0.001 sec
     gradient                   ...        0 min,  0.001 sec
 * total energy  :   -10.2312376 Eh     change       -0.7585949E-02 Eh
   gradient norm :     0.0723576 Eh/α   predicted    -0.5426516E-02 ( -28.47%)
   displ. norm   :     0.2330509 α      lambda       -0.1221998E-01
   maximum displ.:     0.1704803 α      in ANC's #7, #3, #5, ...

........................................................................
.............................. CYCLE    6 ..............................
........................................................................
   1    -10.4641791 -0.104642E+02  0.116E+00    1.54       0.0  T
   2    -10.4531639  0.110152E-01  0.126E+00    1.54       1.0  T
   3    -10.4643381 -0.111743E-01  0.784E-01    1.53       1.0  T
   4    -10.4673004 -0.296224E-02  0.136E-01    1.55       1.0  T
   5    -10.4673631 -0.627157E-04  0.689E-02    1.55       1.0  T
   6    -10.4673430  0.201070E-04  0.620E-02    1.55       1.0  T
   7    -10.4673753 -0.322894E-04  0.239E-02    1.55       1.9  T
   8    -10.4673802 -0.496935E-05  0.252E-03    1.55      17.7  T
   9    -10.4673803 -0.132688E-07  0.305E-04    1.55     146.7  T
  10    -10.4673803 -0.225848E-09  0.121E-04    1.55     368.8  T
     SCC iter.                  ...        0 min,  0.001 sec
     gradient                   ...        0 min,  0.001 sec
 * total energy  :   -10.2355305 Eh     change       -0.4292899E-02 Eh
   gradient norm :     0.0751738 Eh/α   predicted    -0.6441839E-02 (  50.06%)
   displ. norm   :     0.4140784 α      lambda       -0.8980946E-02
   maximum displ.:     0.3476841 α      in ANC's #1, #7, #3, ...

........................................................................
.............................. CYCLE    7 ..............................
........................................................................
   1    -10.4302920 -0.104303E+02  0.129E+00    1.65       0.0  T
   2    -10.4246657  0.562634E-02  0.104E+00    1.60       1.0  T
   3    -10.4238263  0.839415E-03  0.112E+00    1.61       1.0  T
   4    -10.4314186 -0.759229E-02  0.287E-01    1.69       1.0  T
   5    -10.4318720 -0.453407E-03  0.474E-02    1.68       1.0  T
   6    -10.4318595  0.124446E-04  0.527E-02    1.68       1.0  T
   7    -10.4318814 -0.218987E-04  0.186E-02    1.68       2.4  T
   8    -10.4318831 -0.167535E-05  0.136E-03    1.68      32.8  T
   9    -10.4318831 -0.197319E-08  0.629E-04    1.68      71.1  T
  10    -10.4318831 -0.971804E-09  0.232E-04    1.68     192.4  T
     SCC iter.                  ...        0 min,  0.001 sec
     gradient                   ...        0 min,  0.001 sec
 * total energy  :   -10.2397019 Eh     change       -0.4171459E-02 Eh
   gradient norm :     0.0432091 Eh/α   predicted    -0.5260410E-02 (  26.10%)
   displ. norm   :     0.0741142 α      lambda       -0.2294898E-02
   maximum displ.:     0.0627172 α      in ANC's #3, #7, #5, ...

........................................................................
.............................. CYCLE    8 ..............................
........................................................................
   1    -10.4511890 -0.104512E+02  0.402E-01    1.67       0.0  T
   2    -10.4510634  0.125520E-03  0.309E-01    1.68       1.0  T
   3    -10.4511291 -0.656868E-04  0.227E-01    1.67       1.0  T
   4    -10.4510351  0.939745E-04  0.207E-01    1.66       1.0  T
   5    -10.4513863 -0.351106E-03  0.367E-02    1.67       1.2  T
   6    -10.4513964 -0.101412E-04  0.178E-02    1.67       2.5  T
   7    -10.4513980 -0.158416E-05  0.228E-03    1.67      19.6  T
   8    -10.4513980 -0.161826E-07  0.624E-04    1.67      71.7  T
   9    -10.4513980 -0.897508E-09  0.379E-04    1.67     118.1  T
     SCC iter.                  ...        0 min,  0.001 sec
     gradient                   ...        0 min,  0.001 sec
 * total energy  :   -10.2409329 Eh     change       -0.1230990E-02 Eh
   gradient norm :     0.0214334 Eh/α   predicted    -0.1153752E-02 (  -6.27%)
   displ. norm   :     0.1247366 α      lambda       -0.1383720E-02
   maximum displ.:     0.0820904 α      in ANC's #7, #3, #5, ...

........................................................................
.............................. CYCLE    9 ..............................
........................................................................
   1    -10.4551916 -0.104552E+02  0.449E-01    1.64       0.0  T
   2    -10.4549081  0.283503E-03  0.327E-01    1.63       1.0  T
   3    -10.4539972  0.910918E-03  0.408E-01    1.65       1.0  T
   4    -10.4552148 -0.121762E-02  0.915E-02    1.64       1.0  T
   5    -10.4552305 -0.157012E-04  0.744E-02    1.64       1.0  T
   6    -10.4552849 -0.543400E-04  0.119E-02    1.64       3.8  T
   7    -10.4552852 -0.287820E-06  0.398E-03    1.64      11.2  T
   8    -10.4552853 -0.886604E-07  0.707E-04    1.64      63.3  T
   9    -10.4552853 -0.135655E-08  0.235E-04    1.64     190.2  T
     SCC iter.                  ...        0 min,  0.001 sec
     gradient                   ...        0 min,  0.001 sec
 * total energy  :   -10.2420172 Eh     change       -0.1084263E-02 Eh
   gradient norm :     0.0082482 Eh/α   predicted    -0.7026242E-03 ( -35.20%)
   displ. norm   :     0.2394711 α      lambda       -0.1392928E-02
   maximum displ.:     0.1552567 α      in ANC's #7, #3, #5, ...

........................................................................
.............................. CYCLE   10 ..............................
........................................................................
   1    -10.4472087 -0.104472E+02  0.794E-01    1.65       0.0  T
   2    -10.4470831  0.125585E-03  0.500E-01    1.64       1.0  T
   3    -10.4384947  0.858838E-02  0.956E-01    1.63       1.0  T
   4    -10.4463690 -0.787429E-02  0.319E-01    1.65       1.0  T
   5    -10.4472260 -0.856955E-03  0.674E-02    1.66       1.0  T
   6    -10.4472656 -0.395958E-04  0.155E-02    1.65       2.9  T
   7    -10.4472658 -0.203187E-06  0.530E-03    1.65       8.4  T
   8    -10.4472658 -0.284103E-07  0.171E-03    1.65      26.1  T
   9    -10.4472658 -0.233706E-07  0.470E-04    1.65      95.2  T
  10    -10.4472658 -0.510992E-09  0.585E-05    1.65     764.8  T
     SCC iter.                  ...        0 min,  0.001 sec
     gradient                   ...        0 min,  0.001 sec
 * total energy  :   -10.2425469 Eh     change       -0.5296869E-03 Eh
   gradient norm :     0.0227721 Eh/α   predicted    -0.7364096E-03 (  39.03%)
   displ. norm   :     0.0730621 α      lambda       -0.7871139E-03
   maximum displ.:     0.0695286 α      in ANC's #1, #4, #3, ...

........................................................................
.............................. CYCLE   11 ..............................
........................................................................
   1    -10.4585098 -0.104585E+02  0.316E-01    1.62       0.0  T
   2    -10.4566184  0.189136E-02  0.474E-01    1.56       1.0  T
   3    -10.4581114 -0.149296E-02  0.305E-01    1.61       1.0  T
   4    -10.4584665 -0.355066E-03  0.223E-01    1.62       1.0  T
   5    -10.4588402 -0.373728E-03  0.236E-02    1.60       1.9  T
   6    -10.4588420 -0.184172E-05  0.120E-02    1.60       3.7  T
   7    -10.4588424 -0.403342E-06  0.690E-03    1.60       6.5  T
   8    -10.4588427 -0.231324E-06  0.118E-03    1.60      37.9  T
   9    -10.4588427 -0.124416E-08  0.456E-04    1.60      98.1  T
  10    -10.4588427 -0.884713E-09  0.464E-05    1.60     963.9  T
     SCC iter.                  ...        0 min,  0.001 sec
     gradient                   ...        0 min,  0.001 sec
 * total energy  :   -10.2427818 Eh     change       -0.2348877E-03 Eh
   gradient norm :     0.0160191 Eh/α   predicted    -0.3956585E-03 (  68.45%)
   displ. norm   :     0.0409714 α      lambda       -0.3462533E-03
   maximum displ.:     0.0377736 α      in ANC's #4, #2, #7, ...

........................................................................
.............................. CYCLE   12 ..............................
........................................................................
   1    -10.4610783 -0.104611E+02  0.317E-01    1.60       0.0  T
   2    -10.4536965  0.738182E-02  0.869E-01    1.57       1.0  T
   3    -10.4611509 -0.745435E-02  0.252E-01    1.60       1.0  T
   4    -10.4615569 -0.406005E-03  0.924E-02    1.60       1.0  T
   5    -10.4615962 -0.393559E-04  0.253E-02    1.60       1.8  T
   6    -10.4615989 -0.271835E-05  0.146E-02    1.60       3.1  T
   7    -10.4615992 -0.293075E-06  0.118E-02    1.60       3.8  T
   8    -10.4616001 -0.907696E-06  0.210E-03    1.60      21.3  T
   9    -10.4616002 -0.779354E-08  0.748E-04    1.60      59.8  T
  10    -10.4616002 -0.303310E-08  0.547E-05    1.60     817.0  T
     SCC iter.                  ...        0 min,  0.001 sec
     gradient                   ...        0 min,  0.001 sec
 * total energy  :   -10.2425421 Eh     change        0.2396423E-03 Eh
   gradient norm :     0.0276830 Eh/α   predicted    -0.1734163E-03 (-172.36%)
   displ. norm   :     0.0534449 α      lambda       -0.7733990E-03
   maximum displ.:     0.0397237 α      in ANC's #1, #4, #7, ...

........................................................................
.............................. CYCLE   13 ..............................
........................................................................
   1    -10.4564218 -0.104564E+02  0.285E-01    1.62       0.0  T
   2    -10.4522545  0.416737E-02  0.663E-01    1.63       1.0  T
   3    -10.4562527 -0.399826E-02  0.260E-01    1.63       1.0  T
   4    -10.4565590 -0.306286E-03  0.168E-01    1.62       1.0  T
   5    -10.4567558 -0.196771E-03  0.211E-02    1.63       2.1  T
   6    -10.4567565 -0.690086E-06  0.147E-02    1.63       3.0  T
   7    -10.4567574 -0.940235E-06  0.609E-03    1.63       7.3  T
   8    -10.4567576 -0.200676E-06  0.207E-03    1.63      21.6  T
   9    -10.4567576 -0.175832E-07  0.603E-04    1.63      74.2  T
  10    -10.4567576 -0.188739E-08  0.536E-05    1.63     834.7  T
     SCC iter.                  ...        0 min,  0.001 sec
     gradient                   ...        0 min,  0.001 sec
 * total energy  :   -10.2428854 Eh     change       -0.3432347E-03 Eh
   gradient norm :     0.0063183 Eh/α   predicted    -0.3878042E-03 (  12.99%)
   displ. norm   :     0.0285440 α      lambda       -0.7202416E-04
   maximum displ.:     0.0214535 α      in ANC's #1, #3, #7, ...

........................................................................
.............................. CYCLE   14 ..............................
........................................................................
   1    -10.4576169 -0.104576E+02  0.123E-01    1.62       0.0  T
   2    -10.4575443  0.725826E-04  0.109E-01    1.60       1.0  T
   3    -10.4575417  0.256835E-05  0.116E-01    1.62       1.0  T
   4    -10.4574819  0.598532E-04  0.128E-01    1.62       1.0  T
   5    -10.4576353 -0.153407E-03  0.176E-02    1.61       2.5  T
   6    -10.4576372 -0.195622E-05  0.433E-03    1.61      10.3  T
   7    -10.4576373 -0.513897E-07  0.139E-03    1.61      32.3  T
   8    -10.4576373 -0.993559E-08  0.349E-04    1.61     128.3  T
   9    -10.4576373 -0.474351E-09  0.162E-04    1.61     276.6  T
     SCC iter.                  ...        0 min,  0.001 sec
     gradient                   ...        0 min,  0.001 sec
 * total energy  :   -10.2429147 Eh     change       -0.2937144E-04 Eh
   gradient norm :     0.0050865 Eh/α   predicted    -0.3604057E-04 (  22.71%)
   displ. norm   :     0.0059387 α      lambda       -0.1942713E-04
   maximum displ.:     0.0043450 α      in ANC's #7, #9, #5, ...

........................................................................
.............................. CYCLE   15 ..............................
........................................................................
   1    -10.4581655 -0.104582E+02  0.316E-02    1.61       0.0  T
   2    -10.4581567  0.881766E-05  0.349E-02    1.62       1.3  T
   3    -10.4581547  0.201713E-05  0.387E-02    1.61       1.2  T
   4    -10.4581637 -0.899723E-05  0.209E-02    1.61       2.1  T
   5    -10.4581665 -0.282054E-05  0.832E-03    1.61       5.4  T
   6    -10.4581670 -0.523109E-06  0.129E-03    1.61      34.8  T
   7    -10.4581670  0.792818E-09  0.840E-04    1.61      53.3  T
   8    -10.4581670 -0.439389E-08  0.882E-05    1.61     507.2  T
     SCC iter.                  ...        0 min,  0.001 sec
     gradient                   ...        0 min,  0.001 sec
 * total energy  :   -10.2429307 Eh     change       -0.1592859E-04 Eh
   gradient norm :     0.0033474 Eh/α   predicted    -0.9713521E-05 ( -39.02%)
   displ. norm   :     0.0303371 α      lambda       -0.4589103E-04
   maximum displ.:     0.0196555 α      in ANC's #7, #3, #9, ...

........................................................................
.............................. CYCLE   16 ..............................
........................................................................
   1    -10.4584070 -0.104584E+02  0.111E-01    1.61       0.0  T
   2    -10.4583747  0.323275E-04  0.885E-02    1.62       1.0  T
   3    -10.4582352  0.139464E-03  0.144E-01    1.61       1.0  T
   4    -10.4583260 -0.907888E-04  0.958E-02    1.61       1.0  T
   5    -10.4584125 -0.864842E-04  0.126E-02    1.61       3.6  T
   6    -10.4584135 -0.954680E-06  0.314E-03    1.61      14.3  T
   7    -10.4584135  0.547475E-09  0.120E-03    1.61      37.3  T
   8    -10.4584135 -0.994601E-08  0.296E-04    1.61     151.0  T
   9    -10.4584135 -0.235282E-09  0.163E-04    1.61     275.0  T
     SCC iter.                  ...        0 min,  0.001 sec
     gradient                   ...        0 min,  0.001 sec
 * total energy  :   -10.2429606 Eh     change       -0.2997020E-04 Eh
   gradient norm :     0.0018079 Eh/α   predicted    -0.2296728E-04 ( -23.37%)
   displ. norm   :     0.0347586 α      lambda       -0.1702568E-04
   maximum displ.:     0.0227064 α      in ANC's #3, #1, #7, ...

........................................................................
.............................. CYCLE   17 ..............................
........................................................................
   1    -10.4585154 -0.104585E+02  0.112E-01    1.61       0.0  T
   2    -10.4585076  0.782270E-05  0.745E-02    1.61       1.0  T
   3    -10.4583128  0.194775E-03  0.148E-01    1.60       1.0  T
   4    -10.4584713 -0.158427E-03  0.684E-02    1.61       1.0  T
   5    -10.4585172 -0.459389E-04  0.709E-03    1.61       6.3  T
   6    -10.4585174 -0.220995E-06  0.307E-03    1.61      14.6  T
   7    -10.4585174 -0.375006E-08  0.109E-03    1.61      40.9  T
   8    -10.4585174 -0.807634E-08  0.238E-04    1.61     187.6  T
   9    -10.4585174 -0.154072E-09  0.129E-04    1.61     345.9  T
     SCC iter.                  ...        0 min,  0.001 sec
     gradient                   ...        0 min,  0.001 sec
 * total energy  :   -10.2429731 Eh     change       -0.1243425E-04 Eh
   gradient norm :     0.0013303 Eh/α   predicted    -0.8515848E-05 ( -31.51%)
   displ. norm   :     0.0064037 α      lambda       -0.2716511E-05
   maximum displ.:     0.0045728 α      in ANC's #1, #7, #3, ...

........................................................................
.............................. CYCLE   18 ..............................
........................................................................
   1    -10.4580353 -0.104580E+02  0.326E-02    1.61       0.0  T
   2    -10.4580278  0.757728E-05  0.336E-02    1.61       1.3  T
   3    -10.4580207  0.704158E-05  0.423E-02    1.61       1.1  T
   4    -10.4580346 -0.138268E-04  0.143E-02    1.61       3.1  T
   5    -10.4580359 -0.133859E-05  0.519E-03    1.61       8.6  T
   6    -10.4580361 -0.223511E-06  0.784E-04    1.61      57.1  T
   7    -10.4580361 -0.114986E-08  0.216E-04    1.61     207.4  T
     SCC iter.                  ...        0 min,  0.001 sec
     gradient                   ...        0 min,  0.001 sec
 * total energy  :   -10.2429757 Eh     change       -0.2636309E-05 Eh
   gradient norm :     0.0008115 Eh/α   predicted    -0.1358744E-05 ( -48.46%)
   displ. norm   :     0.0102887 α      lambda       -0.1582098E-05
   maximum displ.:     0.0073059 α      in ANC's #7, #1, #5, ...

   *** GEOMETRY OPTIMIZATION CONVERGED AFTER 18 ITERATIONS ***

------------------------------------------------------------------------
 total energy gain   :        -0.1661395 Eh     -104.2541 kcal/mol
 total RMSD          :         1.1685614 a0        0.6184 Å
 total power (kW/mol):       -24.2332884 (step)-6516.1484 (real)
------------------------------------------------------------------------

 ANCopt (total)                0 d,  0 h,  0 min,  0.067 sec
 optimizer setup                ...        0 min,  0.000 sec (  0.096%)
 model hessian                  ...        0 min,  0.000 sec (  0.138%)
 ANC generation                 ...        0 min,  0.000 sec (  0.073%)
 coordinate transformation      ...        0 min,  0.000 sec (  0.056%)
 single point calculation       ...        0 min,  0.065 sec ( 97.680%)
 optimization log               ...        0 min,  0.000 sec (  0.624%)
 hessian update                 ...        0 min,  0.000 sec (  0.059%)
 rational function              ...        0 min,  0.000 sec (  0.629%)

================
 final structure:
================
5
 xtb: 6.2.2 (9d81278992624c895f80dd42a50cac0aa55982e2)
C        -1.95984155523151   -0.51176506432367   -0.08720671168608
C        -0.77647738959568   -0.05974413264732   -0.00817939411193
C         0.77729313967161   -0.04938225527587   -0.00819885912070
C        -0.00751773551258    1.10655535348670    0.19118711055579
C         1.96654254066816   -0.48566390123984   -0.08760214563709

 Bond Distances (Angstroems)
 ---------------------------
C1-C2=1.2692         C2-C1=1.2692         C2-C3=1.5538         C2-C4=1.4111         C3-C2=1.5538         C3-C4=1.4113         
C3-C5=1.2692         C4-C2=1.4111         C4-C3=1.4113         C5-C3=1.2692         
 C  C  Rav=1.3829 sigma=0.1064  Rmin=1.2692  Rmax=1.5538     5

 selected bond angles (degree)
 --------------------
C3-C2-C1=159.18                C4-C2-C1=144.21                C4-C2-C3= 56.60                C4-C3-C2= 56.59                
C5-C3-C2=159.17                C5-C3-C4=144.23                C3-C4-C2= 66.80                

 selected dihedral angles (degree)
 ---------------------------------
C4-C3-C2-C1=179.65            C5-C3-C2-C1=  0.04            C5-C3-C2-C4=180.39            C3-C4-C2-C1=180.21            
C2-C4-C3-C5=179.76            
           -------------------------------------------------
          |                Final Singlepoint                |
           -------------------------------------------------

          ...................................................
          :                      SETUP                      :
          :.................................................:
          :  # basis functions                  20          :
          :  # atomic orbitals                  20          :
          :  # shells                           10          :
          :  # electrons                        20          :
          :  max. iterations                   250          :
          :  Hamiltonian                  GFN2-xTB          :
          :  restarted?                      false          :
          :  GBSA solvation                  false          :
          :  PC potential                    false          :
          :  electronic temp.          300.0000000     K    :
          :  accuracy                    1.0000000          :
          :  -> integral cutoff          0.2500000E+02      :
          :  -> integral neglect         0.1000000E-07      :
          :  -> SCF convergence          0.1000000E-05 Eh   :
          :  -> wf. convergence          0.1000000E-03 e    :
          :  Broyden damping             0.4000000          :
          ...................................................

 iter      E             dE          RMSdq      gap      omega  full diag
   1    -10.4580361 -0.104580E+02  0.972E-05    1.61       0.0  T
   2    -10.4580361  0.171577E-09  0.122E-04    1.61     368.1  T
   3    -10.4580361  0.391047E-10  0.169E-04    1.61     264.2  T

   *** convergence criteria satisfied after 3 iterations ***

         #    Occupation            Energy/Eh            Energy/eV
      -------------------------------------------------------------
         1        2.0000           -0.7338706             -19.9696
       ...           ...                  ...                  ...
         4        2.0000           -0.5858639             -15.9422
         5        2.0000           -0.5595967             -15.2274
         6        2.0000           -0.5578041             -15.1786
         7        2.0000           -0.4771592             -12.9842
         8        2.0000           -0.4743571             -12.9079
         9        2.0000           -0.4723142             -12.8523
        10        2.0000           -0.4610821             -12.5467 (HOMO)
        11                         -0.4019127             -10.9366 (LUMO)
        12                         -0.3969927             -10.8027
        13                         -0.3222231              -8.7681
        14                         -0.2364822              -6.4350
        15                         -0.2091305              -5.6907
       ...                                ...                  ...
        20                          0.8772245              23.8705
      -------------------------------------------------------------
                  HL-Gap            0.0591694 Eh            1.6101 eV
             Fermi-level           -0.4314974 Eh          -11.7416 eV

 SCC (total)                   0 d,  0 h,  0 min,  0.003 sec
 SCC setup                      ...        0 min,  0.000 sec (  2.028%)
 Dispersion                     ...        0 min,  0.000 sec (  0.256%)
 integral evaluation            ...        0 min,  0.001 sec ( 41.905%)
 zeroth order Hamiltonian       ...        0 min,  0.000 sec (  0.489%)
 iterations                     ...        0 min,  0.000 sec ( 11.273%)
 molecular gradient             ...        0 min,  0.001 sec ( 42.301%)
 printout                       ...        0 min,  0.000 sec (  1.530%)

         :::::::::::::::::::::::::::::::::::::::::::::::::::::
         ::                     SUMMARY                     ::
         :::::::::::::::::::::::::::::::::::::::::::::::::::::
         :: total energy             -10.242975691175 Eh    ::
         :: gradient norm              0.000822884589 Eh/a0 ::
         :: HOMO-LUMO gap              1.610080757953 eV    ::
         ::.................................................::
         :: SCC energy               -10.458036120417 Eh    ::
         :: -> isotropic ES           -0.022236840340 Eh    ::
         :: -> anisotropic ES          0.001497804127 Eh    ::
         :: -> anisotropic XC          0.013076809000 Eh    ::
         :: -> dispersion             -0.003009366499 Eh    ::
         :: repulsion energy           0.215060406802 Eh    ::
         :: add. restraining           0.000000000000 Eh    ::
         :::::::::::::::::::::::::::::::::::::::::::::::::::::

           ------------------------------------------------- 
          |                Numerical Hessian                |
           ------------------------------------------------- 
step length          :   0.00500
SCC accuracy         :   0.30000
Hessian scale factor :   1.00000
frozen atoms in %    :   0.00000    0
RMS gradient         :   0.00082
estimated CPU  time      0.00 min
estimated wall time      0.00 min

writing file <hessian>.

 projected vibrational frequencies (cm-1)
eigval :       -0.00    -0.00     0.00     0.00     0.00     0.00
eigval :      202.91   205.67   285.70   407.78   569.41   890.04
eigval :     1185.63  1691.60  1847.55
           -------------------------------------------------
          |                Property Printout                |
           -------------------------------------------------

    * Orbital Energies and Occupations

         #    Occupation            Energy/Eh            Energy/eV
      -------------------------------------------------------------
         1        2.0000           -0.7338706             -19.9696
         2        2.0000           -0.6940429             -18.8859
         3        2.0000           -0.6748262             -18.3630
         4        2.0000           -0.5858639             -15.9422
         5        2.0000           -0.5595967             -15.2274
         6        2.0000           -0.5578041             -15.1786
         7        2.0000           -0.4771592             -12.9842
         8        2.0000           -0.4743571             -12.9079
         9        2.0000           -0.4723142             -12.8523
        10        2.0000           -0.4610821             -12.5467 (HOMO)
        11                         -0.4019127             -10.9366 (LUMO)
        12                         -0.3969927             -10.8027
        13                         -0.3222231              -8.7681
        14                         -0.2364822              -6.4350
        15                         -0.2091305              -5.6907
        16                         -0.0641051              -1.7444
        17                          0.0905651               2.4644
        18                          0.2883343               7.8460
        19                          0.7445862              20.2612
        20                          0.8772245              23.8705
      -------------------------------------------------------------
                  HL-Gap            0.0591694 Eh            1.6101 eV
             Fermi-level           -0.4314974 Eh          -11.7416 eV

     #   Z        covCN         q      C6AA      α(0)
     1   6 C      0.983    -0.101    39.154    10.511
     2   6 C      2.933     0.121    25.348     8.257
     3   6 C      2.933     0.121    25.349     8.257
     4   6 C      1.963    -0.039    32.101     9.150
     5   6 C      0.983    -0.101    39.154    10.511

 Mol. C6AA /au·bohr⁶  :        797.835014
 Mol. C8AA /au·bohr⁸  :      23074.775058
 Mol. α(0) /au        :         46.684978


Wiberg/Mayer (AO) data.
largest (>0.10) Wiberg bond orders for each atom
          total WBO             WBO to atom ...
     1  C   2.824        C    2 2.044    C    5 0.360    C    4 0.301    C    3 0.119
     2  C   3.931        C    1 2.044    C    4 1.146    C    3 0.622    C    5 0.119
     3  C   3.931        C    5 2.044    C    4 1.146    C    2 0.622    C    1 0.119
     4  C   2.894        C    2 1.146    C    3 1.146    C    1 0.301    C    5 0.301
     5  C   2.824        C    3 2.044    C    1 0.360    C    4 0.301    C    2 0.119

MOs/occ written to file <molden.input>


molecular dipole:
                 x           y           z       tot (Debye)
 q only:       -0.001       0.086       0.016
   full:        0.000      -0.099      -0.014       0.255
molecular quadrupole (traceless):
                xx          xy          yy          xz          yz          zz
 q only:       -2.094      -0.019       0.795       0.001      -0.090       1.299
  q+dip:       -4.765      -0.042       1.622       0.003      -0.272       3.142
   full:       -7.833      -0.066       2.142       0.006      -0.635       5.691

           -------------------------------------------------
          |                Geometry Summary                 |
Molecule has the following symmetry elements: (C2) 2*(sigma) 
It seems to be the C2v point group
           -------------------------------------------------

      molecular mass/u    :       60.0536795
   center of mass at/Å    :       -0.0000002       0.0000000       0.0000000
  moments of inertia/u·Å² :        0.2137786E+02   0.1070847E+03   0.1284624E+03
rotational constants/cm⁻¹ :        0.7885555E+00   0.1574234E+00   0.1312262E+00

 * 2 selected distances

     #   Z        #   Z                                     value/Å
     1   6 C      2   6 C                                 1.2692198 (min)
     3   6 C      5   6 C                                 1.2692363 (max)

 * 1 distinct bonds (by element types)

   Z      Z             #   av. dist./Å        max./Å        min./Å
   6 C    6 C           2     1.2692280     1.2692363     1.2692198

           -------------------------------------------------
          |               Frequency Printout                |
           -------------------------------------------------
 projected vibrational frequencies (cm-1)
eigval :       -0.00    -0.00     0.00     0.00     0.00     0.00
eigval :      202.91   205.67   285.70   407.78   569.41   890.04
eigval :     1185.63  1691.60  1847.55
 reduced masses (amu)
   1: 12.01   2: 12.01   3: 12.01   4: 12.01   5: 12.01   6: 12.01   7: 12.01   8: 12.01
   9: 12.01  10: 12.01  11: 12.01  12: 12.01  13: 12.01  14: 12.01  15: 12.01
 IR intensities (amu)
   1:  0.06   2:  0.04   3:  0.04   4:  0.02   5:  0.04   6:  0.05   7:  0.34   8:  0.66
   9:  0.08  10:  0.00  11:  0.15  12:  0.89  13:  0.13  14:  0.60  15:  0.15
 Raman intensities (amu)
   1:  0.00   2:  0.00   3:  0.00   4:  0.00   5:  0.00   6:  0.00   7:  0.00   8:  0.00
   9:  0.00  10:  0.00  11:  0.00  12:  0.00  13:  0.00  14:  0.00  15:  0.00
 output can be read by thermo (or use thermo option).
 writing <g98.out> molden fake output.
 recommended (thermochemical) frequency scaling factor: 1.0
           -------------------------------------------------
          |             Thermodynamic Functions             |
           -------------------------------------------------

c2v symmetry found (for desy threshold:  0.10E+00) used in thermo

          ...................................................
          :                      SETUP                      :
          :.................................................:
          :  # frequencies                           9      :
          :  # imaginary freq.                       0      :
          :  linear?                             false      :
          :  only rotor calc.                    false      :
          :  symmetry                              c2v      :
          :  rotational number                       2      :
          :  scaling factor                  1.0000000      :
          :  rotor cutoff                   50.0000000 cm⁻¹ :
          :  imag. cutoff                  -20.0000000 cm⁻¹ :
          :.................................................:

    mode    ω/cm⁻¹     T·S(HO)/kcal·mol⁻¹    T·S(FR)/kcal·mol⁻¹   T·S(vib)
   ------------------------------------------------------------------------
       1    202.91    -0.00000 ( 99.63%)     0.01222 (  0.37%)     0.00004
       2    205.67    -0.00000 ( 99.65%)     0.01236 (  0.35%)     0.00004
       3    285.70    -0.00000 ( 99.91%)     0.01562 (  0.09%)     0.00001
   ------------------------------------------------------------------------

   temp. (K)  partition function   enthalpy   heat capacity  entropy
                                   cal/mol     cal/K/mol   cal/K/mol   J/K/mol
 298.15  VIB   4.30                 1319.705      8.706      7.326
         ROT  0.207E+05              888.752      2.981     22.731
         INT  0.891E+05             2208.458     11.687     30.057
         TR   0.450E+27             1481.254      4.968     38.181
         TOT                        3689.7116    16.6550    68.2375   285.5057

   temp. (K)  partition function   enthalpy   heat capacity  entropy
                                   cal/mol     cal/K/mol   cal/K/mol   J/K/mol
 120.00  VIB   1.25                  148.552      3.746      1.685
         ROT  0.529E+04              357.707      2.981     20.018
         INT  0.661E+04              506.258      6.727     21.703
         TR   0.115E+27              596.178      4.968     33.661
         TOT                        1102.4365    11.6952    55.3646   231.6454

   temp. (K)  partition function   enthalpy   heat capacity  entropy
                                   cal/mol     cal/K/mol   cal/K/mol   J/K/mol
 100.00  VIB   1.14                   82.649      2.827      1.087
         ROT  0.402E+04              298.089      2.981     19.475
         INT  0.457E+04              380.738      5.808     20.562
         TR   0.875E+26              496.815      4.968     32.756
         TOT                         877.5535    10.7760    53.3176   223.0808

   temp. (K)  partition function   enthalpy   heat capacity  entropy
                                   cal/mol     cal/K/mol   cal/K/mol   J/K/mol
  80.00  VIB   1.06                   36.060      1.822      0.571
         ROT  0.288E+04              238.471      2.981     18.810
         INT  0.305E+04              274.531      4.803     19.380
         TR   0.626E+26              397.452      4.968     31.648
         TOT                         671.9830     9.7711    51.0283   213.5026

   temp. (K)  partition function   enthalpy   heat capacity  entropy
                                   cal/mol     cal/K/mol   cal/K/mol   J/K/mol
  60.00  VIB   1.02                    9.712      0.832      0.197
         ROT  0.187E+04              178.853      2.981     17.952
         INT  0.190E+04              188.565      3.813     18.149
         TR   0.406E+26              298.089      4.968     30.219
         TOT                         486.6543     8.7812    48.3688   202.3753

   temp. (K)  partition function   enthalpy   heat capacity  entropy
                                   cal/mol     cal/K/mol   cal/K/mol   J/K/mol
  40.00  VIB   1.00                    0.782      0.146      0.023
         ROT  0.102E+04              119.236      2.981     16.744
         INT  0.102E+04              120.017      3.127     16.766
         TR   0.221E+26              198.726      4.968     28.206
         TOT                         318.7435     8.0949    44.9723   188.1641

   temp. (K)  partition function   enthalpy   heat capacity  entropy
                                   cal/mol     cal/K/mol   cal/K/mol   J/K/mol
  20.00  VIB   1.00                    0.000      0.000     -0.005
         ROT   360.                   59.618      2.981     14.677
         INT   360.                   59.618      2.981     14.672
         TR   0.782E+25               99.363      4.968     24.764
         TOT                         158.9813     7.9494    39.4363   165.0013

   temp. (K)  partition function   enthalpy   heat capacity  entropy
                                   cal/mol     cal/K/mol   cal/K/mol   J/K/mol
  10.00  VIB   1.00                    0.000      0.000     -0.011
         ROT   127.                   29.809      2.981     12.611
         INT   127.                   29.809      2.981     12.600
         TR   0.277E+25               49.681      4.968     21.322
         TOT                          79.4904     7.9490    33.9223   141.9309

       T/K    H(0)-H(T)+PV         H(T)/Eh          T*S/Eh         G(T)/Eh
   ------------------------------------------------------------------------
    298.15    0.587993E-02    0.224793E-01    0.324218E-01   -0.994252E-02
    120.00    0.175684E-02    0.183562E-01    0.105875E-01    0.776875E-02
    100.00    0.139847E-02    0.179979E-01    0.849670E-02    0.950116E-02
     80.00    0.107087E-02    0.176703E-01    0.650551E-02    0.111648E-01
     60.00    0.775533E-03    0.173749E-01    0.462484E-02    0.127501E-01
     40.00    0.507950E-03    0.171073E-01    0.286672E-02    0.142406E-01
     20.00    0.253353E-03    0.168527E-01    0.125691E-02    0.155958E-01
     10.00    0.126676E-03    0.167261E-01    0.540586E-03    0.161855E-01 (used)
   ------------------------------------------------------------------------

         :::::::::::::::::::::::::::::::::::::::::::::::::::::
         ::                  THERMODYNAMIC                  ::
         :::::::::::::::::::::::::::::::::::::::::::::::::::::
         :: total free energy         -10.226790210004 Eh   ::
         ::.................................................::
         :: total energy              -10.242975691258 Eh   ::
         :: zero point energy           0.016599391311 Eh   ::
         :: G(RRHO) w/o ZPVE           -0.000413910057 Eh   ::
         :: G(RRHO) contrib.            0.016185481254 Eh   ::
         :::::::::::::::::::::::::::::::::::::::::::::::::::::

optimized geometry written to: xtbopt.xyz


           -------------------------------------------------
          | TOTAL ENERGY              -10.242975691258 Eh   |
          | TOTAL ENTHALPY            -10.226249623931 Eh   |
          | TOTAL FREE ENERGY         -10.226790210004 Eh   |
          | GRADIENT NORM               0.000822775570 Eh/α |
          | HOMO-LUMO GAP               1.610081592384 eV   |
           -------------------------------------------------

------------------------------------------------------------------------
 * finished run on 2020/05/12 at 11:44:32.861     
------------------------------------------------------------------------
 total:
 * wall-time:     0 d,  0 h,  0 min,  0.197 sec
 *  cpu-time:     0 d,  0 h,  0 min,  0.197 sec
 * ratio c/w:     0.998 speedup
 SCF:
 * wall-time:     0 d,  0 h,  0 min,  0.005 sec
 *  cpu-time:     0 d,  0 h,  0 min,  0.005 sec
 * ratio c/w:     0.996 speedup
 ANC optimizer:
 * wall-time:     0 d,  0 h,  0 min,  0.071 sec
 *  cpu-time:     0 d,  0 h,  0 min,  0.071 sec
 * ratio c/w:     0.999 speedup
 numerical hessian:
 * wall-time:     0 d,  0 h,  0 min,  0.105 sec
 *  cpu-time:     0 d,  0 h,  0 min,  0.105 sec
 * ratio c/w:     0.998 speedup

