      -----------------------------------------------------------      
     |                   =====================                   |     
     |                           x T B                           |     
     |                   =====================                   |     
     |                         S. Grimme                         |     
     |          Mulliken Center for Theoretical Chemistry        |     
     |                    University of Bonn                     |     
      -----------------------------------------------------------      

   * xtb version 6.2.2 (9d81278992624c895f80dd42a50cac0aa55982e2) compiled by '@Darwin' on 04/03/2020

   xtb is free software: you can redistribute it and/or modify it under
   the terms of the GNU Lesser General Public License as published by
   the Free Software Foundation, either version 3 of the License, or
   (at your option) any later version.
   
   xtb is distributed in the hope that it will be useful,
   but WITHOUT ANY WARRANTY; without even the implied warranty of
   MERCHANTABILITY or FITNESS FOR A PARTICULAR PURPOSE.  See the
   GNU Lesser General Public License for more details.
   
   Cite this work as:
   * S. Grimme, C. Bannwarth, P. Shushkov, J. Chem. Theory Comput., 2017,
     13, 1989-2009. DOI: 10.1021/acs.jctc.7b00118
   * C. Bannwarth, S. Ehlert and S. Grimme., J. Chem. Theory Comput., 2019,
     15, 1652-1671. DOI: 10.1021/acs.jctc.8b01176
   * P. Pracht, E. Caldeweyher, S. Ehlert, S. Grimme, ChemRxiv, 2019, preprint.
     DOI: 10.26434/chemrxiv.8326202.v1
   
   for DFT-D4:
   * E. Caldeweyher, C. Bannwarth and S. Grimme, J. Chem. Phys., 2017,
     147, 034112. DOI: 10.1063/1.4993215
   * E. Caldeweyher, S. Ehlert, A. Hansen, H. Neugebauer, S. Spicher,
     C. Bannwarth and S. Grimme, J. Chem. Phys., 2019, 150, 154122.
     DOI: 10.1063/1.5090222
   
   for sTDA-xTB:
   * S. Grimme and C. Bannwarth, J. Chem. Phys., 2016, 145, 054103.
     DOI: 10.1063/1.4959605
   
   in the mass-spec context:
   * V. Asgeirsson, C. Bauer and S. Grimme, Chem. Sci., 2017, 8, 4879.
     DOI: 10.1039/c7sc00601b
   
   for metadynamics refer to:
   * S. Grimme, J. Chem. Theory Comput., 2019, 155, 2847-2862
     DOI: 10.1021/acs.jctc.9b00143
   
   with help from (in alphabetical order)
   C. Bannwarth, F. Bohle, G. Brandenburg, E. Caldeweyher, M. Checinski,
   S. Dohm, S. Ehlert, S. Ehrlich, F. März, H. Neugebauer, J. Pisarek,
   P. Pracht, P. Shushkov, and S. Spicher.
   
 * started run on 2020/05/13 at 16:22:14.350     

           -------------------------------------------------
          |                Calculation Setup                |
           -------------------------------------------------

          program call               : xtb --input C1_0_S_0.input C1_0_S_0.xyz --ohess --molden --namespace C1_0_S_0 output.out
          calculation namespace      : C1_0_S_0
          coordinate file            : C1_0_S_0.xyz
          number of atoms            :                     1
          number of electrons        :                     4
          charge                     :                     0
          spin                       :                   0.0
          first test random number   :      0.23977618270771

   ID    Z sym.   atoms
    1    6 C      1

           -------------------------------------------------
          |                 G F N 2 - x T B                 |
           -------------------------------------------------

        Reference                      10.1021/acs.jctc.8b01176
      * Hamiltonian:
        H0-scaling (s, p, d)           1.850000    2.230000    2.230000
        zeta-weighting                 0.500000
      * Dispersion:
        s8                             2.700000
        a1                             0.520000
        a2                             5.000000
        s9                             5.000000
      * Repulsion:
        kExp                           1.500000    1.000000
        rExp                           1.000000
      * Coulomb:
        alpha                          2.000000
        third order                    shell-resolved
        anisotropic                    true
        a3                             3.000000
        a5                             4.000000
        cn-shift                       1.200000
        cn-exp                         4.000000
        max-rad                        5.000000


          ...................................................
          :                      SETUP                      :
          :.................................................:
          :  # basis functions                   4          :
          :  # atomic orbitals                   4          :
          :  # shells                            2          :
          :  # electrons                         4          :
          :  max. iterations                   250          :
          :  Hamiltonian                  GFN2-xTB          :
          :  restarted?                      false          :
          :  GBSA solvation                  false          :
          :  PC potential                    false          :
          :  electronic temp.          300.0000000     K    :
          :  accuracy                    1.0000000          :
          :  -> integral cutoff          0.2500000E+02      :
          :  -> integral neglect         0.1000000E-07      :
          :  -> SCF convergence          0.1000000E-05 Eh   :
          :  -> wf. convergence          0.1000000E-03 e    :
          :  Broyden damping             0.4000000          :
          ...................................................

 iter      E             dE          RMSdq      gap      omega  full diag
   1     -1.7951105 -0.179511E+01  0.141E+01    0.00       0.0  T
   2     -1.7951105  0.000000E+00  0.113E+01    0.00       0.0  T
   3     -1.7951105  0.000000E+00  0.871E+00    0.00       0.0  T
   4     -1.7951105  0.000000E+00  0.697E+00    0.00       0.0  T
   5     -1.7951105  0.000000E+00  0.558E+00    0.00       0.0  T
   6     -1.7951105  0.000000E+00  0.446E+00    0.00       0.0  T
   7     -1.7951105  0.000000E+00  0.357E+00    0.00       0.0  T
   8     -1.7951105  0.000000E+00  0.285E+00    0.00       0.0  T
   9     -1.7951105  0.000000E+00  0.228E+00    0.00       0.0  T
  10     -1.7951105  0.000000E+00  0.183E+00    0.00       0.0  T
  11     -1.7951105  0.000000E+00  0.146E+00    0.00       0.0  T
  12     -1.7951105  0.000000E+00  0.117E+00    0.00       0.0  T
  13     -1.7951105  0.000000E+00  0.935E-01    0.00       0.0  T
  14     -1.7951105  0.000000E+00  0.748E-01    0.00       0.0  T
  15     -1.7951105  0.000000E+00  0.599E-01    0.00       0.0  T
  16     -1.7951105  0.000000E+00  0.479E-01    0.00       0.0  T
  17     -1.7951105  0.000000E+00  0.383E-01    0.00       0.0  T
  18     -1.7951105  0.000000E+00  0.307E-01    0.00       0.0  T
  19     -1.7951105  0.000000E+00  0.245E-01    0.00       0.0  T
  20     -1.7951105  0.000000E+00  0.196E-01    0.00       0.0  T
  21     -1.7951105  0.000000E+00  0.157E-01    0.00       0.0  T
  22     -1.7951105  0.000000E+00  0.126E-01    0.00       0.0  T
  23     -1.7951105  0.000000E+00  0.100E-01    0.00       0.0  T
  24     -1.7951105  0.000000E+00  0.803E-02    0.00       0.0  T
  25     -1.7951105  0.000000E+00  0.643E-02    0.00       0.0  T
  26     -1.7951105  0.000000E+00  0.514E-02    0.00       0.0  T
  27     -1.7951105  0.000000E+00  0.411E-02    0.00       0.0  T
  28     -1.7951105  0.000000E+00  0.329E-02    0.00       0.0  T
  29     -1.7951105  0.000000E+00  0.263E-02    0.00       0.0  T
  30     -1.7951105  0.000000E+00  0.211E-02    0.00       0.0  T
  31     -1.7951105  0.000000E+00  0.169E-02    0.00       0.0  T
  32     -1.7951105  0.000000E+00  0.135E-02    0.00       0.0  T
  33     -1.7951105  0.000000E+00  0.108E-02    0.00       0.0  T
  34     -1.7951105  0.000000E+00  0.863E-03    0.00       0.0  T
  35     -1.7951105  0.000000E+00  0.690E-03    0.00       0.0  T
  36     -1.7951105  0.000000E+00  0.552E-03    0.00       0.0  T
  37     -1.7951105  0.000000E+00  0.442E-03    0.00       0.0  T
  38     -1.7951105  0.000000E+00  0.353E-03    0.00       0.0  T
  39     -1.7951105  0.000000E+00  0.283E-03    0.00       0.0  T
  40     -1.7951105  0.000000E+00  0.226E-03    0.00       0.0  T
  41     -1.7951105  0.000000E+00  0.181E-03    0.00       0.0  T
  42     -1.7951105  0.000000E+00  0.145E-03    0.00       0.0  T
  43     -1.7951105  0.000000E+00  0.116E-03    0.00       0.0  T
  44     -1.7951105  0.000000E+00  0.926E-04    0.00       0.0  T
  45     -1.7951105  0.000000E+00  0.741E-04    0.00       0.0  T

   *** convergence criteria satisfied after 45 iterations ***

         #    Occupation            Energy/Eh            Energy/eV
      -------------------------------------------------------------
         1        2.0000           -0.6918215             -18.8254
         2        0.6667           -0.4732266             -12.8772 (HOMO)
         3        0.6667           -0.4732266             -12.8772 (LUMO)
         4        0.6667           -0.4732266             -12.8772
      -------------------------------------------------------------
                  HL-Gap            0.0000000 Eh            0.0000 eV
             Fermi-level           -0.4738852 Eh          -12.8951 eV

 SCC (total)                   0 d,  0 h,  0 min,  0.001 sec
 SCC setup                      ...        0 min,  0.000 sec (  8.198%)
 Dispersion                     ...        0 min,  0.000 sec (  0.668%)
 integral evaluation            ...        0 min,  0.000 sec ( 10.628%)
 zeroth order Hamiltonian       ...        0 min,  0.000 sec (  0.774%)
 iterations                     ...        0 min,  0.001 sec ( 72.363%)
 molecular gradient             ...        0 min,  0.000 sec (  3.258%)
 printout                       ...        0 min,  0.000 sec (  3.124%)

         :::::::::::::::::::::::::::::::::::::::::::::::::::::
         ::                     SUMMARY                     ::
         :::::::::::::::::::::::::::::::::::::::::::::::::::::
         :: total energy              -1.795110518160 Eh    ::
         :: gradient norm              0.000000000000 Eh/a0 ::
         :: HOMO-LUMO gap              0.000000000000 eV    ::
         ::.................................................::
         :: SCC energy                -1.795110518160 Eh    ::
         :: -> isotropic ES           -0.025000000000 Eh    ::
         :: -> anisotropic ES          0.000000000000 Eh    ::
         :: -> anisotropic XC          0.000000000000 Eh    ::
         :: -> dispersion              0.000000000000 Eh    ::
         :: repulsion energy           0.000000000000 Eh    ::
         :: add. restraining           0.000000000000 Eh    ::
         :::::::::::::::::::::::::::::::::::::::::::::::::::::

      ----------------------------------------------------------- 
     |                   =====================                   |
     |                        A N C O P T                        |
     |                   =====================                   |
     |               Approximate Normal Coordinate               |
     |                Rational Function Optimizer                |
      ----------------------------------------------------------- 
================
 final structure:
================
1
 xtb: 6.2.2 (9d81278992624c895f80dd42a50cac0aa55982e2)
C         0.00000000000000    0.00000000000000    0.00000000000000

 Bond Distances (Angstroems)
 ---------------------------


 selected bond angles (degree)
 --------------------


 selected dihedral angles (degree)
 ---------------------------------

           -------------------------------------------------
          |                Final Singlepoint                |
           -------------------------------------------------

          ...................................................
          :                      SETUP                      :
          :.................................................:
          :  # basis functions                   4          :
          :  # atomic orbitals                   4          :
          :  # shells                            2          :
          :  # electrons                         4          :
          :  max. iterations                   250          :
          :  Hamiltonian                  GFN2-xTB          :
          :  restarted?                      false          :
          :  GBSA solvation                  false          :
          :  PC potential                    false          :
          :  electronic temp.          300.0000000     K    :
          :  accuracy                    1.0000000          :
          :  -> integral cutoff          0.2500000E+02      :
          :  -> integral neglect         0.1000000E-07      :
          :  -> SCF convergence          0.1000000E-05 Eh   :
          :  -> wf. convergence          0.1000000E-03 e    :
          :  Broyden damping             0.4000000          :
          ...................................................

 iter      E             dE          RMSdq      gap      omega  full diag
   1     -1.7951105 -0.179511E+01  0.593E-04    0.00       0.0  T
   2     -1.7951105  0.000000E+00  0.474E-04    0.00       0.0  T
   3     -1.7951105  0.000000E+00  0.365E-04    0.00       0.0  T

   *** convergence criteria satisfied after 3 iterations ***

         #    Occupation            Energy/Eh            Energy/eV
      -------------------------------------------------------------
         1        2.0000           -0.6918303             -18.8257
         2        0.6667           -0.4732314             -12.8773 (HOMO)
         3        0.6667           -0.4732314             -12.8773 (LUMO)
         4        0.6667           -0.4732314             -12.8773
      -------------------------------------------------------------
                  HL-Gap            0.0000000 Eh            0.0000 eV
             Fermi-level           -0.4738899 Eh          -12.8952 eV

 SCC (total)                   0 d,  0 h,  0 min,  0.000 sec
 SCC setup                      ...        0 min,  0.000 sec ( 19.399%)
 Dispersion                     ...        0 min,  0.000 sec (  1.184%)
 integral evaluation            ...        0 min,  0.000 sec ( 28.689%)
 zeroth order Hamiltonian       ...        0 min,  0.000 sec (  0.729%)
 iterations                     ...        0 min,  0.000 sec ( 35.519%)
 molecular gradient             ...        0 min,  0.000 sec (  3.461%)
 printout                       ...        0 min,  0.000 sec (  7.650%)

         :::::::::::::::::::::::::::::::::::::::::::::::::::::
         ::                     SUMMARY                     ::
         :::::::::::::::::::::::::::::::::::::::::::::::::::::
         :: total energy              -1.795110518160 Eh    ::
         :: gradient norm              0.000000000000 Eh/a0 ::
         :: HOMO-LUMO gap              0.000000000000 eV    ::
         ::.................................................::
         :: SCC energy                -1.795110518160 Eh    ::
         :: -> isotropic ES           -0.025000000000 Eh    ::
         :: -> anisotropic ES          0.000000000000 Eh    ::
         :: -> anisotropic XC          0.000000000000 Eh    ::
         :: -> dispersion              0.000000000000 Eh    ::
         :: repulsion energy           0.000000000000 Eh    ::
         :: add. restraining           0.000000000000 Eh    ::
         :::::::::::::::::::::::::::::::::::::::::::::::::::::

           ------------------------------------------------- 
          |                Numerical Hessian                |
           ------------------------------------------------- 
step length          :   0.00500
SCC accuracy         :   0.30000
Hessian scale factor :   1.00000
frozen atoms in %    :   0.00000    0
RMS gradient         :   0.00000

writing file <hessian>.

 vibrational frequencies (cm-1)
eigval :        0.00     0.00     0.00
           -------------------------------------------------
          |                Property Printout                |
           -------------------------------------------------

    * Orbital Energies and Occupations

         #    Occupation            Energy/Eh            Energy/eV
      -------------------------------------------------------------
Molecule has the following symmetry elements: (i) (Cinf) (sigma) 
It seems to be the Kh point group
         1        2.0000           -0.6918346             -18.8258
         2        0.6667           -0.4732337             -12.8773 (HOMO)
         3        0.6667           -0.4732337             -12.8773 (LUMO)
         4        0.6667           -0.4732337             -12.8773
      -------------------------------------------------------------
                  HL-Gap            0.0000000 Eh            0.0000 eV
             Fermi-level           -0.4738922 Eh          -12.8953 eV

     #   Z        covCN         q      C6AA      α(0)
     1   6 C      0.000    -0.000    49.264    12.336

 Mol. C6AA /au·bohr⁶  :         49.263764
 Mol. C8AA /au·bohr⁸  :       1424.793668
 Mol. α(0) /au        :         12.336204


Wiberg/Mayer (AO) data.
largest (>0.10) Wiberg bond orders for each atom
          total WBO             WBO to atom ...
     1  C   0.000    

MOs/occ written to file <molden.input>


molecular dipole:
                 x           y           z       tot (Debye)
 q only:        0.000       0.000       0.000
   full:        0.000       0.000       0.000       0.000
molecular quadrupole (traceless):
                xx          xy          yy          xz          yz          zz
 q only:        0.000       0.000       0.000       0.000       0.000       0.000
  q+dip:        0.000       0.000       0.000       0.000       0.000       0.000
   full:       -0.000       0.000       0.000       0.000       0.000       0.000

           -------------------------------------------------
          |                Geometry Summary                 |
           -------------------------------------------------

      molecular mass/u    :       12.0107359
   center of mass at/Å    :        0.0000000       0.0000000       0.0000000
  moments of inertia/u·Å² :        0.0000000E+00   0.0000000E+00   0.0000000E+00
rotational constants/cm⁻¹ :             Infinity        Infinity        Infinity

           -------------------------------------------------
          |               Frequency Printout                |
           -------------------------------------------------
 vibrational frequencies (cm-1)
eigval :        0.00     0.00     0.00
 reduced masses (amu)
   1: 12.01   2: 12.01   3: 12.01
 IR intensities (amu)
   1:  0.00   2:  0.00   3:  0.00
 Raman intensities (amu)
   1:  0.00   2:  0.00   3:  0.00
 output can be read by thermo (or use thermo option).
 writing <g98.out> molden fake output.
 recommended (thermochemical) frequency scaling factor: 1.0
           -------------------------------------------------
          |             Thermodynamic Functions             |
           -------------------------------------------------

Kh  symmetry found (for desy threshold:  0.10E+00) used in thermo

          ...................................................
          :                      SETUP                      :
          :.................................................:
          :  # frequencies                           0      :
          :  # imaginary freq.                       0      :
          :  linear?                              true      :
          :  only rotor calc.                     true      :
          :  symmetry                               Kh      :
          :  rotational number                       1      :
          :  scaling factor                  1.0000000      :
          :  rotor cutoff                   50.0000000 cm⁻¹ :
          :  imag. cutoff                  -20.0000000 cm⁻¹ :
          :.................................................:

    mode    ω/cm⁻¹     T·S(HO)/kcal·mol⁻¹    T·S(FR)/kcal·mol⁻¹   T·S(vib)
   ------------------------------------------------------------------------
   ------------------------------------------------------------------------

   temp. (K)  partition function   enthalpy   heat capacity  entropy
                                   cal/mol     cal/K/mol   cal/K/mol   J/K/mol
 298.15  VIB   1.00                    0.000      0.000      0.000
         ROT   1.00                    0.000      0.000      0.000
         INT   1.00                    0.000      0.000      0.000
         TR   0.403E+26             1481.254      4.968     33.385
         TOT                        1481.2539     4.9681    33.3855   139.6848

   temp. (K)  partition function   enthalpy   heat capacity  entropy
                                   cal/mol     cal/K/mol   cal/K/mol   J/K/mol
 120.00  VIB   1.00                    0.000      0.000      0.000
         ROT   1.00                    0.000      0.000      0.000
         INT   1.00                    0.000      0.000      0.000
         TR   0.103E+26              596.178      4.968     28.866
         TOT                         596.1780     4.9681    28.8661   120.7759

   temp. (K)  partition function   enthalpy   heat capacity  entropy
                                   cal/mol     cal/K/mol   cal/K/mol   J/K/mol
 100.00  VIB   1.00                    0.000      0.000      0.000
         ROT   1.00                    0.000      0.000      0.000
         INT   1.00                    0.000      0.000      0.000
         TR   0.782E+25              496.815      4.968     27.961
         TOT                         496.8150     4.9681    27.9608   116.9879

   temp. (K)  partition function   enthalpy   heat capacity  entropy
                                   cal/mol     cal/K/mol   cal/K/mol   J/K/mol
  80.00  VIB   1.00                    0.000      0.000      0.000
         ROT   1.00                    0.000      0.000      0.000
         INT   1.00                    0.000      0.000      0.000
         TR   0.560E+25              397.452      4.968     26.853
         TOT                         397.4520     4.9681    26.8527   112.3517

   temp. (K)  partition function   enthalpy   heat capacity  entropy
                                   cal/mol     cal/K/mol   cal/K/mol   J/K/mol
  60.00  VIB   1.00                    0.000      0.000      0.000
         ROT   1.00                    0.000      0.000      0.000
         INT   1.00                    0.000      0.000      0.000
         TR   0.364E+25              298.089      4.968     25.424
         TOT                         298.0890     4.9681    25.4242   106.3747

   temp. (K)  partition function   enthalpy   heat capacity  entropy
                                   cal/mol     cal/K/mol   cal/K/mol   J/K/mol
  40.00  VIB   1.00                    0.000      0.000      0.000
         ROT   1.00                    0.000      0.000      0.000
         INT   1.00                    0.000      0.000      0.000
         TR   0.198E+25              198.726      4.968     23.411
         TOT                         198.7260     4.9681    23.4107    97.9505

   temp. (K)  partition function   enthalpy   heat capacity  entropy
                                   cal/mol     cal/K/mol   cal/K/mol   J/K/mol
  20.00  VIB   1.00                    0.000      0.000      0.000
         ROT   1.00                    0.000      0.000      0.000
         INT   1.00                    0.000      0.000      0.000
         TR   0.700E+24               99.363      4.968     19.969
         TOT                          99.3630     4.9681    19.9688    83.5493

   temp. (K)  partition function   enthalpy   heat capacity  entropy
                                   cal/mol     cal/K/mol   cal/K/mol   J/K/mol
  10.00  VIB   1.00                    0.000      0.000      0.000
         ROT   1.00                    0.000      0.000      0.000
         INT   1.00                    0.000      0.000      0.000
         TR   0.247E+24               49.681      4.968     16.527
         TOT                          49.6815     4.9681    16.5268    69.1480

       T/K    H(0)-H(T)+PV         H(T)/Eh          T*S/Eh         G(T)/Eh
   ------------------------------------------------------------------------
    298.15    0.236053E-02    0.236053E-02    0.158625E-01   -0.135020E-01
    120.00    0.950070E-03    0.950070E-03    0.552013E-02   -0.457006E-02
    100.00    0.791725E-03    0.791725E-03    0.445583E-02   -0.366411E-02
     80.00    0.633380E-03    0.633380E-03    0.342340E-02   -0.279002E-02
     60.00    0.475035E-03    0.475035E-03    0.243096E-02   -0.195592E-02
     40.00    0.316690E-03    0.316690E-03    0.149230E-02   -0.117561E-02
     20.00    0.158345E-03    0.158345E-03    0.636445E-03   -0.478100E-03
     10.00    0.791725E-04    0.791725E-04    0.263371E-03   -0.184198E-03 (used)
   ------------------------------------------------------------------------

         :::::::::::::::::::::::::::::::::::::::::::::::::::::
         ::                  THERMODYNAMIC                  ::
         :::::::::::::::::::::::::::::::::::::::::::::::::::::
         :: total free energy          -1.795294716644 Eh   ::
         ::.................................................::
         :: total energy               -1.795110518160 Eh   ::
         :: zero point energy           0.000000000000 Eh   ::
         :: G(RRHO) w/o ZPVE           -0.000184198484 Eh   ::
         :: G(RRHO) contrib.           -0.000184198484 Eh   ::
         :::::::::::::::::::::::::::::::::::::::::::::::::::::

optimized geometry written to: xtbopt.xyz


           -------------------------------------------------
          | TOTAL ENERGY               -1.795110518160 Eh   |
          | TOTAL ENTHALPY             -1.795031345650 Eh   |
          | TOTAL FREE ENERGY          -1.795294716644 Eh   |
          | GRADIENT NORM               0.000000000000 Eh/α |
          | HOMO-LUMO GAP               0.000000000000 eV   |
           -------------------------------------------------

------------------------------------------------------------------------
 * finished run on 2020/05/13 at 16:22:14.369     
------------------------------------------------------------------------
 total:
 * wall-time:     0 d,  0 h,  0 min,  0.018 sec
 *  cpu-time:     0 d,  0 h,  0 min,  0.018 sec
 * ratio c/w:     0.989 speedup
 SCF:
 * wall-time:     0 d,  0 h,  0 min,  0.001 sec
 *  cpu-time:     0 d,  0 h,  0 min,  0.001 sec
 * ratio c/w:     1.000 speedup
 ANC optimizer:
 * wall-time:     0 d,  0 h,  0 min,  0.001 sec
 *  cpu-time:     0 d,  0 h,  0 min,  0.001 sec
 * ratio c/w:     1.001 speedup
 numerical hessian:
 * wall-time:     0 d,  0 h,  0 min,  0.001 sec
 *  cpu-time:     0 d,  0 h,  0 min,  0.001 sec
 * ratio c/w:     0.999 speedup

