      -----------------------------------------------------------      
     |                   =====================                   |     
     |                           x T B                           |     
     |                   =====================                   |     
     |                         S. Grimme                         |     
     |          Mulliken Center for Theoretical Chemistry        |     
     |                    University of Bonn                     |     
      -----------------------------------------------------------      

   * xtb version 6.2.2 (9d81278992624c895f80dd42a50cac0aa55982e2) compiled by '@Darwin' on 04/03/2020

   xtb is free software: you can redistribute it and/or modify it under
   the terms of the GNU Lesser General Public License as published by
   the Free Software Foundation, either version 3 of the License, or
   (at your option) any later version.
   
   xtb is distributed in the hope that it will be useful,
   but WITHOUT ANY WARRANTY; without even the implied warranty of
   MERCHANTABILITY or FITNESS FOR A PARTICULAR PURPOSE.  See the
   GNU Lesser General Public License for more details.
   
   Cite this work as:
   * S. Grimme, C. Bannwarth, P. Shushkov, J. Chem. Theory Comput., 2017,
     13, 1989-2009. DOI: 10.1021/acs.jctc.7b00118
   * C. Bannwarth, S. Ehlert and S. Grimme., J. Chem. Theory Comput., 2019,
     15, 1652-1671. DOI: 10.1021/acs.jctc.8b01176
   * P. Pracht, E. Caldeweyher, S. Ehlert, S. Grimme, ChemRxiv, 2019, preprint.
     DOI: 10.26434/chemrxiv.8326202.v1
   
   for DFT-D4:
   * E. Caldeweyher, C. Bannwarth and S. Grimme, J. Chem. Phys., 2017,
     147, 034112. DOI: 10.1063/1.4993215
   * E. Caldeweyher, S. Ehlert, A. Hansen, H. Neugebauer, S. Spicher,
     C. Bannwarth and S. Grimme, J. Chem. Phys., 2019, 150, 154122.
     DOI: 10.1063/1.5090222
   
   for sTDA-xTB:
   * S. Grimme and C. Bannwarth, J. Chem. Phys., 2016, 145, 054103.
     DOI: 10.1063/1.4959605
   
   in the mass-spec context:
   * V. Asgeirsson, C. Bauer and S. Grimme, Chem. Sci., 2017, 8, 4879.
     DOI: 10.1039/c7sc00601b
   
   for metadynamics refer to:
   * S. Grimme, J. Chem. Theory Comput., 2019, 155, 2847-2862
     DOI: 10.1021/acs.jctc.9b00143
   
   with help from (in alphabetical order)
   C. Bannwarth, F. Bohle, G. Brandenburg, E. Caldeweyher, M. Checinski,
   S. Dohm, S. Ehlert, S. Ehrlich, F. März, H. Neugebauer, J. Pisarek,
   P. Pracht, P. Shushkov, and S. Spicher.
   
 * started run on 2020/05/12 at 11:44:33.940     

           -------------------------------------------------
          |                Calculation Setup                |
           -------------------------------------------------

          program call               : xtb --input C5_6_S_2.input C5_6_S_2.xyz --ohess --molden --namespace C5_6_S_2 output.out
          calculation namespace      : C5_6_S_2
          coordinate file            : C5_6_S_2.xyz
          number of atoms            :                     5
          number of electrons        :                    20
          charge                     :                     0
          spin                       :                   1.0
          first test random number   :      0.07613978852980

   ID    Z sym.   atoms
    1    6 C      1-5

           -------------------------------------------------
          |                 G F N 2 - x T B                 |
           -------------------------------------------------

        Reference                      10.1021/acs.jctc.8b01176
      * Hamiltonian:
        H0-scaling (s, p, d)           1.850000    2.230000    2.230000
        zeta-weighting                 0.500000
      * Dispersion:
        s8                             2.700000
        a1                             0.520000
        a2                             5.000000
        s9                             5.000000
      * Repulsion:
        kExp                           1.500000    1.000000
        rExp                           1.000000
      * Coulomb:
        alpha                          2.000000
        third order                    shell-resolved
        anisotropic                    true
        a3                             3.000000
        a5                             4.000000
        cn-shift                       1.200000
        cn-exp                         4.000000
        max-rad                        5.000000


          ...................................................
          :                      SETUP                      :
          :.................................................:
          :  # basis functions                  20          :
          :  # atomic orbitals                  20          :
          :  # shells                           10          :
          :  # electrons                        20          :
          :  max. iterations                   250          :
          :  Hamiltonian                  GFN2-xTB          :
          :  restarted?                      false          :
          :  GBSA solvation                  false          :
          :  PC potential                    false          :
          :  electronic temp.          300.0000000     K    :
          :  accuracy                    1.0000000          :
          :  -> integral cutoff          0.2500000E+02      :
          :  -> integral neglect         0.1000000E-07      :
          :  -> SCF convergence          0.1000000E-05 Eh   :
          :  -> wf. convergence          0.1000000E-03 e    :
          :  Broyden damping             0.4000000          :
          ...................................................

 iter      E             dE          RMSdq      gap      omega  full diag
   1     -9.9640107 -0.996401E+01  0.116E+01    0.80       0.0  T
   2     -6.9639502  0.300006E+01  0.161E+01    0.71       1.0  T
   3     -7.2444116 -0.280461E+00  0.141E+01    0.41       1.0  T
   4     -9.9399265 -0.269551E+01  0.725E+00    0.95       1.0  T
   5     -9.9677714 -0.278449E-01  0.570E+00    0.71       1.0  T
   6    -10.0759482 -0.108177E+00  0.424E+00    0.85       1.0  T
   7    -10.1073855 -0.314373E-01  0.337E+00    0.82       1.0  T
   8    -10.1174479 -0.100624E-01  0.305E+00    0.80       1.0  T
   9    -10.1152150  0.223292E-02  0.320E+00    0.80       1.0  T
  10    -10.1288210 -0.136060E-01  0.244E+00    0.79       1.0  T
  11    -10.1382743 -0.945331E-02  0.120E+00    0.75       1.0  T
  12    -10.1372808  0.993526E-03  0.748E-01    0.75       1.0  T
  13    -10.1371482  0.132578E-03  0.712E-01    0.73       1.0  T
  14    -10.1393817 -0.223354E-02  0.311E-01    0.73       1.0  T
  15    -10.1397415 -0.359750E-03  0.144E-01    0.73       1.0  T
  16    -10.1398502 -0.108737E-03  0.412E-02    0.73       1.1  T
  17    -10.1398556 -0.539545E-05  0.267E-02    0.73       1.7  T
  18    -10.1398595 -0.390823E-05  0.809E-03    0.73       5.5  T
  19    -10.1398599 -0.351375E-06  0.159E-03    0.73      28.1  T
  20    -10.1398599 -0.115290E-07  0.704E-04    0.73      63.5  T
  21    -10.1398599 -0.142251E-08  0.469E-04    0.73      95.3  T

   *** convergence criteria satisfied after 21 iterations ***

         #    Occupation            Energy/Eh            Energy/eV
      -------------------------------------------------------------
         1        2.0000           -0.7247407             -19.7212
       ...           ...                  ...                  ...
         5        2.0000           -0.5613004             -15.2738
         6        2.0000           -0.5155617             -14.0291
         7        2.0000           -0.5057424             -13.7620
         8        2.0000           -0.4861562             -13.2290
         9        1.7545           -0.4446101             -12.0985
        10        1.2455           -0.4424770             -12.0404
        11        1.0000           -0.4308608             -11.7243 (HOMO)
        12        0.0000           -0.4039412             -10.9918 (LUMO)
        13                         -0.3598163              -9.7911
        14                         -0.3353123              -9.1243
        15                         -0.3175866              -8.6420
        16                         -0.1271479              -3.4599
       ...                                ...                  ...
        20                          0.1384250               3.7667
      -------------------------------------------------------------
                  HL-Gap            0.0269196 Eh            0.7325 eV
             Fermi-level           -0.4304723 Eh          -11.7137 eV

 transition dipole moment (au) for excitation:          10          11
     X       Y       Z   
  -0.1754  -0.0723  -0.1760  total (au/Debye):    0.259   0.658
 dE (eV)             :    0.316
 oscillator strength :  0.73339E-03

 SCC (total)                   0 d,  0 h,  0 min,  0.006 sec
 SCC setup                      ...        0 min,  0.000 sec (  1.358%)
 Dispersion                     ...        0 min,  0.000 sec (  0.320%)
 integral evaluation            ...        0 min,  0.001 sec ( 21.994%)
 zeroth order Hamiltonian       ...        0 min,  0.000 sec (  0.339%)
 iterations                     ...        0 min,  0.002 sec ( 37.506%)
 molecular gradient             ...        0 min,  0.001 sec ( 21.681%)
 printout                       ...        0 min,  0.001 sec ( 16.647%)

         :::::::::::::::::::::::::::::::::::::::::::::::::::::
         ::                     SUMMARY                     ::
         :::::::::::::::::::::::::::::::::::::::::::::::::::::
         :: total energy             -10.065343718190 Eh    ::
         :: gradient norm              0.310038086918 Eh/a0 ::
         :: HOMO-LUMO gap              0.732520121050 eV    ::
         ::.................................................::
         :: SCC energy               -10.139859871460 Eh    ::
         :: -> isotropic ES           -0.025387886624 Eh    ::
         :: -> anisotropic ES         -0.000413737505 Eh    ::
         :: -> anisotropic XC          0.008170817551 Eh    ::
         :: -> dispersion             -0.002959585674 Eh    ::
         :: repulsion energy           0.074516143341 Eh    ::
         :: add. restraining           0.000000000000 Eh    ::
         :::::::::::::::::::::::::::::::::::::::::::::::::::::

      ----------------------------------------------------------- 
     |                   =====================                   |
     |                        A N C O P T                        |
     |                   =====================                   |
     |               Approximate Normal Coordinate               |
     |                Rational Function Optimizer                |
      ----------------------------------------------------------- 

          ...................................................
          :                      SETUP                      :
          :.................................................:
          :   optimization level            normal          :
          :   max. optcycles                   200          :
          :   ANC micro-cycles                  20          :
          :   degrees of freedom                 9          :
          :.................................................:
          :   RF solver                   davidson          :
          :   write xtbopt.log                true          :
          :   linear?                        false          :
          :   energy convergence         0.5000000E-05 Eh   :
          :   grad. convergence          0.1000000E-02 Eh/α :
          :   maximium RF displ.         1.0000000          :
          :   Hlow (freq-cutoff)         0.1000000E-01      :
          :   Hmax (freq-cutoff)         5.0000000          :
          :   S6 in model hess.         20.0000000          :
          ...................................................

generating ANC from model Hessian ...
Using Lindh-Hessian (1995)
 Shifting diagonal of input Hessian by    1.7807401863633721E-003
 Lowest  eigenvalues of input Hessian
   -0.000000   -0.000000   -0.000000    0.000000    0.000000    0.000000
    0.010000    0.038206    0.068376    0.085375    0.639688    0.698103
    0.765230    0.948235    1.284997
 Highest eigenvalues
    0.085375    0.639688    0.698103    0.765230    0.948235    1.284997


........................................................................
.............................. CYCLE    1 ..............................
........................................................................
   1    -10.1398599 -0.101399E+02  0.212E-04    0.73       0.0  T
   2    -10.1398598  0.562076E-07  0.246E-03    0.73      18.2  T
   3    -10.1398599 -0.542462E-07  0.507E-04    0.73      88.3  T
   4    -10.1398599 -0.179909E-08  0.232E-04    0.73     192.8  T
     SCC iter.                  ...        0 min,  0.000 sec
     gradient                   ...        0 min,  0.001 sec
 * total energy  :   -10.0653437 Eh     change       -0.9878658E-09 Eh
   gradient norm :     0.3100367 Eh/α   predicted     0.0000000E+00 (-100.00%)
   displ. norm   :     0.3919276 α      lambda       -0.1130066E+00
   maximum displ.:     0.2820984 α      in ANC's #7, #5, #4, ...

........................................................................
.............................. CYCLE    2 ..............................
........................................................................
   1    -10.2195120 -0.102195E+02  0.393E+00    1.15       0.0  T
   2     -9.0201972  0.119931E+01  0.918E+00    0.62       1.0  T
   3    -10.2101572 -0.118996E+01  0.313E+00    1.15       1.0  T
   4    -10.2813726 -0.712154E-01  0.184E+00    1.14       1.0  T
   5    -10.2945098 -0.131372E-01  0.105E+00    1.14       1.0  T
   6    -10.2981719 -0.366211E-02  0.746E-01    1.15       1.0  T
   7    -10.2980228  0.149034E-03  0.736E-01    1.14       1.0  T
   8    -10.2981578 -0.134952E-03  0.409E-01    1.14       1.0  T
   9    -10.2945243  0.363349E-02  0.841E-01    1.15       1.0  T
  10    -10.2929988  0.152551E-02  0.959E-01    1.15       1.0  T
  11    -10.2988061 -0.580726E-02  0.241E-01    1.15       1.0  T
  12    -10.2991686 -0.362564E-03  0.816E-03    1.15       5.5  T
  13    -10.2991540  0.146275E-04  0.453E-02    1.15       1.0  T
  14    -10.2991687 -0.147103E-04  0.489E-03    1.15       9.1  T
  15    -10.2991687 -0.272156E-07  0.369E-03    1.15      12.1  T
  16    -10.2991688 -0.443890E-07  0.528E-04    1.15      84.7  T
  17    -10.2991688  0.394224E-08  0.796E-04    1.15      56.2  T
     SCC iter.                  ...        0 min,  0.002 sec
     gradient                   ...        0 min,  0.001 sec
 * total energy  :   -10.1633126 Eh     change       -0.9796891E-01 Eh
   gradient norm :     0.2088072 Eh/α   predicted    -0.6518262E-01 ( -33.47%)
   displ. norm   :     0.5926494 α      lambda       -0.1133718E+00
   maximum displ.:     0.4177037 α      in ANC's #7, #4, #5, ...

........................................................................
.............................. CYCLE    3 ..............................
........................................................................
   1    -10.4624558 -0.104625E+02  0.366E+00    1.61       0.0  T
   2     -9.8175194  0.644936E+00  0.706E+00    0.46       1.0  T
   3    -10.4588973 -0.641378E+00  0.266E+00    1.49       1.0  T
   4    -10.5080832 -0.491859E-01  0.165E+00    1.68       1.0  T
   5    -10.5132826 -0.519943E-02  0.106E+00    1.61       1.0  T
   6    -10.5134040 -0.121352E-03  0.991E-01    1.61       1.0  T
   7    -10.5104545  0.294941E-02  0.698E-01    1.63       1.0  T
   8    -10.5137915 -0.333697E-02  0.472E-01    1.56       1.0  T
   9    -10.5139624 -0.170918E-03  0.377E-01    1.56       1.0  T
  10    -10.5142014 -0.238979E-03  0.301E-01    1.57       1.0  T
  11    -10.5145022 -0.300824E-03  0.487E-02    1.57       1.0  T
  12    -10.5145038 -0.152255E-05  0.377E-02    1.57       1.2  T
  13    -10.5145083 -0.456235E-05  0.436E-03    1.57      10.2  T
  14    -10.5145084 -0.494692E-07  0.281E-03    1.57      15.9  T
  15    -10.5145084 -0.231283E-07  0.165E-04    1.57     271.6  T
  16    -10.5145084 -0.544915E-10  0.114E-04    1.57     390.7  T
     SCC iter.                  ...        0 min,  0.002 sec
     gradient                   ...        0 min,  0.001 sec
 * total energy  :   -10.1951655 Eh     change       -0.3185287E-01 Eh
   gradient norm :     0.3808522 Eh/α   predicted    -0.7659587E-01 ( 140.47%)
   displ. norm   :     0.4426276 α      lambda       -0.9349578E-01
   maximum displ.:     0.2671292 α      in ANC's #2, #4, #3, ...

........................................................................
.............................. CYCLE    4 ..............................
........................................................................
   1    -10.4286597 -0.104287E+02  0.231E+00    1.66       0.0  T
   2    -10.0333829  0.395277E+00  0.552E+00    1.42       1.0  T
   3    -10.4074840 -0.374101E+00  0.190E+00    1.53       1.0  T
   4    -10.4327171 -0.252331E-01  0.152E+00    1.69       1.0  T
   5    -10.4378124 -0.509537E-02  0.764E-01    1.70       1.0  T
   6    -10.4410720 -0.325961E-02  0.528E-01    1.65       1.0  T
   7    -10.4418492 -0.777177E-03  0.436E-01    1.66       1.0  T
   8    -10.4429801 -0.113093E-02  0.140E-01    1.67       1.0  T
   9    -10.4429286  0.515826E-04  0.136E-01    1.67       1.0  T
  10    -10.4428063  0.122260E-03  0.410E-01    1.66       1.0  T
  11    -10.4430115 -0.205246E-03  0.226E-02    1.67       2.0  T
  12    -10.4430130 -0.143069E-05  0.991E-03    1.67       4.5  T
  13    -10.4430131 -0.134438E-06  0.105E-03    1.67      42.6  T
  14    -10.4430131 -0.398415E-08  0.690E-04    1.67      64.8  T
  15    -10.4430131 -0.700503E-09  0.490E-05    1.67     912.9  T
     SCC iter.                  ...        0 min,  0.002 sec
     gradient                   ...        0 min,  0.001 sec
 * total energy  :   -10.2305139 Eh     change       -0.3534839E-01 Eh
   gradient norm :     0.1070599 Eh/α   predicted    -0.5590670E-01 (  58.16%)
   displ. norm   :     0.4155158 α      lambda       -0.1513667E-01
   maximum displ.:     0.3493539 α      in ANC's #1, #2, #4, ...

........................................................................
.............................. CYCLE    5 ..............................
........................................................................
   1    -10.4361116 -0.104361E+02  0.178E+00    1.61       0.0  T
   2    -10.4144062  0.217054E-01  0.150E+00    1.63       1.0  T
   3    -10.3592347  0.551715E-01  0.274E+00    1.52       1.0  T
   4    -10.4263162 -0.670814E-01  0.124E+00    1.60       1.0  T
   5    -10.4316312 -0.531501E-02  0.744E-01    1.61       1.0  T
   6    -10.4351697 -0.353846E-02  0.521E-01    1.63       1.0  T
   7    -10.4355350 -0.365363E-03  0.432E-01    1.62       1.0  T
   8    -10.4364361 -0.901040E-03  0.281E-01    1.62       1.0  T
   9    -10.4367537 -0.317638E-03  0.120E-01    1.63       1.0  T
  10    -10.4368348 -0.810641E-04  0.417E-02    1.63       1.1  T
  11    -10.4368389 -0.410453E-05  0.155E-02    1.63       2.9  T
  12    -10.4368401 -0.123242E-05  0.580E-03    1.63       7.7  T
  13    -10.4368404 -0.257275E-06  0.304E-04    1.63     147.2  T
  14    -10.4368404  0.124714E-09  0.188E-04    1.63     238.3  T
     SCC iter.                  ...        0 min,  0.001 sec
     gradient                   ...        0 min,  0.001 sec
 * total energy  :   -10.2363045 Eh     change       -0.5790576E-02 Eh
   gradient norm :     0.0691136 Eh/α   predicted    -0.8875036E-02 (  53.27%)
   displ. norm   :     0.2338679 α      lambda       -0.8147663E-02
   maximum displ.:     0.1246032 α      in ANC's #1, #7, #5, ...

........................................................................
.............................. CYCLE    6 ..............................
........................................................................
   1    -10.4583953 -0.104584E+02  0.794E-01    1.62       0.0  T
   2    -10.4336039  0.247914E-01  0.146E+00    1.61       1.0  T
   3    -10.4572507 -0.236468E-01  0.567E-01    1.62       1.0  T
   4    -10.4583467 -0.109595E-02  0.287E-01    1.62       1.0  T
   5    -10.4589622 -0.615590E-03  0.190E-01    1.62       1.0  T
   6    -10.4590395 -0.772625E-04  0.156E-01    1.62       1.0  T
   7    -10.4590713 -0.317730E-04  0.143E-01    1.62       1.0  T
   8    -10.4592250 -0.153693E-03  0.410E-02    1.62       1.1  T
   9    -10.4592293 -0.429578E-05  0.342E-02    1.62       1.3  T
  10    -10.4592380 -0.871450E-05  0.932E-03    1.62       4.8  T
  11    -10.4592388 -0.834121E-06  0.504E-04    1.62      88.8  T
  12    -10.4592388 -0.933809E-09  0.266E-04    1.62     168.4  T
     SCC iter.                  ...        0 min,  0.001 sec
     gradient                   ...        0 min,  0.001 sec
 * total energy  :   -10.2405603 Eh     change       -0.4255785E-02 Eh
   gradient norm :     0.0292501 Eh/α   predicted    -0.4296647E-02 (   0.96%)
   displ. norm   :     0.2572162 α      lambda       -0.4493610E-02
   maximum displ.:     0.1546399 α      in ANC's #1, #4, #2, ...

........................................................................
.............................. CYCLE    7 ..............................
........................................................................
   1    -10.4756037 -0.104756E+02  0.102E+00    1.74       0.0  T
   2    -10.4716126  0.399107E-02  0.781E-01    1.73       1.0  T
   3    -10.4573559  0.142567E-01  0.129E+00    1.69       1.0  T
   4    -10.4745266 -0.171708E-01  0.421E-01    1.73       1.0  T
   5    -10.4757775 -0.125084E-02  0.164E-01    1.73       1.0  T
   6    -10.4759706 -0.193110E-03  0.112E-01    1.73       1.0  T
   7    -10.4759811 -0.104882E-04  0.102E-01    1.73       1.0  T
   8    -10.4759952 -0.140926E-04  0.470E-02    1.73       1.0  T
   9    -10.4760210 -0.258207E-04  0.114E-02    1.73       3.9  T
  10    -10.4760207  0.311520E-06  0.779E-03    1.73       5.7  T
  11    -10.4760212 -0.471010E-06  0.220E-04    1.73     203.0  T
  12    -10.4760212 -0.400924E-11  0.140E-04    1.73     320.3  T
     SCC iter.                  ...        0 min,  0.001 sec
     gradient                   ...        0 min,  0.001 sec
 * total energy  :   -10.2407256 Eh     change       -0.1653056E-03 Eh
   gradient norm :     0.0636824 Eh/α   predicted    -0.2395452E-02 (1349.11%)
   displ. norm   :     0.0942954 α      lambda       -0.3511008E-02
   maximum displ.:     0.0869570 α      in ANC's #4, #8, #1, ...

........................................................................
.............................. CYCLE    8 ..............................
........................................................................
   1    -10.4610597 -0.104611E+02  0.355E-01    1.79       0.0  T
   2    -10.4599123  0.114737E-02  0.345E-01    1.81       1.0  T
   3    -10.4588226  0.108976E-02  0.465E-01    1.79       1.0  T
   4    -10.4608895 -0.206691E-02  0.181E-01    1.79       1.0  T
   5    -10.4610645 -0.174980E-03  0.102E-01    1.80       1.0  T
   6    -10.4611379 -0.734887E-04  0.439E-02    1.80       1.0  T
   7    -10.4611456 -0.761612E-05  0.343E-02    1.80       1.3  T
   8    -10.4611495 -0.394392E-05  0.175E-02    1.80       2.6  T
   9    -10.4611501 -0.561008E-06  0.463E-03    1.80       9.7  T
  10    -10.4611500  0.180843E-07  0.442E-03    1.80      10.1  T
  11    -10.4611502 -0.192136E-06  0.278E-04    1.80     160.6  T
  12    -10.4611502 -0.508528E-09  0.756E-05    1.80     591.4  T
     SCC iter.                  ...        0 min,  0.001 sec
     gradient                   ...        0 min,  0.001 sec
 * total energy  :   -10.2423625 Eh     change       -0.1636926E-02 Eh
   gradient norm :     0.0202396 Eh/α   predicted    -0.1771114E-02 (   8.20%)
   displ. norm   :     0.1059386 α      lambda       -0.8563651E-03
   maximum displ.:     0.0610025 α      in ANC's #2, #1, #3, ...

........................................................................
.............................. CYCLE    9 ..............................
........................................................................
   1    -10.4716902 -0.104717E+02  0.455E-01    1.81       0.0  T
   2    -10.4714666  0.223593E-03  0.292E-01    1.81       1.0  T
   3    -10.4161187  0.553479E-01  0.214E+00    1.81       1.0  T
   4    -10.4714139 -0.552952E-01  0.262E-01    1.80       1.0  T
   5    -10.4716191 -0.205211E-03  0.130E-01    1.81       1.0  T
   6    -10.4717479 -0.128829E-03  0.499E-02    1.81       1.0  T
   7    -10.4717391  0.876225E-05  0.520E-02    1.81       1.0  T
   8    -10.4717537 -0.145247E-04  0.385E-02    1.81       1.2  T
   9    -10.4717540 -0.334339E-06  0.341E-02    1.81       1.3  T
  10    -10.4717568 -0.282019E-05  0.297E-02    1.81       1.5  T
  11    -10.4717613 -0.443304E-05  0.204E-02    1.81       2.2  T
  12    -10.4717639 -0.261554E-05  0.118E-02    1.81       3.8  T
  13    -10.4717652 -0.129782E-05  0.143E-03    1.81      31.4  T
  14    -10.4717652 -0.181257E-07  0.140E-04    1.81     320.6  T
  15    -10.4717652 -0.124844E-09  0.250E-05    1.81    1789.8  T
     SCC iter.                  ...        0 min,  0.001 sec
     gradient                   ...        0 min,  0.001 sec
 * total energy  :   -10.2423245 Eh     change        0.3797436E-04 Eh
   gradient norm :     0.0217630 Eh/α   predicted    -0.4329865E-03 (*******%)
   displ. norm   :     0.1056612 α      lambda       -0.6466077E-03
   maximum displ.:     0.0909374 α      in ANC's #1, #2, #3, ...

........................................................................
.............................. CYCLE   10 ..............................
........................................................................
   1    -10.4668625 -0.104669E+02  0.437E-01    1.82       0.0  T
   2    -10.4631430  0.371946E-02  0.548E-01    1.82       1.0  T
   3    -10.4627839  0.359134E-03  0.615E-01    1.82       1.0  T
   4    -10.4659827 -0.319880E-02  0.318E-01    1.82       1.0  T
   5    -10.4665047 -0.521981E-03  0.200E-01    1.82       1.0  T
   6    -10.4667064 -0.201764E-03  0.158E-01    1.82       1.0  T
   7    -10.4667398 -0.333338E-04  0.144E-01    1.82       1.0  T
   8    -10.4669263 -0.186553E-03  0.392E-02    1.82       1.1  T
   9    -10.4669392 -0.128752E-04  0.722E-03    1.83       6.2  T
  10    -10.4669370  0.224435E-05  0.171E-02    1.82       2.6  T
  11    -10.4669396 -0.266403E-05  0.706E-04    1.83      63.3  T
  12    -10.4669396 -0.405167E-08  0.239E-04    1.83     187.4  T
  13    -10.4669396 -0.583412E-09  0.133E-05    1.83    3363.0  T
     SCC iter.                  ...        0 min,  0.001 sec
     gradient                   ...        0 min,  0.001 sec
 * total energy  :   -10.2427350 Eh     change       -0.4105224E-03 Eh
   gradient norm :     0.0055278 Eh/α   predicted    -0.3269121E-03 ( -20.37%)
   displ. norm   :     0.0832622 α      lambda       -0.1562260E-03
   maximum displ.:     0.0784585 α      in ANC's #1, #2, #5, ...

........................................................................
.............................. CYCLE   11 ..............................
........................................................................
   1    -10.4652153 -0.104652E+02  0.314E-01    1.83       0.0  T
   2    -10.4649407  0.274670E-03  0.218E-01    1.83       1.0  T
   3    -10.4614490  0.349167E-02  0.542E-01    1.82       1.0  T
   4    -10.4648580 -0.340903E-02  0.174E-01    1.83       1.0  T
   5    -10.4651824 -0.324320E-03  0.645E-02    1.83       1.0  T
   6    -10.4652103 -0.279800E-04  0.454E-02    1.83       1.0  T
   7    -10.4652134 -0.302356E-05  0.397E-02    1.83       1.1  T
   8    -10.4652271 -0.137373E-04  0.849E-03    1.83       5.3  T
   9    -10.4652276 -0.465577E-06  0.164E-03    1.83      27.3  T
  10    -10.4652276  0.703372E-08  0.127E-03    1.83      35.1  T
  11    -10.4652276 -0.127176E-07  0.253E-04    1.83     176.9  T
  12    -10.4652276 -0.433644E-09  0.902E-05    1.83     495.9  T
     SCC iter.                  ...        0 min,  0.001 sec
     gradient                   ...        0 min,  0.001 sec
 * total energy  :   -10.2428338 Eh     change       -0.9875238E-04 Eh
   gradient norm :     0.0091857 Eh/α   predicted    -0.7865410E-04 ( -20.35%)
   displ. norm   :     0.0483798 α      lambda       -0.9192168E-04
   maximum displ.:     0.0432396 α      in ANC's #1, #6, #2, ...

........................................................................
.............................. CYCLE   12 ..............................
........................................................................
   1    -10.4664640 -0.104665E+02  0.166E-01    1.85       0.0  T
   2    -10.4660837  0.380359E-03  0.183E-01    1.85       1.0  T
   3    -10.4655941  0.489559E-03  0.266E-01    1.84       1.0  T
   4    -10.4664278 -0.833641E-03  0.638E-02    1.85       1.0  T
   5    -10.4664638 -0.360146E-04  0.351E-02    1.85       1.3  T
   6    -10.4664673 -0.351266E-05  0.296E-02    1.85       1.5  T
   7    -10.4664700 -0.267290E-05  0.246E-02    1.85       1.8  T
   8    -10.4664757 -0.575630E-05  0.171E-03    1.85      26.1  T
   9    -10.4664757  0.117669E-08  0.165E-03    1.85      27.1  T
  10    -10.4664757 -0.169583E-07  0.291E-04    1.85     153.5  T
  11    -10.4664757 -0.601691E-09  0.139E-04    1.85     321.8  T
     SCC iter.                  ...        0 min,  0.001 sec
     gradient                   ...        0 min,  0.001 sec
 * total energy  :   -10.2428989 Eh     change       -0.6512097E-04 Eh
   gradient norm :     0.0067470 Eh/α   predicted    -0.4606666E-04 ( -29.26%)
   displ. norm   :     0.0454153 α      lambda       -0.5319736E-04
   maximum displ.:     0.0400144 α      in ANC's #1, #3, #2, ...

........................................................................
.............................. CYCLE   13 ..............................
........................................................................
   1    -10.4673100 -0.104673E+02  0.140E-01    1.85       0.0  T
   2    -10.4673043  0.570948E-05  0.872E-02    1.85       1.0  T
   3    -10.4667424  0.561885E-03  0.205E-01    1.85       1.0  T
   4    -10.4672193 -0.476899E-03  0.831E-02    1.85       1.0  T
   5    -10.4673113 -0.920334E-04  0.807E-03    1.85       5.5  T
   6    -10.4673115 -0.240963E-06  0.605E-03    1.85       7.4  T
   7    -10.4673117 -0.202492E-06  0.353E-03    1.85      12.7  T
   8    -10.4673118 -0.718423E-07  0.247E-04    1.85     181.0  T
   9    -10.4673118 -0.690701E-10  0.168E-04    1.85     266.0  T
     SCC iter.                  ...        0 min,  0.001 sec
     gradient                   ...        0 min,  0.001 sec
 * total energy  :   -10.2429303 Eh     change       -0.3143781E-04 Eh
   gradient norm :     0.0033083 Eh/α   predicted    -0.2665432E-04 ( -15.22%)
   displ. norm   :     0.0209231 α      lambda       -0.1761053E-04
   maximum displ.:     0.0188765 α      in ANC's #1, #4, #7, ...

........................................................................
.............................. CYCLE   14 ..............................
........................................................................
   1    -10.4681526 -0.104682E+02  0.890E-02    1.85       0.0  T
   2    -10.4679550  0.197643E-03  0.124E-01    1.85       1.0  T
   3    -10.4678827  0.723438E-04  0.148E-01    1.85       1.0  T
   4    -10.4681509 -0.268247E-03  0.252E-02    1.85       1.8  T
   5    -10.4681545 -0.363120E-05  0.171E-02    1.85       2.6  T
   6    -10.4681553 -0.778740E-06  0.143E-02    1.85       3.1  T
   7    -10.4681555 -0.201455E-06  0.135E-02    1.85       3.3  T
   8    -10.4681573 -0.177598E-05  0.247E-03    1.85      18.1  T
   9    -10.4681574 -0.644917E-07  0.616E-04    1.85      72.6  T
  10    -10.4681574 -0.230931E-08  0.102E-04    1.85     437.1  T
     SCC iter.                  ...        0 min,  0.001 sec
     gradient                   ...        0 min,  0.001 sec
 * total energy  :   -10.2429429 Eh     change       -0.1254472E-04 Eh
   gradient norm :     0.0029690 Eh/α   predicted    -0.8809589E-05 ( -29.77%)
   displ. norm   :     0.0484184 α      lambda       -0.2752190E-04
   maximum displ.:     0.0440895 α      in ANC's #1, #2, #7, ...

........................................................................
.............................. CYCLE   15 ..............................
........................................................................
   1    -10.4680392 -0.104680E+02  0.195E-01    1.85       0.0  T
   2    -10.4679350  0.104212E-03  0.139E-01    1.85       1.0  T
   3    -10.4658132  0.212182E-02  0.398E-01    1.84       1.0  T
   4    -10.4679665 -0.215335E-02  0.806E-02    1.85       1.0  T
   5    -10.4680315 -0.649251E-04  0.330E-02    1.85       1.4  T
   6    -10.4680347 -0.321561E-05  0.281E-02    1.85       1.6  T
   7    -10.4680384 -0.370548E-05  0.204E-02    1.85       2.2  T
   8    -10.4680420 -0.364923E-05  0.407E-03    1.85      11.0  T
   9    -10.4680421 -0.101186E-06  0.760E-04    1.85      58.9  T
  10    -10.4680421 -0.514579E-09  0.214E-04    1.85     208.9  T
     SCC iter.                  ...        0 min,  0.001 sec
     gradient                   ...        0 min,  0.001 sec
 * total energy  :   -10.2429645 Eh     change       -0.2165471E-04 Eh
   gradient norm :     0.0029117 Eh/α   predicted    -0.1379305E-04 ( -36.30%)
   displ. norm   :     0.0798091 α      lambda       -0.5526287E-04
   maximum displ.:     0.0642310 α      in ANC's #1, #7, #2, ...

........................................................................
.............................. CYCLE   16 ..............................
........................................................................
   1    -10.4680494 -0.104680E+02  0.335E-01    1.85       0.0  T
   2    -10.4675949  0.454525E-03  0.261E-01    1.85       1.0  T
   3    -10.4633104  0.428444E-02  0.585E-01    1.83       1.0  T
   4    -10.4676034 -0.429301E-02  0.199E-01    1.84       1.0  T
   5    -10.4679739 -0.370481E-03  0.911E-02    1.85       1.0  T
   6    -10.4680052 -0.313150E-04  0.749E-02    1.85       1.0  T
   7    -10.4680261 -0.209067E-04  0.590E-02    1.85       1.0  T
   8    -10.4680539 -0.277336E-04  0.243E-02    1.85       1.8  T
   9    -10.4680587 -0.486653E-05  0.376E-03    1.85      11.9  T
  10    -10.4680588 -0.700828E-07  0.142E-03    1.85      31.6  T
  11    -10.4680588 -0.796901E-08  0.829E-04    1.85      53.9  T
  12    -10.4680588 -0.634973E-08  0.128E-04    1.85     348.0  T
     SCC iter.                  ...        0 min,  0.001 sec
     gradient                   ...        0 min,  0.001 sec
 * total energy  :   -10.2430033 Eh     change       -0.3874483E-04 Eh
   gradient norm :     0.0021021 Eh/α   predicted    -0.2780687E-04 ( -28.23%)
   displ. norm   :     0.0539118 α      lambda       -0.2487278E-04
   maximum displ.:     0.0382525 α      in ANC's #1, #7, #2, ...

........................................................................
.............................. CYCLE   17 ..............................
........................................................................
   1    -10.4677014 -0.104677E+02  0.227E-01    1.85       0.0  T
   2    -10.4676990  0.238187E-05  0.140E-01    1.85       1.0  T
   3    -10.4671739  0.525090E-03  0.190E-01    1.84       1.0  T
   4    -10.4676673 -0.493455E-03  0.524E-02    1.85       1.0  T
   5    -10.4677022 -0.348531E-04  0.556E-03    1.85       8.0  T
   6    -10.4677023 -0.612889E-07  0.360E-03    1.85      12.4  T
   7    -10.4677023 -0.546148E-07  0.201E-03    1.85      22.2  T
   8    -10.4677023 -0.244169E-07  0.230E-04    1.85     194.2  T
   9    -10.4677023 -0.451372E-09  0.115E-04    1.85     387.5  T
     SCC iter.                  ...        0 min,  0.001 sec
     gradient                   ...        0 min,  0.001 sec
 * total energy  :   -10.2430188 Eh     change       -0.1550091E-04 Eh
   gradient norm :     0.0016411 Eh/α   predicted    -0.1247251E-04 ( -19.54%)
   displ. norm   :     0.0201467 α      lambda       -0.7225291E-05
   maximum displ.:     0.0111337 α      in ANC's #7, #4, #3, ...

........................................................................
.............................. CYCLE   18 ..............................
........................................................................
   1    -10.4688404 -0.104688E+02  0.847E-02    1.86       0.0  T
   2    -10.4688396  0.797709E-06  0.528E-02    1.86       1.0  T
   3    -10.4688008  0.387424E-04  0.664E-02    1.86       1.0  T
   4    -10.4683694  0.431482E-03  0.188E-01    1.86       1.0  T
   5    -10.4688419 -0.472582E-03  0.942E-03    1.86       4.7  T
   6    -10.4688419 -0.794032E-10  0.841E-03    1.86       5.3  T
   7    -10.4688426 -0.637517E-06  0.296E-03    1.86      15.1  T
   8    -10.4688426 -0.565174E-07  0.859E-04    1.86      52.1  T
   9    -10.4688426  0.661153E-08  0.901E-04    1.86      49.6  T
     SCC iter.                  ...        0 min,  0.001 sec
     gradient                   ...        0 min,  0.001 sec
 * total energy  :   -10.2430168 Eh     change        0.1966465E-05 Eh
   gradient norm :     0.0030724 Eh/α   predicted    -0.3614789E-05 (-283.82%)
   displ. norm   :     0.0244578 α      lambda       -0.8968234E-05
   maximum displ.:     0.0213377 α      in ANC's #1, #2, #7, ...

........................................................................
.............................. CYCLE   19 ..............................
........................................................................
   1    -10.4678642 -0.104679E+02  0.983E-02    1.85       0.0  T
   2    -10.4678187  0.454739E-04  0.834E-02    1.85       1.0  T
   3    -10.4655886  0.223009E-02  0.411E-01    1.86       1.0  T
   4    -10.4678557 -0.226710E-02  0.420E-02    1.85       1.1  T
   5    -10.4678653 -0.961220E-05  0.109E-02    1.85       4.1  T
   6    -10.4678641  0.126215E-05  0.145E-02    1.85       3.1  T
   7    -10.4678644 -0.273754E-06  0.134E-02    1.85       3.3  T
   8    -10.4678655 -0.115834E-05  0.770E-03    1.85       5.8  T
   9    -10.4678659 -0.372532E-06  0.375E-03    1.85      11.9  T
  10    -10.4678660 -0.772045E-07  0.237E-03    1.85      18.8  T
  11    -10.4678660 -0.524185E-07  0.999E-05    1.85     447.7  T
  12    -10.4678660 -0.927738E-10  0.167E-05    1.85    2681.6  T
     SCC iter.                  ...        0 min,  0.001 sec
     gradient                   ...        0 min,  0.001 sec
 * total energy  :   -10.2430216 Eh     change       -0.4821339E-05 Eh
   gradient norm :     0.0007649 Eh/α   predicted    -0.4487699E-05 (  -6.92%)
   displ. norm   :     0.0151074 α      lambda       -0.1867341E-05
   maximum displ.:     0.0073491 α      in ANC's #1, #7, #3, ...

   *** GEOMETRY OPTIMIZATION CONVERGED AFTER 19 ITERATIONS ***

------------------------------------------------------------------------
 total energy gain   :        -0.1776779 Eh     -111.4946 kcal/mol
 total RMSD          :         0.7834495 a0        0.4146 Å
 total power (kW/mol):       -24.5522802 (step)-6102.9782 (real)
------------------------------------------------------------------------

 ANCopt (total)                0 d,  0 h,  0 min,  0.076 sec
 optimizer setup                ...        0 min,  0.000 sec (  0.081%)
 model hessian                  ...        0 min,  0.000 sec (  0.110%)
 ANC generation                 ...        0 min,  0.000 sec (  0.090%)
 coordinate transformation      ...        0 min,  0.000 sec (  0.052%)
 single point calculation       ...        0 min,  0.075 sec ( 97.842%)
 optimization log               ...        0 min,  0.000 sec (  0.622%)
 hessian update                 ...        0 min,  0.000 sec (  0.050%)
 rational function              ...        0 min,  0.000 sec (  0.519%)

================
 final structure:
================
5
 xtb: 6.2.2 (9d81278992624c895f80dd42a50cac0aa55982e2)
C        -1.46716522625808   -0.82615972376380    0.04267171952831
C        -0.25934609254296   -0.03343532511396    0.04035608348422
C         1.02507681438034    0.13258579923102   -0.15782753344138
C        -1.56906490165571    0.44364055061641    0.42504366050334
C         2.27049940607641    0.28336869903034   -0.35024493007449

 Bond Distances (Angstroems)
 ---------------------------
C1-C2=1.4447         C1-C4=1.3300         C2-C1=1.4447         C2-C3=1.3102         C2-C4=1.4460         C3-C2=1.3102         
C3-C5=1.2692         C4-C1=1.3300         C4-C2=1.4460         C5-C3=1.2692         
 C  C  Rav=1.3600 sigma=0.0724  Rmin=1.2692  Rmax=1.4460     5

 selected bond angles (degree)
 --------------------
C4-C1-C2= 62.66                C3-C2-C1=152.79                C4-C2-C1= 54.79                C4-C2-C3=152.42                
C5-C3-C2=179.54                C2-C4-C1= 62.56                

 selected dihedral angles (degree)
 ---------------------------------
C3-C2-C1-C4=180.20            C5-C3-C2-C1=345.42            C5-C3-C2-C4=165.77            C1-C4-C2-C3=179.81            
           -------------------------------------------------
          |                Final Singlepoint                |
           -------------------------------------------------

          ...................................................
          :                      SETUP                      :
          :.................................................:
          :  # basis functions                  20          :
          :  # atomic orbitals                  20          :
          :  # shells                           10          :
          :  # electrons                        20          :
          :  max. iterations                   250          :
          :  Hamiltonian                  GFN2-xTB          :
          :  restarted?                      false          :
          :  GBSA solvation                  false          :
          :  PC potential                    false          :
          :  electronic temp.          300.0000000     K    :
          :  accuracy                    1.0000000          :
          :  -> integral cutoff          0.2500000E+02      :
          :  -> integral neglect         0.1000000E-07      :
          :  -> SCF convergence          0.1000000E-05 Eh   :
          :  -> wf. convergence          0.1000000E-03 e    :
          :  Broyden damping             0.4000000          :
          ...................................................

 iter      E             dE          RMSdq      gap      omega  full diag
   1    -10.4678660 -0.104679E+02  0.648E-06    1.85       0.0  T
   2    -10.4678660  0.325802E-10  0.505E-05    1.85     886.0  T
   3    -10.4678660 -0.222862E-10  0.301E-05    1.85    1485.3  T

   *** convergence criteria satisfied after 3 iterations ***

         #    Occupation            Energy/Eh            Energy/eV
      -------------------------------------------------------------
         1        2.0000           -0.7307474             -19.8846
       ...           ...                  ...                  ...
         5        2.0000           -0.5531164             -15.0511
         6        2.0000           -0.5490526             -14.9405
         7        2.0000           -0.4821948             -13.1212
         8        2.0000           -0.4642707             -12.6334
         9        1.9638           -0.4339684             -11.8089
        10        1.0362           -0.4277334             -11.6392
        11        1.0000           -0.4112606             -11.1910 (HOMO)
        12                         -0.3431785              -9.3384 (LUMO)
        13                         -0.2890648              -7.8659
        14                         -0.2294061              -6.2425
        15                         -0.1535513              -4.1783
        16                         -0.0039527              -0.1076
       ...                                ...                  ...
        20                          1.1304040              30.7599
      -------------------------------------------------------------
                  HL-Gap            0.0680821 Eh            1.8526 eV
             Fermi-level           -0.4040352 Eh          -10.9944 eV

 transition dipole moment (au) for excitation:          10          11
     X       Y       Z   
  -0.0215   0.5646   0.1655  total (au/Debye):    0.589   1.496
 dE (eV)             :    0.448
 oscillator strength :  0.53832E-02

 SCC (total)                   0 d,  0 h,  0 min,  0.004 sec
 SCC setup                      ...        0 min,  0.000 sec (  1.230%)
 Dispersion                     ...        0 min,  0.000 sec (  0.213%)
 integral evaluation            ...        0 min,  0.001 sec ( 31.908%)
 zeroth order Hamiltonian       ...        0 min,  0.000 sec (  0.362%)
 iterations                     ...        0 min,  0.000 sec (  9.418%)
 molecular gradient             ...        0 min,  0.001 sec ( 32.845%)
 printout                       ...        0 min,  0.001 sec ( 23.835%)

         :::::::::::::::::::::::::::::::::::::::::::::::::::::
         ::                     SUMMARY                     ::
         :::::::::::::::::::::::::::::::::::::::::::::::::::::
         :: total energy             -10.243021641851 Eh    ::
         :: gradient norm              0.000788109757 Eh/a0 ::
         :: HOMO-LUMO gap              1.852609203461 eV    ::
         ::.................................................::
         :: SCC energy               -10.467866021683 Eh    ::
         :: -> isotropic ES           -0.009864446710 Eh    ::
         :: -> anisotropic ES          0.000212019373 Eh    ::
         :: -> anisotropic XC          0.011226160828 Eh    ::
         :: -> dispersion             -0.002863105863 Eh    ::
         :: repulsion energy           0.224844506485 Eh    ::
         :: add. restraining           0.000000000000 Eh    ::
         :::::::::::::::::::::::::::::::::::::::::::::::::::::

           ------------------------------------------------- 
          |                Numerical Hessian                |
           ------------------------------------------------- 
step length          :   0.00500
SCC accuracy         :   0.30000
Hessian scale factor :   1.00000
frozen atoms in %    :   0.00000    0
RMS gradient         :   0.00079
estimated CPU  time      0.00 min
estimated wall time      0.00 min

writing file <hessian>.

 projected vibrational frequencies (cm-1)
eigval :       -0.00    -0.00    -0.00     0.00     0.00     0.00
eigval :       66.13   165.31   356.61   490.18   710.28   803.45
eigval :     1272.68  1666.26  1899.13
           -------------------------------------------------
          |                Property Printout                |
           -------------------------------------------------

    * Orbital Energies and Occupations

         #    Occupation            Energy/Eh            Energy/eV
      -------------------------------------------------------------
         1        2.0000           -0.7307479             -19.8847
         2        2.0000           -0.6729264             -18.3113
         3        2.0000           -0.6334260             -17.2364
         4        2.0000           -0.5888743             -16.0241
         5        2.0000           -0.5531169             -15.0511
         6        2.0000           -0.5490531             -14.9405
         7        2.0000           -0.4821948             -13.1212
         8        2.0000           -0.4642704             -12.6334
         9        1.9638           -0.4339676             -11.8089
        10        1.0362           -0.4277341             -11.6392
        11        1.0000           -0.4112605             -11.1910 (HOMO)
        12                         -0.3431783              -9.3384 (LUMO)
        13                         -0.2890656              -7.8659
        14                         -0.2294056              -6.2424
        15                         -0.1535510              -4.1783
        16                         -0.0039531              -0.1076
        17                          0.0501747               1.3653
        18                          0.4694130              12.7734
        19                          0.4815606              13.1039
        20                          1.1304043              30.7599
      -------------------------------------------------------------
                  HL-Gap            0.0680822 Eh            1.8526 eV
             Fermi-level           -0.4040351 Eh          -10.9944 eV

     #   Z        covCN         q      C6AA      α(0)
     1   6 C      1.960    -0.012    31.378     9.046
     2   6 C      2.940     0.132    25.118     8.220
     3   6 C      1.962     0.022    30.493     8.918
     4   6 C      1.960    -0.012    31.383     9.047
     5   6 C      0.982    -0.131    40.159    10.644

 Mol. C6AA /au·bohr⁶  :        788.045591
 Mol. C8AA /au·bohr⁸  :      22791.647930
 Mol. α(0) /au        :         45.874474


Wiberg/Mayer (AO) data.
largest (>0.10) Wiberg bond orders for each atom
          total WBO             WBO to atom ...
Molecule has the following symmetry elements: (C2) 2*(sigma) 
It seems to be the C2v point group
     1  C   2.848        C    4 1.644    C    2 1.024
     2  C   3.748        C    3 1.574    C    1 1.024    C    4 1.021    C    5 0.128
     3  C   3.824        C    5 2.079    C    2 1.574
     4  C   2.845        C    1 1.644    C    2 1.021
     5  C   2.396        C    3 2.079    C    2 0.128

MOs/occ written to file <molden.input>


molecular dipole:
                 x           y           z       tot (Debye)
 q only:       -0.517      -0.065       0.080
   full:       -0.817      -0.101       0.127       2.116
molecular quadrupole (traceless):
                xx          xy          yy          xz          yz          zz
 q only:       -2.420      -0.460       1.203       0.577       0.057       1.217
  q+dip:       -4.995      -0.942       2.858       1.105       0.354       2.137
   full:       -7.868      -1.463       3.253       2.039      -0.242       4.615

           -------------------------------------------------
          |                Geometry Summary                 |
           -------------------------------------------------

      molecular mass/u    :       60.0536795
   center of mass at/Å    :       -0.0000000      -0.0000000      -0.0000002
  moments of inertia/u·Å² :        0.1062362E+02   0.1358809E+03   0.1465045E+03
rotational constants/cm⁻¹ :        0.1586806E+01   0.1240619E+00   0.1150657E+00

 * 1 selected distances

     #   Z        #   Z                                     value/Å
     2   6 C      3   6 C                                 1.3101839 (max)

 * 1 distinct bonds (by element types)

   Z      Z             #   av. dist./Å        max./Å        min./Å
   6 C    6 C           1     1.3101839     1.3101839     1.3101839

           -------------------------------------------------
          |               Frequency Printout                |
           -------------------------------------------------
 projected vibrational frequencies (cm-1)
eigval :       -0.00    -0.00    -0.00     0.00     0.00     0.00
eigval :       66.13   165.31   356.61   490.18   710.28   803.45
eigval :     1272.68  1666.26  1899.13
 reduced masses (amu)
   1: 12.01   2: 12.01   3: 12.01   4: 12.01   5: 12.01   6: 12.01   7: 12.01   8: 12.01
   9: 12.01  10: 12.01  11: 12.01  12: 12.01  13: 12.01  14: 12.01  15: 12.01
 IR intensities (amu)
   1:  0.10   2:  0.03   3:  0.06   4:  0.10   5:  0.11   6:  0.14   7:  0.40   8:  0.39
   9:  0.06  10:  0.31  11:  1.04  12:  0.41  13:  1.38  14:  1.74  15:  0.14
 Raman intensities (amu)
   1:  0.00   2:  0.00   3:  0.00   4:  0.00   5:  0.00   6:  0.00   7:  0.00   8:  0.00
   9:  0.00  10:  0.00  11:  0.00  12:  0.00  13:  0.00  14:  0.00  15:  0.00
 output can be read by thermo (or use thermo option).
 writing <g98.out> molden fake output.
 recommended (thermochemical) frequency scaling factor: 1.0
           -------------------------------------------------
          |             Thermodynamic Functions             |
           -------------------------------------------------

c2v symmetry found (for desy threshold:  0.10E+00) used in thermo

          ...................................................
          :                      SETUP                      :
          :.................................................:
          :  # frequencies                           9      :
          :  # imaginary freq.                       0      :
          :  linear?                             false      :
          :  only rotor calc.                    false      :
          :  symmetry                              c2v      :
          :  rotational number                       2      :
          :  scaling factor                  1.0000000      :
          :  rotor cutoff                   50.0000000 cm⁻¹ :
          :  imag. cutoff                  -20.0000000 cm⁻¹ :
          :.................................................:

    mode    ω/cm⁻¹     T·S(HO)/kcal·mol⁻¹    T·S(FR)/kcal·mol⁻¹   T·S(vib)
   ------------------------------------------------------------------------
       1     66.13    -0.00002 ( 75.37%)     0.00110 ( 24.63%)     0.00026
       2    165.31    -0.00000 ( 99.17%)     0.01019 (  0.83%)     0.00008
   ------------------------------------------------------------------------

   temp. (K)  partition function   enthalpy   heat capacity  entropy
                                   cal/mol     cal/K/mol   cal/K/mol   J/K/mol
 298.15  VIB   9.47                 1384.347      8.365      8.863
         ROT  0.176E+05              888.752      2.981     22.404
         INT  0.166E+06             2273.099     11.346     31.267
         TR   0.450E+27             1481.254      4.968     38.181
         TOT                        3754.3532    16.3139    69.4477   290.5692

   temp. (K)  partition function   enthalpy   heat capacity  entropy
                                   cal/mol     cal/K/mol   cal/K/mol   J/K/mol
 120.00  VIB   2.16                  250.708      4.087      3.585
         ROT  0.449E+04              357.707      2.981     19.691
         INT  0.967E+04              608.415      7.068     23.276
         TR   0.115E+27              596.178      4.968     33.661
         TOT                        1204.5933    12.0363    56.9372   238.2253

   temp. (K)  partition function   enthalpy   heat capacity  entropy
                                   cal/mol     cal/K/mol   cal/K/mol   J/K/mol
 100.00  VIB   1.81                  174.624      3.519      2.933
         ROT  0.341E+04              298.089      2.981     19.147
         INT  0.617E+04              472.713      6.499     22.080
         TR   0.875E+26              496.815      4.968     32.756
         TOT                         969.5279    11.4676    54.8360   229.4340

   temp. (K)  partition function   enthalpy   heat capacity  entropy
                                   cal/mol     cal/K/mol   cal/K/mol   J/K/mol
  80.00  VIB   1.52                  110.125      2.925      2.261
         ROT  0.244E+04              238.471      2.981     18.482
         INT  0.371E+04              348.596      5.906     20.743
         TR   0.626E+26              397.452      4.968     31.648
         TOT                         746.0478    10.8742    52.3906   219.2023

   temp. (K)  partition function   enthalpy   heat capacity  entropy
                                   cal/mol     cal/K/mol   cal/K/mol   J/K/mol
  60.00  VIB   1.28                   58.052      2.265      1.565
         ROT  0.159E+04              178.853      2.981     17.625
         INT  0.203E+04              236.906      5.246     19.190
         TR   0.406E+26              298.089      4.968     30.219
         TOT                         534.9948    10.2138    49.4095   206.7292

   temp. (K)  partition function   enthalpy   heat capacity  entropy
                                   cal/mol     cal/K/mol   cal/K/mol   J/K/mol
  40.00  VIB   1.11                   20.557      1.452      0.861
         ROT   863.                  119.236      2.981     16.416
         INT   954.                  139.793      4.432     17.276
         TR   0.221E+26              198.726      4.968     28.206
         TOT                         338.5186     9.4005    45.4824   190.2984

   temp. (K)  partition function   enthalpy   heat capacity  entropy
                                   cal/mol     cal/K/mol   cal/K/mol   J/K/mol
  20.00  VIB   1.01                    1.642      0.395      0.214
         ROT   305.                   59.618      2.981     14.350
         INT   308.                   61.259      3.376     14.564
         TR   0.782E+25               99.363      4.968     24.764
         TOT                         160.6224     8.3440    39.3277   164.5473

   temp. (K)  partition function   enthalpy   heat capacity  entropy
                                   cal/mol     cal/K/mol   cal/K/mol   J/K/mol
  10.00  VIB   1.00                    0.014      0.013     -0.035
         ROT   108.                   29.809      2.981     12.284
         INT   108.                   29.823      2.994     12.248
         TR   0.277E+25               49.681      4.968     21.322
         TOT                          79.5044     7.9623    33.5701   140.4575

       T/K    H(0)-H(T)+PV         H(T)/Eh          T*S/Eh         G(T)/Eh
   ------------------------------------------------------------------------
    298.15    0.598294E-02    0.229098E-01    0.329968E-01   -0.100870E-01
    120.00    0.191964E-02    0.188465E-01    0.108882E-01    0.795828E-02
    100.00    0.154504E-02    0.184719E-01    0.873868E-02    0.973323E-02
     80.00    0.118890E-02    0.181158E-01    0.667918E-02    0.114366E-01
     60.00    0.852569E-03    0.177794E-01    0.472434E-02    0.130551E-01
     40.00    0.539464E-03    0.174663E-01    0.289923E-02    0.145671E-01
     20.00    0.255968E-03    0.171828E-01    0.125345E-02    0.159294E-01
     10.00    0.126698E-03    0.170536E-01    0.534974E-03    0.165186E-01 (used)
   ------------------------------------------------------------------------

         :::::::::::::::::::::::::::::::::::::::::::::::::::::
         ::                  THERMODYNAMIC                  ::
         :::::::::::::::::::::::::::::::::::::::::::::::::::::
         :: total free energy         -10.226503053557 Eh   ::
         ::.................................................::
         :: total energy              -10.243021641107 Eh   ::
         :: zero point energy           0.016926863631 Eh   ::
         :: G(RRHO) w/o ZPVE           -0.000408276081 Eh   ::
         :: G(RRHO) contrib.            0.016518587550 Eh   ::
         :::::::::::::::::::::::::::::::::::::::::::::::::::::

optimized geometry written to: xtbopt.xyz


           -------------------------------------------------
          | TOTAL ENERGY              -10.243021641107 Eh   |
          | TOTAL ENTHALPY            -10.225968079223 Eh   |
          | TOTAL FREE ENERGY         -10.226503053557 Eh   |
          | GRADIENT NORM               0.000785708935 Eh/α |
          | HOMO-LUMO GAP               1.852611753108 eV   |
           -------------------------------------------------

------------------------------------------------------------------------
 * finished run on 2020/05/12 at 11:44:34.150     
------------------------------------------------------------------------
 total:
 * wall-time:     0 d,  0 h,  0 min,  0.210 sec
 *  cpu-time:     0 d,  0 h,  0 min,  0.210 sec
 * ratio c/w:     0.999 speedup
 SCF:
 * wall-time:     0 d,  0 h,  0 min,  0.006 sec
 *  cpu-time:     0 d,  0 h,  0 min,  0.006 sec
 * ratio c/w:     1.000 speedup
 ANC optimizer:
 * wall-time:     0 d,  0 h,  0 min,  0.081 sec
 *  cpu-time:     0 d,  0 h,  0 min,  0.081 sec
 * ratio c/w:     1.000 speedup
 numerical hessian:
 * wall-time:     0 d,  0 h,  0 min,  0.107 sec
 *  cpu-time:     0 d,  0 h,  0 min,  0.106 sec
 * ratio c/w:     0.999 speedup

