      -----------------------------------------------------------      
     |                   =====================                   |     
     |                           x T B                           |     
     |                   =====================                   |     
     |                         S. Grimme                         |     
     |          Mulliken Center for Theoretical Chemistry        |     
     |                    University of Bonn                     |     
      -----------------------------------------------------------      

   * xtb version 6.2.2 (9d81278992624c895f80dd42a50cac0aa55982e2) compiled by '@Darwin' on 04/03/2020

   xtb is free software: you can redistribute it and/or modify it under
   the terms of the GNU Lesser General Public License as published by
   the Free Software Foundation, either version 3 of the License, or
   (at your option) any later version.
   
   xtb is distributed in the hope that it will be useful,
   but WITHOUT ANY WARRANTY; without even the implied warranty of
   MERCHANTABILITY or FITNESS FOR A PARTICULAR PURPOSE.  See the
   GNU Lesser General Public License for more details.
   
   Cite this work as:
   * S. Grimme, C. Bannwarth, P. Shushkov, J. Chem. Theory Comput., 2017,
     13, 1989-2009. DOI: 10.1021/acs.jctc.7b00118
   * C. Bannwarth, S. Ehlert and S. Grimme., J. Chem. Theory Comput., 2019,
     15, 1652-1671. DOI: 10.1021/acs.jctc.8b01176
   * P. Pracht, E. Caldeweyher, S. Ehlert, S. Grimme, ChemRxiv, 2019, preprint.
     DOI: 10.26434/chemrxiv.8326202.v1
   
   for DFT-D4:
   * E. Caldeweyher, C. Bannwarth and S. Grimme, J. Chem. Phys., 2017,
     147, 034112. DOI: 10.1063/1.4993215
   * E. Caldeweyher, S. Ehlert, A. Hansen, H. Neugebauer, S. Spicher,
     C. Bannwarth and S. Grimme, J. Chem. Phys., 2019, 150, 154122.
     DOI: 10.1063/1.5090222
   
   for sTDA-xTB:
   * S. Grimme and C. Bannwarth, J. Chem. Phys., 2016, 145, 054103.
     DOI: 10.1063/1.4959605
   
   in the mass-spec context:
   * V. Asgeirsson, C. Bauer and S. Grimme, Chem. Sci., 2017, 8, 4879.
     DOI: 10.1039/c7sc00601b
   
   for metadynamics refer to:
   * S. Grimme, J. Chem. Theory Comput., 2019, 155, 2847-2862
     DOI: 10.1021/acs.jctc.9b00143
   
   with help from (in alphabetical order)
   C. Bannwarth, F. Bohle, G. Brandenburg, E. Caldeweyher, M. Checinski,
   S. Dohm, S. Ehlert, S. Ehrlich, F. März, H. Neugebauer, J. Pisarek,
   P. Pracht, P. Shushkov, and S. Spicher.
   
 * started run on 2020/05/12 at 11:45:09.654     

           -------------------------------------------------
          |                Calculation Setup                |
           -------------------------------------------------

          program call               : xtb --input H1C4_4_S_3.input H1C4_4_S_3.xyz --ohess --molden --namespace H1C4_4_S_3 output.out
          calculation namespace      : H1C4_4_S_3
          coordinate file            : H1C4_4_S_3.xyz
          number of atoms            :                     5
          number of electrons        :                    17
          charge                     :                     0
          spin                       :                   1.5
          first test random number   :      0.30406577615162

   ID    Z sym.   atoms
    1    6 C      1-4
    2    1 H      5

           -------------------------------------------------
          |                 G F N 2 - x T B                 |
           -------------------------------------------------

        Reference                      10.1021/acs.jctc.8b01176
      * Hamiltonian:
        H0-scaling (s, p, d)           1.850000    2.230000    2.230000
        zeta-weighting                 0.500000
      * Dispersion:
        s8                             2.700000
        a1                             0.520000
        a2                             5.000000
        s9                             5.000000
      * Repulsion:
        kExp                           1.500000    1.000000
        rExp                           1.000000
      * Coulomb:
        alpha                          2.000000
        third order                    shell-resolved
        anisotropic                    true
        a3                             3.000000
        a5                             4.000000
        cn-shift                       1.200000
        cn-exp                         4.000000
        max-rad                        5.000000


          ...................................................
          :                      SETUP                      :
          :.................................................:
          :  # basis functions                  17          :
          :  # atomic orbitals                  17          :
          :  # shells                            9          :
          :  # electrons                        17          :
          :  max. iterations                   250          :
          :  Hamiltonian                  GFN2-xTB          :
          :  restarted?                      false          :
          :  GBSA solvation                  false          :
          :  PC potential                    false          :
          :  electronic temp.          300.0000000     K    :
          :  accuracy                    1.0000000          :
          :  -> integral cutoff          0.2500000E+02      :
          :  -> integral neglect         0.1000000E-07      :
          :  -> SCF convergence          0.1000000E-05 Eh   :
          :  -> wf. convergence          0.1000000E-03 e    :
          :  Broyden damping             0.4000000          :
          ...................................................

 iter      E             dE          RMSdq      gap      omega  full diag
   1     -8.6030854 -0.860309E+01  0.793E+00    0.80       0.0  T
   2     -8.5931739  0.991155E-02  0.478E+00    0.87       1.0  T
   3     -8.1850556  0.408118E+00  0.710E+00    1.02       1.0  T
   4     -8.5513757 -0.366320E+00  0.261E+00    0.76       1.0  T
   5     -8.5979280 -0.465524E-01  0.150E+00    0.77       1.0  T
   6     -8.6115503 -0.136222E-01  0.631E-01    0.84       1.0  T
   7     -8.6118956 -0.345333E-03  0.520E-01    0.83       1.0  T
   8     -8.6119397 -0.441548E-04  0.107E-01    0.83       1.0  T
   9     -8.6119657 -0.259319E-04  0.355E-02    0.83       1.3  T
  10     -8.6119675 -0.177340E-05  0.144E-02    0.83       3.1  T
  11     -8.6119678 -0.336158E-06  0.294E-03    0.83      15.2  T
  12     -8.6119678 -0.219133E-07  0.676E-04    0.83      66.1  T
  13     -8.6119678 -0.862824E-09  0.197E-04    0.83     227.4  T

   *** convergence criteria satisfied after 13 iterations ***

         #    Occupation            Energy/Eh            Energy/eV
      -------------------------------------------------------------
         1        2.0000           -0.6939417             -18.8831
       ...           ...                  ...                  ...
         4        2.0000           -0.5460762             -14.8595
         5        2.0000           -0.5134819             -13.9726
         6        2.0000           -0.4643969             -12.6369
         7        2.0000           -0.4458511             -12.1322
         8        1.0000           -0.4264067             -11.6031
         9        1.0000           -0.4070581             -11.0766
        10        1.0000           -0.3600051              -9.7962 (HOMO)
        11        0.0000           -0.3296134              -8.9692 (LUMO)
        12                         -0.3077025              -8.3730
        13                         -0.1025765              -2.7912
        14                          0.1119340               3.0459
        15                          0.1217027               3.3117
       ...                                ...                  ...
        17                          0.1728843               4.7044
      -------------------------------------------------------------
                  HL-Gap            0.0303918 Eh            0.8270 eV
             Fermi-level           -0.3904691 Eh          -10.6252 eV

 SCC (total)                   0 d,  0 h,  0 min,  0.004 sec
 SCC setup                      ...        0 min,  0.000 sec (  2.339%)
 Dispersion                     ...        0 min,  0.000 sec (  0.604%)
 integral evaluation            ...        0 min,  0.001 sec ( 28.724%)
 zeroth order Hamiltonian       ...        0 min,  0.000 sec (  0.562%)
 iterations                     ...        0 min,  0.001 sec ( 36.345%)
 molecular gradient             ...        0 min,  0.001 sec ( 29.359%)
 printout                       ...        0 min,  0.000 sec (  1.801%)

         :::::::::::::::::::::::::::::::::::::::::::::::::::::
         ::                     SUMMARY                     ::
         :::::::::::::::::::::::::::::::::::::::::::::::::::::
         :: total energy              -8.537932196010 Eh    ::
         :: gradient norm              0.239236022956 Eh/a0 ::
         :: HOMO-LUMO gap              0.827001969695 eV    ::
         ::.................................................::
         :: SCC energy                -8.611967812182 Eh    ::
         :: -> isotropic ES           -0.011241760919 Eh    ::
         :: -> anisotropic ES          0.000313168936 Eh    ::
         :: -> anisotropic XC          0.005849434888 Eh    ::
         :: -> dispersion             -0.002215746484 Eh    ::
         :: repulsion energy           0.074035583173 Eh    ::
         :: add. restraining           0.000000000000 Eh    ::
         :::::::::::::::::::::::::::::::::::::::::::::::::::::

      ----------------------------------------------------------- 
     |                   =====================                   |
     |                        A N C O P T                        |
     |                   =====================                   |
     |               Approximate Normal Coordinate               |
     |                Rational Function Optimizer                |
      ----------------------------------------------------------- 

          ...................................................
          :                      SETUP                      :
          :.................................................:
          :   optimization level            normal          :
          :   max. optcycles                   200          :
          :   ANC micro-cycles                  20          :
          :   degrees of freedom                 9          :
          :.................................................:
          :   RF solver                   davidson          :
          :   write xtbopt.log                true          :
          :   linear?                        false          :
          :   energy convergence         0.5000000E-05 Eh   :
          :   grad. convergence          0.1000000E-02 Eh/α :
          :   maximium RF displ.         1.0000000          :
          :   Hlow (freq-cutoff)         0.1000000E-01      :
          :   Hmax (freq-cutoff)         5.0000000          :
          :   S6 in model hess.         20.0000000          :
          ...................................................

generating ANC from model Hessian ...
Using Lindh-Hessian (1995)
 Shifting diagonal of input Hessian by    0.0000000000000000     
 Lowest  eigenvalues of input Hessian
   -0.000000   -0.000000    0.000000    0.000000    0.000000    0.000000
    0.011826    0.037593    0.077069    0.092755    0.637128    0.699073
    0.757925    0.944239    1.280464
 Highest eigenvalues
    0.092755    0.637128    0.699073    0.757925    0.944239    1.280464


........................................................................
.............................. CYCLE    1 ..............................
........................................................................
   1     -8.6119678 -0.861197E+01  0.601E-05    0.83       0.0  T
   2     -8.6119678  0.110859E-09  0.117E-04    0.83     380.6  T
   3     -8.6119678 -0.117309E-09  0.384E-05    0.83    1166.1  T
     SCC iter.                  ...        0 min,  0.001 sec
     gradient                   ...        0 min,  0.001 sec
 * total energy  :    -8.5379322 Eh     change       -0.8657697E-09 Eh
   gradient norm :     0.2392370 Eh/α   predicted     0.0000000E+00 (-100.00%)
   displ. norm   :     0.4342663 α      lambda       -0.7732586E-01
   maximum displ.:     0.2568933 α      in ANC's #4, #7, #3, ...

........................................................................
.............................. CYCLE    2 ..............................
........................................................................
   1     -8.7084315 -0.870843E+01  0.197E+00    1.95       0.0  T
   2     -8.7026132  0.581834E-02  0.161E+00    1.82       1.0  T
   3     -8.6951805  0.743266E-02  0.156E+00    1.96       1.0  T
   4     -8.7067412 -0.115607E-01  0.674E-01    1.86       1.0  T
   5     -8.7101871 -0.344583E-02  0.194E-01    1.93       1.0  T
   6     -8.7104340 -0.246964E-03  0.822E-02    1.93       1.0  T
   7     -8.7104500 -0.159829E-04  0.463E-02    1.93       1.0  T
   8     -8.7104556 -0.559953E-05  0.361E-03    1.93      12.4  T
   9     -8.7104556 -0.144948E-07  0.968E-04    1.93      46.2  T
  10     -8.7104556 -0.391267E-09  0.158E-04    1.93     283.2  T
     SCC iter.                  ...        0 min,  0.001 sec
     gradient                   ...        0 min,  0.001 sec
 * total energy  :    -8.6009381 Eh     change       -0.6300586E-01 Eh
   gradient norm :     0.1498001 Eh/α   predicted    -0.4595426E-01 ( -27.06%)
   displ. norm   :     0.4930542 α      lambda       -0.6381648E-01
   maximum displ.:     0.2728601 α      in ANC's #7, #8, #3, ...

........................................................................
.............................. CYCLE    3 ..............................
........................................................................
   1     -8.8285653 -0.882857E+01  0.230E+00    2.38       0.0  T
   2     -8.8287311 -0.165855E-03  0.146E+00    2.33       1.0  T
   3     -8.8242643  0.446682E-02  0.101E+00    2.49       1.0  T
   4     -8.8290614 -0.479711E-02  0.264E-01    2.29       1.0  T
   5     -8.8295956 -0.534176E-03  0.851E-02    2.36       1.0  T
   6     -8.8295694  0.261567E-04  0.729E-02    2.37       1.0  T
   7     -8.8296077 -0.382659E-04  0.114E-02    2.36       3.9  T
   8     -8.8296079 -0.266947E-06  0.329E-03    2.36      13.6  T
   9     -8.8296080 -0.171850E-07  0.701E-04    2.36      63.8  T
  10     -8.8296080 -0.230564E-09  0.901E-05    2.36     496.5  T
     SCC iter.                  ...        0 min,  0.001 sec
     gradient                   ...        0 min,  0.001 sec
 * total energy  :    -8.6207080 Eh     change       -0.1976991E-01 Eh
   gradient norm :     0.1881200 Eh/α   predicted    -0.3966522E-01 ( 100.63%)
   displ. norm   :     0.4231091 α      lambda       -0.4129413E-01
   maximum displ.:     0.2592095 α      in ANC's #3, #4, #2, ...

........................................................................
.............................. CYCLE    4 ..............................
........................................................................
   1     -8.7747064 -0.877471E+01  0.123E+00    2.49       0.0  T
   2     -8.7737122  0.994231E-03  0.801E-01    2.61       1.0  T
   3     -8.7704926  0.321962E-02  0.916E-01    2.35       1.0  T
   4     -8.7746160 -0.412339E-02  0.324E-01    2.60       1.0  T
   5     -8.7754545 -0.838485E-03  0.853E-02    2.54       1.0  T
   6     -8.7754925 -0.380159E-04  0.449E-02    2.53       1.0  T
   7     -8.7754998 -0.726895E-05  0.865E-03    2.54       5.2  T
   8     -8.7754998 -0.659442E-07  0.360E-03    2.54      12.4  T
   9     -8.7754998 -0.176229E-07  0.530E-04    2.54      84.4  T
  10     -8.7754998 -0.287290E-09  0.469E-05    2.54     952.7  T
     SCC iter.                  ...        0 min,  0.001 sec
     gradient                   ...        0 min,  0.001 sec
 * total energy  :    -8.6360902 Eh     change       -0.1538225E-01 Eh
   gradient norm :     0.0652666 Eh/α   predicted    -0.2434334E-01 (  58.26%)
   displ. norm   :     0.3782091 α      lambda       -0.1109569E-01
   maximum displ.:     0.3539701 α      in ANC's #1, #3, #5, ...

........................................................................
.............................. CYCLE    5 ..............................
........................................................................
   1     -8.7854778 -0.878548E+01  0.104E+00    1.98       0.0  T
   2     -8.7854980 -0.202788E-04  0.625E-01    1.95       1.0  T
   3     -8.7842176  0.128049E-02  0.436E-01    2.06       1.0  T
   4     -8.7855510 -0.133341E-02  0.803E-02    1.96       1.0  T
   5     -8.7855720 -0.210128E-04  0.531E-02    1.97       1.0  T
   6     -8.7855669  0.505391E-05  0.468E-02    1.98       1.0  T
   7     -8.7855848 -0.178436E-04  0.931E-03    1.97       4.8  T
   8     -8.7855850 -0.182355E-06  0.168E-03    1.97      26.7  T
   9     -8.7855850 -0.134154E-07  0.393E-04    1.97     113.9  T
  10     -8.7855850 -0.193671E-09  0.395E-05    1.97    1131.9  T
     SCC iter.                  ...        0 min,  0.001 sec
     gradient                   ...        0 min,  0.001 sec
 * total energy  :    -8.6399577 Eh     change       -0.3867464E-02 Eh
   gradient norm :     0.0655901 Eh/α   predicted    -0.6341421E-02 (  63.97%)
   displ. norm   :     0.2010686 α      lambda       -0.7145692E-02
   maximum displ.:     0.1380479 α      in ANC's #1, #5, #4, ...

........................................................................
.............................. CYCLE    6 ..............................
........................................................................
   1     -8.8083239 -0.880832E+01  0.592E-01    1.93       0.0  T
   2     -8.8083200  0.384285E-05  0.410E-01    1.92       1.0  T
   3     -8.8080148  0.305202E-03  0.352E-01    1.93       1.0  T
   4     -8.8079491  0.657119E-04  0.300E-01    1.93       1.0  T
   5     -8.8086261 -0.676987E-03  0.411E-02    1.91       1.1  T
   6     -8.8086376 -0.114975E-04  0.169E-02    1.92       2.7  T
   7     -8.8086382 -0.579431E-06  0.408E-03    1.92      11.0  T
   8     -8.8086382 -0.463720E-07  0.994E-04    1.92      45.0  T
   9     -8.8086382 -0.500945E-09  0.235E-04    1.92     190.2  T
     SCC iter.                  ...        0 min,  0.001 sec
     gradient                   ...        0 min,  0.001 sec
 * total energy  :    -8.6425328 Eh     change       -0.2575116E-02 Eh
   gradient norm :     0.0349404 Eh/α   predicted    -0.3717293E-02 (  44.35%)
   displ. norm   :     0.2451622 α      lambda       -0.5429105E-02
   maximum displ.:     0.1446757 α      in ANC's #3, #4, #1, ...

........................................................................
.............................. CYCLE    7 ..............................
........................................................................
   1     -8.8049143 -0.880491E+01  0.776E-01    2.12       0.0  T
   2     -8.8049082  0.605733E-05  0.476E-01    2.13       1.0  T
   3     -8.8039173  0.990947E-03  0.398E-01    2.10       1.0  T
   4     -8.8048029 -0.885592E-03  0.156E-01    2.12       1.0  T
   5     -8.8049836 -0.180723E-03  0.293E-02    2.13       1.5  T
   6     -8.8049851 -0.155250E-05  0.211E-02    2.12       2.1  T
   7     -8.8049879 -0.278500E-05  0.268E-03    2.12      16.7  T
   8     -8.8049879 -0.300184E-08  0.881E-04    2.12      50.8  T
   9     -8.8049879 -0.918243E-09  0.167E-04    2.12     268.6  T
     SCC iter.                  ...        0 min,  0.001 sec
     gradient                   ...        0 min,  0.001 sec
 * total energy  :    -8.6446941 Eh     change       -0.2161254E-02 Eh
   gradient norm :     0.0201640 Eh/α   predicted    -0.2877711E-02 (  33.15%)
   displ. norm   :     0.0635884 α      lambda       -0.8677820E-03
   maximum displ.:     0.0565065 α      in ANC's #3, #5, #4, ...

........................................................................
.............................. CYCLE    8 ..............................
........................................................................
   1     -8.8064713 -0.880647E+01  0.224E-01    2.05       0.0  T
   2     -8.8064655  0.582237E-05  0.137E-01    2.04       1.0  T
   3     -8.8062633  0.202172E-03  0.154E-01    2.08       1.0  T
   4     -8.8064705 -0.207182E-03  0.247E-02    2.05       1.8  T
   5     -8.8064748 -0.434909E-05  0.736E-03    2.05       6.1  T
   6     -8.8064749 -0.869257E-07  0.441E-03    2.05      10.1  T
   7     -8.8064750 -0.737062E-07  0.773E-04    2.05      57.9  T
   8     -8.8064750 -0.293372E-09  0.231E-04    2.05     193.3  T
     SCC iter.                  ...        0 min,  0.001 sec
     gradient                   ...        0 min,  0.001 sec
 * total energy  :    -8.6452149 Eh     change       -0.5208658E-03 Eh
   gradient norm :     0.0119216 Eh/α   predicted    -0.4356452E-03 ( -16.36%)
   displ. norm   :     0.0499389 α      lambda       -0.2851859E-03
   maximum displ.:     0.0327862 α      in ANC's #1, #5, #4, ...

........................................................................
.............................. CYCLE    9 ..............................
........................................................................
   1     -8.8071518 -0.880715E+01  0.137E-01    2.02       0.0  T
   2     -8.8071523 -0.460382E-06  0.835E-02    2.02       1.0  T
   3     -8.8071368  0.155068E-04  0.521E-02    2.03       1.0  T
   4     -8.8071487 -0.118974E-04  0.242E-02    2.02       1.9  T
   5     -8.8071537 -0.499317E-05  0.433E-03    2.02      10.3  T
   6     -8.8071537 -0.159580E-07  0.321E-03    2.02      13.9  T
   7     -8.8071538 -0.562042E-07  0.190E-04    2.02     235.5  T
   8     -8.8071538 -0.457572E-10  0.878E-05    2.02     509.5  T
     SCC iter.                  ...        0 min,  0.001 sec
     gradient                   ...        0 min,  0.001 sec
 * total energy  :    -8.6454303 Eh     change       -0.2153972E-03 Eh
   gradient norm :     0.0089022 Eh/α   predicted    -0.1429478E-03 ( -33.64%)
   displ. norm   :     0.0840485 α      lambda       -0.3028670E-03
   maximum displ.:     0.0439993 α      in ANC's #2, #1, #4, ...

........................................................................
.............................. CYCLE   10 ..............................
........................................................................
   1     -8.8081098 -0.880811E+01  0.203E-01    2.03       0.0  T
   2     -8.8080934  0.163607E-04  0.133E-01    2.02       1.0  T
   3     -8.8078229  0.270504E-03  0.193E-01    2.05       1.0  T
   4     -8.8081127 -0.289773E-03  0.230E-02    2.03       1.9  T
   5     -8.8081158 -0.313937E-05  0.799E-03    2.02       5.6  T
   6     -8.8081159 -0.131007E-06  0.532E-03    2.03       8.4  T
   7     -8.8081161 -0.126895E-06  0.464E-04    2.02      96.3  T
   8     -8.8081161 -0.311088E-09  0.215E-04    2.02     208.1  T
     SCC iter.                  ...        0 min,  0.001 sec
     gradient                   ...        0 min,  0.001 sec
 * total energy  :    -8.6456168 Eh     change       -0.1864879E-03 Eh
   gradient norm :     0.0060785 Eh/α   predicted    -0.1525048E-03 ( -18.22%)
   displ. norm   :     0.0293670 α      lambda       -0.6847546E-04
   maximum displ.:     0.0173819 α      in ANC's #4, #1, #2, ...

........................................................................
.............................. CYCLE   11 ..............................
........................................................................
   1     -8.8077370 -0.880774E+01  0.737E-02    2.05       0.0  T
   2     -8.8077365  0.532991E-06  0.467E-02    2.05       1.0  T
   3     -8.8077079  0.285979E-04  0.595E-02    2.06       1.0  T
   4     -8.8077375 -0.295985E-04  0.367E-03    2.05      12.2  T
   5     -8.8077375  0.157608E-07  0.251E-03    2.05      17.8  T
   6     -8.8077375 -0.289343E-07  0.107E-03    2.05      41.6  T
   7     -8.8077375 -0.615074E-08  0.553E-04    2.05      80.9  T
   8     -8.8077375 -0.982975E-09  0.533E-05    2.05     839.8  T
     SCC iter.                  ...        0 min,  0.001 sec
     gradient                   ...        0 min,  0.001 sec
 * total energy  :    -8.6456581 Eh     change       -0.4129223E-04 Eh
   gradient norm :     0.0019051 Eh/α   predicted    -0.3426705E-04 ( -17.01%)
   displ. norm   :     0.0207979 α      lambda       -0.1461722E-04
   maximum displ.:     0.0155040 α      in ANC's #2, #5, #7, ...

........................................................................
.............................. CYCLE   12 ..............................
........................................................................
   1     -8.8077741 -0.880777E+01  0.577E-02    2.08       0.0  T
   2     -8.8077722  0.198064E-05  0.401E-02    2.07       1.1  T
   3     -8.8077515  0.206472E-04  0.544E-02    2.08       1.0  T
   4     -8.8077747 -0.231376E-04  0.669E-03    2.08       6.7  T
   5     -8.8077749 -0.254977E-06  0.255E-03    2.08      17.5  T
   6     -8.8077749 -0.150563E-07  0.195E-03    2.08      23.0  T
   7     -8.8077749 -0.183051E-07  0.305E-04    2.08     146.8  T
   8     -8.8077749 -0.216467E-10  0.480E-05    2.08     932.5  T
     SCC iter.                  ...        0 min,  0.001 sec
     gradient                   ...        0 min,  0.001 sec
 * total energy  :    -8.6456653 Eh     change       -0.7240452E-05 Eh
   gradient norm :     0.0013095 Eh/α   predicted    -0.7311419E-05 (   0.98%)
   displ. norm   :     0.0090525 α      lambda       -0.3048745E-05
   maximum displ.:     0.0075187 α      in ANC's #2, #3, #9, ...

........................................................................
.............................. CYCLE   13 ..............................
........................................................................
   1     -8.8072748 -0.880727E+01  0.257E-02    2.07       0.0  T
   2     -8.8072737  0.112997E-05  0.206E-02    2.07       2.2  T
   3     -8.8072724  0.123845E-05  0.210E-02    2.07       2.1  T
   4     -8.8072749 -0.252284E-05  0.602E-03    2.07       7.4  T
   5     -8.8072752 -0.234597E-06  0.160E-03    2.07      27.9  T
   6     -8.8072752 -0.785908E-08  0.102E-03    2.07      44.0  T
   7     -8.8072752 -0.317489E-08  0.716E-05    2.07     624.6  T
   8     -8.8072752 -0.239808E-11  0.218E-05    2.07    2053.7  T
     SCC iter.                  ...        0 min,  0.001 sec
     gradient                   ...        0 min,  0.001 sec
 * total energy  :    -8.6456672 Eh     change       -0.1846490E-05 Eh
   gradient norm :     0.0004844 Eh/α   predicted    -0.1524963E-05 ( -17.41%)
   displ. norm   :     0.0029209 α      lambda       -0.5044885E-06
   maximum displ.:     0.0018170 α      in ANC's #1, #4, #2, ...

   *** GEOMETRY OPTIMIZATION CONVERGED AFTER 13 ITERATIONS ***

------------------------------------------------------------------------
 total energy gain   :        -0.1077350 Eh      -67.6047 kcal/mol
 total RMSD          :         0.6316210 a0        0.3342 Å
 total power (kW/mol):       -21.7583208 (step)-6931.4456 (real)
------------------------------------------------------------------------

 ANCopt (total)                0 d,  0 h,  0 min,  0.041 sec
 optimizer setup                ...        0 min,  0.000 sec (  0.206%)
 model hessian                  ...        0 min,  0.000 sec (  0.272%)
 ANC generation                 ...        0 min,  0.000 sec (  0.142%)
 coordinate transformation      ...        0 min,  0.000 sec (  0.072%)
 single point calculation       ...        0 min,  0.039 sec ( 96.386%)
 optimization log               ...        0 min,  0.000 sec (  0.922%)
 hessian update                 ...        0 min,  0.000 sec (  0.077%)
 rational function              ...        0 min,  0.000 sec (  0.754%)

================
 final structure:
================
5
 xtb: 6.2.2 (9d81278992624c895f80dd42a50cac0aa55982e2)
C         1.11007363042978   -0.32594996437326    0.01986414219376
C        -0.17901373749686   -0.08972711672122    0.00429265922662
C        -1.39543873635053    0.73719150913821   -0.04037465929223
C        -1.51628796399438   -0.61365752071228    0.02490868812694
H         1.98066680741198    0.29214309266856   -0.00869083025508

 Bond Distances (Angstroems)
 ---------------------------
C1-C2=1.3106         C1-H5=1.0681         C2-C1=1.3106         C2-C3=1.4716         C2-C4=1.4364         C3-C2=1.4716         
C3-C4=1.3578         C4-C2=1.4364         C4-C3=1.3578         H5-C1=1.0681         
 C  H  Rav=1.0681 sigma=0.0000  Rmin=1.0681  Rmax=1.0681     1
 C  C  Rav=1.3941 sigma=0.0634  Rmin=1.3106  Rmax=1.4716     4

 selected bond angles (degree)
 --------------------
H5-C1-C2=134.19                C3-C2-C1=156.16                C4-C2-C1=148.19                C4-C2-C3= 55.65                
C4-C3-C2= 60.86                C3-C4-C2= 63.48                

 selected dihedral angles (degree)
 ---------------------------------
C3-C2-C1-H5=359.96            C4-C2-C1-H5=179.86            C4-C3-C2-C1=179.93            C3-C4-C2-C1=180.05            
           -------------------------------------------------
          |                Final Singlepoint                |
           -------------------------------------------------

          ...................................................
          :                      SETUP                      :
          :.................................................:
          :  # basis functions                  17          :
          :  # atomic orbitals                  17          :
          :  # shells                            9          :
          :  # electrons                        17          :
          :  max. iterations                   250          :
          :  Hamiltonian                  GFN2-xTB          :
          :  restarted?                      false          :
          :  GBSA solvation                  false          :
          :  PC potential                    false          :
          :  electronic temp.          300.0000000     K    :
          :  accuracy                    1.0000000          :
          :  -> integral cutoff          0.2500000E+02      :
          :  -> integral neglect         0.1000000E-07      :
          :  -> SCF convergence          0.1000000E-05 Eh   :
          :  -> wf. convergence          0.1000000E-03 e    :
          :  Broyden damping             0.4000000          :
          ...................................................

 iter      E             dE          RMSdq      gap      omega  full diag
   1     -8.8072752 -0.880728E+01  0.450E-06    2.07       0.0  T
   2     -8.8072752  0.301981E-13  0.334E-06    2.07   13403.3  T
   3     -8.8072752  0.319744E-13  0.381E-06    2.07   11730.9  T

   *** convergence criteria satisfied after 3 iterations ***

         #    Occupation            Energy/Eh            Energy/eV
      -------------------------------------------------------------
         1        2.0000           -0.6956239             -18.9289
       ...           ...                  ...                  ...
         4        2.0000           -0.5449722             -14.8294
         5        2.0000           -0.5143112             -13.9951
         6        2.0000           -0.4985467             -13.5661
         7        2.0000           -0.4384488             -11.9308
         8        1.0000           -0.4041882             -10.9985
         9        1.0000           -0.3998184             -10.8796
        10        1.0000           -0.3407103              -9.2712 (HOMO)
        11                         -0.2645871              -7.1998 (LUMO)
        12                         -0.2032282              -5.5301
        13                         -0.0210010              -0.5715
        14                          0.0775233               2.1095
        15                          0.2732441               7.4354
       ...                                ...                  ...
        17                          0.7747646              21.0824
      -------------------------------------------------------------
                  HL-Gap            0.0761232 Eh            2.0714 eV
             Fermi-level           -0.3619860 Eh           -9.8501 eV

 SCC (total)                   0 d,  0 h,  0 min,  0.003 sec
 SCC setup                      ...        0 min,  0.000 sec (  1.877%)
 Dispersion                     ...        0 min,  0.000 sec (  0.411%)
 integral evaluation            ...        0 min,  0.001 sec ( 41.496%)
 zeroth order Hamiltonian       ...        0 min,  0.000 sec (  0.643%)
 iterations                     ...        0 min,  0.000 sec ( 12.182%)
 molecular gradient             ...        0 min,  0.001 sec ( 40.924%)
 printout                       ...        0 min,  0.000 sec (  2.065%)

         :::::::::::::::::::::::::::::::::::::::::::::::::::::
         ::                     SUMMARY                     ::
         :::::::::::::::::::::::::::::::::::::::::::::::::::::
         :: total energy              -8.645667183564 Eh    ::
         :: gradient norm              0.000506035268 Eh/a0 ::
         :: HOMO-LUMO gap              2.071418150618 eV    ::
         ::.................................................::
         :: SCC energy                -8.807275180296 Eh    ::
         :: -> isotropic ES           -0.005461415133 Eh    ::
         :: -> anisotropic ES         -0.000142887582 Eh    ::
         :: -> anisotropic XC          0.008231150028 Eh    ::
         :: -> dispersion             -0.002192598565 Eh    ::
         :: repulsion energy           0.161608004553 Eh    ::
         :: add. restraining           0.000000000000 Eh    ::
         :::::::::::::::::::::::::::::::::::::::::::::::::::::

           ------------------------------------------------- 
          |                Numerical Hessian                |
           ------------------------------------------------- 
step length          :   0.00500
SCC accuracy         :   0.30000
Hessian scale factor :   1.00000
frozen atoms in %    :   0.00000    0
RMS gradient         :   0.00051
estimated CPU  time      0.00 min
estimated wall time      0.00 min

writing file <hessian>.

 projected vibrational frequencies (cm-1)
eigval :       -0.00    -0.00     0.00     0.00     0.00     0.00
eigval :      340.20   352.63   624.49   658.53   752.42   910.33
eigval :     1487.35  1748.69  3145.93
           -------------------------------------------------
          |                Property Printout                |
           -------------------------------------------------

    * Orbital Energies and Occupations

         #    Occupation            Energy/Eh            Energy/eV
      -------------------------------------------------------------
         1        2.0000           -0.6956239             -18.9289
         2        2.0000           -0.6393070             -17.3964
         3        2.0000           -0.5593275             -15.2201
         4        2.0000           -0.5449722             -14.8294
         5        2.0000           -0.5143112             -13.9951
         6        2.0000           -0.4985467             -13.5661
         7        2.0000           -0.4384488             -11.9308
         8        1.0000           -0.4041882             -10.9985
         9        1.0000           -0.3998185             -10.8796
        10        1.0000           -0.3407103              -9.2712 (HOMO)
        11                         -0.2645872              -7.1998 (LUMO)
        12                         -0.2032281              -5.5301
        13                         -0.0210010              -0.5715
        14                          0.0775233               2.1095
        15                          0.2732442               7.4354
        16                          0.4520725              12.3015
        17                          0.7747646              21.0824
      -------------------------------------------------------------
                  HL-Gap            0.0761231 Eh            2.0714 eV
             Fermi-level           -0.3619860 Eh           -9.8501 eV

     #   Z        covCN         q      C6AA      α(0)
     1   6 C      1.908    -0.098    33.824     9.393
     2   6 C      2.939     0.093    25.930     8.351
     3   6 C      1.959    -0.052    32.479     9.203
     4   6 C      1.960    -0.029    31.858     9.115
     5   1 H      0.927     0.087     1.909     2.161

 Mol. C6AA /au·bohr⁶  :        558.447943
 Mol. C8AA /au·bohr⁸  :      15490.917838
 Mol. α(0) /au        :         38.223221


Wiberg/Mayer (AO) data.
largest (>0.10) Wiberg bond orders for each atom
          total WBO             WBO to atom ...
     1  C   2.674        C    2 1.652    H    5 0.942
     2  C   3.729        C    1 1.652    C    4 1.090    C    3 0.981
Molecule has the following symmetry elements: (sigma) 
It seems to be the Cs point group
     3  C   2.512        C    4 1.482    C    2 0.981
     4  C   2.618        C    3 1.482    C    2 1.090
     5  H   0.961        C    1 0.942

MOs/occ written to file <molden.input>


molecular dipole:
                 x           y           z       tot (Debye)
 q only:        0.309       0.054      -0.002
   full:        0.596       0.178      -0.007       1.580
molecular quadrupole (traceless):
                xx          xy          yy          xz          yz          zz
 q only:        0.264       0.609      -0.244      -0.030       0.013      -0.021
  q+dip:        0.178       1.990       0.071      -0.098      -0.010      -0.250
   full:       -1.596       1.931      -0.783      -0.110       0.160       2.379

           -------------------------------------------------
          |                Geometry Summary                 |
           -------------------------------------------------

      molecular mass/u    :       49.0508844
   center of mass at/Å    :       -0.4442914      -0.0655294       0.0019511
  moments of inertia/u·Å² :        0.1154501E+02   0.6124444E+02   0.7278945E+02
rotational constants/cm⁻¹ :        0.1460166E+01   0.2752516E+00   0.2315945E+00

 * 1 selected distances

     #   Z        #   Z                                     value/Å
     1   6 C      2   6 C                                 1.3106449 (max)

 * 1 distinct bonds (by element types)

   Z      Z             #   av. dist./Å        max./Å        min./Å
   6 C    6 C           1     1.3106449     1.3106449     1.3106449

           -------------------------------------------------
          |               Frequency Printout                |
           -------------------------------------------------
 projected vibrational frequencies (cm-1)
eigval :       -0.00    -0.00     0.00     0.00     0.00     0.00
eigval :      340.20   352.63   624.49   658.53   752.42   910.33
eigval :     1487.35  1748.69  3145.93
 reduced masses (amu)
   1: 11.98   2: 11.79   3: 11.46   4: 11.66   5: 11.73   6: 10.42   7: 10.27   8: 10.65
   9: 11.77  10:  4.02  11:  3.96  12: 11.76  13: 11.92  14: 11.81  15:  1.95
 IR intensities (amu)
   1:  0.09   2:  0.08   3:  0.15   4:  0.09   5:  0.03   6:  0.12   7:  0.23   8:  0.26
   9:  0.87  10:  0.17  11:  0.65  12:  0.37  13:  0.71  14:  0.27  15:  0.12
 Raman intensities (amu)
   1:  0.00   2:  0.00   3:  0.00   4:  0.00   5:  0.00   6:  0.00   7:  0.00   8:  0.00
   9:  0.00  10:  0.00  11:  0.00  12:  0.00  13:  0.00  14:  0.00  15:  0.00
 output can be read by thermo (or use thermo option).
 writing <g98.out> molden fake output.
 recommended (thermochemical) frequency scaling factor: 1.0
           -------------------------------------------------
          |             Thermodynamic Functions             |
           -------------------------------------------------

cs  symmetry found (for desy threshold:  0.10E+00) used in thermo

          ...................................................
          :                      SETUP                      :
          :.................................................:
          :  # frequencies                           9      :
          :  # imaginary freq.                       0      :
          :  linear?                             false      :
          :  only rotor calc.                    false      :
          :  symmetry                               cs      :
          :  rotational number                       1      :
          :  scaling factor                  1.0000000      :
          :  rotor cutoff                   50.0000000 cm⁻¹ :
          :  imag. cutoff                  -20.0000000 cm⁻¹ :
          :.................................................:

    mode    ω/cm⁻¹     T·S(HO)/kcal·mol⁻¹    T·S(FR)/kcal·mol⁻¹   T·S(vib)
   ------------------------------------------------------------------------
   ------------------------------------------------------------------------

   temp. (K)  partition function   enthalpy   heat capacity  entropy
                                   cal/mol     cal/K/mol   cal/K/mol   J/K/mol
 298.15  VIB   1.73                  728.072      6.384      3.535
         ROT  0.173E+05              888.752      2.981     22.377
         INT  0.300E+05             1616.824      9.365     25.912
         TR   0.332E+27             1481.254      4.968     37.578
         TOT                        3098.0779    14.3327    63.4897   265.6407

   temp. (K)  partition function   enthalpy   heat capacity  entropy
                                   cal/mol     cal/K/mol   cal/K/mol   J/K/mol
 120.00  VIB   1.03                   33.677      1.245      0.346
         ROT  0.443E+04              357.707      2.981     19.664
         INT  0.457E+04              391.383      4.226     20.010
         TR   0.849E+26              596.178      4.968     33.058
         TOT                         987.5613     9.1940    53.0688   222.0398

   temp. (K)  partition function   enthalpy   heat capacity  entropy
                                   cal/mol     cal/K/mol   cal/K/mol   J/K/mol
 100.00  VIB   1.01                   14.105      0.725      0.169
         ROT  0.337E+04              298.089      2.981     19.121
         INT  0.341E+04              312.194      3.706     19.290
         TR   0.646E+26              496.815      4.968     32.153
         TOT                         809.0087     8.6743    51.4429   215.2369

   temp. (K)  partition function   enthalpy   heat capacity  entropy
                                   cal/mol     cal/K/mol   cal/K/mol   J/K/mol
  80.00  VIB   1.00                    3.965      0.312      0.058
         ROT  0.241E+04              238.471      2.981     18.455
         INT  0.242E+04              242.437      3.293     18.513
         TR   0.462E+26              397.452      4.968     31.045
         TOT                         639.8887     8.2607    49.5580   207.3509

   temp. (K)  partition function   enthalpy   heat capacity  entropy
                                   cal/mol     cal/K/mol   cal/K/mol   J/K/mol
  60.00  VIB   1.00                    0.494      0.068      0.009
         ROT  0.156E+04              178.853      2.981     17.598
         INT  0.157E+04              179.347      3.049     17.607
         TR   0.300E+26              298.089      4.968     29.616
         TOT                         477.4364     8.0174    47.2234   197.5828

   temp. (K)  partition function   enthalpy   heat capacity  entropy
                                   cal/mol     cal/K/mol   cal/K/mol   J/K/mol
  40.00  VIB   1.00                    0.008      0.002     -0.000
         ROT   852.                  119.236      2.981     16.389
         INT   852.                  119.243      2.983     16.389
         TR   0.163E+26              198.726      4.968     27.603
         TOT                         317.9694     7.9515    43.9919   184.0623

   temp. (K)  partition function   enthalpy   heat capacity  entropy
                                   cal/mol     cal/K/mol   cal/K/mol   J/K/mol
  20.00  VIB   1.00                    0.000      0.000     -0.001
         ROT   301.                   59.618      2.981     14.323
         INT   301.                   59.618      2.981     14.322
         TR   0.577E+25               99.363      4.968     24.161
         TOT                         158.9808     7.9490    38.4829   161.0124

   temp. (K)  partition function   enthalpy   heat capacity  entropy
                                   cal/mol     cal/K/mol   cal/K/mol   J/K/mol
  10.00  VIB   1.00                    0.000      0.000     -0.002
         ROT   106.                   29.809      2.981     12.257
         INT   106.                   29.809      2.981     12.255
         TR   0.204E+25               49.681      4.968     20.719
         TOT                          79.4904     7.9490    32.9740   137.9634

       T/K    H(0)-H(T)+PV         H(T)/Eh          T*S/Eh         G(T)/Eh
   ------------------------------------------------------------------------
    298.15    0.493710E-02    0.277657E-01    0.301660E-01   -0.240032E-02
    120.00    0.157378E-02    0.244023E-01    0.101485E-01    0.142539E-01
    100.00    0.128924E-02    0.241178E-01    0.819794E-02    0.159199E-01
     80.00    0.101973E-02    0.238483E-01    0.631806E-02    0.175302E-01
     60.00    0.760843E-03    0.235894E-01    0.451532E-02    0.190741E-01
     40.00    0.506717E-03    0.233353E-01    0.280422E-02    0.205311E-01
     20.00    0.253352E-03    0.230819E-01    0.122653E-02    0.218554E-01
     10.00    0.126676E-03    0.229552E-01    0.525475E-03    0.224298E-01 (used)
   ------------------------------------------------------------------------

         :::::::::::::::::::::::::::::::::::::::::::::::::::::
         ::                  THERMODYNAMIC                  ::
         :::::::::::::::::::::::::::::::::::::::::::::::::::::
         :: total free energy          -8.623237415516 Eh   ::
         ::.................................................::
         :: total energy               -8.645667183470 Eh   ::
         :: zero point energy           0.022828566737 Eh   ::
         :: G(RRHO) w/o ZPVE           -0.000398798783 Eh   ::
         :: G(RRHO) contrib.            0.022429767954 Eh   ::
         :::::::::::::::::::::::::::::::::::::::::::::::::::::

optimized geometry written to: xtbopt.xyz


           -------------------------------------------------
          | TOTAL ENERGY               -8.645667183470 Eh   |
          | TOTAL ENTHALPY             -8.622711940718 Eh   |
          | TOTAL FREE ENERGY          -8.623237415516 Eh   |
          | GRADIENT NORM               0.000506158384 Eh/α |
          | HOMO-LUMO GAP               2.071415051894 eV   |
           -------------------------------------------------

------------------------------------------------------------------------
 * finished run on 2020/05/12 at 11:45:09.807     
------------------------------------------------------------------------
 total:
 * wall-time:     0 d,  0 h,  0 min,  0.152 sec
 *  cpu-time:     0 d,  0 h,  0 min,  0.152 sec
 * ratio c/w:     0.999 speedup
 SCF:
 * wall-time:     0 d,  0 h,  0 min,  0.004 sec
 *  cpu-time:     0 d,  0 h,  0 min,  0.004 sec
 * ratio c/w:     0.999 speedup
 ANC optimizer:
 * wall-time:     0 d,  0 h,  0 min,  0.044 sec
 *  cpu-time:     0 d,  0 h,  0 min,  0.044 sec
 * ratio c/w:     0.999 speedup
 numerical hessian:
 * wall-time:     0 d,  0 h,  0 min,  0.087 sec
 *  cpu-time:     0 d,  0 h,  0 min,  0.086 sec
 * ratio c/w:     0.999 speedup

