      -----------------------------------------------------------      
     |                   =====================                   |     
     |                           x T B                           |     
     |                   =====================                   |     
     |                         S. Grimme                         |     
     |          Mulliken Center for Theoretical Chemistry        |     
     |                    University of Bonn                     |     
      -----------------------------------------------------------      

   * xtb version 6.2.2 (9d81278992624c895f80dd42a50cac0aa55982e2) compiled by '@Darwin' on 04/03/2020

   xtb is free software: you can redistribute it and/or modify it under
   the terms of the GNU Lesser General Public License as published by
   the Free Software Foundation, either version 3 of the License, or
   (at your option) any later version.
   
   xtb is distributed in the hope that it will be useful,
   but WITHOUT ANY WARRANTY; without even the implied warranty of
   MERCHANTABILITY or FITNESS FOR A PARTICULAR PURPOSE.  See the
   GNU Lesser General Public License for more details.
   
   Cite this work as:
   * S. Grimme, C. Bannwarth, P. Shushkov, J. Chem. Theory Comput., 2017,
     13, 1989-2009. DOI: 10.1021/acs.jctc.7b00118
   * C. Bannwarth, S. Ehlert and S. Grimme., J. Chem. Theory Comput., 2019,
     15, 1652-1671. DOI: 10.1021/acs.jctc.8b01176
   * P. Pracht, E. Caldeweyher, S. Ehlert, S. Grimme, ChemRxiv, 2019, preprint.
     DOI: 10.26434/chemrxiv.8326202.v1
   
   for DFT-D4:
   * E. Caldeweyher, C. Bannwarth and S. Grimme, J. Chem. Phys., 2017,
     147, 034112. DOI: 10.1063/1.4993215
   * E. Caldeweyher, S. Ehlert, A. Hansen, H. Neugebauer, S. Spicher,
     C. Bannwarth and S. Grimme, J. Chem. Phys., 2019, 150, 154122.
     DOI: 10.1063/1.5090222
   
   for sTDA-xTB:
   * S. Grimme and C. Bannwarth, J. Chem. Phys., 2016, 145, 054103.
     DOI: 10.1063/1.4959605
   
   in the mass-spec context:
   * V. Asgeirsson, C. Bauer and S. Grimme, Chem. Sci., 2017, 8, 4879.
     DOI: 10.1039/c7sc00601b
   
   for metadynamics refer to:
   * S. Grimme, J. Chem. Theory Comput., 2019, 155, 2847-2862
     DOI: 10.1021/acs.jctc.9b00143
   
   with help from (in alphabetical order)
   C. Bannwarth, F. Bohle, G. Brandenburg, E. Caldeweyher, M. Checinski,
   S. Dohm, S. Ehlert, S. Ehrlich, F. März, H. Neugebauer, J. Pisarek,
   P. Pracht, P. Shushkov, and S. Spicher.
   
 * started run on 2020/05/12 at 11:44:06.830     

           -------------------------------------------------
          |                Calculation Setup                |
           -------------------------------------------------

          program call               : xtb --input C4N1_20_S_3.input C4N1_20_S_3.xyz --ohess --molden --namespace C4N1_20_S_3 output.out
          calculation namespace      : C4N1_20_S_3
          coordinate file            : C4N1_20_S_3.xyz
          number of atoms            :                     5
          number of electrons        :                    21
          charge                     :                     0
          spin                       :                   1.5
          first test random number   :      0.41001466173893

   ID    Z sym.   atoms
    1    6 C      1, 3-5
    2    7 N      2

           -------------------------------------------------
          |                 G F N 2 - x T B                 |
           -------------------------------------------------

        Reference                      10.1021/acs.jctc.8b01176
      * Hamiltonian:
        H0-scaling (s, p, d)           1.850000    2.230000    2.230000
        zeta-weighting                 0.500000
      * Dispersion:
        s8                             2.700000
        a1                             0.520000
        a2                             5.000000
        s9                             5.000000
      * Repulsion:
        kExp                           1.500000    1.000000
        rExp                           1.000000
      * Coulomb:
        alpha                          2.000000
        third order                    shell-resolved
        anisotropic                    true
        a3                             3.000000
        a5                             4.000000
        cn-shift                       1.200000
        cn-exp                         4.000000
        max-rad                        5.000000


          ...................................................
          :                      SETUP                      :
          :.................................................:
          :  # basis functions                  20          :
          :  # atomic orbitals                  20          :
          :  # shells                           10          :
          :  # electrons                        21          :
          :  max. iterations                   250          :
          :  Hamiltonian                  GFN2-xTB          :
          :  restarted?                      false          :
          :  GBSA solvation                  false          :
          :  PC potential                    false          :
          :  electronic temp.          300.0000000     K    :
          :  accuracy                    1.0000000          :
          :  -> integral cutoff          0.2500000E+02      :
          :  -> integral neglect         0.1000000E-07      :
          :  -> SCF convergence          0.1000000E-05 Eh   :
          :  -> wf. convergence          0.1000000E-03 e    :
          :  Broyden damping             0.4000000          :
          ...................................................

 iter      E             dE          RMSdq      gap      omega  full diag
   1    -10.7638519 -0.107639E+02  0.115E+01    1.52       0.0  T
   2     -8.6167599  0.214709E+01  0.139E+01    0.15       1.0  T
   3     -7.9008459  0.715914E+00  0.141E+01    0.32       1.0  T
   4    -10.8806537 -0.297981E+01  0.521E+00    1.13       1.0  T
   5    -10.9019883 -0.213346E-01  0.435E+00    1.49       1.0  T
   6    -10.8677397  0.342486E-01  0.403E+00    1.24       1.0  T
   7    -10.9188577 -0.511181E-01  0.249E+00    1.33       1.0  T
   8    -10.9388663 -0.200085E-01  0.133E+00    1.46       1.0  T
   9    -10.9261808  0.126854E-01  0.121E+00    1.47       1.0  T
  10    -10.9374479 -0.112671E-01  0.877E-01    1.41       1.0  T
  11    -10.9345484  0.289943E-02  0.108E+00    1.40       1.0  T
  12    -10.9397440 -0.519558E-02  0.436E-01    1.44       1.0  T
  13    -10.9411213 -0.137722E-02  0.180E-01    1.42       1.0  T
  14    -10.9412642 -0.142943E-03  0.592E-02    1.43       1.0  T
  15    -10.9412645 -0.300571E-06  0.460E-02    1.43       1.0  T
  16    -10.9412750 -0.105340E-04  0.241E-02    1.43       1.9  T
  17    -10.9412788 -0.374864E-05  0.363E-03    1.43      12.3  T
  18    -10.9412789 -0.768269E-07  0.412E-04    1.43     108.5  T
  19    -10.9412789  0.197564E-08  0.681E-04    1.43      65.7  T

   *** convergence criteria satisfied after 19 iterations ***

         #    Occupation            Energy/Eh            Energy/eV
      -------------------------------------------------------------
         1        2.0000           -0.7533114             -20.4986
       ...           ...                  ...                  ...
         6        2.0000           -0.5331989             -14.5091
         7        2.0000           -0.5206457             -14.1675
         8        2.0000           -0.5009947             -13.6328
         9        1.6647           -0.4497615             -12.2386
        10        1.3353           -0.4484615             -12.2033
        11        1.0000           -0.4365885             -11.8802
        12        1.0000           -0.4286547             -11.6643 (HOMO)
        13                         -0.3761638             -10.2359 (LUMO)
        14                         -0.3417615              -9.2998
        15                         -0.3108939              -8.4599
        16                         -0.1429211              -3.8891
        17                         -0.0111663              -0.3039
       ...                                ...                  ...
        20                          0.1953508               5.3158
      -------------------------------------------------------------
                  HL-Gap            0.0524909 Eh            1.4284 eV
             Fermi-level           -0.4257604 Eh          -11.5855 eV

 SCC (total)                   0 d,  0 h,  0 min,  0.005 sec
 SCC setup                      ...        0 min,  0.000 sec (  1.432%)
 Dispersion                     ...        0 min,  0.000 sec (  0.356%)
 integral evaluation            ...        0 min,  0.001 sec ( 26.164%)
 zeroth order Hamiltonian       ...        0 min,  0.000 sec (  0.415%)
 iterations                     ...        0 min,  0.002 sec ( 44.609%)
 molecular gradient             ...        0 min,  0.001 sec ( 25.315%)
 printout                       ...        0 min,  0.000 sec (  1.472%)

         :::::::::::::::::::::::::::::::::::::::::::::::::::::
         ::                     SUMMARY                     ::
         :::::::::::::::::::::::::::::::::::::::::::::::::::::
         :: total energy             -10.873755917749 Eh    ::
         :: gradient norm              0.291301477498 Eh/a0 ::
         :: HOMO-LUMO gap              1.428350943421 eV    ::
         ::.................................................::
         :: SCC energy               -10.941278853154 Eh    ::
         :: -> isotropic ES           -0.023183549120 Eh    ::
         :: -> anisotropic ES          0.002478481363 Eh    ::
         :: -> anisotropic XC          0.006349121759 Eh    ::
         :: -> dispersion             -0.002913074994 Eh    ::
         :: repulsion energy           0.067522942517 Eh    ::
         :: add. restraining           0.000000000000 Eh    ::
         :::::::::::::::::::::::::::::::::::::::::::::::::::::

      ----------------------------------------------------------- 
     |                   =====================                   |
     |                        A N C O P T                        |
     |                   =====================                   |
     |               Approximate Normal Coordinate               |
     |                Rational Function Optimizer                |
      ----------------------------------------------------------- 

          ...................................................
          :                      SETUP                      :
          :.................................................:
          :   optimization level            normal          :
          :   max. optcycles                   200          :
          :   ANC micro-cycles                  20          :
          :   degrees of freedom                 9          :
          :.................................................:
          :   RF solver                   davidson          :
          :   write xtbopt.log                true          :
          :   linear?                        false          :
          :   energy convergence         0.5000000E-05 Eh   :
          :   grad. convergence          0.1000000E-02 Eh/α :
          :   maximium RF displ.         1.0000000          :
          :   Hlow (freq-cutoff)         0.1000000E-01      :
          :   Hmax (freq-cutoff)         5.0000000          :
          :   S6 in model hess.         20.0000000          :
          ...................................................

generating ANC from model Hessian ...
Using Lindh-Hessian (1995)
 Shifting diagonal of input Hessian by    0.0000000000000000     
 Lowest  eigenvalues of input Hessian
   -0.000000   -0.000000   -0.000000    0.000000    0.000000    0.000000
    0.012270    0.061102    0.081278    0.117396    0.793134    0.816967
    0.832315    1.092062    1.477603
 Highest eigenvalues
    0.117396    0.793134    0.816967    0.832315    1.092062    1.477603


........................................................................
.............................. CYCLE    1 ..............................
........................................................................
   1    -10.9412789 -0.109413E+02  0.126E-04    1.43       0.0  T
   2    -10.9412788  0.187127E-07  0.146E-03    1.43      30.7  T
   3    -10.9412789 -0.165346E-07  0.543E-04    1.43      82.3  T
   4    -10.9412789 -0.326160E-09  0.488E-04    1.43      91.6  T
     SCC iter.                  ...        0 min,  0.001 sec
     gradient                   ...        0 min,  0.001 sec
 * total energy  :   -10.8737559 Eh     change       -0.1863171E-08 Eh
   gradient norm :     0.2913006 Eh/α   predicted     0.0000000E+00 (-100.00%)
   displ. norm   :     0.3402134 α      lambda       -0.9257277E-01
   maximum displ.:     0.2191761 α      in ANC's #7, #5, #2, ...

........................................................................
.............................. CYCLE    2 ..............................
........................................................................
   1    -11.0489602 -0.110490E+02  0.257E+00    2.62       0.0  T
   2    -10.6027520  0.446208E+00  0.632E+00    1.80       1.0  T
   3    -11.0584078 -0.455656E+00  0.172E+00    2.54       1.0  T
   4    -11.0509958  0.741194E-02  0.186E+00    2.80       1.0  T
   5    -11.0681808 -0.171849E-01  0.916E-01    2.71       1.0  T
   6    -11.0707123 -0.253158E-02  0.726E-01    2.77       1.0  T
   7    -11.0734760 -0.276363E-02  0.364E-01    2.82       1.0  T
   8    -11.0740954 -0.619387E-03  0.293E-01    2.82       1.0  T
   9    -11.0746010 -0.505676E-03  0.953E-02    2.81       1.0  T
  10    -11.0746310 -0.299300E-04  0.535E-02    2.81       1.0  T
  11    -11.0746288  0.214740E-05  0.379E-02    2.81       1.2  T
  12    -11.0746391 -0.102960E-04  0.772E-03    2.81       5.8  T
  13    -11.0746396 -0.472127E-06  0.177E-03    2.82      25.2  T
  14    -11.0746396 -0.127170E-07  0.178E-04    2.82     250.8  T
  15    -11.0746396  0.561021E-09  0.315E-04    2.82     142.2  T
     SCC iter.                  ...        0 min,  0.002 sec
     gradient                   ...        0 min,  0.001 sec
 * total energy  :   -10.9551211 Eh     change       -0.8136517E-01 Eh
   gradient norm :     0.2010586 Eh/α   predicted    -0.5164383E-01 ( -36.53%)
   displ. norm   :     0.5279203 α      lambda       -0.1027500E+00
   maximum displ.:     0.3625129 α      in ANC's #7, #5, #4, ...

........................................................................
.............................. CYCLE    3 ..............................
........................................................................
   1    -11.3046874 -0.113047E+02  0.335E+00    3.53       0.0  T
   2    -11.3057820 -0.109460E-02  0.201E+00    3.51       1.0  T
   3    -11.3024160  0.336597E-02  0.970E-01    3.50       1.0  T
   4    -11.3062542 -0.383812E-02  0.252E-01    3.47       1.0  T
   5    -11.3055033  0.750886E-03  0.382E-01    3.49       1.0  T
   6    -11.3063991 -0.895775E-03  0.115E-01    3.49       1.0  T
   7    -11.3064377 -0.386446E-04  0.268E-02    3.48       1.7  T
   8    -11.3064401 -0.237811E-05  0.870E-03    3.49       5.1  T
   9    -11.3064401  0.812233E-08  0.217E-03    3.49      20.6  T
  10    -11.3064401 -0.238209E-07  0.167E-04    3.49     267.6  T
  11    -11.3064401 -0.124274E-10  0.471E-05    3.49     949.2  T
     SCC iter.                  ...        0 min,  0.001 sec
     gradient                   ...        0 min,  0.001 sec
 * total energy  :   -10.9103905 Eh     change        0.4473057E-01 Eh
   gradient norm :     0.8262599 Eh/α   predicted    -0.6569320E-01 (-246.86%)
   displ. norm   :     0.3263201 α      lambda       -0.2348308E+00
   maximum displ.:     0.2007312 α      in ANC's #2, #7, #5, ...

........................................................................
.............................. CYCLE    4 ..............................
........................................................................
   1    -11.1618861 -0.111619E+02  0.198E+00    3.25       0.0  T
   2    -10.7357225  0.426164E+00  0.596E+00    2.60       1.0  T
   3    -11.1667569 -0.431034E+00  0.176E+00    3.17       1.0  T
   4    -11.1789331 -0.121762E-01  0.110E+00    3.15       1.0  T
   5    -11.1784711  0.461962E-03  0.879E-01    3.21       1.0  T
   6    -11.1799560 -0.148486E-02  0.402E-01    3.23       1.0  T
   7    -11.1799632 -0.725184E-05  0.393E-01    3.22       1.0  T
   8    -11.1807490 -0.785782E-03  0.166E-01    3.22       1.0  T
   9    -11.1807526 -0.363324E-05  0.110E-01    3.22       1.0  T
  10    -11.1807381  0.145618E-04  0.446E-02    3.21       1.0  T
  11    -11.1807508 -0.127159E-04  0.378E-02    3.22       1.2  T
  12    -11.1807537 -0.292770E-05  0.329E-02    3.22       1.4  T
  13    -11.1807551 -0.138574E-05  0.216E-02    3.22       2.1  T
  14    -11.1807564 -0.131610E-05  0.138E-02    3.22       3.2  T
  15    -11.1807572 -0.808445E-06  0.409E-04    3.22     109.4  T
  16    -11.1807572  0.258162E-08  0.105E-03    3.22      42.6  T
  17    -11.1807572 -0.409802E-08  0.184E-04    3.22     243.0  T
     SCC iter.                  ...        0 min,  0.002 sec
     gradient                   ...        0 min,  0.001 sec
 * total energy  :   -10.9951112 Eh     change       -0.8472073E-01 Eh
   gradient norm :     0.0775942 Eh/α   predicted    -0.1299184E+00 (  53.35%)
   displ. norm   :     0.1973959 α      lambda       -0.6893138E-02
   maximum displ.:     0.1196228 α      in ANC's #4, #2, #5, ...

........................................................................
.............................. CYCLE    5 ..............................
........................................................................
   1    -11.1775862 -0.111776E+02  0.240E+00    3.12       0.0  T
   2    -10.7763919  0.401194E+00  0.556E+00    2.62       1.0  T
   3    -11.1582321 -0.381840E+00  0.230E+00    3.26       1.0  T
   4    -11.1832905 -0.250584E-01  0.214E+00    3.08       1.0  T
   5    -11.1842912 -0.100066E-02  0.886E-01    3.11       1.0  T
   6    -11.1862164 -0.192520E-02  0.757E-01    3.10       1.0  T
   7    -11.1864908 -0.274389E-03  0.629E-01    3.10       1.0  T
   8    -11.1871597 -0.668901E-03  0.584E-01    3.09       1.0  T
   9    -11.1871538  0.584097E-05  0.594E-01    3.09       1.0  T
  10    -11.1871779 -0.241156E-04  0.558E-01    3.08       1.0  T
  11    -11.1873288 -0.150920E-03  0.375E-02    3.06       1.2  T
  12    -11.1873271  0.170767E-05  0.427E-02    3.06       1.0  T
  13    -11.1873290 -0.190607E-05  0.122E-02    3.06       3.7  T
  14    -11.1873292 -0.116329E-06  0.410E-03    3.06      10.9  T
  15    -11.1873292 -0.354474E-07  0.155E-03    3.06      28.9  T
  16    -11.1873292 -0.122510E-08  0.204E-04    3.06     218.9  T
  17    -11.1873292 -0.523226E-10  0.145E-04    3.06     308.9  T
     SCC iter.                  ...        0 min,  0.002 sec
     gradient                   ...        0 min,  0.001 sec
 * total energy  :   -11.0002139 Eh     change       -0.5102623E-02 Eh
   gradient norm :     0.0588272 Eh/α   predicted    -0.3580866E-02 ( -29.82%)
   displ. norm   :     0.3945076 α      lambda       -0.1172755E-01
   maximum displ.:     0.2830288 α      in ANC's #1, #5, #4, ...

........................................................................
.............................. CYCLE    6 ..............................
........................................................................
   1    -11.1900246 -0.111900E+02  0.292E+00    2.84       0.0  T
   2    -10.8104295  0.379595E+00  0.539E+00    2.38       1.0  T
   3    -11.0841645 -0.273735E+00  0.330E+00    3.31       1.0  T
   4    -11.1912544 -0.107090E+00  0.142E+00    2.95       1.0  T
   5    -11.1868328  0.442158E-02  0.127E+00    2.89       1.0  T
   6    -11.1898911 -0.305829E-02  0.108E+00    2.91       1.0  T
   7    -11.1929240 -0.303294E-02  0.907E-01    2.90       1.0  T
   8    -11.1925553  0.368703E-03  0.937E-01    2.91       1.0  T
   9    -11.1956989 -0.314363E-02  0.598E-01    2.84       1.0  T
  10    -11.1968341 -0.113515E-02  0.413E-01    2.81       1.0  T
  11    -11.1978354 -0.100134E-02  0.122E-02    2.72       3.7  T
  12    -11.1978038  0.315993E-04  0.757E-02    2.71       1.0  T
  13    -11.1978344 -0.306138E-04  0.129E-02    2.72       3.5  T
  14    -11.1978358 -0.139278E-05  0.133E-03    2.72      33.6  T
  15    -11.1978358  0.254436E-07  0.199E-03    2.72      22.4  T
  16    -11.1978358 -0.255263E-07  0.125E-04    2.72     357.8  T
  17    -11.1978358 -0.625757E-10  0.417E-05    2.72    1071.6  T
     SCC iter.                  ...        0 min,  0.002 sec
     gradient                   ...        0 min,  0.001 sec
 * total energy  :   -11.0093386 Eh     change       -0.9124750E-02 Eh
   gradient norm :     0.0466367 Eh/α   predicted    -0.6776387E-02 ( -25.74%)
   displ. norm   :     0.5026538 α      lambda       -0.7327505E-02
   maximum displ.:     0.4049966 α      in ANC's #1, #2, #5, ...

........................................................................
.............................. CYCLE    7 ..............................
........................................................................
   1    -11.1625850 -0.111626E+02  0.206E+00    2.79       0.0  T
   2    -11.1565502  0.603483E-02  0.138E+00    2.78       1.0  T
   3    -11.1198922  0.366580E-01  0.215E+00    2.36       1.0  T
   4    -11.1634538 -0.435617E-01  0.359E-01    2.76       1.0  T
   5    -11.1642555 -0.801677E-03  0.167E-01    2.80       1.0  T
   6    -11.1643021 -0.466073E-04  0.108E-01    2.80       1.0  T
   7    -11.1642133  0.888525E-04  0.125E-01    2.80       1.0  T
   8    -11.1643267 -0.113453E-03  0.137E-02    2.81       3.3  T
   9    -11.1643271 -0.416856E-06  0.736E-03    2.80       6.1  T
  10    -11.1643273 -0.151465E-06  0.856E-04    2.81      52.2  T
  11    -11.1643273 -0.722759E-09  0.399E-04    2.81     111.9  T
     SCC iter.                  ...        0 min,  0.001 sec
     gradient                   ...        0 min,  0.001 sec
 * total energy  :   -11.0022631 Eh     change        0.7075541E-02 Eh
   gradient norm :     0.0993185 Eh/α   predicted    -0.4589429E-02 (-164.86%)
   displ. norm   :     0.3538990 α      lambda       -0.2109426E-01
   maximum displ.:     0.3230652 α      in ANC's #1, #2, #3, ...

........................................................................
.............................. CYCLE    8 ..............................
........................................................................
   1    -11.2221306 -0.112221E+02  0.152E+00    3.14       0.0  T
   2    -11.1741115  0.480191E-01  0.223E+00    2.65       1.0  T
   3    -11.2221628 -0.480513E-01  0.105E+00    3.26       1.0  T
   4    -11.2278347 -0.567185E-02  0.529E-01    2.97       1.0  T
   5    -11.2293425 -0.150781E-02  0.224E-01    3.03       1.0  T
   6    -11.2294966 -0.154092E-03  0.138E-01    3.05       1.0  T
   7    -11.2295558 -0.592089E-04  0.824E-02    3.04       1.0  T
   8    -11.2295671 -0.113593E-04  0.980E-03    3.05       4.6  T
   9    -11.2295673 -0.159423E-06  0.537E-03    3.05       8.3  T
  10    -11.2295674 -0.874693E-07  0.115E-03    3.05      39.1  T
  11    -11.2295674 -0.775185E-08  0.375E-04    3.05     119.4  T
  12    -11.2295674 -0.971490E-10  0.683E-05    3.05     654.6  T
     SCC iter.                  ...        0 min,  0.001 sec
     gradient                   ...        0 min,  0.001 sec
 * total energy  :   -11.0097279 Eh     change       -0.7464855E-02 Eh
   gradient norm :     0.0644436 Eh/α   predicted    -0.1186810E-01 (  58.99%)
   displ. norm   :     0.2079318 α      lambda       -0.7168222E-02
   maximum displ.:     0.1305385 α      in ANC's #8, #7, #5, ...

........................................................................
.............................. CYCLE    9 ..............................
........................................................................
   1    -11.1957305 -0.111957E+02  0.153E+00    2.68       0.0  T
   2    -11.1799641  0.157664E-01  0.155E+00    2.81       1.0  T
   3    -11.1754115  0.455257E-02  0.174E+00    2.48       1.0  T
   4    -11.1954305 -0.200190E-01  0.541E-01    2.82       1.0  T
   5    -11.1984919 -0.306141E-02  0.254E-01    2.68       1.0  T
   6    -11.1985549 -0.629802E-04  0.194E-01    2.68       1.0  T
   7    -11.1985183  0.366638E-04  0.190E-01    2.68       1.0  T
   8    -11.1986134 -0.951062E-04  0.469E-02    2.69       1.0  T
   9    -11.1986260 -0.126588E-04  0.844E-03    2.69       5.3  T
  10    -11.1986256  0.427959E-06  0.886E-03    2.70       5.0  T
  11    -11.1986261 -0.525461E-06  0.683E-04    2.69      65.5  T
  12    -11.1986261 -0.426469E-08  0.478E-04    2.69      93.5  T
     SCC iter.                  ...        0 min,  0.002 sec
     gradient                   ...        0 min,  0.001 sec
 * total energy  :   -11.0099534 Eh     change       -0.2254785E-03 Eh
   gradient norm :     0.0437165 Eh/α   predicted    -0.3739075E-02 (1558.28%)
   displ. norm   :     0.1200196 α      lambda       -0.3050071E-02
   maximum displ.:     0.0656717 α      in ANC's #8, #5, #7, ...

........................................................................
.............................. CYCLE   10 ..............................
........................................................................
   1    -11.2098193 -0.112098E+02  0.797E-01    2.83       0.0  T
   2    -11.2067479  0.307143E-02  0.712E-01    2.75       1.0  T
   3    -11.2057682  0.979709E-03  0.810E-01    2.93       1.0  T
   4    -11.2098741 -0.410585E-02  0.242E-01    2.76       1.0  T
   5    -11.2104066 -0.532522E-03  0.889E-02    2.82       1.0  T
   6    -11.2104070 -0.421547E-06  0.745E-02    2.82       1.0  T
   7    -11.2103990  0.801126E-05  0.707E-02    2.82       1.0  T
   8    -11.2104235 -0.245037E-04  0.775E-03    2.81       5.8  T
   9    -11.2104235 -0.395767E-07  0.445E-03    2.81      10.1  T
  10    -11.2104236 -0.665769E-07  0.344E-04    2.81     130.0  T
  11    -11.2104236 -0.135712E-09  0.139E-04    2.81     322.6  T
     SCC iter.                  ...        0 min,  0.001 sec
     gradient                   ...        0 min,  0.001 sec
 * total energy  :   -11.0116649 Eh     change       -0.1711535E-02 Eh
   gradient norm :     0.0050401 Eh/α   predicted    -0.1547003E-02 (  -9.61%)
   displ. norm   :     0.0516008 α      lambda       -0.1605487E-03
   maximum displ.:     0.0460341 α      in ANC's #1, #3, #2, ...

........................................................................
.............................. CYCLE   11 ..............................
........................................................................
   1    -11.2110418 -0.112110E+02  0.160E-01    2.79       0.0  T
   2    -11.2110427 -0.923959E-06  0.962E-02    2.81       1.0  T
   3    -11.2110144  0.283412E-04  0.772E-02    2.79       1.0  T
   4    -11.2110421 -0.277519E-04  0.305E-02    2.80       1.5  T
   5    -11.2110486 -0.649657E-05  0.951E-03    2.80       4.7  T
   6    -11.2110490 -0.408436E-06  0.388E-03    2.80      11.5  T
   7    -11.2110487  0.344905E-06  0.606E-03    2.80       7.4  T
   8    -11.2110491 -0.366806E-06  0.797E-04    2.80      56.1  T
   9    -11.2110491 -0.176066E-08  0.141E-04    2.80     318.1  T
     SCC iter.                  ...        0 min,  0.001 sec
     gradient                   ...        0 min,  0.001 sec
 * total energy  :   -11.0117451 Eh     change       -0.8017785E-04 Eh
   gradient norm :     0.0113473 Eh/α   predicted    -0.8048802E-04 (   0.39%)
   displ. norm   :     0.0287977 α      lambda       -0.8483624E-04
   maximum displ.:     0.0239474 α      in ANC's #1, #5, #4, ...

........................................................................
.............................. CYCLE   12 ..............................
........................................................................
   1    -11.2115391 -0.112115E+02  0.107E-01    2.81       0.0  T
   2    -11.2115212  0.179494E-04  0.692E-02    2.82       1.0  T
   3    -11.2114112  0.109941E-03  0.129E-01    2.79       1.0  T
   4    -11.2115420 -0.130780E-03  0.116E-02    2.82       3.9  T
   5    -11.2115426 -0.590787E-06  0.106E-02    2.81       4.2  T
   6    -11.2115432 -0.602086E-06  0.610E-03    2.81       7.3  T
   7    -11.2115434 -0.171983E-06  0.272E-03    2.81      16.5  T
   8    -11.2115434 -0.399509E-07  0.329E-04    2.81     135.9  T
   9    -11.2115434 -0.104272E-09  0.163E-04    2.81     274.6  T
     SCC iter.                  ...        0 min,  0.001 sec
     gradient                   ...        0 min,  0.001 sec
 * total energy  :   -11.0118119 Eh     change       -0.6675660E-04 Eh
   gradient norm :     0.0084938 Eh/α   predicted    -0.4245474E-04 ( -36.40%)
   displ. norm   :     0.0728484 α      lambda       -0.1584380E-03
   maximum displ.:     0.0584464 α      in ANC's #1, #2, #5, ...

........................................................................
.............................. CYCLE   13 ..............................
........................................................................
   1    -11.2120341 -0.112120E+02  0.292E-01    2.79       0.0  T
   2    -11.2118614  0.172726E-03  0.199E-01    2.81       1.0  T
   3    -11.2111222  0.739215E-03  0.357E-01    2.75       1.0  T
   4    -11.2120527 -0.930522E-03  0.417E-02    2.80       1.1  T
   5    -11.2120604 -0.764651E-05  0.377E-02    2.79       1.2  T
   6    -11.2120681 -0.772464E-05  0.214E-02    2.79       2.1  T
   7    -11.2120705 -0.237685E-05  0.570E-03    2.79       7.8  T
   8    -11.2120706 -0.153249E-06  0.116E-03    2.79      38.6  T
   9    -11.2120706 -0.802824E-10  0.719E-04    2.79      62.2  T
  10    -11.2120706 -0.281146E-09  0.786E-05    2.79     569.0  T
     SCC iter.                  ...        0 min,  0.001 sec
     gradient                   ...        0 min,  0.002 sec
 * total energy  :   -11.0119146 Eh     change       -0.1027320E-03 Eh
   gradient norm :     0.0047226 Eh/α   predicted    -0.7963936E-04 ( -22.48%)
   displ. norm   :     0.0332003 α      lambda       -0.4978508E-04
   maximum displ.:     0.0218427 α      in ANC's #1, #2, #5, ...

........................................................................
.............................. CYCLE   14 ..............................
........................................................................
   1    -11.2130832 -0.112131E+02  0.163E-01    2.76       0.0  T
   2    -11.2130436  0.395191E-04  0.110E-01    2.77       1.0  T
   3    -11.2128502  0.193466E-03  0.191E-01    2.75       1.0  T
   4    -11.2130749 -0.224693E-03  0.407E-02    2.78       1.1  T
   5    -11.2130888 -0.139760E-04  0.254E-02    2.77       1.8  T
   6    -11.2130923 -0.342377E-05  0.125E-02    2.77       3.6  T
   7    -11.2130931 -0.837012E-06  0.177E-03    2.77      25.3  T
   8    -11.2130931 -0.131639E-07  0.699E-04    2.77      63.9  T
   9    -11.2130931  0.211017E-09  0.258E-04    2.77     173.4  T
     SCC iter.                  ...        0 min,  0.001 sec
     gradient                   ...        0 min,  0.001 sec
 * total energy  :   -11.0119480 Eh     change       -0.3338607E-04 Eh
   gradient norm :     0.0030298 Eh/α   predicted    -0.2492075E-04 ( -25.36%)
   displ. norm   :     0.0165989 α      lambda       -0.1901536E-04
   maximum displ.:     0.0093439 α      in ANC's #2, #5, #1, ...

........................................................................
.............................. CYCLE   15 ..............................
........................................................................
   1    -11.2137569 -0.112138E+02  0.995E-02    2.75       0.0  T
   2    -11.2137365  0.203915E-04  0.722E-02    2.75       1.0  T
   3    -11.2136927  0.438117E-04  0.106E-01    2.74       1.0  T
   4    -11.2137512 -0.584773E-04  0.327E-02    2.76       1.4  T
   5    -11.2137609 -0.970989E-05  0.146E-02    2.75       3.1  T
   6    -11.2137621 -0.125907E-05  0.401E-03    2.75      11.1  T
   7    -11.2137621  0.113135E-07  0.269E-03    2.75      16.6  T
   8    -11.2137622 -0.513336E-07  0.427E-04    2.75     104.8  T
   9    -11.2137622 -0.169305E-10  0.101E-04    2.75     443.7  T
     SCC iter.                  ...        0 min,  0.001 sec
     gradient                   ...        0 min,  0.001 sec
 * total energy  :   -11.0119607 Eh     change       -0.1274258E-04 Eh
   gradient norm :     0.0021987 Eh/α   predicted    -0.9511545E-05 ( -25.36%)
   displ. norm   :     0.0091352 α      lambda       -0.8642652E-05
   maximum displ.:     0.0055421 α      in ANC's #5, #6, #3, ...

........................................................................
.............................. CYCLE   16 ..............................
........................................................................
   1    -11.2139643 -0.112140E+02  0.629E-02    2.74       0.0  T
   2    -11.2139523  0.119892E-04  0.510E-02    2.74       1.0  T
   3    -11.2139471  0.523853E-05  0.592E-02    2.74       1.0  T
   4    -11.2139611 -0.140646E-04  0.251E-02    2.75       1.8  T
   5    -11.2139670 -0.587061E-05  0.788E-03    2.74       5.7  T
   6    -11.2139674 -0.378469E-06  0.311E-03    2.74      14.4  T
   7    -11.2139674 -0.710017E-08  0.185E-03    2.74      24.2  T
   8    -11.2139674 -0.185675E-07  0.307E-04    2.74     145.9  T
   9    -11.2139674 -0.242807E-09  0.641E-05    2.74     698.0  T
     SCC iter.                  ...        0 min,  0.001 sec
     gradient                   ...        0 min,  0.001 sec
 * total energy  :   -11.0119671 Eh     change       -0.6338735E-05 Eh
   gradient norm :     0.0019915 Eh/α   predicted    -0.4320333E-05 ( -31.84%)
   displ. norm   :     0.0151760 α      lambda       -0.8390415E-05
   maximum displ.:     0.0098185 α      in ANC's #6, #5, #3, ...

........................................................................
.............................. CYCLE   17 ..............................
........................................................................
   1    -11.2139499 -0.112139E+02  0.103E-01    2.73       0.0  T
   2    -11.2139075  0.424719E-04  0.918E-02    2.74       1.0  T
   3    -11.2139116 -0.413086E-05  0.911E-02    2.73       1.0  T
   4    -11.2139336 -0.220026E-04  0.523E-02    2.74       1.0  T
   5    -11.2139595 -0.258956E-04  0.102E-02    2.73       4.4  T
   6    -11.2139601 -0.616995E-06  0.459E-03    2.73       9.7  T
   7    -11.2139601 -0.371975E-07  0.203E-03    2.73      22.1  T
   8    -11.2139602 -0.165549E-07  0.413E-04    2.73     108.2  T
   9    -11.2139602 -0.533328E-09  0.129E-04    2.73     347.0  T
     SCC iter.                  ...        0 min,  0.001 sec
     gradient                   ...        0 min,  0.001 sec
 * total energy  :   -11.0119744 Eh     change       -0.7315038E-05 Eh
   gradient norm :     0.0020818 Eh/α   predicted    -0.4197224E-05 ( -42.62%)
   displ. norm   :     0.0042889 α      lambda       -0.4472899E-05
   maximum displ.:     0.0032549 α      in ANC's #6, #1, #4, ...

........................................................................
.............................. CYCLE   18 ..............................
........................................................................
   1    -11.2138389 -0.112138E+02  0.272E-02    2.74       0.0  T
   2    -11.2138356  0.325248E-05  0.261E-02    2.74       1.7  T
   3    -11.2138366 -0.101344E-05  0.222E-02    2.74       2.0  T
   4    -11.2138372 -0.586202E-06  0.159E-02    2.74       2.8  T
   5    -11.2138396 -0.235280E-05  0.210E-03    2.74      21.3  T
   6    -11.2138396  0.155032E-08  0.176E-03    2.74      25.3  T
   7    -11.2138396 -0.182719E-07  0.211E-04    2.74     212.2  T
   8    -11.2138396 -0.169610E-09  0.101E-04    2.74     442.0  T
     SCC iter.                  ...        0 min,  0.001 sec
     gradient                   ...        0 min,  0.001 sec
 * total energy  :   -11.0119782 Eh     change       -0.3786380E-05 Eh
   gradient norm :     0.0015747 Eh/α   predicted    -0.2237297E-05 ( -40.91%)
   displ. norm   :     0.0144612 α      lambda       -0.8282455E-05
   maximum displ.:     0.0116444 α      in ANC's #6, #5, #1, ...

........................................................................
.............................. CYCLE   19 ..............................
........................................................................
   1    -11.2135702 -0.112136E+02  0.955E-02    2.76       0.0  T
   2    -11.2135185  0.516846E-04  0.968E-02    2.77       1.0  T
   3    -11.2135366 -0.181103E-04  0.817E-02    2.75       1.0  T
   4    -11.2135490 -0.124140E-04  0.574E-02    2.77       1.0  T
   5    -11.2135798 -0.307640E-04  0.686E-03    2.76       6.5  T
   6    -11.2135798 -0.251857E-07  0.525E-03    2.76       8.5  T
   7    -11.2135800 -0.149169E-06  0.149E-03    2.76      30.0  T
   8    -11.2135800 -0.655319E-08  0.397E-04    2.76     112.7  T
   9    -11.2135800 -0.397764E-09  0.154E-04    2.76     290.1  T
     SCC iter.                  ...        0 min,  0.001 sec
     gradient                   ...        0 min,  0.002 sec
 * total energy  :   -11.0119819 Eh     change       -0.3718897E-05 Eh
   gradient norm :     0.0006645 Eh/α   predicted    -0.4142166E-05 (  11.38%)
   displ. norm   :     0.0052011 α      lambda       -0.1342434E-05
   maximum displ.:     0.0037798 α      in ANC's #6, #1, #2, ...

   *** GEOMETRY OPTIMIZATION CONVERGED AFTER 19 ITERATIONS ***

------------------------------------------------------------------------
 total energy gain   :        -0.1382260 Eh      -86.7381 kcal/mol
 total RMSD          :         0.6582828 a0        0.3483 Å
 total power (kW/mol):       -19.1006461 (step)-4914.9642 (real)
------------------------------------------------------------------------

 ANCopt (total)                0 d,  0 h,  0 min,  0.074 sec
 optimizer setup                ...        0 min,  0.000 sec (  0.074%)
 model hessian                  ...        0 min,  0.000 sec (  0.103%)
 ANC generation                 ...        0 min,  0.000 sec (  0.057%)
 coordinate transformation      ...        0 min,  0.000 sec (  0.047%)
 single point calculation       ...        0 min,  0.072 sec ( 97.735%)
 optimization log               ...        0 min,  0.001 sec (  0.714%)
 hessian update                 ...        0 min,  0.000 sec (  0.050%)
 rational function              ...        0 min,  0.000 sec (  0.509%)

================
 final structure:
================
5
 xtb: 6.2.2 (9d81278992624c895f80dd42a50cac0aa55982e2)
C        -1.57730811431351   -0.48071697495943    0.23202122015278
N        -0.25012901427869   -0.10430762641203   -0.12694507732593
C         0.99804234729281   -0.25837906139402   -0.07187015383201
C        -1.39237762825090    0.80888079197739    0.10789540915977
C         2.22177240955029    0.03452187078809   -0.14110139815461

 Bond Distances (Angstroems)
 ---------------------------
C1-N2=1.4255         C1-C4=1.3087         N2-C1=1.4255         N2-C3=1.2588         N2-C4=1.4811         C3-N2=1.2588         
C3-C5=1.2602         C4-C1=1.3087         C4-N2=1.4811         C5-C3=1.2602         
 C  C  Rav=1.2844 sigma=0.0242  Rmin=1.2602  Rmax=1.3087     2
 N  C  Rav=1.3885 sigma=0.0944  Rmin=1.2588  Rmax=1.4811     3

 selected bond angles (degree)
 --------------------
C4-C1-N2= 65.44                C3-N2-C1=151.62                C4-N2-C1= 53.48                C4-N2-C3=146.43                
C5-C3-N2=158.74                N2-C4-C1= 61.08                

 selected dihedral angles (degree)
 ---------------------------------
C3-N2-C1-C4=144.14            C5-C3-N2-C1=202.37            C5-C3-N2-C4=324.01            C1-C4-N2-C3=210.23            
           -------------------------------------------------
          |                Final Singlepoint                |
           -------------------------------------------------

          ...................................................
          :                      SETUP                      :
          :.................................................:
          :  # basis functions                  20          :
          :  # atomic orbitals                  20          :
          :  # shells                           10          :
          :  # electrons                        21          :
          :  max. iterations                   250          :
          :  Hamiltonian                  GFN2-xTB          :
          :  restarted?                      false          :
          :  GBSA solvation                  false          :
          :  PC potential                    false          :
          :  electronic temp.          300.0000000     K    :
          :  accuracy                    1.0000000          :
          :  -> integral cutoff          0.2500000E+02      :
          :  -> integral neglect         0.1000000E-07      :
          :  -> SCF convergence          0.1000000E-05 Eh   :
          :  -> wf. convergence          0.1000000E-03 e    :
          :  Broyden damping             0.4000000          :
          ...................................................

 iter      E             dE          RMSdq      gap      omega  full diag
   1    -11.2135800 -0.112136E+02  0.382E-05    2.76       0.0  T
   2    -11.2135800  0.405276E-10  0.857E-05    2.76     521.9  T
   3    -11.2135800 -0.797229E-11  0.796E-05    2.76     561.6  T

   *** convergence criteria satisfied after 3 iterations ***

         #    Occupation            Energy/Eh            Energy/eV
      -------------------------------------------------------------
         1        2.0000           -0.7419731             -20.1901
       ...           ...                  ...                  ...
         6        2.0000           -0.5692484             -15.4900
         7        2.0000           -0.4983417             -13.5606
         8        2.0000           -0.4741919             -12.9034
         9        2.0000           -0.4448571             -12.1052
        10        1.0000           -0.4236773             -11.5288
        11        1.0000           -0.4173101             -11.3556
        12        1.0000           -0.3795636             -10.3285 (HOMO)
        13                         -0.2781839              -7.5698 (LUMO)
        14                         -0.2444795              -6.6526
        15                         -0.1825376              -4.9671
        16                         -0.0668770              -1.8198
        17                         -0.0663972              -1.8068
       ...                                ...                  ...
        20                          1.0310596              28.0566
      -------------------------------------------------------------
                  HL-Gap            0.1013797 Eh            2.7587 eV
             Fermi-level           -0.3815708 Eh          -10.3831 eV

 SCC (total)                   0 d,  0 h,  0 min,  0.003 sec
 SCC setup                      ...        0 min,  0.000 sec (  2.081%)
 Dispersion                     ...        0 min,  0.000 sec (  0.245%)
 integral evaluation            ...        0 min,  0.001 sec ( 43.803%)
 zeroth order Hamiltonian       ...        0 min,  0.000 sec (  0.514%)
 iterations                     ...        0 min,  0.000 sec ( 11.636%)
 molecular gradient             ...        0 min,  0.001 sec ( 40.147%)
 printout                       ...        0 min,  0.000 sec (  1.363%)

         :::::::::::::::::::::::::::::::::::::::::::::::::::::
         ::                     SUMMARY                     ::
         :::::::::::::::::::::::::::::::::::::::::::::::::::::
         :: total energy             -11.011981903506 Eh    ::
         :: gradient norm              0.000674303870 Eh/a0 ::
         :: HOMO-LUMO gap              2.758681691191 eV    ::
         ::.................................................::
         :: SCC energy               -11.213579972246 Eh    ::
         :: -> isotropic ES           -0.009622816588 Eh    ::
         :: -> anisotropic ES          0.001193042872 Eh    ::
         :: -> anisotropic XC          0.008844073779 Eh    ::
         :: -> dispersion             -0.002855057757 Eh    ::
         :: repulsion energy           0.201598163725 Eh    ::
         :: add. restraining           0.000000000000 Eh    ::
         :::::::::::::::::::::::::::::::::::::::::::::::::::::

           ------------------------------------------------- 
          |                Numerical Hessian                |
           ------------------------------------------------- 
step length          :   0.00500
SCC accuracy         :   0.30000
Hessian scale factor :   1.00000
frozen atoms in %    :   0.00000    0
RMS gradient         :   0.00067
estimated CPU  time      0.00 min
estimated wall time      0.00 min

writing file <hessian>.

 projected vibrational frequencies (cm-1)
eigval :       -0.00    -0.00    -0.00     0.00     0.00     0.00
eigval :      126.68   186.58   326.75   350.01   463.28   768.45
eigval :     1367.37  1614.38  1818.95
           -------------------------------------------------
          |                Property Printout                |
           -------------------------------------------------

    * Orbital Energies and Occupations

         #    Occupation            Energy/Eh            Energy/eV
      -------------------------------------------------------------
         1        2.0000           -0.7419732             -20.1901
         2        2.0000           -0.6963311             -18.9481
         3        2.0000           -0.6470539             -17.6072
         4        2.0000           -0.6105333             -16.6135
         5        2.0000           -0.5861522             -15.9500
         6        2.0000           -0.5692484             -15.4900
         7        2.0000           -0.4983417             -13.5606
         8        2.0000           -0.4741919             -12.9034
         9        2.0000           -0.4448572             -12.1052
        10        1.0000           -0.4236773             -11.5288
        11        1.0000           -0.4173101             -11.3556
        12        1.0000           -0.3795636             -10.3285 (HOMO)
        13                         -0.2781839              -7.5698 (LUMO)
        14                         -0.2444796              -6.6526
        15                         -0.1825377              -4.9671
        16                         -0.0668771              -1.8198
        17                         -0.0663972              -1.8068
        18                          0.3845214              10.4634
        19                          0.5421438              14.7525
        20                          1.0310594              28.0566
      -------------------------------------------------------------
                  HL-Gap            0.1013797 Eh            2.7587 eV
             Fermi-level           -0.3815708 Eh          -10.3831 eV

     #   Z        covCN         q      C6AA      α(0)
     1   6 C      1.890     0.003    31.053     9.000
     2   7 N      2.726     0.070    20.024     6.646
     3   6 C      1.892     0.077    29.175     8.724
     4   6 C      1.887    -0.019    31.615     9.081
     5   6 C      0.983    -0.131    40.178    10.647

 Mol. C6AA /au·bohr⁶  :        749.975464
 Mol. C8AA /au·bohr⁸  :      20806.103600
 Mol. α(0) /au        :         44.098229


Wiberg/Mayer (AO) data.
largest (>0.10) Wiberg bond orders for each atom
          total WBO             WBO to atom ...
     1  C   2.772        C    4 1.767    N    2 0.890
     2  N   3.237        C    3 1.491    C    1 0.890    C    4 0.799
     3  C   3.724        C    5 2.079    N    2 1.491
     4  C   2.726        C    1 1.767    N    2 0.799
     5  C   2.257        C    3 2.079

MOs/occ written to file <molden.input>


molecular dipole:
                 x           y           z       tot (Debye)
 q only:       -0.398      -0.091       0.005
   full:       -0.418      -0.298       0.004       1.305
molecular quadrupole (traceless):
                xx          xy          yy          xz          yz          zz
 q only:       -2.118      -0.028       1.047       0.213       0.006       1.072
  q+dip:       -4.851      -0.071       2.744       0.720      -0.120       2.108
   full:       -6.470      -0.816       2.698       0.978       0.019       3.772

           -------------------------------------------------
          |                Geometry Summary                 |
           -------------------------------------------------

      molecular mass/u    :       62.0496468
   center of mass at/Å    :       -0.0080460      -0.0033554      -0.0040834
  moments of inertia/u·Å² :        0.1171411E+02   0.1269204E+03   0.1377762E+03
rotational constants/cm⁻¹ :        0.1439088E+01   0.1328205E+00   0.1223552E+00

 * 3 selected distances

     #   Z        #   Z                                     value/Å
     2   7 N      3   6 C                                 1.2588499 (min)
     1   6 C      4   6 C                                 1.3086898 (max)
     3   6 C      5   6 C                                 1.2601981
Molecule has no symmetry elements
It seems to be the C1 point group

 * 2 distinct bonds (by element types)

   Z      Z             #   av. dist./Å        max./Å        min./Å
   6 C    6 C           2     1.2844439     1.3086898     1.2601981
   6 C    7 N           1     1.2588499     1.2588499     1.2588499

           -------------------------------------------------
          |               Frequency Printout                |
           -------------------------------------------------
 projected vibrational frequencies (cm-1)
eigval :       -0.00    -0.00    -0.00     0.00     0.00     0.00
eigval :      126.68   186.58   326.75   350.01   463.28   768.45
eigval :     1367.37  1614.38  1818.95
 reduced masses (amu)
   1: 12.03   2: 12.30   3: 12.37   4: 12.48   5: 12.27   6: 12.08   7: 13.23   8: 12.59
   9: 12.15  10: 12.26  11: 12.76  12: 12.15  13: 13.09  14: 12.03  15: 12.37
 IR intensities (amu)
   1:  0.08   2:  0.01   3:  0.07   4:  0.11   5:  0.10   6:  0.11   7:  0.19   8:  0.47
   9:  1.05  10:  0.34  11:  0.48  12:  0.82  13:  0.77  14:  2.72  15:  0.65
 Raman intensities (amu)
   1:  0.00   2:  0.00   3:  0.00   4:  0.00   5:  0.00   6:  0.00   7:  0.00   8:  0.00
   9:  0.00  10:  0.00  11:  0.00  12:  0.00  13:  0.00  14:  0.00  15:  0.00
 output can be read by thermo (or use thermo option).
 writing <g98.out> molden fake output.
 recommended (thermochemical) frequency scaling factor: 1.0
           -------------------------------------------------
          |             Thermodynamic Functions             |
           -------------------------------------------------

c1  symmetry found (for desy threshold:  0.10E+00) used in thermo

          ...................................................
          :                      SETUP                      :
          :.................................................:
          :  # frequencies                           9      :
          :  # imaginary freq.                       0      :
          :  linear?                             false      :
          :  only rotor calc.                    false      :
          :  symmetry                               c1      :
          :  rotational number                       1      :
          :  scaling factor                  1.0000000      :
          :  rotor cutoff                   50.0000000 cm⁻¹ :
          :  imag. cutoff                  -20.0000000 cm⁻¹ :
          :.................................................:

    mode    ω/cm⁻¹     T·S(HO)/kcal·mol⁻¹    T·S(FR)/kcal·mol⁻¹   T·S(vib)
   ------------------------------------------------------------------------
       1    126.68    -0.00000 ( 97.63%)     0.00755 (  2.37%)     0.00018
       2    186.58    -0.00000 ( 99.49%)     0.01139 (  0.51%)     0.00006
   ------------------------------------------------------------------------

   temp. (K)  partition function   enthalpy   heat capacity  entropy
                                   cal/mol     cal/K/mol   cal/K/mol   J/K/mol
 298.15  VIB   6.55                 1486.902      9.210      8.713
         ROT  0.346E+05              888.752      2.981     23.749
         INT  0.226E+06             2375.655     12.190     32.463
         TR   0.473E+27             1481.254      4.968     38.278
         TOT                        3856.9084    17.1586    70.7408   295.9797

   temp. (K)  partition function   enthalpy   heat capacity  entropy
                                   cal/mol     cal/K/mol   cal/K/mol   J/K/mol
 120.00  VIB   1.49                  204.921      4.407      2.514
         ROT  0.883E+04              357.707      2.981     21.037
         INT  0.132E+05              562.628      7.388     23.550
         TR   0.121E+27              596.178      4.968     33.759
         TOT                        1158.8058    12.3557    57.3089   239.7804

   temp. (K)  partition function   enthalpy   heat capacity  entropy
                                   cal/mol     cal/K/mol   cal/K/mol   J/K/mol
 100.00  VIB   1.30                  125.732      3.499      1.797
         ROT  0.672E+04              298.089      2.981     20.493
         INT  0.874E+04              423.821      6.479     22.290
         TR   0.919E+26              496.815      4.968     32.853
         TOT                         920.6358    11.4476    55.1433   230.7197

   temp. (K)  partition function   enthalpy   heat capacity  entropy
                                   cal/mol     cal/K/mol   cal/K/mol   J/K/mol
  80.00  VIB   1.16                   65.431      2.523      1.130
         ROT  0.481E+04              238.471      2.981     19.828
         INT  0.557E+04              303.903      5.504     20.958
         TR   0.657E+26              397.452      4.968     31.745
         TOT                         701.3546    10.4722    52.7034   220.5111

   temp. (K)  partition function   enthalpy   heat capacity  entropy
                                   cal/mol     cal/K/mol   cal/K/mol   J/K/mol
  60.00  VIB   1.06                   25.008      1.518      0.556
         ROT  0.312E+04              178.853      2.981     18.970
         INT  0.332E+04              203.861      4.499     19.526
         TR   0.427E+26              298.089      4.968     30.317
         TOT                         501.9501     9.4667    49.8430   208.5432

   temp. (K)  partition function   enthalpy   heat capacity  entropy
                                   cal/mol     cal/K/mol   cal/K/mol   J/K/mol
  40.00  VIB   1.01                    4.504      0.555      0.149
         ROT  0.170E+04              119.236      2.981     17.762
         INT  0.172E+04              123.739      3.536     17.910
         TR   0.232E+26              198.726      4.968     28.303
         TOT                         322.4652     8.5039    46.2137   193.3582

   temp. (K)  partition function   enthalpy   heat capacity  entropy
                                   cal/mol     cal/K/mol   cal/K/mol   J/K/mol
  20.00  VIB   1.00                    0.041      0.019     -0.003
         ROT   601.                   59.618      2.981     15.695
         INT   601.                   59.659      3.000     15.693
         TR   0.822E+25               99.363      4.968     24.861
         TOT                         159.0215     7.9678    40.5540   169.6779

   temp. (K)  partition function   enthalpy   heat capacity  entropy
                                   cal/mol     cal/K/mol   cal/K/mol   J/K/mol
  10.00  VIB   1.00                    0.000      0.000     -0.026
         ROT   212.                   29.809      2.981     13.629
         INT   212.                   29.809      2.981     13.604
         TR   0.290E+25               49.681      4.968     21.419
         TOT                          79.4904     7.9490    35.0230   146.5362

       T/K    H(0)-H(T)+PV         H(T)/Eh          T*S/Eh         G(T)/Eh
   ------------------------------------------------------------------------
    298.15    0.614637E-02    0.221447E-01    0.336113E-01   -0.114666E-01
    120.00    0.184667E-02    0.178450E-01    0.109593E-01    0.688566E-02
    100.00    0.146713E-02    0.174654E-01    0.878765E-02    0.867777E-02
     80.00    0.111768E-02    0.171160E-01    0.671906E-02    0.103969E-01
     60.00    0.799908E-03    0.167982E-01    0.476580E-02    0.120324E-01
     40.00    0.513881E-03    0.165122E-01    0.294585E-02    0.135663E-01
     20.00    0.253417E-03    0.162517E-01    0.129254E-02    0.149592E-01
     10.00    0.126676E-03    0.161250E-01    0.558127E-03    0.155668E-01 (used)
   ------------------------------------------------------------------------

         :::::::::::::::::::::::::::::::::::::::::::::::::::::
         ::                  THERMODYNAMIC                  ::
         :::::::::::::::::::::::::::::::::::::::::::::::::::::
         :: total free energy         -10.996415063005 Eh   ::
         ::.................................................::
         :: total energy              -11.011981903411 Eh   ::
         :: zero point energy           0.015998291161 Eh   ::
         :: G(RRHO) w/o ZPVE           -0.000431450755 Eh   ::
         :: G(RRHO) contrib.            0.015566840406 Eh   ::
         :::::::::::::::::::::::::::::::::::::::::::::::::::::

optimized geometry written to: xtbopt.xyz


           -------------------------------------------------
          | TOTAL ENERGY              -11.011981903411 Eh   |
          | TOTAL ENTHALPY            -10.995856936227 Eh   |
          | TOTAL FREE ENERGY         -10.996415063005 Eh   |
          | GRADIENT NORM               0.000674229365 Eh/α |
          | HOMO-LUMO GAP               2.758682488229 eV   |
           -------------------------------------------------

------------------------------------------------------------------------
 * finished run on 2020/05/12 at 11:44:07.029     
------------------------------------------------------------------------
 total:
 * wall-time:     0 d,  0 h,  0 min,  0.199 sec
 *  cpu-time:     0 d,  0 h,  0 min,  0.199 sec
 * ratio c/w:     0.998 speedup
 SCF:
 * wall-time:     0 d,  0 h,  0 min,  0.005 sec
 *  cpu-time:     0 d,  0 h,  0 min,  0.005 sec
 * ratio c/w:     0.997 speedup
 ANC optimizer:
 * wall-time:     0 d,  0 h,  0 min,  0.077 sec
 *  cpu-time:     0 d,  0 h,  0 min,  0.077 sec
 * ratio c/w:     0.999 speedup
 numerical hessian:
 * wall-time:     0 d,  0 h,  0 min,  0.102 sec
 *  cpu-time:     0 d,  0 h,  0 min,  0.102 sec
 * ratio c/w:     0.998 speedup

