      -----------------------------------------------------------      
     |                   =====================                   |     
     |                           x T B                           |     
     |                   =====================                   |     
     |                         S. Grimme                         |     
     |          Mulliken Center for Theoretical Chemistry        |     
     |                    University of Bonn                     |     
      -----------------------------------------------------------      

   * xtb version 6.2.2 (9d81278992624c895f80dd42a50cac0aa55982e2) compiled by '@Darwin' on 04/03/2020

   xtb is free software: you can redistribute it and/or modify it under
   the terms of the GNU Lesser General Public License as published by
   the Free Software Foundation, either version 3 of the License, or
   (at your option) any later version.
   
   xtb is distributed in the hope that it will be useful,
   but WITHOUT ANY WARRANTY; without even the implied warranty of
   MERCHANTABILITY or FITNESS FOR A PARTICULAR PURPOSE.  See the
   GNU Lesser General Public License for more details.
   
   Cite this work as:
   * S. Grimme, C. Bannwarth, P. Shushkov, J. Chem. Theory Comput., 2017,
     13, 1989-2009. DOI: 10.1021/acs.jctc.7b00118
   * C. Bannwarth, S. Ehlert and S. Grimme., J. Chem. Theory Comput., 2019,
     15, 1652-1671. DOI: 10.1021/acs.jctc.8b01176
   * P. Pracht, E. Caldeweyher, S. Ehlert, S. Grimme, ChemRxiv, 2019, preprint.
     DOI: 10.26434/chemrxiv.8326202.v1
   
   for DFT-D4:
   * E. Caldeweyher, C. Bannwarth and S. Grimme, J. Chem. Phys., 2017,
     147, 034112. DOI: 10.1063/1.4993215
   * E. Caldeweyher, S. Ehlert, A. Hansen, H. Neugebauer, S. Spicher,
     C. Bannwarth and S. Grimme, J. Chem. Phys., 2019, 150, 154122.
     DOI: 10.1063/1.5090222
   
   for sTDA-xTB:
   * S. Grimme and C. Bannwarth, J. Chem. Phys., 2016, 145, 054103.
     DOI: 10.1063/1.4959605
   
   in the mass-spec context:
   * V. Asgeirsson, C. Bauer and S. Grimme, Chem. Sci., 2017, 8, 4879.
     DOI: 10.1039/c7sc00601b
   
   for metadynamics refer to:
   * S. Grimme, J. Chem. Theory Comput., 2019, 155, 2847-2862
     DOI: 10.1021/acs.jctc.9b00143
   
   with help from (in alphabetical order)
   C. Bannwarth, F. Bohle, G. Brandenburg, E. Caldeweyher, M. Checinski,
   S. Dohm, S. Ehlert, S. Ehrlich, F. März, H. Neugebauer, J. Pisarek,
   P. Pracht, P. Shushkov, and S. Spicher.
   
 * started run on 2020/05/12 at 11:45:00.076     

           -------------------------------------------------
          |                Calculation Setup                |
           -------------------------------------------------

          program call               : xtb --input H1C3N1_25_S_0.input H1C3N1_25_S_0.xyz --ohess --molden --namespace H1C3N1_25_S_0 output.out
          calculation namespace      : H1C3N1_25_S_0
          coordinate file            : H1C3N1_25_S_0.xyz
          number of atoms            :                     5
          number of electrons        :                    18
          charge                     :                     0
          spin                       :                   0.0
          first test random number   :      0.36287500282104

   ID    Z sym.   atoms
    1    6 C      1-3
    2    7 N      4
    3    1 H      5

           -------------------------------------------------
          |                 G F N 2 - x T B                 |
           -------------------------------------------------

        Reference                      10.1021/acs.jctc.8b01176
      * Hamiltonian:
        H0-scaling (s, p, d)           1.850000    2.230000    2.230000
        zeta-weighting                 0.500000
      * Dispersion:
        s8                             2.700000
        a1                             0.520000
        a2                             5.000000
        s9                             5.000000
      * Repulsion:
        kExp                           1.500000    1.000000
        rExp                           1.000000
      * Coulomb:
        alpha                          2.000000
        third order                    shell-resolved
        anisotropic                    true
        a3                             3.000000
        a5                             4.000000
        cn-shift                       1.200000
        cn-exp                         4.000000
        max-rad                        5.000000


          ...................................................
          :                      SETUP                      :
          :.................................................:
          :  # basis functions                  17          :
          :  # atomic orbitals                  17          :
          :  # shells                            9          :
          :  # electrons                        18          :
          :  max. iterations                   250          :
          :  Hamiltonian                  GFN2-xTB          :
          :  restarted?                      false          :
          :  GBSA solvation                  false          :
          :  PC potential                    false          :
          :  electronic temp.          300.0000000     K    :
          :  accuracy                    1.0000000          :
          :  -> integral cutoff          0.2500000E+02      :
          :  -> integral neglect         0.1000000E-07      :
          :  -> SCF convergence          0.1000000E-05 Eh   :
          :  -> wf. convergence          0.1000000E-03 e    :
          :  Broyden damping             0.4000000          :
          ...................................................

 iter      E             dE          RMSdq      gap      omega  full diag
   1     -9.3273004 -0.932730E+01  0.880E+00    0.54       0.0  T
   2     -8.0916918  0.123561E+01  0.145E+01    0.48       1.0  T
   3     -9.3813025 -0.128961E+01  0.625E+00    0.59       1.0  T
   4     -9.4827550 -0.101452E+00  0.344E+00    0.00       1.0  T
   5     -9.4779760  0.477902E-02  0.280E+00    0.00       1.0  T
   6     -9.4643202  0.136558E-01  0.358E+00    0.22       1.0  T
   7     -9.4849286 -0.206084E-01  0.276E+00    0.15       1.0  T
   8     -9.1705419  0.314387E+00  0.993E+00    0.14       1.0  T
   9     -9.2774642 -0.106922E+00  0.811E+00    0.10       1.0  T
  10     -9.3238622 -0.463980E-01  0.727E+00    0.07       1.0  T
  11     -9.4871635 -0.163301E+00  0.279E+00    0.01       1.0  T
  12     -9.5094874 -0.223239E-01  0.117E+00    0.09       1.0  T
  13     -9.5004962  0.899120E-02  0.196E+00    0.11       1.0  T
  14     -9.5077296 -0.723341E-02  0.137E+00    0.09       1.0  T
  15     -9.5143464 -0.661676E-02  0.259E-01    0.06       1.0  T
  16     -9.5141266  0.219770E-03  0.357E-01    0.07       1.0  T
  17     -9.5146011 -0.474511E-03  0.105E-02    0.06       4.3  T
  18     -9.5146006  0.514909E-06  0.166E-02    0.06       2.7  T
  19     -9.5146012 -0.614145E-06  0.491E-03    0.06       9.1  T
  20     -9.5146011  0.110188E-06  0.569E-03    0.06       7.9  T
  21     -9.5146010  0.114434E-06  0.787E-03    0.06       5.7  T
  22     -9.5146012 -0.242966E-06  0.803E-04    0.06      55.7  T
  23     -9.5146012 -0.245489E-09  0.642E-04    0.06      69.6  T

   *** convergence criteria satisfied after 23 iterations ***

         #    Occupation            Energy/Eh            Energy/eV
      -------------------------------------------------------------
         1        2.0000           -0.7212876             -19.6272
       ...           ...                  ...                  ...
         3        2.0000           -0.6271295             -17.0651
         4        2.0000           -0.5751641             -15.6510
         5        2.0000           -0.5380341             -14.6407
         6        2.0000           -0.5136065             -13.9759
         7        2.0000           -0.4814199             -13.1001
         8        2.0000           -0.4173627             -11.3570
         9        1.4649           -0.3854262             -10.4880 (HOMO)
        10        0.4547           -0.3833071             -10.4303 (LUMO)
        11        0.0804           -0.3814548             -10.3799
        12                         -0.2498674              -6.7992
        13                         -0.0209510              -0.5701
        14                         -0.0038881              -0.1058
       ...                                ...                  ...
        17                          0.2717243               7.3940
      -------------------------------------------------------------
                  HL-Gap            0.0021191 Eh            0.0577 eV
             Fermi-level           -0.3844694 Eh          -10.4619 eV

 SCC (total)                   0 d,  0 h,  0 min,  0.004 sec
 SCC setup                      ...        0 min,  0.000 sec (  1.766%)
 Dispersion                     ...        0 min,  0.000 sec (  0.322%)
 integral evaluation            ...        0 min,  0.001 sec ( 22.681%)
 zeroth order Hamiltonian       ...        0 min,  0.000 sec (  0.360%)
 iterations                     ...        0 min,  0.002 sec ( 48.583%)
 molecular gradient             ...        0 min,  0.001 sec ( 24.092%)
 printout                       ...        0 min,  0.000 sec (  1.990%)

         :::::::::::::::::::::::::::::::::::::::::::::::::::::
         ::                     SUMMARY                     ::
         :::::::::::::::::::::::::::::::::::::::::::::::::::::
         :: total energy              -9.447849816967 Eh    ::
         :: gradient norm              0.196278931132 Eh/a0 ::
         :: HOMO-LUMO gap              0.057664430319 eV    ::
         ::.................................................::
         :: SCC energy                -9.514601242036 Eh    ::
         :: -> isotropic ES           -0.006433408319 Eh    ::
         :: -> anisotropic ES          0.001746294391 Eh    ::
         :: -> anisotropic XC          0.005995103330 Eh    ::
         :: -> dispersion             -0.002136033478 Eh    ::
         :: repulsion energy           0.066751395865 Eh    ::
         :: add. restraining           0.000000000000 Eh    ::
         :::::::::::::::::::::::::::::::::::::::::::::::::::::

      ----------------------------------------------------------- 
     |                   =====================                   |
     |                        A N C O P T                        |
     |                   =====================                   |
     |               Approximate Normal Coordinate               |
     |                Rational Function Optimizer                |
      ----------------------------------------------------------- 

          ...................................................
          :                      SETUP                      :
          :.................................................:
          :   optimization level            normal          :
          :   max. optcycles                   200          :
          :   ANC micro-cycles                  20          :
          :   degrees of freedom                 9          :
          :.................................................:
          :   RF solver                   davidson          :
          :   write xtbopt.log                true          :
          :   linear?                        false          :
          :   energy convergence         0.5000000E-05 Eh   :
          :   grad. convergence          0.1000000E-02 Eh/α :
          :   maximium RF displ.         1.0000000          :
          :   Hlow (freq-cutoff)         0.1000000E-01      :
          :   Hmax (freq-cutoff)         5.0000000          :
          :   S6 in model hess.         20.0000000          :
          ...................................................

generating ANC from model Hessian ...
Using Lindh-Hessian (1995)
 Shifting diagonal of input Hessian by    0.0000000000000000     
 Lowest  eigenvalues of input Hessian
   -0.000000   -0.000000   -0.000000   -0.000000    0.000000    0.000000
    0.026180    0.129959    0.146198    0.294703    0.839906    0.882237
    0.957321    1.059190    1.246737
 Highest eigenvalues
    0.294703    0.839906    0.882237    0.957321    1.059190    1.246737


........................................................................
.............................. CYCLE    1 ..............................
........................................................................
   1     -9.5146012 -0.951460E+01  0.213E-04    0.06       0.0  T
   2     -9.5146012  0.884754E-07  0.468E-03    0.06       9.6  T
   3     -9.5146012 -0.885305E-07  0.187E-04    0.06     239.2  T
   4     -9.5146012 -0.112966E-09  0.619E-05    0.06     721.9  T
     SCC iter.                  ...        0 min,  0.000 sec
     gradient                   ...        0 min,  0.001 sec
 * total energy  :    -9.4478498 Eh     change       -0.3494517E-08 Eh
   gradient norm :     0.1962753 Eh/α   predicted     0.0000000E+00 (-100.00%)
   displ. norm   :     0.3761045 α      lambda       -0.6086425E-01
   maximum displ.:     0.2595164 α      in ANC's #4, #3, #7, ...

........................................................................
.............................. CYCLE    2 ..............................
........................................................................
   1     -9.5834038 -0.958340E+01  0.392E+00    0.83       0.0  T
   2     -8.8584055  0.724998E+00  0.119E+01    0.20       1.0  T
   3     -9.5381277 -0.679722E+00  0.373E+00    1.28       1.0  T
   4     -9.5777885 -0.396608E-01  0.283E+00    0.86       1.0  T
   5     -9.5802634 -0.247482E-02  0.234E+00    0.77       1.0  T
   6     -9.5823045 -0.204117E-02  0.220E+00    0.73       1.0  T
   7     -9.5888471 -0.654254E-02  0.154E+00    0.57       1.0  T
   8     -9.5892531 -0.406054E-03  0.149E+00    0.56       1.0  T
   9     -9.5898139 -0.560771E-03  0.142E+00    0.54       1.0  T
  10     -9.5948572 -0.504327E-02  0.425E-01    0.31       1.0  T
  11     -9.5953427 -0.485517E-03  0.124E-01    0.25       1.0  T
  12     -9.5953880 -0.452903E-04  0.199E-02    0.23       2.2  T
  13     -9.5953661  0.218376E-04  0.910E-02    0.24       1.0  T
  14     -9.5953856 -0.194240E-04  0.348E-02    0.23       1.3  T
  15     -9.5953889 -0.333942E-05  0.506E-03    0.23       8.8  T
  16     -9.5953890 -0.635388E-07  0.244E-03    0.23      18.3  T
  17     -9.5953890 -0.164209E-07  0.203E-04    0.23     220.6  T
  18     -9.5953890 -0.121274E-09  0.459E-05    0.23     975.1  T
     SCC iter.                  ...        0 min,  0.001 sec
     gradient                   ...        0 min,  0.001 sec
 * total energy  :    -9.5042697 Eh     change       -0.5641987E-01 Eh
   gradient norm :     0.1434682 Eh/α   predicted    -0.3473690E-01 ( -38.43%)
   displ. norm   :     0.8074760 α      lambda       -0.1069637E+00
   maximum displ.:     0.6634211 α      in ANC's #4, #3, #7, ...

........................................................................
.............................. CYCLE    3 ..............................
........................................................................
   1     -9.6307093 -0.963071E+01  0.730E+00    3.47       0.0  T
   2     -9.6087678  0.219416E-01  0.443E+00    3.12       1.0  T
   3     -9.6329838 -0.242160E-01  0.400E+00    3.57       1.0  T
   4     -9.6852369 -0.522531E-01  0.532E-01    3.68       1.0  T
   5     -9.6859597 -0.722784E-03  0.265E-01    3.62       1.0  T
   6     -9.6859627 -0.302110E-05  0.945E-02    3.60       1.0  T
   7     -9.6860190 -0.562875E-04  0.115E-02    3.61       3.9  T
   8     -9.6860193 -0.323644E-06  0.219E-03    3.61      20.4  T
   9     -9.6860193 -0.612598E-08  0.100E-03    3.61      44.6  T
  10     -9.6860193 -0.195091E-08  0.257E-04    3.61     174.0  T
  11     -9.6860193 -0.167260E-09  0.145E-04    3.61     308.3  T
     SCC iter.                  ...        0 min,  0.001 sec
     gradient                   ...        0 min,  0.001 sec
 * total energy  :    -9.4928507 Eh     change        0.1141904E-01 Eh
   gradient norm :     0.3515478 Eh/α   predicted    -0.8835296E-01 (-873.73%)
   displ. norm   :     0.4274347 α      lambda       -0.1403884E+00
   maximum displ.:     0.3665487 α      in ANC's #4, #7, #6, ...

........................................................................
.............................. CYCLE    4 ..............................
........................................................................
   1     -9.6217166 -0.962172E+01  0.432E+00    2.19       0.0  T
   2     -9.6189000  0.281669E-02  0.255E+00    1.10       1.0  T
   3     -9.6287735 -0.987358E-02  0.214E+00    2.09       1.0  T
   4     -9.6422598 -0.134862E-01  0.186E-01    1.75       1.0  T
   5     -9.6423293 -0.695374E-04  0.840E-02    1.77       1.0  T
   6     -9.6423280  0.130750E-05  0.218E-02    1.78       2.1  T
   7     -9.6423306 -0.256170E-05  0.379E-03    1.77      11.8  T
   8     -9.6423306  0.354762E-08  0.124E-03    1.77      36.2  T
   9     -9.6423306 -0.898623E-09  0.996E-04    1.77      44.9  T
  10     -9.6423306 -0.545844E-08  0.184E-04    1.77     243.0  T
     SCC iter.                  ...        0 min,  0.001 sec
     gradient                   ...        0 min,  0.001 sec
 * total energy  :    -9.5364785 Eh     change       -0.4362786E-01 Eh
   gradient norm :     0.0659681 Eh/α   predicted    -0.8301875E-01 (  90.29%)
   displ. norm   :     0.0575885 α      lambda       -0.3374449E-02
   maximum displ.:     0.0310103 α      in ANC's #6, #7, #1, ...

........................................................................
.............................. CYCLE    5 ..............................
........................................................................
   1     -9.6553705 -0.965537E+01  0.340E-01    1.93       0.0  T
   2     -9.6553836 -0.130754E-04  0.227E-01    1.90       1.0  T
   3     -9.6553025  0.811193E-04  0.157E-01    1.95       1.0  T
   4     -9.6554244 -0.121898E-03  0.280E-02    1.90       1.6  T
   5     -9.6554261 -0.170513E-05  0.125E-02    1.91       3.6  T
   6     -9.6554261 -0.319402E-07  0.140E-03    1.91      32.1  T
   7     -9.6554261  0.155402E-07  0.163E-03    1.91      27.4  T
   8     -9.6554261 -0.180889E-07  0.299E-04    1.91     149.7  T
   9     -9.6554261 -0.171013E-09  0.116E-04    1.91     386.0  T
     SCC iter.                  ...        0 min,  0.001 sec
     gradient                   ...        0 min,  0.001 sec
 * total energy  :    -9.5389423 Eh     change       -0.2463749E-02 Eh
   gradient norm :     0.0292465 Eh/α   predicted    -0.1692819E-02 ( -31.29%)
   displ. norm   :     0.0790983 α      lambda       -0.1528403E-02
   maximum displ.:     0.0485312 α      in ANC's #1, #3, #6, ...

........................................................................
.............................. CYCLE    6 ..............................
........................................................................
   1     -9.6644111 -0.966441E+01  0.419E-01    2.10       0.0  T
   2     -9.6644311 -0.200110E-04  0.234E-01    2.14       1.0  T
   3     -9.6643430  0.881105E-04  0.150E-01    2.08       1.0  T
   4     -9.6644455 -0.102550E-03  0.277E-02    2.12       1.6  T
   5     -9.6644477 -0.221037E-05  0.125E-02    2.11       3.6  T
   6     -9.6644478 -0.232669E-07  0.128E-03    2.12      34.8  T
   7     -9.6644478  0.115728E-09  0.492E-04    2.11      90.9  T
   8     -9.6644478 -0.203103E-09  0.403E-04    2.11     111.0  T
     SCC iter.                  ...        0 min,  0.001 sec
     gradient                   ...        0 min,  0.001 sec
 * total energy  :    -9.5396625 Eh     change       -0.7202773E-03 Eh
   gradient norm :     0.0066078 Eh/α   predicted    -0.7689834E-03 (   6.76%)
   displ. norm   :     0.0085166 α      lambda       -0.4294074E-04
   maximum displ.:     0.0057684 α      in ANC's #3, #4, #9, ...

........................................................................
.............................. CYCLE    7 ..............................
........................................................................
   1     -9.6637883 -0.966379E+01  0.530E-02    2.10       0.0  T
   2     -9.6637896 -0.121606E-05  0.278E-02    2.10       1.6  T
   3     -9.6637896 -0.545416E-07  0.977E-03    2.10       4.6  T
   4     -9.6637896 -0.323065E-07  0.234E-03    2.10      19.1  T
   5     -9.6637897 -0.503614E-08  0.143E-03    2.10      31.3  T
   6     -9.6637897 -0.477035E-08  0.448E-04    2.10      99.8  T
   7     -9.6637897 -0.117566E-08  0.173E-04    2.10     257.8  T
     SCC iter.                  ...        0 min,  0.001 sec
     gradient                   ...        0 min,  0.001 sec
 * total energy  :    -9.5396912 Eh     change       -0.2868178E-04 Eh
   gradient norm :     0.0023571 Eh/α   predicted    -0.2147293E-04 ( -25.13%)
   displ. norm   :     0.0220308 α      lambda       -0.2269039E-04
   maximum displ.:     0.0198673 α      in ANC's #1, #3, #4, ...

........................................................................
.............................. CYCLE    8 ..............................
........................................................................
   1     -9.6633848 -0.966338E+01  0.703E-02    2.09       0.0  T
   2     -9.6633851 -0.276350E-06  0.407E-02    2.08       1.1  T
   3     -9.6633819  0.319698E-05  0.263E-02    2.09       1.7  T
   4     -9.6633855 -0.364019E-05  0.313E-03    2.09      14.3  T
   5     -9.6633855 -0.151237E-07  0.157E-03    2.09      28.5  T
   6     -9.6633855  0.726497E-08  0.111E-03    2.09      40.2  T
   7     -9.6633855 -0.848742E-08  0.189E-04    2.09     236.0  T
   8     -9.6633855 -0.588969E-10  0.236E-05    2.09    1895.7  T
     SCC iter.                  ...        0 min,  0.001 sec
     gradient                   ...        0 min,  0.001 sec
 * total energy  :    -9.5397006 Eh     change       -0.9400130E-05 Eh
   gradient norm :     0.0020934 Eh/α   predicted    -0.1134921E-04 (  20.73%)
   displ. norm   :     0.0085596 α      lambda       -0.1041027E-04
   maximum displ.:     0.0060953 α      in ANC's #1, #3, #4, ...

........................................................................
.............................. CYCLE    9 ..............................
........................................................................
   1     -9.6640616 -0.966406E+01  0.530E-02    2.09       0.0  T
   2     -9.6640618 -0.161485E-06  0.326E-02    2.08       1.4  T
   3     -9.6640612  0.626885E-06  0.255E-02    2.09       1.8  T
   4     -9.6640638 -0.260989E-05  0.318E-03    2.08      14.0  T
   5     -9.6640638 -0.119795E-07  0.140E-03    2.08      31.9  T
   6     -9.6640638 -0.455630E-09  0.365E-04    2.08     122.5  T
   7     -9.6640638 -0.438527E-09  0.235E-04    2.08     190.5  T
     SCC iter.                  ...        0 min,  0.001 sec
     gradient                   ...        0 min,  0.001 sec
 * total energy  :    -9.5397035 Eh     change       -0.2840746E-05 Eh
   gradient norm :     0.0010424 Eh/α   predicted    -0.5205397E-05 (  83.24%)
   displ. norm   :     0.0051538 α      lambda       -0.2289804E-05
   maximum displ.:     0.0040141 α      in ANC's #1, #3, #4, ...

........................................................................
.............................. CYCLE   10 ..............................
........................................................................
   1     -9.6639727 -0.966397E+01  0.283E-02    2.08       0.0  T
   2     -9.6639729 -0.212280E-06  0.152E-02    2.08       2.9  T
   3     -9.6639729  0.119735E-07  0.449E-03    2.08      10.0  T
   4     -9.6639729 -0.123882E-07  0.212E-03    2.08      21.1  T
   5     -9.6639730 -0.250614E-07  0.705E-04    2.08      63.4  T
   6     -9.6639730 -0.711928E-10  0.263E-04    2.08     170.2  T
     SCC iter.                  ...        0 min,  0.001 sec
     gradient                   ...        0 min,  0.001 sec
 * total energy  :    -9.5397045 Eh     change       -0.1000842E-05 Eh
   gradient norm :     0.0004318 Eh/α   predicted    -0.1144875E-05 (  14.39%)
   displ. norm   :     0.0014425 α      lambda       -0.2992451E-06
   maximum displ.:     0.0009740 α      in ANC's #3, #4, #1, ...

   *** GEOMETRY OPTIMIZATION CONVERGED AFTER 10 ITERATIONS ***

------------------------------------------------------------------------
 total energy gain   :        -0.0918546 Eh      -57.6397 kcal/mol
 total RMSD          :         0.4046637 a0        0.2141 Å
 total power (kW/mol):       -24.1164348 (step)-8114.0081 (real)
------------------------------------------------------------------------

 ANCopt (total)                0 d,  0 h,  0 min,  0.030 sec
 optimizer setup                ...        0 min,  0.000 sec (  0.218%)
 model hessian                  ...        0 min,  0.000 sec (  0.319%)
 ANC generation                 ...        0 min,  0.000 sec (  0.243%)
 coordinate transformation      ...        0 min,  0.000 sec (  0.067%)
 single point calculation       ...        0 min,  0.029 sec ( 96.045%)
 optimization log               ...        0 min,  0.000 sec (  0.939%)
 hessian update                 ...        0 min,  0.000 sec (  0.079%)
 rational function              ...        0 min,  0.000 sec (  0.765%)

================
 final structure:
================
5
 xtb: 6.2.2 (9d81278992624c895f80dd42a50cac0aa55982e2)
C        -0.37439504256511    0.76194588953561    0.02311392299938
C        -1.48630657249116    0.02521057149265    0.45400844726955
C        -0.40083717591944   -0.74844384747054    0.02039954743494
N         0.68896083974401   -0.01116472187886   -0.50205796588236
H         1.57257795123170   -0.02754789167885    0.00453604817850

 Bond Distances (Angstroems)
 ---------------------------
C1-C2=1.4017         C1-C3=1.5106         C1-N4=1.4157         C2-C1=1.4017         C2-C3=1.4017         C3-C1=1.5106         
C3-C2=1.4017         C3-N4=1.4157         N4-C1=1.4157         N4-C3=1.4157         N4-H5=1.0187         H5-N4=1.0187         
 C  C  Rav=1.4380 sigma=0.0513  Rmin=1.4017  Rmax=1.5106     3
 N  H  Rav=1.0187 sigma=0.0000  Rmin=1.0187  Rmax=1.0187     1
 N  C  Rav=1.4157 sigma=0.0000  Rmin=1.4157  Rmax=1.4157     2

 selected bond angles (degree)
 --------------------
C3-C1-C2= 57.39                N4-C1-C2=115.01                N4-C1-C3= 57.76                C3-C2-C1= 65.21                
C2-C3-C1= 57.39                N4-C3-C1= 57.76                N4-C3-C2=115.01                C3-N4-C1= 64.49                
H5-N4-C1=118.41                H5-N4-C3=118.41                

 selected dihedral angles (degree)
 ---------------------------------
C3-C2-C1-N4=  4.17            C2-C3-C1-N4=184.47            N4-C3-C1-C2=175.53            N4-C3-C2-C1=355.83            
C3-N4-C1-C2=355.85            H5-N4-C1-C2=245.89            H5-N4-C1-C3=250.05            C1-N4-C3-C2=  4.15            
H5-N4-C3-C1=109.95            H5-N4-C3-C2=114.11            
           -------------------------------------------------
          |                Final Singlepoint                |
           -------------------------------------------------

          ...................................................
          :                      SETUP                      :
          :.................................................:
          :  # basis functions                  17          :
          :  # atomic orbitals                  17          :
          :  # shells                            9          :
          :  # electrons                        18          :
          :  max. iterations                   250          :
          :  Hamiltonian                  GFN2-xTB          :
          :  restarted?                      false          :
          :  GBSA solvation                  false          :
          :  PC potential                    false          :
          :  electronic temp.          300.0000000     K    :
          :  accuracy                    1.0000000          :
          :  -> integral cutoff          0.2500000E+02      :
          :  -> integral neglect         0.1000000E-07      :
          :  -> SCF convergence          0.1000000E-05 Eh   :
          :  -> wf. convergence          0.1000000E-03 e    :
          :  Broyden damping             0.4000000          :
          ...................................................

 iter      E             dE          RMSdq      gap      omega  full diag
   1     -9.6639730 -0.966397E+01  0.128E-04    2.08       0.0  T
   2     -9.6639730  0.470006E-10  0.916E-05    2.08     488.0  T
   3     -9.6639730 -0.144613E-10  0.108E-04    2.08     414.3  T

   *** convergence criteria satisfied after 3 iterations ***

         #    Occupation            Energy/Eh            Energy/eV
      -------------------------------------------------------------
         1        2.0000           -0.7398845             -20.1333
       ...           ...                  ...                  ...
         3        2.0000           -0.6043008             -16.4439
         4        2.0000           -0.5982431             -16.2790
         5        2.0000           -0.5427596             -14.7692
         6        2.0000           -0.5299375             -14.4203
         7        2.0000           -0.4456809             -12.1276
         8        2.0000           -0.4272089             -11.6249
         9        2.0000           -0.4086387             -11.1196 (HOMO)
        10                         -0.3321364              -9.0379 (LUMO)
        11                         -0.2831210              -7.7041
        12                         -0.2339397              -6.3658
        13                          0.0238573               0.6492
        14                          0.1247592               3.3949
       ...                                ...                  ...
        17                          0.4118318              11.2065
      -------------------------------------------------------------
                  HL-Gap            0.0765023 Eh            2.0817 eV
             Fermi-level           -0.3703875 Eh          -10.0788 eV

 SCC (total)                   0 d,  0 h,  0 min,  0.003 sec
 SCC setup                      ...        0 min,  0.000 sec (  2.140%)
 Dispersion                     ...        0 min,  0.000 sec (  0.475%)
 integral evaluation            ...        0 min,  0.001 sec ( 35.292%)
 zeroth order Hamiltonian       ...        0 min,  0.000 sec (  0.509%)
 iterations                     ...        0 min,  0.001 sec ( 19.251%)
 molecular gradient             ...        0 min,  0.001 sec ( 38.027%)
 printout                       ...        0 min,  0.000 sec (  3.978%)

         :::::::::::::::::::::::::::::::::::::::::::::::::::::
         ::                     SUMMARY                     ::
         :::::::::::::::::::::::::::::::::::::::::::::::::::::
         :: total energy              -9.539704468092 Eh    ::
         :: gradient norm              0.000431506068 Eh/a0 ::
         :: HOMO-LUMO gap              2.081732830034 eV    ::
         ::.................................................::
         :: SCC energy                -9.663972957482 Eh    ::
         :: -> isotropic ES           -0.001205780661 Eh    ::
         :: -> anisotropic ES          0.003935841231 Eh    ::
         :: -> anisotropic XC          0.006869433617 Eh    ::
         :: -> dispersion             -0.002082419997 Eh    ::
         :: repulsion energy           0.124268487647 Eh    ::
         :: add. restraining           0.000000000000 Eh    ::
         :::::::::::::::::::::::::::::::::::::::::::::::::::::

           ------------------------------------------------- 
          |                Numerical Hessian                |
           ------------------------------------------------- 
step length          :   0.00500
SCC accuracy         :   0.30000
Hessian scale factor :   1.00000
frozen atoms in %    :   0.00000    0
RMS gradient         :   0.00043
estimated CPU  time      0.00 min
estimated wall time      0.00 min

writing file <hessian>.

 projected vibrational frequencies (cm-1)
eigval :       -0.00    -0.00    -0.00    -0.00    -0.00     0.00
eigval :      367.03   439.30   559.45   894.49   964.07  1064.43
eigval :     1355.21  1506.22  3292.35
           -------------------------------------------------
          |                Property Printout                |
           -------------------------------------------------

    * Orbital Energies and Occupations

         #    Occupation            Energy/Eh            Energy/eV
      -------------------------------------------------------------
         1        2.0000           -0.7398846             -20.1333
         2        2.0000           -0.6613712             -17.9968
         3        2.0000           -0.6043010             -16.4439
         4        2.0000           -0.5982431             -16.2790
         5        2.0000           -0.5427598             -14.7692
         6        2.0000           -0.5299376             -14.4203
         7        2.0000           -0.4456810             -12.1276
         8        2.0000           -0.4272090             -11.6249
         9        2.0000           -0.4086387             -11.1196 (HOMO)
        10                         -0.3321366              -9.0379 (LUMO)
        11                         -0.2831212              -7.7041
        12                         -0.2339397              -6.3658
        13                          0.0238573               0.6492
        14                          0.1247590               3.3949
        15                          0.2068525               5.6287
        16                          0.2187364               5.9521
        17                          0.4118316              11.2065
      -------------------------------------------------------------
                  HL-Gap            0.0765022 Eh            2.0817 eV
             Fermi-level           -0.3703877 Eh          -10.0788 eV

     #   Z        covCN         q      C6AA      α(0)
     1   6 C      2.865     0.070    26.422     8.426
     2   6 C      1.969    -0.153    35.394     9.608
     3   6 C      2.865     0.070    26.422     8.426
     4   7 N      2.686    -0.156    24.371     7.332
     5   1 H      0.860     0.168     1.287     1.777

 Mol. C6AA /au·bohr⁶  :        496.431804
 Mol. C8AA /au·bohr⁸  :      13068.573110
 Mol. α(0) /au        :         35.568346


Wiberg/Mayer (AO) data.
largest (>0.10) Wiberg bond orders for each atom
          total WBO             WBO to atom ...
     1  C   3.383        C    2 1.265    C    3 1.119    N    4 0.998
     2  C   2.829        C    1 1.265    C    3 1.265    N    4 0.257
     3  C   3.383        C    2 1.265    C    1 1.119    N    4 0.998
     4  N   3.181        C    3 0.998    C    1 0.998    H    5 0.928    C    2 0.257
     5  H   0.972        N    4 0.928

MOs/occ written to file <molden.input>


molecular dipole:
                 x           y           z       tot (Debye)
 q only:        0.621      -0.011       0.024
   full:        1.367      -0.024       0.056       3.478
molecular quadrupole (traceless):
                xx          xy          yy          xz          yz          zz
 q only:        0.072       0.004       0.368       0.840      -0.013      -0.440
  q+dip:       -0.700       0.015       0.436       2.885      -0.050       0.265
   full:       -1.698       0.028       0.324       3.945      -0.071       1.374

           -------------------------------------------------
          |                Geometry Summary                 |
           -------------------------------------------------

      molecular mass/u    :       51.0468517
   center of mass at/Å    :       -0.3120195       0.0055028      -0.0206074
  moments of inertia/u·Å² :        0.1431409E+02   0.4031924E+02   0.5341345E+02
rotational constants/cm⁻¹ :        0.1177695E+01   0.4181039E+00   0.3156065E+00

 * 3 selected distances

     #   Z        #   Z                                     value/Å
     1   6 C      4   7 N                                 1.4157087 (max)
     3   6 C      4   7 N                                 1.4156984
     4   7 N      5   1 H                                 1.0186683 (min)

 * 2 distinct bonds (by element types)

   Z      Z             #   av. dist./Å        max./Å        min./Å
   1 H    7 N           1     1.0186683     1.0186683     1.0186683
   6 C    7 N           2     1.4157036     1.4157087     1.4156984

           -------------------------------------------------
          |               Frequency Printout                |
           -------------------------------------------------
 projected vibrational frequencies (cm-1)
eigval :       -0.00    -0.00    -0.00    -0.00    -0.00     0.00
eigval :      367.03   439.30   559.45   894.49   964.07  1064.43
Molecule has the following symmetry elements: (sigma) 
It seems to be the Cs point group
eigval :     1355.21  1506.22  3292.35
 reduced masses (amu)
   1: 12.18   2: 11.87   3: 11.74   4: 12.07   5: 12.34   6: 12.36   7: 12.26   8: 10.76
   9: 12.05  10: 11.45  11:  5.03  12:  2.76  13: 12.45  14: 11.98  15:  1.84
 IR intensities (amu)
   1:  0.24   2:  0.15   3:  0.15   4:  0.19   5:  0.13   6:  0.08   7:  1.41   8:  0.51
   9:  0.60  10:  0.71  11:  0.37  12:  0.05  13:  0.87  14:  0.49  15:  0.09
 Raman intensities (amu)
   1:  0.00   2:  0.00   3:  0.00   4:  0.00   5:  0.00   6:  0.00   7:  0.00   8:  0.00
   9:  0.00  10:  0.00  11:  0.00  12:  0.00  13:  0.00  14:  0.00  15:  0.00
 output can be read by thermo (or use thermo option).
 writing <g98.out> molden fake output.
 recommended (thermochemical) frequency scaling factor: 1.0
           -------------------------------------------------
          |             Thermodynamic Functions             |
           -------------------------------------------------

cs  symmetry found (for desy threshold:  0.10E+00) used in thermo

          ...................................................
          :                      SETUP                      :
          :.................................................:
          :  # frequencies                           9      :
          :  # imaginary freq.                       0      :
          :  linear?                             false      :
          :  only rotor calc.                    false      :
          :  symmetry                               cs      :
          :  rotational number                       1      :
          :  scaling factor                  1.0000000      :
          :  rotor cutoff                   50.0000000 cm⁻¹ :
          :  imag. cutoff                  -20.0000000 cm⁻¹ :
          :.................................................:

    mode    ω/cm⁻¹     T·S(HO)/kcal·mol⁻¹    T·S(FR)/kcal·mol⁻¹   T·S(vib)
   ------------------------------------------------------------------------
   ------------------------------------------------------------------------

   temp. (K)  partition function   enthalpy   heat capacity  entropy
                                   cal/mol     cal/K/mol   cal/K/mol   J/K/mol
 298.15  VIB   1.51                  589.528      5.478      2.802
         ROT  0.134E+05              888.752      2.981     21.868
         INT  0.203E+05             1478.280      8.459     24.670
         TR   0.353E+27             1481.254      4.968     37.697
         TOT                        2959.5341    13.4270    62.3666   260.9417

   temp. (K)  partition function   enthalpy   heat capacity  entropy
                                   cal/mol     cal/K/mol   cal/K/mol   J/K/mol
 120.00  VIB   1.02                   21.598      0.889      0.218
         ROT  0.342E+04              357.707      2.981     19.155
         INT  0.349E+04              379.304      3.870     19.372
         TR   0.901E+26              596.178      4.968     33.177
         TOT                         975.4824     8.8384    52.5495   219.8671

   temp. (K)  partition function   enthalpy   heat capacity  entropy
                                   cal/mol     cal/K/mol   cal/K/mol   J/K/mol
 100.00  VIB   1.01                    8.152      0.471      0.096
         ROT  0.261E+04              298.089      2.981     18.611
         INT  0.262E+04              306.241      3.452     18.707
         TR   0.685E+26              496.815      4.968     32.272
         TOT                         803.0563     8.4197    50.9792   213.2969

   temp. (K)  partition function   enthalpy   heat capacity  entropy
                                   cal/mol     cal/K/mol   cal/K/mol   J/K/mol
  80.00  VIB   1.00                    1.962      0.173      0.028
         ROT  0.186E+04              238.471      2.981     17.946
         INT  0.187E+04              240.434      3.154     17.974
         TR   0.490E+26              397.452      4.968     31.164
         TOT                         637.8857     8.1217    49.1380   205.5934

   temp. (K)  partition function   enthalpy   heat capacity  entropy
                                   cal/mol     cal/K/mol   cal/K/mol   J/K/mol
  60.00  VIB   1.00                    0.194      0.030      0.003
         ROT  0.121E+04              178.853      2.981     17.089
         INT  0.121E+04              179.047      3.010     17.092
         TR   0.319E+26              298.089      4.968     29.735
         TOT                         477.1362     7.9786    46.8273   195.9253

   temp. (K)  partition function   enthalpy   heat capacity  entropy
                                   cal/mol     cal/K/mol   cal/K/mol   J/K/mol
  40.00  VIB   1.00                    0.002      0.001     -0.000
         ROT   659.                  119.236      2.981     15.880
         INT   659.                  119.238      2.982     15.880
         TR   0.173E+26              198.726      4.968     27.722
         TOT                         317.9637     7.9497    43.6014   182.4283

   temp. (K)  partition function   enthalpy   heat capacity  entropy
                                   cal/mol     cal/K/mol   cal/K/mol   J/K/mol
  20.00  VIB   1.00                    0.000      0.000     -0.001
         ROT   233.                   59.618      2.981     13.814
         INT   233.                   59.618      2.981     13.813
         TR   0.613E+25               99.363      4.968     24.280
         TOT                         158.9808     7.9490    38.0928   159.3802

   temp. (K)  partition function   enthalpy   heat capacity  entropy
                                   cal/mol     cal/K/mol   cal/K/mol   J/K/mol
  10.00  VIB   1.00                    0.000      0.000     -0.001
         ROT   82.4                   29.809      2.981     11.748
         INT   82.4                   29.809      2.981     11.746
         TR   0.217E+25               49.681      4.968     20.838
         TOT                          79.4904     7.9490    32.5842   136.3323

       T/K    H(0)-H(T)+PV         H(T)/Eh          T*S/Eh         G(T)/Eh
   ------------------------------------------------------------------------
    298.15    0.471632E-02    0.285062E-01    0.296324E-01   -0.112618E-02
    120.00    0.155453E-02    0.253444E-01    0.100492E-01    0.152952E-01
    100.00    0.127975E-02    0.250696E-01    0.812405E-02    0.169456E-01
     80.00    0.101654E-02    0.248064E-01    0.626451E-02    0.185419E-01
     60.00    0.760365E-03    0.245502E-01    0.447744E-02    0.200728E-01
     40.00    0.506707E-03    0.242966E-01    0.277933E-02    0.215172E-01
     20.00    0.253352E-03    0.240432E-01    0.121409E-02    0.228291E-01
     10.00    0.126676E-03    0.239165E-01    0.519262E-03    0.233973E-01 (used)
   ------------------------------------------------------------------------

         :::::::::::::::::::::::::::::::::::::::::::::::::::::
         ::                  THERMODYNAMIC                  ::
         :::::::::::::::::::::::::::::::::::::::::::::::::::::
         :: total free energy          -9.516307189213 Eh   ::
         ::.................................................::
         :: total energy               -9.539704468228 Eh   ::
         :: zero point energy           0.023789865162 Eh   ::
         :: G(RRHO) w/o ZPVE           -0.000392586147 Eh   ::
         :: G(RRHO) contrib.            0.023397279015 Eh   ::
         :::::::::::::::::::::::::::::::::::::::::::::::::::::

optimized geometry written to: xtbopt.xyz


           -------------------------------------------------
          | TOTAL ENERGY               -9.539704468228 Eh   |
          | TOTAL ENTHALPY             -9.515787927050 Eh   |
          | TOTAL FREE ENERGY          -9.516307189213 Eh   |
          | GRADIENT NORM               0.000431524249 Eh/α |
          | HOMO-LUMO GAP               2.081729901002 eV   |
           -------------------------------------------------

------------------------------------------------------------------------
 * finished run on 2020/05/12 at 11:45:00.214     
------------------------------------------------------------------------
 total:
 * wall-time:     0 d,  0 h,  0 min,  0.137 sec
 *  cpu-time:     0 d,  0 h,  0 min,  0.137 sec
 * ratio c/w:     0.995 speedup
 SCF:
 * wall-time:     0 d,  0 h,  0 min,  0.004 sec
 *  cpu-time:     0 d,  0 h,  0 min,  0.004 sec
 * ratio c/w:     1.000 speedup
 ANC optimizer:
 * wall-time:     0 d,  0 h,  0 min,  0.033 sec
 *  cpu-time:     0 d,  0 h,  0 min,  0.033 sec
 * ratio c/w:     0.998 speedup
 numerical hessian:
 * wall-time:     0 d,  0 h,  0 min,  0.081 sec
 *  cpu-time:     0 d,  0 h,  0 min,  0.081 sec
 * ratio c/w:     0.998 speedup

