      -----------------------------------------------------------      
     |                   =====================                   |     
     |                           x T B                           |     
     |                   =====================                   |     
     |                         S. Grimme                         |     
     |          Mulliken Center for Theoretical Chemistry        |     
     |                    University of Bonn                     |     
      -----------------------------------------------------------      

   * xtb version 6.2.2 (9d81278992624c895f80dd42a50cac0aa55982e2) compiled by '@Darwin' on 04/03/2020

   xtb is free software: you can redistribute it and/or modify it under
   the terms of the GNU Lesser General Public License as published by
   the Free Software Foundation, either version 3 of the License, or
   (at your option) any later version.
   
   xtb is distributed in the hope that it will be useful,
   but WITHOUT ANY WARRANTY; without even the implied warranty of
   MERCHANTABILITY or FITNESS FOR A PARTICULAR PURPOSE.  See the
   GNU Lesser General Public License for more details.
   
   Cite this work as:
   * S. Grimme, C. Bannwarth, P. Shushkov, J. Chem. Theory Comput., 2017,
     13, 1989-2009. DOI: 10.1021/acs.jctc.7b00118
   * C. Bannwarth, S. Ehlert and S. Grimme., J. Chem. Theory Comput., 2019,
     15, 1652-1671. DOI: 10.1021/acs.jctc.8b01176
   * P. Pracht, E. Caldeweyher, S. Ehlert, S. Grimme, ChemRxiv, 2019, preprint.
     DOI: 10.26434/chemrxiv.8326202.v1
   
   for DFT-D4:
   * E. Caldeweyher, C. Bannwarth and S. Grimme, J. Chem. Phys., 2017,
     147, 034112. DOI: 10.1063/1.4993215
   * E. Caldeweyher, S. Ehlert, A. Hansen, H. Neugebauer, S. Spicher,
     C. Bannwarth and S. Grimme, J. Chem. Phys., 2019, 150, 154122.
     DOI: 10.1063/1.5090222
   
   for sTDA-xTB:
   * S. Grimme and C. Bannwarth, J. Chem. Phys., 2016, 145, 054103.
     DOI: 10.1063/1.4959605
   
   in the mass-spec context:
   * V. Asgeirsson, C. Bauer and S. Grimme, Chem. Sci., 2017, 8, 4879.
     DOI: 10.1039/c7sc00601b
   
   for metadynamics refer to:
   * S. Grimme, J. Chem. Theory Comput., 2019, 155, 2847-2862
     DOI: 10.1021/acs.jctc.9b00143
   
   with help from (in alphabetical order)
   C. Bannwarth, F. Bohle, G. Brandenburg, E. Caldeweyher, M. Checinski,
   S. Dohm, S. Ehlert, S. Ehrlich, F. März, H. Neugebauer, J. Pisarek,
   P. Pracht, P. Shushkov, and S. Spicher.
   
 * started run on 2020/05/12 at 11:44:09.649     

           -------------------------------------------------
          |                Calculation Setup                |
           -------------------------------------------------

          program call               : xtb --input C4N1_26_S_3.input C4N1_26_S_3.xyz --ohess --molden --namespace C4N1_26_S_3 output.out
          calculation namespace      : C4N1_26_S_3
          coordinate file            : C4N1_26_S_3.xyz
          number of atoms            :                     5
          number of electrons        :                    21
          charge                     :                     0
          spin                       :                   1.5
          first test random number   :      0.06636208082527

   ID    Z sym.   atoms
    1    6 C      1-3, 5
    2    7 N      4

           -------------------------------------------------
          |                 G F N 2 - x T B                 |
           -------------------------------------------------

        Reference                      10.1021/acs.jctc.8b01176
      * Hamiltonian:
        H0-scaling (s, p, d)           1.850000    2.230000    2.230000
        zeta-weighting                 0.500000
      * Dispersion:
        s8                             2.700000
        a1                             0.520000
        a2                             5.000000
        s9                             5.000000
      * Repulsion:
        kExp                           1.500000    1.000000
        rExp                           1.000000
      * Coulomb:
        alpha                          2.000000
        third order                    shell-resolved
        anisotropic                    true
        a3                             3.000000
        a5                             4.000000
        cn-shift                       1.200000
        cn-exp                         4.000000
        max-rad                        5.000000


          ...................................................
          :                      SETUP                      :
          :.................................................:
          :  # basis functions                  20          :
          :  # atomic orbitals                  20          :
          :  # shells                           10          :
          :  # electrons                        21          :
          :  max. iterations                   250          :
          :  Hamiltonian                  GFN2-xTB          :
          :  restarted?                      false          :
          :  GBSA solvation                  false          :
          :  PC potential                    false          :
          :  electronic temp.          300.0000000     K    :
          :  accuracy                    1.0000000          :
          :  -> integral cutoff          0.2500000E+02      :
          :  -> integral neglect         0.1000000E-07      :
          :  -> SCF convergence          0.1000000E-05 Eh   :
          :  -> wf. convergence          0.1000000E-03 e    :
          :  Broyden damping             0.4000000          :
          ...................................................

 iter      E             dE          RMSdq      gap      omega  full diag
   1    -10.8479103 -0.108479E+02  0.102E+01    0.21       0.0  T
   2     -9.7215441  0.112637E+01  0.114E+01    0.46       1.0  T
   3     -9.7791687 -0.576246E-01  0.106E+01    1.35       1.0  T
   4    -10.7689088 -0.989740E+00  0.565E+00    0.07       1.0  T
   5    -10.9346705 -0.165762E+00  0.387E+00    0.25       1.0  T
   6    -10.9650746 -0.304041E-01  0.284E+00    0.21       1.0  T
   7    -10.9613720  0.370263E-02  0.230E+00    0.20       1.0  T
   8    -10.9726381 -0.112662E-01  0.724E-01    0.13       1.0  T
   9    -10.9754335 -0.279542E-02  0.430E-01    0.14       1.0  T
  10    -10.9755633 -0.129749E-03  0.306E-01    0.13       1.0  T
  11    -10.9755936 -0.303542E-04  0.207E-01    0.13       1.0  T
  12    -10.9756534 -0.597865E-04  0.808E-02    0.14       1.0  T
  13    -10.9756527  0.732886E-06  0.529E-02    0.14       1.0  T
  14    -10.9756556 -0.292406E-05  0.110E-02    0.14       4.1  T
  15    -10.9756558 -0.235306E-06  0.703E-03    0.14       6.4  T
  16    -10.9756559 -0.820864E-07  0.621E-04    0.14      72.0  T
  17    -10.9756559 -0.212319E-09  0.830E-04    0.14      53.9  T

   *** convergence criteria satisfied after 17 iterations ***

         #    Occupation            Energy/Eh            Energy/eV
      -------------------------------------------------------------
         1        2.0000           -0.7698051             -20.9475
       ...           ...                  ...                  ...
         6        2.0000           -0.5529705             -15.0471
         7        2.0000           -0.5374879             -14.6258
         8        2.0000           -0.5078357             -13.8189
         9        2.0000           -0.4944560             -13.4548
        10        1.0000           -0.4505608             -12.2604
        11        1.0000           -0.4364838             -11.8773
        12        0.9344           -0.4092011             -11.1349 (HOMO)
        13        0.0656           -0.4041524             -10.9975 (LUMO)
        14                         -0.3429587              -9.3324
        15                         -0.2843895              -7.7386
        16                         -0.0309543              -0.8423
        17                         -0.0105718              -0.2877
       ...                                ...                  ...
        20                          0.1811316               4.9288
      -------------------------------------------------------------
                  HL-Gap            0.0050487 Eh            0.1374 eV
             Fermi-level           -0.4395926 Eh          -11.9619 eV

 SCC (total)                   0 d,  0 h,  0 min,  0.005 sec
 SCC setup                      ...        0 min,  0.000 sec (  1.437%)
 Dispersion                     ...        0 min,  0.000 sec (  0.333%)
 integral evaluation            ...        0 min,  0.001 sec ( 24.593%)
 zeroth order Hamiltonian       ...        0 min,  0.000 sec (  0.407%)
 iterations                     ...        0 min,  0.002 sec ( 41.954%)
 molecular gradient             ...        0 min,  0.001 sec ( 28.996%)
 printout                       ...        0 min,  0.000 sec (  2.079%)

         :::::::::::::::::::::::::::::::::::::::::::::::::::::
         ::                     SUMMARY                     ::
         :::::::::::::::::::::::::::::::::::::::::::::::::::::
         :: total energy             -10.890345491847 Eh    ::
         :: gradient norm              0.183590624491 Eh/a0 ::
         :: HOMO-LUMO gap              0.137381487230 eV    ::
         ::.................................................::
         :: SCC energy               -10.975655923665 Eh    ::
         :: -> isotropic ES           -0.016368438405 Eh    ::
         :: -> anisotropic ES          0.002371552259 Eh    ::
         :: -> anisotropic XC          0.008082014423 Eh    ::
         :: -> dispersion             -0.002835843535 Eh    ::
         :: repulsion energy           0.085310335927 Eh    ::
         :: add. restraining           0.000000000000 Eh    ::
         :::::::::::::::::::::::::::::::::::::::::::::::::::::

      ----------------------------------------------------------- 
     |                   =====================                   |
     |                        A N C O P T                        |
     |                   =====================                   |
     |               Approximate Normal Coordinate               |
     |                Rational Function Optimizer                |
      ----------------------------------------------------------- 

          ...................................................
          :                      SETUP                      :
          :.................................................:
          :   optimization level            normal          :
          :   max. optcycles                   200          :
          :   ANC micro-cycles                  20          :
          :   degrees of freedom                 9          :
          :.................................................:
          :   RF solver                   davidson          :
          :   write xtbopt.log                true          :
          :   linear?                        false          :
          :   energy convergence         0.5000000E-05 Eh   :
          :   grad. convergence          0.1000000E-02 Eh/α :
          :   maximium RF displ.         1.0000000          :
          :   Hlow (freq-cutoff)         0.1000000E-01      :
          :   Hmax (freq-cutoff)         5.0000000          :
          :   S6 in model hess.         20.0000000          :
          ...................................................

generating ANC from model Hessian ...
Using Lindh-Hessian (1995)
 Shifting diagonal of input Hessian by    0.0000000000000000     
 Lowest  eigenvalues of input Hessian
   -0.000000   -0.000000   -0.000000    0.000000    0.000000    0.000000
    0.082940    0.089905    0.129277    0.532013    0.631971    0.923710
    0.978068    1.328389    1.514400
 Highest eigenvalues
    0.532013    0.631971    0.923710    0.978068    1.328389    1.514400


........................................................................
.............................. CYCLE    1 ..............................
........................................................................
   1    -10.9756559 -0.109757E+02  0.980E-05    0.14       0.0  T
   2    -10.9756559  0.313381E-09  0.233E-04    0.14     191.6  T
   3    -10.9756559 -0.273982E-09  0.120E-04    0.14     373.4  T
     SCC iter.                  ...        0 min,  0.001 sec
     gradient                   ...        0 min,  0.001 sec
 * total energy  :   -10.8903455 Eh     change        0.7631780E-09 Eh
   gradient norm :     0.1835909 Eh/α   predicted     0.0000000E+00 (-100.00%)
   displ. norm   :     0.2795232 α      lambda       -0.4558424E-01
   maximum displ.:     0.1936330 α      in ANC's #5, #3, #1, ...

........................................................................
.............................. CYCLE    2 ..............................
........................................................................
   1    -11.0297715 -0.110298E+02  0.203E+00    0.12       0.0  T
   2    -11.0182431  0.115284E-01  0.172E+00    0.17       1.0  T
   3    -11.0216036 -0.336048E-02  0.155E+00    0.11       1.0  T
   4    -11.0137991  0.780447E-02  0.206E+00    0.17       1.0  T
   5    -11.0346652 -0.208661E-01  0.433E-01    0.15       1.0  T
   6    -11.0353339 -0.668693E-03  0.171E-01    0.15       1.0  T
   7    -11.0354425 -0.108551E-03  0.941E-02    0.14       1.0  T
   8    -11.0354157  0.267182E-04  0.796E-02    0.14       1.0  T
   9    -11.0354510 -0.352567E-04  0.201E-02    0.14       2.2  T
  10    -11.0354520 -0.104432E-05  0.101E-02    0.14       4.4  T
  11    -11.0354523 -0.224104E-06  0.201E-03    0.14      22.2  T
  12    -11.0354523 -0.478005E-08  0.107E-03    0.14      41.7  T
  13    -11.0354523 -0.317861E-08  0.294E-04    0.14     151.9  T
  14    -11.0354523 -0.272925E-09  0.283E-05    0.14    1578.9  T
     SCC iter.                  ...        0 min,  0.002 sec
     gradient                   ...        0 min,  0.001 sec
 * total energy  :   -10.9275714 Eh     change       -0.3722595E-01 Eh
   gradient norm :     0.1139815 Eh/α   predicted    -0.2457293E-01 ( -33.99%)
   displ. norm   :     0.4203163 α      lambda       -0.4112810E-01
   maximum displ.:     0.2670470 α      in ANC's #5, #3, #2, ...

........................................................................
.............................. CYCLE    3 ..............................
........................................................................
   1    -11.1024370 -0.111024E+02  0.369E+00    0.17       0.0  T
   2    -10.7173495  0.385087E+00  0.662E+00    0.21       1.0  T
   3    -10.9717357 -0.254386E+00  0.394E+00    0.58       1.0  T
   4    -11.0021007 -0.303650E-01  0.467E+00    0.08       1.0  T
   5    -11.1058645 -0.103764E+00  0.143E+00    0.19       1.0  T
   6    -11.0998603  0.600423E-02  0.135E+00    0.20       1.0  T
   7    -11.1004527 -0.592417E-03  0.126E+00    0.21       1.0  T
   8    -11.1061303 -0.567765E-02  0.753E-01    0.18       1.0  T
   9    -11.1091574 -0.302710E-02  0.394E-01    0.16       1.0  T
  10    -11.1088736  0.283843E-03  0.455E-01    0.16       1.0  T
  11    -11.1100061 -0.113252E-02  0.139E-01    0.15       1.0  T
  12    -11.1101071 -0.100998E-03  0.437E-02    0.15       1.0  T
  13    -11.1101105 -0.335125E-05  0.281E-02    0.15       1.6  T
  14    -11.1101086  0.188767E-05  0.299E-02    0.15       1.5  T
  15    -11.1101129 -0.433285E-05  0.681E-03    0.15       6.6  T
  16    -11.1101130 -0.109766E-06  0.381E-03    0.15      11.7  T
  17    -11.1101131 -0.429785E-07  0.560E-04    0.15      79.9  T
  18    -11.1101131 -0.660012E-09  0.159E-04    0.15     280.6  T
     SCC iter.                  ...        0 min,  0.002 sec
     gradient                   ...        0 min,  0.001 sec
 * total energy  :   -10.9486965 Eh     change       -0.2112509E-01 Eh
   gradient norm :     0.0708590 Eh/α   predicted    -0.2419701E-01 (  14.54%)
   displ. norm   :     0.3718774 α      lambda       -0.1359412E-01
   maximum displ.:     0.2721541 α      in ANC's #2, #1, #3, ...

........................................................................
.............................. CYCLE    4 ..............................
........................................................................
   1    -11.0957378 -0.110957E+02  0.280E+00    0.44       0.0  T
   2    -10.9952856  0.100452E+00  0.343E+00    0.57       1.0  T
   3    -10.7355822  0.259703E+00  0.616E+00    0.15       1.0  T
   4    -11.0938181 -0.358236E+00  0.145E+00    0.54       1.0  T
   5    -11.1025484 -0.873035E-02  0.880E-01    0.38       1.0  T
   6    -11.1023132  0.235222E-03  0.666E-01    0.46       1.0  T
   7    -11.1037132 -0.139999E-02  0.468E-01    0.41       1.0  T
   8    -11.1035708  0.142362E-03  0.432E-01    0.42       1.0  T
   9    -11.1040641 -0.493299E-03  0.294E-01    0.40       1.0  T
  10    -11.1041305 -0.664114E-04  0.212E-01    0.40       1.0  T
  11    -11.1041389 -0.833828E-05  0.168E-01    0.40       1.0  T
  12    -11.1041807 -0.417705E-04  0.473E-02    0.39       1.0  T
  13    -11.1041900 -0.937236E-05  0.151E-02    0.39       3.0  T
  14    -11.1041910 -0.101984E-05  0.307E-03    0.39      14.6  T
  15    -11.1041911 -0.108056E-07  0.165E-04    0.39     270.8  T
  16    -11.1041911  0.722125E-10  0.168E-04    0.39     266.1  T
     SCC iter.                  ...        0 min,  0.002 sec
     gradient                   ...        0 min,  0.001 sec
 * total energy  :   -10.9600401 Eh     change       -0.1134358E-01 Eh
   gradient norm :     0.0447305 Eh/α   predicted    -0.7737044E-02 ( -31.79%)
   displ. norm   :     0.7180514 α      lambda       -0.2078596E-01
   maximum displ.:     0.4410791 α      in ANC's #3, #2, #1, ...

........................................................................
.............................. CYCLE    5 ..............................
........................................................................
   1    -11.0702146 -0.110702E+02  0.352E+00    0.64       0.0  T
   2    -11.0566846  0.135300E-01  0.234E+00    0.86       1.0  T
   3    -11.0143511  0.423335E-01  0.301E+00    0.42       1.0  T
   4    -11.0470713 -0.327201E-01  0.182E+00    1.03       1.0  T
   5    -11.0582539 -0.111826E-01  0.137E+00    0.51       1.0  T
   6    -11.0780731 -0.198192E-01  0.325E-01    0.72       1.0  T
   7    -11.0781776 -0.104465E-03  0.268E-01    0.72       1.0  T
   8    -11.0781428  0.347780E-04  0.231E-01    0.71       1.0  T
   9    -11.0782756 -0.132809E-03  0.329E-02    0.72       1.4  T
  10    -11.0782790 -0.336532E-05  0.161E-02    0.72       2.8  T
  11    -11.0782791 -0.196490E-06  0.153E-03    0.72      29.3  T
  12    -11.0782792 -0.877808E-09  0.311E-04    0.72     143.8  T
  13    -11.0782792 -0.196453E-09  0.980E-05    0.72     456.5  T
     SCC iter.                  ...        0 min,  0.001 sec
     gradient                   ...        0 min,  0.001 sec
 * total energy  :   -10.9659412 Eh     change       -0.5901085E-02 Eh
   gradient norm :     0.1452205 Eh/α   predicted    -0.1575155E-01 ( 166.93%)
   displ. norm   :     0.2229476 α      lambda       -0.1667087E-01
   maximum displ.:     0.1600119 α      in ANC's #1, #2, #4, ...

........................................................................
.............................. CYCLE    6 ..............................
........................................................................
   1    -11.1002923 -0.111003E+02  0.123E+00    0.58       0.0  T
   2    -10.9277072  0.172585E+00  0.412E+00    1.28       1.0  T
   3    -11.1060073 -0.178300E+00  0.711E-01    0.71       1.0  T
   4    -11.1031166  0.289075E-02  0.720E-01    0.68       1.0  T
   5    -11.1061261 -0.300950E-02  0.301E-01    0.67       1.0  T
   6    -11.1067745 -0.648474E-03  0.943E-02    0.69       1.0  T
   7    -11.1068393 -0.647885E-04  0.504E-02    0.70       1.0  T
   8    -11.1068330  0.638019E-05  0.396E-02    0.70       1.1  T
   9    -11.1068425 -0.951611E-05  0.164E-02    0.70       2.7  T
  10    -11.1068429 -0.466157E-06  0.977E-03    0.70       4.6  T
  11    -11.1068431 -0.204686E-06  0.430E-03    0.70      10.4  T
  12    -11.1068432 -0.307175E-07  0.723E-04    0.70      61.9  T
  13    -11.1068432 -0.852241E-09  0.825E-05    0.70     541.8  T
     SCC iter.                  ...        0 min,  0.001 sec
     gradient                   ...        0 min,  0.001 sec
 * total energy  :   -10.9771986 Eh     change       -0.1125737E-01 Eh
   gradient norm :     0.0857450 Eh/α   predicted    -0.8749751E-02 ( -22.28%)
   displ. norm   :     0.3592694 α      lambda       -0.1826988E-01
   maximum displ.:     0.2138217 α      in ANC's #1, #5, #3, ...

........................................................................
.............................. CYCLE    7 ..............................
........................................................................
   1    -11.1180939 -0.111181E+02  0.255E+00    1.10       0.0  T
   2    -10.4661800  0.651914E+00  0.736E+00    2.00       1.0  T
   3    -11.1361772 -0.669997E+00  0.141E+00    1.13       1.0  T
   4    -11.1404571 -0.427991E-02  0.109E+00    1.17       1.0  T
   5    -11.1470412 -0.658406E-02  0.523E-01    1.17       1.0  T
   6    -11.1461389  0.902209E-03  0.452E-01    1.17       1.0  T
   7    -11.1484851 -0.234615E-02  0.151E-01    1.19       1.0  T
   8    -11.1485148 -0.296998E-04  0.626E-02    1.20       1.0  T
   9    -11.1485215 -0.673513E-05  0.280E-02    1.20       1.6  T
  10    -11.1485252 -0.366312E-05  0.985E-03    1.20       4.5  T
  11    -11.1485253 -0.160060E-06  0.517E-03    1.20       8.7  T
  12    -11.1485254 -0.422476E-07  0.242E-04    1.20     184.7  T
  13    -11.1485254 -0.204047E-09  0.159E-04    1.20     281.4  T
     SCC iter.                  ...        0 min,  0.001 sec
     gradient                   ...        0 min,  0.001 sec
 * total energy  :   -10.9886606 Eh     change       -0.1146206E-01 Eh
   gradient norm :     0.0407880 Eh/α   predicted    -0.1031402E-01 ( -10.02%)
   displ. norm   :     0.2971677 α      lambda       -0.7593822E-02
   maximum displ.:     0.1782824 α      in ANC's #3, #2, #5, ...

........................................................................
.............................. CYCLE    8 ..............................
........................................................................
   1    -11.1531884 -0.111532E+02  0.144E+00    1.66       0.0  T
   2    -11.1508523  0.233618E-02  0.925E-01    1.67       1.0  T
   3    -11.0964234  0.544289E-01  0.227E+00    1.63       1.0  T
   4    -11.1518998 -0.554765E-01  0.511E-01    1.66       1.0  T
   5    -11.1532340 -0.133416E-02  0.217E-01    1.66       1.0  T
   6    -11.1536680 -0.434015E-03  0.645E-02    1.66       1.0  T
   7    -11.1536801 -0.120336E-04  0.441E-02    1.66       1.0  T
   8    -11.1536884 -0.837016E-05  0.115E-02    1.66       3.9  T
   9    -11.1536892 -0.751846E-06  0.340E-03    1.66      13.1  T
  10    -11.1536892 -0.150420E-07  0.773E-04    1.66      57.9  T
  11    -11.1536892 -0.139504E-08  0.325E-04    1.66     137.7  T
     SCC iter.                  ...        0 min,  0.001 sec
     gradient                   ...        0 min,  0.001 sec
 * total energy  :   -10.9940837 Eh     change       -0.5423080E-02 Eh
   gradient norm :     0.0423159 Eh/α   predicted    -0.4132213E-02 ( -23.80%)
   displ. norm   :     0.2073450 α      lambda       -0.4071428E-02
   maximum displ.:     0.1264552 α      in ANC's #2, #5, #3, ...

........................................................................
.............................. CYCLE    9 ..............................
........................................................................
   1    -11.1586665 -0.111587E+02  0.110E+00    2.09       0.0  T
   2    -11.1465178  0.121487E-01  0.118E+00    2.08       1.0  T
   3    -11.1279376  0.185802E-01  0.172E+00    2.10       1.0  T
   4    -11.1589924 -0.310548E-01  0.295E-01    2.09       1.0  T
   5    -11.1594426 -0.450179E-03  0.722E-02    2.09       1.0  T
   6    -11.1594628 -0.201853E-04  0.399E-02    2.09       1.1  T
   7    -11.1594538  0.894950E-05  0.441E-02    2.09       1.0  T
   8    -11.1594653 -0.114823E-04  0.900E-03    2.09       5.0  T
   9    -11.1594659 -0.611586E-06  0.268E-03    2.09      16.7  T
  10    -11.1594659 -0.244062E-07  0.391E-04    2.09     114.3  T
  11    -11.1594659 -0.762117E-09  0.962E-05    2.09     465.0  T
     SCC iter.                  ...        0 min,  0.001 sec
     gradient                   ...        0 min,  0.001 sec
 * total energy  :   -10.9964987 Eh     change       -0.2414945E-02 Eh
   gradient norm :     0.0455594 Eh/α   predicted    -0.2123235E-02 ( -12.08%)
   displ. norm   :     0.0893493 α      lambda       -0.2294294E-02
   maximum displ.:     0.0480748 α      in ANC's #3, #9, #2, ...

........................................................................
.............................. CYCLE   10 ..............................
........................................................................
   1    -11.1606728 -0.111607E+02  0.418E-01    2.21       0.0  T
   2    -11.1573311  0.334175E-02  0.630E-01    2.21       1.0  T
   3    -11.1602746 -0.294352E-02  0.287E-01    2.21       1.0  T
   4    -11.1607418 -0.467175E-03  0.116E-01    2.21       1.0  T
   5    -11.1608307 -0.889064E-04  0.196E-02    2.21       2.3  T
   6    -11.1608298  0.835779E-06  0.172E-02    2.21       2.6  T
   7    -11.1608310 -0.121267E-05  0.531E-03    2.21       8.4  T
   8    -11.1608312 -0.162255E-06  0.207E-03    2.21      21.6  T
   9    -11.1608312 -0.793189E-08  0.793E-04    2.21      56.4  T
  10    -11.1608312 -0.103562E-08  0.117E-04    2.21     381.4  T
     SCC iter.                  ...        0 min,  0.001 sec
     gradient                   ...        0 min,  0.002 sec
 * total energy  :   -10.9978731 Eh     change       -0.1374412E-02 Eh
   gradient norm :     0.0295225 Eh/α   predicted    -0.1156305E-02 ( -15.87%)
   displ. norm   :     0.1278449 α      lambda       -0.2628724E-02
   maximum displ.:     0.0612598 α      in ANC's #9, #1, #3, ...

........................................................................
.............................. CYCLE   11 ..............................
........................................................................
   1    -11.1756631 -0.111757E+02  0.517E-01    2.14       0.0  T
   2    -11.1756343  0.288200E-04  0.335E-01    2.14       1.0  T
   3    -11.1751026  0.531656E-03  0.308E-01    2.14       1.0  T
   4    -11.1731688  0.193386E-02  0.464E-01    2.13       1.0  T
   5    -11.1757492 -0.258048E-02  0.781E-02    2.14       1.0  T
   6    -11.1757927 -0.434877E-04  0.260E-02    2.14       1.7  T
   7    -11.1757934 -0.633599E-06  0.150E-02    2.14       3.0  T
   8    -11.1757949 -0.156943E-05  0.208E-03    2.14      21.5  T
   9    -11.1757949 -0.804558E-08  0.865E-04    2.14      51.7  T
  10    -11.1757949 -0.121245E-08  0.138E-04    2.14     325.2  T
     SCC iter.                  ...        0 min,  0.001 sec
     gradient                   ...        0 min,  0.001 sec
 * total energy  :   -10.9989656 Eh     change       -0.1092537E-02 Eh
   gradient norm :     0.0286425 Eh/α   predicted    -0.1335845E-02 (  22.27%)
   displ. norm   :     0.0650163 α      lambda       -0.1345493E-02
   maximum displ.:     0.0349993 α      in ANC's #3, #2, #6, ...

........................................................................
.............................. CYCLE   12 ..............................
........................................................................
   1    -11.1725903 -0.111726E+02  0.276E-01    2.08       0.0  T
   2    -11.1723513  0.239019E-03  0.228E-01    2.09       1.0  T
   3    -11.1707209  0.163036E-02  0.415E-01    2.09       1.0  T
   4    -11.1724096 -0.168867E-02  0.174E-01    2.08       1.0  T
   5    -11.1726494 -0.239808E-03  0.302E-02    2.09       1.5  T
   6    -11.1726539 -0.455805E-05  0.167E-02    2.09       2.7  T
   7    -11.1726551 -0.118972E-05  0.854E-03    2.09       5.2  T
   8    -11.1726554 -0.285785E-06  0.158E-03    2.09      28.2  T
   9    -11.1726554 -0.211698E-08  0.758E-04    2.09      59.0  T
  10    -11.1726554 -0.280320E-08  0.776E-05    2.09     576.0  T
     SCC iter.                  ...        0 min,  0.001 sec
     gradient                   ...        0 min,  0.001 sec
 * total energy  :   -11.0001061 Eh     change       -0.1140501E-02 Eh
   gradient norm :     0.0222635 Eh/α   predicted    -0.6755896E-03 ( -40.76%)
   displ. norm   :     0.2202608 α      lambda       -0.3088787E-02
   maximum displ.:     0.0952356 α      in ANC's #6, #2, #7, ...

........................................................................
.............................. CYCLE   13 ..............................
........................................................................
   1    -11.1661408 -0.111661E+02  0.901E-01    1.94       0.0  T
   2    -11.1658941  0.246659E-03  0.579E-01    1.95       1.0  T
   3    -11.1587862  0.710787E-02  0.866E-01    1.92       1.0  T
   4    -11.1567482  0.203801E-02  0.902E-01    1.94       1.0  T
   5    -11.1664726 -0.972440E-02  0.613E-02    1.94       1.0  T
   6    -11.1664836 -0.109572E-04  0.354E-02    1.94       1.3  T
   7    -11.1664818  0.178678E-05  0.286E-02    1.94       1.6  T
   8    -11.1664878 -0.597985E-05  0.670E-03    1.94       6.7  T
   9    -11.1664880 -0.219162E-06  0.267E-03    1.94      16.7  T
  10    -11.1664880 -0.158018E-07  0.277E-04    1.94     161.5  T
  11    -11.1664880  0.179696E-10  0.744E-05    1.94     600.8  T
     SCC iter.                  ...        0 min,  0.001 sec
     gradient                   ...        0 min,  0.001 sec
 * total energy  :   -11.0018073 Eh     change       -0.1701213E-02 Eh
   gradient norm :     0.0197965 Eh/α   predicted    -0.1619320E-02 (  -4.81%)
   displ. norm   :     0.0402776 α      lambda       -0.3969688E-03
   maximum displ.:     0.0229603 α      in ANC's #6, #7, #5, ...

........................................................................
.............................. CYCLE   14 ..............................
........................................................................
   1    -11.1714508 -0.111715E+02  0.202E-01    1.93       0.0  T
   2    -11.1708540  0.596715E-03  0.253E-01    1.92       1.0  T
   3    -11.1709124 -0.583588E-04  0.235E-01    1.93       1.0  T
   4    -11.1714481 -0.535731E-03  0.762E-02    1.93       1.0  T
   5    -11.1714831 -0.349297E-04  0.218E-02    1.92       2.1  T
   6    -11.1714870 -0.395880E-05  0.746E-03    1.92       6.0  T
   7    -11.1714872 -0.142243E-06  0.375E-03    1.92      11.9  T
   8    -11.1714872 -0.759962E-07  0.793E-04    1.92      56.4  T
   9    -11.1714872  0.545629E-09  0.606E-04    1.92      73.8  T
     SCC iter.                  ...        0 min,  0.001 sec
     gradient                   ...        0 min,  0.001 sec
 * total energy  :   -11.0020460 Eh     change       -0.2386933E-03 Eh
   gradient norm :     0.0097630 Eh/α   predicted    -0.1988055E-03 ( -16.71%)
   displ. norm   :     0.0661750 α      lambda       -0.2539382E-03
   maximum displ.:     0.0359138 α      in ANC's #2, #7, #6, ...

........................................................................
.............................. CYCLE   15 ..............................
........................................................................
   1    -11.1722982 -0.111723E+02  0.231E-01    1.93       0.0  T
   2    -11.1721386  0.159613E-03  0.182E-01    1.94       1.0  T
   3    -11.1699007  0.223786E-02  0.443E-01    1.92       1.0  T
   4    -11.1723086 -0.240788E-02  0.272E-02    1.93       1.6  T
   5    -11.1723122 -0.355091E-05  0.110E-02    1.93       4.1  T
   6    -11.1723125 -0.279093E-06  0.635E-03    1.94       7.0  T
   7    -11.1723125 -0.634010E-07  0.328E-03    1.94      13.6  T
   8    -11.1723126 -0.742784E-07  0.809E-04    1.94      55.3  T
   9    -11.1723126 -0.479378E-08  0.229E-04    1.94     195.3  T
     SCC iter.                  ...        0 min,  0.001 sec
     gradient                   ...        0 min,  0.001 sec
 * total energy  :   -11.0022062 Eh     change       -0.1601748E-03 Eh
   gradient norm :     0.0082766 Eh/α   predicted    -0.1275256E-03 ( -20.38%)
   displ. norm   :     0.0299739 α      lambda       -0.1148108E-03
   maximum displ.:     0.0148540 α      in ANC's #9, #2, #6, ...

........................................................................
.............................. CYCLE   16 ..............................
........................................................................
   1    -11.1737302 -0.111737E+02  0.115E-01    1.95       0.0  T
   2    -11.1737055  0.246989E-04  0.937E-02    1.95       1.0  T
   3    -11.1735651  0.140376E-03  0.128E-01    1.96       1.0  T
   4    -11.1735813 -0.162059E-04  0.118E-01    1.95       1.0  T
   5    -11.1737379 -0.156555E-03  0.168E-02    1.95       2.7  T
   6    -11.1737397 -0.181039E-05  0.435E-03    1.95      10.3  T
   7    -11.1737397  0.258309E-07  0.229E-03    1.95      19.5  T
   8    -11.1737397 -0.469370E-07  0.391E-04    1.95     114.5  T
   9    -11.1737397 -0.133415E-09  0.197E-04    1.95     227.4  T
     SCC iter.                  ...        0 min,  0.001 sec
     gradient                   ...        0 min,  0.001 sec
 * total energy  :   -11.0022889 Eh     change       -0.8266759E-04 Eh
   gradient norm :     0.0057653 Eh/α   predicted    -0.5745711E-04 ( -30.50%)
   displ. norm   :     0.0269990 α      lambda       -0.8703620E-04
   maximum displ.:     0.0122806 α      in ANC's #1, #2, #9, ...

........................................................................
.............................. CYCLE   17 ..............................
........................................................................
   1    -11.1737687 -0.111738E+02  0.128E-01    1.96       0.0  T
   2    -11.1737427  0.260399E-04  0.104E-01    1.95       1.0  T
   3    -11.1736177  0.125034E-03  0.125E-01    1.95       1.0  T
   4    -11.1735446  0.730823E-04  0.143E-01    1.96       1.0  T
   5    -11.1737794 -0.234865E-03  0.214E-02    1.96       2.1  T
   6    -11.1737823 -0.285030E-05  0.631E-03    1.95       7.1  T
   7    -11.1737822  0.701546E-07  0.424E-03    1.95      10.6  T
   8    -11.1737824 -0.150262E-06  0.453E-04    1.96      98.7  T
   9    -11.1737824 -0.211761E-09  0.198E-04    1.96     225.5  T
     SCC iter.                  ...        0 min,  0.001 sec
     gradient                   ...        0 min,  0.001 sec
 * total energy  :   -11.0023470 Eh     change       -0.5814112E-04 Eh
   gradient norm :     0.0037436 Eh/α   predicted    -0.4354911E-04 ( -25.10%)
   displ. norm   :     0.0150347 α      lambda       -0.3593127E-04
   maximum displ.:     0.0095960 α      in ANC's #8, #1, #5, ...

........................................................................
.............................. CYCLE   18 ..............................
........................................................................
   1    -11.1731782 -0.111732E+02  0.931E-02    1.94       0.0  T
   2    -11.1731306  0.475902E-04  0.932E-02    1.94       1.0  T
   3    -11.1730502  0.804836E-04  0.112E-01    1.94       1.0  T
   4    -11.1731286 -0.784152E-04  0.755E-02    1.94       1.0  T
   5    -11.1731857 -0.571518E-04  0.151E-02    1.94       3.0  T
   6    -11.1731871 -0.138782E-05  0.528E-03    1.94       8.5  T
   7    -11.1731871  0.140739E-07  0.328E-03    1.94      13.6  T
   8    -11.1731872 -0.799816E-07  0.458E-04    1.94      97.6  T
   9    -11.1731872 -0.489493E-10  0.162E-04    1.94     276.3  T
     SCC iter.                  ...        0 min,  0.001 sec
     gradient                   ...        0 min,  0.001 sec
 * total energy  :   -11.0023705 Eh     change       -0.2350371E-04 Eh
   gradient norm :     0.0024276 Eh/α   predicted    -0.1796912E-04 ( -23.55%)
   displ. norm   :     0.0095977 α      lambda       -0.1336178E-04
   maximum displ.:     0.0067145 α      in ANC's #7, #8, #3, ...

........................................................................
.............................. CYCLE   19 ..............................
........................................................................
   1    -11.1724485 -0.111724E+02  0.574E-02    1.93       0.0  T
   2    -11.1724297  0.188106E-04  0.529E-02    1.93       1.0  T
   3    -11.1723598  0.699388E-04  0.888E-02    1.93       1.0  T
   4    -11.1724451 -0.853371E-04  0.251E-02    1.93       1.8  T
   5    -11.1724501 -0.498685E-05  0.707E-03    1.93       6.3  T
   6    -11.1724504 -0.268556E-06  0.315E-03    1.93      14.2  T
   7    -11.1724504 -0.253959E-08  0.191E-03    1.93      23.4  T
   8    -11.1724504 -0.285525E-07  0.326E-04    1.93     137.1  T
   9    -11.1724504 -0.118254E-09  0.837E-05    1.93     534.5  T
     SCC iter.                  ...        0 min,  0.001 sec
     gradient                   ...        0 min,  0.001 sec
 * total energy  :   -11.0023795 Eh     change       -0.9029298E-05 Eh
   gradient norm :     0.0015653 Eh/α   predicted    -0.6681893E-05 ( -26.00%)
   displ. norm   :     0.0110518 α      lambda       -0.6900082E-05
   maximum displ.:     0.0079398 α      in ANC's #7, #2, #4, ...

........................................................................
.............................. CYCLE   20 ..............................
........................................................................
   1    -11.1719045 -0.111719E+02  0.511E-02    1.92       0.0  T
   2    -11.1718998  0.468773E-05  0.361E-02    1.92       1.2  T
   3    -11.1718061  0.936973E-04  0.914E-02    1.92       1.0  T
   4    -11.1719022 -0.960793E-04  0.183E-02    1.92       2.5  T
   5    -11.1719051 -0.295538E-05  0.541E-03    1.92       8.3  T
   6    -11.1719052 -0.123814E-06  0.264E-03    1.92      16.9  T
   7    -11.1719052 -0.409339E-08  0.172E-03    1.92      26.0  T
   8    -11.1719053 -0.225461E-07  0.298E-04    1.92     149.8  T
   9    -11.1719053 -0.194676E-09  0.688E-05    1.92     649.7  T
     SCC iter.                  ...        0 min,  0.001 sec
     gradient                   ...        0 min,  0.001 sec
 * total energy  :   -11.0023855 Eh     change       -0.6000916E-05 Eh
   gradient norm :     0.0014246 Eh/α   predicted    -0.3449391E-05 ( -42.52%)
   displ. norm   :     0.0071400 α      lambda       -0.3943254E-05
   maximum displ.:     0.0041009 α      in ANC's #6, #1, #4, ...
 * RMSD in coord.:     1.0888592 α      energy gain  -0.1120400E+00 Eh

generating ANC from model Hessian ...
Using Lindh-Hessian (1995)
 Shifting diagonal of input Hessian by    0.0000000000000000     
 Lowest  eigenvalues of input Hessian
   -0.000000   -0.000000   -0.000000   -0.000000    0.000000    0.000000
    0.047207    0.075993    0.240260    0.365639    0.835020    1.090541
    1.333110    1.653790    2.149716
 Highest eigenvalues
    0.365639    0.835020    1.090541    1.333110    1.653790    2.149716


........................................................................
.............................. CYCLE   21 ..............................
........................................................................
   1    -11.1719840 -0.111720E+02  0.306E-02    1.92       0.0  T
   2    -11.1719815  0.248195E-05  0.240E-02    1.92       1.9  T
   3    -11.1719612  0.203345E-04  0.449E-02    1.92       1.0  T
   4    -11.1719793 -0.181167E-04  0.228E-02    1.92       2.0  T
   5    -11.1719844 -0.513310E-05  0.334E-03    1.92      13.4  T
   6    -11.1719845 -0.578726E-07  0.122E-03    1.92      36.5  T
   7    -11.1719845  0.480187E-09  0.739E-04    1.92      60.5  T
   8    -11.1719845 -0.378529E-08  0.108E-04    1.92     415.4  T
     SCC iter.                  ...        0 min,  0.001 sec
     gradient                   ...        0 min,  0.001 sec
 * total energy  :   -11.0023899 Eh     change       -0.4372518E-05 Eh
   gradient norm :     0.0009654 Eh/α   predicted     0.0000000E+00 (-100.00%)
   displ. norm   :     0.0063804 α      lambda       -0.1875410E-05
   maximum displ.:     0.0058605 α      in ANC's #1, #3, #2, ...

   *** GEOMETRY OPTIMIZATION CONVERGED AFTER 21 ITERATIONS ***

------------------------------------------------------------------------
 total energy gain   :        -0.1120444 Eh      -70.3089 kcal/mol
 total RMSD          :         1.0888592 a0        0.5762 Å
 total power (kW/mol):       -14.0082165 (step)-3570.7025 (real)
------------------------------------------------------------------------

 ANCopt (total)                0 d,  0 h,  0 min,  0.082 sec
 optimizer setup                ...        0 min,  0.000 sec (  0.157%)
 model hessian                  ...        0 min,  0.000 sec (  0.209%)
 ANC generation                 ...        0 min,  0.000 sec (  0.095%)
 coordinate transformation      ...        0 min,  0.000 sec (  0.049%)
 single point calculation       ...        0 min,  0.080 sec ( 97.458%)
 optimization log               ...        0 min,  0.001 sec (  0.649%)
 hessian update                 ...        0 min,  0.000 sec (  0.046%)
 rational function              ...        0 min,  0.000 sec (  0.539%)

================
 final structure:
================
5
 xtb: 6.2.2 (9d81278992624c895f80dd42a50cac0aa55982e2)
C         1.89401965842476   -0.17180102330602   -0.06193259125133
C         0.62666801240158   -0.10544302791024   -0.02439703670929
C        -1.48548926164293    0.21574010020492    0.05445574375674
N        -0.40738842250168    0.94036372360331    0.04350553092882
C        -0.62780998668172   -0.87885977259197   -0.01163164672493

 Bond Distances (Angstroems)
 ---------------------------
C1-C2=1.2696         C2-C1=1.2696         C2-N4=1.4723         C2-C5=1.4738         C3-N4=1.2990         C3-C5=1.3922         
N4-C2=1.4723         N4-C3=1.2990         N4-C5=1.8334         C5-C2=1.4738         C5-C3=1.3922         C5-N4=1.8334         
 C  C  Rav=1.3785 sigma=0.0839  Rmin=1.2696  Rmax=1.4738     3
 N  C  Rav=1.5349 sigma=0.2226  Rmin=1.2990  Rmax=1.8334     3

 selected bond angles (degree)
 --------------------
N4-C2-C1=137.70                C5-C2-C1=145.33                C5-C2-N4= 76.97                C5-C3-N4= 85.81                
C3-N4-C2=100.78                C5-N4-C2= 51.55                C5-N4-C3= 49.23                C3-C5-C2= 96.44                
N4-C5-C2= 51.48                N4-C5-C3= 44.96                

 selected dihedral angles (degree)
 ---------------------------------
C3-N4-C2-C1=180.38            C3-N4-C2-C5=  0.09            C5-N4-C2-C1=180.29            C2-N4-C3-C5=359.91            
C3-C5-C2-C1=179.58            C3-C5-C2-N4=359.92            N4-C5-C2-C1=179.66            C2-C5-C3-N4=  0.09            
           -------------------------------------------------
          |                Final Singlepoint                |
           -------------------------------------------------

          ...................................................
          :                      SETUP                      :
          :.................................................:
          :  # basis functions                  20          :
          :  # atomic orbitals                  20          :
          :  # shells                           10          :
          :  # electrons                        21          :
          :  max. iterations                   250          :
          :  Hamiltonian                  GFN2-xTB          :
          :  restarted?                      false          :
          :  GBSA solvation                  false          :
          :  PC potential                    false          :
          :  electronic temp.          300.0000000     K    :
          :  accuracy                    1.0000000          :
          :  -> integral cutoff          0.2500000E+02      :
          :  -> integral neglect         0.1000000E-07      :
          :  -> SCF convergence          0.1000000E-05 Eh   :
          :  -> wf. convergence          0.1000000E-03 e    :
          :  Broyden damping             0.4000000          :
          ...................................................

 iter      E             dE          RMSdq      gap      omega  full diag
   1    -11.1719845 -0.111720E+02  0.272E-05    1.92       0.0  T
   2    -11.1719845  0.607123E-10  0.799E-05    1.92     559.7  T
   3    -11.1719845 -0.541576E-10  0.375E-05    1.92    1193.1  T

   *** convergence criteria satisfied after 3 iterations ***

         #    Occupation            Energy/Eh            Energy/eV
      -------------------------------------------------------------
         1        2.0000           -0.7522040             -20.4685
       ...           ...                  ...                  ...
         6        2.0000           -0.5712756             -15.5452
         7        2.0000           -0.5099136             -13.8755
         8        2.0000           -0.4704269             -12.8010
         9        2.0000           -0.4663245             -12.6893
        10        1.0000           -0.4237773             -11.5316
        11        1.0000           -0.4124453             -11.2232
        12        1.0000           -0.4099327             -11.1548 (HOMO)
        13                         -0.3394139              -9.2359 (LUMO)
        14                         -0.3039286              -8.2703
        15                         -0.1803257              -4.9069
        16                         -0.0107482              -0.2925
        17                          0.1081608               2.9432
       ...                                ...                  ...
        20                          0.8313978              22.6235
      -------------------------------------------------------------
                  HL-Gap            0.0705188 Eh            1.9189 eV
             Fermi-level           -0.4098590 Eh          -11.1528 eV

 SCC (total)                   0 d,  0 h,  0 min,  0.003 sec
 SCC setup                      ...        0 min,  0.000 sec (  2.558%)
 Dispersion                     ...        0 min,  0.000 sec (  0.276%)
 integral evaluation            ...        0 min,  0.001 sec ( 38.514%)
 zeroth order Hamiltonian       ...        0 min,  0.000 sec (  0.471%)
 iterations                     ...        0 min,  0.000 sec ( 12.091%)
 molecular gradient             ...        0 min,  0.001 sec ( 43.906%)
 printout                       ...        0 min,  0.000 sec (  1.981%)

         :::::::::::::::::::::::::::::::::::::::::::::::::::::
         ::                     SUMMARY                     ::
         :::::::::::::::::::::::::::::::::::::::::::::::::::::
         :: total energy             -11.002389898767 Eh    ::
         :: gradient norm              0.000964922059 Eh/a0 ::
         :: HOMO-LUMO gap              1.918913056698 eV    ::
         ::.................................................::
         :: SCC energy               -11.171984503468 Eh    ::
         :: -> isotropic ES           -0.006993972746 Eh    ::
         :: -> anisotropic ES          0.001877556538 Eh    ::
         :: -> anisotropic XC          0.008061827611 Eh    ::
         :: -> dispersion             -0.002903372960 Eh    ::
         :: repulsion energy           0.169594592829 Eh    ::
         :: add. restraining           0.000000000000 Eh    ::
         :::::::::::::::::::::::::::::::::::::::::::::::::::::

           ------------------------------------------------- 
          |                Numerical Hessian                |
           ------------------------------------------------- 
step length          :   0.00500
SCC accuracy         :   0.30000
Hessian scale factor :   1.00000
frozen atoms in %    :   0.00000    0
RMS gradient         :   0.00096
estimated CPU  time      0.00 min
estimated wall time      0.00 min

writing file <hessian>.

 projected vibrational frequencies (cm-1)
eigval :       -0.00    -0.00     0.00     0.00     0.00     0.00
eigval :      261.12   347.74   428.42   434.78   512.15   904.85
eigval :     1076.55  1481.08  1761.66
           -------------------------------------------------
          |                Property Printout                |
           -------------------------------------------------

    * Orbital Energies and Occupations

         #    Occupation            Energy/Eh            Energy/eV
      -------------------------------------------------------------
         1        2.0000           -0.7522041             -20.4685
         2        2.0000           -0.6852612             -18.6469
         3        2.0000           -0.6414901             -17.4558
         4        2.0000           -0.6268493             -17.0574
         5        2.0000           -0.5783147             -15.7367
         6        2.0000           -0.5712757             -15.5452
         7        2.0000           -0.5099136             -13.8755
         8        2.0000           -0.4704269             -12.8010
         9        2.0000           -0.4663245             -12.6893
        10        1.0000           -0.4237774             -11.5316
        11        1.0000           -0.4124453             -11.2232
        12        1.0000           -0.4099326             -11.1548 (HOMO)
        13                         -0.3394139              -9.2359 (LUMO)
        14                         -0.3039286              -8.2703
        15                         -0.1803257              -4.9069
        16                         -0.0107482              -0.2925
        17                          0.1081608               2.9432
        18                          0.1900415               5.1713
        19                          0.4217969              11.4777
        20                          0.8313979              22.6235
      -------------------------------------------------------------
                  HL-Gap            0.0705187 Eh            1.9189 eV
             Fermi-level           -0.4098589 Eh          -11.1528 eV

     #   Z        covCN         q      C6AA      α(0)
     1   6 C      0.982    -0.101    39.137    10.508
     2   6 C      3.093     0.132    25.015     8.198
     3   6 C      2.118     0.042    29.760     8.816
     4   7 N      2.483    -0.068    22.619     7.063
     5   6 C      2.625    -0.005    28.132     8.675

 Mol. C6AA /au·bohr⁶  :        715.485341
 Mol. C8AA /au·bohr⁸  :      19775.215671
 Mol. α(0) /au        :         43.259641


Wiberg/Mayer (AO) data.
largest (>0.10) Wiberg bond orders for each atom
          total WBO             WBO to atom ...
     1  C   2.446        C    2 2.031    C    3 0.263
     2  C   3.769        C    1 2.031    C    5 0.893    N    4 0.808
     3  C   2.956        N    4 1.462    C    5 1.193    C    1 0.263
     4  N   2.744        C    3 1.462    C    2 0.808    C    5 0.399
     5  C   2.561        C    3 1.193    C    2 0.893    N    4 0.399

MOs/occ written to file <molden.input>


molecular dipole:
                 x           y           z       tot (Debye)
 q only:       -0.266      -0.089       0.005
   full:       -0.430      -0.031       0.011       1.095
molecular quadrupole (traceless):
                xx          xy          yy          xz          yz          zz
 q only:       -0.712       0.183       0.187       0.041      -0.016       0.525
  q+dip:       -1.585       0.190      -0.007       0.104      -0.059       1.593
   full:       -3.728       0.258       0.684       0.215      -0.087       3.044

           -------------------------------------------------
          |                Geometry Summary                 |
           -------------------------------------------------

      molecular mass/u    :       62.0496468
   center of mass at/Å    :       -0.0131044       0.0302490       0.0013994
  moments of inertia/u·Å² :        0.2178725E+02   0.8233774E+02   0.1041247E+03
rotational constants/cm⁻¹ :        0.7737385E+00   0.2047376E+00   0.1618985E+00

 * 2 selected distances

     #   Z        #   Z                                     value/Å
     1   6 C      2   6 C                                 1.2696427 (min)
     3   6 C      4   7 N                                 1.2990384 (max)

 * 2 distinct bonds (by element types)

   Z      Z             #   av. dist./Å        max./Å        min./Å
   6 C    6 C           1     1.2696427     1.2696427     1.2696427
   6 C    7 N           1     1.2990384     1.2990384     1.2990384

           -------------------------------------------------
          |               Frequency Printout                |
           -------------------------------------------------
 projected vibrational frequencies (cm-1)
eigval :       -0.00    -0.00     0.00     0.00     0.00     0.00
eigval :      261.12   347.74   428.42   434.78   512.15   904.85
eigval :     1076.55  1481.08  1761.66
 reduced masses (amu)
   1: 12.71   2: 12.59   3: 12.21   4: 12.40   5: 12.63   6: 12.18   7: 12.22   8: 12.27
   9: 12.37  10: 12.32  11: 12.87  12: 12.37  13: 12.43  14: 12.55  15: 12.04
 IR intensities (amu)
   1:  0.04   2:  0.07   3:  0.07   4:  0.07   5:  0.03   6:  0.04   7:  0.16   8:  0.20
   9:  0.47  10:  0.14  11:  0.50  12:  0.58  13:  1.13  14:  0.78  15:  1.20
 Raman intensities (amu)
   1:  0.00   2:  0.00   3:  0.00   4:  0.00   5:  0.00   6:  0.00   7:  0.00   8:  0.00
Molecule has the following symmetry elements: (sigma) 
It seems to be the Cs point group
   9:  0.00  10:  0.00  11:  0.00  12:  0.00  13:  0.00  14:  0.00  15:  0.00
 output can be read by thermo (or use thermo option).
 writing <g98.out> molden fake output.
 recommended (thermochemical) frequency scaling factor: 1.0
           -------------------------------------------------
          |             Thermodynamic Functions             |
           -------------------------------------------------

cs  symmetry found (for desy threshold:  0.10E+00) used in thermo

          ...................................................
          :                      SETUP                      :
          :.................................................:
          :  # frequencies                           9      :
          :  # imaginary freq.                       0      :
          :  linear?                             false      :
          :  only rotor calc.                    false      :
          :  symmetry                               cs      :
          :  rotational number                       1      :
          :  scaling factor                  1.0000000      :
          :  rotor cutoff                   50.0000000 cm⁻¹ :
          :  imag. cutoff                  -20.0000000 cm⁻¹ :
          :.................................................:

    mode    ω/cm⁻¹     T·S(HO)/kcal·mol⁻¹    T·S(FR)/kcal·mol⁻¹   T·S(vib)
   ------------------------------------------------------------------------
       1    261.12    -0.00000 ( 99.87%)     0.01473 (  0.13%)     0.00002
   ------------------------------------------------------------------------

   temp. (K)  partition function   enthalpy   heat capacity  entropy
                                   cal/mol     cal/K/mol   cal/K/mol   J/K/mol
 298.15  VIB   2.49                 1065.032      8.253      5.389
         ROT  0.330E+05              888.752      2.981     23.658
         INT  0.823E+05             1953.784     11.234     29.047
         TR   0.473E+27             1481.254      4.968     38.278
         TOT                        3435.0382    16.2022    67.3251   281.6883

   temp. (K)  partition function   enthalpy   heat capacity  entropy
                                   cal/mol     cal/K/mol   cal/K/mol   J/K/mol
 120.00  VIB   1.08                   66.987      2.258      0.706
         ROT  0.843E+04              357.707      2.981     20.945
         INT  0.908E+04              424.694      5.239     21.651
         TR   0.121E+27              596.178      4.968     33.759
         TOT                        1020.8721    10.2071    55.4097   231.8344

   temp. (K)  partition function   enthalpy   heat capacity  entropy
                                   cal/mol     cal/K/mol   cal/K/mol   J/K/mol
 100.00  VIB   1.04                   30.482      1.404      0.376
         ROT  0.641E+04              298.089      2.981     20.401
         INT  0.664E+04              328.571      4.385     20.777
         TR   0.919E+26              496.815      4.968     32.853
         TOT                         825.3856     9.3529    53.6303   224.3893

   temp. (K)  partition function   enthalpy   heat capacity  entropy
                                   cal/mol     cal/K/mol   cal/K/mol   J/K/mol
  80.00  VIB   1.01                    9.994      0.677      0.150
         ROT  0.459E+04              238.471      2.981     19.736
         INT  0.464E+04              248.465      3.657     19.886
         TR   0.657E+26              397.452      4.968     31.745
         TOT                         645.9167     8.6256    51.6312   216.0250

   temp. (K)  partition function   enthalpy   heat capacity  entropy
                                   cal/mol     cal/K/mol   cal/K/mol   J/K/mol
  60.00  VIB   1.00                    1.751      0.197      0.034
         ROT  0.298E+04              178.853      2.981     18.879
         INT  0.299E+04              180.605      3.178     18.913
         TR   0.427E+26              298.089      4.968     30.317
         TOT                         478.6936     8.1464    49.2293   205.9755

   temp. (K)  partition function   enthalpy   heat capacity  entropy
                                   cal/mol     cal/K/mol   cal/K/mol   J/K/mol
  40.00  VIB   1.00                    0.066      0.016      0.001
         ROT  0.162E+04              119.236      2.981     17.670
         INT  0.162E+04              119.302      2.997     17.671
         TR   0.232E+26              198.726      4.968     28.303
         TOT                         318.0280     7.9650    45.9746   192.3579

   temp. (K)  partition function   enthalpy   heat capacity  entropy
                                   cal/mol     cal/K/mol   cal/K/mol   J/K/mol
  20.00  VIB   1.00                    0.000      0.000     -0.002
         ROT   574.                   59.618      2.981     15.604
         INT   574.                   59.618      2.981     15.602
         TR   0.822E+25               99.363      4.968     24.861
         TOT                         158.9808     7.9490    40.4631   169.2976

   temp. (K)  partition function   enthalpy   heat capacity  entropy
                                   cal/mol     cal/K/mol   cal/K/mol   J/K/mol
  10.00  VIB   1.00                    0.000      0.000     -0.004
         ROT   203.                   29.809      2.981     13.538
         INT   203.                   29.809      2.981     13.534
         TR   0.290E+25               49.681      4.968     21.419
         TOT                          79.4904     7.9490    34.9534   146.2449

       T/K    H(0)-H(T)+PV         H(T)/Eh          T*S/Eh         G(T)/Eh
   ------------------------------------------------------------------------
    298.15    0.547408E-02    0.218959E-01    0.319883E-01   -0.100925E-01
    120.00    0.162686E-02    0.180487E-01    0.105961E-01    0.745254E-02
    100.00    0.131534E-02    0.177371E-01    0.854654E-02    0.919060E-02
     80.00    0.102933E-02    0.174511E-01    0.658237E-02    0.108688E-01
     60.00    0.762847E-03    0.171847E-01    0.470712E-02    0.124775E-01
     40.00    0.506810E-03    0.169286E-01    0.293061E-02    0.139980E-01
     20.00    0.253352E-03    0.166752E-01    0.128964E-02    0.153855E-01
     10.00    0.126676E-03    0.165485E-01    0.557017E-03    0.159915E-01 (used)
   ------------------------------------------------------------------------

         :::::::::::::::::::::::::::::::::::::::::::::::::::::
         ::                  THERMODYNAMIC                  ::
         :::::::::::::::::::::::::::::::::::::::::::::::::::::
         :: total free energy         -10.986398435585 Eh   ::
         ::.................................................::
         :: total energy              -11.002389899129 Eh   ::
         :: zero point energy           0.016421805010 Eh   ::
         :: G(RRHO) w/o ZPVE           -0.000430341466 Eh   ::
         :: G(RRHO) contrib.            0.015991463544 Eh   ::
         :::::::::::::::::::::::::::::::::::::::::::::::::::::

optimized geometry written to: xtbopt.xyz


           -------------------------------------------------
          | TOTAL ENERGY              -11.002389899129 Eh   |
          | TOTAL ENTHALPY            -10.985841418103 Eh   |
          | TOTAL FREE ENERGY         -10.986398435585 Eh   |
          | GRADIENT NORM               0.000964662317 Eh/α |
          | HOMO-LUMO GAP               1.918912098249 eV   |
           -------------------------------------------------

------------------------------------------------------------------------
 * finished run on 2020/05/12 at 11:44:09.857     
------------------------------------------------------------------------
 total:
 * wall-time:     0 d,  0 h,  0 min,  0.208 sec
 *  cpu-time:     0 d,  0 h,  0 min,  0.207 sec
 * ratio c/w:     0.999 speedup
 SCF:
 * wall-time:     0 d,  0 h,  0 min,  0.005 sec
 *  cpu-time:     0 d,  0 h,  0 min,  0.005 sec
 * ratio c/w:     0.998 speedup
 ANC optimizer:
 * wall-time:     0 d,  0 h,  0 min,  0.086 sec
 *  cpu-time:     0 d,  0 h,  0 min,  0.086 sec
 * ratio c/w:     0.998 speedup
 numerical hessian:
 * wall-time:     0 d,  0 h,  0 min,  0.101 sec
 *  cpu-time:     0 d,  0 h,  0 min,  0.101 sec
 * ratio c/w:     0.999 speedup

