      -----------------------------------------------------------      
     |                   =====================                   |     
     |                           x T B                           |     
     |                   =====================                   |     
     |                         S. Grimme                         |     
     |          Mulliken Center for Theoretical Chemistry        |     
     |                    University of Bonn                     |     
      -----------------------------------------------------------      

   * xtb version 6.2.2 (9d81278992624c895f80dd42a50cac0aa55982e2) compiled by '@Darwin' on 04/03/2020

   xtb is free software: you can redistribute it and/or modify it under
   the terms of the GNU Lesser General Public License as published by
   the Free Software Foundation, either version 3 of the License, or
   (at your option) any later version.
   
   xtb is distributed in the hope that it will be useful,
   but WITHOUT ANY WARRANTY; without even the implied warranty of
   MERCHANTABILITY or FITNESS FOR A PARTICULAR PURPOSE.  See the
   GNU Lesser General Public License for more details.
   
   Cite this work as:
   * S. Grimme, C. Bannwarth, P. Shushkov, J. Chem. Theory Comput., 2017,
     13, 1989-2009. DOI: 10.1021/acs.jctc.7b00118
   * C. Bannwarth, S. Ehlert and S. Grimme., J. Chem. Theory Comput., 2019,
     15, 1652-1671. DOI: 10.1021/acs.jctc.8b01176
   * P. Pracht, E. Caldeweyher, S. Ehlert, S. Grimme, ChemRxiv, 2019, preprint.
     DOI: 10.26434/chemrxiv.8326202.v1
   
   for DFT-D4:
   * E. Caldeweyher, C. Bannwarth and S. Grimme, J. Chem. Phys., 2017,
     147, 034112. DOI: 10.1063/1.4993215
   * E. Caldeweyher, S. Ehlert, A. Hansen, H. Neugebauer, S. Spicher,
     C. Bannwarth and S. Grimme, J. Chem. Phys., 2019, 150, 154122.
     DOI: 10.1063/1.5090222
   
   for sTDA-xTB:
   * S. Grimme and C. Bannwarth, J. Chem. Phys., 2016, 145, 054103.
     DOI: 10.1063/1.4959605
   
   in the mass-spec context:
   * V. Asgeirsson, C. Bauer and S. Grimme, Chem. Sci., 2017, 8, 4879.
     DOI: 10.1039/c7sc00601b
   
   for metadynamics refer to:
   * S. Grimme, J. Chem. Theory Comput., 2019, 155, 2847-2862
     DOI: 10.1021/acs.jctc.9b00143
   
   with help from (in alphabetical order)
   C. Bannwarth, F. Bohle, G. Brandenburg, E. Caldeweyher, M. Checinski,
   S. Dohm, S. Ehlert, S. Ehrlich, F. März, H. Neugebauer, J. Pisarek,
   P. Pracht, P. Shushkov, and S. Spicher.
   
 * started run on 2020/05/12 at 11:44:28.370     

           -------------------------------------------------
          |                Calculation Setup                |
           -------------------------------------------------

          program call               : xtb --input H3C1N1_2_S_0.input H3C1N1_2_S_0.xyz --ohess --molden --namespace H3C1N1_2_S_0 output.out
          calculation namespace      : H3C1N1_2_S_0
          coordinate file            : H3C1N1_2_S_0.xyz
          number of atoms            :                     5
          number of electrons        :                    12
          charge                     :                     0
          spin                       :                   0.0
          first test random number   :      0.42753050622914

   ID    Z sym.   atoms
    1    6 C      1
    2    7 N      2
    3    1 H      3-5

           -------------------------------------------------
          |                 G F N 2 - x T B                 |
           -------------------------------------------------

        Reference                      10.1021/acs.jctc.8b01176
      * Hamiltonian:
        H0-scaling (s, p, d)           1.850000    2.230000    2.230000
        zeta-weighting                 0.500000
      * Dispersion:
        s8                             2.700000
        a1                             0.520000
        a2                             5.000000
        s9                             5.000000
      * Repulsion:
        kExp                           1.500000    1.000000
        rExp                           1.000000
      * Coulomb:
        alpha                          2.000000
        third order                    shell-resolved
        anisotropic                    true
        a3                             3.000000
        a5                             4.000000
        cn-shift                       1.200000
        cn-exp                         4.000000
        max-rad                        5.000000


          ...................................................
          :                      SETUP                      :
          :.................................................:
          :  # basis functions                  11          :
          :  # atomic orbitals                  11          :
          :  # shells                            7          :
          :  # electrons                        12          :
          :  max. iterations                   250          :
          :  Hamiltonian                  GFN2-xTB          :
          :  restarted?                      false          :
          :  GBSA solvation                  false          :
          :  PC potential                    false          :
          :  electronic temp.          300.0000000     K    :
          :  accuracy                    1.0000000          :
          :  -> integral cutoff          0.2500000E+02      :
          :  -> integral neglect         0.1000000E-07      :
          :  -> SCF convergence          0.1000000E-05 Eh   :
          :  -> wf. convergence          0.1000000E-03 e    :
          :  Broyden damping             0.4000000          :
          ...................................................

 iter      E             dE          RMSdq      gap      omega  full diag
   1     -6.4501586 -0.645016E+01  0.841E+00    0.70       0.0  T
   2     -6.4556928 -0.553415E-02  0.501E+00    0.76       1.0  T
   3     -6.4556881  0.464758E-05  0.638E-01    0.44       1.0  T
   4     -6.4570314 -0.134328E-02  0.328E-01    0.62       1.0  T
   5     -6.4571172 -0.857967E-04  0.141E-01    0.60       1.0  T
   6     -6.4571195 -0.234420E-05  0.365E-02    0.59       1.2  T
   7     -6.4571252 -0.567872E-05  0.106E-02    0.60       4.2  T
   8     -6.4571254 -0.155898E-06  0.132E-03    0.60      33.8  T
   9     -6.4571254  0.600330E-08  0.130E-03    0.60      34.4  T
  10     -6.4571254 -0.627405E-08  0.660E-05    0.60     677.5  T
  11     -6.4571254  0.579181E-11  0.417E-05    0.60    1071.8  T

   *** convergence criteria satisfied after 11 iterations ***

         #    Occupation            Energy/Eh            Energy/eV
      -------------------------------------------------------------
         1        2.0000           -0.6374181             -17.3450
         2        2.0000           -0.5758341             -15.6692
         3        2.0000           -0.5334136             -14.5149
         4        2.0000           -0.5129409             -13.9578
         5        2.0000           -0.4220828             -11.4855
         6        2.0000           -0.3596026              -9.7853 (HOMO)
         7        0.0000           -0.3375613              -9.1855 (LUMO)
         8                          0.0168472               0.4584
         9                          0.1034637               2.8154
        10                          0.1454192               3.9571
        11                          0.1741918               4.7400
      -------------------------------------------------------------
                  HL-Gap            0.0220412 Eh            0.5998 eV
             Fermi-level           -0.3485819 Eh           -9.4854 eV

 SCC (total)                   0 d,  0 h,  0 min,  0.002 sec
 SCC setup                      ...        0 min,  0.000 sec (  4.495%)
 Dispersion                     ...        0 min,  0.000 sec (  0.651%)
 integral evaluation            ...        0 min,  0.000 sec ( 23.292%)
 zeroth order Hamiltonian       ...        0 min,  0.000 sec (  0.792%)
 iterations                     ...        0 min,  0.001 sec ( 43.379%)
 molecular gradient             ...        0 min,  0.000 sec ( 24.109%)
 printout                       ...        0 min,  0.000 sec (  2.733%)

         :::::::::::::::::::::::::::::::::::::::::::::::::::::
         ::                     SUMMARY                     ::
         :::::::::::::::::::::::::::::::::::::::::::::::::::::
         :: total energy              -6.403994769964 Eh    ::
         :: gradient norm              0.050025355201 Eh/a0 ::
         :: HOMO-LUMO gap              0.599772536044 eV    ::
         ::.................................................::
         :: SCC energy                -6.457125370271 Eh    ::
         :: -> isotropic ES            0.003760834806 Eh    ::
         :: -> anisotropic ES          0.003680987243 Eh    ::
         :: -> anisotropic XC          0.011740803959 Eh    ::
         :: -> dispersion             -0.001009123207 Eh    ::
         :: repulsion energy           0.053130586764 Eh    ::
         :: add. restraining           0.000000000000 Eh    ::
         :::::::::::::::::::::::::::::::::::::::::::::::::::::

      ----------------------------------------------------------- 
     |                   =====================                   |
     |                        A N C O P T                        |
     |                   =====================                   |
     |               Approximate Normal Coordinate               |
     |                Rational Function Optimizer                |
      ----------------------------------------------------------- 

          ...................................................
          :                      SETUP                      :
          :.................................................:
          :   optimization level            normal          :
          :   max. optcycles                   200          :
          :   ANC micro-cycles                  20          :
          :   degrees of freedom                 9          :
          :.................................................:
          :   RF solver                   davidson          :
          :   write xtbopt.log                true          :
          :   linear?                        false          :
          :   energy convergence         0.5000000E-05 Eh   :
          :   grad. convergence          0.1000000E-02 Eh/α :
          :   maximium RF displ.         1.0000000          :
          :   Hlow (freq-cutoff)         0.1000000E-01      :
          :   Hmax (freq-cutoff)         5.0000000          :
          :   S6 in model hess.         20.0000000          :
          ...................................................

generating ANC from model Hessian ...
Using Lindh-Hessian (1995)
 Shifting diagonal of input Hessian by    0.0000000000000000     
 Lowest  eigenvalues of input Hessian
   -0.000000   -0.000000    0.000000    0.000000    0.000000    0.000000
    0.016563    0.045777    0.132345    0.168071    0.199428    0.664883
    0.863055    1.174721    1.257264
 Highest eigenvalues
    0.168071    0.199428    0.664883    0.863055    1.174721    1.257264


........................................................................
.............................. CYCLE    1 ..............................
........................................................................
   1     -6.4571254 -0.645713E+01  0.231E-06    0.60       0.0  T
   2     -6.4571254 -0.133227E-13  0.966E-07    0.60   46278.1  T
   3     -6.4571254 -0.355271E-14  0.545E-07    0.60   82046.2  T
     SCC iter.                  ...        0 min,  0.000 sec
     gradient                   ...        0 min,  0.000 sec
 * total energy  :    -6.4039948 Eh     change        0.8329479E-09 Eh
   gradient norm :     0.0500248 Eh/α   predicted     0.0000000E+00 (-100.00%)
   displ. norm   :     0.1274607 α      lambda       -0.3900767E-02
   maximum displ.:     0.0916546 α      in ANC's #2, #4, #6, ...

........................................................................
.............................. CYCLE    2 ..............................
........................................................................
   1     -6.4663544 -0.646635E+01  0.373E-01    0.65       0.0  T
   2     -6.4664842 -0.129842E-03  0.202E-01    0.71       1.0  T
   3     -6.4664942 -0.100398E-04  0.946E-02    0.68       1.0  T
   4     -6.4664984 -0.418750E-05  0.173E-02    0.69       2.6  T
   5     -6.4664985 -0.404451E-07  0.248E-03    0.69      18.1  T
   6     -6.4664985 -0.164522E-08  0.102E-03    0.69      43.8  T
   7     -6.4664985 -0.940637E-09  0.192E-04    0.69     233.0  T
   8     -6.4664985 -0.388525E-10  0.746E-05    0.69     599.2  T
     SCC iter.                  ...        0 min,  0.000 sec
     gradient                   ...        0 min,  0.000 sec
 * total energy  :    -6.4065906 Eh     change       -0.2595817E-02 Eh
   gradient norm :     0.0221099 Eh/α   predicted    -0.1982071E-02 ( -23.64%)
   displ. norm   :     0.0517930 α      lambda       -0.8935023E-03
   maximum displ.:     0.0334205 α      in ANC's #4, #6, #9, ...

........................................................................
.............................. CYCLE    3 ..............................
........................................................................
   1     -6.4706269 -0.647063E+01  0.183E-01    0.67       0.0  T
   2     -6.4706716 -0.446295E-04  0.103E-01    0.70       1.0  T
   3     -6.4706750 -0.340573E-05  0.553E-02    0.69       1.0  T
   4     -6.4706758 -0.851107E-06  0.115E-02    0.69       3.9  T
   5     -6.4706758 -0.254346E-07  0.276E-03    0.69      16.2  T
   6     -6.4706758 -0.213633E-08  0.726E-04    0.69      61.6  T
   7     -6.4706758 -0.137129E-09  0.134E-04    0.69     332.9  T
     SCC iter.                  ...        0 min,  0.000 sec
     gradient                   ...        0 min,  0.000 sec
 * total energy  :    -6.4070473 Eh     change       -0.4567231E-03 Eh
   gradient norm :     0.0055520 Eh/α   predicted    -0.4479495E-03 (  -1.92%)
   displ. norm   :     0.0146872 α      lambda       -0.5149598E-04
   maximum displ.:     0.0094862 α      in ANC's #5, #2, #4, ...

........................................................................
.............................. CYCLE    4 ..............................
........................................................................
   1     -6.4701152 -0.647012E+01  0.382E-02    0.69       0.0  T
   2     -6.4701160 -0.809416E-06  0.197E-02    0.68       2.3  T
   3     -6.4701161 -0.598020E-07  0.629E-03    0.69       7.1  T
   4     -6.4701161 -0.289363E-07  0.178E-03    0.69      25.1  T
   5     -6.4701161 -0.129509E-08  0.650E-04    0.69      68.8  T
   6     -6.4701161 -0.377138E-10  0.750E-05    0.69     596.2  T
     SCC iter.                  ...        0 min,  0.000 sec
     gradient                   ...        0 min,  0.000 sec
 * total energy  :    -6.4070820 Eh     change       -0.3464133E-04 Eh
   gradient norm :     0.0021221 Eh/α   predicted    -0.2575313E-04 ( -25.66%)
   displ. norm   :     0.0138552 α      lambda       -0.1371183E-04
   maximum displ.:     0.0097620 α      in ANC's #2, #1, #4, ...

........................................................................
.............................. CYCLE    5 ..............................
........................................................................
   1     -6.4696292 -0.646963E+01  0.975E-02    0.68       0.0  T
   2     -6.4696297 -0.506815E-06  0.491E-02    0.68       1.0  T
   3     -6.4696298 -0.840981E-07  0.388E-03    0.68      11.5  T
   4     -6.4696298 -0.464637E-08  0.122E-03    0.68      36.6  T
   5     -6.4696298 -0.197065E-09  0.348E-04    0.68     128.7  T
   6     -6.4696298 -0.916422E-10  0.124E-04    0.68     361.3  T
     SCC iter.                  ...        0 min,  0.000 sec
     gradient                   ...        0 min,  0.000 sec
 * total energy  :    -6.4070917 Eh     change       -0.9763760E-05 Eh
   gradient norm :     0.0011789 Eh/α   predicted    -0.6856528E-05 ( -29.78%)
   displ. norm   :     0.3150495 α      lambda       -0.1513332E-03
   maximum displ.:     0.2508119 α      in ANC's #1, #2, #4, ...

........................................................................
.............................. CYCLE    6 ..............................
........................................................................
   1     -6.4596983 -0.645970E+01  0.330E+00    0.82       0.0  T
   2     -6.4609599 -0.126154E-02  0.136E+00    0.93       1.0  T
   3     -6.4606791  0.280780E-03  0.845E-01    0.81       1.0  T
   4     -6.4615033 -0.824245E-03  0.813E-02    0.88       1.0  T
   5     -6.4615065 -0.316283E-05  0.266E-02    0.88       1.7  T
   6     -6.4615066 -0.116123E-06  0.426E-03    0.87      10.5  T
   7     -6.4615066 -0.522791E-08  0.181E-03    0.87      24.8  T
   8     -6.4615066 -0.442220E-09  0.251E-04    0.87     177.9  T
   9     -6.4615066 -0.188169E-10  0.391E-05    0.87    1142.7  T
     SCC iter.                  ...        0 min,  0.000 sec
     gradient                   ...        0 min,  0.000 sec
 * total energy  :    -6.4083175 Eh     change       -0.1225818E-02 Eh
   gradient norm :     0.0523162 Eh/α   predicted    -0.7900405E-04 ( -93.55%)
   displ. norm   :     0.3550586 α      lambda       -0.4398021E-02
   maximum displ.:     0.3013829 α      in ANC's #1, #2, #5, ...

........................................................................
.............................. CYCLE    7 ..............................
........................................................................
   1     -6.4543318 -0.645433E+01  0.311E+00    1.17       0.0  T
   2     -6.4558788 -0.154701E-02  0.134E+00    1.25       1.0  T
   3     -6.4551867  0.692092E-03  0.113E+00    1.16       1.0  T
   4     -6.4573996 -0.221282E-02  0.891E-02    1.21       1.0  T
   5     -6.4574091 -0.953114E-05  0.307E-02    1.21       1.5  T
   6     -6.4574092 -0.905883E-07  0.622E-03    1.22       7.2  T
   7     -6.4574092 -0.283729E-07  0.199E-03    1.21      22.5  T
   8     -6.4574092 -0.104574E-08  0.431E-04    1.21     103.7  T
   9     -6.4574092  0.670637E-10  0.281E-04    1.21     159.4  T
     SCC iter.                  ...        0 min,  0.000 sec
     gradient                   ...        0 min,  0.000 sec
 * total energy  :    -6.4122135 Eh     change       -0.3896017E-02 Eh
   gradient norm :     0.0927773 Eh/α   predicted    -0.2476234E-02 ( -36.44%)
   displ. norm   :     0.7295405 α      lambda       -0.2461879E-01
   maximum displ.:     0.6202451 α      in ANC's #1, #2, #4, ...

........................................................................
.............................. CYCLE    8 ..............................
........................................................................
   1     -6.4517085 -0.645171E+01  0.349E+00    2.14       0.0  T
   2     -6.4531488 -0.144031E-02  0.202E+00    2.12       1.0  T
   3     -6.4484577  0.469109E-02  0.122E+00    2.06       1.0  T
   4     -6.4543993 -0.594156E-02  0.238E-01    2.11       1.0  T
   5     -6.4545216 -0.122351E-03  0.816E-02    2.11       1.0  T
   6     -6.4545252 -0.361948E-05  0.178E-02    2.11       2.5  T
   7     -6.4545252  0.725236E-07  0.796E-03    2.11       5.6  T
   8     -6.4545253 -0.164279E-06  0.176E-03    2.11      25.4  T
   9     -6.4545253 -0.476478E-08  0.237E-04    2.11     188.5  T
  10     -6.4545253 -0.149335E-09  0.438E-05    2.11    1021.2  T
     SCC iter.                  ...        0 min,  0.000 sec
     gradient                   ...        0 min,  0.000 sec
 * total energy  :    -6.4189477 Eh     change       -0.6734200E-02 Eh
   gradient norm :     0.1404443 Eh/α   predicted    -0.1886081E-01 ( 180.08%)
   displ. norm   :     0.5508304 α      lambda       -0.4515224E-01
   maximum displ.:     0.3176891 α      in ANC's #2, #6, #4, ...

........................................................................
.............................. CYCLE    9 ..............................
........................................................................
   1     -6.5076630 -0.650766E+01  0.154E+00    2.14       0.0  T
   2     -6.5093961 -0.173308E-02  0.908E-01    2.22       1.0  T
   3     -6.5094751 -0.790433E-04  0.540E-01    2.20       1.0  T
   4     -6.5101315 -0.656420E-03  0.165E-01    2.21       1.0  T
   5     -6.5101427 -0.111668E-04  0.393E-02    2.19       1.1  T
   6     -6.5101434 -0.669339E-06  0.822E-03    2.19       5.4  T
   7     -6.5101434 -0.105710E-07  0.345E-03    2.19      13.0  T
   8     -6.5101434 -0.854445E-08  0.574E-04    2.19      77.9  T
   9     -6.5101434 -0.520846E-10  0.598E-05    2.19     747.6  T
     SCC iter.                  ...        0 min,  0.000 sec
     gradient                   ...        0 min,  0.000 sec
 * total energy  :    -6.4374217 Eh     change       -0.1847396E-01 Eh
   gradient norm :     0.1056626 Eh/α   predicted    -0.2942603E-01 (  59.28%)
   displ. norm   :     0.3931982 α      lambda       -0.2473440E-01
   maximum displ.:     0.2871637 α      in ANC's #2, #3, #6, ...

........................................................................
.............................. CYCLE   10 ..............................
........................................................................
   1     -6.5334884 -0.653349E+01  0.181E+00    2.33       0.0  T
   2     -6.5368935 -0.340514E-02  0.902E-01    2.26       1.0  T
   3     -6.5382029 -0.130934E-02  0.562E-01    2.26       1.0  T
   4     -6.5383458 -0.142957E-03  0.914E-02    2.24       1.0  T
   5     -6.5383513 -0.553526E-05  0.305E-02    2.23       1.5  T
   6     -6.5383526 -0.128751E-05  0.107E-02    2.23       4.2  T
   7     -6.5383529 -0.237978E-06  0.264E-03    2.23      17.0  T
   8     -6.5383529 -0.166943E-07  0.303E-04    2.23     147.5  T
   9     -6.5383529  0.890648E-10  0.197E-04    2.23     227.4  T
     SCC iter.                  ...        0 min,  0.000 sec
     gradient                   ...        0 min,  0.000 sec
 * total energy  :    -6.4521602 Eh     change       -0.1473850E-01 Eh
   gradient norm :     0.0768707 Eh/α   predicted    -0.1427922E-01 (  -3.12%)
   displ. norm   :     0.3976441 α      lambda       -0.1885441E-01
   maximum displ.:     0.2300403 α      in ANC's #2, #6, #1, ...

........................................................................
.............................. CYCLE   11 ..............................
........................................................................
   1     -6.5414849 -0.654148E+01  0.130E+00    2.75       0.0  T
   2     -6.5420522 -0.567369E-03  0.647E-01    2.72       1.0  T
   3     -6.5420587 -0.649704E-05  0.301E-01    2.73       1.0  T
   4     -6.5421888 -0.130042E-03  0.415E-02    2.72       1.1  T
   5     -6.5421900 -0.127736E-05  0.139E-02    2.72       3.2  T
   6     -6.5421901 -0.271834E-07  0.223E-03    2.72      20.1  T
   7     -6.5421901 -0.227845E-08  0.682E-04    2.72      65.5  T
   8     -6.5421901 -0.289369E-09  0.203E-04    2.72     220.5  T
     SCC iter.                  ...        0 min,  0.000 sec
     gradient                   ...        0 min,  0.000 sec
 * total energy  :    -6.4640739 Eh     change       -0.1191367E-01 Eh
   gradient norm :     0.0838566 Eh/α   predicted    -0.1091784E-01 (  -8.36%)
   displ. norm   :     0.2740166 α      lambda       -0.1451457E-01
   maximum displ.:     0.1613974 α      in ANC's #6, #9, #3, ...

........................................................................
.............................. CYCLE   12 ..............................
........................................................................
   1     -6.5503138 -0.655031E+01  0.794E-01    2.68       0.0  T
   2     -6.5505148 -0.201012E-03  0.454E-01    2.71       1.0  T
   3     -6.5505123  0.248818E-05  0.181E-01    2.71       1.0  T
   4     -6.5505718 -0.594817E-04  0.464E-02    2.72       1.0  T
   5     -6.5505728 -0.103039E-05  0.116E-02    2.71       3.8  T
   6     -6.5505728 -0.375289E-07  0.225E-03    2.71      19.9  T
   7     -6.5505728 -0.126750E-08  0.587E-04    2.71      76.2  T
   8     -6.5505728 -0.418137E-10  0.145E-04    2.71     308.4  T
     SCC iter.                  ...        0 min,  0.000 sec
     gradient                   ...        0 min,  0.000 sec
 * total energy  :    -6.4713674 Eh     change       -0.7293575E-02 Eh
   gradient norm :     0.0395436 Eh/α   predicted    -0.7802204E-02 (   6.97%)
   displ. norm   :     0.3149998 α      lambda       -0.8342717E-02
   maximum displ.:     0.2026890 α      in ANC's #1, #6, #3, ...

........................................................................
.............................. CYCLE   13 ..............................
........................................................................
   1     -6.5498279 -0.654983E+01  0.836E-01    2.93       0.0  T
   2     -6.5499417 -0.113849E-03  0.467E-01    2.93       1.0  T
   3     -6.5499662 -0.244315E-04  0.107E-01    2.92       1.0  T
   4     -6.5499770 -0.108430E-04  0.459E-02    2.93       1.0  T
   5     -6.5499783 -0.134983E-05  0.151E-02    2.93       3.0  T
   6     -6.5499784 -0.732750E-07  0.360E-03    2.93      12.4  T
   7     -6.5499784 -0.172560E-08  0.678E-04    2.93      66.0  T
   8     -6.5499784 -0.119937E-08  0.161E-04    2.93     278.3  T
     SCC iter.                  ...        0 min,  0.000 sec
     gradient                   ...        0 min,  0.000 sec
 * total energy  :    -6.4737812 Eh     change       -0.2413770E-02 Eh
   gradient norm :     0.0356275 Eh/α   predicted    -0.4585260E-02 (  89.96%)
   displ. norm   :     0.1088861 α      lambda       -0.2822725E-02
   maximum displ.:     0.0732903 α      in ANC's #2, #3, #1, ...

........................................................................
.............................. CYCLE   14 ..............................
........................................................................
   1     -6.5611634 -0.656116E+01  0.393E-01    2.86       0.0  T
   2     -6.5612586 -0.951790E-04  0.218E-01    2.86       1.0  T
   3     -6.5612636 -0.502990E-05  0.109E-01    2.86       1.0  T
   4     -6.5612788 -0.151977E-04  0.326E-02    2.86       1.4  T
   5     -6.5612792 -0.358838E-06  0.887E-03    2.85       5.0  T
   6     -6.5612792 -0.134943E-07  0.142E-03    2.85      31.5  T
   7     -6.5612792 -0.884068E-09  0.309E-04    2.85     144.6  T
   8     -6.5612792 -0.131615E-09  0.544E-05    2.85     821.7  T
     SCC iter.                  ...        0 min,  0.000 sec
     gradient                   ...        0 min,  0.000 sec
 * total energy  :    -6.4750875 Eh     change       -0.1306299E-02 Eh
   gradient norm :     0.0114995 Eh/α   predicted    -0.1428095E-02 (   9.32%)
   displ. norm   :     0.0568249 α      lambda       -0.4682238E-03
   maximum displ.:     0.0279415 α      in ANC's #2, #6, #5, ...

........................................................................
.............................. CYCLE   15 ..............................
........................................................................
   1     -6.5596464 -0.655965E+01  0.167E-01    2.84       0.0  T
   2     -6.5596516 -0.517349E-05  0.885E-02    2.84       1.0  T
   3     -6.5596522 -0.632440E-06  0.266E-02    2.84       1.7  T
   4     -6.5596534 -0.116261E-05  0.960E-03    2.84       4.7  T
   5     -6.5596534 -0.139138E-07  0.154E-03    2.84      29.0  T
   6     -6.5596534 -0.619641E-09  0.256E-04    2.84     174.5  T
   7     -6.5596534 -0.772094E-11  0.861E-05    2.84     519.2  T
     SCC iter.                  ...        0 min,  0.000 sec
     gradient                   ...        0 min,  0.000 sec
 * total energy  :    -6.4751958 Eh     change       -0.1082485E-03 Eh
   gradient norm :     0.0091157 Eh/α   predicted    -0.2348669E-03 ( 116.97%)
   displ. norm   :     0.0195200 α      lambda       -0.1409552E-03
   maximum displ.:     0.0166616 α      in ANC's #3, #5, #4, ...

........................................................................
.............................. CYCLE   16 ..............................
........................................................................
   1     -6.5594319 -0.655943E+01  0.896E-02    2.83       0.0  T
   2     -6.5594396 -0.778264E-05  0.402E-02    2.84       1.1  T
   3     -6.5594415 -0.181921E-05  0.281E-02    2.84       1.6  T
   4     -6.5594420 -0.525509E-06  0.547E-03    2.84       8.2  T
   5     -6.5594420 -0.643178E-08  0.972E-04    2.84      46.0  T
   6     -6.5594420 -0.285714E-09  0.294E-04    2.84     151.9  T
     SCC iter.                  ...        0 min,  0.000 sec
     gradient                   ...        0 min,  0.000 sec
 * total energy  :    -6.4752676 Eh     change       -0.7183160E-04 Eh
   gradient norm :     0.0011124 Eh/α   predicted    -0.7050450E-04 (  -1.85%)
   displ. norm   :     0.0089328 α      lambda       -0.4653257E-05
   maximum displ.:     0.0069315 α      in ANC's #6, #2, #3, ...

........................................................................
.............................. CYCLE   17 ..............................
........................................................................
   1     -6.5601559 -0.656016E+01  0.220E-02    2.85       0.0  T
   2     -6.5601562 -0.354915E-06  0.115E-02    2.85       3.9  T
   3     -6.5601563 -0.733590E-07  0.667E-03    2.85       6.7  T
   4     -6.5601563 -0.331798E-07  0.739E-04    2.85      60.5  T
   5     -6.5601563 -0.916280E-10  0.979E-05    2.85     457.0  T
     SCC iter.                  ...        0 min,  0.000 sec
     gradient                   ...        0 min,  0.000 sec
 * total energy  :    -6.4752681 Eh     change       -0.5134187E-06 Eh
   gradient norm :     0.0013643 Eh/α   predicted    -0.2327698E-05 ( 353.37%)
   displ. norm   :     0.0038797 α      lambda       -0.2409745E-05
   maximum displ.:     0.0029259 α      in ANC's #2, #6, #3, ...

........................................................................
.............................. CYCLE   18 ..............................
........................................................................
   1     -6.5598334 -0.655983E+01  0.121E-02    2.84       0.0  T
   2     -6.5598335 -0.140801E-06  0.565E-03    2.84       7.9  T
   3     -6.5598335 -0.317131E-07  0.361E-03    2.84      12.4  T
   4     -6.5598335 -0.706590E-08  0.464E-04    2.84      96.4  T
   5     -6.5598335 -0.118716E-09  0.134E-04    2.84     332.8  T
     SCC iter.                  ...        0 min,  0.000 sec
     gradient                   ...        0 min,  0.000 sec
 * total energy  :    -6.4752699 Eh     change       -0.1813701E-05 Eh
   gradient norm :     0.0003641 Eh/α   predicted    -0.1204429E-05 ( -33.59%)
   displ. norm   :     0.0012935 α      lambda       -0.2127166E-06
   maximum displ.:     0.0007727 α      in ANC's #7, #6, #9, ...

   *** GEOMETRY OPTIMIZATION CONVERGED AFTER 18 ITERATIONS ***

------------------------------------------------------------------------
 total energy gain   :        -0.0712752 Eh      -44.7258 kcal/mol
 total RMSD          :         0.8810283 a0        0.4662 Å
 total power (kW/mol):       -10.3962718 (step)-7946.5859 (real)
------------------------------------------------------------------------

 ANCopt (total)                0 d,  0 h,  0 min,  0.024 sec
 optimizer setup                ...        0 min,  0.000 sec (  0.279%)
 model hessian                  ...        0 min,  0.000 sec (  0.425%)
 ANC generation                 ...        0 min,  0.000 sec (  0.237%)
 coordinate transformation      ...        0 min,  0.000 sec (  0.164%)
 single point calculation       ...        0 min,  0.022 sec ( 93.249%)
 optimization log               ...        0 min,  0.000 sec (  1.772%)
 hessian update                 ...        0 min,  0.000 sec (  0.178%)
 rational function              ...        0 min,  0.000 sec (  1.695%)

================
 final structure:
================
5
 xtb: 6.2.2 (9d81278992624c895f80dd42a50cac0aa55982e2)
C         0.79502072012295   -0.50834684421402    0.02656871611136
N        -0.41566796782593   -0.04899418622602    0.00148825236774
H         1.51648924431218    0.33309177313613   -0.00943349505431
H        -0.71099175873156    0.93233688784668   -0.04780344850654
H        -1.18485023787764   -0.70808763054278    0.02917997508175

 Bond Distances (Angstroems)
 ---------------------------
C1-N2=1.2951         C1-H3=1.1090         N2-C1=1.2951         N2-H4=1.0260         N2-H5=1.0133         H3-C1=1.1090         
H4-N2=1.0260         H5-N2=1.0133         
 C  H  Rav=1.1090 sigma=0.0000  Rmin=1.1090  Rmax=1.1090     1
 N  H  Rav=1.0197 sigma=0.0063  Rmin=1.0133  Rmax=1.0260     2
 N  C  Rav=1.2951 sigma=0.0000  Rmin=1.2951  Rmax=1.2951     1

 selected bond angles (degree)
 --------------------
H3-C1-N2=109.78                H4-N2-C1=127.53                H5-N2-C1=118.58                H5-N2-H4=113.89                

 selected dihedral angles (degree)
 ---------------------------------
H4-N2-C1-H3=  0.24            H5-N2-C1-H3=180.01            
           -------------------------------------------------
          |                Final Singlepoint                |
           -------------------------------------------------

          ...................................................
          :                      SETUP                      :
          :.................................................:
          :  # basis functions                  11          :
          :  # atomic orbitals                  11          :
          :  # shells                            7          :
          :  # electrons                        12          :
          :  max. iterations                   250          :
          :  Hamiltonian                  GFN2-xTB          :
          :  restarted?                      false          :
          :  GBSA solvation                  false          :
          :  PC potential                    false          :
          :  electronic temp.          300.0000000     K    :
          :  accuracy                    1.0000000          :
          :  -> integral cutoff          0.2500000E+02      :
          :  -> integral neglect         0.1000000E-07      :
          :  -> SCF convergence          0.1000000E-05 Eh   :
          :  -> wf. convergence          0.1000000E-03 e    :
          :  Broyden damping             0.4000000          :
          ...................................................

 iter      E             dE          RMSdq      gap      omega  full diag
   1     -6.5598335 -0.655983E+01  0.175E-05    2.84       0.0  T
   2     -6.5598335 -0.470735E-13  0.109E-05    2.84    4106.8  T
   3     -6.5598335 -0.976996E-14  0.209E-06    2.84   21417.4  T

   *** convergence criteria satisfied after 3 iterations ***

         #    Occupation            Energy/Eh            Energy/eV
      -------------------------------------------------------------
         1        2.0000           -0.6390954             -17.3907
         2        2.0000           -0.5826096             -15.8536
         3        2.0000           -0.5543029             -15.0833
         4        2.0000           -0.4703767             -12.7996
         5        2.0000           -0.4630365             -12.5999
         6        2.0000           -0.3359457              -9.1415 (HOMO)
         7                         -0.2315950              -6.3020 (LUMO)
         8                          0.0199699               0.5434
         9                          0.1274933               3.4693
        10                          0.2854934               7.7687
        11                          0.4545701              12.3695
      -------------------------------------------------------------
                  HL-Gap            0.1043507 Eh            2.8395 eV
             Fermi-level           -0.2837704 Eh           -7.7218 eV

 SCC (total)                   0 d,  0 h,  0 min,  0.001 sec
 SCC setup                      ...        0 min,  0.000 sec (  3.814%)
 Dispersion                     ...        0 min,  0.000 sec (  0.639%)
 integral evaluation            ...        0 min,  0.000 sec ( 36.714%)
 zeroth order Hamiltonian       ...        0 min,  0.000 sec (  0.618%)
 iterations                     ...        0 min,  0.000 sec ( 17.771%)
 molecular gradient             ...        0 min,  0.000 sec ( 36.288%)
 printout                       ...        0 min,  0.000 sec (  3.495%)

         :::::::::::::::::::::::::::::::::::::::::::::::::::::
         ::                     SUMMARY                     ::
         :::::::::::::::::::::::::::::::::::::::::::::::::::::
         :: total energy              -6.475269923651 Eh    ::
         :: gradient norm              0.000419828863 Eh/a0 ::
         :: HOMO-LUMO gap              2.839527081676 eV    ::
         ::.................................................::
         :: SCC energy                -6.559833546869 Eh    ::
         :: -> isotropic ES            0.004480591663 Eh    ::
         :: -> anisotropic ES          0.000103447075 Eh    ::
         :: -> anisotropic XC          0.007535548527 Eh    ::
         :: -> dispersion             -0.001034431902 Eh    ::
         :: repulsion energy           0.084563616274 Eh    ::
         :: add. restraining           0.000000000000 Eh    ::
         :::::::::::::::::::::::::::::::::::::::::::::::::::::

           ------------------------------------------------- 
          |                Numerical Hessian                |
           ------------------------------------------------- 
step length          :   0.00500
SCC accuracy         :   0.30000
Hessian scale factor :   1.00000
frozen atoms in %    :   0.00000    0
RMS gradient         :   0.00042
estimated CPU  time      0.00 min
estimated wall time      0.00 min

writing file <hessian>.

 projected vibrational frequencies (cm-1)
eigval :       -0.00    -0.00     0.00     0.00     0.00     0.00
eigval :      790.24  1024.46  1031.09  1326.39  1468.57  1539.20
eigval :     2780.57  3114.68  3382.41
           -------------------------------------------------
          |                Property Printout                |
           -------------------------------------------------

    * Orbital Energies and Occupations

         #    Occupation            Energy/Eh            Energy/eV
      -------------------------------------------------------------
         1        2.0000           -0.6390954             -17.3907
         2        2.0000           -0.5826096             -15.8536
         3        2.0000           -0.5543029             -15.0833
         4        2.0000           -0.4703767             -12.7996
         5        2.0000           -0.4630365             -12.5999
         6        2.0000           -0.3359457              -9.1415 (HOMO)
         7                         -0.2315950              -6.3020 (LUMO)
         8                          0.0199699               0.5434
         9                          0.1274933               3.4693
        10                          0.2854934               7.7687
        11                          0.4545701              12.3695
      -------------------------------------------------------------
                  HL-Gap            0.1043507 Eh            2.8395 eV
             Fermi-level           -0.2837704 Eh           -7.7218 eV

     #   Z        covCN         q      C6AA      α(0)
     1   6 C      1.832    -0.171    36.096     9.706
     2   7 N      2.630    -0.128    23.798     7.245
     3   1 H      0.922    -0.002     3.097     2.752
     4   1 H      0.859     0.135     1.505     1.922
     5   1 H      0.860     0.167     1.293     1.781

 Mol. C6AA /au·bohr⁶  :        224.669923
 Mol. C8AA /au·bohr⁸  :       4825.466184
 Mol. α(0) /au        :         23.406668


Wiberg/Mayer (AO) data.
largest (>0.10) Wiberg bond orders for each atom
          total WBO             WBO to atom ...
     1  C   2.710        N    2 1.687    H    3 0.977
     2  N   3.570        C    1 1.687    H    5 0.950    H    4 0.933
     3  H   1.000        C    1 0.977
     4  H   0.982        N    2 0.933
     5  H   0.972        N    2 0.950

MOs/occ written to file <molden.input>


molecular dipole:
                 x           y           z       tot (Debye)
 q only:       -0.718       0.191      -0.012
   full:       -1.011       0.755      -0.040       3.208
molecular quadrupole (traceless):
                xx          xy          yy          xz          yz          zz
 q only:        0.316       0.620       0.260      -0.025      -0.038      -0.576
  q+dip:        0.773       2.443       0.107      -0.106      -0.039      -0.880
   full:        0.527       2.456      -0.675      -0.112       0.046       0.148

           -------------------------------------------------
          |                Geometry Summary                 |
           -------------------------------------------------
Molecule has the following symmetry elements: (sigma) 
It seems to be the Cs point group

      molecular mass/u    :       29.0412614
   center of mass at/Å    :        0.1151551      -0.2145264       0.0107321
  moments of inertia/u·Å² :        0.2424244E+01   0.1474740E+02   0.1717163E+02
rotational constants/cm⁻¹ :        0.6953767E+01   0.1143092E+01   0.9817143E+00

 * 3 selected distances

     #   Z        #   Z                                     value/Å
     1   6 C      2   7 N                                 1.2951452 (max)
     2   7 N      4   1 H                                 1.0259905
     2   7 N      5   1 H                                 1.0133175 (min)

 * 2 distinct bonds (by element types)

   Z      Z             #   av. dist./Å        max./Å        min./Å
   1 H    7 N           2     1.0196540     1.0259905     1.0133175
   6 C    7 N           1     1.2951452     1.2951452     1.2951452

           -------------------------------------------------
          |               Frequency Printout                |
           -------------------------------------------------
 projected vibrational frequencies (cm-1)
eigval :       -0.00    -0.00     0.00     0.00     0.00     0.00
eigval :      790.24  1024.46  1031.09  1326.39  1468.57  1539.20
eigval :     2780.57  3114.68  3382.41
 reduced masses (amu)
   1:  7.50   2: 11.35   3: 10.70   4:  9.96   5:  7.15   6:  8.59   7:  4.11   8:  2.00
   9:  1.86  10:  4.27  11:  8.95  12:  5.40  13:  1.80  14:  1.70  15:  1.79
 IR intensities (amu)
   1:  0.23   2:  0.39   3:  0.16   4:  0.13   5:  0.10   6:  0.15   7:  0.57   8:  0.12
   9:  0.09  10:  0.21  11:  0.44  12:  0.29  13:  0.54  14:  0.31  15:  0.05
 Raman intensities (amu)
   1:  0.00   2:  0.00   3:  0.00   4:  0.00   5:  0.00   6:  0.00   7:  0.00   8:  0.00
   9:  0.00  10:  0.00  11:  0.00  12:  0.00  13:  0.00  14:  0.00  15:  0.00
 output can be read by thermo (or use thermo option).
 writing <g98.out> molden fake output.
 recommended (thermochemical) frequency scaling factor: 1.0
           -------------------------------------------------
          |             Thermodynamic Functions             |
           -------------------------------------------------

cs  symmetry found (for desy threshold:  0.10E+00) used in thermo

          ...................................................
          :                      SETUP                      :
          :.................................................:
          :  # frequencies                           9      :
          :  # imaginary freq.                       0      :
          :  linear?                             false      :
          :  only rotor calc.                    false      :
          :  symmetry                               cs      :
          :  rotational number                       1      :
          :  scaling factor                  1.0000000      :
          :  rotor cutoff                   50.0000000 cm⁻¹ :
          :  imag. cutoff                  -20.0000000 cm⁻¹ :
          :.................................................:

    mode    ω/cm⁻¹     T·S(HO)/kcal·mol⁻¹    T·S(FR)/kcal·mol⁻¹   T·S(vib)
   ------------------------------------------------------------------------
   ------------------------------------------------------------------------

   temp. (K)  partition function   enthalpy   heat capacity  entropy
                                   cal/mol     cal/K/mol   cal/K/mol   J/K/mol
 298.15  VIB   1.04                  104.973      1.648      0.431
         ROT  0.189E+04              888.752      2.981     17.976
         INT  0.197E+04              993.725      4.629     18.407
         TR   0.151E+27             1481.254      4.968     36.016
         TOT                        2474.9793     9.5968    54.4230   227.7057

   temp. (K)  partition function   enthalpy   heat capacity  entropy
                                   cal/mol     cal/K/mol   cal/K/mol   J/K/mol
 120.00  VIB   1.00                    0.200      0.016      0.002
         ROT   483.                  357.707      2.981     15.263
         INT   483.                  357.907      2.997     15.265
         TR   0.387E+26              596.178      4.968     31.497
         TOT                         954.0850     7.9655    46.7620   195.6520

   temp. (K)  partition function   enthalpy   heat capacity  entropy
                                   cal/mol     cal/K/mol   cal/K/mol   J/K/mol
 100.00  VIB   1.00                    0.028      0.003      0.000
         ROT   368.                  298.089      2.981     14.720
         INT   368.                  298.117      2.984     14.720
         TR   0.294E+26              496.815      4.968     30.591
         TOT                         794.9323     7.9523    45.3116   189.5837

   temp. (K)  partition function   enthalpy   heat capacity  entropy
                                   cal/mol     cal/K/mol   cal/K/mol   J/K/mol
  80.00  VIB   1.00                    0.002      0.000     -0.000
         ROT   263.                  238.471      2.981     14.055
         INT   263.                  238.473      2.981     14.055
         TR   0.210E+26              397.452      4.968     29.483
         TOT                         635.9248     7.9493    43.5381   182.1632

   temp. (K)  partition function   enthalpy   heat capacity  entropy
                                   cal/mol     cal/K/mol   cal/K/mol   J/K/mol
  60.00  VIB   1.00                    0.000      0.000     -0.000
         ROT   171.                  178.853      2.981     13.197
         INT   171.                  178.853      2.981     13.197
         TR   0.137E+26              298.089      4.968     28.055
         TOT                         476.9424     7.9490    41.2519   172.5981

   temp. (K)  partition function   enthalpy   heat capacity  entropy
                                   cal/mol     cal/K/mol   cal/K/mol   J/K/mol
  40.00  VIB   1.00                    0.000      0.000     -0.000
         ROT   93.0                  119.236      2.981     11.989
         INT   93.0                  119.236      2.981     11.989
         TR   0.744E+25              198.726      4.968     26.041
         TOT                         317.9616     7.9490    38.0298   159.1169

   temp. (K)  partition function   enthalpy   heat capacity  entropy
                                   cal/mol     cal/K/mol   cal/K/mol   J/K/mol
  20.00  VIB   1.00                    0.000      0.000     -0.000
         ROT   32.9                   59.618      2.981      9.922
         INT   32.9                   59.618      2.981      9.922
         TR   0.263E+25               99.363      4.968     22.599
         TOT                         158.9808     7.9490    32.5216   136.0706

   temp. (K)  partition function   enthalpy   heat capacity  entropy
                                   cal/mol     cal/K/mol   cal/K/mol   J/K/mol
  10.00  VIB   1.00                    0.000      0.000     -0.000
         ROT   11.6                   29.809      2.981      7.856
         INT   11.6                   29.809      2.981      7.856
         TR   0.930E+24               49.681      4.968     19.157
         TOT                          79.4904     7.9490    27.0135   113.0243

       T/K    H(0)-H(T)+PV         H(T)/Eh          T*S/Eh         G(T)/Eh
   ------------------------------------------------------------------------
    298.15    0.394413E-02    0.414373E-01    0.258581E-01    0.155792E-01
    120.00    0.152043E-02    0.390136E-01    0.894239E-02    0.300712E-01
    100.00    0.126681E-02    0.387600E-01    0.722086E-02    0.315391E-01
     80.00    0.101341E-02    0.385066E-01    0.555058E-02    0.329560E-01
     60.00    0.760056E-03    0.382533E-01    0.394435E-02    0.343089E-01
     40.00    0.506704E-03    0.379999E-01    0.242418E-02    0.355757E-01
     20.00    0.253352E-03    0.377466E-01    0.103653E-02    0.367100E-01
     10.00    0.126676E-03    0.376199E-01    0.430487E-03    0.371894E-01 (used)
   ------------------------------------------------------------------------

         :::::::::::::::::::::::::::::::::::::::::::::::::::::
         ::                  THERMODYNAMIC                  ::
         :::::::::::::::::::::::::::::::::::::::::::::::::::::
         :: total free energy          -6.438080530947 Eh   ::
         ::.................................................::
         :: total energy               -6.475269923617 Eh   ::
         :: zero point energy           0.037493203410 Eh   ::
         :: G(RRHO) w/o ZPVE           -0.000303810740 Eh   ::
         :: G(RRHO) contrib.            0.037189392670 Eh   ::
         :::::::::::::::::::::::::::::::::::::::::::::::::::::

optimized geometry written to: xtbopt.xyz


           -------------------------------------------------
          | TOTAL ENERGY               -6.475269923617 Eh   |
          | TOTAL ENTHALPY             -6.437650044191 Eh   |
          | TOTAL FREE ENERGY          -6.438080530947 Eh   |
          | GRADIENT NORM               0.000419828721 Eh/α |
          | HOMO-LUMO GAP               2.839527186749 eV   |
           -------------------------------------------------

------------------------------------------------------------------------
 * finished run on 2020/05/12 at 11:44:28.452     
------------------------------------------------------------------------
 total:
 * wall-time:     0 d,  0 h,  0 min,  0.082 sec
 *  cpu-time:     0 d,  0 h,  0 min,  0.080 sec
 * ratio c/w:     0.984 speedup
 SCF:
 * wall-time:     0 d,  0 h,  0 min,  0.002 sec
 *  cpu-time:     0 d,  0 h,  0 min,  0.002 sec
 * ratio c/w:     1.000 speedup
 ANC optimizer:
 * wall-time:     0 d,  0 h,  0 min,  0.025 sec
 *  cpu-time:     0 d,  0 h,  0 min,  0.025 sec
 * ratio c/w:     1.000 speedup
 numerical hessian:
 * wall-time:     0 d,  0 h,  0 min,  0.035 sec
 *  cpu-time:     0 d,  0 h,  0 min,  0.035 sec
 * ratio c/w:     1.000 speedup

