      -----------------------------------------------------------      
     |                   =====================                   |     
     |                           x T B                           |     
     |                   =====================                   |     
     |                         S. Grimme                         |     
     |          Mulliken Center for Theoretical Chemistry        |     
     |                    University of Bonn                     |     
      -----------------------------------------------------------      

   * xtb version 6.2.2 (9d81278992624c895f80dd42a50cac0aa55982e2) compiled by '@Darwin' on 04/03/2020

   xtb is free software: you can redistribute it and/or modify it under
   the terms of the GNU Lesser General Public License as published by
   the Free Software Foundation, either version 3 of the License, or
   (at your option) any later version.
   
   xtb is distributed in the hope that it will be useful,
   but WITHOUT ANY WARRANTY; without even the implied warranty of
   MERCHANTABILITY or FITNESS FOR A PARTICULAR PURPOSE.  See the
   GNU Lesser General Public License for more details.
   
   Cite this work as:
   * S. Grimme, C. Bannwarth, P. Shushkov, J. Chem. Theory Comput., 2017,
     13, 1989-2009. DOI: 10.1021/acs.jctc.7b00118
   * C. Bannwarth, S. Ehlert and S. Grimme., J. Chem. Theory Comput., 2019,
     15, 1652-1671. DOI: 10.1021/acs.jctc.8b01176
   * P. Pracht, E. Caldeweyher, S. Ehlert, S. Grimme, ChemRxiv, 2019, preprint.
     DOI: 10.26434/chemrxiv.8326202.v1
   
   for DFT-D4:
   * E. Caldeweyher, C. Bannwarth and S. Grimme, J. Chem. Phys., 2017,
     147, 034112. DOI: 10.1063/1.4993215
   * E. Caldeweyher, S. Ehlert, A. Hansen, H. Neugebauer, S. Spicher,
     C. Bannwarth and S. Grimme, J. Chem. Phys., 2019, 150, 154122.
     DOI: 10.1063/1.5090222
   
   for sTDA-xTB:
   * S. Grimme and C. Bannwarth, J. Chem. Phys., 2016, 145, 054103.
     DOI: 10.1063/1.4959605
   
   in the mass-spec context:
   * V. Asgeirsson, C. Bauer and S. Grimme, Chem. Sci., 2017, 8, 4879.
     DOI: 10.1039/c7sc00601b
   
   for metadynamics refer to:
   * S. Grimme, J. Chem. Theory Comput., 2019, 155, 2847-2862
     DOI: 10.1021/acs.jctc.9b00143
   
   with help from (in alphabetical order)
   C. Bannwarth, F. Bohle, G. Brandenburg, E. Caldeweyher, M. Checinski,
   S. Dohm, S. Ehlert, S. Ehrlich, F. März, H. Neugebauer, J. Pisarek,
   P. Pracht, P. Shushkov, and S. Spicher.
   
 * started run on 2020/05/12 at 11:44:47.007     

           -------------------------------------------------
          |                Calculation Setup                |
           -------------------------------------------------

          program call               : xtb --input H2C2N1_7_S_1.input H2C2N1_7_S_1.xyz --ohess --molden --namespace H2C2N1_7_S_1 output.out
          calculation namespace      : H2C2N1_7_S_1
          coordinate file            : H2C2N1_7_S_1.xyz
          number of atoms            :                     5
          number of electrons        :                    15
          charge                     :                     0
          spin                       :                   0.5
          first test random number   :      0.91678789637142

   ID    Z sym.   atoms
    1    7 N      1
    2    6 C      2, 3
    3    1 H      4, 5

           -------------------------------------------------
          |                 G F N 2 - x T B                 |
           -------------------------------------------------

        Reference                      10.1021/acs.jctc.8b01176
      * Hamiltonian:
        H0-scaling (s, p, d)           1.850000    2.230000    2.230000
        zeta-weighting                 0.500000
      * Dispersion:
        s8                             2.700000
        a1                             0.520000
        a2                             5.000000
        s9                             5.000000
      * Repulsion:
        kExp                           1.500000    1.000000
        rExp                           1.000000
      * Coulomb:
        alpha                          2.000000
        third order                    shell-resolved
        anisotropic                    true
        a3                             3.000000
        a5                             4.000000
        cn-shift                       1.200000
        cn-exp                         4.000000
        max-rad                        5.000000


          ...................................................
          :                      SETUP                      :
          :.................................................:
          :  # basis functions                  14          :
          :  # atomic orbitals                  14          :
          :  # shells                            8          :
          :  # electrons                        15          :
          :  max. iterations                   250          :
          :  Hamiltonian                  GFN2-xTB          :
          :  restarted?                      false          :
          :  GBSA solvation                  false          :
          :  PC potential                    false          :
          :  electronic temp.          300.0000000     K    :
          :  accuracy                    1.0000000          :
          :  -> integral cutoff          0.2500000E+02      :
          :  -> integral neglect         0.1000000E-07      :
          :  -> SCF convergence          0.1000000E-05 Eh   :
          :  -> wf. convergence          0.1000000E-03 e    :
          :  Broyden damping             0.4000000          :
          ...................................................

 iter      E             dE          RMSdq      gap      omega  full diag
   1     -7.8102075 -0.781021E+01  0.933E+00    0.82       0.0  T
   2     -6.1208132  0.168939E+01  0.140E+01    1.28       1.0  T
   3     -6.8005081 -0.679695E+00  0.114E+01    2.61       1.0  T
   4     -7.7700027 -0.969495E+00  0.615E+00    0.89       1.0  T
   5     -7.8888626 -0.118860E+00  0.344E+00    0.71       1.0  T
   6     -7.9159155 -0.270529E-01  0.259E+00    0.66       1.0  T
   7     -7.9187100 -0.279456E-02  0.358E+00    0.67       1.0  T
   8     -7.9066104  0.120996E-01  0.150E+00    0.64       1.0  T
   9     -7.9159940 -0.938357E-02  0.848E-01    0.62       1.0  T
  10     -7.9201172 -0.412323E-02  0.816E-02    0.59       1.0  T
  11     -7.9200962  0.210055E-04  0.844E-02    0.59       1.0  T
  12     -7.9201359 -0.396985E-04  0.165E-02    0.59       2.7  T
  13     -7.9201367 -0.754444E-06  0.205E-03    0.59      21.8  T
  14     -7.9201366  0.524441E-07  0.377E-03    0.59      11.9  T
  15     -7.9201367 -0.756910E-07  0.450E-04    0.59      99.4  T
  16     -7.9201367 -0.519372E-09  0.173E-04    0.59     258.1  T

   *** convergence criteria satisfied after 16 iterations ***

         #    Occupation            Energy/Eh            Energy/eV
      -------------------------------------------------------------
         1        2.0000           -0.6855813             -18.6556
         2        2.0000           -0.6313079             -17.1788
         3        2.0000           -0.6002818             -16.3345
         4        2.0000           -0.5500452             -14.9675
         5        2.0000           -0.4919970             -13.3879
         6        2.0000           -0.4809907             -13.0884
         7        2.0000           -0.3935492             -10.7090
         8        1.0000           -0.3627542              -9.8710 (HOMO)
         9        0.0000           -0.3410314              -9.2799 (LUMO)
        10                         -0.3307304              -8.9996
        11                          0.0015024               0.0409
        12                          0.0781584               2.1268
        13                          0.0818788               2.2280
        14                          0.1618675               4.4046
      -------------------------------------------------------------
                  HL-Gap            0.0217229 Eh            0.5911 eV
             Fermi-level           -0.3650223 Eh           -9.9328 eV

 SCC (total)                   0 d,  0 h,  0 min,  0.003 sec
 SCC setup                      ...        0 min,  0.000 sec (  2.956%)
 Dispersion                     ...        0 min,  0.000 sec (  0.519%)
 integral evaluation            ...        0 min,  0.001 sec ( 24.267%)
 zeroth order Hamiltonian       ...        0 min,  0.000 sec (  0.528%)
 iterations                     ...        0 min,  0.001 sec ( 43.895%)
 molecular gradient             ...        0 min,  0.001 sec ( 24.301%)
 printout                       ...        0 min,  0.000 sec (  3.132%)

         :::::::::::::::::::::::::::::::::::::::::::::::::::::
         ::                     SUMMARY                     ::
         :::::::::::::::::::::::::::::::::::::::::::::::::::::
         :: total energy              -7.870357896726 Eh    ::
         :: gradient norm              0.156677305547 Eh/a0 ::
         :: HOMO-LUMO gap              0.591108968567 eV    ::
         ::.................................................::
         :: SCC energy                -7.920136719363 Eh    ::
         :: -> isotropic ES           -0.018705693957 Eh    ::
         :: -> anisotropic ES          0.000813570486 Eh    ::
         :: -> anisotropic XC          0.008017937647 Eh    ::
         :: -> dispersion             -0.001592389811 Eh    ::
         :: repulsion energy           0.049778779778 Eh    ::
         :: add. restraining           0.000000000000 Eh    ::
         :::::::::::::::::::::::::::::::::::::::::::::::::::::

      ----------------------------------------------------------- 
     |                   =====================                   |
     |                        A N C O P T                        |
     |                   =====================                   |
     |               Approximate Normal Coordinate               |
     |                Rational Function Optimizer                |
      ----------------------------------------------------------- 

          ...................................................
          :                      SETUP                      :
          :.................................................:
          :   optimization level            normal          :
          :   max. optcycles                   200          :
          :   ANC micro-cycles                  20          :
          :   degrees of freedom                 9          :
          :.................................................:
          :   RF solver                   davidson          :
          :   write xtbopt.log                true          :
          :   linear?                        false          :
          :   energy convergence         0.5000000E-05 Eh   :
          :   grad. convergence          0.1000000E-02 Eh/α :
          :   maximium RF displ.         1.0000000          :
          :   Hlow (freq-cutoff)         0.1000000E-01      :
          :   Hmax (freq-cutoff)         5.0000000          :
          :   S6 in model hess.         20.0000000          :
          ...................................................

generating ANC from model Hessian ...
Using Lindh-Hessian (1995)
 Shifting diagonal of input Hessian by    0.0000000000000000     
 Lowest  eigenvalues of input Hessian
   -0.000000   -0.000000    0.000000    0.000000    0.000000    0.000000
    0.014690    0.043235    0.114481    0.147155    0.185479    0.659699
    0.855820    1.170049    1.236732
 Highest eigenvalues
    0.147155    0.185479    0.659699    0.855820    1.170049    1.236732


........................................................................
.............................. CYCLE    1 ..............................
........................................................................
   1     -7.9201367 -0.792014E+01  0.557E-05    0.59       0.0  T
   2     -7.9201367  0.877133E-09  0.329E-04    0.59     136.1  T
   3     -7.9201367 -0.882503E-09  0.442E-05    0.59    1011.8  T
     SCC iter.                  ...        0 min,  0.000 sec
     gradient                   ...        0 min,  0.001 sec
 * total energy  :    -7.8703579 Eh     change       -0.1747766E-09 Eh
   gradient norm :     0.1566773 Eh/α   predicted     0.0000000E+00 (-100.00%)
   displ. norm   :     0.3369547 α      lambda       -0.3743291E-01
   maximum displ.:     0.2319800 α      in ANC's #3, #6, #1, ...

........................................................................
.............................. CYCLE    2 ..............................
........................................................................
   1     -7.9654029 -0.796540E+01  0.216E+00    1.45       0.0  T
   2     -7.9676923 -0.228946E-02  0.113E+00    1.28       1.0  T
   3     -7.9582172  0.947516E-02  0.135E+00    1.44       1.0  T
   4     -7.9391087  0.191085E-01  0.197E+00    1.25       1.0  T
   5     -7.9688376 -0.297289E-01  0.135E-01    1.34       1.0  T
   6     -7.9688695 -0.319494E-04  0.939E-02    1.33       1.0  T
   7     -7.9688725 -0.301964E-05  0.884E-03    1.33       5.1  T
   8     -7.9688728 -0.288897E-06  0.459E-03    1.33       9.7  T
   9     -7.9688729 -0.681326E-07  0.928E-04    1.33      48.2  T
  10     -7.9688729 -0.245040E-08  0.162E-04    1.33     276.7  T
     SCC iter.                  ...        0 min,  0.001 sec
     gradient                   ...        0 min,  0.001 sec
 * total energy  :    -7.9021814 Eh     change       -0.3182355E-01 Eh
   gradient norm :     0.1087577 Eh/α   predicted    -0.2084149E-01 ( -34.51%)
   displ. norm   :     0.4683435 α      lambda       -0.4094453E-01
   maximum displ.:     0.3103524 α      in ANC's #3, #6, #7, ...

........................................................................
.............................. CYCLE    3 ..............................
........................................................................
   1     -8.0284356 -0.802844E+01  0.288E+00    2.56       0.0  T
   2     -8.0315373 -0.310169E-02  0.153E+00    2.55       1.0  T
   3     -8.0233421  0.819520E-02  0.142E+00    2.57       1.0  T
   4     -8.0295113 -0.616917E-02  0.802E-01    2.53       1.0  T
   5     -8.0332833 -0.377202E-02  0.121E-01    2.53       1.0  T
   6     -8.0332657  0.175992E-04  0.748E-02    2.53       1.0  T
   7     -8.0332917 -0.260461E-04  0.108E-02    2.53       4.1  T
   8     -8.0332918 -0.890496E-07  0.268E-03    2.53      16.7  T
   9     -8.0332918 -0.154123E-07  0.403E-04    2.53     110.9  T
  10     -8.0332918 -0.305750E-09  0.171E-04    2.53     262.1  T
     SCC iter.                  ...        0 min,  0.001 sec
     gradient                   ...        0 min,  0.001 sec
 * total energy  :    -7.9179974 Eh     change       -0.1581594E-01 Eh
   gradient norm :     0.1455754 Eh/α   predicted    -0.2496276E-01 (  57.83%)
   displ. norm   :     0.4356634 α      lambda       -0.2430987E-01
   maximum displ.:     0.2778484 α      in ANC's #1, #3, #4, ...

........................................................................
.............................. CYCLE    4 ..............................
........................................................................
   1     -7.9978927 -0.799789E+01  0.354E+00    2.01       0.0  T
   2     -7.9947560  0.313669E-02  0.200E+00    2.37       1.0  T
   3     -7.9276297  0.671262E-01  0.358E+00    1.83       1.0  T
   4     -8.0013170 -0.736872E-01  0.702E-01    2.21       1.0  T
   5     -8.0040469 -0.272989E-02  0.192E-01    2.18       1.0  T
   6     -8.0041542 -0.107322E-03  0.864E-02    2.17       1.0  T
   7     -8.0041633 -0.910019E-05  0.241E-02    2.17       1.9  T
   8     -8.0041647 -0.135632E-05  0.378E-03    2.17      11.8  T
   9     -8.0041647 -0.641420E-08  0.108E-03    2.17      41.3  T
  10     -8.0041647 -0.439050E-09  0.446E-04    2.17     100.2  T
  11     -8.0041647 -0.403377E-09  0.891E-05    2.17     501.8  T
     SCC iter.                  ...        0 min,  0.001 sec
     gradient                   ...        0 min,  0.001 sec
 * total energy  :    -7.9301661 Eh     change       -0.1216866E-01 Eh
   gradient norm :     0.0867220 Eh/α   predicted    -0.1446198E-01 (  18.85%)
   displ. norm   :     0.5153084 α      lambda       -0.2475449E-01
   maximum displ.:     0.3782290 α      in ANC's #3, #1, #6, ...

........................................................................
.............................. CYCLE    5 ..............................
........................................................................
   1     -8.0163440 -0.801634E+01  0.356E+00    1.34       0.0  T
   2     -8.0195325 -0.318847E-02  0.183E+00    1.62       1.0  T
   3     -8.0188617  0.670762E-03  0.940E-01    1.38       1.0  T
   4     -8.0193795 -0.517721E-03  0.429E-01    1.62       1.0  T
   5     -8.0205590 -0.117958E-02  0.132E-01    1.52       1.0  T
   6     -8.0205954 -0.363548E-04  0.399E-02    1.52       1.1  T
   7     -8.0205973 -0.188296E-05  0.554E-03    1.52       8.1  T
   8     -8.0205973 -0.390848E-07  0.237E-03    1.52      18.9  T
   9     -8.0205973 -0.409527E-08  0.160E-04    1.52     278.9  T
  10     -8.0205973  0.104805E-11  0.723E-05    1.52     618.8  T
     SCC iter.                  ...        0 min,  0.001 sec
     gradient                   ...        0 min,  0.001 sec
 * total energy  :    -7.9546280 Eh     change       -0.2446191E-01 Eh
   gradient norm :     0.1276670 Eh/α   predicted    -0.1566392E-01 ( -35.97%)
   displ. norm   :     0.7751616 α      lambda       -0.5244049E-01
   maximum displ.:     0.5086688 α      in ANC's #3, #1, #5, ...

........................................................................
.............................. CYCLE    6 ..............................
........................................................................
   1     -8.0178789 -0.801788E+01  0.692E+00    2.53       0.0  T
   2     -8.0342203 -0.163414E-01  0.426E+00    2.03       1.0  T
   3     -8.0690583 -0.348380E-01  0.315E+00    1.95       1.0  T
   4     -8.0851453 -0.160870E-01  0.139E+00    2.27       1.0  T
   5     -8.0955817 -0.104364E-01  0.259E-01    1.91       1.0  T
   6     -8.0956497 -0.679949E-04  0.764E-02    1.93       1.0  T
   7     -8.0956603 -0.106275E-04  0.251E-02    1.93       1.8  T
   8     -8.0956607 -0.380440E-06  0.776E-03    1.93       5.8  T
   9     -8.0956608 -0.993918E-07  0.208E-03    1.93      21.5  T
  10     -8.0956608 -0.140602E-07  0.209E-04    1.93     214.5  T
  11     -8.0956608 -0.653522E-11  0.571E-05    1.93     782.7  T
     SCC iter.                  ...        0 min,  0.001 sec
     gradient                   ...        0 min,  0.001 sec
 * total energy  :    -7.9785100 Eh     change       -0.2388208E-01 Eh
   gradient norm :     0.1347616 Eh/α   predicted    -0.4197540E-01 (  75.76%)
   displ. norm   :     0.4468691 α      lambda       -0.3573069E-01
   maximum displ.:     0.3142578 α      in ANC's #2, #3, #1, ...

........................................................................
.............................. CYCLE    7 ..............................
........................................................................
   1     -8.0482359 -0.804824E+01  0.381E+00    0.67       0.0  T
   2     -7.9381585  0.110077E+00  0.525E+00    0.77       1.0  T
   3     -8.0499381 -0.111780E+00  0.254E+00    1.24       1.0  T
   4     -8.0730205 -0.230824E-01  0.138E+00    0.73       1.0  T
   5     -8.0759981 -0.297756E-02  0.735E-01    0.64       1.0  T
   6     -8.0773813 -0.138326E-02  0.184E-01    0.58       1.0  T
   7     -8.0774487 -0.673454E-04  0.720E-02    0.54       1.0  T
   8     -8.0774633 -0.146660E-04  0.191E-02    0.54       2.3  T
   9     -8.0774643 -0.936368E-06  0.912E-03    0.54       4.9  T
  10     -8.0774645 -0.214929E-06  0.115E-03    0.54      39.0  T
  11     -8.0774645  0.268587E-08  0.118E-03    0.54      37.8  T
  12     -8.0774645 -0.427455E-08  0.174E-04    0.54     256.6  T
  13     -8.0774645 -0.897167E-10  0.478E-05    0.54     935.5  T
     SCC iter.                  ...        0 min,  0.001 sec
     gradient                   ...        0 min,  0.001 sec
 * total energy  :    -7.9823690 Eh     change       -0.3859004E-02 Eh
   gradient norm :     0.1091120 Eh/α   predicted    -0.2143291E-01 ( 455.40%)
   displ. norm   :     0.3332709 α      lambda       -0.1975158E-01
   maximum displ.:     0.2106566 α      in ANC's #3, #2, #4, ...

........................................................................
.............................. CYCLE    8 ..............................
........................................................................
   1     -8.0722082 -0.807221E+01  0.245E+00    1.65       0.0  T
   2     -8.0597230  0.124852E-01  0.213E+00    1.92       1.0  T
   3     -8.0822804 -0.225574E-01  0.113E+00    1.54       1.0  T
   4     -8.0853075 -0.302712E-02  0.203E-01    1.65       1.0  T
   5     -8.0854422 -0.134726E-03  0.661E-02    1.60       1.0  T
   6     -8.0854464 -0.416108E-05  0.160E-02    1.61       2.8  T
   7     -8.0854466 -0.181679E-06  0.596E-03    1.60       7.5  T
   8     -8.0854466 -0.561223E-07  0.192E-03    1.60      23.3  T
   9     -8.0854466 -0.370481E-08  0.145E-04    1.60     308.1  T
  10     -8.0854466 -0.160867E-10  0.757E-05    1.60     590.9  T
     SCC iter.                  ...        0 min,  0.001 sec
     gradient                   ...        0 min,  0.001 sec
 * total energy  :    -7.9925942 Eh     change       -0.1022516E-01 Eh
   gradient norm :     0.0629213 Eh/α   predicted    -0.1097268E-01 (   7.31%)
   displ. norm   :     0.2807179 α      lambda       -0.1378602E-01
   maximum displ.:     0.1760315 α      in ANC's #2, #4, #7, ...

........................................................................
.............................. CYCLE    9 ..............................
........................................................................
   1     -8.1232707 -0.812327E+01  0.133E+00    2.61       0.0  T
   2     -8.1230246  0.246090E-03  0.903E-01    2.65       1.0  T
   3     -8.1243105 -0.128592E-02  0.609E-01    2.57       1.0  T
   4     -8.1251822 -0.871751E-03  0.107E-01    2.62       1.0  T
   5     -8.1252194 -0.372107E-04  0.515E-02    2.59       1.0  T
   6     -8.1252209 -0.150090E-05  0.129E-02    2.60       3.5  T
   7     -8.1252211 -0.179966E-06  0.319E-03    2.60      14.0  T
   8     -8.1252211 -0.889192E-08  0.137E-03    2.60      32.8  T
   9     -8.1252211 -0.239473E-08  0.100E-04    2.60     445.6  T
  10     -8.1252211 -0.169287E-11  0.989E-06    2.60    4523.2  T
     SCC iter.                  ...        0 min,  0.001 sec
     gradient                   ...        0 min,  0.001 sec
 * total energy  :    -7.9932670 Eh     change       -0.6727576E-03 Eh
   gradient norm :     0.1259493 Eh/α   predicted    -0.7436200E-02 (1005.33%)
   displ. norm   :     0.1470583 α      lambda       -0.1111591E-01
   maximum displ.:     0.0887794 α      in ANC's #1, #2, #3, ...

........................................................................
.............................. CYCLE   10 ..............................
........................................................................
   1     -8.1077988 -0.810780E+01  0.130E+00    1.91       0.0  T
   2     -8.1057940  0.200487E-02  0.990E-01    1.86       1.0  T
   3     -8.1098106 -0.401661E-02  0.622E-01    1.98       1.0  T
   4     -8.1108009 -0.990299E-03  0.149E-01    1.88       1.0  T
   5     -8.1108499 -0.490224E-04  0.321E-02    1.91       1.4  T
   6     -8.1108506 -0.709585E-06  0.764E-03    1.91       5.9  T
   7     -8.1108507 -0.695858E-07  0.234E-03    1.91      19.1  T
   8     -8.1108507 -0.722964E-08  0.742E-04    1.91      60.3  T
   9     -8.1108507 -0.505777E-09  0.705E-05    1.91     634.8  T
     SCC iter.                  ...        0 min,  0.001 sec
     gradient                   ...        0 min,  0.001 sec
 * total energy  :    -7.9988431 Eh     change       -0.5576162E-02 Eh
   gradient norm :     0.0429928 Eh/α   predicted    -0.5678151E-02 (   1.83%)
   displ. norm   :     0.2586371 α      lambda       -0.4799738E-02
   maximum displ.:     0.1912291 α      in ANC's #1, #2, #3, ...

........................................................................
.............................. CYCLE   11 ..............................
........................................................................
   1     -8.1064629 -0.810646E+01  0.112E+00    2.28       0.0  T
   2     -8.1051077  0.135524E-02  0.876E-01    2.44       1.0  T
   3     -8.1085514 -0.344364E-02  0.465E-01    2.31       1.0  T
   4     -8.1089512 -0.399898E-03  0.355E-02    2.33       1.3  T
   5     -8.1089513 -0.485790E-07  0.106E-02    2.33       4.2  T
   6     -8.1089516 -0.287182E-06  0.369E-03    2.33      12.1  T
   7     -8.1089516 -0.141534E-07  0.179E-03    2.33      25.1  T
   8     -8.1089516 -0.392313E-08  0.398E-04    2.33     112.4  T
   9     -8.1089516 -0.169909E-09  0.644E-05    2.33     693.9  T
     SCC iter.                  ...        0 min,  0.001 sec
     gradient                   ...        0 min,  0.001 sec
 * total energy  :    -7.9991756 Eh     change       -0.3325156E-03 Eh
   gradient norm :     0.0470637 Eh/α   predicted    -0.2560404E-02 ( 670.01%)
   displ. norm   :     0.2508387 α      lambda       -0.6639016E-02
   maximum displ.:     0.1349213 α      in ANC's #5, #1, #7, ...

........................................................................
.............................. CYCLE   12 ..............................
........................................................................
   1     -8.1086216 -0.810862E+01  0.940E-01    2.50       0.0  T
   2     -8.1087187 -0.971642E-04  0.538E-01    2.52       1.0  T
   3     -8.1081713  0.547386E-03  0.429E-01    2.54       1.0  T
   4     -8.1089080 -0.736623E-03  0.805E-02    2.50       1.0  T
   5     -8.1089340 -0.260703E-04  0.253E-02    2.52       1.8  T
   6     -8.1089343 -0.275191E-06  0.434E-03    2.52      10.3  T
   7     -8.1089343 -0.127033E-07  0.669E-04    2.52      66.8  T
   8     -8.1089343 -0.282991E-09  0.297E-04    2.52     150.6  T
     SCC iter.                  ...        0 min,  0.001 sec
     gradient                   ...        0 min,  0.001 sec
 * total energy  :    -8.0034350 Eh     change       -0.4259371E-02 Eh
   gradient norm :     0.0402274 Eh/α   predicted    -0.3528372E-02 ( -17.16%)
   displ. norm   :     0.3369593 α      lambda       -0.7596640E-02
   maximum displ.:     0.1648066 α      in ANC's #2, #7, #3, ...

........................................................................
.............................. CYCLE   13 ..............................
........................................................................
   1     -8.1097877 -0.810979E+01  0.128E+00    2.73       0.0  T
   2     -8.1098933 -0.105517E-03  0.705E-01    2.74       1.0  T
   3     -8.1087091  0.118421E-02  0.641E-01    2.78       1.0  T
   4     -8.1103274 -0.161831E-02  0.904E-02    2.73       1.0  T
   5     -8.1103486 -0.212602E-04  0.447E-02    2.75       1.0  T
   6     -8.1103499 -0.131797E-05  0.484E-03    2.74       9.2  T
   7     -8.1103500 -0.426227E-07  0.158E-03    2.74      28.3  T
   8     -8.1103500 -0.640203E-09  0.402E-04    2.74     111.3  T
   9     -8.1103500 -0.781810E-10  0.109E-04    2.74     408.9  T
     SCC iter.                  ...        0 min,  0.001 sec
     gradient                   ...        0 min,  0.001 sec
 * total energy  :    -8.0058423 Eh     change       -0.2407247E-02 Eh
   gradient norm :     0.0588347 Eh/α   predicted    -0.4229584E-02 (  75.70%)
   displ. norm   :     0.0834140 α      lambda       -0.3418692E-02
   maximum displ.:     0.0515677 α      in ANC's #4, #6, #3, ...

........................................................................
.............................. CYCLE   14 ..............................
........................................................................
   1     -8.1171659 -0.811717E+01  0.599E-01    2.82       0.0  T
   2     -8.1170321  0.133804E-03  0.357E-01    2.85       1.0  T
   3     -8.1172879 -0.255828E-03  0.313E-01    2.80       1.0  T
   4     -8.1175376 -0.249708E-03  0.338E-02    2.83       1.3  T
   5     -8.1175405 -0.284803E-05  0.139E-02    2.82       3.2  T
   6     -8.1175405 -0.573826E-07  0.190E-03    2.82      23.5  T
   7     -8.1175405 -0.187688E-08  0.693E-04    2.82      64.5  T
   8     -8.1175405 -0.794351E-10  0.219E-04    2.82     203.8  T
     SCC iter.                  ...        0 min,  0.001 sec
     gradient                   ...        0 min,  0.001 sec
 * total energy  :    -8.0078260 Eh     change       -0.1983756E-02 Eh
   gradient norm :     0.0241353 Eh/α   predicted    -0.1721238E-02 ( -13.23%)
   displ. norm   :     0.0570830 α      lambda       -0.8836200E-03
   maximum displ.:     0.0330092 α      in ANC's #9, #1, #2, ...

........................................................................
.............................. CYCLE   15 ..............................
........................................................................
   1     -8.1192836 -0.811928E+01  0.440E-01    2.89       0.0  T
   2     -8.1192234  0.602069E-04  0.269E-01    2.91       1.0  T
   3     -8.1193109 -0.875657E-04  0.228E-01    2.88       1.0  T
   4     -8.1194511 -0.140183E-03  0.210E-02    2.90       2.1  T
   5     -8.1194525 -0.140153E-05  0.820E-03    2.90       5.5  T
   6     -8.1194526 -0.247435E-07  0.136E-03    2.90      32.9  T
   7     -8.1194526 -0.110563E-08  0.620E-04    2.90      72.1  T
   8     -8.1194526 -0.405143E-09  0.180E-04    2.90     249.0  T
     SCC iter.                  ...        0 min,  0.000 sec
     gradient                   ...        0 min,  0.001 sec
 * total energy  :    -8.0084134 Eh     change       -0.5873829E-03 Eh
   gradient norm :     0.0160125 Eh/α   predicted    -0.4432485E-03 ( -24.54%)
   displ. norm   :     0.0391282 α      lambda       -0.4521633E-03
   maximum displ.:     0.0262556 α      in ANC's #9, #2, #5, ...

........................................................................
.............................. CYCLE   16 ..............................
........................................................................
   1     -8.1200405 -0.812004E+01  0.239E-01    2.90       0.0  T
   2     -8.1200294  0.110406E-04  0.145E-01    2.90       1.0  T
   3     -8.1200375 -0.802177E-05  0.126E-01    2.89       1.0  T
   4     -8.1200815 -0.440179E-04  0.175E-02    2.90       2.6  T
   5     -8.1200826 -0.117588E-05  0.470E-03    2.89       9.5  T
   6     -8.1200827 -0.102735E-07  0.111E-03    2.89      40.5  T
   7     -8.1200827 -0.984777E-09  0.353E-04    2.89     126.7  T
   8     -8.1200827 -0.121995E-09  0.112E-04    2.89     400.6  T
     SCC iter.                  ...        0 min,  0.000 sec
     gradient                   ...        0 min,  0.001 sec
 * total energy  :    -8.0087071 Eh     change       -0.2936803E-03 Eh
   gradient norm :     0.0104891 Eh/α   predicted    -0.2264279E-03 ( -22.90%)
   displ. norm   :     0.0409086 α      lambda       -0.2346722E-03
   maximum displ.:     0.0202080 α      in ANC's #2, #7, #4, ...

........................................................................
.............................. CYCLE   17 ..............................
........................................................................
   1     -8.1171081 -0.811711E+01  0.183E-01    2.94       0.0  T
   2     -8.1171162 -0.814126E-05  0.102E-01    2.93       1.0  T
   3     -8.1171065  0.974619E-05  0.821E-02    2.93       1.0  T
   4     -8.1171223 -0.157956E-04  0.256E-02    2.94       1.7  T
   5     -8.1171255 -0.328825E-05  0.596E-03    2.93       7.5  T
   6     -8.1171255 -0.487000E-08  0.128E-03    2.93      34.9  T
   7     -8.1171255 -0.170179E-08  0.431E-04    2.93     103.8  T
   8     -8.1171255 -0.244656E-09  0.156E-04    2.93     286.4  T
     SCC iter.                  ...        0 min,  0.000 sec
     gradient                   ...        0 min,  0.001 sec
 * total energy  :    -8.0088071 Eh     change       -0.1000675E-03 Eh
   gradient norm :     0.0064929 Eh/α   predicted    -0.1175323E-03 (  17.45%)
   displ. norm   :     0.0323131 α      lambda       -0.1160288E-03
   maximum displ.:     0.0268000 α      in ANC's #5, #7, #8, ...

........................................................................
.............................. CYCLE   18 ..............................
........................................................................
   1     -8.1181231 -0.811812E+01  0.146E-01    2.86       0.0  T
   2     -8.1181263 -0.321474E-05  0.793E-02    2.86       1.0  T
   3     -8.1181259  0.486784E-06  0.242E-02    2.86       1.8  T
   4     -8.1181274 -0.150285E-05  0.681E-03    2.86       6.6  T
   5     -8.1181273  0.338411E-07  0.537E-03    2.86       8.3  T
   6     -8.1181274 -0.117051E-06  0.869E-04    2.86      51.4  T
   7     -8.1181274 -0.571017E-09  0.120E-04    2.86     373.5  T
     SCC iter.                  ...        0 min,  0.000 sec
     gradient                   ...        0 min,  0.001 sec
 * total energy  :    -8.0088400 Eh     change       -0.3283133E-04 Eh
   gradient norm :     0.0035227 Eh/α   predicted    -0.5807650E-04 (  76.89%)
   displ. norm   :     0.0138604 α      lambda       -0.3789944E-04
   maximum displ.:     0.0082394 α      in ANC's #5, #7, #6, ...

........................................................................
.............................. CYCLE   19 ..............................
........................................................................
   1     -8.1181912 -0.811819E+01  0.595E-02    2.88       0.0  T
   2     -8.1181911  0.516798E-07  0.361E-02    2.88       1.2  T
   3     -8.1181889  0.224028E-05  0.305E-02    2.89       1.5  T
   4     -8.1181924 -0.354546E-05  0.493E-03    2.88       9.1  T
   5     -8.1181925 -0.808204E-07  0.177E-03    2.88      25.2  T
   6     -8.1181925 -0.132515E-08  0.337E-04    2.88     132.7  T
   7     -8.1181925 -0.110747E-09  0.106E-04    2.88     421.0  T
     SCC iter.                  ...        0 min,  0.000 sec
     gradient                   ...        0 min,  0.001 sec
 * total energy  :    -8.0088639 Eh     change       -0.2391574E-04 Eh
   gradient norm :     0.0019101 Eh/α   predicted    -0.1895382E-04 ( -20.75%)
   displ. norm   :     0.0168250 α      lambda       -0.1270515E-04
   maximum displ.:     0.0100621 α      in ANC's #6, #2, #7, ...

........................................................................
.............................. CYCLE   20 ..............................
........................................................................
   1     -8.1182202 -0.811822E+01  0.456E-02    2.89       0.0  T
   2     -8.1182203 -0.964724E-07  0.268E-02    2.89       1.7  T
   3     -8.1182195  0.866186E-06  0.140E-02    2.90       3.2  T
   4     -8.1182204 -0.970200E-06  0.278E-03    2.89      16.1  T
   5     -8.1182205 -0.152230E-07  0.130E-03    2.89      34.3  T
   6     -8.1182205 -0.138311E-08  0.132E-04    2.89     338.1  T
   7     -8.1182205 -0.719247E-11  0.359E-05    2.89    1246.6  T
     SCC iter.                  ...        0 min,  0.000 sec
     gradient                   ...        0 min,  0.001 sec
 * total energy  :    -8.0088752 Eh     change       -0.1128567E-04 Eh
   gradient norm :     0.0018062 Eh/α   predicted    -0.6355480E-05 ( -43.69%)
   displ. norm   :     0.0108162 α      lambda       -0.5935516E-05
   maximum displ.:     0.0077790 α      in ANC's #6, #2, #7, ...
 * RMSD in coord.:     0.8879538 α      energy gain  -0.1385173E+00 Eh

generating ANC from model Hessian ...
Using Lindh-Hessian (1995)
 Shifting diagonal of input Hessian by    0.0000000000000000     
 Lowest  eigenvalues of input Hessian
   -0.000000   -0.000000   -0.000000   -0.000000    0.000000    0.000000
    0.057216    0.123563    0.251413    0.396895    0.470458    0.801618
    1.183076    1.534792    2.135286
 Highest eigenvalues
    0.396895    0.470458    0.801618    1.183076    1.534792    2.135286


........................................................................
.............................. CYCLE   21 ..............................
........................................................................
   1     -8.1184760 -0.811848E+01  0.260E-02    2.89       0.0  T
   2     -8.1184759  0.534936E-07  0.162E-02    2.89       2.8  T
   3     -8.1184754  0.593058E-06  0.146E-02    2.89       3.1  T
   4     -8.1184762 -0.851761E-06  0.134E-03    2.89      33.4  T
   5     -8.1184762 -0.360599E-09  0.741E-04    2.89      60.4  T
   6     -8.1184762 -0.846043E-09  0.135E-04    2.89     330.5  T
     SCC iter.                  ...        0 min,  0.001 sec
     gradient                   ...        0 min,  0.001 sec
 * total energy  :    -8.0088806 Eh     change       -0.5452446E-05 Eh
   gradient norm :     0.0008177 Eh/α   predicted     0.0000000E+00 (-100.00%)
   displ. norm   :     0.0045270 α      lambda       -0.1322560E-05
   maximum displ.:     0.0033240 α      in ANC's #2, #1, #3, ...

........................................................................
.............................. CYCLE   22 ..............................
........................................................................
   1     -8.1183995 -0.811840E+01  0.136E-02    2.88       0.0  T
   2     -8.1183995  0.646767E-08  0.871E-03    2.88       5.1  T
   3     -8.1183993  0.204430E-06  0.759E-03    2.88       5.9  T
   4     -8.1183996 -0.255718E-06  0.801E-04    2.88      55.8  T
   5     -8.1183996 -0.986903E-09  0.476E-04    2.88      93.9  T
     SCC iter.                  ...        0 min,  0.000 sec
     gradient                   ...        0 min,  0.001 sec
 * total energy  :    -8.0088816 Eh     change       -0.1012527E-05 Eh
   gradient norm :     0.0002367 Eh/α   predicted    -0.6625625E-06 ( -34.56%)
   displ. norm   :     0.0010156 α      lambda       -0.8825053E-07
   maximum displ.:     0.0006021 α      in ANC's #3, #2, #1, ...

   *** GEOMETRY OPTIMIZATION CONVERGED AFTER 22 ITERATIONS ***

------------------------------------------------------------------------
 total energy gain   :        -0.1385237 Eh      -86.9250 kcal/mol
 total RMSD          :         0.8891218 a0        0.4705 Å
 total power (kW/mol):       -16.5315478 (step)-7789.2331 (real)
------------------------------------------------------------------------

 ANCopt (total)                0 d,  0 h,  0 min,  0.047 sec
 optimizer setup                ...        0 min,  0.000 sec (  0.146%)
 model hessian                  ...        0 min,  0.000 sec (  0.356%)
 ANC generation                 ...        0 min,  0.000 sec (  0.227%)
 coordinate transformation      ...        0 min,  0.000 sec (  0.102%)
 single point calculation       ...        0 min,  0.045 sec ( 95.419%)
 optimization log               ...        0 min,  0.001 sec (  1.199%)
 hessian update                 ...        0 min,  0.000 sec (  0.118%)
 rational function              ...        0 min,  0.001 sec (  1.136%)

================
 final structure:
================
5
 xtb: 6.2.2 (9d81278992624c895f80dd42a50cac0aa55982e2)
N        -0.57113554425667   -0.43725509689261    0.21669237479856
C         0.57151089607869    0.31553376747492    0.07875565951782
C        -0.55336486644383    1.02465100037023    0.35842259968805
H        -1.03017736205354   -0.99865806248733   -0.48863367799882
H         1.58316687667535    0.09572839153479   -0.16523695600560

 Bond Distances (Angstroems)
 ---------------------------
N1-C2=1.3753         N1-C3=1.4689         N1-H4=1.0116         C2-N1=1.3753         C2-C3=1.3588         C2-H5=1.0636         
C3-N1=1.4689         C3-C2=1.3588         H4-N1=1.0116         H5-C2=1.0636         
 C  H  Rav=1.0636 sigma=0.0000  Rmin=1.0636  Rmax=1.0636     1
 C  C  Rav=1.3588 sigma=0.0000  Rmin=1.3588  Rmax=1.3588     1
 N  H  Rav=1.0116 sigma=0.0000  Rmin=1.0116  Rmax=1.0116     1
 N  C  Rav=1.4221 sigma=0.0468  Rmin=1.3753  Rmax=1.4689     2

 selected bond angles (degree)
 --------------------
C3-N1-C2= 56.96                H4-N1-C2=127.65                H4-N1-C3=128.69                C3-C2-N1= 64.99                
H5-C2-N1=134.44                H5-C2-C3=160.47                C2-C3-N1= 58.05                

 selected dihedral angles (degree)
 ---------------------------------
C3-C2-N1-H4=116.11            H5-C2-N1-C3=182.51            H5-C2-N1-H4=298.61            C2-C3-N1-H4=245.62            
N1-C3-C2-H5=174.64            
           -------------------------------------------------
          |                Final Singlepoint                |
           -------------------------------------------------

          ...................................................
          :                      SETUP                      :
          :.................................................:
          :  # basis functions                  14          :
          :  # atomic orbitals                  14          :
          :  # shells                            8          :
          :  # electrons                        15          :
          :  max. iterations                   250          :
          :  Hamiltonian                  GFN2-xTB          :
          :  restarted?                      false          :
          :  GBSA solvation                  false          :
          :  PC potential                    false          :
          :  electronic temp.          300.0000000     K    :
          :  accuracy                    1.0000000          :
          :  -> integral cutoff          0.2500000E+02      :
          :  -> integral neglect         0.1000000E-07      :
          :  -> SCF convergence          0.1000000E-05 Eh   :
          :  -> wf. convergence          0.1000000E-03 e    :
          :  Broyden damping             0.4000000          :
          ...................................................

 iter      E             dE          RMSdq      gap      omega  full diag
   1     -8.1183996 -0.811840E+01  0.102E-04    2.88       0.0  T
   2     -8.1183996 -0.367706E-12  0.610E-05    2.88     733.1  T
   3     -8.1183996  0.413891E-11  0.297E-05    2.88    1504.8  T

   *** convergence criteria satisfied after 3 iterations ***

         #    Occupation            Energy/Eh            Energy/eV
      -------------------------------------------------------------
         1        2.0000           -0.6922359             -18.8367
         2        2.0000           -0.6029262             -16.4065
         3        2.0000           -0.5806533             -15.8004
         4        2.0000           -0.5354393             -14.5700
         5        2.0000           -0.4990620             -13.5802
         6        2.0000           -0.4612682             -12.5517
         7        2.0000           -0.4006070             -10.9011
         8        1.0000           -0.3470387              -9.4434 (HOMO)
         9                         -0.2410843              -6.5602 (LUMO)
        10                         -0.0602044              -1.6382
        11                          0.0281673               0.7665
        12                          0.1091035               2.9689
        13                          0.2620432               7.1306
        14                          0.6528373              17.7646
      -------------------------------------------------------------
                  HL-Gap            0.1059543 Eh            2.8832 eV
             Fermi-level           -0.3339422 Eh           -9.0870 eV

 SCC (total)                   0 d,  0 h,  0 min,  0.002 sec
 SCC setup                      ...        0 min,  0.000 sec (  4.086%)
 Dispersion                     ...        0 min,  0.000 sec (  0.507%)
 integral evaluation            ...        0 min,  0.001 sec ( 38.360%)
 zeroth order Hamiltonian       ...        0 min,  0.000 sec (  0.562%)
 iterations                     ...        0 min,  0.000 sec ( 12.819%)
 molecular gradient             ...        0 min,  0.001 sec ( 40.143%)
 printout                       ...        0 min,  0.000 sec (  2.989%)

         :::::::::::::::::::::::::::::::::::::::::::::::::::::
         ::                     SUMMARY                     ::
         :::::::::::::::::::::::::::::::::::::::::::::::::::::
         :: total energy              -8.008881643674 Eh    ::
         :: gradient norm              0.000236548971 Eh/a0 ::
         :: HOMO-LUMO gap              2.883164031184 eV    ::
         ::.................................................::
         :: SCC energy                -8.118399560214 Eh    ::
         :: -> isotropic ES           -0.002598983175 Eh    ::
         :: -> anisotropic ES          0.001161188374 Eh    ::
         :: -> anisotropic XC          0.007703809653 Eh    ::
         :: -> dispersion             -0.001517640542 Eh    ::
         :: repulsion energy           0.109517885193 Eh    ::
         :: add. restraining           0.000000000000 Eh    ::
         :::::::::::::::::::::::::::::::::::::::::::::::::::::

           ------------------------------------------------- 
          |                Numerical Hessian                |
           ------------------------------------------------- 
step length          :   0.00500
SCC accuracy         :   0.30000
Hessian scale factor :   1.00000
frozen atoms in %    :   0.00000    0
RMS gradient         :   0.00024
estimated CPU  time      0.00 min
estimated wall time      0.00 min

writing file <hessian>.

 projected vibrational frequencies (cm-1)
eigval :       -0.00    -0.00    -0.00    -0.00     0.00     0.00
eigval :      601.51   747.64   827.44   905.17   940.47  1235.70
eigval :     1604.73  3215.24  3320.45
           -------------------------------------------------
          |                Property Printout                |
           -------------------------------------------------

    * Orbital Energies and Occupations

         #    Occupation            Energy/Eh            Energy/eV
      -------------------------------------------------------------
         1        2.0000           -0.6922359             -18.8367
         2        2.0000           -0.6029262             -16.4065
         3        2.0000           -0.5806533             -15.8004
         4        2.0000           -0.5354393             -14.5700
         5        2.0000           -0.4990620             -13.5802
         6        2.0000           -0.4612682             -12.5517
         7        2.0000           -0.4006072             -10.9011
         8        1.0000           -0.3470387              -9.4434 (HOMO)
         9                         -0.2410845              -6.5602 (LUMO)
        10                         -0.0602045              -1.6382
        11                          0.0281673               0.7665
        12                          0.1091035               2.9689
        13                          0.2620432               7.1306
        14                          0.6528373              17.7646
      -------------------------------------------------------------
                  HL-Gap            0.1059542 Eh            2.8832 eV
             Fermi-level           -0.3339423 Eh           -9.0870 eV

     #   Z        covCN         q      C6AA      α(0)
     1   7 N      2.676    -0.127    23.756     7.239
     2   6 C      2.817     0.068    26.462     8.428
     3   6 C      1.887    -0.146    35.243     9.588
     4   1 H      0.860     0.155     1.368     1.832
     5   1 H      0.927     0.049     2.331     2.387

 Mol. C6AA /au·bohr⁶  :        347.073481
 Mol. C8AA /au·bohr⁸  :       8420.011798
 Mol. α(0) /au        :         29.474939


Wiberg/Mayer (AO) data.
largest (>0.10) Wiberg bond orders for each atom
          total WBO             WBO to atom ...
     1  N   3.022        C    2 1.137    C    3 0.956    H    4 0.920
     2  C   3.585        C    3 1.482    N    1 1.137    H    5 0.961
     3  C   2.477        C    2 1.482    N    1 0.956
     4  H   0.936        N    1 0.920
     5  H   0.997        C    2 0.961

MOs/occ written to file <molden.input>


molecular dipole:
                 x           y           z       tot (Debye)
 q only:        0.208      -0.420      -0.299
   full:        0.538      -0.991      -0.675       3.340
molecular quadrupole (traceless):
                xx          xy          yy          xz          yz          zz
 q only:        0.801       1.232      -0.479       0.604       0.188      -0.322
  q+dip:        2.412       2.128      -2.370       1.190       0.138      -0.042
   full:        1.420       2.652      -2.596       1.641      -0.269       1.175

           -------------------------------------------------
          |                Geometry Summary                 |
           -------------------------------------------------

      molecular mass/u    :       40.0440565
   center of mass at/Å    :       -0.1804094       0.2263021       0.1904633
  moments of inertia/u·Å² :        0.1427521E+02   0.1716548E+02   0.3056096E+02
Molecule has no symmetry elements
It seems to be the C1 point group
rotational constants/cm⁻¹ :        0.1180903E+01   0.9820660E+00   0.5516067E+00

 * 4 selected distances

     #   Z        #   Z                                     value/Å
     1   7 N      2   6 C                                 1.3752667 (max)
     2   6 C      3   6 C                                 1.3588253
     1   7 N      4   1 H                                 1.0116212 (min)
     2   6 C      5   1 H                                 1.0636233

 * 4 distinct bonds (by element types)

   Z      Z             #   av. dist./Å        max./Å        min./Å
   1 H    6 C           1     1.0636233     1.0636233     1.0636233
   6 C    6 C           1     1.3588253     1.3588253     1.3588253
   1 H    7 N           1     1.0116212     1.0116212     1.0116212
   6 C    7 N           1     1.3752667     1.3752667     1.3752667

           -------------------------------------------------
          |               Frequency Printout                |
           -------------------------------------------------
 projected vibrational frequencies (cm-1)
eigval :       -0.00    -0.00    -0.00    -0.00     0.00     0.00
eigval :      601.51   747.64   827.44   905.17   940.47  1235.70
eigval :     1604.73  3215.24  3320.45
 reduced masses (amu)
   1:  9.00   2: 11.79   3: 11.81   4: 10.42   5: 12.32   6: 12.20   7:  3.57   8:  9.05
   9:  4.78  10:  2.01  11:  5.13  12: 12.55  13: 11.65  14:  2.01  15:  1.84
 IR intensities (amu)
   1:  0.26   2:  0.14   3:  0.35   4:  0.23   5:  0.06   6:  0.08   7:  0.05   8:  0.19
   9:  0.38  10:  0.24  11:  0.23  12:  0.40  13:  0.41  14:  0.14  15:  0.04
 Raman intensities (amu)
   1:  0.00   2:  0.00   3:  0.00   4:  0.00   5:  0.00   6:  0.00   7:  0.00   8:  0.00
   9:  0.00  10:  0.00  11:  0.00  12:  0.00  13:  0.00  14:  0.00  15:  0.00
 output can be read by thermo (or use thermo option).
 writing <g98.out> molden fake output.
 recommended (thermochemical) frequency scaling factor: 1.0
           -------------------------------------------------
          |             Thermodynamic Functions             |
           -------------------------------------------------

c1  symmetry found (for desy threshold:  0.10E+00) used in thermo

          ...................................................
          :                      SETUP                      :
          :.................................................:
          :  # frequencies                           9      :
          :  # imaginary freq.                       0      :
          :  linear?                             false      :
          :  only rotor calc.                    false      :
          :  symmetry                               c1      :
          :  rotational number                       1      :
          :  scaling factor                  1.0000000      :
          :  rotor cutoff                   50.0000000 cm⁻¹ :
          :  imag. cutoff                  -20.0000000 cm⁻¹ :
          :.................................................:

    mode    ω/cm⁻¹     T·S(HO)/kcal·mol⁻¹    T·S(FR)/kcal·mol⁻¹   T·S(vib)
   ------------------------------------------------------------------------
   ------------------------------------------------------------------------

   temp. (K)  partition function   enthalpy   heat capacity  entropy
                                   cal/mol     cal/K/mol   cal/K/mol   J/K/mol
 298.15  VIB   1.14                  277.265      3.551      1.186
         ROT  0.661E+04              888.752      2.981     20.462
         INT  0.752E+04             1166.018      6.532     21.648
         TR   0.245E+27             1481.254      4.968     36.973
         TOT                        2647.2715    11.4998    58.6214   245.2720

   temp. (K)  partition function   enthalpy   heat capacity  entropy
                                   cal/mol     cal/K/mol   cal/K/mol   J/K/mol
 120.00  VIB   1.00                    1.745      0.114      0.016
         ROT  0.169E+04              357.707      2.981     17.749
         INT  0.169E+04              359.452      3.095     17.765
         TR   0.626E+26              596.178      4.968     32.454
         TOT                         955.6296     8.0633    50.2191   210.1167

   temp. (K)  partition function   enthalpy   heat capacity  entropy
                                   cal/mol     cal/K/mol   cal/K/mol   J/K/mol
 100.00  VIB   1.00                    0.371      0.034      0.004
         ROT  0.128E+04              298.089      2.981     17.205
         INT  0.128E+04              298.460      3.015     17.209
         TR   0.476E+26              496.815      4.968     31.549
         TOT                         795.2748     7.9830    48.7579   204.0032

   temp. (K)  partition function   enthalpy   heat capacity  entropy
                                   cal/mol     cal/K/mol   cal/K/mol   J/K/mol
  80.00  VIB   1.00                    0.039      0.005      0.000
         ROT   919.                  238.471      2.981     16.540
         INT   919.                  238.510      2.986     16.541
         TR   0.341E+26              397.452      4.968     30.440
         TOT                         635.9619     7.9544    46.9811   196.5689

   temp. (K)  partition function   enthalpy   heat capacity  entropy
                                   cal/mol     cal/K/mol   cal/K/mol   J/K/mol
  60.00  VIB   1.00                    0.001      0.000     -0.000
         ROT   597.                  178.853      2.981     15.683
         INT   597.                  178.854      2.981     15.683
         TR   0.221E+26              298.089      4.968     29.012
         TOT                         476.9434     7.9493    44.6945   187.0016

   temp. (K)  partition function   enthalpy   heat capacity  entropy
                                   cal/mol     cal/K/mol   cal/K/mol   J/K/mol
  40.00  VIB   1.00                    0.000      0.000     -0.000
         ROT   325.                  119.236      2.981     14.474
         INT   325.                  119.236      2.981     14.474
         TR   0.120E+26              198.726      4.968     26.999
         TOT                         317.9616     7.9490    41.4723   173.5202

   temp. (K)  partition function   enthalpy   heat capacity  entropy
                                   cal/mol     cal/K/mol   cal/K/mol   J/K/mol
  20.00  VIB   1.00                    0.000      0.000     -0.000
         ROT   115.                   59.618      2.981     12.408
         INT   115.                   59.618      2.981     12.408
         TR   0.426E+25               99.363      4.968     23.557
         TOT                         158.9808     7.9490    35.9641   150.4737

   temp. (K)  partition function   enthalpy   heat capacity  entropy
                                   cal/mol     cal/K/mol   cal/K/mol   J/K/mol
  10.00  VIB   1.00                    0.000      0.000     -0.000
         ROT   40.6                   29.809      2.981     10.342
         INT   40.6                   29.809      2.981     10.341
         TR   0.151E+25               49.681      4.968     20.115
         TOT                          79.4904     7.9490    30.4558   127.4272

       T/K    H(0)-H(T)+PV         H(T)/Eh          T*S/Eh         G(T)/Eh
   ------------------------------------------------------------------------
    298.15    0.421870E-02    0.347424E-01    0.278529E-01    0.688947E-02
    120.00    0.152289E-02    0.320466E-01    0.960351E-02    0.224431E-01
    100.00    0.126735E-02    0.317910E-01    0.777007E-02    0.240210E-01
     80.00    0.101347E-02    0.315372E-01    0.598953E-02    0.255476E-01
     60.00    0.760058E-03    0.312838E-01    0.427351E-02    0.270102E-01
     40.00    0.506704E-03    0.310304E-01    0.264361E-02    0.283868E-01
     20.00    0.253352E-03    0.307771E-01    0.114625E-02    0.296308E-01
     10.00    0.126676E-03    0.306504E-01    0.485345E-03    0.301650E-01 (used)
   ------------------------------------------------------------------------

         :::::::::::::::::::::::::::::::::::::::::::::::::::::
         ::                  THERMODYNAMIC                  ::
         :::::::::::::::::::::::::::::::::::::::::::::::::::::
         :: total free energy          -7.978716614064 Eh   ::
         ::.................................................::
         :: total energy               -8.008881643647 Eh   ::
         :: zero point energy           0.030523698214 Eh   ::
         :: G(RRHO) w/o ZPVE           -0.000358668631 Eh   ::
         :: G(RRHO) contrib.            0.030165029583 Eh   ::
         :::::::::::::::::::::::::::::::::::::::::::::::::::::

optimized geometry written to: xtbopt.xyz


           -------------------------------------------------
          | TOTAL ENERGY               -8.008881643647 Eh   |
          | TOTAL ENTHALPY             -7.978231269417 Eh   |
          | TOTAL FREE ENERGY          -7.978716614064 Eh   |
          | GRADIENT NORM               0.000236644736 Eh/α |
          | HOMO-LUMO GAP               2.883160881621 eV   |
           -------------------------------------------------

------------------------------------------------------------------------
 * finished run on 2020/05/12 at 11:44:47.128     
------------------------------------------------------------------------
 total:
 * wall-time:     0 d,  0 h,  0 min,  0.121 sec
 *  cpu-time:     0 d,  0 h,  0 min,  0.121 sec
 * ratio c/w:     0.999 speedup
 SCF:
 * wall-time:     0 d,  0 h,  0 min,  0.003 sec
 *  cpu-time:     0 d,  0 h,  0 min,  0.003 sec
 * ratio c/w:     1.000 speedup
 ANC optimizer:
 * wall-time:     0 d,  0 h,  0 min,  0.049 sec
 *  cpu-time:     0 d,  0 h,  0 min,  0.049 sec
 * ratio c/w:     0.999 speedup
 numerical hessian:
 * wall-time:     0 d,  0 h,  0 min,  0.053 sec
 *  cpu-time:     0 d,  0 h,  0 min,  0.053 sec
 * ratio c/w:     0.999 speedup

