      -----------------------------------------------------------      
     |                   =====================                   |     
     |                           x T B                           |     
     |                   =====================                   |     
     |                         S. Grimme                         |     
     |          Mulliken Center for Theoretical Chemistry        |     
     |                    University of Bonn                     |     
      -----------------------------------------------------------      

   * xtb version 6.2.2 (9d81278992624c895f80dd42a50cac0aa55982e2) compiled by '@Darwin' on 04/03/2020

   xtb is free software: you can redistribute it and/or modify it under
   the terms of the GNU Lesser General Public License as published by
   the Free Software Foundation, either version 3 of the License, or
   (at your option) any later version.
   
   xtb is distributed in the hope that it will be useful,
   but WITHOUT ANY WARRANTY; without even the implied warranty of
   MERCHANTABILITY or FITNESS FOR A PARTICULAR PURPOSE.  See the
   GNU Lesser General Public License for more details.
   
   Cite this work as:
   * S. Grimme, C. Bannwarth, P. Shushkov, J. Chem. Theory Comput., 2017,
     13, 1989-2009. DOI: 10.1021/acs.jctc.7b00118
   * C. Bannwarth, S. Ehlert and S. Grimme., J. Chem. Theory Comput., 2019,
     15, 1652-1671. DOI: 10.1021/acs.jctc.8b01176
   * P. Pracht, E. Caldeweyher, S. Ehlert, S. Grimme, ChemRxiv, 2019, preprint.
     DOI: 10.26434/chemrxiv.8326202.v1
   
   for DFT-D4:
   * E. Caldeweyher, C. Bannwarth and S. Grimme, J. Chem. Phys., 2017,
     147, 034112. DOI: 10.1063/1.4993215
   * E. Caldeweyher, S. Ehlert, A. Hansen, H. Neugebauer, S. Spicher,
     C. Bannwarth and S. Grimme, J. Chem. Phys., 2019, 150, 154122.
     DOI: 10.1063/1.5090222
   
   for sTDA-xTB:
   * S. Grimme and C. Bannwarth, J. Chem. Phys., 2016, 145, 054103.
     DOI: 10.1063/1.4959605
   
   in the mass-spec context:
   * V. Asgeirsson, C. Bauer and S. Grimme, Chem. Sci., 2017, 8, 4879.
     DOI: 10.1039/c7sc00601b
   
   for metadynamics refer to:
   * S. Grimme, J. Chem. Theory Comput., 2019, 155, 2847-2862
     DOI: 10.1021/acs.jctc.9b00143
   
   with help from (in alphabetical order)
   C. Bannwarth, F. Bohle, G. Brandenburg, E. Caldeweyher, M. Checinski,
   S. Dohm, S. Ehlert, S. Ehrlich, F. März, H. Neugebauer, J. Pisarek,
   P. Pracht, P. Shushkov, and S. Spicher.
   
 * started run on 2020/05/12 at 11:45:10.103     

           -------------------------------------------------
          |                Calculation Setup                |
           -------------------------------------------------

          program call               : xtb --input H1C4_5_S_3.input H1C4_5_S_3.xyz --ohess --molden --namespace H1C4_5_S_3 output.out
          calculation namespace      : H1C4_5_S_3
          coordinate file            : H1C4_5_S_3.xyz
          number of atoms            :                     5
          number of electrons        :                    17
          charge                     :                     0
          spin                       :                   1.5
          first test random number   :      0.79171607063308

   ID    Z sym.   atoms
    1    6 C      1-4
    2    1 H      5

           -------------------------------------------------
          |                 G F N 2 - x T B                 |
           -------------------------------------------------

        Reference                      10.1021/acs.jctc.8b01176
      * Hamiltonian:
        H0-scaling (s, p, d)           1.850000    2.230000    2.230000
        zeta-weighting                 0.500000
      * Dispersion:
        s8                             2.700000
        a1                             0.520000
        a2                             5.000000
        s9                             5.000000
      * Repulsion:
        kExp                           1.500000    1.000000
        rExp                           1.000000
      * Coulomb:
        alpha                          2.000000
        third order                    shell-resolved
        anisotropic                    true
        a3                             3.000000
        a5                             4.000000
        cn-shift                       1.200000
        cn-exp                         4.000000
        max-rad                        5.000000


          ...................................................
          :                      SETUP                      :
          :.................................................:
          :  # basis functions                  17          :
          :  # atomic orbitals                  17          :
          :  # shells                            9          :
          :  # electrons                        17          :
          :  max. iterations                   250          :
          :  Hamiltonian                  GFN2-xTB          :
          :  restarted?                      false          :
          :  GBSA solvation                  false          :
          :  PC potential                    false          :
          :  electronic temp.          300.0000000     K    :
          :  accuracy                    1.0000000          :
          :  -> integral cutoff          0.2500000E+02      :
          :  -> integral neglect         0.1000000E-07      :
          :  -> SCF convergence          0.1000000E-05 Eh   :
          :  -> wf. convergence          0.1000000E-03 e    :
          :  Broyden damping             0.4000000          :
          ...................................................

 iter      E             dE          RMSdq      gap      omega  full diag
   1     -8.5780848 -0.857808E+01  0.942E+00    0.16       0.0  T
   2     -8.5632004  0.148844E-01  0.578E+00    0.27       1.0  T
   3     -6.9229796  0.164022E+01  0.116E+01    2.07       1.0  T
   4     -8.5640872 -0.164111E+01  0.222E+00    0.21       1.0  T
   5     -8.5927449 -0.286577E-01  0.793E-01    0.12       1.0  T
   6     -8.5934752 -0.730276E-03  0.672E-01    0.11       1.0  T
   7     -8.5933841  0.910919E-04  0.449E-01    0.10       1.0  T
   8     -8.5933628  0.213402E-04  0.224E-01    0.10       1.0  T
   9     -8.5935103 -0.147565E-03  0.156E-01    0.10       1.0  T
  10     -8.5935045  0.578705E-05  0.105E-01    0.10       1.0  T
  11     -8.5935460 -0.414289E-04  0.542E-02    0.10       1.0  T
  12     -8.5935586 -0.126338E-04  0.258E-02    0.10       1.7  T
  13     -8.5935592 -0.615787E-06  0.955E-03    0.10       4.7  T
  14     -8.5935593 -0.394649E-07  0.129E-03    0.10      34.7  T
  15     -8.5935593 -0.811978E-08  0.552E-04    0.10      81.1  T
  16     -8.5935593 -0.223366E-09  0.355E-05    0.10    1259.6  T

   *** convergence criteria satisfied after 16 iterations ***

         #    Occupation            Energy/Eh            Energy/eV
      -------------------------------------------------------------
         1        2.0000           -0.7130790             -19.4039
       ...           ...                  ...                  ...
         4        2.0000           -0.5814842             -15.8230
         5        2.0000           -0.5195065             -14.1365
         6        2.0000           -0.4799588             -13.0603
         7        2.0000           -0.4602941             -12.5252
         8        1.0000           -0.4413118             -12.0087
         9        1.0000           -0.4220728             -11.4852
        10        0.8784           -0.3680971             -10.0164 (HOMO)
        11        0.1216           -0.3643392              -9.9142 (LUMO)
        12                         -0.3230793              -8.7914
        13                         -0.1144317              -3.1138
        14                          0.0335837               0.9139
        15                          0.1235514               3.3620
       ...                                ...                  ...
        17                          0.2015596               5.4847
      -------------------------------------------------------------
                  HL-Gap            0.0037579 Eh            0.1023 eV
             Fermi-level           -0.4085105 Eh          -11.1161 eV

 SCC (total)                   0 d,  0 h,  0 min,  0.004 sec
 SCC setup                      ...        0 min,  0.000 sec (  2.174%)
 Dispersion                     ...        0 min,  0.000 sec (  0.421%)
 integral evaluation            ...        0 min,  0.001 sec ( 26.343%)
 zeroth order Hamiltonian       ...        0 min,  0.000 sec (  0.522%)
 iterations                     ...        0 min,  0.002 sec ( 41.326%)
 molecular gradient             ...        0 min,  0.001 sec ( 26.438%)
 printout                       ...        0 min,  0.000 sec (  2.494%)

         :::::::::::::::::::::::::::::::::::::::::::::::::::::
         ::                     SUMMARY                     ::
         :::::::::::::::::::::::::::::::::::::::::::::::::::::
         :: total energy              -8.519411379253 Eh    ::
         :: gradient norm              0.172119882201 Eh/a0 ::
         :: HOMO-LUMO gap              0.102257951993 eV    ::
         ::.................................................::
         :: SCC energy                -8.593559264141 Eh    ::
         :: -> isotropic ES           -0.023885810842 Eh    ::
         :: -> anisotropic ES         -0.000015104016 Eh    ::
         :: -> anisotropic XC          0.005743074079 Eh    ::
         :: -> dispersion             -0.002186035906 Eh    ::
         :: repulsion energy           0.074147805389 Eh    ::
         :: add. restraining           0.000000000000 Eh    ::
         :::::::::::::::::::::::::::::::::::::::::::::::::::::

      ----------------------------------------------------------- 
     |                   =====================                   |
     |                        A N C O P T                        |
     |                   =====================                   |
     |               Approximate Normal Coordinate               |
     |                Rational Function Optimizer                |
      ----------------------------------------------------------- 

          ...................................................
          :                      SETUP                      :
          :.................................................:
          :   optimization level            normal          :
          :   max. optcycles                   200          :
          :   ANC micro-cycles                  20          :
          :   degrees of freedom                 9          :
          :.................................................:
          :   RF solver                   davidson          :
          :   write xtbopt.log                true          :
          :   linear?                        false          :
          :   energy convergence         0.5000000E-05 Eh   :
          :   grad. convergence          0.1000000E-02 Eh/α :
          :   maximium RF displ.         1.0000000          :
          :   Hlow (freq-cutoff)         0.1000000E-01      :
          :   Hmax (freq-cutoff)         5.0000000          :
          :   S6 in model hess.         20.0000000          :
          ...................................................

generating ANC from model Hessian ...
Using Lindh-Hessian (1995)
 Shifting diagonal of input Hessian by    0.0000000000000000     
 Lowest  eigenvalues of input Hessian
   -0.000000   -0.000000   -0.000000    0.000000    0.000000    0.000000
    0.050478    0.065048    0.095012    0.127088    0.369599    0.713735
    0.804628    1.123497    1.397867
 Highest eigenvalues
    0.127088    0.369599    0.713735    0.804628    1.123497    1.397867


........................................................................
.............................. CYCLE    1 ..............................
........................................................................
   1     -8.5935593 -0.859356E+01  0.154E-05    0.10       0.0  T
   2     -8.5935593  0.923706E-13  0.109E-05    0.10    4093.8  T
   3     -8.5935593  0.369837E-11  0.235E-05    0.10    1899.7  T
     SCC iter.                  ...        0 min,  0.001 sec
     gradient                   ...        0 min,  0.001 sec
 * total energy  :    -8.5194114 Eh     change       -0.5525234E-09 Eh
   gradient norm :     0.1721194 Eh/α   predicted     0.0000000E+00 (-100.00%)
   displ. norm   :     0.2713226 α      lambda       -0.3771321E-01
   maximum displ.:     0.1821699 α      in ANC's #7, #3, #4, ...

........................................................................
.............................. CYCLE    2 ..............................
........................................................................
   1     -8.6501572 -0.865016E+01  0.216E+00    0.43       0.0  T
   2     -8.6223380  0.278192E-01  0.213E+00    0.21       1.0  T
   3     -8.6273055 -0.496748E-02  0.191E+00    0.51       1.0  T
   4     -8.6547051 -0.273997E-01  0.286E-01    0.35       1.0  T
   5     -8.6552660 -0.560891E-03  0.934E-02    0.36       1.0  T
   6     -8.6552670 -0.102127E-05  0.681E-02    0.36       1.0  T
   7     -8.6552667  0.310711E-06  0.113E-02    0.36       4.0  T
   8     -8.6552674 -0.682349E-06  0.603E-03    0.36       7.4  T
   9     -8.6552675 -0.810199E-07  0.891E-04    0.36      50.2  T
  10     -8.6552675 -0.171174E-08  0.194E-04    0.36     230.6  T
     SCC iter.                  ...        0 min,  0.001 sec
     gradient                   ...        0 min,  0.001 sec
 * total energy  :    -8.5526830 Eh     change       -0.3327163E-01 Eh
   gradient norm :     0.1238580 Eh/α   predicted    -0.2024475E-01 ( -39.15%)
   displ. norm   :     0.4624907 α      lambda       -0.5249925E-01
   maximum displ.:     0.3757348 α      in ANC's #7, #4, #3, ...

........................................................................
.............................. CYCLE    3 ..............................
........................................................................
   1     -8.7943650 -0.879437E+01  0.464E+00    1.58       0.0  T
   2     -8.7968878 -0.252281E-02  0.268E+00    1.55       1.0  T
   3     -8.7887934  0.809445E-02  0.151E+00    1.69       1.0  T
   4     -8.7920083 -0.321496E-02  0.780E-01    1.53       1.0  T
   5     -8.7981570 -0.614868E-02  0.220E-01    1.61       1.0  T
   6     -8.7982788 -0.121824E-03  0.311E-02    1.61       1.4  T
   7     -8.7982829 -0.403078E-05  0.754E-03    1.61       5.9  T
   8     -8.7982829 -0.637910E-07  0.266E-03    1.61      16.8  T
   9     -8.7982829  0.104044E-07  0.224E-03    1.61      20.0  T
  10     -8.7982830 -0.265836E-07  0.897E-04    1.61      49.9  T
  11     -8.7982830 -0.569328E-08  0.153E-04    1.61     291.4  T
     SCC iter.                  ...        0 min,  0.001 sec
     gradient                   ...        0 min,  0.001 sec
 * total energy  :    -8.5367606 Eh     change        0.1592241E-01 Eh
   gradient norm :     0.4098404 Eh/α   predicted    -0.3186436E-01 (-300.12%)
   displ. norm   :     0.2556017 α      lambda       -0.9602064E-01
   maximum displ.:     0.2392794 α      in ANC's #7, #9, #8, ...

........................................................................
.............................. CYCLE    4 ..............................
........................................................................
   1     -8.6976854 -0.869769E+01  0.273E+00    0.85       0.0  T
   2     -8.6751891  0.224963E-01  0.220E+00    0.62       1.0  T
   3     -8.6102358  0.649534E-01  0.313E+00    1.06       1.0  T
   4     -8.7015769 -0.913411E-01  0.572E-01    0.75       1.0  T
   5     -8.7027325 -0.115564E-02  0.194E-01    0.76       1.0  T
   6     -8.7027995 -0.669572E-04  0.165E-01    0.76       1.0  T
   7     -8.7029105 -0.111073E-03  0.311E-02    0.77       1.4  T
   8     -8.7029150 -0.450704E-05  0.702E-03    0.77       6.4  T
   9     -8.7029150  0.359078E-07  0.614E-03    0.77       7.3  T
  10     -8.7029152 -0.180193E-06  0.233E-03    0.77      19.2  T
  11     -8.7029152 -0.285967E-07  0.722E-04    0.77      61.9  T
  12     -8.7029152 -0.327846E-08  0.128E-04    0.77     349.4  T
     SCC iter.                  ...        0 min,  0.001 sec
     gradient                   ...        0 min,  0.001 sec
 * total energy  :    -8.5680588 Eh     change       -0.3129822E-01 Eh
   gradient norm :     0.0542182 Eh/α   predicted    -0.5114695E-01 (  63.42%)
   displ. norm   :     0.0551873 α      lambda       -0.2508033E-02
   maximum displ.:     0.0377682 α      in ANC's #7, #5, #4, ...

........................................................................
.............................. CYCLE    5 ..............................
........................................................................
   1     -8.7136005 -0.871360E+01  0.508E-01    0.90       0.0  T
   2     -8.7125103  0.109017E-02  0.447E-01    0.95       1.0  T
   3     -8.7111347  0.137561E-02  0.532E-01    0.87       1.0  T
   4     -8.7137342 -0.259953E-02  0.508E-02    0.92       1.0  T
   5     -8.7137426 -0.838186E-05  0.163E-02    0.92       2.7  T
   6     -8.7137424  0.208265E-06  0.809E-03    0.92       5.5  T
   7     -8.7137428 -0.384520E-06  0.103E-03    0.92      43.6  T
   8     -8.7137428  0.495447E-08  0.118E-03    0.92      37.9  T
   9     -8.7137428 -0.952547E-08  0.172E-04    0.92     260.0  T
  10     -8.7137428 -0.333511E-10  0.294E-05    0.92    1521.2  T
     SCC iter.                  ...        0 min,  0.001 sec
     gradient                   ...        0 min,  0.001 sec
 * total energy  :    -8.5700285 Eh     change       -0.1969700E-02 Eh
   gradient norm :     0.0289384 Eh/α   predicted    -0.1257835E-02 ( -36.14%)
   displ. norm   :     0.0803112 α      lambda       -0.2093546E-02
   maximum displ.:     0.0527216 α      in ANC's #7, #5, #4, ...

........................................................................
.............................. CYCLE    6 ..............................
........................................................................
   1     -8.7288967 -0.872890E+01  0.747E-01    1.15       0.0  T
   2     -8.7260871  0.280964E-02  0.688E-01    1.22       1.0  T
   3     -8.7245987  0.148836E-02  0.728E-01    1.10       1.0  T
   4     -8.7292224 -0.462367E-02  0.106E-01    1.17       1.0  T
   5     -8.7292634 -0.410184E-04  0.317E-02    1.18       1.4  T
   6     -8.7292636 -0.238261E-06  0.147E-02    1.18       3.0  T
   7     -8.7292642 -0.596355E-06  0.223E-03    1.18      20.1  T
   8     -8.7292642 -0.907860E-08  0.179E-03    1.18      24.9  T
   9     -8.7292643 -0.186414E-07  0.521E-04    1.18      85.8  T
  10     -8.7292643 -0.116095E-08  0.912E-05    1.18     490.6  T
     SCC iter.                  ...        0 min,  0.001 sec
     gradient                   ...        0 min,  0.001 sec
 * total energy  :    -8.5710527 Eh     change       -0.1024221E-02 Eh
   gradient norm :     0.0202190 Eh/α   predicted    -0.1053526E-02 (   2.86%)
   displ. norm   :     0.0175627 α      lambda       -0.2035992E-03
   maximum displ.:     0.0105457 α      in ANC's #4, #5, #9, ...

........................................................................
.............................. CYCLE    7 ..............................
........................................................................
   1     -8.7264441 -0.872644E+01  0.578E-02    1.18       0.0  T
   2     -8.7264098  0.343014E-04  0.753E-02    1.19       1.0  T
   3     -8.7264416 -0.317524E-04  0.392E-02    1.18       1.1  T
   4     -8.7264483 -0.670913E-05  0.267E-02    1.18       1.7  T
   5     -8.7264529 -0.463224E-05  0.370E-03    1.18      12.1  T
   6     -8.7264529 -0.268546E-07  0.679E-04    1.18      65.9  T
   7     -8.7264529 -0.255493E-10  0.278E-04    1.18     161.0  T
     SCC iter.                  ...        0 min,  0.001 sec
     gradient                   ...        0 min,  0.001 sec
 * total energy  :    -8.5712033 Eh     change       -0.1505091E-03 Eh
   gradient norm :     0.0121876 Eh/α   predicted    -0.1018304E-03 ( -32.34%)
   displ. norm   :     0.0222832 α      lambda       -0.1867098E-03
   maximum displ.:     0.0183850 α      in ANC's #9, #4, #5, ...

........................................................................
.............................. CYCLE    8 ..............................
........................................................................
   1     -8.7252710 -0.872527E+01  0.112E-01    1.21       0.0  T
   2     -8.7251940  0.770192E-04  0.123E-01    1.23       1.0  T
   3     -8.7252404 -0.464044E-04  0.779E-02    1.21       1.0  T
   4     -8.7252764 -0.360270E-04  0.277E-02    1.22       1.6  T
   5     -8.7252823 -0.587820E-05  0.780E-03    1.22       5.7  T
   6     -8.7252820  0.231259E-06  0.707E-03    1.22       6.3  T
   7     -8.7252824 -0.392285E-06  0.589E-04    1.22      75.9  T
   8     -8.7252824 -0.410534E-09  0.378E-04    1.22     118.4  T
     SCC iter.                  ...        0 min,  0.001 sec
     gradient                   ...        0 min,  0.001 sec
 * total energy  :    -8.5712946 Eh     change       -0.9139768E-04 Eh
   gradient norm :     0.0022688 Eh/α   predicted    -0.9340151E-04 (   2.19%)
   displ. norm   :     0.0043835 α      lambda       -0.6230562E-05
   maximum displ.:     0.0034131 α      in ANC's #5, #7, #9, ...

........................................................................
.............................. CYCLE    9 ..............................
........................................................................
   1     -8.7254396 -0.872544E+01  0.302E-02    1.23       0.0  T
   2     -8.7254265  0.130781E-04  0.397E-02    1.23       1.1  T
   3     -8.7254373 -0.107643E-04  0.239E-02    1.23       1.9  T
   4     -8.7254411 -0.383549E-05  0.312E-03    1.23      14.3  T
   5     -8.7254412 -0.747873E-07  0.618E-04    1.23      72.3  T
   6     -8.7254412 -0.150915E-08  0.197E-04    1.23     226.4  T
     SCC iter.                  ...        0 min,  0.001 sec
     gradient                   ...        0 min,  0.001 sec
 * total energy  :    -8.5712978 Eh     change       -0.3139461E-05 Eh
   gradient norm :     0.0004582 Eh/α   predicted    -0.3113492E-05 (  -0.83%)
   displ. norm   :     0.0023713 α      lambda       -0.5265009E-06
   maximum displ.:     0.0022165 α      in ANC's #4, #7, #9, ...

   *** GEOMETRY OPTIMIZATION CONVERGED AFTER 9 ITERATIONS ***

------------------------------------------------------------------------
 total energy gain   :        -0.0518864 Eh      -32.5592 kcal/mol
 total RMSD          :         0.2584455 a0        0.1368 Å
 total power (kW/mol):       -15.1364165 (step)-4752.7519 (real)
------------------------------------------------------------------------

 ANCopt (total)                0 d,  0 h,  0 min,  0.029 sec
 optimizer setup                ...        0 min,  0.000 sec (  0.244%)
 model hessian                  ...        0 min,  0.000 sec (  0.338%)
 ANC generation                 ...        0 min,  0.000 sec (  0.206%)
 coordinate transformation      ...        0 min,  0.000 sec (  0.069%)
 single point calculation       ...        0 min,  0.028 sec ( 96.374%)
 optimization log               ...        0 min,  0.000 sec (  0.795%)
 hessian update                 ...        0 min,  0.000 sec (  0.078%)
 rational function              ...        0 min,  0.000 sec (  0.787%)

================
 final structure:
================
5
 xtb: 6.2.2 (9d81278992624c895f80dd42a50cac0aa55982e2)
C         1.33119737742495   -0.74339754239185   -0.01340359039636
C         0.33772107223849    0.11677492433269   -0.00837978853123
C        -1.11328709231786   -0.29514467824428   -0.61199134837610
C        -1.08879250593874   -0.27430810923003    0.66352711346331
H         0.53316014859316    1.19607540553347   -0.02975238615963

 Bond Distances (Angstroems)
 ---------------------------
C1-C2=1.3141         C2-C1=1.3141         C2-C3=1.6246         C2-C4=1.6246         C2-H5=1.0971         C3-C2=1.6246         
C3-C4=1.2759         C4-C2=1.6246         C4-C3=1.2759         H5-C2=1.0971         
 C  H  Rav=1.0971 sigma=0.0000  Rmin=1.0971  Rmax=1.0971     1
 C  C  Rav=1.4598 sigma=0.1654  Rmin=1.2759  Rmax=1.6246     4

 selected bond angles (degree)
 --------------------
C3-C2-C1=120.52                C4-C2-C1=120.52                C4-C2-C3= 46.24                H5-C2-C1=120.61                
H5-C2-C3=113.66                H5-C2-C4=113.66                C4-C3-C2= 66.88                C3-C4-C2= 66.88                

 selected dihedral angles (degree)
 ---------------------------------
C4-C3-C2-C1=104.58            C4-C3-C2-H5=259.22            C3-C4-C2-C1=255.42            C3-C4-C2-H5=100.78            
           -------------------------------------------------
          |                Final Singlepoint                |
           -------------------------------------------------

          ...................................................
          :                      SETUP                      :
          :.................................................:
          :  # basis functions                  17          :
          :  # atomic orbitals                  17          :
          :  # shells                            9          :
          :  # electrons                        17          :
          :  max. iterations                   250          :
          :  Hamiltonian                  GFN2-xTB          :
          :  restarted?                      false          :
          :  GBSA solvation                  false          :
          :  PC potential                    false          :
          :  electronic temp.          300.0000000     K    :
          :  accuracy                    1.0000000          :
          :  -> integral cutoff          0.2500000E+02      :
          :  -> integral neglect         0.1000000E-07      :
          :  -> SCF convergence          0.1000000E-05 Eh   :
          :  -> wf. convergence          0.1000000E-03 e    :
          :  Broyden damping             0.4000000          :
          ...................................................

 iter      E             dE          RMSdq      gap      omega  full diag
   1     -8.7254412 -0.872544E+01  0.713E-05    1.23       0.0  T
   2     -8.7254412  0.136886E-10  0.590E-05    1.23     757.8  T
   3     -8.7254412  0.370015E-11  0.612E-05    1.23     730.7  T

   *** convergence criteria satisfied after 3 iterations ***

         #    Occupation            Energy/Eh            Energy/eV
      -------------------------------------------------------------
         1        2.0000           -0.6992527             -19.0276
       ...           ...                  ...                  ...
         4        2.0000           -0.5462588             -14.8645
         5        2.0000           -0.5332587             -14.5107
         6        2.0000           -0.4660774             -12.6826
         7        2.0000           -0.4537005             -12.3458
         8        1.0000           -0.4266379             -11.6094
         9        1.0000           -0.3951262             -10.7519
        10        1.0000           -0.3530461              -9.6069 (HOMO)
        11                         -0.3078987              -8.3784 (LUMO)
        12                         -0.2433374              -6.6215
        13                         -0.0917456              -2.4965
        14                         -0.0232084              -0.6315
        15                          0.1732308               4.7139
       ...                                ...                  ...
        17                          0.6361391              17.3102
      -------------------------------------------------------------
                  HL-Gap            0.0451474 Eh            1.2285 eV
             Fermi-level           -0.3853208 Eh          -10.4851 eV

 SCC (total)                   0 d,  0 h,  0 min,  0.003 sec
 SCC setup                      ...        0 min,  0.000 sec (  1.967%)
 Dispersion                     ...        0 min,  0.000 sec (  0.494%)
 integral evaluation            ...        0 min,  0.001 sec ( 38.150%)
 zeroth order Hamiltonian       ...        0 min,  0.000 sec (  0.460%)
 iterations                     ...        0 min,  0.001 sec ( 18.147%)
 molecular gradient             ...        0 min,  0.001 sec ( 38.636%)
 printout                       ...        0 min,  0.000 sec (  1.788%)

         :::::::::::::::::::::::::::::::::::::::::::::::::::::
         ::                     SUMMARY                     ::
         :::::::::::::::::::::::::::::::::::::::::::::::::::::
         :: total energy              -8.571297788767 Eh    ::
         :: gradient norm              0.000459678127 Eh/a0 ::
         :: HOMO-LUMO gap              1.228522894730 eV    ::
         ::.................................................::
         :: SCC energy                -8.725441213497 Eh    ::
         :: -> isotropic ES           -0.009017166249 Eh    ::
         :: -> anisotropic ES          0.000771676192 Eh    ::
         :: -> anisotropic XC          0.005062319048 Eh    ::
         :: -> dispersion             -0.002185576271 Eh    ::
         :: repulsion energy           0.154143362361 Eh    ::
         :: add. restraining           0.000000000000 Eh    ::
         :::::::::::::::::::::::::::::::::::::::::::::::::::::

           ------------------------------------------------- 
          |                Numerical Hessian                |
           ------------------------------------------------- 
step length          :   0.00500
SCC accuracy         :   0.30000
Hessian scale factor :   1.00000
frozen atoms in %    :   0.00000    0
RMS gradient         :   0.00046
estimated CPU  time      0.00 min
estimated wall time      0.00 min

writing file <hessian>.

 projected vibrational frequencies (cm-1)
eigval :       -0.00    -0.00    -0.00     0.00     0.00     0.00
eigval :     -300.21   250.19   455.87   584.67   676.09  1095.72
eigval :     1445.42  1797.30  2782.14
           -------------------------------------------------
          |                Property Printout                |
           -------------------------------------------------

    * Orbital Energies and Occupations

         #    Occupation            Energy/Eh            Energy/eV
      -------------------------------------------------------------
         1        2.0000           -0.6992526             -19.0276
         2        2.0000           -0.6530344             -17.7700
         3        2.0000           -0.5824963             -15.8505
         4        2.0000           -0.5462587             -14.8645
         5        2.0000           -0.5332585             -14.5107
         6        2.0000           -0.4660772             -12.6826
         7        2.0000           -0.4537004             -12.3458
         8        1.0000           -0.4266379             -11.6094
         9        1.0000           -0.3951260             -10.7519
        10        1.0000           -0.3530463              -9.6069 (HOMO)
        11                         -0.3078988              -8.3784 (LUMO)
        12                         -0.2433371              -6.6215
        13                         -0.0917454              -2.4965
        14                         -0.0232083              -0.6315
        15                          0.1732308               4.7139
        16                          0.5364459              14.5974
        17                          0.6361394              17.3102
      -------------------------------------------------------------
                  HL-Gap            0.0451475 Eh            1.2285 eV
             Fermi-level           -0.3853208 Eh          -10.4851 eV

     #   Z        covCN         q      C6AA      α(0)
     1   6 C      0.984    -0.108    39.386    10.543
     2   6 C      3.820     0.079    19.255     6.245
     3   6 C      1.940    -0.039    32.127     9.153
     4   6 C      1.940    -0.039    32.127     9.153
     5   1 H      0.924     0.107     1.723     2.053

 Mol. C6AA /au·bohr⁶  :        542.240139
 Mol. C8AA /au·bohr⁸  :      15064.193519
 Mol. α(0) /au        :         37.146875


Wiberg/Mayer (AO) data.
largest (>0.10) Wiberg bond orders for each atom
          total WBO             WBO to atom ...
     1  C   2.105        C    2 1.729    C    3 0.183    C    4 0.183
     2  C   3.828        C    1 1.729    H    5 0.856    C    4 0.621    C    3 0.621
     3  C   2.804        C    4 1.998    C    2 0.621    C    1 0.183
     4  C   2.804        C    3 1.998    C    2 0.621    C    1 0.183
     5  H   0.868        C    2 0.856

MOs/occ written to file <molden.input>
Molecule has the following symmetry elements: (sigma) 
It seems to be the Cs point group


molecular dipole:
                 x           y           z       tot (Debye)
 q only:        0.048       0.453      -0.008
   full:        0.142       0.642      -0.013       1.672
molecular quadrupole (traceless):
                xx          xy          yy          xz          yz          zz
 q only:       -0.981       0.824       0.811       0.009      -0.026       0.170
  q+dip:       -2.620       0.472       1.760       0.059      -0.024       0.860
   full:       -2.325       0.832       2.053       0.036      -0.045       0.272

           -------------------------------------------------
          |                Geometry Summary                 |
           -------------------------------------------------

      molecular mass/u    :       49.0508844
   center of mass at/Å    :       -0.1195969      -0.2682957       0.0066748
  moments of inertia/u·Å² :        0.1592629E+02   0.5803743E+02   0.6166440E+02
rotational constants/cm⁻¹ :        0.1058478E+01   0.2904614E+00   0.2733771E+00

 * 3 selected distances

     #   Z        #   Z                                     value/Å
     1   6 C      2   6 C                                 1.3141222 (max)
     3   6 C      4   6 C                                 1.2759238
     2   6 C      5   1 H                                 1.0970610 (min)

 * 2 distinct bonds (by element types)

   Z      Z             #   av. dist./Å        max./Å        min./Å
   1 H    6 C           1     1.0970610     1.0970610     1.0970610
   6 C    6 C           2     1.2950230     1.3141222     1.2759238

           -------------------------------------------------
          |               Frequency Printout                |
           -------------------------------------------------
 projected vibrational frequencies (cm-1)
eigval :       -0.00    -0.00    -0.00     0.00     0.00     0.00
eigval :     -300.21   250.19   455.87   584.67   676.09  1095.72
eigval :     1445.42  1797.30  2782.14
 reduced masses (amu)
   1: 11.82   2: 11.61   3: 11.74   4: 12.00   5: 11.93   6: 10.13   7: 11.99   8: 10.85
   9: 11.81  10:  4.08  11: 11.81  12:  1.94  13: 11.70  14: 12.01  15:  1.72
 IR intensities (amu)
   1:  0.02   2:  0.06   3:  0.07   4:  0.08   5:  0.08   6:  0.19   7:  0.64   8:  0.06
   9:  0.28  10:  0.03  11:  0.40  12:  0.05  13:  0.70  14:  0.19  15:  0.03
 Raman intensities (amu)
   1:  0.00   2:  0.00   3:  0.00   4:  0.00   5:  0.00   6:  0.00   7:  0.00   8:  0.00
   9:  0.00  10:  0.00  11:  0.00  12:  0.00  13:  0.00  14:  0.00  15:  0.00
 output can be read by thermo (or use thermo option).
 writing <g98.out> molden fake output.
 recommended (thermochemical) frequency scaling factor: 1.0
           -------------------------------------------------
          |             Thermodynamic Functions             |
           -------------------------------------------------

cs  symmetry found (for desy threshold:  0.10E+00) used in thermo

          ...................................................
          :                      SETUP                      :
          :.................................................:
          :  # frequencies                           8      :
          :  # imaginary freq.                       1      :
          :  linear?                             false      :
          :  only rotor calc.                    false      :
          :  symmetry                               cs      :
          :  rotational number                       1      :
          :  scaling factor                  1.0000000      :
          :  rotor cutoff                   50.0000000 cm⁻¹ :
          :  imag. cutoff                  -20.0000000 cm⁻¹ :
          :.................................................:

    mode    ω/cm⁻¹     T·S(HO)/kcal·mol⁻¹    T·S(FR)/kcal·mol⁻¹   T·S(vib)
   ------------------------------------------------------------------------
       1    250.19    -0.00000 ( 99.84%)     0.01431 (  0.16%)     0.00002
   ------------------------------------------------------------------------

   temp. (K)  partition function   enthalpy   heat capacity  entropy
                                   cal/mol     cal/K/mol   cal/K/mol   J/K/mol
 298.15  VIB   1.78                  670.988      5.451      3.402
         ROT  0.182E+05              888.752      2.981     22.478
         INT  0.325E+05             1559.740      8.432     25.881
         TR   0.332E+27             1481.254      4.968     37.578
         TOT                        3040.9942    13.4001    63.4582   265.5093

   temp. (K)  partition function   enthalpy   heat capacity  entropy
                                   cal/mol     cal/K/mol   cal/K/mol   J/K/mol
 120.00  VIB   1.06                   45.129      1.368      0.489
         ROT  0.466E+04              357.707      2.981     19.765
         INT  0.493E+04              402.836      4.349     20.255
         TR   0.849E+26              596.178      4.968     33.058
         TOT                         999.0137     9.3170    53.3133   223.0629

   temp. (K)  partition function   enthalpy   heat capacity  entropy
                                   cal/mol     cal/K/mol   cal/K/mol   J/K/mol
 100.00  VIB   1.03                   22.440      0.908      0.284
         ROT  0.354E+04              298.089      2.981     19.222
         INT  0.365E+04              320.529      3.889     19.506
         TR   0.646E+26              496.815      4.968     32.153
         TOT                         817.3439     8.8571    51.6588   216.1406

   temp. (K)  partition function   enthalpy   heat capacity  entropy
                                   cal/mol     cal/K/mol   cal/K/mol   J/K/mol
  80.00  VIB   1.01                    8.454      0.502      0.129
         ROT  0.253E+04              238.471      2.981     18.557
         INT  0.256E+04              246.925      3.482     18.686
         TR   0.462E+26              397.452      4.968     31.045
         TOT                         644.3771     8.4506    49.7310   208.0747

   temp. (K)  partition function   enthalpy   heat capacity  entropy
                                   cal/mol     cal/K/mol   cal/K/mol   J/K/mol
  60.00  VIB   1.00                    1.804      0.183      0.035
         ROT  0.165E+04              178.853      2.981     17.699
         INT  0.165E+04              180.657      3.164     17.735
         TR   0.300E+26              298.089      4.968     29.616
         TOT                         478.7459     8.1319    47.3511   198.1170

   temp. (K)  partition function   enthalpy   heat capacity  entropy
                                   cal/mol     cal/K/mol   cal/K/mol   J/K/mol
  40.00  VIB   1.00                    0.088      0.020      0.002
         ROT   896.                  119.236      2.981     16.491
         INT   896.                  119.324      3.001     16.493
         TR   0.163E+26              198.726      4.968     27.603
         TOT                         318.0501     7.9690    44.0958   184.4967

   temp. (K)  partition function   enthalpy   heat capacity  entropy
                                   cal/mol     cal/K/mol   cal/K/mol   J/K/mol
  20.00  VIB   1.00                    0.000      0.000     -0.002
         ROT   317.                   59.618      2.981     14.424
         INT   317.                   59.618      2.981     14.423
         TR   0.577E+25               99.363      4.968     24.161
         TOT                         158.9808     7.9490    38.5839   161.4350

   temp. (K)  partition function   enthalpy   heat capacity  entropy
                                   cal/mol     cal/K/mol   cal/K/mol   J/K/mol
  10.00  VIB   1.00                    0.000      0.000     -0.003
         ROT   112.                   29.809      2.981     12.358
         INT   112.                   29.809      2.981     12.355
         TR   0.204E+25               49.681      4.968     20.719
         TOT                          79.4904     7.9490    33.0745   138.3835

       T/K    H(0)-H(T)+PV         H(T)/Eh          T*S/Eh         G(T)/Eh
   ------------------------------------------------------------------------
    298.15    0.484613E-02    0.255487E-01    0.301511E-01   -0.460232E-02
    120.00    0.159203E-02    0.222946E-01    0.101952E-01    0.120994E-01
    100.00    0.130252E-02    0.220051E-01    0.823236E-02    0.137728E-01
     80.00    0.102688E-02    0.217295E-01    0.634012E-02    0.153894E-01
     60.00    0.762930E-03    0.214655E-01    0.452753E-02    0.169380E-01
     40.00    0.506845E-03    0.212094E-01    0.281084E-02    0.183986E-01
     20.00    0.253352E-03    0.209560E-01    0.122975E-02    0.197262E-01
     10.00    0.126676E-03    0.208293E-01    0.527075E-03    0.203022E-01 (used)
   ------------------------------------------------------------------------

         :::::::::::::::::::::::::::::::::::::::::::::::::::::
         ::                  THERMODYNAMIC                  ::
         :::::::::::::::::::::::::::::::::::::::::::::::::::::
         :: total free energy          -8.550995582813 Eh   ::
         ::.................................................::
         :: total energy               -8.571297788743 Eh   ::
         :: zero point energy           0.020702604910 Eh   ::
         :: G(RRHO) w/o ZPVE           -0.000400398980 Eh   ::
         :: G(RRHO) contrib.            0.020302205930 Eh   ::
         :::::::::::::::::::::::::::::::::::::::::::::::::::::
imag cut-off (cm-1) :    5.00
 found            1  significant imaginary frequency
 writing imag mode distorted coords to xtbhess.xyz
 for further optimization.

optimized geometry written to: xtbopt.xyz


           -------------------------------------------------
          | TOTAL ENERGY               -8.571297788743 Eh   |
          | TOTAL ENTHALPY             -8.550468507818 Eh   |
          | TOTAL FREE ENERGY          -8.550995582813 Eh   |
          | GRADIENT NORM               0.000459562180 Eh/α |
          | HOMO-LUMO GAP               1.228526248409 eV   |
           -------------------------------------------------

------------------------------------------------------------------------
 * finished run on 2020/05/12 at 11:45:10.246     
------------------------------------------------------------------------
 total:
 * wall-time:     0 d,  0 h,  0 min,  0.142 sec
 *  cpu-time:     0 d,  0 h,  0 min,  0.142 sec
 * ratio c/w:     0.996 speedup
 SCF:
 * wall-time:     0 d,  0 h,  0 min,  0.004 sec
 *  cpu-time:     0 d,  0 h,  0 min,  0.004 sec
 * ratio c/w:     0.999 speedup
 ANC optimizer:
 * wall-time:     0 d,  0 h,  0 min,  0.032 sec
 *  cpu-time:     0 d,  0 h,  0 min,  0.032 sec
 * ratio c/w:     0.999 speedup
 numerical hessian:
 * wall-time:     0 d,  0 h,  0 min,  0.088 sec
 *  cpu-time:     0 d,  0 h,  0 min,  0.088 sec
 * ratio c/w:     0.999 speedup

