      -----------------------------------------------------------      
     |                   =====================                   |     
     |                           x T B                           |     
     |                   =====================                   |     
     |                         S. Grimme                         |     
     |          Mulliken Center for Theoretical Chemistry        |     
     |                    University of Bonn                     |     
      -----------------------------------------------------------      

   * xtb version 6.2.2 (9d81278992624c895f80dd42a50cac0aa55982e2) compiled by '@Darwin' on 04/03/2020

   xtb is free software: you can redistribute it and/or modify it under
   the terms of the GNU Lesser General Public License as published by
   the Free Software Foundation, either version 3 of the License, or
   (at your option) any later version.
   
   xtb is distributed in the hope that it will be useful,
   but WITHOUT ANY WARRANTY; without even the implied warranty of
   MERCHANTABILITY or FITNESS FOR A PARTICULAR PURPOSE.  See the
   GNU Lesser General Public License for more details.
   
   Cite this work as:
   * S. Grimme, C. Bannwarth, P. Shushkov, J. Chem. Theory Comput., 2017,
     13, 1989-2009. DOI: 10.1021/acs.jctc.7b00118
   * C. Bannwarth, S. Ehlert and S. Grimme., J. Chem. Theory Comput., 2019,
     15, 1652-1671. DOI: 10.1021/acs.jctc.8b01176
   * P. Pracht, E. Caldeweyher, S. Ehlert, S. Grimme, ChemRxiv, 2019, preprint.
     DOI: 10.26434/chemrxiv.8326202.v1
   
   for DFT-D4:
   * E. Caldeweyher, C. Bannwarth and S. Grimme, J. Chem. Phys., 2017,
     147, 034112. DOI: 10.1063/1.4993215
   * E. Caldeweyher, S. Ehlert, A. Hansen, H. Neugebauer, S. Spicher,
     C. Bannwarth and S. Grimme, J. Chem. Phys., 2019, 150, 154122.
     DOI: 10.1063/1.5090222
   
   for sTDA-xTB:
   * S. Grimme and C. Bannwarth, J. Chem. Phys., 2016, 145, 054103.
     DOI: 10.1063/1.4959605
   
   in the mass-spec context:
   * V. Asgeirsson, C. Bauer and S. Grimme, Chem. Sci., 2017, 8, 4879.
     DOI: 10.1039/c7sc00601b
   
   for metadynamics refer to:
   * S. Grimme, J. Chem. Theory Comput., 2019, 155, 2847-2862
     DOI: 10.1021/acs.jctc.9b00143
   
   with help from (in alphabetical order)
   C. Bannwarth, F. Bohle, G. Brandenburg, E. Caldeweyher, M. Checinski,
   S. Dohm, S. Ehlert, S. Ehrlich, F. März, H. Neugebauer, J. Pisarek,
   P. Pracht, P. Shushkov, and S. Spicher.
   
 * started run on 2020/05/12 at 11:44:46.731     

           -------------------------------------------------
          |                Calculation Setup                |
           -------------------------------------------------

          program call               : xtb --input H2C2N1_6_S_1.input H2C2N1_6_S_1.xyz --ohess --molden --namespace H2C2N1_6_S_1 output.out
          calculation namespace      : H2C2N1_6_S_1
          coordinate file            : H2C2N1_6_S_1.xyz
          number of atoms            :                     5
          number of electrons        :                    15
          charge                     :                     0
          spin                       :                   0.5
          first test random number   :      0.75864987404372

   ID    Z sym.   atoms
    1    7 N      1
    2    6 C      2, 3
    3    1 H      4, 5

           -------------------------------------------------
          |                 G F N 2 - x T B                 |
           -------------------------------------------------

        Reference                      10.1021/acs.jctc.8b01176
      * Hamiltonian:
        H0-scaling (s, p, d)           1.850000    2.230000    2.230000
        zeta-weighting                 0.500000
      * Dispersion:
        s8                             2.700000
        a1                             0.520000
        a2                             5.000000
        s9                             5.000000
      * Repulsion:
        kExp                           1.500000    1.000000
        rExp                           1.000000
      * Coulomb:
        alpha                          2.000000
        third order                    shell-resolved
        anisotropic                    true
        a3                             3.000000
        a5                             4.000000
        cn-shift                       1.200000
        cn-exp                         4.000000
        max-rad                        5.000000


          ...................................................
          :                      SETUP                      :
          :.................................................:
          :  # basis functions                  14          :
          :  # atomic orbitals                  14          :
          :  # shells                            8          :
          :  # electrons                        15          :
          :  max. iterations                   250          :
          :  Hamiltonian                  GFN2-xTB          :
          :  restarted?                      false          :
          :  GBSA solvation                  false          :
          :  PC potential                    false          :
          :  electronic temp.          300.0000000     K    :
          :  accuracy                    1.0000000          :
          :  -> integral cutoff          0.2500000E+02      :
          :  -> integral neglect         0.1000000E-07      :
          :  -> SCF convergence          0.1000000E-05 Eh   :
          :  -> wf. convergence          0.1000000E-03 e    :
          :  Broyden damping             0.4000000          :
          ...................................................

 iter      E             dE          RMSdq      gap      omega  full diag
   1     -7.7576433 -0.775764E+01  0.846E+00    0.48       0.0  T
   2     -7.8292600 -0.716167E-01  0.520E+00    0.26       1.0  T
   3     -7.8316117 -0.235170E-02  0.244E+00    0.28       1.0  T
   4     -7.8320835 -0.471818E-03  0.529E-01    0.29       1.0  T
   5     -7.7455895  0.864940E-01  0.327E+00    0.34       1.0  T
   6     -7.8313402 -0.857506E-01  0.458E-01    0.28       1.0  T
   7     -7.8324838 -0.114363E-02  0.668E-02    0.29       1.0  T
   8     -7.8322950  0.188836E-03  0.166E-01    0.29       1.0  T
   9     -7.8325065 -0.211578E-03  0.225E-02    0.28       2.0  T
  10     -7.8325027  0.385392E-05  0.273E-02    0.28       1.6  T
  11     -7.8325076 -0.492769E-05  0.143E-03    0.29      31.3  T
  12     -7.8325076  0.701298E-08  0.140E-03    0.29      31.9  T
  13     -7.8325076 -0.966371E-08  0.245E-04    0.29     182.5  T
  14     -7.8325076 -0.153308E-09  0.692E-05    0.29     646.1  T

   *** convergence criteria satisfied after 14 iterations ***

         #    Occupation            Energy/Eh            Energy/eV
      -------------------------------------------------------------
         1        2.0000           -0.7007466             -19.0683
         2        2.0000           -0.6407280             -17.4351
         3        2.0000           -0.6324339             -17.2094
         4        2.0000           -0.6110139             -16.6265
         5        2.0000           -0.4697265             -12.7819
         6        2.0000           -0.4488971             -12.2151
         7        1.9571           -0.3280539              -8.9268
         8        1.0389           -0.3221536              -8.7662 (HOMO)
         9        0.0040           -0.3116738              -8.4811 (LUMO)
        10                         -0.2901399              -7.8951
        11                         -0.0527859              -1.4364
        12                          0.0927175               2.5230
        13                          0.0934542               2.5430
        14                          0.0994009               2.7048
      -------------------------------------------------------------
                  HL-Gap            0.0104798 Eh            0.2852 eV
             Fermi-level           -0.3210082 Eh           -8.7351 eV

 SCC (total)                   0 d,  0 h,  0 min,  0.003 sec
 SCC setup                      ...        0 min,  0.000 sec (  2.803%)
 Dispersion                     ...        0 min,  0.000 sec (  0.435%)
 integral evaluation            ...        0 min,  0.001 sec ( 24.974%)
 zeroth order Hamiltonian       ...        0 min,  0.000 sec (  0.514%)
 iterations                     ...        0 min,  0.001 sec ( 41.069%)
 molecular gradient             ...        0 min,  0.001 sec ( 27.011%)
 printout                       ...        0 min,  0.000 sec (  2.777%)

         :::::::::::::::::::::::::::::::::::::::::::::::::::::
         ::                     SUMMARY                     ::
         :::::::::::::::::::::::::::::::::::::::::::::::::::::
         :: total energy              -7.781866478927 Eh    ::
         :: gradient norm              0.055879281296 Eh/a0 ::
         :: HOMO-LUMO gap              0.285168653325 eV    ::
         ::.................................................::
         :: SCC energy                -7.832507621299 Eh    ::
         :: -> isotropic ES           -0.018585547375 Eh    ::
         :: -> anisotropic ES          0.003162763085 Eh    ::
         :: -> anisotropic XC          0.003715821638 Eh    ::
         :: -> dispersion             -0.001606174025 Eh    ::
         :: repulsion energy           0.050641101595 Eh    ::
         :: add. restraining           0.000000000000 Eh    ::
         :::::::::::::::::::::::::::::::::::::::::::::::::::::

      ----------------------------------------------------------- 
     |                   =====================                   |
     |                        A N C O P T                        |
     |                   =====================                   |
     |               Approximate Normal Coordinate               |
     |                Rational Function Optimizer                |
      ----------------------------------------------------------- 

          ...................................................
          :                      SETUP                      :
          :.................................................:
          :   optimization level            normal          :
          :   max. optcycles                   200          :
          :   ANC micro-cycles                  20          :
          :   degrees of freedom                 9          :
          :.................................................:
          :   RF solver                   davidson          :
          :   write xtbopt.log                true          :
          :   linear?                        false          :
          :   energy convergence         0.5000000E-05 Eh   :
          :   grad. convergence          0.1000000E-02 Eh/α :
          :   maximium RF displ.         1.0000000          :
          :   Hlow (freq-cutoff)         0.1000000E-01      :
          :   Hmax (freq-cutoff)         5.0000000          :
          :   S6 in model hess.         20.0000000          :
          ...................................................

generating ANC from model Hessian ...
Using Lindh-Hessian (1995)
 Shifting diagonal of input Hessian by    0.0000000000000000     
 Lowest  eigenvalues of input Hessian
   -0.000000   -0.000000    0.000000    0.000000    0.000000    0.000000
    0.104447    0.122847    0.138498    0.178739    0.182411    0.521600
    1.269422    1.285882    1.287211
 Highest eigenvalues
    0.178739    0.182411    0.521600    1.269422    1.285882    1.287211


........................................................................
.............................. CYCLE    1 ..............................
........................................................................
   1     -7.8325076 -0.783251E+01  0.962E-06    0.29       0.0  T
   2     -7.8325076  0.155580E-09  0.139E-04    0.29     321.4  T
   3     -7.8325076 -0.147176E-09  0.336E-05    0.29    1332.6  T
     SCC iter.                  ...        0 min,  0.000 sec
     gradient                   ...        0 min,  0.001 sec
 * total energy  :    -7.7818665 Eh     change       -0.5331930E-09 Eh
   gradient norm :     0.0558792 Eh/α   predicted     0.0000000E+00 (-100.00%)
   displ. norm   :     0.3743491 α      lambda       -0.1876482E-01
   maximum displ.:     0.3661197 α      in ANC's #1, #5, #6, ...

........................................................................
.............................. CYCLE    2 ..............................
........................................................................
   1     -7.8586392 -0.785864E+01  0.329E+00    0.15       0.0  T
   2     -7.8597286 -0.108936E-02  0.170E+00    0.11       1.0  T
   3     -7.8598505 -0.121885E-03  0.172E-01    0.10       1.0  T
   4     -7.8564148  0.343567E-02  0.772E-01    0.10       1.0  T
   5     -7.8597305 -0.331564E-02  0.154E-01    0.09       1.0  T
   6     -7.8598571 -0.126612E-03  0.142E-02    0.10       3.1  T
   7     -7.8598570  0.609519E-07  0.920E-03    0.09       4.9  T
   8     -7.8598574 -0.385315E-06  0.105E-03    0.09      42.8  T
   9     -7.8598574  0.370297E-09  0.388E-04    0.09     115.4  T
  10     -7.8598574 -0.724469E-09  0.226E-05    0.09    1977.7  T
     SCC iter.                  ...        0 min,  0.001 sec
     gradient                   ...        0 min,  0.001 sec
 * total energy  :    -7.8060123 Eh     change       -0.2414586E-01 Eh
   gradient norm :     0.1012064 Eh/α   predicted    -0.1069725E-01 ( -55.70%)
   displ. norm   :     0.5781756 α      lambda       -0.5635333E-01
   maximum displ.:     0.5625710 α      in ANC's #1, #5, #6, ...

........................................................................
.............................. CYCLE    3 ..............................
........................................................................
   1     -7.9197140 -0.791971E+01  0.405E+00    1.32       0.0  T
   2     -7.9234319 -0.371785E-02  0.194E+00    1.27       1.0  T
   3     -7.9236562 -0.224327E-03  0.429E-01    1.27       1.0  T
   4     -7.9236902 -0.339801E-04  0.467E-02    1.26       1.0  T
   5     -7.9236902  0.121192E-07  0.746E-03    1.26       6.0  T
   6     -7.9236878  0.234906E-05  0.190E-02    1.26       2.4  T
   7     -7.9236904 -0.256492E-05  0.273E-03    1.26      16.4  T
   8     -7.9236904 -0.917261E-08  0.497E-04    1.26      90.0  T
   9     -7.9236904 -0.171185E-09  0.634E-05    1.26     705.6  T
     SCC iter.                  ...        0 min,  0.001 sec
     gradient                   ...        0 min,  0.001 sec
 * total energy  :    -7.8720367 Eh     change       -0.6602437E-01 Eh
   gradient norm :     0.1392531 Eh/α   predicted    -0.3759575E-01 ( -43.06%)
   displ. norm   :     0.6077749 α      lambda       -0.7656757E-01
   maximum displ.:     0.5704150 α      in ANC's #1, #5, #6, ...

........................................................................
.............................. CYCLE    4 ..............................
........................................................................
   1     -7.9995020 -0.799950E+01  0.646E+00    3.61       0.0  T
   2     -8.0107266 -0.112246E-01  0.324E+00    3.58       1.0  T
   3     -8.0114707 -0.744103E-03  0.104E+00    3.56       1.0  T
   4     -8.0116858 -0.215139E-03  0.262E-01    3.55       1.0  T
   5     -8.0117024 -0.165583E-04  0.640E-02    3.53       1.0  T
   6     -8.0117038 -0.138649E-05  0.191E-02    3.53       2.3  T
   7     -8.0117043 -0.493936E-06  0.733E-03    3.53       6.1  T
   8     -8.0117040  0.299491E-06  0.803E-03    3.53       5.6  T
   9     -8.0117044 -0.408708E-06  0.463E-04    3.53      96.6  T
  10     -8.0117044 -0.146487E-09  0.274E-04    3.53     163.1  T
     SCC iter.                  ...        0 min,  0.001 sec
     gradient                   ...        0 min,  0.001 sec
 * total energy  :    -7.9384219 Eh     change       -0.6638516E-01 Eh
   gradient norm :     0.1586511 Eh/α   predicted    -0.5242545E-01 ( -21.03%)
   displ. norm   :     0.6120739 α      lambda       -0.8527035E-01
   maximum displ.:     0.5643514 α      in ANC's #1, #5, #6, ...

........................................................................
.............................. CYCLE    5 ..............................
........................................................................
   1     -8.1535615 -0.815356E+01  0.533E+00    2.94       0.0  T
   2     -8.1616909 -0.812940E-02  0.299E+00    3.47       1.0  T
   3     -8.1620166 -0.325646E-03  0.752E-01    3.41       1.0  T
   4     -8.1620663 -0.497754E-04  0.158E-01    3.45       1.0  T
   5     -8.1620680 -0.162854E-05  0.202E-02    3.43       2.2  T
   6     -8.1620684 -0.447544E-06  0.948E-03    3.44       4.7  T
   7     -8.1620684 -0.188777E-07  0.851E-04    3.44      52.6  T
   8     -8.1620684 -0.498996E-09  0.181E-04    3.44     246.8  T
     SCC iter.                  ...        0 min,  0.000 sec
     gradient                   ...        0 min,  0.001 sec
 * total energy  :    -7.8039933 Eh     change        0.1344286E+00 Eh
   gradient norm :     1.1193779 Eh/α   predicted    -0.5860778E-01 (-143.60%)
   displ. norm   :     0.4033811 α      lambda       -0.4364786E+00
   maximum displ.:     0.3151505 α      in ANC's #1, #6, #5, ...

........................................................................
.............................. CYCLE    6 ..............................
........................................................................
   1     -8.0440648 -0.804406E+01  0.351E+00    3.81       0.0  T
   2     -8.0467792 -0.271437E-02  0.190E+00    3.86       1.0  T
   3     -8.0470016 -0.222465E-03  0.605E-01    3.92       1.0  T
   4     -8.0471328 -0.131161E-03  0.150E-01    3.95       1.0  T
   5     -8.0471356 -0.279760E-05  0.212E-02    3.96       2.1  T
   6     -8.0471358 -0.182741E-06  0.142E-02    3.96       3.1  T
   7     -8.0471357  0.134050E-06  0.952E-03    3.96       4.7  T
   8     -8.0471361 -0.481067E-06  0.127E-03    3.96      35.3  T
   9     -8.0471361 -0.202016E-08  0.193E-04    3.96     231.6  T
  10     -8.0471361 -0.114149E-10  0.677E-05    3.96     660.3  T
     SCC iter.                  ...        0 min,  0.001 sec
     gradient                   ...        0 min,  0.001 sec
 * total energy  :    -7.9523279 Eh     change       -0.1483346E+00 Eh
   gradient norm :     0.0701453 Eh/α   predicted    -0.2537504E+00 (  71.07%)
   displ. norm   :     0.0915355 α      lambda       -0.4067867E-02
   maximum displ.:     0.0726732 α      in ANC's #6, #1, #8, ...

........................................................................
.............................. CYCLE    7 ..............................
........................................................................
   1     -8.0598209 -0.805982E+01  0.483E-01    4.01       0.0  T
   2     -8.0601539 -0.333007E-03  0.204E-01    4.01       1.0  T
   3     -8.0601635 -0.962303E-05  0.119E-01    4.01       1.0  T
   4     -8.0601655 -0.200110E-05  0.215E-02    4.01       2.1  T
   5     -8.0601656 -0.894008E-07  0.481E-03    4.01       9.3  T
   6     -8.0601656 -0.634523E-08  0.926E-04    4.01      48.3  T
   7     -8.0601656 -0.128106E-08  0.224E-04    4.01     199.6  T
     SCC iter.                  ...        0 min,  0.000 sec
     gradient                   ...        0 min,  0.001 sec
 * total energy  :    -7.9550848 Eh     change       -0.2756932E-02 Eh
   gradient norm :     0.0367380 Eh/α   predicted    -0.2050975E-02 ( -25.61%)
   displ. norm   :     0.0423441 α      lambda       -0.9981245E-03
   maximum displ.:     0.0316393 α      in ANC's #6, #8, #1, ...

........................................................................
.............................. CYCLE    8 ..............................
........................................................................
   1     -8.0668546 -0.806685E+01  0.276E-01    4.07       0.0  T
   2     -8.0669527 -0.980123E-04  0.117E-01    4.06       1.0  T
   3     -8.0669551 -0.239827E-05  0.696E-02    4.06       1.0  T
   4     -8.0669553 -0.280858E-06  0.149E-02    4.06       3.0  T
   5     -8.0669538  0.154420E-05  0.188E-02    4.06       2.4  T
   6     -8.0669559 -0.209041E-05  0.147E-03    4.06      30.4  T
   7     -8.0669559 -0.121976E-08  0.228E-04    4.06     196.2  T
   8     -8.0669559 -0.510205E-10  0.662E-05    4.06     676.1  T
     SCC iter.                  ...        0 min,  0.000 sec
     gradient                   ...        0 min,  0.001 sec
 * total energy  :    -7.9555989 Eh     change       -0.5140426E-03 Eh
   gradient norm :     0.0093853 Eh/α   predicted    -0.4999552E-03 (  -2.74%)
   displ. norm   :     0.0112194 α      lambda       -0.7107771E-04
   maximum displ.:     0.0100415 α      in ANC's #1, #6, #8, ...

........................................................................
.............................. CYCLE    9 ..............................
........................................................................
   1     -8.0674110 -0.806741E+01  0.574E-02    4.07       0.0  T
   2     -8.0674136 -0.258385E-05  0.272E-02    4.07       1.6  T
   3     -8.0674137 -0.729698E-07  0.119E-02    4.07       3.8  T
   4     -8.0674137 -0.121675E-07  0.187E-03    4.07      23.9  T
   5     -8.0674137 -0.737675E-09  0.370E-04    4.07     120.7  T
   6     -8.0674137  0.701288E-10  0.138E-04    4.07     325.0  T
     SCC iter.                  ...        0 min,  0.000 sec
     gradient                   ...        0 min,  0.001 sec
 * total energy  :    -7.9556489 Eh     change       -0.5005969E-04 Eh
   gradient norm :     0.0039265 Eh/α   predicted    -0.3554273E-04 ( -29.00%)
   displ. norm   :     0.0083111 α      lambda       -0.2105405E-04
   maximum displ.:     0.0076401 α      in ANC's #1, #6, #5, ...

........................................................................
.............................. CYCLE   10 ..............................
........................................................................
   1     -8.0678370 -0.806784E+01  0.480E-02    4.08       0.0  T
   2     -8.0678390 -0.200429E-05  0.216E-02    4.08       2.1  T
   3     -8.0678390 -0.447641E-07  0.987E-03    4.08       4.5  T
   4     -8.0678390  0.264780E-08  0.179E-03    4.08      25.0  T
   5     -8.0678390  0.146593E-07  0.207E-03    4.08      21.6  T
   6     -8.0678390 -0.258977E-07  0.192E-04    4.08     233.0  T
   7     -8.0678390 -0.115801E-10  0.285E-05    4.08    1567.2  T
     SCC iter.                  ...        0 min,  0.000 sec
     gradient                   ...        0 min,  0.001 sec
 * total energy  :    -7.9556595 Eh     change       -0.1061957E-04 Eh
   gradient norm :     0.0003515 Eh/α   predicted    -0.1052812E-04 (  -0.86%)
   displ. norm   :     0.0004962 α      lambda       -0.1052217E-06
   maximum displ.:     0.0003455 α      in ANC's #8, #5, #6, ...

........................................................................
.............................. CYCLE   11 ..............................
........................................................................
   1     -8.0679110 -0.806791E+01  0.361E-03    4.08       0.0  T
   2     -8.0679111 -0.998304E-08  0.148E-03    4.08      30.3  T
   3     -8.0679111 -0.181355E-09  0.725E-04    4.08      61.6  T
   4     -8.0679111 -0.337419E-10  0.691E-05    4.08     647.2  T
     SCC iter.                  ...        0 min,  0.000 sec
     gradient                   ...        0 min,  0.001 sec
 * total energy  :    -7.9556596 Eh     change       -0.8991149E-07 Eh
   gradient norm :     0.0000588 Eh/α   predicted    -0.5196149E-07 ( -42.21%)
   displ. norm   :     0.0003280 α      lambda       -0.9087482E-08
   maximum displ.:     0.0002745 α      in ANC's #5, #1, #6, ...

   *** GEOMETRY OPTIMIZATION CONVERGED AFTER 11 ITERATIONS ***

------------------------------------------------------------------------
 total energy gain   :        -0.1737932 Eh     -109.0569 kcal/mol
 total RMSD          :         0.7880046 a0        0.4170 Å
 total power (kW/mol):       -41.4812616 (step)********** (real)
------------------------------------------------------------------------

 ANCopt (total)                0 d,  0 h,  0 min,  0.021 sec
 optimizer setup                ...        0 min,  0.000 sec (  0.328%)
 model hessian                  ...        0 min,  0.000 sec (  0.593%)
 ANC generation                 ...        0 min,  0.000 sec (  0.271%)
 coordinate transformation      ...        0 min,  0.000 sec (  0.107%)
 single point calculation       ...        0 min,  0.020 sec ( 94.705%)
 optimization log               ...        0 min,  0.000 sec (  1.238%)
 hessian update                 ...        0 min,  0.000 sec (  0.121%)
 rational function              ...        0 min,  0.000 sec (  1.082%)

================
 final structure:
================
5
 xtb: 6.2.2 (9d81278992624c895f80dd42a50cac0aa55982e2)
N        -0.01040059001527    0.33328270237081    0.03989612562428
C         0.67754488323683   -1.02386085757807   -0.11659472743742
C        -0.61244758344227   -1.06213838469708   -0.13311307717534
H        -0.01951347475039    0.97805059579594   -0.74256515073245
H        -0.03518223502891    0.77466594410840    0.95237682972092

 Bond Distances (Angstroems)
 ---------------------------
N1-C2=1.5296         N1-C3=1.5296         N1-H4=1.0139         N1-H5=1.0139         C2-N1=1.5296         C2-C3=1.2907         
C3-N1=1.5296         C3-C2=1.2907         H4-N1=1.0139         H5-N1=1.0139         
 C  C  Rav=1.2907 sigma=0.0000  Rmin=1.2907  Rmax=1.2907     1
 N  H  Rav=1.0139 sigma=0.0000  Rmin=1.0139  Rmax=1.0139     2
 N  C  Rav=1.5296 sigma=0.0000  Rmin=1.5296  Rmax=1.5296     2

 selected bond angles (degree)
 --------------------
C3-N1-C2= 49.91                H4-N1-C2=119.30                H4-N1-C3=119.30                H5-N1-C2=119.30                
H5-N1-C3=119.30                H5-N1-H4=114.67                C3-C2-N1= 65.05                C2-C3-N1= 65.05                

 selected dihedral angles (degree)
 ---------------------------------
C3-C2-N1-H4=254.87            C3-C2-N1-H5=105.13            C2-C3-N1-H4=105.13            C2-C3-N1-H5=254.87            
           -------------------------------------------------
          |                Final Singlepoint                |
           -------------------------------------------------

          ...................................................
          :                      SETUP                      :
          :.................................................:
          :  # basis functions                  14          :
          :  # atomic orbitals                  14          :
          :  # shells                            8          :
          :  # electrons                        15          :
          :  max. iterations                   250          :
          :  Hamiltonian                  GFN2-xTB          :
          :  restarted?                      false          :
          :  GBSA solvation                  false          :
          :  PC potential                    false          :
          :  electronic temp.          300.0000000     K    :
          :  accuracy                    1.0000000          :
          :  -> integral cutoff          0.2500000E+02      :
          :  -> integral neglect         0.1000000E-07      :
          :  -> SCF convergence          0.1000000E-05 Eh   :
          :  -> wf. convergence          0.1000000E-03 e    :
          :  Broyden damping             0.4000000          :
          ...................................................

 iter      E             dE          RMSdq      gap      omega  full diag
   1     -8.0679111 -0.806791E+01  0.227E-05    4.08       0.0  T
   2     -8.0679111  0.696865E-11  0.365E-05    4.08    1225.9  T
   3     -8.0679111 -0.886580E-11  0.876E-06    4.08    5106.2  T

   *** convergence criteria satisfied after 3 iterations ***

         #    Occupation            Energy/Eh            Energy/eV
      -------------------------------------------------------------
         1        2.0000           -0.6769333             -18.4203
         2        2.0000           -0.6276808             -17.0801
         3        2.0000           -0.5787322             -15.7481
         4        2.0000           -0.5332991             -14.5118
         5        2.0000           -0.4985644             -13.5666
         6        2.0000           -0.4071462             -11.0790
         7        2.0000           -0.3907077             -10.6317
         8        1.0000           -0.3421186              -9.3095 (HOMO)
         9                         -0.1920696              -5.2265 (LUMO)
        10                         -0.0924381              -2.5154
        11                         -0.0707103              -1.9241
        12                          0.1128833               3.0717
        13                          0.1851322               5.0377
        14                          0.6459777              17.5779
      -------------------------------------------------------------
                  HL-Gap            0.1500489 Eh            4.0830 eV
             Fermi-level           -0.3167536 Eh           -8.6193 eV

 SCC (total)                   0 d,  0 h,  0 min,  0.002 sec
 SCC setup                      ...        0 min,  0.000 sec (  2.517%)
 Dispersion                     ...        0 min,  0.000 sec (  0.531%)
 integral evaluation            ...        0 min,  0.001 sec ( 40.064%)
 zeroth order Hamiltonian       ...        0 min,  0.000 sec (  0.699%)
 iterations                     ...        0 min,  0.000 sec ( 12.614%)
 molecular gradient             ...        0 min,  0.001 sec ( 39.309%)
 printout                       ...        0 min,  0.000 sec (  3.762%)

         :::::::::::::::::::::::::::::::::::::::::::::::::::::
         ::                     SUMMARY                     ::
         :::::::::::::::::::::::::::::::::::::::::::::::::::::
         :: total energy              -7.955659639340 Eh    ::
         :: gradient norm              0.000058923355 Eh/a0 ::
         :: HOMO-LUMO gap              4.083039243462 eV    ::
         ::.................................................::
         :: SCC energy                -8.067911058886 Eh    ::
         :: -> isotropic ES           -0.000327482179 Eh    ::
         :: -> anisotropic ES          0.004391285883 Eh    ::
         :: -> anisotropic XC          0.004332220693 Eh    ::
         :: -> dispersion             -0.001514429346 Eh    ::
         :: repulsion energy           0.112251399508 Eh    ::
         :: add. restraining           0.000000000000 Eh    ::
         :::::::::::::::::::::::::::::::::::::::::::::::::::::

           ------------------------------------------------- 
          |                Numerical Hessian                |
           ------------------------------------------------- 
step length          :   0.00500
SCC accuracy         :   0.30000
Hessian scale factor :   1.00000
frozen atoms in %    :   0.00000    0
RMS gradient         :   0.00006
estimated CPU  time      0.00 min
estimated wall time      0.00 min

writing file <hessian>.

 projected vibrational frequencies (cm-1)
eigval :       -0.00    -0.00     0.00     0.00     0.00     0.00
eigval :      402.17   742.73   832.64   937.10   990.89  1483.40
eigval :     1769.66  3346.09  3351.59
           -------------------------------------------------
          |                Property Printout                |
           -------------------------------------------------

    * Orbital Energies and Occupations

         #    Occupation            Energy/Eh            Energy/eV
      -------------------------------------------------------------
         1        2.0000           -0.6769333             -18.4203
         2        2.0000           -0.6276808             -17.0801
         3        2.0000           -0.5787322             -15.7481
         4        2.0000           -0.5332992             -14.5118
         5        2.0000           -0.4985644             -13.5666
         6        2.0000           -0.4071462             -11.0790
         7        2.0000           -0.3907077             -10.6317
         8        1.0000           -0.3421186              -9.3095 (HOMO)
         9                         -0.1920696              -5.2265 (LUMO)
        10                         -0.0924381              -2.5154
        11                         -0.0707103              -1.9241
        12                          0.1128833               3.0717
        13                          0.1851322               5.0377
        14                          0.6459777              17.5779
Molecule has the following symmetry elements: (C2) 2*(sigma) 
It seems to be the C2v point group
      -------------------------------------------------------------
                  HL-Gap            0.1500489 Eh            4.0830 eV
             Fermi-level           -0.3167536 Eh           -8.6193 eV

     #   Z        covCN         q      C6AA      α(0)
     1   7 N      3.520    -0.093    23.057     7.132
     2   6 C      1.881    -0.111    34.217     9.448
     3   6 C      1.881    -0.111    34.217     9.448
     4   1 H      0.860     0.158     1.349     1.819
     5   1 H      0.860     0.158     1.349     1.819

 Mol. C6AA /au·bohr⁶  :        353.532299
 Mol. C8AA /au·bohr⁸  :       8732.265974
 Mol. α(0) /au        :         29.666065


Wiberg/Mayer (AO) data.
largest (>0.10) Wiberg bond orders for each atom
          total WBO             WBO to atom ...
     1  N   3.525        H    5 0.955    H    4 0.955    C    3 0.808    C    2 0.808
     2  C   2.857        C    3 2.029    N    1 0.808
     3  C   2.857        C    2 2.029    N    1 0.808
     4  H   0.975        N    1 0.955
     5  H   0.975        N    1 0.955

MOs/occ written to file <molden.input>


molecular dipole:
                 x           y           z       tot (Debye)
 q only:       -0.028       0.902       0.108
   full:       -0.049       1.564       0.187       4.005
molecular quadrupole (traceless):
                xx          xy          yy          xz          yz          zz
 q only:       -0.723      -0.012      -0.263      -0.017      -0.152       0.986
  q+dip:        0.123       0.088      -2.573      -0.012      -0.611       2.450
   full:       -1.075       0.028      -1.787      -0.034      -0.566       2.862

           -------------------------------------------------
          |                Geometry Summary                 |
           -------------------------------------------------

      molecular mass/u    :       40.0440565
   center of mass at/Å    :        0.0145079      -0.4649770      -0.0556600
  moments of inertia/u·Å² :        0.1147264E+02   0.2236179E+02   0.3089685E+02
rotational constants/cm⁻¹ :        0.1469376E+01   0.7538588E+00   0.5456100E+00

 * 3 selected distances

     #   Z        #   Z                                     value/Å
     2   6 C      3   6 C                                 1.2906659 (max)
     1   7 N      4   1 H                                 1.0139301 (min)
     1   7 N      5   1 H                                 1.0139301

 * 2 distinct bonds (by element types)

   Z      Z             #   av. dist./Å        max./Å        min./Å
   6 C    6 C           1     1.2906659     1.2906659     1.2906659
   1 H    7 N           2     1.0139301     1.0139301     1.0139301

           -------------------------------------------------
          |               Frequency Printout                |
           -------------------------------------------------
 projected vibrational frequencies (cm-1)
eigval :       -0.00    -0.00     0.00     0.00     0.00     0.00
eigval :      402.17   742.73   832.64   937.10   990.89  1483.40
eigval :     1769.66  3346.09  3351.59
 reduced masses (amu)
   1: 12.09   2: 11.37   3: 11.73   4: 11.79   5: 11.08   6: 10.58   7: 12.34   8:  3.26
   9:  2.42  10: 12.75  11:  3.40  12:  1.78  13: 11.98  14:  1.38  15:  2.19
 IR intensities (amu)
   1:  0.22   2:  0.16   3:  0.25   4:  0.07   5:  0.10   6:  0.36   7:  0.86   8:  0.40
   9:  0.00  10:  0.97  11:  0.05  12:  0.27  13:  0.41  14:  0.07  15:  0.08
 Raman intensities (amu)
   1:  0.00   2:  0.00   3:  0.00   4:  0.00   5:  0.00   6:  0.00   7:  0.00   8:  0.00
   9:  0.00  10:  0.00  11:  0.00  12:  0.00  13:  0.00  14:  0.00  15:  0.00
 output can be read by thermo (or use thermo option).
 writing <g98.out> molden fake output.
 recommended (thermochemical) frequency scaling factor: 1.0
           -------------------------------------------------
          |             Thermodynamic Functions             |
           -------------------------------------------------

c2v symmetry found (for desy threshold:  0.10E+00) used in thermo

          ...................................................
          :                      SETUP                      :
          :.................................................:
          :  # frequencies                           9      :
          :  # imaginary freq.                       0      :
          :  linear?                             false      :
          :  only rotor calc.                    false      :
          :  symmetry                              c2v      :
          :  rotational number                       2      :
          :  scaling factor                  1.0000000      :
          :  rotor cutoff                   50.0000000 cm⁻¹ :
          :  imag. cutoff                  -20.0000000 cm⁻¹ :
          :.................................................:

    mode    ω/cm⁻¹     T·S(HO)/kcal·mol⁻¹    T·S(FR)/kcal·mol⁻¹   T·S(vib)
   ------------------------------------------------------------------------
   ------------------------------------------------------------------------

   temp. (K)  partition function   enthalpy   heat capacity  entropy
                                   cal/mol     cal/K/mol   cal/K/mol   J/K/mol
 298.15  VIB   1.25                  354.724      3.760      1.630
         ROT  0.340E+04              888.752      2.981     19.141
         INT  0.424E+04             1243.476      6.741     20.771
         TR   0.245E+27             1481.254      4.968     36.973
         TOT                        2724.7299    11.7092    57.7443   241.6020

   temp. (K)  partition function   enthalpy   heat capacity  entropy
                                   cal/mol     cal/K/mol   cal/K/mol   J/K/mol
 120.00  VIB   1.01                    9.786      0.414      0.098
         ROT   868.                  357.707      2.981     16.428
         INT   876.                  367.493      3.395     16.526
         TR   0.626E+26              596.178      4.968     32.454
         TOT                         963.6708     8.3629    48.9798   204.9315

   temp. (K)  partition function   enthalpy   heat capacity  entropy
                                   cal/mol     cal/K/mol   cal/K/mol   J/K/mol
 100.00  VIB   1.00                    3.609      0.213      0.042
         ROT   661.                  298.089      2.981     15.884
         INT   663.                  301.698      3.194     15.927
         TR   0.476E+26              496.815      4.968     31.549
         TOT                         798.5130     8.1622    47.4752   198.6361

   temp. (K)  partition function   enthalpy   heat capacity  entropy
                                   cal/mol     cal/K/mol   cal/K/mol   J/K/mol
  80.00  VIB   1.00                    0.836      0.076      0.012
         ROT   473.                  238.471      2.981     15.219
         INT   473.                  239.307      3.057     15.231
         TR   0.341E+26              397.452      4.968     30.440
         TOT                         636.7587     8.0250    45.6715   191.0896

   temp. (K)  partition function   enthalpy   heat capacity  entropy
                                   cal/mol     cal/K/mol   cal/K/mol   J/K/mol
  60.00  VIB   1.00                    0.075      0.012      0.001
         ROT   307.                  178.853      2.981     14.362
         INT   307.                  178.928      2.993     14.363
         TR   0.221E+26              298.089      4.968     29.012
         TOT                         477.0170     7.9610    43.3748   181.4802

   temp. (K)  partition function   enthalpy   heat capacity  entropy
                                   cal/mol     cal/K/mol   cal/K/mol   J/K/mol
  40.00  VIB   1.00                    0.001      0.000     -0.000
         ROT   167.                  119.236      2.981     13.153
         INT   167.                  119.236      2.981     13.153
         TR   0.120E+26              198.726      4.968     26.999
         TOT                         317.9622     7.9493    40.1513   167.9929

   temp. (K)  partition function   enthalpy   heat capacity  entropy
                                   cal/mol     cal/K/mol   cal/K/mol   J/K/mol
  20.00  VIB   1.00                    0.000      0.000     -0.000
         ROT   59.1                   59.618      2.981     11.087
         INT   59.1                   59.618      2.981     11.086
         TR   0.426E+25               99.363      4.968     23.557
         TOT                         158.9808     7.9490    34.6429   144.9458

   temp. (K)  partition function   enthalpy   heat capacity  entropy
                                   cal/mol     cal/K/mol   cal/K/mol   J/K/mol
  10.00  VIB   1.00                    0.000      0.000     -0.001
         ROT   20.9                   29.809      2.981      9.021
         INT   20.9                   29.809      2.981      9.020
         TR   0.151E+25               49.681      4.968     20.115
         TOT                          79.4904     7.9490    29.1345   121.8988

       T/K    H(0)-H(T)+PV         H(T)/Eh          T*S/Eh         G(T)/Eh
   ------------------------------------------------------------------------
    298.15    0.434213E-02    0.359091E-01    0.274362E-01    0.847289E-02
    120.00    0.153571E-02    0.331026E-01    0.936651E-02    0.237361E-01
    100.00    0.127251E-02    0.328394E-01    0.756565E-02    0.252738E-01
     80.00    0.101474E-02    0.325817E-01    0.582257E-02    0.267591E-01
     60.00    0.760175E-03    0.323271E-01    0.414733E-02    0.281798E-01
     40.00    0.506705E-03    0.320736E-01    0.255940E-02    0.295142E-01
     20.00    0.253352E-03    0.318203E-01    0.110414E-02    0.307161E-01
     10.00    0.126676E-03    0.316936E-01    0.464288E-03    0.312293E-01 (used)
   ------------------------------------------------------------------------

         :::::::::::::::::::::::::::::::::::::::::::::::::::::
         ::                  THERMODYNAMIC                  ::
         :::::::::::::::::::::::::::::::::::::::::::::::::::::
         :: total free energy          -7.924430331597 Eh   ::
         ::.................................................::
         :: total energy               -7.955659639310 Eh   ::
         :: zero point energy           0.031566919557 Eh   ::
         :: G(RRHO) w/o ZPVE           -0.000337611843 Eh   ::
         :: G(RRHO) contrib.            0.031229307714 Eh   ::
         :::::::::::::::::::::::::::::::::::::::::::::::::::::

optimized geometry written to: xtbopt.xyz


           -------------------------------------------------
          | TOTAL ENERGY               -7.955659639310 Eh   |
          | TOTAL ENTHALPY             -7.923966043738 Eh   |
          | TOTAL FREE ENERGY          -7.924430331597 Eh   |
          | GRADIENT NORM               0.000058885794 Eh/α |
          | HOMO-LUMO GAP               4.083039587491 eV   |
           -------------------------------------------------

------------------------------------------------------------------------
 * finished run on 2020/05/12 at 11:44:46.830     
------------------------------------------------------------------------
 total:
 * wall-time:     0 d,  0 h,  0 min,  0.098 sec
 *  cpu-time:     0 d,  0 h,  0 min,  0.098 sec
 * ratio c/w:     0.999 speedup
 SCF:
 * wall-time:     0 d,  0 h,  0 min,  0.003 sec
 *  cpu-time:     0 d,  0 h,  0 min,  0.003 sec
 * ratio c/w:     0.997 speedup
 ANC optimizer:
 * wall-time:     0 d,  0 h,  0 min,  0.024 sec
 *  cpu-time:     0 d,  0 h,  0 min,  0.024 sec
 * ratio c/w:     0.999 speedup
 numerical hessian:
 * wall-time:     0 d,  0 h,  0 min,  0.055 sec
 *  cpu-time:     0 d,  0 h,  0 min,  0.055 sec
 * ratio c/w:     0.999 speedup

