      -----------------------------------------------------------      
     |                   =====================                   |     
     |                           x T B                           |     
     |                   =====================                   |     
     |                         S. Grimme                         |     
     |          Mulliken Center for Theoretical Chemistry        |     
     |                    University of Bonn                     |     
      -----------------------------------------------------------      

   * xtb version 6.2.2 (9d81278992624c895f80dd42a50cac0aa55982e2) compiled by '@Darwin' on 04/03/2020

   xtb is free software: you can redistribute it and/or modify it under
   the terms of the GNU Lesser General Public License as published by
   the Free Software Foundation, either version 3 of the License, or
   (at your option) any later version.
   
   xtb is distributed in the hope that it will be useful,
   but WITHOUT ANY WARRANTY; without even the implied warranty of
   MERCHANTABILITY or FITNESS FOR A PARTICULAR PURPOSE.  See the
   GNU Lesser General Public License for more details.
   
   Cite this work as:
   * S. Grimme, C. Bannwarth, P. Shushkov, J. Chem. Theory Comput., 2017,
     13, 1989-2009. DOI: 10.1021/acs.jctc.7b00118
   * C. Bannwarth, S. Ehlert and S. Grimme., J. Chem. Theory Comput., 2019,
     15, 1652-1671. DOI: 10.1021/acs.jctc.8b01176
   * P. Pracht, E. Caldeweyher, S. Ehlert, S. Grimme, ChemRxiv, 2019, preprint.
     DOI: 10.26434/chemrxiv.8326202.v1
   
   for DFT-D4:
   * E. Caldeweyher, C. Bannwarth and S. Grimme, J. Chem. Phys., 2017,
     147, 034112. DOI: 10.1063/1.4993215
   * E. Caldeweyher, S. Ehlert, A. Hansen, H. Neugebauer, S. Spicher,
     C. Bannwarth and S. Grimme, J. Chem. Phys., 2019, 150, 154122.
     DOI: 10.1063/1.5090222
   
   for sTDA-xTB:
   * S. Grimme and C. Bannwarth, J. Chem. Phys., 2016, 145, 054103.
     DOI: 10.1063/1.4959605
   
   in the mass-spec context:
   * V. Asgeirsson, C. Bauer and S. Grimme, Chem. Sci., 2017, 8, 4879.
     DOI: 10.1039/c7sc00601b
   
   for metadynamics refer to:
   * S. Grimme, J. Chem. Theory Comput., 2019, 155, 2847-2862
     DOI: 10.1021/acs.jctc.9b00143
   
   with help from (in alphabetical order)
   C. Bannwarth, F. Bohle, G. Brandenburg, E. Caldeweyher, M. Checinski,
   S. Dohm, S. Ehlert, S. Ehrlich, F. März, H. Neugebauer, J. Pisarek,
   P. Pracht, P. Shushkov, and S. Spicher.
   
 * started run on 2020/05/12 at 11:44:47.736     

           -------------------------------------------------
          |                Calculation Setup                |
           -------------------------------------------------

          program call               : xtb --input H2C2N1_9_S_3.input H2C2N1_9_S_3.xyz --ohess --molden --namespace H2C2N1_9_S_3 output.out
          calculation namespace      : H2C2N1_9_S_3
          coordinate file            : H2C2N1_9_S_3.xyz
          number of atoms            :                     5
          number of electrons        :                    15
          charge                     :                     0
          spin                       :                   1.5
          first test random number   :      0.07979261863989

   ID    Z sym.   atoms
    1    7 N      1
    2    6 C      2, 3
    3    1 H      4, 5

           -------------------------------------------------
          |                 G F N 2 - x T B                 |
           -------------------------------------------------

        Reference                      10.1021/acs.jctc.8b01176
      * Hamiltonian:
        H0-scaling (s, p, d)           1.850000    2.230000    2.230000
        zeta-weighting                 0.500000
      * Dispersion:
        s8                             2.700000
        a1                             0.520000
        a2                             5.000000
        s9                             5.000000
      * Repulsion:
        kExp                           1.500000    1.000000
        rExp                           1.000000
      * Coulomb:
        alpha                          2.000000
        third order                    shell-resolved
        anisotropic                    true
        a3                             3.000000
        a5                             4.000000
        cn-shift                       1.200000
        cn-exp                         4.000000
        max-rad                        5.000000


          ...................................................
          :                      SETUP                      :
          :.................................................:
          :  # basis functions                  14          :
          :  # atomic orbitals                  14          :
          :  # shells                            8          :
          :  # electrons                        15          :
          :  max. iterations                   250          :
          :  Hamiltonian                  GFN2-xTB          :
          :  restarted?                      false          :
          :  GBSA solvation                  false          :
          :  PC potential                    false          :
          :  electronic temp.          300.0000000     K    :
          :  accuracy                    1.0000000          :
          :  -> integral cutoff          0.2500000E+02      :
          :  -> integral neglect         0.1000000E-07      :
          :  -> SCF convergence          0.1000000E-05 Eh   :
          :  -> wf. convergence          0.1000000E-03 e    :
          :  Broyden damping             0.4000000          :
          ...................................................

 iter      E             dE          RMSdq      gap      omega  full diag
   1     -7.8310140 -0.783101E+01  0.506E+00    0.57       0.0  T
   2     -7.7835733  0.474406E-01  0.591E+00    0.55       1.0  T
   3     -7.8754624 -0.918891E-01  0.292E+00    0.42       1.0  T
   4     -7.8654391  0.100233E-01  0.174E+00    0.40       1.0  T
   5     -7.8780895 -0.126504E-01  0.811E-01    0.39       1.0  T
   6     -7.8793215 -0.123207E-02  0.403E-01    0.39       1.0  T
   7     -7.8759013  0.342019E-02  0.787E-01    0.38       1.0  T
   8     -7.8798683 -0.396693E-02  0.778E-02    0.39       1.0  T
   9     -7.8798630  0.528530E-05  0.762E-02    0.38       1.0  T
  10     -7.8798853 -0.223212E-04  0.652E-03    0.39       6.9  T
  11     -7.8798854 -0.333848E-07  0.594E-03    0.39       7.5  T
  12     -7.8798855 -0.133929E-06  0.901E-04    0.39      49.7  T
  13     -7.8798855 -0.142487E-08  0.273E-04    0.39     163.6  T

   *** convergence criteria satisfied after 13 iterations ***

         #    Occupation            Energy/Eh            Energy/eV
      -------------------------------------------------------------
         1        2.0000           -0.6457676             -17.5722
       ...           ...                  ...                  ...
         3        2.0000           -0.5500903             -14.9687
         4        2.0000           -0.5236045             -14.2480
         5        2.0000           -0.4680002             -12.7349
         6        2.0000           -0.4648649             -12.6496
         7        1.0000           -0.4130705             -11.2402
         8        0.9996           -0.3392895              -9.2325
         9        0.9996           -0.3392519              -9.2315 (HOMO)
        10        0.0008           -0.3250847              -8.8460 (LUMO)
        11                          0.0587645               1.5991
        12                          0.1041150               2.8331
        13                          0.1273800               3.4662
        14                          0.1544687               4.2033
      -------------------------------------------------------------
                  HL-Gap            0.0141672 Eh            0.3855 eV
             Fermi-level           -0.3853994 Eh          -10.4873 eV

 SCC (total)                   0 d,  0 h,  0 min,  0.003 sec
 SCC setup                      ...        0 min,  0.000 sec (  3.047%)
 Dispersion                     ...        0 min,  0.000 sec (  0.474%)
 integral evaluation            ...        0 min,  0.001 sec ( 25.450%)
 zeroth order Hamiltonian       ...        0 min,  0.000 sec (  0.562%)
 iterations                     ...        0 min,  0.001 sec ( 39.817%)
 molecular gradient             ...        0 min,  0.001 sec ( 27.268%)
 printout                       ...        0 min,  0.000 sec (  2.907%)

         :::::::::::::::::::::::::::::::::::::::::::::::::::::
         ::                     SUMMARY                     ::
         :::::::::::::::::::::::::::::::::::::::::::::::::::::
         :: total energy              -7.829517020481 Eh    ::
         :: gradient norm              0.180376696065 Eh/a0 ::
         :: HOMO-LUMO gap              0.385509541734 eV    ::
         ::.................................................::
         :: SCC energy                -7.879885485529 Eh    ::
         :: -> isotropic ES            0.001277856733 Eh    ::
         :: -> anisotropic ES          0.002124207712 Eh    ::
         :: -> anisotropic XC          0.009840612245 Eh    ::
         :: -> dispersion             -0.001537324841 Eh    ::
         :: repulsion energy           0.050368436195 Eh    ::
         :: add. restraining           0.000000000000 Eh    ::
         :::::::::::::::::::::::::::::::::::::::::::::::::::::

      ----------------------------------------------------------- 
     |                   =====================                   |
     |                        A N C O P T                        |
     |                   =====================                   |
     |               Approximate Normal Coordinate               |
     |                Rational Function Optimizer                |
      ----------------------------------------------------------- 

          ...................................................
          :                      SETUP                      :
          :.................................................:
          :   optimization level            normal          :
          :   max. optcycles                   200          :
          :   ANC micro-cycles                  20          :
          :   degrees of freedom                 9          :
          :.................................................:
          :   RF solver                   davidson          :
          :   write xtbopt.log                true          :
          :   linear?                        false          :
          :   energy convergence         0.5000000E-05 Eh   :
          :   grad. convergence          0.1000000E-02 Eh/α :
          :   maximium RF displ.         1.0000000          :
          :   Hlow (freq-cutoff)         0.1000000E-01      :
          :   Hmax (freq-cutoff)         5.0000000          :
          :   S6 in model hess.         20.0000000          :
          ...................................................

generating ANC from model Hessian ...
Using Lindh-Hessian (1995)
 Shifting diagonal of input Hessian by    4.7473367444974910E-003
 Lowest  eigenvalues of input Hessian
   -0.000000   -0.000000   -0.000000   -0.000000    0.000000    0.000000
    0.010000    0.020345    0.060279    0.127935    0.155534    0.710897
    0.775803    0.997912    1.195158
 Highest eigenvalues
    0.127935    0.155534    0.710897    0.775803    0.997912    1.195158


........................................................................
.............................. CYCLE    1 ..............................
........................................................................
   1     -7.8798855 -0.787989E+01  0.112E-04    0.39       0.0  T
   2     -7.8798855  0.151996E-09  0.211E-04    0.39     212.3  T
   3     -7.8798855 -0.163569E-09  0.679E-05    0.39     658.7  T
     SCC iter.                  ...        0 min,  0.000 sec
     gradient                   ...        0 min,  0.001 sec
 * total energy  :    -7.8295170 Eh     change        0.1423095E-08 Eh
   gradient norm :     0.1803745 Eh/α   predicted     0.0000000E+00 (-100.00%)
   displ. norm   :     0.3645895 α      lambda       -0.4444865E-01
   maximum displ.:     0.2572662 α      in ANC's #1, #6, #5, ...

........................................................................
.............................. CYCLE    2 ..............................
........................................................................
   1     -7.9304905 -0.793049E+01  0.194E+00    0.64       0.0  T
   2     -7.9254062  0.508421E-02  0.198E+00    0.56       1.0  T
   3     -7.9397305 -0.143243E-01  0.655E-01    0.57       1.0  T
   4     -7.9397472 -0.167132E-04  0.185E-01    0.57       1.0  T
   5     -7.9398384 -0.912218E-04  0.472E-02    0.57       1.0  T
   6     -7.9398379  0.488443E-06  0.145E-02    0.57       3.1  T
   7     -7.9398386 -0.617517E-06  0.100E-02    0.57       4.5  T
   8     -7.9398391 -0.516414E-06  0.146E-03    0.57      30.6  T
   9     -7.9398391 -0.117205E-08  0.429E-04    0.57     104.3  T
  10     -7.9398391 -0.892717E-10  0.553E-05    0.57     808.3  T
     SCC iter.                  ...        0 min,  0.001 sec
     gradient                   ...        0 min,  0.001 sec
 * total energy  :    -7.8658808 Eh     change       -0.3636376E-01 Eh
   gradient norm :     0.1071443 Eh/α   predicted    -0.2517851E-01 ( -30.76%)
   displ. norm   :     0.6164324 α      lambda       -0.4962373E-01
   maximum displ.:     0.3782888 α      in ANC's #3, #1, #6, ...

........................................................................
.............................. CYCLE    3 ..............................
........................................................................
   1     -8.0156315 -0.801563E+01  0.280E+00    1.47       0.0  T
   2     -8.0200745 -0.444298E-02  0.161E+00    1.39       1.0  T
   3     -8.0204835 -0.408965E-03  0.745E-01    1.42       1.0  T
   4     -8.0207843 -0.300802E-03  0.964E-02    1.41       1.0  T
   5     -8.0207860 -0.172825E-05  0.257E-02    1.41       1.7  T
   6     -8.0207862 -0.228277E-06  0.703E-03    1.41       6.4  T
   7     -8.0207863 -0.694681E-07  0.448E-03    1.41      10.0  T
   8     -8.0207864 -0.114867E-06  0.946E-04    1.41      47.3  T
   9     -8.0207864 -0.549784E-09  0.445E-05    1.41    1004.0  T
     SCC iter.                  ...        0 min,  0.001 sec
     gradient                   ...        0 min,  0.001 sec
 * total energy  :    -7.8940428 Eh     change       -0.2816200E-01 Eh
   gradient norm :     0.1492525 Eh/α   predicted    -0.3424010E-01 (  21.58%)
   displ. norm   :     0.4485838 α      lambda       -0.2703981E-01
   maximum displ.:     0.4180506 α      in ANC's #3, #6, #5, ...

........................................................................
.............................. CYCLE    4 ..............................
........................................................................
   1     -8.0157148 -0.801571E+01  0.159E+00    1.83       0.0  T
   2     -8.0163229 -0.608059E-03  0.854E-01    1.86       1.0  T
   3     -8.0163103  0.126223E-04  0.315E-01    1.86       1.0  T
   4     -8.0164438 -0.133553E-03  0.517E-02    1.88       1.0  T
   5     -8.0164446 -0.743337E-06  0.163E-02    1.88       2.7  T
   6     -8.0164446 -0.664893E-07  0.165E-03    1.88      27.2  T
   7     -8.0164446  0.385975E-08  0.154E-03    1.88      29.0  T
   8     -8.0164447 -0.148051E-07  0.582E-04    1.88      76.8  T
   9     -8.0164447 -0.396073E-09  0.269E-05    1.88    1663.6  T
     SCC iter.                  ...        0 min,  0.001 sec
     gradient                   ...        0 min,  0.001 sec
 * total energy  :    -7.9126905 Eh     change       -0.1864770E-01 Eh
   gradient norm :     0.0921775 Eh/α   predicted    -0.1624048E-01 ( -12.91%)
   displ. norm   :     0.6173366 α      lambda       -0.2868433E-01
   maximum displ.:     0.4360645 α      in ANC's #1, #3, #6, ...

........................................................................
.............................. CYCLE    5 ..............................
........................................................................
   1     -8.0351426 -0.803514E+01  0.171E+00    1.85       0.0  T
   2     -8.0359641 -0.821434E-03  0.980E-01    1.88       1.0  T
   3     -8.0359375  0.265835E-04  0.381E-01    1.89       1.0  T
   4     -8.0361695 -0.231992E-03  0.677E-02    1.90       1.0  T
   5     -8.0361709 -0.138008E-05  0.128E-02    1.90       3.5  T
   6     -8.0361707  0.184911E-06  0.603E-03    1.90       7.4  T
   7     -8.0361709 -0.227310E-06  0.258E-03    1.90      17.3  T
   8     -8.0361710 -0.456900E-07  0.537E-04    1.90      83.2  T
   9     -8.0361710 -0.315055E-10  0.190E-05    1.90    2348.3  T
     SCC iter.                  ...        0 min,  0.001 sec
     gradient                   ...        0 min,  0.001 sec
 * total energy  :    -7.9236283 Eh     change       -0.1093784E-01 Eh
   gradient norm :     0.0827000 Eh/α   predicted    -0.1980802E-01 (  81.10%)
   displ. norm   :     0.3867821 α      lambda       -0.1666370E-01
   maximum displ.:     0.2261454 α      in ANC's #3, #1, #6, ...

........................................................................
.............................. CYCLE    6 ..............................
........................................................................
   1     -8.0273261 -0.802733E+01  0.854E-01    2.69       0.0  T
   2     -8.0276030 -0.276906E-03  0.512E-01    2.68       1.0  T
   3     -8.0276135 -0.104346E-04  0.152E-01    2.68       1.0  T
   4     -8.0276506 -0.370919E-04  0.573E-02    2.68       1.0  T
   5     -8.0276533 -0.272558E-05  0.132E-02    2.68       3.4  T
   6     -8.0276532  0.100112E-06  0.417E-03    2.68      10.7  T
   7     -8.0276533 -0.137627E-06  0.111E-03    2.68      40.2  T
   8     -8.0276533 -0.346802E-08  0.461E-04    2.68      96.9  T
   9     -8.0276533 -0.803269E-10  0.155E-05    2.68    2890.4  T
     SCC iter.                  ...        0 min,  0.001 sec
     gradient                   ...        0 min,  0.001 sec
 * total energy  :    -7.9313113 Eh     change       -0.7682984E-02 Eh
   gradient norm :     0.0600604 Eh/α   predicted    -0.9578297E-02 (  24.67%)
   displ. norm   :     0.3198482 α      lambda       -0.1070407E-01
   maximum displ.:     0.1997214 α      in ANC's #3, #1, #5, ...

........................................................................
.............................. CYCLE    7 ..............................
........................................................................
   1     -8.0548068 -0.805481E+01  0.119E+00    3.16       0.0  T
   2     -8.0557176 -0.910809E-03  0.582E-01    3.13       1.0  T
   3     -8.0558069 -0.893057E-04  0.301E-01    3.13       1.0  T
   4     -8.0558589 -0.520482E-04  0.331E-02    3.11       1.3  T
   5     -8.0558592 -0.319433E-06  0.962E-03    3.11       4.7  T
   6     -8.0558592  0.903787E-07  0.412E-03    3.11      10.9  T
   7     -8.0558593 -0.108915E-06  0.141E-03    3.11      31.8  T
   8     -8.0558593 -0.869101E-08  0.270E-04    3.11     165.5  T
   9     -8.0558593 -0.261675E-10  0.137E-05    3.11    3269.3  T
     SCC iter.                  ...        0 min,  0.001 sec
     gradient                   ...        0 min,  0.001 sec
 * total energy  :    -7.9363527 Eh     change       -0.5041410E-02 Eh
   gradient norm :     0.0394857 Eh/α   predicted    -0.5899564E-02 (  17.02%)
   displ. norm   :     0.1637928 α      lambda       -0.3694684E-02
   maximum displ.:     0.1431898 α      in ANC's #6, #8, #3, ...

........................................................................
.............................. CYCLE    8 ..............................
........................................................................
   1     -8.0586840 -0.805868E+01  0.409E-01    3.22       0.0  T
   2     -8.0587209 -0.368564E-04  0.225E-01    3.23       1.0  T
   3     -8.0587217 -0.830259E-06  0.702E-02    3.23       1.0  T
   4     -8.0587289 -0.714251E-05  0.102E-02    3.23       4.4  T
   5     -8.0587286  0.220012E-06  0.539E-03    3.23       8.3  T
   6     -8.0587289 -0.237091E-06  0.474E-04    3.23      94.3  T
   7     -8.0587289 -0.588399E-09  0.126E-04    3.23     353.7  T
     SCC iter.                  ...        0 min,  0.001 sec
     gradient                   ...        0 min,  0.001 sec
 * total energy  :    -7.9389516 Eh     change       -0.2598903E-02 Eh
   gradient norm :     0.0151844 Eh/α   predicted    -0.1896901E-02 ( -27.01%)
   displ. norm   :     0.1363895 α      lambda       -0.1169528E-02
   maximum displ.:     0.1098920 α      in ANC's #6, #1, #8, ...

........................................................................
.............................. CYCLE    9 ..............................
........................................................................
   1     -8.0596603 -0.805966E+01  0.271E-01    3.30       0.0  T
   2     -8.0596721 -0.118049E-04  0.152E-01    3.30       1.0  T
   3     -8.0596708  0.127186E-05  0.422E-02    3.30       1.1  T
   4     -8.0596736 -0.279319E-05  0.152E-02    3.30       2.9  T
   5     -8.0596752 -0.152919E-05  0.664E-03    3.30       6.7  T
   6     -8.0596753 -0.108410E-06  0.295E-04    3.30     151.5  T
   7     -8.0596753 -0.809983E-10  0.154E-04    3.30     290.9  T
     SCC iter.                  ...        0 min,  0.000 sec
     gradient                   ...        0 min,  0.001 sec
 * total energy  :    -7.9395986 Eh     change       -0.6470064E-03 Eh
   gradient norm :     0.0053923 Eh/α   predicted    -0.5956417E-03 (  -7.94%)
   displ. norm   :     0.1070595 α      lambda       -0.2935556E-03
   maximum displ.:     0.0908176 α      in ANC's #2, #6, #1, ...

........................................................................
.............................. CYCLE   10 ..............................
........................................................................
   1     -8.0605834 -0.806058E+01  0.359E-01    3.29       0.0  T
   2     -8.0605839 -0.512923E-06  0.207E-01    3.28       1.0  T
   3     -8.0604148  0.169099E-03  0.156E-01    3.29       1.0  T
   4     -8.0605966 -0.181794E-03  0.197E-02    3.28       2.3  T
   5     -8.0605969 -0.370736E-06  0.474E-03    3.28       9.4  T
   6     -8.0605970 -0.411627E-07  0.210E-03    3.28      21.3  T
   7     -8.0605970 -0.102979E-07  0.455E-04    3.28      98.3  T
   8     -8.0605970 -0.420439E-09  0.962E-05    3.28     464.6  T
     SCC iter.                  ...        0 min,  0.000 sec
     gradient                   ...        0 min,  0.001 sec
 * total energy  :    -7.9388080 Eh     change        0.7906104E-03 Eh
   gradient norm :     0.0335651 Eh/α   predicted    -0.1484608E-03 (-118.78%)
   displ. norm   :     0.0846375 α      lambda       -0.1674869E-02
   maximum displ.:     0.0808040 α      in ANC's #2, #6, #4, ...

........................................................................
.............................. CYCLE   11 ..............................
........................................................................
   1     -8.0614609 -0.806146E+01  0.321E-01    3.32       0.0  T
   2     -8.0614617 -0.804391E-06  0.185E-01    3.32       1.0  T
   3     -8.0613361  0.125575E-03  0.136E-01    3.32       1.0  T
   4     -8.0614715 -0.135349E-03  0.167E-02    3.32       2.7  T
   5     -8.0614714  0.117960E-06  0.113E-02    3.32       4.0  T
   6     -8.0614716 -0.298276E-06  0.183E-03    3.32      24.5  T
   7     -8.0614717 -0.747649E-08  0.323E-04    3.32     138.5  T
   8     -8.0614717 -0.181897E-09  0.703E-05    3.32     636.2  T
     SCC iter.                  ...        0 min,  0.001 sec
     gradient                   ...        0 min,  0.001 sec
 * total energy  :    -7.9396395 Eh     change       -0.8315044E-03 Eh
   gradient norm :     0.0025793 Eh/α   predicted    -0.8434322E-03 (   1.43%)
   displ. norm   :     0.0161696 α      lambda       -0.2967159E-04
   maximum displ.:     0.0145952 α      in ANC's #1, #3, #2, ...

........................................................................
.............................. CYCLE   12 ..............................
........................................................................
   1     -8.0600677 -0.806007E+01  0.383E-02    3.34       0.0  T
   2     -8.0600683 -0.553640E-06  0.232E-02    3.34       1.9  T
   3     -8.0600675  0.781523E-06  0.124E-02    3.34       3.6  T
   4     -8.0600682 -0.729436E-06  0.595E-03    3.34       7.5  T
   5     -8.0600684 -0.198352E-06  0.932E-04    3.34      48.0  T
   6     -8.0600684 -0.206502E-08  0.426E-04    3.34     104.9  T
     SCC iter.                  ...        0 min,  0.000 sec
     gradient                   ...        0 min,  0.001 sec
 * total energy  :    -7.9396389 Eh     change        0.5678941E-06 Eh
   gradient norm :     0.0030847 Eh/α   predicted    -0.1483804E-04 (*******%)
   displ. norm   :     0.0068823 α      lambda       -0.1625168E-04
   maximum displ.:     0.0044789 α      in ANC's #3, #1, #6, ...

........................................................................
.............................. CYCLE   13 ..............................
........................................................................
   1     -8.0607339 -0.806073E+01  0.195E-02    3.33       0.0  T
   2     -8.0607341 -0.166567E-06  0.116E-02    3.33       3.8  T
   3     -8.0607341  0.252145E-07  0.403E-03    3.33      11.1  T
   4     -8.0607340  0.514796E-07  0.374E-03    3.33      12.0  T
   5     -8.0607341 -0.106301E-06  0.366E-04    3.33     122.3  T
   6     -8.0607341 -0.169285E-09  0.208E-04    3.33     214.7  T
     SCC iter.                  ...        0 min,  0.000 sec
     gradient                   ...        0 min,  0.001 sec
 * total energy  :    -7.9396473 Eh     change       -0.8314017E-05 Eh
   gradient norm :     0.0002808 Eh/α   predicted    -0.8126877E-05 (  -2.25%)
   displ. norm   :     0.0029063 α      lambda       -0.1719779E-06
   maximum displ.:     0.0024119 α      in ANC's #1, #3, #8, ...

........................................................................
.............................. CYCLE   14 ..............................
........................................................................
   1     -8.0607032 -0.806070E+01  0.447E-03    3.33       0.0  T
   2     -8.0607032 -0.157479E-08  0.257E-03    3.33      17.4  T
   3     -8.0607032  0.205904E-07  0.172E-03    3.33      26.0  T
   4     -8.0607032 -0.218840E-07  0.396E-04    3.33     112.9  T
   5     -8.0607032 -0.103218E-08  0.957E-05    3.33     467.1  T
     SCC iter.                  ...        0 min,  0.000 sec
     gradient                   ...        0 min,  0.001 sec
 * total energy  :    -7.9396474 Eh     change       -0.1380069E-06 Eh
   gradient norm :     0.0000678 Eh/α   predicted    -0.8378927E-07 ( -39.29%)
   displ. norm   :     0.0011066 α      lambda       -0.2653879E-07
   maximum displ.:     0.0008232 α      in ANC's #1, #2, #4, ...

   *** GEOMETRY OPTIMIZATION CONVERGED AFTER 14 ITERATIONS ***

------------------------------------------------------------------------
 total energy gain   :        -0.1101304 Eh      -69.1079 kcal/mol
 total RMSD          :         0.9010482 a0        0.4768 Å
 total power (kW/mol):       -20.6533768 (step)-9849.7614 (real)
------------------------------------------------------------------------

 ANCopt (total)                0 d,  0 h,  0 min,  0.029 sec
 optimizer setup                ...        0 min,  0.000 sec (  0.253%)
 model hessian                  ...        0 min,  0.000 sec (  0.434%)
 ANC generation                 ...        0 min,  0.000 sec (  0.195%)
 coordinate transformation      ...        0 min,  0.000 sec (  0.120%)
 single point calculation       ...        0 min,  0.028 sec ( 95.213%)
 optimization log               ...        0 min,  0.000 sec (  1.250%)
 hessian update                 ...        0 min,  0.000 sec (  0.103%)
 rational function              ...        0 min,  0.000 sec (  1.139%)

================
 final structure:
================
5
 xtb: 6.2.2 (9d81278992624c895f80dd42a50cac0aa55982e2)
N         0.01085859860024    0.53897083830380    0.53307234853331
C        -1.18264083993650    0.27697575996806    0.19263880553889
C         1.19173165853101    0.17158619963873    0.25111527416677
H        -1.58433121016478   -0.42375994234928   -0.52727039385453
H         1.56438179297004   -0.56377285556131   -0.44955703438444

 Bond Distances (Angstroems)
 ---------------------------
N1-C2=1.2685         N1-C3=1.2684         C2-N1=1.2685         C2-H4=1.0820         C3-N1=1.2684         C3-H5=1.0819         
H4-C2=1.0820         H5-C3=1.0819         
 C  H  Rav=1.0819 sigma=0.0000  Rmin=1.0819  Rmax=1.0820     2
 N  C  Rav=1.2684 sigma=0.0000  Rmin=1.2684  Rmax=1.2685     2

 selected bond angles (degree)
 --------------------
C3-N1-C2=139.15                H4-C2-N1=131.43                H5-C3-N1=131.41                

 selected dihedral angles (degree)
 ---------------------------------
H4-C2-N1-C3=  0.00            H5-C3-N1-C2=  0.00            
           -------------------------------------------------
          |                Final Singlepoint                |
           -------------------------------------------------

          ...................................................
          :                      SETUP                      :
          :.................................................:
          :  # basis functions                  14          :
          :  # atomic orbitals                  14          :
          :  # shells                            8          :
          :  # electrons                        15          :
          :  max. iterations                   250          :
          :  Hamiltonian                  GFN2-xTB          :
          :  restarted?                      false          :
          :  GBSA solvation                  false          :
          :  PC potential                    false          :
          :  electronic temp.          300.0000000     K    :
          :  accuracy                    1.0000000          :
          :  -> integral cutoff          0.2500000E+02      :
          :  -> integral neglect         0.1000000E-07      :
          :  -> SCF convergence          0.1000000E-05 Eh   :
          :  -> wf. convergence          0.1000000E-03 e    :
          :  Broyden damping             0.4000000          :
          ...................................................

 iter      E             dE          RMSdq      gap      omega  full diag
   1     -8.0607032 -0.806070E+01  0.184E-05    3.33       0.0  T
   2     -8.0607032 -0.168754E-12  0.936E-06    3.33    4777.4  T
   3     -8.0607032  0.159872E-13  0.349E-06    3.33   12813.5  T

   *** convergence criteria satisfied after 3 iterations ***

         #    Occupation            Energy/Eh            Energy/eV
      -------------------------------------------------------------
         1        2.0000           -0.6638113             -18.0632
       ...           ...                  ...                  ...
         3        2.0000           -0.5569594             -15.1556
         4        2.0000           -0.5201522             -14.1541
         5        2.0000           -0.5135789             -13.9752
         6        2.0000           -0.4788967             -13.0314
         7        1.0000           -0.3502231              -9.5301
         8        1.0000           -0.3467310              -9.4350
         9        1.0000           -0.3215214              -8.7490 (HOMO)
        10                         -0.1989984              -5.4150 (LUMO)
        11                          0.1542264               4.1967
        12                          0.2010928               5.4720
        13                          0.3250446               8.8449
        14                          0.7467958              20.3213
      -------------------------------------------------------------
                  HL-Gap            0.1225230 Eh            3.3340 eV
             Fermi-level           -0.3374099 Eh           -9.1814 eV

 SCC (total)                   0 d,  0 h,  0 min,  0.002 sec
 SCC setup                      ...        0 min,  0.000 sec (  2.764%)
 Dispersion                     ...        0 min,  0.000 sec (  0.527%)
 integral evaluation            ...        0 min,  0.001 sec ( 39.912%)
 zeroth order Hamiltonian       ...        0 min,  0.000 sec (  0.727%)
 iterations                     ...        0 min,  0.000 sec ( 12.853%)
 molecular gradient             ...        0 min,  0.001 sec ( 40.182%)
 printout                       ...        0 min,  0.000 sec (  2.508%)

         :::::::::::::::::::::::::::::::::::::::::::::::::::::
         ::                     SUMMARY                     ::
         :::::::::::::::::::::::::::::::::::::::::::::::::::::
         :: total energy              -7.939647401883 Eh    ::
         :: gradient norm              0.000069011640 Eh/a0 ::
         :: HOMO-LUMO gap              3.334021890948 eV    ::
         ::.................................................::
         :: SCC energy                -8.060703242566 Eh    ::
         :: -> isotropic ES           -0.000446991182 Eh    ::
         :: -> anisotropic ES          0.000621880272 Eh    ::
         :: -> anisotropic XC          0.011846660998 Eh    ::
         :: -> dispersion             -0.001568830655 Eh    ::
         :: repulsion energy           0.121055812850 Eh    ::
         :: add. restraining           0.000000000000 Eh    ::
         :::::::::::::::::::::::::::::::::::::::::::::::::::::

           ------------------------------------------------- 
          |                Numerical Hessian                |
           ------------------------------------------------- 
step length          :   0.00500
SCC accuracy         :   0.30000
Hessian scale factor :   1.00000
frozen atoms in %    :   0.00000    0
RMS gradient         :   0.00007
estimated CPU  time      0.00 min
estimated wall time      0.00 min

writing file <hessian>.

 projected vibrational frequencies (cm-1)
eigval :       -0.00    -0.00    -0.00     0.00     0.00     0.00
eigval :      426.41   582.22   753.23   890.59   946.76  1391.16
eigval :     1580.49  2915.46  2942.94
           -------------------------------------------------
          |                Property Printout                |
           -------------------------------------------------

    * Orbital Energies and Occupations

         #    Occupation            Energy/Eh            Energy/eV
      -------------------------------------------------------------
         1        2.0000           -0.6638113             -18.0632
         2        2.0000           -0.6169388             -16.7878
         3        2.0000           -0.5569595             -15.1556
         4        2.0000           -0.5201522             -14.1541
         5        2.0000           -0.5135789             -13.9752
         6        2.0000           -0.4788967             -13.0314
         7        1.0000           -0.3502231              -9.5301
         8        1.0000           -0.3467310              -9.4350
         9        1.0000           -0.3215214              -8.7490 (HOMO)
        10                         -0.1989984              -5.4150 (LUMO)
        11                          0.1542264               4.1967
        12                          0.2010928               5.4720
        13                          0.3250446               8.8449
        14                          0.7467958              20.3213
      -------------------------------------------------------------
                  HL-Gap            0.1225231 Eh            3.3340 eV
             Fermi-level           -0.3374099 Eh           -9.1814 eV

     #   Z        covCN         q      C6AA      α(0)
     1   7 N      1.821    -0.020    22.336     7.003
     2   6 C      1.858    -0.054    32.596     9.222
     3   6 C      1.858    -0.054    32.596     9.222
     4   1 H      0.925     0.064     2.155     2.296
     5   1 H      0.925     0.064     2.155     2.296

 Mol. C6AA /au·bohr⁶  :        363.369674
 Mol. C8AA /au·bohr⁸  :       8784.981895
 Mol. α(0) /au        :         30.038662


Wiberg/Mayer (AO) data.
largest (>0.10) Wiberg bond orders for each atom
          total WBO             WBO to atom ...
     1  N   3.204        C    3 1.597    C    2 1.597
     2  C   2.556        N    1 1.597    H    4 0.906
     3  C   2.556        N    1 1.597    H    5 0.906
     4  H   0.914        C    2 0.906
     5  H   0.914        C    3 0.906

MOs/occ written to file <molden.input>


molecular dipole:
                 x           y           z       tot (Debye)
Molecule has the following symmetry elements: (C2) 2*(sigma) 
It seems to be the C2v point group
 q only:       -0.004      -0.185      -0.183
   full:       -0.011      -0.536      -0.530       1.916
molecular quadrupole (traceless):
                xx          xy          yy          xz          yz          zz
 q only:        0.516      -0.037      -0.256       0.024       0.104      -0.260
  q+dip:        0.328      -0.038      -0.156       0.042       0.660      -0.172
   full:       -0.400       0.034       0.196      -0.028      -0.294       0.204

           -------------------------------------------------
          |                Geometry Summary                 |
           -------------------------------------------------

      molecular mass/u    :       40.0440565
   center of mass at/Å    :        0.0060253       0.2982068       0.2949700
  moments of inertia/u·Å² :        0.4368051E+01   0.3895285E+02   0.4332090E+02
rotational constants/cm⁻¹ :        0.3859303E+01   0.4327702E+00   0.3891339E+00

 * 2 selected distances

     #   Z        #   Z                                     value/Å
     1   7 N      2   6 C                                 1.2684547 (max)
     1   7 N      3   6 C                                 1.2684370 (min)

 * 1 distinct bonds (by element types)

   Z      Z             #   av. dist./Å        max./Å        min./Å
   6 C    7 N           2     1.2684459     1.2684547     1.2684370

           -------------------------------------------------
          |               Frequency Printout                |
           -------------------------------------------------
 projected vibrational frequencies (cm-1)
eigval :       -0.00    -0.00    -0.00     0.00     0.00     0.00
eigval :      426.41   582.22   753.23   890.59   946.76  1391.16
eigval :     1580.49  2915.46  2942.94
 reduced masses (amu)
   1: 12.08   2: 12.92   3: 11.50   4: 10.50   5: 10.06   6:  6.63   7:  9.60   8:  8.43
   9:  2.42  10:  4.44  11:  2.82  12: 12.05  13: 13.08  14:  1.82  15:  1.80
 IR intensities (amu)
   1:  0.06   2:  0.23   3:  0.03   4:  0.03   5:  0.05   6:  0.14   7:  0.13   8:  0.12
   9:  0.00  10:  0.14  11:  0.24  12:  0.59  13:  0.01  14:  0.22  15:  0.20
 Raman intensities (amu)
   1:  0.00   2:  0.00   3:  0.00   4:  0.00   5:  0.00   6:  0.00   7:  0.00   8:  0.00
   9:  0.00  10:  0.00  11:  0.00  12:  0.00  13:  0.00  14:  0.00  15:  0.00
 output can be read by thermo (or use thermo option).
 writing <g98.out> molden fake output.
 recommended (thermochemical) frequency scaling factor: 1.0
           -------------------------------------------------
          |             Thermodynamic Functions             |
           -------------------------------------------------

c2v symmetry found (for desy threshold:  0.10E+00) used in thermo

          ...................................................
          :                      SETUP                      :
          :.................................................:
          :  # frequencies                           9      :
          :  # imaginary freq.                       0      :
          :  linear?                             false      :
          :  only rotor calc.                    false      :
          :  symmetry                              c2v      :
          :  rotational number                       2      :
          :  scaling factor                  1.0000000      :
          :  rotor cutoff                   50.0000000 cm⁻¹ :
          :  imag. cutoff                  -20.0000000 cm⁻¹ :
          :.................................................:

    mode    ω/cm⁻¹     T·S(HO)/kcal·mol⁻¹    T·S(FR)/kcal·mol⁻¹   T·S(vib)
   ------------------------------------------------------------------------
   ------------------------------------------------------------------------

   temp. (K)  partition function   enthalpy   heat capacity  entropy
                                   cal/mol     cal/K/mol   cal/K/mol   J/K/mol
 298.15  VIB   1.29                  414.142      4.332      1.889
         ROT  0.328E+04              888.752      2.981     19.068
         INT  0.422E+04             1302.895      7.313     20.957
         TR   0.245E+27             1481.254      4.968     36.973
         TOT                        2784.1485    12.2808    57.9304   242.3809

   temp. (K)  partition function   enthalpy   heat capacity  entropy
                                   cal/mol     cal/K/mol   cal/K/mol   J/K/mol
 120.00  VIB   1.01                    9.282      0.434      0.092
         ROT   837.                  357.707      2.981     16.356
         INT   843.                  366.989      3.415     16.447
         TR   0.626E+26              596.178      4.968     32.454
         TOT                         963.1671     8.3834    48.9011   204.6021

   temp. (K)  partition function   enthalpy   heat capacity  entropy
                                   cal/mol     cal/K/mol   cal/K/mol   J/K/mol
 100.00  VIB   1.00                    3.082      0.201      0.036
         ROT   637.                  298.089      2.981     15.812
         INT   639.                  301.171      3.182     15.848
         TR   0.476E+26              496.815      4.968     31.549
         TOT                         797.9857     8.1498    47.3963   198.3062

   temp. (K)  partition function   enthalpy   heat capacity  entropy
                                   cal/mol     cal/K/mol   cal/K/mol   J/K/mol
  80.00  VIB   1.00                    0.620      0.061      0.009
         ROT   456.                  238.471      2.981     15.147
         INT   456.                  239.091      3.042     15.156
         TR   0.341E+26              397.452      4.968     30.440
         TOT                         636.5434     8.0104    45.5961   190.7742

   temp. (K)  partition function   enthalpy   heat capacity  entropy
                                   cal/mol     cal/K/mol   cal/K/mol   J/K/mol
  60.00  VIB   1.00                    0.046      0.008      0.001
         ROT   296.                  178.853      2.981     14.289
         INT   296.                  178.899      2.989     14.290
         TR   0.221E+26              298.089      4.968     29.012
         TOT                         476.9881     7.9569    43.3020   181.1757

   temp. (K)  partition function   enthalpy   heat capacity  entropy
                                   cal/mol     cal/K/mol   cal/K/mol   J/K/mol
  40.00  VIB   1.00                    0.000      0.000     -0.000
         ROT   161.                  119.236      2.981     13.081
         INT   161.                  119.236      2.981     13.081
         TR   0.120E+26              198.726      4.968     26.999
         TOT                         317.9619     7.9491    40.0790   167.6906

   temp. (K)  partition function   enthalpy   heat capacity  entropy
                                   cal/mol     cal/K/mol   cal/K/mol   J/K/mol
  20.00  VIB   1.00                    0.000      0.000     -0.000
         ROT   57.0                   59.618      2.981     11.015
         INT   57.0                   59.618      2.981     11.014
         TR   0.426E+25               99.363      4.968     23.557
         TOT                         158.9808     7.9490    34.5707   144.6436

   temp. (K)  partition function   enthalpy   heat capacity  entropy
                                   cal/mol     cal/K/mol   cal/K/mol   J/K/mol
  10.00  VIB   1.00                    0.000      0.000     -0.001
         ROT   20.1                   29.809      2.981      8.948
         INT   20.1                   29.809      2.981      8.948
         TR   0.151E+25               49.681      4.968     20.115
         TOT                          79.4904     7.9490    29.0623   121.5966

       T/K    H(0)-H(T)+PV         H(T)/Eh          T*S/Eh         G(T)/Eh
   ------------------------------------------------------------------------
    298.15    0.443682E-02    0.327528E-01    0.275246E-01    0.522814E-02
    120.00    0.153490E-02    0.298508E-01    0.935146E-02    0.204994E-01
    100.00    0.127167E-02    0.295876E-01    0.755308E-02    0.220345E-01
     80.00    0.101440E-02    0.293303E-01    0.581296E-02    0.235174E-01
     60.00    0.760129E-03    0.290761E-01    0.414037E-02    0.249357E-01
     40.00    0.506704E-03    0.288226E-01    0.255480E-02    0.262678E-01
     20.00    0.253352E-03    0.285693E-01    0.110184E-02    0.274675E-01
     10.00    0.126676E-03    0.284426E-01    0.463137E-03    0.279795E-01 (used)
   ------------------------------------------------------------------------

         :::::::::::::::::::::::::::::::::::::::::::::::::::::
         ::                  THERMODYNAMIC                  ::
         :::::::::::::::::::::::::::::::::::::::::::::::::::::
         :: total free energy          -7.911667925338 Eh   ::
         ::.................................................::
         :: total energy               -7.939647401941 Eh   ::
         :: zero point energy           0.028315937552 Eh   ::
         :: G(RRHO) w/o ZPVE           -0.000336460949 Eh   ::
         :: G(RRHO) contrib.            0.027979476603 Eh   ::
         :::::::::::::::::::::::::::::::::::::::::::::::::::::

optimized geometry written to: xtbopt.xyz


           -------------------------------------------------
          | TOTAL ENERGY               -7.939647401941 Eh   |
          | TOTAL ENTHALPY             -7.911204788373 Eh   |
          | TOTAL FREE ENERGY          -7.911667925338 Eh   |
          | GRADIENT NORM               0.000069043984 Eh/α |
          | HOMO-LUMO GAP               3.334021895729 eV   |
           -------------------------------------------------

------------------------------------------------------------------------
 * finished run on 2020/05/12 at 11:44:47.840     
------------------------------------------------------------------------
 total:
 * wall-time:     0 d,  0 h,  0 min,  0.103 sec
 *  cpu-time:     0 d,  0 h,  0 min,  0.103 sec
 * ratio c/w:     0.999 speedup
 SCF:
 * wall-time:     0 d,  0 h,  0 min,  0.003 sec
 *  cpu-time:     0 d,  0 h,  0 min,  0.003 sec
 * ratio c/w:     0.997 speedup
 ANC optimizer:
 * wall-time:     0 d,  0 h,  0 min,  0.032 sec
 *  cpu-time:     0 d,  0 h,  0 min,  0.032 sec
 * ratio c/w:     0.998 speedup
 numerical hessian:
 * wall-time:     0 d,  0 h,  0 min,  0.053 sec
 *  cpu-time:     0 d,  0 h,  0 min,  0.053 sec
 * ratio c/w:     0.999 speedup

