      -----------------------------------------------------------      
     |                   =====================                   |     
     |                           x T B                           |     
     |                   =====================                   |     
     |                         S. Grimme                         |     
     |          Mulliken Center for Theoretical Chemistry        |     
     |                    University of Bonn                     |     
      -----------------------------------------------------------      

   * xtb version 6.2.2 (9d81278992624c895f80dd42a50cac0aa55982e2) compiled by '@Darwin' on 04/03/2020

   xtb is free software: you can redistribute it and/or modify it under
   the terms of the GNU Lesser General Public License as published by
   the Free Software Foundation, either version 3 of the License, or
   (at your option) any later version.
   
   xtb is distributed in the hope that it will be useful,
   but WITHOUT ANY WARRANTY; without even the implied warranty of
   MERCHANTABILITY or FITNESS FOR A PARTICULAR PURPOSE.  See the
   GNU Lesser General Public License for more details.
   
   Cite this work as:
   * S. Grimme, C. Bannwarth, P. Shushkov, J. Chem. Theory Comput., 2017,
     13, 1989-2009. DOI: 10.1021/acs.jctc.7b00118
   * C. Bannwarth, S. Ehlert and S. Grimme., J. Chem. Theory Comput., 2019,
     15, 1652-1671. DOI: 10.1021/acs.jctc.8b01176
   * P. Pracht, E. Caldeweyher, S. Ehlert, S. Grimme, ChemRxiv, 2019, preprint.
     DOI: 10.26434/chemrxiv.8326202.v1
   
   for DFT-D4:
   * E. Caldeweyher, C. Bannwarth and S. Grimme, J. Chem. Phys., 2017,
     147, 034112. DOI: 10.1063/1.4993215
   * E. Caldeweyher, S. Ehlert, A. Hansen, H. Neugebauer, S. Spicher,
     C. Bannwarth and S. Grimme, J. Chem. Phys., 2019, 150, 154122.
     DOI: 10.1063/1.5090222
   
   for sTDA-xTB:
   * S. Grimme and C. Bannwarth, J. Chem. Phys., 2016, 145, 054103.
     DOI: 10.1063/1.4959605
   
   in the mass-spec context:
   * V. Asgeirsson, C. Bauer and S. Grimme, Chem. Sci., 2017, 8, 4879.
     DOI: 10.1039/c7sc00601b
   
   for metadynamics refer to:
   * S. Grimme, J. Chem. Theory Comput., 2019, 155, 2847-2862
     DOI: 10.1021/acs.jctc.9b00143
   
   with help from (in alphabetical order)
   C. Bannwarth, F. Bohle, G. Brandenburg, E. Caldeweyher, M. Checinski,
   S. Dohm, S. Ehlert, S. Ehrlich, F. März, H. Neugebauer, J. Pisarek,
   P. Pracht, P. Shushkov, and S. Spicher.
   
 * started run on 2020/05/12 at 11:44:41.437     

           -------------------------------------------------
          |                Calculation Setup                |
           -------------------------------------------------

          program call               : xtb --input C1N1O1_3_S_1.input C1N1O1_3_S_1.xyz --ohess --molden --namespace C1N1O1_3_S_1 output.out
          calculation namespace      : C1N1O1_3_S_1
          coordinate file            : C1N1O1_3_S_1.xyz
          number of atoms            :                     3
          number of electrons        :                    15
          charge                     :                     0
          spin                       :                   0.5
          first test random number   :      0.53623949209730

   ID    Z sym.   atoms
    1    6 C      1
    2    8 O      2
    3    7 N      3

           -------------------------------------------------
          |                 G F N 2 - x T B                 |
           -------------------------------------------------

        Reference                      10.1021/acs.jctc.8b01176
      * Hamiltonian:
        H0-scaling (s, p, d)           1.850000    2.230000    2.230000
        zeta-weighting                 0.500000
      * Dispersion:
        s8                             2.700000
        a1                             0.520000
        a2                             5.000000
        s9                             5.000000
      * Repulsion:
        kExp                           1.500000    1.000000
        rExp                           1.000000
      * Coulomb:
        alpha                          2.000000
        third order                    shell-resolved
        anisotropic                    true
        a3                             3.000000
        a5                             4.000000
        cn-shift                       1.200000
        cn-exp                         4.000000
        max-rad                        5.000000


          ...................................................
          :                      SETUP                      :
          :.................................................:
          :  # basis functions                  12          :
          :  # atomic orbitals                  12          :
          :  # shells                            6          :
          :  # electrons                        15          :
          :  max. iterations                   250          :
          :  Hamiltonian                  GFN2-xTB          :
          :  restarted?                      false          :
          :  GBSA solvation                  false          :
          :  PC potential                    false          :
          :  electronic temp.          300.0000000     K    :
          :  accuracy                    1.0000000          :
          :  -> integral cutoff          0.2500000E+02      :
          :  -> integral neglect         0.1000000E-07      :
          :  -> SCF convergence          0.1000000E-05 Eh   :
          :  -> wf. convergence          0.1000000E-03 e    :
          :  Broyden damping             0.4000000          :
          ...................................................

 iter      E             dE          RMSdq      gap      omega  full diag
   1     -8.8453178 -0.884532E+01  0.981E+00    1.48       0.0  T
   2     -8.8643451 -0.190273E-01  0.703E+00    3.10       1.0  T
   3     -8.8944546 -0.301095E-01  0.378E+00    1.75       1.0  T
   4     -8.8968199 -0.236529E-02  0.834E-01    1.77       1.0  T
   5     -8.8979814 -0.116154E-02  0.417E-01    2.05       1.0  T
   6     -8.8980026 -0.212340E-04  0.316E-01    1.88       1.0  T
   7     -8.8982692 -0.266561E-03  0.602E-02    1.95       1.0  T
   8     -8.8982748 -0.564812E-05  0.166E-02    1.97       3.5  T
   9     -8.8982754 -0.534365E-06  0.274E-03    1.97      21.0  T
  10     -8.8982754 -0.101231E-07  0.474E-04    1.97     121.9  T
  11     -8.8982754 -0.433687E-09  0.156E-04    1.97     370.2  T

   *** convergence criteria satisfied after 11 iterations ***

         #    Occupation            Energy/Eh            Energy/eV
      -------------------------------------------------------------
         1        2.0000           -0.8308598             -22.6088
         2        2.0000           -0.7094511             -19.3051
         3        2.0000           -0.6932011             -18.8630
         4        2.0000           -0.6471667             -17.6103
         5        2.0000           -0.5640964             -15.3498
         6        2.0000           -0.5258174             -14.3082
         7        2.0000           -0.4886176             -13.2960
         8        1.0000           -0.4409006             -11.9975 (HOMO)
         9                         -0.3685504             -10.0288 (LUMO)
        10                         -0.1782974              -4.8517
        11                         -0.0454734              -1.2374
        12                          0.1582055               4.3050
      -------------------------------------------------------------
                  HL-Gap            0.0723503 Eh            1.9688 eV
             Fermi-level           -0.4347423 Eh          -11.8299 eV

 SCC (total)                   0 d,  0 h,  0 min,  0.002 sec
 SCC setup                      ...        0 min,  0.000 sec (  4.033%)
 Dispersion                     ...        0 min,  0.000 sec (  0.488%)
 integral evaluation            ...        0 min,  0.001 sec ( 27.549%)
 zeroth order Hamiltonian       ...        0 min,  0.000 sec (  0.639%)
 iterations                     ...        0 min,  0.001 sec ( 39.591%)
 molecular gradient             ...        0 min,  0.001 sec ( 24.759%)
 printout                       ...        0 min,  0.000 sec (  2.383%)

         :::::::::::::::::::::::::::::::::::::::::::::::::::::
         ::                     SUMMARY                     ::
         :::::::::::::::::::::::::::::::::::::::::::::::::::::
         :: total energy              -8.871463071073 Eh    ::
         :: gradient norm              0.110142688944 Eh/a0 ::
         :: HOMO-LUMO gap              1.968751627580 eV    ::
         ::.................................................::
         :: SCC energy                -8.898275388045 Eh    ::
         :: -> isotropic ES           -0.003306254980 Eh    ::
         :: -> anisotropic ES          0.006248205952 Eh    ::
         :: -> anisotropic XC          0.007618166679 Eh    ::
         :: -> dispersion             -0.000754226375 Eh    ::
         :: repulsion energy           0.026812316031 Eh    ::
         :: add. restraining           0.000000000000 Eh    ::
         :::::::::::::::::::::::::::::::::::::::::::::::::::::

      ----------------------------------------------------------- 
     |                   =====================                   |
     |                        A N C O P T                        |
     |                   =====================                   |
     |               Approximate Normal Coordinate               |
     |                Rational Function Optimizer                |
      ----------------------------------------------------------- 

          ...................................................
          :                      SETUP                      :
          :.................................................:
          :   optimization level            normal          :
          :   max. optcycles                   200          :
          :   ANC micro-cycles                  20          :
          :   degrees of freedom                 3          :
          :.................................................:
          :   RF solver                   davidson          :
          :   write xtbopt.log                true          :
          :   linear?                        false          :
          :   energy convergence         0.5000000E-05 Eh   :
          :   grad. convergence          0.1000000E-02 Eh/α :
          :   maximium RF displ.         1.0000000          :
          :   Hlow (freq-cutoff)         0.1000000E-01      :
          :   Hmax (freq-cutoff)         5.0000000          :
          :   S6 in model hess.         20.0000000          :
          ...................................................

generating ANC from model Hessian ...
Using Lindh-Hessian (1995)
 Shifting diagonal of input Hessian by    0.0000000000000000     
 Lowest  eigenvalues of input Hessian
   -0.000000   -0.000000    0.000000    0.000000    0.000000    0.000000
    0.967488    1.102792    1.739626
 Highest eigenvalues
    0.000000    0.000000    0.000000    0.967488    1.102792    1.739626


........................................................................
.............................. CYCLE    1 ..............................
........................................................................
   1     -8.8982754 -0.889828E+01  0.294E-05    1.97       0.0  T
   2     -8.8982754 -0.758504E-12  0.231E-05    1.97    2500.7  T
   3     -8.8982754 -0.128075E-11  0.839E-06    1.97    6885.5  T
     SCC iter.                  ...        0 min,  0.000 sec
     gradient                   ...        0 min,  0.000 sec
 * total energy  :    -8.8714631 Eh     change       -0.2477663E-10 Eh
   gradient norm :     0.1101437 Eh/α   predicted     0.0000000E+00 (-100.00%)
   displ. norm   :     0.0862953 α      lambda       -0.9120643E-02
   maximum displ.:     0.0705972 α      in ANC's #1, #3, #2, ...

........................................................................
.............................. CYCLE    2 ..............................
........................................................................
   1     -8.9139084 -0.891391E+01  0.104E+00    2.40       0.0  T
   2     -8.9142841 -0.375717E-03  0.617E-01    2.61       1.0  T
   3     -8.9145018 -0.217687E-03  0.376E-01    2.47       1.0  T
   4     -8.9145969 -0.950269E-04  0.350E-02    2.52       1.7  T
   5     -8.9145970 -0.128051E-06  0.194E-02    2.52       3.0  T
   6     -8.9145971 -0.104455E-06  0.226E-03    2.52      25.5  T
   7     -8.9145971 -0.245706E-08  0.136E-03    2.52      42.6  T
   8     -8.9145971 -0.181678E-08  0.265E-04    2.52     218.2  T
   9     -8.9145971 -0.160814E-10  0.308E-05    2.52    1872.6  T
     SCC iter.                  ...        0 min,  0.000 sec
     gradient                   ...        0 min,  0.000 sec
 * total energy  :    -8.8783080 Eh     change       -0.6844939E-02 Eh
   gradient norm :     0.0501825 Eh/α   predicted    -0.4594282E-02 ( -32.88%)
   displ. norm   :     0.0832321 α      lambda       -0.4037310E-02
   maximum displ.:     0.0744285 α      in ANC's #1, #3, #2, ...

........................................................................
.............................. CYCLE    3 ..............................
........................................................................
   1     -8.9268601 -0.892686E+01  0.110E+00    3.01       0.0  T
   2     -8.9274105 -0.550354E-03  0.603E-01    3.18       1.0  T
   3     -8.9275944 -0.183949E-03  0.353E-01    3.08       1.0  T
   4     -8.9276507 -0.562611E-04  0.315E-02    3.11       1.8  T
   5     -8.9276513 -0.614750E-06  0.183E-02    3.11       3.2  T
   6     -8.9276513 -0.515311E-07  0.185E-03    3.11      31.1  T
   7     -8.9276513 -0.184087E-08  0.116E-03    3.11      49.6  T
   8     -8.9276513 -0.101333E-08  0.172E-04    3.11     336.5  T
   9     -8.9276513 -0.612665E-11  0.189E-05    3.11    3051.0  T
     SCC iter.                  ...        0 min,  0.000 sec
     gradient                   ...        0 min,  0.000 sec
 * total energy  :    -8.8796603 Eh     change       -0.1352273E-02 Eh
   gradient norm :     0.0270478 Eh/α   predicted    -0.2032642E-02 (  50.31%)
   displ. norm   :     0.0235098 α      lambda       -0.5773293E-03
   maximum displ.:     0.0184325 α      in ANC's #1, #3, #2, ...

........................................................................
.............................. CYCLE    4 ..............................
........................................................................
   1     -8.9236890 -0.892369E+01  0.281E-01    2.96       0.0  T
   2     -8.9237158 -0.267815E-04  0.164E-01    2.91       1.0  T
   3     -8.9237234 -0.764259E-05  0.985E-02    2.94       1.0  T
   4     -8.9237302 -0.680820E-05  0.914E-03    2.93       6.3  T
   5     -8.9237302 -0.762912E-08  0.120E-03    2.93      48.3  T
   6     -8.9237302 -0.900858E-09  0.489E-04    2.93     118.1  T
   7     -8.9237302 -0.378400E-10  0.107E-04    2.93     540.6  T
     SCC iter.                  ...        0 min,  0.000 sec
     gradient                   ...        0 min,  0.000 sec
 * total energy  :    -8.8799338 Eh     change       -0.2734833E-03 Eh
   gradient norm :     0.0064694 Eh/α   predicted    -0.2888245E-03 (   5.61%)
   displ. norm   :     0.0065243 α      lambda       -0.4210269E-04
   maximum displ.:     0.0051491 α      in ANC's #2, #1, #3, ...

........................................................................
.............................. CYCLE    5 ..............................
........................................................................
   1     -8.9238502 -0.892385E+01  0.922E-02    2.93       0.0  T
   2     -8.9238554 -0.516647E-05  0.445E-02    2.94       1.3  T
   3     -8.9238565 -0.116969E-05  0.249E-02    2.93       2.3  T
   4     -8.9238568 -0.234854E-06  0.553E-03    2.94      10.4  T
   5     -8.9238568 -0.615536E-07  0.157E-03    2.94      36.7  T
   6     -8.9238568 -0.212344E-09  0.137E-04    2.94     421.3  T
   7     -8.9238568 -0.286526E-11  0.546E-05    2.94    1057.9  T
     SCC iter.                  ...        0 min,  0.000 sec
     gradient                   ...        0 min,  0.000 sec
 * total energy  :    -8.8799679 Eh     change       -0.3415738E-04 Eh
   gradient norm :     0.0041045 Eh/α   predicted    -0.2105291E-04 ( -38.36%)
   displ. norm   :     0.0113227 α      lambda       -0.4639677E-04
   maximum displ.:     0.0099007 α      in ANC's #2, #1, #3, ...

........................................................................
.............................. CYCLE    6 ..............................
........................................................................
   1     -8.9238946 -0.892389E+01  0.153E-01    2.93       0.0  T
   2     -8.9239079 -0.132796E-04  0.750E-02    2.94       1.0  T
   3     -8.9239107 -0.283558E-05  0.420E-02    2.93       1.4  T
   4     -8.9239114 -0.709355E-06  0.967E-03    2.94       6.0  T
   5     -8.9239116 -0.183481E-06  0.295E-03    2.94      19.5  T
   6     -8.9239116 -0.893781E-09  0.304E-04    2.94     189.7  T
   7     -8.9239116 -0.146745E-10  0.126E-04    2.94     457.8  T
     SCC iter.                  ...        0 min,  0.000 sec
     gradient                   ...        0 min,  0.000 sec
 * total energy  :    -8.8799919 Eh     change       -0.2394627E-04 Eh
   gradient norm :     0.0006347 Eh/α   predicted    -0.2320121E-04 (  -3.11%)
   displ. norm   :     0.0011819 α      lambda       -0.4412258E-06
   maximum displ.:     0.0011003 α      in ANC's #2, #1, #3, ...

........................................................................
.............................. CYCLE    7 ..............................
........................................................................
   1     -8.9238779 -0.892388E+01  0.129E-02    2.93       0.0  T
   2     -8.9238779 -0.134887E-07  0.722E-03    2.93       8.0  T
   3     -8.9238779  0.134911E-08  0.194E-03    2.93      29.7  T
   4     -8.9238779 -0.547591E-08  0.578E-04    2.93      99.8  T
   5     -8.9238779 -0.177947E-09  0.303E-04    2.93     190.6  T
     SCC iter.                  ...        0 min,  0.000 sec
     gradient                   ...        0 min,  0.000 sec
 * total energy  :    -8.8799922 Eh     change       -0.3200737E-06 Eh
   gradient norm :     0.0001722 Eh/α   predicted    -0.2199944E-06 ( -31.27%)
   displ. norm   :     0.0002743 α      lambda       -0.2835093E-07
   maximum displ.:     0.0001839 α      in ANC's #3, #2, #1, ...

   *** GEOMETRY OPTIMIZATION CONVERGED AFTER 7 ITERATIONS ***

------------------------------------------------------------------------
 total energy gain   :        -0.0085291 Eh       -5.3521 kcal/mol
 total RMSD          :         0.0881068 a0        0.0466 Å
 total power (kW/mol):        -3.1990282 (step)-2114.1646 (real)
------------------------------------------------------------------------

 ANCopt (total)                0 d,  0 h,  0 min,  0.011 sec
 optimizer setup                ...        0 min,  0.000 sec (  0.605%)
 model hessian                  ...        0 min,  0.000 sec (  0.367%)
 ANC generation                 ...        0 min,  0.000 sec (  0.340%)
 coordinate transformation      ...        0 min,  0.000 sec (  0.135%)
 single point calculation       ...        0 min,  0.010 sec ( 94.095%)
 optimization log               ...        0 min,  0.000 sec (  1.143%)
 hessian update                 ...        0 min,  0.000 sec (  0.148%)
 rational function              ...        0 min,  0.000 sec (  1.149%)

================
 final structure:
================
3
 xtb: 6.2.2 (9d81278992624c895f80dd42a50cac0aa55982e2)
C         0.75041292548007   -0.14071876878111    0.03633516093634
O        -0.25803529211251    0.74812885871463   -0.01290712850144
N        -0.49237763336756   -0.60741008993352   -0.02342803243490

 Bond Distances (Angstroems)
 ---------------------------
C1-O2=1.3452         C1-N3=1.3289         O2-C1=1.3452         O2-N3=1.3757         N3-C1=1.3289         N3-O2=1.3757         
 N  C  Rav=1.3289 sigma=0.0000  Rmin=1.3289  Rmax=1.3289     1
 O  C  Rav=1.3452 sigma=0.0000  Rmin=1.3452  Rmax=1.3452     1
 O  N  Rav=1.3757 sigma=0.0000  Rmin=1.3757  Rmax=1.3757     1

 selected bond angles (degree)
 --------------------
N3-C1-O2= 61.92                N3-O2-C1= 58.46                O2-N3-C1= 59.62                

 selected dihedral angles (degree)
 ---------------------------------

           -------------------------------------------------
          |                Final Singlepoint                |
           -------------------------------------------------

          ...................................................
          :                      SETUP                      :
          :.................................................:
          :  # basis functions                  12          :
          :  # atomic orbitals                  12          :
          :  # shells                            6          :
          :  # electrons                        15          :
          :  max. iterations                   250          :
          :  Hamiltonian                  GFN2-xTB          :
          :  restarted?                      false          :
          :  GBSA solvation                  false          :
          :  PC potential                    false          :
          :  electronic temp.          300.0000000     K    :
          :  accuracy                    1.0000000          :
          :  -> integral cutoff          0.2500000E+02      :
          :  -> integral neglect         0.1000000E-07      :
          :  -> SCF convergence          0.1000000E-05 Eh   :
          :  -> wf. convergence          0.1000000E-03 e    :
          :  Broyden damping             0.4000000          :
          ...................................................

 iter      E             dE          RMSdq      gap      omega  full diag
   1     -8.9238779 -0.892388E+01  0.587E-05    2.93       0.0  T
   2     -8.9238779 -0.442313E-12  0.395E-05    2.93    1461.4  T
   3     -8.9238779 -0.254019E-12  0.712E-06    2.93    8113.3  T

   *** convergence criteria satisfied after 3 iterations ***

         #    Occupation            Energy/Eh            Energy/eV
      -------------------------------------------------------------
         1        2.0000           -0.8341750             -22.6991
         2        2.0000           -0.7142002             -19.4344
         3        2.0000           -0.6870302             -18.6950
         4        2.0000           -0.6516596             -17.7326
         5        2.0000           -0.5790770             -15.7575
         6        2.0000           -0.5197191             -14.1423
         7        2.0000           -0.4725106             -12.8577
         8        1.0000           -0.4475266             -12.1778 (HOMO)
         9                         -0.3397704              -9.2456 (LUMO)
        10                         -0.1513870              -4.1195
        11                          0.0019037               0.0518
        12                          0.3147507               8.5648
      -------------------------------------------------------------
                  HL-Gap            0.1077562 Eh            2.9322 eV
             Fermi-level           -0.4268336 Eh          -11.6147 eV

 SCC (total)                   0 d,  0 h,  0 min,  0.002 sec
 SCC setup                      ...        0 min,  0.000 sec (  6.228%)
 Dispersion                     ...        0 min,  0.000 sec (  0.392%)
 integral evaluation            ...        0 min,  0.001 sec ( 31.167%)
 zeroth order Hamiltonian       ...        0 min,  0.000 sec (  0.554%)
 iterations                     ...        0 min,  0.001 sec ( 29.289%)
 molecular gradient             ...        0 min,  0.001 sec ( 28.384%)
 printout                       ...        0 min,  0.000 sec (  3.567%)

         :::::::::::::::::::::::::::::::::::::::::::::::::::::
         ::                     SUMMARY                     ::
         :::::::::::::::::::::::::::::::::::::::::::::::::::::
         :: total energy              -8.879992189619 Eh    ::
         :: gradient norm              0.000171206695 Eh/a0 ::
         :: HOMO-LUMO gap              2.932195897234 eV    ::
         ::.................................................::
         :: SCC energy                -8.923877894234 Eh    ::
         :: -> isotropic ES           -0.002120123591 Eh    ::
         :: -> anisotropic ES          0.007220345293 Eh    ::
         :: -> anisotropic XC          0.007815774283 Eh    ::
         :: -> dispersion             -0.000754174239 Eh    ::
         :: repulsion energy           0.043885703862 Eh    ::
         :: add. restraining           0.000000000000 Eh    ::
         :::::::::::::::::::::::::::::::::::::::::::::::::::::

           ------------------------------------------------- 
          |                Numerical Hessian                |
           ------------------------------------------------- 
step length          :   0.00500
SCC accuracy         :   0.30000
Hessian scale factor :   1.00000
frozen atoms in %    :   0.00000    0
RMS gradient         :   0.00017
estimated CPU  time      0.00 min
estimated wall time      0.00 min

writing file <hessian>.

 projected vibrational frequencies (cm-1)
eigval :       -0.00    -0.00    -0.00     0.00     0.00     0.00
eigval :      803.74  1113.64  1605.93
           -------------------------------------------------
          |                Property Printout                |
           -------------------------------------------------

    * Orbital Energies and Occupations

         #    Occupation            Energy/Eh            Energy/eV
      -------------------------------------------------------------
         1        2.0000           -0.8341750             -22.6991
         2        2.0000           -0.7142002             -19.4344
         3        2.0000           -0.6870302             -18.6950
         4        2.0000           -0.6516597             -17.7326
         5        2.0000           -0.5790770             -15.7575
         6        2.0000           -0.5197190             -14.1423
         7        2.0000           -0.4725105             -12.8577
         8        1.0000           -0.4475267             -12.1778 (HOMO)
         9                         -0.3397703              -9.2456 (LUMO)
        10                         -0.1513870              -4.1195
        11                          0.0019037               0.0518
        12                          0.3147507               8.5648
      -------------------------------------------------------------
                  HL-Gap            0.1077563 Eh            2.9322 eV
             Fermi-level           -0.4268335 Eh          -11.6147 eV

     #   Z        covCN         q      C6AA      α(0)
     1   6 C      1.764     0.036    30.328     8.904
     2   8 O      1.770    -0.047    15.095     5.246
     3   7 N      1.827     0.011    21.742     6.909

 Mol. C6AA /au·bohr⁶  :        196.491309
 Mol. C8AA /au·bohr⁸  :       4731.585823
 Mol. α(0) /au        :         21.059943


Wiberg/Mayer (AO) data.
largest (>0.10) Wiberg bond orders for each atom
          total WBO             WBO to atom ...
     1  C   2.449        N    3 1.347    O    2 1.102
     2  O   2.103        C    1 1.102    N    3 1.001
     3  N   2.348        C    1 1.347    O    2 1.001

MOs/occ written to file <molden.input>


molecular dipole:
                 x           y           z       tot (Debye)
 q only:        0.064      -0.090       0.003
   full:       -0.212       0.184      -0.010       0.715
molecular quadrupole (traceless):
                xx          xy          yy          xz          yz          zz
 q only:        0.110       0.047      -0.113       0.005       0.002       0.003
  q+dip:       -0.963       0.186      -0.624      -0.124       0.010       1.588
   full:       -2.048       0.026      -0.614      -0.228       0.003       2.662

           -------------------------------------------------
          |                Geometry Summary                 |
           -------------------------------------------------

      molecular mass/u    :       42.0168440
   center of mass at/Å    :       -0.0478850       0.0421659      -0.0023381
  moments of inertia/u·Å² :        0.1115189E+02   0.1428791E+02   0.2543979E+02
rotational constants/cm⁻¹ :        0.1511639E+01   0.1179853E+01   0.6626481E+00

           -------------------------------------------------
          |               Frequency Printout                |
Molecule has the following symmetry elements: (sigma) 
It seems to be the Cs point group
           -------------------------------------------------
 projected vibrational frequencies (cm-1)
eigval :       -0.00    -0.00    -0.00     0.00     0.00     0.00
eigval :      803.74  1113.64  1605.93
 reduced masses (amu)
   1: 14.01   2: 14.12   3: 15.16   4: 12.03   5: 14.10   6: 15.05   7: 13.77   8: 14.54
   9: 13.29
 IR intensities (amu)
   1:  0.00   2:  0.08   3:  0.12   4:  0.11   5:  0.11   6:  0.04   7:  0.73   8:  0.68
   9:  0.40
 Raman intensities (amu)
   1:  0.00   2:  0.00   3:  0.00   4:  0.00   5:  0.00   6:  0.00   7:  0.00   8:  0.00
   9:  0.00
 output can be read by thermo (or use thermo option).
 writing <g98.out> molden fake output.
 recommended (thermochemical) frequency scaling factor: 1.0
           -------------------------------------------------
          |             Thermodynamic Functions             |
           -------------------------------------------------

cs  symmetry found (for desy threshold:  0.10E+00) used in thermo

          ...................................................
          :                      SETUP                      :
          :.................................................:
          :  # frequencies                           3      :
          :  # imaginary freq.                       0      :
          :  linear?                             false      :
          :  only rotor calc.                    false      :
          :  symmetry                               cs      :
          :  rotational number                       1      :
          :  scaling factor                  1.0000000      :
          :  rotor cutoff                   50.0000000 cm⁻¹ :
          :  imag. cutoff                  -20.0000000 cm⁻¹ :
          :.................................................:

    mode    ω/cm⁻¹     T·S(HO)/kcal·mol⁻¹    T·S(FR)/kcal·mol⁻¹   T·S(vib)
   ------------------------------------------------------------------------
   ------------------------------------------------------------------------

   temp. (K)  partition function   enthalpy   heat capacity  entropy
                                   cal/mol     cal/K/mol   cal/K/mol   J/K/mol
 298.15  VIB   1.03                   65.335      0.965      0.271
         ROT  0.486E+04              888.752      2.981     19.852
         INT  0.499E+04              954.088      3.945     20.123
         TR   0.264E+27             1481.254      4.968     37.117
         TOT                        2435.3416     8.9136    57.2391   239.4883

   temp. (K)  partition function   enthalpy   heat capacity  entropy
                                   cal/mol     cal/K/mol   cal/K/mol   J/K/mol
 120.00  VIB   1.00                    0.155      0.013      0.001
         ROT  0.124E+04              357.707      2.981     17.139
         INT  0.124E+04              357.862      2.994     17.140
         TR   0.673E+26              596.178      4.968     32.597
         TOT                         954.0399     7.9617    49.7375   208.1016

   temp. (K)  partition function   enthalpy   heat capacity  entropy
                                   cal/mol     cal/K/mol   cal/K/mol   J/K/mol
 100.00  VIB   1.00                    0.022      0.003      0.000
         ROT   945.                  298.089      2.981     16.595
         INT   945.                  298.111      2.983     16.596
         TR   0.512E+26              496.815      4.968     31.692
         TOT                         794.9262     7.9516    48.2875   202.0347

   temp. (K)  partition function   enthalpy   heat capacity  entropy
                                   cal/mol     cal/K/mol   cal/K/mol   J/K/mol
  80.00  VIB   1.00                    0.001      0.000      0.000
         ROT   676.                  238.471      2.981     15.930
         INT   676.                  238.472      2.981     15.930
         TR   0.366E+26              397.452      4.968     30.584
         TOT                         635.9244     7.9493    46.5140   194.6145

   temp. (K)  partition function   enthalpy   heat capacity  entropy
                                   cal/mol     cal/K/mol   cal/K/mol   J/K/mol
  60.00  VIB   1.00                    0.000      0.000     -0.000
         ROT   439.                  178.853      2.981     15.073
         INT   439.                  178.853      2.981     15.073
         TR   0.238E+26              298.089      4.968     29.155
         TOT                         476.9424     7.9490    44.2279   185.0494

   temp. (K)  partition function   enthalpy   heat capacity  entropy
                                   cal/mol     cal/K/mol   cal/K/mol   J/K/mol
  40.00  VIB   1.00                    0.000      0.000     -0.000
         ROT   239.                  119.236      2.981     13.864
         INT   239.                  119.236      2.981     13.864
         TR   0.129E+26              198.726      4.968     27.142
         TOT                         317.9616     7.9490    41.0058   171.5682

   temp. (K)  partition function   enthalpy   heat capacity  entropy
                                   cal/mol     cal/K/mol   cal/K/mol   J/K/mol
  20.00  VIB   1.00                    0.000      0.000     -0.000
         ROT   84.5                   59.618      2.981     11.798
         INT   84.5                   59.618      2.981     11.798
         TR   0.458E+25               99.363      4.968     23.700
         TOT                         158.9808     7.9490    35.4976   148.5220

   temp. (K)  partition function   enthalpy   heat capacity  entropy
                                   cal/mol     cal/K/mol   cal/K/mol   J/K/mol
  10.00  VIB   1.00                    0.000      0.000     -0.000
         ROT   29.9                   29.809      2.981      9.732
         INT   29.9                   29.809      2.981      9.732
         TR   0.162E+25               49.681      4.968     20.258
         TOT                          79.4904     7.9490    29.9894   125.4757

       T/K    H(0)-H(T)+PV         H(T)/Eh          T*S/Eh         G(T)/Eh
   ------------------------------------------------------------------------
    298.15    0.388096E-02    0.119076E-01    0.271961E-01   -0.152885E-01
    120.00    0.152036E-02    0.954703E-02    0.951141E-02    0.356215E-04
    100.00    0.126680E-02    0.929346E-02    0.769510E-02    0.159837E-02
     80.00    0.101341E-02    0.904008E-02    0.592998E-02    0.311010E-02
     60.00    0.760056E-03    0.878673E-02    0.422890E-02    0.455783E-02
     40.00    0.506704E-03    0.853337E-02    0.261388E-02    0.591950E-02
     20.00    0.253352E-03    0.828002E-02    0.113138E-02    0.714864E-02
     10.00    0.126676E-03    0.815335E-02    0.477912E-03    0.767543E-02 (used)
   ------------------------------------------------------------------------

         :::::::::::::::::::::::::::::::::::::::::::::::::::::
         ::                  THERMODYNAMIC                  ::
         :::::::::::::::::::::::::::::::::::::::::::::::::::::
         :: total free energy          -8.872316756121 Eh   ::
         ::.................................................::
         :: total energy               -8.879992189623 Eh   ::
         :: zero point energy           0.008026669276 Eh   ::
         :: G(RRHO) w/o ZPVE           -0.000351235774 Eh   ::
         :: G(RRHO) contrib.            0.007675433502 Eh   ::
         :::::::::::::::::::::::::::::::::::::::::::::::::::::

optimized geometry written to: xtbopt.xyz


           -------------------------------------------------
          | TOTAL ENERGY               -8.879992189623 Eh   |
          | TOTAL ENTHALPY             -8.871838844331 Eh   |
          | TOTAL FREE ENERGY          -8.872316756121 Eh   |
          | GRADIENT NORM               0.000171160211 Eh/α |
          | HOMO-LUMO GAP               2.932198576374 eV   |
           -------------------------------------------------

------------------------------------------------------------------------
 * finished run on 2020/05/12 at 11:44:41.496     
------------------------------------------------------------------------
 total:
 * wall-time:     0 d,  0 h,  0 min,  0.058 sec
 *  cpu-time:     0 d,  0 h,  0 min,  0.058 sec
 * ratio c/w:     0.998 speedup
 SCF:
 * wall-time:     0 d,  0 h,  0 min,  0.002 sec
 *  cpu-time:     0 d,  0 h,  0 min,  0.002 sec
 * ratio c/w:     1.000 speedup
 ANC optimizer:
 * wall-time:     0 d,  0 h,  0 min,  0.013 sec
 *  cpu-time:     0 d,  0 h,  0 min,  0.013 sec
 * ratio c/w:     0.999 speedup
 numerical hessian:
 * wall-time:     0 d,  0 h,  0 min,  0.027 sec
 *  cpu-time:     0 d,  0 h,  0 min,  0.027 sec
 * ratio c/w:     0.998 speedup

