      -----------------------------------------------------------      
     |                   =====================                   |     
     |                           x T B                           |     
     |                   =====================                   |     
     |                         S. Grimme                         |     
     |          Mulliken Center for Theoretical Chemistry        |     
     |                    University of Bonn                     |     
      -----------------------------------------------------------      

   * xtb version 6.2.2 (9d81278992624c895f80dd42a50cac0aa55982e2) compiled by '@Darwin' on 04/03/2020

   xtb is free software: you can redistribute it and/or modify it under
   the terms of the GNU Lesser General Public License as published by
   the Free Software Foundation, either version 3 of the License, or
   (at your option) any later version.
   
   xtb is distributed in the hope that it will be useful,
   but WITHOUT ANY WARRANTY; without even the implied warranty of
   MERCHANTABILITY or FITNESS FOR A PARTICULAR PURPOSE.  See the
   GNU Lesser General Public License for more details.
   
   Cite this work as:
   * S. Grimme, C. Bannwarth, P. Shushkov, J. Chem. Theory Comput., 2017,
     13, 1989-2009. DOI: 10.1021/acs.jctc.7b00118
   * C. Bannwarth, S. Ehlert and S. Grimme., J. Chem. Theory Comput., 2019,
     15, 1652-1671. DOI: 10.1021/acs.jctc.8b01176
   * P. Pracht, E. Caldeweyher, S. Ehlert, S. Grimme, ChemRxiv, 2019, preprint.
     DOI: 10.26434/chemrxiv.8326202.v1
   
   for DFT-D4:
   * E. Caldeweyher, C. Bannwarth and S. Grimme, J. Chem. Phys., 2017,
     147, 034112. DOI: 10.1063/1.4993215
   * E. Caldeweyher, S. Ehlert, A. Hansen, H. Neugebauer, S. Spicher,
     C. Bannwarth and S. Grimme, J. Chem. Phys., 2019, 150, 154122.
     DOI: 10.1063/1.5090222
   
   for sTDA-xTB:
   * S. Grimme and C. Bannwarth, J. Chem. Phys., 2016, 145, 054103.
     DOI: 10.1063/1.4959605
   
   in the mass-spec context:
   * V. Asgeirsson, C. Bauer and S. Grimme, Chem. Sci., 2017, 8, 4879.
     DOI: 10.1039/c7sc00601b
   
   for metadynamics refer to:
   * S. Grimme, J. Chem. Theory Comput., 2019, 155, 2847-2862
     DOI: 10.1021/acs.jctc.9b00143
   
   with help from (in alphabetical order)
   C. Bannwarth, F. Bohle, G. Brandenburg, E. Caldeweyher, M. Checinski,
   S. Dohm, S. Ehlert, S. Ehrlich, F. März, H. Neugebauer, J. Pisarek,
   P. Pracht, P. Shushkov, and S. Spicher.
   
 * started run on 2020/05/12 at 11:44:12.926     

           -------------------------------------------------
          |                Calculation Setup                |
           -------------------------------------------------

          program call               : xtb --input C4N1_33_S_3.input C4N1_33_S_3.xyz --ohess --molden --namespace C4N1_33_S_3 output.out
          calculation namespace      : C4N1_33_S_3
          coordinate file            : C4N1_33_S_3.xyz
          number of atoms            :                     5
          number of electrons        :                    21
          charge                     :                     0
          spin                       :                   1.5
          first test random number   :      0.76622677269827

   ID    Z sym.   atoms
    1    7 N      1
    2    6 C      2-5

           -------------------------------------------------
          |                 G F N 2 - x T B                 |
           -------------------------------------------------

        Reference                      10.1021/acs.jctc.8b01176
      * Hamiltonian:
        H0-scaling (s, p, d)           1.850000    2.230000    2.230000
        zeta-weighting                 0.500000
      * Dispersion:
        s8                             2.700000
        a1                             0.520000
        a2                             5.000000
        s9                             5.000000
      * Repulsion:
        kExp                           1.500000    1.000000
        rExp                           1.000000
      * Coulomb:
        alpha                          2.000000
        third order                    shell-resolved
        anisotropic                    true
        a3                             3.000000
        a5                             4.000000
        cn-shift                       1.200000
        cn-exp                         4.000000
        max-rad                        5.000000


          ...................................................
          :                      SETUP                      :
          :.................................................:
          :  # basis functions                  20          :
          :  # atomic orbitals                  20          :
          :  # shells                           10          :
          :  # electrons                        21          :
          :  max. iterations                   250          :
          :  Hamiltonian                  GFN2-xTB          :
          :  restarted?                      false          :
          :  GBSA solvation                  false          :
          :  PC potential                    false          :
          :  electronic temp.          300.0000000     K    :
          :  accuracy                    1.0000000          :
          :  -> integral cutoff          0.2500000E+02      :
          :  -> integral neglect         0.1000000E-07      :
          :  -> SCF convergence          0.1000000E-05 Eh   :
          :  -> wf. convergence          0.1000000E-03 e    :
          :  Broyden damping             0.4000000          :
          ...................................................

 iter      E             dE          RMSdq      gap      omega  full diag
   1    -10.8059772 -0.108060E+02  0.993E+00    0.26       0.0  T
   2     -9.5747342  0.123124E+01  0.119E+01    0.57       1.0  T
   3     -9.9793125 -0.404578E+00  0.100E+01    1.53       1.0  T
   4    -10.8780633 -0.898751E+00  0.533E+00    0.11       1.0  T
   5    -10.8949408 -0.168775E-01  0.373E+00    0.42       1.0  T
   6    -10.9078634 -0.129226E-01  0.349E+00    0.36       1.0  T
   7    -10.8859897  0.218737E-01  0.358E+00    0.43       1.0  T
   8    -10.9646650 -0.786753E-01  0.104E+00    0.12       1.0  T
   9    -10.9329533  0.317117E-01  0.232E+00    0.10       1.0  T
  10    -10.9280806  0.487277E-02  0.246E+00    0.10       1.0  T
  11    -10.9553265 -0.272459E-01  0.147E+00    0.09       1.0  T
  12    -10.9622103 -0.688384E-02  0.105E+00    0.08       1.0  T
  13    -10.9619341  0.276206E-03  0.105E+00    0.08       1.0  T
  14    -10.9687981 -0.686398E-02  0.396E-01    0.09       1.0  T
  15    -10.9692960 -0.497868E-03  0.288E-01    0.09       1.0  T
  16    -10.9696077 -0.311718E-03  0.189E-01    0.10       1.0  T
  17    -10.9696981 -0.903832E-04  0.138E-01    0.10       1.0  T
  18    -10.9697621 -0.640612E-04  0.913E-02    0.10       1.0  T
  19    -10.9697946 -0.325007E-04  0.570E-02    0.10       1.0  T
  20    -10.9698099 -0.152360E-04  0.334E-02    0.10       1.3  T
  21    -10.9698147 -0.482527E-05  0.212E-02    0.10       2.1  T
  22    -10.9698177 -0.305564E-05  0.311E-03    0.10      14.4  T
  23    -10.9698178 -0.492528E-07  0.125E-03    0.10      35.9  T
  24    -10.9698178 -0.956724E-08  0.220E-04    0.10     203.6  T
  25    -10.9698178 -0.566818E-10  0.208E-04    0.10     215.5  T

   *** convergence criteria satisfied after 25 iterations ***

         #    Occupation            Energy/Eh            Energy/eV
      -------------------------------------------------------------
         1        2.0000           -0.7533747             -20.5004
       ...           ...                  ...                  ...
         6        2.0000           -0.5458363             -14.8530
         7        2.0000           -0.5340568             -14.5324
         8        2.0000           -0.4993420             -13.5878
         9        1.9882           -0.4630024             -12.5989
        10        1.0118           -0.4545906             -12.3700
        11        1.0000           -0.4371924             -11.8966
        12        0.8784           -0.3817919             -10.3891 (HOMO)
        13        0.1216           -0.3780356             -10.2869 (LUMO)
        14        0.0000           -0.3685559             -10.0289
        15                         -0.2540623              -6.9134
        16                         -0.0287936              -0.7835
        17                         -0.0009700              -0.0264
       ...                                ...                  ...
        20                          0.2010945               5.4721
      -------------------------------------------------------------
                  HL-Gap            0.0037564 Eh            0.1022 eV
             Fermi-level           -0.4193551 Eh          -11.4112 eV

 SCC (total)                   0 d,  0 h,  0 min,  0.007 sec
 SCC setup                      ...        0 min,  0.000 sec (  1.451%)
 Dispersion                     ...        0 min,  0.000 sec (  0.305%)
 integral evaluation            ...        0 min,  0.002 sec ( 23.544%)
 zeroth order Hamiltonian       ...        0 min,  0.000 sec (  0.396%)
 iterations                     ...        0 min,  0.003 sec ( 47.073%)
 molecular gradient             ...        0 min,  0.002 sec ( 25.278%)
 printout                       ...        0 min,  0.000 sec (  1.800%)

         :::::::::::::::::::::::::::::::::::::::::::::::::::::
         ::                     SUMMARY                     ::
         :::::::::::::::::::::::::::::::::::::::::::::::::::::
         :: total energy             -10.885018839642 Eh    ::
         :: gradient norm              0.182160057570 Eh/a0 ::
         :: HOMO-LUMO gap              0.102216428570 eV    ::
         ::.................................................::
         :: SCC energy               -10.969817805847 Eh    ::
         :: -> isotropic ES           -0.012263820474 Eh    ::
         :: -> anisotropic ES          0.001509382189 Eh    ::
         :: -> anisotropic XC          0.007847712932 Eh    ::
         :: -> dispersion             -0.002905303505 Eh    ::
         :: repulsion energy           0.084798891797 Eh    ::
         :: add. restraining           0.000000000000 Eh    ::
         :::::::::::::::::::::::::::::::::::::::::::::::::::::

      ----------------------------------------------------------- 
     |                   =====================                   |
     |                        A N C O P T                        |
     |                   =====================                   |
     |               Approximate Normal Coordinate               |
     |                Rational Function Optimizer                |
      ----------------------------------------------------------- 

          ...................................................
          :                      SETUP                      :
          :.................................................:
          :   optimization level            normal          :
          :   max. optcycles                   200          :
          :   ANC micro-cycles                  20          :
          :   degrees of freedom                 9          :
          :.................................................:
          :   RF solver                   davidson          :
          :   write xtbopt.log                true          :
          :   linear?                        false          :
          :   energy convergence         0.5000000E-05 Eh   :
          :   grad. convergence          0.1000000E-02 Eh/α :
          :   maximium RF displ.         1.0000000          :
          :   Hlow (freq-cutoff)         0.1000000E-01      :
          :   Hmax (freq-cutoff)         5.0000000          :
          :   S6 in model hess.         20.0000000          :
          ...................................................

generating ANC from model Hessian ...
Using Lindh-Hessian (1995)
 Shifting diagonal of input Hessian by    0.0000000000000000     
 Lowest  eigenvalues of input Hessian
   -0.000000   -0.000000   -0.000000   -0.000000    0.000000    0.000000
    0.034758    0.057155    0.133626    0.593118    0.659314    0.843840
    0.930766    1.333937    1.467495
 Highest eigenvalues
    0.593118    0.659314    0.843840    0.930766    1.333937    1.467495


........................................................................
.............................. CYCLE    1 ..............................
........................................................................
   1    -10.9698178 -0.109698E+02  0.701E-05    0.10       0.0  T
   2    -10.9698178  0.755308E-08  0.908E-04    0.10      49.2  T
   3    -10.9698178 -0.744654E-08  0.125E-04    0.10     357.3  T
     SCC iter.                  ...        0 min,  0.000 sec
     gradient                   ...        0 min,  0.001 sec
 * total energy  :   -10.8850188 Eh     change       -0.4717897E-09 Eh
   gradient norm :     0.1821603 Eh/α   predicted     0.0000000E+00 (-100.00%)
   displ. norm   :     0.2175070 α      lambda       -0.3723315E-01
   maximum displ.:     0.1764467 α      in ANC's #4, #6, #8, ...

........................................................................
.............................. CYCLE    2 ..............................
........................................................................
   1    -11.0148367 -0.110148E+02  0.235E+00    0.13       0.0  T
   2    -10.8919679  0.122869E+00  0.358E+00    0.18       1.0  T
   3    -10.5725120  0.319456E+00  0.700E+00    0.09       1.0  T
   4    -11.0172434 -0.444731E+00  0.145E+00    0.08       1.0  T
   5    -11.0231198 -0.587639E-02  0.112E+00    0.16       1.0  T
   6    -11.0208578  0.226201E-02  0.101E+00    0.09       1.0  T
   7    -11.0233885 -0.253070E-02  0.760E-01    0.10       1.0  T
   8    -11.0252492 -0.186070E-02  0.538E-01    0.10       1.0  T
   9    -11.0269329 -0.168373E-02  0.310E-01    0.09       1.0  T
  10    -11.0269414 -0.843766E-05  0.311E-01    0.09       1.0  T
  11    -11.0269626 -0.211652E-04  0.230E-01    0.08       1.0  T
  12    -11.0270205 -0.579797E-04  0.160E-01    0.08       1.0  T
  13    -11.0270627 -0.421191E-04  0.948E-02    0.08       1.0  T
  14    -11.0270951 -0.324783E-04  0.157E-02    0.08       2.8  T
  15    -11.0270959 -0.747876E-06  0.428E-03    0.08      10.5  T
  16    -11.0270959 -0.413670E-07  0.149E-03    0.08      30.0  T
  17    -11.0270959 -0.334243E-09  0.359E-04    0.08     124.6  T
  18    -11.0270959 -0.605478E-09  0.127E-04    0.08     351.3  T
     SCC iter.                  ...        0 min,  0.002 sec
     gradient                   ...        0 min,  0.001 sec
 * total energy  :   -10.9164166 Eh     change       -0.3139774E-01 Eh
   gradient norm :     0.1253667 Eh/α   predicted    -0.1949731E-01 ( -37.90%)
   displ. norm   :     0.6759107 α      lambda       -0.7855222E-01
   maximum displ.:     0.4485712 α      in ANC's #4, #3, #6, ...

........................................................................
.............................. CYCLE    3 ..............................
........................................................................
   1    -10.9834511 -0.109835E+02  0.624E+00    0.18       0.0  T
   2     -9.9456693  0.103778E+01  0.973E+00    0.65       1.0  T
   3    -11.0370876 -0.109142E+01  0.555E+00    0.35       1.0  T
   4    -11.1508915 -0.113804E+00  0.342E+00    0.14       1.0  T
   5    -11.1323209  0.185706E-01  0.262E+00    0.03       1.0  T
   6    -11.1111980  0.211229E-01  0.313E+00    0.18       1.0  T
   7    -11.1067989  0.439913E-02  0.334E+00    0.17       1.0  T
   8    -11.1500241 -0.432253E-01  0.194E+00    0.07       1.0  T
   9    -11.1461240  0.390011E-02  0.191E+00    0.10       1.0  T
  10    -11.1682948 -0.221708E-01  0.529E-01    0.04       1.0  T
  11    -11.1686141 -0.319301E-03  0.453E-01    0.03       1.0  T
  12    -11.1691326 -0.518526E-03  0.165E-01    0.04       1.0  T
  13    -11.1690919  0.406951E-04  0.126E-01    0.04       1.0  T
  14    -11.1691338 -0.418240E-04  0.799E-02    0.05       1.0  T
  15    -11.1691456 -0.118859E-04  0.311E-02    0.04       1.4  T
  16    -11.1691453  0.372998E-06  0.250E-02    0.04       1.8  T
  17    -11.1691487 -0.342994E-05  0.547E-03    0.04       8.2  T
  18    -11.1691488 -0.487595E-07  0.248E-03    0.04      18.0  T
  19    -11.1691488 -0.113061E-07  0.245E-03    0.04      18.2  T
  20    -11.1691488 -0.295595E-07  0.420E-04    0.04     106.5  T
  21    -11.1691488 -0.472214E-09  0.184E-04    0.04     243.3  T
     SCC iter.                  ...        0 min,  0.002 sec
     gradient                   ...        0 min,  0.001 sec
 * total energy  :   -10.9014180 Eh     change        0.1499859E-01 Eh
   gradient norm :     0.3864758 Eh/α   predicted    -0.5721959E-01 (-481.50%)
   displ. norm   :     0.3711735 α      lambda       -0.9919435E-01
   maximum displ.:     0.3167607 α      in ANC's #1, #6, #3, ...

........................................................................
.............................. CYCLE    4 ..............................
........................................................................
   1    -11.0314158 -0.110314E+02  0.450E+00    0.33       0.0  T
   2    -10.1158621  0.915554E+00  0.857E+00    1.08       1.0  T
   3    -10.8591433 -0.743281E+00  0.482E+00    0.16       1.0  T
   4    -11.0913909 -0.232248E+00  0.207E+00    0.06       1.0  T
   5    -11.0948335 -0.344260E-02  0.184E+00    0.03       1.0  T
   6    -11.0896353  0.519826E-02  0.162E+00    0.03       1.0  T
   7    -11.0645903  0.250450E-01  0.268E+00    0.08       1.0  T
   8    -11.0824946 -0.179044E-01  0.197E+00    0.09       1.0  T
   9    -11.0965696 -0.140750E-01  0.136E+00    0.03       1.0  T
  10    -11.0896760  0.689364E-02  0.164E+00    0.05       1.0  T
  11    -11.0924925 -0.281656E-02  0.132E+00    0.04       1.0  T
  12    -11.1002320 -0.773950E-02  0.659E-01    0.02       1.0  T
  13    -11.1001511  0.809179E-04  0.616E-01    0.02       1.0  T
  14    -11.1006482 -0.497100E-03  0.390E-01    0.02       1.0  T
  15    -11.1011007 -0.452533E-03  0.404E-02    0.00       1.1  T
  16    -11.1010972  0.351129E-05  0.319E-02    0.01       1.4  T
  17    -11.1011000 -0.275666E-05  0.260E-02    0.00       1.7  T
  18    -11.1011013 -0.127209E-05  0.612E-03    0.00       7.3  T
  19    -11.1011013 -0.162902E-07  0.256E-03    0.00      17.4  T
  20    -11.1011013 -0.122336E-07  0.122E-03    0.00      36.6  T
  21    -11.1011013 -0.510227E-08  0.471E-04    0.00      95.0  T
  22    -11.1011013 -0.101174E-08  0.146E-04    0.00     306.9  T
     SCC iter.                  ...        0 min,  0.003 sec
     gradient                   ...        0 min,  0.001 sec
 * total energy  :   -10.9467077 Eh     change       -0.4528976E-01 Eh
   gradient norm :     0.0975374 Eh/α   predicted    -0.5643015E-01 (  24.60%)
   displ. norm   :     0.4604582 α      lambda       -0.1905720E-01
   maximum displ.:     0.4384348 α      in ANC's #1, #4, #3, ...

........................................................................
.............................. CYCLE    5 ..............................
........................................................................
   1    -11.0911759 -0.110912E+02  0.318E+00    0.13       0.0  T
   2    -11.0125807  0.785952E-01  0.321E+00    0.14       1.0  T
   3    -10.6948163  0.317764E+00  0.634E+00    0.22       1.0  T
   4    -11.0616487 -0.366832E+00  0.305E+00    0.31       1.0  T
   5    -11.0834066 -0.217578E-01  0.156E+00    0.09       1.0  T
   6    -11.0896481 -0.624153E-02  0.116E+00    0.12       1.0  T
   7    -11.0897160 -0.678799E-04  0.114E+00    0.12       1.0  T
   8    -11.0924342 -0.271826E-02  0.791E-01    0.12       1.0  T
   9    -11.0925606 -0.126415E-03  0.506E-01    0.10       1.0  T
  10    -11.0930710 -0.510332E-03  0.378E-01    0.10       1.0  T
  11    -11.0940879 -0.101694E-02  0.639E-02    0.11       1.0  T
  12    -11.0940851  0.283640E-05  0.448E-02    0.11       1.0  T
  13    -11.0940840  0.103361E-05  0.369E-02    0.11       1.2  T
  14    -11.0940941 -0.100708E-04  0.467E-03    0.11       9.6  T
  15    -11.0940941 -0.292348E-07  0.207E-03    0.11      21.6  T
  16    -11.0940942 -0.542599E-08  0.536E-04    0.11      83.5  T
  17    -11.0940942 -0.199574E-08  0.166E-04    0.11     269.3  T
     SCC iter.                  ...        0 min,  0.002 sec
     gradient                   ...        0 min,  0.001 sec
 * total energy  :   -10.9633701 Eh     change       -0.1666231E-01 Eh
   gradient norm :     0.1077045 Eh/α   predicted    -0.1154887E-01 ( -30.69%)
   displ. norm   :     0.6284406 α      lambda       -0.2286817E-01
   maximum displ.:     0.5486022 α      in ANC's #1, #4, #9, ...

........................................................................
.............................. CYCLE    6 ..............................
........................................................................
   1    -11.0419163 -0.110419E+02  0.277E+00    0.15       0.0  T
   2    -10.6205178  0.421398E+00  0.679E+00    0.01       1.0  T
   3    -11.0498467 -0.429329E+00  0.213E+00    0.29       1.0  T
   4    -10.9722751  0.775716E-01  0.286E+00    0.09       1.0  T
   5    -11.0601748 -0.878997E-01  0.131E+00    0.22       1.0  T
   6    -11.0602374 -0.626229E-04  0.118E+00    0.22       1.0  T
   7    -11.0604919 -0.254476E-03  0.114E+00    0.21       1.0  T
   8    -11.0607485 -0.256668E-03  0.107E+00    0.21       1.0  T
   9    -11.0618562 -0.110770E-02  0.651E-01    0.18       1.0  T
  10    -11.0626766 -0.820391E-03  0.397E-01    0.16       1.0  T
  11    -11.0625147  0.161923E-03  0.474E-01    0.17       1.0  T
  12    -11.0631400 -0.625268E-03  0.332E-02    0.14       1.3  T
  13    -11.0631399  0.118542E-06  0.330E-02    0.14       1.4  T
  14    -11.0631337  0.610741E-05  0.484E-02    0.14       1.0  T
  15    -11.0631367 -0.297631E-05  0.399E-02    0.14       1.1  T
  16    -11.0631416 -0.484052E-05  0.372E-03    0.14      12.0  T
  17    -11.0631416 -0.362373E-07  0.167E-03    0.14      26.7  T
  18    -11.0631416 -0.985255E-08  0.236E-04    0.14     189.3  T
  19    -11.0631416  0.190532E-10  0.228E-04    0.14     196.4  T
     SCC iter.                  ...        0 min,  0.002 sec
     gradient                   ...        0 min,  0.001 sec
 * total energy  :   -10.9636928 Eh     change       -0.3227127E-03 Eh
   gradient norm :     0.1630018 Eh/α   predicted    -0.1594983E-01 (4842.42%)
   displ. norm   :     0.3283803 α      lambda       -0.2735561E-01
   maximum displ.:     0.3200000 α      in ANC's #1, #4, #6, ...

........................................................................
.............................. CYCLE    7 ..............................
........................................................................
   1    -11.0962813 -0.110963E+02  0.158E+00    0.56       0.0  T
   2    -10.9965220  0.997593E-01  0.319E+00    0.22       1.0  T
   3    -11.1051384 -0.108616E+00  0.754E-01    0.52       1.0  T
   4    -11.1052650 -0.126651E-03  0.403E-01    0.52       1.0  T
   5    -11.1067532 -0.148817E-02  0.132E-01    0.49       1.0  T
   6    -11.1067252  0.279678E-04  0.133E-01    0.49       1.0  T
   7    -11.1068148 -0.895967E-04  0.538E-02    0.49       1.0  T
   8    -11.1068293 -0.144585E-04  0.168E-02    0.49       2.7  T
   9    -11.1068296 -0.385071E-06  0.598E-03    0.49       7.5  T
  10    -11.1068297 -0.440064E-08  0.255E-03    0.49      17.5  T
  11    -11.1068297 -0.120962E-07  0.484E-04    0.49      92.3  T
  12    -11.1068297 -0.166978E-09  0.454E-05    0.49     986.0  T
     SCC iter.                  ...        0 min,  0.001 sec
     gradient                   ...        0 min,  0.001 sec
 * total energy  :   -10.9822607 Eh     change       -0.1856789E-01 Eh
   gradient norm :     0.1113233 Eh/α   predicted    -0.1515274E-01 ( -18.39%)
   displ. norm   :     0.1847817 α      lambda       -0.1090210E-01
   maximum displ.:     0.1424780 α      in ANC's #1, #3, #4, ...

........................................................................
.............................. CYCLE    8 ..............................
........................................................................
   1    -11.1362781 -0.111363E+02  0.111E+00    0.81       0.0  T
   2    -11.1230713  0.132068E-01  0.136E+00    0.71       1.0  T
   3    -11.1334423 -0.103710E-01  0.818E-01    0.85       1.0  T
   4    -11.1373954 -0.395312E-02  0.228E-01    0.80       1.0  T
   5    -11.1377085 -0.313046E-03  0.747E-02    0.81       1.0  T
   6    -11.1376765  0.319696E-04  0.779E-02    0.81       1.0  T
   7    -11.1376919 -0.153887E-04  0.559E-02    0.81       1.0  T
   8    -11.1377113 -0.193692E-04  0.129E-02    0.81       3.5  T
   9    -11.1377122 -0.989050E-06  0.419E-03    0.81      10.7  T
  10    -11.1377123 -0.183602E-07  0.303E-04    0.81     147.8  T
  11    -11.1377123 -0.799201E-09  0.120E-04    0.81     373.1  T
     SCC iter.                  ...        0 min,  0.001 sec
     gradient                   ...        0 min,  0.001 sec
 * total energy  :   -10.9897259 Eh     change       -0.7465287E-02 Eh
   gradient norm :     0.0808000 Eh/α   predicted    -0.5637172E-02 ( -24.49%)
   displ. norm   :     0.1378512 α      lambda       -0.9254973E-02
   maximum displ.:     0.0915759 α      in ANC's #8, #4, #3, ...

........................................................................
.............................. CYCLE    9 ..............................
........................................................................
   1    -11.1667525 -0.111668E+02  0.111E+00    1.16       0.0  T
   2    -11.1660807  0.671762E-03  0.681E-01    1.15       1.0  T
   3    -11.1462453  0.198354E-01  0.140E+00    1.09       1.0  T
   4    -11.1664026 -0.201573E-01  0.270E-01    1.18       1.0  T
   5    -11.1670248 -0.622181E-03  0.623E-02    1.15       1.0  T
   6    -11.1670284 -0.357552E-05  0.247E-02    1.15       1.8  T
   7    -11.1670279  0.426951E-06  0.971E-03    1.15       4.6  T
   8    -11.1670283 -0.355502E-06  0.689E-03    1.15       6.5  T
   9    -11.1670286 -0.290026E-06  0.206E-03    1.15      21.7  T
  10    -11.1670286 -0.154815E-07  0.183E-04    1.15     244.5  T
  11    -11.1670286  0.129296E-09  0.149E-04    1.15     299.2  T
     SCC iter.                  ...        0 min,  0.001 sec
     gradient                   ...        0 min,  0.001 sec
 * total energy  :   -10.9959049 Eh     change       -0.6178952E-02 Eh
   gradient norm :     0.0461470 Eh/α   predicted    -0.4715423E-02 ( -23.69%)
   displ. norm   :     0.2766568 α      lambda       -0.9183615E-02
   maximum displ.:     0.2125190 α      in ANC's #1, #4, #8, ...

........................................................................
.............................. CYCLE   10 ..............................
........................................................................
   1    -11.1678157 -0.111678E+02  0.137E+00    1.34       0.0  T
   2    -11.1431795  0.246363E-01  0.163E+00    1.30       1.0  T
   3    -11.1521739 -0.899447E-02  0.142E+00    1.30       1.0  T
   4    -11.1703702 -0.181963E-01  0.210E-01    1.33       1.0  T
   5    -11.1705128 -0.142597E-03  0.826E-02    1.31       1.0  T
   6    -11.1705300 -0.172273E-04  0.629E-02    1.32       1.0  T
   7    -11.1705307 -0.678209E-06  0.558E-02    1.32       1.0  T
   8    -11.1705485 -0.178046E-04  0.469E-03    1.32       9.5  T
   9    -11.1705485 -0.427525E-08  0.246E-03    1.32      18.2  T
  10    -11.1705485 -0.178283E-07  0.543E-04    1.32      82.4  T
  11    -11.1705485 -0.151734E-08  0.235E-04    1.32     190.0  T
     SCC iter.                  ...        0 min,  0.001 sec
     gradient                   ...        0 min,  0.001 sec
 * total energy  :   -11.0032609 Eh     change       -0.7356000E-02 Eh
   gradient norm :     0.0324124 Eh/α   predicted    -0.4943262E-02 ( -32.80%)
   displ. norm   :     0.3799789 α      lambda       -0.8673919E-02
   maximum displ.:     0.2922295 α      in ANC's #1, #4, #8, ...

........................................................................
.............................. CYCLE   11 ..............................
........................................................................
   1    -11.1492429 -0.111492E+02  0.190E+00    1.34       0.0  T
   2    -11.0245914  0.124651E+00  0.362E+00    0.95       1.0  T
   3    -11.1564285 -0.131837E+00  0.104E+00    1.25       1.0  T
   4    -11.1605028 -0.407423E-02  0.366E-01    1.29       1.0  T
   5    -11.1614948 -0.992045E-03  0.977E-02    1.23       1.0  T
   6    -11.1614548  0.399934E-04  0.111E-01    1.23       1.0  T
   7    -11.1615198 -0.649561E-04  0.563E-02    1.23       1.0  T
   8    -11.1615384 -0.186667E-04  0.134E-02    1.23       3.3  T
   9    -11.1615399 -0.148963E-05  0.425E-03    1.23      10.5  T
  10    -11.1615399 -0.973376E-08  0.765E-04    1.23      58.5  T
  11    -11.1615399 -0.204029E-08  0.293E-04    1.23     152.5  T
     SCC iter.                  ...        0 min,  0.001 sec
     gradient                   ...        0 min,  0.001 sec
 * total energy  :   -11.0070156 Eh     change       -0.3754665E-02 Eh
   gradient norm :     0.0614869 Eh/α   predicted    -0.4963146E-02 (  32.19%)
   displ. norm   :     0.0559416 α      lambda       -0.2607073E-02
   maximum displ.:     0.0387692 α      in ANC's #3, #9, #8, ...

........................................................................
.............................. CYCLE   12 ..............................
........................................................................
   1    -11.1684716 -0.111685E+02  0.371E-01    1.33       0.0  T
   2    -11.1593598  0.911173E-02  0.982E-01    1.39       1.0  T
   3    -11.1693531 -0.999324E-02  0.224E-01    1.33       1.0  T
   4    -11.1692036  0.149495E-03  0.196E-01    1.35       1.0  T
   5    -11.1694595 -0.255926E-03  0.318E-02    1.34       1.4  T
   6    -11.1694615 -0.203691E-05  0.242E-02    1.34       1.8  T
   7    -11.1694631 -0.153814E-05  0.120E-02    1.34       3.7  T
   8    -11.1694636 -0.492448E-06  0.469E-03    1.34       9.5  T
   9    -11.1694638 -0.242500E-06  0.103E-03    1.34      43.6  T
  10    -11.1694638 -0.215878E-08  0.201E-04    1.34     222.7  T
  11    -11.1694638 -0.179705E-09  0.581E-05    1.34     770.0  T
     SCC iter.                  ...        0 min,  0.001 sec
     gradient                   ...        0 min,  0.001 sec
 * total energy  :   -11.0085667 Eh     change       -0.1551152E-02 Eh
   gradient norm :     0.0255630 Eh/α   predicted    -0.1307616E-02 ( -15.70%)
   displ. norm   :     0.0751489 α      lambda       -0.1475048E-02
   maximum displ.:     0.0514302 α      in ANC's #3, #8, #9, ...

........................................................................
.............................. CYCLE   13 ..............................
........................................................................
   1    -11.1855300 -0.111855E+02  0.404E-01    1.44       0.0  T
   2    -11.1854643  0.656616E-04  0.246E-01    1.39       1.0  T
   3    -11.1829663  0.249807E-02  0.477E-01    1.47       1.0  T
   4    -11.1855333 -0.256708E-02  0.110E-01    1.42       1.0  T
   5    -11.1855933 -0.599135E-04  0.228E-02    1.41       2.0  T
   6    -11.1855915  0.171940E-05  0.242E-02    1.41       1.8  T
   7    -11.1855946 -0.304635E-05  0.110E-02    1.41       4.1  T
   8    -11.1855955 -0.878856E-06  0.205E-03    1.41      21.8  T
   9    -11.1855955 -0.739477E-08  0.796E-04    1.41      56.2  T
  10    -11.1855955 -0.226146E-08  0.871E-05    1.41     513.4  T
     SCC iter.                  ...        0 min,  0.001 sec
     gradient                   ...        0 min,  0.001 sec
 * total energy  :   -11.0091841 Eh     change       -0.6173774E-03 Eh
   gradient norm :     0.0306013 Eh/α   predicted    -0.7416887E-03 (  20.14%)
   displ. norm   :     0.1436029 α      lambda       -0.1313945E-02
   maximum displ.:     0.0885975 α      in ANC's #4, #1, #8, ...

........................................................................
.............................. CYCLE   14 ..............................
........................................................................
   1    -11.1797025 -0.111797E+02  0.626E-01    1.35       0.0  T
   2    -11.1771835  0.251899E-02  0.586E-01    1.28       1.0  T
   3    -11.1741153  0.306824E-02  0.765E-01    1.40       1.0  T
   4    -11.1799406 -0.582530E-02  0.734E-02    1.34       1.0  T
   5    -11.1799805 -0.398749E-04  0.274E-02    1.33       1.6  T
   6    -11.1799824 -0.193044E-05  0.171E-02    1.33       2.6  T
   7    -11.1799826 -0.195941E-06  0.143E-02    1.33       3.1  T
   8    -11.1799841 -0.149771E-05  0.327E-03    1.33      13.7  T
   9    -11.1799842 -0.619766E-07  0.162E-03    1.33      27.6  T
  10    -11.1799842 -0.554797E-08  0.138E-04    1.33     323.9  T
  11    -11.1799842 -0.400426E-10  0.306E-05    1.33    1463.3  T
     SCC iter.                  ...        0 min,  0.001 sec
     gradient                   ...        0 min,  0.001 sec
 * total energy  :   -11.0099580 Eh     change       -0.7738860E-03 Eh
   gradient norm :     0.0069175 Eh/α   predicted    -0.6705200E-03 ( -13.36%)
   displ. norm   :     0.0500717 α      lambda       -0.1937156E-03
   maximum displ.:     0.0300872 α      in ANC's #4, #3, #9, ...

........................................................................
.............................. CYCLE   15 ..............................
........................................................................
   1    -11.1811571 -0.111812E+02  0.225E-01    1.31       0.0  T
   2    -11.1809354  0.221687E-03  0.193E-01    1.29       1.0  T
   3    -11.1802791  0.656245E-03  0.293E-01    1.33       1.0  T
   4    -11.1811794 -0.900234E-03  0.374E-02    1.31       1.2  T
   5    -11.1811878 -0.848146E-05  0.922E-03    1.30       4.9  T
   6    -11.1811878  0.904063E-07  0.825E-03    1.30       5.4  T
   7    -11.1811878 -0.507315E-07  0.720E-03    1.30       6.2  T
   8    -11.1811882 -0.389646E-06  0.460E-04    1.30      97.3  T
   9    -11.1811882 -0.505052E-09  0.212E-04    1.30     210.7  T
     SCC iter.                  ...        0 min,  0.001 sec
     gradient                   ...        0 min,  0.001 sec
 * total energy  :   -11.0100784 Eh     change       -0.1204314E-03 Eh
   gradient norm :     0.0039458 Eh/α   predicted    -0.9709997E-04 ( -19.37%)
   displ. norm   :     0.0167777 α      lambda       -0.3720087E-04
   maximum displ.:     0.0100066 α      in ANC's #3, #9, #4, ...

........................................................................
.............................. CYCLE   16 ..............................
........................................................................
   1    -11.1826529 -0.111827E+02  0.777E-02    1.30       0.0  T
   2    -11.1826501  0.272279E-05  0.487E-02    1.30       1.0  T
   3    -11.1825493  0.100882E-03  0.981E-02    1.30       1.0  T
   4    -11.1826490 -0.997472E-04  0.214E-02    1.31       2.1  T
   5    -11.1826543 -0.533434E-05  0.271E-03    1.30      16.5  T
   6    -11.1826541  0.196780E-06  0.501E-03    1.30       8.9  T
   7    -11.1826543 -0.203323E-06  0.425E-04    1.30     105.2  T
   8    -11.1826543 -0.918776E-09  0.153E-04    1.30     291.6  T
     SCC iter.                  ...        0 min,  0.001 sec
     gradient                   ...        0 min,  0.001 sec
 * total energy  :   -11.0101010 Eh     change       -0.2258626E-04 Eh
   gradient norm :     0.0029420 Eh/α   predicted    -0.1860723E-04 ( -17.62%)
   displ. norm   :     0.0124521 α      lambda       -0.1319539E-04
   maximum displ.:     0.0064658 α      in ANC's #3, #8, #1, ...

........................................................................
.............................. CYCLE   17 ..............................
........................................................................
   1    -11.1828585 -0.111829E+02  0.596E-02    1.31       0.0  T
   2    -11.1828545  0.392894E-05  0.387E-02    1.30       1.2  T
   3    -11.1827586  0.958947E-04  0.947E-02    1.31       1.0  T
   4    -11.1828591 -0.100429E-03  0.583E-03    1.31       7.7  T
   5    -11.1828591 -0.356042E-07  0.517E-03    1.30       8.7  T
   6    -11.1828593 -0.172461E-06  0.217E-03    1.30      20.6  T
   7    -11.1828593 -0.236736E-07  0.146E-04    1.30     306.5  T
   8    -11.1828593 -0.606093E-11  0.893E-05    1.30     500.7  T
     SCC iter.                  ...        0 min,  0.001 sec
     gradient                   ...        0 min,  0.001 sec
 * total energy  :   -11.0101114 Eh     change       -0.1044284E-04 Eh
   gradient norm :     0.0030748 Eh/α   predicted    -0.6600195E-05 ( -36.80%)
   displ. norm   :     0.0182702 α      lambda       -0.2649446E-04
   maximum displ.:     0.0097064 α      in ANC's #6, #3, #8, ...

........................................................................
.............................. CYCLE   18 ..............................
........................................................................
   1    -11.1830751 -0.111831E+02  0.837E-02    1.31       0.0  T
   2    -11.1830754 -0.318006E-06  0.485E-02    1.31       1.0  T
   3    -11.1830637  0.117182E-04  0.394E-02    1.31       1.1  T
   4    -11.1830743 -0.106205E-04  0.147E-02    1.31       3.0  T
   5    -11.1830759 -0.155783E-05  0.317E-03    1.31      14.1  T
   6    -11.1830758  0.830779E-07  0.311E-03    1.31      14.4  T
   7    -11.1830758 -0.280231E-07  0.234E-03    1.31      19.1  T
   8    -11.1830759 -0.650529E-07  0.124E-04    1.31     359.4  T
   9    -11.1830759 -0.896883E-11  0.514E-05    1.31     870.4  T
     SCC iter.                  ...        0 min,  0.001 sec
     gradient                   ...        0 min,  0.001 sec
 * total energy  :   -11.0101310 Eh     change       -0.1954721E-04 Eh
   gradient norm :     0.0030269 Eh/α   predicted    -0.1325179E-04 ( -32.21%)
   displ. norm   :     0.0192646 α      lambda       -0.2706455E-04
   maximum displ.:     0.0141836 α      in ANC's #6, #3, #4, ...

........................................................................
.............................. CYCLE   19 ..............................
........................................................................
   1    -11.1827954 -0.111828E+02  0.740E-02    1.31       0.0  T
   2    -11.1827927  0.270225E-05  0.479E-02    1.31       1.0  T
   3    -11.1827105  0.822106E-04  0.981E-02    1.30       1.0  T
   4    -11.1827946 -0.841106E-04  0.139E-02    1.31       3.2  T
   5    -11.1827951 -0.479596E-06  0.105E-02    1.31       4.3  T
   6    -11.1827962 -0.107972E-05  0.264E-03    1.31      17.0  T
   7    -11.1827962 -0.197971E-07  0.724E-04    1.31      61.8  T
   8    -11.1827962 -0.500337E-08  0.973E-05    1.31     459.4  T
     SCC iter.                  ...        0 min,  0.001 sec
     gradient                   ...        0 min,  0.001 sec
 * total energy  :   -11.0101497 Eh     change       -0.1870805E-04 Eh
   gradient norm :     0.0021718 Eh/α   predicted    -0.1353732E-04 ( -27.64%)
   displ. norm   :     0.0158867 α      lambda       -0.1503601E-04
   maximum displ.:     0.0104672 α      in ANC's #6, #4, #1, ...

........................................................................
.............................. CYCLE   20 ..............................
........................................................................
   1    -11.1822898 -0.111823E+02  0.536E-02    1.30       0.0  T
   2    -11.1822810  0.877489E-05  0.466E-02    1.30       1.0  T
   3    -11.1822678  0.131982E-04  0.573E-02    1.30       1.0  T
   4    -11.1822900 -0.222427E-04  0.119E-02    1.30       3.8  T
   5    -11.1822900  0.260192E-07  0.997E-03    1.30       4.5  T
   6    -11.1822911 -0.112378E-05  0.199E-03    1.30      22.4  T
   7    -11.1822911 -0.114983E-07  0.107E-03    1.30      41.9  T
   8    -11.1822912 -0.603439E-08  0.123E-04    1.30     362.3  T
   9    -11.1822912  0.156319E-11  0.516E-05    1.30     866.6  T
     SCC iter.                  ...        0 min,  0.001 sec
     gradient                   ...        0 min,  0.001 sec
 * total energy  :   -11.0101589 Eh     change       -0.9189333E-05 Eh
   gradient norm :     0.0010048 Eh/α   predicted    -0.7521611E-05 ( -18.15%)
   displ. norm   :     0.0150496 α      lambda       -0.4430986E-05
   maximum displ.:     0.0076229 α      in ANC's #1, #4, #9, ...
 * RMSD in coord.:     1.0749890 α      energy gain  -0.1251400E+00 Eh

generating ANC from model Hessian ...
Using Lindh-Hessian (1995)
 Shifting diagonal of input Hessian by    0.0000000000000000     
 Lowest  eigenvalues of input Hessian
   -0.000000   -0.000000   -0.000000    0.000000    0.000000    0.000000
    0.058830    0.148516    0.219331    0.347898    0.827829    0.967157
    1.554232    1.643821    2.119860
 Highest eigenvalues
    0.347898    0.827829    0.967157    1.554232    1.643821    2.119860


........................................................................
.............................. CYCLE   21 ..............................
........................................................................
   1    -11.1818689 -0.111819E+02  0.723E-02    1.29       0.0  T
   2    -11.1818183  0.505494E-04  0.901E-02    1.29       1.0  T
   3    -11.1818582 -0.398963E-04  0.557E-02    1.29       1.0  T
   4    -11.1818758 -0.175527E-04  0.514E-03    1.29       8.7  T
   5    -11.1818754  0.317369E-06  0.683E-03    1.29       6.5  T
   6    -11.1818759 -0.460298E-06  0.233E-03    1.29      19.2  T
   7    -11.1818759 -0.215638E-07  0.277E-04    1.29     161.5  T
   8    -11.1818759 -0.435865E-10  0.143E-04    1.29     313.1  T
     SCC iter.                  ...        0 min,  0.001 sec
     gradient                   ...        0 min,  0.001 sec
 * total energy  :   -11.0101599 Eh     change       -0.1016803E-05 Eh
   gradient norm :     0.0009150 Eh/α   predicted     0.0000000E+00 (-100.00%)
   displ. norm   :     0.0021333 α      lambda       -0.8447229E-06
   maximum displ.:     0.0013885 α      in ANC's #3, #2, #7, ...

   *** GEOMETRY OPTIMIZATION CONVERGED AFTER 21 ITERATIONS ***

------------------------------------------------------------------------
 total energy gain   :        -0.1251411 Eh      -78.5272 kcal/mol
 total RMSD          :         1.0749890 a0        0.5689 Å
 total power (kW/mol):       -15.6456096 (step)-3808.4785 (real)
------------------------------------------------------------------------

 ANCopt (total)                0 d,  0 h,  0 min,  0.086 sec
 optimizer setup                ...        0 min,  0.000 sec (  0.090%)
 model hessian                  ...        0 min,  0.000 sec (  0.175%)
 ANC generation                 ...        0 min,  0.000 sec (  0.173%)
 coordinate transformation      ...        0 min,  0.000 sec (  0.052%)
 single point calculation       ...        0 min,  0.084 sec ( 97.764%)
 optimization log               ...        0 min,  0.000 sec (  0.572%)
 hessian update                 ...        0 min,  0.000 sec (  0.053%)
 rational function              ...        0 min,  0.000 sec (  0.526%)

================
 final structure:
================
5
 xtb: 6.2.2 (9d81278992624c895f80dd42a50cac0aa55982e2)
N        -1.47016773970300   -0.06853812060223    0.15453930417059
C        -0.58902271723858    0.89419003770749    0.02193582257401
C         0.65206225089643    0.03170646868944   -0.06721593470040
C        -0.49396438012262   -0.94491791724373    0.09271638541671
C         1.90109258616776    0.08755953144904   -0.20197557746092

 Bond Distances (Angstroems)
 ---------------------------
N1-C2=1.3118         N1-C4=1.3133         C2-N1=1.3118         C2-C3=1.5140         C2-C4=1.8429         C3-C2=1.5140         
C3-C4=1.5142         C3-C5=1.2575         C4-N1=1.3133         C4-C2=1.8429         C4-C3=1.5142         C5-C3=1.2575         
 C  C  Rav=1.5321 sigma=0.2078  Rmin=1.2575  Rmax=1.8429     4
 N  C  Rav=1.3126 sigma=0.0008  Rmin=1.3118  Rmax=1.3133     2

 selected bond angles (degree)
 --------------------
C4-N1-C2= 89.18                C3-C2-N1= 97.96                C4-C2-N1= 45.44                C4-C2-C3= 52.52                
C4-C3-C2= 74.98                C5-C3-C2=142.68                C5-C3-C4=142.35                C2-C4-N1= 45.38                
C3-C4-N1= 97.88                C3-C4-C2= 52.51                

 selected dihedral angles (degree)
 ---------------------------------
C3-C2-N1-C4=  0.00            C4-C3-C2-N1=  0.00            C5-C3-C2-N1=179.67            C5-C3-C2-C4=179.66            
C3-C4-N1-C2=  0.00            N1-C4-C2-C3=179.98            C3-C4-C2-N1=180.02            N1-C4-C3-C2=  0.00            
N1-C4-C3-C5=180.32            C2-C4-C3-C5=180.34            
           -------------------------------------------------
          |                Final Singlepoint                |
           -------------------------------------------------

          ...................................................
          :                      SETUP                      :
          :.................................................:
          :  # basis functions                  20          :
          :  # atomic orbitals                  20          :
          :  # shells                           10          :
          :  # electrons                        21          :
          :  max. iterations                   250          :
          :  Hamiltonian                  GFN2-xTB          :
          :  restarted?                      false          :
          :  GBSA solvation                  false          :
          :  PC potential                    false          :
          :  electronic temp.          300.0000000     K    :
          :  accuracy                    1.0000000          :
          :  -> integral cutoff          0.2500000E+02      :
          :  -> integral neglect         0.1000000E-07      :
          :  -> SCF convergence          0.1000000E-05 Eh   :
          :  -> wf. convergence          0.1000000E-03 e    :
          :  Broyden damping             0.4000000          :
          ...................................................

 iter      E             dE          RMSdq      gap      omega  full diag
   1    -11.1818759 -0.111819E+02  0.433E-05    1.29       0.0  T
   2    -11.1818759  0.134630E-10  0.565E-05    1.29     792.0  T
   3    -11.1818759 -0.133191E-10  0.324E-05    1.29    1380.4  T

   *** convergence criteria satisfied after 3 iterations ***

         #    Occupation            Energy/Eh            Energy/eV
      -------------------------------------------------------------
         1        2.0000           -0.7436203             -20.2349
       ...           ...                  ...                  ...
         6        2.0000           -0.5641138             -15.3503
         7        2.0000           -0.4922177             -13.3939
         8        2.0000           -0.4837124             -13.1625
         9        2.0000           -0.4698874             -12.7863
        10        1.0000           -0.4364384             -11.8761
        11        1.0000           -0.4142945             -11.2735
        12        1.0000           -0.3680175             -10.0143 (HOMO)
        13                         -0.3205020              -8.7213 (LUMO)
        14                         -0.3184098              -8.6644
        15                         -0.1772046              -4.8220
        16                          0.0504030               1.3715
        17                          0.0781595               2.1268
       ...                                ...                  ...
        20                          0.8593703              23.3847
      -------------------------------------------------------------
                  HL-Gap            0.0475155 Eh            1.2930 eV
             Fermi-level           -0.3987362 Eh          -10.8502 eV

 SCC (total)                   0 d,  0 h,  0 min,  0.003 sec
 SCC setup                      ...        0 min,  0.000 sec (  1.974%)
 Dispersion                     ...        0 min,  0.000 sec (  0.260%)
 integral evaluation            ...        0 min,  0.001 sec ( 41.388%)
 zeroth order Hamiltonian       ...        0 min,  0.000 sec (  0.478%)
 iterations                     ...        0 min,  0.000 sec ( 11.604%)
 molecular gradient             ...        0 min,  0.001 sec ( 42.659%)
 printout                       ...        0 min,  0.000 sec (  1.391%)

         :::::::::::::::::::::::::::::::::::::::::::::::::::::
         ::                     SUMMARY                     ::
         :::::::::::::::::::::::::::::::::::::::::::::::::::::
         :: total energy             -11.010159896735 Eh    ::
         :: gradient norm              0.000914858690 Eh/a0 ::
         :: HOMO-LUMO gap              1.292962578487 eV    ::
         ::.................................................::
         :: SCC energy               -11.181875915662 Eh    ::
         :: -> isotropic ES           -0.007582533460 Eh    ::
         :: -> anisotropic ES          0.002218519022 Eh    ::
         :: -> anisotropic XC          0.006229740544 Eh    ::
         :: -> dispersion             -0.002856676926 Eh    ::
         :: repulsion energy           0.171716006482 Eh    ::
         :: add. restraining           0.000000000000 Eh    ::
         :::::::::::::::::::::::::::::::::::::::::::::::::::::

           ------------------------------------------------- 
          |                Numerical Hessian                |
           ------------------------------------------------- 
step length          :   0.00500
SCC accuracy         :   0.30000
Hessian scale factor :   1.00000
frozen atoms in %    :   0.00000    0
RMS gradient         :   0.00091
estimated CPU  time      0.00 min
estimated wall time      0.00 min

writing file <hessian>.

 projected vibrational frequencies (cm-1)
eigval :       -0.00    -0.00    -0.00    -0.00     0.00     0.00
eigval :      221.62   284.77   304.95   358.96   623.00   899.77
eigval :      951.25  1496.05  1811.08
           -------------------------------------------------
          |                Property Printout                |
           -------------------------------------------------

    * Orbital Energies and Occupations

         #    Occupation            Energy/Eh            Energy/eV
      -------------------------------------------------------------
         1        2.0000           -0.7436201             -20.2349
         2        2.0000           -0.6853741             -18.6500
         3        2.0000           -0.6352061             -17.2848
         4        2.0000           -0.6218078             -16.9203
         5        2.0000           -0.5721324             -15.5685
         6        2.0000           -0.5641137             -15.3503
         7        2.0000           -0.4922178             -13.3939
         8        2.0000           -0.4837125             -13.1625
         9        2.0000           -0.4698872             -12.7863
        10        1.0000           -0.4364385             -11.8761
        11        1.0000           -0.4142948             -11.2735
        12        1.0000           -0.3680172             -10.0143 (HOMO)
        13                         -0.3205020              -8.7213 (LUMO)
        14                         -0.3184099              -8.6644
        15                         -0.1772046              -4.8220
        16                          0.0504031               1.3715
        17                          0.0781596               2.1268
        18                          0.2496755               6.7940
        19                          0.3490840               9.4991
        20                          0.8593701              23.3847
      -------------------------------------------------------------
                  HL-Gap            0.0475152 Eh            1.2930 eV
             Fermi-level           -0.3987361 Eh          -10.8502 eV

     #   Z        covCN         q      C6AA      α(0)
     1   7 N      1.958    -0.025    22.417     7.021
     2   6 C      2.669    -0.008    28.206     8.690
     3   6 C      3.070     0.101    25.689     8.311
     4   6 C      2.669    -0.009    28.224     8.693
     5   6 C      0.982    -0.059    37.749    10.320

 Mol. C6AA /au·bohr⁶  :        704.902620
 Mol. C8AA /au·bohr⁸  :      19479.513786
 Mol. α(0) /au        :         43.034802


Wiberg/Mayer (AO) data.
largest (>0.10) Wiberg bond orders for each atom
          total WBO             WBO to atom ...
     1  N   3.041        C    2 1.391    C    4 1.386    C    5 0.227
     2  C   2.687        N    1 1.391    C    3 0.806    C    4 0.424
     3  C   3.778        C    5 2.130    C    2 0.806    C    4 0.806
     4  C   2.681        N    1 1.386    C    3 0.806    C    2 0.424
     5  C   2.485        C    3 2.130    N    1 0.227

MOs/occ written to file <molden.input>


molecular dipole:
                 x           y           z       tot (Debye)
 q only:        0.000       0.002       0.000
   full:       -0.043       0.001       0.005       0.111
molecular quadrupole (traceless):
                xx          xy          yy          xz          yz          zz
Molecule has the following symmetry elements: (C2) 2*(sigma) 
It seems to be the C2v point group
 q only:       -0.785      -0.054       0.358       0.130       0.009       0.426
  q+dip:       -0.233       0.034      -0.882       0.138       0.085       1.114
   full:       -2.299      -0.087      -0.227       0.510       0.132       2.526

           -------------------------------------------------
          |                Geometry Summary                 |
           -------------------------------------------------

      molecular mass/u    :       62.0496468
   center of mass at/Å    :       -0.0472913      -0.0022044       0.0049713
  moments of inertia/u·Å² :        0.2039647E+02   0.8683537E+02   0.1072317E+03
rotational constants/cm⁻¹ :        0.8264975E+00   0.1941332E+00   0.1572075E+00

 * 3 selected distances

     #   Z        #   Z                                     value/Å
     1   7 N      2   6 C                                 1.3118101
     1   7 N      4   6 C                                 1.3133304 (max)
     3   6 C      5   6 C                                 1.2575200 (min)

 * 2 distinct bonds (by element types)

   Z      Z             #   av. dist./Å        max./Å        min./Å
   6 C    6 C           1     1.2575200     1.2575200     1.2575200
   6 C    7 N           2     1.3125702     1.3133304     1.3118101

           -------------------------------------------------
          |               Frequency Printout                |
           -------------------------------------------------
 projected vibrational frequencies (cm-1)
eigval :       -0.00    -0.00    -0.00    -0.00     0.00     0.00
eigval :      221.62   284.77   304.95   358.96   623.00   899.77
eigval :      951.25  1496.05  1811.08
 reduced masses (amu)
   1: 12.13   2: 12.20   3: 12.34   4: 12.67   5: 12.85   6: 12.43   7: 12.85   8: 12.09
   9: 12.06  10: 12.11  11: 12.57  12: 12.05  13: 12.85  14: 12.92  15: 12.05
 IR intensities (amu)
   1:  0.03   2:  0.04   3:  0.06   4:  0.01   5:  0.04   6:  0.03   7:  0.05   8:  0.56
   9:  0.20  10:  0.31  11:  0.49  12:  0.61  13:  1.66  14:  0.99  15:  1.12
 Raman intensities (amu)
   1:  0.00   2:  0.00   3:  0.00   4:  0.00   5:  0.00   6:  0.00   7:  0.00   8:  0.00
   9:  0.00  10:  0.00  11:  0.00  12:  0.00  13:  0.00  14:  0.00  15:  0.00
 output can be read by thermo (or use thermo option).
 writing <g98.out> molden fake output.
 recommended (thermochemical) frequency scaling factor: 1.0
           -------------------------------------------------
          |             Thermodynamic Functions             |
           -------------------------------------------------

c2v symmetry found (for desy threshold:  0.10E+00) used in thermo

          ...................................................
          :                      SETUP                      :
          :.................................................:
          :  # frequencies                           9      :
          :  # imaginary freq.                       0      :
          :  linear?                             false      :
          :  only rotor calc.                    false      :
          :  symmetry                              c2v      :
          :  rotational number                       2      :
          :  scaling factor                  1.0000000      :
          :  rotor cutoff                   50.0000000 cm⁻¹ :
          :  imag. cutoff                  -20.0000000 cm⁻¹ :
          :.................................................:

    mode    ω/cm⁻¹     T·S(HO)/kcal·mol⁻¹    T·S(FR)/kcal·mol⁻¹   T·S(vib)
   ------------------------------------------------------------------------
       1    221.62    -0.00000 ( 99.74%)     0.01310 (  0.26%)     0.00003
       2    284.77    -0.00000 ( 99.91%)     0.01559 (  0.09%)     0.00001
   ------------------------------------------------------------------------

   temp. (K)  partition function   enthalpy   heat capacity  entropy
                                   cal/mol     cal/K/mol   cal/K/mol   J/K/mol
 298.15  VIB   3.46                 1245.750      8.749      6.648
         ROT  0.166E+05              888.752      2.981     22.297
         INT  0.577E+05             2134.502     11.730     28.945
         TR   0.473E+27             1481.254      4.968     38.278
         TOT                        3615.7559    16.6983    67.2234   281.2628

   temp. (K)  partition function   enthalpy   heat capacity  entropy
                                   cal/mol     cal/K/mol   cal/K/mol   J/K/mol
 120.00  VIB   1.16                  113.779      3.258      1.242
         ROT  0.425E+04              357.707      2.981     19.584
         INT  0.492E+04              471.486      6.239     20.826
         TR   0.121E+27              596.178      4.968     33.759
         TOT                        1067.6638    11.2075    54.5849   228.3833

   temp. (K)  partition function   enthalpy   heat capacity  entropy
                                   cal/mol     cal/K/mol   cal/K/mol   J/K/mol
 100.00  VIB   1.08                   58.121      2.295      0.737
         ROT  0.323E+04              298.089      2.981     19.040
         INT  0.349E+04              356.210      5.276     19.778
         TR   0.919E+26              496.815      4.968     32.853
         TOT                         853.0254    10.2443    52.6312   220.2091

   temp. (K)  partition function   enthalpy   heat capacity  entropy
                                   cal/mol     cal/K/mol   cal/K/mol   J/K/mol
  80.00  VIB   1.03                   22.157      1.308      0.340
         ROT  0.231E+04              238.471      2.981     18.375
         INT  0.239E+04              260.628      4.289     18.715
         TR   0.657E+26              397.452      4.968     31.745
         TOT                         658.0805     9.2570    50.4604   211.1263

   temp. (K)  partition function   enthalpy   heat capacity  entropy
                                   cal/mol     cal/K/mol   cal/K/mol   J/K/mol
  60.00  VIB   1.01                    4.786      0.477      0.095
         ROT  0.150E+04              178.853      2.981     17.518
         INT  0.151E+04              183.639      3.458     17.612
         TR   0.427E+26              298.089      4.968     30.317
         TOT                         481.7282     8.4265    47.9292   200.5359

   temp. (K)  partition function   enthalpy   heat capacity  entropy
                                   cal/mol     cal/K/mol   cal/K/mol   J/K/mol
  40.00  VIB   1.00                    0.265      0.056      0.007
         ROT   818.                  119.236      2.981     16.309
         INT   818.                  119.501      3.037     16.316
         TR   0.232E+26              198.726      4.968     28.303
         TOT                         318.2269     8.0050    44.6195   186.6878

   temp. (K)  partition function   enthalpy   heat capacity  entropy
                                   cal/mol     cal/K/mol   cal/K/mol   J/K/mol
  20.00  VIB   1.00                    0.000      0.000     -0.004
         ROT   289.                   59.618      2.981     14.243
         INT   289.                   59.618      2.981     14.239
         TR   0.822E+25               99.363      4.968     24.861
         TOT                         158.9809     7.9491    39.1007   163.5971

   temp. (K)  partition function   enthalpy   heat capacity  entropy
                                   cal/mol     cal/K/mol   cal/K/mol   J/K/mol
  10.00  VIB   1.00                    0.000      0.000     -0.007
         ROT   102.                   29.809      2.981     12.177
         INT   102.                   29.809      2.981     12.170
         TR   0.290E+25               49.681      4.968     21.419
         TOT                          79.4904     7.9490    33.5892   140.5374

       T/K    H(0)-H(T)+PV         H(T)/Eh          T*S/Eh         G(T)/Eh
   ------------------------------------------------------------------------
    298.15    0.576207E-02    0.215987E-01    0.319400E-01   -0.103414E-01
    120.00    0.170143E-02    0.175380E-01    0.104384E-01    0.709963E-02
    100.00    0.135938E-02    0.171960E-01    0.838732E-02    0.880865E-02
     80.00    0.104872E-02    0.168853E-01    0.643310E-02    0.104522E-01
     60.00    0.767683E-03    0.166043E-01    0.458281E-02    0.120215E-01
     40.00    0.507127E-03    0.163437E-01    0.284423E-02    0.134995E-01
     20.00    0.253352E-03    0.160899E-01    0.124622E-02    0.148437E-01
     10.00    0.126676E-03    0.159633E-01    0.535279E-03    0.154280E-01 (used)
   ------------------------------------------------------------------------

         :::::::::::::::::::::::::::::::::::::::::::::::::::::
         ::                  THERMODYNAMIC                  ::
         :::::::::::::::::::::::::::::::::::::::::::::::::::::
         :: total free energy         -10.994731909616 Eh   ::
         ::.................................................::
         :: total energy              -11.010159896036 Eh   ::
         :: zero point energy           0.015836589080 Eh   ::
         :: G(RRHO) w/o ZPVE           -0.000408602661 Eh   ::
         :: G(RRHO) contrib.            0.015427986420 Eh   ::
         :::::::::::::::::::::::::::::::::::::::::::::::::::::

optimized geometry written to: xtbopt.xyz


           -------------------------------------------------
          | TOTAL ENERGY              -11.010159896036 Eh   |
          | TOTAL ENTHALPY            -10.994196630940 Eh   |
          | TOTAL FREE ENERGY         -10.994731909616 Eh   |
          | GRADIENT NORM               0.000914516492 Eh/α |
          | HOMO-LUMO GAP               1.292953920779 eV   |
           -------------------------------------------------

------------------------------------------------------------------------
 * finished run on 2020/05/12 at 11:44:13.151     
------------------------------------------------------------------------
 total:
 * wall-time:     0 d,  0 h,  0 min,  0.224 sec
 *  cpu-time:     0 d,  0 h,  0 min,  0.224 sec
 * ratio c/w:     0.999 speedup
 SCF:
 * wall-time:     0 d,  0 h,  0 min,  0.007 sec
 *  cpu-time:     0 d,  0 h,  0 min,  0.007 sec
 * ratio c/w:     1.000 speedup
 ANC optimizer:
 * wall-time:     0 d,  0 h,  0 min,  0.090 sec
 *  cpu-time:     0 d,  0 h,  0 min,  0.090 sec
 * ratio c/w:     0.999 speedup
 numerical hessian:
 * wall-time:     0 d,  0 h,  0 min,  0.107 sec
 *  cpu-time:     0 d,  0 h,  0 min,  0.107 sec
 * ratio c/w:     0.999 speedup

