      -----------------------------------------------------------      
     |                   =====================                   |     
     |                           x T B                           |     
     |                   =====================                   |     
     |                         S. Grimme                         |     
     |          Mulliken Center for Theoretical Chemistry        |     
     |                    University of Bonn                     |     
      -----------------------------------------------------------      

   * xtb version 6.2.2 (9d81278992624c895f80dd42a50cac0aa55982e2) compiled by '@Darwin' on 04/03/2020

   xtb is free software: you can redistribute it and/or modify it under
   the terms of the GNU Lesser General Public License as published by
   the Free Software Foundation, either version 3 of the License, or
   (at your option) any later version.
   
   xtb is distributed in the hope that it will be useful,
   but WITHOUT ANY WARRANTY; without even the implied warranty of
   MERCHANTABILITY or FITNESS FOR A PARTICULAR PURPOSE.  See the
   GNU Lesser General Public License for more details.
   
   Cite this work as:
   * S. Grimme, C. Bannwarth, P. Shushkov, J. Chem. Theory Comput., 2017,
     13, 1989-2009. DOI: 10.1021/acs.jctc.7b00118
   * C. Bannwarth, S. Ehlert and S. Grimme., J. Chem. Theory Comput., 2019,
     15, 1652-1671. DOI: 10.1021/acs.jctc.8b01176
   * P. Pracht, E. Caldeweyher, S. Ehlert, S. Grimme, ChemRxiv, 2019, preprint.
     DOI: 10.26434/chemrxiv.8326202.v1
   
   for DFT-D4:
   * E. Caldeweyher, C. Bannwarth and S. Grimme, J. Chem. Phys., 2017,
     147, 034112. DOI: 10.1063/1.4993215
   * E. Caldeweyher, S. Ehlert, A. Hansen, H. Neugebauer, S. Spicher,
     C. Bannwarth and S. Grimme, J. Chem. Phys., 2019, 150, 154122.
     DOI: 10.1063/1.5090222
   
   for sTDA-xTB:
   * S. Grimme and C. Bannwarth, J. Chem. Phys., 2016, 145, 054103.
     DOI: 10.1063/1.4959605
   
   in the mass-spec context:
   * V. Asgeirsson, C. Bauer and S. Grimme, Chem. Sci., 2017, 8, 4879.
     DOI: 10.1039/c7sc00601b
   
   for metadynamics refer to:
   * S. Grimme, J. Chem. Theory Comput., 2019, 155, 2847-2862
     DOI: 10.1021/acs.jctc.9b00143
   
   with help from (in alphabetical order)
   C. Bannwarth, F. Bohle, G. Brandenburg, E. Caldeweyher, M. Checinski,
   S. Dohm, S. Ehlert, S. Ehrlich, F. März, H. Neugebauer, J. Pisarek,
   P. Pracht, P. Shushkov, and S. Spicher.
   
 * started run on 2020/05/12 at 11:43:59.151     

           -------------------------------------------------
          |                Calculation Setup                |
           -------------------------------------------------

          program call               : xtb --input C4N1_5_S_1.input C4N1_5_S_1.xyz --ohess --molden --namespace C4N1_5_S_1 output.out
          calculation namespace      : C4N1_5_S_1
          coordinate file            : C4N1_5_S_1.xyz
          number of atoms            :                     5
          number of electrons        :                    21
          charge                     :                     0
          spin                       :                   0.5
          first test random number   :      0.16758374515168

   ID    Z sym.   atoms
    1    6 C      1-4
    2    7 N      5

           -------------------------------------------------
          |                 G F N 2 - x T B                 |
           -------------------------------------------------

        Reference                      10.1021/acs.jctc.8b01176
      * Hamiltonian:
        H0-scaling (s, p, d)           1.850000    2.230000    2.230000
        zeta-weighting                 0.500000
      * Dispersion:
        s8                             2.700000
        a1                             0.520000
        a2                             5.000000
        s9                             5.000000
      * Repulsion:
        kExp                           1.500000    1.000000
        rExp                           1.000000
      * Coulomb:
        alpha                          2.000000
        third order                    shell-resolved
        anisotropic                    true
        a3                             3.000000
        a5                             4.000000
        cn-shift                       1.200000
        cn-exp                         4.000000
        max-rad                        5.000000


          ...................................................
          :                      SETUP                      :
          :.................................................:
          :  # basis functions                  20          :
          :  # atomic orbitals                  20          :
          :  # shells                           10          :
          :  # electrons                        21          :
          :  max. iterations                   250          :
          :  Hamiltonian                  GFN2-xTB          :
          :  restarted?                      false          :
          :  GBSA solvation                  false          :
          :  PC potential                    false          :
          :  electronic temp.          300.0000000     K    :
          :  accuracy                    1.0000000          :
          :  -> integral cutoff          0.2500000E+02      :
          :  -> integral neglect         0.1000000E-07      :
          :  -> SCF convergence          0.1000000E-05 Eh   :
          :  -> wf. convergence          0.1000000E-03 e    :
          :  Broyden damping             0.4000000          :
          ...................................................

 iter      E             dE          RMSdq      gap      omega  full diag
   1    -10.6780633 -0.106781E+02  0.131E+01    0.24       0.0  T
   2     -9.6249559  0.105311E+01  0.144E+01    0.34       1.0  T
   3    -10.1085676 -0.483612E+00  0.105E+01    0.95       1.0  T
   4     -8.1472766  0.196129E+01  0.156E+01    0.91       1.0  T
   5    -10.4783533 -0.233108E+01  0.819E+00    0.82       1.0  T
   6    -10.7966672 -0.318314E+00  0.379E+00    0.35       1.0  T
   7    -10.8857570 -0.890898E-01  0.286E+00    0.26       1.0  T
   8    -10.9139441 -0.281871E-01  0.171E+00    0.12       1.0  T
   9    -10.9120740  0.187013E-02  0.145E+00    0.14       1.0  T
  10    -10.9163329 -0.425887E-02  0.846E-01    0.12       1.0  T
  11    -10.9178962 -0.156330E-02  0.526E-01    0.08       1.0  T
  12    -10.9168982  0.997934E-03  0.714E-01    0.07       1.0  T
  13    -10.9186367 -0.173853E-02  0.310E-01    0.11       1.0  T
  14    -10.9192858 -0.649044E-03  0.482E-02    0.10       1.0  T
  15    -10.9192849  0.926232E-06  0.249E-02    0.09       1.8  T
  16    -10.9192895 -0.460934E-05  0.117E-02    0.10       3.8  T
  17    -10.9192897 -0.252278E-06  0.815E-03    0.10       5.5  T
  18    -10.9192901 -0.418657E-06  0.369E-03    0.10      12.1  T
  19    -10.9192902 -0.115126E-07  0.612E-04    0.10      73.1  T
  20    -10.9192902  0.712754E-09  0.771E-04    0.10      58.0  T

   *** convergence criteria satisfied after 20 iterations ***

         #    Occupation            Energy/Eh            Energy/eV
      -------------------------------------------------------------
         1        2.0000           -0.7234814             -19.6869
       ...           ...                  ...                  ...
         5        2.0000           -0.5576462             -15.1743
         6        2.0000           -0.5283164             -14.3762
         7        2.0000           -0.5259582             -14.3120
         8        2.0000           -0.5138442             -13.9824
         9        2.0000           -0.4811515             -13.0928
        10        2.0000           -0.4660149             -12.6809
        11        0.8647           -0.4340084             -11.8100 (HOMO)
        12        0.1353           -0.4304846             -11.7141 (LUMO)
        13                         -0.4081454             -11.1062
        14                         -0.4063237             -11.0566
        15                         -0.3637328              -9.8977
        16                         -0.3213369              -8.7440
       ...                                ...                  ...
        20                          0.0952467               2.5918
      -------------------------------------------------------------
                  HL-Gap            0.0035238 Eh            0.0959 eV
             Fermi-level           -0.4411348 Eh          -12.0039 eV

 SCC (total)                   0 d,  0 h,  0 min,  0.005 sec
 SCC setup                      ...        0 min,  0.000 sec (  1.383%)
 Dispersion                     ...        0 min,  0.000 sec (  0.362%)
 integral evaluation            ...        0 min,  0.001 sec ( 27.053%)
 zeroth order Hamiltonian       ...        0 min,  0.000 sec (  0.403%)
 iterations                     ...        0 min,  0.002 sec ( 44.112%)
 molecular gradient             ...        0 min,  0.001 sec ( 24.997%)
 printout                       ...        0 min,  0.000 sec (  1.498%)

         :::::::::::::::::::::::::::::::::::::::::::::::::::::
         ::                     SUMMARY                     ::
         :::::::::::::::::::::::::::::::::::::::::::::::::::::
         :: total energy             -10.864005943931 Eh    ::
         :: gradient norm              0.390385505484 Eh/a0 ::
         :: HOMO-LUMO gap              0.095888539198 eV    ::
         ::.................................................::
         :: SCC energy               -10.919290155430 Eh    ::
         :: -> isotropic ES           -0.025298351299 Eh    ::
         :: -> anisotropic ES         -0.000576726573 Eh    ::
         :: -> anisotropic XC          0.019008242053 Eh    ::
         :: -> dispersion             -0.002967078871 Eh    ::
         :: repulsion energy           0.055283967196 Eh    ::
         :: add. restraining           0.000000000000 Eh    ::
         :::::::::::::::::::::::::::::::::::::::::::::::::::::

      ----------------------------------------------------------- 
     |                   =====================                   |
     |                        A N C O P T                        |
     |                   =====================                   |
     |               Approximate Normal Coordinate               |
     |                Rational Function Optimizer                |
      ----------------------------------------------------------- 

          ...................................................
          :                      SETUP                      :
          :.................................................:
          :   optimization level            normal          :
          :   max. optcycles                   200          :
          :   ANC micro-cycles                  20          :
          :   degrees of freedom                 9          :
          :.................................................:
          :   RF solver                   davidson          :
          :   write xtbopt.log                true          :
          :   linear?                        false          :
          :   energy convergence         0.5000000E-05 Eh   :
          :   grad. convergence          0.1000000E-02 Eh/α :
          :   maximium RF displ.         1.0000000          :
          :   Hlow (freq-cutoff)         0.1000000E-01      :
          :   Hmax (freq-cutoff)         5.0000000          :
          :   S6 in model hess.         20.0000000          :
          ...................................................

generating ANC from model Hessian ...
Using Lindh-Hessian (1995)
 Shifting diagonal of input Hessian by    4.6147355978122702E-004
 Lowest  eigenvalues of input Hessian
   -0.000000   -0.000000   -0.000000    0.000000    0.000000    0.000000
    0.010000    0.037174    0.060782    0.067130    0.100020    0.571668
    0.889628    0.981655    1.107280
 Highest eigenvalues
    0.067130    0.100020    0.571668    0.889628    0.981655    1.107280


........................................................................
.............................. CYCLE    1 ..............................
........................................................................
   1    -10.9192902 -0.109193E+02  0.118E-04    0.10       0.0  T
   2    -10.9192902  0.197285E-08  0.509E-04    0.10      87.9  T
   3    -10.9192902 -0.100651E-08  0.353E-04    0.10     126.7  T
     SCC iter.                  ...        0 min,  0.000 sec
     gradient                   ...        0 min,  0.001 sec
 * total energy  :   -10.8640060 Eh     change       -0.9800175E-08 Eh
   gradient norm :     0.3903856 Eh/α   predicted     0.0000000E+00 (-100.00%)
   displ. norm   :     0.4237549 α      lambda       -0.1568036E+00
   maximum displ.:     0.3207309 α      in ANC's #6, #9, #7, ...

........................................................................
.............................. CYCLE    2 ..............................
........................................................................
   1    -11.1075897 -0.111076E+02  0.276E+00    0.01       0.0  T
   2    -10.9741748  0.133415E+00  0.430E+00    0.64       1.0  T
   3    -10.9656601  0.851477E-02  0.449E+00    0.35       1.0  T
   4    -11.1022905 -0.136630E+00  0.214E+00    0.16       1.0  T
   5    -11.1205644 -0.182740E-01  0.136E+00    0.17       1.0  T
   6    -11.1171963  0.336814E-02  0.144E+00    0.10       1.0  T
   7    -11.1186026 -0.140632E-02  0.124E+00    0.09       1.0  T
   8    -11.1280049 -0.940232E-02  0.343E-01    0.09       1.0  T
   9    -11.1288004 -0.795476E-03  0.260E-01    0.10       1.0  T
  10    -11.1289596 -0.159251E-03  0.168E-01    0.09       1.0  T
  11    -11.1278442  0.111542E-02  0.504E-01    0.09       1.0  T
  12    -11.1289558 -0.111157E-02  0.176E-01    0.09       1.0  T
  13    -11.1290470 -0.911680E-04  0.336E-02    0.09       1.3  T
  14    -11.1290451  0.182866E-05  0.296E-02    0.09       1.5  T
  15    -11.1290490 -0.389247E-05  0.557E-03    0.09       8.0  T
  16    -11.1290492 -0.140897E-06  0.103E-03    0.09      43.5  T
  17    -11.1290492 -0.512159E-08  0.143E-04    0.09     313.4  T
  18    -11.1290492 -0.319194E-10  0.139E-05    0.09    3226.7  T
     SCC iter.                  ...        0 min,  0.002 sec
     gradient                   ...        0 min,  0.002 sec
 * total energy  :   -11.0003560 Eh     change       -0.1363501E+00 Eh
   gradient norm :     0.2480314 Eh/α   predicted    -0.9248024E-01 ( -32.17%)
   displ. norm   :     0.5911155 α      lambda       -0.1324569E+00
   maximum displ.:     0.3596130 α      in ANC's #6, #9, #3, ...

........................................................................
.............................. CYCLE    3 ..............................
........................................................................
   1    -11.3553166 -0.113553E+02  0.354E+00    0.05       0.0  T
   2    -11.2832022  0.721144E-01  0.424E+00    0.68       1.0  T
   3    -11.2959753 -0.127731E-01  0.366E+00    0.51       1.0  T
   4    -11.3737944 -0.778191E-01  0.219E+00    0.33       1.0  T
   5    -11.3918123 -0.180179E-01  0.916E-01    0.29       1.0  T
   6    -11.3929562 -0.114393E-02  0.243E-01    0.24       1.0  T
   7    -11.3929983 -0.420767E-04  0.174E-01    0.24       1.0  T
   8    -11.3931521 -0.153800E-03  0.548E-02    0.24       1.0  T
   9    -11.3931698 -0.177513E-04  0.169E-02    0.24       2.6  T
  10    -11.3931700 -0.162844E-06  0.551E-03    0.24       8.1  T
  11    -11.3931700  0.462896E-07  0.493E-03    0.24       9.1  T
  12    -11.3931700 -0.540970E-07  0.189E-03    0.24      23.6  T
  13    -11.3931700 -0.117870E-07  0.412E-04    0.24     108.6  T
  14    -11.3931700 -0.371170E-09  0.913E-05    0.24     489.9  T
     SCC iter.                  ...        0 min,  0.001 sec
     gradient                   ...        0 min,  0.001 sec
 * total energy  :   -10.9622302 Eh     change        0.3812581E-01 Eh
   gradient norm :     1.0175942 Eh/α   predicted    -0.8936981E-01 (-334.41%)
   displ. norm   :     0.3454263 α      lambda       -0.2717339E+00
   maximum displ.:     0.1964565 α      in ANC's #2, #9, #5, ...

........................................................................
.............................. CYCLE    4 ..............................
........................................................................
   1    -11.2650258 -0.112650E+02  0.172E+00    0.54       0.0  T
   2    -11.2676256 -0.259985E-02  0.151E+00    0.29       1.0  T
   3    -11.2696617 -0.203607E-02  0.866E-01    0.40       1.0  T
   4    -11.2362196  0.334421E-01  0.197E+00    0.44       1.0  T
   5    -11.2699312 -0.337117E-01  0.556E-01    0.40       1.0  T
   6    -11.2720085 -0.207727E-02  0.851E-02    0.38       1.0  T
   7    -11.2720294 -0.208845E-04  0.560E-02    0.39       1.0  T
   8    -11.2720358 -0.644165E-05  0.168E-02    0.39       2.7  T
   9    -11.2720366 -0.779035E-06  0.338E-03    0.39      13.2  T
  10    -11.2720366 -0.232397E-07  0.463E-04    0.39      96.6  T
  11    -11.2720366 -0.682618E-09  0.212E-04    0.39     211.2  T
     SCC iter.                  ...        0 min,  0.001 sec
     gradient                   ...        0 min,  0.001 sec
 * total energy  :   -11.0579932 Eh     change       -0.9576303E-01 Eh
   gradient norm :     0.1654226 Eh/α   predicted    -0.1520785E+00 (  58.81%)
   displ. norm   :     0.5074968 α      lambda       -0.3773346E-01
   maximum displ.:     0.4317811 α      in ANC's #3, #1, #5, ...

........................................................................
.............................. CYCLE    5 ..............................
........................................................................
   1    -11.2465539 -0.112466E+02  0.184E+00    1.13       0.0  T
   2    -11.2468618 -0.307828E-03  0.117E+00    1.14       1.0  T
   3    -11.2425823  0.427941E-02  0.102E+00    1.15       1.0  T
   4    -11.2411536  0.142872E-02  0.835E-01    1.14       1.0  T
   5    -11.2472727 -0.611910E-02  0.278E-01    1.14       1.0  T
   6    -11.2479302 -0.657524E-03  0.493E-02    1.14       1.0  T
   7    -11.2479244  0.583182E-05  0.399E-02    1.15       1.1  T
   8    -11.2479325 -0.809545E-05  0.603E-03    1.14       7.4  T
   9    -11.2479326 -0.132164E-06  0.249E-03    1.14      17.9  T
  10    -11.2479326 -0.297710E-08  0.350E-04    1.14     127.8  T
  11    -11.2479326 -0.849845E-10  0.851E-05    1.14     525.5  T
     SCC iter.                  ...        0 min,  0.001 sec
     gradient                   ...        0 min,  0.002 sec
 * total energy  :   -11.0761361 Eh     change       -0.1814286E-01 Eh
   gradient norm :     0.1077103 Eh/α   predicted    -0.2372591E-01 (  30.77%)
   displ. norm   :     0.5641181 α      lambda       -0.2994215E-01
   maximum displ.:     0.3344216 α      in ANC's #2, #4, #3, ...

........................................................................
.............................. CYCLE    6 ..............................
........................................................................
   1    -11.2819598 -0.112820E+02  0.262E+00    2.42       0.0  T
   2    -11.2805865  0.137330E-02  0.166E+00    2.38       1.0  T
   3    -11.2198616  0.607250E-01  0.290E+00    2.32       1.0  T
   4    -11.2824689 -0.626073E-01  0.275E-01    2.37       1.0  T
   5    -11.2825569 -0.880740E-04  0.220E-01    2.35       1.0  T
   6    -11.2827610 -0.204079E-03  0.134E-01    2.36       1.0  T
   7    -11.2828302 -0.691338E-04  0.736E-02    2.35       1.0  T
   8    -11.2828251  0.502880E-05  0.523E-02    2.35       1.0  T
   9    -11.2828337 -0.857545E-05  0.265E-02    2.35       1.7  T
  10    -11.2828342 -0.476172E-06  0.136E-02    2.35       3.3  T
  11    -11.2828345 -0.302417E-06  0.705E-03    2.35       6.3  T
  12    -11.2828346 -0.678160E-07  0.152E-03    2.35      29.5  T
  13    -11.2828346 -0.155254E-08  0.310E-04    2.35     144.4  T
  14    -11.2828346 -0.515836E-10  0.384E-05    2.35    1165.9  T
     SCC iter.                  ...        0 min,  0.001 sec
     gradient                   ...        0 min,  0.001 sec
 * total energy  :   -11.1048416 Eh     change       -0.2870549E-01 Eh
   gradient norm :     0.1239950 Eh/α   predicted    -0.1973532E-01 ( -31.25%)
   displ. norm   :     0.6551757 α      lambda       -0.4926686E-01
   maximum displ.:     0.4407276 α      in ANC's #4, #5, #3, ...

........................................................................
.............................. CYCLE    7 ..............................
........................................................................
   1    -11.3486447 -0.113486E+02  0.544E+00    1.35       0.0  T
   2    -11.3025902  0.460545E-01  0.420E+00    1.37       1.0  T
   3    -11.2475345  0.550557E-01  0.468E+00    1.20       1.0  T
   4    -11.3449604 -0.974259E-01  0.152E+00    1.03       1.0  T
   5    -11.3554594 -0.104990E-01  0.109E+00    1.42       1.0  T
   6    -11.3570045 -0.154518E-02  0.786E-01    1.32       1.0  T
   7    -11.3575835 -0.578981E-03  0.497E-01    1.34       1.0  T
   8    -11.3579146 -0.331103E-03  0.117E-01    1.34       1.0  T
   9    -11.3579319 -0.173194E-04  0.462E-02    1.33       1.0  T
  10    -11.3579338 -0.189653E-05  0.280E-02    1.33       1.6  T
  11    -11.3579352 -0.138056E-05  0.200E-03    1.33      22.4  T
  12    -11.3579352 -0.241259E-08  0.186E-03    1.33      24.0  T
  13    -11.3579352 -0.404354E-08  0.258E-04    1.33     173.6  T
  14    -11.3579352 -0.750262E-10  0.846E-05    1.33     528.4  T
     SCC iter.                  ...        0 min,  0.001 sec
     gradient                   ...        0 min,  0.001 sec
 * total energy  :   -11.1405767 Eh     change       -0.3573515E-01 Eh
   gradient norm :     0.0980951 Eh/α   predicted    -0.3520747E-01 (  -1.48%)
   displ. norm   :     0.3344058 α      lambda       -0.2219390E-01
   maximum displ.:     0.1954584 α      in ANC's #4, #1, #2, ...

........................................................................
.............................. CYCLE    8 ..............................
........................................................................
   1    -11.3423307 -0.113423E+02  0.223E+00    1.86       0.0  T
   2    -11.3412859  0.104484E-02  0.147E+00    1.68       1.0  T
   3    -11.3353259  0.595998E-02  0.133E+00    1.98       1.0  T
   4    -11.3439161 -0.859024E-02  0.110E-01    1.79       1.0  T
   5    -11.3439309 -0.147435E-04  0.604E-02    1.80       1.0  T
   6    -11.3439134  0.174842E-04  0.705E-02    1.81       1.0  T
   7    -11.3439374 -0.240277E-04  0.126E-02    1.80       3.5  T
   8    -11.3439377 -0.263559E-06  0.964E-03    1.80       4.6  T
   9    -11.3439380 -0.361933E-06  0.353E-03    1.80      12.7  T
  10    -11.3439380 -0.862623E-08  0.617E-04    1.80      72.5  T
  11    -11.3439380 -0.491191E-09  0.846E-05    1.80     528.5  T
     SCC iter.                  ...        0 min,  0.001 sec
     gradient                   ...        0 min,  0.001 sec
 * total energy  :   -11.1452772 Eh     change       -0.4700426E-02 Eh
   gradient norm :     0.1173927 Eh/α   predicted    -0.1233790E-01 ( 162.48%)
   displ. norm   :     0.3633986 α      lambda       -0.1334134E-01
   maximum displ.:     0.2810049 α      in ANC's #1, #2, #5, ...

........................................................................
.............................. CYCLE    9 ..............................
........................................................................
   1    -11.3938852 -0.113939E+02  0.137E+00    2.15       0.0  T
   2    -11.3930422  0.843044E-03  0.867E-01    2.14       1.0  T
   3    -11.3888977  0.414448E-02  0.990E-01    2.10       1.0  T
   4    -11.3945831 -0.568544E-02  0.984E-02    2.14       1.0  T
   5    -11.3946040 -0.208600E-04  0.608E-02    2.13       1.0  T
   6    -11.3946102 -0.618931E-05  0.400E-02    2.13       1.1  T
   7    -11.3946115 -0.137698E-05  0.137E-02    2.13       3.3  T
   8    -11.3946126 -0.110028E-05  0.322E-03    2.13      13.9  T
   9    -11.3946127 -0.198249E-07  0.193E-03    2.13      23.2  T
  10    -11.3946127 -0.959266E-09  0.253E-04    2.13     176.6  T
  11    -11.3946127 -0.876099E-11  0.424E-05    2.13    1055.9  T
     SCC iter.                  ...        0 min,  0.001 sec
     gradient                   ...        0 min,  0.002 sec
 * total energy  :   -11.1452483 Eh     change        0.2889477E-04 Eh
   gradient norm :     0.0808701 Eh/α   predicted    -0.7551596E-02 (*******%)
   displ. norm   :     0.3365277 α      lambda       -0.1332085E-01
   maximum displ.:     0.1779000 α      in ANC's #3, #1, #4, ...

........................................................................
.............................. CYCLE   10 ..............................
........................................................................
   1    -11.3969862 -0.113970E+02  0.210E+00    1.06       0.0  T
   2    -11.3964146  0.571619E-03  0.133E+00    1.15       1.0  T
   3    -11.3824555  0.139591E-01  0.145E+00    0.88       1.0  T
   4    -11.3972862 -0.148307E-01  0.173E-01    1.04       1.0  T
   5    -11.3974803 -0.194105E-03  0.559E-02    1.08       1.0  T
   6    -11.3974832 -0.287709E-05  0.292E-02    1.08       1.5  T
   7    -11.3974842 -0.952277E-06  0.895E-03    1.07       5.0  T
   8    -11.3974844 -0.260372E-06  0.371E-03    1.07      12.1  T
   9    -11.3974844 -0.157233E-07  0.189E-03    1.07      23.7  T
  10    -11.3974845 -0.792530E-08  0.270E-04    1.07     165.5  T
  11    -11.3974845 -0.633396E-10  0.446E-05    1.07    1001.6  T
     SCC iter.                  ...        0 min,  0.001 sec
     gradient                   ...        0 min,  0.001 sec
 * total energy  :   -11.1432293 Eh     change        0.2018925E-02 Eh
   gradient norm :     0.1164083 Eh/α   predicted    -0.7414729E-02 (-467.26%)
   displ. norm   :     0.1723203 α      lambda       -0.1789106E-01
   maximum displ.:     0.1114776 α      in ANC's #5, #4, #1, ...

........................................................................
.............................. CYCLE   11 ..............................
........................................................................
   1    -11.3623790 -0.113624E+02  0.133E+00    1.63       0.0  T
   2    -11.3623360  0.430683E-04  0.760E-01    1.66       1.0  T
   3    -11.3598676  0.246838E-02  0.642E-01    1.61       1.0  T
   4    -11.3624452 -0.257759E-02  0.881E-02    1.66       1.0  T
   5    -11.3624702 -0.250533E-04  0.499E-02    1.66       1.0  T
   6    -11.3624723 -0.206480E-05  0.149E-02    1.66       3.0  T
   7    -11.3624728 -0.495603E-06  0.104E-02    1.66       4.3  T
   8    -11.3624734 -0.650857E-06  0.279E-03    1.66      16.0  T
   9    -11.3624734 -0.105774E-08  0.103E-03    1.66      43.5  T
  10    -11.3624734 -0.241048E-08  0.318E-04    1.66     140.8  T
  11    -11.3624734 -0.166946E-09  0.324E-05    1.66    1379.7  T
     SCC iter.                  ...        0 min,  0.001 sec
     gradient                   ...        0 min,  0.001 sec
 * total energy  :   -11.1495508 Eh     change       -0.6321458E-02 Eh
   gradient norm :     0.0559987 Eh/α   predicted    -0.9211168E-02 (  45.71%)
   displ. norm   :     0.1006949 α      lambda       -0.2917860E-02
   maximum displ.:     0.0519838 α      in ANC's #4, #3, #5, ...

........................................................................
.............................. CYCLE   12 ..............................
........................................................................
   1    -11.3847621 -0.113848E+02  0.486E-01    1.73       0.0  T
   2    -11.3845998  0.162259E-03  0.355E-01    1.66       1.0  T
   3    -11.3847854 -0.185544E-03  0.260E-01    1.73       1.0  T
   4    -11.3849736 -0.188173E-03  0.722E-02    1.71       1.0  T
   5    -11.3850077 -0.341546E-04  0.194E-02    1.70       2.3  T
   6    -11.3850080 -0.318434E-06  0.810E-03    1.70       5.5  T
   7    -11.3850082 -0.123655E-06  0.358E-03    1.70      12.5  T
   8    -11.3850082 -0.496365E-07  0.116E-03    1.70      38.4  T
   9    -11.3850082 -0.830024E-09  0.273E-04    1.70     164.1  T
  10    -11.3850082 -0.217769E-09  0.672E-05    1.70     665.5  T
     SCC iter.                  ...        0 min,  0.001 sec
     gradient                   ...        0 min,  0.001 sec
 * total energy  :   -11.1501399 Eh     change       -0.5891174E-03 Eh
   gradient norm :     0.0310345 Eh/α   predicted    -0.1473724E-02 ( 150.16%)
   displ. norm   :     0.1104822 α      lambda       -0.1302779E-02
   maximum displ.:     0.0813478 α      in ANC's #1, #2, #4, ...

........................................................................
.............................. CYCLE   13 ..............................
........................................................................
   1    -11.3815561 -0.113816E+02  0.479E-01    1.64       0.0  T
   2    -11.3815213  0.347744E-04  0.287E-01    1.69       1.0  T
   3    -11.3812410  0.280336E-03  0.276E-01    1.61       1.0  T
   4    -11.3816414 -0.400374E-03  0.224E-02    1.66       2.0  T
   5    -11.3816400  0.139572E-05  0.205E-02    1.66       2.2  T
   6    -11.3816417 -0.173768E-05  0.576E-03    1.66       7.8  T
   7    -11.3816419 -0.168425E-06  0.278E-03    1.66      16.1  T
   8    -11.3816419 -0.320548E-07  0.935E-04    1.66      47.8  T
   9    -11.3816419 -0.115951E-08  0.243E-04    1.66     184.4  T
     SCC iter.                  ...        0 min,  0.001 sec
     gradient                   ...        0 min,  0.001 sec
 * total energy  :   -11.1507211 Eh     change       -0.5812046E-03 Eh
   gradient norm :     0.0143914 Eh/α   predicted    -0.6593390E-03 (  13.44%)
   displ. norm   :     0.1102804 α      lambda       -0.5889350E-03
   maximum displ.:     0.0691406 α      in ANC's #1, #3, #5, ...

........................................................................
.............................. CYCLE   14 ..............................
........................................................................
   1    -11.3752590 -0.113753E+02  0.378E-01    1.73       0.0  T
   2    -11.3752428  0.162478E-04  0.231E-01    1.76       1.0  T
   3    -11.3750454  0.197378E-03  0.213E-01    1.71       1.0  T
   4    -11.3753088 -0.263418E-03  0.334E-02    1.74       1.3  T
   5    -11.3753138 -0.496826E-05  0.209E-02    1.74       2.1  T
   6    -11.3753156 -0.186182E-05  0.827E-03    1.74       5.4  T
   7    -11.3753157 -0.392908E-07  0.432E-03    1.74      10.4  T
   8    -11.3753158 -0.744273E-07  0.840E-04    1.74      53.2  T
   9    -11.3753158 -0.665308E-09  0.183E-04    1.74     244.5  T
     SCC iter.                  ...        0 min,  0.001 sec
     gradient                   ...        0 min,  0.002 sec
 * total energy  :   -11.1503237 Eh     change        0.3974776E-03 Eh
   gradient norm :     0.0172083 Eh/α   predicted    -0.2980488E-03 (-174.99%)
   displ. norm   :     0.0919258 α      lambda       -0.1128266E-02
   maximum displ.:     0.0746687 α      in ANC's #1, #3, #5, ...

........................................................................
.............................. CYCLE   15 ..............................
........................................................................
   1    -11.3802979 -0.113803E+02  0.335E-01    1.65       0.0  T
   2    -11.3802605  0.373438E-04  0.209E-01    1.62       1.0  T
   3    -11.3801199  0.140566E-03  0.209E-01    1.67       1.0  T
   4    -11.3803471 -0.227167E-03  0.469E-02    1.65       1.0  T
   5    -11.3803602 -0.131230E-04  0.169E-02    1.64       2.6  T
   6    -11.3803610 -0.745727E-06  0.756E-03    1.64       5.9  T
   7    -11.3803611 -0.736233E-07  0.345E-03    1.64      13.0  T
   8    -11.3803611 -0.456130E-07  0.919E-04    1.64      48.7  T
   9    -11.3803611 -0.129467E-08  0.218E-04    1.64     205.3  T
     SCC iter.                  ...        0 min,  0.001 sec
     gradient                   ...        0 min,  0.001 sec
 * total energy  :   -11.1509283 Eh     change       -0.6046122E-03 Eh
   gradient norm :     0.0104949 Eh/α   predicted    -0.5689001E-03 (  -5.91%)
   displ. norm   :     0.0219438 α      lambda       -0.1070888E-03
   maximum displ.:     0.0150533 α      in ANC's #1, #3, #6, ...

........................................................................
.............................. CYCLE   16 ..............................
........................................................................
   1    -11.3820273 -0.113820E+02  0.946E-02    1.67       0.0  T
   2    -11.3820222  0.512050E-05  0.663E-02    1.68       1.0  T
   3    -11.3820063  0.158652E-04  0.632E-02    1.68       1.0  T
   4    -11.3820312 -0.249135E-04  0.120E-02    1.68       3.7  T
   5    -11.3820318 -0.605138E-06  0.363E-03    1.68      12.3  T
   6    -11.3820318 -0.342916E-08  0.226E-03    1.68      19.8  T
   7    -11.3820318 -0.387479E-08  0.123E-03    1.68      36.4  T
   8    -11.3820318 -0.847996E-08  0.285E-04    1.68     157.0  T
   9    -11.3820318 -0.112728E-09  0.433E-05    1.68    1032.7  T
     SCC iter.                  ...        0 min,  0.001 sec
     gradient                   ...        0 min,  0.001 sec
 * total energy  :   -11.1510084 Eh     change       -0.8012358E-04 Eh
   gradient norm :     0.0095577 Eh/α   predicted    -0.5357061E-04 ( -33.14%)
   displ. norm   :     0.0681122 α      lambda       -0.2254989E-03
   maximum displ.:     0.0530916 α      in ANC's #1, #6, #8, ...

........................................................................
.............................. CYCLE   17 ..............................
........................................................................
   1    -11.3834215 -0.113834E+02  0.229E-01    1.70       0.0  T
   2    -11.3834240 -0.253292E-05  0.132E-01    1.71       1.0  T
   3    -11.3834108  0.131908E-04  0.566E-02    1.70       1.0  T
   4    -11.3834255 -0.147078E-04  0.131E-02    1.71       3.4  T
   5    -11.3834255 -0.255709E-07  0.109E-02    1.71       4.1  T
   6    -11.3834260 -0.479230E-06  0.213E-03    1.71      21.0  T
   7    -11.3834260 -0.183994E-07  0.513E-04    1.71      87.1  T
   8    -11.3834260  0.949731E-09  0.479E-04    1.71      93.4  T
     SCC iter.                  ...        0 min,  0.001 sec
     gradient                   ...        0 min,  0.001 sec
 * total energy  :   -11.1511713 Eh     change       -0.1629045E-03 Eh
   gradient norm :     0.0089041 Eh/α   predicted    -0.1132722E-03 ( -30.47%)
   displ. norm   :     0.0692907 α      lambda       -0.1762008E-03
   maximum displ.:     0.0453199 α      in ANC's #1, #2, #8, ...

........................................................................
.............................. CYCLE   18 ..............................
........................................................................
   1    -11.3836429 -0.113836E+02  0.229E-01    1.74       0.0  T
   2    -11.3836435 -0.630217E-06  0.132E-01    1.74       1.0  T
   3    -11.3835866  0.569585E-04  0.103E-01    1.73       1.0  T
   4    -11.3836474 -0.607761E-04  0.140E-02    1.74       3.2  T
   5    -11.3836473  0.657435E-07  0.111E-02    1.74       4.0  T
   6    -11.3836478 -0.554650E-06  0.163E-03    1.74      27.4  T
   7    -11.3836479 -0.868650E-08  0.729E-04    1.74      61.3  T
   8    -11.3836479 -0.100988E-08  0.376E-04    1.74     118.8  T
     SCC iter.                  ...        0 min,  0.001 sec
     gradient                   ...        0 min,  0.001 sec
 * total energy  :   -11.1512915 Eh     change       -0.1201958E-03 Eh
   gradient norm :     0.0054501 Eh/α   predicted    -0.8852376E-04 ( -26.35%)
   displ. norm   :     0.0507363 α      lambda       -0.8987552E-04
   maximum displ.:     0.0347674 α      in ANC's #2, #1, #8, ...

........................................................................
.............................. CYCLE   19 ..............................
........................................................................
   1    -11.3833383 -0.113833E+02  0.159E-01    1.75       0.0  T
   2    -11.3833367  0.155305E-05  0.934E-02    1.75       1.0  T
   3    -11.3832751  0.616271E-04  0.103E-01    1.74       1.0  T
   4    -11.3833413 -0.662350E-04  0.899E-03    1.75       5.0  T
   5    -11.3833410  0.289965E-06  0.801E-03    1.75       5.6  T
   6    -11.3833414 -0.394474E-06  0.684E-04    1.75      65.4  T
   7    -11.3833414  0.358238E-10  0.380E-04    1.75     117.8  T
     SCC iter.                  ...        0 min,  0.001 sec
     gradient                   ...        0 min,  0.001 sec
 * total energy  :   -11.1513549 Eh     change       -0.6336486E-04 Eh
   gradient norm :     0.0035109 Eh/α   predicted    -0.4505218E-04 ( -28.90%)
   displ. norm   :     0.0387363 α      lambda       -0.5755334E-04
   maximum displ.:     0.0318535 α      in ANC's #2, #8, #3, ...

........................................................................
.............................. CYCLE   20 ..............................
........................................................................
   1    -11.3835348 -0.113835E+02  0.124E-01    1.75       0.0  T
   2    -11.3835345  0.248799E-06  0.729E-02    1.75       1.0  T
   3    -11.3835080  0.265311E-04  0.672E-02    1.75       1.0  T
   4    -11.3835361 -0.281143E-04  0.745E-03    1.75       6.0  T
   5    -11.3835361  0.562060E-07  0.603E-03    1.75       7.4  T
   6    -11.3835363 -0.195803E-06  0.823E-04    1.75      54.3  T
   7    -11.3835363 -0.893612E-09  0.370E-04    1.75     121.0  T
     SCC iter.                  ...        0 min,  0.001 sec
     gradient                   ...        0 min,  0.001 sec
 * total energy  :   -11.1513910 Eh     change       -0.3615418E-04 Eh
   gradient norm :     0.0018991 Eh/α   predicted    -0.2882094E-04 ( -20.28%)
   displ. norm   :     0.0318142 α      lambda       -0.1985492E-04
   maximum displ.:     0.0256996 α      in ANC's #2, #4, #6, ...
 * RMSD in coord.:     1.0786554 α      energy gain  -0.2873851E+00 Eh

generating ANC from model Hessian ...
Using Lindh-Hessian (1995)
 Shifting diagonal of input Hessian by    9.5427487857734691E-003
 Lowest  eigenvalues of input Hessian
   -0.000000   -0.000000   -0.000000   -0.000000    0.000000    0.000000
    0.010000    0.011988    0.188034    0.335143    0.600621    1.170861
    1.256237    1.853259    2.756585
 Highest eigenvalues
    0.335143    0.600621    1.170861    1.256237    1.853259    2.756585


........................................................................
.............................. CYCLE   21 ..............................
........................................................................
   1    -11.3819751 -0.113820E+02  0.102E-01    1.73       0.0  T
   2    -11.3819747  0.377456E-06  0.609E-02    1.73       1.0  T
   3    -11.3819506  0.241220E-04  0.602E-02    1.73       1.0  T
   4    -11.3819762 -0.255703E-04  0.634E-03    1.73       7.1  T
   5    -11.3819762 -0.626407E-07  0.404E-03    1.73      11.1  T
   6    -11.3819763 -0.307295E-07  0.737E-04    1.73      60.7  T
   7    -11.3819763 -0.689935E-09  0.326E-04    1.73     137.3  T
     SCC iter.                  ...        0 min,  0.001 sec
     gradient                   ...        0 min,  0.001 sec
 * total energy  :   -11.1513968 Eh     change       -0.5827064E-05 Eh
   gradient norm :     0.0057378 Eh/α   predicted     0.0000000E+00 (-100.00%)
   displ. norm   :     0.0161606 α      lambda       -0.2400326E-04
   maximum displ.:     0.0148812 α      in ANC's #2, #4, #1, ...

........................................................................
.............................. CYCLE   22 ..............................
........................................................................
   1    -11.3835067 -0.113835E+02  0.530E-02    1.74       0.0  T
   2    -11.3835068 -0.965808E-07  0.307E-02    1.74       1.5  T
   3    -11.3835027  0.414319E-05  0.263E-02    1.74       1.7  T
   4    -11.3835071 -0.445635E-05  0.383E-03    1.74      11.7  T
   5    -11.3835072 -0.582778E-07  0.218E-03    1.74      20.5  T
   6    -11.3835072 -0.193855E-07  0.939E-04    1.74      47.6  T
   7    -11.3835072 -0.343372E-09  0.430E-04    1.74     104.1  T
     SCC iter.                  ...        0 min,  0.001 sec
     gradient                   ...        0 min,  0.001 sec
 * total energy  :   -11.1514007 Eh     change       -0.3888915E-05 Eh
   gradient norm :     0.0020260 Eh/α   predicted    -0.1200291E-04 ( 208.64%)
   displ. norm   :     0.0378746 α      lambda       -0.4060609E-04
   maximum displ.:     0.0267776 α      in ANC's #1, #2, #4, ...

........................................................................
.............................. CYCLE   23 ..............................
........................................................................
   1    -11.3855307 -0.113855E+02  0.117E-01    1.75       0.0  T
   2    -11.3855309 -0.179885E-06  0.689E-02    1.75       1.0  T
   3    -11.3855104  0.204620E-04  0.555E-02    1.75       1.0  T
   4    -11.3855320 -0.216086E-04  0.780E-03    1.75       5.7  T
   5    -11.3855322 -0.164951E-06  0.443E-03    1.75      10.1  T
   6    -11.3855322 -0.365948E-07  0.169E-03    1.75      26.5  T
   7    -11.3855323 -0.549038E-08  0.740E-04    1.75      60.4  T
   8    -11.3855323 -0.321420E-08  0.225E-04    1.75     198.6  T
     SCC iter.                  ...        0 min,  0.001 sec
     gradient                   ...        0 min,  0.001 sec
 * total energy  :   -11.1513568 Eh     change        0.4391703E-04 Eh
   gradient norm :     0.0102675 Eh/α   predicted    -0.2033070E-04 (-146.29%)
   displ. norm   :     0.0273026 α      lambda       -0.1036790E-03
   maximum displ.:     0.0223741 α      in ANC's #1, #2, #4, ...

........................................................................
.............................. CYCLE   24 ..............................
........................................................................
   1    -11.3833149 -0.113833E+02  0.817E-02    1.74       0.0  T
   2    -11.3833150 -0.576133E-07  0.493E-02    1.74       1.0  T
   3    -11.3833030  0.120072E-04  0.432E-02    1.74       1.0  T
   4    -11.3833156 -0.126458E-04  0.748E-03    1.74       6.0  T
   5    -11.3833158 -0.213555E-06  0.362E-03    1.74      12.4  T
   6    -11.3833158 -0.328115E-07  0.148E-03    1.74      30.2  T
   7    -11.3833159 -0.220016E-08  0.741E-04    1.74      60.4  T
   8    -11.3833159 -0.333186E-08  0.189E-04    1.74     236.5  T
     SCC iter.                  ...        0 min,  0.001 sec
     gradient                   ...        0 min,  0.001 sec
 * total energy  :   -11.1514093 Eh     change       -0.5250293E-04 Eh
   gradient norm :     0.0008163 Eh/α   predicted    -0.5187859E-04 (  -1.19%)
   displ. norm   :     0.0104705 α      lambda       -0.1586026E-05
   maximum displ.:     0.0075660 α      in ANC's #2, #1, #3, ...

........................................................................
.............................. CYCLE   25 ..............................
........................................................................
   1    -11.3833090 -0.113833E+02  0.362E-02    1.74       0.0  T
   2    -11.3833091 -0.665654E-07  0.205E-02    1.74       2.2  T
   3    -11.3833087  0.398631E-06  0.881E-03    1.74       5.1  T
   4    -11.3833091 -0.445614E-06  0.166E-03    1.74      27.0  T
   5    -11.3833091  0.747270E-08  0.147E-03    1.74      30.4  T
   6    -11.3833091 -0.119295E-07  0.236E-04    1.74     189.9  T
   7    -11.3833091 -0.982361E-10  0.145E-04    1.74     309.3  T
     SCC iter.                  ...        0 min,  0.001 sec
     gradient                   ...        0 min,  0.001 sec
 * total energy  :   -11.1514105 Eh     change       -0.1163739E-05 Eh
   gradient norm :     0.0007896 Eh/α   predicted    -0.7913406E-06 ( -32.00%)
   displ. norm   :     0.0066826 α      lambda       -0.2271992E-05
   maximum displ.:     0.0039139 α      in ANC's #3, #1, #5, ...

   *** GEOMETRY OPTIMIZATION CONVERGED AFTER 25 ITERATIONS ***

------------------------------------------------------------------------
 total energy gain   :        -0.2874045 Eh     -180.3491 kcal/mol
 total RMSD          :         1.0760844 a0        0.5694 Å
 total power (kW/mol):       -30.1832193 (step)-7903.7743 (real)
------------------------------------------------------------------------

 ANCopt (total)                0 d,  0 h,  0 min,  0.095 sec
 optimizer setup                ...        0 min,  0.000 sec (  0.056%)
 model hessian                  ...        0 min,  0.000 sec (  0.104%)
 ANC generation                 ...        0 min,  0.000 sec (  0.085%)
 coordinate transformation      ...        0 min,  0.000 sec (  0.054%)
 single point calculation       ...        0 min,  0.093 sec ( 97.599%)
 optimization log               ...        0 min,  0.001 sec (  0.645%)
 hessian update                 ...        0 min,  0.000 sec (  0.051%)
 rational function              ...        0 min,  0.001 sec (  0.668%)

================
 final structure:
================
5
 xtb: 6.2.2 (9d81278992624c895f80dd42a50cac0aa55982e2)
C        -1.46760735750433    0.87411315269199   -0.03145040718575
C        -0.28905488378787   -0.02305190332958   -0.00306262721474
C         1.07483747693626   -0.12782765783981    0.01346561114879
C        -1.54141629705640   -0.51861237996920   -0.00550951825488
N         2.22324106141234   -0.20462221155339    0.02655794150657

 Bond Distances (Angstroems)
 ---------------------------
C1-C2=1.4815         C1-C4=1.3949         C2-C1=1.4815         C2-C3=1.3680         C2-C4=1.3468         C3-C2=1.3680         
C3-N5=1.1510         C4-C1=1.3949         C4-C2=1.3468         N5-C3=1.1510         
 C  C  Rav=1.3978 sigma=0.0512  Rmin=1.3468  Rmax=1.4815     4
 N  C  Rav=1.1510 sigma=0.0000  Rmin=1.1510  Rmax=1.1510     1

 selected bond angles (degree)
 --------------------
C4-C1-C2= 55.74                C3-C2-C1=147.11                C4-C2-C1= 58.87                C4-C2-C3=154.01                
N5-C3-C2=179.43                C2-C4-C1= 65.38                

 selected dihedral angles (degree)
 ---------------------------------
C3-C2-C1-C4=180.12            N5-C3-C2-C1=356.87            N5-C3-C2-C4=177.10            C1-C4-C2-C3=179.85            
           -------------------------------------------------
          |                Final Singlepoint                |
           -------------------------------------------------

          ...................................................
          :                      SETUP                      :
          :.................................................:
          :  # basis functions                  20          :
          :  # atomic orbitals                  20          :
          :  # shells                           10          :
          :  # electrons                        21          :
          :  max. iterations                   250          :
          :  Hamiltonian                  GFN2-xTB          :
          :  restarted?                      false          :
          :  GBSA solvation                  false          :
          :  PC potential                    false          :
          :  electronic temp.          300.0000000     K    :
          :  accuracy                    1.0000000          :
          :  -> integral cutoff          0.2500000E+02      :
          :  -> integral neglect         0.1000000E-07      :
          :  -> SCF convergence          0.1000000E-05 Eh   :
          :  -> wf. convergence          0.1000000E-03 e    :
          :  Broyden damping             0.4000000          :
          ...................................................

 iter      E             dE          RMSdq      gap      omega  full diag
   1    -11.3833091 -0.113833E+02  0.678E-05    1.74       0.0  T
   2    -11.3833091  0.627587E-11  0.544E-05    1.74     821.9  T
   3    -11.3833091 -0.193854E-10  0.272E-05    1.74    1643.9  T

   *** convergence criteria satisfied after 3 iterations ***

         #    Occupation            Energy/Eh            Energy/eV
      -------------------------------------------------------------
         1        2.0000           -0.7291455             -19.8411
       ...           ...                  ...                  ...
         5        2.0000           -0.5622933             -15.3008
         6        2.0000           -0.5380305             -14.6406
         7        2.0000           -0.5258773             -14.3098
         8        2.0000           -0.5132899             -13.9673
         9        2.0000           -0.4708189             -12.8116
        10        2.0000           -0.4424808             -12.0405
        11        1.0000           -0.4204733             -11.4417 (HOMO)
        12                         -0.3564926              -9.7007 (LUMO)
        13                         -0.2964280              -8.0662
        14                         -0.2581773              -7.0254
        15                         -0.1784564              -4.8560
        16                         -0.0271802              -0.7396
       ...                                ...                  ...
        20                          1.1962839              32.5525
      -------------------------------------------------------------
                  HL-Gap            0.0639808 Eh            1.7410 eV
             Fermi-level           -0.4099800 Eh          -11.1561 eV

 SCC (total)                   0 d,  0 h,  0 min,  0.003 sec
 SCC setup                      ...        0 min,  0.000 sec (  1.420%)
 Dispersion                     ...        0 min,  0.000 sec (  0.419%)
 integral evaluation            ...        0 min,  0.001 sec ( 41.700%)
 zeroth order Hamiltonian       ...        0 min,  0.000 sec (  0.458%)
 iterations                     ...        0 min,  0.000 sec ( 11.595%)
 molecular gradient             ...        0 min,  0.001 sec ( 42.088%)
 printout                       ...        0 min,  0.000 sec (  2.049%)

         :::::::::::::::::::::::::::::::::::::::::::::::::::::
         ::                     SUMMARY                     ::
         :::::::::::::::::::::::::::::::::::::::::::::::::::::
         :: total energy             -11.151410472054 Eh    ::
         :: gradient norm              0.000789999511 Eh/a0 ::
         :: HOMO-LUMO gap              1.741005729849 eV    ::
         ::.................................................::
         :: SCC energy               -11.383309134577 Eh    ::
         :: -> isotropic ES           -0.000286314064 Eh    ::
         :: -> anisotropic ES          0.001737936940 Eh    ::
         :: -> anisotropic XC          0.022180093424 Eh    ::
         :: -> dispersion             -0.002690488193 Eh    ::
         :: repulsion energy           0.231898736196 Eh    ::
         :: add. restraining           0.000000000000 Eh    ::
         :::::::::::::::::::::::::::::::::::::::::::::::::::::

           ------------------------------------------------- 
          |                Numerical Hessian                |
           ------------------------------------------------- 
step length          :   0.00500
SCC accuracy         :   0.30000
Hessian scale factor :   1.00000
frozen atoms in %    :   0.00000    0
RMS gradient         :   0.00079
estimated CPU  time      0.00 min
estimated wall time      0.00 min

writing file <hessian>.

 projected vibrational frequencies (cm-1)
eigval :       -0.00    -0.00     0.00     0.00     0.00     0.00
eigval :      190.06   201.78   499.66   546.29   705.79   941.09
eigval :     1203.74  1792.07  2301.05
           -------------------------------------------------
          |                Property Printout                |
           -------------------------------------------------

    * Orbital Energies and Occupations

         #    Occupation            Energy/Eh            Energy/eV
      -------------------------------------------------------------
         1        2.0000           -0.7291454             -19.8411
         2        2.0000           -0.6931962             -18.8628
         3        2.0000           -0.6564869             -17.8639
         4        2.0000           -0.5968699             -16.2417
         5        2.0000           -0.5622933             -15.3008
         6        2.0000           -0.5380305             -14.6406
         7        2.0000           -0.5258773             -14.3099
         8        2.0000           -0.5132900             -13.9673
         9        2.0000           -0.4708191             -12.8116
        10        2.0000           -0.4424806             -12.0405
        11        1.0000           -0.4204732             -11.4417 (HOMO)
        12                         -0.3564925              -9.7007 (LUMO)
        13                         -0.2964278              -8.0662
        14                         -0.2581774              -7.0254
        15                         -0.1784565              -4.8560
        16                         -0.0271801              -0.7396
        17                          0.0603938               1.6434
        18                          0.3150048               8.5717
        19                          0.5757681              15.6674
        20                          1.1962838              32.5525
      -------------------------------------------------------------
                  HL-Gap            0.0639807 Eh            1.7410 eV
             Fermi-level           -0.4099799 Eh          -11.1561 eV

     #   Z        covCN         q      C6AA      α(0)
     1   6 C      1.958    -0.089    33.508     9.348
     2   6 C      2.940     0.113    25.505     8.283
     3   6 C      1.891     0.128    27.973     8.542
     4   6 C      1.961     0.008    30.855     8.970
     5   7 N      0.911    -0.161    24.485     7.156

 Mol. C6AA /au·bohr⁶  :        707.916470
 Mol. C8AA /au·bohr⁸  :      19524.898788
 Mol. α(0) /au        :         42.299501


Wiberg/Mayer (AO) data.
largest (>0.10) Wiberg bond orders for each atom
          total WBO             WBO to atom ...
     1  C   2.560        C    4 1.310    C    2 1.110    N    5 0.109
     2  C   3.840        C    4 1.483    C    3 1.192    C    1 1.110
     3  C   3.960        N    5 2.710    C    2 1.192
     4  C   2.923        C    2 1.483    C    1 1.310    N    5 0.103
     5  N   2.977        C    3 2.710    C    1 0.109    C    4 0.103

MOs/occ written to file <molden.input>


molecular dipole:
                 x           y           z       tot (Debye)
 q only:       -0.257      -0.128      -0.000
   full:       -0.309      -0.403       0.004       1.291
molecular quadrupole (traceless):
                xx          xy          yy          xz          yz          zz
 q only:       -2.767       0.948       1.196      -0.062       0.017       1.571
  q+dip:       -5.152       3.119       2.038      -0.143       0.052       3.113
   full:       -8.047       3.321       1.903      -0.207       0.114       6.144

           -------------------------------------------------
          |                Geometry Summary                 |
           -------------------------------------------------

      molecular mass/u    :       62.0496468
   center of mass at/Å    :        0.0715155      -0.0065827       0.0008543
  moments of inertia/u·Å² :        0.1170963E+02   0.1397095E+03   0.1514191E+03
rotational constants/cm⁻¹ :        0.1439639E+01   0.1206620E+00   0.1113309E+00

 * 3 selected distances

     #   Z        #   Z                                     value/Å
     2   6 C      3   6 C                                 1.3680108 (max)
     2   6 C      4   6 C                                 1.3468464
     3   6 C      5   7 N                                 1.1510428 (min)

 * 2 distinct bonds (by element types)

   Z      Z             #   av. dist./Å        max./Å        min./Å
   6 C    6 C           2     1.3574286     1.3680108     1.3468464
   6 C    7 N           1     1.1510428     1.1510428     1.1510428

           -------------------------------------------------
          |               Frequency Printout                |
           -------------------------------------------------
 projected vibrational frequencies (cm-1)
eigval :       -0.00    -0.00     0.00     0.00     0.00     0.00
eigval :      190.06   201.78   499.66   546.29   705.79   941.09
eigval :     1203.74  1792.07  2301.05
 reduced masses (amu)
   1: 12.69   2: 12.83   3: 12.01   4: 12.23   5: 12.45   6: 12.99   7: 12.53   8: 12.51
   9: 12.18  10: 12.12  11: 12.50  12: 12.17  13: 12.08  14: 12.07  15: 12.77
 IR intensities (amu)
   1:  0.04   2:  0.06   3:  0.15   4:  0.02   5:  0.11   6:  0.15   7:  0.45   8:  0.54
   9:  0.25  10:  0.03  11:  0.05  12:  0.32  13:  0.69  14:  0.29  15:  0.79
 Raman intensities (amu)
   1:  0.00   2:  0.00   3:  0.00   4:  0.00   5:  0.00   6:  0.00   7:  0.00   8:  0.00
   9:  0.00  10:  0.00  11:  0.00  12:  0.00  13:  0.00  14:  0.00  15:  0.00
 output can be read by thermo (or use thermo option).
 writing <g98.out> molden fake output.
 recommended (thermochemical) frequency scaling factor: 1.0
           -------------------------------------------------
          |             Thermodynamic Functions             |
Molecule has the following symmetry elements: (sigma) 
It seems to be the Cs point group
           -------------------------------------------------

cs  symmetry found (for desy threshold:  0.10E+00) used in thermo

          ...................................................
          :                      SETUP                      :
          :.................................................:
          :  # frequencies                           9      :
          :  # imaginary freq.                       0      :
          :  linear?                             false      :
          :  only rotor calc.                    false      :
          :  symmetry                               cs      :
          :  rotational number                       1      :
          :  scaling factor                  1.0000000      :
          :  rotor cutoff                   50.0000000 cm⁻¹ :
          :  imag. cutoff                  -20.0000000 cm⁻¹ :
          :.................................................:

    mode    ω/cm⁻¹     T·S(HO)/kcal·mol⁻¹    T·S(FR)/kcal·mol⁻¹   T·S(vib)
   ------------------------------------------------------------------------
       1    190.06    -0.00000 ( 99.52%)     0.01157 (  0.48%)     0.00006
       2    201.78    -0.00000 ( 99.62%)     0.01217 (  0.38%)     0.00005
   ------------------------------------------------------------------------

   temp. (K)  partition function   enthalpy   heat capacity  entropy
                                   cal/mol     cal/K/mol   cal/K/mol   J/K/mol
 298.15  VIB   3.32                 1082.786      7.586      6.018
         ROT  0.380E+05              888.752      2.981     23.938
         INT  0.126E+06             1971.538     10.567     29.956
         TR   0.473E+27             1481.254      4.968     38.278
         TOT                        3452.7920    15.5354    68.2340   285.4911

   temp. (K)  partition function   enthalpy   heat capacity  entropy
                                   cal/mol     cal/K/mol   cal/K/mol   J/K/mol
 120.00  VIB   1.23                  124.638      2.894      1.452
         ROT  0.971E+04              357.707      2.981     21.225
         INT  0.119E+05              482.345      5.875     22.677
         TR   0.121E+27              596.178      4.968     33.759
         TOT                        1078.5227    10.8430    56.4360   236.1283

   temp. (K)  partition function   enthalpy   heat capacity  entropy
                                   cal/mol     cal/K/mol   cal/K/mol   J/K/mol
 100.00  VIB   1.13                   72.978      2.265      0.983
         ROT  0.739E+04              298.089      2.981     20.682
         INT  0.837E+04              371.067      5.246     21.665
         TR   0.919E+26              496.815      4.968     32.853
         TOT                         867.8822    10.2144    54.5182   228.1043

   temp. (K)  partition function   enthalpy   heat capacity  entropy
                                   cal/mol     cal/K/mol   cal/K/mol   J/K/mol
  80.00  VIB   1.06                   34.415      1.578      0.555
         ROT  0.528E+04              238.471      2.981     20.017
         INT  0.561E+04              272.886      4.559     20.572
         TR   0.657E+26              397.452      4.968     31.745
         TOT                         670.3384     9.5270    52.3174   218.8961

   temp. (K)  partition function   enthalpy   heat capacity  entropy
                                   cal/mol     cal/K/mol   cal/K/mol   J/K/mol
  60.00  VIB   1.02                   10.377      0.819      0.214
         ROT  0.343E+04              178.853      2.981     19.159
         INT  0.350E+04              189.230      3.800     19.373
         TR   0.427E+26              298.089      4.968     30.317
         TOT                         487.3195     8.7680    49.6898   207.9020

   temp. (K)  partition function   enthalpy   heat capacity  entropy
                                   cal/mol     cal/K/mol   cal/K/mol   J/K/mol
  40.00  VIB   1.00                    0.991      0.174      0.030
         ROT  0.187E+04              119.236      2.981     17.951
         INT  0.187E+04              120.227      3.155     17.980
         TR   0.232E+26              198.726      4.968     28.303
         TOT                         318.9528     8.1229    46.2836   193.6504

   temp. (K)  partition function   enthalpy   heat capacity  entropy
                                   cal/mol     cal/K/mol   cal/K/mol   J/K/mol
  20.00  VIB   1.00                    0.001      0.001     -0.004
         ROT   661.                   59.618      2.981     15.884
         INT   661.                   59.619      2.982     15.880
         TR   0.822E+25               99.363      4.968     24.861
         TOT                         158.9817     7.9497    40.7412   170.4613

   temp. (K)  partition function   enthalpy   heat capacity  entropy
                                   cal/mol     cal/K/mol   cal/K/mol   J/K/mol
  10.00  VIB   1.00                    0.000      0.000     -0.011
         ROT   234.                   29.809      2.981     13.818
         INT   234.                   29.809      2.981     13.808
         TR   0.290E+25               49.681      4.968     21.419
         TOT                          79.4904     7.9490    35.2270   147.3897

       T/K    H(0)-H(T)+PV         H(T)/Eh          T*S/Eh         G(T)/Eh
   ------------------------------------------------------------------------
    298.15    0.550237E-02    0.245969E-01    0.324202E-01   -0.782330E-02
    120.00    0.171874E-02    0.208132E-01    0.107924E-01    0.100209E-01
    100.00    0.138306E-02    0.204776E-01    0.868804E-02    0.117895E-01
     80.00    0.106825E-02    0.201628E-01    0.666985E-02    0.134929E-01
     60.00    0.776593E-03    0.198711E-01    0.475114E-02    0.151200E-01
     40.00    0.508284E-03    0.196028E-01    0.295030E-02    0.166525E-01
     20.00    0.253353E-03    0.193479E-01    0.129851E-02    0.180494E-01
     10.00    0.126676E-03    0.192212E-01    0.561378E-03    0.186598E-01 (used)
   ------------------------------------------------------------------------

         :::::::::::::::::::::::::::::::::::::::::::::::::::::
         ::                  THERMODYNAMIC                  ::
         :::::::::::::::::::::::::::::::::::::::::::::::::::::
         :: total free energy         -11.132750661426 Eh   ::
         ::.................................................::
         :: total energy              -11.151410472269 Eh   ::
         :: zero point energy           0.019094512647 Eh   ::
         :: G(RRHO) w/o ZPVE           -0.000434701804 Eh   ::
         :: G(RRHO) contrib.            0.018659810843 Eh   ::
         :::::::::::::::::::::::::::::::::::::::::::::::::::::

optimized geometry written to: xtbopt.xyz


           -------------------------------------------------
          | TOTAL ENERGY              -11.151410472269 Eh   |
          | TOTAL ENTHALPY            -11.132189283607 Eh   |
          | TOTAL FREE ENERGY         -11.132750661426 Eh   |
          | GRADIENT NORM               0.000789924412 Eh/α |
          | HOMO-LUMO GAP               1.741002299578 eV   |
           -------------------------------------------------

------------------------------------------------------------------------
 * finished run on 2020/05/12 at 11:43:59.366     
------------------------------------------------------------------------
 total:
 * wall-time:     0 d,  0 h,  0 min,  0.215 sec
 *  cpu-time:     0 d,  0 h,  0 min,  0.214 sec
 * ratio c/w:     0.998 speedup
 SCF:
 * wall-time:     0 d,  0 h,  0 min,  0.005 sec
 *  cpu-time:     0 d,  0 h,  0 min,  0.005 sec
 * ratio c/w:     0.999 speedup
 ANC optimizer:
 * wall-time:     0 d,  0 h,  0 min,  0.099 sec
 *  cpu-time:     0 d,  0 h,  0 min,  0.099 sec
 * ratio c/w:     0.998 speedup
 numerical hessian:
 * wall-time:     0 d,  0 h,  0 min,  0.095 sec
 *  cpu-time:     0 d,  0 h,  0 min,  0.095 sec
 * ratio c/w:     0.998 speedup

