      -----------------------------------------------------------      
     |                   =====================                   |     
     |                           x T B                           |     
     |                   =====================                   |     
     |                         S. Grimme                         |     
     |          Mulliken Center for Theoretical Chemistry        |     
     |                    University of Bonn                     |     
      -----------------------------------------------------------      

   * xtb version 6.2.2 (9d81278992624c895f80dd42a50cac0aa55982e2) compiled by '@Darwin' on 04/03/2020

   xtb is free software: you can redistribute it and/or modify it under
   the terms of the GNU Lesser General Public License as published by
   the Free Software Foundation, either version 3 of the License, or
   (at your option) any later version.
   
   xtb is distributed in the hope that it will be useful,
   but WITHOUT ANY WARRANTY; without even the implied warranty of
   MERCHANTABILITY or FITNESS FOR A PARTICULAR PURPOSE.  See the
   GNU Lesser General Public License for more details.
   
   Cite this work as:
   * S. Grimme, C. Bannwarth, P. Shushkov, J. Chem. Theory Comput., 2017,
     13, 1989-2009. DOI: 10.1021/acs.jctc.7b00118
   * C. Bannwarth, S. Ehlert and S. Grimme., J. Chem. Theory Comput., 2019,
     15, 1652-1671. DOI: 10.1021/acs.jctc.8b01176
   * P. Pracht, E. Caldeweyher, S. Ehlert, S. Grimme, ChemRxiv, 2019, preprint.
     DOI: 10.26434/chemrxiv.8326202.v1
   
   for DFT-D4:
   * E. Caldeweyher, C. Bannwarth and S. Grimme, J. Chem. Phys., 2017,
     147, 034112. DOI: 10.1063/1.4993215
   * E. Caldeweyher, S. Ehlert, A. Hansen, H. Neugebauer, S. Spicher,
     C. Bannwarth and S. Grimme, J. Chem. Phys., 2019, 150, 154122.
     DOI: 10.1063/1.5090222
   
   for sTDA-xTB:
   * S. Grimme and C. Bannwarth, J. Chem. Phys., 2016, 145, 054103.
     DOI: 10.1063/1.4959605
   
   in the mass-spec context:
   * V. Asgeirsson, C. Bauer and S. Grimme, Chem. Sci., 2017, 8, 4879.
     DOI: 10.1039/c7sc00601b
   
   for metadynamics refer to:
   * S. Grimme, J. Chem. Theory Comput., 2019, 155, 2847-2862
     DOI: 10.1021/acs.jctc.9b00143
   
   with help from (in alphabetical order)
   C. Bannwarth, F. Bohle, G. Brandenburg, E. Caldeweyher, M. Checinski,
   S. Dohm, S. Ehlert, S. Ehrlich, F. März, H. Neugebauer, J. Pisarek,
   P. Pracht, P. Shushkov, and S. Spicher.
   
 * started run on 2020/05/12 at 11:45:21.086     

           -------------------------------------------------
          |                Calculation Setup                |
           -------------------------------------------------

          program call               : xtb --input H2C1N2_3_S_2.input H2C1N2_3_S_2.xyz --ohess --molden --namespace H2C1N2_3_S_2 output.out
          calculation namespace      : H2C1N2_3_S_2
          coordinate file            : H2C1N2_3_S_2.xyz
          number of atoms            :                     5
          number of electrons        :                    16
          charge                     :                     0
          spin                       :                   1.0
          first test random number   :      0.53938403814585

   ID    Z sym.   atoms
    1    7 N      1, 3
    2    6 C      2
    3    1 H      4, 5

           -------------------------------------------------
          |                 G F N 2 - x T B                 |
           -------------------------------------------------

        Reference                      10.1021/acs.jctc.8b01176
      * Hamiltonian:
        H0-scaling (s, p, d)           1.850000    2.230000    2.230000
        zeta-weighting                 0.500000
      * Dispersion:
        s8                             2.700000
        a1                             0.520000
        a2                             5.000000
        s9                             5.000000
      * Repulsion:
        kExp                           1.500000    1.000000
        rExp                           1.000000
      * Coulomb:
        alpha                          2.000000
        third order                    shell-resolved
        anisotropic                    true
        a3                             3.000000
        a5                             4.000000
        cn-shift                       1.200000
        cn-exp                         4.000000
        max-rad                        5.000000


          ...................................................
          :                      SETUP                      :
          :.................................................:
          :  # basis functions                  14          :
          :  # atomic orbitals                  14          :
          :  # shells                            8          :
          :  # electrons                        16          :
          :  max. iterations                   250          :
          :  Hamiltonian                  GFN2-xTB          :
          :  restarted?                      false          :
          :  GBSA solvation                  false          :
          :  PC potential                    false          :
          :  electronic temp.          300.0000000     K    :
          :  accuracy                    1.0000000          :
          :  -> integral cutoff          0.2500000E+02      :
          :  -> integral neglect         0.1000000E-07      :
          :  -> SCF convergence          0.1000000E-05 Eh   :
          :  -> wf. convergence          0.1000000E-03 e    :
          :  Broyden damping             0.4000000          :
          ...................................................

 iter      E             dE          RMSdq      gap      omega  full diag
   1     -8.7231689 -0.872317E+01  0.501E+00    1.01       0.0  T
   2     -8.4616842  0.261485E+00  0.765E+00    0.32       1.0  T
   3     -8.7582729 -0.296589E+00  0.284E+00    0.81       1.0  T
   4     -8.7689842 -0.107113E-01  0.903E-01    0.36       1.0  T
   5     -8.7686156  0.368581E-03  0.803E-01    0.31       1.0  T
   6     -8.7703919 -0.177622E-02  0.530E-01    0.27       1.0  T
   7     -8.7708513 -0.459497E-03  0.338E-01    0.22       1.0  T
   8     -8.7712358 -0.384413E-03  0.455E-02    0.15       1.0  T
   9     -8.7712361 -0.291287E-06  0.375E-02    0.16       1.2  T
  10     -8.7712416 -0.549839E-05  0.793E-03    0.15       5.6  T
  11     -8.7712417 -0.192607E-06  0.163E-03    0.16      27.5  T
  12     -8.7712418 -0.786044E-08  0.174E-04    0.16     256.7  T
  13     -8.7712418 -0.324860E-10  0.753E-05    0.16     593.5  T

   *** convergence criteria satisfied after 13 iterations ***

         #    Occupation            Energy/Eh            Energy/eV
      -------------------------------------------------------------
         1        2.0000           -0.6666317             -18.1400
       ...           ...                  ...                  ...
         3        2.0000           -0.5705889             -15.5265
         4        2.0000           -0.5442504             -14.8098
         5        2.0000           -0.5088802             -13.8473
         6        2.0000           -0.4831182             -13.1463
         7        2.0000           -0.4705959             -12.8056
         8        1.0000           -0.3947080             -10.7406
         9        0.9529           -0.3712423             -10.1020 (HOMO)
        10        0.0471           -0.3655298              -9.9466 (LUMO)
        11                         -0.0007631              -0.0208
        12                          0.0627615               1.7078
        13                          0.1191616               3.2426
        14                          0.1615827               4.3969
      -------------------------------------------------------------
                  HL-Gap            0.0057124 Eh            0.1554 eV
             Fermi-level           -0.4005190 Eh          -10.8987 eV

 transition dipole moment (au) for excitation:           8           9
     X       Y       Z   
  -1.1668  -0.0276   0.4653  total (au/Debye):    1.256   3.194
 dE (eV)             :    0.639
 oscillator strength :  0.34928E-01

 SCC (total)                   0 d,  0 h,  0 min,  0.004 sec
 SCC setup                      ...        0 min,  0.000 sec (  2.456%)
 Dispersion                     ...        0 min,  0.000 sec (  0.371%)
 integral evaluation            ...        0 min,  0.001 sec ( 21.965%)
 zeroth order Hamiltonian       ...        0 min,  0.000 sec (  0.425%)
 iterations                     ...        0 min,  0.001 sec ( 34.530%)
 molecular gradient             ...        0 min,  0.001 sec ( 22.026%)
 printout                       ...        0 min,  0.001 sec ( 17.923%)

         :::::::::::::::::::::::::::::::::::::::::::::::::::::
         ::                     SUMMARY                     ::
         :::::::::::::::::::::::::::::::::::::::::::::::::::::
         :: total energy              -8.724606548539 Eh    ::
         :: gradient norm              0.267667208226 Eh/a0 ::
         :: HOMO-LUMO gap              0.155443588988 eV    ::
         ::.................................................::
         :: SCC energy                -8.771241751536 Eh    ::
         :: -> isotropic ES            0.003925989406 Eh    ::
         :: -> anisotropic ES          0.000554249422 Eh    ::
         :: -> anisotropic XC          0.016154503411 Eh    ::
         :: -> dispersion             -0.001434421066 Eh    ::
         :: repulsion energy           0.046635165056 Eh    ::
         :: add. restraining           0.000000000000 Eh    ::
         :::::::::::::::::::::::::::::::::::::::::::::::::::::

      ----------------------------------------------------------- 
     |                   =====================                   |
     |                        A N C O P T                        |
     |                   =====================                   |
     |               Approximate Normal Coordinate               |
     |                Rational Function Optimizer                |
      ----------------------------------------------------------- 

          ...................................................
          :                      SETUP                      :
          :.................................................:
          :   optimization level            normal          :
          :   max. optcycles                   200          :
          :   ANC micro-cycles                  20          :
          :   degrees of freedom                 9          :
          :.................................................:
          :   RF solver                   davidson          :
          :   write xtbopt.log                true          :
          :   linear?                        false          :
          :   energy convergence         0.5000000E-05 Eh   :
          :   grad. convergence          0.1000000E-02 Eh/α :
          :   maximium RF displ.         1.0000000          :
          :   Hlow (freq-cutoff)         0.1000000E-01      :
          :   Hmax (freq-cutoff)         5.0000000          :
          :   S6 in model hess.         20.0000000          :
          ...................................................

generating ANC from model Hessian ...
Using Lindh-Hessian (1995)
 Shifting diagonal of input Hessian by    0.0000000000000000     
 Lowest  eigenvalues of input Hessian
   -0.000000   -0.000000   -0.000000    0.000000    0.000000    0.000000
    0.014174    0.039134    0.101337    0.103068    0.188027    0.558606
    0.989872    1.042594    1.285848
 Highest eigenvalues
    0.103068    0.188027    0.558606    0.989872    1.042594    1.285848


........................................................................
.............................. CYCLE    1 ..............................
........................................................................
   1     -8.7712418 -0.877124E+01  0.305E-05    0.16       0.0  T
   2     -8.7712418  0.156604E-10  0.575E-05    0.16     777.1  T
   3     -8.7712418 -0.170903E-10  0.155E-05    0.16    2880.7  T
     SCC iter.                  ...        0 min,  0.000 sec
     gradient                   ...        0 min,  0.001 sec
 * total energy  :    -8.7246065 Eh     change        0.5593588E-09 Eh
   gradient norm :     0.2676661 Eh/α   predicted     0.0000000E+00 (-100.00%)
   displ. norm   :     0.3377611 α      lambda       -0.7121737E-01
   maximum displ.:     0.2120774 α      in ANC's #2, #8, #6, ...

........................................................................
.............................. CYCLE    2 ..............................
........................................................................
   1     -8.8533741 -0.885337E+01  0.179E+00    1.02       0.0  T
   2     -8.8549100 -0.153597E-02  0.103E+00    0.87       1.0  T
   3     -8.8548174  0.926393E-04  0.564E-01    0.79       1.0  T
   4     -8.8553339 -0.516527E-03  0.174E-01    0.80       1.0  T
   5     -8.8554580 -0.124132E-03  0.525E-02    0.77       1.0  T
   6     -8.8554586 -0.559855E-06  0.437E-03    0.77      10.2  T
   7     -8.8554586 -0.115825E-07  0.146E-03    0.77      30.7  T
   8     -8.8554586 -0.192288E-08  0.412E-04    0.77     108.5  T
   9     -8.8554586 -0.122983E-09  0.569E-05    0.77     785.3  T
     SCC iter.                  ...        0 min,  0.001 sec
     gradient                   ...        0 min,  0.001 sec
 * total energy  :    -8.7816856 Eh     change       -0.5707910E-01 Eh
   gradient norm :     0.1471946 Eh/α   predicted    -0.3967101E-01 ( -30.50%)
   displ. norm   :     0.2820294 α      lambda       -0.3930226E-01
   maximum displ.:     0.1864125 α      in ANC's #8, #9, #6, ...

........................................................................
.............................. CYCLE    3 ..............................
........................................................................
   1     -8.9261547 -0.892615E+01  0.186E+00    1.28       0.0  T
   2     -8.9272944 -0.113974E-02  0.103E+00    1.18       1.0  T
   3     -8.9273964 -0.101983E-03  0.284E-01    1.12       1.0  T
   4     -8.9274294 -0.329914E-04  0.625E-02    1.10       1.0  T
   5     -8.9274329 -0.348924E-05  0.333E-02    1.09       1.3  T
   6     -8.9274340 -0.112896E-05  0.275E-03    1.09      16.3  T
   7     -8.9274340 -0.175438E-08  0.923E-04    1.09      48.4  T
   8     -8.9274340 -0.161409E-08  0.214E-04    1.09     208.9  T
     SCC iter.                  ...        0 min,  0.001 sec
     gradient                   ...        0 min,  0.001 sec
 * total energy  :    -8.7708242 Eh     change        0.1086142E-01 Eh
   gradient norm :     0.3689021 Eh/α   predicted    -0.2121419E-01 (-295.32%)
   displ. norm   :     0.2540722 α      lambda       -0.6386628E-01
   maximum displ.:     0.1945470 α      in ANC's #2, #8, #9, ...

........................................................................
.............................. CYCLE    4 ..............................
........................................................................
   1     -8.8832109 -0.888321E+01  0.137E+00    0.32       0.0  T
   2     -8.8845517 -0.134083E-02  0.718E-01    0.40       1.0  T
   3     -8.8847160 -0.164296E-03  0.461E-01    0.45       1.0  T
   4     -8.8848922 -0.176216E-03  0.115E-01    0.44       1.0  T
   5     -8.8849553 -0.630176E-04  0.369E-02    0.46       1.2  T
   6     -8.8849558 -0.513966E-06  0.447E-03    0.46      10.0  T
   7     -8.8849558 -0.118874E-07  0.817E-04    0.46      54.7  T
   8     -8.8849558 -0.265320E-09  0.297E-04    0.46     150.6  T
     SCC iter.                  ...        0 min,  0.001 sec
     gradient                   ...        0 min,  0.001 sec
 * total energy  :    -8.7936063 Eh     change       -0.2278206E-01 Eh
   gradient norm :     0.0569262 Eh/α   predicted    -0.3399451E-01 (  49.22%)
   displ. norm   :     0.0969827 α      lambda       -0.2006695E-02
   maximum displ.:     0.0785562 α      in ANC's #2, #5, #9, ...

........................................................................
.............................. CYCLE    5 ..............................
........................................................................
   1     -8.8892153 -0.888922E+01  0.279E-01    0.51       0.0  T
   2     -8.8892481 -0.327180E-04  0.156E-01    0.49       1.0  T
   3     -8.8892499 -0.184472E-05  0.530E-02    0.49       1.0  T
   4     -8.8892515 -0.158416E-05  0.135E-02    0.48       3.3  T
   5     -8.8892518 -0.355775E-06  0.669E-03    0.48       6.7  T
   6     -8.8892519 -0.497099E-07  0.932E-04    0.48      48.0  T
   7     -8.8892519 -0.496335E-09  0.169E-04    0.48     264.3  T
     SCC iter.                  ...        0 min,  0.001 sec
     gradient                   ...        0 min,  0.001 sec
 * total energy  :    -8.7948528 Eh     change       -0.1246538E-02 Eh
   gradient norm :     0.0251295 Eh/α   predicted    -0.1012784E-02 ( -18.75%)
   displ. norm   :     0.0386896 α      lambda       -0.8185602E-03
   maximum displ.:     0.0329457 α      in ANC's #6, #9, #5, ...

........................................................................
.............................. CYCLE    6 ..............................
........................................................................
   1     -8.8972647 -0.889726E+01  0.162E-01    0.54       0.0  T
   2     -8.8972760 -0.113569E-04  0.873E-02    0.53       1.0  T
   3     -8.8972770 -0.962163E-06  0.268E-02    0.52       1.7  T
   4     -8.8972773 -0.282788E-06  0.617E-03    0.52       7.2  T
   5     -8.8972773  0.250138E-08  0.180E-03    0.52      24.8  T
   6     -8.8972773 -0.104342E-07  0.672E-04    0.52      66.6  T
   7     -8.8972773 -0.678561E-09  0.147E-04    0.52     305.2  T
     SCC iter.                  ...        0 min,  0.001 sec
     gradient                   ...        0 min,  0.001 sec
 * total energy  :    -8.7952385 Eh     change       -0.3856273E-03 Eh
   gradient norm :     0.0115898 Eh/α   predicted    -0.4098921E-03 (   6.29%)
   displ. norm   :     0.0469662 α      lambda       -0.1615614E-03
   maximum displ.:     0.0415788 α      in ANC's #2, #3, #6, ...

........................................................................
.............................. CYCLE    7 ..............................
........................................................................
   1     -8.8964650 -0.889647E+01  0.171E-01    0.47       0.0  T
   2     -8.8964732 -0.818490E-05  0.842E-02    0.46       1.0  T
   3     -8.8964726  0.622569E-06  0.381E-02    0.47       1.2  T
   4     -8.8964754 -0.276321E-05  0.109E-02    0.46       4.1  T
   5     -8.8964755 -0.130500E-06  0.355E-03    0.46      12.6  T
   6     -8.8964755 -0.902822E-08  0.143E-03    0.46      31.4  T
   7     -8.8964755 -0.779025E-09  0.848E-05    0.46     527.4  T
   8     -8.8964755 -0.149214E-11  0.189E-05    0.46    2369.5  T
     SCC iter.                  ...        0 min,  0.001 sec
     gradient                   ...        0 min,  0.001 sec
 * total energy  :    -8.7953532 Eh     change       -0.1147332E-03 Eh
   gradient norm :     0.0073547 Eh/α   predicted    -0.8095946E-04 ( -29.44%)
   displ. norm   :     0.1743831 α      lambda       -0.3563219E-03
   maximum displ.:     0.1408511 α      in ANC's #1, #2, #3, ...

........................................................................
.............................. CYCLE    8 ..............................
........................................................................
   1     -8.8926489 -0.889265E+01  0.142E+00    0.49       0.0  T
   2     -8.8935102 -0.861291E-03  0.522E-01    0.54       1.0  T
   3     -8.8937235 -0.213296E-03  0.432E-01    0.46       1.0  T
   4     -8.8943408 -0.617320E-03  0.998E-02    0.49       1.0  T
   5     -8.8943492 -0.840980E-05  0.449E-02    0.49       1.0  T
   6     -8.8943515 -0.222749E-05  0.812E-03    0.48       5.5  T
   7     -8.8943515 -0.878419E-08  0.301E-03    0.48      14.8  T
   8     -8.8943515 -0.242202E-08  0.278E-04    0.48     160.6  T
   9     -8.8943515 -0.163709E-10  0.963E-05    0.48     464.6  T
     SCC iter.                  ...        0 min,  0.001 sec
     gradient                   ...        0 min,  0.001 sec
 * total energy  :    -8.7965797 Eh     change       -0.1226523E-02 Eh
   gradient norm :     0.0249629 Eh/α   predicted    -0.1835803E-03 ( -85.03%)
   displ. norm   :     0.6157880 α      lambda       -0.8396414E-02
   maximum displ.:     0.5435394 α      in ANC's #1, #2, #4, ...

........................................................................
.............................. CYCLE    9 ..............................
........................................................................
   1     -8.8436681 -0.884367E+01  0.348E+00    1.39       0.0  T
   2     -8.8281358  0.155324E-01  0.282E+00    1.09       1.0  T
   3     -8.8596305 -0.314947E-01  0.159E+00    1.29       1.0  T
   4     -8.8671688 -0.753834E-02  0.403E-01    1.18       1.0  T
   5     -8.8675391 -0.370255E-03  0.121E-01    1.19       1.0  T
   6     -8.8675421 -0.305396E-05  0.247E-02    1.19       1.8  T
   7     -8.8675422 -0.121201E-06  0.929E-03    1.19       4.8  T
   8     -8.8675423 -0.145632E-07  0.161E-03    1.19      27.7  T
   9     -8.8675423 -0.424129E-08  0.525E-04    1.19      85.2  T
  10     -8.8675423 -0.639151E-10  0.947E-05    1.19     472.2  T
     SCC iter.                  ...        0 min,  0.001 sec
     gradient                   ...        0 min,  0.001 sec
 * total energy  :    -8.7959498 Eh     change        0.6298623E-03 Eh
   gradient norm :     0.1533849 Eh/α   predicted    -0.5790150E-02 (*******%)
   displ. norm   :     0.2904147 α      lambda       -0.1819003E-01
   maximum displ.:     0.2378018 α      in ANC's #1, #2, #3, ...

........................................................................
.............................. CYCLE   10 ..............................
........................................................................
   1     -8.8950441 -0.889504E+01  0.129E+00    1.03       0.0  T
   2     -8.8955201 -0.475954E-03  0.729E-01    1.00       1.0  T
   3     -8.8957760 -0.255932E-03  0.608E-01    0.98       1.0  T
   4     -8.8969314 -0.115536E-02  0.152E-01    0.97       1.0  T
   5     -8.8969846 -0.532832E-04  0.386E-02    0.96       1.2  T
   6     -8.8969848 -0.204335E-06  0.649E-03    0.96       6.9  T
   7     -8.8969849 -0.567758E-07  0.109E-03    0.96      40.9  T
   8     -8.8969849 -0.316760E-09  0.333E-04    0.96     134.4  T
   9     -8.8969849 -0.969891E-11  0.316E-05    0.96    1413.2  T
     SCC iter.                  ...        0 min,  0.001 sec
     gradient                   ...        0 min,  0.001 sec
 * total energy  :    -8.8049054 Eh     change       -0.8955545E-02 Eh
   gradient norm :     0.0522570 Eh/α   predicted    -0.9862092E-02 (  10.12%)
   displ. norm   :     0.2035290 α      lambda       -0.6941658E-02
   maximum displ.:     0.1370313 α      in ANC's #1, #6, #4, ...

........................................................................
.............................. CYCLE   11 ..............................
........................................................................
   1     -8.9046974 -0.890470E+01  0.123E+00    1.32       0.0  T
   2     -8.9040745  0.622840E-03  0.813E-01    1.22       1.0  T
   3     -8.9061399 -0.206538E-02  0.540E-01    1.30       1.0  T
   4     -8.9070145 -0.874625E-03  0.451E-02    1.27       1.0  T
   5     -8.9070153 -0.768144E-06  0.194E-02    1.27       2.3  T
   6     -8.9070155 -0.220604E-06  0.425E-03    1.27      10.5  T
   7     -8.9070155 -0.436743E-08  0.141E-03    1.27      31.8  T
   8     -8.9070155 -0.254472E-09  0.217E-04    1.27     205.8  T
   9     -8.9070155 -0.125322E-10  0.419E-05    1.27    1067.8  T
     SCC iter.                  ...        0 min,  0.001 sec
     gradient                   ...        0 min,  0.001 sec
 * total energy  :    -8.8106272 Eh     change       -0.5721807E-02 Eh
   gradient norm :     0.0463308 Eh/α   predicted    -0.3614605E-02 ( -36.83%)
   displ. norm   :     0.5269373 α      lambda       -0.1261754E-01
   maximum displ.:     0.3480370 α      in ANC's #1, #2, #6, ...

........................................................................
.............................. CYCLE   12 ..............................
........................................................................
   1     -8.9054753 -0.890548E+01  0.214E+00    2.17       0.0  T
   2     -8.9060257 -0.550369E-03  0.128E+00    1.85       1.0  T
   3     -8.9089838 -0.295817E-02  0.910E-01    2.10       1.0  T
   4     -8.9112722 -0.228832E-02  0.905E-02    1.99       1.0  T
   5     -8.9112764 -0.424740E-05  0.465E-02    1.99       1.0  T
   6     -8.9112769 -0.533754E-06  0.546E-03    1.99       8.2  T
   7     -8.9112770 -0.306931E-07  0.136E-03    1.99      32.8  T
   8     -8.9112770 -0.764741E-09  0.396E-04    1.99     112.9  T
   9     -8.9112770 -0.271569E-10  0.590E-05    1.99     757.6  T
     SCC iter.                  ...        0 min,  0.001 sec
     gradient                   ...        0 min,  0.001 sec
 * total energy  :    -8.8137473 Eh     change       -0.3120049E-02 Eh
   gradient norm :     0.1126236 Eh/α   predicted    -0.8060475E-02 ( 158.34%)
   displ. norm   :     0.1576735 α      lambda       -0.7862277E-02
   maximum displ.:     0.1123986 α      in ANC's #1, #2, #6, ...

........................................................................
.............................. CYCLE   13 ..............................
........................................................................
   1     -8.9206232 -0.892062E+01  0.825E-01    1.68       0.0  T
   2     -8.9207233 -0.100074E-03  0.469E-01    1.75       1.0  T
   3     -8.9211813 -0.457997E-03  0.352E-01    1.68       1.0  T
   4     -8.9215137 -0.332393E-03  0.500E-02    1.70       1.0  T
   5     -8.9215160 -0.229935E-05  0.181E-02    1.70       2.5  T
   6     -8.9215160 -0.546345E-07  0.204E-03    1.70      21.9  T
   7     -8.9215160 -0.162276E-08  0.568E-04    1.70      78.8  T
   8     -8.9215160 -0.815632E-10  0.190E-04    1.70     235.6  T
     SCC iter.                  ...        0 min,  0.001 sec
     gradient                   ...        0 min,  0.001 sec
 * total energy  :    -8.8177987 Eh     change       -0.4051415E-02 Eh
   gradient norm :     0.0331759 Eh/α   predicted    -0.4028869E-02 (  -0.56%)
   displ. norm   :     0.1174023 α      lambda       -0.2020407E-02
   maximum displ.:     0.0557386 α      in ANC's #2, #9, #1, ...

........................................................................
.............................. CYCLE   14 ..............................
........................................................................
   1     -8.9221992 -0.892220E+01  0.456E-01    1.76       0.0  T
   2     -8.9222486 -0.494649E-04  0.228E-01    1.75       1.0  T
   3     -8.9222172  0.314314E-04  0.107E-01    1.77       1.0  T
   4     -8.9222697 -0.525387E-04  0.186E-02    1.75       2.4  T
   5     -8.9222708 -0.102205E-05  0.821E-03    1.75       5.4  T
   6     -8.9222708 -0.393728E-07  0.201E-03    1.75      22.3  T
   7     -8.9222708 -0.311609E-08  0.180E-04    1.75     248.8  T
   8     -8.9222708 -0.257412E-10  0.936E-05    1.75     477.9  T
     SCC iter.                  ...        0 min,  0.001 sec
     gradient                   ...        0 min,  0.001 sec
 * total energy  :    -8.8194197 Eh     change       -0.1621029E-02 Eh
   gradient norm :     0.0224909 Eh/α   predicted    -0.1024128E-02 ( -36.82%)
   displ. norm   :     0.2556538 α      lambda       -0.3146348E-02
   maximum displ.:     0.1421896 α      in ANC's #1, #9, #6, ...

........................................................................
.............................. CYCLE   15 ..............................
........................................................................
   1     -8.9228138 -0.892281E+01  0.971E-01    1.91       0.0  T
   2     -8.9230255 -0.211711E-03  0.497E-01    1.86       1.0  T
   3     -8.9227550  0.270566E-03  0.300E-01    1.92       1.0  T
   4     -8.9231805 -0.425509E-03  0.298E-02    1.88       1.5  T
   5     -8.9231809 -0.429870E-06  0.110E-02    1.88       4.1  T
   6     -8.9231810 -0.726527E-07  0.422E-03    1.88      10.6  T
   7     -8.9231810 -0.865050E-08  0.799E-04    1.88      56.0  T
   8     -8.9231810 -0.182815E-08  0.162E-04    1.88     276.4  T
     SCC iter.                  ...        0 min,  0.001 sec
     gradient                   ...        0 min,  0.001 sec
 * total energy  :    -8.8213166 Eh     change       -0.1896942E-02 Eh
   gradient norm :     0.0133532 Eh/α   predicted    -0.1675997E-02 ( -11.65%)
   displ. norm   :     0.1037427 α      lambda       -0.6522838E-03
   maximum displ.:     0.0546341 α      in ANC's #1, #8, #9, ...

........................................................................
.............................. CYCLE   16 ..............................
........................................................................
   1     -8.9249293 -0.892493E+01  0.432E-01    1.92       0.0  T
   2     -8.9249679 -0.385447E-04  0.219E-01    1.91       1.0  T
   3     -8.9249610  0.685091E-05  0.643E-02    1.92       1.0  T
   4     -8.9249818 -0.208317E-04  0.152E-02    1.91       2.9  T
   5     -8.9249822 -0.354114E-06  0.368E-03    1.91      12.2  T
   6     -8.9249822 -0.885438E-08  0.160E-03    1.91      27.9  T
   7     -8.9249822 -0.434973E-09  0.184E-04    1.91     242.9  T
   8     -8.9249822 -0.185842E-10  0.899E-05    1.91     497.5  T
     SCC iter.                  ...        0 min,  0.001 sec
     gradient                   ...        0 min,  0.001 sec
 * total energy  :    -8.8216963 Eh     change       -0.3796575E-03 Eh
   gradient norm :     0.0115142 Eh/α   predicted    -0.3296517E-03 ( -13.17%)
   displ. norm   :     0.0623701 α      lambda       -0.3147550E-03
   maximum displ.:     0.0345428 α      in ANC's #9, #8, #6, ...

........................................................................
.............................. CYCLE   17 ..............................
........................................................................
   1     -8.9269375 -0.892694E+01  0.279E-01    1.94       0.0  T
   2     -8.9269645 -0.269339E-04  0.136E-01    1.94       1.0  T
   3     -8.9269686 -0.411229E-05  0.326E-02    1.94       1.4  T
   4     -8.9269696 -0.107730E-05  0.815E-03    1.94       5.5  T
   5     -8.9269696  0.236564E-07  0.435E-03    1.94      10.3  T
   6     -8.9269697 -0.690554E-07  0.124E-03    1.94      36.1  T
   7     -8.9269697 -0.231172E-09  0.885E-05    1.94     505.5  T
   8     -8.9269697 -0.693845E-11  0.363E-05    1.94    1232.3  T
     SCC iter.                  ...        0 min,  0.001 sec
     gradient                   ...        0 min,  0.001 sec
 * total energy  :    -8.8218142 Eh     change       -0.1179528E-03 Eh
   gradient norm :     0.0081587 Eh/α   predicted    -0.1579895E-03 (  33.94%)
   displ. norm   :     0.0562654 α      lambda       -0.1284395E-03
   maximum displ.:     0.0275225 α      in ANC's #2, #8, #9, ...

........................................................................
.............................. CYCLE   18 ..............................
........................................................................
   1     -8.9243939 -0.892439E+01  0.243E-01    1.93       0.0  T
   2     -8.9244108 -0.168942E-04  0.120E-01    1.93       1.0  T
   3     -8.9244136 -0.283565E-05  0.231E-02    1.93       1.9  T
   4     -8.9244144 -0.820474E-06  0.797E-03    1.93       5.6  T
   5     -8.9244145 -0.715611E-07  0.481E-03    1.93       9.3  T
   6     -8.9244146 -0.820187E-07  0.969E-04    1.93      46.2  T
   7     -8.9244146 -0.112978E-09  0.673E-05    1.93     664.7  T
     SCC iter.                  ...        0 min,  0.000 sec
     gradient                   ...        0 min,  0.001 sec
 * total energy  :    -8.8218402 Eh     change       -0.2591763E-04 Eh
   gradient norm :     0.0057695 Eh/α   predicted    -0.6442277E-04 ( 148.57%)
   displ. norm   :     0.0271552 α      lambda       -0.6811482E-04
   maximum displ.:     0.0131261 α      in ANC's #2, #1, #6, ...

........................................................................
.............................. CYCLE   19 ..............................
........................................................................
   1     -8.9259616 -0.892596E+01  0.104E-01    1.93       0.0  T
   2     -8.9259643 -0.271494E-05  0.513E-02    1.93       1.0  T
   3     -8.9259647 -0.382497E-06  0.107E-02    1.92       4.2  T
   4     -8.9259649 -0.240690E-06  0.486E-03    1.93       9.2  T
   5     -8.9259650 -0.639929E-07  0.208E-03    1.92      21.5  T
   6     -8.9259650 -0.794268E-08  0.579E-04    1.92      77.2  T
   7     -8.9259650 -0.640377E-10  0.397E-05    1.92    1125.3  T
     SCC iter.                  ...        0 min,  0.001 sec
     gradient                   ...        0 min,  0.001 sec
 * total energy  :    -8.8218778 Eh     change       -0.3761093E-04 Eh
   gradient norm :     0.0027888 Eh/α   predicted    -0.3408164E-04 (  -9.38%)
   displ. norm   :     0.0121142 α      lambda       -0.1774710E-04
   maximum displ.:     0.0093619 α      in ANC's #1, #3, #5, ...

........................................................................
.............................. CYCLE   20 ..............................
........................................................................
   1     -8.9261960 -0.892620E+01  0.394E-02    1.92       0.0  T
   2     -8.9261963 -0.272347E-06  0.207E-02    1.92       2.2  T
   3     -8.9261963 -0.245517E-07  0.437E-03    1.92      10.2  T
   4     -8.9261964 -0.726378E-07  0.148E-03    1.92      30.2  T
   5     -8.9261964 -0.103292E-08  0.287E-04    1.92     156.0  T
   6     -8.9261964 -0.191829E-10  0.433E-05    1.92    1032.9  T
     SCC iter.                  ...        0 min,  0.000 sec
     gradient                   ...        0 min,  0.001 sec
 * total energy  :    -8.8218922 Eh     change       -0.1445714E-04 Eh
   gradient norm :     0.0022027 Eh/α   predicted    -0.8874986E-05 ( -38.61%)
   displ. norm   :     0.0263874 α      lambda       -0.2933047E-04
   maximum displ.:     0.0165005 α      in ANC's #1, #5, #2, ...
 * RMSD in coord.:     0.9438527 α      energy gain  -0.9728568E-01 Eh

generating ANC from model Hessian ...
Using Lindh-Hessian (1995)
 Shifting diagonal of input Hessian by    0.0000000000000000     
 Lowest  eigenvalues of input Hessian
   -0.000000   -0.000000   -0.000000    0.000000    0.000000    0.000000
    0.040670    0.103042    0.144791    0.176286    0.347849    0.564131
    1.273526    1.558513    2.363668
 Highest eigenvalues
    0.176286    0.347849    0.564131    1.273526    1.558513    2.363668


........................................................................
.............................. CYCLE   21 ..............................
........................................................................
   1     -8.9262539 -0.892625E+01  0.104E-01    1.92       0.0  T
   2     -8.9262558 -0.192539E-05  0.544E-02    1.92       1.0  T
   3     -8.9262561 -0.316965E-06  0.963E-03    1.92       4.6  T
   4     -8.9262564 -0.326343E-06  0.357E-03    1.92      12.5  T
   5     -8.9262565 -0.192692E-07  0.193E-03    1.92      23.1  T
   6     -8.9262565 -0.332554E-08  0.131E-04    1.92     341.6  T
   7     -8.9262565 -0.371081E-11  0.288E-05    1.92    1553.7  T
     SCC iter.                  ...        0 min,  0.001 sec
     gradient                   ...        0 min,  0.001 sec
 * total energy  :    -8.8219079 Eh     change       -0.1562617E-04 Eh
   gradient norm :     0.0006486 Eh/α   predicted     0.0000000E+00 (-100.00%)
   displ. norm   :     0.0023982 α      lambda       -0.5699667E-06
   maximum displ.:     0.0014572 α      in ANC's #1, #3, #5, ...

........................................................................
.............................. CYCLE   22 ..............................
........................................................................
   1     -8.9260369 -0.892604E+01  0.654E-03    1.91       0.0  T
   2     -8.9260370 -0.115274E-07  0.346E-03    1.91      12.9  T
   3     -8.9260370  0.981085E-09  0.137E-03    1.92      32.6  T
   4     -8.9260370 -0.226571E-08  0.449E-04    1.92      99.6  T
   5     -8.9260370 -0.828296E-09  0.189E-04    1.92     237.0  T
     SCC iter.                  ...        0 min,  0.000 sec
     gradient                   ...        0 min,  0.001 sec
 * total energy  :    -8.8219081 Eh     change       -0.2881712E-06 Eh
   gradient norm :     0.0002099 Eh/α   predicted    -0.2873476E-06 (  -0.29%)
   displ. norm   :     0.0021911 α      lambda       -0.1526553E-06
   maximum displ.:     0.0021670 α      in ANC's #1, #2, #5, ...

   *** GEOMETRY OPTIMIZATION CONVERGED AFTER 22 ITERATIONS ***

------------------------------------------------------------------------
 total energy gain   :        -0.0973016 Eh      -61.0577 kcal/mol
 total RMSD          :         0.9438055 a0        0.4994 Å
 total power (kW/mol):       -11.6120597 (step)-5047.1468 (real)
------------------------------------------------------------------------

 ANCopt (total)                0 d,  0 h,  0 min,  0.051 sec
 optimizer setup                ...        0 min,  0.000 sec (  0.146%)
 model hessian                  ...        0 min,  0.000 sec (  0.347%)
 ANC generation                 ...        0 min,  0.000 sec (  0.220%)
 coordinate transformation      ...        0 min,  0.000 sec (  0.112%)
 single point calculation       ...        0 min,  0.048 sec ( 95.280%)
 optimization log               ...        0 min,  0.001 sec (  1.283%)
 hessian update                 ...        0 min,  0.000 sec (  0.103%)
 rational function              ...        0 min,  0.001 sec (  1.061%)

================
 final structure:
================
5
 xtb: 6.2.2 (9d81278992624c895f80dd42a50cac0aa55982e2)
N         0.68941095528265   -0.48496074600945   -0.09544580894475
C        -0.49719832204135    0.05365921029164   -0.02153714456020
N         1.81319652156748   -0.08950180380607    0.11324472715722
H        -1.34190552732018   -0.56405533022976   -0.27960485309431
H        -0.66350262748859    1.08485866975364    0.28334307944204

 Bond Distances (Angstroems)
 ---------------------------
N1-C2=1.3052         N1-N3=1.2095         C2-N1=1.3052         C2-H4=1.0778         C2-H5=1.0881         N3-N1=1.2095         
H4-C2=1.0778         H5-C2=1.0881         
 C  H  Rav=1.0830 sigma=0.0051  Rmin=1.0778  Rmax=1.0881     2
 N  C  Rav=1.3052 sigma=0.0000  Rmin=1.3052  Rmax=1.3052     1
 N  N  Rav=1.2095 sigma=0.0000  Rmin=1.2095  Rmax=1.2095     1

 selected bond angles (degree)
 --------------------
N3-N1-C2=134.43                H4-C2-N1=117.54                H5-C2-N1=123.09                H5-C2-H4=119.37                

 selected dihedral angles (degree)
 ---------------------------------
H4-C2-N1-N3=179.85            H5-C2-N1-N3=359.98            
           -------------------------------------------------
          |                Final Singlepoint                |
           -------------------------------------------------

          ...................................................
          :                      SETUP                      :
          :.................................................:
          :  # basis functions                  14          :
          :  # atomic orbitals                  14          :
          :  # shells                            8          :
          :  # electrons                        16          :
          :  max. iterations                   250          :
          :  Hamiltonian                  GFN2-xTB          :
          :  restarted?                      false          :
          :  GBSA solvation                  false          :
          :  PC potential                    false          :
          :  electronic temp.          300.0000000     K    :
          :  accuracy                    1.0000000          :
          :  -> integral cutoff          0.2500000E+02      :
          :  -> integral neglect         0.1000000E-07      :
          :  -> SCF convergence          0.1000000E-05 Eh   :
          :  -> wf. convergence          0.1000000E-03 e    :
          :  Broyden damping             0.4000000          :
          ...................................................

 iter      E             dE          RMSdq      gap      omega  full diag
   1     -8.9260370 -0.892604E+01  0.641E-05    1.92       0.0  T
   2     -8.9260370 -0.143530E-11  0.303E-05    1.92    1473.6  T
   3     -8.9260370 -0.152767E-12  0.939E-06    1.92    4764.5  T

   *** convergence criteria satisfied after 3 iterations ***

         #    Occupation            Energy/Eh            Energy/eV
      -------------------------------------------------------------
         1        2.0000           -0.6902837             -18.7836
       ...           ...                  ...                  ...
         3        2.0000           -0.5775661             -15.7164
         4        2.0000           -0.5540349             -15.0761
         5        2.0000           -0.5491152             -14.9422
         6        2.0000           -0.4894893             -13.3197
         7        2.0000           -0.4391783             -11.9506
         8        1.0000           -0.3985459             -10.8450
         9        1.0000           -0.3119231              -8.4879 (HOMO)
        10                         -0.2415446              -6.5728 (LUMO)
        11                          0.0894317               2.4336
        12                          0.1964963               5.3469
        13                          0.2819925               7.6734
        14                          0.5910622              16.0836
      -------------------------------------------------------------
                  HL-Gap            0.0703785 Eh            1.9151 eV
             Fermi-level           -0.3477979 Eh           -9.4641 eV

 transition dipole moment (au) for excitation:           8           9
     X       Y       Z   
   0.0049   0.0142  -0.0462  total (au/Debye):    0.049   0.124
 dE (eV)             :    2.357
 oscillator strength :  0.19290E-03

 SCC (total)                   0 d,  0 h,  0 min,  0.003 sec
 SCC setup                      ...        0 min,  0.000 sec (  2.206%)
 Dispersion                     ...        0 min,  0.000 sec (  0.385%)
 integral evaluation            ...        0 min,  0.001 sec ( 29.813%)
 zeroth order Hamiltonian       ...        0 min,  0.000 sec (  0.432%)
 iterations                     ...        0 min,  0.000 sec ( 11.584%)
 molecular gradient             ...        0 min,  0.001 sec ( 29.672%)
 printout                       ...        0 min,  0.001 sec ( 25.561%)

         :::::::::::::::::::::::::::::::::::::::::::::::::::::
         ::                     SUMMARY                     ::
         :::::::::::::::::::::::::::::::::::::::::::::::::::::
         :: total energy              -8.821908146726 Eh    ::
         :: gradient norm              0.000209444532 Eh/a0 ::
         :: HOMO-LUMO gap              1.915095967468 eV    ::
         ::.................................................::
         :: SCC energy                -8.926036960871 Eh    ::
         :: -> isotropic ES            0.007381373757 Eh    ::
         :: -> anisotropic ES          0.000607671223 Eh    ::
         :: -> anisotropic XC          0.016253110799 Eh    ::
         :: -> dispersion             -0.001428510557 Eh    ::
         :: repulsion energy           0.104128799690 Eh    ::
         :: add. restraining           0.000000000000 Eh    ::
         :::::::::::::::::::::::::::::::::::::::::::::::::::::

           ------------------------------------------------- 
          |                Numerical Hessian                |
           ------------------------------------------------- 
step length          :   0.00500
SCC accuracy         :   0.30000
Hessian scale factor :   1.00000
frozen atoms in %    :   0.00000    0
RMS gradient         :   0.00021
estimated CPU  time      0.00 min
estimated wall time      0.00 min

writing file <hessian>.

 projected vibrational frequencies (cm-1)
eigval :       -0.00    -0.00    -0.00     0.00     0.00     0.00
eigval :      355.90   426.24   811.29  1057.44  1247.41  1386.87
eigval :     1648.80  2941.77  3099.72
           -------------------------------------------------
          |                Property Printout                |
           -------------------------------------------------

    * Orbital Energies and Occupations

         #    Occupation            Energy/Eh            Energy/eV
      -------------------------------------------------------------
         1        2.0000           -0.6902837             -18.7836
         2        2.0000           -0.6532727             -17.7765
         3        2.0000           -0.5775661             -15.7164
         4        2.0000           -0.5540349             -15.0761
         5        2.0000           -0.5491152             -14.9422
         6        2.0000           -0.4894893             -13.3197
         7        2.0000           -0.4391783             -11.9507
         8        1.0000           -0.3985459             -10.8450
         9        1.0000           -0.3119231              -8.4879 (HOMO)
        10                         -0.2415446              -6.5728 (LUMO)
        11                          0.0894317               2.4336
        12                          0.1964963               5.3469
        13                          0.2819925               7.6734
        14                          0.5910622              16.0836
      -------------------------------------------------------------
                  HL-Gap            0.0703785 Eh            1.9151 eV
             Fermi-level           -0.3477980 Eh           -9.4641 eV

     #   Z        covCN         q      C6AA      α(0)
     1   7 N      1.891     0.045    21.121     6.813
     2   6 C      2.780     0.004    27.923     8.655
     3   7 N      1.000    -0.200    24.866     7.164
     4   1 H      0.926     0.079     1.991     2.206
     5   1 H      0.925     0.073     2.057     2.243

 Mol. C6AA /au·bohr⁶  :        312.802247
 Mol. C8AA /au·bohr⁸  :       6922.598530
 Mol. α(0) /au        :         27.081079


Wiberg/Mayer (AO) data.
largest (>0.10) Wiberg bond orders for each atom
          total WBO             WBO to atom ...
     1  N   3.209        N    3 1.764    C    2 1.433
     2  C   3.375        N    1 1.433    H    4 0.969    H    5 0.945
     3  N   1.815        N    1 1.764
     4  H   0.991        C    2 0.969
     5  H   0.961        C    2 0.945

MOs/occ written to file <molden.input>


molecular dipole:
                 x           y           z       tot (Debye)
 q only:       -0.922       0.058      -0.054
   full:       -1.297       0.181      -0.045       3.332
molecular quadrupole (traceless):
                xx          xy          yy          xz          yz          zz
 q only:       -1.883       0.133       1.235      -0.151       0.208       0.647
  q+dip:       -3.482       0.443       2.471      -0.197       0.532       1.012
   full:       -4.222       0.361       2.068      -0.383      -0.007       2.154

           -------------------------------------------------
          |                Geometry Summary                 |
           -------------------------------------------------

      molecular mass/u    :       42.0400238
   center of mass at/Å    :        0.6436769      -0.1635832      -0.0001353
  moments of inertia/u·Å² :        0.3961683E+01   0.4085044E+02   0.4481211E+02
rotational constants/cm⁻¹ :        0.4255170E+01   0.4126671E+00   0.3761848E+00

 * 4 selected distances

     #   Z        #   Z                                     value/Å
     1   7 N      2   6 C                                 1.3052262 (max)
     1   7 N      3   7 N                                 1.2094765
     2   6 C      4   1 H                                 1.0778221 (min)
     2   6 C      5   1 H                                 1.0881091

 * 3 distinct bonds (by element types)

   Z      Z             #   av. dist./Å        max./Å        min./Å
   1 H    6 C           2     1.0829656     1.0881091     1.0778221
   6 C    7 N           1     1.3052262     1.3052262     1.3052262
   7 N    7 N           1     1.2094765     1.2094765     1.2094765

           -------------------------------------------------
          |               Frequency Printout                |
           -------------------------------------------------
 projected vibrational frequencies (cm-1)
eigval :       -0.00    -0.00    -0.00     0.00     0.00     0.00
eigval :      355.90   426.24   811.29  1057.44  1247.41  1386.87
eigval :     1648.80  2941.77  3099.72
 reduced masses (amu)
   1: 10.32   2: 11.48   3: 13.22   4: 13.44   5: 12.88   6:  7.58   7:  5.57   8: 10.83
Molecule has the following symmetry elements: (sigma) 
It seems to be the Cs point group
   9:  4.25  10:  4.91  11:  9.23  12:  4.96  13: 13.93  14:  1.67  15:  1.84
 IR intensities (amu)
   1:  0.32   2:  0.27   3:  0.10   4:  0.23   5:  0.05   6:  0.06   7:  0.13   8:  0.26
   9:  0.18  10:  0.23  11:  0.27  12:  0.16  13:  0.57  14:  0.22  15:  0.11
 Raman intensities (amu)
   1:  0.00   2:  0.00   3:  0.00   4:  0.00   5:  0.00   6:  0.00   7:  0.00   8:  0.00
   9:  0.00  10:  0.00  11:  0.00  12:  0.00  13:  0.00  14:  0.00  15:  0.00
 output can be read by thermo (or use thermo option).
 writing <g98.out> molden fake output.
 recommended (thermochemical) frequency scaling factor: 1.0
           -------------------------------------------------
          |             Thermodynamic Functions             |
           -------------------------------------------------

cs  symmetry found (for desy threshold:  0.10E+00) used in thermo

          ...................................................
          :                      SETUP                      :
          :.................................................:
          :  # frequencies                           9      :
          :  # imaginary freq.                       0      :
          :  linear?                             false      :
          :  only rotor calc.                    false      :
          :  symmetry                               cs      :
          :  rotational number                       1      :
          :  scaling factor                  1.0000000      :
          :  rotor cutoff                   50.0000000 cm⁻¹ :
          :  imag. cutoff                  -20.0000000 cm⁻¹ :
          :.................................................:

    mode    ω/cm⁻¹     T·S(HO)/kcal·mol⁻¹    T·S(FR)/kcal·mol⁻¹   T·S(vib)
   ------------------------------------------------------------------------
   ------------------------------------------------------------------------

   temp. (K)  partition function   enthalpy   heat capacity  entropy
                                   cal/mol     cal/K/mol   cal/K/mol   J/K/mol
 298.15  VIB   1.44                  482.263      4.258      2.343
         ROT  0.651E+04              888.752      2.981     20.430
         INT  0.937E+04             1371.015      7.239     22.773
         TR   0.264E+27             1481.254      4.968     37.118
         TOT                        2852.2690    12.2072    59.8910   250.5839

   temp. (K)  partition function   enthalpy   heat capacity  entropy
                                   cal/mol     cal/K/mol   cal/K/mol   J/K/mol
 120.00  VIB   1.02                   22.016      0.851      0.224
         ROT  0.166E+04              357.707      2.981     17.717
         INT  0.170E+04              379.723      3.832     17.941
         TR   0.673E+26              596.178      4.968     32.599
         TOT                         975.9013     8.8002    50.5397   211.4581

   temp. (K)  partition function   enthalpy   heat capacity  entropy
                                   cal/mol     cal/K/mol   cal/K/mol   J/K/mol
 100.00  VIB   1.01                    8.786      0.480      0.104
         ROT  0.126E+04              298.089      2.981     17.173
         INT  0.127E+04              306.875      3.461     17.278
         TR   0.512E+26              496.815      4.968     31.693
         TOT                         803.6897     8.4294    48.9712   204.8955

   temp. (K)  partition function   enthalpy   heat capacity  entropy
                                   cal/mol     cal/K/mol   cal/K/mol   J/K/mol
  80.00  VIB   1.00                    2.265      0.191      0.033
         ROT   904.                  238.471      2.981     16.508
         INT   906.                  240.736      3.171     16.541
         TR   0.367E+26              397.452      4.968     30.585
         TOT                         638.1878     8.1396    47.1263   197.1764

   temp. (K)  partition function   enthalpy   heat capacity  entropy
                                   cal/mol     cal/K/mol   cal/K/mol   J/K/mol
  60.00  VIB   1.00                    0.244      0.036      0.004
         ROT   587.                  178.853      2.981     15.651
         INT   587.                  179.098      3.017     15.655
         TR   0.238E+26              298.089      4.968     29.157
         TOT                         477.1868     7.9851    44.8120   187.4935

   temp. (K)  partition function   enthalpy   heat capacity  entropy
                                   cal/mol     cal/K/mol   cal/K/mol   J/K/mol
  40.00  VIB   1.00                    0.003      0.001     -0.000
         ROT   320.                  119.236      2.981     14.442
         INT   320.                  119.239      2.982     14.442
         TR   0.130E+26              198.726      4.968     27.143
         TOT                         317.9647     7.9500    41.5853   173.9927

   temp. (K)  partition function   enthalpy   heat capacity  entropy
                                   cal/mol     cal/K/mol   cal/K/mol   J/K/mol
  20.00  VIB   1.00                    0.000      0.000     -0.001
         ROT   113.                   59.618      2.981     12.376
         INT   113.                   59.618      2.981     12.375
         TR   0.458E+25               99.363      4.968     23.701
         TOT                         158.9808     7.9490    36.0766   150.9445

   temp. (K)  partition function   enthalpy   heat capacity  entropy
                                   cal/mol     cal/K/mol   cal/K/mol   J/K/mol
  10.00  VIB   1.00                    0.000      0.000     -0.001
         ROT   40.0                   29.809      2.981     10.310
         INT   40.0                   29.809      2.981     10.309
         TR   0.162E+25               49.681      4.968     20.259
         TOT                          79.4904     7.9490    30.5680   127.8965

       T/K    H(0)-H(T)+PV         H(T)/Eh          T*S/Eh         G(T)/Eh
   ------------------------------------------------------------------------
    298.15    0.454538E-02    0.341056E-01    0.284561E-01    0.564950E-02
    120.00    0.155520E-02    0.311155E-01    0.966482E-02    0.214506E-01
    100.00    0.128076E-02    0.308410E-01    0.780406E-02    0.230370E-01
     80.00    0.101702E-02    0.305773E-01    0.600804E-02    0.245692E-01
     60.00    0.760446E-03    0.303207E-01    0.428475E-02    0.260359E-01
     40.00    0.506709E-03    0.300670E-01    0.265081E-02    0.274161E-01
     20.00    0.253352E-03    0.298136E-01    0.114983E-02    0.286638E-01
     10.00    0.126676E-03    0.296869E-01    0.487132E-03    0.291998E-01 (used)
   ------------------------------------------------------------------------

         :::::::::::::::::::::::::::::::::::::::::::::::::::::
         ::                  THERMODYNAMIC                  ::
         :::::::::::::::::::::::::::::::::::::::::::::::::::::
         :: total free energy          -8.792708349655 Eh   ::
         ::.................................................::
         :: total energy               -8.821908146721 Eh   ::
         :: zero point energy           0.029560253196 Eh   ::
         :: G(RRHO) w/o ZPVE           -0.000360456129 Eh   ::
         :: G(RRHO) contrib.            0.029199797066 Eh   ::
         :::::::::::::::::::::::::::::::::::::::::::::::::::::

optimized geometry written to: xtbopt.xyz


           -------------------------------------------------
          | TOTAL ENERGY               -8.821908146721 Eh   |
          | TOTAL ENTHALPY             -8.792221217510 Eh   |
          | TOTAL FREE ENERGY          -8.792708349655 Eh   |
          | GRADIENT NORM               0.000209459047 Eh/α |
          | HOMO-LUMO GAP               1.915096268927 eV   |
           -------------------------------------------------

------------------------------------------------------------------------
 * finished run on 2020/05/12 at 11:45:21.223     
------------------------------------------------------------------------
 total:
 * wall-time:     0 d,  0 h,  0 min,  0.136 sec
 *  cpu-time:     0 d,  0 h,  0 min,  0.136 sec
 * ratio c/w:     0.999 speedup
 SCF:
 * wall-time:     0 d,  0 h,  0 min,  0.004 sec
 *  cpu-time:     0 d,  0 h,  0 min,  0.004 sec
 * ratio c/w:     1.000 speedup
 ANC optimizer:
 * wall-time:     0 d,  0 h,  0 min,  0.054 sec
 *  cpu-time:     0 d,  0 h,  0 min,  0.054 sec
 * ratio c/w:     0.998 speedup
 numerical hessian:
 * wall-time:     0 d,  0 h,  0 min,  0.061 sec
 *  cpu-time:     0 d,  0 h,  0 min,  0.061 sec
 * ratio c/w:     0.999 speedup

