      -----------------------------------------------------------      
     |                   =====================                   |     
     |                           x T B                           |     
     |                   =====================                   |     
     |                         S. Grimme                         |     
     |          Mulliken Center for Theoretical Chemistry        |     
     |                    University of Bonn                     |     
      -----------------------------------------------------------      

   * xtb version 6.2.2 (9d81278992624c895f80dd42a50cac0aa55982e2) compiled by '@Darwin' on 04/03/2020

   xtb is free software: you can redistribute it and/or modify it under
   the terms of the GNU Lesser General Public License as published by
   the Free Software Foundation, either version 3 of the License, or
   (at your option) any later version.
   
   xtb is distributed in the hope that it will be useful,
   but WITHOUT ANY WARRANTY; without even the implied warranty of
   MERCHANTABILITY or FITNESS FOR A PARTICULAR PURPOSE.  See the
   GNU Lesser General Public License for more details.
   
   Cite this work as:
   * S. Grimme, C. Bannwarth, P. Shushkov, J. Chem. Theory Comput., 2017,
     13, 1989-2009. DOI: 10.1021/acs.jctc.7b00118
   * C. Bannwarth, S. Ehlert and S. Grimme., J. Chem. Theory Comput., 2019,
     15, 1652-1671. DOI: 10.1021/acs.jctc.8b01176
   * P. Pracht, E. Caldeweyher, S. Ehlert, S. Grimme, ChemRxiv, 2019, preprint.
     DOI: 10.26434/chemrxiv.8326202.v1
   
   for DFT-D4:
   * E. Caldeweyher, C. Bannwarth and S. Grimme, J. Chem. Phys., 2017,
     147, 034112. DOI: 10.1063/1.4993215
   * E. Caldeweyher, S. Ehlert, A. Hansen, H. Neugebauer, S. Spicher,
     C. Bannwarth and S. Grimme, J. Chem. Phys., 2019, 150, 154122.
     DOI: 10.1063/1.5090222
   
   for sTDA-xTB:
   * S. Grimme and C. Bannwarth, J. Chem. Phys., 2016, 145, 054103.
     DOI: 10.1063/1.4959605
   
   in the mass-spec context:
   * V. Asgeirsson, C. Bauer and S. Grimme, Chem. Sci., 2017, 8, 4879.
     DOI: 10.1039/c7sc00601b
   
   for metadynamics refer to:
   * S. Grimme, J. Chem. Theory Comput., 2019, 155, 2847-2862
     DOI: 10.1021/acs.jctc.9b00143
   
   with help from (in alphabetical order)
   C. Bannwarth, F. Bohle, G. Brandenburg, E. Caldeweyher, M. Checinski,
   S. Dohm, S. Ehlert, S. Ehrlich, F. März, H. Neugebauer, J. Pisarek,
   P. Pracht, P. Shushkov, and S. Spicher.
   
 * started run on 2020/05/12 at 11:44:36.046     

           -------------------------------------------------
          |                Calculation Setup                |
           -------------------------------------------------

          program call               : xtb --input C5_11_S_0.input C5_11_S_0.xyz --ohess --molden --namespace C5_11_S_0 output.out
          calculation namespace      : C5_11_S_0
          coordinate file            : C5_11_S_0.xyz
          number of atoms            :                     5
          number of electrons        :                    20
          charge                     :                     0
          spin                       :                   0.0
          first test random number   :      0.80126154388829

   ID    Z sym.   atoms
    1    6 C      1-5

           -------------------------------------------------
          |                 G F N 2 - x T B                 |
           -------------------------------------------------

        Reference                      10.1021/acs.jctc.8b01176
      * Hamiltonian:
        H0-scaling (s, p, d)           1.850000    2.230000    2.230000
        zeta-weighting                 0.500000
      * Dispersion:
        s8                             2.700000
        a1                             0.520000
        a2                             5.000000
        s9                             5.000000
      * Repulsion:
        kExp                           1.500000    1.000000
        rExp                           1.000000
      * Coulomb:
        alpha                          2.000000
        third order                    shell-resolved
        anisotropic                    true
        a3                             3.000000
        a5                             4.000000
        cn-shift                       1.200000
        cn-exp                         4.000000
        max-rad                        5.000000


          ...................................................
          :                      SETUP                      :
          :.................................................:
          :  # basis functions                  20          :
          :  # atomic orbitals                  20          :
          :  # shells                           10          :
          :  # electrons                        20          :
          :  max. iterations                   250          :
          :  Hamiltonian                  GFN2-xTB          :
          :  restarted?                      false          :
          :  GBSA solvation                  false          :
          :  PC potential                    false          :
          :  electronic temp.          300.0000000     K    :
          :  accuracy                    1.0000000          :
          :  -> integral cutoff          0.2500000E+02      :
          :  -> integral neglect         0.1000000E-07      :
          :  -> SCF convergence          0.1000000E-05 Eh   :
          :  -> wf. convergence          0.1000000E-03 e    :
          :  Broyden damping             0.4000000          :
          ...................................................

 iter      E             dE          RMSdq      gap      omega  full diag
   1    -10.0684469 -0.100684E+02  0.118E+01    0.30       0.0  T
   2     -8.3219860  0.174646E+01  0.149E+01    0.20       1.0  T
   3     -7.9142846  0.407701E+00  0.137E+01    0.72       1.0  T
   4    -10.0647302 -0.215045E+01  0.738E+00    0.57       1.0  T
   5    -10.1478922 -0.831620E-01  0.489E+00    0.12       1.0  T
   6    -10.1905107 -0.426185E-01  0.387E+00    0.28       1.0  T
   7    -10.1906307 -0.120001E-03  0.381E+00    0.28       1.0  T
   8    -10.1948978 -0.426716E-02  0.238E+00    0.20       1.0  T
   9    -10.1990856 -0.418779E-02  0.154E+00    0.18       1.0  T
  10    -10.2018216 -0.273603E-02  0.494E-01    0.16       1.0  T
  11    -10.2020299 -0.208211E-03  0.380E-01    0.16       1.0  T
  12    -10.2024500 -0.420140E-03  0.138E-01    0.16       1.0  T
  13    -10.2025697 -0.119695E-03  0.111E-01    0.15       1.0  T
  14    -10.2025831 -0.134568E-04  0.205E-02    0.16       2.2  T
  15    -10.2025828  0.367270E-06  0.216E-02    0.16       2.1  T
  16    -10.2025832 -0.424240E-06  0.717E-03    0.16       6.2  T
  17    -10.2025833 -0.102588E-06  0.173E-03    0.16      25.9  T
  18    -10.2025833 -0.162019E-08  0.840E-04    0.16      53.3  T
  19    -10.2025833 -0.584107E-09  0.658E-05    0.16     680.2  T

   *** convergence criteria satisfied after 19 iterations ***

         #    Occupation            Energy/Eh            Energy/eV
      -------------------------------------------------------------
         1        2.0000           -0.7402358             -20.1428
       ...           ...                  ...                  ...
         4        2.0000           -0.5983151             -16.2810
         5        2.0000           -0.5441416             -14.8068
         6        2.0000           -0.5232524             -14.2384
         7        2.0000           -0.5223378             -14.2135
         8        2.0000           -0.4792466             -13.0410
         9        2.0000           -0.4557079             -12.4004
        10        1.9078           -0.4342097             -11.8154 (HOMO)
        11        0.0922           -0.4284535             -11.6588 (LUMO)
        12                         -0.3726589             -10.1406
        13                         -0.3652777              -9.9397
        14                         -0.3359880              -9.1427
        15                         -0.2446627              -6.6576
       ...                                ...                  ...
        20                          0.1763563               4.7989
      -------------------------------------------------------------
                  HL-Gap            0.0057562 Eh            0.1566 eV
             Fermi-level           -0.4313316 Eh          -11.7371 eV

 SCC (total)                   0 d,  0 h,  0 min,  0.005 sec
 SCC setup                      ...        0 min,  0.000 sec (  1.621%)
 Dispersion                     ...        0 min,  0.000 sec (  0.460%)
 integral evaluation            ...        0 min,  0.001 sec ( 26.414%)
 zeroth order Hamiltonian       ...        0 min,  0.000 sec (  0.401%)
 iterations                     ...        0 min,  0.002 sec ( 41.643%)
 molecular gradient             ...        0 min,  0.001 sec ( 27.717%)
 printout                       ...        0 min,  0.000 sec (  1.548%)

         :::::::::::::::::::::::::::::::::::::::::::::::::::::
         ::                     SUMMARY                     ::
         :::::::::::::::::::::::::::::::::::::::::::::::::::::
         :: total energy             -10.114603459841 Eh    ::
         :: gradient norm              0.220720939397 Eh/a0 ::
         :: HOMO-LUMO gap              0.156635490174 eV    ::
         ::.................................................::
         :: SCC energy               -10.202583306917 Eh    ::
         :: -> isotropic ES           -0.026205543186 Eh    ::
         :: -> anisotropic ES          0.000701999335 Eh    ::
         :: -> anisotropic XC          0.009214740345 Eh    ::
         :: -> dispersion             -0.003004121724 Eh    ::
         :: repulsion energy           0.087979771703 Eh    ::
         :: add. restraining           0.000000000000 Eh    ::
         :::::::::::::::::::::::::::::::::::::::::::::::::::::

      ----------------------------------------------------------- 
     |                   =====================                   |
     |                        A N C O P T                        |
     |                   =====================                   |
     |               Approximate Normal Coordinate               |
     |                Rational Function Optimizer                |
      ----------------------------------------------------------- 

          ...................................................
          :                      SETUP                      :
          :.................................................:
          :   optimization level            normal          :
          :   max. optcycles                   200          :
          :   ANC micro-cycles                  20          :
          :   degrees of freedom                 9          :
          :.................................................:
          :   RF solver                   davidson          :
          :   write xtbopt.log                true          :
          :   linear?                        false          :
          :   energy convergence         0.5000000E-05 Eh   :
          :   grad. convergence          0.1000000E-02 Eh/α :
          :   maximium RF displ.         1.0000000          :
          :   Hlow (freq-cutoff)         0.1000000E-01      :
          :   Hmax (freq-cutoff)         5.0000000          :
          :   S6 in model hess.         20.0000000          :
          ...................................................

generating ANC from model Hessian ...
Using Lindh-Hessian (1995)
 Shifting diagonal of input Hessian by    0.0000000000000000     
 Lowest  eigenvalues of input Hessian
   -0.000000   -0.000000   -0.000000   -0.000000    0.000000    0.000000
    0.028475    0.054415    0.119969    0.528741    0.603247    0.809178
    0.837887    1.228662    1.317900
 Highest eigenvalues
    0.528741    0.603247    0.809178    0.837887    1.228662    1.317900


........................................................................
.............................. CYCLE    1 ..............................
........................................................................
   1    -10.2025833 -0.102026E+02  0.557E-05    0.16       0.0  T
   2    -10.2025833  0.773603E-11  0.494E-05    0.16     905.2  T
   3    -10.2025833 -0.155786E-11  0.424E-05    0.16    1055.3  T
     SCC iter.                  ...        0 min,  0.001 sec
     gradient                   ...        0 min,  0.001 sec
 * total energy  :   -10.1146035 Eh     change       -0.3515943E-09 Eh
   gradient norm :     0.2207200 Eh/α   predicted     0.0000000E+00 (-100.00%)
   displ. norm   :     0.5278850 α      lambda       -0.7729892E-01
   maximum displ.:     0.4529018 α      in ANC's #1, #4, #6, ...

........................................................................
.............................. CYCLE    2 ..............................
........................................................................
   1    -10.2889849 -0.102890E+02  0.236E+00    0.58       0.0  T
   2    -10.2674945  0.214904E-01  0.249E+00    0.48       1.0  T
   3    -10.2946546 -0.271600E-01  0.133E+00    0.50       1.0  T
   4    -10.2871107  0.754385E-02  0.132E+00    0.61       1.0  T
   5    -10.2993431 -0.122324E-01  0.323E-01    0.53       1.0  T
   6    -10.3002790 -0.935926E-03  0.915E-02    0.53       1.0  T
   7    -10.3002954 -0.163855E-04  0.147E-02    0.53       3.0  T
   8    -10.3002958 -0.402578E-06  0.259E-03    0.53      17.3  T
   9    -10.3002958 -0.232619E-08  0.549E-04    0.53      81.4  T
  10    -10.3002958 -0.699924E-09  0.421E-04    0.53     106.2  T
     SCC iter.                  ...        0 min,  0.001 sec
     gradient                   ...        0 min,  0.001 sec
 * total energy  :   -10.1759509 Eh     change       -0.6134742E-01 Eh
   gradient norm :     0.1441957 Eh/α   predicted    -0.4941962E-01 ( -19.44%)
   displ. norm   :     0.4488178 α      lambda       -0.6080462E-01
   maximum displ.:     0.3128618 α      in ANC's #4, #6, #8, ...

........................................................................
.............................. CYCLE    3 ..............................
........................................................................
   1    -10.4135756 -0.104136E+02  0.264E+00    0.57       0.0  T
   2    -10.4069188  0.665688E-02  0.230E+00    0.20       1.0  T
   3    -10.4308017 -0.238829E-01  0.115E+00    0.40       1.0  T
   4    -10.4300469  0.754719E-03  0.722E-01    0.52       1.0  T
   5    -10.4328944 -0.284745E-02  0.147E-01    0.41       1.0  T
   6    -10.4329843 -0.899248E-04  0.875E-02    0.41       1.0  T
   7    -10.4329961 -0.117805E-04  0.255E-02    0.41       1.8  T
   8    -10.4329933  0.275041E-05  0.298E-02    0.41       1.5  T
   9    -10.4329989 -0.554015E-05  0.243E-03    0.41      18.4  T
  10    -10.4329989 -0.655100E-08  0.105E-03    0.41      42.8  T
  11    -10.4329989 -0.652471E-08  0.701E-05    0.41     638.2  T
  12    -10.4329989 -0.161293E-11  0.323E-05    0.41    1385.3  T
     SCC iter.                  ...        0 min,  0.001 sec
     gradient                   ...        0 min,  0.001 sec
 * total energy  :   -10.1848951 Eh     change       -0.8944201E-02 Eh
   gradient norm :     0.2299742 Eh/α   predicted    -0.3652648E-01 ( 308.38%)
   displ. norm   :     0.5312760 α      lambda       -0.6309470E-01
   maximum displ.:     0.5055462 α      in ANC's #1, #3, #6, ...

........................................................................
.............................. CYCLE    4 ..............................
........................................................................
   1    -10.3655252 -0.103655E+02  0.208E+00    0.85       0.0  T
   2    -10.3504790  0.150461E-01  0.209E+00    0.54       1.0  T
   3    -10.3709894 -0.205104E-01  0.116E+00    0.95       1.0  T
   4    -10.3729306 -0.194119E-02  0.694E-01    0.69       1.0  T
   5    -10.3755823 -0.265169E-02  0.114E-01    0.85       1.0  T
   6    -10.3756669 -0.845755E-04  0.512E-02    0.83       1.0  T
   7    -10.3756668  0.898923E-07  0.213E-02    0.84       2.1  T
   8    -10.3756695 -0.265264E-05  0.519E-03    0.83       8.6  T
   9    -10.3756696 -0.124769E-06  0.263E-03    0.83      17.0  T
  10    -10.3756696 -0.213675E-07  0.404E-04    0.83     110.7  T
  11    -10.3756696 -0.108704E-09  0.894E-05    0.83     500.5  T
     SCC iter.                  ...        0 min,  0.001 sec
     gradient                   ...        0 min,  0.001 sec
 * total energy  :   -10.2138370 Eh     change       -0.2894190E-01 Eh
   gradient norm :     0.0704391 Eh/α   predicted    -0.4045171E-01 (  39.77%)
   displ. norm   :     0.3849028 α      lambda       -0.1176572E-01
   maximum displ.:     0.3539102 α      in ANC's #1, #6, #3, ...

........................................................................
.............................. CYCLE    5 ..............................
........................................................................
   1    -10.3688610 -0.103689E+02  0.131E+00    1.05       0.0  T
   2    -10.3681228  0.738228E-03  0.851E-01    1.16       1.0  T
   3    -10.3650484  0.307437E-02  0.962E-01    0.93       1.0  T
   4    -10.3687198 -0.367145E-02  0.382E-01    1.16       1.0  T
   5    -10.3698760 -0.115616E-02  0.828E-02    1.12       1.0  T
   6    -10.3698981 -0.220673E-04  0.430E-02    1.11       1.0  T
   7    -10.3699019 -0.385574E-05  0.623E-03    1.12       7.2  T
   8    -10.3699021 -0.141197E-06  0.266E-03    1.12      16.8  T
   9    -10.3699021 -0.695908E-08  0.307E-04    1.12     145.8  T
  10    -10.3699021 -0.263457E-09  0.213E-04    1.12     210.0  T
     SCC iter.                  ...        0 min,  0.001 sec
     gradient                   ...        0 min,  0.001 sec
 * total energy  :   -10.2188883 Eh     change       -0.5051265E-02 Eh
   gradient norm :     0.0893332 Eh/α   predicted    -0.6754402E-02 (  33.72%)
   displ. norm   :     0.1793353 α      lambda       -0.8102920E-02
   maximum displ.:     0.1012496 α      in ANC's #4, #1, #8, ...

........................................................................
.............................. CYCLE    6 ..............................
........................................................................
   1    -10.3865605 -0.103866E+02  0.705E-01    1.03       0.0  T
   2    -10.3865432  0.173366E-04  0.469E-01    0.97       1.0  T
   3    -10.3861808  0.362397E-03  0.400E-01    1.06       1.0  T
   4    -10.3866185 -0.437693E-03  0.177E-01    0.95       1.0  T
   5    -10.3868701 -0.251669E-03  0.441E-02    1.00       1.0  T
   6    -10.3868782 -0.806842E-05  0.202E-02    1.00       2.2  T
   7    -10.3868789 -0.650720E-06  0.178E-03    0.99      25.1  T
   8    -10.3868789 -0.378165E-08  0.111E-03    0.99      40.3  T
   9    -10.3868789 -0.925841E-09  0.429E-04    0.99     104.2  T
  10    -10.3868789 -0.130099E-08  0.662E-05    0.99     675.9  T
     SCC iter.                  ...        0 min,  0.001 sec
     gradient                   ...        0 min,  0.001 sec
 * total energy  :   -10.2248113 Eh     change       -0.5923015E-02 Eh
   gradient norm :     0.0518168 Eh/α   predicted    -0.4181762E-02 ( -29.40%)
   displ. norm   :     0.1987436 α      lambda       -0.6938201E-02
   maximum displ.:     0.1266140 α      in ANC's #4, #8, #6, ...

........................................................................
.............................. CYCLE    7 ..............................
........................................................................
   1    -10.4164634 -0.104165E+02  0.794E-01    0.89       0.0  T
   2    -10.4162519  0.211478E-03  0.603E-01    0.93       1.0  T
   3    -10.4167594 -0.507512E-03  0.413E-01    0.85       1.0  T
   4    -10.4170049 -0.245519E-03  0.220E-01    0.93       1.0  T
   5    -10.4172776 -0.272617E-03  0.449E-02    0.88       1.0  T
   6    -10.4172866 -0.901622E-05  0.250E-02    0.89       1.8  T
   7    -10.4172875 -0.891050E-06  0.145E-03    0.88      30.9  T
   8    -10.4172874  0.156623E-07  0.188E-03    0.88      23.7  T
   9    -10.4172875 -0.215325E-07  0.667E-04    0.88      67.1  T
  10    -10.4172875 -0.738833E-09  0.326E-05    0.88    1371.0  T
     SCC iter.                  ...        0 min,  0.001 sec
     gradient                   ...        0 min,  0.001 sec
 * total energy  :   -10.2281792 Eh     change       -0.3367920E-02 Eh
   gradient norm :     0.0335461 Eh/α   predicted    -0.3606126E-02 (   7.07%)
   displ. norm   :     0.4427636 α      lambda       -0.6060706E-02
   maximum displ.:     0.3451399 α      in ANC's #1, #4, #8, ...

........................................................................
.............................. CYCLE    8 ..............................
........................................................................
   1    -10.3913603 -0.103914E+02  0.140E+00    1.03       0.0  T
   2    -10.3901287  0.123154E-02  0.102E+00    0.87       1.0  T
   3    -10.3880670  0.206176E-02  0.972E-01    1.14       1.0  T
   4    -10.3919785 -0.391149E-02  0.313E-01    0.94       1.0  T
   5    -10.3925428 -0.564312E-03  0.678E-02    1.00       1.0  T
   6    -10.3925668 -0.239686E-04  0.297E-02    0.99       1.5  T
   7    -10.3925676 -0.887701E-06  0.444E-03    0.99      10.1  T
   8    -10.3925677 -0.983572E-07  0.200E-03    0.99      22.4  T
   9    -10.3925678 -0.134102E-07  0.132E-03    0.99      34.0  T
  10    -10.3925678 -0.518816E-08  0.684E-05    0.99     653.4  T
  11    -10.3925678  0.923706E-13  0.422E-05    0.99    1058.8  T
     SCC iter.                  ...        0 min,  0.001 sec
     gradient                   ...        0 min,  0.001 sec
 * total energy  :   -10.2295800 Eh     change       -0.1400818E-02 Eh
   gradient norm :     0.0531938 Eh/α   predicted    -0.3624423E-02 ( 158.74%)
   displ. norm   :     0.1528716 α      lambda       -0.3074689E-02
   maximum displ.:     0.1263368 α      in ANC's #1, #4, #6, ...

........................................................................
.............................. CYCLE    9 ..............................
........................................................................
   1    -10.4103437 -0.104103E+02  0.576E-01    0.92       0.0  T
   2    -10.4101020  0.241666E-03  0.449E-01    0.98       1.0  T
   3    -10.4104937 -0.391691E-03  0.319E-01    0.89       1.0  T
   4    -10.4106546 -0.160880E-03  0.170E-01    0.96       1.0  T
   5    -10.4108111 -0.156465E-03  0.312E-02    0.92       1.4  T
   6    -10.4108160 -0.497266E-05  0.153E-02    0.93       2.9  T
   7    -10.4108164 -0.308346E-06  0.109E-03    0.93      41.2  T
   8    -10.4108163  0.887251E-08  0.140E-03    0.93      31.9  T
   9    -10.4108164 -0.124852E-07  0.439E-04    0.93     102.0  T
  10    -10.4108164 -0.253403E-09  0.304E-05    0.93    1470.1  T
     SCC iter.                  ...        0 min,  0.001 sec
     gradient                   ...        0 min,  0.001 sec
 * total energy  :   -10.2308475 Eh     change       -0.1267502E-02 Eh
   gradient norm :     0.0069463 Eh/α   predicted    -0.1573272E-02 (  24.12%)
   displ. norm   :     0.0875163 α      lambda       -0.4340902E-03
   maximum displ.:     0.0547070 α      in ANC's #1, #4, #8, ...

........................................................................
.............................. CYCLE   10 ..............................
........................................................................
   1    -10.4106429 -0.104106E+02  0.274E-01    0.93       0.0  T
   2    -10.4106432 -0.297598E-06  0.167E-01    0.93       1.0  T
   3    -10.4106167  0.265274E-04  0.641E-02    0.94       1.0  T
   4    -10.4106446 -0.278774E-04  0.915E-03    0.93       4.9  T
   5    -10.4106446  0.246397E-07  0.502E-03    0.93       8.9  T
   6    -10.4106446 -0.539204E-07  0.155E-03    0.93      28.9  T
   7    -10.4106446 -0.153674E-07  0.245E-04    0.93     182.6  T
   8    -10.4106446  0.113353E-09  0.263E-04    0.93     170.0  T
     SCC iter.                  ...        0 min,  0.001 sec
     gradient                   ...        0 min,  0.002 sec
 * total energy  :   -10.2311955 Eh     change       -0.3480190E-03 Eh
   gradient norm :     0.0073159 Eh/α   predicted    -0.2187063E-03 ( -37.16%)
   displ. norm   :     0.1408932 α      lambda       -0.4852475E-03
   maximum displ.:     0.0868673 α      in ANC's #4, #1, #8, ...

........................................................................
.............................. CYCLE   11 ..............................
........................................................................
   1    -10.4102252 -0.104102E+02  0.443E-01    0.93       0.0  T
   2    -10.4102108  0.144104E-04  0.276E-01    0.90       1.0  T
   3    -10.4097549  0.455848E-03  0.277E-01    0.98       1.0  T
   4    -10.4102384 -0.483470E-03  0.170E-02    0.92       2.6  T
   5    -10.4102388 -0.393958E-06  0.117E-02    0.92       3.8  T
   6    -10.4102390 -0.228228E-06  0.428E-03    0.92      10.4  T
   7    -10.4102391 -0.107629E-06  0.473E-04    0.92      94.6  T
   8    -10.4102391  0.117536E-08  0.578E-04    0.92      77.4  T
     SCC iter.                  ...        0 min,  0.001 sec
     gradient                   ...        0 min,  0.001 sec
 * total energy  :   -10.2314480 Eh     change       -0.2525225E-03 Eh
   gradient norm :     0.0070477 Eh/α   predicted    -0.2474400E-03 (  -2.01%)
   displ. norm   :     0.0143967 α      lambda       -0.5152029E-04
   maximum displ.:     0.0085914 α      in ANC's #8, #3, #4, ...

........................................................................
.............................. CYCLE   12 ..............................
........................................................................
   1    -10.4122652 -0.104123E+02  0.593E-02    0.91       0.0  T
   2    -10.4122609  0.432153E-05  0.503E-02    0.92       1.0  T
   3    -10.4122681 -0.721412E-05  0.316E-02    0.91       1.4  T
   4    -10.4122696 -0.153512E-05  0.160E-02    0.91       2.8  T
   5    -10.4122710 -0.134314E-05  0.343E-03    0.91      13.0  T
   6    -10.4122710 -0.474215E-07  0.186E-03    0.91      24.0  T
   7    -10.4122710 -0.431905E-08  0.226E-04    0.91     197.8  T
   8    -10.4122710 -0.130589E-09  0.172E-04    0.91     259.9  T
     SCC iter.                  ...        0 min,  0.001 sec
     gradient                   ...        0 min,  0.001 sec
 * total energy  :   -10.2314759 Eh     change       -0.2787017E-04 Eh
   gradient norm :     0.0013696 Eh/α   predicted    -0.2576584E-04 (  -7.55%)
   displ. norm   :     0.0123442 α      lambda       -0.3135362E-05
   maximum displ.:     0.0073617 α      in ANC's #8, #4, #1, ...

........................................................................
.............................. CYCLE   13 ..............................
........................................................................
   1    -10.4125673 -0.104126E+02  0.397E-02    0.91       0.0  T
   2    -10.4125673  0.293669E-07  0.245E-02    0.91       1.8  T
   3    -10.4125649  0.242157E-05  0.211E-02    0.91       2.1  T
   4    -10.4125674 -0.253093E-05  0.344E-03    0.91      13.0  T
   5    -10.4125675 -0.760071E-07  0.120E-03    0.91      37.4  T
   6    -10.4125675 -0.968468E-09  0.815E-04    0.91      54.9  T
   7    -10.4125675 -0.188620E-08  0.683E-05    0.91     654.5  T
     SCC iter.                  ...        0 min,  0.001 sec
     gradient                   ...        0 min,  0.001 sec
 * total energy  :   -10.2314777 Eh     change       -0.1743402E-05 Eh
   gradient norm :     0.0006163 Eh/α   predicted    -0.1566972E-05 ( -10.12%)
   displ. norm   :     0.0020027 α      lambda       -0.6217779E-06
   maximum displ.:     0.0015052 α      in ANC's #4, #6, #3, ...

   *** GEOMETRY OPTIMIZATION CONVERGED AFTER 13 ITERATIONS ***

------------------------------------------------------------------------
 total energy gain   :        -0.1168742 Eh      -73.3397 kcal/mol
 total RMSD          :         1.1006885 a0        0.5825 Å
 total power (kW/mol):       -23.6040905 (step)-5834.5672 (real)
------------------------------------------------------------------------

 ANCopt (total)                0 d,  0 h,  0 min,  0.053 sec
 optimizer setup                ...        0 min,  0.000 sec (  0.201%)
 model hessian                  ...        0 min,  0.000 sec (  0.170%)
 ANC generation                 ...        0 min,  0.000 sec (  0.097%)
 coordinate transformation      ...        0 min,  0.000 sec (  0.056%)
 single point calculation       ...        0 min,  0.051 sec ( 97.284%)
 optimization log               ...        0 min,  0.000 sec (  0.669%)
 hessian update                 ...        0 min,  0.000 sec (  0.057%)
 rational function              ...        0 min,  0.000 sec (  0.628%)

================
 final structure:
================
5
 xtb: 6.2.2 (9d81278992624c895f80dd42a50cac0aa55982e2)
C        -1.70167983425426   -0.00628630866734    0.00672488128137
C        -0.52209064357185   -0.18780097221561   -0.73682525706833
C         0.72615504976112    0.00449307556362   -0.00327520714846
C        -0.51764490285590    0.18468156844712    0.74079074154750
C         2.01526133092090    0.00491263687220   -0.00741615861208

 Bond Distances (Angstroems)
 ---------------------------
C1-C2=1.4061         C1-C4=1.4062         C2-C1=1.4061         C2-C3=1.4605         C2-C4=1.5238         C3-C2=1.4605         
C3-C4=1.4605         C3-C5=1.2891         C4-C1=1.4062         C4-C2=1.5238         C4-C3=1.4605         C5-C3=1.2891         
 C  C  Rav=1.4244 sigma=0.0724  Rmin=1.2891  Rmax=1.5238     6

 selected bond angles (degree)
 --------------------
C4-C1-C2= 65.62                C3-C2-C1=115.75                C4-C2-C1= 57.19                C4-C2-C3= 58.55                
C4-C3-C2= 62.89                C5-C3-C2=148.55                C5-C3-C4=148.56                C2-C4-C1= 57.19                
C3-C4-C1=115.75                C3-C4-C2= 58.56                

 selected dihedral angles (degree)
 ---------------------------------
C3-C2-C1-C4=359.95            C4-C3-C2-C1=  0.05            C5-C3-C2-C1=179.54            C5-C3-C2-C4=179.49            
C3-C4-C1-C2=  0.05            C1-C4-C2-C3=179.95            C3-C4-C2-C1=180.05            C1-C4-C3-C2=359.95            
C1-C4-C3-C5=180.46            C2-C4-C3-C5=180.51            
           -------------------------------------------------
          |                Final Singlepoint                |
           -------------------------------------------------

          ...................................................
          :                      SETUP                      :
          :.................................................:
          :  # basis functions                  20          :
          :  # atomic orbitals                  20          :
          :  # shells                           10          :
          :  # electrons                        20          :
          :  max. iterations                   250          :
          :  Hamiltonian                  GFN2-xTB          :
          :  restarted?                      false          :
          :  GBSA solvation                  false          :
          :  PC potential                    false          :
          :  electronic temp.          300.0000000     K    :
          :  accuracy                    1.0000000          :
          :  -> integral cutoff          0.2500000E+02      :
          :  -> integral neglect         0.1000000E-07      :
          :  -> SCF convergence          0.1000000E-05 Eh   :
          :  -> wf. convergence          0.1000000E-03 e    :
          :  Broyden damping             0.4000000          :
          ...................................................

 iter      E             dE          RMSdq      gap      omega  full diag
   1    -10.4125675 -0.104126E+02  0.652E-05    0.91       0.0  T
   2    -10.4125675  0.837534E-10  0.120E-04    0.91     372.7  T
   3    -10.4125675 -0.108129E-09  0.160E-05    0.91    2797.1  T

   *** convergence criteria satisfied after 3 iterations ***

         #    Occupation            Energy/Eh            Energy/eV
      -------------------------------------------------------------
         1        2.0000           -0.7469668             -20.3260
       ...           ...                  ...                  ...
         4        2.0000           -0.6095511             -16.5867
         5        2.0000           -0.5660711             -15.4036
         6        2.0000           -0.5437006             -14.7948
         7        2.0000           -0.4841068             -13.1732
         8        2.0000           -0.4632075             -12.6045
         9        2.0000           -0.4622970             -12.5797
        10        2.0000           -0.4389995             -11.9458 (HOMO)
        11                         -0.4056122             -11.0373 (LUMO)
        12                         -0.3526452              -9.5960
        13                         -0.3182319              -8.6595
        14                         -0.2451397              -6.6706
        15                         -0.1922759              -5.2321
       ...                                ...                  ...
        20                          0.7591354              20.6571
      -------------------------------------------------------------
                  HL-Gap            0.0333873 Eh            0.9085 eV
             Fermi-level           -0.4223058 Eh          -11.4915 eV

 SCC (total)                   0 d,  0 h,  0 min,  0.004 sec
 SCC setup                      ...        0 min,  0.000 sec (  1.583%)
 Dispersion                     ...        0 min,  0.000 sec (  0.445%)
 integral evaluation            ...        0 min,  0.001 sec ( 38.820%)
 zeroth order Hamiltonian       ...        0 min,  0.000 sec (  0.451%)
 iterations                     ...        0 min,  0.001 sec ( 15.288%)
 molecular gradient             ...        0 min,  0.001 sec ( 40.935%)
 printout                       ...        0 min,  0.000 sec (  2.196%)

         :::::::::::::::::::::::::::::::::::::::::::::::::::::
         ::                     SUMMARY                     ::
         :::::::::::::::::::::::::::::::::::::::::::::::::::::
         :: total energy             -10.231477662167 Eh    ::
         :: gradient norm              0.000616520112 Eh/a0 ::
         :: HOMO-LUMO gap              0.908514114849 eV    ::
         ::.................................................::
         :: SCC energy               -10.412567461624 Eh    ::
         :: -> isotropic ES           -0.015120800275 Eh    ::
         :: -> anisotropic ES          0.003150361201 Eh    ::
         :: -> anisotropic XC          0.010759629211 Eh    ::
         :: -> dispersion             -0.002917042109 Eh    ::
         :: repulsion energy           0.181089861955 Eh    ::
         :: add. restraining           0.000000000000 Eh    ::
         :::::::::::::::::::::::::::::::::::::::::::::::::::::

           ------------------------------------------------- 
          |                Numerical Hessian                |
           ------------------------------------------------- 
step length          :   0.00500
SCC accuracy         :   0.30000
Hessian scale factor :   1.00000
frozen atoms in %    :   0.00000    0
RMS gradient         :   0.00062
estimated CPU  time      0.00 min
estimated wall time      0.00 min

writing file <hessian>.

 projected vibrational frequencies (cm-1)
eigval :       -0.00    -0.00    -0.00    -0.00     0.00     0.00
eigval :     -202.08   206.97   362.89   519.50   720.43   738.73
eigval :     1149.16  1482.23  1804.54
           -------------------------------------------------
          |                Property Printout                |
           -------------------------------------------------

    * Orbital Energies and Occupations

         #    Occupation            Energy/Eh            Energy/eV
      -------------------------------------------------------------
         1        2.0000           -0.7469669             -20.3260
         2        2.0000           -0.6948403             -18.9076
         3        2.0000           -0.6430355             -17.4979
         4        2.0000           -0.6095512             -16.5867
         5        2.0000           -0.5660712             -15.4036
         6        2.0000           -0.5437007             -14.7948
         7        2.0000           -0.4841066             -13.1732
         8        2.0000           -0.4632074             -12.6045
         9        2.0000           -0.4622971             -12.5797
        10        2.0000           -0.4389996             -11.9458 (HOMO)
        11                         -0.4056119             -11.0373 (LUMO)
        12                         -0.3526453              -9.5960
        13                         -0.3182320              -8.6595
        14                         -0.2451397              -6.6706
        15                         -0.1922759              -5.2321
        16                          0.0967555               2.6329
        17                          0.1367145               3.7202
        18                          0.1796967               4.8898
        19                          0.3872941              10.5388
        20                          0.7591355              20.6571
      -------------------------------------------------------------
                  HL-Gap            0.0333877 Eh            0.9085 eV
             Fermi-level           -0.4223057 Eh          -11.4915 eV

     #   Z        covCN         q      C6AA      α(0)
     1   6 C      1.972    -0.097    33.736     9.380
     2   6 C      2.934     0.050    26.868     8.501
     3   6 C      2.950     0.104    25.705     8.316
     4   6 C      2.934     0.050    26.868     8.501
     5   6 C      0.981    -0.108    39.355    10.537

 Mol. C6AA /au·bohr⁶  :        757.098707
 Mol. C8AA /au·bohr⁸  :      21896.610275
 Mol. α(0) /au        :         45.234319


Wiberg/Mayer (AO) data.
largest (>0.10) Wiberg bond orders for each atom
          total WBO             WBO to atom ...
     1  C   2.777        C    2 1.232    C    4 1.232    C    5 0.217
     2  C   3.405        C    1 1.232    C    4 1.151    C    3 0.925
     3  C   3.951        C    5 2.006    C    4 0.925    C    2 0.925
     4  C   3.405        C    1 1.232    C    2 1.151    C    3 0.925
     5  C   2.417        C    3 2.006    C    1 0.217

MOs/occ written to file <molden.input>


molecular dipole:
                 x           y           z       tot (Debye)
 q only:       -0.055       0.001       0.000
   full:        0.142       0.003      -0.001       0.361
molecular quadrupole (traceless):
                xx          xy          yy          xz          yz          zz
 q only:       -2.376      -0.009       1.050       0.014       0.074       1.326
  q+dip:       -6.276      -0.033       3.578       0.036      -0.237       2.698
   full:       -9.642      -0.053       5.957       0.054      -0.612       3.685

           -------------------------------------------------
          |                Geometry Summary                 |
           -------------------------------------------------

      molecular mass/u    :       60.0536795
   center of mass at/Å    :        0.0000002      -0.0000000      -0.0000002
  moments of inertia/u·Å² :        0.1394524E+02   0.9638647E+02   0.1103315E+03
rotational constants/cm⁻¹ :        0.1208845E+01   0.1748963E+00   0.1527907E+00

 * 1 selected distances

     #   Z        #   Z                                     value/Å
     3   6 C      5   6 C                                 1.2891130 (max)

 * 1 distinct bonds (by element types)

   Z      Z             #   av. dist./Å        max./Å        min./Å
   6 C    6 C           1     1.2891130     1.2891130     1.2891130

           -------------------------------------------------
          |               Frequency Printout                |
           -------------------------------------------------
 projected vibrational frequencies (cm-1)
eigval :       -0.00    -0.00    -0.00    -0.00     0.00     0.00
eigval :     -202.08   206.97   362.89   519.50   720.43   738.73
eigval :     1149.16  1482.23  1804.54
 reduced masses (amu)
   1: 12.01   2: 12.01   3: 12.01   4: 12.01   5: 12.01   6: 12.01   7: 12.01   8: 12.01
   9: 12.01  10: 12.01  11: 12.01  12: 12.01  13: 12.01  14: 12.01  15: 12.01
 IR intensities (amu)
   1:  0.01   2:  0.03   3:  0.04   4:  0.03   5:  0.02   6:  0.03   7:  0.68   8:  0.61
   9:  1.77  10:  0.19  11:  0.23  12:  0.46  13:  0.22  14:  0.10  15:  0.40
 Raman intensities (amu)
   1:  0.00   2:  0.00   3:  0.00   4:  0.00   5:  0.00   6:  0.00   7:  0.00   8:  0.00
   9:  0.00  10:  0.00  11:  0.00  12:  0.00  13:  0.00  14:  0.00  15:  0.00
 output can be read by thermo (or use thermo option).
 writing <g98.out> molden fake output.
Molecule has the following symmetry elements: (C2) 2*(sigma) 
It seems to be the C2v point group
 recommended (thermochemical) frequency scaling factor: 1.0
           -------------------------------------------------
          |             Thermodynamic Functions             |
           -------------------------------------------------

c2v symmetry found (for desy threshold:  0.10E+00) used in thermo

          ...................................................
          :                      SETUP                      :
          :.................................................:
          :  # frequencies                           8      :
          :  # imaginary freq.                       1      :
          :  linear?                             false      :
          :  only rotor calc.                    false      :
          :  symmetry                              c2v      :
          :  rotational number                       2      :
          :  scaling factor                  1.0000000      :
          :  rotor cutoff                   50.0000000 cm⁻¹ :
          :  imag. cutoff                  -20.0000000 cm⁻¹ :
          :.................................................:

    mode    ω/cm⁻¹     T·S(HO)/kcal·mol⁻¹    T·S(FR)/kcal·mol⁻¹   T·S(vib)
   ------------------------------------------------------------------------
       1    206.97    -0.00000 ( 99.66%)     0.01242 (  0.34%)     0.00004
   ------------------------------------------------------------------------

   temp. (K)  partition function   enthalpy   heat capacity  entropy
                                   cal/mol     cal/K/mol   cal/K/mol   J/K/mol
 298.15  VIB   2.23                  839.088      6.478      4.405
         ROT  0.147E+05              888.752      2.981     22.051
         INT  0.327E+05             1727.840      9.459     26.456
         TR   0.450E+27             1481.254      4.968     38.181
         TOT                        3209.0938    14.4273    64.6364   270.4385

   temp. (K)  partition function   enthalpy   heat capacity  entropy
                                   cal/mol     cal/K/mol   cal/K/mol   J/K/mol
 120.00  VIB   1.11                   71.152      1.918      0.799
         ROT  0.376E+04              357.707      2.981     19.338
         INT  0.416E+04              428.859      4.899     20.137
         TR   0.115E+27              596.178      4.968     33.661
         TOT                        1025.0371     9.8669    53.7985   225.0931

   temp. (K)  partition function   enthalpy   heat capacity  entropy
                                   cal/mol     cal/K/mol   cal/K/mol   J/K/mol
 100.00  VIB   1.06                   38.331      1.367      0.501
         ROT  0.286E+04              298.089      2.981     18.795
         INT  0.303E+04              336.420      4.348     19.296
         TR   0.875E+26              496.815      4.968     32.756
         TOT                         833.2352     9.3159    52.0520   217.7858

   temp. (K)  partition function   enthalpy   heat capacity  entropy
                                   cal/mol     cal/K/mol   cal/K/mol   J/K/mol
  80.00  VIB   1.03                   16.322      0.840      0.258
         ROT  0.204E+04              238.471      2.981     18.129
         INT  0.210E+04              254.793      3.821     18.387
         TR   0.626E+26              397.452      4.968     31.648
         TOT                         652.2450     8.7890    50.0352   209.3474

   temp. (K)  partition function   enthalpy   heat capacity  entropy
                                   cal/mol     cal/K/mol   cal/K/mol   J/K/mol
  60.00  VIB   1.01                    4.345      0.373      0.088
         ROT  0.133E+04              178.853      2.981     17.272
         INT  0.134E+04              183.198      3.354     17.360
         TR   0.406E+26              298.089      4.968     30.219
         TOT                         481.2870     8.3223    47.5795   199.0725

   temp. (K)  partition function   enthalpy   heat capacity  entropy
                                   cal/mol     cal/K/mol   cal/K/mol   J/K/mol
  40.00  VIB   1.00                    0.348      0.065      0.010
         ROT   723.                  119.236      2.981     16.063
         INT   723.                  119.584      3.046     16.073
         TR   0.221E+26              198.726      4.968     28.206
         TOT                         318.3099     8.0142    44.2793   185.2644

   temp. (K)  partition function   enthalpy   heat capacity  entropy
                                   cal/mol     cal/K/mol   cal/K/mol   J/K/mol
  20.00  VIB   1.00                    0.000      0.000     -0.002
         ROT   256.                   59.618      2.981     13.997
         INT   256.                   59.618      2.981     13.995
         TR   0.782E+25               99.363      4.968     24.764
         TOT                         158.9810     7.9492    38.7586   162.1659

   temp. (K)  partition function   enthalpy   heat capacity  entropy
                                   cal/mol     cal/K/mol   cal/K/mol   J/K/mol
  10.00  VIB   1.00                    0.000      0.000     -0.005
         ROT   90.4                   29.809      2.981     11.931
         INT   90.4                   29.809      2.981     11.926
         TR   0.277E+25               49.681      4.968     21.322
         TOT                          79.4904     7.9490    33.2477   139.1084

       T/K    H(0)-H(T)+PV         H(T)/Eh          T*S/Eh         G(T)/Eh
   ------------------------------------------------------------------------
    298.15    0.511402E-02    0.210258E-01    0.307108E-01   -0.968506E-02
    120.00    0.163350E-02    0.175452E-01    0.102880E-01    0.725722E-02
    100.00    0.132784E-02    0.172396E-01    0.829502E-02    0.894456E-02
     80.00    0.103942E-02    0.169512E-01    0.637890E-02    0.105723E-01
     60.00    0.766980E-03    0.166787E-01    0.454936E-02    0.121294E-01
     40.00    0.507259E-03    0.164190E-01    0.282254E-02    0.135965E-01
     20.00    0.253352E-03    0.161651E-01    0.123531E-02    0.149298E-01
     10.00    0.126676E-03    0.160384E-01    0.529836E-03    0.155086E-01 (used)
   ------------------------------------------------------------------------

         :::::::::::::::::::::::::::::::::::::::::::::::::::::
         ::                  THERMODYNAMIC                  ::
         :::::::::::::::::::::::::::::::::::::::::::::::::::::
         :: total free energy         -10.215969086852 Eh   ::
         ::.................................................::
         :: total energy              -10.231477662321 Eh   ::
         :: zero point energy           0.015911735545 Eh   ::
         :: G(RRHO) w/o ZPVE           -0.000403160076 Eh   ::
         :: G(RRHO) contrib.            0.015508575469 Eh   ::
         :::::::::::::::::::::::::::::::::::::::::::::::::::::
imag cut-off (cm-1) :    5.00
 found            1  significant imaginary frequency
 writing imag mode distorted coords to xtbhess.xyz
 for further optimization.

optimized geometry written to: xtbopt.xyz


           -------------------------------------------------
          | TOTAL ENERGY              -10.231477662321 Eh   |
          | TOTAL ENTHALPY            -10.215439250761 Eh   |
          | TOTAL FREE ENERGY         -10.215969086852 Eh   |
          | GRADIENT NORM               0.000616483552 Eh/α |
          | HOMO-LUMO GAP               0.908524530077 eV   |
           -------------------------------------------------

------------------------------------------------------------------------
 * finished run on 2020/05/12 at 11:44:36.235     
------------------------------------------------------------------------
 total:
 * wall-time:     0 d,  0 h,  0 min,  0.189 sec
 *  cpu-time:     0 d,  0 h,  0 min,  0.189 sec
 * ratio c/w:     0.998 speedup
 SCF:
 * wall-time:     0 d,  0 h,  0 min,  0.005 sec
 *  cpu-time:     0 d,  0 h,  0 min,  0.005 sec
 * ratio c/w:     0.998 speedup
 ANC optimizer:
 * wall-time:     0 d,  0 h,  0 min,  0.057 sec
 *  cpu-time:     0 d,  0 h,  0 min,  0.057 sec
 * ratio c/w:     0.998 speedup
 numerical hessian:
 * wall-time:     0 d,  0 h,  0 min,  0.110 sec
 *  cpu-time:     0 d,  0 h,  0 min,  0.110 sec
 * ratio c/w:     0.998 speedup

