      -----------------------------------------------------------      
     |                   =====================                   |     
     |                           x T B                           |     
     |                   =====================                   |     
     |                         S. Grimme                         |     
     |          Mulliken Center for Theoretical Chemistry        |     
     |                    University of Bonn                     |     
      -----------------------------------------------------------      

   * xtb version 6.2.2 (9d81278992624c895f80dd42a50cac0aa55982e2) compiled by '@Darwin' on 04/03/2020

   xtb is free software: you can redistribute it and/or modify it under
   the terms of the GNU Lesser General Public License as published by
   the Free Software Foundation, either version 3 of the License, or
   (at your option) any later version.
   
   xtb is distributed in the hope that it will be useful,
   but WITHOUT ANY WARRANTY; without even the implied warranty of
   MERCHANTABILITY or FITNESS FOR A PARTICULAR PURPOSE.  See the
   GNU Lesser General Public License for more details.
   
   Cite this work as:
   * S. Grimme, C. Bannwarth, P. Shushkov, J. Chem. Theory Comput., 2017,
     13, 1989-2009. DOI: 10.1021/acs.jctc.7b00118
   * C. Bannwarth, S. Ehlert and S. Grimme., J. Chem. Theory Comput., 2019,
     15, 1652-1671. DOI: 10.1021/acs.jctc.8b01176
   * P. Pracht, E. Caldeweyher, S. Ehlert, S. Grimme, ChemRxiv, 2019, preprint.
     DOI: 10.26434/chemrxiv.8326202.v1
   
   for DFT-D4:
   * E. Caldeweyher, C. Bannwarth and S. Grimme, J. Chem. Phys., 2017,
     147, 034112. DOI: 10.1063/1.4993215
   * E. Caldeweyher, S. Ehlert, A. Hansen, H. Neugebauer, S. Spicher,
     C. Bannwarth and S. Grimme, J. Chem. Phys., 2019, 150, 154122.
     DOI: 10.1063/1.5090222
   
   for sTDA-xTB:
   * S. Grimme and C. Bannwarth, J. Chem. Phys., 2016, 145, 054103.
     DOI: 10.1063/1.4959605
   
   in the mass-spec context:
   * V. Asgeirsson, C. Bauer and S. Grimme, Chem. Sci., 2017, 8, 4879.
     DOI: 10.1039/c7sc00601b
   
   for metadynamics refer to:
   * S. Grimme, J. Chem. Theory Comput., 2019, 155, 2847-2862
     DOI: 10.1021/acs.jctc.9b00143
   
   with help from (in alphabetical order)
   C. Bannwarth, F. Bohle, G. Brandenburg, E. Caldeweyher, M. Checinski,
   S. Dohm, S. Ehlert, S. Ehrlich, F. März, H. Neugebauer, J. Pisarek,
   P. Pracht, P. Shushkov, and S. Spicher.
   
 * started run on 2020/05/12 at 11:44:49.337     

           -------------------------------------------------
          |                Calculation Setup                |
           -------------------------------------------------

          program call               : xtb --input C1O2_2_S_0.input C1O2_2_S_0.xyz --ohess --molden --namespace C1O2_2_S_0 output.out
          calculation namespace      : C1O2_2_S_0
          coordinate file            : C1O2_2_S_0.xyz
          number of atoms            :                     3
          number of electrons        :                    16
          charge                     :                     0
          spin                       :                   0.0
          first test random number   :      0.88599391727054

   ID    Z sym.   atoms
    1    6 C      1
    2    8 O      2, 3

           -------------------------------------------------
          |                 G F N 2 - x T B                 |
           -------------------------------------------------

        Reference                      10.1021/acs.jctc.8b01176
      * Hamiltonian:
        H0-scaling (s, p, d)           1.850000    2.230000    2.230000
        zeta-weighting                 0.500000
      * Dispersion:
        s8                             2.700000
        a1                             0.520000
        a2                             5.000000
        s9                             5.000000
      * Repulsion:
        kExp                           1.500000    1.000000
        rExp                           1.000000
      * Coulomb:
        alpha                          2.000000
        third order                    shell-resolved
        anisotropic                    true
        a3                             3.000000
        a5                             4.000000
        cn-shift                       1.200000
        cn-exp                         4.000000
        max-rad                        5.000000


          ...................................................
          :                      SETUP                      :
          :.................................................:
          :  # basis functions                  12          :
          :  # atomic orbitals                  12          :
          :  # shells                            6          :
          :  # electrons                        16          :
          :  max. iterations                   250          :
          :  Hamiltonian                  GFN2-xTB          :
          :  restarted?                      false          :
          :  GBSA solvation                  false          :
          :  PC potential                    false          :
          :  electronic temp.          300.0000000     K    :
          :  accuracy                    1.0000000          :
          :  -> integral cutoff          0.2500000E+02      :
          :  -> integral neglect         0.1000000E-07      :
          :  -> SCF convergence          0.1000000E-05 Eh   :
          :  -> wf. convergence          0.1000000E-03 e    :
          :  Broyden damping             0.4000000          :
          ...................................................

 iter      E             dE          RMSdq      gap      omega  full diag
   1    -10.0607381 -0.100607E+02  0.104E+01    2.95       0.0  T
   2    -10.0648175 -0.407941E-02  0.588E+00    2.50       1.0  T
   3    -10.0650543 -0.236826E-03  0.875E-01    2.67       1.0  T
   4    -10.0652694 -0.215144E-03  0.236E-01    2.53       1.0  T
   5    -10.0646037  0.665747E-03  0.454E-01    2.77       1.0  T
   6    -10.0653008 -0.697108E-03  0.103E-01    2.55       1.0  T
   7    -10.0653362 -0.354131E-04  0.247E-02    2.58       2.3  T
   8    -10.0653379 -0.171301E-05  0.122E-03    2.59      47.3  T
   9    -10.0653379  0.326221E-09  0.103E-03    2.59      56.2  T
  10    -10.0653379 -0.386776E-08  0.407E-05    2.59    1419.2  T
  11    -10.0653379 -0.522604E-11  0.120E-05    2.59    4812.3  T

   *** convergence criteria satisfied after 11 iterations ***

         #    Occupation            Energy/Eh            Energy/eV
      -------------------------------------------------------------
         1        2.0000           -0.8510264             -23.1576
         2        2.0000           -0.7638508             -20.7854
         3        2.0000           -0.7243013             -19.7092
         4        2.0000           -0.6797185             -18.4961
         5        2.0000           -0.6562473             -17.8574
         6        2.0000           -0.5992963             -16.3077
         7        2.0000           -0.5320621             -14.4781
         8        2.0000           -0.4941832             -13.4474 (HOMO)
         9                         -0.3990798             -10.8595 (LUMO)
        10                         -0.2058487              -5.6014
        11                         -0.0857197              -2.3326
        12                          0.1496216               4.0714
      -------------------------------------------------------------
                  HL-Gap            0.0951035 Eh            2.5879 eV
             Fermi-level           -0.4466315 Eh          -12.1535 eV

 SCC (total)                   0 d,  0 h,  0 min,  0.002 sec
 SCC setup                      ...        0 min,  0.000 sec (  3.811%)
 Dispersion                     ...        0 min,  0.000 sec (  0.472%)
 integral evaluation            ...        0 min,  0.001 sec ( 28.957%)
 zeroth order Hamiltonian       ...        0 min,  0.000 sec (  0.652%)
 iterations                     ...        0 min,  0.001 sec ( 38.557%)
 molecular gradient             ...        0 min,  0.001 sec ( 24.764%)
 printout                       ...        0 min,  0.000 sec (  2.304%)

         :::::::::::::::::::::::::::::::::::::::::::::::::::::
         ::                     SUMMARY                     ::
         :::::::::::::::::::::::::::::::::::::::::::::::::::::
         :: total energy             -10.044162670169 Eh    ::
         :: gradient norm              0.180804297813 Eh/a0 ::
         :: HOMO-LUMO gap              2.587897118022 eV    ::
         ::.................................................::
         :: SCC energy               -10.065337928273 Eh    ::
         :: -> isotropic ES            0.005390041244 Eh    ::
         :: -> anisotropic ES          0.007472023688 Eh    ::
         :: -> anisotropic XC         -0.012312157863 Eh    ::
         :: -> dispersion             -0.000668291142 Eh    ::
         :: repulsion energy           0.021175257409 Eh    ::
         :: add. restraining           0.000000000000 Eh    ::
         :::::::::::::::::::::::::::::::::::::::::::::::::::::

      ----------------------------------------------------------- 
     |                   =====================                   |
     |                        A N C O P T                        |
     |                   =====================                   |
     |               Approximate Normal Coordinate               |
     |                Rational Function Optimizer                |
      ----------------------------------------------------------- 

          ...................................................
          :                      SETUP                      :
          :.................................................:
          :   optimization level            normal          :
          :   max. optcycles                   200          :
          :   ANC micro-cycles                  20          :
          :   degrees of freedom                 3          :
          :.................................................:
          :   RF solver                   davidson          :
          :   write xtbopt.log                true          :
          :   linear?                        false          :
          :   energy convergence         0.5000000E-05 Eh   :
          :   grad. convergence          0.1000000E-02 Eh/α :
          :   maximium RF displ.         1.0000000          :
          :   Hlow (freq-cutoff)         0.1000000E-01      :
          :   Hmax (freq-cutoff)         5.0000000          :
          :   S6 in model hess.         20.0000000          :
          ...................................................

generating ANC from model Hessian ...
Using Lindh-Hessian (1995)
 Shifting diagonal of input Hessian by    0.0000000000000000     
 Lowest  eigenvalues of input Hessian
   -0.000000   -0.000000    0.000000    0.000000    0.000000    0.000000
    1.119313    1.179226    1.876145
 Highest eigenvalues
    0.000000    0.000000    0.000000    1.119313    1.179226    1.876145


........................................................................
.............................. CYCLE    1 ..............................
........................................................................
   1    -10.0653379 -0.100653E+02  0.286E-07    2.59       0.0  T
   2    -10.0653379  0.355271E-14  0.179E-07    2.59  100000.0  T
   3    -10.0653379 -0.710543E-14  0.588E-08    2.59  100000.0  T
     SCC iter.                  ...        0 min,  0.000 sec
     gradient                   ...        0 min,  0.001 sec
 * total energy  :   -10.0441627 Eh     change        0.6590284E-12 Eh
   gradient norm :     0.1808042 Eh/α   predicted     0.0000000E+00 (-100.00%)
   displ. norm   :     0.1490007 α      lambda       -0.2690394E-01
   maximum displ.:     0.1483909 α      in ANC's #2, #3, #1, ...

........................................................................
.............................. CYCLE    2 ..............................
........................................................................
   1    -10.0927302 -0.100927E+02  0.149E+00    3.65       0.0  T
   2    -10.0932545 -0.524341E-03  0.846E-01    3.86       1.0  T
   3    -10.0932262  0.283130E-04  0.429E-01    3.72       1.0  T
   4    -10.0934012 -0.175013E-03  0.378E-02    3.80       1.5  T
   5    -10.0934015 -0.246280E-06  0.611E-03    3.80       9.5  T
   6    -10.0934016 -0.973381E-07  0.179E-03    3.80      32.2  T
   7    -10.0934016 -0.564050E-09  0.121E-04    3.80     476.6  T
   8    -10.0934016 -0.268692E-10  0.395E-05    3.80    1461.2  T
     SCC iter.                  ...        0 min,  0.000 sec
     gradient                   ...        0 min,  0.001 sec
 * total energy  :   -10.0634452 Eh     change       -0.1928256E-01 Eh
   gradient norm :     0.0794092 Eh/α   predicted    -0.1375062E-01 ( -28.69%)
   displ. norm   :     0.1125546 α      lambda       -0.8889485E-02
   maximum displ.:     0.1105035 α      in ANC's #2, #3, #1, ...

........................................................................
.............................. CYCLE    3 ..............................
........................................................................
   1    -10.1081590 -0.101082E+02  0.110E+00    4.04       0.0  T
   2    -10.1085496 -0.390590E-03  0.615E-01    4.03       1.0  T
   3    -10.1085623 -0.126797E-04  0.293E-01    4.01       1.0  T
   4    -10.1086066 -0.442938E-04  0.249E-02    4.00       2.3  T
   5    -10.1086067 -0.790199E-07  0.424E-03    4.00      13.6  T
   6    -10.1086067 -0.469132E-07  0.111E-03    4.00      51.9  T
   7    -10.1086067 -0.408168E-09  0.731E-05    4.00     789.6  T
   8    -10.1086067 -0.864908E-11  0.262E-05    4.00    2204.6  T
     SCC iter.                  ...        0 min,  0.000 sec
     gradient                   ...        0 min,  0.000 sec
 * total energy  :   -10.0675709 Eh     change       -0.4125671E-02 Eh
   gradient norm :     0.0218019 Eh/α   predicted    -0.4501052E-02 (   9.10%)
   displ. norm   :     0.0115335 α      lambda       -0.2451901E-03
   maximum displ.:     0.0107577 α      in ANC's #3, #2, #1, ...

........................................................................
.............................. CYCLE    4 ..............................
........................................................................
   1    -10.1066367 -0.101066E+02  0.102E-01    3.96       0.0  T
   2    -10.1066413 -0.464473E-05  0.599E-02    3.96       1.0  T
   3    -10.1066416 -0.290290E-06  0.305E-02    3.97       1.9  T
   4    -10.1066420 -0.332538E-06  0.128E-03    3.97      45.1  T
   5    -10.1066420 -0.155474E-09  0.235E-04    3.97     245.4  T
   6    -10.1066420 -0.306510E-10  0.109E-04    3.97     527.7  T
     SCC iter.                  ...        0 min,  0.000 sec
     gradient                   ...        0 min,  0.000 sec
 * total energy  :   -10.0677209 Eh     change       -0.1499638E-03 Eh
   gradient norm :     0.0065839 Eh/α   predicted    -0.1226095E-03 ( -18.24%)
   displ. norm   :     0.0064968 α      lambda       -0.4086514E-04
   maximum displ.:     0.0050813 α      in ANC's #3, #2, #1, ...

........................................................................
.............................. CYCLE    5 ..............................
........................................................................
   1    -10.1061683 -0.101062E+02  0.474E-02    3.96       0.0  T
   2    -10.1061683 -0.256143E-07  0.285E-02    3.96       2.0  T
   3    -10.1061683 -0.839394E-08  0.209E-03    3.96      27.7  T
   4    -10.1061683 -0.445599E-08  0.127E-03    3.96      45.4  T
   5    -10.1061683 -0.198989E-09  0.594E-05    3.96     972.1  T
   6    -10.1061683 -0.309086E-12  0.304E-05    3.96    1901.3  T
     SCC iter.                  ...        0 min,  0.000 sec
     gradient                   ...        0 min,  0.000 sec
 * total energy  :   -10.0677445 Eh     change       -0.2365896E-04 Eh
   gradient norm :     0.0011071 Eh/α   predicted    -0.2043353E-04 ( -13.63%)
   displ. norm   :     0.0026949 α      lambda       -0.1985777E-05
   maximum displ.:     0.0024427 α      in ANC's #2, #3, #1, ...

........................................................................
.............................. CYCLE    6 ..............................
........................................................................
   1    -10.1061778 -0.101062E+02  0.221E-02    3.96       0.0  T
   2    -10.1061778 -0.529150E-07  0.126E-02    3.96       4.6  T
   3    -10.1061778  0.735229E-08  0.389E-03    3.96      14.8  T
   4    -10.1061778 -0.165457E-07  0.568E-04    3.96     101.6  T
   5    -10.1061778 -0.321432E-10  0.326E-05    3.96    1770.2  T
     SCC iter.                  ...        0 min,  0.000 sec
     gradient                   ...        0 min,  0.000 sec
 * total energy  :   -10.0677454 Eh     change       -0.8839283E-06 Eh
   gradient norm :     0.0004815 Eh/α   predicted    -0.9935573E-06 (  12.40%)
   displ. norm   :     0.0007686 α      lambda       -0.2386377E-06
   maximum displ.:     0.0006417 α      in ANC's #2, #3, #1, ...

   *** GEOMETRY OPTIMIZATION CONVERGED AFTER 6 ITERATIONS ***

------------------------------------------------------------------------
 total energy gain   :        -0.0235827 Eh      -14.7984 kcal/mol
 total RMSD          :         0.1511722 a0        0.0800 Å
 total power (kW/mol):       -10.3194100 (step)-6663.4967 (real)
------------------------------------------------------------------------

 ANCopt (total)                0 d,  0 h,  0 min,  0.009 sec
 optimizer setup                ...        0 min,  0.000 sec (  0.700%)
 model hessian                  ...        0 min,  0.000 sec (  0.418%)
 ANC generation                 ...        0 min,  0.000 sec (  0.395%)
 coordinate transformation      ...        0 min,  0.000 sec (  0.123%)
 single point calculation       ...        0 min,  0.009 sec ( 93.908%)
 optimization log               ...        0 min,  0.000 sec (  1.097%)
 hessian update                 ...        0 min,  0.000 sec (  0.146%)
 rational function              ...        0 min,  0.000 sec (  1.077%)

================
 final structure:
================
3
 xtb: 6.2.2 (9d81278992624c895f80dd42a50cac0aa55982e2)
C        -0.23874750430827    0.66959575957461   -0.01423083139669
O        -0.56660971711057   -0.58020797796304   -0.03144347026361
O         0.80535722141884   -0.08938778161157    0.04567430166030

 Bond Distances (Angstroems)
 ---------------------------
C1-O2=1.2922         C1-O3=1.2922         O2-C1=1.2922         O2-O3=1.4592         O3-C1=1.2922         O3-O2=1.4592         
 O  C  Rav=1.2922 sigma=0.0000  Rmin=1.2922  Rmax=1.2922     2
 O  O  Rav=1.4592 sigma=0.0000  Rmin=1.4592  Rmax=1.4592     1

 selected bond angles (degree)
 --------------------
O3-C1-O2= 68.75                O3-O2-C1= 55.63                O2-O3-C1= 55.63                

 selected dihedral angles (degree)
 ---------------------------------

           -------------------------------------------------
          |                Final Singlepoint                |
           -------------------------------------------------

          ...................................................
          :                      SETUP                      :
          :.................................................:
          :  # basis functions                  12          :
          :  # atomic orbitals                  12          :
          :  # shells                            6          :
          :  # electrons                        16          :
          :  max. iterations                   250          :
          :  Hamiltonian                  GFN2-xTB          :
          :  restarted?                      false          :
          :  GBSA solvation                  false          :
          :  PC potential                    false          :
          :  electronic temp.          300.0000000     K    :
          :  accuracy                    1.0000000          :
          :  -> integral cutoff          0.2500000E+02      :
          :  -> integral neglect         0.1000000E-07      :
          :  -> SCF convergence          0.1000000E-05 Eh   :
          :  -> wf. convergence          0.1000000E-03 e    :
          :  Broyden damping             0.4000000          :
          ...................................................

 iter      E             dE          RMSdq      gap      omega  full diag
   1    -10.1061778 -0.101062E+02  0.696E-06    3.96       0.0  T
   2    -10.1061778 -0.159872E-13  0.488E-06    3.96   11837.5  T
   3    -10.1061778 -0.177636E-14  0.140E-06    3.96   41224.9  T

   *** convergence criteria satisfied after 3 iterations ***

         #    Occupation            Energy/Eh            Energy/eV
      -------------------------------------------------------------
         1        2.0000           -0.8482707             -23.0826
         2        2.0000           -0.7694523             -20.9379
         3        2.0000           -0.7086319             -19.2829
         4        2.0000           -0.6763557             -18.4046
         5        2.0000           -0.6578457             -17.9009
         6        2.0000           -0.6156744             -16.7534
         7        2.0000           -0.5187555             -14.1161
         8        2.0000           -0.4914919             -13.3742 (HOMO)
         9                         -0.3459322              -9.4133 (LUMO)
        10                         -0.2890842              -7.8664
        11                         -0.0084222              -0.2292
        12                          0.4066880              11.0665
      -------------------------------------------------------------
                  HL-Gap            0.1455597 Eh            3.9609 eV
             Fermi-level           -0.4187121 Eh          -11.3937 eV

 SCC (total)                   0 d,  0 h,  0 min,  0.001 sec
 SCC setup                      ...        0 min,  0.000 sec (  4.269%)
 Dispersion                     ...        0 min,  0.000 sec (  0.344%)
 integral evaluation            ...        0 min,  0.001 sec ( 42.882%)
 zeroth order Hamiltonian       ...        0 min,  0.000 sec (  0.585%)
 iterations                     ...        0 min,  0.000 sec ( 12.704%)
 molecular gradient             ...        0 min,  0.000 sec ( 35.927%)
 printout                       ...        0 min,  0.000 sec (  2.754%)

         :::::::::::::::::::::::::::::::::::::::::::::::::::::
         ::                     SUMMARY                     ::
         :::::::::::::::::::::::::::::::::::::::::::::::::::::
         :: total energy             -10.067745404366 Eh    ::
         :: gradient norm              0.000481556750 Eh/a0 ::
         :: HOMO-LUMO gap              3.960880066075 eV    ::
         ::.................................................::
         :: SCC energy               -10.106177823200 Eh    ::
         :: -> isotropic ES            0.005053141680 Eh    ::
         :: -> anisotropic ES          0.005724086582 Eh    ::
         :: -> anisotropic XC         -0.008305195434 Eh    ::
         :: -> dispersion             -0.000668383852 Eh    ::
         :: repulsion energy           0.038432418221 Eh    ::
         :: add. restraining           0.000000000000 Eh    ::
         :::::::::::::::::::::::::::::::::::::::::::::::::::::

           ------------------------------------------------- 
          |                Numerical Hessian                |
           ------------------------------------------------- 
step length          :   0.00500
SCC accuracy         :   0.30000
Hessian scale factor :   1.00000
frozen atoms in %    :   0.00000    0
RMS gradient         :   0.00048
estimated CPU  time      0.00 min
estimated wall time      0.00 min

writing file <hessian>.

 projected vibrational frequencies (cm-1)
eigval :       -0.00    -0.00    -0.00    -0.00     0.00     0.00
eigval :      902.76   986.96  1634.17
           -------------------------------------------------
          |                Property Printout                |
           -------------------------------------------------

    * Orbital Energies and Occupations

         #    Occupation            Energy/Eh            Energy/eV
      -------------------------------------------------------------
         1        2.0000           -0.8482707             -23.0826
         2        2.0000           -0.7694523             -20.9379
         3        2.0000           -0.7086319             -19.2829
         4        2.0000           -0.6763557             -18.4046
         5        2.0000           -0.6578457             -17.9009
         6        2.0000           -0.6156744             -16.7534
         7        2.0000           -0.5187555             -14.1161
         8        2.0000           -0.4914919             -13.3742 (HOMO)
         9                         -0.3459322              -9.4133 (LUMO)
        10                         -0.2890842              -7.8664
        11                         -0.0084222              -0.2292
        12                          0.4066880              11.0665
      -------------------------------------------------------------
                  HL-Gap            0.1455597 Eh            3.9609 eV
             Fermi-level           -0.4187121 Eh          -11.3937 eV

     #   Z        covCN         q      C6AA      α(0)
     1   6 C      1.710     0.127    28.245     8.604
     2   8 O      1.756    -0.064    15.318     5.285
     3   8 O      1.756    -0.064    15.318     5.285

 Mol. C6AA /au·bohr⁶  :        171.367733
 Mol. C8AA /au·bohr⁸  :       4030.823078
 Mol. α(0) /au        :         19.173874


Wiberg/Mayer (AO) data.
largest (>0.10) Wiberg bond orders for each atom
          total WBO             WBO to atom ...
     1  C   2.520        O    2 1.260    O    3 1.260
     2  O   2.212        C    1 1.260    O    3 0.952
     3  O   2.212        C    1 1.260    O    2 0.952

MOs/occ written to file <molden.input>


molecular dipole:
                 x           y           z       tot (Debye)
 q only:       -0.086       0.242      -0.005
   full:        0.042      -0.117       0.002       0.315
molecular quadrupole (traceless):
                xx          xy          yy          xz          yz          zz
 q only:       -0.257      -0.197       0.223      -0.016      -0.011       0.034
  q+dip:       -0.807      -0.008      -0.794      -0.137       0.002       1.601
   full:       -0.338       0.500      -1.568      -0.128       0.032       1.907

           -------------------------------------------------
          |                Geometry Summary                 |
           -------------------------------------------------

      molecular mass/u    :       44.0095457
   center of mass at/Å    :        0.0216378      -0.0606869       0.0012898
  moments of inertia/u·Å² :        0.9933744E+01   0.1703253E+02   0.2696627E+02
rotational constants/cm⁻¹ :        0.1697007E+01   0.9897318E+00   0.6251377E+00

 * 3 selected distances

     #   Z        #   Z                                     value/Å
     1   6 C      2   8 O                                 1.2922071
     1   6 C      3   8 O                                 1.2922072 (max)
     0 *** --     0 *** --                                0.0000000 (min)

 * 1 distinct bonds (by element types)

   Z      Z             #   av. dist./Å        max./Å        min./Å
   6 C    8 O           2     1.2922071     1.2922072     1.2922071

           -------------------------------------------------
          |               Frequency Printout                |
           -------------------------------------------------
 projected vibrational frequencies (cm-1)
eigval :       -0.00    -0.00    -0.00    -0.00     0.00     0.00
eigval :      902.76   986.96  1634.17
 reduced masses (amu)
   1: 14.55   2: 15.81   3: 14.63   4: 12.20   5: 15.79   6: 15.79   7: 14.17   8: 15.50
   9: 13.60
 IR intensities (amu)
   1:  0.10   2:  0.04   3:  0.12   4:  0.07   5:  0.02   6:  0.06   7:  1.86   8:  0.20
   9:  0.41
 Raman intensities (amu)
   1:  0.00   2:  0.00   3:  0.00   4:  0.00   5:  0.00   6:  0.00   7:  0.00   8:  0.00
   9:  0.00
 output can be read by thermo (or use thermo option).
 writing <g98.out> molden fake output.
 recommended (thermochemical) frequency scaling factor: 1.0
           -------------------------------------------------
          |             Thermodynamic Functions             |
           -------------------------------------------------
Molecule has the following symmetry elements: (C2) 2*(sigma) 
It seems to be the C2v point group

c2v symmetry found (for desy threshold:  0.10E+00) used in thermo

          ...................................................
          :                      SETUP                      :
          :.................................................:
          :  # frequencies                           3      :
          :  # imaginary freq.                       0      :
          :  linear?                             false      :
          :  only rotor calc.                    false      :
          :  symmetry                              c2v      :
          :  rotational number                       2      :
          :  scaling factor                  1.0000000      :
          :  rotor cutoff                   50.0000000 cm⁻¹ :
          :  imag. cutoff                  -20.0000000 cm⁻¹ :
          :.................................................:

    mode    ω/cm⁻¹     T·S(HO)/kcal·mol⁻¹    T·S(FR)/kcal·mol⁻¹   T·S(vib)
   ------------------------------------------------------------------------
   ------------------------------------------------------------------------

   temp. (K)  partition function   enthalpy   heat capacity  entropy
                                   cal/mol     cal/K/mol   cal/K/mol   J/K/mol
 298.15  VIB   1.02                   59.602      0.935      0.243
         ROT  0.258E+04              888.752      2.981     18.592
         INT  0.264E+04              948.354      3.915     18.835
         TR   0.282E+27             1481.254      4.968     37.255
         TOT                        2429.6083     8.8836    56.0898   234.6798

   temp. (K)  partition function   enthalpy   heat capacity  entropy
                                   cal/mol     cal/K/mol   cal/K/mol   J/K/mol
 120.00  VIB   1.00                    0.072      0.007      0.001
         ROT   659.                  357.707      2.981     15.879
         INT   659.                  357.779      2.988     15.880
         TR   0.721E+26              596.178      4.968     32.735
         TOT                         953.9567     7.9557    48.6149   203.4046

   temp. (K)  partition function   enthalpy   heat capacity  entropy
                                   cal/mol     cal/K/mol   cal/K/mol   J/K/mol
 100.00  VIB   1.00                    0.008      0.001      0.000
         ROT   501.                  298.089      2.981     15.335
         INT   501.                  298.097      2.982     15.336
         TR   0.549E+26              496.815      4.968     31.830
         TOT                         794.9118     7.9501    47.1654   197.3402

   temp. (K)  partition function   enthalpy   heat capacity  entropy
                                   cal/mol     cal/K/mol   cal/K/mol   J/K/mol
  80.00  VIB   1.00                    0.000      0.000     -0.000
         ROT   359.                  238.471      2.981     14.670
         INT   359.                  238.471      2.981     14.670
         TR   0.393E+26              397.452      4.968     30.722
         TOT                         635.9235     7.9491    45.3921   189.9207

   temp. (K)  partition function   enthalpy   heat capacity  entropy
                                   cal/mol     cal/K/mol   cal/K/mol   J/K/mol
  60.00  VIB   1.00                    0.000      0.000     -0.000
         ROT   233.                  178.853      2.981     13.813
         INT   233.                  178.853      2.981     13.813
         TR   0.255E+26              298.089      4.968     29.293
         TOT                         476.9424     7.9490    43.1060   180.3556

   temp. (K)  partition function   enthalpy   heat capacity  entropy
                                   cal/mol     cal/K/mol   cal/K/mol   J/K/mol
  40.00  VIB   1.00                    0.000      0.000     -0.000
         ROT   127.                  119.236      2.981     12.604
         INT   127.                  119.236      2.981     12.604
         TR   0.139E+26              198.726      4.968     27.280
         TOT                         317.9616     7.9490    39.8839   166.8744

   temp. (K)  partition function   enthalpy   heat capacity  entropy
                                   cal/mol     cal/K/mol   cal/K/mol   J/K/mol
  20.00  VIB   1.00                    0.000      0.000     -0.000
         ROT   44.8                   59.618      2.981     10.538
         INT   44.8                   59.618      2.981     10.538
         TR   0.491E+25               99.363      4.968     23.838
         TOT                         158.9808     7.9490    34.3758   143.8282

   temp. (K)  partition function   enthalpy   heat capacity  entropy
                                   cal/mol     cal/K/mol   cal/K/mol   J/K/mol
  10.00  VIB   1.00                    0.000      0.000     -0.000
         ROT   15.8                   29.809      2.981      8.472
         INT   15.8                   29.809      2.981      8.472
         TR   0.174E+25               49.681      4.968     20.396
         TOT                          79.4904     7.9490    28.8676   120.7819

       T/K    H(0)-H(T)+PV         H(T)/Eh          T*S/Eh         G(T)/Eh
   ------------------------------------------------------------------------
    298.15    0.387183E-02    0.118998E-01    0.266501E-01   -0.147503E-01
    120.00    0.152023E-02    0.954823E-02    0.929673E-02    0.251508E-03
    100.00    0.126677E-02    0.929478E-02    0.751629E-02    0.177849E-02
     80.00    0.101341E-02    0.904142E-02    0.578696E-02    0.325446E-02
     60.00    0.760056E-03    0.878806E-02    0.412163E-02    0.466643E-02
     40.00    0.506704E-03    0.853471E-02    0.254236E-02    0.599235E-02
     20.00    0.253352E-03    0.828136E-02    0.109563E-02    0.718573E-02
     10.00    0.126676E-03    0.815468E-02    0.460034E-03    0.769465E-02 (used)
   ------------------------------------------------------------------------

         :::::::::::::::::::::::::::::::::::::::::::::::::::::
         ::                  THERMODYNAMIC                  ::
         :::::::::::::::::::::::::::::::::::::::::::::::::::::
         :: total free energy         -10.060050755258 Eh   ::
         ::.................................................::
         :: total energy              -10.067745404366 Eh   ::
         :: zero point energy           0.008028007170 Eh   ::
         :: G(RRHO) w/o ZPVE           -0.000333358062 Eh   ::
         :: G(RRHO) contrib.            0.007694649108 Eh   ::
         :::::::::::::::::::::::::::::::::::::::::::::::::::::

optimized geometry written to: xtbopt.xyz


           -------------------------------------------------
          | TOTAL ENERGY              -10.067745404366 Eh   |
          | TOTAL ENTHALPY            -10.059590721180 Eh   |
          | TOTAL FREE ENERGY         -10.060050755258 Eh   |
          | GRADIENT NORM               0.000481557127 Eh/α |
          | HOMO-LUMO GAP               3.960879957506 eV   |
           -------------------------------------------------

------------------------------------------------------------------------
 * finished run on 2020/05/12 at 11:44:49.393     
------------------------------------------------------------------------
 total:
 * wall-time:     0 d,  0 h,  0 min,  0.055 sec
 *  cpu-time:     0 d,  0 h,  0 min,  0.055 sec
 * ratio c/w:     1.000 speedup
 SCF:
 * wall-time:     0 d,  0 h,  0 min,  0.002 sec
 *  cpu-time:     0 d,  0 h,  0 min,  0.002 sec
 * ratio c/w:     1.000 speedup
 ANC optimizer:
 * wall-time:     0 d,  0 h,  0 min,  0.011 sec
 *  cpu-time:     0 d,  0 h,  0 min,  0.011 sec
 * ratio c/w:     1.000 speedup
 numerical hessian:
 * wall-time:     0 d,  0 h,  0 min,  0.026 sec
 *  cpu-time:     0 d,  0 h,  0 min,  0.026 sec
 * ratio c/w:     1.000 speedup

