      -----------------------------------------------------------      
     |                   =====================                   |     
     |                           x T B                           |     
     |                   =====================                   |     
     |                         S. Grimme                         |     
     |          Mulliken Center for Theoretical Chemistry        |     
     |                    University of Bonn                     |     
      -----------------------------------------------------------      

   * xtb version 6.2.2 (9d81278992624c895f80dd42a50cac0aa55982e2) compiled by '@Darwin' on 04/03/2020

   xtb is free software: you can redistribute it and/or modify it under
   the terms of the GNU Lesser General Public License as published by
   the Free Software Foundation, either version 3 of the License, or
   (at your option) any later version.
   
   xtb is distributed in the hope that it will be useful,
   but WITHOUT ANY WARRANTY; without even the implied warranty of
   MERCHANTABILITY or FITNESS FOR A PARTICULAR PURPOSE.  See the
   GNU Lesser General Public License for more details.
   
   Cite this work as:
   * S. Grimme, C. Bannwarth, P. Shushkov, J. Chem. Theory Comput., 2017,
     13, 1989-2009. DOI: 10.1021/acs.jctc.7b00118
   * C. Bannwarth, S. Ehlert and S. Grimme., J. Chem. Theory Comput., 2019,
     15, 1652-1671. DOI: 10.1021/acs.jctc.8b01176
   * P. Pracht, E. Caldeweyher, S. Ehlert, S. Grimme, ChemRxiv, 2019, preprint.
     DOI: 10.26434/chemrxiv.8326202.v1
   
   for DFT-D4:
   * E. Caldeweyher, C. Bannwarth and S. Grimme, J. Chem. Phys., 2017,
     147, 034112. DOI: 10.1063/1.4993215
   * E. Caldeweyher, S. Ehlert, A. Hansen, H. Neugebauer, S. Spicher,
     C. Bannwarth and S. Grimme, J. Chem. Phys., 2019, 150, 154122.
     DOI: 10.1063/1.5090222
   
   for sTDA-xTB:
   * S. Grimme and C. Bannwarth, J. Chem. Phys., 2016, 145, 054103.
     DOI: 10.1063/1.4959605
   
   in the mass-spec context:
   * V. Asgeirsson, C. Bauer and S. Grimme, Chem. Sci., 2017, 8, 4879.
     DOI: 10.1039/c7sc00601b
   
   for metadynamics refer to:
   * S. Grimme, J. Chem. Theory Comput., 2019, 155, 2847-2862
     DOI: 10.1021/acs.jctc.9b00143
   
   with help from (in alphabetical order)
   C. Bannwarth, F. Bohle, G. Brandenburg, E. Caldeweyher, M. Checinski,
   S. Dohm, S. Ehlert, S. Ehrlich, F. März, H. Neugebauer, J. Pisarek,
   P. Pracht, P. Shushkov, and S. Spicher.
   
 * started run on 2020/05/12 at 11:45:10.508     

           -------------------------------------------------
          |                Calculation Setup                |
           -------------------------------------------------

          program call               : xtb --input H1C4_6_S_3.input H1C4_6_S_3.xyz --ohess --molden --namespace H1C4_6_S_3 output.out
          calculation namespace      : H1C4_6_S_3
          coordinate file            : H1C4_6_S_3.xyz
          number of atoms            :                     5
          number of electrons        :                    17
          charge                     :                     0
          spin                       :                   1.5
          first test random number   :      0.72833548874035

   ID    Z sym.   atoms
    1    6 C      1-4
    2    1 H      5

           -------------------------------------------------
          |                 G F N 2 - x T B                 |
           -------------------------------------------------

        Reference                      10.1021/acs.jctc.8b01176
      * Hamiltonian:
        H0-scaling (s, p, d)           1.850000    2.230000    2.230000
        zeta-weighting                 0.500000
      * Dispersion:
        s8                             2.700000
        a1                             0.520000
        a2                             5.000000
        s9                             5.000000
      * Repulsion:
        kExp                           1.500000    1.000000
        rExp                           1.000000
      * Coulomb:
        alpha                          2.000000
        third order                    shell-resolved
        anisotropic                    true
        a3                             3.000000
        a5                             4.000000
        cn-shift                       1.200000
        cn-exp                         4.000000
        max-rad                        5.000000


          ...................................................
          :                      SETUP                      :
          :.................................................:
          :  # basis functions                  17          :
          :  # atomic orbitals                  17          :
          :  # shells                            9          :
          :  # electrons                        17          :
          :  max. iterations                   250          :
          :  Hamiltonian                  GFN2-xTB          :
          :  restarted?                      false          :
          :  GBSA solvation                  false          :
          :  PC potential                    false          :
          :  electronic temp.          300.0000000     K    :
          :  accuracy                    1.0000000          :
          :  -> integral cutoff          0.2500000E+02      :
          :  -> integral neglect         0.1000000E-07      :
          :  -> SCF convergence          0.1000000E-05 Eh   :
          :  -> wf. convergence          0.1000000E-03 e    :
          :  Broyden damping             0.4000000          :
          ...................................................

 iter      E             dE          RMSdq      gap      omega  full diag
   1     -8.5594561 -0.855946E+01  0.830E+00    0.66       0.0  T
   2     -8.4112480  0.148208E+00  0.615E+00    0.89       1.0  T
   3     -7.4227543  0.988494E+00  0.994E+00    1.39       1.0  T
   4     -8.1319143 -0.709160E+00  0.689E+00    0.54       1.0  T
   5     -8.5683007 -0.436386E+00  0.232E+00    0.60       1.0  T
   6     -8.5901583 -0.218576E-01  0.144E+00    0.64       1.0  T
   7     -8.5940985 -0.394021E-02  0.111E+00    0.63       1.0  T
   8     -8.5971383 -0.303981E-02  0.861E-01    0.63       1.0  T
   9     -8.5988664 -0.172810E-02  0.195E-01    0.64       1.0  T
  10     -8.5988604  0.598250E-05  0.181E-01    0.64       1.0  T
  11     -8.5991712 -0.310712E-03  0.369E-02    0.64       1.2  T
  12     -8.5991775 -0.637026E-05  0.219E-02    0.64       2.0  T
  13     -8.5991771  0.458992E-06  0.108E-02    0.64       4.1  T
  14     -8.5991777 -0.675030E-06  0.270E-03    0.64      16.6  T
  15     -8.5991778 -0.215275E-07  0.730E-04    0.64      61.3  T
  16     -8.5991778 -0.136129E-08  0.129E-04    0.64     347.9  T

   *** convergence criteria satisfied after 16 iterations ***

         #    Occupation            Energy/Eh            Energy/eV
      -------------------------------------------------------------
         1        2.0000           -0.6989389             -19.0191
       ...           ...                  ...                  ...
         4        2.0000           -0.5534642             -15.0605
         5        2.0000           -0.5089796             -13.8500
         6        2.0000           -0.4748268             -12.9207
         7        2.0000           -0.4620938             -12.5742
         8        1.0000           -0.4419326             -12.0256
         9        1.0000           -0.3956791             -10.7670
        10        1.0000           -0.3663781              -9.9697 (HOMO)
        11        0.0000           -0.3427314              -9.3262 (LUMO)
        12                         -0.3272206              -8.9041
        13                         -0.1083421              -2.9481
        14                          0.0742166               2.0195
        15                          0.1282965               3.4911
       ...                                ...                  ...
        17                          0.1616441               4.3986
      -------------------------------------------------------------
                  HL-Gap            0.0236467 Eh            0.6435 eV
             Fermi-level           -0.4032840 Eh          -10.9739 eV

 SCC (total)                   0 d,  0 h,  0 min,  0.004 sec
 SCC setup                      ...        0 min,  0.000 sec (  2.185%)
 Dispersion                     ...        0 min,  0.000 sec (  0.460%)
 integral evaluation            ...        0 min,  0.001 sec ( 26.191%)
 zeroth order Hamiltonian       ...        0 min,  0.000 sec (  0.460%)
 iterations                     ...        0 min,  0.002 sec ( 42.173%)
 molecular gradient             ...        0 min,  0.001 sec ( 25.917%)
 printout                       ...        0 min,  0.000 sec (  2.372%)

         :::::::::::::::::::::::::::::::::::::::::::::::::::::
         ::                     SUMMARY                     ::
         :::::::::::::::::::::::::::::::::::::::::::::::::::::
         :: total energy              -8.526799356090 Eh    ::
         :: gradient norm              0.206450424074 Eh/a0 ::
         :: HOMO-LUMO gap              0.643459114687 eV    ::
         ::.................................................::
         :: SCC energy                -8.599177770201 Eh    ::
         :: -> isotropic ES           -0.018875101825 Eh    ::
         :: -> anisotropic ES         -0.000388515406 Eh    ::
         :: -> anisotropic XC          0.006558383828 Eh    ::
         :: -> dispersion             -0.002281244778 Eh    ::
         :: repulsion energy           0.072378347554 Eh    ::
         :: add. restraining           0.000000000000 Eh    ::
         :::::::::::::::::::::::::::::::::::::::::::::::::::::

      ----------------------------------------------------------- 
     |                   =====================                   |
     |                        A N C O P T                        |
     |                   =====================                   |
     |               Approximate Normal Coordinate               |
     |                Rational Function Optimizer                |
      ----------------------------------------------------------- 

          ...................................................
          :                      SETUP                      :
          :.................................................:
          :   optimization level            normal          :
          :   max. optcycles                   200          :
          :   ANC micro-cycles                  20          :
          :   degrees of freedom                 9          :
          :.................................................:
          :   RF solver                   davidson          :
          :   write xtbopt.log                true          :
          :   linear?                        false          :
          :   energy convergence         0.5000000E-05 Eh   :
          :   grad. convergence          0.1000000E-02 Eh/α :
          :   maximium RF displ.         1.0000000          :
          :   Hlow (freq-cutoff)         0.1000000E-01      :
          :   Hmax (freq-cutoff)         5.0000000          :
          :   S6 in model hess.         20.0000000          :
          ...................................................

generating ANC from model Hessian ...
Using Lindh-Hessian (1995)
 Shifting diagonal of input Hessian by    0.0000000000000000     
 Lowest  eigenvalues of input Hessian
   -0.000000   -0.000000    0.000000    0.000000    0.000000    0.000000
    0.024571    0.050324    0.098059    0.131085    0.608357    0.637366
    0.802408    0.915537    1.323489
 Highest eigenvalues
    0.131085    0.608357    0.637366    0.802408    0.915537    1.323489


........................................................................
.............................. CYCLE    1 ..............................
........................................................................
   1     -8.5991778 -0.859918E+01  0.908E-05    0.64       0.0  T
   2     -8.5991778  0.606923E-09  0.245E-04    0.64     182.2  T
   3     -8.5991778 -0.516538E-09  0.127E-04    0.64     351.5  T
     SCC iter.                  ...        0 min,  0.000 sec
     gradient                   ...        0 min,  0.001 sec
 * total energy  :    -8.5267994 Eh     change        0.1075078E-08 Eh
   gradient norm :     0.2064510 Eh/α   predicted     0.0000000E+00 (-100.00%)
   displ. norm   :     0.4005598 α      lambda       -0.5748074E-01
   maximum displ.:     0.2785424 α      in ANC's #1, #7, #3, ...

........................................................................
.............................. CYCLE    2 ..............................
........................................................................
   1     -8.6730169 -0.867302E+01  0.181E+00    0.79       0.0  T
   2     -8.5683579  0.104659E+00  0.366E+00    0.86       1.0  T
   3     -8.6754753 -0.107117E+00  0.119E+00    0.77       1.0  T
   4     -8.6752816  0.193636E-03  0.109E+00    0.78       1.0  T
   5     -8.6814081 -0.612653E-02  0.285E-01    0.76       1.0  T
   6     -8.6818398 -0.431605E-03  0.120E-01    0.76       1.0  T
   7     -8.6818887 -0.489395E-04  0.602E-02    0.76       1.0  T
   8     -8.6819045 -0.158236E-04  0.754E-03    0.76       5.9  T
   9     -8.6819047 -0.224072E-06  0.183E-03    0.76      24.4  T
  10     -8.6819047 -0.282219E-08  0.508E-04    0.76      88.0  T
  11     -8.6819047 -0.320901E-09  0.104E-04    0.76     428.7  T
     SCC iter.                  ...        0 min,  0.001 sec
     gradient                   ...        0 min,  0.001 sec
 * total energy  :    -8.5735976 Eh     change       -0.4679826E-01 Eh
   gradient norm :     0.1190160 Eh/α   predicted    -0.3335171E-01 ( -28.73%)
   displ. norm   :     0.4773024 α      lambda       -0.4307485E-01
   maximum displ.:     0.2827918 α      in ANC's #1, #7, #3, ...

........................................................................
.............................. CYCLE    3 ..............................
........................................................................
   1     -8.7611436 -0.876114E+01  0.211E+00    0.80       0.0  T
   2     -8.6916925  0.694511E-01  0.322E+00    0.79       1.0  T
   3     -8.7580488 -0.663563E-01  0.148E+00    0.81       1.0  T
   4     -8.7638840 -0.583517E-02  0.939E-01    0.76       1.0  T
   5     -8.7683082 -0.442421E-02  0.247E-01    0.76       1.0  T
   6     -8.7684573 -0.149080E-03  0.162E-01    0.76       1.0  T
   7     -8.7685540 -0.967258E-04  0.411E-02    0.76       1.1  T
   8     -8.7685592 -0.516316E-05  0.867E-03    0.76       5.2  T
   9     -8.7685595 -0.293270E-06  0.204E-03    0.75      21.9  T
  10     -8.7685595 -0.104132E-07  0.588E-04    0.75      76.0  T
  11     -8.7685595 -0.284729E-08  0.162E-04    0.76     276.1  T
     SCC iter.                  ...        0 min,  0.001 sec
     gradient                   ...        0 min,  0.001 sec
 * total energy  :    -8.5952636 Eh     change       -0.2166598E-01 Eh
   gradient norm :     0.0782963 Eh/α   predicted    -0.2644402E-01 (  22.05%)
   displ. norm   :     0.5716111 α      lambda       -0.2086572E-01
   maximum displ.:     0.4882464 α      in ANC's #1, #3, #2, ...

........................................................................
.............................. CYCLE    4 ..............................
........................................................................
   1     -8.7350366 -0.873504E+01  0.186E+00    0.75       0.0  T
   2     -8.6740652  0.609715E-01  0.262E+00    0.59       1.0  T
   3     -8.7125286 -0.384634E-01  0.208E+00    0.88       1.0  T
   4     -8.7345618 -0.220332E-01  0.882E-01    0.74       1.0  T
   5     -8.7386025 -0.404072E-02  0.372E-01    0.69       1.0  T
   6     -8.7390719 -0.469390E-03  0.249E-01    0.68       1.0  T
   7     -8.7390869 -0.150349E-04  0.244E-01    0.68       1.0  T
   8     -8.7392630 -0.176128E-03  0.866E-02    0.66       1.0  T
   9     -8.7393231 -0.600604E-04  0.142E-02    0.66       3.1  T
  10     -8.7393242 -0.104384E-05  0.168E-03    0.67      26.6  T
  11     -8.7393241  0.321618E-08  0.103E-03    0.67      43.4  T
  12     -8.7393242 -0.417788E-08  0.162E-04    0.67     276.6  T
  13     -8.7393242 -0.130365E-09  0.434E-05    0.67    1030.6  T
     SCC iter.                  ...        0 min,  0.001 sec
     gradient                   ...        0 min,  0.001 sec
 * total energy  :    -8.6050324 Eh     change       -0.9768762E-02 Eh
   gradient norm :     0.0648509 Eh/α   predicted    -0.1384167E-01 (  41.69%)
   displ. norm   :     0.1409009 α      lambda       -0.5802539E-02
   maximum displ.:     0.0981284 α      in ANC's #3, #7, #5, ...

........................................................................
.............................. CYCLE    5 ..............................
........................................................................
   1     -8.7465235 -0.874652E+01  0.629E-01    0.63       0.0  T
   2     -8.7318959  0.146276E-01  0.140E+00    0.52       1.0  T
   3     -8.7465649 -0.146689E-01  0.448E-01    0.63       1.0  T
   4     -8.7473251 -0.760280E-03  0.172E-01    0.60       1.0  T
   5     -8.7474600 -0.134876E-03  0.467E-02    0.60       1.0  T
   6     -8.7474665 -0.645147E-05  0.277E-02    0.60       1.6  T
   7     -8.7474686 -0.212119E-05  0.137E-02    0.60       3.3  T
   8     -8.7474689 -0.345598E-06  0.800E-03    0.60       5.6  T
   9     -8.7474692 -0.298832E-06  0.316E-03    0.60      14.1  T
  10     -8.7474693 -0.683316E-07  0.399E-04    0.60     112.0  T
  11     -8.7474693 -0.495387E-09  0.575E-05    0.60     777.8  T
     SCC iter.                  ...        0 min,  0.001 sec
     gradient                   ...        0 min,  0.001 sec
 * total energy  :    -8.6093342 Eh     change       -0.4301809E-02 Eh
   gradient norm :     0.0391852 Eh/α   predicted    -0.2958869E-02 ( -31.22%)
   displ. norm   :     0.3148541 α      lambda       -0.7258861E-02
   maximum displ.:     0.2017434 α      in ANC's #1, #7, #3, ...

........................................................................
.............................. CYCLE    6 ..............................
........................................................................
   1     -8.7631782 -0.876318E+01  0.107E+00    0.76       0.0  T
   2     -8.6199508  0.143227E+00  0.386E+00    0.50       1.0  T
   3     -8.7636843 -0.143733E+00  0.730E-01    0.73       1.0  T
   4     -8.7639938 -0.309516E-03  0.585E-01    0.72       1.0  T
   5     -8.7652679 -0.127409E-02  0.327E-01    0.70       1.0  T
   6     -8.7653153 -0.474062E-04  0.290E-01    0.70       1.0  T
   7     -8.7656869 -0.371580E-03  0.209E-01    0.69       1.0  T
   8     -8.7657256 -0.386955E-04  0.193E-01    0.69       1.0  T
   9     -8.7659006 -0.175052E-03  0.109E-01    0.68       1.0  T
  10     -8.7659353 -0.346736E-04  0.801E-02    0.67       1.0  T
  11     -8.7659740 -0.387100E-04  0.280E-03    0.66      16.0  T
  12     -8.7659739  0.671712E-07  0.345E-03    0.66      13.0  T
  13     -8.7659740 -0.771555E-07  0.837E-04    0.66      53.4  T
  14     -8.7659740 -0.340449E-08  0.272E-04    0.66     164.1  T
     SCC iter.                  ...        0 min,  0.001 sec
     gradient                   ...        0 min,  0.001 sec
 * total energy  :    -8.6140372 Eh     change       -0.4703029E-02 Eh
   gradient norm :     0.0184755 Eh/α   predicted    -0.3989226E-02 ( -15.18%)
   displ. norm   :     0.2667404 α      lambda       -0.2696516E-02
   maximum displ.:     0.1524452 α      in ANC's #3, #7, #1, ...

........................................................................
.............................. CYCLE    7 ..............................
........................................................................
   1     -8.7603905 -0.876039E+01  0.110E+00    0.78       0.0  T
   2     -8.6577015  0.102689E+00  0.383E+00    0.54       1.0  T
   3     -8.7588197 -0.101118E+00  0.928E-01    0.67       1.0  T
   4     -8.7587070  0.112649E-03  0.758E-01    0.73       1.0  T
   5     -8.7613935 -0.268645E-02  0.139E-01    0.72       1.0  T
   6     -8.7614681 -0.745974E-04  0.694E-02    0.71       1.0  T
   7     -8.7614535  0.145095E-04  0.650E-02    0.71       1.0  T
   8     -8.7614581 -0.459050E-05  0.518E-02    0.71       1.0  T
   9     -8.7614616 -0.348989E-05  0.449E-02    0.71       1.0  T
  10     -8.7614671 -0.549303E-05  0.333E-02    0.71       1.3  T
  11     -8.7614717 -0.457641E-05  0.189E-02    0.71       2.4  T
  12     -8.7614734 -0.171298E-05  0.813E-03    0.72       5.5  T
  13     -8.7614738 -0.376994E-06  0.411E-04    0.72     108.9  T
  14     -8.7614738 -0.298478E-09  0.359E-04    0.72     124.4  T
     SCC iter.                  ...        0 min,  0.001 sec
     gradient                   ...        0 min,  0.001 sec
 * total energy  :    -8.6158173 Eh     change       -0.1780052E-02 Eh
   gradient norm :     0.0197034 Eh/α   predicted    -0.1444188E-02 ( -18.87%)
   displ. norm   :     0.2080168 α      lambda       -0.2164216E-02
   maximum displ.:     0.1452389 α      in ANC's #7, #3, #5, ...

........................................................................
.............................. CYCLE    8 ..............................
........................................................................
   1     -8.7664487 -0.876645E+01  0.109E+00    0.80       0.0  T
   2     -8.7535110  0.129376E-01  0.128E+00    1.04       1.0  T
   3     -8.6539248  0.995862E-01  0.419E+00    0.61       1.0  T
   4     -8.7415835 -0.876587E-01  0.210E+00    0.74       1.0  T
   5     -8.7672960 -0.257125E-01  0.245E-01    0.86       1.0  T
   6     -8.7658390  0.145702E-02  0.587E-01    0.88       1.0  T
   7     -8.7654055  0.433515E-03  0.615E-01    0.89       1.0  T
   8     -8.7659509 -0.545361E-03  0.519E-01    0.89       1.0  T
   9     -8.7671995 -0.124861E-02  0.228E-01    0.86       1.0  T
  10     -8.7673260 -0.126506E-03  0.170E-01    0.86       1.0  T
  11     -8.7674203 -0.942811E-04  0.960E-02    0.85       1.0  T
  12     -8.7674505 -0.302048E-04  0.545E-02    0.85       1.0  T
  13     -8.7674647 -0.142365E-04  0.106E-02    0.84       4.2  T
  14     -8.7674653 -0.561800E-06  0.184E-03    0.84      24.3  T
  15     -8.7674653 -0.143771E-07  0.754E-04    0.84      59.3  T
  16     -8.7674653 -0.281805E-08  0.213E-04    0.84     210.3  T
     SCC iter.                  ...        0 min,  0.001 sec
     gradient                   ...        0 min,  0.001 sec
 * total energy  :    -8.6173066 Eh     change       -0.1489342E-02 Eh
   gradient norm :     0.0226603 Eh/α   predicted    -0.1128930E-02 ( -24.20%)
   displ. norm   :     0.2430918 α      lambda       -0.1852006E-02
   maximum displ.:     0.1455481 α      in ANC's #3, #7, #5, ...

........................................................................
.............................. CYCLE    9 ..............................
........................................................................
   1     -8.7160323 -0.871603E+01  0.314E+00    0.76       0.0  T
   2     -8.4381419  0.277890E+00  0.545E+00    2.13       1.0  T
   3     -8.7541373 -0.315995E+00  0.118E+00    0.87       1.0  T
   4     -8.7507286  0.340873E-02  0.160E+00    1.08       1.0  T
   5     -8.7545783 -0.384967E-02  0.125E+00    1.01       1.0  T
   6     -8.7618131 -0.723485E-02  0.441E-01    0.96       1.0  T
   7     -8.7002458  0.615674E-01  0.337E+00    0.76       1.0  T
   8     -8.7616928 -0.614470E-01  0.473E-01    0.93       1.0  T
   9     -8.7625098 -0.817064E-03  0.210E-01    0.96       1.0  T
  10     -8.7626939 -0.184045E-03  0.120E-01    0.95       1.0  T
  11     -8.7627407 -0.468085E-04  0.420E-02    0.95       1.1  T
  12     -8.7627348  0.590546E-05  0.422E-02    0.96       1.1  T
  13     -8.7627367 -0.195384E-05  0.329E-02    0.96       1.4  T
  14     -8.7627407 -0.399170E-05  0.134E-02    0.95       3.3  T
  15     -8.7627415 -0.770235E-06  0.306E-03    0.95      14.6  T
  16     -8.7627415 -0.374057E-07  0.903E-04    0.95      49.5  T
  17     -8.7627415 -0.284990E-08  0.363E-04    0.95     123.4  T
     SCC iter.                  ...        0 min,  0.001 sec
     gradient                   ...        0 min,  0.001 sec
 * total energy  :    -8.6178820 Eh     change       -0.5754199E-03 Eh
   gradient norm :     0.0303869 Eh/α   predicted    -0.9807230E-03 (  70.44%)
   displ. norm   :     0.1871136 α      lambda       -0.2662124E-02
   maximum displ.:     0.1756427 α      in ANC's #1, #2, #9, ...

........................................................................
.............................. CYCLE   10 ..............................
........................................................................
   1     -8.7685657 -0.876857E+01  0.176E+00    0.95       0.0  T
   2     -8.6277718  0.140794E+00  0.398E+00    1.83       1.0  T
   3     -8.7393089 -0.111537E+00  0.250E+00    0.87       1.0  T
   4     -8.7769470 -0.376381E-01  0.844E-01    1.01       1.0  T
   5     -8.7579061  0.190409E-01  0.208E+00    1.19       1.0  T
   6     -8.7668291 -0.892308E-02  0.157E+00    1.14       1.0  T
   7     -8.7658868  0.942345E-03  0.163E+00    1.14       1.0  T
   8     -8.7797153 -0.138285E-01  0.530E-01    1.03       1.0  T
   9     -8.7800170 -0.301681E-03  0.412E-01    1.07       1.0  T
  10     -8.7807197 -0.702647E-03  0.190E-01    1.06       1.0  T
  11     -8.7805099  0.209800E-03  0.235E-01    1.06       1.0  T
  12     -8.7806548 -0.144958E-03  0.143E-01    1.06       1.0  T
  13     -8.7807248 -0.699708E-04  0.747E-02    1.06       1.0  T
  14     -8.7807528 -0.280347E-04  0.117E-02    1.05       3.8  T
  15     -8.7807534 -0.596294E-06  0.180E-03    1.05      24.9  T
  16     -8.7807534 -0.124457E-07  0.194E-04    1.05     230.7  T
  17     -8.7807534  0.224059E-09  0.263E-04    1.05     170.3  T
     SCC iter.                  ...        0 min,  0.002 sec
     gradient                   ...        0 min,  0.001 sec
 * total energy  :    -8.6191686 Eh     change       -0.1286572E-02 Eh
   gradient norm :     0.0303026 Eh/α   predicted    -0.1377666E-02 (   7.08%)
   displ. norm   :     0.0997408 α      lambda       -0.1367770E-02
   maximum displ.:     0.0700203 α      in ANC's #1, #3, #4, ...

........................................................................
.............................. CYCLE   11 ..............................
........................................................................
   1     -8.7759586 -0.877596E+01  0.642E-01    1.08       0.0  T
   2     -8.7130078  0.629508E-01  0.298E+00    1.37       1.0  T
   3     -8.7607919 -0.477841E-01  0.162E+00    1.01       1.0  T
   4     -8.7738201 -0.130281E-01  0.758E-01    1.07       1.0  T
   5     -8.7768063 -0.298629E-02  0.220E-01    1.10       1.0  T
   6     -8.7766995  0.106858E-03  0.278E-01    1.11       1.0  T
   7     -8.7764392  0.260324E-03  0.326E-01    1.12       1.0  T
   8     -8.7762021  0.237100E-03  0.389E-01    1.12       1.0  T
   9     -8.7770187 -0.816676E-03  0.417E-02    1.10       1.1  T
  10     -8.7770190 -0.231798E-06  0.331E-02    1.10       1.4  T
  11     -8.7770131  0.586734E-05  0.335E-02    1.10       1.3  T
  12     -8.7770180 -0.487683E-05  0.154E-02    1.10       2.9  T
  13     -8.7770193 -0.128319E-05  0.219E-03    1.10      20.4  T
  14     -8.7770193 -0.238925E-07  0.703E-04    1.10      63.6  T
  15     -8.7770193 -0.269589E-08  0.686E-05    1.10     651.8  T
     SCC iter.                  ...        0 min,  0.001 sec
     gradient                   ...        0 min,  0.001 sec
 * total energy  :    -8.6200231 Eh     change       -0.8544985E-03 Eh
   gradient norm :     0.0217757 Eh/α   predicted    -0.6906874E-03 ( -19.17%)
   displ. norm   :     0.1488588 α      lambda       -0.1458750E-02
   maximum displ.:     0.0921077 α      in ANC's #7, #1, #2, ...

........................................................................
.............................. CYCLE   12 ..............................
........................................................................
   1     -8.7771446 -0.877714E+01  0.437E-01    1.16       0.0  T
   2     -8.7768442  0.300435E-03  0.274E-01    1.16       1.0  T
   3     -8.7463844  0.304598E-01  0.217E+00    1.04       1.0  T
   4     -8.7739718 -0.275873E-01  0.768E-01    1.15       1.0  T
   5     -8.7760661 -0.209431E-02  0.423E-01    1.15       1.0  T
   6     -8.7766688 -0.602731E-03  0.285E-01    1.16       1.0  T
   7     -8.7771790 -0.510183E-03  0.742E-02    1.17       1.0  T
   8     -8.7771850 -0.596372E-05  0.641E-02    1.17       1.0  T
   9     -8.7771969 -0.119290E-04  0.939E-03    1.17       4.8  T
  10     -8.7771948  0.205990E-05  0.214E-02    1.17       2.1  T
  11     -8.7771973 -0.241709E-05  0.365E-03    1.17      12.3  T
  12     -8.7771973 -0.235450E-07  0.184E-03    1.17      24.3  T
  13     -8.7771973 -0.177699E-07  0.271E-04    1.17     165.3  T
  14     -8.7771973 -0.344157E-09  0.651E-05    1.17     686.8  T
     SCC iter.                  ...        0 min,  0.001 sec
     gradient                   ...        0 min,  0.001 sec
 * total energy  :    -8.6204821 Eh     change       -0.4590552E-03 Eh
   gradient norm :     0.0244932 Eh/α   predicted    -0.7455384E-03 (  62.41%)
   displ. norm   :     0.0791483 α      lambda       -0.7008743E-03
   maximum displ.:     0.0542906 α      in ANC's #1, #2, #3, ...

........................................................................
.............................. CYCLE   13 ..............................
........................................................................
   1     -8.7680889 -0.876809E+01  0.112E+00    1.10       0.0  T
   2     -8.6150950  0.152994E+00  0.433E+00    1.87       1.0  T
   3     -8.7714299 -0.156335E+00  0.772E-01    1.13       1.0  T
   4     -8.7748664 -0.343650E-02  0.242E-01    1.18       1.0  T
   5     -8.7749732 -0.106846E-03  0.179E-01    1.18       1.0  T
   6     -8.7750464 -0.731124E-04  0.116E-01    1.18       1.0  T
   7     -8.7749637  0.826322E-04  0.164E-01    1.18       1.0  T
   8     -8.7750808 -0.117064E-03  0.310E-02    1.19       1.4  T
   9     -8.7750648  0.159727E-04  0.597E-02    1.19       1.0  T
  10     -8.7750611  0.368263E-05  0.674E-02    1.18       1.0  T
  11     -8.7750845 -0.233753E-04  0.166E-02    1.19       2.7  T
  12     -8.7750853 -0.754301E-06  0.119E-02    1.19       3.8  T
  13     -8.7750860 -0.777932E-06  0.976E-05    1.19     458.2  T
  14     -8.7750860 -0.242295E-10  0.408E-05    1.19    1096.9  T
     SCC iter.                  ...        0 min,  0.001 sec
     gradient                   ...        0 min,  0.001 sec
 * total energy  :    -8.6208161 Eh     change       -0.3339794E-03 Eh
   gradient norm :     0.0110667 Eh/α   predicted    -0.3526342E-03 (   5.59%)
   displ. norm   :     0.0478192 α      lambda       -0.1951519E-03
   maximum displ.:     0.0341116 α      in ANC's #1, #3, #6, ...

........................................................................
.............................. CYCLE   14 ..............................
........................................................................
   1     -8.7747530 -0.877475E+01  0.564E-01    1.20       0.0  T
   2     -8.7186218  0.561313E-01  0.264E+00    0.84       1.0  T
   3     -8.7710459 -0.524241E-01  0.905E-01    1.21       1.0  T
   4     -8.7755905 -0.454462E-02  0.284E-01    1.18       1.0  T
   5     -8.7757506 -0.160146E-03  0.330E-01    1.15       1.0  T
   6     -8.7758173 -0.666342E-04  0.289E-01    1.15       1.0  T
   7     -8.7761343 -0.317018E-03  0.684E-02    1.16       1.0  T
   8     -8.7760172  0.117092E-03  0.162E-01    1.17       1.0  T
   9     -8.7760944 -0.772026E-04  0.108E-01    1.17       1.0  T
  10     -8.7761561 -0.616899E-04  0.206E-02    1.17       2.2  T
  11     -8.7761585 -0.242819E-05  0.105E-03    1.17      42.7  T
  12     -8.7761584  0.125515E-06  0.494E-03    1.16       9.0  T
  13     -8.7761585 -0.127463E-06  0.316E-04    1.17     141.5  T
  14     -8.7761585 -0.310255E-09  0.170E-04    1.17     263.3  T
     SCC iter.                  ...        0 min,  0.001 sec
     gradient                   ...        0 min,  0.001 sec
 * total energy  :    -8.6209142 Eh     change       -0.9809172E-04 Eh
   gradient norm :     0.0077120 Eh/α   predicted    -0.9779945E-04 (  -0.30%)
   displ. norm   :     0.0345488 α      lambda       -0.1915826E-03
   maximum displ.:     0.0181817 α      in ANC's #7, #5, #3, ...

........................................................................
.............................. CYCLE   15 ..............................
........................................................................
   1     -8.7778690 -0.877787E+01  0.411E-01    1.15       0.0  T
   2     -8.7011783  0.766907E-01  0.336E+00    1.41       1.0  T
   3     -8.7780664 -0.768881E-01  0.336E-01    1.15       1.0  T
   4     -8.7781160 -0.495739E-04  0.310E-01    1.17       1.0  T
   5     -8.7785271 -0.411127E-03  0.165E-01    1.17       1.0  T
   6     -8.7785650 -0.379004E-04  0.140E-01    1.17       1.0  T
   7     -8.7786671 -0.102134E-03  0.458E-02    1.18       1.0  T
   8     -8.7786670  0.164058E-06  0.441E-02    1.18       1.0  T
   9     -8.7786662  0.787816E-06  0.457E-02    1.18       1.0  T
  10     -8.7786778 -0.116577E-04  0.135E-03    1.18      33.1  T
  11     -8.7786779 -0.965621E-08  0.333E-04    1.18     134.1  T
  12     -8.7786779  0.108594E-09  0.370E-04    1.18     120.9  T
     SCC iter.                  ...        0 min,  0.001 sec
     gradient                   ...        0 min,  0.001 sec
 * total energy  :    -8.6210598 Eh     change       -0.1456262E-03 Eh
   gradient norm :     0.0052458 Eh/α   predicted    -0.9590731E-04 ( -34.14%)
   displ. norm   :     0.0638600 α      lambda       -0.2464547E-03
   maximum displ.:     0.0395638 α      in ANC's #6, #3, #5, ...

........................................................................
.............................. CYCLE   16 ..............................
........................................................................
   1     -8.7776814 -0.877768E+01  0.603E-01    1.16       0.0  T
   2     -8.6729250  0.104756E+00  0.386E+00    1.52       1.0  T
   3     -8.7779605 -0.105035E+00  0.491E-01    1.16       1.0  T
   4     -8.7783331 -0.372645E-03  0.395E-01    1.19       1.0  T
   5     -8.7791619 -0.828821E-03  0.145E-01    1.19       1.0  T
   6     -8.7791722 -0.102652E-04  0.130E-01    1.19       1.0  T
   7     -8.7792534 -0.811802E-04  0.433E-02    1.19       1.0  T
   8     -8.7792384  0.149890E-04  0.590E-02    1.20       1.0  T
   9     -8.7792335  0.492681E-05  0.658E-02    1.20       1.0  T
  10     -8.7792592 -0.257823E-04  0.745E-03    1.20       6.0  T
  11     -8.7792595 -0.280633E-06  0.191E-03    1.20      23.5  T
  12     -8.7792595 -0.760217E-08  0.146E-03    1.20      30.7  T
  13     -8.7792595 -0.117273E-07  0.169E-05    1.20    2645.5  T
  14     -8.7792595  0.144329E-10  0.509E-05    1.20     877.8  T
     SCC iter.                  ...        0 min,  0.001 sec
     gradient                   ...        0 min,  0.001 sec
 * total energy  :    -8.6211907 Eh     change       -0.1308272E-03 Eh
   gradient norm :     0.0012716 Eh/α   predicted    -0.1237299E-03 (  -5.42%)
   displ. norm   :     0.0321914 α      lambda       -0.1666543E-04
   maximum displ.:     0.0234220 α      in ANC's #1, #7, #5, ...

........................................................................
.............................. CYCLE   17 ..............................
........................................................................
   1     -8.7790748 -0.877907E+01  0.104E-01    1.20       0.0  T
   2     -8.7784471  0.627727E-03  0.297E-01    1.18       1.0  T
   3     -8.7770034  0.144369E-02  0.579E-01    1.22       1.0  T
   4     -8.7787553 -0.175194E-02  0.231E-01    1.21       1.0  T
   5     -8.7790766 -0.321287E-03  0.248E-02    1.19       1.8  T
   6     -8.7790786 -0.200393E-05  0.166E-02    1.19       2.7  T
   7     -8.7790797 -0.105536E-05  0.105E-02    1.19       4.3  T
   8     -8.7790801 -0.398236E-06  0.616E-03    1.19       7.3  T
   9     -8.7790802 -0.123372E-06  0.406E-03    1.19      11.0  T
  10     -8.7790803 -0.927356E-07  0.747E-04    1.19      59.9  T
  11     -8.7790803 -0.337808E-08  0.406E-05    1.19    1101.8  T
     SCC iter.                  ...        0 min,  0.001 sec
     gradient                   ...        0 min,  0.001 sec
 * total energy  :    -8.6212001 Eh     change       -0.9445526E-05 Eh
   gradient norm :     0.0011956 Eh/α   predicted    -0.8336635E-05 ( -11.74%)
   displ. norm   :     0.0061546 α      lambda       -0.2695193E-05
   maximum displ.:     0.0051233 α      in ANC's #7, #3, #2, ...

........................................................................
.............................. CYCLE   18 ..............................
........................................................................
   1     -8.7791020 -0.877910E+01  0.276E-02    1.19       0.0  T
   2     -8.7785700  0.531987E-03  0.283E-01    1.21       1.0  T
   3     -8.7790831 -0.513112E-03  0.590E-02    1.19       1.0  T
   4     -8.7790999 -0.168139E-04  0.276E-02    1.19       1.6  T
   5     -8.7791030 -0.310943E-05  0.134E-02    1.19       3.3  T
   6     -8.7791034 -0.427017E-06  0.102E-02    1.19       4.4  T
   7     -8.7791037 -0.280735E-06  0.755E-03    1.19       5.9  T
   8     -8.7791041 -0.323179E-06  0.188E-03    1.19      23.8  T
   9     -8.7791041 -0.194536E-07  0.517E-04    1.19      86.5  T
  10     -8.7791041 -0.161144E-08  0.954E-05    1.19     468.7  T
     SCC iter.                  ...        0 min,  0.001 sec
     gradient                   ...        0 min,  0.001 sec
 * total energy  :    -8.6212028 Eh     change       -0.2738061E-05 Eh
   gradient norm :     0.0011022 Eh/α   predicted    -0.1347647E-05 ( -50.78%)
   displ. norm   :     0.0067375 α      lambda       -0.2921754E-05
   maximum displ.:     0.0036975 α      in ANC's #7, #2, #5, ...

........................................................................
.............................. CYCLE   19 ..............................
........................................................................
   1     -8.7790353 -0.877904E+01  0.114E-01    1.19       0.0  T
   2     -8.7608896  0.181457E-01  0.167E+00    1.27       1.0  T
   3     -8.7790669 -0.181773E-01  0.797E-02    1.19       1.0  T
   4     -8.7790700 -0.317397E-05  0.763E-02    1.20       1.0  T
   5     -8.7790765 -0.648983E-05  0.654E-02    1.19       1.0  T
   6     -8.7790911 -0.145601E-04  0.424E-02    1.20       1.1  T
   7     -8.7790936 -0.254637E-05  0.369E-02    1.20       1.2  T
   8     -8.7791014 -0.772694E-05  0.711E-03    1.20       6.3  T
   9     -8.7791017 -0.307137E-06  0.626E-04    1.20      71.4  T
  10     -8.7791017 -0.305516E-10  0.347E-04    1.20     128.9  T
     SCC iter.                  ...        0 min,  0.001 sec
     gradient                   ...        0 min,  0.001 sec
 * total energy  :    -8.6212063 Eh     change       -0.3487999E-05 Eh
   gradient norm :     0.0009301 Eh/α   predicted    -0.1460674E-05 ( -58.12%)
   displ. norm   :     0.0223894 α      lambda       -0.6331347E-05
   maximum displ.:     0.0156116 α      in ANC's #1, #5, #2, ...

   *** GEOMETRY OPTIMIZATION CONVERGED AFTER 19 ITERATIONS ***

------------------------------------------------------------------------
 total energy gain   :        -0.0944070 Eh      -59.2413 kcal/mol
 total RMSD          :         0.9412200 a0        0.4981 Å
 total power (kW/mol):       -13.0455520 (step)-3739.3290 (real)
------------------------------------------------------------------------

 ANCopt (total)                0 d,  0 h,  0 min,  0.066 sec
 optimizer setup                ...        0 min,  0.000 sec (  0.112%)
 model hessian                  ...        0 min,  0.000 sec (  0.159%)
 ANC generation                 ...        0 min,  0.000 sec (  0.083%)
 coordinate transformation      ...        0 min,  0.000 sec (  0.068%)
 single point calculation       ...        0 min,  0.064 sec ( 97.085%)
 optimization log               ...        0 min,  0.001 sec (  0.811%)
 hessian update                 ...        0 min,  0.000 sec (  0.067%)
 rational function              ...        0 min,  0.001 sec (  0.772%)

================
 final structure:
================
5
 xtb: 6.2.2 (9d81278992624c895f80dd42a50cac0aa55982e2)
C         1.87000243510968   -0.44343143892018    0.02358026933400
C         0.67680611539580    0.12928594228900    0.01085261678012
C        -0.73850265859522   -0.08590503387110   -0.01228214048501
C        -0.29037080069079    1.21049175543714    0.00834794508716
H        -1.51793609121946   -0.81044022493486   -0.03049869071626

 Bond Distances (Angstroems)
 ---------------------------
C1-C2=1.3236         C2-C1=1.3236         C2-C3=1.4318         C2-C4=1.4507         C3-C2=1.4318         C3-C4=1.3718         
C3-H5=1.0643         C4-C2=1.4507         C4-C3=1.3718         H5-C3=1.0643         
 C  H  Rav=1.0643 sigma=0.0000  Rmin=1.0643  Rmax=1.0643     1
 C  C  Rav=1.3945 sigma=0.0502  Rmin=1.3236  Rmax=1.4507     4

 selected bond angles (degree)
 --------------------
C3-C2-C1=145.72                C4-C2-C1=157.45                C4-C2-C3= 56.83                C4-C3-C2= 62.28                
H5-C3-C2=145.74                H5-C3-C4=151.98                C3-C4-C2= 60.89                

 selected dihedral angles (degree)
 ---------------------------------
C4-C3-C2-C1=179.89            H5-C3-C2-C1=  0.00            H5-C3-C2-C4=180.10            C3-C4-C2-C1=180.16            
C2-C4-C3-H5=179.88            
           -------------------------------------------------
          |                Final Singlepoint                |
           -------------------------------------------------

          ...................................................
          :                      SETUP                      :
          :.................................................:
          :  # basis functions                  17          :
          :  # atomic orbitals                  17          :
          :  # shells                            9          :
          :  # electrons                        17          :
          :  max. iterations                   250          :
          :  Hamiltonian                  GFN2-xTB          :
          :  restarted?                      false          :
          :  GBSA solvation                  false          :
          :  PC potential                    false          :
          :  electronic temp.          300.0000000     K    :
          :  accuracy                    1.0000000          :
          :  -> integral cutoff          0.2500000E+02      :
          :  -> integral neglect         0.1000000E-07      :
          :  -> SCF convergence          0.1000000E-05 Eh   :
          :  -> wf. convergence          0.1000000E-03 e    :
          :  Broyden damping             0.4000000          :
          ...................................................

 iter      E             dE          RMSdq      gap      omega  full diag
   1     -8.7791017 -0.877910E+01  0.214E-04    1.20       0.0  T
   2     -8.7791017  0.152157E-08  0.393E-04    1.20     113.7  T
   3     -8.7791016  0.315469E-07  0.231E-03    1.20      19.3  T
   4     -8.7791017 -0.310894E-07  0.568E-04    1.20      78.7  T

   *** convergence criteria satisfied after 4 iterations ***

         #    Occupation            Energy/Eh            Energy/eV
      -------------------------------------------------------------
         1        2.0000           -0.6976399             -18.9837
       ...           ...                  ...                  ...
         4        2.0000           -0.5366971             -14.6043
         5        2.0000           -0.5184641             -14.1081
         6        2.0000           -0.4937438             -13.4355
         7        1.7739           -0.4228593             -11.5066
         8        1.2261           -0.4205216             -11.4430
         9        1.0000           -0.3958725             -10.7722
        10        1.0000           -0.3178104              -8.6481 (HOMO)
        11                         -0.2737790              -7.4499 (LUMO)
        12                         -0.2009594              -5.4684
        13                         -0.0024965              -0.0679
        14                          0.0656372               1.7861
        15                          0.1740406               4.7359
       ...                                ...                  ...
        17                          0.7309718              19.8908
      -------------------------------------------------------------
                  HL-Gap            0.0440314 Eh            1.1982 eV
             Fermi-level           -0.3587426 Eh           -9.7619 eV

 SCC (total)                   0 d,  0 h,  0 min,  0.003 sec
 SCC setup                      ...        0 min,  0.000 sec (  1.737%)
 Dispersion                     ...        0 min,  0.000 sec (  0.327%)
 integral evaluation            ...        0 min,  0.001 sec ( 38.488%)
 zeroth order Hamiltonian       ...        0 min,  0.000 sec (  0.507%)
 iterations                     ...        0 min,  0.000 sec ( 16.298%)
 molecular gradient             ...        0 min,  0.001 sec ( 39.649%)
 printout                       ...        0 min,  0.000 sec (  2.666%)

         :::::::::::::::::::::::::::::::::::::::::::::::::::::
         ::                     SUMMARY                     ::
         :::::::::::::::::::::::::::::::::::::::::::::::::::::
         :: total energy              -8.621206335079 Eh    ::
         :: gradient norm              0.001060059621 Eh/a0 ::
         :: HOMO-LUMO gap              1.198154767485 eV    ::
         ::.................................................::
         :: SCC energy                -8.779101658937 Eh    ::
         :: -> isotropic ES           -0.004636408335 Eh    ::
         :: -> anisotropic ES         -0.000826051615 Eh    ::
         :: -> anisotropic XC          0.008319457161 Eh    ::
         :: -> dispersion             -0.002255705141 Eh    ::
         :: repulsion energy           0.157895248229 Eh    ::
         :: add. restraining           0.000000000000 Eh    ::
         :::::::::::::::::::::::::::::::::::::::::::::::::::::

           ------------------------------------------------- 
          |                Numerical Hessian                |
           ------------------------------------------------- 
step length          :   0.00500
SCC accuracy         :   0.30000
Hessian scale factor :   1.00000
frozen atoms in %    :   0.00000    0
RMS gradient         :   0.00105
estimated CPU  time      0.00 min
estimated wall time      0.00 min

writing file <hessian>.

 projected vibrational frequencies (cm-1)
eigval :       -0.00    -0.00    -0.00     0.00     0.00     0.00
eigval :      169.24   339.14   611.19   656.97   802.35   887.06
eigval :     1437.64  1607.46  3200.70
           -------------------------------------------------
          |                Property Printout                |
           -------------------------------------------------

    * Orbital Energies and Occupations

         #    Occupation            Energy/Eh            Energy/eV
      -------------------------------------------------------------
         1        2.0000           -0.6976397             -18.9837
         2        2.0000           -0.6364192             -17.3178
         3        2.0000           -0.5915827             -16.0978
         4        2.0000           -0.5366970             -14.6043
         5        2.0000           -0.5184640             -14.1081
         6        2.0000           -0.4937437             -13.4354
         7        1.7738           -0.4228593             -11.5066
         8        1.2262           -0.4205219             -11.4430
         9        1.0000           -0.3958727             -10.7722
        10        1.0000           -0.3178108              -8.6481 (HOMO)
        11                         -0.2737786              -7.4499 (LUMO)
        12                         -0.2009596              -5.4684
        13                         -0.0024963              -0.0679
        14                          0.0656374               1.7861
        15                          0.1740407               4.7359
        16                          0.5758366              15.6693
        17                          0.7309716              19.8907
      -------------------------------------------------------------
                  HL-Gap            0.0440322 Eh            1.1982 eV
             Fermi-level           -0.3587426 Eh           -9.7619 eV

     #   Z        covCN         q      C6AA      α(0)
     1   6 C      0.981    -0.134    40.254    10.657
     2   6 C      2.939     0.111    25.551     8.290
     3   6 C      2.887     0.027    27.397     8.581
Molecule has the following symmetry elements: (sigma) 
It seems to be the Cs point group
     4   6 C      1.960    -0.085    33.405     9.334
     5   1 H      0.927     0.081     1.969     2.194

 Mol. C6AA /au·bohr⁶  :        567.038317
 Mol. C8AA /au·bohr⁸  :      15724.217908
 Mol. α(0) /au        :         39.056095


Wiberg/Mayer (AO) data.
largest (>0.10) Wiberg bond orders for each atom
          total WBO             WBO to atom ...
     1  C   1.561        C    2 1.504
     2  C   3.618        C    1 1.504    C    3 1.101    C    4 1.004
     3  C   3.526        C    4 1.461    C    2 1.101    H    5 0.956
     4  C   2.531        C    3 1.461    C    2 1.004
     5  H   0.983        C    3 0.956

MOs/occ written to file <molden.input>


molecular dipole:
                 x           y           z       tot (Debye)
 q only:       -0.554      -0.184      -0.010
   full:       -0.775      -0.477      -0.017       2.315
molecular quadrupole (traceless):
                xx          xy          yy          xz          yz          zz
 q only:       -0.626       1.350       0.056      -0.005       0.015       0.570
  q+dip:        0.543       2.611      -0.694       0.031       0.030       0.151
   full:       -0.877       2.713      -1.886      -0.028      -0.008       2.763

           -------------------------------------------------
          |                Geometry Summary                 |
           -------------------------------------------------

      molecular mass/u    :       49.0508844
   center of mass at/Å    :        0.3404949       0.1817915       0.0068398
  moments of inertia/u·Å² :        0.1397652E+02   0.5702513E+02   0.7100163E+02
rotational constants/cm⁻¹ :        0.1206140E+01   0.2956176E+00   0.2374260E+00

 * 2 selected distances

     #   Z        #   Z                                     value/Å
     3   6 C      4   6 C                                 1.3718208 (max)
     3   6 C      5   1 H                                 1.0643306 (min)

 * 2 distinct bonds (by element types)

   Z      Z             #   av. dist./Å        max./Å        min./Å
   1 H    6 C           1     1.0643306     1.0643306     1.0643306
   6 C    6 C           1     1.3718208     1.3718208     1.3718208

           -------------------------------------------------
          |               Frequency Printout                |
           -------------------------------------------------
 projected vibrational frequencies (cm-1)
eigval :       -0.00    -0.00    -0.00     0.00     0.00     0.00
eigval :      169.24   339.14   611.19   656.97   802.35   887.06
eigval :     1437.64  1607.46  3200.70
 reduced masses (amu)
   1:  9.58   2: 11.84   3: 11.40   4: 11.79   5: 11.95   6: 11.77   7: 11.21   8: 11.74
   9:  9.73  10:  3.87  11:  5.84  12: 10.99  13: 11.62  14: 11.82  15:  2.01
 IR intensities (amu)
   1:  0.18   2:  0.09   3:  0.10   4:  0.06   5:  0.12   6:  0.07   7:  1.30   8:  0.26
   9:  3.00  10:  0.13  11:  0.63  12:  0.82  13:  0.57  14:  2.47  15:  0.16
 Raman intensities (amu)
   1:  0.00   2:  0.00   3:  0.00   4:  0.00   5:  0.00   6:  0.00   7:  0.00   8:  0.00
   9:  0.00  10:  0.00  11:  0.00  12:  0.00  13:  0.00  14:  0.00  15:  0.00
 output can be read by thermo (or use thermo option).
 writing <g98.out> molden fake output.
 recommended (thermochemical) frequency scaling factor: 1.0
           -------------------------------------------------
          |             Thermodynamic Functions             |
           -------------------------------------------------

cs  symmetry found (for desy threshold:  0.10E+00) used in thermo

          ...................................................
          :                      SETUP                      :
          :.................................................:
          :  # frequencies                           9      :
          :  # imaginary freq.                       0      :
          :  linear?                             false      :
          :  only rotor calc.                    false      :
          :  symmetry                               cs      :
          :  rotational number                       1      :
          :  scaling factor                  1.0000000      :
          :  rotor cutoff                   50.0000000 cm⁻¹ :
          :  imag. cutoff                  -20.0000000 cm⁻¹ :
          :.................................................:

    mode    ω/cm⁻¹     T·S(HO)/kcal·mol⁻¹    T·S(FR)/kcal·mol⁻¹   T·S(vib)
   ------------------------------------------------------------------------
       1    169.24    -0.00000 ( 99.24%)     0.01043 (  0.76%)     0.00008
   ------------------------------------------------------------------------

   temp. (K)  partition function   enthalpy   heat capacity  entropy
                                   cal/mol     cal/K/mol   cal/K/mol   J/K/mol
 298.15  VIB   2.54                  886.709      6.709      4.827
         ROT  0.182E+05              888.752      2.981     22.471
         INT  0.462E+05             1775.462      9.690     27.298
         TR   0.332E+27             1481.254      4.968     37.578
         TOT                        3256.7156    14.6579    64.8759   271.4410

   temp. (K)  partition function   enthalpy   heat capacity  entropy
                                   cal/mol     cal/K/mol   cal/K/mol   J/K/mol
 120.00  VIB   1.17                   92.220      2.143      1.089
         ROT  0.464E+04              357.707      2.981     19.758
         INT  0.544E+04              449.927      5.124     20.848
         TR   0.849E+26              596.178      4.968     33.058
         TOT                        1046.1050    10.0925    53.9062   225.5434

   temp. (K)  partition function   enthalpy   heat capacity  entropy
                                   cal/mol     cal/K/mol   cal/K/mol   J/K/mol
 100.00  VIB   1.10                   54.328      1.646      0.746
         ROT  0.353E+04              298.089      2.981     19.215
         INT  0.390E+04              352.417      4.627     19.961
         TR   0.646E+26              496.815      4.968     32.153
         TOT                         849.2321     9.5948    52.1137   218.0437

   temp. (K)  partition function   enthalpy   heat capacity  entropy
                                   cal/mol     cal/K/mol   cal/K/mol   J/K/mol
  80.00  VIB   1.05                   26.441      1.140      0.437
         ROT  0.253E+04              238.471      2.981     18.550
         INT  0.266E+04              264.913      4.121     18.987
         TR   0.462E+26              397.452      4.968     31.045
         TOT                         662.3645     9.0895    50.0315   209.3318

   temp. (K)  partition function   enthalpy   heat capacity  entropy
                                   cal/mol     cal/K/mol   cal/K/mol   J/K/mol
  60.00  VIB   1.02                    8.794      0.624      0.186
         ROT  0.164E+04              178.853      2.981     17.692
         INT  0.167E+04              187.648      3.605     17.878
         TR   0.300E+26              298.089      4.968     29.616
         TOT                         485.7366     8.5735    47.4945   198.7170

   temp. (K)  partition function   enthalpy   heat capacity  entropy
                                   cal/mol     cal/K/mol   cal/K/mol   J/K/mol
  40.00  VIB   1.00                    1.106      0.170      0.034
         ROT   893.                  119.236      2.981     16.483
         INT   895.                  120.342      3.150     16.518
         TR   0.163E+26              198.726      4.968     27.603
         TOT                         319.0680     8.1186    44.1206   184.6007

   temp. (K)  partition function   enthalpy   heat capacity  entropy
                                   cal/mol     cal/K/mol   cal/K/mol   J/K/mol
  20.00  VIB   1.00                    0.002      0.002     -0.003
         ROT   316.                   59.618      2.981     14.417
         INT   316.                   59.620      2.982     14.414
         TR   0.577E+25               99.363      4.968     24.161
         TOT                         158.9833     7.9506    38.5750   161.3980

   temp. (K)  partition function   enthalpy   heat capacity  entropy
                                   cal/mol     cal/K/mol   cal/K/mol   J/K/mol
  10.00  VIB   1.00                    0.000      0.000     -0.009
         ROT   112.                   29.809      2.981     12.351
         INT   112.                   29.809      2.981     12.342
         TR   0.204E+25               49.681      4.968     20.719
         TOT                          79.4904     7.9490    33.0611   138.3278

       T/K    H(0)-H(T)+PV         H(T)/Eh          T*S/Eh         G(T)/Eh
   ------------------------------------------------------------------------
    298.15    0.518991E-02    0.273149E-01    0.308247E-01   -0.350975E-02
    120.00    0.166707E-02    0.237921E-01    0.103086E-01    0.134835E-01
    100.00    0.135334E-02    0.234783E-01    0.830484E-02    0.151735E-01
     80.00    0.105555E-02    0.231805E-01    0.637842E-02    0.168021E-01
     60.00    0.774070E-03    0.228991E-01    0.454124E-02    0.183578E-01
     40.00    0.508467E-03    0.226335E-01    0.281243E-02    0.198210E-01
     20.00    0.253356E-03    0.223784E-01    0.122946E-02    0.211489E-01
     10.00    0.126676E-03    0.222517E-01    0.526863E-03    0.217248E-01 (used)
   ------------------------------------------------------------------------

         :::::::::::::::::::::::::::::::::::::::::::::::::::::
         ::                  THERMODYNAMIC                  ::
         :::::::::::::::::::::::::::::::::::::::::::::::::::::
         :: total free energy          -8.599481525121 Eh   ::
         ::.................................................::
         :: total energy               -8.621206335926 Eh   ::
         :: zero point energy           0.022124997436 Eh   ::
         :: G(RRHO) w/o ZPVE           -0.000400186631 Eh   ::
         :: G(RRHO) contrib.            0.021724810805 Eh   ::
         :::::::::::::::::::::::::::::::::::::::::::::::::::::

optimized geometry written to: xtbopt.xyz


           -------------------------------------------------
          | TOTAL ENERGY               -8.621206335926 Eh   |
          | TOTAL ENTHALPY             -8.598954662474 Eh   |
          | TOTAL FREE ENERGY          -8.599481525121 Eh   |
          | GRADIENT NORM               0.001053939179 Eh/α |
          | HOMO-LUMO GAP               1.198177013355 eV   |
           -------------------------------------------------

------------------------------------------------------------------------
 * finished run on 2020/05/12 at 11:45:10.695     
------------------------------------------------------------------------
 total:
 * wall-time:     0 d,  0 h,  0 min,  0.186 sec
 *  cpu-time:     0 d,  0 h,  0 min,  0.184 sec
 * ratio c/w:     0.993 speedup
 SCF:
 * wall-time:     0 d,  0 h,  0 min,  0.004 sec
 *  cpu-time:     0 d,  0 h,  0 min,  0.004 sec
 * ratio c/w:     1.000 speedup
 ANC optimizer:
 * wall-time:     0 d,  0 h,  0 min,  0.070 sec
 *  cpu-time:     0 d,  0 h,  0 min,  0.070 sec
 * ratio c/w:     0.999 speedup
 numerical hessian:
 * wall-time:     0 d,  0 h,  0 min,  0.093 sec
 *  cpu-time:     0 d,  0 h,  0 min,  0.093 sec
 * ratio c/w:     0.998 speedup

