      -----------------------------------------------------------      
     |                   =====================                   |     
     |                           x T B                           |     
     |                   =====================                   |     
     |                         S. Grimme                         |     
     |          Mulliken Center for Theoretical Chemistry        |     
     |                    University of Bonn                     |     
      -----------------------------------------------------------      

   * xtb version 6.2.2 (9d81278992624c895f80dd42a50cac0aa55982e2) compiled by '@Darwin' on 04/03/2020

   xtb is free software: you can redistribute it and/or modify it under
   the terms of the GNU Lesser General Public License as published by
   the Free Software Foundation, either version 3 of the License, or
   (at your option) any later version.
   
   xtb is distributed in the hope that it will be useful,
   but WITHOUT ANY WARRANTY; without even the implied warranty of
   MERCHANTABILITY or FITNESS FOR A PARTICULAR PURPOSE.  See the
   GNU Lesser General Public License for more details.
   
   Cite this work as:
   * S. Grimme, C. Bannwarth, P. Shushkov, J. Chem. Theory Comput., 2017,
     13, 1989-2009. DOI: 10.1021/acs.jctc.7b00118
   * C. Bannwarth, S. Ehlert and S. Grimme., J. Chem. Theory Comput., 2019,
     15, 1652-1671. DOI: 10.1021/acs.jctc.8b01176
   * P. Pracht, E. Caldeweyher, S. Ehlert, S. Grimme, ChemRxiv, 2019, preprint.
     DOI: 10.26434/chemrxiv.8326202.v1
   
   for DFT-D4:
   * E. Caldeweyher, C. Bannwarth and S. Grimme, J. Chem. Phys., 2017,
     147, 034112. DOI: 10.1063/1.4993215
   * E. Caldeweyher, S. Ehlert, A. Hansen, H. Neugebauer, S. Spicher,
     C. Bannwarth and S. Grimme, J. Chem. Phys., 2019, 150, 154122.
     DOI: 10.1063/1.5090222
   
   for sTDA-xTB:
   * S. Grimme and C. Bannwarth, J. Chem. Phys., 2016, 145, 054103.
     DOI: 10.1063/1.4959605
   
   in the mass-spec context:
   * V. Asgeirsson, C. Bauer and S. Grimme, Chem. Sci., 2017, 8, 4879.
     DOI: 10.1039/c7sc00601b
   
   for metadynamics refer to:
   * S. Grimme, J. Chem. Theory Comput., 2019, 155, 2847-2862
     DOI: 10.1021/acs.jctc.9b00143
   
   with help from (in alphabetical order)
   C. Bannwarth, F. Bohle, G. Brandenburg, E. Caldeweyher, M. Checinski,
   S. Dohm, S. Ehlert, S. Ehrlich, F. März, H. Neugebauer, J. Pisarek,
   P. Pracht, P. Shushkov, and S. Spicher.
   
 * started run on 2020/05/12 at 11:44:52.418     

           -------------------------------------------------
          |                Calculation Setup                |
           -------------------------------------------------

          program call               : xtb --input H1C3N1_6_S_0.input H1C3N1_6_S_0.xyz --ohess --molden --namespace H1C3N1_6_S_0 output.out
          calculation namespace      : H1C3N1_6_S_0
          coordinate file            : H1C3N1_6_S_0.xyz
          number of atoms            :                     5
          number of electrons        :                    18
          charge                     :                     0
          spin                       :                   0.0
          first test random number   :      0.83489373451829

   ID    Z sym.   atoms
    1    6 C      1-3
    2    7 N      4
    3    1 H      5

           -------------------------------------------------
          |                 G F N 2 - x T B                 |
           -------------------------------------------------

        Reference                      10.1021/acs.jctc.8b01176
      * Hamiltonian:
        H0-scaling (s, p, d)           1.850000    2.230000    2.230000
        zeta-weighting                 0.500000
      * Dispersion:
        s8                             2.700000
        a1                             0.520000
        a2                             5.000000
        s9                             5.000000
      * Repulsion:
        kExp                           1.500000    1.000000
        rExp                           1.000000
      * Coulomb:
        alpha                          2.000000
        third order                    shell-resolved
        anisotropic                    true
        a3                             3.000000
        a5                             4.000000
        cn-shift                       1.200000
        cn-exp                         4.000000
        max-rad                        5.000000


          ...................................................
          :                      SETUP                      :
          :.................................................:
          :  # basis functions                  17          :
          :  # atomic orbitals                  17          :
          :  # shells                            9          :
          :  # electrons                        18          :
          :  max. iterations                   250          :
          :  Hamiltonian                  GFN2-xTB          :
          :  restarted?                      false          :
          :  GBSA solvation                  false          :
          :  PC potential                    false          :
          :  electronic temp.          300.0000000     K    :
          :  accuracy                    1.0000000          :
          :  -> integral cutoff          0.2500000E+02      :
          :  -> integral neglect         0.1000000E-07      :
          :  -> SCF convergence          0.1000000E-05 Eh   :
          :  -> wf. convergence          0.1000000E-03 e    :
          :  Broyden damping             0.4000000          :
          ...................................................

 iter      E             dE          RMSdq      gap      omega  full diag
   1     -9.2369894 -0.923699E+01  0.120E+01    1.14       0.0  T
   2     -8.1941852  0.104280E+01  0.142E+01    1.00       1.0  T
   3     -9.2381661 -0.104398E+01  0.764E+00    0.80       1.0  T
   4     -9.2836385 -0.454724E-01  0.494E+00    0.20       1.0  T
   5     -9.4375458 -0.153907E+00  0.261E+00    0.70       1.0  T
   6     -9.4622668 -0.247210E-01  0.121E+00    0.63       1.0  T
   7     -9.4659047 -0.363789E-02  0.427E-01    0.59       1.0  T
   8     -9.4663187 -0.413944E-03  0.400E-01    0.64       1.0  T
   9     -9.4668167 -0.497987E-03  0.177E-01    0.63       1.0  T
  10     -9.4669581 -0.141461E-03  0.185E-02    0.63       2.4  T
  11     -9.4669594 -0.133103E-05  0.102E-02    0.63       4.4  T
  12     -9.4669596 -0.198463E-06  0.601E-03    0.63       7.4  T
  13     -9.4669598 -0.175906E-06  0.195E-03    0.63      23.0  T
  14     -9.4669598 -0.118793E-07  0.680E-04    0.63      65.8  T
  15     -9.4669598 -0.248009E-08  0.247E-04    0.63     181.2  T

   *** convergence criteria satisfied after 15 iterations ***

         #    Occupation            Energy/Eh            Energy/eV
      -------------------------------------------------------------
         1        2.0000           -0.6816592             -18.5489
       ...           ...                  ...                  ...
         3        2.0000           -0.6036846             -16.4271
         4        2.0000           -0.5684666             -15.4688
         5        2.0000           -0.5079411             -13.8218
         6        2.0000           -0.4966850             -13.5155
         7        2.0000           -0.4825074             -13.1297
         8        2.0000           -0.4551713             -12.3858
         9        2.0000           -0.4289819             -11.6732 (HOMO)
        10        0.0000           -0.4058282             -11.0431 (LUMO)
        11                         -0.3756315             -10.2215
        12                         -0.3364751              -9.1560
        13                         -0.3328025              -9.0560
        14                          0.0439288               1.1954
       ...                                ...                  ...
        17                          0.1366362               3.7181
      -------------------------------------------------------------
                  HL-Gap            0.0231537 Eh            0.6300 eV
             Fermi-level           -0.4174051 Eh          -11.3582 eV

 SCC (total)                   0 d,  0 h,  0 min,  0.004 sec
 SCC setup                      ...        0 min,  0.000 sec (  2.161%)
 Dispersion                     ...        0 min,  0.000 sec (  0.406%)
 integral evaluation            ...        0 min,  0.001 sec ( 32.697%)
 zeroth order Hamiltonian       ...        0 min,  0.000 sec (  0.549%)
 iterations                     ...        0 min,  0.001 sec ( 35.783%)
 molecular gradient             ...        0 min,  0.001 sec ( 24.709%)
 printout                       ...        0 min,  0.000 sec (  3.457%)

         :::::::::::::::::::::::::::::::::::::::::::::::::::::
         ::                     SUMMARY                     ::
         :::::::::::::::::::::::::::::::::::::::::::::::::::::
         :: total energy              -9.412754373227 Eh    ::
         :: gradient norm              0.393399426775 Eh/a0 ::
         :: HOMO-LUMO gap              0.630043904807 eV    ::
         ::.................................................::
         :: SCC energy                -9.466959833223 Eh    ::
         :: -> isotropic ES           -0.010158709309 Eh    ::
         :: -> anisotropic ES         -0.000169002475 Eh    ::
         :: -> anisotropic XC          0.022690373159 Eh    ::
         :: -> dispersion             -0.002168717919 Eh    ::
         :: repulsion energy           0.054205341202 Eh    ::
         :: add. restraining           0.000000000000 Eh    ::
         :::::::::::::::::::::::::::::::::::::::::::::::::::::

      ----------------------------------------------------------- 
     |                   =====================                   |
     |                        A N C O P T                        |
     |                   =====================                   |
     |               Approximate Normal Coordinate               |
     |                Rational Function Optimizer                |
      ----------------------------------------------------------- 

          ...................................................
          :                      SETUP                      :
          :.................................................:
          :   optimization level            normal          :
          :   max. optcycles                   200          :
          :   ANC micro-cycles                  20          :
          :   degrees of freedom                 9          :
          :.................................................:
          :   RF solver                   davidson          :
          :   write xtbopt.log                true          :
          :   linear?                        false          :
          :   energy convergence         0.5000000E-05 Eh   :
          :   grad. convergence          0.1000000E-02 Eh/α :
          :   maximium RF displ.         1.0000000          :
          :   Hlow (freq-cutoff)         0.1000000E-01      :
          :   Hmax (freq-cutoff)         5.0000000          :
          :   S6 in model hess.         20.0000000          :
          ...................................................

generating ANC from model Hessian ...
Using Lindh-Hessian (1995)
 Shifting diagonal of input Hessian by    1.0358181734795770E-003
 Lowest  eigenvalues of input Hessian
   -0.000000   -0.000000   -0.000000   -0.000000   -0.000000    0.000000
    0.010000    0.028012    0.071245    0.090050    0.126944    0.524240
    0.890861    0.978515    1.116568
 Highest eigenvalues
    0.090050    0.126944    0.524240    0.890861    0.978515    1.116568


........................................................................
.............................. CYCLE    1 ..............................
........................................................................
   1     -9.4669598 -0.946696E+01  0.110E-04    0.63       0.0  T
   2     -9.4669598  0.786315E-09  0.387E-04    0.63     115.7  T
   3     -9.4669598 -0.841299E-09  0.314E-05    0.63    1423.1  T
     SCC iter.                  ...        0 min,  0.001 sec
     gradient                   ...        0 min,  0.001 sec
 * total energy  :    -9.4127544 Eh     change       -0.4960654E-10 Eh
   gradient norm :     0.3933998 Eh/α   predicted     0.0000000E+00 (-100.00%)
   displ. norm   :     0.4606546 α      lambda       -0.1627957E+00
   maximum displ.:     0.2907036 α      in ANC's #6, #2, #9, ...

........................................................................
.............................. CYCLE    2 ..............................
........................................................................
   1     -9.6663696 -0.966637E+01  0.258E+00    1.32       0.0  T
   2     -9.6461254  0.202442E-01  0.256E+00    1.65       1.0  T
   3     -9.6683312 -0.222058E-01  0.138E+00    1.35       1.0  T
   4     -9.6746070 -0.627582E-02  0.172E-01    1.43       1.0  T
   5     -9.6746717 -0.647227E-04  0.112E-01    1.44       1.0  T
   6     -9.6746427  0.290467E-04  0.104E-01    1.45       1.0  T
   7     -9.6746903 -0.475992E-04  0.283E-02    1.44       1.6  T
   8     -9.6746934 -0.308967E-05  0.785E-03    1.44       5.7  T
   9     -9.6746935 -0.117587E-06  0.236E-03    1.44      19.0  T
  10     -9.6746935 -0.144612E-07  0.363E-04    1.44     123.4  T
  11     -9.6746935 -0.369109E-10  0.134E-04    1.44     334.0  T
     SCC iter.                  ...        0 min,  0.001 sec
     gradient                   ...        0 min,  0.001 sec
 * total energy  :    -9.5514253 Eh     change       -0.1386709E+00 Eh
   gradient norm :     0.2414723 Eh/α   predicted    -0.9867073E-01 ( -28.85%)
   displ. norm   :     0.5100782 α      lambda       -0.1152259E+00
   maximum displ.:     0.2870305 α      in ANC's #6, #9, #7, ...

........................................................................
.............................. CYCLE    3 ..............................
........................................................................
   1     -9.8946031 -0.989460E+01  0.321E+00    2.19       0.0  T
   2     -9.8903374  0.426574E-02  0.252E+00    2.24       1.0  T
   3     -9.9055340 -0.151967E-01  0.149E+00    2.17       1.0  T
   4     -9.9108361 -0.530205E-02  0.315E-01    2.19       1.0  T
   5     -9.9110281 -0.191987E-03  0.123E-01    2.18       1.0  T
   6     -9.9110636 -0.354828E-04  0.628E-02    2.17       1.0  T
   7     -9.9110668 -0.320832E-05  0.103E-02    2.17       4.4  T
   8     -9.9110669 -0.164575E-06  0.581E-03    2.17       7.7  T
   9     -9.9110670 -0.864788E-07  0.723E-04    2.17      61.8  T
  10     -9.9110670 -0.270354E-09  0.157E-04    2.17     285.0  T
     SCC iter.                  ...        0 min,  0.001 sec
     gradient                   ...        0 min,  0.001 sec
 * total energy  :    -9.5344941 Eh     change        0.1693118E-01 Eh
   gradient norm :     0.7417333 Eh/α   predicted    -0.7260266E-01 (-528.81%)
   displ. norm   :     0.4378275 α      lambda       -0.1976839E+00
   maximum displ.:     0.3353487 α      in ANC's #2, #5, #9, ...

........................................................................
.............................. CYCLE    4 ..............................
........................................................................
   1     -9.7879216 -0.978792E+01  0.209E+00    2.11       0.0  T
   2     -9.7860354  0.188621E-02  0.192E+00    1.99       1.0  T
   3     -9.7963618 -0.103264E-01  0.101E+00    2.15       1.0  T
   4     -9.7980392 -0.167742E-02  0.294E-01    2.11       1.0  T
   5     -9.7982418 -0.202551E-03  0.760E-02    2.12       1.0  T
   6     -9.7982373  0.442841E-05  0.667E-02    2.12       1.0  T
   7     -9.7982542 -0.168361E-04  0.127E-02    2.12       3.5  T
   8     -9.7982544 -0.253666E-06  0.313E-03    2.12      14.3  T
   9     -9.7982544 -0.102810E-07  0.107E-03    2.12      41.9  T
  10     -9.7982544 -0.774175E-09  0.259E-04    2.12     172.6  T
  11     -9.7982544 -0.208273E-09  0.691E-05    2.12     647.3  T
     SCC iter.                  ...        0 min,  0.001 sec
     gradient                   ...        0 min,  0.001 sec
 * total energy  :    -9.5987635 Eh     change       -0.6426942E-01 Eh
   gradient norm :     0.2184883 Eh/α   predicted    -0.1177893E+00 (  83.27%)
   displ. norm   :     0.4962852 α      lambda       -0.4517418E-01
   maximum displ.:     0.2828155 α      in ANC's #2, #1, #5, ...

........................................................................
.............................. CYCLE    5 ..............................
........................................................................
   1     -9.7445321 -0.974453E+01  0.202E+00    1.92       0.0  T
   2     -9.7172537  0.272784E-01  0.242E+00    1.41       1.0  T
   3     -9.7483353 -0.310817E-01  0.117E+00    1.92       1.0  T
   4     -9.7518557 -0.352041E-02  0.385E-01    1.75       1.0  T
   5     -9.7525107 -0.654959E-03  0.110E-01    1.78       1.0  T
   6     -9.7525153 -0.460311E-05  0.655E-02    1.78       1.0  T
   7     -9.7525307 -0.154448E-04  0.207E-02    1.77       2.2  T
   8     -9.7525312 -0.460000E-06  0.507E-03    1.77       8.8  T
   9     -9.7525313 -0.886177E-07  0.173E-03    1.77      25.9  T
  10     -9.7525313 -0.288686E-08  0.183E-04    1.77     244.1  T
  11     -9.7525313 -0.124876E-09  0.848E-05    1.77     527.6  T
     SCC iter.                  ...        0 min,  0.001 sec
     gradient                   ...        0 min,  0.001 sec
 * total energy  :    -9.6016411 Eh     change       -0.2877605E-02 Eh
   gradient norm :     0.1738369 Eh/α   predicted    -0.2815025E-01 ( 878.25%)
   displ. norm   :     0.3126244 α      lambda       -0.2619334E-01
   maximum displ.:     0.1763667 α      in ANC's #1, #2, #5, ...

........................................................................
.............................. CYCLE    6 ..............................
........................................................................
   1     -9.7852678 -0.978527E+01  0.139E+00    2.12       0.0  T
   2     -9.7817050  0.356272E-02  0.118E+00    2.30       1.0  T
   3     -9.7850106 -0.330555E-02  0.797E-01    2.12       1.0  T
   4     -9.7873465 -0.233587E-02  0.135E-01    2.19       1.0  T
   5     -9.7873947 -0.482289E-04  0.768E-02    2.19       1.0  T
   6     -9.7874103 -0.156375E-04  0.311E-02    2.19       1.4  T
   7     -9.7874113 -0.976157E-06  0.109E-02    2.19       4.1  T
   8     -9.7874117 -0.362035E-06  0.197E-03    2.19      22.7  T
   9     -9.7874117 -0.706906E-08  0.104E-03    2.19      43.0  T
  10     -9.7874117 -0.277558E-08  0.945E-05    2.19     473.0  T
  11     -9.7874117 -0.101608E-11  0.215E-05    2.19    2082.5  T
     SCC iter.                  ...        0 min,  0.001 sec
     gradient                   ...        0 min,  0.001 sec
 * total energy  :    -9.6187522 Eh     change       -0.1711106E-01 Eh
   gradient norm :     0.1120015 Eh/α   predicted    -0.1437665E-01 ( -15.98%)
   displ. norm   :     0.3279690 α      lambda       -0.1601266E-01
   maximum displ.:     0.1868553 α      in ANC's #1, #2, #6, ...

........................................................................
.............................. CYCLE    7 ..............................
........................................................................
   1     -9.8464373 -0.984644E+01  0.126E+00    2.21       0.0  T
   2     -9.8454236  0.101375E-02  0.922E-01    2.27       1.0  T
   3     -9.8468545 -0.143098E-02  0.656E-01    2.19       1.0  T
   4     -9.8483470 -0.149246E-02  0.999E-02    2.21       1.0  T
   5     -9.8483658 -0.187863E-04  0.507E-02    2.20       1.0  T
   6     -9.8483655  0.314135E-06  0.341E-02    2.21       1.3  T
   7     -9.8483693 -0.378770E-05  0.692E-03    2.20       6.5  T
   8     -9.8483693 -0.688402E-07  0.143E-03    2.20      31.3  T
   9     -9.8483693 -0.155541E-08  0.529E-04    2.20      84.5  T
  10     -9.8483693 -0.256449E-09  0.349E-05    2.20    1282.1  T
     SCC iter.                  ...        0 min,  0.001 sec
     gradient                   ...        0 min,  0.001 sec
 * total energy  :    -9.6189568 Eh     change       -0.2046028E-03 Eh
   gradient norm :     0.1019903 Eh/α   predicted    -0.8867512E-02 (4234.01%)
   displ. norm   :     0.3201888 α      lambda       -0.1486007E-01
   maximum displ.:     0.2536951 α      in ANC's #2, #1, #4, ...

........................................................................
.............................. CYCLE    8 ..............................
........................................................................
   1     -9.8354202 -0.983542E+01  0.985E-01    2.22       0.0  T
   2     -9.8352737  0.146535E-03  0.597E-01    2.19       1.0  T
   3     -9.8333304  0.194333E-02  0.649E-01    2.27       1.0  T
   4     -9.8357165 -0.238609E-02  0.632E-02    2.23       1.0  T
   5     -9.8357278 -0.113220E-04  0.300E-02    2.23       1.5  T
   6     -9.8357273  0.488906E-06  0.203E-02    2.23       2.2  T
   7     -9.8357287 -0.146244E-05  0.347E-03    2.23      12.9  T
   8     -9.8357287 -0.268164E-09  0.166E-03    2.23      27.0  T
   9     -9.8357288 -0.842534E-08  0.341E-04    2.23     131.0  T
  10     -9.8357288 -0.942624E-10  0.595E-05    2.23     751.5  T
     SCC iter.                  ...        0 min,  0.001 sec
     gradient                   ...        0 min,  0.001 sec
 * total energy  :    -9.6279190 Eh     change       -0.8962215E-02 Eh
   gradient norm :     0.0422977 Eh/α   predicted    -0.8191772E-02 (  -8.60%)
   displ. norm   :     0.3516658 α      lambda       -0.5014818E-02
   maximum displ.:     0.2236700 α      in ANC's #2, #1, #6, ...

........................................................................
.............................. CYCLE    9 ..............................
........................................................................
   1     -9.7912051 -0.979121E+01  0.133E+00    2.23       0.0  T
   2     -9.7894821  0.172300E-02  0.979E-01    2.08       1.0  T
   3     -9.7885990  0.883131E-03  0.889E-01    2.27       1.0  T
   4     -9.7923879 -0.378884E-02  0.130E-01    2.20       1.0  T
   5     -9.7924526 -0.646988E-04  0.639E-02    2.19       1.0  T
   6     -9.7924644 -0.118458E-04  0.306E-02    2.19       1.5  T
   7     -9.7924654 -0.982648E-06  0.418E-03    2.19      10.7  T
   8     -9.7924654 -0.132509E-07  0.373E-03    2.19      12.0  T
   9     -9.7924654 -0.431664E-07  0.506E-04    2.19      88.5  T
  10     -9.7924654 -0.168539E-09  0.953E-05    2.19     469.3  T
     SCC iter.                  ...        0 min,  0.001 sec
     gradient                   ...        0 min,  0.001 sec
 * total energy  :    -9.6248095 Eh     change        0.3109482E-02 Eh
   gradient norm :     0.1490501 Eh/α   predicted    -0.2817494E-02 (-190.61%)
   displ. norm   :     0.2370988 α      lambda       -0.1468945E-01
   maximum displ.:     0.1918577 α      in ANC's #1, #3, #4, ...

........................................................................
.............................. CYCLE   10 ..............................
........................................................................
   1     -9.8337224 -0.983372E+01  0.860E-01    2.25       0.0  T
   2     -9.8336429  0.794777E-04  0.591E-01    2.34       1.0  T
   3     -9.8318967  0.174624E-02  0.597E-01    2.21       1.0  T
   4     -9.8341277 -0.223108E-02  0.672E-02    2.30       1.0  T
   5     -9.8341442 -0.164591E-04  0.361E-02    2.30       1.2  T
   6     -9.8341480 -0.378023E-05  0.158E-02    2.30       2.8  T
   7     -9.8341486 -0.602084E-06  0.198E-03    2.30      22.6  T
   8     -9.8341486 -0.229071E-07  0.370E-04    2.30     120.9  T
   9     -9.8341486 -0.558131E-10  0.346E-05    2.30    1291.0  T
     SCC iter.                  ...        0 min,  0.001 sec
     gradient                   ...        0 min,  0.001 sec
 * total energy  :    -9.6302391 Eh     change       -0.5429595E-02 Eh
   gradient norm :     0.0486049 Eh/α   predicted    -0.7757614E-02 (  42.88%)
   displ. norm   :     0.1732472 α      lambda       -0.4065844E-02
   maximum displ.:     0.1301957 α      in ANC's #3, #1, #4, ...

........................................................................
.............................. CYCLE   11 ..............................
........................................................................
   1     -9.8434337 -0.984343E+01  0.672E-01    2.27       0.0  T
   2     -9.8429769  0.456886E-03  0.497E-01    2.31       1.0  T
   3     -9.8433319 -0.355042E-03  0.403E-01    2.25       1.0  T
   4     -9.8438542 -0.522260E-03  0.713E-02    2.27       1.0  T
   5     -9.8438769 -0.227295E-04  0.232E-02    2.27       1.9  T
   6     -9.8438767  0.142918E-06  0.171E-02    2.27       2.6  T
   7     -9.8438775 -0.749534E-06  0.167E-03    2.27      26.8  T
   8     -9.8438775 -0.410335E-08  0.644E-04    2.27      69.4  T
   9     -9.8438775 -0.271774E-09  0.117E-04    2.27     382.4  T
     SCC iter.                  ...        0 min,  0.001 sec
     gradient                   ...        0 min,  0.001 sec
 * total energy  :    -9.6314510 Eh     change       -0.1211884E-02 Eh
   gradient norm :     0.0336281 Eh/α   predicted    -0.2093938E-02 (  72.78%)
   displ. norm   :     0.0839582 α      lambda       -0.1413541E-02
   maximum displ.:     0.0707937 α      in ANC's #1, #5, #6, ...

........................................................................
.............................. CYCLE   12 ..............................
........................................................................
   1     -9.8414945 -0.984149E+01  0.280E-01    2.27       0.0  T
   2     -9.8413810  0.113514E-03  0.224E-01    2.24       1.0  T
   3     -9.8415064 -0.125381E-03  0.155E-01    2.27       1.0  T
   4     -9.8415871 -0.806992E-04  0.208E-02    2.26       2.2  T
   5     -9.8415885 -0.141803E-05  0.104E-02    2.26       4.3  T
   6     -9.8415886 -0.109742E-06  0.609E-03    2.26       7.3  T
   7     -9.8415887 -0.908585E-07  0.810E-04    2.26      55.2  T
   8     -9.8415887 -0.314190E-09  0.337E-04    2.26     132.9  T
     SCC iter.                  ...        0 min,  0.001 sec
     gradient                   ...        0 min,  0.001 sec
 * total energy  :    -9.6323249 Eh     change       -0.8738890E-03 Eh
   gradient norm :     0.0120398 Eh/α   predicted    -0.7117536E-03 ( -18.55%)
   displ. norm   :     0.0865820 α      lambda       -0.4748341E-03
   maximum displ.:     0.0467844 α      in ANC's #2, #6, #9, ...

........................................................................
.............................. CYCLE   13 ..............................
........................................................................
   1     -9.8384745 -0.983847E+01  0.327E-01    2.26       0.0  T
   2     -9.8384591  0.154344E-04  0.199E-01    2.25       1.0  T
   3     -9.8381997  0.259364E-03  0.220E-01    2.28       1.0  T
   4     -9.8384944 -0.294712E-03  0.135E-02    2.26       3.3  T
   5     -9.8384946 -0.127744E-06  0.906E-03    2.26       4.9  T
   6     -9.8384947 -0.141710E-06  0.291E-03    2.26      15.3  T
   7     -9.8384948 -0.366321E-07  0.670E-04    2.26      66.8  T
   8     -9.8384948 -0.972076E-10  0.308E-04    2.26     145.4  T
     SCC iter.                  ...        0 min,  0.001 sec
     gradient                   ...        0 min,  0.001 sec
 * total energy  :    -9.6326017 Eh     change       -0.2767687E-03 Eh
   gradient norm :     0.0178196 Eh/α   predicted    -0.2391978E-03 ( -13.57%)
   displ. norm   :     0.0514021 α      lambda       -0.2876382E-03
   maximum displ.:     0.0260538 α      in ANC's #9, #1, #6, ...

........................................................................
.............................. CYCLE   14 ..............................
........................................................................
   1     -9.8436364 -0.984364E+01  0.199E-01    2.25       0.0  T
   2     -9.8436399 -0.352956E-05  0.113E-01    2.26       1.0  T
   3     -9.8435870  0.529365E-04  0.949E-02    2.24       1.0  T
   4     -9.8436445 -0.574671E-04  0.954E-03    2.25       4.7  T
   5     -9.8436446 -0.132335E-06  0.439E-03    2.25      10.2  T
   6     -9.8436446 -0.122658E-08  0.705E-04    2.25      63.5  T
   7     -9.8436446 -0.618954E-09  0.494E-04    2.25      90.6  T
     SCC iter.                  ...        0 min,  0.001 sec
     gradient                   ...        0 min,  0.001 sec
 * total energy  :    -9.6327423 Eh     change       -0.1406654E-03 Eh
   gradient norm :     0.0079822 Eh/α   predicted    -0.1441998E-03 (   2.51%)
   displ. norm   :     0.0309624 α      lambda       -0.8461668E-04
   maximum displ.:     0.0156640 α      in ANC's #6, #9, #4, ...

........................................................................
.............................. CYCLE   15 ..............................
........................................................................
   1     -9.8435526 -0.984355E+01  0.117E-01    2.26       0.0  T
   2     -9.8435493  0.334552E-05  0.729E-02    2.26       1.0  T
   3     -9.8435226  0.267013E-04  0.786E-02    2.25       1.0  T
   4     -9.8435565 -0.338986E-04  0.425E-03    2.26      10.5  T
   5     -9.8435565  0.374373E-08  0.347E-03    2.26      12.9  T
   6     -9.8435565 -0.250209E-07  0.147E-03    2.26      30.4  T
   7     -9.8435565 -0.749892E-08  0.274E-04    2.26     163.5  T
   8     -9.8435565 -0.107484E-09  0.592E-05    2.26     755.7  T
     SCC iter.                  ...        0 min,  0.001 sec
     gradient                   ...        0 min,  0.001 sec
 * total energy  :    -9.6327887 Eh     change       -0.4637780E-04 Eh
   gradient norm :     0.0033048 Eh/α   predicted    -0.4234790E-04 (  -8.69%)
   displ. norm   :     0.0065661 α      lambda       -0.1000861E-04
   maximum displ.:     0.0039495 α      in ANC's #4, #2, #8, ...

........................................................................
.............................. CYCLE   16 ..............................
........................................................................
   1     -9.8442652 -0.984427E+01  0.202E-02    2.26       0.0  T
   2     -9.8442650  0.171777E-06  0.134E-02    2.26       3.3  T
   3     -9.8442644  0.590447E-06  0.134E-02    2.26       3.3  T
   4     -9.8442653 -0.940267E-06  0.156E-03    2.26      28.6  T
   5     -9.8442653 -0.686408E-08  0.694E-04    2.26      64.4  T
   6     -9.8442653 -0.968040E-09  0.273E-04    2.26     163.7  T
     SCC iter.                  ...        0 min,  0.000 sec
     gradient                   ...        0 min,  0.001 sec
 * total energy  :    -9.6327950 Eh     change       -0.6303505E-05 Eh
   gradient norm :     0.0014372 Eh/α   predicted    -0.5004589E-05 ( -20.61%)
   displ. norm   :     0.0150607 α      lambda       -0.7038035E-05
   maximum displ.:     0.0108909 α      in ANC's #1, #2, #5, ...

........................................................................
.............................. CYCLE   17 ..............................
........................................................................
   1     -9.8445105 -0.984451E+01  0.383E-02    2.26       0.0  T
   2     -9.8445105 -0.771865E-07  0.214E-02    2.26       2.1  T
   3     -9.8445103  0.294464E-06  0.737E-03    2.26       6.1  T
   4     -9.8445106 -0.343729E-06  0.124E-03    2.26      36.1  T
   5     -9.8445106 -0.213291E-09  0.564E-04    2.26      79.3  T
   6     -9.8445106 -0.295479E-10  0.264E-04    2.26     169.4  T
     SCC iter.                  ...        0 min,  0.000 sec
     gradient                   ...        0 min,  0.001 sec
 * total energy  :    -9.6328013 Eh     change       -0.6255838E-05 Eh
   gradient norm :     0.0015217 Eh/α   predicted    -0.3518685E-05 ( -43.75%)
   displ. norm   :     0.0082302 α      lambda       -0.3102151E-05
   maximum displ.:     0.0067882 α      in ANC's #1, #6, #7, ...

........................................................................
.............................. CYCLE   18 ..............................
........................................................................
   1     -9.8440136 -0.984401E+01  0.261E-02    2.26       0.0  T
   2     -9.8440133  0.367765E-06  0.178E-02    2.25       2.5  T
   3     -9.8440125  0.750158E-06  0.170E-02    2.26       2.6  T
   4     -9.8440140 -0.146808E-05  0.124E-03    2.26      36.0  T
   5     -9.8440140 -0.197249E-08  0.640E-04    2.26      69.9  T
   6     -9.8440140 -0.398900E-09  0.338E-04    2.26     132.3  T
     SCC iter.                  ...        0 min,  0.000 sec
     gradient                   ...        0 min,  0.001 sec
 * total energy  :    -9.6328035 Eh     change       -0.2221481E-05 Eh
   gradient norm :     0.0003030 Eh/α   predicted    -0.1549933E-05 ( -30.23%)
   displ. norm   :     0.0026243 α      lambda       -0.3354431E-06
   maximum displ.:     0.0016153 α      in ANC's #4, #3, #1, ...

   *** GEOMETRY OPTIMIZATION CONVERGED AFTER 18 ITERATIONS ***

------------------------------------------------------------------------
 total energy gain   :        -0.2200491 Eh     -138.0829 kcal/mol
 total RMSD          :         0.9709709 a0        0.5138 Å
 total power (kW/mol):       -32.0966041 (step)********** (real)
------------------------------------------------------------------------

 ANCopt (total)                0 d,  0 h,  0 min,  0.050 sec
 optimizer setup                ...        0 min,  0.000 sec (  0.134%)
 model hessian                  ...        0 min,  0.000 sec (  0.179%)
 ANC generation                 ...        0 min,  0.000 sec (  0.107%)
 coordinate transformation      ...        0 min,  0.000 sec (  0.074%)
 single point calculation       ...        0 min,  0.049 sec ( 96.820%)
 optimization log               ...        0 min,  0.000 sec (  0.830%)
 hessian update                 ...        0 min,  0.000 sec (  0.074%)
 rational function              ...        0 min,  0.000 sec (  0.795%)

================
 final structure:
================
5
 xtb: 6.2.2 (9d81278992624c895f80dd42a50cac0aa55982e2)
C        -1.23899339466356    1.09374939496745    0.36032344510599
C        -0.53157140544126    0.05496456463312    0.04761072602468
C         0.86304704420554   -0.09920738569550   -0.08027820650290
N         1.99850249908406   -0.19036900485365   -0.17699382539747
H        -1.09098374318479   -0.85913856905143   -0.15066213923029

 Bond Distances (Angstroems)
 ---------------------------
C1-C2=1.2951         C2-C1=1.2951         C2-C3=1.4089         C2-H5=1.0899         C3-C2=1.4089         C3-N4=1.1432         
N4-C3=1.1432         H5-C2=1.0899         
 C  H  Rav=1.0899 sigma=0.0000  Rmin=1.0899  Rmax=1.0899     1
 C  C  Rav=1.3520 sigma=0.0569  Rmin=1.2951  Rmax=1.4089     2
 N  C  Rav=1.1432 sigma=0.0000  Rmin=1.1432  Rmax=1.1432     1

 selected bond angles (degree)
 --------------------
C3-C2-C1=130.57                H5-C2-C1=115.87                H5-C2-C3=113.56                N4-C3-C2=178.25                

 selected dihedral angles (degree)
 ---------------------------------
N4-C3-C2-C1=357.68            N4-C3-C2-H5=177.81            
           -------------------------------------------------
          |                Final Singlepoint                |
           -------------------------------------------------

          ...................................................
          :                      SETUP                      :
          :.................................................:
          :  # basis functions                  17          :
          :  # atomic orbitals                  17          :
          :  # shells                            9          :
          :  # electrons                        18          :
          :  max. iterations                   250          :
          :  Hamiltonian                  GFN2-xTB          :
          :  restarted?                      false          :
          :  GBSA solvation                  false          :
          :  PC potential                    false          :
          :  electronic temp.          300.0000000     K    :
          :  accuracy                    1.0000000          :
          :  -> integral cutoff          0.2500000E+02      :
          :  -> integral neglect         0.1000000E-07      :
          :  -> SCF convergence          0.1000000E-05 Eh   :
          :  -> wf. convergence          0.1000000E-03 e    :
          :  Broyden damping             0.4000000          :
          ...................................................

 iter      E             dE          RMSdq      gap      omega  full diag
   1     -9.8440140 -0.984401E+01  0.118E-04    2.26       0.0  T
   2     -9.8440140  0.134648E-10  0.804E-05    2.26     556.3  T
   3     -9.8440140 -0.723510E-11  0.771E-05    2.26     579.7  T

   *** convergence criteria satisfied after 3 iterations ***

         #    Occupation            Energy/Eh            Energy/eV
      -------------------------------------------------------------
         1        2.0000           -0.6855272             -18.6541
       ...           ...                  ...                  ...
         3        2.0000           -0.6202756             -16.8786
         4        2.0000           -0.5712842             -15.5454
         5        2.0000           -0.5318470             -14.4723
         6        2.0000           -0.5095470             -13.8655
         7        2.0000           -0.4684262             -12.7465
         8        2.0000           -0.4624784             -12.5847
         9        2.0000           -0.4442155             -12.0877 (HOMO)
        10                         -0.3613038              -9.8316 (LUMO)
        11                         -0.2974663              -8.0945
        12                         -0.2358354              -6.4174
        13                         -0.1608868              -4.3780
        14                          0.1177633               3.2045
       ...                                ...                  ...
        17                          1.1575535              31.4986
      -------------------------------------------------------------
                  HL-Gap            0.0829117 Eh            2.2561 eV
             Fermi-level           -0.4027596 Eh          -10.9596 eV

 SCC (total)                   0 d,  0 h,  0 min,  0.002 sec
 SCC setup                      ...        0 min,  0.000 sec (  3.017%)
 Dispersion                     ...        0 min,  0.000 sec (  0.503%)
 integral evaluation            ...        0 min,  0.001 sec ( 39.990%)
 zeroth order Hamiltonian       ...        0 min,  0.000 sec (  0.503%)
 iterations                     ...        0 min,  0.000 sec ( 14.218%)
 molecular gradient             ...        0 min,  0.001 sec ( 39.578%)
 printout                       ...        0 min,  0.000 sec (  1.810%)

         :::::::::::::::::::::::::::::::::::::::::::::::::::::
         ::                     SUMMARY                     ::
         :::::::::::::::::::::::::::::::::::::::::::::::::::::
         :: total energy              -9.632803491403 Eh    ::
         :: gradient norm              0.000303142661 Eh/a0 ::
         :: HOMO-LUMO gap              2.256142811368 eV    ::
         ::.................................................::
         :: SCC energy                -9.844013979805 Eh    ::
         :: -> isotropic ES           -0.002066618825 Eh    ::
         :: -> anisotropic ES          0.000826392395 Eh    ::
         :: -> anisotropic XC          0.023263005839 Eh    ::
         :: -> dispersion             -0.002101023450 Eh    ::
         :: repulsion energy           0.211210437796 Eh    ::
         :: add. restraining           0.000000000000 Eh    ::
         :::::::::::::::::::::::::::::::::::::::::::::::::::::

           ------------------------------------------------- 
          |                Numerical Hessian                |
           ------------------------------------------------- 
step length          :   0.00500
SCC accuracy         :   0.30000
Hessian scale factor :   1.00000
frozen atoms in %    :   0.00000    0
RMS gradient         :   0.00030
estimated CPU  time      0.00 min
estimated wall time      0.00 min

writing file <hessian>.

 projected vibrational frequencies (cm-1)
eigval :       -0.00    -0.00    -0.00    -0.00     0.00     0.00
eigval :      151.67   363.04   379.47   664.08   860.04   956.98
eigval :     1723.31  2380.57  2949.12
           -------------------------------------------------
          |                Property Printout                |
           -------------------------------------------------

    * Orbital Energies and Occupations

         #    Occupation            Energy/Eh            Energy/eV
      -------------------------------------------------------------
         1        2.0000           -0.6855272             -18.6541
         2        2.0000           -0.6745543             -18.3556
         3        2.0000           -0.6202756             -16.8786
         4        2.0000           -0.5712840             -15.5454
         5        2.0000           -0.5318469             -14.4723
         6        2.0000           -0.5095470             -13.8655
         7        2.0000           -0.4684264             -12.7465
         8        2.0000           -0.4624785             -12.5847
         9        2.0000           -0.4442157             -12.0877 (HOMO)
        10                         -0.3613040              -9.8316 (LUMO)
        11                         -0.2974663              -8.0945
        12                         -0.2358353              -6.4174
        13                         -0.1608867              -4.3779
        14                          0.1177634               3.2045
        15                          0.2326433               6.3305
        16                          0.6150622              16.7367
        17                          1.1575536              31.4986
      -------------------------------------------------------------
                  HL-Gap            0.0829117 Eh            2.2561 eV
             Fermi-level           -0.4027599 Eh          -10.9597 eV

     #   Z        covCN         q      C6AA      α(0)
     1   6 C      0.988    -0.107    39.394    10.546
     2   6 C      2.886     0.005    27.908     8.661
     3   6 C      1.898     0.141    27.682     8.497
     4   7 N      0.911    -0.191    25.153     7.253
     5   1 H      0.925     0.153     1.373     1.832

 Mol. C6AA /au·bohr⁶  :        527.989234
 Mol. C8AA /au·bohr⁸  :      13911.552233
 Mol. α(0) /au        :         36.789735


Wiberg/Mayer (AO) data.
largest (>0.10) Wiberg bond orders for each atom
          total WBO             WBO to atom ...
     1  C   2.474        C    2 2.069    N    4 0.208    H    5 0.117
     2  C   3.987        C    1 2.069    C    3 1.058    H    5 0.816
     3  C   3.948        N    4 2.794    C    2 1.058
     4  N   3.074        C    3 2.794    C    1 0.208
     5  H   0.977        C    2 0.816    C    1 0.117

MOs/occ written to file <molden.input>


molecular dipole:
                 x           y           z       tot (Debye)
 q only:       -0.562      -0.427      -0.073
   full:       -0.758      -0.788      -0.153       2.807
molecular quadrupole (traceless):
                xx          xy          yy          xz          yz          zz
 q only:       -2.223       1.871       1.097       0.701      -0.149       1.126
  q+dip:       -3.688       3.710       1.854       1.316      -0.272       1.833
   full:       -5.170       5.109       1.978       1.868      -0.717       3.192

           -------------------------------------------------
          |                Geometry Summary                 |
           -------------------------------------------------

      molecular mass/u    :       51.0468517
   center of mass at/Å    :        0.3132981       0.1777360       0.0255522
  moments of inertia/u·Å² :        0.6403341E+01   0.9276072E+02   0.9916405E+02
rotational constants/cm⁻¹ :        0.2632631E+01   0.1817325E+00   0.1699974E+00

 * 3 selected distances

     #   Z        #   Z                                     value/Å
     1   6 C      2   6 C                                 1.2951097 (max)
     3   6 C      4   7 N                                 1.1432075
     2   6 C      5   1 H                                 1.0898802 (min)

 * 3 distinct bonds (by element types)

   Z      Z             #   av. dist./Å        max./Å        min./Å
   1 H    6 C           1     1.0898802     1.0898802     1.0898802
   6 C    6 C           1     1.2951097     1.2951097     1.2951097
   6 C    7 N           1     1.1432075     1.1432075     1.1432075

           -------------------------------------------------
          |               Frequency Printout                |
           -------------------------------------------------
Molecule has the following symmetry elements: (sigma) 
It seems to be the Cs point group
 projected vibrational frequencies (cm-1)
eigval :       -0.00    -0.00    -0.00    -0.00     0.00     0.00
eigval :      151.67   363.04   379.47   664.08   860.04   956.98
eigval :     1723.31  2380.57  2949.12
 reduced masses (amu)
   1: 12.42   2: 13.05   3: 10.34   4: 11.05   5: 11.70   6: 12.26   7: 12.03   8:  9.70
   9: 10.85  10:  7.74  11:  3.35  12: 12.10  13: 11.96  14: 12.79  15:  1.81
 IR intensities (amu)
   1:  0.13   2:  0.09   3:  0.37   4:  0.16   5:  0.01   6:  0.13   7:  0.23   8:  0.35
   9:  0.42  10:  0.30  11:  0.36  12:  0.36  13:  0.53  14:  1.57  15:  0.20
 Raman intensities (amu)
   1:  0.00   2:  0.00   3:  0.00   4:  0.00   5:  0.00   6:  0.00   7:  0.00   8:  0.00
   9:  0.00  10:  0.00  11:  0.00  12:  0.00  13:  0.00  14:  0.00  15:  0.00
 output can be read by thermo (or use thermo option).
 writing <g98.out> molden fake output.
 recommended (thermochemical) frequency scaling factor: 1.0
           -------------------------------------------------
          |             Thermodynamic Functions             |
           -------------------------------------------------

cs  symmetry found (for desy threshold:  0.10E+00) used in thermo

          ...................................................
          :                      SETUP                      :
          :.................................................:
          :  # frequencies                           9      :
          :  # imaginary freq.                       0      :
          :  linear?                             false      :
          :  only rotor calc.                    false      :
          :  symmetry                               cs      :
          :  rotational number                       1      :
          :  scaling factor                  1.0000000      :
          :  rotor cutoff                   50.0000000 cm⁻¹ :
          :  imag. cutoff                  -20.0000000 cm⁻¹ :
          :.................................................:

    mode    ω/cm⁻¹     T·S(HO)/kcal·mol⁻¹    T·S(FR)/kcal·mol⁻¹   T·S(vib)
   ------------------------------------------------------------------------
       1    151.67    -0.00000 ( 98.83%)     0.00934 (  1.17%)     0.00011
   ------------------------------------------------------------------------

   temp. (K)  partition function   enthalpy   heat capacity  entropy
                                   cal/mol     cal/K/mol   cal/K/mol   J/K/mol
 298.15  VIB   2.97                  974.937      6.883      5.431
         ROT  0.185E+05              888.752      2.981     22.511
         INT  0.551E+05             1863.689      9.864     27.942
         TR   0.353E+27             1481.254      4.968     37.697
         TOT                        3344.9429    14.8321    65.6383   274.6308

   temp. (K)  partition function   enthalpy   heat capacity  entropy
                                   cal/mol     cal/K/mol   cal/K/mol   J/K/mol
 120.00  VIB   1.22                  109.896      2.515      1.321
         ROT  0.473E+04              357.707      2.981     19.798
         INT  0.579E+04              467.603      5.496     21.119
         TR   0.901E+26              596.178      4.968     33.177
         TOT                        1063.7808    10.4637    54.2966   227.1769

   temp. (K)  partition function   enthalpy   heat capacity  entropy
                                   cal/mol     cal/K/mol   cal/K/mol   J/K/mol
 100.00  VIB   1.14                   65.540      1.920      0.919
         ROT  0.360E+04              298.089      2.981     19.255
         INT  0.410E+04              363.629      4.901     20.174
         TR   0.685E+26              496.815      4.968     32.272
         TOT                         860.4440     9.8692    52.4459   219.4337

   temp. (K)  partition function   enthalpy   heat capacity  entropy
                                   cal/mol     cal/K/mol   cal/K/mol   J/K/mol
  80.00  VIB   1.07                   33.040      1.333      0.560
         ROT  0.258E+04              238.471      2.981     18.589
         INT  0.276E+04              271.511      4.314     19.149
         TR   0.490E+26              397.452      4.968     31.164
         TOT                         668.9629     9.2823    50.3130   210.5096

   temp. (K)  partition function   enthalpy   heat capacity  entropy
                                   cal/mol     cal/K/mol   cal/K/mol   J/K/mol
  60.00  VIB   1.03                   12.021      0.774      0.261
         ROT  0.167E+04              178.853      2.981     17.732
         INT  0.172E+04              190.874      3.754     17.993
         TR   0.319E+26              298.089      4.968     29.735
         TOT                         488.9631     8.7225    47.7280   199.6939

   temp. (K)  partition function   enthalpy   heat capacity  entropy
                                   cal/mol     cal/K/mol   cal/K/mol   J/K/mol
  40.00  VIB   1.00                    1.864      0.256      0.059
         ROT   911.                  119.236      2.981     16.523
         INT   915.                  121.100      3.237     16.583
         TR   0.173E+26              198.726      4.968     27.722
         TOT                         319.8259     8.2051    44.3044   185.3695

   temp. (K)  partition function   enthalpy   heat capacity  entropy
                                   cal/mol     cal/K/mol   cal/K/mol   J/K/mol
  20.00  VIB   1.00                    0.008      0.004     -0.003
         ROT   322.                   59.618      2.981     14.457
         INT   322.                   59.626      2.985     14.454
         TR   0.613E+25               99.363      4.968     24.280
         TOT                         158.9887     7.9534    38.7336   162.0614

   temp. (K)  partition function   enthalpy   heat capacity  entropy
                                   cal/mol     cal/K/mol   cal/K/mol   J/K/mol
  10.00  VIB   1.00                    0.000      0.000     -0.012
         ROT   114.                   29.809      2.981     12.391
         INT   114.                   29.809      2.981     12.379
         TR   0.217E+25               49.681      4.968     20.838
         TOT                          79.4904     7.9490    33.2165   138.9778

       T/K    H(0)-H(T)+PV         H(T)/Eh          T*S/Eh         G(T)/Eh
   ------------------------------------------------------------------------
    298.15    0.533051E-02    0.290879E-01    0.311869E-01   -0.209900E-02
    120.00    0.169524E-02    0.254526E-01    0.103833E-01    0.150694E-01
    100.00    0.137120E-02    0.251286E-01    0.835779E-02    0.167708E-01
     80.00    0.106606E-02    0.248234E-01    0.641431E-02    0.184091E-01
     60.00    0.779212E-03    0.245366E-01    0.456356E-02    0.199730E-01
     40.00    0.509675E-03    0.242671E-01    0.282414E-02    0.214429E-01
     20.00    0.253365E-03    0.240107E-01    0.123452E-02    0.227762E-01
     10.00    0.126676E-03    0.238841E-01    0.529338E-03    0.233547E-01 (used)
   ------------------------------------------------------------------------

         :::::::::::::::::::::::::::::::::::::::::::::::::::::
         ::                  THERMODYNAMIC                  ::
         :::::::::::::::::::::::::::::::::::::::::::::::::::::
         :: total free energy          -9.609448769668 Eh   ::
         ::.................................................::
         :: total energy               -9.632803491410 Eh   ::
         :: zero point energy           0.023757384123 Eh   ::
         :: G(RRHO) w/o ZPVE           -0.000402662381 Eh   ::
         :: G(RRHO) contrib.            0.023354721742 Eh   ::
         :::::::::::::::::::::::::::::::::::::::::::::::::::::

optimized geometry written to: xtbopt.xyz


           -------------------------------------------------
          | TOTAL ENERGY               -9.632803491410 Eh   |
          | TOTAL ENTHALPY             -9.608919431271 Eh   |
          | TOTAL FREE ENERGY          -9.609448769668 Eh   |
          | GRADIENT NORM               0.000303293448 Eh/α |
          | HOMO-LUMO GAP               2.256143131682 eV   |
           -------------------------------------------------

------------------------------------------------------------------------
 * finished run on 2020/05/12 at 11:44:52.567     
------------------------------------------------------------------------
 total:
 * wall-time:     0 d,  0 h,  0 min,  0.149 sec
 *  cpu-time:     0 d,  0 h,  0 min,  0.149 sec
 * ratio c/w:     0.998 speedup
 SCF:
 * wall-time:     0 d,  0 h,  0 min,  0.004 sec
 *  cpu-time:     0 d,  0 h,  0 min,  0.004 sec
 * ratio c/w:     0.991 speedup
 ANC optimizer:
 * wall-time:     0 d,  0 h,  0 min,  0.053 sec
 *  cpu-time:     0 d,  0 h,  0 min,  0.053 sec
 * ratio c/w:     0.999 speedup
 numerical hessian:
 * wall-time:     0 d,  0 h,  0 min,  0.075 sec
 *  cpu-time:     0 d,  0 h,  0 min,  0.075 sec
 * ratio c/w:     0.998 speedup

