      -----------------------------------------------------------      
     |                   =====================                   |     
     |                           x T B                           |     
     |                   =====================                   |     
     |                         S. Grimme                         |     
     |          Mulliken Center for Theoretical Chemistry        |     
     |                    University of Bonn                     |     
      -----------------------------------------------------------      

   * xtb version 6.2.2 (9d81278992624c895f80dd42a50cac0aa55982e2) compiled by '@Darwin' on 04/03/2020

   xtb is free software: you can redistribute it and/or modify it under
   the terms of the GNU Lesser General Public License as published by
   the Free Software Foundation, either version 3 of the License, or
   (at your option) any later version.
   
   xtb is distributed in the hope that it will be useful,
   but WITHOUT ANY WARRANTY; without even the implied warranty of
   MERCHANTABILITY or FITNESS FOR A PARTICULAR PURPOSE.  See the
   GNU Lesser General Public License for more details.
   
   Cite this work as:
   * S. Grimme, C. Bannwarth, P. Shushkov, J. Chem. Theory Comput., 2017,
     13, 1989-2009. DOI: 10.1021/acs.jctc.7b00118
   * C. Bannwarth, S. Ehlert and S. Grimme., J. Chem. Theory Comput., 2019,
     15, 1652-1671. DOI: 10.1021/acs.jctc.8b01176
   * P. Pracht, E. Caldeweyher, S. Ehlert, S. Grimme, ChemRxiv, 2019, preprint.
     DOI: 10.26434/chemrxiv.8326202.v1
   
   for DFT-D4:
   * E. Caldeweyher, C. Bannwarth and S. Grimme, J. Chem. Phys., 2017,
     147, 034112. DOI: 10.1063/1.4993215
   * E. Caldeweyher, S. Ehlert, A. Hansen, H. Neugebauer, S. Spicher,
     C. Bannwarth and S. Grimme, J. Chem. Phys., 2019, 150, 154122.
     DOI: 10.1063/1.5090222
   
   for sTDA-xTB:
   * S. Grimme and C. Bannwarth, J. Chem. Phys., 2016, 145, 054103.
     DOI: 10.1063/1.4959605
   
   in the mass-spec context:
   * V. Asgeirsson, C. Bauer and S. Grimme, Chem. Sci., 2017, 8, 4879.
     DOI: 10.1039/c7sc00601b
   
   for metadynamics refer to:
   * S. Grimme, J. Chem. Theory Comput., 2019, 155, 2847-2862
     DOI: 10.1021/acs.jctc.9b00143
   
   with help from (in alphabetical order)
   C. Bannwarth, F. Bohle, G. Brandenburg, E. Caldeweyher, M. Checinski,
   S. Dohm, S. Ehlert, S. Ehrlich, F. März, H. Neugebauer, J. Pisarek,
   P. Pracht, P. Shushkov, and S. Spicher.
   
 * started run on 2020/05/12 at 11:45:20.238     

           -------------------------------------------------
          |                Calculation Setup                |
           -------------------------------------------------

          program call               : xtb --input H2C1N2_1_S_0.input H2C1N2_1_S_0.xyz --ohess --molden --namespace H2C1N2_1_S_0 output.out
          calculation namespace      : H2C1N2_1_S_0
          coordinate file            : H2C1N2_1_S_0.xyz
          number of atoms            :                     5
          number of electrons        :                    16
          charge                     :                     0
          spin                       :                   0.0
          first test random number   :      0.26626220198845

   ID    Z sym.   atoms
    1    7 N      1, 3
    2    6 C      2
    3    1 H      4, 5

           -------------------------------------------------
          |                 G F N 2 - x T B                 |
           -------------------------------------------------

        Reference                      10.1021/acs.jctc.8b01176
      * Hamiltonian:
        H0-scaling (s, p, d)           1.850000    2.230000    2.230000
        zeta-weighting                 0.500000
      * Dispersion:
        s8                             2.700000
        a1                             0.520000
        a2                             5.000000
        s9                             5.000000
      * Repulsion:
        kExp                           1.500000    1.000000
        rExp                           1.000000
      * Coulomb:
        alpha                          2.000000
        third order                    shell-resolved
        anisotropic                    true
        a3                             3.000000
        a5                             4.000000
        cn-shift                       1.200000
        cn-exp                         4.000000
        max-rad                        5.000000


          ...................................................
          :                      SETUP                      :
          :.................................................:
          :  # basis functions                  14          :
          :  # atomic orbitals                  14          :
          :  # shells                            8          :
          :  # electrons                        16          :
          :  max. iterations                   250          :
          :  Hamiltonian                  GFN2-xTB          :
          :  restarted?                      false          :
          :  GBSA solvation                  false          :
          :  PC potential                    false          :
          :  electronic temp.          300.0000000     K    :
          :  accuracy                    1.0000000          :
          :  -> integral cutoff          0.2500000E+02      :
          :  -> integral neglect         0.1000000E-07      :
          :  -> SCF convergence          0.1000000E-05 Eh   :
          :  -> wf. convergence          0.1000000E-03 e    :
          :  Broyden damping             0.4000000          :
          ...................................................

 iter      E             dE          RMSdq      gap      omega  full diag
   1     -8.2783333 -0.827833E+01  0.852E+00    0.68       0.0  T
   2     -6.7039246  0.157441E+01  0.166E+01    4.08       1.0  T
   3     -8.0159969 -0.131207E+01  0.104E+01    0.70       1.0  T
   4     -8.4378561 -0.421859E+00  0.774E+00    0.49       1.0  T
   5     -8.5406011 -0.102745E+00  0.721E+00    0.49       1.0  T
   6     -8.6865395 -0.145938E+00  0.615E+00    0.14       1.0  T
   7     -8.1429784  0.543561E+00  0.106E+01    0.28       1.0  T
   8     -8.4014677 -0.258489E+00  0.746E+00    0.27       1.0  T
   9     -8.6258261 -0.224358E+00  0.406E+00    0.19       1.0  T
  10     -8.6749029 -0.490768E-01  0.296E+00    0.13       1.0  T
  11     -8.7191644 -0.442616E-01  0.235E+00    0.21       1.0  T
  12     -8.7239082 -0.474378E-02  0.144E+00    0.11       1.0  T
  13     -8.7224869  0.142130E-02  0.123E+00    0.10       1.0  T
  14     -8.7244738 -0.198685E-02  0.790E-01    0.13       1.0  T
  15     -8.7232584  0.121534E-02  0.657E-01    0.12       1.0  T
  16     -8.7249885 -0.173005E-02  0.215E-01    0.12       1.0  T
  17     -8.7250601 -0.716652E-04  0.142E-01    0.12       1.0  T
  18     -8.7250656 -0.550004E-05  0.744E-02    0.13       1.0  T
  19     -8.7250798 -0.141901E-04  0.195E-02    0.13       2.3  T
  20     -8.7250798  0.340706E-07  0.117E-02    0.13       3.8  T
  21     -8.7250800 -0.167565E-06  0.701E-03    0.13       6.4  T
  22     -8.7250802 -0.194576E-06  0.215E-03    0.13      20.8  T
  23     -8.7250802 -0.187176E-07  0.763E-04    0.13      58.6  T
  24     -8.7250802 -0.215405E-08  0.126E-04    0.13     355.5  T

   *** convergence criteria satisfied after 24 iterations ***

         #    Occupation            Energy/Eh            Energy/eV
      -------------------------------------------------------------
         1        2.0000           -0.6852748             -18.6473
         2        2.0000           -0.6270524             -17.0630
         3        2.0000           -0.6060940             -16.4927
         4        2.0000           -0.5611435             -15.2695
         5        2.0000           -0.5052314             -13.7480
         6        2.0000           -0.4752581             -12.9324
         7        2.0000           -0.4102258             -11.1628
         8        1.8502           -0.3755491             -10.2192 (HOMO)
         9        0.1498           -0.3707726             -10.0892 (LUMO)
        10                         -0.3481381              -9.4733
        11                         -0.0117256              -0.3191
        12                          0.0490426               1.3345
        13                          0.0721831               1.9642
        14                          0.1508273               4.1042
      -------------------------------------------------------------
                  HL-Gap            0.0047765 Eh            0.1300 eV
             Fermi-level           -0.3731609 Eh          -10.1542 eV

 SCC (total)                   0 d,  0 h,  0 min,  0.004 sec
 SCC setup                      ...        0 min,  0.000 sec (  2.081%)
 Dispersion                     ...        0 min,  0.000 sec (  0.348%)
 integral evaluation            ...        0 min,  0.001 sec ( 18.036%)
 zeroth order Hamiltonian       ...        0 min,  0.000 sec (  0.375%)
 iterations                     ...        0 min,  0.002 sec ( 57.178%)
 molecular gradient             ...        0 min,  0.001 sec ( 19.096%)
 printout                       ...        0 min,  0.000 sec (  2.572%)

         :::::::::::::::::::::::::::::::::::::::::::::::::::::
         ::                     SUMMARY                     ::
         :::::::::::::::::::::::::::::::::::::::::::::::::::::
         :: total energy              -8.678932623992 Eh    ::
         :: gradient norm              0.173678052868 Eh/a0 ::
         :: HOMO-LUMO gap              0.129975943333 eV    ::
         ::.................................................::
         :: SCC energy                -8.725080172400 Eh    ::
         :: -> isotropic ES            0.008454633592 Eh    ::
         :: -> anisotropic ES          0.000965406195 Eh    ::
         :: -> anisotropic XC          0.012512218815 Eh    ::
         :: -> dispersion             -0.001425447201 Eh    ::
         :: repulsion energy           0.046147509731 Eh    ::
         :: add. restraining           0.000000000000 Eh    ::
         :::::::::::::::::::::::::::::::::::::::::::::::::::::

      ----------------------------------------------------------- 
     |                   =====================                   |
     |                        A N C O P T                        |
     |                   =====================                   |
     |               Approximate Normal Coordinate               |
     |                Rational Function Optimizer                |
      ----------------------------------------------------------- 

          ...................................................
          :                      SETUP                      :
          :.................................................:
          :   optimization level            normal          :
          :   max. optcycles                   200          :
          :   ANC micro-cycles                  20          :
          :   degrees of freedom                 9          :
          :.................................................:
          :   RF solver                   davidson          :
          :   write xtbopt.log                true          :
          :   linear?                        false          :
          :   energy convergence         0.5000000E-05 Eh   :
          :   grad. convergence          0.1000000E-02 Eh/α :
          :   maximium RF displ.         1.0000000          :
          :   Hlow (freq-cutoff)         0.1000000E-01      :
          :   Hmax (freq-cutoff)         5.0000000          :
          :   S6 in model hess.         20.0000000          :
          ...................................................

generating ANC from model Hessian ...
Using Lindh-Hessian (1995)
 Shifting diagonal of input Hessian by    0.0000000000000000     
 Lowest  eigenvalues of input Hessian
   -0.000000   -0.000000   -0.000000   -0.000000    0.000000    0.000000
    0.016322    0.044855    0.131692    0.170184    0.194239    0.677997
    0.883290    1.214293    1.328202
 Highest eigenvalues
    0.170184    0.194239    0.677997    0.883290    1.214293    1.328202


........................................................................
.............................. CYCLE    1 ..............................
........................................................................
   1     -8.7250802 -0.872508E+01  0.500E-05    0.13       0.0  T
   2     -8.7250802  0.180220E-09  0.179E-04    0.13     249.7  T
   3     -8.7250802 -0.130470E-09  0.101E-04    0.13     443.2  T
     SCC iter.                  ...        0 min,  0.001 sec
     gradient                   ...        0 min,  0.001 sec
 * total energy  :    -8.6789326 Eh     change       -0.4496865E-09 Eh
   gradient norm :     0.1736784 Eh/α   predicted     0.0000000E+00 (-100.00%)
   displ. norm   :     0.3821326 α      lambda       -0.4853135E-01
   maximum displ.:     0.3022877 α      in ANC's #3, #6, #2, ...

........................................................................
.............................. CYCLE    2 ..............................
........................................................................
   1     -8.7673885 -0.876739E+01  0.328E+00    1.06       0.0  T
   2     -8.2776189  0.489770E+00  0.834E+00    0.85       1.0  T
   3     -8.7208605 -0.443242E+00  0.347E+00    1.03       1.0  T
   4     -8.7870833 -0.662227E-01  0.942E-01    0.95       1.0  T
   5     -8.7877068 -0.623523E-03  0.585E-01    0.89       1.0  T
   6     -8.7882571 -0.550312E-03  0.210E-01    0.81       1.0  T
   7     -8.7884760 -0.218895E-03  0.583E-02    0.81       1.0  T
   8     -8.7884798 -0.376707E-05  0.181E-02    0.80       2.5  T
   9     -8.7884806 -0.818627E-06  0.994E-03    0.80       4.5  T
  10     -8.7884809 -0.318876E-06  0.303E-03    0.80      14.8  T
  11     -8.7884809 -0.661814E-08  0.766E-04    0.80      58.4  T
  12     -8.7884809 -0.130834E-08  0.103E-04    0.80     434.0  T
     SCC iter.                  ...        0 min,  0.001 sec
     gradient                   ...        0 min,  0.001 sec
 * total energy  :    -8.7267061 Eh     change       -0.4777352E-01 Eh
   gradient norm :     0.1500657 Eh/α   predicted    -0.2780907E-01 ( -41.79%)
   displ. norm   :     0.8107849 α      lambda       -0.1013794E+00
   maximum displ.:     0.6301023 α      in ANC's #3, #6, #7, ...

........................................................................
.............................. CYCLE    3 ..............................
........................................................................
   1     -8.8581641 -0.885816E+01  0.457E+00    2.59       0.0  T
   2     -8.7794913  0.786728E-01  0.508E+00    1.79       1.0  T
   3     -8.8775388 -0.980476E-01  0.216E+00    2.34       1.0  T
   4     -8.8898606 -0.123217E-01  0.361E-01    2.14       1.0  T
   5     -8.8899822 -0.121628E-03  0.206E-01    2.11       1.0  T
   6     -8.8900134 -0.312691E-04  0.233E-02    2.09       1.9  T
   7     -8.8900143 -0.833728E-06  0.976E-03    2.10       4.6  T
   8     -8.8900144 -0.117912E-06  0.189E-03    2.09      23.7  T
   9     -8.8900144 -0.278239E-08  0.619E-04    2.09      72.3  T
  10     -8.8900144 -0.309150E-09  0.194E-04    2.09     231.0  T
     SCC iter.                  ...        0 min,  0.001 sec
     gradient                   ...        0 min,  0.001 sec
 * total energy  :    -8.7704170 Eh     change       -0.4371083E-01 Eh
   gradient norm :     0.2102769 Eh/α   predicted    -0.8401174E-01 (  92.20%)
   displ. norm   :     0.3124616 α      lambda       -0.3832998E-01
   maximum displ.:     0.2247664 α      in ANC's #3, #4, #2, ...

........................................................................
.............................. CYCLE    4 ..............................
........................................................................
   1     -8.7419656 -0.874197E+01  0.530E+00    0.84       0.0  T
   2     -8.4931918  0.248774E+00  0.869E+00    2.75       1.0  T
   3     -8.8377895 -0.344598E+00  0.140E+00    1.27       1.0  T
   4     -8.8431508 -0.536131E-02  0.565E-01    1.07       1.0  T
   5     -8.8432153 -0.644834E-04  0.221E-01    1.08       1.0  T
   6     -8.8432227 -0.739168E-05  0.480E-02    1.07       1.0  T
   7     -8.8432232 -0.484444E-06  0.284E-02    1.08       1.6  T
   8     -8.8432255 -0.233621E-05  0.119E-02    1.07       3.7  T
   9     -8.8432260 -0.479586E-06  0.317E-03    1.07      14.1  T
  10     -8.8432260 -0.185833E-07  0.129E-03    1.07      34.7  T
  11     -8.8432260 -0.496621E-08  0.302E-04    1.07     148.2  T
  12     -8.8432260 -0.314264E-09  0.428E-05    1.07    1044.4  T
     SCC iter.                  ...        0 min,  0.001 sec
     gradient                   ...        0 min,  0.001 sec
 * total energy  :    -8.7770079 Eh     change       -0.6590903E-02 Eh
   gradient norm :     0.0879546 Eh/α   predicted    -0.2103610E-01 ( 219.17%)
   displ. norm   :     0.4597228 α      lambda       -0.1931712E-01
   maximum displ.:     0.4148228 α      in ANC's #1, #3, #5, ...

........................................................................
.............................. CYCLE    5 ..............................
........................................................................
   1     -8.8659206 -0.886592E+01  0.160E+00    1.12       0.0  T
   2     -8.8579662  0.795443E-02  0.175E+00    1.13       1.0  T
   3     -8.8538680  0.409814E-02  0.173E+00    1.02       1.0  T
   4     -8.8664846 -0.126166E-01  0.619E-01    1.13       1.0  T
   5     -8.8680085 -0.152384E-02  0.951E-02    1.08       1.0  T
   6     -8.8680205 -0.119656E-04  0.229E-02    1.07       2.0  T
   7     -8.8680213 -0.887972E-06  0.112E-02    1.07       4.0  T
   8     -8.8680217 -0.352623E-06  0.142E-03    1.07      31.5  T
   9     -8.8680217 -0.116005E-09  0.590E-04    1.07      75.8  T
  10     -8.8680217 -0.833529E-09  0.205E-04    1.07     218.4  T
     SCC iter.                  ...        0 min,  0.001 sec
     gradient                   ...        0 min,  0.001 sec
 * total energy  :    -8.7831394 Eh     change       -0.6131494E-02 Eh
   gradient norm :     0.0583848 Eh/α   predicted    -0.1169986E-01 (  90.82%)
   displ. norm   :     0.3219968 α      lambda       -0.1137567E-01
   maximum displ.:     0.2428152 α      in ANC's #1, #2, #3, ...

........................................................................
.............................. CYCLE    6 ..............................
........................................................................
   1     -8.8846167 -0.888462E+01  0.132E+00    1.54       0.0  T
   2     -8.8534049  0.312119E-01  0.263E+00    1.30       1.0  T
   3     -8.8870376 -0.336327E-01  0.748E-01    1.44       1.0  T
   4     -8.8885660 -0.152838E-02  0.158E-01    1.40       1.0  T
   5     -8.8886287 -0.627628E-04  0.291E-02    1.38       1.5  T
   6     -8.8886286  0.122440E-06  0.960E-03    1.38       4.7  T
   7     -8.8886289 -0.257964E-06  0.297E-03    1.38      15.1  T
   8     -8.8886289 -0.257896E-07  0.429E-04    1.38     104.2  T
   9     -8.8886289 -0.256755E-10  0.847E-05    1.38     528.2  T
     SCC iter.                  ...        0 min,  0.001 sec
     gradient                   ...        0 min,  0.001 sec
 * total energy  :    -8.7849701 Eh     change       -0.1830750E-02 Eh
   gradient norm :     0.0516557 Eh/α   predicted    -0.6277556E-02 ( 242.90%)
   displ. norm   :     0.2614646 α      lambda       -0.7775032E-02
   maximum displ.:     0.1484145 α      in ANC's #1, #3, #2, ...

........................................................................
.............................. CYCLE    7 ..............................
........................................................................
   1     -8.8777000 -0.887770E+01  0.114E+00    1.27       0.0  T
   2     -8.8623428  0.153571E-01  0.196E+00    1.47       1.0  T
   3     -8.8790513 -0.167084E-01  0.631E-01    1.31       1.0  T
   4     -8.8800541 -0.100283E-02  0.678E-02    1.33       1.0  T
   5     -8.8800515  0.259386E-05  0.626E-02    1.34       1.0  T
   6     -8.8800618 -0.103362E-04  0.686E-03    1.33       6.5  T
   7     -8.8800619 -0.111681E-06  0.241E-03    1.33      18.6  T
   8     -8.8800620 -0.248275E-08  0.816E-04    1.33      54.8  T
   9     -8.8800620 -0.221359E-08  0.143E-04    1.33     312.7  T
     SCC iter.                  ...        0 min,  0.001 sec
     gradient                   ...        0 min,  0.001 sec
 * total energy  :    -8.7874230 Eh     change       -0.2452923E-02 Eh
   gradient norm :     0.0561352 Eh/α   predicted    -0.4153279E-02 (  69.32%)
   displ. norm   :     0.1296174 α      lambda       -0.3239693E-02
   maximum displ.:     0.1144768 α      in ANC's #2, #8, #5, ...

........................................................................
.............................. CYCLE    8 ..............................
........................................................................
   1     -8.8796864 -0.887969E+01  0.448E-01    1.20       0.0  T
   2     -8.8784376  0.124879E-02  0.583E-01    1.28       1.0  T
   3     -8.8793065 -0.868893E-03  0.411E-01    1.23       1.0  T
   4     -8.8799894 -0.682846E-03  0.865E-02    1.24       1.0  T
   5     -8.8799946 -0.525908E-05  0.209E-02    1.24       2.1  T
   6     -8.8799953 -0.656311E-06  0.888E-03    1.24       5.0  T
   7     -8.8799955 -0.217067E-06  0.217E-03    1.24      20.6  T
   8     -8.8799955 -0.155072E-07  0.273E-04    1.24     163.7  T
   9     -8.8799955 -0.561045E-10  0.546E-05    1.24     819.2  T
     SCC iter.                  ...        0 min,  0.001 sec
     gradient                   ...        0 min,  0.001 sec
 * total energy  :    -8.7884970 Eh     change       -0.1073957E-02 Eh
   gradient norm :     0.0239550 Eh/α   predicted    -0.1647059E-02 (  53.36%)
   displ. norm   :     0.0854630 α      lambda       -0.1137694E-02
   maximum displ.:     0.0648639 α      in ANC's #2, #1, #5, ...

........................................................................
.............................. CYCLE    9 ..............................
........................................................................
   1     -8.8821434 -0.888214E+01  0.240E-01    1.29       0.0  T
   2     -8.8812784  0.864927E-03  0.470E-01    1.30       1.0  T
   3     -8.8822149 -0.936485E-03  0.129E-01    1.27       1.0  T
   4     -8.8822620 -0.470203E-04  0.512E-02    1.28       1.0  T
   5     -8.8822682 -0.628692E-05  0.979E-03    1.28       4.6  T
   6     -8.8822685 -0.217849E-06  0.176E-03    1.28      25.4  T
   7     -8.8822685 -0.690321E-08  0.434E-04    1.28     103.0  T
   8     -8.8822685 -0.119606E-09  0.101E-04    1.28     442.6  T
     SCC iter.                  ...        0 min,  0.001 sec
     gradient                   ...        0 min,  0.001 sec
 * total energy  :    -8.7892371 Eh     change       -0.7400966E-03 Eh
   gradient norm :     0.0099506 Eh/α   predicted    -0.5730032E-03 ( -22.58%)
   displ. norm   :     0.0853510 α      lambda       -0.5882899E-03
   maximum displ.:     0.0485617 α      in ANC's #2, #1, #6, ...

........................................................................
.............................. CYCLE   10 ..............................
........................................................................
   1     -8.8843995 -0.888440E+01  0.339E-01    1.32       0.0  T
   2     -8.8826481  0.175142E-02  0.656E-01    1.35       1.0  T
   3     -8.8845151 -0.186692E-02  0.186E-01    1.31       1.0  T
   4     -8.8846140 -0.989809E-04  0.456E-02    1.32       1.0  T
   5     -8.8846214 -0.738378E-05  0.825E-03    1.32       5.4  T
   6     -8.8846215 -0.362600E-07  0.167E-03    1.32      26.8  T
   7     -8.8846215 -0.345443E-08  0.557E-04    1.32      80.3  T
   8     -8.8846215 -0.206416E-09  0.118E-04    1.32     377.9  T
     SCC iter.                  ...        0 min,  0.001 sec
     gradient                   ...        0 min,  0.001 sec
 * total energy  :    -8.7896173 Eh     change       -0.3802199E-03 Eh
   gradient norm :     0.0100619 Eh/α   predicted    -0.2962875E-03 ( -22.07%)
   displ. norm   :     0.0593699 α      lambda       -0.2295698E-03
   maximum displ.:     0.0367378 α      in ANC's #1, #2, #8, ...

........................................................................
.............................. CYCLE   11 ..............................
........................................................................
   1     -8.8841539 -0.888415E+01  0.254E-01    1.32       0.0  T
   2     -8.8828275  0.132643E-02  0.562E-01    1.36       1.0  T
   3     -8.8842814 -0.145388E-02  0.109E-01    1.33       1.0  T
   4     -8.8843033 -0.218910E-04  0.899E-03    1.33       5.0  T
   5     -8.8843032  0.356764E-07  0.474E-03    1.33       9.4  T
   6     -8.8843033 -0.371047E-07  0.176E-03    1.33      25.5  T
   7     -8.8843033 -0.100172E-07  0.126E-04    1.33     354.9  T
   8     -8.8843033 -0.159890E-10  0.399E-05    1.33    1122.0  T
     SCC iter.                  ...        0 min,  0.001 sec
     gradient                   ...        0 min,  0.001 sec
 * total energy  :    -8.7897517 Eh     change       -0.1344047E-03 Eh
   gradient norm :     0.0033413 Eh/α   predicted    -0.1151897E-03 ( -14.30%)
   displ. norm   :     0.0199184 α      lambda       -0.3979329E-04
   maximum displ.:     0.0100118 α      in ANC's #2, #1, #6, ...

........................................................................
.............................. CYCLE   12 ..............................
........................................................................
   1     -8.8847901 -0.888479E+01  0.876E-02    1.30       0.0  T
   2     -8.8847659  0.242302E-04  0.932E-02    1.30       1.0  T
   3     -8.8847671 -0.126962E-05  0.795E-02    1.31       1.0  T
   4     -8.8847943 -0.271926E-04  0.137E-02    1.30       3.3  T
   5     -8.8847950 -0.698311E-06  0.288E-03    1.30      15.5  T
   6     -8.8847950 -0.829736E-08  0.412E-04    1.30     108.5  T
   7     -8.8847950 -0.278243E-09  0.124E-04    1.30     359.7  T
     SCC iter.                  ...        0 min,  0.001 sec
     gradient                   ...        0 min,  0.001 sec
 * total energy  :    -8.7897634 Eh     change       -0.1169894E-04 Eh
   gradient norm :     0.0020138 Eh/α   predicted    -0.1990371E-04 (  70.13%)
   displ. norm   :     0.0073367 α      lambda       -0.1208439E-04
   maximum displ.:     0.0047727 α      in ANC's #3, #2, #5, ...

........................................................................
.............................. CYCLE   13 ..............................
........................................................................
   1     -8.8844776 -0.888448E+01  0.480E-02    1.33       0.0  T
   2     -8.8844781 -0.481746E-06  0.255E-02    1.33       1.8  T
   3     -8.8844712  0.689722E-05  0.392E-02    1.33       1.1  T
   4     -8.8844780 -0.683042E-05  0.944E-03    1.33       4.7  T
   5     -8.8844784 -0.375902E-06  0.307E-03    1.33      14.6  T
   6     -8.8844784 -0.251929E-07  0.313E-04    1.33     143.0  T
   7     -8.8844784 -0.292175E-10  0.119E-04    1.33     377.0  T
     SCC iter.                  ...        0 min,  0.000 sec
     gradient                   ...        0 min,  0.001 sec
 * total energy  :    -8.7897687 Eh     change       -0.5244851E-05 Eh
   gradient norm :     0.0007453 Eh/α   predicted    -0.6043040E-05 (  15.22%)
   displ. norm   :     0.0034486 α      lambda       -0.9598664E-06
   maximum displ.:     0.0021123 α      in ANC's #5, #6, #2, ...

........................................................................
.............................. CYCLE   14 ..............................
........................................................................
   1     -8.8844082 -0.888441E+01  0.257E-02    1.32       0.0  T
   2     -8.8843872  0.209881E-04  0.704E-02    1.32       1.0  T
   3     -8.8844104 -0.231668E-04  0.704E-03    1.32       6.3  T
   4     -8.8844104 -0.865535E-08  0.272E-03    1.32      16.4  T
   5     -8.8844104 -0.270691E-07  0.623E-04    1.32      71.8  T
   6     -8.8844104 -0.664198E-10  0.210E-04    1.32     213.1  T
     SCC iter.                  ...        0 min,  0.000 sec
     gradient                   ...        0 min,  0.001 sec
 * total energy  :    -8.7897691 Eh     change       -0.4727677E-06 Eh
   gradient norm :     0.0003029 Eh/α   predicted    -0.4807312E-06 (   1.68%)
   displ. norm   :     0.0014725 α      lambda       -0.2296800E-06
   maximum displ.:     0.0010085 α      in ANC's #5, #2, #7, ...

   *** GEOMETRY OPTIMIZATION CONVERGED AFTER 14 ITERATIONS ***

------------------------------------------------------------------------
 total energy gain   :        -0.1108365 Eh      -69.5510 kcal/mol
 total RMSD          :         0.6732777 a0        0.3563 Å
 total power (kW/mol):       -20.7858021 (step)-8260.5062 (real)
------------------------------------------------------------------------

 ANCopt (total)                0 d,  0 h,  0 min,  0.035 sec
 optimizer setup                ...        0 min,  0.000 sec (  0.247%)
 model hessian                  ...        0 min,  0.000 sec (  0.335%)
 ANC generation                 ...        0 min,  0.000 sec (  0.176%)
 coordinate transformation      ...        0 min,  0.000 sec (  0.117%)
 single point calculation       ...        0 min,  0.033 sec ( 95.069%)
 optimization log               ...        0 min,  0.000 sec (  1.223%)
 hessian update                 ...        0 min,  0.000 sec (  0.109%)
 rational function              ...        0 min,  0.000 sec (  1.223%)

================
 final structure:
================
5
 xtb: 6.2.2 (9d81278992624c895f80dd42a50cac0aa55982e2)
N        -0.40376675890536    0.33753730278413    0.10010853134742
C         0.66386967351755   -0.40094488152732    0.30492845086206
N        -0.89162799834885   -0.76019315157946   -0.21815864942207
H        -0.80568817915042    1.26383406265213    0.26390299752469
H         1.43721326288708   -0.44023433232947   -0.45078033031209

 Bond Distances (Angstroems)
 ---------------------------
N1-C2=1.3142         N1-N3=1.2427         N1-H4=1.0229         C2-N1=1.3142         C2-N3=1.6800         C2-H5=1.0820         
N3-N1=1.2427         N3-C2=1.6800         H4-N1=1.0229         H5-C2=1.0820         
 C  H  Rav=1.0820 sigma=0.0000  Rmin=1.0820  Rmax=1.0820     1
 N  H  Rav=1.0229 sigma=0.0000  Rmin=1.0229  Rmax=1.0229     1
 N  C  Rav=1.4971 sigma=0.1829  Rmin=1.3142  Rmax=1.6800     2
 N  N  Rav=1.2427 sigma=0.0000  Rmin=1.2427  Rmax=1.2427     1

 selected bond angles (degree)
 --------------------
N3-N1-C2= 82.10                H4-N1-C2=143.42                H4-N1-N3=133.37                N3-C2-N1= 47.11                
H5-C2-N1=119.48                H5-C2-N3=115.88                C2-N3-N1= 50.79                

 selected dihedral angles (degree)
 ---------------------------------
N3-C2-N1-H4=167.49            H5-C2-N1-N3= 99.16            H5-C2-N1-H4=266.65            C2-N3-N1-H4=190.23            
N1-N3-C2-H5=252.78            
           -------------------------------------------------
          |                Final Singlepoint                |
           -------------------------------------------------

          ...................................................
          :                      SETUP                      :
          :.................................................:
          :  # basis functions                  14          :
          :  # atomic orbitals                  14          :
          :  # shells                            8          :
          :  # electrons                        16          :
          :  max. iterations                   250          :
          :  Hamiltonian                  GFN2-xTB          :
          :  restarted?                      false          :
          :  GBSA solvation                  false          :
          :  PC potential                    false          :
          :  electronic temp.          300.0000000     K    :
          :  accuracy                    1.0000000          :
          :  -> integral cutoff          0.2500000E+02      :
          :  -> integral neglect         0.1000000E-07      :
          :  -> SCF convergence          0.1000000E-05 Eh   :
          :  -> wf. convergence          0.1000000E-03 e    :
          :  Broyden damping             0.4000000          :
          ...................................................

 iter      E             dE          RMSdq      gap      omega  full diag
   1     -8.8844104 -0.888441E+01  0.131E-04    1.32       0.0  T
   2     -8.8844104  0.139444E-11  0.507E-05    1.32     881.9  T
   3     -8.8844104  0.909104E-10  0.154E-04    1.32     290.0  T

   *** convergence criteria satisfied after 3 iterations ***

         #    Occupation            Energy/Eh            Energy/eV
      -------------------------------------------------------------
         1        2.0000           -0.7240193             -19.7016
         2        2.0000           -0.6395795             -17.4038
         3        2.0000           -0.6240352             -16.9809
         4        2.0000           -0.5780706             -15.7301
         5        2.0000           -0.5082547             -13.8303
         6        2.0000           -0.4586348             -12.4801
         7        2.0000           -0.4172086             -11.3528
         8        2.0000           -0.3534937              -9.6191 (HOMO)
         9                         -0.3049269              -8.2975 (LUMO)
        10                         -0.1832524              -4.9866
        11                         -0.0129782              -0.3532
        12                          0.1975672               5.3761
        13                          0.2423350               6.5943
        14                          0.5160566              14.0426
      -------------------------------------------------------------
                  HL-Gap            0.0485668 Eh            1.3216 eV
             Fermi-level           -0.3292103 Eh           -8.9583 eV

 SCC (total)                   0 d,  0 h,  0 min,  0.002 sec
 SCC setup                      ...        0 min,  0.000 sec (  2.565%)
 Dispersion                     ...        0 min,  0.000 sec (  0.515%)
 integral evaluation            ...        0 min,  0.001 sec ( 39.158%)
 zeroth order Hamiltonian       ...        0 min,  0.000 sec (  0.564%)
 iterations                     ...        0 min,  0.000 sec ( 14.358%)
 molecular gradient             ...        0 min,  0.001 sec ( 39.894%)
 printout                       ...        0 min,  0.000 sec (  2.479%)

         :::::::::::::::::::::::::::::::::::::::::::::::::::::
         ::                     SUMMARY                     ::
         :::::::::::::::::::::::::::::::::::::::::::::::::::::
         :: total energy              -8.789769139607 Eh    ::
         :: gradient norm              0.000306039523 Eh/a0 ::
         :: HOMO-LUMO gap              1.321570931883 eV    ::
         ::.................................................::
         :: SCC energy                -8.884410435949 Eh    ::
         :: -> isotropic ES            0.011602448529 Eh    ::
         :: -> anisotropic ES          0.001519226019 Eh    ::
         :: -> anisotropic XC          0.012705021610 Eh    ::
         :: -> dispersion             -0.001454612523 Eh    ::
         :: repulsion energy           0.094641269488 Eh    ::
         :: add. restraining           0.000000000000 Eh    ::
         :::::::::::::::::::::::::::::::::::::::::::::::::::::

           ------------------------------------------------- 
          |                Numerical Hessian                |
           ------------------------------------------------- 
step length          :   0.00500
SCC accuracy         :   0.30000
Hessian scale factor :   1.00000
frozen atoms in %    :   0.00000    0
RMS gradient         :   0.00031
estimated CPU  time      0.00 min
estimated wall time      0.00 min

writing file <hessian>.

 projected vibrational frequencies (cm-1)
eigval :       -0.00    -0.00    -0.00    -0.00     0.00     0.00
eigval :      627.23   741.54   872.77   927.42  1093.29  1440.93
eigval :     1612.42  2991.95  3173.23
           -------------------------------------------------
          |                Property Printout                |
           -------------------------------------------------

    * Orbital Energies and Occupations

         #    Occupation            Energy/Eh            Energy/eV
      -------------------------------------------------------------
         1        2.0000           -0.7240194             -19.7016
         2        2.0000           -0.6395795             -17.4038
         3        2.0000           -0.6240352             -16.9809
         4        2.0000           -0.5780706             -15.7301
         5        2.0000           -0.5082550             -13.8303
         6        2.0000           -0.4586345             -12.4801
         7        2.0000           -0.4172086             -11.3528
         8        2.0000           -0.3534938              -9.6191 (HOMO)
         9                         -0.3049268              -8.2975 (LUMO)
        10                         -0.1832525              -4.9866
        11                         -0.0129782              -0.3532
        12                          0.1975671               5.3761
        13                          0.2423348               6.5943
        14                          0.5160565              14.0426
      -------------------------------------------------------------
                  HL-Gap            0.0485670 Eh            1.3216 eV
             Fermi-level           -0.3292103 Eh           -8.9583 eV

     #   Z        covCN         q      C6AA      α(0)
     1   7 N      2.750     0.157    18.592     6.404
     2   6 C      2.680    -0.104    30.585     9.050
     3   7 N      1.825    -0.254    27.448     7.763
     4   1 H      0.859     0.149     1.405     1.857
     5   1 H      0.925     0.050     2.317     2.380

 Mol. C6AA /au·bohr⁶  :        315.638699
 Mol. C8AA /au·bohr⁸  :       7041.503443
 Mol. α(0) /au        :         27.454210


Wiberg/Mayer (AO) data.
largest (>0.10) Wiberg bond orders for each atom
          total WBO             WBO to atom ...
     1  N   3.771        N    3 1.550    C    2 1.305    H    4 0.910
     2  C   3.488        N    1 1.305    N    3 1.229    H    5 0.924
     3  N   2.878        N    1 1.550    C    2 1.229
     4  H   0.978        N    1 0.910
     5  H   0.997        C    2 0.924

MOs/occ written to file <molden.input>


molecular dipole:
                 x           y           z       tot (Debye)
 q only:        0.086       0.858       0.106
   full:        0.026       1.354      -0.093       3.451
molecular quadrupole (traceless):
                xx          xy          yy          xz          yz          zz
 q only:       -0.259      -1.873       0.405      -0.755       0.191      -0.145
  q+dip:       -0.565      -3.352       0.513      -2.578       0.472       0.052
   full:       -0.515      -3.026       0.258      -2.442       0.465       0.256

           -------------------------------------------------
          |                Geometry Summary                 |
           -------------------------------------------------

      molecular mass/u    :       42.0400238
   center of mass at/Å    :       -0.2267875      -0.2356199       0.0433066
  moments of inertia/u·Å² :        0.1216232E+02   0.2107218E+02   0.3176266E+02
rotational constants/cm⁻¹ :        0.1386054E+01   0.7999945E+00   0.5307374E+00

 * 4 selected distances

     #   Z        #   Z                                     value/Å
     1   7 N      2   6 C                                 1.3142126 (max)
     1   7 N      3   7 N                                 1.2427046
     1   7 N      4   1 H                                 1.0229346 (min)
     2   6 C      5   1 H                                 1.0819888

 * 4 distinct bonds (by element types)

   Z      Z             #   av. dist./Å        max./Å        min./Å
   1 H    6 C           1     1.0819888     1.0819888     1.0819888
   1 H    7 N           1     1.0229346     1.0229346     1.0229346
   6 C    7 N           1     1.3142126     1.3142126     1.3142126
   7 N    7 N           1     1.2427046     1.2427046     1.2427046

           -------------------------------------------------
          |               Frequency Printout                |
           -------------------------------------------------
 projected vibrational frequencies (cm-1)
eigval :       -0.00    -0.00    -0.00    -0.00     0.00     0.00
eigval :      627.23   741.54   872.77   927.42  1093.29  1440.93
eigval :     1612.42  2991.95  3173.23
 reduced masses (amu)
   1: 10.10   2: 12.39   3: 13.17   4: 12.60   5: 10.86   6: 12.03   7: 10.81   8:  3.85
Molecule has no symmetry elements
It seems to be the C1 point group
   9:  4.20  10:  5.19  11:  2.36  12: 11.56  13: 13.29  14:  1.86  15:  1.85
 IR intensities (amu)
   1:  0.31   2:  0.33   3:  0.26   4:  0.17   5:  0.20   6:  0.28   7:  0.75   8:  0.40
   9:  1.01  10:  0.44  11:  0.13  12:  1.68  13:  0.91  14:  0.25  15:  0.19
 Raman intensities (amu)
   1:  0.00   2:  0.00   3:  0.00   4:  0.00   5:  0.00   6:  0.00   7:  0.00   8:  0.00
   9:  0.00  10:  0.00  11:  0.00  12:  0.00  13:  0.00  14:  0.00  15:  0.00
 output can be read by thermo (or use thermo option).
 writing <g98.out> molden fake output.
 recommended (thermochemical) frequency scaling factor: 1.0
           -------------------------------------------------
          |             Thermodynamic Functions             |
           -------------------------------------------------

c1  symmetry found (for desy threshold:  0.10E+00) used in thermo

          ...................................................
          :                      SETUP                      :
          :.................................................:
          :  # frequencies                           9      :
          :  # imaginary freq.                       0      :
          :  linear?                             false      :
          :  only rotor calc.                    false      :
          :  symmetry                               c1      :
          :  rotational number                       1      :
          :  scaling factor                  1.0000000      :
          :  rotor cutoff                   50.0000000 cm⁻¹ :
          :  imag. cutoff                  -20.0000000 cm⁻¹ :
          :.................................................:

    mode    ω/cm⁻¹     T·S(HO)/kcal·mol⁻¹    T·S(FR)/kcal·mol⁻¹   T·S(vib)
   ------------------------------------------------------------------------
   ------------------------------------------------------------------------

   temp. (K)  partition function   enthalpy   heat capacity  entropy
                                   cal/mol     cal/K/mol   cal/K/mol   J/K/mol
 298.15  VIB   1.12                  242.268      3.157      1.033
         ROT  0.689E+04              888.752      2.981     20.545
         INT  0.770E+04             1131.021      6.138     21.578
         TR   0.264E+27             1481.254      4.968     37.118
         TOT                        2612.2745    11.1059    58.6957   245.5830

   temp. (K)  partition function   enthalpy   heat capacity  entropy
                                   cal/mol     cal/K/mol   cal/K/mol   J/K/mol
 120.00  VIB   1.00                    1.381      0.093      0.013
         ROT  0.176E+04              357.707      2.981     17.832
         INT  0.176E+04              359.088      3.074     17.845
         TR   0.673E+26              596.178      4.968     32.599
         TOT                         955.2661     8.0422    50.4435   211.0554

   temp. (K)  partition function   enthalpy   heat capacity  entropy
                                   cal/mol     cal/K/mol   cal/K/mol   J/K/mol
 100.00  VIB   1.00                    0.279      0.026      0.003
         ROT  0.134E+04              298.089      2.981     17.288
         INT  0.134E+04              298.368      3.007     17.291
         TR   0.512E+26              496.815      4.968     31.693
         TOT                         795.1828     7.9755    48.9847   204.9522

   temp. (K)  partition function   enthalpy   heat capacity  entropy
                                   cal/mol     cal/K/mol   cal/K/mol   J/K/mol
  80.00  VIB   1.00                    0.027      0.004      0.000
         ROT   958.                  238.471      2.981     16.623
         INT   958.                  238.498      2.985     16.623
         TR   0.367E+26              397.452      4.968     30.585
         TOT                         635.9498     7.9529    47.2088   197.5215

   temp. (K)  partition function   enthalpy   heat capacity  entropy
                                   cal/mol     cal/K/mol   cal/K/mol   J/K/mol
  60.00  VIB   1.00                    0.001      0.000     -0.000
         ROT   622.                  178.853      2.981     15.765
         INT   622.                  178.854      2.981     15.765
         TR   0.238E+26              298.089      4.968     29.157
         TOT                         476.9430     7.9492    44.9223   187.9549

   temp. (K)  partition function   enthalpy   heat capacity  entropy
                                   cal/mol     cal/K/mol   cal/K/mol   J/K/mol
  40.00  VIB   1.00                    0.000      0.000     -0.000
         ROT   339.                  119.236      2.981     14.557
         INT   339.                  119.236      2.981     14.557
         TR   0.130E+26              198.726      4.968     27.143
         TOT                         317.9616     7.9490    41.7002   174.4735

   temp. (K)  partition function   enthalpy   heat capacity  entropy
                                   cal/mol     cal/K/mol   cal/K/mol   J/K/mol
  20.00  VIB   1.00                    0.000      0.000     -0.000
         ROT   120.                   59.618      2.981     12.491
         INT   120.                   59.618      2.981     12.490
         TR   0.458E+25               99.363      4.968     23.701
         TOT                         158.9808     7.9490    36.1919   151.4271

   temp. (K)  partition function   enthalpy   heat capacity  entropy
                                   cal/mol     cal/K/mol   cal/K/mol   J/K/mol
  10.00  VIB   1.00                    0.000      0.000     -0.000
         ROT   42.3                   29.809      2.981     10.424
         INT   42.3                   29.809      2.981     10.424
         TR   0.162E+25               49.681      4.968     20.259
         TOT                          79.4904     7.9490    30.6837   128.3806

       T/K    H(0)-H(T)+PV         H(T)/Eh          T*S/Eh         G(T)/Eh
   ------------------------------------------------------------------------
    298.15    0.416292E-02    0.348744E-01    0.278882E-01    0.698614E-02
    120.00    0.152231E-02    0.322338E-01    0.964641E-02    0.225874E-01
    100.00    0.126720E-02    0.319787E-01    0.780622E-02    0.241724E-01
     80.00    0.101345E-02    0.317249E-01    0.601856E-02    0.257064E-01
     60.00    0.760057E-03    0.314715E-01    0.429529E-02    0.271762E-01
     40.00    0.506704E-03    0.312182E-01    0.265814E-02    0.285600E-01
     20.00    0.253352E-03    0.309648E-01    0.115351E-02    0.298113E-01
     10.00    0.126676E-03    0.308381E-01    0.488976E-03    0.303492E-01 (used)
   ------------------------------------------------------------------------

         :::::::::::::::::::::::::::::::::::::::::::::::::::::
         ::                  THERMODYNAMIC                  ::
         :::::::::::::::::::::::::::::::::::::::::::::::::::::
         :: total free energy          -8.759419981994 Eh   ::
         ::.................................................::
         :: total energy               -8.789769139694 Eh   ::
         :: zero point energy           0.030711457645 Eh   ::
         :: G(RRHO) w/o ZPVE           -0.000362299945 Eh   ::
         :: G(RRHO) contrib.            0.030349157700 Eh   ::
         :::::::::::::::::::::::::::::::::::::::::::::::::::::

optimized geometry written to: xtbopt.xyz


           -------------------------------------------------
          | TOTAL ENERGY               -8.789769139694 Eh   |
          | TOTAL ENTHALPY             -8.758931006033 Eh   |
          | TOTAL FREE ENERGY          -8.759419981994 Eh   |
          | GRADIENT NORM               0.000308126048 Eh/α |
          | HOMO-LUMO GAP               1.321576460476 eV   |
           -------------------------------------------------

------------------------------------------------------------------------
 * finished run on 2020/05/12 at 11:45:20.363     
------------------------------------------------------------------------
 total:
 * wall-time:     0 d,  0 h,  0 min,  0.123 sec
 *  cpu-time:     0 d,  0 h,  0 min,  0.123 sec
 * ratio c/w:     0.997 speedup
 SCF:
 * wall-time:     0 d,  0 h,  0 min,  0.004 sec
 *  cpu-time:     0 d,  0 h,  0 min,  0.004 sec
 * ratio c/w:     0.989 speedup
 ANC optimizer:
 * wall-time:     0 d,  0 h,  0 min,  0.038 sec
 *  cpu-time:     0 d,  0 h,  0 min,  0.038 sec
 * ratio c/w:     0.998 speedup
 numerical hessian:
 * wall-time:     0 d,  0 h,  0 min,  0.063 sec
 *  cpu-time:     0 d,  0 h,  0 min,  0.063 sec
 * ratio c/w:     0.998 speedup

