      -----------------------------------------------------------      
     |                   =====================                   |     
     |                           x T B                           |     
     |                   =====================                   |     
     |                         S. Grimme                         |     
     |          Mulliken Center for Theoretical Chemistry        |     
     |                    University of Bonn                     |     
      -----------------------------------------------------------      

   * xtb version 6.2.2 (9d81278992624c895f80dd42a50cac0aa55982e2) compiled by '@Darwin' on 04/03/2020

   xtb is free software: you can redistribute it and/or modify it under
   the terms of the GNU Lesser General Public License as published by
   the Free Software Foundation, either version 3 of the License, or
   (at your option) any later version.
   
   xtb is distributed in the hope that it will be useful,
   but WITHOUT ANY WARRANTY; without even the implied warranty of
   MERCHANTABILITY or FITNESS FOR A PARTICULAR PURPOSE.  See the
   GNU Lesser General Public License for more details.
   
   Cite this work as:
   * S. Grimme, C. Bannwarth, P. Shushkov, J. Chem. Theory Comput., 2017,
     13, 1989-2009. DOI: 10.1021/acs.jctc.7b00118
   * C. Bannwarth, S. Ehlert and S. Grimme., J. Chem. Theory Comput., 2019,
     15, 1652-1671. DOI: 10.1021/acs.jctc.8b01176
   * P. Pracht, E. Caldeweyher, S. Ehlert, S. Grimme, ChemRxiv, 2019, preprint.
     DOI: 10.26434/chemrxiv.8326202.v1
   
   for DFT-D4:
   * E. Caldeweyher, C. Bannwarth and S. Grimme, J. Chem. Phys., 2017,
     147, 034112. DOI: 10.1063/1.4993215
   * E. Caldeweyher, S. Ehlert, A. Hansen, H. Neugebauer, S. Spicher,
     C. Bannwarth and S. Grimme, J. Chem. Phys., 2019, 150, 154122.
     DOI: 10.1063/1.5090222
   
   for sTDA-xTB:
   * S. Grimme and C. Bannwarth, J. Chem. Phys., 2016, 145, 054103.
     DOI: 10.1063/1.4959605
   
   in the mass-spec context:
   * V. Asgeirsson, C. Bauer and S. Grimme, Chem. Sci., 2017, 8, 4879.
     DOI: 10.1039/c7sc00601b
   
   for metadynamics refer to:
   * S. Grimme, J. Chem. Theory Comput., 2019, 155, 2847-2862
     DOI: 10.1021/acs.jctc.9b00143
   
   with help from (in alphabetical order)
   C. Bannwarth, F. Bohle, G. Brandenburg, E. Caldeweyher, M. Checinski,
   S. Dohm, S. Ehlert, S. Ehrlich, F. März, H. Neugebauer, J. Pisarek,
   P. Pracht, P. Shushkov, and S. Spicher.
   
 * started run on 2020/05/12 at 11:44:44.424     

           -------------------------------------------------
          |                Calculation Setup                |
           -------------------------------------------------

          program call               : xtb --input H3C1O1_0_S_1.input H3C1O1_0_S_1.xyz --ohess --molden --namespace H3C1O1_0_S_1 output.out
          calculation namespace      : H3C1O1_0_S_1
          coordinate file            : H3C1O1_0_S_1.xyz
          number of atoms            :                     5
          number of electrons        :                    13
          charge                     :                     0
          spin                       :                   0.5
          first test random number   :      0.89398363526233

   ID    Z sym.   atoms
    1    8 O      1
    2    6 C      2
    3    1 H      3-5

           -------------------------------------------------
          |                 G F N 2 - x T B                 |
           -------------------------------------------------

        Reference                      10.1021/acs.jctc.8b01176
      * Hamiltonian:
        H0-scaling (s, p, d)           1.850000    2.230000    2.230000
        zeta-weighting                 0.500000
      * Dispersion:
        s8                             2.700000
        a1                             0.520000
        a2                             5.000000
        s9                             5.000000
      * Repulsion:
        kExp                           1.500000    1.000000
        rExp                           1.000000
      * Coulomb:
        alpha                          2.000000
        third order                    shell-resolved
        anisotropic                    true
        a3                             3.000000
        a5                             4.000000
        cn-shift                       1.200000
        cn-exp                         4.000000
        max-rad                        5.000000


          ...................................................
          :                      SETUP                      :
          :.................................................:
          :  # basis functions                  11          :
          :  # atomic orbitals                  11          :
          :  # shells                            7          :
          :  # electrons                        13          :
          :  max. iterations                   250          :
          :  Hamiltonian                  GFN2-xTB          :
          :  restarted?                      false          :
          :  GBSA solvation                  false          :
          :  PC potential                    false          :
          :  electronic temp.          300.0000000     K    :
          :  accuracy                    1.0000000          :
          :  -> integral cutoff          0.2500000E+02      :
          :  -> integral neglect         0.1000000E-07      :
          :  -> SCF convergence          0.1000000E-05 Eh   :
          :  -> wf. convergence          0.1000000E-03 e    :
          :  Broyden damping             0.4000000          :
          ...................................................

 iter      E             dE          RMSdq      gap      omega  full diag
   1     -7.6536157 -0.765362E+01  0.483E+00   10.82       0.0  T
   2     -7.6614455 -0.782980E-02  0.260E+00   11.16       1.0  T
   3     -7.6619591 -0.513598E-03  0.762E-01   10.94       1.0  T
   4     -7.6620134 -0.543045E-04  0.159E-01   10.94       1.0  T
   5     -7.6620207 -0.735365E-05  0.399E-02   10.96       1.1  T
   6     -7.6620214 -0.687838E-06  0.290E-02   10.97       1.5  T
   7     -7.6620236 -0.223430E-05  0.102E-02   10.97       4.4  T
   8     -7.6620239 -0.299478E-06  0.168E-03   10.97      26.6  T
   9     -7.6620239 -0.681012E-08  0.564E-04   10.97      79.4  T
  10     -7.6620239 -0.349420E-09  0.403E-05   10.97    1110.2  T

   *** convergence criteria satisfied after 10 iterations ***

         #    Occupation            Energy/Eh            Energy/eV
      -------------------------------------------------------------
         1        2.0000           -0.6995597             -19.0360
         2        2.0000           -0.6129115             -16.6782
         3        2.0000           -0.5756305             -15.6637
         4        2.0000           -0.5287188             -14.3872
         5        2.0000           -0.5059524             -13.7677
         6        2.0000           -0.4222323             -11.4895
         7        1.0000           -0.3571547              -9.7187 (HOMO)
         8                          0.0458245               1.2469 (LUMO)
         9                          0.1076748               2.9300
        10                          0.1749943               4.7618
        11                          0.1770601               4.8181
      -------------------------------------------------------------
                  HL-Gap            0.4029791 Eh           10.9656 eV
             Fermi-level           -0.2726793 Eh           -7.4200 eV

 SCC (total)                   0 d,  0 h,  0 min,  0.002 sec
 SCC setup                      ...        0 min,  0.000 sec (  4.747%)
 Dispersion                     ...        0 min,  0.000 sec (  0.650%)
 integral evaluation            ...        0 min,  0.000 sec ( 23.514%)
 zeroth order Hamiltonian       ...        0 min,  0.000 sec (  0.702%)
 iterations                     ...        0 min,  0.001 sec ( 42.541%)
 molecular gradient             ...        0 min,  0.000 sec ( 24.385%)
 printout                       ...        0 min,  0.000 sec (  2.887%)

         :::::::::::::::::::::::::::::::::::::::::::::::::::::
         ::                     SUMMARY                     ::
         :::::::::::::::::::::::::::::::::::::::::::::::::::::
         :: total energy              -7.613257539235 Eh    ::
         :: gradient norm              0.061973250336 Eh/a0 ::
         :: HOMO-LUMO gap             10.965619949016 eV    ::
         ::.................................................::
         :: SCC energy                -7.662023944646 Eh    ::
         :: -> isotropic ES            0.021856398433 Eh    ::
         :: -> anisotropic ES          0.003474030788 Eh    ::
         :: -> anisotropic XC          0.001952976974 Eh    ::
         :: -> dispersion             -0.000908157294 Eh    ::
         :: repulsion energy           0.048766392797 Eh    ::
         :: add. restraining           0.000000000000 Eh    ::
         :::::::::::::::::::::::::::::::::::::::::::::::::::::

      ----------------------------------------------------------- 
     |                   =====================                   |
     |                        A N C O P T                        |
     |                   =====================                   |
     |               Approximate Normal Coordinate               |
     |                Rational Function Optimizer                |
      ----------------------------------------------------------- 

          ...................................................
          :                      SETUP                      :
          :.................................................:
          :   optimization level            normal          :
          :   max. optcycles                   200          :
          :   ANC micro-cycles                  20          :
          :   degrees of freedom                 9          :
          :.................................................:
          :   RF solver                   davidson          :
          :   write xtbopt.log                true          :
          :   linear?                        false          :
          :   energy convergence         0.5000000E-05 Eh   :
          :   grad. convergence          0.1000000E-02 Eh/α :
          :   maximium RF displ.         1.0000000          :
          :   Hlow (freq-cutoff)         0.1000000E-01      :
          :   Hmax (freq-cutoff)         5.0000000          :
          :   S6 in model hess.         20.0000000          :
          ...................................................

generating ANC from model Hessian ...
Using Lindh-Hessian (1995)
 Shifting diagonal of input Hessian by    0.0000000000000000     
 Lowest  eigenvalues of input Hessian
   -0.000000   -0.000000   -0.000000    0.000000    0.000000    0.000000
    0.022794    0.054685    0.102796    0.129703    0.267833    0.582735
    0.999990    1.122256    1.406517
 Highest eigenvalues
    0.129703    0.267833    0.582735    0.999990    1.122256    1.406517


........................................................................
.............................. CYCLE    1 ..............................
........................................................................
   1     -7.6620239 -0.766202E+01  0.124E-05   10.97       0.0  T
   2     -7.6620239 -0.460965E-12  0.319E-06   10.97   14026.0  T
   3     -7.6620239 -0.142109E-13  0.195E-06   10.97   22967.1  T
     SCC iter.                  ...        0 min,  0.000 sec
     gradient                   ...        0 min,  0.000 sec
 * total energy  :    -7.6132575 Eh     change        0.1045825E-08 Eh
   gradient norm :     0.0619731 Eh/α   predicted     0.0000000E+00 (-100.00%)
   displ. norm   :     0.3866335 α      lambda       -0.1554830E-01
   maximum displ.:     0.3583069 α      in ANC's #2, #3, #6, ...

........................................................................
.............................. CYCLE    2 ..............................
........................................................................
   1     -7.6732485 -0.767325E+01  0.869E-01   10.99       0.0  T
   2     -7.6734902 -0.241757E-03  0.512E-01   10.90       1.0  T
   3     -7.6735011 -0.108412E-04  0.137E-01   10.91       1.0  T
   4     -7.6735053 -0.421055E-05  0.218E-02   10.90       2.1  T
   5     -7.6735055 -0.168926E-06  0.431E-03   10.90      10.4  T
   6     -7.6735055 -0.185350E-07  0.106E-03   10.90      42.1  T
   7     -7.6735055 -0.150959E-08  0.490E-04   10.90      91.2  T
   8     -7.6735055 -0.191966E-09  0.616E-05   10.90     725.6  T
     SCC iter.                  ...        0 min,  0.000 sec
     gradient                   ...        0 min,  0.000 sec
 * total energy  :    -7.6222301 Eh     change       -0.8972570E-02 Eh
   gradient norm :     0.0406954 Eh/α   predicted    -0.8936274E-02 (  -0.40%)
   displ. norm   :     0.1441568 α      lambda       -0.4323892E-02
   maximum displ.:     0.1005855 α      in ANC's #2, #6, #8, ...

........................................................................
.............................. CYCLE    3 ..............................
........................................................................
   1     -7.6849218 -0.768492E+01  0.363E-01   11.16       0.0  T
   2     -7.6849496 -0.278371E-04  0.215E-01   11.12       1.0  T
   3     -7.6849509 -0.129158E-05  0.413E-02   11.13       1.1  T
   4     -7.6849512 -0.258674E-06  0.755E-03   11.13       5.9  T
   5     -7.6849512 -0.184959E-07  0.218E-03   11.13      20.5  T
   6     -7.6849512 -0.228263E-08  0.366E-04   11.13     122.1  T
   7     -7.6849512 -0.942224E-10  0.169E-04   11.13     264.6  T
     SCC iter.                  ...        0 min,  0.000 sec
     gradient                   ...        0 min,  0.000 sec
 * total energy  :    -7.6252780 Eh     change       -0.3047929E-02 Eh
   gradient norm :     0.0150842 Eh/α   predicted    -0.2206875E-02 ( -27.59%)
   displ. norm   :     0.1674007 α      lambda       -0.1748892E-02
   maximum displ.:     0.1440215 α      in ANC's #2, #6, #5, ...

........................................................................
.............................. CYCLE    4 ..............................
........................................................................
   1     -7.6888367 -0.768884E+01  0.380E-01   10.81       0.0  T
   2     -7.6888519 -0.151900E-04  0.229E-01   10.78       1.0  T
   3     -7.6888532 -0.132943E-05  0.264E-02   10.78       1.7  T
   4     -7.6888534 -0.121871E-06  0.686E-03   10.78       6.5  T
   5     -7.6888534 -0.139372E-07  0.130E-03   10.78      34.4  T
   6     -7.6888534 -0.125545E-08  0.321E-04   10.78     139.2  T
   7     -7.6888534 -0.312692E-10  0.865E-05   10.78     516.9  T
     SCC iter.                  ...        0 min,  0.000 sec
     gradient                   ...        0 min,  0.000 sec
 * total energy  :    -7.6264060 Eh     change       -0.1127933E-02 Eh
   gradient norm :     0.0098455 Eh/α   predicted    -0.8989521E-03 ( -20.30%)
   displ. norm   :     0.0983628 α      lambda       -0.4392257E-03
   maximum displ.:     0.0825545 α      in ANC's #2, #6, #3, ...

........................................................................
.............................. CYCLE    5 ..............................
........................................................................
   1     -7.6897552 -0.768976E+01  0.250E-01   10.59       0.0  T
   2     -7.6897599 -0.472204E-05  0.153E-01   10.58       1.0  T
   3     -7.6897610 -0.110414E-05  0.129E-02   10.58       3.5  T
   4     -7.6897611 -0.496803E-07  0.559E-03   10.58       8.0  T
   5     -7.6897611 -0.111664E-07  0.127E-03   10.58      35.3  T
   6     -7.6897611 -0.114538E-08  0.245E-04   10.58     182.3  T
   7     -7.6897611 -0.175495E-10  0.286E-05   10.58    1565.6  T
     SCC iter.                  ...        0 min,  0.000 sec
     gradient                   ...        0 min,  0.000 sec
 * total energy  :    -7.6267296 Eh     change       -0.3236025E-03 Eh
   gradient norm :     0.0096711 Eh/α   predicted    -0.2217364E-03 ( -31.48%)
   displ. norm   :     0.1040595 α      lambda       -0.3669075E-03
   maximum displ.:     0.0761484 α      in ANC's #2, #6, #3, ...

........................................................................
.............................. CYCLE    6 ..............................
........................................................................
   1     -7.6908918 -0.769089E+01  0.305E-01   10.49       0.0  T
   2     -7.6908981 -0.631006E-05  0.189E-01   10.48       1.0  T
   3     -7.6909002 -0.206872E-05  0.151E-02   10.48       3.0  T
   4     -7.6909003 -0.125303E-06  0.706E-03   10.48       6.3  T
   5     -7.6909003 -0.220276E-07  0.286E-03   10.48      15.7  T
   6     -7.6909003 -0.360188E-08  0.300E-04   10.48     149.1  T
   7     -7.6909003 -0.239826E-10  0.315E-05   10.48    1419.3  T
     SCC iter.                  ...        0 min,  0.000 sec
     gradient                   ...        0 min,  0.000 sec
 * total energy  :    -7.6269974 Eh     change       -0.2678365E-03 Eh
   gradient norm :     0.0067893 Eh/α   predicted    -0.1854406E-03 ( -30.76%)
   displ. norm   :     0.1095516 α      lambda       -0.2499243E-03
   maximum displ.:     0.0743988 α      in ANC's #2, #6, #3, ...

........................................................................
.............................. CYCLE    7 ..............................
........................................................................
   1     -7.6907494 -0.769075E+01  0.345E-01   10.42       0.0  T
   2     -7.6907536 -0.423045E-05  0.214E-01   10.41       1.0  T
   3     -7.6907559 -0.230656E-05  0.120E-02   10.42       3.7  T
   4     -7.6907560 -0.652012E-07  0.680E-03   10.42       6.6  T
   5     -7.6907560 -0.163111E-07  0.213E-03   10.42      21.0  T
   6     -7.6907560 -0.262341E-08  0.321E-04   10.42     139.4  T
   7     -7.6907560 -0.254703E-10  0.373E-05   10.42    1198.2  T
     SCC iter.                  ...        0 min,  0.001 sec
     gradient                   ...        0 min,  0.000 sec
 * total energy  :    -7.6271693 Eh     change       -0.1718654E-03 Eh
   gradient norm :     0.0054733 Eh/α   predicted    -0.1264632E-03 ( -26.42%)
   displ. norm   :     0.0635460 α      lambda       -0.1189068E-03
   maximum displ.:     0.0489749 α      in ANC's #6, #2, #3, ...

........................................................................
.............................. CYCLE    8 ..............................
........................................................................
   1     -7.6914103 -0.769141E+01  0.216E-01   10.51       0.0  T
   2     -7.6914116 -0.127537E-05  0.134E-01   10.51       1.0  T
   3     -7.6914123 -0.738319E-06  0.657E-03   10.51       6.8  T
   4     -7.6914123 -0.203139E-07  0.342E-03   10.51      13.1  T
   5     -7.6914123 -0.380001E-08  0.119E-03   10.51      37.5  T
   6     -7.6914123 -0.769839E-09  0.195E-04   10.51     229.0  T
   7     -7.6914123 -0.981437E-11  0.268E-05   10.51    1669.7  T
     SCC iter.                  ...        0 min,  0.000 sec
     gradient                   ...        0 min,  0.000 sec
 * total energy  :    -7.6272347 Eh     change       -0.6545309E-04 Eh
   gradient norm :     0.0043961 Eh/α   predicted    -0.5969335E-04 (  -8.80%)
   displ. norm   :     0.0066146 α      lambda       -0.1892474E-04
   maximum displ.:     0.0037995 α      in ANC's #5, #6, #8, ...

........................................................................
.............................. CYCLE    9 ..............................
........................................................................
   1     -7.6913757 -0.769138E+01  0.249E-02   10.52       0.0  T
   2     -7.6913759 -0.189222E-06  0.141E-02   10.52       3.2  T
   3     -7.6913759 -0.220352E-07  0.346E-03   10.52      12.9  T
   4     -7.6913759 -0.237268E-08  0.865E-04   10.52      51.7  T
   5     -7.6913759 -0.552996E-09  0.352E-04   10.52     127.0  T
     SCC iter.                  ...        0 min,  0.000 sec
     gradient                   ...        0 min,  0.000 sec
 * total energy  :    -7.6272487 Eh     change       -0.1399733E-04 Eh
   gradient norm :     0.0022261 Eh/α   predicted    -0.9463100E-05 ( -32.39%)
   displ. norm   :     0.0088303 α      lambda       -0.1221683E-04
   maximum displ.:     0.0057418 α      in ANC's #5, #2, #9, ...

........................................................................
.............................. CYCLE   10 ..............................
........................................................................
   1     -7.6911672 -0.769117E+01  0.261E-02   10.54       0.0  T
   2     -7.6911674 -0.290299E-06  0.146E-02   10.54       3.1  T
   3     -7.6911675 -0.334596E-07  0.418E-03   10.54      10.7  T
   4     -7.6911675 -0.369886E-08  0.107E-03   10.54      41.8  T
   5     -7.6911675 -0.886947E-09  0.459E-04   10.54      97.4  T
   6     -7.6911675 -0.833120E-10  0.257E-05   10.54    1742.7  T
     SCC iter.                  ...        0 min,  0.000 sec
     gradient                   ...        0 min,  0.000 sec
 * total energy  :    -7.6272551 Eh     change       -0.6418162E-05 Eh
   gradient norm :     0.0002773 Eh/α   predicted    -0.6108673E-05 (  -4.82%)
   displ. norm   :     0.0078440 α      lambda       -0.5057120E-06
   maximum displ.:     0.0052042 α      in ANC's #2, #6, #1, ...

........................................................................
.............................. CYCLE   11 ..............................
........................................................................
   1     -7.6912576 -0.769126E+01  0.218E-02   10.54       0.0  T
   2     -7.6912576 -0.172628E-07  0.135E-02   10.54       3.3  T
   3     -7.6912576 -0.103989E-07  0.857E-04   10.54      52.2  T
   4     -7.6912576 -0.145812E-09  0.493E-04   10.54      90.8  T
     SCC iter.                  ...        0 min,  0.000 sec
     gradient                   ...        0 min,  0.000 sec
 * total energy  :    -7.6272555 Eh     change       -0.3950226E-06 Eh
   gradient norm :     0.0005069 Eh/α   predicted    -0.2544160E-06 ( -35.59%)
   displ. norm   :     0.0237089 α      lambda       -0.1697469E-05
   maximum displ.:     0.0191193 α      in ANC's #1, #2, #6, ...

   *** GEOMETRY OPTIMIZATION CONVERGED AFTER 11 ITERATIONS ***

------------------------------------------------------------------------
 total energy gain   :        -0.0139980 Eh       -8.7839 kcal/mol
 total RMSD          :         0.4511104 a0        0.2387 Å
 total power (kW/mol):        -3.3410672 (step)-2549.8812 (real)
------------------------------------------------------------------------

 ANCopt (total)                0 d,  0 h,  0 min,  0.014 sec
 optimizer setup                ...        0 min,  0.000 sec (  0.450%)
 model hessian                  ...        0 min,  0.000 sec (  0.701%)
 ANC generation                 ...        0 min,  0.000 sec (  0.380%)
 coordinate transformation      ...        0 min,  0.000 sec (  0.177%)
 single point calculation       ...        0 min,  0.013 sec ( 91.970%)
 optimization log               ...        0 min,  0.000 sec (  1.996%)
 hessian update                 ...        0 min,  0.000 sec (  0.154%)
 rational function              ...        0 min,  0.000 sec (  1.865%)

================
 final structure:
================
5
 xtb: 6.2.2 (9d81278992624c895f80dd42a50cac0aa55982e2)
O         0.81854741387661   -0.29608344157639    0.38896330165347
C        -0.42410971962501    0.07455567965072   -0.01663290802096
H         1.49436067411144   -0.11806652895363   -0.27830185365882
H        -1.07796338121885   -0.68078512753085   -0.41654196014861
H        -0.81083398714419    1.02037841841015    0.32251342017492

 Bond Distances (Angstroems)
 ---------------------------
O1-C2=1.3587         O1-H3=0.9663         C2-O1=1.3587         C2-H4=1.0761         C2-H5=1.0766         H3-O1=0.9663         
H4-C2=1.0761         H5-C2=1.0766         
 C  H  Rav=1.0764 sigma=0.0003  Rmin=1.0761  Rmax=1.0766     2
 O  H  Rav=0.9663 sigma=0.0000  Rmin=0.9663  Rmax=0.9663     1
 O  C  Rav=1.3587 sigma=0.0000  Rmin=1.3587  Rmax=1.3587     1

 selected bond angles (degree)
 --------------------
H3-O1-C2=112.54                H4-C2-O1=118.37                H5-C2-O1=118.30                H5-C2-H4=121.03                

 selected dihedral angles (degree)
 ---------------------------------
H4-C2-O1-H3= 98.17            H5-C2-O1-H3=261.14            
           -------------------------------------------------
          |                Final Singlepoint                |
           -------------------------------------------------

          ...................................................
          :                      SETUP                      :
          :.................................................:
          :  # basis functions                  11          :
          :  # atomic orbitals                  11          :
          :  # shells                            7          :
          :  # electrons                        13          :
          :  max. iterations                   250          :
          :  Hamiltonian                  GFN2-xTB          :
          :  restarted?                      false          :
          :  GBSA solvation                  false          :
          :  PC potential                    false          :
          :  electronic temp.          300.0000000     K    :
          :  accuracy                    1.0000000          :
          :  -> integral cutoff          0.2500000E+02      :
          :  -> integral neglect         0.1000000E-07      :
          :  -> SCF convergence          0.1000000E-05 Eh   :
          :  -> wf. convergence          0.1000000E-03 e    :
          :  Broyden damping             0.4000000          :
          ...................................................

 iter      E             dE          RMSdq      gap      omega  full diag
   1     -7.6912576 -0.769126E+01  0.747E-05   10.54       0.0  T
   2     -7.6912576 -0.266187E-11  0.494E-05   10.54     904.5  T
   3     -7.6912576 -0.153833E-11  0.148E-05   10.54    3022.6  T

   *** convergence criteria satisfied after 3 iterations ***

         #    Occupation            Energy/Eh            Energy/eV
      -------------------------------------------------------------
         1        2.0000           -0.6992214             -19.0268
         2        2.0000           -0.6168206             -16.7845
         3        2.0000           -0.5576923             -15.1756
         4        2.0000           -0.5279196             -14.3654
         5        2.0000           -0.5143989             -13.9975
         6        2.0000           -0.4194651             -11.4142
         7        1.0000           -0.3174398              -8.6380 (HOMO)
         8                          0.0699448               1.9033 (LUMO)
         9                          0.1553515               4.2273
        10                          0.2587459               7.0408
        11                          0.3000103               8.1637
      -------------------------------------------------------------
                  HL-Gap            0.3873846 Eh           10.5413 eV
             Fermi-level           -0.2461000 Eh           -6.6967 eV

 SCC (total)                   0 d,  0 h,  0 min,  0.001 sec
 SCC setup                      ...        0 min,  0.000 sec (  4.669%)
 Dispersion                     ...        0 min,  0.000 sec (  0.717%)
 integral evaluation            ...        0 min,  0.000 sec ( 37.264%)
 zeroth order Hamiltonian       ...        0 min,  0.000 sec (  0.630%)
 iterations                     ...        0 min,  0.000 sec ( 15.744%)
 molecular gradient             ...        0 min,  0.000 sec ( 36.786%)
 printout                       ...        0 min,  0.000 sec (  3.540%)

         :::::::::::::::::::::::::::::::::::::::::::::::::::::
         ::                     SUMMARY                     ::
         :::::::::::::::::::::::::::::::::::::::::::::::::::::
         :: total energy              -7.627255536402 Eh    ::
         :: gradient norm              0.000522474036 Eh/a0 ::
         :: HOMO-LUMO gap             10.541272570670 eV    ::
         ::.................................................::
         :: SCC energy                -7.691257612741 Eh    ::
         :: -> isotropic ES            0.020101374041 Eh    ::
         :: -> anisotropic ES          0.002333558527 Eh    ::
         :: -> anisotropic XC          0.002193750753 Eh    ::
         :: -> dispersion             -0.000903392229 Eh    ::
         :: repulsion energy           0.064002061462 Eh    ::
         :: add. restraining           0.000000000000 Eh    ::
         :::::::::::::::::::::::::::::::::::::::::::::::::::::

           ------------------------------------------------- 
          |                Numerical Hessian                |
           ------------------------------------------------- 
step length          :   0.00500
SCC accuracy         :   0.30000
Hessian scale factor :   1.00000
frozen atoms in %    :   0.00000    0
RMS gradient         :   0.00052
estimated CPU  time      0.00 min
estimated wall time      0.00 min

writing file <hessian>.

 projected vibrational frequencies (cm-1)
eigval :       -0.00    -0.00    -0.00     0.00     0.00     0.00
eigval :     -709.63   392.07  1074.12  1098.70  1222.70  1384.07
eigval :     3074.46  3104.40  3414.01
           -------------------------------------------------
          |                Property Printout                |
           -------------------------------------------------

    * Orbital Energies and Occupations

         #    Occupation            Energy/Eh            Energy/eV
      -------------------------------------------------------------
         1        2.0000           -0.6992215             -19.0268
         2        2.0000           -0.6168207             -16.7845
         3        2.0000           -0.5576924             -15.1756
         4        2.0000           -0.5279197             -14.3654
         5        2.0000           -0.5143990             -13.9975
         6        2.0000           -0.4194652             -11.4142
         7        1.0000           -0.3174399              -8.6380 (HOMO)
         8                          0.0699447               1.9033 (LUMO)
         9                          0.1553515               4.2273
        10                          0.2587458               7.0408
        11                          0.3000103               8.1637
      -------------------------------------------------------------
                  HL-Gap            0.3873846 Eh           10.5413 eV
             Fermi-level           -0.2461001 Eh           -6.6967 eV

     #   Z        covCN         q      C6AA      α(0)
     1   8 O      1.658    -0.388    20.625     6.131
     2   6 C      2.705     0.017    27.612     8.601
     3   1 H      0.805     0.304     0.710     1.323
     4   1 H      0.926     0.034     2.532     2.488
     5   1 H      0.926     0.034     2.531     2.488

 Mol. C6AA /au·bohr⁶  :        189.614646
 Mol. C8AA /au·bohr⁸  :       3897.648123
 Mol. α(0) /au        :         21.030950


Wiberg/Mayer (AO) data.
largest (>0.10) Wiberg bond orders for each atom
          total WBO             WBO to atom ...
     1  O   1.983        C    2 1.088    H    3 0.858
     2  C   3.039        O    1 1.088    H    5 0.974    H    4 0.974
     3  H   0.864        O    1 0.858
     4  H   0.998        C    2 0.974
     5  H   0.998        C    2 0.974

MOs/occ written to file <molden.input>


molecular dipole:
                 x           y           z       tot (Debye)
 q only:        0.123       0.174      -0.452
   full:        0.146       0.223      -0.577       1.616
molecular quadrupole (traceless):
                xx          xy          yy          xz          yz          zz
 q only:        1.733       0.197      -0.740      -1.305       0.404      -0.992
  q+dip:        1.659       0.683      -0.184      -2.065       1.146      -1.475
   full:        1.933       0.563      -0.677      -2.133       0.769      -1.256

           -------------------------------------------------
          |                Geometry Summary                 |
           -------------------------------------------------

      molecular mass/u    :       31.0339631
   center of mass at/Å    :        0.2450487      -0.1165959       0.1819974
  moments of inertia/u·Å² :        0.2502325E+01   0.1766359E+02   0.1870076E+02
rotational constants/cm⁻¹ :        0.6736787E+01   0.9543716E+00   0.9014409E+00
Molecule has the following symmetry elements: (sigma) 
It seems to be the Cs point group

 * 4 selected distances

     #   Z        #   Z                                     value/Å
     1   8 O      2   6 C                                 1.3587047 (max)
     1   8 O      3   1 H                                 0.9662590 (min)
     2   6 C      4   1 H                                 1.0761002
     2   6 C      5   1 H                                 1.0766413

 * 3 distinct bonds (by element types)

   Z      Z             #   av. dist./Å        max./Å        min./Å
   1 H    6 C           2     1.0763708     1.0766413     1.0761002
   1 H    8 O           1     0.9662590     0.9662590     0.9662590
   6 C    8 O           1     1.3587047     1.3587047     1.3587047

           -------------------------------------------------
          |               Frequency Printout                |
           -------------------------------------------------
 projected vibrational frequencies (cm-1)
eigval :       -0.00    -0.00    -0.00     0.00     0.00     0.00
eigval :     -709.63   392.07  1074.12  1098.70  1222.70  1384.07
eigval :     3074.46  3104.40  3414.01
 reduced masses (amu)
   1:  4.48   2:  9.77   3: 14.06   4: 13.46   5: 11.08   6:  7.91   7:  1.99   8:  3.66
   9:  3.53  10:  5.04  11: 10.36  12:  2.39  13:  1.35  14:  2.17  15:  1.87
 IR intensities (amu)
   1:  0.40   2:  0.29   3:  0.31   4:  0.29   5:  0.18   6:  0.02   7:  0.52   8:  0.30
   9:  0.34  10:  0.93  11:  0.97  12:  0.35  13:  0.28  14:  0.35  15:  0.17
 Raman intensities (amu)
   1:  0.00   2:  0.00   3:  0.00   4:  0.00   5:  0.00   6:  0.00   7:  0.00   8:  0.00
   9:  0.00  10:  0.00  11:  0.00  12:  0.00  13:  0.00  14:  0.00  15:  0.00
 output can be read by thermo (or use thermo option).
 writing <g98.out> molden fake output.
 recommended (thermochemical) frequency scaling factor: 1.0
           -------------------------------------------------
          |             Thermodynamic Functions             |
           -------------------------------------------------

cs  symmetry found (for desy threshold:  0.10E+00) used in thermo

          ...................................................
          :                      SETUP                      :
          :.................................................:
          :  # frequencies                           8      :
          :  # imaginary freq.                       1      :
          :  linear?                             false      :
          :  only rotor calc.                    false      :
          :  symmetry                               cs      :
          :  rotational number                       1      :
          :  scaling factor                  1.0000000      :
          :  rotor cutoff                   50.0000000 cm⁻¹ :
          :  imag. cutoff                  -20.0000000 cm⁻¹ :
          :.................................................:

    mode    ω/cm⁻¹     T·S(HO)/kcal·mol⁻¹    T·S(FR)/kcal·mol⁻¹   T·S(vib)
   ------------------------------------------------------------------------
   ------------------------------------------------------------------------

   temp. (K)  partition function   enthalpy   heat capacity  entropy
                                   cal/mol     cal/K/mol   cal/K/mol   J/K/mol
 298.15  VIB   1.19                  246.660      2.374      1.181
         ROT  0.220E+04              888.752      2.981     18.272
         INT  0.262E+04             1135.412      5.355     19.453
         TR   0.167E+27             1481.254      4.968     36.214
         TOT                        2616.6661    10.3227    55.6669   232.9104

   temp. (K)  partition function   enthalpy   heat capacity  entropy
                                   cal/mol     cal/K/mol   cal/K/mol   J/K/mol
 120.00  VIB   1.01                   10.296      0.408      0.104
         ROT   561.                  357.707      2.981     15.559
         INT   566.                  368.003      3.389     15.663
         TR   0.427E+26              596.178      4.968     31.694
         TOT                         964.1812     8.3572    47.3575   198.1437

   temp. (K)  partition function   enthalpy   heat capacity  entropy
                                   cal/mol     cal/K/mol   cal/K/mol   J/K/mol
 100.00  VIB   1.00                    3.994      0.226      0.047
         ROT   427.                  298.089      2.981     15.015
         INT   428.                  302.083      3.207     15.063
         TR   0.325E+26              496.815      4.968     30.789
         TOT                         798.8981     8.1753    45.8517   191.8434

   temp. (K)  partition function   enthalpy   heat capacity  entropy
                                   cal/mol     cal/K/mol   cal/K/mol   J/K/mol
  80.00  VIB   1.00                    0.972      0.086      0.014
         ROT   305.                  238.471      2.981     14.350
         INT   306.                  239.443      3.067     14.364
         TR   0.232E+26              397.452      4.968     29.681
         TOT                         636.8952     8.0348    44.0452   184.2853

   temp. (K)  partition function   enthalpy   heat capacity  entropy
                                   cal/mol     cal/K/mol   cal/K/mol   J/K/mol
  60.00  VIB   1.00                    0.093      0.015      0.002
         ROT   198.                  178.853      2.981     13.493
         INT   198.                  178.946      2.995     13.494
         TR   0.151E+26              298.089      4.968     28.252
         TOT                         477.0350     7.9635    41.7469   174.6690

   temp. (K)  partition function   enthalpy   heat capacity  entropy
                                   cal/mol     cal/K/mol   cal/K/mol   J/K/mol
  40.00  VIB   1.00                    0.001      0.000     -0.000
         ROT   108.                  119.236      2.981     12.284
         INT   108.                  119.236      2.981     12.284
         TR   0.822E+25              198.726      4.968     26.239
         TOT                         317.9624     7.9493    38.5230   161.1804

   temp. (K)  partition function   enthalpy   heat capacity  entropy
                                   cal/mol     cal/K/mol   cal/K/mol   J/K/mol
  20.00  VIB   1.00                    0.000      0.000     -0.000
         ROT   38.2                   59.618      2.981     10.218
         INT   38.2                   59.618      2.981     10.218
         TR   0.291E+25               99.363      4.968     22.797
         TOT                         158.9808     7.9490    33.0146   138.1333

   temp. (K)  partition function   enthalpy   heat capacity  entropy
                                   cal/mol     cal/K/mol   cal/K/mol   J/K/mol
  10.00  VIB   1.00                    0.000      0.000     -0.001
         ROT   13.5                   29.809      2.981      8.152
         INT   13.5                   29.809      2.981      8.151
         TR   0.103E+25               49.681      4.968     19.355
         TOT                          79.4904     7.9490    27.5063   115.0863

       T/K    H(0)-H(T)+PV         H(T)/Eh          T*S/Eh         G(T)/Eh
   ------------------------------------------------------------------------
    298.15    0.416992E-02    0.378060E-01    0.264492E-01    0.113568E-01
    120.00    0.153652E-02    0.351726E-01    0.905628E-02    0.261163E-01
    100.00    0.127313E-02    0.349092E-01    0.730693E-02    0.276023E-01
     80.00    0.101496E-02    0.346510E-01    0.561525E-02    0.290358E-01
     60.00    0.760204E-03    0.343963E-01    0.399168E-02    0.304046E-01
     40.00    0.506705E-03    0.341428E-01    0.245561E-02    0.316872E-01
     20.00    0.253352E-03    0.338894E-01    0.105224E-02    0.328372E-01
     10.00    0.126676E-03    0.337627E-01    0.438341E-03    0.333244E-01 (used)
   ------------------------------------------------------------------------

         :::::::::::::::::::::::::::::::::::::::::::::::::::::
         ::                  THERMODYNAMIC                  ::
         :::::::::::::::::::::::::::::::::::::::::::::::::::::
         :: total free energy          -7.593931136126 Eh   ::
         ::.................................................::
         :: total energy               -7.627255536597 Eh   ::
         :: zero point energy           0.033636064961 Eh   ::
         :: G(RRHO) w/o ZPVE           -0.000311664491 Eh   ::
         :: G(RRHO) contrib.            0.033324400471 Eh   ::
         :::::::::::::::::::::::::::::::::::::::::::::::::::::
imag cut-off (cm-1) :    5.00
 found            1  significant imaginary frequency
 writing imag mode distorted coords to xtbhess.xyz
 for further optimization.

optimized geometry written to: xtbopt.xyz


           -------------------------------------------------
          | TOTAL ENERGY               -7.627255536597 Eh   |
          | TOTAL ENTHALPY             -7.593492795620 Eh   |
          | TOTAL FREE ENERGY          -7.593931136126 Eh   |
          | GRADIENT NORM               0.000522449096 Eh/α |
          | HOMO-LUMO GAP              10.541271579134 eV   |
           -------------------------------------------------

------------------------------------------------------------------------
 * finished run on 2020/05/12 at 11:44:44.493     
------------------------------------------------------------------------
 total:
 * wall-time:     0 d,  0 h,  0 min,  0.069 sec
 *  cpu-time:     0 d,  0 h,  0 min,  0.069 sec
 * ratio c/w:     0.999 speedup
 SCF:
 * wall-time:     0 d,  0 h,  0 min,  0.002 sec
 *  cpu-time:     0 d,  0 h,  0 min,  0.002 sec
 * ratio c/w:     0.999 speedup
 ANC optimizer:
 * wall-time:     0 d,  0 h,  0 min,  0.016 sec
 *  cpu-time:     0 d,  0 h,  0 min,  0.016 sec
 * ratio c/w:     1.000 speedup
 numerical hessian:
 * wall-time:     0 d,  0 h,  0 min,  0.034 sec
 *  cpu-time:     0 d,  0 h,  0 min,  0.034 sec
 * ratio c/w:     0.998 speedup

