      -----------------------------------------------------------      
     |                   =====================                   |     
     |                           x T B                           |     
     |                   =====================                   |     
     |                         S. Grimme                         |     
     |          Mulliken Center for Theoretical Chemistry        |     
     |                    University of Bonn                     |     
      -----------------------------------------------------------      

   * xtb version 6.2.2 (9d81278992624c895f80dd42a50cac0aa55982e2) compiled by '@Darwin' on 04/03/2020

   xtb is free software: you can redistribute it and/or modify it under
   the terms of the GNU Lesser General Public License as published by
   the Free Software Foundation, either version 3 of the License, or
   (at your option) any later version.
   
   xtb is distributed in the hope that it will be useful,
   but WITHOUT ANY WARRANTY; without even the implied warranty of
   MERCHANTABILITY or FITNESS FOR A PARTICULAR PURPOSE.  See the
   GNU Lesser General Public License for more details.
   
   Cite this work as:
   * S. Grimme, C. Bannwarth, P. Shushkov, J. Chem. Theory Comput., 2017,
     13, 1989-2009. DOI: 10.1021/acs.jctc.7b00118
   * C. Bannwarth, S. Ehlert and S. Grimme., J. Chem. Theory Comput., 2019,
     15, 1652-1671. DOI: 10.1021/acs.jctc.8b01176
   * P. Pracht, E. Caldeweyher, S. Ehlert, S. Grimme, ChemRxiv, 2019, preprint.
     DOI: 10.26434/chemrxiv.8326202.v1
   
   for DFT-D4:
   * E. Caldeweyher, C. Bannwarth and S. Grimme, J. Chem. Phys., 2017,
     147, 034112. DOI: 10.1063/1.4993215
   * E. Caldeweyher, S. Ehlert, A. Hansen, H. Neugebauer, S. Spicher,
     C. Bannwarth and S. Grimme, J. Chem. Phys., 2019, 150, 154122.
     DOI: 10.1063/1.5090222
   
   for sTDA-xTB:
   * S. Grimme and C. Bannwarth, J. Chem. Phys., 2016, 145, 054103.
     DOI: 10.1063/1.4959605
   
   in the mass-spec context:
   * V. Asgeirsson, C. Bauer and S. Grimme, Chem. Sci., 2017, 8, 4879.
     DOI: 10.1039/c7sc00601b
   
   for metadynamics refer to:
   * S. Grimme, J. Chem. Theory Comput., 2019, 155, 2847-2862
     DOI: 10.1021/acs.jctc.9b00143
   
   with help from (in alphabetical order)
   C. Bannwarth, F. Bohle, G. Brandenburg, E. Caldeweyher, M. Checinski,
   S. Dohm, S. Ehlert, S. Ehrlich, F. März, H. Neugebauer, J. Pisarek,
   P. Pracht, P. Shushkov, and S. Spicher.
   
 * started run on 2020/05/12 at 11:43:51.717     

           -------------------------------------------------
          |                Calculation Setup                |
           -------------------------------------------------

          program call               : xtb --input H1C3_2_S_3.input H1C3_2_S_3.xyz --ohess --molden --namespace H1C3_2_S_3 output.out
          calculation namespace      : H1C3_2_S_3
          coordinate file            : H1C3_2_S_3.xyz
          number of atoms            :                     4
          number of electrons        :                    13
          charge                     :                     0
          spin                       :                   1.5
          first test random number   :      0.85354217670171

   ID    Z sym.   atoms
    1    6 C      1-3
    2    1 H      4

           -------------------------------------------------
          |                 G F N 2 - x T B                 |
           -------------------------------------------------

        Reference                      10.1021/acs.jctc.8b01176
      * Hamiltonian:
        H0-scaling (s, p, d)           1.850000    2.230000    2.230000
        zeta-weighting                 0.500000
      * Dispersion:
        s8                             2.700000
        a1                             0.520000
        a2                             5.000000
        s9                             5.000000
      * Repulsion:
        kExp                           1.500000    1.000000
        rExp                           1.000000
      * Coulomb:
        alpha                          2.000000
        third order                    shell-resolved
        anisotropic                    true
        a3                             3.000000
        a5                             4.000000
        cn-shift                       1.200000
        cn-exp                         4.000000
        max-rad                        5.000000


          ...................................................
          :                      SETUP                      :
          :.................................................:
          :  # basis functions                  13          :
          :  # atomic orbitals                  13          :
          :  # shells                            7          :
          :  # electrons                        13          :
          :  max. iterations                   250          :
          :  Hamiltonian                  GFN2-xTB          :
          :  restarted?                      false          :
          :  GBSA solvation                  false          :
          :  PC potential                    false          :
          :  electronic temp.          300.0000000     K    :
          :  accuracy                    1.0000000          :
          :  -> integral cutoff          0.2500000E+02      :
          :  -> integral neglect         0.1000000E-07      :
          :  -> SCF convergence          0.1000000E-05 Eh   :
          :  -> wf. convergence          0.1000000E-03 e    :
          :  Broyden damping             0.4000000          :
          ...................................................

 iter      E             dE          RMSdq      gap      omega  full diag
   1     -6.5247094 -0.652471E+01  0.715E+00    1.52       0.0  T
   2     -6.5308636 -0.615419E-02  0.451E+00    0.61       1.0  T
   3     -6.5036201  0.272435E-01  0.324E+00    1.62       1.0  T
   4     -6.5440223 -0.404023E-01  0.655E-01    0.89       1.0  T
   5     -6.5437628  0.259509E-03  0.462E-01    1.15       1.0  T
   6     -6.5446339 -0.871097E-03  0.239E-01    0.96       1.0  T
   7     -6.5448867 -0.252745E-03  0.443E-02    1.03       1.1  T
   8     -6.5448931 -0.647196E-05  0.311E-02    1.03       1.6  T
   9     -6.5448971 -0.395327E-05  0.170E-02    1.03       2.9  T
  10     -6.5448984 -0.129812E-05  0.253E-03    1.03      19.7  T
  11     -6.5448984 -0.258153E-07  0.338E-04    1.03     148.0  T
  12     -6.5448984 -0.184287E-09  0.396E-05    1.03    1262.9  T

   *** convergence criteria satisfied after 12 iterations ***

         #    Occupation            Energy/Eh            Energy/eV
      -------------------------------------------------------------
         1        2.0000           -0.6851253             -18.6432
         2        2.0000           -0.5743978             -15.6302
         3        2.0000           -0.5543913             -15.0858
         4        2.0000           -0.5109161             -13.9027
         5        2.0000           -0.4513049             -12.2806
         6        1.0000           -0.4261893             -11.5972
         7        1.0000           -0.4236506             -11.5281
         8        1.0000           -0.3495334              -9.5113 (HOMO)
         9                         -0.3117733              -8.4838 (LUMO)
        10                         -0.1056086              -2.8738
        11                          0.1418227               3.8592
        12                          0.1425469               3.8789
        13                          0.1540314               4.1914
      -------------------------------------------------------------
                  HL-Gap            0.0377601 Eh            1.0275 eV
             Fermi-level           -0.3847161 Eh          -10.4687 eV

 SCC (total)                   0 d,  0 h,  0 min,  0.002 sec
 SCC setup                      ...        0 min,  0.000 sec (  2.780%)
 Dispersion                     ...        0 min,  0.000 sec (  0.496%)
 integral evaluation            ...        0 min,  0.001 sec ( 21.031%)
 zeroth order Hamiltonian       ...        0 min,  0.000 sec (  0.457%)
 iterations                     ...        0 min,  0.001 sec ( 48.148%)
 molecular gradient             ...        0 min,  0.001 sec ( 24.983%)
 printout                       ...        0 min,  0.000 sec (  1.758%)

         :::::::::::::::::::::::::::::::::::::::::::::::::::::
         ::                     SUMMARY                     ::
         :::::::::::::::::::::::::::::::::::::::::::::::::::::
         :: total energy              -6.485718998721 Eh    ::
         :: gradient norm              0.203085081659 Eh/a0 ::
         :: HOMO-LUMO gap              1.027504720297 eV    ::
         ::.................................................::
         :: SCC energy                -6.544898401721 Eh    ::
         :: -> isotropic ES           -0.006993476881 Eh    ::
         :: -> anisotropic ES          0.000799852804 Eh    ::
         :: -> anisotropic XC          0.003249677191 Eh    ::
         :: -> dispersion             -0.001250806193 Eh    ::
         :: repulsion energy           0.059179395258 Eh    ::
         :: add. restraining           0.000000000000 Eh    ::
         :::::::::::::::::::::::::::::::::::::::::::::::::::::

      ----------------------------------------------------------- 
     |                   =====================                   |
     |                        A N C O P T                        |
     |                   =====================                   |
     |               Approximate Normal Coordinate               |
     |                Rational Function Optimizer                |
      ----------------------------------------------------------- 

          ...................................................
          :                      SETUP                      :
          :.................................................:
          :   optimization level            normal          :
          :   max. optcycles                   200          :
          :   ANC micro-cycles                  20          :
          :   degrees of freedom                 6          :
          :.................................................:
          :   RF solver                   davidson          :
          :   write xtbopt.log                true          :
          :   linear?                        false          :
          :   energy convergence         0.5000000E-05 Eh   :
          :   grad. convergence          0.1000000E-02 Eh/α :
          :   maximium RF displ.         1.0000000          :
          :   Hlow (freq-cutoff)         0.1000000E-01      :
          :   Hmax (freq-cutoff)         5.0000000          :
          :   S6 in model hess.         20.0000000          :
          ...................................................

generating ANC from model Hessian ...
Using Lindh-Hessian (1995)
 Shifting diagonal of input Hessian by    0.0000000000000000     
 Lowest  eigenvalues of input Hessian
   -0.000000   -0.000000    0.000000    0.000000    0.000000    0.000000
    0.060266    0.112323    0.642693    0.693478    0.843793    1.275429
 Highest eigenvalues
    0.060266    0.112323    0.642693    0.693478    0.843793    1.275429


........................................................................
.............................. CYCLE    1 ..............................
........................................................................
   1     -6.5448984 -0.654490E+01  0.181E-05    1.03       0.0  T
   2     -6.5448984  0.113687E-12  0.150E-05    1.03    3332.0  T
   3     -6.5448984 -0.112177E-11  0.584E-06    1.03    8564.3  T
     SCC iter.                  ...        0 min,  0.000 sec
     gradient                   ...        0 min,  0.000 sec
 * total energy  :    -6.4857190 Eh     change       -0.1515845E-09 Eh
   gradient norm :     0.2030852 Eh/α   predicted     0.0000000E+00 (-100.00%)
   displ. norm   :     0.3215078 α      lambda       -0.5071937E-01
   maximum displ.:     0.2410463 α      in ANC's #2, #5, #3, ...

........................................................................
.............................. CYCLE    2 ..............................
........................................................................
   1     -6.6121548 -0.661215E+01  0.203E+00    2.18       0.0  T
   2     -6.6122029 -0.480681E-04  0.122E+00    2.31       1.0  T
   3     -6.6097169  0.248598E-02  0.735E-01    2.00       1.0  T
   4     -6.6125660 -0.284906E-02  0.780E-02    2.22       1.0  T
   5     -6.6125671 -0.115053E-05  0.251E-02    2.22       2.0  T
   6     -6.6125680 -0.924578E-06  0.977E-03    2.22       5.1  T
   7     -6.6125683 -0.282794E-06  0.425E-03    2.22      11.8  T
   8     -6.6125684 -0.109347E-06  0.774E-04    2.22      64.6  T
   9     -6.6125684 -0.429528E-09  0.148E-04    2.22     338.6  T
     SCC iter.                  ...        0 min,  0.000 sec
     gradient                   ...        0 min,  0.000 sec
 * total energy  :    -6.5247418 Eh     change       -0.3902278E-01 Eh
   gradient norm :     0.0913383 Eh/α   predicted    -0.2798104E-01 ( -28.30%)
   displ. norm   :     0.2280921 α      lambda       -0.1690719E-01
   maximum displ.:     0.1609640 α      in ANC's #2, #5, #6, ...

........................................................................
.............................. CYCLE    3 ..............................
........................................................................
   1     -6.6619041 -0.666190E+01  0.158E+00    3.38       0.0  T
   2     -6.6619570 -0.529127E-04  0.935E-01    3.46       1.0  T
   3     -6.6611590  0.797974E-03  0.408E-01    3.27       1.0  T
   4     -6.6620640 -0.904973E-03  0.496E-02    3.40       1.0  T
   5     -6.6620644 -0.420899E-06  0.145E-02    3.40       3.4  T
   6     -6.6620645 -0.639773E-07  0.458E-03    3.40      10.9  T
   7     -6.6620646 -0.772247E-07  0.508E-04    3.40      98.4  T
   8     -6.6620646  0.975309E-11  0.859E-05    3.40     582.2  T
     SCC iter.                  ...        0 min,  0.000 sec
     gradient                   ...        0 min,  0.001 sec
 * total energy  :    -6.5256526 Eh     change       -0.9107746E-03 Eh
   gradient norm :     0.1280926 Eh/α   predicted    -0.8893403E-02 ( 876.47%)
   displ. norm   :     0.0938785 α      lambda       -0.1159971E-01
   maximum displ.:     0.0638496 α      in ANC's #3, #5, #6, ...

........................................................................
.............................. CYCLE    4 ..............................
........................................................................
   1     -6.6351917 -0.663519E+01  0.840E-01    2.61       0.0  T
   2     -6.6352083 -0.166498E-04  0.490E-01    2.53       1.0  T
   3     -6.6347872  0.421078E-03  0.332E-01    2.67       1.0  T
   4     -6.6352944 -0.507172E-03  0.248E-02    2.57       2.0  T
   5     -6.6352944 -0.100402E-08  0.685E-03    2.58       7.3  T
   6     -6.6352945 -0.596093E-07  0.265E-03    2.57      18.9  T
   7     -6.6352944  0.172002E-07  0.285E-03    2.57      17.6  T
   8     -6.6352945 -0.487059E-07  0.263E-04    2.57     190.0  T
   9     -6.6352945 -0.132001E-10  0.254E-05    2.57    1968.6  T
     SCC iter.                  ...        0 min,  0.001 sec
     gradient                   ...        0 min,  0.001 sec
 * total energy  :    -6.5305172 Eh     change       -0.4864622E-02 Eh
   gradient norm :     0.0190178 Eh/α   predicted    -0.5850971E-02 (  20.28%)
   displ. norm   :     0.0309028 α      lambda       -0.3786536E-03
   maximum displ.:     0.0238409 α      in ANC's #2, #5, #3, ...

........................................................................
.............................. CYCLE    5 ..............................
........................................................................
   1     -6.6390015 -0.663900E+01  0.149E-01    2.58       0.0  T
   2     -6.6390026 -0.114917E-05  0.860E-02    2.57       1.0  T
   3     -6.6389918  0.108544E-04  0.557E-02    2.59       1.0  T
   4     -6.6390049 -0.130790E-04  0.649E-03    2.57       7.7  T
   5     -6.6390049 -0.152573E-07  0.178E-03    2.57      28.1  T
   6     -6.6390049 -0.437701E-09  0.180E-04    2.57     277.8  T
   7     -6.6390049 -0.322231E-11  0.667E-05    2.57     749.4  T
     SCC iter.                  ...        0 min,  0.000 sec
     gradient                   ...        0 min,  0.000 sec
 * total energy  :    -6.5307968 Eh     change       -0.2795864E-03 Eh
   gradient norm :     0.0081116 Eh/α   predicted    -0.1895075E-03 ( -32.22%)
   displ. norm   :     0.0369582 α      lambda       -0.2055727E-03
   maximum displ.:     0.0291234 α      in ANC's #2, #3, #5, ...

........................................................................
.............................. CYCLE    6 ..............................
........................................................................
   1     -6.6415744 -0.664157E+01  0.173E-01    2.53       0.0  T
   2     -6.6415762 -0.178039E-05  0.980E-02    2.51       1.0  T
   3     -6.6415611  0.151456E-04  0.745E-02    2.54       1.0  T
   4     -6.6415814 -0.203020E-04  0.641E-03    2.52       7.8  T
   5     -6.6415814  0.314104E-08  0.246E-03    2.52      20.4  T
   6     -6.6415814  0.475681E-09  0.213E-03    2.52      23.5  T
   7     -6.6415814 -0.189502E-07  0.147E-04    2.52     341.2  T
   8     -6.6415814 -0.162652E-10  0.478E-05    2.52    1047.0  T
     SCC iter.                  ...        0 min,  0.000 sec
     gradient                   ...        0 min,  0.001 sec
 * total energy  :    -6.5309111 Eh     change       -0.1143368E-03 Eh
   gradient norm :     0.0023080 Eh/α   predicted    -0.1029257E-03 (  -9.98%)
   displ. norm   :     0.0075395 α      lambda       -0.8880665E-05
   maximum displ.:     0.0059905 α      in ANC's #2, #3, #5, ...

........................................................................
.............................. CYCLE    7 ..............................
........................................................................
   1     -6.6414854 -0.664149E+01  0.376E-02    2.49       0.0  T
   2     -6.6414855 -0.857164E-07  0.212E-02    2.49       2.4  T
   3     -6.6414849  0.642552E-06  0.171E-02    2.50       2.9  T
   4     -6.6414859 -0.987435E-06  0.940E-04    2.49      53.2  T
   5     -6.6414859 -0.234130E-09  0.245E-04    2.49     204.3  T
     SCC iter.                  ...        0 min,  0.000 sec
     gradient                   ...        0 min,  0.001 sec
 * total energy  :    -6.5309164 Eh     change       -0.5262543E-05 Eh
   gradient norm :     0.0007326 Eh/α   predicted    -0.4439392E-05 ( -15.64%)
   displ. norm   :     0.0018032 α      lambda       -0.5324020E-06
   maximum displ.:     0.0014691 α      in ANC's #3, #2, #5, ...

........................................................................
.............................. CYCLE    8 ..............................
........................................................................
   1     -6.6413278 -0.664133E+01  0.122E-02    2.48       0.0  T
   2     -6.6413278 -0.838388E-08  0.690E-03    2.48       7.2  T
   3     -6.6413277  0.666575E-07  0.549E-03    2.48       9.1  T
   4     -6.6413278 -0.103797E-06  0.263E-04    2.48     189.8  T
   5     -6.6413278  0.509817E-09  0.324E-04    2.48     154.3  T
     SCC iter.                  ...        0 min,  0.001 sec
     gradient                   ...        0 min,  0.000 sec
 * total energy  :    -6.5309166 Eh     change       -0.2243579E-06 Eh
   gradient norm :     0.0002855 Eh/α   predicted    -0.2675951E-06 (  19.27%)
   displ. norm   :     0.0006766 α      lambda       -0.7242370E-07
   maximum displ.:     0.0005142 α      in ANC's #3, #2, #5, ...

   *** GEOMETRY OPTIMIZATION CONVERGED AFTER 8 ITERATIONS ***

------------------------------------------------------------------------
 total energy gain   :        -0.0451976 Eh      -28.3619 kcal/mol
 total RMSD          :         0.2823942 a0        0.1494 Å
 total power (kW/mol):       -14.8332808 (step)-8832.0672 (real)
------------------------------------------------------------------------

 ANCopt (total)                0 d,  0 h,  0 min,  0.013 sec
 optimizer setup                ...        0 min,  0.000 sec (  0.387%)
 model hessian                  ...        0 min,  0.000 sec (  0.417%)
 ANC generation                 ...        0 min,  0.000 sec (  0.250%)
 coordinate transformation      ...        0 min,  0.000 sec (  0.101%)
 single point calculation       ...        0 min,  0.013 sec ( 95.190%)
 optimization log               ...        0 min,  0.000 sec (  0.983%)
 hessian update                 ...        0 min,  0.000 sec (  0.096%)
 rational function              ...        0 min,  0.000 sec (  0.952%)

================
 final structure:
================
4
 xtb: 6.2.2 (9d81278992624c895f80dd42a50cac0aa55982e2)
C         0.41624747303292   -0.03314106655541    0.32992333760531
C        -0.90400727538589   -0.61552127401064   -0.10230445260171
C        -0.86221246884187    0.68009704829832   -0.02488901833759
H         1.34997227119484   -0.03143470773227   -0.20272986666601

 Bond Distances (Angstroems)
 ---------------------------
C1-C2=1.5063         C1-C3=1.5063         C1-H4=1.0750         C2-C1=1.5063         C2-C3=1.2986         C3-C1=1.5063         
C3-C2=1.2986         H4-C1=1.0750         
 C  H  Rav=1.0750 sigma=0.0000  Rmin=1.0750  Rmax=1.0750     1
 C  C  Rav=1.4371 sigma=0.0979  Rmin=1.2986  Rmax=1.5063     3

 selected bond angles (degree)
 --------------------
C3-C1-C2= 51.07                H4-C1-C2=128.30                H4-C1-C3=128.30                C3-C2-C1= 64.47                
C2-C3-C1= 64.47                

 selected dihedral angles (degree)
 ---------------------------------
C3-C2-C1-H4=247.84            C2-C3-C1-H4=112.16            
           -------------------------------------------------
          |                Final Singlepoint                |
           -------------------------------------------------

          ...................................................
          :                      SETUP                      :
          :.................................................:
          :  # basis functions                  13          :
          :  # atomic orbitals                  13          :
          :  # shells                            7          :
          :  # electrons                        13          :
          :  max. iterations                   250          :
          :  Hamiltonian                  GFN2-xTB          :
          :  restarted?                      false          :
          :  GBSA solvation                  false          :
          :  PC potential                    false          :
          :  electronic temp.          300.0000000     K    :
          :  accuracy                    1.0000000          :
          :  -> integral cutoff          0.2500000E+02      :
          :  -> integral neglect         0.1000000E-07      :
          :  -> SCF convergence          0.1000000E-05 Eh   :
          :  -> wf. convergence          0.1000000E-03 e    :
          :  Broyden damping             0.4000000          :
          ...................................................

 iter      E             dE          RMSdq      gap      omega  full diag
   1     -6.6413278 -0.664133E+01  0.884E-05    2.48       0.0  T
   2     -6.6413278  0.274625E-11  0.478E-05    2.48    1045.8  T
   3     -6.6413278  0.223137E-10  0.759E-05    2.48     658.5  T

   *** convergence criteria satisfied after 3 iterations ***

         #    Occupation            Energy/Eh            Energy/eV
      -------------------------------------------------------------
         1        2.0000           -0.6844150             -18.6239
         2        2.0000           -0.5807921             -15.8042
         3        2.0000           -0.5347249             -14.5506
         4        2.0000           -0.5130506             -13.9608
         5        2.0000           -0.4780614             -13.0087
         6        1.0000           -0.3956414             -10.7660
         7        1.0000           -0.3907403             -10.6326
         8        1.0000           -0.3362133              -9.1488 (HOMO)
         9                         -0.2450606              -6.6684 (LUMO)
        10                         -0.0541131              -1.4725
        11                          0.0797093               2.1690
        12                          0.2818489               7.6695
        13                          0.5843422              15.9008
      -------------------------------------------------------------
                  HL-Gap            0.0911527 Eh            2.4804 eV
             Fermi-level           -0.3637442 Eh           -9.8980 eV

 SCC (total)                   0 d,  0 h,  0 min,  0.001 sec
 SCC setup                      ...        0 min,  0.000 sec (  3.241%)
 Dispersion                     ...        0 min,  0.000 sec (  1.440%)
 integral evaluation            ...        0 min,  0.000 sec ( 39.196%)
 zeroth order Hamiltonian       ...        0 min,  0.000 sec (  0.891%)
 iterations                     ...        0 min,  0.000 sec ( 12.718%)
 molecular gradient             ...        0 min,  0.000 sec ( 37.908%)
 printout                       ...        0 min,  0.000 sec (  4.227%)

         :::::::::::::::::::::::::::::::::::::::::::::::::::::
         ::                     SUMMARY                     ::
         :::::::::::::::::::::::::::::::::::::::::::::::::::::
         :: total energy              -6.530916584868 Eh    ::
         :: gradient norm              0.000285416911 Eh/a0 ::
         :: HOMO-LUMO gap              2.480390667064 eV    ::
         ::.................................................::
         :: SCC energy                -6.641327814698 Eh    ::
         :: -> isotropic ES           -0.003407548001 Eh    ::
         :: -> anisotropic ES          0.000731978126 Eh    ::
         :: -> anisotropic XC          0.003724064236 Eh    ::
         :: -> dispersion             -0.001250884945 Eh    ::
         :: repulsion energy           0.110411224550 Eh    ::
         :: add. restraining           0.000000000000 Eh    ::
         :::::::::::::::::::::::::::::::::::::::::::::::::::::

           ------------------------------------------------- 
          |                Numerical Hessian                |
           ------------------------------------------------- 
step length          :   0.00500
SCC accuracy         :   0.30000
Hessian scale factor :   1.00000
frozen atoms in %    :   0.00000    0
RMS gradient         :   0.00029
estimated CPU  time      0.00 min
estimated wall time      0.00 min

writing file <hessian>.

 projected vibrational frequencies (cm-1)
eigval :       -0.00    -0.00     0.00     0.00     0.00     0.00
eigval :      590.87   831.23   850.52  1125.63  1774.06  3051.81
           -------------------------------------------------
          |                Property Printout                |
           -------------------------------------------------

    * Orbital Energies and Occupations

         #    Occupation            Energy/Eh            Energy/eV
      -------------------------------------------------------------
         1        2.0000           -0.6844150             -18.6239
         2        2.0000           -0.5807921             -15.8042
         3        2.0000           -0.5347249             -14.5506
         4        2.0000           -0.5130506             -13.9608
         5        2.0000           -0.4780613             -13.0087
         6        1.0000           -0.3956415             -10.7660
         7        1.0000           -0.3907403             -10.6326
         8        1.0000           -0.3362133              -9.1488 (HOMO)
         9                         -0.2450605              -6.6684 (LUMO)
        10                         -0.0541131              -1.4725
        11                          0.0797093               2.1690
        12                          0.2818488               7.6695
        13                          0.5843422              15.9008
      -------------------------------------------------------------
                  HL-Gap            0.0911527 Eh            2.4804 eV
             Fermi-level           -0.3637442 Eh           -9.8980 eV

     #   Z        covCN         q      C6AA      α(0)
     1   6 C      2.879    -0.036    28.897     8.813
     2   6 C      1.957    -0.016    31.507     9.065
     3   6 C      1.957    -0.016    31.507     9.065
     4   1 H      0.926     0.069     2.099     2.266
Molecule has the following symmetry elements: (sigma) 
It seems to be the Cs point group

 Mol. C6AA /au·bohr⁶  :        325.760183
 Mol. C8AA /au·bohr⁸  :       8894.840181
 Mol. α(0) /au        :         29.207278


Wiberg/Mayer (AO) data.
largest (>0.10) Wiberg bond orders for each atom
          total WBO             WBO to atom ...
     1  C   2.665        H    4 0.940    C    3 0.862    C    2 0.862
     2  C   2.722        C    3 1.853    C    1 0.862
     3  C   2.722        C    2 1.853    C    1 0.862
     4  H   0.952        C    1 0.940

MOs/occ written to file <molden.input>


molecular dipole:
                 x           y           z       tot (Debye)
 q only:        0.201      -0.004      -0.045
   full:        0.321       0.004      -0.233       1.008
molecular quadrupole (traceless):
                xx          xy          yy          xz          yz          zz
 q only:        0.361      -0.010      -0.214      -0.137       0.000      -0.147
  q+dip:        0.253       0.061       0.542      -0.853       0.108      -0.795
   full:        0.028       0.049      -0.114      -0.900       0.017       0.086

           -------------------------------------------------
          |                Geometry Summary                 |
           -------------------------------------------------

      molecular mass/u    :       37.0401484
   center of mass at/Å    :       -0.4010097       0.0093399       0.0602224
  moments of inertia/u·Å² :        0.1063213E+02   0.1804307E+02   0.2766544E+02
rotational constants/cm⁻¹ :        0.1585537E+01   0.9342998E+00   0.6093390E+00

 * 2 selected distances

     #   Z        #   Z                                     value/Å
     2   6 C      3   6 C                                 1.2986019 (max)
     1   6 C      4   1 H                                 1.0749718 (min)

 * 2 distinct bonds (by element types)

   Z      Z             #   av. dist./Å        max./Å        min./Å
   1 H    6 C           1     1.0749718     1.0749718     1.0749718
   6 C    6 C           1     1.2986019     1.2986019     1.2986019

           -------------------------------------------------
          |               Frequency Printout                |
           -------------------------------------------------
 projected vibrational frequencies (cm-1)
eigval :       -0.00    -0.00     0.00     0.00     0.00     0.00
eigval :      590.87   831.23   850.52  1125.63  1774.06  3051.81
 reduced masses (amu)
   1:  9.84   2: 11.92   3: 11.78   4: 11.82   5: 11.76   6: 10.60   7: 11.66   8:  3.17
   9:  2.98  10: 11.75  11: 11.98  12:  1.85
 IR intensities (amu)
   1:  0.10   2:  0.08   3:  0.07   4:  0.09   5:  0.04   6:  0.06   7:  0.37   8:  0.17
   9:  0.24  10:  0.39  11:  0.27  12:  0.24
 Raman intensities (amu)
   1:  0.00   2:  0.00   3:  0.00   4:  0.00   5:  0.00   6:  0.00   7:  0.00   8:  0.00
   9:  0.00  10:  0.00  11:  0.00  12:  0.00
 output can be read by thermo (or use thermo option).
 writing <g98.out> molden fake output.
 recommended (thermochemical) frequency scaling factor: 1.0
           -------------------------------------------------
          |             Thermodynamic Functions             |
           -------------------------------------------------

cs  symmetry found (for desy threshold:  0.10E+00) used in thermo

          ...................................................
          :                      SETUP                      :
          :.................................................:
          :  # frequencies                           6      :
          :  # imaginary freq.                       0      :
          :  linear?                             false      :
          :  only rotor calc.                    false      :
          :  symmetry                               cs      :
          :  rotational number                       1      :
          :  scaling factor                  1.0000000      :
          :  rotor cutoff                   50.0000000 cm⁻¹ :
          :  imag. cutoff                  -20.0000000 cm⁻¹ :
          :.................................................:

    mode    ω/cm⁻¹     T·S(HO)/kcal·mol⁻¹    T·S(FR)/kcal·mol⁻¹   T·S(vib)
   ------------------------------------------------------------------------
   ------------------------------------------------------------------------

   temp. (K)  partition function   enthalpy   heat capacity  entropy
                                   cal/mol     cal/K/mol   cal/K/mol   J/K/mol
 298.15  VIB   1.10                  203.326      2.510      0.879
         ROT  0.557E+04              888.752      2.981     20.120
         INT  0.614E+04             1092.078      5.491     20.998
         TR   0.218E+27             1481.254      4.968     36.741
         TOT                        2573.3320    10.4589    57.7392   241.5808

   temp. (K)  partition function   enthalpy   heat capacity  entropy
                                   cal/mol     cal/K/mol   cal/K/mol   J/K/mol
 120.00  VIB   1.00                    1.624      0.101      0.015
         ROT  0.142E+04              357.707      2.981     17.407
         INT  0.142E+04              359.330      3.082     17.422
         TR   0.557E+26              596.178      4.968     32.222
         TOT                         955.5084     8.0502    49.6436   207.7088

   temp. (K)  partition function   enthalpy   heat capacity  entropy
                                   cal/mol     cal/K/mol   cal/K/mol   J/K/mol
 100.00  VIB   1.00                    0.371      0.033      0.004
         ROT  0.108E+04              298.089      2.981     16.863
         INT  0.108E+04              298.460      3.013     16.867
         TR   0.424E+26              496.815      4.968     31.316
         TOT                         795.2746     7.9815    48.1835   201.5998

   temp. (K)  partition function   enthalpy   heat capacity  entropy
                                   cal/mol     cal/K/mol   cal/K/mol   J/K/mol
  80.00  VIB   1.00                    0.042      0.006      0.001
         ROT   773.                  238.471      2.981     16.198
         INT   774.                  238.514      2.987     16.199
         TR   0.303E+26              397.452      4.968     30.208
         TOT                         635.9655     7.9547    46.4067   194.1656

   temp. (K)  partition function   enthalpy   heat capacity  entropy
                                   cal/mol     cal/K/mol   cal/K/mol   J/K/mol
  60.00  VIB   1.00                    0.001      0.000     -0.000
         ROT   502.                  178.853      2.981     15.340
         INT   502.                  178.855      2.981     15.340
         TR   0.197E+26              298.089      4.968     28.780
         TOT                         476.9436     7.9493    44.1200   184.5982

   temp. (K)  partition function   enthalpy   heat capacity  entropy
                                   cal/mol     cal/K/mol   cal/K/mol   J/K/mol
  40.00  VIB   1.00                    0.000      0.000     -0.000
         ROT   273.                  119.236      2.981     14.132
         INT   273.                  119.236      2.981     14.132
         TR   0.107E+26              198.726      4.968     26.766
         TOT                         317.9616     7.9490    40.8979   171.1168

   temp. (K)  partition function   enthalpy   heat capacity  entropy
                                   cal/mol     cal/K/mol   cal/K/mol   J/K/mol
  20.00  VIB   1.00                    0.000      0.000     -0.000
         ROT   96.7                   59.618      2.981     12.066
         INT   96.7                   59.618      2.981     12.065
         TR   0.379E+25               99.363      4.968     23.324
         TOT                         158.9808     7.9490    35.3897   148.0704

   temp. (K)  partition function   enthalpy   heat capacity  entropy
                                   cal/mol     cal/K/mol   cal/K/mol   J/K/mol
  10.00  VIB   1.00                    0.000      0.000     -0.000
         ROT   34.2                   29.809      2.981      9.999
         INT   34.2                   29.809      2.981      9.999
         TR   0.134E+25               49.681      4.968     19.882
         TOT                          79.4904     7.9490    29.8814   125.0239

       T/K    H(0)-H(T)+PV         H(T)/Eh          T*S/Eh         G(T)/Eh
   ------------------------------------------------------------------------
    298.15    0.410087E-02    0.228368E-01    0.274338E-01   -0.459694E-02
    120.00    0.152270E-02    0.202587E-01    0.949345E-02    0.107652E-01
    100.00    0.126735E-02    0.200033E-01    0.767853E-02    0.123248E-01
     80.00    0.101348E-02    0.197494E-01    0.591630E-02    0.138331E-01
     60.00    0.760058E-03    0.194960E-01    0.421858E-02    0.152774E-01
     40.00    0.506704E-03    0.192427E-01    0.260700E-02    0.166357E-01
     20.00    0.253352E-03    0.189893E-01    0.112794E-02    0.178614E-01
     10.00    0.126676E-03    0.188626E-01    0.476191E-03    0.183864E-01 (used)
   ------------------------------------------------------------------------

         :::::::::::::::::::::::::::::::::::::::::::::::::::::
         ::                  THERMODYNAMIC                  ::
         :::::::::::::::::::::::::::::::::::::::::::::::::::::
         :: total free energy          -6.512530148867 Eh   ::
         ::.................................................::
         :: total energy               -6.530916585001 Eh   ::
         :: zero point energy           0.018735951094 Eh   ::
         :: G(RRHO) w/o ZPVE           -0.000349514961 Eh   ::
         :: G(RRHO) contrib.            0.018386436133 Eh   ::
         :::::::::::::::::::::::::::::::::::::::::::::::::::::

optimized geometry written to: xtbopt.xyz


           -------------------------------------------------
          | TOTAL ENERGY               -6.530916585001 Eh   |
          | TOTAL ENTHALPY             -6.512053957891 Eh   |
          | TOTAL FREE ENERGY          -6.512530148867 Eh   |
          | GRADIENT NORM               0.000285386771 Eh/α |
          | HOMO-LUMO GAP               2.480392500632 eV   |
           -------------------------------------------------

------------------------------------------------------------------------
 * finished run on 2020/05/12 at 11:43:51.790     
------------------------------------------------------------------------
 total:
 * wall-time:     0 d,  0 h,  0 min,  0.072 sec
 *  cpu-time:     0 d,  0 h,  0 min,  0.072 sec
 * ratio c/w:     0.999 speedup
 SCF:
 * wall-time:     0 d,  0 h,  0 min,  0.002 sec
 *  cpu-time:     0 d,  0 h,  0 min,  0.002 sec
 * ratio c/w:     1.000 speedup
 ANC optimizer:
 * wall-time:     0 d,  0 h,  0 min,  0.015 sec
 *  cpu-time:     0 d,  0 h,  0 min,  0.015 sec
 * ratio c/w:     0.998 speedup
 numerical hessian:
 * wall-time:     0 d,  0 h,  0 min,  0.036 sec
 *  cpu-time:     0 d,  0 h,  0 min,  0.036 sec
 * ratio c/w:     0.999 speedup

