      -----------------------------------------------------------      
     |                   =====================                   |     
     |                           x T B                           |     
     |                   =====================                   |     
     |                         S. Grimme                         |     
     |          Mulliken Center for Theoretical Chemistry        |     
     |                    University of Bonn                     |     
      -----------------------------------------------------------      

   * xtb version 6.2.2 (9d81278992624c895f80dd42a50cac0aa55982e2) compiled by '@Darwin' on 04/03/2020

   xtb is free software: you can redistribute it and/or modify it under
   the terms of the GNU Lesser General Public License as published by
   the Free Software Foundation, either version 3 of the License, or
   (at your option) any later version.
   
   xtb is distributed in the hope that it will be useful,
   but WITHOUT ANY WARRANTY; without even the implied warranty of
   MERCHANTABILITY or FITNESS FOR A PARTICULAR PURPOSE.  See the
   GNU Lesser General Public License for more details.
   
   Cite this work as:
   * S. Grimme, C. Bannwarth, P. Shushkov, J. Chem. Theory Comput., 2017,
     13, 1989-2009. DOI: 10.1021/acs.jctc.7b00118
   * C. Bannwarth, S. Ehlert and S. Grimme., J. Chem. Theory Comput., 2019,
     15, 1652-1671. DOI: 10.1021/acs.jctc.8b01176
   * P. Pracht, E. Caldeweyher, S. Ehlert, S. Grimme, ChemRxiv, 2019, preprint.
     DOI: 10.26434/chemrxiv.8326202.v1
   
   for DFT-D4:
   * E. Caldeweyher, C. Bannwarth and S. Grimme, J. Chem. Phys., 2017,
     147, 034112. DOI: 10.1063/1.4993215
   * E. Caldeweyher, S. Ehlert, A. Hansen, H. Neugebauer, S. Spicher,
     C. Bannwarth and S. Grimme, J. Chem. Phys., 2019, 150, 154122.
     DOI: 10.1063/1.5090222
   
   for sTDA-xTB:
   * S. Grimme and C. Bannwarth, J. Chem. Phys., 2016, 145, 054103.
     DOI: 10.1063/1.4959605
   
   in the mass-spec context:
   * V. Asgeirsson, C. Bauer and S. Grimme, Chem. Sci., 2017, 8, 4879.
     DOI: 10.1039/c7sc00601b
   
   for metadynamics refer to:
   * S. Grimme, J. Chem. Theory Comput., 2019, 155, 2847-2862
     DOI: 10.1021/acs.jctc.9b00143
   
   with help from (in alphabetical order)
   C. Bannwarth, F. Bohle, G. Brandenburg, E. Caldeweyher, M. Checinski,
   S. Dohm, S. Ehlert, S. Ehrlich, F. März, H. Neugebauer, J. Pisarek,
   P. Pracht, P. Shushkov, and S. Spicher.
   
 * started run on 2020/05/12 at 11:44:28.714     

           -------------------------------------------------
          |                Calculation Setup                |
           -------------------------------------------------

          program call               : xtb --input H3C1N1_3_S_2.input H3C1N1_3_S_2.xyz --ohess --molden --namespace H3C1N1_3_S_2 output.out
          calculation namespace      : H3C1N1_3_S_2
          coordinate file            : H3C1N1_3_S_2.xyz
          number of atoms            :                     5
          number of electrons        :                    12
          charge                     :                     0
          spin                       :                   1.0
          first test random number   :      0.17307367421939

   ID    Z sym.   atoms
    1    6 C      1
    2    7 N      2
    3    1 H      3-5

           -------------------------------------------------
          |                 G F N 2 - x T B                 |
           -------------------------------------------------

        Reference                      10.1021/acs.jctc.8b01176
      * Hamiltonian:
        H0-scaling (s, p, d)           1.850000    2.230000    2.230000
        zeta-weighting                 0.500000
      * Dispersion:
        s8                             2.700000
        a1                             0.520000
        a2                             5.000000
        s9                             5.000000
      * Repulsion:
        kExp                           1.500000    1.000000
        rExp                           1.000000
      * Coulomb:
        alpha                          2.000000
        third order                    shell-resolved
        anisotropic                    true
        a3                             3.000000
        a5                             4.000000
        cn-shift                       1.200000
        cn-exp                         4.000000
        max-rad                        5.000000


          ...................................................
          :                      SETUP                      :
          :.................................................:
          :  # basis functions                  11          :
          :  # atomic orbitals                  11          :
          :  # shells                            7          :
          :  # electrons                        12          :
          :  max. iterations                   250          :
          :  Hamiltonian                  GFN2-xTB          :
          :  restarted?                      false          :
          :  GBSA solvation                  false          :
          :  PC potential                    false          :
          :  electronic temp.          300.0000000     K    :
          :  accuracy                    1.0000000          :
          :  -> integral cutoff          0.2500000E+02      :
          :  -> integral neglect         0.1000000E-07      :
          :  -> SCF convergence          0.1000000E-05 Eh   :
          :  -> wf. convergence          0.1000000E-03 e    :
          :  Broyden damping             0.4000000          :
          ...................................................

 iter      E             dE          RMSdq      gap      omega  full diag
   1     -6.2080645 -0.620806E+01  0.633E+00    8.01       0.0  T
   2     -6.3431063 -0.135042E+00  0.346E+00    4.35       1.0  T
   3     -6.3440121 -0.905845E-03  0.233E+00    4.05       1.0  T
   4     -6.3446836 -0.671523E-03  0.326E-01    3.93       1.0  T
   5     -6.3447277 -0.440604E-04  0.166E-01    3.91       1.0  T
   6     -6.3447356 -0.785167E-05  0.317E-02    3.95       1.4  T
   7     -6.3447380 -0.249645E-05  0.993E-03    3.93       4.5  T
   8     -6.3447382 -0.107787E-06  0.378E-03    3.92      11.8  T
   9     -6.3447382 -0.201601E-07  0.947E-05    3.92     472.3  T
  10     -6.3447382 -0.388312E-11  0.439E-05    3.92    1018.8  T

   *** convergence criteria satisfied after 10 iterations ***

         #    Occupation            Energy/Eh            Energy/eV
      -------------------------------------------------------------
         1        2.0000           -0.6629803             -18.0406
         2        2.0000           -0.5754771             -15.6595
         3        2.0000           -0.5754770             -15.6595
         4        2.0000           -0.5735802             -15.6079
         5        2.0000           -0.3592525              -9.7758
         6        1.0000           -0.1926375              -5.2419
         7        1.0000           -0.1926375              -5.2419 (HOMO)
         8                         -0.0484710              -1.3190 (LUMO)
         9                          0.1177215               3.2034
        10                          0.1177222               3.2034
        11                          0.1702742               4.6334
      -------------------------------------------------------------
                  HL-Gap            0.1441665 Eh            3.9230 eV
             Fermi-level           -0.1982496 Eh           -5.3946 eV

 transition dipole moment (au) for excitation:           6           7
     X       Y       Z   
   0.0038   0.0045   0.0396  total (au/Debye):    0.040   0.102
 dE (eV)             :    0.000
 oscillator strength :  0.16586E-10

 SCC (total)                   0 d,  0 h,  0 min,  0.003 sec
 SCC setup                      ...        0 min,  0.000 sec (  4.791%)
 Dispersion                     ...        0 min,  0.000 sec (  0.580%)
 integral evaluation            ...        0 min,  0.001 sec ( 25.574%)
 zeroth order Hamiltonian       ...        0 min,  0.000 sec (  0.901%)
 iterations                     ...        0 min,  0.001 sec ( 37.287%)
 molecular gradient             ...        0 min,  0.000 sec ( 16.798%)
 printout                       ...        0 min,  0.000 sec ( 13.593%)

         :::::::::::::::::::::::::::::::::::::::::::::::::::::
         ::                     SUMMARY                     ::
         :::::::::::::::::::::::::::::::::::::::::::::::::::::
         :: total energy              -6.290848473877 Eh    ::
         :: gradient norm              0.058665688085 Eh/a0 ::
         :: HOMO-LUMO gap              3.922971041435 eV    ::
         ::.................................................::
         :: SCC energy                -6.344738174479 Eh    ::
         :: -> isotropic ES            0.021498634591 Eh    ::
         :: -> anisotropic ES          0.003038319007 Eh    ::
         :: -> anisotropic XC          0.002548952287 Eh    ::
         :: -> dispersion             -0.000994602221 Eh    ::
         :: repulsion energy           0.053889686563 Eh    ::
         :: add. restraining           0.000000000000 Eh    ::
         :::::::::::::::::::::::::::::::::::::::::::::::::::::

      ----------------------------------------------------------- 
     |                   =====================                   |
     |                        A N C O P T                        |
     |                   =====================                   |
     |               Approximate Normal Coordinate               |
     |                Rational Function Optimizer                |
      ----------------------------------------------------------- 

          ...................................................
          :                      SETUP                      :
          :.................................................:
          :   optimization level            normal          :
          :   max. optcycles                   200          :
          :   ANC micro-cycles                  20          :
          :   degrees of freedom                 9          :
          :.................................................:
          :   RF solver                   davidson          :
          :   write xtbopt.log                true          :
          :   linear?                        false          :
          :   energy convergence         0.5000000E-05 Eh   :
          :   grad. convergence          0.1000000E-02 Eh/α :
          :   maximium RF displ.         1.0000000          :
          :   Hlow (freq-cutoff)         0.1000000E-01      :
          :   Hmax (freq-cutoff)         5.0000000          :
          :   S6 in model hess.         20.0000000          :
          ...................................................

generating ANC from model Hessian ...
Using Lindh-Hessian (1995)
 Shifting diagonal of input Hessian by    0.0000000000000000     
 Lowest  eigenvalues of input Hessian
   -0.000000   -0.000000   -0.000000   -0.000000    0.000000    0.000000
    0.125621    0.125621    0.176096    0.176097    0.193386    0.507126
    1.297198    1.297199    1.314603
 Highest eigenvalues
    0.176097    0.193386    0.507126    1.297198    1.297199    1.314603


........................................................................
.............................. CYCLE    1 ..............................
........................................................................
   1     -6.3447382 -0.634474E+01  0.103E-05    3.92       0.0  T
   2     -6.3447382 -0.184741E-12  0.542E-06    3.92    8254.1  T
   3     -6.3447382 -0.621725E-14  0.325E-06    3.92   13746.7  T
     SCC iter.                  ...        0 min,  0.000 sec
     gradient                   ...        0 min,  0.000 sec
 * total energy  :    -6.2908485 Eh     change        0.4526735E-09 Eh
   gradient norm :     0.0586649 Eh/α   predicted     0.0000000E+00 (-100.00%)
   displ. norm   :     0.1569312 α      lambda       -0.6695858E-02
   maximum displ.:     0.1496096 α      in ANC's #5, #9, #6, ...

........................................................................
.............................. CYCLE    2 ..............................
........................................................................
   1     -6.3478699 -0.634787E+01  0.739E-01    4.04       0.0  T
   2     -6.3483673 -0.497354E-03  0.323E-01    4.27       1.0  T
   3     -6.3483892 -0.219028E-04  0.138E-01    4.31       1.0  T
   4     -6.3483926 -0.345535E-05  0.313E-02    4.30       1.4  T
   5     -6.3483931 -0.462886E-06  0.707E-03    4.29       6.3  T
   6     -6.3483931 -0.119508E-07  0.784E-04    4.29      57.0  T
   7     -6.3483931 -0.540599E-10  0.365E-04    4.29     122.4  T
     SCC iter.                  ...        0 min,  0.000 sec
     gradient                   ...        0 min,  0.000 sec
 * total energy  :    -6.2956253 Eh     change       -0.4776805E-02 Eh
   gradient norm :     0.0375490 Eh/α   predicted    -0.3430380E-02 ( -28.19%)
   displ. norm   :     0.1159379 α      lambda       -0.3022600E-02
   maximum displ.:     0.0991765 α      in ANC's #5, #9, #6, ...

........................................................................
.............................. CYCLE    3 ..............................
........................................................................
   1     -6.3500979 -0.635010E+01  0.730E-01    4.17       0.0  T
   2     -6.3506293 -0.531334E-03  0.290E-01    4.36       1.0  T
   3     -6.3506437 -0.144433E-04  0.139E-01    4.39       1.0  T
   4     -6.3506472 -0.346249E-05  0.258E-02    4.38       1.7  T
   5     -6.3506475 -0.294153E-06  0.515E-03    4.38       8.7  T
   6     -6.3506475 -0.517115E-08  0.505E-04    4.38      88.5  T
   7     -6.3506475 -0.947056E-10  0.210E-04    4.38     213.2  T
     SCC iter.                  ...        0 min,  0.000 sec
     gradient                   ...        0 min,  0.000 sec
 * total energy  :    -6.2976366 Eh     change       -0.2011277E-02 Eh
   gradient norm :     0.0243047 Eh/α   predicted    -0.1531614E-02 ( -23.85%)
   displ. norm   :     0.0630946 α      lambda       -0.1200895E-02
   maximum displ.:     0.0499235 α      in ANC's #9, #5, #6, ...

........................................................................
.............................. CYCLE    4 ..............................
........................................................................
   1     -6.3522214 -0.635222E+01  0.546E-01    4.14       0.0  T
   2     -6.3525461 -0.324713E-03  0.204E-01    4.25       1.0  T
   3     -6.3525517 -0.561883E-05  0.107E-01    4.26       1.0  T
   4     -6.3525537 -0.202678E-05  0.172E-02    4.26       2.6  T
   5     -6.3525538 -0.743331E-07  0.397E-03    4.26      11.3  T
   6     -6.3525538 -0.356902E-08  0.152E-04    4.26     293.5  T
   7     -6.3525538 -0.305524E-10  0.742E-05    4.26     602.3  T
     SCC iter.                  ...        0 min,  0.000 sec
     gradient                   ...        0 min,  0.000 sec
 * total energy  :    -6.2984962 Eh     change       -0.8596638E-03 Eh
   gradient norm :     0.0144698 Eh/α   predicted    -0.6028371E-03 ( -29.88%)
   displ. norm   :     0.0542147 α      lambda       -0.7293379E-03
   maximum displ.:     0.0471272 α      in ANC's #9, #6, #5, ...

........................................................................
.............................. CYCLE    5 ..............................
........................................................................
   1     -6.3536807 -0.635368E+01  0.458E-01    3.98       0.0  T
   2     -6.3539107 -0.229999E-03  0.175E-01    4.06       1.0  T
   3     -6.3539140 -0.324918E-05  0.928E-02    4.06       1.0  T
   4     -6.3539154 -0.137704E-05  0.169E-02    4.06       2.7  T
   5     -6.3539154 -0.300119E-07  0.144E-03    4.06      31.0  T
   6     -6.3539154 -0.186419E-08  0.354E-04    4.06     126.3  T
   7     -6.3539154 -0.318989E-10  0.173E-04    4.06     259.2  T
     SCC iter.                  ...        0 min,  0.000 sec
     gradient                   ...        0 min,  0.000 sec
 * total energy  :    -6.2989480 Eh     change       -0.4518294E-03 Eh
   gradient norm :     0.0052824 Eh/α   predicted    -0.3657402E-03 ( -19.05%)
   displ. norm   :     0.0281257 α      lambda       -0.1447526E-03
   maximum displ.:     0.0249153 α      in ANC's #5, #9, #6, ...

........................................................................
.............................. CYCLE    6 ..............................
........................................................................
   1     -6.3540515 -0.635405E+01  0.122E-01    4.03       0.0  T
   2     -6.3540594 -0.788990E-05  0.593E-02    4.03       1.0  T
   3     -6.3540598 -0.468153E-06  0.209E-02    4.03       2.1  T
   4     -6.3540599 -0.426692E-07  0.597E-03    4.03       7.5  T
   5     -6.3540599 -0.748365E-08  0.152E-03    4.03      29.4  T
   6     -6.3540599 -0.614049E-09  0.149E-04    4.03     300.8  T
   7     -6.3540599 -0.157829E-11  0.400E-05    4.03    1117.4  T
     SCC iter.                  ...        0 min,  0.000 sec
     gradient                   ...        0 min,  0.000 sec
 * total energy  :    -6.2990419 Eh     change       -0.9383853E-04 Eh
   gradient norm :     0.0022600 Eh/α   predicted    -0.7243348E-04 ( -22.81%)
   displ. norm   :     0.0171487 α      lambda       -0.3549876E-04
   maximum displ.:     0.0167755 α      in ANC's #5, #6, #9, ...

........................................................................
.............................. CYCLE    7 ..............................
........................................................................
   1     -6.3542704 -0.635427E+01  0.600E-02    4.08       0.0  T
   2     -6.3542730 -0.264956E-05  0.288E-02    4.07       1.6  T
   3     -6.3542732 -0.220974E-06  0.104E-02    4.07       4.3  T
   4     -6.3542732 -0.560021E-08  0.267E-03    4.06      16.7  T
   5     -6.3542732 -0.183652E-08  0.504E-04    4.07      88.7  T
   6     -6.3542732 -0.380531E-10  0.624E-05    4.07     716.3  T
     SCC iter.                  ...        0 min,  0.000 sec
     gradient                   ...        0 min,  0.000 sec
 * total energy  :    -6.2990627 Eh     change       -0.2076392E-04 Eh
   gradient norm :     0.0007788 Eh/α   predicted    -0.1775327E-04 ( -14.50%)
   displ. norm   :     0.0061832 α      lambda       -0.2548022E-05
   maximum displ.:     0.0046688 α      in ANC's #5, #6, #9, ...

........................................................................
.............................. CYCLE    8 ..............................
........................................................................
   1     -6.3545311 -0.635453E+01  0.314E-02    4.10       0.0  T
   2     -6.3545324 -0.132753E-05  0.123E-02    4.10       3.6  T
   3     -6.3545325 -0.420952E-07  0.642E-03    4.10       7.0  T
   4     -6.3545325 -0.585795E-08  0.170E-03    4.10      26.3  T
   5     -6.3545325 -0.110763E-08  0.272E-04    4.10     164.4  T
   6     -6.3545325 -0.602540E-11  0.223E-05    4.10    2006.1  T
     SCC iter.                  ...        0 min,  0.000 sec
     gradient                   ...        0 min,  0.000 sec
 * total energy  :    -6.2990639 Eh     change       -0.1259492E-05 Eh
   gradient norm :     0.0002205 Eh/α   predicted    -0.1273847E-05 (   1.14%)
   displ. norm   :     0.0019595 α      lambda       -0.2567474E-06
   maximum displ.:     0.0018085 α      in ANC's #5, #6, #9, ...

   *** GEOMETRY OPTIMIZATION CONVERGED AFTER 8 ITERATIONS ***

------------------------------------------------------------------------
 total energy gain   :        -0.0082154 Eh       -5.1553 kcal/mol
 total RMSD          :         0.1404422 a0        0.0743 Å
 total power (kW/mol):        -2.6962030 (step)-2057.8101 (real)
------------------------------------------------------------------------

 ANCopt (total)                0 d,  0 h,  0 min,  0.010 sec
 optimizer setup                ...        0 min,  0.000 sec (  0.636%)
 model hessian                  ...        0 min,  0.000 sec (  0.877%)
 ANC generation                 ...        0 min,  0.000 sec (  0.532%)
 coordinate transformation      ...        0 min,  0.000 sec (  0.173%)
 single point calculation       ...        0 min,  0.010 sec ( 91.499%)
 optimization log               ...        0 min,  0.000 sec (  1.659%)
 hessian update                 ...        0 min,  0.000 sec (  0.177%)
 rational function              ...        0 min,  0.000 sec (  1.766%)

================
 final structure:
================
5
 xtb: 6.2.2 (9d81278992624c895f80dd42a50cac0aa55982e2)
C         1.50038056159569   -0.04867994567061   -0.14000246835988
N        -0.12960308106012    0.00420497999805    0.01209319165051
H        -0.37628484769512   -0.19736885313593    0.98063701869790
H        -0.45395404568415    0.93580433086064   -0.24574424931484
H        -0.54053958715630   -0.69396051205215   -0.60698449267369

 Bond Distances (Angstroems)
 ---------------------------
C1-N2=1.6379         N2-C1=1.6379         N2-H3=1.0196         N2-H4=1.0196         N2-H5=1.0196         H3-N2=1.0196         
H4-N2=1.0196         H5-N2=1.0196         
 N  H  Rav=1.0196 sigma=0.0000  Rmin=1.0196  Rmax=1.0196     3
 N  C  Rav=1.6379 sigma=0.0000  Rmin=1.6379  Rmax=1.6379     1

 selected bond angles (degree)
 --------------------
H3-N2-C1=108.82                H4-N2-C1=108.82                H4-N2-H3=110.11                H5-N2-C1=108.82                
H5-N2-H3=110.11                H5-N2-H4=110.11                

 selected dihedral angles (degree)
 ---------------------------------

           -------------------------------------------------
          |                Final Singlepoint                |
           -------------------------------------------------

          ...................................................
          :                      SETUP                      :
          :.................................................:
          :  # basis functions                  11          :
          :  # atomic orbitals                  11          :
          :  # shells                            7          :
          :  # electrons                        12          :
          :  max. iterations                   250          :
          :  Hamiltonian                  GFN2-xTB          :
          :  restarted?                      false          :
          :  GBSA solvation                  false          :
          :  PC potential                    false          :
          :  electronic temp.          300.0000000     K    :
          :  accuracy                    1.0000000          :
          :  -> integral cutoff          0.2500000E+02      :
          :  -> integral neglect         0.1000000E-07      :
          :  -> SCF convergence          0.1000000E-05 Eh   :
          :  -> wf. convergence          0.1000000E-03 e    :
          :  Broyden damping             0.4000000          :
          ...................................................

 iter      E             dE          RMSdq      gap      omega  full diag
   1     -6.3545325 -0.635453E+01  0.173E-06    4.10       0.0  T
   2     -6.3545325 -0.444089E-14  0.995E-07    4.10   44961.4  T
   3     -6.3545325 -0.888178E-15  0.569E-07    4.10   78618.2  T

   *** convergence criteria satisfied after 3 iterations ***

         #    Occupation            Energy/Eh            Energy/eV
      -------------------------------------------------------------
         1        2.0000           -0.6605077             -17.9733
         2        2.0000           -0.5719236             -15.5628
         3        2.0000           -0.5719236             -15.5628
         4        2.0000           -0.5613403             -15.2748
         5        2.0000           -0.4063816             -11.0582
         6        1.0000           -0.2177735              -5.9259
         7        1.0000           -0.2177735              -5.9259 (HOMO)
         8                         -0.0672721              -1.8306 (LUMO)
         9                          0.0249146               0.6780
        10                          0.1542955               4.1986
        11                          0.1542955               4.1986
      -------------------------------------------------------------
                  HL-Gap            0.1505014 Eh            4.0954 eV
             Fermi-level           -0.2273001 Eh           -6.1852 eV

 transition dipole moment (au) for excitation:           6           7
     X       Y       Z   
  -0.0013  -0.0008  -0.0132  total (au/Debye):    0.013   0.034
 dE (eV)             :    0.000
 oscillator strength :  0.41347E-13

 SCC (total)                   0 d,  0 h,  0 min,  0.002 sec
 SCC setup                      ...        0 min,  0.000 sec (  2.396%)
 Dispersion                     ...        0 min,  0.000 sec (  0.384%)
 integral evaluation            ...        0 min,  0.000 sec ( 24.874%)
 zeroth order Hamiltonian       ...        0 min,  0.000 sec (  1.072%)
 iterations                     ...        0 min,  0.000 sec ( 25.589%)
 molecular gradient             ...        0 min,  0.000 sec ( 22.584%)
 printout                       ...        0 min,  0.000 sec ( 22.544%)

         :::::::::::::::::::::::::::::::::::::::::::::::::::::
         ::                     SUMMARY                     ::
         :::::::::::::::::::::::::::::::::::::::::::::::::::::
         :: total energy              -6.299063909966 Eh    ::
         :: gradient norm              0.000220476968 Eh/a0 ::
         :: HOMO-LUMO gap              4.095351642766 eV    ::
         ::.................................................::
         :: SCC energy                -6.354532481584 Eh    ::
         :: -> isotropic ES            0.003957627727 Eh    ::
         :: -> anisotropic ES          0.003399882143 Eh    ::
         :: -> anisotropic XC          0.003272998141 Eh    ::
         :: -> dispersion             -0.000977785938 Eh    ::
         :: repulsion energy           0.055468553487 Eh    ::
         :: add. restraining           0.000000000000 Eh    ::
         :::::::::::::::::::::::::::::::::::::::::::::::::::::

           ------------------------------------------------- 
          |                Numerical Hessian                |
           ------------------------------------------------- 
step length          :   0.00500
SCC accuracy         :   0.30000
Hessian scale factor :   1.00000
frozen atoms in %    :   0.00000    0
RMS gradient         :   0.00022
estimated CPU  time      0.00 min
estimated wall time      0.00 min

writing file <hessian>.

 projected vibrational frequencies (cm-1)
eigval :       -0.00    -0.00    -0.00     0.00     0.00     0.00
eigval :      613.18   663.72   663.87  1150.39  1469.28  1469.36
eigval :     3297.46  3303.58  3303.78
           -------------------------------------------------
          |                Property Printout                |
           -------------------------------------------------

    * Orbital Energies and Occupations

         #    Occupation            Energy/Eh            Energy/eV
      -------------------------------------------------------------
         1        2.0000           -0.6605077             -17.9733
         2        2.0000           -0.5719236             -15.5628
         3        2.0000           -0.5719236             -15.5628
         4        2.0000           -0.5613403             -15.2748
         5        2.0000           -0.4063816             -11.0582
         6        1.0000           -0.2177735              -5.9259
         7        1.0000           -0.2177735              -5.9259 (HOMO)
         8                         -0.0672721              -1.8306 (LUMO)
         9                          0.0249146               0.6780
        10                          0.1542955               4.1986
        11                          0.1542955               4.1986
      -------------------------------------------------------------
                  HL-Gap            0.1505014 Eh            4.0954 eV
             Fermi-level           -0.2273001 Eh           -6.1852 eV

     #   Z        covCN         q      C6AA      α(0)
     1   6 C      0.868    -0.440    51.786    12.016
     2   7 N      3.447    -0.152    24.270     7.317
     3   1 H      0.860     0.197     1.120     1.658
     4   1 H      0.860     0.197     1.120     1.658
     5   1 H      0.860     0.197     1.120     1.658
Molecule has the following symmetry elements: (C3) 3*(sigma) 
It seems to be the C3v point group

 Mol. C6AA /au·bohr⁶  :        233.201204
 Mol. C8AA /au·bohr⁸  :       5293.028134
 Mol. α(0) /au        :         24.305234


Wiberg/Mayer (AO) data.
largest (>0.10) Wiberg bond orders for each atom
          total WBO             WBO to atom ...
     1  C   0.736        N    2 0.727
     2  N   3.568        H    4 0.947    H    3 0.947    H    5 0.947    C    1 0.727
     3  H   0.952        N    2 0.947
     4  H   0.952        N    2 0.947
     5  H   0.952        N    2 0.947

MOs/occ written to file <molden.input>


molecular dipole:
                 x           y           z       tot (Debye)
 q only:       -1.723       0.056       0.161
   full:       -2.307       0.075       0.215       5.891
molecular quadrupole (traceless):
                xx          xy          yy          xz          yz          zz
 q only:       -4.063       0.199       2.055       0.572      -0.019       2.008
  q+dip:       -6.390       0.313       3.232       0.899      -0.029       3.158
   full:       -6.214       0.304       3.143       0.874      -0.028       3.071

           -------------------------------------------------
          |                Geometry Summary                 |
           -------------------------------------------------

      molecular mass/u    :       29.0412614
   center of mass at/Å    :        0.5104355      -0.0165639      -0.0476313
  moments of inertia/u·Å² :        0.2816312E+01   0.2194456E+02   0.2194456E+02
rotational constants/cm⁻¹ :        0.5985711E+01   0.7681919E+00   0.7681919E+00

 * 3 selected distances

     #   Z        #   Z                                     value/Å
     2   7 N      3   1 H                                 1.0195887 (max)
     2   7 N      4   1 H                                 1.0195887 (min)
     2   7 N      5   1 H                                 1.0195887

 * 1 distinct bonds (by element types)

   Z      Z             #   av. dist./Å        max./Å        min./Å
   1 H    7 N           3     1.0195887     1.0195887     1.0195887

           -------------------------------------------------
          |               Frequency Printout                |
           -------------------------------------------------
 projected vibrational frequencies (cm-1)
eigval :       -0.00    -0.00    -0.00     0.00     0.00     0.00
eigval :      613.18   663.72   663.87  1150.39  1469.28  1469.36
eigval :     3297.46  3303.58  3303.78
 reduced masses (amu)
   1:  6.83   2: 11.39   3: 11.71   4: 11.25   5:  5.52   6: 10.59   7: 12.76   8:  2.87
   9:  2.87  10:  2.31  11:  1.86  12:  1.86  13:  1.14  14:  2.09  15:  2.09
 IR intensities (amu)
   1:  0.20   2:  0.52   3:  0.55   4:  0.19   5:  0.15   6:  0.29   7:  1.06   8:  0.12
   9:  0.12  10:  0.47  11:  0.23  12:  0.23  13:  0.07  14:  0.10  15:  0.10
 Raman intensities (amu)
   1:  0.00   2:  0.00   3:  0.00   4:  0.00   5:  0.00   6:  0.00   7:  0.00   8:  0.00
   9:  0.00  10:  0.00  11:  0.00  12:  0.00  13:  0.00  14:  0.00  15:  0.00
 output can be read by thermo (or use thermo option).
 writing <g98.out> molden fake output.
 recommended (thermochemical) frequency scaling factor: 1.0
           -------------------------------------------------
          |             Thermodynamic Functions             |
           -------------------------------------------------

c3v symmetry found (for desy threshold:  0.10E+00) used in thermo

          ...................................................
          :                      SETUP                      :
          :.................................................:
          :  # frequencies                           9      :
          :  # imaginary freq.                       0      :
          :  linear?                             false      :
          :  only rotor calc.                    false      :
          :  symmetry                              c3v      :
          :  rotational number                       3      :
          :  scaling factor                  1.0000000      :
          :  rotor cutoff                   50.0000000 cm⁻¹ :
          :  imag. cutoff                  -20.0000000 cm⁻¹ :
          :.................................................:

    mode    ω/cm⁻¹     T·S(HO)/kcal·mol⁻¹    T·S(FR)/kcal·mol⁻¹   T·S(vib)
   ------------------------------------------------------------------------
   ------------------------------------------------------------------------

   temp. (K)  partition function   enthalpy   heat capacity  entropy
                                   cal/mol     cal/K/mol   cal/K/mol   J/K/mol
 298.15  VIB   1.15                  276.498      3.211      1.209
         ROT   938.                  888.752      2.981     16.581
         INT  0.108E+04             1165.251      6.192     17.790
         TR   0.151E+27             1481.254      4.968     36.016
         TOT                        2646.5047    11.1598    53.8059   225.1240

   temp. (K)  partition function   enthalpy   heat capacity  entropy
                                   cal/mol     cal/K/mol   cal/K/mol   J/K/mol
 120.00  VIB   1.00                    2.456      0.157      0.023
         ROT   239.                  357.707      2.981     13.868
         INT   240.                  360.163      3.138     13.891
         TR   0.387E+26              596.178      4.968     31.497
         TOT                         956.3410     8.1065    45.3876   189.9018

   temp. (K)  partition function   enthalpy   heat capacity  entropy
                                   cal/mol     cal/K/mol   cal/K/mol   J/K/mol
 100.00  VIB   1.00                    0.529      0.049      0.006
         ROT   182.                  298.089      2.981     13.324
         INT   182.                  298.618      3.030     13.330
         TR   0.294E+26              496.815      4.968     30.591
         TOT                         795.4329     7.9977    43.9215   183.7675

   temp. (K)  partition function   enthalpy   heat capacity  entropy
                                   cal/mol     cal/K/mol   cal/K/mol   J/K/mol
  80.00  VIB   1.00                    0.053      0.008      0.001
         ROT   130.                  238.471      2.981     12.659
         INT   130.                  238.524      2.989     12.660
         TR   0.210E+26              397.452      4.968     29.483
         TOT                         635.9765     7.9567    42.1431   176.3267

   temp. (K)  partition function   enthalpy   heat capacity  entropy
                                   cal/mol     cal/K/mol   cal/K/mol   J/K/mol
  60.00  VIB   1.00                    0.001      0.000     -0.000
         ROT   84.7                  178.853      2.981     11.802
         INT   84.7                  178.855      2.981     11.801
         TR   0.137E+26              298.089      4.968     28.055
         TOT                         476.9436     7.9493    39.8563   166.7586

   temp. (K)  partition function   enthalpy   heat capacity  entropy
                                   cal/mol     cal/K/mol   cal/K/mol   J/K/mol
  40.00  VIB   1.00                    0.000      0.000     -0.000
         ROT   46.1                  119.236      2.981     10.593
         INT   46.1                  119.236      2.981     10.593
         TR   0.744E+25              198.726      4.968     26.041
         TOT                         317.9616     7.9490    36.6341   153.2771

   temp. (K)  partition function   enthalpy   heat capacity  entropy
                                   cal/mol     cal/K/mol   cal/K/mol   J/K/mol
  20.00  VIB   1.00                    0.000      0.000     -0.000
         ROT   16.3                   59.618      2.981      8.527
         INT   16.3                   59.618      2.981      8.527
         TR   0.263E+25               99.363      4.968     22.599
         TOT                         158.9808     7.9490    31.1259   130.2306

   temp. (K)  partition function   enthalpy   heat capacity  entropy
                                   cal/mol     cal/K/mol   cal/K/mol   J/K/mol
  10.00  VIB   1.00                    0.000      0.000     -0.000
         ROT   5.76                   29.809      2.981      6.461
         INT   5.76                   29.809      2.981      6.460
         TR   0.930E+24               49.681      4.968     19.157
         TOT                          79.4904     7.9490    25.6176   107.1841

       T/K    H(0)-H(T)+PV         H(T)/Eh          T*S/Eh         G(T)/Eh
   ------------------------------------------------------------------------
    298.15    0.421747E-02    0.405192E-01    0.255649E-01    0.149543E-01
    120.00    0.152403E-02    0.378257E-01    0.867957E-02    0.291462E-01
    100.00    0.126760E-02    0.375693E-01    0.699933E-02    0.305700E-01
     80.00    0.101349E-02    0.373152E-01    0.537274E-02    0.319425E-01
     60.00    0.760058E-03    0.370618E-01    0.381090E-02    0.332509E-01
     40.00    0.506704E-03    0.368084E-01    0.233521E-02    0.344732E-01
     20.00    0.253352E-03    0.365551E-01    0.992044E-03    0.355630E-01
     10.00    0.126676E-03    0.364284E-01    0.408243E-03    0.360202E-01 (used)
   ------------------------------------------------------------------------

         :::::::::::::::::::::::::::::::::::::::::::::::::::::
         ::                  THERMODYNAMIC                  ::
         :::::::::::::::::::::::::::::::::::::::::::::::::::::
         :: total free energy          -6.263043755730 Eh   ::
         ::.................................................::
         :: total energy               -6.299063909966 Eh   ::
         :: zero point energy           0.036301720783 Eh   ::
         :: G(RRHO) w/o ZPVE           -0.000281566546 Eh   ::
         :: G(RRHO) contrib.            0.036020154236 Eh   ::
         :::::::::::::::::::::::::::::::::::::::::::::::::::::

optimized geometry written to: xtbopt.xyz


           -------------------------------------------------
          | TOTAL ENERGY               -6.299063909966 Eh   |
          | TOTAL ENTHALPY             -6.262635513168 Eh   |
          | TOTAL FREE ENERGY          -6.263043755730 Eh   |
          | GRADIENT NORM               0.000220475179 Eh/α |
          | HOMO-LUMO GAP               4.095351682629 eV   |
           -------------------------------------------------

------------------------------------------------------------------------
 * finished run on 2020/05/12 at 11:44:28.781     
------------------------------------------------------------------------
 total:
 * wall-time:     0 d,  0 h,  0 min,  0.066 sec
 *  cpu-time:     0 d,  0 h,  0 min,  0.066 sec
 * ratio c/w:     0.999 speedup
 SCF:
 * wall-time:     0 d,  0 h,  0 min,  0.003 sec
 *  cpu-time:     0 d,  0 h,  0 min,  0.003 sec
 * ratio c/w:     1.000 speedup
 ANC optimizer:
 * wall-time:     0 d,  0 h,  0 min,  0.013 sec
 *  cpu-time:     0 d,  0 h,  0 min,  0.013 sec
 * ratio c/w:     0.999 speedup
 numerical hessian:
 * wall-time:     0 d,  0 h,  0 min,  0.033 sec
 *  cpu-time:     0 d,  0 h,  0 min,  0.033 sec
 * ratio c/w:     0.999 speedup

