      -----------------------------------------------------------      
     |                   =====================                   |     
     |                           x T B                           |     
     |                   =====================                   |     
     |                         S. Grimme                         |     
     |          Mulliken Center for Theoretical Chemistry        |     
     |                    University of Bonn                     |     
      -----------------------------------------------------------      

   * xtb version 6.2.2 (9d81278992624c895f80dd42a50cac0aa55982e2) compiled by '@Darwin' on 04/03/2020

   xtb is free software: you can redistribute it and/or modify it under
   the terms of the GNU Lesser General Public License as published by
   the Free Software Foundation, either version 3 of the License, or
   (at your option) any later version.
   
   xtb is distributed in the hope that it will be useful,
   but WITHOUT ANY WARRANTY; without even the implied warranty of
   MERCHANTABILITY or FITNESS FOR A PARTICULAR PURPOSE.  See the
   GNU Lesser General Public License for more details.
   
   Cite this work as:
   * S. Grimme, C. Bannwarth, P. Shushkov, J. Chem. Theory Comput., 2017,
     13, 1989-2009. DOI: 10.1021/acs.jctc.7b00118
   * C. Bannwarth, S. Ehlert and S. Grimme., J. Chem. Theory Comput., 2019,
     15, 1652-1671. DOI: 10.1021/acs.jctc.8b01176
   * P. Pracht, E. Caldeweyher, S. Ehlert, S. Grimme, ChemRxiv, 2019, preprint.
     DOI: 10.26434/chemrxiv.8326202.v1
   
   for DFT-D4:
   * E. Caldeweyher, C. Bannwarth and S. Grimme, J. Chem. Phys., 2017,
     147, 034112. DOI: 10.1063/1.4993215
   * E. Caldeweyher, S. Ehlert, A. Hansen, H. Neugebauer, S. Spicher,
     C. Bannwarth and S. Grimme, J. Chem. Phys., 2019, 150, 154122.
     DOI: 10.1063/1.5090222
   
   for sTDA-xTB:
   * S. Grimme and C. Bannwarth, J. Chem. Phys., 2016, 145, 054103.
     DOI: 10.1063/1.4959605
   
   in the mass-spec context:
   * V. Asgeirsson, C. Bauer and S. Grimme, Chem. Sci., 2017, 8, 4879.
     DOI: 10.1039/c7sc00601b
   
   for metadynamics refer to:
   * S. Grimme, J. Chem. Theory Comput., 2019, 155, 2847-2862
     DOI: 10.1021/acs.jctc.9b00143
   
   with help from (in alphabetical order)
   C. Bannwarth, F. Bohle, G. Brandenburg, E. Caldeweyher, M. Checinski,
   S. Dohm, S. Ehlert, S. Ehrlich, F. März, H. Neugebauer, J. Pisarek,
   P. Pracht, P. Shushkov, and S. Spicher.
   
 * started run on 2020/05/12 at 11:44:47.446     

           -------------------------------------------------
          |                Calculation Setup                |
           -------------------------------------------------

          program call               : xtb --input H2C2N1_8_S_3.input H2C2N1_8_S_3.xyz --ohess --molden --namespace H2C2N1_8_S_3 output.out
          calculation namespace      : H2C2N1_8_S_3
          coordinate file            : H2C2N1_8_S_3.xyz
          number of atoms            :                     5
          number of electrons        :                    15
          charge                     :                     0
          spin                       :                   1.5
          first test random number   :      0.40510143453982

   ID    Z sym.   atoms
    1    7 N      1
    2    6 C      2, 3
    3    1 H      4, 5

           -------------------------------------------------
          |                 G F N 2 - x T B                 |
           -------------------------------------------------

        Reference                      10.1021/acs.jctc.8b01176
      * Hamiltonian:
        H0-scaling (s, p, d)           1.850000    2.230000    2.230000
        zeta-weighting                 0.500000
      * Dispersion:
        s8                             2.700000
        a1                             0.520000
        a2                             5.000000
        s9                             5.000000
      * Repulsion:
        kExp                           1.500000    1.000000
        rExp                           1.000000
      * Coulomb:
        alpha                          2.000000
        third order                    shell-resolved
        anisotropic                    true
        a3                             3.000000
        a5                             4.000000
        cn-shift                       1.200000
        cn-exp                         4.000000
        max-rad                        5.000000


          ...................................................
          :                      SETUP                      :
          :.................................................:
          :  # basis functions                  14          :
          :  # atomic orbitals                  14          :
          :  # shells                            8          :
          :  # electrons                        15          :
          :  max. iterations                   250          :
          :  Hamiltonian                  GFN2-xTB          :
          :  restarted?                      false          :
          :  GBSA solvation                  false          :
          :  PC potential                    false          :
          :  electronic temp.          300.0000000     K    :
          :  accuracy                    1.0000000          :
          :  -> integral cutoff          0.2500000E+02      :
          :  -> integral neglect         0.1000000E-07      :
          :  -> SCF convergence          0.1000000E-05 Eh   :
          :  -> wf. convergence          0.1000000E-03 e    :
          :  Broyden damping             0.4000000          :
          ...................................................

 iter      E             dE          RMSdq      gap      omega  full diag
   1     -7.8429375 -0.784294E+01  0.653E+00    1.21       0.0  T
   2     -7.7904745  0.524631E-01  0.535E+00    0.61       1.0  T
   3     -7.8078905 -0.174161E-01  0.390E+00    1.17       1.0  T
   4     -7.8202139 -0.123234E-01  0.332E+00    0.68       1.0  T
   5     -7.8949260 -0.747122E-01  0.934E-01    0.77       1.0  T
   6     -7.8965169 -0.159086E-02  0.491E-01    0.76       1.0  T
   7     -7.8954749  0.104199E-02  0.379E-01    0.73       1.0  T
   8     -7.8966283 -0.115337E-02  0.978E-02    0.76       1.0  T
   9     -7.8966445 -0.162524E-04  0.713E-02    0.76       1.0  T
  10     -7.8966760 -0.314386E-04  0.176E-02    0.75       2.5  T
  11     -7.8966779 -0.196200E-05  0.328E-03    0.75      13.6  T
  12     -7.8966780 -0.439923E-07  0.509E-04    0.75      87.9  T
  13     -7.8966780 -0.391093E-09  0.152E-04    0.75     294.5  T

   *** convergence criteria satisfied after 13 iterations ***

         #    Occupation            Energy/Eh            Energy/eV
      -------------------------------------------------------------
         1        2.0000           -0.6574811             -17.8910
       ...           ...                  ...                  ...
         3        2.0000           -0.5552574             -15.1093
         4        2.0000           -0.5220717             -14.2063
         5        2.0000           -0.5030921             -13.6898
         6        2.0000           -0.4630385             -12.5999
         7        1.0000           -0.4349003             -11.8342
         8        1.0000           -0.3624897              -9.8638
         9        1.0000           -0.3278703              -8.9218 (HOMO)
        10        0.0000           -0.3002003              -8.1689 (LUMO)
        11                          0.0492829               1.3411
        12                          0.0903136               2.4576
        13                          0.1214990               3.3062
        14                          0.1651249               4.4933
      -------------------------------------------------------------
                  HL-Gap            0.0276700 Eh            0.7529 eV
             Fermi-level           -0.3815024 Eh          -10.3812 eV

 SCC (total)                   0 d,  0 h,  0 min,  0.003 sec
 SCC setup                      ...        0 min,  0.000 sec (  3.193%)
 Dispersion                     ...        0 min,  0.000 sec (  0.500%)
 integral evaluation            ...        0 min,  0.001 sec ( 26.098%)
 zeroth order Hamiltonian       ...        0 min,  0.000 sec (  0.609%)
 iterations                     ...        0 min,  0.001 sec ( 40.644%)
 molecular gradient             ...        0 min,  0.001 sec ( 26.635%)
 printout                       ...        0 min,  0.000 sec (  1.983%)

         :::::::::::::::::::::::::::::::::::::::::::::::::::::
         ::                     SUMMARY                     ::
         :::::::::::::::::::::::::::::::::::::::::::::::::::::
         :: total energy              -7.845697400822 Eh    ::
         :: gradient norm              0.191442642351 Eh/a0 ::
         :: HOMO-LUMO gap              0.752938677846 eV    ::
         ::.................................................::
         :: SCC energy                -7.896677967003 Eh    ::
         :: -> isotropic ES           -0.007592789202 Eh    ::
         :: -> anisotropic ES          0.000647471383 Eh    ::
         :: -> anisotropic XC          0.008945721941 Eh    ::
         :: -> dispersion             -0.001544718322 Eh    ::
         :: repulsion energy           0.050980546127 Eh    ::
         :: add. restraining           0.000000000000 Eh    ::
         :::::::::::::::::::::::::::::::::::::::::::::::::::::

      ----------------------------------------------------------- 
     |                   =====================                   |
     |                        A N C O P T                        |
     |                   =====================                   |
     |               Approximate Normal Coordinate               |
     |                Rational Function Optimizer                |
      ----------------------------------------------------------- 

          ...................................................
          :                      SETUP                      :
          :.................................................:
          :   optimization level            normal          :
          :   max. optcycles                   200          :
          :   ANC micro-cycles                  20          :
          :   degrees of freedom                 9          :
          :.................................................:
          :   RF solver                   davidson          :
          :   write xtbopt.log                true          :
          :   linear?                        false          :
          :   energy convergence         0.5000000E-05 Eh   :
          :   grad. convergence          0.1000000E-02 Eh/α :
          :   maximium RF displ.         1.0000000          :
          :   Hlow (freq-cutoff)         0.1000000E-01      :
          :   Hmax (freq-cutoff)         5.0000000          :
          :   S6 in model hess.         20.0000000          :
          ...................................................

generating ANC from model Hessian ...
Using Lindh-Hessian (1995)
 Shifting diagonal of input Hessian by    0.0000000000000000     
 Lowest  eigenvalues of input Hessian
   -0.000000   -0.000000   -0.000000   -0.000000    0.000000    0.000000
    0.012996    0.053863    0.092126    0.095806    0.131148    0.607654
    0.951975    1.001747    1.208096
 Highest eigenvalues
    0.095806    0.131148    0.607654    0.951975    1.001747    1.208096


........................................................................
.............................. CYCLE    1 ..............................
........................................................................
   1     -7.8966780 -0.789668E+01  0.811E-05    0.75       0.0  T
   2     -7.8966780  0.179671E-09  0.172E-04    0.75     260.6  T
   3     -7.8966780 -0.215943E-09  0.315E-05    0.75    1418.4  T
     SCC iter.                  ...        0 min,  0.000 sec
     gradient                   ...        0 min,  0.001 sec
 * total energy  :    -7.8456974 Eh     change        0.2480416E-10 Eh
   gradient norm :     0.1914430 Eh/α   predicted     0.0000000E+00 (-100.00%)
   displ. norm   :     0.3760902 α      lambda       -0.4925637E-01
   maximum displ.:     0.2217089 α      in ANC's #1, #3, #6, ...

........................................................................
.............................. CYCLE    2 ..............................
........................................................................
   1     -7.9521962 -0.795220E+01  0.222E+00    1.26       0.0  T
   2     -7.9421940  0.100022E-01  0.180E+00    1.05       1.0  T
   3     -7.9401605  0.203350E-02  0.165E+00    1.33       1.0  T
   4     -7.9558124 -0.156519E-01  0.309E-01    1.17       1.0  T
   5     -7.9563810 -0.568561E-03  0.152E-01    1.19       1.0  T
   6     -7.9563489  0.321284E-04  0.894E-02    1.19       1.0  T
   7     -7.9564071 -0.582465E-04  0.146E-02    1.19       3.1  T
   8     -7.9564076 -0.509928E-06  0.276E-03    1.19      16.2  T
   9     -7.9564076 -0.565885E-08  0.930E-04    1.19      48.1  T
  10     -7.9564076 -0.283130E-08  0.200E-04    1.19     223.4  T
     SCC iter.                  ...        0 min,  0.001 sec
     gradient                   ...        0 min,  0.001 sec
 * total energy  :    -7.8850639 Eh     change       -0.3936649E-01 Eh
   gradient norm :     0.1241099 Eh/α   predicted    -0.2811168E-01 ( -28.59%)
   displ. norm   :     0.4454202 α      lambda       -0.4797152E-01
   maximum displ.:     0.2535797 α      in ANC's #7, #6, #3, ...

........................................................................
.............................. CYCLE    3 ..............................
........................................................................
   1     -8.0365668 -0.803657E+01  0.238E+00    1.92       0.0  T
   2     -8.0370698 -0.503010E-03  0.151E+00    1.78       1.0  T
   3     -8.0328579  0.421191E-02  0.117E+00    1.91       1.0  T
   4     -8.0392394 -0.638156E-02  0.216E-01    1.79       1.0  T
   5     -8.0394829 -0.243485E-03  0.113E-01    1.81       1.0  T
   6     -8.0394982 -0.152941E-04  0.240E-02    1.81       1.9  T
   7     -8.0394998 -0.157476E-05  0.563E-03    1.81       7.9  T
   8     -8.0394998 -0.175416E-07  0.985E-04    1.81      45.4  T
   9     -8.0394998 -0.995062E-09  0.190E-04    1.81     235.2  T
     SCC iter.                  ...        0 min,  0.001 sec
     gradient                   ...        0 min,  0.001 sec
 * total energy  :    -7.8833624 Eh     change        0.1701482E-02 Eh
   gradient norm :     0.2631566 Eh/α   predicted    -0.2874452E-01 (*******%)
   displ. norm   :     0.3520487 α      lambda       -0.5446528E-01
   maximum displ.:     0.2457581 α      in ANC's #1, #2, #3, ...

........................................................................
.............................. CYCLE    4 ..............................
........................................................................
   1     -8.0012713 -0.800127E+01  0.150E+00    1.62       0.0  T
   2     -8.0021149 -0.843613E-03  0.927E-01    1.65       1.0  T
   3     -8.0021307 -0.158106E-04  0.370E-01    1.65       1.0  T
   4     -8.0023178 -0.187086E-03  0.868E-02    1.66       1.0  T
   5     -8.0022959  0.219440E-04  0.596E-02    1.67       1.0  T
   6     -8.0023167 -0.208228E-04  0.363E-02    1.66       1.2  T
   7     -8.0023232 -0.647309E-05  0.738E-03    1.66       6.1  T
   8     -8.0023234 -0.232039E-06  0.305E-03    1.66      14.7  T
   9     -8.0023235 -0.487041E-07  0.176E-04    1.66     254.8  T
  10     -8.0023235  0.141647E-10  0.989E-05    1.66     452.4  T
     SCC iter.                  ...        0 min,  0.001 sec
     gradient                   ...        0 min,  0.001 sec
 * total energy  :    -7.9069771 Eh     change       -0.2361466E-01 Eh
   gradient norm :     0.0427225 Eh/α   predicted    -0.3060780E-01 (  29.61%)
   displ. norm   :     0.2799203 α      lambda       -0.4061724E-02
   maximum displ.:     0.2590562 α      in ANC's #1, #6, #7, ...

........................................................................
.............................. CYCLE    5 ..............................
........................................................................
   1     -8.0033614 -0.800336E+01  0.112E+00    1.78       0.0  T
   2     -8.0028389  0.522460E-03  0.700E-01    1.70       1.0  T
   3     -7.9989252  0.391372E-02  0.816E-01    1.87       1.0  T
   4     -8.0037536 -0.482838E-02  0.772E-02    1.74       1.0  T
   5     -8.0037837 -0.301737E-04  0.301E-02    1.75       1.5  T
   6     -8.0037864 -0.266868E-05  0.511E-03    1.75       8.8  T
   7     -8.0037866 -0.200301E-06  0.254E-03    1.75      17.6  T
   8     -8.0037866 -0.181893E-07  0.586E-04    1.75      76.3  T
   9     -8.0037866 -0.620133E-09  0.557E-05    1.75     802.2  T
     SCC iter.                  ...        0 min,  0.001 sec
     gradient                   ...        0 min,  0.001 sec
 * total energy  :    -7.9082477 Eh     change       -0.1270617E-02 Eh
   gradient norm :     0.0483678 Eh/α   predicted    -0.2189988E-02 (  72.36%)
   displ. norm   :     0.1348071 α      lambda       -0.4066864E-02
   maximum displ.:     0.1128002 α      in ANC's #1, #6, #7, ...

........................................................................
.............................. CYCLE    6 ..............................
........................................................................
   1     -8.0194900 -0.801949E+01  0.694E-01    1.93       0.0  T
   2     -8.0189814  0.508567E-03  0.504E-01    1.84       1.0  T
   3     -8.0188388  0.142557E-03  0.445E-01    1.94       1.0  T
   4     -8.0198792 -0.104038E-02  0.376E-02    1.88       1.2  T
   5     -8.0198813 -0.208484E-05  0.261E-02    1.88       1.7  T
   6     -8.0198826 -0.124050E-05  0.660E-03    1.88       6.8  T
   7     -8.0198827 -0.175518E-06  0.162E-03    1.88      27.6  T
   8     -8.0198827 -0.136114E-08  0.179E-04    1.88     249.4  T
   9     -8.0198827 -0.495568E-10  0.410E-05    1.88    1091.1  T
     SCC iter.                  ...        0 min,  0.001 sec
     gradient                   ...        0 min,  0.001 sec
 * total energy  :    -7.9098060 Eh     change       -0.1558294E-02 Eh
   gradient norm :     0.0169347 Eh/α   predicted    -0.2070387E-02 (  32.86%)
   displ. norm   :     0.0927082 α      lambda       -0.9742904E-03
   maximum displ.:     0.0675953 α      in ANC's #3, #4, #1, ...

........................................................................
.............................. CYCLE    7 ..............................
........................................................................
   1     -8.0129864 -0.801299E+01  0.328E-01    1.81       0.0  T
   2     -8.0126606  0.325809E-03  0.302E-01    1.87       1.0  T
   3     -8.0131087 -0.448141E-03  0.165E-01    1.82       1.0  T
   4     -8.0132026 -0.939214E-04  0.188E-02    1.84       2.4  T
   5     -8.0132034 -0.745530E-06  0.860E-03    1.84       5.2  T
   6     -8.0132034 -0.257590E-07  0.269E-03    1.84      16.6  T
   7     -8.0132034 -0.184458E-07  0.411E-04    1.84     108.8  T
   8     -8.0132034 -0.672173E-10  0.189E-04    1.84     236.1  T
     SCC iter.                  ...        0 min,  0.001 sec
     gradient                   ...        0 min,  0.001 sec
 * total energy  :    -7.9099347 Eh     change       -0.1287026E-03 Eh
   gradient norm :     0.0122556 Eh/α   predicted    -0.4913321E-03 ( 281.76%)
   displ. norm   :     0.0501205 α      lambda       -0.3753174E-03
   maximum displ.:     0.0302075 α      in ANC's #3, #1, #4, ...

........................................................................
.............................. CYCLE    8 ..............................
........................................................................
   1     -8.0153414 -0.801534E+01  0.142E-01    1.85       0.0  T
   2     -8.0153157  0.257604E-04  0.108E-01    1.83       1.0  T
   3     -8.0153223 -0.659897E-05  0.862E-02    1.85       1.0  T
   4     -8.0153607 -0.384321E-04  0.910E-03    1.84       4.9  T
   5     -8.0153608 -0.120937E-06  0.272E-03    1.84      16.5  T
   6     -8.0153608 -0.271713E-08  0.181E-03    1.84      24.7  T
   7     -8.0153608 -0.908833E-08  0.228E-04    1.84     196.1  T
   8     -8.0153608  0.207621E-10  0.127E-04    1.84     352.3  T
     SCC iter.                  ...        0 min,  0.001 sec
     gradient                   ...        0 min,  0.001 sec
 * total energy  :    -7.9101151 Eh     change       -0.1804471E-03 Eh
   gradient norm :     0.0018807 Eh/α   predicted    -0.1881301E-03 (   4.26%)
   displ. norm   :     0.0151930 α      lambda       -0.1180848E-04
   maximum displ.:     0.0133468 α      in ANC's #2, #5, #3, ...

........................................................................
.............................. CYCLE    9 ..............................
........................................................................
   1     -8.0160993 -0.801610E+01  0.486E-02    1.86       0.0  T
   2     -8.0160960  0.328458E-05  0.391E-02    1.85       1.1  T
   3     -8.0160998 -0.379103E-05  0.257E-02    1.86       1.7  T
   4     -8.0161024 -0.263304E-05  0.714E-03    1.85       6.3  T
   5     -8.0161027 -0.292393E-06  0.146E-03    1.85      30.6  T
   6     -8.0161027 -0.429782E-09  0.374E-04    1.85     119.7  T
   7     -8.0161027 -0.236561E-09  0.104E-04    1.85     429.1  T
     SCC iter.                  ...        0 min,  0.000 sec
     gradient                   ...        0 min,  0.001 sec
 * total energy  :    -7.9101165 Eh     change       -0.1348581E-05 Eh
   gradient norm :     0.0025668 Eh/α   predicted    -0.5906032E-05 ( 337.94%)
   displ. norm   :     0.0043859 α      lambda       -0.6127318E-05
   maximum displ.:     0.0026753 α      in ANC's #2, #4, #5, ...

........................................................................
.............................. CYCLE   10 ..............................
........................................................................
   1     -8.0159144 -0.801591E+01  0.180E-02    1.85       0.0  T
   2     -8.0159137  0.629116E-06  0.151E-02    1.85       3.0  T
   3     -8.0159145 -0.815582E-06  0.923E-03    1.85       4.8  T
   4     -8.0159149 -0.337232E-06  0.217E-03    1.85      20.6  T
   5     -8.0159149 -0.266631E-07  0.389E-04    1.85     114.8  T
   6     -8.0159149 -0.119917E-09  0.919E-05    1.85     486.6  T
     SCC iter.                  ...        0 min,  0.000 sec
     gradient                   ...        0 min,  0.001 sec
 * total energy  :    -7.9101206 Eh     change       -0.4163346E-05 Eh
   gradient norm :     0.0011981 Eh/α   predicted    -0.3064524E-05 ( -26.39%)
   displ. norm   :     0.0029963 α      lambda       -0.1623561E-05
   maximum displ.:     0.0019275 α      in ANC's #4, #2, #6, ...

........................................................................
.............................. CYCLE   11 ..............................
........................................................................
   1     -8.0157325 -0.801573E+01  0.121E-02    1.84       0.0  T
   2     -8.0157319  0.535461E-06  0.124E-02    1.85       3.6  T
   3     -8.0157329 -0.908495E-06  0.532E-03    1.85       8.4  T
   4     -8.0157329 -0.677659E-07  0.170E-03    1.85      26.3  T
   5     -8.0157329 -0.124438E-07  0.430E-04    1.85     104.1  T
   6     -8.0157329 -0.394813E-10  0.139E-04    1.85     322.4  T
     SCC iter.                  ...        0 min,  0.001 sec
     gradient                   ...        0 min,  0.001 sec
 * total energy  :    -7.9101215 Eh     change       -0.8319406E-06 Eh
   gradient norm :     0.0004622 Eh/α   predicted    -0.8131286E-06 (  -2.26%)
   displ. norm   :     0.0016824 α      lambda       -0.2836441E-06
   maximum displ.:     0.0014915 α      in ANC's #2, #1, #5, ...

   *** GEOMETRY OPTIMIZATION CONVERGED AFTER 11 ITERATIONS ***

------------------------------------------------------------------------
 total energy gain   :        -0.0644241 Eh      -40.4267 kcal/mol
 total RMSD          :         0.4582564 a0        0.2425 Å
 total power (kW/mol):       -15.3768544 (step)-7235.2706 (real)
------------------------------------------------------------------------

 ANCopt (total)                0 d,  0 h,  0 min,  0.023 sec
 optimizer setup                ...        0 min,  0.000 sec (  0.274%)
 model hessian                  ...        0 min,  0.000 sec (  0.407%)
 ANC generation                 ...        0 min,  0.000 sec (  0.222%)
 coordinate transformation      ...        0 min,  0.000 sec (  0.134%)
 single point calculation       ...        0 min,  0.022 sec ( 95.122%)
 optimization log               ...        0 min,  0.000 sec (  1.227%)
 hessian update                 ...        0 min,  0.000 sec (  0.109%)
 rational function              ...        0 min,  0.000 sec (  1.164%)

================
 final structure:
================
5
 xtb: 6.2.2 (9d81278992624c895f80dd42a50cac0aa55982e2)
N         0.75411230940897   -0.40401210115984    0.21384597196212
C        -0.48912929936980   -0.04310167014404    0.00007188529062
C         1.77862619736460    0.31306480825004   -0.07488100972713
H        -1.23483105507986   -0.75991007727703    0.30299063751500
H        -0.80877915232392    0.89396004033087   -0.44202748504061

 Bond Distances (Angstroems)
 ---------------------------
N1-C2=1.3121         N1-C3=1.2834         C2-N1=1.3121         C2-H4=1.0778         C2-H5=1.0843         C3-N1=1.2834         
H4-C2=1.0778         H5-C2=1.0843         
 C  H  Rav=1.0810 sigma=0.0033  Rmin=1.0778  Rmax=1.0843     2
 N  C  Rav=1.2978 sigma=0.0143  Rmin=1.2834  Rmax=1.3121     2

 selected bond angles (degree)
 --------------------
C3-N1-C2=124.47                H4-C2-N1=115.27                H5-C2-N1=125.69                H5-C2-H4=119.04                

 selected dihedral angles (degree)
 ---------------------------------
H4-C2-N1-C3=180.18            H5-C2-N1-C3=  0.00            
           -------------------------------------------------
          |                Final Singlepoint                |
           -------------------------------------------------

          ...................................................
          :                      SETUP                      :
          :.................................................:
          :  # basis functions                  14          :
          :  # atomic orbitals                  14          :
          :  # shells                            8          :
          :  # electrons                        15          :
          :  max. iterations                   250          :
          :  Hamiltonian                  GFN2-xTB          :
          :  restarted?                      false          :
          :  GBSA solvation                  false          :
          :  PC potential                    false          :
          :  electronic temp.          300.0000000     K    :
          :  accuracy                    1.0000000          :
          :  -> integral cutoff          0.2500000E+02      :
          :  -> integral neglect         0.1000000E-07      :
          :  -> SCF convergence          0.1000000E-05 Eh   :
          :  -> wf. convergence          0.1000000E-03 e    :
          :  Broyden damping             0.4000000          :
          ...................................................

 iter      E             dE          RMSdq      gap      omega  full diag
   1     -8.0157329 -0.801573E+01  0.281E-05    1.85       0.0  T
   2     -8.0157329  0.753175E-12  0.244E-05    1.85    1834.8  T
   3     -8.0157329 -0.442313E-12  0.140E-05    1.85    3196.0  T

   *** convergence criteria satisfied after 3 iterations ***

         #    Occupation            Energy/Eh            Energy/eV
      -------------------------------------------------------------
         1        2.0000           -0.6696449             -18.2220
       ...           ...                  ...                  ...
         3        2.0000           -0.5582304             -15.1902
         4        2.0000           -0.5277242             -14.3601
         5        2.0000           -0.5124201             -13.9437
         6        2.0000           -0.4630633             -12.6006
         7        1.0000           -0.4038033             -10.9880
         8        1.0000           -0.3482179              -9.4755
         9        1.0000           -0.2822811              -7.6813 (HOMO)
        10                         -0.2144566              -5.8357 (LUMO)
        11                          0.1172743               3.1912
        12                          0.2332487               6.3470
        13                          0.2995136               8.1502
        14                          0.5403308              14.7032
      -------------------------------------------------------------
                  HL-Gap            0.0678246 Eh            1.8456 eV
             Fermi-level           -0.3409011 Eh           -9.2764 eV

 SCC (total)                   0 d,  0 h,  0 min,  0.002 sec
 SCC setup                      ...        0 min,  0.000 sec (  2.723%)
 Dispersion                     ...        0 min,  0.000 sec (  0.459%)
 integral evaluation            ...        0 min,  0.001 sec ( 38.822%)
 zeroth order Hamiltonian       ...        0 min,  0.000 sec (  0.639%)
 iterations                     ...        0 min,  0.000 sec ( 12.992%)
 molecular gradient             ...        0 min,  0.001 sec ( 39.378%)
 printout                       ...        0 min,  0.000 sec (  4.432%)

         :::::::::::::::::::::::::::::::::::::::::::::::::::::
         ::                     SUMMARY                     ::
         :::::::::::::::::::::::::::::::::::::::::::::::::::::
         :: total energy              -7.910121478931 Eh    ::
         :: gradient norm              0.000467557933 Eh/a0 ::
         :: HOMO-LUMO gap              1.845600602604 eV    ::
         ::.................................................::
         :: SCC energy                -8.015732935535 Eh    ::
         :: -> isotropic ES           -0.000485340030 Eh    ::
         :: -> anisotropic ES         -0.000304770169 Eh    ::
         :: -> anisotropic XC          0.008705459876 Eh    ::
         :: -> dispersion             -0.001575076056 Eh    ::
         :: repulsion energy           0.105611441552 Eh    ::
         :: add. restraining           0.000000000000 Eh    ::
         :::::::::::::::::::::::::::::::::::::::::::::::::::::

           ------------------------------------------------- 
          |                Numerical Hessian                |
           ------------------------------------------------- 
step length          :   0.00500
SCC accuracy         :   0.30000
Hessian scale factor :   1.00000
frozen atoms in %    :   0.00000    0
RMS gradient         :   0.00047
estimated CPU  time      0.00 min
estimated wall time      0.00 min

writing file <hessian>.

 projected vibrational frequencies (cm-1)
eigval :       -0.00    -0.00    -0.00     0.00     0.00     0.00
eigval :      475.43   572.79   691.08   995.54  1248.94  1336.43
eigval :     1467.12  2973.86  3083.52
           -------------------------------------------------
          |                Property Printout                |
           -------------------------------------------------

    * Orbital Energies and Occupations

         #    Occupation            Energy/Eh            Energy/eV
      -------------------------------------------------------------
         1        2.0000           -0.6696449             -18.2220
         2        2.0000           -0.6193282             -16.8528
         3        2.0000           -0.5582304             -15.1902
         4        2.0000           -0.5277242             -14.3601
         5        2.0000           -0.5124201             -13.9437
         6        2.0000           -0.4630633             -12.6006
         7        1.0000           -0.4038034             -10.9880
         8        1.0000           -0.3482179              -9.4755
         9        1.0000           -0.2822812              -7.6813 (HOMO)
        10                         -0.2144566              -5.8357 (LUMO)
        11                          0.1172744               3.1912
        12                          0.2332487               6.3470
        13                          0.2995136               8.1502
        14                          0.5403308              14.7031
      -------------------------------------------------------------
                  HL-Gap            0.0678246 Eh            1.8456 eV
             Fermi-level           -0.3409011 Eh           -9.2764 eV
Molecule has the following symmetry elements: (sigma) 
It seems to be the Cs point group

     #   Z        covCN         q      C6AA      α(0)
     1   7 N      1.821    -0.041    22.739     7.066
     2   6 C      2.818    -0.022    28.532     8.752
     3   6 C      0.967    -0.098    38.912    10.470
     4   1 H      0.926     0.091     1.873     2.140
     5   1 H      0.925     0.069     2.097     2.264

 Mol. C6AA /au·bohr⁶  :        366.384645
 Mol. C8AA /au·bohr⁸  :       8902.479330
 Mol. α(0) /au        :         30.691996


Wiberg/Mayer (AO) data.
largest (>0.10) Wiberg bond orders for each atom
          total WBO             WBO to atom ...
     1  N   3.032        C    3 1.581    C    2 1.441
     2  C   3.338        N    1 1.441    H    5 0.932    H    4 0.926
     3  C   1.654        N    1 1.581
     4  H   0.950        C    2 0.926
     5  H   0.951        C    2 0.932

MOs/occ written to file <molden.input>


molecular dipole:
                 x           y           z       tot (Debye)
 q only:       -0.683      -0.039      -0.008
   full:       -0.768       0.045      -0.049       1.958
molecular quadrupole (traceless):
                xx          xy          yy          xz          yz          zz
 q only:       -0.745      -0.039       0.565      -0.015      -0.227       0.180
  q+dip:       -0.201       0.253       0.662      -0.096      -0.642      -0.461
   full:       -0.571       0.070       0.206      -0.071       0.095       0.365

           -------------------------------------------------
          |                Geometry Summary                 |
           -------------------------------------------------

      molecular mass/u    :       40.0440565
   center of mass at/Å    :        0.5991049      -0.0569730       0.0488598
  moments of inertia/u·Å² :        0.5069781E+01   0.3723369E+02   0.4230345E+02
rotational constants/cm⁻¹ :        0.3325120E+01   0.4527522E+00   0.3984931E+00

 * 3 selected distances

     #   Z        #   Z                                     value/Å
     1   7 N      2   6 C                                 1.3120996 (max)
     2   6 C      4   1 H                                 1.0777964 (min)
     2   6 C      5   1 H                                 1.0843028

 * 2 distinct bonds (by element types)

   Z      Z             #   av. dist./Å        max./Å        min./Å
   1 H    6 C           2     1.0810496     1.0843028     1.0777964
   6 C    7 N           1     1.3120996     1.3120996     1.3120996

           -------------------------------------------------
          |               Frequency Printout                |
           -------------------------------------------------
 projected vibrational frequencies (cm-1)
eigval :       -0.00    -0.00    -0.00     0.00     0.00     0.00
eigval :      475.43   572.79   691.08   995.54  1248.94  1336.43
eigval :     1467.12  2973.86  3083.52
 reduced masses (amu)
   1: 10.34   2:  9.85   3: 11.62   4: 12.24   5: 11.40   6: 10.72   7:  9.66   8:  3.98
   9:  4.48  10:  5.28  11:  7.92  12:  6.85  13: 12.30  14:  1.66  15:  1.84
 IR intensities (amu)
   1:  0.10   2:  0.02   3:  0.12   4:  0.14   5:  0.14   6:  0.03   7:  0.19   8:  0.18
   9:  0.22  10:  0.15  11:  0.53  12:  0.88  13:  1.27  14:  0.18  15:  0.11
 Raman intensities (amu)
   1:  0.00   2:  0.00   3:  0.00   4:  0.00   5:  0.00   6:  0.00   7:  0.00   8:  0.00
   9:  0.00  10:  0.00  11:  0.00  12:  0.00  13:  0.00  14:  0.00  15:  0.00
 output can be read by thermo (or use thermo option).
 writing <g98.out> molden fake output.
 recommended (thermochemical) frequency scaling factor: 1.0
           -------------------------------------------------
          |             Thermodynamic Functions             |
           -------------------------------------------------

cs  symmetry found (for desy threshold:  0.10E+00) used in thermo

          ...................................................
          :                      SETUP                      :
          :.................................................:
          :  # frequencies                           9      :
          :  # imaginary freq.                       0      :
          :  linear?                             false      :
          :  only rotor calc.                    false      :
          :  symmetry                               cs      :
          :  rotational number                       1      :
          :  scaling factor                  1.0000000      :
          :  rotor cutoff                   50.0000000 cm⁻¹ :
          :  imag. cutoff                  -20.0000000 cm⁻¹ :
          :.................................................:

    mode    ω/cm⁻¹     T·S(HO)/kcal·mol⁻¹    T·S(FR)/kcal·mol⁻¹   T·S(vib)
   ------------------------------------------------------------------------
   ------------------------------------------------------------------------

   temp. (K)  partition function   enthalpy   heat capacity  entropy
                                   cal/mol     cal/K/mol   cal/K/mol   J/K/mol
 298.15  VIB   1.25                  377.350      4.014      1.704
         ROT  0.683E+04              888.752      2.981     20.526
         INT  0.851E+04             1266.102      6.995     22.230
         TR   0.245E+27             1481.254      4.968     36.973
         TOT                        2747.3560    11.9629    59.2032   247.7061

   temp. (K)  partition function   enthalpy   heat capacity  entropy
                                   cal/mol     cal/K/mol   cal/K/mol   J/K/mol
 120.00  VIB   1.00                    6.787      0.352      0.066
         ROT  0.174E+04              357.707      2.981     17.813
         INT  0.175E+04              364.494      3.333     17.878
         TR   0.626E+26              596.178      4.968     32.454
         TOT                         960.6719     8.3007    50.3324   210.5906

   temp. (K)  partition function   enthalpy   heat capacity  entropy
                                   cal/mol     cal/K/mol   cal/K/mol   J/K/mol
 100.00  VIB   1.00                    1.984      0.145      0.023
         ROT  0.133E+04              298.089      2.981     17.269
         INT  0.133E+04              300.073      3.126     17.292
         TR   0.476E+26              496.815      4.968     31.549
         TOT                         796.8882     8.0940    48.8403   204.3477

   temp. (K)  partition function   enthalpy   heat capacity  entropy
                                   cal/mol     cal/K/mol   cal/K/mol   J/K/mol
  80.00  VIB   1.00                    0.326      0.036      0.005
         ROT   949.                  238.471      2.981     16.604
         INT   949.                  238.797      3.017     16.608
         TR   0.341E+26              397.452      4.968     30.440
         TOT                         636.2492     7.9855    47.0489   196.8527

   temp. (K)  partition function   enthalpy   heat capacity  entropy
                                   cal/mol     cal/K/mol   cal/K/mol   J/K/mol
  60.00  VIB   1.00                    0.017      0.003      0.000
         ROT   616.                  178.853      2.981     15.746
         INT   616.                  178.871      2.984     15.747
         TR   0.221E+26              298.089      4.968     29.012
         TOT                         476.9595     7.9524    44.7585   187.2698

   temp. (K)  partition function   enthalpy   heat capacity  entropy
                                   cal/mol     cal/K/mol   cal/K/mol   J/K/mol
  40.00  VIB   1.00                    0.000      0.000     -0.000
         ROT   335.                  119.236      2.981     14.538
         INT   335.                  119.236      2.981     14.538
         TR   0.120E+26              198.726      4.968     26.999
         TOT                         317.9617     7.9491    41.5361   173.7869

   temp. (K)  partition function   enthalpy   heat capacity  entropy
                                   cal/mol     cal/K/mol   cal/K/mol   J/K/mol
  20.00  VIB   1.00                    0.000      0.000     -0.000
         ROT   119.                   59.618      2.981     12.472
         INT   119.                   59.618      2.981     12.471
         TR   0.426E+25               99.363      4.968     23.557
         TOT                         158.9808     7.9490    36.0278   150.7401

   temp. (K)  partition function   enthalpy   heat capacity  entropy
                                   cal/mol     cal/K/mol   cal/K/mol   J/K/mol
  10.00  VIB   1.00                    0.000      0.000     -0.000
         ROT   41.9                   29.809      2.981     10.405
         INT   41.9                   29.809      2.981     10.405
         TR   0.151E+25               49.681      4.968     20.115
         TOT                          79.4904     7.9490    30.5194   127.6933

       T/K    H(0)-H(T)+PV         H(T)/Eh          T*S/Eh         G(T)/Eh
   ------------------------------------------------------------------------
    298.15    0.437819E-02    0.336406E-01    0.281293E-01    0.551124E-02
    120.00    0.153093E-02    0.307933E-01    0.962517E-02    0.211681E-01
    100.00    0.126992E-02    0.305323E-01    0.778319E-02    0.227491E-01
     80.00    0.101393E-02    0.302763E-01    0.599818E-02    0.242781E-01
     60.00    0.760083E-03    0.300225E-01    0.427964E-02    0.257428E-01
     40.00    0.506704E-03    0.297691E-01    0.264768E-02    0.271214E-01
     20.00    0.253352E-03    0.295157E-01    0.114828E-02    0.283675E-01
     10.00    0.126676E-03    0.293891E-01    0.486358E-03    0.289027E-01 (used)
   ------------------------------------------------------------------------

         :::::::::::::::::::::::::::::::::::::::::::::::::::::
         ::                  THERMODYNAMIC                  ::
         :::::::::::::::::::::::::::::::::::::::::::::::::::::
         :: total free energy          -7.881218774987 Eh   ::
         ::.................................................::
         :: total energy               -7.910121478899 Eh   ::
         :: zero point energy           0.029262385911 Eh   ::
         :: G(RRHO) w/o ZPVE           -0.000359681999 Eh   ::
         :: G(RRHO) contrib.            0.028902703912 Eh   ::
         :::::::::::::::::::::::::::::::::::::::::::::::::::::

optimized geometry written to: xtbopt.xyz


           -------------------------------------------------
          | TOTAL ENERGY               -7.910121478899 Eh   |
          | TOTAL ENTHALPY             -7.880732416972 Eh   |
          | TOTAL FREE ENERGY          -7.881218774987 Eh   |
          | GRADIENT NORM               0.000467678727 Eh/α |
          | HOMO-LUMO GAP               1.845602016533 eV   |
           -------------------------------------------------

------------------------------------------------------------------------
 * finished run on 2020/05/12 at 11:44:47.545     
------------------------------------------------------------------------
 total:
 * wall-time:     0 d,  0 h,  0 min,  0.098 sec
 *  cpu-time:     0 d,  0 h,  0 min,  0.098 sec
 * ratio c/w:     0.999 speedup
 SCF:
 * wall-time:     0 d,  0 h,  0 min,  0.003 sec
 *  cpu-time:     0 d,  0 h,  0 min,  0.003 sec
 * ratio c/w:     1.000 speedup
 ANC optimizer:
 * wall-time:     0 d,  0 h,  0 min,  0.026 sec
 *  cpu-time:     0 d,  0 h,  0 min,  0.026 sec
 * ratio c/w:     0.999 speedup
 numerical hessian:
 * wall-time:     0 d,  0 h,  0 min,  0.054 sec
 *  cpu-time:     0 d,  0 h,  0 min,  0.054 sec
 * ratio c/w:     0.999 speedup

