      -----------------------------------------------------------      
     |                   =====================                   |     
     |                           x T B                           |     
     |                   =====================                   |     
     |                         S. Grimme                         |     
     |          Mulliken Center for Theoretical Chemistry        |     
     |                    University of Bonn                     |     
      -----------------------------------------------------------      

   * xtb version 6.2.2 (9d81278992624c895f80dd42a50cac0aa55982e2) compiled by '@Darwin' on 04/03/2020

   xtb is free software: you can redistribute it and/or modify it under
   the terms of the GNU Lesser General Public License as published by
   the Free Software Foundation, either version 3 of the License, or
   (at your option) any later version.
   
   xtb is distributed in the hope that it will be useful,
   but WITHOUT ANY WARRANTY; without even the implied warranty of
   MERCHANTABILITY or FITNESS FOR A PARTICULAR PURPOSE.  See the
   GNU Lesser General Public License for more details.
   
   Cite this work as:
   * S. Grimme, C. Bannwarth, P. Shushkov, J. Chem. Theory Comput., 2017,
     13, 1989-2009. DOI: 10.1021/acs.jctc.7b00118
   * C. Bannwarth, S. Ehlert and S. Grimme., J. Chem. Theory Comput., 2019,
     15, 1652-1671. DOI: 10.1021/acs.jctc.8b01176
   * P. Pracht, E. Caldeweyher, S. Ehlert, S. Grimme, ChemRxiv, 2019, preprint.
     DOI: 10.26434/chemrxiv.8326202.v1
   
   for DFT-D4:
   * E. Caldeweyher, C. Bannwarth and S. Grimme, J. Chem. Phys., 2017,
     147, 034112. DOI: 10.1063/1.4993215
   * E. Caldeweyher, S. Ehlert, A. Hansen, H. Neugebauer, S. Spicher,
     C. Bannwarth and S. Grimme, J. Chem. Phys., 2019, 150, 154122.
     DOI: 10.1063/1.5090222
   
   for sTDA-xTB:
   * S. Grimme and C. Bannwarth, J. Chem. Phys., 2016, 145, 054103.
     DOI: 10.1063/1.4959605
   
   in the mass-spec context:
   * V. Asgeirsson, C. Bauer and S. Grimme, Chem. Sci., 2017, 8, 4879.
     DOI: 10.1039/c7sc00601b
   
   for metadynamics refer to:
   * S. Grimme, J. Chem. Theory Comput., 2019, 155, 2847-2862
     DOI: 10.1021/acs.jctc.9b00143
   
   with help from (in alphabetical order)
   C. Bannwarth, F. Bohle, G. Brandenburg, E. Caldeweyher, M. Checinski,
   S. Dohm, S. Ehlert, S. Ehrlich, F. März, H. Neugebauer, J. Pisarek,
   P. Pracht, P. Shushkov, and S. Spicher.
   
 * started run on 2020/05/12 at 11:43:53.350     

           -------------------------------------------------
          |                Calculation Setup                |
           -------------------------------------------------

          program call               : xtb --input H2C1O2_5_S_2.input H2C1O2_5_S_2.xyz --ohess --molden --namespace H2C1O2_5_S_2 output.out
          calculation namespace      : H2C1O2_5_S_2
          coordinate file            : H2C1O2_5_S_2.xyz
          number of atoms            :                     5
          number of electrons        :                    18
          charge                     :                     0
          spin                       :                   1.0
          first test random number   :      0.44086515422953

   ID    Z sym.   atoms
    1    6 C      1
    2    8 O      2, 3
    3    1 H      4, 5

           -------------------------------------------------
          |                 G F N 2 - x T B                 |
           -------------------------------------------------

        Reference                      10.1021/acs.jctc.8b01176
      * Hamiltonian:
        H0-scaling (s, p, d)           1.850000    2.230000    2.230000
        zeta-weighting                 0.500000
      * Dispersion:
        s8                             2.700000
        a1                             0.520000
        a2                             5.000000
        s9                             5.000000
      * Repulsion:
        kExp                           1.500000    1.000000
        rExp                           1.000000
      * Coulomb:
        alpha                          2.000000
        third order                    shell-resolved
        anisotropic                    true
        a3                             3.000000
        a5                             4.000000
        cn-shift                       1.200000
        cn-exp                         4.000000
        max-rad                        5.000000


          ...................................................
          :                      SETUP                      :
          :.................................................:
          :  # basis functions                  14          :
          :  # atomic orbitals                  14          :
          :  # shells                            8          :
          :  # electrons                        18          :
          :  max. iterations                   250          :
          :  Hamiltonian                  GFN2-xTB          :
          :  restarted?                      false          :
          :  GBSA solvation                  false          :
          :  PC potential                    false          :
          :  electronic temp.          300.0000000     K    :
          :  accuracy                    1.0000000          :
          :  -> integral cutoff          0.2500000E+02      :
          :  -> integral neglect         0.1000000E-07      :
          :  -> SCF convergence          0.1000000E-05 Eh   :
          :  -> wf. convergence          0.1000000E-03 e    :
          :  Broyden damping             0.4000000          :
          ...................................................

 iter      E             dE          RMSdq      gap      omega  full diag
   1    -10.9307907 -0.109308E+02  0.584E+00    3.13       0.0  T
   2    -10.9332822 -0.249156E-02  0.366E+00    3.17       1.0  T
   3    -10.9337380 -0.455761E-03  0.399E-01    3.29       1.0  T
   4    -10.9339384 -0.200422E-03  0.228E-01    3.28       1.0  T
   5    -10.9339727 -0.343035E-04  0.704E-02    3.29       1.0  T
   6    -10.9339739 -0.118583E-05  0.924E-03    3.29       4.8  T
   7    -10.9339739 -0.417255E-07  0.363E-03    3.29      12.3  T
   8    -10.9339740 -0.196773E-07  0.175E-03    3.29      25.6  T
   9    -10.9339740 -0.212309E-08  0.724E-05    3.29     618.0  T
  10    -10.9339740 -0.671285E-11  0.274E-05    3.29    1632.0  T

   *** convergence criteria satisfied after 10 iterations ***

         #    Occupation            Energy/Eh            Energy/eV
      -------------------------------------------------------------
         1        2.0000           -0.8087177             -22.0063
       ...           ...                  ...                  ...
         4        2.0000           -0.6499733             -17.6867
         5        2.0000           -0.6314263             -17.1820
         6        2.0000           -0.5669318             -15.4270
         7        2.0000           -0.5653280             -15.3834
         8        2.0000           -0.4912531             -13.3677
         9        1.0000           -0.4651393             -12.6571
        10        1.0000           -0.1701777              -4.6308 (HOMO)
        11                         -0.0491429              -1.3372 (LUMO)
        12                          0.0380955               1.0366
        13                          0.2085456               5.6748
        14                          0.2305800               6.2744
      -------------------------------------------------------------
                  HL-Gap            0.1210348 Eh            3.2935 eV
             Fermi-level           -0.2939282 Eh           -7.9982 eV

 transition dipole moment (au) for excitation:           9          10
     X       Y       Z   
  -0.0016  -0.0620  -0.0056  total (au/Debye):    0.062   0.158
 dE (eV)             :    8.026
 oscillator strength :  0.10768E-02

 SCC (total)                   0 d,  0 h,  0 min,  0.003 sec
 SCC setup                      ...        0 min,  0.000 sec (  2.966%)
 Dispersion                     ...        0 min,  0.000 sec (  0.388%)
 integral evaluation            ...        0 min,  0.001 sec ( 20.770%)
 zeroth order Hamiltonian       ...        0 min,  0.000 sec (  1.240%)
 iterations                     ...        0 min,  0.001 sec ( 27.941%)
 molecular gradient             ...        0 min,  0.001 sec ( 19.431%)
 printout                       ...        0 min,  0.001 sec ( 26.375%)

         :::::::::::::::::::::::::::::::::::::::::::::::::::::
         ::                     SUMMARY                     ::
         :::::::::::::::::::::::::::::::::::::::::::::::::::::
         :: total energy             -10.883755693486 Eh    ::
         :: gradient norm              0.449658258940 Eh/a0 ::
         :: HOMO-LUMO gap              3.293525235620 eV    ::
         ::.................................................::
         :: SCC energy               -10.933973964677 Eh    ::
         :: -> isotropic ES            0.007976028558 Eh    ::
         :: -> anisotropic ES          0.005833289284 Eh    ::
         :: -> anisotropic XC         -0.013912244655 Eh    ::
         :: -> dispersion             -0.001184461261 Eh    ::
         :: repulsion energy           0.050218253622 Eh    ::
         :: add. restraining           0.000000000000 Eh    ::
         :::::::::::::::::::::::::::::::::::::::::::::::::::::

      ----------------------------------------------------------- 
     |                   =====================                   |
     |                        A N C O P T                        |
     |                   =====================                   |
     |               Approximate Normal Coordinate               |
     |                Rational Function Optimizer                |
      ----------------------------------------------------------- 

          ...................................................
          :                      SETUP                      :
          :.................................................:
          :   optimization level            normal          :
          :   max. optcycles                   200          :
          :   ANC micro-cycles                  20          :
          :   degrees of freedom                 9          :
          :.................................................:
          :   RF solver                   davidson          :
          :   write xtbopt.log                true          :
          :   linear?                        false          :
          :   energy convergence         0.5000000E-05 Eh   :
          :   grad. convergence          0.1000000E-02 Eh/α :
          :   maximium RF displ.         1.0000000          :
          :   Hlow (freq-cutoff)         0.1000000E-01      :
          :   Hmax (freq-cutoff)         5.0000000          :
          :   S6 in model hess.         20.0000000          :
          ...................................................

generating ANC from model Hessian ...
Using Lindh-Hessian (1995)
 Shifting diagonal of input Hessian by    0.0000000000000000     
 Lowest  eigenvalues of input Hessian
   -0.000000   -0.000000    0.000000    0.000000    0.000000    0.000000
    0.107987    0.115711    0.173398    0.196694    0.415469    1.170163
    1.238044    1.315028    2.039622
 Highest eigenvalues
    0.196694    0.415469    1.170163    1.238044    1.315028    2.039622


........................................................................
.............................. CYCLE    1 ..............................
........................................................................
   1    -10.9339740 -0.109340E+02  0.618E-07    3.29       0.0  T
   2    -10.9339740  0.124345E-13  0.376E-07    3.29  100000.0  T
   3    -10.9339740  0.106581E-13  0.273E-07    3.29  100000.0  T
     SCC iter.                  ...        0 min,  0.001 sec
     gradient                   ...        0 min,  0.001 sec
 * total energy  :   -10.8837557 Eh     change       -0.6035705E-10 Eh
   gradient norm :     0.4496581 Eh/α   predicted     0.0000000E+00 (-100.00%)
   displ. norm   :     0.2650045 α      lambda       -0.1097013E+00
   maximum displ.:     0.1788567 α      in ANC's #9, #8, #3, ...

........................................................................
.............................. CYCLE    2 ..............................
........................................................................
   1    -10.9190736 -0.109191E+02  0.461E+00    4.12       0.0  T
   2    -10.9741707 -0.550971E-01  0.308E+00    2.92       1.0  T
   3    -11.0126558 -0.384851E-01  0.124E+00    3.40       1.0  T
   4    -11.0133246 -0.668789E-03  0.909E-01    3.45       1.0  T
   5    -11.0138285 -0.503993E-03  0.178E-01    3.54       1.0  T
   6    -11.0135983  0.230240E-03  0.263E-01    3.53       1.0  T
   7    -11.0138532 -0.254855E-03  0.198E-02    3.53       2.3  T
   8    -11.0138534 -0.231452E-06  0.626E-03    3.53       7.1  T
   9    -11.0138535 -0.579868E-07  0.438E-04    3.53     102.1  T
  10    -11.0138535 -0.118838E-10  0.105E-04    3.53     427.4  T
     SCC iter.                  ...        0 min,  0.001 sec
     gradient                   ...        0 min,  0.001 sec
 * total energy  :   -10.9696759 Eh     change       -0.8592018E-01 Eh
   gradient norm :     0.2633961 Eh/α   predicted    -0.5870267E-01 ( -31.68%)
   displ. norm   :     0.4630399 α      lambda       -0.1198124E+00
   maximum displ.:     0.4029376 α      in ANC's #8, #9, #5, ...

........................................................................
.............................. CYCLE    3 ..............................
........................................................................
   1    -11.0457874 -0.110458E+02  0.364E+00    7.43       0.0  T
   2    -11.0622425 -0.164551E-01  0.178E+00    6.33       1.0  T
   3    -11.0732082 -0.109657E-01  0.134E+00    6.88       1.0  T
   4    -11.0288787  0.443295E-01  0.323E+00    6.68       1.0  T
   5    -11.0727744 -0.438957E-01  0.815E-01    6.68       1.0  T
   6    -11.0752973 -0.252298E-02  0.338E-01    6.72       1.0  T
   7    -11.0756262 -0.328878E-03  0.101E-01    6.70       1.0  T
   8    -11.0756477 -0.214975E-04  0.574E-02    6.70       1.0  T
   9    -11.0756580 -0.102904E-04  0.672E-03    6.70       6.7  T
  10    -11.0756582 -0.165012E-06  0.231E-03    6.70      19.3  T
  11    -11.0756582 -0.178193E-07  0.428E-04    6.70     104.4  T
  12    -11.0756582 -0.540652E-09  0.214E-04    6.70     209.2  T
     SCC iter.                  ...        0 min,  0.001 sec
     gradient                   ...        0 min,  0.001 sec
 * total energy  :   -11.0311376 Eh     change       -0.6146169E-01 Eh
   gradient norm :     0.1979450 Eh/α   predicted    -0.7275048E-01 (  18.37%)
   displ. norm   :     0.2277923 α      lambda       -0.2863414E-01
   maximum displ.:     0.2035116 α      in ANC's #8, #5, #3, ...

........................................................................
.............................. CYCLE    4 ..............................
........................................................................
   1    -11.0986221 -0.110986E+02  0.106E+00    8.94       0.0  T
   2    -11.0989556 -0.333488E-03  0.597E-01    8.81       1.0  T
   3    -11.0989071  0.484843E-04  0.269E-01    8.90       1.0  T
   4    -11.0989771 -0.699019E-04  0.988E-02    8.85       1.0  T
   5    -11.0990244 -0.473457E-04  0.264E-02    8.85       1.7  T
   6    -11.0990272 -0.281585E-05  0.464E-03    8.85       9.6  T
   7    -11.0990272 -0.571349E-08  0.907E-04    8.85      49.3  T
   8    -11.0990272 -0.446555E-09  0.191E-04    8.85     234.2  T
     SCC iter.                  ...        0 min,  0.000 sec
     gradient                   ...        0 min,  0.001 sec
 * total energy  :   -11.0544540 Eh     change       -0.2331642E-01 Eh
   gradient norm :     0.1782267 Eh/α   predicted    -0.1505997E-01 ( -35.41%)
   displ. norm   :     0.3345553 α      lambda       -0.3722726E-01
   maximum displ.:     0.2764229 α      in ANC's #8, #5, #9, ...

........................................................................
.............................. CYCLE    5 ..............................
........................................................................
   1    -11.1263187 -0.111263E+02  0.155E+00   13.13       0.0  T
   2    -11.1269025 -0.583776E-03  0.907E-01   13.01       1.0  T
   3    -11.1268634  0.390829E-04  0.293E-01   13.07       1.0  T
   4    -11.1269717 -0.108280E-03  0.324E-02   13.03       1.4  T
   5    -11.1269416  0.301139E-04  0.737E-02   13.03       1.0  T
   6    -11.1269738 -0.322376E-04  0.103E-02   13.03       4.3  T
   7    -11.1269739 -0.971882E-07  0.778E-04   13.03      57.5  T
   8    -11.1269739 -0.360421E-09  0.387E-04   13.03     115.5  T
     SCC iter.                  ...        0 min,  0.000 sec
     gradient                   ...        0 min,  0.001 sec
 * total energy  :   -11.0799858 Eh     change       -0.2553181E-01 Eh
   gradient norm :     0.1098884 Eh/α   predicted    -0.2069700E-01 ( -18.94%)
   displ. norm   :     0.1835328 α      lambda       -0.1276180E-01
   maximum displ.:     0.1240910 α      in ANC's #8, #5, #9, ...

........................................................................
.............................. CYCLE    6 ..............................
........................................................................
   1    -11.1399819 -0.111400E+02  0.874E-01   13.90       0.0  T
   2    -11.1403475 -0.365598E-03  0.502E-01   13.86       1.0  T
   3    -11.1403584 -0.109419E-04  0.203E-01   13.92       1.0  T
   4    -11.1403746 -0.161500E-04  0.369E-02   13.92       1.2  T
   5    -11.1403296  0.450164E-04  0.934E-02   13.92       1.0  T
   6    -11.1403801 -0.505722E-04  0.823E-03   13.92       5.4  T
   7    -11.1403802 -0.241733E-07  0.702E-04   13.92      63.7  T
   8    -11.1403802 -0.245077E-09  0.325E-04   13.92     137.8  T
     SCC iter.                  ...        0 min,  0.001 sec
     gradient                   ...        0 min,  0.001 sec
 * total energy  :   -11.0877723 Eh     change       -0.7786498E-02 Eh
   gradient norm :     0.0435590 Eh/α   predicted    -0.6595832E-02 ( -15.29%)
   displ. norm   :     0.0464450 α      lambda       -0.1852979E-02
   maximum displ.:     0.0419311 α      in ANC's #9, #3, #5, ...

........................................................................
.............................. CYCLE    7 ..............................
........................................................................
   1    -11.1448874 -0.111449E+02  0.211E-01   13.74       0.0  T
   2    -11.1449551 -0.676893E-04  0.101E-01   13.72       1.0  T
   3    -11.1449586 -0.353262E-05  0.587E-02   13.74       1.0  T
   4    -11.1449573  0.126741E-05  0.197E-02   13.74       2.3  T
   5    -11.1449572  0.832240E-07  0.197E-02   13.74       2.3  T
   6    -11.1449594 -0.212301E-05  0.214E-03   13.74      20.9  T
   7    -11.1449594 -0.996371E-09  0.196E-04   13.74     228.5  T
   8    -11.1449594 -0.536104E-11  0.102E-04   13.74     439.9  T
     SCC iter.                  ...        0 min,  0.000 sec
     gradient                   ...        0 min,  0.001 sec
 * total energy  :   -11.0890088 Eh     change       -0.1236546E-02 Eh
   gradient norm :     0.0164666 Eh/α   predicted    -0.9284880E-03 ( -24.91%)
   displ. norm   :     0.0600050 α      lambda       -0.8380463E-03
   maximum displ.:     0.0393432 α      in ANC's #8, #3, #9, ...

........................................................................
.............................. CYCLE    8 ..............................
........................................................................
   1    -11.1472993 -0.111473E+02  0.221E-01   13.59       0.0  T
   2    -11.1473228 -0.235776E-04  0.127E-01   13.57       1.0  T
   3    -11.1473232 -0.361704E-06  0.480E-02   13.58       1.0  T
   4    -11.1473243 -0.106342E-05  0.336E-03   13.58      13.3  T
   5    -11.1473240  0.291925E-06  0.726E-03   13.58       6.2  T
   6    -11.1473243 -0.300437E-06  0.319E-04   13.58     140.4  T
   7    -11.1473243 -0.157607E-09  0.856E-05   13.58     522.5  T
     SCC iter.                  ...        0 min,  0.001 sec
     gradient                   ...        0 min,  0.001 sec
 * total energy  :   -11.0895487 Eh     change       -0.5398769E-03 Eh
   gradient norm :     0.0060085 Eh/α   predicted    -0.4205310E-03 ( -22.11%)
   displ. norm   :     0.0424173 α      lambda       -0.2186142E-03
   maximum displ.:     0.0300755 α      in ANC's #8, #3, #5, ...

........................................................................
.............................. CYCLE    9 ..............................
........................................................................
   1    -11.1473532 -0.111474E+02  0.166E-01   13.54       0.0  T
   2    -11.1473548 -0.164599E-05  0.102E-01   13.53       1.0  T
   3    -11.1473550 -0.154667E-06  0.898E-03   13.53       5.0  T
   4    -11.1473551 -0.137108E-06  0.321E-03   13.53      13.9  T
   5    -11.1473551  0.208018E-07  0.259E-03   13.53      17.3  T
   6    -11.1473551 -0.284561E-07  0.123E-03   13.53      36.2  T
   7    -11.1473551 -0.434207E-08  0.655E-05   13.53     682.3  T
   8    -11.1473551 -0.593303E-12  0.366E-05   13.53    1222.0  T
     SCC iter.                  ...        0 min,  0.000 sec
     gradient                   ...        0 min,  0.001 sec
 * total energy  :   -11.0896696 Eh     change       -0.1209313E-03 Eh
   gradient norm :     0.0024927 Eh/α   predicted    -0.1095034E-03 (  -9.45%)
   displ. norm   :     0.0057396 α      lambda       -0.8955136E-05
   maximum displ.:     0.0044036 α      in ANC's #3, #8, #9, ...

........................................................................
.............................. CYCLE   10 ..............................
........................................................................
   1    -11.1471698 -0.111472E+02  0.245E-02   13.56       0.0  T
   2    -11.1471701 -0.214290E-06  0.142E-02   13.56       3.1  T
   3    -11.1471701 -0.604255E-08  0.471E-03   13.55       9.5  T
   4    -11.1471701 -0.363594E-08  0.134E-03   13.55      33.3  T
   5    -11.1471701  0.224967E-07  0.232E-03   13.55      19.3  T
   6    -11.1471701 -0.309550E-07  0.168E-04   13.55     266.7  T
   7    -11.1471701 -0.777511E-11  0.134E-05   13.55    3338.4  T
     SCC iter.                  ...        0 min,  0.001 sec
     gradient                   ...        0 min,  0.001 sec
 * total energy  :   -11.0896749 Eh     change       -0.5253036E-05 Eh
   gradient norm :     0.0005596 Eh/α   predicted    -0.4478252E-05 ( -14.75%)
   displ. norm   :     0.0035788 α      lambda       -0.1064324E-05
   maximum displ.:     0.0032168 α      in ANC's #3, #5, #9, ...

........................................................................
.............................. CYCLE   11 ..............................
........................................................................
   1    -11.1471751 -0.111472E+02  0.760E-03   13.58       0.0  T
   2    -11.1471751 -0.224655E-07  0.428E-03   13.58      10.4  T
   3    -11.1471751 -0.301807E-09  0.155E-03   13.58      28.9  T
   4    -11.1471751  0.206903E-09  0.507E-04   13.58      88.2  T
   5    -11.1471751  0.442720E-09  0.564E-04   13.58      79.2  T
     SCC iter.                  ...        0 min,  0.000 sec
     gradient                   ...        0 min,  0.001 sec
 * total energy  :   -11.0896757 Eh     change       -0.8010870E-06 Eh
   gradient norm :     0.0003128 Eh/α   predicted    -0.5315264E-06 ( -33.65%)
   displ. norm   :     0.0010735 α      lambda       -0.1445364E-06
   maximum displ.:     0.0006391 α      in ANC's #5, #3, #8, ...

   *** GEOMETRY OPTIMIZATION CONVERGED AFTER 11 ITERATIONS ***

------------------------------------------------------------------------
 total energy gain   :        -0.2059200 Eh     -129.2168 kcal/mol
 total RMSD          :         0.5421159 a0        0.2869 Å
 total power (kW/mol):       -49.1493554 (step)********** (real)
------------------------------------------------------------------------

 ANCopt (total)                0 d,  0 h,  0 min,  0.022 sec
 optimizer setup                ...        0 min,  0.000 sec (  0.290%)
 model hessian                  ...        0 min,  0.000 sec (  0.439%)
 ANC generation                 ...        0 min,  0.000 sec (  0.202%)
 coordinate transformation      ...        0 min,  0.000 sec (  0.186%)
 single point calculation       ...        0 min,  0.021 sec ( 94.636%)
 optimization log               ...        0 min,  0.000 sec (  1.137%)
 hessian update                 ...        0 min,  0.000 sec (  0.109%)
 rational function              ...        0 min,  0.000 sec (  1.372%)

================
 final structure:
================
5
 xtb: 6.2.2 (9d81278992624c895f80dd42a50cac0aa55982e2)
C        -0.02085711989231    0.00059027299632   -0.00044797854170
O         0.79554662373673    0.07008165200857   -1.01658060301639
O         0.74595550050204   -0.11367047472890    1.04970064334731
H        -0.78297728212388   -0.83818121816571   -0.09333024157593
H        -0.73766772222258    0.88118076788972    0.06065817978671

 Bond Distances (Angstroems)
 ---------------------------
C1-O2=1.3053         C1-O3=1.3053         C1-H4=1.1371         C1-H5=1.1371         O2-C1=1.3053         O3-C1=1.3053         
H4-C1=1.1371         H5-C1=1.1371         
 C  H  Rav=1.1371 sigma=0.0000  Rmin=1.1371  Rmax=1.1371     2
 O  C  Rav=1.3053 sigma=0.0000  Rmin=1.3053  Rmax=1.3053     2

 selected bond angles (degree)
 --------------------
O3-C1-O2=105.28                H4-C1-O2=113.26                H4-C1-O3=113.26                H5-C1-O2=113.26                
H5-C1-O3=113.26                H5-C1-H4= 98.81                

 selected dihedral angles (degree)
 ---------------------------------

           -------------------------------------------------
          |                Final Singlepoint                |
           -------------------------------------------------

          ...................................................
          :                      SETUP                      :
          :.................................................:
          :  # basis functions                  14          :
          :  # atomic orbitals                  14          :
          :  # shells                            8          :
          :  # electrons                        18          :
          :  max. iterations                   250          :
          :  Hamiltonian                  GFN2-xTB          :
          :  restarted?                      false          :
          :  GBSA solvation                  false          :
          :  PC potential                    false          :
          :  electronic temp.          300.0000000     K    :
          :  accuracy                    1.0000000          :
          :  -> integral cutoff          0.2500000E+02      :
          :  -> integral neglect         0.1000000E-07      :
          :  -> SCF convergence          0.1000000E-05 Eh   :
          :  -> wf. convergence          0.1000000E-03 e    :
          :  Broyden damping             0.4000000          :
          ...................................................

 iter      E             dE          RMSdq      gap      omega  full diag
   1    -11.1471751 -0.111472E+02  0.178E-04   13.58       0.0  T
   2    -11.1471751  0.240819E-09  0.288E-04   13.58     155.0  T
   3    -11.1471751 -0.214005E-09  0.182E-04   13.58     246.4  T

   *** convergence criteria satisfied after 3 iterations ***

         #    Occupation            Energy/Eh            Energy/eV
      -------------------------------------------------------------
         1        2.0000           -0.7640748             -20.7915
       ...           ...                  ...                  ...
         4        2.0000           -0.6226855             -16.9441
         5        2.0000           -0.6077800             -16.5385
         6        2.0000           -0.5878619             -15.9965
         7        2.0000           -0.4945576             -13.4576
         8        2.0000           -0.4870126             -13.2523
         9        1.0000           -0.4571475             -12.4396
        10        1.0000           -0.4338766             -11.8064 (HOMO)
        11                          0.0650338               1.7697 (LUMO)
        12                          0.0784547               2.1349
        13                          0.1920597               5.2262
        14                          0.3051160               8.3026
      -------------------------------------------------------------
                  HL-Gap            0.4989103 Eh           13.5760 eV
             Fermi-level           -0.3282506 Eh           -8.9322 eV

 transition dipole moment (au) for excitation:           9          10
     X       Y       Z   
   0.0000   0.0000   0.0000  total (au/Debye):    0.000   0.000
 dE (eV)             :    0.633
 oscillator strength :  0.20580E-12

 SCC (total)                   0 d,  0 h,  0 min,  0.002 sec
 SCC setup                      ...        0 min,  0.000 sec (  1.809%)
 Dispersion                     ...        0 min,  0.000 sec (  0.396%)
 integral evaluation            ...        0 min,  0.001 sec ( 27.739%)
 zeroth order Hamiltonian       ...        0 min,  0.000 sec (  0.384%)
 iterations                     ...        0 min,  0.000 sec (  8.493%)
 molecular gradient             ...        0 min,  0.001 sec ( 29.775%)
 printout                       ...        0 min,  0.001 sec ( 31.166%)

         :::::::::::::::::::::::::::::::::::::::::::::::::::::
         ::                     SUMMARY                     ::
         :::::::::::::::::::::::::::::::::::::::::::::::::::::
         :: total energy             -11.089675707735 Eh    ::
         :: gradient norm              0.000311592674 Eh/a0 ::
         :: HOMO-LUMO gap             13.576040691740 eV    ::
         ::.................................................::
         :: SCC energy               -11.147175145522 Eh    ::
         :: -> isotropic ES            0.039856203606 Eh    ::
         :: -> anisotropic ES          0.000431212550 Eh    ::
         :: -> anisotropic XC         -0.003770266971 Eh    ::
         :: -> dispersion             -0.001132941534 Eh    ::
         :: repulsion energy           0.057499412734 Eh    ::
         :: add. restraining           0.000000000000 Eh    ::
         :::::::::::::::::::::::::::::::::::::::::::::::::::::

           ------------------------------------------------- 
          |                Numerical Hessian                |
           ------------------------------------------------- 
step length          :   0.00500
SCC accuracy         :   0.30000
Hessian scale factor :   1.00000
frozen atoms in %    :   0.00000    0
RMS gradient         :   0.00031
estimated CPU  time      0.00 min
estimated wall time      0.00 min

writing file <hessian>.

 projected vibrational frequencies (cm-1)
eigval :       -0.00    -0.00    -0.00     0.00     0.00     0.00
eigval :      515.47   734.35  1013.08  1155.20  1180.39  1212.29
eigval :     1285.74  2356.88  2487.78
           -------------------------------------------------
          |                Property Printout                |
           -------------------------------------------------

    * Orbital Energies and Occupations

         #    Occupation            Energy/Eh            Energy/eV
      -------------------------------------------------------------
         1        2.0000           -0.7640748             -20.7915
         2        2.0000           -0.7328757             -19.9426
         3        2.0000           -0.6674466             -18.1621
         4        2.0000           -0.6226855             -16.9441
         5        2.0000           -0.6077799             -16.5385
         6        2.0000           -0.5878619             -15.9965
         7        2.0000           -0.4945576             -13.4576
         8        2.0000           -0.4870126             -13.2523
         9        1.0000           -0.4571475             -12.4396
        10        1.0000           -0.4338766             -11.8064 (HOMO)
        11                          0.0650337               1.7697 (LUMO)
        12                          0.0784547               2.1349
        13                          0.1920597               5.2262
        14                          0.3051160               8.3026
      -------------------------------------------------------------
Molecule has the following symmetry elements: (C2) 2*(sigma) 
It seems to be the C2v point group
                  HL-Gap            0.4989103 Eh           13.5760 eV
             Fermi-level           -0.3282506 Eh           -8.9322 eV

     #   Z        covCN         q      C6AA      α(0)
     1   6 C      3.541     0.277    17.267     6.089
     2   8 O      0.861    -0.280    19.417     5.908
     3   8 O      0.861    -0.280    19.417     5.908
     4   1 H      0.916     0.141     1.456     1.887
     5   1 H      0.916     0.141     1.456     1.887

 Mol. C6AA /au·bohr⁶  :        235.335874
 Mol. C8AA /au·bohr⁸  :       4923.019274
 Mol. α(0) /au        :         21.679588


Wiberg/Mayer (AO) data.
largest (>0.10) Wiberg bond orders for each atom
          total WBO             WBO to atom ...
     1  C   3.845        O    3 1.164    O    2 1.164    H    5 0.758    H    4 0.758
     2  O   1.491        C    1 1.164    O    3 0.302
     3  O   1.491        C    1 1.164    O    2 0.302
     4  H   0.808        C    1 0.758
     5  H   0.808        C    1 0.758

MOs/occ written to file <molden.input>


molecular dipole:
                 x           y           z       tot (Debye)
 q only:       -1.230       0.035      -0.026
   full:       -1.524       0.043      -0.033       3.875
molecular quadrupole (traceless):
                xx          xy          yy          xz          yz          zz
 q only:        0.095       0.048       2.092       0.060       0.385      -2.187
  q+dip:        0.047       0.090       3.757       0.102       0.680      -3.803
   full:       -0.198       0.090       3.421       0.082       0.598      -3.222

           -------------------------------------------------
          |                Geometry Summary                 |
           -------------------------------------------------

      molecular mass/u    :       46.0254272
   center of mass at/Å    :        0.4971140      -0.0140593       0.0106791
  moments of inertia/u·Å² :        0.1031973E+02   0.3594748E+02   0.4326156E+02
rotational constants/cm⁻¹ :        0.1633535E+01   0.4689517E+00   0.3896677E+00

 * 2 selected distances

     #   Z        #   Z                                     value/Å
     1   6 C      4   1 H                                 1.1370980 (max)
     1   6 C      5   1 H                                 1.1370976 (min)

 * 1 distinct bonds (by element types)

   Z      Z             #   av. dist./Å        max./Å        min./Å
   1 H    6 C           2     1.1370978     1.1370980     1.1370976

           -------------------------------------------------
          |               Frequency Printout                |
           -------------------------------------------------
 projected vibrational frequencies (cm-1)
eigval :       -0.00    -0.00    -0.00     0.00     0.00     0.00
eigval :      515.47   734.35  1013.08  1155.20  1180.39  1212.29
eigval :     1285.74  2356.88  2487.78
 reduced masses (amu)
   1: 13.55   2: 14.47   3: 15.35   4: 13.99   5:  8.67   6: 14.78   7: 14.97   8:  6.10
   9:  1.63  10:  2.70  11:  6.60  12: 13.41  13:  8.81  14:  1.69  15:  1.35
 IR intensities (amu)
   1:  0.10   2:  0.24   3:  0.31   4:  0.36   5:  0.18   6:  0.18   7:  0.54   8:  0.02
   9:  0.00  10:  0.04  11:  0.33  12:  0.97  13:  0.70  14:  0.05  15:  0.16
 Raman intensities (amu)
   1:  0.00   2:  0.00   3:  0.00   4:  0.00   5:  0.00   6:  0.00   7:  0.00   8:  0.00
   9:  0.00  10:  0.00  11:  0.00  12:  0.00  13:  0.00  14:  0.00  15:  0.00
 output can be read by thermo (or use thermo option).
 writing <g98.out> molden fake output.
 recommended (thermochemical) frequency scaling factor: 1.0
           -------------------------------------------------
          |             Thermodynamic Functions             |
           -------------------------------------------------

c2v symmetry found (for desy threshold:  0.10E+00) used in thermo

          ...................................................
          :                      SETUP                      :
          :.................................................:
          :  # frequencies                           9      :
          :  # imaginary freq.                       0      :
          :  linear?                             false      :
          :  only rotor calc.                    false      :
          :  symmetry                              c2v      :
          :  rotational number                       2      :
          :  scaling factor                  1.0000000      :
          :  rotor cutoff                   50.0000000 cm⁻¹ :
          :  imag. cutoff                  -20.0000000 cm⁻¹ :
          :.................................................:

    mode    ω/cm⁻¹     T·S(HO)/kcal·mol⁻¹    T·S(FR)/kcal·mol⁻¹   T·S(vib)
   ------------------------------------------------------------------------
   ------------------------------------------------------------------------

   temp. (K)  partition function   enthalpy   heat capacity  entropy
                                   cal/mol     cal/K/mol   cal/K/mol   J/K/mol
 298.15  VIB   1.15                  259.605      3.155      1.141
         ROT  0.484E+04              888.752      2.981     19.842
         INT  0.554E+04             1148.358      6.136     20.982
         TR   0.302E+27             1481.254      4.968     37.388
         TOT                        2629.6116    11.1038    58.3702   244.2209

   temp. (K)  partition function   enthalpy   heat capacity  entropy
                                   cal/mol     cal/K/mol   cal/K/mol   J/K/mol
 120.00  VIB   1.00                    3.395      0.183      0.033
         ROT  0.124E+04              357.707      2.981     17.129
         INT  0.124E+04              361.102      3.164     17.161
         TR   0.771E+26              596.178      4.968     32.869
         TOT                         957.2799     8.1324    50.0301   209.3260

   temp. (K)  partition function   enthalpy   heat capacity  entropy
                                   cal/mol     cal/K/mol   cal/K/mol   J/K/mol
 100.00  VIB   1.00                    0.943      0.072      0.011
         ROT   940.                  298.089      2.981     16.585
         INT   940.                  299.032      3.053     16.596
         TR   0.587E+26              496.815      4.968     31.963
         TOT                         795.8467     8.0208    48.5592   203.1717

   temp. (K)  partition function   enthalpy   heat capacity  entropy
                                   cal/mol     cal/K/mol   cal/K/mol   J/K/mol
  80.00  VIB   1.00                    0.143      0.017      0.002
         ROT   673.                  238.471      2.981     15.920
         INT   673.                  238.614      2.998     15.922
         TR   0.420E+26              397.452      4.968     30.855
         TOT                         636.0659     7.9658    46.7772   195.7160

   temp. (K)  partition function   enthalpy   heat capacity  entropy
                                   cal/mol     cal/K/mol   cal/K/mol   J/K/mol
  60.00  VIB   1.00                    0.006      0.001      0.000
         ROT   437.                  178.853      2.981     15.062
         INT   437.                  178.860      2.982     15.063
         TR   0.273E+26              298.089      4.968     29.427
         TOT                         476.9488     7.9504    44.4892   186.1430

   temp. (K)  partition function   enthalpy   heat capacity  entropy
                                   cal/mol     cal/K/mol   cal/K/mol   J/K/mol
  40.00  VIB   1.00                    0.000      0.000     -0.000
         ROT   238.                  119.236      2.981     13.854
         INT   238.                  119.236      2.981     13.854
         TR   0.148E+26              198.726      4.968     27.413
         TOT                         317.9616     7.9490    41.2670   172.6612

   temp. (K)  partition function   enthalpy   heat capacity  entropy
                                   cal/mol     cal/K/mol   cal/K/mol   J/K/mol
  20.00  VIB   1.00                    0.000      0.000     -0.000
         ROT   84.1                   59.618      2.981     11.788
         INT   84.1                   59.618      2.981     11.787
         TR   0.525E+25               99.363      4.968     23.971
         TOT                         158.9808     7.9490    35.7587   149.6146

   temp. (K)  partition function   enthalpy   heat capacity  entropy
                                   cal/mol     cal/K/mol   cal/K/mol   J/K/mol
  10.00  VIB   1.00                    0.000      0.000     -0.000
         ROT   29.7                   29.809      2.981      9.721
         INT   29.7                   29.809      2.981      9.721
         TR   0.186E+25               49.681      4.968     20.529
         TOT                          79.4904     7.9490    30.2505   126.5680

       T/K    H(0)-H(T)+PV         H(T)/Eh          T*S/Eh         G(T)/Eh
   ------------------------------------------------------------------------
    298.15    0.419055E-02    0.313946E-01    0.277336E-01    0.366100E-02
    120.00    0.152552E-02    0.287295E-01    0.956737E-02    0.191622E-01
    100.00    0.126826E-02    0.284723E-01    0.773840E-02    0.207339E-01
     80.00    0.101364E-02    0.282176E-01    0.596354E-02    0.222541E-01
     60.00    0.760066E-03    0.279641E-01    0.425389E-02    0.237102E-01
     40.00    0.506704E-03    0.277107E-01    0.263053E-02    0.250802E-01
     20.00    0.253352E-03    0.274574E-01    0.113970E-02    0.263177E-01
     10.00    0.126676E-03    0.273307E-01    0.482072E-03    0.268486E-01 (used)
   ------------------------------------------------------------------------

         :::::::::::::::::::::::::::::::::::::::::::::::::::::
         ::                  THERMODYNAMIC                  ::
         :::::::::::::::::::::::::::::::::::::::::::::::::::::
         :: total free energy         -11.062827089866 Eh   ::
         ::.................................................::
         :: total energy              -11.089675707796 Eh   ::
         :: zero point energy           0.027204014073 Eh   ::
         :: G(RRHO) w/o ZPVE           -0.000355396143 Eh   ::
         :: G(RRHO) contrib.            0.026848617930 Eh   ::
         :::::::::::::::::::::::::::::::::::::::::::::::::::::

optimized geometry written to: xtbopt.xyz


           -------------------------------------------------
          | TOTAL ENERGY              -11.089675707796 Eh   |
          | TOTAL ENTHALPY            -11.062345017707 Eh   |
          | TOTAL FREE ENERGY         -11.062827089866 Eh   |
          | GRADIENT NORM               0.000311586539 Eh/α |
          | HOMO-LUMO GAP              13.576040240457 eV   |
           -------------------------------------------------

------------------------------------------------------------------------
 * finished run on 2020/05/12 at 11:43:53.441     
------------------------------------------------------------------------
 total:
 * wall-time:     0 d,  0 h,  0 min,  0.091 sec
 *  cpu-time:     0 d,  0 h,  0 min,  0.090 sec
 * ratio c/w:     0.998 speedup
 SCF:
 * wall-time:     0 d,  0 h,  0 min,  0.003 sec
 *  cpu-time:     0 d,  0 h,  0 min,  0.003 sec
 * ratio c/w:     0.986 speedup
 ANC optimizer:
 * wall-time:     0 d,  0 h,  0 min,  0.025 sec
 *  cpu-time:     0 d,  0 h,  0 min,  0.025 sec
 * ratio c/w:     0.998 speedup
 numerical hessian:
 * wall-time:     0 d,  0 h,  0 min,  0.049 sec
 *  cpu-time:     0 d,  0 h,  0 min,  0.049 sec
 * ratio c/w:     0.998 speedup

